src/Tensile/data/Configs/miopen/archives/transformer/2020-09-01/exact/vega20_Cijk_Ailk_Bjlk_HBH.yaml
- {MinimumRequiredVersion: 4.22.0}
- vega20
- gfx906
- [Device 66a0, Device 66a1, Device 66a7, Device 66af, Vega 20]
    SolutionIndex: 0
    SolutionNameMin: Cijk_Ailk_Bjlk_HBH_MT64x64x8_SE_GRVW2_LRVW2_TT4_4_VW2_WG16_16_1_WGM1
    SolutionIndex: 1
    SolutionNameMin: Cijk_Ailk_Bjlk_HBH_MT64x64x8_SE_GRVW2_LRVW2_TT4_4_VW2_WG16_16_1_WGM8
    SolutionIndex: 2
    SolutionNameMin: Cijk_Ailk_Bjlk_HBH_MT64x64x16_SE_GRVW2_LRVW2_TT4_4_VW2_WG16_16_1_WGM1
    SolutionIndex: 3
    SolutionNameMin: Cijk_Ailk_Bjlk_HBH_MT64x64x16_SE_GRVW2_LRVW2_TT4_4_VW2_WG16_16_1_WGM8
    SolutionIndex: 4
    SolutionNameMin: Cijk_Ailk_Bjlk_HBH_MT64x64x16_SE_GRVW4_LRVW4_TT4_4_VW4_WG16_16_1_WGM1
    SolutionIndex: 5
    SolutionNameMin: Cijk_Ailk_Bjlk_HBH_MT64x64x16_SE_GRVW4_LRVW4_TT4_4_VW4_WG16_16_1_WGM8
    SolutionIndex: 6
    SolutionNameMin: Cijk_Ailk_Bjlk_HBH_MT64x64x32_SE_GRVW4_LRVW4_TT4_4_VW4_WG16_16_1_WGM8
    SolutionIndex: 7
    SolutionNameMin: Cijk_Ailk_Bjlk_HBH_MT128x64x16_SE_GRVW4_LRVW4_TT8_4_VW4_WG16_16_1_WGM1
    SolutionIndex: 8
    SolutionNameMin: Cijk_Ailk_Bjlk_HBH_MT128x64x16_SE_GRVW4_LRVW4_TT8_4_VW4_WG16_16_1_WGM8
    SolutionIndex: 9
    SolutionNameMin: Cijk_Ailk_Bjlk_HBH_MT64x128x8_SE_GRVW2_LRVW2_TT4_8_VW2_WG16_16_1_WGM1
    SolutionIndex: 10
    SolutionNameMin: Cijk_Ailk_Bjlk_HBH_MT64x128x8_SE_GRVW2_LRVW2_TT4_8_VW2_WG16_16_1_WGM8
    SolutionIndex: 11
    SolutionNameMin: Cijk_Ailk_Bjlk_HBH_MT64x128x16_SE_GRVW2_LRVW2_TT4_8_VW2_WG16_16_1_WGM1
    SolutionIndex: 12
    SolutionNameMin: Cijk_Ailk_Bjlk_HBH_MT64x128x8_SE_GRVW4_LRVW4_TT4_8_VW4_WG16_16_1_WGM1
    SolutionIndex: 13
    SolutionNameMin: Cijk_Ailk_Bjlk_HBH_MT64x128x8_SE_GRVW4_LRVW4_TT4_8_VW4_WG16_16_1_WGM8
    SolutionIndex: 14
    SolutionNameMin: Cijk_Ailk_Bjlk_HBH_MT64x128x16_SE_GRVW4_LRVW4_TT4_8_VW4_WG16_16_1_WGM8
    SolutionIndex: 15
    SolutionNameMin: Cijk_Ailk_Bjlk_HBH_MT96x64x8_SE_GRVW2_LRVW2_TT6_4_VW2_WG16_16_1_WGM1
    SolutionIndex: 16
    SolutionNameMin: Cijk_Ailk_Bjlk_HBH_MT96x64x8_SE_GRVW2_LRVW2_TT6_4_VW2_WG16_16_1_WGM8
    SolutionIndex: 17
    SolutionNameMin: Cijk_Ailk_Bjlk_HBH_MT64x96x8_SE_GRVW2_LRVW2_TT4_6_VW2_WG16_16_1_WGM1
    SolutionIndex: 18
    SolutionNameMin: Cijk_Ailk_Bjlk_HBH_MT64x96x8_SE_GRVW2_LRVW2_TT4_6_VW2_WG16_16_1_WGM8
    SolutionIndex: 19
    SolutionNameMin: Cijk_Ailk_Bjlk_HBH_MT64x96x24_SE_GRVW2_LRVW2_TT4_6_VW2_WG16_16_1_WGM8
    SolutionIndex: 20
    SolutionNameMin: Cijk_Ailk_Bjlk_HBH_MT64x64x8_SE_GRVW2_LRVW2_TT4_8_VW2_WG16_8_1_WGM1
    SolutionIndex: 21
    SolutionNameMin: Cijk_Ailk_Bjlk_HBH_MT64x64x8_SE_GRVW2_LRVW2_TT4_8_VW2_WG16_8_1_WGM8
    SolutionIndex: 22
    SolutionNameMin: Cijk_Ailk_Bjlk_HBH_MT64x64x8_SE_GRVW4_LRVW4_TT4_8_VW4_WG16_8_1_WGM8
    SolutionIndex: 23
    SolutionNameMin: Cijk_Ailk_Bjlk_HBH_MT96x32x8_SE_GRVW2_LRVW2_TT6_4_VW2_WG16_8_1_WGM1
    SolutionIndex: 24
    SolutionNameMin: Cijk_Ailk_Bjlk_HBH_MT96x32x8_SE_GRVW2_LRVW2_TT6_4_VW2_WG16_8_1_WGM8
    SolutionIndex: 25
    SolutionNameMin: Cijk_Ailk_Bjlk_HBH_MT32x64x8_SE_GRVW2_LRVW2_TT4_4_VW2_WG8_16_1_WGM8
    SolutionIndex: 26
    SolutionNameMin: Cijk_Ailk_Bjlk_HBH_MT32x64x8_SE_GRVW4_LRVW4_TT4_4_VW4_WG8_16_1_WGM8
    SolutionIndex: 27
    SolutionNameMin: Cijk_Ailk_Bjlk_HBH_MT64x64x8_SE_GRVW2_LRVW2_TT8_4_VW2_WG8_16_1_WGM1
    SolutionIndex: 28
    SolutionNameMin: Cijk_Ailk_Bjlk_HBH_MT64x64x8_SE_GRVW2_LRVW2_TT8_4_VW2_WG8_16_1_WGM8
    SolutionIndex: 29
    SolutionNameMin: Cijk_Ailk_Bjlk_HBH_MT64x64x16_SE_GRVW2_LRVW2_TT8_4_VW2_WG8_16_1_WGM8
    SolutionIndex: 30
    SolutionNameMin: Cijk_Ailk_Bjlk_HBH_MT64x64x8_SE_GRVW4_LRVW4_TT8_4_VW4_WG8_16_1_WGM1
    SolutionIndex: 31
    SolutionNameMin: Cijk_Ailk_Bjlk_HBH_MT64x64x8_SE_GRVW4_LRVW4_TT8_4_VW4_WG8_16_1_WGM8
    SolutionIndex: 32
    SolutionNameMin: Cijk_Ailk_Bjlk_HBH_MT64x64x16_SE_GRVW4_LRVW4_TT8_4_VW4_WG8_16_1_WGM1
    SolutionIndex: 33
    SolutionNameMin: Cijk_Ailk_Bjlk_HBH_MT64x64x16_SE_GRVW4_LRVW4_TT8_4_VW4_WG8_16_1_WGM8
    SolutionIndex: 34
    SolutionNameMin: Cijk_Ailk_Bjlk_HBH_MT32x128x8_SE_GRVW4_LRVW4_TT4_8_VW4_WG8_16_1_WGM1
    SolutionIndex: 35
    SolutionNameMin: Cijk_Ailk_Bjlk_HBH_MT32x128x8_SE_GRVW4_LRVW4_TT4_8_VW4_WG8_16_1_WGM8
    SolutionIndex: 36
    SolutionNameMin: Cijk_Ailk_Bjlk_HBH_MT48x64x8_SE_GRVW2_LRVW2_TT6_4_VW2_WG8_16_1_WGM1
    SolutionIndex: 37
    SolutionNameMin: Cijk_Ailk_Bjlk_HBH_MT48x64x8_SE_GRVW2_LRVW2_TT6_4_VW2_WG8_16_1_WGM8
    SolutionIndex: 38
    SolutionNameMin: Cijk_Ailk_Bjlk_HBH_MT48x64x16_SE_GRVW2_LRVW2_TT6_4_VW2_WG8_16_1_WGM8
    SolutionIndex: 39
    SolutionNameMin: Cijk_Ailk_Bjlk_HBH_MT32x96x8_SE_GRVW2_LRVW2_TT4_6_VW2_WG8_16_1_WGM1
    SolutionIndex: 40
    SolutionNameMin: Cijk_Ailk_Bjlk_HBH_MT32x96x8_SE_GRVW2_LRVW2_TT4_6_VW2_WG8_16_1_WGM8
    SolutionIndex: 41
    SolutionNameMin: Cijk_Ailk_Bjlk_HBH_MT32x64x8_SE_GRVW2_LRVW2_TT8_4_VW2_WG4_16_1_WGM1
    SolutionIndex: 42
    SolutionNameMin: Cijk_Ailk_Bjlk_HBH_MT32x64x8_SE_GRVW4_LRVW4_TT8_4_VW4_WG4_16_1_WGM1
    SolutionIndex: 43
    SolutionNameMin: Cijk_Ailk_Bjlk_HBH_MT32x64x8_SE_GRVW4_LRVW4_TT8_4_VW4_WG4_16_1_WGM8
    SolutionIndex: 44
    SolutionNameMin: Cijk_Ailk_Bjlk_HBH_MT24x64x8_SE_GRVW2_LRVW2_TT6_4_VW2_WG4_16_1_WGM8
    SolutionIndex: 45
    SolutionNameMin: Cijk_Ailk_Bjlk_HBH_MT64x32x8_SE_GRVW2_LRVW2_TT4_8_VW2_WG16_4_1_WGM1
    SolutionIndex: 46
    SolutionNameMin: Cijk_Ailk_Bjlk_HBH_MT64x32x8_SE_GRVW2_LRVW2_TT4_8_VW2_WG16_4_1_WGM8
    SolutionIndex: 47
    SolutionNameMin: Cijk_Ailk_Bjlk_HBH_MT64x32x8_SE_GRVW4_LRVW4_TT4_8_VW4_WG16_4_1_WGM1
    SolutionIndex: 48
    SolutionNameMin: Cijk_Ailk_Bjlk_HBH_MT64x32x8_SE_GRVW4_LRVW4_TT4_8_VW4_WG16_4_1_WGM8
    SolutionIndex: 49
    SolutionNameMin: Cijk_Ailk_Bjlk_HBH_MT64x24x8_SE_GRVW2_LRVW2_TT4_6_VW2_WG16_4_1_WGM1
    SolutionIndex: 50
    SolutionNameMin: Cijk_Ailk_Bjlk_HBH_MT64x24x8_SE_GRVW2_LRVW2_TT4_6_VW2_WG16_4_1_WGM8
    SolutionIndex: 51
    SolutionNameMin: Cijk_Ailk_Bjlk_HBH_MT32x32x8_SE_GRVW2_LRVW2_TT4_4_VW2_WG8_8_1_WGM1
    SolutionIndex: 52
    SolutionNameMin: Cijk_Ailk_Bjlk_HBH_MT64x32x8_SE_GRVW2_LRVW2_TT8_4_VW2_WG8_8_1_WGM1
    SolutionIndex: 53
    SolutionNameMin: Cijk_Ailk_Bjlk_HBH_MT64x32x8_SE_GRVW2_LRVW2_TT8_4_VW2_WG8_8_1_WGM8
    SolutionIndex: 54
    SolutionNameMin: Cijk_Ailk_Bjlk_HBH_MT64x32x8_SE_GRVW4_LRVW4_TT8_4_VW4_WG8_8_1_WGM1
    SolutionIndex: 55
    SolutionNameMin: Cijk_Ailk_Bjlk_HBH_MT64x32x8_SE_GRVW4_LRVW4_TT8_4_VW4_WG8_8_1_WGM8
    SolutionIndex: 56
    SolutionNameMin: Cijk_Ailk_Bjlk_HBH_MT32x64x8_SE_GRVW4_LRVW4_TT4_8_VW4_WG8_8_1_WGM1
    SolutionIndex: 57
    SolutionNameMin: Cijk_Ailk_Bjlk_HBH_MT32x64x8_SE_GRVW4_LRVW4_TT4_8_VW4_WG8_8_1_WGM8
- - - [4096, 1024, 1, 2912, 4096, 4096, 4096, 1024]
    - [4, 12047.1]
  - - [4096, 1024, 1, 7392, 4096, 4096, 4096, 1024]
    - [5, 12078.2]
  - - [1024, 33712, 1, 7480, 1024, 1024, 1024, 33712]
    - [0, 13007.9]
  - - [1024, 33712, 1, 7424, 1024, 1024, 1024, 33712]
    - [0, 12963.8]
  - - [1024, 1024, 1, 9040, 1024, 1024, 1024, 1024]
    - [15, 10402.9]
  - - [1024, 4096, 1, 7904, 1024, 1024, 1024, 4096]
    - [32, 11693.6]
  - - [1024, 4096, 1, 8352, 1024, 1024, 1024, 4096]
    - [1, 11822.3]
  - - [1024, 4096, 1, 6480, 1024, 1024, 1024, 4096]
    - [0, 11660.8]
  - - [1024, 33712, 1, 8320, 1024, 1024, 1024, 33712]
    - [4, 12071.8]
  - - [1024, 1024, 1, 9512, 1024, 1024, 1024, 1024]
    - [15, 10414.8]
  - - [4096, 1024, 1, 3120, 4096, 4096, 4096, 1024]
    - [15, 10938.0]
  - - [4096, 1024, 1, 7296, 4096, 4096, 4096, 1024]
    - [46, 11161.9]
  - - [4096, 1024, 1, 5888, 4096, 4096, 4096, 1024]
    - [2, 11054.2]
  - - [1024, 4096, 1, 6976, 1024, 1024, 1024, 4096]
    - [55, 11481.1]
  - - [1024, 33712, 1, 9184, 1024, 1024, 1024, 33712]
    - [54, 11595.9]
  - - [1024, 4096, 1, 1344, 1024, 1024, 1024, 4096]
    - [5, 11920.9]
  - - [1024, 4096, 1, 7872, 1024, 1024, 1024, 4096]
    - [54, 11322.2]
  - - [4096, 1024, 1, 9960, 4096, 4096, 4096, 1024]
    - [1, 11127.7]
  - - [1024, 4096, 1, 3240, 1024, 1024, 1024, 4096]
    - [45, 11211.7]
  - - [1024, 4096, 1, 8680, 1024, 1024, 1024, 4096]
    - [45, 11308.9]
  - - [1024, 33712, 1, 3240, 1024, 1024, 1024, 33712]
    - [0, 12241.1]
  - - [1024, 4096, 1, 6600, 1024, 1024, 1024, 4096]
    - [45, 11258.1]
  - - [1024, 4096, 1, 5984, 1024, 1024, 1024, 4096]
    - [52, 11248.1]
  - - [4096, 1024, 1, 9112, 4096, 4096, 4096, 1024]
    - [0, 11747.4]
  - - [1024, 1024, 1, 8288, 1024, 1024, 1024, 1024]
    - [15, 9702.77]
  - - [1024, 1024, 1, 9744, 1024, 1024, 1024, 1024]
    - [15, 10412.2]
  - - [4096, 1024, 1, 9976, 4096, 4096, 4096, 1024]
    - [17, 11628.3]
  - - [1024, 1024, 1, 7200, 1024, 1024, 1024, 1024]
    - [37, 9707.01]
  - - [1024, 4096, 1, 10000, 1024, 1024, 1024, 4096]
    - [22, 11084.3]
  - - [1024, 1024, 1, 9520, 1024, 1024, 1024, 1024]
    - [3, 9750.74]
  - - [1024, 1024, 1, 9792, 1024, 1024, 1024, 1024]
    - [15, 9704.02]
  - - [1024, 33712, 1, 8528, 1024, 1024, 1024, 33712]
    - [45, 11864.8]
  - - [1024, 33712, 1, 8616, 1024, 1024, 1024, 33712]
    - [0, 11950.1]
  - - [1024, 4096, 1, 8760, 1024, 1024, 1024, 4096]
    - [1, 11861.1]
  - - [1024, 33712, 1, 8296, 1024, 1024, 1024, 33712]
    - [45, 11883.5]
  - - [1024, 33712, 1, 9760, 1024, 1024, 1024, 33712]
    - [20, 11444.3]
  - - [4096, 1024, 1, 7208, 4096, 4096, 4096, 1024]
    - [3, 11927.7]
  - - [1024, 4096, 1, 6688, 1024, 1024, 1024, 4096]
    - [55, 11403.4]
  - - [1024, 1024, 1, 6400, 1024, 1024, 1024, 1024]
    - [44, 10107.9]
  - - [1024, 4096, 1, 9088, 1024, 1024, 1024, 4096]
    - [47, 11167.7]
  - - [4096, 1024, 1, 8648, 4096, 4096, 4096, 1024]
    - [0, 11610.2]
  - - [1024, 1024, 1, 3000, 1024, 1024, 1024, 1024]
    - [18, 10261.3]
  - - [4096, 1024, 1, 10152, 4096, 4096, 4096, 1024]
    - [35, 11096.7]
  - - [1024, 33712, 1, 5760, 1024, 1024, 1024, 33712]
    - [27, 12201.9]
  - - [1024, 1024, 1, 9696, 1024, 1024, 1024, 1024]
    - [37, 10116.8]
  - - [1024, 4096, 1, 5888, 1024, 1024, 1024, 4096]
    - [52, 11277.9]
  - - [4096, 1024, 1, 9696, 4096, 4096, 4096, 1024]
    - [0, 11447.5]
  - - [4096, 1024, 1, 9240, 4096, 4096, 4096, 1024]
    - [0, 11119.9]
  - - [1024, 1024, 1, 9952, 1024, 1024, 1024, 1024]
    - [15, 9712.04]
  - - [4096, 1024, 1, 8320, 4096, 4096, 4096, 1024]
    - [55, 10860.6]
  - - [4096, 1024, 1, 9632, 4096, 4096, 4096, 1024]
    - [0, 11628.8]
  - - [1024, 4096, 1, 7200, 1024, 1024, 1024, 4096]
    - [27, 11389.3]
  - - [4096, 1024, 1, 8576, 4096, 4096, 4096, 1024]
    - [0, 11473.6]
  - - [1024, 1024, 1, 7640, 1024, 1024, 1024, 1024]
    - [2, 9812.71]
  - - [1024, 4096, 1, 6624, 1024, 1024, 1024, 4096]
    - [28, 11265.7]
  - - [1024, 33712, 1, 7040, 1024, 1024, 1024, 33712]
    - [45, 12044.9]
  - - [1024, 1024, 1, 800, 1024, 1024, 1024, 1024]
    - [18, 9763.28]
  - - [1024, 4096, 1, 9440, 1024, 1024, 1024, 4096]
    - [23, 11542.7]
  - - [4096, 1024, 1, 9440, 4096, 4096, 4096, 1024]
    - [0, 11337.2]
  - - [1024, 33712, 1, 4864, 1024, 1024, 1024, 33712]
    - [45, 12070.8]
  - - [1024, 33712, 1, 9440, 1024, 1024, 1024, 33712]
    - [42, 11427.2]
  - - [1024, 1024, 1, 6048, 1024, 1024, 1024, 1024]
    - [15, 10382.7]
  - - [4096, 1024, 1, 9288, 4096, 4096, 4096, 1024]
    - [23, 10928.4]
  - - [1024, 4096, 1, 8480, 1024, 1024, 1024, 4096]
    - [54, 11394.0]
  - - [1024, 1024, 1, 8856, 1024, 1024, 1024, 1024]
    - [44, 10058.7]
  - - [1024, 1024, 1, 8816, 1024, 1024, 1024, 1024]
    - [15, 9704.6]
  - - [1024, 33712, 1, 9648, 1024, 1024, 1024, 33712]
    - [20, 11410.1]
  - - [4096, 1024, 1, 1232, 4096, 4096, 4096, 1024]
    - [5, 11926.2]
  - - [4096, 1024, 1, 2720, 4096, 4096, 4096, 1024]
    - [15, 10933.5]
  - - [1024, 1024, 1, 9152, 1024, 1024, 1024, 1024]
    - [15, 9705.24]
  - - [1024, 1024, 1, 1856, 1024, 1024, 1024, 1024]
    - [15, 10178.6]
  - - [4096, 1024, 1, 5640, 4096, 4096, 4096, 1024]
    - [0, 11920.4]
  - - [4096, 1024, 1, 3040, 4096, 4096, 4096, 1024]
    - [15, 10942.1]
  - - [1024, 1024, 1, 5328, 1024, 1024, 1024, 1024]
    - [37, 10356.7]
  - - [4096, 1024, 1, 9168, 4096, 4096, 4096, 1024]
    - [36, 11079.1]
  - - [1024, 1024, 1, 9640, 1024, 1024, 1024, 1024]
    - [24, 10335.6]
  - - [1024, 33712, 1, 5400, 1024, 1024, 1024, 33712]
    - [45, 12122.5]
  - - [1024, 1024, 1, 8944, 1024, 1024, 1024, 1024]
    - [5, 10023.1]
  - - [1024, 1024, 1, 5784, 1024, 1024, 1024, 1024]
    - [15, 10378.1]
  - - [1024, 33712, 1, 8640, 1024, 1024, 1024, 33712]
    - [45, 11771.0]
  - - [1024, 4096, 1, 6912, 1024, 1024, 1024, 4096]
    - [1, 11866.0]
  - - [1024, 1024, 1, 8208, 1024, 1024, 1024, 1024]
    - [2, 9777.66]
  - - [1024, 4096, 1, 5760, 1024, 1024, 1024, 4096]
    - [52, 10763.4]
  - - [1024, 4096, 1, 8664, 1024, 1024, 1024, 4096]
    - [0, 11487.9]
  - - [1024, 1024, 1, 2400, 1024, 1024, 1024, 1024]
    - [5, 9885.99]
  - - [1024, 4096, 1, 2400, 1024, 1024, 1024, 4096]
    - [0, 11533.3]
  - - [1024, 33712, 1, 2400, 1024, 1024, 1024, 33712]
    - [0, 12080.0]
  - - [1024, 4096, 1, 9344, 1024, 1024, 1024, 4096]
    - [0, 11682.2]
  - - [1024, 1024, 1, 9312, 1024, 1024, 1024, 1024]
    - [37, 10313.8]
  - - [4096, 1024, 1, 9408, 4096, 4096, 4096, 1024]
    - [12, 11711.9]
  - - [1024, 1024, 1, 7296, 1024, 1024, 1024, 1024]
    - [15, 9697.78]
  - - [1024, 4096, 1, 4216, 1024, 1024, 1024, 4096]
    - [23, 10996.4]
  - - [1024, 33712, 1, 9408, 1024, 1024, 1024, 33712]
    - [20, 11564.9]
  - - [1024, 4096, 1, 9760, 1024, 1024, 1024, 4096]
    - [1, 11858.4]
  - - [1024, 4096, 1, 9512, 1024, 1024, 1024, 4096]
    - [0, 11568.6]
  - - [4096, 1024, 1, 5400, 4096, 4096, 4096, 1024]
    - [0, 11823.5]
  - - [1024, 33712, 1, 3120, 1024, 1024, 1024, 33712]
    - [49, 11800.4]
  - - [1024, 4096, 1, 7480, 1024, 1024, 1024, 4096]
    - [54, 11475.6]
  - - [1024, 1024, 1, 3600, 1024, 1024, 1024, 1024]
    - [15, 10311.6]
  - - [1024, 4096, 1, 800, 1024, 1024, 1024, 4096]
    - [39, 11205.7]
  - - [1024, 1024, 1, 3240, 1024, 1024, 1024, 1024]
    - [15, 10300.1]
  - - [1024, 4096, 1, 9288, 1024, 1024, 1024, 4096]
    - [23, 11055.1]
  - - [1024, 1024, 1, 3024, 1024, 1024, 1024, 1024]
    - [5, 9909.01]
  - - [1024, 1024, 1, 9752, 1024, 1024, 1024, 1024]
    - [16, 10379.3]
  - - [1024, 1024, 1, 8064, 1024, 1024, 1024, 1024]
    - [44, 10246.8]
  - - [4096, 1024, 1, 4048, 4096, 4096, 4096, 1024]
    - [26, 11031.9]
  - - [1024, 4096, 1, 7840, 1024, 1024, 1024, 4096]
    - [47, 11465.9]
  - - [1024, 33712, 1, 8928, 1024, 1024, 1024, 33712]
    - [20, 11666.8]
  - - [1024, 33712, 1, 8064, 1024, 1024, 1024, 33712]
    - [0, 12338.4]
  - - [1024, 1024, 1, 3344, 1024, 1024, 1024, 1024]
    - [4, 9927.6]
  - - [4096, 1024, 1, 6400, 4096, 4096, 4096, 1024]
    - [48, 10887.5]
  - - [4096, 1024, 1, 7872, 4096, 4096, 4096, 1024]
    - [55, 11243.9]
  - - [1024, 4096, 1, 4032, 1024, 1024, 1024, 4096]
    - [52, 11168.8]
  - - [1024, 1024, 1, 5984, 1024, 1024, 1024, 1024]
    - [15, 10376.1]
  - - [4096, 1024, 1, 4032, 4096, 4096, 4096, 1024]
    - [41, 11089.1]
  - - [1024, 4096, 1, 6400, 1024, 1024, 1024, 4096]
    - [15, 10943.3]
  - - [1024, 33712, 1, 6272, 1024, 1024, 1024, 33712]
    - [12, 12351.8]
  - - [1024, 4096, 1, 8432, 1024, 1024, 1024, 4096]
    - [1, 11833.9]
  - - [1024, 1024, 1, 5304, 1024, 1024, 1024, 1024]
    - [15, 10371.5]
  - - [1024, 1024, 1, 8832, 1024, 1024, 1024, 1024]
    - [37, 10378.6]
  - - [1024, 1024, 1, 4488, 1024, 1024, 1024, 1024]
    - [15, 10349.2]
  - - [4096, 1024, 1, 9520, 4096, 4096, 4096, 1024]
    - [8, 11043.7]
  - - [1024, 1024, 1, 2176, 1024, 1024, 1024, 1024]
    - [15, 10211.7]
  - - [4096, 1024, 1, 6480, 4096, 4096, 4096, 1024]
    - [46, 11285.5]
  - - [4096, 1024, 1, 4968, 4096, 4096, 4096, 1024]
    - [8, 10985.5]
  - - [1024, 4096, 1, 4560, 1024, 1024, 1024, 4096]
    - [7, 11027.9]
  - - [1024, 4096, 1, 8880, 1024, 1024, 1024, 4096]
    - [0, 11303.2]
  - - [1024, 33712, 1, 8960, 1024, 1024, 1024, 33712]
    - [45, 11692.1]
  - - [1024, 1024, 1, 8968, 1024, 1024, 1024, 1024]
    - [5, 10031.1]
  - - [4096, 1024, 1, 8216, 4096, 4096, 4096, 1024]
    - [24, 10782.9]
  - - [1024, 4096, 1, 8968, 1024, 1024, 1024, 4096]
    - [0, 11688.5]
  - - [4096, 1024, 1, 8968, 4096, 4096, 4096, 1024]
    - [1, 11126.2]
  - - [1024, 4096, 1, 9520, 1024, 1024, 1024, 4096]
    - [8, 11039.8]
  - - [1024, 1024, 1, 5016, 1024, 1024, 1024, 1024]
    - [3, 9760.32]
  - - [1024, 1024, 1, 6816, 1024, 1024, 1024, 1024]
    - [15, 10402.7]
  - - [4096, 1024, 1, 9656, 4096, 4096, 4096, 1024]
    - [23, 11146.2]
  - - [1024, 1024, 1, 9272, 1024, 1024, 1024, 1024]
    - [37, 10357.9]
  - - [1024, 1024, 1, 6976, 1024, 1024, 1024, 1024]
    - [24, 10307.2]
  - - [1024, 33712, 1, 9384, 1024, 1024, 1024, 33712]
    - [45, 11488.7]
  - - [1024, 4096, 1, 9272, 1024, 1024, 1024, 4096]
    - [1, 11825.7]
  - - [1024, 1024, 1, 5280, 1024, 1024, 1024, 1024]
    - [3, 9778.98]
  - - [1024, 1024, 1, 6912, 1024, 1024, 1024, 1024]
    - [15, 9685.34]
  - - [1024, 1024, 1, 9168, 1024, 1024, 1024, 1024]
    - [15, 9701.8]
  - - [1024, 1024, 1, 5640, 1024, 1024, 1024, 1024]
    - [24, 10283.0]
  - - [4096, 1024, 1, 9384, 4096, 4096, 4096, 1024]
    - [23, 11028.0]
  - - [1024, 4096, 1, 9168, 1024, 1024, 1024, 4096]
    - [45, 11327.9]
  - - [1024, 1024, 1, 10224, 1024, 1024, 1024, 1024]
    - [37, 10407.6]
  - - [1024, 1024, 1, 9384, 1024, 1024, 1024, 1024]
    - [24, 10334.2]
  - - [1024, 1024, 1, 8528, 1024, 1024, 1024, 1024]
    - [15, 9899.73]
  - - [1024, 33712, 1, 8800, 1024, 1024, 1024, 33712]
    - [20, 12115.3]
  - - [1024, 1024, 1, 4704, 1024, 1024, 1024, 1024]
    - [5, 9970.26]
  - - [1024, 33712, 1, 9936, 1024, 1024, 1024, 33712]
    - [47, 11360.3]
  - - [4096, 1024, 1, 4704, 4096, 4096, 4096, 1024]
    - [3, 11902.7]
  - - [1024, 33712, 1, 4704, 1024, 1024, 1024, 33712]
    - [45, 12107.7]
  - - [1024, 1024, 1, 8352, 1024, 1024, 1024, 1024]
    - [16, 10368.5]
  - - [1024, 1024, 1, 7752, 1024, 1024, 1024, 1024]
    - [24, 10314.4]
  - - [1024, 4096, 1, 7224, 1024, 1024, 1024, 4096]
    - [48, 11441.4]
  - - [1024, 1024, 1, 3808, 1024, 1024, 1024, 1024]
    - [15, 10316.7]
  - - [1024, 33712, 1, 8000, 1024, 1024, 1024, 33712]
    - [5, 12042.0]
  - - [1024, 4096, 1, 8856, 1024, 1024, 1024, 4096]
    - [1, 11850.0]
  - - [1024, 1024, 1, 7168, 1024, 1024, 1024, 1024]
    - [44, 10132.9]
  - - [4096, 1024, 1, 2400, 4096, 4096, 4096, 1024]
    - [24, 10754.6]
  - - [1024, 1024, 1, 9632, 1024, 1024, 1024, 1024]
    - [37, 10384.8]
  - - [4096, 1024, 1, 9800, 4096, 4096, 4096, 1024]
    - [31, 11350.2]
  - - [1024, 4096, 1, 10040, 1024, 1024, 1024, 4096]
    - [31, 11368.5]
  - - [1024, 4096, 1, 8512, 1024, 1024, 1024, 4096]
    - [23, 11565.4]
  - - [1024, 1024, 1, 8512, 1024, 1024, 1024, 1024]
    - [2, 9824.6]
  - - [4096, 1024, 1, 7128, 4096, 4096, 4096, 1024]
    - [55, 11109.5]
  - - [1024, 4096, 1, 9672, 1024, 1024, 1024, 4096]
    - [23, 11563.1]
  - - [1024, 4096, 1, 3360, 1024, 1024, 1024, 4096]
    - [1, 11905.9]
  - - [1024, 33712, 1, 6624, 1024, 1024, 1024, 33712]
    - [17, 12189.0]
  - - [1024, 33712, 1, 10224, 1024, 1024, 1024, 33712]
    - [20, 11282.9]
  - - [1024, 4096, 1, 7168, 1024, 1024, 1024, 4096]
    - [1, 11884.8]
  - - [4096, 1024, 1, 6976, 4096, 4096, 4096, 1024]
    - [0, 11718.7]
  - - [1024, 4096, 1, 2176, 1024, 1024, 1024, 4096]
    - [29, 11051.5]
  - - [1024, 1024, 1, 7360, 1024, 1024, 1024, 1024]
    - [37, 10371.9]
  - - [4096, 1024, 1, 2176, 4096, 4096, 4096, 1024]
    - [45, 11458.9]
  - - [4096, 1024, 1, 9936, 4096, 4096, 4096, 1024]
    - [23, 11254.9]
  - - [1024, 33712, 1, 7800, 1024, 1024, 1024, 33712]
    - [45, 11979.8]
  - - [1024, 4096, 1, 9120, 1024, 1024, 1024, 4096]
    - [1, 11859.7]
  - - [1024, 4096, 1, 5600, 1024, 1024, 1024, 4096]
    - [0, 11565.0]
  - - [4096, 1024, 1, 1856, 4096, 4096, 4096, 1024]
    - [1, 11840.8]
  - - [1024, 4096, 1, 8232, 1024, 1024, 1024, 4096]
    - [54, 11408.1]
  - - [1024, 33712, 1, 8360, 1024, 1024, 1024, 33712]
    - [45, 11865.1]
  - - [1024, 33712, 1, 5600, 1024, 1024, 1024, 33712]
    - [0, 12760.0]
  - - [1024, 1024, 1, 8544, 1024, 1024, 1024, 1024]
    - [5, 9951.79]
  - - [1024, 4096, 1, 7696, 1024, 1024, 1024, 4096]
    - [54, 11415.8]
  - - [1024, 1024, 1, 6800, 1024, 1024, 1024, 1024]
    - [2, 9809.45]
  - - [4096, 1024, 1, 8232, 4096, 4096, 4096, 1024]
    - [35, 10833.7]
  - - [1024, 4096, 1, 9856, 1024, 1024, 1024, 4096]
    - [23, 11440.3]
  - - [1024, 4096, 1, 6936, 1024, 1024, 1024, 4096]
    - [0, 11619.2]
  - - [1024, 4096, 1, 8216, 1024, 1024, 1024, 4096]
    - [54, 11335.0]
  - - [4096, 1024, 1, 9672, 4096, 4096, 4096, 1024]
    - [0, 11127.2]
  - - [4096, 1024, 1, 9248, 4096, 4096, 4096, 1024]
    - [35, 11162.9]
  - - [1024, 33712, 1, 3864, 1024, 1024, 1024, 33712]
    - [56, 11971.4]
  - - [1024, 4096, 1, 9152, 1024, 1024, 1024, 4096]
    - [0, 11778.1]
  - - [1024, 4096, 1, 8096, 1024, 1024, 1024, 4096]
    - [47, 11418.3]
  - - [4096, 1024, 1, 8096, 4096, 4096, 4096, 1024]
    - [0, 11583.1]
  - - [1024, 4096, 1, 5280, 1024, 1024, 1024, 4096]
    - [1, 11662.6]
  - - [1024, 33712, 1, 8096, 1024, 1024, 1024, 33712]
    - [45, 11927.0]
  - - [1024, 33712, 1, 9656, 1024, 1024, 1024, 33712]
    - [56, 11426.4]
  - - [1024, 1024, 1, 6496, 1024, 1024, 1024, 1024]
    - [37, 10387.2]
  - - [4096, 1024, 1, 4920, 4096, 4096, 4096, 1024]
    - [35, 10733.1]
  - - [1024, 1024, 1, 6560, 1024, 1024, 1024, 1024]
    - [24, 9992.2]
  - - [4096, 1024, 1, 8832, 4096, 4096, 4096, 1024]
    - [23, 11316.5]
  - - [1024, 4096, 1, 9960, 1024, 1024, 1024, 4096]
    - [23, 11144.8]
  - - [1024, 33712, 1, 8600, 1024, 1024, 1024, 33712]
    - [45, 11809.8]
  - - [1024, 1024, 1, 6960, 1024, 1024, 1024, 1024]
    - [44, 10226.0]
  - - [1024, 1024, 1, 6072, 1024, 1024, 1024, 1024]
    - [15, 9679.72]
  - - [1024, 4096, 1, 6072, 1024, 1024, 1024, 4096]
    - [46, 11293.3]
  - - [1024, 4096, 1, 3808, 1024, 1024, 1024, 4096]
    - [0, 11583.9]
  - - [4096, 1024, 1, 6072, 4096, 4096, 4096, 1024]
    - [35, 11324.2]
  - - [1024, 33712, 1, 6072, 1024, 1024, 1024, 33712]
    - [45, 12166.6]
  - - [4096, 1024, 1, 8784, 4096, 4096, 4096, 1024]
    - [1, 11929.1]
  - - [1024, 4096, 1, 9072, 1024, 1024, 1024, 4096]
    - [0, 11527.1]
  - - [1024, 33712, 1, 8256, 1024, 1024, 1024, 33712]
    - [45, 11832.1]
  - - [1024, 4096, 1, 9040, 1024, 1024, 1024, 4096]
    - [1, 11848.3]
  - - [1024, 1024, 1, 5600, 1024, 1024, 1024, 1024]
    - [2, 9781.46]
  - - [1024, 33712, 1, 9072, 1024, 1024, 1024, 33712]
    - [20, 11543.5]
  - - [1024, 4096, 1, 4968, 1024, 1024, 1024, 4096]
    - [3, 11839.9]
  - - [4096, 1024, 1, 8120, 4096, 4096, 4096, 1024]
    - [0, 11495.7]
  - - [1024, 4096, 1, 8400, 1024, 1024, 1024, 4096]
    - [0, 11634.5]
  - - [1024, 4096, 1, 4600, 1024, 1024, 1024, 4096]
    - [1, 11080.2]
  - - [4096, 1024, 1, 8400, 4096, 4096, 4096, 1024]
    - [1, 11117.6]
  - - [4096, 1024, 1, 10032, 4096, 4096, 4096, 1024]
    - [0, 11601.0]
  - - [1024, 4096, 1, 7800, 1024, 1024, 1024, 4096]
    - [48, 11396.3]
  - - [1024, 4096, 1, 5680, 1024, 1024, 1024, 4096]
    - [0, 11597.3]
  - - [1024, 33712, 1, 6400, 1024, 1024, 1024, 33712]
    - [12, 12322.5]
  - - [1024, 1024, 1, 8960, 1024, 1024, 1024, 1024]
    - [37, 10366.3]
  - - [1024, 4096, 1, 8976, 1024, 1024, 1024, 4096]
    - [45, 11230.7]
  - - [1024, 33712, 1, 5824, 1024, 1024, 1024, 33712]
    - [27, 12341.8]
  - - [1024, 4096, 1, 5800, 1024, 1024, 1024, 4096]
    - [3, 11807.3]
  - - [1024, 1024, 1, 8496, 1024, 1024, 1024, 1024]
    - [1, 9763.14]
  - - [1024, 4096, 1, 4224, 1024, 1024, 1024, 4096]
    - [23, 11514.5]
  - - [1024, 4096, 1, 6800, 1024, 1024, 1024, 4096]
    - [27, 11339.9]
  - - [4096, 1024, 1, 6800, 4096, 4096, 4096, 1024]
    - [48, 11136.2]
  - - [4096, 1024, 1, 5440, 4096, 4096, 4096, 1024]
    - [27, 11409.4]
  - - [1024, 1024, 1, 4560, 1024, 1024, 1024, 1024]
    - [15, 9651.0]
  - - [1024, 1024, 1, 8200, 1024, 1024, 1024, 1024]
    - [15, 10405.5]
  - - [1024, 33712, 1, 5104, 1024, 1024, 1024, 33712]
    - [45, 12094.1]
  - - [4096, 1024, 1, 7448, 4096, 4096, 4096, 1024]
    - [46, 10860.2]
  - - [1024, 4096, 1, 8832, 1024, 1024, 1024, 4096]
    - [47, 11271.9]
  - - [1024, 1024, 1, 7384, 1024, 1024, 1024, 1024]
    - [3, 9795.88]
  - - [1024, 33712, 1, 10176, 1024, 1024, 1024, 33712]
    - [20, 11307.3]
  - - [1024, 4096, 1, 6864, 1024, 1024, 1024, 4096]
    - [1, 11892.6]
  - - [1024, 4096, 1, 5504, 1024, 1024, 1024, 4096]
    - [1, 11095.3]
  - - [4096, 1024, 1, 1344, 4096, 4096, 4096, 1024]
    - [1, 11801.1]
  - - [1024, 4096, 1, 8648, 1024, 1024, 1024, 4096]
    - [23, 11534.9]
  - - [4096, 1024, 1, 6864, 4096, 4096, 4096, 1024]
    - [0, 11709.2]
  - - [4096, 1024, 1, 9272, 4096, 4096, 4096, 1024]
    - [6, 11175.1]
  - - [1024, 1024, 1, 6864, 1024, 1024, 1024, 1024]
    - [15, 10393.7]
  - - [1024, 1024, 1, 7216, 1024, 1024, 1024, 1024]
    - [15, 9682.77]
  - - [1024, 33712, 1, 9504, 1024, 1024, 1024, 33712]
    - [20, 11543.2]
  - - [1024, 1024, 1, 7744, 1024, 1024, 1024, 1024]
    - [5, 10023.9]
  - - [4096, 1024, 1, 6160, 4096, 4096, 4096, 1024]
    - [46, 11439.9]
  - - [4096, 1024, 1, 7744, 4096, 4096, 4096, 1024]
    - [55, 11103.7]
  - - [1024, 4096, 1, 8704, 1024, 1024, 1024, 4096]
    - [47, 11414.5]
  - - [1024, 4096, 1, 8800, 1024, 1024, 1024, 4096]
    - [45, 11189.7]
  - - [1024, 33712, 1, 8184, 1024, 1024, 1024, 33712]
    - [45, 11873.3]
  - - [1024, 1024, 1, 9016, 1024, 1024, 1024, 1024]
    - [37, 10361.6]
  - - [4096, 1024, 1, 8840, 4096, 4096, 4096, 1024]
    - [23, 10897.7]
  - - [4096, 1024, 1, 9016, 4096, 4096, 4096, 1024]
    - [0, 11122.0]
  - - [1024, 33712, 1, 9016, 1024, 1024, 1024, 33712]
    - [20, 11667.3]
  - - [4096, 1024, 1, 5784, 4096, 4096, 4096, 1024]
    - [3, 11924.3]
  - - [4096, 1024, 1, 7840, 4096, 4096, 4096, 1024]
    - [48, 11113.1]
  - - [1024, 33712, 1, 9744, 1024, 1024, 1024, 33712]
    - [45, 11356.8]
  - - [1024, 4096, 1, 1984, 1024, 1024, 1024, 4096]
    - [5, 12007.2]
  - - [1024, 33712, 1, 9776, 1024, 1024, 1024, 33712]
    - [54, 11322.3]
  - - [1024, 33712, 1, 7072, 1024, 1024, 1024, 33712]
    - [0, 12593.7]
  - - [1024, 1024, 1, 5504, 1024, 1024, 1024, 1024]
    - [15, 10369.7]
  - - [1024, 1024, 1, 6936, 1024, 1024, 1024, 1024]
    - [23, 10282.9]
  - - [4096, 1024, 1, 9912, 4096, 4096, 4096, 1024]
    - [31, 11284.7]
  - - [1024, 4096, 1, 6512, 1024, 1024, 1024, 4096]
    - [27, 11357.8]
  - - [4096, 1024, 1, 9152, 4096, 4096, 4096, 1024]
    - [6, 11186.1]
  - - [1024, 4096, 1, 5824, 1024, 1024, 1024, 4096]
    - [1, 11097.4]
  - - [1024, 1024, 1, 5832, 1024, 1024, 1024, 1024]
    - [15, 10380.4]
  - - [1024, 1024, 1, 6624, 1024, 1024, 1024, 1024]
    - [15, 10386.6]
  - - [1024, 4096, 1, 6528, 1024, 1024, 1024, 4096]
    - [55, 11244.3]
  - - [1024, 1024, 1, 9024, 1024, 1024, 1024, 1024]
    - [15, 9702.15]
  - - [1024, 33712, 1, 7192, 1024, 1024, 1024, 33712]
    - [2, 12072.4]
  - - [4096, 1024, 1, 9048, 4096, 4096, 4096, 1024]
    - [1, 11928.5]
  - - [4096, 1024, 1, 8904, 4096, 4096, 4096, 1024]
    - [0, 11061.4]
  - - [1024, 4096, 1, 9952, 1024, 1024, 1024, 4096]
    - [22, 11200.1]
  - - [1024, 1024, 1, 6968, 1024, 1024, 1024, 1024]
    - [37, 10359.6]
  - - [4096, 1024, 1, 8856, 4096, 4096, 4096, 1024]
    - [45, 11059.7]
  - - [1024, 4096, 1, 9504, 1024, 1024, 1024, 4096]
    - [45, 11199.6]
  - - [1024, 1024, 1, 9672, 1024, 1024, 1024, 1024]
    - [2, 9821.23]
  - - [1024, 4096, 1, 5040, 1024, 1024, 1024, 4096]
    - [27, 11261.5]
  - - [1024, 33712, 1, 8664, 1024, 1024, 1024, 33712]
    - [45, 11751.8]
  - - [4096, 1024, 1, 10240, 4096, 4096, 4096, 1024]
    - [1, 11934.7]
  - - [1024, 1024, 1, 8016, 1024, 1024, 1024, 1024]
    - [15, 10404.7]
  - - [4096, 1024, 1, 8600, 4096, 4096, 4096, 1024]
    - [33, 10874.9]
  - - [1024, 1024, 1, 8648, 1024, 1024, 1024, 1024]
    - [15, 9704.68]
  - - [1024, 1024, 1, 8024, 1024, 1024, 1024, 1024]
    - [15, 9697.72]
  - - [1024, 1024, 1, 8464, 1024, 1024, 1024, 1024]
    - [16, 10368.1]
  - - [1024, 1024, 1, 9184, 1024, 1024, 1024, 1024]
    - [15, 9707.75]
  - - [1024, 33712, 1, 6528, 1024, 1024, 1024, 33712]
    - [17, 12161.3]
  - - [1024, 33712, 1, 7936, 1024, 1024, 1024, 33712]
    - [45, 11930.1]
  - - [1024, 4096, 1, 7896, 1024, 1024, 1024, 4096]
    - [1, 11904.1]
  - - [1024, 4096, 1, 4920, 1024, 1024, 1024, 4096]
    - [1, 11469.5]
  - - [1024, 1024, 1, 9424, 1024, 1024, 1024, 1024]
    - [24, 10153.9]
  - - [1024, 4096, 1, 3000, 1024, 1024, 1024, 4096]
    - [46, 11262.1]
  - - [1024, 4096, 1, 6560, 1024, 1024, 1024, 4096]
    - [0, 11709.9]
  - - [1024, 1024, 1, 10160, 1024, 1024, 1024, 1024]
    - [2, 9826.49]
  - - [1024, 1024, 1, 8432, 1024, 1024, 1024, 1024]
    - [16, 10358.9]
  - - [1024, 33712, 1, 9272, 1024, 1024, 1024, 33712]
    - [20, 11585.1]
  - - [1024, 4096, 1, 9240, 1024, 1024, 1024, 4096]
    - [1, 11872.4]
  - - [1024, 33712, 1, 9952, 1024, 1024, 1024, 33712]
    - [54, 11322.4]
  - - [1024, 4096, 1, 9360, 1024, 1024, 1024, 4096]
    - [1, 11838.8]
  - - [1024, 1024, 1, 3256, 1024, 1024, 1024, 1024]
    - [17, 10276.2]
  - - [1024, 1024, 1, 9112, 1024, 1024, 1024, 1024]
    - [15, 9704.43]
  - - [1024, 4096, 1, 9984, 1024, 1024, 1024, 4096]
    - [31, 11436.7]
  - - [1024, 4096, 1, 9752, 1024, 1024, 1024, 4096]
    - [23, 11513.8]
  - - [4096, 1024, 1, 9768, 4096, 4096, 4096, 1024]
    - [0, 11531.2]
  - - [1024, 4096, 1, 8592, 1024, 1024, 1024, 4096]
    - [32, 11500.6]
  - - [1024, 4096, 1, 9792, 1024, 1024, 1024, 4096]
    - [0, 11377.1]
  - - [1024, 1024, 1, 9728, 1024, 1024, 1024, 1024]
    - [37, 10405.3]
  - - [1024, 4096, 1, 5120, 1024, 1024, 1024, 4096]
    - [23, 11299.2]
  - - [1024, 1024, 1, 8568, 1024, 1024, 1024, 1024]
    - [44, 10167.7]
  - - [1024, 1024, 1, 8760, 1024, 1024, 1024, 1024]
    - [15, 10418.2]
  - - [4096, 1024, 1, 1984, 4096, 4096, 4096, 1024]
    - [33, 11635.2]
  - - [1024, 1024, 1, 9920, 1024, 1024, 1024, 1024]
    - [15, 10267.9]
  - - [1024, 1024, 1, 8904, 1024, 1024, 1024, 1024]
    - [24, 10310.6]
  - - [1024, 4096, 1, 5200, 1024, 1024, 1024, 4096]
    - [23, 11258.7]
  - - [4096, 1024, 1, 8064, 4096, 4096, 4096, 1024]
    - [1, 11119.5]
  - - [4096, 1024, 1, 7968, 4096, 4096, 4096, 1024]
    - [0, 11874.0]
  - - [1024, 1024, 1, 5200, 1024, 1024, 1024, 1024]
    - [15, 10363.0]
  - - [1024, 4096, 1, 8288, 1024, 1024, 1024, 4096]
    - [23, 11531.8]
  - - [4096, 1024, 1, 10120, 4096, 4096, 4096, 1024]
    - [22, 11208.0]
  - - [4096, 1024, 1, 3024, 4096, 4096, 4096, 1024]
    - [0, 11108.0]
  - - [1024, 4096, 1, 9568, 1024, 1024, 1024, 4096]
    - [23, 11107.0]
  - - [1024, 33712, 1, 9920, 1024, 1024, 1024, 33712]
    - [20, 11357.2]
  - - [1024, 1024, 1, 1224, 1024, 1024, 1024, 1024]
    - [15, 10027.0]
  - - [1024, 1024, 1, 9912, 1024, 1024, 1024, 1024]
    - [24, 10326.5]
  - - [1024, 1024, 1, 6888, 1024, 1024, 1024, 1024]
    - [24, 10305.0]
  - - [1024, 4096, 1, 3120, 1024, 1024, 1024, 4096]
    - [45, 11220.8]
  - - [4096, 1024, 1, 8736, 4096, 4096, 4096, 1024]
    - [0, 11412.5]
  - - [1024, 4096, 1, 8208, 1024, 1024, 1024, 4096]
    - [47, 11335.6]
  - - [4096, 1024, 1, 8816, 4096, 4096, 4096, 1024]
    - [0, 11558.7]
  - - [1024, 1024, 1, 6160, 1024, 1024, 1024, 1024]
    - [15, 9684.54]
  - - [1024, 33712, 1, 8592, 1024, 1024, 1024, 33712]
    - [45, 11816.6]
  - - [1024, 4096, 1, 10168, 1024, 1024, 1024, 4096]
    - [0, 11853.1]
  - - [1024, 33712, 1, 7568, 1024, 1024, 1024, 33712]
    - [12, 12116.8]
  - - [4096, 1024, 1, 6496, 4096, 4096, 4096, 1024]
    - [3, 11936.6]
  - - [1024, 4096, 1, 9184, 1024, 1024, 1024, 4096]
    - [47, 11034.3]
  - - [1024, 1024, 1, 8232, 1024, 1024, 1024, 1024]
    - [24, 10309.4]
  - - [1024, 1024, 1, 3120, 1024, 1024, 1024, 1024]
    - [15, 10295.7]
  - - [1024, 1024, 1, 10080, 1024, 1024, 1024, 1024]
    - [24, 10330.8]
  - - [1024, 1024, 1, 8320, 1024, 1024, 1024, 1024]
    - [37, 10195.5]
  - - [1024, 33712, 1, 8968, 1024, 1024, 1024, 33712]
    - [45, 11673.7]
  - - [4096, 1024, 1, 5576, 4096, 4096, 4096, 1024]
    - [3, 11919.2]
  - - [4096, 1024, 1, 7224, 4096, 4096, 4096, 1024]
    - [48, 11294.0]
  - - [4096, 1024, 1, 912, 4096, 4096, 4096, 1024]
    - [37, 11314.5]
  - - [4096, 1024, 1, 10080, 4096, 4096, 4096, 1024]
    - [30, 11217.1]
  - - [1024, 33712, 1, 10080, 1024, 1024, 1024, 33712]
    - [47, 11299.1]
  - - [1024, 33712, 1, 4488, 1024, 1024, 1024, 33712]
    - [0, 13001.3]
  - - [1024, 33712, 1, 5800, 1024, 1024, 1024, 33712]
    - [27, 12162.2]
  - - [1024, 4096, 1, 10064, 1024, 1024, 1024, 4096]
    - [1, 11776.9]
  - - [4096, 1024, 1, 8960, 4096, 4096, 4096, 1024]
    - [0, 11600.5]
  - - [1024, 1024, 1, 10000, 1024, 1024, 1024, 1024]
    - [15, 9712.6]
  - - [1024, 1024, 1, 8184, 1024, 1024, 1024, 1024]
    - [15, 9697.07]
  - - [4096, 1024, 1, 6624, 4096, 4096, 4096, 1024]
    - [55, 11208.2]
  - - [1024, 4096, 1, 10224, 1024, 1024, 1024, 4096]
    - [30, 11452.2]
  - - [1024, 33712, 1, 10064, 1024, 1024, 1024, 33712]
    - [54, 11302.4]
  - - [4096, 1024, 1, 7640, 4096, 4096, 4096, 1024]
    - [3, 11949.0]
  - - [1024, 33712, 1, 8448, 1024, 1024, 1024, 33712]
    - [20, 11864.3]
  - - [1024, 33712, 1, 9856, 1024, 1024, 1024, 33712]
    - [20, 11386.2]
  - - [1024, 4096, 1, 10120, 1024, 1024, 1024, 4096]
    - [1, 11825.6]
  - - [4096, 1024, 1, 9576, 4096, 4096, 4096, 1024]
    - [0, 11571.9]
  - - [1024, 1024, 1, 8480, 1024, 1024, 1024, 1024]
    - [15, 9698.84]
  - - [1024, 33712, 1, 5040, 1024, 1024, 1024, 33712]
    - [45, 12084.0]
  - - [1024, 4096, 1, 3600, 1024, 1024, 1024, 4096]
    - [21, 11386.5]
  - - [1024, 4096, 1, 2912, 1024, 1024, 1024, 4096]
    - [0, 11643.7]
  - - [1024, 33712, 1, 8584, 1024, 1024, 1024, 33712]
    - [45, 11816.4]
  - - [1024, 1024, 1, 10152, 1024, 1024, 1024, 1024]
    - [24, 10328.6]
  - - [1024, 1024, 1, 4224, 1024, 1024, 1024, 1024]
    - [15, 9642.05]
  - - [1024, 4096, 1, 8024, 1024, 1024, 1024, 4096]
    - [47, 11433.6]
  - - [1024, 33712, 1, 8112, 1024, 1024, 1024, 33712]
    - [10, 12086.8]
  - - [1024, 4096, 1, 10152, 1024, 1024, 1024, 4096]
    - [1, 11836.8]
  - - [4096, 1024, 1, 8928, 4096, 4096, 4096, 1024]
    - [0, 11632.3]
  - - [4096, 1024, 1, 7616, 4096, 4096, 4096, 1024]
    - [1, 11117.5]
  - - [1024, 33712, 1, 10152, 1024, 1024, 1024, 33712]
    - [56, 11250.0]
  - - [1024, 4096, 1, 2040, 1024, 1024, 1024, 4096]
    - [5, 11999.8]
  - - [4096, 1024, 1, 8568, 4096, 4096, 4096, 1024]
    - [23, 10958.7]
  - - [1024, 1024, 1, 7800, 1024, 1024, 1024, 1024]
    - [15, 10406.7]
  - - [1024, 4096, 1, 10176, 1024, 1024, 1024, 4096]
    - [22, 11472.9]
  - - [1024, 33712, 1, 6960, 1024, 1024, 1024, 33712]
    - [45, 12059.2]
  - - [1024, 1024, 1, 4032, 1024, 1024, 1024, 1024]
    - [50, 10241.9]
  - - [1024, 1024, 1, 7840, 1024, 1024, 1024, 1024]
    - [15, 9687.04]
  - - [1024, 1024, 1, 9120, 1024, 1024, 1024, 1024]
    - [15, 9705.06]
  - - [1024, 1024, 1, 8976, 1024, 1024, 1024, 1024]
    - [15, 9707.88]
  - - [1024, 4096, 1, 8064, 1024, 1024, 1024, 4096]
    - [47, 11342.0]
  - - [4096, 1024, 1, 9360, 4096, 4096, 4096, 1024]
    - [23, 11138.6]
  - - [1024, 1024, 1, 5840, 1024, 1024, 1024, 1024]
    - [15, 10376.3]
  - - [1024, 33712, 1, 8576, 1024, 1024, 1024, 33712]
    - [45, 11787.0]
  - - [1024, 4096, 1, 9384, 1024, 1024, 1024, 4096]
    - [1, 11836.6]
  - - [4096, 1024, 1, 8040, 4096, 4096, 4096, 1024]
    - [0, 11742.3]
  - - [1024, 1024, 1, 9880, 1024, 1024, 1024, 1024]
    - [2, 9774.96]
  - - [4096, 1024, 1, 6720, 4096, 4096, 4096, 1024]
    - [55, 11383.9]
  - - [1024, 33712, 1, 10168, 1024, 1024, 1024, 33712]
    - [20, 11312.8]
  - - [1024, 1024, 1, 5920, 1024, 1024, 1024, 1024]
    - [15, 10380.5]
  - - [1024, 4096, 1, 4800, 1024, 1024, 1024, 4096]
    - [20, 10596.5]
  - - [1024, 4096, 1, 9976, 1024, 1024, 1024, 4096]
    - [23, 11271.4]
  - - [4096, 1024, 1, 9984, 4096, 4096, 4096, 1024]
    - [0, 11553.1]
  - - [1024, 33712, 1, 5576, 1024, 1024, 1024, 33712]
    - [5, 12264.8]
  - - [1024, 1024, 1, 7896, 1024, 1024, 1024, 1024]
    - [24, 10308.2]
  - - [1024, 1024, 1, 8664, 1024, 1024, 1024, 1024]
    - [15, 9705.19]
  - - [4096, 1024, 1, 3256, 4096, 4096, 4096, 1024]
    - [55, 10853.7]
  - - [1024, 4096, 1, 6496, 1024, 1024, 1024, 4096]
    - [27, 11270.3]
  - - [1024, 1024, 1, 10192, 1024, 1024, 1024, 1024]
    - [15, 9708.44]
  - - [1024, 4096, 1, 9840, 1024, 1024, 1024, 4096]
    - [23, 11387.7]
  - - [1024, 1024, 1, 8584, 1024, 1024, 1024, 1024]
    - [24, 10276.9]
  - - [4096, 1024, 1, 8480, 4096, 4096, 4096, 1024]
    - [14, 11025.8]
  - - [4096, 1024, 1, 5760, 4096, 4096, 4096, 1024]
    - [0, 11738.7]
  - - [1024, 1024, 1, 6384, 1024, 1024, 1024, 1024]
    - [24, 10299.9]
  - - [1024, 33712, 1, 9672, 1024, 1024, 1024, 33712]
    - [54, 11437.4]
  - - [4096, 1024, 1, 5832, 4096, 4096, 4096, 1024]
    - [3, 11920.6]
  - - [1024, 4096, 1, 5920, 1024, 1024, 1024, 4096]
    - [52, 10963.5]
  - - [1024, 1024, 1, 5472, 1024, 1024, 1024, 1024]
    - [15, 10372.0]
  - - [1024, 4096, 1, 9928, 1024, 1024, 1024, 4096]
    - [15, 11768.6]
  - - [4096, 1024, 1, 3344, 4096, 4096, 4096, 1024]
    - [1, 11902.3]
  - - [1024, 4096, 1, 4368, 1024, 1024, 1024, 4096]
    - [27, 11136.9]
  - - [4096, 1024, 1, 8528, 4096, 4096, 4096, 1024]
    - [6, 11162.7]
  - - [1024, 4096, 1, 9472, 1024, 1024, 1024, 4096]
    - [23, 11406.0]
  - - [4096, 1024, 1, 7728, 4096, 4096, 4096, 1024]
    - [0, 11819.0]
  - - [1024, 33712, 1, 5880, 1024, 1024, 1024, 33712]
    - [45, 12143.3]
  - - [1024, 33712, 1, 2912, 1024, 1024, 1024, 33712]
    - [19, 12182.6]
  - - [1024, 4096, 1, 7296, 1024, 1024, 1024, 4096]
    - [55, 11350.7]
  - - [1024, 4096, 1, 7504, 1024, 1024, 1024, 4096]
    - [45, 11281.0]
  - - [1024, 33712, 1, 9792, 1024, 1024, 1024, 33712]
    - [20, 11457.1]
  - - [1024, 1024, 1, 4080, 1024, 1024, 1024, 1024]
    - [15, 10333.8]
  - - [1024, 4096, 1, 8576, 1024, 1024, 1024, 4096]
    - [47, 11508.3]
  - - [4096, 1024, 1, 10200, 4096, 4096, 4096, 1024]
    - [0, 11512.9]
  - - [1024, 1024, 1, 5576, 1024, 1024, 1024, 1024]
    - [15, 10369.7]
  - - [1024, 1024, 1, 9464, 1024, 1024, 1024, 1024]
    - [15, 9700.96]
  - - [1024, 4096, 1, 9800, 1024, 1024, 1024, 4096]
    - [7, 11042.4]
  - - [1024, 4096, 1, 8320, 1024, 1024, 1024, 4096]
    - [0, 11707.7]
  - - [1024, 1024, 1, 8616, 1024, 1024, 1024, 1024]
    - [15, 10418.0]
  - - [1024, 1024, 1, 9408, 1024, 1024, 1024, 1024]
    - [24, 10165.9]
  - - [1024, 4096, 1, 6888, 1024, 1024, 1024, 4096]
    - [55, 11476.4]
  - - [4096, 1024, 1, 8464, 4096, 4096, 4096, 1024]
    - [0, 11234.3]
  - - [4096, 1024, 1, 7920, 4096, 4096, 4096, 1024]
    - [0, 11639.4]
  - - [1024, 4096, 1, 7056, 1024, 1024, 1024, 4096]
    - [54, 11434.7]
  - - [1024, 33712, 1, 3072, 1024, 1024, 1024, 33712]
    - [0, 12243.2]
  - - [1024, 1024, 1, 6600, 1024, 1024, 1024, 1024]
    - [15, 10400.0]
  - - [1024, 1024, 1, 9344, 1024, 1024, 1024, 1024]
    - [37, 10184.0]
  - - [4096, 1024, 1, 4368, 4096, 4096, 4096, 1024]
    - [20, 10857.1]
  - - [1024, 1024, 1, 9968, 1024, 1024, 1024, 1024]
    - [37, 10387.4]
  - - [1024, 33712, 1, 5504, 1024, 1024, 1024, 33712]
    - [5, 12301.5]
  - - [1024, 33712, 1, 9696, 1024, 1024, 1024, 33712]
    - [20, 11440.2]
  - - [4096, 1024, 1, 7168, 4096, 4096, 4096, 1024]
    - [3, 11944.1]
  - - [1024, 4096, 1, 7616, 1024, 1024, 1024, 4096]
    - [54, 11385.7]
  - - [4096, 1024, 1, 3600, 4096, 4096, 4096, 1024]
    - [0, 11302.0]
  - - [1024, 1024, 1, 1984, 1024, 1024, 1024, 1024]
    - [17, 9501.14]
  - - [1024, 4096, 1, 9024, 1024, 1024, 1024, 4096]
    - [45, 11260.1]
  - - [1024, 33712, 1, 8200, 1024, 1024, 1024, 33712]
    - [45, 11843.9]
  - - [1024, 4096, 1, 8904, 1024, 1024, 1024, 4096]
    - [1, 11887.0]
  - - [1024, 33712, 1, 9976, 1024, 1024, 1024, 33712]
    - [20, 11386.8]
  - - [1024, 33712, 1, 5936, 1024, 1024, 1024, 33712]
    - [0, 12826.4]
  - - [1024, 4096, 1, 7936, 1024, 1024, 1024, 4096]
    - [1, 11735.6]
  - - [1024, 1024, 1, 5120, 1024, 1024, 1024, 1024]
    - [15, 10362.7]
  - - [4096, 1024, 1, 9880, 4096, 4096, 4096, 1024]
    - [23, 11150.5]
  - - [1024, 1024, 1, 9568, 1024, 1024, 1024, 1024]
    - [44, 10176.8]
  - - [1024, 33712, 1, 8704, 1024, 1024, 1024, 33712]
    - [20, 11730.0]
  - - [1024, 1024, 1, 8192, 1024, 1024, 1024, 1024]
    - [23, 10281.9]
  - - [1024, 1024, 1, 9200, 1024, 1024, 1024, 1024]
    - [24, 10330.3]
  - - [1024, 1024, 1, 9248, 1024, 1024, 1024, 1024]
    - [15, 9707.3]
  - - [1024, 1024, 1, 9840, 1024, 1024, 1024, 1024]
    - [15, 9709.01]
  - - [1024, 1024, 1, 9936, 1024, 1024, 1024, 1024]
    - [15, 9709.44]
  - - [1024, 1024, 1, 9176, 1024, 1024, 1024, 1024]
    - [37, 10397.8]
  - - [1024, 1024, 1, 9976, 1024, 1024, 1024, 1024]
    - [15, 10207.4]
  - - [1024, 33712, 1, 8976, 1024, 1024, 1024, 33712]
    - [20, 11669.3]
  - - [4096, 1024, 1, 8192, 4096, 4096, 4096, 1024]
    - [3, 11954.3]
  - - [1024, 1024, 1, 9984, 1024, 1024, 1024, 1024]
    - [15, 10422.3]
  - - [1024, 4096, 1, 6720, 1024, 1024, 1024, 4096]
    - [54, 11289.1]
  - - [1024, 1024, 1, 7936, 1024, 1024, 1024, 1024]
    - [15, 10412.3]
  - - [1024, 1024, 1, 1584, 1024, 1024, 1024, 1024]
    - [15, 10117.8]
  - - [1024, 33712, 1, 5984, 1024, 1024, 1024, 33712]
    - [3, 12196.2]
  - - [4096, 1024, 1, 6960, 4096, 4096, 4096, 1024]
    - [1, 11853.7]
  - - [4096, 1024, 1, 6272, 4096, 4096, 4096, 1024]
    - [46, 11224.5]
  - - [1024, 4096, 1, 6816, 1024, 1024, 1024, 4096]
    - [27, 11264.1]
  - - [1024, 4096, 1, 10160, 1024, 1024, 1024, 4096]
    - [31, 11244.7]
  - - [4096, 1024, 1, 4080, 4096, 4096, 4096, 1024]
    - [0, 11870.6]
  - - [1024, 1024, 1, 8784, 1024, 1024, 1024, 1024]
    - [15, 9705.24]
  - - [1024, 1024, 1, 8840, 1024, 1024, 1024, 1024]
    - [15, 9703.32]
  - - [1024, 33712, 1, 9728, 1024, 1024, 1024, 33712]
    - [54, 11414.6]
  - - [1024, 1024, 1, 8000, 1024, 1024, 1024, 1024]
    - [37, 10372.7]
  - - [1024, 4096, 1, 9400, 1024, 1024, 1024, 4096]
    - [45, 11287.9]
  - - [1024, 4096, 1, 8928, 1024, 1024, 1024, 4096]
    - [0, 11391.1]
  - - [1024, 4096, 1, 10208, 1024, 1024, 1024, 4096]
    - [0, 11398.0]
  - - [4096, 1024, 1, 6768, 4096, 4096, 4096, 1024]
    - [0, 11880.2]
  - - [1024, 1024, 1, 10208, 1024, 1024, 1024, 1024]
    - [16, 10380.0]
  - - [1024, 4096, 1, 3344, 1024, 1024, 1024, 4096]
    - [46, 10597.9]
  - - [1024, 1024, 1, 9072, 1024, 1024, 1024, 1024]
    - [37, 10371.4]
  - - [1024, 1024, 1, 7560, 1024, 1024, 1024, 1024]
    - [24, 10312.2]
  - - [4096, 1024, 1, 8880, 4096, 4096, 4096, 1024]
    - [32, 10897.8]
  - - [4096, 1024, 1, 8208, 4096, 4096, 4096, 1024]
    - [1, 11118.9]
  - - [1024, 1024, 1, 7776, 1024, 1024, 1024, 1024]
    - [15, 10067.3]
  - - [4096, 1024, 1, 7776, 4096, 4096, 4096, 1024]
    - [48, 11157.5]
  - - [1024, 1024, 1, 2592, 1024, 1024, 1024, 1024]
    - [18, 9535.17]
  - - [4096, 1024, 1, 6032, 4096, 4096, 4096, 1024]
    - [1, 11102.7]
  - - [1024, 1024, 1, 7520, 1024, 1024, 1024, 1024]
    - [15, 9692.78]
  - - [4096, 1024, 1, 3000, 4096, 4096, 4096, 1024]
    - [15, 10930.2]
  - - [1024, 4096, 1, 9656, 1024, 1024, 1024, 4096]
    - [20, 11071.9]
  - - [4096, 1024, 1, 8976, 4096, 4096, 4096, 1024]
    - [35, 11520.2]
  - - [1024, 4096, 1, 8280, 1024, 1024, 1024, 4096]
    - [45, 11314.4]
  - - [4096, 1024, 1, 8000, 4096, 4096, 4096, 1024]
    - [48, 11187.2]
  - - [1024, 33712, 1, 7560, 1024, 1024, 1024, 33712]
    - [45, 12047.5]
  - - [1024, 1024, 1, 8448, 1024, 1024, 1024, 1024]
    - [24, 10224.3]
  - - [4096, 1024, 1, 5680, 4096, 4096, 4096, 1024]
    - [37, 10801.4]
  - - [4096, 1024, 1, 9400, 4096, 4096, 4096, 1024]
    - [23, 11020.3]
  - - [1024, 1024, 1, 7144, 1024, 1024, 1024, 1024]
    - [44, 10209.1]
  - - [4096, 1024, 1, 10064, 4096, 4096, 4096, 1024]
    - [31, 10843.9]
  - - [4096, 1024, 1, 7560, 4096, 4096, 4096, 1024]
    - [48, 11421.5]
  - - [1024, 4096, 1, 8736, 1024, 1024, 1024, 4096]
    - [45, 11308.8]
  - - [4096, 1024, 1, 8496, 4096, 4096, 4096, 1024]
    - [0, 11687.5]
  - - [1024, 1024, 1, 10120, 1024, 1024, 1024, 1024]
    - [37, 10394.5]
  - - [4096, 1024, 1, 10040, 4096, 4096, 4096, 1024]
    - [31, 11152.0]
  - - [1024, 1024, 1, 8928, 1024, 1024, 1024, 1024]
    - [15, 9707.24]
  - - [1024, 1024, 1, 10064, 1024, 1024, 1024, 1024]
    - [15, 9711.44]
  - - [1024, 33712, 1, 10040, 1024, 1024, 1024, 33712]
    - [20, 11338.5]
  - - [1024, 4096, 1, 8448, 1024, 1024, 1024, 4096]
    - [1, 11897.7]
  - - [4096, 1024, 1, 9568, 4096, 4096, 4096, 1024]
    - [23, 11249.7]
  - - [4096, 1024, 1, 10208, 4096, 4096, 4096, 1024]
    - [31, 11331.4]
  - - [4096, 1024, 1, 7752, 4096, 4096, 4096, 1024]
    - [55, 10925.2]
  - - [1024, 4096, 1, 10240, 1024, 1024, 1024, 4096]
    - [30, 11263.9]
  - - [1024, 4096, 1, 4704, 1024, 1024, 1024, 4096]
    - [0, 11342.7]
  - - [1024, 1024, 1, 1344, 1024, 1024, 1024, 1024]
    - [40, 9907.8]
  - - [4096, 1024, 1, 3696, 4096, 4096, 4096, 1024]
    - [0, 11116.1]
  - - [1024, 33712, 1, 6496, 1024, 1024, 1024, 33712]
    - [12, 12407.1]
  - - [1024, 33712, 1, 10120, 1024, 1024, 1024, 33712]
    - [54, 11219.3]
  - - [1024, 1024, 1, 2720, 1024, 1024, 1024, 1024]
    - [15, 10268.3]
  - - [1024, 1024, 1, 8704, 1024, 1024, 1024, 1024]
    - [15, 10409.2]
  - - [4096, 1024, 1, 7800, 4096, 4096, 4096, 1024]
    - [34, 11124.1]
  - - [1024, 33712, 1, 4536, 1024, 1024, 1024, 33712]
    - [45, 12068.9]
  - - [1024, 4096, 1, 6360, 1024, 1024, 1024, 4096]
    - [28, 11087.9]
  - - [4096, 1024, 1, 8200, 4096, 4096, 4096, 1024]
    - [1, 11118.1]
  - - [1024, 1024, 1, 6656, 1024, 1024, 1024, 1024]
    - [37, 10334.2]
  - - [1024, 4096, 1, 8640, 1024, 1024, 1024, 4096]
    - [32, 11461.3]
  - - [1024, 33712, 1, 10192, 1024, 1024, 1024, 33712]
    - [47, 11151.0]
  - - [1024, 33712, 1, 10160, 1024, 1024, 1024, 33712]
    - [54, 11481.3]
  - - [4096, 1024, 1, 9504, 4096, 4096, 4096, 1024]
    - [3, 11966.4]
  - - [1024, 1024, 1, 6512, 1024, 1024, 1024, 1024]
    - [37, 10358.5]
  - - [4096, 1024, 1, 10224, 4096, 4096, 4096, 1024]
    - [31, 11342.6]
  - - [1024, 4096, 1, 9328, 1024, 1024, 1024, 4096]
    - [47, 11169.2]
  - - [4096, 1024, 1, 9024, 4096, 4096, 4096, 1024]
    - [0, 11337.8]
  - - [4096, 1024, 1, 9728, 4096, 4096, 4096, 1024]
    - [23, 11163.2]
  - - [1024, 4096, 1, 3584, 1024, 1024, 1024, 4096]
    - [52, 11201.4]
  - - [1024, 4096, 1, 9728, 1024, 1024, 1024, 4096]
    - [23, 11551.9]
  - - [1024, 4096, 1, 7424, 1024, 1024, 1024, 4096]
    - [54, 11435.8]
  - - [4096, 1024, 1, 10192, 4096, 4096, 4096, 1024]
    - [31, 11142.8]
  - - [1024, 33712, 1, 4920, 1024, 1024, 1024, 33712]
    - [45, 12086.5]
  - - [1024, 33712, 1, 9296, 1024, 1024, 1024, 33712]
    - [20, 11584.7]
  - - [1024, 1024, 1, 10184, 1024, 1024, 1024, 1024]
    - [5, 10037.1]
  - - [4096, 1024, 1, 8664, 4096, 4096, 4096, 1024]
    - [24, 10829.5]
  - - [1024, 4096, 1, 9696, 1024, 1024, 1024, 4096]
    - [15, 11502.4]
  - - [1024, 1024, 1, 2912, 1024, 1024, 1024, 1024]
    - [44, 10124.1]
  - - [4096, 1024, 1, 8448, 4096, 4096, 4096, 1024]
    - [6, 11174.1]
  - - [1024, 4096, 1, 9016, 1024, 1024, 1024, 4096]
    - [0, 11711.1]
  - - [4096, 1024, 1, 6936, 4096, 4096, 4096, 1024]
    - [0, 11888.9]
  - - [4096, 1024, 1, 8280, 4096, 4096, 4096, 1024]
    - [24, 11227.7]
  - - [4096, 1024, 1, 8008, 4096, 4096, 4096, 1024]
    - [35, 11299.6]
  - - [1024, 4096, 1, 7072, 1024, 1024, 1024, 4096]
    - [55, 11415.1]
  - - [4096, 1024, 1, 8024, 4096, 4096, 4096, 1024]
    - [48, 11222.5]
  - - [1024, 1024, 1, 9720, 1024, 1024, 1024, 1024]
    - [2, 9819.01]
  - - [1024, 33712, 1, 10240, 1024, 1024, 1024, 33712]
    - [20, 11247.8]
  - - [1024, 1024, 1, 7072, 1024, 1024, 1024, 1024]
    - [5, 10027.5]
  - - [1024, 33712, 1, 8160, 1024, 1024, 1024, 33712]
    - [45, 11855.3]
  - - [1024, 1024, 1, 7504, 1024, 1024, 1024, 1024]
    - [4, 10017.9]
  - - [1024, 33712, 1, 9984, 1024, 1024, 1024, 33712]
    - [20, 11301.0]
  - - [1024, 1024, 1, 5800, 1024, 1024, 1024, 1024]
    - [15, 10375.5]
  - - [1024, 4096, 1, 8192, 1024, 1024, 1024, 4096]
    - [47, 11443.1]
  - - [1024, 1024, 1, 6480, 1024, 1024, 1024, 1024]
    - [37, 10354.1]
  - - [1024, 1024, 1, 9600, 1024, 1024, 1024, 1024]
    - [15, 9707.51]
  - - [1024, 1024, 1, 7872, 1024, 1024, 1024, 1024]
    - [15, 9695.51]
  - - [1024, 4096, 1, 8296, 1024, 1024, 1024, 4096]
    - [47, 11389.4]
  - - [1024, 4096, 1, 7440, 1024, 1024, 1024, 4096]
    - [54, 11337.6]
  - - [1024, 1024, 1, 4640, 1024, 1024, 1024, 1024]
    - [15, 10350.1]
  - - [4096, 1024, 1, 7896, 4096, 4096, 4096, 1024]
    - [48, 11106.3]
  - - [1024, 33712, 1, 9568, 1024, 1024, 1024, 33712]
    - [54, 11432.7]
  - - [1024, 1024, 1, 8280, 1024, 1024, 1024, 1024]
    - [5, 10019.1]
  - - [1024, 4096, 1, 4640, 1024, 1024, 1024, 4096]
    - [31, 10888.9]
  - - [4096, 1024, 1, 9000, 4096, 4096, 4096, 1024]
    - [0, 11124.3]
  - - [1024, 33712, 1, 10208, 1024, 1024, 1024, 33712]
    - [47, 11217.2]
  - - [1024, 33712, 1, 6720, 1024, 1024, 1024, 33712]
    - [0, 12708.1]
  - - [4096, 1024, 1, 9792, 4096, 4096, 4096, 1024]
    - [1, 11931.9]
  - - [4096, 1024, 1, 5936, 4096, 4096, 4096, 1024]
    - [0, 11007.2]
  - - [1024, 1024, 1, 9856, 1024, 1024, 1024, 1024]
    - [37, 10278.0]
  - - [4096, 1024, 1, 9856, 4096, 4096, 4096, 1024]
    - [35, 11285.7]
  - - [4096, 1024, 1, 9760, 4096, 4096, 4096, 1024]
    - [32, 10891.0]
  - - [1024, 4096, 1, 9880, 1024, 1024, 1024, 4096]
    - [30, 10898.3]
  - - [1024, 4096, 1, 7448, 1024, 1024, 1024, 4096]
    - [48, 11515.4]
  - - [1024, 1024, 1, 9504, 1024, 1024, 1024, 1024]
    - [2, 9827.27]
  - - [1024, 4096, 1, 7360, 1024, 1024, 1024, 4096]
    - [54, 11400.9]
  - - [1024, 1024, 1, 5440, 1024, 1024, 1024, 1024]
    - [3, 9797.06]
  - - [1024, 1024, 1, 6720, 1024, 1024, 1024, 1024]
    - [15, 9686.59]
  - - [4096, 1024, 1, 7904, 4096, 4096, 4096, 1024]
    - [7, 11032.9]
  - - [1024, 4096, 1, 6960, 1024, 1024, 1024, 4096]
    - [54, 11337.0]
  - - [1024, 4096, 1, 9464, 1024, 1024, 1024, 4096]
    - [45, 11167.0]
  - - [1024, 1024, 1, 9960, 1024, 1024, 1024, 1024]
    - [1, 9770.77]
  - - [4096, 1024, 1, 9312, 4096, 4096, 4096, 1024]
    - [23, 11098.8]
  - - [1024, 4096, 1, 10192, 1024, 1024, 1024, 4096]
    - [23, 11164.7]
  - - [1024, 4096, 1, 4864, 1024, 1024, 1024, 4096]
    - [1, 11874.3]
  - - [4096, 1024, 1, 9464, 4096, 4096, 4096, 1024]
    - [0, 11445.7]
  - - [4096, 1024, 1, 4480, 4096, 4096, 4096, 1024]
    - [1, 11082.9]
  - - [1024, 33712, 1, 10200, 1024, 1024, 1024, 33712]
    - [20, 11264.5]
  - - [1024, 1024, 1, 8096, 1024, 1024, 1024, 1024]
    - [5, 10021.3]
  - - [1024, 4096, 1, 10200, 1024, 1024, 1024, 4096]
    - [23, 11198.7]
  - - [1024, 1024, 1, 4368, 1024, 1024, 1024, 1024]
    - [15, 10353.0]
  - - [1024, 4096, 1, 8008, 1024, 1024, 1024, 4096]
    - [54, 11440.3]
  - - [1024, 4096, 1, 6048, 1024, 1024, 1024, 4096]
    - [1, 11103.7]
  - - [1024, 1024, 1, 10200, 1024, 1024, 1024, 1024]
    - [1, 9777.17]
  - - [1024, 1024, 1, 9760, 1024, 1024, 1024, 1024]
    - [24, 9905.99]
  - - [1024, 4096, 1, 8200, 1024, 1024, 1024, 4096]
    - [47, 11400.2]
  - - [1024, 33712, 1, 10112, 1024, 1024, 1024, 33712]
    - [47, 11240.2]
  - - [4096, 1024, 1, 9928, 4096, 4096, 4096, 1024]
    - [1, 11940.8]
  - - [1024, 4096, 1, 9776, 1024, 1024, 1024, 4096]
    - [45, 11307.2]
  - - [1024, 1024, 1, 8424, 1024, 1024, 1024, 1024]
    - [1, 9757.4]
  - - [4096, 1024, 1, 8800, 4096, 4096, 4096, 1024]
    - [23, 10975.4]
  - - [4096, 1024, 1, 8160, 4096, 4096, 4096, 1024]
    - [0, 11457.7]
  - - [1024, 33712, 1, 8192, 1024, 1024, 1024, 33712]
    - [45, 11866.8]
  - - [1024, 4096, 1, 2112, 1024, 1024, 1024, 4096]
    - [1, 11864.3]
  - - [1024, 4096, 1, 3024, 1024, 1024, 1024, 4096]
    - [45, 11245.1]
  - - [4096, 1024, 1, 10168, 4096, 4096, 4096, 1024]
    - [0, 11544.6]
  - - [1024, 33712, 1, 9912, 1024, 1024, 1024, 33712]
    - [20, 11362.1]
  - - [1024, 33712, 1, 7168, 1024, 1024, 1024, 33712]
    - [0, 12633.8]
  - - [1024, 1024, 1, 8880, 1024, 1024, 1024, 1024]
    - [5, 10030.3]
  - - [1024, 1024, 1, 10240, 1024, 1024, 1024, 1024]
    - [15, 10424.6]
  - - [1024, 4096, 1, 9744, 1024, 1024, 1024, 4096]
    - [23, 11030.2]
  - - [1024, 4096, 1, 8784, 1024, 1024, 1024, 4096]
    - [0, 11418.3]
  - - [4096, 1024, 1, 6880, 4096, 4096, 4096, 1024]
    - [0, 11557.1]
  - - [1024, 33712, 1, 9400, 1024, 1024, 1024, 33712]
    - [47, 11435.8]
  - - [1024, 33712, 1, 8904, 1024, 1024, 1024, 33712]
    - [0, 12058.2]
  - - [4096, 1024, 1, 8944, 4096, 4096, 4096, 1024]
    - [1, 11935.5]
  - - [1024, 1024, 1, 9440, 1024, 1024, 1024, 1024]
    - [24, 10330.8]
  - - [4096, 1024, 1, 4640, 4096, 4096, 4096, 1024]
    - [37, 11467.4]
  - - [1024, 4096, 1, 10112, 1024, 1024, 1024, 4096]
    - [45, 11120.5]
  - - [1024, 33712, 1, 8832, 1024, 1024, 1024, 33712]
    - [20, 11626.9]
  - - [4096, 1024, 1, 7488, 4096, 4096, 4096, 1024]
    - [3, 11951.2]
  - - [4096, 1024, 1, 8584, 4096, 4096, 4096, 1024]
    - [0, 11118.3]
  - - [1024, 4096, 1, 8584, 1024, 1024, 1024, 4096]
    - [0, 11495.2]
  - - [1024, 4096, 1, 5832, 1024, 1024, 1024, 4096]
    - [0, 11699.0]
  - - [4096, 1024, 1, 8424, 4096, 4096, 4096, 1024]
    - [0, 11562.4]
  - - [1024, 33712, 1, 4896, 1024, 1024, 1024, 33712]
    - [45, 12118.1]
  - - [1024, 4096, 1, 10184, 1024, 1024, 1024, 4096]
    - [21, 11061.4]
  - - [1024, 1024, 1, 2040, 1024, 1024, 1024, 1024]
    - [5, 9833.99]
  - - [1024, 1024, 1, 7424, 1024, 1024, 1024, 1024]
    - [0, 9734.65]
  - - [1024, 1024, 1, 10032, 1024, 1024, 1024, 1024]
    - [15, 9711.3]
  - - [1024, 1024, 1, 8736, 1024, 1024, 1024, 1024]
    - [15, 9702.92]
  - - [1024, 4096, 1, 7560, 1024, 1024, 1024, 4096]
    - [54, 11464.1]
  - - [1024, 4096, 1, 8960, 1024, 1024, 1024, 4096]
    - [45, 11313.0]
  - - [4096, 1024, 1, 8288, 4096, 4096, 4096, 1024]
    - [0, 11363.5]
  - - [1024, 33712, 1, 8008, 1024, 1024, 1024, 33712]
    - [45, 11909.9]
  - - [4096, 1024, 1, 800, 4096, 4096, 4096, 1024]
    - [5, 11818.2]
  - - [1024, 1024, 1, 5680, 1024, 1024, 1024, 1024]
    - [15, 9668.66]
  - - [4096, 1024, 1, 6912, 4096, 4096, 4096, 1024]
    - [46, 10849.3]
  - - [1024, 1024, 1, 7400, 1024, 1024, 1024, 1024]
    - [15, 9692.51]
  - - [1024, 33712, 1, 8208, 1024, 1024, 1024, 33712]
    - [45, 11877.0]
  - - [1024, 33712, 1, 4048, 1024, 1024, 1024, 33712]
    - [0, 12973.7]
  - - [4096, 1024, 1, 7424, 4096, 4096, 4096, 1024]
    - [48, 11418.1]
  - - [4096, 1024, 1, 2392, 4096, 4096, 4096, 1024]
    - [45, 11304.2]
  - - [1024, 1024, 1, 7040, 1024, 1024, 1024, 1024]
    - [15, 10392.4]
  - - [4096, 1024, 1, 2112, 4096, 4096, 4096, 1024]
    - [21, 11408.3]
  - - [1024, 4096, 1, 9600, 1024, 1024, 1024, 4096]
    - [23, 10969.5]
  - - [1024, 33712, 1, 5472, 1024, 1024, 1024, 33712]
    - [45, 12109.6]
  - - [1024, 1024, 1, 4920, 1024, 1024, 1024, 1024]
    - [15, 9650.89]
  - - [1024, 1024, 1, 9576, 1024, 1024, 1024, 1024]
    - [15, 9705.71]
  - - [4096, 1024, 1, 8592, 4096, 4096, 4096, 1024]
    - [55, 10778.0]
  - - [4096, 1024, 1, 9920, 4096, 4096, 4096, 1024]
    - [0, 11510.8]
  - - [1024, 4096, 1, 6160, 1024, 1024, 1024, 4096]
    - [52, 11185.9]
  - - [1024, 33712, 1, 8016, 1024, 1024, 1024, 33712]
    - [45, 11905.7]
  - - [1024, 4096, 1, 9920, 1024, 1024, 1024, 4096]
    - [1, 11854.8]
  - - [4096, 1024, 1, 7440, 4096, 4096, 4096, 1024]
    - [0, 11760.4]
  - - [4096, 1024, 1, 6560, 4096, 4096, 4096, 1024]
    - [46, 11443.0]
  - - [1024, 1024, 1, 9656, 1024, 1024, 1024, 1024]
    - [15, 9704.99]
  - - [1024, 4096, 1, 8184, 1024, 1024, 1024, 4096]
    - [47, 11444.8]
  - - [1024, 33712, 1, 9768, 1024, 1024, 1024, 33712]
    - [20, 11453.3]
  - - [1024, 4096, 1, 9768, 1024, 1024, 1024, 4096]
    - [1, 11817.8]
  - - [1024, 33712, 1, 9112, 1024, 1024, 1024, 33712]
    - [20, 11636.7]
  - - [1024, 4096, 1, 6784, 1024, 1024, 1024, 4096]
    - [1, 11897.9]
  - - [1024, 1024, 1, 8160, 1024, 1024, 1024, 1024]
    - [15, 9956.66]
  - - [1024, 4096, 1, 8840, 1024, 1024, 1024, 4096]
    - [45, 11300.0]
  - - [1024, 4096, 1, 3040, 1024, 1024, 1024, 4096]
    - [1, 11895.1]
  - - [4096, 1024, 1, 8296, 4096, 4096, 4096, 1024]
    - [1, 11119.2]
  - - [1024, 33712, 1, 9752, 1024, 1024, 1024, 33712]
    - [20, 11303.9]
  - - [1024, 4096, 1, 8160, 1024, 1024, 1024, 4096]
    - [1, 11859.8]
  - - [4096, 1024, 1, 9776, 4096, 4096, 4096, 1024]
    - [21, 11154.1]
  - - [4096, 1024, 1, 9328, 4096, 4096, 4096, 1024]
    - [0, 11127.8]
  - - [1024, 33712, 1, 5280, 1024, 1024, 1024, 33712]
    - [45, 12101.0]
  - - [4096, 1024, 1, 8640, 4096, 4096, 4096, 1024]
    - [3, 11153.4]
  - - [4096, 1024, 1, 7936, 4096, 4096, 4096, 1024]
    - [0, 11591.1]
  - - [4096, 1024, 1, 8520, 4096, 4096, 4096, 1024]
    - [1, 11123.6]
  - - [1024, 4096, 1, 7392, 1024, 1024, 1024, 4096]
    - [0, 11807.0]
  - - [4096, 1024, 1, 6360, 4096, 4096, 4096, 1024]
    - [0, 11759.7]
  - - [4096, 1024, 1, 7040, 4096, 4096, 4096, 1024]
    - [46, 11085.0]
  - - [4096, 1024, 1, 5504, 4096, 4096, 4096, 1024]
    - [1, 11098.3]
  - - [1024, 33712, 1, 9168, 1024, 1024, 1024, 33712]
    - [20, 11692.7]
  - - [4096, 1024, 1, 8704, 4096, 4096, 4096, 1024]
    - [3, 11961.7]
  - - [1024, 33712, 1, 8736, 1024, 1024, 1024, 33712]
    - [20, 11724.8]
  - - [1024, 33712, 1, 9600, 1024, 1024, 1024, 33712]
    - [20, 11442.7]
  - - [4096, 1024, 1, 8544, 4096, 4096, 4096, 1024]
    - [3, 11962.6]
  - - [4096, 1024, 1, 9344, 4096, 4096, 4096, 1024]
    - [0, 11575.1]
  - - [1024, 4096, 1, 5472, 1024, 1024, 1024, 4096]
    - [14, 10994.5]
  - - [1024, 1024, 1, 9360, 1024, 1024, 1024, 1024]
    - [44, 10089.1]
  - - [4096, 1024, 1, 9176, 4096, 4096, 4096, 1024]
    - [23, 11129.5]
  - - [1024, 4096, 1, 6440, 1024, 1024, 1024, 4096]
    - [55, 11301.4]
  - - [1024, 4096, 1, 8424, 1024, 1024, 1024, 4096]
    - [24, 11491.4]
  - - [4096, 1024, 1, 6888, 4096, 4096, 4096, 1024]
    - [1, 11112.0]
  - - [4096, 1024, 1, 5280, 4096, 4096, 4096, 1024]
    - [1, 11057.4]
  - - [1024, 1024, 1, 9240, 1024, 1024, 1024, 1024]
    - [15, 9701.23]
  - - [4096, 1024, 1, 8432, 4096, 4096, 4096, 1024]
    - [55, 10860.0]
  - - [1024, 4096, 1, 9632, 1024, 1024, 1024, 4096]
    - [23, 11371.9]
  - - [1024, 33712, 1, 9520, 1024, 1024, 1024, 33712]
    - [54, 11492.5]
  - - [1024, 33712, 1, 8760, 1024, 1024, 1024, 33712]
    - [0, 12073.1]
  - - [1024, 1024, 1, 4896, 1024, 1024, 1024, 1024]
    - [15, 10367.1]
  - - [1024, 33712, 1, 9360, 1024, 1024, 1024, 33712]
    - [47, 11425.1]
  - - [1024, 4096, 1, 7920, 1024, 1024, 1024, 4096]
    - [1, 11907.4]
  - - [1024, 4096, 1, 5640, 1024, 1024, 1024, 4096]
    - [0, 11606.4]
  - - [1024, 4096, 1, 9408, 1024, 1024, 1024, 4096]
    - [23, 11385.9]
  - - [1024, 33712, 1, 7920, 1024, 1024, 1024, 33712]
    - [45, 11918.0]
  - - [4096, 1024, 1, 9472, 4096, 4096, 4096, 1024]
    - [1, 11930.4]
  - - [4096, 1024, 1, 9184, 4096, 4096, 4096, 1024]
    - [0, 11117.4]
  - - [1024, 4096, 1, 9312, 1024, 1024, 1024, 4096]
    - [54, 11205.1]
  - - [1024, 1024, 1, 6688, 1024, 1024, 1024, 1024]
    - [2, 9808.74]
  - - [1024, 1024, 1, 9216, 1024, 1024, 1024, 1024]
    - [15, 9700.9]
  - - [1024, 33712, 1, 9216, 1024, 1024, 1024, 33712]
    - [20, 11615.2]
  - - [4096, 1024, 1, 9216, 4096, 4096, 4096, 1024]
    - [1, 11934.8]
  - - [1024, 4096, 1, 9216, 1024, 1024, 1024, 4096]
    - [47, 11085.2]
  - - [1024, 1024, 1, 5824, 1024, 1024, 1024, 1024]
    - [2, 9799.24]
  - - [4096, 1024, 1, 9840, 4096, 4096, 4096, 1024]
    - [27, 11262.7]
  - - [4096, 1024, 1, 5824, 4096, 4096, 4096, 1024]
    - [0, 11095.8]
  - - [1024, 1024, 1, 8400, 1024, 1024, 1024, 1024]
    - [37, 10366.3]
  - - [4096, 1024, 1, 5600, 4096, 4096, 4096, 1024]
    - [25, 10742.0]
  - - [1024, 1024, 1, 5456, 1024, 1024, 1024, 1024]
    - [15, 9667.8]
  - - [1024, 4096, 1, 8128, 1024, 1024, 1024, 4096]
    - [45, 11237.0]
  - - [4096, 1024, 1, 5104, 4096, 4096, 4096, 1024]
    - [0, 11082.4]
  - - [1024, 1024, 1, 7208, 1024, 1024, 1024, 1024]
    - [15, 9693.86]
  - - [1024, 4096, 1, 6384, 1024, 1024, 1024, 4096]
    - [46, 11252.1]
  - - [1024, 4096, 1, 5104, 1024, 1024, 1024, 4096]
    - [0, 11414.7]
  - - [1024, 4096, 1, 7776, 1024, 1024, 1024, 4096]
    - [47, 11295.4]
  - - [4096, 1024, 1, 5920, 4096, 4096, 4096, 1024]
    - [0, 11449.7]
  - - [1024, 1024, 1, 8600, 1024, 1024, 1024, 1024]
    - [44, 10069.8]
  - - [1024, 4096, 1, 8600, 1024, 1024, 1024, 4096]
    - [23, 11511.3]
  - - [1024, 33712, 1, 8648, 1024, 1024, 1024, 33712]
    - [45, 11666.5]
  - - [1024, 4096, 1, 5400, 1024, 1024, 1024, 4096]
    - [1, 11893.1]
  - - [1024, 1024, 1, 5400, 1024, 1024, 1024, 1024]
    - [15, 10367.5]
  - - [1024, 33712, 1, 9472, 1024, 1024, 1024, 33712]
    - [20, 11501.1]
  - - [4096, 1024, 1, 4352, 4096, 4096, 4096, 1024]
    - [3, 11896.2]
  - - [4096, 1024, 1, 5456, 4096, 4096, 4096, 1024]
    - [3, 11034.6]
  - - [1024, 1024, 1, 8520, 1024, 1024, 1024, 1024]
    - [15, 9698.89]
  - - [1024, 4096, 1, 8520, 1024, 1024, 1024, 4096]
    - [47, 11344.0]
  - - [1024, 33712, 1, 8784, 1024, 1024, 1024, 33712]
    - [45, 11663.6]
  - - [1024, 4096, 1, 6656, 1024, 1024, 1024, 4096]
    - [1, 11901.1]
  - - [1024, 4096, 1, 7656, 1024, 1024, 1024, 4096]
    - [48, 11338.8]
  - - [4096, 1024, 1, 6688, 4096, 4096, 4096, 1024]
    - [1, 11110.7]
  - - [1024, 1024, 1, 9768, 1024, 1024, 1024, 1024]
    - [15, 10340.1]
  - - [4096, 1024, 1, 5840, 4096, 4096, 4096, 1024]
    - [55, 11184.0]
  - - [1024, 1024, 1, 5104, 1024, 1024, 1024, 1024]
    - [15, 10359.1]
  - - [1024, 1024, 1, 2392, 1024, 1024, 1024, 1024]
    - [17, 10225.8]
  - - [1024, 4096, 1, 2392, 1024, 1024, 1024, 4096]
    - [27, 11082.5]
  - - [1024, 1024, 1, 3584, 1024, 1024, 1024, 1024]
    - [15, 9610.49]
  - - [4096, 1024, 1, 5200, 4096, 4096, 4096, 1024]
    - [23, 10734.7]
  - - [1024, 33712, 1, 9800, 1024, 1024, 1024, 33712]
    - [42, 11507.1]
  - - [4096, 1024, 1, 3584, 4096, 4096, 4096, 1024]
    - [5, 11943.3]
  - - [1024, 4096, 1, 8360, 1024, 1024, 1024, 4096]
    - [45, 11288.9]
  - - [1024, 33712, 1, 7968, 1024, 1024, 1024, 33712]
    - [45, 11844.9]
  - - [1024, 1024, 1, 7968, 1024, 1024, 1024, 1024]
    - [5, 10031.5]
  - - [1024, 4096, 1, 9640, 1024, 1024, 1024, 4096]
    - [45, 11270.7]
  - - [4096, 1024, 1, 5328, 4096, 4096, 4096, 1024]
    - [0, 11864.1]
  - - [1024, 1024, 1, 3696, 1024, 1024, 1024, 1024]
    - [24, 10222.4]
  - - [1024, 4096, 1, 5304, 1024, 1024, 1024, 4096]
    - [53, 11060.9]
  - - [1024, 4096, 1, 3696, 1024, 1024, 1024, 4096]
    - [0, 11746.2]
  - - [4096, 1024, 1, 8680, 4096, 4096, 4096, 1024]
    - [0, 11119.9]
  - - [1024, 33712, 1, 8400, 1024, 1024, 1024, 33712]
    - [45, 11825.1]
  - - [4096, 1024, 1, 3240, 4096, 4096, 4096, 1024]
    - [2, 11920.6]
  - - [1024, 33712, 1, 8520, 1024, 1024, 1024, 33712]
    - [20, 11793.8]
  - - [1024, 33712, 1, 6976, 1024, 1024, 1024, 33712]
    - [0, 12523.1]
  - - [1024, 33712, 1, 9576, 1024, 1024, 1024, 33712]
    - [56, 11401.4]
  - - [4096, 1024, 1, 3072, 4096, 4096, 4096, 1024]
    - [4, 12055.5]
  - - [1024, 1024, 1, 3072, 1024, 1024, 1024, 1024]
    - [15, 9593.8]
  - - [1024, 1024, 1, 5760, 1024, 1024, 1024, 1024]
    - [24, 10294.1]
  - - [4096, 1024, 1, 9040, 4096, 4096, 4096, 1024]
    - [6, 11839.4]
  - - [1024, 1024, 1, 2304, 1024, 1024, 1024, 1024]
    - [24, 10113.5]
  - - [4096, 1024, 1, 2304, 4096, 4096, 4096, 1024]
    - [0, 11876.5]
  - - [1024, 4096, 1, 2304, 1024, 1024, 1024, 4096]
    - [46, 10555.4]
  - - [1024, 1024, 1, 2880, 1024, 1024, 1024, 1024]
    - [24, 10180.3]
  - - [4096, 1024, 1, 3400, 4096, 4096, 4096, 1024]
    - [11, 11451.7]
  - - [1024, 4096, 1, 7744, 1024, 1024, 1024, 4096]
    - [48, 11362.6]
  - - [1024, 1024, 1, 9328, 1024, 1024, 1024, 1024]
    - [2, 9826.68]
  - - [1024, 33712, 1, 9880, 1024, 1024, 1024, 33712]
    - [20, 11415.2]
  - - [1024, 1024, 1, 9088, 1024, 1024, 1024, 1024]
    - [4, 10035.2]
  - - [4096, 1024, 1, 6384, 4096, 4096, 4096, 1024]
    - [46, 11402.0]
  - - [1024, 33712, 1, 9640, 1024, 1024, 1024, 33712]
    - [47, 11427.5]
  - - [4096, 1024, 1, 9640, 4096, 4096, 4096, 1024]
    - [3, 11965.8]
  - - [1024, 1024, 1, 6120, 1024, 1024, 1024, 1024]
    - [15, 9671.55]
  - - [4096, 1024, 1, 6120, 4096, 4096, 4096, 1024]
    - [55, 10900.4]
  - - [1024, 4096, 1, 6120, 1024, 1024, 1024, 4096]
    - [52, 10869.7]
  - - [4096, 1024, 1, 5016, 4096, 4096, 4096, 1024]
    - [0, 11516.6]
  - - [1024, 33712, 1, 9720, 1024, 1024, 1024, 33712]
    - [20, 11448.3]
  - - [4096, 1024, 1, 9720, 4096, 4096, 4096, 1024]
    - [1, 11939.9]
  - - [4096, 1024, 1, 9744, 4096, 4096, 4096, 1024]
    - [23, 11165.7]
  - - [1024, 33712, 1, 5840, 1024, 1024, 1024, 33712]
    - [5, 12269.0]
  - - [1024, 33712, 1, 8624, 1024, 1024, 1024, 33712]
    - [45, 11750.6]
  - - [4096, 1024, 1, 7504, 4096, 4096, 4096, 1024]
    - [3, 11954.2]
  - - [1024, 4096, 1, 7176, 1024, 1024, 1024, 4096]
    - [55, 11363.0]
  - - [1024, 4096, 1, 4608, 1024, 1024, 1024, 4096]
    - [1, 11484.1]
  - - [4096, 1024, 1, 8624, 4096, 4096, 4096, 1024]
    - [1, 11122.9]
  - - [1024, 4096, 1, 8624, 1024, 1024, 1024, 4096]
    - [47, 11452.5]
  - - [1024, 1024, 1, 8624, 1024, 1024, 1024, 1024]
    - [15, 10415.2]
  - - [1024, 1024, 1, 4216, 1024, 1024, 1024, 1024]
    - [15, 9635.54]
  - - [1024, 1024, 1, 6128, 1024, 1024, 1024, 1024]
    - [37, 10347.9]
  - - [1024, 33712, 1, 8120, 1024, 1024, 1024, 33712]
    - [20, 12089.8]
  - - [4096, 1024, 1, 4392, 4096, 4096, 4096, 1024]
    - [0, 11911.2]
  - - [1024, 4096, 1, 9176, 1024, 1024, 1024, 4096]
    - [47, 11132.4]
  - - [1024, 33712, 1, 8352, 1024, 1024, 1024, 33712]
    - [45, 11847.8]
  - - [1024, 33712, 1, 6336, 1024, 1024, 1024, 33712]
    - [0, 12660.8]
  - - [1024, 4096, 1, 6032, 1024, 1024, 1024, 4096]
    - [1, 11904.7]
  - - [1024, 4096, 1, 7640, 1024, 1024, 1024, 4096]
    - [54, 11477.5]
  - - [4096, 1024, 1, 6336, 4096, 4096, 4096, 1024]
    - [1, 11114.0]
  - - [4096, 1024, 1, 1224, 4096, 4096, 4096, 1024]
    - [46, 11207.2]
  - - [1024, 1024, 1, 10168, 1024, 1024, 1024, 1024]
    - [44, 10263.7]
  - - [1024, 4096, 1, 6336, 1024, 1024, 1024, 4096]
    - [52, 11277.8]
  - - [1024, 4096, 1, 8944, 1024, 1024, 1024, 4096]
    - [0, 11492.1]
  - - [1024, 1024, 1, 6336, 1024, 1024, 1024, 1024]
    - [24, 10307.4]
  - - [4096, 1024, 1, 9680, 4096, 4096, 4096, 1024]
    - [24, 10830.1]
  - - [1024, 1024, 1, 9648, 1024, 1024, 1024, 1024]
    - [15, 9711.1]
  - - [4096, 1024, 1, 9648, 4096, 4096, 4096, 1024]
    - [23, 11025.8]
  - - [1024, 4096, 1, 9648, 1024, 1024, 1024, 4096]
    - [23, 11429.9]
  - - [1024, 33712, 1, 9680, 1024, 1024, 1024, 33712]
    - [20, 11473.7]
  - - [1024, 4096, 1, 2880, 1024, 1024, 1024, 4096]
    - [1, 11899.6]
  - - [1024, 4096, 1, 7040, 1024, 1024, 1024, 4096]
    - [55, 11426.8]
  - - [1024, 4096, 1, 5440, 1024, 1024, 1024, 4096]
    - [23, 11339.5]
  - - [1024, 33712, 1, 9464, 1024, 1024, 1024, 33712]
    - [47, 11477.7]
  - - [1024, 1024, 1, 3040, 1024, 1024, 1024, 1024]
    - [15, 10282.8]
  - - [4096, 1024, 1, 8712, 4096, 4096, 4096, 1024]
    - [6, 11176.7]
  - - [4096, 1024, 1, 7200, 4096, 4096, 4096, 1024]
    - [0, 11561.2]
  - - [1024, 33712, 1, 10184, 1024, 1024, 1024, 33712]
    - [20, 11344.9]
  - - [1024, 1024, 1, 8040, 1024, 1024, 1024, 1024]
    - [15, 10406.0]
  - - [1024, 4096, 1, 8040, 1024, 1024, 1024, 4096]
    - [54, 11402.2]
  - - [1024, 33712, 1, 9864, 1024, 1024, 1024, 33712]
    - [47, 11291.1]
  - - [1024, 33712, 1, 9176, 1024, 1024, 1024, 33712]
    - [0, 11975.0]
  - - [1024, 1024, 1, 4864, 1024, 1024, 1024, 1024]
    - [5, 9980.16]
  - - [1024, 1024, 1, 6032, 1024, 1024, 1024, 1024]
    - [24, 10290.6]
  - - [1024, 33712, 1, 9152, 1024, 1024, 1024, 33712]
    - [20, 11553.6]
  - - [1024, 33712, 1, 8840, 1024, 1024, 1024, 33712]
    - [0, 11995.0]
  - - [1024, 1024, 1, 9928, 1024, 1024, 1024, 1024]
    - [4, 10016.8]
  - - [1024, 33712, 1, 4800, 1024, 1024, 1024, 33712]
    - [45, 12074.5]
  - - [4096, 1024, 1, 10176, 4096, 4096, 4096, 1024]
    - [20, 11088.3]
  - - [4096, 1024, 1, 4800, 4096, 4096, 4096, 1024]
    - [7, 10992.8]
  - - [1024, 1024, 1, 4800, 1024, 1024, 1024, 1024]
    - [15, 10363.1]
  - - [1024, 33712, 1, 8816, 1024, 1024, 1024, 33712]
    - [20, 11757.4]
  - - [4096, 1024, 1, 7680, 4096, 4096, 4096, 1024]
    - [3, 11957.0]
  - - [1024, 4096, 1, 9720, 1024, 1024, 1024, 4096]
    - [23, 11386.8]
  - - [1024, 1024, 1, 6784, 1024, 1024, 1024, 1024]
    - [2, 9822.05]
  - - [4096, 1024, 1, 6784, 4096, 4096, 4096, 1024]
    - [43, 11011.6]
  - - [1024, 1024, 1, 7728, 1024, 1024, 1024, 1024]
    - [5, 9346.88]
  - - [1024, 1024, 1, 5888, 1024, 1024, 1024, 1024]
    - [15, 9667.41]
  - - [1024, 4096, 1, 7728, 1024, 1024, 1024, 4096]
    - [48, 11467.5]
  - - [4096, 1024, 1, 4536, 4096, 4096, 4096, 1024]
    - [36, 11118.6]
  - - [1024, 33712, 1, 7056, 1024, 1024, 1024, 33712]
    - [45, 12060.3]
  - - [4096, 1024, 1, 7056, 4096, 4096, 4096, 1024]
    - [3, 11936.1]
  - - [1024, 4096, 1, 8112, 1024, 1024, 1024, 4096]
    - [47, 11126.0]
  - - [4096, 1024, 1, 7176, 4096, 4096, 4096, 1024]
    - [1, 11113.2]
  - - [1024, 4096, 1, 9200, 1024, 1024, 1024, 4096]
    - [23, 11394.3]
  - - [1024, 1024, 1, 7056, 1024, 1024, 1024, 1024]
    - [44, 10212.5]
  - - [4096, 1024, 1, 9968, 4096, 4096, 4096, 1024]
    - [32, 10944.7]
  - - [1024, 4096, 1, 9968, 1024, 1024, 1024, 4096]
    - [30, 11133.3]
  - - [1024, 33712, 1, 7616, 1024, 1024, 1024, 33712]
    - [45, 11952.2]
  - - [1024, 1024, 1, 9280, 1024, 1024, 1024, 1024]
    - [5, 10036.7]
  - - [4096, 1024, 1, 9280, 4096, 4096, 4096, 1024]
    - [24, 11021.9]
  - - [1024, 4096, 1, 9280, 1024, 1024, 1024, 4096]
    - [23, 11391.4]
  - - [1024, 1024, 1, 7344, 1024, 1024, 1024, 1024]
    - [3, 9811.33]
  - - [1024, 4096, 1, 7968, 1024, 1024, 1024, 4096]
    - [54, 11357.5]
  - - [4096, 1024, 1, 7344, 4096, 4096, 4096, 1024]
    - [1, 11115.4]
  - - [1024, 4096, 1, 7344, 1024, 1024, 1024, 4096]
    - [54, 11344.9]
  - - [1024, 4096, 1, 8816, 1024, 1024, 1024, 4096]
    - [0, 11420.5]
  - - [1024, 4096, 1, 7144, 1024, 1024, 1024, 4096]
    - [55, 11382.1]
  - - [1024, 4096, 1, 5016, 1024, 1024, 1024, 4096]
    - [1, 11276.1]
  - - [4096, 1024, 1, 8760, 4096, 4096, 4096, 1024]
    - [0, 11126.9]
  - - [4096, 1024, 1, 7400, 4096, 4096, 4096, 1024]
    - [0, 11796.0]
  - - [4096, 1024, 1, 9120, 4096, 4096, 4096, 1024]
    - [23, 11000.8]
  - - [1024, 1024, 1, 8800, 1024, 1024, 1024, 1024]
    - [15, 9704.92]
  - - [1024, 1024, 1, 7488, 1024, 1024, 1024, 1024]
    - [44, 9885.82]
  - - [1024, 4096, 1, 7488, 1024, 1024, 1024, 4096]
    - [55, 11481.8]
  - - [1024, 33712, 1, 4368, 1024, 1024, 1024, 33712]
    - [45, 11989.6]
  - - [1024, 33712, 1, 5568, 1024, 1024, 1024, 33712]
    - [45, 12092.8]
  - - [4096, 1024, 1, 9072, 4096, 4096, 4096, 1024]
    - [3, 11155.7]
  - - [1024, 33712, 1, 9840, 1024, 1024, 1024, 33712]
    - [54, 11264.3]
  - - [1024, 4096, 1, 5568, 1024, 1024, 1024, 4096]
    - [1, 11896.3]
  - - [1024, 1024, 1, 5568, 1024, 1024, 1024, 1024]
    - [37, 10346.0]
  - - [1024, 33712, 1, 7520, 1024, 1024, 1024, 33712]
    - [45, 12008.9]
  - - [4096, 1024, 1, 7520, 4096, 4096, 4096, 1024]
    - [1, 11915.2]
  - - [1024, 1024, 1, 6000, 1024, 1024, 1024, 1024]
    - [4, 9992.75]
  - - [1024, 33712, 1, 6864, 1024, 1024, 1024, 33712]
    - [45, 12067.3]
  - - [1024, 1024, 1, 6768, 1024, 1024, 1024, 1024]
    - [5, 10012.3]
  - - [1024, 4096, 1, 6768, 1024, 1024, 1024, 4096]
    - [55, 11253.2]
  - - [4096, 1024, 1, 6240, 4096, 4096, 4096, 1024]
    - [1, 11107.7]
  - - [1024, 1024, 1, 10040, 1024, 1024, 1024, 1024]
    - [15, 9706.86]
  - - [4096, 1024, 1, 10000, 4096, 4096, 4096, 1024]
    - [27, 11009.6]
  - - [1024, 1024, 1, 7480, 1024, 1024, 1024, 1024]
    - [15, 10402.3]
  - - [1024, 1024, 1, 7680, 1024, 1024, 1024, 1024]
    - [16, 10357.3]
  - - [1024, 4096, 1, 7680, 1024, 1024, 1024, 4096]
    - [55, 11418.2]
  - - [4096, 1024, 1, 9144, 4096, 4096, 4096, 1024]
    - [1, 11126.2]
  - - [1024, 1024, 1, 7440, 1024, 1024, 1024, 1024]
    - [15, 9691.64]
  - - [4096, 1024, 1, 4472, 4096, 4096, 4096, 1024]
    - [24, 10731.9]
  - - [1024, 33712, 1, 6032, 1024, 1024, 1024, 33712]
    - [45, 12095.7]
  - - [4096, 1024, 1, 9296, 4096, 4096, 4096, 1024]
    - [2, 11600.1]
  - - [1024, 4096, 1, 9296, 1024, 1024, 1024, 4096]
    - [24, 11118.7]
  - - [4096, 1024, 1, 5472, 4096, 4096, 4096, 1024]
    - [0, 11863.3]
  - - [4096, 1024, 1, 5776, 4096, 4096, 4096, 1024]
    - [24, 10794.5]
  - - [1024, 1024, 1, 4600, 1024, 1024, 1024, 1024]
    - [24, 10257.4]
  - - [4096, 1024, 1, 9512, 4096, 4096, 4096, 1024]
    - [8, 11039.8]
  - - [1024, 33712, 1, 9928, 1024, 1024, 1024, 33712]
    - [20, 11209.1]
  - - [1024, 33712, 1, 10032, 1024, 1024, 1024, 33712]
    - [0, 11472.3]
  - - [1024, 1024, 1, 7632, 1024, 1024, 1024, 1024]
    - [5, 10028.5]
  - - [4096, 1024, 1, 4896, 4096, 4096, 4096, 1024]
    - [24, 10781.2]
  - - [1024, 4096, 1, 4896, 1024, 1024, 1024, 4096]
    - [53, 10915.1]
  - - [1024, 4096, 1, 8120, 1024, 1024, 1024, 4096]
    - [54, 11395.4]
  - - [4096, 1024, 1, 8128, 4096, 4096, 4096, 1024]
    - [1, 11120.3]
  - - [1024, 1024, 1, 8128, 1024, 1024, 1024, 1024]
    - [15, 10410.9]
  - - [4096, 1024, 1, 6128, 4096, 4096, 4096, 1024]
    - [46, 11208.6]
  - - [1024, 4096, 1, 6128, 1024, 1024, 1024, 4096]
    - [15, 10975.4]
  - - [1024, 4096, 1, 7400, 1024, 1024, 1024, 4096]
    - [48, 11532.4]
  - - [4096, 1024, 1, 5632, 4096, 4096, 4096, 1024]
    - [57, 11277.5]
  - - [1024, 1024, 1, 7224, 1024, 1024, 1024, 1024]
    - [15, 9685.57]
  - - [1024, 4096, 1, 5632, 1024, 1024, 1024, 4096]
    - [53, 10990.0]
  - - [4096, 1024, 1, 4560, 4096, 4096, 4096, 1024]
    - [1, 11542.8]
  - - [1024, 1024, 1, 9800, 1024, 1024, 1024, 1024]
    - [24, 10340.5]
  - - [1024, 1024, 1, 7568, 1024, 1024, 1024, 1024]
    - [15, 10157.2]
  - - [4096, 1024, 1, 7568, 4096, 4096, 4096, 1024]
    - [48, 11214.8]
  - - [1024, 4096, 1, 7568, 1024, 1024, 1024, 4096]
    - [54, 11439.2]
  - - [1024, 33712, 1, 6912, 1024, 1024, 1024, 33712]
    - [45, 12056.7]
  - - [1024, 33712, 1, 7992, 1024, 1024, 1024, 33712]
    - [0, 11898.2]
  - - [4096, 1024, 1, 7992, 4096, 4096, 4096, 1024]
    - [1, 11926.7]
  - - [1024, 33712, 1, 9288, 1024, 1024, 1024, 33712]
    - [45, 11443.7]
  - - [1024, 4096, 1, 7992, 1024, 1024, 1024, 4096]
    - [1, 11896.9]
  - - [1024, 1024, 1, 7992, 1024, 1024, 1024, 1024]
    - [2, 9786.29]
  - - [1024, 1024, 1, 8576, 1024, 1024, 1024, 1024]
    - [44, 10248.6]
  - - [1024, 33712, 1, 4160, 1024, 1024, 1024, 33712]
    - [47, 11976.9]
  - - [1024, 1024, 1, 5936, 1024, 1024, 1024, 1024]
    - [44, 10060.0]
  - - [4096, 1024, 1, 7384, 4096, 4096, 4096, 1024]
    - [46, 11037.6]
  - - [4096, 1024, 1, 6440, 4096, 4096, 4096, 1024]
    - [46, 11299.9]
  - - [1024, 4096, 1, 7384, 1024, 1024, 1024, 4096]
    - [54, 11323.0]
  - - [4096, 1024, 1, 2040, 4096, 4096, 4096, 1024]
    - [5, 11192.4]
  - - [1024, 33712, 1, 7344, 1024, 1024, 1024, 33712]
    - [45, 12025.8]
  - - [4096, 1024, 1, 8616, 4096, 4096, 4096, 1024]
    - [1, 11929.6]
  - - [1024, 4096, 1, 5784, 1024, 1024, 1024, 4096]
    - [0, 11752.4]
  - - [1024, 1024, 1, 5776, 1024, 1024, 1024, 1024]
    - [3, 9804.06]
  - - [1024, 4096, 1, 5776, 1024, 1024, 1024, 4096]
    - [52, 11209.6]
  - - [1024, 4096, 1, 6664, 1024, 1024, 1024, 4096]
    - [0, 11508.8]
  - - [1024, 4096, 1, 9112, 1024, 1024, 1024, 4096]
    - [45, 11198.0]
  - - [4096, 1024, 1, 8016, 4096, 4096, 4096, 1024]
    - [1, 11119.7]
  - - [1024, 4096, 1, 8016, 1024, 1024, 1024, 4096]
    - [47, 11352.1]
  - - [1024, 1024, 1, 7920, 1024, 1024, 1024, 1024]
    - [2, 9816.43]
  - - [1024, 1024, 1, 912, 1024, 1024, 1024, 1024]
    - [17, 9879.15]
  - - [1024, 33712, 1, 6968, 1024, 1024, 1024, 33712]
    - [7, 12098.7]
  - - [1024, 1024, 1, 6240, 1024, 1024, 1024, 1024]
    - [44, 10062.6]
  - - [1024, 4096, 1, 8000, 1024, 1024, 1024, 4096]
    - [47, 11419.2]
  - - [4096, 1024, 1, 7696, 4096, 4096, 4096, 1024]
    - [48, 11403.2]
  - - [1024, 1024, 1, 6696, 1024, 1024, 1024, 1024]
    - [16, 9692.5]
  - - [4096, 1024, 1, 5040, 4096, 4096, 4096, 1024]
    - [38, 10703.2]
  - - [1024, 33712, 1, 8712, 1024, 1024, 1024, 33712]
    - [54, 11616.7]
  - - [1024, 1024, 1, 5040, 1024, 1024, 1024, 1024]
    - [15, 10370.5]
  - - [4096, 1024, 1, 7144, 4096, 4096, 4096, 1024]
    - [45, 11084.0]
  - - [4096, 1024, 1, 8360, 4096, 4096, 4096, 1024]
    - [1, 11124.7]
  - - [1024, 1024, 1, 8360, 1024, 1024, 1024, 1024]
    - [1, 9760.9]
  - - [1024, 33712, 1, 7176, 1024, 1024, 1024, 33712]
    - [45, 12065.2]
  - - [1024, 1024, 1, 7176, 1024, 1024, 1024, 1024]
    - [5, 10014.6]
  - - [1024, 33712, 1, 7488, 1024, 1024, 1024, 33712]
    - [45, 12021.2]
  - - [1024, 4096, 1, 5576, 1024, 1024, 1024, 4096]
    - [1, 11899.8]
  - - [4096, 1024, 1, 2880, 4096, 4096, 4096, 1024]
    - [1, 11741.4]
  - - [4096, 1024, 1, 8184, 4096, 4096, 4096, 1024]
    - [55, 11376.2]
  - - [1024, 33712, 1, 9328, 1024, 1024, 1024, 33712]
    - [20, 11561.8]
  - - [4096, 1024, 1, 7072, 4096, 4096, 4096, 1024]
    - [3, 11943.5]
  - - [4096, 1024, 1, 10184, 4096, 4096, 4096, 1024]
    - [31, 11404.4]
  - - [1024, 33712, 1, 9120, 1024, 1024, 1024, 33712]
    - [20, 11667.2]
  - - [4096, 1024, 1, 7688, 4096, 4096, 4096, 1024]
    - [3, 11946.7]
  - - [1024, 33712, 1, 4352, 1024, 1024, 1024, 33712]
    - [45, 12116.1]
  - - [1024, 33712, 1, 5120, 1024, 1024, 1024, 33712]
    - [45, 12098.5]
  - - [1024, 4096, 1, 4352, 1024, 1024, 1024, 4096]
    - [5, 11118.3]
  - - [1024, 1024, 1, 4352, 1024, 1024, 1024, 1024]
    - [15, 9638.79]
  - - [4096, 1024, 1, 6000, 4096, 4096, 4096, 1024]
    - [14, 10997.9]
  - - [1024, 4096, 1, 9680, 1024, 1024, 1024, 4096]
    - [23, 11334.1]
  - - [1024, 1024, 1, 9680, 1024, 1024, 1024, 1024]
    - [44, 9949.6]
  - - [1024, 1024, 1, 10112, 1024, 1024, 1024, 1024]
    - [24, 10261.7]
  - - [1024, 33712, 1, 9312, 1024, 1024, 1024, 33712]
    - [20, 11559.2]
  - - [4096, 1024, 1, 5880, 4096, 4096, 4096, 1024]
    - [1, 11901.8]
  - - [1024, 4096, 1, 5880, 1024, 1024, 1024, 4096]
    - [52, 11274.6]
  - - [4096, 1024, 1, 5120, 4096, 4096, 4096, 1024]
    - [23, 11154.6]
  - - [1024, 4096, 1, 9576, 1024, 1024, 1024, 4096]
    - [23, 11315.2]
  - - [1024, 1024, 1, 3864, 1024, 1024, 1024, 1024]
    - [15, 10317.0]
  - - [1024, 33712, 1, 7872, 1024, 1024, 1024, 33712]
    - [13, 11947.4]
  - - [1024, 4096, 1, 10080, 1024, 1024, 1024, 4096]
    - [1, 11801.7]
  - - [1024, 33712, 1, 8512, 1024, 1024, 1024, 33712]
    - [20, 11760.1]
  - - [1024, 33712, 1, 9048, 1024, 1024, 1024, 33712]
    - [0, 11705.0]
  - - [1024, 1024, 1, 6360, 1024, 1024, 1024, 1024]
    - [15, 10395.5]
  - - [1024, 33712, 1, 7680, 1024, 1024, 1024, 33712]
    - [45, 11947.2]
  - - [1024, 1024, 1, 7888, 1024, 1024, 1024, 1024]
    - [5, 10023.2]
  - - [4096, 1024, 1, 7888, 4096, 4096, 4096, 1024]
    - [45, 11023.5]
  - - [1024, 4096, 1, 7888, 1024, 1024, 1024, 4096]
    - [47, 11317.3]
  - - [1024, 33712, 1, 8680, 1024, 1024, 1024, 33712]
    - [45, 11685.9]
  - - [1024, 4096, 1, 9864, 1024, 1024, 1024, 4096]
    - [1, 11849.4]
  - - [1024, 33712, 1, 2720, 1024, 1024, 1024, 33712]
    - [0, 12210.7]
  - - [1024, 1024, 1, 8680, 1024, 1024, 1024, 1024]
    - [37, 10374.8]
  - - [4096, 1024, 1, 9752, 4096, 4096, 4096, 1024]
    - [23, 11188.6]
  - - [4096, 1024, 1, 4488, 4096, 4096, 4096, 1024]
    - [0, 11070.3]
  - - [1024, 1024, 1, 8120, 1024, 1024, 1024, 1024]
    - [15, 10407.8]
  - - [1024, 4096, 1, 6696, 1024, 1024, 1024, 4096]
    - [55, 11401.5]
  - - [1024, 4096, 1, 6000, 1024, 1024, 1024, 4096]
    - [52, 11097.2]
  - - [1024, 33712, 1, 8880, 1024, 1024, 1024, 33712]
    - [45, 11668.0]
  - - [1024, 1024, 1, 8536, 1024, 1024, 1024, 1024]
    - [5, 10024.4]
  - - [1024, 33712, 1, 9240, 1024, 1024, 1024, 33712]
    - [20, 11625.6]
  - - [4096, 1024, 1, 8536, 4096, 4096, 4096, 1024]
    - [3, 11957.1]
  - - [1024, 4096, 1, 8536, 1024, 1024, 1024, 4096]
    - [0, 11478.4]
  - - [1024, 33712, 1, 7744, 1024, 1024, 1024, 33712]
    - [45, 11991.1]
  - - [1024, 1024, 1, 8712, 1024, 1024, 1024, 1024]
    - [4, 10026.3]
  - - [1024, 4096, 1, 8712, 1024, 1024, 1024, 4096]
    - [47, 11379.7]
  - - [4096, 1024, 1, 9952, 4096, 4096, 4096, 1024]
    - [0, 11526.5]
  - - [4096, 1024, 1, 3808, 4096, 4096, 4096, 1024]
    - [0, 11059.0]
  - - [4096, 1024, 1, 6968, 4096, 4096, 4096, 1024]
    - [43, 11177.1]
  - - [1024, 4096, 1, 6968, 1024, 1024, 1024, 4096]
    - [55, 11371.6]
  - - [1024, 1024, 1, 5632, 1024, 1024, 1024, 1024]
    - [44, 10061.3]
  - - [1024, 33712, 1, 9144, 1024, 1024, 1024, 33712]
    - [20, 11545.3]
  - - [1024, 4096, 1, 912, 1024, 1024, 1024, 4096]
    - [4, 11858.9]
  - - [1024, 33712, 1, 10000, 1024, 1024, 1024, 33712]
    - [20, 11279.2]
  - - [1024, 4096, 1, 6272, 1024, 1024, 1024, 4096]
    - [1, 11901.3]
  - - [1024, 1024, 1, 6272, 1024, 1024, 1024, 1024]
    - [15, 10386.4]
  - - [4096, 1024, 1, 10112, 4096, 4096, 4096, 1024]
    - [27, 11069.2]
  - - [4096, 1024, 1, 5304, 4096, 4096, 4096, 1024]
    - [7, 10998.3]
  - - [4096, 1024, 1, 5984, 4096, 4096, 4096, 1024]
    - [35, 11351.1]
  - - [1024, 33712, 1, 9088, 1024, 1024, 1024, 33712]
    - [20, 11596.7]
  - - [1024, 1024, 1, 3400, 1024, 1024, 1024, 1024]
    - [44, 10179.2]
  - - [4096, 1024, 1, 9088, 4096, 4096, 4096, 1024]
    - [0, 11120.8]
  - - [4096, 1024, 1, 6528, 4096, 4096, 4096, 1024]
    - [1, 11109.3]
  - - [1024, 1024, 1, 7616, 1024, 1024, 1024, 1024]
    - [15, 9692.6]
  - - [1024, 33712, 1, 7688, 1024, 1024, 1024, 33712]
    - [47, 12043.2]
  - - [1024, 4096, 1, 9048, 1024, 1024, 1024, 4096]
    - [1, 11911.8]
  - - [1024, 1024, 1, 8640, 1024, 1024, 1024, 1024]
    - [15, 9702.36]
  - - [1024, 4096, 1, 7688, 1024, 1024, 1024, 4096]
    - [48, 11383.9]
  - - [1024, 1024, 1, 7688, 1024, 1024, 1024, 1024]
    - [2, 9807.09]
  - - [4096, 1024, 1, 6696, 4096, 4096, 4096, 1024]
    - [48, 11439.7]
  - - [1024, 33712, 1, 5016, 1024, 1024, 1024, 33712]
    - [45, 12062.9]
  - - [1024, 33712, 1, 9424, 1024, 1024, 1024, 33712]
    - [42, 11458.9]
  - - [1024, 4096, 1, 5840, 1024, 1024, 1024, 4096]
    - [1, 11896.2]
  - - [1024, 1024, 1, 10176, 1024, 1024, 1024, 1024]
    - [24, 10222.9]
  - - [1024, 33712, 1, 7360, 1024, 1024, 1024, 33712]
    - [12, 12094.1]
  - - [4096, 1024, 1, 4608, 4096, 4096, 4096, 1024]
    - [0, 11904.6]
  - - [4096, 1024, 1, 7360, 4096, 4096, 4096, 1024]
    - [55, 11276.6]
  - - [1024, 1024, 1, 8216, 1024, 1024, 1024, 1024]
    - [15, 9699.04]
  - - [4096, 1024, 1, 4216, 4096, 4096, 4096, 1024]
    - [23, 11085.2]
  - - [4096, 1024, 1, 9424, 4096, 4096, 4096, 1024]
    - [23, 11169.6]
  - - [1024, 4096, 1, 9424, 1024, 1024, 1024, 4096]
    - [0, 11031.9]
  - - [1024, 4096, 1, 5456, 1024, 1024, 1024, 4096]
    - [1, 11484.3]
  - - [4096, 1024, 1, 4160, 4096, 4096, 4096, 1024]
    - [0, 11826.4]
  - - [1024, 4096, 1, 7208, 1024, 1024, 1024, 4096]
    - [48, 11407.8]
  - - [1024, 4096, 1, 3072, 1024, 1024, 1024, 4096]
    - [1, 11098.5]
  - - [4096, 1024, 1, 10160, 4096, 4096, 4096, 1024]
    - [0, 11393.4]
  - - [1024, 4096, 1, 4160, 1024, 1024, 1024, 4096]
    - [23, 11272.1]
  - - [1024, 33712, 1, 9024, 1024, 1024, 1024, 33712]
    - [20, 11537.0]
  - - [1024, 1024, 1, 7128, 1024, 1024, 1024, 1024]
    - [15, 10398.2]
  - - [1024, 4096, 1, 7128, 1024, 1024, 1024, 4096]
    - [54, 11473.7]
  - - [1024, 4096, 1, 9248, 1024, 1024, 1024, 4096]
    - [23, 11325.9]
  - - [1024, 4096, 1, 4488, 1024, 1024, 1024, 4096]
    - [1, 11757.9]
  - - [1024, 1024, 1, 4480, 1024, 1024, 1024, 1024]
    - [15, 10345.3]
  - - [1024, 4096, 1, 4480, 1024, 1024, 1024, 4096]
    - [8, 11022.1]
  - - [1024, 4096, 1, 10032, 1024, 1024, 1024, 4096]
    - [30, 11200.7]
  - - [4096, 1024, 1, 9200, 4096, 4096, 4096, 1024]
    - [23, 11168.7]
  - - [4096, 1024, 1, 9600, 4096, 4096, 4096, 1024]
    - [0, 11122.7]
  - - [1024, 4096, 1, 5936, 1024, 1024, 1024, 4096]
    - [52, 11032.1]
  - - [1024, 4096, 1, 3864, 1024, 1024, 1024, 4096]
    - [1, 11060.5]
  - - [1024, 33712, 1, 7392, 1024, 1024, 1024, 33712]
    - [45, 11984.7]
  - - [1024, 4096, 1, 7216, 1024, 1024, 1024, 4096]
    - [1, 11907.1]
  - - [1024, 4096, 1, 7520, 1024, 1024, 1024, 4096]
    - [48, 11432.2]
  - - [4096, 1024, 1, 7192, 4096, 4096, 4096, 1024]
    - [0, 11386.6]
  - - [1024, 4096, 1, 7192, 1024, 1024, 1024, 4096]
    - [55, 11456.8]
  - - [1024, 1024, 1, 7192, 1024, 1024, 1024, 1024]
    - [16, 9648.59]
  - - [1024, 1024, 1, 9288, 1024, 1024, 1024, 1024]
    - [15, 9703.44]
  - - [4096, 1024, 1, 2592, 4096, 4096, 4096, 1024]
    - [45, 11427.4]
  - - [1024, 4096, 1, 2592, 1024, 1024, 1024, 4096]
    - [47, 10516.6]
  - - [4096, 1024, 1, 6816, 4096, 4096, 4096, 1024]
    - [0, 11775.2]
  - - [4096, 1024, 1, 1584, 4096, 4096, 4096, 1024]
    - [15, 11650.8]
  - - [1024, 1024, 1, 8592, 1024, 1024, 1024, 1024]
    - [15, 9701.65]
  - - [1024, 4096, 1, 4536, 1024, 1024, 1024, 4096]
    - [23, 11567.5]
  - - [1024, 1024, 1, 4536, 1024, 1024, 1024, 1024]
    - [15, 10343.4]
  - - [4096, 1024, 1, 8512, 4096, 4096, 4096, 1024]
    - [37, 10833.7]
  - - [1024, 33712, 1, 6048, 1024, 1024, 1024, 33712]
    - [27, 12185.3]
  - - [1024, 1024, 1, 6880, 1024, 1024, 1024, 1024]
    - [4, 10006.4]
  - - [1024, 4096, 1, 6880, 1024, 1024, 1024, 4096]
    - [46, 11302.5]
  - - [1024, 1024, 1, 9000, 1024, 1024, 1024, 1024]
    - [2, 9815.65]
  - - [1024, 4096, 1, 9000, 1024, 1024, 1024, 4096]
    - [47, 11290.4]
  - - [1024, 4096, 1, 9936, 1024, 1024, 1024, 4096]
    - [23, 11439.7]
  - - [1024, 33712, 1, 4608, 1024, 1024, 1024, 33712]
    - [45, 12057.0]
  - - [1024, 1024, 1, 4608, 1024, 1024, 1024, 1024]
    - [15, 9637.43]
  - - [1024, 1024, 1, 2112, 1024, 1024, 1024, 1024]
    - [15, 9512.83]
  - - [1024, 33712, 1, 7776, 1024, 1024, 1024, 33712]
    - [45, 11965.7]
  - - [4096, 1024, 1, 8112, 4096, 4096, 4096, 1024]
    - [1, 11923.6]
  - - [1024, 1024, 1, 8112, 1024, 1024, 1024, 1024]
    - [15, 10405.7]
  - - [1024, 4096, 1, 8568, 1024, 1024, 1024, 4096]
    - [47, 11369.2]
  - - [1024, 4096, 1, 4048, 1024, 1024, 1024, 4096]
    - [1, 11489.3]
  - - [1024, 1024, 1, 4048, 1024, 1024, 1024, 1024]
    - [16, 10290.5]
  - - [1024, 4096, 1, 8256, 1024, 1024, 1024, 4096]
    - [54, 11428.1]
  - - [1024, 4096, 1, 7632, 1024, 1024, 1024, 4096]
    - [54, 11327.6]
  - - [1024, 1024, 1, 7656, 1024, 1024, 1024, 1024]
    - [15, 10406.4]
  - - [4096, 1024, 1, 7656, 4096, 4096, 4096, 1024]
    - [48, 11262.8]
  - - [1024, 4096, 1, 2720, 1024, 1024, 1024, 4096]
    - [3, 11067.6]
  - - [1024, 33712, 1, 7144, 1024, 1024, 1024, 33712]
    - [45, 12096.9]
  - - [1024, 4096, 1, 1232, 1024, 1024, 1024, 4096]
    - [5, 11928.4]
  - - [1024, 33712, 1, 7400, 1024, 1024, 1024, 33712]
    - [45, 11996.0]
  - - [4096, 1024, 1, 9864, 4096, 4096, 4096, 1024]
    - [1, 11932.8]
  - - [1024, 1024, 1, 9864, 1024, 1024, 1024, 1024]
    - [37, 10385.5]
  - - [1024, 1024, 1, 4392, 1024, 1024, 1024, 1024]
    - [15, 10340.7]
  - - [1024, 4096, 1, 4392, 1024, 1024, 1024, 4096]
    - [23, 11509.3]
  - - [1024, 33712, 1, 6664, 1024, 1024, 1024, 33712]
    - [17, 12276.6]
  - - [1024, 4096, 1, 8544, 1024, 1024, 1024, 4096]
    - [1, 11899.0]
  - - [1024, 1024, 1, 7392, 1024, 1024, 1024, 1024]
    - [37, 10367.9]
  - - [1024, 33712, 1, 7208, 1024, 1024, 1024, 33712]
    - [45, 12055.0]
  - - [1024, 4096, 1, 8496, 1024, 1024, 1024, 4096]
    - [1, 11867.5]
  - - [1024, 1024, 1, 4968, 1024, 1024, 1024, 1024]
    - [15, 10352.4]
  - - [1024, 4096, 1, 8464, 1024, 1024, 1024, 4096]
    - [45, 11313.1]
  - - [4096, 1024, 1, 8256, 4096, 4096, 4096, 1024]
    - [1, 11121.8]
  - - [1024, 4096, 1, 1856, 1024, 1024, 1024, 4096]
    - [0, 11846.5]
  - - [1024, 33712, 1, 7840, 1024, 1024, 1024, 33712]
    - [45, 11930.9]
  - - [4096, 1024, 1, 8352, 4096, 4096, 4096, 1024]
    - [1, 11930.5]
  - - [1024, 4096, 1, 8528, 1024, 1024, 1024, 4096]
    - [0, 11601.2]
  - - [4096, 1024, 1, 6656, 4096, 4096, 4096, 1024]
    - [0, 11847.4]
  - - [1024, 33712, 1, 3256, 1024, 1024, 1024, 33712]
    - [51, 12015.8]
  - - [1024, 4096, 1, 3256, 1024, 1024, 1024, 4096]
    - [46, 10529.7]
  - - [1024, 33712, 1, 7888, 1024, 1024, 1024, 33712]
    - [45, 11960.9]
  - - [1024, 4096, 1, 5328, 1024, 1024, 1024, 4096]
    - [1, 11882.8]
  - - [1024, 33712, 1, 6840, 1024, 1024, 1024, 33712]
    - [7, 12115.8]
  - - [4096, 1024, 1, 6840, 4096, 4096, 4096, 1024]
    - [0, 11904.5]
  - - [1024, 4096, 1, 6840, 1024, 1024, 1024, 4096]
    - [27, 11354.6]
  - - [1024, 1024, 1, 6840, 1024, 1024, 1024, 1024]
    - [15, 9685.93]
  - - [4096, 1024, 1, 6512, 4096, 4096, 4096, 1024]
    - [55, 11606.4]
  - - [1024, 4096, 1, 7752, 1024, 1024, 1024, 4096]
    - [54, 11413.0]
  - - [1024, 33712, 1, 3360, 1024, 1024, 1024, 33712]
    - [0, 11909.8]
  - - [4096, 1024, 1, 3360, 4096, 4096, 4096, 1024]
    - [46, 11126.1]
  - - [1024, 1024, 1, 3360, 1024, 1024, 1024, 1024]
    - [18, 10289.7]
  - - [1024, 1024, 1, 4160, 1024, 1024, 1024, 1024]
    - [15, 9650.59]
  - - [1024, 1024, 1, 6528, 1024, 1024, 1024, 1024]
    - [24, 10306.4]
  - - [1024, 4096, 1, 9144, 1024, 1024, 1024, 4096]
    - [45, 11315.9]
  - - [1024, 33712, 1, 8128, 1024, 1024, 1024, 33712]
    - [45, 11848.1]
  - - [1024, 1024, 1, 9144, 1024, 1024, 1024, 1024]
    - [5, 10026.9]
  - - [1024, 4096, 1, 1224, 1024, 1024, 1024, 4096]
    - [45, 11370.1]
  - - [4096, 1024, 1, 7632, 4096, 4096, 4096, 1024]
    - [46, 10933.6]
  - - [4096, 1024, 1, 4224, 4096, 4096, 4096, 1024]
    - [1, 11811.8]
  - - [1024, 1024, 1, 9296, 1024, 1024, 1024, 1024]
    - [15, 10385.6]
  - - [1024, 1024, 1, 1232, 1024, 1024, 1024, 1024]
    - [17, 10023.6]
  - - [4096, 1024, 1, 6664, 4096, 4096, 4096, 1024]
    - [46, 11204.7]
  - - [1024, 1024, 1, 4472, 1024, 1024, 1024, 1024]
    - [24, 10256.4]
  - - [4096, 1024, 1, 5568, 4096, 4096, 4096, 1024]
    - [23, 10984.4]
  - - [1024, 4096, 1, 4472, 1024, 1024, 1024, 4096]
    - [52, 10591.8]
  - - [4096, 1024, 1, 3864, 4096, 4096, 4096, 1024]
    - [9, 11413.2]
  - - [1024, 1024, 1, 7448, 1024, 1024, 1024, 1024]
    - [15, 9692.43]
  - - [1024, 4096, 1, 1584, 1024, 1024, 1024, 4096]
    - [41, 11046.4]
  - - [4096, 1024, 1, 6048, 4096, 4096, 4096, 1024]
    - [46, 11438.2]
  - - [1024, 33712, 1, 5632, 1024, 1024, 1024, 33712]
    - [27, 12404.8]
  - - [1024, 1024, 1, 9048, 1024, 1024, 1024, 1024]
    - [5, 10037.5]
  - - [1024, 33712, 1, 9512, 1024, 1024, 1024, 33712]
    - [20, 11428.8]
  - - [1024, 1024, 1, 7904, 1024, 1024, 1024, 1024]
    - [5, 10033.8]
  - - [1024, 33712, 1, 4640, 1024, 1024, 1024, 33712]
    - [45, 12038.8]
  - - [1024, 33712, 1, 5720, 1024, 1024, 1024, 33712]
    - [27, 12276.2]
  - - [4096, 1024, 1, 5720, 4096, 4096, 4096, 1024]
    - [3, 11180.4]
  - - [1024, 4096, 1, 5720, 1024, 1024, 1024, 4096]
    - [52, 11206.7]
  - - [1024, 1024, 1, 5720, 1024, 1024, 1024, 1024]
    - [24, 10290.0]
  - - [1024, 33712, 1, 6600, 1024, 1024, 1024, 33712]
    - [12, 12309.8]
  - - [4096, 1024, 1, 6600, 4096, 4096, 4096, 1024]
    - [3, 11937.8]
  - - [1024, 1024, 1, 8296, 1024, 1024, 1024, 1024]
    - [37, 10383.6]
  - - [1024, 1024, 1, 6664, 1024, 1024, 1024, 1024]
    - [15, 9681.46]
  - - [1024, 4096, 1, 3400, 1024, 1024, 1024, 4096]
    - [45, 11169.7]
  - - [1024, 33712, 1, 4600, 1024, 1024, 1024, 33712]
    - [45, 12031.4]
  - - [1024, 1024, 1, 5880, 1024, 1024, 1024, 1024]
    - [15, 10379.8]
  - - [4096, 1024, 1, 4600, 4096, 4096, 4096, 1024]
    - [7, 10979.3]
  - - [1024, 1024, 1, 8256, 1024, 1024, 1024, 1024]
    - [15, 9698.22]
  - - [1024, 1024, 1, 9776, 1024, 1024, 1024, 1024]
    - [15, 9710.19]
  - - [1024, 33712, 1, 9000, 1024, 1024, 1024, 33712]
    - [20, 11626.7]
  - - [1024, 33712, 1, 8432, 1024, 1024, 1024, 33712]
    - [0, 12152.4]
  - - [1024, 1024, 1, 6440, 1024, 1024, 1024, 1024]
    - [37, 10341.8]
  - - [4096, 1024, 1, 7480, 4096, 4096, 4096, 1024]
    - [48, 11287.3]
  - - [1024, 4096, 1, 4080, 1024, 1024, 1024, 4096]
    - [23, 10716.9]
  - - [1024, 33712, 1, 7200, 1024, 1024, 1024, 33712]
    - [7, 12050.7]
  - - [1024, 33712, 1, 7640, 1024, 1024, 1024, 33712]
    - [0, 12116.5]
  - - [1024, 1024, 1, 8008, 1024, 1024, 1024, 1024]
    - [37, 10373.8]
  - - [1024, 1024, 1, 9472, 1024, 1024, 1024, 1024]
    - [15, 9709.16]
  - - [1024, 4096, 1, 8616, 1024, 1024, 1024, 4096]
    - [47, 11448.3]
  - - [4096, 1024, 1, 4864, 4096, 4096, 4096, 1024]
    - [3, 11111.7]
  - - [1024, 4096, 1, 9912, 1024, 1024, 1024, 4096]
    - [23, 10993.9]
  - - [1024, 33712, 1, 8232, 1024, 1024, 1024, 33712]
    - [45, 11951.8]
  - - [1024, 1024, 1, 9400, 1024, 1024, 1024, 1024]
    - [4, 10023.4]
  - - [4096, 1024, 1, 5800, 4096, 4096, 4096, 1024]
    - [24, 10713.3]
  - - [4096, 1024, 1, 7216, 4096, 4096, 4096, 1024]
    - [48, 11561.1]
  - - [1024, 1024, 1, 7696, 1024, 1024, 1024, 1024]
    - [15, 9691.84]
  - - [1024, 4096, 1, 6240, 1024, 1024, 1024, 4096]
    - [46, 11297.6]
- null
