src/Tensile/data/Configs/miopen/archives/transformer/2020-09-01/exact/vega20_Cijk_Ailk_Bljk_HBH.yaml
- {MinimumRequiredVersion: 4.22.0}
- vega20
- gfx906
- [Device 66a0, Device 66a1, Device 66a7, Device 66af, Vega 20]
    SolutionIndex: 0
    SolutionNameMin: Cijk_Ailk_Bljk_HBH_MT64x64x8_SE_GRVW2_LRVW2_TT4_4_VW2_WG16_16_1_WGM1
    SolutionIndex: 1
    SolutionNameMin: Cijk_Ailk_Bljk_HBH_MT64x64x8_SE_GRVW2_LRVW2_TT4_4_VW2_WG16_16_1_WGM8
    SolutionIndex: 2
    SolutionNameMin: Cijk_Ailk_Bljk_HBH_MT64x64x16_SE_GRVW2_LRVW2_TT4_4_VW2_WG16_16_1_WGM1
    SolutionIndex: 3
    SolutionNameMin: Cijk_Ailk_Bljk_HBH_MT64x64x16_SE_GRVW2_LRVW2_TT4_4_VW2_WG16_16_1_WGM8
    SolutionIndex: 4
    SolutionNameMin: Cijk_Ailk_Bljk_HBH_MT64x64x8_SE_GRVW4_LRVW4_TT4_4_VW4_WG16_16_1_WGM1
    SolutionIndex: 5
    SolutionNameMin: Cijk_Ailk_Bljk_HBH_MT64x64x8_SE_GRVW4_LRVW4_TT4_4_VW4_WG16_16_1_WGM8
    SolutionIndex: 6
    SolutionNameMin: Cijk_Ailk_Bljk_HBH_MT64x64x16_SE_GRVW4_LRVW4_TT4_4_VW4_WG16_16_1_WGM1
    SolutionIndex: 7
    SolutionNameMin: Cijk_Ailk_Bljk_HBH_MT64x64x16_SE_GRVW4_LRVW4_TT4_4_VW4_WG16_16_1_WGM8
    SolutionIndex: 8
    SolutionNameMin: Cijk_Ailk_Bljk_HBH_MT128x64x8_SE_GRVW2_LRVW2_TT8_4_VW2_WG16_16_1_WGM1
    SolutionIndex: 9
    SolutionNameMin: Cijk_Ailk_Bljk_HBH_MT128x64x8_SE_GRVW2_LRVW2_TT8_4_VW2_WG16_16_1_WGM8
    SolutionIndex: 10
    SolutionNameMin: Cijk_Ailk_Bljk_HBH_MT128x64x16_SE_GRVW2_LRVW2_TT8_4_VW2_WG16_16_1_WGM1
    SolutionIndex: 11
    SolutionNameMin: Cijk_Ailk_Bljk_HBH_MT128x64x16_SE_GRVW2_LRVW2_TT8_4_VW2_WG16_16_1_WGM8
    SolutionIndex: 12
    SolutionNameMin: Cijk_Ailk_Bljk_HBH_MT128x64x8_SE_GRVW4_LRVW4_TT8_4_VW4_WG16_16_1_WGM1
    SolutionIndex: 13
    SolutionNameMin: Cijk_Ailk_Bljk_HBH_MT128x64x8_SE_GRVW4_LRVW4_TT8_4_VW4_WG16_16_1_WGM8
    SolutionIndex: 14
    SolutionNameMin: Cijk_Ailk_Bljk_HBH_MT128x64x16_SE_GRVW4_LRVW4_TT8_4_VW4_WG16_16_1_WGM1
    SolutionIndex: 15
    SolutionNameMin: Cijk_Ailk_Bljk_HBH_MT128x64x16_SE_GRVW4_LRVW4_TT8_4_VW4_WG16_16_1_WGM8
    SolutionIndex: 16
    SolutionNameMin: Cijk_Ailk_Bljk_HBH_MT64x128x16_SE_GRVW2_LRVW2_TT4_8_VW2_WG16_16_1_WGM1
    SolutionIndex: 17
    SolutionNameMin: Cijk_Ailk_Bljk_HBH_MT64x128x8_SE_GRVW4_LRVW4_TT4_8_VW4_WG16_16_1_WGM1
    SolutionIndex: 18
    SolutionNameMin: Cijk_Ailk_Bljk_HBH_MT64x128x16_SE_GRVW4_LRVW4_TT4_8_VW4_WG16_16_1_WGM1
    SolutionIndex: 19
    SolutionNameMin: Cijk_Ailk_Bljk_HBH_MT64x128x16_SE_GRVW4_LRVW4_TT4_8_VW4_WG16_16_1_WGM8
    SolutionIndex: 20
    SolutionNameMin: Cijk_Ailk_Bljk_HBH_MT128x128x16_SE_GRVW8_LRVW8_TT8_8_VW8_WG16_16_1_WGM1
    SolutionIndex: 21
    SolutionNameMin: Cijk_Ailk_Bljk_HBH_MT128x128x16_SE_GRVW8_LRVW8_TT8_8_VW8_WG16_16_1_WGM8
    SolutionIndex: 22
    SolutionNameMin: Cijk_Ailk_Bljk_HBH_MT96x64x8_SE_GRVW2_LRVW2_TT6_4_VW2_WG16_16_1_WGM1
    SolutionIndex: 23
    SolutionNameMin: Cijk_Ailk_Bljk_HBH_MT96x64x8_SE_GRVW2_LRVW2_TT6_4_VW2_WG16_16_1_WGM8
    SolutionIndex: 24
    SolutionNameMin: Cijk_Ailk_Bljk_HBH_MT96x64x16_SE_GRVW2_LRVW2_TT6_4_VW2_WG16_16_1_WGM8
    SolutionIndex: 25
    SolutionNameMin: Cijk_Ailk_Bljk_HBH_MT64x96x16_SE_GRVW2_LRVW2_TT4_6_VW2_WG16_16_1_WGM1
    SolutionIndex: 26
    SolutionNameMin: Cijk_Ailk_Bljk_HBH_MT64x32x8_SE_GRVW2_LRVW2_TT4_4_VW2_WG16_8_1_WGM1
    SolutionIndex: 27
    SolutionNameMin: Cijk_Ailk_Bljk_HBH_MT64x32x8_SE_GRVW2_LRVW2_TT4_4_VW2_WG16_8_1_WGM8
    SolutionIndex: 28
    SolutionNameMin: Cijk_Ailk_Bljk_HBH_MT64x32x8_SE_GRVW4_LRVW4_TT4_4_VW4_WG16_8_1_WGM1
    SolutionIndex: 29
    SolutionNameMin: Cijk_Ailk_Bljk_HBH_MT64x32x8_SE_GRVW4_LRVW4_TT4_4_VW4_WG16_8_1_WGM8
    SolutionIndex: 30
    SolutionNameMin: Cijk_Ailk_Bljk_HBH_MT64x32x16_SE_GRVW4_LRVW4_TT4_4_VW4_WG16_8_1_WGM1
    SolutionIndex: 31
    SolutionNameMin: Cijk_Ailk_Bljk_HBH_MT64x32x16_SE_GRVW4_LRVW4_TT4_4_VW4_WG16_8_1_WGM8
    SolutionIndex: 32
    SolutionNameMin: Cijk_Ailk_Bljk_HBH_MT128x32x8_SE_GRVW2_LRVW2_TT8_4_VW2_WG16_8_1_WGM1
    SolutionIndex: 33
    SolutionNameMin: Cijk_Ailk_Bljk_HBH_MT128x32x8_SE_GRVW4_LRVW4_TT8_4_VW4_WG16_8_1_WGM1
    SolutionIndex: 34
    SolutionNameMin: Cijk_Ailk_Bljk_HBH_MT128x32x8_SE_GRVW4_LRVW4_TT8_4_VW4_WG16_8_1_WGM8
    SolutionIndex: 35
    SolutionNameMin: Cijk_Ailk_Bljk_HBH_MT64x64x8_SE_GRVW2_LRVW2_TT4_8_VW2_WG16_8_1_WGM1
    SolutionIndex: 36
    SolutionNameMin: Cijk_Ailk_Bljk_HBH_MT64x64x8_SE_GRVW2_LRVW2_TT4_8_VW2_WG16_8_1_WGM8
    SolutionIndex: 37
    SolutionNameMin: Cijk_Ailk_Bljk_HBH_MT64x64x16_SE_GRVW2_LRVW2_TT4_8_VW2_WG16_8_1_WGM1
    SolutionIndex: 38
    SolutionNameMin: Cijk_Ailk_Bljk_HBH_MT64x64x8_SE_GRVW4_LRVW4_TT4_8_VW4_WG16_8_1_WGM1
    SolutionIndex: 39
    SolutionNameMin: Cijk_Ailk_Bljk_HBH_MT64x64x8_SE_GRVW4_LRVW4_TT4_8_VW4_WG16_8_1_WGM8
    SolutionIndex: 40
    SolutionNameMin: Cijk_Ailk_Bljk_HBH_MT64x64x16_SE_GRVW4_LRVW4_TT4_8_VW4_WG16_8_1_WGM1
    SolutionIndex: 41
    SolutionNameMin: Cijk_Ailk_Bljk_HBH_MT64x64x16_SE_GRVW4_LRVW4_TT4_8_VW4_WG16_8_1_WGM8
    SolutionIndex: 42
    SolutionNameMin: Cijk_Ailk_Bljk_HBH_MT128x64x8_SE_GRVW8_LRVW8_TT8_8_VW8_WG16_8_1_WGM1
    SolutionIndex: 43
    SolutionNameMin: Cijk_Ailk_Bljk_HBH_MT128x64x8_SE_GRVW8_LRVW8_TT8_8_VW8_WG16_8_1_WGM8
    SolutionIndex: 44
    SolutionNameMin: Cijk_Ailk_Bljk_HBH_MT96x32x8_SE_GRVW2_LRVW2_TT6_4_VW2_WG16_8_1_WGM1
    SolutionIndex: 45
    SolutionNameMin: Cijk_Ailk_Bljk_HBH_MT96x32x8_SE_GRVW2_LRVW2_TT6_4_VW2_WG16_8_1_WGM8
    SolutionIndex: 46
    SolutionNameMin: Cijk_Ailk_Bljk_HBH_MT96x32x16_SE_GRVW2_LRVW2_TT6_4_VW2_WG16_8_1_WGM1
    SolutionIndex: 47
    SolutionNameMin: Cijk_Ailk_Bljk_HBH_MT64x48x8_SE_GRVW2_LRVW2_TT4_6_VW2_WG16_8_1_WGM8
    SolutionIndex: 48
    SolutionNameMin: Cijk_Ailk_Bljk_HBH_MT32x64x16_SE_GRVW4_LRVW4_TT4_4_VW4_WG8_16_1_WGM1
    SolutionIndex: 49
    SolutionNameMin: Cijk_Ailk_Bljk_HBH_MT32x64x16_SE_GRVW4_LRVW4_TT4_4_VW4_WG8_16_1_WGM8
    SolutionIndex: 50
    SolutionNameMin: Cijk_Ailk_Bljk_HBH_MT64x64x8_SE_GRVW2_LRVW2_TT8_4_VW2_WG8_16_1_WGM1
    SolutionIndex: 51
    SolutionNameMin: Cijk_Ailk_Bljk_HBH_MT64x64x8_SE_GRVW2_LRVW2_TT8_4_VW2_WG8_16_1_WGM8
    SolutionIndex: 52
    SolutionNameMin: Cijk_Ailk_Bljk_HBH_MT64x64x16_SE_GRVW2_LRVW2_TT8_4_VW2_WG8_16_1_WGM1
    SolutionIndex: 53
    SolutionNameMin: Cijk_Ailk_Bljk_HBH_MT64x64x8_SE_GRVW4_LRVW4_TT8_4_VW4_WG8_16_1_WGM1
    SolutionIndex: 54
    SolutionNameMin: Cijk_Ailk_Bljk_HBH_MT64x64x8_SE_GRVW4_LRVW4_TT8_4_VW4_WG8_16_1_WGM8
    SolutionIndex: 55
    SolutionNameMin: Cijk_Ailk_Bljk_HBH_MT64x64x16_SE_GRVW4_LRVW4_TT8_4_VW4_WG8_16_1_WGM1
    SolutionIndex: 56
    SolutionNameMin: Cijk_Ailk_Bljk_HBH_MT64x64x16_SE_GRVW4_LRVW4_TT8_4_VW4_WG8_16_1_WGM8
    SolutionIndex: 57
    SolutionNameMin: Cijk_Ailk_Bljk_HBH_MT48x64x8_SE_GRVW2_LRVW2_TT6_4_VW2_WG8_16_1_WGM8
    SolutionIndex: 58
    SolutionNameMin: Cijk_Ailk_Bljk_HBH_MT64x16x16_SE_GRVW4_LRVW4_TT4_4_VW4_WG16_4_1_WGM1
    SolutionIndex: 59
    SolutionNameMin: Cijk_Ailk_Bljk_HBH_MT64x16x16_SE_GRVW4_LRVW4_TT4_4_VW4_WG16_4_1_WGM8
    SolutionIndex: 60
    SolutionNameMin: Cijk_Ailk_Bljk_HBH_MT64x32x8_SE_GRVW2_LRVW2_TT4_8_VW2_WG16_4_1_WGM1
    SolutionIndex: 61
    SolutionNameMin: Cijk_Ailk_Bljk_HBH_MT64x32x8_SE_GRVW2_LRVW2_TT4_8_VW2_WG16_4_1_WGM8
    SolutionIndex: 62
    SolutionNameMin: Cijk_Ailk_Bljk_HBH_MT64x32x8_SE_GRVW4_LRVW4_TT4_8_VW4_WG16_4_1_WGM1
    SolutionIndex: 63
    SolutionNameMin: Cijk_Ailk_Bljk_HBH_MT64x32x8_SE_GRVW4_LRVW4_TT4_8_VW4_WG16_4_1_WGM8
    SolutionIndex: 64
    SolutionNameMin: Cijk_Ailk_Bljk_HBH_MT128x32x8_SE_GRVW8_LRVW8_TT8_8_VW8_WG16_4_1_WGM1
    SolutionIndex: 65
    SolutionNameMin: Cijk_Ailk_Bljk_HBH_MT96x16x8_SE_GRVW2_LRVW2_TT6_4_VW2_WG16_4_1_WGM8
    SolutionIndex: 66
    SolutionNameMin: Cijk_Ailk_Bljk_HBH_MT32x32x8_SE_GRVW4_LRVW4_TT4_4_VW4_WG8_8_1_WGM1
    SolutionIndex: 67
    SolutionNameMin: Cijk_Ailk_Bljk_HBH_MT32x32x16_SE_GRVW4_LRVW4_TT4_4_VW4_WG8_8_1_WGM1
    SolutionIndex: 68
    SolutionNameMin: Cijk_Ailk_Bljk_HBH_MT32x32x16_SE_GRVW4_LRVW4_TT4_4_VW4_WG8_8_1_WGM8
    SolutionIndex: 69
    SolutionNameMin: Cijk_Ailk_Bljk_HBH_MT64x32x8_SE_GRVW2_LRVW2_TT8_4_VW2_WG8_8_1_WGM1
    SolutionIndex: 70
    SolutionNameMin: Cijk_Ailk_Bljk_HBH_MT64x32x8_SE_GRVW4_LRVW4_TT8_4_VW4_WG8_8_1_WGM1
    SolutionIndex: 71
    SolutionNameMin: Cijk_Ailk_Bljk_HBH_MT64x64x8_SE_GRVW8_LRVW8_TT8_8_VW8_WG8_8_1_WGM1
    SolutionIndex: 72
    SolutionNameMin: Cijk_Ailk_Bljk_HBH_MT64x32x16_SE_GRVW2_LRVW2_TT4_2_VW2_WG16_16_1_WGM1
    SolutionIndex: 73
    SolutionNameMin: Cijk_Ailk_Bljk_HBH_MT32x32x16_SE_GRVW2_LRVW2_TT2_4_VW2_WG16_8_1_WGM1
- - - [1024, 26656, 1, 1024, 1024, 1024, 1024, 1024]
    - [6, 12851.6]
  - - [1024, 26624, 1, 1024, 1024, 1024, 1024, 1024]
    - [4, 12881.2]
  - - [1024, 484, 1, 1024, 1024, 1024, 1024, 1024]
    - [28, 7009.82]
  - - [1024, 23040, 1, 1024, 1024, 1024, 1024, 1024]
    - [4, 12882.4]
  - - [1024, 20480, 1, 1024, 1024, 1024, 1024, 1024]
    - [6, 12824.1]
  - - [1024, 428, 1, 1024, 1024, 1024, 1024, 1024]
    - [7, 7509.88]
  - - [1024, 18944, 1, 1024, 1024, 1024, 1024, 1024]
    - [4, 12822.9]
  - - [1024, 288, 1, 1024, 1024, 1024, 1024, 1024]
    - [31, 5115.0]
  - - [1024, 304, 1, 1024, 1024, 1024, 1024, 1024]
    - [31, 5377.31]
  - - [1024, 444, 1, 1024, 1024, 1024, 1024, 1024]
    - [31, 7637.27]
  - - [1024, 15360, 1, 1024, 1024, 1024, 1024, 1024]
    - [4, 12802.1]
  - - [1024, 308, 1, 1024, 1024, 1024, 1024, 1024]
    - [31, 5440.72]
  - - [1024, 404, 1, 1024, 1024, 1024, 1024, 1024]
    - [7, 7079.29]
  - - [1024, 14336, 1, 1024, 1024, 1024, 1024, 1024]
    - [4, 12753.1]
  - - [1024, 324, 1, 1024, 1024, 1024, 1024, 1024]
    - [7, 5762.19]
  - - [1024, 384, 1, 1024, 1024, 1024, 1024, 1024]
    - [6, 6710.89]
  - - [1024, 12800, 1, 1024, 1024, 1024, 1024, 1024]
    - [6, 12693.6]
  - - [1024, 344, 1, 1024, 1024, 1024, 1024, 1024]
    - [7, 6093.08]
  - - [1024, 464, 1, 1024, 1024, 1024, 1024, 1024]
    - [68, 7918.93]
  - - [1024, 340, 1, 1024, 1024, 1024, 1024, 1024]
    - [7, 6038.55]
  - - [1024, 436, 1, 1024, 1024, 1024, 1024, 1024]
    - [7, 7549.19]
  - - [1024, 460, 1, 1024, 1024, 1024, 1024, 1024]
    - [31, 8071.37]
  - - [1024, 336, 1, 1024, 1024, 1024, 1024, 1024]
    - [31, 5943.35]
  - - [1024, 440, 1, 1024, 1024, 1024, 1024, 1024]
    - [7, 7658.92]
  - - [1024, 10752, 1, 1024, 1024, 1024, 1024, 1024]
    - [4, 12664.3]
  - - [1024, 272, 1, 1024, 1024, 1024, 1024, 1024]
    - [31, 4785.45]
  - - [1024, 312, 1, 1024, 1024, 1024, 1024, 1024]
    - [31, 5518.82]
  - - [1024, 356, 1, 1024, 1024, 1024, 1024, 1024]
    - [6, 6229.86]
  - - [1024, 396, 1, 1024, 1024, 1024, 1024, 1024]
    - [7, 6883.89]
  - - [1024, 268, 1, 1024, 1024, 1024, 1024, 1024]
    - [7, 4753.36]
  - - [1024, 360, 1, 1024, 1024, 1024, 1024, 1024]
    - [7, 6342.19]
  - - [1024, 296, 1, 1024, 1024, 1024, 1024, 1024]
    - [7, 5221.71]
  - - [1024, 432, 1, 1024, 1024, 1024, 1024, 1024]
    - [7, 7509.7]
  - - [1024, 280, 1, 1024, 1024, 1024, 1024, 1024]
    - [7, 4952.79]
  - - [1024, 320, 1, 1024, 1024, 1024, 1024, 1024]
    - [31, 5691.05]
  - - [1024, 456, 1, 1024, 1024, 1024, 1024, 1024]
    - [31, 8011.91]
  - - [1024, 468, 1, 1024, 1024, 1024, 1024, 1024]
    - [31, 8008.05]
  - - [1024, 260, 1, 1024, 1024, 1024, 1024, 1024]
    - [7, 4642.88]
  - - [1024, 364, 1, 1024, 1024, 1024, 1024, 1024]
    - [7, 6404.05]
  - - [1024, 412, 1, 1024, 1024, 1024, 1024, 1024]
    - [7, 7143.08]
  - - [1024, 472, 1, 1024, 1024, 1024, 1024, 1024]
    - [31, 8270.85]
  - - [1024, 348, 1, 1024, 1024, 1024, 1024, 1024]
    - [7, 6180.63]
  - - [1024, 408, 1, 1024, 1024, 1024, 1024, 1024]
    - [7, 7197.49]
  - - [1024, 9280, 1, 4096, 1024, 1024, 1024, 4096]
    - [14, 12323.0]
  - - [4096, 2912, 1, 1024, 4096, 4096, 4096, 1024]
    - [0, 12263.8]
  - - [1024, 9312, 1, 1024, 1024, 1024, 1024, 1024]
    - [4, 11784.7]
  - - [4096, 7632, 1, 1024, 4096, 4096, 4096, 1024]
    - [44, 12445.1]
  - - [4096, 6512, 1, 1024, 4096, 4096, 4096, 1024]
    - [0, 12696.3]
  - - [4096, 1856, 1, 1024, 4096, 4096, 4096, 1024]
    - [7, 12246.1]
  - - [1024, 8024, 1, 1024, 1024, 1024, 1024, 1024]
    - [60, 11496.7]
  - - [4096, 7488, 1, 1024, 4096, 4096, 4096, 1024]
    - [36, 12544.7]
  - - [1024, 5984, 1, 33712, 1024, 1024, 1024, 33712]
    - [14, 11235.2]
  - - [4096, 8784, 1, 1024, 4096, 4096, 4096, 1024]
    - [44, 12322.9]
  - - [4096, 8320, 1, 1024, 4096, 4096, 4096, 1024]
    - [0, 12694.1]
  - - [1024, 10168, 1, 1024, 1024, 1024, 1024, 1024]
    - [0, 12420.7]
  - - [1024, 4472, 1, 1024, 1024, 1024, 1024, 1024]
    - [41, 10588.0]
  - - [4096, 5888, 1, 1024, 4096, 4096, 4096, 1024]
    - [70, 12217.5]
  - - [1024, 6976, 1, 33712, 1024, 1024, 1024, 33712]
    - [15, 11243.3]
  - - [1024, 1344, 1, 1024, 1024, 1024, 1024, 1024]
    - [6, 10663.5]
  - - [1024, 7424, 1, 1024, 1024, 1024, 1024, 1024]
    - [0, 11695.6]
  - - [1024, 7208, 1, 4096, 1024, 1024, 1024, 4096]
    - [37, 11368.3]
  - - [4096, 9960, 1, 1024, 4096, 4096, 4096, 1024]
    - [35, 12599.0]
  - - [1024, 8288, 1, 1024, 1024, 1024, 1024, 1024]
    - [1, 12367.0]
  - - [1024, 7344, 1, 33712, 1024, 1024, 1024, 33712]
    - [13, 10893.8]
  - - [1024, 10000, 1, 1024, 1024, 1024, 1024, 1024]
    - [4, 12592.1]
  - - [1024, 7560, 1, 4096, 1024, 1024, 1024, 4096]
    - [37, 10656.6]
  - - [4096, 7752, 1, 1024, 4096, 4096, 4096, 1024]
    - [62, 12330.5]
  - - [1024, 9176, 1, 33712, 1024, 1024, 1024, 33712]
    - [2, 10706.6]
  - - [1024, 9048, 1, 1024, 1024, 1024, 1024, 1024]
    - [4, 12558.9]
  - - [4096, 3600, 1, 1024, 4096, 4096, 4096, 1024]
    - [35, 11329.8]
  - - [1024, 9272, 1, 33712, 1024, 1024, 1024, 33712]
    - [10, 10546.5]
  - - [1024, 9760, 1, 1024, 1024, 1024, 1024, 1024]
    - [4, 12587.4]
  - - [1024, 9800, 1, 4096, 1024, 1024, 1024, 4096]
    - [40, 11015.6]
  - - [4096, 9800, 1, 1024, 4096, 4096, 4096, 1024]
    - [35, 12453.4]
  - - [1024, 7752, 1, 4096, 1024, 1024, 1024, 4096]
    - [0, 11645.8]
  - - [1024, 9800, 1, 1024, 1024, 1024, 1024, 1024]
    - [3, 12168.5]
  - - [1024, 9640, 1, 4096, 1024, 1024, 1024, 4096]
    - [25, 11919.0]
  - - [1024, 8616, 1, 4096, 1024, 1024, 1024, 4096]
    - [13, 12280.8]
  - - [4096, 4920, 1, 1024, 4096, 4096, 4096, 1024]
    - [0, 12598.2]
  - - [4096, 5760, 1, 1024, 4096, 4096, 4096, 1024]
    - [60, 12185.8]
  - - [1024, 9696, 1, 4096, 1024, 1024, 1024, 4096]
    - [33, 11243.2]
  - - [1024, 8288, 1, 4096, 1024, 1024, 1024, 4096]
    - [0, 11584.3]
  - - [4096, 2304, 1, 1024, 4096, 4096, 4096, 1024]
    - [0, 12306.0]
  - - [1024, 9696, 1, 33712, 1024, 1024, 1024, 33712]
    - [18, 10362.1]
  - - [1024, 276, 1, 1024, 1024, 1024, 1024, 1024]
    - [31, 4823.45]
  - - [1024, 9512, 1, 1024, 1024, 1024, 1024, 1024]
    - [0, 12486.3]
  - - [1024, 9512, 1, 4096, 1024, 1024, 1024, 4096]
    - [40, 11268.0]
  - - [1024, 5760, 1, 1024, 1024, 1024, 1024, 1024]
    - [0, 12352.3]
  - - [4096, 10200, 1, 1024, 4096, 4096, 4096, 1024]
    - [35, 12573.1]
  - - [1024, 7800, 1, 33712, 1024, 1024, 1024, 33712]
    - [15, 11123.3]
  - - [1024, 9968, 1, 4096, 1024, 1024, 1024, 4096]
    - [2, 12179.2]
  - - [1024, 284, 1, 1024, 1024, 1024, 1024, 1024]
    - [7, 5064.55]
  - - [4096, 9440, 1, 1024, 4096, 4096, 4096, 1024]
    - [35, 12685.5]
  - - [4096, 9520, 1, 1024, 4096, 4096, 4096, 1024]
    - [0, 12636.9]
  - - [1024, 9440, 1, 33712, 1024, 1024, 1024, 33712]
    - [8, 10426.1]
  - - [1024, 9752, 1, 1024, 1024, 1024, 1024, 1024]
    - [4, 12572.1]
  - - [4096, 8856, 1, 1024, 4096, 4096, 4096, 1024]
    - [36, 12412.0]
  - - [1024, 10000, 1, 4096, 1024, 1024, 1024, 4096]
    - [0, 12081.4]
  - - [1024, 8816, 1, 4096, 1024, 1024, 1024, 4096]
    - [13, 11396.3]
  - - [1024, 8424, 1, 4096, 1024, 1024, 1024, 4096]
    - [0, 11996.1]
  - - [1024, 3240, 1, 4096, 1024, 1024, 1024, 4096]
    - [2, 11607.0]
  - - [1024, 8568, 1, 4096, 1024, 1024, 1024, 4096]
    - [12, 11653.5]
  - - [1024, 9976, 1, 1024, 1024, 1024, 1024, 1024]
    - [0, 12485.1]
  - - [4096, 5640, 1, 1024, 4096, 4096, 4096, 1024]
    - [60, 12163.1]
  - - [1024, 8112, 1, 1024, 1024, 1024, 1024, 1024]
    - [33, 11753.8]
  - - [1024, 448, 1, 1024, 1024, 1024, 1024, 1024]
    - [31, 7665.83]
  - - [1024, 9840, 1, 4096, 1024, 1024, 1024, 4096]
    - [7, 11670.3]
  - - [4096, 9840, 1, 1024, 4096, 4096, 4096, 1024]
    - [35, 12590.5]
  - - [1024, 332, 1, 1024, 1024, 1024, 1024, 1024]
    - [31, 5880.53]
  - - [1024, 5104, 1, 1024, 1024, 1024, 1024, 1024]
    - [0, 11924.9]
  - - [1024, 8944, 1, 1024, 1024, 1024, 1024, 1024]
    - [50, 11189.3]
  - - [1024, 3400, 1, 1024, 1024, 1024, 1024, 1024]
    - [44, 10777.4]
  - - [1024, 4224, 1, 4096, 1024, 1024, 1024, 4096]
    - [12, 10930.3]
  - - [1024, 8648, 1, 4096, 1024, 1024, 1024, 4096]
    - [33, 11927.3]
  - - [4096, 8648, 1, 1024, 4096, 4096, 4096, 1024]
    - [0, 12623.6]
  - - [4096, 6128, 1, 1024, 4096, 4096, 4096, 1024]
    - [0, 12657.9]
  - - [1024, 7800, 1, 1024, 1024, 1024, 1024, 1024]
    - [60, 11751.2]
  - - [4096, 3360, 1, 1024, 4096, 4096, 4096, 1024]
    - [62, 11388.7]
  - - [4096, 9408, 1, 1024, 4096, 4096, 4096, 1024]
    - [35, 12629.3]
  - - [1024, 7392, 1, 1024, 1024, 1024, 1024, 1024]
    - [0, 12421.6]
  - - [1024, 3600, 1, 4096, 1024, 1024, 1024, 4096]
    - [55, 10609.5]
  - - [1024, 3600, 1, 1024, 1024, 1024, 1024, 1024]
    - [62, 10511.4]
  - - [4096, 3024, 1, 1024, 4096, 4096, 4096, 1024]
    - [35, 11303.6]
  - - [1024, 6400, 1, 33712, 1024, 1024, 1024, 33712]
    - [7, 11111.2]
  - - [1024, 8064, 1, 4096, 1024, 1024, 1024, 4096]
    - [2, 11947.1]
  - - [4096, 6816, 1, 1024, 4096, 4096, 4096, 1024]
    - [1, 12508.9]
  - - [1024, 9960, 1, 4096, 1024, 1024, 1024, 4096]
    - [33, 11903.9]
  - - [4096, 5984, 1, 1024, 4096, 4096, 4096, 1024]
    - [60, 12172.5]
  - - [4096, 8064, 1, 1024, 4096, 4096, 4096, 1024]
    - [62, 12283.5]
  - - [1024, 4608, 1, 33712, 1024, 1024, 1024, 33712]
    - [55, 11329.6]
  - - [1024, 4032, 1, 4096, 1024, 1024, 1024, 4096]
    - [6, 10939.9]
  - - [1024, 9240, 1, 4096, 1024, 1024, 1024, 4096]
    - [40, 10904.7]
  - - [4096, 6800, 1, 1024, 4096, 4096, 4096, 1024]
    - [0, 12274.1]
  - - [1024, 4536, 1, 4096, 1024, 1024, 1024, 4096]
    - [34, 11502.0]
  - - [1024, 6400, 1, 4096, 1024, 1024, 1024, 4096]
    - [18, 10476.9]
  - - [4096, 9176, 1, 1024, 4096, 4096, 4096, 1024]
    - [36, 12272.3]
  - - [1024, 5920, 1, 4096, 1024, 1024, 1024, 4096]
    - [0, 11947.2]
  - - [1024, 8960, 1, 33712, 1024, 1024, 1024, 33712]
    - [8, 10569.8]
  - - [4096, 5920, 1, 1024, 4096, 4096, 4096, 1024]
    - [0, 12625.2]
  - - [1024, 4160, 1, 4096, 1024, 1024, 1024, 4096]
    - [6, 10423.1]
  - - [1024, 2400, 1, 4096, 1024, 1024, 1024, 4096]
    - [2, 10125.4]
  - - [1024, 5920, 1, 1024, 1024, 1024, 1024, 1024]
    - [4, 12349.9]
  - - [1024, 6480, 1, 4096, 1024, 1024, 1024, 4096]
    - [0, 10759.4]
  - - [4096, 9656, 1, 1024, 4096, 4096, 4096, 1024]
    - [35, 12582.7]
  - - [1024, 392, 1, 1024, 1024, 1024, 1024, 1024]
    - [7, 6832.48]
  - - [1024, 6480, 1, 1024, 1024, 1024, 1024, 1024]
    - [0, 12038.9]
  - - [1024, 33792, 1, 1024, 1024, 1024, 1024, 1024]
    - [62, 12373.7]
  - - [1024, 8880, 1, 4096, 1024, 1024, 1024, 4096]
    - [0, 12116.9]
  - - [1024, 8008, 1, 1024, 1024, 1024, 1024, 1024]
    - [0, 12309.4]
  - - [1024, 8880, 1, 1024, 1024, 1024, 1024, 1024]
    - [38, 11342.0]
  - - [1024, 5984, 1, 4096, 1024, 1024, 1024, 4096]
    - [18, 11071.5]
  - - [1024, 7040, 1, 4096, 1024, 1024, 1024, 4096]
    - [33, 10725.5]
  - - [1024, 6960, 1, 33712, 1024, 1024, 1024, 33712]
    - [12, 11047.5]
  - - [4096, 8968, 1, 1024, 4096, 4096, 4096, 1024]
    - [0, 12663.8]
  - - [1024, 8120, 1, 1024, 1024, 1024, 1024, 1024]
    - [0, 12466.9]
  - - [1024, 9504, 1, 33712, 1024, 1024, 1024, 33712]
    - [8, 10592.1]
  - - [1024, 6816, 1, 4096, 1024, 1024, 1024, 4096]
    - [2, 11828.2]
  - - [1024, 9344, 1, 1024, 1024, 1024, 1024, 1024]
    - [4, 11832.0]
  - - [4096, 9384, 1, 1024, 4096, 4096, 4096, 1024]
    - [35, 12609.3]
  - - [4096, 10160, 1, 1024, 4096, 4096, 4096, 1024]
    - [0, 12653.5]
  - - [1024, 5760, 1, 4096, 1024, 1024, 1024, 4096]
    - [0, 10750.8]
  - - [1024, 6912, 1, 4096, 1024, 1024, 1024, 4096]
    - [33, 10458.5]
  - - [1024, 9168, 1, 4096, 1024, 1024, 1024, 4096]
    - [33, 11497.3]
  - - [1024, 10112, 1, 33712, 1024, 1024, 1024, 33712]
    - [2, 10289.2]
  - - [4096, 9168, 1, 1024, 4096, 4096, 4096, 1024]
    - [0, 12699.2]
  - - [4096, 2880, 1, 1024, 4096, 4096, 4096, 1024]
    - [0, 12558.8]
  - - [1024, 488, 1, 1024, 1024, 1024, 1024, 1024]
    - [28, 7075.57]
  - - [1024, 5400, 1, 1024, 1024, 1024, 1024, 1024]
    - [0, 12090.6]
  - - [1024, 6912, 1, 1024, 1024, 1024, 1024, 1024]
    - [60, 11738.4]
  - - [1024, 6816, 1, 1024, 1024, 1024, 1024, 1024]
    - [44, 11552.9]
  - - [1024, 9520, 1, 33712, 1024, 1024, 1024, 33712]
    - [8, 10585.6]
  - - [1024, 8352, 1, 4096, 1024, 1024, 1024, 4096]
    - [2, 12137.5]
  - - [1024, 9640, 1, 33712, 1024, 1024, 1024, 33712]
    - [33, 10242.5]
  - - [1024, 8568, 1, 1024, 1024, 1024, 1024, 1024]
    - [4, 12540.7]
  - - [4096, 4968, 1, 1024, 4096, 4096, 4096, 1024]
    - [61, 11934.8]
  - - [1024, 8448, 1, 1024, 1024, 1024, 1024, 1024]
    - [61, 11459.1]
  - - [1024, 8968, 1, 1024, 1024, 1024, 1024, 1024]
    - [50, 11254.8]
  - - [4096, 5800, 1, 1024, 4096, 4096, 4096, 1024]
    - [70, 12099.1]
  - - [1024, 5800, 1, 33712, 1024, 1024, 1024, 33712]
    - [7, 11083.1]
  - - [1024, 5440, 1, 1024, 1024, 1024, 1024, 1024]
    - [7, 11925.6]
  - - [4096, 9760, 1, 1024, 4096, 4096, 4096, 1024]
    - [35, 12646.2]
  - - [1024, 6624, 1, 33712, 1024, 1024, 1024, 33712]
    - [13, 11500.4]
  - - [1024, 5680, 1, 4096, 1024, 1024, 1024, 4096]
    - [2, 11741.8]
  - - [4096, 5680, 1, 1024, 4096, 4096, 4096, 1024]
    - [60, 12068.7]
  - - [1024, 8128, 1, 1024, 1024, 1024, 1024, 1024]
    - [35, 11368.6]
  - - [1024, 10040, 1, 4096, 1024, 1024, 1024, 4096]
    - [33, 11450.6]
  - - [1024, 8760, 1, 4096, 1024, 1024, 1024, 4096]
    - [44, 11071.4]
  - - [1024, 7872, 1, 1024, 1024, 1024, 1024, 1024]
    - [0, 12453.8]
  - - [1024, 6840, 1, 1024, 1024, 1024, 1024, 1024]
    - [60, 11626.6]
  - - [1024, 5680, 1, 1024, 1024, 1024, 1024, 1024]
    - [38, 12017.5]
  - - [1024, 9144, 1, 4096, 1024, 1024, 1024, 4096]
    - [0, 11342.6]
  - - [1024, 8512, 1, 4096, 1024, 1024, 1024, 4096]
    - [13, 11534.6]
  - - [4096, 7904, 1, 1024, 4096, 4096, 4096, 1024]
    - [0, 12682.7]
  - - [1024, 8512, 1, 1024, 1024, 1024, 1024, 1024]
    - [2, 12289.9]
  - - [1024, 7896, 1, 1024, 1024, 1024, 1024, 1024]
    - [60, 11335.6]
  - - [1024, 7296, 1, 4096, 1024, 1024, 1024, 4096]
    - [21, 10887.7]
  - - [1024, 9920, 1, 33712, 1024, 1024, 1024, 33712]
    - [2, 10134.1]
  - - [1024, 7168, 1, 33712, 1024, 1024, 1024, 33712]
    - [13, 11672.3]
  - - [1024, 2040, 1, 4096, 1024, 1024, 1024, 4096]
    - [7, 11531.5]
  - - [4096, 10040, 1, 1024, 4096, 4096, 4096, 1024]
    - [35, 12562.9]
  - - [1024, 8704, 1, 33712, 1024, 1024, 1024, 33712]
    - [33, 10748.9]
  - - [1024, 7192, 1, 4096, 1024, 1024, 1024, 4096]
    - [2, 12082.4]
  - - [1024, 8192, 1, 33712, 1024, 1024, 1024, 33712]
    - [15, 10822.9]
  - - [1024, 10064, 1, 1024, 1024, 1024, 1024, 1024]
    - [6, 12492.7]
  - - [1024, 5600, 1, 4096, 1024, 1024, 1024, 4096]
    - [33, 10435.0]
  - - [1024, 9408, 1, 1024, 1024, 1024, 1024, 1024]
    - [60, 10883.7]
  - - [1024, 2720, 1, 1024, 1024, 1024, 1024, 1024]
    - [17, 9914.2]
  - - [1024, 5600, 1, 1024, 1024, 1024, 1024, 1024]
    - [38, 11857.9]
  - - [1024, 8232, 1, 4096, 1024, 1024, 1024, 4096]
    - [14, 11308.3]
  - - [1024, 8648, 1, 1024, 1024, 1024, 1024, 1024]
    - [1, 12235.6]
  - - [1024, 7888, 1, 1024, 1024, 1024, 1024, 1024]
    - [60, 11311.7]
  - - [4096, 8232, 1, 1024, 4096, 4096, 4096, 1024]
    - [62, 12361.6]
  - - [1024, 8000, 1, 1024, 1024, 1024, 1024, 1024]
    - [1, 12292.8]
  - - [1024, 9440, 1, 4096, 1024, 1024, 1024, 4096]
    - [40, 11072.9]
  - - [4096, 4048, 1, 1024, 4096, 4096, 4096, 1024]
    - [0, 12422.1]
  - - [4096, 2392, 1, 1024, 4096, 4096, 4096, 1024]
    - [60, 10997.0]
  - - [1024, 7840, 1, 1024, 1024, 1024, 1024, 1024]
    - [60, 11836.0]
  - - [1024, 9024, 1, 4096, 1024, 1024, 1024, 4096]
    - [41, 11106.8]
  - - [1024, 8216, 1, 4096, 1024, 1024, 1024, 4096]
    - [0, 12115.1]
  - - [1024, 3120, 1, 33712, 1024, 1024, 1024, 33712]
    - [12, 9044.13]
  - - [4096, 8512, 1, 1024, 4096, 4096, 4096, 1024]
    - [44, 12417.2]
  - - [1024, 4488, 1, 33712, 1024, 1024, 1024, 33712]
    - [6, 11170.0]
  - - [1024, 5800, 1, 1024, 1024, 1024, 1024, 1024]
    - [61, 11207.7]
  - - [4096, 9048, 1, 1024, 4096, 4096, 4096, 1024]
    - [35, 12480.9]
  - - [1024, 800, 1, 1024, 1024, 1024, 1024, 1024]
    - [4, 9328.97]
  - - [1024, 9720, 1, 4096, 1024, 1024, 1024, 4096]
    - [7, 11569.3]
  - - [4096, 8096, 1, 1024, 4096, 4096, 4096, 1024]
    - [62, 12315.0]
  - - [1024, 6968, 1, 4096, 1024, 1024, 1024, 4096]
    - [2, 11866.5]
  - - [1024, 8096, 1, 33712, 1024, 1024, 1024, 33712]
    - [13, 10738.9]
  - - [1024, 6664, 1, 4096, 1024, 1024, 1024, 4096]
    - [2, 11944.8]
  - - [1024, 8976, 1, 1024, 1024, 1024, 1024, 1024]
    - [6, 11735.6]
  - - [1024, 8832, 1, 4096, 1024, 1024, 1024, 4096]
    - [44, 11053.9]
  - - [1024, 8840, 1, 4096, 1024, 1024, 1024, 4096]
    - [0, 12000.1]
  - - [4096, 8832, 1, 1024, 4096, 4096, 4096, 1024]
    - [0, 12708.6]
  - - [1024, 7392, 1, 4096, 1024, 1024, 1024, 4096]
    - [0, 11983.7]
  - - [4096, 5936, 1, 1024, 4096, 4096, 4096, 1024]
    - [3, 12176.9]
  - - [1024, 8832, 1, 33712, 1024, 1024, 1024, 33712]
    - [10, 10817.4]
  - - [4096, 9152, 1, 1024, 4096, 4096, 4096, 1024]
    - [0, 12742.0]
  - - [1024, 10168, 1, 4096, 1024, 1024, 1024, 4096]
    - [0, 12036.2]
  - - [1024, 8832, 1, 1024, 1024, 1024, 1024, 1024]
    - [0, 11714.5]
  - - [4096, 9512, 1, 1024, 4096, 4096, 4096, 1024]
    - [70, 12244.4]
  - - [1024, 4536, 1, 33712, 1024, 1024, 1024, 33712]
    - [2, 11165.8]
  - - [1024, 4560, 1, 1024, 1024, 1024, 1024, 1024]
    - [16, 11406.2]
  - - [1024, 6072, 1, 33712, 1024, 1024, 1024, 33712]
    - [13, 10925.0]
  - - [1024, 10152, 1, 1024, 1024, 1024, 1024, 1024]
    - [3, 12321.9]
  - - [4096, 6624, 1, 1024, 4096, 4096, 4096, 1024]
    - [70, 12242.2]
  - - [1024, 7632, 1, 4096, 1024, 1024, 1024, 4096]
    - [2, 11103.8]
  - - [1024, 7776, 1, 4096, 1024, 1024, 1024, 4096]
    - [2, 11152.0]
  - - [1024, 6072, 1, 1024, 1024, 1024, 1024, 1024]
    - [6, 12302.8]
  - - [4096, 7072, 1, 1024, 4096, 4096, 4096, 1024]
    - [60, 12284.7]
  - - [4096, 9072, 1, 1024, 4096, 4096, 4096, 1024]
    - [35, 12667.0]
  - - [1024, 4368, 1, 4096, 1024, 1024, 1024, 4096]
    - [2, 11741.6]
  - - [1024, 9656, 1, 4096, 1024, 1024, 1024, 4096]
    - [33, 11240.3]
  - - [1024, 7360, 1, 1024, 1024, 1024, 1024, 1024]
    - [0, 12347.2]
  - - [1024, 9072, 1, 1024, 1024, 1024, 1024, 1024]
    - [53, 11556.8]
  - - [1024, 328, 1, 1024, 1024, 1024, 1024, 1024]
    - [31, 5778.44]
  - - [1024, 4536, 1, 1024, 1024, 1024, 1024, 1024]
    - [0, 12188.2]
  - - [4096, 8400, 1, 1024, 4096, 4096, 4096, 1024]
    - [44, 12386.5]
  - - [4096, 9696, 1, 1024, 4096, 4096, 4096, 1024]
    - [0, 12695.4]
  - - [1024, 16384, 1, 1024, 1024, 1024, 1024, 1024]
    - [0, 12596.6]
  - - [1024, 9744, 1, 33712, 1024, 1024, 1024, 33712]
    - [33, 10202.8]
  - - [1024, 4704, 1, 4096, 1024, 1024, 1024, 4096]
    - [2, 11504.1]
  - - [1024, 8960, 1, 4096, 1024, 1024, 1024, 4096]
    - [33, 11466.2]
  - - [1024, 7680, 1, 33712, 1024, 1024, 1024, 33712]
    - [12, 11538.1]
  - - [4096, 7200, 1, 1024, 4096, 4096, 4096, 1024]
    - [0, 12648.2]
  - - [1024, 8024, 1, 4096, 1024, 1024, 1024, 4096]
    - [3, 11112.2]
  - - [1024, 8960, 1, 1024, 1024, 1024, 1024, 1024]
    - [2, 12269.1]
  - - [1024, 6800, 1, 4096, 1024, 1024, 1024, 4096]
    - [33, 10923.6]
  - - [1024, 9840, 1, 1024, 1024, 1024, 1024, 1024]
    - [6, 11659.2]
  - - [1024, 800, 1, 4096, 1024, 1024, 1024, 4096]
    - [67, 8811.54]
  - - [4096, 10224, 1, 1024, 4096, 4096, 4096, 1024]
    - [35, 12639.5]
  - - [1024, 8200, 1, 1024, 1024, 1024, 1024, 1024]
    - [1, 12241.3]
  - - [1024, 7040, 1, 33712, 1024, 1024, 1024, 33712]
    - [12, 11342.6]
  - - [4096, 6864, 1, 1024, 4096, 4096, 4096, 1024]
    - [0, 12633.2]
  - - [4096, 9272, 1, 1024, 4096, 4096, 4096, 1024]
    - [35, 12613.3]
  - - [1024, 9856, 1, 33712, 1024, 1024, 1024, 33712]
    - [2, 10413.0]
  - - [1024, 6864, 1, 1024, 1024, 1024, 1024, 1024]
    - [4, 12411.0]
  - - [1024, 8112, 1, 33712, 1024, 1024, 1024, 33712]
    - [12, 10733.0]
  - - [1024, 7744, 1, 1024, 1024, 1024, 1024, 1024]
    - [6, 12451.2]
  - - [4096, 2176, 1, 1024, 4096, 4096, 4096, 1024]
    - [60, 11796.6]
  - - [1024, 9016, 1, 4096, 1024, 1024, 1024, 4096]
    - [40, 11082.9]
  - - [1024, 7520, 1, 33712, 1024, 1024, 1024, 33712]
    - [13, 11278.6]
  - - [1024, 9016, 1, 1024, 1024, 1024, 1024, 1024]
    - [6, 12621.4]
  - - [1024, 9360, 1, 4096, 1024, 1024, 1024, 4096]
    - [40, 11009.1]
  - - [1024, 8536, 1, 1024, 1024, 1024, 1024, 1024]
    - [0, 12405.2]
  - - [1024, 7072, 1, 33712, 1024, 1024, 1024, 33712]
    - [13, 11318.5]
  - - [4096, 10032, 1, 1024, 4096, 4096, 4096, 1024]
    - [0, 12736.7]
  - - [1024, 9976, 1, 4096, 1024, 1024, 1024, 4096]
    - [0, 11789.5]
  - - [1024, 5936, 1, 1024, 1024, 1024, 1024, 1024]
    - [38, 11689.3]
  - - [4096, 2720, 1, 1024, 4096, 4096, 4096, 1024]
    - [0, 11616.6]
  - - [1024, 8736, 1, 4096, 1024, 1024, 1024, 4096]
    - [44, 11204.7]
  - - [1024, 9760, 1, 33712, 1024, 1024, 1024, 33712]
    - [15, 10414.9]
  - - [1024, 7896, 1, 4096, 1024, 1024, 1024, 4096]
    - [2, 12133.7]
  - - [4096, 9016, 1, 1024, 4096, 4096, 4096, 1024]
    - [36, 12533.7]
  - - [1024, 8280, 1, 4096, 1024, 1024, 1024, 4096]
    - [0, 11885.3]
  - - [4096, 7896, 1, 1024, 4096, 4096, 4096, 1024]
    - [0, 12623.5]
  - - [4096, 8216, 1, 1024, 4096, 4096, 4096, 1024]
    - [62, 12341.1]
  - - [1024, 8928, 1, 1024, 1024, 1024, 1024, 1024]
    - [2, 12222.8]
  - - [1024, 8976, 1, 4096, 1024, 1024, 1024, 4096]
    - [41, 10936.3]
  - - [1024, 9880, 1, 4096, 1024, 1024, 1024, 4096]
    - [0, 11937.6]
  - - [1024, 9040, 1, 1024, 1024, 1024, 1024, 1024]
    - [1, 12448.9]
  - - [1024, 6624, 1, 1024, 1024, 1024, 1024, 1024]
    - [39, 11262.4]
  - - [4096, 9504, 1, 1024, 4096, 4096, 4096, 1024]
    - [35, 12612.2]
  - - [1024, 3344, 1, 1024, 1024, 1024, 1024, 1024]
    - [4, 11396.3]
  - - [1024, 6600, 1, 1024, 1024, 1024, 1024, 1024]
    - [35, 11915.6]
  - - [4096, 8880, 1, 1024, 4096, 4096, 4096, 1024]
    - [44, 12364.3]
  - - [1024, 2912, 1, 1024, 1024, 1024, 1024, 1024]
    - [7, 11482.6]
  - - [4096, 800, 1, 1024, 4096, 4096, 4096, 1024]
    - [4, 10843.6]
  - - [4096, 9856, 1, 1024, 4096, 4096, 4096, 1024]
    - [35, 12617.2]
  - - [1024, 8128, 1, 4096, 1024, 1024, 1024, 4096]
    - [0, 11790.7]
  - - [4096, 7040, 1, 1024, 4096, 4096, 4096, 1024]
    - [1, 12559.5]
  - - [1024, 2400, 1, 1024, 1024, 1024, 1024, 1024]
    - [7, 10344.4]
  - - [4096, 9240, 1, 1024, 4096, 4096, 4096, 1024]
    - [35, 12397.1]
  - - [4096, 3240, 1, 1024, 4096, 4096, 4096, 1024]
    - [0, 12415.5]
  - - [1024, 10240, 1, 1024, 1024, 1024, 1024, 1024]
    - [18, 11422.7]
  - - [1024, 9216, 1, 33712, 1024, 1024, 1024, 33712]
    - [18, 10612.9]
  - - [1024, 2720, 1, 4096, 1024, 1024, 1024, 4096]
    - [6, 11742.9]
  - - [1024, 9936, 1, 33712, 1024, 1024, 1024, 33712]
    - [33, 10121.4]
  - - [1024, 4600, 1, 4096, 1024, 1024, 1024, 4096]
    - [2, 11782.9]
  - - [1024, 9112, 1, 4096, 1024, 1024, 1024, 4096]
    - [33, 11639.5]
  - - [1024, 7968, 1, 33712, 1024, 1024, 1024, 33712]
    - [8, 10831.8]
  - - [1024, 4920, 1, 1024, 1024, 1024, 1024, 1024]
    - [6, 12264.6]
  - - [1024, 3400, 1, 4096, 1024, 1024, 1024, 4096]
    - [33, 9939.63]
  - - [1024, 4392, 1, 4096, 1024, 1024, 1024, 4096]
    - [55, 10527.0]
  - - [1024, 3240, 1, 1024, 1024, 1024, 1024, 1024]
    - [65, 10240.5]
  - - [1024, 8856, 1, 4096, 1024, 1024, 1024, 4096]
    - [34, 11549.4]
  - - [1024, 9920, 1, 1024, 1024, 1024, 1024, 1024]
    - [0, 12384.3]
  - - [1024, 9760, 1, 4096, 1024, 1024, 1024, 4096]
    - [0, 11000.8]
  - - [1024, 8064, 1, 1024, 1024, 1024, 1024, 1024]
    - [4, 11674.0]
  - - [1024, 6240, 1, 4096, 1024, 1024, 1024, 4096]
    - [34, 10738.0]
  - - [1024, 8640, 1, 1024, 1024, 1024, 1024, 1024]
    - [22, 11202.5]
  - - [4096, 4864, 1, 1024, 4096, 4096, 4096, 1024]
    - [44, 11477.8]
  - - [4096, 5600, 1, 1024, 4096, 4096, 4096, 1024]
    - [70, 12152.8]
  - - [4096, 9568, 1, 1024, 4096, 4096, 4096, 1024]
    - [44, 12324.3]
  - - [1024, 10224, 1, 33712, 1024, 1024, 1024, 33712]
    - [18, 10062.4]
  - - [1024, 7920, 1, 4096, 1024, 1024, 1024, 4096]
    - [2, 12169.5]
  - - [1024, 9856, 1, 1024, 1024, 1024, 1024, 1024]
    - [3, 12241.5]
  - - [1024, 6656, 1, 1024, 1024, 1024, 1024, 1024]
    - [36, 11932.9]
  - - [1024, 8000, 1, 33712, 1024, 1024, 1024, 33712]
    - [9, 10862.2]
  - - [4096, 5200, 1, 1024, 4096, 4096, 4096, 1024]
    - [0, 12553.1]
  - - [1024, 2176, 1, 1024, 1024, 1024, 1024, 1024]
    - [26, 10371.3]
  - - [1024, 10184, 1, 1024, 1024, 1024, 1024, 1024]
    - [0, 11676.3]
  - - [1024, 8480, 1, 4096, 1024, 1024, 1024, 4096]
    - [13, 11441.8]
  - - [1024, 9568, 1, 4096, 1024, 1024, 1024, 4096]
    - [0, 12174.2]
  - - [1024, 8320, 1, 4096, 1024, 1024, 1024, 4096]
    - [0, 11690.5]
  - - [1024, 9504, 1, 1024, 1024, 1024, 1024, 1024]
    - [1, 12419.8]
  - - [1024, 9400, 1, 1024, 1024, 1024, 1024, 1024]
    - [50, 11288.9]
  - - [1024, 9600, 1, 33712, 1024, 1024, 1024, 33712]
    - [8, 10525.2]
  - - [1024, 7776, 1, 33712, 1024, 1024, 1024, 33712]
    - [15, 11107.5]
  - - [1024, 9240, 1, 1024, 1024, 1024, 1024, 1024]
    - [4, 12519.1]
  - - [1024, 8800, 1, 33712, 1024, 1024, 1024, 33712]
    - [14, 10673.1]
  - - [1024, 9472, 1, 33712, 1024, 1024, 1024, 33712]
    - [2, 10512.8]
  - - [4096, 5576, 1, 1024, 4096, 4096, 4096, 1024]
    - [0, 12611.8]
  - - [1024, 6840, 1, 4096, 1024, 1024, 1024, 4096]
    - [33, 10860.8]
  - - [1024, 7744, 1, 33712, 1024, 1024, 1024, 33712]
    - [15, 10843.9]
  - - [4096, 4704, 1, 1024, 4096, 4096, 4096, 1024]
    - [0, 12625.4]
  - - [1024, 10168, 1, 33712, 1024, 1024, 1024, 33712]
    - [18, 10085.3]
  - - [1024, 10192, 1, 4096, 1024, 1024, 1024, 4096]
    - [2, 12183.7]
  - - [1024, 6720, 1, 1024, 1024, 1024, 1024, 1024]
    - [35, 12122.2]
  - - [1024, 6800, 1, 1024, 1024, 1024, 1024, 1024]
    - [60, 11564.6]
  - - [1024, 9776, 1, 33712, 1024, 1024, 1024, 33712]
    - [10, 10294.4]
  - - [1024, 7040, 1, 1024, 1024, 1024, 1024, 1024]
    - [6, 12420.8]
  - - [1024, 10080, 1, 33712, 1024, 1024, 1024, 33712]
    - [33, 10194.5]
  - - [4096, 7696, 1, 1024, 4096, 4096, 4096, 1024]
    - [0, 12650.6]
  - - [1024, 10064, 1, 33712, 1024, 1024, 1024, 33712]
    - [33, 10438.1]
  - - [1024, 5832, 1, 4096, 1024, 1024, 1024, 4096]
    - [2, 12049.8]
  - - [1024, 10080, 1, 1024, 1024, 1024, 1024, 1024]
    - [32, 11044.1]
  - - [1024, 7176, 1, 1024, 1024, 1024, 1024, 1024]
    - [44, 11485.8]
  - - [1024, 7800, 1, 4096, 1024, 1024, 1024, 4096]
    - [34, 11061.8]
  - - [1024, 10200, 1, 33712, 1024, 1024, 1024, 33712]
    - [18, 10107.6]
  - - [4096, 9576, 1, 1024, 4096, 4096, 4096, 1024]
    - [0, 12742.6]
  - - [4096, 5280, 1, 1024, 4096, 4096, 4096, 1024]
    - [0, 12586.9]
  - - [4096, 3120, 1, 1024, 4096, 4096, 4096, 1024]
    - [35, 11176.4]
  - - [1024, 9112, 1, 33712, 1024, 1024, 1024, 33712]
    - [33, 10363.5]
  - - [1024, 3120, 1, 1024, 1024, 1024, 1024, 1024]
    - [6, 11458.2]
  - - [1024, 9984, 1, 4096, 1024, 1024, 1024, 4096]
    - [6, 11644.8]
  - - [1024, 9400, 1, 33712, 1024, 1024, 1024, 33712]
    - [8, 10316.4]
  - - [1024, 5784, 1, 4096, 1024, 1024, 1024, 4096]
    - [2, 11954.9]
  - - [1024, 5200, 1, 1024, 1024, 1024, 1024, 1024]
    - [13, 11252.6]
  - - [4096, 3864, 1, 1024, 4096, 4096, 4096, 1024]
    - [34, 11225.4]
  - - [1024, 2912, 1, 33712, 1024, 1024, 1024, 33712]
    - [25, 9560.41]
  - - [1024, 4160, 1, 33712, 1024, 1024, 1024, 33712]
    - [12, 9374.14]
  - - [1024, 9152, 1, 1024, 1024, 1024, 1024, 1024]
    - [60, 11081.4]
  - - [1024, 10176, 1, 33712, 1024, 1024, 1024, 33712]
    - [18, 9988.85]
  - - [1024, 9680, 1, 1024, 1024, 1024, 1024, 1024]
    - [6, 12580.8]
  - - [1024, 9216, 1, 1024, 1024, 1024, 1024, 1024]
    - [60, 11162.0]
  - - [1024, 6936, 1, 4096, 1024, 1024, 1024, 4096]
    - [33, 10578.5]
  - - [4096, 6912, 1, 1024, 4096, 4096, 4096, 1024]
    - [60, 12223.8]
  - - [1024, 9792, 1, 4096, 1024, 1024, 1024, 4096]
    - [2, 11424.0]
  - - [1024, 9184, 1, 33712, 1024, 1024, 1024, 33712]
    - [18, 10502.3]
  - - [1024, 8016, 1, 1024, 1024, 1024, 1024, 1024]
    - [6, 12515.4]
  - - [1024, 8712, 1, 4096, 1024, 1024, 1024, 4096]
    - [33, 10927.0]
  - - [1024, 4368, 1, 1024, 1024, 1024, 1024, 1024]
    - [7, 11992.5]
  - - [1024, 11264, 1, 1024, 1024, 1024, 1024, 1024]
    - [22, 11169.5]
  - - [1024, 8904, 1, 4096, 1024, 1024, 1024, 4096]
    - [44, 11075.6]
  - - [1024, 9728, 1, 4096, 1024, 1024, 1024, 4096]
    - [0, 12046.5]
  - - [1024, 8480, 1, 1024, 1024, 1024, 1024, 1024]
    - [0, 12306.1]
  - - [1024, 6496, 1, 1024, 1024, 1024, 1024, 1024]
    - [62, 11129.9]
  - - [4096, 8640, 1, 1024, 4096, 4096, 4096, 1024]
    - [44, 12358.0]
  - - [1024, 372, 1, 1024, 1024, 1024, 1024, 1024]
    - [6, 6458.12]
  - - [1024, 4048, 1, 33712, 1024, 1024, 1024, 33712]
    - [2, 11184.5]
  - - [1024, 3000, 1, 1024, 1024, 1024, 1024, 1024]
    - [45, 10578.8]
  - - [4096, 8976, 1, 1024, 4096, 4096, 4096, 1024]
    - [62, 12219.9]
  - - [1024, 5640, 1, 1024, 1024, 1024, 1024, 1024]
    - [4, 12231.0]
  - - [1024, 8664, 1, 4096, 1024, 1024, 1024, 4096]
    - [0, 11317.3]
  - - [1024, 9728, 1, 1024, 1024, 1024, 1024, 1024]
    - [0, 12470.1]
  - - [1024, 7560, 1, 1024, 1024, 1024, 1024, 1024]
    - [61, 11427.8]
  - - [1024, 7640, 1, 33712, 1024, 1024, 1024, 33712]
    - [13, 11409.6]
  - - [1024, 5800, 1, 4096, 1024, 1024, 1024, 4096]
    - [2, 12000.2]
  - - [1024, 3360, 1, 4096, 1024, 1024, 1024, 4096]
    - [6, 10087.6]
  - - [1024, 6976, 1, 1024, 1024, 1024, 1024, 1024]
    - [45, 11371.2]
  - - [1024, 4800, 1, 1024, 1024, 1024, 1024, 1024]
    - [63, 11047.3]
  - - [1024, 6976, 1, 4096, 1024, 1024, 1024, 4096]
    - [64, 10462.9]
  - - [1024, 6000, 1, 4096, 1024, 1024, 1024, 4096]
    - [12, 11162.5]
  - - [1024, 8520, 1, 4096, 1024, 1024, 1024, 4096]
    - [71, 10795.1]
  - - [1024, 492, 1, 1024, 1024, 1024, 1024, 1024]
    - [7, 7102.14]
  - - [4096, 8704, 1, 1024, 4096, 4096, 4096, 1024]
    - [44, 12446.5]
  - - [1024, 5600, 1, 33712, 1024, 1024, 1024, 33712]
    - [2, 11284.1]
  - - [4096, 2400, 1, 1024, 4096, 4096, 4096, 1024]
    - [7, 12446.0]
  - - [1024, 6720, 1, 33712, 1024, 1024, 1024, 33712]
    - [12, 11825.3]
  - - [1024, 9288, 1, 1024, 1024, 1024, 1024, 1024]
    - [4, 12551.7]
  - - [4096, 8568, 1, 1024, 4096, 4096, 4096, 1024]
    - [62, 12337.8]
  - - [1024, 10208, 1, 4096, 1024, 1024, 1024, 4096]
    - [0, 12139.4]
  - - [1024, 5504, 1, 1024, 1024, 1024, 1024, 1024]
    - [22, 11696.1]
  - - [1024, 9176, 1, 4096, 1024, 1024, 1024, 4096]
    - [12, 11279.6]
  - - [4096, 8208, 1, 1024, 4096, 4096, 4096, 1024]
    - [0, 12644.2]
  - - [1024, 8576, 1, 1024, 1024, 1024, 1024, 1024]
    - [1, 12424.8]
  - - [1024, 9312, 1, 33712, 1024, 1024, 1024, 33712]
    - [18, 10691.6]
  - - [1024, 9384, 1, 1024, 1024, 1024, 1024, 1024]
    - [6, 12502.3]
  - - [4096, 7480, 1, 1024, 4096, 4096, 4096, 1024]
    - [60, 12217.4]
  - - [1024, 6160, 1, 4096, 1024, 1024, 1024, 4096]
    - [2, 11042.9]
  - - [4096, 10240, 1, 1024, 4096, 4096, 4096, 1024]
    - [35, 12651.0]
  - - [4096, 9464, 1, 1024, 4096, 4096, 4096, 1024]
    - [44, 12427.9]
  - - [4096, 8008, 1, 1024, 4096, 4096, 4096, 1024]
    - [0, 12617.5]
  - - [1024, 5016, 1, 1024, 1024, 1024, 1024, 1024]
    - [7, 11960.3]
  - - [1024, 8464, 1, 4096, 1024, 1024, 1024, 4096]
    - [12, 11521.9]
  - - [1024, 8296, 1, 33712, 1024, 1024, 1024, 33712]
    - [14, 11083.7]
  - - [1024, 5280, 1, 1024, 1024, 1024, 1024, 1024]
    - [6, 12052.6]
  - - [1024, 10240, 1, 4096, 1024, 1024, 1024, 4096]
    - [33, 11294.9]
  - - [4096, 9640, 1, 1024, 4096, 4096, 4096, 1024]
    - [35, 12638.1]
  - - [4096, 9984, 1, 1024, 4096, 4096, 4096, 1024]
    - [35, 12630.5]
  - - [1024, 9072, 1, 33712, 1024, 1024, 1024, 33712]
    - [8, 10965.3]
  - - [1024, 10080, 1, 4096, 1024, 1024, 1024, 4096]
    - [2, 12318.6]
  - - [1024, 10176, 1, 4096, 1024, 1024, 1024, 4096]
    - [33, 11697.6]
  - - [4096, 7504, 1, 1024, 4096, 4096, 4096, 1024]
    - [62, 12286.1]
  - - [1024, 1344, 1, 4096, 1024, 1024, 1024, 4096]
    - [7, 10859.0]
  - - [1024, 368, 1, 1024, 1024, 1024, 1024, 1024]
    - [66, 6272.37]
  - - [4096, 8464, 1, 1024, 4096, 4096, 4096, 1024]
    - [62, 12340.3]
  - - [1024, 7056, 1, 33712, 1024, 1024, 1024, 33712]
    - [13, 11389.4]
  - - [4096, 8352, 1, 1024, 4096, 4096, 4096, 1024]
    - [0, 12696.3]
  - - [1024, 316, 1, 1024, 1024, 1024, 1024, 1024]
    - [31, 5544.68]
  - - [4096, 8800, 1, 1024, 4096, 4096, 4096, 1024]
    - [0, 12402.1]
  - - [1024, 9168, 1, 33712, 1024, 1024, 1024, 33712]
    - [33, 10558.6]
  - - [1024, 9632, 1, 1024, 1024, 1024, 1024, 1024]
    - [6, 12527.1]
  - - [4096, 4352, 1, 1024, 4096, 4096, 4096, 1024]
    - [54, 11520.8]
  - - [1024, 8904, 1, 1024, 1024, 1024, 1024, 1024]
    - [50, 11217.4]
  - - [4096, 7208, 1, 1024, 4096, 4096, 4096, 1024]
    - [60, 12152.9]
  - - [1024, 5832, 1, 1024, 1024, 1024, 1024, 1024]
    - [23, 11686.4]
  - - [4096, 7392, 1, 1024, 4096, 4096, 4096, 1024]
    - [60, 12270.1]
  - - [1024, 8096, 1, 4096, 1024, 1024, 1024, 4096]
    - [9, 11470.7]
  - - [4096, 7224, 1, 1024, 4096, 4096, 4096, 1024]
    - [0, 12677.6]
  - - [1024, 8976, 1, 33712, 1024, 1024, 1024, 33712]
    - [33, 10618.0]
  - - [1024, 10200, 1, 1024, 1024, 1024, 1024, 1024]
    - [4, 12542.7]
  - - [1024, 5880, 1, 1024, 1024, 1024, 1024, 1024]
    - [6, 11556.5]
  - - [1024, 8008, 1, 33712, 1024, 1024, 1024, 33712]
    - [8, 10881.8]
  - - [1024, 7224, 1, 1024, 1024, 1024, 1024, 1024]
    - [6, 12348.2]
  - - [1024, 7968, 1, 1024, 1024, 1024, 1024, 1024]
    - [61, 11409.0]
  - - [1024, 9952, 1, 33712, 1024, 1024, 1024, 33712]
    - [33, 10211.5]
  - - [1024, 9176, 1, 1024, 1024, 1024, 1024, 1024]
    - [6, 12529.6]
  - - [4096, 10064, 1, 1024, 4096, 4096, 4096, 1024]
    - [35, 12579.7]
  - - [4096, 8112, 1, 1024, 4096, 4096, 4096, 1024]
    - [0, 12355.1]
  - - [4096, 9776, 1, 1024, 4096, 4096, 4096, 1024]
    - [35, 12648.8]
  - - [1024, 8192, 1, 1024, 1024, 1024, 1024, 1024]
    - [1, 12214.1]
  - - [1024, 4920, 1, 4096, 1024, 1024, 1024, 4096]
    - [34, 11344.9]
  - - [1024, 2880, 1, 1024, 1024, 1024, 1024, 1024]
    - [38, 10636.4]
  - - [1024, 8528, 1, 4096, 1024, 1024, 1024, 4096]
    - [12, 11599.4]
  - - [4096, 5832, 1, 1024, 4096, 4096, 4096, 1024]
    - [0, 12549.3]
  - - [4096, 8192, 1, 1024, 4096, 4096, 4096, 1024]
    - [62, 12306.8]
  - - [4096, 7776, 1, 1024, 4096, 4096, 4096, 1024]
    - [0, 12644.5]
  - - [1024, 9424, 1, 33712, 1024, 1024, 1024, 33712]
    - [8, 10544.0]
  - - [4096, 9976, 1, 1024, 4096, 4096, 4096, 1024]
    - [0, 12741.2]
  - - [4096, 10120, 1, 1024, 4096, 4096, 4096, 1024]
    - [35, 12418.4]
  - - [1024, 7616, 1, 4096, 1024, 1024, 1024, 4096]
    - [0, 11834.9]
  - - [1024, 4704, 1, 33712, 1024, 1024, 1024, 33712]
    - [2, 10959.0]
  - - [1024, 8216, 1, 1024, 1024, 1024, 1024, 1024]
    - [60, 11742.3]
  - - [1024, 9976, 1, 33712, 1024, 1024, 1024, 33712]
    - [33, 10178.1]
  - - [1024, 9912, 1, 33712, 1024, 1024, 1024, 33712]
    - [33, 10190.7]
  - - [1024, 4608, 1, 1024, 1024, 1024, 1024, 1024]
    - [6, 12038.6]
  - - [1024, 9048, 1, 4096, 1024, 1024, 1024, 4096]
    - [33, 11713.8]
  - - [1024, 1232, 1, 1024, 1024, 1024, 1024, 1024]
    - [6, 9774.86]
  - - [4096, 6936, 1, 1024, 4096, 4096, 4096, 1024]
    - [60, 12248.9]
  - - [1024, 8208, 1, 4096, 1024, 1024, 1024, 4096]
    - [37, 11485.7]
  - - [1024, 9792, 1, 33712, 1024, 1024, 1024, 33712]
    - [10, 10199.2]
  - - [1024, 8208, 1, 1024, 1024, 1024, 1024, 1024]
    - [6, 12454.7]
  - - [1024, 5360, 1, 1024, 1024, 1024, 1024, 1024]
    - [60, 11305.8]
  - - [1024, 4032, 1, 1024, 1024, 1024, 1024, 1024]
    - [47, 10800.8]
  - - [4096, 6496, 1, 1024, 4096, 4096, 4096, 1024]
    - [70, 12293.8]
  - - [4096, 6888, 1, 1024, 4096, 4096, 4096, 1024]
    - [60, 12194.1]
  - - [1024, 6768, 1, 1024, 1024, 1024, 1024, 1024]
    - [6, 11519.2]
  - - [1024, 7744, 1, 4096, 1024, 1024, 1024, 4096]
    - [44, 10841.9]
  - - [4096, 3344, 1, 1024, 4096, 4096, 4096, 1024]
    - [1, 12334.4]
  - - [1024, 3040, 1, 1024, 1024, 1024, 1024, 1024]
    - [57, 10320.1]
  - - [1024, 8008, 1, 4096, 1024, 1024, 1024, 4096]
    - [13, 11523.5]
  - - [1024, 8944, 1, 4096, 1024, 1024, 1024, 4096]
    - [0, 11911.5]
  - - [1024, 9672, 1, 33712, 1024, 1024, 1024, 33712]
    - [10, 10184.2]
  - - [1024, 7752, 1, 1024, 1024, 1024, 1024, 1024]
    - [6, 12453.3]
  - - [1024, 9800, 1, 33712, 1024, 1024, 1024, 33712]
    - [8, 10147.0]
  - - [1024, 10152, 1, 4096, 1024, 1024, 1024, 4096]
    - [2, 12399.1]
  - - [4096, 7216, 1, 1024, 4096, 4096, 4096, 1024]
    - [62, 12173.4]
  - - [4096, 8200, 1, 1024, 4096, 4096, 4096, 1024]
    - [62, 12288.5]
  - - [1024, 7424, 1, 33712, 1024, 1024, 1024, 33712]
    - [11, 11088.5]
  - - [1024, 10000, 1, 33712, 1024, 1024, 1024, 33712]
    - [33, 10285.1]
  - - [1024, 9344, 1, 4096, 1024, 1024, 1024, 4096]
    - [2, 12251.9]
  - - [1024, 3344, 1, 4096, 1024, 1024, 1024, 4096]
    - [0, 11095.6]
  - - [1024, 6960, 1, 1024, 1024, 1024, 1024, 1024]
    - [45, 11301.5]
  - - [4096, 9360, 1, 1024, 4096, 4096, 4096, 1024]
    - [36, 12341.7]
  - - [4096, 9024, 1, 1024, 4096, 4096, 4096, 1024]
    - [0, 12550.8]
  - - [1024, 3696, 1, 4096, 1024, 1024, 1024, 4096]
    - [2, 11624.9]
  - - [1024, 9520, 1, 1024, 1024, 1024, 1024, 1024]
    - [38, 11546.2]
  - - [4096, 9880, 1, 1024, 4096, 4096, 4096, 1024]
    - [35, 12648.5]
  - - [1024, 416, 1, 1024, 1024, 1024, 1024, 1024]
    - [7, 7260.45]
  - - [4096, 6072, 1, 1024, 4096, 4096, 4096, 1024]
    - [0, 12470.0]
  - - [1024, 8464, 1, 1024, 1024, 1024, 1024, 1024]
    - [8, 11323.8]
  - - [1024, 9744, 1, 1024, 1024, 1024, 1024, 1024]
    - [22, 10955.2]
  - - [4096, 7168, 1, 1024, 4096, 4096, 4096, 1024]
    - [60, 12254.1]
  - - [1024, 6768, 1, 4096, 1024, 1024, 1024, 4096]
    - [2, 11315.7]
  - - [4096, 9672, 1, 1024, 4096, 4096, 4096, 1024]
    - [35, 12540.2]
  - - [1024, 3584, 1, 4096, 1024, 1024, 1024, 4096]
    - [0, 10825.8]
  - - [1024, 7872, 1, 33712, 1024, 1024, 1024, 33712]
    - [15, 11185.8]
  - - [1024, 5984, 1, 1024, 1024, 1024, 1024, 1024]
    - [6, 12133.9]
  - - [1024, 2304, 1, 1024, 1024, 1024, 1024, 1024]
    - [6, 10036.2]
  - - [1024, 7936, 1, 33712, 1024, 1024, 1024, 33712]
    - [14, 11314.9]
  - - [1024, 9792, 1, 1024, 1024, 1024, 1024, 1024]
    - [4, 12618.8]
  - - [1024, 9960, 1, 1024, 1024, 1024, 1024, 1024]
    - [35, 11356.9]
  - - [4096, 6400, 1, 1024, 4096, 4096, 4096, 1024]
    - [70, 12326.2]
  - - [1024, 7840, 1, 4096, 1024, 1024, 1024, 4096]
    - [2, 11246.9]
  - - [4096, 8000, 1, 1024, 4096, 4096, 4096, 1024]
    - [62, 12355.0]
  - - [4096, 3808, 1, 1024, 4096, 4096, 4096, 1024]
    - [70, 12165.5]
  - - [1024, 8704, 1, 1024, 1024, 1024, 1024, 1024]
    - [60, 11060.1]
  - - [4096, 4640, 1, 1024, 4096, 4096, 4096, 1024]
    - [46, 11571.6]
  - - [1024, 7728, 1, 4096, 1024, 1024, 1024, 4096]
    - [33, 11861.6]
  - - [4096, 8296, 1, 1024, 4096, 4096, 4096, 1024]
    - [62, 12287.7]
  - - [1024, 9648, 1, 4096, 1024, 1024, 1024, 4096]
    - [0, 12091.1]
  - - [4096, 7920, 1, 1024, 4096, 4096, 4096, 1024]
    - [62, 12244.8]
  - - [1024, 10064, 1, 4096, 1024, 1024, 1024, 4096]
    - [33, 11826.3]
  - - [1024, 9464, 1, 4096, 1024, 1024, 1024, 4096]
    - [7, 11638.5]
  - - [1024, 9408, 1, 4096, 1024, 1024, 1024, 4096]
    - [0, 11701.4]
  - - [1024, 292, 1, 1024, 1024, 1024, 1024, 1024]
    - [31, 5158.09]
  - - [4096, 9728, 1, 1024, 4096, 4096, 4096, 1024]
    - [35, 12471.6]
  - - [1024, 7200, 1, 1024, 1024, 1024, 1024, 1024]
    - [0, 12108.2]
  - - [4096, 9936, 1, 1024, 4096, 4096, 4096, 1024]
    - [35, 12408.1]
  - - [1024, 7224, 1, 4096, 1024, 1024, 1024, 4096]
    - [2, 11294.0]
  - - [4096, 8904, 1, 1024, 4096, 4096, 4096, 1024]
    - [35, 12595.1]
  - - [1024, 8096, 1, 1024, 1024, 1024, 1024, 1024]
    - [1, 12422.8]
  - - [1024, 9696, 1, 1024, 1024, 1024, 1024, 1024]
    - [60, 11179.4]
  - - [1024, 7936, 1, 1024, 1024, 1024, 1024, 1024]
    - [60, 11378.1]
  - - [1024, 9672, 1, 4096, 1024, 1024, 1024, 4096]
    - [6, 10950.8]
  - - [4096, 8480, 1, 1024, 4096, 4096, 4096, 1024]
    - [0, 12516.7]
  - - [1024, 380, 1, 1024, 1024, 1024, 1024, 1024]
    - [6, 6632.14]
  - - [1024, 8320, 1, 1024, 1024, 1024, 1024, 1024]
    - [0, 12414.8]
  - - [1024, 7296, 1, 1024, 1024, 1024, 1024, 1024]
    - [61, 11680.7]
  - - [1024, 6336, 1, 1024, 1024, 1024, 1024, 1024]
    - [60, 11519.9]
  - - [1024, 8280, 1, 1024, 1024, 1024, 1024, 1024]
    - [18, 11209.2]
  - - [1024, 10032, 1, 1024, 1024, 1024, 1024, 1024]
    - [60, 11059.9]
  - - [4096, 8840, 1, 1024, 4096, 4096, 4096, 1024]
    - [36, 12365.1]
  - - [4096, 9248, 1, 1024, 4096, 4096, 4096, 1024]
    - [0, 12706.0]
  - - [1024, 4368, 1, 33712, 1024, 1024, 1024, 33712]
    - [2, 11461.6]
  - - [4096, 6160, 1, 1024, 4096, 4096, 4096, 1024]
    - [60, 12105.4]
  - - [1024, 424, 1, 1024, 1024, 1024, 1024, 1024]
    - [68, 7226.86]
  - - [4096, 10208, 1, 1024, 4096, 4096, 4096, 1024]
    - [35, 12512.4]
  - - [1024, 9840, 1, 33712, 1024, 1024, 1024, 33712]
    - [2, 10232.9]
  - - [1024, 9576, 1, 4096, 1024, 1024, 1024, 4096]
    - [2, 12235.1]
  - - [1024, 9120, 1, 1024, 1024, 1024, 1024, 1024]
    - [60, 11799.2]
  - - [4096, 7680, 1, 1024, 4096, 4096, 4096, 1024]
    - [62, 12238.3]
  - - [4096, 9120, 1, 1024, 4096, 4096, 4096, 1024]
    - [44, 12442.7]
  - - [4096, 7744, 1, 1024, 4096, 4096, 4096, 1024]
    - [0, 12667.9]
  - - [1024, 8192, 1, 4096, 1024, 1024, 1024, 4096]
    - [2, 11411.2]
  - - [1024, 5776, 1, 1024, 1024, 1024, 1024, 1024]
    - [0, 11935.5]
  - - [1024, 8160, 1, 1024, 1024, 1024, 1024, 1024]
    - [44, 11655.9]
  - - [1024, 264, 1, 1024, 1024, 1024, 1024, 1024]
    - [48, 4607.59]
  - - [1024, 9600, 1, 4096, 1024, 1024, 1024, 4096]
    - [0, 11853.6]
  - - [1024, 8120, 1, 33712, 1024, 1024, 1024, 33712]
    - [9, 11100.1]
  - - [1024, 6072, 1, 4096, 1024, 1024, 1024, 4096]
    - [2, 12084.2]
  - - [1024, 7200, 1, 4096, 1024, 1024, 1024, 4096]
    - [15, 11920.5]
  - - [4096, 4080, 1, 1024, 4096, 4096, 4096, 1024]
    - [4, 11553.3]
  - - [4096, 7560, 1, 1024, 4096, 4096, 4096, 1024]
    - [60, 12186.3]
  - - [1024, 3240, 1, 33712, 1024, 1024, 1024, 33712]
    - [12, 10054.7]
  - - [4096, 4368, 1, 1024, 4096, 4096, 4096, 1024]
    - [2, 11474.5]
  - - [4096, 5400, 1, 1024, 4096, 4096, 4096, 1024]
    - [60, 12163.9]
  - - [1024, 2880, 1, 4096, 1024, 1024, 1024, 4096]
    - [8, 9885.72]
  - - [1024, 4640, 1, 4096, 1024, 1024, 1024, 4096]
    - [0, 10812.9]
  - - [1024, 5936, 1, 33712, 1024, 1024, 1024, 33712]
    - [13, 10902.8]
  - - [1024, 7072, 1, 1024, 1024, 1024, 1024, 1024]
    - [6, 12462.2]
  - - [1024, 9856, 1, 4096, 1024, 1024, 1024, 4096]
    - [33, 11382.9]
  - - [1024, 9384, 1, 33712, 1024, 1024, 1024, 33712]
    - [8, 10232.6]
  - - [1024, 8544, 1, 4096, 1024, 1024, 1024, 4096]
    - [2, 12093.0]
  - - [1024, 9936, 1, 1024, 1024, 1024, 1024, 1024]
    - [0, 12442.2]
  - - [4096, 3040, 1, 1024, 4096, 4096, 4096, 1024]
    - [18, 11078.3]
  - - [1024, 5104, 1, 4096, 1024, 1024, 1024, 4096]
    - [15, 10432.2]
  - - [1024, 6960, 1, 4096, 1024, 1024, 1024, 4096]
    - [14, 10566.5]
  - - [1024, 9936, 1, 4096, 1024, 1024, 1024, 4096]
    - [34, 11093.3]
  - - [1024, 8432, 1, 1024, 1024, 1024, 1024, 1024]
    - [5, 11559.4]
  - - [1024, 912, 1, 4096, 1024, 1024, 1024, 4096]
    - [29, 9225.34]
  - - [1024, 10192, 1, 1024, 1024, 1024, 1024, 1024]
    - [22, 11875.6]
  - - [1024, 6720, 1, 4096, 1024, 1024, 1024, 4096]
    - [34, 10815.7]
  - - [4096, 6000, 1, 1024, 4096, 4096, 4096, 1024]
    - [60, 12214.5]
  - - [1024, 9984, 1, 33712, 1024, 1024, 1024, 33712]
    - [33, 10269.0]
  - - [4096, 10192, 1, 1024, 4096, 4096, 4096, 1024]
    - [0, 12711.8]
  - - [1024, 8816, 1, 1024, 1024, 1024, 1024, 1024]
    - [1, 12445.1]
  - - [4096, 10080, 1, 1024, 4096, 4096, 4096, 1024]
    - [35, 12589.2]
  - - [1024, 5120, 1, 1024, 1024, 1024, 1024, 1024]
    - [0, 11941.0]
  - - [1024, 4488, 1, 4096, 1024, 1024, 1024, 4096]
    - [33, 10671.7]
  - - [1024, 10120, 1, 33712, 1024, 1024, 1024, 33712]
    - [18, 10088.8]
  - - [1024, 6936, 1, 1024, 1024, 1024, 1024, 1024]
    - [7, 12230.8]
  - - [1024, 10200, 1, 4096, 1024, 1024, 1024, 4096]
    - [33, 11505.2]
  - - [1024, 6528, 1, 1024, 1024, 1024, 1024, 1024]
    - [36, 11764.6]
  - - [1024, 9776, 1, 1024, 1024, 1024, 1024, 1024]
    - [17, 11045.2]
  - - [1024, 10192, 1, 33712, 1024, 1024, 1024, 33712]
    - [18, 10138.9]
  - - [1024, 5776, 1, 4096, 1024, 1024, 1024, 4096]
    - [2, 11950.1]
  - - [1024, 4640, 1, 1024, 1024, 1024, 1024, 1024]
    - [63, 10608.3]
  - - [1024, 9728, 1, 33712, 1024, 1024, 1024, 33712]
    - [18, 10271.9]
  - - [4096, 7448, 1, 1024, 4096, 4096, 4096, 1024]
    - [0, 12707.9]
  - - [4096, 10152, 1, 1024, 4096, 4096, 4096, 1024]
    - [35, 12646.3]
  - - [1024, 1232, 1, 4096, 1024, 1024, 1024, 4096]
    - [2, 9540.93]
  - - [1024, 6864, 1, 4096, 1024, 1024, 1024, 4096]
    - [15, 11111.6]
  - - [1024, 7424, 1, 4096, 1024, 1024, 1024, 4096]
    - [2, 11284.3]
  - - [4096, 9912, 1, 1024, 4096, 4096, 4096, 1024]
    - [35, 12676.2]
  - - [1024, 4048, 1, 1024, 1024, 1024, 1024, 1024]
    - [26, 11417.6]
  - - [1024, 10208, 1, 1024, 1024, 1024, 1024, 1024]
    - [16, 11258.7]
  - - [4096, 6664, 1, 1024, 4096, 4096, 4096, 1024]
    - [70, 12218.8]
  - - [1024, 9744, 1, 4096, 1024, 1024, 1024, 4096]
    - [33, 11560.9]
  - - [4096, 10168, 1, 1024, 4096, 4096, 4096, 1024]
    - [39, 12526.9]
  - - [1024, 3256, 1, 1024, 1024, 1024, 1024, 1024]
    - [3, 11562.4]
  - - [1024, 9472, 1, 1024, 1024, 1024, 1024, 1024]
    - [71, 11361.9]
  - - [1024, 8584, 1, 1024, 1024, 1024, 1024, 1024]
    - [4, 11760.4]
  - - [4096, 9296, 1, 1024, 4096, 4096, 4096, 1024]
    - [35, 12656.5]
  - - [1024, 7168, 1, 4096, 1024, 1024, 1024, 4096]
    - [0, 11989.8]
  - - [1024, 8184, 1, 1024, 1024, 1024, 1024, 1024]
    - [6, 11595.4]
  - - [1024, 4864, 1, 4096, 1024, 1024, 1024, 4096]
    - [52, 10126.0]
  - - [1024, 9576, 1, 33712, 1024, 1024, 1024, 33712]
    - [33, 10527.9]
  - - [1024, 8320, 1, 33712, 1024, 1024, 1024, 33712]
    - [10, 10803.9]
  - - [1024, 5888, 1, 4096, 1024, 1024, 1024, 4096]
    - [2, 12171.3]
  - - [4096, 6720, 1, 1024, 4096, 4096, 4096, 1024]
    - [60, 12253.8]
  - - [1024, 8232, 1, 1024, 1024, 1024, 1024, 1024]
    - [6, 11669.7]
  - - [1024, 6968, 1, 33712, 1024, 1024, 1024, 33712]
    - [13, 11204.8]
  - - [1024, 13312, 1, 1024, 1024, 1024, 1024, 1024]
    - [0, 12584.4]
  - - [1024, 7192, 1, 33712, 1024, 1024, 1024, 33712]
    - [13, 10909.0]
  - - [1024, 480, 1, 1024, 1024, 1024, 1024, 1024]
    - [31, 8399.81]
  - - [4096, 10112, 1, 1024, 4096, 4096, 4096, 1024]
    - [35, 12544.9]
  - - [1024, 8592, 1, 33712, 1024, 1024, 1024, 33712]
    - [8, 10963.4]
  - - [1024, 10112, 1, 4096, 1024, 1024, 1024, 4096]
    - [2, 12350.8]
  - - [1024, 8736, 1, 1024, 1024, 1024, 1024, 1024]
    - [50, 11796.0]
  - - [1024, 5720, 1, 4096, 1024, 1024, 1024, 4096]
    - [12, 10650.7]
  - - [1024, 3040, 1, 4096, 1024, 1024, 1024, 4096]
    - [7, 9817.25]
  - - [1024, 5280, 1, 33712, 1024, 1024, 1024, 33712]
    - [18, 10542.7]
  - - [4096, 8432, 1, 1024, 4096, 4096, 4096, 1024]
    - [62, 12326.2]
  - - [1024, 9520, 1, 4096, 1024, 1024, 1024, 4096]
    - [0, 11966.7]
  - - [1024, 5576, 1, 4096, 1024, 1024, 1024, 4096]
    - [0, 11537.2]
  - - [4096, 7840, 1, 1024, 4096, 4096, 4096, 1024]
    - [62, 12283.4]
  - - [1024, 2112, 1, 1024, 1024, 1024, 1024, 1024]
    - [4, 11529.5]
  - - [1024, 9880, 1, 33712, 1024, 1024, 1024, 33712]
    - [2, 10250.2]
  - - [4096, 9312, 1, 1024, 4096, 4096, 4096, 1024]
    - [0, 12714.6]
  - - [1024, 9504, 1, 4096, 1024, 1024, 1024, 4096]
    - [0, 11766.6]
  - - [1024, 9984, 1, 1024, 1024, 1024, 1024, 1024]
    - [0, 12472.5]
  - - [4096, 10184, 1, 1024, 4096, 4096, 4096, 1024]
    - [35, 12536.3]
  - - [1024, 9912, 1, 4096, 1024, 1024, 1024, 4096]
    - [6, 11825.8]
  - - [4096, 2112, 1, 1024, 4096, 4096, 4096, 1024]
    - [4, 11506.7]
  - - [1024, 8576, 1, 4096, 1024, 1024, 1024, 4096]
    - [34, 10959.3]
  - - [1024, 9576, 1, 1024, 1024, 1024, 1024, 1024]
    - [0, 12555.2]
  - - [1024, 8512, 1, 33712, 1024, 1024, 1024, 33712]
    - [8, 10862.8]
  - - [1024, 9912, 1, 1024, 1024, 1024, 1024, 1024]
    - [6, 12573.1]
  - - [4096, 7056, 1, 1024, 4096, 4096, 4096, 1024]
    - [60, 12246.3]
  - - [1024, 7560, 1, 33712, 1024, 1024, 1024, 33712]
    - [12, 11180.1]
  - - [4096, 1344, 1, 1024, 4096, 4096, 4096, 1024]
    - [6, 12216.4]
  - - [1024, 3024, 1, 4096, 1024, 1024, 1024, 4096]
    - [23, 10307.8]
  - - [4096, 9744, 1, 1024, 4096, 4096, 4096, 1024]
    - [35, 12625.8]
  - - [4096, 9920, 1, 1024, 4096, 4096, 4096, 1024]
    - [35, 12502.8]
  - - [1024, 420, 1, 1024, 1024, 1024, 1024, 1024]
    - [7, 7281.78]
  - - [1024, 8064, 1, 33712, 1024, 1024, 1024, 33712]
    - [9, 11058.2]
  - - [4096, 8928, 1, 1024, 4096, 4096, 4096, 1024]
    - [0, 12684.1]
  - - [1024, 6968, 1, 1024, 1024, 1024, 1024, 1024]
    - [0, 12092.0]
  - - [1024, 8928, 1, 4096, 1024, 1024, 1024, 4096]
    - [44, 10994.8]
  - - [1024, 5504, 1, 33712, 1024, 1024, 1024, 33712]
    - [2, 10864.1]
  - - [1024, 9768, 1, 1024, 1024, 1024, 1024, 1024]
    - [4, 11783.8]
  - - [4096, 10000, 1, 1024, 4096, 4096, 4096, 1024]
    - [35, 12649.9]
  - - [1024, 7920, 1, 33712, 1024, 1024, 1024, 33712]
    - [14, 10720.6]
  - - [1024, 5936, 1, 4096, 1024, 1024, 1024, 4096]
    - [3, 11801.0]
  - - [1024, 8904, 1, 33712, 1024, 1024, 1024, 33712]
    - [8, 10480.6]
  - - [1024, 9072, 1, 4096, 1024, 1024, 1024, 4096]
    - [2, 12192.6]
  - - [4096, 8664, 1, 1024, 4096, 4096, 4096, 1024]
    - [0, 12518.0]
  - - [1024, 9768, 1, 33712, 1024, 1024, 1024, 33712]
    - [10, 10311.9]
  - - [1024, 9768, 1, 4096, 1024, 1024, 1024, 4096]
    - [2, 12208.5]
  - - [1024, 9112, 1, 1024, 1024, 1024, 1024, 1024]
    - [1, 12070.0]
  - - [4096, 6768, 1, 1024, 4096, 4096, 4096, 1024]
    - [70, 12189.1]
  - - [1024, 8664, 1, 33712, 1024, 1024, 1024, 33712]
    - [10, 10467.9]
  - - [1024, 6160, 1, 1024, 1024, 1024, 1024, 1024]
    - [4, 12383.5]
  - - [1024, 8968, 1, 4096, 1024, 1024, 1024, 4096]
    - [33, 10998.6]
  - - [4096, 9112, 1, 1024, 4096, 4096, 4096, 1024]
    - [0, 12595.7]
  - - [1024, 5632, 1, 1024, 1024, 1024, 1024, 1024]
    - [1, 12075.8]
  - - [4096, 8160, 1, 1024, 4096, 4096, 4096, 1024]
    - [44, 12418.9]
  - - [1024, 3696, 1, 1024, 1024, 1024, 1024, 1024]
    - [7, 11958.5]
  - - [1024, 9120, 1, 4096, 1024, 1024, 1024, 4096]
    - [6, 11711.9]
  - - [1024, 8160, 1, 4096, 1024, 1024, 1024, 4096]
    - [0, 11776.2]
  - - [4096, 5880, 1, 1024, 4096, 4096, 4096, 1024]
    - [1, 12544.5]
  - - [1024, 11776, 1, 1024, 1024, 1024, 1024, 1024]
    - [35, 10562.5]
  - - [1024, 9920, 1, 4096, 1024, 1024, 1024, 4096]
    - [22, 11134.7]
  - - [1024, 5200, 1, 4096, 1024, 1024, 1024, 4096]
    - [0, 10979.4]
  - - [1024, 8400, 1, 1024, 1024, 1024, 1024, 1024]
    - [44, 11596.8]
  - - [1024, 912, 1, 1024, 1024, 1024, 1024, 1024]
    - [29, 10495.0]
  - - [1024, 8680, 1, 1024, 1024, 1024, 1024, 1024]
    - [0, 12266.3]
  - - [1024, 8640, 1, 4096, 1024, 1024, 1024, 4096]
    - [12, 11348.4]
  - - [1024, 2400, 1, 33712, 1024, 1024, 1024, 33712]
    - [25, 8895.94]
  - - [1024, 8640, 1, 33712, 1024, 1024, 1024, 33712]
    - [9, 10905.9]
  - - [4096, 10176, 1, 1024, 4096, 4096, 4096, 1024]
    - [0, 12763.2]
  - - [1024, 8736, 1, 33712, 1024, 1024, 1024, 33712]
    - [15, 10604.0]
  - - [4096, 9344, 1, 1024, 4096, 4096, 4096, 1024]
    - [0, 12749.0]
  - - [1024, 7904, 1, 1024, 1024, 1024, 1024, 1024]
    - [0, 12159.5]
  - - [1024, 10184, 1, 33712, 1024, 1024, 1024, 33712]
    - [33, 10018.6]
  - - [4096, 9400, 1, 1024, 4096, 4096, 4096, 1024]
    - [0, 12764.3]
  - - [1024, 10032, 1, 4096, 1024, 1024, 1024, 4096]
    - [0, 11903.9]
  - - [1024, 9400, 1, 4096, 1024, 1024, 1024, 4096]
    - [40, 11381.2]
  - - [4096, 4392, 1, 1024, 4096, 4096, 4096, 1024]
    - [0, 12567.1]
  - - [1024, 8040, 1, 1024, 1024, 1024, 1024, 1024]
    - [60, 11517.1]
  - - [1024, 8840, 1, 1024, 1024, 1024, 1024, 1024]
    - [60, 11442.6]
  - - [1024, 8400, 1, 4096, 1024, 1024, 1024, 4096]
    - [34, 11226.1]
  - - [4096, 7144, 1, 1024, 4096, 4096, 4096, 1024]
    - [0, 12641.8]
  - - [1024, 8664, 1, 1024, 1024, 1024, 1024, 1024]
    - [6, 12458.6]
  - - [1024, 8840, 1, 33712, 1024, 1024, 1024, 33712]
    - [8, 10471.2]
  - - [1024, 6912, 1, 33712, 1024, 1024, 1024, 33712]
    - [13, 11098.1]
  - - [1024, 5280, 1, 4096, 1024, 1024, 1024, 4096]
    - [2, 11826.5]
  - - [1024, 10032, 1, 33712, 1024, 1024, 1024, 33712]
    - [33, 10198.0]
  - - [4096, 9600, 1, 1024, 4096, 4096, 4096, 1024]
    - [0, 12767.4]
  - - [1024, 9864, 1, 1024, 1024, 1024, 1024, 1024]
    - [0, 12343.8]
  - - [4096, 9632, 1, 1024, 4096, 4096, 4096, 1024]
    - [35, 12629.2]
  - - [1024, 9952, 1, 4096, 1024, 1024, 1024, 4096]
    - [0, 11708.3]
  - - [1024, 8584, 1, 33712, 1024, 1024, 1024, 33712]
    - [8, 10983.8]
  - - [1024, 9024, 1, 1024, 1024, 1024, 1024, 1024]
    - [6, 12627.2]
  - - [1024, 4864, 1, 1024, 1024, 1024, 1024, 1024]
    - [27, 11251.9]
  - - [1024, 9360, 1, 1024, 1024, 1024, 1024, 1024]
    - [34, 10906.1]
  - - [4096, 8448, 1, 1024, 4096, 4096, 4096, 1024]
    - [44, 12370.6]
  - - [1024, 9360, 1, 33712, 1024, 1024, 1024, 33712]
    - [8, 10353.0]
  - - [1024, 9880, 1, 1024, 1024, 1024, 1024, 1024]
    - [7, 12550.8]
  - - [1024, 9312, 1, 4096, 1024, 1024, 1024, 4096]
    - [40, 11207.4]
  - - [1024, 5472, 1, 33712, 1024, 1024, 1024, 33712]
    - [56, 10748.1]
  - - [1024, 7968, 1, 4096, 1024, 1024, 1024, 4096]
    - [3, 11293.6]
  - - [1024, 8232, 1, 33712, 1024, 1024, 1024, 33712]
    - [15, 10881.1]
  - - [4096, 6960, 1, 1024, 4096, 4096, 4096, 1024]
    - [0, 12684.3]
  - - [1024, 9144, 1, 1024, 1024, 1024, 1024, 1024]
    - [6, 11657.6]
  - - [4096, 8496, 1, 1024, 4096, 4096, 4096, 1024]
    - [44, 12336.5]
  - - [1024, 9216, 1, 4096, 1024, 1024, 1024, 4096]
    - [0, 12090.4]
  - - [1024, 5824, 1, 1024, 1024, 1024, 1024, 1024]
    - [1, 12019.5]
  - - [1024, 9248, 1, 1024, 1024, 1024, 1024, 1024]
    - [60, 11193.6]
  - - [4096, 2040, 1, 1024, 4096, 4096, 4096, 1024]
    - [60, 11681.3]
  - - [4096, 8712, 1, 1024, 4096, 4096, 4096, 1024]
    - [44, 12364.5]
  - - [1024, 2112, 1, 4096, 1024, 1024, 1024, 4096]
    - [1, 10619.5]
  - - [1024, 4704, 1, 1024, 1024, 1024, 1024, 1024]
    - [13, 10324.2]
  - - [4096, 5824, 1, 1024, 4096, 4096, 4096, 1024]
    - [60, 12092.4]
  - - [4096, 6480, 1, 1024, 4096, 4096, 4096, 1024]
    - [70, 12278.2]
  - - [1024, 6880, 1, 1024, 1024, 1024, 1024, 1024]
    - [22, 11826.5]
  - - [1024, 1984, 1, 1024, 1024, 1024, 1024, 1024]
    - [29, 10138.3]
  - - [4096, 6120, 1, 1024, 4096, 4096, 4096, 1024]
    - [60, 12202.0]
  - - [1024, 8448, 1, 33712, 1024, 1024, 1024, 33712]
    - [8, 10711.2]
  - - [1024, 5456, 1, 4096, 1024, 1024, 1024, 4096]
    - [2, 11740.2]
  - - [4096, 9184, 1, 1024, 4096, 4096, 4096, 1024]
    - [36, 12364.3]
  - - [1024, 5824, 1, 4096, 1024, 1024, 1024, 4096]
    - [0, 11618.9]
  - - [1024, 8880, 1, 33712, 1024, 1024, 1024, 33712]
    - [8, 10464.0]
  - - [1024, 8160, 1, 33712, 1024, 1024, 1024, 33712]
    - [14, 10749.9]
  - - [4096, 5104, 1, 1024, 4096, 4096, 4096, 1024]
    - [0, 12596.3]
  - - [1024, 7696, 1, 1024, 1024, 1024, 1024, 1024]
    - [60, 11626.6]
  - - [4096, 6336, 1, 1024, 4096, 4096, 4096, 1024]
    - [70, 12255.6]
  - - [1024, 7696, 1, 4096, 1024, 1024, 1024, 4096]
    - [45, 10557.3]
  - - [4096, 8024, 1, 1024, 4096, 4096, 4096, 1024]
    - [62, 12385.5]
  - - [1024, 8600, 1, 1024, 1024, 1024, 1024, 1024]
    - [1, 12478.9]
  - - [4096, 8600, 1, 1024, 4096, 4096, 4096, 1024]
    - [62, 12381.2]
  - - [1024, 5720, 1, 1024, 1024, 1024, 1024, 1024]
    - [4, 12390.2]
  - - [1024, 8600, 1, 4096, 1024, 1024, 1024, 4096]
    - [12, 11692.2]
  - - [1024, 10184, 1, 4096, 1024, 1024, 1024, 4096]
    - [4, 12155.3]
  - - [1024, 8648, 1, 33712, 1024, 1024, 1024, 33712]
    - [10, 10392.9]
  - - [1024, 9464, 1, 33712, 1024, 1024, 1024, 33712]
    - [33, 10376.7]
  - - [1024, 5400, 1, 33712, 1024, 1024, 1024, 33712]
    - [2, 10831.0]
  - - [1024, 17408, 1, 1024, 1024, 1024, 1024, 1024]
    - [4, 11910.5]
  - - [1024, 5400, 1, 4096, 1024, 1024, 1024, 4096]
    - [34, 10590.5]
  - - [1024, 5456, 1, 1024, 1024, 1024, 1024, 1024]
    - [62, 10871.5]
  - - [4096, 6440, 1, 1024, 4096, 4096, 4096, 1024]
    - [60, 12186.1]
  - - [4096, 5456, 1, 1024, 4096, 4096, 4096, 1024]
    - [61, 12029.5]
  - - [1024, 8520, 1, 1024, 1024, 1024, 1024, 1024]
    - [60, 11587.9]
  - - [4096, 8520, 1, 1024, 4096, 4096, 4096, 1024]
    - [44, 12348.1]
  - - [1024, 8816, 1, 33712, 1024, 1024, 1024, 33712]
    - [10, 10619.2]
  - - [4096, 7936, 1, 1024, 4096, 4096, 4096, 1024]
    - [0, 12724.7]
  - - [4096, 7400, 1, 1024, 4096, 4096, 4096, 1024]
    - [2, 12285.8]
  - - [1024, 8784, 1, 33712, 1024, 1024, 1024, 33712]
    - [10, 10559.4]
  - - [1024, 8784, 1, 4096, 1024, 1024, 1024, 4096]
    - [2, 12116.4]
  - - [4096, 6656, 1, 1024, 4096, 4096, 4096, 1024]
    - [0, 12737.8]
  - - [1024, 2392, 1, 1024, 1024, 1024, 1024, 1024]
    - [45, 10574.2]
  - - [1024, 4352, 1, 4096, 1024, 1024, 1024, 4096]
    - [0, 11301.1]
  - - [1024, 9720, 1, 1024, 1024, 1024, 1024, 1024]
    - [1, 11669.0]
  - - [1024, 2392, 1, 4096, 1024, 1024, 1024, 4096]
    - [6, 10377.3]
  - - [1024, 3584, 1, 1024, 1024, 1024, 1024, 1024]
    - [4, 10573.1]
  - - [4096, 3584, 1, 1024, 4096, 4096, 4096, 1024]
    - [69, 11214.1]
  - - [1024, 5760, 1, 33712, 1024, 1024, 1024, 33712]
    - [8, 11191.6]
  - - [1024, 9272, 1, 1024, 1024, 1024, 1024, 1024]
    - [6, 12350.6]
  - - [4096, 7968, 1, 1024, 4096, 4096, 4096, 1024]
    - [62, 12302.4]
  - - [1024, 5040, 1, 1024, 1024, 1024, 1024, 1024]
    - [6, 12004.4]
  - - [1024, 452, 1, 1024, 1024, 1024, 1024, 1024]
    - [68, 7684.12]
  - - [4096, 3696, 1, 1024, 4096, 4096, 4096, 1024]
    - [0, 12313.4]
  - - [4096, 6528, 1, 1024, 4096, 4096, 4096, 1024]
    - [60, 12138.4]
  - - [1024, 6048, 1, 33712, 1024, 1024, 1024, 33712]
    - [7, 11219.8]
  - - [4096, 6048, 1, 1024, 4096, 4096, 4096, 1024]
    - [2, 12394.5]
  - - [1024, 8400, 1, 33712, 1024, 1024, 1024, 33712]
    - [15, 10775.2]
  - - [1024, 8520, 1, 33712, 1024, 1024, 1024, 33712]
    - [8, 10732.5]
  - - [1024, 3072, 1, 1024, 1024, 1024, 1024, 1024]
    - [4, 11937.5]
  - - [1024, 3072, 1, 33712, 1024, 1024, 1024, 33712]
    - [3, 9595.41]
  - - [1024, 10112, 1, 1024, 1024, 1024, 1024, 1024]
    - [60, 11163.1]
  - - [4096, 3072, 1, 1024, 4096, 4096, 4096, 1024]
    - [4, 10838.5]
  - - [1024, 3072, 1, 4096, 1024, 1024, 1024, 4096]
    - [37, 9855.63]
  - - [1024, 10160, 1, 1024, 1024, 1024, 1024, 1024]
    - [36, 11138.2]
  - - [1024, 10160, 1, 33712, 1024, 1024, 1024, 33712]
    - [2, 10069.5]
  - - [1024, 10160, 1, 4096, 1024, 1024, 1024, 4096]
    - [2, 12415.2]
  - - [1024, 7480, 1, 1024, 1024, 1024, 1024, 1024]
    - [2, 12092.0]
  - - [4096, 9040, 1, 1024, 4096, 4096, 4096, 1024]
    - [44, 12361.9]
  - - [1024, 9040, 1, 4096, 1024, 1024, 1024, 4096]
    - [0, 11883.3]
  - - [1024, 6000, 1, 1024, 1024, 1024, 1024, 1024]
    - [0, 11960.9]
  - - [1024, 8448, 1, 4096, 1024, 1024, 1024, 4096]
    - [42, 10972.8]
  - - [1024, 7448, 1, 1024, 1024, 1024, 1024, 1024]
    - [2, 12061.0]
  - - [1024, 8496, 1, 4096, 1024, 1024, 1024, 4096]
    - [34, 11315.2]
  - - [1024, 9328, 1, 4096, 1024, 1024, 1024, 4096]
    - [0, 12130.8]
  - - [1024, 6384, 1, 1024, 1024, 1024, 1024, 1024]
    - [0, 12262.0]
  - - [1024, 4480, 1, 4096, 1024, 1024, 1024, 4096]
    - [46, 9918.51]
  - - [1024, 6656, 1, 4096, 1024, 1024, 1024, 4096]
    - [0, 11039.7]
  - - [1024, 9184, 1, 4096, 1024, 1024, 1024, 4096]
    - [33, 11372.9]
  - - [4096, 6384, 1, 1024, 4096, 4096, 4096, 1024]
    - [0, 12699.4]
  - - [1024, 6384, 1, 4096, 1024, 1024, 1024, 4096]
    - [33, 11298.0]
  - - [1024, 6120, 1, 1024, 1024, 1024, 1024, 1024]
    - [39, 11887.4]
  - - [4096, 9752, 1, 1024, 4096, 4096, 4096, 1024]
    - [35, 12503.6]
  - - [1024, 9016, 1, 33712, 1024, 1024, 1024, 33712]
    - [8, 10630.8]
  - - [4096, 4032, 1, 1024, 4096, 4096, 4096, 1024]
    - [0, 12550.7]
  - - [1024, 9640, 1, 1024, 1024, 1024, 1024, 1024]
    - [61, 11117.7]
  - - [4096, 9424, 1, 1024, 4096, 4096, 4096, 1024]
    - [44, 12232.6]
  - - [1024, 5888, 1, 1024, 1024, 1024, 1024, 1024]
    - [0, 12172.7]
  - - [1024, 6120, 1, 4096, 1024, 1024, 1024, 4096]
    - [22, 10931.6]
  - - [1024, 9720, 1, 33712, 1024, 1024, 1024, 33712]
    - [10, 10207.7]
  - - [4096, 9720, 1, 1024, 4096, 4096, 4096, 1024]
    - [0, 12737.6]
  - - [1024, 5840, 1, 1024, 1024, 1024, 1024, 1024]
    - [1, 12065.9]
  - - [4096, 5840, 1, 1024, 4096, 4096, 4096, 1024]
    - [60, 12117.9]
  - - [1024, 5840, 1, 4096, 1024, 1024, 1024, 4096]
    - [55, 10830.3]
  - - [1024, 8624, 1, 1024, 1024, 1024, 1024, 1024]
    - [60, 11711.2]
  - - [4096, 8624, 1, 1024, 4096, 4096, 4096, 1024]
    - [44, 12345.9]
  - - [1024, 7384, 1, 1024, 1024, 1024, 1024, 1024]
    - [0, 12412.9]
  - - [1024, 8624, 1, 4096, 1024, 1024, 1024, 4096]
    - [34, 11386.7]
  - - [1024, 9464, 1, 1024, 1024, 1024, 1024, 1024]
    - [0, 12420.8]
  - - [4096, 9768, 1, 1024, 4096, 4096, 4096, 1024]
    - [35, 12644.7]
  - - [4096, 9952, 1, 1024, 4096, 4096, 4096, 1024]
    - [35, 12598.0]
  - - [1024, 6624, 1, 4096, 1024, 1024, 1024, 4096]
    - [2, 11078.1]
  - - [4096, 8120, 1, 1024, 4096, 4096, 4096, 1024]
    - [62, 12367.7]
  - - [1024, 9568, 1, 1024, 1024, 1024, 1024, 1024]
    - [1, 12392.2]
  - - [1024, 8256, 1, 1024, 1024, 1024, 1024, 1024]
    - [60, 11813.6]
  - - [1024, 8120, 1, 4096, 1024, 1024, 1024, 4096]
    - [34, 11583.0]
  - - [1024, 4968, 1, 1024, 1024, 1024, 1024, 1024]
    - [4, 12263.0]
  - - [4096, 6360, 1, 1024, 4096, 4096, 4096, 1024]
    - [70, 12296.1]
  - - [1024, 6336, 1, 33712, 1024, 1024, 1024, 33712]
    - [13, 11029.2]
  - - [1024, 6336, 1, 4096, 1024, 1024, 1024, 4096]
    - [2, 12169.4]
  - - [1024, 9776, 1, 4096, 1024, 1024, 1024, 4096]
    - [33, 10938.9]
  - - [1024, 9648, 1, 1024, 1024, 1024, 1024, 1024]
    - [1, 12144.2]
  - - [1024, 8432, 1, 4096, 1024, 1024, 1024, 4096]
    - [44, 11048.1]
  - - [1024, 9680, 1, 33712, 1024, 1024, 1024, 33712]
    - [25, 10157.5]
  - - [4096, 9648, 1, 1024, 4096, 4096, 4096, 1024]
    - [0, 12722.4]
  - - [1024, 5440, 1, 4096, 1024, 1024, 1024, 4096]
    - [0, 11609.5]
  - - [1024, 9184, 1, 1024, 1024, 1024, 1024, 1024]
    - [60, 11128.4]
  - - [1024, 8760, 1, 1024, 1024, 1024, 1024, 1024]
    - [61, 11105.4]
  - - [1024, 8536, 1, 4096, 1024, 1024, 1024, 4096]
    - [34, 10954.4]
  - - [4096, 8040, 1, 1024, 4096, 4096, 4096, 1024]
    - [0, 12660.7]
  - - [4096, 8760, 1, 1024, 4096, 4096, 4096, 1024]
    - [1, 12580.5]
  - - [1024, 8040, 1, 4096, 1024, 1024, 1024, 4096]
    - [0, 12054.6]
  - - [1024, 4968, 1, 4096, 1024, 1024, 1024, 4096]
    - [2, 11608.2]
  - - [1024, 9752, 1, 33712, 1024, 1024, 1024, 33712]
    - [10, 10111.4]
  - - [1024, 6032, 1, 33712, 1024, 1024, 1024, 33712]
    - [2, 11045.6]
  - - [4096, 6032, 1, 1024, 4096, 4096, 4096, 1024]
    - [3, 12360.3]
  - - [1024, 7688, 1, 4096, 1024, 1024, 1024, 4096]
    - [64, 10330.7]
  - - [1024, 6032, 1, 4096, 1024, 1024, 1024, 4096]
    - [2, 11774.4]
  - - [1024, 4216, 1, 4096, 1024, 1024, 1024, 4096]
    - [6, 10616.7]
  - - [1024, 7168, 1, 1024, 1024, 1024, 1024, 1024]
    - [35, 12076.1]
  - - [1024, 9152, 1, 33712, 1024, 1024, 1024, 33712]
    - [33, 10660.0]
  - - [1024, 9928, 1, 1024, 1024, 1024, 1024, 1024]
    - [6, 12608.1]
  - - [4096, 7616, 1, 1024, 4096, 4096, 4096, 1024]
    - [62, 12303.8]
  - - [1024, 10120, 1, 4096, 1024, 1024, 1024, 4096]
    - [2, 11534.6]
  - - [1024, 8800, 1, 4096, 1024, 1024, 1024, 4096]
    - [14, 11490.6]
  - - [4096, 9928, 1, 1024, 4096, 4096, 4096, 1024]
    - [0, 12680.9]
  - - [4096, 3256, 1, 1024, 4096, 4096, 4096, 1024]
    - [1, 12445.9]
  - - [1024, 9168, 1, 1024, 1024, 1024, 1024, 1024]
    - [60, 11112.1]
  - - [1024, 10240, 1, 33712, 1024, 1024, 1024, 33712]
    - [18, 10075.4]
  - - [1024, 4800, 1, 33712, 1024, 1024, 1024, 33712]
    - [40, 10676.8]
  - - [1024, 7488, 1, 33712, 1024, 1024, 1024, 33712]
    - [12, 11090.2]
  - - [4096, 4800, 1, 1024, 4096, 4096, 4096, 1024]
    - [0, 12702.9]
  - - [1024, 7992, 1, 1024, 1024, 1024, 1024, 1024]
    - [54, 11317.2]
  - - [1024, 4800, 1, 4096, 1024, 1024, 1024, 4096]
    - [34, 10403.4]
  - - [1024, 4048, 1, 4096, 1024, 1024, 1024, 4096]
    - [15, 10027.9]
  - - [1024, 9384, 1, 4096, 1024, 1024, 1024, 4096]
    - [41, 11043.3]
  - - [1024, 7504, 1, 1024, 1024, 1024, 1024, 1024]
    - [1, 12105.4]
  - - [1024, 7504, 1, 4096, 1024, 1024, 1024, 4096]
    - [13, 11317.7]
  - - [1024, 6496, 1, 4096, 1024, 1024, 1024, 4096]
    - [11, 11257.2]
  - - [1024, 6784, 1, 1024, 1024, 1024, 1024, 1024]
    - [60, 11561.4]
  - - [4096, 6784, 1, 1024, 4096, 4096, 4096, 1024]
    - [60, 12201.6]
  - - [1024, 4224, 1, 1024, 1024, 1024, 1024, 1024]
    - [6, 11391.9]
  - - [1024, 8760, 1, 33712, 1024, 1024, 1024, 33712]
    - [10, 10547.7]
  - - [1024, 7728, 1, 1024, 1024, 1024, 1024, 1024]
    - [6, 12425.4]
  - - [4096, 7728, 1, 1024, 4096, 4096, 4096, 1024]
    - [62, 12291.2]
  - - [1024, 9328, 1, 1024, 1024, 1024, 1024, 1024]
    - [4, 11815.2]
  - - [1024, 8592, 1, 4096, 1024, 1024, 1024, 4096]
    - [33, 11023.6]
  - - [1024, 7440, 1, 1024, 1024, 1024, 1024, 1024]
    - [1, 12144.1]
  - - [1024, 3808, 1, 4096, 1024, 1024, 1024, 4096]
    - [20, 10199.7]
  - - [4096, 9328, 1, 1024, 4096, 4096, 4096, 1024]
    - [35, 12659.6]
  - - [1024, 9968, 1, 1024, 1024, 1024, 1024, 1024]
    - [0, 12464.4]
  - - [1024, 7056, 1, 1024, 1024, 1024, 1024, 1024]
    - [35, 11702.4]
  - - [1024, 7056, 1, 4096, 1024, 1024, 1024, 4096]
    - [37, 10876.0]
  - - [1024, 9280, 1, 1024, 1024, 1024, 1024, 1024]
    - [4, 11760.1]
  - - [1024, 7688, 1, 1024, 1024, 1024, 1024, 1024]
    - [60, 11613.2]
  - - [4096, 9280, 1, 1024, 4096, 4096, 4096, 1024]
    - [36, 12515.4]
  - - [1024, 8712, 1, 33712, 1024, 1024, 1024, 33712]
    - [10, 10458.6]
  - - [1024, 7344, 1, 1024, 1024, 1024, 1024, 1024]
    - [4, 12447.8]
  - - [4096, 7344, 1, 1024, 4096, 4096, 4096, 1024]
    - [60, 12211.0]
  - - [1024, 9672, 1, 1024, 1024, 1024, 1024, 1024]
    - [6, 11740.4]
  - - [1024, 7344, 1, 4096, 1024, 1024, 1024, 4096]
    - [37, 10926.7]
  - - [1024, 7144, 1, 1024, 1024, 1024, 1024, 1024]
    - [35, 12049.6]
  - - [1024, 7616, 1, 33712, 1024, 1024, 1024, 33712]
    - [13, 11454.9]
  - - [1024, 6600, 1, 33712, 1024, 1024, 1024, 33712]
    - [13, 11043.0]
  - - [1024, 7144, 1, 4096, 1024, 1024, 1024, 4096]
    - [2, 12003.3]
  - - [1024, 5640, 1, 4096, 1024, 1024, 1024, 4096]
    - [3, 10611.8]
  - - [1024, 7400, 1, 1024, 1024, 1024, 1024, 1024]
    - [45, 11315.1]
  - - [1024, 7400, 1, 4096, 1024, 1024, 1024, 4096]
    - [43, 10731.4]
  - - [1024, 8800, 1, 1024, 1024, 1024, 1024, 1024]
    - [4, 11731.4]
  - - [1024, 7488, 1, 4096, 1024, 1024, 1024, 4096]
    - [43, 10850.3]
  - - [1024, 7488, 1, 1024, 1024, 1024, 1024, 1024]
    - [6, 11580.7]
  - - [1024, 9864, 1, 33712, 1024, 1024, 1024, 33712]
    - [2, 10206.9]
  - - [1024, 5568, 1, 1024, 1024, 1024, 1024, 1024]
    - [6, 12198.0]
  - - [1024, 8128, 1, 33712, 1024, 1024, 1024, 33712]
    - [13, 11081.2]
  - - [4096, 5568, 1, 1024, 4096, 4096, 4096, 1024]
    - [0, 12712.2]
  - - [4096, 7888, 1, 1024, 4096, 4096, 4096, 1024]
    - [62, 12291.8]
  - - [1024, 8432, 1, 33712, 1024, 1024, 1024, 33712]
    - [15, 11222.8]
  - - [1024, 5568, 1, 4096, 1024, 1024, 1024, 4096]
    - [2, 11971.9]
  - - [1024, 10040, 1, 1024, 1024, 1024, 1024, 1024]
    - [36, 11034.4]
  - - [1024, 2720, 1, 33712, 1024, 1024, 1024, 33712]
    - [12, 10133.0]
  - - [4096, 3400, 1, 1024, 4096, 4096, 4096, 1024]
    - [62, 11176.7]
  - - [1024, 7520, 1, 1024, 1024, 1024, 1024, 1024]
    - [35, 12001.2]
  - - [4096, 8944, 1, 1024, 4096, 4096, 4096, 1024]
    - [44, 12312.5]
  - - [4096, 7520, 1, 1024, 4096, 4096, 4096, 1024]
    - [0, 12719.4]
  - - [1024, 7520, 1, 4096, 1024, 1024, 1024, 4096]
    - [2, 11265.6]
  - - [1024, 476, 1, 1024, 1024, 1024, 1024, 1024]
    - [31, 8113.17]
  - - [1024, 8928, 1, 33712, 1024, 1024, 1024, 33712]
    - [8, 10416.9]
  - - [1024, 7680, 1, 1024, 1024, 1024, 1024, 1024]
    - [4, 12600.2]
  - - [1024, 7680, 1, 4096, 1024, 1024, 1024, 4096]
    - [43, 10975.3]
  - - [1024, 8296, 1, 1024, 1024, 1024, 1024, 1024]
    - [4, 12494.2]
  - - [1024, 9296, 1, 1024, 1024, 1024, 1024, 1024]
    - [71, 11148.7]
  - - [1024, 9296, 1, 33712, 1024, 1024, 1024, 33712]
    - [18, 10567.8]
  - - [1024, 9296, 1, 4096, 1024, 1024, 1024, 4096]
    - [2, 12185.3]
  - - [1024, 10120, 1, 1024, 1024, 1024, 1024, 1024]
    - [0, 12374.7]
  - - [1024, 5472, 1, 1024, 1024, 1024, 1024, 1024]
    - [40, 10900.1]
  - - [1024, 10152, 1, 33712, 1024, 1024, 1024, 33712]
    - [2, 10059.2]
  - - [4096, 5472, 1, 1024, 4096, 4096, 4096, 1024]
    - [0, 12630.0]
  - - [1024, 5472, 1, 4096, 1024, 1024, 1024, 4096]
    - [15, 10330.2]
  - - [1024, 7440, 1, 4096, 1024, 1024, 1024, 4096]
    - [42, 10795.7]
  - - [4096, 7440, 1, 1024, 4096, 4096, 4096, 1024]
    - [60, 12175.2]
  - - [1024, 7920, 1, 1024, 1024, 1024, 1024, 1024]
    - [6, 12375.9]
  - - [1024, 9648, 1, 33712, 1024, 1024, 1024, 33712]
    - [2, 10222.8]
  - - [1024, 6440, 1, 4096, 1024, 1024, 1024, 4096]
    - [2, 11951.0]
  - - [1024, 9928, 1, 33712, 1024, 1024, 1024, 33712]
    - [33, 10079.2]
  - - [1024, 7176, 1, 33712, 1024, 1024, 1024, 33712]
    - [12, 10900.2]
  - - [1024, 4896, 1, 1024, 1024, 1024, 1024, 1024]
    - [6, 12207.1]
  - - [1024, 400, 1, 1024, 1024, 1024, 1024, 1024]
    - [49, 6889.46]
  - - [4096, 8544, 1, 1024, 4096, 4096, 4096, 1024]
    - [44, 12363.4]
  - - [1024, 4896, 1, 33712, 1024, 1024, 1024, 33712]
    - [2, 11486.8]
  - - [1024, 1984, 1, 4096, 1024, 1024, 1024, 4096]
    - [6, 10429.0]
  - - [1024, 4896, 1, 4096, 1024, 1024, 1024, 4096]
    - [34, 10249.2]
  - - [1024, 6128, 1, 1024, 1024, 1024, 1024, 1024]
    - [38, 11218.0]
  - - [4096, 6880, 1, 1024, 4096, 4096, 4096, 1024]
    - [70, 12221.6]
  - - [4096, 4488, 1, 1024, 4096, 4096, 4096, 1024]
    - [34, 11149.5]
  - - [1024, 7144, 1, 33712, 1024, 1024, 1024, 33712]
    - [13, 11514.8]
  - - [4096, 8280, 1, 1024, 4096, 4096, 4096, 1024]
    - [0, 12671.8]
  - - [1024, 6128, 1, 4096, 1024, 1024, 1024, 4096]
    - [0, 11570.7]
  - - [4096, 8680, 1, 1024, 4096, 4096, 4096, 1024]
    - [44, 12418.3]
  - - [1024, 5632, 1, 4096, 1024, 1024, 1024, 4096]
    - [0, 11821.5]
  - - [1024, 7568, 1, 1024, 1024, 1024, 1024, 1024]
    - [53, 11345.6]
  - - [1024, 9200, 1, 4096, 1024, 1024, 1024, 4096]
    - [6, 10944.4]
  - - [4096, 7568, 1, 1024, 4096, 4096, 4096, 1024]
    - [0, 12688.8]
  - - [1024, 2176, 1, 4096, 1024, 1024, 1024, 4096]
    - [7, 10368.5]
  - - [1024, 6080, 1, 1024, 1024, 1024, 1024, 1024]
    - [38, 11862.4]
  - - [1024, 7568, 1, 4096, 1024, 1024, 1024, 4096]
    - [12, 10696.3]
  - - [1024, 500, 1, 1024, 1024, 1024, 1024, 1024]
    - [31, 7225.58]
  - - [4096, 9088, 1, 1024, 4096, 4096, 4096, 1024]
    - [0, 12250.8]
  - - [1024, 7992, 1, 33712, 1024, 1024, 1024, 33712]
    - [8, 10940.3]
  - - [4096, 9216, 1, 1024, 4096, 4096, 4096, 1024]
    - [0, 12727.4]
  - - [1024, 8208, 1, 33712, 1024, 1024, 1024, 33712]
    - [15, 10950.3]
  - - [4096, 7992, 1, 1024, 4096, 4096, 4096, 1024]
    - [0, 12690.3]
  - - [1024, 7992, 1, 4096, 1024, 1024, 1024, 4096]
    - [2, 11454.0]
  - - [1024, 8576, 1, 33712, 1024, 1024, 1024, 33712]
    - [8, 10936.6]
  - - [4096, 8576, 1, 1024, 4096, 4096, 4096, 1024]
    - [0, 12755.8]
  - - [1024, 1224, 1, 4096, 1024, 1024, 1024, 4096]
    - [6, 9938.46]
  - - [1024, 9928, 1, 4096, 1024, 1024, 1024, 4096]
    - [25, 11071.6]
  - - [4096, 7384, 1, 1024, 4096, 4096, 4096, 1024]
    - [60, 12255.3]
  - - [1024, 7384, 1, 4096, 1024, 1024, 1024, 4096]
    - [2, 11220.3]
  - - [1024, 2040, 1, 1024, 1024, 1024, 1024, 1024]
    - [29, 10416.3]
  - - [1024, 5784, 1, 1024, 1024, 1024, 1024, 1024]
    - [0, 11989.8]
  - - [1024, 8616, 1, 1024, 1024, 1024, 1024, 1024]
    - [60, 11697.9]
  - - [1024, 8616, 1, 33712, 1024, 1024, 1024, 33712]
    - [8, 11039.5]
  - - [1024, 1856, 1, 1024, 1024, 1024, 1024, 1024]
    - [6, 11480.4]
  - - [4096, 8736, 1, 1024, 4096, 4096, 4096, 1024]
    - [44, 12361.1]
  - - [4096, 8616, 1, 1024, 4096, 4096, 4096, 1024]
    - [0, 12729.0]
  - - [4096, 5784, 1, 1024, 4096, 4096, 4096, 1024]
    - [0, 12587.1]
  - - [4096, 5776, 1, 1024, 4096, 4096, 4096, 1024]
    - [60, 12200.5]
  - - [1024, 8016, 1, 33712, 1024, 1024, 1024, 33712]
    - [9, 10888.0]
  - - [4096, 8960, 1, 1024, 4096, 4096, 4096, 1024]
    - [0, 12718.9]
  - - [4096, 8288, 1, 1024, 4096, 4096, 4096, 1024]
    - [0, 12678.5]
  - - [1024, 8016, 1, 4096, 1024, 1024, 1024, 4096]
    - [0, 11814.2]
  - - [4096, 912, 1, 1024, 4096, 4096, 4096, 1024]
    - [4, 11591.5]
  - - [1024, 7776, 1, 1024, 1024, 1024, 1024, 1024]
    - [53, 11073.6]
  - - [4096, 9472, 1, 1024, 4096, 4096, 4096, 1024]
    - [35, 12722.3]
  - - [1024, 8624, 1, 33712, 1024, 1024, 1024, 33712]
    - [8, 11085.9]
  - - [4096, 6240, 1, 1024, 4096, 4096, 4096, 1024]
    - [0, 12662.3]
  - - [1024, 5040, 1, 33712, 1024, 1024, 1024, 33712]
    - [10, 11108.9]
  - - [4096, 5040, 1, 1024, 4096, 4096, 4096, 1024]
    - [70, 11317.5]
  - - [1024, 9440, 1, 1024, 1024, 1024, 1024, 1024]
    - [36, 11009.1]
  - - [1024, 5040, 1, 4096, 1024, 1024, 1024, 4096]
    - [14, 10328.7]
  - - [1024, 8360, 1, 33712, 1024, 1024, 1024, 33712]
    - [14, 11013.9]
  - - [1024, 7904, 1, 4096, 1024, 1024, 1024, 4096]
    - [2, 12133.9]
  - - [4096, 8360, 1, 1024, 4096, 4096, 4096, 1024]
    - [44, 12332.7]
  - - [1024, 5120, 1, 4096, 1024, 1024, 1024, 4096]
    - [2, 11883.4]
  - - [1024, 10224, 1, 1024, 1024, 1024, 1024, 1024]
    - [0, 10876.4]
  - - [1024, 8360, 1, 4096, 1024, 1024, 1024, 4096]
    - [44, 11013.2]
  - - [1024, 7176, 1, 4096, 1024, 1024, 1024, 4096]
    - [0, 11752.3]
  - - [1024, 388, 1, 1024, 1024, 1024, 1024, 1024]
    - [29, 6587.56]
  - - [1024, 5576, 1, 1024, 1024, 1024, 1024, 1024]
    - [0, 11995.0]
  - - [1024, 3024, 1, 1024, 1024, 1024, 1024, 1024]
    - [4, 10215.5]
  - - [1024, 10040, 1, 33712, 1024, 1024, 1024, 33712]
    - [33, 10346.7]
  - - [1024, 9000, 1, 1024, 1024, 1024, 1024, 1024]
    - [6, 12604.4]
  - - [1024, 9472, 1, 4096, 1024, 1024, 1024, 4096]
    - [33, 11548.4]
  - - [1024, 6240, 1, 1024, 1024, 1024, 1024, 1024]
    - [0, 11978.4]
  - - [4096, 7296, 1, 1024, 4096, 4096, 4096, 1024]
    - [60, 12273.6]
  - - [1024, 8528, 1, 1024, 1024, 1024, 1024, 1024]
    - [4, 11693.5]
  - - [4096, 8528, 1, 1024, 4096, 4096, 4096, 1024]
    - [44, 12390.5]
  - - [4096, 8184, 1, 1024, 4096, 4096, 4096, 1024]
    - [0, 12697.6]
  - - [1024, 8184, 1, 4096, 1024, 1024, 1024, 4096]
    - [2, 11398.3]
  - - [1024, 9328, 1, 33712, 1024, 1024, 1024, 33712]
    - [18, 10645.0]
  - - [1024, 6032, 1, 1024, 1024, 1024, 1024, 1024]
    - [6, 12235.0]
  - - [1024, 9120, 1, 33712, 1024, 1024, 1024, 33712]
    - [33, 10237.8]
  - - [1024, 4352, 1, 1024, 1024, 1024, 1024, 1024]
    - [6, 11941.0]
  - - [4096, 8128, 1, 1024, 4096, 4096, 4096, 1024]
    - [62, 12371.6]
  - - [1024, 6048, 1, 1024, 1024, 1024, 1024, 1024]
    - [6, 12252.3]
  - - [1024, 4352, 1, 33712, 1024, 1024, 1024, 33712]
    - [6, 10908.0]
  - - [1024, 8256, 1, 33712, 1024, 1024, 1024, 33712]
    - [14, 10875.5]
  - - [4096, 9680, 1, 1024, 4096, 4096, 4096, 1024]
    - [0, 12654.5]
  - - [1024, 4080, 1, 4096, 1024, 1024, 1024, 4096]
    - [0, 11530.2]
  - - [1024, 6496, 1, 33712, 1024, 1024, 1024, 33712]
    - [7, 11274.8]
  - - [1024, 5576, 1, 33712, 1024, 1024, 1024, 33712]
    - [18, 11350.3]
  - - [1024, 5880, 1, 33712, 1024, 1024, 1024, 33712]
    - [2, 11230.8]
  - - [1024, 5880, 1, 4096, 1024, 1024, 1024, 4096]
    - [2, 11179.3]
  - - [1024, 5120, 1, 33712, 1024, 1024, 1024, 33712]
    - [52, 10096.1]
  - - [4096, 5120, 1, 1024, 4096, 4096, 4096, 1024]
    - [61, 12012.1]
  - - [1024, 5504, 1, 4096, 1024, 1024, 1024, 4096]
    - [34, 10579.1]
  - - [4096, 7872, 1, 1024, 4096, 4096, 4096, 1024]
    - [62, 12349.1]
  - - [1024, 4608, 1, 4096, 1024, 1024, 1024, 4096]
    - [2, 11790.1]
  - - [1024, 7872, 1, 4096, 1024, 1024, 1024, 4096]
    - [14, 10587.4]
  - - [1024, 8352, 1, 33712, 1024, 1024, 1024, 33712]
    - [15, 10911.7]
  - - [1024, 9048, 1, 33712, 1024, 1024, 1024, 33712]
    - [8, 10672.6]
  - - [4096, 1232, 1, 1024, 4096, 4096, 4096, 1024]
    - [7, 11720.6]
  - - [1024, 7480, 1, 33712, 1024, 1024, 1024, 33712]
    - [13, 10947.9]
  - - [1024, 7888, 1, 4096, 1024, 1024, 1024, 4096]
    - [2, 12116.4]
  - - [1024, 8680, 1, 33712, 1024, 1024, 1024, 33712]
    - [33, 10656.6]
  - - [1024, 8680, 1, 4096, 1024, 1024, 1024, 4096]
    - [2, 12280.9]
  - - [1024, 8200, 1, 33712, 1024, 1024, 1024, 33712]
    - [14, 10572.2]
  - - [4096, 6272, 1, 1024, 4096, 4096, 4096, 1024]
    - [0, 12697.7]
  - - [1024, 10176, 1, 1024, 1024, 1024, 1024, 1024]
    - [61, 11191.3]
  - - [1024, 6696, 1, 1024, 1024, 1024, 1024, 1024]
    - [39, 11373.0]
  - - [1024, 3120, 1, 4096, 1024, 1024, 1024, 4096]
    - [37, 9951.17]
  - - [4096, 6696, 1, 1024, 4096, 4096, 4096, 1024]
    - [70, 12280.5]
  - - [1024, 6696, 1, 4096, 1024, 1024, 1024, 4096]
    - [33, 10852.7]
  - - [1024, 7072, 1, 4096, 1024, 1024, 1024, 4096]
    - [64, 10634.3]
  - - [1024, 6560, 1, 4096, 1024, 1024, 1024, 4096]
    - [33, 10629.0]
  - - [4096, 7800, 1, 1024, 4096, 4096, 4096, 1024]
    - [62, 12248.6]
  - - [1024, 8360, 1, 1024, 1024, 1024, 1024, 1024]
    - [4, 12581.9]
  - - [4096, 8536, 1, 1024, 4096, 4096, 4096, 1024]
    - [44, 12367.2]
  - - [1024, 5104, 1, 33712, 1024, 1024, 1024, 33712]
    - [2, 11355.5]
  - - [1024, 8712, 1, 1024, 1024, 1024, 1024, 1024]
    - [6, 11691.4]
  - - [1024, 8856, 1, 1024, 1024, 1024, 1024, 1024]
    - [44, 11023.5]
  - - [1024, 3808, 1, 1024, 1024, 1024, 1024, 1024]
    - [47, 10109.8]
  - - [1024, 9952, 1, 1024, 1024, 1024, 1024, 1024]
    - [51, 11305.5]
  - - [1024, 8704, 1, 4096, 1024, 1024, 1024, 4096]
    - [33, 11457.7]
  - - [4096, 6968, 1, 1024, 4096, 4096, 4096, 1024]
    - [0, 12647.5]
  - - [1024, 9152, 1, 4096, 1024, 1024, 1024, 4096]
    - [33, 11784.1]
  - - [1024, 8256, 1, 4096, 1024, 1024, 1024, 4096]
    - [0, 12091.5]
  - - [1024, 8600, 1, 33712, 1024, 1024, 1024, 33712]
    - [8, 10963.2]
  - - [1024, 9656, 1, 33712, 1024, 1024, 1024, 33712]
    - [2, 10286.1]
  - - [1024, 8000, 1, 4096, 1024, 1024, 1024, 4096]
    - [2, 12282.7]
  - - [1024, 3864, 1, 1024, 1024, 1024, 1024, 1024]
    - [7, 11805.6]
  - - [1024, 352, 1, 1024, 1024, 1024, 1024, 1024]
    - [68, 6054.77]
  - - [1024, 6272, 1, 1024, 1024, 1024, 1024, 1024]
    - [1, 12024.0]
  - - [1024, 6272, 1, 33712, 1024, 1024, 1024, 33712]
    - [7, 11276.3]
  - - [1024, 6272, 1, 4096, 1024, 1024, 1024, 4096]
    - [2, 12039.8]
  - - [1024, 5304, 1, 1024, 1024, 1024, 1024, 1024]
    - [15, 10657.7]
  - - [4096, 7424, 1, 1024, 4096, 4096, 4096, 1024]
    - [60, 12322.5]
  - - [1024, 9088, 1, 1024, 1024, 1024, 1024, 1024]
    - [5, 12526.9]
  - - [1024, 6880, 1, 4096, 1024, 1024, 1024, 4096]
    - [33, 11085.1]
  - - [1024, 8784, 1, 1024, 1024, 1024, 1024, 1024]
    - [4, 11713.6]
  - - [1024, 8352, 1, 1024, 1024, 1024, 1024, 1024]
    - [60, 11716.9]
  - - [1024, 9088, 1, 33712, 1024, 1024, 1024, 33712]
    - [8, 10804.5]
  - - [1024, 6360, 1, 1024, 1024, 1024, 1024, 1024]
    - [5, 12329.8]
  - - [1024, 1224, 1, 1024, 1024, 1024, 1024, 1024]
    - [28, 8907.92]
  - - [1024, 9088, 1, 4096, 1024, 1024, 1024, 4096]
    - [12, 11655.1]
  - - [1024, 7128, 1, 4096, 1024, 1024, 1024, 4096]
    - [0, 11924.0]
  - - [4096, 6976, 1, 1024, 4096, 4096, 4096, 1024]
    - [70, 12374.5]
  - - [1024, 6528, 1, 4096, 1024, 1024, 1024, 4096]
    - [33, 11378.9]
  - - [1024, 7616, 1, 1024, 1024, 1024, 1024, 1024]
    - [4, 11701.3]
  - - [1024, 4920, 1, 33712, 1024, 1024, 1024, 33712]
    - [52, 10467.7]
  - - [4096, 8584, 1, 1024, 4096, 4096, 4096, 1024]
    - [62, 12244.9]
  - - [1024, 9600, 1, 1024, 1024, 1024, 1024, 1024]
    - [0, 12590.4]
  - - [4096, 7688, 1, 1024, 4096, 4096, 4096, 1024]
    - [62, 12215.0]
  - - [4096, 5304, 1, 1024, 4096, 4096, 4096, 1024]
    - [2, 12411.6]
  - - [1024, 7400, 1, 33712, 1024, 1024, 1024, 33712]
    - [9, 10832.2]
  - - [4096, 5016, 1, 1024, 4096, 4096, 4096, 1024]
    - [0, 12549.2]
  - - [1024, 5016, 1, 4096, 1024, 1024, 1024, 4096]
    - [34, 10544.6]
  - - [1024, 7360, 1, 33712, 1024, 1024, 1024, 33712]
    - [13, 10952.2]
  - - [1024, 7360, 1, 4096, 1024, 1024, 1024, 4096]
    - [2, 11981.1]
  - - [1024, 9424, 1, 1024, 1024, 1024, 1024, 1024]
    - [2, 12276.1]
  - - [1024, 10224, 1, 4096, 1024, 1024, 1024, 4096]
    - [33, 11355.9]
  - - [1024, 9424, 1, 4096, 1024, 1024, 1024, 4096]
    - [0, 11356.5]
  - - [4096, 9792, 1, 1024, 4096, 4096, 4096, 1024]
    - [35, 12684.5]
  - - [1024, 7208, 1, 1024, 1024, 1024, 1024, 1024]
    - [0, 12109.3]
  - - [1024, 7128, 1, 1024, 1024, 1024, 1024, 1024]
    - [36, 11578.6]
  - - [1024, 4488, 1, 1024, 1024, 1024, 1024, 1024]
    - [62, 11367.1]
  - - [4096, 7128, 1, 1024, 4096, 4096, 4096, 1024]
    - [60, 12188.5]
  - - [1024, 3864, 1, 4096, 1024, 1024, 1024, 4096]
    - [2, 10775.2]
  - - [1024, 9248, 1, 4096, 1024, 1024, 1024, 4096]
    - [16, 11272.7]
  - - [1024, 5304, 1, 4096, 1024, 1024, 1024, 4096]
    - [0, 11451.2]
  - - [1024, 9288, 1, 33712, 1024, 1024, 1024, 33712]
    - [18, 10487.4]
  - - [4096, 4480, 1, 1024, 4096, 4096, 4096, 1024]
    - [0, 12618.5]
  - - [1024, 9200, 1, 1024, 1024, 1024, 1024, 1024]
    - [60, 11146.8]
  - - [4096, 9200, 1, 1024, 4096, 4096, 4096, 1024]
    - [44, 12166.3]
  - - [1024, 6560, 1, 1024, 1024, 1024, 1024, 1024]
    - [1, 12151.4]
  - - [4096, 6560, 1, 1024, 4096, 4096, 4096, 1024]
    - [70, 12244.8]
  - - [1024, 4480, 1, 1024, 1024, 1024, 1024, 1024]
    - [12, 11338.1]
  - - [1024, 6688, 1, 4096, 1024, 1024, 1024, 4096]
    - [14, 10987.1]
  - - [4096, 3000, 1, 1024, 4096, 4096, 4096, 1024]
    - [70, 12100.8]
  - - [1024, 3000, 1, 4096, 1024, 1024, 1024, 4096]
    - [2, 9924.65]
  - - [1024, 6840, 1, 33712, 1024, 1024, 1024, 33712]
    - [7, 11246.3]
  - - [1024, 7392, 1, 33712, 1024, 1024, 1024, 33712]
    - [15, 11154.5]
  - - [1024, 8584, 1, 4096, 1024, 1024, 1024, 4096]
    - [2, 12142.8]
  - - [1024, 5328, 1, 1024, 1024, 1024, 1024, 1024]
    - [4, 12036.4]
  - - [1024, 6784, 1, 4096, 1024, 1024, 1024, 4096]
    - [2, 10509.9]
  - - [1024, 7216, 1, 4096, 1024, 1024, 1024, 4096]
    - [37, 10765.3]
  - - [1024, 7192, 1, 1024, 1024, 1024, 1024, 1024]
    - [7, 12274.3]
  - - [1024, 9408, 1, 33712, 1024, 1024, 1024, 33712]
    - [33, 10361.3]
  - - [4096, 7192, 1, 1024, 4096, 4096, 4096, 1024]
    - [0, 12622.7]
  - - [1024, 9240, 1, 33712, 1024, 1024, 1024, 33712]
    - [18, 10566.1]
  - - [1024, 2592, 1, 1024, 1024, 1024, 1024, 1024]
    - [4, 11784.2]
  - - [4096, 7176, 1, 1024, 4096, 4096, 4096, 1024]
    - [60, 12105.1]
  - - [4096, 2592, 1, 1024, 4096, 4096, 4096, 1024]
    - [4, 11638.8]
  - - [1024, 2592, 1, 4096, 1024, 1024, 1024, 4096]
    - [24, 10084.2]
  - - [4096, 4536, 1, 1024, 4096, 4096, 4096, 1024]
    - [23, 12319.5]
  - - [4096, 9000, 1, 1024, 4096, 4096, 4096, 1024]
    - [44, 12246.5]
  - - [1024, 9000, 1, 4096, 1024, 1024, 1024, 4096]
    - [0, 11959.4]
  - - [1024, 7480, 1, 4096, 1024, 1024, 1024, 4096]
    - [0, 11884.2]
  - - [1024, 7216, 1, 1024, 1024, 1024, 1024, 1024]
    - [53, 11655.1]
  - - [1024, 8528, 1, 33712, 1024, 1024, 1024, 33712]
    - [14, 10625.6]
  - - [1024, 9680, 1, 4096, 1024, 1024, 1024, 4096]
    - [2, 12112.7]
  - - [4096, 4608, 1, 1024, 4096, 4096, 4096, 1024]
    - [0, 12646.1]
  - - [1024, 8112, 1, 4096, 1024, 1024, 1024, 4096]
    - [13, 11671.9]
  - - [1024, 7840, 1, 33712, 1024, 1024, 1024, 33712]
    - [9, 10646.7]
  - - [1024, 7656, 1, 1024, 1024, 1024, 1024, 1024]
    - [4, 12579.7]
  - - [1024, 7888, 1, 33712, 1024, 1024, 1024, 33712]
    - [14, 11005.3]
  - - [4096, 7656, 1, 1024, 4096, 4096, 4096, 1024]
    - [0, 12701.9]
  - - [1024, 7656, 1, 4096, 1024, 1024, 1024, 4096]
    - [2, 11298.9]
  - - [1024, 6528, 1, 33712, 1024, 1024, 1024, 33712]
    - [13, 11262.1]
  - - [1024, 4392, 1, 1024, 1024, 1024, 1024, 1024]
    - [6, 12043.2]
  - - [1024, 8496, 1, 1024, 1024, 1024, 1024, 1024]
    - [60, 11540.9]
  - - [4096, 4896, 1, 1024, 4096, 4096, 4096, 1024]
    - [45, 11503.6]
  - - [1024, 5568, 1, 33712, 1024, 1024, 1024, 33712]
    - [7, 10876.7]
  - - [1024, 4080, 1, 1024, 1024, 1024, 1024, 1024]
    - [15, 11488.1]
  - - [4096, 9864, 1, 1024, 4096, 4096, 4096, 1024]
    - [35, 12619.1]
  - - [1024, 9864, 1, 4096, 1024, 1024, 1024, 4096]
    - [7, 11615.2]
  - - [1024, 8544, 1, 1024, 1024, 1024, 1024, 1024]
    - [4, 11698.3]
  - - [1024, 9288, 1, 4096, 1024, 1024, 1024, 4096]
    - [41, 10939.7]
  - - [1024, 7208, 1, 33712, 1024, 1024, 1024, 33712]
    - [7, 10990.6]
  - - [1024, 8184, 1, 33712, 1024, 1024, 1024, 33712]
    - [14, 10837.9]
  - - [1024, 5824, 1, 33712, 1024, 1024, 1024, 33712]
    - [2, 11237.6]
  - - [4096, 5504, 1, 1024, 4096, 4096, 4096, 1024]
    - [3, 12424.3]
  - - [1024, 504, 1, 1024, 1024, 1024, 1024, 1024]
    - [28, 7259.37]
  - - [4096, 8256, 1, 1024, 4096, 4096, 4096, 1024]
    - [62, 12244.4]
  - - [1024, 1856, 1, 4096, 1024, 1024, 1024, 4096]
    - [2, 11189.9]
  - - [1024, 6864, 1, 33712, 1024, 1024, 1024, 33712]
    - [12, 11265.9]
  - - [1024, 8592, 1, 1024, 1024, 1024, 1024, 1024]
    - [4, 12570.2]
  - - [1024, 5016, 1, 33712, 1024, 1024, 1024, 33712]
    - [52, 10247.9]
  - - [1024, 6360, 1, 4096, 1024, 1024, 1024, 4096]
    - [64, 10280.1]
  - - [4096, 8592, 1, 1024, 4096, 4096, 4096, 1024]
    - [44, 12380.2]
  - - [1024, 3256, 1, 33712, 1024, 1024, 1024, 33712]
    - [13, 9698.91]
  - - [1024, 2912, 1, 4096, 1024, 1024, 1024, 4096]
    - [2, 11259.0]
  - - [1024, 9752, 1, 4096, 1024, 1024, 1024, 4096]
    - [33, 10907.6]
  - - [1024, 3256, 1, 4096, 1024, 1024, 1024, 4096]
    - [2, 10840.0]
  - - [1024, 6664, 1, 1024, 1024, 1024, 1024, 1024]
    - [39, 11235.7]
  - - [1024, 9656, 1, 1024, 1024, 1024, 1024, 1024]
    - [60, 11144.0]
  - - [1024, 6664, 1, 33712, 1024, 1024, 1024, 33712]
    - [12, 11758.2]
  - - [1024, 8296, 1, 4096, 1024, 1024, 1024, 4096]
    - [2, 11926.8]
  - - [4096, 6840, 1, 1024, 4096, 4096, 4096, 1024]
    - [1, 12479.1]
  - - [1024, 10208, 1, 33712, 1024, 1024, 1024, 33712]
    - [18, 10100.7]
  - - [1024, 6512, 1, 1024, 1024, 1024, 1024, 1024]
    - [6, 12284.7]
  - - [1024, 1584, 1, 4096, 1024, 1024, 1024, 4096]
    - [27, 9733.59]
  - - [1024, 6512, 1, 4096, 1024, 1024, 1024, 4096]
    - [22, 10909.2]
  - - [1024, 3360, 1, 1024, 1024, 1024, 1024, 1024]
    - [15, 10220.5]
  - - [1024, 9888, 1, 1024, 1024, 1024, 1024, 1024]
    - [60, 10931.5]
  - - [1024, 7688, 1, 33712, 1024, 1024, 1024, 33712]
    - [13, 10795.7]
  - - [1024, 3360, 1, 33712, 1024, 1024, 1024, 33712]
    - [33, 9380.34]
  - - [4096, 8816, 1, 1024, 4096, 4096, 4096, 1024]
    - [44, 12391.7]
  - - [1024, 9272, 1, 4096, 1024, 1024, 1024, 4096]
    - [0, 12037.4]
  - - [1024, 4160, 1, 1024, 1024, 1024, 1024, 1024]
    - [0, 11746.2]
  - - [4096, 4160, 1, 1024, 4096, 4096, 4096, 1024]
    - [22, 10773.2]
  - - [1024, 6048, 1, 4096, 1024, 1024, 1024, 4096]
    - [33, 10477.1]
  - - [1024, 9632, 1, 4096, 1024, 1024, 1024, 4096]
    - [40, 11850.4]
  - - [1024, 9144, 1, 33712, 1024, 1024, 1024, 33712]
    - [33, 10195.7]
  - - [4096, 9144, 1, 1024, 4096, 4096, 4096, 1024]
    - [0, 12714.7]
  - - [4096, 1224, 1, 1024, 4096, 4096, 4096, 1024]
    - [0, 11424.7]
  - - [1024, 9024, 1, 33712, 1024, 1024, 1024, 33712]
    - [8, 10722.3]
  - - [1024, 7632, 1, 1024, 1024, 1024, 1024, 1024]
    - [4, 12534.0]
  - - [4096, 4224, 1, 1024, 4096, 4096, 4096, 1024]
    - [70, 11245.0]
  - - [1024, 7568, 1, 33712, 1024, 1024, 1024, 33712]
    - [13, 11254.7]
  - - [1024, 9568, 1, 33712, 1024, 1024, 1024, 33712]
    - [8, 10458.5]
  - - [4096, 4472, 1, 1024, 4096, 4096, 4096, 1024]
    - [0, 12633.9]
  - - [1024, 4472, 1, 4096, 1024, 1024, 1024, 4096]
    - [15, 10842.1]
  - - [1024, 6888, 1, 1024, 1024, 1024, 1024, 1024]
    - [44, 11259.9]
  - - [1024, 6888, 1, 4096, 1024, 1024, 1024, 4096]
    - [34, 10478.1]
  - - [1024, 3864, 1, 33712, 1024, 1024, 1024, 33712]
    - [2, 9324.51]
  - - [1024, 7448, 1, 4096, 1024, 1024, 1024, 4096]
    - [34, 10682.8]
  - - [1024, 1584, 1, 1024, 1024, 1024, 1024, 1024]
    - [6, 10273.0]
  - - [1024, 6688, 1, 1024, 1024, 1024, 1024, 1024]
    - [45, 11411.2]
  - - [4096, 6688, 1, 1024, 4096, 4096, 4096, 1024]
    - [70, 12277.8]
  - - [4096, 5328, 1, 1024, 4096, 4096, 4096, 1024]
    - [70, 12270.0]
  - - [1024, 5328, 1, 4096, 1024, 1024, 1024, 4096]
    - [34, 10432.9]
  - - [1024, 4864, 1, 33712, 1024, 1024, 1024, 33712]
    - [10, 10651.9]
  - - [1024, 9512, 1, 33712, 1024, 1024, 1024, 33712]
    - [8, 10271.8]
  - - [1024, 4640, 1, 33712, 1024, 1024, 1024, 33712]
    - [12, 10724.2]
  - - [1024, 5720, 1, 33712, 1024, 1024, 1024, 33712]
    - [12, 11743.2]
  - - [4096, 5720, 1, 1024, 4096, 4096, 4096, 1024]
    - [60, 12129.6]
  - - [1024, 9000, 1, 33712, 1024, 1024, 1024, 33712]
    - [33, 10502.5]
  - - [4096, 6600, 1, 1024, 4096, 4096, 4096, 1024]
    - [0, 12657.4]
  - - [1024, 6600, 1, 4096, 1024, 1024, 1024, 4096]
    - [3, 11019.0]
  - - [4096, 7640, 1, 1024, 4096, 4096, 4096, 1024]
    - [62, 12340.3]
  - - [1024, 7640, 1, 4096, 1024, 1024, 1024, 4096]
    - [2, 11276.9]
  - - [1024, 4600, 1, 1024, 1024, 1024, 1024, 1024]
    - [7, 12012.9]
  - - [1024, 4600, 1, 33712, 1024, 1024, 1024, 33712]
    - [52, 10812.4]
  - - [4096, 4600, 1, 1024, 4096, 4096, 4096, 1024]
    - [2, 11620.5]
  - - [1024, 4216, 1, 1024, 1024, 1024, 1024, 1024]
    - [6, 11365.7]
  - - [4096, 4216, 1, 1024, 4096, 4096, 4096, 1024]
    - [62, 11244.8]
  - - [1024, 7936, 1, 4096, 1024, 1024, 1024, 4096]
    - [34, 10759.0]
  - - [1024, 8424, 1, 1024, 1024, 1024, 1024, 1024]
    - [4, 12338.2]
  - - [1024, 8968, 1, 33712, 1024, 1024, 1024, 33712]
    - [8, 10423.8]
  - - [4096, 8424, 1, 1024, 4096, 4096, 4096, 1024]
    - [0, 12715.5]
  - - [1024, 6440, 1, 1024, 1024, 1024, 1024, 1024]
    - [4, 12473.8]
  - - [4096, 4560, 1, 1024, 4096, 4096, 4096, 1024]
    - [34, 12067.2]
  - - [1024, 4560, 1, 4096, 1024, 1024, 1024, 4096]
    - [2, 10857.6]
  - - [1024, 7200, 1, 33712, 1024, 1024, 1024, 33712]
    - [7, 10951.7]
  - - [1024, 4760, 1, 1024, 1024, 1024, 1024, 1024]
    - [4, 12291.2]
  - - [1024, 512, 1, 1024, 1024, 1024, 1024, 1024]
    - [28, 7390.84]
  - - [1024, 7640, 1, 1024, 1024, 1024, 1024, 1024]
    - [0, 11675.3]
  - - [1024, 508, 1, 1024, 1024, 1024, 1024, 1024]
    - [28, 7308.95]
  - - [4096, 1584, 1, 1024, 4096, 4096, 4096, 1024]
    - [0, 12114.8]
  - - [1024, 5840, 1, 33712, 1024, 1024, 1024, 33712]
    - [40, 10686.4]
  - - [4096, 9288, 1, 1024, 4096, 4096, 4096, 1024]
    - [44, 12205.1]
  - - [4096, 9968, 1, 1024, 4096, 4096, 4096, 1024]
    - [0, 12617.3]
  - - [1024, 2304, 1, 4096, 1024, 1024, 1024, 4096]
    - [19, 10771.9]
  - - [4096, 1984, 1, 1024, 4096, 4096, 4096, 1024]
    - [60, 11350.8]
  - - [4096, 8016, 1, 1024, 4096, 4096, 4096, 1024]
    - [44, 12357.9]
  - - [4096, 7360, 1, 1024, 4096, 4096, 4096, 1024]
    - [2, 12305.9]
  - - [1024, 6400, 1, 1024, 1024, 1024, 1024, 1024]
    - [4, 12383.5]
  - - [4096, 5440, 1, 1024, 4096, 4096, 4096, 1024]
    - [60, 12248.2]
  - - [1024, 496, 1, 1024, 1024, 1024, 1024, 1024]
    - [31, 7152.0]
  - - [1024, 5632, 1, 33712, 1024, 1024, 1024, 33712]
    - [12, 11599.1]
  - - [4096, 5632, 1, 1024, 4096, 4096, 4096, 1024]
    - [60, 12161.9]
  - - [1024, 376, 1, 1024, 1024, 1024, 1024, 1024]
    - [49, 6459.12]
  - - [1024, 8200, 1, 4096, 1024, 1024, 1024, 4096]
    - [0, 11477.9]
  - - [1024, 216, 1, 1024, 1024, 1024, 1024, 1024]
    - [66, 4458.51]
  - - [1024, 232, 1, 1024, 1024, 1024, 1024, 1024]
    - [58, 4714.53]
  - - [1024, 236, 1, 1024, 1024, 1024, 1024, 1024]
    - [58, 4773.61]
  - - [1024, 256, 1, 1024, 1024, 1024, 1024, 1024]
    - [31, 4534.38]
  - - [1024, 240, 1, 1024, 1024, 1024, 1024, 1024]
    - [59, 4862.02]
  - - [1024, 224, 1, 1024, 1024, 1024, 1024, 1024]
    - [66, 4750.83]
  - - [1024, 208, 1, 1024, 1024, 1024, 1024, 1024]
    - [66, 4411.48]
  - - [1024, 252, 1, 1024, 1024, 1024, 1024, 1024]
    - [31, 4451.5]
  - - [1024, 228, 1, 1024, 1024, 1024, 1024, 1024]
    - [59, 4597.6]
  - - [1024, 212, 1, 1024, 1024, 1024, 1024, 1024]
    - [66, 4510.92]
  - - [1024, 244, 1, 1024, 1024, 1024, 1024, 1024]
    - [31, 4316.0]
  - - [1024, 248, 1, 1024, 1024, 1024, 1024, 1024]
    - [31, 4404.59]
  - - [1024, 148, 1, 1024, 1024, 1024, 1024, 1024]
    - [6, 3149.13]
  - - [1024, 176, 1, 1024, 1024, 1024, 1024, 1024]
    - [7, 3819.32]
  - - [1024, 96, 1, 1024, 1024, 1024, 1024, 1024]
    - [6, 2100.65]
  - - [1024, 168, 1, 1024, 1024, 1024, 1024, 1024]
    - [6, 3682.29]
  - - [1024, 156, 1, 1024, 1024, 1024, 1024, 1024]
    - [6, 3385.3]
  - - [1024, 204, 1, 1024, 1024, 1024, 1024, 1024]
    - [66, 4340.7]
  - - [1024, 132, 1, 1024, 1024, 1024, 1024, 1024]
    - [7, 2878.79]
  - - [1024, 200, 1, 1024, 1024, 1024, 1024, 1024]
    - [66, 4248.69]
  - - [1024, 28, 1, 1024, 1024, 1024, 1024, 1024]
    - [7, 616.809]
  - - [1024, 80, 1, 1024, 1024, 1024, 1024, 1024]
    - [6, 1756.41]
  - - [1024, 40, 1, 1024, 1024, 1024, 1024, 1024]
    - [6, 875.272]
  - - [1024, 68, 1, 1024, 1024, 1024, 1024, 1024]
    - [6, 1492.95]
  - - [1024, 124, 1, 1024, 1024, 1024, 1024, 1024]
    - [66, 2621.44]
  - - [1024, 52, 1, 1024, 1024, 1024, 1024, 1024]
    - [31, 1121.01]
  - - [1024, 192, 1, 1024, 1024, 1024, 1024, 1024]
    - [66, 4085.36]
  - - [1024, 24, 1, 1024, 1024, 1024, 1024, 1024]
    - [6, 523.416]
  - - [1024, 152, 1, 1024, 1024, 1024, 1024, 1024]
    - [6, 3293.05]
  - - [1024, 164, 1, 1024, 1024, 1024, 1024, 1024]
    - [7, 3582.63]
  - - [1024, 60, 1, 1024, 1024, 1024, 1024, 1024]
    - [30, 1291.35]
  - - [1024, 44, 1, 1024, 1024, 1024, 1024, 1024]
    - [7, 967.646]
  - - [1024, 112, 1, 1024, 1024, 1024, 1024, 1024]
    - [6, 2450.76]
  - - [1024, 32, 1, 1024, 1024, 1024, 1024, 1024]
    - [6, 700.218]
  - - [1024, 172, 1, 1024, 1024, 1024, 1024, 1024]
    - [7, 3782.61]
  - - [1024, 140, 1, 1024, 1024, 1024, 1024, 1024]
    - [7, 3078.87]
  - - [1024, 116, 1, 1024, 1024, 1024, 1024, 1024]
    - [66, 2464.24]
  - - [1024, 128, 1, 1024, 1024, 1024, 1024, 1024]
    - [66, 2736.9]
  - - [1024, 92, 1, 1024, 1024, 1024, 1024, 1024]
    - [7, 2026.66]
  - - [1024, 56, 1, 1024, 1024, 1024, 1024, 1024]
    - [31, 1209.23]
  - - [1024, 88, 1, 1024, 1024, 1024, 1024, 1024]
    - [6, 1928.82]
  - - [1024, 188, 1, 1024, 1024, 1024, 1024, 1024]
    - [66, 3968.04]
  - - [1024, 136, 1, 1024, 1024, 1024, 1024, 1024]
    - [6, 2951.29]
  - - [1024, 20, 1, 1024, 1024, 1024, 1024, 1024]
    - [6, 438.368]
  - - [1024, 120, 1, 1024, 1024, 1024, 1024, 1024]
    - [66, 2536.88]
  - - [1024, 108, 1, 1024, 1024, 1024, 1024, 1024]
    - [6, 2367.19]
  - - [1024, 76, 1, 1024, 1024, 1024, 1024, 1024]
    - [6, 1663.02]
  - - [1024, 104, 1, 1024, 1024, 1024, 1024, 1024]
    - [7, 2287.16]
  - - [1024, 64, 1, 1024, 1024, 1024, 1024, 1024]
    - [31, 1402.78]
  - - [1024, 184, 1, 1024, 1024, 1024, 1024, 1024]
    - [66, 3902.47]
  - - [1024, 100, 1, 1024, 1024, 1024, 1024, 1024]
    - [7, 2195.51]
  - - [1024, 48, 1, 1024, 1024, 1024, 1024, 1024]
    - [7, 1050.33]
  - - [1024, 180, 1, 1024, 1024, 1024, 1024, 1024]
    - [31, 3861.37]
  - - [1024, 160, 1, 1024, 1024, 1024, 1024, 1024]
    - [7, 3506.94]
  - - [1024, 144, 1, 1024, 1024, 1024, 1024, 1024]
    - [6, 3135.28]
  - - [1024, 84, 1, 1024, 1024, 1024, 1024, 1024]
    - [6, 1838.07]
  - - [1024, 72, 1, 1024, 1024, 1024, 1024, 1024]
    - [6, 1580.77]
  - - [1024, 36, 1, 1024, 1024, 1024, 1024, 1024]
    - [6, 787.745]
  - - [1024, 16, 1, 1024, 1024, 1024, 1024, 1024]
    - [73, 438.735]
  - - [1024, 12, 1, 1024, 1024, 1024, 1024, 1024]
    - [72, 346.446]
  - - [1024, 8, 1, 1024, 1024, 1024, 1024, 1024]
    - [72, 230.456]
  - - [1024, 4, 1, 1024, 1024, 1024, 1024, 1024]
    - [72, 115.228]
- null
