Tensile/Configs/miopen/archives/megatron/2021-02-04/exact/vega20_Cijk_Alik_Bljk_HBH.yaml
- {MinimumRequiredVersion: 4.25.0}
- vega20
- gfx906
- [Device 66a0, Device 66a1, Device 66a7, Device 66af, Vega 20]
    SolutionIndex: 0
    SolutionNameMin: Cijk_Alik_Bljk_HBH_MT128x128x16_SE_FL0_GRVW8_IU2_LDL2_LRVW8_NLCA1_NLCB1_TT8_8_VW8_WG16_16_1_WGM1
    SolutionIndex: 1
    SolutionNameMin: Cijk_Alik_Bljk_HBH_MT128x128x16_SE_FL0_GRVW8_IU2_LDL2_LRVW8_NLCA1_NLCB1_TT8_8_VW8_WG16_16_1_WGM8
    SolutionIndex: 2
    SolutionNameMin: Cijk_Alik_Bljk_HBH_MT128x128x32_SE_FL0_GRVW8_IU2_LDL2_LRVW8_NLCA1_NLCB1_TT8_8_VW8_WG16_16_1_WGM1
    SolutionIndex: 3
    SolutionNameMin: Cijk_Alik_Bljk_HBH_MT128x128x32_SE_FL0_GRVW8_IU2_LDL2_LRVW8_NLCA1_NLCB1_TT8_8_VW8_WG16_16_1_WGM8
    SolutionIndex: 4
    SolutionNameMin: Cijk_Alik_Bljk_HBH_MT128x128x16_SE_FL1_GRVW8_IU2_LDL2_LRVW8_NLCA1_NLCB1_TT8_8_VW8_WG16_16_1_WGM1
    SolutionIndex: 5
    SolutionNameMin: Cijk_Alik_Bljk_HBH_MT128x128x16_SE_FL1_GRVW8_IU2_LDL2_LRVW8_NLCA1_NLCB1_TT8_8_VW8_WG16_16_1_WGM8
    SolutionIndex: 6
    SolutionNameMin: Cijk_Alik_Bljk_HBH_MT128x128x32_SE_FL1_GRVW8_IU2_LDL2_LRVW8_NLCA1_NLCB1_TT8_8_VW8_WG16_16_1_WGM1
- - - [2880, 16384, 1, 1920, 2880, 2880, 1920, 1920]
    - [5, 14813.0]
  - - [1920, 16384, 1, 960, 1920, 1920, 960, 960]
    - [5, 15681.0]
  - - [3840, 16384, 1, 1920, 3840, 3840, 1920, 1920]
    - [5, 15372.0]
  - - [1920, 16384, 1, 3840, 1920, 1920, 3840, 3840]
    - [1, 15364.0]
  - - [25216, 16384, 1, 1920, 25216, 25216, 1920, 1920]
    - [1, 15580.0]
  - - [2880, 4096, 1, 1920, 2880, 2880, 1920, 1920]
    - [1, 13963.0]
  - - [1920, 4096, 1, 960, 1920, 1920, 960, 960]
    - [5, 14989.0]
  - - [3840, 4096, 1, 1920, 3840, 3840, 1920, 1920]
    - [5, 15072.0]
  - - [1920, 4096, 1, 3840, 1920, 1920, 3840, 3840]
    - [5, 14765.0]
  - - [25216, 4096, 1, 1920, 25216, 25216, 1920, 1920]
    - [5, 15355.0]
  - - [2880, 8192, 1, 1920, 2880, 2880, 1920, 1920]
    - [5, 14699.0]
  - - [1920, 8192, 1, 960, 1920, 1920, 960, 960]
    - [5, 15439.0]
  - - [3840, 8192, 1, 1920, 3840, 3840, 1920, 1920]
    - [1, 15249.0]
  - - [1920, 8192, 1, 3840, 1920, 1920, 3840, 3840]
    - [1, 15142.0]
  - - [25216, 8192, 1, 1920, 25216, 25216, 1920, 1920]
    - [1, 15456.0]
  - - [1728, 16384, 1, 2304, 1728, 1728, 2304, 2304]
    - [1, 14774.0]
  - - [2304, 16384, 1, 576, 2304, 2304, 576, 576]
    - [5, 15294.0]
  - - [2304, 16384, 1, 2304, 2304, 2304, 2304, 2304]
    - [1, 15180.0]
  - - [12672, 16384, 1, 2304, 12672, 12672, 2304, 2304]
    - [1, 15619.0]
  - - [1728, 4096, 1, 2304, 1728, 1728, 2304, 2304]
    - [5, 13422.0]
  - - [2304, 4096, 1, 576, 2304, 2304, 576, 576]
    - [1, 14212.0]
  - - [2304, 4096, 1, 2304, 2304, 2304, 2304, 2304]
    - [1, 14388.0]
  - - [12672, 4096, 1, 2304, 12672, 12672, 2304, 2304]
    - [5, 15481.0]
  - - [1728, 8192, 1, 2304, 1728, 1728, 2304, 2304]
    - [1, 14535.0]
  - - [2304, 8192, 1, 576, 2304, 2304, 576, 576]
    - [5, 14701.0]
  - - [2304, 8192, 1, 2304, 2304, 2304, 2304, 2304]
    - [5, 14671.0]
  - - [12672, 8192, 1, 2304, 12672, 12672, 2304, 2304]
    - [5, 15563.0]
  - - [1152, 4096, 1, 3072, 1152, 1152, 3072, 3072]
    - [0, 13582.0]
  - - [3072, 4096, 1, 384, 3072, 3072, 384, 384]
    - [5, 13904.0]
  - - [1536, 4096, 1, 3072, 1536, 1536, 3072, 3072]
    - [0, 13334.0]
  - - [3072, 4096, 1, 1536, 3072, 3072, 1536, 1536]
    - [5, 14671.0]
  - - [6400, 4096, 1, 3072, 6400, 6400, 3072, 3072]
    - [0, 14658.0]
  - - [1152, 8192, 1, 3072, 1152, 1152, 3072, 3072]
    - [4, 14148.0]
  - - [3072, 8192, 1, 384, 3072, 3072, 384, 384]
    - [1, 14273.0]
  - - [1536, 8192, 1, 3072, 1536, 1536, 3072, 3072]
    - [4, 14454.0]
  - - [3072, 8192, 1, 1536, 3072, 3072, 1536, 1536]
    - [1, 14911.0]
  - - [6400, 8192, 1, 3072, 6400, 6400, 3072, 3072]
    - [4, 14776.0]
  - - [1024, 1024, 160, 96, 1024, 1024, 96, 96]
    - [4, 14135.0]
  - - [1024, 1024, 40, 96, 1024, 1024, 96, 96]
    - [0, 13343.0]
  - - [1024, 1024, 80, 96, 1024, 1024, 96, 96]
    - [4, 13862.0]
  - - [1024, 1024, 96, 96, 1024, 1024, 96, 96]
    - [4, 14009.0]
  - - [1024, 1024, 24, 96, 1024, 1024, 96, 96]
    - [4, 12823.0]
  - - [1024, 1024, 48, 96, 1024, 1024, 96, 96]
    - [4, 13554.0]
  - - [1024, 1024, 16, 96, 1024, 1024, 96, 96]
    - [0, 12172.0]
  - - [1024, 1024, 32, 96, 1024, 1024, 96, 96]
    - [4, 13197.0]
  - - [96, 1024, 160, 1024, 96, 96, 1024, 1024]
    - [6, 9468.0]
  - - [96, 1024, 40, 1024, 96, 96, 1024, 1024]
    - [6, 8398.0]
  - - [96, 1024, 80, 1024, 96, 96, 1024, 1024]
    - [6, 8897.0]
  - - [96, 1024, 96, 1024, 96, 96, 1024, 1024]
    - [6, 9148.0]
  - - [96, 1024, 24, 1024, 96, 96, 1024, 1024]
    - [2, 7259.0]
  - - [96, 1024, 48, 1024, 96, 96, 1024, 1024]
    - [3, 8628.0]
  - - [96, 1024, 16, 1024, 96, 96, 1024, 1024]
    - [2, 6003.0]
  - - [96, 1024, 32, 1024, 96, 96, 1024, 1024]
    - [6, 7855.0]
- null
