src/Tensile/data/Configs/miopen/archives/phantom/2019-08-26/exact/vega20_Cijk_Ailk_Bljk_SB.yaml
- {MinimumRequiredVersion: 4.10.0}
- vega20
- gfx906
- [Device 66a0, Device 66a1, Device 66a7, Vega 20]
    SolutionIndex: 0
    SolutionNameMin: Cijk_Ailk_Bljk_SB_MT64x64x16_SE_EPS1_FL0_GRVW4_GSU1_LPB0_PGR1_PLR1_TT4_4_USFGRO0_VW4_WG16_16_1_WGM1
    SolutionIndex: 1
    SolutionNameMin: Cijk_Ailk_Bljk_SB_MT64x64x16_SE_EPS1_FL0_GRVW4_GSU1_LPB0_PGR1_PLR1_TT4_4_USFGRO0_VW4_WG16_16_1_WGM8
    SolutionIndex: 2
    SolutionNameMin: Cijk_Ailk_Bljk_SB_MT64x64x32_SE_EPS1_FL0_GRVW4_GSU1_LPB0_PGR1_PLR1_TT4_4_USFGRO0_VW4_WG16_16_1_WGM8
    SolutionIndex: 3
    SolutionNameMin: Cijk_Ailk_Bljk_SB_MT64x64x16_SE_EPS1_FL1_GRVW4_GSU1_LPB0_PGR1_PLR1_TT4_4_USFGRO0_VW4_WG16_16_1_WGM1
    SolutionIndex: 4
    SolutionNameMin: Cijk_Ailk_Bljk_SB_MT64x64x16_SE_EPS1_FL1_GRVW4_GSU1_LPB0_PGR1_PLR1_TT4_4_USFGRO0_VW4_WG16_16_1_WGM8
    SolutionIndex: 5
    SolutionNameMin: Cijk_Ailk_Bljk_SB_MT64x96x8_SE_EPS1_FL1_GRVW4_GSU1_LPB0_PGR1_PLR0_TT4_6_USFGRO0_VW2_WG16_16_1_WGM8
    SolutionIndex: 6
    SolutionNameMin: Cijk_Ailk_Bljk_SB_MT64x96x8_SE_EPS1_FL1_GRVW4_GSU1_LPB0_PGR1_PLR1_TT4_6_USFGRO0_VW2_WG16_16_1_WGM1
    SolutionIndex: 7
    SolutionNameMin: Cijk_Ailk_Bljk_SB_MT64x96x8_SE_EPS1_FL1_GRVW4_GSU1_LPB0_PGR1_PLR1_TT4_6_USFGRO0_VW2_WG16_16_1_WGM8
    SolutionIndex: 8
    SolutionNameMin: Cijk_Ailk_Bljk_SB_MT128x64x8_SE_EPS1_FL0_GRVW4_GSU1_LPB0_PGR1_PLR0_TT8_4_USFGRO0_VW4_WG16_16_1_WGM1
    SolutionIndex: 9
    SolutionNameMin: Cijk_Ailk_Bljk_SB_MT128x64x8_SE_EPS1_FL0_GRVW4_GSU1_LPB0_PGR1_PLR0_TT8_4_USFGRO0_VW4_WG16_16_1_WGM8
    SolutionIndex: 10
    SolutionNameMin: Cijk_Ailk_Bljk_SB_MT128x64x8_SE_EPS1_FL0_GRVW4_GSU1_LPB0_PGR1_PLR1_TT8_4_USFGRO0_VW4_WG16_16_1_WGM1
    SolutionIndex: 11
    SolutionNameMin: Cijk_Ailk_Bljk_SB_MT128x64x8_SE_EPS1_FL0_GRVW4_GSU1_LPB0_PGR1_PLR1_TT8_4_USFGRO0_VW4_WG16_16_1_WGM8
    SolutionIndex: 12
    SolutionNameMin: Cijk_Ailk_Bljk_SB_MT128x64x16_SE_EPS1_FL0_GRVW4_GSU1_LPB0_PGR1_PLR1_TT8_4_USFGRO0_VW4_WG16_16_1_WGM1
    SolutionIndex: 13
    SolutionNameMin: Cijk_Ailk_Bljk_SB_MT128x64x8_SE_EPS1_FL1_GRVW2_GSU1_LPB0_PGR1_PLR1_TT8_4_USFGRO0_VW2_WG16_16_1_WGM8
    SolutionIndex: 14
    SolutionNameMin: Cijk_Ailk_Bljk_SB_MT128x64x8_SE_EPS1_FL1_GRVW4_GSU1_LPB0_PGR1_PLR0_TT8_4_USFGRO0_VW4_WG16_16_1_WGM1
    SolutionIndex: 15
    SolutionNameMin: Cijk_Ailk_Bljk_SB_MT128x64x8_SE_EPS1_FL1_GRVW4_GSU1_LPB0_PGR1_PLR0_TT8_4_USFGRO0_VW4_WG16_16_1_WGM8
    SolutionIndex: 16
    SolutionNameMin: Cijk_Ailk_Bljk_SB_MT128x64x8_SE_EPS1_FL1_GRVW4_GSU1_LPB0_PGR1_PLR1_TT8_4_USFGRO0_VW4_WG16_16_1_WGM1
    SolutionIndex: 17
    SolutionNameMin: Cijk_Ailk_Bljk_SB_MT128x64x8_SE_EPS1_FL1_GRVW4_GSU1_LPB0_PGR1_PLR1_TT8_4_USFGRO0_VW4_WG16_16_1_WGM8
    SolutionIndex: 18
    SolutionNameMin: Cijk_Ailk_Bljk_SB_MT64x16x16_SE_EPS1_FL0_GRVW4_GSU1_LPB4_PGR1_PLR1_TT4_4_USFGRO0_VW4_WG16_4_4_WGM1
    SolutionIndex: 19
    SolutionNameMin: Cijk_Ailk_Bljk_SB_MT64x16x32_SE_EPS1_FL0_GRVW4_GSU1_LPB4_PGR1_PLR1_TT4_4_USFGRO0_VW4_WG16_4_4_WGM8
    SolutionIndex: 20
    SolutionNameMin: Cijk_Ailk_Bljk_SB_MT64x16x32_SE_EPS1_FL1_GRVW4_GSU1_LPB4_PGR1_PLR1_TT4_4_USFGRO0_VW4_WG16_4_4_WGM8
- - - [1024, 8192, 1, 256, 1024, 1024, 1024, 256]
    - [8, 9518.99]
  - - [1024, 22016, 1, 256, 1024, 1024, 1024, 256]
    - [14, 9881.12]
  - - [256, 8976, 1, 4352, 256, 256, 256, 4352]
    - [6, 9567.08]
  - - [512, 256, 1, 2048, 512, 512, 512, 2048]
    - [19, 5917.89]
  - - [1024, 19968, 1, 256, 1024, 1024, 1024, 256]
    - [14, 9882.37]
  - - [256, 8976, 1, 1536, 256, 256, 256, 1536]
    - [4, 8437.35]
  - - [256, 8976, 1, 33536, 256, 256, 256, 33536]
    - [4, 8441.89]
  - - [1024, 1792, 1, 256, 1024, 1024, 1024, 256]
    - [4, 7756.97]
  - - [1024, 21504, 1, 256, 1024, 1024, 1024, 256]
    - [14, 9893.9]
  - - [512, 215, 1, 2048, 512, 512, 512, 2048]
    - [20, 4665.64]
  - - [1024, 7168, 1, 256, 1024, 1024, 1024, 256]
    - [8, 9509.35]
  - - [256, 8976, 1, 15872, 256, 256, 256, 15872]
    - [10, 8914.65]
  - - [1024, 19712, 1, 256, 1024, 1024, 1024, 256]
    - [14, 9771.9]
  - - [256, 8976, 1, 5632, 256, 256, 256, 5632]
    - [10, 8740.03]
  - - [1024, 14848, 1, 256, 1024, 1024, 1024, 256]
    - [14, 9756.15]
  - - [1024, 28672, 1, 256, 1024, 1024, 1024, 256]
    - [14, 9958.92]
  - - [256, 8976, 1, 9728, 256, 256, 256, 9728]
    - [17, 8853.04]
  - - [1024, 17152, 1, 256, 1024, 1024, 1024, 256]
    - [8, 9737.3]
  - - [256, 8976, 1, 11520, 256, 256, 256, 11520]
    - [10, 8999.2]
  - - [256, 8976, 1, 8192, 256, 256, 256, 8192]
    - [0, 7897.32]
  - - [1024, 3328, 1, 256, 1024, 1024, 1024, 256]
    - [15, 8593.53]
  - - [256, 8976, 1, 7424, 256, 256, 256, 7424]
    - [10, 8980.47]
  - - [1024, 18944, 1, 256, 1024, 1024, 1024, 256]
    - [14, 9854.85]
  - - [1024, 10496, 1, 256, 1024, 1024, 1024, 256]
    - [9, 9453.9]
  - - [256, 8976, 1, 5376, 256, 256, 256, 5376]
    - [7, 9608.37]
  - - [256, 8976, 1, 6144, 256, 256, 256, 6144]
    - [4, 7880.13]
  - - [1024, 40448, 1, 256, 1024, 1024, 1024, 256]
    - [14, 10016.6]
  - - [256, 8976, 1, 22016, 256, 256, 256, 22016]
    - [17, 8939.87]
  - - [256, 8976, 1, 4864, 256, 256, 256, 4864]
    - [5, 9211.43]
  - - [256, 8976, 1, 12288, 256, 256, 256, 12288]
    - [1, 8065.05]
  - - [1024, 9728, 1, 256, 1024, 1024, 1024, 256]
    - [14, 9636.25]
  - - [256, 8976, 1, 2048, 256, 256, 256, 2048]
    - [2, 7001.33]
  - - [1024, 10240, 1, 256, 1024, 1024, 1024, 256]
    - [8, 9619.96]
  - - [256, 8976, 1, 2304, 256, 256, 256, 2304]
    - [6, 9509.74]
  - - [1024, 7936, 1, 256, 1024, 1024, 1024, 256]
    - [14, 9300.67]
  - - [768, 256, 1, 2048, 768, 768, 768, 2048]
    - [18, 6267.95]
  - - [1024, 9984, 1, 256, 1024, 1024, 1024, 256]
    - [14, 9477.28]
  - - [1024, 13312, 1, 256, 1024, 1024, 1024, 256]
    - [14, 9758.56]
  - - [1024, 16128, 1, 256, 1024, 1024, 1024, 256]
    - [8, 9721.9]
  - - [1024, 8960, 1, 256, 1024, 1024, 1024, 256]
    - [9, 9398.25]
  - - [1024, 5120, 1, 256, 1024, 1024, 1024, 256]
    - [15, 9315.5]
  - - [1024, 11264, 1, 256, 1024, 1024, 1024, 256]
    - [8, 9664.8]
  - - [256, 8976, 1, 20480, 256, 256, 256, 20480]
    - [16, 8279.87]
  - - [1024, 20992, 1, 256, 1024, 1024, 1024, 256]
    - [8, 9878.87]
  - - [256, 8976, 1, 9472, 256, 256, 256, 9472]
    - [10, 8990.96]
  - - [256, 8976, 1, 8448, 256, 256, 256, 8448]
    - [10, 8983.52]
  - - [256, 8976, 1, 20992, 256, 256, 256, 20992]
    - [11, 8942.11]
  - - [256, 8976, 1, 10496, 256, 256, 256, 10496]
    - [11, 8989.71]
  - - [1024, 15104, 1, 256, 1024, 1024, 1024, 256]
    - [9, 9676.01]
  - - [1024, 6400, 1, 256, 1024, 1024, 1024, 256]
    - [17, 9145.89]
  - - [1024, 4096, 1, 256, 1024, 1024, 1024, 256]
    - [10, 9124.25]
  - - [256, 8976, 1, 2560, 256, 256, 256, 2560]
    - [4, 8566.11]
  - - [256, 8976, 1, 2816, 256, 256, 256, 2816]
    - [6, 9496.84]
  - - [1024, 7680, 1, 256, 1024, 1024, 1024, 256]
    - [14, 9460.84]
  - - [256, 8976, 1, 14336, 256, 256, 256, 14336]
    - [11, 8226.8]
  - - [256, 8976, 1, 6656, 256, 256, 256, 6656]
    - [11, 8771.42]
  - - [1024, 3072, 1, 256, 1024, 1024, 1024, 256]
    - [11, 9076.94]
  - - [256, 8976, 1, 5888, 256, 256, 256, 5888]
    - [7, 9546.3]
  - - [1024, 12288, 1, 256, 1024, 1024, 1024, 256]
    - [8, 9690.81]
  - - [256, 8976, 1, 26112, 256, 256, 256, 26112]
    - [13, 8699.83]
  - - [1024, 7424, 1, 256, 1024, 1024, 1024, 256]
    - [15, 9256.84]
  - - [256, 8976, 1, 14848, 256, 256, 256, 14848]
    - [16, 8885.79]
  - - [768, 215, 1, 2048, 768, 768, 768, 2048]
    - [18, 5628.59]
  - - [1024, 2560, 1, 256, 1024, 1024, 1024, 256]
    - [11, 8820.83]
  - - [256, 8976, 1, 19968, 256, 256, 256, 19968]
    - [10, 8928.86]
  - - [256, 8976, 1, 9984, 256, 256, 256, 9984]
    - [10, 8993.12]
  - - [1024, 4864, 1, 256, 1024, 1024, 1024, 256]
    - [11, 8974.3]
  - - [1024, 33536, 1, 256, 1024, 1024, 1024, 256]
    - [14, 9943.07]
  - - [256, 8976, 1, 15104, 256, 256, 256, 15104]
    - [11, 8996.63]
  - - [1024, 2048, 1, 256, 1024, 1024, 1024, 256]
    - [9, 8462.66]
  - - [256, 8976, 1, 8960, 256, 256, 256, 8960]
    - [11, 8998.92]
  - - [1024, 6144, 1, 256, 1024, 1024, 1024, 256]
    - [16, 9359.67]
  - - [1024, 14592, 1, 256, 1024, 1024, 1024, 256]
    - [14, 9667.42]
  - - [256, 8976, 1, 19712, 256, 256, 256, 19712]
    - [10, 9020.11]
  - - [1024, 11520, 1, 256, 1024, 1024, 1024, 256]
    - [9, 9527.7]
  - - [1024, 5632, 1, 256, 1024, 1024, 1024, 256]
    - [8, 9297.2]
  - - [256, 8976, 1, 11008, 256, 256, 256, 11008]
    - [17, 8994.8]
  - - [256, 8976, 1, 17152, 256, 256, 256, 17152]
    - [11, 9003.8]
  - - [256, 8976, 1, 3072, 256, 256, 256, 3072]
    - [0, 8261.96]
  - - [1024, 3840, 1, 256, 1024, 1024, 1024, 256]
    - [17, 8671.89]
  - - [1024, 14336, 1, 256, 1024, 1024, 1024, 256]
    - [14, 9760.28]
  - - [1024, 20480, 1, 256, 1024, 1024, 1024, 256]
    - [8, 9887.85]
  - - [1024, 23552, 1, 256, 1024, 1024, 1024, 256]
    - [8, 9890.46]
  - - [256, 8976, 1, 7168, 256, 256, 256, 7168]
    - [3, 8478.34]
  - - [1024, 13568, 1, 256, 1024, 1024, 1024, 256]
    - [8, 9654.64]
  - - [1024, 4608, 1, 256, 1024, 1024, 1024, 256]
    - [16, 9218.25]
  - - [256, 8976, 1, 10240, 256, 256, 256, 10240]
    - [1, 8076.16]
  - - [1024, 8704, 1, 256, 1024, 1024, 1024, 256]
    - [10, 9475.5]
  - - [1024, 11008, 1, 256, 1024, 1024, 1024, 256]
    - [14, 9524.96]
  - - [1024, 8448, 1, 256, 1024, 1024, 1024, 256]
    - [8, 9352.16]
  - - [256, 8976, 1, 44505, 256, 256, 256, 44505]
    - [12, 8430.23]
- null
