test_dir/py38/lib/python3.6/site-packages/Tensile/Configs/miopen/archives/dlrm/2019-08-26/exact/vega20_Cijk_Ailk_Bljk_SB.yaml
- {MinimumRequiredVersion: 4.9.11}
- vega20
- gfx906
- [Device 66a0, Device 66a1, Device 66a7, Vega 20]
    SolutionIndex: 0
    SolutionNameMin: Cijk_Ailk_Bljk_SB_MT64x64x8_SE_AMAS1_EPS0_FL0_GRVW1_GSU1_LPB0_PGR0_PLR0_TT4_4_USFGRO1_VW1_WG16_16_1_WGM8
    SolutionIndex: 1
    SolutionNameMin: Cijk_Ailk_Bljk_SB_MT64x64x8_SE_AMAS3_EPS1_FL1_GRVW4_GSU1_LPB0_PGR1_PLR1_TT4_4_USFGRO0_VW2_WG16_16_1_WGM8
    SolutionIndex: 2
    SolutionNameMin: Cijk_Ailk_Bljk_SB_MT128x64x8_SE_AMAS1_EPS1_FL0_GRVW1_GSU1_LPB0_PGR1_PLR1_TT8_4_USFGRO1_VW1_WG16_16_1_WGM8
    SolutionIndex: 3
    SolutionNameMin: Cijk_Ailk_Bljk_SB_MT128x64x8_SE_AMAS3_EPS1_FL0_GRVW2_GSU1_LPB0_PGR1_PLR1_TT8_4_USFGRO0_VW2_WG16_16_1_WGM1
    SolutionIndex: 4
    SolutionNameMin: Cijk_Ailk_Bljk_SB_MT32x32x8_SE_AMAS1_EPS0_FL0_GRVW1_GSU1_LPB0_PGR0_PLR0_TT2_2_USFGRO1_VW1_WG16_16_1_WGM8
    SolutionIndex: 5
    SolutionNameMin: Cijk_Ailk_Bljk_SB_MT32x32x8_SE_AMAS1_EPS1_FL0_GRVW1_GSU1_LPB1_PGR1_PLR0_TT2_2_USFGRO1_VW1_WG16_16_1_WGM1
    SolutionIndex: 6
    SolutionNameMin: Cijk_Ailk_Bljk_SB_MT32x32x8_SE_AMAS1_EPS0_FL0_GRVW1_GSU1_LPB1_PGR0_PLR0_TT2_2_USFGRO1_VW1_WG16_16_1_WGM8
    SolutionIndex: 7
    SolutionNameMin: Cijk_Ailk_Bljk_SB_MT32x32x16_SE_AMAS1_EPS0_FL0_GRVW1_GSU1_LPB1_PGR0_PLR0_TT2_2_USFGRO1_VW1_WG16_16_1_WGM1
    SolutionIndex: 8
    SolutionNameMin: Cijk_Ailk_Bljk_SB_MT32x64x8_SE_AMAS1_EPS1_FL0_GRVW1_GSU1_LPB0_PGR1_PLR0_TT2_4_USFGRO1_VW1_WG16_16_1_WGM1
    SolutionIndex: 9
    SolutionNameMin: Cijk_Ailk_Bljk_SB_MT32x32x8_SE_AMAS3_EPS1_FL0_GRVW1_GSU1_LPB2_PGR1_PLR1_TT2_4_USFGRO1_VW2_WG16_8_2_WGM8
    SolutionIndex: 10
    SolutionNameMin: Cijk_Ailk_Bljk_SB_MT64x32x32_SE_AMAS1_EPS0_FL0_GRVW1_GSU8_LPB1_PGR0_PLR1_TT4_4_USFGRO1_VW1_WG16_8_2_WGM1
    SolutionIndex: 11
    SolutionNameMin: Cijk_Ailk_Bljk_SB_MT16x32x16_SE_AMAS1_EPS0_FL0_GRVW2_GSU1_LPB0_PGR0_PLR1_TT4_2_USFGRO1_VW1_WG4_16_4_WGM1
    SolutionIndex: 12
    SolutionNameMin: Cijk_Ailk_Bljk_SB_MT64x16x32_SE_AMAS3_EPS1_FL1_GRVW4_GSU1_LPB4_PGR1_PLR1_TT4_4_USFGRO0_VW4_WG16_4_4_WGM1
- - - [1600, 512, 1, 1024, 1600, 1600, 1600, 1024]
    - [3, 7186.95]
  - - [1024, 512, 1, 64, 1024, 1024, 1024, 64]
    - [1, 2557.5]
  - - [1024, 512, 1, 1, 1024, 1024, 1024, 1]
    - [0, 71.2348]
  - - [2048, 512, 1, 1, 2048, 2048, 2048, 1]
    - [2, 90.3945]
  - - [1024, 200, 1, 1, 1024, 1024, 1024, 1]
    - [8, 40.0]
  - - [512, 200, 1, 1, 512, 512, 512, 1]
    - [5, 22.8571]
  - - [512, 200, 1, 32, 512, 512, 512, 32]
    - [9, 576.901]
  - - [32, 200, 1, 1, 32, 32, 32, 1]
    - [4, 1.56863]
  - - [1, 200, 1, 1, 1, 1, 1, 1]
    - [7, 0.0490196]
  - - [560, 200, 1, 1024, 560, 560, 560, 1024]
    - [12, 4731.35]
  - - [1, 512, 1, 1, 1, 1, 1, 1]
    - [11, 0.130612]
  - - [64, 512, 1, 1, 64, 64, 64, 1]
    - [6, 7.58519]
  - - [100, 512, 1, 2048, 100, 100, 100, 2048]
    - [10, 2575.09]
- null
