test_dir/py38/lib/python3.6/site-packages/Tensile/Configs/miopen/archives/transformer/2019-11-01/exact/vega10_Cijk_Ailk_Bjlk_SB.yaml
- {MinimumRequiredVersion: 4.14.0}
- vega10
- gfx900
- [Device 6863, Device 6862, Device 687f, Device 6860, Device 6861, 'Vega 10 XTX [Radeon
    SolutionIndex: 0
    SolutionNameMin: Cijk_Ailk_Bjlk_SB_MT64x64x16_SE_DTL0_EPS0_FL1_GRVW1_PGR0_PLR0_TT4_4_USFGRO1_VW4_WG16_16_1_WGM1
    SolutionIndex: 1
    SolutionNameMin: Cijk_Ailk_Bjlk_SB_MT64x128x16_SE_DTL0_EPS1_FL0_GRVW2_PGR1_PLR0_TT4_8_USFGRO0_VW2_WG16_16_1_WGM1
    SolutionIndex: 2
    SolutionNameMin: Cijk_Ailk_Bjlk_SB_MT64x128x16_SE_DTL0_EPS1_FL0_GRVW2_PGR1_PLR0_TT4_8_USFGRO0_VW2_WG16_16_1_WGM8
    SolutionIndex: 3
    SolutionNameMin: Cijk_Ailk_Bjlk_SB_MT64x128x16_SE_DTL0_EPS1_FL1_GRVW2_PGR1_PLR0_TT4_8_USFGRO0_VW2_WG16_16_1_WGM1
    SolutionIndex: 4
    SolutionNameMin: Cijk_Ailk_Bjlk_SB_MT64x128x16_SE_DTL0_EPS1_FL1_GRVW2_PGR1_PLR0_TT4_8_USFGRO0_VW2_WG16_16_1_WGM8
    SolutionIndex: 5
    SolutionNameMin: Cijk_Ailk_Bjlk_SB_MT64x128x16_SE_DTL0_EPS0_FL1_GRVW1_PGR0_PLR1_TT4_8_USFGRO1_VW4_WG16_16_1_WGM8
    SolutionIndex: 6
    SolutionNameMin: Cijk_Ailk_Bjlk_SB_MT64x128x16_SE_DTL0_EPS1_FL0_GRVW1_PGR1_PLR1_TT4_8_USFGRO1_VW4_WG16_16_1_WGM8
    SolutionIndex: 7
    SolutionNameMin: Cijk_Ailk_Bjlk_SB_MT64x128x8_SE_DTL0_EPS1_FL0_GRVW2_PGR1_PLR1_TT4_8_USFGRO0_VW2_WG16_16_1_WGM1
    SolutionIndex: 8
    SolutionNameMin: Cijk_Ailk_Bjlk_SB_MT128x64x16_SE_DTL0_EPS0_FL0_GRVW4_PGR0_PLR0_TT8_4_USFGRO0_VW4_WG16_16_1_WGM1
    SolutionIndex: 9
    SolutionNameMin: Cijk_Ailk_Bjlk_SB_MT128x64x8_SE_DTL0_EPS0_FL1_GRVW1_PGR0_PLR0_TT8_4_USFGRO1_VW2_WG16_16_1_WGM8
    SolutionIndex: 10
    SolutionNameMin: Cijk_Ailk_Bjlk_SB_MT128x64x16_SE_DTL0_EPS0_FL1_GRVW1_PGR0_PLR0_TT8_4_USFGRO1_VW2_WG16_16_1_WGM8
    SolutionIndex: 11
    SolutionNameMin: Cijk_Ailk_Bjlk_SB_MT128x64x8_SE_DTL0_EPS1_FL0_GRVW1_PGR1_PLR0_TT8_4_USFGRO1_VW2_WG16_16_1_WGM8
    SolutionIndex: 12
    SolutionNameMin: Cijk_Ailk_Bjlk_SB_MT128x64x8_SE_DTL0_EPS1_FL0_GRVW1_PGR1_PLR0_TT8_4_USFGRO1_VW4_WG16_16_1_WGM8
    SolutionIndex: 13
    SolutionNameMin: Cijk_Ailk_Bjlk_SB_MT128x64x8_SE_DTL0_EPS1_FL1_GRVW1_PGR1_PLR0_TT8_4_USFGRO1_VW2_WG16_16_1_WGM8
    SolutionIndex: 14
    SolutionNameMin: Cijk_Ailk_Bjlk_SB_MT128x64x8_SE_DTL0_EPS0_FL0_GRVW1_PGR0_PLR1_TT8_4_USFGRO1_VW2_WG16_16_1_WGM8
    SolutionIndex: 15
    SolutionNameMin: Cijk_Ailk_Bjlk_SB_MT128x64x16_SE_DTL0_EPS0_FL0_GRVW1_PGR0_PLR1_TT8_4_USFGRO1_VW2_WG16_16_1_WGM8
    SolutionIndex: 16
    SolutionNameMin: Cijk_Ailk_Bjlk_SB_MT128x64x8_SE_DTL0_EPS0_FL0_GRVW1_PGR0_PLR1_TT8_4_USFGRO1_VW4_WG16_16_1_WGM8
    SolutionIndex: 17
    SolutionNameMin: Cijk_Ailk_Bjlk_SB_MT128x64x8_SE_DTL0_EPS0_FL0_GRVW2_PGR0_PLR1_TT8_4_USFGRO0_VW2_WG16_16_1_WGM8
    SolutionIndex: 18
    SolutionNameMin: Cijk_Ailk_Bjlk_SB_MT128x64x16_SE_DTL0_EPS0_FL0_GRVW4_PGR0_PLR1_TT8_4_USFGRO0_VW4_WG16_16_1_WGM1
    SolutionIndex: 19
    SolutionNameMin: Cijk_Ailk_Bjlk_SB_MT128x64x8_SE_DTL0_EPS0_FL1_GRVW1_PGR0_PLR1_TT8_4_USFGRO1_VW4_WG16_16_1_WGM8
    SolutionIndex: 20
    SolutionNameMin: Cijk_Ailk_Bjlk_SB_MT128x64x8_SE_DTL0_EPS1_FL0_GRVW2_PGR1_PLR1_TT8_4_USFGRO0_VW2_WG16_16_1_WGM1
    SolutionIndex: 21
    SolutionNameMin: Cijk_Ailk_Bjlk_SB_MT128x64x8_SE_DTL0_EPS1_FL0_GRVW2_PGR1_PLR1_TT8_4_USFGRO0_VW2_WG16_16_1_WGM8
    SolutionIndex: 22
    SolutionNameMin: Cijk_Ailk_Bjlk_SB_MT128x64x16_SE_DTL0_EPS1_FL0_GRVW4_PGR1_PLR1_TT8_4_USFGRO0_VW4_WG16_16_1_WGM1
    SolutionIndex: 23
    SolutionNameMin: Cijk_Ailk_Bjlk_SB_MT128x64x16_SE_DTL0_EPS1_FL0_GRVW4_PGR1_PLR1_TT8_4_USFGRO0_VW4_WG16_16_1_WGM8
    SolutionIndex: 24
    SolutionNameMin: Cijk_Ailk_Bjlk_SB_MT128x64x8_SE_DTL0_EPS1_FL1_GRVW1_PGR1_PLR1_TT8_4_USFGRO1_VW2_WG16_16_1_WGM1
    SolutionIndex: 25
    SolutionNameMin: Cijk_Ailk_Bjlk_SB_MT128x64x8_SE_DTL0_EPS1_FL1_GRVW2_PGR1_PLR1_TT8_4_USFGRO0_VW2_WG16_16_1_WGM1
    SolutionIndex: 26
    SolutionNameMin: Cijk_Ailk_Bjlk_SB_MT128x64x8_SE_DTL0_EPS1_FL1_GRVW2_PGR1_PLR1_TT8_4_USFGRO0_VW2_WG16_16_1_WGM8
    SolutionIndex: 27
    SolutionNameMin: Cijk_Ailk_Bjlk_SB_MT128x64x16_SE_DTL0_EPS1_FL1_GRVW4_PGR1_PLR1_TT8_4_USFGRO0_VW4_WG16_16_1_WGM1
    SolutionIndex: 28
    SolutionNameMin: Cijk_Ailk_Bjlk_SB_MT128x64x16_SE_DTL0_EPS1_FL1_GRVW4_PGR1_PLR1_TT8_4_USFGRO0_VW4_WG16_16_1_WGM8
    SolutionIndex: 29
    SolutionNameMin: Cijk_Ailk_Bjlk_SB_MT128x128x8_SE_DTL0_EPS1_FL1_GRVW4_PGR1_PLR1_TT8_8_USFGRO0_VW4_WG16_16_1_WGM1
    SolutionIndex: 30
    SolutionNameMin: Cijk_Ailk_Bjlk_SB_MT64x32x32_SE_DTL0_EPS0_FL0_GRVW1_PGR0_PLR0_TT4_2_USFGRO1_VW2_WG16_16_1_WGM8
    SolutionIndex: 31
    SolutionNameMin: Cijk_Ailk_Bjlk_SB_MT32x64x32_SE_DTL0_EPS1_FL1_GRVW4_PGR1_PLR1_TT4_4_USFGRO0_VW4_WG8_16_2_WGM1
    SolutionIndex: 32
    SolutionNameMin: Cijk_Ailk_Bjlk_SB_MT64x32x32_SE_DTL0_EPS1_FL0_GRVW4_PGR1_PLR1_TT4_4_USFGRO0_VW4_WG16_8_2_WGM1
    SolutionIndex: 33
    SolutionNameMin: Cijk_Ailk_Bjlk_SB_MT64x32x32_SE_DTL0_EPS1_FL0_GRVW4_PGR1_PLR1_TT4_4_USFGRO0_VW4_WG16_8_2_WGM8
    SolutionIndex: 34
    SolutionNameMin: Cijk_Ailk_Bjlk_SB_MT64x32x32_SE_DTL0_EPS1_FL1_GRVW4_PGR1_PLR1_TT4_4_USFGRO0_VW4_WG16_8_2_WGM1
    SolutionIndex: 35
    SolutionNameMin: Cijk_Ailk_Bjlk_SB_MT64x32x32_SE_DTL0_EPS1_FL1_GRVW4_PGR1_PLR1_TT4_4_USFGRO0_VW4_WG16_8_2_WGM8
    SolutionIndex: 36
    SolutionNameMin: Cijk_Ailk_Bjlk_SB_MT64x16x16_SE_DTL0_EPS1_FL0_GRVW4_PGR1_PLR0_TT4_4_USFGRO0_VW4_WG16_4_4_WGM8
    SolutionIndex: 37
    SolutionNameMin: Cijk_Ailk_Bjlk_SB_MT64x32x8_SE_DTL0_EPS0_FL0_GRVW1_PGR0_PLR0_TT4_4_USFGRO1_VW2_WG16_8_1_WGM1
    SolutionIndex: 38
    SolutionNameMin: Cijk_Ailk_Bjlk_SB_MT64x32x8_SE_DTL0_EPS1_FL0_GRVW2_PGR1_PLR0_TT4_4_USFGRO0_VW2_WG16_8_1_WGM1
    SolutionIndex: 39
    SolutionNameMin: Cijk_Ailk_Bjlk_SB_MT64x32x8_SE_DTL0_EPS0_FL0_GRVW1_PGR0_PLR1_TT4_4_USFGRO1_VW2_WG16_8_1_WGM1
    SolutionIndex: 40
    SolutionNameMin: Cijk_Ailk_Bjlk_SB_MT64x32x8_SE_DTL0_EPS0_FL1_GRVW1_PGR0_PLR1_TT4_4_USFGRO1_VW4_WG16_8_1_WGM1
    SolutionIndex: 41
    SolutionNameMin: Cijk_Ailk_Bjlk_SB_MT64x32x8_SE_DTL0_EPS1_FL0_GRVW2_PGR1_PLR1_TT4_4_USFGRO0_VW2_WG16_8_1_WGM1
    SolutionIndex: 42
    SolutionNameMin: Cijk_Ailk_Bjlk_SB_MT64x32x8_SE_DTL0_EPS1_FL1_GRVW1_PGR1_PLR1_TT4_4_USFGRO1_VW2_WG16_8_1_WGM1
    SolutionIndex: 43
    SolutionNameMin: Cijk_Ailk_Bjlk_SB_MT64x32x8_SE_DTL0_EPS1_FL1_GRVW2_PGR1_PLR1_TT4_4_USFGRO0_VW2_WG16_8_1_WGM1
    SolutionIndex: 44
    SolutionNameMin: Cijk_Ailk_Bjlk_SB_MT64x16x8_SE_DTL0_EPS0_FL0_GRVW1_PGR0_PLR0_TT4_2_USFGRO1_VW2_WG16_8_1_WGM1
    SolutionIndex: 45
    SolutionNameMin: Cijk_Ailk_Bjlk_SB_MT64x16x8_SE_DTL0_EPS0_FL1_GRVW1_PGR0_PLR0_TT4_2_USFGRO1_VW2_WG16_8_1_WGM1
    SolutionIndex: 46
    SolutionNameMin: Cijk_Ailk_Bjlk_SB_MT64x16x8_SE_DTL0_EPS0_FL1_GRVW2_PGR0_PLR0_TT4_2_USFGRO0_VW2_WG16_8_1_WGM1
    SolutionIndex: 47
    SolutionNameMin: Cijk_Ailk_Bjlk_SB_MT64x16x8_SE_DTL0_EPS0_FL0_GRVW1_PGR0_PLR1_TT4_2_USFGRO1_VW2_WG16_8_1_WGM1
    SolutionIndex: 48
    SolutionNameMin: Cijk_Ailk_Bjlk_SB_MT64x16x8_SE_DTL0_EPS0_FL1_GRVW1_PGR0_PLR1_TT4_2_USFGRO1_VW2_WG16_8_1_WGM1
    SolutionIndex: 49
    SolutionNameMin: Cijk_Ailk_Bjlk_SB_MT64x16x8_SE_DTL0_EPS0_FL1_GRVW2_PGR0_PLR1_TT4_2_USFGRO0_VW2_WG16_8_1_WGM1
    SolutionIndex: 50
    SolutionNameMin: Cijk_Ailk_Bjlk_SB_MT64x16x8_SE_DTL0_EPS1_FL0_GRVW2_PGR1_PLR1_TT4_2_USFGRO0_VW2_WG16_8_1_WGM1
    SolutionIndex: 51
    SolutionNameMin: Cijk_Ailk_Bjlk_SB_MT64x16x16_SE_DTL0_EPS1_FL1_GRVW1_PGR1_PLR1_TT4_2_USFGRO1_VW2_WG16_8_1_WGM1
    SolutionIndex: 52
    SolutionNameMin: Cijk_Ailk_Bjlk_SB_MT32x64x8_SE_DTL0_EPS0_FL0_GRVW1_PGR0_PLR1_TT4_4_USFGRO1_VW2_WG8_16_1_WGM1
    SolutionIndex: 53
    SolutionNameMin: Cijk_Ailk_Bjlk_SB_MT64x64x8_SE_DTL0_EPS0_FL0_GRVW1_PGR0_PLR0_TT8_4_USFGRO1_VW2_WG8_16_1_WGM1
    SolutionIndex: 54
    SolutionNameMin: Cijk_Ailk_Bjlk_SB_MT64x64x8_SE_DTL0_EPS1_FL0_GRVW4_PGR1_PLR1_TT8_4_USFGRO0_VW4_WG8_16_1_WGM1
- - - [512, 2048, 1, 2790, 512, 512, 512, 2048]
    - [26, 7486.89]
  - - [512, 2048, 1, 2864, 512, 512, 512, 2048]
    - [25, 7511.74]
  - - [512, 2048, 1, 3092, 512, 512, 512, 2048]
    - [25, 7533.26]
  - - [512, 2048, 1, 3113, 512, 512, 512, 2048]
    - [20, 7537.72]
  - - [512, 2048, 1, 3137, 512, 512, 512, 2048]
    - [20, 7536.52]
  - - [512, 2048, 1, 3165, 512, 512, 512, 2048]
    - [25, 7530.93]
  - - [512, 2048, 1, 3166, 512, 512, 512, 2048]
    - [20, 7518.15]
  - - [512, 2048, 1, 3194, 512, 512, 512, 2048]
    - [25, 7544.15]
  - - [512, 2048, 1, 3219, 512, 512, 512, 2048]
    - [25, 7554.04]
  - - [512, 2048, 1, 3222, 512, 512, 512, 2048]
    - [20, 7534.85]
  - - [512, 2048, 1, 3234, 512, 512, 512, 2048]
    - [25, 7539.24]
  - - [512, 2048, 1, 3237, 512, 512, 512, 2048]
    - [25, 7535.06]
  - - [512, 2048, 1, 3242, 512, 512, 512, 2048]
    - [25, 7549.19]
  - - [512, 2048, 1, 3246, 512, 512, 512, 2048]
    - [25, 7542.37]
  - - [512, 2048, 1, 3249, 512, 512, 512, 2048]
    - [25, 7536.97]
  - - [512, 2048, 1, 3251, 512, 512, 512, 2048]
    - [20, 7535.44]
  - - [512, 2048, 1, 3257, 512, 512, 512, 2048]
    - [21, 7523.47]
  - - [512, 2048, 1, 3262, 512, 512, 512, 2048]
    - [20, 7548.57]
  - - [512, 2048, 1, 3268, 512, 512, 512, 2048]
    - [25, 7543.96]
  - - [512, 2048, 1, 3282, 512, 512, 512, 2048]
    - [20, 7551.65]
  - - [512, 2048, 1, 3286, 512, 512, 512, 2048]
    - [20, 7547.36]
  - - [512, 2048, 1, 3287, 512, 512, 512, 2048]
    - [20, 7544.75]
  - - [512, 2048, 1, 3293, 512, 512, 512, 2048]
    - [25, 7546.29]
  - - [512, 2048, 1, 3297, 512, 512, 512, 2048]
    - [25, 7554.24]
  - - [512, 2048, 1, 3307, 512, 512, 512, 2048]
    - [25, 7551.47]
  - - [512, 2048, 1, 3314, 512, 512, 512, 2048]
    - [25, 7560.14]
  - - [512, 2048, 1, 3315, 512, 512, 512, 2048]
    - [20, 7536.92]
  - - [512, 2048, 1, 3319, 512, 512, 512, 2048]
    - [20, 7537.54]
  - - [512, 2048, 1, 3322, 512, 512, 512, 2048]
    - [20, 7537.09]
  - - [512, 2048, 1, 3323, 512, 512, 512, 2048]
    - [25, 7542.99]
  - - [512, 2048, 1, 3324, 512, 512, 512, 2048]
    - [20, 7546.47]
  - - [512, 2048, 1, 3325, 512, 512, 512, 2048]
    - [20, 7547.53]
  - - [512, 2048, 1, 3327, 512, 512, 512, 2048]
    - [20, 7544.81]
  - - [512, 2048, 1, 3329, 512, 512, 512, 2048]
    - [20, 7551.77]
  - - [512, 2048, 1, 3332, 512, 512, 512, 2048]
    - [20, 7545.28]
  - - [512, 2048, 1, 3336, 512, 512, 512, 2048]
    - [20, 7570.08]
  - - [512, 2048, 1, 3339, 512, 512, 512, 2048]
    - [20, 7545.44]
  - - [512, 2048, 1, 3342, 512, 512, 512, 2048]
    - [20, 7548.6]
  - - [512, 2048, 1, 3344, 512, 512, 512, 2048]
    - [25, 7572.45]
  - - [512, 2048, 1, 3358, 512, 512, 512, 2048]
    - [20, 7548.6]
  - - [512, 2048, 1, 3360, 512, 512, 512, 2048]
    - [20, 7571.13]
  - - [512, 2048, 1, 3364, 512, 512, 512, 2048]
    - [25, 7564.48]
  - - [512, 2048, 1, 3365, 512, 512, 512, 2048]
    - [20, 7566.73]
  - - [512, 2048, 1, 3369, 512, 512, 512, 2048]
    - [20, 7552.94]
  - - [512, 2048, 1, 3371, 512, 512, 512, 2048]
    - [20, 7565.8]
  - - [512, 2048, 1, 3374, 512, 512, 512, 2048]
    - [25, 7555.77]
  - - [512, 2048, 1, 3376, 512, 512, 512, 2048]
    - [20, 7566.24]
  - - [512, 2048, 1, 3377, 512, 512, 512, 2048]
    - [20, 7564.88]
  - - [512, 2048, 1, 3378, 512, 512, 512, 2048]
    - [20, 7564.73]
  - - [512, 2048, 1, 3381, 512, 512, 512, 2048]
    - [20, 7564.27]
  - - [512, 2048, 1, 3382, 512, 512, 512, 2048]
    - [25, 7552.18]
  - - [512, 2048, 1, 3383, 512, 512, 512, 2048]
    - [25, 7549.65]
  - - [512, 2048, 1, 3384, 512, 512, 512, 2048]
    - [25, 7572.17]
  - - [512, 2048, 1, 3385, 512, 512, 512, 2048]
    - [20, 7567.23]
  - - [512, 2048, 1, 3386, 512, 512, 512, 2048]
    - [25, 7561.1]
  - - [512, 2048, 1, 3388, 512, 512, 512, 2048]
    - [27, 7464.3]
  - - [512, 2048, 1, 3390, 512, 512, 512, 2048]
    - [20, 7559.31]
  - - [512, 2048, 1, 3391, 512, 512, 512, 2048]
    - [25, 7561.54]
  - - [512, 2048, 1, 3396, 512, 512, 512, 2048]
    - [20, 7564.34]
  - - [512, 2048, 1, 3399, 512, 512, 512, 2048]
    - [25, 7553.2]
  - - [512, 2048, 1, 3402, 512, 512, 512, 2048]
    - [20, 7569.38]
  - - [512, 2048, 1, 3410, 512, 512, 512, 2048]
    - [25, 7564.58]
  - - [512, 2048, 1, 3412, 512, 512, 512, 2048]
    - [25, 7559.55]
  - - [512, 2048, 1, 3414, 512, 512, 512, 2048]
    - [25, 7550.98]
  - - [512, 2048, 1, 3415, 512, 512, 512, 2048]
    - [25, 7567.37]
  - - [512, 2048, 1, 3418, 512, 512, 512, 2048]
    - [20, 7565.73]
  - - [512, 2048, 1, 3420, 512, 512, 512, 2048]
    - [20, 7574.9]
  - - [512, 2048, 1, 3422, 512, 512, 512, 2048]
    - [25, 7560.39]
  - - [512, 2048, 1, 3425, 512, 512, 512, 2048]
    - [20, 7571.75]
  - - [512, 2048, 1, 3426, 512, 512, 512, 2048]
    - [7, 7512.95]
  - - [512, 2048, 1, 3427, 512, 512, 512, 2048]
    - [25, 7566.72]
  - - [512, 2048, 1, 3428, 512, 512, 512, 2048]
    - [25, 7555.96]
  - - [512, 2048, 1, 3430, 512, 512, 512, 2048]
    - [20, 7556.84]
  - - [512, 2048, 1, 3431, 512, 512, 512, 2048]
    - [20, 7561.4]
  - - [512, 2048, 1, 3432, 512, 512, 512, 2048]
    - [25, 7593.15]
  - - [512, 2048, 1, 3438, 512, 512, 512, 2048]
    - [25, 7574.47]
  - - [512, 2048, 1, 3439, 512, 512, 512, 2048]
    - [20, 7571.96]
  - - [512, 2048, 1, 3440, 512, 512, 512, 2048]
    - [25, 7570.62]
  - - [512, 2048, 1, 3443, 512, 512, 512, 2048]
    - [20, 7565.46]
  - - [512, 2048, 1, 3445, 512, 512, 512, 2048]
    - [27, 7501.16]
  - - [512, 2048, 1, 3447, 512, 512, 512, 2048]
    - [25, 7562.51]
  - - [512, 2048, 1, 3448, 512, 512, 512, 2048]
    - [20, 7577.63]
  - - [512, 2048, 1, 3450, 512, 512, 512, 2048]
    - [25, 7563.24]
  - - [512, 2048, 1, 3451, 512, 512, 512, 2048]
    - [25, 7564.25]
  - - [512, 2048, 1, 3452, 512, 512, 512, 2048]
    - [20, 7578.18]
  - - [512, 2048, 1, 3453, 512, 512, 512, 2048]
    - [20, 7578.03]
  - - [512, 2048, 1, 3455, 512, 512, 512, 2048]
    - [25, 7555.47]
  - - [512, 2048, 1, 3456, 512, 512, 512, 2048]
    - [25, 7572.87]
  - - [512, 2048, 1, 3457, 512, 512, 512, 2048]
    - [20, 7565.69]
  - - [512, 2048, 1, 3458, 512, 512, 512, 2048]
    - [25, 7574.91]
  - - [512, 2048, 1, 3459, 512, 512, 512, 2048]
    - [20, 7565.4]
  - - [512, 2048, 1, 3460, 512, 512, 512, 2048]
    - [25, 7568.74]
  - - [512, 2048, 1, 3461, 512, 512, 512, 2048]
    - [25, 7546.45]
  - - [512, 2048, 1, 3462, 512, 512, 512, 2048]
    - [20, 7569.61]
  - - [512, 2048, 1, 3466, 512, 512, 512, 2048]
    - [20, 7576.02]
  - - [512, 2048, 1, 3467, 512, 512, 512, 2048]
    - [25, 7580.54]
  - - [512, 2048, 1, 3468, 512, 512, 512, 2048]
    - [20, 7568.7]
  - - [512, 2048, 1, 3470, 512, 512, 512, 2048]
    - [20, 7557.92]
  - - [512, 2048, 1, 3471, 512, 512, 512, 2048]
    - [25, 7581.09]
  - - [512, 2048, 1, 3472, 512, 512, 512, 2048]
    - [20, 7584.45]
  - - [512, 2048, 1, 3475, 512, 512, 512, 2048]
    - [25, 7573.46]
  - - [512, 2048, 1, 3476, 512, 512, 512, 2048]
    - [25, 7584.99]
  - - [512, 2048, 1, 3477, 512, 512, 512, 2048]
    - [20, 7565.02]
  - - [512, 2048, 1, 3478, 512, 512, 512, 2048]
    - [20, 7567.19]
  - - [512, 2048, 1, 3479, 512, 512, 512, 2048]
    - [20, 7567.04]
  - - [512, 2048, 1, 3480, 512, 512, 512, 2048]
    - [20, 7577.37]
  - - [512, 2048, 1, 3481, 512, 512, 512, 2048]
    - [25, 7587.71]
  - - [512, 2048, 1, 3483, 512, 512, 512, 2048]
    - [20, 7576.91]
  - - [512, 2048, 1, 3484, 512, 512, 512, 2048]
    - [25, 7580.25]
  - - [512, 2048, 1, 3487, 512, 512, 512, 2048]
    - [25, 7563.51]
  - - [512, 2048, 1, 3489, 512, 512, 512, 2048]
    - [20, 7572.51]
  - - [512, 2048, 1, 3490, 512, 512, 512, 2048]
    - [25, 7573.51]
  - - [512, 2048, 1, 3491, 512, 512, 512, 2048]
    - [20, 7575.69]
  - - [512, 2048, 1, 3493, 512, 512, 512, 2048]
    - [20, 7574.21]
  - - [512, 2048, 1, 3494, 512, 512, 512, 2048]
    - [25, 7578.71]
  - - [512, 2048, 1, 3495, 512, 512, 512, 2048]
    - [20, 7568.12]
  - - [512, 2048, 1, 3497, 512, 512, 512, 2048]
    - [25, 7572.45]
  - - [512, 2048, 1, 3498, 512, 512, 512, 2048]
    - [20, 7574.61]
  - - [512, 2048, 1, 3499, 512, 512, 512, 2048]
    - [20, 7575.62]
  - - [512, 2048, 1, 3501, 512, 512, 512, 2048]
    - [7, 7516.72]
  - - [512, 2048, 1, 3503, 512, 512, 512, 2048]
    - [25, 7573.86]
  - - [512, 2048, 1, 3507, 512, 512, 512, 2048]
    - [25, 7577.87]
  - - [512, 2048, 1, 3508, 512, 512, 512, 2048]
    - [20, 7569.64]
  - - [512, 2048, 1, 3509, 512, 512, 512, 2048]
    - [20, 7574.1]
  - - [512, 2048, 1, 3511, 512, 512, 512, 2048]
    - [25, 7576.11]
  - - [512, 2048, 1, 3514, 512, 512, 512, 2048]
    - [25, 7579.11]
  - - [512, 2048, 1, 3515, 512, 512, 512, 2048]
    - [25, 7577.81]
  - - [512, 2048, 1, 3517, 512, 512, 512, 2048]
    - [25, 7574.05]
  - - [512, 2048, 1, 3518, 512, 512, 512, 2048]
    - [25, 7575.04]
  - - [512, 2048, 1, 3519, 512, 512, 512, 2048]
    - [25, 7576.04]
  - - [512, 2048, 1, 3520, 512, 512, 512, 2048]
    - [25, 7592.05]
  - - [512, 2048, 1, 3523, 512, 512, 512, 2048]
    - [20, 7577.74]
  - - [512, 2048, 1, 3528, 512, 512, 512, 2048]
    - [25, 7589.65]
  - - [512, 2048, 1, 3529, 512, 512, 512, 2048]
    - [20, 7572.24]
  - - [512, 2048, 1, 3530, 512, 512, 512, 2048]
    - [20, 7574.39]
  - - [512, 2048, 1, 3532, 512, 512, 512, 2048]
    - [25, 7574.08]
  - - [512, 2048, 1, 3533, 512, 512, 512, 2048]
    - [20, 7570.5]
  - - [512, 2048, 1, 3534, 512, 512, 512, 2048]
    - [20, 7571.49]
  - - [512, 2048, 1, 3538, 512, 512, 512, 2048]
    - [25, 7584.65]
  - - [512, 2048, 1, 3539, 512, 512, 512, 2048]
    - [25, 7578.76]
  - - [512, 2048, 1, 3541, 512, 512, 512, 2048]
    - [22, 7501.34]
  - - [512, 2048, 1, 3547, 512, 512, 512, 2048]
    - [20, 7578.7]
  - - [512, 2048, 1, 3548, 512, 512, 512, 2048]
    - [20, 7577.4]
  - - [512, 2048, 1, 3552, 512, 512, 512, 2048]
    - [20, 7568.82]
  - - [512, 2048, 1, 3564, 512, 512, 512, 2048]
    - [25, 7577.27]
  - - [512, 2048, 1, 3575, 512, 512, 512, 2048]
    - [25, 7574.5]
  - - [512, 2048, 1, 3598, 512, 512, 512, 2048]
    - [20, 7583.49]
  - - [512, 2048, 1, 3599, 512, 512, 512, 2048]
    - [25, 7584.47]
  - - [512, 2048, 1, 3608, 512, 512, 512, 2048]
    - [20, 7603.44]
  - - [512, 2048, 1, 3780, 512, 512, 512, 2048]
    - [20, 7586.42]
  - - [512, 2048, 1, 3796, 512, 512, 512, 2048]
    - [25, 7594.85]
  - - [512, 2048, 1, 3822, 512, 512, 512, 2048]
    - [21, 7544.5]
  - - [512, 2048, 1, 3840, 512, 512, 512, 2048]
    - [22, 7556.84]
  - - [512, 2048, 1, 3859, 512, 512, 512, 2048]
    - [20, 7597.4]
  - - [512, 2048, 1, 3870, 512, 512, 512, 2048]
    - [25, 7594.76]
  - - [512, 2048, 1, 3876, 512, 512, 512, 2048]
    - [25, 7607.59]
  - - [512, 2048, 1, 3906, 512, 512, 512, 2048]
    - [20, 7604.26]
  - - [512, 2048, 1, 3910, 512, 512, 512, 2048]
    - [25, 7592.21]
  - - [512, 2048, 1, 3925, 512, 512, 512, 2048]
    - [20, 7599.45]
  - - [512, 2048, 1, 3942, 512, 512, 512, 2048]
    - [25, 7605.32]
  - - [512, 2048, 1, 3944, 512, 512, 512, 2048]
    - [25, 7623.72]
  - - [512, 2048, 1, 3955, 512, 512, 512, 2048]
    - [25, 7606.55]
  - - [512, 2048, 1, 3968, 512, 512, 512, 2048]
    - [25, 7623.27]
  - - [512, 2048, 1, 3969, 512, 512, 512, 2048]
    - [25, 7614.86]
  - - [512, 2048, 1, 3976, 512, 512, 512, 2048]
    - [20, 7618.99]
  - - [512, 2048, 1, 3977, 512, 512, 512, 2048]
    - [20, 7600.33]
  - - [512, 2048, 1, 3978, 512, 512, 512, 2048]
    - [25, 7613.54]
  - - [512, 2048, 1, 3990, 512, 512, 512, 2048]
    - [20, 7603.61]
  - - [512, 2048, 1, 3995, 512, 512, 512, 2048]
    - [20, 7614.16]
  - - [512, 2048, 1, 3996, 512, 512, 512, 2048]
    - [20, 7602.76]
  - - [512, 2048, 1, 3999, 512, 512, 512, 2048]
    - [7, 7553.65]
  - - [512, 2048, 1, 4005, 512, 512, 512, 2048]
    - [25, 7614.77]
  - - [512, 2048, 1, 4012, 512, 512, 512, 2048]
    - [20, 7603.57]
  - - [512, 2048, 1, 4020, 512, 512, 512, 2048]
    - [25, 7610.58]
  - - [512, 2048, 1, 4026, 512, 512, 512, 2048]
    - [25, 7615.83]
  - - [512, 2048, 1, 4030, 512, 512, 512, 2048]
    - [20, 7610.17]
  - - [512, 2048, 1, 4032, 512, 512, 512, 2048]
    - [25, 7626.16]
  - - [512, 33708, 1, 3780, 512, 512, 512, 33708]
    - [20, 7913.02]
  - - [512, 33708, 1, 3796, 512, 512, 512, 33708]
    - [15, 7298.95]
  - - [512, 33708, 1, 3822, 512, 512, 512, 33708]
    - [13, 7777.39]
  - - [512, 33708, 1, 3840, 512, 512, 512, 33708]
    - [8, 7481.73]
  - - [512, 33708, 1, 3859, 512, 512, 512, 33708]
    - [19, 7370.51]
  - - [512, 33708, 1, 3870, 512, 512, 512, 33708]
    - [24, 7759.78]
  - - [512, 33708, 1, 3876, 512, 512, 512, 33708]
    - [21, 6879.19]
  - - [512, 33708, 1, 3906, 512, 512, 512, 33708]
    - [29, 7169.91]
  - - [512, 33708, 1, 3910, 512, 512, 512, 33708]
    - [2, 7197.16]
  - - [512, 33708, 1, 3925, 512, 512, 512, 33708]
    - [11, 7783.11]
  - - [512, 33708, 1, 3942, 512, 512, 512, 33708]
    - [14, 7175.62]
  - - [512, 33708, 1, 3944, 512, 512, 512, 33708]
    - [3, 7058.54]
  - - [512, 33708, 1, 3955, 512, 512, 512, 33708]
    - [10, 7200.8]
  - - [512, 33708, 1, 3968, 512, 512, 512, 33708]
    - [5, 7133.55]
  - - [512, 33708, 1, 3969, 512, 512, 512, 33708]
    - [19, 7364.88]
  - - [512, 33708, 1, 3976, 512, 512, 512, 33708]
    - [11, 7789.64]
  - - [512, 33708, 1, 3977, 512, 512, 512, 33708]
    - [4, 7184.32]
  - - [512, 33708, 1, 3978, 512, 512, 512, 33708]
    - [1, 7093.45]
  - - [512, 33708, 1, 3990, 512, 512, 512, 33708]
    - [6, 7291.99]
  - - [512, 33708, 1, 3995, 512, 512, 512, 33708]
    - [14, 7178.32]
  - - [512, 33708, 1, 3996, 512, 512, 512, 33708]
    - [16, 7370.54]
  - - [512, 33708, 1, 3999, 512, 512, 512, 33708]
    - [18, 7633.65]
  - - [512, 33708, 1, 4005, 512, 512, 512, 33708]
    - [14, 7176.75]
  - - [512, 33708, 1, 4012, 512, 512, 512, 33708]
    - [17, 7263.31]
  - - [512, 33708, 1, 4020, 512, 512, 512, 33708]
    - [9, 7062.4]
  - - [512, 33708, 1, 4026, 512, 512, 512, 33708]
    - [24, 7766.38]
  - - [512, 33708, 1, 4030, 512, 512, 512, 33708]
    - [12, 7825.15]
  - - [512, 33708, 1, 4032, 512, 512, 512, 33708]
    - [11, 7791.5]
  - - [2048, 512, 1, 2790, 2048, 2048, 2048, 512]
    - [20, 7488.3]
  - - [2048, 512, 1, 2864, 2048, 2048, 2048, 512]
    - [20, 7508.94]
  - - [2048, 512, 1, 3092, 2048, 2048, 2048, 512]
    - [25, 7524.18]
  - - [2048, 512, 1, 3113, 2048, 2048, 2048, 512]
    - [25, 7528.69]
  - - [2048, 512, 1, 3137, 2048, 2048, 2048, 512]
    - [20, 7537.8]
  - - [2048, 512, 1, 3165, 2048, 2048, 2048, 512]
    - [26, 7530.92]
  - - [2048, 512, 1, 3166, 2048, 2048, 2048, 512]
    - [20, 7524.46]
  - - [2048, 512, 1, 3194, 2048, 2048, 2048, 512]
    - [20, 7540.36]
  - - [2048, 512, 1, 3219, 2048, 2048, 2048, 512]
    - [26, 7536.53]
  - - [2048, 512, 1, 3222, 2048, 2048, 2048, 512]
    - [25, 7532.34]
  - - [2048, 512, 1, 3234, 2048, 2048, 2048, 512]
    - [20, 7535.51]
  - - [2048, 512, 1, 3237, 2048, 2048, 2048, 512]
    - [20, 7537.54]
  - - [2048, 512, 1, 3242, 2048, 2048, 2048, 512]
    - [26, 7538.02]
  - - [2048, 512, 1, 3246, 2048, 2048, 2048, 512]
    - [20, 7546.08]
  - - [2048, 512, 1, 3249, 2048, 2048, 2048, 512]
    - [26, 7534.49]
  - - [2048, 512, 1, 3251, 2048, 2048, 2048, 512]
    - [25, 7550.26]
  - - [2048, 512, 1, 3257, 2048, 2048, 2048, 512]
    - [20, 7553.05]
  - - [2048, 512, 1, 3262, 2048, 2048, 2048, 512]
    - [26, 7530.1]
  - - [2048, 512, 1, 3268, 2048, 2048, 2048, 512]
    - [21, 7540.26]
  - - [2048, 512, 1, 3282, 2048, 2048, 2048, 512]
    - [25, 7534.5]
  - - [2048, 512, 1, 3286, 2048, 2048, 2048, 512]
    - [25, 7542.45]
  - - [2048, 512, 1, 3287, 2048, 2048, 2048, 512]
    - [26, 7544.75]
  - - [2048, 512, 1, 3293, 2048, 2048, 2048, 512]
    - [20, 7542.62]
  - - [2048, 512, 1, 3297, 2048, 2048, 2048, 512]
    - [20, 7556.67]
  - - [2048, 512, 1, 3307, 2048, 2048, 2048, 512]
    - [20, 7542.95]
  - - [2048, 512, 1, 3314, 2048, 2048, 2048, 512]
    - [25, 7547.97]
  - - [2048, 512, 1, 3315, 2048, 2048, 2048, 512]
    - [26, 7540.55]
  - - [2048, 512, 1, 3319, 2048, 2048, 2048, 512]
    - [20, 7536.32]
  - - [2048, 512, 1, 3322, 2048, 2048, 2048, 512]
    - [23, 7453.47]
  - - [2048, 512, 1, 3323, 2048, 2048, 2048, 512]
    - [25, 7549.04]
  - - [2048, 512, 1, 3324, 2048, 2048, 2048, 512]
    - [20, 7550.1]
  - - [2048, 512, 1, 3325, 2048, 2048, 2048, 512]
    - [26, 7540.27]
  - - [2048, 512, 1, 3327, 2048, 2048, 2048, 512]
    - [20, 7543.6]
  - - [2048, 512, 1, 3329, 2048, 2048, 2048, 512]
    - [25, 7546.92]
  - - [2048, 512, 1, 3332, 2048, 2048, 2048, 512]
    - [20, 7538.03]
  - - [2048, 512, 1, 3336, 2048, 2048, 2048, 512]
    - [25, 7562.79]
  - - [2048, 512, 1, 3339, 2048, 2048, 2048, 512]
    - [26, 7546.62]
  - - [2048, 512, 1, 3342, 2048, 2048, 2048, 512]
    - [25, 7548.59]
  - - [2048, 512, 1, 3344, 2048, 2048, 2048, 512]
    - [25, 7560.34]
  - - [2048, 512, 1, 3358, 2048, 2048, 2048, 512]
    - [26, 7543.8]
  - - [2048, 512, 1, 3360, 2048, 2048, 2048, 512]
    - [25, 7557.89]
  - - [2048, 512, 1, 3364, 2048, 2048, 2048, 512]
    - [20, 7548.89]
  - - [2048, 512, 1, 3365, 2048, 2048, 2048, 512]
    - [21, 7540.38]
  - - [2048, 512, 1, 3369, 2048, 2048, 2048, 512]
    - [20, 7564.91]
  - - [2048, 512, 1, 3371, 2048, 2048, 2048, 512]
    - [20, 7556.22]
  - - [2048, 512, 1, 3374, 2048, 2048, 2048, 512]
    - [20, 7553.37]
  - - [2048, 512, 1, 3376, 2048, 2048, 2048, 512]
    - [23, 7495.02]
  - - [2048, 512, 1, 3377, 2048, 2048, 2048, 512]
    - [22, 7473.8]
  - - [2048, 512, 1, 3378, 2048, 2048, 2048, 512]
    - [20, 7548.0]
  - - [2048, 512, 1, 3381, 2048, 2048, 2048, 512]
    - [20, 7549.94]
  - - [2048, 512, 1, 3382, 2048, 2048, 2048, 512]
    - [25, 7550.98]
  - - [2048, 512, 1, 3383, 2048, 2048, 2048, 512]
    - [21, 7521.18]
  - - [2048, 512, 1, 3384, 2048, 2048, 2048, 512]
    - [20, 7548.3]
  - - [2048, 512, 1, 3385, 2048, 2048, 2048, 512]
    - [20, 7551.72]
  - - [2048, 512, 1, 3386, 2048, 2048, 2048, 512]
    - [25, 7551.57]
  - - [2048, 512, 1, 3388, 2048, 2048, 2048, 512]
    - [25, 7565.57]
  - - [2048, 512, 1, 3390, 2048, 2048, 2048, 512]
    - [25, 7555.73]
  - - [2048, 512, 1, 3391, 2048, 2048, 2048, 512]
    - [20, 7553.21]
  - - [2048, 512, 1, 3396, 2048, 2048, 2048, 512]
    - [20, 7559.57]
  - - [2048, 512, 1, 3399, 2048, 2048, 2048, 512]
    - [20, 7553.19]
  - - [2048, 512, 1, 3402, 2048, 2048, 2048, 512]
    - [25, 7561.04]
  - - [2048, 512, 1, 3410, 2048, 2048, 2048, 512]
    - [20, 7565.76]
  - - [2048, 512, 1, 3412, 2048, 2048, 2048, 512]
    - [20, 7551.27]
  - - [2048, 512, 1, 3414, 2048, 2048, 2048, 512]
    - [25, 7554.51]
  - - [2048, 512, 1, 3415, 2048, 2048, 2048, 512]
    - [21, 7537.87]
  - - [2048, 512, 1, 3418, 2048, 2048, 2048, 512]
    - [25, 7558.63]
  - - [2048, 512, 1, 3420, 2048, 2048, 2048, 512]
    - [20, 7554.79]
  - - [2048, 512, 1, 3422, 2048, 2048, 2048, 512]
    - [20, 7562.75]
  - - [2048, 512, 1, 3425, 2048, 2048, 2048, 512]
    - [20, 7567.02]
  - - [2048, 512, 1, 3426, 2048, 2048, 2048, 512]
    - [20, 7552.72]
  - - [2048, 512, 1, 3427, 2048, 2048, 2048, 512]
    - [20, 7550.23]
  - - [2048, 512, 1, 3428, 2048, 2048, 2048, 512]
    - [20, 7560.67]
  - - [2048, 512, 1, 3430, 2048, 2048, 2048, 512]
    - [25, 7553.31]
  - - [2048, 512, 1, 3431, 2048, 2048, 2048, 512]
    - [20, 7557.86]
  - - [2048, 512, 1, 3432, 2048, 2048, 2048, 512]
    - [25, 7569.49]
  - - [2048, 512, 1, 3438, 2048, 2048, 2048, 512]
    - [20, 7566.22]
  - - [2048, 512, 1, 3439, 2048, 2048, 2048, 512]
    - [26, 7560.19]
  - - [2048, 512, 1, 3440, 2048, 2048, 2048, 512]
    - [20, 7575.33]
  - - [2048, 512, 1, 3443, 2048, 2048, 2048, 512]
    - [25, 7551.39]
  - - [2048, 512, 1, 3445, 2048, 2048, 2048, 512]
    - [20, 7558.11]
  - - [2048, 512, 1, 3447, 2048, 2048, 2048, 512]
    - [20, 7561.34]
  - - [2048, 512, 1, 3448, 2048, 2048, 2048, 512]
    - [23, 7481.22]
  - - [2048, 512, 1, 3450, 2048, 2048, 2048, 512]
    - [20, 7564.4]
  - - [2048, 512, 1, 3451, 2048, 2048, 2048, 512]
    - [25, 7563.07]
  - - [2048, 512, 1, 3452, 2048, 2048, 2048, 512]
    - [26, 7552.41]
  - - [2048, 512, 1, 3453, 2048, 2048, 2048, 512]
    - [20, 7562.78]
  - - [2048, 512, 1, 3455, 2048, 2048, 2048, 512]
    - [25, 7550.8]
  - - [2048, 512, 1, 3456, 2048, 2048, 2048, 512]
    - [25, 7577.56]
  - - [2048, 512, 1, 3457, 2048, 2048, 2048, 512]
    - [20, 7554.01]
  - - [2048, 512, 1, 3458, 2048, 2048, 2048, 512]
    - [20, 7574.9]
  - - [2048, 512, 1, 3459, 2048, 2048, 2048, 512]
    - [26, 7566.56]
  - - [2048, 512, 1, 3460, 2048, 2048, 2048, 512]
    - [25, 7566.4]
  - - [2048, 512, 1, 3461, 2048, 2048, 2048, 512]
    - [20, 7559.24]
  - - [2048, 512, 1, 3462, 2048, 2048, 2048, 512]
    - [26, 7559.1]
  - - [2048, 512, 1, 3466, 2048, 2048, 2048, 512]
    - [20, 7557.34]
  - - [2048, 512, 1, 3467, 2048, 2048, 2048, 512]
    - [20, 7568.85]
  - - [2048, 512, 1, 3468, 2048, 2048, 2048, 512]
    - [20, 7553.55]
  - - [2048, 512, 1, 3470, 2048, 2048, 2048, 512]
    - [25, 7561.4]
  - - [2048, 512, 1, 3471, 2048, 2048, 2048, 512]
    - [20, 7555.43]
  - - [2048, 512, 1, 3472, 2048, 2048, 2048, 512]
    - [26, 7577.42]
  - - [2048, 512, 1, 3475, 2048, 2048, 2048, 512]
    - [26, 7569.97]
  - - [2048, 512, 1, 3476, 2048, 2048, 2048, 512]
    - [20, 7562.83]
  - - [2048, 512, 1, 3477, 2048, 2048, 2048, 512]
    - [25, 7558.04]
  - - [2048, 512, 1, 3478, 2048, 2048, 2048, 512]
    - [26, 7561.37]
  - - [2048, 512, 1, 3479, 2048, 2048, 2048, 512]
    - [25, 7539.24]
  - - [2048, 512, 1, 3480, 2048, 2048, 2048, 512]
    - [25, 7570.37]
  - - [2048, 512, 1, 3481, 2048, 2048, 2048, 512]
    - [25, 7563.25]
  - - [2048, 512, 1, 3483, 2048, 2048, 2048, 512]
    - [20, 7559.47]
  - - [2048, 512, 1, 3484, 2048, 2048, 2048, 512]
    - [20, 7563.97]
  - - [2048, 512, 1, 3487, 2048, 2048, 2048, 512]
    - [20, 7556.57]
  - - [2048, 512, 1, 3489, 2048, 2048, 2048, 512]
    - [21, 7567.86]
  - - [2048, 512, 1, 3490, 2048, 2048, 2048, 512]
    - [22, 7486.28]
  - - [2048, 512, 1, 3491, 2048, 2048, 2048, 512]
    - [23, 7485.02]
  - - [2048, 512, 1, 3493, 2048, 2048, 2048, 512]
    - [20, 7570.73]
  - - [2048, 512, 1, 3494, 2048, 2048, 2048, 512]
    - [20, 7552.09]
  - - [2048, 512, 1, 3495, 2048, 2048, 2048, 512]
    - [20, 7566.95]
  - - [2048, 512, 1, 3497, 2048, 2048, 2048, 512]
    - [27, 7483.15]
  - - [2048, 512, 1, 3498, 2048, 2048, 2048, 512]
    - [20, 7566.5]
  - - [2048, 512, 1, 3499, 2048, 2048, 2048, 512]
    - [20, 7567.51]
  - - [2048, 512, 1, 3501, 2048, 2048, 2048, 512]
    - [20, 7561.44]
  - - [2048, 512, 1, 3503, 2048, 2048, 2048, 512]
    - [26, 7562.3]
  - - [2048, 512, 1, 3507, 2048, 2048, 2048, 512]
    - [25, 7554.81]
  - - [2048, 512, 1, 3508, 2048, 2048, 2048, 512]
    - [22, 7484.07]
  - - [2048, 512, 1, 3509, 2048, 2048, 2048, 512]
    - [26, 7559.11]
  - - [2048, 512, 1, 3511, 2048, 2048, 2048, 512]
    - [20, 7563.43]
  - - [2048, 512, 1, 3514, 2048, 2048, 2048, 512]
    - [25, 7566.43]
  - - [2048, 512, 1, 3515, 2048, 2048, 2048, 512]
    - [26, 7576.65]
  - - [2048, 512, 1, 3517, 2048, 2048, 2048, 512]
    - [20, 7572.89]
  - - [2048, 512, 1, 3518, 2048, 2048, 2048, 512]
    - [21, 7537.21]
  - - [2048, 512, 1, 3519, 2048, 2048, 2048, 512]
    - [20, 7567.99]
  - - [2048, 512, 1, 3520, 2048, 2048, 2048, 512]
    - [20, 7570.14]
  - - [2048, 512, 1, 3523, 2048, 2048, 2048, 512]
    - [21, 7559.37]
  - - [2048, 512, 1, 3528, 2048, 2048, 2048, 512]
    - [20, 7582.73]
  - - [2048, 512, 1, 3529, 2048, 2048, 2048, 512]
    - [25, 7569.94]
  - - [2048, 512, 1, 3530, 2048, 2048, 2048, 512]
    - [25, 7570.94]
  - - [2048, 512, 1, 3532, 2048, 2048, 2048, 512]
    - [26, 7566.06]
  - - [2048, 512, 1, 3533, 2048, 2048, 2048, 512]
    - [20, 7570.49]
  - - [2048, 512, 1, 3534, 2048, 2048, 2048, 512]
    - [20, 7571.49]
  - - [2048, 512, 1, 3538, 2048, 2048, 2048, 512]
    - [20, 7560.6]
  - - [2048, 512, 1, 3539, 2048, 2048, 2048, 512]
    - [22, 7493.73]
  - - [2048, 512, 1, 3541, 2048, 2048, 2048, 512]
    - [20, 7560.16]
  - - [2048, 512, 1, 3547, 2048, 2048, 2048, 512]
    - [26, 7569.55]
  - - [2048, 512, 1, 3548, 2048, 2048, 2048, 512]
    - [20, 7570.54]
  - - [2048, 512, 1, 3552, 2048, 2048, 2048, 512]
    - [20, 7576.8]
  - - [2048, 512, 1, 3564, 2048, 2048, 2048, 512]
    - [20, 7572.72]
  - - [2048, 512, 1, 3575, 2048, 2048, 2048, 512]
    - [26, 7555.27]
  - - [2048, 512, 1, 3598, 2048, 2048, 2048, 512]
    - [20, 7572.22]
  - - [2048, 512, 1, 3599, 2048, 2048, 2048, 512]
    - [27, 7485.29]
  - - [2048, 512, 1, 3608, 2048, 2048, 2048, 512]
    - [25, 7577.5]
  - - [2048, 512, 1, 3780, 2048, 2048, 2048, 512]
    - [20, 7577.82]
  - - [2048, 512, 1, 3796, 2048, 2048, 2048, 512]
    - [26, 7583.05]
  - - [2048, 512, 1, 3822, 2048, 2048, 2048, 512]
    - [25, 7595.33]
  - - [2048, 512, 1, 3840, 2048, 2048, 2048, 512]
    - [21, 7592.72]
  - - [2048, 512, 1, 3859, 2048, 2048, 2048, 512]
    - [20, 7596.34]
  - - [2048, 512, 1, 3870, 2048, 2048, 2048, 512]
    - [20, 7587.39]
  - - [2048, 512, 1, 3876, 2048, 2048, 2048, 512]
    - [20, 7594.95]
  - - [2048, 512, 1, 3906, 2048, 2048, 2048, 512]
    - [25, 7597.99]
  - - [2048, 512, 1, 3910, 2048, 2048, 2048, 512]
    - [20, 7589.09]
  - - [2048, 512, 1, 3925, 2048, 2048, 2048, 512]
    - [21, 7594.25]
  - - [2048, 512, 1, 3942, 2048, 2048, 2048, 512]
    - [20, 7594.96]
  - - [2048, 512, 1, 3944, 2048, 2048, 2048, 512]
    - [28, 7527.1]
  - - [2048, 512, 1, 3955, 2048, 2048, 2048, 512]
    - [26, 7600.35]
  - - [2048, 512, 1, 3968, 2048, 2048, 2048, 512]
    - [25, 7612.93]
  - - [2048, 512, 1, 3969, 2048, 2048, 2048, 512]
    - [25, 7603.51]
  - - [2048, 512, 1, 3976, 2048, 2048, 2048, 512]
    - [20, 7608.69]
  - - [2048, 512, 1, 3977, 2048, 2048, 2048, 512]
    - [20, 7608.55]
  - - [2048, 512, 1, 3978, 2048, 2048, 2048, 512]
    - [20, 7598.13]
  - - [2048, 512, 1, 3990, 2048, 2048, 2048, 512]
    - [20, 7590.33]
  - - [2048, 512, 1, 3995, 2048, 2048, 2048, 512]
    - [23, 7529.02]
  - - [2048, 512, 1, 3996, 2048, 2048, 2048, 512]
    - [25, 7602.77]
  - - [2048, 512, 1, 3999, 2048, 2048, 2048, 512]
    - [20, 7595.2]
  - - [2048, 512, 1, 4005, 2048, 2048, 2048, 512]
    - [25, 7591.32]
  - - [2048, 512, 1, 4012, 2048, 2048, 2048, 512]
    - [25, 7594.42]
  - - [2048, 512, 1, 4020, 2048, 2048, 2048, 512]
    - [20, 7602.45]
  - - [2048, 512, 1, 4026, 2048, 2048, 2048, 512]
    - [25, 7606.67]
  - - [2048, 512, 1, 4030, 2048, 2048, 2048, 512]
    - [20, 7599.02]
  - - [2048, 512, 1, 4032, 2048, 2048, 2048, 512]
    - [20, 7621.07]
  - - [512, 512, 1, 3780, 512, 512, 512, 512]
    - [36, 5831.18]
  - - [512, 512, 1, 3796, 512, 512, 512, 512]
    - [35, 6477.03]
  - - [512, 512, 1, 3822, 512, 512, 512, 512]
    - [35, 6584.89]
  - - [512, 512, 1, 3840, 512, 512, 512, 512]
    - [35, 6622.35]
  - - [512, 512, 1, 3859, 512, 512, 512, 512]
    - [31, 6475.26]
  - - [512, 512, 1, 3870, 512, 512, 512, 512]
    - [35, 6466.11]
  - - [512, 512, 1, 3876, 512, 512, 512, 512]
    - [35, 6572.36]
  - - [512, 512, 1, 3906, 512, 512, 512, 512]
    - [35, 6588.5]
  - - [512, 512, 1, 3910, 512, 512, 512, 512]
    - [32, 6570.17]
  - - [512, 512, 1, 3925, 512, 512, 512, 512]
    - [34, 6518.02]
  - - [512, 512, 1, 3927, 512, 512, 512, 512]
    - [34, 6496.96]
  - - [512, 512, 1, 3942, 512, 512, 512, 512]
    - [34, 6570.91]
  - - [512, 512, 1, 3944, 512, 512, 512, 512]
    - [35, 6574.23]
  - - [512, 512, 1, 3955, 512, 512, 512, 512]
    - [33, 6521.92]
  - - [512, 512, 1, 3968, 512, 512, 512, 512]
    - [35, 6645.55]
  - - [512, 512, 1, 3969, 512, 512, 512, 512]
    - [32, 6575.66]
  - - [512, 512, 1, 3976, 512, 512, 512, 512]
    - [34, 6562.68]
  - - [512, 512, 1, 3977, 512, 512, 512, 512]
    - [32, 6570.45]
  - - [512, 512, 1, 3978, 512, 512, 512, 512]
    - [33, 6556.77]
  - - [512, 512, 1, 3990, 512, 512, 512, 512]
    - [33, 6518.88]
  - - [512, 512, 1, 3995, 512, 512, 512, 512]
    - [32, 6509.02]
  - - [512, 512, 1, 3996, 512, 512, 512, 512]
    - [34, 6498.69]
  - - [512, 512, 1, 3999, 512, 512, 512, 512]
    - [32, 6491.63]
  - - [512, 512, 1, 4005, 512, 512, 512, 512]
    - [33, 6585.95]
  - - [512, 512, 1, 4012, 512, 512, 512, 512]
    - [34, 6539.72]
  - - [512, 512, 1, 4020, 512, 512, 512, 512]
    - [34, 6504.83]
  - - [512, 512, 1, 4026, 512, 512, 512, 512]
    - [35, 6526.47]
  - - [512, 512, 1, 4030, 512, 512, 512, 512]
    - [33, 6526.98]
  - - [512, 512, 1, 4032, 512, 512, 512, 512]
    - [33, 6645.8]
  - - [512, 512, 1, 4050, 512, 512, 512, 512]
    - [34, 6532.45]
  - - [512, 512, 1, 4059, 512, 512, 512, 512]
    - [35, 6517.29]
  - - [64, 12, 2520, 12, 64, 64, 64, 12]
    - [46, 519.072]
  - - [64, 13, 2336, 13, 64, 64, 64, 13]
    - [45, 527.99]
  - - [64, 14, 2184, 14, 64, 64, 64, 14]
    - [44, 571.615]
  - - [64, 15, 2048, 15, 64, 64, 64, 15]
    - [50, 608.737]
  - - [64, 16, 1920, 16, 64, 64, 64, 16]
    - [51, 640.508]
  - - [64, 17, 1816, 17, 64, 64, 64, 17]
    - [44, 677.773]
  - - [64, 18, 1720, 18, 64, 64, 64, 18]
    - [48, 709.085]
  - - [64, 19, 1632, 19, 64, 64, 64, 19]
    - [44, 750.759]
  - - [64, 21, 1488, 21, 64, 64, 64, 21]
    - [45, 820.476]
  - - [64, 23, 1360, 23, 64, 64, 64, 23]
    - [49, 891.784]
  - - [64, 25, 1256, 25, 64, 64, 64, 25]
    - [45, 939.355]
  - - [64, 27, 1168, 27, 64, 64, 64, 27]
    - [39, 994.121]
  - - [64, 29, 1088, 29, 64, 64, 64, 29]
    - [47, 1069.74]
  - - [64, 32, 992, 32, 64, 64, 64, 32]
    - [30, 1130.96]
  - - [64, 35, 904, 35, 64, 64, 64, 35]
    - [47, 1265.55]
  - - [64, 38, 840, 38, 64, 64, 64, 38]
    - [47, 1364.53]
  - - [64, 41, 776, 41, 64, 64, 64, 41]
    - [44, 1437.52]
  - - [64, 45, 712, 45, 64, 64, 64, 45]
    - [39, 1562.95]
  - - [64, 49, 648, 49, 64, 64, 64, 49]
    - [39, 1631.32]
  - - [64, 54, 592, 54, 64, 64, 64, 54]
    - [44, 1756.7]
  - - [64, 59, 544, 59, 64, 64, 64, 59]
    - [47, 1874.07]
  - - [64, 64, 496, 64, 64, 64, 64, 64]
    - [0, 1954.64]
  - - [64, 64, 496, 65, 64, 64, 64, 64]
    - [53, 2270.94]
  - - [64, 65, 496, 65, 64, 64, 64, 65]
    - [40, 2059.76]
  - - [64, 71, 448, 71, 64, 64, 64, 71]
    - [39, 2214.71]
  - - [64, 77, 408, 77, 64, 64, 64, 77]
    - [39, 2291.63]
  - - [64, 77, 408, 78, 64, 64, 64, 77]
    - [39, 2336.77]
  - - [64, 78, 408, 78, 64, 64, 64, 78]
    - [37, 2306.04]
  - - [64, 85, 376, 85, 64, 64, 64, 85]
    - [41, 2526.45]
  - - [64, 93, 344, 93, 64, 64, 64, 93]
    - [41, 2636.45]
  - - [64, 102, 312, 102, 64, 64, 64, 102]
    - [52, 2668.4]
  - - [64, 112, 288, 112, 64, 64, 64, 112]
    - [38, 2906.18]
  - - [64, 122, 264, 122, 64, 64, 64, 122]
    - [43, 2959.77]
  - - [64, 123, 264, 122, 64, 64, 64, 123]
    - [41, 2981.44]
  - - [64, 123, 264, 123, 64, 64, 64, 123]
    - [42, 2982.5]
  - - [64, 134, 240, 134, 64, 64, 64, 134]
    - [39, 3163.33]
  - - [64, 135, 240, 134, 64, 64, 64, 135]
    - [39, 3162.74]
  - - [64, 135, 240, 135, 64, 64, 64, 135]
    - [54, 3216.18]
- null
