src/Tensile/data/Configs/miopen/archives/inception/2020-06-15/exact/arcturus_Cijk_Ailk_Bjlk_SB.yaml
- {MinimumRequiredVersion: 4.20.0}
- arcturus
- gfx908
- [Device 7380, Device 7388, Device 738c, Device 7390, Device 731f]
- - - [64, 192, 64, 1280, 64, 64, 64, 192]
    - [29, 20460.0]
  - - [64, 320, 64, 1280, 64, 64, 64, 320]
    - [26, 24273.0]
  - - [64, 384, 64, 1280, 64, 64, 64, 384]
    - [38, 23967.0]
  - - [64, 448, 64, 1280, 64, 64, 64, 448]
    - [29, 25664.0]
  - - [64, 192, 64, 2048, 64, 64, 64, 192]
    - [25, 20607.0]
  - - [64, 320, 64, 2048, 64, 64, 64, 320]
    - [2, 24966.0]
  - - [64, 384, 64, 2048, 64, 64, 64, 384]
    - [33, 25229.0]
  - - [64, 448, 64, 2048, 64, 64, 64, 448]
    - [24, 26616.0]
  - - [1225, 32, 64, 192, 1225, 1225, 1225, 32]
    - [11, 8039.0]
  - - [1225, 48, 64, 192, 1225, 1225, 1225, 48]
    - [0, 10601.0]
  - - [1225, 64, 64, 192, 1225, 1225, 1225, 64]
    - [2, 16014.0]
  - - [1225, 48, 64, 256, 1225, 1225, 1225, 48]
    - [1, 12078.0]
  - - [1225, 64, 64, 256, 1225, 1225, 1225, 64]
    - [18, 17434.0]
  - - [1225, 48, 64, 288, 1225, 1225, 1225, 48]
    - [17, 12626.0]
  - - [1225, 64, 64, 288, 1225, 1225, 1225, 64]
    - [4, 17973.0]
  - - [5329, 80, 64, 64, 5329, 5329, 5329, 80]
    - [18, 11292.0]
  - - [289, 128, 64, 768, 289, 289, 289, 128]
    - [41, 22260.0]
  - - [289, 160, 64, 768, 289, 289, 289, 160]
    - [19, 20468.0]
  - - [289, 192, 64, 768, 289, 289, 289, 192]
    - [8, 23160.0]
  - - [49, 2048, 64, 512, 49, 49, 49, 2048]
    - [35, 18132.0]
  - - [49, 512, 64, 2048, 49, 49, 49, 512]
    - [6, 19065.0]
  - - [3136, 256, 64, 64, 3136, 3136, 3136, 256]
    - [40, 21408.0]
  - - [3136, 64, 64, 64, 3136, 3136, 3136, 64]
    - [32, 13593.0]
  - - [3136, 64, 64, 256, 3136, 3136, 3136, 64]
    - [28, 22111.0]
  - - [784, 512, 64, 128, 784, 784, 784, 512]
    - [37, 25248.0]
  - - [784, 128, 64, 512, 784, 784, 784, 128]
    - [20, 27221.0]
  - - [196, 1024, 64, 256, 196, 196, 196, 1024]
    - [34, 20791.0]
  - - [196, 256, 64, 1024, 196, 196, 196, 256]
    - [21, 21702.0]
  - - [64, 192, 32, 1280, 64, 64, 64, 192]
    - [27, 16470.0]
  - - [64, 320, 32, 1280, 64, 64, 64, 320]
    - [7, 19859.0]
  - - [64, 384, 32, 1280, 64, 64, 64, 384]
    - [9, 22390.0]
  - - [64, 448, 32, 1280, 64, 64, 64, 448]
    - [30, 24549.0]
  - - [64, 192, 32, 2048, 64, 64, 64, 192]
    - [31, 18040.0]
  - - [64, 320, 32, 2048, 64, 64, 64, 320]
    - [27, 21130.0]
  - - [64, 384, 32, 2048, 64, 64, 64, 384]
    - [42, 24492.0]
  - - [64, 448, 32, 2048, 64, 64, 64, 448]
    - [25, 25531.0]
  - - [1225, 32, 32, 192, 1225, 1225, 1225, 32]
    - [14, 7117.0]
  - - [1225, 48, 32, 192, 1225, 1225, 1225, 48]
    - [2, 9408.0]
  - - [1225, 64, 32, 192, 1225, 1225, 1225, 64]
    - [15, 15053.0]
  - - [1225, 48, 32, 256, 1225, 1225, 1225, 48]
    - [2, 10908.0]
  - - [1225, 64, 32, 256, 1225, 1225, 1225, 64]
    - [3, 16384.0]
  - - [1225, 48, 32, 288, 1225, 1225, 1225, 48]
    - [15, 11290.0]
  - - [1225, 64, 32, 288, 1225, 1225, 1225, 64]
    - [12, 16945.0]
  - - [5329, 80, 32, 64, 5329, 5329, 5329, 80]
    - [15, 10795.0]
  - - [289, 128, 32, 768, 289, 289, 289, 128]
    - [23, 20042.0]
  - - [289, 160, 32, 768, 289, 289, 289, 160]
    - [13, 18424.0]
  - - [289, 192, 32, 768, 289, 289, 289, 192]
    - [10, 20813.0]
  - - [49, 2048, 32, 512, 49, 49, 49, 2048]
    - [22, 17127.0]
  - - [49, 512, 32, 2048, 49, 49, 49, 512]
    - [2, 16601.0]
  - - [3136, 256, 32, 64, 3136, 3136, 3136, 256]
    - [36, 20110.0]
  - - [3136, 64, 32, 64, 3136, 3136, 3136, 64]
    - [32, 11839.0]
  - - [3136, 64, 32, 256, 3136, 3136, 3136, 64]
    - [32, 21210.0]
  - - [784, 512, 32, 128, 784, 784, 784, 512]
    - [39, 23408.0]
  - - [784, 128, 32, 512, 784, 784, 784, 128]
    - [13, 24672.0]
  - - [196, 1024, 32, 256, 196, 196, 196, 1024]
    - [16, 19065.0]
  - - [196, 256, 32, 1024, 196, 196, 196, 256]
    - [5, 19083.0]
- null
