src/Tensile/data/Configs/miopen/archives/inception/2019-03-26/exact/vega20_Cijk_Ailk_Bjlk_SB.yaml
- {MinimumRequiredVersion: 4.9.3}
- vega20
- gfx906
- [Device 66a0, Device 66a1, Device 66a7]
    SolutionIndex: 0
    SolutionNameMin: Cijk_Ailk_Bjlk_SB_MT64x32x8_SE_EPS0_GSU1_PGR0_PLR1_SNLL0_TT8_4_VW4_WG8_8_1_WGM1
    SolutionIndex: 1
    SolutionNameMin: Cijk_Ailk_Bjlk_SB_MT64x64x8_SE_EPS1_GSU1_PGR1_PLR1_SNLL1_TT8_8_VW4_WG8_8_1_WGM8
    SolutionIndex: 2
    SolutionNameMin: Cijk_Ailk_Bjlk_SB_MT64x32x8_SE_EPS0_GSU1_PGR0_PLR1_SNLL0_TT8_4_VW4_WG8_8_1_WGM64
    SolutionIndex: 3
    SolutionNameMin: Cijk_Ailk_Bjlk_SB_MT64x64x8_SE_EPS1_GSU1_PGR1_PLR1_SNLL1_TT8_8_VW4_WG8_8_1_WGM64
    SolutionIndex: 4
    SolutionNameMin: Cijk_Ailk_Bjlk_SB_MT128x32x16_SE_EPS0_GSU1_PGR0_PLR1_SNLL0_TT8_4_VW4_WG16_8_1_WGM1
    SolutionIndex: 5
    SolutionNameMin: Cijk_Ailk_Bjlk_SB_MT64x64x16_SE_EPS1_GSU1_PGR1_PLR1_SNLL1_TT4_4_VW4_WG16_16_1_WGM1
    SolutionIndex: 6
    SolutionNameMin: Cijk_Ailk_Bjlk_SB_MT128x32x16_SE_EPS0_GSU1_PGR0_PLR1_SNLL0_TT8_4_VW4_WG16_8_1_WGM8
    SolutionIndex: 7
    SolutionNameMin: Cijk_Ailk_Bjlk_SB_MT64x64x16_SE_EPS0_GSU1_PGR0_PLR0_SNLL0_TT4_4_VW4_WG16_16_1_WGM8
    SolutionIndex: 8
    SolutionNameMin: Cijk_Ailk_Bjlk_SB_MT64x64x16_SE_EPS0_GSU1_PGR0_PLR1_SNLL0_TT4_4_VW4_WG16_16_1_WGM8
    SolutionIndex: 9
    SolutionNameMin: Cijk_Ailk_Bjlk_SB_MT64x64x16_SE_EPS1_GSU1_PGR1_PLR1_SNLL1_TT4_4_VW4_WG16_16_1_WGM8
    SolutionIndex: 10
    SolutionNameMin: Cijk_Ailk_Bjlk_SB_MT128x32x16_SE_EPS0_GSU1_PGR0_PLR1_SNLL0_TT8_4_VW4_WG16_8_1_WGM64
    SolutionIndex: 11
    SolutionNameMin: Cijk_Ailk_Bjlk_SB_MT64x64x16_SE_EPS0_GSU1_PGR0_PLR0_SNLL0_TT4_4_VW4_WG16_16_1_WGM64
    SolutionIndex: 12
    SolutionNameMin: Cijk_Ailk_Bjlk_SB_MT64x64x16_SE_EPS0_GSU1_PGR0_PLR1_SNLL0_TT4_4_VW4_WG16_16_1_WGM64
    SolutionIndex: 13
    SolutionNameMin: Cijk_Ailk_Bjlk_SB_MT64x64x16_SE_EPS1_GSU1_PGR1_PLR1_SNLL1_TT4_4_VW4_WG16_16_1_WGM64
- - - [5329, 160, 64, 64, 5329, 5329, 5329, 160]
    - [6, 8156.79]
  - - [1225, 288, 64, 48, 1225, 1225, 1225, 288]
    - [10, 6926.13]
  - - [1225, 192, 64, 64, 1225, 1225, 1225, 192]
    - [12, 7840.0]
  - - [64, 1280, 64, 384, 64, 64, 64, 1280]
    - [13, 9276.01]
  - - [1225, 384, 64, 192, 1225, 1225, 1225, 384]
    - [3, 9162.25]
  - - [1225, 288, 64, 64, 1225, 1225, 1225, 288]
    - [4, 7495.17]
  - - [5329, 64, 64, 80, 5329, 5329, 5329, 64]
    - [5, 8480.03]
  - - [289, 1024, 64, 256, 289, 289, 289, 1024]
    - [3, 8483.73]
  - - [289, 768, 64, 192, 289, 289, 289, 768]
    - [9, 8234.74]
  - - [289, 768, 64, 128, 289, 289, 289, 768]
    - [9, 7988.71]
  - - [64, 1536, 64, 384, 64, 64, 64, 1536]
    - [13, 9323.55]
  - - [1225, 384, 64, 64, 1225, 1225, 1225, 384]
    - [12, 8158.7]
  - - [64, 2048, 64, 192, 64, 64, 64, 2048]
    - [9, 8818.51]
  - - [64, 1280, 64, 320, 64, 64, 64, 1280]
    - [5, 9202.07]
  - - [1225, 384, 64, 96, 1225, 1225, 1225, 384]
    - [3, 8540.6]
  - - [64, 1280, 64, 448, 64, 64, 64, 1280]
    - [9, 9317.72]
  - - [289, 768, 64, 160, 289, 289, 289, 768]
    - [13, 8128.71]
  - - [1225, 192, 64, 32, 1225, 1225, 1225, 192]
    - [12, 6495.27]
  - - [64, 1536, 64, 256, 64, 64, 64, 1536]
    - [9, 9142.9]
  - - [1225, 256, 64, 48, 1225, 1225, 1225, 256]
    - [7, 7545.26]
  - - [1225, 256, 64, 64, 1225, 1225, 1225, 256]
    - [8, 7972.35]
  - - [1225, 192, 64, 48, 1225, 1225, 1225, 192]
    - [11, 7348.8]
  - - [289, 1024, 64, 384, 289, 289, 289, 1024]
    - [1, 8725.56]
  - - [289, 1024, 64, 192, 289, 289, 289, 1024]
    - [3, 8313.06]
  - - [64, 1280, 64, 192, 64, 64, 64, 1280]
    - [5, 8768.58]
  - - [64, 2048, 64, 320, 64, 64, 64, 2048]
    - [2, 9147.88]
  - - [64, 2048, 64, 448, 64, 64, 64, 2048]
    - [0, 9304.06]
  - - [64, 2048, 64, 384, 64, 64, 64, 2048]
    - [2, 9235.18]
  - - [289, 1024, 64, 128, 289, 289, 289, 1024]
    - [9, 7989.41]
- null
