Tensile/Configs/miopen/archives/bert/2020-07-14/exact/vega20_Cijk_Ailk_Bljk_SB.yaml
- {MinimumRequiredVersion: 4.21.0}
- vega20
- gfx906
- [Device 66a0, Device 66a1, Device 66a7, Device 66af, Vega 20]
    SolutionIndex: 0
    SolutionNameMin: Cijk_Ailk_Bljk_SB_MT64x64x16_SE_GRVW4_GSU1_LRVW4_TT4_4_VW4_WG16_16_1_WGM1
    SolutionIndex: 1
    SolutionNameMin: Cijk_Ailk_Bljk_SB_MT64x64x16_SE_GRVW4_GSU1_LRVW4_TT4_4_VW4_WG16_16_1_WGM8
    SolutionIndex: 2
    SolutionNameMin: Cijk_Ailk_Bljk_SB_MT128x64x16_SE_GRVW4_GSU1_LRVW4_TT8_4_VW4_WG16_16_1_WGM1
    SolutionIndex: 3
    SolutionNameMin: Cijk_Ailk_Bljk_SB_MT128x128x16_SE_GRVW4_GSU1_LRVW4_TT8_8_VW4_WG16_16_1_WGM1
    SolutionIndex: 4
    SolutionNameMin: Cijk_Ailk_Bljk_SB_MT64x32x16_SE_GRVW4_GSU1_LRVW4_TT4_4_VW4_WG16_8_2_WGM1
    SolutionIndex: 5
    SolutionNameMin: Cijk_Ailk_Bljk_SB_MT64x32x16_SE_GRVW4_GSU1_LRVW4_TT4_4_VW4_WG16_8_2_WGM8
    SolutionIndex: 6
    SolutionNameMin: Cijk_Ailk_Bljk_SB_MT64x64x16_SE_GRVW4_GSU1_LRVW4_TT4_8_VW4_WG16_8_2_WGM8
    SolutionIndex: 7
    SolutionNameMin: Cijk_Ailk_Bljk_SB_MT128x32x16_SE_GRVW4_GSU1_LRVW4_TT8_4_VW4_WG16_8_2_WGM1
    SolutionIndex: 8
    SolutionNameMin: Cijk_Ailk_Bljk_SB_MT32x32x32_SE_GRVW4_GSU1_LRVW4_TT4_4_VW4_WG8_8_4_WGM1
    SolutionIndex: 9
    SolutionNameMin: Cijk_Ailk_Bljk_SB_MT32x32x32_SE_GRVW4_GSU1_LRVW4_TT4_4_VW4_WG8_8_4_WGM8
    SolutionIndex: 10
    SolutionNameMin: Cijk_Ailk_Bljk_SB_MT64x32x32_SE_GRVW4_GSU1_LRVW4_TT8_4_VW4_WG8_8_4_WGM1
    SolutionIndex: 11
    SolutionNameMin: Cijk_Ailk_Bljk_SB_MT64x32x32_SE_GRVW4_GSU1_LRVW4_TT8_4_VW4_WG8_8_4_WGM8
- - - [512, 512, 128, 64, 512, 512, 512, 64]
    - [0, 11180.2]
  - - [512, 512, 192, 64, 512, 512, 512, 64]
    - [0, 11393.7]
  - - [128, 128, 1312, 64, 128, 128, 128, 64]
    - [0, 9957.53]
  - - [64, 128, 1312, 128, 64, 64, 64, 128]
    - [5, 9305.55]
  - - [128, 128, 1280, 64, 128, 128, 128, 64]
    - [0, 9898.06]
  - - [64, 128, 1280, 128, 64, 64, 64, 128]
    - [4, 9289.71]
  - - [128, 128, 1024, 64, 128, 128, 128, 64]
    - [1, 9825.6]
  - - [64, 128, 1024, 128, 64, 64, 64, 128]
    - [4, 9174.14]
  - - [128, 128, 512, 64, 128, 128, 128, 64]
    - [0, 9425.4]
  - - [64, 128, 512, 128, 64, 64, 64, 128]
    - [5, 8692.86]
  - - [64, 512, 128, 512, 64, 64, 64, 512]
    - [11, 9818.41]
  - - [64, 512, 192, 512, 64, 64, 64, 512]
    - [10, 9883.5]
  - - [1024, 8, 1, 1024, 1024, 1024, 1024, 1024]
    - [8, 472.332]
  - - [1024, 12, 1, 1024, 1024, 1024, 1024, 1024]
    - [8, 782.519]
  - - [1024, 4096, 1, 4096, 1024, 1024, 1024, 4096]
    - [2, 13653.0]
  - - [1024, 4096, 1, 1024, 1024, 1024, 1024, 1024]
    - [3, 13381.6]
  - - [1024, 4096, 1, 30528, 1024, 1024, 1024, 30528]
    - [3, 14267.0]
  - - [4096, 4096, 1, 1024, 4096, 4096, 4096, 1024]
    - [3, 13747.4]
  - - [1024, 6144, 1, 30528, 1024, 1024, 1024, 30528]
    - [3, 14305.8]
  - - [1024, 6144, 1, 4096, 1024, 1024, 1024, 4096]
    - [2, 13780.1]
  - - [1024, 6144, 1, 1024, 1024, 1024, 1024, 1024]
    - [3, 13520.9]
  - - [4096, 6144, 1, 1024, 4096, 4096, 4096, 1024]
    - [3, 13860.7]
  - - [1024, 10496, 1, 4096, 1024, 1024, 1024, 4096]
    - [7, 13012.7]
  - - [1024, 10496, 1, 1024, 1024, 1024, 1024, 1024]
    - [2, 12663.2]
  - - [4096, 10496, 1, 1024, 4096, 4096, 4096, 1024]
    - [3, 13687.9]
  - - [1024, 10496, 1, 30528, 1024, 1024, 1024, 30528]
    - [6, 13545.1]
  - - [1024, 10240, 1, 4096, 1024, 1024, 1024, 4096]
    - [2, 13799.2]
  - - [1024, 10240, 1, 1024, 1024, 1024, 1024, 1024]
    - [3, 13568.3]
  - - [4096, 10240, 1, 1024, 4096, 4096, 4096, 1024]
    - [3, 14025.6]
  - - [1024, 10240, 1, 30528, 1024, 1024, 1024, 30528]
    - [3, 14357.8]
  - - [1024, 8192, 1, 4096, 1024, 1024, 1024, 4096]
    - [2, 13827.1]
  - - [1024, 8192, 1, 1024, 1024, 1024, 1024, 1024]
    - [3, 13626.2]
  - - [1024, 8192, 1, 30528, 1024, 1024, 1024, 30528]
    - [3, 14355.0]
  - - [4096, 8192, 1, 1024, 4096, 4096, 4096, 1024]
    - [3, 13937.5]
  - - [1024, 82, 1, 1024, 1024, 1024, 1024, 1024]
    - [9, 4117.97]
  - - [1024, 80, 1, 1024, 1024, 1024, 1024, 1024]
    - [9, 4112.06]
  - - [1024, 64, 1, 1024, 1024, 1024, 1024, 1024]
    - [9, 4112.06]
  - - [1024, 32, 1, 1024, 1024, 1024, 1024, 1024]
    - [8, 2107.69]
- null
