Tensile/Configs/miopen/Logic/deepbench/vega10_Cijk_Ailk_Bljk_SB.yaml
- {MinimumRequiredVersion: 4.2.0}
- vega10
- gfx900
- [Device 6863, Device 6862, Device 687f, Device 6860, Device 6861]
    SolutionIndex: 0
    SolutionNameMin: Cijk_Ailk_Bljk_SB_MT064x128x32_NLCB01_PGR1_TT04_08_WGM08
    SolutionIndex: 1
    SolutionNameMin: Cijk_Ailk_Bljk_SB_MT064x016x16_NLCB01_PGR1_TT02_02_WGM08
    SolutionIndex: 2
    SolutionNameMin: Cijk_Ailk_Bljk_SB_MT128x032x16_NLCB01_PGR0_TT04_04_WGM64
    SolutionIndex: 3
    SolutionNameMin: Cijk_Ailk_Bljk_SB_MT064x064x16_NLCB01_PGR0_TT04_04_WGM08
    SolutionIndex: 4
    SolutionNameMin: Cijk_Ailk_Bljk_SB_MT128x032x16_NLCB01_PGR0_TT04_04_WGM08
    SolutionIndex: 5
    SolutionNameMin: Cijk_Ailk_Bljk_SB_MT032x016x32_NLCB01_PGR1_TT02_02_WGM08
    SolutionIndex: 6
    SolutionNameMin: Cijk_Ailk_Bljk_SB_MT032x016x16_NLCB01_PGR1_TT02_02_WGM64
    SolutionIndex: 7
    SolutionNameMin: Cijk_Ailk_Bljk_SB_MT128x064x16_NLCB01_PGR1_TT08_04_WGM01
    SolutionIndex: 8
    SolutionNameMin: Cijk_Ailk_Bljk_SB_MT128x032x16_NLCB01_PGR0_TT04_04_WGM01
    SolutionIndex: 9
    SolutionNameMin: Cijk_Ailk_Bljk_SB_MT128x032x16_NLCB01_PGR1_TT04_04_WGM08
    SolutionIndex: 10
    SolutionNameMin: Cijk_Ailk_Bljk_SB_MT064x064x16_NLCB01_PGR1_TT04_04_WGM64
    SolutionIndex: 11
    SolutionNameMin: Cijk_Ailk_Bljk_SB_MT032x016x16_NLCB01_PGR1_TT02_02_WGM08
    SolutionIndex: 12
    SolutionNameMin: Cijk_Ailk_Bljk_SB_MT064x016x16_NLCB01_PGR1_TT02_02_WGM64
    SolutionIndex: 13
    SolutionNameMin: Cijk_Ailk_Bljk_SB_MT064x016x16_NLCB01_PGR1_TT02_02_WGM64
    SolutionIndex: 14
    SolutionNameMin: Cijk_Ailk_Bljk_SB_MT032x016x16_NLCB01_PGR0_TT02_02_WGM64
    SolutionIndex: 15
    SolutionNameMin: Cijk_Ailk_Bljk_SB_MT064x016x16_NLCB01_PGR0_TT02_02_WGM64
    SolutionIndex: 16
    SolutionNameMin: Cijk_Ailk_Bljk_SB_MT032x016x16_NLCB01_PGR1_TT02_02_WGM64
    SolutionIndex: 17
    SolutionNameMin: Cijk_Ailk_Bljk_SB_MT064x016x32_NLCB01_PGR1_TT02_02_WGM08
    SolutionIndex: 18
    SolutionNameMin: Cijk_Ailk_Bljk_SB_MT032x016x32_NLCB01_PGR1_TT02_02_WGM64
    SolutionIndex: 19
    SolutionNameMin: Cijk_Ailk_Bljk_SB_MT064x032x16_NLCB01_PGR1_TT04_04_WGM08
    SolutionIndex: 20
    SolutionNameMin: Cijk_Ailk_Bljk_SB_MT064x064x16_NLCB01_PGR1_TT04_04_WGM01
    SolutionIndex: 21
    SolutionNameMin: Cijk_Ailk_Bljk_SB_MT128x064x16_NLCB01_PGR1_TT08_04_WGM08
    SolutionIndex: 22
    SolutionNameMin: Cijk_Ailk_Bljk_SB_MT128x032x32_NLCB01_PGR0_TT04_04_WGM64
    SolutionIndex: 23
    SolutionNameMin: Cijk_Ailk_Bljk_SB_MT064x128x16_NLCB01_PGR1_TT04_08_WGM01
    SolutionIndex: 24
    SolutionNameMin: Cijk_Ailk_Bljk_SB_MT128x064x16_NLCB01_PGR0_TT04_08_WGM01
    SolutionIndex: 25
    SolutionNameMin: Cijk_Ailk_Bljk_SB_MT032x016x16_NLCB01_PGR1_TT02_02_WGM01
    SolutionIndex: 26
    SolutionNameMin: Cijk_Ailk_Bljk_SB_MT064x064x16_NLCB01_PGR1_TT04_04_WGM08
    SolutionIndex: 27
    SolutionNameMin: Cijk_Ailk_Bljk_SB_MT064x032x16_NLCB01_PGR0_TT04_04_WGM08
    SolutionIndex: 28
    SolutionNameMin: Cijk_Ailk_Bljk_SB_MT128x032x16_NLCB01_PGR0_TT04_04_WGM08
    SolutionIndex: 29
    SolutionNameMin: Cijk_Ailk_Bljk_SB_MT128x064x16_NLCB01_PGR0_TT08_04_WGM64
    SolutionIndex: 30
    SolutionNameMin: Cijk_Ailk_Bljk_SB_MT128x032x16_NLCB01_PGR1_TT04_04_WGM64
    SolutionIndex: 31
    SolutionNameMin: Cijk_Ailk_Bljk_SB_MT064x016x16_NLCB01_PGR0_TT02_02_WGM01
    SolutionIndex: 32
    SolutionNameMin: Cijk_Ailk_Bljk_SB_MT064x064x16_NLCB01_PGR1_TT04_04_WGM64
    SolutionIndex: 33
    SolutionNameMin: Cijk_Ailk_Bljk_SB_MT032x016x16_NLCB01_PGR0_TT02_02_WGM64
    SolutionIndex: 34
    SolutionNameMin: Cijk_Ailk_Bljk_SB_MT032x016x16_NLCB01_PGR0_TT02_02_WGM01
    SolutionIndex: 35
    SolutionNameMin: Cijk_Ailk_Bljk_SB_MT064x016x32_NLCB01_PGR1_TT02_02_WGM01
    SolutionIndex: 36
    SolutionNameMin: Cijk_Ailk_Bljk_SB_MT128x128x16_NLCB01_PGR1_TT08_08_WGM08
    SolutionIndex: 37
    SolutionNameMin: Cijk_Ailk_Bljk_SB_MT128x128x16_NLCB01_PGR1_TT08_08_WGM01
- - - [8448, 48000, 1, 2816]
    - [36, 11161.7]
  - - [2048, 7000, 1, 2048]
    - [37, 10309.1]
  - - [7680, 64, 1, 2560]
    - [9, 7342.04]
  - - [7680, 128, 1, 2560]
    - [3, 8677.94]
  - - [512, 24000, 1, 2816]
    - [36, 10575.4]
  - - [512, 24000, 1, 2048]
    - [7, 9585.48]
  - - [5124, 9124, 1, 2560]
    - [37, 10449.0]
  - - [1024, 48000, 1, 2560]
    - [36, 10832.1]
  - - [3072, 32, 1, 1024]
    - [4, 3131.71]
  - - [3072, 48000, 1, 1024]
    - [37, 10680.7]
  - - [5124, 9124, 1, 4096]
    - [37, 10385.6]
  - - [5124, 9124, 1, 1760]
    - [36, 10612.3]
  - - [4096, 32, 1, 4096]
    - [22, 5036.41]
  - - [512, 48000, 1, 2560]
    - [37, 10499.3]
  - - [2048, 64, 1, 2048]
    - [26, 4784.29]
  - - [512, 24000, 1, 1536]
    - [37, 10185.9]
  - - [4096, 128, 1, 4096]
    - [24, 8022.93]
  - - [4608, 24000, 1, 1536]
    - [37, 10917.5]
  - - [7680, 48000, 1, 2560]
    - [37, 11086.2]
  - - [2560, 16, 1, 2560]
    - [17, 2745.87]
  - - [512, 16, 1, 512]
    - [33, 450.234]
  - - [3072, 24000, 1, 1024]
    - [37, 10553.9]
  - - [4096, 64, 1, 4096]
    - [28, 7039.23]
  - - [2560, 7000, 1, 2560]
    - [37, 10406.6]
  - - [1760, 7000, 1, 1760]
    - [21, 10104.8]
  - - [3072, 128, 1, 1024]
    - [29, 5831.29]
  - - [1760, 32, 1, 1760]
    - [16, 3111.35]
  - - [8448, 24000, 1, 2816]
    - [36, 11114.0]
  - - [6144, 16, 1, 2048]
    - [14, 2958.3]
  - - [2560, 64, 1, 2560]
    - [30, 5765.5]
  - - [35, 8457, 1, 4096]
    - [23, 1596.79]
  - - [1760, 128, 1, 1760]
    - [32, 6229.7]
  - - [3072, 16, 1, 1024]
    - [25, 2144.77]
  - - [1024, 16, 1, 512]
    - [34, 813.531]
  - - [1024, 24000, 1, 2048]
    - [37, 10349.1]
  - - [4096, 16, 1, 4096]
    - [6, 3091.55]
  - - [1024, 32, 1, 512]
    - [12, 1465.39]
  - - [512, 48000, 1, 2048]
    - [37, 9964.28]
  - - [512, 48000, 1, 1536]
    - [37, 10400.3]
  - - [512, 32, 1, 512]
    - [31, 848.651]
  - - [8448, 32, 1, 2816]
    - [27, 5481.32]
  - - [1024, 8, 1, 500000]
    - [18, 1513.76]
  - - [2048, 128, 1, 2048]
    - [28, 6234.18]
  - - [4608, 16, 1, 1536]
    - [1, 2740.95]
  - - [1024, 24000, 1, 2560]
    - [36, 10567.1]
  - - [5124, 9124, 1, 2048]
    - [37, 10292.5]
  - - [35, 8457, 1, 1760]
    - [23, 2548.96]
  - - [1024, 700, 1, 512]
    - [7, 5381.49]
  - - [2560, 32, 1, 2560]
    - [19, 4381.95]
  - - [2048, 32, 1, 2048]
    - [13, 3425.42]
  - - [8448, 16, 1, 2816]
    - [15, 3051.61]
  - - [6144, 24000, 1, 2048]
    - [37, 10845.3]
  - - [4096, 7000, 1, 4096]
    - [37, 10640.4]
  - - [7680, 24000, 1, 2560]
    - [37, 11050.4]
  - - [6144, 48000, 1, 2048]
    - [37, 10941.8]
  - - [4608, 32, 1, 1536]
    - [2, 4753.72]
  - - [35, 8457, 1, 2560]
    - [23, 2026.93]
  - - [4608, 48000, 1, 1536]
    - [37, 10977.1]
  - - [1024, 48000, 1, 2816]
    - [36, 10986.2]
  - - [3072, 64, 1, 1024]
    - [28, 4798.43]
  - - [512, 48000, 1, 2816]
    - [36, 10696.8]
  - - [2048, 16, 1, 2048]
    - [11, 2296.11]
  - - [1024, 24000, 1, 1536]
    - [36, 10424.6]
  - - [7680, 16, 1, 2560]
    - [35, 3257.42]
  - - [1760, 64, 1, 1760]
    - [20, 4615.55]
  - - [6144, 32, 1, 2048]
    - [8, 5257.37]
  - - [1024, 48000, 1, 1536]
    - [36, 10696.6]
  - - [2560, 128, 1, 2560]
    - [10, 7136.23]
  - - [35, 8457, 1, 2048]
    - [0, 1425.26]
  - - [512, 16, 1, 500000]
    - [18, 1902.01]
  - - [512, 8, 1, 500000]
    - [5, 949.127]
  - - [512, 24000, 1, 2560]
    - [37, 10399.4]
  - - [7680, 32, 1, 2560]
    - [8, 5642.33]
  - - [1024, 48000, 1, 2048]
    - [37, 10719.4]
  - - [1024, 16, 1, 500000]
    - [18, 2959.47]
  - - [1024, 24000, 1, 2816]
    - [36, 10715.7]
- null
