Tensile/Configs/miopen/archives/bert/2020-04-27/exact/vega20_Cijk_Ailk_Bjlk_SB.yaml
- {MinimumRequiredVersion: 4.18.0}
- vega20
- gfx906
- [Device 66a0, Device 66a1, Device 66a7, Device 66af, Vega 20]
- - - [1024, 2, 1, 32, 1024, 1024, 1024, 2]
    - [12, 12.0]
  - - [1024, 2, 1, 4, 1024, 1024, 1024, 2]
    - [3, 2.0]
  - - [1024, 30528, 1, 4096, 1024, 1024, 1024, 30528]
    - [7, 13868.0]
  - - [1024, 1024, 1, 4096, 1024, 1024, 1024, 1024]
    - [6, 13544.0]
  - - [1024, 1024, 1, 32, 1024, 1024, 1024, 1024]
    - [0, 3813.0]
  - - [4096, 1024, 1, 4096, 4096, 4096, 4096, 1024]
    - [8, 13876.0]
  - - [1024, 4096, 1, 4096, 1024, 1024, 1024, 4096]
    - [9, 13979.0]
  - - [1024, 1024, 1, 2048, 1024, 1024, 1024, 1024]
    - [4, 13101.0]
  - - [4096, 1024, 1, 2048, 4096, 4096, 4096, 1024]
    - [10, 13708.0]
  - - [1024, 30528, 1, 2048, 1024, 1024, 1024, 30528]
    - [9, 13862.0]
  - - [1024, 1024, 1, 4, 1024, 1024, 1024, 1024]
    - [5, 603.0]
  - - [1024, 4096, 1, 2048, 1024, 1024, 1024, 4096]
    - [11, 13780.0]
  - - [128, 64, 512, 128, 128, 128, 128, 64]
    - [2, 9020.0]
  - - [64, 128, 512, 128, 64, 64, 64, 128]
    - [2, 10168.0]
  - - [512, 64, 64, 512, 512, 512, 512, 64]
    - [2, 11641.0]
  - - [64, 512, 64, 512, 64, 64, 64, 512]
    - [1, 12280.0]
- null
