Tensile/Configs/miopen/archives/bert/2020-03-29/exact/arcturus_Cijk_Alik_Bljk_SB.yaml
- {MinimumRequiredVersion: 4.17.0}
- arcturus
- gfx908
- [Device 7380, Device 7388, Device 738c, Device 7390, Device 731f]
    SolutionIndex: 0
    SolutionNameMin: Cijk_Alik_Bljk_SB_MT32x256x8_MI32x32x1x2_SE_FL0_GRVW1_LPA0_LPB0_ONLL0_PLR0_SNLL1_TT1_32_USFGRO0_WG16_16_1
    SolutionIndex: 1
    SolutionNameMin: Cijk_Alik_Bljk_SB_MT32x256x8_MI32x32x1x2_SE_FL0_GRVW4_LPA0_LPB0_ONLL0_PLR0_SNLL1_TT1_32_USFGRO0_WG16_16_1
    SolutionIndex: 2
    SolutionNameMin: Cijk_Alik_Bljk_SB_MT32x256x8_MI32x32x1x2_SE_FL0_GRVW4_LPA0_LPB0_ONLL1_PLR0_SNLL0_TT1_32_USFGRO0_WG16_16_1
    SolutionIndex: 3
    SolutionNameMin: Cijk_Alik_Bljk_SB_MT32x256x8_MI32x32x1x2_SE_FL0_GRVW4_LPA1_LPB1_ONLL1_PLR0_SNLL1_TT1_32_USFGRO0_WG16_16_1
    SolutionIndex: 4
    SolutionNameMin: Cijk_Alik_Bljk_SB_MT32x256x8_MI32x32x1x2_SE_FL0_GRVW4_LPA1_LPB0_ONLL1_PLR1_SNLL1_TT1_32_USFGRO0_WG16_16_1
    SolutionIndex: 5
    SolutionNameMin: Cijk_Alik_Bljk_SB_MT64x128x16_MI32x32x1x2_SE_FL0_GRVW2_LPA0_LPB1_ONLL0_PLR0_SNLL0_TT1_32_USFGRO1_WG64_4_1
    SolutionIndex: 6
    SolutionNameMin: Cijk_Alik_Bljk_SB_MT64x128x16_MI32x32x1x2_SE_FL0_GRVW1_LPA1_LPB1_ONLL1_PLR0_SNLL0_TT1_32_USFGRO1_WG64_4_1
    SolutionIndex: 7
    SolutionNameMin: Cijk_Alik_Bljk_SB_MT64x128x8_MI32x32x1x2_SE_FL0_GRVW4_LPA0_LPB0_ONLL0_PLR1_SNLL1_TT1_32_USFGRO0_WG64_4_1
    SolutionIndex: 8
    SolutionNameMin: Cijk_Alik_Bljk_SB_MT64x128x16_MI32x32x1x2_SE_FL0_GRVW4_LPA1_LPB1_ONLL1_PLR1_SNLL0_TT1_32_USFGRO0_WG64_4_1
    SolutionIndex: 9
    SolutionNameMin: Cijk_Alik_Bljk_SB_MT64x128x8_MI32x32x1x2_SE_FL0_GRVW4_LPA0_LPB0_ONLL0_PLR1_SNLL1_TT1_32_USFGRO1_WG64_4_1
    SolutionIndex: 10
    SolutionNameMin: Cijk_Alik_Bljk_SB_MT128x128x16_MI32x32x1x2_SE_FL0_GRVW4_LPA0_LPB0_ONLL1_PLR0_SNLL1_TT2_32_USFGRO0_WG64_4_1
    SolutionIndex: 11
    SolutionNameMin: Cijk_Alik_Bljk_SB_MT128x128x16_MI32x32x1x2_SE_FL0_GRVW4_LPA0_LPB0_ONLL1_PLR0_SNLL0_TT2_32_USFGRO0_WG64_4_1
    SolutionIndex: 12
    SolutionNameMin: Cijk_Alik_Bljk_SB_MT128x128x16_MI32x32x1x2_SE_FL0_GRVW4_LPA0_LPB0_ONLL0_PLR0_SNLL0_TT2_32_USFGRO1_WG64_4_1
    SolutionIndex: 13
    SolutionNameMin: Cijk_Alik_Bljk_SB_MT128x128x16_MI32x32x1x2_SE_FL1_GRVW4_LPA0_LPB0_ONLL1_PLR0_SNLL1_TT2_32_USFGRO0_WG64_4_1
    SolutionIndex: 14
    SolutionNameMin: Cijk_Alik_Bljk_SB_MT128x128x16_MI32x32x1x2_SE_FL1_GRVW4_LPA0_LPB0_ONLL1_PLR0_SNLL0_TT2_32_USFGRO0_WG64_4_1
    SolutionIndex: 15
    SolutionNameMin: Cijk_Alik_Bljk_SB_MT128x128x16_MI32x32x1x2_SE_FL1_GRVW4_LPA0_LPB0_ONLL0_PLR0_SNLL1_TT2_32_USFGRO1_WG64_4_1
    SolutionIndex: 16
    SolutionNameMin: Cijk_Alik_Bljk_SB_MT128x128x16_MI32x32x1x2_SE_FL1_GRVW4_LPA0_LPB0_ONLL0_PLR1_SNLL0_TT2_32_USFGRO0_WG64_4_1
    SolutionIndex: 17
    SolutionNameMin: Cijk_Alik_Bljk_SB_MT128x128x16_MI32x32x1x2_SE_FL1_GRVW4_LPA0_LPB0_ONLL1_PLR1_SNLL1_TT2_32_USFGRO0_WG64_4_1
    SolutionIndex: 18
    SolutionNameMin: Cijk_Alik_Bljk_SB_MT128x128x16_MI32x32x1x2_SE_FL1_GRVW4_LPA0_LPB0_ONLL1_PLR1_SNLL0_TT2_32_USFGRO0_WG64_4_1
    SolutionIndex: 19
    SolutionNameMin: Cijk_Alik_Bljk_SB_MT128x128x16_MI32x32x1x2_SE_FL1_GRVW4_LPA0_LPB0_ONLL0_PLR1_SNLL1_TT2_32_USFGRO1_WG64_4_1
    SolutionIndex: 20
    SolutionNameMin: Cijk_Alik_Bljk_SB_MT256x128x16_MI32x32x1x2_SE_FL0_GRVW2_LPA1_LPB1_ONLL1_PLR0_SNLL1_TT4_32_USFGRO0_WG64_4_1
    SolutionIndex: 21
    SolutionNameMin: Cijk_Alik_Bljk_SB_MT256x128x16_MI32x32x1x2_SE_FL0_GRVW4_LPA0_LPB0_ONLL1_PLR1_SNLL1_TT4_32_USFGRO1_WG64_4_1
    SolutionIndex: 22
    SolutionNameMin: Cijk_Alik_Bljk_SB_MT256x128x16_MI32x32x1x2_SE_FL0_GRVW4_LPA1_LPB0_ONLL1_PLR1_SNLL1_TT4_32_USFGRO1_WG64_4_1
    SolutionIndex: 23
    SolutionNameMin: Cijk_Alik_Bljk_SB_MT256x128x16_MI32x32x1x2_SE_FL1_GRVW4_LPA1_LPB1_ONLL0_PLR1_SNLL1_TT4_32_USFGRO1_WG64_4_1
    SolutionIndex: 24
    SolutionNameMin: Cijk_Alik_Bljk_SB_MT128x256x16_MI32x32x1x2_SE_FL0_GRVW2_LPA1_LPB1_ONLL0_PLR1_SNLL0_TT2_64_USFGRO1_WG64_4_1
- - - [1024, 3840, 1, 1024, 1024, 1024, 1024, 1024]
    - [5, 24880.0]
  - - [1024, 3840, 1, 4096, 1024, 1024, 4096, 4096]
    - [24, 24475.0]
  - - [1024, 3968, 1, 1024, 1024, 1024, 1024, 1024]
    - [8, 22771.0]
  - - [1024, 3968, 1, 4096, 1024, 1024, 4096, 4096]
    - [15, 20124.0]
  - - [1024, 7200, 1, 1024, 1024, 1024, 1024, 1024]
    - [17, 24809.0]
  - - [1024, 7200, 1, 4096, 1024, 1024, 4096, 4096]
    - [20, 24479.0]
  - - [1024, 8160, 1, 1024, 1024, 1024, 1024, 1024]
    - [6, 24073.0]
  - - [1024, 8160, 1, 4096, 1024, 1024, 4096, 4096]
    - [15, 24494.0]
  - - [1024, 9520, 1, 1024, 1024, 1024, 1024, 1024]
    - [18, 25803.0]
  - - [1024, 9520, 1, 4096, 1024, 1024, 4096, 4096]
    - [22, 24539.0]
  - - [1024, 10200, 1, 1024, 1024, 1024, 1024, 1024]
    - [16, 26066.0]
  - - [1024, 10200, 1, 4096, 1024, 1024, 4096, 4096]
    - [23, 25173.0]
  - - [4096, 3840, 1, 1024, 4096, 4096, 1024, 1024]
    - [21, 30371.0]
  - - [4096, 3968, 1, 1024, 4096, 4096, 1024, 1024]
    - [19, 29597.0]
  - - [4096, 7200, 1, 1024, 4096, 4096, 1024, 1024]
    - [12, 30134.0]
  - - [4096, 8160, 1, 1024, 4096, 4096, 1024, 1024]
    - [16, 29772.0]
  - - [4096, 9520, 1, 1024, 4096, 4096, 1024, 1024]
    - [12, 30401.0]
  - - [4096, 10200, 1, 1024, 4096, 4096, 1024, 1024]
    - [14, 29931.0]
  - - [42720, 3968, 1, 1024, 42720, 42720, 1024, 1024]
    - [13, 33229.0]
  - - [42720, 7200, 1, 1024, 42720, 42720, 1024, 1024]
    - [11, 32562.0]
  - - [42720, 9520, 1, 1024, 42720, 42720, 1024, 1024]
    - [10, 32796.0]
  - - [14, 14, 1, 64, 14, 14, 64, 64]
    - [4, 2.0]
  - - [15, 14, 1, 64, 15, 15, 64, 64]
    - [2, 2.0]
  - - [15, 15, 1, 64, 15, 15, 64, 64]
    - [1, 2.0]
  - - [17, 15, 1, 64, 17, 17, 64, 64]
    - [0, 2.0]
  - - [17, 17, 1, 64, 17, 17, 64, 64]
    - [0, 2.0]
  - - [30, 30, 1, 64, 30, 30, 64, 64]
    - [3, 7.0]
  - - [30, 31, 1, 64, 30, 30, 64, 64]
    - [9, 8.0]
  - - [31, 31, 1, 64, 31, 31, 64, 64]
    - [7, 8.0]
- null
