Tensile/Configs/miopen/archives/bert/2020-03-29/exact/arcturus_Cijk_Ailk_Bjlk_SB.yaml
- {MinimumRequiredVersion: 4.17.0}
- arcturus
- gfx908
- [Device 7380, Device 7388, Device 738c, Device 7390, Device 731f]
    SolutionIndex: 0
    SolutionNameMin: Cijk_Ailk_Bjlk_SB_MT32x256x8_MI32x32x1x2_SE_FL0_NLCB1_ONLL0_PLR0_SNLL1_TT1_32_USFGRO0_WG16_16_1
    SolutionIndex: 1
    SolutionNameMin: Cijk_Ailk_Bjlk_SB_MT32x256x16_MI32x32x1x2_SE_FL0_NLCB1_ONLL0_PLR0_SNLL1_TT1_32_USFGRO0_WG16_16_1
    SolutionIndex: 2
    SolutionNameMin: Cijk_Ailk_Bjlk_SB_MT32x256x8_MI32x32x1x2_SE_FL0_NLCB1_ONLL0_PLR0_SNLL0_TT1_32_USFGRO0_WG16_16_1
    SolutionIndex: 3
    SolutionNameMin: Cijk_Ailk_Bjlk_SB_MT32x256x8_MI32x32x1x2_SE_FL0_NLCB1_ONLL0_PLR0_SNLL0_TT1_32_USFGRO1_WG16_16_1
    SolutionIndex: 4
    SolutionNameMin: Cijk_Ailk_Bjlk_SB_MT32x256x8_MI32x32x1x2_SE_FL1_NLCB1_ONLL0_PLR1_SNLL0_TT1_32_USFGRO1_WG16_16_1
    SolutionIndex: 5
    SolutionNameMin: Cijk_Ailk_Bjlk_SB_MT32x256x8_MI32x32x1x2_SE_FL1_NLCB1_ONLL1_PLR1_SNLL1_TT1_32_USFGRO1_WG16_16_1
    SolutionIndex: 6
    SolutionNameMin: Cijk_Ailk_Bjlk_SB_MT64x128x16_MI32x32x1x2_SE_FL0_NLCB1_ONLL0_PLR0_SNLL0_TT1_32_USFGRO1_WG64_4_1
    SolutionIndex: 7
    SolutionNameMin: Cijk_Ailk_Bjlk_SB_MT128x128x8_MI32x32x1x2_SE_FL0_NLCB1_ONLL1_PLR0_SNLL0_TT2_32_USFGRO1_WG64_4_1
    SolutionIndex: 8
    SolutionNameMin: Cijk_Ailk_Bjlk_SB_MT128x128x32_MI32x32x1x2_SE_FL0_NLCB1_ONLL0_PLR1_SNLL0_TT2_32_USFGRO0_WG64_4_1
    SolutionIndex: 9
    SolutionNameMin: Cijk_Ailk_Bjlk_SB_MT128x128x32_MI32x32x1x2_SE_FL0_NLCB1_ONLL1_PLR1_SNLL0_TT2_32_USFGRO0_WG64_4_1
    SolutionIndex: 10
    SolutionNameMin: Cijk_Ailk_Bjlk_SB_MT128x128x32_MI32x32x1x2_SE_FL1_NLCB1_ONLL0_PLR1_SNLL0_TT2_32_USFGRO0_WG64_4_1
    SolutionIndex: 11
    SolutionNameMin: Cijk_Ailk_Bjlk_SB_MT128x128x32_MI32x32x1x2_SE_FL1_NLCB1_ONLL1_PLR1_SNLL0_TT2_32_USFGRO0_WG64_4_1
- - - [1024, 1024, 1, 3840, 1024, 1024, 1024, 1024]
    - [10, 17562.0]
  - - [1024, 1024, 1, 3968, 1024, 1024, 1024, 1024]
    - [8, 17601.0]
  - - [1024, 1024, 1, 7200, 1024, 1024, 1024, 1024]
    - [10, 18062.0]
  - - [1024, 1024, 1, 8160, 1024, 1024, 1024, 1024]
    - [10, 18113.0]
  - - [1024, 1024, 1, 9520, 1024, 1024, 1024, 1024]
    - [10, 18129.0]
  - - [1024, 1024, 1, 10200, 1024, 1024, 1024, 1024]
    - [11, 18160.0]
  - - [1024, 4096, 1, 3840, 1024, 1024, 1024, 4096]
    - [11, 23605.0]
  - - [1024, 4096, 1, 3968, 1024, 1024, 1024, 4096]
    - [10, 23641.0]
  - - [1024, 4096, 1, 7200, 1024, 1024, 1024, 4096]
    - [8, 24113.0]
  - - [1024, 4096, 1, 8160, 1024, 1024, 1024, 4096]
    - [11, 24135.0]
  - - [1024, 4096, 1, 9520, 1024, 1024, 1024, 4096]
    - [10, 24202.0]
  - - [1024, 4096, 1, 10200, 1024, 1024, 1024, 4096]
    - [10, 24235.0]
  - - [1024, 42720, 1, 3968, 1024, 1024, 1024, 42720]
    - [7, 35831.0]
  - - [1024, 42720, 1, 7200, 1024, 1024, 1024, 42720]
    - [7, 36338.0]
  - - [1024, 42720, 1, 9520, 1024, 1024, 1024, 42720]
    - [7, 36483.0]
  - - [4096, 1024, 1, 3840, 4096, 4096, 4096, 1024]
    - [9, 23487.0]
  - - [4096, 1024, 1, 3968, 4096, 4096, 4096, 1024]
    - [10, 23489.0]
  - - [4096, 1024, 1, 7200, 4096, 4096, 4096, 1024]
    - [10, 24021.0]
  - - [4096, 1024, 1, 8160, 4096, 4096, 4096, 1024]
    - [11, 24101.0]
  - - [4096, 1024, 1, 9520, 4096, 4096, 4096, 1024]
    - [8, 24123.0]
  - - [4096, 1024, 1, 10200, 4096, 4096, 4096, 1024]
    - [8, 24117.0]
  - - [17, 64, 1, 15, 17, 17, 17, 64]
    - [0, 2.0]
  - - [17, 64, 1, 17, 17, 17, 17, 64]
    - [2, 4.0]
  - - [30, 64, 1, 30, 30, 30, 30, 64]
    - [6, 11.0]
  - - [30, 64, 1, 31, 30, 30, 30, 64]
    - [5, 11.0]
  - - [31, 64, 1, 31, 31, 31, 31, 64]
    - [4, 11.0]
  - - [64, 17, 1, 15, 64, 64, 64, 17]
    - [4, 4.0]
  - - [64, 17, 1, 17, 64, 64, 64, 17]
    - [2, 4.0]
  - - [64, 30, 1, 30, 64, 64, 64, 30]
    - [4, 11.0]
  - - [64, 30, 1, 31, 64, 64, 64, 30]
    - [2, 10.0]
  - - [64, 31, 1, 31, 64, 64, 64, 31]
    - [3, 11.0]
  - - [14, 64, 1, 14, 14, 14, 14, 64]
    - [1, 2.0]
  - - [15, 64, 1, 14, 15, 15, 15, 64]
    - [0, 3.0]
  - - [15, 64, 1, 15, 15, 15, 15, 64]
    - [0, 3.0]
  - - [64, 14, 1, 14, 64, 64, 64, 14]
    - [1, 3.0]
  - - [64, 15, 1, 14, 64, 64, 64, 15]
    - [0, 3.0]
  - - [64, 15, 1, 15, 64, 64, 64, 15]
    - [0, 3.0]
- null
