Tensile/Configs/miopen/archives/bert/2020-03-29/exact/arcturus_Cijk_Ailk_Bljk_SB.yaml
- {MinimumRequiredVersion: 4.17.0}
- arcturus
- gfx908
- [Device 7380, Device 7388, Device 738c, Device 7390, Device 731f]
    SolutionIndex: 0
    SolutionNameMin: Cijk_Ailk_Bljk_SB_MT32x256x8_MI32x32x1x2_SE_FL0_GRVW1_LPB0_ONLL0_PLR0_SNLL1_TT1_32_USFGRO0_WG16_16_1
    SolutionIndex: 1
    SolutionNameMin: Cijk_Ailk_Bljk_SB_MT32x256x8_MI32x32x1x2_SE_FL0_GRVW2_LPB0_ONLL0_PLR0_SNLL1_TT1_32_USFGRO0_WG16_16_1
    SolutionIndex: 2
    SolutionNameMin: Cijk_Ailk_Bljk_SB_MT32x256x8_MI32x32x1x2_SE_FL0_GRVW4_LPB0_ONLL0_PLR0_SNLL1_TT1_32_USFGRO0_WG16_16_1
    SolutionIndex: 3
    SolutionNameMin: Cijk_Ailk_Bljk_SB_MT32x256x8_MI32x32x1x2_SE_FL0_GRVW4_LPB0_ONLL0_PLR0_SNLL0_TT1_32_USFGRO0_WG16_16_1
    SolutionIndex: 4
    SolutionNameMin: Cijk_Ailk_Bljk_SB_MT64x128x16_MI32x32x1x2_SE_FL0_GRVW1_LPB1_ONLL0_PLR0_SNLL0_TT1_32_USFGRO0_WG64_4_1
    SolutionIndex: 5
    SolutionNameMin: Cijk_Ailk_Bljk_SB_MT64x128x16_MI32x32x1x2_SE_FL0_GRVW1_LPB1_ONLL1_PLR0_SNLL1_TT1_32_USFGRO0_WG64_4_1
    SolutionIndex: 6
    SolutionNameMin: Cijk_Ailk_Bljk_SB_MT64x128x16_MI32x32x1x2_SE_FL0_GRVW1_LPB1_ONLL1_PLR0_SNLL0_TT1_32_USFGRO0_WG64_4_1
    SolutionIndex: 7
    SolutionNameMin: Cijk_Ailk_Bljk_SB_MT64x128x16_MI32x32x1x2_SE_FL1_GRVW1_LPB1_ONLL1_PLR0_SNLL1_TT1_32_USFGRO1_WG64_4_1
    SolutionIndex: 8
    SolutionNameMin: Cijk_Ailk_Bljk_SB_MT64x128x32_MI32x32x1x2_SE_FL0_GRVW1_LPB1_ONLL1_PLR1_SNLL0_TT1_32_USFGRO0_WG64_4_1
    SolutionIndex: 9
    SolutionNameMin: Cijk_Ailk_Bljk_SB_MT64x128x32_MI32x32x1x2_SE_FL1_GRVW1_LPB1_ONLL1_PLR1_SNLL0_TT1_32_USFGRO0_WG64_4_1
    SolutionIndex: 10
    SolutionNameMin: Cijk_Ailk_Bljk_SB_MT64x128x32_MI32x32x1x2_SE_FL1_GRVW1_LPB1_ONLL0_PLR1_SNLL0_TT1_32_USFGRO1_WG64_4_1
    SolutionIndex: 11
    SolutionNameMin: Cijk_Ailk_Bljk_SB_MT64x128x16_MI32x32x1x2_SE_FL1_GRVW1_LPB1_ONLL1_PLR1_SNLL1_TT1_32_USFGRO1_WG64_4_1
    SolutionIndex: 12
    SolutionNameMin: Cijk_Ailk_Bljk_SB_MT128x128x8_MI32x32x1x2_SE_FL0_GRVW1_LPB0_ONLL0_PLR0_SNLL0_TT2_32_USFGRO1_WG64_4_1
    SolutionIndex: 13
    SolutionNameMin: Cijk_Ailk_Bljk_SB_MT128x128x8_MI32x32x1x2_SE_FL1_GRVW1_LPB0_ONLL0_PLR0_SNLL1_TT2_32_USFGRO1_WG64_4_1
    SolutionIndex: 14
    SolutionNameMin: Cijk_Ailk_Bljk_SB_MT128x128x16_MI32x32x1x2_SE_FL0_GRVW1_LPB1_ONLL1_PLR1_SNLL1_TT2_32_USFGRO0_WG64_4_1
    SolutionIndex: 15
    SolutionNameMin: Cijk_Ailk_Bljk_SB_MT128x128x16_MI32x32x1x2_SE_FL1_GRVW1_LPB1_ONLL1_PLR1_SNLL0_TT2_32_USFGRO0_WG64_4_1
    SolutionIndex: 16
    SolutionNameMin: Cijk_Ailk_Bljk_SB_MT256x128x16_MI32x32x1x2_SE_FL0_GRVW1_LPB1_ONLL0_PLR1_SNLL1_TT4_32_USFGRO0_WG64_4_1
    SolutionIndex: 17
    SolutionNameMin: Cijk_Ailk_Bljk_SB_MT256x128x16_MI32x32x1x2_SE_FL0_GRVW1_LPB1_ONLL0_PLR1_SNLL0_TT4_32_USFGRO0_WG64_4_1
    SolutionIndex: 18
    SolutionNameMin: Cijk_Ailk_Bljk_SB_MT256x128x16_MI32x32x1x2_SE_FL0_GRVW1_LPB1_ONLL1_PLR1_SNLL1_TT4_32_USFGRO0_WG64_4_1
    SolutionIndex: 19
    SolutionNameMin: Cijk_Ailk_Bljk_SB_MT256x128x16_MI32x32x1x2_SE_FL1_GRVW1_LPB1_ONLL0_PLR1_SNLL1_TT4_32_USFGRO0_WG64_4_1
    SolutionIndex: 20
    SolutionNameMin: Cijk_Ailk_Bljk_SB_MT256x128x16_MI32x32x1x2_SE_FL1_GRVW1_LPB1_ONLL0_PLR1_SNLL0_TT4_32_USFGRO0_WG64_4_1
- - - [1024, 3840, 1, 1024, 1024, 1024, 1024, 1024]
    - [6, 25562.0]
  - - [1024, 3840, 1, 4096, 1024, 1024, 1024, 4096]
    - [16, 26733.0]
  - - [1024, 3968, 1, 1024, 1024, 1024, 1024, 1024]
    - [11, 23651.0]
  - - [1024, 3968, 1, 4096, 1024, 1024, 1024, 4096]
    - [10, 20999.0]
  - - [1024, 3968, 1, 42720, 1024, 1024, 1024, 42720]
    - [9, 27005.0]
  - - [1024, 7200, 1, 1024, 1024, 1024, 1024, 1024]
    - [7, 26041.0]
  - - [1024, 7200, 1, 4096, 1024, 1024, 1024, 4096]
    - [16, 27386.0]
  - - [1024, 7200, 1, 42720, 1024, 1024, 1024, 42720]
    - [18, 31663.0]
  - - [1024, 8160, 1, 1024, 1024, 1024, 1024, 1024]
    - [7, 24925.0]
  - - [1024, 8160, 1, 4096, 1024, 1024, 1024, 4096]
    - [14, 24202.0]
  - - [1024, 9520, 1, 1024, 1024, 1024, 1024, 1024]
    - [4, 25899.0]
  - - [1024, 9520, 1, 4096, 1024, 1024, 1024, 4096]
    - [15, 26015.0]
  - - [1024, 9520, 1, 42720, 1024, 1024, 1024, 42720]
    - [8, 30715.0]
  - - [1024, 10200, 1, 1024, 1024, 1024, 1024, 1024]
    - [5, 25795.0]
  - - [1024, 10200, 1, 4096, 1024, 1024, 1024, 4096]
    - [19, 26673.0]
  - - [4096, 3840, 1, 1024, 4096, 4096, 4096, 1024]
    - [17, 28864.0]
  - - [4096, 3968, 1, 1024, 4096, 4096, 4096, 1024]
    - [13, 26896.0]
  - - [4096, 7200, 1, 1024, 4096, 4096, 4096, 1024]
    - [20, 27744.0]
  - - [4096, 8160, 1, 1024, 4096, 4096, 4096, 1024]
    - [12, 27136.0]
  - - [4096, 9520, 1, 1024, 4096, 4096, 4096, 1024]
    - [17, 29137.0]
  - - [4096, 10200, 1, 1024, 4096, 4096, 4096, 1024]
    - [20, 28012.0]
  - - [64, 17, 1, 17, 64, 64, 64, 17]
    - [3, 3.0]
  - - [64, 30, 1, 30, 64, 64, 64, 30]
    - [3, 8.0]
  - - [64, 31, 1, 30, 64, 64, 64, 30]
    - [2, 8.0]
  - - [64, 31, 1, 31, 64, 64, 64, 31]
    - [3, 8.0]
  - - [64, 14, 1, 14, 64, 64, 64, 14]
    - [1, 2.0]
  - - [64, 14, 1, 15, 64, 64, 64, 15]
    - [0, 2.0]
  - - [64, 15, 1, 15, 64, 64, 64, 15]
    - [0, 2.0]
  - - [64, 15, 1, 17, 64, 64, 64, 17]
    - [0, 2.0]
- null
