test_dir/py38/lib/python3.6/site-packages/Tensile/Configs/miopen/archives/resnet50/2019-12-03/exact/vega20_Cijk_Ailk_Bjlk_SB.yaml
- {MinimumRequiredVersion: 4.14.0}
- vega20
- gfx906
- [Device 66a0, Device 66a1, Device 66a7, Vega 20]
    SolutionIndex: 0
    SolutionNameMin: Cijk_Ailk_Bjlk_SB_MT64x64x8_SE_DTL0_EPS1_FL0_GRVW1_PGR1_PLR0_TT4_4_USFGRO1_VW4_WG16_16_1_WGM1
    SolutionIndex: 1
    SolutionNameMin: Cijk_Ailk_Bjlk_SB_MT64x64x8_SE_DTL0_EPS1_FL0_GRVW1_PGR1_PLR0_TT4_4_USFGRO1_VW4_WG16_16_1_WGM8
    SolutionIndex: 2
    SolutionNameMin: Cijk_Ailk_Bjlk_SB_MT64x64x16_SE_DTL0_EPS0_FL0_GRVW1_PGR0_PLR1_TT4_4_USFGRO1_VW4_WG16_16_1_WGM8
    SolutionIndex: 3
    SolutionNameMin: Cijk_Ailk_Bjlk_SB_MT64x128x8_SE_DTL0_EPS1_FL0_GRVW1_PGR1_PLR0_TT4_8_USFGRO1_VW4_WG16_16_1_WGM1
    SolutionIndex: 4
    SolutionNameMin: Cijk_Ailk_Bjlk_SB_MT64x128x8_SE_DTL0_EPS1_FL0_GRVW1_PGR1_PLR0_TT4_8_USFGRO1_VW4_WG16_16_1_WGM8
    SolutionIndex: 5
    SolutionNameMin: Cijk_Ailk_Bjlk_SB_MT64x128x8_SE_DTL0_EPS1_FL0_GRVW2_PGR1_PLR1_TT4_8_USFGRO0_VW2_WG16_16_1_WGM1
    SolutionIndex: 6
    SolutionNameMin: Cijk_Ailk_Bjlk_SB_MT64x128x8_SE_DTL0_EPS1_FL0_GRVW2_PGR1_PLR1_TT4_8_USFGRO0_VW2_WG16_16_1_WGM8
    SolutionIndex: 7
    SolutionNameMin: Cijk_Ailk_Bjlk_SB_MT64x128x8_SE_DTL0_EPS1_FL1_GRVW2_PGR1_PLR1_TT4_8_USFGRO0_VW2_WG16_16_1_WGM1
    SolutionIndex: 8
    SolutionNameMin: Cijk_Ailk_Bjlk_SB_MT64x64x8_SE_DTL0_EPS1_FL0_GRVW4_PGR1_PLR0_TT4_8_USFGRO0_VW4_WG16_8_1_WGM1
    SolutionIndex: 9
    SolutionNameMin: Cijk_Ailk_Bjlk_SB_MT64x64x8_SE_DTL0_EPS1_FL1_GRVW4_PGR1_PLR0_TT4_8_USFGRO0_VW4_WG16_8_1_WGM1
    SolutionIndex: 10
    SolutionNameMin: Cijk_Ailk_Bjlk_SB_MT64x64x8_SE_DTL0_EPS1_FL1_GRVW4_PGR1_PLR0_TT4_8_USFGRO0_VW4_WG16_8_1_WGM8
    SolutionIndex: 11
    SolutionNameMin: Cijk_Ailk_Bjlk_SB_MT128x32x8_SE_DTL1_EPS0_FL0_GRVW1_PGR0_PLR1_TT8_4_USFGRO1_VW4_WG16_8_1_WGM8
    SolutionIndex: 12
    SolutionNameMin: Cijk_Ailk_Bjlk_SB_MT32x128x8_SE_DTL1_EPS0_FL0_GRVW1_PGR0_PLR1_TT4_8_USFGRO1_VW4_WG8_16_1_WGM1
    SolutionIndex: 13
    SolutionNameMin: Cijk_Ailk_Bjlk_SB_MT64x64x8_SE_DTL0_EPS1_FL0_GRVW2_PGR1_PLR0_TT8_4_USFGRO0_VW2_WG8_16_1_WGM8
    SolutionIndex: 14
    SolutionNameMin: Cijk_Ailk_Bjlk_SB_MT64x64x8_SE_DTL0_EPS1_FL0_GRVW4_PGR1_PLR0_TT8_4_USFGRO0_VW4_WG8_16_1_WGM8
- - - [49, 512, 64, 2048, 49, 49, 49, 512]
    - [13, 7581.0]
  - - [49, 2048, 64, 512, 49, 49, 49, 2048]
    - [7, 7418.19]
  - - [64, 1280, 64, 192, 64, 64, 64, 1280]
    - [10, 9341.43]
  - - [64, 1280, 64, 320, 64, 64, 64, 1280]
    - [9, 9731.56]
  - - [64, 1280, 64, 384, 64, 64, 64, 1280]
    - [14, 9780.73]
  - - [64, 1280, 64, 448, 64, 64, 64, 1280]
    - [5, 9852.39]
  - - [64, 2048, 64, 192, 64, 64, 64, 2048]
    - [3, 9518.99]
  - - [64, 2048, 64, 320, 64, 64, 64, 2048]
    - [4, 9868.95]
  - - [64, 2048, 64, 384, 64, 64, 64, 2048]
    - [5, 9895.63]
  - - [64, 2048, 64, 448, 64, 64, 64, 2048]
    - [6, 9971.6]
  - - [196, 256, 64, 1024, 196, 196, 196, 256]
    - [6, 7586.6]
  - - [196, 1024, 64, 256, 196, 196, 196, 1024]
    - [12, 7815.97]
  - - [289, 768, 64, 128, 289, 289, 289, 768]
    - [9, 8322.18]
  - - [289, 768, 64, 160, 289, 289, 289, 768]
    - [8, 8508.49]
  - - [289, 768, 64, 192, 289, 289, 289, 768]
    - [9, 8648.36]
  - - [784, 128, 64, 512, 784, 784, 784, 128]
    - [5, 9365.27]
  - - [784, 512, 64, 128, 784, 784, 784, 512]
    - [3, 9226.53]
  - - [1225, 192, 64, 32, 1225, 1225, 1225, 192]
    - [2, 6865.59]
  - - [1225, 192, 64, 48, 1225, 1225, 1225, 192]
    - [1, 7915.58]
  - - [1225, 192, 64, 64, 1225, 1225, 1225, 192]
    - [1, 8282.15]
  - - [1225, 256, 64, 48, 1225, 1225, 1225, 256]
    - [1, 8114.72]
  - - [1225, 256, 64, 64, 1225, 1225, 1225, 256]
    - [1, 8384.5]
  - - [1225, 288, 64, 48, 1225, 1225, 1225, 288]
    - [11, 7126.52]
  - - [1225, 288, 64, 64, 1225, 1225, 1225, 288]
    - [11, 7712.79]
  - - [3136, 64, 64, 64, 3136, 3136, 3136, 64]
    - [1, 8556.24]
  - - [3136, 64, 64, 256, 3136, 3136, 3136, 64]
    - [9, 9796.04]
  - - [3136, 256, 64, 64, 3136, 3136, 3136, 256]
    - [3, 9369.54]
  - - [5329, 64, 64, 80, 5329, 5329, 5329, 64]
    - [0, 8717.09]
- null
