test_dir/py38/lib/python3.6/site-packages/Tensile/Configs/miopen/archives/resnet50/2019-12-03/exact/vega20_Cijk_Ailk_Bljk_SB.yaml
- {MinimumRequiredVersion: 4.14.0}
- vega20
- gfx906
- [Device 66a0, Device 66a1, Device 66a7, Vega 20]
    SolutionIndex: 0
    SolutionNameMin: Cijk_Ailk_Bljk_SB_MT64x64x16_SE_DTL0_EPS1_FL0_GRVW4_LPB0_PGR1_PLR1_TT4_4_USFGRO0_VW4_WG16_16_1_WGM8
    SolutionIndex: 1
    SolutionNameMin: Cijk_Ailk_Bljk_SB_MT64x64x32_SE_DTL0_EPS1_FL0_GRVW4_LPB0_PGR1_PLR1_TT4_4_USFGRO0_VW4_WG16_16_1_WGM1
    SolutionIndex: 2
    SolutionNameMin: Cijk_Ailk_Bljk_SB_MT64x64x32_SE_DTL0_EPS1_FL0_GRVW4_LPB0_PGR1_PLR1_TT4_4_USFGRO0_VW4_WG16_16_1_WGM8
    SolutionIndex: 3
    SolutionNameMin: Cijk_Ailk_Bljk_SB_MT64x64x16_SE_DTL0_EPS0_FL0_GRVW1_LPB2_PGR0_PLR0_TT4_4_USFGRO1_VW2_WG16_16_1_WGM1
    SolutionIndex: 4
    SolutionNameMin: Cijk_Ailk_Bljk_SB_MT64x64x16_SE_DTL0_EPS0_FL0_GRVW1_LPB4_PGR0_PLR0_TT4_4_USFGRO1_VW4_WG16_16_1_WGM8
    SolutionIndex: 5
    SolutionNameMin: Cijk_Ailk_Bljk_SB_MT64x64x16_SE_DTL0_EPS0_FL0_GRVW1_LPB4_PGR0_PLR1_TT4_4_USFGRO1_VW4_WG16_16_1_WGM1
    SolutionIndex: 6
    SolutionNameMin: Cijk_Ailk_Bljk_SB_MT64x64x32_SE_DTL0_EPS0_FL0_GRVW2_LPB2_PGR0_PLR1_TT4_4_USFGRO0_VW2_WG16_16_1_WGM8
    SolutionIndex: 7
    SolutionNameMin: Cijk_Ailk_Bljk_SB_MT64x64x16_SE_DTL0_EPS0_FL1_GRVW4_LPB4_PGR0_PLR1_TT4_4_USFGRO0_VW4_WG16_16_1_WGM8
    SolutionIndex: 8
    SolutionNameMin: Cijk_Ailk_Bljk_SB_MT64x64x32_SE_DTL0_EPS1_FL0_GRVW4_LPB4_PGR1_PLR1_TT4_4_USFGRO0_VW4_WG16_16_1_WGM1
    SolutionIndex: 9
    SolutionNameMin: Cijk_Ailk_Bljk_SB_MT64x64x32_SE_DTL0_EPS1_FL0_GRVW4_LPB4_PGR1_PLR1_TT4_4_USFGRO0_VW4_WG16_16_1_WGM8
    SolutionIndex: 10
    SolutionNameMin: Cijk_Ailk_Bljk_SB_MT64x64x16_SE_DTL0_EPS1_FL1_GRVW4_LPB4_PGR1_PLR1_TT4_4_USFGRO0_VW4_WG16_16_1_WGM1
    SolutionIndex: 11
    SolutionNameMin: Cijk_Ailk_Bljk_SB_MT64x128x8_SE_DTL0_EPS1_FL0_GRVW1_LPB4_PGR1_PLR0_TT4_8_USFGRO1_VW4_WG16_16_1_WGM1
    SolutionIndex: 12
    SolutionNameMin: Cijk_Ailk_Bljk_SB_MT64x128x8_SE_DTL0_EPS1_FL0_GRVW1_LPB4_PGR1_PLR1_TT4_8_USFGRO1_VW4_WG16_16_1_WGM8
    SolutionIndex: 13
    SolutionNameMin: Cijk_Ailk_Bljk_SB_MT128x64x8_SE_DTL0_EPS1_FL0_GRVW2_LPB0_PGR1_PLR0_TT8_4_USFGRO0_VW2_WG16_16_1_WGM1
    SolutionIndex: 14
    SolutionNameMin: Cijk_Ailk_Bljk_SB_MT128x64x8_SE_DTL0_EPS1_FL1_GRVW4_LPB0_PGR1_PLR0_TT8_4_USFGRO0_VW4_WG16_16_1_WGM8
    SolutionIndex: 15
    SolutionNameMin: Cijk_Ailk_Bljk_SB_MT128x64x8_SE_DTL0_EPS1_FL0_GRVW4_LPB4_PGR1_PLR0_TT8_4_USFGRO0_VW4_WG16_16_1_WGM1
    SolutionIndex: 16
    SolutionNameMin: Cijk_Ailk_Bljk_SB_MT128x64x8_SE_DTL0_EPS1_FL1_GRVW2_LPB2_PGR1_PLR0_TT8_4_USFGRO0_VW2_WG16_16_1_WGM1
    SolutionIndex: 17
    SolutionNameMin: Cijk_Ailk_Bljk_SB_MT128x64x8_SE_DTL0_EPS1_FL1_GRVW2_LPB2_PGR1_PLR0_TT8_4_USFGRO0_VW2_WG16_16_1_WGM8
    SolutionIndex: 18
    SolutionNameMin: Cijk_Ailk_Bljk_SB_MT128x64x16_SE_DTL0_EPS1_FL0_GRVW4_LPB4_PGR1_PLR1_TT8_4_USFGRO0_VW4_WG16_16_1_WGM8
    SolutionIndex: 19
    SolutionNameMin: Cijk_Ailk_Bljk_SB_MT128x64x8_SE_DTL0_EPS1_FL1_GRVW4_LPB4_PGR1_PLR1_TT8_4_USFGRO0_VW4_WG16_16_1_WGM1
    SolutionIndex: 20
    SolutionNameMin: Cijk_Ailk_Bljk_SB_MT64x32x16_SE_DTL0_EPS0_FL0_GRVW2_LPB2_PGR0_PLR1_TT4_4_USFGRO0_VW2_WG16_8_1_WGM1
    SolutionIndex: 21
    SolutionNameMin: Cijk_Ailk_Bljk_SB_MT128x32x8_SE_DTL1_EPS0_FL0_GRVW1_LPB2_PGR0_PLR1_TT8_4_USFGRO1_VW2_WG16_8_1_WGM8
    SolutionIndex: 22
    SolutionNameMin: Cijk_Ailk_Bljk_SB_MT128x32x16_SE_DTL0_EPS0_FL1_GRVW4_LPB4_PGR0_PLR1_TT8_4_USFGRO0_VW4_WG16_8_1_WGM8
    SolutionIndex: 23
    SolutionNameMin: Cijk_Ailk_Bljk_SB_MT64x64x8_SE_DTL0_EPS1_FL1_GRVW4_LPB0_PGR1_PLR0_TT8_4_USFGRO0_VW4_WG8_16_1_WGM1
- - - [49, 512, 64, 2048, 49, 49, 49, 2048]
    - [1, 4354.26]
  - - [49, 2048, 64, 512, 49, 49, 49, 512]
    - [3, 5932.2]
  - - [64, 192, 64, 1280, 64, 64, 64, 1280]
    - [6, 6975.01]
  - - [64, 192, 64, 2048, 64, 64, 64, 2048]
    - [9, 4794.63]
  - - [64, 320, 64, 1280, 64, 64, 64, 1280]
    - [4, 7184.49]
  - - [64, 320, 64, 2048, 64, 64, 64, 2048]
    - [8, 5096.36]
  - - [64, 384, 64, 1280, 64, 64, 64, 1280]
    - [0, 7764.83]
  - - [64, 384, 64, 2048, 64, 64, 64, 2048]
    - [9, 5291.11]
  - - [64, 448, 64, 1280, 64, 64, 64, 1280]
    - [0, 7808.54]
  - - [64, 448, 64, 2048, 64, 64, 64, 2048]
    - [2, 5388.42]
  - - [196, 256, 64, 1024, 196, 196, 196, 1024]
    - [18, 6560.93]
  - - [196, 1024, 64, 256, 196, 196, 196, 256]
    - [17, 7246.86]
  - - [289, 128, 64, 768, 289, 289, 289, 768]
    - [10, 7639.62]
  - - [289, 160, 64, 768, 289, 289, 289, 768]
    - [20, 6733.79]
  - - [289, 192, 64, 768, 289, 289, 289, 768]
    - [7, 7778.19]
  - - [784, 128, 64, 512, 784, 784, 784, 512]
    - [12, 8830.11]
  - - [784, 512, 64, 128, 784, 784, 784, 128]
    - [23, 8937.63]
  - - [1225, 32, 64, 192, 1225, 1225, 1225, 192]
    - [22, 5817.51]
  - - [1225, 48, 64, 192, 1225, 1225, 1225, 192]
    - [16, 5808.15]
  - - [1225, 48, 64, 256, 1225, 1225, 1225, 256]
    - [16, 6140.87]
  - - [1225, 48, 64, 288, 1225, 1225, 1225, 288]
    - [13, 6243.1]
  - - [1225, 64, 64, 192, 1225, 1225, 1225, 192]
    - [19, 8082.04]
  - - [1225, 64, 64, 256, 1225, 1225, 1225, 256]
    - [14, 8437.37]
  - - [1225, 64, 64, 288, 1225, 1225, 1225, 288]
    - [19, 8585.25]
  - - [3136, 64, 64, 64, 3136, 3136, 3136, 64]
    - [5, 7898.57]
  - - [3136, 64, 64, 256, 3136, 3136, 3136, 256]
    - [15, 9550.23]
  - - [3136, 256, 64, 64, 3136, 3136, 3136, 64]
    - [11, 9043.82]
  - - [5329, 80, 64, 64, 5329, 5329, 5329, 64]
    - [21, 6218.68]
- null
