Tensile/Configs/miopen/archives/bert/2020-01-19/exact/arcturus_Cijk_Alik_Bljk_SB.yaml
- {MinimumRequiredVersion: 4.15.0}
- arcturus
- gfx908
- [Device 7380, Device 7388, Device 738c, Device 7390, Device 731f]
    SolutionIndex: 0
    SolutionNameMin: Cijk_Alik_Bljk_SB_MT64x128x16_SE_EPS0_FL0_GRVW1_PGR0_PLR1_TT4_8_VW2_WGM1
    SolutionIndex: 1
    SolutionNameMin: Cijk_Alik_Bljk_SB_MT64x128x16_SE_EPS0_FL0_GRVW1_PGR0_PLR1_TT4_8_VW2_WGM8
    SolutionIndex: 2
    SolutionNameMin: Cijk_Alik_Bljk_SB_MT64x128x8_SE_EPS0_FL0_GRVW1_PGR0_PLR1_TT4_8_VW4_WGM1
    SolutionIndex: 3
    SolutionNameMin: Cijk_Alik_Bljk_SB_MT64x128x8_SE_EPS0_FL0_GRVW2_PGR0_PLR1_TT4_8_VW2_WGM1
    SolutionIndex: 4
    SolutionNameMin: Cijk_Alik_Bljk_SB_MT64x128x8_SE_EPS1_FL0_GRVW2_PGR1_PLR1_TT4_8_VW4_WGM8
    SolutionIndex: 5
    SolutionNameMin: Cijk_Alik_Bljk_SB_MT64x128x8_SE_EPS1_FL0_GRVW2_PGR1_PLR0_TT4_8_VW4_WGM8
    SolutionIndex: 6
    SolutionNameMin: Cijk_Alik_Bljk_SB_MT64x128x8_SE_EPS1_FL0_GRVW4_PGR1_PLR0_TT4_8_VW2_WGM1
    SolutionIndex: 7
    SolutionNameMin: Cijk_Alik_Bljk_SB_MT64x128x8_SE_EPS1_FL0_GRVW4_PGR1_PLR1_TT4_8_VW2_WGM1
    SolutionIndex: 8
    SolutionNameMin: Cijk_Alik_Bljk_SB_MT64x128x8_SE_EPS1_FL0_GRVW4_PGR1_PLR1_TT4_8_VW2_WGM8
    SolutionIndex: 9
    SolutionNameMin: Cijk_Alik_Bljk_SB_MT64x128x8_SE_EPS1_FL0_GRVW4_PGR1_PLR1_TT4_8_VW2_WGM1
    SolutionIndex: 10
    SolutionNameMin: Cijk_Alik_Bljk_SB_MT64x128x8_SE_EPS1_FL0_GRVW4_PGR1_PLR0_TT4_8_VW2_WGM1
    SolutionIndex: 11
    SolutionNameMin: Cijk_Alik_Bljk_SB_MT64x128x16_SE_EPS0_FL0_GRVW4_PGR0_PLR0_TT4_8_VW2_WGM1
    SolutionIndex: 12
    SolutionNameMin: Cijk_Alik_Bljk_SB_MT64x128x8_SE_EPS1_FL0_GRVW4_PGR1_PLR1_TT4_8_VW2_WGM1
    SolutionIndex: 13
    SolutionNameMin: Cijk_Alik_Bljk_SB_MT64x128x16_SE_EPS0_FL0_GRVW4_PGR0_PLR1_TT4_8_VW2_WGM1
    SolutionIndex: 14
    SolutionNameMin: Cijk_Alik_Bljk_SB_MT64x128x8_SE_EPS1_FL0_GRVW4_PGR1_PLR1_TT4_8_VW2_WGM1
    SolutionIndex: 15
    SolutionNameMin: Cijk_Alik_Bljk_SB_MT64x128x16_SE_EPS0_FL0_GRVW4_PGR0_PLR1_TT4_8_VW2_WGM1
    SolutionIndex: 16
    SolutionNameMin: Cijk_Alik_Bljk_SB_MT64x128x16_SE_EPS0_FL0_GRVW4_PGR0_PLR1_TT4_8_VW2_WGM8
    SolutionIndex: 17
    SolutionNameMin: Cijk_Alik_Bljk_SB_MT64x128x8_SE_EPS1_FL0_GRVW4_PGR1_PLR0_TT4_8_VW4_WGM8
    SolutionIndex: 18
    SolutionNameMin: Cijk_Alik_Bljk_SB_MT64x128x16_SE_EPS1_FL0_GRVW4_PGR1_PLR0_TT4_8_VW4_WGM1
    SolutionIndex: 19
    SolutionNameMin: Cijk_Alik_Bljk_SB_MT64x128x8_SE_EPS1_FL0_GRVW4_PGR1_PLR0_TT4_8_VW4_WGM1
    SolutionIndex: 20
    SolutionNameMin: Cijk_Alik_Bljk_SB_MT64x128x8_SE_EPS0_FL0_GRVW4_PGR0_PLR1_TT4_8_VW4_WGM1
    SolutionIndex: 21
    SolutionNameMin: Cijk_Alik_Bljk_SB_MT64x128x8_SE_EPS1_FL0_GRVW4_PGR1_PLR1_TT4_8_VW4_WGM1
    SolutionIndex: 22
    SolutionNameMin: Cijk_Alik_Bljk_SB_MT64x128x8_SE_EPS1_FL0_GRVW4_PGR1_PLR1_TT4_8_VW4_WGM8
    SolutionIndex: 23
    SolutionNameMin: Cijk_Alik_Bljk_SB_MT64x128x16_SE_EPS1_FL0_GRVW4_PGR1_PLR1_TT4_8_VW4_WGM1
    SolutionIndex: 24
    SolutionNameMin: Cijk_Alik_Bljk_SB_MT64x128x8_SE_EPS0_FL0_GRVW4_PGR0_PLR1_TT4_8_VW4_WGM1
    SolutionIndex: 25
    SolutionNameMin: Cijk_Alik_Bljk_SB_MT64x128x8_SE_EPS1_FL0_GRVW4_PGR1_PLR0_TT4_8_VW4_WGM1
    SolutionIndex: 26
    SolutionNameMin: Cijk_Alik_Bljk_SB_MT64x128x16_SE_EPS0_FL0_GRVW4_PGR0_PLR1_TT4_8_VW4_WGM1
    SolutionIndex: 27
    SolutionNameMin: Cijk_Alik_Bljk_SB_MT64x128x16_SE_EPS0_FL0_GRVW4_PGR0_PLR1_TT4_8_VW4_WGM1
    SolutionIndex: 28
    SolutionNameMin: Cijk_Alik_Bljk_SB_MT64x128x16_SE_EPS0_FL0_GRVW4_PGR0_PLR1_TT4_8_VW4_WGM8
    SolutionIndex: 29
    SolutionNameMin: Cijk_Alik_Bljk_SB_MT64x128x8_SE_EPS1_FL1_GRVW2_PGR1_PLR1_TT4_8_VW2_WGM8
    SolutionIndex: 30
    SolutionNameMin: Cijk_Alik_Bljk_SB_MT64x128x8_SE_EPS1_FL1_GRVW2_PGR1_PLR1_TT4_8_VW4_WGM8
    SolutionIndex: 31
    SolutionNameMin: Cijk_Alik_Bljk_SB_MT64x128x8_SE_EPS1_FL1_GRVW4_PGR1_PLR0_TT4_8_VW2_WGM8
    SolutionIndex: 32
    SolutionNameMin: Cijk_Alik_Bljk_SB_MT64x128x8_SE_EPS1_FL1_GRVW4_PGR1_PLR1_TT4_8_VW2_WGM1
    SolutionIndex: 33
    SolutionNameMin: Cijk_Alik_Bljk_SB_MT64x128x8_SE_EPS1_FL1_GRVW4_PGR1_PLR1_TT4_8_VW2_WGM8
    SolutionIndex: 34
    SolutionNameMin: Cijk_Alik_Bljk_SB_MT64x128x8_SE_EPS1_FL1_GRVW4_PGR1_PLR1_TT4_8_VW2_WGM1
    SolutionIndex: 35
    SolutionNameMin: Cijk_Alik_Bljk_SB_MT64x128x16_SE_EPS0_FL1_GRVW4_PGR0_PLR1_TT4_8_VW2_WGM1
    SolutionIndex: 36
    SolutionNameMin: Cijk_Alik_Bljk_SB_MT64x128x8_SE_EPS1_FL1_GRVW4_PGR1_PLR0_TT4_8_VW2_WGM1
    SolutionIndex: 37
    SolutionNameMin: Cijk_Alik_Bljk_SB_MT64x128x8_SE_EPS1_FL1_GRVW4_PGR1_PLR1_TT4_8_VW2_WGM1
    SolutionIndex: 38
    SolutionNameMin: Cijk_Alik_Bljk_SB_MT64x128x8_SE_EPS0_FL1_GRVW4_PGR0_PLR1_TT4_8_VW2_WGM1
    SolutionIndex: 39
    SolutionNameMin: Cijk_Alik_Bljk_SB_MT64x128x16_SE_EPS0_FL1_GRVW4_PGR0_PLR1_TT4_8_VW2_WGM1
    SolutionIndex: 40
    SolutionNameMin: Cijk_Alik_Bljk_SB_MT64x128x16_SE_EPS0_FL1_GRVW4_PGR0_PLR1_TT4_8_VW2_WGM8
    SolutionIndex: 41
    SolutionNameMin: Cijk_Alik_Bljk_SB_MT64x128x8_SE_EPS1_FL1_GRVW4_PGR1_PLR0_TT4_8_VW4_WGM8
    SolutionIndex: 42
    SolutionNameMin: Cijk_Alik_Bljk_SB_MT64x128x8_SE_EPS1_FL1_GRVW4_PGR1_PLR0_TT4_8_VW4_WGM1
    SolutionIndex: 43
    SolutionNameMin: Cijk_Alik_Bljk_SB_MT64x128x8_SE_EPS1_FL1_GRVW4_PGR1_PLR1_TT4_8_VW4_WGM1
    SolutionIndex: 44
    SolutionNameMin: Cijk_Alik_Bljk_SB_MT64x128x8_SE_EPS1_FL1_GRVW4_PGR1_PLR1_TT4_8_VW4_WGM8
    SolutionIndex: 45
    SolutionNameMin: Cijk_Alik_Bljk_SB_MT64x128x16_SE_EPS1_FL1_GRVW4_PGR1_PLR1_TT4_8_VW4_WGM1
    SolutionIndex: 46
    SolutionNameMin: Cijk_Alik_Bljk_SB_MT64x128x8_SE_EPS0_FL1_GRVW4_PGR0_PLR1_TT4_8_VW4_WGM1
    SolutionIndex: 47
    SolutionNameMin: Cijk_Alik_Bljk_SB_MT64x128x8_SE_EPS1_FL1_GRVW4_PGR1_PLR0_TT4_8_VW4_WGM1
    SolutionIndex: 48
    SolutionNameMin: Cijk_Alik_Bljk_SB_MT64x128x16_SE_EPS0_FL1_GRVW4_PGR0_PLR1_TT4_8_VW4_WGM1
    SolutionIndex: 49
    SolutionNameMin: Cijk_Alik_Bljk_SB_MT64x128x16_SE_EPS0_FL1_GRVW4_PGR0_PLR1_TT4_8_VW4_WGM8
    SolutionIndex: 50
    SolutionNameMin: Cijk_Alik_Bljk_SB_MT128x64x16_SE_EPS0_FL0_GRVW1_PGR0_PLR1_TT8_4_VW2_WGM1
    SolutionIndex: 51
    SolutionNameMin: Cijk_Alik_Bljk_SB_MT128x64x8_SE_EPS0_FL0_GRVW1_PGR0_PLR1_TT8_4_VW4_WGM1
    SolutionIndex: 52
    SolutionNameMin: Cijk_Alik_Bljk_SB_MT128x64x8_SE_EPS1_FL0_GRVW2_PGR1_PLR0_TT8_4_VW2_WGM8
    SolutionIndex: 53
    SolutionNameMin: Cijk_Alik_Bljk_SB_MT128x64x8_SE_EPS1_FL0_GRVW2_PGR1_PLR0_TT8_4_VW4_WGM8
    SolutionIndex: 54
    SolutionNameMin: Cijk_Alik_Bljk_SB_MT128x64x8_SE_EPS1_FL0_GRVW2_PGR1_PLR1_TT8_4_VW4_WGM8
    SolutionIndex: 55
    SolutionNameMin: Cijk_Alik_Bljk_SB_MT128x64x8_SE_EPS0_FL0_GRVW2_PGR0_PLR1_TT8_4_VW4_WGM8
    SolutionIndex: 56
    SolutionNameMin: Cijk_Alik_Bljk_SB_MT128x64x8_SE_EPS1_FL0_GRVW4_PGR1_PLR0_TT8_4_VW2_WGM8
    SolutionIndex: 57
    SolutionNameMin: Cijk_Alik_Bljk_SB_MT128x64x8_SE_EPS0_FL0_GRVW4_PGR0_PLR1_TT8_4_VW2_WGM1
    SolutionIndex: 58
    SolutionNameMin: Cijk_Alik_Bljk_SB_MT128x64x8_SE_EPS1_FL0_GRVW4_PGR1_PLR1_TT8_4_VW2_WGM1
    SolutionIndex: 59
    SolutionNameMin: Cijk_Alik_Bljk_SB_MT128x64x8_SE_EPS1_FL0_GRVW4_PGR1_PLR1_TT8_4_VW2_WGM8
    SolutionIndex: 60
    SolutionNameMin: Cijk_Alik_Bljk_SB_MT128x64x16_SE_EPS1_FL0_GRVW4_PGR1_PLR1_TT8_4_VW2_WGM8
    SolutionIndex: 61
    SolutionNameMin: Cijk_Alik_Bljk_SB_MT128x64x16_SE_EPS0_FL0_GRVW4_PGR0_PLR1_TT8_4_VW2_WGM1
    SolutionIndex: 62
    SolutionNameMin: Cijk_Alik_Bljk_SB_MT128x64x16_SE_EPS0_FL0_GRVW4_PGR0_PLR1_TT8_4_VW2_WGM8
    SolutionIndex: 63
    SolutionNameMin: Cijk_Alik_Bljk_SB_MT128x64x8_SE_EPS1_FL0_GRVW4_PGR1_PLR0_TT8_4_VW2_WGM8
    SolutionIndex: 64
    SolutionNameMin: Cijk_Alik_Bljk_SB_MT128x64x8_SE_EPS1_FL0_GRVW4_PGR1_PLR1_TT8_4_VW2_WGM1
    SolutionIndex: 65
    SolutionNameMin: Cijk_Alik_Bljk_SB_MT128x64x16_SE_EPS0_FL0_GRVW4_PGR0_PLR1_TT8_4_VW2_WGM1
    SolutionIndex: 66
    SolutionNameMin: Cijk_Alik_Bljk_SB_MT128x64x16_SE_EPS0_FL0_GRVW4_PGR0_PLR1_TT8_4_VW2_WGM8
    SolutionIndex: 67
    SolutionNameMin: Cijk_Alik_Bljk_SB_MT128x64x8_SE_EPS1_FL0_GRVW4_PGR1_PLR0_TT8_4_VW4_WGM8
    SolutionIndex: 68
    SolutionNameMin: Cijk_Alik_Bljk_SB_MT128x64x16_SE_EPS1_FL0_GRVW4_PGR1_PLR0_TT8_4_VW4_WGM1
    SolutionIndex: 69
    SolutionNameMin: Cijk_Alik_Bljk_SB_MT128x64x8_SE_EPS1_FL0_GRVW4_PGR1_PLR1_TT8_4_VW4_WGM8
    SolutionIndex: 70
    SolutionNameMin: Cijk_Alik_Bljk_SB_MT128x64x16_SE_EPS1_FL0_GRVW4_PGR1_PLR1_TT8_4_VW4_WGM1
    SolutionIndex: 71
    SolutionNameMin: Cijk_Alik_Bljk_SB_MT128x64x16_SE_EPS1_FL0_GRVW4_PGR1_PLR1_TT8_4_VW4_WGM8
    SolutionIndex: 72
    SolutionNameMin: Cijk_Alik_Bljk_SB_MT128x64x8_SE_EPS0_FL0_GRVW4_PGR0_PLR1_TT8_4_VW4_WGM1
    SolutionIndex: 73
    SolutionNameMin: Cijk_Alik_Bljk_SB_MT128x64x16_SE_EPS0_FL0_GRVW4_PGR0_PLR1_TT8_4_VW4_WGM1
    SolutionIndex: 74
    SolutionNameMin: Cijk_Alik_Bljk_SB_MT128x64x8_SE_EPS1_FL1_GRVW2_PGR1_PLR0_TT8_4_VW2_WGM8
    SolutionIndex: 75
    SolutionNameMin: Cijk_Alik_Bljk_SB_MT128x64x8_SE_EPS0_FL1_GRVW2_PGR0_PLR1_TT8_4_VW2_WGM1
    SolutionIndex: 76
    SolutionNameMin: Cijk_Alik_Bljk_SB_MT128x64x16_SE_EPS0_FL1_GRVW2_PGR0_PLR1_TT8_4_VW2_WGM8
    SolutionIndex: 77
    SolutionNameMin: Cijk_Alik_Bljk_SB_MT128x64x8_SE_EPS1_FL1_GRVW2_PGR1_PLR0_TT8_4_VW4_WGM8
    SolutionIndex: 78
    SolutionNameMin: Cijk_Alik_Bljk_SB_MT128x64x8_SE_EPS1_FL1_GRVW2_PGR1_PLR1_TT8_4_VW4_WGM8
    SolutionIndex: 79
    SolutionNameMin: Cijk_Alik_Bljk_SB_MT128x64x8_SE_EPS1_FL1_GRVW2_PGR1_PLR0_TT8_4_VW4_WGM8
    SolutionIndex: 80
    SolutionNameMin: Cijk_Alik_Bljk_SB_MT128x64x8_SE_EPS1_FL1_GRVW4_PGR1_PLR0_TT8_4_VW2_WGM8
    SolutionIndex: 81
    SolutionNameMin: Cijk_Alik_Bljk_SB_MT128x64x8_SE_EPS1_FL1_GRVW4_PGR1_PLR1_TT8_4_VW2_WGM1
    SolutionIndex: 82
    SolutionNameMin: Cijk_Alik_Bljk_SB_MT128x64x8_SE_EPS1_FL1_GRVW4_PGR1_PLR1_TT8_4_VW2_WGM8
    SolutionIndex: 83
    SolutionNameMin: Cijk_Alik_Bljk_SB_MT128x64x16_SE_EPS0_FL1_GRVW4_PGR0_PLR1_TT8_4_VW2_WGM1
    SolutionIndex: 84
    SolutionNameMin: Cijk_Alik_Bljk_SB_MT128x64x16_SE_EPS1_FL1_GRVW4_PGR1_PLR1_TT8_4_VW2_WGM8
    SolutionIndex: 85
    SolutionNameMin: Cijk_Alik_Bljk_SB_MT128x64x16_SE_EPS0_FL1_GRVW4_PGR0_PLR1_TT8_4_VW2_WGM1
    SolutionIndex: 86
    SolutionNameMin: Cijk_Alik_Bljk_SB_MT128x64x8_SE_EPS1_FL1_GRVW4_PGR1_PLR1_TT8_4_VW2_WGM1
    SolutionIndex: 87
    SolutionNameMin: Cijk_Alik_Bljk_SB_MT128x64x8_SE_EPS1_FL1_GRVW4_PGR1_PLR1_TT8_4_VW2_WGM8
    SolutionIndex: 88
    SolutionNameMin: Cijk_Alik_Bljk_SB_MT128x64x8_SE_EPS0_FL1_GRVW4_PGR0_PLR1_TT8_4_VW2_WGM1
    SolutionIndex: 89
    SolutionNameMin: Cijk_Alik_Bljk_SB_MT128x64x8_SE_EPS1_FL1_GRVW4_PGR1_PLR1_TT8_4_VW2_WGM1
    SolutionIndex: 90
    SolutionNameMin: Cijk_Alik_Bljk_SB_MT128x64x16_SE_EPS0_FL1_GRVW4_PGR0_PLR1_TT8_4_VW2_WGM8
    SolutionIndex: 91
    SolutionNameMin: Cijk_Alik_Bljk_SB_MT128x64x8_SE_EPS1_FL1_GRVW4_PGR1_PLR0_TT8_4_VW4_WGM8
    SolutionIndex: 92
    SolutionNameMin: Cijk_Alik_Bljk_SB_MT128x64x16_SE_EPS1_FL1_GRVW4_PGR1_PLR0_TT8_4_VW4_WGM8
    SolutionIndex: 93
    SolutionNameMin: Cijk_Alik_Bljk_SB_MT128x64x8_SE_EPS1_FL1_GRVW4_PGR1_PLR1_TT8_4_VW4_WGM8
    SolutionIndex: 94
    SolutionNameMin: Cijk_Alik_Bljk_SB_MT128x64x16_SE_EPS1_FL1_GRVW4_PGR1_PLR1_TT8_4_VW4_WGM1
    SolutionIndex: 95
    SolutionNameMin: Cijk_Alik_Bljk_SB_MT128x64x16_SE_EPS1_FL1_GRVW4_PGR1_PLR1_TT8_4_VW4_WGM8
    SolutionIndex: 96
    SolutionNameMin: Cijk_Alik_Bljk_SB_MT128x64x16_SE_EPS0_FL1_GRVW4_PGR0_PLR1_TT8_4_VW4_WGM1
    SolutionIndex: 97
    SolutionNameMin: Cijk_Alik_Bljk_SB_MT128x64x8_SE_EPS1_FL1_GRVW4_PGR1_PLR0_TT8_4_VW4_WGM1
    SolutionIndex: 98
    SolutionNameMin: Cijk_Alik_Bljk_SB_MT128x64x16_SE_EPS0_FL1_GRVW4_PGR0_PLR1_TT8_4_VW4_WGM1
    SolutionIndex: 99
    SolutionNameMin: Cijk_Alik_Bljk_SB_MT128x128x8_SE_EPS1_FL0_GRVW2_PGR1_PLR1_TT8_8_VW4_WGM8
    SolutionIndex: 100
    SolutionNameMin: Cijk_Alik_Bljk_SB_MT128x128x16_SE_EPS1_FL0_GRVW2_PGR1_PLR1_TT8_8_VW4_WGM1
    SolutionIndex: 101
    SolutionNameMin: Cijk_Alik_Bljk_SB_MT128x128x16_SE_EPS1_FL0_GRVW4_PGR1_PLR1_TT8_8_VW2_WGM1
    SolutionIndex: 102
    SolutionNameMin: Cijk_Alik_Bljk_SB_MT128x128x8_SE_EPS1_FL0_GRVW4_PGR1_PLR1_TT8_8_VW4_WGM8
    SolutionIndex: 103
    SolutionNameMin: Cijk_Alik_Bljk_SB_MT128x128x16_SE_EPS1_FL0_GRVW4_PGR1_PLR1_TT8_8_VW4_WGM1
    SolutionIndex: 104
    SolutionNameMin: Cijk_Alik_Bljk_SB_MT128x128x16_SE_EPS1_FL0_GRVW4_PGR1_PLR1_TT8_8_VW4_WGM8
    SolutionIndex: 105
    SolutionNameMin: Cijk_Alik_Bljk_SB_MT128x128x32_SE_EPS1_FL0_GRVW4_PGR1_PLR1_TT8_8_VW4_WGM8
    SolutionIndex: 106
    SolutionNameMin: Cijk_Alik_Bljk_SB_MT128x128x16_SE_EPS1_FL1_GRVW2_PGR1_PLR1_TT8_8_VW4_WGM1
    SolutionIndex: 107
    SolutionNameMin: Cijk_Alik_Bljk_SB_MT128x128x8_SE_EPS1_FL1_GRVW4_PGR1_PLR1_TT8_8_VW2_WGM8
    SolutionIndex: 108
    SolutionNameMin: Cijk_Alik_Bljk_SB_MT128x128x8_SE_EPS1_FL1_GRVW4_PGR1_PLR0_TT8_8_VW4_WGM8
    SolutionIndex: 109
    SolutionNameMin: Cijk_Alik_Bljk_SB_MT128x128x8_SE_EPS1_FL1_GRVW4_PGR1_PLR1_TT8_8_VW4_WGM8
    SolutionIndex: 110
    SolutionNameMin: Cijk_Alik_Bljk_SB_MT128x128x16_SE_EPS1_FL1_GRVW4_PGR1_PLR1_TT8_8_VW4_WGM1
    SolutionIndex: 111
    SolutionNameMin: Cijk_Alik_Bljk_SB_MT128x128x16_SE_EPS1_FL1_GRVW4_PGR1_PLR1_TT8_8_VW4_WGM8
    SolutionIndex: 112
    SolutionNameMin: Cijk_Alik_Bljk_SB_MT128x128x32_SE_EPS1_FL1_GRVW4_PGR1_PLR1_TT8_8_VW4_WGM8
- - - [7, 7, 736, 64, 7, 7, 64, 64]
    - [48, 66.9401]
  - - [8, 8, 264, 64, 8, 8, 64, 64]
    - [24, 63.4592]
  - - [9, 9, 416, 64, 9, 9, 64, 64]
    - [80, 102.109]
  - - [10, 10, 448, 64, 10, 10, 64, 64]
    - [49, 134.232]
  - - [11, 11, 568, 64, 11, 11, 64, 64]
    - [43, 167.629]
  - - [12, 12, 480, 64, 12, 12, 64, 64]
    - [36, 208.664]
  - - [12, 12, 2520, 64, 12, 12, 64, 64]
    - [47, 265.119]
  - - [13, 13, 576, 64, 13, 13, 64, 64]
    - [21, 237.424]
  - - [13, 13, 2336, 64, 13, 13, 64, 64]
    - [47, 303.39]
  - - [14, 14, 704, 64, 14, 14, 64, 64]
    - [19, 297.54]
  - - [14, 14, 2184, 64, 14, 14, 64, 64]
    - [25, 346.611]
  - - [15, 15, 688, 64, 15, 15, 64, 64]
    - [96, 332.903]
  - - [15, 15, 2048, 64, 15, 15, 64, 64]
    - [42, 395.536]
  - - [16, 16, 712, 64, 16, 16, 64, 64]
    - [79, 391.983]
  - - [16, 16, 1920, 64, 16, 16, 64, 64]
    - [48, 458.828]
  - - [17, 17, 688, 64, 17, 17, 64, 64]
    - [5, 426.449]
  - - [17, 17, 1816, 64, 17, 17, 64, 64]
    - [73, 498.645]
  - - [18, 18, 648, 64, 18, 18, 64, 64]
    - [49, 455.18]
  - - [18, 18, 1720, 64, 18, 18, 64, 64]
    - [49, 555.198]
  - - [19, 19, 680, 64, 19, 19, 64, 64]
    - [5, 527.914]
  - - [19, 19, 1632, 64, 19, 19, 64, 64]
    - [48, 622.618]
  - - [21, 21, 1472, 64, 21, 21, 64, 64]
    - [97, 730.41]
  - - [21, 21, 1488, 64, 21, 21, 64, 64]
    - [27, 740.432]
  - - [23, 23, 64, 64, 23, 23, 64, 64]
    - [2, 171.423]
  - - [23, 23, 1360, 64, 23, 23, 64, 64]
    - [27, 866.795]
  - - [25, 25, 176, 64, 25, 25, 64, 64]
    - [72, 478.261]
  - - [25, 25, 1256, 64, 25, 25, 64, 64]
    - [48, 1011.27]
  - - [26, 26, 56, 64, 26, 26, 64, 64]
    - [46, 194.133]
  - - [26, 27, 56, 64, 26, 26, 64, 64]
    - [55, 200.316]
  - - [27, 27, 56, 64, 27, 27, 64, 64]
    - [20, 209.354]
  - - [27, 27, 1168, 64, 27, 27, 64, 64]
    - [28, 1182.6]
  - - [29, 29, 136, 64, 29, 29, 64, 64]
    - [51, 505.529]
  - - [29, 29, 1088, 64, 29, 29, 64, 64]
    - [26, 1284.22]
  - - [32, 32, 624, 64, 32, 32, 64, 64]
    - [37, 1341.68]
  - - [32, 32, 992, 64, 32, 32, 64, 64]
    - [39, 1521.81]
  - - [35, 35, 384, 64, 35, 35, 64, 64]
    - [10, 1383.53]
  - - [35, 35, 904, 64, 35, 35, 64, 64]
    - [16, 1815.41]
  - - [38, 38, 320, 64, 38, 38, 64, 64]
    - [9, 1672.69]
  - - [38, 38, 840, 64, 38, 38, 64, 64]
    - [6, 2142.09]
  - - [41, 41, 312, 64, 41, 41, 64, 64]
    - [34, 1873.11]
  - - [41, 41, 776, 64, 41, 41, 64, 64]
    - [31, 2313.89]
  - - [45, 45, 392, 64, 45, 45, 64, 64]
    - [76, 2251.91]
  - - [45, 45, 712, 64, 45, 45, 64, 64]
    - [86, 2827.06]
  - - [49, 49, 160, 64, 49, 49, 64, 64]
    - [64, 1576.04]
  - - [49, 49, 648, 64, 49, 49, 64, 64]
    - [14, 3006.47]
  - - [54, 54, 200, 64, 54, 54, 64, 64]
    - [58, 2287.06]
  - - [54, 54, 592, 64, 54, 54, 64, 64]
    - [12, 3514.04]
  - - [59, 59, 512, 64, 59, 59, 64, 64]
    - [87, 3582.46]
  - - [59, 59, 544, 64, 59, 59, 64, 64]
    - [34, 3740.57]
  - - [64, 64, 496, 64, 64, 64, 64, 64]
    - [9, 4032.98]
  - - [64, 65, 496, 64, 64, 64, 64, 64]
    - [35, 4085.86]
  - - [65, 65, 472, 64, 65, 65, 64, 64]
    - [65, 2905.94]
  - - [65, 65, 496, 64, 65, 65, 64, 64]
    - [62, 2880.55]
  - - [70, 70, 216, 64, 70, 70, 64, 64]
    - [66, 2713.85]
  - - [70, 71, 216, 64, 70, 70, 64, 64]
    - [66, 2735.08]
  - - [71, 71, 216, 64, 71, 71, 64, 64]
    - [40, 2756.6]
  - - [71, 71, 448, 64, 71, 71, 64, 64]
    - [11, 3321.13]
  - - [77, 77, 248, 64, 77, 77, 64, 64]
    - [0, 2978.01]
  - - [77, 77, 408, 64, 77, 77, 64, 64]
    - [11, 3802.01]
  - - [77, 78, 248, 64, 77, 77, 64, 64]
    - [83, 3024.34]
  - - [77, 78, 408, 64, 77, 77, 64, 64]
    - [15, 3828.83]
  - - [78, 78, 248, 64, 78, 78, 64, 64]
    - [0, 3055.86]
  - - [78, 78, 408, 64, 78, 78, 64, 64]
    - [90, 3916.8]
  - - [80, 80, 152, 64, 80, 80, 64, 64]
    - [7, 3229.21]
  - - [80, 84, 152, 64, 80, 80, 64, 64]
    - [81, 3390.67]
  - - [84, 84, 152, 64, 84, 84, 64, 64]
    - [32, 3338.56]
  - - [85, 85, 376, 64, 85, 85, 64, 64]
    - [61, 4211.78]
  - - [91, 91, 40, 64, 91, 91, 64, 64]
    - [13, 1522.94]
  - - [91, 93, 40, 64, 91, 91, 64, 64]
    - [0, 1556.41]
  - - [93, 93, 40, 64, 93, 93, 64, 64]
    - [88, 1581.53]
  - - [93, 93, 344, 64, 93, 93, 64, 64]
    - [63, 4798.8]
  - - [102, 102, 56, 64, 102, 102, 64, 64]
    - [13, 2427.6]
  - - [102, 102, 312, 64, 102, 102, 64, 64]
    - [6, 5225.03]
  - - [103, 103, 16, 64, 103, 103, 64, 64]
    - [57, 803.522]
  - - [103, 104, 16, 64, 103, 103, 64, 64]
    - [75, 806.551]
  - - [104, 104, 16, 64, 104, 104, 64, 64]
    - [50, 824.076]
  - - [112, 112, 16, 64, 112, 112, 64, 64]
    - [1, 938.966]
  - - [112, 112, 288, 64, 112, 112, 64, 64]
    - [86, 6705.66]
  - - [112, 123, 16, 64, 112, 112, 64, 64]
    - [3, 1031.19]
  - - [119, 119, 32, 64, 119, 119, 64, 64]
    - [38, 2083.46]
  - - [119, 135, 32, 64, 119, 119, 64, 64]
    - [85, 2259.69]
  - - [122, 122, 264, 64, 122, 122, 64, 64]
    - [89, 6603.99]
  - - [123, 122, 264, 64, 123, 123, 64, 64]
    - [34, 6644.17]
  - - [123, 123, 16, 64, 123, 123, 64, 64]
    - [88, 1132.46]
  - - [123, 123, 264, 64, 123, 123, 64, 64]
    - [82, 6670.66]
  - - [134, 134, 240, 64, 134, 134, 64, 64]
    - [15, 5047.66]
  - - [135, 134, 240, 64, 135, 135, 64, 64]
    - [98, 5070.48]
  - - [135, 135, 32, 64, 135, 135, 64, 64]
    - [4, 2494.97]
  - - [135, 135, 240, 64, 135, 135, 64, 64]
    - [0, 5100.87]
  - - [512, 2790, 1, 2048, 512, 512, 2048, 2048]
    - [95, 9679.55]
  - - [512, 2864, 1, 2048, 512, 512, 2048, 2048]
    - [23, 9690.05]
  - - [512, 3092, 1, 2048, 512, 512, 2048, 2048]
    - [45, 10039.1]
  - - [512, 3113, 1, 2048, 512, 512, 2048, 2048]
    - [45, 10374.5]
  - - [512, 3137, 1, 2048, 512, 512, 2048, 2048]
    - [94, 10110.0]
  - - [512, 3165, 1, 2048, 512, 512, 2048, 2048]
    - [94, 10192.7]
  - - [512, 3166, 1, 2048, 512, 512, 2048, 2048]
    - [71, 10178.5]
  - - [512, 3194, 1, 2048, 512, 512, 2048, 2048]
    - [95, 10228.3]
  - - [512, 3219, 1, 2048, 512, 512, 2048, 2048]
    - [45, 10184.0]
  - - [512, 3222, 1, 2048, 512, 512, 2048, 2048]
    - [111, 10285.3]
  - - [512, 3234, 1, 2048, 512, 512, 2048, 2048]
    - [94, 10301.1]
  - - [512, 3237, 1, 2048, 512, 512, 2048, 2048]
    - [95, 10399.1]
  - - [512, 3242, 1, 2048, 512, 512, 2048, 2048]
    - [106, 10314.0]
  - - [512, 3246, 1, 2048, 512, 512, 2048, 2048]
    - [23, 10367.0]
  - - [512, 3249, 1, 2048, 512, 512, 2048, 2048]
    - [23, 10283.9]
  - - [512, 3251, 1, 2048, 512, 512, 2048, 2048]
    - [70, 10277.8]
  - - [512, 3257, 1, 2048, 512, 512, 2048, 2048]
    - [70, 10389.5]
  - - [512, 3262, 1, 2048, 512, 512, 2048, 2048]
    - [23, 10307.6]
  - - [512, 3268, 1, 2048, 512, 512, 2048, 2048]
    - [71, 10341.5]
  - - [512, 3282, 1, 2048, 512, 512, 2048, 2048]
    - [95, 10291.4]
  - - [512, 3286, 1, 2048, 512, 512, 2048, 2048]
    - [71, 10365.9]
  - - [512, 3287, 1, 2048, 512, 512, 2048, 2048]
    - [71, 10371.6]
  - - [512, 3293, 1, 2048, 512, 512, 2048, 2048]
    - [45, 10358.1]
  - - [512, 3297, 1, 2048, 512, 512, 2048, 2048]
    - [95, 10223.5]
  - - [512, 3307, 1, 2048, 512, 512, 2048, 2048]
    - [45, 10335.2]
  - - [512, 3314, 1, 2048, 512, 512, 2048, 2048]
    - [95, 10220.6]
  - - [512, 3315, 1, 2048, 512, 512, 2048, 2048]
    - [71, 10492.8]
  - - [512, 3319, 1, 2048, 512, 512, 2048, 2048]
    - [70, 10485.2]
  - - [512, 3322, 1, 2048, 512, 512, 2048, 2048]
    - [18, 10267.0]
  - - [512, 3323, 1, 2048, 512, 512, 2048, 2048]
    - [95, 10422.5]
  - - [512, 3324, 1, 2048, 512, 512, 2048, 2048]
    - [71, 10485.8]
  - - [512, 3325, 1, 2048, 512, 512, 2048, 2048]
    - [71, 10471.3]
  - - [512, 3327, 1, 2048, 512, 512, 2048, 2048]
    - [110, 10711.8]
  - - [512, 3329, 1, 2048, 512, 512, 2048, 2048]
    - [104, 10645.1]
  - - [512, 3332, 1, 2048, 512, 512, 2048, 2048]
    - [100, 10423.2]
  - - [512, 3336, 1, 2048, 512, 512, 2048, 2048]
    - [100, 10538.9]
  - - [512, 3339, 1, 2048, 512, 512, 2048, 2048]
    - [104, 10737.3]
  - - [512, 3342, 1, 2048, 512, 512, 2048, 2048]
    - [103, 10573.1]
  - - [512, 3344, 1, 2048, 512, 512, 2048, 2048]
    - [100, 10561.6]
  - - [512, 3358, 1, 2048, 512, 512, 2048, 2048]
    - [105, 10479.6]
  - - [512, 3360, 1, 2048, 512, 512, 2048, 2048]
    - [104, 10523.4]
  - - [512, 3364, 1, 2048, 512, 512, 2048, 2048]
    - [103, 10421.4]
  - - [512, 3365, 1, 2048, 512, 512, 2048, 2048]
    - [112, 10426.9]
  - - [512, 3369, 1, 2048, 512, 512, 2048, 2048]
    - [110, 10404.9]
  - - [512, 3371, 1, 2048, 512, 512, 2048, 2048]
    - [103, 10555.3]
  - - [512, 3374, 1, 2048, 512, 512, 2048, 2048]
    - [100, 10507.0]
  - - [512, 3376, 1, 2048, 512, 512, 2048, 2048]
    - [105, 10382.5]
  - - [512, 3377, 1, 2048, 512, 512, 2048, 2048]
    - [95, 10546.4]
  - - [512, 3378, 1, 2048, 512, 512, 2048, 2048]
    - [92, 10282.5]
  - - [512, 3381, 1, 2048, 512, 512, 2048, 2048]
    - [100, 10660.5]
  - - [512, 3382, 1, 2048, 512, 512, 2048, 2048]
    - [103, 10856.9]
  - - [512, 3383, 1, 2048, 512, 512, 2048, 2048]
    - [60, 10421.1]
  - - [512, 3384, 1, 2048, 512, 512, 2048, 2048]
    - [100, 10580.9]
  - - [512, 3385, 1, 2048, 512, 512, 2048, 2048]
    - [105, 10571.4]
  - - [512, 3386, 1, 2048, 512, 512, 2048, 2048]
    - [71, 10643.0]
  - - [512, 3388, 1, 2048, 512, 512, 2048, 2048]
    - [112, 10543.1]
  - - [512, 3390, 1, 2048, 512, 512, 2048, 2048]
    - [94, 10625.0]
  - - [512, 3391, 1, 2048, 512, 512, 2048, 2048]
    - [110, 10694.6]
  - - [512, 3396, 1, 2048, 512, 512, 2048, 2048]
    - [45, 10550.4]
  - - [512, 3399, 1, 2048, 512, 512, 2048, 2048]
    - [84, 10482.7]
  - - [512, 3402, 1, 2048, 512, 512, 2048, 2048]
    - [103, 10757.8]
  - - [512, 3410, 1, 2048, 512, 512, 2048, 2048]
    - [105, 10447.8]
  - - [512, 3412, 1, 2048, 512, 512, 2048, 2048]
    - [23, 10627.8]
  - - [512, 3414, 1, 2048, 512, 512, 2048, 2048]
    - [70, 10384.8]
  - - [512, 3415, 1, 2048, 512, 512, 2048, 2048]
    - [110, 10542.0]
  - - [512, 3418, 1, 2048, 512, 512, 2048, 2048]
    - [95, 10460.1]
  - - [512, 3420, 1, 2048, 512, 512, 2048, 2048]
    - [112, 10530.1]
  - - [512, 3422, 1, 2048, 512, 512, 2048, 2048]
    - [103, 10558.6]
  - - [512, 3425, 1, 2048, 512, 512, 2048, 2048]
    - [112, 10491.3]
  - - [512, 3426, 1, 2048, 512, 512, 2048, 2048]
    - [60, 10487.0]
  - - [512, 3427, 1, 2048, 512, 512, 2048, 2048]
    - [105, 10383.4]
  - - [512, 3428, 1, 2048, 512, 512, 2048, 2048]
    - [105, 10322.0]
  - - [512, 3430, 1, 2048, 512, 512, 2048, 2048]
    - [71, 10356.6]
  - - [512, 3431, 1, 2048, 512, 512, 2048, 2048]
    - [71, 10352.4]
  - - [512, 3432, 1, 2048, 512, 512, 2048, 2048]
    - [71, 10549.7]
  - - [512, 3438, 1, 2048, 512, 512, 2048, 2048]
    - [23, 10548.4]
  - - [512, 3439, 1, 2048, 512, 512, 2048, 2048]
    - [112, 10616.1]
  - - [512, 3440, 1, 2048, 512, 512, 2048, 2048]
    - [70, 10677.0]
  - - [512, 3443, 1, 2048, 512, 512, 2048, 2048]
    - [23, 10556.3]
  - - [512, 3445, 1, 2048, 512, 512, 2048, 2048]
    - [100, 10530.4]
  - - [512, 3447, 1, 2048, 512, 512, 2048, 2048]
    - [23, 10534.1]
  - - [512, 3448, 1, 2048, 512, 512, 2048, 2048]
    - [71, 10542.1]
  - - [512, 3450, 1, 2048, 512, 512, 2048, 2048]
    - [110, 10800.1]
  - - [512, 3451, 1, 2048, 512, 512, 2048, 2048]
    - [68, 10668.2]
  - - [512, 3452, 1, 2048, 512, 512, 2048, 2048]
    - [100, 10643.7]
  - - [512, 3453, 1, 2048, 512, 512, 2048, 2048]
    - [106, 10435.6]
  - - [512, 3455, 1, 2048, 512, 512, 2048, 2048]
    - [110, 10741.4]
  - - [512, 3456, 1, 2048, 512, 512, 2048, 2048]
    - [23, 10554.2]
  - - [512, 3457, 1, 2048, 512, 512, 2048, 2048]
    - [104, 10727.2]
  - - [512, 3458, 1, 2048, 512, 512, 2048, 2048]
    - [106, 10817.4]
  - - [512, 3459, 1, 2048, 512, 512, 2048, 2048]
    - [111, 10580.6]
  - - [512, 3460, 1, 2048, 512, 512, 2048, 2048]
    - [104, 10767.1]
  - - [512, 3461, 1, 2048, 512, 512, 2048, 2048]
    - [104, 10648.9]
  - - [512, 3462, 1, 2048, 512, 512, 2048, 2048]
    - [106, 10669.5]
  - - [512, 3466, 1, 2048, 512, 512, 2048, 2048]
    - [111, 10577.4]
  - - [512, 3467, 1, 2048, 512, 512, 2048, 2048]
    - [106, 10695.0]
  - - [512, 3468, 1, 2048, 512, 512, 2048, 2048]
    - [104, 10838.3]
  - - [512, 3470, 1, 2048, 512, 512, 2048, 2048]
    - [106, 10701.7]
  - - [512, 3471, 1, 2048, 512, 512, 2048, 2048]
    - [111, 10757.9]
  - - [512, 3472, 1, 2048, 512, 512, 2048, 2048]
    - [110, 10680.2]
  - - [512, 3475, 1, 2048, 512, 512, 2048, 2048]
    - [111, 10714.6]
  - - [512, 3476, 1, 2048, 512, 512, 2048, 2048]
    - [104, 10778.5]
  - - [512, 3477, 1, 2048, 512, 512, 2048, 2048]
    - [104, 10786.7]
  - - [512, 3478, 1, 2048, 512, 512, 2048, 2048]
    - [95, 10621.4]
  - - [512, 3479, 1, 2048, 512, 512, 2048, 2048]
    - [106, 10787.8]
  - - [512, 3480, 1, 2048, 512, 512, 2048, 2048]
    - [111, 10901.8]
  - - [512, 3481, 1, 2048, 512, 512, 2048, 2048]
    - [106, 10748.3]
  - - [512, 3483, 1, 2048, 512, 512, 2048, 2048]
    - [104, 10764.6]
  - - [512, 3484, 1, 2048, 512, 512, 2048, 2048]
    - [110, 11054.4]
  - - [512, 3487, 1, 2048, 512, 512, 2048, 2048]
    - [103, 10905.5]
  - - [512, 3489, 1, 2048, 512, 512, 2048, 2048]
    - [104, 10854.8]
  - - [512, 3490, 1, 2048, 512, 512, 2048, 2048]
    - [106, 10750.7]
  - - [512, 3491, 1, 2048, 512, 512, 2048, 2048]
    - [101, 10601.8]
  - - [512, 3493, 1, 2048, 512, 512, 2048, 2048]
    - [111, 10810.8]
  - - [512, 3494, 1, 2048, 512, 512, 2048, 2048]
    - [106, 10635.6]
  - - [512, 3495, 1, 2048, 512, 512, 2048, 2048]
    - [104, 10574.8]
  - - [512, 3497, 1, 2048, 512, 512, 2048, 2048]
    - [106, 10681.9]
  - - [512, 3498, 1, 2048, 512, 512, 2048, 2048]
    - [103, 10929.5]
  - - [512, 3499, 1, 2048, 512, 512, 2048, 2048]
    - [101, 10533.4]
  - - [512, 3501, 1, 2048, 512, 512, 2048, 2048]
    - [94, 10701.6]
  - - [512, 3503, 1, 2048, 512, 512, 2048, 2048]
    - [103, 10857.1]
  - - [512, 3507, 1, 2048, 512, 512, 2048, 2048]
    - [103, 10745.0]
  - - [512, 3508, 1, 2048, 512, 512, 2048, 2048]
    - [106, 10673.2]
  - - [512, 3509, 1, 2048, 512, 512, 2048, 2048]
    - [110, 10873.1]
  - - [512, 3511, 1, 2048, 512, 512, 2048, 2048]
    - [103, 10687.3]
  - - [512, 3514, 1, 2048, 512, 512, 2048, 2048]
    - [112, 10520.5]
  - - [512, 3515, 1, 2048, 512, 512, 2048, 2048]
    - [110, 10797.3]
  - - [512, 3517, 1, 2048, 512, 512, 2048, 2048]
    - [106, 10905.7]
  - - [512, 3518, 1, 2048, 512, 512, 2048, 2048]
    - [106, 10950.2]
  - - [512, 3519, 1, 2048, 512, 512, 2048, 2048]
    - [110, 10976.8]
  - - [512, 3520, 1, 2048, 512, 512, 2048, 2048]
    - [110, 10927.9]
  - - [512, 3523, 1, 2048, 512, 512, 2048, 2048]
    - [112, 10644.7]
  - - [512, 3528, 1, 2048, 512, 512, 2048, 2048]
    - [103, 10704.3]
  - - [512, 3529, 1, 2048, 512, 512, 2048, 2048]
    - [110, 10997.5]
  - - [512, 3530, 1, 2048, 512, 512, 2048, 2048]
    - [112, 10619.4]
  - - [512, 3532, 1, 2048, 512, 512, 2048, 2048]
    - [110, 10944.4]
  - - [512, 3533, 1, 2048, 512, 512, 2048, 2048]
    - [106, 10618.7]
  - - [512, 3534, 1, 2048, 512, 512, 2048, 2048]
    - [106, 10767.3]
  - - [512, 3538, 1, 2048, 512, 512, 2048, 2048]
    - [105, 10546.6]
  - - [512, 3539, 1, 2048, 512, 512, 2048, 2048]
    - [23, 10883.8]
  - - [512, 3541, 1, 2048, 512, 512, 2048, 2048]
    - [23, 10741.2]
  - - [512, 3547, 1, 2048, 512, 512, 2048, 2048]
    - [45, 10817.0]
  - - [512, 3548, 1, 2048, 512, 512, 2048, 2048]
    - [105, 10777.4]
  - - [512, 3552, 1, 2048, 512, 512, 2048, 2048]
    - [103, 10890.5]
  - - [512, 3564, 1, 2048, 512, 512, 2048, 2048]
    - [23, 10831.0]
  - - [512, 3575, 1, 2048, 512, 512, 2048, 2048]
    - [45, 10769.6]
  - - [512, 3598, 1, 2048, 512, 512, 2048, 2048]
    - [111, 11188.6]
  - - [512, 3599, 1, 2048, 512, 512, 2048, 2048]
    - [104, 11199.7]
  - - [512, 3608, 1, 2048, 512, 512, 2048, 2048]
    - [103, 11169.3]
  - - [512, 3780, 1, 512, 512, 512, 512, 512]
    - [30, 14606.5]
  - - [512, 3780, 1, 2048, 512, 512, 2048, 2048]
    - [110, 11471.5]
  - - [512, 3796, 1, 512, 512, 512, 512, 512]
    - [29, 14330.3]
  - - [512, 3796, 1, 2048, 512, 512, 2048, 2048]
    - [110, 11290.0]
  - - [512, 3822, 1, 512, 512, 512, 512, 512]
    - [22, 14579.7]
  - - [512, 3822, 1, 2048, 512, 512, 2048, 2048]
    - [106, 11282.9]
  - - [512, 3840, 1, 512, 512, 512, 512, 512]
    - [44, 14546.7]
  - - [512, 3840, 1, 2048, 512, 512, 2048, 2048]
    - [105, 11389.9]
  - - [512, 3859, 1, 512, 512, 512, 512, 512]
    - [30, 11063.2]
  - - [512, 3859, 1, 2048, 512, 512, 2048, 2048]
    - [71, 10006.1]
  - - [512, 3870, 1, 512, 512, 512, 512, 512]
    - [44, 11202.5]
  - - [512, 3870, 1, 2048, 512, 512, 2048, 2048]
    - [71, 10153.1]
  - - [512, 3876, 1, 512, 512, 512, 512, 512]
    - [30, 11073.1]
  - - [512, 3876, 1, 2048, 512, 512, 2048, 2048]
    - [95, 10104.2]
  - - [512, 3906, 1, 512, 512, 512, 512, 512]
    - [4, 11110.5]
  - - [512, 3906, 1, 2048, 512, 512, 2048, 2048]
    - [95, 10046.5]
  - - [512, 3910, 1, 512, 512, 512, 512, 512]
    - [44, 11131.5]
  - - [512, 3910, 1, 2048, 512, 512, 2048, 2048]
    - [95, 10098.4]
  - - [512, 3925, 1, 512, 512, 512, 512, 512]
    - [22, 11183.9]
  - - [512, 3925, 1, 2048, 512, 512, 2048, 2048]
    - [71, 10219.7]
  - - [512, 3927, 1, 512, 512, 512, 512, 512]
    - [22, 11287.8]
  - - [512, 3942, 1, 512, 512, 512, 512, 512]
    - [33, 11154.8]
  - - [512, 3942, 1, 2048, 512, 512, 2048, 2048]
    - [71, 10175.0]
  - - [512, 3944, 1, 512, 512, 512, 512, 512]
    - [8, 11228.3]
  - - [512, 3944, 1, 2048, 512, 512, 2048, 2048]
    - [71, 10178.2]
  - - [512, 3955, 1, 512, 512, 512, 512, 512]
    - [44, 11220.6]
  - - [512, 3955, 1, 2048, 512, 512, 2048, 2048]
    - [71, 10120.9]
  - - [512, 3968, 1, 512, 512, 512, 512, 512]
    - [22, 11395.6]
  - - [512, 3968, 1, 2048, 512, 512, 2048, 2048]
    - [60, 9990.32]
  - - [512, 3969, 1, 512, 512, 512, 512, 512]
    - [22, 11540.0]
  - - [512, 3969, 1, 2048, 512, 512, 2048, 2048]
    - [95, 10196.5]
  - - [512, 3976, 1, 512, 512, 512, 512, 512]
    - [33, 11418.6]
  - - [512, 3976, 1, 2048, 512, 512, 2048, 2048]
    - [95, 10111.5]
  - - [512, 3977, 1, 512, 512, 512, 512, 512]
    - [30, 11491.9]
  - - [512, 3977, 1, 2048, 512, 512, 2048, 2048]
    - [84, 9839.11]
  - - [512, 3978, 1, 512, 512, 512, 512, 512]
    - [22, 11566.3]
  - - [512, 3978, 1, 2048, 512, 512, 2048, 2048]
    - [71, 10211.7]
  - - [512, 3990, 1, 512, 512, 512, 512, 512]
    - [33, 11418.8]
  - - [512, 3990, 1, 2048, 512, 512, 2048, 2048]
    - [71, 10041.9]
  - - [512, 3995, 1, 512, 512, 512, 512, 512]
    - [30, 11513.5]
  - - [512, 3995, 1, 2048, 512, 512, 2048, 2048]
    - [95, 10245.3]
  - - [512, 3996, 1, 512, 512, 512, 512, 512]
    - [4, 11506.3]
  - - [512, 3996, 1, 2048, 512, 512, 2048, 2048]
    - [71, 10192.0]
  - - [512, 3999, 1, 512, 512, 512, 512, 512]
    - [22, 11484.7]
  - - [512, 3999, 1, 2048, 512, 512, 2048, 2048]
    - [71, 10126.7]
  - - [512, 4005, 1, 512, 512, 512, 512, 512]
    - [33, 11461.7]
  - - [512, 4005, 1, 2048, 512, 512, 2048, 2048]
    - [95, 10209.0]
  - - [512, 4012, 1, 512, 512, 512, 512, 512]
    - [4, 11634.2]
  - - [512, 4012, 1, 2048, 512, 512, 2048, 2048]
    - [71, 10008.8]
  - - [512, 4020, 1, 512, 512, 512, 512, 512]
    - [44, 11678.0]
  - - [512, 4020, 1, 2048, 512, 512, 2048, 2048]
    - [71, 10229.3]
  - - [512, 4026, 1, 512, 512, 512, 512, 512]
    - [22, 11757.9]
  - - [512, 4026, 1, 2048, 512, 512, 2048, 2048]
    - [71, 10087.9]
  - - [512, 4030, 1, 512, 512, 512, 512, 512]
    - [22, 11748.7]
  - - [512, 4030, 1, 2048, 512, 512, 2048, 2048]
    - [71, 10140.6]
  - - [512, 4032, 1, 512, 512, 512, 512, 512]
    - [4, 11549.1]
  - - [512, 4032, 1, 2048, 512, 512, 2048, 2048]
    - [95, 10342.2]
  - - [512, 4050, 1, 512, 512, 512, 512, 512]
    - [44, 11661.8]
  - - [512, 4059, 1, 512, 512, 512, 512, 512]
    - [30, 11697.9]
  - - [2048, 2790, 1, 512, 2048, 2048, 512, 512]
    - [71, 15634.6]
  - - [2048, 2864, 1, 512, 2048, 2048, 512, 512]
    - [95, 15947.0]
  - - [2048, 3092, 1, 512, 2048, 2048, 512, 512]
    - [53, 15678.0]
  - - [2048, 3113, 1, 512, 2048, 2048, 512, 512]
    - [77, 15747.9]
  - - [2048, 3137, 1, 512, 2048, 2048, 512, 512]
    - [52, 15598.4]
  - - [2048, 3165, 1, 512, 2048, 2048, 512, 512]
    - [54, 15707.9]
  - - [2048, 3166, 1, 512, 2048, 2048, 512, 512]
    - [77, 15772.6]
  - - [2048, 3194, 1, 512, 2048, 2048, 512, 512]
    - [78, 15792.0]
  - - [2048, 3219, 1, 512, 2048, 2048, 512, 512]
    - [54, 15523.3]
  - - [2048, 3222, 1, 512, 2048, 2048, 512, 512]
    - [74, 15566.4]
  - - [2048, 3234, 1, 512, 2048, 2048, 512, 512]
    - [53, 15653.2]
  - - [2048, 3237, 1, 512, 2048, 2048, 512, 512]
    - [78, 15661.9]
  - - [2048, 3242, 1, 512, 2048, 2048, 512, 512]
    - [93, 15744.3]
  - - [2048, 3246, 1, 512, 2048, 2048, 512, 512]
    - [80, 15613.3]
  - - [2048, 3249, 1, 512, 2048, 2048, 512, 512]
    - [74, 15599.1]
  - - [2048, 3251, 1, 512, 2048, 2048, 512, 512]
    - [53, 15654.6]
  - - [2048, 3257, 1, 512, 2048, 2048, 512, 512]
    - [78, 15518.1]
  - - [2048, 3262, 1, 512, 2048, 2048, 512, 512]
    - [78, 15655.8]
  - - [2048, 3268, 1, 512, 2048, 2048, 512, 512]
    - [95, 15363.9]
  - - [2048, 3282, 1, 512, 2048, 2048, 512, 512]
    - [95, 15457.4]
  - - [2048, 3286, 1, 512, 2048, 2048, 512, 512]
    - [71, 15493.0]
  - - [2048, 3287, 1, 512, 2048, 2048, 512, 512]
    - [71, 15548.0]
  - - [2048, 3293, 1, 512, 2048, 2048, 512, 512]
    - [71, 15531.6]
  - - [2048, 3297, 1, 512, 2048, 2048, 512, 512]
    - [71, 15544.8]
  - - [2048, 3307, 1, 512, 2048, 2048, 512, 512]
    - [71, 15597.6]
  - - [2048, 3314, 1, 512, 2048, 2048, 512, 512]
    - [71, 15557.8]
  - - [2048, 3315, 1, 512, 2048, 2048, 512, 512]
    - [71, 15607.2]
  - - [2048, 3319, 1, 512, 2048, 2048, 512, 512]
    - [71, 15581.3]
  - - [2048, 3322, 1, 512, 2048, 2048, 512, 512]
    - [95, 15584.2]
  - - [2048, 3323, 1, 512, 2048, 2048, 512, 512]
    - [71, 15566.6]
  - - [2048, 3324, 1, 512, 2048, 2048, 512, 512]
    - [71, 15593.6]
  - - [2048, 3325, 1, 512, 2048, 2048, 512, 512]
    - [95, 15603.9]
  - - [2048, 3327, 1, 512, 2048, 2048, 512, 512]
    - [95, 15579.8]
  - - [2048, 3329, 1, 512, 2048, 2048, 512, 512]
    - [91, 15358.7]
  - - [2048, 3332, 1, 512, 2048, 2048, 512, 512]
    - [67, 15372.5]
  - - [2048, 3336, 1, 512, 2048, 2048, 512, 512]
    - [93, 15385.6]
  - - [2048, 3339, 1, 512, 2048, 2048, 512, 512]
    - [69, 15367.0]
  - - [2048, 3342, 1, 512, 2048, 2048, 512, 512]
    - [93, 15517.0]
  - - [2048, 3344, 1, 512, 2048, 2048, 512, 512]
    - [69, 15411.6]
  - - [2048, 3358, 1, 512, 2048, 2048, 512, 512]
    - [69, 15530.8]
  - - [2048, 3360, 1, 512, 2048, 2048, 512, 512]
    - [93, 15661.6]
  - - [2048, 3364, 1, 512, 2048, 2048, 512, 512]
    - [93, 15427.9]
  - - [2048, 3365, 1, 512, 2048, 2048, 512, 512]
    - [69, 15427.0]
  - - [2048, 3369, 1, 512, 2048, 2048, 512, 512]
    - [93, 15576.1]
  - - [2048, 3371, 1, 512, 2048, 2048, 512, 512]
    - [91, 15427.6]
  - - [2048, 3374, 1, 512, 2048, 2048, 512, 512]
    - [56, 15457.5]
  - - [2048, 3376, 1, 512, 2048, 2048, 512, 512]
    - [93, 15520.9]
  - - [2048, 3377, 1, 512, 2048, 2048, 512, 512]
    - [67, 15492.9]
  - - [2048, 3378, 1, 512, 2048, 2048, 512, 512]
    - [69, 15492.1]
  - - [2048, 3381, 1, 512, 2048, 2048, 512, 512]
    - [93, 15554.8]
  - - [2048, 3382, 1, 512, 2048, 2048, 512, 512]
    - [78, 15499.6]
  - - [2048, 3383, 1, 512, 2048, 2048, 512, 512]
    - [91, 15482.5]
  - - [2048, 3384, 1, 512, 2048, 2048, 512, 512]
    - [93, 15667.6]
  - - [2048, 3385, 1, 512, 2048, 2048, 512, 512]
    - [93, 15573.2]
  - - [2048, 3386, 1, 512, 2048, 2048, 512, 512]
    - [67, 15517.9]
  - - [2048, 3388, 1, 512, 2048, 2048, 512, 512]
    - [69, 15614.4]
  - - [2048, 3390, 1, 512, 2048, 2048, 512, 512]
    - [93, 15476.7]
  - - [2048, 3391, 1, 512, 2048, 2048, 512, 512]
    - [80, 15508.3]
  - - [2048, 3396, 1, 512, 2048, 2048, 512, 512]
    - [93, 15728.7]
  - - [2048, 3399, 1, 512, 2048, 2048, 512, 512]
    - [93, 15577.5]
  - - [2048, 3402, 1, 512, 2048, 2048, 512, 512]
    - [91, 15607.6]
  - - [2048, 3410, 1, 512, 2048, 2048, 512, 512]
    - [67, 15551.8]
  - - [2048, 3412, 1, 512, 2048, 2048, 512, 512]
    - [91, 15642.5]
  - - [2048, 3414, 1, 512, 2048, 2048, 512, 512]
    - [91, 15701.1]
  - - [2048, 3415, 1, 512, 2048, 2048, 512, 512]
    - [91, 15634.4]
  - - [2048, 3418, 1, 512, 2048, 2048, 512, 512]
    - [56, 15626.3]
  - - [2048, 3420, 1, 512, 2048, 2048, 512, 512]
    - [69, 15778.5]
  - - [2048, 3422, 1, 512, 2048, 2048, 512, 512]
    - [93, 15699.3]
  - - [2048, 3425, 1, 512, 2048, 2048, 512, 512]
    - [91, 15696.6]
  - - [2048, 3426, 1, 512, 2048, 2048, 512, 512]
    - [77, 15619.3]
  - - [2048, 3427, 1, 512, 2048, 2048, 512, 512]
    - [93, 15667.4]
  - - [2048, 3428, 1, 512, 2048, 2048, 512, 512]
    - [67, 15639.3]
  - - [2048, 3430, 1, 512, 2048, 2048, 512, 512]
    - [53, 15621.2]
  - - [2048, 3431, 1, 512, 2048, 2048, 512, 512]
    - [91, 15674.8]
  - - [2048, 3432, 1, 512, 2048, 2048, 512, 512]
    - [67, 15728.7]
  - - [2048, 3438, 1, 512, 2048, 2048, 512, 512]
    - [91, 15756.2]
  - - [2048, 3439, 1, 512, 2048, 2048, 512, 512]
    - [69, 15810.5]
  - - [2048, 3440, 1, 512, 2048, 2048, 512, 512]
    - [69, 15754.4]
  - - [2048, 3443, 1, 512, 2048, 2048, 512, 512]
    - [67, 15773.6]
  - - [2048, 3445, 1, 512, 2048, 2048, 512, 512]
    - [67, 15760.7]
  - - [2048, 3447, 1, 512, 2048, 2048, 512, 512]
    - [69, 15808.5]
  - - [2048, 3448, 1, 512, 2048, 2048, 512, 512]
    - [69, 15885.4]
  - - [2048, 3450, 1, 512, 2048, 2048, 512, 512]
    - [80, 15745.1]
  - - [2048, 3451, 1, 512, 2048, 2048, 512, 512]
    - [67, 15727.8]
  - - [2048, 3452, 1, 512, 2048, 2048, 512, 512]
    - [91, 15732.4]
  - - [2048, 3453, 1, 512, 2048, 2048, 512, 512]
    - [80, 15682.4]
  - - [2048, 3455, 1, 512, 2048, 2048, 512, 512]
    - [67, 15724.2]
  - - [2048, 3456, 1, 512, 2048, 2048, 512, 512]
    - [56, 15750.6]
  - - [2048, 3457, 1, 512, 2048, 2048, 512, 512]
    - [53, 15689.7]
  - - [2048, 3458, 1, 512, 2048, 2048, 512, 512]
    - [53, 15776.2]
  - - [2048, 3459, 1, 512, 2048, 2048, 512, 512]
    - [80, 15715.1]
  - - [2048, 3460, 1, 512, 2048, 2048, 512, 512]
    - [69, 15801.8]
  - - [2048, 3461, 1, 512, 2048, 2048, 512, 512]
    - [77, 15778.9]
  - - [2048, 3462, 1, 512, 2048, 2048, 512, 512]
    - [67, 15794.4]
  - - [2048, 3466, 1, 512, 2048, 2048, 512, 512]
    - [93, 15829.2]
  - - [2048, 3467, 1, 512, 2048, 2048, 512, 512]
    - [77, 15735.1]
  - - [2048, 3468, 1, 512, 2048, 2048, 512, 512]
    - [53, 15843.8]
  - - [2048, 3470, 1, 512, 2048, 2048, 512, 512]
    - [91, 15858.5]
  - - [2048, 3471, 1, 512, 2048, 2048, 512, 512]
    - [91, 15797.0]
  - - [2048, 3472, 1, 512, 2048, 2048, 512, 512]
    - [77, 15768.7]
  - - [2048, 3475, 1, 512, 2048, 2048, 512, 512]
    - [77, 15804.2]
  - - [2048, 3476, 1, 512, 2048, 2048, 512, 512]
    - [91, 15885.9]
  - - [2048, 3477, 1, 512, 2048, 2048, 512, 512]
    - [77, 15868.4]
  - - [2048, 3478, 1, 512, 2048, 2048, 512, 512]
    - [67, 15850.8]
  - - [2048, 3479, 1, 512, 2048, 2048, 512, 512]
    - [67, 15855.4]
  - - [2048, 3480, 1, 512, 2048, 2048, 512, 512]
    - [67, 15816.0]
  - - [2048, 3481, 1, 512, 2048, 2048, 512, 512]
    - [77, 15870.0]
  - - [2048, 3483, 1, 512, 2048, 2048, 512, 512]
    - [91, 15846.1]
  - - [2048, 3484, 1, 512, 2048, 2048, 512, 512]
    - [56, 15850.6]
  - - [2048, 3487, 1, 512, 2048, 2048, 512, 512]
    - [67, 15919.5]
  - - [2048, 3489, 1, 512, 2048, 2048, 512, 512]
    - [77, 15829.4]
  - - [2048, 3490, 1, 512, 2048, 2048, 512, 512]
    - [91, 15855.9]
  - - [2048, 3491, 1, 512, 2048, 2048, 512, 512]
    - [77, 15822.1]
  - - [2048, 3493, 1, 512, 2048, 2048, 512, 512]
    - [91, 15782.0]
  - - [2048, 3494, 1, 512, 2048, 2048, 512, 512]
    - [53, 15885.1]
  - - [2048, 3495, 1, 512, 2048, 2048, 512, 512]
    - [77, 15845.7]
  - - [2048, 3497, 1, 512, 2048, 2048, 512, 512]
    - [67, 15948.5]
  - - [2048, 3498, 1, 512, 2048, 2048, 512, 512]
    - [56, 15903.3]
  - - [2048, 3499, 1, 512, 2048, 2048, 512, 512]
    - [67, 15918.9]
  - - [2048, 3501, 1, 512, 2048, 2048, 512, 512]
    - [56, 15928.0]
  - - [2048, 3503, 1, 512, 2048, 2048, 512, 512]
    - [91, 15948.1]
  - - [2048, 3507, 1, 512, 2048, 2048, 512, 512]
    - [53, 15949.7]
  - - [2048, 3508, 1, 512, 2048, 2048, 512, 512]
    - [80, 15970.9]
  - - [2048, 3509, 1, 512, 2048, 2048, 512, 512]
    - [91, 15975.5]
  - - [2048, 3511, 1, 512, 2048, 2048, 512, 512]
    - [56, 15868.8]
  - - [2048, 3514, 1, 512, 2048, 2048, 512, 512]
    - [67, 16042.8]
  - - [2048, 3515, 1, 512, 2048, 2048, 512, 512]
    - [77, 15740.4]
  - - [2048, 3517, 1, 512, 2048, 2048, 512, 512]
    - [77, 16017.5]
  - - [2048, 3518, 1, 512, 2048, 2048, 512, 512]
    - [56, 15922.4]
  - - [2048, 3519, 1, 512, 2048, 2048, 512, 512]
    - [67, 15910.5]
  - - [2048, 3520, 1, 512, 2048, 2048, 512, 512]
    - [77, 15981.1]
  - - [2048, 3523, 1, 512, 2048, 2048, 512, 512]
    - [77, 15945.0]
  - - [2048, 3528, 1, 512, 2048, 2048, 512, 512]
    - [77, 15918.2]
  - - [2048, 3529, 1, 512, 2048, 2048, 512, 512]
    - [77, 15879.0]
  - - [2048, 3530, 1, 512, 2048, 2048, 512, 512]
    - [91, 15960.2]
  - - [2048, 3532, 1, 512, 2048, 2048, 512, 512]
    - [53, 15914.3]
  - - [2048, 3533, 1, 512, 2048, 2048, 512, 512]
    - [80, 15886.1]
  - - [2048, 3534, 1, 512, 2048, 2048, 512, 512]
    - [56, 15967.3]
  - - [2048, 3538, 1, 512, 2048, 2048, 512, 512]
    - [77, 16024.0]
  - - [2048, 3539, 1, 512, 2048, 2048, 512, 512]
    - [80, 15989.9]
  - - [2048, 3541, 1, 512, 2048, 2048, 512, 512]
    - [53, 15905.7]
  - - [2048, 3547, 1, 512, 2048, 2048, 512, 512]
    - [80, 15840.4]
  - - [2048, 3548, 1, 512, 2048, 2048, 512, 512]
    - [56, 15991.9]
  - - [2048, 3552, 1, 512, 2048, 2048, 512, 512]
    - [53, 15949.6]
  - - [2048, 3564, 1, 512, 2048, 2048, 512, 512]
    - [67, 16209.0]
  - - [2048, 3575, 1, 512, 2048, 2048, 512, 512]
    - [80, 16069.4]
  - - [2048, 3598, 1, 512, 2048, 2048, 512, 512]
    - [102, 16040.8]
  - - [2048, 3599, 1, 512, 2048, 2048, 512, 512]
    - [99, 16100.0]
  - - [2048, 3608, 1, 512, 2048, 2048, 512, 512]
    - [107, 16107.3]
  - - [2048, 3780, 1, 512, 2048, 2048, 512, 512]
    - [108, 16727.0]
  - - [2048, 3796, 1, 512, 2048, 2048, 512, 512]
    - [109, 16820.5]
  - - [2048, 3822, 1, 512, 2048, 2048, 512, 512]
    - [99, 16970.2]
  - - [2048, 3840, 1, 512, 2048, 2048, 512, 512]
    - [102, 17125.5]
  - - [2048, 3859, 1, 512, 2048, 2048, 512, 512]
    - [93, 15727.9]
  - - [2048, 3870, 1, 512, 2048, 2048, 512, 512]
    - [93, 16052.2]
  - - [2048, 3876, 1, 512, 2048, 2048, 512, 512]
    - [59, 15811.9]
  - - [2048, 3906, 1, 512, 2048, 2048, 512, 512]
    - [93, 15959.1]
  - - [2048, 3910, 1, 512, 2048, 2048, 512, 512]
    - [69, 16060.6]
  - - [2048, 3925, 1, 512, 2048, 2048, 512, 512]
    - [78, 15898.0]
  - - [2048, 3942, 1, 512, 2048, 2048, 512, 512]
    - [78, 16026.3]
  - - [2048, 3944, 1, 512, 2048, 2048, 512, 512]
    - [93, 15975.0]
  - - [2048, 3955, 1, 512, 2048, 2048, 512, 512]
    - [69, 15916.2]
  - - [2048, 3968, 1, 512, 2048, 2048, 512, 512]
    - [69, 16319.3]
  - - [2048, 3969, 1, 512, 2048, 2048, 512, 512]
    - [93, 15997.1]
  - - [2048, 3976, 1, 512, 2048, 2048, 512, 512]
    - [82, 15811.4]
  - - [2048, 3977, 1, 512, 2048, 2048, 512, 512]
    - [93, 16118.6]
  - - [2048, 3978, 1, 512, 2048, 2048, 512, 512]
    - [93, 15984.3]
  - - [2048, 3990, 1, 512, 2048, 2048, 512, 512]
    - [54, 16156.3]
  - - [2048, 3995, 1, 512, 2048, 2048, 512, 512]
    - [54, 15974.2]
  - - [2048, 3996, 1, 512, 2048, 2048, 512, 512]
    - [59, 15934.5]
  - - [2048, 3999, 1, 512, 2048, 2048, 512, 512]
    - [93, 16108.1]
  - - [2048, 4005, 1, 512, 2048, 2048, 512, 512]
    - [93, 16107.6]
  - - [2048, 4012, 1, 512, 2048, 2048, 512, 512]
    - [54, 16190.4]
  - - [2048, 4020, 1, 512, 2048, 2048, 512, 512]
    - [59, 16103.6]
  - - [2048, 4026, 1, 512, 2048, 2048, 512, 512]
    - [78, 16024.8]
  - - [2048, 4030, 1, 512, 2048, 2048, 512, 512]
    - [54, 16099.4]
  - - [2048, 4032, 1, 512, 2048, 2048, 512, 512]
    - [78, 16117.2]
  - - [33708, 184, 1, 512, 33708, 33708, 512, 512]
    - [52, 14534.9]
  - - [33708, 189, 1, 512, 33708, 33708, 512, 512]
    - [52, 14984.7]
  - - [33708, 208, 1, 512, 33708, 33708, 512, 512]
    - [78, 12927.8]
  - - [33708, 246, 1, 512, 33708, 33708, 512, 512]
    - [82, 14894.8]
  - - [33708, 264, 1, 512, 33708, 33708, 512, 512]
    - [69, 13806.9]
  - - [33708, 465, 1, 512, 33708, 33708, 512, 512]
    - [69, 15935.7]
  - - [33708, 468, 1, 512, 33708, 33708, 512, 512]
    - [93, 15949.9]
  - - [33708, 493, 1, 512, 33708, 33708, 512, 512]
    - [82, 16605.2]
  - - [33708, 540, 1, 512, 33708, 33708, 512, 512]
    - [69, 16231.8]
  - - [33708, 550, 1, 512, 33708, 33708, 512, 512]
    - [69, 16211.6]
  - - [33708, 560, 1, 512, 33708, 33708, 512, 512]
    - [69, 16626.8]
  - - [33708, 644, 1, 512, 33708, 33708, 512, 512]
    - [93, 16306.5]
  - - [33708, 714, 1, 512, 33708, 33708, 512, 512]
    - [44, 16578.7]
  - - [33708, 720, 1, 512, 33708, 33708, 512, 512]
    - [22, 16680.3]
  - - [33708, 781, 1, 512, 33708, 33708, 512, 512]
    - [77, 16753.2]
  - - [33708, 936, 1, 512, 33708, 33708, 512, 512]
    - [69, 17532.8]
  - - [33708, 980, 1, 512, 33708, 33708, 512, 512]
    - [69, 17188.4]
  - - [33708, 1232, 1, 512, 33708, 33708, 512, 512]
    - [44, 17389.6]
  - - [33708, 1290, 1, 512, 33708, 33708, 512, 512]
    - [91, 17478.6]
  - - [33708, 1350, 1, 512, 33708, 33708, 512, 512]
    - [91, 17504.4]
  - - [33708, 1424, 1, 512, 33708, 33708, 512, 512]
    - [93, 17632.0]
  - - [33708, 1458, 1, 512, 33708, 33708, 512, 512]
    - [67, 17958.2]
  - - [33708, 1462, 1, 512, 33708, 33708, 512, 512]
    - [69, 17982.8]
  - - [33708, 1520, 1, 512, 33708, 33708, 512, 512]
    - [80, 17777.9]
  - - [33708, 1596, 1, 512, 33708, 33708, 512, 512]
    - [77, 17838.9]
  - - [33708, 1599, 1, 512, 33708, 33708, 512, 512]
    - [69, 17809.7]
  - - [33708, 1615, 1, 512, 33708, 33708, 512, 512]
    - [17, 17772.3]
  - - [33708, 1680, 1, 512, 33708, 33708, 512, 512]
    - [53, 17728.0]
  - - [33708, 1917, 1, 512, 33708, 33708, 512, 512]
    - [17, 18171.2]
  - - [33708, 2205, 1, 512, 33708, 33708, 512, 512]
    - [67, 17998.1]
  - - [33708, 2418, 1, 512, 33708, 33708, 512, 512]
    - [17, 18216.3]
  - - [33708, 2496, 1, 512, 33708, 33708, 512, 512]
    - [93, 18324.0]
  - - [33708, 3776, 1, 512, 33708, 33708, 512, 512]
    - [67, 18399.2]
  - - [33708, 3780, 1, 512, 33708, 33708, 512, 512]
    - [41, 18255.8]
  - - [33708, 3796, 1, 512, 33708, 33708, 512, 512]
    - [17, 18295.8]
  - - [33708, 3822, 1, 512, 33708, 33708, 512, 512]
    - [41, 18344.5]
  - - [33708, 3835, 1, 512, 33708, 33708, 512, 512]
    - [41, 18406.9]
  - - [33708, 3840, 1, 512, 33708, 33708, 512, 512]
    - [17, 18549.7]
  - - [33708, 3859, 1, 512, 33708, 33708, 512, 512]
    - [93, 18170.0]
  - - [33708, 3864, 1, 512, 33708, 33708, 512, 512]
    - [91, 18117.2]
  - - [33708, 3870, 1, 512, 33708, 33708, 512, 512]
    - [53, 18230.9]
  - - [33708, 3876, 1, 512, 33708, 33708, 512, 512]
    - [53, 18272.7]
  - - [33708, 3906, 1, 512, 33708, 33708, 512, 512]
    - [41, 18224.6]
  - - [33708, 3910, 1, 512, 33708, 33708, 512, 512]
    - [41, 18233.8]
  - - [33708, 3925, 1, 512, 33708, 33708, 512, 512]
    - [41, 18319.6]
  - - [33708, 3942, 1, 512, 33708, 33708, 512, 512]
    - [41, 18356.0]
  - - [33708, 3944, 1, 512, 33708, 33708, 512, 512]
    - [17, 18373.3]
  - - [33708, 3955, 1, 512, 33708, 33708, 512, 512]
    - [17, 18432.5]
  - - [33708, 3968, 1, 512, 33708, 33708, 512, 512]
    - [17, 18543.1]
  - - [33708, 3969, 1, 512, 33708, 33708, 512, 512]
    - [69, 18133.4]
  - - [33708, 3976, 1, 512, 33708, 33708, 512, 512]
    - [69, 18119.7]
  - - [33708, 3977, 1, 512, 33708, 33708, 512, 512]
    - [53, 18125.1]
  - - [33708, 3978, 1, 512, 33708, 33708, 512, 512]
    - [77, 18147.6]
  - - [33708, 3990, 1, 512, 33708, 33708, 512, 512]
    - [53, 18169.3]
  - - [33708, 3995, 1, 512, 33708, 33708, 512, 512]
    - [53, 18221.7]
  - - [33708, 3996, 1, 512, 33708, 33708, 512, 512]
    - [91, 18241.7]
  - - [33708, 3999, 1, 512, 33708, 33708, 512, 512]
    - [53, 18203.8]
  - - [33708, 4005, 1, 512, 33708, 33708, 512, 512]
    - [67, 18278.5]
  - - [33708, 4012, 1, 512, 33708, 33708, 512, 512]
    - [77, 18261.8]
  - - [33708, 4020, 1, 512, 33708, 33708, 512, 512]
    - [77, 18307.9]
  - - [33708, 4026, 1, 512, 33708, 33708, 512, 512]
    - [93, 18359.6]
  - - [33708, 4030, 1, 512, 33708, 33708, 512, 512]
    - [53, 18371.3]
  - - [33708, 4032, 1, 512, 33708, 33708, 512, 512]
    - [69, 18395.5]
- null
