Tensile/Configs/miopen/archives/bert/2020-01-19/exact/arcturus_Cijk_Ailk_Bjlk_SB.yaml
- {MinimumRequiredVersion: 4.15.0}
- arcturus
- gfx908
- [Device 7380, Device 7388, Device 738c, Device 7390, Device 731f]
    SolutionIndex: 0
    SolutionNameMin: Cijk_Ailk_Bjlk_SB_MT96x64x16_SE_EPS1_FL0_GRVW2_PGR1_PLR1_TT6_4_USFGRO0_VW2_WGM8
    SolutionIndex: 1
    SolutionNameMin: Cijk_Ailk_Bjlk_SB_MT96x64x8_SE_EPS1_FL1_GRVW2_PGR1_PLR1_TT6_4_USFGRO0_VW2_WGM1
    SolutionIndex: 2
    SolutionNameMin: Cijk_Ailk_Bjlk_SB_MT96x64x8_SE_EPS1_FL1_GRVW2_PGR1_PLR1_TT6_4_USFGRO0_VW2_WGM8
    SolutionIndex: 3
    SolutionNameMin: Cijk_Ailk_Bjlk_SB_MT64x96x8_SE_EPS1_FL1_GRVW2_PGR1_PLR1_TT4_6_USFGRO0_VW2_WGM1
    SolutionIndex: 4
    SolutionNameMin: Cijk_Ailk_Bjlk_SB_MT64x96x8_SE_EPS1_FL1_GRVW2_PGR1_PLR1_TT4_6_USFGRO0_VW2_WGM8
    SolutionIndex: 5
    SolutionNameMin: Cijk_Ailk_Bjlk_SB_MT64x128x8_SE_EPS0_FL0_GRVW1_PGR0_PLR0_TT4_8_USFGRO1_VW2_WGM8
    SolutionIndex: 6
    SolutionNameMin: Cijk_Ailk_Bjlk_SB_MT64x128x8_SE_EPS1_FL0_GRVW1_PGR1_PLR0_TT4_8_USFGRO1_VW2_WGM8
    SolutionIndex: 7
    SolutionNameMin: Cijk_Ailk_Bjlk_SB_MT64x128x16_SE_EPS0_FL0_GRVW1_PGR0_PLR0_TT4_8_USFGRO1_VW2_WGM1
    SolutionIndex: 8
    SolutionNameMin: Cijk_Ailk_Bjlk_SB_MT64x128x16_SE_EPS0_FL0_GRVW1_PGR0_PLR0_TT4_8_USFGRO1_VW2_WGM8
    SolutionIndex: 9
    SolutionNameMin: Cijk_Ailk_Bjlk_SB_MT64x128x8_SE_EPS0_FL0_GRVW1_PGR0_PLR1_TT4_8_USFGRO1_VW2_WGM1
    SolutionIndex: 10
    SolutionNameMin: Cijk_Ailk_Bjlk_SB_MT64x128x8_SE_EPS1_FL0_GRVW1_PGR1_PLR1_TT4_8_USFGRO1_VW2_WGM1
    SolutionIndex: 11
    SolutionNameMin: Cijk_Ailk_Bjlk_SB_MT64x128x8_SE_EPS0_FL0_GRVW1_PGR0_PLR1_TT4_8_USFGRO1_VW2_WGM8
    SolutionIndex: 12
    SolutionNameMin: Cijk_Ailk_Bjlk_SB_MT64x128x8_SE_EPS1_FL0_GRVW1_PGR1_PLR1_TT4_8_USFGRO1_VW2_WGM8
    SolutionIndex: 13
    SolutionNameMin: Cijk_Ailk_Bjlk_SB_MT64x128x16_SE_EPS0_FL0_GRVW1_PGR0_PLR1_TT4_8_USFGRO1_VW2_WGM8
    SolutionIndex: 14
    SolutionNameMin: Cijk_Ailk_Bjlk_SB_MT64x128x8_SE_EPS0_FL0_GRVW1_PGR0_PLR0_TT4_8_USFGRO1_VW4_WGM1
    SolutionIndex: 15
    SolutionNameMin: Cijk_Ailk_Bjlk_SB_MT64x128x8_SE_EPS1_FL0_GRVW1_PGR1_PLR0_TT4_8_USFGRO1_VW4_WGM1
    SolutionIndex: 16
    SolutionNameMin: Cijk_Ailk_Bjlk_SB_MT64x128x8_SE_EPS0_FL0_GRVW1_PGR0_PLR1_TT4_8_USFGRO1_VW4_WGM8
    SolutionIndex: 17
    SolutionNameMin: Cijk_Ailk_Bjlk_SB_MT64x128x8_SE_EPS1_FL0_GRVW2_PGR1_PLR0_TT4_8_USFGRO0_VW2_WGM1
    SolutionIndex: 18
    SolutionNameMin: Cijk_Ailk_Bjlk_SB_MT64x128x8_SE_EPS0_FL0_GRVW2_PGR0_PLR1_TT4_8_USFGRO0_VW2_WGM8
    SolutionIndex: 19
    SolutionNameMin: Cijk_Ailk_Bjlk_SB_MT64x128x8_SE_EPS0_FL1_GRVW2_PGR0_PLR1_TT4_8_USFGRO0_VW2_WGM1
    SolutionIndex: 20
    SolutionNameMin: Cijk_Ailk_Bjlk_SB_MT128x64x8_SE_EPS0_FL0_GRVW1_PGR0_PLR0_TT8_4_USFGRO1_VW2_WGM8
    SolutionIndex: 21
    SolutionNameMin: Cijk_Ailk_Bjlk_SB_MT128x64x8_SE_EPS0_FL0_GRVW1_PGR0_PLR1_TT8_4_USFGRO1_VW2_WGM1
    SolutionIndex: 22
    SolutionNameMin: Cijk_Ailk_Bjlk_SB_MT128x64x8_SE_EPS0_FL0_GRVW2_PGR0_PLR0_TT8_4_USFGRO0_VW2_WGM1
    SolutionIndex: 23
    SolutionNameMin: Cijk_Ailk_Bjlk_SB_MT128x64x8_SE_EPS1_FL0_GRVW2_PGR1_PLR1_TT8_4_USFGRO0_VW2_WGM8
    SolutionIndex: 24
    SolutionNameMin: Cijk_Ailk_Bjlk_SB_MT128x64x8_SE_EPS1_FL1_GRVW2_PGR1_PLR1_TT8_4_USFGRO0_VW2_WGM1
    SolutionIndex: 25
    SolutionNameMin: Cijk_Ailk_Bjlk_SB_MT128x64x8_SE_EPS1_FL1_GRVW2_PGR1_PLR1_TT8_4_USFGRO0_VW2_WGM8
    SolutionIndex: 26
    SolutionNameMin: Cijk_Ailk_Bjlk_SB_MT64x64x8_SE_EPS0_FL0_GRVW2_PGR0_PLR0_TT4_4_USFGRO0_VW2_WGM8
    SolutionIndex: 27
    SolutionNameMin: Cijk_Ailk_Bjlk_SB_MT64x64x8_SE_EPS0_FL1_GRVW2_PGR0_PLR0_TT4_4_USFGRO0_VW2_WGM8
    SolutionIndex: 28
    SolutionNameMin: Cijk_Ailk_Bjlk_SB_MT16x64x16_SE_EPS1_FL0_GRVW4_PGR1_PLR0_TT4_4_USFGRO0_VW4_WGM1
    SolutionIndex: 29
    SolutionNameMin: Cijk_Ailk_Bjlk_SB_MT16x64x16_SE_EPS1_FL0_GRVW4_PGR1_PLR1_TT4_4_USFGRO0_VW4_WGM1
    SolutionIndex: 30
    SolutionNameMin: Cijk_Ailk_Bjlk_SB_MT64x16x16_SE_EPS1_FL0_GRVW4_PGR1_PLR0_TT4_4_USFGRO0_VW4_WGM8
    SolutionIndex: 31
    SolutionNameMin: Cijk_Ailk_Bjlk_SB_MT64x16x16_SE_EPS1_FL0_GRVW4_PGR1_PLR1_TT4_4_USFGRO0_VW4_WGM8
- - - [512, 2048, 1, 2790, 512, 512, 512, 2048]
    - [1, 12693.3]
  - - [512, 2048, 1, 2864, 512, 512, 512, 2048]
    - [1, 12878.0]
  - - [512, 2048, 1, 3092, 512, 512, 512, 2048]
    - [1, 12890.5]
  - - [512, 2048, 1, 3113, 512, 512, 512, 2048]
    - [1, 12896.0]
  - - [512, 2048, 1, 3137, 512, 512, 512, 2048]
    - [1, 12897.6]
  - - [512, 2048, 1, 3165, 512, 512, 512, 2048]
    - [1, 12915.5]
  - - [512, 2048, 1, 3166, 512, 512, 512, 2048]
    - [1, 12871.5]
  - - [512, 2048, 1, 3194, 512, 512, 512, 2048]
    - [1, 12917.2]
  - - [512, 2048, 1, 3219, 512, 512, 512, 2048]
    - [1, 12910.7]
  - - [512, 2048, 1, 3222, 512, 512, 512, 2048]
    - [1, 12867.6]
  - - [512, 2048, 1, 3234, 512, 512, 512, 2048]
    - [1, 12931.3]
  - - [512, 2048, 1, 3237, 512, 512, 512, 2048]
    - [1, 12896.1]
  - - [512, 2048, 1, 3242, 512, 512, 512, 2048]
    - [1, 12947.5]
  - - [512, 2048, 1, 3246, 512, 512, 512, 2048]
    - [1, 12877.2]
  - - [512, 2048, 1, 3249, 512, 512, 512, 2048]
    - [1, 12924.3]
  - - [512, 2048, 1, 3251, 512, 512, 512, 2048]
    - [1, 12897.0]
  - - [512, 2048, 1, 3257, 512, 512, 512, 2048]
    - [1, 12932.5]
  - - [512, 2048, 1, 3262, 512, 512, 512, 2048]
    - [3, 12870.5]
  - - [512, 2048, 1, 3268, 512, 512, 512, 2048]
    - [1, 12894.2]
  - - [512, 2048, 1, 3282, 512, 512, 512, 2048]
    - [1, 12918.3]
  - - [512, 2048, 1, 3286, 512, 512, 512, 2048]
    - [1, 12903.1]
  - - [512, 2048, 1, 3287, 512, 512, 512, 2048]
    - [2, 12934.1]
  - - [512, 2048, 1, 3293, 512, 512, 512, 2048]
    - [1, 12884.2]
  - - [512, 2048, 1, 3297, 512, 512, 512, 2048]
    - [1, 12919.2]
  - - [512, 2048, 1, 3307, 512, 512, 512, 2048]
    - [1, 12919.7]
  - - [512, 2048, 1, 3314, 512, 512, 512, 2048]
    - [1, 12920.1]
  - - [512, 2048, 1, 3315, 512, 512, 512, 2048]
    - [1, 12920.2]
  - - [512, 2048, 1, 3319, 512, 512, 512, 2048]
    - [1, 12874.5]
  - - [512, 2048, 1, 3322, 512, 512, 512, 2048]
    - [4, 12951.3]
  - - [512, 2048, 1, 3323, 512, 512, 512, 2048]
    - [1, 12901.5]
  - - [512, 2048, 1, 3324, 512, 512, 512, 2048]
    - [1, 12893.9]
  - - [512, 2048, 1, 3325, 512, 512, 512, 2048]
    - [3, 12913.1]
  - - [512, 2048, 1, 3327, 512, 512, 512, 2048]
    - [1, 12905.5]
  - - [512, 2048, 1, 3329, 512, 512, 512, 2048]
    - [1, 12901.8]
  - - [512, 2048, 1, 3332, 512, 512, 512, 2048]
    - [1, 12921.1]
  - - [512, 2048, 1, 3336, 512, 512, 512, 2048]
    - [1, 12921.3]
  - - [512, 2048, 1, 3339, 512, 512, 512, 2048]
    - [1, 12944.4]
  - - [512, 2048, 1, 3342, 512, 512, 512, 2048]
    - [1, 12940.7]
  - - [512, 2048, 1, 3344, 512, 512, 512, 2048]
    - [4, 12952.3]
  - - [512, 2048, 1, 3358, 512, 512, 512, 2048]
    - [1, 12926.3]
  - - [512, 2048, 1, 3360, 512, 512, 512, 2048]
    - [3, 12926.4]
  - - [512, 2048, 1, 3364, 512, 512, 512, 2048]
    - [1, 12900.2]
  - - [512, 2048, 1, 3365, 512, 512, 512, 2048]
    - [1, 12938.1]
  - - [512, 2048, 1, 3369, 512, 512, 512, 2048]
    - [1, 12915.6]
  - - [512, 2048, 1, 3371, 512, 512, 512, 2048]
    - [1, 12915.7]
  - - [512, 2048, 1, 3374, 512, 512, 512, 2048]
    - [1, 12900.8]
  - - [512, 2048, 1, 3376, 512, 512, 512, 2048]
    - [1, 12938.6]
  - - [512, 2048, 1, 3377, 512, 512, 512, 2048]
    - [4, 12957.6]
  - - [512, 2048, 1, 3378, 512, 512, 512, 2048]
    - [1, 12961.4]
  - - [512, 2048, 1, 3381, 512, 512, 512, 2048]
    - [1, 12912.5]
  - - [512, 2048, 1, 3382, 512, 512, 512, 2048]
    - [1, 12920.1]
  - - [512, 2048, 1, 3383, 512, 512, 512, 2048]
    - [1, 12923.9]
  - - [512, 2048, 1, 3384, 512, 512, 512, 2048]
    - [1, 12942.8]
  - - [512, 2048, 1, 3385, 512, 512, 512, 2048]
    - [1, 12931.5]
  - - [512, 2048, 1, 3386, 512, 512, 512, 2048]
    - [1, 12886.5]
  - - [512, 2048, 1, 3388, 512, 512, 512, 2048]
    - [1, 12943.0]
  - - [512, 2048, 1, 3390, 512, 512, 512, 2048]
    - [1, 12928.0]
  - - [512, 2048, 1, 3391, 512, 512, 512, 2048]
    - [1, 12935.6]
  - - [512, 2048, 1, 3396, 512, 512, 512, 2048]
    - [1, 12917.1]
  - - [512, 2048, 1, 3399, 512, 512, 512, 2048]
    - [3, 12917.2]
  - - [512, 2048, 1, 3402, 512, 512, 512, 2048]
    - [1, 12924.9]
  - - [512, 2048, 1, 3410, 512, 512, 512, 2048]
    - [1, 12914.1]
  - - [512, 2048, 1, 3412, 512, 512, 512, 2048]
    - [1, 12917.9]
  - - [512, 2048, 1, 3414, 512, 512, 512, 2048]
    - [1, 12910.6]
  - - [512, 2048, 1, 3415, 512, 512, 512, 2048]
    - [1, 12910.7]
  - - [512, 2048, 1, 3418, 512, 512, 512, 2048]
    - [1, 12903.4]
  - - [512, 2048, 1, 3420, 512, 512, 512, 2048]
    - [1, 12922.1]
  - - [512, 2048, 1, 3422, 512, 512, 512, 2048]
    - [3, 12914.8]
  - - [512, 2048, 1, 3425, 512, 512, 512, 2048]
    - [1, 12926.1]
  - - [512, 2048, 1, 3426, 512, 512, 512, 2048]
    - [1, 12937.3]
  - - [512, 2048, 1, 3427, 512, 512, 512, 2048]
    - [1, 12944.8]
  - - [512, 2048, 1, 3428, 512, 512, 512, 2048]
    - [1, 12926.2]
  - - [512, 2048, 1, 3430, 512, 512, 512, 2048]
    - [1, 12911.5]
  - - [512, 2048, 1, 3431, 512, 512, 512, 2048]
    - [1, 12922.7]
  - - [512, 2048, 1, 3432, 512, 512, 512, 2048]
    - [2, 12952.5]
  - - [512, 2048, 1, 3438, 512, 512, 512, 2048]
    - [1, 12934.2]
  - - [512, 2048, 1, 3439, 512, 512, 512, 2048]
    - [3, 12923.1]
  - - [512, 2048, 1, 3440, 512, 512, 512, 2048]
    - [3, 12926.9]
  - - [512, 2048, 1, 3443, 512, 512, 512, 2048]
    - [1, 12897.5]
  - - [512, 2048, 1, 3445, 512, 512, 512, 2048]
    - [1, 12953.1]
  - - [512, 2048, 1, 3447, 512, 512, 512, 2048]
    - [1, 12919.8]
  - - [512, 2048, 1, 3448, 512, 512, 512, 2048]
    - [1, 12931.0]
  - - [512, 2048, 1, 3450, 512, 512, 512, 2048]
    - [1, 12920.0]
  - - [512, 2048, 1, 3451, 512, 512, 512, 2048]
    - [1, 12909.0]
  - - [512, 2048, 1, 3452, 512, 512, 512, 2048]
    - [1, 12953.4]
  - - [512, 2048, 1, 3453, 512, 512, 512, 2048]
    - [1, 12931.2]
  - - [512, 2048, 1, 3455, 512, 512, 512, 2048]
    - [1, 12905.5]
  - - [512, 2048, 1, 3456, 512, 512, 512, 2048]
    - [1, 12983.3]
  - - [512, 2048, 1, 3457, 512, 512, 512, 2048]
    - [1, 12953.6]
  - - [512, 2048, 1, 3458, 512, 512, 512, 2048]
    - [3, 12924.1]
  - - [512, 2048, 1, 3459, 512, 512, 512, 2048]
    - [1, 12953.7]
  - - [512, 2048, 1, 3460, 512, 512, 512, 2048]
    - [1, 12946.4]
  - - [512, 2048, 1, 3461, 512, 512, 512, 2048]
    - [1, 12942.7]
  - - [512, 2048, 1, 3462, 512, 512, 512, 2048]
    - [3, 12942.8]
  - - [512, 2048, 1, 3466, 512, 512, 512, 2048]
    - [1, 12946.6]
  - - [512, 2048, 1, 3467, 512, 512, 512, 2048]
    - [3, 12898.9]
  - - [512, 2048, 1, 3468, 512, 512, 512, 2048]
    - [1, 12950.4]
  - - [512, 2048, 1, 3470, 512, 512, 512, 2048]
    - [1, 12939.4]
  - - [512, 2048, 1, 3471, 512, 512, 512, 2048]
    - [1, 12888.2]
  - - [512, 2048, 1, 3472, 512, 512, 512, 2048]
    - [1, 12950.6]
  - - [512, 2048, 1, 3475, 512, 512, 512, 2048]
    - [1, 12917.7]
  - - [512, 2048, 1, 3476, 512, 512, 512, 2048]
    - [1, 12925.0]
  - - [512, 2048, 1, 3477, 512, 512, 512, 2048]
    - [1, 12943.5]
  - - [512, 2048, 1, 3478, 512, 512, 512, 2048]
    - [3, 12932.5]
  - - [512, 2048, 1, 3479, 512, 512, 512, 2048]
    - [1, 12936.2]
  - - [512, 2048, 1, 3480, 512, 512, 512, 2048]
    - [1, 12969.4]
  - - [512, 2048, 1, 3481, 512, 512, 512, 2048]
    - [1, 12907.0]
  - - [512, 2048, 1, 3483, 512, 512, 512, 2048]
    - [1, 12940.1]
  - - [512, 2048, 1, 3484, 512, 512, 512, 2048]
    - [1, 12903.5]
  - - [512, 2048, 1, 3487, 512, 512, 512, 2048]
    - [1, 12896.4]
  - - [512, 2048, 1, 3489, 512, 512, 512, 2048]
    - [1, 12903.9]
  - - [512, 2048, 1, 3490, 512, 512, 512, 2048]
    - [1, 12962.4]
  - - [512, 2048, 1, 3491, 512, 512, 512, 2048]
    - [1, 12933.1]
  - - [512, 2048, 1, 3493, 512, 512, 512, 2048]
    - [3, 12925.9]
  - - [512, 2048, 1, 3494, 512, 512, 512, 2048]
    - [1, 12933.3]
  - - [512, 2048, 1, 3495, 512, 512, 512, 2048]
    - [3, 12926.0]
  - - [512, 2048, 1, 3497, 512, 512, 512, 2048]
    - [1, 12944.4]
  - - [512, 2048, 1, 3498, 512, 512, 512, 2048]
    - [3, 12933.5]
  - - [512, 2048, 1, 3499, 512, 512, 512, 2048]
    - [4, 12962.8]
  - - [512, 2048, 1, 3501, 512, 512, 512, 2048]
    - [1, 12951.9]
  - - [512, 2048, 1, 3503, 512, 512, 512, 2048]
    - [1, 12919.2]
  - - [512, 2048, 1, 3507, 512, 512, 512, 2048]
    - [1, 12941.2]
  - - [512, 2048, 1, 3508, 512, 512, 512, 2048]
    - [1, 12912.2]
  - - [512, 2048, 1, 3509, 512, 512, 512, 2048]
    - [3, 12919.5]
  - - [512, 2048, 1, 3511, 512, 512, 512, 2048]
    - [1, 12937.7]
  - - [512, 2048, 1, 3514, 512, 512, 512, 2048]
    - [1, 12945.2]
  - - [512, 2048, 1, 3515, 512, 512, 512, 2048]
    - [1, 12956.1]
  - - [512, 2048, 1, 3517, 512, 512, 512, 2048]
    - [1, 12945.3]
  - - [512, 2048, 1, 3518, 512, 512, 512, 2048]
    - [1, 12930.8]
  - - [512, 2048, 1, 3519, 512, 512, 512, 2048]
    - [1, 12901.9]
  - - [512, 2048, 1, 3520, 512, 512, 512, 2048]
    - [1, 12956.3]
  - - [512, 2048, 1, 3523, 512, 512, 512, 2048]
    - [1, 12923.8]
  - - [512, 2048, 1, 3528, 512, 512, 512, 2048]
    - [1, 12971.2]
  - - [512, 2048, 1, 3529, 512, 512, 512, 2048]
    - [1, 12945.8]
  - - [512, 2048, 1, 3530, 512, 512, 512, 2048]
    - [1, 12909.8]
  - - [512, 2048, 1, 3532, 512, 512, 512, 2048]
    - [2, 12953.2]
  - - [512, 2048, 1, 3533, 512, 512, 512, 2048]
    - [1, 12917.1]
  - - [512, 2048, 1, 3534, 512, 512, 512, 2048]
    - [1, 12935.2]
  - - [512, 2048, 1, 3538, 512, 512, 512, 2048]
    - [1, 12946.3]
  - - [512, 2048, 1, 3539, 512, 512, 512, 2048]
    - [1, 12946.3]
  - - [512, 2048, 1, 3541, 512, 512, 512, 2048]
    - [1, 12935.6]
  - - [512, 2048, 1, 3547, 512, 512, 512, 2048]
    - [1, 12943.0]
  - - [512, 2048, 1, 3548, 512, 512, 512, 2048]
    - [2, 12961.1]
  - - [512, 2048, 1, 3552, 512, 512, 512, 2048]
    - [1, 12954.1]
  - - [512, 2048, 1, 3564, 512, 512, 512, 2048]
    - [1, 12943.8]
  - - [512, 2048, 1, 3575, 512, 512, 512, 2048]
    - [1, 12937.2]
  - - [512, 2048, 1, 3598, 512, 512, 512, 2048]
    - [1, 12938.3]
  - - [512, 2048, 1, 3599, 512, 512, 512, 2048]
    - [1, 12938.3]
  - - [512, 2048, 1, 3608, 512, 512, 512, 2048]
    - [1, 12984.9]
  - - [512, 2048, 1, 3780, 512, 512, 512, 2048]
    - [1, 12953.1]
  - - [512, 2048, 1, 3796, 512, 512, 512, 2048]
    - [1, 12936.9]
  - - [512, 2048, 1, 3822, 512, 512, 512, 2048]
    - [1, 12971.5]
  - - [512, 2048, 1, 3840, 512, 512, 512, 2048]
    - [1, 12988.9]
  - - [512, 2048, 1, 3859, 512, 512, 512, 2048]
    - [1, 12986.1]
  - - [512, 2048, 1, 3870, 512, 512, 512, 2048]
    - [1, 12973.2]
  - - [512, 2048, 1, 3876, 512, 512, 512, 2048]
    - [1, 12980.0]
  - - [512, 2048, 1, 3906, 512, 512, 512, 2048]
    - [3, 12997.5]
  - - [512, 2048, 1, 3910, 512, 512, 512, 2048]
    - [1, 13007.5]
  - - [512, 2048, 1, 3925, 512, 512, 512, 2048]
    - [1, 12988.1]
  - - [512, 2048, 1, 3942, 512, 512, 512, 2048]
    - [1, 12982.1]
  - - [512, 2048, 1, 3944, 512, 512, 512, 2048]
    - [1, 13008.3]
  - - [512, 2048, 1, 3955, 512, 512, 512, 2048]
    - [3, 12956.6]
  - - [512, 2048, 1, 3968, 512, 512, 512, 2048]
    - [3, 13005.7]
  - - [512, 2048, 1, 3969, 512, 512, 512, 2048]
    - [1, 12989.4]
  - - [512, 2048, 1, 3976, 512, 512, 512, 2048]
    - [1, 12999.4]
  - - [512, 2048, 1, 3977, 512, 512, 512, 2048]
    - [1, 13002.6]
  - - [512, 2048, 1, 3978, 512, 512, 512, 2048]
    - [1, 12989.7]
  - - [512, 2048, 1, 3990, 512, 512, 512, 2048]
    - [1, 12970.7]
  - - [512, 2048, 1, 3995, 512, 512, 512, 2048]
    - [1, 12999.9]
  - - [512, 2048, 1, 3996, 512, 512, 512, 2048]
    - [1, 12974.1]
  - - [512, 2048, 1, 3999, 512, 512, 512, 2048]
    - [1, 12993.5]
  - - [512, 2048, 1, 4005, 512, 512, 512, 2048]
    - [1, 12964.8]
  - - [512, 2048, 1, 4012, 512, 512, 512, 2048]
    - [1, 12984.3]
  - - [512, 2048, 1, 4020, 512, 512, 512, 2048]
    - [1, 13007.0]
  - - [512, 2048, 1, 4026, 512, 512, 512, 2048]
    - [1, 12984.7]
  - - [512, 2048, 1, 4030, 512, 512, 512, 2048]
    - [1, 12988.0]
  - - [512, 2048, 1, 4032, 512, 512, 512, 2048]
    - [1, 13032.9]
  - - [512, 33708, 1, 3780, 512, 512, 512, 33708]
    - [25, 18700.0]
  - - [512, 33708, 1, 3796, 512, 512, 512, 33708]
    - [23, 18688.3]
  - - [512, 33708, 1, 3822, 512, 512, 512, 33708]
    - [25, 18690.4]
  - - [512, 33708, 1, 3840, 512, 512, 512, 33708]
    - [25, 18678.5]
  - - [512, 33708, 1, 3859, 512, 512, 512, 33708]
    - [25, 18675.0]
  - - [512, 33708, 1, 3870, 512, 512, 512, 33708]
    - [23, 18666.2]
  - - [512, 33708, 1, 3876, 512, 512, 512, 33708]
    - [23, 18671.8]
  - - [512, 33708, 1, 3906, 512, 512, 512, 33708]
    - [23, 18667.5]
  - - [512, 33708, 1, 3910, 512, 512, 512, 33708]
    - [25, 18662.6]
  - - [512, 33708, 1, 3925, 512, 512, 512, 33708]
    - [23, 18672.7]
  - - [512, 33708, 1, 3942, 512, 512, 512, 33708]
    - [25, 18665.9]
  - - [512, 33708, 1, 3944, 512, 512, 512, 33708]
    - [25, 18678.2]
  - - [512, 33708, 1, 3955, 512, 512, 512, 33708]
    - [25, 18671.7]
  - - [512, 33708, 1, 3968, 512, 512, 512, 33708]
    - [25, 18659.2]
  - - [512, 33708, 1, 3969, 512, 512, 512, 33708]
    - [25, 18683.8]
  - - [512, 33708, 1, 3976, 512, 512, 512, 33708]
    - [23, 18681.3]
  - - [512, 33708, 1, 3977, 512, 512, 512, 33708]
    - [23, 18662.4]
  - - [512, 33708, 1, 3978, 512, 512, 512, 33708]
    - [23, 18681.3]
  - - [512, 33708, 1, 3990, 512, 512, 512, 33708]
    - [25, 18686.0]
  - - [512, 33708, 1, 3995, 512, 512, 512, 33708]
    - [24, 18703.4]
  - - [512, 33708, 1, 3996, 512, 512, 512, 33708]
    - [23, 18658.6]
  - - [512, 33708, 1, 3999, 512, 512, 512, 33708]
    - [25, 18667.0]
  - - [512, 33708, 1, 4005, 512, 512, 512, 33708]
    - [23, 18675.2]
  - - [512, 33708, 1, 4012, 512, 512, 512, 33708]
    - [25, 18661.0]
  - - [512, 33708, 1, 4020, 512, 512, 512, 33708]
    - [23, 18660.4]
  - - [512, 33708, 1, 4026, 512, 512, 512, 33708]
    - [23, 18657.0]
  - - [512, 33708, 1, 4030, 512, 512, 512, 33708]
    - [25, 18652.3]
  - - [512, 33708, 1, 4032, 512, 512, 512, 33708]
    - [23, 18665.5]
  - - [2048, 512, 1, 2790, 2048, 2048, 2048, 512]
    - [1, 12831.3]
  - - [2048, 512, 1, 2864, 2048, 2048, 2048, 512]
    - [1, 12842.7]
  - - [2048, 512, 1, 3092, 2048, 2048, 2048, 512]
    - [1, 12882.3]
  - - [2048, 512, 1, 3113, 2048, 2048, 2048, 512]
    - [1, 12936.9]
  - - [2048, 512, 1, 3137, 2048, 2048, 2048, 512]
    - [1, 12889.5]
  - - [2048, 512, 1, 3165, 2048, 2048, 2048, 512]
    - [1, 12879.4]
  - - [2048, 512, 1, 3166, 2048, 2048, 2048, 512]
    - [1, 12839.6]
  - - [2048, 512, 1, 3194, 2048, 2048, 2048, 512]
    - [1, 12889.3]
  - - [2048, 512, 1, 3219, 2048, 2048, 2048, 512]
    - [1, 12902.8]
  - - [2048, 512, 1, 3222, 2048, 2048, 2048, 512]
    - [1, 12922.8]
  - - [2048, 512, 1, 3234, 2048, 2048, 2048, 512]
    - [1, 12892.0]
  - - [2048, 512, 1, 3237, 2048, 2048, 2048, 512]
    - [1, 12900.0]
  - - [2048, 512, 1, 3242, 2048, 2048, 2048, 512]
    - [1, 12927.8]
  - - [2048, 512, 1, 3246, 2048, 2048, 2048, 512]
    - [1, 12888.9]
  - - [2048, 512, 1, 3249, 2048, 2048, 2048, 512]
    - [1, 12932.1]
  - - [2048, 512, 1, 3251, 2048, 2048, 2048, 512]
    - [1, 12908.7]
  - - [2048, 512, 1, 3257, 2048, 2048, 2048, 512]
    - [1, 12909.1]
  - - [2048, 512, 1, 3262, 2048, 2048, 2048, 512]
    - [1, 12878.3]
  - - [2048, 512, 1, 3268, 2048, 2048, 2048, 512]
    - [1, 12902.0]
  - - [2048, 512, 1, 3282, 2048, 2048, 2048, 512]
    - [1, 12918.3]
  - - [2048, 512, 1, 3286, 2048, 2048, 2048, 512]
    - [1, 12903.1]
  - - [2048, 512, 1, 3287, 2048, 2048, 2048, 512]
    - [1, 12907.0]
  - - [2048, 512, 1, 3293, 2048, 2048, 2048, 512]
    - [1, 12895.8]
  - - [2048, 512, 1, 3297, 2048, 2048, 2048, 512]
    - [1, 12892.2]
  - - [2048, 512, 1, 3307, 2048, 2048, 2048, 512]
    - [1, 12892.8]
  - - [2048, 512, 1, 3314, 2048, 2048, 2048, 512]
    - [1, 12901.0]
  - - [2048, 512, 1, 3315, 2048, 2048, 2048, 512]
    - [1, 12893.3]
  - - [2048, 512, 1, 3319, 2048, 2048, 2048, 512]
    - [1, 12920.4]
  - - [2048, 512, 1, 3322, 2048, 2048, 2048, 512]
    - [1, 12955.2]
  - - [2048, 512, 1, 3323, 2048, 2048, 2048, 512]
    - [1, 12886.2]
  - - [2048, 512, 1, 3324, 2048, 2048, 2048, 512]
    - [1, 12939.9]
  - - [2048, 512, 1, 3325, 2048, 2048, 2048, 512]
    - [1, 12916.9]
  - - [2048, 512, 1, 3327, 2048, 2048, 2048, 512]
    - [1, 12920.9]
  - - [2048, 512, 1, 3329, 2048, 2048, 2048, 512]
    - [1, 12860.0]
  - - [2048, 512, 1, 3332, 2048, 2048, 2048, 512]
    - [1, 12917.3]
  - - [2048, 512, 1, 3336, 2048, 2048, 2048, 512]
    - [1, 12967.3]
  - - [2048, 512, 1, 3339, 2048, 2048, 2048, 512]
    - [1, 12883.5]
  - - [2048, 512, 1, 3342, 2048, 2048, 2048, 512]
    - [1, 12872.3]
  - - [2048, 512, 1, 3344, 2048, 2048, 2048, 512]
    - [1, 12944.7]
  - - [2048, 512, 1, 3358, 2048, 2048, 2048, 512]
    - [1, 12949.1]
  - - [2048, 512, 1, 3360, 2048, 2048, 2048, 512]
    - [1, 12900.0]
  - - [2048, 512, 1, 3364, 2048, 2048, 2048, 512]
    - [1, 12930.5]
  - - [2048, 512, 1, 3365, 2048, 2048, 2048, 512]
    - [1, 12919.1]
  - - [2048, 512, 1, 3369, 2048, 2048, 2048, 512]
    - [0, 12889.2]
  - - [2048, 512, 1, 3371, 2048, 2048, 2048, 512]
    - [1, 12927.0]
  - - [2048, 512, 1, 3374, 2048, 2048, 2048, 512]
    - [1, 12900.8]
  - - [2048, 512, 1, 3376, 2048, 2048, 2048, 512]
    - [1, 12953.8]
  - - [2048, 512, 1, 3377, 2048, 2048, 2048, 512]
    - [1, 12919.8]
  - - [2048, 512, 1, 3378, 2048, 2048, 2048, 512]
    - [1, 12957.6]
  - - [2048, 512, 1, 3381, 2048, 2048, 2048, 512]
    - [1, 12905.0]
  - - [2048, 512, 1, 3382, 2048, 2048, 2048, 512]
    - [1, 12927.6]
  - - [2048, 512, 1, 3383, 2048, 2048, 2048, 512]
    - [1, 12950.3]
  - - [2048, 512, 1, 3384, 2048, 2048, 2048, 512]
    - [1, 12931.5]
  - - [2048, 512, 1, 3385, 2048, 2048, 2048, 512]
    - [1, 12894.0]
  - - [2048, 512, 1, 3386, 2048, 2048, 2048, 512]
    - [2, 12939.1]
  - - [2048, 512, 1, 3388, 2048, 2048, 2048, 512]
    - [1, 12924.2]
  - - [2048, 512, 1, 3390, 2048, 2048, 2048, 512]
    - [1, 12928.0]
  - - [2048, 512, 1, 3391, 2048, 2048, 2048, 512]
    - [1, 12946.9]
  - - [2048, 512, 1, 3396, 2048, 2048, 2048, 512]
    - [1, 12920.8]
  - - [2048, 512, 1, 3399, 2048, 2048, 2048, 512]
    - [1, 12894.8]
  - - [2048, 512, 1, 3402, 2048, 2048, 2048, 512]
    - [1, 12951.2]
  - - [2048, 512, 1, 3410, 2048, 2048, 2048, 512]
    - [1, 12932.8]
  - - [2048, 512, 1, 3412, 2048, 2048, 2048, 512]
    - [1, 12921.7]
  - - [2048, 512, 1, 3414, 2048, 2048, 2048, 512]
    - [1, 12940.5]
  - - [2048, 512, 1, 3415, 2048, 2048, 2048, 512]
    - [1, 12910.7]
  - - [2048, 512, 1, 3418, 2048, 2048, 2048, 512]
    - [1, 12933.2]
  - - [2048, 512, 1, 3420, 2048, 2048, 2048, 512]
    - [1, 12914.7]
  - - [2048, 512, 1, 3422, 2048, 2048, 2048, 512]
    - [1, 12937.1]
  - - [2048, 512, 1, 3425, 2048, 2048, 2048, 512]
    - [1, 12937.3]
  - - [2048, 512, 1, 3426, 2048, 2048, 2048, 512]
    - [2, 12929.9]
  - - [2048, 512, 1, 3427, 2048, 2048, 2048, 512]
    - [1, 12937.4]
  - - [2048, 512, 1, 3428, 2048, 2048, 2048, 512]
    - [1, 12922.6]
  - - [2048, 512, 1, 3430, 2048, 2048, 2048, 512]
    - [1, 12911.5]
  - - [2048, 512, 1, 3431, 2048, 2048, 2048, 512]
    - [1, 12915.3]
  - - [2048, 512, 1, 3432, 2048, 2048, 2048, 512]
    - [1, 12960.0]
  - - [2048, 512, 1, 3438, 2048, 2048, 2048, 512]
    - [1, 12960.3]
  - - [2048, 512, 1, 3439, 2048, 2048, 2048, 512]
    - [1, 12930.6]
  - - [2048, 512, 1, 3440, 2048, 2048, 2048, 512]
    - [2, 12945.5]
  - - [2048, 512, 1, 3443, 2048, 2048, 2048, 512]
    - [1, 12945.6]
  - - [2048, 512, 1, 3445, 2048, 2048, 2048, 512]
    - [1, 12942.0]
  - - [2048, 512, 1, 3447, 2048, 2048, 2048, 512]
    - [0, 12795.5]
  - - [2048, 512, 1, 3448, 2048, 2048, 2048, 512]
    - [1, 12931.0]
  - - [2048, 512, 1, 3450, 2048, 2048, 2048, 512]
    - [1, 12964.5]
  - - [2048, 512, 1, 3451, 2048, 2048, 2048, 512]
    - [2, 12923.8]
  - - [2048, 512, 1, 3452, 2048, 2048, 2048, 512]
    - [1, 12946.0]
  - - [2048, 512, 1, 3453, 2048, 2048, 2048, 512]
    - [2, 12927.6]
  - - [2048, 512, 1, 3455, 2048, 2048, 2048, 512]
    - [1, 12912.9]
  - - [2048, 512, 1, 3456, 2048, 2048, 2048, 512]
    - [1, 12957.3]
  - - [2048, 512, 1, 3457, 2048, 2048, 2048, 512]
    - [1, 12957.3]
  - - [2048, 512, 1, 3458, 2048, 2048, 2048, 512]
    - [1, 12964.8]
  - - [2048, 512, 1, 3459, 2048, 2048, 2048, 512]
    - [1, 12924.2]
  - - [2048, 512, 1, 3460, 2048, 2048, 2048, 512]
    - [1, 12935.3]
  - - [2048, 512, 1, 3461, 2048, 2048, 2048, 512]
    - [1, 12909.6]
  - - [2048, 512, 1, 3462, 2048, 2048, 2048, 512]
    - [1, 12939.1]
  - - [2048, 512, 1, 3466, 2048, 2048, 2048, 512]
    - [1, 12983.7]
  - - [2048, 512, 1, 3467, 2048, 2048, 2048, 512]
    - [1, 12928.3]
  - - [2048, 512, 1, 3468, 2048, 2048, 2048, 512]
    - [1, 12935.7]
  - - [2048, 512, 1, 3470, 2048, 2048, 2048, 512]
    - [1, 12946.8]
  - - [2048, 512, 1, 3471, 2048, 2048, 2048, 512]
    - [1, 12859.1]
  - - [2048, 512, 1, 3472, 2048, 2048, 2048, 512]
    - [1, 12983.9]
  - - [2048, 512, 1, 3475, 2048, 2048, 2048, 512]
    - [1, 12910.4]
  - - [2048, 512, 1, 3476, 2048, 2048, 2048, 512]
    - [1, 12917.7]
  - - [2048, 512, 1, 3477, 2048, 2048, 2048, 512]
    - [1, 12943.5]
  - - [2048, 512, 1, 3478, 2048, 2048, 2048, 512]
    - [1, 12958.2]
  - - [2048, 512, 1, 3479, 2048, 2048, 2048, 512]
    - [1, 12932.6]
  - - [2048, 512, 1, 3480, 2048, 2048, 2048, 512]
    - [1, 12951.0]
  - - [2048, 512, 1, 3481, 2048, 2048, 2048, 512]
    - [1, 12877.9]
  - - [2048, 512, 1, 3483, 2048, 2048, 2048, 512]
    - [1, 12921.8]
  - - [2048, 512, 1, 3484, 2048, 2048, 2048, 512]
    - [1, 12936.5]
  - - [2048, 512, 1, 3487, 2048, 2048, 2048, 512]
    - [1, 12933.0]
  - - [2048, 512, 1, 3489, 2048, 2048, 2048, 512]
    - [1, 12925.7]
  - - [2048, 512, 1, 3490, 2048, 2048, 2048, 512]
    - [1, 12936.8]
  - - [2048, 512, 1, 3491, 2048, 2048, 2048, 512]
    - [1, 12940.5]
  - - [2048, 512, 1, 3493, 2048, 2048, 2048, 512]
    - [2, 12947.9]
  - - [2048, 512, 1, 3494, 2048, 2048, 2048, 512]
    - [1, 12929.6]
  - - [2048, 512, 1, 3495, 2048, 2048, 2048, 512]
    - [1, 12944.3]
  - - [2048, 512, 1, 3497, 2048, 2048, 2048, 512]
    - [1, 12962.7]
  - - [2048, 512, 1, 3498, 2048, 2048, 2048, 512]
    - [1, 12915.3]
  - - [2048, 512, 1, 3499, 2048, 2048, 2048, 512]
    - [1, 12937.2]
  - - [2048, 512, 1, 3501, 2048, 2048, 2048, 512]
    - [1, 12940.9]
  - - [2048, 512, 1, 3503, 2048, 2048, 2048, 512]
    - [1, 12926.5]
  - - [2048, 512, 1, 3507, 2048, 2048, 2048, 512]
    - [1, 12966.8]
  - - [2048, 512, 1, 3508, 2048, 2048, 2048, 512]
    - [1, 12908.6]
  - - [2048, 512, 1, 3509, 2048, 2048, 2048, 512]
    - [1, 12952.2]
  - - [2048, 512, 1, 3511, 2048, 2048, 2048, 512]
    - [1, 12937.8]
  - - [2048, 512, 1, 3514, 2048, 2048, 2048, 512]
    - [1, 12930.6]
  - - [2048, 512, 1, 3515, 2048, 2048, 2048, 512]
    - [1, 12916.2]
  - - [2048, 512, 1, 3517, 2048, 2048, 2048, 512]
    - [1, 12941.7]
  - - [2048, 512, 1, 3518, 2048, 2048, 2048, 512]
    - [1, 12912.7]
  - - [2048, 512, 1, 3519, 2048, 2048, 2048, 512]
    - [1, 12981.8]
  - - [2048, 512, 1, 3520, 2048, 2048, 2048, 512]
    - [1, 12927.3]
  - - [2048, 512, 1, 3523, 2048, 2048, 2048, 512]
    - [1, 12960.1]
  - - [2048, 512, 1, 3528, 2048, 2048, 2048, 512]
    - [1, 12982.2]
  - - [2048, 512, 1, 3529, 2048, 2048, 2048, 512]
    - [1, 12945.9]
  - - [2048, 512, 1, 3530, 2048, 2048, 2048, 512]
    - [1, 12964.0]
  - - [2048, 512, 1, 3532, 2048, 2048, 2048, 512]
    - [1, 12946.0]
  - - [2048, 512, 1, 3533, 2048, 2048, 2048, 512]
    - [1, 12902.8]
  - - [2048, 512, 1, 3534, 2048, 2048, 2048, 512]
    - [1, 12964.2]
  - - [2048, 512, 1, 3538, 2048, 2048, 2048, 512]
    - [1, 12953.5]
  - - [2048, 512, 1, 3539, 2048, 2048, 2048, 512]
    - [1, 12978.9]
  - - [2048, 512, 1, 3541, 2048, 2048, 2048, 512]
    - [1, 12928.4]
  - - [2048, 512, 1, 3547, 2048, 2048, 2048, 512]
    - [1, 12928.7]
  - - [2048, 512, 1, 3548, 2048, 2048, 2048, 512]
    - [1, 12925.1]
  - - [2048, 512, 1, 3552, 2048, 2048, 2048, 512]
    - [1, 12975.8]
  - - [2048, 512, 1, 3564, 2048, 2048, 2048, 512]
    - [2, 12933.1]
  - - [2048, 512, 1, 3575, 2048, 2048, 2048, 512]
    - [1, 12955.1]
  - - [2048, 512, 1, 3598, 2048, 2048, 2048, 512]
    - [1, 12931.2]
  - - [2048, 512, 1, 3599, 2048, 2048, 2048, 512]
    - [1, 12945.4]
  - - [2048, 512, 1, 3608, 2048, 2048, 2048, 512]
    - [1, 12984.9]
  - - [2048, 512, 1, 3780, 2048, 2048, 2048, 512]
    - [1, 12980.2]
  - - [2048, 512, 1, 3796, 2048, 2048, 2048, 512]
    - [1, 12950.3]
  - - [2048, 512, 1, 3822, 2048, 2048, 2048, 512]
    - [1, 12931.3]
  - - [2048, 512, 1, 3840, 2048, 2048, 2048, 512]
    - [1, 12992.2]
  - - [2048, 512, 1, 3859, 2048, 2048, 2048, 512]
    - [1, 12976.1]
  - - [2048, 512, 1, 3870, 2048, 2048, 2048, 512]
    - [1, 12996.4]
  - - [2048, 512, 1, 3876, 2048, 2048, 2048, 512]
    - [1, 12976.7]
  - - [2048, 512, 1, 3906, 2048, 2048, 2048, 512]
    - [1, 12964.5]
  - - [2048, 512, 1, 3910, 2048, 2048, 2048, 512]
    - [1, 12987.7]
  - - [2048, 512, 1, 3925, 2048, 2048, 2048, 512]
    - [1, 12978.3]
  - - [2048, 512, 1, 3942, 2048, 2048, 2048, 512]
    - [2, 12939.9]
  - - [2048, 512, 1, 3944, 2048, 2048, 2048, 512]
    - [1, 12982.2]
  - - [2048, 512, 1, 3955, 2048, 2048, 2048, 512]
    - [2, 12969.5]
  - - [2048, 512, 1, 3968, 2048, 2048, 2048, 512]
    - [1, 13028.5]
  - - [2048, 512, 1, 3969, 2048, 2048, 2048, 512]
    - [1, 12976.5]
  - - [2048, 512, 1, 3976, 2048, 2048, 2048, 512]
    - [2, 13035.1]
  - - [2048, 512, 1, 3977, 2048, 2048, 2048, 512]
    - [1, 13009.1]
  - - [2048, 512, 1, 3978, 2048, 2048, 2048, 512]
    - [1, 12967.1]
  - - [2048, 512, 1, 3990, 2048, 2048, 2048, 512]
    - [1, 12977.2]
  - - [2048, 512, 1, 3995, 2048, 2048, 2048, 512]
    - [1, 13009.6]
  - - [2048, 512, 1, 3996, 2048, 2048, 2048, 512]
    - [1, 12999.9]
  - - [2048, 512, 1, 3999, 2048, 2048, 2048, 512]
    - [1, 13003.2]
  - - [2048, 512, 1, 4005, 2048, 2048, 2048, 512]
    - [1, 13035.7]
  - - [2048, 512, 1, 4012, 2048, 2048, 2048, 512]
    - [1, 13003.5]
  - - [2048, 512, 1, 4020, 2048, 2048, 2048, 512]
    - [1, 13013.4]
  - - [2048, 512, 1, 4026, 2048, 2048, 2048, 512]
    - [1, 12997.5]
  - - [2048, 512, 1, 4030, 2048, 2048, 2048, 512]
    - [1, 13026.5]
  - - [2048, 512, 1, 4032, 2048, 2048, 2048, 512]
    - [1, 13010.5]
  - - [512, 512, 1, 3780, 512, 512, 512, 512]
    - [31, 9491.47]
  - - [512, 512, 1, 3796, 512, 512, 512, 512]
    - [29, 9495.22]
  - - [512, 512, 1, 3822, 512, 512, 512, 512]
    - [31, 9769.1]
  - - [512, 512, 1, 3840, 512, 512, 512, 512]
    - [31, 9118.09]
  - - [512, 512, 1, 3859, 512, 512, 512, 512]
    - [31, 9380.69]
  - - [512, 512, 1, 3870, 512, 512, 512, 512]
    - [31, 9324.42]
  - - [512, 512, 1, 3876, 512, 512, 512, 512]
    - [31, 9190.26]
  - - [512, 512, 1, 3906, 512, 512, 512, 512]
    - [29, 9201.42]
  - - [512, 512, 1, 3910, 512, 512, 512, 512]
    - [31, 9365.71]
  - - [512, 512, 1, 3925, 512, 512, 512, 512]
    - [31, 9605.26]
  - - [512, 512, 1, 3927, 512, 512, 512, 512]
    - [31, 9171.81]
  - - [512, 512, 1, 3942, 512, 512, 512, 512]
    - [31, 9618.13]
  - - [512, 512, 1, 3944, 512, 512, 512, 512]
    - [30, 9244.42]
  - - [512, 512, 1, 3955, 512, 512, 512, 512]
    - [27, 9276.84]
  - - [512, 512, 1, 3968, 512, 512, 512, 512]
    - [31, 9340.76]
  - - [512, 512, 1, 3969, 512, 512, 512, 512]
    - [31, 9171.8]
  - - [512, 512, 1, 3976, 512, 512, 512, 512]
    - [31, 9393.34]
  - - [512, 512, 1, 3977, 512, 512, 512, 512]
    - [31, 9798.37]
  - - [512, 512, 1, 3978, 512, 512, 512, 512]
    - [31, 9860.14]
  - - [512, 512, 1, 3990, 512, 512, 512, 512]
    - [29, 9487.98]
  - - [512, 512, 1, 3995, 512, 512, 512, 512]
    - [31, 9343.91]
  - - [512, 512, 1, 3996, 512, 512, 512, 512]
    - [28, 9195.29]
  - - [512, 512, 1, 3999, 512, 512, 512, 512]
    - [31, 9859.99]
  - - [512, 512, 1, 4005, 512, 512, 512, 512]
    - [31, 9897.12]
  - - [512, 512, 1, 4012, 512, 512, 512, 512]
    - [29, 9485.22]
  - - [512, 512, 1, 4020, 512, 512, 512, 512]
    - [29, 9497.29]
  - - [512, 512, 1, 4026, 512, 512, 512, 512]
    - [31, 9296.97]
  - - [512, 512, 1, 4030, 512, 512, 512, 512]
    - [31, 9709.93]
  - - [512, 512, 1, 4032, 512, 512, 512, 512]
    - [31, 9941.35]
  - - [512, 512, 1, 4050, 512, 512, 512, 512]
    - [26, 9171.42]
  - - [512, 512, 1, 4059, 512, 512, 512, 512]
    - [29, 9185.45]
  - - [64, 12, 2520, 12, 64, 64, 64, 12]
    - [20, 537.606]
  - - [64, 13, 2336, 13, 64, 64, 64, 13]
    - [8, 644.554]
  - - [64, 14, 2184, 14, 64, 64, 64, 14]
    - [7, 706.094]
  - - [64, 15, 2048, 15, 64, 64, 64, 15]
    - [20, 772.84]
  - - [64, 16, 1920, 16, 64, 64, 64, 16]
    - [22, 833.085]
  - - [64, 17, 1816, 17, 64, 64, 64, 17]
    - [20, 939.282]
  - - [64, 18, 1720, 18, 64, 64, 64, 18]
    - [5, 1008.65]
  - - [64, 19, 1632, 19, 64, 64, 64, 19]
    - [21, 1085.99]
  - - [64, 21, 1488, 21, 64, 64, 64, 21]
    - [11, 1209.6]
  - - [64, 23, 1360, 23, 64, 64, 64, 23]
    - [9, 1403.79]
  - - [64, 25, 1256, 25, 64, 64, 64, 25]
    - [9, 1550.62]
  - - [64, 27, 1168, 27, 64, 64, 64, 27]
    - [21, 1686.08]
  - - [64, 29, 1088, 29, 64, 64, 64, 29]
    - [21, 1794.13]
  - - [64, 32, 992, 32, 64, 64, 64, 32]
    - [9, 1930.28]
  - - [64, 35, 904, 35, 64, 64, 64, 35]
    - [21, 2307.08]
  - - [64, 38, 840, 38, 64, 64, 64, 38]
    - [21, 2673.19]
  - - [64, 41, 776, 41, 64, 64, 64, 41]
    - [21, 2835.77]
  - - [64, 45, 712, 45, 64, 64, 64, 45]
    - [9, 3212.92]
  - - [64, 49, 648, 49, 64, 64, 64, 49]
    - [9, 3216.22]
  - - [64, 54, 592, 54, 64, 64, 64, 54]
    - [9, 3762.99]
  - - [64, 59, 544, 59, 64, 64, 64, 59]
    - [25, 3874.5]
  - - [64, 64, 496, 64, 64, 64, 64, 64]
    - [13, 3719.21]
  - - [64, 64, 496, 65, 64, 64, 64, 64]
    - [25, 4006.52]
  - - [64, 65, 496, 65, 64, 64, 64, 65]
    - [12, 4069.13]
  - - [64, 71, 448, 71, 64, 64, 64, 71]
    - [19, 5089.28]
  - - [64, 77, 408, 77, 64, 64, 64, 77]
    - [18, 5216.24]
  - - [64, 77, 408, 78, 64, 64, 64, 77]
    - [11, 5356.17]
  - - [64, 78, 408, 78, 64, 64, 64, 78]
    - [19, 5267.42]
  - - [64, 85, 376, 85, 64, 64, 64, 85]
    - [9, 5460.5]
  - - [64, 93, 344, 93, 64, 64, 64, 93]
    - [12, 6685.97]
  - - [64, 102, 312, 102, 64, 64, 64, 102]
    - [12, 6999.56]
  - - [64, 112, 288, 112, 64, 64, 64, 112]
    - [17, 7298.33]
  - - [64, 122, 264, 122, 64, 64, 64, 122]
    - [10, 7379.11]
  - - [64, 123, 264, 122, 64, 64, 64, 123]
    - [12, 7457.1]
  - - [64, 123, 264, 123, 64, 64, 64, 123]
    - [6, 7553.77]
  - - [64, 134, 240, 134, 64, 64, 64, 134]
    - [14, 7108.35]
  - - [64, 135, 240, 134, 64, 64, 64, 135]
    - [16, 7073.89]
  - - [64, 135, 240, 135, 64, 64, 64, 135]
    - [15, 6998.4]
- null
