Tensile/Configs/miopen/archives/bert/2020-01-19/exact/arcturus_Cijk_Ailk_Bljk_SB.yaml
- {MinimumRequiredVersion: 4.15.0}
- arcturus
- gfx908
- [Device 7380, Device 7388, Device 738c, Device 7390, Device 731f]
    SolutionIndex: 0
    SolutionNameMin: Cijk_Ailk_Bljk_SB_MT64x64x8_SE_EPS1_FL0_GRVW2_LPB0_PGR1_PLR1_TT4_4_USFGRO0_VW2_WGM8
    SolutionIndex: 1
    SolutionNameMin: Cijk_Ailk_Bljk_SB_MT64x64x16_SE_EPS1_FL0_GRVW2_LPB0_PGR1_PLR1_TT4_4_USFGRO0_VW2_WGM8
    SolutionIndex: 2
    SolutionNameMin: Cijk_Ailk_Bljk_SB_MT64x64x8_SE_EPS1_FL0_GRVW4_LPB0_PGR1_PLR1_TT4_4_USFGRO0_VW2_WGM8
    SolutionIndex: 3
    SolutionNameMin: Cijk_Ailk_Bljk_SB_MT64x64x16_SE_EPS1_FL0_GRVW4_LPB0_PGR1_PLR0_TT4_4_USFGRO0_VW4_WGM8
    SolutionIndex: 4
    SolutionNameMin: Cijk_Ailk_Bljk_SB_MT64x64x16_SE_EPS1_FL0_GRVW4_LPB0_PGR1_PLR1_TT4_4_USFGRO0_VW4_WGM1
    SolutionIndex: 5
    SolutionNameMin: Cijk_Ailk_Bljk_SB_MT64x64x16_SE_EPS1_FL0_GRVW4_LPB0_PGR1_PLR1_TT4_4_USFGRO0_VW4_WGM8
    SolutionIndex: 6
    SolutionNameMin: Cijk_Ailk_Bljk_SB_MT64x64x32_SE_EPS1_FL0_GRVW4_LPB0_PGR1_PLR1_TT4_4_USFGRO0_VW4_WGM8
    SolutionIndex: 7
    SolutionNameMin: Cijk_Ailk_Bljk_SB_MT64x64x8_SE_EPS1_FL1_GRVW2_LPB0_PGR1_PLR1_TT4_4_USFGRO0_VW2_WGM8
    SolutionIndex: 8
    SolutionNameMin: Cijk_Ailk_Bljk_SB_MT64x64x16_SE_EPS1_FL1_GRVW2_LPB0_PGR1_PLR1_TT4_4_USFGRO0_VW2_WGM8
    SolutionIndex: 9
    SolutionNameMin: Cijk_Ailk_Bljk_SB_MT64x64x16_SE_EPS1_FL1_GRVW4_LPB0_PGR1_PLR1_TT4_4_USFGRO0_VW4_WGM8
    SolutionIndex: 10
    SolutionNameMin: Cijk_Ailk_Bljk_SB_MT64x64x32_SE_EPS1_FL1_GRVW4_LPB0_PGR1_PLR1_TT4_4_USFGRO0_VW4_WGM8
    SolutionIndex: 11
    SolutionNameMin: Cijk_Ailk_Bljk_SB_MT96x64x16_SE_EPS1_FL0_GRVW2_LPB0_PGR1_PLR1_TT6_4_USFGRO0_VW2_WGM1
    SolutionIndex: 12
    SolutionNameMin: Cijk_Ailk_Bljk_SB_MT96x64x8_SE_EPS1_FL1_GRVW2_LPB0_PGR1_PLR1_TT6_4_USFGRO0_VW2_WGM8
    SolutionIndex: 13
    SolutionNameMin: Cijk_Ailk_Bljk_SB_MT96x64x16_SE_EPS1_FL1_GRVW2_LPB0_PGR1_PLR1_TT6_4_USFGRO0_VW2_WGM1
    SolutionIndex: 14
    SolutionNameMin: Cijk_Ailk_Bljk_SB_MT64x96x16_SE_EPS0_FL0_GRVW2_LPB0_PGR0_PLR1_TT4_6_USFGRO0_VW2_WGM8
    SolutionIndex: 15
    SolutionNameMin: Cijk_Ailk_Bljk_SB_MT64x96x16_SE_EPS0_FL1_GRVW2_LPB0_PGR0_PLR1_TT4_6_USFGRO0_VW2_WGM8
    SolutionIndex: 16
    SolutionNameMin: Cijk_Ailk_Bljk_SB_MT64x96x16_SE_EPS1_FL1_GRVW2_LPB0_PGR1_PLR1_TT4_6_USFGRO0_VW2_WGM8
    SolutionIndex: 17
    SolutionNameMin: Cijk_Ailk_Bljk_SB_MT64x96x8_SE_EPS1_FL1_GRVW4_LPB0_PGR1_PLR0_TT4_6_USFGRO0_VW2_WGM8
    SolutionIndex: 18
    SolutionNameMin: Cijk_Ailk_Bljk_SB_MT64x96x8_SE_EPS1_FL1_GRVW4_LPB0_PGR1_PLR1_TT4_6_USFGRO0_VW2_WGM8
    SolutionIndex: 19
    SolutionNameMin: Cijk_Ailk_Bljk_SB_MT64x128x8_SE_EPS0_FL0_GRVW1_LPB0_PGR0_PLR0_TT4_8_USFGRO1_VW2_WGM1
    SolutionIndex: 20
    SolutionNameMin: Cijk_Ailk_Bljk_SB_MT64x128x8_SE_EPS0_FL0_GRVW2_LPB0_PGR0_PLR1_TT4_8_USFGRO0_VW2_WGM8
    SolutionIndex: 21
    SolutionNameMin: Cijk_Ailk_Bljk_SB_MT64x128x8_SE_EPS0_FL0_GRVW4_LPB0_PGR0_PLR0_TT4_8_USFGRO0_VW2_WGM1
    SolutionIndex: 22
    SolutionNameMin: Cijk_Ailk_Bljk_SB_MT64x128x8_SE_EPS1_FL0_GRVW4_LPB0_PGR1_PLR0_TT4_8_USFGRO0_VW2_WGM1
    SolutionIndex: 23
    SolutionNameMin: Cijk_Ailk_Bljk_SB_MT64x128x8_SE_EPS1_FL0_GRVW4_LPB0_PGR1_PLR0_TT4_8_USFGRO0_VW2_WGM8
    SolutionIndex: 24
    SolutionNameMin: Cijk_Ailk_Bljk_SB_MT64x128x8_SE_EPS0_FL0_GRVW4_LPB0_PGR0_PLR1_TT4_8_USFGRO0_VW2_WGM1
    SolutionIndex: 25
    SolutionNameMin: Cijk_Ailk_Bljk_SB_MT64x128x8_SE_EPS1_FL0_GRVW4_LPB0_PGR1_PLR1_TT4_8_USFGRO0_VW2_WGM8
    SolutionIndex: 26
    SolutionNameMin: Cijk_Ailk_Bljk_SB_MT64x128x8_SE_EPS1_FL1_GRVW2_LPB0_PGR1_PLR0_TT4_8_USFGRO0_VW2_WGM1
    SolutionIndex: 27
    SolutionNameMin: Cijk_Ailk_Bljk_SB_MT64x128x8_SE_EPS0_FL1_GRVW4_LPB0_PGR0_PLR0_TT4_8_USFGRO0_VW2_WGM1
    SolutionIndex: 28
    SolutionNameMin: Cijk_Ailk_Bljk_SB_MT64x128x8_SE_EPS1_FL1_GRVW4_LPB0_PGR1_PLR0_TT4_8_USFGRO0_VW2_WGM1
    SolutionIndex: 29
    SolutionNameMin: Cijk_Ailk_Bljk_SB_MT64x128x8_SE_EPS1_FL1_GRVW4_LPB0_PGR1_PLR0_TT4_8_USFGRO0_VW2_WGM8
    SolutionIndex: 30
    SolutionNameMin: Cijk_Ailk_Bljk_SB_MT64x128x8_SE_EPS1_FL1_GRVW4_LPB0_PGR1_PLR1_TT4_8_USFGRO0_VW2_WGM1
    SolutionIndex: 31
    SolutionNameMin: Cijk_Ailk_Bljk_SB_MT64x128x8_SE_EPS1_FL1_GRVW4_LPB0_PGR1_PLR1_TT4_8_USFGRO0_VW2_WGM8
    SolutionIndex: 32
    SolutionNameMin: Cijk_Ailk_Bljk_SB_MT128x64x8_SE_EPS0_FL0_GRVW1_LPB0_PGR0_PLR0_TT8_4_USFGRO1_VW2_WGM1
    SolutionIndex: 33
    SolutionNameMin: Cijk_Ailk_Bljk_SB_MT128x64x8_SE_EPS1_FL0_GRVW2_LPB0_PGR1_PLR0_TT8_4_USFGRO0_VW2_WGM1
    SolutionIndex: 34
    SolutionNameMin: Cijk_Ailk_Bljk_SB_MT128x64x8_SE_EPS1_FL0_GRVW2_LPB0_PGR1_PLR0_TT8_4_USFGRO0_VW2_WGM8
    SolutionIndex: 35
    SolutionNameMin: Cijk_Ailk_Bljk_SB_MT128x64x8_SE_EPS0_FL0_GRVW2_LPB0_PGR0_PLR1_TT8_4_USFGRO0_VW2_WGM1
    SolutionIndex: 36
    SolutionNameMin: Cijk_Ailk_Bljk_SB_MT128x64x8_SE_EPS1_FL0_GRVW2_LPB0_PGR1_PLR1_TT8_4_USFGRO0_VW2_WGM8
    SolutionIndex: 37
    SolutionNameMin: Cijk_Ailk_Bljk_SB_MT128x64x8_SE_EPS1_FL0_GRVW4_LPB0_PGR1_PLR0_TT8_4_USFGRO0_VW4_WGM8
    SolutionIndex: 38
    SolutionNameMin: Cijk_Ailk_Bljk_SB_MT128x64x8_SE_EPS1_FL0_GRVW4_LPB0_PGR1_PLR1_TT8_4_USFGRO0_VW4_WGM8
    SolutionIndex: 39
    SolutionNameMin: Cijk_Ailk_Bljk_SB_MT128x64x16_SE_EPS1_FL0_GRVW4_LPB0_PGR1_PLR1_TT8_4_USFGRO0_VW4_WGM1
    SolutionIndex: 40
    SolutionNameMin: Cijk_Ailk_Bljk_SB_MT128x64x16_SE_EPS1_FL0_GRVW4_LPB0_PGR1_PLR1_TT8_4_USFGRO0_VW4_WGM8
    SolutionIndex: 41
    SolutionNameMin: Cijk_Ailk_Bljk_SB_MT128x64x32_SE_EPS1_FL0_GRVW4_LPB0_PGR1_PLR1_TT8_4_USFGRO0_VW4_WGM8
    SolutionIndex: 42
    SolutionNameMin: Cijk_Ailk_Bljk_SB_MT128x64x8_SE_EPS1_FL1_GRVW2_LPB0_PGR1_PLR0_TT8_4_USFGRO0_VW2_WGM8
    SolutionIndex: 43
    SolutionNameMin: Cijk_Ailk_Bljk_SB_MT128x64x8_SE_EPS0_FL1_GRVW2_LPB0_PGR0_PLR1_TT8_4_USFGRO0_VW2_WGM1
    SolutionIndex: 44
    SolutionNameMin: Cijk_Ailk_Bljk_SB_MT128x64x8_SE_EPS1_FL1_GRVW2_LPB0_PGR1_PLR1_TT8_4_USFGRO0_VW2_WGM8
    SolutionIndex: 45
    SolutionNameMin: Cijk_Ailk_Bljk_SB_MT128x64x8_SE_EPS1_FL1_GRVW4_LPB0_PGR1_PLR0_TT8_4_USFGRO0_VW4_WGM8
    SolutionIndex: 46
    SolutionNameMin: Cijk_Ailk_Bljk_SB_MT128x64x16_SE_EPS1_FL1_GRVW4_LPB0_PGR1_PLR0_TT8_4_USFGRO0_VW4_WGM1
    SolutionIndex: 47
    SolutionNameMin: Cijk_Ailk_Bljk_SB_MT128x64x16_SE_EPS1_FL1_GRVW4_LPB0_PGR1_PLR0_TT8_4_USFGRO0_VW4_WGM8
    SolutionIndex: 48
    SolutionNameMin: Cijk_Ailk_Bljk_SB_MT128x64x8_SE_EPS1_FL1_GRVW4_LPB0_PGR1_PLR1_TT8_4_USFGRO0_VW4_WGM8
    SolutionIndex: 49
    SolutionNameMin: Cijk_Ailk_Bljk_SB_MT128x64x16_SE_EPS1_FL1_GRVW4_LPB0_PGR1_PLR1_TT8_4_USFGRO0_VW4_WGM1
    SolutionIndex: 50
    SolutionNameMin: Cijk_Ailk_Bljk_SB_MT128x64x16_SE_EPS1_FL1_GRVW4_LPB0_PGR1_PLR1_TT8_4_USFGRO0_VW4_WGM8
    SolutionIndex: 51
    SolutionNameMin: Cijk_Ailk_Bljk_SB_MT32x64x32_SE_EPS1_FL0_GRVW4_LPB4_PGR1_PLR1_TT4_4_USFGRO0_VW4_WGM8
    SolutionIndex: 52
    SolutionNameMin: Cijk_Ailk_Bljk_SB_MT64x32x32_SE_EPS1_FL0_GRVW4_LPB0_PGR1_PLR1_TT4_4_USFGRO0_VW4_WGM8
    SolutionIndex: 53
    SolutionNameMin: Cijk_Ailk_Bljk_SB_MT64x32x32_SE_EPS1_FL0_GRVW4_LPB4_PGR1_PLR1_TT4_4_USFGRO0_VW4_WGM8
    SolutionIndex: 54
    SolutionNameMin: Cijk_Ailk_Bljk_SB_MT64x32x32_SE_EPS1_FL1_GRVW2_LPB2_PGR1_PLR1_TT4_4_USFGRO0_VW2_WGM8
    SolutionIndex: 55
    SolutionNameMin: Cijk_Ailk_Bljk_SB_MT64x32x32_SE_EPS1_FL1_GRVW4_LPB0_PGR1_PLR1_TT4_4_USFGRO0_VW4_WGM8
    SolutionIndex: 56
    SolutionNameMin: Cijk_Ailk_Bljk_SB_MT64x32x16_SE_EPS1_FL1_GRVW4_LPB4_PGR1_PLR1_TT4_4_USFGRO0_VW4_WGM8
    SolutionIndex: 57
    SolutionNameMin: Cijk_Ailk_Bljk_SB_MT64x32x32_SE_EPS1_FL1_GRVW4_LPB4_PGR1_PLR1_TT4_4_USFGRO0_VW4_WGM8
    SolutionIndex: 58
    SolutionNameMin: Cijk_Ailk_Bljk_SB_MT16x32x32_SE_EPS1_FL0_GRVW2_LPB2_PGR1_PLR1_TT4_2_USFGRO0_VW2_WGM8
    SolutionIndex: 59
    SolutionNameMin: Cijk_Ailk_Bljk_SB_MT16x32x32_SE_EPS1_FL0_GRVW4_LPB2_PGR1_PLR1_TT4_2_USFGRO0_VW2_WGM8
    SolutionIndex: 60
    SolutionNameMin: Cijk_Ailk_Bljk_SB_MT32x16x32_SE_EPS1_FL0_GRVW2_LPB2_PGR1_PLR1_TT2_4_USFGRO0_VW2_WGM8
    SolutionIndex: 61
    SolutionNameMin: Cijk_Ailk_Bljk_SB_MT32x16x32_SE_EPS1_FL1_GRVW2_LPB2_PGR1_PLR0_TT2_4_USFGRO0_VW2_WGM8
    SolutionIndex: 62
    SolutionNameMin: Cijk_Ailk_Bljk_SB_MT32x16x32_SE_EPS1_FL1_GRVW2_LPB2_PGR1_PLR1_TT2_4_USFGRO0_VW2_WGM8
    SolutionIndex: 63
    SolutionNameMin: Cijk_Ailk_Bljk_SB_MT64x16x16_SE_EPS1_FL0_GRVW4_LPB0_PGR1_PLR1_TT4_4_USFGRO0_VW4_WGM8
    SolutionIndex: 64
    SolutionNameMin: Cijk_Ailk_Bljk_SB_MT64x16x16_SE_EPS1_FL0_GRVW4_LPB4_PGR1_PLR1_TT4_4_USFGRO0_VW4_WGM8
    SolutionIndex: 65
    SolutionNameMin: Cijk_Ailk_Bljk_SB_MT64x16x32_SE_EPS1_FL0_GRVW4_LPB4_PGR1_PLR1_TT4_4_USFGRO0_VW4_WGM8
    SolutionIndex: 66
    SolutionNameMin: Cijk_Ailk_Bljk_SB_MT64x16x32_SE_EPS1_FL1_GRVW4_LPB4_PGR1_PLR1_TT4_4_USFGRO0_VW4_WGM8
    SolutionIndex: 67
    SolutionNameMin: Cijk_Ailk_Bljk_SB_MT64x128x8_SE_EPS0_FL0_GRVW1_LPB2_PGR0_PLR0_TT4_8_USFGRO1_VW2_WGM1
    SolutionIndex: 68
    SolutionNameMin: Cijk_Ailk_Bljk_SB_MT64x128x8_SE_EPS0_FL0_GRVW1_LPB2_PGR0_PLR0_TT4_8_USFGRO1_VW2_WGM8
    SolutionIndex: 69
    SolutionNameMin: Cijk_Ailk_Bljk_SB_MT64x128x16_SE_EPS0_FL0_GRVW1_LPB2_PGR0_PLR0_TT4_8_USFGRO1_VW2_WGM1
    SolutionIndex: 70
    SolutionNameMin: Cijk_Ailk_Bljk_SB_MT64x128x16_SE_EPS0_FL0_GRVW1_LPB2_PGR0_PLR0_TT4_8_USFGRO1_VW2_WGM8
    SolutionIndex: 71
    SolutionNameMin: Cijk_Ailk_Bljk_SB_MT64x128x8_SE_EPS0_FL0_GRVW1_LPB2_PGR0_PLR1_TT4_8_USFGRO1_VW2_WGM1
    SolutionIndex: 72
    SolutionNameMin: Cijk_Ailk_Bljk_SB_MT64x128x8_SE_EPS1_FL0_GRVW1_LPB2_PGR1_PLR1_TT4_8_USFGRO1_VW2_WGM1
    SolutionIndex: 73
    SolutionNameMin: Cijk_Ailk_Bljk_SB_MT64x128x16_SE_EPS0_FL0_GRVW1_LPB2_PGR0_PLR1_TT4_8_USFGRO1_VW2_WGM8
    SolutionIndex: 74
    SolutionNameMin: Cijk_Ailk_Bljk_SB_MT64x128x32_SE_EPS0_FL0_GRVW1_LPB2_PGR0_PLR1_TT4_8_USFGRO1_VW2_WGM1
    SolutionIndex: 75
    SolutionNameMin: Cijk_Ailk_Bljk_SB_MT64x128x8_SE_EPS1_FL0_GRVW1_LPB4_PGR1_PLR1_TT4_8_USFGRO1_VW4_WGM8
    SolutionIndex: 76
    SolutionNameMin: Cijk_Ailk_Bljk_SB_MT64x128x32_SE_EPS0_FL0_GRVW1_LPB4_PGR0_PLR1_TT4_8_USFGRO1_VW4_WGM1
    SolutionIndex: 77
    SolutionNameMin: Cijk_Ailk_Bljk_SB_MT64x128x8_SE_EPS1_FL0_GRVW2_LPB2_PGR1_PLR1_TT4_8_USFGRO0_VW2_WGM1
    SolutionIndex: 78
    SolutionNameMin: Cijk_Ailk_Bljk_SB_MT64x128x8_SE_EPS0_FL0_GRVW2_LPB2_PGR0_PLR1_TT4_8_USFGRO0_VW2_WGM8
    SolutionIndex: 79
    SolutionNameMin: Cijk_Ailk_Bljk_SB_MT64x128x8_SE_EPS1_FL0_GRVW2_LPB2_PGR1_PLR1_TT4_8_USFGRO0_VW2_WGM8
    SolutionIndex: 80
    SolutionNameMin: Cijk_Ailk_Bljk_SB_MT64x128x8_SE_EPS1_FL0_GRVW4_LPB2_PGR1_PLR0_TT4_8_USFGRO0_VW2_WGM1
    SolutionIndex: 81
    SolutionNameMin: Cijk_Ailk_Bljk_SB_MT64x128x8_SE_EPS1_FL0_GRVW4_LPB2_PGR1_PLR1_TT4_8_USFGRO0_VW2_WGM1
    SolutionIndex: 82
    SolutionNameMin: Cijk_Ailk_Bljk_SB_MT64x128x8_SE_EPS1_FL0_GRVW4_LPB2_PGR1_PLR1_TT4_8_USFGRO0_VW2_WGM8
    SolutionIndex: 83
    SolutionNameMin: Cijk_Ailk_Bljk_SB_MT64x128x8_SE_EPS0_FL1_GRVW2_LPB2_PGR0_PLR1_TT4_8_USFGRO0_VW2_WGM1
    SolutionIndex: 84
    SolutionNameMin: Cijk_Ailk_Bljk_SB_MT64x128x8_SE_EPS1_FL1_GRVW4_LPB2_PGR1_PLR0_TT4_8_USFGRO0_VW2_WGM1
    SolutionIndex: 85
    SolutionNameMin: Cijk_Ailk_Bljk_SB_MT64x128x8_SE_EPS1_FL1_GRVW4_LPB2_PGR1_PLR1_TT4_8_USFGRO0_VW2_WGM8
    SolutionIndex: 86
    SolutionNameMin: Cijk_Ailk_Bljk_SB_MT128x64x8_SE_EPS0_FL0_GRVW1_LPB2_PGR0_PLR0_TT8_4_USFGRO1_VW2_WGM8
    SolutionIndex: 87
    SolutionNameMin: Cijk_Ailk_Bljk_SB_MT128x64x16_SE_EPS0_FL0_GRVW1_LPB2_PGR0_PLR0_TT8_4_USFGRO1_VW2_WGM1
    SolutionIndex: 88
    SolutionNameMin: Cijk_Ailk_Bljk_SB_MT128x64x32_SE_EPS0_FL0_GRVW1_LPB2_PGR0_PLR0_TT8_4_USFGRO1_VW2_WGM8
    SolutionIndex: 89
    SolutionNameMin: Cijk_Ailk_Bljk_SB_MT128x64x8_SE_EPS0_FL0_GRVW1_LPB2_PGR0_PLR1_TT8_4_USFGRO1_VW2_WGM1
    SolutionIndex: 90
    SolutionNameMin: Cijk_Ailk_Bljk_SB_MT128x64x8_SE_EPS1_FL0_GRVW1_LPB2_PGR1_PLR1_TT8_4_USFGRO1_VW2_WGM1
    SolutionIndex: 91
    SolutionNameMin: Cijk_Ailk_Bljk_SB_MT128x64x8_SE_EPS0_FL0_GRVW1_LPB2_PGR0_PLR1_TT8_4_USFGRO1_VW2_WGM8
    SolutionIndex: 92
    SolutionNameMin: Cijk_Ailk_Bljk_SB_MT128x64x16_SE_EPS0_FL0_GRVW1_LPB2_PGR0_PLR1_TT8_4_USFGRO1_VW2_WGM8
    SolutionIndex: 93
    SolutionNameMin: Cijk_Ailk_Bljk_SB_MT128x64x8_SE_EPS0_FL0_GRVW1_LPB4_PGR0_PLR1_TT8_4_USFGRO1_VW4_WGM1
    SolutionIndex: 94
    SolutionNameMin: Cijk_Ailk_Bljk_SB_MT128x64x16_SE_EPS0_FL0_GRVW1_LPB4_PGR0_PLR1_TT8_4_USFGRO1_VW4_WGM1
    SolutionIndex: 95
    SolutionNameMin: Cijk_Ailk_Bljk_SB_MT128x64x8_SE_EPS0_FL0_GRVW2_LPB2_PGR0_PLR1_TT8_4_USFGRO0_VW2_WGM1
    SolutionIndex: 96
    SolutionNameMin: Cijk_Ailk_Bljk_SB_MT128x64x8_SE_EPS1_FL0_GRVW4_LPB4_PGR1_PLR1_TT8_4_USFGRO0_VW4_WGM1
    SolutionIndex: 97
    SolutionNameMin: Cijk_Ailk_Bljk_SB_MT128x64x16_SE_EPS0_FL0_GRVW4_LPB4_PGR0_PLR1_TT8_4_USFGRO0_VW4_WGM1
    SolutionIndex: 98
    SolutionNameMin: Cijk_Ailk_Bljk_SB_MT128x64x16_SE_EPS0_FL1_GRVW4_LPB4_PGR0_PLR1_TT8_4_USFGRO0_VW4_WGM1
- - - [512, 540, 1, 512, 512, 512, 512, 512]
    - [9, 4502.54]
  - - [512, 540, 1, 2048, 512, 512, 512, 2048]
    - [5, 6018.68]
  - - [512, 550, 1, 512, 512, 512, 512, 512]
    - [4, 4597.55]
  - - [512, 550, 1, 2048, 512, 512, 512, 2048]
    - [9, 6114.5]
  - - [512, 560, 1, 512, 512, 512, 512, 512]
    - [9, 4791.14]
  - - [512, 560, 1, 2048, 512, 512, 512, 2048]
    - [5, 6220.4]
  - - [512, 600, 1, 2048, 512, 512, 512, 2048]
    - [9, 6687.38]
  - - [512, 644, 1, 512, 512, 512, 512, 512]
    - [9, 5302.16]
  - - [512, 644, 1, 2048, 512, 512, 512, 2048]
    - [9, 6981.87]
  - - [512, 668, 1, 2048, 512, 512, 512, 2048]
    - [9, 7130.01]
  - - [512, 714, 1, 512, 512, 512, 512, 512]
    - [5, 6092.8]
  - - [512, 714, 1, 2048, 512, 512, 512, 2048]
    - [9, 7522.98]
  - - [512, 720, 1, 512, 512, 512, 512, 512]
    - [5, 6080.66]
  - - [512, 720, 1, 2048, 512, 512, 512, 2048]
    - [6, 7466.16]
  - - [512, 722, 1, 2048, 512, 512, 512, 2048]
    - [5, 7613.39]
  - - [512, 781, 1, 512, 512, 512, 512, 512]
    - [9, 6630.0]
  - - [512, 781, 1, 2048, 512, 512, 512, 2048]
    - [5, 7910.95]
  - - [512, 848, 1, 2048, 512, 512, 512, 2048]
    - [6, 8307.14]
  - - [512, 872, 1, 2048, 512, 512, 512, 2048]
    - [5, 8240.47]
  - - [512, 936, 1, 512, 512, 512, 512, 512]
    - [9, 7784.48]
  - - [512, 936, 1, 2048, 512, 512, 512, 2048]
    - [5, 8334.5]
  - - [512, 980, 1, 512, 512, 512, 512, 512]
    - [5, 6803.53]
  - - [512, 980, 1, 2048, 512, 512, 512, 2048]
    - [5, 7507.37]
  - - [512, 1139, 1, 2048, 512, 512, 512, 2048]
    - [5, 8239.05]
  - - [512, 1184, 1, 2048, 512, 512, 512, 2048]
    - [5, 8802.6]
  - - [512, 1186, 1, 2048, 512, 512, 512, 2048]
    - [5, 8304.06]
  - - [512, 1232, 1, 512, 512, 512, 512, 512]
    - [2, 8428.01]
  - - [512, 1232, 1, 2048, 512, 512, 512, 2048]
    - [9, 9201.21]
  - - [512, 1279, 1, 2048, 512, 512, 512, 2048]
    - [9, 8544.45]
  - - [512, 1290, 1, 512, 512, 512, 512, 512]
    - [5, 8861.79]
  - - [512, 1290, 1, 2048, 512, 512, 512, 2048]
    - [9, 9105.22]
  - - [512, 1327, 1, 2048, 512, 512, 512, 2048]
    - [6, 9135.14]
  - - [512, 1331, 1, 2048, 512, 512, 512, 2048]
    - [6, 9110.08]
  - - [512, 1341, 1, 2048, 512, 512, 512, 2048]
    - [10, 9069.59]
  - - [512, 1350, 1, 512, 512, 512, 512, 512]
    - [9, 9293.45]
  - - [512, 1350, 1, 2048, 512, 512, 512, 2048]
    - [6, 9000.42]
  - - [512, 1359, 1, 2048, 512, 512, 512, 2048]
    - [6, 9181.83]
  - - [512, 1391, 1, 2048, 512, 512, 512, 2048]
    - [6, 9393.22]
  - - [512, 1424, 1, 512, 512, 512, 512, 512]
    - [9, 9680.84]
  - - [512, 1424, 1, 2048, 512, 512, 512, 2048]
    - [9, 9508.26]
  - - [512, 1458, 1, 512, 512, 512, 512, 512]
    - [0, 9810.21]
  - - [512, 1458, 1, 2048, 512, 512, 512, 2048]
    - [5, 9545.63]
  - - [512, 1462, 1, 512, 512, 512, 512, 512]
    - [5, 9877.69]
  - - [512, 1462, 1, 2048, 512, 512, 512, 2048]
    - [5, 9463.1]
  - - [512, 1467, 1, 2048, 512, 512, 512, 2048]
    - [9, 9677.06]
  - - [512, 1472, 1, 2048, 512, 512, 512, 2048]
    - [9, 9710.05]
  - - [512, 1520, 1, 512, 512, 512, 512, 512]
    - [0, 10227.4]
  - - [512, 1520, 1, 2048, 512, 512, 512, 2048]
    - [5, 9464.61]
  - - [512, 1596, 1, 512, 512, 512, 512, 512]
    - [9, 10608.1]
  - - [512, 1596, 1, 2048, 512, 512, 512, 2048]
    - [41, 9487.14]
  - - [512, 1599, 1, 512, 512, 512, 512, 512]
    - [2, 10628.0]
  - - [512, 1599, 1, 2048, 512, 512, 512, 2048]
    - [9, 9743.6]
  - - [512, 1615, 1, 512, 512, 512, 512, 512]
    - [9, 11048.1]
  - - [512, 1615, 1, 2048, 512, 512, 512, 2048]
    - [9, 9836.52]
  - - [512, 1680, 1, 512, 512, 512, 512, 512]
    - [5, 11280.8]
  - - [512, 1680, 1, 2048, 512, 512, 512, 2048]
    - [9, 10027.4]
  - - [512, 1709, 1, 2048, 512, 512, 512, 2048]
    - [9, 10413.9]
  - - [512, 1890, 1, 512, 512, 512, 512, 512]
    - [9, 12511.4]
  - - [512, 1902, 1, 2048, 512, 512, 512, 2048]
    - [50, 10963.0]
  - - [512, 1917, 1, 512, 512, 512, 512, 512]
    - [7, 12563.3]
  - - [512, 1917, 1, 2048, 512, 512, 512, 2048]
    - [41, 10779.3]
  - - [512, 2076, 1, 2048, 512, 512, 512, 2048]
    - [16, 9604.89]
  - - [512, 2195, 1, 2048, 512, 512, 512, 2048]
    - [11, 9982.8]
  - - [512, 2205, 1, 512, 512, 512, 512, 512]
    - [12, 11272.0]
  - - [512, 2205, 1, 2048, 512, 512, 512, 2048]
    - [13, 9918.15]
  - - [512, 2387, 1, 512, 512, 512, 512, 512]
    - [12, 11923.4]
  - - [512, 2418, 1, 512, 512, 512, 512, 512]
    - [18, 12133.7]
  - - [512, 2418, 1, 2048, 512, 512, 512, 2048]
    - [3, 10522.4]
  - - [512, 2496, 1, 512, 512, 512, 512, 512]
    - [18, 12544.3]
  - - [512, 2496, 1, 2048, 512, 512, 512, 2048]
    - [50, 10529.7]
  - - [512, 2790, 1, 2048, 512, 512, 512, 2048]
    - [50, 11402.9]
  - - [512, 2864, 1, 2048, 512, 512, 512, 2048]
    - [40, 11529.2]
  - - [512, 3092, 1, 2048, 512, 512, 512, 2048]
    - [50, 12076.2]
  - - [512, 3113, 1, 2048, 512, 512, 512, 2048]
    - [40, 11878.6]
  - - [512, 3137, 1, 2048, 512, 512, 512, 2048]
    - [50, 11741.1]
  - - [512, 3165, 1, 2048, 512, 512, 512, 2048]
    - [40, 11962.1]
  - - [512, 3166, 1, 2048, 512, 512, 512, 2048]
    - [50, 11679.6]
  - - [512, 3194, 1, 2048, 512, 512, 512, 2048]
    - [50, 11896.7]
  - - [512, 3219, 1, 2048, 512, 512, 512, 2048]
    - [49, 11739.6]
  - - [512, 3222, 1, 2048, 512, 512, 512, 2048]
    - [39, 11953.5]
  - - [512, 3234, 1, 2048, 512, 512, 512, 2048]
    - [40, 11823.9]
  - - [512, 3237, 1, 2048, 512, 512, 512, 2048]
    - [40, 12398.6]
  - - [512, 3242, 1, 2048, 512, 512, 512, 2048]
    - [49, 11963.3]
  - - [512, 3246, 1, 2048, 512, 512, 512, 2048]
    - [49, 12008.5]
  - - [512, 3249, 1, 2048, 512, 512, 512, 2048]
    - [49, 12026.4]
  - - [512, 3251, 1, 2048, 512, 512, 512, 2048]
    - [40, 12129.7]
  - - [512, 3257, 1, 2048, 512, 512, 512, 2048]
    - [50, 12100.4]
  - - [512, 3262, 1, 2048, 512, 512, 512, 2048]
    - [49, 12077.9]
  - - [512, 3268, 1, 2048, 512, 512, 512, 2048]
    - [40, 12120.7]
  - - [512, 3282, 1, 2048, 512, 512, 512, 2048]
    - [40, 12073.5]
  - - [512, 3286, 1, 2048, 512, 512, 512, 2048]
    - [40, 12433.7]
  - - [512, 3287, 1, 2048, 512, 512, 512, 2048]
    - [50, 12337.8]
  - - [512, 3293, 1, 2048, 512, 512, 512, 2048]
    - [40, 12168.6]
  - - [512, 3297, 1, 2048, 512, 512, 512, 2048]
    - [39, 12088.0]
  - - [512, 3307, 1, 2048, 512, 512, 512, 2048]
    - [50, 12124.7]
  - - [512, 3314, 1, 2048, 512, 512, 512, 2048]
    - [40, 12208.4]
  - - [512, 3315, 1, 2048, 512, 512, 512, 2048]
    - [47, 12046.2]
  - - [512, 3319, 1, 2048, 512, 512, 512, 2048]
    - [50, 12334.3]
  - - [512, 3322, 1, 2048, 512, 512, 512, 2048]
    - [49, 12081.7]
  - - [512, 3323, 1, 2048, 512, 512, 512, 2048]
    - [47, 11939.5]
  - - [512, 3324, 1, 2048, 512, 512, 512, 2048]
    - [50, 11897.5]
  - - [512, 3325, 1, 2048, 512, 512, 512, 2048]
    - [40, 12473.3]
  - - [512, 3327, 1, 2048, 512, 512, 512, 2048]
    - [40, 11770.0]
  - - [512, 3329, 1, 2048, 512, 512, 512, 2048]
    - [50, 11967.6]
  - - [512, 3332, 1, 2048, 512, 512, 512, 2048]
    - [40, 12365.0]
  - - [512, 3336, 1, 2048, 512, 512, 512, 2048]
    - [40, 12334.5]
  - - [512, 3339, 1, 2048, 512, 512, 512, 2048]
    - [50, 12133.4]
  - - [512, 3342, 1, 2048, 512, 512, 512, 2048]
    - [40, 12412.7]
  - - [512, 3344, 1, 2048, 512, 512, 512, 2048]
    - [40, 12678.8]
  - - [512, 3358, 1, 2048, 512, 512, 512, 2048]
    - [50, 11992.9]
  - - [512, 3360, 1, 2048, 512, 512, 512, 2048]
    - [49, 12601.0]
  - - [512, 3364, 1, 2048, 512, 512, 512, 2048]
    - [49, 11985.0]
  - - [512, 3365, 1, 2048, 512, 512, 512, 2048]
    - [40, 12476.9]
  - - [512, 3369, 1, 2048, 512, 512, 512, 2048]
    - [39, 12276.4]
  - - [512, 3370, 1, 2048, 512, 512, 512, 2048]
    - [50, 12161.7]
  - - [512, 3371, 1, 2048, 512, 512, 512, 2048]
    - [39, 12026.3]
  - - [512, 3374, 1, 2048, 512, 512, 512, 2048]
    - [50, 12708.0]
  - - [512, 3376, 1, 2048, 512, 512, 512, 2048]
    - [50, 12374.2]
  - - [512, 3377, 1, 2048, 512, 512, 512, 2048]
    - [49, 12402.1]
  - - [512, 3378, 1, 2048, 512, 512, 512, 2048]
    - [40, 12312.6]
  - - [512, 3381, 1, 2048, 512, 512, 512, 2048]
    - [40, 11964.3]
  - - [512, 3382, 1, 2048, 512, 512, 512, 2048]
    - [49, 12629.3]
  - - [512, 3383, 1, 2048, 512, 512, 512, 2048]
    - [40, 12462.6]
  - - [512, 3384, 1, 2048, 512, 512, 512, 2048]
    - [49, 12033.4]
  - - [512, 3385, 1, 2048, 512, 512, 512, 2048]
    - [50, 12376.0]
  - - [512, 3386, 1, 2048, 512, 512, 512, 2048]
    - [39, 11946.5]
  - - [512, 3388, 1, 2048, 512, 512, 512, 2048]
    - [40, 12425.1]
  - - [512, 3390, 1, 2048, 512, 512, 512, 2048]
    - [49, 12432.4]
  - - [512, 3391, 1, 2048, 512, 512, 512, 2048]
    - [40, 12332.6]
  - - [512, 3396, 1, 2048, 512, 512, 512, 2048]
    - [40, 12218.6]
  - - [512, 3399, 1, 2048, 512, 512, 512, 2048]
    - [40, 12015.0]
  - - [512, 3402, 1, 2048, 512, 512, 512, 2048]
    - [39, 12002.9]
  - - [512, 3410, 1, 2048, 512, 512, 512, 2048]
    - [50, 11953.9]
  - - [512, 3412, 1, 2048, 512, 512, 512, 2048]
    - [50, 12083.8]
  - - [512, 3414, 1, 2048, 512, 512, 512, 2048]
    - [40, 12534.5]
  - - [512, 3415, 1, 2048, 512, 512, 512, 2048]
    - [50, 12097.6]
  - - [512, 3418, 1, 2048, 512, 512, 512, 2048]
    - [50, 12111.6]
  - - [512, 3420, 1, 2048, 512, 512, 512, 2048]
    - [39, 12257.8]
  - - [512, 3422, 1, 2048, 512, 512, 512, 2048]
    - [50, 12204.9]
  - - [512, 3425, 1, 2048, 512, 512, 512, 2048]
    - [39, 12295.9]
  - - [512, 3426, 1, 2048, 512, 512, 512, 2048]
    - [50, 12071.4]
  - - [512, 3427, 1, 2048, 512, 512, 512, 2048]
    - [49, 12463.5]
  - - [512, 3428, 1, 2048, 512, 512, 512, 2048]
    - [50, 12273.1]
  - - [512, 3430, 1, 2048, 512, 512, 512, 2048]
    - [50, 12049.8]
  - - [512, 3431, 1, 2048, 512, 512, 512, 2048]
    - [39, 12280.4]
  - - [512, 3432, 1, 2048, 512, 512, 512, 2048]
    - [40, 12314.3]
  - - [512, 3433, 1, 2048, 512, 512, 512, 2048]
    - [39, 12450.8]
  - - [512, 3438, 1, 2048, 512, 512, 512, 2048]
    - [40, 12292.1]
  - - [512, 3439, 1, 2048, 512, 512, 512, 2048]
    - [39, 12332.6]
  - - [512, 3440, 1, 2048, 512, 512, 512, 2048]
    - [39, 12017.3]
  - - [512, 3443, 1, 2048, 512, 512, 512, 2048]
    - [49, 12266.5]
  - - [512, 3445, 1, 2048, 512, 512, 512, 2048]
    - [39, 12425.6]
  - - [512, 3447, 1, 2048, 512, 512, 512, 2048]
    - [50, 11949.4]
  - - [512, 3448, 1, 2048, 512, 512, 512, 2048]
    - [39, 12344.7]
  - - [512, 3450, 1, 2048, 512, 512, 512, 2048]
    - [50, 12058.7]
  - - [512, 3451, 1, 2048, 512, 512, 512, 2048]
    - [39, 12321.7]
  - - [512, 3452, 1, 2048, 512, 512, 512, 2048]
    - [39, 12481.7]
  - - [512, 3453, 1, 2048, 512, 512, 512, 2048]
    - [39, 12359.2]
  - - [512, 3455, 1, 2048, 512, 512, 512, 2048]
    - [50, 12610.8]
  - - [512, 3456, 1, 2048, 512, 512, 512, 2048]
    - [39, 11942.7]
  - - [512, 3457, 1, 2048, 512, 512, 512, 2048]
    - [50, 12193.7]
  - - [512, 3458, 1, 2048, 512, 512, 512, 2048]
    - [46, 12041.7]
  - - [512, 3459, 1, 2048, 512, 512, 512, 2048]
    - [39, 12472.6]
  - - [512, 3460, 1, 2048, 512, 512, 512, 2048]
    - [50, 12187.9]
  - - [512, 3461, 1, 2048, 512, 512, 512, 2048]
    - [40, 12421.8]
  - - [512, 3462, 1, 2048, 512, 512, 512, 2048]
    - [39, 11863.4]
  - - [512, 3466, 1, 2048, 512, 512, 512, 2048]
    - [39, 11958.4]
  - - [512, 3467, 1, 2048, 512, 512, 512, 2048]
    - [40, 12321.8]
  - - [512, 3468, 1, 2048, 512, 512, 512, 2048]
    - [49, 12031.8]
  - - [512, 3470, 1, 2048, 512, 512, 512, 2048]
    - [49, 12315.8]
  - - [512, 3471, 1, 2048, 512, 512, 512, 2048]
    - [50, 11978.8]
  - - [512, 3472, 1, 2048, 512, 512, 512, 2048]
    - [49, 12423.8]
  - - [512, 3475, 1, 2048, 512, 512, 512, 2048]
    - [49, 12162.3]
  - - [512, 3476, 1, 2048, 512, 512, 512, 2048]
    - [49, 12662.8]
  - - [512, 3477, 1, 2048, 512, 512, 512, 2048]
    - [39, 12192.1]
  - - [512, 3478, 1, 2048, 512, 512, 512, 2048]
    - [39, 12234.8]
  - - [512, 3479, 1, 2048, 512, 512, 512, 2048]
    - [39, 12431.9]
  - - [512, 3480, 1, 2048, 512, 512, 512, 2048]
    - [39, 12579.5]
  - - [512, 3481, 1, 2048, 512, 512, 512, 2048]
    - [49, 12486.7]
  - - [512, 3483, 1, 2048, 512, 512, 512, 2048]
    - [49, 12335.2]
  - - [512, 3484, 1, 2048, 512, 512, 512, 2048]
    - [39, 12154.8]
  - - [512, 3487, 1, 2048, 512, 512, 512, 2048]
    - [49, 12426.6]
  - - [512, 3489, 1, 2048, 512, 512, 512, 2048]
    - [49, 11990.4]
  - - [512, 3490, 1, 2048, 512, 512, 512, 2048]
    - [39, 12263.9]
  - - [512, 3491, 1, 2048, 512, 512, 512, 2048]
    - [49, 12650.6]
  - - [512, 3493, 1, 2048, 512, 512, 512, 2048]
    - [39, 12437.8]
  - - [512, 3494, 1, 2048, 512, 512, 512, 2048]
    - [49, 12595.4]
  - - [512, 3495, 1, 2048, 512, 512, 512, 2048]
    - [50, 12061.6]
  - - [512, 3497, 1, 2048, 512, 512, 512, 2048]
    - [50, 12027.3]
  - - [512, 3498, 1, 2048, 512, 512, 512, 2048]
    - [40, 12285.4]
  - - [512, 3499, 1, 2048, 512, 512, 512, 2048]
    - [39, 12312.0]
  - - [512, 3501, 1, 2048, 512, 512, 512, 2048]
    - [49, 12425.8]
  - - [512, 3503, 1, 2048, 512, 512, 512, 2048]
    - [40, 12076.5]
  - - [512, 3505, 1, 2048, 512, 512, 512, 2048]
    - [39, 12399.7]
  - - [512, 3507, 1, 2048, 512, 512, 512, 2048]
    - [46, 12064.9]
  - - [512, 3508, 1, 2048, 512, 512, 512, 2048]
    - [40, 12232.0]
  - - [512, 3509, 1, 2048, 512, 512, 512, 2048]
    - [39, 12287.8]
  - - [512, 3510, 1, 2048, 512, 512, 512, 2048]
    - [39, 12374.0]
  - - [512, 3511, 1, 2048, 512, 512, 512, 2048]
    - [40, 12255.6]
  - - [512, 3513, 1, 2048, 512, 512, 512, 2048]
    - [40, 12114.1]
  - - [512, 3514, 1, 2048, 512, 512, 512, 2048]
    - [40, 12275.8]
  - - [512, 3515, 1, 2048, 512, 512, 512, 2048]
    - [50, 12418.3]
  - - [512, 3517, 1, 2048, 512, 512, 512, 2048]
    - [40, 12442.2]
  - - [512, 3518, 1, 2048, 512, 512, 512, 2048]
    - [49, 12345.7]
  - - [512, 3519, 1, 2048, 512, 512, 512, 2048]
    - [39, 12375.8]
  - - [512, 3520, 1, 2048, 512, 512, 512, 2048]
    - [49, 12489.9]
  - - [512, 3523, 1, 2048, 512, 512, 512, 2048]
    - [39, 12389.8]
  - - [512, 3528, 1, 2048, 512, 512, 512, 2048]
    - [40, 12295.2]
  - - [512, 3529, 1, 2048, 512, 512, 512, 2048]
    - [49, 12381.0]
  - - [512, 3530, 1, 2048, 512, 512, 512, 2048]
    - [40, 12414.4]
  - - [512, 3531, 1, 2048, 512, 512, 512, 2048]
    - [49, 12328.7]
  - - [512, 3532, 1, 2048, 512, 512, 512, 2048]
    - [49, 12030.9]
  - - [512, 3533, 1, 2048, 512, 512, 512, 2048]
    - [40, 12448.4]
  - - [512, 3534, 1, 2048, 512, 512, 512, 2048]
    - [49, 12505.7]
  - - [512, 3538, 1, 2048, 512, 512, 512, 2048]
    - [39, 12598.1]
  - - [512, 3539, 1, 2048, 512, 512, 512, 2048]
    - [50, 12446.1]
  - - [512, 3540, 1, 2048, 512, 512, 512, 2048]
    - [50, 12363.4]
  - - [512, 3541, 1, 2048, 512, 512, 512, 2048]
    - [39, 12278.5]
  - - [512, 3547, 1, 2048, 512, 512, 512, 2048]
    - [49, 12397.7]
  - - [512, 3548, 1, 2048, 512, 512, 512, 2048]
    - [40, 12378.1]
  - - [512, 3552, 1, 2048, 512, 512, 512, 2048]
    - [39, 12586.4]
  - - [512, 3564, 1, 2048, 512, 512, 512, 2048]
    - [49, 12450.5]
  - - [512, 3575, 1, 2048, 512, 512, 512, 2048]
    - [49, 12376.8]
  - - [512, 3598, 1, 2048, 512, 512, 512, 2048]
    - [40, 12463.0]
  - - [512, 3599, 1, 2048, 512, 512, 512, 2048]
    - [39, 12430.3]
  - - [512, 3608, 1, 2048, 512, 512, 512, 2048]
    - [49, 12328.2]
  - - [512, 3776, 1, 512, 512, 512, 512, 512]
    - [31, 14871.6]
  - - [512, 3776, 1, 2048, 512, 512, 512, 2048]
    - [47, 12382.5]
  - - [512, 3780, 1, 512, 512, 512, 512, 512]
    - [25, 14923.3]
  - - [512, 3780, 1, 2048, 512, 512, 512, 2048]
    - [40, 12511.5]
  - - [512, 3780, 1, 33708, 512, 512, 512, 33708]
    - [40, 18007.1]
  - - [512, 3796, 1, 512, 512, 512, 512, 512]
    - [25, 14914.5]
  - - [512, 3796, 1, 2048, 512, 512, 512, 2048]
    - [39, 12589.9]
  - - [512, 3796, 1, 33708, 512, 512, 512, 33708]
    - [39, 18100.5]
  - - [512, 3822, 1, 512, 512, 512, 512, 512]
    - [31, 14980.8]
  - - [512, 3822, 1, 2048, 512, 512, 512, 2048]
    - [50, 12396.9]
  - - [512, 3822, 1, 33708, 512, 512, 512, 33708]
    - [39, 18173.0]
  - - [512, 3835, 1, 512, 512, 512, 512, 512]
    - [31, 14801.6]
  - - [512, 3835, 1, 2048, 512, 512, 512, 2048]
    - [39, 12998.8]
  - - [512, 3840, 1, 512, 512, 512, 512, 512]
    - [31, 15123.7]
  - - [512, 3840, 1, 2048, 512, 512, 512, 2048]
    - [40, 12523.5]
  - - [512, 3840, 1, 33708, 512, 512, 512, 33708]
    - [39, 18115.7]
  - - [512, 3859, 1, 512, 512, 512, 512, 512]
    - [18, 13804.8]
  - - [512, 3859, 1, 2048, 512, 512, 512, 2048]
    - [6, 10707.2]
  - - [512, 3859, 1, 33708, 512, 512, 512, 33708]
    - [14, 12064.5]
  - - [512, 3864, 1, 512, 512, 512, 512, 512]
    - [18, 13717.8]
  - - [512, 3864, 1, 2048, 512, 512, 512, 2048]
    - [10, 10682.6]
  - - [512, 3870, 1, 512, 512, 512, 512, 512]
    - [18, 14153.1]
  - - [512, 3870, 1, 2048, 512, 512, 512, 2048]
    - [6, 10774.2]
  - - [512, 3870, 1, 33708, 512, 512, 512, 33708]
    - [15, 12119.8]
  - - [512, 3876, 1, 512, 512, 512, 512, 512]
    - [18, 13972.4]
  - - [512, 3876, 1, 2048, 512, 512, 512, 2048]
    - [6, 10761.2]
  - - [512, 3876, 1, 33708, 512, 512, 512, 33708]
    - [14, 12123.8]
  - - [512, 3906, 1, 512, 512, 512, 512, 512]
    - [18, 13957.7]
  - - [512, 3906, 1, 2048, 512, 512, 512, 2048]
    - [6, 10672.7]
  - - [512, 3906, 1, 33708, 512, 512, 512, 33708]
    - [15, 12242.7]
  - - [512, 3910, 1, 512, 512, 512, 512, 512]
    - [18, 14048.6]
  - - [512, 3910, 1, 2048, 512, 512, 512, 2048]
    - [10, 10719.4]
  - - [512, 3910, 1, 33708, 512, 512, 512, 33708]
    - [15, 12226.1]
  - - [512, 3925, 1, 512, 512, 512, 512, 512]
    - [18, 14243.0]
  - - [512, 3925, 1, 2048, 512, 512, 512, 2048]
    - [6, 10642.5]
  - - [512, 3925, 1, 33708, 512, 512, 512, 33708]
    - [15, 12277.6]
  - - [512, 3927, 1, 512, 512, 512, 512, 512]
    - [18, 14002.2]
  - - [512, 3942, 1, 512, 512, 512, 512, 512]
    - [18, 14241.6]
  - - [512, 3942, 1, 2048, 512, 512, 512, 2048]
    - [6, 10986.3]
  - - [512, 3942, 1, 33708, 512, 512, 512, 33708]
    - [15, 12299.4]
  - - [512, 3944, 1, 512, 512, 512, 512, 512]
    - [18, 14248.8]
  - - [512, 3944, 1, 2048, 512, 512, 512, 2048]
    - [10, 10837.5]
  - - [512, 3944, 1, 33708, 512, 512, 512, 33708]
    - [14, 12324.0]
  - - [512, 3955, 1, 512, 512, 512, 512, 512]
    - [18, 14056.1]
  - - [512, 3955, 1, 2048, 512, 512, 512, 2048]
    - [1, 10845.0]
  - - [512, 3955, 1, 33708, 512, 512, 512, 33708]
    - [14, 12386.9]
  - - [512, 3968, 1, 512, 512, 512, 512, 512]
    - [18, 14194.7]
  - - [512, 3968, 1, 2048, 512, 512, 512, 2048]
    - [10, 10965.5]
  - - [512, 3968, 1, 33708, 512, 512, 512, 33708]
    - [15, 12437.9]
  - - [512, 3969, 1, 512, 512, 512, 512, 512]
    - [18, 14418.6]
  - - [512, 3969, 1, 2048, 512, 512, 512, 2048]
    - [6, 10759.6]
  - - [512, 3969, 1, 33708, 512, 512, 512, 33708]
    - [15, 12418.5]
  - - [512, 3976, 1, 512, 512, 512, 512, 512]
    - [18, 14332.8]
  - - [512, 3976, 1, 2048, 512, 512, 512, 2048]
    - [10, 10771.9]
  - - [512, 3976, 1, 33708, 512, 512, 512, 33708]
    - [15, 12434.8]
  - - [512, 3977, 1, 512, 512, 512, 512, 512]
    - [18, 14383.9]
  - - [512, 3977, 1, 2048, 512, 512, 512, 2048]
    - [10, 10853.1]
  - - [512, 3977, 1, 33708, 512, 512, 512, 33708]
    - [14, 12461.8]
  - - [512, 3978, 1, 512, 512, 512, 512, 512]
    - [18, 14031.3]
  - - [512, 3978, 1, 2048, 512, 512, 512, 2048]
    - [10, 10826.5]
  - - [512, 3978, 1, 33708, 512, 512, 512, 33708]
    - [15, 12450.8]
  - - [512, 3990, 1, 512, 512, 512, 512, 512]
    - [18, 14415.0]
  - - [512, 3990, 1, 2048, 512, 512, 512, 2048]
    - [10, 10767.5]
  - - [512, 3990, 1, 33708, 512, 512, 512, 33708]
    - [14, 12467.5]
  - - [512, 3995, 1, 512, 512, 512, 512, 512]
    - [18, 14030.9]
  - - [512, 3995, 1, 2048, 512, 512, 512, 2048]
    - [10, 10832.3]
  - - [512, 3995, 1, 33708, 512, 512, 512, 33708]
    - [14, 12489.0]
  - - [512, 3996, 1, 512, 512, 512, 512, 512]
    - [18, 14004.4]
  - - [512, 3996, 1, 2048, 512, 512, 512, 2048]
    - [10, 10743.9]
  - - [512, 3996, 1, 33708, 512, 512, 512, 33708]
    - [15, 12516.6]
  - - [512, 3999, 1, 512, 512, 512, 512, 512]
    - [18, 14029.9]
  - - [512, 3999, 1, 2048, 512, 512, 512, 2048]
    - [6, 10825.3]
  - - [512, 3999, 1, 33708, 512, 512, 512, 33708]
    - [14, 12501.3]
  - - [512, 4005, 1, 512, 512, 512, 512, 512]
    - [18, 14035.9]
  - - [512, 4005, 1, 2048, 512, 512, 512, 2048]
    - [6, 10730.7]
  - - [512, 4005, 1, 33708, 512, 512, 512, 33708]
    - [14, 12482.8]
  - - [512, 4012, 1, 512, 512, 512, 512, 512]
    - [18, 14105.7]
  - - [512, 4012, 1, 2048, 512, 512, 512, 2048]
    - [40, 10738.5]
  - - [512, 4012, 1, 33708, 512, 512, 512, 33708]
    - [15, 12558.5]
  - - [512, 4020, 1, 512, 512, 512, 512, 512]
    - [18, 14491.5]
  - - [512, 4020, 1, 2048, 512, 512, 512, 2048]
    - [6, 10775.3]
  - - [512, 4020, 1, 33708, 512, 512, 512, 33708]
    - [15, 12575.1]
  - - [512, 4026, 1, 512, 512, 512, 512, 512]
    - [18, 14064.4]
  - - [512, 4026, 1, 2048, 512, 512, 512, 2048]
    - [8, 10849.1]
  - - [512, 4026, 1, 33708, 512, 512, 512, 33708]
    - [14, 12595.0]
  - - [512, 4030, 1, 512, 512, 512, 512, 512]
    - [18, 14479.7]
  - - [512, 4030, 1, 2048, 512, 512, 512, 2048]
    - [6, 10837.5]
  - - [512, 4030, 1, 33708, 512, 512, 512, 33708]
    - [14, 12592.7]
  - - [512, 4032, 1, 512, 512, 512, 512, 512]
    - [18, 14115.4]
  - - [512, 4032, 1, 2048, 512, 512, 512, 2048]
    - [10, 10989.5]
  - - [512, 4032, 1, 33708, 512, 512, 512, 33708]
    - [15, 12616.9]
  - - [512, 4050, 1, 512, 512, 512, 512, 512]
    - [18, 14583.6]
  - - [512, 4059, 1, 512, 512, 512, 512, 512]
    - [18, 14567.9]
  - - [2048, 160, 1, 512, 2048, 2048, 2048, 512]
    - [5, 5447.15]
  - - [2048, 174, 1, 512, 2048, 2048, 2048, 512]
    - [5, 5893.16]
  - - [2048, 184, 1, 512, 2048, 2048, 2048, 512]
    - [5, 6136.7]
  - - [2048, 189, 1, 512, 2048, 2048, 2048, 512]
    - [4, 6368.28]
  - - [2048, 198, 1, 512, 2048, 2048, 2048, 512]
    - [9, 5521.76]
  - - [2048, 207, 1, 512, 2048, 2048, 2048, 512]
    - [5, 5772.75]
  - - [2048, 208, 1, 512, 2048, 2048, 2048, 512]
    - [5, 5825.42]
  - - [2048, 245, 1, 512, 2048, 2048, 2048, 512]
    - [4, 6732.21]
  - - [2048, 246, 1, 512, 2048, 2048, 2048, 512]
    - [5, 6620.89]
  - - [2048, 264, 1, 512, 2048, 2048, 2048, 512]
    - [9, 7346.71]
  - - [2048, 401, 1, 512, 2048, 2048, 2048, 512]
    - [5, 10950.0]
  - - [2048, 439, 1, 512, 2048, 2048, 2048, 512]
    - [5, 11508.1]
  - - [2048, 443, 1, 512, 2048, 2048, 2048, 512]
    - [9, 11430.1]
  - - [2048, 446, 1, 512, 2048, 2048, 2048, 512]
    - [5, 11738.6]
  - - [2048, 465, 1, 512, 2048, 2048, 2048, 512]
    - [12, 9862.21]
  - - [2048, 468, 1, 512, 2048, 2048, 2048, 512]
    - [12, 9798.99]
  - - [2048, 493, 1, 512, 2048, 2048, 2048, 512]
    - [12, 10306.0]
  - - [2048, 495, 1, 512, 2048, 2048, 2048, 512]
    - [12, 10217.4]
  - - [2048, 511, 1, 512, 2048, 2048, 2048, 512]
    - [12, 10514.6]
  - - [2048, 512, 1, 512, 2048, 2048, 2048, 512]
    - [12, 10824.0]
  - - [2048, 540, 1, 512, 2048, 2048, 2048, 512]
    - [12, 11128.8]
  - - [2048, 550, 1, 512, 2048, 2048, 2048, 512]
    - [12, 11461.0]
  - - [2048, 560, 1, 512, 2048, 2048, 2048, 512]
    - [12, 11522.8]
  - - [2048, 600, 1, 512, 2048, 2048, 2048, 512]
    - [12, 12288.0]
  - - [2048, 644, 1, 512, 2048, 2048, 2048, 512]
    - [18, 12468.3]
  - - [2048, 668, 1, 512, 2048, 2048, 2048, 512]
    - [18, 12819.3]
  - - [2048, 714, 1, 512, 2048, 2048, 2048, 512]
    - [48, 11998.1]
  - - [2048, 720, 1, 512, 2048, 2048, 2048, 512]
    - [36, 12006.6]
  - - [2048, 722, 1, 512, 2048, 2048, 2048, 512]
    - [38, 12086.1]
  - - [2048, 781, 1, 512, 2048, 2048, 2048, 512]
    - [38, 13107.2]
  - - [2048, 848, 1, 512, 2048, 2048, 2048, 512]
    - [38, 14051.7]
  - - [2048, 872, 1, 512, 2048, 2048, 2048, 512]
    - [36, 14376.7]
  - - [2048, 936, 1, 512, 2048, 2048, 2048, 512]
    - [44, 15090.2]
  - - [2048, 980, 1, 512, 2048, 2048, 2048, 512]
    - [12, 14240.6]
  - - [2048, 1139, 1, 512, 2048, 2048, 2048, 512]
    - [9, 13823.3]
  - - [2048, 1184, 1, 512, 2048, 2048, 2048, 512]
    - [36, 14006.3]
  - - [2048, 1186, 1, 512, 2048, 2048, 2048, 512]
    - [48, 14068.0]
  - - [2048, 1232, 1, 512, 2048, 2048, 2048, 512]
    - [38, 14613.6]
  - - [2048, 1279, 1, 512, 2048, 2048, 2048, 512]
    - [36, 14928.0]
  - - [2048, 1290, 1, 512, 2048, 2048, 2048, 512]
    - [44, 15260.2]
  - - [2048, 1327, 1, 512, 2048, 2048, 2048, 512]
    - [48, 15571.4]
  - - [2048, 1331, 1, 512, 2048, 2048, 2048, 512]
    - [44, 15787.9]
  - - [2048, 1341, 1, 512, 2048, 2048, 2048, 512]
    - [44, 15721.7]
  - - [2048, 1350, 1, 512, 2048, 2048, 2048, 512]
    - [38, 15970.1]
  - - [2048, 1359, 1, 512, 2048, 2048, 2048, 512]
    - [48, 16134.7]
  - - [2048, 1391, 1, 512, 2048, 2048, 2048, 512]
    - [44, 16366.4]
  - - [2048, 1424, 1, 512, 2048, 2048, 2048, 512]
    - [17, 15028.0]
  - - [2048, 1458, 1, 512, 2048, 2048, 2048, 512]
    - [12, 13206.9]
  - - [2048, 1462, 1, 512, 2048, 2048, 2048, 512]
    - [12, 13307.5]
  - - [2048, 1467, 1, 512, 2048, 2048, 2048, 512]
    - [5, 13279.2]
  - - [2048, 1472, 1, 512, 2048, 2048, 2048, 512]
    - [5, 13511.1]
  - - [2048, 1520, 1, 512, 2048, 2048, 2048, 512]
    - [12, 13645.9]
  - - [2048, 1596, 1, 512, 2048, 2048, 2048, 512]
    - [5, 14387.3]
  - - [2048, 1599, 1, 512, 2048, 2048, 2048, 512]
    - [5, 14414.4]
  - - [2048, 1615, 1, 512, 2048, 2048, 2048, 512]
    - [5, 14598.8]
  - - [2048, 1680, 1, 512, 2048, 2048, 2048, 512]
    - [42, 14898.6]
  - - [2048, 1709, 1, 512, 2048, 2048, 2048, 512]
    - [42, 15033.8]
  - - [2048, 1902, 1, 512, 2048, 2048, 2048, 512]
    - [34, 16731.5]
  - - [2048, 1917, 1, 512, 2048, 2048, 2048, 512]
    - [34, 16751.1]
  - - [2048, 2076, 1, 512, 2048, 2048, 2048, 512]
    - [48, 15227.0]
  - - [2048, 2195, 1, 512, 2048, 2048, 2048, 512]
    - [48, 16046.0]
  - - [2048, 2205, 1, 512, 2048, 2048, 2048, 512]
    - [48, 16047.5]
  - - [2048, 2418, 1, 512, 2048, 2048, 2048, 512]
    - [12, 15752.1]
  - - [2048, 2496, 1, 512, 2048, 2048, 2048, 512]
    - [38, 15675.9]
  - - [2048, 2790, 1, 512, 2048, 2048, 2048, 512]
    - [38, 17184.8]
  - - [2048, 2864, 1, 512, 2048, 2048, 2048, 512]
    - [48, 17451.9]
  - - [2048, 3092, 1, 512, 2048, 2048, 2048, 512]
    - [45, 16421.3]
  - - [2048, 3113, 1, 512, 2048, 2048, 2048, 512]
    - [38, 16426.3]
  - - [2048, 3137, 1, 512, 2048, 2048, 2048, 512]
    - [37, 16660.2]
  - - [2048, 3165, 1, 512, 2048, 2048, 2048, 512]
    - [38, 16694.0]
  - - [2048, 3166, 1, 512, 2048, 2048, 2048, 512]
    - [37, 16759.9]
  - - [2048, 3194, 1, 512, 2048, 2048, 2048, 512]
    - [37, 16766.0]
  - - [2048, 3219, 1, 512, 2048, 2048, 2048, 512]
    - [37, 17019.9]
  - - [2048, 3222, 1, 512, 2048, 2048, 2048, 512]
    - [37, 17015.2]
  - - [2048, 3234, 1, 512, 2048, 2048, 2048, 512]
    - [37, 16989.5]
  - - [2048, 3237, 1, 512, 2048, 2048, 2048, 512]
    - [45, 16937.4]
  - - [2048, 3242, 1, 512, 2048, 2048, 2048, 512]
    - [37, 17031.6]
  - - [2048, 3246, 1, 512, 2048, 2048, 2048, 512]
    - [37, 16998.1]
  - - [2048, 3249, 1, 512, 2048, 2048, 2048, 512]
    - [48, 17027.4]
  - - [2048, 3251, 1, 512, 2048, 2048, 2048, 512]
    - [45, 17031.1]
  - - [2048, 3257, 1, 512, 2048, 2048, 2048, 512]
    - [45, 17083.0]
  - - [2048, 3262, 1, 512, 2048, 2048, 2048, 512]
    - [37, 17061.4]
  - - [2048, 3268, 1, 512, 2048, 2048, 2048, 512]
    - [48, 17106.4]
  - - [2048, 3282, 1, 512, 2048, 2048, 2048, 512]
    - [37, 17179.7]
  - - [2048, 3286, 1, 512, 2048, 2048, 2048, 512]
    - [38, 17200.7]
  - - [2048, 3287, 1, 512, 2048, 2048, 2048, 512]
    - [37, 17316.6]
  - - [2048, 3293, 1, 512, 2048, 2048, 2048, 512]
    - [45, 17320.3]
  - - [2048, 3297, 1, 512, 2048, 2048, 2048, 512]
    - [37, 17101.2]
  - - [2048, 3307, 1, 512, 2048, 2048, 2048, 512]
    - [38, 17221.2]
  - - [2048, 3314, 1, 512, 2048, 2048, 2048, 512]
    - [48, 17237.1]
  - - [2048, 3315, 1, 512, 2048, 2048, 2048, 512]
    - [45, 17187.7]
  - - [2048, 3319, 1, 512, 2048, 2048, 2048, 512]
    - [37, 17256.3]
  - - [2048, 3322, 1, 512, 2048, 2048, 2048, 512]
    - [48, 17292.4]
  - - [2048, 3323, 1, 512, 2048, 2048, 2048, 512]
    - [48, 17311.4]
  - - [2048, 3324, 1, 512, 2048, 2048, 2048, 512]
    - [38, 17289.1]
  - - [2048, 3325, 1, 512, 2048, 2048, 2048, 512]
    - [48, 17321.8]
  - - [2048, 3327, 1, 512, 2048, 2048, 2048, 512]
    - [45, 17215.9]
  - - [2048, 3329, 1, 512, 2048, 2048, 2048, 512]
    - [12, 15924.8]
  - - [2048, 3332, 1, 512, 2048, 2048, 2048, 512]
    - [48, 15800.8]
  - - [2048, 3336, 1, 512, 2048, 2048, 2048, 512]
    - [12, 15999.2]
  - - [2048, 3339, 1, 512, 2048, 2048, 2048, 512]
    - [12, 15920.4]
  - - [2048, 3342, 1, 512, 2048, 2048, 2048, 512]
    - [12, 15808.2]
  - - [2048, 3344, 1, 512, 2048, 2048, 2048, 512]
    - [12, 16031.7]
  - - [2048, 3358, 1, 512, 2048, 2048, 2048, 512]
    - [12, 15872.4]
  - - [2048, 3360, 1, 512, 2048, 2048, 2048, 512]
    - [12, 16003.0]
  - - [2048, 3364, 1, 512, 2048, 2048, 2048, 512]
    - [12, 15993.0]
  - - [2048, 3365, 1, 512, 2048, 2048, 2048, 512]
    - [12, 16097.1]
  - - [2048, 3369, 1, 512, 2048, 2048, 2048, 512]
    - [12, 16092.7]
  - - [2048, 3370, 1, 512, 2048, 2048, 2048, 512]
    - [12, 16039.0]
  - - [2048, 3371, 1, 512, 2048, 2048, 2048, 512]
    - [12, 15951.1]
  - - [2048, 3374, 1, 512, 2048, 2048, 2048, 512]
    - [12, 16134.2]
  - - [2048, 3376, 1, 512, 2048, 2048, 2048, 512]
    - [12, 16126.1]
  - - [2048, 3377, 1, 512, 2048, 2048, 2048, 512]
    - [12, 16160.4]
  - - [2048, 3378, 1, 512, 2048, 2048, 2048, 512]
    - [12, 16141.6]
  - - [2048, 3381, 1, 512, 2048, 2048, 2048, 512]
    - [12, 16197.2]
  - - [2048, 3382, 1, 512, 2048, 2048, 2048, 512]
    - [12, 16172.5]
  - - [2048, 3383, 1, 512, 2048, 2048, 2048, 512]
    - [12, 15973.3]
  - - [2048, 3384, 1, 512, 2048, 2048, 2048, 512]
    - [12, 16035.8]
  - - [2048, 3385, 1, 512, 2048, 2048, 2048, 512]
    - [12, 16098.7]
  - - [2048, 3386, 1, 512, 2048, 2048, 2048, 512]
    - [12, 16227.1]
  - - [2048, 3388, 1, 512, 2048, 2048, 2048, 512]
    - [12, 16136.4]
  - - [2048, 3390, 1, 512, 2048, 2048, 2048, 512]
    - [12, 16210.7]
  - - [2048, 3391, 1, 512, 2048, 2048, 2048, 512]
    - [12, 16121.4]
  - - [2048, 3396, 1, 512, 2048, 2048, 2048, 512]
    - [48, 15982.9]
  - - [2048, 3399, 1, 512, 2048, 2048, 2048, 512]
    - [38, 16066.2]
  - - [2048, 3402, 1, 512, 2048, 2048, 2048, 512]
    - [38, 16086.2]
  - - [2048, 3410, 1, 512, 2048, 2048, 2048, 512]
    - [48, 16100.8]
  - - [2048, 3412, 1, 512, 2048, 2048, 2048, 512]
    - [48, 16012.2]
  - - [2048, 3414, 1, 512, 2048, 2048, 2048, 512]
    - [48, 16021.5]
  - - [2048, 3415, 1, 512, 2048, 2048, 2048, 512]
    - [48, 16095.4]
  - - [2048, 3418, 1, 512, 2048, 2048, 2048, 512]
    - [38, 16000.2]
  - - [2048, 3420, 1, 512, 2048, 2048, 2048, 512]
    - [48, 15986.7]
  - - [2048, 3422, 1, 512, 2048, 2048, 2048, 512]
    - [38, 16059.1]
  - - [2048, 3425, 1, 512, 2048, 2048, 2048, 512]
    - [38, 16130.9]
  - - [2048, 3426, 1, 512, 2048, 2048, 2048, 512]
    - [38, 16124.0]
  - - [2048, 3427, 1, 512, 2048, 2048, 2048, 512]
    - [38, 16140.3]
  - - [2048, 3428, 1, 512, 2048, 2048, 2048, 512]
    - [48, 16081.5]
  - - [2048, 3430, 1, 512, 2048, 2048, 2048, 512]
    - [38, 16131.3]
  - - [2048, 3431, 1, 512, 2048, 2048, 2048, 512]
    - [48, 16101.3]
  - - [2048, 3432, 1, 512, 2048, 2048, 2048, 512]
    - [38, 16094.5]
  - - [2048, 3433, 1, 512, 2048, 2048, 2048, 512]
    - [38, 16064.7]
  - - [2048, 3438, 1, 512, 2048, 2048, 2048, 512]
    - [36, 15979.7]
  - - [2048, 3439, 1, 512, 2048, 2048, 2048, 512]
    - [48, 16156.2]
  - - [2048, 3440, 1, 512, 2048, 2048, 2048, 512]
    - [38, 16149.3]
  - - [2048, 3443, 1, 512, 2048, 2048, 2048, 512]
    - [38, 16192.4]
  - - [2048, 3445, 1, 512, 2048, 2048, 2048, 512]
    - [38, 16231.0]
  - - [2048, 3447, 1, 512, 2048, 2048, 2048, 512]
    - [48, 16147.5]
  - - [2048, 3448, 1, 512, 2048, 2048, 2048, 512]
    - [44, 16088.9]
  - - [2048, 3450, 1, 512, 2048, 2048, 2048, 512]
    - [48, 16167.3]
  - - [2048, 3451, 1, 512, 2048, 2048, 2048, 512]
    - [38, 16166.2]
  - - [2048, 3452, 1, 512, 2048, 2048, 2048, 512]
    - [48, 16165.2]
  - - [2048, 3453, 1, 512, 2048, 2048, 2048, 512]
    - [38, 16095.1]
  - - [2048, 3455, 1, 512, 2048, 2048, 2048, 512]
    - [48, 16087.2]
  - - [2048, 3456, 1, 512, 2048, 2048, 2048, 512]
    - [38, 16365.1]
  - - [2048, 3457, 1, 512, 2048, 2048, 2048, 512]
    - [48, 16328.6]
  - - [2048, 3458, 1, 512, 2048, 2048, 2048, 512]
    - [38, 16268.8]
  - - [2048, 3459, 1, 512, 2048, 2048, 2048, 512]
    - [38, 16279.4]
  - - [2048, 3460, 1, 512, 2048, 2048, 2048, 512]
    - [48, 16295.8]
  - - [2048, 3461, 1, 512, 2048, 2048, 2048, 512]
    - [38, 16329.8]
  - - [2048, 3462, 1, 512, 2048, 2048, 2048, 512]
    - [38, 16328.7]
  - - [2048, 3466, 1, 512, 2048, 2048, 2048, 512]
    - [48, 16388.8]
  - - [2048, 3467, 1, 512, 2048, 2048, 2048, 512]
    - [38, 16218.0]
  - - [2048, 3468, 1, 512, 2048, 2048, 2048, 512]
    - [38, 16275.0]
  - - [2048, 3470, 1, 512, 2048, 2048, 2048, 512]
    - [48, 16325.3]
  - - [2048, 3471, 1, 512, 2048, 2048, 2048, 512]
    - [48, 16371.1]
  - - [2048, 3472, 1, 512, 2048, 2048, 2048, 512]
    - [48, 16369.9]
  - - [2048, 3475, 1, 512, 2048, 2048, 2048, 512]
    - [38, 16354.7]
  - - [2048, 3476, 1, 512, 2048, 2048, 2048, 512]
    - [38, 16324.2]
  - - [2048, 3477, 1, 512, 2048, 2048, 2048, 512]
    - [38, 16311.4]
  - - [2048, 3478, 1, 512, 2048, 2048, 2048, 512]
    - [38, 16286.9]
  - - [2048, 3479, 1, 512, 2048, 2048, 2048, 512]
    - [38, 16314.9]
  - - [2048, 3480, 1, 512, 2048, 2048, 2048, 512]
    - [48, 16337.1]
  - - [2048, 3481, 1, 512, 2048, 2048, 2048, 512]
    - [38, 16330.1]
  - - [2048, 3483, 1, 512, 2048, 2048, 2048, 512]
    - [38, 16398.2]
  - - [2048, 3484, 1, 512, 2048, 2048, 2048, 512]
    - [38, 16350.1]
  - - [2048, 3487, 1, 512, 2048, 2048, 2048, 512]
    - [38, 16311.6]
  - - [2048, 3489, 1, 512, 2048, 2048, 2048, 512]
    - [38, 16320.9]
  - - [2048, 3490, 1, 512, 2048, 2048, 2048, 512]
    - [38, 16331.4]
  - - [2048, 3491, 1, 512, 2048, 2048, 2048, 512]
    - [38, 16254.9]
  - - [2048, 3493, 1, 512, 2048, 2048, 2048, 512]
    - [38, 16339.6]
  - - [2048, 3494, 1, 512, 2048, 2048, 2048, 512]
    - [38, 16391.1]
  - - [2048, 3495, 1, 512, 2048, 2048, 2048, 512]
    - [48, 16389.9]
  - - [2048, 3497, 1, 512, 2048, 2048, 2048, 512]
    - [48, 16416.9]
  - - [2048, 3498, 1, 512, 2048, 2048, 2048, 512]
    - [38, 16368.9]
  - - [2048, 3499, 1, 512, 2048, 2048, 2048, 512]
    - [48, 16444.0]
  - - [2048, 3501, 1, 512, 2048, 2048, 2048, 512]
    - [48, 16336.2]
  - - [2048, 3503, 1, 512, 2048, 2048, 2048, 512]
    - [38, 16415.7]
  - - [2048, 3505, 1, 512, 2048, 2048, 2048, 512]
    - [48, 16372.4]
  - - [2048, 3507, 1, 512, 2048, 2048, 2048, 512]
    - [38, 16434.5]
  - - [2048, 3508, 1, 512, 2048, 2048, 2048, 512]
    - [48, 16363.1]
  - - [2048, 3509, 1, 512, 2048, 2048, 2048, 512]
    - [38, 16385.2]
  - - [2048, 3510, 1, 512, 2048, 2048, 2048, 512]
    - [48, 16372.4]
  - - [2048, 3511, 1, 512, 2048, 2048, 2048, 512]
    - [48, 16429.7]
  - - [2048, 3513, 1, 512, 2048, 2048, 2048, 512]
    - [38, 16450.8]
  - - [2048, 3514, 1, 512, 2048, 2048, 2048, 512]
    - [38, 16402.7]
  - - [2048, 3515, 1, 512, 2048, 2048, 2048, 512]
    - [48, 16436.7]
  - - [2048, 3517, 1, 512, 2048, 2048, 2048, 512]
    - [38, 16405.1]
  - - [2048, 3518, 1, 512, 2048, 2048, 2048, 512]
    - [38, 16444.8]
  - - [2048, 3519, 1, 512, 2048, 2048, 2048, 512]
    - [38, 16385.2]
  - - [2048, 3520, 1, 512, 2048, 2048, 2048, 512]
    - [48, 16596.2]
  - - [2048, 3523, 1, 512, 2048, 2048, 2048, 512]
    - [48, 16544.9]
  - - [2048, 3528, 1, 512, 2048, 2048, 2048, 512]
    - [48, 16538.8]
  - - [2048, 3529, 1, 512, 2048, 2048, 2048, 512]
    - [48, 16614.8]
  - - [2048, 3530, 1, 512, 2048, 2048, 2048, 512]
    - [48, 16601.6]
  - - [2048, 3531, 1, 512, 2048, 2048, 2048, 512]
    - [38, 16552.8]
  - - [2048, 3532, 1, 512, 2048, 2048, 2048, 512]
    - [38, 16551.6]
  - - [2048, 3533, 1, 512, 2048, 2048, 2048, 512]
    - [48, 16556.3]
  - - [2048, 3534, 1, 512, 2048, 2048, 2048, 512]
    - [38, 16513.7]
  - - [2048, 3538, 1, 512, 2048, 2048, 2048, 512]
    - [48, 16573.8]
  - - [2048, 3539, 1, 512, 2048, 2048, 2048, 512]
    - [38, 16566.6]
  - - [2048, 3540, 1, 512, 2048, 2048, 2048, 512]
    - [38, 16530.0]
  - - [2048, 3541, 1, 512, 2048, 2048, 2048, 512]
    - [38, 16570.1]
  - - [2048, 3547, 1, 512, 2048, 2048, 2048, 512]
    - [48, 16515.6]
  - - [2048, 3548, 1, 512, 2048, 2048, 2048, 512]
    - [48, 16602.8]
  - - [2048, 3552, 1, 512, 2048, 2048, 2048, 512]
    - [48, 16562.4]
  - - [2048, 3564, 1, 512, 2048, 2048, 2048, 512]
    - [38, 16547.7]
  - - [2048, 3575, 1, 512, 2048, 2048, 2048, 512]
    - [44, 16470.5]
  - - [2048, 3598, 1, 512, 2048, 2048, 2048, 512]
    - [48, 16806.8]
  - - [2048, 3599, 1, 512, 2048, 2048, 2048, 512]
    - [38, 16829.5]
  - - [2048, 3608, 1, 512, 2048, 2048, 2048, 512]
    - [38, 16799.6]
  - - [2048, 3776, 1, 512, 2048, 2048, 2048, 512]
    - [48, 17317.4]
  - - [2048, 3780, 1, 512, 2048, 2048, 2048, 512]
    - [38, 17378.3]
  - - [2048, 3796, 1, 512, 2048, 2048, 2048, 512]
    - [48, 17482.5]
  - - [2048, 3822, 1, 512, 2048, 2048, 2048, 512]
    - [38, 17461.1]
  - - [2048, 3835, 1, 512, 2048, 2048, 2048, 512]
    - [38, 17551.1]
  - - [2048, 3840, 1, 512, 2048, 2048, 2048, 512]
    - [38, 17678.9]
  - - [2048, 3859, 1, 512, 2048, 2048, 2048, 512]
    - [48, 16300.6]
  - - [2048, 3864, 1, 512, 2048, 2048, 2048, 512]
    - [38, 16311.2]
  - - [2048, 3870, 1, 512, 2048, 2048, 2048, 512]
    - [48, 16373.5]
  - - [2048, 3876, 1, 512, 2048, 2048, 2048, 512]
    - [38, 16409.5]
  - - [2048, 3906, 1, 512, 2048, 2048, 2048, 512]
    - [48, 16568.6]
  - - [2048, 3910, 1, 512, 2048, 2048, 2048, 512]
    - [48, 16532.1]
  - - [2048, 3925, 1, 512, 2048, 2048, 2048, 512]
    - [38, 16520.9]
  - - [2048, 3942, 1, 512, 2048, 2048, 2048, 512]
    - [48, 16640.5]
  - - [2048, 3944, 1, 512, 2048, 2048, 2048, 512]
    - [38, 16568.9]
  - - [2048, 3955, 1, 512, 2048, 2048, 2048, 512]
    - [38, 16673.9]
  - - [2048, 3968, 1, 512, 2048, 2048, 2048, 512]
    - [38, 16820.7]
  - - [2048, 3969, 1, 512, 2048, 2048, 2048, 512]
    - [38, 16743.7]
  - - [2048, 3976, 1, 512, 2048, 2048, 2048, 512]
    - [48, 16778.6]
  - - [2048, 3977, 1, 512, 2048, 2048, 2048, 512]
    - [38, 16772.1]
  - - [2048, 3978, 1, 512, 2048, 2048, 2048, 512]
    - [48, 16814.1]
  - - [2048, 3990, 1, 512, 2048, 2048, 2048, 512]
    - [48, 16767.5]
  - - [2048, 3995, 1, 512, 2048, 2048, 2048, 512]
    - [48, 16804.7]
  - - [2048, 3996, 1, 512, 2048, 2048, 2048, 512]
    - [48, 16760.5]
  - - [2048, 3999, 1, 512, 2048, 2048, 2048, 512]
    - [48, 16821.5]
  - - [2048, 4005, 1, 512, 2048, 2048, 2048, 512]
    - [38, 16895.6]
  - - [2048, 4012, 1, 512, 2048, 2048, 2048, 512]
    - [48, 16710.0]
  - - [2048, 4020, 1, 512, 2048, 2048, 2048, 512]
    - [48, 16780.6]
  - - [2048, 4026, 1, 512, 2048, 2048, 2048, 512]
    - [48, 16752.3]
  - - [2048, 4030, 1, 512, 2048, 2048, 2048, 512]
    - [48, 16854.6]
  - - [2048, 4032, 1, 512, 2048, 2048, 2048, 512]
    - [38, 17009.5]
  - - [512, 160, 1, 2048, 512, 512, 512, 2048]
    - [62, 4539.29]
  - - [512, 174, 1, 2048, 512, 512, 512, 2048]
    - [65, 5148.2]
  - - [512, 182, 1, 512, 512, 512, 512, 512]
    - [60, 3923.54]
  - - [512, 184, 1, 512, 512, 512, 512, 512]
    - [62, 4073.86]
  - - [512, 184, 1, 2048, 512, 512, 512, 2048]
    - [61, 5288.87]
  - - [512, 189, 1, 512, 512, 512, 512, 512]
    - [62, 4128.77]
  - - [512, 189, 1, 2048, 512, 512, 512, 2048]
    - [60, 5529.6]
  - - [512, 198, 1, 2048, 512, 512, 512, 2048]
    - [65, 5605.24]
  - - [512, 206, 1, 512, 512, 512, 512, 512]
    - [62, 4411.9]
  - - [512, 207, 1, 2048, 512, 512, 512, 2048]
    - [65, 5664.28]
  - - [512, 208, 1, 512, 512, 512, 512, 512]
    - [59, 4425.81]
  - - [512, 208, 1, 2048, 512, 512, 512, 2048]
    - [65, 5715.51]
  - - [512, 224, 1, 512, 512, 512, 512, 512]
    - [58, 4705.15]
  - - [512, 245, 1, 2048, 512, 512, 512, 2048]
    - [65, 5653.63]
  - - [512, 246, 1, 512, 512, 512, 512, 512]
    - [64, 4404.88]
  - - [512, 246, 1, 2048, 512, 512, 512, 2048]
    - [65, 5696.77]
  - - [512, 264, 1, 512, 512, 512, 512, 512]
    - [64, 4676.08]
  - - [512, 264, 1, 2048, 512, 512, 512, 2048]
    - [65, 6102.82]
  - - [512, 401, 1, 2048, 512, 512, 512, 2048]
    - [57, 7809.79]
  - - [512, 439, 1, 2048, 512, 512, 512, 2048]
    - [51, 8127.2]
  - - [512, 443, 1, 2048, 512, 512, 512, 2048]
    - [55, 8121.04]
  - - [512, 446, 1, 2048, 512, 512, 512, 2048]
    - [53, 8315.52]
  - - [512, 455, 1, 512, 512, 512, 512, 512]
    - [66, 7308.55]
  - - [512, 465, 1, 512, 512, 512, 512, 512]
    - [63, 7469.18]
  - - [512, 465, 1, 2048, 512, 512, 512, 2048]
    - [52, 8465.07]
  - - [512, 468, 1, 512, 512, 512, 512, 512]
    - [64, 7444.38]
  - - [512, 468, 1, 2048, 512, 512, 512, 2048]
    - [54, 8496.08]
  - - [512, 476, 1, 512, 512, 512, 512, 512]
    - [65, 7571.63]
  - - [512, 493, 1, 512, 512, 512, 512, 512]
    - [64, 6731.09]
  - - [512, 493, 1, 2048, 512, 512, 512, 2048]
    - [57, 7171.86]
  - - [512, 495, 1, 2048, 512, 512, 512, 2048]
    - [64, 7526.76]
  - - [512, 511, 1, 2048, 512, 512, 512, 2048]
    - [56, 7628.45]
  - - [512, 512, 1, 2048, 512, 512, 512, 2048]
    - [56, 7574.36]
  - - [64, 7, 736, 7, 64, 64, 64, 7]
    - [67, 146.457]
  - - [64, 8, 264, 8, 64, 64, 64, 8]
    - [69, 118.568]
  - - [64, 9, 416, 9, 64, 64, 64, 9]
    - [69, 213.943]
  - - [64, 10, 448, 10, 64, 64, 64, 10]
    - [92, 277.829]
  - - [64, 11, 568, 11, 64, 64, 64, 11]
    - [87, 341.506]
  - - [64, 12, 480, 12, 64, 64, 64, 12]
    - [92, 397.813]
  - - [64, 12, 2520, 12, 64, 64, 64, 12]
    - [68, 565.895]
  - - [64, 13, 576, 13, 64, 64, 64, 13]
    - [70, 445.001]
  - - [64, 13, 2336, 13, 64, 64, 64, 13]
    - [69, 649.85]
  - - [64, 14, 704, 14, 64, 64, 64, 14]
    - [68, 554.71]
  - - [64, 14, 2184, 14, 64, 64, 64, 14]
    - [87, 706.085]
  - - [64, 15, 688, 15, 64, 64, 64, 15]
    - [67, 610.049]
  - - [64, 15, 2048, 15, 64, 64, 64, 15]
    - [32, 769.603]
  - - [64, 16, 712, 16, 64, 64, 64, 16]
    - [27, 697.692]
  - - [64, 16, 1920, 16, 64, 64, 64, 16]
    - [21, 831.323]
  - - [64, 17, 688, 17, 64, 64, 64, 17]
    - [86, 746.787]
  - - [64, 17, 1816, 17, 64, 64, 64, 17]
    - [19, 943.504]
  - - [64, 18, 648, 18, 64, 64, 64, 18]
    - [67, 766.948]
  - - [64, 18, 1720, 18, 64, 64, 64, 18]
    - [67, 995.143]
  - - [64, 19, 680, 19, 64, 64, 64, 19]
    - [71, 884.613]
  - - [64, 19, 1632, 19, 64, 64, 64, 19]
    - [68, 1098.65]
  - - [64, 21, 1472, 21, 64, 64, 64, 21]
    - [32, 1210.54]
  - - [64, 21, 1488, 21, 64, 64, 64, 21]
    - [71, 1206.82]
  - - [64, 23, 64, 23, 64, 64, 64, 23]
    - [76, 239.688]
  - - [64, 23, 1360, 23, 64, 64, 64, 23]
    - [89, 1390.22]
  - - [64, 25, 176, 25, 64, 64, 64, 25]
    - [74, 637.681]
  - - [64, 25, 1256, 25, 64, 64, 64, 25]
    - [89, 1535.45]
  - - [64, 26, 56, 26, 64, 64, 64, 26]
    - [76, 263.346]
  - - [64, 27, 56, 26, 64, 64, 64, 26]
    - [78, 317.673]
  - - [64, 27, 56, 27, 64, 64, 64, 27]
    - [20, 323.358]
  - - [64, 27, 1168, 27, 64, 64, 64, 27]
    - [71, 1661.41]
  - - [64, 29, 136, 29, 64, 64, 64, 29]
    - [88, 658.279]
  - - [64, 29, 1088, 29, 64, 64, 64, 29]
    - [71, 1798.54]
  - - [64, 32, 624, 32, 64, 64, 64, 32]
    - [35, 1750.62]
  - - [64, 32, 992, 32, 64, 64, 64, 32]
    - [83, 1991.78]
  - - [64, 35, 384, 35, 64, 64, 64, 35]
    - [43, 1718.36]
  - - [64, 35, 904, 35, 64, 64, 64, 35]
    - [91, 2225.93]
  - - [64, 38, 320, 38, 64, 64, 64, 38]
    - [71, 1935.41]
  - - [64, 38, 840, 38, 64, 64, 64, 38]
    - [67, 2567.11]
  - - [64, 41, 312, 41, 64, 64, 64, 41]
    - [90, 2056.75]
  - - [64, 41, 776, 41, 64, 64, 64, 41]
    - [71, 2703.54]
  - - [64, 45, 392, 45, 64, 64, 64, 45]
    - [73, 2510.04]
  - - [64, 45, 712, 45, 64, 64, 64, 45]
    - [95, 3035.37]
  - - [64, 49, 160, 49, 64, 64, 64, 49]
    - [71, 1688.62]
  - - [64, 49, 648, 49, 64, 64, 64, 49]
    - [33, 3151.08]
  - - [64, 54, 200, 54, 64, 64, 64, 54]
    - [24, 2309.7]
  - - [64, 54, 592, 54, 64, 64, 64, 54]
    - [90, 3550.17]
  - - [64, 59, 512, 59, 64, 64, 64, 59]
    - [85, 3591.48]
  - - [64, 59, 544, 59, 64, 64, 64, 59]
    - [90, 3768.49]
  - - [64, 64, 496, 64, 64, 64, 64, 64]
    - [30, 3906.95]
  - - [64, 65, 472, 65, 64, 64, 64, 65]
    - [22, 4584.37]
  - - [64, 65, 496, 64, 64, 64, 64, 64]
    - [82, 3893.13]
  - - [64, 65, 496, 65, 64, 64, 64, 65]
    - [82, 4010.72]
  - - [64, 70, 216, 70, 64, 64, 64, 70]
    - [71, 3513.36]
  - - [64, 71, 216, 70, 64, 64, 64, 70]
    - [71, 3548.83]
  - - [64, 71, 216, 71, 64, 64, 64, 71]
    - [83, 3570.02]
  - - [64, 71, 448, 71, 64, 64, 64, 71]
    - [83, 4922.87]
  - - [64, 77, 248, 77, 64, 64, 64, 77]
    - [84, 3987.5]
  - - [64, 77, 408, 77, 64, 64, 64, 77]
    - [22, 5119.64]
  - - [64, 78, 248, 77, 64, 64, 64, 77]
    - [72, 4108.93]
  - - [64, 78, 248, 78, 64, 64, 64, 78]
    - [22, 4037.01]
  - - [64, 78, 408, 77, 64, 64, 64, 77]
    - [23, 5158.84]
  - - [64, 78, 408, 78, 64, 64, 64, 78]
    - [29, 5198.48]
  - - [64, 80, 152, 80, 64, 64, 64, 80]
    - [30, 3229.21]
  - - [64, 84, 152, 80, 64, 64, 64, 80]
    - [81, 3348.98]
  - - [64, 84, 152, 84, 64, 64, 64, 84]
    - [77, 3377.99]
  - - [64, 85, 376, 85, 64, 64, 64, 85]
    - [28, 5433.2]
  - - [64, 91, 40, 91, 64, 64, 64, 91]
    - [71, 1305.38]
  - - [64, 93, 40, 91, 64, 64, 64, 91]
    - [71, 1354.08]
  - - [64, 93, 40, 93, 64, 64, 64, 93]
    - [71, 1363.39]
  - - [64, 93, 344, 93, 64, 64, 64, 93]
    - [30, 6450.42]
  - - [64, 102, 56, 102, 64, 64, 64, 102]
    - [30, 2090.13]
  - - [64, 102, 312, 102, 64, 64, 64, 102]
    - [81, 6888.17]
  - - [64, 103, 16, 103, 64, 64, 64, 103]
    - [93, 640.543]
  - - [64, 104, 16, 103, 64, 64, 64, 103]
    - [94, 643.726]
  - - [64, 104, 16, 104, 64, 64, 64, 104]
    - [96, 665.6]
  - - [64, 112, 16, 112, 64, 64, 64, 112]
    - [96, 753.818]
  - - [64, 112, 288, 112, 64, 64, 64, 112]
    - [26, 7298.33]
  - - [64, 119, 32, 119, 64, 64, 64, 119]
    - [98, 1536.11]
  - - [64, 122, 264, 122, 64, 64, 64, 122]
    - [28, 7293.5]
  - - [64, 122, 264, 123, 64, 64, 64, 123]
    - [79, 7353.29]
  - - [64, 123, 16, 112, 64, 64, 64, 112]
    - [97, 808.866]
  - - [64, 123, 16, 123, 64, 64, 64, 123]
    - [96, 845.638]
  - - [64, 123, 264, 123, 64, 64, 64, 123]
    - [72, 7311.77]
  - - [64, 134, 240, 134, 64, 64, 64, 134]
    - [80, 6867.63]
  - - [64, 134, 240, 135, 64, 64, 64, 135]
    - [80, 6823.73]
  - - [64, 135, 32, 119, 64, 64, 64, 119]
    - [75, 1844.23]
  - - [64, 135, 32, 135, 64, 64, 64, 135]
    - [75, 1944.0]
  - - [64, 135, 240, 135, 64, 64, 64, 135]
    - [84, 6874.66]
- null
