HostLibraryTests/configs/lite_configs/arcturus_Cijk_Alik_Bljk_SB.yaml
- {MinimumRequiredVersion: 4.12.0}
- arcturus
- gfx908
- [Device 7380, Device 7388, Device 738c]
    SolutionIndex: 0
    SolutionNameMin: Cijk_Alik_Bljk_SB_MT128x64x16_SE_AMAS3_GRVW4_VW4
    SolutionIndex: 1
    SolutionNameMin: Cijk_Alik_Bljk_SB_MT32x64x16_SE_AMAS3_GRVW4_VW4
    SolutionIndex: 2
    SolutionNameMin: Cijk_Alik_Bljk_SB_MT32x32x32_SE_AMAS3_GRVW4_VW4
    SolutionIndex: 3
    SolutionNameMin: Cijk_Alik_Bljk_SB_MT128x128x16_SE_AMAS3_GRVW4_VW4
    SolutionIndex: 4
    SolutionNameMin: Cijk_Alik_Bljk_SB_MT64x128x16_SE_AMAS3_GRVW4_VW4
    SolutionIndex: 5
    SolutionNameMin: Cijk_Alik_Bljk_SB_MT64x32x16_SE_AMAS3_GRVW4_VW4
    SolutionIndex: 6
    SolutionNameMin: Cijk_Alik_Bljk_SB_MT64x64x16_SE_AMAS3_GRVW4_VW4
    SolutionIndex: 7
    SolutionNameMin: Cijk_Alik_Bljk_SB_MT8x8x8_SE_AMAS3_GRVW2_VW2
    SolutionIndex: 8
    SolutionNameMin: Cijk_Alik_Bljk_SB_MT8x8x8_SE_AMAS0_GRVW1_VW1
- - - [6784, 448, 1, 256, 6784, 6784, 256, 256]
    - [6, 2954.59]
  - - [1856, 6784, 1, 3328, 1856, 1856, 3328, 3328]
    - [4, 4025.85]
  - - [4, 2944, 1, 768, 4, 4, 768, 768]
    - [7, 116.076]
  - - [1024, 128, 1, 256, 1024, 1024, 256, 256]
    - [1, 845.171]
  - - [128, 4288, 1, 768, 128, 128, 768, 768]
    - [1, 1972.31]
  - - [1024, 1024, 1, 3328, 1024, 1024, 3328, 3328]
    - [5, 2480.72]
  - - [4, 1408, 1, 768, 4, 4, 768, 768]
    - [7, 59.9816]
  - - [5056, 6784, 1, 768, 5056, 5056, 768, 768]
    - [3, 4257.57]
  - - [704, 5056, 1, 256, 704, 704, 256, 256]
    - [3, 3289.8]
  - - [1408, 2944, 1, 1792, 1408, 1408, 1792, 1792]
    - [4, 3303.91]
  - - [704, 256, 1, 768, 704, 704, 768, 768]
    - [5, 1484.0]
  - - [5888, 1408, 1, 768, 5888, 5888, 768, 768]
    - [0, 3705.47]
  - - [64, 3584, 1, 256, 64, 64, 256, 256]
    - [2, 1238.89]
  - - [5888, 64, 1, 768, 5888, 5888, 768, 768]
    - [5, 2209.44]
  - - [3584, 2944, 1, 3328, 3584, 3584, 3328, 3328]
    - [3, 4001.8]
  - - [256, 4, 1, 1792, 256, 256, 1792, 1792]
    - [7, 13.0749]
  - - [4288, 5888, 1, 256, 4288, 4288, 256, 256]
    - [4, 3907.7]
  - - [64, 128, 1, 256, 64, 64, 256, 256]
    - [2, 74.4445]
  - - [5888, 5888, 1, 768, 5888, 5888, 768, 768]
    - [3, 4282.36]
  - - [3584, 4, 1, 1792, 3584, 3584, 1792, 1792]
    - [8, 120.803]
  - - [1856, 2944, 1, 1792, 1856, 1856, 1792, 1792]
    - [4, 3782.03]
  - - [448, 2944, 1, 3328, 448, 448, 3328, 3328]
    - [5, 2976.19]
  - - [5888, 3584, 1, 256, 5888, 5888, 256, 256]
    - [0, 3847.68]
  - - [4288, 5888, 1, 1792, 4288, 4288, 1792, 1792]
    - [3, 4112.42]
  - - [6784, 128, 1, 3328, 6784, 6784, 3328, 3328]
    - [6, 3046.15]
  - - [128, 256, 1, 3328, 128, 128, 3328, 3328]
    - [2, 449.449]
  - - [4, 1408, 1, 1792, 4, 4, 1792, 1792]
    - [7, 62.3904]
  - - [64, 4, 1, 3328, 64, 64, 3328, 3328]
    - [7, 3.39824]
  - - [2944, 256, 1, 256, 2944, 2944, 256, 256]
    - [6, 2200.75]
  - - [5888, 1024, 1, 3328, 5888, 5888, 3328, 3328]
    - [4, 3516.69]
  - - [5056, 704, 1, 3328, 5056, 5056, 3328, 3328]
    - [3, 4032.95]
  - - [4288, 448, 1, 1792, 4288, 4288, 1792, 1792]
    - [0, 3915.86]
  - - [4288, 704, 1, 3328, 4288, 4288, 3328, 3328]
    - [3, 3413.62]
  - - [1024, 704, 1, 3328, 1024, 1024, 3328, 3328]
    - [5, 2585.53]
  - - [704, 1024, 1, 768, 704, 704, 768, 768]
    - [5, 2676.32]
  - - [2944, 256, 1, 1792, 2944, 2944, 1792, 1792]
    - [6, 2610.68]
  - - [6784, 64, 1, 1792, 6784, 6784, 1792, 1792]
    - [5, 2760.48]
  - - [2368, 4, 1, 3328, 2368, 2368, 3328, 3328]
    - [7, 104.231]
  - - [64, 64, 1, 768, 64, 64, 768, 768]
    - [2, 47.383]
  - - [4288, 2944, 1, 768, 4288, 4288, 768, 768]
    - [4, 3924.37]
  - - [2368, 64, 1, 1792, 2368, 2368, 1792, 1792]
    - [5, 1289.67]
  - - [1408, 5056, 1, 3328, 1408, 1408, 3328, 3328]
    - [3, 4057.1]
  - - [1856, 1856, 1, 256, 1856, 1856, 256, 256]
    - [3, 3225.34]
  - - [1024, 4288, 1, 1792, 1024, 1024, 1792, 1792]
    - [0, 3503.28]
  - - [2944, 1408, 1, 3328, 2944, 2944, 3328, 3328]
    - [4, 3301.1]
  - - [4288, 448, 1, 768, 4288, 4288, 768, 768]
    - [0, 3759.95]
  - - [6784, 256, 1, 768, 6784, 6784, 768, 768]
    - [4, 3445.79]
  - - [4288, 1408, 1, 768, 4288, 4288, 768, 768]
    - [4, 3442.49]
  - - [448, 1856, 1, 1792, 448, 448, 1792, 1792]
    - [6, 2882.31]
  - - [2368, 6784, 1, 256, 2368, 2368, 256, 256]
    - [4, 3759.15]
  - - [448, 704, 1, 1792, 448, 448, 1792, 1792]
    - [5, 2018.01]
  - - [6784, 4, 1, 768, 6784, 6784, 768, 768]
    - [8, 219.812]
  - - [4288, 2368, 1, 256, 4288, 4288, 256, 256]
    - [0, 3566.71]
  - - [5056, 5888, 1, 256, 5056, 5056, 256, 256]
    - [3, 3912.43]
  - - [1856, 704, 1, 768, 1856, 1856, 768, 768]
    - [6, 2935.45]
  - - [1024, 5888, 1, 768, 1024, 1024, 768, 768]
    - [0, 3457.56]
  - - [704, 256, 1, 3328, 704, 704, 3328, 3328]
    - [5, 1594.49]
  - - [2944, 704, 1, 1792, 2944, 2944, 1792, 1792]
    - [5, 2992.89]
  - - [3584, 5056, 1, 256, 3584, 3584, 256, 256]
    - [0, 3768.5]
  - - [64, 256, 1, 768, 64, 64, 768, 768]
    - [2, 197.778]
  - - [3584, 128, 1, 768, 3584, 3584, 768, 768]
    - [5, 2634.93]
  - - [2944, 5056, 1, 256, 2944, 2944, 256, 256]
    - [3, 3751.81]
  - - [5056, 64, 1, 1792, 5056, 5056, 1792, 1792]
    - [5, 2059.72]
  - - [5888, 6784, 1, 3328, 5888, 5888, 3328, 3328]
    - [3, 4168.66]
  - - [1856, 3584, 1, 3328, 1856, 1856, 3328, 3328]
    - [4, 3866.16]
  - - [128, 128, 1, 256, 128, 128, 256, 256]
    - [2, 153.45]
  - - [5888, 5056, 1, 768, 5888, 5888, 768, 768]
    - [3, 4119.58]
  - - [1408, 4288, 1, 256, 1408, 1408, 256, 256]
    - [6, 3268.41]
  - - [448, 1408, 1, 256, 448, 448, 256, 256]
    - [5, 1929.12]
  - - [5888, 1408, 1, 256, 5888, 5888, 256, 256]
    - [4, 3553.24]
  - - [1856, 704, 1, 1792, 1856, 1856, 1792, 1792]
    - [6, 2971.75]
  - - [6784, 4288, 1, 256, 6784, 6784, 256, 256]
    - [0, 3894.12]
  - - [5056, 256, 1, 768, 5056, 5056, 768, 768]
    - [6, 2896.24]
  - - [2368, 64, 1, 3328, 2368, 2368, 3328, 3328]
    - [5, 1313.5]
  - - [1024, 256, 1, 1792, 1024, 1024, 1792, 1792]
    - [5, 1682.69]
  - - [64, 5888, 1, 768, 64, 64, 768, 768]
    - [1, 1860.07]
  - - [704, 1024, 1, 1792, 704, 704, 1792, 1792]
    - [5, 2829.95]
  - - [1856, 4, 1, 3328, 1856, 1856, 3328, 3328]
    - [7, 85.9574]
  - - [5888, 64, 1, 256, 5888, 5888, 256, 256]
    - [5, 1724.63]
  - - [4288, 1856, 1, 3328, 4288, 4288, 3328, 3328]
    - [4, 3608.87]
  - - [448, 6784, 1, 256, 448, 448, 256, 256]
    - [6, 2951.84]
  - - [5056, 1024, 1, 768, 5056, 5056, 768, 768]
    - [4, 3544.32]
  - - [6784, 704, 1, 256, 6784, 6784, 256, 256]
    - [0, 3394.21]
  - - [5888, 128, 1, 3328, 5888, 5888, 3328, 3328]
    - [6, 2647.22]
  - - [1856, 256, 1, 256, 1856, 1856, 256, 256]
    - [5, 2117.2]
  - - [704, 3584, 1, 1792, 704, 704, 1792, 1792]
    - [5, 3077.93]
  - - [2368, 2368, 1, 256, 2368, 2368, 256, 256]
    - [0, 3537.99]
  - - [4, 64, 1, 256, 4, 4, 256, 256]
    - [7, 2.47794]
  - - [5888, 448, 1, 1792, 5888, 5888, 1792, 1792]
    - [0, 3350.62]
  - - [448, 1856, 1, 768, 448, 448, 768, 768]
    - [6, 2769.06]
  - - [128, 5888, 1, 1792, 128, 128, 1792, 1792]
    - [6, 2611.65]
  - - [1856, 5056, 1, 3328, 1856, 1856, 3328, 3328]
    - [0, 3931.4]
  - - [1856, 4288, 1, 1792, 1856, 1856, 1792, 1792]
    - [0, 3628.16]
  - - [4, 64, 1, 1792, 4, 4, 1792, 1792]
    - [7, 3.34032]
  - - [256, 1408, 1, 256, 256, 256, 256, 256]
    - [5, 1656.91]
  - - [128, 3584, 1, 1792, 128, 128, 1792, 1792]
    - [1, 2845.71]
  - - [4, 1024, 1, 1792, 4, 4, 1792, 1792]
    - [7, 45.7854]
  - - [2368, 4288, 1, 768, 2368, 2368, 768, 768]
    - [0, 3748.16]
  - - [5056, 3584, 1, 3328, 5056, 5056, 3328, 3328]
    - [3, 4145.64]
  - - [448, 704, 1, 768, 448, 448, 768, 768]
    - [5, 1867.3]
  - - [2368, 5056, 1, 3328, 2368, 2368, 3328, 3328]
    - [0, 3791.39]
  - - [128, 448, 1, 256, 128, 128, 256, 256]
    - [2, 504.215]
  - - [6784, 2944, 1, 3328, 6784, 6784, 3328, 3328]
    - [0, 3949.4]
  - - [704, 6784, 1, 256, 704, 704, 256, 256]
    - [4, 3507.09]
  - - [4, 4, 1, 768, 4, 4, 768, 768]
    - [7, 0.189148]
  - - [2368, 1856, 1, 1792, 2368, 2368, 1792, 1792]
    - [0, 3491.21]
  - - [448, 6784, 1, 768, 448, 448, 768, 768]
    - [3, 3243.14]
  - - [256, 3584, 1, 3328, 256, 256, 3328, 3328]
    - [5, 3055.67]
  - - [5056, 704, 1, 1792, 5056, 5056, 1792, 1792]
    - [3, 3974.1]
  - - [1408, 704, 1, 3328, 1408, 1408, 3328, 3328]
    - [6, 2313.73]
  - - [704, 1856, 1, 1792, 704, 704, 1792, 1792]
    - [5, 2892.91]
  - - [1024, 1856, 1, 256, 1024, 1024, 256, 256]
    - [0, 3394.58]
  - - [2368, 1024, 1, 256, 2368, 2368, 256, 256]
    - [6, 3161.19]
  - - [4, 2368, 1, 768, 4, 4, 768, 768]
    - [7, 94.5694]
  - - [2944, 2944, 1, 256, 2944, 2944, 256, 256]
    - [4, 3700.44]
  - - [1024, 4, 1, 3328, 1024, 1024, 3328, 3328]
    - [7, 47.3194]
  - - [704, 5056, 1, 3328, 704, 704, 3328, 3328]
    - [3, 4032.43]
  - - [64, 704, 1, 3328, 64, 64, 3328, 3328]
    - [2, 614.494]
  - - [1856, 1024, 1, 3328, 1856, 1856, 3328, 3328]
    - [4, 3945.16]
  - - [448, 5888, 1, 3328, 448, 448, 3328, 3328]
    - [4, 3369.2]
  - - [5888, 256, 1, 768, 5888, 5888, 768, 768]
    - [0, 3002.56]
  - - [128, 128, 1, 768, 128, 128, 768, 768]
    - [2, 199.873]
  - - [4288, 2944, 1, 256, 4288, 4288, 256, 256]
    - [4, 3803.42]
  - - [256, 2368, 1, 1792, 256, 256, 1792, 1792]
    - [5, 2333.84]
  - - [5888, 1856, 1, 3328, 5888, 5888, 3328, 3328]
    - [3, 4137.48]
  - - [704, 5056, 1, 768, 704, 704, 768, 768]
    - [3, 3794.16]
  - - [4, 3584, 1, 768, 4, 4, 768, 768]
    - [7, 137.801]
  - - [704, 5888, 1, 1792, 704, 704, 1792, 1792]
    - [5, 3308.23]
  - - [5888, 704, 1, 1792, 5888, 5888, 1792, 1792]
    - [0, 3306.04]
  - - [448, 64, 1, 1792, 448, 448, 1792, 1792]
    - [2, 379.582]
  - - [4, 1024, 1, 3328, 4, 4, 3328, 3328]
    - [7, 47.0106]
  - - [3584, 2368, 1, 256, 3584, 3584, 256, 256]
    - [0, 3572.96]
  - - [6784, 64, 1, 256, 6784, 6784, 256, 256]
    - [5, 1920.96]
  - - [3584, 5888, 1, 768, 3584, 3584, 768, 768]
    - [0, 3979.16]
  - - [4288, 3584, 1, 768, 4288, 4288, 768, 768]
    - [3, 4245.44]
  - - [5056, 1024, 1, 1792, 5056, 5056, 1792, 1792]
    - [4, 3591.76]
  - - [5888, 2368, 1, 256, 5888, 5888, 256, 256]
    - [0, 3685.82]
  - - [1856, 5888, 1, 1792, 1856, 1856, 1792, 1792]
    - [3, 4128.27]
  - - [6784, 1408, 1, 768, 6784, 6784, 768, 768]
    - [0, 3899.64]
  - - [4, 6784, 1, 768, 4, 4, 768, 768]
    - [7, 185.705]
  - - [128, 1408, 1, 3328, 128, 128, 3328, 3328]
    - [1, 1542.23]
  - - [128, 3584, 1, 256, 128, 128, 256, 256]
    - [1, 2016.49]
  - - [2368, 1024, 1, 768, 2368, 2368, 768, 768]
    - [6, 3361.14]
  - - [1024, 256, 1, 3328, 1024, 1024, 3328, 3328]
    - [5, 1730.08]
  - - [704, 5056, 1, 1792, 704, 704, 1792, 1792]
    - [3, 3968.13]
  - - [256, 704, 1, 3328, 256, 256, 3328, 3328]
    - [2, 1539.55]
  - - [6784, 2944, 1, 768, 6784, 6784, 768, 768]
    - [0, 3928.83]
  - - [1408, 128, 1, 768, 1408, 1408, 768, 768]
    - [5, 1477.08]
  - - [6784, 2944, 1, 256, 6784, 6784, 256, 256]
    - [4, 3802.97]
  - - [2944, 5056, 1, 3328, 2944, 2944, 3328, 3328]
    - [3, 4251.2]
  - - [64, 4, 1, 1792, 64, 64, 1792, 1792]
    - [7, 3.29931]
  - - [3584, 704, 1, 3328, 3584, 3584, 3328, 3328]
    - [0, 3234.49]
  - - [64, 704, 1, 256, 64, 64, 256, 256]
    - [2, 399.61]
  - - [704, 5888, 1, 3328, 704, 704, 3328, 3328]
    - [5, 3310.51]
  - - [1024, 128, 1, 1792, 1024, 1024, 1792, 1792]
    - [1, 1127.07]
  - - [256, 1024, 1, 256, 256, 256, 256, 256]
    - [5, 1229.4]
  - - [5888, 64, 1, 3328, 5888, 5888, 3328, 3328]
    - [5, 2483.92]
  - - [3584, 1408, 1, 768, 3584, 3584, 768, 768]
    - [4, 3449.25]
  - - [4, 1024, 1, 768, 4, 4, 768, 768]
    - [7, 44.6838]
  - - [6784, 1024, 1, 256, 6784, 6784, 256, 256]
    - [3, 3532.17]
  - - [5056, 2368, 1, 256, 5056, 5056, 256, 256]
    - [0, 3602.91]
  - - [1024, 64, 1, 256, 1024, 1024, 256, 256]
    - [2, 557.951]
  - - [704, 448, 1, 3328, 704, 704, 3328, 3328]
    - [5, 2082.54]
  - - [2944, 448, 1, 1792, 2944, 2944, 1792, 1792]
    - [5, 2898.46]
  - - [3584, 1856, 1, 1792, 3584, 3584, 1792, 1792]
    - [0, 3850.44]
  - - [1856, 4, 1, 256, 1856, 1856, 256, 256]
    - [7, 56.5909]
  - - [1856, 1856, 1, 768, 1856, 1856, 768, 768]
    - [3, 3687.44]
  - - [1856, 1024, 1, 768, 1856, 1856, 768, 768]
    - [4, 3784.63]
  - - [448, 2368, 1, 256, 448, 448, 256, 256]
    - [6, 2202.49]
  - - [1024, 6784, 1, 3328, 1024, 1024, 3328, 3328]
    - [3, 3929.59]
  - - [448, 2944, 1, 768, 448, 448, 768, 768]
    - [6, 2959.0]
  - - [128, 704, 1, 3328, 128, 128, 3328, 3328]
    - [2, 1213.31]
  - - [5888, 1408, 1, 1792, 5888, 5888, 1792, 1792]
    - [0, 3777.43]
  - - [6784, 1856, 1, 256, 6784, 6784, 256, 256]
    - [0, 3763.48]
  - - [3584, 256, 1, 1792, 3584, 3584, 1792, 1792]
    - [6, 3171.29]
  - - [2368, 128, 1, 256, 2368, 2368, 256, 256]
    - [5, 1415.27]
  - - [3584, 6784, 1, 3328, 3584, 3584, 3328, 3328]
    - [4, 4063.84]
  - - [64, 3584, 1, 1792, 64, 64, 1792, 1792]
    - [2, 1867.92]
  - - [704, 2368, 1, 256, 704, 704, 256, 256]
    - [4, 2891.71]
  - - [4288, 4288, 1, 3328, 4288, 4288, 3328, 3328]
    - [3, 4202.4]
  - - [128, 128, 1, 3328, 128, 128, 3328, 3328]
    - [2, 225.483]
  - - [1856, 128, 1, 256, 1856, 1856, 256, 256]
    - [5, 1394.04]
  - - [1024, 5056, 1, 256, 1024, 1024, 256, 256]
    - [0, 3333.63]
  - - [448, 64, 1, 256, 448, 448, 256, 256]
    - [2, 258.161]
  - - [2368, 5888, 1, 768, 2368, 2368, 768, 768]
    - [3, 3878.62]
  - - [1856, 2368, 1, 1792, 1856, 1856, 1792, 1792]
    - [0, 3495.89]
  - - [6784, 448, 1, 768, 6784, 6784, 768, 768]
    - [3, 3232.17]
  - - [64, 1408, 1, 3328, 64, 64, 3328, 3328]
    - [2, 1211.2]
  - - [2368, 256, 1, 256, 2368, 2368, 256, 256]
    - [5, 1864.66]
  - - [64, 1024, 1, 3328, 64, 64, 3328, 3328]
    - [2, 889.455]
  - - [448, 1408, 1, 3328, 448, 448, 3328, 3328]
    - [5, 2540.22]
  - - [704, 128, 1, 3328, 704, 704, 3328, 3328]
    - [2, 1213.26]
  - - [1024, 2944, 1, 3328, 1024, 1024, 3328, 3328]
    - [3, 3415.1]
  - - [128, 2368, 1, 1792, 128, 128, 1792, 1792]
    - [1, 1897.22]
  - - [5888, 2944, 1, 768, 5888, 5888, 768, 768]
    - [0, 3978.16]
  - - [2944, 1024, 1, 1792, 2944, 2944, 1792, 1792]
    - [3, 3401.08]
  - - [5888, 2368, 1, 3328, 5888, 5888, 3328, 3328]
    - [3, 3971.91]
  - - [4288, 2368, 1, 3328, 4288, 4288, 3328, 3328]
    - [3, 3864.17]
  - - [448, 256, 1, 1792, 448, 448, 1792, 1792]
    - [2, 1451.96]
  - - [2944, 256, 1, 3328, 2944, 2944, 3328, 3328]
    - [6, 2650.71]
  - - [128, 64, 1, 768, 128, 128, 768, 768]
    - [2, 99.9024]
  - - [64, 704, 1, 768, 64, 64, 768, 768]
    - [2, 536.026]
  - - [256, 1856, 1, 3328, 256, 256, 3328, 3328]
    - [5, 3109.53]
  - - [1024, 1408, 1, 1792, 1024, 1024, 1792, 1792]
    - [6, 3308.31]
  - - [448, 448, 1, 768, 448, 448, 768, 768]
    - [5, 1632.02]
  - - [2944, 2368, 1, 256, 2944, 2944, 256, 256]
    - [3, 3452.57]
  - - [3584, 3584, 1, 256, 3584, 3584, 256, 256]
    - [4, 3642.52]
  - - [448, 128, 1, 768, 448, 448, 768, 768]
    - [2, 676.958]
  - - [1408, 5888, 1, 768, 1408, 1408, 768, 768]
    - [0, 3733.15]
  - - [1024, 4, 1, 768, 1024, 1024, 768, 768]
    - [7, 42.4366]
  - - [256, 448, 1, 768, 256, 256, 768, 768]
    - [2, 1259.44]
  - - [2368, 5056, 1, 256, 2368, 2368, 256, 256]
    - [0, 3578.36]
  - - [448, 4, 1, 1792, 448, 448, 1792, 1792]
    - [7, 22.8941]
  - - [2368, 4288, 1, 256, 2368, 2368, 256, 256]
    - [0, 3558.79]
  - - [1408, 1024, 1, 3328, 1408, 1408, 3328, 3328]
    - [4, 3002.15]
  - - [448, 2944, 1, 1792, 448, 448, 1792, 1792]
    - [5, 2917.45]
  - - [4, 6784, 1, 1792, 4, 4, 1792, 1792]
    - [8, 76.6595]
  - - [128, 704, 1, 256, 128, 128, 256, 256]
    - [2, 716.596]
  - - [256, 128, 1, 1792, 256, 256, 1792, 1792]
    - [2, 434.321]
  - - [4, 704, 1, 256, 4, 4, 256, 256]
    - [7, 23.5363]
  - - [448, 6784, 1, 1792, 448, 448, 1792, 1792]
    - [3, 3388.29]
  - - [4288, 5888, 1, 3328, 4288, 4288, 3328, 3328]
    - [3, 4134.75]
  - - [1408, 3584, 1, 256, 1408, 1408, 256, 256]
    - [4, 3280.21]
  - - [704, 1856, 1, 768, 704, 704, 768, 768]
    - [6, 2935.68]
  - - [5056, 4, 1, 3328, 5056, 5056, 3328, 3328]
    - [7, 66.36]
  - - [128, 704, 1, 1792, 128, 128, 1792, 1792]
    - [2, 1157.14]
  - - [128, 4, 1, 3328, 128, 128, 3328, 3328]
    - [7, 6.74141]
  - - [128, 1856, 1, 3328, 128, 128, 3328, 3328]
    - [1, 2026.28]
  - - [1408, 1408, 1, 3328, 1408, 1408, 3328, 3328]
    - [1, 2568.07]
  - - [4288, 2944, 1, 3328, 4288, 4288, 3328, 3328]
    - [4, 3872.69]
  - - [4, 4288, 1, 256, 4, 4, 256, 256]
    - [7, 126.041]
  - - [6784, 3584, 1, 1792, 6784, 6784, 1792, 1792]
    - [0, 4074.29]
  - - [3584, 448, 1, 3328, 3584, 3584, 3328, 3328]
    - [0, 3320.38]
  - - [2944, 6784, 1, 3328, 2944, 2944, 3328, 3328]
    - [0, 3955.26]
  - - [1408, 448, 1, 1792, 1408, 1408, 1792, 1792]
    - [5, 2444.39]
  - - [448, 5056, 1, 256, 448, 448, 256, 256]
    - [6, 2966.8]
  - - [256, 448, 1, 256, 256, 256, 256, 256]
    - [2, 860.967]
  - - [5056, 5056, 1, 3328, 5056, 5056, 3328, 3328]
    - [3, 4177.86]
  - - [2944, 704, 1, 768, 2944, 2944, 768, 768]
    - [6, 2883.97]
  - - [4288, 128, 1, 1792, 4288, 4288, 1792, 1792]
    - [5, 2109.4]
  - - [128, 2944, 1, 1792, 128, 128, 1792, 1792]
    - [1, 2356.82]
  - - [4288, 4, 1, 768, 4288, 4288, 768, 768]
    - [7, 158.154]
  - - [5056, 448, 1, 1792, 5056, 5056, 1792, 1792]
    - [5, 3018.65]
  - - [448, 64, 1, 768, 448, 448, 768, 768]
    - [2, 345.417]
  - - [128, 704, 1, 768, 128, 128, 768, 768]
    - [2, 1022.14]
  - - [64, 1856, 1, 256, 64, 64, 256, 256]
    - [2, 880.153]
  - - [2944, 64, 1, 3328, 2944, 2944, 3328, 3328]
    - [2, 1605.97]
  - - [5056, 1856, 1, 256, 5056, 5056, 256, 256]
    - [0, 3659.17]
  - - [256, 4, 1, 3328, 256, 256, 3328, 3328]
    - [7, 13.429]
  - - [448, 1408, 1, 768, 448, 448, 768, 768]
    - [5, 2351.72]
  - - [6784, 1408, 1, 1792, 6784, 6784, 1792, 1792]
    - [0, 3985.1]
  - - [704, 448, 1, 768, 704, 704, 768, 768]
    - [5, 1868.76]
  - - [2368, 1024, 1, 1792, 2368, 2368, 1792, 1792]
    - [5, 3240.85]
  - - [5056, 3584, 1, 1792, 5056, 5056, 1792, 1792]
    - [3, 4121.05]
  - - [1856, 2944, 1, 768, 1856, 1856, 768, 768]
    - [4, 3714.4]
  - - [4, 1408, 1, 3328, 4, 4, 3328, 3328]
    - [7, 64.5789]
  - - [256, 4288, 1, 3328, 256, 256, 3328, 3328]
    - [5, 2793.34]
  - - [2368, 1856, 1, 3328, 2368, 2368, 3328, 3328]
    - [4, 3457.72]
  - - [2944, 1408, 1, 1792, 2944, 2944, 1792, 1792]
    - [0, 3307.29]
  - - [1024, 64, 1, 1792, 1024, 1024, 1792, 1792]
    - [2, 854.784]
  - - [1024, 6784, 1, 768, 1024, 1024, 768, 768]
    - [3, 3676.24]
  - - [64, 5056, 1, 3328, 64, 64, 3328, 3328]
    - [5, 2059.89]
  - - [704, 1024, 1, 256, 704, 704, 256, 256]
    - [5, 2163.63]
  - - [1024, 1408, 1, 3328, 1024, 1024, 3328, 3328]
    - [6, 3219.27]
  - - [704, 1408, 1, 768, 704, 704, 768, 768]
    - [5, 2405.82]
  - - [1024, 4288, 1, 3328, 1024, 1024, 3328, 3328]
    - [0, 3520.4]
  - - [128, 448, 1, 768, 128, 128, 768, 768]
    - [2, 679.353]
  - - [5056, 2368, 1, 1792, 5056, 5056, 1792, 1792]
    - [0, 3815.12]
  - - [2944, 4288, 1, 1792, 2944, 2944, 1792, 1792]
    - [0, 4022.07]
  - - [64, 128, 1, 1792, 64, 64, 1792, 1792]
    - [2, 108.933]
  - - [1024, 128, 1, 3328, 1024, 1024, 3328, 3328]
    - [1, 1140.96]
  - - [128, 4, 1, 256, 128, 128, 256, 256]
    - [7, 4.88687]
  - - [6784, 448, 1, 3328, 6784, 6784, 3328, 3328]
    - [3, 3431.58]
  - - [1408, 1856, 1, 1792, 1408, 1408, 1792, 1792]
    - [4, 3291.2]
  - - [3584, 256, 1, 3328, 3584, 3584, 3328, 3328]
    - [6, 3216.38]
  - - [5888, 1024, 1, 1792, 5888, 5888, 1792, 1792]
    - [4, 3500.9]
  - - [2944, 4288, 1, 768, 2944, 2944, 768, 768]
    - [0, 3963.31]
  - - [2368, 128, 1, 1792, 2368, 2368, 1792, 1792]
    - [5, 1937.87]
  - - [1856, 64, 1, 256, 1856, 1856, 256, 256]
    - [2, 884.522]
  - - [1024, 1024, 1, 1792, 1024, 1024, 1792, 1792]
    - [1, 2568.63]
  - - [3584, 1856, 1, 256, 3584, 3584, 256, 256]
    - [0, 3523.17]
  - - [1408, 5888, 1, 256, 1408, 1408, 256, 256]
    - [4, 3557.97]
  - - [448, 5888, 1, 256, 448, 448, 256, 256]
    - [4, 3019.04]
  - - [4, 128, 1, 768, 4, 4, 768, 768]
    - [7, 6.25454]
  - - [1856, 128, 1, 1792, 1856, 1856, 1792, 1792]
    - [5, 2023.96]
  - - [448, 704, 1, 3328, 448, 448, 3328, 3328]
    - [5, 2081.99]
  - - [64, 64, 1, 1792, 64, 64, 1792, 1792]
    - [2, 53.8336]
  - - [128, 1408, 1, 768, 128, 128, 768, 768]
    - [1, 1459.06]
  - - [5056, 5888, 1, 1792, 5056, 5056, 1792, 1792]
    - [3, 4235.25]
  - - [704, 704, 1, 256, 704, 704, 256, 256]
    - [5, 1552.34]
  - - [128, 2368, 1, 768, 128, 128, 768, 768]
    - [1, 1754.44]
  - - [4288, 2368, 1, 1792, 4288, 4288, 1792, 1792]
    - [3, 3832.67]
  - - [4288, 256, 1, 3328, 4288, 4288, 3328, 3328]
    - [5, 2774.48]
  - - [128, 5888, 1, 768, 128, 128, 768, 768]
    - [6, 2506.29]
  - - [1408, 6784, 1, 1792, 1408, 1408, 1792, 1792]
    - [4, 3983.94]
  - - [64, 6784, 1, 768, 64, 64, 768, 768]
    - [6, 2049.01]
  - - [4, 256, 1, 768, 4, 4, 768, 768]
    - [7, 12.4363]
  - - [2944, 5888, 1, 1792, 2944, 2944, 1792, 1792]
    - [0, 4035.24]
  - - [3584, 4, 1, 3328, 3584, 3584, 3328, 3328]
    - [8, 112.578]
  - - [4288, 2944, 1, 1792, 4288, 4288, 1792, 1792]
    - [0, 3777.6]
  - - [704, 64, 1, 3328, 704, 704, 3328, 3328]
    - [2, 615.139]
  - - [704, 448, 1, 256, 704, 704, 256, 256]
    - [5, 1469.36]
  - - [1856, 5888, 1, 3328, 1856, 1856, 3328, 3328]
    - [3, 4162.26]
  - - [2944, 6784, 1, 256, 2944, 2944, 256, 256]
    - [4, 3807.08]
  - - [256, 64, 1, 256, 256, 256, 256, 256]
    - [2, 150.802]
  - - [3584, 2944, 1, 1792, 3584, 3584, 1792, 1792]
    - [0, 3953.73]
  - - [2368, 448, 1, 1792, 2368, 2368, 1792, 1792]
    - [5, 2656.61]
  - - [1408, 4, 1, 256, 1408, 1408, 256, 256]
    - [7, 43.1504]
  - - [1408, 3584, 1, 768, 1408, 1408, 768, 768]
    - [0, 3456.13]
  - - [64, 5056, 1, 256, 64, 64, 256, 256]
    - [2, 1330.25]
  - - [1856, 2944, 1, 256, 1856, 1856, 256, 256]
    - [4, 3533.04]
  - - [2944, 5888, 1, 768, 2944, 2944, 768, 768]
    - [0, 3989.01]
  - - [1408, 6784, 1, 256, 1408, 1408, 256, 256]
    - [4, 3759.93]
  - - [2944, 4288, 1, 3328, 2944, 2944, 3328, 3328]
    - [0, 3955.47]
  - - [704, 6784, 1, 1792, 704, 704, 1792, 1792]
    - [5, 3260.15]
  - - [704, 2944, 1, 768, 704, 704, 768, 768]
    - [5, 2931.91]
  - - [5056, 704, 1, 256, 5056, 5056, 256, 256]
    - [3, 3314.05]
  - - [64, 6784, 1, 256, 64, 64, 256, 256]
    - [6, 1663.64]
  - - [5888, 448, 1, 3328, 5888, 5888, 3328, 3328]
    - [0, 3366.61]
  - - [5056, 1856, 1, 3328, 5056, 5056, 3328, 3328]
    - [0, 3901.83]
  - - [5888, 2368, 1, 768, 5888, 5888, 768, 768]
    - [0, 3825.48]
  - - [128, 256, 1, 256, 128, 128, 256, 256]
    - [2, 300.222]
  - - [2944, 1856, 1, 256, 2944, 2944, 256, 256]
    - [0, 3463.15]
  - - [4288, 6784, 1, 256, 4288, 4288, 256, 256]
    - [4, 3917.56]
  - - [2368, 704, 1, 256, 2368, 2368, 256, 256]
    - [0, 2894.32]
  - - [2944, 448, 1, 3328, 2944, 2944, 3328, 3328]
    - [5, 2950.38]
  - - [4, 2368, 1, 256, 4, 4, 256, 256]
    - [7, 72.7336]
  - - [4288, 4288, 1, 1792, 4288, 4288, 1792, 1792]
    - [3, 4171.16]
  - - [128, 6784, 1, 256, 128, 128, 256, 256]
    - [6, 2471.0]
  - - [2944, 2944, 1, 1792, 2944, 2944, 1792, 1792]
    - [0, 3945.03]
  - - [1024, 5888, 1, 3328, 1024, 1024, 3328, 3328]
    - [0, 3515.58]
  - - [5056, 1024, 1, 256, 5056, 5056, 256, 256]
    - [4, 3370.12]
  - - [2944, 1024, 1, 3328, 2944, 2944, 3328, 3328]
    - [3, 3434.27]
  - - [3584, 3584, 1, 3328, 3584, 3584, 3328, 3328]
    - [0, 3858.55]
  - - [256, 4288, 1, 768, 256, 256, 768, 768]
    - [5, 2561.33]
  - - [1408, 704, 1, 768, 1408, 1408, 768, 768]
    - [5, 2379.07]
  - - [6784, 64, 1, 3328, 6784, 6784, 3328, 3328]
    - [5, 2854.89]
  - - [2368, 4, 1, 768, 2368, 2368, 768, 768]
    - [7, 93.9893]
  - - [1856, 2368, 1, 3328, 1856, 1856, 3328, 3328]
    - [0, 3518.31]
  - - [1408, 4, 1, 768, 1408, 1408, 768, 768]
    - [7, 60.5684]
  - - [6784, 2368, 1, 3328, 6784, 6784, 3328, 3328]
    - [0, 3884.63]
  - - [6784, 5056, 1, 1792, 6784, 6784, 1792, 1792]
    - [3, 4324.6]
  - - [704, 4, 1, 768, 704, 704, 768, 768]
    - [7, 31.2047]
  - - [64, 3584, 1, 768, 64, 64, 768, 768]
    - [2, 1674.28]
  - - [704, 128, 1, 768, 704, 704, 768, 768]
    - [2, 1016.78]
  - - [704, 256, 1, 1792, 704, 704, 1792, 1792]
    - [5, 1599.11]
  - - [2368, 704, 1, 3328, 2368, 2368, 3328, 3328]
    - [0, 3444.48]
  - - [3584, 1024, 1, 3328, 3584, 3584, 3328, 3328]
    - [3, 4132.45]
  - - [448, 256, 1, 768, 448, 448, 768, 768]
    - [2, 1257.43]
  - - [1024, 2944, 1, 768, 1024, 1024, 768, 768]
    - [3, 3214.23]
  - - [4, 1856, 1, 256, 4, 4, 256, 256]
    - [7, 56.7984]
  - - [704, 2944, 1, 3328, 704, 704, 3328, 3328]
    - [5, 3077.58]
  - - [1856, 448, 1, 768, 1856, 1856, 768, 768]
    - [6, 2772.91]
  - - [4288, 256, 1, 768, 4288, 4288, 768, 768]
    - [5, 2591.06]
  - - [704, 64, 1, 768, 704, 704, 768, 768]
    - [2, 536.558]
  - - [6784, 1408, 1, 3328, 6784, 6784, 3328, 3328]
    - [4, 3915.26]
  - - [4, 64, 1, 3328, 4, 4, 3328, 3328]
    - [7, 3.41876]
  - - [3584, 1408, 1, 256, 3584, 3584, 256, 256]
    - [4, 3252.95]
  - - [6784, 2368, 1, 768, 6784, 6784, 768, 768]
    - [0, 3888.51]
  - - [6784, 5888, 1, 256, 6784, 6784, 256, 256]
    - [4, 3946.23]
  - - [2368, 448, 1, 768, 2368, 2368, 768, 768]
    - [5, 2524.57]
  - - [64, 4, 1, 256, 64, 64, 256, 256]
    - [7, 2.48897]
  - - [2944, 3584, 1, 256, 2944, 2944, 256, 256]
    - [4, 3734.78]
  - - [1856, 256, 1, 3328, 1856, 1856, 3328, 3328]
    - [1, 3040.71]
  - - [5888, 4288, 1, 3328, 5888, 5888, 3328, 3328]
    - [3, 4119.12]
  - - [1408, 5056, 1, 1792, 1408, 1408, 1792, 1792]
    - [3, 4012.64]
  - - [4288, 6784, 1, 1792, 4288, 4288, 1792, 1792]
    - [3, 4151.1]
  - - [128, 448, 1, 1792, 128, 128, 1792, 1792]
    - [2, 753.022]
  - - [5888, 3584, 1, 1792, 5888, 5888, 1792, 1792]
    - [0, 4025.26]
  - - [64, 1408, 1, 256, 64, 64, 256, 256]
    - [2, 710.826]
  - - [704, 6784, 1, 3328, 704, 704, 3328, 3328]
    - [5, 3292.4]
  - - [256, 704, 1, 1792, 256, 256, 1792, 1792]
    - [5, 1494.64]
  - - [256, 3584, 1, 256, 256, 256, 256, 256]
    - [6, 2649.35]
  - - [2368, 704, 1, 1792, 2368, 2368, 1792, 1792]
    - [0, 3389.44]
  - - [5056, 5888, 1, 3328, 5056, 5056, 3328, 3328]
    - [3, 4259.43]
  - - [704, 704, 1, 3328, 704, 704, 3328, 3328]
    - [5, 1960.4]
  - - [4, 3584, 1, 256, 4, 4, 256, 256]
    - [7, 108.675]
  - - [1408, 64, 1, 1792, 1408, 1408, 1792, 1792]
    - [2, 1154.88]
  - - [4288, 64, 1, 256, 4288, 4288, 256, 256]
    - [5, 1281.64]
  - - [4288, 256, 1, 256, 4288, 4288, 256, 256]
    - [6, 2264.13]
  - - [4288, 5056, 1, 1792, 4288, 4288, 1792, 1792]
    - [3, 4108.75]
  - - [4288, 1856, 1, 1792, 4288, 4288, 1792, 1792]
    - [0, 3627.7]
  - - [1408, 5888, 1, 3328, 1408, 1408, 3328, 3328]
    - [4, 3763.17]
  - - [2368, 4, 1, 256, 2368, 2368, 256, 256]
    - [7, 72.78]
  - - [256, 6784, 1, 256, 256, 256, 256, 256]
    - [4, 3114.58]
  - - [6784, 1856, 1, 3328, 6784, 6784, 3328, 3328]
    - [0, 3923.11]
  - - [704, 1024, 1, 3328, 704, 704, 3328, 3328]
    - [5, 2880.72]
  - - [1856, 704, 1, 256, 1856, 1856, 256, 256]
    - [6, 2684.96]
  - - [128, 1408, 1, 256, 128, 128, 256, 256]
    - [1, 1108.79]
  - - [2944, 1024, 1, 256, 2944, 2944, 256, 256]
    - [3, 3036.86]
  - - [5888, 3584, 1, 768, 5888, 5888, 768, 768]
    - [0, 3979.84]
  - - [1856, 128, 1, 3328, 1856, 1856, 3328, 3328]
    - [5, 2082.23]
  - - [2368, 704, 1, 768, 2368, 2368, 768, 768]
    - [0, 3280.2]
  - - [4, 128, 1, 1792, 4, 4, 1792, 1792]
    - [7, 6.60929]
  - - [3584, 5888, 1, 3328, 3584, 3584, 3328, 3328]
    - [0, 4024.75]
  - - [6784, 1856, 1, 768, 6784, 6784, 768, 768]
    - [0, 3940.16]
  - - [3584, 448, 1, 1792, 3584, 3584, 1792, 1792]
    - [0, 3272.78]
  - - [5888, 3584, 1, 3328, 5888, 5888, 3328, 3328]
    - [4, 4026.52]
  - - [64, 1408, 1, 768, 64, 64, 768, 768]
    - [2, 1015.51]
  - - [3584, 128, 1, 3328, 3584, 3584, 3328, 3328]
    - [5, 3003.32]
  - - [1024, 448, 1, 768, 1024, 1024, 768, 768]
    - [5, 2609.94]
  - - [3584, 3584, 1, 768, 3584, 3584, 768, 768]
    - [0, 3803.62]
  - - [2368, 1408, 1, 3328, 2368, 2368, 3328, 3328]
    - [3, 3782.58]
  - - [1408, 256, 1, 1792, 1408, 1408, 1792, 1792]
    - [5, 2308.14]
  - - [448, 1024, 1, 1792, 448, 448, 1792, 1792]
    - [5, 2907.82]
  - - [5056, 2944, 1, 1792, 5056, 5056, 1792, 1792]
    - [3, 4216.97]
  - - [5056, 3584, 1, 768, 5056, 5056, 768, 768]
    - [3, 4040.01]
  - - [1856, 1408, 1, 1792, 1856, 1856, 1792, 1792]
    - [4, 3322.98]
  - - [3584, 704, 1, 1792, 3584, 3584, 1792, 1792]
    - [0, 3207.4]
  - - [4288, 4, 1, 1792, 4288, 4288, 1792, 1792]
    - [7, 99.1004]
  - - [4, 4, 1, 1792, 4, 4, 1792, 1792]
    - [7, 0.205247]
  - - [2944, 2368, 1, 3328, 2944, 2944, 3328, 3328]
    - [3, 3970.49]
  - - [1856, 4, 1, 768, 1856, 1856, 768, 768]
    - [7, 76.7561]
  - - [128, 1856, 1, 256, 128, 128, 256, 256]
    - [1, 1382.88]
  - - [2944, 1856, 1, 1792, 2944, 2944, 1792, 1792]
    - [0, 3785.46]
  - - [704, 64, 1, 1792, 704, 704, 1792, 1792]
    - [2, 593.586]
  - - [1856, 4, 1, 1792, 1856, 1856, 1792, 1792]
    - [7, 82.4428]
  - - [5888, 2944, 1, 3328, 5888, 5888, 3328, 3328]
    - [4, 4014.26]
  - - [4, 4, 1, 256, 4, 4, 256, 256]
    - [7, 0.147297]
  - - [2944, 1856, 1, 3328, 2944, 2944, 3328, 3328]
    - [4, 3732.83]
  - - [64, 5056, 1, 768, 64, 64, 768, 768]
    - [1, 1710.7]
  - - [5888, 5888, 1, 256, 5888, 5888, 256, 256]
    - [3, 3960.69]
  - - [1408, 6784, 1, 3328, 1408, 1408, 3328, 3328]
    - [4, 3955.15]
  - - [64, 6784, 1, 1792, 64, 64, 1792, 1792]
    - [5, 2241.05]
  - - [5888, 704, 1, 768, 5888, 5888, 768, 768]
    - [6, 3275.56]
  - - [4, 256, 1, 256, 4, 4, 256, 256]
    - [7, 9.95386]
  - - [1408, 64, 1, 256, 1408, 1408, 256, 256]
    - [2, 717.905]
  - - [1024, 256, 1, 256, 1024, 1024, 256, 256]
    - [5, 1217.5]
  - - [2368, 6784, 1, 1792, 2368, 2368, 1792, 1792]
    - [4, 3939.37]
  - - [1856, 256, 1, 768, 1856, 1856, 768, 768]
    - [5, 2765.1]
  - - [1408, 1024, 1, 1792, 1408, 1408, 1792, 1792]
    - [5, 3160.15]
  - - [1024, 3584, 1, 1792, 1024, 1024, 1792, 1792]
    - [3, 4037.76]
  - - [1408, 1024, 1, 256, 1408, 1408, 256, 256]
    - [6, 2933.2]
  - - [448, 448, 1, 256, 448, 448, 256, 256]
    - [5, 1211.49]
  - - [4, 448, 1, 3328, 4, 4, 3328, 3328]
    - [7, 21.8833]
  - - [5056, 448, 1, 256, 5056, 5056, 256, 256]
    - [6, 2966.72]
  - - [1024, 2944, 1, 256, 1024, 1024, 256, 256]
    - [6, 2912.42]
  - - [1856, 448, 1, 3328, 1856, 1856, 3328, 3328]
    - [6, 2914.8]
  - - [2368, 128, 1, 3328, 2368, 2368, 3328, 3328]
    - [5, 1995.58]
  - - [4, 2368, 1, 3328, 4, 4, 3328, 3328]
    - [7, 108.24]
  - - [5056, 128, 1, 768, 5056, 5056, 768, 768]
    - [5, 2322.55]
  - - [64, 256, 1, 1792, 64, 64, 1792, 1792]
    - [2, 217.221]
  - - [4288, 64, 1, 768, 4288, 4288, 768, 768]
    - [5, 1619.33]
  - - [2368, 6784, 1, 768, 2368, 2368, 768, 768]
    - [4, 3894.97]
  - - [2944, 2944, 1, 768, 2944, 2944, 768, 768]
    - [0, 3867.84]
  - - [5888, 4288, 1, 1792, 5888, 5888, 1792, 1792]
    - [3, 4084.35]
  - - [128, 1408, 1, 1792, 128, 128, 1792, 1792]
    - [2, 1488.61]
  - - [256, 1856, 1, 256, 256, 256, 256, 256]
    - [5, 2116.81]
  - - [3584, 2368, 1, 3328, 3584, 3584, 3328, 3328]
    - [0, 3882.16]
  - - [5888, 448, 1, 256, 5888, 5888, 256, 256]
    - [0, 2980.45]
  - - [5888, 4, 1, 1792, 5888, 5888, 1792, 1792]
    - [7, 138.205]
  - - [128, 4, 1, 768, 128, 128, 768, 768]
    - [7, 6.1811]
  - - [1408, 1856, 1, 768, 1408, 1408, 768, 768]
    - [0, 3256.35]
  - - [448, 128, 1, 256, 448, 448, 256, 256]
    - [2, 500.457]
  - - [2944, 128, 1, 768, 2944, 2944, 768, 768]
    - [5, 2214.22]
  - - [4, 5056, 1, 256, 4, 4, 256, 256]
    - [7, 140.466]
  - - [1856, 1024, 1, 256, 1856, 1856, 256, 256]
    - [4, 3451.74]
  - - [1408, 2944, 1, 256, 1408, 1408, 256, 256]
    - [6, 3180.68]
  - - [5888, 256, 1, 256, 5888, 5888, 256, 256]
    - [0, 2723.57]
  - - [704, 2368, 1, 3328, 704, 704, 3328, 3328]
    - [4, 3434.31]
  - - [3584, 5056, 1, 768, 3584, 3584, 768, 768]
    - [3, 3961.62]
  - - [1408, 128, 1, 1792, 1408, 1408, 1792, 1792]
    - [1, 1516.34]
  - - [256, 2368, 1, 768, 256, 256, 768, 768]
    - [5, 2204.84]
  - - [4, 1024, 1, 256, 4, 4, 256, 256]
    - [7, 31.6601]
  - - [2368, 4, 1, 1792, 2368, 2368, 1792, 1792]
    - [7, 103.546]
  - - [4288, 4288, 1, 256, 4288, 4288, 256, 256]
    - [4, 3802.0]
  - - [2944, 5888, 1, 256, 2944, 2944, 256, 256]
    - [4, 3844.41]
  - - [704, 1408, 1, 1792, 704, 704, 1792, 1792]
    - [5, 2508.24]
  - - [4288, 6784, 1, 768, 4288, 4288, 768, 768]
    - [3, 4091.78]
  - - [256, 704, 1, 256, 256, 256, 256, 256]
    - [1, 1108.79]
  - - [128, 4288, 1, 1792, 128, 128, 1792, 1792]
    - [1, 2097.85]
  - - [256, 6784, 1, 3328, 256, 256, 3328, 3328]
    - [0, 3608.38]
  - - [1408, 4288, 1, 1792, 1408, 1408, 1792, 1792]
    - [4, 3494.14]
  - - [5888, 4, 1, 3328, 5888, 5888, 3328, 3328]
    - [7, 65.54]
  - - [2944, 4288, 1, 256, 2944, 2944, 256, 256]
    - [0, 3767.59]
  - - [64, 2368, 1, 768, 64, 64, 768, 768]
    - [5, 1153.71]
  - - [2944, 6784, 1, 768, 2944, 2944, 768, 768]
    - [0, 3941.89]
  - - [6784, 1408, 1, 256, 6784, 6784, 256, 256]
    - [4, 3756.48]
  - - [1408, 2368, 1, 768, 1408, 1408, 768, 768]
    - [3, 3591.21]
  - - [64, 6784, 1, 3328, 64, 64, 3328, 3328]
    - [5, 2444.08]
  - - [704, 4288, 1, 768, 704, 704, 768, 768]
    - [3, 3223.06]
  - - [6784, 2368, 1, 256, 6784, 6784, 256, 256]
    - [0, 3734.12]
  - - [3584, 4288, 1, 768, 3584, 3584, 768, 768]
    - [3, 4139.0]
  - - [4, 3584, 1, 3328, 4, 4, 3328, 3328]
    - [8, 86.4303]
  - - [3584, 64, 1, 3328, 3584, 3584, 3328, 3328]
    - [2, 1945.87]
  - - [2944, 2368, 1, 1792, 2944, 2944, 1792, 1792]
    - [3, 3928.89]
  - - [704, 4288, 1, 3328, 704, 704, 3328, 3328]
    - [3, 3418.02]
  - - [4, 448, 1, 256, 4, 4, 256, 256]
    - [7, 16.6311]
  - - [4288, 6784, 1, 3328, 4288, 4288, 3328, 3328]
    - [3, 4170.31]
  - - [128, 6784, 1, 3328, 128, 128, 3328, 3328]
    - [6, 3048.08]
  - - [6784, 256, 1, 256, 6784, 6784, 256, 256]
    - [4, 3134.49]
  - - [1408, 704, 1, 256, 1408, 1408, 256, 256]
    - [6, 2069.02]
  - - [64, 2368, 1, 256, 64, 64, 256, 256]
    - [5, 952.035]
  - - [1408, 128, 1, 3328, 1408, 1408, 3328, 3328]
    - [1, 1578.36]
  - - [1856, 4288, 1, 3328, 1856, 1856, 3328, 3328]
    - [0, 3645.8]
  - - [5056, 64, 1, 256, 5056, 5056, 256, 256]
    - [5, 1495.33]
  - - [448, 448, 1, 1792, 448, 448, 1792, 1792]
    - [1, 1764.85]
  - - [704, 4288, 1, 1792, 704, 704, 1792, 1792]
    - [3, 3366.48]
  - - [6784, 4, 1, 1792, 6784, 6784, 1792, 1792]
    - [8, 80.1206]
  - - [64, 5888, 1, 1792, 64, 64, 1792, 1792]
    - [5, 2055.88]
  - - [2944, 2944, 1, 3328, 2944, 2944, 3328, 3328]
    - [0, 3834.83]
  - - [1856, 6784, 1, 1792, 1856, 1856, 1792, 1792]
    - [4, 4011.32]
  - - [4, 4288, 1, 768, 4, 4, 768, 768]
    - [7, 149.863]
  - - [1024, 6784, 1, 256, 1024, 1024, 256, 256]
    - [0, 3404.19]
  - - [6784, 5888, 1, 768, 6784, 6784, 768, 768]
    - [3, 4109.44]
  - - [6784, 128, 1, 256, 6784, 6784, 256, 256]
    - [6, 2498.26]
  - - [4, 128, 1, 3328, 4, 4, 3328, 3328]
    - [7, 6.70746]
  - - [4, 4288, 1, 3328, 4, 4, 3328, 3328]
    - [7, 69.7989]
  - - [5888, 5056, 1, 3328, 5888, 5888, 3328, 3328]
    - [3, 4248.83]
  - - [3584, 64, 1, 768, 3584, 3584, 768, 768]
    - [2, 1674.96]
  - - [256, 2944, 1, 3328, 256, 256, 3328, 3328]
    - [6, 2646.07]
  - - [6784, 5888, 1, 1792, 6784, 6784, 1792, 1792]
    - [3, 4150.71]
  - - [1408, 2368, 1, 1792, 1408, 1408, 1792, 1792]
    - [3, 3731.23]
  - - [1856, 5888, 1, 256, 1856, 1856, 256, 256]
    - [3, 3713.5]
  - - [2368, 5888, 1, 256, 2368, 2368, 256, 256]
    - [4, 3691.7]
  - - [448, 256, 1, 3328, 448, 448, 3328, 3328]
    - [2, 1532.18]
  - - [4, 5056, 1, 768, 4, 4, 768, 768]
    - [7, 162.997]
  - - [5056, 3584, 1, 256, 5056, 5056, 256, 256]
    - [4, 3803.42]
  - - [3584, 5888, 1, 1792, 3584, 3584, 1792, 1792]
    - [0, 4025.75]
  - - [128, 5056, 1, 1792, 128, 128, 1792, 1792]
    - [1, 2439.4]
  - - [4, 3584, 1, 1792, 4, 4, 1792, 1792]
    - [8, 114.954]
  - - [5056, 2944, 1, 3328, 5056, 5056, 3328, 3328]
    - [3, 4252.25]
  - - [3584, 2368, 1, 1792, 3584, 3584, 1792, 1792]
    - [0, 3862.28]
  - - [448, 5056, 1, 3328, 448, 448, 3328, 3328]
    - [5, 3102.19]
  - - [1408, 2368, 1, 256, 1408, 1408, 256, 256]
    - [6, 3214.28]
  - - [5056, 1408, 1, 3328, 5056, 5056, 3328, 3328]
    - [3, 4055.76]
  - - [5056, 704, 1, 768, 5056, 5056, 768, 768]
    - [3, 3804.86]
  - - [1024, 6784, 1, 1792, 1024, 1024, 1792, 1792]
    - [3, 3857.54]
  - - [2368, 2944, 1, 768, 2368, 2368, 768, 768]
    - [3, 3810.17]
  - - [5888, 1024, 1, 256, 5888, 5888, 256, 256]
    - [4, 3294.59]
  - - [2944, 5056, 1, 1792, 2944, 2944, 1792, 1792]
    - [3, 4213.43]
  - - [5888, 6784, 1, 1792, 5888, 5888, 1792, 1792]
    - [3, 4151.42]
  - - [4, 2368, 1, 1792, 4, 4, 1792, 1792]
    - [7, 104.221]
  - - [128, 448, 1, 3328, 128, 128, 3328, 3328]
    - [2, 782.339]
  - - [64, 5888, 1, 3328, 64, 64, 3328, 3328]
    - [1, 2243.95]
  - - [5888, 2944, 1, 256, 5888, 5888, 256, 256]
    - [4, 3843.13]
  - - [5056, 1408, 1, 768, 5056, 5056, 768, 768]
    - [3, 3896.45]
  - - [64, 64, 1, 256, 64, 64, 256, 256]
    - [2, 34.9587]
  - - [1024, 5888, 1, 1792, 1024, 1024, 1792, 1792]
    - [0, 3504.68]
  - - [3584, 4288, 1, 3328, 3584, 3584, 3328, 3328]
    - [3, 4358.78]
  - - [64, 2368, 1, 3328, 64, 64, 3328, 3328]
    - [2, 1295.8]
  - - [2368, 1408, 1, 768, 2368, 2368, 768, 768]
    - [3, 3553.18]
  - - [3584, 1024, 1, 768, 3584, 3584, 768, 768]
    - [3, 3844.99]
  - - [2368, 2944, 1, 256, 2368, 2368, 256, 256]
    - [3, 3526.8]
  - - [704, 4, 1, 256, 704, 704, 256, 256]
    - [7, 22.457]
  - - [1408, 1408, 1, 256, 1408, 1408, 256, 256]
    - [6, 2623.53]
  - - [64, 4, 1, 768, 64, 64, 768, 768]
    - [7, 3.08332]
  - - [5056, 1408, 1, 1792, 5056, 5056, 1792, 1792]
    - [3, 4016.52]
  - - [64, 128, 1, 3328, 64, 64, 3328, 3328]
    - [2, 112.535]
  - - [1024, 1856, 1, 768, 1024, 1024, 768, 768]
    - [0, 3777.84]
  - - [5056, 64, 1, 768, 5056, 5056, 768, 768]
    - [5, 1905.07]
  - - [3584, 2944, 1, 256, 3584, 3584, 256, 256]
    - [4, 3698.4]
  - - [4, 1408, 1, 256, 4, 4, 256, 256]
    - [7, 43.2817]
  - - [5056, 64, 1, 3328, 5056, 5056, 3328, 3328]
    - [5, 2132.15]
  - - [448, 3584, 1, 3328, 448, 448, 3328, 3328]
    - [0, 3322.72]
  - - [2944, 3584, 1, 1792, 2944, 2944, 1792, 1792]
    - [3, 3990.69]
  - - [1856, 2368, 1, 768, 1856, 1856, 768, 768]
    - [6, 3470.39]
  - - [448, 5888, 1, 1792, 448, 448, 1792, 1792]
    - [4, 3336.99]
  - - [64, 448, 1, 256, 64, 64, 256, 256]
    - [2, 262.494]
  - - [4288, 1024, 1, 3328, 4288, 4288, 3328, 3328]
    - [4, 3524.82]
  - - [448, 4, 1, 768, 448, 448, 768, 768]
    - [7, 20.8929]
  - - [1024, 5888, 1, 256, 1024, 1024, 256, 256]
    - [0, 3273.35]
  - - [128, 5056, 1, 768, 128, 128, 768, 768]
    - [1, 2290.86]
  - - [3584, 6784, 1, 768, 3584, 3584, 768, 768]
    - [0, 4026.55]
  - - [64, 1024, 1, 1792, 64, 64, 1792, 1792]
    - [2, 853.492]
  - - [256, 256, 1, 256, 256, 256, 256, 256]
    - [2, 564.864]
  - - [4288, 1024, 1, 1792, 4288, 4288, 1792, 1792]
    - [4, 3504.03]
  - - [704, 704, 1, 1792, 704, 704, 1792, 1792]
    - [5, 1937.26]
  - - [6784, 5888, 1, 3328, 6784, 6784, 3328, 3328]
    - [3, 4169.33]
  - - [5888, 128, 1, 256, 5888, 5888, 256, 256]
    - [6, 2191.68]
  - - [3584, 1856, 1, 768, 3584, 3584, 768, 768]
    - [0, 3757.99]
  - - [5888, 128, 1, 1792, 5888, 5888, 1792, 1792]
    - [6, 2608.83]
  - - [1024, 1408, 1, 768, 1024, 1024, 768, 768]
    - [6, 3197.71]
  - - [64, 4288, 1, 1792, 64, 64, 1792, 1792]
    - [5, 1722.02]
  - - [2944, 4, 1, 1792, 2944, 2944, 1792, 1792]
    - [7, 125.372]
  - - [5888, 1856, 1, 256, 5888, 5888, 256, 256]
    - [0, 3619.11]
  - - [2944, 4, 1, 768, 2944, 2944, 768, 768]
    - [7, 114.523]
  - - [3584, 5056, 1, 1792, 3584, 3584, 1792, 1792]
    - [3, 4077.13]
  - - [704, 2368, 1, 1792, 704, 704, 1792, 1792]
    - [0, 3385.18]
  - - [704, 704, 1, 768, 704, 704, 768, 768]
    - [5, 1869.17]
  - - [4288, 1408, 1, 256, 4288, 4288, 256, 256]
    - [4, 3291.09]
  - - [4288, 64, 1, 1792, 4288, 4288, 1792, 1792]
    - [5, 1756.0]
  - - [5888, 1856, 1, 1792, 5888, 5888, 1792, 1792]
    - [0, 3812.85]
  - - [256, 2944, 1, 256, 256, 256, 256, 256]
    - [6, 2214.76]
  - - [256, 5056, 1, 1792, 256, 256, 1792, 1792]
    - [6, 2976.54]
  - - [2944, 128, 1, 3328, 2944, 2944, 3328, 3328]
    - [5, 2481.64]
  - - [1024, 2368, 1, 768, 1024, 1024, 768, 768]
    - [6, 3343.25]
  - - [3584, 704, 1, 256, 3584, 3584, 256, 256]
    - [6, 2830.61]
  - - [1024, 128, 1, 768, 1024, 1024, 768, 768]
    - [5, 1100.29]
  - - [1408, 4, 1, 3328, 1408, 1408, 3328, 3328]
    - [7, 65.1619]
  - - [256, 5888, 1, 1792, 256, 256, 1792, 1792]
    - [0, 3104.21]
  - - [704, 448, 1, 1792, 704, 704, 1792, 1792]
    - [5, 2018.85]
  - - [1024, 704, 1, 256, 1024, 1024, 256, 256]
    - [6, 2060.07]
  - - [256, 1024, 1, 768, 256, 256, 768, 768]
    - [5, 1560.44]
  - - [2944, 3584, 1, 768, 2944, 2944, 768, 768]
    - [3, 3902.03]
  - - [1408, 2944, 1, 3328, 1408, 1408, 3328, 3328]
    - [4, 3309.7]
  - - [64, 1024, 1, 256, 64, 64, 256, 256]
    - [2, 558.545]
  - - [5056, 1856, 1, 768, 5056, 5056, 768, 768]
    - [0, 3829.35]
  - - [2368, 2368, 1, 768, 2368, 2368, 768, 768]
    - [0, 3777.6]
  - - [2368, 1024, 1, 3328, 2368, 2368, 3328, 3328]
    - [1, 3223.43]
  - - [128, 6784, 1, 768, 128, 128, 768, 768]
    - [6, 2858.71]
  - - [4, 2944, 1, 3328, 4, 4, 3328, 3328]
    - [7, 133.193]
  - - [1856, 5888, 1, 768, 1856, 1856, 768, 768]
    - [3, 4031.67]
  - - [256, 256, 1, 3328, 256, 256, 3328, 3328]
    - [2, 891.821]
  - - [1856, 448, 1, 256, 1856, 1856, 256, 256]
    - [6, 2437.19]
  - - [4, 64, 1, 768, 4, 4, 768, 768]
    - [7, 3.13365]
  - - [448, 1856, 1, 3328, 448, 448, 3328, 3328]
    - [6, 2900.65]
  - - [64, 2944, 1, 768, 64, 64, 768, 768]
    - [2, 1406.75]
  - - [448, 4288, 1, 768, 448, 448, 768, 768]
    - [4, 3738.0]
  - - [5888, 704, 1, 3328, 5888, 5888, 3328, 3328]
    - [4, 3304.99]
  - - [128, 128, 1, 1792, 128, 128, 1792, 1792]
    - [2, 215.765]
  - - [6784, 3584, 1, 256, 6784, 6784, 256, 256]
    - [4, 3898.43]
  - - [256, 256, 1, 768, 256, 256, 768, 768]
    - [2, 768.813]
  - - [1408, 5056, 1, 768, 1408, 1408, 768, 768]
    - [3, 3892.4]
  - - [4, 5056, 1, 1792, 4, 4, 1792, 1792]
    - [7, 66.1967]
  - - [1024, 704, 1, 768, 1024, 1024, 768, 768]
    - [1, 2563.12]
  - - [6784, 1024, 1, 3328, 6784, 6784, 3328, 3328]
    - [3, 3963.2]
  - - [2368, 3584, 1, 1792, 2368, 2368, 1792, 1792]
    - [4, 3863.82]
  - - [64, 2944, 1, 3328, 64, 64, 3328, 3328]
    - [2, 1606.41]
  - - [4, 448, 1, 1792, 4, 4, 1792, 1792]
    - [7, 23.0616]
  - - [448, 1024, 1, 256, 448, 448, 256, 256]
    - [5, 2049.52]
  - - [4288, 4, 1, 256, 4288, 4288, 256, 256]
    - [7, 127.111]
  - - [3584, 1408, 1, 1792, 3584, 3584, 1792, 1792]
    - [0, 3502.73]
  - - [4288, 256, 1, 1792, 4288, 4288, 1792, 1792]
    - [5, 2732.77]
  - - [1024, 448, 1, 3328, 1024, 1024, 3328, 3328]
    - [5, 3000.67]
  - - [5056, 2944, 1, 768, 5056, 5056, 768, 768]
    - [3, 4122.05]
  - - [1024, 448, 1, 256, 1024, 1024, 256, 256]
    - [5, 1994.21]
  - - [2368, 4288, 1, 3328, 2368, 2368, 3328, 3328]
    - [3, 3866.88]
  - - [128, 4288, 1, 256, 128, 128, 256, 256]
    - [1, 1665.22]
  - - [4288, 704, 1, 1792, 4288, 4288, 1792, 1792]
    - [3, 3366.98]
  - - [1856, 3584, 1, 256, 1856, 1856, 256, 256]
    - [4, 3597.57]
  - - [5056, 256, 1, 256, 5056, 5056, 256, 256]
    - [6, 2658.23]
  - - [64, 2944, 1, 256, 64, 64, 256, 256]
    - [2, 1067.89]
  - - [256, 2944, 1, 768, 256, 256, 768, 768]
    - [6, 2512.74]
  - - [64, 3584, 1, 3328, 64, 64, 3328, 3328]
    - [2, 1943.57]
  - - [1408, 5056, 1, 256, 1408, 1408, 256, 256]
    - [3, 3528.29]
  - - [4288, 1856, 1, 768, 4288, 4288, 768, 768]
    - [0, 3564.84]
  - - [448, 4, 1, 3328, 448, 448, 3328, 3328]
    - [7, 21.8379]
  - - [5888, 4, 1, 256, 5888, 5888, 256, 256]
    - [7, 158.333]
  - - [128, 5056, 1, 256, 128, 128, 256, 256]
    - [1, 1924.3]
  - - [4288, 3584, 1, 1792, 4288, 4288, 1792, 1792]
    - [3, 4351.33]
  - - [128, 2944, 1, 3328, 128, 128, 3328, 3328]
    - [1, 2424.08]
  - - [3584, 4, 1, 768, 3584, 3584, 768, 768]
    - [7, 138.197]
  - - [1856, 1408, 1, 3328, 1856, 1856, 3328, 3328]
    - [0, 3343.06]
  - - [256, 128, 1, 256, 256, 256, 256, 256]
    - [2, 299.593]
  - - [256, 5056, 1, 256, 256, 256, 256, 256]
    - [6, 2646.56]
  - - [5888, 256, 1, 3328, 5888, 5888, 3328, 3328]
    - [4, 3131.85]
  - - [5888, 4, 1, 768, 5888, 5888, 768, 768]
    - [7, 206.195]
  - - [256, 2944, 1, 1792, 256, 256, 1792, 1792]
    - [6, 2613.54]
  - - [5888, 5888, 1, 3328, 5888, 5888, 3328, 3328]
    - [3, 4401.65]
  - - [6784, 704, 1, 768, 6784, 6784, 768, 768]
    - [0, 3733.95]
  - - [5888, 448, 1, 768, 5888, 5888, 768, 768]
    - [0, 3287.15]
  - - [2368, 5056, 1, 1792, 2368, 2368, 1792, 1792]
    - [0, 3815.37]
  - - [448, 4288, 1, 1792, 448, 448, 1792, 1792]
    - [4, 3909.32]
  - - [2944, 2368, 1, 768, 2944, 2944, 768, 768]
    - [3, 3793.79]
  - - [1024, 5056, 1, 768, 1024, 1024, 768, 768]
    - [0, 3543.9]
  - - [2944, 6784, 1, 1792, 2944, 2944, 1792, 1792]
    - [0, 3980.55]
  - - [128, 5056, 1, 3328, 128, 128, 3328, 3328]
    - [1, 2512.58]
  - - [448, 5056, 1, 1792, 448, 448, 1792, 1792]
    - [5, 3052.26]
  - - [2944, 448, 1, 256, 2944, 2944, 256, 256]
    - [6, 2708.82]
  - - [256, 5056, 1, 3328, 256, 256, 3328, 3328]
    - [5, 2908.72]
  - - [256, 1024, 1, 3328, 256, 256, 3328, 3328]
    - [5, 1737.12]
  - - [1024, 64, 1, 768, 1024, 1024, 768, 768]
    - [2, 766.876]
  - - [448, 4288, 1, 256, 448, 448, 256, 256]
    - [4, 3299.07]
  - - [4288, 5056, 1, 768, 4288, 4288, 768, 768]
    - [3, 4032.77]
  - - [5056, 5056, 1, 768, 5056, 5056, 768, 768]
    - [3, 4067.76]
  - - [4288, 1024, 1, 768, 4288, 4288, 768, 768]
    - [6, 3466.62]
  - - [128, 2944, 1, 768, 128, 128, 768, 768]
    - [1, 2170.99]
  - - [128, 2368, 1, 256, 128, 128, 256, 256]
    - [1, 1386.94]
  - - [5056, 1024, 1, 3328, 5056, 5056, 3328, 3328]
    - [4, 3608.02]
  - - [1024, 5056, 1, 3328, 1024, 1024, 3328, 3328]
    - [0, 3606.13]
  - - [448, 704, 1, 256, 448, 448, 256, 256]
    - [5, 1467.93]
  - - [6784, 4288, 1, 768, 6784, 6784, 768, 768]
    - [3, 4059.27]
  - - [1408, 256, 1, 3328, 1408, 1408, 3328, 3328]
    - [1, 2296.74]
  - - [2368, 3584, 1, 768, 2368, 2368, 768, 768]
    - [4, 3785.39]
  - - [2944, 1856, 1, 768, 2944, 2944, 768, 768]
    - [0, 3701.49]
  - - [6784, 2944, 1, 1792, 6784, 6784, 1792, 1792]
    - [0, 3977.24]
  - - [256, 2368, 1, 3328, 256, 256, 3328, 3328]
    - [5, 2379.08]
  - - [5056, 4288, 1, 1792, 5056, 5056, 1792, 1792]
    - [3, 4102.61]
  - - [2368, 256, 1, 1792, 2368, 2368, 1792, 1792]
    - [5, 2341.32]
  - - [1024, 1024, 1, 768, 1024, 1024, 768, 768]
    - [5, 2450.42]
  - - [1024, 3584, 1, 256, 1024, 1024, 256, 256]
    - [0, 3443.87]
  - - [6784, 4, 1, 3328, 6784, 6784, 3328, 3328]
    - [8, 66.1168]
  - - [704, 2944, 1, 256, 704, 704, 256, 256]
    - [6, 2727.52]
  - - [5888, 5888, 1, 1792, 5888, 5888, 1792, 1792]
    - [3, 4370.81]
  - - [1856, 6784, 1, 256, 1856, 1856, 256, 256]
    - [4, 3797.12]
  - - [64, 448, 1, 1792, 64, 64, 1792, 1792]
    - [2, 378.866]
  - - [448, 2944, 1, 256, 448, 448, 256, 256]
    - [6, 2701.07]
  - - [4288, 1024, 1, 256, 4288, 4288, 256, 256]
    - [6, 3351.04]
  - - [256, 128, 1, 3328, 256, 256, 3328, 3328]
    - [2, 449.32]
  - - [6784, 6784, 1, 3328, 6784, 6784, 3328, 3328]
    - [3, 4395.29]
  - - [2368, 2944, 1, 1792, 2368, 2368, 1792, 1792]
    - [3, 3937.21]
  - - [4, 256, 1, 3328, 4, 4, 3328, 3328]
    - [7, 13.4054]
  - - [2368, 128, 1, 768, 2368, 2368, 768, 768]
    - [5, 1791.16]
  - - [4, 6784, 1, 3328, 4, 4, 3328, 3328]
    - [8, 65.9035]
  - - [256, 3584, 1, 1792, 256, 256, 1792, 1792]
    - [6, 3172.76]
  - - [704, 1856, 1, 256, 704, 704, 256, 256]
    - [6, 2684.04]
  - - [1024, 1856, 1, 1792, 1024, 1024, 1792, 1792]
    - [0, 3900.43]
  - - [1024, 1408, 1, 256, 1024, 1024, 256, 256]
    - [6, 2857.86]
  - - [2368, 3584, 1, 256, 2368, 2368, 256, 256]
    - [4, 3631.34]
  - - [256, 1024, 1, 1792, 256, 256, 1792, 1792]
    - [5, 1687.36]
  - - [5888, 1408, 1, 3328, 5888, 5888, 3328, 3328]
    - [4, 3783.43]
  - - [704, 128, 1, 256, 704, 704, 256, 256]
    - [2, 713.288]
  - - [256, 64, 1, 3328, 256, 256, 3328, 3328]
    - [2, 225.314]
  - - [5056, 448, 1, 768, 5056, 5056, 768, 768]
    - [6, 3141.68]
  - - [128, 6784, 1, 1792, 128, 128, 1792, 1792]
    - [6, 3001.0]
  - - [4288, 448, 1, 3328, 4288, 4288, 3328, 3328]
    - [0, 3973.4]
  - - [128, 64, 1, 256, 128, 128, 256, 256]
    - [2, 74.3601]
  - - [3584, 1024, 1, 256, 3584, 3584, 256, 256]
    - [4, 3431.86]
  - - [4, 4288, 1, 1792, 4, 4, 1792, 1792]
    - [7, 101.132]
  - - [2368, 5888, 1, 1792, 2368, 2368, 1792, 1792]
    - [3, 3963.75]
  - - [2368, 1856, 1, 256, 2368, 2368, 256, 256]
    - [6, 3357.32]
  - - [6784, 64, 1, 768, 6784, 6784, 768, 768]
    - [5, 2515.24]
  - - [2368, 2368, 1, 1792, 2368, 2368, 1792, 1792]
    - [4, 3871.99]
  - - [4288, 2368, 1, 768, 4288, 4288, 768, 768]
    - [3, 3737.94]
  - - [2944, 128, 1, 256, 2944, 2944, 256, 256]
    - [5, 1729.74]
  - - [6784, 6784, 1, 768, 6784, 6784, 768, 768]
    - [3, 4300.2]
  - - [1856, 1856, 1, 1792, 1856, 1856, 1792, 1792]
    - [3, 3844.76]
  - - [1024, 4, 1, 256, 1024, 1024, 256, 256]
    - [7, 29.848]
  - - [1024, 4288, 1, 256, 1024, 1024, 256, 256]
    - [6, 3325.97]
  - - [5056, 2368, 1, 768, 5056, 5056, 768, 768]
    - [0, 3760.19]
  - - [448, 3584, 1, 768, 448, 448, 768, 768]
    - [4, 3198.2]
  - - [2944, 64, 1, 256, 2944, 2944, 256, 256]
    - [5, 1146.84]
  - - [4, 256, 1, 1792, 4, 4, 1792, 1792]
    - [7, 13.1003]
  - - [2368, 256, 1, 768, 2368, 2368, 768, 768]
    - [5, 2202.94]
  - - [256, 5888, 1, 768, 256, 256, 768, 768]
    - [4, 3004.89]
  - - [1024, 2368, 1, 3328, 1024, 1024, 3328, 3328]
    - [0, 3112.16]
  - - [4, 704, 1, 768, 4, 4, 768, 768]
    - [7, 31.887]
  - - [3584, 4288, 1, 256, 3584, 3584, 256, 256]
    - [0, 3788.3]
  - - [5056, 4, 1, 768, 5056, 5056, 768, 768]
    - [7, 182.016]
  - - [2368, 5056, 1, 768, 2368, 2368, 768, 768]
    - [0, 3758.34]
  - - [6784, 256, 1, 3328, 6784, 6784, 3328, 3328]
    - [4, 3605.79]
  - - [128, 5888, 1, 256, 128, 128, 256, 256]
    - [6, 2197.54]
  - - [64, 448, 1, 3328, 64, 64, 3328, 3328]
    - [2, 392.337]
  - - [256, 5888, 1, 3328, 256, 256, 3328, 3328]
    - [0, 3137.03]
  - - [4, 1856, 1, 3328, 4, 4, 3328, 3328]
    - [7, 84.8213]
  - - [3584, 2944, 1, 768, 3584, 3584, 768, 768]
    - [0, 3877.88]
  - - [448, 1408, 1, 1792, 448, 448, 1792, 1792]
    - [5, 2484.13]
  - - [5056, 128, 1, 3328, 5056, 5056, 3328, 3328]
    - [5, 2510.52]
  - - [5888, 6784, 1, 768, 5888, 5888, 768, 768]
    - [3, 4100.18]
  - - [4288, 64, 1, 3328, 4288, 4288, 3328, 3328]
    - [5, 1807.42]
  - - [448, 1024, 1, 3328, 448, 448, 3328, 3328]
    - [5, 3005.78]
  - - [4, 704, 1, 3328, 4, 4, 3328, 3328]
    - [7, 32.6355]
  - - [5888, 704, 1, 256, 5888, 5888, 256, 256]
    - [6, 3173.73]
  - - [448, 1856, 1, 256, 448, 448, 256, 256]
    - [6, 2437.49]
  - - [704, 4288, 1, 256, 704, 704, 256, 256]
    - [6, 2934.74]
  - - [128, 2368, 1, 3328, 128, 128, 3328, 3328]
    - [5, 1967.37]
  - - [1856, 5056, 1, 256, 1856, 1856, 256, 256]
    - [0, 3635.13]
  - - [5888, 64, 1, 1792, 5888, 5888, 1792, 1792]
    - [5, 2403.67]
  - - [1024, 64, 1, 3328, 1024, 1024, 3328, 3328]
    - [2, 890.209]
  - - [128, 5888, 1, 3328, 128, 128, 3328, 3328]
    - [6, 2648.92]
  - - [1024, 1024, 1, 256, 1024, 1024, 256, 256]
    - [6, 2139.22]
  - - [2368, 1408, 1, 1792, 2368, 2368, 1792, 1792]
    - [3, 3735.88]
  - - [5888, 6784, 1, 256, 5888, 5888, 256, 256]
    - [0, 3943.16]
  - - [6784, 128, 1, 768, 6784, 6784, 768, 768]
    - [6, 2871.9]
  - - [256, 2368, 1, 256, 256, 256, 256, 256]
    - [5, 1837.92]
  - - [2368, 6784, 1, 3328, 2368, 2368, 3328, 3328]
    - [4, 3908.47]
  - - [1408, 64, 1, 3328, 1408, 1408, 3328, 3328]
    - [2, 1212.11]
  - - [4, 128, 1, 256, 4, 4, 256, 256]
    - [7, 5.09562]
  - - [1856, 1856, 1, 3328, 1856, 1856, 3328, 3328]
    - [3, 3905.33]
  - - [64, 4288, 1, 256, 64, 64, 256, 256]
    - [5, 1175.61]
  - - [128, 256, 1, 768, 128, 128, 768, 768]
    - [2, 395.457]
  - - [1024, 2368, 1, 1792, 1024, 1024, 1792, 1792]
    - [6, 3153.54]
  - - [2944, 128, 1, 1792, 2944, 2944, 1792, 1792]
    - [5, 2408.47]
  - - [704, 3584, 1, 256, 704, 704, 256, 256]
    - [4, 2887.5]
  - - [1408, 5888, 1, 1792, 1408, 1408, 1792, 1792]
    - [4, 3775.55]
  - - [6784, 1024, 1, 768, 6784, 6784, 768, 768]
    - [3, 3838.62]
  - - [64, 1408, 1, 1792, 64, 64, 1792, 1792]
    - [2, 1152.56]
  - - [3584, 64, 1, 256, 3584, 3584, 256, 256]
    - [5, 1333.26]
  - - [1856, 64, 1, 3328, 1856, 1856, 3328, 3328]
    - [2, 1584.84]
  - - [3584, 1408, 1, 3328, 3584, 3584, 3328, 3328]
    - [0, 3515.84]
  - - [5056, 2944, 1, 256, 5056, 5056, 256, 256]
    - [3, 3800.37]
  - - [128, 1856, 1, 1792, 128, 128, 1792, 1792]
    - [2, 1946.66]
  - - [1856, 448, 1, 1792, 1856, 1856, 1792, 1792]
    - [6, 2884.28]
  - - [5888, 128, 1, 768, 5888, 5888, 768, 768]
    - [6, 2503.69]
  - - [5888, 1024, 1, 768, 5888, 5888, 768, 768]
    - [4, 3457.54]
  - - [64, 2944, 1, 1792, 64, 64, 1792, 1792]
    - [2, 1549.72]
  - - [256, 5888, 1, 256, 256, 256, 256, 256]
    - [4, 2738.42]
  - - [1856, 5056, 1, 1792, 1856, 1856, 1792, 1792]
    - [0, 3913.15]
  - - [448, 448, 1, 3328, 448, 448, 3328, 3328]
    - [5, 1758.9]
  - - [128, 1024, 1, 3328, 128, 128, 3328, 3328]
    - [5, 1140.69]
  - - [448, 4, 1, 256, 448, 448, 256, 256]
    - [7, 16.0478]
  - - [5056, 128, 1, 256, 5056, 5056, 256, 256]
    - [6, 1920.85]
  - - [4, 5888, 1, 256, 4, 4, 256, 256]
    - [7, 149.696]
  - - [448, 2368, 1, 3328, 448, 448, 3328, 3328]
    - [5, 2750.63]
  - - [256, 704, 1, 768, 256, 256, 768, 768]
    - [5, 1481.63]
  - - [64, 5888, 1, 256, 64, 64, 256, 256]
    - [6, 1495.86]
  - - [1408, 448, 1, 768, 1408, 1408, 768, 768]
    - [5, 2324.93]
  - - [6784, 3584, 1, 768, 6784, 6784, 768, 768]
    - [0, 4021.58]
  - - [64, 64, 1, 3328, 64, 64, 3328, 3328]
    - [2, 55.7085]
  - - [3584, 256, 1, 256, 3584, 3584, 256, 256]
    - [6, 2659.91]
  - - [704, 64, 1, 256, 704, 704, 256, 256]
    - [2, 401.315]
  - - [3584, 128, 1, 1792, 3584, 3584, 1792, 1792]
    - [5, 2900.11]
  - - [128, 3584, 1, 768, 128, 128, 768, 768]
    - [1, 2605.0]
  - - [704, 4, 1, 3328, 704, 704, 3328, 3328]
    - [7, 32.5243]
  - - [5056, 4288, 1, 3328, 5056, 5056, 3328, 3328]
    - [3, 4132.5]
  - - [4, 704, 1, 1792, 4, 4, 1792, 1792]
    - [7, 34.1077]
  - - [2368, 2368, 1, 3328, 2368, 2368, 3328, 3328]
    - [4, 3840.55]
  - - [1408, 1856, 1, 256, 1408, 1408, 256, 256]
    - [6, 2926.91]
  - - [4, 2944, 1, 256, 4, 4, 256, 256]
    - [7, 90.5271]
  - - [1024, 4288, 1, 768, 1024, 1024, 768, 768]
    - [6, 3455.76]
  - - [448, 4288, 1, 3328, 448, 448, 3328, 3328]
    - [4, 3949.71]
  - - [704, 128, 1, 1792, 704, 704, 1792, 1792]
    - [2, 1156.91]
  - - [3584, 704, 1, 768, 3584, 3584, 768, 768]
    - [0, 3137.52]
  - - [256, 64, 1, 768, 256, 256, 768, 768]
    - [2, 198.828]
  - - [704, 6784, 1, 768, 704, 704, 768, 768]
    - [4, 3739.9]
  - - [5056, 4288, 1, 768, 5056, 5056, 768, 768]
    - [3, 4019.39]
  - - [2368, 3584, 1, 3328, 2368, 2368, 3328, 3328]
    - [0, 3725.79]
  - - [5056, 2368, 1, 3328, 5056, 5056, 3328, 3328]
    - [4, 3824.97]
  - - [128, 256, 1, 1792, 128, 128, 1792, 1792]
    - [2, 434.27]
  - - [4288, 128, 1, 768, 4288, 4288, 768, 768]
    - [5, 1989.69]
  - - [128, 2944, 1, 256, 128, 128, 256, 256]
    - [1, 1698.88]
  - - [1408, 2368, 1, 3328, 1408, 1408, 3328, 3328]
    - [3, 3780.08]
  - - [256, 6784, 1, 768, 256, 256, 768, 768]
    - [4, 3444.79]
  - - [2944, 4, 1, 256, 2944, 2944, 256, 256]
    - [7, 90.2377]
  - - [64, 256, 1, 3328, 64, 64, 3328, 3328]
    - [2, 223.971]
  - - [256, 1856, 1, 1792, 256, 256, 1792, 1792]
    - [5, 3015.48]
  - - [2368, 4288, 1, 1792, 2368, 2368, 1792, 1792]
    - [3, 3835.43]
  - - [3584, 448, 1, 256, 3584, 3584, 256, 256]
    - [0, 2890.97]
  - - [6784, 2368, 1, 1792, 6784, 6784, 1792, 1792]
    - [0, 3940.37]
  - - [5056, 256, 1, 3328, 5056, 5056, 3328, 3328]
    - [6, 3004.32]
  - - [5888, 5056, 1, 256, 5888, 5888, 256, 256]
    - [0, 3877.45]
  - - [5888, 4288, 1, 768, 5888, 5888, 768, 768]
    - [0, 4027.68]
  - - [1408, 1024, 1, 768, 1408, 1408, 768, 768]
    - [6, 3226.99]
  - - [5056, 6784, 1, 3328, 5056, 5056, 3328, 3328]
    - [3, 4362.06]
  - - [64, 1856, 1, 768, 64, 64, 768, 768]
    - [2, 1297.0]
  - - [64, 256, 1, 256, 64, 64, 256, 256]
    - [2, 153.36]
  - - [5056, 1856, 1, 1792, 5056, 5056, 1792, 1792]
    - [0, 3910.82]
  - - [1408, 448, 1, 256, 1408, 1408, 256, 256]
    - [1, 1888.46]
  - - [4288, 128, 1, 3328, 4288, 4288, 3328, 3328]
    - [5, 2150.46]
  - - [1856, 2368, 1, 256, 1856, 1856, 256, 256]
    - [6, 3355.82]
  - - [5056, 5056, 1, 1792, 5056, 5056, 1792, 1792]
    - [3, 4149.16]
  - - [6784, 128, 1, 1792, 6784, 6784, 1792, 1792]
    - [6, 2999.52]
  - - [256, 4, 1, 256, 256, 256, 256, 256]
    - [7, 9.73118]
  - - [256, 1856, 1, 768, 256, 256, 768, 768]
    - [5, 2744.47]
  - - [1408, 3584, 1, 1792, 1408, 1408, 1792, 1792]
    - [4, 3498.06]
  - - [256, 4288, 1, 256, 256, 256, 256, 256]
    - [6, 2269.99]
  - - [256, 128, 1, 768, 256, 256, 768, 768]
    - [2, 396.054]
  - - [3584, 4, 1, 256, 3584, 3584, 256, 256]
    - [7, 109.453]
  - - [6784, 3584, 1, 3328, 6784, 6784, 3328, 3328]
    - [0, 4034.28]
  - - [5056, 4, 1, 1792, 5056, 5056, 1792, 1792]
    - [7, 67.9596]
  - - [1408, 1408, 1, 1792, 1408, 1408, 1792, 1792]
    - [5, 2895.62]
  - - [64, 4288, 1, 768, 64, 64, 768, 768]
    - [5, 1551.01]
  - - [64, 1856, 1, 1792, 64, 64, 1792, 1792]
    - [2, 1498.35]
  - - [704, 1856, 1, 3328, 704, 704, 3328, 3328]
    - [5, 2914.21]
  - - [128, 64, 1, 1792, 128, 128, 1792, 1792]
    - [2, 109.235]
  - - [6784, 5056, 1, 3328, 6784, 6784, 3328, 3328]
    - [3, 4358.17]
  - - [704, 3584, 1, 3328, 704, 704, 3328, 3328]
    - [5, 3119.82]
  - - [1408, 256, 1, 256, 1408, 1408, 256, 256]
    - [5, 1657.55]
  - - [2368, 1408, 1, 256, 2368, 2368, 256, 256]
    - [3, 3256.66]
  - - [1024, 2368, 1, 256, 1024, 1024, 256, 256]
    - [6, 3112.91]
  - - [704, 4, 1, 1792, 704, 704, 1792, 1792]
    - [7, 33.9483]
  - - [128, 64, 1, 3328, 128, 128, 3328, 3328]
    - [2, 112.704]
  - - [4, 5056, 1, 3328, 4, 4, 3328, 3328]
    - [7, 66.5315]
  - - [5056, 448, 1, 3328, 5056, 5056, 3328, 3328]
    - [5, 3052.22]
  - - [4, 1856, 1, 768, 4, 4, 768, 768]
    - [7, 76.2308]
  - - [2368, 448, 1, 3328, 2368, 2368, 3328, 3328]
    - [1, 2663.87]
  - - [128, 3584, 1, 3328, 128, 128, 3328, 3328]
    - [1, 2933.66]
  - - [2944, 1408, 1, 768, 2944, 2944, 768, 768]
    - [6, 3280.2]
  - - [4288, 5888, 1, 768, 4288, 4288, 768, 768]
    - [3, 4052.64]
  - - [448, 256, 1, 256, 448, 448, 256, 256]
    - [2, 852.963]
  - - [4288, 4288, 1, 768, 4288, 4288, 768, 768]
    - [3, 4082.68]
  - - [256, 6784, 1, 1792, 256, 256, 1792, 1792]
    - [0, 3564.95]
  - - [256, 256, 1, 1792, 256, 256, 1792, 1792]
    - [2, 855.481]
  - - [6784, 1856, 1, 1792, 6784, 6784, 1792, 1792]
    - [0, 4008.36]
  - - [1856, 5056, 1, 768, 1856, 1856, 768, 768]
    - [0, 3838.1]
  - - [6784, 5056, 1, 768, 6784, 6784, 768, 768]
    - [3, 4247.41]
  - - [704, 2368, 1, 768, 704, 704, 768, 768]
    - [4, 3273.85]
  - - [4288, 3584, 1, 3328, 4288, 4288, 3328, 3328]
    - [3, 4387.22]
  - - [5056, 5056, 1, 256, 5056, 5056, 256, 256]
    - [3, 3802.95]
  - - [4288, 1408, 1, 3328, 4288, 4288, 3328, 3328]
    - [4, 3517.16]
  - - [1856, 1408, 1, 768, 1856, 1856, 768, 768]
    - [4, 3263.1]
  - - [5056, 128, 1, 1792, 5056, 5056, 1792, 1792]
    - [5, 2467.98]
  - - [1408, 1856, 1, 3328, 1408, 1408, 3328, 3328]
    - [4, 3331.87]
  - - [6784, 4288, 1, 1792, 6784, 6784, 1792, 1792]
    - [3, 4129.55]
  - - [2944, 256, 1, 768, 2944, 2944, 768, 768]
    - [6, 2519.79]
  - - [256, 3584, 1, 768, 256, 256, 768, 768]
    - [6, 3041.59]
  - - [704, 3584, 1, 768, 704, 704, 768, 768]
    - [4, 3148.94]
  - - [5056, 6784, 1, 256, 5056, 5056, 256, 256]
    - [3, 4001.27]
  - - [1024, 448, 1, 1792, 1024, 1024, 1792, 1792]
    - [5, 2888.31]
  - - [4, 5888, 1, 3328, 4, 4, 3328, 3328]
    - [7, 65.2708]
  - - [3584, 3584, 1, 1792, 3584, 3584, 1792, 1792]
    - [0, 3844.53]
  - - [6784, 4, 1, 256, 6784, 6784, 256, 256]
    - [7, 176.16]
  - - [2944, 64, 1, 768, 2944, 2944, 768, 768]
    - [5, 1420.67]
  - - [256, 4288, 1, 1792, 256, 256, 1792, 1792]
    - [5, 2731.74]
  - - [448, 2368, 1, 1792, 448, 448, 1792, 1792]
    - [5, 2697.6]
  - - [5056, 4, 1, 256, 5056, 5056, 256, 256]
    - [7, 139.557]
  - - [448, 3584, 1, 256, 448, 448, 256, 256]
    - [4, 2932.99]
  - - [448, 1024, 1, 768, 448, 448, 768, 768]
    - [5, 2671.15]
  - - [5888, 1856, 1, 768, 5888, 5888, 768, 768]
    - [3, 3951.69]
  - - [1408, 4, 1, 1792, 1408, 1408, 1792, 1792]
    - [7, 62.5511]
  - - [2944, 704, 1, 256, 2944, 2944, 256, 256]
    - [6, 2730.59]
  - - [3584, 1024, 1, 1792, 3584, 3584, 1792, 1792]
    - [3, 4053.56]
  - - [128, 4288, 1, 3328, 128, 128, 3328, 3328]
    - [1, 2149.69]
  - - [1024, 1856, 1, 3328, 1024, 1024, 3328, 3328]
    - [0, 3943.73]
  - - [128, 1024, 1, 256, 128, 128, 256, 256]
    - [1, 855.631]
  - - [1024, 3584, 1, 768, 1024, 1024, 768, 768]
    - [3, 3804.87]
  - - [1024, 256, 1, 768, 1024, 1024, 768, 768]
    - [5, 1552.23]
  - - [4288, 1856, 1, 256, 4288, 4288, 256, 256]
    - [0, 3382.74]
  - - [6784, 256, 1, 1792, 6784, 6784, 1792, 1792]
    - [4, 3561.34]
  - - [1024, 704, 1, 1792, 1024, 1024, 1792, 1792]
    - [1, 2677.42]
  - - [448, 2368, 1, 768, 448, 448, 768, 768]
    - [5, 2569.11]
  - - [1856, 3584, 1, 1792, 1856, 1856, 1792, 1792]
    - [4, 3851.13]
  - - [4288, 448, 1, 256, 4288, 4288, 256, 256]
    - [0, 3288.72]
  - - [1024, 2944, 1, 1792, 1024, 1024, 1792, 1792]
    - [3, 3359.9]
  - - [128, 4, 1, 1792, 128, 128, 1792, 1792]
    - [7, 6.58145]
  - - [1856, 3584, 1, 768, 1856, 1856, 768, 768]
    - [4, 3759.49]
  - - [64, 4288, 1, 3328, 64, 64, 3328, 3328]
    - [5, 1792.92]
  - - [2944, 1408, 1, 256, 2944, 2944, 256, 256]
    - [6, 3177.83]
  - - [1408, 3584, 1, 3328, 1408, 1408, 3328, 3328]
    - [4, 3495.41]
  - - [704, 1408, 1, 256, 704, 704, 256, 256]
    - [6, 2071.18]
  - - [1856, 256, 1, 1792, 1856, 1856, 1792, 1792]
    - [5, 3013.89]
  - - [3584, 1856, 1, 3328, 3584, 3584, 3328, 3328]
    - [0, 3872.27]
  - - [5056, 256, 1, 1792, 5056, 5056, 1792, 1792]
    - [6, 2979.62]
  - - [704, 2944, 1, 1792, 704, 704, 1792, 1792]
    - [5, 3060.39]
  - - [1856, 1024, 1, 1792, 1856, 1856, 1792, 1792]
    - [4, 3908.24]
  - - [6784, 448, 1, 1792, 6784, 6784, 1792, 1792]
    - [3, 3381.96]
  - - [3584, 128, 1, 256, 3584, 3584, 256, 256]
    - [5, 2025.58]
  - - [448, 3584, 1, 1792, 448, 448, 1792, 1792]
    - [0, 3276.42]
  - - [4288, 128, 1, 256, 4288, 4288, 256, 256]
    - [5, 1673.68]
  - - [4288, 4, 1, 3328, 4288, 4288, 3328, 3328]
    - [8, 71.5333]
  - - [4, 4, 1, 3328, 4, 4, 3328, 3328]
    - [7, 0.211818]
  - - [256, 64, 1, 1792, 256, 256, 1792, 1792]
    - [2, 217.986]
  - - [1408, 256, 1, 768, 1408, 1408, 768, 768]
    - [5, 2125.93]
  - - [1856, 64, 1, 768, 1856, 1856, 768, 768]
    - [2, 1299.37]
  - - [128, 1856, 1, 768, 128, 128, 768, 768]
    - [1, 1791.09]
  - - [704, 256, 1, 256, 704, 704, 256, 256]
    - [1, 1112.35]
  - - [3584, 5888, 1, 256, 3584, 3584, 256, 256]
    - [4, 3826.11]
  - - [256, 1408, 1, 768, 256, 256, 768, 768]
    - [5, 2129.68]
  - - [2944, 4, 1, 3328, 2944, 2944, 3328, 3328]
    - [7, 127.058]
  - - [3584, 6784, 1, 1792, 3584, 3584, 1792, 1792]
    - [0, 4074.23]
  - - [1856, 704, 1, 3328, 1856, 1856, 3328, 3328]
    - [1, 2861.38]
  - - [2944, 448, 1, 768, 2944, 2944, 768, 768]
    - [6, 2959.27]
  - - [448, 6784, 1, 3328, 448, 448, 3328, 3328]
    - [3, 3439.95]
  - - [5888, 2944, 1, 1792, 5888, 5888, 1792, 1792]
    - [0, 4036.06]
  - - [704, 5888, 1, 256, 704, 704, 256, 256]
    - [6, 3181.9]
  - - [5888, 2368, 1, 1792, 5888, 5888, 1792, 1792]
    - [3, 3934.24]
  - - [4, 5888, 1, 768, 4, 4, 768, 768]
    - [7, 176.292]
  - - [64, 128, 1, 768, 64, 64, 768, 768]
    - [2, 99.6577]
  - - [4288, 704, 1, 256, 4288, 4288, 256, 256]
    - [6, 2933.5]
  - - [1408, 4288, 1, 768, 1408, 1408, 768, 768]
    - [0, 3460.7]
  - - [2368, 256, 1, 3328, 2368, 2368, 3328, 3328]
    - [1, 2362.88]
  - - [1856, 128, 1, 768, 1856, 1856, 768, 768]
    - [5, 1911.27]
  - - [256, 1408, 1, 1792, 256, 256, 1792, 1792]
    - [5, 2309.77]
  - - [5888, 4288, 1, 256, 5888, 5888, 256, 256]
    - [0, 3903.22]
  - - [5888, 256, 1, 1792, 5888, 5888, 1792, 1792]
    - [4, 3096.87]
  - - [5888, 5056, 1, 1792, 5888, 5888, 1792, 1792]
    - [3, 4219.73]
  - - [1856, 6784, 1, 768, 1856, 1856, 768, 768]
    - [4, 3949.36]
  - - [2944, 5056, 1, 768, 2944, 2944, 768, 768]
    - [3, 4109.02]
  - - [2368, 64, 1, 768, 2368, 2368, 768, 768]
    - [5, 1217.42]
  - - [2944, 64, 1, 1792, 2944, 2944, 1792, 1792]
    - [2, 1549.53]
  - - [1024, 5056, 1, 1792, 1024, 1024, 1792, 1792]
    - [0, 3598.13]
  - - [1408, 6784, 1, 768, 1408, 1408, 768, 768]
    - [0, 3937.09]
  - - [4288, 3584, 1, 256, 4288, 4288, 256, 256]
    - [3, 3930.61]
  - - [128, 1024, 1, 768, 128, 128, 768, 768]
    - [1, 1100.29]
  - - [3584, 256, 1, 768, 3584, 3584, 768, 768]
    - [6, 3043.2]
  - - [4, 6784, 1, 256, 4, 4, 256, 256]
    - [7, 163.696]
  - - [448, 128, 1, 1792, 448, 448, 1792, 1792]
    - [2, 753.11]
  - - [2368, 64, 1, 256, 2368, 2368, 256, 256]
    - [1, 965.94]
  - - [6784, 6784, 1, 256, 6784, 6784, 256, 256]
    - [3, 3980.24]
  - - [64, 1024, 1, 768, 64, 64, 768, 768]
    - [2, 764.826]
  - - [2368, 2944, 1, 3328, 2368, 2368, 3328, 3328]
    - [3, 3975.0]
  - - [6784, 6784, 1, 1792, 6784, 6784, 1792, 1792]
    - [3, 4363.13]
  - - [1408, 64, 1, 768, 1408, 1408, 768, 768]
    - [2, 1020.46]
  - - [3584, 5056, 1, 3328, 3584, 3584, 3328, 3328]
    - [3, 4126.19]
  - - [256, 1408, 1, 3328, 256, 256, 3328, 3328]
    - [5, 2380.28]
  - - [6784, 5056, 1, 256, 6784, 6784, 256, 256]
    - [0, 3938.53]
  - - [64, 1856, 1, 3328, 64, 64, 3328, 3328]
    - [2, 1584.13]
  - - [64, 704, 1, 1792, 64, 64, 1792, 1792]
    - [2, 592.656]
  - - [448, 128, 1, 3328, 448, 448, 3328, 3328]
    - [2, 781.963]
  - - [4, 2944, 1, 1792, 4, 4, 1792, 1792]
    - [7, 128.374]
  - - [256, 5056, 1, 768, 256, 256, 768, 768]
    - [6, 2901.92]
  - - [4288, 5056, 1, 3328, 4288, 4288, 3328, 3328]
    - [3, 4134.91]
  - - [3584, 6784, 1, 256, 3584, 3584, 256, 256]
    - [4, 3872.77]
  - - [3584, 448, 1, 768, 3584, 3584, 768, 768]
    - [0, 3197.89]
  - - [5056, 1408, 1, 256, 5056, 5056, 256, 256]
    - [3, 3556.2]
  - - [448, 5888, 1, 768, 448, 448, 768, 768]
    - [4, 3281.84]
  - - [6784, 1024, 1, 1792, 6784, 6784, 1792, 1792]
    - [3, 3930.75]
  - - [256, 4, 1, 768, 256, 256, 768, 768]
    - [7, 12.2279]
  - - [5056, 6784, 1, 1792, 5056, 5056, 1792, 1792]
    - [3, 4336.2]
  - - [2368, 1856, 1, 768, 2368, 2368, 768, 768]
    - [6, 3474.12]
  - - [1408, 704, 1, 1792, 1408, 1408, 1792, 1792]
    - [5, 2483.9]
  - - [6784, 704, 1, 3328, 6784, 6784, 3328, 3328]
    - [0, 3819.24]
  - - [2944, 3584, 1, 3328, 2944, 2944, 3328, 3328]
    - [3, 4022.48]
  - - [4, 5888, 1, 1792, 4, 4, 1792, 1792]
    - [7, 108.675]
  - - [64, 448, 1, 768, 64, 64, 768, 768]
    - [2, 342.75]
  - - [5056, 5888, 1, 768, 5056, 5056, 768, 768]
    - [3, 4161.07]
  - - [1856, 4288, 1, 768, 1856, 1856, 768, 768]
    - [0, 3572.4]
  - - [704, 5888, 1, 768, 704, 704, 768, 768]
    - [6, 3278.06]
  - - [4, 448, 1, 768, 4, 4, 768, 768]
    - [7, 21.307]
  - - [256, 448, 1, 3328, 256, 256, 3328, 3328]
    - [2, 1532.18]
  - - [2944, 1024, 1, 768, 2944, 2944, 768, 768]
    - [3, 3314.65]
  - - [3584, 64, 1, 1792, 3584, 3584, 1792, 1792]
    - [2, 1868.42]
  - - [2944, 5888, 1, 3328, 2944, 2944, 3328, 3328]
    - [0, 4019.86]
  - - [4288, 5056, 1, 256, 4288, 4288, 256, 256]
    - [0, 3758.65]
  - - [448, 5056, 1, 768, 448, 448, 768, 768]
    - [6, 3130.46]
  - - [1408, 128, 1, 256, 1408, 1408, 256, 256]
    - [1, 1112.35]
  - - [4, 1856, 1, 1792, 4, 4, 1792, 1792]
    - [7, 81.9581]
  - - [6784, 704, 1, 1792, 6784, 6784, 1792, 1792]
    - [0, 3796.02]
  - - [3584, 4288, 1, 1792, 3584, 3584, 1792, 1792]
    - [3, 4291.75]
  - - [2944, 704, 1, 3328, 2944, 2944, 3328, 3328]
    - [5, 3058.7]
  - - [1408, 4288, 1, 3328, 1408, 1408, 3328, 3328]
    - [4, 3492.85]
  - - [5056, 4288, 1, 256, 5056, 5056, 256, 256]
    - [0, 3764.21]
  - - [448, 64, 1, 3328, 448, 448, 3328, 3328]
    - [2, 392.81]
  - - [1408, 1408, 1, 768, 1408, 1408, 768, 768]
    - [5, 2778.18]
  - - [3584, 2368, 1, 768, 3584, 3584, 768, 768]
    - [0, 3783.16]
  - - [1856, 1408, 1, 256, 1856, 1856, 256, 256]
    - [4, 2995.2]
  - - [1856, 2944, 1, 3328, 1856, 1856, 3328, 3328]
    - [0, 3806.19]
  - - [2368, 448, 1, 256, 2368, 2368, 256, 256]
    - [6, 2205.16]
  - - [2368, 5888, 1, 3328, 2368, 2368, 3328, 3328]
    - [3, 3991.52]
  - - [1024, 3584, 1, 3328, 1024, 1024, 3328, 3328]
    - [3, 4131.3]
  - - [1856, 64, 1, 1792, 1856, 1856, 1792, 1792]
    - [2, 1498.85]
  - - [64, 5056, 1, 1792, 64, 64, 1792, 1792]
    - [5, 1943.97]
  - - [1408, 448, 1, 3328, 1408, 1408, 3328, 3328]
    - [1, 2351.63]
  - - [6784, 4288, 1, 3328, 6784, 6784, 3328, 3328]
    - [0, 4044.93]
  - - [4288, 704, 1, 768, 4288, 4288, 768, 768]
    - [3, 3228.83]
  - - [1408, 2944, 1, 768, 1408, 1408, 768, 768]
    - [6, 3272.83]
  - - [704, 1408, 1, 3328, 704, 704, 3328, 3328]
    - [5, 2539.14]
  - - [64, 2368, 1, 1792, 64, 64, 1792, 1792]
    - [2, 1252.53]
  - - [4288, 1408, 1, 1792, 4288, 4288, 1792, 1792]
    - [4, 3504.5]
  - - [256, 448, 1, 1792, 256, 256, 1792, 1792]
    - [2, 1451.8]
  - - [1856, 4288, 1, 256, 1856, 1856, 256, 256]
    - [0, 3374.04]
  - - [1024, 4, 1, 1792, 1024, 1024, 1792, 1792]
    - [7, 45.5761]
  - - [128, 1024, 1, 1792, 128, 128, 1792, 1792]
    - [5, 1111.09]
- null
