src/Tensile/data/Configs/miopen/archives/inception/2019-08-26/exact/vega20_Cijk_Alik_Bljk_SB.yaml
- {MinimumRequiredVersion: 4.11.0}
- vega20
- gfx906
- [Device 66a0, Device 66a1, Device 66a7, Vega 20]
    SolutionIndex: 0
    SolutionNameMin: Cijk_Alik_Bljk_SB_MT64x32x16_SE_EPS1_FL0_GRVW4_LPA0_LPB0_PGR1_PLR1_TT4_4_USFGRO1_VW4_WG16_8_2_WGM8
    SolutionIndex: 1
    SolutionNameMin: Cijk_Alik_Bljk_SB_MT16x64x16_SE_EPS1_FL0_GRVW4_LPA0_LPB0_PGR1_PLR1_TT4_4_USFGRO1_VW4_WG4_16_4_WGM1
    SolutionIndex: 2
    SolutionNameMin: Cijk_Alik_Bljk_SB_MT16x64x16_SE_EPS1_FL0_GRVW4_LPA0_LPB0_PGR1_PLR1_TT4_4_USFGRO1_VW4_WG4_16_4_WGM8
    SolutionIndex: 3
    SolutionNameMin: Cijk_Alik_Bljk_SB_MT32x64x16_SE_EPS1_FL1_GRVW2_LPA2_LPB2_PGR1_PLR1_TT2_4_USFGRO1_VW2_WG16_16_1_WGM1
    SolutionIndex: 4
    SolutionNameMin: Cijk_Alik_Bljk_SB_MT32x64x32_SE_EPS1_FL1_GRVW4_LPA2_LPB2_PGR1_PLR1_TT2_4_USFGRO1_VW2_WG16_16_1_WGM8
    SolutionIndex: 5
    SolutionNameMin: Cijk_Alik_Bljk_SB_MT64x128x16_SE_EPS1_FL0_GRVW4_LPA2_LPB2_PGR1_PLR1_TT4_8_USFGRO1_VW2_WG16_16_1_WGM8
    SolutionIndex: 6
    SolutionNameMin: Cijk_Alik_Bljk_SB_MT128x64x16_SE_EPS0_FL0_GRVW4_LPA4_LPB4_PGR0_PLR1_TT8_4_USFGRO1_VW4_WG16_16_1_WGM8
    SolutionIndex: 7
    SolutionNameMin: Cijk_Alik_Bljk_SB_MT128x64x16_SE_EPS1_FL1_GRVW4_LPA2_LPB2_PGR1_PLR1_TT8_4_USFGRO1_VW2_WG16_16_1_WGM8
    SolutionIndex: 8
    SolutionNameMin: Cijk_Alik_Bljk_SB_MT128x64x16_SE_EPS1_FL1_GRVW4_LPA4_LPB4_PGR1_PLR1_TT8_4_USFGRO1_VW4_WG16_16_1_WGM1
    SolutionIndex: 9
    SolutionNameMin: Cijk_Alik_Bljk_SB_MT64x32x16_SE_EPS1_FL0_GRVW1_LPA4_LPB4_PGR1_PLR1_TT4_4_USFGRO1_VW4_WG16_8_1_WGM1
    SolutionIndex: 10
    SolutionNameMin: Cijk_Alik_Bljk_SB_MT64x32x16_SE_EPS1_FL0_GRVW1_LPA4_LPB4_PGR1_PLR1_TT4_4_USFGRO1_VW4_WG16_8_1_WGM8
- - - [96, 64, 36, 10368, 96, 96, 10368, 10368]
    - [3, 5000.95]
  - - [384, 448, 36, 512, 384, 384, 512, 512]
    - [8, 8903.0]
  - - [2048, 64, 1, 1001, 2048, 2048, 1001, 1001]
    - [1, 4385.13]
  - - [224, 192, 36, 5184, 224, 224, 5184, 5184]
    - [7, 7487.81]
  - - [2048, 128, 1, 1001, 2048, 2048, 1001, 1001]
    - [0, 5764.63]
  - - [96, 96, 36, 10368, 96, 96, 10368, 10368]
    - [9, 5275.21]
  - - [192, 80, 36, 20736, 192, 192, 20736, 20736]
    - [5, 5409.4]
  - - [96, 64, 36, 5184, 96, 96, 5184, 5184]
    - [3, 4911.83]
  - - [1536, 64, 1, 1001, 1536, 1536, 1001, 1001]
    - [2, 3162.03]
  - - [96, 64, 36, 20736, 96, 96, 20736, 20736]
    - [4, 5034.33]
  - - [384, 448, 36, 256, 384, 384, 256, 256]
    - [6, 8815.87]
  - - [96, 96, 36, 5184, 96, 96, 5184, 5184]
    - [10, 5236.02]
- null
