lib/configs/lite_configs_mixed/vega10_Cijk_Alik_Bljk_SB.yaml
- {MinimumRequiredVersion: 4.8.1}
- vega10
- gfx900
- [Device 6863, Device 6862, Device 687f, Device 6860, Device 6861, 'Vega 10 XTX [Radeon
    SolutionIndex: 0
    SolutionNameMin: Cijk_Alik_Bljk_SB_MT128x064x16_GSU01
    SolutionIndex: 1
    SolutionNameMin: Cijk_Alik_Bljk_SB_MT064x064x16_GSU01
    SolutionIndex: 2
    SolutionNameMin: Cijk_Alik_Bljk_SB_MT064x128x16_GSU01
    SolutionIndex: 3
    SolutionNameMin: Cijk_Alik_Bljk_SB_MT032x064x16_GSU01
    SolutionIndex: 4
    SolutionNameMin: Cijk_Alik_Bljk_SB_MT032x032x16_GSU01
    SolutionIndex: 5
    SolutionNameMin: Cijk_Alik_Bljk_SB_MT128x128x16_GSU01
    SolutionIndex: 6
    SolutionNameMin: Cijk_Alik_Bljk_SB_MT064x032x16_GSU01
    SolutionIndex: 7
    SolutionNameMin: Cijk_Alik_Bljk_SB_MT032x032x32_GSU08
    SolutionIndex: 8
    SolutionNameMin: Cijk_Alik_Bljk_SB_MT032x032x32_GSU04
    SolutionIndex: 9
    SolutionNameMin: Cijk_Alik_Bljk_SB_MT064x032x16_GSU01
    SolutionIndex: 10
    SolutionNameMin: Cijk_Alik_Bljk_SB_MT064x064x16_GSU04
    SolutionIndex: 11
    SolutionNameMin: Cijk_Alik_Bljk_SB_MT128x064x08_GSU01
    SolutionIndex: 12
    SolutionNameMin: Cijk_Alik_Bljk_SB_MT064x064x16_GSU01
    SolutionIndex: 13
    SolutionNameMin: Cijk_Alik_Bljk_SB_MT128x128x16_GSU01
    SolutionIndex: 14
    SolutionNameMin: Cijk_Alik_Bljk_SB_MT032x032x16_GSU01
    SolutionIndex: 15
    SolutionNameMin: Cijk_Alik_Bljk_SB_MT064x128x08_GSU01
    SolutionIndex: 16
    SolutionNameMin: Cijk_Alik_Bljk_SB_MT032x032x32_GSU02
    SolutionIndex: 17
    SolutionNameMin: Cijk_Alik_Bljk_SB_MT064x064x16_GSU02
    SolutionIndex: 18
    SolutionNameMin: Cijk_Alik_Bljk_SB_MT032x064x16_GSU02
    SolutionIndex: 19
    SolutionNameMin: Cijk_Alik_Bljk_SB_MT064x032x16_GSU02
    SolutionIndex: 20
    SolutionNameMin: Cijk_Alik_Bljk_SB_MT064x032x16_GSU04
    SolutionIndex: 21
    SolutionNameMin: Cijk_Alik_Bljk_SB_MT032x064x16_GSU01
    SolutionIndex: 22
    SolutionNameMin: Cijk_Alik_Bljk_SB_MT016x016x04_GSU01
    SolutionIndex: 23
    SolutionNameMin: Cijk_Alik_Bljk_SB_MT008x008x08_GSU02
    SolutionIndex: 24
    SolutionNameMin: Cijk_Alik_Bljk_SB_MT008x008x08_GSU04
    SolutionIndex: 25
    SolutionNameMin: Cijk_Alik_Bljk_SB_MT008x008x08_GSU08
- - - [1024, 128, 1, 128]
    - [4, 478.836]
  - - [4, 256, 1, 1792]
    - [25, 63.0327]
  - - [128, 704, 1, 1792]
    - [14, 1988.98]
  - - [4, 1856, 1, 3328]
    - [24, 331.879]
  - - [5888, 256, 1, 1792]
    - [15, 5642.02]
  - - [1856, 448, 1, 3328]
    - [11, 4497.49]
  - - [3584, 1024, 1, 1792]
    - [13, 5571.91]
  - - [2368, 64, 1, 3328]
    - [10, 2718.06]
  - - [2368, 5888, 1, 256]
    - [15, 6002.12]
  - - [5888, 1856, 1, 256]
    - [13, 5804.01]
  - - [5056, 256, 1, 128]
    - [2, 2291.57]
  - - [4288, 4, 1, 768]
    - [23, 267.812]
  - - [2368, 1024, 1, 768]
    - [11, 5429.81]
  - - [128, 6784, 1, 3328]
    - [13, 4510.62]
  - - [5888, 1408, 1, 256]
    - [13, 5983.83]
  - - [5888, 1856, 1, 3328]
    - [13, 6240.04]
  - - [3584, 128, 1, 1792]
    - [12, 4184.72]
  - - [5056, 2944, 1, 768]
    - [13, 6165.99]
  - - [256, 1408, 1, 128]
    - [1, 921.365]
  - - [3584, 1408, 1, 256]
    - [13, 5632.9]
  - - [1024, 5056, 1, 128]
    - [0, 2527.2]
  - - [5056, 5056, 1, 3328]
    - [13, 6490.04]
  - - [448, 448, 1, 256]
    - [21, 2400.05]
  - - [2944, 3584, 1, 1792]
    - [13, 6026.88]
  - - [1024, 3584, 1, 3328]
    - [13, 5604.81]
  - - [4, 1408, 1, 1792]
    - [24, 207.375]
  - - [5888, 5056, 1, 128]
    - [2, 3324.15]
  - - [256, 4288, 1, 3328]
    - [12, 4355.9]
  - - [704, 1856, 1, 3328]
    - [12, 5171.57]
  - - [2944, 448, 1, 3328]
    - [15, 4939.94]
  - - [1024, 2368, 1, 256]
    - [12, 4642.67]
  - - [64, 4, 1, 256]
    - [25, 3.84657]
  - - [1024, 2944, 1, 1792]
    - [13, 5979.73]
  - - [5056, 64, 1, 3328]
    - [17, 3519.15]
  - - [448, 6784, 1, 1792]
    - [12, 5156.63]
  - - [256, 3584, 1, 1792]
    - [13, 4671.79]
  - - [704, 5056, 1, 768]
    - [13, 5181.57]
  - - [1408, 2368, 1, 1792]
    - [11, 5336.97]
  - - [256, 1408, 1, 3328]
    - [21, 3484.78]
  - - [448, 5056, 1, 256]
    - [12, 4832.07]
  - - [6784, 448, 1, 256]
    - [11, 5439.3]
  - - [128, 5056, 1, 128]
    - [1, 1446.69]
  - - [3584, 5888, 1, 768]
    - [13, 6286.78]
  - - [2368, 128, 1, 256]
    - [12, 2413.59]
  - - [1408, 2944, 1, 1792]
    - [13, 6272.8]
  - - [2944, 3584, 1, 768]
    - [13, 5951.75]
  - - [4, 5888, 1, 1792]
    - [25, 334.365]
  - - [1856, 5888, 1, 1792]
    - [13, 6215.56]
  - - [3584, 1024, 1, 256]
    - [12, 5122.48]
  - - [6784, 256, 1, 3328]
    - [13, 5118.39]
  - - [1408, 3584, 1, 256]
    - [13, 5671.37]
  - - [3584, 1024, 1, 768]
    - [13, 5445.8]
  - - [64, 704, 1, 128]
    - [4, 179.392]
  - - [6784, 6784, 1, 1792]
    - [13, 6650.57]
  - - [1856, 2368, 1, 3328]
    - [13, 5425.15]
  - - [1024, 64, 1, 3328]
    - [16, 1904.48]
  - - [6784, 4, 1, 128]
    - [22, 134.74]
  - - [1408, 704, 1, 768]
    - [11, 5072.47]
  - - [2368, 704, 1, 3328]
    - [13, 4888.16]
  - - [256, 5888, 1, 256]
    - [12, 4565.44]
  - - [1856, 4288, 1, 3328]
    - [13, 6215.26]
  - - [256, 2944, 1, 256]
    - [12, 4088.88]
  - - [5888, 1024, 1, 256]
    - [13, 5696.22]
  - - [4288, 2368, 1, 1792]
    - [13, 5790.64]
  - - [5056, 448, 1, 768]
    - [11, 5243.09]
  - - [1024, 704, 1, 256]
    - [12, 3892.71]
  - - [5056, 2944, 1, 1792]
    - [13, 6246.17]
  - - [1408, 2944, 1, 256]
    - [13, 5622.17]
  - - [4, 5888, 1, 256]
    - [24, 151.855]
  - - [6784, 5056, 1, 3328]
    - [13, 6428.66]
  - - [5056, 1856, 1, 768]
    - [11, 5915.02]
  - - [64, 2368, 1, 1792]
    - [9, 2336.69]
  - - [64, 128, 1, 128]
    - [4, 30.84]
  - - [2944, 4, 1, 256]
    - [24, 105.433]
  - - [704, 5056, 1, 128]
    - [2, 3058.47]
  - - [4, 1856, 1, 768]
    - [24, 157.728]
  - - [64, 64, 1, 768]
    - [14, 112.049]
  - - [448, 448, 1, 3328]
    - [9, 3306.57]
  - - [64, 5888, 1, 1792]
    - [12, 3317.37]
  - - [128, 1024, 1, 128]
    - [4, 488.121]
  - - [5056, 128, 1, 768]
    - [12, 4003.39]
  - - [4, 448, 1, 1792]
    - [25, 94.4462]
  - - [4, 4288, 1, 128]
    - [22, 91.7583]
  - - [4, 6784, 1, 3328]
    - [25, 320.236]
  - - [1856, 1408, 1, 768]
    - [15, 5672.84]
  - - [704, 64, 1, 1792]
    - [8, 1334.11]
  - - [448, 2368, 1, 1792]
    - [12, 4192.06]
  - - [2944, 128, 1, 1792]
    - [21, 3661.08]
  - - [2944, 128, 1, 128]
    - [1, 1060.51]
  - - [3584, 64, 1, 3328]
    - [9, 3706.89]
  - - [704, 448, 1, 256]
    - [9, 2546.65]
  - - [1408, 128, 1, 1792]
    - [21, 2847.73]
  - - [448, 704, 1, 768]
    - [9, 2999.92]
  - - [2944, 64, 1, 256]
    - [9, 2300.88]
  - - [1408, 2944, 1, 128]
    - [2, 3001.97]
  - - [128, 2368, 1, 1792]
    - [21, 2917.83]
  - - [3584, 256, 1, 1792]
    - [13, 4704.47]
  - - [704, 4, 1, 256]
    - [24, 29.1377]
  - - [5056, 4, 1, 3328]
    - [23, 168.541]
  - - [448, 6784, 1, 256]
    - [15, 5296.69]
  - - [448, 5888, 1, 128]
    - [1, 2630.16]
  - - [64, 128, 1, 768]
    - [14, 220.035]
  - - [2944, 256, 1, 3328]
    - [12, 4846.11]
  - - [1024, 64, 1, 128]
    - [4, 240.434]
  - - [64, 4288, 1, 1792]
    - [17, 2559.35]
  - - [5056, 3584, 1, 1792]
    - [13, 6354.22]
  - - [6784, 5888, 1, 256]
    - [13, 6341.59]
  - - [1408, 448, 1, 128]
    - [2, 1432.29]
  - - [704, 1024, 1, 128]
    - [2, 1663.13]
  - - [4, 64, 1, 768]
    - [25, 9.75795]
  - - [1856, 2368, 1, 768]
    - [11, 5603.33]
  - - [1408, 5056, 1, 3328]
    - [13, 6332.59]
  - - [1024, 1408, 1, 256]
    - [11, 4643.72]
  - - [2368, 2368, 1, 3328]
    - [13, 5791.76]
  - - [1856, 6784, 1, 128]
    - [2, 3515.44]
  - - [704, 5888, 1, 3328]
    - [15, 5511.68]
  - - [5056, 704, 1, 3328]
    - [11, 5449.63]
  - - [2368, 2944, 1, 768]
    - [13, 6055.93]
  - - [1408, 1856, 1, 256]
    - [11, 5483.4]
  - - [704, 6784, 1, 1792]
    - [13, 5808.77]
  - - [1856, 704, 1, 768]
    - [12, 5060.42]
  - - [2368, 5056, 1, 256]
    - [13, 5820.27]
  - - [5056, 6784, 1, 1792]
    - [13, 6408.08]
  - - [5056, 128, 1, 1792]
    - [21, 4129.75]
  - - [256, 448, 1, 768]
    - [9, 2451.68]
  - - [4288, 64, 1, 3328]
    - [10, 3059.39]
  - - [704, 5888, 1, 256]
    - [15, 5567.54]
  - - [6784, 2944, 1, 128]
    - [2, 3475.44]
  - - [256, 704, 1, 1792]
    - [9, 2875.91]
  - - [2944, 256, 1, 256]
    - [12, 4207.75]
  - - [1024, 1024, 1, 1792]
    - [13, 5354.98]
  - - [448, 5888, 1, 1792]
    - [13, 5177.91]
  - - [704, 1408, 1, 3328]
    - [15, 5071.52]
  - - [5056, 64, 1, 768]
    - [21, 2860.05]
  - - [3584, 704, 1, 3328]
    - [12, 5114.45]
  - - [4, 1024, 1, 3328]
    - [25, 242.133]
  - - [2944, 256, 1, 128]
    - [2, 1627.88]
  - - [5056, 64, 1, 1792]
    - [9, 3090.38]
  - - [256, 6784, 1, 768]
    - [12, 4894.18]
  - - [6784, 5056, 1, 768]
    - [13, 6340.37]
  - - [256, 2944, 1, 1792]
    - [12, 4787.87]
  - - [5056, 256, 1, 768]
    - [12, 4997.89]
  - - [64, 3584, 1, 3328]
    - [9, 3355.66]
  - - [704, 1024, 1, 768]
    - [12, 4438.27]
  - - [2368, 1856, 1, 1792]
    - [11, 5528.64]
  - - [2944, 64, 1, 3328]
    - [9, 3082.64]
  - - [128, 6784, 1, 1792]
    - [13, 4376.38]
  - - [2368, 128, 1, 3328]
    - [10, 3322.16]
  - - [128, 2944, 1, 768]
    - [12, 3258.46]
  - - [448, 1408, 1, 256]
    - [12, 3579.51]
  - - [5056, 4288, 1, 128]
    - [2, 3620.27]
  - - [4, 704, 1, 256]
    - [24, 27.885]
  - - [1024, 448, 1, 128]
    - [4, 1242.49]
  - - [448, 2944, 1, 1792]
    - [15, 4838.69]
  - - [1856, 5056, 1, 1792]
    - [13, 5860.91]
  - - [704, 2944, 1, 128]
    - [2, 2795.75]
  - - [1408, 5056, 1, 256]
    - [13, 5722.75]
  - - [2944, 1024, 1, 1792]
    - [13, 6004.83]
  - - [4288, 704, 1, 1792]
    - [11, 5538.7]
  - - [256, 4288, 1, 1792]
    - [12, 4323.61]
  - - [2368, 4288, 1, 768]
    - [15, 5827.83]
  - - [4, 1024, 1, 1792]
    - [25, 177.895]
  - - [5056, 1408, 1, 128]
    - [2, 3284.68]
  - - [1856, 4288, 1, 256]
    - [13, 5666.25]
  - - [64, 64, 1, 1792]
    - [7, 206.866]
  - - [5888, 1024, 1, 1792]
    - [13, 6186.69]
  - - [256, 3584, 1, 3328]
    - [13, 4808.75]
  - - [5888, 5056, 1, 256]
    - [13, 6248.88]
  - - [5056, 704, 1, 256]
    - [11, 4984.23]
  - - [128, 1408, 1, 128]
    - [4, 626.611]
  - - [448, 256, 1, 3328]
    - [18, 2768.71]
  - - [5056, 1024, 1, 3328]
    - [13, 6378.25]
  - - [3584, 3584, 1, 1792]
    - [13, 6207.59]
  - - [1408, 64, 1, 128]
    - [4, 339.98]
  - - [2944, 704, 1, 768]
    - [12, 5156.69]
  - - [1856, 3584, 1, 768]
    - [13, 5776.95]
  - - [1024, 6784, 1, 768]
    - [13, 5994.9]
  - - [1024, 256, 1, 256]
    - [9, 2950.94]
  - - [1856, 4, 1, 3328]
    - [25, 362.542]
  - - [128, 448, 1, 768]
    - [14, 1556.36]
  - - [2944, 3584, 1, 3328]
    - [13, 6050.01]
  - - [128, 4288, 1, 128]
    - [1, 1302.77]
  - - [64, 448, 1, 256]
    - [14, 563.015]
  - - [6784, 4288, 1, 1792]
    - [13, 6366.92]
  - - [256, 6784, 1, 1792]
    - [13, 5053.93]
  - - [128, 1024, 1, 3328]
    - [18, 3067.01]
  - - [448, 704, 1, 256]
    - [9, 2620.12]
  - - [3584, 5056, 1, 768]
    - [13, 6254.85]
  - - [6784, 128, 1, 768]
    - [15, 4402.38]
  - - [6784, 2944, 1, 256]
    - [13, 6084.43]
  - - [64, 1408, 1, 768]
    - [14, 1730.13]
  - - [5888, 4, 1, 1792]
    - [24, 159.15]
  - - [704, 448, 1, 768]
    - [9, 3050.28]
  - - [3584, 5056, 1, 128]
    - [2, 3232.37]
  - - [2944, 2368, 1, 768]
    - [13, 6019.12]
  - - [4288, 2368, 1, 3328]
    - [13, 5813.52]
  - - [4288, 6784, 1, 3328]
    - [13, 6383.66]
  - - [1024, 1856, 1, 768]
    - [13, 5281.25]
  - - [3584, 256, 1, 128]
    - [3, 1828.62]
  - - [2944, 5888, 1, 1792]
    - [13, 6438.91]
  - - [6784, 256, 1, 768]
    - [13, 4926.32]
  - - [3584, 6784, 1, 3328]
    - [13, 6438.51]
  - - [256, 1024, 1, 256]
    - [9, 3092.0]
  - - [1024, 5888, 1, 3328]
    - [13, 6230.66]
  - - [1408, 1856, 1, 3328]
    - [12, 5305.24]
  - - [128, 1408, 1, 1792]
    - [9, 2831.08]
  - - [5888, 64, 1, 256]
    - [12, 2894.01]
  - - [64, 5888, 1, 3328]
    - [17, 3684.44]
  - - [2944, 5888, 1, 128]
    - [2, 3447.24]
  - - [2368, 3584, 1, 128]
    - [2, 3339.81]
  - - [5888, 4, 1, 768]
    - [23, 279.705]
  - - [704, 4288, 1, 1792]
    - [12, 5122.96]
  - - [6784, 5888, 1, 1792]
    - [13, 6517.12]
  - - [128, 4288, 1, 1792]
    - [12, 3459.56]
  - - [5888, 256, 1, 768]
    - [12, 4918.98]
  - - [448, 1856, 1, 128]
    - [2, 1885.54]
  - - [64, 2944, 1, 768]
    - [9, 2501.23]
  - - [3584, 2368, 1, 3328]
    - [13, 5906.08]
  - - [1856, 1856, 1, 128]
    - [2, 3004.74]
  - - [2944, 4, 1, 128]
    - [22, 68.0555]
  - - [704, 5888, 1, 768]
    - [15, 5733.17]
  - - [3584, 1856, 1, 1792]
    - [13, 5869.31]
  - - [128, 5888, 1, 256]
    - [12, 3413.62]
  - - [1856, 1024, 1, 3328]
    - [13, 5579.29]
  - - [1024, 6784, 1, 1792]
    - [13, 6138.26]
  - - [4288, 1024, 1, 256]
    - [15, 5462.42]
  - - [2944, 2368, 1, 128]
    - [2, 3137.07]
  - - [704, 704, 1, 3328]
    - [12, 4594.82]
  - - [3584, 2944, 1, 256]
    - [13, 5718.11]
  - - [3584, 256, 1, 3328]
    - [13, 4807.07]
  - - [4, 128, 1, 128]
    - [22, 3.00928]
  - - [704, 256, 1, 768]
    - [9, 2719.83]
  - - [704, 1856, 1, 128]
    - [2, 2342.11]
  - - [6784, 6784, 1, 128]
    - [2, 3593.57]
  - - [3584, 5056, 1, 1792]
    - [13, 6347.14]
  - - [6784, 3584, 1, 1792]
    - [13, 6421.74]
  - - [1856, 256, 1, 3328]
    - [12, 4409.49]
  - - [64, 6784, 1, 768]
    - [12, 3349.28]
  - - [2944, 256, 1, 1792]
    - [12, 4794.16]
  - - [4, 4288, 1, 768]
    - [24, 232.457]
  - - [256, 5056, 1, 128]
    - [1, 1916.51]
  - - [128, 256, 1, 1792]
    - [16, 1137.31]
  - - [2944, 448, 1, 128]
    - [2, 2193.49]
  - - [2368, 4, 1, 768]
    - [24, 198.391]
  - - [6784, 256, 1, 128]
    - [2, 2226.23]
  - - [64, 64, 1, 3328]
    - [7, 341.415]
  - - [4, 3584, 1, 768]
    - [24, 234.436]
  - - [1024, 5888, 1, 256]
    - [13, 5617.9]
  - - [2368, 1024, 1, 3328]
    - [11, 5428.55]
  - - [1856, 1856, 1, 3328]
    - [11, 5490.91]
  - - [2368, 128, 1, 1792]
    - [9, 3036.23]
  - - [448, 1408, 1, 3328]
    - [17, 4182.28]
  - - [4, 4, 1, 1792]
    - [25, 1.0996]
  - - [2368, 2368, 1, 256]
    - [15, 5649.79]
  - - [4288, 128, 1, 3328]
    - [17, 3693.64]
  - - [5056, 704, 1, 128]
    - [1, 2791.9]
  - - [1408, 4288, 1, 256]
    - [11, 5596.86]
  - - [448, 4, 1, 256]
    - [25, 19.414]
  - - [5888, 448, 1, 128]
    - [2, 2382.69]
  - - [448, 4, 1, 3328]
    - [25, 140.996]
  - - [704, 6784, 1, 3328]
    - [13, 5864.91]
  - - [1408, 6784, 1, 1792]
    - [13, 5984.95]
  - - [448, 5888, 1, 3328]
    - [13, 5265.2]
  - - [128, 4, 1, 128]
    - [22, 3.26464]
  - - [4288, 5888, 1, 128]
    - [2, 3676.05]
  - - [256, 3584, 1, 256]
    - [15, 4112.6]
  - - [2368, 1024, 1, 1792]
    - [15, 5673.67]
  - - [448, 1024, 1, 1792]
    - [12, 4191.03]
  - - [1408, 3584, 1, 128]
    - [2, 2984.19]
  - - [256, 2944, 1, 3328]
    - [12, 4839.18]
  - - [704, 5888, 1, 128]
    - [2, 3142.92]
  - - [1408, 4, 1, 768]
    - [25, 138.041]
  - - [4, 128, 1, 768]
    - [25, 18.4319]
  - - [2368, 5888, 1, 128]
    - [2, 3546.17]
  - - [64, 2944, 1, 128]
    - [4, 628.528]
  - - [5056, 6784, 1, 3328]
    - [13, 6429.41]
  - - [3584, 5888, 1, 256]
    - [13, 6117.16]
  - - [5888, 64, 1, 768]
    - [21, 3299.74]
  - - [2368, 1024, 1, 128]
    - [2, 2747.56]
  - - [2368, 704, 1, 128]
    - [2, 2342.0]
  - - [704, 2944, 1, 256]
    - [12, 4936.33]
  - - [64, 5056, 1, 768]
    - [12, 2572.75]
  - - [448, 2368, 1, 128]
    - [2, 1933.69]
  - - [5888, 128, 1, 768]
    - [12, 4651.07]
  - - [5056, 1024, 1, 256]
    - [13, 5689.17]
  - - [5056, 1408, 1, 3328]
    - [13, 6334.47]
  - - [1408, 704, 1, 256]
    - [11, 4531.22]
  - - [5888, 2944, 1, 768]
    - [13, 6351.78]
  - - [5056, 5888, 1, 768]
    - [13, 6422.34]
  - - [6784, 2944, 1, 3328]
    - [13, 6343.25]
  - - [2944, 5056, 1, 3328]
    - [13, 6275.5]
  - - [1856, 1856, 1, 256]
    - [11, 5403.87]
  - - [128, 1856, 1, 1792]
    - [21, 3705.41]
  - - [2944, 5888, 1, 768]
    - [13, 6357.17]
  - - [1024, 704, 1, 768]
    - [12, 4388.76]
  - - [128, 4, 1, 768]
    - [25, 18.8241]
  - - [1408, 2944, 1, 768]
    - [13, 6124.53]
  - - [4288, 3584, 1, 256]
    - [15, 6045.66]
  - - [4, 5888, 1, 768]
    - [24, 274.363]
  - - [5888, 1408, 1, 3328]
    - [13, 6470.88]
  - - [4288, 4288, 1, 256]
    - [11, 5948.67]
  - - [64, 1024, 1, 768]
    - [14, 1350.82]
  - - [2944, 4, 1, 768]
    - [24, 222.793]
  - - [1024, 3584, 1, 1792]
    - [13, 5546.84]
  - - [1856, 2944, 1, 3328]
    - [13, 5654.99]
  - - [256, 6784, 1, 3328]
    - [13, 5106.66]
  - - [64, 5888, 1, 256]
    - [12, 2245.34]
  - - [5888, 5888, 1, 256]
    - [13, 6267.93]
  - - [1408, 4288, 1, 1792]
    - [13, 6173.63]
  - - [2368, 4, 1, 1792]
    - [24, 294.907]
  - - [64, 704, 1, 1792]
    - [8, 1244.26]
  - - [5056, 1856, 1, 3328]
    - [13, 5893.82]
  - - [2368, 704, 1, 768]
    - [15, 4715.9]
  - - [4, 448, 1, 768]
    - [25, 49.8102]
  - - [1856, 1408, 1, 256]
    - [12, 5045.34]
  - - [256, 4, 1, 256]
    - [24, 12.9157]
  - - [128, 1024, 1, 1792]
    - [14, 2778.97]
  - - [256, 704, 1, 768]
    - [21, 2639.16]
  - - [6784, 128, 1, 3328]
    - [11, 4704.25]
  - - [4288, 1408, 1, 128]
    - [2, 3242.97]
  - - [1856, 5888, 1, 3328]
    - [13, 6251.25]
  - - [4288, 4, 1, 3328]
    - [25, 160.673]
  - - [448, 1024, 1, 768]
    - [12, 4023.89]
  - - [704, 704, 1, 256]
    - [12, 3831.77]
  - - [256, 3584, 1, 128]
    - [2, 1701.09]
  - - [1408, 256, 1, 1792]
    - [9, 3575.13]
  - - [6784, 1408, 1, 1792]
    - [13, 5983.25]
  - - [1856, 64, 1, 768]
    - [14, 2359.25]
  - - [1024, 64, 1, 1792]
    - [14, 1642.9]
  - - [64, 128, 1, 256]
    - [14, 157.284]
  - - [3584, 64, 1, 128]
    - [4, 789.548]
  - - [4288, 2368, 1, 256]
    - [15, 5563.86]
  - - [4, 3584, 1, 256]
    - [24, 115.489]
  - - [5056, 2368, 1, 1792]
    - [13, 6245.88]
  - - [64, 4, 1, 768]
    - [25, 9.86691]
  - - [256, 4, 1, 768]
    - [25, 33.3856]
  - - [6784, 5888, 1, 768]
    - [13, 6452.85]
  - - [128, 1856, 1, 768]
    - [21, 3351.07]
  - - [704, 128, 1, 768]
    - [14, 1853.67]
  - - [128, 4288, 1, 3328]
    - [21, 3551.09]
  - - [1024, 1408, 1, 768]
    - [15, 4996.04]
  - - [1856, 4, 1, 768]
    - [25, 170.667]
  - - [6784, 448, 1, 128]
    - [1, 2651.04]
  - - [5888, 1024, 1, 768]
    - [13, 6065.43]
  - - [2944, 5056, 1, 768]
    - [13, 6158.85]
  - - [256, 1408, 1, 1792]
    - [21, 3514.6]
  - - [128, 5056, 1, 3328]
    - [12, 4147.09]
  - - [1024, 448, 1, 3328]
    - [12, 4226.88]
  - - [2944, 128, 1, 256]
    - [12, 2966.5]
  - - [3584, 704, 1, 1792]
    - [12, 5109.94]
  - - [5888, 5888, 1, 3328]
    - [13, 6501.44]
  - - [5888, 704, 1, 256]
    - [12, 5087.11]
  - - [6784, 1024, 1, 256]
    - [13, 5672.87]
  - - [2944, 2368, 1, 256]
    - [11, 5656.86]
  - - [256, 448, 1, 256]
    - [14, 1777.41]
  - - [5056, 5888, 1, 3328]
    - [13, 6527.19]
  - - [1856, 1024, 1, 256]
    - [11, 4850.89]
  - - [704, 5888, 1, 1792]
    - [12, 5306.22]
  - - [6784, 5888, 1, 3328]
    - [13, 6534.04]
  - - [2944, 1408, 1, 1792]
    - [13, 6279.87]
  - - [4288, 6784, 1, 768]
    - [13, 6307.42]
  - - [6784, 64, 1, 768]
    - [12, 3776.36]
  - - [448, 5888, 1, 256]
    - [15, 4818.24]
  - - [1408, 6784, 1, 3328]
    - [13, 6012.66]
  - - [448, 1024, 1, 128]
    - [4, 1256.26]
  - - [6784, 4, 1, 1792]
    - [23, 161.094]
  - - [2944, 1408, 1, 3328]
    - [13, 6328.5]
  - - [128, 1856, 1, 128]
    - [4, 795.571]
  - - [448, 2368, 1, 3328]
    - [17, 4263.09]
  - - [5056, 64, 1, 128]
    - [4, 915.119]
  - - [5056, 2944, 1, 256]
    - [15, 5994.04]
  - - [1024, 448, 1, 1792]
    - [12, 4145.62]
  - - [6784, 5888, 1, 128]
    - [2, 3619.8]
  - - [704, 1024, 1, 256]
    - [12, 4031.31]
  - - [1024, 4, 1, 256]
    - [24, 41.0305]
  - - [2368, 1856, 1, 256]
    - [11, 5444.0]
  - - [5888, 256, 1, 256]
    - [12, 4605.85]
  - - [1408, 3584, 1, 3328]
    - [13, 6229.92]
  - - [1856, 6784, 1, 768]
    - [13, 6012.68]
  - - [1408, 64, 1, 768]
    - [14, 1835.48]
  - - [448, 1408, 1, 1792]
    - [12, 4013.56]
  - - [2944, 704, 1, 1792]
    - [12, 5218.95]
  - - [3584, 4, 1, 768]
    - [24, 251.492]
  - - [1408, 5888, 1, 3328]
    - [13, 6481.69]
  - - [1856, 5056, 1, 256]
    - [15, 5738.82]
  - - [64, 256, 1, 128]
    - [4, 60.7536]
  - - [4288, 2368, 1, 128]
    - [2, 3409.59]
  - - [64, 1856, 1, 768]
    - [14, 2123.32]
  - - [704, 6784, 1, 768]
    - [13, 5622.31]
  - - [4288, 128, 1, 768]
    - [12, 3403.4]
  - - [2368, 2944, 1, 256]
    - [15, 5750.0]
  - - [4, 1856, 1, 256]
    - [24, 67.8741]
  - - [6784, 64, 1, 128]
    - [4, 1213.99]
  - - [3584, 1408, 1, 768]
    - [13, 6057.48]
  - - [256, 1856, 1, 128]
    - [4, 1270.93]
  - - [4288, 5056, 1, 1792]
    - [13, 6237.85]
  - - [5888, 64, 1, 3328]
    - [9, 3779.84]
  - - [5056, 1408, 1, 768]
    - [13, 6145.41]
  - - [1408, 3584, 1, 768]
    - [13, 6046.28]
  - - [2944, 1024, 1, 768]
    - [13, 5850.84]
  - - [448, 4288, 1, 128]
    - [2, 2581.24]
  - - [2944, 1856, 1, 1792]
    - [11, 5680.42]
  - - [256, 6784, 1, 256]
    - [12, 4616.83]
  - - [1408, 4288, 1, 128]
    - [2, 3103.1]
  - - [2368, 4288, 1, 1792]
    - [13, 5777.02]
  - - [128, 448, 1, 256]
    - [14, 1100.99]
  - - [3584, 6784, 1, 1792]
    - [13, 6420.47]
  - - [4288, 64, 1, 256]
    - [12, 2195.39]
  - - [256, 256, 1, 768]
    - [14, 1792.79]
  - - [448, 1408, 1, 128]
    - [2, 1451.37]
  - - [3584, 2944, 1, 768]
    - [13, 5943.01]
  - - [128, 5888, 1, 1792]
    - [12, 4723.36]
  - - [3584, 5056, 1, 256]
    - [13, 6061.71]
  - - [5888, 2368, 1, 1792]
    - [13, 6254.78]
  - - [5056, 448, 1, 128]
    - [2, 2633.92]
  - - [704, 4, 1, 768]
    - [25, 77.4421]
  - - [64, 1408, 1, 3328]
    - [16, 2230.56]
  - - [64, 1856, 1, 1792]
    - [14, 2445.6]
  - - [4, 2368, 1, 3328]
    - [24, 329.373]
  - - [448, 64, 1, 3328]
    - [8, 1477.22]
  - - [704, 6784, 1, 128]
    - [1, 2957.94]
  - - [3584, 4, 1, 3328]
    - [24, 394.169]
  - - [4288, 2944, 1, 256]
    - [11, 5890.76]
  - - [4, 3584, 1, 1792]
    - [25, 302.625]
  - - [256, 128, 1, 128]
    - [4, 129.57]
  - - [704, 1408, 1, 128]
    - [2, 2218.68]
  - - [256, 5888, 1, 3328]
    - [15, 5037.53]
  - - [3584, 2368, 1, 128]
    - [2, 3008.23]
  - - [4288, 128, 1, 1792]
    - [9, 3561.64]
  - - [128, 1408, 1, 256]
    - [21, 2140.3]
  - - [4, 1408, 1, 768]
    - [24, 125.036]
  - - [64, 128, 1, 3328]
    - [7, 608.338]
  - - [5056, 2368, 1, 128]
    - [2, 3425.21]
  - - [448, 3584, 1, 128]
    - [1, 2212.51]
  - - [2944, 2944, 1, 3328]
    - [13, 6048.73]
  - - [5056, 6784, 1, 256]
    - [15, 6212.33]
  - - [1856, 3584, 1, 128]
    - [2, 3297.27]
  - - [128, 2944, 1, 128]
    - [4, 1060.51]
  - - [3584, 6784, 1, 128]
    - [2, 3299.84]
  - - [128, 4288, 1, 256]
    - [12, 2843.83]
  - - [704, 448, 1, 3328]
    - [10, 3415.17]
  - - [1024, 1024, 1, 3328]
    - [13, 5481.64]
  - - [1024, 4288, 1, 768]
    - [11, 5418.86]
  - - [4, 704, 1, 3328]
    - [25, 198.923]
  - - [5056, 1856, 1, 256]
    - [11, 5725.65]
  - - [2944, 1856, 1, 768]
    - [15, 5801.92]
  - - [256, 128, 1, 256]
    - [14, 632.649]
  - - [1024, 1856, 1, 256]
    - [13, 4561.18]
  - - [2368, 1408, 1, 768]
    - [15, 5385.19]
  - - [4288, 64, 1, 128]
    - [4, 792.986]
  - - [256, 448, 1, 3328]
    - [19, 2767.22]
  - - [3584, 4, 1, 128]
    - [22, 82.2984]
  - - [5888, 5888, 1, 128]
    - [2, 3327.01]
  - - [256, 5056, 1, 768]
    - [12, 4983.04]
  - - [6784, 3584, 1, 3328]
    - [13, 6442.39]
  - - [64, 6784, 1, 3328]
    - [12, 3900.46]
  - - [3584, 2944, 1, 1792]
    - [13, 6022.05]
  - - [4288, 1024, 1, 3328]
    - [11, 5676.18]
  - - [256, 2368, 1, 128]
    - [1, 1319.28]
  - - [6784, 1856, 1, 768]
    - [13, 5968.42]
  - - [5056, 2368, 1, 3328]
    - [13, 6273.89]
  - - [128, 448, 1, 3328]
    - [20, 1984.81]
  - - [1024, 2944, 1, 768]
    - [13, 5771.96]
  - - [2368, 64, 1, 256]
    - [9, 1824.94]
  - - [64, 448, 1, 3328]
    - [8, 1510.14]
  - - [256, 256, 1, 3328]
    - [16, 2139.77]
  - - [4, 704, 1, 768]
    - [25, 72.6258]
  - - [1408, 448, 1, 3328]
    - [9, 4123.86]
  - - [1024, 4, 1, 3328]
    - [25, 282.24]
  - - [4, 2368, 1, 1792]
    - [24, 267.688]
  - - [4288, 4, 1, 1792]
    - [25, 155.989]
  - - [1856, 256, 1, 768]
    - [12, 4206.73]
  - - [448, 1856, 1, 1792]
    - [15, 4446.25]
  - - [2368, 6784, 1, 3328]
    - [13, 6355.14]
  - - [3584, 128, 1, 768]
    - [12, 3996.82]
  - - [6784, 704, 1, 128]
    - [2, 2895.67]
  - - [704, 6784, 1, 256]
    - [15, 5458.07]
  - - [128, 5888, 1, 128]
    - [1, 1676.07]
  - - [5888, 2368, 1, 768]
    - [13, 6158.62]
  - - [1408, 5888, 1, 256]
    - [13, 6008.93]
  - - [4, 4288, 1, 1792]
    - [25, 308.042]
  - - [64, 256, 1, 1792]
    - [8, 702.757]
  - - [1856, 2368, 1, 128]
    - [2, 3074.68]
  - - [256, 64, 1, 256]
    - [14, 316.324]
  - - [704, 128, 1, 128]
    - [4, 339.98]
  - - [1024, 1024, 1, 256]
    - [11, 4616.3]
  - - [704, 1856, 1, 256]
    - [12, 4689.05]
  - - [4288, 1024, 1, 768]
    - [11, 5694.04]
  - - [1408, 1856, 1, 128]
    - [2, 2552.63]
  - - [1856, 128, 1, 1792]
    - [21, 3712.58]
  - - [448, 6784, 1, 768]
    - [12, 5103.65]
  - - [3584, 6784, 1, 256]
    - [13, 6175.7]
  - - [256, 3584, 1, 768]
    - [15, 4577.69]
  - - [5888, 2368, 1, 256]
    - [13, 5890.59]
  - - [448, 5056, 1, 3328]
    - [12, 5107.57]
  - - [2944, 6784, 1, 128]
    - [2, 3489.5]
  - - [3584, 448, 1, 3328]
    - [13, 4716.31]
  - - [1408, 4, 1, 256]
    - [24, 55.1376]
  - - [704, 2368, 1, 3328]
    - [13, 4895.18]
  - - [2944, 448, 1, 256]
    - [11, 4521.84]
  - - [1856, 448, 1, 128]
    - [2, 1897.99]
  - - [3584, 448, 1, 768]
    - [12, 4534.67]
  - - [3584, 5888, 1, 1792]
    - [13, 6365.59]
  - - [256, 5888, 1, 128]
    - [2, 2175.96]
  - - [64, 128, 1, 1792]
    - [8, 355.157]
  - - [3584, 256, 1, 256]
    - [12, 4044.37]
  - - [5888, 1408, 1, 128]
    - [2, 3036.32]
  - - [4, 6784, 1, 128]
    - [22, 121.475]
  - - [5888, 4288, 1, 768]
    - [13, 6317.26]
  - - [5056, 448, 1, 1792]
    - [11, 5156.75]
  - - [128, 2368, 1, 3328]
    - [17, 3185.38]
  - - [1408, 704, 1, 1792]
    - [11, 5209.49]
  - - [3584, 256, 1, 768]
    - [13, 4430.57]
  - - [1408, 128, 1, 128]
    - [4, 654.245]
  - - [6784, 704, 1, 3328]
    - [13, 5869.73]
  - - [4, 5056, 1, 1792]
    - [25, 332.144]
  - - [5888, 4288, 1, 128]
    - [2, 3292.13]
  - - [5888, 2944, 1, 256]
    - [13, 6165.05]
  - - [704, 1408, 1, 1792]
    - [15, 5173.52]
  - - [1408, 2944, 1, 3328]
    - [13, 6338.4]
  - - [5056, 3584, 1, 768]
    - [13, 6264.24]
  - - [3584, 704, 1, 128]
    - [1, 2351.62]
  - - [5888, 2944, 1, 1792]
    - [13, 6429.92]
  - - [64, 1024, 1, 256]
    - [14, 1179.62]
  - - [5056, 5056, 1, 128]
    - [2, 3650.3]
  - - [128, 3584, 1, 256]
    - [12, 3189.97]
  - - [4, 6784, 1, 1792]
    - [25, 349.739]
  - - [448, 5056, 1, 128]
    - [2, 2558.17]
  - - [256, 4, 1, 3328]
    - [25, 90.2055]
  - - [128, 5056, 1, 256]
    - [12, 3318.31]
  - - [1408, 5056, 1, 128]
    - [2, 3143.66]
  - - [2944, 3584, 1, 128]
    - [2, 3321.0]
  - - [3584, 2368, 1, 256]
    - [11, 5511.09]
  - - [2368, 5056, 1, 128]
    - [2, 3452.66]
  - - [64, 704, 1, 256]
    - [14, 860.29]
  - - [3584, 3584, 1, 3328]
    - [13, 6238.45]
  - - [448, 4288, 1, 1792]
    - [15, 5000.24]
  - - [704, 64, 1, 128]
    - [4, 181.48]
  - - [1408, 128, 1, 768]
    - [9, 2696.28]
  - - [448, 256, 1, 1792]
    - [14, 2545.37]
  - - [5888, 6784, 1, 256]
    - [13, 6312.88]
  - - [4288, 2944, 1, 3328]
    - [13, 6131.69]
  - - [1024, 5888, 1, 1792]
    - [13, 6176.47]
  - - [2944, 64, 1, 128]
    - [4, 661.735]
  - - [1024, 1024, 1, 128]
    - [3, 1969.46]
  - - [5056, 4, 1, 1792]
    - [23, 163.738]
  - - [1408, 2368, 1, 768]
    - [11, 5445.42]
  - - [256, 64, 1, 768]
    - [14, 448.197]
  - - [2944, 704, 1, 3328]
    - [12, 5238.8]
  - - [1856, 256, 1, 1792]
    - [12, 4360.46]
  - - [1408, 256, 1, 128]
    - [4, 1029.5]
  - - [2944, 5888, 1, 3328]
    - [13, 6461.89]
  - - [704, 128, 1, 256]
    - [14, 1402.78]
  - - [3584, 64, 1, 1792]
    - [9, 3655.43]
  - - [4288, 1856, 1, 768]
    - [13, 6001.74]
  - - [1408, 5056, 1, 1792]
    - [13, 6278.8]
  - - [5888, 3584, 1, 128]
    - [2, 3307.15]
  - - [128, 128, 1, 768]
    - [14, 450.572]
  - - [704, 704, 1, 768]
    - [12, 4332.54]
  - - [448, 4, 1, 1792]
    - [25, 98.7489]
  - - [1856, 448, 1, 1792]
    - [11, 4426.68]
  - - [448, 704, 1, 1792]
    - [9, 3130.81]
  - - [3584, 1024, 1, 3328]
    - [13, 5610.15]
  - - [704, 3584, 1, 128]
    - [2, 2868.35]
  - - [1856, 704, 1, 1792]
    - [12, 5151.41]
  - - [6784, 1024, 1, 768]
    - [13, 6042.18]
  - - [6784, 2944, 1, 768]
    - [13, 6261.05]
  - - [256, 448, 1, 1792]
    - [14, 2540.71]
  - - [2944, 4288, 1, 768]
    - [11, 6051.46]
  - - [2368, 4, 1, 256]
    - [24, 88.4717]
  - - [4288, 2944, 1, 128]
    - [2, 3472.96]
  - - [1408, 6784, 1, 128]
    - [2, 3183.29]
  - - [5056, 3584, 1, 128]
    - [2, 3584.66]
  - - [5056, 5888, 1, 128]
    - [2, 3698.14]
  - - [5888, 64, 1, 1792]
    - [9, 3634.8]
  - - [1024, 1024, 1, 768]
    - [11, 5037.7]
  - - [5056, 2944, 1, 3328]
    - [13, 6276.51]
  - - [448, 5888, 1, 768]
    - [13, 4960.68]
  - - [256, 1024, 1, 1792]
    - [9, 4117.94]
  - - [448, 128, 1, 256]
    - [14, 1113.35]
  - - [2944, 3584, 1, 256]
    - [15, 5854.91]
  - - [1408, 1408, 1, 3328]
    - [13, 5849.21]
  - - [448, 704, 1, 3328]
    - [17, 3446.75]
  - - [1024, 64, 1, 256]
    - [14, 1251.33]
  - - [3584, 3584, 1, 128]
    - [2, 3210.28]
  - - [64, 3584, 1, 256]
    - [9, 2053.62]
  - - [128, 2944, 1, 3328]
    - [17, 3627.57]
  - - [3584, 704, 1, 256]
    - [11, 5005.58]
  - - [704, 1024, 1, 1792]
    - [12, 4583.3]
  - - [2368, 1856, 1, 768]
    - [15, 5259.27]
  - - [3584, 1408, 1, 3328]
    - [13, 6218.99]
  - - [3584, 4288, 1, 3328]
    - [13, 6465.99]
  - - [1024, 1408, 1, 128]
    - [1, 1913.49]
  - - [448, 2944, 1, 3328]
    - [15, 4862.91]
  - - [1856, 6784, 1, 256]
    - [15, 5891.38]
  - - [4288, 448, 1, 3328]
    - [12, 4859.82]
  - - [6784, 4288, 1, 128]
    - [2, 3548.62]
  - - [704, 64, 1, 3328]
    - [8, 1815.45]
  - - [1856, 4288, 1, 1792]
    - [13, 6161.88]
  - - [256, 4288, 1, 256]
    - [12, 3875.05]
  - - [2368, 5888, 1, 1792]
    - [13, 6265.0]
  - - [1856, 5056, 1, 768]
    - [13, 5765.69]
  - - [5888, 1024, 1, 3328]
    - [13, 6226.22]
  - - [5888, 1408, 1, 768]
    - [13, 6316.26]
  - - [448, 64, 1, 128]
    - [4, 118.245]
  - - [5888, 128, 1, 256]
    - [12, 4160.7]
  - - [256, 4288, 1, 768]
    - [12, 4233.99]
  - - [1024, 1856, 1, 3328]
    - [13, 5582.21]
  - - [1024, 2368, 1, 1792]
    - [11, 5162.83]
  - - [1856, 448, 1, 768]
    - [11, 4269.76]
  - - [1024, 2944, 1, 3328]
    - [13, 6046.12]
  - - [4288, 448, 1, 1792]
    - [11, 5314.15]
  - - [1856, 5056, 1, 3328]
    - [13, 5898.52]
  - - [704, 64, 1, 768]
    - [14, 1136.57]
  - - [4, 6784, 1, 256]
    - [24, 155.008]
  - - [1024, 3584, 1, 128]
    - [6, 2317.02]
  - - [4288, 704, 1, 128]
    - [1, 2725.34]
  - - [2368, 2944, 1, 128]
    - [2, 3258.42]
  - - [2368, 4288, 1, 256]
    - [11, 5730.13]
  - - [256, 2944, 1, 128]
    - [1, 1517.85]
  - - [4, 448, 1, 3328]
    - [25, 139.288]
  - - [5056, 2944, 1, 128]
    - [2, 3498.92]
  - - [5888, 2944, 1, 3328]
    - [13, 6457.66]
  - - [448, 5056, 1, 1792]
    - [15, 5143.2]
  - - [5888, 5056, 1, 3328]
    - [13, 6527.8]
  - - [1024, 704, 1, 128]
    - [3, 1465.5]
  - - [5888, 2368, 1, 128]
    - [2, 3128.92]
  - - [128, 448, 1, 1792]
    - [16, 1543.09]
  - - [2944, 6784, 1, 3328]
    - [13, 6342.71]
  - - [4288, 1856, 1, 256]
    - [11, 5682.64]
  - - [1856, 5888, 1, 256]
    - [15, 5848.95]
  - - [256, 256, 1, 256]
    - [14, 1251.33]
  - - [64, 4, 1, 1792]
    - [25, 18.1616]
  - - [256, 64, 1, 128]
    - [4, 67.4076]
  - - [4288, 4288, 1, 3328]
    - [13, 6142.36]
  - - [2368, 6784, 1, 256]
    - [15, 6078.12]
  - - [4, 2944, 1, 3328]
    - [23, 283.983]
  - - [5888, 1408, 1, 1792]
    - [13, 6434.61]
  - - [64, 1856, 1, 256]
    - [14, 1808.43]
  - - [2944, 2944, 1, 768]
    - [13, 5932.83]
  - - [2944, 2368, 1, 1792]
    - [13, 6154.35]
  - - [448, 64, 1, 768]
    - [14, 790.597]
  - - [4288, 704, 1, 768]
    - [12, 5077.48]
  - - [1856, 1408, 1, 128]
    - [2, 2963.01]
  - - [6784, 2368, 1, 3328]
    - [13, 6342.24]
  - - [6784, 704, 1, 256]
    - [15, 5157.88]
  - - [704, 4, 1, 128]
    - [22, 16.8955]
  - - [256, 1856, 1, 768]
    - [12, 4122.24]
  - - [1408, 4, 1, 128]
    - [22, 32.7673]
  - - [5888, 5056, 1, 768]
    - [13, 6425.68]
  - - [4288, 128, 1, 256]
    - [12, 3109.54]
  - - [704, 1856, 1, 1792]
    - [12, 5123.85]
  - - [6784, 448, 1, 768]
    - [11, 5405.73]
  - - [3584, 448, 1, 128]
    - [1, 2064.35]
  - - [4288, 1856, 1, 3328]
    - [13, 6204.59]
  - - [5888, 5056, 1, 1792]
    - [13, 6503.03]
  - - [4, 3584, 1, 128]
    - [22, 81.7558]
  - - [6784, 2368, 1, 128]
    - [2, 3413.55]
  - - [4288, 448, 1, 768]
    - [11, 5239.85]
  - - [5056, 4288, 1, 3328]
    - [13, 6257.96]
  - - [4, 1024, 1, 768]
    - [25, 98.7592]
  - - [128, 4288, 1, 768]
    - [12, 3302.67]
  - - [704, 5056, 1, 1792]
    - [13, 5367.96]
  - - [6784, 2368, 1, 256]
    - [13, 5985.72]
  - - [1024, 4288, 1, 256]
    - [12, 5029.7]
  - - [2368, 448, 1, 1792]
    - [12, 4193.43]
  - - [1856, 4, 1, 256]
    - [24, 70.6798]
  - - [4, 256, 1, 256]
    - [24, 12.4608]
  - - [256, 1024, 1, 768]
    - [21, 3790.57]
  - - [704, 448, 1, 128]
    - [4, 917.483]
  - - [704, 4288, 1, 768]
    - [15, 5162.93]
  - - [4, 4, 1, 128]
    - [22, 0.000110849]
  - - [128, 2368, 1, 256]
    - [21, 2364.57]
  - - [5056, 5056, 1, 768]
    - [13, 6365.45]
  - - [1408, 256, 1, 3328]
    - [17, 3673.73]
  - - [1024, 6784, 1, 256]
    - [13, 5644.86]
  - - [4, 128, 1, 256]
    - [25, 7.04972]
  - - [4, 1024, 1, 256]
    - [24, 39.4305]
  - - [2944, 1408, 1, 128]
    - [2, 3015.87]
  - - [448, 128, 1, 3328]
    - [8, 1966.63]
  - - [3584, 4288, 1, 1792]
    - [13, 6437.04]
  - - [64, 4288, 1, 3328]
    - [10, 3242.88]
  - - [1408, 1856, 1, 768]
    - [12, 5243.56]
  - - [448, 3584, 1, 768]
    - [12, 4529.74]
  - - [704, 2368, 1, 128]
    - [2, 2278.99]
  - - [256, 5888, 1, 1792]
    - [12, 4998.54]
  - - [128, 2944, 1, 256]
    - [12, 2874.87]
  - - [4, 5888, 1, 3328]
    - [25, 198.039]
  - - [1408, 448, 1, 768]
    - [12, 3916.04]
  - - [5056, 5056, 1, 1792]
    - [13, 6462.68]
  - - [128, 6784, 1, 128]
    - [3, 1714.84]
  - - [3584, 4288, 1, 256]
    - [13, 6058.08]
  - - [448, 1856, 1, 256]
    - [15, 3785.98]
  - - [1856, 6784, 1, 3328]
    - [13, 6114.65]
  - - [4288, 256, 1, 1792]
    - [12, 4329.24]
  - - [3584, 128, 1, 3328]
    - [12, 4245.16]
  - - [64, 2368, 1, 768]
    - [9, 2158.32]
  - - [1856, 256, 1, 256]
    - [12, 3681.66]
  - - [5888, 4288, 1, 256]
    - [13, 6114.5]
  - - [4, 448, 1, 128]
    - [22, 10.7517]
  - - [704, 2944, 1, 1792]
    - [12, 5216.24]
  - - [4288, 64, 1, 1792]
    - [9, 2647.09]
  - - [4, 6784, 1, 768]
    - [24, 278.004]
  - - [1856, 2944, 1, 1792]
    - [13, 5609.31]
  - - [256, 704, 1, 256]
    - [9, 2155.15]
  - - [704, 1856, 1, 768]
    - [12, 5037.83]
  - - [2944, 128, 1, 768]
    - [9, 3587.61]
  - - [1024, 2944, 1, 256]
    - [13, 5142.34]
  - - [448, 6784, 1, 3328]
    - [15, 5328.1]
  - - [1408, 1408, 1, 1792]
    - [13, 5783.02]
  - - [256, 2368, 1, 1792]
    - [12, 3866.34]
  - - [2368, 3584, 1, 1792]
    - [13, 5887.37]
  - - [2944, 1856, 1, 3328]
    - [13, 5646.54]
  - - [1408, 4, 1, 1792]
    - [25, 245.932]
  - - [2368, 64, 1, 128]
    - [4, 546.718]
  - - [2944, 448, 1, 768]
    - [15, 4777.82]
  - - [64, 6784, 1, 256]
    - [12, 2229.56]
  - - [64, 4288, 1, 128]
    - [4, 782.528]
  - - [64, 4, 1, 128]
    - [22, 1.62033]
  - - [2944, 5056, 1, 256]
    - [11, 5931.83]
  - - [2368, 5056, 1, 1792]
    - [13, 6247.63]
  - - [5888, 256, 1, 3328]
    - [12, 5026.69]
  - - [2944, 4288, 1, 128]
    - [1, 3165.07]
  - - [2944, 448, 1, 1792]
    - [11, 4836.49]
  - - [64, 5056, 1, 1792]
    - [17, 2915.46]
  - - [5888, 1856, 1, 768]
    - [13, 6100.91]
  - - [704, 3584, 1, 3328]
    - [12, 5135.07]
  - - [4, 4, 1, 256]
    - [24, 0.233311]
  - - [3584, 1856, 1, 3328]
    - [13, 5913.94]
  - - [1856, 2944, 1, 768]
    - [13, 5508.56]
  - - [1408, 1024, 1, 768]
    - [11, 5325.29]
  - - [64, 3584, 1, 1792]
    - [21, 3087.9]
  - - [128, 64, 1, 1792]
    - [8, 384.809]
  - - [2368, 4288, 1, 3328]
    - [13, 5814.78]
  - - [4, 1408, 1, 256]
    - [24, 53.1791]
  - - [64, 64, 1, 256]
    - [14, 67.4087]
  - - [5056, 64, 1, 256]
    - [12, 2547.32]
  - - [704, 256, 1, 3328]
    - [10, 3063.52]
  - - [2944, 64, 1, 1792]
    - [9, 2994.78]
  - - [4, 4288, 1, 3328]
    - [25, 225.648]
  - - [3584, 5056, 1, 3328]
    - [13, 6374.9]
  - - [448, 6784, 1, 128]
    - [2, 2909.53]
  - - [6784, 1408, 1, 256]
    - [11, 5807.61]
  - - [448, 2944, 1, 256]
    - [15, 4521.87]
  - - [2944, 4, 1, 1792]
    - [24, 330.871]
  - - [2944, 6784, 1, 256]
    - [13, 6102.72]
  - - [1856, 2368, 1, 1792]
    - [13, 5375.74]
  - - [2944, 2944, 1, 128]
    - [2, 3228.4]
  - - [5888, 128, 1, 3328]
    - [12, 4844.03]
  - - [2368, 3584, 1, 768]
    - [15, 5836.82]
  - - [1024, 256, 1, 1792]
    - [21, 4107.26]
  - - [4288, 4288, 1, 1792]
    - [13, 6123.93]
  - - [128, 5056, 1, 768]
    - [12, 3907.8]
  - - [1856, 4288, 1, 768]
    - [13, 6054.14]
  - - [256, 128, 1, 1792]
    - [16, 1124.4]
  - - [448, 256, 1, 128]
    - [1, 413.733]
  - - [64, 448, 1, 1792]
    - [8, 1035.26]
  - - [1856, 1408, 1, 3328]
    - [12, 5284.47]
  - - [128, 1024, 1, 768]
    - [14, 2659.32]
  - - [6784, 704, 1, 768]
    - [13, 5636.39]
  - - [1024, 4288, 1, 3328]
    - [11, 5470.45]
  - - [1408, 5056, 1, 768]
    - [13, 6136.72]
  - - [64, 704, 1, 768]
    - [14, 1117.54]
  - - [1024, 4, 1, 128]
    - [22, 23.7508]
  - - [6784, 64, 1, 1792]
    - [12, 3959.03]
  - - [5056, 448, 1, 256]
    - [11, 4835.05]
  - - [2944, 2368, 1, 3328]
    - [13, 6195.41]
  - - [704, 128, 1, 3328]
    - [19, 2241.66]
  - - [5888, 2944, 1, 128]
    - [2, 3247.3]
  - - [5056, 256, 1, 256]
    - [12, 4683.89]
  - - [6784, 1856, 1, 256]
    - [11, 5892.98]
  - - [5888, 6784, 1, 768]
    - [13, 6453.75]
  - - [2368, 5056, 1, 768]
    - [13, 6156.27]
  - - [704, 256, 1, 128]
    - [4, 642.107]
  - - [5888, 128, 1, 1792]
    - [12, 4795.41]
  - - [1024, 5056, 1, 1792]
    - [13, 6296.67]
  - - [3584, 2368, 1, 768]
    - [13, 5767.95]
  - - [1024, 128, 1, 768]
    - [14, 2654.13]
  - - [64, 5056, 1, 256]
    - [12, 1979.27]
  - - [128, 704, 1, 128]
    - [4, 334.14]
  - - [1408, 2368, 1, 256]
    - [11, 5263.82]
  - - [1408, 1408, 1, 256]
    - [15, 5182.49]
  - - [4, 64, 1, 128]
    - [22, 1.5149]
  - - [64, 1024, 1, 128]
    - [4, 249.438]
  - - [2944, 256, 1, 768]
    - [12, 4651.07]
  - - [448, 448, 1, 768]
    - [9, 3002.67]
  - - [256, 5056, 1, 1792]
    - [12, 5097.98]
  - - [2368, 2368, 1, 128]
    - [2, 3239.54]
  - - [64, 5888, 1, 128]
    - [4, 1050.24]
  - - [2944, 4288, 1, 3328]
    - [13, 6130.17]
  - - [6784, 1408, 1, 128]
    - [2, 3272.27]
  - - [1856, 1024, 1, 1792]
    - [13, 5515.45]
  - - [4288, 5888, 1, 256]
    - [13, 6108.09]
  - - [448, 128, 1, 768]
    - [14, 1589.64]
  - - [448, 256, 1, 768]
    - [14, 2277.89]
  - - [1024, 1408, 1, 1792]
    - [11, 5074.78]
  - - [6784, 5056, 1, 256]
    - [13, 6187.36]
  - - [5056, 128, 1, 3328]
    - [9, 4255.74]
  - - [2368, 448, 1, 3328]
    - [12, 4214.08]
  - - [256, 1408, 1, 768]
    - [21, 3330.68]
  - - [4288, 3584, 1, 128]
    - [2, 3548.81]
  - - [5888, 4, 1, 3328]
    - [25, 164.152]
  - - [2944, 128, 1, 3328]
    - [17, 3756.35]
  - - [64, 2944, 1, 1792]
    - [21, 2767.5]
  - - [5056, 3584, 1, 256]
    - [13, 6044.17]
  - - [704, 704, 1, 128]
    - [4, 1355.07]
  - - [5056, 4, 1, 128]
    - [22, 102.784]
  - - [6784, 5056, 1, 1792]
    - [13, 6405.9]
  - - [64, 2368, 1, 3328]
    - [10, 2701.91]
  - - [1856, 1024, 1, 128]
    - [2, 2567.69]
  - - [1856, 64, 1, 128]
    - [4, 444.279]
  - - [128, 704, 1, 768]
    - [14, 1803.6]
  - - [448, 128, 1, 1792]
    - [8, 1534.55]
  - - [704, 4288, 1, 256]
    - [15, 5081.61]
  - - [1024, 64, 1, 768]
    - [14, 1551.27]
  - - [128, 256, 1, 256]
    - [14, 639.79]
  - - [1856, 256, 1, 128]
    - [4, 1311.54]
  - - [64, 3584, 1, 768]
    - [9, 2672.06]
  - - [5056, 704, 1, 768]
    - [11, 5609.24]
  - - [6784, 1408, 1, 768]
    - [11, 5956.41]
  - - [4, 256, 1, 768]
    - [25, 32.8687]
  - - [64, 2944, 1, 256]
    - [12, 1920.81]
  - - [2368, 1856, 1, 3328]
    - [11, 5490.63]
  - - [64, 256, 1, 3328]
    - [8, 1063.7]
  - - [2368, 128, 1, 128]
    - [1, 895.299]
  - - [2944, 704, 1, 256]
    - [11, 5357.25]
  - - [5056, 128, 1, 128]
    - [1, 1511.19]
  - - [6784, 448, 1, 1792]
    - [11, 5344.04]
  - - [6784, 128, 1, 1792]
    - [15, 4624.98]
  - - [256, 704, 1, 3328]
    - [9, 2934.72]
  - - [704, 3584, 1, 256]
    - [15, 5174.92]
  - - [1856, 6784, 1, 1792]
    - [13, 6088.03]
  - - [704, 2944, 1, 3328]
    - [15, 5337.6]
  - - [6784, 1024, 1, 128]
    - [2, 3141.56]
  - - [256, 448, 1, 128]
    - [4, 428.028]
  - - [448, 1024, 1, 3328]
    - [12, 4252.18]
  - - [2944, 1024, 1, 3328]
    - [13, 6051.52]
  - - [6784, 2944, 1, 1792]
    - [13, 6326.39]
  - - [2944, 5056, 1, 128]
    - [2, 3388.3]
  - - [2368, 256, 1, 256]
    - [12, 3417.63]
  - - [1408, 6784, 1, 256]
    - [11, 5834.29]
  - - [6784, 1408, 1, 3328]
    - [13, 6006.35]
  - - [4288, 6784, 1, 128]
    - [2, 3673.63]
  - - [3584, 1408, 1, 1792]
    - [13, 6177.01]
  - - [4, 2944, 1, 256]
    - [24, 96.8984]
  - - [704, 64, 1, 256]
    - [14, 860.258]
  - - [256, 4, 1, 1792]
    - [25, 62.0858]
  - - [256, 2368, 1, 3328]
    - [21, 3905.78]
  - - [4288, 1856, 1, 128]
    - [2, 3301.82]
  - - [6784, 3584, 1, 256]
    - [13, 6138.26]
  - - [1856, 2944, 1, 128]
    - [2, 3172.62]
  - - [1024, 5888, 1, 768]
    - [13, 6007.72]
  - - [2368, 3584, 1, 256]
    - [15, 5803.33]
  - - [64, 3584, 1, 128]
    - [4, 797.494]
  - - [5056, 256, 1, 3328]
    - [12, 5131.53]
  - - [4288, 4, 1, 256]
    - [23, 140.133]
  - - [2368, 1856, 1, 128]
    - [2, 3082.15]
  - - [2944, 4288, 1, 1792]
    - [13, 6106.07]
  - - [64, 2944, 1, 3328]
    - [10, 3029.7]
  - - [4288, 704, 1, 256]
    - [11, 5174.88]
  - - [2368, 2368, 1, 1792]
    - [13, 5751.35]
  - - [2368, 448, 1, 128]
    - [2, 1975.37]
  - - [1856, 5888, 1, 768]
    - [13, 6125.31]
  - - [3584, 1024, 1, 128]
    - [2, 2633.59]
  - - [256, 256, 1, 1792]
    - [16, 1679.45]
  - - [1408, 4288, 1, 3328]
    - [13, 6235.4]
  - - [6784, 4288, 1, 256]
    - [13, 6134.48]
  - - [5888, 448, 1, 3328]
    - [13, 5282.34]
  - - [4288, 256, 1, 128]
    - [2, 1865.14]
  - - [704, 1408, 1, 768]
    - [15, 5074.97]
  - - [6784, 128, 1, 256]
    - [15, 4001.3]
  - - [3584, 64, 1, 768]
    - [21, 3284.68]
  - - [5888, 1024, 1, 128]
    - [2, 2870.1]
  - - [128, 64, 1, 3328]
    - [7, 601.374]
  - - [1408, 1408, 1, 768]
    - [13, 5614.22]
  - - [448, 64, 1, 256]
    - [14, 556.675]
  - - [2368, 256, 1, 128]
    - [1, 1415.56]
  - - [4288, 5888, 1, 1792]
    - [13, 6396.59]
  - - [6784, 2368, 1, 768]
    - [13, 6211.64]
  - - [6784, 6784, 1, 256]
    - [13, 6440.59]
  - - [4, 64, 1, 3328]
    - [25, 24.3155]
  - - [256, 1856, 1, 256]
    - [12, 3531.23]
  - - [1408, 2368, 1, 3328]
    - [12, 5244.47]
  - - [2944, 4, 1, 3328]
    - [23, 303.884]
  - - [128, 1408, 1, 3328]
    - [9, 2910.46]
  - - [2944, 1856, 1, 128]
    - [2, 3039.84]
  - - [128, 2944, 1, 1792]
    - [21, 3558.19]
  - - [256, 6784, 1, 128]
    - [1, 2085.46]
  - - [2368, 4, 1, 128]
    - [22, 54.9238]
  - - [704, 2944, 1, 768]
    - [12, 5155.45]
  - - [1856, 4, 1, 128]
    - [22, 43.339]
  - - [5056, 6784, 1, 128]
    - [2, 3723.87]
  - - [2944, 1024, 1, 256]
    - [11, 5386.96]
  - - [4288, 5056, 1, 128]
    - [2, 3627.99]
  - - [4288, 5056, 1, 768]
    - [13, 6162.07]
  - - [1856, 5888, 1, 128]
    - [2, 3470.59]
  - - [2944, 5888, 1, 256]
    - [13, 6158.07]
  - - [1024, 4288, 1, 1792]
    - [11, 5483.85]
  - - [4288, 448, 1, 256]
    - [11, 4906.78]
  - - [2368, 448, 1, 256]
    - [12, 3859.22]
  - - [1856, 4, 1, 1792]
    - [25, 279.313]
  - - [4288, 256, 1, 3328]
    - [12, 4358.59]
  - - [1856, 704, 1, 128]
    - [2, 2285.23]
  - - [64, 5888, 1, 768]
    - [12, 3012.27]
  - - [64, 1856, 1, 128]
    - [4, 439.515]
  - - [4, 256, 1, 128]
    - [22, 6.20856]
  - - [2368, 1408, 1, 1792]
    - [15, 5483.18]
  - - [704, 704, 1, 1792]
    - [12, 4527.81]
  - - [2368, 2368, 1, 768]
    - [13, 5648.14]
  - - [128, 2368, 1, 768]
    - [21, 2716.07]
  - - [6784, 3584, 1, 128]
    - [2, 3545.75]
  - - [448, 2944, 1, 768]
    - [15, 4585.56]
  - - [64, 2368, 1, 256]
    - [14, 1722.87]
  - - [2944, 64, 1, 768]
    - [9, 2802.65]
  - - [4288, 128, 1, 128]
    - [1, 1278.19]
  - - [1408, 1408, 1, 128]
    - [2, 2569.87]
  - - [1024, 128, 1, 3328]
    - [14, 3012.1]
  - - [1856, 128, 1, 128]
    - [4, 827.639]
  - - [64, 4288, 1, 768]
    - [14, 2256.35]
  - - [4288, 704, 1, 3328]
    - [11, 5406.33]
  - - [448, 3584, 1, 256]
    - [12, 4335.11]
  - - [128, 256, 1, 3328]
    - [8, 1630.29]
  - - [2944, 6784, 1, 768]
    - [13, 6263.13]
  - - [1408, 448, 1, 256]
    - [12, 3603.19]
  - - [1024, 1408, 1, 3328]
    - [15, 5211.2]
  - - [3584, 4288, 1, 768]
    - [13, 6333.31]
  - - [448, 1856, 1, 768]
    - [15, 4321.13]
  - - [1408, 4, 1, 3328]
    - [25, 332.06]
  - - [5888, 3584, 1, 256]
    - [13, 6138.27]
  - - [5056, 4288, 1, 1792]
    - [13, 6239.04]
  - - [64, 5056, 1, 3328]
    - [17, 3380.86]
  - - [1024, 448, 1, 768]
    - [12, 3934.03]
  - - [4, 4, 1, 3328]
    - [25, 1.55256]
  - - [5888, 1856, 1, 128]
    - [2, 3086.54]
  - - [2368, 256, 1, 1792]
    - [9, 3937.98]
  - - [64, 256, 1, 768]
    - [14, 448.197]
  - - [704, 4288, 1, 128]
    - [2, 2970.56]
  - - [3584, 1856, 1, 256]
    - [11, 5472.13]
  - - [2368, 4288, 1, 128]
    - [2, 3421.56]
  - - [1408, 5888, 1, 128]
    - [2, 3215.57]
  - - [3584, 1856, 1, 128]
    - [2, 2892.37]
  - - [3584, 128, 1, 128]
    - [4, 1258.27]
  - - [1024, 6784, 1, 128]
    - [2, 2550.22]
  - - [4288, 2368, 1, 768]
    - [11, 5856.36]
  - - [4288, 1024, 1, 1792]
    - [13, 5377.25]
  - - [6784, 4288, 1, 768]
    - [13, 6293.86]
  - - [1408, 64, 1, 3328]
    - [19, 2256.67]
  - - [6784, 4, 1, 256]
    - [24, 177.278]
  - - [1856, 1856, 1, 768]
    - [15, 5459.2]
  - - [256, 2368, 1, 256]
    - [12, 3445.74]
  - - [448, 4288, 1, 3328]
    - [15, 4975.53]
  - - [4288, 3584, 1, 768]
    - [13, 6341.88]
  - - [2368, 1408, 1, 256]
    - [11, 5176.33]
  - - [704, 2368, 1, 256]
    - [12, 4493.95]
  - - [4288, 4288, 1, 768]
    - [13, 6057.74]
  - - [5888, 1856, 1, 1792]
    - [13, 6206.52]
  - - [1024, 256, 1, 128]
    - [4, 893.439]
  - - [128, 6784, 1, 768]
    - [13, 3980.03]
  - - [4288, 5056, 1, 256]
    - [15, 5994.93]
  - - [3584, 4, 1, 256]
    - [24, 124.17]
  - - [6784, 1024, 1, 3328]
    - [13, 6180.66]
  - - [5056, 1024, 1, 768]
    - [13, 6140.17]
  - - [4, 1856, 1, 128]
    - [22, 42.7607]
  - - [5056, 5888, 1, 1792]
    - [13, 6502.67]
  - - [4288, 3584, 1, 3328]
    - [13, 6465.32]
  - - [64, 1408, 1, 128]
    - [4, 336.307]
  - - [4288, 1408, 1, 768]
    - [13, 6028.63]
  - - [1024, 6784, 1, 3328]
    - [13, 6185.32]
  - - [2944, 1408, 1, 256]
    - [13, 5659.94]
  - - [4288, 4, 1, 128]
    - [22, 92.6177]
  - - [1856, 128, 1, 768]
    - [9, 3559.31]
  - - [1408, 1024, 1, 256]
    - [15, 4904.25]
  - - [4, 64, 1, 1792]
    - [25, 17.8475]
  - - [128, 64, 1, 256]
    - [14, 158.162]
  - - [4, 5056, 1, 768]
    - [24, 253.235]
  - - [3584, 1856, 1, 768]
    - [13, 5746.62]
  - - [256, 1024, 1, 128]
    - [4, 806.016]
  - - [448, 1024, 1, 256]
    - [12, 3578.76]
  - - [128, 4, 1, 3328]
    - [25, 48.2237]
  - - [6784, 6784, 1, 3328]
    - [13, 6670.5]
  - - [4288, 1408, 1, 256]
    - [13, 5643.78]
  - - [4288, 5888, 1, 768]
    - [13, 6325.96]
  - - [704, 5056, 1, 3328]
    - [13, 5428.17]
  - - [6784, 1856, 1, 128]
    - [2, 3275.18]
  - - [64, 1024, 1, 3328]
    - [16, 2146.03]
  - - [5888, 3584, 1, 3328]
    - [13, 6386.23]
  - - [2944, 6784, 1, 1792]
    - [13, 6323.41]
  - - [4, 2944, 1, 128]
    - [22, 67.8274]
  - - [2368, 2944, 1, 3328]
    - [13, 6207.2]
  - - [5056, 128, 1, 256]
    - [12, 3630.76]
  - - [128, 3584, 1, 3328]
    - [12, 4254.81]
  - - [4288, 3584, 1, 1792]
    - [13, 6440.84]
  - - [1856, 3584, 1, 1792]
    - [13, 5886.48]
  - - [5056, 1408, 1, 1792]
    - [13, 6282.69]
  - - [1408, 64, 1, 256]
    - [14, 1402.78]
  - - [256, 5888, 1, 768]
    - [12, 4900.47]
  - - [1856, 1856, 1, 1792]
    - [13, 5216.78]
  - - [128, 1024, 1, 256]
    - [14, 2022.2]
  - - [6784, 6784, 1, 768]
    - [13, 6575.23]
  - - [4288, 1408, 1, 3328]
    - [13, 6233.39]
  - - [64, 704, 1, 3328]
    - [8, 1826.92]
  - - [64, 1408, 1, 1792]
    - [14, 1925.76]
  - - [2368, 2944, 1, 1792]
    - [13, 6158.85]
  - - [1408, 128, 1, 256]
    - [21, 2185.36]
  - - [2944, 1024, 1, 128]
    - [2, 2797.65]
  - - [1024, 1856, 1, 1792]
    - [13, 5506.86]
  - - [5888, 704, 1, 3328]
    - [11, 5556.08]
  - - [6784, 5056, 1, 128]
    - [2, 3547.35]
  - - [5888, 704, 1, 768]
    - [15, 5362.6]
  - - [256, 1024, 1, 3328]
    - [9, 4259.42]
  - - [1024, 4, 1, 768]
    - [25, 105.639]
  - - [1024, 128, 1, 256]
    - [14, 1960.93]
  - - [1856, 1024, 1, 768]
    - [13, 5338.48]
  - - [64, 6784, 1, 128]
    - [1, 1156.0]
  - - [5888, 448, 1, 1792]
    - [13, 5218.14]
  - - [448, 2944, 1, 128]
    - [2, 2295.1]
  - - [6784, 1856, 1, 1792]
    - [13, 6066.45]
  - - [256, 5056, 1, 256]
    - [12, 4536.62]
  - - [128, 3584, 1, 128]
    - [4, 1155.55]
  - - [1408, 5888, 1, 768]
    - [13, 6326.96]
  - - [448, 3584, 1, 3328]
    - [13, 4698.5]
  - - [1408, 1856, 1, 1792]
    - [12, 5295.09]
  - - [2368, 64, 1, 768]
    - [9, 2257.54]
  - - [256, 256, 1, 128]
    - [4, 229.702]
  - - [4, 704, 1, 128]
    - [22, 15.954]
  - - [4, 5056, 1, 128]
    - [22, 100.42]
  - - [448, 256, 1, 256]
    - [9, 1801.62]
  - - [704, 4, 1, 3328]
    - [25, 211.564]
  - - [1408, 256, 1, 256]
    - [9, 2857.07]
  - - [4288, 4288, 1, 128]
    - [2, 3568.69]
  - - [4, 5056, 1, 256]
    - [24, 141.483]
  - - [1856, 4288, 1, 128]
    - [2, 3350.08]
  - - [1024, 5056, 1, 256]
    - [13, 5570.5]
  - - [256, 64, 1, 1792]
    - [8, 725.918]
  - - [2368, 1408, 1, 3328]
    - [11, 5588.86]
  - - [6784, 1024, 1, 1792]
    - [13, 6145.21]
  - - [5888, 448, 1, 256]
    - [11, 4854.15]
  - - [5888, 6784, 1, 128]
    - [2, 3385.27]
  - - [2368, 4, 1, 3328]
    - [24, 366.223]
  - - [704, 256, 1, 1792]
    - [9, 2902.71]
  - - [1024, 2368, 1, 128]
    - [0, 2136.69]
  - - [1408, 2368, 1, 128]
    - [2, 2755.29]
  - - [128, 5888, 1, 3328]
    - [12, 4795.32]
  - - [6784, 4, 1, 3328]
    - [24, 164.194]
  - - [704, 4, 1, 1792]
    - [25, 145.252]
  - - [704, 2368, 1, 768]
    - [12, 4709.48]
  - - [128, 256, 1, 768]
    - [14, 898.763]
  - - [2368, 5888, 1, 768]
    - [13, 6184.44]
  - - [256, 4, 1, 128]
    - [22, 6.38784]
  - - [1024, 5888, 1, 128]
    - [5, 2524.47]
  - - [1024, 4, 1, 1792]
    - [25, 195.44]
  - - [3584, 5888, 1, 128]
    - [2, 3296.68]
  - - [5056, 5888, 1, 256]
    - [13, 6217.16]
  - - [2368, 1024, 1, 256]
    - [15, 5150.59]
  - - [1856, 128, 1, 3328]
    - [9, 3832.38]
  - - [256, 128, 1, 768]
    - [14, 901.145]
  - - [2368, 6784, 1, 1792]
    - [13, 6324.32]
  - - [4, 1856, 1, 1792]
    - [24, 257.305]
  - - [5888, 256, 1, 128]
    - [2, 2262.92]
  - - [1024, 1856, 1, 128]
    - [3, 2111.94]
  - - [5056, 3584, 1, 3328]
    - [13, 6381.05]
  - - [448, 704, 1, 128]
    - [4, 902.298]
  - - [4, 1024, 1, 128]
    - [22, 23.6715]
  - - [704, 3584, 1, 768]
    - [12, 5060.79]
  - - [1408, 5888, 1, 1792]
    - [13, 6436.26]
  - - [3584, 3584, 1, 768]
    - [13, 6132.54]
  - - [1408, 704, 1, 128]
    - [6, 1928.85]
  - - [448, 2368, 1, 768]
    - [12, 4119.38]
  - - [5056, 1024, 1, 1792]
    - [13, 6316.05]
  - - [6784, 3584, 1, 768]
    - [13, 6355.7]
  - - [1408, 1024, 1, 3328]
    - [11, 5136.0]
  - - [2368, 256, 1, 3328]
    - [17, 4025.28]
  - - [1408, 6784, 1, 768]
    - [13, 5907.73]
  - - [1024, 2368, 1, 768]
    - [11, 5186.72]
  - - [1856, 3584, 1, 3328]
    - [13, 5925.55]
  - - [4, 4, 1, 768]
    - [25, 0.616682]
  - - [1408, 64, 1, 1792]
    - [14, 2001.77]
  - - [448, 128, 1, 128]
    - [4, 204.307]
  - - [3584, 3584, 1, 256]
    - [13, 5907.04]
  - - [704, 5056, 1, 256]
    - [15, 5452.59]
  - - [3584, 448, 1, 1792]
    - [13, 4650.68]
  - - [5056, 2368, 1, 256]
    - [13, 5824.36]
  - - [128, 256, 1, 128]
    - [4, 127.527]
  - - [1024, 256, 1, 3328]
    - [9, 4250.2]
  - - [2368, 256, 1, 768]
    - [9, 3772.51]
  - - [448, 5056, 1, 768]
    - [12, 5020.06]
  - - [2368, 3584, 1, 3328]
    - [13, 5918.54]
  - - [3584, 5888, 1, 3328]
    - [13, 6382.7]
  - - [128, 4, 1, 256]
    - [25, 7.46594]
  - - [2368, 128, 1, 768]
    - [9, 2869.85]
  - - [4288, 5056, 1, 3328]
    - [13, 6260.09]
  - - [5056, 6784, 1, 768]
    - [13, 6344.22]
  - - [5888, 704, 1, 1792]
    - [11, 5564.45]
  - - [5056, 448, 1, 3328]
    - [12, 5106.04]
  - - [1408, 704, 1, 3328]
    - [12, 4865.93]
  - - [3584, 128, 1, 256]
    - [12, 3461.56]
  - - [2368, 6784, 1, 768]
    - [13, 6237.93]
  - - [6784, 64, 1, 3328]
    - [12, 4026.87]
  - - [64, 1856, 1, 3328]
    - [18, 2645.83]
  - - [128, 1408, 1, 768]
    - [21, 2639.16]
  - - [6784, 256, 1, 1792]
    - [13, 5070.4]
  - - [448, 64, 1, 1792]
    - [8, 1052.53]
  - - [4, 704, 1, 1792]
    - [25, 137.069]
  - - [256, 4288, 1, 128]
    - [1, 1699.67]
  - - [3584, 4, 1, 1792]
    - [24, 341.012]
  - - [256, 128, 1, 3328]
    - [8, 1608.92]
  - - [1024, 704, 1, 1792]
    - [12, 4527.38]
  - - [128, 4, 1, 1792]
    - [25, 34.3101]
  - - [5888, 128, 1, 128]
    - [2, 1561.53]
  - - [4, 5056, 1, 3328]
    - [25, 314.723]
  - - [256, 1856, 1, 1792]
    - [12, 4334.16]
  - - [1856, 64, 1, 3328]
    - [18, 2804.3]
  - - [64, 1024, 1, 1792]
    - [16, 1670.61]
  - - [1024, 3584, 1, 768]
    - [13, 5389.48]
  - - [128, 128, 1, 1792]
    - [8, 724.584]
  - - [1856, 2944, 1, 256]
    - [15, 5696.33]
  - - [5888, 5888, 1, 1792]
    - [13, 6483.91]
  - - [4288, 6784, 1, 1792]
    - [13, 6367.95]
  - - [5056, 1024, 1, 128]
    - [2, 3239.07]
  - - [256, 2944, 1, 768]
    - [12, 4623.54]
  - - [1408, 4288, 1, 768]
    - [13, 6033.28]
  - - [4, 2368, 1, 768]
    - [24, 190.686]
  - - [5056, 704, 1, 1792]
    - [13, 5371.31]
  - - [2368, 704, 1, 1792]
    - [13, 4819.98]
  - - [4288, 2944, 1, 1792]
    - [13, 6104.85]
  - - [5888, 704, 1, 128]
    - [2, 2663.7]
  - - [64, 6784, 1, 1792]
    - [12, 3707.49]
  - - [2368, 448, 1, 768]
    - [12, 4119.38]
  - - [448, 4, 1, 128]
    - [22, 10.9417]
  - - [4288, 256, 1, 768]
    - [12, 4252.97]
  - - [1408, 256, 1, 768]
    - [9, 3425.32]
  - - [5888, 4, 1, 128]
    - [22, 120.051]
  - - [2944, 1408, 1, 768]
    - [13, 6144.68]
  - - [1024, 5056, 1, 3328]
    - [13, 6360.63]
  - - [5056, 5056, 1, 256]
    - [13, 6117.16]
  - - [1856, 1408, 1, 1792]
    - [12, 5300.42]
  - - [704, 4288, 1, 3328]
    - [15, 5350.87]
  - - [3584, 64, 1, 256]
    - [9, 2678.05]
  - - [4, 1408, 1, 3328]
    - [24, 268.609]
  - - [4288, 2944, 1, 768]
    - [13, 6023.33]
  - - [1408, 128, 1, 3328]
    - [9, 2948.62]
  - - [4, 2944, 1, 1792]
    - [24, 306.323]
  - - [1856, 64, 1, 1792]
    - [14, 2668.12]
  - - [256, 704, 1, 128]
    - [4, 639.473]
  - - [5056, 4288, 1, 768]
    - [13, 6160.05]
  - - [4, 256, 1, 3328]
    - [25, 88.3017]
  - - [128, 704, 1, 3328]
    - [19, 2262.97]
  - - [4288, 6784, 1, 256]
    - [13, 6148.36]
  - - [3584, 2944, 1, 3328]
    - [13, 6047.08]
  - - [128, 1856, 1, 256]
    - [9, 2764.36]
  - - [64, 4288, 1, 256]
    - [14, 1947.46]
  - - [4, 3584, 1, 3328]
    - [25, 234.294]
  - - [448, 3584, 1, 1792]
    - [13, 4621.9]
  - - [64, 4, 1, 3328]
    - [25, 24.8946]
  - - [2368, 64, 1, 1792]
    - [9, 2416.78]
  - - [704, 128, 1, 1792]
    - [14, 2046.88]
  - - [1408, 448, 1, 1792]
    - [9, 4081.18]
  - - [4288, 256, 1, 256]
    - [12, 3989.1]
  - - [4, 2368, 1, 256]
    - [24, 81.6318]
  - - [1856, 64, 1, 256]
    - [14, 1857.47]
  - - [2368, 6784, 1, 128]
    - [2, 3570.75]
  - - [5056, 2368, 1, 768]
    - [13, 6141.65]
  - - [448, 1856, 1, 3328]
    - [15, 4483.99]
  - - [5056, 1856, 1, 1792]
    - [13, 5868.48]
  - - [1024, 4288, 1, 128]
    - [0, 2387.47]
  - - [3584, 448, 1, 256]
    - [12, 4288.21]
  - - [5056, 4288, 1, 256]
    - [15, 5998.29]
  - - [1024, 448, 1, 256]
    - [12, 3330.65]
  - - [1856, 704, 1, 256]
    - [12, 4758.25]
  - - [1856, 5056, 1, 128]
    - [2, 3362.74]
  - - [64, 256, 1, 256]
    - [14, 314.569]
  - - [4288, 64, 1, 768]
    - [9, 2457.03]
  - - [2944, 2944, 1, 1792]
    - [13, 6016.01]
  - - [128, 2368, 1, 128]
    - [4, 868.58]
  - - [4288, 448, 1, 128]
    - [1, 2405.41]
  - - [5056, 1408, 1, 256]
    - [15, 5776.5]
  - - [2944, 1856, 1, 256]
    - [11, 5518.21]
  - - [64, 2368, 1, 128]
    - [4, 535.534]
  - - [6784, 4, 1, 768]
    - [23, 305.473]
  - - [3584, 2944, 1, 128]
    - [2, 3111.32]
  - - [256, 2368, 1, 768]
    - [12, 3750.01]
  - - [4288, 1408, 1, 1792]
    - [13, 6182.25]
  - - [448, 4288, 1, 768]
    - [12, 4776.18]
  - - [128, 3584, 1, 1792]
    - [12, 4121.0]
  - - [2368, 5888, 1, 3328]
    - [13, 6295.91]
  - - [704, 2368, 1, 1792]
    - [13, 4818.26]
  - - [4, 64, 1, 256]
    - [25, 3.73297]
  - - [704, 1024, 1, 3328]
    - [12, 4624.16]
  - - [6784, 64, 1, 256]
    - [12, 3276.12]
  - - [128, 448, 1, 128]
    - [4, 210.827]
  - - [128, 6784, 1, 256]
    - [12, 3390.91]
  - - [3584, 4288, 1, 128]
    - [2, 3208.38]
  - - [448, 2368, 1, 256]
    - [12, 3867.36]
  - - [64, 448, 1, 128]
    - [4, 112.346]
  - - [448, 1408, 1, 768]
    - [12, 3906.7]
  - - [5888, 4288, 1, 3328]
    - [13, 6418.82]
  - - [2368, 704, 1, 256]
    - [12, 4490.45]
  - - [256, 1856, 1, 3328]
    - [12, 4395.87]
  - - [1856, 128, 1, 256]
    - [9, 2840.94]
  - - [2944, 4288, 1, 256]
    - [15, 5787.61]
  - - [6784, 128, 1, 128]
    - [2, 1838.83]
  - - [3584, 1408, 1, 128]
    - [2, 2784.1]
  - - [128, 3584, 1, 768]
    - [12, 3817.18]
  - - [6784, 4288, 1, 3328]
    - [13, 6385.15]
  - - [5888, 3584, 1, 1792]
    - [13, 6363.76]
  - - [1408, 1024, 1, 1792]
    - [11, 5295.93]
  - - [5056, 4, 1, 256]
    - [23, 157.416]
  - - [128, 64, 1, 768]
    - [14, 222.919]
  - - [4, 4288, 1, 256]
    - [24, 124.009]
  - - [448, 4288, 1, 256]
    - [12, 4581.71]
  - - [5056, 4, 1, 768]
    - [23, 294.907]
  - - [1024, 2368, 1, 3328]
    - [15, 5389.61]
  - - [128, 128, 1, 3328]
    - [8, 1079.31]
  - - [5888, 4288, 1, 1792]
    - [13, 6397.99]
  - - [704, 1408, 1, 256]
    - [12, 4330.7]
  - - [6784, 1856, 1, 3328]
    - [13, 6107.59]
  - - [1024, 2944, 1, 128]
    - [0, 2366.76]
  - - [704, 448, 1, 1792]
    - [9, 3163.26]
  - - [4288, 5888, 1, 3328]
    - [13, 6418.71]
  - - [1408, 3584, 1, 1792]
    - [13, 6175.14]
  - - [256, 1408, 1, 256]
    - [9, 2944.87]
  - - [5888, 64, 1, 128]
    - [4, 1051.95]
  - - [4, 5888, 1, 128]
    - [22, 111.499]
  - - [704, 3584, 1, 1792]
    - [15, 5212.93]
  - - [448, 448, 1, 1792]
    - [9, 3217.56]
  - - [1856, 3584, 1, 256]
    - [15, 5474.73]
  - - [1024, 256, 1, 768]
    - [9, 3849.64]
  - - [128, 5056, 1, 1792]
    - [12, 4081.31]
  - - [6784, 704, 1, 1792]
    - [13, 5812.57]
  - - [3584, 6784, 1, 768]
    - [13, 6341.15]
  - - [2944, 704, 1, 128]
    - [1, 2342.29]
  - - [64, 5056, 1, 128]
    - [4, 901.849]
  - - [64, 448, 1, 768]
    - [14, 786.418]
  - - [4, 128, 1, 3328]
    - [25, 47.9219]
  - - [3584, 2368, 1, 1792]
    - [13, 5870.7]
  - - [128, 704, 1, 256]
    - [14, 1402.78]
  - - [448, 4, 1, 768]
    - [25, 51.608]
  - - [64, 1408, 1, 256]
    - [14, 1384.09]
  - - [5056, 256, 1, 1792]
    - [12, 5102.13]
  - - [6784, 2368, 1, 1792]
    - [13, 6318.66]
  - - [2368, 1408, 1, 128]
    - [2, 2869.17]
  - - [1856, 448, 1, 256]
    - [11, 3741.59]
  - - [1408, 1024, 1, 128]
    - [2, 2418.81]
  - - [128, 64, 1, 128]
    - [4, 33.3856]
  - - [5888, 6784, 1, 1792]
    - [13, 6514.44]
  - - [1024, 704, 1, 3328]
    - [12, 4612.96]
  - - [64, 64, 1, 128]
    - [4, 15.5899]
  - - [2944, 5056, 1, 1792]
    - [13, 6246.71]
  - - [1024, 128, 1, 1792]
    - [14, 2826.03]
  - - [5888, 2368, 1, 3328]
    - [13, 6284.36]
  - - [256, 64, 1, 3328]
    - [8, 1076.14]
  - - [4, 1408, 1, 128]
    - [22, 32.4392]
  - - [128, 1856, 1, 3328]
    - [21, 3824.14]
  - - [2944, 2944, 1, 256]
    - [11, 5829.68]
  - - [4288, 1856, 1, 1792]
    - [13, 6167.21]
  - - [4, 448, 1, 256]
    - [24, 18.7671]
  - - [5888, 4, 1, 256]
    - [23, 172.079]
  - - [6784, 256, 1, 256]
    - [12, 4609.75]
  - - [256, 5056, 1, 3328]
    - [12, 5135.61]
  - - [4, 128, 1, 1792]
    - [25, 34.1213]
  - - [4, 2944, 1, 768]
    - [24, 212.704]
  - - [1024, 3584, 1, 256]
    - [12, 5021.09]
  - - [5056, 1856, 1, 128]
    - [2, 3358.57]
  - - [3584, 704, 1, 768]
    - [12, 5054.92]
  - - [2368, 5056, 1, 3328]
    - [13, 6285.32]
  - - [128, 128, 1, 256]
    - [14, 306.064]
  - - [5888, 5888, 1, 768]
    - [13, 6419.5]
  - - [128, 5888, 1, 768]
    - [12, 4379.94]
  - - [448, 448, 1, 128]
    - [4, 712.131]
  - - [1024, 5056, 1, 768]
    - [13, 6083.1]
  - - [1856, 704, 1, 3328]
    - [12, 5136.28]
  - - [4, 2368, 1, 128]
    - [22, 54.9238]
  - - [5888, 6784, 1, 3328]
    - [13, 6534.54]
  - - [1856, 2368, 1, 256]
    - [15, 5270.23]
  - - [5888, 3584, 1, 768]
    - [13, 6297.27]
  - - [5888, 448, 1, 768]
    - [11, 5122.36]
  - - [128, 128, 1, 128]
    - [4, 67.7298]
  - - [704, 256, 1, 256]
    - [21, 2118.53]
  - - [6784, 448, 1, 3328]
    - [11, 5310.69]
  - - [4288, 1024, 1, 128]
    - [2, 3037.37]
- null
