lib/configs/lite_configs_mixed/vega10_Cijk_Alik_Bljk_SB.yaml
- {MinimumRequiredVersion: 4.9.4}
- vega10
- gfx900
- [Device 6863, Device 6862, Device 687f, Device 6860, Device 6861, 'Vega 10 XTX [Radeon
    SolutionIndex: 0
    SolutionNameMin: Cijk_Alik_Bljk_SB_MT32x32x8_SE_GSU1
    SolutionIndex: 1
    SolutionNameMin: Cijk_Alik_Bljk_SB_MT64x128x16_SE_GSU1
    SolutionIndex: 2
    SolutionNameMin: Cijk_Alik_Bljk_SB_MT64x64x32_SE_GSU1
    SolutionIndex: 3
    SolutionNameMin: Cijk_Alik_Bljk_SB_MT128x64x16_SE_GSU1
    SolutionIndex: 4
    SolutionNameMin: Cijk_Alik_Bljk_SB_MT64x32x16_SE_GSU1
    SolutionIndex: 5
    SolutionNameMin: Cijk_Alik_Bljk_SB_MT128x128x8_SE_GSU1
    SolutionIndex: 6
    SolutionNameMin: Cijk_Alik_Bljk_SB_MT64x64x8_SE_GSU1
    SolutionIndex: 7
    SolutionNameMin: Cijk_Alik_Bljk_SB_MT64x64x16_SE_GSU2
    SolutionIndex: 8
    SolutionNameMin: Cijk_Alik_Bljk_SB_MT32x32x8_SE_GSU1
    SolutionIndex: 9
    SolutionNameMin: Cijk_Alik_Bljk_SB_MT64x32x16_SE_GSU1
    SolutionIndex: 10
    SolutionNameMin: Cijk_Alik_Bljk_SB_MT64x128x16_SE_GSU1
    SolutionIndex: 11
    SolutionNameMin: Cijk_Alik_Bljk_SB_MT32x64x32_SE_GSU8
    SolutionIndex: 12
    SolutionNameMin: Cijk_Alik_Bljk_SB_MT64x32x16_SE_GSU4
    SolutionIndex: 13
    SolutionNameMin: Cijk_Alik_Bljk_SB_MT32x64x16_SE_GSU1
    SolutionIndex: 14
    SolutionNameMin: Cijk_Alik_Bljk_SB_MT32x64x32_SE_GSU2
    SolutionIndex: 15
    SolutionNameMin: Cijk_Alik_Bljk_SB_MT32x64x32_SE_GSU4
    SolutionIndex: 16
    SolutionNameMin: Cijk_Alik_Bljk_SB_MT128x64x8_SE_GSU1
    SolutionIndex: 17
    SolutionNameMin: Cijk_Alik_Bljk_SB_MT64x64x16_SE_GSU4
    SolutionIndex: 18
    SolutionNameMin: Cijk_Alik_Bljk_SB_MT64x32x16_SE_GSU2
    SolutionIndex: 19
    SolutionNameMin: Cijk_Alik_Bljk_SB_MT32x32x16_SE_GSU8
    SolutionIndex: 20
    SolutionNameMin: Cijk_Alik_Bljk_SB_MT128x64x16_SE_GSU2
    SolutionIndex: 21
    SolutionNameMin: Cijk_Alik_Bljk_SB_MT16x16x4_SE_GSU1
    SolutionIndex: 22
    SolutionNameMin: Cijk_Alik_Bljk_SB_MT8x8x8_SE_GSU2
    SolutionIndex: 23
    SolutionNameMin: Cijk_Alik_Bljk_SB_MT8x8x8_SE_GSU4
    SolutionIndex: 24
    SolutionNameMin: Cijk_Alik_Bljk_SB_MT8x8x8_SE_GSU8
- - - [6784, 448, 1, 256, 6784, 6784, 256, 256]
    - [16, 5310.1]
  - - [704, 5888, 1, 1792, 704, 704, 1792, 1792]
    - [10, 5864.86]
  - - [256, 6784, 1, 256, 256, 256, 256, 256]
    - [5, 4247.64]
  - - [704, 448, 1, 3328, 704, 704, 3328, 3328]
    - [17, 3528.29]
  - - [64, 128, 1, 3328, 64, 64, 3328, 3328]
    - [11, 464.114]
  - - [704, 1856, 1, 768, 704, 704, 768, 768]
    - [16, 4773.35]
  - - [4, 3584, 1, 128, 4, 4, 128, 128]
    - [21, 80.9533]
  - - [5056, 1856, 1, 128, 5056, 5056, 128, 128]
    - [1, 3200.77]
  - - [5056, 6784, 1, 768, 5056, 5056, 768, 768]
    - [5, 6247.27]
  - - [704, 2944, 1, 3328, 704, 704, 3328, 3328]
    - [10, 5760.62]
  - - [256, 1024, 1, 256, 256, 256, 256, 256]
    - [9, 3019.79]
  - - [128, 4, 1, 128, 128, 128, 128, 128]
    - [21, 3.25265]
  - - [2944, 2368, 1, 128, 2944, 2944, 128, 128]
    - [1, 2998.83]
  - - [128, 2944, 1, 128, 128, 128, 128, 128]
    - [0, 1136.39]
  - - [2944, 1408, 1, 768, 2944, 2944, 768, 768]
    - [5, 6041.89]
  - - [64, 3584, 1, 256, 64, 64, 256, 256]
    - [9, 2069.73]
  - - [704, 4, 1, 1792, 704, 704, 1792, 1792]
    - [24, 141.925]
  - - [1408, 128, 1, 3328, 1408, 1408, 3328, 3328]
    - [9, 2958.32]
  - - [2368, 2944, 1, 768, 2368, 2368, 768, 768]
    - [5, 5964.01]
  - - [3584, 1024, 1, 256, 3584, 3584, 256, 256]
    - [16, 5647.04]
  - - [448, 128, 1, 768, 448, 448, 768, 768]
    - [13, 1251.64]
  - - [6784, 4288, 1, 128, 6784, 6784, 128, 128]
    - [1, 3441.7]
  - - [128, 128, 1, 1792, 128, 128, 1792, 1792]
    - [15, 566.218]
  - - [256, 4, 1, 1792, 256, 256, 1792, 1792]
    - [24, 60.2729]
  - - [4288, 5888, 1, 256, 4288, 4288, 256, 256]
    - [16, 6035.43]
  - - [1408, 4, 1, 128, 1408, 1408, 128, 128]
    - [21, 33.1013]
  - - [448, 128, 1, 128, 448, 448, 128, 128]
    - [0, 252.778]
  - - [5888, 5888, 1, 768, 5888, 5888, 768, 768]
    - [5, 6299.48]
  - - [3584, 4, 1, 1792, 3584, 3584, 1792, 1792]
    - [23, 330.296]
  - - [1024, 2368, 1, 1792, 1024, 1024, 1792, 1792]
    - [16, 5618.26]
  - - [448, 2944, 1, 3328, 448, 448, 3328, 3328]
    - [16, 5024.57]
  - - [64, 256, 1, 256, 64, 64, 256, 256]
    - [8, 252.776]
  - - [1856, 128, 1, 768, 1856, 1856, 768, 768]
    - [9, 3513.63]
  - - [4, 6784, 1, 3328, 4, 4, 3328, 3328]
    - [24, 320.405]
  - - [448, 2944, 1, 128, 448, 448, 128, 128]
    - [1, 2122.01]
  - - [6784, 128, 1, 3328, 6784, 6784, 3328, 3328]
    - [10, 4664.89]
  - - [3584, 6784, 1, 1792, 3584, 3584, 1792, 1792]
    - [5, 6326.1]
  - - [704, 128, 1, 256, 704, 704, 256, 256]
    - [13, 1377.97]
  - - [1408, 4, 1, 256, 1408, 1408, 256, 256]
    - [23, 54.982]
  - - [3584, 4288, 1, 128, 3584, 3584, 128, 128]
    - [1, 3067.53]
  - - [448, 448, 1, 768, 448, 448, 768, 768]
    - [9, 3007.04]
  - - [4, 1408, 1, 768, 4, 4, 768, 768]
    - [23, 125.572]
  - - [5056, 256, 1, 128, 5056, 5056, 128, 128]
    - [2, 2094.16]
  - - [1856, 5056, 1, 3328, 1856, 1856, 3328, 3328]
    - [5, 5849.11]
  - - [5056, 704, 1, 3328, 5056, 5056, 3328, 3328]
    - [5, 5373.28]
  - - [4288, 448, 1, 1792, 4288, 4288, 1792, 1792]
    - [16, 5463.48]
  - - [128, 1024, 1, 768, 128, 128, 768, 768]
    - [13, 2315.03]
  - - [256, 2944, 1, 256, 256, 256, 256, 256]
    - [10, 3427.11]
  - - [2368, 64, 1, 3328, 2368, 2368, 3328, 3328]
    - [17, 2782.5]
  - - [1024, 704, 1, 3328, 1024, 1024, 3328, 3328]
    - [9, 4059.12]
  - - [704, 1024, 1, 768, 704, 704, 768, 768]
    - [9, 3892.75]
  - - [2944, 256, 1, 1792, 2944, 2944, 1792, 1792]
    - [9, 4223.36]
  - - [2944, 256, 1, 3328, 2944, 2944, 3328, 3328]
    - [9, 4265.0]
  - - [6784, 64, 1, 1792, 6784, 6784, 1792, 1792]
    - [9, 3508.14]
  - - [64, 64, 1, 768, 64, 64, 768, 768]
    - [13, 88.4713]
  - - [4288, 2944, 1, 768, 4288, 4288, 768, 768]
    - [16, 5989.72]
  - - [64, 2368, 1, 768, 64, 64, 768, 768]
    - [13, 2072.91]
  - - [3584, 704, 1, 1792, 3584, 3584, 1792, 1792]
    - [16, 5292.04]
  - - [1408, 3584, 1, 128, 1408, 1408, 128, 128]
    - [1, 2907.56]
  - - [1408, 5056, 1, 3328, 1408, 1408, 3328, 3328]
    - [5, 6271.27]
  - - [1856, 1856, 1, 256, 1856, 1856, 256, 256]
    - [16, 5379.46]
  - - [1024, 4288, 1, 1792, 1024, 1024, 1792, 1792]
    - [16, 5627.69]
  - - [2944, 1408, 1, 3328, 2944, 2944, 3328, 3328]
    - [5, 6262.96]
  - - [4288, 5888, 1, 3328, 4288, 4288, 3328, 3328]
    - [5, 6363.92]
  - - [448, 704, 1, 256, 448, 448, 256, 256]
    - [9, 2588.99]
  - - [3584, 4288, 1, 1792, 3584, 3584, 1792, 1792]
    - [5, 6349.99]
  - - [3584, 256, 1, 3328, 3584, 3584, 3328, 3328]
    - [10, 4925.4]
  - - [6784, 256, 1, 768, 6784, 6784, 768, 768]
    - [16, 4873.01]
  - - [2368, 1856, 1, 3328, 2368, 2368, 3328, 3328]
    - [10, 5588.39]
  - - [3584, 3584, 1, 256, 3584, 3584, 256, 256]
    - [16, 5794.48]
  - - [4288, 1408, 1, 768, 4288, 4288, 768, 768]
    - [5, 5953.53]
  - - [448, 1856, 1, 1792, 448, 448, 1792, 1792]
    - [16, 4387.11]
  - - [2368, 6784, 1, 256, 2368, 2368, 256, 256]
    - [16, 5909.92]
  - - [448, 704, 1, 1792, 448, 448, 1792, 1792]
    - [13, 3105.33]
  - - [6784, 4, 1, 768, 6784, 6784, 768, 768]
    - [22, 290.043]
  - - [5888, 1408, 1, 128, 5888, 5888, 128, 128]
    - [1, 2876.57]
  - - [5056, 5888, 1, 256, 5056, 5056, 256, 256]
    - [5, 6002.8]
  - - [256, 5888, 1, 768, 256, 256, 768, 768]
    - [10, 5147.44]
  - - [2944, 6784, 1, 3328, 2944, 2944, 3328, 3328]
    - [5, 6288.76]
  - - [64, 64, 1, 128, 64, 64, 128, 128]
    - [2, 14.5333]
  - - [2944, 704, 1, 1792, 2944, 2944, 1792, 1792]
    - [16, 4850.4]
  - - [3584, 5056, 1, 256, 3584, 3584, 256, 256]
    - [16, 5874.65]
  - - [1024, 1856, 1, 3328, 1024, 1024, 3328, 3328]
    - [16, 5506.27]
  - - [2368, 1408, 1, 128, 2368, 2368, 128, 128]
    - [1, 2739.55]
  - - [3584, 128, 1, 768, 3584, 3584, 768, 768]
    - [10, 3730.38]
  - - [128, 1856, 1, 128, 128, 128, 128, 128]
    - [0, 860.607]
  - - [5056, 64, 1, 1792, 5056, 5056, 1792, 1792]
    - [13, 3073.41]
  - - [5888, 6784, 1, 3328, 5888, 5888, 3328, 3328]
    - [5, 6466.53]
  - - [1856, 3584, 1, 3328, 1856, 1856, 3328, 3328]
    - [10, 5899.6]
  - - [2368, 1856, 1, 128, 2368, 2368, 128, 128]
    - [1, 2992.28]
  - - [5888, 5056, 1, 768, 5888, 5888, 768, 768]
    - [5, 6303.78]
  - - [1408, 4288, 1, 256, 1408, 1408, 256, 256]
    - [16, 5713.35]
  - - [4288, 4, 1, 256, 4288, 4288, 256, 256]
    - [22, 133.205]
  - - [2368, 64, 1, 1792, 2368, 2368, 1792, 1792]
    - [9, 2407.27]
  - - [256, 704, 1, 1792, 256, 256, 1792, 1792]
    - [9, 2825.6]
  - - [1856, 448, 1, 256, 1856, 1856, 256, 256]
    - [16, 3781.0]
  - - [1856, 704, 1, 1792, 1856, 1856, 1792, 1792]
    - [16, 4949.76]
  - - [5056, 256, 1, 256, 5056, 5056, 256, 256]
    - [16, 4321.85]
  - - [64, 256, 1, 768, 64, 64, 768, 768]
    - [13, 352.418]
  - - [1408, 2944, 1, 128, 1408, 1408, 128, 128]
    - [1, 2880.05]
  - - [448, 5888, 1, 128, 448, 448, 128, 128]
    - [1, 2604.62]
  - - [1024, 64, 1, 3328, 1024, 1024, 3328, 3328]
    - [14, 2040.43]
  - - [128, 128, 1, 256, 128, 128, 256, 256]
    - [8, 250.541]
  - - [5888, 1408, 1, 256, 5888, 5888, 256, 256]
    - [5, 5734.72]
  - - [2944, 4288, 1, 3328, 2944, 2944, 3328, 3328]
    - [5, 6070.35]
  - - [704, 1024, 1, 1792, 704, 704, 1792, 1792]
    - [9, 4065.16]
  - - [1856, 4, 1, 3328, 1856, 1856, 3328, 3328]
    - [23, 313.772]
  - - [128, 3584, 1, 768, 128, 128, 768, 768]
    - [10, 3639.05]
  - - [4288, 1856, 1, 3328, 4288, 4288, 3328, 3328]
    - [5, 6152.08]
  - - [448, 6784, 1, 256, 448, 448, 256, 256]
    - [10, 5156.29]
  - - [5056, 1024, 1, 768, 5056, 5056, 768, 768]
    - [16, 6160.63]
  - - [6784, 704, 1, 256, 6784, 6784, 256, 256]
    - [16, 5208.35]
  - - [5056, 448, 1, 1792, 5056, 5056, 1792, 1792]
    - [16, 5307.61]
  - - [128, 5056, 1, 128, 128, 128, 128, 128]
    - [0, 1553.17]
  - - [5056, 2944, 1, 768, 5056, 5056, 768, 768]
    - [5, 6068.53]
  - - [704, 3584, 1, 1792, 704, 704, 1792, 1792]
    - [10, 5606.53]
  - - [5888, 1024, 1, 128, 5888, 5888, 128, 128]
    - [1, 2852.02]
  - - [4, 4288, 1, 128, 4, 4, 128, 128]
    - [21, 92.3314]
  - - [5888, 448, 1, 1792, 5888, 5888, 1792, 1792]
    - [5, 5145.37]
  - - [704, 4288, 1, 128, 704, 704, 128, 128]
    - [1, 2858.24]
  - - [1408, 704, 1, 3328, 1408, 1408, 3328, 3328]
    - [16, 5355.11]
  - - [2944, 3584, 1, 3328, 2944, 2944, 3328, 3328]
    - [5, 5987.67]
  - - [64, 4288, 1, 256, 64, 64, 256, 256]
    - [13, 1841.58]
  - - [704, 2368, 1, 3328, 704, 704, 3328, 3328]
    - [5, 4825.5]
  - - [2368, 1024, 1, 1792, 2368, 2368, 1792, 1792]
    - [16, 5577.13]
  - - [4, 704, 1, 128, 4, 4, 128, 128]
    - [21, 17.0735]
  - - [128, 3584, 1, 1792, 128, 128, 1792, 1792]
    - [10, 4013.7]
  - - [4, 1024, 1, 1792, 4, 4, 1792, 1792]
    - [24, 177.261]
  - - [2368, 5056, 1, 1792, 2368, 2368, 1792, 1792]
    - [5, 6185.87]
  - - [2368, 4288, 1, 768, 2368, 2368, 768, 768]
    - [16, 5815.93]
  - - [5056, 3584, 1, 3328, 5056, 5056, 3328, 3328]
    - [5, 6321.06]
  - - [1408, 1024, 1, 256, 1408, 1408, 256, 256]
    - [16, 4875.46]
  - - [448, 704, 1, 768, 448, 448, 768, 768]
    - [9, 3024.89]
  - - [6784, 2944, 1, 3328, 6784, 6784, 3328, 3328]
    - [5, 6276.44]
  - - [704, 6784, 1, 256, 704, 704, 256, 256]
    - [16, 5193.61]
  - - [2944, 2944, 1, 256, 2944, 2944, 256, 256]
    - [16, 5799.22]
  - - [2368, 1856, 1, 1792, 2368, 2368, 1792, 1792]
    - [10, 5541.34]
  - - [448, 6784, 1, 768, 448, 448, 768, 768]
    - [10, 5530.99]
  - - [256, 3584, 1, 3328, 256, 256, 3328, 3328]
    - [10, 4918.94]
  - - [5056, 704, 1, 1792, 5056, 5056, 1792, 1792]
    - [16, 5868.04]
  - - [704, 5888, 1, 768, 704, 704, 768, 768]
    - [10, 5730.13]
  - - [1408, 1856, 1, 768, 1408, 1408, 768, 768]
    - [16, 5826.57]
  - - [128, 256, 1, 128, 128, 128, 128, 128]
    - [0, 137.1]
  - - [1024, 1856, 1, 256, 1024, 1024, 256, 256]
    - [16, 4773.34]
  - - [448, 4288, 1, 1792, 448, 448, 1792, 1792]
    - [10, 5261.22]
  - - [2368, 1024, 1, 256, 2368, 2368, 256, 256]
    - [16, 5195.31]
  - - [4, 2368, 1, 768, 4, 4, 768, 768]
    - [23, 188.852]
  - - [64, 1408, 1, 256, 64, 64, 256, 256]
    - [13, 1221.28]
  - - [6784, 256, 1, 3328, 6784, 6784, 3328, 3328]
    - [5, 5048.52]
  - - [704, 448, 1, 768, 704, 704, 768, 768]
    - [9, 3013.75]
  - - [2944, 4288, 1, 768, 2944, 2944, 768, 768]
    - [16, 6062.97]
  - - [3584, 2368, 1, 3328, 3584, 3584, 3328, 3328]
    - [5, 5840.24]
  - - [1856, 1024, 1, 3328, 1856, 1856, 3328, 3328]
    - [5, 5505.21]
  - - [448, 5888, 1, 3328, 448, 448, 3328, 3328]
    - [5, 5198.93]
  - - [4, 2944, 1, 1792, 4, 4, 1792, 1792]
    - [23, 305.664]
  - - [5888, 256, 1, 768, 5888, 5888, 768, 768]
    - [16, 5454.67]
  - - [128, 128, 1, 768, 128, 128, 768, 768]
    - [13, 353.15]
  - - [4288, 2944, 1, 256, 4288, 4288, 256, 256]
    - [16, 5841.1]
  - - [256, 2368, 1, 1792, 256, 256, 1792, 1792]
    - [13, 3791.38]
  - - [5888, 1856, 1, 3328, 5888, 5888, 3328, 3328]
    - [5, 6181.22]
  - - [704, 5056, 1, 768, 704, 704, 768, 768]
    - [10, 5548.53]
  - - [4, 3584, 1, 768, 4, 4, 768, 768]
    - [23, 235.925]
  - - [1408, 2368, 1, 128, 1408, 1408, 128, 128]
    - [1, 2674.69]
  - - [5888, 704, 1, 1792, 5888, 5888, 1792, 1792]
    - [16, 5568.49]
  - - [448, 64, 1, 1792, 448, 448, 1792, 1792]
    - [15, 865.942]
  - - [4, 1024, 1, 3328, 4, 4, 3328, 3328]
    - [24, 236.53]
  - - [3584, 2368, 1, 256, 3584, 3584, 256, 256]
    - [16, 5595.21]
  - - [4288, 64, 1, 128, 4288, 4288, 128, 128]
    - [0, 975.731]
  - - [128, 4288, 1, 128, 128, 128, 128, 128]
    - [0, 1332.04]
  - - [1856, 6784, 1, 256, 1856, 1856, 256, 256]
    - [16, 5831.4]
  - - [4, 64, 1, 256, 4, 4, 256, 256]
    - [23, 3.48318]
  - - [3584, 5056, 1, 128, 3584, 3584, 128, 128]
    - [1, 3052.74]
  - - [4288, 1856, 1, 128, 4288, 4288, 128, 128]
    - [1, 3250.3]
  - - [5888, 2368, 1, 256, 5888, 5888, 256, 256]
    - [16, 5740.43]
  - - [1856, 5056, 1, 256, 1856, 1856, 256, 256]
    - [16, 5739.85]
  - - [5888, 5888, 1, 3328, 5888, 5888, 3328, 3328]
    - [5, 6433.78]
  - - [6784, 1408, 1, 768, 6784, 6784, 768, 768]
    - [16, 5900.01]
  - - [4, 6784, 1, 768, 4, 4, 768, 768]
    - [23, 303.494]
  - - [2368, 4, 1, 3328, 2368, 2368, 3328, 3328]
    - [23, 347.386]
  - - [128, 3584, 1, 256, 128, 128, 256, 256]
    - [13, 2887.82]
  - - [4, 256, 1, 3328, 4, 4, 3328, 3328]
    - [24, 87.7967]
  - - [2368, 1024, 1, 768, 2368, 2368, 768, 768]
    - [16, 5531.38]
  - - [1024, 256, 1, 3328, 1024, 1024, 3328, 3328]
    - [9, 4257.9]
  - - [2944, 2368, 1, 256, 2944, 2944, 256, 256]
    - [16, 5630.43]
  - - [704, 5056, 1, 1792, 704, 704, 1792, 1792]
    - [10, 5706.65]
  - - [64, 3584, 1, 1792, 64, 64, 1792, 1792]
    - [13, 3241.21]
  - - [6784, 2944, 1, 768, 6784, 6784, 768, 768]
    - [5, 6138.2]
  - - [1408, 128, 1, 768, 1408, 1408, 768, 768]
    - [9, 2696.28]
  - - [6784, 2944, 1, 256, 6784, 6784, 256, 256]
    - [5, 5871.22]
  - - [2944, 64, 1, 128, 2944, 2944, 128, 128]
    - [0, 686.866]
  - - [64, 4, 1, 768, 64, 64, 768, 768]
    - [24, 9.75795]
  - - [2944, 5056, 1, 128, 2944, 2944, 128, 128]
    - [1, 3205.04]
  - - [64, 704, 1, 256, 64, 64, 256, 256]
    - [13, 676.997]
  - - [704, 5888, 1, 3328, 704, 704, 3328, 3328]
    - [10, 5900.99]
  - - [1408, 4288, 1, 3328, 1408, 1408, 3328, 3328]
    - [5, 6175.93]
  - - [2944, 3584, 1, 128, 2944, 2944, 128, 128]
    - [1, 3199.2]
  - - [4, 6784, 1, 256, 4, 4, 256, 256]
    - [23, 168.063]
  - - [5888, 64, 1, 3328, 5888, 5888, 3328, 3328]
    - [13, 3582.29]
  - - [3584, 1408, 1, 768, 3584, 3584, 768, 768]
    - [16, 5960.2]
  - - [4, 2944, 1, 128, 4, 4, 128, 128]
    - [21, 68.2837]
  - - [3584, 1856, 1, 128, 3584, 3584, 128, 128]
    - [1, 2759.06]
  - - [1024, 1856, 1, 768, 1024, 1024, 768, 768]
    - [5, 5188.1]
  - - [5056, 2368, 1, 256, 5056, 5056, 256, 256]
    - [16, 5730.01]
  - - [128, 448, 1, 1792, 128, 128, 1792, 1792]
    - [14, 1464.88]
  - - [128, 256, 1, 768, 128, 128, 768, 768]
    - [13, 712.227]
  - - [2944, 448, 1, 1792, 2944, 2944, 1792, 1792]
    - [16, 4933.73]
  - - [1856, 64, 1, 256, 1856, 1856, 256, 256]
    - [13, 1816.42]
  - - [64, 2368, 1, 128, 64, 64, 128, 128]
    - [0, 648.21]
  - - [1024, 1408, 1, 768, 1024, 1024, 768, 768]
    - [16, 5201.17]
  - - [1856, 1024, 1, 768, 1856, 1856, 768, 768]
    - [16, 5379.31]
  - - [448, 1856, 1, 768, 448, 448, 768, 768]
    - [16, 4205.21]
  - - [704, 448, 1, 1792, 704, 704, 1792, 1792]
    - [13, 3106.59]
  - - [448, 2944, 1, 768, 448, 448, 768, 768]
    - [16, 4756.24]
  - - [64, 4, 1, 1792, 64, 64, 1792, 1792]
    - [24, 17.299]
  - - [128, 704, 1, 3328, 128, 128, 3328, 3328]
    - [18, 2275.7]
  - - [5888, 1408, 1, 1792, 5888, 5888, 1792, 1792]
    - [5, 6353.7]
  - - [6784, 1856, 1, 256, 6784, 6784, 256, 256]
    - [16, 5628.49]
  - - [2368, 2368, 1, 768, 2368, 2368, 768, 768]
    - [16, 5756.09]
  - - [2368, 128, 1, 256, 2368, 2368, 256, 256]
    - [13, 2277.17]
  - - [3584, 6784, 1, 3328, 3584, 3584, 3328, 3328]
    - [5, 6370.01]
  - - [2368, 3584, 1, 256, 2368, 2368, 256, 256]
    - [16, 5774.78]
  - - [2944, 1856, 1, 768, 2944, 2944, 768, 768]
    - [16, 5895.53]
  - - [704, 2368, 1, 256, 704, 704, 256, 256]
    - [16, 4230.01]
  - - [4288, 4288, 1, 3328, 4288, 4288, 3328, 3328]
    - [5, 6086.49]
  - - [3584, 1856, 1, 256, 3584, 3584, 256, 256]
    - [16, 5676.17]
  - - [256, 128, 1, 128, 256, 256, 128, 128]
    - [0, 137.767]
  - - [1856, 128, 1, 256, 1856, 1856, 256, 256]
    - [9, 2783.09]
  - - [3584, 448, 1, 256, 3584, 3584, 256, 256]
    - [16, 4210.14]
  - - [2944, 1856, 1, 3328, 2944, 2944, 3328, 3328]
    - [10, 5700.45]
  - - [1024, 5056, 1, 256, 1024, 1024, 256, 256]
    - [16, 5495.24]
  - - [448, 64, 1, 256, 448, 448, 256, 256]
    - [8, 442.357]
  - - [2368, 5888, 1, 768, 2368, 2368, 768, 768]
    - [5, 6093.48]
  - - [4, 5888, 1, 128, 4, 4, 128, 128]
    - [21, 112.113]
  - - [1856, 5056, 1, 128, 1856, 1856, 128, 128]
    - [1, 3269.83]
  - - [5056, 4288, 1, 1792, 5056, 5056, 1792, 1792]
    - [5, 6167.31]
  - - [5888, 4, 1, 1792, 5888, 5888, 1792, 1792]
    - [23, 159.061]
  - - [6784, 448, 1, 768, 6784, 6784, 768, 768]
    - [16, 5758.41]
  - - [64, 1408, 1, 3328, 64, 64, 3328, 3328]
    - [18, 2185.99]
  - - [448, 256, 1, 256, 448, 448, 256, 256]
    - [9, 1715.81]
  - - [1024, 3584, 1, 128, 1024, 1024, 128, 128]
    - [3, 2330.63]
  - - [1408, 4288, 1, 128, 1408, 1408, 128, 128]
    - [1, 3030.96]
  - - [64, 1024, 1, 3328, 64, 64, 3328, 3328]
    - [14, 2172.94]
  - - [448, 1408, 1, 3328, 448, 448, 3328, 3328]
    - [7, 4162.03]
  - - [704, 128, 1, 3328, 704, 704, 3328, 3328]
    - [18, 2241.67]
  - - [1024, 2944, 1, 3328, 1024, 1024, 3328, 3328]
    - [5, 5964.13]
  - - [128, 2368, 1, 1792, 128, 128, 1792, 1792]
    - [13, 2835.47]
  - - [1408, 256, 1, 128, 1408, 1408, 128, 128]
    - [0, 1200.07]
  - - [3584, 6784, 1, 256, 3584, 3584, 256, 256]
    - [16, 5890.01]
  - - [1408, 6784, 1, 128, 1408, 1408, 128, 128]
    - [1, 3214.9]
  - - [1408, 5888, 1, 128, 1408, 1408, 128, 128]
    - [1, 3153.97]
  - - [4288, 2368, 1, 3328, 4288, 4288, 3328, 3328]
    - [10, 5881.74]
  - - [64, 128, 1, 256, 64, 64, 256, 256]
    - [9, 127.525]
  - - [256, 128, 1, 768, 256, 256, 768, 768]
    - [13, 713.722]
  - - [704, 5056, 1, 256, 704, 704, 256, 256]
    - [10, 5203.51]
  - - [1856, 2944, 1, 128, 1856, 1856, 128, 128]
    - [1, 3095.64]
  - - [128, 64, 1, 768, 128, 128, 768, 768]
    - [9, 176.945]
  - - [64, 704, 1, 768, 64, 64, 768, 768]
    - [9, 903.544]
  - - [4288, 704, 1, 256, 4288, 4288, 256, 256]
    - [16, 5439.31]
  - - [256, 1856, 1, 3328, 256, 256, 3328, 3328]
    - [10, 4312.41]
  - - [128, 6784, 1, 1792, 128, 128, 1792, 1792]
    - [10, 4545.92]
  - - [1856, 4288, 1, 128, 1856, 1856, 128, 128]
    - [1, 3192.95]
  - - [128, 6784, 1, 128, 128, 128, 128, 128]
    - [0, 1670.91]
  - - [2368, 6784, 1, 128, 2368, 2368, 128, 128]
    - [1, 3373.3]
  - - [1856, 1856, 1, 1792, 1856, 1856, 1792, 1792]
    - [10, 5538.93]
  - - [1408, 5888, 1, 768, 1408, 1408, 768, 768]
    - [5, 6221.19]
  - - [2944, 4, 1, 128, 2944, 2944, 128, 128]
    - [21, 66.9358]
  - - [256, 448, 1, 768, 256, 256, 768, 768]
    - [13, 2387.68]
  - - [2368, 5056, 1, 256, 2368, 2368, 256, 256]
    - [16, 5822.74]
  - - [448, 4, 1, 1792, 448, 448, 1792, 1792]
    - [24, 95.9087]
  - - [2368, 4288, 1, 256, 2368, 2368, 256, 256]
    - [16, 5891.77]
  - - [5888, 256, 1, 128, 5888, 5888, 128, 128]
    - [2, 2017.51]
  - - [4288, 1024, 1, 128, 4288, 4288, 128, 128]
    - [1, 2943.1]
  - - [448, 2944, 1, 1792, 448, 448, 1792, 1792]
    - [16, 4952.88]
  - - [4, 6784, 1, 1792, 4, 4, 1792, 1792]
    - [24, 360.693]
  - - [128, 704, 1, 256, 128, 128, 256, 256]
    - [13, 1365.9]
  - - [256, 2944, 1, 1792, 256, 256, 1792, 1792]
    - [9, 4137.11]
  - - [256, 128, 1, 1792, 256, 256, 1792, 1792]
    - [15, 979.855]
  - - [4, 704, 1, 256, 4, 4, 256, 256]
    - [23, 27.491]
  - - [448, 6784, 1, 1792, 448, 448, 1792, 1792]
    - [10, 5675.3]
  - - [1024, 1024, 1, 3328, 1024, 1024, 3328, 3328]
    - [10, 5567.83]
  - - [2368, 5888, 1, 128, 2368, 2368, 128, 128]
    - [1, 3356.92]
  - - [1408, 3584, 1, 256, 1408, 1408, 256, 256]
    - [16, 5691.75]
  - - [1856, 64, 1, 128, 1856, 1856, 128, 128]
    - [0, 488.697]
  - - [5888, 6784, 1, 128, 5888, 5888, 128, 128]
    - [1, 3246.26]
  - - [128, 704, 1, 1792, 128, 128, 1792, 1792]
    - [18, 1794.19]
  - - [128, 4, 1, 3328, 128, 128, 3328, 3328]
    - [24, 46.6582]
  - - [128, 1856, 1, 3328, 128, 128, 3328, 3328]
    - [13, 3776.79]
  - - [1408, 1408, 1, 3328, 1408, 1408, 3328, 3328]
    - [5, 5762.93]
  - - [4288, 2944, 1, 3328, 4288, 4288, 3328, 3328]
    - [5, 6073.6]
  - - [5056, 1408, 1, 128, 5056, 5056, 128, 128]
    - [1, 3187.64]
  - - [6784, 3584, 1, 1792, 6784, 6784, 1792, 1792]
    - [5, 6333.04]
  - - [3584, 448, 1, 3328, 3584, 3584, 3328, 3328]
    - [5, 4648.85]
  - - [128, 2944, 1, 768, 128, 128, 768, 768]
    - [9, 3069.05]
  - - [1408, 448, 1, 1792, 1408, 1408, 1792, 1792]
    - [9, 4085.56]
  - - [448, 5056, 1, 256, 448, 448, 256, 256]
    - [16, 4517.01]
  - - [4, 1024, 1, 256, 4, 4, 256, 256]
    - [23, 39.6512]
  - - [256, 448, 1, 256, 256, 256, 256, 256]
    - [9, 1715.81]
  - - [1024, 1408, 1, 128, 1024, 1024, 128, 128]
    - [3, 1954.01]
  - - [5056, 5056, 1, 3328, 5056, 5056, 3328, 3328]
    - [5, 6435.62]
  - - [256, 2368, 1, 768, 256, 256, 768, 768]
    - [13, 3718.95]
  - - [4288, 128, 1, 1792, 4288, 4288, 1792, 1792]
    - [9, 3528.52]
  - - [5888, 2944, 1, 768, 5888, 5888, 768, 768]
    - [5, 6208.94]
  - - [4288, 4, 1, 768, 4288, 4288, 768, 768]
    - [22, 262.669]
  - - [448, 1024, 1, 128, 448, 448, 128, 128]
    - [0, 1459.87]
  - - [1408, 256, 1, 3328, 1408, 1408, 3328, 3328]
    - [7, 3671.24]
  - - [448, 64, 1, 768, 448, 448, 768, 768]
    - [13, 627.139]
  - - [4, 1408, 1, 256, 4, 4, 256, 256]
    - [23, 53.3247]
  - - [128, 704, 1, 768, 128, 128, 768, 768]
    - [13, 1736.55]
  - - [4288, 256, 1, 256, 4288, 4288, 256, 256]
    - [16, 3708.37]
  - - [2944, 64, 1, 3328, 2944, 2944, 3328, 3328]
    - [9, 3068.13]
  - - [128, 1024, 1, 128, 128, 128, 128, 128]
    - [0, 570.498]
  - - [5056, 704, 1, 256, 5056, 5056, 256, 256]
    - [16, 5538.55]
  - - [256, 4, 1, 3328, 256, 256, 3328, 3328]
    - [24, 88.3017]
  - - [448, 1408, 1, 768, 448, 448, 768, 768]
    - [13, 3918.4]
  - - [3584, 2368, 1, 768, 3584, 3584, 768, 768]
    - [16, 5949.72]
  - - [2368, 1408, 1, 256, 2368, 2368, 256, 256]
    - [16, 5232.77]
  - - [1408, 5056, 1, 128, 1408, 1408, 128, 128]
    - [1, 3043.32]
  - - [4, 1408, 1, 3328, 4, 4, 3328, 3328]
    - [23, 269.467]
  - - [704, 4288, 1, 768, 704, 704, 768, 768]
    - [10, 5449.72]
  - - [6784, 4288, 1, 768, 6784, 6784, 768, 768]
    - [5, 6177.85]
  - - [64, 256, 1, 128, 64, 64, 128, 128]
    - [0, 69.2198]
  - - [3584, 2944, 1, 768, 3584, 3584, 768, 768]
    - [16, 5910.92]
  - - [4, 128, 1, 1792, 4, 4, 1792, 1792]
    - [24, 29.4908]
  - - [256, 4288, 1, 3328, 256, 256, 3328, 3328]
    - [9, 4165.69]
  - - [448, 448, 1, 3328, 448, 448, 3328, 3328]
    - [9, 3281.31]
  - - [3584, 1024, 1, 1792, 3584, 3584, 1792, 1792]
    - [10, 5863.36]
  - - [2944, 1408, 1, 1792, 2944, 2944, 1792, 1792]
    - [5, 6189.96]
  - - [1024, 4, 1, 256, 1024, 1024, 256, 256]
    - [23, 39.9876]
  - - [1024, 64, 1, 1792, 1024, 1024, 1792, 1792]
    - [14, 1501.34]
  - - [1024, 6784, 1, 768, 1024, 1024, 768, 768]
    - [5, 5869.37]
  - - [2944, 1024, 1, 3328, 2944, 2944, 3328, 3328]
    - [5, 5976.24]
  - - [704, 1024, 1, 256, 704, 704, 256, 256]
    - [6, 3426.91]
  - - [1408, 128, 1, 1792, 1408, 1408, 1792, 1792]
    - [9, 2898.85]
  - - [1024, 1408, 1, 3328, 1024, 1024, 3328, 3328]
    - [16, 5438.28]
  - - [256, 1408, 1, 768, 256, 256, 768, 768]
    - [13, 3391.14]
  - - [704, 1408, 1, 768, 704, 704, 768, 768]
    - [10, 5090.09]
  - - [128, 448, 1, 768, 128, 128, 768, 768]
    - [13, 1220.8]
  - - [2944, 6784, 1, 768, 2944, 2944, 768, 768]
    - [5, 6143.3]
  - - [1856, 5888, 1, 3328, 1856, 1856, 3328, 3328]
    - [5, 6196.82]
  - - [64, 1408, 1, 768, 64, 64, 768, 768]
    - [13, 1531.58]
  - - [1856, 5888, 1, 768, 1856, 1856, 768, 768]
    - [5, 6042.68]
  - - [1024, 128, 1, 3328, 1024, 1024, 3328, 3328]
    - [9, 2755.58]
  - - [64, 4, 1, 128, 64, 64, 128, 128]
    - [21, 1.64444]
  - - [6784, 448, 1, 3328, 6784, 6784, 3328, 3328]
    - [16, 5158.23]
  - - [1024, 256, 1, 1792, 1024, 1024, 1792, 1792]
    - [13, 4107.28]
  - - [5888, 1024, 1, 1792, 5888, 5888, 1792, 1792]
    - [5, 6104.12]
  - - [1024, 448, 1, 128, 1024, 1024, 128, 128]
    - [0, 1390.72]
  - - [2368, 128, 1, 1792, 2368, 2368, 1792, 1792]
    - [13, 2902.82]
  - - [128, 5888, 1, 1792, 128, 128, 1792, 1792]
    - [13, 4063.34]
  - - [4288, 704, 1, 768, 4288, 4288, 768, 768]
    - [16, 5687.39]
  - - [128, 256, 1, 1792, 128, 128, 1792, 1792]
    - [15, 972.641]
  - - [256, 448, 1, 3328, 256, 256, 3328, 3328]
    - [18, 2797.28]
  - - [1024, 1024, 1, 1792, 1024, 1024, 1792, 1792]
    - [10, 5476.37]
  - - [2368, 2944, 1, 1792, 2368, 2368, 1792, 1792]
    - [5, 6096.97]
  - - [704, 2368, 1, 128, 704, 704, 128, 128]
    - [1, 2202.32]
  - - [64, 64, 1, 3328, 64, 64, 3328, 3328]
    - [11, 267.862]
  - - [448, 5888, 1, 256, 448, 448, 256, 256]
    - [10, 4533.12]
  - - [4288, 704, 1, 128, 4288, 4288, 128, 128]
    - [3, 2672.28]
  - - [6784, 704, 1, 1792, 6784, 6784, 1792, 1792]
    - [5, 5740.68]
  - - [2944, 1856, 1, 128, 2944, 2944, 128, 128]
    - [1, 2964.42]
  - - [2368, 704, 1, 128, 2368, 2368, 128, 128]
    - [1, 2212.47]
  - - [1856, 4, 1, 256, 1856, 1856, 256, 256]
    - [23, 69.9102]
  - - [1408, 1408, 1, 128, 1408, 1408, 128, 128]
    - [1, 2388.86]
  - - [128, 1408, 1, 768, 128, 128, 768, 768]
    - [13, 2514.82]
  - - [5056, 5888, 1, 1792, 5056, 5056, 1792, 1792]
    - [5, 6435.46]
  - - [6784, 448, 1, 1792, 6784, 6784, 1792, 1792]
    - [16, 5478.65]
  - - [704, 704, 1, 256, 704, 704, 256, 256]
    - [9, 3195.55]
  - - [4288, 2368, 1, 1792, 4288, 4288, 1792, 1792]
    - [10, 5851.07]
  - - [2944, 5888, 1, 128, 2944, 2944, 128, 128]
    - [1, 3328.48]
  - - [128, 448, 1, 256, 128, 128, 256, 256]
    - [13, 857.906]
  - - [2944, 5056, 1, 1792, 2944, 2944, 1792, 1792]
    - [5, 6168.93]
  - - [128, 5888, 1, 768, 128, 128, 768, 768]
    - [13, 3877.83]
  - - [1408, 6784, 1, 1792, 1408, 1408, 1792, 1792]
    - [5, 5910.87]
  - - [64, 6784, 1, 768, 64, 64, 768, 768]
    - [13, 2900.41]
  - - [4, 256, 1, 768, 4, 4, 768, 768]
    - [24, 32.3675]
  - - [2944, 5888, 1, 1792, 2944, 2944, 1792, 1792]
    - [5, 6357.13]
  - - [3584, 4, 1, 3328, 3584, 3584, 3328, 3328]
    - [23, 395.137]
  - - [4288, 2944, 1, 1792, 4288, 4288, 1792, 1792]
    - [5, 6035.25]
  - - [4, 6784, 1, 128, 4, 4, 128, 128]
    - [21, 120.231]
  - - [4, 256, 1, 256, 4, 4, 256, 256]
    - [23, 12.3735]
  - - [1408, 2944, 1, 256, 1408, 1408, 256, 256]
    - [16, 5725.56]
  - - [704, 448, 1, 256, 704, 704, 256, 256]
    - [9, 2558.6]
  - - [5888, 5888, 1, 1792, 5888, 5888, 1792, 1792]
    - [5, 6406.07]
  - - [1024, 448, 1, 3328, 1024, 1024, 3328, 3328]
    - [10, 4173.83]
  - - [2944, 6784, 1, 256, 2944, 2944, 256, 256]
    - [16, 5955.82]
  - - [256, 64, 1, 256, 256, 256, 256, 256]
    - [8, 255.05]
  - - [4288, 256, 1, 768, 4288, 4288, 768, 768]
    - [16, 4038.68]
  - - [2944, 2944, 1, 3328, 2944, 2944, 3328, 3328]
    - [5, 5984.06]
  - - [1856, 5056, 1, 768, 1856, 1856, 768, 768]
    - [16, 5992.27]
  - - [704, 704, 1, 1792, 704, 704, 1792, 1792]
    - [9, 4068.44]
  - - [1856, 5056, 1, 1792, 1856, 1856, 1792, 1792]
    - [5, 5805.17]
  - - [5888, 3584, 1, 256, 5888, 5888, 256, 256]
    - [5, 5839.92]
  - - [1024, 4, 1, 128, 1024, 1024, 128, 128]
    - [21, 23.9921]
  - - [1408, 3584, 1, 768, 1408, 1408, 768, 768]
    - [16, 5954.09]
  - - [448, 704, 1, 3328, 448, 448, 3328, 3328]
    - [17, 3420.14]
  - - [1024, 128, 1, 1792, 1024, 1024, 1792, 1792]
    - [9, 2584.22]
  - - [64, 5056, 1, 256, 64, 64, 256, 256]
    - [13, 1885.8]
  - - [1856, 2944, 1, 256, 1856, 1856, 256, 256]
    - [16, 5633.46]
  - - [2944, 256, 1, 256, 2944, 2944, 256, 256]
    - [10, 3500.8]
  - - [128, 5056, 1, 3328, 128, 128, 3328, 3328]
    - [13, 4119.48]
  - - [1024, 2944, 1, 1792, 1024, 1024, 1792, 1792]
    - [5, 5891.82]
  - - [3584, 2368, 1, 128, 3584, 3584, 128, 128]
    - [1, 2954.88]
  - - [2944, 448, 1, 768, 2944, 2944, 768, 768]
    - [16, 4814.85]
  - - [64, 6784, 1, 256, 64, 64, 256, 256]
    - [13, 2122.3]
  - - [5888, 448, 1, 3328, 5888, 5888, 3328, 3328]
    - [5, 5214.02]
  - - [5056, 1856, 1, 3328, 5056, 5056, 3328, 3328]
    - [5, 5832.44]
  - - [5888, 2368, 1, 768, 5888, 5888, 768, 768]
    - [5, 6013.13]
  - - [128, 256, 1, 256, 128, 128, 256, 256]
    - [8, 505.551]
  - - [1856, 6784, 1, 3328, 1856, 1856, 3328, 3328]
    - [5, 6062.44]
  - - [2944, 1856, 1, 256, 2944, 2944, 256, 256]
    - [16, 5600.05]
  - - [4288, 6784, 1, 256, 4288, 4288, 256, 256]
    - [16, 5993.69]
  - - [2368, 704, 1, 256, 2368, 2368, 256, 256]
    - [16, 4309.09]
  - - [128, 2368, 1, 128, 128, 128, 128, 128]
    - [2, 931.944]
  - - [4, 2368, 1, 256, 4, 4, 256, 256]
    - [23, 82.2479]
  - - [3584, 5888, 1, 128, 3584, 3584, 128, 128]
    - [1, 3172.2]
  - - [1856, 448, 1, 768, 1856, 1856, 768, 768]
    - [16, 4284.64]
  - - [4288, 3584, 1, 128, 4288, 4288, 128, 128]
    - [1, 3295.56]
  - - [2944, 2944, 1, 1792, 2944, 2944, 1792, 1792]
    - [5, 5935.64]
  - - [5056, 1024, 1, 256, 5056, 5056, 256, 256]
    - [16, 5738.45]
  - - [1024, 128, 1, 256, 1024, 1024, 256, 256]
    - [9, 1879.59]
  - - [64, 5056, 1, 128, 64, 64, 128, 128]
    - [0, 1000.26]
  - - [4288, 448, 1, 128, 4288, 4288, 128, 128]
    - [3, 2305.18]
  - - [256, 4288, 1, 768, 256, 256, 768, 768]
    - [9, 3931.26]
  - - [1408, 704, 1, 768, 1408, 1408, 768, 768]
    - [16, 5110.34]
  - - [1856, 1856, 1, 768, 1856, 1856, 768, 768]
    - [16, 5759.43]
  - - [6784, 64, 1, 3328, 6784, 6784, 3328, 3328]
    - [20, 3611.59]
  - - [2368, 4, 1, 768, 2368, 2368, 768, 768]
    - [23, 180.191]
  - - [1856, 2368, 1, 3328, 1856, 1856, 3328, 3328]
    - [10, 5584.28]
  - - [3584, 4, 1, 128, 3584, 3584, 128, 128]
    - [21, 82.028]
  - - [6784, 2368, 1, 3328, 6784, 6784, 3328, 3328]
    - [5, 6281.76]
  - - [6784, 5056, 1, 1792, 6784, 6784, 1792, 1792]
    - [5, 6318.7]
  - - [704, 128, 1, 128, 704, 704, 128, 128]
    - [0, 404.444]
  - - [64, 3584, 1, 768, 64, 64, 768, 768]
    - [13, 2752.45]
  - - [5056, 64, 1, 128, 5056, 5056, 128, 128]
    - [0, 1109.41]
  - - [704, 256, 1, 1792, 704, 704, 1792, 1792]
    - [9, 2868.35]
  - - [3584, 5056, 1, 3328, 3584, 3584, 3328, 3328]
    - [5, 6309.26]
  - - [704, 448, 1, 128, 704, 704, 128, 128]
    - [0, 1107.69]
  - - [3584, 1024, 1, 3328, 3584, 3584, 3328, 3328]
    - [10, 5939.8]
  - - [448, 256, 1, 768, 448, 448, 768, 768]
    - [13, 2407.03]
  - - [1024, 2944, 1, 768, 1024, 1024, 768, 768]
    - [5, 5685.88]
  - - [4, 448, 1, 128, 4, 4, 128, 128]
    - [21, 10.7893]
  - - [1024, 2368, 1, 128, 1024, 1024, 128, 128]
    - [3, 2144.33]
  - - [64, 704, 1, 1792, 64, 64, 1792, 1792]
    - [14, 1168.25]
  - - [1856, 64, 1, 1792, 1856, 1856, 1792, 1792]
    - [13, 2323.01]
  - - [6784, 1408, 1, 1792, 6784, 6784, 1792, 1792]
    - [5, 5896.69]
  - - [64, 704, 1, 3328, 64, 64, 3328, 3328]
    - [15, 1596.4]
  - - [448, 256, 1, 128, 448, 448, 128, 128]
    - [0, 512.08]
  - - [6784, 1408, 1, 3328, 6784, 6784, 3328, 3328]
    - [5, 5945.62]
  - - [6784, 2368, 1, 128, 6784, 6784, 128, 128]
    - [1, 3256.93]
  - - [3584, 1408, 1, 256, 3584, 3584, 256, 256]
    - [16, 5573.51]
  - - [6784, 2368, 1, 768, 6784, 6784, 768, 768]
    - [5, 6095.94]
  - - [1024, 1024, 1, 256, 1024, 1024, 256, 256]
    - [16, 4592.92]
  - - [6784, 5888, 1, 256, 6784, 6784, 256, 256]
    - [5, 6106.79]
  - - [5056, 5056, 1, 128, 5056, 5056, 128, 128]
    - [1, 3400.73]
  - - [1856, 3584, 1, 768, 1856, 1856, 768, 768]
    - [10, 5777.93]
  - - [64, 4, 1, 256, 64, 64, 256, 256]
    - [24, 3.76471]
  - - [2944, 3584, 1, 256, 2944, 2944, 256, 256]
    - [16, 5776.09]
  - - [1856, 256, 1, 3328, 1856, 1856, 3328, 3328]
    - [10, 4351.09]
  - - [5888, 4288, 1, 3328, 5888, 5888, 3328, 3328]
    - [5, 6348.82]
  - - [4288, 1408, 1, 128, 4288, 4288, 128, 128]
    - [1, 3148.04]
  - - [4288, 6784, 1, 1792, 4288, 4288, 1792, 1792]
    - [5, 6297.71]
  - - [5888, 3584, 1, 1792, 5888, 5888, 1792, 1792]
    - [5, 6270.76]
  - - [256, 4288, 1, 128, 256, 256, 128, 128]
    - [2, 1705.79]
  - - [704, 6784, 1, 3328, 704, 704, 3328, 3328]
    - [5, 5821.65]
  - - [5056, 1408, 1, 256, 5056, 5056, 256, 256]
    - [16, 5662.18]
  - - [64, 1856, 1, 128, 64, 64, 128, 128]
    - [0, 530.378]
  - - [5056, 5888, 1, 3328, 5056, 5056, 3328, 3328]
    - [5, 6468.68]
  - - [704, 704, 1, 3328, 704, 704, 3328, 3328]
    - [9, 4180.73]
  - - [1408, 64, 1, 1792, 1408, 1408, 1792, 1792]
    - [9, 1816.61]
  - - [704, 5888, 1, 128, 704, 704, 128, 128]
    - [1, 2956.12]
  - - [1024, 2944, 1, 128, 1024, 1024, 128, 128]
    - [3, 2295.82]
  - - [64, 1408, 1, 1792, 64, 64, 1792, 1792]
    - [14, 1723.27]
  - - [1024, 1408, 1, 1792, 1024, 1024, 1792, 1792]
    - [16, 5398.4]
  - - [4288, 5056, 1, 1792, 4288, 4288, 1792, 1792]
    - [5, 6165.13]
  - - [4288, 1856, 1, 1792, 4288, 4288, 1792, 1792]
    - [5, 6100.97]
  - - [2368, 3584, 1, 128, 2368, 2368, 128, 128]
    - [1, 3164.67]
  - - [2368, 4, 1, 256, 2368, 2368, 256, 256]
    - [23, 86.8291]
  - - [128, 3584, 1, 3328, 128, 128, 3328, 3328]
    - [10, 4160.35]
  - - [6784, 1856, 1, 3328, 6784, 6784, 3328, 3328]
    - [5, 6041.72]
  - - [5056, 448, 1, 128, 5056, 5056, 128, 128]
    - [1, 2460.08]
  - - [704, 2944, 1, 1792, 704, 704, 1792, 1792]
    - [10, 5702.75]
  - - [2944, 1024, 1, 256, 2944, 2944, 256, 256]
    - [16, 5395.34]
  - - [5888, 3584, 1, 768, 5888, 5888, 768, 768]
    - [5, 6172.05]
  - - [64, 1024, 1, 128, 64, 64, 128, 128]
    - [0, 294.141]
  - - [6784, 64, 1, 256, 6784, 6784, 256, 256]
    - [16, 2768.38]
  - - [2368, 704, 1, 768, 2368, 2368, 768, 768]
    - [16, 4703.08]
  - - [256, 5056, 1, 128, 256, 256, 128, 128]
    - [2, 1871.6]
  - - [1856, 704, 1, 256, 1856, 1856, 256, 256]
    - [16, 4396.89]
  - - [3584, 704, 1, 256, 3584, 3584, 256, 256]
    - [16, 5271.94]
  - - [6784, 1856, 1, 768, 6784, 6784, 768, 768]
    - [16, 5918.11]
  - - [3584, 448, 1, 1792, 3584, 3584, 1792, 1792]
    - [5, 4585.9]
  - - [5888, 3584, 1, 3328, 5888, 5888, 3328, 3328]
    - [5, 6314.95]
  - - [2944, 5056, 1, 3328, 2944, 2944, 3328, 3328]
    - [5, 6214.18]
  - - [64, 1856, 1, 256, 64, 64, 256, 256]
    - [13, 1481.98]
  - - [2368, 128, 1, 128, 2368, 2368, 128, 128]
    - [0, 1062.39]
  - - [1856, 4288, 1, 3328, 1856, 1856, 3328, 3328]
    - [5, 6160.35]
  - - [5056, 4, 1, 1792, 5056, 5056, 1792, 1792]
    - [22, 161.308]
  - - [1024, 6784, 1, 256, 1024, 1024, 256, 256]
    - [16, 5455.04]
  - - [5056, 5888, 1, 768, 5056, 5056, 768, 768]
    - [5, 6337.82]
  - - [1408, 256, 1, 1792, 1408, 1408, 1792, 1792]
    - [9, 3573.68]
  - - [448, 1024, 1, 1792, 448, 448, 1792, 1792]
    - [10, 4092.14]
  - - [2944, 1024, 1, 1792, 2944, 2944, 1792, 1792]
    - [5, 5912.84]
  - - [2368, 6784, 1, 768, 2368, 2368, 768, 768]
    - [5, 6154.5]
  - - [5056, 3584, 1, 768, 5056, 5056, 768, 768]
    - [5, 6167.4]
  - - [1856, 1408, 1, 1792, 1856, 1856, 1792, 1792]
    - [10, 5820.67]
  - - [448, 64, 1, 128, 448, 448, 128, 128]
    - [0, 120.544]
  - - [704, 1024, 1, 128, 704, 704, 128, 128]
    - [0, 1725.32]
  - - [4288, 4, 1, 1792, 4288, 4288, 1792, 1792]
    - [22, 153.112]
  - - [4, 4, 1, 1792, 4, 4, 1792, 1792]
    - [24, 0.984903]
  - - [2944, 2368, 1, 3328, 2944, 2944, 3328, 3328]
    - [5, 6136.92]
  - - [2368, 64, 1, 768, 2368, 2368, 768, 768]
    - [9, 2241.45]
  - - [1856, 4, 1, 768, 1856, 1856, 768, 768]
    - [23, 161.364]
  - - [128, 1856, 1, 256, 128, 128, 256, 256]
    - [13, 2639.93]
  - - [2944, 1856, 1, 1792, 2944, 2944, 1792, 1792]
    - [10, 5653.95]
  - - [704, 64, 1, 1792, 704, 704, 1792, 1792]
    - [15, 1170.75]
  - - [704, 4, 1, 128, 704, 704, 128, 128]
    - [21, 16.8955]
  - - [5888, 2944, 1, 3328, 5888, 5888, 3328, 3328]
    - [5, 6390.38]
  - - [4, 4, 1, 256, 4, 4, 256, 256]
    - [24, 0.226618]
  - - [2944, 64, 1, 1792, 2944, 2944, 1792, 1792]
    - [9, 2955.95]
  - - [4288, 448, 1, 768, 4288, 4288, 768, 768]
    - [16, 5409.21]
  - - [5888, 5888, 1, 256, 5888, 5888, 256, 256]
    - [5, 5981.62]
  - - [64, 6784, 1, 1792, 64, 64, 1792, 1792]
    - [13, 3335.46]
  - - [5888, 704, 1, 768, 5888, 5888, 768, 768]
    - [16, 5763.17]
  - - [2368, 448, 1, 3328, 2368, 2368, 3328, 3328]
    - [7, 4167.67]
  - - [704, 1408, 1, 1792, 704, 704, 1792, 1792]
    - [10, 5251.72]
  - - [1024, 256, 1, 256, 1024, 1024, 256, 256]
    - [9, 2857.89]
  - - [5888, 3584, 1, 128, 5888, 5888, 128, 128]
    - [1, 3166.97]
  - - [2368, 6784, 1, 1792, 2368, 2368, 1792, 1792]
    - [5, 6261.77]
  - - [1856, 256, 1, 768, 1856, 1856, 768, 768]
    - [10, 3922.06]
  - - [1408, 1024, 1, 1792, 1408, 1408, 1792, 1792]
    - [16, 5283.1]
  - - [1024, 3584, 1, 1792, 1024, 1024, 1792, 1792]
    - [10, 5784.29]
  - - [1024, 1024, 1, 128, 1024, 1024, 128, 128]
    - [4, 1907.26]
  - - [448, 448, 1, 256, 448, 448, 256, 256]
    - [9, 2351.23]
  - - [4, 448, 1, 3328, 4, 4, 3328, 3328]
    - [24, 137.387]
  - - [256, 1024, 1, 768, 256, 256, 768, 768]
    - [13, 3855.1]
  - - [4, 5056, 1, 1792, 4, 4, 1792, 1792]
    - [24, 331.02]
  - - [256, 256, 1, 768, 256, 256, 768, 768]
    - [13, 1430.45]
  - - [1856, 448, 1, 3328, 1856, 1856, 3328, 3328]
    - [16, 4487.78]
  - - [5056, 448, 1, 256, 5056, 5056, 256, 256]
    - [16, 4761.54]
  - - [3584, 3584, 1, 128, 3584, 3584, 128, 128]
    - [1, 3080.61]
  - - [2368, 128, 1, 3328, 2368, 2368, 3328, 3328]
    - [17, 3442.25]
  - - [4, 1024, 1, 128, 4, 4, 128, 128]
    - [21, 23.9921]
  - - [4, 2368, 1, 3328, 4, 4, 3328, 3328]
    - [23, 363.407]
  - - [6784, 1856, 1, 128, 6784, 6784, 128, 128]
    - [1, 3211.83]
  - - [704, 64, 1, 128, 704, 704, 128, 128]
    - [0, 189.426]
  - - [2944, 448, 1, 128, 2944, 2944, 128, 128]
    - [2, 1971.48]
  - - [4288, 64, 1, 768, 4288, 4288, 768, 768]
    - [13, 2454.91]
  - - [3584, 5056, 1, 768, 3584, 3584, 768, 768]
    - [16, 6304.41]
  - - [448, 1408, 1, 128, 448, 448, 128, 128]
    - [0, 1631.7]
  - - [2944, 2944, 1, 768, 2944, 2944, 768, 768]
    - [16, 5905.16]
  - - [5888, 4288, 1, 1792, 5888, 5888, 1792, 1792]
    - [5, 6299.43]
  - - [4, 64, 1, 768, 4, 4, 768, 768]
    - [24, 9.05861]
  - - [128, 1408, 1, 1792, 128, 128, 1792, 1792]
    - [9, 2805.59]
  - - [256, 1856, 1, 256, 256, 256, 256, 256]
    - [13, 3098.15]
  - - [2368, 704, 1, 1792, 2368, 2368, 1792, 1792]
    - [16, 4785.68]
  - - [5056, 4, 1, 128, 5056, 5056, 128, 128]
    - [21, 103.087]
  - - [5888, 448, 1, 256, 5888, 5888, 256, 256]
    - [16, 4720.92]
  - - [2368, 2368, 1, 256, 2368, 2368, 256, 256]
    - [16, 5745.28]
  - - [3584, 256, 1, 1792, 3584, 3584, 1792, 1792]
    - [16, 4827.26]
  - - [1856, 6784, 1, 128, 1856, 1856, 128, 128]
    - [1, 3337.98]
  - - [448, 128, 1, 256, 448, 448, 256, 256]
    - [8, 896.739]
  - - [2944, 128, 1, 768, 2944, 2944, 768, 768]
    - [9, 3373.85]
  - - [4, 5056, 1, 256, 4, 4, 256, 256]
    - [23, 134.929]
  - - [5056, 256, 1, 768, 5056, 5056, 768, 768]
    - [16, 4748.54]
  - - [1856, 1024, 1, 256, 1856, 1856, 256, 256]
    - [16, 4876.12]
  - - [256, 3584, 1, 256, 256, 256, 256, 256]
    - [10, 3929.12]
  - - [1408, 1856, 1, 3328, 1408, 1408, 3328, 3328]
    - [5, 5178.89]
  - - [64, 3584, 1, 128, 64, 64, 128, 128]
    - [0, 882.746]
  - - [5888, 256, 1, 256, 5888, 5888, 256, 256]
    - [16, 4942.31]
  - - [128, 64, 1, 256, 128, 128, 256, 256]
    - [13, 124.169]
  - - [6784, 5056, 1, 128, 6784, 6784, 128, 128]
    - [1, 3433.69]
  - - [448, 4288, 1, 128, 448, 448, 128, 128]
    - [1, 2482.77]
  - - [4288, 2944, 1, 128, 4288, 4288, 128, 128]
    - [1, 3295.1]
  - - [2368, 4, 1, 1792, 2368, 2368, 1792, 1792]
    - [23, 288.592]
  - - [4288, 4288, 1, 256, 4288, 4288, 256, 256]
    - [16, 5947.02]
  - - [1024, 1856, 1, 128, 1024, 1024, 128, 128]
    - [4, 2016.0]
  - - [2944, 5888, 1, 256, 2944, 2944, 256, 256]
    - [16, 5929.52]
  - - [4288, 2368, 1, 256, 4288, 4288, 256, 256]
    - [16, 5839.81]
  - - [5888, 1408, 1, 768, 5888, 5888, 768, 768]
    - [5, 6205.02]
  - - [4288, 6784, 1, 768, 4288, 4288, 768, 768]
    - [5, 6213.61]
  - - [256, 704, 1, 256, 256, 256, 256, 256]
    - [9, 2155.2]
  - - [6784, 256, 1, 128, 6784, 6784, 128, 128]
    - [2, 2221.29]
  - - [128, 4288, 1, 1792, 128, 128, 1792, 1792]
    - [13, 3479.51]
  - - [256, 6784, 1, 3328, 256, 256, 3328, 3328]
    - [5, 5019.29]
  - - [4, 2368, 1, 1792, 4, 4, 1792, 1792]
    - [23, 273.441]
  - - [5056, 448, 1, 768, 5056, 5056, 768, 768]
    - [16, 5188.67]
  - - [2944, 4288, 1, 256, 2944, 2944, 256, 256]
    - [16, 5837.19]
  - - [1856, 704, 1, 128, 1856, 1856, 128, 128]
    - [2, 2094.43]
  - - [4288, 5888, 1, 1792, 4288, 4288, 1792, 1792]
    - [5, 6327.88]
  - - [1856, 128, 1, 1792, 1856, 1856, 1792, 1792]
    - [9, 3785.99]
  - - [6784, 1408, 1, 256, 6784, 6784, 256, 256]
    - [16, 5573.28]
  - - [1408, 2368, 1, 768, 1408, 1408, 768, 768]
    - [16, 5611.63]
  - - [64, 6784, 1, 3328, 64, 64, 3328, 3328]
    - [17, 3659.02]
  - - [256, 1024, 1, 128, 256, 256, 128, 128]
    - [2, 837.291]
  - - [6784, 2368, 1, 256, 6784, 6784, 256, 256]
    - [16, 5744.2]
  - - [64, 5888, 1, 768, 64, 64, 768, 768]
    - [13, 2514.1]
  - - [4, 3584, 1, 3328, 4, 4, 3328, 3328]
    - [24, 261.925]
  - - [128, 448, 1, 3328, 128, 128, 3328, 3328]
    - [14, 1957.66]
  - - [4288, 5888, 1, 128, 4288, 4288, 128, 128]
    - [1, 3487.38]
  - - [1856, 704, 1, 3328, 1856, 1856, 3328, 3328]
    - [10, 4745.57]
  - - [1024, 5056, 1, 768, 1024, 1024, 768, 768]
    - [16, 6036.61]
  - - [6784, 128, 1, 128, 6784, 6784, 128, 128]
    - [1, 1718.76]
  - - [4, 1856, 1, 128, 4, 4, 128, 128]
    - [21, 43.1932]
  - - [4288, 6784, 1, 3328, 4288, 4288, 3328, 3328]
    - [5, 6329.36]
  - - [5888, 128, 1, 128, 5888, 5888, 128, 128]
    - [0, 1738.71]
  - - [6784, 256, 1, 256, 6784, 6784, 256, 256]
    - [16, 4449.17]
  - - [1408, 704, 1, 256, 1408, 1408, 256, 256]
    - [16, 4483.79]
  - - [64, 2368, 1, 256, 64, 64, 256, 256]
    - [9, 1641.87]
  - - [128, 5888, 1, 128, 128, 128, 128, 128]
    - [0, 1669.62]
  - - [64, 5888, 1, 1792, 64, 64, 1792, 1792]
    - [13, 3109.18]
  - - [5056, 64, 1, 256, 5056, 5056, 256, 256]
    - [9, 2420.52]
  - - [1856, 4288, 1, 256, 1856, 1856, 256, 256]
    - [16, 5606.22]
  - - [4, 5056, 1, 128, 4, 4, 128, 128]
    - [21, 100.422]
  - - [2944, 1408, 1, 128, 2944, 2944, 128, 128]
    - [1, 2858.21]
  - - [704, 4288, 1, 1792, 704, 704, 1792, 1792]
    - [10, 5617.54]
  - - [6784, 4, 1, 1792, 6784, 6784, 1792, 1792]
    - [22, 159.762]
  - - [1408, 448, 1, 128, 1408, 1408, 128, 128]
    - [0, 1636.61]
  - - [2368, 5056, 1, 3328, 2368, 2368, 3328, 3328]
    - [5, 6231.24]
  - - [1856, 4288, 1, 768, 1856, 1856, 768, 768]
    - [5, 5983.91]
  - - [4, 4288, 1, 768, 4, 4, 768, 768]
    - [23, 233.677]
  - - [4, 5888, 1, 256, 4, 4, 256, 256]
    - [23, 149.622]
  - - [1024, 128, 1, 128, 1024, 1024, 128, 128]
    - [0, 577.778]
  - - [4, 4288, 1, 256, 4, 4, 256, 256]
    - [23, 122.979]
  - - [4, 128, 1, 3328, 4, 4, 3328, 3328]
    - [24, 45.2807]
  - - [4, 4288, 1, 3328, 4, 4, 3328, 3328]
    - [24, 301.129]
  - - [5888, 5056, 1, 3328, 5888, 5888, 3328, 3328]
    - [5, 6463.34]
  - - [448, 4, 1, 256, 448, 448, 256, 256]
    - [24, 19.1734]
  - - [4288, 1024, 1, 1792, 4288, 4288, 1792, 1792]
    - [10, 5558.48]
  - - [3584, 64, 1, 768, 3584, 3584, 768, 768]
    - [13, 3235.54]
  - - [6784, 1024, 1, 256, 6784, 6784, 256, 256]
    - [16, 5481.2]
  - - [256, 2944, 1, 3328, 256, 256, 3328, 3328]
    - [9, 4233.54]
  - - [6784, 5888, 1, 1792, 6784, 6784, 1792, 1792]
    - [5, 6424.75]
  - - [1408, 2368, 1, 1792, 1408, 1408, 1792, 1792]
    - [16, 5389.76]
  - - [1856, 5888, 1, 256, 1856, 1856, 256, 256]
    - [16, 5822.82]
  - - [704, 5056, 1, 128, 704, 704, 128, 128]
    - [1, 2948.49]
  - - [448, 256, 1, 3328, 448, 448, 3328, 3328]
    - [18, 2765.75]
  - - [4, 5056, 1, 768, 4, 4, 768, 768]
    - [23, 252.625]
  - - [5056, 3584, 1, 256, 5056, 5056, 256, 256]
    - [16, 5940.4]
  - - [3584, 5888, 1, 1792, 3584, 3584, 1792, 1792]
    - [5, 6268.6]
  - - [64, 2944, 1, 128, 64, 64, 128, 128]
    - [0, 723.503]
  - - [128, 5056, 1, 1792, 128, 128, 1792, 1792]
    - [13, 4011.26]
  - - [4, 3584, 1, 1792, 4, 4, 1792, 1792]
    - [24, 301.835]
  - - [5056, 2944, 1, 3328, 5056, 5056, 3328, 3328]
    - [5, 6214.75]
  - - [1024, 448, 1, 768, 1024, 1024, 768, 768]
    - [10, 3707.11]
  - - [3584, 2368, 1, 1792, 3584, 3584, 1792, 1792]
    - [5, 5792.05]
  - - [448, 5056, 1, 3328, 448, 448, 3328, 3328]
    - [16, 5185.93]
  - - [1856, 3584, 1, 1792, 1856, 1856, 1792, 1792]
    - [10, 5864.83]
  - - [5056, 1408, 1, 3328, 5056, 5056, 3328, 3328]
    - [5, 6269.79]
  - - [128, 3584, 1, 128, 128, 128, 128, 128]
    - [0, 1327.81]
  - - [5056, 704, 1, 768, 5056, 5056, 768, 768]
    - [16, 5964.65]
  - - [1024, 6784, 1, 1792, 1024, 1024, 1792, 1792]
    - [5, 6050.32]
  - - [5888, 5056, 1, 128, 5888, 5888, 128, 128]
    - [1, 3197.27]
  - - [5888, 1024, 1, 256, 5888, 5888, 256, 256]
    - [5, 5484.82]
  - - [4288, 704, 1, 3328, 4288, 4288, 3328, 3328]
    - [16, 4919.06]
  - - [1856, 2944, 1, 768, 1856, 1856, 768, 768]
    - [16, 5904.75]
  - - [5888, 6784, 1, 1792, 5888, 5888, 1792, 1792]
    - [5, 6430.48]
  - - [64, 64, 1, 1792, 64, 64, 1792, 1792]
    - [19, 172.328]
  - - [64, 4, 1, 3328, 64, 64, 3328, 3328]
    - [24, 24.5754]
  - - [128, 704, 1, 128, 128, 128, 128, 128]
    - [0, 398.23]
  - - [5056, 2944, 1, 1792, 5056, 5056, 1792, 1792]
    - [5, 6180.37]
  - - [1856, 128, 1, 3328, 1856, 1856, 3328, 3328]
    - [9, 3874.13]
  - - [5888, 2944, 1, 256, 5888, 5888, 256, 256]
    - [5, 5847.33]
  - - [5056, 1408, 1, 768, 5056, 5056, 768, 768]
    - [16, 6118.93]
  - - [5056, 4288, 1, 128, 5056, 5056, 128, 128]
    - [1, 3361.97]
  - - [2944, 4288, 1, 1792, 2944, 2944, 1792, 1792]
    - [5, 6023.83]
  - - [64, 64, 1, 256, 64, 64, 256, 256]
    - [8, 53.0173]
  - - [256, 5056, 1, 1792, 256, 256, 1792, 1792]
    - [10, 4627.83]
  - - [1024, 5888, 1, 1792, 1024, 1024, 1792, 1792]
    - [5, 6097.99]
  - - [128, 5056, 1, 256, 128, 128, 256, 256]
    - [13, 3274.63]
  - - [128, 4288, 1, 256, 128, 128, 256, 256]
    - [13, 2852.37]
  - - [5888, 4, 1, 3328, 5888, 5888, 3328, 3328]
    - [23, 163.745]
  - - [1408, 6784, 1, 256, 1408, 1408, 256, 256]
    - [16, 5791.32]
  - - [2368, 2944, 1, 256, 2368, 2368, 256, 256]
    - [16, 5668.84]
  - - [6784, 128, 1, 1792, 6784, 6784, 1792, 1792]
    - [10, 4613.81]
  - - [3584, 3584, 1, 3328, 3584, 3584, 3328, 3328]
    - [5, 6169.97]
  - - [1408, 1408, 1, 256, 1408, 1408, 256, 256]
    - [16, 5170.77]
  - - [256, 2944, 1, 768, 256, 256, 768, 768]
    - [9, 3954.35]
  - - [448, 4, 1, 128, 448, 448, 128, 128]
    - [21, 10.9807]
  - - [4288, 3584, 1, 3328, 4288, 4288, 3328, 3328]
    - [5, 6416.67]
  - - [4, 4, 1, 128, 4, 4, 128, 128]
    - [21, 0.000113098]
  - - [5056, 1408, 1, 1792, 5056, 5056, 1792, 1792]
    - [5, 6218.28]
  - - [4, 64, 1, 1792, 4, 4, 1792, 1792]
    - [24, 16.6928]
  - - [704, 1024, 1, 3328, 704, 704, 3328, 3328]
    - [20, 4173.14]
  - - [5056, 64, 1, 768, 5056, 5056, 768, 768]
    - [13, 2882.17]
  - - [3584, 2944, 1, 256, 3584, 3584, 256, 256]
    - [16, 5661.31]
  - - [2368, 1408, 1, 768, 2368, 2368, 768, 768]
    - [16, 5590.76]
  - - [64, 128, 1, 128, 64, 64, 128, 128]
    - [0, 34.5256]
  - - [5056, 64, 1, 3328, 5056, 5056, 3328, 3328]
    - [7, 3503.05]
  - - [448, 3584, 1, 3328, 448, 448, 3328, 3328]
    - [5, 4634.22]
  - - [2944, 2368, 1, 768, 2944, 2944, 768, 768]
    - [5, 5912.29]
  - - [2944, 3584, 1, 1792, 2944, 2944, 1792, 1792]
    - [5, 5947.28]
  - - [2944, 704, 1, 256, 2944, 2944, 256, 256]
    - [16, 5333.34]
  - - [64, 4288, 1, 128, 64, 64, 128, 128]
    - [0, 849.83]
  - - [64, 448, 1, 256, 64, 64, 256, 256]
    - [8, 442.357]
  - - [2368, 2944, 1, 3328, 2368, 2368, 3328, 3328]
    - [5, 6146.55]
  - - [4288, 1024, 1, 3328, 4288, 4288, 3328, 3328]
    - [10, 5585.87]
  - - [2368, 256, 1, 1792, 2368, 2368, 1792, 1792]
    - [9, 3929.54]
  - - [2368, 2368, 1, 1792, 2368, 2368, 1792, 1792]
    - [10, 5808.26]
  - - [704, 1408, 1, 256, 704, 704, 256, 256]
    - [10, 4561.4]
  - - [4, 1408, 1, 1792, 4, 4, 1792, 1792]
    - [23, 205.501]
  - - [1024, 5888, 1, 256, 1024, 1024, 256, 256]
    - [16, 5448.97]
  - - [256, 256, 1, 256, 256, 256, 256, 256]
    - [8, 997.723]
  - - [6784, 64, 1, 128, 6784, 6784, 128, 128]
    - [2, 1300.25]
  - - [704, 1856, 1, 3328, 704, 704, 3328, 3328]
    - [10, 4748.26]
  - - [3584, 6784, 1, 768, 3584, 3584, 768, 768]
    - [5, 6196.67]
  - - [1024, 5056, 1, 3328, 1024, 1024, 3328, 3328]
    - [5, 6292.85]
  - - [256, 2944, 1, 128, 256, 256, 128, 128]
    - [2, 1629.92]
  - - [1856, 1408, 1, 768, 1856, 1856, 768, 768]
    - [10, 5689.53]
  - - [5056, 2368, 1, 128, 5056, 5056, 128, 128]
    - [1, 3231.02]
  - - [1408, 2944, 1, 3328, 1408, 1408, 3328, 3328]
    - [5, 6265.28]
  - - [6784, 5888, 1, 3328, 6784, 6784, 3328, 3328]
    - [5, 6473.6]
  - - [5888, 128, 1, 256, 5888, 5888, 256, 256]
    - [16, 3431.63]
  - - [448, 1408, 1, 256, 448, 448, 256, 256]
    - [13, 3369.31]
  - - [256, 704, 1, 3328, 256, 256, 3328, 3328]
    - [9, 2927.3]
  - - [64, 448, 1, 3328, 64, 64, 3328, 3328]
    - [15, 1276.66]
  - - [1024, 4, 1, 3328, 1024, 1024, 3328, 3328]
    - [24, 272.221]
  - - [3584, 1856, 1, 768, 3584, 3584, 768, 768]
    - [16, 6121.55]
  - - [3584, 128, 1, 3328, 3584, 3584, 3328, 3328]
    - [10, 4189.95]
  - - [5888, 128, 1, 1792, 5888, 5888, 1792, 1792]
    - [9, 4201.94]
  - - [4288, 64, 1, 256, 4288, 4288, 256, 256]
    - [9, 2057.3]
  - - [5056, 4, 1, 256, 5056, 5056, 256, 256]
    - [22, 152.605]
  - - [64, 4288, 1, 1792, 64, 64, 1792, 1792]
    - [7, 2492.09]
  - - [2944, 4, 1, 1792, 2944, 2944, 1792, 1792]
    - [23, 313.744]
  - - [1408, 128, 1, 128, 1408, 1408, 128, 128]
    - [0, 798.514]
  - - [64, 448, 1, 128, 64, 64, 128, 128]
    - [0, 128.687]
  - - [2944, 4, 1, 768, 2944, 2944, 768, 768]
    - [23, 197.559]
  - - [64, 1024, 1, 768, 64, 64, 768, 768]
    - [13, 1136.23]
  - - [1408, 2944, 1, 1792, 1408, 1408, 1792, 1792]
    - [5, 6206.05]
  - - [1408, 128, 1, 256, 1408, 1408, 256, 256]
    - [9, 2140.35]
  - - [4288, 128, 1, 768, 4288, 4288, 768, 768]
    - [9, 3407.49]
  - - [704, 704, 1, 768, 704, 704, 768, 768]
    - [13, 3863.49]
  - - [4288, 1408, 1, 256, 4288, 4288, 256, 256]
    - [16, 5697.75]
  - - [2944, 5888, 1, 768, 2944, 2944, 768, 768]
    - [5, 6240.42]
  - - [4288, 64, 1, 1792, 4288, 4288, 1792, 1792]
    - [9, 2642.88]
  - - [5888, 1856, 1, 1792, 5888, 5888, 1792, 1792]
    - [5, 6124.15]
  - - [2368, 256, 1, 256, 2368, 2368, 256, 256]
    - [9, 3159.87]
  - - [256, 256, 1, 128, 256, 256, 128, 128]
    - [0, 291.864]
  - - [448, 4288, 1, 3328, 448, 448, 3328, 3328]
    - [10, 5332.46]
  - - [64, 256, 1, 1792, 64, 64, 1792, 1792]
    - [15, 546.693]
  - - [2944, 128, 1, 3328, 2944, 2944, 3328, 3328]
    - [9, 3804.48]
  - - [704, 4288, 1, 3328, 704, 704, 3328, 3328]
    - [10, 5683.9]
  - - [1024, 4288, 1, 128, 1024, 1024, 128, 128]
    - [3, 2408.68]
  - - [4, 704, 1, 1792, 4, 4, 1792, 1792]
    - [24, 135.434]
  - - [6784, 704, 1, 128, 6784, 6784, 128, 128]
    - [1, 2888.56]
  - - [256, 1024, 1, 3328, 256, 256, 3328, 3328]
    - [9, 4241.03]
  - - [448, 3584, 1, 768, 448, 448, 768, 768]
    - [16, 4435.61]
  - - [1024, 128, 1, 768, 1024, 1024, 768, 768]
    - [9, 2330.92]
  - - [1408, 4, 1, 3328, 1408, 1408, 3328, 3328]
    - [24, 330.325]
  - - [1024, 64, 1, 128, 1024, 1024, 128, 128]
    - [0, 273.539]
  - - [3584, 1856, 1, 1792, 3584, 3584, 1792, 1792]
    - [16, 5797.64]
  - - [256, 5888, 1, 1792, 256, 256, 1792, 1792]
    - [10, 5395.75]
  - - [1024, 4, 1, 768, 1024, 1024, 768, 768]
    - [24, 103.577]
  - - [4288, 704, 1, 1792, 4288, 4288, 1792, 1792]
    - [16, 5560.23]
  - - [1024, 704, 1, 256, 1024, 1024, 256, 256]
    - [16, 3273.81]
  - - [2368, 2368, 1, 128, 2368, 2368, 128, 128]
    - [1, 3145.92]
  - - [128, 6784, 1, 3328, 128, 128, 3328, 3328]
    - [10, 4638.82]
  - - [1024, 5056, 1, 128, 1024, 1024, 128, 128]
    - [3, 2452.37]
  - - [2944, 3584, 1, 768, 2944, 2944, 768, 768]
    - [16, 5940.45]
  - - [3584, 2944, 1, 128, 3584, 3584, 128, 128]
    - [1, 2990.36]
  - - [64, 1024, 1, 256, 64, 64, 256, 256]
    - [13, 989.019]
  - - [128, 5056, 1, 768, 128, 128, 768, 768]
    - [13, 3696.8]
  - - [4288, 128, 1, 256, 4288, 4288, 256, 256]
    - [9, 2878.34]
  - - [4, 5056, 1, 3328, 4, 4, 3328, 3328]
    - [24, 282.088]
  - - [5056, 1856, 1, 768, 5056, 5056, 768, 768]
    - [16, 5991.9]
  - - [2368, 1856, 1, 256, 2368, 2368, 256, 256]
    - [16, 5487.29]
  - - [2368, 1024, 1, 3328, 2368, 2368, 3328, 3328]
    - [10, 5458.49]
  - - [128, 6784, 1, 768, 128, 128, 768, 768]
    - [10, 4322.08]
  - - [4, 2944, 1, 3328, 4, 4, 3328, 3328]
    - [24, 259.598]
  - - [256, 1856, 1, 128, 256, 256, 128, 128]
    - [2, 1209.15]
  - - [1024, 704, 1, 128, 1024, 1024, 128, 128]
    - [0, 1654.29]
  - - [256, 256, 1, 3328, 256, 256, 3328, 3328]
    - [14, 2135.12]
  - - [128, 4288, 1, 768, 128, 128, 768, 768]
    - [13, 3276.05]
  - - [1024, 2368, 1, 256, 1024, 1024, 256, 256]
    - [16, 4982.18]
  - - [1408, 5888, 1, 256, 1408, 1408, 256, 256]
    - [16, 5835.17]
  - - [3584, 5888, 1, 768, 3584, 3584, 768, 768]
    - [5, 6150.71]
  - - [448, 5056, 1, 128, 448, 448, 128, 128]
    - [1, 2500.95]
  - - [64, 2944, 1, 768, 64, 64, 768, 768]
    - [13, 2510.86]
  - - [448, 4288, 1, 768, 448, 448, 768, 768]
    - [10, 5076.92]
  - - [5888, 704, 1, 3328, 5888, 5888, 3328, 3328]
    - [10, 5262.79]
  - - [64, 4288, 1, 3328, 64, 64, 3328, 3328]
    - [17, 3097.84]
  - - [6784, 3584, 1, 256, 6784, 6784, 256, 256]
    - [5, 5875.59]
  - - [1024, 6784, 1, 128, 1024, 1024, 128, 128]
    - [2, 2493.01]
  - - [1408, 5056, 1, 768, 1408, 1408, 768, 768]
    - [5, 6051.21]
  - - [64, 704, 1, 128, 64, 64, 128, 128]
    - [0, 207.613]
  - - [1024, 704, 1, 768, 1024, 1024, 768, 768]
    - [9, 3753.93]
  - - [6784, 1024, 1, 3328, 6784, 6784, 3328, 3328]
    - [5, 6119.72]
  - - [2368, 3584, 1, 1792, 2368, 2368, 1792, 1792]
    - [5, 5822.44]
  - - [64, 2944, 1, 3328, 64, 64, 3328, 3328]
    - [13, 2966.0]
  - - [4, 448, 1, 1792, 4, 4, 1792, 1792]
    - [24, 93.4295]
  - - [448, 1024, 1, 256, 448, 448, 256, 256]
    - [10, 3048.86]
  - - [4288, 1856, 1, 768, 4288, 4288, 768, 768]
    - [5, 5961.0]
  - - [2944, 2368, 1, 1792, 2944, 2944, 1792, 1792]
    - [5, 6079.82]
  - - [3584, 1408, 1, 1792, 3584, 3584, 1792, 1792]
    - [5, 6097.74]
  - - [1024, 6784, 1, 3328, 1024, 1024, 3328, 3328]
    - [5, 6119.6]
  - - [2944, 256, 1, 128, 2944, 2944, 128, 128]
    - [0, 1727.19]
  - - [704, 6784, 1, 128, 704, 704, 128, 128]
    - [1, 2898.71]
  - - [1856, 6784, 1, 1792, 1856, 1856, 1792, 1792]
    - [5, 6023.4]
  - - [5888, 5888, 1, 128, 5888, 5888, 128, 128]
    - [1, 3210.91]
  - - [3584, 4288, 1, 768, 3584, 3584, 768, 768]
    - [5, 6206.28]
  - - [1024, 448, 1, 256, 1024, 1024, 256, 256]
    - [16, 3008.36]
  - - [2368, 4288, 1, 3328, 2368, 2368, 3328, 3328]
    - [10, 5886.53]
  - - [6784, 5888, 1, 768, 6784, 6784, 768, 768]
    - [5, 6349.77]
  - - [6784, 448, 1, 128, 6784, 6784, 128, 128]
    - [3, 2558.06]
  - - [1856, 1024, 1, 1792, 1856, 1856, 1792, 1792]
    - [5, 5424.37]
  - - [1856, 3584, 1, 256, 1856, 1856, 256, 256]
    - [10, 5528.73]
  - - [64, 2944, 1, 256, 64, 64, 256, 256]
    - [13, 1834.26]
  - - [64, 1856, 1, 3328, 64, 64, 3328, 3328]
    - [18, 2665.64]
  - - [64, 3584, 1, 3328, 64, 64, 3328, 3328]
    - [13, 3506.36]
  - - [1408, 5056, 1, 256, 1408, 1408, 256, 256]
    - [16, 5817.49]
  - - [4288, 256, 1, 128, 4288, 4288, 128, 128]
    - [1, 1868.81]
  - - [448, 4, 1, 3328, 448, 448, 3328, 3328]
    - [24, 140.016]
  - - [1408, 1024, 1, 3328, 1408, 1408, 3328, 3328]
    - [10, 5245.82]
  - - [448, 2368, 1, 256, 448, 448, 256, 256]
    - [6, 3478.42]
  - - [1856, 256, 1, 128, 1856, 1856, 128, 128]
    - [0, 1458.29]
  - - [4288, 3584, 1, 1792, 4288, 4288, 1792, 1792]
    - [5, 6375.25]
  - - [128, 2944, 1, 3328, 128, 128, 3328, 3328]
    - [13, 3567.95]
  - - [3584, 4, 1, 768, 3584, 3584, 768, 768]
    - [23, 232.24]
  - - [1856, 1408, 1, 3328, 1856, 1856, 3328, 3328]
    - [10, 5866.16]
  - - [256, 128, 1, 256, 256, 256, 256, 256]
    - [9, 494.524]
  - - [256, 704, 1, 128, 256, 256, 128, 128]
    - [0, 647.442]
  - - [256, 5056, 1, 256, 256, 256, 256, 256]
    - [6, 3923.79]
  - - [5888, 256, 1, 3328, 5888, 5888, 3328, 3328]
    - [10, 5486.05]
  - - [5888, 4, 1, 768, 5888, 5888, 768, 768]
    - [22, 293.84]
  - - [2944, 128, 1, 128, 2944, 2944, 128, 128]
    - [0, 1257.06]
  - - [4288, 5056, 1, 128, 4288, 4288, 128, 128]
    - [1, 3412.81]
  - - [6784, 704, 1, 768, 6784, 6784, 768, 768]
    - [5, 5556.71]
  - - [3584, 5888, 1, 3328, 3584, 3584, 3328, 3328]
    - [5, 6314.91]
  - - [5888, 448, 1, 768, 5888, 5888, 768, 768]
    - [16, 5122.38]
  - - [128, 6784, 1, 256, 128, 128, 256, 256]
    - [10, 3598.28]
  - - [704, 1856, 1, 128, 704, 704, 128, 128]
    - [2, 2118.01]
  - - [64, 1024, 1, 1792, 64, 64, 1792, 1792]
    - [14, 1599.81]
  - - [704, 1856, 1, 1792, 704, 704, 1792, 1792]
    - [16, 4948.98]
  - - [2944, 6784, 1, 1792, 2944, 2944, 1792, 1792]
    - [5, 6241.9]
  - - [448, 6784, 1, 128, 448, 448, 128, 128]
    - [1, 2817.43]
  - - [448, 5056, 1, 1792, 448, 448, 1792, 1792]
    - [16, 5283.56]
  - - [2944, 448, 1, 256, 2944, 2944, 256, 256]
    - [16, 4408.17]
  - - [64, 6784, 1, 128, 64, 64, 128, 128]
    - [0, 1364.08]
  - - [704, 704, 1, 128, 704, 704, 128, 128]
    - [2, 1494.6]
  - - [1024, 64, 1, 768, 1024, 1024, 768, 768]
    - [13, 1235.38]
  - - [448, 4288, 1, 256, 448, 448, 256, 256]
    - [10, 4603.95]
  - - [3584, 64, 1, 256, 3584, 3584, 256, 256]
    - [9, 2492.79]
  - - [5056, 5056, 1, 768, 5056, 5056, 768, 768]
    - [5, 6294.42]
  - - [4288, 1024, 1, 768, 4288, 4288, 768, 768]
    - [16, 5785.23]
  - - [4, 1408, 1, 128, 4, 4, 128, 128]
    - [21, 32.8778]
  - - [128, 2368, 1, 256, 128, 128, 256, 256]
    - [13, 2408.05]
  - - [5056, 1024, 1, 3328, 5056, 5056, 3328, 3328]
    - [5, 6317.12]
  - - [448, 1856, 1, 128, 448, 448, 128, 128]
    - [2, 1664.86]
  - - [2368, 448, 1, 1792, 2368, 2368, 1792, 1792]
    - [9, 4003.72]
  - - [4288, 2368, 1, 128, 4288, 4288, 128, 128]
    - [1, 3245.6]
  - - [5888, 448, 1, 128, 5888, 5888, 128, 128]
    - [2, 2310.22]
  - - [1024, 5888, 1, 768, 1024, 1024, 768, 768]
    - [5, 5902.23]
  - - [448, 5056, 1, 768, 448, 448, 768, 768]
    - [16, 5104.09]
  - - [704, 4, 1, 768, 704, 704, 768, 768]
    - [24, 75.0542]
  - - [2368, 3584, 1, 768, 2368, 2368, 768, 768]
    - [16, 5878.56]
  - - [1856, 2368, 1, 256, 1856, 1856, 256, 256]
    - [16, 5438.17]
  - - [6784, 2944, 1, 1792, 6784, 6784, 1792, 1792]
    - [5, 6236.98]
  - - [256, 2368, 1, 3328, 256, 256, 3328, 3328]
    - [13, 3895.18]
  - - [1856, 256, 1, 256, 1856, 1856, 256, 256]
    - [10, 3133.67]
  - - [448, 3584, 1, 128, 448, 448, 128, 128]
    - [1, 2090.79]
  - - [4288, 256, 1, 3328, 4288, 4288, 3328, 3328]
    - [7, 4248.59]
  - - [1024, 1024, 1, 768, 1024, 1024, 768, 768]
    - [10, 5113.54]
  - - [1024, 3584, 1, 256, 1024, 1024, 256, 256]
    - [16, 5420.2]
  - - [6784, 6784, 1, 3328, 6784, 6784, 3328, 3328]
    - [5, 6604.61]
  - - [6784, 4, 1, 3328, 6784, 6784, 3328, 3328]
    - [24, 165.173]
  - - [704, 2944, 1, 256, 704, 704, 256, 256]
    - [10, 5127.16]
  - - [2368, 5888, 1, 256, 2368, 2368, 256, 256]
    - [16, 5823.69]
  - - [1408, 4288, 1, 1792, 1408, 1408, 1792, 1792]
    - [5, 6108.32]
  - - [4288, 4, 1, 128, 4288, 4288, 128, 128]
    - [21, 92.9077]
  - - [2944, 4288, 1, 128, 2944, 2944, 128, 128]
    - [1, 3164.14]
  - - [448, 2944, 1, 256, 448, 448, 256, 256]
    - [10, 4189.39]
  - - [3584, 1024, 1, 768, 3584, 3584, 768, 768]
    - [16, 6124.24]
  - - [704, 256, 1, 768, 704, 704, 768, 768]
    - [9, 2692.4]
  - - [4288, 1024, 1, 256, 4288, 4288, 256, 256]
    - [16, 5381.08]
  - - [256, 128, 1, 3328, 256, 256, 3328, 3328]
    - [15, 1472.17]
  - - [1856, 2944, 1, 1792, 1856, 1856, 1792, 1792]
    - [10, 5679.46]
  - - [4288, 4288, 1, 128, 4288, 4288, 128, 128]
    - [3, 3326.91]
  - - [2368, 128, 1, 768, 2368, 2368, 768, 768]
    - [9, 2690.51]
  - - [4, 1856, 1, 1792, 4, 4, 1792, 1792]
    - [23, 251.186]
  - - [2368, 4288, 1, 128, 2368, 2368, 128, 128]
    - [1, 3267.96]
  - - [1024, 4288, 1, 256, 1024, 1024, 256, 256]
    - [16, 5218.25]
  - - [256, 3584, 1, 1792, 256, 256, 1792, 1792]
    - [10, 4840.95]
  - - [704, 1856, 1, 256, 704, 704, 256, 256]
    - [16, 4325.28]
  - - [1024, 1408, 1, 256, 1024, 1024, 256, 256]
    - [16, 4661.1]
  - - [5888, 64, 1, 128, 5888, 5888, 128, 128]
    - [0, 1264.39]
  - - [256, 1024, 1, 1792, 256, 256, 1792, 1792]
    - [13, 4083.48]
  - - [5888, 1408, 1, 3328, 5888, 5888, 3328, 3328]
    - [5, 6406.46]
  - - [5888, 1856, 1, 128, 5888, 5888, 128, 128]
    - [1, 3002.13]
  - - [256, 2368, 1, 128, 256, 256, 128, 128]
    - [0, 1259.02]
  - - [3584, 128, 1, 128, 3584, 3584, 128, 128]
    - [2, 1223.31]
  - - [5056, 128, 1, 128, 5056, 5056, 128, 128]
    - [0, 1694.37]
  - - [2944, 2944, 1, 128, 2944, 2944, 128, 128]
    - [1, 3134.47]
  - - [3584, 6784, 1, 128, 3584, 3584, 128, 128]
    - [1, 3146.6]
  - - [64, 4288, 1, 768, 64, 64, 768, 768]
    - [13, 2165.33]
  - - [2944, 5056, 1, 256, 2944, 2944, 256, 256]
    - [16, 5907.32]
  - - [2368, 256, 1, 128, 2368, 2368, 128, 128]
    - [0, 1596.81]
  - - [4288, 448, 1, 3328, 4288, 4288, 3328, 3328]
    - [7, 4556.8]
  - - [256, 6784, 1, 768, 256, 256, 768, 768]
    - [5, 4781.14]
  - - [128, 1408, 1, 3328, 128, 128, 3328, 3328]
    - [9, 2890.73]
  - - [1856, 2368, 1, 768, 1856, 1856, 768, 768]
    - [16, 5700.08]
  - - [4, 4288, 1, 1792, 4, 4, 1792, 1792]
    - [24, 314.819]
  - - [2368, 5888, 1, 1792, 2368, 2368, 1792, 1792]
    - [5, 6194.49]
  - - [6784, 64, 1, 768, 6784, 6784, 768, 768]
    - [9, 3297.75]
  - - [3584, 5056, 1, 1792, 3584, 3584, 1792, 1792]
    - [5, 6261.75]
  - - [1856, 448, 1, 128, 1856, 1856, 128, 128]
    - [2, 1690.34]
  - - [4288, 2368, 1, 768, 4288, 4288, 768, 768]
    - [16, 6048.85]
  - - [2944, 128, 1, 256, 2944, 2944, 256, 256]
    - [9, 2855.93]
  - - [6784, 6784, 1, 768, 6784, 6784, 768, 768]
    - [5, 6458.74]
  - - [128, 128, 1, 128, 128, 128, 128, 128]
    - [0, 68.8833]
  - - [1856, 1856, 1, 128, 1856, 1856, 128, 128]
    - [1, 2940.89]
  - - [5056, 5888, 1, 128, 5056, 5056, 128, 128]
    - [1, 3405.56]
  - - [5056, 3584, 1, 128, 5056, 5056, 128, 128]
    - [1, 3416.46]
  - - [5056, 2368, 1, 768, 5056, 5056, 768, 768]
    - [5, 6041.53]
  - - [256, 5056, 1, 3328, 256, 256, 3328, 3328]
    - [16, 4716.96]
  - - [2944, 64, 1, 256, 2944, 2944, 256, 256]
    - [9, 2237.64]
  - - [4, 256, 1, 1792, 4, 4, 1792, 1792]
    - [24, 60.8656]
  - - [2368, 256, 1, 768, 2368, 2368, 768, 768]
    - [9, 3712.35]
  - - [128, 1408, 1, 256, 128, 128, 256, 256]
    - [13, 2015.7]
  - - [1024, 2368, 1, 3328, 1024, 1024, 3328, 3328]
    - [16, 5482.66]
  - - [3584, 3584, 1, 768, 3584, 3584, 768, 768]
    - [16, 6231.85]
  - - [4, 704, 1, 768, 4, 4, 768, 768]
    - [24, 73.5408]
  - - [3584, 4288, 1, 256, 3584, 3584, 256, 256]
    - [16, 5810.23]
  - - [5056, 4, 1, 768, 5056, 5056, 768, 768]
    - [22, 291.219]
  - - [2368, 5056, 1, 768, 2368, 2368, 768, 768]
    - [5, 6068.11]
  - - [5056, 2944, 1, 128, 5056, 5056, 128, 128]
    - [1, 3321.34]
  - - [2368, 448, 1, 128, 2368, 2368, 128, 128]
    - [0, 1800.72]
  - - [128, 5888, 1, 256, 128, 128, 256, 256]
    - [13, 3360.79]
  - - [1408, 1024, 1, 128, 1408, 1408, 128, 128]
    - [1, 2200.85]
  - - [3584, 448, 1, 128, 3584, 3584, 128, 128]
    - [2, 1986.03]
  - - [256, 5888, 1, 3328, 256, 256, 3328, 3328]
    - [10, 5482.94]
  - - [1856, 704, 1, 768, 1856, 1856, 768, 768]
    - [16, 4790.24]
  - - [4, 1856, 1, 3328, 4, 4, 3328, 3328]
    - [23, 333.873]
  - - [2368, 5056, 1, 128, 2368, 2368, 128, 128]
    - [1, 3314.36]
  - - [448, 1408, 1, 1792, 448, 448, 1792, 1792]
    - [9, 4033.73]
  - - [5056, 128, 1, 3328, 5056, 5056, 3328, 3328]
    - [7, 4185.31]
  - - [5888, 6784, 1, 768, 5888, 5888, 768, 768]
    - [5, 6344.13]
  - - [4288, 64, 1, 3328, 4288, 4288, 3328, 3328]
    - [17, 3130.88]
  - - [448, 1024, 1, 3328, 448, 448, 3328, 3328]
    - [10, 4192.5]
  - - [4, 448, 1, 256, 4, 4, 256, 256]
    - [23, 18.6538]
  - - [5888, 704, 1, 256, 5888, 5888, 256, 256]
    - [16, 5518.23]
  - - [1856, 1024, 1, 128, 1856, 1856, 128, 128]
    - [1, 2354.17]
  - - [6784, 4288, 1, 256, 6784, 6784, 256, 256]
    - [5, 5909.13]
  - - [704, 4288, 1, 256, 704, 704, 256, 256]
    - [10, 5079.15]
  - - [128, 2368, 1, 3328, 128, 128, 3328, 3328]
    - [7, 3249.24]
  - - [448, 1856, 1, 256, 448, 448, 256, 256]
    - [10, 3698.26]
  - - [5888, 64, 1, 1792, 5888, 5888, 1792, 1792]
    - [13, 3523.82]
  - - [64, 2944, 1, 1792, 64, 64, 1792, 1792]
    - [9, 2801.52]
  - - [4288, 5056, 1, 768, 4288, 4288, 768, 768]
    - [5, 6062.86]
  - - [128, 5888, 1, 3328, 128, 128, 3328, 3328]
    - [13, 4211.95]
  - - [1408, 64, 1, 768, 1408, 1408, 768, 768]
    - [13, 1650.63]
  - - [256, 256, 1, 1792, 256, 256, 1792, 1792]
    - [14, 1675.91]
  - - [1856, 1408, 1, 256, 1856, 1856, 256, 256]
    - [10, 5366.12]
  - - [5056, 6784, 1, 128, 5056, 5056, 128, 128]
    - [1, 3509.32]
  - - [1856, 128, 1, 128, 1856, 1856, 128, 128]
    - [0, 968.183]
  - - [256, 64, 1, 128, 256, 256, 128, 128]
    - [0, 68.8833]
  - - [6784, 128, 1, 768, 6784, 6784, 768, 768]
    - [10, 4443.67]
  - - [256, 2368, 1, 256, 256, 256, 256, 256]
    - [9, 3188.73]
  - - [6784, 2944, 1, 128, 6784, 6784, 128, 128]
    - [1, 3356.78]
  - - [2368, 6784, 1, 3328, 2368, 2368, 3328, 3328]
    - [5, 6303.71]
  - - [64, 1408, 1, 128, 64, 64, 128, 128]
    - [0, 404.444]
  - - [1408, 64, 1, 3328, 1408, 1408, 3328, 3328]
    - [18, 2237.96]
  - - [5056, 1856, 1, 256, 5056, 5056, 256, 256]
    - [16, 5641.99]
  - - [4, 128, 1, 256, 4, 4, 256, 256]
    - [23, 6.41096]
  - - [1856, 1856, 1, 3328, 1856, 1856, 3328, 3328]
    - [10, 5582.03]
  - - [1024, 5888, 1, 3328, 1024, 1024, 3328, 3328]
    - [5, 6163.76]
  - - [64, 128, 1, 1792, 64, 64, 1792, 1792]
    - [19, 297.562]
  - - [2944, 128, 1, 1792, 2944, 2944, 1792, 1792]
    - [13, 3701.22]
  - - [4, 64, 1, 3328, 4, 4, 3328, 3328]
    - [24, 23.6166]
  - - [704, 3584, 1, 256, 704, 704, 256, 256]
    - [10, 5087.37]
  - - [1408, 5888, 1, 1792, 1408, 1408, 1792, 1792]
    - [5, 6364.19]
  - - [6784, 1024, 1, 768, 6784, 6784, 768, 768]
    - [5, 5920.02]
  - - [6784, 4288, 1, 1792, 6784, 6784, 1792, 1792]
    - [5, 6272.05]
  - - [448, 3584, 1, 1792, 448, 448, 1792, 1792]
    - [16, 4612.59]
  - - [6784, 5056, 1, 256, 6784, 6784, 256, 256]
    - [5, 5997.66]
  - - [1856, 64, 1, 3328, 1856, 1856, 3328, 3328]
    - [18, 2808.74]
  - - [256, 4288, 1, 256, 256, 256, 256, 256]
    - [9, 3461.37]
  - - [5056, 2944, 1, 256, 5056, 5056, 256, 256]
    - [16, 5905.96]
  - - [448, 4, 1, 768, 448, 448, 768, 768]
    - [24, 50.6246]
  - - [128, 1856, 1, 1792, 128, 128, 1792, 1792]
    - [13, 3651.27]
  - - [1856, 448, 1, 1792, 1856, 1856, 1792, 1792]
    - [16, 4426.7]
  - - [5888, 128, 1, 768, 5888, 5888, 768, 768]
    - [9, 4011.2]
  - - [5888, 1024, 1, 768, 5888, 5888, 768, 768]
    - [5, 5944.89]
  - - [3584, 2944, 1, 1792, 3584, 3584, 1792, 1792]
    - [5, 5937.04]
  - - [4288, 128, 1, 128, 4288, 4288, 128, 128]
    - [0, 1477.29]
  - - [5888, 2944, 1, 128, 5888, 5888, 128, 128]
    - [1, 3130.53]
  - - [2944, 4, 1, 3328, 2944, 2944, 3328, 3328]
    - [22, 308.851]
  - - [4288, 3584, 1, 768, 4288, 4288, 768, 768]
    - [5, 6250.59]
  - - [128, 1024, 1, 3328, 128, 128, 3328, 3328]
    - [18, 3063.83]
  - - [2944, 704, 1, 768, 2944, 2944, 768, 768]
    - [16, 5818.58]
  - - [5056, 128, 1, 256, 5056, 5056, 256, 256]
    - [9, 3246.08]
  - - [448, 2368, 1, 3328, 448, 448, 3328, 3328]
    - [7, 4217.83]
  - - [256, 704, 1, 768, 256, 256, 768, 768]
    - [13, 2639.16]
  - - [1856, 2368, 1, 1792, 1856, 1856, 1792, 1792]
    - [10, 5544.81]
  - - [256, 64, 1, 3328, 256, 256, 3328, 3328]
    - [15, 813.353]
  - - [1408, 448, 1, 768, 1408, 1408, 768, 768]
    - [9, 3876.59]
  - - [6784, 3584, 1, 768, 6784, 6784, 768, 768]
    - [5, 6234.37]
  - - [4, 256, 1, 128, 4, 4, 128, 128]
    - [21, 6.25254]
  - - [3584, 256, 1, 256, 3584, 3584, 256, 256]
    - [16, 4172.14]
  - - [704, 64, 1, 256, 704, 704, 256, 256]
    - [8, 679.97]
  - - [5888, 704, 1, 128, 5888, 5888, 128, 128]
    - [1, 2571.88]
  - - [3584, 4288, 1, 3328, 3584, 3584, 3328, 3328]
    - [5, 6402.57]
  - - [3584, 128, 1, 1792, 3584, 3584, 1792, 1792]
    - [10, 4065.15]
  - - [3584, 256, 1, 128, 3584, 3584, 128, 128]
    - [4, 1730.8]
  - - [704, 4, 1, 3328, 704, 704, 3328, 3328]
    - [24, 205.049]
  - - [5056, 4288, 1, 3328, 5056, 5056, 3328, 3328]
    - [5, 6198.64]
  - - [4, 64, 1, 128, 4, 4, 128, 128]
    - [21, 1.51493]
  - - [2368, 2368, 1, 3328, 2368, 2368, 3328, 3328]
    - [10, 5850.42]
  - - [2368, 448, 1, 768, 2368, 2368, 768, 768]
    - [16, 3914.16]
  - - [704, 3584, 1, 128, 704, 704, 128, 128]
    - [1, 2726.63]
  - - [1408, 1856, 1, 256, 1408, 1408, 256, 256]
    - [16, 5557.65]
  - - [4, 2944, 1, 256, 4, 4, 256, 256]
    - [23, 93.1283]
  - - [1024, 4288, 1, 768, 1024, 1024, 768, 768]
    - [16, 5390.0]
  - - [256, 5888, 1, 128, 256, 256, 128, 128]
    - [1, 2028.51]
  - - [704, 128, 1, 1792, 704, 704, 1792, 1792]
    - [9, 1833.42]
  - - [3584, 704, 1, 768, 3584, 3584, 768, 768]
    - [16, 5749.3]
  - - [256, 64, 1, 768, 256, 256, 768, 768]
    - [13, 353.885]
  - - [704, 6784, 1, 768, 704, 704, 768, 768]
    - [5, 5559.2]
  - - [5056, 4288, 1, 768, 5056, 5056, 768, 768]
    - [5, 6074.66]
  - - [2368, 3584, 1, 3328, 2368, 2368, 3328, 3328]
    - [5, 5860.61]
  - - [5056, 2368, 1, 3328, 5056, 5056, 3328, 3328]
    - [5, 6221.15]
  - - [2944, 6784, 1, 128, 2944, 2944, 128, 128]
    - [1, 3361.36]
  - - [5056, 3584, 1, 1792, 5056, 5056, 1792, 1792]
    - [5, 6281.4]
  - - [704, 6784, 1, 1792, 704, 704, 1792, 1792]
    - [5, 5750.11]
  - - [704, 4, 1, 256, 704, 704, 256, 256]
    - [24, 28.878]
  - - [128, 2944, 1, 256, 128, 128, 256, 256]
    - [13, 2881.18]
  - - [1408, 2368, 1, 3328, 1408, 1408, 3328, 3328]
    - [10, 5404.96]
  - - [448, 2368, 1, 128, 448, 448, 128, 128]
    - [1, 1778.02]
  - - [3584, 704, 1, 3328, 3584, 3584, 3328, 3328]
    - [5, 4987.98]
  - - [2944, 4, 1, 256, 2944, 2944, 256, 256]
    - [23, 94.2065]
  - - [4, 3584, 1, 256, 4, 4, 256, 256]
    - [23, 111.838]
  - - [1024, 2368, 1, 768, 1024, 1024, 768, 768]
    - [16, 5256.14]
  - - [256, 1856, 1, 1792, 256, 256, 1792, 1792]
    - [10, 4184.29]
  - - [2368, 4288, 1, 1792, 2368, 2368, 1792, 1792]
    - [10, 5856.51]
  - - [704, 128, 1, 768, 704, 704, 768, 768]
    - [9, 1821.16]
  - - [6784, 2368, 1, 1792, 6784, 6784, 1792, 1792]
    - [5, 6226.45]
  - - [704, 1408, 1, 128, 704, 704, 128, 128]
    - [1, 2003.28]
  - - [5056, 256, 1, 3328, 5056, 5056, 3328, 3328]
    - [16, 4885.38]
  - - [5888, 1856, 1, 256, 5888, 5888, 256, 256]
    - [16, 5698.93]
  - - [5888, 5056, 1, 256, 5888, 5888, 256, 256]
    - [5, 5955.88]
  - - [4, 1856, 1, 256, 4, 4, 256, 256]
    - [23, 66.8147]
  - - [5888, 4288, 1, 768, 5888, 5888, 768, 768]
    - [5, 6187.37]
  - - [4, 2944, 1, 768, 4, 4, 768, 768]
    - [23, 208.704]
  - - [5056, 6784, 1, 3328, 5056, 5056, 3328, 3328]
    - [5, 6371.21]
  - - [64, 1856, 1, 768, 64, 64, 768, 768]
    - [13, 1891.76]
  - - [2368, 2944, 1, 128, 2368, 2368, 128, 128]
    - [1, 3145.25]
  - - [5056, 1856, 1, 1792, 5056, 5056, 1792, 1792]
    - [5, 5788.44]
  - - [1408, 448, 1, 256, 1408, 1408, 256, 256]
    - [13, 3323.09]
  - - [4288, 128, 1, 3328, 4288, 4288, 3328, 3328]
    - [7, 3727.71]
  - - [1024, 2944, 1, 256, 1024, 1024, 256, 256]
    - [16, 5206.61]
  - - [5056, 5056, 1, 1792, 5056, 5056, 1792, 1792]
    - [5, 6399.3]
  - - [448, 448, 1, 128, 448, 448, 128, 128]
    - [0, 875.779]
  - - [256, 4, 1, 256, 256, 256, 256, 256]
    - [23, 12.6386]
  - - [256, 1856, 1, 768, 256, 256, 768, 768]
    - [10, 3809.82]
  - - [1408, 3584, 1, 1792, 1408, 1408, 1792, 1792]
    - [5, 6103.53]
  - - [5888, 2368, 1, 128, 5888, 5888, 128, 128]
    - [1, 2988.42]
  - - [64, 448, 1, 1792, 64, 64, 1792, 1792]
    - [15, 841.767]
  - - [3584, 4, 1, 256, 3584, 3584, 256, 256]
    - [23, 111.586]
  - - [64, 5888, 1, 128, 64, 64, 128, 128]
    - [0, 1169.04]
  - - [4288, 256, 1, 1792, 4288, 4288, 1792, 1792]
    - [16, 4140.91]
  - - [6784, 3584, 1, 3328, 6784, 6784, 3328, 3328]
    - [5, 6373.69]
  - - [3584, 64, 1, 128, 3584, 3584, 128, 128]
    - [0, 824.017]
  - - [1408, 1408, 1, 1792, 1408, 1408, 1792, 1792]
    - [5, 5687.7]
  - - [1408, 1408, 1, 768, 1408, 1408, 768, 768]
    - [16, 5547.57]
  - - [64, 1856, 1, 1792, 64, 64, 1792, 1792]
    - [14, 2099.02]
  - - [64, 5056, 1, 3328, 64, 64, 3328, 3328]
    - [17, 3391.1]
  - - [128, 64, 1, 1792, 128, 128, 1792, 1792]
    - [11, 302.099]
  - - [6784, 5056, 1, 3328, 6784, 6784, 3328, 3328]
    - [5, 6365.84]
  - - [704, 3584, 1, 3328, 704, 704, 3328, 3328]
    - [10, 5665.3]
  - - [1408, 256, 1, 256, 1408, 1408, 256, 256]
    - [13, 2896.94]
  - - [448, 1856, 1, 3328, 448, 448, 3328, 3328]
    - [16, 4480.78]
  - - [3584, 1408, 1, 128, 3584, 3584, 128, 128]
    - [1, 2736.9]
  - - [1856, 4, 1, 128, 1856, 1856, 128, 128]
    - [21, 43.1932]
  - - [2368, 704, 1, 3328, 2368, 2368, 3328, 3328]
    - [5, 4828.61]
  - - [128, 64, 1, 3328, 128, 128, 3328, 3328]
    - [11, 496.684]
  - - [448, 704, 1, 128, 448, 448, 128, 128]
    - [0, 1112.22]
  - - [4, 128, 1, 128, 4, 4, 128, 128]
    - [21, 3.09344]
  - - [704, 5056, 1, 3328, 704, 704, 3328, 3328]
    - [10, 5772.66]
  - - [5056, 448, 1, 3328, 5056, 5056, 3328, 3328]
    - [10, 5070.69]
  - - [4, 1856, 1, 768, 4, 4, 768, 768]
    - [23, 160.021]
  - - [256, 4, 1, 128, 256, 256, 128, 128]
    - [21, 6.41096]
  - - [6784, 1024, 1, 128, 6784, 6784, 128, 128]
    - [1, 2976.41]
  - - [3584, 64, 1, 3328, 3584, 3584, 3328, 3328]
    - [9, 3671.24]
  - - [2368, 5888, 1, 3328, 2368, 2368, 3328, 3328]
    - [5, 6240.36]
  - - [5888, 256, 1, 1792, 5888, 5888, 1792, 1792]
    - [16, 5629.84]
  - - [128, 128, 1, 3328, 128, 128, 3328, 3328]
    - [15, 819.693]
  - - [4288, 5888, 1, 768, 4288, 4288, 768, 768]
    - [5, 6232.15]
  - - [128, 4, 1, 768, 128, 128, 768, 768]
    - [24, 18.7572]
  - - [1856, 3584, 1, 128, 1856, 1856, 128, 128]
    - [1, 3137.93]
  - - [4288, 4288, 1, 768, 4288, 4288, 768, 768]
    - [5, 5958.91]
  - - [256, 6784, 1, 1792, 256, 256, 1792, 1792]
    - [5, 4954.41]
  - - [4288, 4288, 1, 1792, 4288, 4288, 1792, 1792]
    - [5, 6050.89]
  - - [4, 704, 1, 3328, 4, 4, 3328, 3328]
    - [24, 197.988]
  - - [6784, 1856, 1, 1792, 6784, 6784, 1792, 1792]
    - [5, 5991.29]
  - - [256, 5888, 1, 256, 256, 256, 256, 256]
    - [10, 4486.83]
  - - [5056, 128, 1, 768, 5056, 5056, 768, 768]
    - [9, 3860.58]
  - - [1408, 1856, 1, 128, 1408, 1408, 128, 128]
    - [2, 2459.47]
  - - [1408, 64, 1, 256, 1408, 1408, 256, 256]
    - [13, 1377.93]
  - - [6784, 5056, 1, 768, 6784, 6784, 768, 768]
    - [5, 6233.8]
  - - [5056, 128, 1, 1792, 5056, 5056, 1792, 1792]
    - [13, 4071.76]
  - - [128, 4, 1, 256, 128, 128, 256, 256]
    - [24, 7.16358]
  - - [704, 2368, 1, 768, 704, 704, 768, 768]
    - [16, 4642.44]
  - - [704, 2944, 1, 128, 704, 704, 128, 128]
    - [1, 2600.83]
  - - [1024, 256, 1, 128, 1024, 1024, 128, 128]
    - [0, 1053.43]
  - - [5056, 5056, 1, 256, 5056, 5056, 256, 256]
    - [16, 5934.72]
  - - [4288, 1408, 1, 3328, 4288, 4288, 3328, 3328]
    - [5, 6165.26]
  - - [1024, 64, 1, 256, 1024, 1024, 256, 256]
    - [9, 993.352]
  - - [2368, 1408, 1, 3328, 2368, 2368, 3328, 3328]
    - [10, 5421.39]
  - - [1408, 5888, 1, 3328, 1408, 1408, 3328, 3328]
    - [5, 6418.6]
  - - [128, 448, 1, 128, 128, 128, 128, 128]
    - [0, 255.385]
  - - [2368, 4, 1, 128, 2368, 2368, 128, 128]
    - [21, 55.1086]
  - - [6784, 5888, 1, 128, 6784, 6784, 128, 128]
    - [1, 3475.43]
  - - [2368, 1024, 1, 128, 2368, 2368, 128, 128]
    - [1, 2680.75]
  - - [2944, 256, 1, 768, 2944, 2944, 768, 768]
    - [9, 4038.15]
  - - [2944, 704, 1, 128, 2944, 2944, 128, 128]
    - [3, 2342.27]
  - - [4, 1024, 1, 768, 4, 4, 768, 768]
    - [24, 98.0741]
  - - [256, 3584, 1, 768, 256, 256, 768, 768]
    - [10, 4595.39]
  - - [704, 2944, 1, 768, 704, 704, 768, 768]
    - [10, 5531.02]
  - - [5888, 4288, 1, 128, 5888, 5888, 128, 128]
    - [1, 3144.07]
  - - [5056, 6784, 1, 256, 5056, 5056, 256, 256]
    - [16, 5977.7]
  - - [1024, 448, 1, 1792, 1024, 1024, 1792, 1792]
    - [10, 4038.53]
  - - [4, 5888, 1, 3328, 4, 4, 3328, 3328]
    - [24, 293.515]
  - - [3584, 3584, 1, 1792, 3584, 3584, 1792, 1792]
    - [5, 6126.71]
  - - [5888, 64, 1, 256, 5888, 5888, 256, 256]
    - [9, 2718.81]
  - - [5888, 4, 1, 256, 5888, 5888, 256, 256]
    - [22, 170.281]
  - - [6784, 4, 1, 256, 6784, 6784, 256, 256]
    - [22, 182.099]
  - - [2944, 64, 1, 768, 2944, 2944, 768, 768]
    - [9, 2766.93]
  - - [256, 4288, 1, 1792, 256, 256, 1792, 1792]
    - [9, 4108.87]
  - - [448, 2368, 1, 1792, 448, 448, 1792, 1792]
    - [9, 4020.03]
  - - [256, 4, 1, 768, 256, 256, 768, 768]
    - [24, 33.1772]
  - - [448, 3584, 1, 256, 448, 448, 256, 256]
    - [10, 4012.24]
  - - [448, 1024, 1, 768, 448, 448, 768, 768]
    - [10, 3798.92]
  - - [5888, 1856, 1, 768, 5888, 5888, 768, 768]
    - [5, 5987.12]
  - - [1408, 4, 1, 1792, 1408, 1408, 1792, 1792]
    - [24, 244.608]
  - - [4288, 6784, 1, 128, 4288, 4288, 128, 128]
    - [3, 3394.06]
  - - [64, 5056, 1, 768, 64, 64, 768, 768]
    - [10, 2464.99]
  - - [3584, 704, 1, 128, 3584, 3584, 128, 128]
    - [2, 2311.71]
  - - [1856, 4, 1, 1792, 1856, 1856, 1792, 1792]
    - [23, 263.337]
  - - [128, 1024, 1, 256, 128, 128, 256, 256]
    - [13, 1978.04]
  - - [1024, 3584, 1, 768, 1024, 1024, 768, 768]
    - [10, 5483.49]
  - - [1024, 256, 1, 768, 1024, 1024, 768, 768]
    - [13, 3738.45]
  - - [4288, 1856, 1, 256, 4288, 4288, 256, 256]
    - [16, 5672.1]
  - - [6784, 256, 1, 1792, 6784, 6784, 1792, 1792]
    - [5, 4980.84]
  - - [1024, 704, 1, 1792, 1024, 1024, 1792, 1792]
    - [9, 4004.48]
  - - [448, 2368, 1, 768, 448, 448, 768, 768]
    - [9, 3904.44]
  - - [2368, 1408, 1, 1792, 2368, 2368, 1792, 1792]
    - [16, 5545.4]
  - - [2944, 1024, 1, 128, 2944, 2944, 128, 128]
    - [1, 2784.19]
  - - [4288, 448, 1, 256, 4288, 4288, 256, 256]
    - [16, 4995.43]
  - - [256, 3584, 1, 128, 256, 256, 128, 128]
    - [4, 1661.85]
  - - [128, 4, 1, 1792, 128, 128, 1792, 1792]
    - [24, 33.385]
  - - [64, 5888, 1, 3328, 64, 64, 3328, 3328]
    - [7, 3614.42]
  - - [704, 64, 1, 3328, 704, 704, 3328, 3328]
    - [15, 1641.71]
  - - [2944, 1408, 1, 256, 2944, 2944, 256, 256]
    - [16, 5668.9]
  - - [1408, 3584, 1, 3328, 1408, 1408, 3328, 3328]
    - [5, 6160.7]
  - - [1856, 1408, 1, 128, 1856, 1856, 128, 128]
    - [1, 2755.09]
  - - [1856, 256, 1, 1792, 1856, 1856, 1792, 1792]
    - [10, 4242.98]
  - - [5888, 6784, 1, 256, 5888, 5888, 256, 256]
    - [5, 6086.06]
  - - [3584, 1856, 1, 3328, 3584, 3584, 3328, 3328]
    - [5, 5852.46]
  - - [5056, 256, 1, 1792, 5056, 5056, 1792, 1792]
    - [16, 4806.86]
  - - [448, 128, 1, 1792, 448, 448, 1792, 1792]
    - [14, 1445.04]
  - - [4, 128, 1, 768, 4, 4, 768, 768]
    - [24, 17.0135]
  - - [1856, 5888, 1, 128, 1856, 1856, 128, 128]
    - [1, 3334.52]
  - - [3584, 128, 1, 256, 3584, 3584, 256, 256]
    - [16, 3060.62]
  - - [4, 4, 1, 768, 4, 4, 768, 768]
    - [24, 0.605425]
  - - [1408, 2368, 1, 256, 1408, 1408, 256, 256]
    - [16, 5280.73]
  - - [4288, 4, 1, 3328, 4288, 4288, 3328, 3328]
    - [24, 160.975]
  - - [4, 4, 1, 3328, 4, 4, 3328, 3328]
    - [24, 1.50699]
  - - [256, 1408, 1, 1792, 256, 256, 1792, 1792]
    - [13, 3492.1]
  - - [256, 64, 1, 1792, 256, 256, 1792, 1792]
    - [15, 555.117]
  - - [1408, 256, 1, 768, 1408, 1408, 768, 768]
    - [9, 3412.82]
  - - [1856, 64, 1, 768, 1856, 1856, 768, 768]
    - [13, 2141.78]
  - - [128, 1856, 1, 768, 128, 128, 768, 768]
    - [13, 3360.23]
  - - [704, 256, 1, 256, 704, 704, 256, 256]
    - [9, 2035.44]
  - - [3584, 5888, 1, 256, 3584, 3584, 256, 256]
    - [16, 5863.87]
  - - [3584, 1024, 1, 128, 3584, 3584, 128, 128]
    - [1, 2570.59]
  - - [1856, 4288, 1, 1792, 1856, 1856, 1792, 1792]
    - [5, 6106.2]
  - - [128, 256, 1, 3328, 128, 128, 3328, 3328]
    - [15, 1490.04]
  - - [1408, 6784, 1, 3328, 1408, 1408, 3328, 3328]
    - [5, 5954.45]
  - - [448, 5888, 1, 1792, 448, 448, 1792, 1792]
    - [16, 5213.04]
  - - [448, 6784, 1, 3328, 448, 448, 3328, 3328]
    - [10, 5727.02]
  - - [5888, 2944, 1, 1792, 5888, 5888, 1792, 1792]
    - [5, 6342.51]
  - - [704, 5888, 1, 256, 704, 704, 256, 256]
    - [10, 5411.91]
  - - [5888, 2368, 1, 1792, 5888, 5888, 1792, 1792]
    - [5, 6162.91]
  - - [4, 5888, 1, 768, 4, 4, 768, 768]
    - [23, 277.48]
  - - [2368, 64, 1, 128, 2368, 2368, 128, 128]
    - [0, 559.563]
  - - [64, 128, 1, 768, 64, 64, 768, 768]
    - [13, 176.209]
  - - [128, 1024, 1, 1792, 128, 128, 1792, 1792]
    - [18, 2477.2]
  - - [1408, 4288, 1, 768, 1408, 1408, 768, 768]
    - [5, 5937.72]
  - - [2368, 256, 1, 3328, 2368, 2368, 3328, 3328]
    - [7, 4046.22]
  - - [256, 6784, 1, 128, 256, 256, 128, 128]
    - [2, 2034.55]
  - - [5888, 64, 1, 768, 5888, 5888, 768, 768]
    - [13, 3280.37]
  - - [704, 256, 1, 3328, 704, 704, 3328, 3328]
    - [17, 3079.85]
  - - [128, 1408, 1, 128, 128, 128, 128, 128]
    - [0, 719.222]
  - - [5888, 4288, 1, 256, 5888, 5888, 256, 256]
    - [5, 5811.91]
  - - [1856, 5888, 1, 1792, 1856, 1856, 1792, 1792]
    - [5, 6140.65]
  - - [1408, 2944, 1, 768, 1408, 1408, 768, 768]
    - [5, 6034.25]
  - - [6784, 6784, 1, 128, 6784, 6784, 128, 128]
    - [1, 3497.31]
  - - [5888, 5056, 1, 1792, 5888, 5888, 1792, 1792]
    - [5, 6416.71]
  - - [1856, 6784, 1, 768, 1856, 1856, 768, 768]
    - [16, 5940.46]
  - - [2944, 5056, 1, 768, 2944, 2944, 768, 768]
    - [5, 6047.61]
  - - [1408, 5056, 1, 1792, 1408, 1408, 1792, 1792]
    - [5, 6203.95]
  - - [1408, 704, 1, 128, 1408, 1408, 128, 128]
    - [2, 1894.71]
  - - [1024, 5056, 1, 1792, 1024, 1024, 1792, 1792]
    - [5, 6217.61]
  - - [1408, 6784, 1, 768, 1408, 1408, 768, 768]
    - [16, 6051.8]
  - - [4288, 3584, 1, 256, 4288, 4288, 256, 256]
    - [16, 5954.85]
  - - [3584, 256, 1, 768, 3584, 3584, 768, 768]
    - [16, 4669.84]
  - - [4, 448, 1, 768, 4, 4, 768, 768]
    - [24, 49.5439]
  - - [128, 64, 1, 128, 128, 128, 128, 128]
    - [0, 34.9514]
  - - [2368, 64, 1, 256, 2368, 2368, 256, 256]
    - [9, 1793.68]
  - - [6784, 6784, 1, 256, 6784, 6784, 256, 256]
    - [5, 6195.25]
  - - [5056, 1024, 1, 128, 5056, 5056, 128, 128]
    - [1, 3166.82]
  - - [256, 1408, 1, 128, 256, 256, 128, 128]
    - [2, 987.064]
  - - [5056, 4, 1, 3328, 5056, 5056, 3328, 3328]
    - [24, 160.361]
  - - [128, 4288, 1, 3328, 128, 128, 3328, 3328]
    - [7, 3567.02]
  - - [6784, 6784, 1, 1792, 6784, 6784, 1792, 1792]
    - [5, 6560.61]
  - - [64, 256, 1, 3328, 64, 64, 3328, 3328]
    - [15, 800.093]
  - - [128, 2368, 1, 768, 128, 128, 768, 768]
    - [13, 2704.4]
  - - [256, 1408, 1, 3328, 256, 256, 3328, 3328]
    - [9, 3505.92]
  - - [5888, 2368, 1, 3328, 5888, 5888, 3328, 3328]
    - [5, 6217.88]
  - - [704, 64, 1, 768, 704, 704, 768, 768]
    - [9, 943.697]
  - - [1024, 1856, 1, 1792, 1024, 1024, 1792, 1792]
    - [16, 5432.7]
  - - [448, 128, 1, 3328, 448, 448, 3328, 3328]
    - [12, 1935.6]
  - - [6784, 128, 1, 256, 6784, 6784, 256, 256]
    - [10, 3927.94]
  - - [256, 5056, 1, 768, 256, 256, 768, 768]
    - [10, 4415.72]
  - - [4288, 5056, 1, 3328, 4288, 4288, 3328, 3328]
    - [5, 6197.49]
  - - [64, 2368, 1, 3328, 64, 64, 3328, 3328]
    - [17, 2614.74]
  - - [3584, 448, 1, 768, 3584, 3584, 768, 768]
    - [16, 4527.28]
  - - [5056, 704, 1, 128, 5056, 5056, 128, 128]
    - [1, 2760.56]
  - - [2944, 448, 1, 3328, 2944, 2944, 3328, 3328]
    - [16, 4890.22]
  - - [448, 5888, 1, 768, 448, 448, 768, 768]
    - [16, 5018.97]
  - - [6784, 1024, 1, 1792, 6784, 6784, 1792, 1792]
    - [5, 6062.76]
  - - [5056, 2368, 1, 1792, 5056, 5056, 1792, 1792]
    - [5, 6182.31]
  - - [6784, 4, 1, 128, 6784, 6784, 128, 128]
    - [21, 135.128]
  - - [5056, 6784, 1, 1792, 5056, 5056, 1792, 1792]
    - [5, 6333.65]
  - - [2368, 1856, 1, 768, 2368, 2368, 768, 768]
    - [16, 5548.76]
  - - [1408, 704, 1, 1792, 1408, 1408, 1792, 1792]
    - [16, 5309.86]
  - - [6784, 704, 1, 3328, 6784, 6784, 3328, 3328]
    - [5, 5814.39]
  - - [256, 1408, 1, 256, 256, 256, 256, 256]
    - [13, 2890.22]
  - - [4, 5888, 1, 1792, 4, 4, 1792, 1792]
    - [24, 342.197]
  - - [64, 448, 1, 768, 64, 64, 768, 768]
    - [9, 619.299]
  - - [1408, 64, 1, 128, 1408, 1408, 128, 128]
    - [0, 379.781]
  - - [1408, 4, 1, 768, 1408, 1408, 768, 768]
    - [24, 137.39]
  - - [4, 2368, 1, 128, 4, 4, 128, 128]
    - [21, 55.1086]
  - - [64, 5888, 1, 256, 64, 64, 256, 256]
    - [13, 1937.95]
  - - [2944, 1024, 1, 768, 2944, 2944, 768, 768]
    - [16, 5825.77]
  - - [3584, 64, 1, 1792, 3584, 3584, 1792, 1792]
    - [9, 3589.23]
  - - [2944, 5888, 1, 3328, 2944, 2944, 3328, 3328]
    - [5, 6399.94]
  - - [4288, 5056, 1, 256, 4288, 4288, 256, 256]
    - [16, 6022.9]
  - - [128, 2944, 1, 1792, 128, 128, 1792, 1792]
    - [13, 3495.44]
  - - [5888, 1024, 1, 3328, 5888, 5888, 3328, 3328]
    - [5, 6167.83]
  - - [448, 256, 1, 1792, 448, 448, 1792, 1792]
    - [9, 2306.3]
  - - [3584, 2944, 1, 3328, 3584, 3584, 3328, 3328]
    - [5, 5980.04]
  - - [5056, 1024, 1, 1792, 5056, 5056, 1792, 1792]
    - [5, 6238.67]
  - - [1024, 4288, 1, 3328, 1024, 1024, 3328, 3328]
    - [16, 5598.71]
  - - [2944, 704, 1, 3328, 2944, 2944, 3328, 3328]
    - [20, 4681.01]
  - - [6784, 1408, 1, 128, 6784, 6784, 128, 128]
    - [1, 3236.33]
  - - [1408, 1856, 1, 1792, 1408, 1408, 1792, 1792]
    - [5, 5114.33]
  - - [5056, 4288, 1, 256, 5056, 5056, 256, 256]
    - [16, 5959.19]
  - - [448, 64, 1, 3328, 448, 448, 3328, 3328]
    - [15, 1310.42]
  - - [256, 448, 1, 128, 256, 256, 128, 128]
    - [0, 489.327]
  - - [5888, 128, 1, 3328, 5888, 5888, 3328, 3328]
    - [9, 4279.55]
  - - [448, 448, 1, 1792, 448, 448, 1792, 1792]
    - [9, 3185.92]
  - - [1856, 2944, 1, 3328, 1856, 1856, 3328, 3328]
    - [10, 5712.25]
  - - [3584, 1408, 1, 3328, 3584, 3584, 3328, 3328]
    - [5, 6151.84]
  - - [2368, 448, 1, 256, 2368, 2368, 256, 256]
    - [16, 3562.94]
  - - [1024, 3584, 1, 3328, 1024, 1024, 3328, 3328]
    - [10, 5884.26]
  - - [1408, 1024, 1, 768, 1408, 1408, 768, 768]
    - [16, 5348.19]
  - - [64, 5056, 1, 1792, 64, 64, 1792, 1792]
    - [7, 2886.42]
  - - [1408, 448, 1, 3328, 1408, 1408, 3328, 3328]
    - [13, 4137.72]
  - - [6784, 4288, 1, 3328, 6784, 6784, 3328, 3328]
    - [5, 6317.97]
  - - [1024, 5888, 1, 128, 1024, 1024, 128, 128]
    - [3, 2495.65]
  - - [1856, 2368, 1, 128, 1856, 1856, 128, 128]
    - [1, 2975.87]
  - - [6784, 3584, 1, 128, 6784, 6784, 128, 128]
    - [1, 3430.79]
  - - [704, 1408, 1, 3328, 704, 704, 3328, 3328]
    - [10, 5326.92]
  - - [64, 2368, 1, 1792, 64, 64, 1792, 1792]
    - [9, 2339.66]
  - - [4288, 1408, 1, 1792, 4288, 4288, 1792, 1792]
    - [5, 6113.69]
  - - [704, 256, 1, 128, 704, 704, 128, 128]
    - [0, 802.64]
  - - [256, 448, 1, 1792, 256, 256, 1792, 1792]
    - [13, 2321.73]
  - - [704, 2368, 1, 1792, 704, 704, 1792, 1792]
    - [5, 4755.21]
  - - [1024, 4, 1, 1792, 1024, 1024, 1792, 1792]
    - [24, 195.058]
  - - [5888, 4, 1, 128, 5888, 5888, 128, 128]
    - [21, 117.963]
  - - [704, 3584, 1, 768, 704, 704, 768, 768]
    - [10, 5448.72]
- null
