lib/configs/lite_configs_mixed/vega10_Cijk_Ailk_Bljk_SB.yaml
- {MinimumRequiredVersion: 4.9.4}
- vega10
- gfx900
- [Device 6863, Device 6862, Device 687f, Device 6860, Device 6861, 'Vega 10 XTX [Radeon
    SolutionIndex: 0
    SolutionNameMin: Cijk_Ailk_Bljk_SB_MT128x64x16_SE_GSU1
    SolutionIndex: 1
    SolutionNameMin: Cijk_Ailk_Bljk_SB_MT32x32x8_SE_GSU1
    SolutionIndex: 2
    SolutionNameMin: Cijk_Ailk_Bljk_SB_MT64x128x16_SE_GSU1
    SolutionIndex: 3
    SolutionNameMin: Cijk_Ailk_Bljk_SB_MT64x32x32_SE_GSU1
    SolutionIndex: 4
    SolutionNameMin: Cijk_Ailk_Bljk_SB_MT32x64x8_SE_GSU1
    SolutionIndex: 5
    SolutionNameMin: Cijk_Ailk_Bljk_SB_MT64x32x16_SE_GSU1
    SolutionIndex: 6
    SolutionNameMin: Cijk_Ailk_Bljk_SB_MT32x32x8_SE_GSU1
    SolutionIndex: 7
    SolutionNameMin: Cijk_Ailk_Bljk_SB_MT64x128x16_SE_GSU1
    SolutionIndex: 8
    SolutionNameMin: Cijk_Ailk_Bljk_SB_MT32x32x8_SE_GSU4
    SolutionIndex: 9
    SolutionNameMin: Cijk_Ailk_Bljk_SB_MT32x32x8_SE_GSU8
    SolutionIndex: 10
    SolutionNameMin: Cijk_Ailk_Bljk_SB_MT64x32x16_SE_GSU4
    SolutionIndex: 11
    SolutionNameMin: Cijk_Ailk_Bljk_SB_MT64x64x16_SE_GSU1
    SolutionIndex: 12
    SolutionNameMin: Cijk_Ailk_Bljk_SB_MT64x64x16_SE_GSU2
    SolutionIndex: 13
    SolutionNameMin: Cijk_Ailk_Bljk_SB_MT128x64x8_SE_GSU1
    SolutionIndex: 14
    SolutionNameMin: Cijk_Ailk_Bljk_SB_MT32x64x8_SE_GSU4
    SolutionIndex: 15
    SolutionNameMin: Cijk_Ailk_Bljk_SB_MT64x64x16_SE_GSU4
    SolutionIndex: 16
    SolutionNameMin: Cijk_Ailk_Bljk_SB_MT64x128x16_SE_GSU4
    SolutionIndex: 17
    SolutionNameMin: Cijk_Ailk_Bljk_SB_MT16x16x4_SE_GSU1
    SolutionIndex: 18
    SolutionNameMin: Cijk_Ailk_Bljk_SB_MT8x8x8_SE_GSU2
    SolutionIndex: 19
    SolutionNameMin: Cijk_Ailk_Bljk_SB_MT8x8x8_SE_GSU4
    SolutionIndex: 20
    SolutionNameMin: Cijk_Ailk_Bljk_SB_MT8x8x8_SE_GSU8
- - - [4, 2368, 1, 256, 4, 4, 4, 256]
    - [19, 79.8404]
  - - [2368, 4288, 1, 768, 2368, 2368, 2368, 768]
    - [13, 6401.2]
  - - [5888, 1856, 1, 768, 5888, 5888, 5888, 768]
    - [13, 6526.89]
  - - [256, 6784, 1, 256, 256, 256, 256, 256]
    - [13, 4543.44]
  - - [3584, 2944, 1, 1792, 3584, 3584, 3584, 1792]
    - [13, 6399.03]
  - - [5056, 64, 1, 1792, 5056, 5056, 5056, 1792]
    - [5, 3442.37]
  - - [5888, 1856, 1, 128, 5888, 5888, 5888, 128]
    - [0, 2933.11]
  - - [1408, 704, 1, 1792, 1408, 1408, 1408, 1792]
    - [13, 5419.06]
  - - [704, 1408, 1, 256, 704, 704, 704, 256]
    - [7, 4567.48]
  - - [4288, 704, 1, 1792, 4288, 4288, 4288, 1792]
    - [13, 6124.45]
  - - [2368, 5888, 1, 256, 2368, 2368, 2368, 256]
    - [13, 6142.15]
  - - [128, 128, 1, 3328, 128, 128, 128, 3328]
    - [9, 734.618]
  - - [6784, 64, 1, 256, 6784, 6784, 6784, 256]
    - [13, 3031.23]
  - - [1024, 5888, 1, 768, 1024, 1024, 1024, 768]
    - [13, 6141.73]
  - - [256, 1024, 1, 256, 256, 256, 256, 256]
    - [5, 3201.22]
  - - [128, 2944, 1, 128, 128, 128, 128, 128]
    - [1, 1098.06]
  - - [1024, 2368, 1, 256, 1024, 1024, 1024, 256]
    - [13, 5156.95]
  - - [1856, 5056, 1, 256, 1856, 1856, 1856, 256]
    - [13, 5973.5]
  - - [4, 2944, 1, 128, 4, 4, 4, 128]
    - [17, 64.1908]
  - - [128, 3584, 1, 1792, 128, 128, 128, 1792]
    - [7, 4101.21]
  - - [1024, 2368, 1, 3328, 1024, 1024, 1024, 3328]
    - [13, 5860.47]
  - - [64, 5056, 1, 256, 64, 64, 64, 256]
    - [7, 1876.32]
  - - [4, 256, 1, 3328, 4, 4, 4, 3328]
    - [20, 85.8298]
  - - [1024, 4, 1, 1792, 1024, 1024, 1024, 1792]
    - [20, 160.077]
  - - [448, 3584, 1, 256, 448, 448, 448, 256]
    - [7, 4053.29]
  - - [5056, 2368, 1, 768, 5056, 5056, 5056, 768]
    - [13, 6304.81]
  - - [5888, 1024, 1, 256, 5888, 5888, 5888, 256]
    - [13, 5882.78]
  - - [64, 4288, 1, 256, 64, 64, 64, 256]
    - [6, 1693.6]
  - - [256, 1408, 1, 1792, 256, 256, 256, 1792]
    - [5, 3974.36]
  - - [4, 4288, 1, 256, 4, 4, 4, 256]
    - [19, 118.79]
  - - [2944, 704, 1, 768, 2944, 2944, 2944, 768]
    - [13, 6002.23]
  - - [128, 5888, 1, 768, 128, 128, 128, 768]
    - [5, 4149.67]
  - - [5056, 704, 1, 768, 5056, 5056, 5056, 768]
    - [13, 6124.0]
  - - [448, 128, 1, 768, 448, 448, 448, 768]
    - [5, 1333.04]
  - - [5888, 64, 1, 128, 5888, 5888, 5888, 128]
    - [1, 1173.25]
  - - [5056, 5888, 1, 128, 5056, 5056, 5056, 128]
    - [1, 3330.59]
  - - [4288, 5056, 1, 256, 4288, 4288, 4288, 256]
    - [13, 6358.72]
  - - [4288, 1856, 1, 256, 4288, 4288, 4288, 256]
    - [13, 6000.01]
  - - [2944, 128, 1, 256, 2944, 2944, 2944, 256]
    - [5, 3057.02]
  - - [1024, 3584, 1, 128, 1024, 1024, 1024, 128]
    - [0, 2162.17]
  - - [1856, 64, 1, 768, 1856, 1856, 1856, 768]
    - [5, 2438.65]
  - - [6784, 5056, 1, 128, 6784, 6784, 6784, 128]
    - [0, 3257.78]
  - - [6784, 2368, 1, 128, 6784, 6784, 6784, 128]
    - [0, 3165.56]
  - - [1856, 1024, 1, 768, 1856, 1856, 1856, 768]
    - [13, 5490.22]
  - - [1024, 6784, 1, 1792, 1024, 1024, 1024, 1792]
    - [13, 6245.72]
  - - [4, 448, 1, 768, 4, 4, 4, 768]
    - [20, 48.2575]
  - - [4288, 6784, 1, 256, 4288, 4288, 4288, 256]
    - [13, 6359.56]
  - - [128, 3584, 1, 256, 128, 128, 128, 256]
    - [5, 2985.69]
  - - [3584, 2368, 1, 3328, 3584, 3584, 3584, 3328]
    - [13, 6359.09]
  - - [3584, 704, 1, 3328, 3584, 3584, 3584, 3328]
    - [13, 6138.68]
  - - [4, 256, 1, 1792, 4, 4, 4, 1792]
    - [20, 59.9813]
  - - [448, 3584, 1, 1792, 448, 448, 448, 1792]
    - [5, 4719.06]
  - - [4, 6784, 1, 1792, 4, 4, 4, 1792]
    - [20, 387.291]
  - - [2368, 64, 1, 768, 2368, 2368, 2368, 768]
    - [5, 2478.32]
  - - [448, 6784, 1, 1792, 448, 448, 448, 1792]
    - [7, 5763.83]
  - - [1024, 1856, 1, 768, 1024, 1024, 1024, 768]
    - [13, 5428.2]
  - - [5888, 1408, 1, 256, 5888, 5888, 5888, 256]
    - [13, 6160.1]
  - - [1408, 6784, 1, 3328, 1408, 1408, 1408, 3328]
    - [13, 6436.24]
  - - [2368, 2368, 1, 768, 2368, 2368, 2368, 768]
    - [13, 6282.98]
  - - [704, 128, 1, 128, 704, 704, 704, 128]
    - [1, 391.233]
  - - [1024, 448, 1, 3328, 1024, 1024, 1024, 3328]
    - [7, 4174.67]
  - - [5056, 4, 1, 128, 5056, 5056, 5056, 128]
    - [17, 95.4824]
  - - [1408, 448, 1, 3328, 1408, 1408, 1408, 3328]
    - [5, 4601.27]
  - - [3584, 1856, 1, 1792, 3584, 3584, 3584, 1792]
    - [13, 6437.8]
  - - [3584, 1024, 1, 128, 3584, 3584, 3584, 128]
    - [0, 2433.48]
  - - [3584, 4, 1, 256, 3584, 3584, 3584, 256]
    - [18, 119.096]
  - - [6784, 1856, 1, 256, 6784, 6784, 6784, 256]
    - [13, 6150.36]
  - - [1856, 3584, 1, 3328, 1856, 1856, 1856, 3328]
    - [13, 6039.81]
  - - [4288, 1024, 1, 128, 4288, 4288, 4288, 128]
    - [1, 2866.39]
  - - [128, 448, 1, 768, 128, 128, 128, 768]
    - [5, 1318.25]
  - - [128, 448, 1, 128, 128, 128, 128, 128]
    - [1, 252.131]
  - - [6784, 704, 1, 3328, 6784, 6784, 6784, 3328]
    - [13, 6004.26]
  - - [5056, 3584, 1, 3328, 5056, 5056, 5056, 3328]
    - [13, 6665.97]
  - - [4, 4288, 1, 3328, 4, 4, 4, 3328]
    - [20, 273.258]
  - - [2368, 256, 1, 3328, 2368, 2368, 2368, 3328]
    - [5, 4361.1]
  - - [4, 2944, 1, 3328, 4, 4, 4, 3328]
    - [20, 276.56]
  - - [256, 5056, 1, 768, 256, 256, 256, 768]
    - [13, 4823.64]
  - - [4288, 256, 1, 3328, 4288, 4288, 4288, 3328]
    - [5, 4362.46]
  - - [1856, 1856, 1, 1792, 1856, 1856, 1856, 1792]
    - [13, 6053.55]
  - - [1024, 5888, 1, 256, 1024, 1024, 1024, 256]
    - [13, 5789.61]
  - - [5888, 4288, 1, 3328, 5888, 5888, 5888, 3328]
    - [13, 6646.34]
  - - [4288, 3584, 1, 768, 4288, 4288, 4288, 768]
    - [13, 6501.82]
  - - [4288, 5888, 1, 768, 4288, 4288, 4288, 768]
    - [13, 6571.5]
  - - [2944, 4288, 1, 1792, 2944, 2944, 2944, 1792]
    - [13, 6460.4]
  - - [128, 3584, 1, 768, 128, 128, 128, 768]
    - [7, 3712.91]
  - - [704, 2368, 1, 768, 704, 704, 704, 768]
    - [13, 4760.07]
  - - [448, 5888, 1, 3328, 448, 448, 448, 3328]
    - [13, 5374.82]
  - - [128, 1024, 1, 256, 128, 128, 128, 256]
    - [5, 2022.2]
  - - [64, 6784, 1, 3328, 64, 64, 64, 3328]
    - [5, 3821.0]
  - - [4288, 6784, 1, 128, 4288, 4288, 4288, 128]
    - [1, 3365.2]
  - - [2944, 64, 1, 768, 2944, 2944, 2944, 768]
    - [5, 3086.02]
  - - [704, 4288, 1, 768, 704, 704, 704, 768]
    - [7, 5556.13]
  - - [1856, 128, 1, 256, 1856, 1856, 1856, 256]
    - [5, 2963.96]
  - - [6784, 4288, 1, 128, 6784, 6784, 6784, 128]
    - [0, 3258.52]
  - - [1856, 128, 1, 128, 1856, 1856, 1856, 128]
    - [1, 959.129]
  - - [128, 1024, 1, 3328, 128, 128, 128, 3328]
    - [12, 2986.15]
  - - [4, 1024, 1, 3328, 4, 4, 4, 3328]
    - [20, 248.677]
  - - [4288, 6784, 1, 1792, 4288, 4288, 4288, 1792]
    - [13, 6585.91]
  - - [4, 4288, 1, 768, 4, 4, 4, 768]
    - [20, 239.339]
  - - [4, 128, 1, 256, 4, 4, 4, 256]
    - [20, 6.83165]
  - - [128, 5056, 1, 128, 128, 128, 128, 128]
    - [1, 1442.94]
  - - [128, 5888, 1, 1792, 128, 128, 128, 1792]
    - [5, 4486.27]
  - - [256, 1856, 1, 128, 256, 256, 256, 128]
    - [4, 1127.76]
  - - [256, 704, 1, 128, 256, 256, 256, 128]
    - [1, 619.119]
  - - [3584, 1024, 1, 3328, 3584, 3584, 3584, 3328]
    - [13, 6494.0]
  - - [3584, 4, 1, 768, 3584, 3584, 3584, 768]
    - [18, 237.811]
  - - [6784, 2944, 1, 256, 6784, 6784, 6784, 256]
    - [13, 6264.47]
  - - [704, 2944, 1, 128, 704, 704, 704, 128]
    - [2, 2502.67]
  - - [448, 6784, 1, 128, 448, 448, 448, 128]
    - [2, 2669.89]
  - - [4, 4, 1, 256, 4, 4, 4, 256]
    - [20, 0.228489]
  - - [128, 128, 1, 1792, 128, 128, 128, 1792]
    - [8, 514.075]
  - - [5888, 3584, 1, 768, 5888, 5888, 5888, 768]
    - [13, 6528.99]
  - - [4, 2368, 1, 768, 4, 4, 4, 768]
    - [19, 186.698]
  - - [3584, 5888, 1, 768, 3584, 3584, 3584, 768]
    - [13, 6544.42]
  - - [1856, 1408, 1, 768, 1856, 1856, 1856, 768]
    - [7, 5774.41]
  - - [4288, 1856, 1, 768, 4288, 4288, 4288, 768]
    - [13, 6236.74]
  - - [1408, 1856, 1, 3328, 1408, 1408, 1408, 3328]
    - [13, 6362.74]
  - - [1408, 2944, 1, 768, 1408, 1408, 1408, 768]
    - [13, 6308.85]
  - - [4288, 64, 1, 768, 4288, 4288, 4288, 768]
    - [5, 2822.66]
  - - [1024, 448, 1, 256, 1024, 1024, 1024, 256]
    - [13, 3127.04]
  - - [3584, 5888, 1, 1792, 3584, 3584, 3584, 1792]
    - [13, 6609.3]
  - - [5888, 704, 1, 3328, 5888, 5888, 5888, 3328]
    - [13, 6451.95]
  - - [1408, 2944, 1, 3328, 1408, 1408, 1408, 3328]
    - [13, 6464.27]
  - - [1408, 6784, 1, 1792, 1408, 1408, 1408, 1792]
    - [13, 6409.45]
  - - [704, 4, 1, 128, 704, 704, 704, 128]
    - [17, 14.6565]
  - - [64, 64, 1, 128, 64, 64, 64, 128]
    - [1, 17.2628]
  - - [1856, 704, 1, 128, 1856, 1856, 1856, 128]
    - [1, 2269.15]
  - - [6784, 256, 1, 3328, 6784, 6784, 6784, 3328]
    - [13, 5196.11]
  - - [128, 256, 1, 3328, 128, 128, 128, 3328]
    - [8, 1197.86]
  - - [1024, 704, 1, 256, 1024, 1024, 1024, 256]
    - [13, 3348.62]
  - - [128, 256, 1, 128, 128, 128, 128, 128]
    - [1, 135.784]
  - - [2944, 3584, 1, 768, 2944, 2944, 2944, 768]
    - [13, 6344.22]
  - - [5888, 128, 1, 128, 5888, 5888, 5888, 128]
    - [1, 1652.66]
  - - [448, 6784, 1, 768, 448, 448, 448, 768]
    - [7, 5611.76]
  - - [6784, 704, 1, 768, 6784, 6784, 6784, 768]
    - [13, 5885.62]
  - - [5888, 6784, 1, 1792, 5888, 5888, 5888, 1792]
    - [13, 6685.63]
  - - [5056, 1024, 1, 128, 5056, 5056, 5056, 128]
    - [2, 2921.7]
  - - [448, 64, 1, 1792, 448, 448, 448, 1792]
    - [8, 795.427]
  - - [6784, 5888, 1, 128, 6784, 6784, 6784, 128]
    - [0, 3275.68]
  - - [1024, 64, 1, 768, 1024, 1024, 1024, 768]
    - [5, 1163.46]
  - - [3584, 6784, 1, 128, 3584, 3584, 3584, 128]
    - [2, 3136.03]
  - - [256, 6784, 1, 3328, 256, 256, 256, 3328]
    - [13, 5194.04]
  - - [6784, 3584, 1, 1792, 6784, 6784, 6784, 1792]
    - [13, 6643.7]
  - - [704, 1024, 1, 128, 704, 704, 704, 128]
    - [1, 1840.01]
  - - [2368, 4, 1, 3328, 2368, 2368, 2368, 3328]
    - [19, 349.382]
  - - [704, 5056, 1, 128, 704, 704, 704, 128]
    - [2, 2768.02]
  - - [2368, 4, 1, 1792, 2368, 2368, 2368, 1792]
    - [19, 285.356]
  - - [1856, 5056, 1, 768, 1856, 1856, 1856, 768]
    - [13, 6213.86]
  - - [1856, 448, 1, 1792, 1856, 1856, 1856, 1792]
    - [13, 4527.32]
  - - [128, 128, 1, 768, 128, 128, 128, 768]
    - [5, 381.717]
  - - [128, 4288, 1, 128, 128, 128, 128, 128]
    - [1, 1315.42]
  - - [1024, 3584, 1, 256, 1024, 1024, 1024, 256]
    - [13, 5672.32]
  - - [5056, 5056, 1, 768, 5056, 5056, 5056, 768]
    - [13, 6522.91]
  - - [64, 4, 1, 768, 64, 64, 64, 768]
    - [20, 9.44527]
  - - [448, 5056, 1, 768, 448, 448, 448, 768]
    - [13, 5194.4]
  - - [6784, 64, 1, 1792, 6784, 6784, 6784, 1792]
    - [13, 3888.69]
  - - [64, 128, 1, 256, 64, 64, 64, 256]
    - [5, 126.954]
  - - [4288, 128, 1, 128, 4288, 4288, 4288, 128]
    - [1, 1519.91]
  - - [1856, 4288, 1, 256, 1856, 1856, 1856, 256]
    - [13, 5994.78]
  - - [64, 1408, 1, 256, 64, 64, 64, 256]
    - [5, 1415.56]
  - - [128, 3584, 1, 3328, 128, 128, 128, 3328]
    - [7, 4257.45]
  - - [2944, 5888, 1, 1792, 2944, 2944, 2944, 1792]
    - [13, 6550.26]
  - - [2944, 448, 1, 768, 2944, 2944, 2944, 768]
    - [13, 4986.93]
  - - [64, 1856, 1, 128, 64, 64, 64, 128]
    - [1, 496.98]
  - - [256, 704, 1, 1792, 256, 256, 256, 1792]
    - [5, 3177.77]
  - - [2368, 6784, 1, 1792, 2368, 2368, 2368, 1792]
    - [13, 6444.41]
  - - [5888, 64, 1, 768, 5888, 5888, 5888, 768]
    - [5, 3682.28]
  - - [64, 448, 1, 128, 64, 64, 64, 128]
    - [1, 117.403]
  - - [5888, 1024, 1, 768, 5888, 5888, 5888, 768]
    - [13, 6202.05]
  - - [256, 128, 1, 1792, 256, 256, 256, 1792]
    - [8, 900.804]
  - - [704, 64, 1, 256, 704, 704, 704, 256]
    - [5, 701.389]
  - - [1856, 4288, 1, 768, 1856, 1856, 1856, 768]
    - [13, 6229.68]
  - - [448, 1024, 1, 128, 448, 448, 448, 128]
    - [1, 1492.86]
  - - [4, 2368, 1, 128, 4, 4, 4, 128]
    - [17, 51.7949]
  - - [448, 64, 1, 768, 448, 448, 448, 768]
    - [5, 671.027]
  - - [4288, 2368, 1, 256, 4288, 4288, 4288, 256]
    - [13, 6147.75]
  - - [2944, 4, 1, 3328, 2944, 2944, 2944, 3328]
    - [19, 356.509]
  - - [3584, 1024, 1, 768, 3584, 3584, 3584, 768]
    - [13, 6312.19]
  - - [128, 6784, 1, 768, 128, 128, 128, 768]
    - [7, 4415.33]
  - - [448, 1856, 1, 768, 448, 448, 448, 768]
    - [7, 4286.75]
  - - [1856, 2944, 1, 768, 1856, 1856, 1856, 768]
    - [13, 6120.37]
  - - [1856, 704, 1, 768, 1856, 1856, 1856, 768]
    - [13, 4874.69]
  - - [3584, 128, 1, 1792, 3584, 3584, 3584, 1792]
    - [7, 4102.73]
  - - [1856, 5888, 1, 128, 1856, 1856, 1856, 128]
    - [2, 3102.76]
  - - [4288, 1024, 1, 768, 4288, 4288, 4288, 768]
    - [13, 5950.84]
  - - [1024, 6784, 1, 3328, 1024, 1024, 1024, 3328]
    - [13, 6279.41]
  - - [128, 128, 1, 256, 128, 128, 128, 256]
    - [5, 258.549]
  - - [4, 5888, 1, 3328, 4, 4, 4, 3328]
    - [20, 352.354]
  - - [1408, 5056, 1, 768, 1408, 1408, 1408, 768]
    - [13, 6346.77]
  - - [448, 2944, 1, 3328, 448, 448, 448, 3328]
    - [13, 5115.66]
  - - [256, 1024, 1, 3328, 256, 256, 256, 3328]
    - [5, 4750.84]
  - - [64, 4, 1, 1792, 64, 64, 64, 1792]
    - [20, 17.4943]
  - - [2368, 3584, 1, 1792, 2368, 2368, 2368, 1792]
    - [13, 6344.19]
  - - [704, 64, 1, 3328, 704, 704, 704, 3328]
    - [8, 1572.83]
  - - [3584, 5888, 1, 256, 3584, 3584, 3584, 256]
    - [13, 6324.59]
  - - [704, 1024, 1, 1792, 704, 704, 704, 1792]
    - [5, 4450.0]
  - - [4, 4288, 1, 128, 4, 4, 4, 128]
    - [17, 86.9143]
  - - [5888, 3584, 1, 128, 5888, 5888, 5888, 128]
    - [2, 3090.47]
  - - [5056, 5056, 1, 1792, 5056, 5056, 5056, 1792]
    - [13, 6583.16]
  - - [1408, 2368, 1, 768, 1408, 1408, 1408, 768]
    - [13, 5780.53]
  - - [448, 5888, 1, 1792, 448, 448, 448, 1792]
    - [13, 5298.3]
  - - [2368, 256, 1, 1792, 2368, 2368, 2368, 1792]
    - [5, 4268.06]
  - - [1856, 2368, 1, 256, 1856, 1856, 1856, 256]
    - [13, 5656.91]
  - - [2944, 5888, 1, 128, 2944, 2944, 2944, 128]
    - [0, 3184.11]
  - - [2368, 448, 1, 1792, 2368, 2368, 2368, 1792]
    - [5, 4399.76]
  - - [256, 64, 1, 3328, 256, 256, 256, 3328]
    - [9, 743.519]
  - - [5056, 4, 1, 768, 5056, 5056, 5056, 768]
    - [20, 276.622]
  - - [1408, 5056, 1, 256, 1408, 1408, 1408, 256]
    - [13, 6103.24]
  - - [64, 1408, 1, 3328, 64, 64, 64, 3328]
    - [5, 2106.38]
  - - [5888, 128, 1, 3328, 5888, 5888, 5888, 3328]
    - [5, 4537.64]
  - - [64, 4288, 1, 3328, 64, 64, 64, 3328]
    - [16, 2953.85]
  - - [704, 1856, 1, 256, 704, 704, 704, 256]
    - [13, 4371.32]
  - - [2368, 3584, 1, 3328, 2368, 2368, 2368, 3328]
    - [13, 6373.76]
  - - [1408, 704, 1, 256, 1408, 1408, 1408, 256]
    - [13, 4635.48]
  - - [2944, 256, 1, 3328, 2944, 2944, 2944, 3328]
    - [5, 4701.45]
  - - [1856, 448, 1, 768, 1856, 1856, 1856, 768]
    - [13, 4340.72]
  - - [4288, 4288, 1, 128, 4288, 4288, 4288, 128]
    - [1, 3278.83]
  - - [1408, 64, 1, 1792, 1408, 1408, 1408, 1792]
    - [5, 2124.7]
  - - [5056, 2368, 1, 3328, 5056, 5056, 5056, 3328]
    - [13, 6398.46]
  - - [4, 64, 1, 3328, 4, 4, 4, 3328]
    - [20, 23.4718]
  - - [448, 1856, 1, 256, 448, 448, 448, 256]
    - [13, 3651.26]
  - - [64, 704, 1, 128, 64, 64, 64, 128]
    - [1, 202.222]
  - - [2944, 128, 1, 3328, 2944, 2944, 2944, 3328]
    - [5, 4178.16]
  - - [3584, 2944, 1, 768, 3584, 3584, 3584, 768]
    - [13, 6329.53]
  - - [4288, 1024, 1, 1792, 4288, 4288, 4288, 1792]
    - [13, 6078.54]
  - - [2944, 5056, 1, 128, 2944, 2944, 2944, 128]
    - [0, 3133.2]
  - - [1024, 2368, 1, 128, 1024, 1024, 1024, 128]
    - [1, 2135.58]
  - - [4, 5888, 1, 1792, 4, 4, 4, 1792]
    - [20, 355.432]
  - - [3584, 128, 1, 3328, 3584, 3584, 3584, 3328]
    - [13, 4197.63]
  - - [448, 2944, 1, 1792, 448, 448, 448, 1792]
    - [13, 5029.38]
  - - [1408, 3584, 1, 1792, 1408, 1408, 1408, 1792]
    - [13, 6320.63]
  - - [256, 2368, 1, 1792, 256, 256, 256, 1792]
    - [5, 4333.64]
  - - [2944, 2944, 1, 1792, 2944, 2944, 2944, 1792]
    - [13, 6462.54]
  - - [128, 704, 1, 3328, 128, 128, 128, 3328]
    - [12, 2195.47]
  - - [1856, 128, 1, 3328, 1856, 1856, 1856, 3328]
    - [5, 4265.87]
  - - [2368, 5056, 1, 128, 2368, 2368, 2368, 128]
    - [1, 3149.37]
  - - [3584, 3584, 1, 1792, 3584, 3584, 3584, 1792]
    - [13, 6548.93]
  - - [5056, 1024, 1, 1792, 5056, 5056, 5056, 1792]
    - [13, 6449.4]
  - - [256, 448, 1, 768, 256, 256, 256, 768]
    - [5, 2607.59]
  - - [2944, 4288, 1, 768, 2944, 2944, 2944, 768]
    - [13, 6403.82]
  - - [2368, 5888, 1, 128, 2368, 2368, 2368, 128]
    - [1, 3180.54]
  - - [64, 5888, 1, 768, 64, 64, 64, 768]
    - [5, 3016.92]
  - - [5888, 5056, 1, 128, 5888, 5888, 5888, 128]
    - [2, 3135.87]
  - - [3584, 64, 1, 128, 3584, 3584, 3584, 128]
    - [1, 718.027]
  - - [2368, 704, 1, 1792, 2368, 2368, 2368, 1792]
    - [13, 4942.27]
  - - [4288, 704, 1, 256, 4288, 4288, 4288, 256]
    - [13, 5596.86]
  - - [4288, 64, 1, 1792, 4288, 4288, 4288, 1792]
    - [5, 2954.56]
  - - [448, 3584, 1, 3328, 448, 448, 448, 3328]
    - [5, 4796.29]
  - - [4, 2944, 1, 1792, 4, 4, 4, 1792]
    - [20, 298.614]
  - - [4, 1024, 1, 256, 4, 4, 4, 256]
    - [19, 39.1034]
  - - [704, 128, 1, 256, 704, 704, 704, 256]
    - [5, 1422.02]
  - - [704, 448, 1, 768, 704, 704, 704, 768]
    - [5, 3256.86]
  - - [5056, 128, 1, 1792, 5056, 5056, 5056, 1792]
    - [5, 4302.27]
  - - [4, 3584, 1, 128, 4, 4, 4, 128]
    - [17, 77.1709]
  - - [2368, 1856, 1, 1792, 2368, 2368, 2368, 1792]
    - [13, 6087.0]
  - - [704, 2944, 1, 256, 704, 704, 704, 256]
    - [7, 5164.12]
  - - [2368, 5056, 1, 3328, 2368, 2368, 2368, 3328]
    - [13, 6407.53]
  - - [2944, 6784, 1, 3328, 2944, 2944, 2944, 3328]
    - [13, 6608.72]
  - - [1408, 4288, 1, 128, 1408, 1408, 1408, 128]
    - [1, 2824.96]
  - - [1024, 1024, 1, 768, 1024, 1024, 1024, 768]
    - [13, 5287.63]
  - - [128, 1856, 1, 256, 128, 128, 128, 256]
    - [5, 2921.74]
  - - [64, 3584, 1, 768, 64, 64, 64, 768]
    - [5, 2954.18]
  - - [128, 256, 1, 768, 128, 128, 128, 768]
    - [5, 754.96]
  - - [448, 2944, 1, 256, 448, 448, 448, 256]
    - [13, 4236.11]
  - - [4288, 4, 1, 768, 4288, 4288, 4288, 768]
    - [18, 255.132]
  - - [2944, 128, 1, 768, 2944, 2944, 2944, 768]
    - [5, 3793.11]
  - - [4288, 2368, 1, 3328, 4288, 4288, 4288, 3328]
    - [13, 6494.61]
  - - [448, 448, 1, 128, 448, 448, 448, 128]
    - [1, 816.025]
  - - [5888, 1024, 1, 3328, 5888, 5888, 5888, 3328]
    - [13, 6348.07]
  - - [6784, 256, 1, 256, 6784, 6784, 6784, 256]
    - [13, 4667.11]
  - - [256, 2368, 1, 768, 256, 256, 256, 768]
    - [5, 4052.24]
  - - [128, 704, 1, 1792, 128, 128, 128, 1792]
    - [5, 2060.44]
  - - [2368, 1856, 1, 128, 2368, 2368, 2368, 128]
    - [1, 2821.1]
  - - [5888, 5056, 1, 3328, 5888, 5888, 5888, 3328]
    - [13, 6743.86]
  - - [448, 704, 1, 256, 448, 448, 448, 256]
    - [5, 2752.45]
  - - [1408, 6784, 1, 256, 1408, 1408, 1408, 256]
    - [13, 6118.72]
  - - [256, 448, 1, 256, 256, 256, 256, 256]
    - [5, 1769.43]
  - - [4, 256, 1, 768, 4, 4, 4, 768]
    - [20, 31.9772]
  - - [6784, 64, 1, 128, 6784, 6784, 6784, 128]
    - [1, 1194.65]
  - - [64, 5888, 1, 128, 64, 64, 64, 128]
    - [1, 1081.65]
  - - [3584, 6784, 1, 768, 3584, 3584, 3584, 768]
    - [13, 6589.82]
  - - [3584, 448, 1, 128, 3584, 3584, 3584, 128]
    - [4, 1884.83]
  - - [1856, 6784, 1, 256, 1856, 1856, 1856, 256]
    - [13, 6115.79]
  - - [1856, 64, 1, 256, 1856, 1856, 1856, 256]
    - [5, 1824.49]
  - - [1024, 5056, 1, 3328, 1024, 1024, 1024, 3328]
    - [13, 6488.21]
  - - [128, 1024, 1, 128, 128, 128, 128, 128]
    - [1, 537.981]
  - - [2368, 6784, 1, 768, 2368, 2368, 2368, 768]
    - [13, 6392.36]
  - - [2944, 256, 1, 768, 2944, 2944, 2944, 768]
    - [5, 4326.58]
  - - [1024, 4288, 1, 256, 1024, 1024, 1024, 256]
    - [13, 5550.34]
  - - [4288, 2944, 1, 1792, 4288, 4288, 4288, 1792]
    - [13, 6454.26]
  - - [4, 64, 1, 768, 4, 4, 4, 768]
    - [20, 9.41204]
  - - [2368, 5056, 1, 1792, 2368, 2368, 2368, 1792]
    - [13, 6381.16]
  - - [2944, 4, 1, 256, 2944, 2944, 2944, 256]
    - [19, 100.485]
  - - [1408, 2944, 1, 256, 1408, 1408, 1408, 256]
    - [13, 5958.94]
  - - [2368, 3584, 1, 256, 2368, 2368, 2368, 256]
    - [13, 6032.51]
  - - [5888, 448, 1, 768, 5888, 5888, 5888, 768]
    - [13, 5299.03]
  - - [4288, 448, 1, 768, 4288, 4288, 4288, 768]
    - [13, 5558.67]
  - - [6784, 4, 1, 768, 6784, 6784, 6784, 768]
    - [18, 302.191]
  - - [6784, 3584, 1, 256, 6784, 6784, 6784, 256]
    - [13, 6321.6]
  - - [704, 5056, 1, 1792, 704, 704, 704, 1792]
    - [7, 5818.87]
  - - [2944, 1408, 1, 128, 2944, 2944, 2944, 128]
    - [1, 2751.7]
  - - [128, 1856, 1, 128, 128, 128, 128, 128]
    - [1, 880.927]
  - - [5888, 3584, 1, 3328, 5888, 5888, 5888, 3328]
    - [13, 6630.68]
  - - [704, 6784, 1, 128, 704, 704, 704, 128]
    - [1, 2796.55]
  - - [5056, 4, 1, 256, 5056, 5056, 5056, 256]
    - [18, 150.956]
  - - [6784, 128, 1, 256, 6784, 6784, 6784, 256]
    - [13, 4033.57]
  - - [2944, 128, 1, 1792, 2944, 2944, 2944, 1792]
    - [5, 4097.13]
  - - [2368, 1024, 1, 1792, 2368, 2368, 2368, 1792]
    - [13, 5826.4]
  - - [3584, 1408, 1, 256, 3584, 3584, 3584, 256]
    - [13, 5850.22]
  - - [2368, 4288, 1, 3328, 2368, 2368, 2368, 3328]
    - [13, 6498.77]
  - - [4288, 128, 1, 256, 4288, 4288, 4288, 256]
    - [5, 3025.25]
  - - [1408, 704, 1, 768, 1408, 1408, 1408, 768]
    - [13, 5227.29]
  - - [1408, 3584, 1, 768, 1408, 1408, 1408, 768]
    - [13, 6225.43]
  - - [1024, 5888, 1, 3328, 1024, 1024, 1024, 3328]
    - [13, 6322.29]
  - - [1856, 5056, 1, 3328, 1856, 1856, 1856, 3328]
    - [13, 6321.0]
  - - [5056, 1408, 1, 3328, 5056, 5056, 5056, 3328]
    - [13, 6450.36]
  - - [4288, 1024, 1, 256, 4288, 4288, 4288, 256]
    - [13, 5670.65]
  - - [4288, 1856, 1, 128, 4288, 4288, 4288, 128]
    - [1, 3077.89]
  - - [704, 6784, 1, 1792, 704, 704, 704, 1792]
    - [13, 5942.64]
  - - [5888, 2944, 1, 256, 5888, 5888, 5888, 256]
    - [13, 6244.75]
  - - [1024, 64, 1, 128, 1024, 1024, 1024, 128]
    - [1, 270.919]
  - - [448, 5888, 1, 256, 448, 448, 448, 256]
    - [7, 4615.74]
  - - [64, 4288, 1, 128, 64, 64, 64, 128]
    - [1, 805.109]
  - - [5888, 704, 1, 256, 5888, 5888, 5888, 256]
    - [13, 5830.4]
  - - [1024, 704, 1, 1792, 1024, 1024, 1024, 1792]
    - [13, 3948.27]
  - - [4288, 448, 1, 1792, 4288, 4288, 4288, 1792]
    - [13, 5686.08]
  - - [704, 5888, 1, 768, 704, 704, 704, 768]
    - [7, 5828.04]
  - - [1408, 128, 1, 256, 1408, 1408, 1408, 256]
    - [6, 2281.49]
  - - [64, 4, 1, 256, 64, 64, 64, 256]
    - [20, 3.70166]
  - - [1024, 5056, 1, 768, 1024, 1024, 1024, 768]
    - [13, 6250.29]
  - - [1024, 3584, 1, 768, 1024, 1024, 1024, 768]
    - [13, 6196.04]
  - - [2944, 1024, 1, 3328, 2944, 2944, 2944, 3328]
    - [13, 6177.39]
  - - [704, 448, 1, 1792, 704, 704, 704, 1792]
    - [5, 3482.33]
  - - [256, 4, 1, 1792, 256, 256, 256, 1792]
    - [20, 53.3875]
  - - [1024, 1408, 1, 1792, 1024, 1024, 1024, 1792]
    - [13, 5544.28]
  - - [6784, 2368, 1, 1792, 6784, 6784, 6784, 1792]
    - [13, 6623.55]
  - - [3584, 4288, 1, 1792, 3584, 3584, 3584, 1792]
    - [13, 6548.28]
  - - [1856, 64, 1, 3328, 1856, 1856, 1856, 3328]
    - [5, 2837.11]
  - - [6784, 448, 1, 1792, 6784, 6784, 6784, 1792]
    - [13, 6179.99]
  - - [5056, 448, 1, 3328, 5056, 5056, 5056, 3328]
    - [13, 5511.46]
  - - [128, 6784, 1, 128, 128, 128, 128, 128]
    - [4, 1687.82]
  - - [6784, 448, 1, 3328, 6784, 6784, 6784, 3328]
    - [13, 6222.93]
  - - [4, 2368, 1, 1792, 4, 4, 4, 1792]
    - [19, 270.853]
  - - [2944, 5056, 1, 768, 2944, 2944, 2944, 768]
    - [13, 6518.93]
  - - [128, 1856, 1, 3328, 128, 128, 128, 3328]
    - [5, 4262.46]
  - - [3584, 2944, 1, 3328, 3584, 3584, 3584, 3328]
    - [13, 6431.47]
  - - [64, 256, 1, 3328, 64, 64, 64, 3328]
    - [9, 690.508]
  - - [6784, 4288, 1, 1792, 6784, 6784, 6784, 1792]
    - [13, 6676.44]
  - - [5888, 704, 1, 1792, 5888, 5888, 5888, 1792]
    - [13, 6390.34]
  - - [2944, 128, 1, 128, 2944, 2944, 2944, 128]
    - [1, 1249.81]
  - - [4, 128, 1, 768, 4, 4, 4, 768]
    - [20, 17.7536]
  - - [1408, 5056, 1, 3328, 1408, 1408, 1408, 3328]
    - [13, 6465.23]
  - - [5888, 2368, 1, 256, 5888, 5888, 5888, 256]
    - [13, 6251.31]
  - - [64, 256, 1, 128, 64, 64, 64, 128]
    - [1, 68.3835]
  - - [64, 128, 1, 1792, 64, 64, 64, 1792]
    - [9, 291.436]
  - - [448, 704, 1, 3328, 448, 448, 448, 3328]
    - [5, 3594.52]
  - - [704, 256, 1, 3328, 704, 704, 704, 3328]
    - [5, 3245.26]
  - - [4, 5056, 1, 768, 4, 4, 4, 768]
    - [20, 262.098]
  - - [704, 6784, 1, 768, 704, 704, 704, 768]
    - [13, 5781.17]
  - - [2368, 704, 1, 256, 2368, 2368, 2368, 256]
    - [13, 4455.74]
  - - [3584, 64, 1, 256, 3584, 3584, 3584, 256]
    - [5, 2801.07]
  - - [1856, 4, 1, 768, 1856, 1856, 1856, 768]
    - [19, 159.03]
  - - [1408, 4288, 1, 1792, 1408, 1408, 1408, 1792]
    - [13, 6339.51]
  - - [1408, 5888, 1, 1792, 1408, 1408, 1408, 1792]
    - [13, 6574.48]
  - - [704, 4, 1, 1792, 704, 704, 704, 1792]
    - [20, 122.085]
  - - [256, 64, 1, 256, 256, 256, 256, 256]
    - [5, 259.733]
  - - [5056, 1856, 1, 768, 5056, 5056, 5056, 768]
    - [13, 6217.04]
  - - [1856, 5888, 1, 768, 1856, 1856, 1856, 768]
    - [13, 6274.24]
  - - [2944, 5056, 1, 3328, 2944, 2944, 2944, 3328]
    - [13, 6603.19]
  - - [704, 128, 1, 3328, 704, 704, 704, 3328]
    - [12, 2230.56]
  - - [1856, 704, 1, 256, 1856, 1856, 1856, 256]
    - [13, 4488.64]
  - - [1408, 1024, 1, 256, 1408, 1408, 1408, 256]
    - [13, 5007.75]
  - - [64, 1024, 1, 256, 64, 64, 64, 256]
    - [5, 1015.63]
  - - [5888, 448, 1, 128, 5888, 5888, 5888, 128]
    - [1, 2405.31]
  - - [4, 3584, 1, 3328, 4, 4, 4, 3328]
    - [20, 321.876]
  - - [1024, 704, 1, 768, 1024, 1024, 1024, 768]
    - [13, 3786.26]
  - - [6784, 6784, 1, 3328, 6784, 6784, 6784, 3328]
    - [13, 6760.48]
  - - [3584, 256, 1, 256, 3584, 3584, 3584, 256]
    - [13, 4296.5]
  - - [448, 1856, 1, 3328, 448, 448, 448, 3328]
    - [13, 4585.27]
  - - [1408, 64, 1, 128, 1408, 1408, 1408, 128]
    - [1, 368.981]
  - - [448, 448, 1, 3328, 448, 448, 448, 3328]
    - [5, 3649.14]
  - - [2368, 64, 1, 128, 2368, 2368, 2368, 128]
    - [1, 551.317]
  - - [2944, 1856, 1, 128, 2944, 2944, 2944, 128]
    - [1, 2849.89]
  - - [256, 4288, 1, 128, 256, 256, 256, 128]
    - [1, 1604.76]
  - - [5056, 6784, 1, 768, 5056, 5056, 5056, 768]
    - [13, 6553.51]
  - - [704, 2944, 1, 3328, 704, 704, 704, 3328]
    - [7, 5853.32]
  - - [4, 5056, 1, 1792, 4, 4, 4, 1792]
    - [20, 358.687]
  - - [64, 128, 1, 768, 64, 64, 64, 768]
    - [5, 190.858]
  - - [4, 6784, 1, 256, 4, 4, 4, 256]
    - [19, 159.219]
  - - [128, 2368, 1, 128, 128, 128, 128, 128]
    - [1, 892.251]
  - - [64, 6784, 1, 256, 64, 64, 64, 256]
    - [6, 2075.36]
  - - [4, 448, 1, 1792, 4, 4, 4, 1792]
    - [20, 92.6304]
  - - [3584, 448, 1, 3328, 3584, 3584, 3584, 3328]
    - [13, 4783.25]
  - - [2944, 1024, 1, 1792, 2944, 2944, 2944, 1792]
    - [13, 6139.83]
  - - [2944, 2944, 1, 768, 2944, 2944, 2944, 768]
    - [13, 6402.94]
  - - [4288, 5056, 1, 768, 4288, 4288, 4288, 768]
    - [13, 6574.66]
  - - [4, 1024, 1, 1792, 4, 4, 4, 1792]
    - [20, 176.628]
  - - [2368, 1024, 1, 3328, 2368, 2368, 2368, 3328]
    - [13, 5899.83]
  - - [3584, 256, 1, 128, 3584, 3584, 3584, 128]
    - [0, 1751.84]
  - - [6784, 256, 1, 1792, 6784, 6784, 6784, 1792]
    - [13, 5167.06]
  - - [4288, 5888, 1, 128, 4288, 4288, 4288, 128]
    - [1, 3342.56]
  - - [2368, 5888, 1, 768, 2368, 2368, 2368, 768]
    - [13, 6329.32]
  - - [4, 1408, 1, 128, 4, 4, 4, 128]
    - [17, 30.6999]
  - - [448, 1408, 1, 128, 448, 448, 448, 128]
    - [1, 1676.87]
  - - [2368, 2944, 1, 768, 2368, 2368, 2368, 768]
    - [13, 6218.51]
  - - [256, 1408, 1, 768, 256, 256, 256, 768]
    - [5, 3667.37]
  - - [1856, 3584, 1, 256, 1856, 1856, 1856, 256]
    - [13, 5711.42]
  - - [2368, 2368, 1, 256, 2368, 2368, 2368, 256]
    - [13, 5981.12]
  - - [128, 704, 1, 768, 128, 128, 128, 768]
    - [5, 1922.34]
  - - [1856, 1408, 1, 3328, 1856, 1856, 1856, 3328]
    - [7, 5976.04]
  - - [1856, 6784, 1, 768, 1856, 1856, 1856, 768]
    - [13, 6361.36]
  - - [4288, 3584, 1, 1792, 4288, 4288, 4288, 1792]
    - [13, 6567.95]
  - - [2368, 128, 1, 256, 2368, 2368, 2368, 256]
    - [5, 2542.5]
  - - [5056, 6784, 1, 1792, 5056, 5056, 5056, 1792]
    - [13, 6607.98]
  - - [6784, 1024, 1, 3328, 6784, 6784, 6784, 3328]
    - [13, 6287.89]
  - - [1408, 256, 1, 768, 1408, 1408, 1408, 768]
    - [5, 3700.04]
  - - [64, 2944, 1, 256, 64, 64, 64, 256]
    - [5, 2268.79]
  - - [1408, 4, 1, 256, 1408, 1408, 1408, 256]
    - [19, 48.1778]
  - - [256, 1856, 1, 3328, 256, 256, 256, 3328]
    - [5, 4450.88]
  - - [1024, 2944, 1, 1792, 1024, 1024, 1024, 1792]
    - [13, 6081.97]
  - - [2368, 4, 1, 256, 2368, 2368, 2368, 256]
    - [19, 84.8036]
  - - [128, 1024, 1, 768, 128, 128, 128, 768]
    - [5, 2598.3]
  - - [704, 5888, 1, 128, 704, 704, 704, 128]
    - [2, 2831.09]
  - - [4288, 1408, 1, 1792, 4288, 4288, 4288, 1792]
    - [13, 6324.96]
  - - [5888, 64, 1, 1792, 5888, 5888, 5888, 1792]
    - [5, 4023.0]
  - - [1856, 448, 1, 3328, 1856, 1856, 1856, 3328]
    - [13, 4595.99]
  - - [5056, 3584, 1, 768, 5056, 5056, 5056, 768]
    - [13, 6554.48]
  - - [3584, 6784, 1, 3328, 3584, 3584, 3584, 3328]
    - [13, 6674.7]
  - - [448, 2368, 1, 128, 448, 448, 448, 128]
    - [1, 1956.38]
  - - [1024, 64, 1, 256, 1024, 1024, 1024, 256]
    - [6, 959.685]
  - - [704, 128, 1, 768, 704, 704, 704, 768]
    - [5, 2071.54]
  - - [704, 128, 1, 1792, 704, 704, 704, 1792]
    - [5, 2114.4]
  - - [448, 5056, 1, 1792, 448, 448, 448, 1792]
    - [13, 5395.94]
  - - [4, 448, 1, 256, 4, 4, 4, 256]
    - [19, 17.8475]
  - - [5888, 1856, 1, 1792, 5888, 5888, 5888, 1792]
    - [13, 6614.14]
  - - [3584, 64, 1, 1792, 3584, 3584, 3584, 1792]
    - [5, 3929.84]
  - - [6784, 1856, 1, 768, 6784, 6784, 6784, 768]
    - [13, 6369.12]
  - - [64, 64, 1, 768, 64, 64, 64, 768]
    - [5, 95.2154]
  - - [1024, 1024, 1, 256, 1024, 1024, 1024, 256]
    - [13, 4663.86]
  - - [1408, 2368, 1, 256, 1408, 1408, 1408, 256]
    - [13, 5468.7]
  - - [3584, 2368, 1, 256, 3584, 3584, 3584, 256]
    - [13, 5977.19]
  - - [5056, 5888, 1, 256, 5056, 5056, 5056, 256]
    - [13, 6357.4]
  - - [5888, 5056, 1, 1792, 5888, 5888, 5888, 1792]
    - [13, 6707.95]
  - - [704, 3584, 1, 768, 704, 704, 704, 768]
    - [7, 5538.7]
  - - [2368, 1856, 1, 256, 2368, 2368, 2368, 256]
    - [13, 5659.01]
  - - [6784, 128, 1, 1792, 6784, 6784, 6784, 1792]
    - [13, 4745.13]
  - - [704, 1024, 1, 3328, 704, 704, 704, 3328]
    - [5, 4541.81]
  - - [2944, 704, 1, 128, 2944, 2944, 2944, 128]
    - [1, 2476.72]
  - - [704, 6784, 1, 3328, 704, 704, 704, 3328]
    - [13, 5999.23]
  - - [5056, 1408, 1, 128, 5056, 5056, 5056, 128]
    - [1, 3039.55]
  - - [5888, 5888, 1, 1792, 5888, 5888, 5888, 1792]
    - [13, 6658.43]
  - - [6784, 1408, 1, 256, 6784, 6784, 6784, 256]
    - [13, 6033.72]
  - - [6784, 5888, 1, 1792, 6784, 6784, 6784, 1792]
    - [13, 6680.82]
  - - [128, 6784, 1, 3328, 128, 128, 128, 3328]
    - [13, 4726.49]
  - - [448, 256, 1, 3328, 448, 448, 448, 3328]
    - [12, 2753.93]
  - - [1856, 1856, 1, 128, 1856, 1856, 1856, 128]
    - [2, 2686.08]
  - - [5888, 256, 1, 1792, 5888, 5888, 5888, 1792]
    - [13, 5819.41]
  - - [1024, 4288, 1, 768, 1024, 1024, 1024, 768]
    - [13, 5875.57]
  - - [2944, 6784, 1, 128, 2944, 2944, 2944, 128]
    - [0, 3196.35]
  - - [5888, 704, 1, 768, 5888, 5888, 5888, 768]
    - [13, 6273.86]
  - - [1408, 256, 1, 3328, 1408, 1408, 1408, 3328]
    - [5, 4086.26]
  - - [1408, 128, 1, 1792, 1408, 1408, 1408, 1792]
    - [5, 3134.35]
  - - [704, 256, 1, 256, 704, 704, 704, 256]
    - [5, 2185.41]
  - - [1408, 3584, 1, 3328, 1408, 1408, 1408, 3328]
    - [13, 6349.63]
  - - [128, 1408, 1, 768, 128, 128, 128, 768]
    - [5, 2896.92]
  - - [4288, 5888, 1, 3328, 4288, 4288, 4288, 3328]
    - [13, 6658.12]
  - - [64, 4288, 1, 768, 64, 64, 64, 768]
    - [5, 2343.69]
  - - [256, 2944, 1, 1792, 256, 256, 256, 1792]
    - [5, 4648.71]
  - - [3584, 256, 1, 3328, 3584, 3584, 3584, 3328]
    - [13, 5081.44]
  - - [6784, 1408, 1, 3328, 6784, 6784, 6784, 3328]
    - [13, 6413.54]
  - - [448, 4288, 1, 1792, 448, 448, 448, 1792]
    - [7, 5355.19]
  - - [1408, 1856, 1, 1792, 1408, 1408, 1408, 1792]
    - [13, 6304.8]
  - - [704, 3584, 1, 3328, 704, 704, 704, 3328]
    - [7, 5762.05]
  - - [1856, 1408, 1, 256, 1856, 1856, 1856, 256]
    - [7, 5375.69]
  - - [2368, 4288, 1, 128, 2368, 2368, 2368, 128]
    - [1, 3122.56]
  - - [3584, 5056, 1, 3328, 3584, 3584, 3584, 3328]
    - [13, 6659.75]
  - - [704, 1856, 1, 128, 704, 704, 704, 128]
    - [1, 2266.86]
  - - [5888, 1856, 1, 256, 5888, 5888, 5888, 256]
    - [13, 6251.73]
  - - [5888, 4288, 1, 768, 5888, 5888, 5888, 768]
    - [13, 6560.14]
  - - [1408, 256, 1, 128, 1408, 1408, 1408, 128]
    - [1, 1214.11]
  - - [1024, 448, 1, 1792, 1024, 1024, 1024, 1792]
    - [7, 4050.32]
  - - [448, 704, 1, 128, 448, 448, 448, 128]
    - [1, 1094.34]
  - - [128, 4, 1, 256, 128, 128, 128, 256]
    - [20, 7.19267]
  - - [1408, 6784, 1, 128, 1408, 1408, 1408, 128]
    - [0, 3013.56]
  - - [1408, 4, 1, 768, 1408, 1408, 1408, 768]
    - [20, 115.855]
  - - [704, 1856, 1, 1792, 704, 704, 704, 1792]
    - [13, 5020.51]
  - - [256, 3584, 1, 128, 256, 256, 256, 128]
    - [4, 1670.61]
  - - [1856, 704, 1, 3328, 1856, 1856, 1856, 3328]
    - [13, 5085.56]
  - - [2368, 2944, 1, 3328, 2368, 2368, 2368, 3328]
    - [13, 6327.85]
  - - [6784, 704, 1, 128, 6784, 6784, 6784, 128]
    - [1, 2785.23]
  - - [64, 5056, 1, 1792, 64, 64, 64, 1792]
    - [5, 3074.61]
  - - [5056, 2944, 1, 768, 5056, 5056, 5056, 768]
    - [13, 6500.26]
  - - [5888, 2368, 1, 128, 5888, 5888, 5888, 128]
    - [2, 2961.96]
  - - [4288, 1856, 1, 1792, 4288, 4288, 4288, 1792]
    - [13, 6307.44]
  - - [5056, 128, 1, 768, 5056, 5056, 5056, 768]
    - [5, 4126.49]
  - - [1856, 64, 1, 128, 1856, 1856, 1856, 128]
    - [1, 486.384]
  - - [2368, 2368, 1, 1792, 2368, 2368, 2368, 1792]
    - [13, 6395.65]
  - - [4288, 4, 1, 3328, 4288, 4288, 4288, 3328]
    - [18, 401.556]
  - - [704, 448, 1, 256, 704, 704, 704, 256]
    - [5, 2752.45]
  - - [4, 1408, 1, 1792, 4, 4, 4, 1792]
    - [20, 217.299]
  - - [3584, 448, 1, 768, 3584, 3584, 3584, 768]
    - [13, 4676.08]
  - - [1856, 1856, 1, 256, 1856, 1856, 1856, 256]
    - [13, 5586.45]
  - - [5056, 4, 1, 3328, 5056, 5056, 5056, 3328]
    - [18, 413.753]
  - - [2368, 2944, 1, 128, 2368, 2368, 2368, 128]
    - [1, 2988.41]
  - - [3584, 448, 1, 1792, 3584, 3584, 3584, 1792]
    - [13, 4787.11]
  - - [3584, 6784, 1, 256, 3584, 3584, 3584, 256]
    - [13, 6375.32]
  - - [128, 448, 1, 3328, 128, 128, 128, 3328]
    - [10, 1810.46]
  - - [4288, 2944, 1, 3328, 4288, 4288, 4288, 3328]
    - [13, 6482.41]
  - - [3584, 4, 1, 1792, 3584, 3584, 3584, 1792]
    - [18, 336.381]
  - - [5056, 2944, 1, 256, 5056, 5056, 5056, 256]
    - [13, 6270.22]
  - - [64, 1024, 1, 768, 64, 64, 64, 768]
    - [5, 1337.52]
  - - [64, 6784, 1, 1792, 64, 64, 64, 1792]
    - [5, 3578.65]
  - - [1408, 64, 1, 3328, 1408, 1408, 1408, 3328]
    - [12, 2266.78]
  - - [3584, 64, 1, 768, 3584, 3584, 3584, 768]
    - [5, 3664.29]
  - - [704, 1408, 1, 128, 704, 704, 704, 128]
    - [2, 2176.38]
  - - [5888, 256, 1, 256, 5888, 5888, 5888, 256]
    - [13, 5127.17]
  - - [448, 5056, 1, 256, 448, 448, 448, 256]
    - [13, 4626.45]
  - - [2368, 6784, 1, 3328, 2368, 2368, 2368, 3328]
    - [13, 6470.65]
  - - [4288, 256, 1, 256, 4288, 4288, 4288, 256]
    - [13, 3793.65]
  - - [6784, 5888, 1, 256, 6784, 6784, 6784, 256]
    - [13, 6423.63]
  - - [64, 1856, 1, 768, 64, 64, 64, 768]
    - [5, 2141.78]
  - - [6784, 64, 1, 3328, 6784, 6784, 6784, 3328]
    - [13, 3955.03]
  - - [256, 6784, 1, 128, 256, 256, 256, 128]
    - [2, 1926.16]
  - - [2944, 448, 1, 1792, 2944, 2944, 2944, 1792]
    - [13, 5078.21]
  - - [1408, 4, 1, 1792, 1408, 1408, 1408, 1792]
    - [19, 185.875]
  - - [64, 704, 1, 256, 64, 64, 64, 256]
    - [5, 707.78]
  - - [5888, 128, 1, 256, 5888, 5888, 5888, 256]
    - [13, 3572.83]
  - - [1024, 448, 1, 128, 1024, 1024, 1024, 128]
    - [1, 1388.28]
  - - [3584, 256, 1, 768, 3584, 3584, 3584, 768]
    - [13, 4848.36]
  - - [256, 1856, 1, 256, 256, 256, 256, 256]
    - [5, 3303.9]
  - - [1024, 128, 1, 1792, 1024, 1024, 1024, 1792]
    - [11, 2113.87]
  - - [4288, 6784, 1, 768, 4288, 4288, 4288, 768]
    - [13, 6534.7]
  - - [4, 704, 1, 3328, 4, 4, 4, 3328]
    - [20, 196.757]
  - - [256, 1024, 1, 1792, 256, 256, 256, 1792]
    - [5, 4588.75]
  - - [4288, 4, 1, 128, 4288, 4288, 4288, 128]
    - [17, 86.4081]
  - - [704, 3584, 1, 128, 704, 704, 704, 128]
    - [2, 2563.13]
  - - [2368, 128, 1, 1792, 2368, 2368, 2368, 1792]
    - [5, 3307.41]
  - - [704, 2944, 1, 1792, 704, 704, 704, 1792]
    - [7, 5789.01]
  - - [6784, 704, 1, 256, 6784, 6784, 6784, 256]
    - [13, 5583.65]
  - - [2944, 2368, 1, 128, 2944, 2944, 2944, 128]
    - [1, 2921.73]
  - - [1408, 2944, 1, 1792, 1408, 1408, 1408, 1792]
    - [13, 6423.09]
  - - [5888, 6784, 1, 256, 5888, 5888, 5888, 256]
    - [13, 6451.25]
  - - [64, 4, 1, 3328, 64, 64, 64, 3328]
    - [20, 24.6808]
  - - [5888, 704, 1, 128, 5888, 5888, 5888, 128]
    - [0, 2557.18]
  - - [448, 64, 1, 128, 448, 448, 448, 128]
    - [1, 118.811]
  - - [256, 3584, 1, 256, 256, 256, 256, 256]
    - [13, 4139.46]
  - - [1856, 704, 1, 1792, 1856, 1856, 1856, 1792]
    - [13, 5042.13]
  - - [128, 1408, 1, 1792, 128, 128, 128, 1792]
    - [5, 3194.05]
  - - [1856, 4, 1, 256, 1856, 1856, 1856, 256]
    - [19, 68.6006]
  - - [2944, 448, 1, 128, 2944, 2944, 2944, 128]
    - [1, 2073.74]
  - - [3584, 5888, 1, 3328, 3584, 3584, 3584, 3328]
    - [13, 6632.87]
  - - [6784, 256, 1, 128, 6784, 6784, 6784, 128]
    - [1, 2344.5]
  - - [5056, 64, 1, 256, 5056, 5056, 5056, 256]
    - [5, 2618.95]
  - - [1856, 2368, 1, 1792, 1856, 1856, 1856, 1792]
    - [13, 6084.56]
  - - [2944, 5888, 1, 768, 2944, 2944, 2944, 768]
    - [13, 6488.7]
  - - [256, 5056, 1, 3328, 256, 256, 256, 3328]
    - [13, 5031.2]
  - - [3584, 5056, 1, 256, 3584, 3584, 3584, 256]
    - [13, 6324.99]
  - - [1856, 4288, 1, 128, 1856, 1856, 1856, 128]
    - [1, 3014.47]
  - - [2944, 1856, 1, 1792, 2944, 2944, 2944, 1792]
    - [13, 6235.66]
  - - [6784, 704, 1, 1792, 6784, 6784, 6784, 1792]
    - [13, 5976.45]
  - - [1408, 5056, 1, 128, 1408, 1408, 1408, 128]
    - [2, 2926.04]
  - - [128, 5888, 1, 3328, 128, 128, 128, 3328]
    - [5, 4682.59]
  - - [704, 4288, 1, 128, 704, 704, 704, 128]
    - [2, 2638.48]
  - - [5888, 5888, 1, 3328, 5888, 5888, 5888, 3328]
    - [13, 6692.07]
  - - [4, 448, 1, 3328, 4, 4, 4, 3328]
    - [20, 135.996]
  - - [704, 5056, 1, 256, 704, 704, 704, 256]
    - [7, 5203.51]
  - - [704, 1856, 1, 768, 704, 704, 704, 768]
    - [13, 4871.19]
  - - [128, 4, 1, 1792, 128, 128, 128, 1792]
    - [20, 34.0276]
  - - [1024, 1024, 1, 128, 1024, 1024, 1024, 128]
    - [4, 1982.39]
  - - [6784, 2944, 1, 768, 6784, 6784, 6784, 768]
    - [13, 6491.09]
  - - [2368, 1024, 1, 256, 2368, 2368, 2368, 256]
    - [13, 5297.13]
  - - [1856, 256, 1, 128, 1856, 1856, 1856, 128]
    - [1, 1500.94]
  - - [4288, 5056, 1, 128, 4288, 4288, 4288, 128]
    - [1, 3312.91]
  - - [1856, 64, 1, 1792, 1856, 1856, 1856, 1792]
    - [5, 2710.9]
  - - [1856, 1408, 1, 128, 1856, 1856, 1856, 128]
    - [2, 2659.36]
  - - [256, 5056, 1, 128, 256, 256, 256, 128]
    - [2, 1816.87]
  - - [3584, 128, 1, 768, 3584, 3584, 3584, 768]
    - [5, 3860.57]
  - - [128, 4, 1, 128, 128, 128, 128, 128]
    - [17, 2.92951]
  - - [704, 2368, 1, 1792, 704, 704, 704, 1792]
    - [13, 4931.38]
  - - [6784, 1408, 1, 1792, 6784, 6784, 6784, 1792]
    - [13, 6387.48]
  - - [2368, 1408, 1, 1792, 2368, 2368, 2368, 1792]
    - [13, 5872.85]
  - - [1856, 4288, 1, 1792, 1856, 1856, 1856, 1792]
    - [13, 6309.71]
  - - [5056, 4288, 1, 3328, 5056, 5056, 5056, 3328]
    - [13, 6657.89]
  - - [4288, 1856, 1, 3328, 4288, 4288, 4288, 3328]
    - [13, 6335.99]
  - - [448, 2368, 1, 1792, 448, 448, 448, 1792]
    - [5, 4433.97]
  - - [5056, 704, 1, 1792, 5056, 5056, 5056, 1792]
    - [13, 6249.64]
  - - [3584, 6784, 1, 1792, 3584, 3584, 3584, 1792]
    - [13, 6646.26]
  - - [448, 1024, 1, 3328, 448, 448, 448, 3328]
    - [5, 4297.4]
  - - [128, 448, 1, 256, 128, 128, 128, 256]
    - [5, 904.892]
  - - [5056, 448, 1, 1792, 5056, 5056, 5056, 1792]
    - [13, 5472.46]
  - - [4288, 2944, 1, 128, 4288, 4288, 4288, 128]
    - [1, 3204.57]
  - - [1408, 1408, 1, 1792, 1408, 1408, 1408, 1792]
    - [13, 5892.45]
  - - [128, 5888, 1, 128, 128, 128, 128, 128]
    - [1, 1667.48]
  - - [64, 6784, 1, 768, 64, 64, 64, 768]
    - [5, 3066.38]
  - - [5888, 448, 1, 1792, 5888, 5888, 5888, 1792]
    - [13, 5383.68]
  - - [3584, 2368, 1, 128, 3584, 3584, 3584, 128]
    - [2, 2804.56]
  - - [5056, 704, 1, 256, 5056, 5056, 5056, 256]
    - [13, 5745.48]
  - - [6784, 1024, 1, 1792, 6784, 6784, 6784, 1792]
    - [13, 6257.11]
  - - [2944, 3584, 1, 128, 2944, 2944, 2944, 128]
    - [1, 3048.36]
  - - [128, 2368, 1, 256, 128, 128, 128, 256]
    - [5, 2499.99]
  - - [2368, 256, 1, 256, 2368, 2368, 2368, 256]
    - [5, 3325.39]
  - - [256, 448, 1, 128, 256, 256, 256, 128]
    - [1, 472.978]
  - - [1856, 5888, 1, 3328, 1856, 1856, 1856, 3328]
    - [13, 6373.39]
  - - [256, 256, 1, 1792, 256, 256, 256, 1792]
    - [5, 1558.91]
  - - [5888, 6784, 1, 128, 5888, 5888, 5888, 128]
    - [2, 3154.86]
  - - [6784, 3584, 1, 3328, 6784, 6784, 6784, 3328]
    - [13, 6666.75]
  - - [1408, 448, 1, 768, 1408, 1408, 1408, 768]
    - [5, 4254.92]
  - - [64, 128, 1, 128, 64, 64, 64, 128]
    - [1, 34.1918]
  - - [5888, 64, 1, 3328, 5888, 5888, 5888, 3328]
    - [5, 4099.25]
  - - [2944, 1408, 1, 3328, 2944, 2944, 2944, 3328]
    - [13, 6454.63]
  - - [2368, 6784, 1, 256, 2368, 2368, 2368, 256]
    - [13, 6204.48]
  - - [2368, 448, 1, 3328, 2368, 2368, 2368, 3328]
    - [5, 4458.5]
  - - [704, 704, 1, 256, 704, 704, 704, 256]
    - [5, 3439.35]
  - - [5888, 128, 1, 768, 5888, 5888, 5888, 768]
    - [5, 4219.13]
  - - [2368, 64, 1, 1792, 2368, 2368, 2368, 1792]
    - [5, 2645.21]
  - - [256, 1024, 1, 768, 256, 256, 256, 768]
    - [5, 4181.32]
  - - [6784, 4, 1, 3328, 6784, 6784, 6784, 3328]
    - [18, 405.433]
  - - [1024, 1856, 1, 256, 1024, 1024, 1024, 256]
    - [13, 4923.64]
  - - [128, 2944, 1, 768, 128, 128, 128, 768]
    - [5, 3503.95]
  - - [1856, 3584, 1, 768, 1856, 1856, 1856, 768]
    - [13, 5947.34]
  - - [64, 2368, 1, 128, 64, 64, 64, 128]
    - [1, 597.884]
  - - [5888, 256, 1, 768, 5888, 5888, 5888, 768]
    - [13, 5656.03]
  - - [4, 5056, 1, 128, 4, 4, 4, 128]
    - [17, 96.2707]
  - - [448, 256, 1, 128, 448, 448, 448, 128]
    - [1, 499.186]
  - - [2944, 6784, 1, 768, 2944, 2944, 2944, 768]
    - [13, 6535.35]
  - - [128, 448, 1, 1792, 128, 128, 128, 1792]
    - [5, 1340.32]
  - - [128, 3584, 1, 128, 128, 128, 128, 128]
    - [1, 1284.78]
  - - [1408, 4, 1, 3328, 1408, 1408, 1408, 3328]
    - [20, 253.283]
  - - [2368, 704, 1, 768, 2368, 2368, 2368, 768]
    - [13, 4826.53]
  - - [1024, 4, 1, 768, 1024, 1024, 1024, 768]
    - [20, 89.9718]
  - - [256, 2944, 1, 128, 256, 256, 256, 128]
    - [4, 1409.42]
  - - [1024, 1856, 1, 128, 1024, 1024, 1024, 128]
    - [1, 2060.26]
  - - [1024, 256, 1, 768, 1024, 1024, 1024, 768]
    - [11, 3817.2]
  - - [6784, 4, 1, 1792, 6784, 6784, 6784, 1792]
    - [18, 402.983]
  - - [64, 3584, 1, 3328, 64, 64, 64, 3328]
    - [5, 3816.73]
  - - [1408, 1024, 1, 3328, 1408, 1408, 1408, 3328]
    - [13, 5619.93]
  - - [6784, 5056, 1, 768, 6784, 6784, 6784, 768]
    - [13, 6619.51]
  - - [256, 5056, 1, 1792, 256, 256, 256, 1792]
    - [13, 5003.49]
  - - [1408, 3584, 1, 256, 1408, 1408, 1408, 256]
    - [13, 5915.71]
  - - [128, 2368, 1, 3328, 128, 128, 128, 3328]
    - [5, 3380.72]
  - - [6784, 6784, 1, 256, 6784, 6784, 6784, 256]
    - [13, 6435.39]
  - - [5888, 1408, 1, 3328, 5888, 5888, 5888, 3328]
    - [13, 6586.93]
  - - [1408, 1856, 1, 768, 1408, 1408, 1408, 768]
    - [13, 6180.09]
  - - [2944, 704, 1, 3328, 2944, 2944, 2944, 3328]
    - [13, 6201.43]
  - - [256, 256, 1, 768, 256, 256, 256, 768]
    - [5, 1526.87]
  - - [6784, 128, 1, 3328, 6784, 6784, 6784, 3328]
    - [13, 4812.19]
  - - [704, 448, 1, 3328, 704, 704, 704, 3328]
    - [5, 3569.17]
  - - [448, 128, 1, 256, 448, 448, 448, 256]
    - [5, 904.92]
  - - [4, 256, 1, 256, 4, 4, 4, 256]
    - [19, 11.9961]
  - - [704, 1856, 1, 3328, 704, 704, 704, 3328]
    - [13, 5087.77]
  - - [4288, 5888, 1, 1792, 4288, 4288, 4288, 1792]
    - [13, 6640.42]
  - - [4288, 704, 1, 128, 4288, 4288, 4288, 128]
    - [1, 2690.19]
  - - [1024, 5888, 1, 1792, 1024, 1024, 1024, 1792]
    - [13, 6284.26]
  - - [704, 4288, 1, 1792, 704, 704, 704, 1792]
    - [7, 5716.03]
  - - [4288, 3584, 1, 256, 4288, 4288, 4288, 256]
    - [13, 6275.7]
  - - [704, 4, 1, 256, 704, 704, 704, 256]
    - [20, 25.7458]
  - - [5056, 2368, 1, 1792, 5056, 5056, 5056, 1792]
    - [13, 6375.54]
  - - [3584, 3584, 1, 256, 3584, 3584, 3584, 256]
    - [13, 6189.56]
  - - [5056, 3584, 1, 128, 5056, 5056, 5056, 128]
    - [1, 3260.63]
  - - [5056, 4288, 1, 768, 5056, 5056, 5056, 768]
    - [13, 6566.2]
  - - [128, 2944, 1, 1792, 128, 128, 128, 1792]
    - [5, 3904.11]
  - - [3584, 2368, 1, 768, 3584, 3584, 3584, 768]
    - [13, 6237.79]
  - - [2368, 1856, 1, 768, 2368, 2368, 2368, 768]
    - [13, 5972.79]
  - - [4, 4, 1, 3328, 4, 4, 4, 3328]
    - [20, 1.51972]
  - - [3584, 1024, 1, 256, 3584, 3584, 3584, 256]
    - [13, 5874.6]
  - - [448, 5888, 1, 128, 448, 448, 448, 128]
    - [1, 2528.04]
  - - [3584, 64, 1, 3328, 3584, 3584, 3584, 3328]
    - [5, 4074.8]
  - - [1408, 448, 1, 256, 1408, 1408, 1408, 256]
    - [5, 3597.25]
  - - [1856, 4, 1, 1792, 1856, 1856, 1856, 1792]
    - [19, 254.748]
  - - [4288, 3584, 1, 3328, 4288, 4288, 4288, 3328]
    - [13, 6590.62]
  - - [256, 2944, 1, 768, 256, 256, 256, 768]
    - [5, 4357.95]
  - - [64, 5888, 1, 3328, 64, 64, 64, 3328]
    - [5, 3847.71]
  - - [2944, 5888, 1, 256, 2944, 2944, 2944, 256]
    - [13, 6301.9]
  - - [2944, 2368, 1, 3328, 2944, 2944, 2944, 3328]
    - [13, 6327.6]
  - - [4, 5888, 1, 256, 4, 4, 4, 256]
    - [19, 154.155]
  - - [6784, 128, 1, 128, 6784, 6784, 6784, 128]
    - [1, 1814.35]
  - - [2944, 256, 1, 1792, 2944, 2944, 2944, 1792]
    - [5, 4607.58]
  - - [256, 256, 1, 256, 256, 256, 256, 256]
    - [5, 1048.54]
  - - [5888, 2368, 1, 3328, 5888, 5888, 5888, 3328]
    - [13, 6621.15]
  - - [1024, 1408, 1, 128, 1024, 1024, 1024, 128]
    - [4, 2022.22]
  - - [4, 5888, 1, 768, 4, 4, 4, 768]
    - [19, 280.991]
  - - [5056, 6784, 1, 3328, 5056, 5056, 5056, 3328]
    - [13, 6626.55]
  - - [128, 5888, 1, 256, 128, 128, 128, 256]
    - [13, 3276.24]
  - - [2944, 5056, 1, 1792, 2944, 2944, 2944, 1792]
    - [13, 6574.88]
  - - [704, 4, 1, 3328, 704, 704, 704, 3328]
    - [20, 183.621]
  - - [4, 448, 1, 128, 4, 4, 4, 128]
    - [17, 10.1859]
  - - [448, 6784, 1, 256, 448, 448, 448, 256]
    - [7, 5238.57]
  - - [5056, 4288, 1, 1792, 5056, 5056, 5056, 1792]
    - [13, 6634.45]
  - - [4, 1408, 1, 256, 4, 4, 4, 256]
    - [19, 52.1821]
  - - [5056, 1024, 1, 256, 5056, 5056, 5056, 256]
    - [13, 5903.17]
  - - [5056, 448, 1, 768, 5056, 5056, 5056, 768]
    - [13, 5355.5]
  - - [1024, 704, 1, 3328, 1024, 1024, 1024, 3328]
    - [13, 4000.95]
  - - [1856, 256, 1, 768, 1856, 1856, 1856, 768]
    - [5, 4057.74]
  - - [1408, 5888, 1, 256, 1408, 1408, 1408, 256]
    - [13, 6258.34]
  - - [448, 2368, 1, 3328, 448, 448, 448, 3328]
    - [5, 4517.67]
  - - [1024, 3584, 1, 1792, 1024, 1024, 1024, 1792]
    - [13, 6393.24]
  - - [5888, 4, 1, 768, 5888, 5888, 5888, 768]
    - [20, 291.386]
  - - [64, 4, 1, 128, 64, 64, 64, 128]
    - [17, 1.31264]
  - - [1024, 256, 1, 1792, 1024, 1024, 1024, 1792]
    - [11, 4136.76]
  - - [2944, 6784, 1, 256, 2944, 2944, 2944, 256]
    - [13, 6357.95]
  - - [64, 2368, 1, 3328, 64, 64, 64, 3328]
    - [5, 2678.5]
  - - [5056, 256, 1, 768, 5056, 5056, 5056, 768]
    - [13, 4837.56]
  - - [4288, 2944, 1, 768, 4288, 4288, 4288, 768]
    - [13, 6393.81]
  - - [4288, 256, 1, 1792, 4288, 4288, 4288, 1792]
    - [5, 4297.72]
  - - [5056, 256, 1, 256, 5056, 5056, 5056, 256]
    - [13, 4394.04]
  - - [448, 1024, 1, 1792, 448, 448, 448, 1792]
    - [5, 4179.99]
  - - [1408, 1408, 1, 256, 1408, 1408, 1408, 256]
    - [13, 5274.24]
  - - [2944, 3584, 1, 1792, 2944, 2944, 2944, 1792]
    - [13, 6402.24]
  - - [4, 1856, 1, 1792, 4, 4, 4, 1792]
    - [19, 246.698]
  - - [256, 128, 1, 256, 256, 256, 256, 256]
    - [5, 526.724]
  - - [256, 2944, 1, 256, 256, 256, 256, 256]
    - [5, 3617.51]
  - - [64, 64, 1, 1792, 64, 64, 64, 1792]
    - [9, 164.599]
  - - [2944, 5888, 1, 3328, 2944, 2944, 2944, 3328]
    - [13, 6571.23]
  - - [2944, 6784, 1, 1792, 2944, 2944, 2944, 1792]
    - [13, 6587.14]
  - - [704, 3584, 1, 256, 704, 704, 704, 256]
    - [7, 5153.51]
  - - [448, 4288, 1, 3328, 448, 448, 448, 3328]
    - [7, 5427.35]
  - - [128, 5056, 1, 3328, 128, 128, 128, 3328]
    - [5, 4605.62]
  - - [64, 1408, 1, 768, 64, 64, 64, 768]
    - [5, 1736.53]
  - - [5056, 5056, 1, 3328, 5056, 5056, 5056, 3328]
    - [13, 6604.52]
  - - [2368, 4288, 1, 256, 2368, 2368, 2368, 256]
    - [13, 6147.75]
  - - [128, 704, 1, 256, 128, 128, 128, 256]
    - [5, 1422.02]
  - - [4, 704, 1, 1792, 4, 4, 4, 1792]
    - [20, 136.246]
  - - [256, 4288, 1, 768, 256, 256, 256, 768]
    - [5, 4378.98]
  - - [2944, 256, 1, 128, 2944, 2944, 2944, 128]
    - [1, 1865.76]
  - - [2944, 448, 1, 256, 2944, 2944, 2944, 256]
    - [13, 4558.04]
  - - [128, 64, 1, 1792, 128, 128, 128, 1792]
    - [9, 298.907]
  - - [4, 1408, 1, 3328, 4, 4, 4, 3328]
    - [20, 284.304]
  - - [4288, 1024, 1, 3328, 4288, 4288, 4288, 3328]
    - [13, 6104.04]
  - - [5056, 256, 1, 1792, 5056, 5056, 5056, 1792]
    - [13, 4994.71]
  - - [3584, 448, 1, 256, 3584, 3584, 3584, 256]
    - [13, 4386.5]
  - - [448, 128, 1, 3328, 448, 448, 448, 3328]
    - [8, 1840.21]
  - - [448, 4288, 1, 256, 448, 448, 448, 256]
    - [7, 4626.4]
  - - [448, 3584, 1, 128, 448, 448, 448, 128]
    - [1, 2223.13]
  - - [64, 2944, 1, 3328, 64, 64, 64, 3328]
    - [5, 3245.77]
  - - [1856, 2368, 1, 3328, 1856, 1856, 1856, 3328]
    - [13, 6113.33]
  - - [1408, 5888, 1, 768, 1408, 1408, 1408, 768]
    - [13, 6488.89]
  - - [5888, 64, 1, 256, 5888, 5888, 5888, 256]
    - [5, 2939.74]
  - - [4288, 5056, 1, 1792, 4288, 4288, 4288, 1792]
    - [13, 6636.13]
  - - [448, 4, 1, 128, 448, 448, 448, 128]
    - [17, 9.64656]
  - - [256, 4, 1, 768, 256, 256, 256, 768]
    - [20, 30.7723]
  - - [2368, 1408, 1, 256, 2368, 2368, 2368, 256]
    - [13, 5440.29]
  - - [5056, 5056, 1, 128, 5056, 5056, 5056, 128]
    - [1, 3309.26]
  - - [4, 6784, 1, 3328, 4, 4, 4, 3328]
    - [20, 370.897]
  - - [4288, 4288, 1, 768, 4288, 4288, 4288, 768]
    - [13, 6494.44]
  - - [1024, 4288, 1, 3328, 1024, 1024, 1024, 3328]
    - [13, 6075.47]
  - - [448, 1408, 1, 768, 448, 448, 448, 768]
    - [5, 4268.81]
  - - [448, 3584, 1, 768, 448, 448, 448, 768]
    - [13, 4528.51]
  - - [6784, 2944, 1, 1792, 6784, 6784, 6784, 1792]
    - [13, 6562.36]
  - - [448, 1024, 1, 256, 448, 448, 448, 256]
    - [5, 3228.92]
  - - [4, 4, 1, 128, 4, 4, 4, 128]
    - [17, 0.000115128]
  - - [2944, 4288, 1, 128, 2944, 2944, 2944, 128]
    - [0, 3089.3]
  - - [3584, 704, 1, 1792, 3584, 3584, 3584, 1792]
    - [13, 6063.81]
  - - [4288, 4288, 1, 3328, 4288, 4288, 4288, 3328]
    - [13, 6581.96]
  - - [2368, 6784, 1, 128, 2368, 2368, 2368, 128]
    - [1, 3209.11]
  - - [1856, 1856, 1, 768, 1856, 1856, 1856, 768]
    - [13, 5952.37]
  - - [4288, 5056, 1, 3328, 4288, 4288, 4288, 3328]
    - [13, 6662.08]
  - - [64, 256, 1, 1792, 64, 64, 64, 1792]
    - [8, 494.824]
  - - [5888, 4288, 1, 128, 5888, 5888, 5888, 128]
    - [2, 3103.36]
  - - [64, 6784, 1, 128, 64, 64, 64, 128]
    - [1, 1258.78]
  - - [128, 64, 1, 128, 128, 128, 128, 128]
    - [1, 34.4416]
  - - [2944, 64, 1, 256, 2944, 2944, 2944, 256]
    - [5, 2376.49]
  - - [1024, 4288, 1, 1792, 1024, 1024, 1024, 1792]
    - [13, 6038.8]
  - - [256, 256, 1, 128, 256, 256, 256, 128]
    - [1, 288.149]
  - - [1408, 4288, 1, 256, 1408, 1408, 1408, 256]
    - [13, 6007.81]
  - - [128, 64, 1, 256, 128, 128, 128, 256]
    - [5, 132.292]
  - - [6784, 6784, 1, 1792, 6784, 6784, 6784, 1792]
    - [13, 6737.84]
  - - [64, 5888, 1, 256, 64, 64, 64, 256]
    - [6, 1988.25]
  - - [4, 1856, 1, 256, 4, 4, 4, 256]
    - [19, 66.4677]
  - - [6784, 3584, 1, 128, 6784, 6784, 6784, 128]
    - [0, 3208.6]
  - - [256, 3584, 1, 1792, 256, 256, 256, 1792]
    - [13, 5006.93]
  - - [704, 4288, 1, 3328, 704, 704, 704, 3328]
    - [7, 5786.23]
  - - [1408, 1408, 1, 3328, 1408, 1408, 1408, 3328]
    - [13, 5929.83]
  - - [2944, 4288, 1, 3328, 2944, 2944, 2944, 3328]
    - [13, 6483.96]
  - - [4, 128, 1, 128, 4, 4, 4, 128]
    - [17, 2.88178]
  - - [2368, 5888, 1, 1792, 2368, 2368, 2368, 1792]
    - [13, 6385.28]
  - - [4288, 1408, 1, 128, 4288, 4288, 4288, 128]
    - [1, 2949.55]
  - - [448, 2368, 1, 256, 448, 448, 448, 256]
    - [5, 3677.3]
  - - [1024, 1856, 1, 3328, 1024, 1024, 1024, 3328]
    - [13, 5658.43]
  - - [4, 6784, 1, 768, 4, 4, 4, 768]
    - [19, 293.674]
  - - [704, 448, 1, 128, 704, 704, 704, 128]
    - [1, 1092.15]
  - - [704, 256, 1, 768, 704, 704, 704, 768]
    - [5, 2924.13]
  - - [2368, 4, 1, 128, 2368, 2368, 2368, 128]
    - [17, 48.5675]
  - - [1024, 6784, 1, 768, 1024, 1024, 1024, 768]
    - [13, 6091.25]
  - - [2368, 5888, 1, 3328, 2368, 2368, 2368, 3328]
    - [13, 6410.75]
  - - [448, 1408, 1, 256, 448, 448, 448, 256]
    - [5, 3597.25]
  - - [5888, 448, 1, 3328, 5888, 5888, 5888, 3328]
    - [13, 5417.08]
  - - [128, 4288, 1, 256, 128, 128, 128, 256]
    - [5, 2822.66]
  - - [4, 4288, 1, 1792, 4, 4, 4, 1792]
    - [20, 338.719]
  - - [448, 1024, 1, 768, 448, 448, 448, 768]
    - [5, 3934.03]
  - - [2944, 448, 1, 3328, 2944, 2944, 2944, 3328]
    - [13, 5155.27]
  - - [5056, 2944, 1, 1792, 5056, 5056, 5056, 1792]
    - [13, 6571.88]
  - - [256, 3584, 1, 3328, 256, 256, 256, 3328]
    - [13, 5046.61]
  - - [2368, 256, 1, 768, 2368, 2368, 2368, 768]
    - [5, 4013.43]
  - - [2368, 1024, 1, 768, 2368, 2368, 2368, 768]
    - [13, 5703.29]
  - - [2944, 2368, 1, 768, 2944, 2944, 2944, 768]
    - [13, 6215.3]
  - - [64, 704, 1, 3328, 64, 64, 64, 3328]
    - [8, 1518.55]
  - - [448, 1856, 1, 1792, 448, 448, 448, 1792]
    - [13, 4495.95]
  - - [128, 256, 1, 1792, 128, 128, 128, 1792]
    - [8, 892.69]
  - - [4, 128, 1, 3328, 4, 4, 4, 3328]
    - [20, 46.0972]
  - - [2944, 3584, 1, 256, 2944, 2944, 2944, 256]
    - [13, 6141.89]
  - - [64, 256, 1, 768, 64, 64, 64, 768]
    - [5, 382.576]
  - - [448, 4, 1, 768, 448, 448, 448, 768]
    - [20, 45.9871]
  - - [256, 5056, 1, 256, 256, 256, 256, 256]
    - [13, 4260.12]
  - - [64, 1408, 1, 1792, 64, 64, 64, 1792]
    - [5, 1979.96]
  - - [6784, 3584, 1, 768, 6784, 6784, 6784, 768]
    - [13, 6571.43]
  - - [4, 5888, 1, 128, 4, 4, 4, 128]
    - [17, 109.399]
  - - [5056, 2944, 1, 3328, 5056, 5056, 5056, 3328]
    - [13, 6594.6]
  - - [6784, 2944, 1, 128, 6784, 6784, 6784, 128]
    - [2, 3184.84]
  - - [4288, 64, 1, 128, 4288, 4288, 4288, 128]
    - [1, 979.773]
  - - [3584, 704, 1, 128, 3584, 3584, 3584, 128]
    - [0, 2219.89]
  - - [1856, 128, 1, 768, 1856, 1856, 1856, 768]
    - [5, 3860.61]
  - - [128, 64, 1, 768, 128, 128, 128, 768]
    - [5, 192.591]
  - - [704, 256, 1, 128, 704, 704, 704, 128]
    - [1, 737.961]
  - - [4, 6784, 1, 128, 4, 4, 4, 128]
    - [17, 122.748]
  - - [1024, 1408, 1, 256, 1024, 1024, 1024, 256]
    - [13, 4832.91]
  - - [448, 448, 1, 256, 448, 448, 448, 256]
    - [5, 2433.7]
  - - [5056, 5888, 1, 3328, 5056, 5056, 5056, 3328]
    - [13, 6635.69]
  - - [64, 2368, 1, 256, 64, 64, 64, 256]
    - [5, 1837.73]
  - - [2368, 1408, 1, 768, 2368, 2368, 2368, 768]
    - [13, 5749.77]
  - - [6784, 256, 1, 768, 6784, 6784, 6784, 768]
    - [13, 5028.13]
  - - [704, 704, 1, 768, 704, 704, 704, 768]
    - [5, 4218.73]
  - - [2368, 448, 1, 256, 2368, 2368, 2368, 256]
    - [5, 3629.96]
  - - [4, 704, 1, 128, 4, 4, 4, 128]
    - [17, 14.9263]
  - - [1856, 5888, 1, 256, 1856, 1856, 1856, 256]
    - [13, 6072.8]
  - - [448, 2368, 1, 768, 448, 448, 448, 768]
    - [5, 4264.75]
  - - [6784, 1024, 1, 768, 6784, 6784, 6784, 768]
    - [13, 6173.21]
  - - [5056, 1024, 1, 768, 5056, 5056, 5056, 768]
    - [13, 6329.15]
  - - [1024, 1408, 1, 3328, 1024, 1024, 1024, 3328]
    - [13, 5608.74]
  - - [4, 1856, 1, 128, 4, 4, 4, 128]
    - [17, 40.4681]
  - - [5056, 64, 1, 128, 5056, 5056, 5056, 128]
    - [1, 1065.02]
  - - [5888, 5056, 1, 768, 5888, 5888, 5888, 768]
    - [13, 6646.25]
  - - [5888, 256, 1, 3328, 5888, 5888, 5888, 3328]
    - [13, 5884.06]
  - - [5888, 4288, 1, 256, 5888, 5888, 5888, 256]
    - [13, 6342.53]
  - - [6784, 448, 1, 768, 6784, 6784, 6784, 768]
    - [13, 6041.04]
  - - [1856, 256, 1, 256, 1856, 1856, 1856, 256]
    - [5, 3323.95]
  - - [4, 2368, 1, 3328, 4, 4, 4, 3328]
    - [19, 362.786]
  - - [5888, 448, 1, 256, 5888, 5888, 5888, 256]
    - [13, 4981.49]
  - - [1856, 448, 1, 256, 1856, 1856, 1856, 256]
    - [13, 3811.09]
  - - [1856, 6784, 1, 128, 1856, 1856, 1856, 128]
    - [1, 3141.34]
  - - [448, 4, 1, 1792, 448, 448, 448, 1792]
    - [20, 89.754]
  - - [1408, 1408, 1, 128, 1408, 1408, 1408, 128]
    - [1, 2375.6]
  - - [6784, 1408, 1, 128, 6784, 6784, 6784, 128]
    - [0, 2998.78]
  - - [1408, 1856, 1, 128, 1408, 1408, 1408, 128]
    - [0, 2386.67]
  - - [3584, 4, 1, 128, 3584, 3584, 3584, 128]
    - [17, 73.946]
  - - [64, 256, 1, 256, 64, 64, 64, 256]
    - [5, 260.929]
  - - [448, 4, 1, 256, 448, 448, 448, 256]
    - [20, 17.2027]
  - - [128, 5056, 1, 1792, 128, 128, 128, 1792]
    - [5, 4386.64]
  - - [4288, 128, 1, 768, 4288, 4288, 4288, 768]
    - [5, 3583.43]
  - - [128, 4, 1, 768, 128, 128, 128, 768]
    - [20, 18.4956]
  - - [448, 256, 1, 256, 448, 448, 448, 256]
    - [5, 1809.84]
  - - [4288, 4288, 1, 1792, 4288, 4288, 4288, 1792]
    - [13, 6562.6]
  - - [1856, 256, 1, 3328, 1856, 1856, 1856, 3328]
    - [5, 4377.85]
  - - [128, 64, 1, 3328, 128, 128, 128, 3328]
    - [9, 448.286]
  - - [64, 5888, 1, 1792, 64, 64, 64, 1792]
    - [5, 3532.01]
  - - [2368, 2944, 1, 256, 2368, 2368, 2368, 256]
    - [13, 5963.51]
  - - [3584, 4, 1, 3328, 3584, 3584, 3584, 3328]
    - [18, 388.933]
  - - [4288, 2944, 1, 256, 4288, 4288, 4288, 256]
    - [13, 6162.02]
  - - [448, 448, 1, 768, 448, 448, 448, 768]
    - [5, 3251.33]
  - - [704, 6784, 1, 256, 704, 704, 704, 256]
    - [13, 5358.85]
  - - [1024, 2944, 1, 128, 1024, 1024, 1024, 128]
    - [1, 2204.49]
  - - [1408, 4288, 1, 768, 1408, 1408, 1408, 768]
    - [13, 6255.16]
  - - [5056, 6784, 1, 256, 5056, 5056, 5056, 256]
    - [13, 6362.05]
  - - [256, 128, 1, 128, 256, 256, 256, 128]
    - [1, 137.098]
  - - [5056, 4, 1, 1792, 5056, 5056, 5056, 1792]
    - [18, 367.857]
  - - [2368, 1408, 1, 3328, 2368, 2368, 2368, 3328]
    - [13, 5905.73]
  - - [448, 5056, 1, 128, 448, 448, 448, 128]
    - [1, 2502.55]
  - - [704, 256, 1, 1792, 704, 704, 704, 1792]
    - [5, 3150.2]
  - - [2944, 1856, 1, 3328, 2944, 2944, 2944, 3328]
    - [13, 6247.36]
  - - [3584, 4288, 1, 768, 3584, 3584, 3584, 768]
    - [13, 6475.66]
  - - [4, 4, 1, 768, 4, 4, 4, 768]
    - [20, 0.61212]
  - - [6784, 2368, 1, 256, 6784, 6784, 6784, 256]
    - [13, 6291.67]
  - - [3584, 5056, 1, 1792, 3584, 3584, 3584, 1792]
    - [13, 6626.75]
  - - [4288, 256, 1, 128, 4288, 4288, 4288, 128]
    - [1, 1996.66]
  - - [4288, 128, 1, 3328, 4288, 4288, 4288, 3328]
    - [5, 3795.99]
  - - [1856, 2368, 1, 128, 1856, 1856, 1856, 128]
    - [1, 2815.87]
  - - [5056, 128, 1, 256, 5056, 5056, 5056, 256]
    - [5, 3399.02]
  - - [5888, 2944, 1, 128, 5888, 5888, 5888, 128]
    - [2, 3058.61]
  - - [4288, 5888, 1, 256, 4288, 4288, 4288, 256]
    - [13, 6379.16]
  - - [5888, 1856, 1, 3328, 5888, 5888, 5888, 3328]
    - [13, 6647.81]
  - - [128, 4288, 1, 768, 128, 128, 128, 768]
    - [5, 3459.27]
  - - [2368, 1408, 1, 128, 2368, 2368, 2368, 128]
    - [1, 2727.87]
  - - [1408, 64, 1, 256, 1408, 1408, 1408, 256]
    - [5, 1435.11]
  - - [3584, 128, 1, 128, 3584, 3584, 3584, 128]
    - [3, 1104.04]
  - - [4288, 64, 1, 256, 4288, 4288, 4288, 256]
    - [5, 2263.54]
  - - [128, 5056, 1, 256, 128, 128, 128, 256]
    - [5, 3163.43]
  - - [1024, 3584, 1, 3328, 1024, 1024, 1024, 3328]
    - [13, 6454.34]
  - - [1856, 4288, 1, 3328, 1856, 1856, 1856, 3328]
    - [13, 6342.96]
  - - [4, 5056, 1, 256, 4, 4, 4, 256]
    - [19, 129.911]
  - - [448, 256, 1, 768, 448, 448, 448, 768]
    - [5, 2636.47]
  - - [1024, 64, 1, 1792, 1024, 1024, 1024, 1792]
    - [14, 1288.95]
  - - [64, 1408, 1, 128, 64, 64, 64, 128]
    - [1, 389.272]
  - - [3584, 1856, 1, 128, 3584, 3584, 3584, 128]
    - [0, 2668.73]
  - - [64, 1856, 1, 256, 64, 64, 64, 256]
    - [5, 1761.85]
  - - [2368, 1024, 1, 128, 2368, 2368, 2368, 128]
    - [1, 2528.68]
  - - [5056, 1856, 1, 128, 5056, 5056, 5056, 128]
    - [1, 3118.28]
  - - [1024, 1024, 1, 3328, 1024, 1024, 1024, 3328]
    - [13, 5666.95]
  - - [64, 4288, 1, 1792, 64, 64, 64, 1792]
    - [5, 2707.55]
  - - [448, 448, 1, 1792, 448, 448, 448, 1792]
    - [5, 3526.01]
  - - [3584, 2944, 1, 128, 3584, 3584, 3584, 128]
    - [2, 2863.1]
  - - [1024, 128, 1, 128, 1024, 1024, 1024, 128]
    - [1, 559.231]
  - - [128, 4288, 1, 1792, 128, 128, 128, 1792]
    - [5, 3791.49]
  - - [1408, 1408, 1, 768, 1408, 1408, 1408, 768]
    - [13, 5758.96]
  - - [1024, 256, 1, 128, 1024, 1024, 1024, 128]
    - [1, 1020.22]
  - - [5056, 448, 1, 128, 5056, 5056, 5056, 128]
    - [1, 2525.15]
  - - [704, 704, 1, 1792, 704, 704, 704, 1792]
    - [5, 4485.47]
  - - [128, 128, 1, 128, 128, 128, 128, 128]
    - [1, 68.5501]
  - - [5056, 1856, 1, 3328, 5056, 5056, 5056, 3328]
    - [13, 6302.01]
  - - [1024, 704, 1, 128, 1024, 1024, 1024, 128]
    - [1, 1636.9]
  - - [4, 1024, 1, 768, 4, 4, 4, 768]
    - [20, 97.1774]
  - - [5888, 2368, 1, 768, 5888, 5888, 5888, 768]
    - [13, 6516.5]
  - - [5056, 2368, 1, 256, 5056, 5056, 5056, 256]
    - [13, 6078.5]
  - - [5888, 1408, 1, 128, 5888, 5888, 5888, 128]
    - [0, 2830.53]
  - - [4, 1024, 1, 128, 4, 4, 4, 128]
    - [17, 22.5408]
  - - [64, 2368, 1, 1792, 64, 64, 64, 1792]
    - [5, 2540.73]
  - - [448, 1408, 1, 3328, 448, 448, 448, 3328]
    - [5, 4594.55]
  - - [2368, 704, 1, 3328, 2368, 2368, 2368, 3328]
    - [13, 4950.85]
  - - [6784, 4288, 1, 256, 6784, 6784, 6784, 256]
    - [13, 6372.06]
  - - [1024, 4288, 1, 128, 1024, 1024, 1024, 128]
    - [1, 2277.79]
  - - [5888, 3584, 1, 1792, 5888, 5888, 5888, 1792]
    - [13, 6604.68]
  - - [5888, 3584, 1, 256, 5888, 5888, 5888, 256]
    - [13, 6338.33]
  - - [6784, 1856, 1, 1792, 6784, 6784, 6784, 1792]
    - [13, 6425.28]
  - - [4, 4, 1, 1792, 4, 4, 4, 1792]
    - [20, 1.09651]
  - - [4, 704, 1, 256, 4, 4, 4, 256]
    - [20, 26.9585]
  - - [128, 256, 1, 256, 128, 128, 128, 256]
    - [5, 529.183]
  - - [3584, 2368, 1, 1792, 3584, 3584, 3584, 1792]
    - [13, 6331.08]
  - - [5888, 5888, 1, 128, 5888, 5888, 5888, 128]
    - [2, 3176.85]
  - - [4, 128, 1, 1792, 4, 4, 4, 1792]
    - [20, 32.8542]
  - - [6784, 1856, 1, 128, 6784, 6784, 6784, 128]
    - [0, 3091.35]
  - - [2368, 448, 1, 768, 2368, 2368, 2368, 768]
    - [5, 4194.8]
  - - [2944, 64, 1, 1792, 2944, 2944, 2944, 1792]
    - [5, 3300.54]
  - - [128, 5056, 1, 768, 128, 128, 128, 768]
    - [5, 4012.96]
  - - [2944, 2368, 1, 1792, 2944, 2944, 2944, 1792]
    - [13, 6293.77]
  - - [1856, 1408, 1, 1792, 1856, 1856, 1856, 1792]
    - [7, 5915.44]
  - - [256, 4, 1, 3328, 256, 256, 256, 3328]
    - [20, 84.1045]
  - - [256, 3584, 1, 768, 256, 256, 256, 768]
    - [13, 4723.17]
  - - [2944, 2944, 1, 128, 2944, 2944, 2944, 128]
    - [1, 2978.61]
  - - [64, 5056, 1, 3328, 64, 64, 64, 3328]
    - [5, 3357.43]
  - - [3584, 1856, 1, 3328, 3584, 3584, 3584, 3328]
    - [13, 6478.15]
  - - [128, 6784, 1, 256, 128, 128, 128, 256]
    - [7, 3686.66]
  - - [5056, 4288, 1, 256, 5056, 5056, 5056, 256]
    - [13, 6332.92]
  - - [128, 704, 1, 128, 128, 128, 128, 128]
    - [1, 390.254]
  - - [2944, 1024, 1, 768, 2944, 2944, 2944, 768]
    - [13, 6026.85]
  - - [2944, 1024, 1, 128, 2944, 2944, 2944, 128]
    - [1, 2582.66]
  - - [5888, 2944, 1, 1792, 5888, 5888, 5888, 1792]
    - [13, 6539.23]
  - - [64, 3584, 1, 256, 64, 64, 64, 256]
    - [5, 2424.15]
  - - [2368, 2368, 1, 128, 2368, 2368, 2368, 128]
    - [1, 2918.5]
  - - [5888, 2368, 1, 1792, 5888, 5888, 5888, 1792]
    - [13, 6591.93]
  - - [1856, 448, 1, 128, 1856, 1856, 1856, 128]
    - [2, 1846.76]
  - - [704, 3584, 1, 1792, 704, 704, 704, 1792]
    - [7, 5703.98]
  - - [1024, 5056, 1, 1792, 1024, 1024, 1024, 1792]
    - [13, 6421.3]
  - - [5888, 1024, 1, 128, 5888, 5888, 5888, 128]
    - [0, 2708.19]
  - - [5888, 4, 1, 1792, 5888, 5888, 5888, 1792]
    - [18, 376.078]
  - - [256, 2368, 1, 256, 256, 256, 256, 256]
    - [5, 3357.37]
  - - [6784, 2368, 1, 3328, 6784, 6784, 6784, 3328]
    - [13, 6649.92]
  - - [704, 2368, 1, 256, 704, 704, 704, 256]
    - [13, 4309.09]
  - - [2944, 4288, 1, 256, 2944, 2944, 2944, 256]
    - [13, 6203.2]
  - - [448, 704, 1, 768, 448, 448, 448, 768]
    - [5, 3309.62]
  - - [256, 128, 1, 3328, 256, 256, 256, 3328]
    - [15, 1217.67]
  - - [2944, 704, 1, 1792, 2944, 2944, 2944, 1792]
    - [13, 6149.71]
  - - [4, 3584, 1, 1792, 4, 4, 4, 1792]
    - [20, 327.797]
  - - [6784, 4288, 1, 768, 6784, 6784, 6784, 768]
    - [13, 6602.07]
  - - [1024, 64, 1, 3328, 1024, 1024, 1024, 3328]
    - [8, 1511.46]
  - - [256, 128, 1, 768, 256, 256, 256, 768]
    - [5, 766.888]
  - - [4, 704, 1, 768, 4, 4, 4, 768]
    - [20, 72.0884]
  - - [256, 2368, 1, 128, 256, 256, 256, 128]
    - [1, 1146.06]
  - - [5888, 4288, 1, 1792, 5888, 5888, 5888, 1792]
    - [13, 6617.61]
  - - [5888, 128, 1, 1792, 5888, 5888, 5888, 1792]
    - [5, 4456.67]
  - - [1856, 1024, 1, 256, 1856, 1856, 1856, 256]
    - [13, 5052.41]
  - - [4, 3584, 1, 768, 4, 4, 4, 768]
    - [19, 234.436]
  - - [2944, 1408, 1, 1792, 2944, 2944, 2944, 1792]
    - [13, 6423.49]
  - - [1408, 5056, 1, 1792, 1408, 1408, 1408, 1792]
    - [13, 6424.98]
  - - [2944, 1024, 1, 256, 2944, 2944, 2944, 256]
    - [13, 5652.97]
  - - [704, 5056, 1, 3328, 704, 704, 704, 3328]
    - [7, 5880.06]
  - - [6784, 2368, 1, 768, 6784, 6784, 6784, 768]
    - [13, 6542.27]
  - - [1408, 256, 1, 1792, 1408, 1408, 1408, 1792]
    - [5, 3990.74]
  - - [3584, 1408, 1, 128, 3584, 3584, 3584, 128]
    - [0, 2584.4]
  - - [256, 4288, 1, 256, 256, 256, 256, 256]
    - [5, 3726.56]
  - - [448, 64, 1, 3328, 448, 448, 448, 3328]
    - [8, 1099.1]
  - - [5056, 1408, 1, 256, 5056, 5056, 5056, 256]
    - [13, 6015.2]
  - - [5056, 1408, 1, 1792, 5056, 5056, 5056, 1792]
    - [13, 6418.52]
  - - [64, 2944, 1, 128, 64, 64, 64, 128]
    - [1, 691.247]
  - - [1408, 1024, 1, 1792, 1408, 1408, 1408, 1792]
    - [13, 5576.18]
  - - [448, 4288, 1, 768, 448, 448, 448, 768]
    - [7, 5157.09]
  - - [128, 1856, 1, 1792, 128, 128, 128, 1792]
    - [5, 4044.4]
  - - [3584, 4288, 1, 3328, 3584, 3584, 3584, 3328]
    - [13, 6574.24]
  - - [2944, 1408, 1, 256, 2944, 2944, 2944, 256]
    - [13, 5946.58]
  - - [128, 1856, 1, 768, 128, 128, 128, 768]
    - [5, 3681.7]
  - - [256, 5888, 1, 256, 256, 256, 256, 256]
    - [13, 4951.7]
  - - [4288, 128, 1, 1792, 4288, 4288, 4288, 1792]
    - [5, 3727.63]
  - - [1408, 128, 1, 768, 1408, 1408, 1408, 768]
    - [5, 2914.98]
  - - [6784, 5888, 1, 3328, 6784, 6784, 6784, 3328]
    - [13, 6706.02]
  - - [2944, 64, 1, 3328, 2944, 2944, 2944, 3328]
    - [5, 3407.8]
  - - [6784, 6784, 1, 768, 6784, 6784, 6784, 768]
    - [13, 6668.32]
  - - [5888, 4, 1, 256, 5888, 5888, 5888, 256]
    - [18, 164.765]
  - - [5888, 1408, 1, 768, 5888, 5888, 5888, 768]
    - [13, 6446.55]
  - - [5056, 256, 1, 3328, 5056, 5056, 5056, 3328]
    - [13, 5044.73]
  - - [64, 2368, 1, 768, 64, 64, 64, 768]
    - [5, 2303.9]
  - - [448, 704, 1, 1792, 448, 448, 448, 1792]
    - [5, 3493.49]
  - - [704, 5888, 1, 1792, 704, 704, 704, 1792]
    - [7, 5969.95]
  - - [128, 6784, 1, 1792, 128, 128, 128, 1792]
    - [13, 4618.89]
  - - [5056, 2944, 1, 128, 5056, 5056, 5056, 128]
    - [1, 3227.16]
  - - [1024, 4, 1, 256, 1024, 1024, 1024, 256]
    - [19, 35.1252]
  - - [256, 64, 1, 128, 256, 256, 256, 128]
    - [1, 67.8921]
  - - [6784, 1408, 1, 768, 6784, 6784, 6784, 768]
    - [13, 6300.52]
  - - [5056, 256, 1, 128, 5056, 5056, 5056, 128]
    - [1, 2266.03]
  - - [256, 256, 1, 3328, 256, 256, 256, 3328]
    - [15, 2020.82]
  - - [704, 1408, 1, 1792, 704, 704, 704, 1792]
    - [7, 5322.83]
  - - [256, 64, 1, 768, 256, 256, 256, 768]
    - [5, 379.163]
  - - [6784, 1024, 1, 256, 6784, 6784, 6784, 256]
    - [13, 5878.45]
  - - [3584, 1856, 1, 768, 3584, 3584, 3584, 768]
    - [13, 6334.65]
  - - [5888, 5888, 1, 256, 5888, 5888, 5888, 256]
    - [13, 6398.49]
  - - [448, 6784, 1, 3328, 448, 448, 448, 3328]
    - [7, 5831.7]
  - - [256, 704, 1, 256, 256, 256, 256, 256]
    - [5, 2216.54]
  - - [4288, 448, 1, 128, 4288, 4288, 4288, 128]
    - [1, 2431.83]
  - - [64, 1024, 1, 1792, 64, 64, 64, 1792]
    - [5, 1494.27]
  - - [3584, 4288, 1, 256, 3584, 3584, 3584, 256]
    - [13, 6226.41]
  - - [6784, 5888, 1, 768, 6784, 6784, 6784, 768]
    - [13, 6613.52]
  - - [5056, 64, 1, 768, 5056, 5056, 5056, 768]
    - [5, 3250.8]
  - - [1856, 3584, 1, 1792, 1856, 1856, 1856, 1792]
    - [13, 6008.26]
  - - [1856, 1024, 1, 128, 1856, 1856, 1856, 128]
    - [1, 2379.76]
  - - [6784, 5056, 1, 1792, 6784, 6784, 6784, 1792]
    - [13, 6685.39]
  - - [1408, 704, 1, 3328, 1408, 1408, 1408, 3328]
    - [13, 5486.39]
  - - [2944, 64, 1, 128, 2944, 2944, 2944, 128]
    - [1, 695.673]
  - - [1856, 1024, 1, 3328, 1856, 1856, 1856, 3328]
    - [13, 5675.73]
  - - [2944, 704, 1, 256, 2944, 2944, 2944, 256]
    - [13, 5526.75]
  - - [128, 4288, 1, 3328, 128, 128, 128, 3328]
    - [5, 3946.04]
  - - [6784, 4288, 1, 3328, 6784, 6784, 6784, 3328]
    - [13, 6699.8]
  - - [256, 5888, 1, 768, 256, 256, 256, 768]
    - [13, 5581.3]
  - - [64, 448, 1, 1792, 64, 64, 64, 1792]
    - [8, 774.125]
  - - [704, 704, 1, 3328, 704, 704, 704, 3328]
    - [5, 4596.72]
  - - [5056, 704, 1, 128, 5056, 5056, 5056, 128]
    - [1, 2734.79]
  - - [4288, 4, 1, 1792, 4288, 4288, 4288, 1792]
    - [18, 344.343]
  - - [4288, 2368, 1, 1792, 4288, 4288, 4288, 1792]
    - [13, 6463.69]
  - - [1856, 2944, 1, 3328, 1856, 1856, 1856, 3328]
    - [13, 6271.94]
  - - [3584, 3584, 1, 3328, 3584, 3584, 3584, 3328]
    - [13, 6585.97]
  - - [1856, 1024, 1, 1792, 1856, 1856, 1856, 1792]
    - [13, 5636.5]
  - - [2368, 4, 1, 768, 2368, 2368, 2368, 768]
    - [19, 186.344]
  - - [2368, 3584, 1, 768, 2368, 2368, 2368, 768]
    - [13, 6257.31]
  - - [4288, 64, 1, 3328, 4288, 4288, 4288, 3328]
    - [5, 2997.67]
  - - [3584, 3584, 1, 768, 3584, 3584, 3584, 768]
    - [13, 6472.01]
  - - [4288, 704, 1, 3328, 4288, 4288, 4288, 3328]
    - [13, 6181.27]
  - - [256, 1408, 1, 3328, 256, 256, 256, 3328]
    - [5, 4099.7]
  - - [1408, 128, 1, 3328, 1408, 1408, 1408, 3328]
    - [5, 3238.77]
  - - [2944, 1856, 1, 256, 2944, 2944, 2944, 256]
    - [13, 5869.86]
  - - [5056, 1856, 1, 1792, 5056, 5056, 5056, 1792]
    - [13, 6285.6]
  - - [2944, 4, 1, 128, 2944, 2944, 2944, 128]
    - [17, 59.1527]
  - - [4288, 2368, 1, 768, 4288, 4288, 4288, 768]
    - [13, 6398.47]
  - - [704, 5888, 1, 256, 704, 704, 704, 256]
    - [7, 5503.39]
  - - [4288, 2368, 1, 128, 4288, 4288, 4288, 128]
    - [1, 3146.08]
  - - [704, 1408, 1, 768, 704, 704, 704, 768]
    - [7, 5133.28]
  - - [256, 64, 1, 1792, 256, 256, 256, 1792]
    - [8, 514.742]
  - - [256, 5888, 1, 1792, 256, 256, 256, 1792]
    - [13, 5790.77]
  - - [5056, 3584, 1, 256, 5056, 5056, 5056, 256]
    - [13, 6290.68]
  - - [2368, 64, 1, 3328, 2368, 2368, 2368, 3328]
    - [5, 2724.6]
  - - [448, 2944, 1, 768, 448, 448, 448, 768]
    - [13, 4811.46]
  - - [128, 1024, 1, 1792, 128, 128, 128, 1792]
    - [5, 2791.2]
  - - [256, 4, 1, 256, 256, 256, 256, 256]
    - [20, 11.641]
  - - [5056, 5056, 1, 256, 5056, 5056, 5056, 256]
    - [13, 6324.75]
  - - [5056, 128, 1, 3328, 5056, 5056, 5056, 3328]
    - [5, 4398.02]
  - - [4288, 3584, 1, 128, 4288, 4288, 4288, 128]
    - [1, 3251.58]
  - - [3584, 704, 1, 256, 3584, 3584, 3584, 256]
    - [13, 5525.83]
  - - [1408, 448, 1, 128, 1408, 1408, 1408, 128]
    - [1, 1624.41]
  - - [5056, 1408, 1, 768, 5056, 5056, 5056, 768]
    - [13, 6333.69]
  - - [5888, 6784, 1, 3328, 5888, 5888, 5888, 3328]
    - [13, 6710.26]
  - - [4, 256, 1, 128, 4, 4, 4, 128]
    - [17, 5.85901]
  - - [4288, 1408, 1, 3328, 4288, 4288, 4288, 3328]
    - [13, 6346.73]
  - - [64, 2944, 1, 1792, 64, 64, 64, 1792]
    - [5, 3016.58]
  - - [5888, 2944, 1, 3328, 5888, 5888, 5888, 3328]
    - [13, 6561.87]
  - - [256, 1856, 1, 768, 256, 256, 256, 768]
    - [5, 4057.74]
  - - [4288, 448, 1, 256, 4288, 4288, 4288, 256]
    - [13, 5067.86]
  - - [4, 5056, 1, 3328, 4, 4, 4, 3328]
    - [20, 319.481]
  - - [5888, 256, 1, 128, 5888, 5888, 5888, 128]
    - [2, 2095.41]
  - - [64, 1024, 1, 128, 64, 64, 64, 128]
    - [1, 284.528]
  - - [256, 5888, 1, 128, 256, 256, 256, 128]
    - [2, 1989.76]
  - - [704, 5056, 1, 768, 704, 704, 704, 768]
    - [7, 5649.62]
  - - [5056, 4288, 1, 128, 5056, 5056, 5056, 128]
    - [1, 3290.79]
  - - [1856, 5888, 1, 1792, 1856, 1856, 1856, 1792]
    - [13, 6347.05]
  - - [1856, 4, 1, 128, 1856, 1856, 1856, 128]
    - [17, 37.8414]
  - - [704, 2368, 1, 3328, 704, 704, 704, 3328]
    - [13, 4974.86]
  - - [2944, 1856, 1, 768, 2944, 2944, 2944, 768]
    - [13, 6151.6]
  - - [2368, 4288, 1, 1792, 2368, 2368, 2368, 1792]
    - [13, 6467.6]
  - - [1024, 128, 1, 256, 1024, 1024, 1024, 256]
    - [6, 1769.42]
  - - [4, 2944, 1, 256, 4, 4, 4, 256]
    - [19, 93.7728]
  - - [1024, 5888, 1, 128, 1024, 1024, 1024, 128]
    - [0, 2407.77]
  - - [2368, 5056, 1, 768, 2368, 2368, 2368, 768]
    - [13, 6320.87]
  - - [5056, 5888, 1, 1792, 5056, 5056, 5056, 1792]
    - [13, 6617.59]
  - - [256, 704, 1, 768, 256, 256, 256, 768]
    - [5, 2915.01]
  - - [1024, 448, 1, 768, 1024, 1024, 1024, 768]
    - [13, 3792.85]
  - - [1856, 2944, 1, 1792, 1856, 1856, 1856, 1792]
    - [13, 6222.75]
  - - [2368, 128, 1, 3328, 2368, 2368, 2368, 3328]
    - [5, 3399.29]
  - - [3584, 2944, 1, 256, 3584, 3584, 3584, 256]
    - [13, 6074.37]
  - - [3584, 3584, 1, 128, 3584, 3584, 3584, 128]
    - [0, 2971.32]
  - - [1408, 1024, 1, 768, 1408, 1408, 1408, 768]
    - [13, 5433.72]
  - - [2368, 448, 1, 128, 2368, 2368, 2368, 128]
    - [1, 1986.06]
  - - [64, 3584, 1, 128, 64, 64, 64, 128]
    - [1, 867.296]
  - - [704, 2944, 1, 768, 704, 704, 704, 768]
    - [7, 5620.71]
  - - [6784, 5056, 1, 256, 6784, 6784, 6784, 256]
    - [13, 6405.02]
  - - [1408, 3584, 1, 128, 1408, 1408, 1408, 128]
    - [2, 2761.16]
  - - [5888, 4, 1, 128, 5888, 5888, 5888, 128]
    - [17, 112.733]
  - - [128, 2944, 1, 3328, 128, 128, 128, 3328]
    - [5, 4142.38]
  - - [64, 1856, 1, 1792, 64, 64, 64, 1792]
    - [5, 2485.78]
  - - [1856, 1856, 1, 3328, 1856, 1856, 1856, 3328]
    - [13, 6104.03]
  - - [5888, 6784, 1, 768, 5888, 5888, 5888, 768]
    - [13, 6618.06]
  - - [4288, 4288, 1, 256, 4288, 4288, 4288, 256]
    - [13, 6302.08]
  - - [2944, 2944, 1, 3328, 2944, 2944, 2944, 3328]
    - [13, 6498.58]
  - - [704, 1024, 1, 768, 704, 704, 704, 768]
    - [5, 4237.01]
  - - [1408, 448, 1, 1792, 1408, 1408, 1408, 1792]
    - [5, 4506.67]
  - - [64, 2944, 1, 768, 64, 64, 64, 768]
    - [5, 2636.25]
  - - [448, 5056, 1, 3328, 448, 448, 448, 3328]
    - [13, 5474.1]
  - - [1408, 2368, 1, 1792, 1408, 1408, 1408, 1792]
    - [13, 5874.14]
  - - [128, 2368, 1, 1792, 128, 128, 128, 1792]
    - [5, 3204.78]
  - - [2944, 2944, 1, 256, 2944, 2944, 2944, 256]
    - [13, 6160.62]
  - - [1856, 5056, 1, 1792, 1856, 1856, 1856, 1792]
    - [13, 6291.53]
  - - [64, 448, 1, 768, 64, 64, 64, 768]
    - [5, 662.059]
  - - [2944, 256, 1, 256, 2944, 2944, 2944, 256]
    - [5, 3612.5]
  - - [2368, 128, 1, 128, 2368, 2368, 2368, 128]
    - [1, 1049.61]
  - - [256, 2368, 1, 3328, 256, 256, 256, 3328]
    - [5, 4456.0]
  - - [1024, 1408, 1, 768, 1024, 1024, 1024, 768]
    - [13, 5319.63]
  - - [6784, 4, 1, 256, 6784, 6784, 6784, 256]
    - [19, 180.345]
  - - [4288, 1408, 1, 768, 4288, 4288, 4288, 768]
    - [13, 6248.92]
  - - [2368, 5056, 1, 256, 2368, 2368, 2368, 256]
    - [13, 6116.24]
  - - [1408, 4288, 1, 3328, 1408, 1408, 1408, 3328]
    - [13, 6368.49]
  - - [4288, 256, 1, 768, 4288, 4288, 4288, 768]
    - [13, 4125.04]
  - - [64, 64, 1, 256, 64, 64, 64, 256]
    - [5, 55.5111]
  - - [5888, 1024, 1, 1792, 5888, 5888, 5888, 1792]
    - [13, 6308.45]
  - - [1856, 2944, 1, 256, 1856, 1856, 1856, 256]
    - [13, 5839.02]
  - - [1024, 2944, 1, 768, 1024, 1024, 1024, 768]
    - [13, 5930.78]
  - - [128, 2368, 1, 768, 128, 128, 128, 768]
    - [5, 2978.68]
  - - [5056, 1856, 1, 256, 5056, 5056, 5056, 256]
    - [13, 5984.52]
  - - [4288, 1408, 1, 256, 4288, 4288, 4288, 256]
    - [13, 5939.4]
  - - [448, 64, 1, 256, 448, 448, 448, 256]
    - [5, 456.626]
  - - [448, 128, 1, 1792, 448, 448, 448, 1792]
    - [5, 1369.44]
  - - [3584, 1408, 1, 1792, 3584, 3584, 3584, 1792]
    - [13, 6290.34]
  - - [2368, 128, 1, 768, 2368, 2368, 2368, 768]
    - [5, 3083.92]
  - - [4, 64, 1, 1792, 4, 4, 4, 1792]
    - [20, 17.0135]
  - - [256, 4, 1, 128, 256, 256, 256, 128]
    - [17, 5.65307]
  - - [448, 5888, 1, 768, 448, 448, 448, 768]
    - [13, 5116.62]
  - - [64, 1856, 1, 3328, 64, 64, 64, 3328]
    - [5, 2607.04]
  - - [1408, 2944, 1, 128, 1408, 1408, 1408, 128]
    - [2, 2742.21]
  - - [1024, 5056, 1, 128, 1024, 1024, 1024, 128]
    - [0, 2456.41]
  - - [5056, 64, 1, 3328, 5056, 5056, 5056, 3328]
    - [5, 3508.97]
  - - [1856, 2944, 1, 128, 1856, 1856, 1856, 128]
    - [1, 2892.68]
  - - [2944, 2368, 1, 256, 2944, 2944, 2944, 256]
    - [13, 5964.99]
  - - [256, 6784, 1, 768, 256, 256, 256, 768]
    - [13, 4991.88]
  - - [4, 1408, 1, 768, 4, 4, 4, 768]
    - [20, 125.302]
  - - [2944, 4, 1, 1792, 2944, 2944, 2944, 1792]
    - [19, 297.99]
  - - [256, 1856, 1, 1792, 256, 256, 256, 1792]
    - [5, 4324.39]
  - - [2944, 4, 1, 768, 2944, 2944, 2944, 768]
    - [19, 206.582]
  - - [128, 1408, 1, 256, 128, 128, 128, 256]
    - [5, 2208.64]
  - - [1408, 704, 1, 128, 1408, 1408, 1408, 128]
    - [1, 1977.84]
  - - [1856, 2368, 1, 768, 1856, 1856, 1856, 768]
    - [13, 5987.7]
  - - [1856, 6784, 1, 3328, 1856, 1856, 1856, 3328]
    - [13, 6470.98]
  - - [64, 448, 1, 3328, 64, 64, 64, 3328]
    - [8, 1072.56]
  - - [1024, 6784, 1, 256, 1024, 1024, 1024, 256]
    - [13, 5794.75]
  - - [2368, 3584, 1, 128, 2368, 2368, 2368, 128]
    - [1, 3068.0]
  - - [4288, 4, 1, 256, 4288, 4288, 4288, 256]
    - [18, 134.717]
  - - [5056, 448, 1, 256, 5056, 5056, 5056, 256]
    - [13, 4945.02]
  - - [1856, 6784, 1, 1792, 1856, 1856, 1856, 1792]
    - [13, 6438.73]
  - - [6784, 2944, 1, 3328, 6784, 6784, 6784, 3328]
    - [13, 6590.18]
  - - [256, 1408, 1, 128, 256, 256, 256, 128]
    - [4, 911.913]
  - - [4, 64, 1, 256, 4, 4, 4, 256]
    - [20, 3.62588]
  - - [448, 1408, 1, 1792, 448, 448, 448, 1792]
    - [5, 4471.02]
  - - [3584, 1024, 1, 1792, 3584, 3584, 3584, 1792]
    - [13, 6447.1]
  - - [1408, 2368, 1, 128, 1408, 1408, 1408, 128]
    - [1, 2602.2]
  - - [448, 256, 1, 1792, 448, 448, 448, 1792]
    - [5, 2578.5]
  - - [1024, 6784, 1, 128, 1024, 1024, 1024, 128]
    - [2, 2564.92]
  - - [6784, 448, 1, 128, 6784, 6784, 6784, 128]
    - [1, 2529.7]
  - - [1024, 2944, 1, 256, 1024, 1024, 1024, 256]
    - [13, 5448.96]
  - - [1024, 1024, 1, 1792, 1024, 1024, 1024, 1792]
    - [13, 5560.41]
  - - [64, 704, 1, 1792, 64, 64, 64, 1792]
    - [8, 1094.35]
  - - [2944, 1408, 1, 768, 2944, 2944, 2944, 768]
    - [13, 6310.71]
  - - [64, 1024, 1, 3328, 64, 64, 64, 3328]
    - [10, 1980.05]
  - - [1408, 2368, 1, 3328, 1408, 1408, 1408, 3328]
    - [13, 5913.89]
  - - [704, 1408, 1, 3328, 704, 704, 704, 3328]
    - [7, 5385.54]
  - - [6784, 128, 1, 768, 6784, 6784, 6784, 768]
    - [13, 4588.61]
  - - [5056, 704, 1, 3328, 5056, 5056, 5056, 3328]
    - [13, 6293.85]
  - - [5056, 3584, 1, 1792, 5056, 5056, 5056, 1792]
    - [13, 6635.47]
  - - [256, 2944, 1, 3328, 256, 256, 256, 3328]
    - [5, 4764.29]
  - - [2368, 64, 1, 256, 2368, 2368, 2368, 256]
    - [5, 1911.48]
  - - [6784, 1024, 1, 128, 6784, 6784, 6784, 128]
    - [0, 2917.09]
  - - [3584, 5056, 1, 768, 3584, 3584, 3584, 768]
    - [13, 6551.97]
  - - [1408, 1856, 1, 256, 1408, 1408, 1408, 256]
    - [13, 5745.03]
  - - [3584, 1408, 1, 3328, 3584, 3584, 3584, 3328]
    - [13, 6335.08]
  - - [5056, 5888, 1, 768, 5056, 5056, 5056, 768]
    - [13, 6557.71]
  - - [1856, 128, 1, 1792, 1856, 1856, 1856, 1792]
    - [5, 4105.08]
  - - [64, 5056, 1, 128, 64, 64, 64, 128]
    - [1, 947.689]
  - - [6784, 6784, 1, 128, 6784, 6784, 6784, 128]
    - [2, 3291.07]
  - - [448, 1856, 1, 128, 448, 448, 448, 128]
    - [2, 1839.67]
  - - [1408, 1024, 1, 128, 1408, 1408, 1408, 128]
    - [1, 2198.9]
  - - [256, 448, 1, 1792, 256, 256, 256, 1792]
    - [5, 2685.85]
  - - [128, 1408, 1, 128, 128, 128, 128, 128]
    - [1, 692.046]
  - - [3584, 704, 1, 768, 3584, 3584, 3584, 768]
    - [13, 5954.76]
  - - [256, 5888, 1, 3328, 256, 256, 256, 3328]
    - [13, 5868.26]
  - - [704, 704, 1, 128, 704, 704, 704, 128]
    - [1, 1577.18]
  - - [1408, 128, 1, 128, 1408, 1408, 1408, 128]
    - [1, 729.317]
  - - [1408, 256, 1, 256, 1408, 1408, 1408, 256]
    - [5, 3091.02]
  - - [2368, 2368, 1, 3328, 2368, 2368, 2368, 3328]
    - [13, 6431.07]
  - - [1024, 5056, 1, 256, 1024, 1024, 1024, 256]
    - [13, 5805.48]
  - - [3584, 1408, 1, 768, 3584, 3584, 3584, 768]
    - [13, 6176.19]
  - - [704, 64, 1, 1792, 704, 704, 704, 1792]
    - [8, 1122.52]
  - - [6784, 5056, 1, 3328, 6784, 6784, 6784, 3328]
    - [13, 6709.44]
  - - [1408, 6784, 1, 768, 1408, 1408, 1408, 768]
    - [13, 6339.64]
  - - [5056, 1024, 1, 3328, 5056, 5056, 5056, 3328]
    - [13, 6498.0]
  - - [128, 4, 1, 3328, 128, 128, 128, 3328]
    - [20, 45.822]
  - - [1024, 128, 1, 768, 1024, 1024, 1024, 768]
    - [6, 2013.23]
  - - [4, 1856, 1, 768, 4, 4, 4, 768]
    - [19, 153.023]
  - - [448, 2944, 1, 128, 448, 448, 448, 128]
    - [1, 2118.06]
  - - [1024, 4, 1, 3328, 1024, 1024, 1024, 3328]
    - [20, 217.261]
  - - [64, 704, 1, 768, 64, 64, 64, 768]
    - [5, 1004.57]
  - - [1024, 2368, 1, 1792, 1024, 1024, 1024, 1792]
    - [13, 5797.6]
  - - [1024, 1856, 1, 1792, 1024, 1024, 1024, 1792]
    - [13, 5591.94]
  - - [704, 64, 1, 128, 704, 704, 704, 128]
    - [1, 188.055]
  - - [1024, 256, 1, 256, 1024, 1024, 1024, 256]
    - [5, 2903.7]
  - - [4288, 704, 1, 768, 4288, 4288, 4288, 768]
    - [13, 6022.26]
  - - [1024, 128, 1, 3328, 1024, 1024, 1024, 3328]
    - [12, 2793.48]
  - - [1856, 256, 1, 1792, 1856, 1856, 1856, 1792]
    - [5, 4293.7]
  - - [5056, 2368, 1, 128, 5056, 5056, 5056, 128]
    - [1, 3165.75]
  - - [2944, 3584, 1, 3328, 2944, 2944, 2944, 3328]
    - [13, 6434.61]
  - - [256, 4288, 1, 1792, 256, 256, 256, 1792]
    - [5, 4602.36]
  - - [256, 4288, 1, 3328, 256, 256, 256, 3328]
    - [5, 4706.33]
  - - [6784, 1856, 1, 3328, 6784, 6784, 6784, 3328]
    - [13, 6459.89]
  - - [1024, 256, 1, 3328, 1024, 1024, 1024, 3328]
    - [11, 4183.78]
  - - [256, 6784, 1, 1792, 256, 256, 256, 1792]
    - [13, 5129.84]
  - - [256, 704, 1, 3328, 256, 256, 256, 3328]
    - [5, 3303.52]
  - - [3584, 4288, 1, 128, 3584, 3584, 3584, 128]
    - [0, 2982.77]
  - - [256, 448, 1, 3328, 256, 256, 256, 3328]
    - [5, 2770.21]
  - - [1024, 2368, 1, 768, 1024, 1024, 1024, 768]
    - [13, 5616.63]
  - - [64, 3584, 1, 1792, 64, 64, 64, 1792]
    - [5, 3509.77]
  - - [5056, 6784, 1, 128, 5056, 5056, 5056, 128]
    - [1, 3345.12]
  - - [64, 5056, 1, 768, 64, 64, 64, 768]
    - [7, 2562.91]
  - - [1024, 4, 1, 128, 1024, 1024, 1024, 128]
    - [17, 20.8171]
  - - [256, 1024, 1, 128, 256, 256, 256, 128]
    - [1, 770.357]
  - - [5888, 4, 1, 3328, 5888, 5888, 5888, 3328]
    - [18, 434.903]
  - - [3584, 1856, 1, 256, 3584, 3584, 3584, 256]
    - [13, 5967.92]
  - - [256, 1408, 1, 256, 256, 256, 256, 256]
    - [5, 3083.33]
  - - [4, 3584, 1, 256, 4, 4, 4, 256]
    - [19, 109.854]
  - - [704, 64, 1, 768, 704, 704, 704, 768]
    - [5, 1042.7]
  - - [64, 128, 1, 3328, 64, 64, 64, 3328]
    - [9, 436.585]
  - - [5888, 5056, 1, 256, 5888, 5888, 5888, 256]
    - [13, 6421.28]
  - - [1856, 5056, 1, 128, 1856, 1856, 1856, 128]
    - [1, 3050.24]
  - - [1408, 64, 1, 768, 1408, 1408, 1408, 768]
    - [5, 1914.47]
  - - [6784, 448, 1, 256, 6784, 6784, 6784, 256]
    - [13, 5616.77]
  - - [4288, 448, 1, 3328, 4288, 4288, 4288, 3328]
    - [13, 5743.0]
  - - [4288, 6784, 1, 3328, 4288, 4288, 4288, 3328]
    - [13, 6603.95]
  - - [448, 4, 1, 3328, 448, 448, 448, 3328]
    - [20, 129.643]
  - - [1024, 2944, 1, 3328, 1024, 1024, 1024, 3328]
    - [13, 6145.16]
  - - [3584, 5888, 1, 128, 3584, 3584, 3584, 128]
    - [0, 3087.07]
  - - [1408, 5888, 1, 3328, 1408, 1408, 1408, 3328]
    - [13, 6608.2]
  - - [5888, 2944, 1, 768, 5888, 5888, 5888, 768]
    - [13, 6480.28]
  - - [3584, 128, 1, 256, 3584, 3584, 3584, 256]
    - [13, 3209.33]
  - - [704, 4, 1, 768, 704, 704, 704, 768]
    - [20, 67.7396]
  - - [6784, 4, 1, 128, 6784, 6784, 6784, 128]
    - [17, 125.376]
  - - [4, 2944, 1, 768, 4, 4, 4, 768]
    - [19, 210.501]
  - - [128, 2944, 1, 256, 128, 128, 128, 256]
    - [5, 3007.65]
  - - [6784, 64, 1, 768, 6784, 6784, 6784, 768]
    - [13, 3636.05]
  - - [704, 5888, 1, 3328, 704, 704, 704, 3328]
    - [7, 6018.07]
  - - [448, 128, 1, 128, 448, 448, 448, 128]
    - [1, 256.04]
  - - [5888, 5888, 1, 768, 5888, 5888, 5888, 768]
    - [13, 6601.07]
  - - [2944, 5056, 1, 256, 2944, 2944, 2944, 256]
    - [13, 6311.77]
  - - [3584, 256, 1, 1792, 3584, 3584, 3584, 1792]
    - [13, 5023.93]
  - - [4, 64, 1, 128, 4, 4, 4, 128]
    - [17, 1.25313]
  - - [2368, 2944, 1, 1792, 2368, 2368, 2368, 1792]
    - [13, 6298.24]
  - - [2368, 704, 1, 128, 2368, 2368, 2368, 128]
    - [1, 2310.05]
  - - [128, 1408, 1, 3328, 128, 128, 128, 3328]
    - [5, 3274.13]
  - - [64, 448, 1, 256, 64, 64, 64, 256]
    - [5, 454.533]
  - - [1408, 5888, 1, 128, 1408, 1408, 1408, 128]
    - [0, 2976.38]
  - - [3584, 5056, 1, 128, 3584, 3584, 3584, 128]
    - [0, 3029.1]
  - - [448, 4288, 1, 128, 448, 448, 448, 128]
    - [1, 2377.84]
  - - [1856, 3584, 1, 128, 1856, 1856, 1856, 128]
    - [1, 2968.55]
  - - [4, 1856, 1, 3328, 4, 4, 4, 3328]
    - [19, 323.823]
  - - [704, 2368, 1, 128, 704, 704, 704, 128]
    - [1, 2297.16]
  - - [5888, 1408, 1, 1792, 5888, 5888, 5888, 1792]
    - [13, 6550.43]
  - - [1408, 4, 1, 128, 1408, 1408, 1408, 128]
    - [17, 28.7927]
  - - [2368, 256, 1, 128, 2368, 2368, 2368, 128]
    - [1, 1587.13]
  - - [2368, 1856, 1, 3328, 2368, 2368, 2368, 3328]
    - [13, 6124.33]
  - - [5056, 128, 1, 128, 5056, 5056, 5056, 128]
    - [1, 1684.15]
  - - [704, 4288, 1, 256, 704, 704, 704, 256]
    - [7, 5124.06]
  - - [1856, 4, 1, 3328, 1856, 1856, 1856, 3328]
    - [19, 320.709]
  - - [704, 1024, 1, 256, 704, 704, 704, 256]
    - [5, 3528.84]
  - - [64, 64, 1, 3328, 64, 64, 64, 3328]
    - [9, 243.413]
- null
