lib/configs/lite_configs_mixed/vega10_Cijk_Alik_Bjlk_SB.yaml
- {MinimumRequiredVersion: 4.9.4}
- vega10
- gfx900
- [Device 6863, Device 6862, Device 687f, Device 6860, Device 6861, 'Vega 10 XTX [Radeon
    SolutionIndex: 0
    SolutionNameMin: Cijk_Alik_Bjlk_SB_MT32x32x8_SE_GSU1
    SolutionIndex: 1
    SolutionNameMin: Cijk_Alik_Bjlk_SB_MT64x64x16_SE_GSU1
    SolutionIndex: 2
    SolutionNameMin: Cijk_Alik_Bjlk_SB_MT64x128x16_SE_GSU1
    SolutionIndex: 3
    SolutionNameMin: Cijk_Alik_Bjlk_SB_MT128x64x16_SE_GSU1
    SolutionIndex: 4
    SolutionNameMin: Cijk_Alik_Bjlk_SB_MT128x128x8_SE_GSU1
    SolutionIndex: 5
    SolutionNameMin: Cijk_Alik_Bjlk_SB_MT32x32x8_SE_GSU1
    SolutionIndex: 6
    SolutionNameMin: Cijk_Alik_Bjlk_SB_MT64x32x32_SE_GSU8
    SolutionIndex: 7
    SolutionNameMin: Cijk_Alik_Bjlk_SB_MT64x128x16_SE_GSU1
    SolutionIndex: 8
    SolutionNameMin: Cijk_Alik_Bjlk_SB_MT32x64x16_SE_GSU8
    SolutionIndex: 9
    SolutionNameMin: Cijk_Alik_Bjlk_SB_MT64x128x16_SE_GSU2
    SolutionIndex: 10
    SolutionNameMin: Cijk_Alik_Bjlk_SB_MT64x64x16_SE_GSU2
    SolutionIndex: 11
    SolutionNameMin: Cijk_Alik_Bjlk_SB_MT32x64x16_SE_GSU1
    SolutionIndex: 12
    SolutionNameMin: Cijk_Alik_Bjlk_SB_MT64x64x16_SE_GSU1
    SolutionIndex: 13
    SolutionNameMin: Cijk_Alik_Bjlk_SB_MT32x64x16_SE_GSU4
    SolutionIndex: 14
    SolutionNameMin: Cijk_Alik_Bjlk_SB_MT64x128x16_SE_GSU4
    SolutionIndex: 15
    SolutionNameMin: Cijk_Alik_Bjlk_SB_MT16x16x4_SE_GSU1
    SolutionIndex: 16
    SolutionNameMin: Cijk_Alik_Bjlk_SB_MT8x8x8_SE_GSU2
    SolutionIndex: 17
    SolutionNameMin: Cijk_Alik_Bjlk_SB_MT8x8x8_SE_GSU4
    SolutionIndex: 18
    SolutionNameMin: Cijk_Alik_Bjlk_SB_MT8x8x8_SE_GSU8
- - - [256, 2944, 1, 256, 256, 256, 256, 2944]
    - [11, 3653.02]
  - - [5056, 128, 1, 768, 5056, 5056, 768, 128]
    - [11, 4206.71]
  - - [1408, 2944, 1, 256, 1408, 1408, 256, 2944]
    - [7, 5689.17]
  - - [448, 128, 1, 128, 448, 448, 128, 128]
    - [0, 240.503]
  - - [448, 64, 1, 1792, 448, 448, 1792, 64]
    - [13, 768.13]
  - - [128, 704, 1, 1792, 128, 128, 1792, 704]
    - [11, 2100.14]
  - - [448, 64, 1, 3328, 448, 448, 3328, 64]
    - [8, 1303.79]
  - - [448, 3584, 1, 128, 448, 448, 128, 3584]
    - [1, 2279.75]
  - - [1856, 64, 1, 768, 1856, 1856, 768, 64]
    - [11, 2453.24]
  - - [1408, 3584, 1, 256, 1408, 1408, 256, 3584]
    - [7, 5609.37]
  - - [5056, 448, 1, 256, 5056, 5056, 256, 448]
    - [7, 4432.61]
  - - [2944, 64, 1, 1792, 2944, 2944, 1792, 64]
    - [11, 3258.08]
  - - [448, 4288, 1, 3328, 448, 448, 3328, 4288]
    - [7, 5593.02]
  - - [3584, 704, 1, 256, 3584, 3584, 256, 704]
    - [4, 4331.74]
  - - [4288, 5056, 1, 3328, 4288, 4288, 3328, 5056]
    - [7, 6372.8]
  - - [2368, 256, 1, 3328, 2368, 2368, 3328, 256]
    - [14, 3746.24]
  - - [704, 1856, 1, 768, 704, 704, 768, 1856]
    - [11, 4751.58]
  - - [1408, 6784, 1, 128, 1408, 1408, 128, 6784]
    - [1, 3121.27]
  - - [4288, 5056, 1, 128, 4288, 4288, 128, 5056]
    - [1, 3386.28]
  - - [4288, 4, 1, 128, 4288, 4288, 128, 4]
    - [15, 88.7376]
  - - [3584, 6784, 1, 256, 3584, 3584, 256, 6784]
    - [4, 6043.37]
  - - [448, 2368, 1, 768, 448, 448, 768, 2368]
    - [11, 4273.03]
  - - [6784, 1856, 1, 128, 6784, 6784, 128, 1856]
    - [1, 3177.59]
  - - [1856, 704, 1, 3328, 1856, 1856, 3328, 704]
    - [11, 5012.19]
  - - [64, 256, 1, 256, 64, 64, 256, 256]
    - [11, 264.591]
  - - [256, 6784, 1, 256, 256, 256, 256, 6784]
    - [4, 4377.78]
  - - [448, 5056, 1, 3328, 448, 448, 3328, 5056]
    - [7, 5334.08]
  - - [128, 256, 1, 768, 128, 128, 768, 256]
    - [11, 758.327]
  - - [2368, 1024, 1, 3328, 2368, 2368, 3328, 1024]
    - [7, 5345.2]
  - - [704, 5056, 1, 768, 704, 704, 768, 5056]
    - [7, 5875.39]
  - - [256, 2368, 1, 1792, 256, 256, 1792, 2368]
    - [11, 4305.65]
  - - [1408, 3584, 1, 3328, 1408, 1408, 3328, 3584]
    - [4, 6209.13]
  - - [1856, 5056, 1, 1792, 1856, 1856, 1792, 5056]
    - [7, 6030.0]
  - - [1856, 128, 1, 3328, 1856, 1856, 3328, 128]
    - [11, 4247.21]
  - - [2944, 3584, 1, 768, 2944, 2944, 768, 3584]
    - [7, 6063.27]
  - - [1408, 2944, 1, 128, 1408, 1408, 128, 2944]
    - [1, 2803.4]
  - - [1408, 1024, 1, 128, 1408, 1408, 128, 1024]
    - [2, 2050.5]
  - - [256, 1856, 1, 768, 256, 256, 768, 1856]
    - [11, 4044.43]
  - - [1856, 2368, 1, 256, 1856, 1856, 256, 2368]
    - [7, 5331.28]
  - - [704, 3584, 1, 128, 704, 704, 128, 3584]
    - [1, 2634.37]
  - - [1024, 4288, 1, 3328, 1024, 1024, 3328, 4288]
    - [7, 5861.73]
  - - [2368, 2944, 1, 768, 2368, 2368, 768, 2944]
    - [4, 6017.64]
  - - [6784, 128, 1, 3328, 6784, 6784, 3328, 128]
    - [7, 4829.47]
  - - [4288, 5888, 1, 3328, 4288, 4288, 3328, 5888]
    - [4, 6404.43]
  - - [64, 448, 1, 1792, 64, 64, 1792, 448]
    - [13, 764.74]
  - - [2944, 5056, 1, 256, 2944, 2944, 256, 5056]
    - [7, 5914.12]
  - - [2944, 448, 1, 768, 2944, 2944, 768, 448]
    - [7, 4649.5]
  - - [5056, 704, 1, 768, 5056, 5056, 768, 704]
    - [4, 5213.81]
  - - [256, 2944, 1, 3328, 256, 256, 3328, 2944]
    - [11, 4727.71]
  - - [1024, 1024, 1, 3328, 1024, 1024, 3328, 1024]
    - [7, 5850.64]
  - - [6784, 1024, 1, 3328, 6784, 6784, 3328, 1024]
    - [4, 5814.41]
  - - [5888, 4, 1, 128, 5888, 5888, 128, 4]
    - [15, 114.639]
  - - [2368, 64, 1, 3328, 2368, 2368, 3328, 64]
    - [11, 2734.46]
  - - [1024, 1408, 1, 768, 1024, 1024, 768, 1408]
    - [7, 5195.74]
  - - [2944, 4, 1, 1792, 2944, 2944, 1792, 4]
    - [17, 333.582]
  - - [4, 4, 1, 256, 4, 4, 256, 4]
    - [18, 0.225694]
  - - [4, 6784, 1, 3328, 4, 4, 3328, 6784]
    - [16, 444.132]
  - - [1024, 1024, 1, 768, 1024, 1024, 768, 1024]
    - [7, 5493.37]
  - - [64, 4, 1, 768, 64, 64, 768, 4]
    - [18, 9.58175]
  - - [2944, 6784, 1, 256, 2944, 2944, 256, 6784]
    - [4, 6030.77]
  - - [2368, 1856, 1, 128, 2368, 2368, 128, 1856]
    - [1, 2989.92]
  - - [1024, 5056, 1, 768, 1024, 1024, 768, 5056]
    - [4, 6081.75]
  - - [5056, 2944, 1, 1792, 5056, 5056, 1792, 2944]
    - [7, 6299.09]
  - - [4, 4, 1, 128, 4, 4, 128, 4]
    - [15, 0.000121757]
  - - [1856, 2944, 1, 256, 1856, 1856, 256, 2944]
    - [7, 5631.8]
  - - [1024, 256, 1, 128, 1024, 1024, 128, 256]
    - [0, 905.958]
  - - [6784, 128, 1, 1792, 6784, 6784, 1792, 128]
    - [7, 4755.88]
  - - [1408, 1408, 1, 3328, 1408, 1408, 3328, 1408]
    - [4, 5811.06]
  - - [5056, 5888, 1, 128, 5056, 5056, 128, 5888]
    - [1, 3426.66]
  - - [64, 128, 1, 128, 64, 64, 128, 128]
    - [0, 34.3581]
  - - [1024, 704, 1, 768, 1024, 1024, 768, 704]
    - [11, 4127.05]
  - - [4288, 3584, 1, 256, 4288, 4288, 256, 3584]
    - [7, 6005.35]
  - - [448, 256, 1, 768, 448, 448, 768, 256]
    - [11, 2535.31]
  - - [1024, 448, 1, 256, 1024, 1024, 256, 448]
    - [11, 3151.88]
  - - [128, 2944, 1, 768, 128, 128, 768, 2944]
    - [11, 3696.22]
  - - [4288, 6784, 1, 768, 4288, 4288, 768, 6784]
    - [7, 6337.66]
  - - [256, 5056, 1, 768, 256, 256, 768, 5056]
    - [11, 4624.19]
  - - [4288, 64, 1, 1792, 4288, 4288, 1792, 64]
    - [11, 3062.23]
  - - [2944, 1408, 1, 3328, 2944, 2944, 3328, 1408]
    - [4, 6310.73]
  - - [128, 1856, 1, 1792, 128, 128, 1792, 1856]
    - [11, 4152.53]
  - - [1024, 6784, 1, 768, 1024, 1024, 768, 6784]
    - [4, 5962.66]
  - - [5056, 64, 1, 256, 5056, 5056, 256, 64]
    - [11, 2662.56]
  - - [4288, 6784, 1, 3328, 4288, 4288, 3328, 6784]
    - [7, 6433.34]
  - - [64, 2368, 1, 128, 64, 64, 128, 2368]
    - [0, 606.199]
  - - [4, 3584, 1, 256, 4, 4, 256, 3584]
    - [16, 117.403]
  - - [256, 1856, 1, 128, 256, 256, 128, 1856]
    - [0, 1330.67]
  - - [2368, 4, 1, 768, 2368, 2368, 768, 4]
    - [17, 189.218]
  - - [448, 1856, 1, 768, 448, 448, 768, 1856]
    - [7, 4299.58]
  - - [448, 1856, 1, 256, 448, 448, 256, 1856]
    - [7, 3741.62]
  - - [128, 128, 1, 1792, 128, 128, 1792, 128]
    - [8, 485.131]
  - - [3584, 4, 1, 3328, 3584, 3584, 3328, 4]
    - [17, 408.936]
  - - [5056, 64, 1, 1792, 5056, 5056, 1792, 64]
    - [11, 3590.81]
  - - [3584, 6784, 1, 1792, 3584, 3584, 1792, 6784]
    - [4, 6386.9]
  - - [4288, 1024, 1, 256, 4288, 4288, 256, 1024]
    - [7, 5435.06]
  - - [2368, 4288, 1, 768, 2368, 2368, 768, 4288]
    - [7, 6097.91]
  - - [2944, 128, 1, 3328, 2944, 2944, 3328, 128]
    - [11, 4167.89]
  - - [64, 704, 1, 3328, 64, 64, 3328, 704]
    - [13, 1539.34]
  - - [6784, 1856, 1, 3328, 6784, 6784, 3328, 1856]
    - [7, 6184.95]
  - - [5056, 2368, 1, 1792, 5056, 5056, 1792, 2368]
    - [4, 6224.17]
  - - [64, 6784, 1, 128, 64, 64, 128, 6784]
    - [0, 1280.27]
  - - [1024, 256, 1, 1792, 1024, 1024, 1792, 256]
    - [11, 4539.47]
  - - [5888, 5056, 1, 128, 5888, 5888, 128, 5056]
    - [3, 3065.98]
  - - [128, 2368, 1, 1792, 128, 128, 1792, 2368]
    - [11, 3331.46]
  - - [3584, 4288, 1, 128, 3584, 3584, 128, 4288]
    - [3, 2996.91]
  - - [3584, 5056, 1, 3328, 3584, 3584, 3328, 5056]
    - [7, 6372.18]
  - - [2944, 4, 1, 256, 2944, 2944, 256, 4]
    - [16, 100.735]
  - - [448, 5888, 1, 1792, 448, 448, 1792, 5888]
    - [7, 5192.68]
  - - [128, 1408, 1, 256, 128, 128, 256, 1408]
    - [5, 2298.31]
  - - [64, 5888, 1, 768, 64, 64, 768, 5888]
    - [11, 3689.25]
  - - [2368, 2368, 1, 1792, 2368, 2368, 1792, 2368]
    - [7, 6116.23]
  - - [256, 448, 1, 1792, 256, 256, 1792, 448]
    - [11, 2632.34]
  - - [1024, 6784, 1, 3328, 1024, 1024, 3328, 6784]
    - [4, 6162.86]
  - - [1024, 5056, 1, 1792, 1024, 1024, 1792, 5056]
    - [4, 6280.28]
  - - [6784, 5056, 1, 128, 6784, 6784, 128, 5056]
    - [1, 3305.2]
  - - [5888, 64, 1, 768, 5888, 5888, 768, 64]
    - [11, 3793.11]
  - - [1856, 1408, 1, 128, 1856, 1856, 128, 1408]
    - [1, 2723.52]
  - - [3584, 6784, 1, 768, 3584, 3584, 768, 6784]
    - [4, 6305.17]
  - - [704, 2944, 1, 256, 704, 704, 256, 2944]
    - [7, 5325.42]
  - - [2368, 5888, 1, 3328, 2368, 2368, 3328, 5888]
    - [7, 6358.12]
  - - [5056, 1856, 1, 768, 5056, 5056, 768, 1856]
    - [7, 5930.55]
  - - [5888, 448, 1, 768, 5888, 5888, 768, 448]
    - [4, 5010.7]
  - - [1024, 5888, 1, 128, 1024, 1024, 128, 5888]
    - [1, 2607.21]
  - - [1408, 448, 1, 1792, 1408, 1408, 1792, 448]
    - [11, 4502.68]
  - - [256, 1408, 1, 3328, 256, 256, 3328, 1408]
    - [11, 4094.53]
  - - [128, 1856, 1, 256, 128, 128, 256, 1856]
    - [11, 2974.68]
  - - [704, 4, 1, 256, 704, 704, 256, 4]
    - [17, 27.965]
  - - [128, 4, 1, 128, 128, 128, 128, 4]
    - [15, 3.01954]
  - - [1856, 128, 1, 768, 1856, 1856, 768, 128]
    - [11, 3848.51]
  - - [3584, 6784, 1, 3328, 3584, 3584, 3328, 6784]
    - [4, 6421.13]
  - - [2368, 4, 1, 256, 2368, 2368, 256, 4]
    - [17, 84.5862]
  - - [704, 3584, 1, 1792, 704, 704, 1792, 3584]
    - [7, 5880.95]
  - - [1024, 64, 1, 768, 1024, 1024, 768, 64]
    - [11, 1403.85]
  - - [64, 64, 1, 256, 64, 64, 256, 64]
    - [11, 55.2944]
  - - [256, 448, 1, 3328, 256, 256, 3328, 448]
    - [11, 2768.72]
  - - [2944, 6784, 1, 1792, 2944, 2944, 1792, 6784]
    - [7, 6304.46]
  - - [64, 5056, 1, 128, 64, 64, 128, 5056]
    - [0, 970.722]
  - - [256, 1856, 1, 256, 256, 256, 256, 1856]
    - [11, 3277.51]
  - - [4288, 3584, 1, 128, 4288, 4288, 128, 3584]
    - [1, 3270.8]
  - - [128, 4, 1, 1792, 128, 128, 1792, 4]
    - [18, 33.4758]
  - - [128, 1856, 1, 128, 128, 128, 128, 1856]
    - [0, 864.24]
  - - [448, 6784, 1, 1792, 448, 448, 1792, 6784]
    - [7, 5970.72]
  - - [64, 1856, 1, 256, 64, 64, 256, 1856]
    - [11, 1857.47]
  - - [2944, 5056, 1, 128, 2944, 2944, 128, 5056]
    - [1, 3198.67]
  - - [128, 4, 1, 3328, 128, 128, 3328, 4]
    - [18, 46.3763]
  - - [448, 1408, 1, 3328, 448, 448, 3328, 1408]
    - [11, 4623.04]
  - - [448, 4, 1, 1792, 448, 448, 1792, 4]
    - [18, 95.277]
  - - [64, 704, 1, 1792, 64, 64, 1792, 704]
    - [11, 1062.35]
  - - [3584, 704, 1, 1792, 3584, 3584, 1792, 704]
    - [4, 4978.26]
  - - [448, 4288, 1, 128, 448, 448, 128, 4288]
    - [1, 2444.38]
  - - [4, 3584, 1, 128, 4, 4, 128, 3584]
    - [15, 75.2947]
  - - [5888, 64, 1, 256, 5888, 5888, 256, 64]
    - [11, 2953.06]
  - - [1856, 4288, 1, 768, 1856, 1856, 768, 4288]
    - [4, 6027.19]
  - - [448, 256, 1, 3328, 448, 448, 3328, 256]
    - [11, 2870.53]
  - - [128, 4288, 1, 256, 128, 128, 256, 4288]
    - [11, 3049.58]
  - - [2368, 704, 1, 256, 2368, 2368, 256, 704]
    - [7, 4094.72]
  - - [256, 128, 1, 768, 256, 256, 768, 128]
    - [11, 773.869]
  - - [5056, 5056, 1, 3328, 5056, 5056, 3328, 5056]
    - [4, 6474.05]
  - - [4288, 1024, 1, 1792, 4288, 4288, 1792, 1024]
    - [7, 5781.14]
  - - [5056, 4, 1, 3328, 5056, 5056, 3328, 4]
    - [16, 168.51]
  - - [2944, 2944, 1, 3328, 2944, 2944, 3328, 2944]
    - [7, 6238.91]
  - - [1856, 64, 1, 1792, 1856, 1856, 1792, 64]
    - [11, 2675.56]
  - - [3584, 448, 1, 3328, 3584, 3584, 3328, 448]
    - [11, 4782.94]
  - - [1856, 448, 1, 256, 1856, 1856, 256, 448]
    - [7, 3587.44]
  - - [704, 2944, 1, 3328, 704, 704, 3328, 2944]
    - [7, 6046.8]
  - - [4288, 5056, 1, 256, 4288, 4288, 256, 5056]
    - [7, 5992.56]
  - - [2944, 256, 1, 768, 2944, 2944, 768, 256]
    - [12, 4019.46]
  - - [4, 704, 1, 128, 4, 4, 128, 704]
    - [15, 15.2538]
  - - [4, 1024, 1, 768, 4, 4, 768, 1024]
    - [18, 101.595]
  - - [128, 3584, 1, 1792, 128, 128, 1792, 3584]
    - [7, 4151.84]
  - - [1856, 1856, 1, 128, 1856, 1856, 128, 1856]
    - [1, 2841.23]
  - - [5056, 4288, 1, 256, 5056, 5056, 256, 4288]
    - [7, 6030.18]
  - - [5888, 2368, 1, 256, 5888, 5888, 256, 2368]
    - [4, 5772.77]
  - - [5056, 64, 1, 3328, 5056, 5056, 3328, 64]
    - [11, 3679.5]
  - - [704, 6784, 1, 768, 704, 704, 768, 6784]
    - [4, 5659.6]
  - - [2944, 1024, 1, 768, 2944, 2944, 768, 1024]
    - [4, 5798.76]
  - - [1408, 64, 1, 3328, 1408, 1408, 3328, 64]
    - [11, 2206.25]
  - - [1856, 256, 1, 128, 1856, 1856, 128, 256]
    - [0, 1540.36]
  - - [256, 5056, 1, 3328, 256, 256, 3328, 5056]
    - [11, 4955.32]
  - - [4288, 1024, 1, 768, 4288, 4288, 768, 1024]
    - [7, 5736.4]
  - - [5056, 704, 1, 128, 5056, 5056, 128, 704]
    - [1, 2847.48]
  - - [4288, 2368, 1, 768, 4288, 4288, 768, 2368]
    - [7, 6079.95]
  - - [2944, 5056, 1, 3328, 2944, 2944, 3328, 5056]
    - [7, 6316.79]
  - - [4, 256, 1, 128, 4, 4, 128, 256]
    - [15, 5.59945]
  - - [704, 1408, 1, 256, 704, 704, 256, 1408]
    - [7, 4705.54]
  - - [6784, 6784, 1, 1792, 6784, 6784, 1792, 6784]
    - [4, 6627.01]
  - - [1408, 2368, 1, 3328, 1408, 1408, 3328, 2368]
    - [7, 5686.91]
  - - [4, 64, 1, 128, 4, 4, 128, 64]
    - [15, 1.39107]
  - - [1856, 704, 1, 1792, 1856, 1856, 1792, 704]
    - [11, 4922.01]
  - - [448, 448, 1, 128, 448, 448, 128, 448]
    - [0, 837.698]
  - - [448, 128, 1, 1792, 448, 448, 1792, 128]
    - [11, 1342.92]
  - - [2944, 1856, 1, 128, 2944, 2944, 128, 1856]
    - [1, 2966.29]
  - - [5888, 1856, 1, 1792, 5888, 5888, 1792, 1856]
    - [4, 6182.74]
  - - [128, 1024, 1, 3328, 128, 128, 3328, 1024]
    - [10, 2983.13]
  - - [256, 5888, 1, 1792, 256, 256, 1792, 5888]
    - [7, 5606.47]
  - - [4, 6784, 1, 1792, 4, 4, 1792, 6784]
    - [16, 401.751]
  - - [2944, 3584, 1, 3328, 2944, 2944, 3328, 3584]
    - [7, 6172.22]
  - - [2368, 3584, 1, 256, 2368, 2368, 256, 3584]
    - [7, 5770.24]
  - - [5888, 5056, 1, 768, 5888, 5888, 768, 5056]
    - [4, 6394.03]
  - - [1024, 2368, 1, 3328, 1024, 1024, 3328, 2368]
    - [7, 5692.96]
  - - [704, 64, 1, 3328, 704, 704, 3328, 64]
    - [13, 1578.96]
  - - [4, 1408, 1, 768, 4, 4, 768, 1408]
    - [18, 125.573]
  - - [4288, 128, 1, 256, 4288, 4288, 256, 128]
    - [11, 2987.14]
  - - [2944, 6784, 1, 128, 2944, 2944, 128, 6784]
    - [1, 3271.19]
  - - [64, 5056, 1, 256, 64, 64, 256, 5056]
    - [11, 2594.59]
  - - [5888, 3584, 1, 1792, 5888, 5888, 1792, 3584]
    - [4, 6332.45]
  - - [1024, 128, 1, 1792, 1024, 1024, 1792, 128]
    - [11, 2930.52]
  - - [4, 5888, 1, 768, 4, 4, 768, 5888]
    - [16, 295.62]
  - - [1408, 1024, 1, 3328, 1408, 1408, 3328, 1024]
    - [7, 5469.05]
  - - [2944, 128, 1, 768, 2944, 2944, 768, 128]
    - [11, 3785.77]
  - - [64, 1024, 1, 256, 64, 64, 256, 1024]
    - [11, 1034.19]
  - - [3584, 2368, 1, 768, 3584, 3584, 768, 2368]
    - [7, 5934.08]
  - - [5056, 4288, 1, 768, 5056, 5056, 768, 4288]
    - [7, 6258.7]
  - - [5888, 2944, 1, 256, 5888, 5888, 256, 2944]
    - [4, 6005.62]
  - - [6784, 4, 1, 128, 6784, 6784, 128, 4]
    - [15, 130.978]
  - - [1856, 1856, 1, 768, 1856, 1856, 768, 1856]
    - [7, 5689.7]
  - - [1024, 64, 1, 128, 1024, 1024, 128, 64]
    - [0, 273.534]
  - - [704, 128, 1, 1792, 704, 704, 1792, 128]
    - [11, 2143.5]
  - - [2944, 2368, 1, 1792, 2944, 2944, 1792, 2368]
    - [4, 6125.1]
  - - [2944, 1024, 1, 3328, 2944, 2944, 3328, 1024]
    - [4, 6013.93]
  - - [256, 128, 1, 128, 256, 256, 128, 128]
    - [0, 135.134]
  - - [3584, 64, 1, 1792, 3584, 3584, 1792, 64]
    - [11, 4015.16]
  - - [4, 5888, 1, 128, 4, 4, 128, 5888]
    - [15, 115.946]
  - - [128, 256, 1, 128, 128, 128, 128, 256]
    - [0, 140.154]
  - - [1408, 6784, 1, 768, 1408, 1408, 768, 6784]
    - [7, 6051.43]
  - - [2368, 448, 1, 768, 2368, 2368, 768, 448]
    - [11, 4177.29]
  - - [1856, 1408, 1, 1792, 1856, 1856, 1792, 1408]
    - [7, 6105.69]
  - - [1024, 1856, 1, 128, 1024, 1024, 128, 1856]
    - [1, 2139.46]
  - - [2944, 64, 1, 3328, 2944, 2944, 3328, 64]
    - [11, 3418.82]
  - - [1856, 256, 1, 768, 1856, 1856, 768, 256]
    - [7, 4027.89]
  - - [5056, 5888, 1, 1792, 5056, 5056, 1792, 5888]
    - [4, 6484.38]
  - - [704, 5888, 1, 1792, 704, 704, 1792, 5888]
    - [7, 6170.15]
  - - [4, 5888, 1, 3328, 4, 4, 3328, 5888]
    - [16, 449.691]
  - - [6784, 64, 1, 1792, 6784, 6784, 1792, 64]
    - [11, 3938.26]
  - - [1856, 2368, 1, 128, 1856, 1856, 128, 2368]
    - [1, 2966.56]
  - - [3584, 128, 1, 1792, 3584, 3584, 1792, 128]
    - [7, 4148.74]
  - - [5888, 2944, 1, 3328, 5888, 5888, 3328, 2944]
    - [4, 6438.05]
  - - [1408, 704, 1, 128, 1408, 1408, 128, 704]
    - [0, 2010.34]
  - - [704, 5056, 1, 1792, 704, 704, 1792, 5056]
    - [7, 6012.69]
  - - [5888, 704, 1, 256, 5888, 5888, 256, 704]
    - [7, 4910.99]
  - - [1024, 256, 1, 768, 1024, 1024, 768, 256]
    - [11, 4174.86]
  - - [4288, 448, 1, 1792, 4288, 4288, 1792, 448]
    - [11, 4883.1]
  - - [2944, 2944, 1, 128, 2944, 2944, 128, 2944]
    - [1, 3058.92]
  - - [4, 1024, 1, 256, 4, 4, 256, 1024]
    - [17, 39.4298]
  - - [4, 64, 1, 1792, 4, 4, 1792, 64]
    - [18, 17.644]
  - - [5888, 3584, 1, 768, 5888, 5888, 768, 3584]
    - [4, 6254.81]
  - - [1408, 4, 1, 3328, 1408, 1408, 3328, 4]
    - [18, 334.696]
  - - [704, 256, 1, 128, 704, 704, 128, 256]
    - [0, 763.282]
  - - [704, 6784, 1, 3328, 704, 704, 3328, 6784]
    - [4, 5863.81]
  - - [128, 5888, 1, 768, 128, 128, 768, 5888]
    - [11, 4212.3]
  - - [1024, 5888, 1, 3328, 1024, 1024, 3328, 5888]
    - [4, 6212.54]
  - - [1408, 2944, 1, 768, 1408, 1408, 768, 2944]
    - [4, 6095.89]
  - - [2944, 4288, 1, 128, 2944, 2944, 128, 4288]
    - [1, 3196.6]
  - - [1856, 1024, 1, 1792, 1856, 1856, 1792, 1024]
    - [4, 5476.71]
  - - [704, 1408, 1, 768, 704, 704, 768, 1408]
    - [7, 5248.66]
  - - [704, 5056, 1, 3328, 704, 704, 3328, 5056]
    - [7, 6070.24]
  - - [256, 256, 1, 1792, 256, 256, 1792, 256]
    - [11, 1557.37]
  - - [448, 1024, 1, 3328, 448, 448, 3328, 1024]
    - [7, 4256.58]
  - - [1856, 1024, 1, 128, 1856, 1856, 128, 1024]
    - [1, 2339.07]
  - - [4, 704, 1, 3328, 4, 4, 3328, 704]
    - [18, 197.988]
  - - [2944, 1408, 1, 768, 2944, 2944, 768, 1408]
    - [4, 6100.22]
  - - [256, 256, 1, 768, 256, 256, 768, 256]
    - [11, 1544.25]
  - - [4288, 2368, 1, 3328, 4288, 4288, 3328, 2368]
    - [7, 6222.57]
  - - [2944, 704, 1, 1792, 2944, 2944, 1792, 704]
    - [11, 4939.29]
  - - [64, 1408, 1, 3328, 64, 64, 3328, 1408]
    - [11, 2188.36]
  - - [1024, 128, 1, 3328, 1024, 1024, 3328, 128]
    - [11, 3127.27]
  - - [4, 128, 1, 256, 4, 4, 256, 128]
    - [18, 6.83165]
  - - [5888, 448, 1, 1792, 5888, 5888, 1792, 448]
    - [4, 5185.94]
  - - [2944, 1856, 1, 1792, 2944, 2944, 1792, 1856]
    - [7, 5967.13]
  - - [1024, 448, 1, 768, 1024, 1024, 768, 448]
    - [11, 3873.15]
  - - [3584, 3584, 1, 1792, 3584, 3584, 1792, 3584]
    - [7, 6270.63]
  - - [64, 3584, 1, 1792, 64, 64, 1792, 3584]
    - [12, 3636.27]
  - - [704, 1024, 1, 1792, 704, 704, 1792, 1024]
    - [7, 3954.54]
  - - [1408, 6784, 1, 256, 1408, 1408, 256, 6784]
    - [7, 5801.51]
  - - [64, 4, 1, 3328, 64, 64, 3328, 4]
    - [18, 24.0615]
  - - [3584, 6784, 1, 128, 3584, 3584, 128, 6784]
    - [3, 3076.78]
  - - [5888, 1856, 1, 768, 5888, 5888, 768, 1856]
    - [4, 6065.01]
  - - [704, 5056, 1, 256, 704, 704, 256, 5056]
    - [7, 5476.89]
  - - [128, 6784, 1, 1792, 128, 128, 1792, 6784]
    - [7, 4760.19]
  - - [2368, 256, 1, 768, 2368, 2368, 768, 256]
    - [11, 3300.96]
  - - [2944, 448, 1, 3328, 2944, 2944, 3328, 448]
    - [7, 4967.29]
  - - [4, 256, 1, 1792, 4, 4, 1792, 256]
    - [18, 62.8729]
  - - [128, 64, 1, 1792, 128, 128, 1792, 64]
    - [8, 308.207]
  - - [2368, 2368, 1, 768, 2368, 2368, 768, 2368]
    - [7, 6005.84]
  - - [1024, 6784, 1, 128, 1024, 1024, 128, 6784]
    - [1, 2650.44]
  - - [704, 704, 1, 256, 704, 704, 256, 704]
    - [11, 3474.29]
  - - [2944, 704, 1, 128, 2944, 2944, 128, 704]
    - [0, 2464.78]
  - - [6784, 5056, 1, 1792, 6784, 6784, 1792, 5056]
    - [4, 6395.41]
  - - [64, 3584, 1, 256, 64, 64, 256, 3584]
    - [11, 2705.44]
  - - [1024, 3584, 1, 768, 1024, 1024, 768, 3584]
    - [7, 5994.94]
  - - [3584, 4288, 1, 256, 3584, 3584, 256, 4288]
    - [4, 5873.2]
  - - [448, 4288, 1, 256, 448, 448, 256, 4288]
    - [7, 4776.21]
  - - [128, 3584, 1, 3328, 128, 128, 3328, 3584]
    - [7, 4261.86]
  - - [64, 4, 1, 256, 64, 64, 256, 4]
    - [18, 3.78089]
  - - [5888, 6784, 1, 1792, 5888, 5888, 1792, 6784]
    - [4, 6502.36]
  - - [2368, 1856, 1, 768, 2368, 2368, 768, 1856]
    - [7, 5716.53]
  - - [256, 5056, 1, 128, 256, 256, 128, 5056]
    - [0, 1783.54]
  - - [4, 704, 1, 768, 4, 4, 768, 704]
    - [18, 72.9898]
  - - [1024, 1856, 1, 3328, 1024, 1024, 3328, 1856]
    - [4, 5549.21]
  - - [64, 256, 1, 1792, 64, 64, 1792, 256]
    - [8, 485.725]
  - - [704, 6784, 1, 128, 704, 704, 128, 6784]
    - [1, 2992.25]
  - - [4, 448, 1, 3328, 4, 4, 3328, 448]
    - [18, 138.57]
  - - [1856, 2944, 1, 128, 1856, 1856, 128, 2944]
    - [1, 3093.61]
  - - [3584, 1408, 1, 128, 3584, 3584, 128, 1408]
    - [1, 2678.88]
  - - [3584, 5056, 1, 768, 3584, 3584, 768, 5056]
    - [7, 6220.3]
  - - [6784, 2944, 1, 1792, 6784, 6784, 1792, 2944]
    - [7, 6306.02]
  - - [6784, 64, 1, 768, 6784, 6784, 768, 64]
    - [11, 3704.89]
  - - [1856, 128, 1, 256, 1856, 1856, 256, 128]
    - [11, 2942.73]
  - - [4288, 5056, 1, 768, 4288, 4288, 768, 5056]
    - [7, 6256.78]
  - - [1408, 704, 1, 768, 1408, 1408, 768, 704]
    - [11, 4422.06]
  - - [704, 3584, 1, 256, 704, 704, 256, 3584]
    - [7, 5346.27]
  - - [1024, 5888, 1, 256, 1024, 1024, 256, 5888]
    - [4, 5543.19]
  - - [704, 1024, 1, 128, 704, 704, 128, 1024]
    - [0, 1826.5]
  - - [1024, 2944, 1, 256, 1024, 1024, 256, 2944]
    - [4, 5206.61]
  - - [2368, 64, 1, 1792, 2368, 2368, 1792, 64]
    - [11, 2626.27]
  - - [704, 128, 1, 3328, 704, 704, 3328, 128]
    - [11, 2212.28]
  - - [5888, 5888, 1, 3328, 5888, 5888, 3328, 5888]
    - [4, 6484.44]
  - - [128, 6784, 1, 256, 128, 128, 256, 6784]
    - [7, 3892.28]
  - - [2944, 64, 1, 256, 2944, 2944, 256, 64]
    - [11, 2229.98]
  - - [1408, 3584, 1, 1792, 1408, 1408, 1792, 3584]
    - [4, 6158.03]
  - - [5888, 1408, 1, 1792, 5888, 5888, 1792, 1408]
    - [4, 6405.46]
  - - [64, 6784, 1, 3328, 64, 64, 3328, 6784]
    - [7, 4037.72]
  - - [1024, 448, 1, 3328, 1024, 1024, 3328, 448]
    - [7, 4227.77]
  - - [3584, 4, 1, 768, 3584, 3584, 768, 4]
    - [17, 249.803]
  - - [5056, 3584, 1, 1792, 5056, 5056, 1792, 3584]
    - [7, 6364.03]
  - - [256, 704, 1, 1792, 256, 256, 1792, 704]
    - [11, 3196.4]
  - - [5056, 4, 1, 1792, 5056, 5056, 1792, 4]
    - [16, 165.847]
  - - [448, 1024, 1, 128, 448, 448, 128, 1024]
    - [0, 1492.86]
  - - [1856, 3584, 1, 1792, 1856, 1856, 1792, 3584]
    - [7, 6189.92]
  - - [1856, 1856, 1, 3328, 1856, 1856, 3328, 1856]
    - [7, 5871.53]
  - - [1856, 2368, 1, 768, 1856, 1856, 768, 2368]
    - [7, 5732.35]
  - - [128, 704, 1, 256, 128, 128, 256, 704]
    - [11, 1428.53]
  - - [3584, 1408, 1, 768, 3584, 3584, 768, 1408]
    - [4, 6012.95]
  - - [2944, 448, 1, 1792, 2944, 2944, 1792, 448]
    - [7, 4934.5]
  - - [4288, 3584, 1, 768, 4288, 4288, 768, 3584]
    - [4, 6329.57]
  - - [256, 4288, 1, 128, 256, 256, 128, 4288]
    - [1, 1645.12]
  - - [2944, 128, 1, 1792, 2944, 2944, 1792, 128]
    - [11, 4078.81]
  - - [5056, 1408, 1, 768, 5056, 5056, 768, 1408]
    - [4, 6127.07]
  - - [256, 1024, 1, 1792, 256, 256, 1792, 1024]
    - [12, 4120.63]
  - - [4288, 128, 1, 768, 4288, 4288, 768, 128]
    - [11, 3587.96]
  - - [1024, 3584, 1, 1792, 1024, 1024, 1792, 3584]
    - [7, 6150.11]
  - - [256, 3584, 1, 128, 256, 256, 128, 3584]
    - [1, 1721.41]
  - - [4288, 1408, 1, 256, 4288, 4288, 256, 1408]
    - [7, 5716.49]
  - - [448, 2368, 1, 3328, 448, 448, 3328, 2368]
    - [11, 4530.13]
  - - [1024, 2368, 1, 768, 1024, 1024, 768, 2368]
    - [7, 5466.43]
  - - [704, 2368, 1, 1792, 704, 704, 1792, 2368]
    - [11, 4902.02]
  - - [1024, 2944, 1, 3328, 1024, 1024, 3328, 2944]
    - [4, 6020.87]
  - - [128, 2368, 1, 256, 128, 128, 256, 2368]
    - [11, 2586.44]
  - - [6784, 64, 1, 128, 6784, 6784, 128, 64]
    - [0, 1293.51]
  - - [5888, 128, 1, 3328, 5888, 5888, 3328, 128]
    - [11, 4644.71]
  - - [3584, 128, 1, 768, 3584, 3584, 768, 128]
    - [7, 3857.44]
  - - [128, 6784, 1, 768, 128, 128, 768, 6784]
    - [7, 4572.31]
  - - [64, 5888, 1, 1792, 64, 64, 1792, 5888]
    - [11, 4111.91]
  - - [5888, 64, 1, 128, 5888, 5888, 128, 64]
    - [0, 1342.59]
  - - [4, 6784, 1, 256, 4, 4, 256, 6784]
    - [16, 188.314]
  - - [448, 448, 1, 768, 448, 448, 768, 448]
    - [11, 3302.96]
  - - [64, 128, 1, 768, 64, 64, 768, 128]
    - [11, 193.47]
  - - [2368, 5888, 1, 1792, 2368, 2368, 1792, 5888]
    - [7, 6329.81]
  - - [4, 4288, 1, 3328, 4, 4, 3328, 4288]
    - [16, 418.345]
  - - [64, 1856, 1, 1792, 64, 64, 1792, 1856]
    - [11, 2646.01]
  - - [6784, 5056, 1, 256, 6784, 6784, 256, 5056]
    - [4, 6089.18]
  - - [704, 1024, 1, 3328, 704, 704, 3328, 1024]
    - [9, 4258.18]
  - - [128, 5056, 1, 128, 128, 128, 128, 5056]
    - [0, 1570.62]
  - - [1024, 4, 1, 128, 1024, 1024, 128, 4]
    - [15, 23.282]
  - - [1856, 1024, 1, 768, 1856, 1856, 768, 1024]
    - [7, 5337.06]
  - - [6784, 2368, 1, 3328, 6784, 6784, 3328, 2368]
    - [4, 6329.7]
  - - [1024, 1408, 1, 256, 1024, 1024, 256, 1408]
    - [7, 4630.78]
  - - [4, 448, 1, 128, 4, 4, 128, 448]
    - [15, 9.83033]
  - - [4288, 1408, 1, 768, 4288, 4288, 768, 1408]
    - [4, 6022.28]
  - - [2944, 3584, 1, 1792, 2944, 2944, 1792, 3584]
    - [7, 6145.61]
  - - [1024, 256, 1, 3328, 1024, 1024, 3328, 256]
    - [11, 4655.08]
  - - [2368, 5056, 1, 768, 2368, 2368, 768, 5056]
    - [4, 6123.2]
  - - [5888, 4, 1, 3328, 5888, 5888, 3328, 4]
    - [17, 164.611]
  - - [3584, 2368, 1, 1792, 3584, 3584, 1792, 2368]
    - [7, 6049.24]
  - - [448, 6784, 1, 3328, 448, 448, 3328, 6784]
    - [7, 6030.01]
  - - [1408, 5888, 1, 128, 1408, 1408, 128, 5888]
    - [1, 3101.39]
  - - [64, 448, 1, 3328, 64, 64, 3328, 448]
    - [8, 1110.48]
  - - [6784, 4288, 1, 1792, 6784, 6784, 1792, 4288]
    - [4, 6346.1]
  - - [1408, 4, 1, 256, 1408, 1408, 256, 4]
    - [17, 53.1801]
  - - [2368, 64, 1, 768, 2368, 2368, 768, 64]
    - [11, 2380.69]
  - - [448, 128, 1, 3328, 448, 448, 3328, 128]
    - [13, 1909.77]
  - - [4, 5056, 1, 3328, 4, 4, 3328, 5056]
    - [18, 432.874]
  - - [2944, 256, 1, 256, 2944, 2944, 256, 256]
    - [7, 3587.61]
  - - [4, 4, 1, 768, 4, 4, 768, 4]
    - [18, 0.60764]
  - - [5056, 704, 1, 256, 5056, 5056, 256, 704]
    - [7, 4758.65]
  - - [448, 704, 1, 3328, 448, 448, 3328, 704]
    - [11, 3616.55]
  - - [128, 2368, 1, 768, 128, 128, 768, 2368]
    - [11, 3120.66]
  - - [64, 5888, 1, 3328, 64, 64, 3328, 5888]
    - [11, 3946.38]
  - - [448, 3584, 1, 256, 448, 448, 256, 3584]
    - [7, 4144.09]
  - - [6784, 2944, 1, 768, 6784, 6784, 768, 2944]
    - [4, 6235.06]
  - - [448, 1856, 1, 128, 448, 448, 128, 1856]
    - [2, 1858.71]
  - - [256, 4, 1, 3328, 256, 256, 3328, 4]
    - [18, 88.4713]
  - - [64, 2944, 1, 128, 64, 64, 128, 2944]
    - [0, 718.706]
  - - [256, 6784, 1, 1792, 256, 256, 1792, 6784]
    - [4, 5036.98]
  - - [6784, 4288, 1, 768, 6784, 6784, 768, 4288]
    - [4, 6259.27]
  - - [5056, 704, 1, 3328, 5056, 5056, 3328, 704]
    - [4, 5409.64]
  - - [1856, 4, 1, 1792, 1856, 1856, 1792, 4]
    - [17, 254.748]
  - - [128, 256, 1, 256, 128, 128, 256, 256]
    - [11, 529.166]
  - - [4, 128, 1, 1792, 4, 4, 1792, 128]
    - [18, 33.8419]
  - - [3584, 64, 1, 128, 3584, 3584, 128, 64]
    - [0, 898.757]
  - - [5888, 704, 1, 768, 5888, 5888, 768, 704]
    - [7, 5339.97]
  - - [256, 1024, 1, 256, 256, 256, 256, 1024]
    - [11, 3050.33]
  - - [4, 4288, 1, 128, 4, 4, 128, 4288]
    - [15, 89.541]
  - - [2368, 1856, 1, 3328, 2368, 2368, 3328, 1856]
    - [7, 5883.28]
  - - [64, 2368, 1, 768, 64, 64, 768, 2368]
    - [11, 2447.45]
  - - [6784, 704, 1, 256, 6784, 6784, 256, 704]
    - [7, 5105.25]
  - - [1024, 1024, 1, 256, 1024, 1024, 256, 1024]
    - [7, 4681.92]
  - - [704, 448, 1, 3328, 704, 704, 3328, 448]
    - [11, 3611.02]
  - - [448, 2944, 1, 768, 448, 448, 768, 2944]
    - [7, 4772.83]
  - - [5056, 5888, 1, 768, 5056, 5056, 768, 5888]
    - [4, 6409.96]
  - - [1856, 128, 1, 128, 1856, 1856, 128, 128]
    - [0, 853.446]
  - - [5888, 256, 1, 128, 5888, 5888, 128, 256]
    - [0, 2141.93]
  - - [4, 5056, 1, 1792, 4, 4, 1792, 5056]
    - [18, 377.216]
  - - [4, 2368, 1, 1792, 4, 4, 1792, 2368]
    - [17, 287.868]
  - - [4288, 64, 1, 256, 4288, 4288, 256, 64]
    - [11, 2279.85]
  - - [2944, 6784, 1, 768, 2944, 2944, 768, 6784]
    - [4, 6238.63]
  - - [128, 1408, 1, 128, 128, 128, 128, 1408]
    - [0, 698.257]
  - - [64, 64, 1, 768, 64, 64, 768, 64]
    - [11, 94.5799]
  - - [448, 5888, 1, 256, 448, 448, 256, 5888]
    - [7, 4785.35]
  - - [3584, 256, 1, 3328, 3584, 3584, 3328, 256]
    - [7, 5097.17]
  - - [704, 128, 1, 128, 704, 704, 128, 128]
    - [0, 385.422]
  - - [2944, 4288, 1, 768, 2944, 2944, 768, 4288]
    - [7, 6091.48]
  - - [1408, 448, 1, 256, 1408, 1408, 256, 448]
    - [11, 3633.23]
  - - [64, 704, 1, 128, 64, 64, 128, 704]
    - [0, 195.127]
  - - [256, 1856, 1, 1792, 256, 256, 1792, 1856]
    - [7, 4287.29]
  - - [448, 5888, 1, 768, 448, 448, 768, 5888]
    - [7, 5077.68]
  - - [1408, 2368, 1, 256, 1408, 1408, 256, 2368]
    - [7, 5091.71]
  - - [2368, 1024, 1, 128, 2368, 2368, 128, 1024]
    - [1, 2500.01]
  - - [6784, 3584, 1, 1792, 6784, 6784, 1792, 3584]
    - [4, 6391.69]
  - - [256, 64, 1, 128, 256, 256, 128, 64]
    - [0, 68.0551]
  - - [3584, 256, 1, 768, 3584, 3584, 768, 256]
    - [7, 4814.01]
  - - [2368, 1408, 1, 768, 2368, 2368, 768, 1408]
    - [7, 5574.53]
  - - [128, 1024, 1, 768, 128, 128, 768, 1024]
    - [11, 2559.16]
  - - [1024, 5056, 1, 128, 1024, 1024, 128, 5056]
    - [1, 2499.65]
  - - [3584, 1856, 1, 128, 3584, 3584, 128, 1856]
    - [1, 2789.87]
  - - [5056, 256, 1, 1792, 5056, 5056, 1792, 256]
    - [7, 4862.86]
  - - [1408, 64, 1, 128, 1408, 1408, 128, 64]
    - [0, 370.736]
  - - [2368, 2944, 1, 3328, 2368, 2368, 3328, 2944]
    - [4, 6190.05]
  - - [5888, 1408, 1, 768, 5888, 5888, 768, 1408]
    - [4, 6275.71]
  - - [704, 2944, 1, 128, 704, 704, 128, 2944]
    - [1, 2561.75]
  - - [64, 2944, 1, 3328, 64, 64, 3328, 2944]
    - [11, 3405.05]
  - - [4, 5888, 1, 1792, 4, 4, 1792, 5888]
    - [16, 401.803]
  - - [256, 5888, 1, 3328, 256, 256, 3328, 5888]
    - [7, 5701.27]
  - - [5056, 256, 1, 3328, 5056, 5056, 3328, 256]
    - [7, 4923.44]
  - - [6784, 1024, 1, 768, 6784, 6784, 768, 1024]
    - [4, 5941.03]
  - - [448, 3584, 1, 768, 448, 448, 768, 3584]
    - [7, 4502.8]
  - - [1024, 4, 1, 1792, 1024, 1024, 1792, 4]
    - [18, 185.908]
  - - [6784, 1024, 1, 128, 6784, 6784, 128, 1024]
    - [1, 2696.28]
  - - [6784, 5888, 1, 1792, 6784, 6784, 1792, 5888]
    - [4, 6500.97]
  - - [4288, 1408, 1, 1792, 4288, 4288, 1792, 1408]
    - [4, 6164.27]
  - - [6784, 4, 1, 256, 6784, 6784, 256, 4]
    - [17, 180.0]
  - - [1024, 4288, 1, 256, 1024, 1024, 256, 4288]
    - [7, 5193.25]
  - - [448, 1024, 1, 256, 448, 448, 256, 1024]
    - [7, 3096.49]
  - - [2944, 1024, 1, 128, 2944, 2944, 128, 1024]
    - [3, 2400.55]
  - - [256, 5056, 1, 1792, 256, 256, 1792, 5056]
    - [11, 4868.9]
  - - [3584, 4288, 1, 768, 3584, 3584, 768, 4288]
    - [4, 6289.09]
  - - [4288, 256, 1, 256, 4288, 4288, 256, 256]
    - [7, 3683.17]
  - - [5888, 1856, 1, 256, 5888, 5888, 256, 1856]
    - [4, 5661.35]
  - - [128, 64, 1, 256, 128, 128, 256, 64]
    - [11, 130.469]
  - - [256, 1856, 1, 3328, 256, 256, 3328, 1856]
    - [7, 4414.99]
  - - [2368, 1024, 1, 1792, 2368, 2368, 1792, 1024]
    - [7, 5649.65]
  - - [2368, 2368, 1, 3328, 2368, 2368, 3328, 2368]
    - [7, 6169.79]
  - - [3584, 5056, 1, 256, 3584, 3584, 256, 5056]
    - [7, 5879.07]
  - - [6784, 1408, 1, 3328, 6784, 6784, 3328, 1408]
    - [7, 6168.43]
  - - [1856, 6784, 1, 1792, 1856, 1856, 1792, 6784]
    - [7, 6177.2]
  - - [1408, 256, 1, 1792, 1408, 1408, 1792, 256]
    - [11, 3889.29]
  - - [1024, 1024, 1, 128, 1024, 1024, 128, 1024]
    - [1, 1650.18]
  - - [448, 1408, 1, 768, 448, 448, 768, 1408]
    - [11, 4308.18]
  - - [2368, 1408, 1, 3328, 2368, 2368, 3328, 1408]
    - [7, 5709.24]
  - - [5888, 4, 1, 1792, 5888, 5888, 1792, 4]
    - [17, 158.884]
  - - [5056, 4288, 1, 128, 5056, 5056, 128, 4288]
    - [1, 3383.22]
  - - [256, 448, 1, 128, 256, 256, 128, 448]
    - [0, 486.917]
  - - [5888, 448, 1, 256, 5888, 5888, 256, 448]
    - [4, 4438.23]
  - - [704, 448, 1, 768, 704, 704, 768, 448]
    - [11, 3276.47]
  - - [2944, 3584, 1, 128, 2944, 2944, 128, 3584]
    - [1, 3111.83]
  - - [4288, 2944, 1, 1792, 4288, 4288, 1792, 2944]
    - [7, 6191.39]
  - - [2368, 448, 1, 256, 2368, 2368, 256, 448]
    - [11, 3590.85]
  - - [128, 5056, 1, 768, 128, 128, 768, 5056]
    - [11, 4262.81]
  - - [3584, 1024, 1, 256, 3584, 3584, 256, 1024]
    - [7, 5502.53]
  - - [448, 5056, 1, 768, 448, 448, 768, 5056]
    - [7, 5110.75]
  - - [2368, 128, 1, 128, 2368, 2368, 128, 128]
    - [0, 1071.07]
  - - [256, 3584, 1, 256, 256, 256, 256, 3584]
    - [7, 3871.58]
  - - [1024, 1856, 1, 256, 1024, 1024, 256, 1856]
    - [7, 4664.87]
  - - [704, 704, 1, 128, 704, 704, 128, 704]
    - [0, 1618.9]
  - - [6784, 1408, 1, 128, 6784, 6784, 128, 1408]
    - [1, 3120.09]
  - - [1024, 4, 1, 768, 1024, 1024, 768, 4]
    - [18, 102.083]
  - - [4, 64, 1, 3328, 4, 4, 3328, 64]
    - [18, 24.6808]
  - - [4288, 704, 1, 256, 4288, 4288, 256, 704]
    - [7, 4537.88]
  - - [3584, 1856, 1, 1792, 3584, 3584, 1792, 1856]
    - [4, 5840.36]
  - - [64, 3584, 1, 3328, 64, 64, 3328, 3584]
    - [12, 3765.14]
  - - [1024, 6784, 1, 256, 1024, 1024, 256, 6784]
    - [4, 5548.34]
  - - [1856, 6784, 1, 768, 1856, 1856, 768, 6784]
    - [7, 6118.1]
  - - [5888, 3584, 1, 128, 5888, 5888, 128, 3584]
    - [3, 2974.02]
  - - [1024, 3584, 1, 256, 1024, 1024, 256, 3584]
    - [7, 5404.05]
  - - [4288, 256, 1, 128, 4288, 4288, 128, 256]
    - [0, 2015.77]
  - - [4288, 4288, 1, 1792, 4288, 4288, 1792, 4288]
    - [7, 6266.93]
  - - [2944, 64, 1, 768, 2944, 2944, 768, 64]
    - [11, 3005.33]
  - - [5888, 5888, 1, 256, 5888, 5888, 256, 5888]
    - [4, 6169.2]
  - - [3584, 3584, 1, 3328, 3584, 3584, 3328, 3584]
    - [7, 6312.73]
  - - [6784, 4, 1, 768, 6784, 6784, 768, 4]
    - [16, 300.256]
  - - [4288, 5888, 1, 768, 4288, 4288, 768, 5888]
    - [4, 6302.54]
  - - [2944, 5056, 1, 1792, 2944, 2944, 1792, 5056]
    - [7, 6278.65]
  - - [1856, 64, 1, 128, 1856, 1856, 128, 64]
    - [0, 487.546]
  - - [3584, 1408, 1, 1792, 3584, 3584, 1792, 1408]
    - [4, 6148.73]
  - - [2944, 2368, 1, 3328, 2944, 2944, 3328, 2368]
    - [4, 6176.14]
  - - [1408, 4288, 1, 256, 1408, 1408, 256, 4288]
    - [7, 5616.46]
  - - [128, 64, 1, 128, 128, 128, 128, 64]
    - [0, 34.4411]
  - - [1024, 128, 1, 768, 1024, 1024, 768, 128]
    - [11, 2696.29]
  - - [64, 1024, 1, 1792, 64, 64, 1792, 1024]
    - [13, 1353.9]
  - - [1024, 256, 1, 256, 1024, 1024, 256, 256]
    - [11, 3081.43]
  - - [448, 256, 1, 128, 448, 448, 128, 256]
    - [0, 481.014]
  - - [5056, 3584, 1, 256, 5056, 5056, 256, 3584]
    - [7, 6082.94]
  - - [128, 5888, 1, 3328, 128, 128, 3328, 5888]
    - [11, 4691.03]
  - - [1024, 2944, 1, 128, 1024, 1024, 128, 2944]
    - [1, 2337.02]
  - - [4, 3584, 1, 1792, 4, 4, 1792, 3584]
    - [16, 345.427]
  - - [4288, 2944, 1, 3328, 4288, 4288, 3328, 2944]
    - [7, 6218.93]
  - - [704, 2368, 1, 256, 704, 704, 256, 2368]
    - [7, 4230.01]
  - - [2368, 5056, 1, 128, 2368, 2368, 128, 5056]
    - [1, 3283.84]
  - - [1856, 2944, 1, 768, 1856, 1856, 768, 2944]
    - [7, 5900.45]
  - - [1408, 4, 1, 1792, 1408, 1408, 1792, 4]
    - [18, 240.293]
  - - [4288, 64, 1, 3328, 4288, 4288, 3328, 64]
    - [11, 3142.86]
  - - [4288, 6784, 1, 256, 4288, 4288, 256, 6784]
    - [7, 6149.89]
  - - [64, 4288, 1, 768, 64, 64, 768, 4288]
    - [11, 2789.47]
  - - [704, 5888, 1, 256, 704, 704, 256, 5888]
    - [7, 5730.14]
  - - [1024, 2368, 1, 1792, 1024, 1024, 1792, 2368]
    - [7, 5613.42]
  - - [4288, 128, 1, 3328, 4288, 4288, 3328, 128]
    - [11, 3920.95]
  - - [2944, 256, 1, 3328, 2944, 2944, 3328, 256]
    - [12, 4368.45]
  - - [1408, 1024, 1, 256, 1408, 1408, 256, 1024]
    - [7, 4731.91]
  - - [4288, 5888, 1, 256, 4288, 4288, 256, 5888]
    - [7, 6091.91]
  - - [1024, 2368, 1, 256, 1024, 1024, 256, 2368]
    - [7, 4855.16]
  - - [4288, 1856, 1, 256, 4288, 4288, 256, 1856]
    - [7, 5601.65]
  - - [4, 6784, 1, 128, 4, 4, 128, 6784]
    - [15, 129.891]
  - - [1856, 448, 1, 3328, 1856, 1856, 3328, 448]
    - [7, 4575.74]
  - - [2944, 4, 1, 128, 2944, 2944, 128, 4]
    - [15, 66.7166]
  - - [256, 4, 1, 128, 256, 256, 128, 4]
    - [15, 6.08053]
  - - [1024, 1408, 1, 3328, 1024, 1024, 3328, 1408]
    - [7, 5464.44]
  - - [5056, 5056, 1, 1792, 5056, 5056, 1792, 5056]
    - [4, 6448.97]
  - - [448, 2368, 1, 1792, 448, 448, 1792, 2368]
    - [11, 4450.12]
  - - [128, 128, 1, 3328, 128, 128, 3328, 128]
    - [8, 820.605]
  - - [64, 1408, 1, 128, 64, 64, 128, 1408]
    - [0, 392.218]
  - - [1856, 4, 1, 256, 1856, 1856, 256, 4]
    - [17, 69.7191]
  - - [3584, 1024, 1, 128, 3584, 3584, 128, 1024]
    - [1, 2360.12]
  - - [448, 448, 1, 3328, 448, 448, 3328, 448]
    - [11, 3569.68]
  - - [128, 5056, 1, 256, 128, 128, 256, 5056]
    - [11, 3533.27]
  - - [64, 2944, 1, 768, 64, 64, 768, 2944]
    - [11, 3014.59]
  - - [5056, 5888, 1, 3328, 5056, 5056, 3328, 5888]
    - [4, 6511.4]
  - - [5056, 128, 1, 3328, 5056, 5056, 3328, 128]
    - [11, 4565.14]
  - - [1856, 448, 1, 1792, 1856, 1856, 1792, 448]
    - [7, 4502.0]
  - - [704, 64, 1, 128, 704, 704, 128, 64]
    - [0, 187.602]
  - - [5056, 6784, 1, 1792, 5056, 5056, 1792, 6784]
    - [7, 6417.62]
  - - [5888, 256, 1, 256, 5888, 5888, 256, 256]
    - [7, 4805.55]
  - - [1408, 6784, 1, 3328, 1408, 1408, 3328, 6784]
    - [7, 6167.01]
  - - [704, 1408, 1, 128, 704, 704, 128, 1408]
    - [2, 2179.15]
  - - [2368, 6784, 1, 128, 2368, 2368, 128, 6784]
    - [1, 3349.69]
  - - [1856, 1408, 1, 256, 1856, 1856, 256, 1408]
    - [7, 5547.42]
  - - [5888, 64, 1, 1792, 5888, 5888, 1792, 64]
    - [11, 4095.3]
  - - [2944, 4288, 1, 3328, 2944, 2944, 3328, 4288]
    - [7, 6210.34]
  - - [4288, 4, 1, 768, 4288, 4288, 768, 4]
    - [16, 271.494]
  - - [128, 4288, 1, 3328, 128, 128, 3328, 4288]
    - [11, 4015.44]
  - - [5056, 1408, 1, 3328, 5056, 5056, 3328, 1408]
    - [4, 6311.5]
  - - [3584, 256, 1, 1792, 3584, 3584, 1792, 256]
    - [7, 5019.4]
  - - [448, 5056, 1, 1792, 448, 448, 1792, 5056]
    - [7, 5279.49]
  - - [1408, 128, 1, 1792, 1408, 1408, 1792, 128]
    - [11, 3154.75]
  - - [64, 4288, 1, 1792, 64, 64, 1792, 4288]
    - [11, 2963.8]
  - - [256, 64, 1, 3328, 256, 256, 3328, 64]
    - [6, 702.369]
  - - [6784, 1408, 1, 1792, 6784, 6784, 1792, 1408]
    - [7, 6137.26]
  - - [5056, 3584, 1, 3328, 5056, 5056, 3328, 3584]
    - [7, 6390.99]
  - - [1856, 1856, 1, 1792, 1856, 1856, 1792, 1856]
    - [7, 5805.98]
  - - [3584, 448, 1, 128, 3584, 3584, 128, 448]
    - [1, 2040.05]
  - - [2944, 2944, 1, 256, 2944, 2944, 256, 2944]
    - [7, 5829.7]
  - - [448, 4288, 1, 768, 448, 448, 768, 4288]
    - [7, 5322.49]
  - - [4, 3584, 1, 768, 4, 4, 768, 3584]
    - [16, 242.865]
  - - [6784, 256, 1, 1792, 6784, 6784, 1792, 256]
    - [4, 5033.97]
  - - [1408, 1856, 1, 128, 1408, 1408, 128, 1856]
    - [0, 2554.07]
  - - [64, 4, 1, 128, 64, 64, 128, 4]
    - [15, 1.50977]
  - - [5056, 1856, 1, 3328, 5056, 5056, 3328, 1856]
    - [7, 6050.93]
  - - [4, 4288, 1, 1792, 4, 4, 1792, 4288]
    - [16, 357.086]
  - - [128, 4288, 1, 768, 128, 128, 768, 4288]
    - [11, 3695.13]
  - - [4, 256, 1, 256, 4, 4, 256, 256]
    - [18, 12.3737]
  - - [64, 64, 1, 128, 64, 64, 128, 64]
    - [1, 14.7762]
  - - [704, 1856, 1, 3328, 704, 704, 3328, 1856]
    - [11, 5032.38]
  - - [64, 6784, 1, 1792, 64, 64, 1792, 6784]
    - [7, 3941.23]
  - - [256, 6784, 1, 768, 256, 256, 768, 6784]
    - [4, 4871.69]
  - - [5056, 2944, 1, 256, 5056, 5056, 256, 2944]
    - [7, 6024.95]
  - - [256, 2368, 1, 768, 256, 256, 768, 2368]
    - [11, 4075.88]
  - - [256, 4, 1, 1792, 256, 256, 1792, 4]
    - [18, 60.5673]
  - - [64, 704, 1, 768, 64, 64, 768, 704]
    - [11, 1013.29]
  - - [6784, 128, 1, 128, 6784, 6784, 128, 128]
    - [2, 1805.64]
  - - [1856, 5056, 1, 768, 1856, 1856, 768, 5056]
    - [7, 5940.32]
  - - [1856, 448, 1, 768, 1856, 1856, 768, 448]
    - [7, 4274.0]
  - - [5888, 2368, 1, 128, 5888, 5888, 128, 2368]
    - [3, 2948.19]
  - - [704, 256, 1, 3328, 704, 704, 3328, 256]
    - [11, 3227.15]
  - - [704, 4288, 1, 768, 704, 704, 768, 4288]
    - [7, 5763.86]
  - - [6784, 256, 1, 256, 6784, 6784, 256, 256]
    - [7, 4469.04]
  - - [3584, 2944, 1, 128, 3584, 3584, 128, 2944]
    - [1, 2914.83]
  - - [4288, 704, 1, 128, 4288, 4288, 128, 704]
    - [1, 2739.65]
  - - [128, 448, 1, 3328, 128, 128, 3328, 448]
    - [13, 1872.31]
  - - [5056, 5056, 1, 768, 5056, 5056, 768, 5056]
    - [4, 6363.65]
  - - [2368, 2944, 1, 256, 2368, 2368, 256, 2944]
    - [7, 5713.21]
  - - [4288, 64, 1, 768, 4288, 4288, 768, 64]
    - [11, 2817.08]
  - - [128, 4288, 1, 128, 128, 128, 128, 4288]
    - [0, 1332.04]
  - - [1408, 4288, 1, 128, 1408, 1408, 128, 4288]
    - [1, 2991.85]
  - - [64, 4288, 1, 128, 64, 64, 128, 4288]
    - [0, 833.408]
  - - [1024, 128, 1, 128, 1024, 1024, 128, 128]
    - [0, 540.538]
  - - [4288, 5888, 1, 1792, 4288, 4288, 1792, 5888]
    - [4, 6376.05]
  - - [3584, 704, 1, 3328, 3584, 3584, 3328, 704]
    - [4, 5031.61]
  - - [64, 1856, 1, 128, 64, 64, 128, 1856]
    - [0, 508.056]
  - - [1408, 704, 1, 1792, 1408, 1408, 1792, 704]
    - [11, 4651.67]
  - - [256, 1408, 1, 256, 256, 256, 256, 1408]
    - [11, 3038.25]
  - - [4288, 2944, 1, 128, 4288, 4288, 128, 2944]
    - [1, 3288.64]
  - - [1408, 1408, 1, 1792, 1408, 1408, 1792, 1408]
    - [4, 5745.62]
  - - [1856, 4, 1, 128, 1856, 1856, 128, 4]
    - [15, 42.1987]
  - - [64, 1024, 1, 128, 64, 64, 128, 1024]
    - [0, 281.705]
  - - [5056, 448, 1, 768, 5056, 5056, 768, 448]
    - [7, 5010.45]
  - - [5056, 2944, 1, 128, 5056, 5056, 128, 2944]
    - [1, 3348.15]
  - - [2944, 6784, 1, 3328, 2944, 2944, 3328, 6784]
    - [7, 6330.52]
  - - [128, 1408, 1, 768, 128, 128, 768, 1408]
    - [11, 2915.01]
  - - [704, 5888, 1, 768, 704, 704, 768, 5888]
    - [7, 6036.81]
  - - [4288, 1408, 1, 3328, 4288, 4288, 3328, 1408]
    - [4, 6214.86]
  - - [4288, 1024, 1, 3328, 4288, 4288, 3328, 1024]
    - [4, 5361.49]
  - - [1024, 1024, 1, 1792, 1024, 1024, 1792, 1024]
    - [7, 5745.54]
  - - [2944, 704, 1, 3328, 2944, 2944, 3328, 704]
    - [11, 5036.77]
  - - [5056, 448, 1, 3328, 5056, 5056, 3328, 448]
    - [7, 5310.15]
  - - [256, 256, 1, 128, 256, 256, 128, 256]
    - [0, 286.692]
  - - [6784, 4288, 1, 256, 6784, 6784, 256, 4288]
    - [4, 6024.22]
  - - [5056, 1856, 1, 128, 5056, 5056, 128, 1856]
    - [1, 3263.91]
  - - [2368, 3584, 1, 3328, 2368, 2368, 3328, 3584]
    - [7, 6116.23]
  - - [5056, 1408, 1, 256, 5056, 5056, 256, 1408]
    - [7, 5820.26]
  - - [2944, 2944, 1, 768, 2944, 2944, 768, 2944]
    - [7, 6117.02]
  - - [5888, 6784, 1, 256, 5888, 5888, 256, 6784]
    - [4, 6206.75]
  - - [448, 704, 1, 768, 448, 448, 768, 704]
    - [11, 3286.36]
  - - [1408, 5056, 1, 3328, 1408, 1408, 3328, 5056]
    - [4, 6313.74]
  - - [2368, 3584, 1, 1792, 2368, 2368, 1792, 3584]
    - [7, 6087.98]
  - - [448, 1408, 1, 128, 448, 448, 128, 1408]
    - [0, 1602.9]
  - - [1024, 2944, 1, 768, 1024, 1024, 768, 2944]
    - [4, 5753.92]
  - - [4, 1408, 1, 128, 4, 4, 128, 1408]
    - [15, 29.6708]
  - - [128, 2944, 1, 128, 128, 128, 128, 2944]
    - [0, 1088.88]
  - - [5888, 128, 1, 1792, 5888, 5888, 1792, 128]
    - [11, 4539.9]
  - - [2368, 704, 1, 3328, 2368, 2368, 3328, 704]
    - [11, 4953.81]
  - - [5056, 5888, 1, 256, 5056, 5056, 256, 5888]
    - [7, 6179.85]
  - - [3584, 2368, 1, 3328, 3584, 3584, 3328, 2368]
    - [7, 6090.93]
  - - [5056, 448, 1, 1792, 5056, 5056, 1792, 448]
    - [7, 5239.11]
  - - [1024, 5888, 1, 1792, 1024, 1024, 1792, 5888]
    - [4, 6160.32]
  - - [1408, 5056, 1, 1792, 1408, 1408, 1792, 5056]
    - [4, 6261.01]
  - - [4, 3584, 1, 3328, 4, 4, 3328, 3584]
    - [16, 400.544]
  - - [5056, 3584, 1, 768, 5056, 5056, 768, 3584]
    - [7, 6288.59]
  - - [1408, 1856, 1, 768, 1408, 1408, 768, 1856]
    - [7, 5017.33]
  - - [1856, 5056, 1, 3328, 1856, 1856, 3328, 5056]
    - [7, 6053.71]
  - - [5056, 128, 1, 256, 5056, 5056, 256, 128]
    - [11, 3435.6]
  - - [1024, 1856, 1, 768, 1024, 1024, 768, 1856]
    - [4, 5275.62]
  - - [4, 4288, 1, 256, 4, 4, 256, 4288]
    - [16, 136.266]
  - - [128, 3584, 1, 128, 128, 128, 128, 3584]
    - [0, 1312.43]
  - - [4288, 5888, 1, 128, 4288, 4288, 128, 5888]
    - [1, 3404.12]
  - - [704, 4, 1, 768, 704, 704, 768, 4]
    - [18, 73.7263]
  - - [1024, 4288, 1, 1792, 1024, 1024, 1792, 4288]
    - [7, 5795.96]
  - - [448, 1856, 1, 1792, 448, 448, 1792, 1856]
    - [7, 4520.2]
  - - [448, 256, 1, 1792, 448, 448, 1792, 256]
    - [11, 2722.74]
  - - [2368, 448, 1, 1792, 2368, 2368, 1792, 448]
    - [11, 4410.36]
  - - [5888, 3584, 1, 3328, 5888, 5888, 3328, 3584]
    - [7, 6360.72]
  - - [5888, 704, 1, 3328, 5888, 5888, 3328, 704]
    - [7, 5534.47]
  - - [1856, 256, 1, 256, 1856, 1856, 256, 256]
    - [11, 3290.63]
  - - [4, 1856, 1, 256, 4, 4, 256, 1856]
    - [17, 68.0552]
  - - [6784, 6784, 1, 768, 6784, 6784, 768, 6784]
    - [4, 6555.38]
  - - [3584, 4288, 1, 1792, 3584, 3584, 1792, 4288]
    - [4, 6408.78]
  - - [448, 2944, 1, 128, 448, 448, 128, 2944]
    - [1, 2141.95]
  - - [1408, 3584, 1, 768, 1408, 1408, 768, 3584]
    - [4, 6007.42]
  - - [2368, 5056, 1, 3328, 2368, 2368, 3328, 5056]
    - [4, 6274.21]
  - - [64, 2368, 1, 3328, 64, 64, 3328, 2368]
    - [11, 2751.03]
  - - [2368, 4, 1, 1792, 2368, 2368, 1792, 4]
    - [17, 303.096]
  - - [256, 4288, 1, 768, 256, 256, 768, 4288]
    - [11, 4335.61]
  - - [5888, 2368, 1, 768, 5888, 5888, 768, 2368]
    - [4, 6122.65]
  - - [5056, 64, 1, 768, 5056, 5056, 768, 64]
    - [11, 3318.34]
  - - [448, 4, 1, 768, 448, 448, 768, 4]
    - [18, 51.0414]
  - - [128, 448, 1, 128, 128, 128, 128, 448]
    - [0, 242.866]
  - - [6784, 6784, 1, 128, 6784, 6784, 128, 6784]
    - [1, 3319.37]
  - - [256, 4288, 1, 3328, 256, 256, 3328, 4288]
    - [11, 4656.56]
  - - [5056, 2368, 1, 768, 5056, 5056, 768, 2368]
    - [4, 6116.86]
  - - [448, 2368, 1, 256, 448, 448, 256, 2368]
    - [11, 3718.33]
  - - [6784, 2944, 1, 3328, 6784, 6784, 3328, 2944]
    - [4, 6328.82]
  - - [6784, 448, 1, 3328, 6784, 6784, 3328, 448]
    - [7, 5157.85]
  - - [4, 2944, 1, 3328, 4, 4, 3328, 2944]
    - [18, 377.902]
  - - [256, 448, 1, 768, 256, 256, 768, 448]
    - [11, 2492.76]
  - - [128, 704, 1, 128, 128, 128, 128, 704]
    - [0, 389.279]
  - - [1856, 64, 1, 3328, 1856, 1856, 3328, 64]
    - [11, 2887.77]
  - - [256, 256, 1, 256, 256, 256, 256, 256]
    - [11, 1048.54]
  - - [448, 6784, 1, 256, 448, 448, 256, 6784]
    - [7, 5453.47]
  - - [1408, 1024, 1, 1792, 1408, 1408, 1792, 1024]
    - [7, 5388.39]
  - - [1856, 5888, 1, 1792, 1856, 1856, 1792, 5888]
    - [7, 6351.94]
  - - [64, 2368, 1, 1792, 64, 64, 1792, 2368]
    - [11, 2662.5]
  - - [704, 1024, 1, 256, 704, 704, 256, 1024]
    - [7, 3417.52]
  - - [1856, 1024, 1, 256, 1856, 1856, 256, 1024]
    - [7, 4916.28]
  - - [704, 64, 1, 1792, 704, 704, 1792, 64]
    - [13, 1113.35]
  - - [5056, 2368, 1, 3328, 5056, 5056, 3328, 2368]
    - [4, 6262.45]
  - - [128, 3584, 1, 256, 128, 128, 256, 3584]
    - [11, 3078.47]
  - - [4, 1408, 1, 3328, 4, 4, 3328, 1408]
    - [18, 284.304]
  - - [1408, 1408, 1, 768, 1408, 1408, 768, 1408]
    - [4, 5611.17]
  - - [64, 4, 1, 1792, 64, 64, 1792, 4]
    - [18, 15.8795]
  - - [2944, 4, 1, 768, 2944, 2944, 768, 4]
    - [17, 219.984]
  - - [704, 6784, 1, 1792, 704, 704, 1792, 6784]
    - [4, 5790.16]
  - - [1408, 4, 1, 768, 1408, 1408, 768, 4]
    - [18, 136.428]
  - - [1408, 5888, 1, 3328, 1408, 1408, 3328, 5888]
    - [4, 6465.85]
  - - [6784, 448, 1, 1792, 6784, 6784, 1792, 448]
    - [7, 5086.02]
  - - [1408, 128, 1, 128, 1408, 1408, 128, 128]
    - [0, 752.219]
  - - [6784, 1856, 1, 256, 6784, 6784, 256, 1856]
    - [7, 5742.14]
  - - [64, 128, 1, 3328, 64, 64, 3328, 128]
    - [8, 480.473]
  - - [1408, 4288, 1, 1792, 1408, 1408, 1792, 4288]
    - [4, 6167.39]
  - - [2368, 6784, 1, 768, 2368, 2368, 768, 6784]
    - [7, 6285.03]
  - - [6784, 2944, 1, 128, 6784, 6784, 128, 2944]
    - [1, 3245.65]
  - - [6784, 704, 1, 3328, 6784, 6784, 3328, 704]
    - [4, 5852.78]
  - - [3584, 5888, 1, 3328, 3584, 3584, 3328, 5888]
    - [4, 6359.99]
  - - [2368, 256, 1, 256, 2368, 2368, 256, 256]
    - [11, 3136.25]
  - - [128, 1024, 1, 256, 128, 128, 256, 1024]
    - [11, 1960.93]
  - - [2368, 256, 1, 128, 2368, 2368, 128, 256]
    - [0, 1641.85]
  - - [3584, 2368, 1, 128, 3584, 3584, 128, 2368]
    - [1, 2857.57]
  - - [4, 2368, 1, 3328, 4, 4, 3328, 2368]
    - [17, 349.671]
  - - [448, 2368, 1, 128, 448, 448, 128, 2368]
    - [0, 2012.22]
  - - [128, 704, 1, 768, 128, 128, 768, 704]
    - [11, 1966.86]
  - - [2944, 1024, 1, 1792, 2944, 2944, 1792, 1024]
    - [4, 5958.74]
  - - [2368, 2944, 1, 1792, 2368, 2368, 1792, 2944]
    - [4, 6144.06]
  - - [6784, 128, 1, 256, 6784, 6784, 256, 128]
    - [7, 4094.08]
  - - [3584, 2368, 1, 256, 3584, 3584, 256, 2368]
    - [7, 5584.56]
  - - [5056, 4, 1, 768, 5056, 5056, 768, 4]
    - [16, 292.844]
  - - [6784, 2368, 1, 768, 6784, 6784, 768, 2368]
    - [4, 6186.52]
  - - [128, 256, 1, 3328, 128, 128, 3328, 256]
    - [13, 1238.16]
  - - [6784, 5056, 1, 3328, 6784, 6784, 3328, 5056]
    - [4, 6416.91]
  - - [64, 1408, 1, 1792, 64, 64, 1792, 1408]
    - [11, 2088.07]
  - - [128, 448, 1, 768, 128, 128, 768, 448]
    - [11, 1333.02]
  - - [5888, 2944, 1, 1792, 5888, 5888, 1792, 2944]
    - [4, 6405.79]
  - - [2368, 4288, 1, 1792, 2368, 2368, 1792, 4288]
    - [7, 6183.05]
  - - [1408, 1856, 1, 3328, 1408, 1408, 3328, 1856]
    - [4, 5219.88]
  - - [1856, 4, 1, 3328, 1856, 1856, 3328, 4]
    - [17, 327.641]
  - - [64, 1024, 1, 3328, 64, 64, 3328, 1024]
    - [13, 1895.9]
  - - [2944, 1408, 1, 1792, 2944, 2944, 1792, 1408]
    - [4, 6252.49]
  - - [5888, 128, 1, 768, 5888, 5888, 768, 128]
    - [11, 4279.21]
  - - [448, 704, 1, 128, 448, 448, 128, 704]
    - [0, 1123.67]
  - - [128, 3584, 1, 768, 128, 128, 768, 3584]
    - [7, 3854.32]
  - - [5888, 1856, 1, 128, 5888, 5888, 128, 1856]
    - [3, 2901.57]
  - - [6784, 3584, 1, 3328, 6784, 6784, 3328, 3584]
    - [4, 6413.4]
  - - [4, 2944, 1, 1792, 4, 4, 1792, 2944]
    - [18, 313.744]
  - - [448, 1024, 1, 768, 448, 448, 768, 1024]
    - [7, 3892.17]
  - - [2944, 3584, 1, 256, 2944, 2944, 256, 3584]
    - [7, 5826.87]
  - - [256, 5888, 1, 768, 256, 256, 768, 5888]
    - [7, 5288.54]
  - - [64, 256, 1, 3328, 64, 64, 3328, 256]
    - [8, 761.993]
  - - [5888, 4288, 1, 3328, 5888, 5888, 3328, 4288]
    - [4, 6399.33]
  - - [448, 64, 1, 768, 448, 448, 768, 64]
    - [11, 675.598]
  - - [5056, 2944, 1, 768, 5056, 5056, 768, 2944]
    - [7, 6226.72]
  - - [128, 5888, 1, 128, 128, 128, 128, 5888]
    - [0, 1727.19]
  - - [1856, 2944, 1, 3328, 1856, 1856, 3328, 2944]
    - [7, 6030.66]
  - - [5056, 6784, 1, 256, 5056, 5056, 256, 6784]
    - [7, 6160.38]
  - - [1024, 64, 1, 1792, 1024, 1024, 1792, 64]
    - [11, 1543.73]
  - - [5888, 4288, 1, 128, 5888, 5888, 128, 4288]
    - [3, 3057.69]
  - - [3584, 704, 1, 768, 3584, 3584, 768, 704]
    - [4, 4820.22]
  - - [704, 4288, 1, 256, 704, 704, 256, 4288]
    - [7, 5352.79]
  - - [2944, 128, 1, 128, 2944, 2944, 128, 128]
    - [0, 1274.28]
  - - [1408, 2368, 1, 768, 1408, 1408, 768, 2368]
    - [7, 5510.55]
  - - [256, 2944, 1, 768, 256, 256, 768, 2944]
    - [11, 4382.4]
  - - [6784, 5888, 1, 256, 6784, 6784, 256, 5888]
    - [4, 6222.41]
  - - [448, 1408, 1, 256, 448, 448, 256, 1408]
    - [11, 3663.77]
  - - [1408, 256, 1, 3328, 1408, 1408, 3328, 256]
    - [11, 3985.69]
  - - [1024, 3584, 1, 128, 1024, 1024, 128, 3584]
    - [1, 2436.29]
  - - [4288, 2944, 1, 256, 4288, 4288, 256, 2944]
    - [7, 5906.75]
  - - [1408, 5056, 1, 256, 1408, 1408, 256, 5056]
    - [7, 5706.85]
  - - [128, 5056, 1, 1792, 128, 128, 1792, 5056]
    - [11, 4567.08]
  - - [1856, 3584, 1, 128, 1856, 1856, 128, 3584]
    - [1, 3041.6]
  - - [1856, 4288, 1, 256, 1856, 1856, 256, 4288]
    - [7, 5676.79]
  - - [6784, 1856, 1, 768, 6784, 6784, 768, 1856]
    - [7, 6057.63]
  - - [1408, 128, 1, 3328, 1408, 1408, 3328, 128]
    - [11, 3214.34]
  - - [448, 128, 1, 768, 448, 448, 768, 128]
    - [11, 1357.36]
  - - [2368, 6784, 1, 3328, 2368, 2368, 3328, 6784]
    - [7, 6390.96]
  - - [1856, 64, 1, 256, 1856, 1856, 256, 64]
    - [11, 1857.53]
  - - [4, 448, 1, 1792, 4, 4, 1792, 448]
    - [18, 94.8605]
  - - [256, 1024, 1, 3328, 256, 256, 3328, 1024]
    - [12, 4293.59]
  - - [5888, 5056, 1, 1792, 5888, 5888, 1792, 5056]
    - [4, 6477.55]
  - - [4, 1856, 1, 3328, 4, 4, 3328, 1856]
    - [17, 318.263]
  - - [6784, 2944, 1, 256, 6784, 6784, 256, 2944]
    - [7, 6038.16]
  - - [256, 704, 1, 256, 256, 256, 256, 704]
    - [11, 2281.49]
  - - [5888, 4, 1, 256, 5888, 5888, 256, 4]
    - [16, 173.921]
  - - [2944, 64, 1, 128, 2944, 2944, 128, 64]
    - [0, 695.673]
  - - [704, 4, 1, 128, 704, 704, 128, 4]
    - [15, 16.6074]
  - - [4288, 1408, 1, 128, 4288, 4288, 128, 1408]
    - [1, 3078.37]
  - - [1024, 4288, 1, 768, 1024, 1024, 768, 4288]
    - [7, 5646.73]
  - - [5888, 128, 1, 256, 5888, 5888, 256, 128]
    - [11, 3514.99]
  - - [6784, 6784, 1, 3328, 6784, 6784, 3328, 6784]
    - [4, 6652.5]
  - - [5056, 5056, 1, 256, 5056, 5056, 256, 5056]
    - [4, 6052.65]
  - - [5888, 4288, 1, 256, 5888, 5888, 256, 4288]
    - [7, 6003.05]
  - - [2368, 128, 1, 1792, 2368, 2368, 1792, 128]
    - [11, 3371.28]
  - - [3584, 3584, 1, 256, 3584, 3584, 256, 3584]
    - [7, 5903.14]
  - - [4288, 2368, 1, 256, 4288, 4288, 256, 2368]
    - [7, 5802.15]
  - - [128, 256, 1, 1792, 128, 128, 1792, 256]
    - [13, 888.684]
  - - [1856, 256, 1, 1792, 1856, 1856, 1792, 256]
    - [7, 4311.41]
  - - [2944, 4288, 1, 256, 2944, 2944, 256, 4288]
    - [7, 5827.84]
  - - [704, 1408, 1, 3328, 704, 704, 3328, 1408]
    - [7, 5507.43]
  - - [256, 6784, 1, 3328, 256, 256, 3328, 6784]
    - [4, 5101.0]
  - - [704, 64, 1, 256, 704, 704, 256, 64]
    - [11, 711.009]
  - - [1856, 128, 1, 1792, 1856, 1856, 1792, 128]
    - [11, 4134.61]
  - - [5056, 1856, 1, 256, 5056, 5056, 256, 1856]
    - [7, 5640.03]
  - - [256, 1408, 1, 128, 256, 256, 128, 1408]
    - [0, 1064.69]
  - - [1856, 2368, 1, 3328, 1856, 1856, 3328, 2368]
    - [7, 5885.39]
  - - [704, 1024, 1, 768, 704, 704, 768, 1024]
    - [7, 3826.97]
  - - [4288, 4, 1, 256, 4288, 4288, 256, 4]
    - [16, 135.334]
  - - [1408, 128, 1, 256, 1408, 1408, 256, 128]
    - [11, 2289.81]
  - - [5056, 1024, 1, 128, 5056, 5056, 128, 1024]
    - [1, 2847.31]
  - - [4288, 256, 1, 768, 4288, 4288, 768, 256]
    - [7, 4054.5]
  - - [704, 3584, 1, 768, 704, 704, 768, 3584]
    - [7, 5740.46]
  - - [3584, 1024, 1, 768, 3584, 3584, 768, 1024]
    - [7, 6015.8]
  - - [704, 5056, 1, 128, 704, 704, 128, 5056]
    - [1, 2848.79]
  - - [128, 2944, 1, 1792, 128, 128, 1792, 2944]
    - [11, 4093.46]
  - - [704, 1408, 1, 1792, 704, 704, 1792, 1408]
    - [7, 5438.73]
  - - [2368, 1408, 1, 256, 2368, 2368, 256, 1408]
    - [7, 5209.12]
  - - [3584, 448, 1, 768, 3584, 3584, 768, 448]
    - [4, 4468.95]
  - - [3584, 1856, 1, 768, 3584, 3584, 768, 1856]
    - [4, 5703.87]
  - - [3584, 5888, 1, 1792, 3584, 3584, 1792, 5888]
    - [4, 6335.05]
  - - [128, 5888, 1, 256, 128, 128, 256, 5888]
    - [11, 3567.94]
  - - [64, 448, 1, 768, 64, 64, 768, 448]
    - [11, 669.518]
  - - [4288, 2368, 1, 1792, 4288, 4288, 1792, 2368]
    - [7, 6177.76]
  - - [3584, 5056, 1, 1792, 3584, 3584, 1792, 5056]
    - [7, 6325.09]
  - - [3584, 448, 1, 256, 3584, 3584, 256, 448]
    - [4, 3955.06]
  - - [448, 6784, 1, 128, 448, 448, 128, 6784]
    - [1, 2726.73]
  - - [1024, 5056, 1, 256, 1024, 1024, 256, 5056]
    - [4, 5518.97]
  - - [6784, 448, 1, 256, 6784, 6784, 256, 448]
    - [7, 4345.63]
  - - [1856, 448, 1, 128, 1856, 1856, 128, 448]
    - [2, 1895.5]
  - - [6784, 128, 1, 768, 6784, 6784, 768, 128]
    - [7, 4598.0]
  - - [448, 5888, 1, 128, 448, 448, 128, 5888]
    - [1, 2636.24]
  - - [1408, 4288, 1, 768, 1408, 1408, 768, 4288]
    - [4, 6015.9]
  - - [64, 1408, 1, 768, 64, 64, 768, 1408]
    - [11, 1853.67]
  - - [5056, 5056, 1, 128, 5056, 5056, 128, 5056]
    - [1, 3435.91]
  - - [1024, 1408, 1, 128, 1024, 1024, 128, 1408]
    - [0, 2052.2]
  - - [3584, 5888, 1, 256, 3584, 3584, 256, 5888]
    - [4, 6007.83]
  - - [1856, 704, 1, 256, 1856, 1856, 256, 704]
    - [11, 4024.59]
  - - [128, 128, 1, 768, 128, 128, 768, 128]
    - [11, 383.444]
  - - [4, 5888, 1, 256, 4, 4, 256, 5888]
    - [16, 166.791]
  - - [5888, 2944, 1, 768, 5888, 5888, 768, 2944]
    - [4, 6323.2]
  - - [5888, 1408, 1, 128, 5888, 5888, 128, 1408]
    - [3, 2802.29]
  - - [5056, 4288, 1, 3328, 5056, 5056, 3328, 4288]
    - [7, 6374.13]
  - - [6784, 3584, 1, 128, 6784, 6784, 128, 3584]
    - [1, 3227.83]
  - - [2368, 2368, 1, 256, 2368, 2368, 256, 2368]
    - [7, 5654.76]
  - - [64, 5056, 1, 1792, 64, 64, 1792, 5056]
    - [11, 3502.45]
  - - [1408, 2368, 1, 1792, 1408, 1408, 1792, 2368]
    - [7, 5625.85]
  - - [6784, 5888, 1, 3328, 6784, 6784, 3328, 5888]
    - [4, 6524.66]
  - - [2368, 5888, 1, 256, 2368, 2368, 256, 5888]
    - [7, 6028.44]
  - - [128, 1408, 1, 1792, 128, 128, 1792, 1408]
    - [11, 3150.2]
  - - [5056, 256, 1, 256, 5056, 5056, 256, 256]
    - [7, 4301.1]
  - - [6784, 256, 1, 768, 6784, 6784, 768, 256]
    - [7, 4894.21]
  - - [2368, 64, 1, 128, 2368, 2368, 128, 64]
    - [0, 553.654]
  - - [128, 1856, 1, 3328, 128, 128, 3328, 1856]
    - [11, 4264.17]
  - - [4288, 704, 1, 768, 4288, 4288, 768, 704]
    - [7, 4978.96]
  - - [1408, 6784, 1, 1792, 1408, 1408, 1792, 6784]
    - [7, 6138.73]
  - - [4, 704, 1, 256, 4, 4, 256, 704]
    - [17, 27.491]
  - - [1024, 704, 1, 128, 1024, 1024, 128, 704]
    - [1, 1486.49]
  - - [6784, 64, 1, 256, 6784, 6784, 256, 64]
    - [11, 2983.07]
  - - [4288, 64, 1, 128, 4288, 4288, 128, 64]
    - [0, 969.751]
  - - [5888, 1024, 1, 1792, 5888, 5888, 1792, 1024]
    - [4, 6101.83]
  - - [128, 64, 1, 768, 128, 128, 768, 64]
    - [11, 194.355]
  - - [1856, 5888, 1, 3328, 1856, 1856, 3328, 5888]
    - [7, 6388.08]
  - - [5888, 6784, 1, 3328, 5888, 5888, 3328, 6784]
    - [4, 6521.7]
  - - [1856, 3584, 1, 256, 1856, 1856, 256, 3584]
    - [7, 5809.57]
  - - [704, 704, 1, 1792, 704, 704, 1792, 704]
    - [11, 4480.45]
  - - [1408, 1024, 1, 768, 1408, 1408, 768, 1024]
    - [7, 5197.56]
  - - [1856, 5056, 1, 256, 1856, 1856, 256, 5056]
    - [7, 5676.56]
  - - [5888, 256, 1, 768, 5888, 5888, 768, 256]
    - [7, 5456.58]
  - - [448, 4288, 1, 1792, 448, 448, 1792, 4288]
    - [7, 5513.39]
  - - [2944, 2368, 1, 128, 2944, 2944, 128, 2368]
    - [1, 2976.6]
  - - [5056, 2368, 1, 128, 5056, 5056, 128, 2368]
    - [1, 3277.08]
  - - [64, 256, 1, 128, 64, 64, 128, 256]
    - [0, 68.7163]
  - - [3584, 1408, 1, 256, 3584, 3584, 256, 1408]
    - [7, 5569.97]
  - - [5056, 128, 1, 1792, 5056, 5056, 1792, 128]
    - [11, 4447.72]
  - - [4, 5056, 1, 768, 4, 4, 768, 5056]
    - [16, 282.967]
  - - [128, 704, 1, 3328, 128, 128, 3328, 704]
    - [11, 2195.48]
  - - [4, 1408, 1, 1792, 4, 4, 1792, 1408]
    - [18, 218.695]
  - - [3584, 64, 1, 3328, 3584, 3584, 3328, 64]
    - [11, 4140.29]
  - - [5888, 448, 1, 3328, 5888, 5888, 3328, 448]
    - [4, 5255.19]
  - - [448, 5056, 1, 256, 448, 448, 256, 5056]
    - [7, 4684.6]
  - - [2368, 128, 1, 768, 2368, 2368, 768, 128]
    - [11, 3120.66]
  - - [64, 704, 1, 256, 64, 64, 256, 704]
    - [11, 714.267]
  - - [5888, 1024, 1, 768, 5888, 5888, 768, 1024]
    - [4, 5993.92]
  - - [3584, 1408, 1, 3328, 3584, 3584, 3328, 1408]
    - [4, 6193.7]
  - - [1024, 6784, 1, 1792, 1024, 1024, 1792, 6784]
    - [4, 6120.17]
  - - [4288, 448, 1, 3328, 4288, 4288, 3328, 448]
    - [11, 4977.85]
  - - [4, 1408, 1, 256, 4, 4, 256, 1408]
    - [17, 53.1791]
  - - [3584, 704, 1, 128, 3584, 3584, 128, 704]
    - [1, 2388.98]
  - - [1408, 1408, 1, 128, 1408, 1408, 128, 1408]
    - [0, 2415.81]
  - - [4, 128, 1, 768, 4, 4, 768, 128]
    - [18, 18.5602]
  - - [2368, 2944, 1, 128, 2368, 2368, 128, 2944]
    - [1, 3184.32]
  - - [3584, 128, 1, 128, 3584, 3584, 128, 128]
    - [0, 1420.63]
  - - [1408, 4288, 1, 3328, 1408, 1408, 3328, 4288]
    - [4, 6217.13]
  - - [5056, 128, 1, 128, 5056, 5056, 128, 128]
    - [0, 1731.08]
  - - [2944, 1024, 1, 256, 2944, 2944, 256, 1024]
    - [7, 5331.86]
  - - [2368, 5056, 1, 256, 2368, 2368, 256, 5056]
    - [4, 5769.97]
  - - [256, 128, 1, 1792, 256, 256, 1792, 128]
    - [13, 860.704]
  - - [448, 448, 1, 1792, 448, 448, 1792, 448]
    - [11, 3463.15]
  - - [6784, 2368, 1, 256, 6784, 6784, 256, 2368]
    - [7, 5820.09]
  - - [128, 4, 1, 768, 128, 128, 768, 4]
    - [18, 18.4956]
  - - [4, 2944, 1, 128, 4, 4, 128, 2944]
    - [15, 62.0389]
  - - [256, 64, 1, 256, 256, 256, 256, 64]
    - [11, 263.354]
  - - [3584, 5888, 1, 768, 3584, 3584, 768, 5888]
    - [4, 6255.71]
  - - [5056, 1024, 1, 3328, 5056, 5056, 3328, 1024]
    - [4, 6190.53]
  - - [3584, 2944, 1, 768, 3584, 3584, 768, 2944]
    - [7, 6042.84]
  - - [1408, 3584, 1, 128, 1408, 1408, 128, 3584]
    - [1, 2882.57]
  - - [1024, 4, 1, 256, 1024, 1024, 256, 4]
    - [17, 38.6757]
  - - [1856, 5056, 1, 128, 1856, 1856, 128, 5056]
    - [1, 3257.35]
  - - [256, 1408, 1, 768, 256, 256, 768, 1408]
    - [11, 3678.19]
  - - [4288, 3584, 1, 3328, 4288, 4288, 3328, 3584]
    - [4, 6455.2]
  - - [5056, 448, 1, 128, 5056, 5056, 128, 448]
    - [0, 2568.23]
  - - [6784, 64, 1, 3328, 6784, 6784, 3328, 64]
    - [11, 4043.58]
  - - [128, 128, 1, 256, 128, 128, 256, 128]
    - [11, 264.583]
  - - [64, 5888, 1, 128, 64, 64, 128, 5888]
    - [0, 1124.61]
  - - [4288, 448, 1, 256, 4288, 4288, 256, 448]
    - [11, 3935.34]
  - - [5888, 1024, 1, 128, 5888, 5888, 128, 1024]
    - [3, 2554.16]
  - - [3584, 2944, 1, 1792, 3584, 3584, 1792, 2944]
    - [7, 6132.32]
  - - [4288, 4288, 1, 768, 4288, 4288, 768, 4288]
    - [7, 6190.96]
  - - [128, 128, 1, 128, 128, 128, 128, 128]
    - [0, 68.2189]
  - - [5888, 1408, 1, 3328, 5888, 5888, 3328, 1408]
    - [4, 6450.29]
  - - [2368, 128, 1, 3328, 2368, 2368, 3328, 128]
    - [11, 3438.78]
  - - [2944, 1856, 1, 768, 2944, 2944, 768, 1856]
    - [7, 5845.66]
  - - [6784, 6784, 1, 256, 6784, 6784, 256, 6784]
    - [4, 6298.3]
  - - [2944, 448, 1, 256, 2944, 2944, 256, 448]
    - [7, 4026.56]
  - - [4, 1856, 1, 768, 4, 4, 768, 1856]
    - [17, 164.469]
  - - [256, 1024, 1, 768, 256, 256, 768, 1024]
    - [11, 3979.26]
  - - [5056, 2368, 1, 256, 5056, 5056, 256, 2368]
    - [7, 5755.53]
  - - [704, 2368, 1, 3328, 704, 704, 3328, 2368]
    - [11, 4970.9]
  - - [64, 1856, 1, 3328, 64, 64, 3328, 1856]
    - [11, 2782.39]
  - - [1024, 3584, 1, 3328, 1024, 1024, 3328, 3584]
    - [7, 6251.96]
  - - [448, 704, 1, 256, 448, 448, 256, 704]
    - [11, 2759.41]
  - - [2944, 2944, 1, 1792, 2944, 2944, 1792, 2944]
    - [7, 6201.63]
  - - [128, 1024, 1, 128, 128, 128, 128, 1024]
    - [0, 548.392]
  - - [2944, 256, 1, 128, 2944, 2944, 128, 256]
    - [0, 1863.09]
  - - [5888, 5888, 1, 128, 5888, 5888, 128, 5888]
    - [3, 3054.87]
  - - [4, 1024, 1, 1792, 4, 4, 1792, 1024]
    - [18, 186.96]
  - - [5888, 5888, 1, 1792, 5888, 5888, 1792, 5888]
    - [4, 6464.35]
  - - [4288, 4288, 1, 3328, 4288, 4288, 3328, 4288]
    - [7, 6302.38]
  - - [128, 1408, 1, 3328, 128, 128, 3328, 1408]
    - [11, 3245.26]
  - - [1856, 6784, 1, 128, 1856, 1856, 128, 6784]
    - [1, 3317.62]
  - - [4, 64, 1, 256, 4, 4, 256, 64]
    - [18, 3.7173]
  - - [3584, 256, 1, 128, 3584, 3584, 128, 256]
    - [3, 1740.3]
  - - [5888, 5888, 1, 768, 5888, 5888, 768, 5888]
    - [4, 6389.52]
  - - [704, 2944, 1, 1792, 704, 704, 1792, 2944]
    - [7, 5974.58]
  - - [5888, 256, 1, 3328, 5888, 5888, 3328, 256]
    - [7, 5703.68]
  - - [2944, 1408, 1, 128, 2944, 2944, 128, 1408]
    - [1, 2805.59]
  - - [4288, 256, 1, 1792, 4288, 4288, 1792, 256]
    - [7, 4139.62]
  - - [64, 2944, 1, 256, 64, 64, 256, 2944]
    - [11, 2268.79]
  - - [2944, 5056, 1, 768, 2944, 2944, 768, 5056]
    - [7, 6185.29]
  - - [6784, 704, 1, 1792, 6784, 6784, 1792, 704]
    - [4, 5791.04]
  - - [1408, 5056, 1, 128, 1408, 1408, 128, 5056]
    - [1, 3033.56]
  - - [1024, 4, 1, 3328, 1024, 1024, 3328, 4]
    - [18, 275.07]
  - - [64, 1856, 1, 768, 64, 64, 768, 1856]
    - [11, 2332.46]
  - - [1408, 64, 1, 768, 1408, 1408, 768, 64]
    - [11, 1891.21]
  - - [448, 2944, 1, 1792, 448, 448, 1792, 2944]
    - [7, 4938.31]
  - - [6784, 4288, 1, 128, 6784, 6784, 128, 4288]
    - [1, 3307.41]
  - - [64, 3584, 1, 128, 64, 64, 128, 3584]
    - [0, 874.959]
  - - [704, 128, 1, 768, 704, 704, 768, 128]
    - [11, 1938.3]
  - - [448, 4, 1, 3328, 448, 448, 3328, 4]
    - [18, 138.57]
  - - [3584, 3584, 1, 128, 3584, 3584, 128, 3584]
    - [1, 2891.2]
  - - [2368, 6784, 1, 1792, 2368, 2368, 1792, 6784]
    - [7, 6364.63]
  - - [2368, 2368, 1, 128, 2368, 2368, 128, 2368]
    - [1, 3064.34]
  - - [6784, 4, 1, 1792, 6784, 6784, 1792, 4]
    - [17, 159.103]
  - - [3584, 64, 1, 256, 3584, 3584, 256, 64]
    - [11, 2810.99]
  - - [6784, 3584, 1, 256, 6784, 6784, 256, 3584]
    - [4, 6092.44]
  - - [64, 1408, 1, 256, 64, 64, 256, 1408]
    - [11, 1435.11]
  - - [256, 2368, 1, 3328, 256, 256, 3328, 2368]
    - [11, 4392.76]
  - - [4, 5056, 1, 128, 4, 4, 128, 5056]
    - [15, 99.2798]
  - - [704, 4288, 1, 128, 704, 704, 128, 4288]
    - [1, 2761.4]
  - - [128, 2368, 1, 128, 128, 128, 128, 2368]
    - [0, 920.469]
  - - [2368, 5888, 1, 128, 2368, 2368, 128, 5888]
    - [1, 3356.45]
  - - [1856, 5888, 1, 256, 1856, 1856, 256, 5888]
    - [7, 6027.26]
  - - [64, 2944, 1, 1792, 64, 64, 1792, 2944]
    - [11, 3276.82]
  - - [448, 4, 1, 256, 448, 448, 256, 4]
    - [18, 18.9387]
  - - [1408, 2944, 1, 3328, 1408, 1408, 3328, 2944]
    - [4, 6317.57]
  - - [5056, 6784, 1, 128, 5056, 5056, 128, 6784]
    - [1, 3433.29]
  - - [4, 2368, 1, 768, 4, 4, 768, 2368]
    - [17, 186.698]
  - - [3584, 1856, 1, 256, 3584, 3584, 256, 1856]
    - [7, 5298.11]
  - - [448, 5888, 1, 3328, 448, 448, 3328, 5888]
    - [4, 5257.04]
  - - [4288, 4, 1, 1792, 4288, 4288, 1792, 4]
    - [18, 154.193]
  - - [128, 448, 1, 256, 128, 128, 256, 448]
    - [11, 909.067]
  - - [6784, 4288, 1, 3328, 6784, 6784, 3328, 4288]
    - [4, 6374.22]
  - - [2368, 6784, 1, 256, 2368, 2368, 256, 6784]
    - [7, 6072.83]
  - - [256, 2944, 1, 1792, 256, 256, 1792, 2944]
    - [11, 4641.61]
  - - [1408, 5888, 1, 256, 1408, 1408, 256, 5888]
    - [4, 5928.13]
  - - [64, 5056, 1, 3328, 64, 64, 3328, 5056]
    - [11, 3585.12]
  - - [256, 5888, 1, 256, 256, 256, 256, 5888]
    - [7, 4537.64]
  - - [5056, 1408, 1, 1792, 5056, 5056, 1792, 1408]
    - [4, 6261.25]
  - - [704, 4, 1, 3328, 704, 704, 3328, 4]
    - [18, 203.4]
  - - [6784, 5056, 1, 768, 6784, 6784, 768, 5056]
    - [4, 6327.43]
  - - [4288, 704, 1, 1792, 4288, 4288, 1792, 704]
    - [7, 5086.59]
  - - [4, 2368, 1, 256, 4, 4, 256, 2368]
    - [17, 83.5055]
  - - [4288, 6784, 1, 128, 4288, 4288, 128, 6784]
    - [1, 3410.18]
  - - [4, 4288, 1, 768, 4, 4, 768, 4288]
    - [16, 265.812]
  - - [6784, 5888, 1, 768, 6784, 6784, 768, 5888]
    - [4, 6441.44]
  - - [4288, 128, 1, 128, 4288, 4288, 128, 128]
    - [0, 1488.89]
  - - [5056, 256, 1, 768, 5056, 5056, 768, 256]
    - [7, 4721.81]
  - - [3584, 128, 1, 3328, 3584, 3584, 3328, 128]
    - [7, 4257.46]
  - - [1856, 1408, 1, 768, 1856, 1856, 768, 1408]
    - [7, 5990.17]
  - - [6784, 2368, 1, 128, 6784, 6784, 128, 2368]
    - [1, 3211.34]
  - - [448, 3584, 1, 3328, 448, 448, 3328, 3584]
    - [11, 4710.17]
  - - [1408, 256, 1, 256, 1408, 1408, 256, 256]
    - [11, 2951.85]
  - - [256, 5056, 1, 256, 256, 256, 256, 5056]
    - [11, 3969.05]
  - - [4288, 448, 1, 768, 4288, 4288, 768, 448]
    - [11, 4631.81]
  - - [1024, 5888, 1, 768, 1024, 1024, 768, 5888]
    - [4, 6004.85]
  - - [2944, 128, 1, 256, 2944, 2944, 256, 128]
    - [11, 3071.48]
  - - [5056, 2944, 1, 3328, 5056, 5056, 3328, 2944]
    - [7, 6329.05]
  - - [2368, 1856, 1, 256, 2368, 2368, 256, 1856]
    - [7, 5350.07]
  - - [4, 2944, 1, 768, 4, 4, 768, 2944]
    - [17, 205.195]
  - - [4, 1024, 1, 3328, 4, 4, 3328, 1024]
    - [18, 256.298]
  - - [704, 4288, 1, 1792, 704, 704, 1792, 4288]
    - [7, 5907.46]
  - - [2944, 5888, 1, 256, 2944, 2944, 256, 5888]
    - [7, 5997.79]
  - - [6784, 1024, 1, 1792, 6784, 6784, 1792, 1024]
    - [4, 6008.58]
  - - [1024, 448, 1, 1792, 1024, 1024, 1792, 448]
    - [7, 4134.75]
  - - [3584, 256, 1, 256, 3584, 3584, 256, 256]
    - [7, 4199.78]
  - - [5888, 5056, 1, 256, 5888, 5888, 256, 5056]
    - [4, 6102.14]
  - - [448, 1408, 1, 1792, 448, 448, 1792, 1408]
    - [11, 4549.67]
  - - [128, 6784, 1, 3328, 128, 128, 3328, 6784]
    - [7, 4822.9]
  - - [128, 1024, 1, 1792, 128, 128, 1792, 1024]
    - [11, 2731.11]
  - - [128, 2944, 1, 256, 128, 128, 256, 2944]
    - [11, 3138.07]
  - - [5888, 256, 1, 1792, 5888, 5888, 1792, 256]
    - [7, 5629.85]
  - - [448, 64, 1, 256, 448, 448, 256, 64]
    - [11, 454.533]
  - - [704, 704, 1, 768, 704, 704, 768, 704]
    - [11, 4257.19]
  - - [2368, 448, 1, 3328, 2368, 2368, 3328, 448]
    - [11, 4502.74]
  - - [4288, 704, 1, 3328, 4288, 4288, 3328, 704]
    - [7, 5140.18]
  - - [5888, 4288, 1, 768, 5888, 5888, 768, 4288]
    - [4, 6280.16]
  - - [4288, 128, 1, 1792, 4288, 4288, 1792, 128]
    - [11, 3863.21]
  - - [2944, 5888, 1, 1792, 2944, 2944, 1792, 5888]
    - [4, 6409.9]
  - - [64, 4288, 1, 3328, 64, 64, 3328, 4288]
    - [11, 3076.97]
  - - [256, 3584, 1, 768, 256, 256, 768, 3584]
    - [7, 4777.74]
  - - [448, 128, 1, 256, 448, 448, 256, 128]
    - [11, 930.414]
  - - [5056, 1024, 1, 1792, 5056, 5056, 1792, 1024]
    - [4, 6263.95]
  - - [1408, 704, 1, 256, 1408, 1408, 256, 704]
    - [11, 3857.67]
  - - [3584, 4, 1, 256, 3584, 3584, 256, 4]
    - [17, 119.963]
  - - [3584, 4, 1, 128, 3584, 3584, 128, 4]
    - [15, 80.1699]
  - - [5888, 3584, 1, 256, 5888, 5888, 256, 3584]
    - [7, 6043.68]
  - - [448, 3584, 1, 1792, 448, 448, 1792, 3584]
    - [7, 4633.5]
  - - [4288, 4, 1, 3328, 4288, 4288, 3328, 4]
    - [18, 160.841]
  - - [1408, 64, 1, 256, 1408, 1408, 256, 64]
    - [11, 1455.21]
  - - [64, 256, 1, 768, 64, 64, 768, 256]
    - [11, 384.311]
  - - [64, 6784, 1, 768, 64, 64, 768, 6784]
    - [7, 3668.65]
  - - [256, 5888, 1, 128, 256, 256, 128, 5888]
    - [0, 2025.35]
  - - [5056, 4, 1, 256, 5056, 5056, 256, 4]
    - [16, 156.711]
  - - [704, 5888, 1, 128, 704, 704, 128, 5888]
    - [2, 2836.7]
  - - [2944, 5888, 1, 3328, 2944, 2944, 3328, 5888]
    - [4, 6441.88]
  - - [64, 3584, 1, 768, 64, 64, 768, 3584]
    - [11, 3517.9]
  - - [5888, 5056, 1, 3328, 5888, 5888, 3328, 5056]
    - [4, 6510.16]
  - - [128, 4, 1, 256, 128, 128, 256, 4]
    - [18, 7.02159]
  - - [128, 2368, 1, 3328, 128, 128, 3328, 2368]
    - [11, 3443.99]
  - - [2368, 1856, 1, 1792, 2368, 2368, 1792, 1856]
    - [7, 5832.88]
  - - [64, 64, 1, 3328, 64, 64, 3328, 64]
    - [8, 259.551]
  - - [2944, 1856, 1, 256, 2944, 2944, 256, 1856]
    - [7, 5470.28]
  - - [2944, 4, 1, 3328, 2944, 2944, 3328, 4]
    - [16, 291.013]
  - - [4, 448, 1, 256, 4, 4, 256, 448]
    - [17, 18.4865]
  - - [2944, 448, 1, 128, 2944, 2944, 128, 448]
    - [0, 2116.09]
  - - [4, 2368, 1, 128, 4, 4, 128, 2368]
    - [15, 49.448]
  - - [704, 256, 1, 256, 704, 704, 256, 256]
    - [11, 2193.1]
  - - [1408, 2944, 1, 1792, 1408, 1408, 1792, 2944]
    - [4, 6257.56]
  - - [5056, 704, 1, 1792, 5056, 5056, 1792, 704]
    - [4, 5349.64]
  - - [1856, 3584, 1, 768, 1856, 1856, 768, 3584]
    - [7, 6101.52]
  - - [2944, 1408, 1, 256, 2944, 2944, 256, 1408]
    - [7, 5698.23]
  - - [64, 4288, 1, 256, 64, 64, 256, 4288]
    - [11, 2231.58]
  - - [1856, 1408, 1, 3328, 1856, 1856, 3328, 1408]
    - [7, 6165.61]
  - - [704, 1856, 1, 1792, 704, 704, 1792, 1856]
    - [11, 4952.09]
  - - [704, 4, 1, 1792, 704, 704, 1792, 4]
    - [18, 131.26]
  - - [1408, 1856, 1, 256, 1408, 1408, 256, 1856]
    - [7, 4565.82]
  - - [5888, 6784, 1, 768, 5888, 5888, 768, 6784]
    - [4, 6419.77]
  - - [6784, 256, 1, 3328, 6784, 6784, 3328, 256]
    - [4, 5096.68]
  - - [256, 704, 1, 768, 256, 256, 768, 704]
    - [11, 2928.74]
  - - [6784, 1856, 1, 1792, 6784, 6784, 1792, 1856]
    - [7, 6152.25]
  - - [448, 2944, 1, 3328, 448, 448, 3328, 2944]
    - [7, 5009.28]
  - - [6784, 704, 1, 128, 6784, 6784, 128, 704]
    - [1, 2844.75]
  - - [5888, 704, 1, 128, 5888, 5888, 128, 704]
    - [1, 2548.99]
  - - [1856, 2368, 1, 1792, 1856, 1856, 1792, 2368]
    - [7, 5827.77]
  - - [3584, 128, 1, 256, 3584, 3584, 256, 128]
    - [11, 3008.4]
  - - [1408, 448, 1, 3328, 1408, 1408, 3328, 448]
    - [11, 4606.51]
  - - [704, 448, 1, 256, 704, 704, 256, 448]
    - [11, 2752.45]
  - - [128, 2944, 1, 3328, 128, 128, 3328, 2944]
    - [11, 4215.62]
  - - [3584, 4, 1, 1792, 3584, 3584, 1792, 4]
    - [17, 353.885]
  - - [2368, 256, 1, 1792, 2368, 2368, 1792, 256]
    - [11, 3587.35]
  - - [256, 128, 1, 256, 256, 256, 256, 128]
    - [11, 519.467]
  - - [1856, 1024, 1, 3328, 1856, 1856, 3328, 1024]
    - [4, 5559.7]
  - - [448, 5056, 1, 128, 448, 448, 128, 5056]
    - [1, 2588.61]
  - - [2944, 2368, 1, 256, 2944, 2944, 256, 2368]
    - [7, 5578.28]
  - - [2944, 704, 1, 768, 2944, 2944, 768, 704]
    - [11, 4690.68]
  - - [5888, 4, 1, 768, 5888, 5888, 768, 4]
    - [16, 295.263]
  - - [256, 1408, 1, 1792, 256, 256, 1792, 1408]
    - [11, 3858.31]
  - - [4, 128, 1, 128, 4, 4, 128, 128]
    - [15, 2.82659]
  - - [1024, 5056, 1, 3328, 1024, 1024, 3328, 5056]
    - [4, 6354.4]
  - - [6784, 1408, 1, 256, 6784, 6784, 256, 1408]
    - [7, 5806.62]
  - - [64, 2368, 1, 256, 64, 64, 256, 2368]
    - [11, 1812.32]
  - - [4, 2944, 1, 256, 4, 4, 256, 2944]
    - [16, 99.7487]
  - - [5056, 6784, 1, 768, 5056, 5056, 768, 6784]
    - [7, 6348.33]
  - - [1408, 1408, 1, 256, 1408, 1408, 256, 1408]
    - [4, 5067.48]
  - - [3584, 5888, 1, 128, 3584, 3584, 128, 5888]
    - [3, 3044.54]
  - - [3584, 2944, 1, 256, 3584, 3584, 256, 2944]
    - [7, 5766.05]
  - - [448, 256, 1, 256, 448, 448, 256, 256]
    - [11, 1834.95]
  - - [3584, 1024, 1, 3328, 3584, 3584, 3328, 1024]
    - [7, 6016.53]
  - - [1408, 5888, 1, 768, 1408, 1408, 768, 5888]
    - [4, 6288.56]
  - - [4288, 5056, 1, 1792, 4288, 4288, 1792, 5056]
    - [7, 6338.29]
  - - [1856, 6784, 1, 256, 1856, 1856, 256, 6784]
    - [7, 5902.6]
  - - [256, 2368, 1, 128, 256, 256, 128, 2368]
    - [0, 1423.25]
  - - [6784, 4, 1, 3328, 6784, 6784, 3328, 4]
    - [17, 164.905]
  - - [4, 256, 1, 768, 4, 4, 768, 256]
    - [18, 33.0739]
  - - [4, 4, 1, 1792, 4, 4, 1792, 4]
    - [18, 1.09341]
  - - [1024, 704, 1, 3328, 1024, 1024, 3328, 704]
    - [11, 4496.42]
  - - [704, 704, 1, 3328, 704, 704, 3328, 704]
    - [11, 4600.52]
  - - [256, 3584, 1, 3328, 256, 256, 3328, 3584]
    - [7, 5081.45]
  - - [2944, 256, 1, 1792, 2944, 2944, 1792, 256]
    - [12, 4293.99]
  - - [4, 64, 1, 768, 4, 4, 768, 64]
    - [18, 9.61643]
  - - [1856, 4288, 1, 128, 1856, 1856, 128, 4288]
    - [1, 3210.84]
  - - [256, 2944, 1, 128, 256, 256, 128, 2944]
    - [1, 1597.92]
  - - [704, 1856, 1, 128, 704, 704, 128, 1856]
    - [0, 2322.84]
  - - [6784, 5888, 1, 128, 6784, 6784, 128, 5888]
    - [1, 3323.96]
  - - [5056, 4, 1, 128, 5056, 5056, 128, 4]
    - [15, 98.9989]
  - - [2368, 5888, 1, 768, 2368, 2368, 768, 5888]
    - [7, 6256.74]
  - - [5056, 6784, 1, 3328, 5056, 5056, 3328, 6784]
    - [7, 6441.91]
  - - [5888, 1408, 1, 256, 5888, 5888, 256, 1408]
    - [7, 5901.28]
  - - [128, 4288, 1, 1792, 128, 128, 1792, 4288]
    - [11, 3914.46]
  - - [256, 4288, 1, 1792, 256, 256, 1792, 4288]
    - [11, 4569.11]
  - - [4288, 2944, 1, 768, 4288, 4288, 768, 2944]
    - [7, 6121.4]
  - - [4288, 3584, 1, 1792, 4288, 4288, 1792, 3584]
    - [4, 6422.28]
  - - [6784, 448, 1, 128, 6784, 6784, 128, 448]
    - [1, 2683.54]
  - - [256, 4, 1, 768, 256, 256, 768, 4]
    - [18, 32.7673]
  - - [4, 1024, 1, 128, 4, 4, 128, 1024]
    - [15, 21.1274]
  - - [256, 4288, 1, 256, 256, 256, 256, 4288]
    - [11, 3737.59]
  - - [1408, 1856, 1, 1792, 1408, 1408, 1792, 1856]
    - [4, 5163.21]
  - - [5056, 64, 1, 128, 5056, 5056, 128, 64]
    - [0, 1129.58]
  - - [2944, 5888, 1, 768, 2944, 2944, 768, 5888]
    - [4, 6321.42]
  - - [1408, 448, 1, 128, 1408, 1408, 128, 448]
    - [0, 1659.0]
  - - [2368, 4, 1, 3328, 2368, 2368, 3328, 4]
    - [17, 369.081]
  - - [2944, 1856, 1, 3328, 2944, 2944, 3328, 1856]
    - [7, 6018.25]
  - - [3584, 3584, 1, 768, 3584, 3584, 768, 3584]
    - [7, 6175.51]
  - - [704, 1856, 1, 256, 704, 704, 256, 1856]
    - [7, 4196.67]
  - - [1408, 5056, 1, 768, 1408, 1408, 768, 5056]
    - [4, 6107.29]
  - - [4288, 1856, 1, 128, 4288, 4288, 128, 1856]
    - [1, 3174.52]
  - - [3584, 4288, 1, 3328, 3584, 3584, 3328, 4288]
    - [4, 6449.59]
  - - [5888, 1856, 1, 3328, 5888, 5888, 3328, 1856]
    - [4, 6222.67]
  - - [1856, 704, 1, 768, 1856, 1856, 768, 704]
    - [7, 4689.09]
  - - [448, 1856, 1, 3328, 448, 448, 3328, 1856]
    - [7, 4601.09]
  - - [2368, 64, 1, 256, 2368, 2368, 256, 64]
    - [5, 1877.26]
  - - [4, 5056, 1, 256, 4, 4, 256, 5056]
    - [16, 147.452]
  - - [64, 5888, 1, 256, 64, 64, 256, 5888]
    - [11, 3007.65]
  - - [3584, 64, 1, 768, 3584, 3584, 768, 64]
    - [11, 3653.01]
  - - [4288, 2368, 1, 128, 4288, 4288, 128, 2368]
    - [1, 3248.6]
  - - [1024, 704, 1, 256, 1024, 1024, 256, 704]
    - [11, 3417.52]
  - - [6784, 1024, 1, 256, 6784, 6784, 256, 1024]
    - [7, 5651.52]
  - - [704, 2944, 1, 768, 704, 704, 768, 2944]
    - [7, 5802.86]
  - - [64, 448, 1, 128, 64, 64, 128, 448]
    - [0, 127.036]
  - - [2368, 128, 1, 256, 2368, 2368, 256, 128]
    - [11, 2518.04]
  - - [4288, 448, 1, 128, 4288, 4288, 128, 448]
    - [0, 2422.97]
  - - [1856, 6784, 1, 3328, 1856, 1856, 3328, 6784]
    - [7, 6204.48]
  - - [6784, 1408, 1, 768, 6784, 6784, 768, 1408]
    - [7, 6056.99]
  - - [5888, 1024, 1, 3328, 5888, 5888, 3328, 1024]
    - [4, 5924.36]
  - - [3584, 5056, 1, 128, 3584, 3584, 128, 5056]
    - [3, 3058.1]
  - - [1856, 5888, 1, 128, 1856, 1856, 128, 5888]
    - [1, 3286.93]
  - - [5888, 4288, 1, 1792, 5888, 5888, 1792, 4288]
    - [4, 6370.73]
  - - [704, 64, 1, 768, 704, 704, 768, 64]
    - [11, 1006.74]
  - - [128, 1856, 1, 768, 128, 128, 768, 1856]
    - [11, 3812.8]
  - - [2368, 704, 1, 128, 2368, 2368, 128, 704]
    - [0, 2351.55]
  - - [448, 4, 1, 128, 448, 448, 128, 4]
    - [15, 10.6776]
  - - [1856, 4288, 1, 1792, 1856, 1856, 1792, 4288]
    - [4, 6155.99]
  - - [3584, 448, 1, 1792, 3584, 3584, 1792, 448]
    - [11, 4681.53]
  - - [128, 448, 1, 1792, 128, 128, 1792, 448]
    - [11, 1357.38]
  - - [2368, 1408, 1, 128, 2368, 2368, 128, 1408]
    - [0, 2733.05]
  - - [5056, 4288, 1, 1792, 5056, 5056, 1792, 4288]
    - [7, 6342.89]
  - - [704, 6784, 1, 256, 704, 704, 256, 6784]
    - [7, 5376.31]
  - - [3584, 1856, 1, 3328, 3584, 3584, 3328, 1856]
    - [4, 5890.54]
  - - [3584, 1024, 1, 1792, 3584, 3584, 1792, 1024]
    - [7, 6141.61]
  - - [256, 128, 1, 3328, 256, 256, 3328, 128]
    - [13, 1202.75]
  - - [2368, 5056, 1, 1792, 2368, 2368, 1792, 5056]
    - [4, 6239.58]
  - - [4288, 1856, 1, 768, 4288, 4288, 768, 1856]
    - [4, 6006.14]
  - - [1856, 256, 1, 3328, 1856, 1856, 3328, 256]
    - [7, 4412.25]
  - - [6784, 3584, 1, 768, 6784, 6784, 768, 3584]
    - [4, 6323.2]
  - - [1024, 2368, 1, 128, 1024, 1024, 128, 2368]
    - [1, 2257.55]
  - - [4, 448, 1, 768, 4, 4, 768, 448]
    - [18, 49.2814]
  - - [2368, 4288, 1, 256, 2368, 2368, 256, 4288]
    - [7, 5816.58]
  - - [4288, 4288, 1, 256, 4288, 4288, 256, 4288]
    - [7, 5943.69]
  - - [448, 704, 1, 1792, 448, 448, 1792, 704]
    - [11, 3522.53]
  - - [1408, 256, 1, 768, 1408, 1408, 768, 256]
    - [11, 3586.41]
  - - [4288, 1856, 1, 3328, 4288, 4288, 3328, 1856]
    - [4, 6190.65]
  - - [128, 5888, 1, 1792, 128, 128, 1792, 5888]
    - [11, 4584.42]
  - - [1024, 704, 1, 1792, 1024, 1024, 1792, 704]
    - [11, 4408.38]
  - - [4, 704, 1, 1792, 4, 4, 1792, 704]
    - [18, 137.622]
  - - [5056, 1408, 1, 128, 5056, 5056, 128, 1408]
    - [1, 3181.05]
  - - [128, 6784, 1, 128, 128, 128, 128, 6784]
    - [0, 1695.46]
  - - [2368, 704, 1, 768, 2368, 2368, 768, 704]
    - [7, 4643.7]
  - - [4, 6784, 1, 768, 4, 4, 768, 6784]
    - [16, 318.62]
  - - [1024, 4288, 1, 128, 1024, 1024, 128, 4288]
    - [1, 2529.95]
  - - [4, 128, 1, 3328, 4, 4, 3328, 128]
    - [18, 47.8231]
  - - [6784, 448, 1, 768, 6784, 6784, 768, 448]
    - [7, 4916.54]
  - - [5056, 1856, 1, 1792, 5056, 5056, 1792, 1856]
    - [7, 6012.43]
  - - [256, 64, 1, 768, 256, 256, 768, 64]
    - [11, 388.709]
  - - [5056, 1024, 1, 256, 5056, 5056, 256, 1024]
    - [7, 5786.71]
  - - [1856, 1856, 1, 256, 1856, 1856, 256, 1856]
    - [7, 5258.28]
  - - [5888, 2368, 1, 3328, 5888, 5888, 3328, 2368]
    - [4, 6265.46]
  - - [256, 704, 1, 3328, 256, 256, 3328, 704]
    - [11, 3275.45]
  - - [448, 2944, 1, 256, 448, 448, 256, 2944]
    - [7, 4295.99]
  - - [1408, 4, 1, 128, 1408, 1408, 128, 4]
    - [15, 32.119]
  - - [256, 4, 1, 256, 256, 256, 256, 4]
    - [17, 12.5494]
  - - [64, 6784, 1, 256, 64, 64, 256, 6784]
    - [11, 2942.12]
  - - [5888, 1024, 1, 256, 5888, 5888, 256, 1024]
    - [7, 5584.8]
  - - [448, 64, 1, 128, 448, 448, 128, 64]
    - [0, 118.527]
  - - [64, 64, 1, 1792, 64, 64, 1792, 64]
    - [8, 163.242]
  - - [256, 6784, 1, 128, 256, 256, 128, 6784]
    - [0, 2038.7]
  - - [4288, 256, 1, 3328, 4288, 4288, 3328, 256]
    - [7, 4179.82]
  - - [2944, 704, 1, 256, 2944, 2944, 256, 704]
    - [7, 4253.38]
  - - [64, 448, 1, 256, 64, 64, 256, 448]
    - [11, 454.533]
  - - [1408, 5888, 1, 1792, 1408, 1408, 1792, 5888]
    - [4, 6426.59]
  - - [1024, 128, 1, 256, 1024, 1024, 256, 128]
    - [11, 2049.69]
  - - [5888, 64, 1, 3328, 5888, 5888, 3328, 64]
    - [11, 4222.99]
  - - [4288, 6784, 1, 1792, 4288, 4288, 1792, 6784]
    - [7, 6408.28]
  - - [1024, 2944, 1, 1792, 1024, 1024, 1792, 2944]
    - [4, 5952.41]
  - - [2368, 3584, 1, 128, 2368, 2368, 128, 3584]
    - [1, 3194.31]
  - - [704, 128, 1, 256, 704, 704, 256, 128]
    - [11, 1402.78]
  - - [704, 2368, 1, 128, 704, 704, 128, 2368]
    - [0, 2355.39]
  - - [1408, 128, 1, 768, 1408, 1408, 768, 128]
    - [11, 2956.51]
  - - [64, 5056, 1, 768, 64, 64, 768, 5056]
    - [11, 3235.14]
  - - [256, 704, 1, 128, 256, 256, 128, 704]
    - [0, 709.391]
  - - [704, 448, 1, 128, 704, 704, 128, 448]
    - [0, 1116.79]
  - - [1408, 64, 1, 1792, 1408, 1408, 1792, 64]
    - [11, 2098.11]
  - - [256, 64, 1, 1792, 256, 256, 1792, 64]
    - [13, 459.808]
  - - [2368, 1408, 1, 1792, 2368, 2368, 1792, 1408]
    - [7, 5659.81]
  - - [1856, 4, 1, 768, 1856, 1856, 768, 4]
    - [17, 162.043]
  - - [1024, 448, 1, 128, 1024, 1024, 128, 448]
    - [0, 1206.55]
  - - [4288, 1024, 1, 128, 4288, 4288, 128, 1024]
    - [1, 2779.24]
  - - [448, 6784, 1, 768, 448, 448, 768, 6784]
    - [7, 5807.24]
  - - [1856, 2944, 1, 1792, 1856, 1856, 1792, 2944]
    - [7, 5984.15]
  - - [1408, 2368, 1, 128, 1408, 1408, 128, 2368]
    - [1, 2674.68]
  - - [1856, 5888, 1, 768, 1856, 1856, 768, 5888]
    - [7, 6270.08]
  - - [256, 256, 1, 3328, 256, 256, 3328, 256]
    - [13, 2037.61]
  - - [5888, 128, 1, 128, 5888, 5888, 128, 128]
    - [0, 1906.73]
  - - [5056, 1024, 1, 768, 5056, 5056, 768, 1024]
    - [4, 6112.23]
  - - [1024, 64, 1, 256, 1024, 1024, 256, 64]
    - [11, 1011.1]
  - - [256, 2368, 1, 256, 256, 256, 256, 2368]
    - [11, 3509.24]
  - - [5888, 704, 1, 1792, 5888, 5888, 1792, 704]
    - [7, 5483.84]
  - - [1024, 64, 1, 3328, 1024, 1024, 3328, 64]
    - [13, 1769.43]
  - - [6784, 2368, 1, 1792, 6784, 6784, 1792, 2368]
    - [4, 6283.65]
  - - [5056, 3584, 1, 128, 5056, 5056, 128, 3584]
    - [1, 3282.51]
  - - [1024, 1856, 1, 1792, 1024, 1024, 1792, 1856]
    - [4, 5471.49]
  - - [6784, 256, 1, 128, 6784, 6784, 128, 256]
    - [0, 2206.59]
  - - [3584, 2944, 1, 3328, 3584, 3584, 3328, 2944]
    - [7, 6166.6]
  - - [4288, 1856, 1, 1792, 4288, 4288, 1792, 1856]
    - [4, 6144.4]
  - - [1856, 4288, 1, 3328, 1856, 1856, 3328, 4288]
    - [4, 6199.34]
  - - [4288, 4288, 1, 128, 4288, 4288, 128, 4288]
    - [1, 3373.18]
  - - [128, 5056, 1, 3328, 128, 128, 3328, 5056]
    - [11, 4679.76]
  - - [2368, 4288, 1, 128, 2368, 2368, 128, 4288]
    - [1, 3284.48]
  - - [4, 1856, 1, 128, 4, 4, 128, 1856]
    - [15, 38.6399]
  - - [5888, 6784, 1, 128, 5888, 5888, 128, 6784]
    - [3, 3061.79]
  - - [5056, 256, 1, 128, 5056, 5056, 128, 256]
    - [0, 2207.87]
  - - [128, 64, 1, 3328, 128, 128, 3328, 64]
    - [8, 463.53]
  - - [4, 256, 1, 3328, 4, 4, 3328, 256]
    - [18, 88.8126]
  - - [256, 3584, 1, 1792, 256, 256, 1792, 3584]
    - [7, 4997.92]
  - - [4, 1856, 1, 1792, 4, 4, 1792, 1856]
    - [17, 253.669]
  - - [704, 4288, 1, 3328, 704, 704, 3328, 4288]
    - [7, 5972.23]
  - - [6784, 704, 1, 768, 6784, 6784, 768, 704]
    - [4, 5608.32]
  - - [2368, 4288, 1, 3328, 2368, 2368, 3328, 4288]
    - [7, 6227.07]
  - - [64, 1024, 1, 768, 64, 64, 768, 1024]
    - [11, 1311.71]
  - - [2368, 704, 1, 1792, 2368, 2368, 1792, 704]
    - [11, 4847.23]
  - - [4, 4, 1, 3328, 4, 4, 3328, 4]
    - [18, 1.54921]
  - - [704, 3584, 1, 3328, 704, 704, 3328, 3584]
    - [7, 5943.94]
  - - [1408, 448, 1, 768, 1408, 1408, 768, 448]
    - [11, 4243.87]
  - - [5888, 448, 1, 128, 5888, 5888, 128, 448]
    - [1, 2364.14]
  - - [704, 448, 1, 1792, 704, 704, 1792, 448]
    - [11, 3507.96]
  - - [2368, 448, 1, 128, 2368, 2368, 128, 448]
    - [0, 1988.22]
  - - [5888, 2944, 1, 128, 5888, 5888, 128, 2944]
    - [3, 2998.29]
  - - [2368, 1024, 1, 768, 2368, 2368, 768, 1024]
    - [7, 5526.52]
  - - [2368, 3584, 1, 768, 2368, 2368, 768, 3584]
    - [7, 6010.28]
  - - [256, 1024, 1, 128, 256, 256, 128, 1024]
    - [0, 900.548]
  - - [64, 128, 1, 1792, 64, 64, 1792, 128]
    - [8, 291.008]
  - - [704, 256, 1, 1792, 704, 704, 1792, 256]
    - [11, 3096.51]
  - - [1856, 3584, 1, 3328, 1856, 1856, 3328, 3584]
    - [7, 6229.55]
  - - [2368, 1024, 1, 256, 2368, 2368, 256, 1024]
    - [7, 5144.27]
  - - [1856, 704, 1, 128, 1856, 1856, 128, 704]
    - [0, 2332.44]
  - - [704, 256, 1, 768, 704, 704, 768, 256]
    - [11, 2905.95]
  - - [1408, 704, 1, 3328, 1408, 1408, 3328, 704]
    - [11, 4736.56]
  - - [2368, 4, 1, 128, 2368, 2368, 128, 4]
    - [15, 53.8397]
  - - [704, 5888, 1, 3328, 704, 704, 3328, 5888]
    - [7, 6224.66]
  - - [1024, 1408, 1, 1792, 1024, 1024, 1792, 1408]
    - [7, 5347.91]
  - - [448, 1024, 1, 1792, 448, 448, 1792, 1024]
    - [7, 4144.1]
  - - [1408, 256, 1, 128, 1408, 1408, 128, 256]
    - [0, 1240.72]
  - - [2944, 4288, 1, 1792, 2944, 2944, 1792, 4288]
    - [7, 6167.51]
  - - [448, 448, 1, 256, 448, 448, 256, 448]
    - [11, 2550.08]
  - - [2944, 2368, 1, 768, 2944, 2944, 768, 2368]
    - [4, 5990.71]
  - - [704, 2368, 1, 768, 704, 704, 768, 2368]
    - [11, 4696.69]
  - - [64, 128, 1, 256, 64, 64, 256, 128]
    - [11, 130.465]
  - - [5888, 2368, 1, 1792, 5888, 5888, 1792, 2368]
    - [4, 6230.32]
  - - [2944, 5888, 1, 128, 2944, 2944, 128, 5888]
    - [1, 3214.18]
  - - [256, 448, 1, 256, 256, 256, 256, 448]
    - [11, 1738.42]
- null
