lib/configs/lite_configs_mixed/vega10_Cijk_Ailk_Bljk_SB.yaml
- {MinimumRequiredVersion: 4.9.5}
- vega10
- gfx900
- [Device 6863, Device 6862, Device 687f, Device 6860, Device 6861, 'Vega 10 XTX [Radeon
    SolutionIndex: 0
    SolutionNameMin: Cijk_Ailk_Bljk_SB_MT32x64x8_SE_AMAS2_GRVW4_GSU1_VW4
    SolutionIndex: 1
    SolutionNameMin: Cijk_Ailk_Bljk_SB_MT128x64x16_SE_AMAS2_GRVW4_GSU1_VW4
    SolutionIndex: 2
    SolutionNameMin: Cijk_Ailk_Bljk_SB_MT64x128x8_SE_AMAS0_GRVW1_GSU1_VW1
    SolutionIndex: 3
    SolutionNameMin: Cijk_Ailk_Bljk_SB_MT32x32x8_SE_AMAS2_GRVW4_GSU1_VW4
    SolutionIndex: 4
    SolutionNameMin: Cijk_Ailk_Bljk_SB_MT64x32x16_SE_AMAS1_GRVW1_GSU1_VW1
    SolutionIndex: 5
    SolutionNameMin: Cijk_Ailk_Bljk_SB_MT16x16x4_SE_AMAS2_GRVW2_GSU1_VW2
    SolutionIndex: 6
    SolutionNameMin: Cijk_Ailk_Bljk_SB_MT16x16x4_SE_AMAS0_GRVW1_GSU1_VW1
    SolutionIndex: 7
    SolutionNameMin: Cijk_Ailk_Bljk_SB_MT8x8x8_SE_AMAS3_GRVW2_GSU2_VW2
- - - [4, 2368, 1, 256, 4, 4, 4, 256]
    - [7, 0.0]
  - - [2368, 4288, 1, 768, 2368, 2368, 2368, 768]
    - [4, 0.0]
  - - [5888, 1856, 1, 768, 5888, 5888, 5888, 768]
    - [4, 0.0]
  - - [256, 6784, 1, 256, 256, 256, 256, 256]
    - [4, 0.0]
  - - [3584, 2944, 1, 1792, 3584, 3584, 3584, 1792]
    - [4, 0.0]
  - - [5056, 64, 1, 1792, 5056, 5056, 5056, 1792]
    - [4, 0.0]
  - - [5888, 1856, 1, 128, 5888, 5888, 5888, 128]
    - [2, 3233.47]
  - - [1408, 704, 1, 1792, 1408, 1408, 1408, 1792]
    - [4, 0.0]
  - - [704, 1408, 1, 256, 704, 704, 704, 256]
    - [4, 0.0]
  - - [4288, 704, 1, 1792, 4288, 4288, 4288, 1792]
    - [4, 0.0]
  - - [2368, 5888, 1, 256, 2368, 2368, 2368, 256]
    - [4, 0.0]
  - - [128, 128, 1, 3328, 128, 128, 128, 3328]
    - [4, 0.0]
  - - [6784, 64, 1, 256, 6784, 6784, 6784, 256]
    - [4, 0.0]
  - - [1024, 5888, 1, 768, 1024, 1024, 1024, 768]
    - [4, 0.0]
  - - [256, 1024, 1, 256, 256, 256, 256, 256]
    - [4, 0.0]
  - - [128, 2944, 1, 128, 128, 128, 128, 128]
    - [3, 1072.74]
  - - [1024, 2368, 1, 256, 1024, 1024, 1024, 256]
    - [4, 0.0]
  - - [1856, 5056, 1, 256, 1856, 1856, 1856, 256]
    - [4, 0.0]
  - - [4, 2944, 1, 128, 4, 4, 4, 128]
    - [5, 65.4293]
  - - [128, 3584, 1, 1792, 128, 128, 128, 1792]
    - [4, 0.0]
  - - [1024, 2368, 1, 3328, 1024, 1024, 1024, 3328]
    - [4, 0.0]
  - - [64, 5056, 1, 256, 64, 64, 64, 256]
    - [4, 0.0]
  - - [4, 256, 1, 3328, 4, 4, 4, 3328]
    - [7, 0.0]
  - - [1024, 4, 1, 1792, 1024, 1024, 1024, 1792]
    - [7, 0.0]
  - - [448, 3584, 1, 256, 448, 448, 448, 256]
    - [4, 0.0]
  - - [5056, 2368, 1, 768, 5056, 5056, 5056, 768]
    - [4, 0.0]
  - - [5888, 1024, 1, 256, 5888, 5888, 5888, 256]
    - [4, 0.0]
  - - [64, 4288, 1, 256, 64, 64, 64, 256]
    - [4, 0.0]
  - - [256, 1408, 1, 1792, 256, 256, 256, 1792]
    - [4, 0.0]
  - - [4, 4288, 1, 256, 4, 4, 4, 256]
    - [7, 0.0]
  - - [2944, 704, 1, 768, 2944, 2944, 2944, 768]
    - [4, 0.0]
  - - [128, 5888, 1, 768, 128, 128, 128, 768]
    - [4, 0.0]
  - - [5056, 704, 1, 768, 5056, 5056, 5056, 768]
    - [4, 0.0]
  - - [448, 128, 1, 768, 448, 448, 448, 768]
    - [4, 0.0]
  - - [5888, 64, 1, 128, 5888, 5888, 5888, 128]
    - [3, 1266.83]
  - - [5056, 5888, 1, 128, 5056, 5056, 5056, 128]
    - [2, 3513.74]
  - - [4288, 5056, 1, 256, 4288, 4288, 4288, 256]
    - [4, 0.0]
  - - [4288, 1856, 1, 256, 4288, 4288, 4288, 256]
    - [4, 0.0]
  - - [2944, 128, 1, 256, 2944, 2944, 2944, 256]
    - [4, 0.0]
  - - [1024, 3584, 1, 128, 1024, 1024, 1024, 128]
    - [2, 2859.19]
  - - [1856, 64, 1, 768, 1856, 1856, 1856, 768]
    - [4, 0.0]
  - - [6784, 5056, 1, 128, 6784, 6784, 6784, 128]
    - [2, 3501.87]
  - - [6784, 2368, 1, 128, 6784, 6784, 6784, 128]
    - [2, 3342.04]
  - - [1856, 1024, 1, 768, 1856, 1856, 1856, 768]
    - [4, 0.0]
  - - [1024, 6784, 1, 1792, 1024, 1024, 1024, 1792]
    - [4, 0.0]
  - - [4, 448, 1, 768, 4, 4, 4, 768]
    - [7, 0.0]
  - - [4288, 6784, 1, 256, 4288, 4288, 4288, 256]
    - [4, 0.0]
  - - [128, 3584, 1, 256, 128, 128, 128, 256]
    - [4, 0.0]
  - - [3584, 2368, 1, 3328, 3584, 3584, 3584, 3328]
    - [4, 0.0]
  - - [3584, 704, 1, 3328, 3584, 3584, 3584, 3328]
    - [4, 0.0]
  - - [4, 256, 1, 1792, 4, 4, 4, 1792]
    - [7, 0.0]
  - - [448, 3584, 1, 1792, 448, 448, 448, 1792]
    - [4, 0.0]
  - - [4, 6784, 1, 1792, 4, 4, 4, 1792]
    - [7, 0.0]
  - - [2368, 64, 1, 768, 2368, 2368, 2368, 768]
    - [4, 0.0]
  - - [448, 6784, 1, 1792, 448, 448, 448, 1792]
    - [4, 0.0]
  - - [1024, 1856, 1, 768, 1024, 1024, 1024, 768]
    - [4, 0.0]
  - - [5888, 1408, 1, 256, 5888, 5888, 5888, 256]
    - [4, 0.0]
  - - [1408, 6784, 1, 3328, 1408, 1408, 1408, 3328]
    - [4, 0.0]
  - - [2368, 2368, 1, 768, 2368, 2368, 2368, 768]
    - [4, 0.0]
  - - [704, 128, 1, 128, 704, 704, 704, 128]
    - [3, 399.257]
  - - [1024, 448, 1, 3328, 1024, 1024, 1024, 3328]
    - [4, 0.0]
  - - [5056, 4, 1, 128, 5056, 5056, 5056, 128]
    - [6, 100.134]
  - - [1408, 448, 1, 3328, 1408, 1408, 1408, 3328]
    - [4, 0.0]
  - - [3584, 1856, 1, 1792, 3584, 3584, 3584, 1792]
    - [4, 0.0]
  - - [3584, 1024, 1, 128, 3584, 3584, 3584, 128]
    - [2, 2890.46]
  - - [3584, 4, 1, 256, 3584, 3584, 3584, 256]
    - [7, 0.0]
  - - [6784, 1856, 1, 256, 6784, 6784, 6784, 256]
    - [4, 0.0]
  - - [1856, 3584, 1, 3328, 1856, 1856, 1856, 3328]
    - [4, 0.0]
  - - [4288, 1024, 1, 128, 4288, 4288, 4288, 128]
    - [3, 2967.29]
  - - [128, 448, 1, 768, 128, 128, 128, 768]
    - [4, 0.0]
  - - [128, 448, 1, 128, 128, 128, 128, 128]
    - [3, 267.085]
  - - [6784, 704, 1, 3328, 6784, 6784, 6784, 3328]
    - [4, 0.0]
  - - [5056, 3584, 1, 3328, 5056, 5056, 5056, 3328]
    - [4, 0.0]
  - - [4, 4288, 1, 3328, 4, 4, 4, 3328]
    - [7, 0.0]
  - - [2368, 256, 1, 3328, 2368, 2368, 2368, 3328]
    - [4, 0.0]
  - - [4, 2944, 1, 3328, 4, 4, 4, 3328]
    - [7, 0.0]
  - - [256, 5056, 1, 768, 256, 256, 256, 768]
    - [4, 0.0]
  - - [4288, 256, 1, 3328, 4288, 4288, 4288, 3328]
    - [4, 0.0]
  - - [1856, 1856, 1, 1792, 1856, 1856, 1856, 1792]
    - [4, 0.0]
  - - [1024, 5888, 1, 256, 1024, 1024, 1024, 256]
    - [4, 0.0]
  - - [5888, 4288, 1, 3328, 5888, 5888, 5888, 3328]
    - [4, 0.0]
  - - [4288, 3584, 1, 768, 4288, 4288, 4288, 768]
    - [4, 0.0]
  - - [4288, 5888, 1, 768, 4288, 4288, 4288, 768]
    - [4, 0.0]
  - - [2944, 4288, 1, 1792, 2944, 2944, 2944, 1792]
    - [4, 0.0]
  - - [128, 3584, 1, 768, 128, 128, 128, 768]
    - [4, 0.0]
  - - [704, 2368, 1, 768, 704, 704, 704, 768]
    - [4, 0.0]
  - - [448, 5888, 1, 3328, 448, 448, 448, 3328]
    - [4, 0.0]
  - - [128, 1024, 1, 256, 128, 128, 128, 256]
    - [4, 0.0]
  - - [64, 6784, 1, 3328, 64, 64, 64, 3328]
    - [4, 0.0]
  - - [4288, 6784, 1, 128, 4288, 4288, 4288, 128]
    - [2, 3503.85]
  - - [2944, 64, 1, 768, 2944, 2944, 2944, 768]
    - [4, 0.0]
  - - [704, 4288, 1, 768, 704, 704, 704, 768]
    - [4, 0.0]
  - - [1856, 128, 1, 256, 1856, 1856, 1856, 256]
    - [4, 0.0]
  - - [6784, 4288, 1, 128, 6784, 6784, 6784, 128]
    - [2, 3450.93]
  - - [1856, 128, 1, 128, 1856, 1856, 1856, 128]
    - [3, 998.808]
  - - [128, 1024, 1, 3328, 128, 128, 128, 3328]
    - [4, 0.0]
  - - [4, 1024, 1, 3328, 4, 4, 4, 3328]
    - [7, 0.0]
  - - [4288, 6784, 1, 1792, 4288, 4288, 4288, 1792]
    - [4, 0.0]
  - - [4, 4288, 1, 768, 4, 4, 4, 768]
    - [7, 0.0]
  - - [4, 128, 1, 256, 4, 4, 4, 256]
    - [7, 0.0]
  - - [128, 5056, 1, 128, 128, 128, 128, 128]
    - [3, 1542.47]
  - - [128, 5888, 1, 1792, 128, 128, 128, 1792]
    - [4, 0.0]
  - - [256, 1856, 1, 128, 256, 256, 256, 128]
    - [2, 1158.0]
  - - [256, 704, 1, 128, 256, 256, 256, 128]
    - [3, 661.192]
  - - [3584, 1024, 1, 3328, 3584, 3584, 3584, 3328]
    - [4, 0.0]
  - - [3584, 4, 1, 768, 3584, 3584, 3584, 768]
    - [7, 0.0]
  - - [6784, 2944, 1, 256, 6784, 6784, 6784, 256]
    - [4, 0.0]
  - - [704, 2944, 1, 128, 704, 704, 704, 128]
    - [0, 2591.43]
  - - [448, 6784, 1, 128, 448, 448, 448, 128]
    - [2, 2759.69]
  - - [4, 4, 1, 256, 4, 4, 4, 256]
    - [7, 0.0]
  - - [128, 128, 1, 1792, 128, 128, 128, 1792]
    - [4, 0.0]
  - - [5888, 3584, 1, 768, 5888, 5888, 5888, 768]
    - [4, 0.0]
  - - [4, 2368, 1, 768, 4, 4, 4, 768]
    - [7, 0.0]
  - - [3584, 5888, 1, 768, 3584, 3584, 3584, 768]
    - [4, 0.0]
  - - [1856, 1408, 1, 768, 1856, 1856, 1856, 768]
    - [4, 0.0]
  - - [4288, 1856, 1, 768, 4288, 4288, 4288, 768]
    - [4, 0.0]
  - - [1408, 1856, 1, 3328, 1408, 1408, 1408, 3328]
    - [4, 0.0]
  - - [1408, 2944, 1, 768, 1408, 1408, 1408, 768]
    - [4, 0.0]
  - - [4288, 64, 1, 768, 4288, 4288, 4288, 768]
    - [4, 0.0]
  - - [1024, 448, 1, 256, 1024, 1024, 1024, 256]
    - [4, 0.0]
  - - [3584, 5888, 1, 1792, 3584, 3584, 3584, 1792]
    - [4, 0.0]
  - - [5888, 704, 1, 3328, 5888, 5888, 5888, 3328]
    - [4, 0.0]
  - - [1408, 2944, 1, 3328, 1408, 1408, 1408, 3328]
    - [4, 0.0]
  - - [1408, 6784, 1, 1792, 1408, 1408, 1408, 1792]
    - [4, 0.0]
  - - [704, 4, 1, 128, 704, 704, 704, 128]
    - [6, 15.0184]
  - - [64, 64, 1, 128, 64, 64, 64, 128]
    - [3, 17.8281]
  - - [1856, 704, 1, 128, 1856, 1856, 1856, 128]
    - [3, 2364.19]
  - - [6784, 256, 1, 3328, 6784, 6784, 6784, 3328]
    - [4, 0.0]
  - - [128, 256, 1, 3328, 128, 128, 128, 3328]
    - [4, 0.0]
  - - [1024, 704, 1, 256, 1024, 1024, 1024, 256]
    - [4, 0.0]
  - - [128, 256, 1, 128, 128, 128, 128, 128]
    - [3, 143.712]
  - - [2944, 3584, 1, 768, 2944, 2944, 2944, 768]
    - [4, 0.0]
  - - [5888, 128, 1, 128, 5888, 5888, 5888, 128]
    - [3, 1695.73]
  - - [448, 6784, 1, 768, 448, 448, 448, 768]
    - [4, 0.0]
  - - [6784, 704, 1, 768, 6784, 6784, 6784, 768]
    - [4, 0.0]
  - - [5888, 6784, 1, 1792, 5888, 5888, 5888, 1792]
    - [4, 0.0]
  - - [5056, 1024, 1, 128, 5056, 5056, 5056, 128]
    - [2, 3072.22]
  - - [448, 64, 1, 1792, 448, 448, 448, 1792]
    - [4, 0.0]
  - - [6784, 5888, 1, 128, 6784, 6784, 6784, 128]
    - [2, 3506.88]
  - - [1024, 64, 1, 768, 1024, 1024, 1024, 768]
    - [4, 0.0]
  - - [3584, 6784, 1, 128, 3584, 3584, 3584, 128]
    - [2, 3465.61]
  - - [256, 6784, 1, 3328, 256, 256, 256, 3328]
    - [4, 0.0]
  - - [6784, 3584, 1, 1792, 6784, 6784, 6784, 1792]
    - [4, 0.0]
  - - [704, 1024, 1, 128, 704, 704, 704, 128]
    - [3, 1907.64]
  - - [2368, 4, 1, 3328, 2368, 2368, 2368, 3328]
    - [7, 0.0]
  - - [704, 5056, 1, 128, 704, 704, 704, 128]
    - [2, 2835.67]
  - - [2368, 4, 1, 1792, 2368, 2368, 2368, 1792]
    - [7, 0.0]
  - - [1856, 5056, 1, 768, 1856, 1856, 1856, 768]
    - [4, 0.0]
  - - [1856, 448, 1, 1792, 1856, 1856, 1856, 1792]
    - [4, 0.0]
  - - [128, 128, 1, 768, 128, 128, 128, 768]
    - [4, 0.0]
  - - [128, 4288, 1, 128, 128, 128, 128, 128]
    - [3, 1333.93]
  - - [1024, 3584, 1, 256, 1024, 1024, 1024, 256]
    - [4, 0.0]
  - - [5056, 5056, 1, 768, 5056, 5056, 5056, 768]
    - [4, 0.0]
  - - [64, 4, 1, 768, 64, 64, 64, 768]
    - [7, 0.0]
  - - [448, 5056, 1, 768, 448, 448, 448, 768]
    - [4, 0.0]
  - - [6784, 64, 1, 1792, 6784, 6784, 6784, 1792]
    - [4, 0.0]
  - - [64, 128, 1, 256, 64, 64, 64, 256]
    - [4, 0.0]
  - - [4288, 128, 1, 128, 4288, 4288, 4288, 128]
    - [3, 1491.23]
  - - [1856, 4288, 1, 256, 1856, 1856, 1856, 256]
    - [4, 0.0]
  - - [64, 1408, 1, 256, 64, 64, 64, 256]
    - [4, 0.0]
  - - [128, 3584, 1, 3328, 128, 128, 128, 3328]
    - [4, 0.0]
  - - [2944, 5888, 1, 1792, 2944, 2944, 2944, 1792]
    - [4, 0.0]
  - - [2944, 448, 1, 768, 2944, 2944, 2944, 768]
    - [4, 0.0]
  - - [64, 1856, 1, 128, 64, 64, 64, 128]
    - [3, 494.595]
  - - [256, 704, 1, 1792, 256, 256, 256, 1792]
    - [4, 0.0]
  - - [2368, 6784, 1, 1792, 2368, 2368, 2368, 1792]
    - [4, 0.0]
  - - [5888, 64, 1, 768, 5888, 5888, 5888, 768]
    - [4, 0.0]
  - - [64, 448, 1, 128, 64, 64, 64, 128]
    - [3, 128.687]
  - - [5888, 1024, 1, 768, 5888, 5888, 5888, 768]
    - [4, 0.0]
  - - [256, 128, 1, 1792, 256, 256, 256, 1792]
    - [4, 0.0]
  - - [704, 64, 1, 256, 704, 704, 704, 256]
    - [4, 0.0]
  - - [1856, 4288, 1, 768, 1856, 1856, 1856, 768]
    - [4, 0.0]
  - - [448, 1024, 1, 128, 448, 448, 448, 128]
    - [3, 1554.33]
  - - [4, 2368, 1, 128, 4, 4, 4, 128]
    - [5, 52.292]
  - - [448, 64, 1, 768, 448, 448, 448, 768]
    - [4, 0.0]
  - - [4288, 2368, 1, 256, 4288, 4288, 4288, 256]
    - [4, 0.0]
  - - [2944, 4, 1, 3328, 2944, 2944, 2944, 3328]
    - [7, 0.0]
  - - [3584, 1024, 1, 768, 3584, 3584, 3584, 768]
    - [4, 0.0]
  - - [128, 6784, 1, 768, 128, 128, 128, 768]
    - [4, 0.0]
  - - [448, 1856, 1, 768, 448, 448, 448, 768]
    - [4, 0.0]
  - - [1856, 2944, 1, 768, 1856, 1856, 1856, 768]
    - [4, 0.0]
  - - [1856, 704, 1, 768, 1856, 1856, 1856, 768]
    - [4, 0.0]
  - - [3584, 128, 1, 1792, 3584, 3584, 3584, 1792]
    - [4, 0.0]
  - - [1856, 5888, 1, 128, 1856, 1856, 1856, 128]
    - [2, 3336.89]
  - - [4288, 1024, 1, 768, 4288, 4288, 4288, 768]
    - [4, 0.0]
  - - [1024, 6784, 1, 3328, 1024, 1024, 1024, 3328]
    - [4, 0.0]
  - - [128, 128, 1, 256, 128, 128, 128, 256]
    - [4, 0.0]
  - - [4, 5888, 1, 3328, 4, 4, 4, 3328]
    - [7, 0.0]
  - - [1408, 5056, 1, 768, 1408, 1408, 1408, 768]
    - [4, 0.0]
  - - [448, 2944, 1, 3328, 448, 448, 448, 3328]
    - [4, 0.0]
  - - [256, 1024, 1, 3328, 256, 256, 256, 3328]
    - [4, 0.0]
  - - [64, 4, 1, 1792, 64, 64, 64, 1792]
    - [7, 0.0]
  - - [2368, 3584, 1, 1792, 2368, 2368, 2368, 1792]
    - [4, 0.0]
  - - [704, 64, 1, 3328, 704, 704, 704, 3328]
    - [4, 0.0]
  - - [3584, 5888, 1, 256, 3584, 3584, 3584, 256]
    - [4, 0.0]
  - - [704, 1024, 1, 1792, 704, 704, 704, 1792]
    - [4, 0.0]
  - - [4, 4288, 1, 128, 4, 4, 4, 128]
    - [6, 89.0038]
  - - [5888, 3584, 1, 128, 5888, 5888, 5888, 128]
    - [2, 3462.6]
  - - [5056, 5056, 1, 1792, 5056, 5056, 5056, 1792]
    - [4, 0.0]
  - - [1408, 2368, 1, 768, 1408, 1408, 1408, 768]
    - [4, 0.0]
  - - [448, 5888, 1, 1792, 448, 448, 448, 1792]
    - [4, 0.0]
  - - [2368, 256, 1, 1792, 2368, 2368, 2368, 1792]
    - [4, 0.0]
  - - [1856, 2368, 1, 256, 1856, 1856, 1856, 256]
    - [4, 0.0]
  - - [2944, 5888, 1, 128, 2944, 2944, 2944, 128]
    - [2, 3400.29]
  - - [2368, 448, 1, 1792, 2368, 2368, 2368, 1792]
    - [4, 0.0]
  - - [256, 64, 1, 3328, 256, 256, 256, 3328]
    - [4, 0.0]
  - - [5056, 4, 1, 768, 5056, 5056, 5056, 768]
    - [7, 0.0]
  - - [1408, 5056, 1, 256, 1408, 1408, 1408, 256]
    - [4, 0.0]
  - - [64, 1408, 1, 3328, 64, 64, 64, 3328]
    - [4, 0.0]
  - - [5888, 128, 1, 3328, 5888, 5888, 5888, 3328]
    - [4, 0.0]
  - - [64, 4288, 1, 3328, 64, 64, 64, 3328]
    - [4, 0.0]
  - - [704, 1856, 1, 256, 704, 704, 704, 256]
    - [4, 0.0]
  - - [2368, 3584, 1, 3328, 2368, 2368, 2368, 3328]
    - [4, 0.0]
  - - [1408, 704, 1, 256, 1408, 1408, 1408, 256]
    - [4, 0.0]
  - - [2944, 256, 1, 3328, 2944, 2944, 2944, 3328]
    - [4, 0.0]
  - - [1856, 448, 1, 768, 1856, 1856, 1856, 768]
    - [4, 0.0]
  - - [4288, 4288, 1, 128, 4288, 4288, 4288, 128]
    - [2, 3401.36]
  - - [1408, 64, 1, 1792, 1408, 1408, 1408, 1792]
    - [4, 0.0]
  - - [5056, 2368, 1, 3328, 5056, 5056, 5056, 3328]
    - [4, 0.0]
  - - [4, 64, 1, 3328, 4, 4, 4, 3328]
    - [7, 0.0]
  - - [448, 1856, 1, 256, 448, 448, 448, 256]
    - [4, 0.0]
  - - [64, 704, 1, 128, 64, 64, 64, 128]
    - [3, 207.613]
  - - [2944, 128, 1, 3328, 2944, 2944, 2944, 3328]
    - [4, 0.0]
  - - [3584, 2944, 1, 768, 3584, 3584, 3584, 768]
    - [4, 0.0]
  - - [4288, 1024, 1, 1792, 4288, 4288, 4288, 1792]
    - [4, 0.0]
  - - [2944, 5056, 1, 128, 2944, 2944, 2944, 128]
    - [2, 3386.96]
  - - [1024, 2368, 1, 128, 1024, 1024, 1024, 128]
    - [2, 2501.52]
  - - [4, 5888, 1, 1792, 4, 4, 4, 1792]
    - [7, 0.0]
  - - [3584, 128, 1, 3328, 3584, 3584, 3584, 3328]
    - [4, 0.0]
  - - [448, 2944, 1, 1792, 448, 448, 448, 1792]
    - [4, 0.0]
  - - [1408, 3584, 1, 1792, 1408, 1408, 1408, 1792]
    - [4, 0.0]
  - - [256, 2368, 1, 1792, 256, 256, 256, 1792]
    - [4, 0.0]
  - - [2944, 2944, 1, 1792, 2944, 2944, 2944, 1792]
    - [4, 0.0]
  - - [128, 704, 1, 3328, 128, 128, 128, 3328]
    - [4, 0.0]
  - - [1856, 128, 1, 3328, 1856, 1856, 1856, 3328]
    - [4, 0.0]
  - - [2368, 5056, 1, 128, 2368, 2368, 2368, 128]
    - [2, 3264.17]
  - - [3584, 3584, 1, 1792, 3584, 3584, 3584, 1792]
    - [4, 0.0]
  - - [5056, 1024, 1, 1792, 5056, 5056, 5056, 1792]
    - [4, 0.0]
  - - [256, 448, 1, 768, 256, 256, 256, 768]
    - [4, 0.0]
  - - [2944, 4288, 1, 768, 2944, 2944, 2944, 768]
    - [4, 0.0]
  - - [2368, 5888, 1, 128, 2368, 2368, 2368, 128]
    - [2, 3371.97]
  - - [64, 5888, 1, 768, 64, 64, 64, 768]
    - [4, 0.0]
  - - [5888, 5056, 1, 128, 5888, 5888, 5888, 128]
    - [2, 3495.12]
  - - [3584, 64, 1, 128, 3584, 3584, 3584, 128]
    - [3, 941.452]
  - - [2368, 704, 1, 1792, 2368, 2368, 2368, 1792]
    - [4, 0.0]
  - - [4288, 704, 1, 256, 4288, 4288, 4288, 256]
    - [4, 0.0]
  - - [4288, 64, 1, 1792, 4288, 4288, 4288, 1792]
    - [4, 0.0]
  - - [448, 3584, 1, 3328, 448, 448, 448, 3328]
    - [4, 0.0]
  - - [4, 2944, 1, 1792, 4, 4, 4, 1792]
    - [7, 0.0]
  - - [4, 1024, 1, 256, 4, 4, 4, 256]
    - [7, 0.0]
  - - [704, 128, 1, 256, 704, 704, 704, 256]
    - [4, 0.0]
  - - [704, 448, 1, 768, 704, 704, 704, 768]
    - [4, 0.0]
  - - [5056, 128, 1, 1792, 5056, 5056, 5056, 1792]
    - [4, 0.0]
  - - [4, 3584, 1, 128, 4, 4, 4, 128]
    - [5, 77.8998]
  - - [2368, 1856, 1, 1792, 2368, 2368, 2368, 1792]
    - [4, 0.0]
  - - [704, 2944, 1, 256, 704, 704, 704, 256]
    - [4, 0.0]
  - - [2368, 5056, 1, 3328, 2368, 2368, 2368, 3328]
    - [4, 0.0]
  - - [2944, 6784, 1, 3328, 2944, 2944, 2944, 3328]
    - [4, 0.0]
  - - [1408, 4288, 1, 128, 1408, 1408, 1408, 128]
    - [2, 3074.75]
  - - [1024, 1024, 1, 768, 1024, 1024, 1024, 768]
    - [4, 0.0]
  - - [128, 1856, 1, 256, 128, 128, 128, 256]
    - [4, 0.0]
  - - [64, 3584, 1, 768, 64, 64, 64, 768]
    - [4, 0.0]
  - - [128, 256, 1, 768, 128, 128, 128, 768]
    - [4, 0.0]
  - - [448, 2944, 1, 256, 448, 448, 448, 256]
    - [4, 0.0]
  - - [4288, 4, 1, 768, 4288, 4288, 4288, 768]
    - [7, 0.0]
  - - [2944, 128, 1, 768, 2944, 2944, 2944, 768]
    - [4, 0.0]
  - - [4288, 2368, 1, 3328, 4288, 4288, 4288, 3328]
    - [4, 0.0]
  - - [448, 448, 1, 128, 448, 448, 448, 128]
    - [3, 843.834]
  - - [5888, 1024, 1, 3328, 5888, 5888, 5888, 3328]
    - [4, 0.0]
  - - [6784, 256, 1, 256, 6784, 6784, 6784, 256]
    - [4, 0.0]
  - - [256, 2368, 1, 768, 256, 256, 256, 768]
    - [4, 0.0]
  - - [128, 704, 1, 1792, 128, 128, 128, 1792]
    - [4, 0.0]
  - - [2368, 1856, 1, 128, 2368, 2368, 2368, 128]
    - [3, 2920.94]
  - - [5888, 5056, 1, 3328, 5888, 5888, 5888, 3328]
    - [4, 0.0]
  - - [448, 704, 1, 256, 448, 448, 448, 256]
    - [4, 0.0]
  - - [1408, 6784, 1, 256, 1408, 1408, 1408, 256]
    - [4, 0.0]
  - - [256, 448, 1, 256, 256, 256, 256, 256]
    - [4, 0.0]
  - - [4, 256, 1, 768, 4, 4, 4, 768]
    - [7, 0.0]
  - - [6784, 64, 1, 128, 6784, 6784, 6784, 128]
    - [3, 1437.24]
  - - [64, 5888, 1, 128, 64, 64, 64, 128]
    - [3, 1150.45]
  - - [3584, 6784, 1, 768, 3584, 3584, 3584, 768]
    - [4, 0.0]
  - - [3584, 448, 1, 128, 3584, 3584, 3584, 128]
    - [2, 1976.12]
  - - [1856, 6784, 1, 256, 1856, 1856, 1856, 256]
    - [4, 0.0]
  - - [1856, 64, 1, 256, 1856, 1856, 1856, 256]
    - [4, 0.0]
  - - [1024, 5056, 1, 3328, 1024, 1024, 1024, 3328]
    - [4, 0.0]
  - - [128, 1024, 1, 128, 128, 128, 128, 128]
    - [3, 536.699]
  - - [2368, 6784, 1, 768, 2368, 2368, 2368, 768]
    - [4, 0.0]
  - - [2944, 256, 1, 768, 2944, 2944, 2944, 768]
    - [4, 0.0]
  - - [1024, 4288, 1, 256, 1024, 1024, 1024, 256]
    - [4, 0.0]
  - - [4288, 2944, 1, 1792, 4288, 4288, 4288, 1792]
    - [4, 0.0]
  - - [4, 64, 1, 768, 4, 4, 4, 768]
    - [7, 0.0]
  - - [2368, 5056, 1, 1792, 2368, 2368, 2368, 1792]
    - [4, 0.0]
  - - [2944, 4, 1, 256, 2944, 2944, 2944, 256]
    - [7, 0.0]
  - - [1408, 2944, 1, 256, 1408, 1408, 1408, 256]
    - [4, 0.0]
  - - [2368, 3584, 1, 256, 2368, 2368, 2368, 256]
    - [4, 0.0]
  - - [5888, 448, 1, 768, 5888, 5888, 5888, 768]
    - [4, 0.0]
  - - [4288, 448, 1, 768, 4288, 4288, 4288, 768]
    - [4, 0.0]
  - - [6784, 4, 1, 768, 6784, 6784, 6784, 768]
    - [7, 0.0]
  - - [6784, 3584, 1, 256, 6784, 6784, 6784, 256]
    - [4, 0.0]
  - - [704, 5056, 1, 1792, 704, 704, 704, 1792]
    - [4, 0.0]
  - - [2944, 1408, 1, 128, 2944, 2944, 2944, 128]
    - [2, 2934.33]
  - - [128, 1856, 1, 128, 128, 128, 128, 128]
    - [3, 879.029]
  - - [5888, 3584, 1, 3328, 5888, 5888, 5888, 3328]
    - [4, 0.0]
  - - [704, 6784, 1, 128, 704, 704, 704, 128]
    - [2, 2897.71]
  - - [5056, 4, 1, 256, 5056, 5056, 5056, 256]
    - [7, 0.0]
  - - [6784, 128, 1, 256, 6784, 6784, 6784, 256]
    - [4, 0.0]
  - - [2944, 128, 1, 1792, 2944, 2944, 2944, 1792]
    - [4, 0.0]
  - - [2368, 1024, 1, 1792, 2368, 2368, 2368, 1792]
    - [4, 0.0]
  - - [3584, 1408, 1, 256, 3584, 3584, 3584, 256]
    - [4, 0.0]
  - - [2368, 4288, 1, 3328, 2368, 2368, 2368, 3328]
    - [4, 0.0]
  - - [4288, 128, 1, 256, 4288, 4288, 4288, 256]
    - [4, 0.0]
  - - [1408, 704, 1, 768, 1408, 1408, 1408, 768]
    - [4, 0.0]
  - - [1408, 3584, 1, 768, 1408, 1408, 1408, 768]
    - [4, 0.0]
  - - [1024, 5888, 1, 3328, 1024, 1024, 1024, 3328]
    - [4, 0.0]
  - - [1856, 5056, 1, 3328, 1856, 1856, 1856, 3328]
    - [4, 0.0]
  - - [5056, 1408, 1, 3328, 5056, 5056, 5056, 3328]
    - [4, 0.0]
  - - [4288, 1024, 1, 256, 4288, 4288, 4288, 256]
    - [4, 0.0]
  - - [4288, 1856, 1, 128, 4288, 4288, 4288, 128]
    - [3, 3191.48]
  - - [704, 6784, 1, 1792, 704, 704, 704, 1792]
    - [4, 0.0]
  - - [5888, 2944, 1, 256, 5888, 5888, 5888, 256]
    - [4, 0.0]
  - - [1024, 64, 1, 128, 1024, 1024, 1024, 128]
    - [3, 293.38]
  - - [448, 5888, 1, 256, 448, 448, 448, 256]
    - [4, 0.0]
  - - [64, 4288, 1, 128, 64, 64, 64, 128]
    - [3, 836.344]
  - - [5888, 704, 1, 256, 5888, 5888, 5888, 256]
    - [4, 0.0]
  - - [1024, 704, 1, 1792, 1024, 1024, 1024, 1792]
    - [4, 0.0]
  - - [4288, 448, 1, 1792, 4288, 4288, 4288, 1792]
    - [4, 0.0]
  - - [704, 5888, 1, 768, 704, 704, 704, 768]
    - [4, 0.0]
  - - [1408, 128, 1, 256, 1408, 1408, 1408, 256]
    - [4, 0.0]
  - - [64, 4, 1, 256, 64, 64, 64, 256]
    - [7, 0.0]
  - - [1024, 5056, 1, 768, 1024, 1024, 1024, 768]
    - [4, 0.0]
  - - [1024, 3584, 1, 768, 1024, 1024, 1024, 768]
    - [4, 0.0]
  - - [2944, 1024, 1, 3328, 2944, 2944, 2944, 3328]
    - [4, 0.0]
  - - [704, 448, 1, 1792, 704, 704, 704, 1792]
    - [4, 0.0]
  - - [256, 4, 1, 1792, 256, 256, 256, 1792]
    - [7, 0.0]
  - - [1024, 1408, 1, 1792, 1024, 1024, 1024, 1792]
    - [4, 0.0]
  - - [6784, 2368, 1, 1792, 6784, 6784, 6784, 1792]
    - [4, 0.0]
  - - [3584, 4288, 1, 1792, 3584, 3584, 3584, 1792]
    - [4, 0.0]
  - - [1856, 64, 1, 3328, 1856, 1856, 1856, 3328]
    - [4, 0.0]
  - - [6784, 448, 1, 1792, 6784, 6784, 6784, 1792]
    - [4, 0.0]
  - - [5056, 448, 1, 3328, 5056, 5056, 5056, 3328]
    - [4, 0.0]
  - - [128, 6784, 1, 128, 128, 128, 128, 128]
    - [3, 1632.74]
  - - [6784, 448, 1, 3328, 6784, 6784, 6784, 3328]
    - [4, 0.0]
  - - [4, 2368, 1, 1792, 4, 4, 4, 1792]
    - [7, 0.0]
  - - [2944, 5056, 1, 768, 2944, 2944, 2944, 768]
    - [4, 0.0]
  - - [128, 1856, 1, 3328, 128, 128, 128, 3328]
    - [4, 0.0]
  - - [3584, 2944, 1, 3328, 3584, 3584, 3584, 3328]
    - [4, 0.0]
  - - [64, 256, 1, 3328, 64, 64, 64, 3328]
    - [4, 0.0]
  - - [6784, 4288, 1, 1792, 6784, 6784, 6784, 1792]
    - [4, 0.0]
  - - [5888, 704, 1, 1792, 5888, 5888, 5888, 1792]
    - [4, 0.0]
  - - [2944, 128, 1, 128, 2944, 2944, 2944, 128]
    - [3, 1331.6]
  - - [4, 128, 1, 768, 4, 4, 4, 768]
    - [7, 0.0]
  - - [1408, 5056, 1, 3328, 1408, 1408, 1408, 3328]
    - [4, 0.0]
  - - [5888, 2368, 1, 256, 5888, 5888, 5888, 256]
    - [4, 0.0]
  - - [64, 256, 1, 128, 64, 64, 64, 128]
    - [3, 72.0386]
  - - [64, 128, 1, 1792, 64, 64, 64, 1792]
    - [4, 0.0]
  - - [448, 704, 1, 3328, 448, 448, 448, 3328]
    - [4, 0.0]
  - - [704, 256, 1, 3328, 704, 704, 704, 3328]
    - [4, 0.0]
  - - [4, 5056, 1, 768, 4, 4, 4, 768]
    - [7, 0.0]
  - - [704, 6784, 1, 768, 704, 704, 704, 768]
    - [4, 0.0]
  - - [2368, 704, 1, 256, 2368, 2368, 2368, 256]
    - [4, 0.0]
  - - [3584, 64, 1, 256, 3584, 3584, 3584, 256]
    - [4, 0.0]
  - - [1856, 4, 1, 768, 1856, 1856, 1856, 768]
    - [7, 0.0]
  - - [1408, 4288, 1, 1792, 1408, 1408, 1408, 1792]
    - [4, 0.0]
  - - [1408, 5888, 1, 1792, 1408, 1408, 1408, 1792]
    - [4, 0.0]
  - - [704, 4, 1, 1792, 704, 704, 704, 1792]
    - [7, 0.0]
  - - [256, 64, 1, 256, 256, 256, 256, 256]
    - [4, 0.0]
  - - [5056, 1856, 1, 768, 5056, 5056, 5056, 768]
    - [4, 0.0]
  - - [1856, 5888, 1, 768, 1856, 1856, 1856, 768]
    - [4, 0.0]
  - - [2944, 5056, 1, 3328, 2944, 2944, 2944, 3328]
    - [4, 0.0]
  - - [704, 128, 1, 3328, 704, 704, 704, 3328]
    - [4, 0.0]
  - - [1856, 704, 1, 256, 1856, 1856, 1856, 256]
    - [4, 0.0]
  - - [1408, 1024, 1, 256, 1408, 1408, 1408, 256]
    - [4, 0.0]
  - - [64, 1024, 1, 256, 64, 64, 64, 256]
    - [4, 0.0]
  - - [5888, 448, 1, 128, 5888, 5888, 5888, 128]
    - [2, 2442.7]
  - - [4, 3584, 1, 3328, 4, 4, 4, 3328]
    - [7, 0.0]
  - - [1024, 704, 1, 768, 1024, 1024, 1024, 768]
    - [4, 0.0]
  - - [6784, 6784, 1, 3328, 6784, 6784, 6784, 3328]
    - [4, 0.0]
  - - [3584, 256, 1, 256, 3584, 3584, 3584, 256]
    - [4, 0.0]
  - - [448, 1856, 1, 3328, 448, 448, 448, 3328]
    - [4, 0.0]
  - - [1408, 64, 1, 128, 1408, 1408, 1408, 128]
    - [3, 379.781]
  - - [448, 448, 1, 3328, 448, 448, 448, 3328]
    - [4, 0.0]
  - - [2368, 64, 1, 128, 2368, 2368, 2368, 128]
    - [3, 641.851]
  - - [2944, 1856, 1, 128, 2944, 2944, 2944, 128]
    - [2, 3012.68]
  - - [256, 4288, 1, 128, 256, 256, 256, 128]
    - [2, 1711.95]
  - - [5056, 6784, 1, 768, 5056, 5056, 5056, 768]
    - [4, 0.0]
  - - [704, 2944, 1, 3328, 704, 704, 704, 3328]
    - [4, 0.0]
  - - [4, 5056, 1, 1792, 4, 4, 4, 1792]
    - [7, 0.0]
  - - [64, 128, 1, 768, 64, 64, 64, 768]
    - [4, 0.0]
  - - [4, 6784, 1, 256, 4, 4, 4, 256]
    - [7, 0.0]
  - - [128, 2368, 1, 128, 128, 128, 128, 128]
    - [3, 945.411]
  - - [64, 6784, 1, 256, 64, 64, 64, 256]
    - [4, 0.0]
  - - [4, 448, 1, 1792, 4, 4, 4, 1792]
    - [7, 0.0]
  - - [3584, 448, 1, 3328, 3584, 3584, 3584, 3328]
    - [4, 0.0]
  - - [2944, 1024, 1, 1792, 2944, 2944, 2944, 1792]
    - [4, 0.0]
  - - [2944, 2944, 1, 768, 2944, 2944, 2944, 768]
    - [4, 0.0]
  - - [4288, 5056, 1, 768, 4288, 4288, 4288, 768]
    - [4, 0.0]
  - - [4, 1024, 1, 1792, 4, 4, 4, 1792]
    - [7, 0.0]
  - - [2368, 1024, 1, 3328, 2368, 2368, 2368, 3328]
    - [4, 0.0]
  - - [3584, 256, 1, 128, 3584, 3584, 3584, 128]
    - [1, 1779.37]
  - - [6784, 256, 1, 1792, 6784, 6784, 6784, 1792]
    - [4, 0.0]
  - - [4288, 5888, 1, 128, 4288, 4288, 4288, 128]
    - [2, 3468.82]
  - - [2368, 5888, 1, 768, 2368, 2368, 2368, 768]
    - [4, 0.0]
  - - [4, 1408, 1, 128, 4, 4, 4, 128]
    - [5, 31.7003]
  - - [448, 1408, 1, 128, 448, 448, 448, 128]
    - [3, 1735.62]
  - - [2368, 2944, 1, 768, 2368, 2368, 2368, 768]
    - [4, 0.0]
  - - [256, 1408, 1, 768, 256, 256, 256, 768]
    - [4, 0.0]
  - - [1856, 3584, 1, 256, 1856, 1856, 1856, 256]
    - [4, 0.0]
  - - [2368, 2368, 1, 256, 2368, 2368, 2368, 256]
    - [4, 0.0]
  - - [128, 704, 1, 768, 128, 128, 128, 768]
    - [4, 0.0]
  - - [1856, 1408, 1, 3328, 1856, 1856, 1856, 3328]
    - [4, 0.0]
  - - [1856, 6784, 1, 768, 1856, 1856, 1856, 768]
    - [4, 0.0]
  - - [4288, 3584, 1, 1792, 4288, 4288, 4288, 1792]
    - [4, 0.0]
  - - [2368, 128, 1, 256, 2368, 2368, 2368, 256]
    - [4, 0.0]
  - - [5056, 6784, 1, 1792, 5056, 5056, 5056, 1792]
    - [4, 0.0]
  - - [6784, 1024, 1, 3328, 6784, 6784, 6784, 3328]
    - [4, 0.0]
  - - [1408, 256, 1, 768, 1408, 1408, 1408, 768]
    - [4, 0.0]
  - - [64, 2944, 1, 256, 64, 64, 64, 256]
    - [4, 0.0]
  - - [1408, 4, 1, 256, 1408, 1408, 1408, 256]
    - [7, 0.0]
  - - [256, 1856, 1, 3328, 256, 256, 256, 3328]
    - [4, 0.0]
  - - [1024, 2944, 1, 1792, 1024, 1024, 1024, 1792]
    - [4, 0.0]
  - - [2368, 4, 1, 256, 2368, 2368, 2368, 256]
    - [7, 0.0]
  - - [128, 1024, 1, 768, 128, 128, 128, 768]
    - [4, 0.0]
  - - [704, 5888, 1, 128, 704, 704, 704, 128]
    - [2, 2931.93]
  - - [4288, 1408, 1, 1792, 4288, 4288, 4288, 1792]
    - [4, 0.0]
  - - [5888, 64, 1, 1792, 5888, 5888, 5888, 1792]
    - [4, 0.0]
  - - [1856, 448, 1, 3328, 1856, 1856, 1856, 3328]
    - [4, 0.0]
  - - [5056, 3584, 1, 768, 5056, 5056, 5056, 768]
    - [4, 0.0]
  - - [3584, 6784, 1, 3328, 3584, 3584, 3584, 3328]
    - [4, 0.0]
  - - [448, 2368, 1, 128, 448, 448, 448, 128]
    - [3, 2043.64]
  - - [1024, 64, 1, 256, 1024, 1024, 1024, 256]
    - [4, 0.0]
  - - [704, 128, 1, 768, 704, 704, 704, 768]
    - [4, 0.0]
  - - [704, 128, 1, 1792, 704, 704, 704, 1792]
    - [4, 0.0]
  - - [448, 5056, 1, 1792, 448, 448, 448, 1792]
    - [4, 0.0]
  - - [4, 448, 1, 256, 4, 4, 4, 256]
    - [7, 0.0]
  - - [5888, 1856, 1, 1792, 5888, 5888, 5888, 1792]
    - [4, 0.0]
  - - [3584, 64, 1, 1792, 3584, 3584, 3584, 1792]
    - [4, 0.0]
  - - [6784, 1856, 1, 768, 6784, 6784, 6784, 768]
    - [4, 0.0]
  - - [64, 64, 1, 768, 64, 64, 64, 768]
    - [4, 0.0]
  - - [1024, 1024, 1, 256, 1024, 1024, 1024, 256]
    - [4, 0.0]
  - - [1408, 2368, 1, 256, 1408, 1408, 1408, 256]
    - [4, 0.0]
  - - [3584, 2368, 1, 256, 3584, 3584, 3584, 256]
    - [4, 0.0]
  - - [5056, 5888, 1, 256, 5056, 5056, 5056, 256]
    - [4, 0.0]
  - - [5888, 5056, 1, 1792, 5888, 5888, 5888, 1792]
    - [4, 0.0]
  - - [704, 3584, 1, 768, 704, 704, 704, 768]
    - [4, 0.0]
  - - [2368, 1856, 1, 256, 2368, 2368, 2368, 256]
    - [4, 0.0]
  - - [6784, 128, 1, 1792, 6784, 6784, 6784, 1792]
    - [4, 0.0]
  - - [704, 1024, 1, 3328, 704, 704, 704, 3328]
    - [4, 0.0]
  - - [2944, 704, 1, 128, 2944, 2944, 2944, 128]
    - [3, 2550.81]
  - - [704, 6784, 1, 3328, 704, 704, 704, 3328]
    - [4, 0.0]
  - - [5056, 1408, 1, 128, 5056, 5056, 5056, 128]
    - [2, 3162.25]
  - - [5888, 5888, 1, 1792, 5888, 5888, 5888, 1792]
    - [4, 0.0]
  - - [6784, 1408, 1, 256, 6784, 6784, 6784, 256]
    - [4, 0.0]
  - - [6784, 5888, 1, 1792, 6784, 6784, 6784, 1792]
    - [4, 0.0]
  - - [128, 6784, 1, 3328, 128, 128, 128, 3328]
    - [4, 0.0]
  - - [448, 256, 1, 3328, 448, 448, 448, 3328]
    - [4, 0.0]
  - - [1856, 1856, 1, 128, 1856, 1856, 1856, 128]
    - [3, 2777.6]
  - - [5888, 256, 1, 1792, 5888, 5888, 5888, 1792]
    - [4, 0.0]
  - - [1024, 4288, 1, 768, 1024, 1024, 1024, 768]
    - [4, 0.0]
  - - [2944, 6784, 1, 128, 2944, 2944, 2944, 128]
    - [2, 3421.69]
  - - [5888, 704, 1, 768, 5888, 5888, 5888, 768]
    - [4, 0.0]
  - - [1408, 256, 1, 3328, 1408, 1408, 1408, 3328]
    - [4, 0.0]
  - - [1408, 128, 1, 1792, 1408, 1408, 1408, 1792]
    - [4, 0.0]
  - - [704, 256, 1, 256, 704, 704, 704, 256]
    - [4, 0.0]
  - - [1408, 3584, 1, 3328, 1408, 1408, 1408, 3328]
    - [4, 0.0]
  - - [128, 1408, 1, 768, 128, 128, 128, 768]
    - [4, 0.0]
  - - [4288, 5888, 1, 3328, 4288, 4288, 4288, 3328]
    - [4, 0.0]
  - - [64, 4288, 1, 768, 64, 64, 64, 768]
    - [4, 0.0]
  - - [256, 2944, 1, 1792, 256, 256, 256, 1792]
    - [4, 0.0]
  - - [3584, 256, 1, 3328, 3584, 3584, 3584, 3328]
    - [4, 0.0]
  - - [6784, 1408, 1, 3328, 6784, 6784, 6784, 3328]
    - [4, 0.0]
  - - [448, 4288, 1, 1792, 448, 448, 448, 1792]
    - [4, 0.0]
  - - [1408, 1856, 1, 1792, 1408, 1408, 1408, 1792]
    - [4, 0.0]
  - - [704, 3584, 1, 3328, 704, 704, 704, 3328]
    - [4, 0.0]
  - - [1856, 1408, 1, 256, 1856, 1856, 1856, 256]
    - [4, 0.0]
  - - [2368, 4288, 1, 128, 2368, 2368, 2368, 128]
    - [2, 3249.22]
  - - [3584, 5056, 1, 3328, 3584, 3584, 3584, 3328]
    - [4, 0.0]
  - - [704, 1856, 1, 128, 704, 704, 704, 128]
    - [3, 2342.13]
  - - [5888, 1856, 1, 256, 5888, 5888, 5888, 256]
    - [4, 0.0]
  - - [5888, 4288, 1, 768, 5888, 5888, 5888, 768]
    - [4, 0.0]
  - - [1408, 256, 1, 128, 1408, 1408, 1408, 128]
    - [3, 1268.52]
  - - [1024, 448, 1, 1792, 1024, 1024, 1024, 1792]
    - [4, 0.0]
  - - [448, 704, 1, 128, 448, 448, 448, 128]
    - [3, 1142.53]
  - - [128, 4, 1, 256, 128, 128, 128, 256]
    - [7, 0.0]
  - - [1408, 6784, 1, 128, 1408, 1408, 1408, 128]
    - [2, 3222.44]
  - - [1408, 4, 1, 768, 1408, 1408, 1408, 768]
    - [7, 0.0]
  - - [704, 1856, 1, 1792, 704, 704, 704, 1792]
    - [4, 0.0]
  - - [256, 3584, 1, 128, 256, 256, 256, 128]
    - [2, 1777.38]
  - - [1856, 704, 1, 3328, 1856, 1856, 1856, 3328]
    - [4, 0.0]
  - - [2368, 2944, 1, 3328, 2368, 2368, 2368, 3328]
    - [4, 0.0]
  - - [6784, 704, 1, 128, 6784, 6784, 6784, 128]
    - [2, 2855.59]
  - - [64, 5056, 1, 1792, 64, 64, 64, 1792]
    - [4, 0.0]
  - - [5056, 2944, 1, 768, 5056, 5056, 5056, 768]
    - [4, 0.0]
  - - [5888, 2368, 1, 128, 5888, 5888, 5888, 128]
    - [2, 3304.44]
  - - [4288, 1856, 1, 1792, 4288, 4288, 4288, 1792]
    - [4, 0.0]
  - - [5056, 128, 1, 768, 5056, 5056, 5056, 768]
    - [4, 0.0]
  - - [1856, 64, 1, 128, 1856, 1856, 1856, 128]
    - [3, 498.193]
  - - [2368, 2368, 1, 1792, 2368, 2368, 2368, 1792]
    - [4, 0.0]
  - - [4288, 4, 1, 3328, 4288, 4288, 4288, 3328]
    - [7, 0.0]
  - - [704, 448, 1, 256, 704, 704, 704, 256]
    - [4, 0.0]
  - - [4, 1408, 1, 1792, 4, 4, 4, 1792]
    - [7, 0.0]
  - - [3584, 448, 1, 768, 3584, 3584, 3584, 768]
    - [4, 0.0]
  - - [1856, 1856, 1, 256, 1856, 1856, 1856, 256]
    - [4, 0.0]
  - - [5056, 4, 1, 3328, 5056, 5056, 5056, 3328]
    - [7, 0.0]
  - - [2368, 2944, 1, 128, 2368, 2368, 2368, 128]
    - [2, 3124.06]
  - - [3584, 448, 1, 1792, 3584, 3584, 3584, 1792]
    - [4, 0.0]
  - - [3584, 6784, 1, 256, 3584, 3584, 3584, 256]
    - [4, 0.0]
  - - [128, 448, 1, 3328, 128, 128, 128, 3328]
    - [4, 0.0]
  - - [4288, 2944, 1, 3328, 4288, 4288, 4288, 3328]
    - [4, 0.0]
  - - [3584, 4, 1, 1792, 3584, 3584, 3584, 1792]
    - [7, 0.0]
  - - [5056, 2944, 1, 256, 5056, 5056, 5056, 256]
    - [4, 0.0]
  - - [64, 1024, 1, 768, 64, 64, 64, 768]
    - [4, 0.0]
  - - [64, 6784, 1, 1792, 64, 64, 64, 1792]
    - [4, 0.0]
  - - [1408, 64, 1, 3328, 1408, 1408, 1408, 3328]
    - [4, 0.0]
  - - [3584, 64, 1, 768, 3584, 3584, 3584, 768]
    - [4, 0.0]
  - - [704, 1408, 1, 128, 704, 704, 704, 128]
    - [0, 2138.35]
  - - [5888, 256, 1, 256, 5888, 5888, 5888, 256]
    - [4, 0.0]
  - - [448, 5056, 1, 256, 448, 448, 448, 256]
    - [4, 0.0]
  - - [2368, 6784, 1, 3328, 2368, 2368, 2368, 3328]
    - [4, 0.0]
  - - [4288, 256, 1, 256, 4288, 4288, 4288, 256]
    - [4, 0.0]
  - - [6784, 5888, 1, 256, 6784, 6784, 6784, 256]
    - [4, 0.0]
  - - [64, 1856, 1, 768, 64, 64, 64, 768]
    - [4, 0.0]
  - - [6784, 64, 1, 3328, 6784, 6784, 6784, 3328]
    - [4, 0.0]
  - - [256, 6784, 1, 128, 256, 256, 256, 128]
    - [2, 2126.84]
  - - [2944, 448, 1, 1792, 2944, 2944, 2944, 1792]
    - [4, 0.0]
  - - [1408, 4, 1, 1792, 1408, 1408, 1408, 1792]
    - [7, 0.0]
  - - [64, 704, 1, 256, 64, 64, 64, 256]
    - [4, 0.0]
  - - [5888, 128, 1, 256, 5888, 5888, 5888, 256]
    - [4, 0.0]
  - - [1024, 448, 1, 128, 1024, 1024, 1024, 128]
    - [3, 1186.69]
  - - [3584, 256, 1, 768, 3584, 3584, 3584, 768]
    - [4, 0.0]
  - - [256, 1856, 1, 256, 256, 256, 256, 256]
    - [4, 0.0]
  - - [1024, 128, 1, 1792, 1024, 1024, 1024, 1792]
    - [4, 0.0]
  - - [4288, 6784, 1, 768, 4288, 4288, 4288, 768]
    - [4, 0.0]
  - - [4, 704, 1, 3328, 4, 4, 4, 3328]
    - [7, 0.0]
  - - [256, 1024, 1, 1792, 256, 256, 256, 1792]
    - [4, 0.0]
  - - [4288, 4, 1, 128, 4288, 4288, 4288, 128]
    - [5, 87.6867]
  - - [704, 3584, 1, 128, 704, 704, 704, 128]
    - [3, 2620.13]
  - - [2368, 128, 1, 1792, 2368, 2368, 2368, 1792]
    - [4, 0.0]
  - - [704, 2944, 1, 1792, 704, 704, 704, 1792]
    - [4, 0.0]
  - - [6784, 704, 1, 256, 6784, 6784, 6784, 256]
    - [4, 0.0]
  - - [2944, 2368, 1, 128, 2944, 2944, 2944, 128]
    - [2, 3102.33]
  - - [1408, 2944, 1, 1792, 1408, 1408, 1408, 1792]
    - [4, 0.0]
  - - [5888, 6784, 1, 256, 5888, 5888, 5888, 256]
    - [4, 0.0]
  - - [64, 4, 1, 3328, 64, 64, 64, 3328]
    - [7, 0.0]
  - - [5888, 704, 1, 128, 5888, 5888, 5888, 128]
    - [2, 2728.64]
  - - [448, 64, 1, 128, 448, 448, 448, 128]
    - [3, 129.024]
  - - [256, 3584, 1, 256, 256, 256, 256, 256]
    - [4, 0.0]
  - - [1856, 704, 1, 1792, 1856, 1856, 1856, 1792]
    - [4, 0.0]
  - - [128, 1408, 1, 1792, 128, 128, 128, 1792]
    - [4, 0.0]
  - - [1856, 4, 1, 256, 1856, 1856, 1856, 256]
    - [7, 0.0]
  - - [2944, 448, 1, 128, 2944, 2944, 2944, 128]
    - [3, 2187.18]
  - - [3584, 5888, 1, 3328, 3584, 3584, 3584, 3328]
    - [4, 0.0]
  - - [6784, 256, 1, 128, 6784, 6784, 6784, 128]
    - [3, 2329.95]
  - - [5056, 64, 1, 256, 5056, 5056, 5056, 256]
    - [4, 0.0]
  - - [1856, 2368, 1, 1792, 1856, 1856, 1856, 1792]
    - [4, 0.0]
  - - [2944, 5888, 1, 768, 2944, 2944, 2944, 768]
    - [4, 0.0]
  - - [256, 5056, 1, 3328, 256, 256, 256, 3328]
    - [4, 0.0]
  - - [3584, 5056, 1, 256, 3584, 3584, 3584, 256]
    - [4, 0.0]
  - - [1856, 4288, 1, 128, 1856, 1856, 1856, 128]
    - [2, 3151.98]
  - - [2944, 1856, 1, 1792, 2944, 2944, 2944, 1792]
    - [4, 0.0]
  - - [6784, 704, 1, 1792, 6784, 6784, 6784, 1792]
    - [4, 0.0]
  - - [1408, 5056, 1, 128, 1408, 1408, 1408, 128]
    - [2, 3167.95]
  - - [128, 5888, 1, 3328, 128, 128, 128, 3328]
    - [4, 0.0]
  - - [704, 4288, 1, 128, 704, 704, 704, 128]
    - [3, 2702.76]
  - - [5888, 5888, 1, 3328, 5888, 5888, 5888, 3328]
    - [4, 0.0]
  - - [4, 448, 1, 3328, 4, 4, 4, 3328]
    - [7, 0.0]
  - - [704, 5056, 1, 256, 704, 704, 704, 256]
    - [4, 0.0]
  - - [704, 1856, 1, 768, 704, 704, 704, 768]
    - [4, 0.0]
  - - [128, 4, 1, 1792, 128, 128, 128, 1792]
    - [7, 0.0]
  - - [1024, 1024, 1, 128, 1024, 1024, 1024, 128]
    - [2, 2006.54]
  - - [6784, 2944, 1, 768, 6784, 6784, 6784, 768]
    - [4, 0.0]
  - - [2368, 1024, 1, 256, 2368, 2368, 2368, 256]
    - [4, 0.0]
  - - [1856, 256, 1, 128, 1856, 1856, 1856, 128]
    - [3, 1594.23]
  - - [4288, 5056, 1, 128, 4288, 4288, 4288, 128]
    - [2, 3442.62]
  - - [1856, 64, 1, 1792, 1856, 1856, 1856, 1792]
    - [4, 0.0]
  - - [1856, 1408, 1, 128, 1856, 1856, 1856, 128]
    - [3, 2679.89]
  - - [256, 5056, 1, 128, 256, 256, 256, 128]
    - [2, 2024.04]
  - - [3584, 128, 1, 768, 3584, 3584, 3584, 768]
    - [4, 0.0]
  - - [128, 4, 1, 128, 128, 128, 128, 128]
    - [6, 2.96886]
  - - [704, 2368, 1, 1792, 704, 704, 704, 1792]
    - [4, 0.0]
  - - [6784, 1408, 1, 1792, 6784, 6784, 6784, 1792]
    - [4, 0.0]
  - - [2368, 1408, 1, 1792, 2368, 2368, 2368, 1792]
    - [4, 0.0]
  - - [1856, 4288, 1, 1792, 1856, 1856, 1856, 1792]
    - [4, 0.0]
  - - [5056, 4288, 1, 3328, 5056, 5056, 5056, 3328]
    - [4, 0.0]
  - - [4288, 1856, 1, 3328, 4288, 4288, 4288, 3328]
    - [4, 0.0]
  - - [448, 2368, 1, 1792, 448, 448, 448, 1792]
    - [4, 0.0]
  - - [5056, 704, 1, 1792, 5056, 5056, 5056, 1792]
    - [4, 0.0]
  - - [3584, 6784, 1, 1792, 3584, 3584, 3584, 1792]
    - [4, 0.0]
  - - [448, 1024, 1, 3328, 448, 448, 448, 3328]
    - [4, 0.0]
  - - [128, 448, 1, 256, 128, 128, 128, 256]
    - [4, 0.0]
  - - [5056, 448, 1, 1792, 5056, 5056, 5056, 1792]
    - [4, 0.0]
  - - [4288, 2944, 1, 128, 4288, 4288, 4288, 128]
    - [2, 3315.65]
  - - [1408, 1408, 1, 1792, 1408, 1408, 1408, 1792]
    - [4, 0.0]
  - - [128, 5888, 1, 128, 128, 128, 128, 128]
    - [3, 1722.63]
  - - [64, 6784, 1, 768, 64, 64, 64, 768]
    - [4, 0.0]
  - - [5888, 448, 1, 1792, 5888, 5888, 5888, 1792]
    - [4, 0.0]
  - - [3584, 2368, 1, 128, 3584, 3584, 3584, 128]
    - [2, 3166.05]
  - - [5056, 704, 1, 256, 5056, 5056, 5056, 256]
    - [4, 0.0]
  - - [6784, 1024, 1, 1792, 6784, 6784, 6784, 1792]
    - [4, 0.0]
  - - [2944, 3584, 1, 128, 2944, 2944, 2944, 128]
    - [2, 3252.87]
  - - [128, 2368, 1, 256, 128, 128, 128, 256]
    - [4, 0.0]
  - - [2368, 256, 1, 256, 2368, 2368, 2368, 256]
    - [4, 0.0]
  - - [256, 448, 1, 128, 256, 256, 256, 128]
    - [3, 459.808]
  - - [1856, 5888, 1, 3328, 1856, 1856, 1856, 3328]
    - [4, 0.0]
  - - [256, 256, 1, 1792, 256, 256, 256, 1792]
    - [4, 0.0]
  - - [5888, 6784, 1, 128, 5888, 5888, 5888, 128]
    - [2, 3550.53]
  - - [6784, 3584, 1, 3328, 6784, 6784, 6784, 3328]
    - [4, 0.0]
  - - [1408, 448, 1, 768, 1408, 1408, 1408, 768]
    - [4, 0.0]
  - - [64, 128, 1, 128, 64, 64, 64, 128]
    - [3, 35.3884]
  - - [5888, 64, 1, 3328, 5888, 5888, 5888, 3328]
    - [4, 0.0]
  - - [2944, 1408, 1, 3328, 2944, 2944, 2944, 3328]
    - [4, 0.0]
  - - [2368, 6784, 1, 256, 2368, 2368, 2368, 256]
    - [4, 0.0]
  - - [2368, 448, 1, 3328, 2368, 2368, 2368, 3328]
    - [4, 0.0]
  - - [704, 704, 1, 256, 704, 704, 704, 256]
    - [4, 0.0]
  - - [5888, 128, 1, 768, 5888, 5888, 5888, 768]
    - [4, 0.0]
  - - [2368, 64, 1, 1792, 2368, 2368, 2368, 1792]
    - [4, 0.0]
  - - [256, 1024, 1, 768, 256, 256, 256, 768]
    - [4, 0.0]
  - - [6784, 4, 1, 3328, 6784, 6784, 6784, 3328]
    - [7, 0.0]
  - - [1024, 1856, 1, 256, 1024, 1024, 1024, 256]
    - [4, 0.0]
  - - [128, 2944, 1, 768, 128, 128, 128, 768]
    - [4, 0.0]
  - - [1856, 3584, 1, 768, 1856, 1856, 1856, 768]
    - [4, 0.0]
  - - [64, 2368, 1, 128, 64, 64, 64, 128]
    - [3, 631.025]
  - - [5888, 256, 1, 768, 5888, 5888, 5888, 768]
    - [4, 0.0]
  - - [4, 5056, 1, 128, 4, 4, 4, 128]
    - [6, 98.1636]
  - - [448, 256, 1, 128, 448, 448, 448, 128]
    - [3, 501.72]
  - - [2944, 6784, 1, 768, 2944, 2944, 2944, 768]
    - [4, 0.0]
  - - [128, 448, 1, 1792, 128, 128, 128, 1792]
    - [4, 0.0]
  - - [128, 3584, 1, 128, 128, 128, 128, 128]
    - [3, 1303.79]
  - - [1408, 4, 1, 3328, 1408, 1408, 1408, 3328]
    - [7, 0.0]
  - - [2368, 704, 1, 768, 2368, 2368, 2368, 768]
    - [4, 0.0]
  - - [1024, 4, 1, 768, 1024, 1024, 1024, 768]
    - [7, 0.0]
  - - [256, 2944, 1, 128, 256, 256, 256, 128]
    - [2, 1466.56]
  - - [1024, 1856, 1, 128, 1024, 1024, 1024, 128]
    - [2, 2229.52]
  - - [1024, 256, 1, 768, 1024, 1024, 1024, 768]
    - [4, 0.0]
  - - [6784, 4, 1, 1792, 6784, 6784, 6784, 1792]
    - [7, 0.0]
  - - [64, 3584, 1, 3328, 64, 64, 64, 3328]
    - [4, 0.0]
  - - [1408, 1024, 1, 3328, 1408, 1408, 1408, 3328]
    - [4, 0.0]
  - - [6784, 5056, 1, 768, 6784, 6784, 6784, 768]
    - [4, 0.0]
  - - [256, 5056, 1, 1792, 256, 256, 256, 1792]
    - [4, 0.0]
  - - [1408, 3584, 1, 256, 1408, 1408, 1408, 256]
    - [4, 0.0]
  - - [128, 2368, 1, 3328, 128, 128, 128, 3328]
    - [4, 0.0]
  - - [6784, 6784, 1, 256, 6784, 6784, 6784, 256]
    - [4, 0.0]
  - - [5888, 1408, 1, 3328, 5888, 5888, 5888, 3328]
    - [4, 0.0]
  - - [1408, 1856, 1, 768, 1408, 1408, 1408, 768]
    - [4, 0.0]
  - - [2944, 704, 1, 3328, 2944, 2944, 2944, 3328]
    - [4, 0.0]
  - - [256, 256, 1, 768, 256, 256, 256, 768]
    - [4, 0.0]
  - - [6784, 128, 1, 3328, 6784, 6784, 6784, 3328]
    - [4, 0.0]
  - - [704, 448, 1, 3328, 704, 704, 704, 3328]
    - [4, 0.0]
  - - [448, 128, 1, 256, 448, 448, 448, 256]
    - [4, 0.0]
  - - [4, 256, 1, 256, 4, 4, 4, 256]
    - [7, 0.0]
  - - [704, 1856, 1, 3328, 704, 704, 704, 3328]
    - [4, 0.0]
  - - [4288, 5888, 1, 1792, 4288, 4288, 4288, 1792]
    - [4, 0.0]
  - - [4288, 704, 1, 128, 4288, 4288, 4288, 128]
    - [3, 2789.47]
  - - [1024, 5888, 1, 1792, 1024, 1024, 1024, 1792]
    - [4, 0.0]
  - - [704, 4288, 1, 1792, 704, 704, 704, 1792]
    - [4, 0.0]
  - - [4288, 3584, 1, 256, 4288, 4288, 4288, 256]
    - [4, 0.0]
  - - [704, 4, 1, 256, 704, 704, 704, 256]
    - [7, 0.0]
  - - [5056, 2368, 1, 1792, 5056, 5056, 5056, 1792]
    - [4, 0.0]
  - - [3584, 3584, 1, 256, 3584, 3584, 3584, 256]
    - [4, 0.0]
  - - [5056, 3584, 1, 128, 5056, 5056, 5056, 128]
    - [2, 3432.21]
  - - [5056, 4288, 1, 768, 5056, 5056, 5056, 768]
    - [4, 0.0]
  - - [128, 2944, 1, 1792, 128, 128, 128, 1792]
    - [4, 0.0]
  - - [3584, 2368, 1, 768, 3584, 3584, 3584, 768]
    - [4, 0.0]
  - - [2368, 1856, 1, 768, 2368, 2368, 2368, 768]
    - [4, 0.0]
  - - [4, 4, 1, 3328, 4, 4, 4, 3328]
    - [7, 0.0]
  - - [3584, 1024, 1, 256, 3584, 3584, 3584, 256]
    - [4, 0.0]
  - - [448, 5888, 1, 128, 448, 448, 448, 128]
    - [3, 2613.59]
  - - [3584, 64, 1, 3328, 3584, 3584, 3584, 3328]
    - [4, 0.0]
  - - [1408, 448, 1, 256, 1408, 1408, 1408, 256]
    - [4, 0.0]
  - - [1856, 4, 1, 1792, 1856, 1856, 1856, 1792]
    - [7, 0.0]
  - - [4288, 3584, 1, 3328, 4288, 4288, 4288, 3328]
    - [4, 0.0]
  - - [256, 2944, 1, 768, 256, 256, 256, 768]
    - [4, 0.0]
  - - [64, 5888, 1, 3328, 64, 64, 64, 3328]
    - [4, 0.0]
  - - [2944, 5888, 1, 256, 2944, 2944, 2944, 256]
    - [4, 0.0]
  - - [2944, 2368, 1, 3328, 2944, 2944, 2944, 3328]
    - [4, 0.0]
  - - [4, 5888, 1, 256, 4, 4, 4, 256]
    - [7, 0.0]
  - - [6784, 128, 1, 128, 6784, 6784, 6784, 128]
    - [3, 1859.33]
  - - [2944, 256, 1, 1792, 2944, 2944, 2944, 1792]
    - [4, 0.0]
  - - [256, 256, 1, 256, 256, 256, 256, 256]
    - [4, 0.0]
  - - [5888, 2368, 1, 3328, 5888, 5888, 5888, 3328]
    - [4, 0.0]
  - - [1024, 1408, 1, 128, 1024, 1024, 1024, 128]
    - [2, 2212.6]
  - - [4, 5888, 1, 768, 4, 4, 4, 768]
    - [7, 0.0]
  - - [5056, 6784, 1, 3328, 5056, 5056, 5056, 3328]
    - [4, 0.0]
  - - [128, 5888, 1, 256, 128, 128, 128, 256]
    - [4, 0.0]
  - - [2944, 5056, 1, 1792, 2944, 2944, 2944, 1792]
    - [4, 0.0]
  - - [704, 4, 1, 3328, 704, 704, 704, 3328]
    - [7, 0.0]
  - - [4, 448, 1, 128, 4, 4, 4, 128]
    - [6, 10.1861]
  - - [448, 6784, 1, 256, 448, 448, 448, 256]
    - [4, 0.0]
  - - [5056, 4288, 1, 1792, 5056, 5056, 5056, 1792]
    - [4, 0.0]
  - - [4, 1408, 1, 256, 4, 4, 4, 256]
    - [7, 0.0]
  - - [5056, 1024, 1, 256, 5056, 5056, 5056, 256]
    - [4, 0.0]
  - - [5056, 448, 1, 768, 5056, 5056, 5056, 768]
    - [4, 0.0]
  - - [1024, 704, 1, 3328, 1024, 1024, 1024, 3328]
    - [4, 0.0]
  - - [1856, 256, 1, 768, 1856, 1856, 1856, 768]
    - [4, 0.0]
  - - [1408, 5888, 1, 256, 1408, 1408, 1408, 256]
    - [4, 0.0]
  - - [448, 2368, 1, 3328, 448, 448, 448, 3328]
    - [4, 0.0]
  - - [1024, 3584, 1, 1792, 1024, 1024, 1024, 1792]
    - [4, 0.0]
  - - [5888, 4, 1, 768, 5888, 5888, 5888, 768]
    - [7, 0.0]
  - - [64, 4, 1, 128, 64, 64, 64, 128]
    - [6, 1.45516]
  - - [1024, 256, 1, 1792, 1024, 1024, 1024, 1792]
    - [4, 0.0]
  - - [2944, 6784, 1, 256, 2944, 2944, 2944, 256]
    - [4, 0.0]
  - - [64, 2368, 1, 3328, 64, 64, 64, 3328]
    - [4, 0.0]
  - - [5056, 256, 1, 768, 5056, 5056, 5056, 768]
    - [4, 0.0]
  - - [4288, 2944, 1, 768, 4288, 4288, 4288, 768]
    - [4, 0.0]
  - - [4288, 256, 1, 1792, 4288, 4288, 4288, 1792]
    - [4, 0.0]
  - - [5056, 256, 1, 256, 5056, 5056, 5056, 256]
    - [4, 0.0]
  - - [448, 1024, 1, 1792, 448, 448, 448, 1792]
    - [4, 0.0]
  - - [1408, 1408, 1, 256, 1408, 1408, 1408, 256]
    - [4, 0.0]
  - - [2944, 3584, 1, 1792, 2944, 2944, 2944, 1792]
    - [4, 0.0]
  - - [4, 1856, 1, 1792, 4, 4, 4, 1792]
    - [7, 0.0]
  - - [256, 128, 1, 256, 256, 256, 256, 256]
    - [4, 0.0]
  - - [256, 2944, 1, 256, 256, 256, 256, 256]
    - [4, 0.0]
  - - [64, 64, 1, 1792, 64, 64, 64, 1792]
    - [4, 0.0]
  - - [2944, 5888, 1, 3328, 2944, 2944, 2944, 3328]
    - [4, 0.0]
  - - [2944, 6784, 1, 1792, 2944, 2944, 2944, 1792]
    - [4, 0.0]
  - - [704, 3584, 1, 256, 704, 704, 704, 256]
    - [4, 0.0]
  - - [448, 4288, 1, 3328, 448, 448, 448, 3328]
    - [4, 0.0]
  - - [128, 5056, 1, 3328, 128, 128, 128, 3328]
    - [4, 0.0]
  - - [64, 1408, 1, 768, 64, 64, 64, 768]
    - [4, 0.0]
  - - [5056, 5056, 1, 3328, 5056, 5056, 5056, 3328]
    - [4, 0.0]
  - - [2368, 4288, 1, 256, 2368, 2368, 2368, 256]
    - [4, 0.0]
  - - [128, 704, 1, 256, 128, 128, 128, 256]
    - [4, 0.0]
  - - [4, 704, 1, 1792, 4, 4, 4, 1792]
    - [7, 0.0]
  - - [256, 4288, 1, 768, 256, 256, 256, 768]
    - [4, 0.0]
  - - [2944, 256, 1, 128, 2944, 2944, 2944, 128]
    - [3, 1932.2]
  - - [2944, 448, 1, 256, 2944, 2944, 2944, 256]
    - [4, 0.0]
  - - [128, 64, 1, 1792, 128, 128, 128, 1792]
    - [4, 0.0]
  - - [4, 1408, 1, 3328, 4, 4, 4, 3328]
    - [7, 0.0]
  - - [4288, 1024, 1, 3328, 4288, 4288, 4288, 3328]
    - [4, 0.0]
  - - [5056, 256, 1, 1792, 5056, 5056, 5056, 1792]
    - [4, 0.0]
  - - [3584, 448, 1, 256, 3584, 3584, 3584, 256]
    - [4, 0.0]
  - - [448, 128, 1, 3328, 448, 448, 448, 3328]
    - [4, 0.0]
  - - [448, 4288, 1, 256, 448, 448, 448, 256]
    - [4, 0.0]
  - - [448, 3584, 1, 128, 448, 448, 448, 128]
    - [3, 2308.21]
  - - [64, 2944, 1, 3328, 64, 64, 64, 3328]
    - [4, 0.0]
  - - [1856, 2368, 1, 3328, 1856, 1856, 1856, 3328]
    - [4, 0.0]
  - - [1408, 5888, 1, 768, 1408, 1408, 1408, 768]
    - [4, 0.0]
  - - [5888, 64, 1, 256, 5888, 5888, 5888, 256]
    - [4, 0.0]
  - - [4288, 5056, 1, 1792, 4288, 4288, 4288, 1792]
    - [4, 0.0]
  - - [448, 4, 1, 128, 448, 448, 448, 128]
    - [6, 9.89287]
  - - [256, 4, 1, 768, 256, 256, 256, 768]
    - [7, 0.0]
  - - [2368, 1408, 1, 256, 2368, 2368, 2368, 256]
    - [4, 0.0]
  - - [5056, 5056, 1, 128, 5056, 5056, 5056, 128]
    - [2, 3447.73]
  - - [4, 6784, 1, 3328, 4, 4, 4, 3328]
    - [7, 0.0]
  - - [4288, 4288, 1, 768, 4288, 4288, 4288, 768]
    - [4, 0.0]
  - - [1024, 4288, 1, 3328, 1024, 1024, 1024, 3328]
    - [4, 0.0]
  - - [448, 1408, 1, 768, 448, 448, 448, 768]
    - [4, 0.0]
  - - [448, 3584, 1, 768, 448, 448, 448, 768]
    - [4, 0.0]
  - - [6784, 2944, 1, 1792, 6784, 6784, 6784, 1792]
    - [4, 0.0]
  - - [448, 1024, 1, 256, 448, 448, 448, 256]
    - [4, 0.0]
  - - [4, 4, 1, 128, 4, 4, 4, 128]
    - [6, 0.0796763]
  - - [2944, 4288, 1, 128, 2944, 2944, 2944, 128]
    - [3, 3144.09]
  - - [3584, 704, 1, 1792, 3584, 3584, 3584, 1792]
    - [4, 0.0]
  - - [4288, 4288, 1, 3328, 4288, 4288, 4288, 3328]
    - [4, 0.0]
  - - [2368, 6784, 1, 128, 2368, 2368, 2368, 128]
    - [2, 3414.39]
  - - [1856, 1856, 1, 768, 1856, 1856, 1856, 768]
    - [4, 0.0]
  - - [4288, 5056, 1, 3328, 4288, 4288, 4288, 3328]
    - [4, 0.0]
  - - [64, 256, 1, 1792, 64, 64, 64, 1792]
    - [4, 0.0]
  - - [5888, 4288, 1, 128, 5888, 5888, 5888, 128]
    - [2, 3472.68]
  - - [64, 6784, 1, 128, 64, 64, 64, 128]
    - [3, 1260.92]
  - - [128, 64, 1, 128, 128, 128, 128, 128]
    - [3, 36.8633]
  - - [2944, 64, 1, 256, 2944, 2944, 2944, 256]
    - [4, 0.0]
  - - [1024, 4288, 1, 1792, 1024, 1024, 1024, 1792]
    - [4, 0.0]
  - - [256, 256, 1, 128, 256, 256, 256, 128]
    - [3, 295.675]
  - - [1408, 4288, 1, 256, 1408, 1408, 1408, 256]
    - [4, 0.0]
  - - [128, 64, 1, 256, 128, 128, 128, 256]
    - [4, 0.0]
  - - [6784, 6784, 1, 1792, 6784, 6784, 6784, 1792]
    - [4, 0.0]
  - - [64, 5888, 1, 256, 64, 64, 64, 256]
    - [4, 0.0]
  - - [4, 1856, 1, 256, 4, 4, 4, 256]
    - [7, 0.0]
  - - [6784, 3584, 1, 128, 6784, 6784, 6784, 128]
    - [2, 3485.74]
  - - [256, 3584, 1, 1792, 256, 256, 256, 1792]
    - [4, 0.0]
  - - [704, 4288, 1, 3328, 704, 704, 704, 3328]
    - [4, 0.0]
  - - [1408, 1408, 1, 3328, 1408, 1408, 1408, 3328]
    - [4, 0.0]
  - - [2944, 4288, 1, 3328, 2944, 2944, 2944, 3328]
    - [4, 0.0]
  - - [4, 128, 1, 128, 4, 4, 4, 128]
    - [6, 2.83564]
  - - [2368, 5888, 1, 1792, 2368, 2368, 2368, 1792]
    - [4, 0.0]
  - - [4288, 1408, 1, 128, 4288, 4288, 4288, 128]
    - [3, 3082.92]
  - - [448, 2368, 1, 256, 448, 448, 448, 256]
    - [4, 0.0]
  - - [1024, 1856, 1, 3328, 1024, 1024, 1024, 3328]
    - [4, 0.0]
  - - [4, 6784, 1, 768, 4, 4, 4, 768]
    - [7, 0.0]
  - - [704, 448, 1, 128, 704, 704, 704, 128]
    - [3, 1147.34]
  - - [704, 256, 1, 768, 704, 704, 704, 768]
    - [4, 0.0]
  - - [2368, 4, 1, 128, 2368, 2368, 2368, 128]
    - [6, 49.0043]
  - - [1024, 6784, 1, 768, 1024, 1024, 1024, 768]
    - [4, 0.0]
  - - [2368, 5888, 1, 3328, 2368, 2368, 2368, 3328]
    - [4, 0.0]
  - - [448, 1408, 1, 256, 448, 448, 448, 256]
    - [4, 0.0]
  - - [5888, 448, 1, 3328, 5888, 5888, 5888, 3328]
    - [4, 0.0]
  - - [128, 4288, 1, 256, 128, 128, 128, 256]
    - [4, 0.0]
  - - [4, 4288, 1, 1792, 4, 4, 4, 1792]
    - [7, 0.0]
  - - [448, 1024, 1, 768, 448, 448, 448, 768]
    - [4, 0.0]
  - - [2944, 448, 1, 3328, 2944, 2944, 2944, 3328]
    - [4, 0.0]
  - - [5056, 2944, 1, 1792, 5056, 5056, 5056, 1792]
    - [4, 0.0]
  - - [256, 3584, 1, 3328, 256, 256, 256, 3328]
    - [4, 0.0]
  - - [2368, 256, 1, 768, 2368, 2368, 2368, 768]
    - [4, 0.0]
  - - [2368, 1024, 1, 768, 2368, 2368, 2368, 768]
    - [4, 0.0]
  - - [2944, 2368, 1, 768, 2944, 2944, 2944, 768]
    - [4, 0.0]
  - - [64, 704, 1, 3328, 64, 64, 64, 3328]
    - [4, 0.0]
  - - [448, 1856, 1, 1792, 448, 448, 448, 1792]
    - [4, 0.0]
  - - [128, 256, 1, 1792, 128, 128, 128, 1792]
    - [4, 0.0]
  - - [4, 128, 1, 3328, 4, 4, 4, 3328]
    - [7, 0.0]
  - - [2944, 3584, 1, 256, 2944, 2944, 2944, 256]
    - [4, 0.0]
  - - [64, 256, 1, 768, 64, 64, 64, 768]
    - [4, 0.0]
  - - [448, 4, 1, 768, 448, 448, 448, 768]
    - [7, 0.0]
  - - [256, 5056, 1, 256, 256, 256, 256, 256]
    - [4, 0.0]
  - - [64, 1408, 1, 1792, 64, 64, 64, 1792]
    - [4, 0.0]
  - - [6784, 3584, 1, 768, 6784, 6784, 6784, 768]
    - [4, 0.0]
  - - [4, 5888, 1, 128, 4, 4, 4, 128]
    - [6, 113.997]
  - - [5056, 2944, 1, 3328, 5056, 5056, 5056, 3328]
    - [4, 0.0]
  - - [6784, 2944, 1, 128, 6784, 6784, 6784, 128]
    - [2, 3443.54]
  - - [4288, 64, 1, 128, 4288, 4288, 4288, 128]
    - [3, 946.534]
  - - [3584, 704, 1, 128, 3584, 3584, 3584, 128]
    - [2, 2344.04]
  - - [1856, 128, 1, 768, 1856, 1856, 1856, 768]
    - [4, 0.0]
  - - [128, 64, 1, 768, 128, 128, 128, 768]
    - [4, 0.0]
  - - [704, 256, 1, 128, 704, 704, 704, 128]
    - [3, 772.755]
  - - [4, 6784, 1, 128, 4, 4, 4, 128]
    - [6, 122.748]
  - - [1024, 1408, 1, 256, 1024, 1024, 1024, 256]
    - [4, 0.0]
  - - [448, 448, 1, 256, 448, 448, 448, 256]
    - [4, 0.0]
  - - [5056, 5888, 1, 3328, 5056, 5056, 5056, 3328]
    - [4, 0.0]
  - - [64, 2368, 1, 256, 64, 64, 64, 256]
    - [4, 0.0]
  - - [2368, 1408, 1, 768, 2368, 2368, 2368, 768]
    - [4, 0.0]
  - - [6784, 256, 1, 768, 6784, 6784, 6784, 768]
    - [4, 0.0]
  - - [704, 704, 1, 768, 704, 704, 704, 768]
    - [4, 0.0]
  - - [2368, 448, 1, 256, 2368, 2368, 2368, 256]
    - [4, 0.0]
  - - [4, 704, 1, 128, 4, 4, 4, 128]
    - [5, 15.4968]
  - - [1856, 5888, 1, 256, 1856, 1856, 1856, 256]
    - [4, 0.0]
  - - [448, 2368, 1, 768, 448, 448, 448, 768]
    - [4, 0.0]
  - - [6784, 1024, 1, 768, 6784, 6784, 6784, 768]
    - [4, 0.0]
  - - [5056, 1024, 1, 768, 5056, 5056, 5056, 768]
    - [4, 0.0]
  - - [1024, 1408, 1, 3328, 1024, 1024, 1024, 3328]
    - [4, 0.0]
  - - [4, 1856, 1, 128, 4, 4, 4, 128]
    - [6, 40.596]
  - - [5056, 64, 1, 128, 5056, 5056, 5056, 128]
    - [3, 1152.87]
  - - [5888, 5056, 1, 768, 5888, 5888, 5888, 768]
    - [4, 0.0]
  - - [5888, 256, 1, 3328, 5888, 5888, 5888, 3328]
    - [4, 0.0]
  - - [5888, 4288, 1, 256, 5888, 5888, 5888, 256]
    - [4, 0.0]
  - - [6784, 448, 1, 768, 6784, 6784, 6784, 768]
    - [4, 0.0]
  - - [1856, 256, 1, 256, 1856, 1856, 1856, 256]
    - [4, 0.0]
  - - [4, 2368, 1, 3328, 4, 4, 4, 3328]
    - [7, 0.0]
  - - [5888, 448, 1, 256, 5888, 5888, 5888, 256]
    - [4, 0.0]
  - - [1856, 448, 1, 256, 1856, 1856, 1856, 256]
    - [4, 0.0]
  - - [1856, 6784, 1, 128, 1856, 1856, 1856, 128]
    - [2, 3315.61]
  - - [448, 4, 1, 1792, 448, 448, 448, 1792]
    - [7, 0.0]
  - - [1408, 1408, 1, 128, 1408, 1408, 1408, 128]
    - [3, 2410.73]
  - - [6784, 1408, 1, 128, 6784, 6784, 6784, 128]
    - [2, 3243.34]
  - - [1408, 1856, 1, 128, 1408, 1408, 1408, 128]
    - [0, 2601.16]
  - - [3584, 4, 1, 128, 3584, 3584, 3584, 128]
    - [6, 73.7262]
  - - [64, 256, 1, 256, 64, 64, 64, 256]
    - [4, 0.0]
  - - [448, 4, 1, 256, 448, 448, 448, 256]
    - [7, 0.0]
  - - [128, 5056, 1, 1792, 128, 128, 128, 1792]
    - [4, 0.0]
  - - [4288, 128, 1, 768, 4288, 4288, 4288, 768]
    - [4, 0.0]
  - - [128, 4, 1, 768, 128, 128, 128, 768]
    - [7, 0.0]
  - - [448, 256, 1, 256, 448, 448, 448, 256]
    - [4, 0.0]
  - - [4288, 4288, 1, 1792, 4288, 4288, 4288, 1792]
    - [4, 0.0]
  - - [1856, 256, 1, 3328, 1856, 1856, 1856, 3328]
    - [4, 0.0]
  - - [128, 64, 1, 3328, 128, 128, 128, 3328]
    - [4, 0.0]
  - - [64, 5888, 1, 1792, 64, 64, 64, 1792]
    - [4, 0.0]
  - - [2368, 2944, 1, 256, 2368, 2368, 2368, 256]
    - [4, 0.0]
  - - [3584, 4, 1, 3328, 3584, 3584, 3584, 3328]
    - [7, 0.0]
  - - [4288, 2944, 1, 256, 4288, 4288, 4288, 256]
    - [4, 0.0]
  - - [448, 448, 1, 768, 448, 448, 448, 768]
    - [4, 0.0]
  - - [704, 6784, 1, 256, 704, 704, 704, 256]
    - [4, 0.0]
  - - [1024, 2944, 1, 128, 1024, 1024, 1024, 128]
    - [2, 2696.29]
  - - [1408, 4288, 1, 768, 1408, 1408, 1408, 768]
    - [4, 0.0]
  - - [5056, 6784, 1, 256, 5056, 5056, 5056, 256]
    - [4, 0.0]
  - - [256, 128, 1, 128, 256, 256, 256, 128]
    - [3, 147.838]
  - - [5056, 4, 1, 1792, 5056, 5056, 5056, 1792]
    - [7, 0.0]
  - - [2368, 1408, 1, 3328, 2368, 2368, 2368, 3328]
    - [4, 0.0]
  - - [448, 5056, 1, 128, 448, 448, 448, 128]
    - [3, 2549.84]
  - - [704, 256, 1, 1792, 704, 704, 704, 1792]
    - [4, 0.0]
  - - [2944, 1856, 1, 3328, 2944, 2944, 2944, 3328]
    - [4, 0.0]
  - - [3584, 4288, 1, 768, 3584, 3584, 3584, 768]
    - [4, 0.0]
  - - [4, 4, 1, 768, 4, 4, 4, 768]
    - [7, 0.0]
  - - [6784, 2368, 1, 256, 6784, 6784, 6784, 256]
    - [4, 0.0]
  - - [3584, 5056, 1, 1792, 3584, 3584, 3584, 1792]
    - [4, 0.0]
  - - [4288, 256, 1, 128, 4288, 4288, 4288, 128]
    - [3, 2086.73]
  - - [4288, 128, 1, 3328, 4288, 4288, 4288, 3328]
    - [4, 0.0]
  - - [1856, 2368, 1, 128, 1856, 1856, 1856, 128]
    - [3, 2911.98]
  - - [5056, 128, 1, 256, 5056, 5056, 5056, 256]
    - [4, 0.0]
  - - [5888, 2944, 1, 128, 5888, 5888, 5888, 128]
    - [2, 3406.08]
  - - [4288, 5888, 1, 256, 4288, 4288, 4288, 256]
    - [4, 0.0]
  - - [5888, 1856, 1, 3328, 5888, 5888, 5888, 3328]
    - [4, 0.0]
  - - [128, 4288, 1, 768, 128, 128, 128, 768]
    - [4, 0.0]
  - - [2368, 1408, 1, 128, 2368, 2368, 2368, 128]
    - [3, 2811.76]
  - - [1408, 64, 1, 256, 1408, 1408, 1408, 256]
    - [4, 0.0]
  - - [3584, 128, 1, 128, 3584, 3584, 3584, 128]
    - [3, 1425.73]
  - - [4288, 64, 1, 256, 4288, 4288, 4288, 256]
    - [4, 0.0]
  - - [128, 5056, 1, 256, 128, 128, 128, 256]
    - [4, 0.0]
  - - [1024, 3584, 1, 3328, 1024, 1024, 1024, 3328]
    - [4, 0.0]
  - - [1856, 4288, 1, 3328, 1856, 1856, 1856, 3328]
    - [4, 0.0]
  - - [4, 5056, 1, 256, 4, 4, 4, 256]
    - [7, 0.0]
  - - [448, 256, 1, 768, 448, 448, 448, 768]
    - [4, 0.0]
  - - [1024, 64, 1, 1792, 1024, 1024, 1024, 1792]
    - [4, 0.0]
  - - [64, 1408, 1, 128, 64, 64, 64, 128]
    - [3, 387.338]
  - - [3584, 1856, 1, 128, 3584, 3584, 3584, 128]
    - [2, 2955.59]
  - - [64, 1856, 1, 256, 64, 64, 64, 256]
    - [4, 0.0]
  - - [2368, 1024, 1, 128, 2368, 2368, 2368, 128]
    - [3, 2626.98]
  - - [5056, 1856, 1, 128, 5056, 5056, 5056, 128]
    - [3, 3221.13]
  - - [1024, 1024, 1, 3328, 1024, 1024, 1024, 3328]
    - [4, 0.0]
  - - [64, 4288, 1, 1792, 64, 64, 64, 1792]
    - [4, 0.0]
  - - [448, 448, 1, 1792, 448, 448, 448, 1792]
    - [4, 0.0]
  - - [3584, 2944, 1, 128, 3584, 3584, 3584, 128]
    - [2, 3241.3]
  - - [1024, 128, 1, 128, 1024, 1024, 1024, 128]
    - [3, 532.915]
  - - [128, 4288, 1, 1792, 128, 128, 128, 1792]
    - [4, 0.0]
  - - [1408, 1408, 1, 768, 1408, 1408, 1408, 768]
    - [4, 0.0]
  - - [1024, 256, 1, 128, 1024, 1024, 1024, 128]
    - [3, 913.257]
  - - [5056, 448, 1, 128, 5056, 5056, 5056, 128]
    - [3, 2626.86]
  - - [704, 704, 1, 1792, 704, 704, 704, 1792]
    - [4, 0.0]
  - - [128, 128, 1, 128, 128, 128, 128, 128]
    - [3, 74.5018]
  - - [5056, 1856, 1, 3328, 5056, 5056, 5056, 3328]
    - [4, 0.0]
  - - [1024, 704, 1, 128, 1024, 1024, 1024, 128]
    - [2, 1394.94]
  - - [4, 1024, 1, 768, 4, 4, 4, 768]
    - [7, 0.0]
  - - [5888, 2368, 1, 768, 5888, 5888, 5888, 768]
    - [4, 0.0]
  - - [5056, 2368, 1, 256, 5056, 5056, 5056, 256]
    - [4, 0.0]
  - - [5888, 1408, 1, 128, 5888, 5888, 5888, 128]
    - [2, 3250.6]
  - - [4, 1024, 1, 128, 4, 4, 4, 128]
    - [5, 21.9124]
  - - [64, 2368, 1, 1792, 64, 64, 64, 1792]
    - [4, 0.0]
  - - [448, 1408, 1, 3328, 448, 448, 448, 3328]
    - [4, 0.0]
  - - [2368, 704, 1, 3328, 2368, 2368, 2368, 3328]
    - [4, 0.0]
  - - [6784, 4288, 1, 256, 6784, 6784, 6784, 256]
    - [4, 0.0]
  - - [1024, 4288, 1, 128, 1024, 1024, 1024, 128]
    - [2, 2750.04]
  - - [5888, 3584, 1, 1792, 5888, 5888, 5888, 1792]
    - [4, 0.0]
  - - [5888, 3584, 1, 256, 5888, 5888, 5888, 256]
    - [4, 0.0]
  - - [6784, 1856, 1, 1792, 6784, 6784, 6784, 1792]
    - [4, 0.0]
  - - [4, 4, 1, 1792, 4, 4, 4, 1792]
    - [7, 0.0]
  - - [4, 704, 1, 256, 4, 4, 4, 256]
    - [7, 0.0]
  - - [128, 256, 1, 256, 128, 128, 128, 256]
    - [4, 0.0]
  - - [3584, 2368, 1, 1792, 3584, 3584, 3584, 1792]
    - [4, 0.0]
  - - [5888, 5888, 1, 128, 5888, 5888, 5888, 128]
    - [2, 3527.21]
  - - [4, 128, 1, 1792, 4, 4, 4, 1792]
    - [7, 0.0]
  - - [6784, 1856, 1, 128, 6784, 6784, 6784, 128]
    - [2, 3290.04]
  - - [2368, 448, 1, 768, 2368, 2368, 2368, 768]
    - [4, 0.0]
  - - [2944, 64, 1, 1792, 2944, 2944, 2944, 1792]
    - [4, 0.0]
  - - [128, 5056, 1, 768, 128, 128, 128, 768]
    - [4, 0.0]
  - - [2944, 2368, 1, 1792, 2944, 2944, 2944, 1792]
    - [4, 0.0]
  - - [1856, 1408, 1, 1792, 1856, 1856, 1856, 1792]
    - [4, 0.0]
  - - [256, 4, 1, 3328, 256, 256, 256, 3328]
    - [7, 0.0]
  - - [256, 3584, 1, 768, 256, 256, 256, 768]
    - [4, 0.0]
  - - [2944, 2944, 1, 128, 2944, 2944, 2944, 128]
    - [2, 3235.37]
  - - [64, 5056, 1, 3328, 64, 64, 64, 3328]
    - [4, 0.0]
  - - [3584, 1856, 1, 3328, 3584, 3584, 3584, 3328]
    - [4, 0.0]
  - - [128, 6784, 1, 256, 128, 128, 128, 256]
    - [4, 0.0]
  - - [5056, 4288, 1, 256, 5056, 5056, 5056, 256]
    - [4, 0.0]
  - - [128, 704, 1, 128, 128, 128, 128, 128]
    - [3, 392.218]
  - - [2944, 1024, 1, 768, 2944, 2944, 2944, 768]
    - [4, 0.0]
  - - [2944, 1024, 1, 128, 2944, 2944, 2944, 128]
    - [2, 2750.38]
  - - [5888, 2944, 1, 1792, 5888, 5888, 5888, 1792]
    - [4, 0.0]
  - - [64, 3584, 1, 256, 64, 64, 64, 256]
    - [4, 0.0]
  - - [2368, 2368, 1, 128, 2368, 2368, 2368, 128]
    - [2, 3056.61]
  - - [5888, 2368, 1, 1792, 5888, 5888, 5888, 1792]
    - [4, 0.0]
  - - [1856, 448, 1, 128, 1856, 1856, 1856, 128]
    - [0, 1900.51]
  - - [704, 3584, 1, 1792, 704, 704, 704, 1792]
    - [4, 0.0]
  - - [1024, 5056, 1, 1792, 1024, 1024, 1024, 1792]
    - [4, 0.0]
  - - [5888, 1024, 1, 128, 5888, 5888, 5888, 128]
    - [2, 3104.43]
  - - [5888, 4, 1, 1792, 5888, 5888, 5888, 1792]
    - [7, 0.0]
  - - [256, 2368, 1, 256, 256, 256, 256, 256]
    - [4, 0.0]
  - - [6784, 2368, 1, 3328, 6784, 6784, 6784, 3328]
    - [4, 0.0]
  - - [704, 2368, 1, 256, 704, 704, 704, 256]
    - [4, 0.0]
  - - [2944, 4288, 1, 256, 2944, 2944, 2944, 256]
    - [4, 0.0]
  - - [448, 704, 1, 768, 448, 448, 448, 768]
    - [4, 0.0]
  - - [256, 128, 1, 3328, 256, 256, 256, 3328]
    - [4, 0.0]
  - - [2944, 704, 1, 1792, 2944, 2944, 2944, 1792]
    - [4, 0.0]
  - - [4, 3584, 1, 1792, 4, 4, 4, 1792]
    - [7, 0.0]
  - - [6784, 4288, 1, 768, 6784, 6784, 6784, 768]
    - [4, 0.0]
  - - [1024, 64, 1, 3328, 1024, 1024, 1024, 3328]
    - [4, 0.0]
  - - [256, 128, 1, 768, 256, 256, 256, 768]
    - [4, 0.0]
  - - [4, 704, 1, 768, 4, 4, 4, 768]
    - [7, 0.0]
  - - [256, 2368, 1, 128, 256, 256, 256, 128]
    - [3, 1256.0]
  - - [5888, 4288, 1, 1792, 5888, 5888, 5888, 1792]
    - [4, 0.0]
  - - [5888, 128, 1, 1792, 5888, 5888, 5888, 1792]
    - [4, 0.0]
  - - [1856, 1024, 1, 256, 1856, 1856, 1856, 256]
    - [4, 0.0]
  - - [4, 3584, 1, 768, 4, 4, 4, 768]
    - [7, 0.0]
  - - [2944, 1408, 1, 1792, 2944, 2944, 2944, 1792]
    - [4, 0.0]
  - - [1408, 5056, 1, 1792, 1408, 1408, 1408, 1792]
    - [4, 0.0]
  - - [2944, 1024, 1, 256, 2944, 2944, 2944, 256]
    - [4, 0.0]
  - - [704, 5056, 1, 3328, 704, 704, 704, 3328]
    - [4, 0.0]
  - - [6784, 2368, 1, 768, 6784, 6784, 6784, 768]
    - [4, 0.0]
  - - [1408, 256, 1, 1792, 1408, 1408, 1408, 1792]
    - [4, 0.0]
  - - [3584, 1408, 1, 128, 3584, 3584, 3584, 128]
    - [2, 3000.62]
  - - [256, 4288, 1, 256, 256, 256, 256, 256]
    - [4, 0.0]
  - - [448, 64, 1, 3328, 448, 448, 448, 3328]
    - [4, 0.0]
  - - [5056, 1408, 1, 256, 5056, 5056, 5056, 256]
    - [4, 0.0]
  - - [5056, 1408, 1, 1792, 5056, 5056, 5056, 1792]
    - [4, 0.0]
  - - [64, 2944, 1, 128, 64, 64, 64, 128]
    - [3, 731.635]
  - - [1408, 1024, 1, 1792, 1408, 1408, 1408, 1792]
    - [4, 0.0]
  - - [448, 4288, 1, 768, 448, 448, 448, 768]
    - [4, 0.0]
  - - [128, 1856, 1, 1792, 128, 128, 128, 1792]
    - [4, 0.0]
  - - [3584, 4288, 1, 3328, 3584, 3584, 3584, 3328]
    - [4, 0.0]
  - - [2944, 1408, 1, 256, 2944, 2944, 2944, 256]
    - [4, 0.0]
  - - [128, 1856, 1, 768, 128, 128, 128, 768]
    - [4, 0.0]
  - - [256, 5888, 1, 256, 256, 256, 256, 256]
    - [4, 0.0]
  - - [4288, 128, 1, 1792, 4288, 4288, 4288, 1792]
    - [4, 0.0]
  - - [1408, 128, 1, 768, 1408, 1408, 1408, 768]
    - [4, 0.0]
  - - [6784, 5888, 1, 3328, 6784, 6784, 6784, 3328]
    - [4, 0.0]
  - - [2944, 64, 1, 3328, 2944, 2944, 2944, 3328]
    - [4, 0.0]
  - - [6784, 6784, 1, 768, 6784, 6784, 6784, 768]
    - [4, 0.0]
  - - [5888, 4, 1, 256, 5888, 5888, 5888, 256]
    - [7, 0.0]
  - - [5888, 1408, 1, 768, 5888, 5888, 5888, 768]
    - [4, 0.0]
  - - [5056, 256, 1, 3328, 5056, 5056, 5056, 3328]
    - [4, 0.0]
  - - [64, 2368, 1, 768, 64, 64, 64, 768]
    - [4, 0.0]
  - - [448, 704, 1, 1792, 448, 448, 448, 1792]
    - [4, 0.0]
  - - [704, 5888, 1, 1792, 704, 704, 704, 1792]
    - [4, 0.0]
  - - [128, 6784, 1, 1792, 128, 128, 128, 1792]
    - [4, 0.0]
  - - [5056, 2944, 1, 128, 5056, 5056, 5056, 128]
    - [2, 3387.41]
  - - [1024, 4, 1, 256, 1024, 1024, 1024, 256]
    - [7, 0.0]
  - - [256, 64, 1, 128, 256, 256, 256, 128]
    - [3, 73.9202]
  - - [6784, 1408, 1, 768, 6784, 6784, 6784, 768]
    - [4, 0.0]
  - - [5056, 256, 1, 128, 5056, 5056, 5056, 128]
    - [3, 2317.7]
  - - [256, 256, 1, 3328, 256, 256, 256, 3328]
    - [4, 0.0]
  - - [704, 1408, 1, 1792, 704, 704, 704, 1792]
    - [4, 0.0]
  - - [256, 64, 1, 768, 256, 256, 256, 768]
    - [4, 0.0]
  - - [6784, 1024, 1, 256, 6784, 6784, 6784, 256]
    - [4, 0.0]
  - - [3584, 1856, 1, 768, 3584, 3584, 3584, 768]
    - [4, 0.0]
  - - [5888, 5888, 1, 256, 5888, 5888, 5888, 256]
    - [4, 0.0]
  - - [448, 6784, 1, 3328, 448, 448, 448, 3328]
    - [4, 0.0]
  - - [256, 704, 1, 256, 256, 256, 256, 256]
    - [4, 0.0]
  - - [4288, 448, 1, 128, 4288, 4288, 4288, 128]
    - [3, 2495.84]
  - - [64, 1024, 1, 1792, 64, 64, 64, 1792]
    - [4, 0.0]
  - - [3584, 4288, 1, 256, 3584, 3584, 3584, 256]
    - [4, 0.0]
  - - [6784, 5888, 1, 768, 6784, 6784, 6784, 768]
    - [4, 0.0]
  - - [5056, 64, 1, 768, 5056, 5056, 5056, 768]
    - [4, 0.0]
  - - [1856, 3584, 1, 1792, 1856, 1856, 1856, 1792]
    - [4, 0.0]
  - - [1856, 1024, 1, 128, 1856, 1856, 1856, 128]
    - [0, 2425.47]
  - - [6784, 5056, 1, 1792, 6784, 6784, 6784, 1792]
    - [4, 0.0]
  - - [1408, 704, 1, 3328, 1408, 1408, 1408, 3328]
    - [4, 0.0]
  - - [2944, 64, 1, 128, 2944, 2944, 2944, 128]
    - [3, 782.646]
  - - [1856, 1024, 1, 3328, 1856, 1856, 1856, 3328]
    - [4, 0.0]
  - - [2944, 704, 1, 256, 2944, 2944, 2944, 256]
    - [4, 0.0]
  - - [128, 4288, 1, 3328, 128, 128, 128, 3328]
    - [4, 0.0]
  - - [6784, 4288, 1, 3328, 6784, 6784, 6784, 3328]
    - [4, 0.0]
  - - [256, 5888, 1, 768, 256, 256, 256, 768]
    - [4, 0.0]
  - - [64, 448, 1, 1792, 64, 64, 64, 1792]
    - [4, 0.0]
  - - [704, 704, 1, 3328, 704, 704, 704, 3328]
    - [4, 0.0]
  - - [5056, 704, 1, 128, 5056, 5056, 5056, 128]
    - [3, 2850.12]
  - - [4288, 4, 1, 1792, 4288, 4288, 4288, 1792]
    - [7, 0.0]
  - - [4288, 2368, 1, 1792, 4288, 4288, 4288, 1792]
    - [4, 0.0]
  - - [1856, 2944, 1, 3328, 1856, 1856, 1856, 3328]
    - [4, 0.0]
  - - [3584, 3584, 1, 3328, 3584, 3584, 3584, 3328]
    - [4, 0.0]
  - - [1856, 1024, 1, 1792, 1856, 1856, 1856, 1792]
    - [4, 0.0]
  - - [2368, 4, 1, 768, 2368, 2368, 2368, 768]
    - [7, 0.0]
  - - [2368, 3584, 1, 768, 2368, 2368, 2368, 768]
    - [4, 0.0]
  - - [4288, 64, 1, 3328, 4288, 4288, 4288, 3328]
    - [4, 0.0]
  - - [3584, 3584, 1, 768, 3584, 3584, 3584, 768]
    - [4, 0.0]
  - - [4288, 704, 1, 3328, 4288, 4288, 4288, 3328]
    - [4, 0.0]
  - - [256, 1408, 1, 3328, 256, 256, 256, 3328]
    - [4, 0.0]
  - - [1408, 128, 1, 3328, 1408, 1408, 1408, 3328]
    - [4, 0.0]
  - - [2944, 1856, 1, 256, 2944, 2944, 2944, 256]
    - [4, 0.0]
  - - [5056, 1856, 1, 1792, 5056, 5056, 5056, 1792]
    - [4, 0.0]
  - - [2944, 4, 1, 128, 2944, 2944, 2944, 128]
    - [6, 60.9231]
  - - [4288, 2368, 1, 768, 4288, 4288, 4288, 768]
    - [4, 0.0]
  - - [704, 5888, 1, 256, 704, 704, 704, 256]
    - [4, 0.0]
  - - [4288, 2368, 1, 128, 4288, 4288, 4288, 128]
    - [2, 3254.04]
  - - [704, 1408, 1, 768, 704, 704, 704, 768]
    - [4, 0.0]
  - - [256, 64, 1, 1792, 256, 256, 256, 1792]
    - [4, 0.0]
  - - [256, 5888, 1, 1792, 256, 256, 256, 1792]
    - [4, 0.0]
  - - [5056, 3584, 1, 256, 5056, 5056, 5056, 256]
    - [4, 0.0]
  - - [2368, 64, 1, 3328, 2368, 2368, 2368, 3328]
    - [4, 0.0]
  - - [448, 2944, 1, 768, 448, 448, 448, 768]
    - [4, 0.0]
  - - [128, 1024, 1, 1792, 128, 128, 128, 1792]
    - [4, 0.0]
  - - [256, 4, 1, 256, 256, 256, 256, 256]
    - [7, 0.0]
  - - [5056, 5056, 1, 256, 5056, 5056, 5056, 256]
    - [4, 0.0]
  - - [5056, 128, 1, 3328, 5056, 5056, 5056, 3328]
    - [4, 0.0]
  - - [4288, 3584, 1, 128, 4288, 4288, 4288, 128]
    - [2, 3379.46]
  - - [3584, 704, 1, 256, 3584, 3584, 3584, 256]
    - [4, 0.0]
  - - [1408, 448, 1, 128, 1408, 1408, 1408, 128]
    - [3, 1713.81]
  - - [5056, 1408, 1, 768, 5056, 5056, 5056, 768]
    - [4, 0.0]
  - - [5888, 6784, 1, 3328, 5888, 5888, 5888, 3328]
    - [4, 0.0]
  - - [4, 256, 1, 128, 4, 4, 4, 128]
    - [6, 5.63508]
  - - [4288, 1408, 1, 3328, 4288, 4288, 4288, 3328]
    - [4, 0.0]
  - - [64, 2944, 1, 1792, 64, 64, 64, 1792]
    - [4, 0.0]
  - - [5888, 2944, 1, 3328, 5888, 5888, 5888, 3328]
    - [4, 0.0]
  - - [256, 1856, 1, 768, 256, 256, 256, 768]
    - [4, 0.0]
  - - [4288, 448, 1, 256, 4288, 4288, 4288, 256]
    - [4, 0.0]
  - - [4, 5056, 1, 3328, 4, 4, 4, 3328]
    - [7, 0.0]
  - - [5888, 256, 1, 128, 5888, 5888, 5888, 128]
    - [2, 2361.38]
  - - [64, 1024, 1, 128, 64, 64, 64, 128]
    - [3, 298.798]
  - - [256, 5888, 1, 128, 256, 256, 256, 128]
    - [2, 2311.12]
  - - [704, 5056, 1, 768, 704, 704, 704, 768]
    - [4, 0.0]
  - - [5056, 4288, 1, 128, 5056, 5056, 5056, 128]
    - [2, 3454.68]
  - - [1856, 5888, 1, 1792, 1856, 1856, 1856, 1792]
    - [4, 0.0]
  - - [1856, 4, 1, 128, 1856, 1856, 1856, 128]
    - [6, 38.6399]
  - - [704, 2368, 1, 3328, 704, 704, 704, 3328]
    - [4, 0.0]
  - - [2944, 1856, 1, 768, 2944, 2944, 2944, 768]
    - [4, 0.0]
  - - [2368, 4288, 1, 1792, 2368, 2368, 2368, 1792]
    - [4, 0.0]
  - - [1024, 128, 1, 256, 1024, 1024, 1024, 256]
    - [4, 0.0]
  - - [4, 2944, 1, 256, 4, 4, 4, 256]
    - [7, 0.0]
  - - [1024, 5888, 1, 128, 1024, 1024, 1024, 128]
    - [2, 2972.46]
  - - [2368, 5056, 1, 768, 2368, 2368, 2368, 768]
    - [4, 0.0]
  - - [5056, 5888, 1, 1792, 5056, 5056, 5056, 1792]
    - [4, 0.0]
  - - [256, 704, 1, 768, 256, 256, 256, 768]
    - [4, 0.0]
  - - [1024, 448, 1, 768, 1024, 1024, 1024, 768]
    - [4, 0.0]
  - - [1856, 2944, 1, 1792, 1856, 1856, 1856, 1792]
    - [4, 0.0]
  - - [2368, 128, 1, 3328, 2368, 2368, 2368, 3328]
    - [4, 0.0]
  - - [3584, 2944, 1, 256, 3584, 3584, 3584, 256]
    - [4, 0.0]
  - - [3584, 3584, 1, 128, 3584, 3584, 3584, 128]
    - [2, 3340.23]
  - - [1408, 1024, 1, 768, 1408, 1408, 1408, 768]
    - [4, 0.0]
  - - [2368, 448, 1, 128, 2368, 2368, 2368, 128]
    - [3, 2030.06]
  - - [64, 3584, 1, 128, 64, 64, 64, 128]
    - [3, 888.691]
  - - [704, 2944, 1, 768, 704, 704, 704, 768]
    - [4, 0.0]
  - - [6784, 5056, 1, 256, 6784, 6784, 6784, 256]
    - [4, 0.0]
  - - [1408, 3584, 1, 128, 1408, 1408, 1408, 128]
    - [2, 3005.79]
  - - [5888, 4, 1, 128, 5888, 5888, 5888, 128]
    - [6, 118.999]
  - - [128, 2944, 1, 3328, 128, 128, 128, 3328]
    - [4, 0.0]
  - - [64, 1856, 1, 1792, 64, 64, 64, 1792]
    - [4, 0.0]
  - - [1856, 1856, 1, 3328, 1856, 1856, 1856, 3328]
    - [4, 0.0]
  - - [5888, 6784, 1, 768, 5888, 5888, 5888, 768]
    - [4, 0.0]
  - - [4288, 4288, 1, 256, 4288, 4288, 4288, 256]
    - [4, 0.0]
  - - [2944, 2944, 1, 3328, 2944, 2944, 2944, 3328]
    - [4, 0.0]
  - - [704, 1024, 1, 768, 704, 704, 704, 768]
    - [4, 0.0]
  - - [1408, 448, 1, 1792, 1408, 1408, 1408, 1792]
    - [4, 0.0]
  - - [64, 2944, 1, 768, 64, 64, 64, 768]
    - [4, 0.0]
  - - [448, 5056, 1, 3328, 448, 448, 448, 3328]
    - [4, 0.0]
  - - [1408, 2368, 1, 1792, 1408, 1408, 1408, 1792]
    - [4, 0.0]
  - - [128, 2368, 1, 1792, 128, 128, 128, 1792]
    - [4, 0.0]
  - - [2944, 2944, 1, 256, 2944, 2944, 2944, 256]
    - [4, 0.0]
  - - [1856, 5056, 1, 1792, 1856, 1856, 1856, 1792]
    - [4, 0.0]
  - - [64, 448, 1, 768, 64, 64, 64, 768]
    - [4, 0.0]
  - - [2944, 256, 1, 256, 2944, 2944, 2944, 256]
    - [4, 0.0]
  - - [2368, 128, 1, 128, 2368, 2368, 2368, 128]
    - [3, 1109.65]
  - - [256, 2368, 1, 3328, 256, 256, 256, 3328]
    - [4, 0.0]
  - - [1024, 1408, 1, 768, 1024, 1024, 1024, 768]
    - [4, 0.0]
  - - [6784, 4, 1, 256, 6784, 6784, 6784, 256]
    - [7, 0.0]
  - - [4288, 1408, 1, 768, 4288, 4288, 4288, 768]
    - [4, 0.0]
  - - [2368, 5056, 1, 256, 2368, 2368, 2368, 256]
    - [4, 0.0]
  - - [1408, 4288, 1, 3328, 1408, 1408, 1408, 3328]
    - [4, 0.0]
  - - [4288, 256, 1, 768, 4288, 4288, 4288, 768]
    - [4, 0.0]
  - - [64, 64, 1, 256, 64, 64, 64, 256]
    - [4, 0.0]
  - - [5888, 1024, 1, 1792, 5888, 5888, 5888, 1792]
    - [4, 0.0]
  - - [1856, 2944, 1, 256, 1856, 1856, 1856, 256]
    - [4, 0.0]
  - - [1024, 2944, 1, 768, 1024, 1024, 1024, 768]
    - [4, 0.0]
  - - [128, 2368, 1, 768, 128, 128, 128, 768]
    - [4, 0.0]
  - - [5056, 1856, 1, 256, 5056, 5056, 5056, 256]
    - [4, 0.0]
  - - [4288, 1408, 1, 256, 4288, 4288, 4288, 256]
    - [4, 0.0]
  - - [448, 64, 1, 256, 448, 448, 448, 256]
    - [4, 0.0]
  - - [448, 128, 1, 1792, 448, 448, 448, 1792]
    - [4, 0.0]
  - - [3584, 1408, 1, 1792, 3584, 3584, 3584, 1792]
    - [4, 0.0]
  - - [2368, 128, 1, 768, 2368, 2368, 2368, 768]
    - [4, 0.0]
  - - [4, 64, 1, 1792, 4, 4, 4, 1792]
    - [7, 0.0]
  - - [256, 4, 1, 128, 256, 256, 256, 128]
    - [6, 5.74499]
  - - [448, 5888, 1, 768, 448, 448, 448, 768]
    - [4, 0.0]
  - - [64, 1856, 1, 3328, 64, 64, 64, 3328]
    - [4, 0.0]
  - - [1408, 2944, 1, 128, 1408, 1408, 1408, 128]
    - [2, 2972.07]
  - - [1024, 5056, 1, 128, 1024, 1024, 1024, 128]
    - [2, 2944.8]
  - - [5056, 64, 1, 3328, 5056, 5056, 5056, 3328]
    - [4, 0.0]
  - - [1856, 2944, 1, 128, 1856, 1856, 1856, 128]
    - [2, 3019.43]
  - - [2944, 2368, 1, 256, 2944, 2944, 2944, 256]
    - [4, 0.0]
  - - [256, 6784, 1, 768, 256, 256, 256, 768]
    - [4, 0.0]
  - - [4, 1408, 1, 768, 4, 4, 4, 768]
    - [7, 0.0]
  - - [2944, 4, 1, 1792, 2944, 2944, 2944, 1792]
    - [7, 0.0]
  - - [256, 1856, 1, 1792, 256, 256, 256, 1792]
    - [4, 0.0]
  - - [2944, 4, 1, 768, 2944, 2944, 2944, 768]
    - [7, 0.0]
  - - [128, 1408, 1, 256, 128, 128, 128, 256]
    - [4, 0.0]
  - - [1408, 704, 1, 128, 1408, 1408, 1408, 128]
    - [3, 2046.36]
  - - [1856, 2368, 1, 768, 1856, 1856, 1856, 768]
    - [4, 0.0]
  - - [1856, 6784, 1, 3328, 1856, 1856, 1856, 3328]
    - [4, 0.0]
  - - [64, 448, 1, 3328, 64, 64, 64, 3328]
    - [4, 0.0]
  - - [1024, 6784, 1, 256, 1024, 1024, 1024, 256]
    - [4, 0.0]
  - - [2368, 3584, 1, 128, 2368, 2368, 2368, 128]
    - [2, 3178.4]
  - - [4288, 4, 1, 256, 4288, 4288, 4288, 256]
    - [7, 0.0]
  - - [5056, 448, 1, 256, 5056, 5056, 5056, 256]
    - [4, 0.0]
  - - [1856, 6784, 1, 1792, 1856, 1856, 1856, 1792]
    - [4, 0.0]
  - - [6784, 2944, 1, 3328, 6784, 6784, 6784, 3328]
    - [4, 0.0]
  - - [256, 1408, 1, 128, 256, 256, 256, 128]
    - [3, 900.065]
  - - [4, 64, 1, 256, 4, 4, 4, 256]
    - [7, 0.0]
  - - [448, 1408, 1, 1792, 448, 448, 448, 1792]
    - [4, 0.0]
  - - [3584, 1024, 1, 1792, 3584, 3584, 3584, 1792]
    - [4, 0.0]
  - - [1408, 2368, 1, 128, 1408, 1408, 1408, 128]
    - [2, 2698.5]
  - - [448, 256, 1, 1792, 448, 448, 448, 1792]
    - [4, 0.0]
  - - [1024, 6784, 1, 128, 1024, 1024, 1024, 128]
    - [2, 3003.22]
  - - [6784, 448, 1, 128, 6784, 6784, 6784, 128]
    - [3, 2668.54]
  - - [1024, 2944, 1, 256, 1024, 1024, 1024, 256]
    - [4, 0.0]
  - - [1024, 1024, 1, 1792, 1024, 1024, 1024, 1792]
    - [4, 0.0]
  - - [64, 704, 1, 1792, 64, 64, 64, 1792]
    - [4, 0.0]
  - - [2944, 1408, 1, 768, 2944, 2944, 2944, 768]
    - [4, 0.0]
  - - [64, 1024, 1, 3328, 64, 64, 64, 3328]
    - [4, 0.0]
  - - [1408, 2368, 1, 3328, 1408, 1408, 1408, 3328]
    - [4, 0.0]
  - - [704, 1408, 1, 3328, 704, 704, 704, 3328]
    - [4, 0.0]
  - - [6784, 128, 1, 768, 6784, 6784, 6784, 768]
    - [4, 0.0]
  - - [5056, 704, 1, 3328, 5056, 5056, 5056, 3328]
    - [4, 0.0]
  - - [5056, 3584, 1, 1792, 5056, 5056, 5056, 1792]
    - [4, 0.0]
  - - [256, 2944, 1, 3328, 256, 256, 256, 3328]
    - [4, 0.0]
  - - [2368, 64, 1, 256, 2368, 2368, 2368, 256]
    - [4, 0.0]
  - - [6784, 1024, 1, 128, 6784, 6784, 6784, 128]
    - [2, 3106.6]
  - - [3584, 5056, 1, 768, 3584, 3584, 3584, 768]
    - [4, 0.0]
  - - [1408, 1856, 1, 256, 1408, 1408, 1408, 256]
    - [4, 0.0]
  - - [3584, 1408, 1, 3328, 3584, 3584, 3584, 3328]
    - [4, 0.0]
  - - [5056, 5888, 1, 768, 5056, 5056, 5056, 768]
    - [4, 0.0]
  - - [1856, 128, 1, 1792, 1856, 1856, 1856, 1792]
    - [4, 0.0]
  - - [64, 5056, 1, 128, 64, 64, 64, 128]
    - [3, 965.697]
  - - [6784, 6784, 1, 128, 6784, 6784, 6784, 128]
    - [2, 3570.02]
  - - [448, 1856, 1, 128, 448, 448, 448, 128]
    - [0, 1895.5]
  - - [1408, 1024, 1, 128, 1408, 1408, 1408, 128]
    - [2, 2248.53]
  - - [256, 448, 1, 1792, 256, 256, 256, 1792]
    - [4, 0.0]
  - - [128, 1408, 1, 128, 128, 128, 128, 128]
    - [3, 739.712]
  - - [3584, 704, 1, 768, 3584, 3584, 3584, 768]
    - [4, 0.0]
  - - [256, 5888, 1, 3328, 256, 256, 256, 3328]
    - [4, 0.0]
  - - [704, 704, 1, 128, 704, 704, 704, 128]
    - [3, 1625.05]
  - - [1408, 128, 1, 128, 1408, 1408, 1408, 128]
    - [3, 761.418]
  - - [1408, 256, 1, 256, 1408, 1408, 1408, 256]
    - [4, 0.0]
  - - [2368, 2368, 1, 3328, 2368, 2368, 2368, 3328]
    - [4, 0.0]
  - - [1024, 5056, 1, 256, 1024, 1024, 1024, 256]
    - [4, 0.0]
  - - [3584, 1408, 1, 768, 3584, 3584, 3584, 768]
    - [4, 0.0]
  - - [704, 64, 1, 1792, 704, 704, 704, 1792]
    - [4, 0.0]
  - - [6784, 5056, 1, 3328, 6784, 6784, 6784, 3328]
    - [4, 0.0]
  - - [1408, 6784, 1, 768, 1408, 1408, 1408, 768]
    - [4, 0.0]
  - - [5056, 1024, 1, 3328, 5056, 5056, 5056, 3328]
    - [4, 0.0]
  - - [128, 4, 1, 3328, 128, 128, 128, 3328]
    - [7, 0.0]
  - - [1024, 128, 1, 768, 1024, 1024, 1024, 768]
    - [4, 0.0]
  - - [4, 1856, 1, 768, 4, 4, 4, 768]
    - [7, 0.0]
  - - [448, 2944, 1, 128, 448, 448, 448, 128]
    - [3, 2193.49]
  - - [1024, 4, 1, 3328, 1024, 1024, 1024, 3328]
    - [7, 0.0]
  - - [64, 704, 1, 768, 64, 64, 64, 768]
    - [4, 0.0]
  - - [1024, 2368, 1, 1792, 1024, 1024, 1024, 1792]
    - [4, 0.0]
  - - [1024, 1856, 1, 1792, 1024, 1024, 1024, 1792]
    - [4, 0.0]
  - - [704, 64, 1, 128, 704, 704, 704, 128]
    - [3, 208.167]
  - - [1024, 256, 1, 256, 1024, 1024, 1024, 256]
    - [4, 0.0]
  - - [4288, 704, 1, 768, 4288, 4288, 4288, 768]
    - [4, 0.0]
  - - [1024, 128, 1, 3328, 1024, 1024, 1024, 3328]
    - [4, 0.0]
  - - [1856, 256, 1, 1792, 1856, 1856, 1856, 1792]
    - [4, 0.0]
  - - [5056, 2368, 1, 128, 5056, 5056, 5056, 128]
    - [3, 3262.11]
  - - [2944, 3584, 1, 3328, 2944, 2944, 2944, 3328]
    - [4, 0.0]
  - - [256, 4288, 1, 1792, 256, 256, 256, 1792]
    - [4, 0.0]
  - - [256, 4288, 1, 3328, 256, 256, 256, 3328]
    - [4, 0.0]
  - - [6784, 1856, 1, 3328, 6784, 6784, 6784, 3328]
    - [4, 0.0]
  - - [1024, 256, 1, 3328, 1024, 1024, 1024, 3328]
    - [4, 0.0]
  - - [256, 6784, 1, 1792, 256, 256, 256, 1792]
    - [4, 0.0]
  - - [256, 704, 1, 3328, 256, 256, 256, 3328]
    - [4, 0.0]
  - - [3584, 4288, 1, 128, 3584, 3584, 3584, 128]
    - [2, 3363.19]
  - - [256, 448, 1, 3328, 256, 256, 256, 3328]
    - [4, 0.0]
  - - [1024, 2368, 1, 768, 1024, 1024, 1024, 768]
    - [4, 0.0]
  - - [64, 3584, 1, 1792, 64, 64, 64, 1792]
    - [4, 0.0]
  - - [5056, 6784, 1, 128, 5056, 5056, 5056, 128]
    - [2, 3525.83]
  - - [64, 5056, 1, 768, 64, 64, 64, 768]
    - [4, 0.0]
  - - [1024, 4, 1, 128, 1024, 1024, 1024, 128]
    - [6, 21.2542]
  - - [256, 1024, 1, 128, 256, 256, 256, 128]
    - [3, 743.803]
  - - [5888, 4, 1, 3328, 5888, 5888, 5888, 3328]
    - [7, 0.0]
  - - [3584, 1856, 1, 256, 3584, 3584, 3584, 256]
    - [4, 0.0]
  - - [256, 1408, 1, 256, 256, 256, 256, 256]
    - [4, 0.0]
  - - [4, 3584, 1, 256, 4, 4, 4, 256]
    - [7, 0.0]
  - - [704, 64, 1, 768, 704, 704, 704, 768]
    - [4, 0.0]
  - - [64, 128, 1, 3328, 64, 64, 64, 3328]
    - [4, 0.0]
  - - [5888, 5056, 1, 256, 5888, 5888, 5888, 256]
    - [4, 0.0]
  - - [1856, 5056, 1, 128, 1856, 1856, 1856, 128]
    - [2, 3163.31]
  - - [1408, 64, 1, 768, 1408, 1408, 1408, 768]
    - [4, 0.0]
  - - [6784, 448, 1, 256, 6784, 6784, 6784, 256]
    - [4, 0.0]
  - - [4288, 448, 1, 3328, 4288, 4288, 4288, 3328]
    - [4, 0.0]
  - - [4288, 6784, 1, 3328, 4288, 4288, 4288, 3328]
    - [4, 0.0]
  - - [448, 4, 1, 3328, 448, 448, 448, 3328]
    - [7, 0.0]
  - - [1024, 2944, 1, 3328, 1024, 1024, 1024, 3328]
    - [4, 0.0]
  - - [3584, 5888, 1, 128, 3584, 3584, 3584, 128]
    - [2, 3444.28]
  - - [1408, 5888, 1, 3328, 1408, 1408, 1408, 3328]
    - [4, 0.0]
  - - [5888, 2944, 1, 768, 5888, 5888, 5888, 768]
    - [4, 0.0]
  - - [3584, 128, 1, 256, 3584, 3584, 3584, 256]
    - [4, 0.0]
  - - [704, 4, 1, 768, 704, 704, 704, 768]
    - [7, 0.0]
  - - [6784, 4, 1, 128, 6784, 6784, 6784, 128]
    - [6, 135.914]
  - - [4, 2944, 1, 768, 4, 4, 4, 768]
    - [7, 0.0]
  - - [128, 2944, 1, 256, 128, 128, 128, 256]
    - [4, 0.0]
  - - [6784, 64, 1, 768, 6784, 6784, 6784, 768]
    - [4, 0.0]
  - - [704, 5888, 1, 3328, 704, 704, 704, 3328]
    - [4, 0.0]
  - - [448, 128, 1, 128, 448, 448, 448, 128]
    - [3, 271.476]
  - - [5888, 5888, 1, 768, 5888, 5888, 5888, 768]
    - [4, 0.0]
  - - [2944, 5056, 1, 256, 2944, 2944, 2944, 256]
    - [4, 0.0]
  - - [3584, 256, 1, 1792, 3584, 3584, 3584, 1792]
    - [4, 0.0]
  - - [4, 64, 1, 128, 4, 4, 4, 128]
    - [6, 1.4133]
  - - [2368, 2944, 1, 1792, 2368, 2368, 2368, 1792]
    - [4, 0.0]
  - - [2368, 704, 1, 128, 2368, 2368, 2368, 128]
    - [3, 2386.62]
  - - [128, 1408, 1, 3328, 128, 128, 128, 3328]
    - [4, 0.0]
  - - [64, 448, 1, 256, 64, 64, 64, 256]
    - [4, 0.0]
  - - [1408, 5888, 1, 128, 1408, 1408, 1408, 128]
    - [2, 3241.77]
  - - [3584, 5056, 1, 128, 3584, 3584, 3584, 128]
    - [2, 3377.78]
  - - [448, 4288, 1, 128, 448, 448, 448, 128]
    - [3, 2451.6]
  - - [1856, 3584, 1, 128, 1856, 1856, 1856, 128]
    - [2, 3149.12]
  - - [4, 1856, 1, 3328, 4, 4, 4, 3328]
    - [7, 0.0]
  - - [704, 2368, 1, 128, 704, 704, 704, 128]
    - [3, 2340.08]
  - - [5888, 1408, 1, 1792, 5888, 5888, 5888, 1792]
    - [4, 0.0]
  - - [1408, 4, 1, 128, 1408, 1408, 1408, 128]
    - [5, 28.7078]
  - - [2368, 256, 1, 128, 2368, 2368, 2368, 128]
    - [3, 1678.7]
  - - [2368, 1856, 1, 3328, 2368, 2368, 2368, 3328]
    - [4, 0.0]
  - - [5056, 128, 1, 128, 5056, 5056, 5056, 128]
    - [3, 1752.79]
  - - [704, 4288, 1, 256, 704, 704, 704, 256]
    - [4, 0.0]
  - - [1856, 4, 1, 3328, 1856, 1856, 1856, 3328]
    - [7, 0.0]
  - - [704, 1024, 1, 256, 704, 704, 704, 256]
    - [4, 0.0]
  - - [64, 64, 1, 3328, 64, 64, 64, 3328]
    - [4, 0.0]
- null
