src/Tensile/data/Configs/miopen/archives/resnet50/2018-09-12/logic/vega20_Cijk_Ailk_Bjlk_SB.yaml
- {MinimumRequiredVersion: 4.3.0}
- vega20
- gfx906
- [Device 66a0, Device 66a7]
    SolutionIndex: 0
    SolutionNameMin: Cijk_Ailk_Bjlk_SB_MT064x128x08_DTL0_GRVW04_GSU01_PGR1_PLR1_TT04_08_VW04_WG16_16_01_WGM01
    SolutionIndex: 1
    SolutionNameMin: Cijk_Ailk_Bjlk_SB_MT064x064x08_DTL0_GRVW04_GSU01_PGR1_PLR1_TT04_08_VW04_WG16_08_01_WGM01
    SolutionIndex: 2
    SolutionNameMin: Cijk_Ailk_Bjlk_SB_MT032x128x08_DTL0_GRVW04_GSU01_PGR1_PLR1_TT04_04_VW04_WG08_32_01_WGM01
    SolutionIndex: 3
    SolutionNameMin: Cijk_Ailk_Bjlk_SB_MT064x064x16_DTL0_GRVW04_GSU01_PGR1_PLR1_TT04_04_VW04_WG16_16_01_WGM01
    SolutionIndex: 4
    SolutionNameMin: Cijk_Ailk_Bjlk_SB_MT064x128x08_DTL0_GRVW04_GSU01_PGR1_PLR1_TT04_08_VW02_WG16_16_01_WGM64
    SolutionIndex: 5
    SolutionNameMin: Cijk_Ailk_Bjlk_SB_MT064x128x08_DTL0_GRVW04_GSU01_PGR1_PLR1_TT04_08_VW02_WG16_16_01_WGM01
    SolutionIndex: 6
    SolutionNameMin: Cijk_Ailk_Bjlk_SB_MT064x064x08_DTL0_GRVW01_GSU01_PGR1_PLR1_TT04_04_VW04_WG16_16_01_WGM01
    SolutionIndex: 7
    SolutionNameMin: Cijk_Ailk_Bjlk_SB_MT064x128x08_DTL0_GRVW04_GSU01_PGR1_PLR1_TT04_08_VW04_WG16_16_01_WGM64
    SolutionIndex: 8
    SolutionNameMin: Cijk_Ailk_Bjlk_SB_MT032x128x08_DTL0_GRVW04_GSU01_PGR1_PLR1_TT04_04_VW04_WG08_32_01_WGM64
    SolutionIndex: 9
    SolutionNameMin: Cijk_Ailk_Bjlk_SB_MT032x128x08_DTL0_GRVW04_GSU01_PGR1_PLR1_TT04_04_VW04_WG08_32_01_WGM08
- - - [3136, 256, 64, 64]
    - [1, 8023.34]
  - - [784, 512, 64, 128]
    - [0, 8118.42]
  - - [49, 2048, 128, 512]
    - [5, 6709.69]
  - - [784, 128, 64, 512]
    - [7, 8457.53]
  - - [196, 1024, 64, 256]
    - [8, 7259.55]
  - - [3136, 64, 128, 64]
    - [6, 7772.99]
  - - [784, 512, 128, 128]
    - [0, 8225.65]
  - - [196, 1024, 128, 256]
    - [9, 7369.53]
  - - [196, 256, 64, 1024]
    - [2, 7306.01]
  - - [3136, 64, 64, 64]
    - [6, 7555.78]
  - - [3136, 64, 64, 256]
    - [1, 8713.92]
  - - [3136, 64, 128, 256]
    - [1, 8912.31]
  - - [784, 128, 128, 512]
    - [0, 8609.88]
  - - [49, 2048, 64, 512]
    - [4, 6575.52]
  - - [196, 256, 128, 1024]
    - [2, 7483.58]
  - - [49, 512, 64, 2048]
    - [3, 6562.92]
  - - [49, 512, 128, 2048]
    - [1, 6808.05]
  - - [3136, 256, 128, 64]
    - [1, 8120.83]
- null
