Tensile/Configs/miopen/archives/bert/2020-01-07/exact/vega20_Cijk_Ailk_Bjlk_SB.yaml
- {MinimumRequiredVersion: 4.14.0}
- vega20
- gfx906
- [Device 66a0, Device 66a1, Device 66a7, Vega 20]
    SolutionIndex: 0
    SolutionNameMin: Cijk_Ailk_Bjlk_SB_MT64x64x8_SE_EPS0_FL0_GRVW1_GSU1_PGR0_PLR0_TT4_4_USFGRO1_VW2_WG16_16_1_WGM1
    SolutionIndex: 1
    SolutionNameMin: Cijk_Ailk_Bjlk_SB_MT64x64x8_SE_EPS1_FL0_GRVW1_GSU1_PGR1_PLR0_TT4_4_USFGRO1_VW2_WG16_16_1_WGM8
    SolutionIndex: 2
    SolutionNameMin: Cijk_Ailk_Bjlk_SB_MT64x64x16_SE_EPS1_FL0_GRVW4_GSU1_PGR1_PLR1_TT4_4_USFGRO0_VW4_WG16_16_1_WGM1
    SolutionIndex: 3
    SolutionNameMin: Cijk_Ailk_Bjlk_SB_MT64x64x16_SE_EPS1_FL0_GRVW4_GSU1_PGR1_PLR1_TT4_4_USFGRO0_VW4_WG16_16_1_WGM8
    SolutionIndex: 4
    SolutionNameMin: Cijk_Ailk_Bjlk_SB_MT64x64x16_SE_EPS1_FL1_GRVW4_GSU1_PGR1_PLR1_TT4_4_USFGRO0_VW4_WG16_16_1_WGM1
    SolutionIndex: 5
    SolutionNameMin: Cijk_Ailk_Bjlk_SB_MT64x64x16_SE_EPS1_FL1_GRVW4_GSU1_PGR1_PLR1_TT4_4_USFGRO0_VW4_WG16_16_1_WGM8
    SolutionIndex: 6
    SolutionNameMin: Cijk_Ailk_Bjlk_SB_MT128x64x8_SE_EPS1_FL0_GRVW1_GSU1_PGR1_PLR0_TT8_4_USFGRO1_VW2_WG16_16_1_WGM1
    SolutionIndex: 7
    SolutionNameMin: Cijk_Ailk_Bjlk_SB_MT128x64x16_SE_EPS0_FL0_GRVW1_GSU1_PGR0_PLR0_TT8_4_USFGRO1_VW2_WG16_16_1_WGM1
    SolutionIndex: 8
    SolutionNameMin: Cijk_Ailk_Bjlk_SB_MT128x64x8_SE_EPS1_FL0_GRVW1_GSU1_PGR1_PLR0_TT8_4_USFGRO1_VW4_WG16_16_1_WGM1
    SolutionIndex: 9
    SolutionNameMin: Cijk_Ailk_Bjlk_SB_MT128x64x8_SE_EPS1_FL0_GRVW1_GSU1_PGR1_PLR0_TT8_4_USFGRO1_VW4_WG16_16_1_WGM8
    SolutionIndex: 10
    SolutionNameMin: Cijk_Ailk_Bjlk_SB_MT128x64x8_SE_EPS1_FL0_GRVW2_GSU1_PGR1_PLR0_TT8_4_USFGRO0_VW2_WG16_16_1_WGM8
    SolutionIndex: 11
    SolutionNameMin: Cijk_Ailk_Bjlk_SB_MT128x64x8_SE_EPS0_FL1_GRVW2_GSU1_PGR0_PLR0_TT8_4_USFGRO0_VW2_WG16_16_1_WGM1
    SolutionIndex: 12
    SolutionNameMin: Cijk_Ailk_Bjlk_SB_MT96x64x8_SE_EPS1_FL1_GRVW2_GSU1_PGR1_PLR1_TT6_4_USFGRO0_VW2_WG16_16_1_WGM1
    SolutionIndex: 13
    SolutionNameMin: Cijk_Ailk_Bjlk_SB_MT96x64x8_SE_EPS1_FL1_GRVW2_GSU1_PGR1_PLR1_TT6_4_USFGRO0_VW2_WG16_16_1_WGM8
    SolutionIndex: 14
    SolutionNameMin: Cijk_Ailk_Bjlk_SB_MT64x96x8_SE_EPS1_FL0_GRVW1_GSU1_PGR1_PLR1_TT4_6_USFGRO1_VW2_WG16_16_1_WGM1
    SolutionIndex: 15
    SolutionNameMin: Cijk_Ailk_Bjlk_SB_MT64x96x8_SE_EPS1_FL1_GRVW2_GSU1_PGR1_PLR1_TT4_6_USFGRO0_VW2_WG16_16_1_WGM8
    SolutionIndex: 16
    SolutionNameMin: Cijk_Ailk_Bjlk_SB_MT32x32x8_SE_EPS0_FL0_GRVW1_GSU1_PGR0_PLR0_TT2_2_USFGRO1_VW2_WG16_16_1_WGM1
- - - [1024, 2, 1, 512, 1024, 1024, 1024, 2]
    - [16, 0.0]
  - - [1024, 3072, 1, 512, 1024, 1024, 1024, 3072]
    - [2, 9355.32]
  - - [1024, 1024, 1, 6, 1024, 1024, 1024, 1024]
    - [9, 534.988]
  - - [1024, 2, 1, 3072, 1024, 1024, 1024, 2]
    - [16, 0.0]
  - - [1024, 1024, 1, 4, 1024, 1024, 1024, 1024]
    - [1, 356.658]
  - - [1024, 30522, 1, 120, 1024, 1024, 1024, 30522]
    - [6, 10516.3]
  - - [3072, 1024, 1, 3072, 3072, 3072, 3072, 1024]
    - [3, 11003.5]
  - - [64, 512, 96, 512, 64, 64, 64, 512]
    - [4, 9487.59]
  - - [1024, 1024, 1, 80, 1024, 1024, 1024, 1024]
    - [10, 3883.61]
  - - [1024, 1024, 1, 2048, 1024, 1024, 1024, 1024]
    - [12, 9611.01]
  - - [1024, 1024, 1, 20, 1024, 1024, 1024, 1024]
    - [11, 1515.28]
  - - [3072, 1024, 1, 2048, 3072, 3072, 3072, 1024]
    - [13, 10805.1]
  - - [1024, 1024, 1, 3072, 1024, 1024, 1024, 1024]
    - [13, 9799.3]
  - - [3072, 1024, 1, 512, 3072, 3072, 3072, 1024]
    - [13, 9239.4]
  - - [64, 512, 16, 512, 64, 64, 64, 512]
    - [5, 6236.88]
  - - [1024, 1024, 1, 512, 1024, 1024, 1024, 1024]
    - [15, 8036.99]
  - - [1024, 30522, 1, 80, 1024, 1024, 1024, 30522]
    - [8, 9385.74]
  - - [1024, 1024, 1, 1, 1024, 1024, 1024, 1024]
    - [0, 0.0]
  - - [1024, 2, 1, 6, 1024, 1024, 1024, 2]
    - [16, 0.0]
  - - [1024, 2, 1, 4, 1024, 1024, 1024, 2]
    - [16, 0.0]
  - - [1024, 1024, 1, 120, 1024, 1024, 1024, 1024]
    - [14, 4723.32]
  - - [1024, 3072, 1, 2048, 1024, 1024, 1024, 3072]
    - [3, 11072.6]
  - - [64, 512, 64, 512, 64, 64, 64, 512]
    - [4, 8870.97]
  - - [1024, 2, 1, 1, 1024, 1024, 1024, 2]
    - [16, 0.0]
  - - [1024, 2, 1, 2048, 1024, 1024, 1024, 2]
    - [16, 0.0]
  - - [1024, 30522, 1, 20, 1024, 1024, 1024, 30522]
    - [7, 5392.43]
  - - [1024, 3072, 1, 3072, 1024, 1024, 1024, 3072]
    - [15, 11162.1]
- null
