Tensile/Configs/miopen/archives/inception/2019-03-26/exact/vega20_Cijk_Alik_Bljk_SB.yaml
- {MinimumRequiredVersion: 4.9.3}
- vega20
- gfx906
- [Device 66a0, Device 66a1, Device 66a7]
    SolutionIndex: 0
    SolutionNameMin: Cijk_Alik_Bljk_SB_MT64x32x16_SE_EPS1_GSU1_PGR1_SNLL1_TT4_2_VW2_WG16_16_1_WGM1
    SolutionIndex: 1
    SolutionNameMin: Cijk_Alik_Bljk_SB_MT64x64x16_SE_EPS1_GSU1_PGR1_SNLL1_TT4_4_VW2_WG16_16_1_WGM1
    SolutionIndex: 2
    SolutionNameMin: Cijk_Alik_Bljk_SB_MT16x8x32_SE_EPS1_GSU1_PGR1_SNLL1_TT4_2_VW2_WG4_4_8_WGM1
    SolutionIndex: 3
    SolutionNameMin: Cijk_Alik_Bljk_SB_MT32x32x8_SE_EPS1_GSU1_PGR1_SNLL1_TT4_4_VW2_WG8_8_1_WGM8
    SolutionIndex: 4
    SolutionNameMin: Cijk_Alik_Bljk_SB_MT32x16x16_SE_EPS1_GSU1_PGR1_SNLL1_TT8_4_VW2_WG4_4_8_WGM8
    SolutionIndex: 5
    SolutionNameMin: Cijk_Alik_Bljk_SB_MT16x8x32_SE_EPS1_GSU1_PGR1_SNLL1_TT4_2_VW2_WG4_4_8_WGM8
    SolutionIndex: 6
    SolutionNameMin: Cijk_Alik_Bljk_SB_MT16x8x32_SE_EPS1_GSU1_PGR1_SNLL1_TT4_2_VW2_WG4_4_8_WGM16
    SolutionIndex: 7
    SolutionNameMin: Cijk_Alik_Bljk_SB_MT32x32x8_SE_EPS1_GSU1_PGR1_SNLL1_TT4_4_VW2_WG8_8_1_WGM64
    SolutionIndex: 8
    SolutionNameMin: Cijk_Alik_Bljk_SB_MT16x8x32_SE_EPS1_GSU1_PGR1_SNLL1_TT4_2_VW2_WG4_4_8_WGM64
    SolutionIndex: 9
    SolutionNameMin: Cijk_Alik_Bljk_SB_MT32x16x32_SE_EPS1_GSU8_PGR1_SNLL0_TT8_4_VW2_WG4_4_8_WGM64
    SolutionIndex: 10
    SolutionNameMin: Cijk_Alik_Bljk_SB_MT32x8x8_SE_EPS1_GSU1_PGR1_SNLL1_TT4_4_VW4_WG8_2_4_WGM1
    SolutionIndex: 11
    SolutionNameMin: Cijk_Alik_Bljk_SB_MT128x64x8_SE_EPS1_GSU1_PGR1_SNLL1_TT8_4_VW4_WG16_16_1_WGM1
    SolutionIndex: 12
    SolutionNameMin: Cijk_Alik_Bljk_SB_MT32x32x8_SE_EPS1_GSU1_PGR1_SNLL1_TT4_4_VW4_WG8_8_1_WGM1
    SolutionIndex: 13
    SolutionNameMin: Cijk_Alik_Bljk_SB_MT16x32x16_SE_EPS1_GSU1_PGR1_SNLL1_TT8_4_VW4_WG2_8_4_WGM1
    SolutionIndex: 14
    SolutionNameMin: Cijk_Alik_Bljk_SB_MT64x64x16_SE_EPS0_GSU1_PGR0_SNLL0_TT4_4_VW4_WG16_16_1_WGM1
    SolutionIndex: 15
    SolutionNameMin: Cijk_Alik_Bljk_SB_MT16x16x32_SE_EPS1_GSU1_PGR1_SNLL1_TT4_4_VW4_WG4_4_8_WGM1
    SolutionIndex: 16
    SolutionNameMin: Cijk_Alik_Bljk_SB_MT32x8x8_SE_EPS1_GSU1_PGR1_SNLL1_TT4_4_VW4_WG8_2_4_WGM8
    SolutionIndex: 17
    SolutionNameMin: Cijk_Alik_Bljk_SB_MT32x32x8_SE_EPS1_GSU1_PGR1_SNLL1_TT4_4_VW4_WG8_8_1_WGM8
    SolutionIndex: 18
    SolutionNameMin: Cijk_Alik_Bljk_SB_MT16x16x32_SE_EPS1_GSU8_PGR1_SNLL0_TT4_4_VW4_WG4_4_8_WGM8
    SolutionIndex: 19
    SolutionNameMin: Cijk_Alik_Bljk_SB_MT64x64x16_SE_EPS1_GSU1_PGR1_SNLL1_TT4_4_VW4_WG16_16_1_WGM16
    SolutionIndex: 20
    SolutionNameMin: Cijk_Alik_Bljk_SB_MT32x32x8_SE_EPS1_GSU1_PGR1_SNLL1_TT4_4_VW4_WG8_8_1_WGM64
    SolutionIndex: 21
    SolutionNameMin: Cijk_Alik_Bljk_SB_MT16x32x16_SE_EPS1_GSU1_PGR1_SNLL1_TT8_4_VW4_WG2_8_4_WGM64
    SolutionIndex: 22
    SolutionNameMin: Cijk_Alik_Bljk_SB_MT32x16x16_SE_EPS1_GSU1_PGR1_SNLL1_TT8_4_VW4_WG4_4_8_WGM64
    SolutionIndex: 23
    SolutionNameMin: Cijk_Alik_Bljk_SB_MT16x16x32_SE_EPS1_GSU1_PGR1_SNLL1_TT4_4_VW4_WG4_4_8_WGM64
- - - [1280, 384, 1, 64, 1280, 1280, 64, 64]
    - [14, 3196.88]
  - - [256, 64, 1, 1225, 256, 256, 1225, 1225]
    - [15, 1194.67]
  - - [2048, 320, 1, 64, 2048, 2048, 64, 64]
    - [17, 3449.26]
  - - [256, 48, 1, 1225, 256, 256, 1225, 1225]
    - [8, 913.398]
  - - [2048, 192, 1, 64, 2048, 2048, 64, 64]
    - [7, 2516.58]
  - - [1024, 128, 1, 289, 1024, 1024, 289, 289]
    - [21, 2869.68]
  - - [1280, 192, 1, 64, 1280, 1280, 64, 64]
    - [0, 1872.46]
  - - [192, 32, 1, 1225, 192, 192, 1225, 1225]
    - [5, 505.806]
  - - [1280, 448, 1, 64, 1280, 1280, 64, 64]
    - [1, 3078.87]
  - - [384, 64, 1, 1225, 384, 384, 1225, 1225]
    - [6, 1511.33]
  - - [2048, 384, 1, 64, 2048, 2048, 64, 64]
    - [19, 3836.25]
  - - [288, 48, 1, 1225, 288, 288, 1225, 1225]
    - [2, 1032.59]
  - - [64, 80, 1, 5329, 64, 64, 5329, 5329]
    - [18, 888.167]
  - - [1024, 384, 1, 289, 1024, 1024, 289, 289]
    - [12, 4291.52]
  - - [2048, 448, 1, 64, 2048, 2048, 64, 64]
    - [11, 3783.52]
  - - [1280, 320, 1, 64, 1280, 1280, 64, 64]
    - [17, 2776.95]
  - - [192, 64, 1, 1225, 192, 192, 1225, 1225]
    - [2, 926.897]
  - - [384, 192, 1, 1225, 384, 384, 1225, 1225]
    - [13, 2560.0]
  - - [1536, 256, 1, 64, 1536, 1536, 64, 64]
    - [20, 2621.44]
  - - [192, 48, 1, 1225, 192, 192, 1225, 1225]
    - [5, 698.614]
  - - [768, 128, 1, 289, 768, 768, 289, 289]
    - [22, 2291.12]
  - - [1024, 256, 1, 289, 1024, 1024, 289, 289]
    - [20, 4064.36]
  - - [768, 192, 1, 289, 768, 768, 289, 289]
    - [16, 2690.33]
  - - [1536, 384, 1, 64, 1536, 1536, 64, 64]
    - [3, 3145.73]
  - - [288, 64, 1, 1225, 288, 288, 1225, 1225]
    - [5, 1142.67]
  - - [1024, 192, 1, 289, 1024, 1024, 289, 289]
    - [10, 3243.13]
  - - [384, 96, 1, 1225, 384, 384, 1225, 1225]
    - [23, 1844.71]
  - - [160, 64, 1, 5329, 160, 160, 5329, 5329]
    - [9, 1564.48]
  - - [768, 160, 1, 289, 768, 768, 289, 289]
    - [4, 2386.58]
- null
