Tensile/Configs/miopen/archives/inception/2019-03-26/exact/vega20_Cijk_Ailk_Bljk_SB.yaml
- {MinimumRequiredVersion: 4.9.3}
- vega20
- gfx906
- [Device 66a0, Device 66a1, Device 66a7]
    SolutionIndex: 0
    SolutionNameMin: Cijk_Ailk_Bljk_SB_MT128x64x8_SE_EPS1_PGR1_SNLL1_TT8_4_WG16_16_1_WGM2
    SolutionIndex: 1
    SolutionNameMin: Cijk_Ailk_Bljk_SB_MT128x64x8_SE_EPS1_PGR1_SNLL1_TT4_8_WG32_8_1_WGM2
    SolutionIndex: 2
    SolutionNameMin: Cijk_Ailk_Bljk_SB_MT256x32x8_SE_EPS1_PGR1_SNLL1_TT4_8_WG64_4_1_WGM2
    SolutionIndex: 3
    SolutionNameMin: Cijk_Ailk_Bljk_SB_MT128x32x8_SE_EPS1_PGR1_SNLL1_TT4_4_WG32_8_1_WGM4
    SolutionIndex: 4
    SolutionNameMin: Cijk_Ailk_Bljk_SB_MT128x64x8_SE_EPS1_PGR1_SNLL1_TT4_8_WG32_8_1_WGM7
    SolutionIndex: 5
    SolutionNameMin: Cijk_Ailk_Bljk_SB_MT128x64x8_SE_EPS1_PGR1_SNLL1_TT4_8_WG32_8_1_WGM15
    SolutionIndex: 6
    SolutionNameMin: Cijk_Ailk_Bljk_SB_MT128x64x8_SE_EPS1_PGR1_SNLL1_TT8_4_WG16_16_1_WGM16
    SolutionIndex: 7
    SolutionNameMin: Cijk_Ailk_Bljk_SB_MT128x64x8_SE_EPS1_PGR1_SNLL1_TT8_4_WG16_16_1_WGM17
    SolutionIndex: 8
    SolutionNameMin: Cijk_Ailk_Bljk_SB_MT256x16x8_SE_EPS0_PGR0_SNLL0_TT4_4_WG64_4_1_WGM17
    SolutionIndex: 9
    SolutionNameMin: Cijk_Ailk_Bljk_SB_MT128x64x8_SE_EPS1_PGR1_SNLL1_TT4_8_WG32_8_1_WGM32
    SolutionIndex: 10
    SolutionNameMin: Cijk_Ailk_Bljk_SB_MT256x16x8_SE_EPS0_PGR0_SNLL0_TT4_4_WG64_4_1_WGM32
    SolutionIndex: 11
    SolutionNameMin: Cijk_Ailk_Bljk_SB_MT64x64x16_SE_EPS1_PGR1_SNLL1_TT4_4_WG16_16_1_WGM2
    SolutionIndex: 12
    SolutionNameMin: Cijk_Ailk_Bljk_SB_MT64x64x16_SE_EPS1_PGR1_SNLL1_TT4_8_WG16_8_2_WGM2
    SolutionIndex: 13
    SolutionNameMin: Cijk_Ailk_Bljk_SB_MT64x128x16_SE_EPS1_PGR1_SNLL1_TT4_8_WG16_16_1_WGM7
    SolutionIndex: 14
    SolutionNameMin: Cijk_Ailk_Bljk_SB_MT64x64x16_SE_EPS1_PGR1_SNLL1_TT4_8_WG16_8_2_WGM7
    SolutionIndex: 15
    SolutionNameMin: Cijk_Ailk_Bljk_SB_MT64x64x16_SE_EPS1_PGR1_SNLL1_TT4_8_WG16_8_2_WGM11
    SolutionIndex: 16
    SolutionNameMin: Cijk_Ailk_Bljk_SB_MT64x64x16_SE_EPS1_PGR1_SNLL1_TT4_4_WG16_16_1_WGM16
    SolutionIndex: 17
    SolutionNameMin: Cijk_Ailk_Bljk_SB_MT64x64x16_SE_EPS1_PGR1_SNLL1_TT4_8_WG16_8_2_WGM32
    SolutionIndex: 18
    SolutionNameMin: Cijk_Ailk_Bljk_SB_MT64x32x16_SE_EPS1_PGR1_SNLL1_TT4_4_WG16_8_2_WGM64
    SolutionIndex: 19
    SolutionNameMin: Cijk_Ailk_Bljk_SB_MT64x64x32_SE_EPS1_PGR1_SNLL1_TT4_8_WG16_8_2_WGM32
    SolutionIndex: 20
    SolutionNameMin: Cijk_Ailk_Bljk_SB_MT128x64x8_SE_EPS1_PGR1_SNLL1_TT8_4_WG16_16_1_WGM8
    SolutionIndex: 21
    SolutionNameMin: Cijk_Ailk_Bljk_SB_MT64x64x16_SE_EPS1_PGR1_SNLL1_TT4_4_WG16_16_1_WGM1
    SolutionIndex: 22
    SolutionNameMin: Cijk_Ailk_Bljk_SB_MT128x64x16_SE_EPS1_PGR1_SNLL1_TT8_4_WG16_16_1_WGM1
    SolutionIndex: 23
    SolutionNameMin: Cijk_Ailk_Bljk_SB_MT128x128x16_SE_EPS1_PGR1_SNLL1_TT8_4_WG16_32_1_WGM1
    SolutionIndex: 24
    SolutionNameMin: Cijk_Ailk_Bljk_SB_MT64x64x16_SE_EPS1_PGR1_SNLL1_TT4_4_WG16_16_1_WGM8
- - - [4096, 384, 1, 2048, 4096, 4096, 4096, 2048]
    - [22, 8892.52]
  - - [4096, 192, 1, 2048, 4096, 4096, 4096, 2048]
    - [16, 8024.18]
  - - [289, 160, 64, 768, 289, 289, 289, 768]
    - [18, 6783.63]
  - - [1225, 192, 64, 384, 1225, 1225, 1225, 384]
    - [5, 9373.83]
  - - [5329, 64, 64, 160, 5329, 5329, 5329, 160]
    - [9, 9186.69]
  - - [1225, 64, 64, 288, 1225, 1225, 1225, 288]
    - [0, 8492.41]
  - - [1225, 64, 64, 384, 1225, 1225, 1225, 384]
    - [4, 8735.76]
  - - [289, 128, 64, 1024, 289, 289, 289, 1024]
    - [19, 7000.2]
  - - [4096, 320, 1, 1280, 4096, 4096, 4096, 1280]
    - [24, 8302.26]
  - - [4096, 384, 1, 1536, 4096, 4096, 4096, 1536]
    - [6, 9052.45]
  - - [4096, 192, 1, 1280, 4096, 4096, 4096, 1280]
    - [21, 7561.85]
  - - [289, 192, 64, 768, 289, 289, 289, 768]
    - [17, 7882.5]
  - - [1225, 48, 64, 256, 1225, 1225, 1225, 256]
    - [8, 6620.25]
  - - [289, 192, 64, 1024, 289, 289, 289, 1024]
    - [15, 7346.99]
  - - [1225, 64, 64, 192, 1225, 1225, 1225, 192]
    - [1, 8098.35]
  - - [1225, 96, 64, 384, 1225, 1225, 1225, 384]
    - [2, 8303.08]
  - - [1225, 48, 64, 288, 1225, 1225, 1225, 288]
    - [10, 6746.77]
  - - [4096, 320, 1, 2048, 4096, 4096, 4096, 2048]
    - [11, 8384.42]
  - - [4096, 256, 1, 1536, 4096, 4096, 4096, 1536]
    - [23, 8734.34]
  - - [1225, 48, 64, 192, 1225, 1225, 1225, 192]
    - [10, 6516.36]
  - - [4096, 384, 1, 1280, 4096, 4096, 4096, 1280]
    - [20, 9023.24]
  - - [1225, 64, 64, 256, 1225, 1225, 1225, 256]
    - [7, 8319.34]
  - - [4096, 448, 1, 1280, 4096, 4096, 4096, 1280]
    - [11, 8343.32]
  - - [289, 128, 64, 768, 289, 289, 289, 768]
    - [13, 7667.98]
  - - [289, 256, 64, 1024, 289, 289, 289, 1024]
    - [14, 7535.46]
  - - [4096, 448, 1, 2048, 4096, 4096, 4096, 2048]
    - [11, 8572.31]
  - - [5329, 80, 64, 64, 5329, 5329, 5329, 64]
    - [10, 6492.44]
  - - [1225, 32, 64, 192, 1225, 1225, 1225, 192]
    - [3, 6278.54]
  - - [289, 384, 64, 1024, 289, 289, 289, 1024]
    - [12, 7767.57]
- null
