lib/configs/lite_configs/vega10_Cijk_Alik_Bjlk_SB.yaml
- {MinimumRequiredVersion: 4.8.1}
- vega10
- gfx900
- [Device 6863, Device 6862, Device 687f, Device 6860, Device 6861, 'Vega 10 XTX [Radeon
    SolutionIndex: 0
    SolutionNameMin: Cijk_Alik_Bjlk_SB_MT064x128x08_
    SolutionIndex: 1
    SolutionNameMin: Cijk_Alik_Bjlk_SB_MT032x064x32_
    SolutionIndex: 2
    SolutionNameMin: Cijk_Alik_Bjlk_SB_MT064x032x32_
    SolutionIndex: 3
    SolutionNameMin: Cijk_Alik_Bjlk_SB_MT128x128x16_
    SolutionIndex: 4
    SolutionNameMin: Cijk_Alik_Bjlk_SB_MT064x064x16_
    SolutionIndex: 5
    SolutionNameMin: Cijk_Alik_Bjlk_SB_MT032x032x32_
    SolutionIndex: 6
    SolutionNameMin: Cijk_Alik_Bjlk_SB_MT128x064x16_
    SolutionIndex: 7
    SolutionNameMin: Cijk_Alik_Bjlk_SB_MT008x008x08_
- - - [1024, 1024, 1, 3328]
    - [0, 5752.08]
  - - [4, 256, 1, 1792]
    - [7, 29.5609]
  - - [64, 6784, 1, 256]
    - [4, 3465.34]
  - - [5888, 256, 1, 1792]
    - [0, 5809.24]
  - - [6784, 256, 1, 256]
    - [4, 4980.86]
  - - [3584, 1024, 1, 1792]
    - [0, 6421.94]
  - - [2368, 64, 1, 3328]
    - [5, 3007.42]
  - - [64, 3584, 1, 1792]
    - [1, 3986.32]
  - - [128, 64, 1, 256]
    - [5, 179.183]
  - - [4288, 4, 1, 768]
    - [7, 289.622]
  - - [2368, 1024, 1, 768]
    - [0, 5788.66]
  - - [5056, 1856, 1, 3328]
    - [0, 6319.6]
  - - [5888, 1408, 1, 256]
    - [0, 6193.42]
  - - [5888, 1856, 1, 3328]
    - [0, 6351.73]
  - - [3584, 128, 1, 1792]
    - [4, 4489.45]
  - - [5056, 2944, 1, 768]
    - [0, 6541.06]
  - - [1856, 4288, 1, 256]
    - [0, 6036.91]
  - - [3584, 1408, 1, 256]
    - [0, 5740.48]
  - - [4288, 1856, 1, 768]
    - [0, 6223.13]
  - - [5056, 5056, 1, 3328]
    - [0, 6617.11]
  - - [448, 448, 1, 256]
    - [1, 2486.1]
  - - [2944, 3584, 1, 1792]
    - [0, 6420.3]
  - - [64, 64, 1, 1792]
    - [5, 177.897]
  - - [1024, 3584, 1, 3328]
    - [0, 6283.18]
  - - [4, 2944, 1, 256]
    - [7, 166.11]
  - - [448, 3584, 1, 3328]
    - [4, 4973.56]
  - - [256, 4288, 1, 3328]
    - [1, 4759.94]
  - - [2944, 448, 1, 3328]
    - [0, 5110.83]
  - - [3584, 1856, 1, 3328]
    - [6, 6024.61]
  - - [1024, 2944, 1, 1792]
    - [3, 5990.07]
  - - [5056, 64, 1, 3328]
    - [1, 4120.66]
  - - [448, 6784, 1, 1792]
    - [0, 6200.87]
  - - [256, 3584, 1, 1792]
    - [0, 5005.82]
  - - [704, 5056, 1, 768]
    - [0, 6124.03]
  - - [448, 5056, 1, 256]
    - [4, 5099.67]
  - - [6784, 448, 1, 256]
    - [6, 5347.95]
  - - [3584, 5888, 1, 768]
    - [3, 6333.04]
  - - [2368, 128, 1, 256]
    - [5, 2727.88]
  - - [704, 704, 1, 3328]
    - [4, 4943.74]
  - - [4, 5888, 1, 1792]
    - [7, 372.149]
  - - [128, 4288, 1, 1792]
    - [1, 4110.79]
  - - [64, 5056, 1, 256]
    - [1, 2662.6]
  - - [64, 4, 1, 256]
    - [7, 4.40164]
  - - [6784, 4288, 1, 3328]
    - [0, 6610.56]
  - - [3584, 1024, 1, 768]
    - [0, 6241.79]
  - - [1856, 5056, 1, 1792]
    - [0, 6301.16]
  - - [1856, 2368, 1, 3328]
    - [0, 6126.82]
  - - [1024, 4, 1, 256]
    - [7, 69.3893]
  - - [1408, 704, 1, 768]
    - [6, 5203.5]
  - - [2944, 4288, 1, 3328]
    - [0, 6486.73]
  - - [5888, 1024, 1, 256]
    - [0, 5917.89]
  - - [4288, 2368, 1, 1792]
    - [0, 6465.75]
  - - [5056, 448, 1, 768]
    - [4, 5407.32]
  - - [1024, 704, 1, 256]
    - [4, 3880.63]
  - - [1408, 2944, 1, 256]
    - [0, 5986.37]
  - - [4, 5888, 1, 256]
    - [7, 284.596]
  - - [6784, 5056, 1, 3328]
    - [0, 6633.28]
  - - [5056, 5056, 1, 256]
    - [0, 6321.61]
  - - [256, 1408, 1, 1792]
    - [1, 4406.17]
  - - [6784, 64, 1, 256]
    - [4, 3402.49]
  - - [2944, 4, 1, 256]
    - [7, 172.443]
  - - [4288, 1856, 1, 1792]
    - [0, 6313.46]
  - - [4, 1856, 1, 768]
    - [7, 154.558]
  - - [1856, 2944, 1, 768]
    - [0, 6187.23]
  - - [1408, 256, 1, 256]
    - [1, 3202.26]
  - - [6784, 1856, 1, 1792]
    - [0, 6438.62]
  - - [1024, 256, 1, 3328]
    - [1, 4801.22]
  - - [5056, 128, 1, 768]
    - [1, 4672.5]
  - - [4, 448, 1, 1792]
    - [7, 44.3263]
  - - [1856, 1408, 1, 768]
    - [0, 6224.12]
  - - [448, 2368, 1, 1792]
    - [1, 4661.09]
  - - [4288, 256, 1, 256]
    - [4, 4224.57]
  - - [1408, 128, 1, 1792]
    - [5, 3422.22]
  - - [2944, 64, 1, 256]
    - [5, 2420.62]
  - - [448, 448, 1, 3328]
    - [1, 3753.99]
  - - [256, 256, 1, 3328]
    - [5, 2900.84]
  - - [128, 2368, 1, 1792]
    - [1, 3697.71]
  - - [3584, 256, 1, 1792]
    - [1, 5108.36]
  - - [704, 4, 1, 256]
    - [7, 46.1226]
  - - [5056, 4, 1, 3328]
    - [7, 168.51]
  - - [6784, 64, 1, 768]
    - [4, 4037.18]
  - - [256, 64, 1, 1792]
    - [5, 707.771]
  - - [2944, 256, 1, 3328]
    - [4, 5193.25]
  - - [128, 1856, 1, 1792]
    - [1, 4244.57]
  - - [64, 4288, 1, 1792]
    - [1, 3314.5]
  - - [5056, 3584, 1, 1792]
    - [0, 6662.52]
  - - [6784, 5888, 1, 256]
    - [0, 6481.87]
  - - [64, 1024, 1, 3328]
    - [5, 2230.57]
  - - [1856, 2368, 1, 768]
    - [0, 6002.71]
  - - [4, 6784, 1, 768]
    - [7, 351.237]
  - - [1024, 1408, 1, 256]
    - [0, 4359.34]
  - - [2368, 2368, 1, 3328]
    - [0, 6428.47]
  - - [5056, 128, 1, 1792]
    - [1, 5000.31]
  - - [64, 6784, 1, 1792]
    - [4, 4247.23]
  - - [5056, 704, 1, 3328]
    - [6, 5893.52]
  - - [1408, 1856, 1, 256]
    - [4, 5366.14]
  - - [6784, 1856, 1, 768]
    - [0, 6357.36]
  - - [1856, 704, 1, 768]
    - [4, 5401.44]
  - - [2368, 5056, 1, 256]
    - [0, 6085.68]
  - - [5056, 6784, 1, 1792]
    - [0, 6711.81]
  - - [5888, 1856, 1, 256]
    - [0, 5929.8]
  - - [256, 448, 1, 768]
    - [1, 2965.22]
  - - [4288, 64, 1, 3328]
    - [1, 3512.66]
  - - [704, 5888, 1, 256]
    - [0, 6031.73]
  - - [256, 704, 1, 1792]
    - [5, 3408.82]
  - - [1024, 1024, 1, 1792]
    - [0, 5627.03]
  - - [448, 5888, 1, 1792]
    - [0, 5407.42]
  - - [5056, 64, 1, 768]
    - [1, 3650.54]
  - - [3584, 704, 1, 3328]
    - [6, 5778.23]
  - - [1408, 1408, 1, 256]
    - [0, 5377.77]
  - - [128, 4, 1, 768]
    - [7, 13.6811]
  - - [256, 6784, 1, 768]
    - [4, 5103.68]
  - - [6784, 5056, 1, 768]
    - [0, 6540.76]
  - - [448, 4288, 1, 256]
    - [0, 5071.75]
  - - [64, 3584, 1, 3328]
    - [1, 4173.84]
  - - [4, 704, 1, 3328]
    - [7, 60.3313]
  - - [704, 1024, 1, 768]
    - [4, 4700.7]
  - - [2368, 1856, 1, 1792]
    - [0, 6088.06]
  - - [2944, 64, 1, 3328]
    - [5, 3729.07]
  - - [128, 6784, 1, 1792]
    - [0, 4766.68]
  - - [2368, 128, 1, 3328]
    - [1, 3856.58]
  - - [704, 1856, 1, 3328]
    - [4, 5578.53]
  - - [448, 1408, 1, 256]
    - [4, 3694.83]
  - - [64, 5056, 1, 3328]
    - [1, 4025.95]
  - - [4, 704, 1, 256]
    - [7, 43.4458]
  - - [5056, 3584, 1, 768]
    - [0, 6599.64]
  - - [5056, 256, 1, 768]
    - [4, 5354.91]
  - - [64, 128, 1, 768]
    - [5, 308.844]
  - - [1408, 5056, 1, 256]
    - [0, 5942.58]
  - - [2944, 1024, 1, 1792]
    - [0, 6141.92]
  - - [5056, 4, 1, 1792]
    - [7, 165.287]
  - - [256, 4288, 1, 1792]
    - [4, 4629.66]
  - - [2368, 4288, 1, 768]
    - [0, 6383.36]
  - - [4, 1024, 1, 1792]
    - [7, 84.9084]
  - - [3584, 1856, 1, 1792]
    - [6, 5975.93]
  - - [256, 128, 1, 768]
    - [5, 1163.47]
  - - [5888, 1024, 1, 1792]
    - [0, 6321.05]
  - - [704, 64, 1, 1792]
    - [5, 1847.42]
  - - [5056, 704, 1, 256]
    - [6, 5362.3]
  - - [1408, 3584, 1, 256]
    - [0, 5937.88]
  - - [448, 2944, 1, 1792]
    - [0, 5124.72]
  - - [5056, 1024, 1, 3328]
    - [0, 6516.77]
  - - [3584, 3584, 1, 1792]
    - [0, 6471.62]
  - - [128, 448, 1, 256]
    - [5, 1238.61]
  - - [2944, 704, 1, 768]
    - [6, 5711.86]
  - - [1856, 3584, 1, 768]
    - [0, 6395.18]
  - - [1024, 6784, 1, 768]
    - [3, 5997.93]
  - - [1024, 256, 1, 256]
    - [1, 2876.01]
  - - [1856, 4, 1, 3328]
    - [7, 144.389]
  - - [128, 448, 1, 768]
    - [5, 2001.78]
  - - [2944, 3584, 1, 3328]
    - [0, 6440.31]
  - - [256, 5888, 1, 1792]
    - [0, 5731.62]
  - - [6784, 4288, 1, 1792]
    - [0, 6588.95]
  - - [128, 1024, 1, 3328]
    - [5, 3541.01]
  - - [3584, 5056, 1, 768]
    - [3, 6317.14]
  - - [6784, 128, 1, 768]
    - [0, 4659.88]
  - - [6784, 2944, 1, 256]
    - [0, 6393.91]
  - - [64, 1408, 1, 768]
    - [1, 2318.27]
  - - [704, 448, 1, 768]
    - [1, 3613.19]
  - - [1024, 2368, 1, 256]
    - [6, 4169.19]
  - - [2944, 2368, 1, 768]
    - [0, 6203.59]
  - - [4288, 2368, 1, 3328]
    - [0, 6497.87]
  - - [4288, 6784, 1, 3328]
    - [0, 6722.98]
  - - [1024, 1856, 1, 768]
    - [3, 5254.53]
  - - [6784, 3584, 1, 768]
    - [0, 6612.31]
  - - [2944, 5888, 1, 1792]
    - [0, 6556.43]
  - - [3584, 6784, 1, 3328]
    - [0, 6526.68]
  - - [6784, 1856, 1, 3328]
    - [0, 6468.71]
  - - [4, 128, 1, 256]
    - [7, 11.0586]
  - - [128, 1408, 1, 1792]
    - [5, 3424.9]
  - - [5888, 64, 1, 256]
    - [1, 3255.79]
  - - [4288, 704, 1, 768]
    - [6, 5647.39]
  - - [6784, 256, 1, 1792]
    - [4, 5353.4]
  - - [6784, 5888, 1, 1792]
    - [0, 6710.35]
  - - [448, 256, 1, 3328]
    - [1, 3600.7]
  - - [5888, 256, 1, 768]
    - [0, 5656.06]
  - - [64, 2944, 1, 768]
    - [5, 3171.2]
  - - [3584, 2368, 1, 3328]
    - [0, 6325.99]
  - - [128, 128, 1, 768]
    - [5, 608.841]
  - - [256, 4, 1, 768]
    - [7, 26.2788]
  - - [128, 5888, 1, 256]
    - [4, 4167.35]
  - - [6784, 128, 1, 3328]
    - [1, 4972.29]
  - - [1856, 1024, 1, 3328]
    - [0, 5700.38]
  - - [4288, 1024, 1, 256]
    - [0, 5794.09]
  - - [2368, 1408, 1, 256]
    - [0, 5590.78]
  - - [704, 4288, 1, 1792]
    - [0, 6144.05]
  - - [3584, 2944, 1, 256]
    - [3, 5773.36]
  - - [3584, 256, 1, 3328]
    - [1, 5233.72]
  - - [704, 5888, 1, 3328]
    - [0, 6471.93]
  - - [64, 2368, 1, 1792]
    - [5, 2882.29]
  - - [128, 3584, 1, 3328]
    - [4, 4570.95]
  - - [3584, 5056, 1, 1792]
    - [0, 6405.98]
  - - [6784, 3584, 1, 1792]
    - [0, 6670.7]
  - - [4, 64, 1, 768]
    - [7, 5.63516]
  - - [64, 6784, 1, 768]
    - [4, 4029.96]
  - - [2944, 256, 1, 1792]
    - [4, 5122.86]
  - - [4, 4288, 1, 768]
    - [7, 293.933]
  - - [1856, 128, 1, 3328]
    - [1, 4436.1]
  - - [128, 256, 1, 1792]
    - [5, 1376.23]
  - - [2944, 5888, 1, 768]
    - [0, 6495.29]
  - - [6784, 1408, 1, 3328]
    - [0, 6430.87]
  - - [4, 1024, 1, 256]
    - [7, 61.279]
  - - [4, 3584, 1, 768]
    - [7, 258.941]
  - - [1024, 5888, 1, 256]
    - [3, 5493.51]
  - - [2368, 1024, 1, 3328]
    - [0, 5912.34]
  - - [1856, 1856, 1, 3328]
    - [0, 6102.85]
  - - [3584, 128, 1, 256]
    - [4, 3523.15]
  - - [448, 1408, 1, 3328]
    - [1, 4983.17]
  - - [2368, 2368, 1, 256]
    - [0, 5997.8]
  - - [4288, 128, 1, 3328]
    - [1, 4349.77]
  - - [128, 1408, 1, 768]
    - [5, 3098.72]
  - - [448, 4, 1, 256]
    - [7, 31.7585]
  - - [5056, 4, 1, 768]
    - [7, 313.421]
  - - [704, 6784, 1, 3328]
    - [0, 6019.95]
  - - [1408, 6784, 1, 1792]
    - [0, 6396.7]
  - - [448, 5888, 1, 3328]
    - [0, 5427.52]
  - - [1408, 64, 1, 768]
    - [1, 2306.83]
  - - [256, 3584, 1, 256]
    - [0, 4096.68]
  - - [448, 1024, 1, 1792]
    - [4, 4498.54]
  - - [256, 2944, 1, 3328]
    - [4, 5166.3]
  - - [256, 448, 1, 256]
    - [1, 1896.4]
  - - [4, 128, 1, 768]
    - [7, 13.7164]
  - - [5056, 6784, 1, 3328]
    - [0, 6736.59]
  - - [3584, 5888, 1, 256]
    - [3, 6145.03]
  - - [5888, 64, 1, 768]
    - [1, 4242.01]
  - - [2368, 128, 1, 1792]
    - [1, 3731.57]
  - - [2944, 3584, 1, 256]
    - [0, 6160.6]
  - - [704, 2944, 1, 256]
    - [0, 5662.2]
  - - [64, 5056, 1, 768]
    - [5, 3509.25]
  - - [5888, 128, 1, 768]
    - [4, 4920.55]
  - - [4, 5056, 1, 256]
    - [7, 252.32]
  - - [5056, 1408, 1, 3328]
    - [0, 6464.07]
  - - [1408, 704, 1, 256]
    - [6, 4641.8]
  - - [5888, 704, 1, 768]
    - [6, 5898.45]
  - - [5888, 2944, 1, 768]
    - [0, 6468.64]
  - - [5056, 5888, 1, 768]
    - [0, 6685.29]
  - - [6784, 2944, 1, 3328]
    - [0, 6620.74]
  - - [2944, 5056, 1, 3328]
    - [0, 6599.11]
  - - [64, 64, 1, 3328]
    - [5, 187.203]
  - - [1024, 704, 1, 768]
    - [4, 4588.16]
  - - [1408, 2944, 1, 768]
    - [0, 6312.59]
  - - [4288, 3584, 1, 256]
    - [0, 6365.23]
  - - [4, 5888, 1, 768]
    - [7, 369.972]
  - - [448, 2944, 1, 3328]
    - [0, 5164.73]
  - - [2944, 4, 1, 768]
    - [7, 210.501]
  - - [1024, 3584, 1, 1792]
    - [0, 6051.62]
  - - [1856, 2944, 1, 3328]
    - [0, 6277.26]
  - - [256, 6784, 1, 3328]
    - [4, 5340.89]
  - - [64, 5888, 1, 256]
    - [4, 3049.87]
  - - [5888, 5888, 1, 256]
    - [3, 6317.54]
  - - [1408, 4288, 1, 1792]
    - [0, 6321.97]
  - - [2368, 4, 1, 1792]
    - [7, 180.143]
  - - [256, 1024, 1, 256]
    - [2, 2813.55]
  - - [5056, 5888, 1, 256]
    - [0, 6495.09]
  - - [2368, 704, 1, 768]
    - [4, 5068.58]
  - - [4, 448, 1, 768]
    - [7, 39.3626]
  - - [1856, 1408, 1, 256]
    - [0, 5898.9]
  - - [128, 1024, 1, 1792]
    - [5, 3369.64]
  - - [64, 704, 1, 1792]
    - [5, 1819.66]
  - - [4288, 256, 1, 1792]
    - [1, 4845.93]
  - - [4288, 4, 1, 3328]
    - [7, 160.606]
  - - [5056, 256, 1, 3328]
    - [4, 5523.44]
  - - [704, 704, 1, 256]
    - [4, 3983.29]
  - - [1408, 256, 1, 1792]
    - [1, 4444.33]
  - - [6784, 1408, 1, 1792]
    - [0, 6412.68]
  - - [1856, 64, 1, 768]
    - [1, 2981.88]
  - - [3584, 6784, 1, 256]
    - [3, 6176.19]
  - - [64, 5888, 1, 1792]
    - [1, 4457.77]
  - - [4288, 2368, 1, 256]
    - [0, 6148.85]
  - - [4, 3584, 1, 256]
    - [7, 198.181]
  - - [5056, 2368, 1, 1792]
    - [0, 6382.03]
  - - [64, 4, 1, 768]
    - [7, 5.49514]
  - - [6784, 5888, 1, 768]
    - [0, 6659.81]
  - - [704, 128, 1, 768]
    - [1, 2353.31]
  - - [448, 256, 1, 1792]
    - [1, 3416.86]
  - - [1024, 1408, 1, 768]
    - [0, 5115.74]
  - - [5056, 128, 1, 256]
    - [4, 3842.9]
  - - [5888, 1024, 1, 768]
    - [0, 6210.7]
  - - [5888, 448, 1, 1792]
    - [0, 5285.6]
  - - [4, 6784, 1, 256]
    - [7, 307.476]
  - - [256, 2368, 1, 256]
    - [4, 3491.68]
  - - [1024, 448, 1, 3328]
    - [4, 4559.83]
  - - [2944, 128, 1, 256]
    - [1, 3322.22]
  - - [3584, 704, 1, 1792]
    - [6, 5734.01]
  - - [5888, 5888, 1, 3328]
    - [0, 6693.45]
  - - [5888, 704, 1, 256]
    - [6, 5539.58]
  - - [6784, 1024, 1, 256]
    - [0, 6007.94]
  - - [1856, 1024, 1, 256]
    - [0, 5200.43]
  - - [704, 5888, 1, 1792]
    - [0, 6430.94]
  - - [6784, 5888, 1, 3328]
    - [0, 6730.82]
  - - [2944, 1408, 1, 1792]
    - [0, 6430.52]
  - - [4288, 6784, 1, 768]
    - [0, 6654.39]
  - - [448, 5888, 1, 256]
    - [0, 5121.42]
  - - [448, 128, 1, 768]
    - [5, 2022.19]
  - - [6784, 4, 1, 1792]
    - [7, 168.367]
  - - [2944, 1408, 1, 3328]
    - [0, 6463.84]
  - - [1856, 128, 1, 768]
    - [1, 3866.66]
  - - [256, 2944, 1, 256]
    - [4, 3940.4]
  - - [5056, 2944, 1, 256]
    - [0, 6386.23]
  - - [1408, 256, 1, 768]
    - [1, 4097.67]
  - - [704, 1024, 1, 256]
    - [4, 4215.53]
  - - [2368, 1856, 1, 256]
    - [0, 5642.21]
  - - [1024, 4, 1, 1792]
    - [7, 85.0545]
  - - [1856, 6784, 1, 768]
    - [0, 6398.18]
  - - [448, 1408, 1, 1792]
    - [1, 4859.76]
  - - [4288, 3584, 1, 1792]
    - [0, 6579.71]
  - - [1408, 5888, 1, 3328]
    - [0, 6596.52]
  - - [1856, 704, 1, 256]
    - [4, 5022.91]
  - - [1856, 5056, 1, 256]
    - [0, 6007.83]
  - - [1408, 704, 1, 3328]
    - [6, 5399.93]
  - - [64, 1856, 1, 768]
    - [1, 2953.3]
  - - [704, 6784, 1, 768]
    - [0, 5922.25]
  - - [4288, 128, 1, 768]
    - [1, 3982.18]
  - - [2368, 2944, 1, 256]
    - [0, 6064.1]
  - - [4, 1856, 1, 256]
    - [7, 109.646]
  - - [5056, 5888, 1, 3328]
    - [0, 6764.66]
  - - [3584, 1408, 1, 768]
    - [0, 6119.87]
  - - [704, 1408, 1, 3328]
    - [0, 5517.68]
  - - [4288, 5056, 1, 1792]
    - [0, 6640.53]
  - - [5056, 1408, 1, 768]
    - [0, 6370.89]
  - - [1408, 3584, 1, 768]
    - [0, 6222.49]
  - - [2944, 1024, 1, 768]
    - [0, 6032.69]
  - - [5056, 64, 1, 1792]
    - [1, 3987.76]
  - - [4288, 5056, 1, 768]
    - [0, 6558.57]
  - - [256, 6784, 1, 256]
    - [4, 4445.87]
  - - [1856, 3584, 1, 3328]
    - [0, 6493.94]
  - - [3584, 6784, 1, 1792]
    - [3, 6454.54]
  - - [256, 256, 1, 768]
    - [5, 2280.08]
  - - [3584, 2944, 1, 768]
    - [0, 6106.27]
  - - [64, 2368, 1, 768]
    - [5, 2601.43]
  - - [3584, 5056, 1, 256]
    - [3, 6048.28]
  - - [5888, 2368, 1, 1792]
    - [0, 6352.83]
  - - [6784, 128, 1, 256]
    - [0, 4208.96]
  - - [704, 4, 1, 768]
    - [7, 60.824]
  - - [64, 1408, 1, 3328]
    - [1, 2831.1]
  - - [64, 1856, 1, 1792]
    - [1, 3483.13]
  - - [4, 2368, 1, 3328]
    - [7, 196.558]
  - - [448, 64, 1, 3328]
    - [5, 1272.87]
  - - [2944, 5056, 1, 1792]
    - [0, 6567.35]
  - - [3584, 4, 1, 3328]
    - [7, 180.565]
  - - [4288, 2944, 1, 256]
    - [0, 6287.25]
  - - [4, 3584, 1, 1792]
    - [7, 279.911]
  - - [256, 1024, 1, 1792]
    - [2, 4109.96]
  - - [256, 1856, 1, 3328]
    - [4, 4711.21]
  - - [4, 2368, 1, 256]
    - [7, 135.83]
  - - [256, 704, 1, 256]
    - [1, 2256.71]
  - - [4288, 128, 1, 1792]
    - [1, 4246.2]
  - - [128, 1408, 1, 256]
    - [5, 2289.86]
  - - [4, 1408, 1, 768]
    - [7, 117.488]
  - - [64, 128, 1, 3328]
    - [5, 373.269]
  - - [2944, 2944, 1, 3328]
    - [0, 6505.11]
  - - [5056, 6784, 1, 256]
    - [0, 6514.16]
  - - [1408, 4288, 1, 3328]
    - [0, 6359.85]
  - - [2368, 704, 1, 3328]
    - [1, 5219.29]
  - - [128, 4288, 1, 256]
    - [4, 3231.4]
  - - [4, 4, 1, 1792]
    - [7, 0.346831]
  - - [1024, 4288, 1, 768]
    - [3, 5226.04]
  - - [128, 128, 1, 3328]
    - [5, 743.519]
  - - [5056, 1856, 1, 256]
    - [0, 6011.17]
  - - [2944, 1856, 1, 768]
    - [0, 6132.98]
  - - [128, 5888, 1, 1792]
    - [4, 5088.55]
  - - [256, 128, 1, 256]
    - [5, 712.227]
  - - [2368, 1408, 1, 768]
    - [0, 5813.61]
  - - [704, 4288, 1, 256]
    - [0, 5624.03]
  - - [256, 448, 1, 3328]
    - [1, 3600.7]
  - - [256, 5056, 1, 3328]
    - [4, 5473.53]
  - - [128, 4, 1, 3328]
    - [7, 12.4071]
  - - [1024, 6784, 1, 1792]
    - [3, 6147.27]
  - - [6784, 3584, 1, 3328]
    - [0, 6690.99]
  - - [64, 6784, 1, 3328]
    - [4, 4335.69]
  - - [3584, 2944, 1, 1792]
    - [0, 6338.67]
  - - [4288, 1024, 1, 3328]
    - [0, 6124.72]
  - - [5056, 2368, 1, 3328]
    - [0, 6410.15]
  - - [2944, 4288, 1, 256]
    - [0, 6130.01]
  - - [2368, 64, 1, 256]
    - [5, 1983.91]
  - - [256, 256, 1, 256]
    - [5, 1451.82]
  - - [704, 128, 1, 3328]
    - [1, 2825.18]
  - - [128, 2944, 1, 768]
    - [1, 4116.89]
  - - [4, 704, 1, 768]
    - [7, 60.9517]
  - - [1408, 448, 1, 3328]
    - [1, 4988.44]
  - - [1024, 4, 1, 3328]
    - [7, 84.9592]
  - - [4, 2368, 1, 1792]
    - [7, 191.111]
  - - [4288, 4, 1, 1792]
    - [7, 151.38]
  - - [1856, 256, 1, 768]
    - [4, 4458.02]
  - - [448, 1856, 1, 1792]
    - [1, 4649.79]
  - - [128, 5888, 1, 768]
    - [4, 4865.39]
  - - [2368, 6784, 1, 3328]
    - [0, 6670.23]
  - - [3584, 128, 1, 768]
    - [4, 4231.53]
  - - [1024, 448, 1, 1792]
    - [4, 4448.06]
  - - [704, 6784, 1, 256]
    - [0, 5713.16]
  - - [1856, 4288, 1, 3328]
    - [0, 6344.33]
  - - [5888, 2368, 1, 768]
    - [0, 6273.86]
  - - [1408, 5888, 1, 256]
    - [0, 6142.96]
  - - [64, 256, 1, 1792]
    - [5, 704.004]
  - - [5888, 5056, 1, 768]
    - [3, 6484.99]
  - - [2368, 6784, 1, 256]
    - [0, 6376.23]
  - - [704, 1856, 1, 256]
    - [4, 5022.91]
  - - [4288, 1024, 1, 768]
    - [0, 6029.68]
  - - [1024, 2368, 1, 768]
    - [0, 5161.2]
  - - [1856, 128, 1, 1792]
    - [1, 4269.77]
  - - [448, 6784, 1, 768]
    - [0, 6084.22]
  - - [256, 3584, 1, 768]
    - [0, 4789.78]
  - - [1856, 4, 1, 1792]
    - [7, 144.837]
  - - [5888, 5056, 1, 256]
    - [3, 6244.75]
  - - [1408, 4, 1, 256]
    - [7, 93.13]
  - - [3584, 448, 1, 3328]
    - [1, 5025.88]
  - - [704, 2368, 1, 3328]
    - [1, 5202.61]
  - - [2944, 448, 1, 256]
    - [4, 4341.04]
  - - [3584, 448, 1, 768]
    - [4, 4864.66]
  - - [3584, 5888, 1, 1792]
    - [0, 6471.17]
  - - [4288, 448, 1, 256]
    - [4, 4899.59]
  - - [128, 704, 1, 1792]
    - [1, 2674.78]
  - - [4, 256, 1, 256]
    - [7, 21.3186]
  - - [5056, 448, 1, 1792]
    - [4, 5485.08]
  - - [5888, 2368, 1, 256]
    - [0, 5996.19]
  - - [1408, 704, 1, 1792]
    - [6, 5343.01]
  - - [704, 448, 1, 3328]
    - [1, 4006.12]
  - - [6784, 704, 1, 3328]
    - [0, 5987.19]
  - - [4, 5056, 1, 1792]
    - [7, 355.819]
  - - [704, 1408, 1, 1792]
    - [0, 5444.92]
  - - [1408, 2944, 1, 3328]
    - [0, 6463.84]
  - - [4288, 5888, 1, 1792]
    - [0, 6650.64]
  - - [5888, 2944, 1, 1792]
    - [0, 6539.05]
  - - [64, 1024, 1, 256]
    - [5, 1286.84]
  - - [2944, 6784, 1, 768]
    - [0, 6535.58]
  - - [128, 3584, 1, 256]
    - [4, 3446.53]
  - - [64, 5888, 1, 768]
    - [1, 3942.39]
  - - [1856, 448, 1, 3328]
    - [1, 4750.3]
  - - [256, 4, 1, 3328]
    - [7, 25.2084]
  - - [128, 5056, 1, 256]
    - [4, 3758.98]
  - - [2368, 704, 1, 256]
    - [4, 4777.19]
  - - [3584, 2368, 1, 256]
    - [3, 5505.95]
  - - [4288, 4288, 1, 256]
    - [0, 6277.81]
  - - [64, 1024, 1, 768]
    - [5, 1755.7]
  - - [64, 704, 1, 256]
    - [5, 943.697]
  - - [3584, 3584, 1, 3328]
    - [0, 6546.85]
  - - [448, 4288, 1, 1792]
    - [0, 5700.75]
  - - [128, 1024, 1, 256]
    - [5, 2116.67]
  - - [1408, 128, 1, 768]
    - [5, 3068.19]
  - - [4, 64, 1, 3328]
    - [7, 6.56094]
  - - [5888, 6784, 1, 256]
    - [3, 6349.21]
  - - [4288, 2944, 1, 3328]
    - [0, 6496.54]
  - - [1024, 5888, 1, 1792]
    - [3, 6176.51]
  - - [1024, 128, 1, 3328]
    - [1, 4063.96]
  - - [1408, 2368, 1, 768]
    - [0, 5765.13]
  - - [64, 128, 1, 1792]
    - [5, 354.522]
  - - [4288, 704, 1, 1792]
    - [6, 5757.05]
  - - [1856, 256, 1, 1792]
    - [4, 4681.98]
  - - [2944, 2944, 1, 1792]
    - [0, 6476.53]
  - - [3584, 64, 1, 1792]
    - [1, 4113.4]
  - - [1408, 5056, 1, 1792]
    - [0, 6418.3]
  - - [128, 6784, 1, 3328]
    - [1, 4870.48]
  - - [704, 704, 1, 768]
    - [4, 4633.42]
  - - [448, 4, 1, 1792]
    - [7, 44.9235]
  - - [1856, 448, 1, 1792]
    - [1, 4664.88]
  - - [448, 704, 1, 1792]
    - [1, 3874.97]
  - - [3584, 1024, 1, 3328]
    - [0, 6462.21]
  - - [704, 448, 1, 256]
    - [5, 2838.47]
  - - [1856, 704, 1, 1792]
    - [4, 5532.86]
  - - [6784, 1024, 1, 768]
    - [0, 6213.18]
  - - [6784, 2944, 1, 768]
    - [0, 6548.6]
  - - [256, 448, 1, 1792]
    - [1, 3416.86]
  - - [2944, 4288, 1, 768]
    - [0, 6373.59]
  - - [2368, 4, 1, 256]
    - [7, 143.575]
  - - [1024, 6784, 1, 3328]
    - [3, 6204.41]
  - - [64, 5888, 1, 3328]
    - [1, 4611.81]
  - - [4288, 6784, 1, 256]
    - [0, 6485.96]
  - - [5888, 64, 1, 1792]
    - [1, 4625.15]
  - - [1024, 1024, 1, 768]
    - [6, 5414.04]
  - - [5056, 2944, 1, 3328]
    - [0, 6612.29]
  - - [448, 5888, 1, 768]
    - [0, 5343.58]
  - - [6784, 704, 1, 1792]
    - [0, 5941.74]
  - - [448, 128, 1, 256]
    - [5, 1246.4]
  - - [1408, 1408, 1, 3328]
    - [0, 5943.71]
  - - [1024, 64, 1, 256]
    - [5, 1340.14]
  - - [256, 2944, 1, 768]
    - [4, 4724.2]
  - - [64, 3584, 1, 256]
    - [1, 2616.24]
  - - [128, 2944, 1, 3328]
    - [1, 4746.29]
  - - [3584, 704, 1, 256]
    - [4, 5193.45]
  - - [704, 1024, 1, 1792]
    - [4, 4853.76]
  - - [2368, 1856, 1, 768]
    - [0, 5981.43]
  - - [3584, 1408, 1, 3328]
    - [0, 6324.5]
  - - [3584, 4288, 1, 3328]
    - [3, 6509.92]
  - - [1856, 6784, 1, 256]
    - [0, 6237.68]
  - - [4288, 448, 1, 3328]
    - [6, 5438.66]
  - - [704, 64, 1, 3328]
    - [5, 1988.44]
  - - [1856, 4288, 1, 1792]
    - [0, 6318.64]
  - - [704, 3584, 1, 1792]
    - [0, 6117.92]
  - - [2368, 5888, 1, 1792]
    - [0, 6620.42]
  - - [1856, 5056, 1, 768]
    - [0, 6210.71]
  - - [5888, 1024, 1, 3328]
    - [0, 6352.86]
  - - [5888, 1408, 1, 768]
    - [0, 6453.84]
  - - [256, 4288, 1, 768]
    - [4, 4494.88]
  - - [2368, 4288, 1, 1792]
    - [0, 6471.72]
  - - [1024, 2368, 1, 1792]
    - [0, 5566.03]
  - - [1856, 448, 1, 768]
    - [1, 4414.08]
  - - [1024, 2944, 1, 3328]
    - [3, 6070.81]
  - - [704, 64, 1, 768]
    - [5, 1599.77]
  - - [128, 5056, 1, 1792]
    - [1, 4805.4]
  - - [1408, 3584, 1, 3328]
    - [0, 6352.86]
  - - [128, 6784, 1, 768]
    - [0, 4563.05]
  - - [2944, 1856, 1, 256]
    - [0, 5804.93]
  - - [2944, 4288, 1, 1792]
    - [0, 6458.92]
  - - [4, 448, 1, 3328]
    - [7, 39.543]
  - - [2944, 704, 1, 1792]
    - [6, 5829.41]
  - - [5888, 2944, 1, 3328]
    - [0, 6568.15]
  - - [448, 5056, 1, 1792]
    - [0, 5482.89]
  - - [5888, 5056, 1, 3328]
    - [0, 6624.28]
  - - [128, 5056, 1, 3328]
    - [1, 4996.63]
  - - [4288, 5056, 1, 256]
    - [0, 6316.4]
  - - [4288, 1856, 1, 256]
    - [0, 6000.03]
  - - [1856, 5888, 1, 256]
    - [0, 6331.41]
  - - [64, 448, 1, 3328]
    - [5, 1275.39]
  - - [448, 704, 1, 256]
    - [1, 2809.19]
  - - [4288, 4288, 1, 3328]
    - [0, 6592.81]
  - - [5888, 4288, 1, 768]
    - [0, 6481.22]
  - - [4, 2944, 1, 3328]
    - [7, 240.265]
  - - [5888, 1408, 1, 1792]
    - [0, 6562.45]
  - - [64, 1856, 1, 256]
    - [1, 2022.19]
  - - [2944, 2368, 1, 1792]
    - [0, 6282.78]
  - - [448, 64, 1, 768]
    - [5, 1039.39]
  - - [3584, 4, 1, 768]
    - [7, 253.638]
  - - [256, 4288, 1, 256]
    - [4, 3894.95]
  - - [6784, 2368, 1, 3328]
    - [0, 6468.0]
  - - [6784, 704, 1, 256]
    - [4, 5374.57]
  - - [64, 4, 1, 3328]
    - [7, 6.20687]
  - - [5888, 4, 1, 768]
    - [7, 255.42]
  - - [4288, 128, 1, 256]
    - [4, 3259.17]
  - - [4288, 1856, 1, 3328]
    - [0, 6340.95]
  - - [6784, 448, 1, 768]
    - [6, 5713.53]
  - - [2368, 2944, 1, 768]
    - [0, 6252.96]
  - - [5888, 4, 1, 1792]
    - [7, 166.84]
  - - [4, 1408, 1, 3328]
    - [7, 120.49]
  - - [1024, 64, 1, 1792]
    - [5, 2637.96]
  - - [4288, 448, 1, 768]
    - [6, 5262.03]
  - - [5056, 4288, 1, 3328]
    - [0, 6666.25]
  - - [4, 1024, 1, 768]
    - [7, 84.0924]
  - - [128, 5056, 1, 768]
    - [1, 4340.03]
  - - [6784, 2368, 1, 256]
    - [0, 6164.54]
  - - [1024, 4288, 1, 256]
    - [3, 4755.47]
  - - [2368, 448, 1, 1792]
    - [1, 4683.2]
  - - [5056, 3584, 1, 3328]
    - [0, 6682.57]
  - - [1408, 128, 1, 3328]
    - [5, 3555.97]
  - - [704, 4288, 1, 768]
    - [0, 6021.13]
  - - [4, 6784, 1, 3328]
    - [7, 341.497]
  - - [4288, 2944, 1, 1792]
    - [0, 6469.73]
  - - [5056, 5056, 1, 768]
    - [0, 6533.39]
  - - [3584, 256, 1, 256]
    - [4, 4261.89]
  - - [128, 1856, 1, 3328]
    - [1, 4419.56]
  - - [1024, 6784, 1, 256]
    - [3, 5495.02]
  - - [2944, 256, 1, 768]
    - [4, 4961.16]
  - - [448, 128, 1, 3328]
    - [5, 2506.13]
  - - [3584, 4288, 1, 1792]
    - [3, 6470.69]
  - - [64, 4288, 1, 3328]
    - [1, 3439.17]
  - - [1408, 1856, 1, 768]
    - [6, 5831.6]
  - - [448, 3584, 1, 768]
    - [4, 4840.62]
  - - [2368, 64, 1, 768]
    - [5, 2614.4]
  - - [128, 2944, 1, 256]
    - [1, 3176.35]
  - - [4, 5888, 1, 3328]
    - [7, 369.199]
  - - [1408, 448, 1, 768]
    - [1, 4544.72]
  - - [3584, 4288, 1, 256]
    - [3, 6056.04]
  - - [448, 1856, 1, 256]
    - [0, 3883.19]
  - - [1856, 6784, 1, 3328]
    - [0, 6476.63]
  - - [3584, 128, 1, 3328]
    - [4, 4574.0]
  - - [704, 448, 1, 1792]
    - [1, 3874.97]
  - - [64, 448, 1, 256]
    - [5, 631.129]
  - - [5888, 4288, 1, 256]
    - [3, 6156.39]
  - - [4, 1856, 1, 1792]
    - [7, 152.59]
  - - [704, 2944, 1, 1792]
    - [0, 6173.21]
  - - [3584, 1024, 1, 256]
    - [0, 5839.47]
  - - [6784, 64, 1, 1792]
    - [4, 4250.66]
  - - [704, 1856, 1, 768]
    - [4, 5401.45]
  - - [2944, 128, 1, 768]
    - [1, 4260.53]
  - - [1024, 2944, 1, 256]
    - [3, 5127.19]
  - - [448, 6784, 1, 3328]
    - [0, 6241.72]
  - - [1408, 1408, 1, 1792]
    - [0, 5902.63]
  - - [256, 2368, 1, 1792]
    - [1, 4604.43]
  - - [2368, 3584, 1, 1792]
    - [0, 6355.6]
  - - [2944, 1856, 1, 3328]
    - [0, 6261.57]
  - - [704, 2368, 1, 768]
    - [4, 5050.81]
  - - [2944, 448, 1, 768]
    - [0, 4806.4]
  - - [448, 5056, 1, 3328]
    - [0, 5518.05]
  - - [704, 4, 1, 3328]
    - [7, 58.061]
  - - [2368, 5056, 1, 1792]
    - [0, 6391.04]
  - - [5888, 256, 1, 3328]
    - [0, 5870.82]
  - - [1856, 5888, 1, 3328]
    - [0, 6668.97]
  - - [2944, 448, 1, 1792]
    - [0, 5018.32]
  - - [64, 5056, 1, 1792]
    - [1, 3879.08]
  - - [5888, 1856, 1, 768]
    - [0, 6206.55]
  - - [704, 3584, 1, 3328]
    - [0, 6154.7]
  - - [4, 4, 1, 256]
    - [7, 0.246851]
  - - [1408, 1024, 1, 768]
    - [0, 5435.72]
  - - [704, 128, 1, 256]
    - [1, 1448.45]
  - - [128, 64, 1, 1792]
    - [5, 353.886]
  - - [2368, 4288, 1, 3328]
    - [0, 6499.35]
  - - [4, 1408, 1, 256]
    - [7, 85.3662]
  - - [64, 64, 1, 256]
    - [5, 80.4277]
  - - [5056, 64, 1, 256]
    - [1, 2823.94]
  - - [704, 256, 1, 3328]
    - [5, 3552.84]
  - - [2944, 64, 1, 1792]
    - [5, 3572.15]
  - - [4, 4288, 1, 3328]
    - [7, 324.869]
  - - [3584, 5056, 1, 3328]
    - [0, 6513.72]
  - - [4288, 5888, 1, 256]
    - [0, 6432.8]
  - - [6784, 2368, 1, 1792]
    - [0, 6441.87]
  - - [448, 2944, 1, 256]
    - [0, 4699.03]
  - - [2944, 4, 1, 1792]
    - [7, 200.76]
  - - [2944, 6784, 1, 256]
    - [0, 6356.22]
  - - [1856, 2368, 1, 1792]
    - [0, 6079.71]
  - - [128, 3584, 1, 768]
    - [4, 4186.83]
  - - [5888, 128, 1, 3328]
    - [4, 5186.88]
  - - [2368, 3584, 1, 768]
    - [0, 6294.93]
  - - [1024, 256, 1, 1792]
    - [1, 4618.85]
  - - [4288, 4288, 1, 1792]
    - [0, 6570.87]
  - - [64, 2944, 1, 256]
    - [5, 2393.95]
  - - [2944, 128, 1, 1792]
    - [1, 4629.82]
  - - [256, 5888, 1, 256]
    - [0, 4735.66]
  - - [1856, 1408, 1, 3328]
    - [0, 6372.78]
  - - [128, 1024, 1, 768]
    - [5, 2891.34]
  - - [6784, 704, 1, 768]
    - [0, 5798.12]
  - - [1024, 4288, 1, 3328]
    - [0, 5785.58]
  - - [1408, 5056, 1, 768]
    - [0, 6270.22]
  - - [64, 704, 1, 768]
    - [5, 1605.3]
  - - [128, 4, 1, 1792]
    - [7, 12.6131]
  - - [5056, 448, 1, 256]
    - [4, 5163.58]
  - - [2944, 2368, 1, 3328]
    - [0, 6321.36]
  - - [704, 4288, 1, 3328]
    - [0, 6189.76]
  - - [1408, 128, 1, 256]
    - [5, 2315.38]
  - - [5056, 256, 1, 256]
    - [4, 4953.66]
  - - [6784, 1856, 1, 256]
    - [0, 6100.38]
  - - [5888, 6784, 1, 768]
    - [0, 6535.58]
  - - [2368, 5056, 1, 768]
    - [0, 6309.96]
  - - [128, 2368, 1, 3328]
    - [1, 3834.86]
  - - [5888, 128, 1, 1792]
    - [4, 5114.25]
  - - [1024, 5056, 1, 1792]
    - [3, 6282.81]
  - - [3584, 2368, 1, 768]
    - [0, 6074.6]
  - - [1024, 128, 1, 768]
    - [1, 3322.55]
  - - [128, 2944, 1, 1792]
    - [1, 4558.07]
  - - [1408, 2368, 1, 256]
    - [0, 5437.74]
  - - [6784, 128, 1, 1792]
    - [1, 4875.09]
  - - [2944, 704, 1, 3328]
    - [6, 5876.98]
  - - [4288, 64, 1, 1792]
    - [1, 3390.67]
  - - [256, 64, 1, 256]
    - [5, 349.525]
  - - [448, 448, 1, 768]
    - [1, 3329.39]
  - - [256, 5056, 1, 1792]
    - [4, 5393.96]
  - - [5056, 1024, 1, 256]
    - [0, 6157.11]
  - - [5888, 4, 1, 3328]
    - [7, 168.76]
  - - [6784, 256, 1, 3328]
    - [4, 5382.15]
  - - [1856, 1024, 1, 1792]
    - [0, 5664.29]
  - - [448, 256, 1, 768]
    - [1, 2965.22]
  - - [1024, 1408, 1, 1792]
    - [0, 5417.7]
  - - [6784, 5056, 1, 256]
    - [0, 6309.25]
  - - [5056, 128, 1, 3328]
    - [1, 5113.51]
  - - [2368, 448, 1, 3328]
    - [1, 4766.16]
  - - [256, 1408, 1, 768]
    - [1, 4005.44]
  - - [1408, 1856, 1, 1792]
    - [6, 5942.14]
  - - [2944, 128, 1, 3328]
    - [1, 4787.89]
  - - [448, 1024, 1, 256]
    - [4, 3653.01]
  - - [5056, 3584, 1, 256]
    - [0, 6440.14]
  - - [1856, 4, 1, 256]
    - [7, 119.893]
  - - [6784, 5056, 1, 1792]
    - [0, 6612.64]
  - - [64, 2368, 1, 3328]
    - [5, 3003.44]
  - - [256, 704, 1, 3328]
    - [5, 3562.23]
  - - [128, 704, 1, 768]
    - [1, 2347.4]
  - - [448, 128, 1, 1792]
    - [5, 2367.29]
  - - [1408, 4288, 1, 256]
    - [0, 5915.85]
  - - [1024, 64, 1, 768]
    - [5, 2242.44]
  - - [128, 256, 1, 256]
    - [5, 740.16]
  - - [64, 128, 1, 256]
    - [5, 208.164]
  - - [64, 3584, 1, 768]
    - [1, 3441.55]
  - - [6784, 1408, 1, 768]
    - [0, 6350.23]
  - - [4, 256, 1, 768]
    - [7, 27.3627]
  - - [2368, 1856, 1, 3328]
    - [0, 6117.52]
  - - [2368, 1024, 1, 1792]
    - [0, 5881.33]
  - - [2944, 704, 1, 256]
    - [4, 5251.23]
  - - [1856, 6784, 1, 1792]
    - [0, 6458.0]
  - - [6784, 448, 1, 1792]
    - [6, 5805.26]
  - - [704, 3584, 1, 256]
    - [0, 5684.36]
  - - [704, 2944, 1, 3328]
    - [0, 6212.63]
  - - [1856, 5056, 1, 3328]
    - [0, 6323.01]
  - - [2944, 1024, 1, 3328]
    - [0, 6184.47]
  - - [6784, 2944, 1, 1792]
    - [0, 6598.14]
  - - [704, 6784, 1, 1792]
    - [0, 5986.38]
  - - [2368, 256, 1, 256]
    - [4, 3575.09]
  - - [1408, 6784, 1, 256]
    - [0, 6121.01]
  - - [3584, 3584, 1, 256]
    - [3, 5937.09]
  - - [3584, 1408, 1, 1792]
    - [0, 6270.33]
  - - [4, 4288, 1, 1792]
    - [7, 318.2]
  - - [256, 4, 1, 1792]
    - [7, 24.9719]
  - - [256, 2368, 1, 3328]
    - [1, 4734.08]
  - - [704, 5056, 1, 1792]
    - [0, 6258.75]
  - - [2944, 1856, 1, 1792]
    - [0, 6233.92]
  - - [1024, 5888, 1, 768]
    - [3, 5987.62]
  - - [2368, 3584, 1, 256]
    - [0, 6125.77]
  - - [64, 2944, 1, 3328]
    - [5, 3699.73]
  - - [4288, 704, 1, 256]
    - [4, 5258.36]
  - - [2368, 2368, 1, 1792]
    - [0, 6392.96]
  - - [1024, 2944, 1, 768]
    - [3, 5738.08]
  - - [1856, 5888, 1, 768]
    - [0, 6567.39]
  - - [256, 256, 1, 1792]
    - [5, 2719.41]
  - - [4, 64, 1, 1792]
    - [7, 6.18064]
  - - [6784, 4288, 1, 256]
    - [0, 6306.53]
  - - [4288, 1408, 1, 1792]
    - [0, 6349.45]
  - - [5888, 256, 1, 256]
    - [0, 5004.06]
  - - [3584, 64, 1, 768]
    - [1, 3750.97]
  - - [128, 64, 1, 3328]
    - [5, 373.269]
  - - [448, 64, 1, 256]
    - [5, 623.199]
  - - [2944, 5056, 1, 768]
    - [0, 6478.45]
  - - [3584, 4, 1, 256]
    - [7, 197.387]
  - - [5888, 3584, 1, 1792]
    - [0, 6595.15]
  - - [6784, 2368, 1, 768]
    - [0, 6374.77]
  - - [6784, 6784, 1, 256]
    - [0, 6517.96]
  - - [256, 1856, 1, 256]
    - [4, 3508.61]
  - - [1408, 2368, 1, 3328]
    - [0, 5906.45]
  - - [2944, 4, 1, 3328]
    - [7, 202.628]
  - - [128, 1408, 1, 3328]
    - [5, 3551.29]
  - - [1856, 2944, 1, 1792]
    - [0, 6252.79]
  - - [1024, 3584, 1, 256]
    - [3, 4908.41]
  - - [448, 4, 1, 3328]
    - [7, 43.9222]
  - - [1408, 256, 1, 3328]
    - [1, 4559.1]
  - - [4, 6784, 1, 1792]
    - [7, 351.801]
  - - [2944, 1024, 1, 256]
    - [0, 5665.29]
  - - [5888, 128, 1, 256]
    - [4, 4348.24]
  - - [1856, 1408, 1, 1792]
    - [0, 6337.06]
  - - [2944, 5888, 1, 256]
    - [0, 6310.55]
  - - [1024, 4288, 1, 1792]
    - [0, 5576.88]
  - - [2368, 448, 1, 256]
    - [4, 4096.4]
  - - [4288, 256, 1, 3328]
    - [1, 4932.27]
  - - [5888, 448, 1, 3328]
    - [0, 5367.54]
  - - [64, 256, 1, 256]
    - [5, 410.321]
  - - [4, 128, 1, 1792]
    - [7, 14.8514]
  - - [2368, 1408, 1, 1792]
    - [0, 5896.05]
  - - [704, 704, 1, 1792]
    - [4, 4875.84]
  - - [2368, 2368, 1, 768]
    - [0, 6295.25]
  - - [128, 2368, 1, 768]
    - [1, 3412.08]
  - - [3584, 256, 1, 768]
    - [6, 4818.9]
  - - [64, 2368, 1, 256]
    - [5, 1877.26]
  - - [2944, 64, 1, 768]
    - [5, 3212.92]
  - - [2944, 256, 1, 256]
    - [4, 4362.84]
  - - [256, 3584, 1, 3328]
    - [0, 5085.85]
  - - [128, 1856, 1, 768]
    - [1, 3801.01]
  - - [64, 4288, 1, 768]
    - [5, 2988.73]
  - - [4288, 704, 1, 3328]
    - [6, 5804.08]
  - - [448, 3584, 1, 256]
    - [4, 4548.33]
  - - [128, 256, 1, 3328]
    - [5, 1457.59]
  - - [1408, 448, 1, 256]
    - [4, 3739.19]
  - - [1024, 1408, 1, 3328]
    - [0, 5541.11]
  - - [3584, 4288, 1, 768]
    - [3, 6371.08]
  - - [448, 1856, 1, 768]
    - [0, 4398.32]
  - - [1408, 4, 1, 3328]
    - [7, 115.381]
  - - [5888, 3584, 1, 256]
    - [3, 6161.12]
  - - [5056, 4288, 1, 1792]
    - [0, 6640.11]
  - - [6784, 3584, 1, 256]
    - [0, 6408.9]
  - - [1408, 1856, 1, 3328]
    - [6, 5983.07]
  - - [4, 4, 1, 3328]
    - [7, 0.372646]
  - - [64, 256, 1, 768]
    - [5, 606.669]
  - - [4288, 64, 1, 256]
    - [5, 2489.27]
  - - [3584, 1856, 1, 256]
    - [0, 5460.46]
  - - [2944, 5888, 1, 3328]
    - [0, 6579.08]
  - - [704, 64, 1, 256]
    - [5, 985.504]
  - - [256, 704, 1, 768]
    - [5, 3078.29]
  - - [1408, 6784, 1, 3328]
    - [0, 6426.44]
  - - [4288, 2368, 1, 768]
    - [0, 6396.94]
  - - [4288, 1024, 1, 1792]
    - [0, 6094.26]
  - - [6784, 4288, 1, 768]
    - [0, 6518.2]
  - - [1408, 64, 1, 3328]
    - [1, 2843.03]
  - - [6784, 4, 1, 256]
    - [7, 326.763]
  - - [1856, 1856, 1, 768]
    - [0, 5924.74]
  - - [448, 1024, 1, 3328]
    - [4, 4550.76]
  - - [448, 4288, 1, 3328]
    - [0, 5752.97]
  - - [4288, 3584, 1, 768]
    - [0, 6519.94]
  - - [5056, 2944, 1, 1792]
    - [0, 6586.45]
  - - [704, 2368, 1, 256]
    - [4, 4757.46]
  - - [4288, 4288, 1, 768]
    - [0, 6497.12]
  - - [5888, 1856, 1, 1792]
    - [0, 6322.33]
  - - [2368, 5888, 1, 256]
    - [0, 6355.23]
  - - [5056, 1856, 1, 768]
    - [0, 6220.24]
  - - [5056, 1024, 1, 768]
    - [0, 6408.51]
  - - [4288, 3584, 1, 3328]
    - [0, 6601.92]
  - - [128, 2368, 1, 256]
    - [1, 2679.05]
  - - [4288, 1408, 1, 768]
    - [0, 6281.55]
  - - [2944, 1408, 1, 256]
    - [0, 6062.36]
  - - [64, 4, 1, 1792]
    - [7, 6.06566]
  - - [1408, 1024, 1, 256]
    - [0, 4913.95]
  - - [4, 5056, 1, 768]
    - [7, 326.602]
  - - [3584, 1856, 1, 768]
    - [6, 5849.0]
  - - [256, 128, 1, 1792]
    - [5, 1373.85]
  - - [704, 1408, 1, 768]
    - [0, 5305.58]
  - - [6784, 6784, 1, 3328]
    - [0, 6781.46]
  - - [4288, 5888, 1, 768]
    - [0, 6600.19]
  - - [704, 5056, 1, 3328]
    - [0, 6301.56]
  - - [256, 1856, 1, 768]
    - [4, 4309.8]
  - - [448, 2944, 1, 768]
    - [0, 5038.4]
  - - [5888, 3584, 1, 3328]
    - [0, 6634.56]
  - - [2944, 6784, 1, 1792]
    - [0, 6578.38]
  - - [4, 1024, 1, 3328]
    - [7, 83.0047]
  - - [2368, 2944, 1, 3328]
    - [0, 6335.81]
  - - [256, 6784, 1, 1792]
    - [4, 5300.72]
  - - [1856, 3584, 1, 1792]
    - [0, 6467.31]
  - - [5056, 1408, 1, 1792]
    - [0, 6442.07]
  - - [1408, 64, 1, 256]
    - [5, 1482.94]
  - - [64, 2944, 1, 1792]
    - [5, 3547.12]
  - - [256, 5888, 1, 768]
    - [0, 5456.58]
  - - [1856, 1856, 1, 1792]
    - [0, 6046.98]
  - - [1856, 1856, 1, 256]
    - [0, 5607.54]
  - - [6784, 6784, 1, 768]
    - [0, 6691.82]
  - - [4288, 1408, 1, 3328]
    - [0, 6372.4]
  - - [64, 704, 1, 3328]
    - [5, 1969.11]
  - - [64, 1408, 1, 1792]
    - [1, 2674.78]
  - - [2368, 2944, 1, 1792]
    - [0, 6308.39]
  - - [1024, 1856, 1, 1792]
    - [3, 5505.57]
  - - [5888, 704, 1, 3328]
    - [6, 6038.19]
  - - [64, 448, 1, 1792]
    - [5, 1206.29]
  - - [256, 1024, 1, 3328]
    - [2, 4236.47]
  - - [1024, 4, 1, 768]
    - [7, 88.8423]
  - - [1024, 128, 1, 256]
    - [5, 2068.39]
  - - [1856, 1024, 1, 768]
    - [0, 5559.94]
  - - [1408, 2368, 1, 1792]
    - [0, 5866.89]
  - - [5888, 1408, 1, 3328]
    - [0, 6595.82]
  - - [256, 5056, 1, 256]
    - [4, 4292.85]
  - - [2944, 2944, 1, 768]
    - [0, 6405.24]
  - - [1408, 5888, 1, 768]
    - [0, 6457.23]
  - - [1856, 5888, 1, 1792]
    - [0, 6640.75]
  - - [4, 5056, 1, 3328]
    - [7, 367.262]
  - - [6784, 256, 1, 768]
    - [4, 5267.93]
  - - [128, 256, 1, 768]
    - [5, 1167.49]
  - - [4, 1856, 1, 3328]
    - [7, 157.33]
  - - [448, 256, 1, 256]
    - [5, 1852.08]
  - - [128, 128, 1, 1792]
    - [5, 705.255]
  - - [128, 448, 1, 1792]
    - [5, 2379.49]
  - - [128, 5888, 1, 3328]
    - [4, 5171.04]
  - - [1024, 5056, 1, 256]
    - [3, 5395.82]
  - - [2368, 1408, 1, 3328]
    - [0, 5923.27]
  - - [6784, 1024, 1, 1792]
    - [0, 6280.28]
  - - [5888, 448, 1, 256]
    - [4, 4989.68]
  - - [2368, 4, 1, 3328]
    - [7, 184.941]
  - - [704, 256, 1, 1792]
    - [5, 3424.9]
  - - [128, 704, 1, 256]
    - [1, 1462.03]
  - - [256, 1408, 1, 3328]
    - [1, 4562.95]
  - - [6784, 4, 1, 3328]
    - [7, 169.75]
  - - [704, 4, 1, 1792]
    - [7, 62.6706]
  - - [1024, 64, 1, 3328]
    - [5, 2812.17]
  - - [2368, 4, 1, 768]
    - [7, 175.679]
  - - [2368, 5888, 1, 768]
    - [0, 6550.78]
  - - [6784, 1408, 1, 256]
    - [0, 6188.72]
  - - [5056, 1856, 1, 1792]
    - [0, 6292.77]
  - - [4288, 4, 1, 256]
    - [7, 208.718]
  - - [2368, 1024, 1, 256]
    - [0, 5459.32]
  - - [2368, 6784, 1, 1792]
    - [0, 6645.66]
  - - [5056, 704, 1, 768]
    - [6, 5749.98]
  - - [1024, 448, 1, 768]
    - [4, 4212.79]
  - - [1856, 4288, 1, 768]
    - [0, 6233.0]
  - - [4, 1408, 1, 1792]
    - [7, 115.17]
  - - [704, 3584, 1, 768]
    - [0, 5995.73]
  - - [1408, 5888, 1, 1792]
    - [0, 6560.52]
  - - [3584, 3584, 1, 768]
    - [0, 6310.41]
  - - [64, 256, 1, 3328]
    - [5, 742.021]
  - - [5888, 64, 1, 3328]
    - [1, 4797.39]
  - - [5056, 1024, 1, 1792]
    - [0, 6483.48]
  - - [1408, 1024, 1, 3328]
    - [0, 5631.68]
  - - [2368, 256, 1, 3328]
    - [1, 4790.71]
  - - [1408, 6784, 1, 768]
    - [0, 6328.32]
  - - [5056, 5888, 1, 1792]
    - [0, 6741.95]
  - - [4, 4, 1, 768]
    - [7, 0.329791]
  - - [1408, 64, 1, 1792]
    - [1, 2678.07]
  - - [448, 1024, 1, 768]
    - [4, 4281.05]
  - - [704, 5056, 1, 256]
    - [0, 5761.66]
  - - [3584, 448, 1, 1792]
    - [4, 4942.45]
  - - [5056, 2368, 1, 256]
    - [0, 6115.37]
  - - [1856, 256, 1, 3328]
    - [4, 4751.06]
  - - [2368, 256, 1, 768]
    - [1, 4395.13]
  - - [448, 5056, 1, 768]
    - [4, 5398.62]
  - - [2368, 3584, 1, 3328]
    - [0, 6378.26]
  - - [3584, 5888, 1, 3328]
    - [0, 6565.32]
  - - [128, 4, 1, 256]
    - [7, 10.7896]
  - - [2368, 128, 1, 768]
    - [1, 3449.54]
  - - [4288, 5056, 1, 3328]
    - [0, 6665.57]
  - - [5056, 6784, 1, 768]
    - [0, 6665.94]
  - - [5888, 704, 1, 1792]
    - [6, 5998.9]
  - - [5056, 448, 1, 3328]
    - [4, 5507.6]
  - - [4288, 1408, 1, 256]
    - [0, 6092.02]
  - - [2368, 6784, 1, 768]
    - [0, 6586.01]
  - - [6784, 64, 1, 3328]
    - [4, 4328.96]
  - - [64, 1856, 1, 3328]
    - [1, 3716.31]
  - - [1024, 1024, 1, 256]
    - [6, 4645.9]
  - - [448, 64, 1, 1792]
    - [5, 1204.2]
  - - [4, 704, 1, 1792]
    - [7, 63.9056]
  - - [2944, 5056, 1, 256]
    - [0, 6150.3]
  - - [3584, 4, 1, 1792]
    - [7, 218.669]
  - - [256, 128, 1, 3328]
    - [5, 1444.72]
  - - [1024, 704, 1, 1792]
    - [4, 4820.23]
  - - [1408, 2944, 1, 1792]
    - [0, 6425.58]
  - - [256, 1856, 1, 1792]
    - [4, 4616.17]
  - - [1856, 64, 1, 3328]
    - [1, 3721.49]
  - - [64, 1024, 1, 1792]
    - [5, 2157.03]
  - - [1024, 3584, 1, 768]
    - [0, 5517.69]
  - - [1856, 2944, 1, 256]
    - [0, 5975.76]
  - - [5888, 5888, 1, 1792]
    - [0, 6650.21]
  - - [1408, 4288, 1, 768]
    - [0, 6206.8]
  - - [4, 2368, 1, 768]
    - [7, 187.412]
  - - [5056, 704, 1, 1792]
    - [6, 5858.48]
  - - [2368, 704, 1, 1792]
    - [4, 5136.15]
  - - [128, 4288, 1, 768]
    - [1, 3724.17]
  - - [2368, 448, 1, 768]
    - [1, 4449.37]
  - - [1856, 4, 1, 768]
    - [7, 143.87]
  - - [4288, 256, 1, 768]
    - [1, 4579.88]
  - - [2368, 256, 1, 1792]
    - [1, 4688.32]
  - - [1408, 4, 1, 768]
    - [7, 114.718]
  - - [2944, 1408, 1, 768]
    - [0, 6324.67]
  - - [1024, 5056, 1, 3328]
    - [3, 6386.34]
  - - [1024, 1856, 1, 3328]
    - [3, 5592.85]
  - - [3584, 64, 1, 256]
    - [1, 2810.99]
  - - [4288, 2944, 1, 768]
    - [0, 6424.59]
  - - [4, 2944, 1, 1792]
    - [7, 229.927]
  - - [1856, 64, 1, 1792]
    - [1, 3487.32]
  - - [128, 4288, 1, 3328]
    - [1, 4268.46]
  - - [256, 64, 1, 768]
    - [5, 606.669]
  - - [4, 256, 1, 3328]
    - [7, 26.3339]
  - - [128, 704, 1, 3328]
    - [1, 2817.31]
  - - [3584, 2944, 1, 3328]
    - [0, 6377.15]
  - - [128, 1856, 1, 256]
    - [1, 2821.43]
  - - [64, 4288, 1, 256]
    - [5, 2463.43]
  - - [4, 3584, 1, 3328]
    - [7, 287.661]
  - - [448, 3584, 1, 1792]
    - [4, 4945.59]
  - - [2368, 64, 1, 1792]
    - [5, 2898.24]
  - - [704, 128, 1, 1792]
    - [1, 2678.07]
  - - [1408, 448, 1, 1792]
    - [1, 4864.41]
  - - [5888, 2944, 1, 256]
    - [3, 6198.25]
  - - [1856, 64, 1, 256]
    - [5, 1964.2]
  - - [5056, 2368, 1, 768]
    - [0, 6320.24]
  - - [448, 1856, 1, 3328]
    - [1, 4759.98]
  - - [3584, 448, 1, 256]
    - [4, 4578.35]
  - - [5056, 4288, 1, 256]
    - [0, 6324.39]
  - - [1024, 448, 1, 256]
    - [4, 3446.53]
  - - [256, 2944, 1, 1792]
    - [4, 5077.22]
  - - [6784, 1024, 1, 3328]
    - [0, 6308.63]
  - - [704, 2944, 1, 768]
    - [0, 6052.97]
  - - [4288, 64, 1, 768]
    - [1, 3119.81]
  - - [256, 4, 1, 256]
    - [7, 20.456]
  - - [704, 5888, 1, 768]
    - [0, 6336.78]
  - - [5056, 1408, 1, 256]
    - [0, 6189.24]
  - - [5056, 5056, 1, 1792]
    - [0, 6593.01]
  - - [704, 1856, 1, 1792]
    - [4, 5533.83]
  - - [6784, 4, 1, 768]
    - [7, 285.335]
  - - [1408, 1408, 1, 768]
    - [0, 5783.28]
  - - [256, 2368, 1, 768]
    - [1, 4206.85]
  - - [448, 4288, 1, 768]
    - [0, 5566.45]
  - - [64, 64, 1, 768]
    - [5, 137.431]
  - - [2368, 5888, 1, 3328]
    - [0, 6644.35]
  - - [704, 2368, 1, 1792]
    - [4, 5133.53]
  - - [4, 64, 1, 256]
    - [7, 5.42764]
  - - [704, 1024, 1, 3328]
    - [4, 4944.7]
  - - [128, 6784, 1, 256]
    - [0, 4105.27]
  - - [448, 2368, 1, 256]
    - [4, 4091.8]
  - - [4288, 448, 1, 1792]
    - [6, 5383.75]
  - - [448, 1408, 1, 768]
    - [1, 4541.57]
  - - [5888, 4288, 1, 3328]
    - [0, 6638.31]
  - - [256, 5888, 1, 3328]
    - [0, 5840.44]
  - - [1856, 128, 1, 256]
    - [1, 2932.23]
  - - [2944, 6784, 1, 3328]
    - [0, 6609.72]
  - - [5888, 5056, 1, 1792]
    - [0, 6563.87]
  - - [5056, 4288, 1, 768]
    - [0, 6567.76]
  - - [1408, 1024, 1, 1792]
    - [0, 5578.88]
  - - [5056, 4, 1, 256]
    - [7, 269.857]
  - - [128, 64, 1, 768]
    - [5, 311.112]
  - - [4, 4288, 1, 256]
    - [7, 227.987]
  - - [2368, 4288, 1, 256]
    - [0, 6158.56]
  - - [1024, 2368, 1, 3328]
    - [0, 5734.03]
  - - [256, 1024, 1, 768]
    - [2, 3753.92]
  - - [5888, 4288, 1, 1792]
    - [0, 6595.77]
  - - [704, 1408, 1, 256]
    - [0, 4831.64]
  - - [448, 4, 1, 768]
    - [7, 42.2249]
  - - [4288, 5888, 1, 3328]
    - [0, 6670.56]
  - - [1408, 3584, 1, 1792]
    - [0, 6320.32]
  - - [256, 1408, 1, 256]
    - [1, 3098.75]
  - - [6784, 6784, 1, 1792]
    - [0, 6754.83]
  - - [448, 448, 1, 1792]
    - [1, 3612.6]
  - - [1856, 3584, 1, 256]
    - [0, 6158.19]
  - - [1024, 256, 1, 768]
    - [1, 4093.17]
  - - [128, 448, 1, 3328]
    - [5, 2530.76]
  - - [1856, 256, 1, 256]
    - [4, 3854.57]
  - - [3584, 6784, 1, 768]
    - [3, 6391.02]
  - - [448, 6784, 1, 256]
    - [0, 5761.6]
  - - [64, 448, 1, 768]
    - [5, 1039.39]
  - - [4, 128, 1, 3328]
    - [7, 13.1745]
  - - [3584, 2368, 1, 1792]
    - [0, 6225.52]
  - - [704, 256, 1, 768]
    - [5, 3114.23]
  - - [448, 2368, 1, 3328]
    - [1, 4768.54]
  - - [64, 1408, 1, 256]
    - [1, 1482.99]
  - - [5056, 256, 1, 1792]
    - [4, 5484.67]
  - - [2944, 2368, 1, 256]
    - [0, 5923.94]
  - - [1856, 448, 1, 256]
    - [4, 3893.74]
  - - [4288, 6784, 1, 1792]
    - [0, 6699.29]
  - - [1024, 1856, 1, 256]
    - [3, 4542.28]
  - - [5888, 6784, 1, 1792]
    - [0, 6652.24]
  - - [1024, 704, 1, 3328]
    - [4, 4933.4]
  - - [1024, 5888, 1, 3328]
    - [3, 6248.52]
  - - [1024, 128, 1, 1792]
    - [1, 3788.34]
  - - [5888, 2368, 1, 3328]
    - [0, 6393.1]
  - - [128, 3584, 1, 1792]
    - [4, 4451.62]
  - - [256, 64, 1, 3328]
    - [5, 736.086]
  - - [256, 5056, 1, 768]
    - [4, 5110.21]
  - - [2944, 2944, 1, 256]
    - [0, 6173.35]
  - - [1408, 4, 1, 1792]
    - [7, 115.268]
  - - [5888, 4, 1, 256]
    - [7, 300.347]
  - - [2944, 3584, 1, 768]
    - [0, 6353.82]
  - - [448, 704, 1, 768]
    - [1, 3597.28]
  - - [4, 2944, 1, 768]
    - [7, 217.244]
  - - [1408, 5056, 1, 3328]
    - [0, 6447.0]
  - - [3584, 704, 1, 768]
    - [6, 5626.88]
  - - [2368, 5056, 1, 3328]
    - [0, 6411.52]
  - - [128, 128, 1, 256]
    - [5, 413.293]
  - - [5888, 5888, 1, 768]
    - [0, 6564.57]
  - - [448, 704, 1, 3328]
    - [1, 4007.26]
  - - [448, 2368, 1, 768]
    - [1, 4399.54]
  - - [1024, 5056, 1, 768]
    - [3, 6037.98]
  - - [1856, 704, 1, 3328]
    - [4, 5574.29]
  - - [4, 448, 1, 256]
    - [7, 28.9397]
  - - [5888, 6784, 1, 3328]
    - [0, 6690.42]
  - - [1856, 2368, 1, 256]
    - [0, 5716.53]
  - - [5888, 3584, 1, 768]
    - [0, 6531.55]
  - - [5888, 448, 1, 768]
    - [4, 5196.36]
  - - [704, 256, 1, 256]
    - [5, 2324.01]
  - - [6784, 448, 1, 3328]
    - [6, 5854.73]
  - - [3584, 64, 1, 3328]
    - [1, 4288.49]
- null
