src/Tensile/data/Configs/miopen/archives/dlrm/2020-04-02/exact/arcturus_Cijk_Alik_Bljk_SB.yaml
- {MinimumRequiredVersion: 4.17.0}
- arcturus
- gfx908
- [Device 7380, Device 7388, Device 738c, Device 7390, Device 731f]
    SolutionIndex: 0
    SolutionNameMin: Cijk_Alik_Bljk_SB_MT32x256x8_MI32x32x1x2_SE_FL0_GRVW1_LPA0_LPB0_ONLL0_PLR0_SNLL1_TT1_32_USFGRO0
    SolutionIndex: 1
    SolutionNameMin: Cijk_Alik_Bljk_SB_MT64x128x32_MI32x32x1x2_SE_FL0_GRVW4_LPA1_LPB1_ONLL1_PLR1_SNLL1_TT1_32_USFGRO1
    SolutionIndex: 2
    SolutionNameMin: Cijk_Alik_Bljk_SB_MT64x256x16_MI32x32x1x2_SE_FL1_GRVW4_LPA0_LPB1_ONLL1_PLR1_SNLL1_TT1_64_USFGRO1
    SolutionIndex: 3
    SolutionNameMin: Cijk_Alik_Bljk_SB_MT32x128x16_MI32x32x2x1_SE_FL0_GRVW4_LPA1_LPB1_ONLL0_PLR0_SNLL0_TT1_32_USFGRO0
    SolutionIndex: 4
    SolutionNameMin: Cijk_Alik_Bljk_SB_MT32x128x8_MI32x32x2x1_SE_FL0_GRVW4_LPA1_LPB0_ONLL0_PLR1_SNLL0_TT1_32_USFGRO0
    SolutionIndex: 5
    SolutionNameMin: Cijk_Alik_Bljk_SB_MT32x128x16_MI32x32x2x1_SE_FL0_GRVW4_LPA0_LPB1_ONLL0_PLR1_SNLL1_TT1_32_USFGRO0
    SolutionIndex: 6
    SolutionNameMin: Cijk_Alik_Bljk_SB_MT32x128x32_MI32x32x2x1_SE_FL0_GRVW4_LPA1_LPB1_ONLL0_PLR1_SNLL1_TT1_32_USFGRO1
    SolutionIndex: 7
    SolutionNameMin: Cijk_Alik_Bljk_SB_MT32x128x32_MI32x32x2x1_SE_FL0_GRVW4_LPA1_LPB1_ONLL0_PLR1_SNLL0_TT1_32_USFGRO1
    SolutionIndex: 8
    SolutionNameMin: Cijk_Alik_Bljk_SB_MT32x128x32_MI32x32x2x1_SE_FL1_GRVW4_LPA1_LPB1_ONLL0_PLR1_SNLL1_TT1_32_USFGRO1
    SolutionIndex: 9
    SolutionNameMin: Cijk_Alik_Bljk_SB_MT64x128x32_MI32x32x2x1_SE_FL0_GRVW4_LPA1_LPB1_ONLL0_PLR1_SNLL1_TT2_32_USFGRO1
    SolutionIndex: 10
    SolutionNameMin: Cijk_Alik_Bljk_SB_MT64x64x8_MI16x16x4x1_SE_FL0_GRVW1_LPA0_LPB1_ONLL0_PLR0_SNLL0_TT4_16_USFGRO0
    SolutionIndex: 11
    SolutionNameMin: Cijk_Alik_Bljk_SB_MT64x64x16_MI16x16x4x1_SE_FL0_GRVW4_LPA1_LPB0_ONLL0_PLR1_SNLL0_TT4_16_USFGRO0
    SolutionIndex: 12
    SolutionNameMin: Cijk_Alik_Bljk_SB_MT64x64x32_MI16x16x4x1_SE_FL0_GRVW4_LPA1_LPB1_ONLL0_PLR1_SNLL0_TT4_16_USFGRO1
    SolutionIndex: 13
    SolutionNameMin: Cijk_Alik_Bljk_SB_MT64x64x16_MI16x16x4x1_SE_FL1_GRVW1_LPA1_LPB1_ONLL1_PLR1_SNLL0_TT4_16_USFGRO0
- - - [5, 5, 1, 64, 5, 5, 64, 64]
    - [4, 0.27397259191128837]
  - - [16, 128, 1, 64, 16, 16, 64, 64]
    - [3, 20.0]
  - - [27, 27, 1, 16, 27, 27, 16, 16]
    - [0, 2.0]
  - - [64, 128, 1, 256, 64, 64, 256, 256]
    - [8, 234.0]
  - - [64, 512, 1, 1024, 64, 64, 1024, 1024]
    - [12, 1349.0]
  - - [128, 1, 1, 256, 128, 128, 256, 256]
    - [5, 4.0]
  - - [256, 128, 1, 512, 256, 256, 512, 512]
    - [6, 1336.0]
  - - [512, 1, 1, 2048, 512, 512, 2048, 2048]
    - [7, 31.0]
  - - [512, 128, 1, 13, 512, 512, 13, 13]
    - [10, 205.0]
  - - [512, 128, 1, 367, 512, 512, 367, 367]
    - [11, 1952.0]
  - - [1024, 512, 1, 1024, 1024, 1024, 1024, 1024]
    - [1, 15115.0]
  - - [1024, 512, 1, 1600, 1024, 1024, 1600, 1600]
    - [9, 17106.0]
  - - [2048, 512, 1, 74, 2048, 2048, 74, 74]
    - [13, 6598.0]
  - - [2048, 512, 1, 2048, 2048, 2048, 2048, 2048]
    - [2, 16220.0]
- null
