src/Tensile/data/Configs/miopen/archives/mlperf/2019-05-03/exact/vega20_Cijk_Ailk_Bjlk_SB.yaml
- {MinimumRequiredVersion: 4.9.4}
- vega20
- gfx906
- [Device 66a0, Device 66a1, Device 66a7]
    SolutionIndex: 0
    SolutionNameMin: Cijk_Ailk_Bjlk_SB_MT64x64x8_SE_EPS1_FL0_GRVW1_NLCA1_NLCB1_PGR1_PLR0_SNLL1_TT4_4_USFGRO1_VW1_WGM1
    SolutionIndex: 1
    SolutionNameMin: Cijk_Ailk_Bjlk_SB_MT64x64x8_SE_EPS0_FL0_GRVW1_NLCA1_NLCB1_PGR0_PLR1_SNLL0_TT4_4_USFGRO1_VW1_WGM1
    SolutionIndex: 2
    SolutionNameMin: Cijk_Ailk_Bjlk_SB_MT64x32x8_SE_EPS0_FL0_GRVW1_NLCA1_NLCB1_PGR0_PLR1_SNLL0_TT4_2_USFGRO1_VW1_WGM1
    SolutionIndex: 3
    SolutionNameMin: Cijk_Ailk_Bjlk_SB_MT64x128x8_SE_EPS1_FL0_GRVW1_NLCA1_NLCB1_PGR1_PLR0_SNLL1_TT4_8_USFGRO1_VW1_WGM1
    SolutionIndex: 4
    SolutionNameMin: Cijk_Ailk_Bjlk_SB_MT64x32x8_SE_EPS0_FL0_GRVW1_NLCA1_NLCB1_PGR0_PLR0_SNLL0_TT4_4_USFGRO1_VW1_WGM1
    SolutionIndex: 5
    SolutionNameMin: Cijk_Ailk_Bjlk_SB_MT64x32x8_SE_EPS0_FL0_GRVW1_NLCA1_NLCB1_PGR0_PLR1_SNLL0_TT4_4_USFGRO1_VW1_WGM1
    SolutionIndex: 6
    SolutionNameMin: Cijk_Ailk_Bjlk_SB_MT64x16x8_SE_EPS0_FL0_GRVW1_NLCA1_NLCB1_PGR0_PLR0_SNLL0_TT4_2_USFGRO1_VW1_WGM1
    SolutionIndex: 7
    SolutionNameMin: Cijk_Ailk_Bjlk_SB_MT64x16x8_SE_EPS0_FL0_GRVW1_NLCA1_NLCB1_PGR0_PLR1_SNLL0_TT4_2_USFGRO1_VW1_WGM1
    SolutionIndex: 8
    SolutionNameMin: Cijk_Ailk_Bjlk_SB_MT64x64x8_SE_EPS1_FL0_GRVW1_NLCA1_NLCB1_PGR1_PLR0_SNLL1_TT4_4_USFGRO1_VW1_WGM8
    SolutionIndex: 9
    SolutionNameMin: Cijk_Ailk_Bjlk_SB_MT64x128x8_SE_EPS1_FL0_GRVW1_NLCA1_NLCB1_PGR1_PLR0_SNLL1_TT4_8_USFGRO1_VW1_WGM8
    SolutionIndex: 10
    SolutionNameMin: Cijk_Ailk_Bjlk_SB_MT64x32x8_SE_EPS0_FL0_GRVW1_NLCA1_NLCB1_PGR0_PLR0_SNLL0_TT4_4_USFGRO1_VW1_WGM8
    SolutionIndex: 11
    SolutionNameMin: Cijk_Ailk_Bjlk_SB_MT64x32x8_SE_EPS0_FL0_GRVW1_NLCA1_NLCB1_PGR0_PLR1_SNLL0_TT4_4_USFGRO1_VW1_WGM8
    SolutionIndex: 12
    SolutionNameMin: Cijk_Ailk_Bjlk_SB_MT64x16x8_SE_EPS0_FL0_GRVW1_NLCA1_NLCB1_PGR0_PLR1_SNLL0_TT4_2_USFGRO1_VW1_WGM8
    SolutionIndex: 13
    SolutionNameMin: Cijk_Ailk_Bjlk_SB_MT64x64x16_SE_EPS0_FL0_GRVW1_NLCA1_NLCB1_PGR0_PLR0_SNLL0_TT4_4_USFGRO1_VW1_WGM1
    SolutionIndex: 14
    SolutionNameMin: Cijk_Ailk_Bjlk_SB_MT64x16x16_SE_EPS0_FL0_GRVW1_NLCA1_NLCB1_PGR0_PLR0_SNLL0_TT4_2_USFGRO1_VW1_WGM1
    SolutionIndex: 15
    SolutionNameMin: Cijk_Ailk_Bjlk_SB_MT64x16x16_SE_EPS0_FL0_GRVW1_NLCA1_NLCB1_PGR0_PLR1_SNLL0_TT4_2_USFGRO1_VW1_WGM1
    SolutionIndex: 16
    SolutionNameMin: Cijk_Ailk_Bjlk_SB_MT64x32x32_SE_EPS0_FL0_GRVW1_NLCA1_NLCB1_PGR0_PLR1_SNLL0_TT4_2_USFGRO1_VW1_WGM8
    SolutionIndex: 17
    SolutionNameMin: Cijk_Ailk_Bjlk_SB_MT64x32x8_SE_EPS0_FL0_GRVW1_NLCA1_NLCB1_PGR0_PLR0_SNLL0_TT4_4_USFGRO1_VW4_WGM1
    SolutionIndex: 18
    SolutionNameMin: Cijk_Ailk_Bjlk_SB_MT64x32x8_SE_EPS0_FL0_GRVW1_NLCA1_NLCB1_PGR0_PLR1_SNLL0_TT4_4_USFGRO1_VW4_WGM1
    SolutionIndex: 19
    SolutionNameMin: Cijk_Ailk_Bjlk_SB_MT64x32x8_SE_EPS0_FL0_GRVW1_NLCA1_NLCB1_PGR0_PLR0_SNLL0_TT4_4_USFGRO1_VW4_WGM8
    SolutionIndex: 20
    SolutionNameMin: Cijk_Ailk_Bjlk_SB_MT64x32x8_SE_EPS0_FL0_GRVW1_NLCA1_NLCB1_PGR0_PLR1_SNLL0_TT4_4_USFGRO1_VW4_WGM8
    SolutionIndex: 21
    SolutionNameMin: Cijk_Ailk_Bjlk_SB_MT64x64x8_SE_EPS1_FL0_GRVW4_NLCA1_NLCB1_PGR1_PLR1_SNLL1_TT8_4_USFGRO0_VW4_WGM1
    SolutionIndex: 22
    SolutionNameMin: Cijk_Ailk_Bjlk_SB_MT64x64x16_SE_EPS1_FL0_GRVW4_NLCA1_NLCB1_PGR1_PLR1_SNLL1_TT4_4_USFGRO0_VW4_WGM1
    SolutionIndex: 23
    SolutionNameMin: Cijk_Ailk_Bjlk_SB_MT64x64x16_SE_EPS1_FL1_GRVW4_NLCA1_NLCB1_PGR1_PLR1_SNLL1_TT4_4_USFGRO0_VW4_WGM1
    SolutionIndex: 24
    SolutionNameMin: Cijk_Ailk_Bjlk_SB_MT64x128x16_SE_EPS1_FL0_GRVW4_NLCA1_NLCB1_PGR1_PLR1_SNLL1_TT4_8_USFGRO0_VW4_WGM1
    SolutionIndex: 25
    SolutionNameMin: Cijk_Ailk_Bjlk_SB_MT128x64x16_SE_EPS1_FL0_GRVW4_NLCA1_NLCB1_PGR1_PLR1_SNLL1_TT8_4_USFGRO0_VW4_WGM1
    SolutionIndex: 26
    SolutionNameMin: Cijk_Ailk_Bjlk_SB_MT128x64x16_SE_EPS1_FL1_GRVW4_NLCA1_NLCB1_PGR1_PLR1_SNLL1_TT8_4_USFGRO0_VW4_WGM1
    SolutionIndex: 27
    SolutionNameMin: Cijk_Ailk_Bjlk_SB_MT128x128x16_SE_EPS1_FL0_GRVW4_NLCA1_NLCB1_PGR1_PLR1_SNLL1_TT8_8_USFGRO0_VW4_WGM1
    SolutionIndex: 28
    SolutionNameMin: Cijk_Ailk_Bjlk_SB_MT128x128x16_SE_EPS1_FL1_GRVW4_NLCA1_NLCB1_PGR1_PLR1_SNLL1_TT8_8_USFGRO0_VW4_WGM1
    SolutionIndex: 29
    SolutionNameMin: Cijk_Ailk_Bjlk_SB_MT64x64x16_SE_EPS1_FL0_GRVW4_NLCA1_NLCB1_PGR1_PLR1_SNLL1_TT4_4_USFGRO0_VW4_WGM8
    SolutionIndex: 30
    SolutionNameMin: Cijk_Ailk_Bjlk_SB_MT64x128x16_SE_EPS1_FL0_GRVW4_NLCA1_NLCB1_PGR1_PLR1_SNLL1_TT4_8_USFGRO0_VW4_WGM8
    SolutionIndex: 31
    SolutionNameMin: Cijk_Ailk_Bjlk_SB_MT64x128x16_SE_EPS1_FL1_GRVW4_NLCA1_NLCB1_PGR1_PLR1_SNLL1_TT4_8_USFGRO0_VW4_WGM8
    SolutionIndex: 32
    SolutionNameMin: Cijk_Ailk_Bjlk_SB_MT128x64x16_SE_EPS1_FL0_GRVW4_NLCA1_NLCB1_PGR1_PLR1_SNLL1_TT8_4_USFGRO0_VW4_WGM8
    SolutionIndex: 33
    SolutionNameMin: Cijk_Ailk_Bjlk_SB_MT128x64x16_SE_EPS1_FL1_GRVW4_NLCA1_NLCB1_PGR1_PLR1_SNLL1_TT8_4_USFGRO0_VW4_WGM8
    SolutionIndex: 34
    SolutionNameMin: Cijk_Ailk_Bjlk_SB_MT128x128x16_SE_EPS1_FL0_GRVW4_NLCA1_NLCB1_PGR1_PLR1_SNLL1_TT8_8_USFGRO0_VW4_WGM8
    SolutionIndex: 35
    SolutionNameMin: Cijk_Ailk_Bjlk_SB_MT128x128x16_SE_EPS1_FL1_GRVW4_NLCA1_NLCB1_PGR1_PLR1_SNLL1_TT8_8_USFGRO0_VW4_WGM8
- - - [4096, 1024, 1, 2984, 4096, 4096, 4096, 1024]
    - [34, 9846.29]
  - - [1024, 4096, 1, 3437, 1024, 1024, 1024, 4096]
    - [35, 9915.7]
  - - [1024, 4096, 1, 3235, 1024, 1024, 1024, 4096]
    - [28, 9913.92]
  - - [4096, 1024, 1, 4032, 4096, 4096, 4096, 1024]
    - [34, 9925.96]
  - - [1024, 4096, 1, 3334, 1024, 1024, 1024, 4096]
    - [35, 9918.17]
  - - [4096, 1024, 1, 3288, 4096, 4096, 4096, 1024]
    - [35, 9854.57]
  - - [1024, 4096, 1, 3515, 1024, 1024, 1024, 4096]
    - [35, 9923.93]
  - - [4096, 1024, 1, 3437, 4096, 4096, 4096, 1024]
    - [35, 9869.53]
  - - [1024, 4096, 1, 3259, 1024, 1024, 1024, 4096]
    - [35, 9907.55]
  - - [1024, 4096, 1, 3384, 1024, 1024, 1024, 4096]
    - [27, 9921.11]
  - - [64, 92, 688, 92, 64, 64, 64, 92]
    - [5, 6137.79]
  - - [4096, 1024, 1, 3458, 4096, 4096, 4096, 1024]
    - [34, 9887.59]
  - - [1024, 4096, 1, 3412, 1024, 1024, 1024, 4096]
    - [34, 9930.46]
  - - [1024, 4096, 1, 3529, 1024, 1024, 1024, 4096]
    - [28, 9924.44]
  - - [1024, 4096, 1, 4032, 1024, 1024, 1024, 4096]
    - [35, 9963.38]
  - - [4096, 1024, 1, 3999, 4096, 4096, 4096, 1024]
    - [35, 9894.9]
  - - [1024, 4096, 1, 3079, 1024, 1024, 1024, 4096]
    - [28, 9894.48]
  - - [1024, 4096, 1, 3876, 1024, 1024, 1024, 4096]
    - [27, 9949.29]
  - - [1024, 4096, 1, 3450, 1024, 1024, 1024, 4096]
    - [35, 9915.55]
  - - [1024, 4096, 1, 3256, 1024, 1024, 1024, 4096]
    - [35, 9911.08]
  - - [4096, 1024, 1, 3403, 4096, 4096, 4096, 1024]
    - [34, 9858.83]
  - - [1024, 1024, 1, 3975, 1024, 1024, 1024, 1024]
    - [25, 8990.71]
  - - [1024, 4096, 1, 3359, 1024, 1024, 1024, 4096]
    - [35, 9914.9]
  - - [4096, 1024, 1, 3549, 4096, 4096, 4096, 1024]
    - [34, 9870.56]
  - - [4096, 1024, 1, 3176, 4096, 4096, 4096, 1024]
    - [35, 9855.82]
  - - [1024, 4096, 1, 3504, 1024, 1024, 1024, 4096]
    - [27, 9934.07]
  - - [4096, 1024, 1, 3314, 4096, 4096, 4096, 1024]
    - [34, 9873.8]
  - - [4096, 1024, 1, 3183, 4096, 4096, 4096, 1024]
    - [34, 9843.74]
  - - [1024, 4096, 1, 3209, 1024, 1024, 1024, 4096]
    - [28, 9904.87]
  - - [1024, 4096, 1, 3720, 1024, 1024, 1024, 4096]
    - [27, 9934.06]
  - - [1024, 4096, 1, 3859, 1024, 1024, 1024, 4096]
    - [27, 9952.43]
  - - [1024, 33708, 1, 4059, 1024, 1024, 1024, 33708]
    - [27, 10321.4]
  - - [1024, 4096, 1, 3968, 1024, 1024, 1024, 4096]
    - [27, 9955.86]
  - - [64, 123, 528, 123, 64, 64, 64, 123]
    - [0, 6916.11]
  - - [4096, 1024, 1, 3477, 4096, 4096, 4096, 1024]
    - [35, 9871.93]
  - - [4096, 1024, 1, 3233, 4096, 4096, 4096, 1024]
    - [35, 9862.25]
  - - [4096, 1024, 1, 3409, 4096, 4096, 4096, 1024]
    - [35, 9876.76]
  - - [4096, 1024, 1, 3564, 4096, 4096, 4096, 1024]
    - [35, 9870.39]
  - - [64, 102, 624, 100, 64, 64, 64, 102]
    - [0, 5773.06]
  - - [4096, 1024, 1, 3190, 4096, 4096, 4096, 1024]
    - [34, 9850.87]
  - - [64, 112, 576, 111, 64, 64, 64, 112]
    - [0, 6517.25]
  - - [1024, 4096, 1, 3288, 1024, 1024, 1024, 4096]
    - [34, 9911.8]
  - - [4096, 1024, 1, 3451, 4096, 4096, 4096, 1024]
    - [34, 9859.51]
  - - [1024, 4096, 1, 3348, 1024, 1024, 1024, 4096]
    - [27, 9915.37]
  - - [64, 102, 624, 102, 64, 64, 64, 102]
    - [0, 5783.6]
  - - [1024, 4096, 1, 3465, 1024, 1024, 1024, 4096]
    - [28, 9913.02]
  - - [1024, 33708, 1, 4032, 1024, 1024, 1024, 33708]
    - [27, 10340.3]
  - - [1024, 33708, 1, 3840, 1024, 1024, 1024, 33708]
    - [27, 10341.7]
  - - [4096, 1024, 1, 3391, 4096, 4096, 4096, 1024]
    - [35, 9861.67]
  - - [1024, 4096, 1, 3530, 1024, 1024, 1024, 4096]
    - [27, 9920.34]
  - - [4096, 1024, 1, 3209, 4096, 4096, 4096, 1024]
    - [34, 9846.9]
  - - [1024, 4096, 1, 3457, 1024, 1024, 1024, 4096]
    - [28, 9917.19]
  - - [1024, 4096, 1, 3386, 1024, 1024, 1024, 4096]
    - [27, 9917.55]
  - - [4096, 1024, 1, 3350, 4096, 4096, 4096, 1024]
    - [34, 9884.44]
  - - [1024, 4096, 1, 3184, 1024, 1024, 1024, 4096]
    - [35, 9925.88]
  - - [1024, 4096, 1, 3093, 1024, 1024, 1024, 4096]
    - [34, 9902.45]
  - - [64, 133, 480, 135, 64, 64, 64, 133]
    - [17, 6205.87]
  - - [1024, 4096, 1, 3400, 1024, 1024, 1024, 4096]
    - [27, 9917.0]
  - - [1024, 1024, 1, 4026, 1024, 1024, 1024, 1024]
    - [33, 9014.29]
  - - [1024, 4096, 1, 3214, 1024, 1024, 1024, 4096]
    - [27, 9895.84]
  - - [4096, 1024, 1, 3406, 4096, 4096, 4096, 1024]
    - [35, 9857.72]
  - - [1024, 4096, 1, 3565, 1024, 1024, 1024, 4096]
    - [34, 9919.27]
  - - [4096, 1024, 1, 3536, 4096, 4096, 4096, 1024]
    - [35, 9888.96]
  - - [1024, 4096, 1, 3183, 1024, 1024, 1024, 4096]
    - [34, 9907.45]
  - - [1024, 4096, 1, 3462, 1024, 1024, 1024, 4096]
    - [35, 9922.3]
  - - [4096, 1024, 1, 3130, 4096, 4096, 4096, 1024]
    - [28, 9845.94]
  - - [4096, 1024, 1, 3381, 4096, 4096, 4096, 1024]
    - [35, 9868.17]
  - - [4096, 1024, 1, 3298, 4096, 4096, 4096, 1024]
    - [34, 9870.44]
  - - [1024, 4096, 1, 3292, 1024, 1024, 1024, 4096]
    - [27, 9906.2]
  - - [4096, 1024, 1, 3289, 4096, 4096, 4096, 1024]
    - [34, 9856.45]
  - - [64, 160, 400, 159, 64, 64, 64, 160]
    - [20, 7427.74]
  - - [1024, 4096, 1, 3379, 1024, 1024, 1024, 4096]
    - [27, 9916.99]
  - - [1024, 4096, 1, 3990, 1024, 1024, 1024, 4096]
    - [28, 9947.27]
  - - [1024, 4096, 1, 3540, 1024, 1024, 1024, 4096]
    - [35, 9935.66]
  - - [4096, 1024, 1, 3412, 4096, 4096, 4096, 1024]
    - [35, 9867.46]
  - - [1024, 1024, 1, 3780, 1024, 1024, 1024, 1024]
    - [30, 9036.16]
  - - [1024, 4096, 1, 3555, 1024, 1024, 1024, 4096]
    - [34, 9927.27]
  - - [1024, 4096, 1, 3518, 1024, 1024, 1024, 4096]
    - [28, 9925.45]
  - - [4096, 1024, 1, 3189, 4096, 4096, 4096, 1024]
    - [34, 9861.14]
  - - [1024, 4096, 1, 3298, 1024, 1024, 1024, 4096]
    - [28, 9923.12]
  - - [4096, 1024, 1, 3072, 4096, 4096, 4096, 1024]
    - [34, 9871.98]
  - - [1024, 4096, 1, 3393, 1024, 1024, 1024, 4096]
    - [35, 9929.18]
  - - [1024, 4096, 1, 3207, 1024, 1024, 1024, 4096]
    - [27, 9912.71]
  - - [64, 228, 272, 232, 64, 64, 64, 228]
    - [23, 7350.04]
  - - [64, 23, 2720, 23, 64, 64, 64, 23]
    - [4, 2640.15]
  - - [4096, 1024, 1, 3487, 4096, 4096, 4096, 1024]
    - [35, 9860.81]
  - - [1024, 1024, 1, 3822, 1024, 1024, 1024, 1024]
    - [33, 8993.86]
  - - [64, 77, 816, 77, 64, 64, 64, 77]
    - [5, 5273.09]
  - - [4096, 1024, 1, 3431, 4096, 4096, 4096, 1024]
    - [35, 9867.43]
  - - [4096, 1024, 1, 3378, 4096, 4096, 4096, 1024]
    - [34, 9888.04]
  - - [4096, 1024, 1, 3529, 4096, 4096, 4096, 1024]
    - [28, 9879.4]
  - - [4096, 1024, 1, 3460, 4096, 4096, 4096, 1024]
    - [35, 9877.15]
  - - [1024, 4096, 1, 3336, 1024, 1024, 1024, 4096]
    - [27, 9912.31]
  - - [1024, 4096, 1, 3501, 1024, 1024, 1024, 4096]
    - [28, 9914.3]
  - - [64, 159, 400, 159, 64, 64, 64, 159]
    - [18, 7016.41]
  - - [1024, 4096, 1, 3584, 1024, 1024, 1024, 4096]
    - [35, 9940.49]
  - - [64, 135, 480, 134, 64, 64, 64, 135]
    - [18, 6241.29]
  - - [64, 99, 624, 99, 64, 64, 64, 99]
    - [9, 5617.29]
  - - [4096, 1024, 1, 2499, 4096, 4096, 4096, 1024]
    - [34, 9813.47]
  - - [1024, 1024, 1, 3942, 1024, 1024, 1024, 1024]
    - [30, 9059.91]
  - - [4096, 1024, 1, 3352, 4096, 4096, 4096, 1024]
    - [34, 9867.02]
  - - [1024, 4096, 1, 3543, 1024, 1024, 1024, 4096]
    - [35, 9928.67]
  - - [1024, 4096, 1, 3476, 1024, 1024, 1024, 4096]
    - [34, 9931.48]
  - - [1024, 33708, 1, 3822, 1024, 1024, 1024, 33708]
    - [27, 10324.6]
  - - [1024, 4096, 1, 3436, 1024, 1024, 1024, 4096]
    - [27, 9917.18]
  - - [1024, 1024, 1, 3861, 1024, 1024, 1024, 1024]
    - [26, 8998.39]
  - - [1024, 1024, 1, 4000, 1024, 1024, 1024, 1024]
    - [31, 9058.2]
  - - [1024, 4096, 1, 3594, 1024, 1024, 1024, 4096]
    - [27, 9927.78]
  - - [4096, 1024, 1, 3514, 4096, 4096, 4096, 1024]
    - [35, 9872.2]
  - - [1024, 4096, 1, 3064, 1024, 1024, 1024, 4096]
    - [34, 9907.0]
  - - [4096, 1024, 1, 3371, 4096, 4096, 4096, 1024]
    - [27, 9857.64]
  - - [4096, 1024, 1, 3558, 4096, 4096, 4096, 1024]
    - [35, 9876.21]
  - - [4096, 1024, 1, 3517, 4096, 4096, 4096, 1024]
    - [34, 9866.35]
  - - [4096, 1024, 1, 3144, 4096, 4096, 4096, 1024]
    - [34, 9846.26]
  - - [1024, 4096, 1, 3312, 1024, 1024, 1024, 4096]
    - [27, 9932.75]
  - - [4096, 1024, 1, 3079, 4096, 4096, 4096, 1024]
    - [34, 9851.0]
  - - [1024, 4096, 1, 3415, 1024, 1024, 1024, 4096]
    - [27, 9919.37]
  - - [1024, 4096, 1, 3221, 1024, 1024, 1024, 4096]
    - [34, 9908.08]
  - - [1024, 4096, 1, 3978, 1024, 1024, 1024, 4096]
    - [28, 9944.31]
  - - [4096, 1024, 1, 3876, 4096, 4096, 4096, 1024]
    - [34, 9898.89]
  - - [1024, 4096, 1, 3528, 1024, 1024, 1024, 4096]
    - [27, 9919.5]
  - - [1024, 4096, 1, 3181, 1024, 1024, 1024, 4096]
    - [35, 9894.76]
  - - [4096, 1024, 1, 3445, 4096, 4096, 4096, 1024]
    - [34, 9878.44]
  - - [4096, 1024, 1, 3450, 4096, 4096, 4096, 1024]
    - [27, 9864.72]
  - - [4096, 1024, 1, 3377, 4096, 4096, 4096, 1024]
    - [34, 9879.59]
  - - [1024, 4096, 1, 3532, 1024, 1024, 1024, 4096]
    - [28, 9928.09]
  - - [1024, 33708, 1, 3944, 1024, 1024, 1024, 33708]
    - [27, 10329.6]
  - - [4096, 1024, 1, 3483, 4096, 4096, 4096, 1024]
    - [34, 9861.73]
  - - [1024, 4096, 1, 3358, 1024, 1024, 1024, 4096]
    - [27, 9903.59]
  - - [4096, 1024, 1, 3464, 4096, 4096, 4096, 1024]
    - [34, 9876.74]
  - - [4096, 1024, 1, 3282, 4096, 4096, 4096, 1024]
    - [27, 9859.13]
  - - [4096, 1024, 1, 3256, 4096, 4096, 4096, 1024]
    - [35, 9855.0]
  - - [1024, 4096, 1, 3057, 1024, 1024, 1024, 4096]
    - [34, 9910.65]
  - - [4096, 1024, 1, 3481, 4096, 4096, 4096, 1024]
    - [34, 9866.19]
  - - [4096, 1024, 1, 3340, 4096, 4096, 4096, 1024]
    - [34, 9862.15]
  - - [1024, 1024, 1, 3870, 1024, 1024, 1024, 1024]
    - [33, 9082.35]
  - - [1024, 4096, 1, 3273, 1024, 1024, 1024, 4096]
    - [27, 9916.19]
  - - [64, 65, 992, 65, 64, 64, 64, 65]
    - [18, 4682.91]
  - - [4096, 1024, 1, 3392, 4096, 4096, 4096, 1024]
    - [28, 9881.02]
  - - [4096, 1024, 1, 3337, 4096, 4096, 4096, 1024]
    - [34, 9864.4]
  - - [4096, 1024, 1, 3359, 4096, 4096, 4096, 1024]
    - [34, 9874.32]
  - - [4096, 1024, 1, 3498, 4096, 4096, 4096, 1024]
    - [35, 9864.25]
  - - [4096, 1024, 1, 3169, 4096, 4096, 4096, 1024]
    - [34, 9851.0]
  - - [1024, 33708, 1, 3859, 1024, 1024, 1024, 33708]
    - [28, 10332.5]
  - - [64, 19, 3264, 19, 64, 64, 64, 19]
    - [4, 2182.04]
  - - [1024, 4096, 1, 3103, 1024, 1024, 1024, 4096]
    - [27, 9898.8]
  - - [4096, 1024, 1, 3900, 4096, 4096, 4096, 1024]
    - [34, 9897.02]
  - - [1024, 4096, 1, 3442, 1024, 1024, 1024, 4096]
    - [34, 9938.87]
  - - [1024, 4096, 1, 3248, 1024, 1024, 1024, 4096]
    - [34, 9939.82]
  - - [1024, 4096, 1, 3351, 1024, 1024, 1024, 4096]
    - [35, 9923.13]
  - - [4096, 1024, 1, 3593, 4096, 4096, 4096, 1024]
    - [34, 9894.26]
  - - [1024, 4096, 1, 3780, 1024, 1024, 1024, 4096]
    - [34, 9941.86]
  - - [64, 133, 480, 133, 64, 64, 64, 133]
    - [18, 6180.69]
  - - [1024, 33708, 1, 3681, 1024, 1024, 1024, 33708]
    - [27, 10332.2]
  - - [4096, 1024, 1, 3374, 4096, 4096, 4096, 1024]
    - [28, 9859.26]
  - - [1024, 4096, 1, 3557, 1024, 1024, 1024, 4096]
    - [27, 9928.1]
  - - [4096, 1024, 1, 3906, 4096, 4096, 4096, 1024]
    - [34, 9906.97]
  - - [4096, 1024, 1, 3504, 4096, 4096, 4096, 1024]
    - [34, 9885.95]
  - - [1024, 4096, 1, 3270, 1024, 1024, 1024, 4096]
    - [34, 9916.27]
  - - [4096, 1024, 1, 3098, 4096, 4096, 4096, 1024]
    - [27, 9854.66]
  - - [64, 232, 272, 232, 64, 64, 64, 232]
    - [23, 7394.0]
  - - [4096, 1024, 1, 3216, 4096, 4096, 4096, 1024]
    - [35, 9876.47]
  - - [64, 148, 432, 148, 64, 64, 64, 148]
    - [20, 6663.75]
  - - [1024, 4096, 1, 3550, 1024, 1024, 1024, 4096]
    - [34, 9920.18]
  - - [4096, 1024, 1, 3449, 4096, 4096, 4096, 1024]
    - [28, 9870.47]
  - - [1024, 4096, 1, 3403, 1024, 1024, 1024, 4096]
    - [35, 9908.11]
  - - [1024, 4096, 1, 3523, 1024, 1024, 1024, 4096]
    - [34, 9932.61]
  - - [1024, 4096, 1, 3486, 1024, 1024, 1024, 4096]
    - [34, 9917.36]
  - - [1024, 4096, 1, 3564, 1024, 1024, 1024, 4096]
    - [34, 9923.34]
  - - [1024, 33708, 1, 4005, 1024, 1024, 1024, 33708]
    - [27, 10339.4]
  - - [4096, 1024, 1, 3296, 4096, 4096, 4096, 1024]
    - [34, 9879.68]
  - - [1024, 4096, 1, 3263, 1024, 1024, 1024, 4096]
    - [27, 9907.07]
  - - [64, 25, 2512, 25, 64, 64, 64, 25]
    - [4, 2848.07]
  - - [1024, 4096, 1, 3130, 1024, 1024, 1024, 4096]
    - [35, 9900.0]
  - - [1024, 4096, 1, 3295, 1024, 1024, 1024, 4096]
    - [35, 9895.35]
  - - [1024, 33708, 1, 3925, 1024, 1024, 1024, 33708]
    - [28, 10342.2]
  - - [1024, 4096, 1, 3378, 1024, 1024, 1024, 4096]
    - [27, 9921.27]
  - - [4096, 1024, 1, 3720, 4096, 4096, 4096, 1024]
    - [35, 9885.72]
  - - [4096, 1024, 1, 3399, 4096, 4096, 4096, 1024]
    - [34, 9880.55]
  - - [4096, 1024, 1, 3543, 4096, 4096, 4096, 1024]
    - [35, 9870.63]
  - - [64, 9, 6544, 9, 64, 64, 64, 9]
    - [7, 955.07]
  - - [4096, 1024, 1, 3497, 4096, 4096, 4096, 1024]
    - [34, 9868.33]
  - - [4096, 1024, 1, 3594, 4096, 4096, 4096, 1024]
    - [35, 9876.78]
  - - [1024, 4096, 1, 3144, 1024, 1024, 1024, 4096]
    - [35, 9901.86]
  - - [1024, 4096, 1, 3975, 1024, 1024, 1024, 4096]
    - [28, 9950.09]
  - - [4096, 1024, 1, 3205, 4096, 4096, 4096, 1024]
    - [35, 9855.97]
  - - [1024, 33708, 1, 3995, 1024, 1024, 1024, 33708]
    - [27, 10331.0]
  - - [1024, 4096, 1, 3392, 1024, 1024, 1024, 4096]
    - [27, 9935.68]
  - - [1024, 4096, 1, 3055, 1024, 1024, 1024, 4096]
    - [35, 9893.15]
  - - [1024, 4096, 1, 4026, 1024, 1024, 1024, 4096]
    - [35, 9940.12]
  - - [4096, 1024, 1, 3557, 4096, 4096, 4096, 1024]
    - [34, 9883.9]
  - - [4096, 1024, 1, 3515, 4096, 4096, 4096, 1024]
    - [34, 9871.84]
  - - [4096, 1024, 1, 3486, 4096, 4096, 4096, 1024]
    - [35, 9860.64]
  - - [4096, 1024, 1, 3457, 4096, 4096, 4096, 1024]
    - [35, 9885.27]
  - - [1024, 4096, 1, 3511, 1024, 1024, 1024, 4096]
    - [27, 9928.14]
  - - [4096, 1024, 1, 3138, 4096, 4096, 4096, 1024]
    - [34, 9853.96]
  - - [1024, 4096, 1, 3339, 1024, 1024, 1024, 4096]
    - [28, 9912.79]
  - - [1024, 4096, 1, 3939, 1024, 1024, 1024, 4096]
    - [28, 9952.16]
  - - [4096, 1024, 1, 3500, 4096, 4096, 4096, 1024]
    - [28, 9863.52]
  - - [4096, 1024, 1, 3395, 4096, 4096, 4096, 1024]
    - [35, 9883.72]
  - - [4096, 1024, 1, 3968, 4096, 4096, 4096, 1024]
    - [35, 9920.26]
  - - [4096, 1024, 1, 4020, 4096, 4096, 4096, 1024]
    - [35, 9912.71]
  - - [4096, 1024, 1, 3942, 4096, 4096, 4096, 1024]
    - [34, 9910.07]
  - - [1024, 1024, 1, 4032, 1024, 1024, 1024, 1024]
    - [24, 9024.64]
  - - [4096, 1024, 1, 3349, 4096, 4096, 4096, 1024]
    - [35, 9865.94]
  - - [1024, 4096, 1, 3322, 1024, 1024, 1024, 4096]
    - [28, 9908.33]
  - - [4096, 1024, 1, 3452, 4096, 4096, 4096, 1024]
    - [34, 9872.59]
  - - [1024, 4096, 1, 3417, 1024, 1024, 1024, 4096]
    - [34, 9912.54]
  - - [1024, 1024, 1, 4012, 1024, 1024, 1024, 1024]
    - [32, 9085.37]
  - - [1024, 4096, 1, 3526, 1024, 1024, 1024, 4096]
    - [28, 9920.26]
  - - [4096, 1024, 1, 3485, 4096, 4096, 4096, 1024]
    - [28, 9861.54]
  - - [1024, 1024, 1, 3681, 1024, 1024, 1024, 1024]
    - [32, 8991.36]
  - - [4096, 1024, 1, 3303, 4096, 4096, 4096, 1024]
    - [35, 9861.2]
  - - [4096, 1024, 1, 3344, 4096, 4096, 4096, 1024]
    - [35, 9892.34]
  - - [1024, 4096, 1, 3479, 1024, 1024, 1024, 4096]
    - [35, 9921.67]
  - - [4096, 1024, 1, 3300, 4096, 4096, 4096, 1024]
    - [34, 9868.54]
  - - [1024, 4096, 1, 3439, 1024, 1024, 1024, 4096]
    - [28, 9918.19]
  - - [4096, 1024, 1, 3280, 4096, 4096, 4096, 1024]
    - [35, 9875.19]
  - - [1024, 4096, 1, 3245, 1024, 1024, 1024, 4096]
    - [27, 9910.39]
  - - [1024, 4096, 1, 3328, 1024, 1024, 1024, 4096]
    - [27, 9941.5]
  - - [4096, 1024, 1, 3418, 4096, 4096, 4096, 1024]
    - [27, 9870.66]
  - - [1024, 4096, 1, 3493, 1024, 1024, 1024, 4096]
    - [35, 9938.35]
  - - [1024, 4096, 1, 3500, 1024, 1024, 1024, 4096]
    - [27, 9916.83]
  - - [1024, 4096, 1, 3166, 1024, 1024, 1024, 4096]
    - [27, 9898.02]
  - - [4096, 1024, 1, 3126, 4096, 4096, 4096, 1024]
    - [28, 9846.94]
  - - [1024, 4096, 1, 3277, 1024, 1024, 1024, 4096]
    - [35, 9898.56]
  - - [1024, 4096, 1, 3315, 1024, 1024, 1024, 4096]
    - [34, 9923.01]
  - - [1024, 1024, 1, 3927, 1024, 1024, 1024, 1024]
    - [25, 8987.61]
  - - [1024, 4096, 1, 3414, 1024, 1024, 1024, 4096]
    - [27, 9915.91]
  - - [4096, 1024, 1, 3531, 4096, 4096, 4096, 1024]
    - [34, 9871.82]
  - - [4096, 1024, 1, 3484, 4096, 4096, 4096, 1024]
    - [27, 9867.76]
  - - [1024, 4096, 1, 3180, 1024, 1024, 1024, 4096]
    - [34, 9903.99]
  - - [4096, 1024, 1, 3360, 4096, 4096, 4096, 1024]
    - [34, 9879.47]
  - - [1024, 33708, 1, 3990, 1024, 1024, 1024, 33708]
    - [27, 10334.9]
  - - [4096, 1024, 1, 3466, 4096, 4096, 4096, 1024]
    - [34, 9874.92]
  - - [1024, 4096, 1, 3428, 1024, 1024, 1024, 4096]
    - [27, 9915.92]
  - - [1024, 4096, 1, 3137, 1024, 1024, 1024, 4096]
    - [34, 9913.17]
  - - [4096, 1024, 1, 4059, 4096, 4096, 4096, 1024]
    - [34, 9901.76]
  - - [1024, 4096, 1, 3353, 1024, 1024, 1024, 4096]
    - [34, 9914.5]
  - - [1024, 4096, 1, 3942, 1024, 1024, 1024, 4096]
    - [34, 9944.4]
  - - [4096, 1024, 1, 3506, 4096, 4096, 4096, 1024]
    - [27, 9875.65]
  - - [1024, 1024, 1, 3894, 1024, 1024, 1024, 1024]
    - [25, 8946.45]
  - - [4096, 1024, 1, 3508, 4096, 4096, 4096, 1024]
    - [35, 9877.57]
  - - [64, 132, 480, 135, 64, 64, 64, 132]
    - [18, 6164.76]
  - - [4096, 1024, 1, 3956, 4096, 4096, 4096, 1024]
    - [27, 9907.73]
  - - [64, 7, 8192, 7, 64, 64, 64, 7]
    - [6, 812.978]
  - - [1024, 4096, 1, 3272, 1024, 1024, 1024, 4096]
    - [28, 9909.72]
  - - [1024, 4096, 1, 3443, 1024, 1024, 1024, 4096]
    - [35, 9929.73]
  - - [1024, 4096, 1, 3375, 1024, 1024, 1024, 4096]
    - [35, 9909.13]
  - - [1024, 4096, 1, 3525, 1024, 1024, 1024, 4096]
    - [35, 9929.17]
  - - [4096, 1024, 1, 3472, 4096, 4096, 4096, 1024]
    - [34, 9889.87]
  - - [1024, 4096, 1, 3520, 1024, 1024, 1024, 4096]
    - [27, 9947.69]
  - - [4096, 1024, 1, 3322, 4096, 4096, 4096, 1024]
    - [34, 9862.88]
  - - [4096, 1024, 1, 3387, 4096, 4096, 4096, 1024]
    - [34, 9861.52]
  - - [64, 8, 7280, 8, 64, 64, 64, 8]
    - [12, 1024.0]
  - - [1024, 33708, 1, 3939, 1024, 1024, 1024, 33708]
    - [27, 10339.8]
  - - [4096, 1024, 1, 3345, 4096, 4096, 4096, 1024]
    - [35, 9873.58]
  - - [4096, 1024, 1, 2967, 4096, 4096, 4096, 1024]
    - [34, 9839.11]
  - - [1024, 4096, 1, 3453, 1024, 1024, 1024, 4096]
    - [27, 9905.71]
  - - [1024, 4096, 1, 3640, 1024, 1024, 1024, 4096]
    - [34, 9933.95]
  - - [4096, 1024, 1, 3291, 4096, 4096, 4096, 1024]
    - [28, 9860.74]
  - - [1024, 4096, 1, 3350, 1024, 1024, 1024, 4096]
    - [35, 9917.93]
  - - [4096, 1024, 1, 3417, 4096, 4096, 4096, 1024]
    - [34, 9864.51]
  - - [64, 135, 480, 135, 64, 64, 64, 135]
    - [18, 6265.35]
  - - [1024, 4096, 1, 3467, 1024, 1024, 1024, 4096]
    - [28, 9906.85]
  - - [1024, 4096, 1, 3491, 1024, 1024, 1024, 4096]
    - [34, 9933.2]
  - - [1024, 4096, 1, 3822, 1024, 1024, 1024, 4096]
    - [34, 9938.65]
  - - [4096, 1024, 1, 3292, 4096, 4096, 4096, 1024]
    - [34, 9849.11]
  - - [1024, 4096, 1, 3231, 1024, 1024, 1024, 4096]
    - [27, 9905.72]
  - - [1024, 4096, 1, 3364, 1024, 1024, 1024, 4096]
    - [28, 9930.22]
  - - [1024, 4096, 1, 3995, 1024, 1024, 1024, 4096]
    - [28, 9943.66]
  - - [1024, 4096, 1, 3545, 1024, 1024, 1024, 4096]
    - [27, 9928.43]
  - - [1024, 1024, 1, 3876, 1024, 1024, 1024, 1024]
    - [25, 9002.94]
  - - [1024, 4096, 1, 3186, 1024, 1024, 1024, 4096]
    - [27, 9920.91]
  - - [4096, 1024, 1, 3432, 4096, 4096, 4096, 1024]
    - [34, 9875.19]
  - - [64, 84, 752, 85, 64, 64, 64, 84]
    - [5, 5704.41]
  - - [4096, 1024, 1, 3367, 4096, 4096, 4096, 1024]
    - [28, 9867.96]
  - - [4096, 1024, 1, 3503, 4096, 4096, 4096, 1024]
    - [35, 9870.91]
  - - [1024, 4096, 1, 3095, 1024, 1024, 1024, 4096]
    - [28, 9902.8]
  - - [4096, 1024, 1, 3465, 4096, 4096, 4096, 1024]
    - [35, 9872.07]
  - - [1024, 4096, 1, 3402, 1024, 1024, 1024, 4096]
    - [34, 9914.56]
  - - [4096, 1024, 1, 3140, 4096, 4096, 4096, 1024]
    - [34, 9847.85]
  - - [1024, 1024, 1, 4050, 1024, 1024, 1024, 1024]
    - [31, 9055.65]
  - - [4096, 1024, 1, 3424, 4096, 4096, 4096, 1024]
    - [28, 9894.52]
  - - [4096, 1024, 1, 3257, 4096, 4096, 4096, 1024]
    - [27, 9860.87]
  - - [4096, 1024, 1, 2917, 4096, 4096, 4096, 1024]
    - [34, 9845.81]
  - - [1024, 33708, 1, 3640, 1024, 1024, 1024, 33708]
    - [27, 10321.6]
  - - [1024, 4096, 1, 3456, 1024, 1024, 1024, 4096]
    - [27, 9950.25]
  - - [1024, 4096, 1, 3014, 1024, 1024, 1024, 4096]
    - [27, 9907.87]
  - - [4096, 1024, 1, 3372, 4096, 4096, 4096, 1024]
    - [35, 9868.27]
  - - [64, 132, 480, 132, 64, 64, 64, 132]
    - [18, 6121.52]
  - - [1024, 4096, 1, 3294, 1024, 1024, 1024, 4096]
    - [35, 9903.13]
  - - [4096, 1024, 1, 3446, 4096, 4096, 4096, 1024]
    - [35, 9871.59]
  - - [1024, 4096, 1, 3389, 1024, 1024, 1024, 4096]
    - [28, 9909.17]
  - - [4096, 1024, 1, 3259, 4096, 4096, 4096, 1024]
    - [34, 9860.66]
  - - [4096, 1024, 1, 3544, 4096, 4096, 4096, 1024]
    - [34, 9878.66]
  - - [4096, 1024, 1, 3479, 4096, 4096, 4096, 1024]
    - [35, 9873.87]
  - - [4096, 1024, 1, 3542, 4096, 4096, 4096, 1024]
    - [34, 9878.87]
  - - [4096, 1024, 1, 3321, 4096, 4096, 4096, 1024]
    - [27, 9861.03]
  - - [1024, 4096, 1, 3147, 1024, 1024, 1024, 4096]
    - [27, 9894.67]
  - - [1024, 4096, 1, 3944, 1024, 1024, 1024, 4096]
    - [27, 9950.41]
  - - [4096, 1024, 1, 3870, 4096, 4096, 4096, 1024]
    - [35, 9881.64]
  - - [1024, 4096, 1, 3308, 1024, 1024, 1024, 4096]
    - [27, 9907.16]
  - - [4096, 1024, 1, 3401, 4096, 4096, 4096, 1024]
    - [34, 9864.49]
  - - [1024, 4096, 1, 3395, 1024, 1024, 1024, 4096]
    - [27, 9928.93]
  - - [64, 99, 624, 102, 64, 64, 64, 99]
    - [3, 5651.26]
  - - [1024, 4096, 1, 3563, 1024, 1024, 1024, 4096]
    - [34, 9922.66]
  - - [1024, 33708, 1, 3870, 1024, 1024, 1024, 33708]
    - [27, 10325.3]
  - - [4096, 1024, 1, 3494, 4096, 4096, 4096, 1024]
    - [34, 9875.27]
  - - [1024, 4096, 1, 3271, 1024, 1024, 1024, 4096]
    - [27, 9912.99]
  - - [1024, 33708, 1, 3910, 1024, 1024, 1024, 33708]
    - [27, 10341.4]
  - - [1024, 4096, 1, 3287, 1024, 1024, 1024, 4096]
    - [35, 9924.77]
  - - [1024, 33708, 1, 3860, 1024, 1024, 1024, 33708]
    - [27, 10330.6]
  - - [64, 143, 432, 148, 64, 64, 64, 143]
    - [20, 6571.68]
  - - [1024, 1024, 1, 3584, 1024, 1024, 1024, 1024]
    - [32, 8975.21]
  - - [64, 162, 400, 162, 64, 64, 64, 162]
    - [22, 6822.16]
  - - [4096, 1024, 1, 3341, 4096, 4096, 4096, 1024]
    - [34, 9854.56]
  - - [1024, 4096, 1, 3136, 1024, 1024, 1024, 4096]
    - [27, 9926.76]
  - - [4096, 1024, 1, 3439, 4096, 4096, 4096, 1024]
    - [34, 9854.23]
  - - [64, 148, 432, 147, 64, 64, 64, 148]
    - [18, 6677.51]
  - - [1024, 4096, 1, 3751, 1024, 1024, 1024, 4096]
    - [34, 9938.38]
  - - [1024, 4096, 1, 3301, 1024, 1024, 1024, 4096]
    - [34, 9919.05]
  - - [4096, 1024, 1, 3468, 4096, 4096, 4096, 1024]
    - [35, 9859.73]
  - - [1024, 4096, 1, 3416, 1024, 1024, 1024, 4096]
    - [35, 9918.42]
  - - [4096, 1024, 1, 3163, 4096, 4096, 4096, 1024]
    - [34, 9854.55]
  - - [1024, 4096, 1, 3230, 1024, 1024, 1024, 4096]
    - [28, 9897.44]
  - - [1024, 4096, 1, 3581, 1024, 1024, 1024, 4096]
    - [28, 9915.38]
  - - [1024, 1024, 1, 3960, 1024, 1024, 1024, 1024]
    - [30, 9045.76]
  - - [4096, 1024, 1, 3463, 4096, 4096, 4096, 1024]
    - [35, 9884.64]
  - - [1024, 4096, 1, 3478, 1024, 1024, 1024, 4096]
    - [28, 9926.92]
  - - [4096, 1024, 1, 3262, 4096, 4096, 4096, 1024]
    - [34, 9852.12]
  - - [1024, 4096, 1, 3438, 1024, 1024, 1024, 4096]
    - [34, 9912.58]
  - - [1024, 4096, 1, 3244, 1024, 1024, 1024, 4096]
    - [27, 9900.41]
  - - [1024, 4096, 1, 3445, 1024, 1024, 1024, 4096]
    - [27, 9920.22]
  - - [4096, 1024, 1, 3328, 4096, 4096, 4096, 1024]
    - [34, 9887.97]
  - - [1024, 4096, 1, 3492, 1024, 1024, 1024, 4096]
    - [28, 9937.12]
  - - [4096, 1024, 1, 3211, 4096, 4096, 4096, 1024]
    - [28, 9847.85]
  - - [1024, 4096, 1, 3910, 1024, 1024, 1024, 4096]
    - [35, 9946.47]
  - - [1024, 4096, 1, 3314, 1024, 1024, 1024, 4096]
    - [27, 9932.5]
  - - [4096, 1024, 1, 3859, 4096, 4096, 4096, 1024]
    - [34, 9902.74]
  - - [4096, 1024, 1, 3383, 4096, 4096, 4096, 1024]
    - [34, 9875.1]
  - - [1024, 4096, 1, 3409, 1024, 1024, 1024, 4096]
    - [35, 9926.69]
  - - [1024, 4096, 1, 4020, 1024, 1024, 1024, 4096]
    - [27, 9941.7]
  - - [4096, 1024, 1, 3530, 4096, 4096, 4096, 1024]
    - [34, 9872.71]
  - - [4096, 1024, 1, 3411, 4096, 4096, 4096, 1024]
    - [35, 9874.92]
  - - [1024, 4096, 1, 3566, 1024, 1024, 1024, 4096]
    - [35, 9921.0]
  - - [4096, 1024, 1, 3493, 4096, 4096, 4096, 1024]
    - [27, 9875.64]
  - - [4096, 1024, 1, 3184, 4096, 4096, 4096, 1024]
    - [34, 9873.04]
  - - [1024, 4096, 1, 3072, 1024, 1024, 1024, 4096]
    - [27, 9923.69]
  - - [1024, 4096, 1, 3431, 1024, 1024, 1024, 4096]
    - [28, 9910.93]
  - - [4096, 1024, 1, 3306, 4096, 4096, 4096, 1024]
    - [35, 9853.32]
  - - [1024, 4096, 1, 3352, 1024, 1024, 1024, 4096]
    - [35, 9913.22]
  - - [4096, 1024, 1, 3295, 4096, 4096, 4096, 1024]
    - [34, 9862.58]
  - - [64, 123, 528, 122, 64, 64, 64, 123]
    - [0, 6950.15]
  - - [1024, 4096, 1, 3517, 1024, 1024, 1024, 4096]
    - [28, 9919.96]
  - - [64, 102, 624, 101, 64, 64, 64, 102]
    - [8, 5791.39]
  - - [4096, 1024, 1, 3426, 4096, 4096, 4096, 1024]
    - [34, 9891.04]
  - - [4096, 1024, 1, 3385, 4096, 4096, 4096, 1024]
    - [34, 9868.31]
  - - [1024, 1024, 1, 3978, 1024, 1024, 1024, 1024]
    - [25, 9008.38]
  - - [4096, 1024, 1, 3572, 4096, 4096, 4096, 1024]
    - [27, 9884.71]
  - - [4096, 1024, 1, 3459, 4096, 4096, 4096, 1024]
    - [34, 9892.07]
  - - [1024, 4096, 1, 3374, 1024, 1024, 1024, 4096]
    - [35, 9908.42]
  - - [4096, 1024, 1, 3166, 4096, 4096, 4096, 1024]
    - [34, 9832.35]
  - - [4096, 1024, 1, 3093, 4096, 4096, 4096, 1024]
    - [35, 9841.15]
  - - [4096, 1024, 1, 3523, 4096, 4096, 4096, 1024]
    - [28, 9878.95]
  - - [4096, 1024, 1, 3413, 4096, 4096, 4096, 1024]
    - [28, 9880.71]
  - - [1024, 4096, 1, 3996, 1024, 1024, 1024, 4096]
    - [27, 9948.04]
  - - [1024, 4096, 1, 3452, 1024, 1024, 1024, 4096]
    - [35, 9915.87]
  - - [4096, 1024, 1, 3232, 4096, 4096, 4096, 1024]
    - [35, 9876.44]
  - - [4096, 1024, 1, 3400, 4096, 4096, 4096, 1024]
    - [27, 9867.05]
  - - [4096, 1024, 1, 3334, 4096, 4096, 4096, 1024]
    - [34, 9868.89]
  - - [1024, 4096, 1, 3345, 1024, 1024, 1024, 4096]
    - [27, 9920.5]
  - - [1024, 4096, 1, 3538, 1024, 1024, 1024, 4096]
    - [34, 9933.24]
  - - [1024, 4096, 1, 3466, 1024, 1024, 1024, 4096]
    - [34, 9920.75]
  - - [4096, 1024, 1, 3315, 4096, 4096, 4096, 1024]
    - [34, 9876.77]
  - - [4096, 1024, 1, 3214, 4096, 4096, 4096, 1024]
    - [35, 9847.83]
  - - [1024, 33708, 1, 3900, 1024, 1024, 1024, 33708]
    - [27, 10331.6]
  - - [64, 160, 400, 160, 64, 64, 64, 160]
    - [20, 7440.51]
  - - [1024, 4096, 1, 3367, 1024, 1024, 1024, 4096]
    - [34, 9926.22]
  - - [1024, 4096, 1, 2917, 1024, 1024, 1024, 4096]
    - [35, 9904.47]
  - - [1024, 1024, 1, 3995, 1024, 1024, 1024, 1024]
    - [26, 9000.23]
  - - [64, 132, 480, 134, 64, 64, 64, 132]
    - [18, 6146.78]
  - - [1024, 4096, 1, 3544, 1024, 1024, 1024, 4096]
    - [35, 9924.04]
  - - [4096, 1024, 1, 3414, 4096, 4096, 4096, 1024]
    - [35, 9867.8]
  - - [4096, 1024, 1, 3565, 4096, 4096, 4096, 1024]
    - [28, 9870.03]
  - - [1024, 4096, 1, 3512, 1024, 1024, 1024, 4096]
    - [34, 9919.74]
  - - [1024, 4096, 1, 3191, 1024, 1024, 1024, 4096]
    - [35, 9914.69]
  - - [64, 27, 2336, 27, 64, 64, 64, 27]
    - [2, 3054.61]
  - - [1024, 4096, 1, 3289, 1024, 1024, 1024, 4096]
    - [35, 9917.1]
  - - [4096, 1024, 1, 3290, 4096, 4096, 4096, 1024]
    - [34, 9858.31]
  - - [1024, 4096, 1, 3211, 1024, 1024, 1024, 4096]
    - [35, 9897.06]
  - - [1024, 33708, 1, 3969, 1024, 1024, 1024, 33708]
    - [28, 10336.0]
  - - [4096, 1024, 1, 3566, 4096, 4096, 4096, 1024]
    - [34, 9862.9]
  - - [64, 111, 576, 111, 64, 64, 64, 111]
    - [8, 6400.81]
  - - [1024, 4096, 1, 3459, 1024, 1024, 1024, 4096]
    - [34, 9922.93]
  - - [1024, 4096, 1, 3372, 1024, 1024, 1024, 4096]
    - [27, 9909.76]
  - - [4096, 1024, 1, 3339, 4096, 4096, 4096, 1024]
    - [34, 9859.2]
  - - [4096, 1024, 1, 3425, 4096, 4096, 4096, 1024]
    - [34, 9889.24]
  - - [4096, 1024, 1, 3388, 4096, 4096, 4096, 1024]
    - [34, 9871.57]
  - - [1024, 4096, 1, 3531, 1024, 1024, 1024, 4096]
    - [27, 9918.9]
  - - [4096, 1024, 1, 3286, 4096, 4096, 4096, 1024]
    - [35, 9868.32]
  - - [4096, 1024, 1, 3462, 4096, 4096, 4096, 1024]
    - [34, 9881.78]
  - - [1024, 4096, 1, 3388, 1024, 1024, 1024, 4096]
    - [27, 9904.59]
  - - [4096, 1024, 1, 3165, 4096, 4096, 4096, 1024]
    - [27, 9836.23]
  - - [4096, 1024, 1, 3304, 4096, 4096, 4096, 1024]
    - [34, 9857.45]
  - - [1024, 4096, 1, 2736, 1024, 1024, 1024, 4096]
    - [34, 9900.97]
  - - [4096, 1024, 1, 3397, 4096, 4096, 4096, 1024]
    - [34, 9872.0]
  - - [64, 38, 1680, 38, 64, 64, 64, 38]
    - [1, 3459.42]
  - - [1024, 4096, 1, 3311, 1024, 1024, 1024, 4096]
    - [35, 9908.22]
  - - [1024, 4096, 1, 3394, 1024, 1024, 1024, 4096]
    - [35, 9929.33]
  - - [4096, 1024, 1, 2736, 4096, 4096, 4096, 1024]
    - [34, 9833.78]
  - - [1024, 4096, 1, 3559, 1024, 1024, 1024, 4096]
    - [28, 9925.23]
  - - [4096, 1024, 1, 3180, 4096, 4096, 4096, 1024]
    - [34, 9837.95]
  - - [1024, 4096, 1, 3480, 1024, 1024, 1024, 4096]
    - [27, 9922.36]
  - - [4096, 1024, 1, 3318, 4096, 4096, 4096, 1024]
    - [34, 9867.77]
  - - [4096, 1024, 1, 3213, 4096, 4096, 4096, 1024]
    - [34, 9845.92]
  - - [1024, 4096, 1, 3286, 1024, 1024, 1024, 4096]
    - [34, 9912.04]
  - - [4096, 1024, 1, 3471, 4096, 4096, 4096, 1024]
    - [34, 9874.14]
  - - [1024, 4096, 1, 3381, 1024, 1024, 1024, 4096]
    - [35, 9922.86]
  - - [64, 100, 624, 100, 64, 64, 64, 100]
    - [9, 5705.14]
  - - [4096, 1024, 1, 3502, 4096, 4096, 4096, 1024]
    - [34, 9872.34]
  - - [64, 16, 3840, 16, 64, 64, 64, 16]
    - [15, 2091.57]
  - - [1024, 4096, 1, 3552, 1024, 1024, 1024, 4096]
    - [27, 9943.79]
  - - [4096, 1024, 1, 3519, 4096, 4096, 4096, 1024]
    - [35, 9869.85]
  - - [1024, 4096, 1, 3300, 1024, 1024, 1024, 4096]
    - [28, 9916.05]
  - - [1024, 4096, 1, 3419, 1024, 1024, 1024, 4096]
    - [27, 9913.96]
  - - [4096, 1024, 1, 4030, 4096, 4096, 4096, 1024]
    - [28, 9893.63]
  - - [4096, 1024, 1, 3976, 4096, 4096, 4096, 1024]
    - [35, 9898.25]
  - - [1024, 4096, 1, 3473, 1024, 1024, 1024, 4096]
    - [35, 9928.32]
  - - [1024, 1024, 1, 3977, 1024, 1024, 1024, 1024]
    - [32, 9009.23]
  - - [4096, 1024, 1, 3428, 4096, 4096, 4096, 1024]
    - [34, 9876.69]
  - - [1024, 4096, 1, 3433, 1024, 1024, 1024, 4096]
    - [28, 9923.82]
  - - [4096, 1024, 1, 3534, 4096, 4096, 4096, 1024]
    - [28, 9863.9]
  - - [4096, 1024, 1, 3461, 4096, 4096, 4096, 1024]
    - [34, 9873.02]
  - - [4096, 1024, 1, 3681, 4096, 4096, 4096, 1024]
    - [34, 9898.47]
  - - [4096, 1024, 1, 3495, 4096, 4096, 4096, 1024]
    - [35, 9875.98]
  - - [4096, 1024, 1, 3351, 4096, 4096, 4096, 1024]
    - [34, 9879.61]
  - - [1024, 4096, 1, 4059, 1024, 1024, 1024, 4096]
    - [27, 9948.51]
  - - [4096, 1024, 1, 3990, 4096, 4096, 4096, 1024]
    - [34, 9900.66]
  - - [1024, 4096, 1, 3325, 1024, 1024, 1024, 4096]
    - [28, 9903.2]
  - - [1024, 4096, 1, 3408, 1024, 1024, 1024, 4096]
    - [34, 9932.05]
  - - [64, 59, 1088, 59, 64, 64, 64, 59]
    - [8, 5343.67]
  - - [4096, 1024, 1, 3394, 4096, 4096, 4096, 1024]
    - [35, 9878.07]
  - - [1024, 4096, 1, 3573, 1024, 1024, 1024, 4096]
    - [35, 9935.2]
  - - [4096, 1024, 1, 3386, 4096, 4096, 4096, 1024]
    - [34, 9866.28]
  - - [4096, 1024, 1, 3540, 4096, 4096, 4096, 1024]
    - [34, 9882.23]
  - - [1024, 4096, 1, 3182, 1024, 1024, 1024, 4096]
    - [28, 9894.35]
  - - [1024, 4096, 1, 3430, 1024, 1024, 1024, 4096]
    - [27, 9915.14]
  - - [1024, 4096, 1, 3236, 1024, 1024, 1024, 4096]
    - [35, 9920.46]
  - - [4096, 1024, 1, 2977, 4096, 4096, 4096, 1024]
    - [34, 9847.98]
  - - [1024, 4096, 1, 3355, 1024, 1024, 1024, 4096]
    - [34, 9908.68]
  - - [4096, 1024, 1, 3139, 4096, 4096, 4096, 1024]
    - [34, 9850.61]
  - - [4096, 1024, 1, 3516, 4096, 4096, 4096, 1024]
    - [28, 9874.11]
  - - [4096, 1024, 1, 3368, 4096, 4096, 4096, 1024]
    - [28, 9872.54]
  - - [4096, 1024, 1, 3559, 4096, 4096, 4096, 1024]
    - [27, 9884.22]
  - - [64, 11, 5456, 11, 64, 64, 64, 11]
    - [15, 1382.57]
  - - [1024, 4096, 1, 3506, 1024, 1024, 1024, 4096]
    - [34, 9937.59]
  - - [1024, 4096, 1, 3145, 1024, 1024, 1024, 4096]
    - [27, 9905.01]
  - - [1024, 4096, 1, 3369, 1024, 1024, 1024, 4096]
    - [34, 9912.61]
  - - [64, 112, 576, 112, 64, 64, 64, 112]
    - [0, 6583.46]
  - - [4096, 1024, 1, 3522, 4096, 4096, 4096, 1024]
    - [34, 9889.37]
  - - [1024, 33708, 1, 3894, 1024, 1024, 1024, 33708]
    - [27, 10337.4]
  - - [64, 159, 400, 162, 64, 64, 64, 159]
    - [18, 7056.99]
  - - [4096, 1024, 1, 3336, 4096, 4096, 4096, 1024]
    - [34, 9867.57]
  - - [1024, 4096, 1, 3382, 1024, 1024, 1024, 4096]
    - [28, 9915.8]
  - - [4096, 1024, 1, 3533, 4096, 4096, 4096, 1024]
    - [34, 9878.46]
  - - [4096, 1024, 1, 4050, 4096, 4096, 4096, 1024]
    - [35, 9916.72]
  - - [4096, 1024, 1, 3480, 4096, 4096, 4096, 1024]
    - [28, 9869.22]
  - - [1024, 4096, 1, 3344, 1024, 1024, 1024, 4096]
    - [27, 9935.51]
  - - [64, 122, 528, 122, 64, 64, 64, 122]
    - [0, 6871.04]
  - - [1024, 4096, 1, 3509, 1024, 1024, 1024, 4096]
    - [28, 9925.7]
  - - [1024, 4096, 1, 3956, 1024, 1024, 1024, 4096]
    - [27, 9958.16]
  - - [4096, 1024, 1, 3616, 4096, 4096, 4096, 1024]
    - [34, 9904.53]
  - - [1024, 4096, 1, 3366, 1024, 1024, 1024, 4096]
    - [27, 9919.37]
  - - [4096, 1024, 1, 2935, 4096, 4096, 4096, 1024]
    - [27, 9833.13]
  - - [4096, 1024, 1, 3393, 4096, 4096, 4096, 1024]
    - [34, 9877.35]
  - - [4096, 1024, 1, 3547, 4096, 4096, 4096, 1024]
    - [28, 9865.0]
  - - [1024, 4096, 1, 3499, 1024, 1024, 1024, 4096]
    - [35, 9912.39]
  - - [4096, 1024, 1, 3357, 4096, 4096, 4096, 1024]
    - [34, 9855.18]
  - - [4096, 1024, 1, 3272, 4096, 4096, 4096, 1024]
    - [34, 9861.87]
  - - [4096, 1024, 1, 3207, 4096, 4096, 4096, 1024]
    - [34, 9847.68]
  - - [4096, 1024, 1, 3894, 4096, 4096, 4096, 1024]
    - [34, 9918.76]
  - - [1024, 4096, 1, 3444, 1024, 1024, 1024, 4096]
    - [34, 9932.61]
  - - [4096, 1024, 1, 3561, 4096, 4096, 4096, 1024]
    - [34, 9872.51]
  - - [4096, 1024, 1, 3376, 4096, 4096, 4096, 1024]
    - [34, 9885.49]
  - - [1024, 4096, 1, 3458, 1024, 1024, 1024, 4096]
    - [34, 9929.29]
  - - [4096, 1024, 1, 3231, 4096, 4096, 4096, 1024]
    - [28, 9846.98]
  - - [64, 228, 272, 228, 64, 64, 64, 228]
    - [29, 7302.59]
  - - [1024, 4096, 1, 3505, 1024, 1024, 1024, 4096]
    - [35, 9931.53]
  - - [4096, 1024, 1, 3277, 4096, 4096, 4096, 1024]
    - [34, 9857.1]
  - - [64, 21, 2976, 21, 64, 64, 64, 21]
    - [4, 2436.04]
  - - [1024, 4096, 1, 3391, 1024, 1024, 1024, 4096]
    - [34, 9911.15]
  - - [64, 32, 1984, 32, 64, 64, 64, 32]
    - [16, 3572.07]
  - - [1024, 4096, 1, 3536, 1024, 1024, 1024, 4096]
    - [35, 9946.8]
  - - [1024, 4096, 1, 3063, 1024, 1024, 1024, 4096]
    - [34, 9906.82]
  - - [1024, 1024, 1, 3925, 1024, 1024, 1024, 1024]
    - [26, 9011.35]
  - - [1024, 4096, 1, 3189, 1024, 1024, 1024, 4096]
    - [28, 9900.85]
  - - [1024, 4096, 1, 2505, 1024, 1024, 1024, 4096]
    - [34, 9854.75]
  - - [4096, 1024, 1, 3454, 4096, 4096, 4096, 1024]
    - [27, 9864.86]
  - - [1024, 4096, 1, 3405, 1024, 1024, 1024, 4096]
    - [35, 9906.23]
  - - [1024, 33708, 1, 4050, 1024, 1024, 1024, 33708]
    - [28, 10343.6]
  - - [4096, 1024, 1, 3520, 4096, 4096, 4096, 1024]
    - [34, 9886.93]
  - - [64, 93, 688, 93, 64, 64, 64, 93]
    - [11, 6222.76]
  - - [1024, 4096, 1, 3487, 1024, 1024, 1024, 4096]
    - [35, 9918.59]
  - - [1024, 4096, 1, 3558, 1024, 1024, 1024, 4096]
    - [35, 9930.89]
  - - [4096, 1024, 1, 3297, 4096, 4096, 4096, 1024]
    - [34, 9874.21]
  - - [1024, 1024, 1, 3840, 1024, 1024, 1024, 1024]
    - [30, 9075.32]
  - - [1024, 4096, 1, 3483, 1024, 1024, 1024, 4096]
    - [34, 9915.28]
  - - [1024, 1024, 1, 3956, 1024, 1024, 1024, 1024]
    - [33, 9009.93]
  - - [1024, 33708, 1, 3751, 1024, 1024, 1024, 33708]
    - [28, 10325.8]
  - - [4096, 1024, 1, 3380, 4096, 4096, 4096, 1024]
    - [34, 9888.37]
  - - [1024, 4096, 1, 3380, 1024, 1024, 1024, 4096]
    - [27, 9927.15]
  - - [1024, 4096, 1, 3396, 1024, 1024, 1024, 4096]
    - [35, 9931.86]
  - - [1024, 4096, 1, 3497, 1024, 1024, 1024, 4096]
    - [28, 9914.76]
  - - [1024, 4096, 1, 3502, 1024, 1024, 1024, 4096]
    - [35, 9921.42]
  - - [1024, 1024, 1, 3976, 1024, 1024, 1024, 1024]
    - [30, 9060.2]
  - - [1024, 4096, 1, 3138, 1024, 1024, 1024, 4096]
    - [28, 9908.56]
  - - [4096, 1024, 1, 3939, 4096, 4096, 4096, 1024]
    - [27, 9910.13]
  - - [1024, 4096, 1, 3303, 1024, 1024, 1024, 4096]
    - [28, 9916.54]
  - - [64, 111, 576, 112, 64, 64, 64, 111]
    - [8, 6495.09]
  - - [1024, 4096, 1, 3418, 1024, 1024, 1024, 4096]
    - [34, 9913.25]
  - - [1024, 4096, 1, 3224, 1024, 1024, 1024, 4096]
    - [28, 9903.95]
  - - [4096, 1024, 1, 3978, 4096, 4096, 4096, 1024]
    - [34, 9896.18]
  - - [1024, 4096, 1, 3472, 1024, 1024, 1024, 4096]
    - [27, 9937.38]
  - - [4096, 1024, 1, 3353, 4096, 4096, 4096, 1024]
    - [35, 9863.87]
  - - [4096, 1024, 1, 3362, 4096, 4096, 4096, 1024]
    - [34, 9870.96]
  - - [1024, 33708, 1, 3978, 1024, 1024, 1024, 33708]
    - [27, 10325.3]
  - - [64, 100, 624, 102, 64, 64, 64, 100]
    - [3, 5695.57]
  - - [1024, 4096, 1, 3432, 1024, 1024, 1024, 4096]
    - [35, 9915.46]
  - - [1024, 4096, 1, 3139, 1024, 1024, 1024, 4096]
    - [34, 9914.11]
  - - [1024, 4096, 1, 3341, 1024, 1024, 1024, 4096]
    - [35, 9912.0]
  - - [1024, 4096, 1, 3494, 1024, 1024, 1024, 4096]
    - [28, 9924.5]
  - - [1024, 4096, 1, 3969, 1024, 1024, 1024, 4096]
    - [27, 9952.18]
  - - [1024, 4096, 1, 3163, 1024, 1024, 1024, 4096]
    - [35, 9911.69]
  - - [1024, 1024, 1, 3955, 1024, 1024, 1024, 1024]
    - [25, 9097.76]
  - - [4096, 1024, 1, 3405, 4096, 4096, 4096, 1024]
    - [34, 9853.74]
  - - [1024, 1024, 1, 4030, 1024, 1024, 1024, 1024]
    - [25, 9083.76]
  - - [4096, 1024, 1, 3453, 4096, 4096, 4096, 1024]
    - [34, 9858.78]
  - - [1024, 4096, 1, 3411, 1024, 1024, 1024, 4096]
    - [35, 9926.44]
  - - [1024, 4096, 1, 3527, 1024, 1024, 1024, 4096]
    - [28, 9922.55]
  - - [4096, 1024, 1, 3474, 4096, 4096, 4096, 1024]
    - [34, 9878.39]
  - - [1024, 4096, 1, 3572, 1024, 1024, 1024, 4096]
    - [34, 9931.9]
  - - [4096, 1024, 1, 3293, 4096, 4096, 4096, 1024]
    - [34, 9848.16]
  - - [4096, 1024, 1, 3247, 4096, 4096, 4096, 1024]
    - [34, 9861.35]
  - - [64, 15, 4096, 15, 64, 64, 64, 15]
    - [15, 1955.65]
  - - [1024, 4096, 1, 3425, 1024, 1024, 1024, 4096]
    - [35, 9936.3]
  - - [1024, 4096, 1, 3354, 1024, 1024, 1024, 4096]
    - [27, 9917.45]
  - - [4096, 1024, 1, 3382, 4096, 4096, 4096, 1024]
    - [34, 9885.39]
  - - [4096, 1024, 1, 3236, 4096, 4096, 4096, 1024]
    - [34, 9860.5]
  - - [1024, 4096, 1, 3519, 1024, 1024, 1024, 4096]
    - [35, 9919.2]
  - - [4096, 1024, 1, 3354, 4096, 4096, 4096, 1024]
    - [34, 9854.65]
  - - [4096, 1024, 1, 3501, 4096, 4096, 4096, 1024]
    - [35, 9869.52]
  - - [1024, 1024, 1, 3906, 1024, 1024, 1024, 1024]
    - [33, 9104.89]
  - - [4096, 1024, 1, 3266, 4096, 4096, 4096, 1024]
    - [34, 9873.87]
  - - [64, 101, 624, 102, 64, 64, 64, 101]
    - [3, 5765.42]
  - - [1024, 4096, 1, 3368, 1024, 1024, 1024, 4096]
    - [34, 9909.67]
  - - [1024, 4096, 1, 4030, 1024, 1024, 1024, 4096]
    - [35, 9940.17]
  - - [1024, 4096, 1, 3533, 1024, 1024, 1024, 4096]
    - [28, 9916.54]
  - - [4096, 1024, 1, 3332, 4096, 4096, 4096, 1024]
    - [35, 9876.35]
  - - [4096, 1024, 1, 3584, 4096, 4096, 4096, 1024]
    - [34, 9896.5]
  - - [1024, 4096, 1, 3616, 1024, 1024, 1024, 4096]
    - [34, 9957.08]
  - - [4096, 1024, 1, 3265, 4096, 4096, 4096, 1024]
    - [34, 9877.68]
  - - [4096, 1024, 1, 3361, 4096, 4096, 4096, 1024]
    - [34, 9888.51]
  - - [4096, 1024, 1, 3467, 4096, 4096, 4096, 1024]
    - [34, 9863.3]
  - - [1024, 4096, 1, 3454, 1024, 1024, 1024, 4096]
    - [28, 9904.79]
  - - [1024, 4096, 1, 3101, 1024, 1024, 1024, 4096]
    - [35, 9893.02]
  - - [1024, 4096, 1, 3508, 1024, 1024, 1024, 4096]
    - [35, 9931.44]
  - - [4096, 1024, 1, 3267, 4096, 4096, 4096, 1024]
    - [34, 9864.38]
  - - [64, 54, 1184, 54, 64, 64, 64, 54]
    - [0, 4905.92]
  - - [4096, 1024, 1, 3419, 4096, 4096, 4096, 1024]
    - [34, 9872.46]
  - - [4096, 1024, 1, 3822, 4096, 4096, 4096, 1024]
    - [34, 9892.53]
  - - [1024, 4096, 1, 3266, 1024, 1024, 1024, 4096]
    - [34, 9918.48]
  - - [4096, 1024, 1, 3440, 4096, 4096, 4096, 1024]
    - [35, 9890.06]
  - - [1024, 4096, 1, 3361, 1024, 1024, 1024, 4096]
    - [34, 9930.87]
  - - [1024, 4096, 1, 3546, 1024, 1024, 1024, 4096]
    - [28, 9926.46]
  - - [4096, 1024, 1, 3473, 4096, 4096, 4096, 1024]
    - [34, 9888.96]
  - - [4096, 1024, 1, 3546, 4096, 4096, 4096, 1024]
    - [35, 9872.17]
  - - [1024, 4096, 1, 3088, 1024, 1024, 1024, 4096]
    - [28, 9917.93]
  - - [1024, 4096, 1, 3535, 1024, 1024, 1024, 4096]
    - [35, 9921.1]
  - - [1024, 4096, 1, 3447, 1024, 1024, 1024, 4096]
    - [35, 9920.53]
  - - [1024, 4096, 1, 3560, 1024, 1024, 1024, 4096]
    - [34, 9925.38]
  - - [1024, 4096, 1, 3422, 1024, 1024, 1024, 4096]
    - [28, 9922.11]
  - - [1024, 4096, 1, 3469, 1024, 1024, 1024, 4096]
    - [27, 9906.08]
  - - [4096, 1024, 1, 3488, 4096, 4096, 4096, 1024]
    - [34, 9903.16]
  - - [1024, 4096, 1, 3110, 1024, 1024, 1024, 4096]
    - [34, 9906.66]
  - - [1024, 4096, 1, 3265, 1024, 1024, 1024, 4096]
    - [35, 9916.59]
  - - [1024, 4096, 1, 3291, 1024, 1024, 1024, 4096]
    - [34, 9902.63]
  - - [1024, 4096, 1, 3390, 1024, 1024, 1024, 4096]
    - [35, 9907.12]
  - - [4096, 1024, 1, 3046, 4096, 4096, 4096, 1024]
    - [34, 9847.58]
  - - [1024, 4096, 1, 3539, 1024, 1024, 1024, 4096]
    - [35, 9933.39]
  - - [4096, 1024, 1, 3221, 4096, 4096, 4096, 1024]
    - [35, 9860.64]
  - - [4096, 1024, 1, 3433, 4096, 4096, 4096, 1024]
    - [34, 9872.64]
  - - [4096, 1024, 1, 3364, 4096, 4096, 4096, 1024]
    - [35, 9881.81]
  - - [4096, 1024, 1, 3470, 4096, 4096, 4096, 1024]
    - [34, 9858.46]
  - - [1024, 4096, 1, 3404, 1024, 1024, 1024, 4096]
    - [27, 9907.17]
  - - [1024, 33708, 1, 3968, 1024, 1024, 1024, 33708]
    - [28, 10350.2]
  - - [4096, 1024, 1, 3088, 4096, 4096, 4096, 1024]
    - [34, 9868.96]
  - - [1024, 4096, 1, 3247, 1024, 1024, 1024, 4096]
    - [34, 9900.92]
  - - [1024, 33708, 1, 3996, 1024, 1024, 1024, 33708]
    - [27, 10328.4]
  - - [4096, 1024, 1, 3482, 4096, 4096, 4096, 1024]
    - [35, 9866.89]
  - - [1024, 1024, 1, 3796, 1024, 1024, 1024, 1024]
    - [30, 9031.58]
  - - [4096, 1024, 1, 3995, 4096, 4096, 4096, 1024]
    - [35, 9896.68]
  - - [1024, 1024, 1, 3859, 1024, 1024, 1024, 1024]
    - [32, 9097.26]
  - - [1024, 4096, 1, 3280, 1024, 1024, 1024, 4096]
    - [28, 9933.95]
  - - [4096, 1024, 1, 3271, 4096, 4096, 4096, 1024]
    - [35, 9859.99]
  - - [64, 10, 5952, 10, 64, 64, 64, 10]
    - [15, 1220.92]
  - - [4096, 1024, 1, 3545, 4096, 4096, 4096, 1024]
    - [34, 9877.25]
  - - [4096, 1024, 1, 3476, 4096, 4096, 4096, 1024]
    - [27, 9882.47]
  - - [4096, 1024, 1, 3496, 4096, 4096, 4096, 1024]
    - [28, 9880.4]
  - - [4096, 1024, 1, 3191, 4096, 4096, 4096, 1024]
    - [28, 9858.6]
  - - [4096, 1024, 1, 3311, 4096, 4096, 4096, 1024]
    - [35, 9853.1]
  - - [1024, 4096, 1, 3302, 1024, 1024, 1024, 4096]
    - [35, 9919.22]
  - - [1024, 4096, 1, 3681, 1024, 1024, 1024, 4096]
    - [34, 9944.89]
  - - [4096, 1024, 1, 3582, 4096, 4096, 4096, 1024]
    - [27, 9869.67]
  - - [4096, 1024, 1, 3421, 4096, 4096, 4096, 1024]
    - [35, 9855.98]
  - - [4096, 1024, 1, 3560, 4096, 4096, 4096, 1024]
    - [28, 9884.38]
  - - [1024, 4096, 1, 3495, 1024, 1024, 1024, 4096]
    - [35, 9930.03]
  - - [4096, 1024, 1, 3186, 4096, 4096, 4096, 1024]
    - [34, 9870.49]
  - - [4096, 1024, 1, 3925, 4096, 4096, 4096, 1024]
    - [34, 9903.9]
  - - [64, 71, 896, 71, 64, 64, 64, 71]
    - [19, 5004.69]
  - - [1024, 4096, 1, 3435, 1024, 1024, 1024, 4096]
    - [35, 9916.48]
  - - [4096, 1024, 1, 3434, 4096, 4096, 4096, 1024]
    - [34, 9871.19]
  - - [1024, 33708, 1, 4012, 1024, 1024, 1024, 33708]
    - [27, 10332.4]
  - - [1024, 4096, 1, 3340, 1024, 1024, 1024, 4096]
    - [27, 9918.01]
  - - [1024, 1024, 1, 3860, 1024, 1024, 1024, 1024]
    - [25, 8999.26]
  - - [4096, 1024, 1, 3489, 4096, 4096, 4096, 1024]
    - [34, 9881.92]
  - - [1024, 4096, 1, 3162, 1024, 1024, 1024, 4096]
    - [35, 9906.18]
  - - [4096, 1024, 1, 3436, 4096, 4096, 4096, 1024]
    - [34, 9858.02]
  - - [1024, 1024, 1, 4005, 1024, 1024, 1024, 1024]
    - [31, 9042.96]
  - - [64, 84, 752, 84, 64, 64, 64, 84]
    - [4, 5629.83]
  - - [4096, 1024, 1, 3574, 4096, 4096, 4096, 1024]
    - [34, 9886.6]
  - - [4096, 1024, 1, 3469, 4096, 4096, 4096, 1024]
    - [27, 9856.16]
  - - [1024, 4096, 1, 3410, 1024, 1024, 1024, 4096]
    - [28, 9924.64]
  - - [1024, 4096, 1, 3216, 1024, 1024, 1024, 4096]
    - [27, 9930.57]
  - - [4096, 1024, 1, 3095, 4096, 4096, 4096, 1024]
    - [34, 9846.91]
  - - [1024, 1024, 1, 3990, 1024, 1024, 1024, 1024]
    - [33, 9088.94]
  - - [4096, 1024, 1, 3448, 4096, 4096, 4096, 1024]
    - [34, 9863.84]
  - - [1024, 4096, 1, 3176, 1024, 1024, 1024, 4096]
    - [35, 9913.91]
  - - [64, 49, 1296, 49, 64, 64, 64, 49]
    - [0, 4437.36]
  - - [4096, 1024, 1, 2918, 4096, 4096, 4096, 1024]
    - [34, 9830.83]
  - - [64, 14, 4368, 14, 64, 64, 64, 14]
    - [14, 1802.37]
  - - [1024, 4096, 1, 3424, 1024, 1024, 1024, 4096]
    - [34, 9933.95]
  - - [4096, 1024, 1, 3402, 4096, 4096, 4096, 1024]
    - [27, 9863.02]
  - - [4096, 1024, 1, 3145, 4096, 4096, 4096, 1024]
    - [28, 9856.46]
  - - [64, 134, 480, 134, 64, 64, 64, 134]
    - [20, 6183.95]
  - - [1024, 33708, 1, 3976, 1024, 1024, 1024, 33708]
    - [28, 10330.0]
  - - [4096, 1024, 1, 3518, 4096, 4096, 4096, 1024]
    - [27, 9855.97]
  - - [4096, 1024, 1, 3110, 4096, 4096, 4096, 1024]
    - [34, 9856.36]
  - - [4096, 1024, 1, 3325, 4096, 4096, 4096, 1024]
    - [34, 9852.26]
  - - [1024, 33708, 1, 3999, 1024, 1024, 1024, 33708]
    - [27, 10329.6]
  - - [4096, 1024, 1, 2985, 4096, 4096, 4096, 1024]
    - [34, 9837.2]
  - - [1024, 4096, 1, 3371, 1024, 1024, 1024, 4096]
    - [27, 9912.93]
  - - [4096, 1024, 1, 3342, 4096, 4096, 4096, 1024]
    - [34, 9863.06]
  - - [4096, 1024, 1, 3141, 4096, 4096, 4096, 1024]
    - [28, 9849.81]
  - - [4096, 1024, 1, 3532, 4096, 4096, 4096, 1024]
    - [28, 9866.2]
  - - [64, 78, 816, 78, 64, 64, 64, 78]
    - [5, 5316.78]
  - - [1024, 4096, 1, 3169, 1024, 1024, 1024, 4096]
    - [35, 9910.35]
  - - [1024, 4096, 1, 3514, 1024, 1024, 1024, 4096]
    - [34, 9917.9]
  - - [4096, 1024, 1, 3780, 4096, 4096, 4096, 1024]
    - [35, 9899.65]
  - - [1024, 4096, 1, 3098, 1024, 1024, 1024, 4096]
    - [27, 9901.52]
  - - [1024, 4096, 1, 3449, 1024, 1024, 1024, 4096]
    - [35, 9919.75]
  - - [1024, 4096, 1, 3222, 1024, 1024, 1024, 4096]
    - [27, 9917.56]
  - - [1024, 4096, 1, 3346, 1024, 1024, 1024, 4096]
    - [28, 9912.81]
  - - [4096, 1024, 1, 3064, 4096, 4096, 4096, 1024]
    - [35, 9848.69]
  - - [4096, 1024, 1, 3511, 4096, 4096, 4096, 1024]
    - [34, 9873.29]
  - - [4096, 1024, 1, 3384, 4096, 4096, 4096, 1024]
    - [34, 9870.88]
  - - [4096, 1024, 1, 3356, 4096, 4096, 4096, 1024]
    - [28, 9853.35]
  - - [1024, 4096, 1, 3796, 1024, 1024, 1024, 4096]
    - [27, 9940.56]
  - - [4096, 1024, 1, 3427, 4096, 4096, 4096, 1024]
    - [34, 9883.04]
  - - [4096, 1024, 1, 3390, 4096, 4096, 4096, 1024]
    - [34, 9863.69]
  - - [4096, 1024, 1, 3573, 4096, 4096, 4096, 1024]
    - [35, 9885.92]
  - - [4096, 1024, 1, 3456, 4096, 4096, 4096, 1024]
    - [28, 9890.51]
  - - [1024, 4096, 1, 3360, 1024, 1024, 1024, 4096]
    - [35, 9938.0]
  - - [1024, 33708, 1, 3977, 1024, 1024, 1024, 33708]
    - [28, 10327.1]
  - - [1024, 4096, 1, 2918, 1024, 1024, 1024, 4096]
    - [27, 9902.74]
  - - [4096, 1024, 1, 3975, 4096, 4096, 4096, 1024]
    - [34, 9905.17]
  - - [4096, 1024, 1, 3525, 4096, 4096, 4096, 1024]
    - [35, 9879.81]
  - - [4096, 1024, 1, 3398, 4096, 4096, 4096, 1024]
    - [27, 9873.81]
  - - [4096, 1024, 1, 3640, 4096, 4096, 4096, 1024]
    - [34, 9885.06]
  - - [1024, 1024, 1, 3999, 1024, 1024, 1024, 1024]
    - [26, 8995.32]
  - - [4096, 1024, 1, 3014, 4096, 4096, 4096, 1024]
    - [34, 9841.22]
  - - [1024, 4096, 1, 3446, 1024, 1024, 1024, 4096]
    - [27, 9917.11]
  - - [1024, 33708, 1, 3796, 1024, 1024, 1024, 33708]
    - [27, 10338.9]
  - - [4096, 1024, 1, 3101, 4096, 4096, 4096, 1024]
    - [27, 9827.24]
  - - [4096, 1024, 1, 3563, 4096, 4096, 4096, 1024]
    - [35, 9862.93]
  - - [4096, 1024, 1, 3539, 4096, 4096, 4096, 1024]
    - [27, 9889.44]
  - - [4096, 1024, 1, 3182, 4096, 4096, 4096, 1024]
    - [34, 9833.69]
  - - [1024, 4096, 1, 3468, 1024, 1024, 1024, 4096]
    - [28, 9912.95]
  - - [4096, 1024, 1, 3312, 4096, 4096, 4096, 1024]
    - [34, 9889.75]
  - - [4096, 1024, 1, 3215, 4096, 4096, 4096, 1024]
    - [34, 9853.78]
  - - [4096, 1024, 1, 3910, 4096, 4096, 4096, 1024]
    - [34, 9894.62]
  - - [1024, 33708, 1, 3780, 1024, 1024, 1024, 33708]
    - [28, 10331.9]
  - - [1024, 4096, 1, 3290, 1024, 1024, 1024, 4096]
    - [34, 9914.98]
  - - [1024, 4096, 1, 4012, 1024, 1024, 1024, 4096]
    - [34, 9942.55]
  - - [1024, 4096, 1, 3385, 1024, 1024, 1024, 4096]
    - [34, 9915.73]
  - - [1024, 33708, 1, 3975, 1024, 1024, 1024, 33708]
    - [27, 10330.0]
  - - [4096, 1024, 1, 3996, 4096, 4096, 4096, 1024]
    - [34, 9891.21]
  - - [4096, 1024, 1, 2765, 4096, 4096, 4096, 1024]
    - [35, 9800.28]
  - - [4096, 1024, 1, 3538, 4096, 4096, 4096, 1024]
    - [35, 9886.12]
  - - [4096, 1024, 1, 3415, 4096, 4096, 4096, 1024]
    - [35, 9874.5]
  - - [1024, 4096, 1, 3554, 1024, 1024, 1024, 4096]
    - [34, 9931.89]
  - - [4096, 1024, 1, 3513, 4096, 4096, 4096, 1024]
    - [28, 9874.15]
  - - [1024, 4096, 1, 3304, 1024, 1024, 1024, 4096]
    - [28, 9907.63]
  - - [4096, 1024, 1, 3294, 4096, 4096, 4096, 1024]
    - [34, 9851.15]
  - - [4096, 1024, 1, 3396, 4096, 4096, 4096, 1024]
    - [35, 9880.6]
  - - [1024, 4096, 1, 3213, 1024, 1024, 1024, 4096]
    - [28, 9891.02]
  - - [4096, 1024, 1, 3137, 4096, 4096, 4096, 1024]
    - [28, 9857.31]
  - - [4096, 1024, 1, 3552, 4096, 4096, 4096, 1024]
    - [34, 9904.12]
  - - [1024, 1024, 1, 4020, 1024, 1024, 1024, 1024]
    - [33, 9098.77]
  - - [64, 13, 4672, 13, 64, 64, 64, 13]
    - [15, 1693.44]
  - - [1024, 4096, 1, 3461, 1024, 1024, 1024, 4096]
    - [34, 9918.35]
  - - [4096, 1024, 1, 3263, 4096, 4096, 4096, 1024]
    - [27, 9843.79]
  - - [4096, 1024, 1, 3430, 4096, 4096, 4096, 1024]
    - [34, 9885.16]
  - - [4096, 1024, 1, 3389, 4096, 4096, 4096, 1024]
    - [34, 9859.13]
  - - [4096, 1024, 1, 3528, 4096, 4096, 4096, 1024]
    - [34, 9872.91]
  - - [1024, 4096, 1, 3463, 1024, 1024, 1024, 4096]
    - [35, 9929.51]
  - - [4096, 1024, 1, 3526, 4096, 4096, 4096, 1024]
    - [35, 9876.8]
  - - [4096, 1024, 1, 3154, 4096, 4096, 4096, 1024]
    - [34, 9858.15]
  - - [4096, 1024, 1, 3499, 4096, 4096, 4096, 1024]
    - [35, 9862.82]
  - - [1024, 1024, 1, 3939, 1024, 1024, 1024, 1024]
    - [33, 9107.31]
  - - [4096, 1024, 1, 3955, 4096, 4096, 4096, 1024]
    - [35, 9906.18]
  - - [1024, 4096, 1, 3297, 1024, 1024, 1024, 4096]
    - [28, 9925.24]
  - - [1024, 4096, 1, 3233, 1024, 1024, 1024, 4096]
    - [34, 9920.55]
  - - [1024, 4096, 1, 3226, 1024, 1024, 1024, 4096]
    - [34, 9911.25]
  - - [4096, 1024, 1, 3404, 4096, 4096, 4096, 1024]
    - [34, 9867.18]
  - - [4096, 1024, 1, 3355, 4096, 4096, 4096, 1024]
    - [34, 9862.56]
  - - [1024, 4096, 1, 3542, 1024, 1024, 1024, 4096]
    - [34, 9926.39]
  - - [4096, 1024, 1, 3181, 4096, 4096, 4096, 1024]
    - [35, 9831.76]
  - - [1024, 4096, 1, 3474, 1024, 1024, 1024, 4096]
    - [34, 9927.93]
  - - [4096, 1024, 1, 3319, 4096, 4096, 4096, 1024]
    - [34, 9870.18]
  - - [1024, 4096, 1, 3434, 1024, 1024, 1024, 4096]
    - [27, 9917.41]
  - - [1024, 4096, 1, 3860, 1024, 1024, 1024, 4096]
    - [34, 9945.22]
  - - [1024, 4096, 1, 3343, 1024, 1024, 1024, 4096]
    - [27, 9914.56]
  - - [64, 77, 816, 78, 64, 64, 64, 77]
    - [5, 5276.87]
  - - [1024, 4096, 1, 3488, 1024, 1024, 1024, 4096]
    - [34, 9945.71]
  - - [1024, 4096, 1, 3046, 1024, 1024, 1024, 4096]
    - [34, 9908.68]
  - - [1024, 4096, 1, 3141, 1024, 1024, 1024, 4096]
    - [35, 9909.08]
  - - [1024, 4096, 1, 3516, 1024, 1024, 1024, 4096]
    - [35, 9911.28]
  - - [4096, 1024, 1, 3147, 4096, 4096, 4096, 1024]
    - [34, 9840.37]
  - - [1024, 1024, 1, 4059, 1024, 1024, 1024, 1024]
    - [26, 9009.68]
  - - [1024, 1024, 1, 3944, 1024, 1024, 1024, 1024]
    - [26, 9006.07]
  - - [1024, 4096, 1, 3421, 1024, 1024, 1024, 4096]
    - [35, 9919.76]
  - - [4096, 1024, 1, 3944, 4096, 4096, 4096, 1024]
    - [28, 9899.43]
  - - [64, 45, 1424, 45, 64, 64, 64, 45]
    - [13, 4068.57]
  - - [1024, 4096, 1, 3574, 1024, 1024, 1024, 4096]
    - [28, 9930.09]
  - - [1024, 4096, 1, 3977, 1024, 1024, 1024, 4096]
    - [27, 9944.18]
  - - [1024, 1024, 1, 3968, 1024, 1024, 1024, 1024]
    - [32, 9045.12]
  - - [1024, 4096, 1, 2985, 1024, 1024, 1024, 4096]
    - [34, 9887.55]
  - - [64, 193, 320, 193, 64, 64, 64, 193]
    - [21, 6631.25]
  - - [1024, 4096, 1, 3427, 1024, 1024, 1024, 4096]
    - [35, 9933.31]
  - - [64, 12, 5040, 12, 64, 64, 64, 12]
    - [15, 1552.43]
  - - [1024, 4096, 1, 3482, 1024, 1024, 1024, 4096]
    - [35, 9942.12]
  - - [1024, 4096, 1, 3332, 1024, 1024, 1024, 4096]
    - [27, 9923.48]
  - - [1024, 1024, 1, 3720, 1024, 1024, 1024, 1024]
    - [31, 9039.46]
  - - [4096, 1024, 1, 3308, 4096, 4096, 4096, 1024]
    - [35, 9852.56]
  - - [1024, 4096, 1, 3513, 1024, 1024, 1024, 4096]
    - [35, 9919.89]
  - - [1024, 4096, 1, 3154, 1024, 1024, 1024, 4096]
    - [28, 9908.36]
  - - [1024, 4096, 1, 3955, 1024, 1024, 1024, 4096]
    - [35, 9949.91]
  - - [1024, 4096, 1, 2967, 1024, 1024, 1024, 4096]
    - [35, 9897.34]
  - - [1024, 33708, 1, 3942, 1024, 1024, 1024, 33708]
    - [27, 10336.0]
  - - [1024, 4096, 1, 3319, 1024, 1024, 1024, 4096]
    - [35, 9912.35]
  - - [4096, 1024, 1, 3860, 4096, 4096, 4096, 1024]
    - [34, 9909.19]
  - - [1024, 4096, 1, 3548, 1024, 1024, 1024, 4096]
    - [27, 9924.11]
  - - [4096, 1024, 1, 3977, 4096, 4096, 4096, 1024]
    - [35, 9891.34]
  - - [4096, 1024, 1, 3535, 4096, 4096, 4096, 1024]
    - [34, 9867.74]
  - - [1024, 4096, 1, 3541, 1024, 1024, 1024, 4096]
    - [35, 9923.06]
  - - [1024, 1024, 1, 3910, 1024, 1024, 1024, 1024]
    - [32, 9080.3]
  - - [1024, 33708, 1, 3584, 1024, 1024, 1024, 33708]
    - [27, 10332.9]
  - - [1024, 4096, 1, 3168, 1024, 1024, 1024, 4096]
    - [28, 9926.17]
  - - [1024, 4096, 1, 3448, 1024, 1024, 1024, 4096]
    - [35, 9922.32]
  - - [4096, 1024, 1, 3343, 4096, 4096, 4096, 1024]
    - [34, 9857.13]
  - - [64, 35, 1808, 35, 64, 64, 64, 35]
    - [17, 3175.34]
  - - [1024, 4096, 1, 3357, 1024, 1024, 1024, 4096]
    - [28, 9902.31]
  - - [64, 143, 432, 143, 64, 64, 64, 143]
    - [18, 6489.6]
  - - [4096, 1024, 1, 3510, 4096, 4096, 4096, 1024]
    - [34, 9867.3]
  - - [4096, 1024, 1, 3369, 4096, 4096, 4096, 1024]
    - [34, 9863.34]
  - - [64, 92, 688, 93, 64, 64, 64, 92]
    - [5, 6188.2]
  - - [4096, 1024, 1, 3379, 4096, 4096, 4096, 1024]
    - [34, 9870.02]
  - - [1024, 4096, 1, 3276, 1024, 1024, 1024, 4096]
    - [34, 9904.67]
  - - [1024, 4096, 1, 3363, 1024, 1024, 1024, 4096]
    - [34, 9925.03]
  - - [4096, 1024, 1, 3055, 4096, 4096, 4096, 1024]
    - [34, 9831.82]
  - - [1024, 4096, 1, 3524, 1024, 1024, 1024, 4096]
    - [27, 9923.69]
  - - [4096, 1024, 1, 3057, 4096, 4096, 4096, 1024]
    - [34, 9852.77]
  - - [1024, 33708, 1, 3720, 1024, 1024, 1024, 33708]
    - [28, 10327.0]
  - - [1024, 4096, 1, 3383, 1024, 1024, 1024, 4096]
    - [27, 9919.29]
  - - [1024, 4096, 1, 3522, 1024, 1024, 1024, 4096]
    - [28, 9932.46]
  - - [1024, 33708, 1, 3956, 1024, 1024, 1024, 33708]
    - [27, 10333.7]
  - - [1024, 4096, 1, 3481, 1024, 1024, 1024, 4096]
    - [27, 9921.98]
  - - [4096, 1024, 1, 3562, 4096, 4096, 4096, 1024]
    - [35, 9874.76]
  - - [4096, 1024, 1, 3299, 4096, 4096, 4096, 1024]
    - [34, 9872.87]
  - - [1024, 4096, 1, 3262, 1024, 1024, 1024, 4096]
    - [28, 9924.73]
  - - [1024, 4096, 1, 3840, 1024, 1024, 1024, 4096]
    - [27, 9961.74]
  - - [1024, 33708, 1, 4026, 1024, 1024, 1024, 33708]
    - [27, 10334.2]
  - - [4096, 1024, 1, 3168, 4096, 4096, 4096, 1024]
    - [28, 9878.35]
  - - [64, 101, 624, 101, 64, 64, 64, 101]
    - [8, 5734.62]
  - - [1024, 4096, 1, 3999, 1024, 1024, 1024, 4096]
    - [27, 9947.0]
  - - [1024, 4096, 1, 3549, 1024, 1024, 1024, 4096]
    - [27, 9923.2]
  - - [4096, 1024, 1, 3375, 4096, 4096, 4096, 1024]
    - [34, 9868.79]
  - - [1024, 4096, 1, 3496, 1024, 1024, 1024, 4096]
    - [35, 9928.57]
  - - [64, 29, 2176, 29, 64, 64, 64, 29]
    - [4, 3289.92]
  - - [1024, 4096, 1, 3190, 1024, 1024, 1024, 4096]
    - [35, 9897.51]
  - - [4096, 1024, 1, 3273, 4096, 4096, 4096, 1024]
    - [35, 9853.55]
  - - [1024, 4096, 1, 3406, 1024, 1024, 1024, 4096]
    - [34, 9906.94]
  - - [4096, 1024, 1, 4005, 4096, 4096, 4096, 1024]
    - [27, 9907.87]
  - - [4096, 1024, 1, 3555, 4096, 4096, 4096, 1024]
    - [34, 9878.86]
  - - [4096, 1024, 1, 2505, 4096, 4096, 4096, 1024]
    - [34, 9785.0]
  - - [1024, 4096, 1, 3460, 1024, 1024, 1024, 4096]
    - [34, 9930.14]
  - - [64, 17, 3632, 17, 64, 64, 64, 17]
    - [5, 1917.17]
  - - [1024, 4096, 1, 3579, 1024, 1024, 1024, 4096]
    - [28, 9920.84]
  - - [1024, 33708, 1, 4030, 1024, 1024, 1024, 33708]
    - [28, 10327.6]
  - - [1024, 4096, 1, 3510, 1024, 1024, 1024, 4096]
    - [28, 9931.21]
  - - [1024, 1024, 1, 3969, 1024, 1024, 1024, 1024]
    - [25, 9020.73]
  - - [1024, 4096, 1, 3282, 1024, 1024, 1024, 4096]
    - [35, 9919.95]
  - - [1024, 4096, 1, 3377, 1024, 1024, 1024, 4096]
    - [27, 9927.24]
  - - [1024, 4096, 1, 2935, 1024, 1024, 1024, 4096]
    - [35, 9903.38]
  - - [64, 41, 1552, 41, 64, 64, 64, 41]
    - [5, 3740.38]
  - - [1024, 4096, 1, 3498, 1024, 1024, 1024, 4096]
    - [27, 9914.91]
  - - [1024, 4096, 1, 3593, 1024, 1024, 1024, 4096]
    - [34, 9925.54]
  - - [1024, 1024, 1, 3948, 1024, 1024, 1024, 1024]
    - [33, 9008.93]
  - - [4096, 1024, 1, 3226, 4096, 4096, 4096, 1024]
    - [35, 9854.65]
  - - [1024, 4096, 1, 2499, 1024, 1024, 1024, 4096]
    - [34, 9904.72]
  - - [1024, 4096, 1, 3296, 1024, 1024, 1024, 4096]
    - [27, 9926.79]
  - - [1024, 4096, 1, 3455, 1024, 1024, 1024, 4096]
    - [34, 9917.42]
  - - [1024, 4096, 1, 3399, 1024, 1024, 1024, 4096]
    - [28, 9919.6]
  - - [1024, 4096, 1, 3205, 1024, 1024, 1024, 4096]
    - [27, 9917.64]
  - - [4096, 1024, 1, 4026, 4096, 4096, 4096, 1024]
    - [35, 9897.71]
  - - [1024, 4096, 1, 3484, 1024, 1024, 1024, 4096]
    - [27, 9915.43]
  - - [4096, 1024, 1, 3302, 4096, 4096, 4096, 1024]
    - [35, 9862.7]
  - - [1024, 4096, 1, 3485, 1024, 1024, 1024, 4096]
    - [35, 9912.9]
  - - [1024, 1024, 1, 3996, 1024, 1024, 1024, 1024]
    - [33, 9008.67]
  - - [1024, 4096, 1, 3126, 1024, 1024, 1024, 4096]
    - [28, 9910.06]
  - - [1024, 4096, 1, 4050, 1024, 1024, 1024, 4096]
    - [27, 9951.11]
  - - [4096, 1024, 1, 3235, 4096, 4096, 4096, 1024]
    - [28, 9870.64]
  - - [1024, 33708, 1, 3955, 1024, 1024, 1024, 33708]
    - [27, 10336.0]
  - - [1024, 4096, 1, 3342, 1024, 1024, 1024, 4096]
    - [27, 9903.75]
  - - [1024, 1024, 1, 3900, 1024, 1024, 1024, 1024]
    - [32, 9082.82]
  - - [1024, 4096, 1, 3397, 1024, 1024, 1024, 4096]
    - [35, 9922.6]
  - - [4096, 1024, 1, 3491, 4096, 4096, 4096, 1024]
    - [35, 9880.65]
  - - [1024, 4096, 1, 3503, 1024, 1024, 1024, 4096]
    - [27, 9923.18]
  - - [1024, 4096, 1, 3140, 1024, 1024, 1024, 4096]
    - [28, 9908.31]
  - - [4096, 1024, 1, 3121, 4096, 4096, 4096, 1024]
    - [34, 9860.22]
  - - [4096, 1024, 1, 3276, 4096, 4096, 4096, 1024]
    - [34, 9854.09]
  - - [1024, 4096, 1, 3321, 1024, 1024, 1024, 4096]
    - [35, 9917.76]
  - - [1024, 4096, 1, 3870, 1024, 1024, 1024, 4096]
    - [35, 9930.97]
  - - [4096, 1024, 1, 3475, 4096, 4096, 4096, 1024]
    - [34, 9877.48]
  - - [1024, 4096, 1, 2984, 1024, 1024, 1024, 4096]
    - [34, 9895.49]
  - - [4096, 1024, 1, 3363, 4096, 4096, 4096, 1024]
    - [28, 9873.34]
  - - [1024, 4096, 1, 3582, 1024, 1024, 1024, 4096]
    - [34, 9920.77]
  - - [4096, 1024, 1, 3509, 4096, 4096, 4096, 1024]
    - [34, 9886.76]
  - - [1024, 4096, 1, 3426, 1024, 1024, 1024, 4096]
    - [27, 9928.76]
  - - [4096, 1024, 1, 3136, 4096, 4096, 4096, 1024]
    - [34, 9872.51]
  - - [1024, 4096, 1, 3232, 1024, 1024, 1024, 4096]
    - [35, 9926.19]
  - - [4096, 1024, 1, 3103, 4096, 4096, 4096, 1024]
    - [34, 9838.93]
  - - [1024, 4096, 1, 3335, 1024, 1024, 1024, 4096]
    - [28, 9913.27]
  - - [1024, 4096, 1, 3900, 1024, 1024, 1024, 4096]
    - [27, 9937.91]
  - - [4096, 1024, 1, 3512, 4096, 4096, 4096, 1024]
    - [28, 9877.16]
  - - [4096, 1024, 1, 3222, 4096, 4096, 4096, 1024]
    - [34, 9859.67]
  - - [1024, 4096, 1, 3165, 1024, 1024, 1024, 4096]
    - [34, 9899.61]
  - - [4096, 1024, 1, 3408, 4096, 4096, 4096, 1024]
    - [34, 9899.58]
  - - [4096, 1024, 1, 3751, 4096, 4096, 4096, 1024]
    - [34, 9891.39]
  - - [1024, 4096, 1, 3318, 1024, 1024, 1024, 4096]
    - [27, 9913.32]
  - - [4096, 1024, 1, 3442, 4096, 4096, 4096, 1024]
    - [35, 9880.11]
  - - [1024, 4096, 1, 3413, 1024, 1024, 1024, 4096]
    - [34, 9921.8]
  - - [4096, 1024, 1, 3524, 4096, 4096, 4096, 1024]
    - [34, 9879.12]
  - - [1024, 4096, 1, 3976, 1024, 1024, 1024, 4096]
    - [35, 9945.47]
  - - [1024, 4096, 1, 3475, 1024, 1024, 1024, 4096]
    - [35, 9932.41]
  - - [1024, 4096, 1, 3534, 1024, 1024, 1024, 4096]
    - [27, 9911.39]
  - - [4096, 1024, 1, 3301, 4096, 4096, 4096, 1024]
    - [34, 9872.65]
  - - [4096, 1024, 1, 3248, 4096, 4096, 4096, 1024]
    - [34, 9878.12]
  - - [1024, 4096, 1, 2977, 1024, 1024, 1024, 4096]
    - [28, 9899.83]
  - - [4096, 1024, 1, 3346, 4096, 4096, 4096, 1024]
    - [34, 9875.97]
  - - [1024, 4096, 1, 3451, 1024, 1024, 1024, 4096]
    - [27, 9920.06]
  - - [1024, 4096, 1, 3257, 1024, 1024, 1024, 4096]
    - [28, 9904.92]
  - - [1024, 1024, 1, 3640, 1024, 1024, 1024, 1024]
    - [26, 8983.29]
  - - [1024, 4096, 1, 3356, 1024, 1024, 1024, 4096]
    - [27, 9904.38]
  - - [4096, 1024, 1, 3348, 4096, 4096, 4096, 1024]
    - [35, 9872.43]
  - - [4096, 1024, 1, 3335, 4096, 4096, 4096, 1024]
    - [34, 9865.72]
  - - [4096, 1024, 1, 3505, 4096, 4096, 4096, 1024]
    - [34, 9888.78]
  - - [1024, 4096, 1, 3490, 1024, 1024, 1024, 4096]
    - [27, 9937.9]
  - - [4096, 1024, 1, 3447, 4096, 4096, 4096, 1024]
    - [34, 9865.29]
  - - [1024, 4096, 1, 3267, 1024, 1024, 1024, 4096]
    - [35, 9919.22]
  - - [4096, 1024, 1, 3230, 4096, 4096, 4096, 1024]
    - [34, 9853.1]
  - - [4096, 1024, 1, 3455, 4096, 4096, 4096, 1024]
    - [34, 9862.34]
  - - [1024, 4096, 1, 3925, 1024, 1024, 1024, 4096]
    - [27, 9945.54]
  - - [1024, 4096, 1, 3362, 1024, 1024, 1024, 4096]
    - [28, 9921.53]
  - - [4096, 1024, 1, 3969, 4096, 4096, 4096, 1024]
    - [35, 9911.88]
  - - [4096, 1024, 1, 3527, 4096, 4096, 4096, 1024]
    - [34, 9882.77]
  - - [1024, 4096, 1, 3585, 1024, 1024, 1024, 4096]
    - [28, 9946.42]
  - - [4096, 1024, 1, 3063, 4096, 4096, 4096, 1024]
    - [34, 9853.93]
  - - [4096, 1024, 1, 3435, 4096, 4096, 4096, 1024]
    - [34, 9867.03]
  - - [4096, 1024, 1, 3366, 4096, 4096, 4096, 1024]
    - [35, 9863.92]
  - - [4096, 1024, 1, 3581, 4096, 4096, 4096, 1024]
    - [27, 9868.47]
  - - [1024, 33708, 1, 3906, 1024, 1024, 1024, 33708]
    - [27, 10339.2]
  - - [1024, 4096, 1, 3464, 1024, 1024, 1024, 4096]
    - [35, 9916.11]
  - - [1024, 4096, 1, 3440, 1024, 1024, 1024, 4096]
    - [34, 9945.15]
  - - [4096, 1024, 1, 3143, 4096, 4096, 4096, 1024]
    - [34, 9846.66]
  - - [1024, 4096, 1, 3349, 1024, 1024, 1024, 4096]
    - [28, 9912.73]
  - - [4096, 1024, 1, 3416, 4096, 4096, 4096, 1024]
    - [34, 9885.03]
  - - [4096, 1024, 1, 3365, 4096, 4096, 4096, 1024]
    - [34, 9875.9]
  - - [1024, 4096, 1, 3470, 1024, 1024, 1024, 4096]
    - [35, 9914.88]
  - - [4096, 1024, 1, 3287, 4096, 4096, 4096, 1024]
    - [34, 9860.59]
  - - [1024, 4096, 1, 3441, 1024, 1024, 1024, 4096]
    - [35, 9928.88]
  - - [4096, 1024, 1, 3224, 4096, 4096, 4096, 1024]
    - [34, 9857.73]
  - - [1024, 4096, 1, 3387, 1024, 1024, 1024, 4096]
    - [27, 9911.62]
  - - [1024, 4096, 1, 3547, 1024, 1024, 1024, 4096]
    - [27, 9920.26]
  - - [4096, 1024, 1, 3478, 4096, 4096, 4096, 1024]
    - [28, 9882.8]
  - - [4096, 1024, 1, 3548, 4096, 4096, 4096, 1024]
    - [35, 9869.35]
  - - [1024, 33708, 1, 4020, 1024, 1024, 1024, 33708]
    - [27, 10345.2]
  - - [4096, 1024, 1, 3320, 4096, 4096, 4096, 1024]
    - [34, 9863.64]
  - - [1024, 4096, 1, 3906, 1024, 1024, 1024, 4096]
    - [34, 9942.57]
  - - [4096, 1024, 1, 3796, 4096, 4096, 4096, 1024]
    - [34, 9899.03]
  - - [1024, 4096, 1, 3306, 1024, 1024, 1024, 4096]
    - [27, 9902.3]
  - - [1024, 4096, 1, 3401, 1024, 1024, 1024, 4096]
    - [35, 9913.85]
  - - [64, 147, 432, 147, 64, 64, 64, 147]
    - [18, 6626.5]
  - - [1024, 4096, 1, 3215, 1024, 1024, 1024, 4096]
    - [35, 9911.14]
  - - [4096, 1024, 1, 4012, 4096, 4096, 4096, 1024]
    - [35, 9898.1]
  - - [1024, 4096, 1, 2765, 1024, 1024, 1024, 4096]
    - [35, 9863.63]
  - - [4096, 1024, 1, 3554, 4096, 4096, 4096, 1024]
    - [28, 9883.42]
  - - [4096, 1024, 1, 3423, 4096, 4096, 4096, 1024]
    - [34, 9866.62]
  - - [1024, 1024, 1, 3751, 1024, 1024, 1024, 1024]
    - [32, 9006.26]
  - - [1024, 4096, 1, 3562, 1024, 1024, 1024, 4096]
    - [28, 9921.98]
  - - [1024, 4096, 1, 3489, 1024, 1024, 1024, 4096]
    - [27, 9936.68]
  - - [4096, 1024, 1, 3358, 4096, 4096, 4096, 1024]
    - [34, 9858.12]
  - - [4096, 1024, 1, 3270, 4096, 4096, 4096, 1024]
    - [35, 9850.74]
  - - [1024, 4096, 1, 3293, 1024, 1024, 1024, 4096]
    - [27, 9905.23]
  - - [1024, 4096, 1, 3376, 1024, 1024, 1024, 4096]
    - [27, 9934.88]
  - - [4096, 1024, 1, 3245, 4096, 4096, 4096, 1024]
    - [34, 9852.42]
  - - [4096, 1024, 1, 3541, 4096, 4096, 4096, 1024]
    - [34, 9887.12]
  - - [4096, 1024, 1, 3443, 4096, 4096, 4096, 1024]
    - [34, 9871.63]
  - - [4096, 1024, 1, 3438, 4096, 4096, 4096, 1024]
    - [35, 9863.76]
  - - [4096, 1024, 1, 3244, 4096, 4096, 4096, 1024]
    - [34, 9859.66]
  - - [1024, 4096, 1, 3365, 1024, 1024, 1024, 4096]
    - [34, 9922.0]
  - - [1024, 4096, 1, 3299, 1024, 1024, 1024, 4096]
    - [28, 9923.28]
  - - [4096, 1024, 1, 3840, 4096, 4096, 4096, 1024]
    - [34, 9914.65]
  - - [1024, 4096, 1, 3471, 1024, 1024, 1024, 4096]
    - [35, 9918.28]
  - - [1024, 4096, 1, 3398, 1024, 1024, 1024, 4096]
    - [27, 9918.89]
  - - [4096, 1024, 1, 3162, 4096, 4096, 4096, 1024]
    - [34, 9843.83]
  - - [1024, 4096, 1, 4005, 1024, 1024, 1024, 4096]
    - [28, 9947.77]
  - - [4096, 1024, 1, 3579, 4096, 4096, 4096, 1024]
    - [34, 9868.15]
  - - [64, 18, 3440, 18, 64, 64, 64, 18]
    - [10, 2059.23]
  - - [64, 177, 352, 177, 64, 64, 64, 177]
    - [29, 7315.3]
  - - [1024, 4096, 1, 3121, 1024, 1024, 1024, 4096]
    - [35, 9930.24]
  - - [4096, 1024, 1, 3441, 4096, 4096, 4096, 1024]
    - [34, 9883.18]
  - - [4096, 1024, 1, 3422, 4096, 4096, 4096, 1024]
    - [34, 9858.31]
  - - [4096, 1024, 1, 3444, 4096, 4096, 4096, 1024]
    - [34, 9886.93]
  - - [1024, 4096, 1, 3337, 1024, 1024, 1024, 4096]
    - [28, 9911.35]
  - - [4096, 1024, 1, 3550, 4096, 4096, 4096, 1024]
    - [27, 9871.77]
  - - [1024, 4096, 1, 3477, 1024, 1024, 1024, 4096]
    - [27, 9930.55]
  - - [4096, 1024, 1, 3490, 4096, 4096, 4096, 1024]
    - [34, 9878.35]
  - - [4096, 1024, 1, 3585, 4096, 4096, 4096, 1024]
    - [34, 9893.53]
  - - [1024, 4096, 1, 3143, 1024, 1024, 1024, 4096]
    - [27, 9901.09]
  - - [1024, 33708, 1, 3876, 1024, 1024, 1024, 33708]
    - [28, 10330.7]
  - - [1024, 4096, 1, 3320, 1024, 1024, 1024, 4096]
    - [35, 9913.08]
  - - [1024, 4096, 1, 3423, 1024, 1024, 1024, 4096]
    - [35, 9914.04]
  - - [1024, 4096, 1, 3894, 1024, 1024, 1024, 4096]
    - [27, 9944.37]
  - - [4096, 1024, 1, 3410, 4096, 4096, 4096, 1024]
    - [34, 9878.57]
  - - [1024, 4096, 1, 3561, 1024, 1024, 1024, 4096]
    - [27, 9926.58]
  - - [4096, 1024, 1, 3492, 4096, 4096, 4096, 1024]
    - [28, 9872.82]
  - - [64, 85, 752, 85, 64, 64, 64, 85]
    - [5, 5734.25]
- null
