src/Tensile/data/Configs/miopen/archives/mlperf/2019-05-03/exact/vega20_Cijk_Ailk_Bljk_SB.yaml
- {MinimumRequiredVersion: 4.9.4}
- vega20
- gfx906
- [Device 66a0, Device 66a1, Device 66a7]
    SolutionIndex: 0
    SolutionNameMin: Cijk_Ailk_Bljk_SB_MT128x64x8_SE_DTL0_EPS1_FL0_GRVW4_LPB0_PGR1_PLR1_SNLL1_TT8_4_USFGRO0_VW4_WG16_16_1_WGM1
    SolutionIndex: 1
    SolutionNameMin: Cijk_Ailk_Bljk_SB_MT128x64x8_SE_DTL0_EPS1_FL1_GRVW4_LPB0_PGR1_PLR1_SNLL1_TT8_4_USFGRO0_VW4_WG16_16_1_WGM1
    SolutionIndex: 2
    SolutionNameMin: Cijk_Ailk_Bljk_SB_MT128x64x8_SE_DTL0_EPS1_FL0_GRVW4_LPB0_PGR1_PLR1_SNLL1_TT8_4_USFGRO0_VW4_WG16_16_1_WGM8
    SolutionIndex: 3
    SolutionNameMin: Cijk_Ailk_Bljk_SB_MT128x64x8_SE_DTL0_EPS1_FL1_GRVW4_LPB0_PGR1_PLR1_SNLL1_TT8_4_USFGRO0_VW4_WG16_16_1_WGM8
    SolutionIndex: 4
    SolutionNameMin: Cijk_Ailk_Bljk_SB_MT128x128x16_SE_DTL0_EPS1_FL0_GRVW4_LPB0_PGR1_PLR1_SNLL1_TT8_8_USFGRO0_VW4_WG16_16_1_WGM1
    SolutionIndex: 5
    SolutionNameMin: Cijk_Ailk_Bljk_SB_MT128x128x16_SE_DTL0_EPS1_FL1_GRVW4_LPB0_PGR1_PLR1_SNLL1_TT8_8_USFGRO0_VW4_WG16_16_1_WGM1
    SolutionIndex: 6
    SolutionNameMin: Cijk_Ailk_Bljk_SB_MT128x128x16_SE_DTL0_EPS1_FL0_GRVW4_LPB0_PGR1_PLR1_SNLL1_TT8_8_USFGRO0_VW4_WG16_16_1_WGM8
    SolutionIndex: 7
    SolutionNameMin: Cijk_Ailk_Bljk_SB_MT128x128x16_SE_DTL0_EPS1_FL1_GRVW4_LPB0_PGR1_PLR1_SNLL1_TT8_8_USFGRO0_VW4_WG16_16_1_WGM8
    SolutionIndex: 8
    SolutionNameMin: Cijk_Ailk_Bljk_SB_MT96x64x8_SE_DTL0_EPS1_FL0_GRVW1_LPB2_PGR1_PLR1_SNLL1_TT6_4_USFGRO0_VW2_WG16_16_1_WGM1
    SolutionIndex: 9
    SolutionNameMin: Cijk_Ailk_Bljk_SB_MT64x64x16_SE_DTL0_EPS0_FL0_GRVW1_LPB4_PGR0_PLR1_SNLL0_TT4_4_USFGRO1_VW4_WG16_16_1_WGM1
    SolutionIndex: 10
    SolutionNameMin: Cijk_Ailk_Bljk_SB_MT64x64x16_SE_DTL0_EPS0_FL0_GRVW1_LPB4_PGR0_PLR1_SNLL0_TT4_4_USFGRO1_VW4_WG16_16_1_WGM8
    SolutionIndex: 11
    SolutionNameMin: Cijk_Ailk_Bljk_SB_MT96x64x8_SE_DTL0_EPS1_FL1_GRVW2_LPB2_PGR1_PLR1_SNLL1_TT6_4_USFGRO0_VW2_WG16_16_1_WGM1
    SolutionIndex: 12
    SolutionNameMin: Cijk_Ailk_Bljk_SB_MT96x64x16_SE_DTL0_EPS1_FL0_GRVW2_LPB2_PGR1_PLR0_SNLL1_TT6_4_USFGRO0_VW2_WG16_16_1_WGM8
    SolutionIndex: 13
    SolutionNameMin: Cijk_Ailk_Bljk_SB_MT64x96x16_SE_DTL0_EPS1_FL0_GRVW2_LPB2_PGR1_PLR0_SNLL1_TT4_6_USFGRO0_VW2_WG16_16_1_WGM8
    SolutionIndex: 14
    SolutionNameMin: Cijk_Ailk_Bljk_SB_MT64x96x16_SE_DTL0_EPS1_FL1_GRVW2_LPB2_PGR1_PLR0_SNLL1_TT4_6_USFGRO0_VW2_WG16_16_1_WGM8
    SolutionIndex: 15
    SolutionNameMin: Cijk_Ailk_Bljk_SB_MT128x64x8_SE_DTL0_EPS1_FL0_GRVW4_LPB4_PGR1_PLR1_SNLL1_TT8_4_USFGRO0_VW4_WG16_16_1_WGM1
    SolutionIndex: 16
    SolutionNameMin: Cijk_Ailk_Bljk_SB_MT128x64x8_SE_DTL0_EPS1_FL1_GRVW4_LPB4_PGR1_PLR1_SNLL1_TT8_4_USFGRO0_VW4_WG16_16_1_WGM1
    SolutionIndex: 17
    SolutionNameMin: Cijk_Ailk_Bljk_SB_MT128x64x8_SE_DTL0_EPS1_FL0_GRVW4_LPB4_PGR1_PLR1_SNLL1_TT8_4_USFGRO0_VW4_WG16_16_1_WGM8
    SolutionIndex: 18
    SolutionNameMin: Cijk_Ailk_Bljk_SB_MT128x64x8_SE_DTL0_EPS1_FL1_GRVW4_LPB4_PGR1_PLR1_SNLL1_TT8_4_USFGRO0_VW4_WG16_16_1_WGM8
    SolutionIndex: 19
    SolutionNameMin: Cijk_Ailk_Bljk_SB_MT64x64x16_SE_DTL0_EPS0_FL0_GRVW4_LPB4_PGR0_PLR1_SNLL0_TT4_4_USFGRO0_VW4_WG16_16_1_WGM1
    SolutionIndex: 20
    SolutionNameMin: Cijk_Ailk_Bljk_SB_MT128x64x16_SE_DTL0_EPS1_FL0_GRVW4_LPB4_PGR1_PLR1_SNLL1_TT8_4_USFGRO0_VW4_WG16_16_1_WGM1
    SolutionIndex: 21
    SolutionNameMin: Cijk_Ailk_Bljk_SB_MT128x64x16_SE_DTL0_EPS1_FL1_GRVW4_LPB4_PGR1_PLR1_SNLL1_TT8_4_USFGRO0_VW4_WG16_16_1_WGM1
    SolutionIndex: 22
    SolutionNameMin: Cijk_Ailk_Bljk_SB_MT64x64x16_SE_DTL0_EPS0_FL0_GRVW4_LPB4_PGR0_PLR1_SNLL0_TT4_4_USFGRO0_VW4_WG16_16_1_WGM8
    SolutionIndex: 23
    SolutionNameMin: Cijk_Ailk_Bljk_SB_MT128x64x16_SE_DTL0_EPS1_FL0_GRVW4_LPB4_PGR1_PLR1_SNLL1_TT8_4_USFGRO0_VW4_WG16_16_1_WGM8
    SolutionIndex: 24
    SolutionNameMin: Cijk_Ailk_Bljk_SB_MT128x64x16_SE_DTL0_EPS1_FL1_GRVW4_LPB4_PGR1_PLR1_SNLL1_TT8_4_USFGRO0_VW4_WG16_16_1_WGM8
    SolutionIndex: 25
    SolutionNameMin: Cijk_Ailk_Bljk_SB_MT64x32x8_SE_DTL0_EPS0_FL0_GRVW1_LPB0_PGR0_PLR1_SNLL0_TT4_4_USFGRO1_VW1_WG16_8_1_WGM1
    SolutionIndex: 26
    SolutionNameMin: Cijk_Ailk_Bljk_SB_MT64x16x8_SE_DTL0_EPS0_FL0_GRVW1_LPB0_PGR0_PLR0_SNLL0_TT4_2_USFGRO1_VW1_WG16_8_1_WGM8
    SolutionIndex: 27
    SolutionNameMin: Cijk_Ailk_Bljk_SB_MT64x16x8_SE_DTL0_EPS0_FL0_GRVW1_LPB0_PGR0_PLR1_SNLL0_TT4_2_USFGRO1_VW1_WG16_8_1_WGM8
    SolutionIndex: 28
    SolutionNameMin: Cijk_Ailk_Bljk_SB_MT64x16x16_SE_DTL0_EPS0_FL0_GRVW1_LPB0_PGR0_PLR1_SNLL0_TT4_2_USFGRO1_VW1_WG16_8_1_WGM1
    SolutionIndex: 29
    SolutionNameMin: Cijk_Ailk_Bljk_SB_MT64x16x16_SE_DTL0_EPS0_FL0_GRVW1_LPB0_PGR0_PLR1_SNLL0_TT4_2_USFGRO1_VW1_WG16_8_1_WGM8
    SolutionIndex: 30
    SolutionNameMin: Cijk_Ailk_Bljk_SB_MT64x32x8_SE_DTL0_EPS1_FL0_GRVW4_LPB0_PGR1_PLR1_SNLL1_TT4_4_USFGRO0_VW4_WG16_8_1_WGM1
    SolutionIndex: 31
    SolutionNameMin: Cijk_Ailk_Bljk_SB_MT64x32x8_SE_DTL0_EPS1_FL1_GRVW4_LPB0_PGR1_PLR1_SNLL1_TT4_4_USFGRO0_VW4_WG16_8_1_WGM1
    SolutionIndex: 32
    SolutionNameMin: Cijk_Ailk_Bljk_SB_MT64x64x8_SE_DTL0_EPS1_FL0_GRVW4_LPB0_PGR1_PLR1_SNLL1_TT4_8_USFGRO0_VW4_WG16_8_1_WGM1
    SolutionIndex: 33
    SolutionNameMin: Cijk_Ailk_Bljk_SB_MT64x32x8_SE_DTL0_EPS1_FL1_GRVW4_LPB0_PGR1_PLR1_SNLL1_TT4_4_USFGRO0_VW4_WG16_8_1_WGM8
    SolutionIndex: 34
    SolutionNameMin: Cijk_Ailk_Bljk_SB_MT64x32x16_SE_DTL0_EPS0_FL0_GRVW4_LPB0_PGR0_PLR1_SNLL0_TT4_4_USFGRO0_VW4_WG16_8_1_WGM8
    SolutionIndex: 35
    SolutionNameMin: Cijk_Ailk_Bljk_SB_MT64x32x16_SE_DTL0_EPS0_FL1_GRVW4_LPB0_PGR0_PLR1_SNLL0_TT4_4_USFGRO0_VW4_WG16_8_1_WGM8
    SolutionIndex: 36
    SolutionNameMin: Cijk_Ailk_Bljk_SB_MT64x64x8_SE_DTL0_EPS0_FL0_GRVW1_LPB1_PGR0_PLR0_SNLL0_TT4_4_USFGRO1_VW1_WG16_16_1_WGM1
    SolutionIndex: 37
    SolutionNameMin: Cijk_Ailk_Bljk_SB_MT64x64x8_SE_DTL0_EPS0_FL0_GRVW1_LPB1_PGR0_PLR1_SNLL0_TT4_4_USFGRO1_VW1_WG16_16_1_WGM1
    SolutionIndex: 38
    SolutionNameMin: Cijk_Ailk_Bljk_SB_MT64x64x8_SE_DTL0_EPS1_FL0_GRVW1_LPB1_PGR1_PLR1_SNLL1_TT4_4_USFGRO1_VW1_WG16_16_1_WGM1
    SolutionIndex: 39
    SolutionNameMin: Cijk_Ailk_Bljk_SB_MT64x32x8_SE_DTL0_EPS0_FL0_GRVW1_LPB1_PGR0_PLR1_SNLL0_TT4_4_USFGRO1_VW1_WG16_8_1_WGM1
    SolutionIndex: 40
    SolutionNameMin: Cijk_Ailk_Bljk_SB_MT64x16x8_SE_DTL0_EPS0_FL0_GRVW1_LPB1_PGR0_PLR0_SNLL0_TT4_2_USFGRO1_VW1_WG16_8_1_WGM1
    SolutionIndex: 41
    SolutionNameMin: Cijk_Ailk_Bljk_SB_MT64x16x8_SE_DTL0_EPS0_FL0_GRVW1_LPB1_PGR0_PLR1_SNLL0_TT4_2_USFGRO1_VW1_WG16_8_1_WGM1
    SolutionIndex: 42
    SolutionNameMin: Cijk_Ailk_Bljk_SB_MT64x64x8_SE_DTL0_EPS1_FL0_GRVW1_LPB1_PGR1_PLR1_SNLL1_TT4_4_USFGRO1_VW1_WG16_16_1_WGM8
    SolutionIndex: 43
    SolutionNameMin: Cijk_Ailk_Bljk_SB_MT64x32x8_SE_DTL0_EPS0_FL0_GRVW1_LPB1_PGR0_PLR1_SNLL0_TT4_4_USFGRO1_VW1_WG16_8_1_WGM8
    SolutionIndex: 44
    SolutionNameMin: Cijk_Ailk_Bljk_SB_MT64x16x8_SE_DTL0_EPS0_FL0_GRVW1_LPB1_PGR0_PLR1_SNLL0_TT4_2_USFGRO1_VW1_WG16_8_1_WGM8
    SolutionIndex: 45
    SolutionNameMin: Cijk_Ailk_Bljk_SB_MT64x64x16_SE_DTL0_EPS0_FL0_GRVW1_LPB1_PGR0_PLR1_SNLL0_TT4_4_USFGRO1_VW1_WG16_16_1_WGM1
    SolutionIndex: 46
    SolutionNameMin: Cijk_Ailk_Bljk_SB_MT64x32x16_SE_DTL0_EPS0_FL0_GRVW1_LPB1_PGR0_PLR0_SNLL0_TT4_2_USFGRO1_VW1_WG16_16_1_WGM1
    SolutionIndex: 47
    SolutionNameMin: Cijk_Ailk_Bljk_SB_MT64x32x16_SE_DTL0_EPS0_FL0_GRVW1_LPB1_PGR0_PLR1_SNLL0_TT4_2_USFGRO1_VW1_WG16_16_1_WGM1
    SolutionIndex: 48
    SolutionNameMin: Cijk_Ailk_Bljk_SB_MT64x32x16_SE_DTL0_EPS0_FL0_GRVW1_LPB1_PGR0_PLR1_SNLL0_TT4_4_USFGRO1_VW1_WG16_8_1_WGM1
    SolutionIndex: 49
    SolutionNameMin: Cijk_Ailk_Bljk_SB_MT64x16x16_SE_DTL0_EPS0_FL0_GRVW1_LPB1_PGR0_PLR0_SNLL0_TT4_2_USFGRO1_VW1_WG16_8_1_WGM1
    SolutionIndex: 50
    SolutionNameMin: Cijk_Ailk_Bljk_SB_MT64x16x16_SE_DTL0_EPS0_FL0_GRVW1_LPB1_PGR0_PLR1_SNLL0_TT4_2_USFGRO1_VW1_WG16_8_1_WGM1
    SolutionIndex: 51
    SolutionNameMin: Cijk_Ailk_Bljk_SB_MT64x64x16_SE_DTL0_EPS0_FL0_GRVW1_LPB1_PGR0_PLR1_SNLL0_TT4_4_USFGRO1_VW1_WG16_16_1_WGM8
    SolutionIndex: 52
    SolutionNameMin: Cijk_Ailk_Bljk_SB_MT64x32x16_SE_DTL0_EPS0_FL0_GRVW1_LPB1_PGR0_PLR1_SNLL0_TT4_2_USFGRO1_VW1_WG16_16_1_WGM8
    SolutionIndex: 53
    SolutionNameMin: Cijk_Ailk_Bljk_SB_MT64x16x16_SE_DTL0_EPS0_FL0_GRVW1_LPB1_PGR0_PLR1_SNLL0_TT4_2_USFGRO1_VW1_WG16_8_1_WGM8
    SolutionIndex: 54
    SolutionNameMin: Cijk_Ailk_Bljk_SB_MT64x32x32_SE_DTL0_EPS0_FL0_GRVW1_LPB1_PGR0_PLR1_SNLL0_TT4_2_USFGRO1_VW1_WG16_16_1_WGM1
    SolutionIndex: 55
    SolutionNameMin: Cijk_Ailk_Bljk_SB_MT64x32x8_SE_DTL0_EPS0_FL0_GRVW1_LPB4_PGR0_PLR1_SNLL0_TT4_4_USFGRO1_VW4_WG16_8_1_WGM1
    SolutionIndex: 56
    SolutionNameMin: Cijk_Ailk_Bljk_SB_MT64x32x8_SE_DTL0_EPS0_FL0_GRVW1_LPB4_PGR0_PLR1_SNLL0_TT4_4_USFGRO1_VW4_WG16_8_1_WGM8
    SolutionIndex: 57
    SolutionNameMin: Cijk_Ailk_Bljk_SB_MT64x32x16_SE_DTL0_EPS0_FL0_GRVW1_LPB4_PGR0_PLR1_SNLL0_TT4_4_USFGRO1_VW4_WG16_8_1_WGM1
    SolutionIndex: 58
    SolutionNameMin: Cijk_Ailk_Bljk_SB_MT64x32x8_SE_DTL0_EPS0_FL0_GRVW4_LPB4_PGR0_PLR1_SNLL0_TT4_4_USFGRO0_VW4_WG16_8_1_WGM8
    SolutionIndex: 59
    SolutionNameMin: Cijk_Ailk_Bljk_SB_MT64x32x8_SE_DTL0_EPS0_FL1_GRVW4_LPB4_PGR0_PLR1_SNLL0_TT4_4_USFGRO0_VW4_WG16_8_1_WGM8
- - - [1024, 3594, 1, 4096, 1024, 1024, 1024, 4096]
    - [6, 8661.42]
  - - [4096, 3103, 1, 1024, 4096, 4096, 4096, 1024]
    - [16, 9652.13]
  - - [4096, 3136, 1, 1024, 4096, 4096, 4096, 1024]
    - [0, 9723.05]
  - - [1024, 3141, 1, 4096, 1024, 1024, 1024, 4096]
    - [18, 8612.02]
  - - [64, 147, 432, 148, 64, 64, 64, 148]
    - [33, 6371.93]
  - - [4096, 3559, 1, 1024, 4096, 4096, 4096, 1024]
    - [5, 9906.25]
  - - [4096, 3368, 1, 1024, 4096, 4096, 4096, 1024]
    - [0, 9720.91]
  - - [1024, 3335, 1, 4096, 1024, 1024, 1024, 4096]
    - [24, 8990.19]
  - - [1024, 3510, 1, 4096, 1024, 1024, 1024, 4096]
    - [24, 9440.58]
  - - [4096, 3209, 1, 1024, 4096, 4096, 4096, 1024]
    - [5, 9632.66]
  - - [4096, 3322, 1, 1024, 4096, 4096, 4096, 1024]
    - [4, 9939.42]
  - - [1024, 3400, 1, 4096, 1024, 1024, 1024, 4096]
    - [23, 9155.99]
  - - [1024, 3995, 1, 4096, 1024, 1024, 1024, 4096]
    - [6, 9610.15]
  - - [1024, 3503, 1, 4096, 1024, 1024, 1024, 4096]
    - [24, 9446.47]
  - - [4096, 3594, 1, 1024, 4096, 4096, 4096, 1024]
    - [15, 9691.86]
  - - [4096, 3473, 1, 1024, 4096, 4096, 4096, 1024]
    - [4, 9698.8]
  - - [4096, 3522, 1, 1024, 4096, 4096, 4096, 1024]
    - [5, 9816.82]
  - - [1024, 3103, 1, 4096, 1024, 1024, 1024, 4096]
    - [2, 8490.95]
  - - [1024, 3214, 1, 4096, 1024, 1024, 1024, 4096]
    - [23, 8667.57]
  - - [4096, 3449, 1, 1024, 4096, 4096, 4096, 1024]
    - [15, 9795.61]
  - - [1024, 3136, 1, 4096, 1024, 1024, 1024, 4096]
    - [24, 8500.51]
  - - [1024, 3955, 1, 33708, 1024, 1024, 1024, 33708]
    - [4, 9634.84]
  - - [1024, 3780, 1, 4096, 1024, 1024, 1024, 4096]
    - [7, 9088.78]
  - - [1024, 3906, 1, 33708, 1024, 1024, 1024, 33708]
    - [5, 9515.36]
  - - [1024, 3386, 1, 4096, 1024, 1024, 1024, 4096]
    - [24, 9115.95]
  - - [4096, 3396, 1, 1024, 4096, 4096, 4096, 1024]
    - [15, 9665.5]
  - - [1024, 3183, 1, 4096, 1024, 1024, 1024, 4096]
    - [2, 8662.84]
  - - [1024, 3098, 1, 4096, 1024, 1024, 1024, 4096]
    - [18, 8490.12]
  - - [1024, 3548, 1, 4096, 1024, 1024, 1024, 4096]
    - [24, 9555.53]
  - - [1024, 3224, 1, 4096, 1024, 1024, 1024, 4096]
    - [17, 8760.78]
  - - [4096, 3469, 1, 1024, 4096, 4096, 4096, 1024]
    - [4, 9687.11]
  - - [1024, 3582, 1, 4096, 1024, 1024, 1024, 4096]
    - [21, 9690.9]
  - - [1024, 2977, 1, 4096, 1024, 1024, 1024, 4096]
    - [6, 9379.28]
  - - [1024, 3939, 1, 1024, 1024, 1024, 1024, 1024]
    - [3, 9172.01]
  - - [64, 123, 528, 123, 64, 64, 64, 123]
    - [51, 6346.07]
  - - [64, 12, 5040, 12, 64, 64, 64, 12]
    - [28, 1536.0]
  - - [4096, 3176, 1, 1024, 4096, 4096, 4096, 1024]
    - [16, 9712.1]
  - - [1024, 3559, 1, 4096, 1024, 1024, 1024, 4096]
    - [20, 9579.74]
  - - [1024, 3478, 1, 4096, 1024, 1024, 1024, 4096]
    - [24, 9373.75]
  - - [4096, 3343, 1, 1024, 4096, 4096, 4096, 1024]
    - [0, 9638.67]
  - - [4096, 3440, 1, 1024, 4096, 4096, 4096, 1024]
    - [0, 9853.86]
  - - [1024, 3996, 1, 33708, 1024, 1024, 1024, 33708]
    - [4, 9733.45]
  - - [1024, 4012, 1, 4096, 1024, 1024, 1024, 4096]
    - [5, 9636.89]
  - - [1024, 3322, 1, 4096, 1024, 1024, 1024, 4096]
    - [24, 8945.02]
  - - [1024, 3990, 1, 33708, 1024, 1024, 1024, 33708]
    - [4, 9720.21]
  - - [1024, 3314, 1, 4096, 1024, 1024, 1024, 4096]
    - [24, 8944.62]
  - - [4096, 3513, 1, 1024, 4096, 4096, 4096, 1024]
    - [4, 9794.85]
  - - [1024, 3562, 1, 4096, 1024, 1024, 1024, 4096]
    - [24, 9597.18]
  - - [1024, 3443, 1, 4096, 1024, 1024, 1024, 4096]
    - [24, 9279.42]
  - - [1024, 3554, 1, 4096, 1024, 1024, 1024, 4096]
    - [21, 9552.06]
  - - [1024, 3063, 1, 4096, 1024, 1024, 1024, 4096]
    - [6, 9622.48]
  - - [64, 111, 576, 112, 64, 64, 64, 112]
    - [51, 6274.55]
  - - [4096, 3460, 1, 1024, 4096, 4096, 4096, 1024]
    - [4, 9665.59]
  - - [1024, 3209, 1, 4096, 1024, 1024, 1024, 4096]
    - [3, 8708.29]
  - - [1024, 3147, 1, 4096, 1024, 1024, 1024, 4096]
    - [24, 8492.13]
  - - [4096, 3387, 1, 1024, 4096, 4096, 4096, 1024]
    - [1, 9761.24]
  - - [4096, 3436, 1, 1024, 4096, 4096, 4096, 1024]
    - [0, 9815.05]
  - - [1024, 3341, 1, 4096, 1024, 1024, 1024, 4096]
    - [23, 9004.97]
  - - [1024, 3516, 1, 4096, 1024, 1024, 1024, 4096]
    - [23, 9471.29]
  - - [4096, 3277, 1, 1024, 4096, 4096, 4096, 1024]
    - [4, 9807.02]
  - - [1024, 3454, 1, 4096, 1024, 1024, 1024, 4096]
    - [24, 9300.93]
  - - [1024, 3969, 1, 4096, 1024, 1024, 1024, 4096]
    - [4, 9539.72]
  - - [1024, 3999, 1, 4096, 1024, 1024, 1024, 4096]
    - [5, 9607.42]
  - - [1024, 4032, 1, 4096, 1024, 1024, 1024, 4096]
    - [6, 9693.37]
  - - [4096, 3541, 1, 1024, 4096, 4096, 4096, 1024]
    - [5, 9866.63]
  - - [4096, 3334, 1, 1024, 4096, 4096, 4096, 1024]
    - [16, 9614.31]
  - - [1024, 3365, 1, 4096, 1024, 1024, 1024, 4096]
    - [24, 9058.48]
  - - [1024, 3527, 1, 4096, 1024, 1024, 1024, 4096]
    - [24, 9510.21]
  - - [1024, 3190, 1, 4096, 1024, 1024, 1024, 4096]
    - [23, 8627.7]
  - - [4096, 3906, 1, 1024, 4096, 4096, 4096, 1024]
    - [1, 9817.68]
  - - [1024, 3593, 1, 4096, 1024, 1024, 1024, 4096]
    - [6, 8662.99]
  - - [1024, 3336, 1, 4096, 1024, 1024, 1024, 4096]
    - [24, 8991.03]
  - - [4096, 3504, 1, 1024, 4096, 4096, 4096, 1024]
    - [4, 9769.76]
  - - [4096, 3977, 1, 1024, 4096, 4096, 4096, 1024]
    - [5, 9742.52]
  - - [1024, 3906, 1, 4096, 1024, 1024, 1024, 4096]
    - [5, 9386.15]
  - - [4096, 3415, 1, 1024, 4096, 4096, 4096, 1024]
    - [15, 9802.6]
  - - [1024, 3295, 1, 4096, 1024, 1024, 1024, 4096]
    - [23, 8879.16]
  - - [4096, 3321, 1, 1024, 4096, 4096, 4096, 1024]
    - [5, 9931.33]
  - - [1024, 3072, 1, 4096, 1024, 1024, 1024, 4096]
    - [6, 9671.61]
  - - [1024, 3408, 1, 4096, 1024, 1024, 1024, 4096]
    - [23, 9182.73]
  - - [1024, 3522, 1, 4096, 1024, 1024, 1024, 4096]
    - [24, 9484.53]
  - - [4096, 3751, 1, 1024, 4096, 4096, 4096, 1024]
    - [5, 9778.76]
  - - [4096, 3378, 1, 1024, 4096, 4096, 4096, 1024]
    - [15, 9692.67]
  - - [64, 77, 816, 77, 64, 64, 64, 77]
    - [57, 4850.19]
  - - [1024, 3925, 1, 33708, 1024, 1024, 1024, 33708]
    - [4, 9560.78]
  - - [1024, 3990, 1, 1024, 1024, 1024, 1024, 1024]
    - [6, 9272.65]
  - - [1024, 3290, 1, 4096, 1024, 1024, 1024, 4096]
    - [17, 8905.51]
  - - [4096, 3500, 1, 1024, 4096, 4096, 4096, 1024]
    - [5, 9761.72]
  - - [4096, 3565, 1, 1024, 4096, 4096, 4096, 1024]
    - [4, 9919.27]
  - - [1024, 3484, 1, 4096, 1024, 1024, 1024, 4096]
    - [23, 9376.42]
  - - [4096, 3395, 1, 1024, 4096, 4096, 4096, 1024]
    - [16, 9788.06]
  - - [64, 92, 688, 92, 64, 64, 64, 92]
    - [43, 5606.0]
  - - [1024, 3681, 1, 1024, 1024, 1024, 1024, 1024]
    - [8, 8690.13]
  - - [64, 159, 400, 159, 64, 64, 64, 159]
    - [35, 6518.87]
  - - [1024, 3584, 1, 1024, 1024, 1024, 1024, 1024]
    - [23, 9365.27]
  - - [4096, 3093, 1, 1024, 4096, 4096, 4096, 1024]
    - [15, 9623.31]
  - - [1024, 4050, 1, 1024, 1024, 1024, 1024, 1024]
    - [7, 9354.04]
  - - [1024, 3301, 1, 4096, 1024, 1024, 1024, 4096]
    - [24, 8888.94]
  - - [1024, 3581, 1, 4096, 1024, 1024, 1024, 4096]
    - [23, 9673.72]
  - - [4096, 3374, 1, 1024, 4096, 4096, 4096, 1024]
    - [16, 9707.23]
  - - [1024, 3449, 1, 4096, 1024, 1024, 1024, 4096]
    - [24, 9270.8]
  - - [4096, 3215, 1, 1024, 4096, 4096, 4096, 1024]
    - [5, 9645.15]
  - - [4096, 3312, 1, 1024, 4096, 4096, 4096, 1024]
    - [5, 9888.62]
  - - [4096, 3479, 1, 1024, 4096, 4096, 4096, 1024]
    - [5, 9698.51]
  - - [4096, 3544, 1, 1024, 4096, 4096, 4096, 1024]
    - [5, 9874.99]
  - - [1024, 3263, 1, 4096, 1024, 1024, 1024, 4096]
    - [24, 8787.51]
  - - [4096, 3455, 1, 1024, 4096, 4096, 4096, 1024]
    - [15, 9845.19]
  - - [1024, 3379, 1, 4096, 1024, 1024, 1024, 4096]
    - [21, 9099.91]
  - - [1024, 3490, 1, 4096, 1024, 1024, 1024, 4096]
    - [24, 9397.39]
  - - [1024, 3368, 1, 4096, 1024, 1024, 1024, 4096]
    - [24, 9079.15]
  - - [4096, 3186, 1, 1024, 4096, 4096, 4096, 1024]
    - [0, 9750.07]
  - - [1024, 3428, 1, 4096, 1024, 1024, 1024, 4096]
    - [24, 9232.82]
  - - [64, 85, 752, 84, 64, 64, 64, 84]
    - [39, 5342.57]
  - - [4096, 3561, 1, 1024, 4096, 4096, 4096, 1024]
    - [5, 9913.92]
  - - [4096, 3418, 1, 1024, 4096, 4096, 4096, 1024]
    - [15, 9765.76]
  - - [1024, 3064, 1, 4096, 1024, 1024, 1024, 4096]
    - [6, 9621.58]
  - - [4096, 3259, 1, 1024, 4096, 4096, 4096, 1024]
    - [5, 9765.42]
  - - [4096, 3308, 1, 1024, 4096, 4096, 4096, 1024]
    - [4, 9900.36]
  - - [1024, 3533, 1, 4096, 1024, 1024, 1024, 4096]
    - [24, 9520.02]
  - - [1024, 3344, 1, 4096, 1024, 1024, 1024, 4096]
    - [24, 9014.45]
  - - [1024, 4030, 1, 1024, 1024, 1024, 1024, 1024]
    - [6, 9354.0]
  - - [4096, 3459, 1, 1024, 4096, 4096, 4096, 1024]
    - [5, 9656.1]
  - - [1024, 3572, 1, 4096, 1024, 1024, 1024, 4096]
    - [21, 9639.97]
  - - [1024, 3925, 1, 1024, 1024, 1024, 1024, 1024]
    - [17, 9173.64]
  - - [4096, 3435, 1, 1024, 4096, 4096, 4096, 1024]
    - [0, 9778.1]
  - - [1024, 3956, 1, 4096, 1024, 1024, 1024, 4096]
    - [7, 9498.46]
  - - [1024, 3463, 1, 4096, 1024, 1024, 1024, 4096]
    - [24, 9332.36]
  - - [4096, 3182, 1, 1024, 4096, 4096, 4096, 1024]
    - [15, 9826.74]
  - - [4096, 3976, 1, 1024, 4096, 4096, 4096, 1024]
    - [15, 9741.89]
  - - [1024, 3417, 1, 4096, 1024, 1024, 1024, 4096]
    - [24, 9208.87]
  - - [1024, 3528, 1, 4096, 1024, 1024, 1024, 4096]
    - [24, 9508.99]
  - - [4096, 3446, 1, 1024, 4096, 4096, 4096, 1024]
    - [15, 9816.87]
  - - [64, 122, 528, 123, 64, 64, 64, 123]
    - [51, 6325.88]
  - - [1024, 3543, 1, 4096, 1024, 1024, 1024, 4096]
    - [24, 9538.63]
  - - [4096, 3287, 1, 1024, 4096, 4096, 4096, 1024]
    - [4, 9845.94]
  - - [1024, 3499, 1, 4096, 1024, 1024, 1024, 4096]
    - [24, 9428.41]
  - - [1024, 3231, 1, 4096, 1024, 1024, 1024, 4096]
    - [17, 8769.81]
  - - [64, 17, 3632, 17, 64, 64, 64, 17]
    - [39, 1934.84]
  - - [4096, 3519, 1, 1024, 4096, 4096, 4096, 1024]
    - [4, 9804.28]
  - - [4096, 3552, 1, 1024, 4096, 4096, 4096, 1024]
    - [4, 9892.55]
  - - [1024, 3458, 1, 4096, 1024, 1024, 1024, 4096]
    - [24, 9312.18]
  - - [64, 93, 688, 92, 64, 64, 64, 92]
    - [43, 5660.12]
  - - [1024, 3374, 1, 4096, 1024, 1024, 1024, 4096]
    - [18, 9110.31]
  - - [1024, 3396, 1, 4096, 1024, 1024, 1024, 4096]
    - [24, 9145.69]
  - - [1024, 2967, 1, 4096, 1024, 1024, 1024, 4096]
    - [6, 9364.66]
  - - [64, 19, 3264, 19, 64, 64, 64, 19]
    - [43, 2142.37]
  - - [4096, 3482, 1, 1024, 4096, 4096, 4096, 1024]
    - [4, 9714.1]
  - - [64, 32, 1984, 32, 64, 64, 64, 32]
    - [54, 3619.81]
  - - [64, 102, 624, 99, 64, 64, 64, 99]
    - [45, 5515.23]
  - - [1024, 3226, 1, 4096, 1024, 1024, 1024, 4096]
    - [3, 8790.37]
  - - [4096, 3377, 1, 1024, 4096, 4096, 4096, 1024]
    - [1, 9683.98]
  - - [4096, 3426, 1, 1024, 4096, 4096, 4096, 1024]
    - [16, 9869.84]
  - - [4096, 2935, 1, 1024, 4096, 4096, 4096, 1024]
    - [16, 9762.01]
  - - [64, 133, 480, 133, 64, 64, 64, 133]
    - [55, 5891.22]
  - - [1024, 3439, 1, 4096, 1024, 1024, 1024, 4096]
    - [24, 9253.89]
  - - [4096, 3267, 1, 1024, 4096, 4096, 4096, 1024]
    - [4, 9783.8]
  - - [4096, 3499, 1, 1024, 4096, 4096, 4096, 1024]
    - [5, 9761.01]
  - - [4096, 3356, 1, 1024, 4096, 4096, 4096, 1024]
    - [16, 9679.34]
  - - [64, 232, 272, 232, 64, 64, 64, 232]
    - [59, 7180.93]
  - - [64, 162, 400, 159, 64, 64, 64, 159]
    - [19, 6444.53]
  - - [4096, 3939, 1, 1024, 4096, 4096, 4096, 1024]
    - [15, 9877.9]
  - - [1024, 3526, 1, 4096, 1024, 1024, 1024, 4096]
    - [24, 9508.0]
  - - [1024, 3859, 1, 33708, 1024, 1024, 1024, 33708]
    - [5, 9402.03]
  - - [1024, 3385, 1, 4096, 1024, 1024, 1024, 4096]
    - [23, 9107.18]
  - - [1024, 3496, 1, 4096, 1024, 1024, 1024, 4096]
    - [24, 9417.9]
  - - [4096, 3141, 1, 1024, 4096, 4096, 4096, 1024]
    - [16, 9682.44]
  - - [4096, 3510, 1, 1024, 4096, 4096, 4096, 1024]
    - [4, 9786.49]
  - - [1024, 3434, 1, 4096, 1024, 1024, 1024, 4096]
    - [24, 9246.6]
  - - [4096, 3969, 1, 1024, 4096, 4096, 4096, 1024]
    - [4, 9714.75]
  - - [1024, 3121, 1, 4096, 1024, 1024, 1024, 4096]
    - [2, 8464.22]
  - - [1024, 3232, 1, 4096, 1024, 1024, 1024, 4096]
    - [24, 8711.63]
  - - [1024, 4030, 1, 33708, 1024, 1024, 1024, 33708]
    - [5, 9816.21]
  - - [1024, 3780, 1, 33708, 1024, 1024, 1024, 33708]
    - [13, 9315.44]
  - - [1024, 3969, 1, 1024, 1024, 1024, 1024, 1024]
    - [2, 9248.44]
  - - [4096, 3527, 1, 1024, 4096, 4096, 4096, 1024]
    - [4, 9832.84]
  - - [4096, 3336, 1, 1024, 4096, 4096, 4096, 1024]
    - [1, 9623.25]
  - - [4096, 3290, 1, 1024, 4096, 4096, 4096, 1024]
    - [4, 9852.11]
  - - [64, 9, 6544, 9, 64, 64, 64, 9]
    - [44, 1068.14]
  - - [1024, 3469, 1, 4096, 1024, 1024, 1024, 4096]
    - [24, 9350.45]
  - - [4096, 3490, 1, 1024, 4096, 4096, 4096, 1024]
    - [4, 9737.46]
  - - [4096, 3064, 1, 1024, 4096, 4096, 4096, 1024]
    - [4, 9889.92]
  - - [4096, 3582, 1, 1024, 4096, 4096, 4096, 1024]
    - [5, 9961.28]
  - - [1024, 3956, 1, 1024, 1024, 1024, 1024, 1024]
    - [2, 9294.15]
  - - [4096, 3417, 1, 1024, 4096, 4096, 4096, 1024]
    - [0, 9811.56]
  - - [1024, 2736, 1, 4096, 1024, 1024, 1024, 4096]
    - [6, 8636.6]
  - - [64, 78, 816, 78, 64, 64, 64, 78]
    - [43, 4946.0]
  - - [1024, 3205, 1, 4096, 1024, 1024, 1024, 4096]
    - [18, 8657.11]
  - - [1024, 3143, 1, 4096, 1024, 1024, 1024, 4096]
    - [18, 8567.77]
  - - [1024, 4020, 1, 4096, 1024, 1024, 1024, 4096]
    - [6, 9664.52]
  - - [1024, 3318, 1, 4096, 1024, 1024, 1024, 4096]
    - [3, 8966.95]
  - - [4096, 3364, 1, 1024, 4096, 4096, 4096, 1024]
    - [16, 9697.08]
  - - [1024, 3353, 1, 4096, 1024, 1024, 1024, 4096]
    - [24, 9034.07]
  - - [1024, 3464, 1, 4096, 1024, 1024, 1024, 4096]
    - [24, 9325.95]
  - - [4096, 3205, 1, 1024, 4096, 4096, 4096, 1024]
    - [4, 9619.0]
  - - [4096, 3318, 1, 1024, 4096, 4096, 4096, 1024]
    - [5, 9932.56]
  - - [1024, 3402, 1, 4096, 1024, 1024, 1024, 4096]
    - [23, 9153.39]
  - - [4096, 3181, 1, 1024, 4096, 4096, 4096, 1024]
    - [15, 9789.05]
  - - [4096, 3550, 1, 1024, 4096, 4096, 4096, 1024]
    - [5, 9888.03]
  - - [4096, 3445, 1, 1024, 4096, 4096, 4096, 1024]
    - [15, 9752.55]
  - - [1024, 3138, 1, 4096, 1024, 1024, 1024, 4096]
    - [1, 8484.0]
  - - [64, 99, 624, 99, 64, 64, 64, 99]
    - [51, 5323.89]
  - - [4096, 3079, 1, 1024, 4096, 4096, 4096, 1024]
    - [1, 9562.16]
  - - [4096, 3144, 1, 1024, 4096, 4096, 4096, 1024]
    - [15, 9686.56]
  - - [4096, 3860, 1, 1024, 4096, 4096, 4096, 1024]
    - [16, 9733.32]
  - - [1024, 3515, 1, 4096, 1024, 1024, 1024, 4096]
    - [24, 9478.34]
  - - [4096, 3408, 1, 1024, 4096, 4096, 4096, 1024]
    - [1, 9764.86]
  - - [64, 101, 624, 102, 64, 64, 64, 102]
    - [51, 5482.69]
  - - [1024, 3181, 1, 4096, 1024, 1024, 1024, 4096]
    - [3, 8593.16]
  - - [4096, 3298, 1, 1024, 4096, 4096, 4096, 1024]
    - [5, 9867.62]
  - - [4096, 3585, 1, 1024, 4096, 4096, 4096, 1024]
    - [15, 9632.91]
  - - [1024, 3550, 1, 4096, 1024, 1024, 1024, 4096]
    - [24, 9564.36]
  - - [1024, 4020, 1, 1024, 1024, 1024, 1024, 1024]
    - [7, 9339.05]
  - - [4096, 3481, 1, 1024, 4096, 4096, 4096, 1024]
    - [5, 9713.9]
  - - [4096, 3530, 1, 1024, 4096, 4096, 4096, 1024]
    - [5, 9833.89]
  - - [4096, 3425, 1, 1024, 4096, 4096, 4096, 1024]
    - [1, 9675.56]
  - - [4096, 4026, 1, 1024, 4096, 4096, 4096, 1024]
    - [5, 9849.67]
  - - [1024, 3860, 1, 1024, 1024, 1024, 1024, 1024]
    - [18, 9073.49]
  - - [4096, 3975, 1, 1024, 4096, 4096, 4096, 1024]
    - [5, 9737.62]
  - - [1024, 3286, 1, 4096, 1024, 1024, 1024, 4096]
    - [2, 8884.14]
  - - [1024, 3176, 1, 4096, 1024, 1024, 1024, 4096]
    - [2, 8597.38]
  - - [1024, 3894, 1, 4096, 1024, 1024, 1024, 4096]
    - [6, 9359.03]
  - - [4096, 3355, 1, 1024, 4096, 4096, 4096, 1024]
    - [15, 9692.99]
  - - [4096, 3404, 1, 1024, 4096, 4096, 4096, 1024]
    - [15, 9786.02]
  - - [1024, 3501, 1, 4096, 1024, 1024, 1024, 4096]
    - [23, 9426.04]
  - - [4096, 3245, 1, 1024, 4096, 4096, 4096, 1024]
    - [5, 9723.47]
  - - [1024, 3431, 1, 4096, 1024, 1024, 1024, 4096]
    - [21, 9244.22]
  - - [1024, 4000, 1, 1024, 1024, 1024, 1024, 1024]
    - [17, 9343.93]
  - - [4096, 3509, 1, 1024, 4096, 4096, 4096, 1024]
    - [4, 9781.62]
  - - [4096, 3558, 1, 1024, 4096, 4096, 4096, 1024]
    - [5, 9905.05]
  - - [1024, 3535, 1, 4096, 1024, 1024, 1024, 4096]
    - [23, 9519.05]
  - - [1024, 3414, 1, 4096, 1024, 1024, 1024, 4096]
    - [21, 9197.95]
  - - [1024, 3445, 1, 4096, 1024, 1024, 1024, 4096]
    - [24, 9279.56]
  - - [1024, 3436, 1, 4096, 1024, 1024, 1024, 4096]
    - [24, 9259.6]
  - - [4096, 3472, 1, 1024, 4096, 4096, 4096, 1024]
    - [5, 9685.17]
  - - [1024, 3211, 1, 4096, 1024, 1024, 1024, 4096]
    - [3, 8708.31]
  - - [64, 7, 8192, 7, 64, 64, 64, 7]
    - [40, 802.816]
  - - [4096, 3383, 1, 1024, 4096, 4096, 4096, 1024]
    - [15, 9734.72]
  - - [4096, 3448, 1, 1024, 4096, 4096, 4096, 1024]
    - [16, 9828.44]
  - - [1024, 3343, 1, 4096, 1024, 1024, 1024, 4096]
    - [17, 9010.36]
  - - [1024, 3518, 1, 4096, 1024, 1024, 1024, 4096]
    - [24, 9467.92]
  - - [4096, 3289, 1, 1024, 4096, 4096, 4096, 1024]
    - [5, 9844.06]
  - - [1024, 3440, 1, 4096, 1024, 1024, 1024, 4096]
    - [20, 9269.42]
  - - [1024, 4032, 1, 33708, 1024, 1024, 1024, 33708]
    - [4, 9822.31]
  - - [4096, 3489, 1, 1024, 4096, 4096, 4096, 1024]
    - [4, 9741.93]
  - - [4096, 3346, 1, 1024, 4096, 4096, 4096, 1024]
    - [1, 9616.64]
  - - [1024, 3534, 1, 4096, 1024, 1024, 1024, 4096]
    - [23, 9524.19]
  - - [1024, 3079, 1, 4096, 1024, 1024, 1024, 4096]
    - [18, 8397.67]
  - - [1024, 3955, 1, 4096, 1024, 1024, 1024, 4096]
    - [5, 9492.15]
  - - [4096, 3236, 1, 1024, 4096, 4096, 4096, 1024]
    - [5, 9705.93]
  - - [1024, 3545, 1, 4096, 1024, 1024, 1024, 4096]
    - [23, 9551.87]
  - - [1024, 3144, 1, 4096, 1024, 1024, 1024, 4096]
    - [17, 8556.7]
  - - [4096, 3780, 1, 1024, 4096, 4096, 4096, 1024]
    - [4, 9847.5]
  - - [4096, 3163, 1, 1024, 4096, 4096, 4096, 1024]
    - [15, 9717.69]
  - - [4096, 3468, 1, 1024, 4096, 4096, 4096, 1024]
    - [5, 9686.39]
  - - [1024, 3539, 1, 4096, 1024, 1024, 1024, 4096]
    - [24, 9526.89]
  - - [1024, 3541, 1, 4096, 1024, 1024, 1024, 4096]
    - [24, 9532.76]
  - - [4096, 3363, 1, 1024, 4096, 4096, 4096, 1024]
    - [0, 9699.0]
  - - [1024, 3475, 1, 4096, 1024, 1024, 1024, 4096]
    - [24, 9357.0]
  - - [4096, 3110, 1, 1024, 4096, 4096, 4096, 1024]
    - [16, 9659.58]
  - - [1024, 3509, 1, 4096, 1024, 1024, 1024, 4096]
    - [23, 9450.49]
  - - [1024, 3413, 1, 4096, 1024, 1024, 1024, 4096]
    - [24, 9185.81]
  - - [1024, 3975, 1, 1024, 1024, 1024, 1024, 1024]
    - [2, 9315.42]
  - - [4096, 3549, 1, 1024, 4096, 4096, 4096, 1024]
    - [5, 9884.72]
  - - [4096, 3342, 1, 1024, 4096, 4096, 4096, 1024]
    - [15, 9644.27]
  - - [1024, 2985, 1, 4096, 1024, 1024, 1024, 4096]
    - [5, 9392.07]
  - - [1024, 3876, 1, 33708, 1024, 1024, 1024, 33708]
    - [4, 9442.22]
  - - [4096, 3280, 1, 1024, 4096, 4096, 4096, 1024]
    - [4, 9819.92]
  - - [4096, 3191, 1, 1024, 4096, 4096, 4096, 1024]
    - [16, 9862.08]
  - - [4096, 3512, 1, 1024, 4096, 4096, 4096, 1024]
    - [5, 9793.11]
  - - [1024, 3560, 1, 4096, 1024, 1024, 1024, 4096]
    - [21, 9555.45]
  - - [4096, 2499, 1, 1024, 4096, 4096, 4096, 1024]
    - [5, 9669.35]
  - - [1024, 3248, 1, 4096, 1024, 1024, 1024, 4096]
    - [2, 8811.84]
  - - [4096, 3423, 1, 1024, 4096, 4096, 4096, 1024]
    - [16, 9729.67]
  - - [64, 111, 576, 111, 64, 64, 64, 111]
    - [51, 5982.63]
  - - [4096, 3297, 1, 1024, 4096, 4096, 4096, 1024]
    - [4, 9865.19]
  - - [4096, 3154, 1, 1024, 4096, 4096, 4096, 1024]
    - [16, 9613.42]
  - - [1024, 3303, 1, 4096, 1024, 1024, 1024, 4096]
    - [3, 8951.79]
  - - [1024, 3222, 1, 4096, 1024, 1024, 1024, 4096]
    - [23, 8682.89]
  - - [1024, 3978, 1, 1024, 1024, 1024, 1024, 1024]
    - [7, 9234.93]
  - - [4096, 3529, 1, 1024, 4096, 4096, 4096, 1024]
    - [5, 9831.62]
  - - [4096, 3386, 1, 1024, 4096, 4096, 4096, 1024]
    - [15, 9755.67]
  - - [64, 134, 480, 134, 64, 64, 64, 134]
    - [30, 5990.53]
  - - [1024, 3451, 1, 4096, 1024, 1024, 1024, 4096]
    - [21, 9277.61]
  - - [4096, 3562, 1, 1024, 4096, 4096, 4096, 1024]
    - [5, 9908.82]
  - - [4096, 3276, 1, 1024, 4096, 4096, 4096, 1024]
    - [4, 9818.04]
  - - [64, 135, 480, 132, 64, 64, 64, 132]
    - [59, 6071.77]
  - - [1024, 3894, 1, 33708, 1024, 1024, 1024, 33708]
    - [4, 9487.79]
  - - [64, 134, 480, 132, 64, 64, 64, 132]
    - [58, 6091.65]
  - - [4096, 3540, 1, 1024, 4096, 4096, 4096, 1024]
    - [5, 9862.79]
  - - [1024, 3416, 1, 4096, 1024, 1024, 1024, 4096]
    - [23, 9206.17]
  - - [1024, 4005, 1, 33708, 1024, 1024, 1024, 33708]
    - [4, 9757.19]
  - - [1024, 3942, 1, 4096, 1024, 1024, 1024, 4096]
    - [7, 9455.75]
  - - [4096, 3403, 1, 1024, 4096, 4096, 4096, 1024]
    - [15, 9739.36]
  - - [4096, 3381, 1, 1024, 4096, 4096, 4096, 1024]
    - [16, 9760.04]
  - - [1024, 3492, 1, 4096, 1024, 1024, 1024, 4096]
    - [20, 9391.69]
  - - [4096, 3101, 1, 1024, 4096, 4096, 4096, 1024]
    - [16, 9625.92]
  - - [1024, 3430, 1, 4096, 1024, 1024, 1024, 4096]
    - [24, 9232.04]
  - - [1024, 3977, 1, 4096, 1024, 1024, 1024, 4096]
    - [7, 9562.9]
  - - [1024, 3640, 1, 4096, 1024, 1024, 1024, 4096]
    - [6, 8761.4]
  - - [4096, 3557, 1, 1024, 4096, 4096, 4096, 1024]
    - [5, 9905.42]
  - - [4096, 3414, 1, 1024, 4096, 4096, 4096, 1024]
    - [1, 9755.39]
  - - [1024, 3391, 1, 4096, 1024, 1024, 1024, 4096]
    - [24, 9142.56]
  - - [64, 134, 480, 135, 64, 64, 64, 135]
    - [33, 5922.05]
  - - [64, 16, 3840, 16, 64, 64, 64, 16]
    - [49, 2080.51]
  - - [1024, 3356, 1, 4096, 1024, 1024, 1024, 4096]
    - [24, 9050.99]
  - - [4096, 3320, 1, 1024, 4096, 4096, 4096, 1024]
    - [5, 9929.47]
  - - [4096, 2765, 1, 1024, 4096, 4096, 4096, 1024]
    - [5, 9750.18]
  - - [64, 162, 400, 162, 64, 64, 64, 162]
    - [22, 6515.19]
  - - [1024, 3411, 1, 4096, 1024, 1024, 1024, 4096]
    - [24, 9185.62]
  - - [1024, 3978, 1, 4096, 1024, 1024, 1024, 4096]
    - [4, 9562.67]
  - - [4096, 3487, 1, 1024, 4096, 4096, 4096, 1024]
    - [5, 9733.75]
  - - [4096, 3520, 1, 1024, 4096, 4096, 4096, 1024]
    - [4, 9813.85]
  - - [4096, 3942, 1, 1024, 4096, 4096, 4096, 1024]
    - [15, 9804.29]
  - - [4096, 3431, 1, 1024, 4096, 4096, 4096, 1024]
    - [0, 9818.96]
  - - [1024, 3271, 1, 4096, 1024, 1024, 1024, 4096]
    - [17, 8912.98]
  - - [4096, 4020, 1, 1024, 4096, 4096, 4096, 1024]
    - [4, 9831.32]
  - - [1024, 3481, 1, 4096, 1024, 1024, 1024, 4096]
    - [20, 9376.05]
  - - [1024, 3419, 1, 4096, 1024, 1024, 1024, 4096]
    - [23, 9208.58]
  - - [1024, 4059, 1, 4096, 1024, 1024, 1024, 4096]
    - [7, 9733.73]
  - - [4096, 3345, 1, 1024, 4096, 4096, 4096, 1024]
    - [16, 9651.33]
  - - [4096, 3394, 1, 1024, 4096, 4096, 4096, 1024]
    - [16, 9780.33]
  - - [1024, 3298, 1, 4096, 1024, 1024, 1024, 4096]
    - [23, 8889.53]
  - - [4096, 3235, 1, 1024, 4096, 4096, 4096, 1024]
    - [5, 9705.71]
  - - [1024, 3681, 1, 33708, 1024, 1024, 1024, 33708]
    - [12, 9146.12]
  - - [1024, 3840, 1, 4096, 1024, 1024, 1024, 4096]
    - [5, 9253.85]
  - - [1024, 3362, 1, 4096, 1024, 1024, 1024, 4096]
    - [24, 9059.71]
  - - [4096, 3467, 1, 1024, 4096, 4096, 4096, 1024]
    - [4, 9677.41]
  - - [1024, 3349, 1, 4096, 1024, 1024, 1024, 4096]
    - [24, 9033.97]
  - - [1024, 3460, 1, 4096, 1024, 1024, 1024, 4096]
    - [24, 9322.84]
  - - [4096, 3214, 1, 1024, 4096, 4096, 4096, 1024]
    - [5, 9644.36]
  - - [1024, 3398, 1, 4096, 1024, 1024, 1024, 4096]
    - [24, 9157.19]
  - - [4096, 3478, 1, 1024, 4096, 4096, 4096, 1024]
    - [4, 9706.56]
  - - [1024, 4050, 1, 33708, 1024, 1024, 1024, 33708]
    - [4, 9865.04]
  - - [1024, 3244, 1, 4096, 1024, 1024, 1024, 4096]
    - [20, 8744.43]
  - - [4096, 3341, 1, 1024, 4096, 4096, 4096, 1024]
    - [16, 9646.69]
  - - [4096, 3454, 1, 1024, 4096, 4096, 4096, 1024]
    - [1, 9880.46]
  - - [1024, 3166, 1, 4096, 1024, 1024, 1024, 4096]
    - [18, 8618.36]
  - - [1024, 3425, 1, 4096, 1024, 1024, 1024, 4096]
    - [24, 9225.22]
  - - [4096, 3295, 1, 1024, 4096, 4096, 4096, 1024]
    - [5, 9863.71]
  - - [4096, 3072, 1, 1024, 4096, 4096, 4096, 1024]
    - [4, 9970.99]
  - - [4096, 3822, 1, 1024, 4096, 4096, 4096, 1024]
    - [5, 9951.97]
  - - [1024, 3681, 1, 4096, 1024, 1024, 1024, 4096]
    - [6, 8856.84]
  - - [1024, 4050, 1, 4096, 1024, 1024, 1024, 4096]
    - [6, 9717.48]
  - - [4096, 3495, 1, 1024, 4096, 4096, 4096, 1024]
    - [4, 9741.04]
  - - [4096, 3560, 1, 1024, 4096, 4096, 4096, 1024]
    - [5, 9909.04]
  - - [1024, 3524, 1, 4096, 1024, 1024, 1024, 4096]
    - [23, 9503.1]
  - - [1024, 3942, 1, 33708, 1024, 1024, 1024, 33708]
    - [4, 9602.57]
  - - [1024, 3304, 1, 4096, 1024, 1024, 1024, 4096]
    - [3, 8928.66]
  - - [1024, 3387, 1, 4096, 1024, 1024, 1024, 4096]
    - [24, 9127.55]
  - - [1024, 3498, 1, 4096, 1024, 1024, 1024, 4096]
    - [23, 9423.29]
  - - [4096, 3458, 1, 1024, 4096, 4096, 4096, 1024]
    - [4, 9642.53]
  - - [4096, 2967, 1, 1024, 4096, 4096, 4096, 1024]
    - [4, 9626.61]
  - - [64, 8, 7280, 8, 64, 64, 64, 8]
    - [26, 1032.51]
  - - [4096, 3385, 1, 1024, 4096, 4096, 4096, 1024]
    - [0, 9735.67]
  - - [4096, 3434, 1, 1024, 4096, 4096, 4096, 1024]
    - [15, 9808.8]
  - - [1024, 3519, 1, 4096, 1024, 1024, 1024, 4096]
    - [24, 9484.73]
  - - [1024, 3511, 1, 4096, 1024, 1024, 1024, 4096]
    - [24, 9456.37]
  - - [1024, 3288, 1, 4096, 1024, 1024, 1024, 4096]
    - [23, 8863.95]
  - - [1024, 2918, 1, 4096, 1024, 1024, 1024, 4096]
    - [6, 9170.25]
  - - [4096, 3573, 1, 1024, 4096, 4096, 4096, 1024]
    - [5, 9945.75]
  - - [1024, 3822, 1, 33708, 1024, 1024, 1024, 33708]
    - [14, 9330.9]
  - - [64, 102, 624, 102, 64, 64, 64, 102]
    - [51, 5531.07]
  - - [4096, 3539, 1, 1024, 4096, 4096, 4096, 1024]
    - [5, 9855.29]
  - - [4096, 3332, 1, 1024, 4096, 4096, 4096, 1024]
    - [16, 9648.87]
  - - [4096, 3286, 1, 1024, 4096, 4096, 4096, 1024]
    - [5, 9846.32]
  - - [1024, 4026, 1, 4096, 1024, 1024, 1024, 4096]
    - [6, 9675.84]
  - - [1024, 3277, 1, 4096, 1024, 1024, 1024, 4096]
    - [20, 8836.11]
  - - [1024, 3471, 1, 4096, 1024, 1024, 1024, 4096]
    - [24, 9346.23]
  - - [4096, 3518, 1, 1024, 4096, 4096, 4096, 1024]
    - [5, 9804.1]
  - - [1024, 3393, 1, 4096, 1024, 1024, 1024, 4096]
    - [24, 9148.89]
  - - [4096, 3413, 1, 1024, 4096, 4096, 4096, 1024]
    - [1, 9785.07]
  - - [4096, 3303, 1, 1024, 4096, 4096, 4096, 1024]
    - [5, 9884.27]
  - - [1024, 3207, 1, 4096, 1024, 1024, 1024, 4096]
    - [2, 8714.59]
  - - [1024, 3894, 1, 1024, 1024, 1024, 1024, 1024]
    - [18, 9181.41]
  - - [1024, 3977, 1, 1024, 1024, 1024, 1024, 1024]
    - [18, 9240.8]
  - - [64, 135, 480, 133, 64, 64, 64, 133]
    - [33, 5923.3]
  - - [4096, 3535, 1, 1024, 4096, 4096, 4096, 1024]
    - [5, 9839.45]
  - - [4096, 3376, 1, 1024, 4096, 4096, 4096, 1024]
    - [0, 9711.92]
  - - [1024, 3355, 1, 4096, 1024, 1024, 1024, 4096]
    - [24, 9043.17]
  - - [64, 27, 2336, 27, 64, 64, 64, 27]
    - [52, 2929.8]
  - - [1024, 3466, 1, 4096, 1024, 1024, 1024, 4096]
    - [24, 9339.0]
  - - [4096, 3266, 1, 1024, 4096, 4096, 4096, 1024]
    - [5, 9789.19]
  - - [1024, 3404, 1, 4096, 1024, 1024, 1024, 4096]
    - [24, 9176.66]
  - - [1024, 3999, 1, 1024, 1024, 1024, 1024, 1024]
    - [17, 9391.81]
  - - [64, 148, 432, 143, 64, 64, 64, 143]
    - [30, 6182.82]
  - - [4096, 3498, 1, 1024, 4096, 4096, 4096, 1024]
    - [4, 9764.46]
  - - [1024, 4032, 1, 1024, 1024, 1024, 1024, 1024]
    - [2, 9401.93]
  - - [1024, 3410, 1, 4096, 1024, 1024, 1024, 4096]
    - [23, 9183.4]
  - - [4096, 3393, 1, 1024, 4096, 4096, 4096, 1024]
    - [16, 9695.39]
  - - [1024, 3140, 1, 4096, 1024, 1024, 1024, 4096]
    - [17, 8504.76]
  - - [1024, 3910, 1, 33708, 1024, 1024, 1024, 33708]
    - [4, 9525.96]
  - - [1024, 3334, 1, 4096, 1024, 1024, 1024, 4096]
    - [23, 8987.49]
  - - [4096, 3140, 1, 1024, 4096, 4096, 4096, 1024]
    - [16, 9660.61]
  - - [1024, 4005, 1, 4096, 1024, 1024, 1024, 4096]
    - [7, 9629.78]
  - - [1024, 3579, 1, 4096, 1024, 1024, 1024, 4096]
    - [23, 9661.35]
  - - [4096, 3372, 1, 1024, 4096, 4096, 4096, 1024]
    - [16, 9697.22]
  - - [1024, 3245, 1, 4096, 1024, 1024, 1024, 4096]
    - [17, 8847.66]
  - - [64, 38, 1680, 38, 64, 64, 64, 38]
    - [27, 3340.34]
  - - [4096, 3956, 1, 1024, 4096, 4096, 4096, 1024]
    - [16, 9911.05]
  - - [4096, 3213, 1, 1024, 4096, 4096, 4096, 1024]
    - [4, 9643.01]
  - - [1024, 3361, 1, 4096, 1024, 1024, 1024, 4096]
    - [24, 9062.14]
  - - [1024, 3536, 1, 4096, 1024, 1024, 1024, 4096]
    - [23, 9530.55]
  - - [1024, 3968, 1, 1024, 1024, 1024, 1024, 1024]
    - [18, 9377.82]
  - - [4096, 3477, 1, 1024, 4096, 4096, 4096, 1024]
    - [5, 9700.67]
  - - [4096, 3526, 1, 1024, 4096, 4096, 4096, 1024]
    - [5, 9824.31]
  - - [1024, 4005, 1, 1024, 1024, 1024, 1024, 1024]
    - [2, 9362.29]
  - - [1024, 3530, 1, 4096, 1024, 1024, 1024, 4096]
    - [21, 9487.07]
  - - [1024, 3944, 1, 4096, 1024, 1024, 1024, 4096]
    - [6, 9464.45]
  - - [4096, 3453, 1, 1024, 4096, 4096, 4096, 1024]
    - [15, 9826.67]
  - - [4096, 3184, 1, 1024, 4096, 4096, 4096, 1024]
    - [16, 9833.49]
  - - [4096, 3579, 1, 1024, 4096, 4096, 4096, 1024]
    - [5, 9962.45]
  - - [4096, 3351, 1, 1024, 4096, 4096, 4096, 1024]
    - [16, 9653.24]
  - - [4096, 3416, 1, 1024, 4096, 4096, 4096, 1024]
    - [0, 9810.3]
  - - [64, 100, 624, 100, 64, 64, 64, 100]
    - [51, 5408.45]
  - - [1024, 3822, 1, 4096, 1024, 1024, 1024, 4096]
    - [6, 9196.1]
  - - [1024, 3796, 1, 4096, 1024, 1024, 1024, 4096]
    - [6, 9131.86]
  - - [4096, 3257, 1, 1024, 4096, 4096, 4096, 1024]
    - [4, 9767.24]
  - - [4096, 3306, 1, 1024, 4096, 4096, 4096, 1024]
    - [4, 9893.25]
  - - [1024, 3505, 1, 4096, 1024, 1024, 1024, 4096]
    - [24, 9449.92]
  - - [1024, 3315, 1, 4096, 1024, 1024, 1024, 4096]
    - [17, 8979.67]
  - - [1024, 3486, 1, 4096, 1024, 1024, 1024, 4096]
    - [23, 9393.38]
  - - [4096, 3457, 1, 1024, 4096, 4096, 4096, 1024]
    - [4, 9653.09]
  - - [4096, 3870, 1, 1024, 4096, 4096, 4096, 1024]
    - [1, 9717.41]
  - - [1024, 3447, 1, 4096, 1024, 1024, 1024, 4096]
    - [24, 9273.04]
  - - [1024, 3558, 1, 4096, 1024, 1024, 1024, 4096]
    - [21, 9567.23]
  - - [4096, 3433, 1, 1024, 4096, 4096, 4096, 1024]
    - [1, 9759.16]
  - - [4096, 3180, 1, 1024, 4096, 4096, 4096, 1024]
    - [16, 9738.53]
  - - [1024, 3213, 1, 4096, 1024, 1024, 1024, 4096]
    - [2, 8692.15]
  - - [1024, 3900, 1, 4096, 1024, 1024, 1024, 4096]
    - [6, 9388.51]
  - - [4096, 3444, 1, 1024, 4096, 4096, 4096, 1024]
    - [15, 9869.63]
  - - [1024, 3504, 1, 4096, 1024, 1024, 1024, 4096]
    - [24, 9429.28]
  - - [4096, 4059, 1, 1024, 4096, 4096, 4096, 1024]
    - [5, 9920.69]
  - - [1024, 3442, 1, 4096, 1024, 1024, 1024, 4096]
    - [24, 9272.91]
  - - [4096, 3517, 1, 1024, 4096, 4096, 4096, 1024]
    - [4, 9808.09]
  - - [1024, 3566, 1, 4096, 1024, 1024, 1024, 4096]
    - [23, 9622.79]
  - - [4096, 3248, 1, 1024, 4096, 4096, 4096, 1024]
    - [4, 9730.23]
  - - [1024, 3547, 1, 4096, 1024, 1024, 1024, 4096]
    - [23, 9564.63]
  - - [64, 59, 1088, 59, 64, 64, 64, 59]
    - [42, 4611.66]
  - - [1024, 3340, 1, 4096, 1024, 1024, 1024, 4096]
    - [23, 8992.11]
  - - [4096, 3480, 1, 1024, 4096, 4096, 4096, 1024]
    - [5, 9710.07]
  - - [1024, 3968, 1, 4096, 1024, 1024, 1024, 4096]
    - [5, 9543.01]
  - - [4096, 3424, 1, 1024, 4096, 4096, 4096, 1024]
    - [1, 9808.56]
  - - [1024, 3906, 1, 1024, 1024, 1024, 1024, 1024]
    - [3, 9150.44]
  - - [4096, 3265, 1, 1024, 4096, 4096, 4096, 1024]
    - [4, 9786.75]
  - - [1024, 3384, 1, 4096, 1024, 1024, 1024, 4096]
    - [24, 9119.46]
  - - [1024, 3494, 1, 4096, 1024, 1024, 1024, 4096]
    - [21, 9415.42]
  - - [1024, 3236, 1, 4096, 1024, 1024, 1024, 4096]
    - [18, 8767.04]
  - - [4096, 3497, 1, 1024, 4096, 4096, 4096, 1024]
    - [5, 9750.76]
  - - [4096, 3354, 1, 1024, 4096, 4096, 4096, 1024]
    - [16, 9665.07]
  - - [4096, 3055, 1, 1024, 4096, 4096, 4096, 1024]
    - [5, 9883.99]
  - - [64, 11, 5456, 11, 64, 64, 64, 11]
    - [28, 1368.24]
  - - [4096, 3244, 1, 1024, 4096, 4096, 4096, 1024]
    - [4, 9719.92]
  - - [4096, 3139, 1, 1024, 4096, 4096, 4096, 1024]
    - [15, 9736.96]
  - - [4096, 3508, 1, 1024, 4096, 4096, 4096, 1024]
    - [4, 9771.56]
  - - [4096, 4050, 1, 1024, 4096, 4096, 4096, 1024]
    - [4, 9898.69]
  - - [1024, 3472, 1, 4096, 1024, 1024, 1024, 4096]
    - [23, 9353.73]
  - - [1024, 3861, 1, 1024, 1024, 1024, 1024, 1024]
    - [2, 9061.22]
  - - [1024, 3910, 1, 1024, 1024, 1024, 1024, 1024]
    - [6, 9043.44]
  - - [4096, 3371, 1, 1024, 4096, 4096, 4096, 1024]
    - [16, 9738.14]
  - - [64, 65, 992, 65, 64, 64, 64, 65]
    - [55, 4354.49]
  - - [1024, 3751, 1, 4096, 1024, 1024, 1024, 4096]
    - [5, 9018.64]
  - - [4096, 3325, 1, 1024, 4096, 4096, 4096, 1024]
    - [4, 9958.63]
  - - [1024, 3321, 1, 4096, 1024, 1024, 1024, 4096]
    - [24, 8952.45]
  - - [1024, 3944, 1, 1024, 1024, 1024, 1024, 1024]
    - [3, 9117.25]
  - - [4096, 3525, 1, 1024, 4096, 4096, 4096, 1024]
    - [5, 9822.04]
  - - [4096, 3382, 1, 1024, 4096, 4096, 4096, 1024]
    - [16, 9720.11]
  - - [64, 122, 528, 122, 64, 64, 64, 122]
    - [51, 6389.23]
  - - [1024, 3453, 1, 4096, 1024, 1024, 1024, 4096]
    - [21, 9304.93]
  - - [4096, 3564, 1, 1024, 4096, 4096, 4096, 1024]
    - [4, 9911.22]
  - - [4096, 3288, 1, 1024, 4096, 4096, 4096, 1024]
    - [4, 9841.07]
  - - [1024, 3925, 1, 4096, 1024, 1024, 1024, 4096]
    - [5, 9418.85]
  - - [1024, 3057, 1, 4096, 1024, 1024, 1024, 4096]
    - [6, 9590.41]
  - - [4096, 3488, 1, 1024, 4096, 4096, 4096, 1024]
    - [5, 9732.4]
  - - [4096, 3046, 1, 1024, 4096, 4096, 4096, 1024]
    - [5, 9850.62]
  - - [1024, 3189, 1, 4096, 1024, 1024, 1024, 4096]
    - [17, 8676.92]
  - - [4096, 3399, 1, 1024, 4096, 4096, 4096, 1024]
    - [1, 9672.99]
  - - [1024, 3383, 1, 4096, 1024, 1024, 1024, 4096]
    - [24, 9102.27]
  - - [1024, 3415, 1, 4096, 1024, 1024, 1024, 4096]
    - [24, 9216.27]
  - - [1024, 3388, 1, 4096, 1024, 1024, 1024, 4096]
    - [24, 9127.43]
  - - [1024, 3376, 1, 4096, 1024, 1024, 1024, 4096]
    - [21, 9090.43]
  - - [1024, 3473, 1, 4096, 1024, 1024, 1024, 4096]
    - [24, 9354.02]
  - - [4096, 3162, 1, 1024, 4096, 4096, 4096, 1024]
    - [0, 9694.73]
  - - [1024, 3448, 1, 4096, 1024, 1024, 1024, 4096]
    - [24, 9283.35]
  - - [4096, 3362, 1, 1024, 4096, 4096, 4096, 1024]
    - [16, 9673.23]
  - - [64, 228, 272, 228, 64, 64, 64, 228]
    - [9, 7039.03]
  - - [1024, 3262, 1, 4096, 1024, 1024, 1024, 4096]
    - [18, 8850.74]
  - - [1024, 3184, 1, 4096, 1024, 1024, 1024, 4096]
    - [3, 8625.27]
  - - [1024, 3378, 1, 4096, 1024, 1024, 1024, 4096]
    - [23, 9105.17]
  - - [4096, 3548, 1, 1024, 4096, 4096, 4096, 1024]
    - [4, 9877.73]
  - - [4096, 2977, 1, 1024, 4096, 4096, 4096, 1024]
    - [4, 9647.71]
  - - [64, 21, 2976, 21, 64, 64, 64, 21]
    - [39, 2364.71]
  - - [64, 112, 576, 111, 64, 64, 64, 111]
    - [38, 5973.58]
  - - [4096, 3443, 1, 1024, 4096, 4096, 4096, 1024]
    - [0, 9784.4]
  - - [1024, 3289, 1, 4096, 1024, 1024, 1024, 4096]
    - [24, 8873.94]
  - - [1024, 3483, 1, 4096, 1024, 1024, 1024, 4096]
    - [20, 9380.47]
  - - [4096, 3190, 1, 1024, 4096, 4096, 4096, 1024]
    - [16, 9850.86]
  - - [1024, 3421, 1, 4096, 1024, 1024, 1024, 4096]
    - [24, 9213.96]
  - - [1024, 3514, 1, 4096, 1024, 1024, 1024, 4096]
    - [23, 9458.13]
  - - [1024, 3532, 1, 4096, 1024, 1024, 1024, 4096]
    - [24, 9512.93]
  - - [1024, 3565, 1, 4096, 1024, 1024, 1024, 4096]
    - [23, 9630.5]
  - - [4096, 3422, 1, 1024, 4096, 4096, 4096, 1024]
    - [1, 9733.69]
  - - [4096, 3263, 1, 1024, 4096, 4096, 4096, 1024]
    - [5, 9776.84]
  - - [4096, 3296, 1, 1024, 4096, 4096, 4096, 1024]
    - [5, 9860.51]
  - - [4096, 3640, 1, 1024, 4096, 4096, 4096, 1024]
    - [15, 9782.2]
  - - [4096, 3463, 1, 1024, 4096, 4096, 4096, 1024]
    - [4, 9671.9]
  - - [4096, 3528, 1, 1024, 4096, 4096, 4096, 1024]
    - [5, 9829.88]
  - - [1024, 3351, 1, 4096, 1024, 1024, 1024, 4096]
    - [18, 9054.27]
  - - [1024, 3462, 1, 4096, 1024, 1024, 1024, 4096]
    - [24, 9327.75]
  - - [4096, 3226, 1, 1024, 4096, 4096, 4096, 1024]
    - [5, 9674.83]
  - - [4096, 3439, 1, 1024, 4096, 4096, 4096, 1024]
    - [0, 9823.08]
  - - [4096, 3121, 1, 1024, 4096, 4096, 4096, 1024]
    - [0, 9672.54]
  - - [1024, 4059, 1, 33708, 1024, 1024, 1024, 33708]
    - [4, 9885.62]
  - - [1024, 3311, 1, 4096, 1024, 1024, 1024, 4096]
    - [24, 8909.91]
  - - [1024, 3230, 1, 4096, 1024, 1024, 1024, 4096]
    - [24, 8705.8]
  - - [4096, 3353, 1, 1024, 4096, 4096, 4096, 1024]
    - [16, 9671.76]
  - - [4096, 3402, 1, 1024, 4096, 4096, 4096, 1024]
    - [1, 9726.94]
  - - [1024, 3427, 1, 4096, 1024, 1024, 1024, 4096]
    - [24, 9233.45]
  - - [1024, 3346, 1, 4096, 1024, 1024, 1024, 4096]
    - [24, 9015.67]
  - - [1024, 3126, 1, 4096, 1024, 1024, 1024, 4096]
    - [18, 8519.21]
  - - [1024, 3796, 1, 1024, 1024, 1024, 1024, 1024]
    - [2, 8916.65]
  - - [1024, 3990, 1, 4096, 1024, 1024, 1024, 4096]
    - [6, 9600.76]
  - - [1024, 3257, 1, 4096, 1024, 1024, 1024, 4096]
    - [2, 8790.32]
  - - [4096, 3996, 1, 1024, 4096, 4096, 4096, 1024]
    - [5, 9788.15]
  - - [64, 143, 432, 143, 64, 64, 64, 143]
    - [33, 6087.14]
  - - [1024, 3306, 1, 4096, 1024, 1024, 1024, 4096]
    - [17, 9035.59]
  - - [1024, 3389, 1, 4096, 1024, 1024, 1024, 4096]
    - [24, 9134.82]
  - - [1024, 3500, 1, 4096, 1024, 1024, 1024, 4096]
    - [24, 9443.23]
  - - [1024, 3999, 1, 33708, 1024, 1024, 1024, 33708]
    - [5, 9741.14]
  - - [4096, 3486, 1, 1024, 4096, 4096, 4096, 1024]
    - [5, 9719.57]
  - - [1024, 3438, 1, 4096, 1024, 1024, 1024, 4096]
    - [24, 9259.28]
  - - [4096, 3616, 1, 1024, 4096, 4096, 4096, 1024]
    - [15, 9739.67]
  - - [1024, 3955, 1, 1024, 1024, 1024, 1024, 1024]
    - [17, 9260.27]
  - - [4096, 3430, 1, 1024, 4096, 4096, 4096, 1024]
    - [16, 9819.85]
  - - [4096, 3271, 1, 1024, 4096, 4096, 4096, 1024]
    - [5, 9801.94]
  - - [1024, 3364, 1, 4096, 1024, 1024, 1024, 4096]
    - [17, 9144.53]
  - - [64, 54, 1184, 54, 64, 64, 64, 54]
    - [37, 4315.68]
  - - [1024, 3497, 1, 4096, 1024, 1024, 1024, 4096]
    - [24, 9429.32]
  - - [4096, 3503, 1, 1024, 4096, 4096, 4096, 1024]
    - [4, 9764.38]
  - - [4096, 3344, 1, 1024, 4096, 4096, 4096, 1024]
    - [1, 9614.06]
  - - [1024, 3457, 1, 4096, 1024, 1024, 1024, 4096]
    - [24, 9320.5]
  - - [4096, 3466, 1, 1024, 4096, 4096, 4096, 1024]
    - [4, 9677.71]
  - - [1024, 3976, 1, 33708, 1024, 1024, 1024, 33708]
    - [5, 9685.28]
  - - [1024, 3395, 1, 4096, 1024, 1024, 1024, 4096]
    - [23, 9146.29]
  - - [4096, 3361, 1, 1024, 4096, 4096, 4096, 1024]
    - [15, 9677.79]
  - - [1024, 3751, 1, 33708, 1024, 1024, 1024, 33708]
    - [13, 9234.59]
  - - [1024, 3822, 1, 1024, 1024, 1024, 1024, 1024]
    - [2, 8977.73]
  - - [4096, 3315, 1, 1024, 4096, 4096, 4096, 1024]
    - [5, 9922.44]
  - - [1024, 3163, 1, 4096, 1024, 1024, 1024, 4096]
    - [17, 8577.69]
  - - [4096, 3547, 1, 1024, 4096, 4096, 4096, 1024]
    - [5, 9882.82]
  - - [4096, 3340, 1, 1024, 4096, 4096, 4096, 1024]
    - [15, 9635.32]
  - - [1024, 3296, 1, 4096, 1024, 1024, 1024, 4096]
    - [24, 8874.56]
  - - [1024, 3468, 1, 4096, 1024, 1024, 1024, 4096]
    - [24, 9350.16]
  - - [4096, 3294, 1, 1024, 4096, 4096, 4096, 1024]
    - [4, 9856.77]
  - - [1024, 3406, 1, 4096, 1024, 1024, 1024, 4096]
    - [20, 9162.74]
  - - [1024, 3860, 1, 33708, 1024, 1024, 1024, 33708]
    - [4, 9403.46]
  - - [1024, 3584, 1, 4096, 1024, 1024, 1024, 4096]
    - [21, 9677.34]
  - - [4096, 3189, 1, 1024, 4096, 4096, 4096, 1024]
    - [16, 9820.59]
  - - [4096, 3494, 1, 1024, 4096, 4096, 4096, 1024]
    - [4, 9747.58]
  - - [64, 135, 480, 135, 64, 64, 64, 135]
    - [30, 5966.24]
  - - [1024, 3093, 1, 4096, 1024, 1024, 1024, 4096]
    - [18, 8445.96]
  - - [4096, 3421, 1, 1024, 4096, 4096, 4096, 1024]
    - [1, 9775.93]
  - - [1024, 3479, 1, 4096, 1024, 1024, 1024, 4096]
    - [24, 9376.44]
  - - [1024, 3433, 1, 4096, 1024, 1024, 1024, 4096]
    - [24, 9251.04]
  - - [4096, 3311, 1, 1024, 4096, 4096, 4096, 1024]
    - [4, 9901.43]
  - - [1024, 3381, 1, 4096, 1024, 1024, 1024, 4096]
    - [24, 9103.89]
  - - [1024, 3996, 1, 4096, 1024, 1024, 1024, 4096]
    - [5, 9609.46]
  - - [4096, 3384, 1, 1024, 4096, 4096, 4096, 1024]
    - [15, 9749.91]
  - - [1024, 3247, 1, 4096, 1024, 1024, 1024, 4096]
    - [3, 8872.49]
  - - [1024, 3169, 1, 4096, 1024, 1024, 1024, 4096]
    - [2, 8597.51]
  - - [1024, 3088, 1, 4096, 1024, 1024, 1024, 4096]
    - [18, 8409.97]
  - - [1024, 3363, 1, 4096, 1024, 1024, 1024, 4096]
    - [24, 9069.4]
  - - [1024, 3538, 1, 4096, 1024, 1024, 1024, 4096]
    - [23, 9529.58]
  - - [1024, 3996, 1, 1024, 1024, 1024, 1024, 1024]
    - [7, 9322.96]
  - - [4096, 3169, 1, 1024, 4096, 4096, 4096, 1024]
    - [1, 9821.3]
  - - [4096, 3538, 1, 1024, 4096, 4096, 4096, 1024]
    - [4, 9859.32]
  - - [4096, 3401, 1, 1024, 4096, 4096, 4096, 1024]
    - [1, 9754.4]
  - - [4096, 3581, 1, 1024, 4096, 4096, 4096, 1024]
    - [4, 9960.61]
  - - [1024, 3180, 1, 4096, 1024, 1024, 1024, 4096]
    - [2, 8634.95]
  - - [1024, 3870, 1, 1024, 1024, 1024, 1024, 1024]
    - [3, 9085.59]
  - - [4096, 3555, 1, 1024, 4096, 4096, 4096, 1024]
    - [4, 9905.64]
  - - [4096, 3412, 1, 1024, 4096, 4096, 4096, 1024]
    - [16, 9778.46]
  - - [4096, 3302, 1, 1024, 4096, 4096, 4096, 1024]
    - [4, 9888.61]
  - - [1024, 3561, 1, 4096, 1024, 1024, 1024, 4096]
    - [20, 9596.95]
  - - [1024, 3302, 1, 4096, 1024, 1024, 1024, 4096]
    - [24, 8900.77]
  - - [1024, 3976, 1, 4096, 1024, 1024, 1024, 4096]
    - [6, 9563.12]
  - - [4096, 3485, 1, 1024, 4096, 4096, 4096, 1024]
    - [4, 9722.47]
  - - [4096, 3534, 1, 1024, 4096, 4096, 4096, 1024]
    - [4, 9847.12]
  - - [1024, 3110, 1, 4096, 1024, 1024, 1024, 4096]
    - [17, 8458.46]
  - - [1024, 3401, 1, 4096, 1024, 1024, 1024, 4096]
    - [24, 9174.71]
  - - [4096, 3216, 1, 1024, 4096, 4096, 4096, 1024]
    - [4, 9645.39]
  - - [1024, 4020, 1, 33708, 1024, 1024, 1024, 33708]
    - [4, 9793.51]
  - - [1024, 3215, 1, 4096, 1024, 1024, 1024, 4096]
    - [24, 8677.41]
  - - [4096, 3566, 1, 1024, 4096, 4096, 4096, 1024]
    - [4, 9924.68]
  - - [1024, 3137, 1, 4096, 1024, 1024, 1024, 4096]
    - [2, 8546.97]
  - - [4096, 3359, 1, 1024, 4096, 4096, 4096, 1024]
    - [1, 9673.63]
  - - [4096, 3392, 1, 1024, 4096, 4096, 4096, 1024]
    - [16, 9757.41]
  - - [1024, 3506, 1, 4096, 1024, 1024, 1024, 4096]
    - [24, 9442.9]
  - - [4096, 3233, 1, 1024, 4096, 4096, 4096, 1024]
    - [4, 9698.6]
  - - [1024, 3444, 1, 4096, 1024, 1024, 1024, 4096]
    - [24, 9275.44]
  - - [1024, 3975, 1, 4096, 1024, 1024, 1024, 4096]
    - [5, 9556.77]
  - - [1024, 3870, 1, 33708, 1024, 1024, 1024, 33708]
    - [4, 9427.34]
  - - [4096, 3465, 1, 1024, 4096, 4096, 4096, 1024]
    - [5, 9674.91]
  - - [4096, 3968, 1, 1024, 4096, 4096, 4096, 1024]
    - [1, 9927.83]
  - - [1024, 3523, 1, 4096, 1024, 1024, 1024, 4096]
    - [24, 9494.05]
  - - [64, 10, 5952, 10, 64, 64, 64, 10]
    - [28, 1224.06]
  - - [4096, 3990, 1, 1024, 4096, 4096, 4096, 1024]
    - [4, 9771.17]
  - - [1024, 3549, 1, 4096, 1024, 1024, 1024, 4096]
    - [23, 9553.32]
  - - [1024, 3342, 1, 4096, 1024, 1024, 1024, 4096]
    - [24, 9007.21]
  - - [4096, 3476, 1, 1024, 4096, 4096, 4096, 1024]
    - [4, 9703.56]
  - - [64, 232, 272, 228, 64, 64, 64, 228]
    - [10, 7078.83]
  - - [1024, 3418, 1, 4096, 1024, 1024, 1024, 4096]
    - [24, 9212.99]
  - - [1024, 3859, 1, 1024, 1024, 1024, 1024, 1024]
    - [3, 9087.44]
  - - [4096, 3339, 1, 1024, 4096, 4096, 4096, 1024]
    - [16, 9593.9]
  - - [4096, 3452, 1, 1024, 4096, 4096, 4096, 1024]
    - [1, 9872.59]
  - - [4096, 3293, 1, 1024, 4096, 4096, 4096, 1024]
    - [4, 9842.55]
  - - [4096, 3840, 1, 1024, 4096, 4096, 4096, 1024]
    - [5, 10030.7]
  - - [1024, 3369, 1, 4096, 1024, 1024, 1024, 4096]
    - [2, 9099.62]
  - - [64, 193, 320, 193, 64, 64, 64, 193]
    - [32, 6425.7]
  - - [1024, 3544, 1, 4096, 1024, 1024, 1024, 4096]
    - [21, 9556.54]
  - - [4096, 3493, 1, 1024, 4096, 4096, 4096, 1024]
    - [5, 9743.24]
  - - [4096, 3350, 1, 1024, 4096, 4096, 4096, 1024]
    - [16, 9653.01]
  - - [64, 71, 896, 71, 64, 64, 64, 71]
    - [56, 4686.63]
  - - [4096, 3256, 1, 1024, 4096, 4096, 4096, 1024]
    - [4, 9763.68]
  - - [1024, 3870, 1, 4096, 1024, 1024, 1024, 4096]
    - [6, 9305.18]
  - - [4096, 4012, 1, 1024, 4096, 4096, 4096, 1024]
    - [5, 9817.25]
  - - [1024, 3280, 1, 4096, 1024, 1024, 1024, 4096]
    - [24, 8841.92]
  - - [4096, 3456, 1, 1024, 4096, 4096, 4096, 1024]
    - [0, 9874.33]
  - - [1024, 3555, 1, 4096, 1024, 1024, 1024, 4096]
    - [23, 9599.53]
  - - [4096, 3014, 1, 1024, 4096, 4096, 4096, 1024]
    - [4, 9762.18]
  - - [1024, 3474, 1, 4096, 1024, 1024, 1024, 4096]
    - [24, 9373.57]
  - - [4096, 3367, 1, 1024, 4096, 4096, 4096, 1024]
    - [0, 9694.54]
  - - [4096, 3432, 1, 1024, 4096, 4096, 4096, 1024]
    - [16, 9855.17]
  - - [64, 84, 752, 84, 64, 64, 64, 84]
    - [43, 5247.08]
  - - [4096, 3273, 1, 1024, 4096, 4096, 4096, 1024]
    - [5, 9801.77]
  - - [4096, 3130, 1, 1024, 4096, 4096, 4096, 1024]
    - [1, 9672.42]
  - - [1024, 2984, 1, 4096, 1024, 1024, 1024, 4096]
    - [6, 9403.6]
  - - [1024, 3995, 1, 1024, 1024, 1024, 1024, 1024]
    - [18, 9392.51]
  - - [1024, 3517, 1, 4096, 1024, 1024, 1024, 4096]
    - [24, 9481.29]
  - - [1024, 3455, 1, 4096, 1024, 1024, 1024, 4096]
    - [24, 9302.19]
  - - [1024, 3939, 1, 4096, 1024, 1024, 1024, 4096]
    - [6, 9469.79]
  - - [64, 49, 1296, 49, 64, 64, 64, 49]
    - [36, 3938.86]
  - - [64, 14, 4368, 14, 64, 64, 64, 14]
    - [28, 1802.37]
  - - [64, 25, 2512, 25, 64, 64, 64, 25]
    - [47, 2760.44]
  - - [4096, 3147, 1, 1024, 4096, 4096, 4096, 1024]
    - [16, 9712.93]
  - - [4096, 3516, 1, 1024, 4096, 4096, 4096, 1024]
    - [4, 9805.83]
  - - [1024, 3876, 1, 4096, 1024, 1024, 1024, 4096]
    - [6, 9320.46]
  - - [1024, 3191, 1, 4096, 1024, 1024, 1024, 4096]
    - [3, 8640.66]
  - - [4096, 3411, 1, 1024, 4096, 4096, 4096, 1024]
    - [15, 9737.27]
  - - [1024, 3337, 1, 4096, 1024, 1024, 1024, 4096]
    - [24, 8990.03]
  - - [1024, 3512, 1, 4096, 1024, 1024, 1024, 4096]
    - [24, 9459.55]
  - - [4096, 3301, 1, 1024, 4096, 4096, 4096, 1024]
    - [4, 9877.16]
  - - [1024, 3450, 1, 4096, 1024, 1024, 1024, 4096]
    - [23, 9283.01]
  - - [4096, 3533, 1, 1024, 4096, 4096, 4096, 1024]
    - [4, 9848.52]
  - - [4096, 3390, 1, 1024, 4096, 4096, 4096, 1024]
    - [16, 9764.51]
  - - [4096, 3231, 1, 1024, 4096, 4096, 4096, 1024]
    - [4, 9693.71]
  - - [1024, 2499, 1, 4096, 1024, 1024, 1024, 4096]
    - [23, 9304.71]
  - - [1024, 3186, 1, 4096, 1024, 1024, 1024, 4096]
    - [3, 8649.45]
  - - [1024, 3380, 1, 4096, 1024, 1024, 1024, 4096]
    - [24, 9101.67]
  - - [4096, 3496, 1, 1024, 4096, 4096, 4096, 1024]
    - [5, 9754.2]
  - - [1024, 3956, 1, 33708, 1024, 1024, 1024, 33708]
    - [4, 9636.67]
  - - [1024, 3976, 1, 1024, 1024, 1024, 1024, 1024]
    - [6, 9248.31]
  - - [4096, 2736, 1, 1024, 4096, 4096, 4096, 1024]
    - [4, 9651.81]
  - - [1024, 3291, 1, 4096, 1024, 1024, 1024, 4096]
    - [24, 8868.84]
  - - [1024, 3944, 1, 33708, 1024, 1024, 1024, 33708]
    - [5, 9606.9]
  - - [1024, 3485, 1, 4096, 1024, 1024, 1024, 4096]
    - [23, 9385.86]
  - - [4096, 3138, 1, 1024, 4096, 4096, 4096, 1024]
    - [1, 9672.05]
  - - [1024, 3423, 1, 4096, 1024, 1024, 1024, 4096]
    - [24, 9222.67]
  - - [1024, 3491, 1, 4096, 1024, 1024, 1024, 4096]
    - [24, 9404.92]
  - - [1024, 3860, 1, 4096, 1024, 1024, 1024, 4096]
    - [7, 9282.84]
  - - [4096, 3211, 1, 1024, 4096, 4096, 4096, 1024]
    - [4, 9640.32]
  - - [1024, 3221, 1, 4096, 1024, 1024, 1024, 4096]
    - [18, 8709.3]
  - - [1024, 2917, 1, 4096, 1024, 1024, 1024, 4096]
    - [6, 9177.01]
  - - [4096, 3475, 1, 1024, 4096, 4096, 4096, 1024]
    - [4, 9703.35]
  - - [4096, 3524, 1, 1024, 4096, 4096, 4096, 1024]
    - [4, 9816.13]
  - - [4096, 2985, 1, 1024, 4096, 4096, 4096, 1024]
    - [5, 9686.81]
  - - [1024, 3480, 1, 4096, 1024, 1024, 1024, 4096]
    - [24, 9380.1]
  - - [4096, 3222, 1, 1024, 4096, 4096, 4096, 1024]
    - [4, 9666.7]
  - - [4096, 3451, 1, 1024, 4096, 4096, 4096, 1024]
    - [0, 9877.81]
  - - [1024, 3969, 1, 33708, 1024, 1024, 1024, 33708]
    - [4, 9669.54]
  - - [1024, 3640, 1, 1024, 1024, 1024, 1024, 1024]
    - [11, 8565.58]
  - - [1024, 3297, 1, 4096, 1024, 1024, 1024, 4096]
    - [20, 8889.12]
  - - [4096, 3944, 1, 1024, 4096, 4096, 4096, 1024]
    - [1, 9902.75]
  - - [1024, 3216, 1, 4096, 1024, 1024, 1024, 4096]
    - [3, 8695.78]
  - - [1024, 3840, 1, 1024, 1024, 1024, 1024, 1024]
    - [17, 9045.95]
  - - [4096, 3349, 1, 1024, 4096, 4096, 4096, 1024]
    - [15, 9676.72]
  - - [4096, 3398, 1, 1024, 4096, 4096, 4096, 1024]
    - [1, 9775.74]
  - - [1024, 3154, 1, 4096, 1024, 1024, 1024, 4096]
    - [18, 8662.16]
  - - [1024, 3978, 1, 33708, 1024, 1024, 1024, 33708]
    - [5, 9689.06]
  - - [1024, 3348, 1, 4096, 1024, 1024, 1024, 4096]
    - [24, 9014.57]
  - - [4096, 3304, 1, 1024, 4096, 4096, 4096, 1024]
    - [5, 9886.7]
  - - [4096, 4030, 1, 1024, 4096, 4096, 4096, 1024]
    - [5, 9859.0]
  - - [1024, 4026, 1, 1024, 1024, 1024, 1024, 1024]
    - [2, 9326.54]
  - - [4096, 3471, 1, 1024, 4096, 4096, 4096, 1024]
    - [4, 9682.9]
  - - [1024, 3259, 1, 4096, 1024, 1024, 1024, 4096]
    - [18, 8792.09]
  - - [64, 132, 480, 132, 64, 64, 64, 132]
    - [58, 6027.76]
  - - [1024, 3308, 1, 4096, 1024, 1024, 1024, 4096]
    - [23, 8905.04]
  - - [4096, 3391, 1, 1024, 4096, 4096, 4096, 1024]
    - [16, 9765.25]
  - - [1024, 3312, 1, 4096, 1024, 1024, 1024, 4096]
    - [24, 8917.64]
  - - [1024, 3502, 1, 4096, 1024, 1024, 1024, 4096]
    - [24, 9435.52]
  - - [1024, 3968, 1, 33708, 1024, 1024, 1024, 33708]
    - [4, 9668.14]
  - - [1024, 3424, 1, 4096, 1024, 1024, 1024, 4096]
    - [20, 9215.89]
  - - [64, 13, 4672, 13, 64, 64, 64, 13]
    - [29, 1662.25]
  - - [4096, 4032, 1, 1024, 4096, 4096, 4096, 1024]
    - [15, 9877.72]
  - - [1024, 3900, 1, 1024, 1024, 1024, 1024, 1024]
    - [18, 9116.83]
  - - [4096, 3442, 1, 1024, 4096, 4096, 4096, 1024]
    - [15, 9773.08]
  - - [1024, 3366, 1, 4096, 1024, 1024, 1024, 4096]
    - [24, 9079.36]
  - - [4096, 3999, 1, 1024, 4096, 4096, 4096, 1024]
    - [4, 9786.36]
  - - [1024, 3477, 1, 4096, 1024, 1024, 1024, 4096]
    - [24, 9364.79]
  - - [1024, 2505, 1, 4096, 1024, 1024, 1024, 4096]
    - [24, 9303.93]
  - - [4096, 3515, 1, 1024, 4096, 4096, 4096, 1024]
    - [4, 9797.83]
  - - [1024, 3564, 1, 4096, 1024, 1024, 1024, 4096]
    - [20, 9632.76]
  - - [4096, 3057, 1, 1024, 4096, 4096, 4096, 1024]
    - [5, 9880.09]
  - - [1024, 3339, 1, 4096, 1024, 1024, 1024, 4096]
    - [3, 9029.76]
  - - [4096, 3262, 1, 1024, 4096, 4096, 4096, 1024]
    - [4, 9780.0]
  - - [1024, 4030, 1, 4096, 1024, 1024, 1024, 4096]
    - [7, 9681.9]
  - - [1024, 3265, 1, 4096, 1024, 1024, 1024, 4096]
    - [24, 8797.42]
  - - [1024, 3459, 1, 4096, 1024, 1024, 1024, 4096]
    - [24, 9312.96]
  - - [4096, 3462, 1, 1024, 4096, 4096, 4096, 1024]
    - [5, 9669.63]
  - - [64, 85, 752, 85, 64, 64, 64, 85]
    - [43, 5186.83]
  - - [1024, 3513, 1, 4096, 1024, 1024, 1024, 4096]
    - [21, 9469.05]
  - - [1024, 3397, 1, 4096, 1024, 1024, 1024, 4096]
    - [24, 9151.67]
  - - [4096, 3572, 1, 1024, 4096, 4096, 4096, 1024]
    - [4, 9945.6]
  - - [4096, 3389, 1, 1024, 4096, 4096, 4096, 1024]
    - [16, 9740.76]
  - - [4096, 3438, 1, 1024, 4096, 4096, 4096, 1024]
    - [16, 9822.37]
  - - [64, 102, 624, 100, 64, 64, 64, 100]
    - [51, 5486.9]
  - - [1024, 3640, 1, 33708, 1024, 1024, 1024, 33708]
    - [12, 9083.43]
  - - [1024, 3995, 1, 33708, 1024, 1024, 1024, 33708]
    - [5, 9731.89]
  - - [1024, 3165, 1, 4096, 1024, 1024, 1024, 4096]
    - [17, 8601.8]
  - - [4096, 3543, 1, 1024, 4096, 4096, 4096, 1024]
    - [5, 9868.53]
  - - [4096, 3352, 1, 1024, 4096, 4096, 4096, 1024]
    - [0, 9668.34]
  - - [1024, 3359, 1, 4096, 1024, 1024, 1024, 4096]
    - [21, 9050.23]
  - - [1024, 3470, 1, 4096, 1024, 1024, 1024, 4096]
    - [24, 9355.07]
  - - [64, 15, 4096, 15, 64, 64, 64, 15]
    - [28, 1945.33]
  - - [1024, 3392, 1, 4096, 1024, 1024, 1024, 4096]
    - [23, 9139.61]
  - - [64, 78, 816, 77, 64, 64, 64, 77]
    - [35, 4870.46]
  - - [4096, 3137, 1, 1024, 4096, 4096, 4096, 1024]
    - [0, 9600.12]
  - - [4096, 3506, 1, 1024, 4096, 4096, 4096, 1024]
    - [5, 9778.98]
  - - [1024, 3095, 1, 4096, 1024, 1024, 1024, 4096]
    - [17, 8381.14]
  - - [1024, 3859, 1, 4096, 1024, 1024, 1024, 4096]
    - [4, 9288.53]
  - - [4096, 3369, 1, 1024, 4096, 4096, 4096, 1024]
    - [16, 9697.63]
  - - [64, 45, 1424, 45, 64, 64, 64, 45]
    - [53, 3883.64]
  - - [1024, 3435, 1, 4096, 1024, 1024, 1024, 4096]
    - [24, 9264.52]
  - - [1024, 3354, 1, 4096, 1024, 1024, 1024, 4096]
    - [24, 9035.37]
  - - [1024, 3055, 1, 4096, 1024, 1024, 1024, 4096]
    - [5, 9597.35]
  - - [4096, 3523, 1, 1024, 4096, 4096, 4096, 1024]
    - [4, 9821.69]
  - - [4096, 3380, 1, 1024, 4096, 4096, 4096, 1024]
    - [0, 9721.29]
  - - [1024, 3233, 1, 4096, 1024, 1024, 1024, 4096]
    - [17, 8724.65]
  - - [4096, 3221, 1, 1024, 4096, 4096, 4096, 1024]
    - [4, 9660.94]
  - - [4096, 3270, 1, 1024, 4096, 4096, 4096, 1024]
    - [4, 9797.82]
  - - [4096, 3593, 1, 1024, 4096, 4096, 4096, 1024]
    - [15, 9679.21]
  - - [1024, 3358, 1, 4096, 1024, 1024, 1024, 4096]
    - [24, 9051.72]
  - - [1024, 3540, 1, 4096, 1024, 1024, 1024, 4096]
    - [24, 9533.49]
  - - [4096, 3502, 1, 1024, 4096, 4096, 4096, 1024]
    - [5, 9760.55]
  - - [4096, 2505, 1, 1024, 4096, 4096, 4096, 1024]
    - [5, 9680.42]
  - - [4096, 3397, 1, 1024, 4096, 4096, 4096, 1024]
    - [15, 9785.75]
  - - [1024, 3300, 1, 4096, 1024, 1024, 1024, 4096]
    - [18, 8907.75]
  - - [4096, 3095, 1, 1024, 4096, 4096, 4096, 1024]
    - [1, 9618.68]
  - - [1024, 3182, 1, 4096, 1024, 1024, 1024, 4096]
    - [17, 8606.06]
  - - [1024, 3299, 1, 4096, 1024, 1024, 1024, 4096]
    - [23, 8885.38]
  - - [1024, 3276, 1, 4096, 1024, 1024, 1024, 4096]
    - [18, 8872.65]
  - - [1024, 3360, 1, 4096, 1024, 1024, 1024, 4096]
    - [21, 9044.1]
  - - [4096, 3360, 1, 1024, 4096, 4096, 4096, 1024]
    - [16, 9681.29]
  - - [4096, 2918, 1, 1024, 4096, 4096, 4096, 1024]
    - [0, 9732.64]
  - - [1024, 3939, 1, 33708, 1024, 1024, 1024, 33708]
    - [4, 9595.86]
  - - [4096, 3314, 1, 1024, 4096, 4096, 4096, 1024]
    - [5, 9914.92]
  - - [1024, 3319, 1, 4096, 1024, 1024, 1024, 4096]
    - [24, 8956.27]
  - - [64, 35, 1808, 35, 64, 64, 64, 35]
    - [41, 3060.17]
  - - [1024, 3942, 1, 1024, 1024, 1024, 1024, 1024]
    - [17, 9211.73]
  - - [1024, 3465, 1, 4096, 1024, 1024, 1024, 4096]
    - [24, 9340.63]
  - - [4096, 3546, 1, 1024, 4096, 4096, 4096, 1024]
    - [5, 9875.31]
  - - [1024, 3403, 1, 4096, 1024, 1024, 1024, 4096]
    - [17, 9224.24]
  - - [1024, 3948, 1, 1024, 1024, 1024, 1024, 1024]
    - [3, 9245.53]
  - - [4096, 3441, 1, 1024, 4096, 4096, 4096, 1024]
    - [16, 9758.62]
  - - [1024, 3139, 1, 4096, 1024, 1024, 1024, 4096]
    - [17, 8582.74]
  - - [1024, 3563, 1, 4096, 1024, 1024, 1024, 4096]
    - [24, 9620.64]
  - - [1024, 3508, 1, 4096, 1024, 1024, 1024, 4096]
    - [21, 9449.26]
  - - [1024, 3975, 1, 33708, 1024, 1024, 1024, 33708]
    - [4, 9683.45]
  - - [1024, 3446, 1, 4096, 1024, 1024, 1024, 4096]
    - [23, 9289.41]
  - - [1024, 3529, 1, 4096, 1024, 1024, 1024, 4096]
    - [20, 9491.19]
  - - [64, 112, 576, 112, 64, 64, 64, 112]
    - [45, 6387.04]
  - - [4096, 3461, 1, 1024, 4096, 4096, 4096, 1024]
    - [5, 9663.23]
  - - [1024, 3574, 1, 4096, 1024, 1024, 1024, 4096]
    - [23, 9662.78]
  - - [1024, 3101, 1, 4096, 1024, 1024, 1024, 4096]
    - [18, 8468.24]
  - - [1024, 3927, 1, 1024, 1024, 1024, 1024, 1024]
    - [3, 9207.87]
  - - [4096, 3224, 1, 1024, 4096, 4096, 4096, 1024]
    - [5, 9665.51]
  - - [4096, 3437, 1, 1024, 4096, 4096, 4096, 1024]
    - [1, 9857.11]
  - - [4096, 3900, 1, 1024, 4096, 4096, 4096, 1024]
    - [16, 9826.15]
  - - [1024, 3495, 1, 4096, 1024, 1024, 1024, 4096]
    - [24, 9412.31]
  - - [1024, 3977, 1, 33708, 1024, 1024, 1024, 33708]
    - [4, 9687.77]
  - - [1024, 3328, 1, 4096, 1024, 1024, 1024, 4096]
    - [24, 8975.47]
  - - [4096, 3168, 1, 1024, 4096, 4096, 4096, 1024]
    - [0, 9754.77]
  - - [1024, 4026, 1, 33708, 1024, 1024, 1024, 33708]
    - [4, 9807.14]
  - - [1024, 3292, 1, 4096, 1024, 1024, 1024, 4096]
    - [17, 8901.73]
  - - [1024, 3294, 1, 4096, 1024, 1024, 1024, 4096]
    - [24, 8876.93]
  - - [4096, 3335, 1, 1024, 4096, 4096, 4096, 1024]
    - [1, 9616.13]
  - - [4096, 3400, 1, 1024, 4096, 4096, 4096, 1024]
    - [15, 9710.63]
  - - [1024, 3287, 1, 4096, 1024, 1024, 1024, 4096]
    - [2, 8907.97]
  - - [1024, 3910, 1, 4096, 1024, 1024, 1024, 4096]
    - [6, 9400.93]
  - - [1024, 3780, 1, 1024, 1024, 1024, 1024, 1024]
    - [17, 8863.19]
  - - [4096, 3098, 1, 1024, 4096, 4096, 4096, 1024]
    - [1, 9606.37]
  - - [1024, 3584, 1, 33708, 1024, 1024, 1024, 33708]
    - [24, 9775.23]
  - - [64, 29, 2176, 29, 64, 64, 64, 29]
    - [46, 3134.93]
  - - [1024, 3371, 1, 4096, 1024, 1024, 1024, 4096]
    - [2, 9117.71]
  - - [1024, 3546, 1, 4096, 1024, 1024, 1024, 4096]
    - [24, 9547.2]
  - - [1024, 4012, 1, 1024, 1024, 1024, 1024, 1024]
    - [6, 9353.63]
  - - [4096, 3505, 1, 1024, 4096, 4096, 4096, 1024]
    - [4, 9773.07]
  - - [4096, 3554, 1, 1024, 4096, 4096, 4096, 1024]
    - [4, 9895.49]
  - - [4096, 3063, 1, 1024, 4096, 4096, 4096, 1024]
    - [4, 9898.88]
  - - [1024, 3900, 1, 33708, 1024, 1024, 1024, 33708]
    - [5, 9502.83]
  - - [1024, 3345, 1, 4096, 1024, 1024, 1024, 4096]
    - [24, 9015.75]
  - - [1024, 3357, 1, 4096, 1024, 1024, 1024, 4096]
    - [24, 9041.13]
  - - [1024, 3282, 1, 4096, 1024, 1024, 1024, 4096]
    - [17, 8860.07]
  - - [4096, 3484, 1, 1024, 4096, 4096, 4096, 1024]
    - [5, 9721.23]
  - - [1024, 3557, 1, 4096, 1024, 1024, 1024, 4096]
    - [21, 9573.38]
  - - [1024, 3476, 1, 4096, 1024, 1024, 1024, 4096]
    - [24, 9361.62]
  - - [1024, 3751, 1, 1024, 1024, 1024, 1024, 1024]
    - [18, 8849.01]
  - - [4096, 3379, 1, 1024, 4096, 4096, 4096, 1024]
    - [1, 9741.39]
  - - [4096, 3428, 1, 1024, 4096, 4096, 4096, 1024]
    - [0, 9767.72]
  - - [4096, 3126, 1, 1024, 4096, 4096, 4096, 1024]
    - [15, 9701.8]
  - - [64, 41, 1552, 41, 64, 64, 64, 41]
    - [50, 3555.59]
  - - [1024, 3325, 1, 4096, 1024, 1024, 1024, 4096]
    - [2, 8962.31]
  - - [4096, 3501, 1, 1024, 4096, 4096, 4096, 1024]
    - [4, 9761.91]
  - - [4096, 3358, 1, 1024, 4096, 4096, 4096, 1024]
    - [0, 9680.32]
  - - [1024, 3441, 1, 4096, 1024, 1024, 1024, 4096]
    - [24, 9271.17]
  - - [1024, 3552, 1, 4096, 1024, 1024, 1024, 4096]
    - [20, 9565.32]
  - - [4096, 3232, 1, 1024, 4096, 4096, 4096, 1024]
    - [5, 9696.71]
  - - [64, 18, 3440, 18, 64, 64, 64, 18]
    - [25, 2059.23]
  - - [1024, 3412, 1, 4096, 1024, 1024, 1024, 4096]
    - [24, 9199.18]
  - - [1024, 3372, 1, 4096, 1024, 1024, 1024, 4096]
    - [21, 9083.39]
  - - [1024, 3585, 1, 4096, 1024, 1024, 1024, 4096]
    - [11, 8710.19]
  - - [4096, 3143, 1, 1024, 4096, 4096, 4096, 1024]
    - [16, 9692.02]
  - - [4096, 3464, 1, 1024, 4096, 4096, 4096, 1024]
    - [4, 9661.83]
  - - [1024, 3145, 1, 4096, 1024, 1024, 1024, 4096]
    - [3, 8526.23]
  - - [4096, 3375, 1, 1024, 4096, 4096, 4096, 1024]
    - [15, 9734.68]
  - - [4096, 2917, 1, 1024, 4096, 4096, 4096, 1024]
    - [0, 9714.47]
  - - [4096, 3978, 1, 1024, 4096, 4096, 4096, 1024]
    - [5, 9741.33]
  - - [1024, 2765, 1, 4096, 1024, 1024, 1024, 4096]
    - [6, 8706.65]
  - - [64, 148, 432, 148, 64, 64, 64, 148]
    - [31, 6372.07]
  - - [1024, 3452, 1, 4096, 1024, 1024, 1024, 4096]
    - [23, 9301.28]
  - - [4096, 3584, 1, 1024, 4096, 4096, 4096, 1024]
    - [5, 10005.6]
  - - [4096, 3545, 1, 1024, 4096, 4096, 4096, 1024]
    - [5, 9877.77]
  - - [1024, 3352, 1, 4096, 1024, 1024, 1024, 4096]
    - [24, 9035.09]
  - - [64, 159, 400, 160, 64, 64, 64, 160]
    - [33, 6952.01]
  - - [4096, 3292, 1, 1024, 4096, 4096, 4096, 1024]
    - [4, 9856.41]
  - - [1024, 3525, 1, 4096, 1024, 1024, 1024, 4096]
    - [24, 9501.4]
  - - [1024, 3266, 1, 4096, 1024, 1024, 1024, 4096]
    - [24, 8817.33]
  - - [1024, 3382, 1, 4096, 1024, 1024, 1024, 4096]
    - [23, 9101.44]
  - - [4096, 3492, 1, 1024, 4096, 4096, 4096, 1024]
    - [4, 9747.19]
  - - [4096, 3419, 1, 1024, 4096, 4096, 4096, 1024]
    - [16, 9745.78]
  - - [1024, 3796, 1, 33708, 1024, 1024, 1024, 33708]
    - [13, 9356.16]
  - - [1024, 3293, 1, 4096, 1024, 1024, 1024, 4096]
    - [20, 8868.3]
  - - [4096, 3796, 1, 1024, 4096, 4096, 4096, 1024]
    - [5, 9885.26]
  - - [1024, 3487, 1, 4096, 1024, 1024, 1024, 4096]
    - [21, 9391.24]
  - - [4096, 3166, 1, 1024, 4096, 4096, 4096, 1024]
    - [16, 9718.36]
  - - [64, 102, 624, 101, 64, 64, 64, 101]
    - [45, 5547.74]
  - - [1024, 3409, 1, 4096, 1024, 1024, 1024, 4096]
    - [24, 9187.78]
  - - [1024, 3520, 1, 4096, 1024, 1024, 1024, 4096]
    - [23, 9484.99]
  - - [1024, 3573, 1, 4096, 1024, 1024, 1024, 4096]
    - [24, 9652.61]
  - - [4096, 3366, 1, 1024, 4096, 4096, 4096, 1024]
    - [0, 9684.21]
  - - [4096, 3720, 1, 1024, 4096, 4096, 4096, 1024]
    - [16, 9703.24]
  - - [4096, 3207, 1, 1024, 4096, 4096, 4096, 1024]
    - [4, 9626.11]
  - - [4096, 3272, 1, 1024, 4096, 4096, 4096, 1024]
    - [4, 9795.41]
  - - [1024, 3390, 1, 4096, 1024, 1024, 1024, 4096]
    - [24, 9125.78]
  - - [4096, 3183, 1, 1024, 4096, 4096, 4096, 1024]
    - [16, 9825.77]
  - - [4096, 3536, 1, 1024, 4096, 4096, 4096, 1024]
    - [5, 9846.41]
  - - [4096, 3563, 1, 1024, 4096, 4096, 4096, 1024]
    - [5, 9913.7]
  - - [1024, 3482, 1, 4096, 1024, 1024, 1024, 4096]
    - [24, 9376.81]
  - - [4096, 3447, 1, 1024, 4096, 4096, 4096, 1024]
    - [15, 9874.99]
  - - [4096, 3955, 1, 1024, 4096, 4096, 4096, 1024]
    - [0, 9922.29]
  - - [4096, 4005, 1, 1024, 4096, 4096, 4096, 1024]
    - [5, 9803.33]
  - - [1024, 3493, 1, 4096, 1024, 1024, 1024, 4096]
    - [24, 9411.27]
  - - [4096, 3410, 1, 1024, 4096, 4096, 4096, 1024]
    - [0, 9788.24]
  - - [1024, 3422, 1, 4096, 1024, 1024, 1024, 4096]
    - [23, 9216.18]
  - - [1024, 3350, 1, 4096, 1024, 1024, 1024, 4096]
    - [18, 9067.92]
  - - [4096, 3300, 1, 1024, 4096, 4096, 4096, 1024]
    - [5, 9883.19]
  - - [4096, 3910, 1, 1024, 4096, 4096, 4096, 1024]
    - [15, 9800.02]
  - - [1024, 3489, 1, 4096, 1024, 1024, 1024, 4096]
    - [24, 9398.56]
  - - [4096, 3483, 1, 1024, 4096, 4096, 4096, 1024]
    - [4, 9715.86]
  - - [4096, 3532, 1, 1024, 4096, 4096, 4096, 1024]
    - [5, 9837.89]
  - - [64, 101, 624, 101, 64, 64, 64, 101]
    - [45, 5452.18]
  - - [4096, 3230, 1, 1024, 4096, 4096, 4096, 1024]
    - [5, 9683.5]
  - - [4096, 3427, 1, 1024, 4096, 4096, 4096, 1024]
    - [0, 9760.62]
  - - [1024, 3377, 1, 4096, 1024, 1024, 1024, 4096]
    - [24, 9101.07]
  - - [1024, 3488, 1, 4096, 1024, 1024, 1024, 4096]
    - [23, 9381.89]
  - - [1024, 3616, 1, 4096, 1024, 1024, 1024, 4096]
    - [6, 8709.23]
  - - [1024, 3426, 1, 4096, 1024, 1024, 1024, 4096]
    - [24, 9229.33]
  - - [4096, 3357, 1, 1024, 4096, 4096, 4096, 1024]
    - [16, 9668.4]
  - - [4096, 3406, 1, 1024, 4096, 4096, 4096, 1024]
    - [1, 9748.47]
  - - [1024, 3046, 1, 4096, 1024, 1024, 1024, 4096]
    - [6, 9590.33]
  - - [1024, 3272, 1, 4096, 1024, 1024, 1024, 4096]
    - [17, 8930.1]
  - - [1024, 3256, 1, 4096, 1024, 1024, 1024, 4096]
    - [2, 8828.06]
  - - [4096, 3247, 1, 1024, 4096, 4096, 4096, 1024]
    - [4, 9741.71]
  - - [4096, 3088, 1, 1024, 4096, 4096, 4096, 1024]
    - [16, 9588.97]
  - - [1024, 3531, 1, 4096, 1024, 1024, 1024, 4096]
    - [23, 9500.96]
  - - [64, 160, 400, 160, 64, 64, 64, 160]
    - [59, 7333.93]
  - - [4096, 3511, 1, 1024, 4096, 4096, 4096, 1024]
    - [5, 9789.28]
  - - [1024, 3720, 1, 33708, 1024, 1024, 1024, 33708]
    - [14, 9214.58]
  - - [1024, 3267, 1, 4096, 1024, 1024, 1024, 4096]
    - [17, 8830.94]
  - - [1024, 3270, 1, 4096, 1024, 1024, 1024, 4096]
    - [18, 8876.58]
  - - [1024, 3461, 1, 4096, 1024, 1024, 1024, 4096]
    - [23, 9327.45]
  - - [4096, 3474, 1, 1024, 4096, 4096, 4096, 1024]
    - [4, 9696.94]
  - - [4096, 2984, 1, 1024, 4096, 4096, 4096, 1024]
    - [5, 9673.98]
  - - [1024, 3399, 1, 4096, 1024, 1024, 1024, 4096]
    - [23, 9158.48]
  - - [4096, 3574, 1, 1024, 4096, 4096, 4096, 1024]
    - [4, 9942.2]
  - - [1024, 3876, 1, 1024, 1024, 1024, 1024, 1024]
    - [18, 9085.03]
  - - [4096, 3337, 1, 1024, 4096, 4096, 4096, 1024]
    - [1, 9611.33]
  - - [4096, 3450, 1, 1024, 4096, 4096, 4096, 1024]
    - [16, 9930.25]
  - - [1024, 3720, 1, 1024, 1024, 1024, 1024, 1024]
    - [2, 8755.39]
  - - [1024, 4059, 1, 1024, 1024, 1024, 1024, 1024]
    - [7, 9366.57]
  - - [4096, 3291, 1, 1024, 4096, 4096, 4096, 1024]
    - [4, 9856.23]
  - - [64, 93, 688, 93, 64, 64, 64, 93]
    - [48, 5497.01]
  - - [4096, 3995, 1, 1024, 4096, 4096, 4096, 1024]
    - [4, 9776.57]
  - - [64, 147, 432, 147, 64, 64, 64, 147]
    - [34, 6233.78]
  - - [4096, 3491, 1, 1024, 4096, 4096, 4096, 1024]
    - [4, 9742.84]
  - - [4096, 3348, 1, 1024, 4096, 4096, 4096, 1024]
    - [16, 9634.01]
  - - [4096, 3925, 1, 1024, 4096, 4096, 4096, 1024]
    - [15, 9848.44]
  - - [4096, 3894, 1, 1024, 4096, 4096, 4096, 1024]
    - [15, 9812.45]
  - - [1024, 3456, 1, 4096, 1024, 1024, 1024, 4096]
    - [24, 9317.81]
  - - [1024, 3394, 1, 4096, 1024, 1024, 1024, 4096]
    - [23, 9148.76]
  - - [64, 100, 624, 102, 64, 64, 64, 102]
    - [45, 5416.85]
  - - [4096, 3165, 1, 1024, 4096, 4096, 4096, 1024]
    - [15, 9743.25]
  - - [4096, 3470, 1, 1024, 4096, 4096, 4096, 1024]
    - [5, 9690.94]
  - - [1024, 3014, 1, 4096, 1024, 1024, 1024, 4096]
    - [6, 9486.16]
  - - [1024, 3375, 1, 4096, 1024, 1024, 1024, 4096]
    - [24, 9082.61]
  - - [4096, 3859, 1, 1024, 4096, 4096, 4096, 1024]
    - [15, 9738.77]
  - - [4096, 3365, 1, 1024, 4096, 4096, 4096, 1024]
    - [16, 9694.64]
  - - [1024, 3162, 1, 4096, 1024, 1024, 1024, 4096]
    - [17, 8550.21]
  - - [1024, 3840, 1, 33708, 1024, 1024, 1024, 33708]
    - [14, 9408.98]
  - - [1024, 3437, 1, 4096, 1024, 1024, 1024, 4096]
    - [24, 9270.39]
  - - [4096, 3319, 1, 1024, 4096, 4096, 4096, 1024]
    - [5, 9927.05]
  - - [1024, 3320, 1, 4096, 1024, 1024, 1024, 4096]
    - [24, 8962.19]
  - - [64, 23, 2720, 23, 64, 64, 64, 23]
    - [47, 2569.43]
  - - [4096, 3328, 1, 1024, 4096, 4096, 4096, 1024]
    - [4, 9997.31]
  - - [1024, 3235, 1, 4096, 1024, 1024, 1024, 4096]
    - [24, 8724.21]
  - - [4096, 3282, 1, 1024, 4096, 4096, 4096, 1024]
    - [5, 9827.03]
  - - [1024, 3367, 1, 4096, 1024, 1024, 1024, 4096]
    - [17, 9083.92]
  - - [1024, 3542, 1, 4096, 1024, 1024, 1024, 4096]
    - [24, 9533.0]
  - - [64, 177, 352, 177, 64, 64, 64, 177]
    - [10, 6817.81]
  - - [4096, 3145, 1, 1024, 4096, 4096, 4096, 1024]
    - [1, 9710.18]
  - - [4096, 3514, 1, 1024, 4096, 4096, 4096, 1024]
    - [4, 9792.96]
  - - [1024, 3432, 1, 4096, 1024, 1024, 1024, 4096]
    - [24, 9249.29]
  - - [4096, 3409, 1, 1024, 4096, 4096, 4096, 1024]
    - [0, 9721.5]
  - - [1024, 4012, 1, 33708, 1024, 1024, 1024, 33708]
    - [4, 9773.25]
  - - [4096, 3876, 1, 1024, 4096, 4096, 4096, 1024]
    - [1, 9745.55]
  - - [4096, 3299, 1, 1024, 4096, 4096, 4096, 1024]
    - [4, 9873.43]
  - - [1024, 3168, 1, 4096, 1024, 1024, 1024, 4096]
    - [17, 8597.03]
  - - [4096, 3681, 1, 1024, 4096, 4096, 4096, 1024]
    - [16, 9839.93]
  - - [4096, 3531, 1, 1024, 4096, 4096, 4096, 1024]
    - [5, 9847.66]
  - - [4096, 3388, 1, 1024, 4096, 4096, 4096, 1024]
    - [16, 9772.18]
  - - [1024, 3720, 1, 4096, 1024, 1024, 1024, 4096]
    - [5, 8951.5]
  - - [1024, 3332, 1, 4096, 1024, 1024, 1024, 4096]
    - [24, 8978.87]
  - - [1024, 3273, 1, 4096, 1024, 1024, 1024, 4096]
    - [18, 8982.39]
  - - [1024, 2935, 1, 4096, 1024, 1024, 1024, 4096]
    - [7, 9224.79]
  - - [1024, 3467, 1, 4096, 1024, 1024, 1024, 4096]
    - [21, 9329.23]
  - - [4096, 3542, 1, 1024, 4096, 4096, 4096, 1024]
    - [4, 9858.41]
  - - [1024, 3130, 1, 4096, 1024, 1024, 1024, 4096]
    - [3, 8526.56]
  - - [1024, 3405, 1, 4096, 1024, 1024, 1024, 4096]
    - [24, 9163.34]
  - - [1024, 3960, 1, 1024, 1024, 1024, 1024, 1024]
    - [2, 9280.26]
  - - [4096, 3405, 1, 1024, 4096, 4096, 4096, 1024]
    - [15, 9710.1]
- null
