Tensile/Configs/miopen/archives/mlperf/2019-05-03/exact/vega20_Cijk_Alik_Bljk_SB.yaml
- {MinimumRequiredVersion: 4.9.4}
- vega20
- gfx906
- [Device 66a0, Device 66a1, Device 66a7]
    SolutionIndex: 0
    SolutionNameMin: Cijk_Alik_Bljk_SB_MT128x128x16_SE_EPS1_FL1_GRVW4_LPA0_LPB0_PGR1_PLR1_SNLL1_TT8_8_USFGRO0_VW2_WG16_16_1_WGM1
    SolutionIndex: 1
    SolutionNameMin: Cijk_Alik_Bljk_SB_MT128x128x16_SE_EPS1_FL0_GRVW4_LPA0_LPB0_PGR1_PLR1_SNLL1_TT8_8_USFGRO0_VW2_WG16_16_1_WGM8
    SolutionIndex: 2
    SolutionNameMin: Cijk_Alik_Bljk_SB_MT128x128x16_SE_EPS1_FL0_GRVW4_LPA0_LPB0_PGR1_PLR1_SNLL1_TT8_8_USFGRO1_VW2_WG16_16_1_WGM8
    SolutionIndex: 3
    SolutionNameMin: Cijk_Alik_Bljk_SB_MT128x128x16_SE_EPS1_FL1_GRVW4_LPA0_LPB0_PGR1_PLR1_SNLL1_TT8_8_USFGRO0_VW2_WG16_16_1_WGM8
    SolutionIndex: 4
    SolutionNameMin: Cijk_Alik_Bljk_SB_MT128x128x16_SE_EPS1_FL1_GRVW4_LPA0_LPB0_PGR1_PLR1_SNLL1_TT8_8_USFGRO1_VW2_WG16_16_1_WGM8
    SolutionIndex: 5
    SolutionNameMin: Cijk_Alik_Bljk_SB_MT128x128x16_SE_EPS1_FL0_GRVW4_LPA0_LPB0_PGR1_PLR1_SNLL1_TT8_8_USFGRO0_VW4_WG16_16_1_WGM1
    SolutionIndex: 6
    SolutionNameMin: Cijk_Alik_Bljk_SB_MT128x128x16_SE_EPS1_FL0_GRVW4_LPA0_LPB0_PGR1_PLR1_SNLL1_TT8_8_USFGRO1_VW4_WG16_16_1_WGM1
    SolutionIndex: 7
    SolutionNameMin: Cijk_Alik_Bljk_SB_MT128x128x16_SE_EPS1_FL1_GRVW4_LPA0_LPB0_PGR1_PLR1_SNLL1_TT8_8_USFGRO0_VW4_WG16_16_1_WGM1
    SolutionIndex: 8
    SolutionNameMin: Cijk_Alik_Bljk_SB_MT128x128x16_SE_EPS1_FL1_GRVW4_LPA0_LPB0_PGR1_PLR1_SNLL1_TT8_8_USFGRO1_VW4_WG16_16_1_WGM1
    SolutionIndex: 9
    SolutionNameMin: Cijk_Alik_Bljk_SB_MT128x128x16_SE_EPS1_FL0_GRVW4_LPA0_LPB0_PGR1_PLR1_SNLL1_TT8_8_USFGRO0_VW4_WG16_16_1_WGM8
    SolutionIndex: 10
    SolutionNameMin: Cijk_Alik_Bljk_SB_MT128x128x16_SE_EPS1_FL0_GRVW4_LPA0_LPB0_PGR1_PLR1_SNLL1_TT8_8_USFGRO1_VW4_WG16_16_1_WGM8
    SolutionIndex: 11
    SolutionNameMin: Cijk_Alik_Bljk_SB_MT128x128x16_SE_EPS1_FL1_GRVW4_LPA0_LPB0_PGR1_PLR1_SNLL1_TT8_8_USFGRO0_VW4_WG16_16_1_WGM8
    SolutionIndex: 12
    SolutionNameMin: Cijk_Alik_Bljk_SB_MT128x128x16_SE_EPS1_FL1_GRVW4_LPA0_LPB0_PGR1_PLR1_SNLL1_TT8_8_USFGRO1_VW4_WG16_16_1_WGM8
    SolutionIndex: 13
    SolutionNameMin: Cijk_Alik_Bljk_SB_MT64x128x16_SE_EPS1_FL0_GRVW2_LPA0_LPB4_PGR1_PLR1_SNLL1_TT4_8_USFGRO0_VW4_WG16_16_1_WGM1
    SolutionIndex: 14
    SolutionNameMin: Cijk_Alik_Bljk_SB_MT64x128x16_SE_EPS1_FL0_GRVW2_LPA0_LPB4_PGR1_PLR1_SNLL1_TT4_8_USFGRO1_VW4_WG16_16_1_WGM1
    SolutionIndex: 15
    SolutionNameMin: Cijk_Alik_Bljk_SB_MT64x128x16_SE_EPS1_FL1_GRVW2_LPA0_LPB4_PGR1_PLR1_SNLL1_TT4_8_USFGRO0_VW4_WG16_16_1_WGM1
    SolutionIndex: 16
    SolutionNameMin: Cijk_Alik_Bljk_SB_MT64x128x16_SE_EPS1_FL1_GRVW2_LPA0_LPB4_PGR1_PLR1_SNLL1_TT4_8_USFGRO1_VW4_WG16_16_1_WGM1
    SolutionIndex: 17
    SolutionNameMin: Cijk_Alik_Bljk_SB_MT64x128x16_SE_EPS1_FL1_GRVW4_LPA0_LPB2_PGR1_PLR1_SNLL1_TT4_8_USFGRO1_VW2_WG16_16_1_WGM1
    SolutionIndex: 18
    SolutionNameMin: Cijk_Alik_Bljk_SB_MT64x128x16_SE_EPS1_FL0_GRVW1_LPA2_LPB2_PGR1_PLR1_SNLL1_TT4_8_USFGRO1_VW2_WG16_16_1_WGM1
    SolutionIndex: 19
    SolutionNameMin: Cijk_Alik_Bljk_SB_MT64x128x16_SE_EPS1_FL0_GRVW1_LPA4_LPB4_PGR1_PLR1_SNLL1_TT4_8_USFGRO0_VW4_WG16_16_1_WGM1
    SolutionIndex: 20
    SolutionNameMin: Cijk_Alik_Bljk_SB_MT64x128x16_SE_EPS1_FL0_GRVW1_LPA4_LPB4_PGR1_PLR1_SNLL1_TT4_8_USFGRO1_VW4_WG16_16_1_WGM1
    SolutionIndex: 21
    SolutionNameMin: Cijk_Alik_Bljk_SB_MT64x128x16_SE_EPS1_FL0_GRVW2_LPA2_LPB2_PGR1_PLR1_SNLL1_TT4_8_USFGRO0_VW2_WG16_16_1_WGM1
    SolutionIndex: 22
    SolutionNameMin: Cijk_Alik_Bljk_SB_MT64x128x16_SE_EPS1_FL0_GRVW2_LPA2_LPB2_PGR1_PLR1_SNLL1_TT4_8_USFGRO1_VW2_WG16_16_1_WGM1
    SolutionIndex: 23
    SolutionNameMin: Cijk_Alik_Bljk_SB_MT64x128x16_SE_EPS1_FL1_GRVW2_LPA2_LPB2_PGR1_PLR1_SNLL1_TT4_8_USFGRO0_VW2_WG16_16_1_WGM1
    SolutionIndex: 24
    SolutionNameMin: Cijk_Alik_Bljk_SB_MT64x128x16_SE_EPS1_FL1_GRVW2_LPA2_LPB2_PGR1_PLR1_SNLL1_TT4_8_USFGRO1_VW2_WG16_16_1_WGM1
    SolutionIndex: 25
    SolutionNameMin: Cijk_Alik_Bljk_SB_MT64x128x16_SE_EPS1_FL0_GRVW2_LPA4_LPB4_PGR1_PLR1_SNLL1_TT4_8_USFGRO0_VW4_WG16_16_1_WGM1
    SolutionIndex: 26
    SolutionNameMin: Cijk_Alik_Bljk_SB_MT64x128x16_SE_EPS1_FL0_GRVW2_LPA4_LPB4_PGR1_PLR1_SNLL1_TT4_8_USFGRO1_VW4_WG16_16_1_WGM1
    SolutionIndex: 27
    SolutionNameMin: Cijk_Alik_Bljk_SB_MT64x128x16_SE_EPS1_FL1_GRVW2_LPA4_LPB4_PGR1_PLR1_SNLL1_TT4_8_USFGRO0_VW4_WG16_16_1_WGM1
    SolutionIndex: 28
    SolutionNameMin: Cijk_Alik_Bljk_SB_MT64x128x16_SE_EPS1_FL1_GRVW2_LPA4_LPB4_PGR1_PLR1_SNLL1_TT4_8_USFGRO1_VW4_WG16_16_1_WGM1
    SolutionIndex: 29
    SolutionNameMin: Cijk_Alik_Bljk_SB_MT128x64x16_SE_EPS1_FL0_GRVW2_LPA4_LPB4_PGR1_PLR1_SNLL1_TT8_4_USFGRO0_VW4_WG16_16_1_WGM1
    SolutionIndex: 30
    SolutionNameMin: Cijk_Alik_Bljk_SB_MT128x64x16_SE_EPS1_FL0_GRVW2_LPA4_LPB4_PGR1_PLR1_SNLL1_TT8_4_USFGRO1_VW4_WG16_16_1_WGM1
    SolutionIndex: 31
    SolutionNameMin: Cijk_Alik_Bljk_SB_MT128x64x16_SE_EPS1_FL1_GRVW2_LPA4_LPB4_PGR1_PLR1_SNLL1_TT8_4_USFGRO0_VW4_WG16_16_1_WGM1
    SolutionIndex: 32
    SolutionNameMin: Cijk_Alik_Bljk_SB_MT128x64x16_SE_EPS1_FL0_GRVW2_LPA4_LPB4_PGR1_PLR1_SNLL1_TT8_4_USFGRO1_VW4_WG16_16_1_WGM8
    SolutionIndex: 33
    SolutionNameMin: Cijk_Alik_Bljk_SB_MT128x64x16_SE_EPS1_FL1_GRVW2_LPA4_LPB4_PGR1_PLR1_SNLL1_TT8_4_USFGRO1_VW4_WG16_16_1_WGM8
    SolutionIndex: 34
    SolutionNameMin: Cijk_Alik_Bljk_SB_MT64x128x16_SE_EPS1_FL0_GRVW4_LPA4_LPB4_PGR1_PLR1_SNLL1_TT4_8_USFGRO0_VW4_WG16_16_1_WGM1
    SolutionIndex: 35
    SolutionNameMin: Cijk_Alik_Bljk_SB_MT64x128x16_SE_EPS1_FL1_GRVW4_LPA4_LPB4_PGR1_PLR1_SNLL1_TT4_8_USFGRO1_VW4_WG16_16_1_WGM1
    SolutionIndex: 36
    SolutionNameMin: Cijk_Alik_Bljk_SB_MT32x32x16_SE_EPS0_FL1_GRVW4_LPA1_LPB0_PGR0_PLR1_SNLL0_TT2_4_USFGRO1_VW1_WG16_8_1_WGM8
    SolutionIndex: 37
    SolutionNameMin: Cijk_Alik_Bljk_SB_MT32x32x16_SE_EPS0_FL0_GRVW1_LPA1_LPB1_PGR0_PLR1_SNLL0_TT2_4_USFGRO1_VW1_WG16_8_1_WGM1
    SolutionIndex: 38
    SolutionNameMin: Cijk_Alik_Bljk_SB_MT32x32x16_SE_EPS0_FL0_GRVW1_LPA1_LPB1_PGR0_PLR1_SNLL0_TT2_4_USFGRO1_VW1_WG16_8_1_WGM8
    SolutionIndex: 39
    SolutionNameMin: Cijk_Alik_Bljk_SB_MT64x64x16_SE_EPS0_FL0_GRVW4_LPA1_LPB1_PGR0_PLR1_SNLL0_TT4_4_USFGRO1_VW1_WG16_16_1_WGM1
    SolutionIndex: 40
    SolutionNameMin: Cijk_Alik_Bljk_SB_MT64x64x16_SE_EPS0_FL1_GRVW4_LPA1_LPB1_PGR0_PLR1_SNLL0_TT4_4_USFGRO1_VW1_WG16_16_1_WGM1
    SolutionIndex: 41
    SolutionNameMin: Cijk_Alik_Bljk_SB_MT32x32x16_SE_EPS0_FL0_GRVW4_LPA1_LPB1_PGR0_PLR1_SNLL0_TT2_4_USFGRO1_VW1_WG16_8_1_WGM1
    SolutionIndex: 42
    SolutionNameMin: Cijk_Alik_Bljk_SB_MT32x32x16_SE_EPS0_FL1_GRVW4_LPA1_LPB1_PGR0_PLR1_SNLL0_TT2_4_USFGRO1_VW1_WG16_8_1_WGM1
    SolutionIndex: 43
    SolutionNameMin: Cijk_Alik_Bljk_SB_MT32x32x16_SE_EPS0_FL0_GRVW4_LPA1_LPB1_PGR0_PLR1_SNLL0_TT4_2_USFGRO1_VW1_WG8_16_1_WGM1
    SolutionIndex: 44
    SolutionNameMin: Cijk_Alik_Bljk_SB_MT32x32x16_SE_EPS0_FL1_GRVW4_LPA1_LPB1_PGR0_PLR1_SNLL0_TT4_2_USFGRO1_VW1_WG8_16_1_WGM1
    SolutionIndex: 45
    SolutionNameMin: Cijk_Alik_Bljk_SB_MT64x64x16_SE_EPS0_FL0_GRVW4_LPA1_LPB1_PGR0_PLR1_SNLL0_TT4_4_USFGRO1_VW1_WG16_16_1_WGM8
    SolutionIndex: 46
    SolutionNameMin: Cijk_Alik_Bljk_SB_MT64x64x16_SE_EPS0_FL1_GRVW4_LPA1_LPB1_PGR0_PLR1_SNLL0_TT4_4_USFGRO1_VW1_WG16_16_1_WGM8
    SolutionIndex: 47
    SolutionNameMin: Cijk_Alik_Bljk_SB_MT32x32x16_SE_EPS0_FL0_GRVW4_LPA1_LPB1_PGR0_PLR1_SNLL0_TT2_4_USFGRO1_VW1_WG16_8_1_WGM8
    SolutionIndex: 48
    SolutionNameMin: Cijk_Alik_Bljk_SB_MT32x32x16_SE_EPS0_FL1_GRVW4_LPA1_LPB1_PGR0_PLR1_SNLL0_TT2_4_USFGRO1_VW1_WG16_8_1_WGM8
    SolutionIndex: 49
    SolutionNameMin: Cijk_Alik_Bljk_SB_MT32x32x16_SE_EPS0_FL0_GRVW4_LPA1_LPB1_PGR0_PLR1_SNLL0_TT4_2_USFGRO1_VW1_WG8_16_1_WGM8
    SolutionIndex: 50
    SolutionNameMin: Cijk_Alik_Bljk_SB_MT32x32x32_SE_EPS0_FL0_GRVW4_LPA1_LPB1_PGR0_PLR1_SNLL0_TT2_4_USFGRO1_VW1_WG16_8_1_WGM1
    SolutionIndex: 51
    SolutionNameMin: Cijk_Alik_Bljk_SB_MT64x32x8_SE_EPS0_FL1_GRVW4_LPA4_LPB4_PGR0_PLR0_SNLL0_TT4_4_USFGRO1_VW4_WG16_8_1_WGM8
    SolutionIndex: 52
    SolutionNameMin: Cijk_Alik_Bljk_SB_MT64x32x16_SE_EPS0_FL0_GRVW4_LPA4_LPB4_PGR0_PLR1_SNLL0_TT4_4_USFGRO1_VW4_WG16_8_1_WGM1
    SolutionIndex: 53
    SolutionNameMin: Cijk_Alik_Bljk_SB_MT64x32x16_SE_EPS0_FL1_GRVW4_LPA4_LPB4_PGR0_PLR1_SNLL0_TT4_4_USFGRO1_VW4_WG16_8_1_WGM1
    SolutionIndex: 54
    SolutionNameMin: Cijk_Alik_Bljk_SB_MT32x64x16_SE_EPS0_FL1_GRVW4_LPA4_LPB4_PGR0_PLR1_SNLL0_TT4_4_USFGRO1_VW4_WG8_16_1_WGM1
    SolutionIndex: 55
    SolutionNameMin: Cijk_Alik_Bljk_SB_MT64x32x16_SE_EPS0_FL1_GRVW4_LPA4_LPB4_PGR0_PLR1_SNLL0_TT4_4_USFGRO1_VW4_WG16_8_1_WGM8
- - - [1024, 3392, 1, 4096, 1024, 1024, 4096, 4096]
    - [25, 8502.92]
  - - [1024, 3301, 1, 4096, 1024, 1024, 4096, 4096]
    - [27, 8414.0]
  - - [1024, 3443, 1, 4096, 1024, 1024, 4096, 4096]
    - [14, 8536.49]
  - - [132, 134, 480, 64, 132, 132, 64, 64]
    - [52, 4149.17]
  - - [162, 162, 400, 64, 162, 162, 64, 64]
    - [40, 5539.63]
  - - [4096, 3548, 1, 1024, 4096, 4096, 1024, 1024]
    - [6, 9772.91]
  - - [4096, 2977, 1, 1024, 4096, 4096, 1024, 1024]
    - [7, 9574.33]
  - - [132, 135, 480, 64, 132, 132, 64, 64]
    - [52, 4167.41]
  - - [1024, 2985, 1, 4096, 1024, 1024, 4096, 4096]
    - [10, 9133.89]
  - - [33708, 3681, 1, 1024, 33708, 33708, 1024, 1024]
    - [7, 10033.7]
  - - [4096, 3443, 1, 1024, 4096, 4096, 1024, 1024]
    - [7, 9513.68]
  - - [11, 11, 5456, 64, 11, 11, 64, 64]
    - [49, 627.246]
  - - [1024, 3400, 1, 4096, 1024, 1024, 4096, 4096]
    - [28, 8419.92]
  - - [4096, 3995, 1, 1024, 4096, 4096, 1024, 1024]
    - [6, 9693.77]
  - - [4096, 3190, 1, 1024, 4096, 4096, 1024, 1024]
    - [6, 9474.74]
  - - [4096, 3594, 1, 1024, 4096, 4096, 1024, 1024]
    - [7, 9315.73]
  - - [159, 162, 400, 64, 159, 159, 64, 64]
    - [39, 5429.88]
  - - [1024, 3565, 1, 4096, 1024, 1024, 4096, 4096]
    - [22, 8532.7]
  - - [4096, 3422, 1, 1024, 4096, 4096, 1024, 1024]
    - [7, 9459.14]
  - - [1024, 3214, 1, 4096, 1024, 1024, 4096, 4096]
    - [27, 8064.82]
  - - [33708, 3584, 1, 1024, 33708, 33708, 1024, 1024]
    - [8, 10128.9]
  - - [33708, 3640, 1, 1024, 33708, 33708, 1024, 1024]
    - [5, 9919.12]
  - - [4096, 3263, 1, 1024, 4096, 4096, 1024, 1024]
    - [5, 9699.25]
  - - [4096, 3296, 1, 1024, 4096, 4096, 1024, 1024]
    - [5, 9780.7]
  - - [1024, 3557, 1, 4096, 1024, 1024, 4096, 4096]
    - [26, 8526.79]
  - - [4096, 3463, 1, 1024, 4096, 4096, 1024, 1024]
    - [5, 9578.03]
  - - [4096, 3528, 1, 1024, 4096, 4096, 1024, 1024]
    - [5, 9739.82]
  - - [14, 14, 4368, 64, 14, 14, 64, 64]
    - [37, 991.176]
  - - [4096, 3226, 1, 1024, 4096, 4096, 1024, 1024]
    - [5, 9587.09]
  - - [4096, 3439, 1, 1024, 4096, 4096, 1024, 1024]
    - [8, 9499.62]
  - - [1024, 3523, 1, 4096, 1024, 1024, 4096, 4096]
    - [28, 8393.48]
  - - [1024, 3098, 1, 4096, 1024, 1024, 4096, 4096]
    - [34, 7882.77]
  - - [4096, 3121, 1, 1024, 4096, 4096, 1024, 1024]
    - [5, 9296.13]
  - - [33708, 3894, 1, 1024, 33708, 33708, 1024, 1024]
    - [6, 9952.17]
  - - [1024, 3548, 1, 4096, 1024, 1024, 4096, 4096]
    - [12, 8432.35]
  - - [1024, 3451, 1, 4096, 1024, 1024, 4096, 4096]
    - [25, 8456.34]
  - - [4096, 3353, 1, 1024, 4096, 4096, 1024, 1024]
    - [7, 9288.98]
  - - [4096, 3402, 1, 1024, 4096, 4096, 1024, 1024]
    - [7, 9406.34]
  - - [4096, 3939, 1, 1024, 4096, 4096, 1024, 1024]
    - [5, 9549.49]
  - - [133, 133, 480, 64, 133, 133, 64, 64]
    - [52, 4124.21]
  - - [1024, 3559, 1, 4096, 1024, 1024, 4096, 4096]
    - [27, 8586.94]
  - - [1024, 2977, 1, 4096, 1024, 1024, 4096, 4096]
    - [10, 9084.49]
  - - [1024, 3478, 1, 4096, 1024, 1024, 4096, 4096]
    - [21, 8342.75]
  - - [134, 134, 480, 64, 134, 134, 64, 64]
    - [54, 4204.33]
  - - [1024, 3368, 1, 4096, 1024, 1024, 4096, 4096]
    - [27, 8277.33]
  - - [4096, 4012, 1, 1024, 4096, 4096, 1024, 1024]
    - [7, 9726.47]
  - - [4096, 3486, 1, 1024, 4096, 4096, 1024, 1024]
    - [5, 9639.61]
  - - [1024, 3479, 1, 4096, 1024, 1024, 4096, 4096]
    - [15, 8420.27]
  - - [1024, 3505, 1, 4096, 1024, 1024, 4096, 4096]
    - [27, 8310.56]
  - - [4096, 3381, 1, 1024, 4096, 4096, 1024, 1024]
    - [8, 9357.65]
  - - [4096, 3430, 1, 1024, 4096, 4096, 1024, 1024]
    - [5, 9482.26]
  - - [1024, 3554, 1, 4096, 1024, 1024, 4096, 4096]
    - [27, 8592.28]
  - - [4096, 3271, 1, 1024, 4096, 4096, 1024, 1024]
    - [5, 9715.31]
  - - [1024, 3063, 1, 4096, 1024, 1024, 4096, 4096]
    - [9, 9388.46]
  - - [1024, 3209, 1, 4096, 1024, 1024, 4096, 4096]
    - [27, 8212.64]
  - - [4096, 3503, 1, 1024, 4096, 4096, 1024, 1024]
    - [7, 9680.49]
  - - [4096, 3344, 1, 1024, 4096, 4096, 1024, 1024]
    - [5, 9268.45]
  - - [1024, 3147, 1, 4096, 1024, 1024, 4096, 4096]
    - [28, 8037.1]
  - - [1024, 3322, 1, 4096, 1024, 1024, 4096, 4096]
    - [26, 8356.22]
  - - [1024, 3341, 1, 4096, 1024, 1024, 4096, 4096]
    - [27, 8316.23]
  - - [1024, 3516, 1, 4096, 1024, 1024, 4096, 4096]
    - [9, 8397.02]
  - - [102, 101, 624, 64, 102, 102, 64, 64]
    - [40, 4709.49]
  - - [1024, 3454, 1, 4096, 1024, 1024, 4096, 4096]
    - [26, 8425.5]
  - - [4096, 3969, 1, 1024, 4096, 4096, 1024, 1024]
    - [7, 9640.05]
  - - [4096, 3466, 1, 1024, 4096, 4096, 1024, 1024]
    - [7, 9576.73]
  - - [1024, 3999, 1, 1024, 1024, 1024, 1024, 1024]
    - [10, 9207.05]
  - - [1024, 4032, 1, 1024, 1024, 1024, 1024, 1024]
    - [11, 9294.46]
  - - [1024, 3403, 1, 4096, 1024, 1024, 4096, 4096]
    - [25, 8357.87]
  - - [4096, 3361, 1, 1024, 4096, 4096, 1024, 1024]
    - [7, 9308.68]
  - - [1024, 3527, 1, 4096, 1024, 1024, 4096, 4096]
    - [26, 8512.09]
  - - [1024, 3822, 1, 4096, 1024, 1024, 4096, 4096]
    - [10, 8991.03]
  - - [4096, 3315, 1, 1024, 4096, 4096, 1024, 1024]
    - [5, 9834.86]
  - - [232, 232, 272, 64, 232, 232, 64, 64]
    - [39, 6481.52]
  - - [1024, 3336, 1, 4096, 1024, 1024, 4096, 4096]
    - [28, 8295.51]
  - - [228, 232, 272, 64, 228, 228, 64, 64]
    - [40, 6327.75]
  - - [4096, 3547, 1, 1024, 4096, 4096, 1024, 1024]
    - [5, 9781.46]
  - - [4096, 3340, 1, 1024, 4096, 4096, 1024, 1024]
    - [7, 9269.62]
  - - [1024, 3906, 1, 1024, 1024, 1024, 1024, 1024]
    - [11, 9018.28]
  - - [1024, 3295, 1, 4096, 1024, 1024, 4096, 4096]
    - [25, 8194.73]
  - - [4096, 3294, 1, 1024, 4096, 4096, 1024, 1024]
    - [8, 9762.06]
  - - [33708, 3968, 1, 1024, 33708, 33708, 1024, 1024]
    - [8, 10147.7]
  - - [1024, 3473, 1, 4096, 1024, 1024, 4096, 4096]
    - [14, 8318.58]
  - - [1024, 3072, 1, 4096, 1024, 1024, 4096, 4096]
    - [11, 9370.03]
  - - [4096, 3189, 1, 1024, 4096, 4096, 1024, 1024]
    - [5, 9470.16]
  - - [4096, 3494, 1, 1024, 4096, 4096, 1024, 1024]
    - [5, 9661.22]
  - - [1024, 3522, 1, 4096, 1024, 1024, 4096, 4096]
    - [28, 8459.13]
  - - [33708, 3944, 1, 1024, 33708, 33708, 1024, 1024]
    - [8, 10060.1]
  - - [135, 135, 480, 64, 135, 135, 64, 64]
    - [53, 4256.93]
  - - [4096, 3421, 1, 1024, 4096, 4096, 1024, 1024]
    - [5, 9456.88]
  - - [32, 32, 1984, 64, 32, 32, 64, 64]
    - [50, 3436.14]
  - - [4096, 3311, 1, 1024, 4096, 4096, 1024, 1024]
    - [5, 9810.78]
  - - [1024, 3990, 1, 1024, 1024, 1024, 1024, 1024]
    - [12, 9197.64]
  - - [1024, 3290, 1, 4096, 1024, 1024, 4096, 4096]
    - [25, 8229.53]
  - - [4096, 3565, 1, 1024, 4096, 4096, 1024, 1024]
    - [6, 9824.38]
  - - [1024, 3484, 1, 4096, 1024, 1024, 4096, 4096]
    - [15, 8575.28]
  - - [4096, 3384, 1, 1024, 4096, 4096, 1024, 1024]
    - [5, 9366.44]
  - - [1024, 3422, 1, 4096, 1024, 1024, 4096, 4096]
    - [25, 8484.02]
  - - [4096, 3681, 1, 1024, 4096, 4096, 1024, 1024]
    - [6, 9520.06]
  - - [1024, 3584, 1, 1024, 1024, 1024, 1024, 1024]
    - [32, 8583.27]
  - - [4096, 4050, 1, 1024, 4096, 4096, 1024, 1024]
    - [7, 9807.25]
  - - [1024, 3996, 1, 4096, 1024, 1024, 4096, 4096]
    - [8, 9181.6]
  - - [4096, 3169, 1, 1024, 4096, 4096, 1024, 1024]
    - [6, 9411.3]
  - - [4096, 3538, 1, 1024, 4096, 4096, 1024, 1024]
    - [6, 9765.89]
  - - [1024, 3495, 1, 4096, 1024, 1024, 4096, 4096]
    - [12, 8295.85]
  - - [4096, 3401, 1, 1024, 4096, 4096, 1024, 1024]
    - [5, 9402.58]
  - - [1024, 3560, 1, 4096, 1024, 1024, 4096, 4096]
    - [26, 8513.35]
  - - [133, 135, 480, 64, 133, 133, 64, 64]
    - [53, 4198.98]
  - - [1024, 3263, 1, 4096, 1024, 1024, 4096, 4096]
    - [27, 8172.13]
  - - [1024, 3870, 1, 4096, 1024, 1024, 4096, 4096]
    - [7, 8996.17]
  - - [4096, 3555, 1, 1024, 4096, 4096, 1024, 1024]
    - [8, 9811.78]
  - - [4096, 3412, 1, 1024, 4096, 4096, 1024, 1024]
    - [5, 9431.99]
  - - [101, 101, 624, 64, 101, 101, 64, 64]
    - [39, 4667.59]
  - - [1024, 3296, 1, 4096, 1024, 1024, 4096, 4096]
    - [26, 8350.51]
  - - [1024, 3379, 1, 4096, 1024, 1024, 4096, 4096]
    - [28, 8432.84]
  - - [4096, 3302, 1, 1024, 4096, 4096, 1024, 1024]
    - [5, 9796.29]
  - - [1024, 3490, 1, 4096, 1024, 1024, 4096, 4096]
    - [25, 8538.34]
  - - [1024, 3428, 1, 4096, 1024, 1024, 4096, 4096]
    - [26, 8531.57]
  - - [1024, 3976, 1, 4096, 1024, 1024, 4096, 4096]
    - [7, 9327.77]
  - - [4096, 3485, 1, 1024, 4096, 4096, 1024, 1024]
    - [5, 9628.72]
  - - [4096, 3534, 1, 1024, 4096, 4096, 1024, 1024]
    - [5, 9755.87]
  - - [1024, 3064, 1, 4096, 1024, 1024, 4096, 4096]
    - [11, 9196.88]
  - - [4096, 3216, 1, 1024, 4096, 4096, 1024, 1024]
    - [7, 9563.34]
  - - [1024, 3450, 1, 4096, 1024, 1024, 4096, 4096]
    - [35, 8519.19]
  - - [1024, 3533, 1, 4096, 1024, 1024, 4096, 4096]
    - [26, 8495.67]
  - - [1024, 4030, 1, 1024, 1024, 1024, 1024, 1024]
    - [11, 9304.58]
  - - [1024, 3311, 1, 4096, 1024, 1024, 4096, 4096]
    - [26, 8278.5]
  - - [1024, 3468, 1, 4096, 1024, 1024, 4096, 4096]
    - [17, 8564.45]
  - - [23, 23, 2720, 64, 23, 23, 64, 64]
    - [41, 2311.45]
  - - [4096, 3359, 1, 1024, 4096, 4096, 1024, 1024]
    - [7, 9309.05]
  - - [4096, 3392, 1, 1024, 4096, 4096, 1024, 1024]
    - [7, 9388.09]
  - - [1024, 3925, 1, 1024, 1024, 1024, 1024, 1024]
    - [9, 9006.62]
  - - [4096, 3233, 1, 1024, 4096, 4096, 1024, 1024]
    - [5, 9603.54]
  - - [4096, 3956, 1, 1024, 4096, 4096, 1024, 1024]
    - [6, 9581.84]
  - - [1024, 3463, 1, 4096, 1024, 1024, 4096, 4096]
    - [27, 8293.87]
  - - [1024, 3126, 1, 4096, 1024, 1024, 4096, 4096]
    - [26, 7978.03]
  - - [1024, 3363, 1, 4096, 1024, 1024, 4096, 4096]
    - [19, 8267.37]
  - - [4096, 3465, 1, 1024, 4096, 4096, 1024, 1024]
    - [5, 9590.64]
  - - [33708, 3996, 1, 1024, 33708, 33708, 1024, 1024]
    - [6, 9899.89]
  - - [1024, 3231, 1, 4096, 1024, 1024, 4096, 4096]
    - [27, 8231.58]
  - - [33708, 3978, 1, 1024, 33708, 33708, 1024, 1024]
    - [6, 9853.54]
  - - [4096, 3476, 1, 1024, 4096, 4096, 1024, 1024]
    - [5, 9616.52]
  - - [85, 85, 752, 64, 85, 85, 64, 64]
    - [37, 4240.55]
  - - [4096, 3339, 1, 1024, 4096, 4096, 1024, 1024]
    - [7, 9249.71]
  - - [4096, 3452, 1, 1024, 4096, 4096, 1024, 1024]
    - [5, 9534.03]
  - - [1024, 3396, 1, 4096, 1024, 1024, 4096, 4096]
    - [26, 8451.13]
  - - [4096, 3293, 1, 1024, 4096, 4096, 1024, 1024]
    - [7, 9775.12]
  - - [54, 54, 1184, 64, 54, 54, 64, 64]
    - [39, 4153.44]
  - - [1024, 3432, 1, 4096, 1024, 1024, 4096, 4096]
    - [20, 8345.43]
  - - [4096, 3493, 1, 1024, 4096, 4096, 1024, 1024]
    - [8, 9649.8]
  - - [4096, 3350, 1, 1024, 4096, 4096, 1024, 1024]
    - [7, 9273.81]
  - - [1024, 3079, 1, 4096, 1024, 1024, 4096, 4096]
    - [35, 7775.56]
  - - [1024, 3101, 1, 4096, 1024, 1024, 4096, 4096]
    - [35, 7847.75]
  - - [33708, 3939, 1, 1024, 33708, 33708, 1024, 1024]
    - [8, 10054.3]
  - - [4096, 3256, 1, 1024, 4096, 4096, 1024, 1024]
    - [7, 9681.73]
  - - [1024, 3439, 1, 4096, 1024, 1024, 4096, 4096]
    - [26, 8531.01]
  - - [1024, 3510, 1, 4096, 1024, 1024, 4096, 4096]
    - [25, 8422.21]
  - - [4096, 3900, 1, 1024, 4096, 4096, 1024, 1024]
    - [6, 9468.51]
  - - [1024, 3470, 1, 4096, 1024, 1024, 4096, 4096]
    - [27, 8507.67]
  - - [4096, 3456, 1, 1024, 4096, 4096, 1024, 1024]
    - [7, 9577.36]
  - - [4096, 3014, 1, 1024, 4096, 4096, 1024, 1024]
    - [6, 9666.05]
  - - [4096, 3367, 1, 1024, 4096, 4096, 1024, 1024]
    - [8, 9328.26]
  - - [4096, 3432, 1, 1024, 4096, 4096, 1024, 1024]
    - [5, 9480.78]
  - - [33708, 4026, 1, 1024, 33708, 33708, 1024, 1024]
    - [8, 9972.73]
  - - [4096, 3273, 1, 1024, 4096, 4096, 1024, 1024]
    - [5, 9716.85]
  - - [4096, 3130, 1, 1024, 4096, 4096, 1024, 1024]
    - [5, 9311.3]
  - - [1024, 3496, 1, 4096, 1024, 1024, 4096, 4096]
    - [16, 8434.55]
  - - [1024, 3995, 1, 4096, 1024, 1024, 4096, 4096]
    - [1, 9157.63]
  - - [1024, 3939, 1, 4096, 1024, 1024, 4096, 4096]
    - [9, 9059.76]
  - - [1024, 3121, 1, 4096, 1024, 1024, 4096, 4096]
    - [33, 7963.33]
  - - [1024, 3232, 1, 4096, 1024, 1024, 4096, 4096]
    - [27, 8060.99]
  - - [4096, 3147, 1, 1024, 4096, 4096, 1024, 1024]
    - [7, 9364.53]
  - - [4096, 3516, 1, 1024, 4096, 4096, 1024, 1024]
    - [5, 9708.74]
  - - [1024, 3969, 1, 1024, 1024, 1024, 1024, 1024]
    - [11, 9168.58]
  - - [1024, 3364, 1, 4096, 1024, 1024, 4096, 4096]
    - [15, 8363.55]
  - - [4096, 3411, 1, 1024, 4096, 4096, 1024, 1024]
    - [8, 9442.67]
  - - [147, 147, 432, 64, 147, 147, 64, 64]
    - [52, 4843.11]
  - - [4096, 3301, 1, 1024, 4096, 4096, 1024, 1024]
    - [7, 9783.36]
  - - [112, 111, 576, 64, 112, 112, 64, 64]
    - [39, 5627.37]
  - - [1024, 3513, 1, 4096, 1024, 1024, 4096, 4096]
    - [26, 8725.31]
  - - [1024, 3469, 1, 4096, 1024, 1024, 4096, 4096]
    - [6, 8183.01]
  - - [1024, 3095, 1, 4096, 1024, 1024, 4096, 4096]
    - [27, 7887.77]
  - - [4096, 3533, 1, 1024, 4096, 4096, 1024, 1024]
    - [6, 9755.17]
  - - [4096, 3390, 1, 1024, 4096, 4096, 1024, 1024]
    - [5, 9377.11]
  - - [4096, 3582, 1, 1024, 4096, 4096, 1024, 1024]
    - [5, 9874.86]
  - - [1024, 3956, 1, 1024, 1024, 1024, 1024, 1024]
    - [11, 9058.72]
  - - [4096, 3585, 1, 1024, 4096, 4096, 1024, 1024]
    - [7, 9289.65]
  - - [4096, 3231, 1, 1024, 4096, 4096, 1024, 1024]
    - [6, 9597.05]
  - - [1024, 3205, 1, 4096, 1024, 1024, 4096, 4096]
    - [25, 8073.15]
  - - [4096, 3496, 1, 1024, 4096, 4096, 1024, 1024]
    - [6, 9668.28]
  - - [1024, 3143, 1, 4096, 1024, 1024, 4096, 4096]
    - [25, 8031.58]
  - - [1024, 3318, 1, 4096, 1024, 1024, 4096, 4096]
    - [22, 8261.33]
  - - [1024, 3353, 1, 4096, 1024, 1024, 4096, 4096]
    - [26, 8414.82]
  - - [1024, 3464, 1, 4096, 1024, 1024, 4096, 4096]
    - [25, 8309.93]
  - - [4096, 2736, 1, 1024, 4096, 4096, 1024, 1024]
    - [7, 9563.02]
  - - [1024, 3402, 1, 4096, 1024, 1024, 4096, 4096]
    - [22, 8413.74]
  - - [4096, 3138, 1, 1024, 4096, 4096, 1024, 1024]
    - [7, 9341.99]
  - - [1024, 3860, 1, 4096, 1024, 1024, 4096, 4096]
    - [10, 9008.47]
  - - [148, 148, 432, 64, 148, 148, 64, 64]
    - [52, 4915.6]
  - - [1024, 3539, 1, 4096, 1024, 1024, 4096, 4096]
    - [22, 8449.26]
  - - [4096, 3211, 1, 1024, 4096, 4096, 1024, 1024]
    - [7, 9551.18]
  - - [1024, 3332, 1, 4096, 1024, 1024, 4096, 4096]
    - [15, 8295.01]
  - - [1024, 3466, 1, 4096, 1024, 1024, 4096, 4096]
    - [26, 8339.15]
  - - [4096, 3475, 1, 1024, 4096, 4096, 1024, 1024]
    - [5, 9612.23]
  - - [4096, 3524, 1, 1024, 4096, 4096, 1024, 1024]
    - [8, 9722.64]
  - - [4096, 2985, 1, 1024, 4096, 4096, 1024, 1024]
    - [8, 9591.23]
  - - [4096, 3222, 1, 1024, 4096, 4096, 1024, 1024]
    - [5, 9577.38]
  - - [4096, 3451, 1, 1024, 4096, 4096, 1024, 1024]
    - [7, 9541.32]
  - - [1024, 3181, 1, 4096, 1024, 1024, 4096, 4096]
    - [25, 8118.79]
  - - [1024, 3640, 1, 4096, 1024, 1024, 4096, 4096]
    - [10, 8617.01]
  - - [1024, 3375, 1, 4096, 1024, 1024, 4096, 4096]
    - [14, 8419.65]
  - - [1024, 3550, 1, 4096, 1024, 1024, 4096, 4096]
    - [27, 8512.73]
  - - [1024, 4020, 1, 1024, 1024, 1024, 1024, 1024]
    - [11, 9266.8]
  - - [1024, 3840, 1, 4096, 1024, 1024, 4096, 4096]
    - [10, 8983.39]
  - - [4096, 3349, 1, 1024, 4096, 4096, 1024, 1024]
    - [5, 9279.86]
  - - [4096, 3398, 1, 1024, 4096, 4096, 1024, 1024]
    - [6, 9402.22]
  - - [33708, 3976, 1, 1024, 33708, 33708, 1024, 1024]
    - [7, 9849.44]
  - - [1024, 2917, 1, 4096, 1024, 1024, 4096, 4096]
    - [12, 8936.77]
  - - [33708, 3910, 1, 1024, 33708, 33708, 1024, 1024]
    - [5, 9983.25]
  - - [4096, 3860, 1, 1024, 4096, 4096, 1024, 1024]
    - [6, 9377.48]
  - - [4096, 3304, 1, 1024, 4096, 4096, 1024, 1024]
    - [8, 9798.34]
  - - [1024, 3286, 1, 4096, 1024, 1024, 4096, 4096]
    - [13, 8167.31]
  - - [1024, 3460, 1, 4096, 1024, 1024, 4096, 4096]
    - [23, 8539.46]
  - - [1024, 4026, 1, 4096, 1024, 1024, 4096, 4096]
    - [9, 9305.58]
  - - [4096, 3471, 1, 1024, 4096, 4096, 1024, 1024]
    - [7, 9596.61]
  - - [193, 193, 320, 64, 193, 193, 64, 64]
    - [55, 4758.36]
  - - [1024, 3894, 1, 1024, 1024, 1024, 1024, 1024]
    - [9, 8979.5]
  - - [65, 65, 992, 64, 65, 65, 64, 64]
    - [51, 2565.39]
  - - [1024, 3506, 1, 4096, 1024, 1024, 4096, 4096]
    - [23, 8593.12]
  - - [35, 35, 1808, 64, 35, 35, 64, 64]
    - [45, 2129.62]
  - - [1024, 4000, 1, 1024, 1024, 1024, 1024, 1024]
    - [9, 9204.5]
  - - [1024, 3900, 1, 4096, 1024, 1024, 4096, 4096]
    - [5, 9050.26]
  - - [1024, 3445, 1, 4096, 1024, 1024, 4096, 4096]
    - [28, 8551.55]
  - - [4096, 3442, 1, 1024, 4096, 4096, 1024, 1024]
    - [6, 9504.9]
  - - [1024, 3358, 1, 4096, 1024, 1024, 4096, 4096]
    - [27, 8437.06]
  - - [13, 13, 4672, 64, 13, 13, 64, 64]
    - [38, 860.565]
  - - [1024, 3211, 1, 4096, 1024, 1024, 4096, 4096]
    - [31, 8085.15]
  - - [4096, 3515, 1, 1024, 4096, 4096, 1024, 1024]
    - [7, 9715.19]
  - - [1024, 3564, 1, 4096, 1024, 1024, 4096, 4096]
    - [13, 8760.27]
  - - [4096, 3057, 1, 1024, 4096, 4096, 1024, 1024]
    - [7, 9803.95]
  - - [1024, 3343, 1, 4096, 1024, 1024, 4096, 4096]
    - [25, 8363.7]
  - - [4096, 3262, 1, 1024, 4096, 4096, 1024, 1024]
    - [6, 9686.39]
  - - [1024, 3518, 1, 4096, 1024, 1024, 4096, 4096]
    - [25, 8454.95]
  - - [77, 77, 816, 64, 77, 77, 64, 64]
    - [44, 3505.84]
  - - [33708, 3876, 1, 1024, 33708, 33708, 1024, 1024]
    - [6, 9895.85]
  - - [4096, 3462, 1, 1024, 4096, 4096, 1024, 1024]
    - [7, 9570.21]
  - - [1024, 3265, 1, 4096, 1024, 1024, 4096, 4096]
    - [25, 8322.65]
  - - [4096, 3389, 1, 1024, 4096, 4096, 1024, 1024]
    - [6, 9382.76]
  - - [4096, 3438, 1, 1024, 4096, 4096, 1024, 1024]
    - [7, 9503.37]
  - - [1024, 3955, 1, 1024, 1024, 1024, 1024, 1024]
    - [9, 9064.35]
  - - [1024, 3545, 1, 4096, 1024, 1024, 4096, 4096]
    - [28, 8652.31]
  - - [1024, 3144, 1, 4096, 1024, 1024, 4096, 4096]
    - [28, 8060.45]
  - - [1024, 3417, 1, 4096, 1024, 1024, 4096, 4096]
    - [26, 8505.81]
  - - [4096, 3543, 1, 1024, 4096, 4096, 1024, 1024]
    - [5, 9775.57]
  - - [4096, 3352, 1, 1024, 4096, 4096, 1024, 1024]
    - [7, 9282.77]
  - - [33708, 3975, 1, 1024, 33708, 33708, 1024, 1024]
    - [8, 9849.39]
  - - [148, 147, 432, 64, 148, 148, 64, 64]
    - [52, 4876.05]
  - - [4096, 3137, 1, 1024, 4096, 4096, 1024, 1024]
    - [5, 9330.53]
  - - [4096, 3506, 1, 1024, 4096, 4096, 1024, 1024]
    - [8, 9682.66]
  - - [1024, 3975, 1, 1024, 1024, 1024, 1024, 1024]
    - [11, 9164.67]
  - - [1024, 3859, 1, 4096, 1024, 1024, 4096, 4096]
    - [9, 8983.74]
  - - [4096, 3369, 1, 1024, 4096, 4096, 1024, 1024]
    - [7, 9330.35]
  - - [1024, 3434, 1, 4096, 1024, 1024, 4096, 4096]
    - [25, 8486.88]
  - - [1024, 3292, 1, 4096, 1024, 1024, 4096, 4096]
    - [25, 8478.86]
  - - [4096, 3523, 1, 1024, 4096, 4096, 1024, 1024]
    - [5, 9734.73]
  - - [4096, 3380, 1, 1024, 4096, 4096, 1024, 1024]
    - [7, 9354.39]
  - - [1024, 3408, 1, 4096, 1024, 1024, 4096, 4096]
    - [28, 8440.93]
  - - [4096, 3221, 1, 1024, 4096, 4096, 1024, 1024]
    - [7, 9575.49]
  - - [4096, 3270, 1, 1024, 4096, 4096, 1024, 1024]
    - [7, 9717.85]
  - - [143, 143, 432, 64, 143, 143, 64, 64]
    - [53, 4643.35]
  - - [111, 111, 576, 64, 111, 111, 64, 64]
    - [45, 5474.94]
  - - [1024, 3303, 1, 4096, 1024, 1024, 4096, 4096]
    - [27, 8412.97]
  - - [4096, 3502, 1, 1024, 4096, 4096, 1024, 1024]
    - [7, 9679.77]
  - - [1024, 3222, 1, 4096, 1024, 1024, 4096, 4096]
    - [27, 8141.78]
  - - [4096, 2505, 1, 1024, 4096, 4096, 1024, 1024]
    - [5, 9594.85]
  - - [4096, 3397, 1, 1024, 4096, 4096, 1024, 1024]
    - [5, 9392.51]
  - - [4096, 3562, 1, 1024, 4096, 4096, 1024, 1024]
    - [5, 9827.48]
  - - [4096, 3095, 1, 1024, 4096, 4096, 1024, 1024]
    - [7, 9222.35]
  - - [1024, 3226, 1, 4096, 1024, 1024, 4096, 4096]
    - [23, 8026.93]
  - - [177, 177, 352, 64, 177, 177, 64, 64]
    - [40, 6406.86]
  - - [4096, 3360, 1, 1024, 4096, 4096, 1024, 1024]
    - [6, 9298.05]
  - - [1024, 3942, 1, 1024, 1024, 1024, 1024, 1024]
    - [11, 9061.49]
  - - [1024, 3298, 1, 4096, 1024, 1024, 4096, 4096]
    - [28, 8254.26]
  - - [1024, 3381, 1, 4096, 1024, 1024, 4096, 4096]
    - [27, 8508.71]
  - - [4096, 3314, 1, 1024, 4096, 4096, 1024, 1024]
    - [7, 9837.46]
  - - [1024, 3492, 1, 4096, 1024, 1024, 4096, 4096]
    - [15, 8583.29]
  - - [1024, 3430, 1, 4096, 1024, 1024, 4096, 4096]
    - [15, 8492.61]
  - - [4096, 3977, 1, 1024, 4096, 4096, 1024, 1024]
    - [7, 9656.35]
  - - [4096, 3546, 1, 1024, 4096, 4096, 1024, 1024]
    - [5, 9780.25]
  - - [4096, 3640, 1, 1024, 4096, 4096, 1024, 1024]
    - [5, 9415.41]
  - - [4096, 3441, 1, 1024, 4096, 4096, 1024, 1024]
    - [6, 9499.14]
  - - [33708, 4059, 1, 1024, 33708, 33708, 1024, 1024]
    - [8, 10051.8]
  - - [1024, 3978, 1, 1024, 1024, 1024, 1024, 1024]
    - [9, 9158.7]
  - - [1024, 3376, 1, 4096, 1024, 1024, 4096, 4096]
    - [27, 8415.34]
  - - [1024, 3482, 1, 4096, 1024, 1024, 4096, 4096]
    - [28, 8396.52]
  - - [1024, 3563, 1, 4096, 1024, 1024, 4096, 4096]
    - [11, 8424.08]
  - - [4096, 4020, 1, 1024, 4096, 4096, 1024, 1024]
    - [8, 9745.86]
  - - [1024, 3271, 1, 4096, 1024, 1024, 4096, 4096]
    - [26, 8289.58]
  - - [1024, 3291, 1, 4096, 1024, 1024, 4096, 4096]
    - [26, 8222.61]
  - - [1024, 3431, 1, 4096, 1024, 1024, 4096, 4096]
    - [21, 8464.3]
  - - [1024, 3481, 1, 4096, 1024, 1024, 4096, 4096]
    - [27, 8386.4]
  - - [84, 85, 752, 64, 84, 84, 64, 64]
    - [42, 4194.75]
  - - [4096, 3461, 1, 1024, 4096, 4096, 1024, 1024]
    - [5, 9579.57]
  - - [1024, 3574, 1, 4096, 1024, 1024, 4096, 4096]
    - [28, 8579.7]
  - - [1024, 4059, 1, 1024, 1024, 1024, 1024, 1024]
    - [9, 9330.44]
  - - [84, 84, 752, 64, 84, 84, 64, 64]
    - [49, 4141.36]
  - - [1024, 3421, 1, 4096, 1024, 1024, 4096, 4096]
    - [28, 8528.32]
  - - [4096, 3224, 1, 1024, 4096, 4096, 1024, 1024]
    - [7, 9589.85]
  - - [4096, 3437, 1, 1024, 4096, 4096, 1024, 1024]
    - [7, 9498.1]
  - - [45, 45, 1424, 64, 45, 45, 64, 64]
    - [39, 3314.48]
  - - [4096, 3840, 1, 1024, 4096, 4096, 1024, 1024]
    - [5, 9931.27]
  - - [4096, 3168, 1, 1024, 4096, 4096, 1024, 1024]
    - [7, 9412.06]
  - - [33708, 3990, 1, 1024, 33708, 33708, 1024, 1024]
    - [5, 9884.29]
  - - [1024, 3349, 1, 4096, 1024, 1024, 4096, 4096]
    - [27, 8421.3]
  - - [4096, 3335, 1, 1024, 4096, 4096, 1024, 1024]
    - [5, 9241.55]
  - - [4096, 3400, 1, 1024, 4096, 4096, 1024, 1024]
    - [7, 9407.25]
  - - [160, 159, 400, 64, 160, 160, 64, 64]
    - [54, 5708.84]
  - - [1024, 3398, 1, 4096, 1024, 1024, 4096, 4096]
    - [27, 8623.93]
  - - [1024, 3780, 1, 4096, 1024, 1024, 4096, 4096]
    - [7, 8756.68]
  - - [29, 29, 2176, 64, 29, 29, 64, 64]
    - [50, 2963.59]
  - - [4096, 3098, 1, 1024, 4096, 4096, 1024, 1024]
    - [5, 9229.72]
  - - [1024, 4012, 1, 4096, 1024, 1024, 4096, 4096]
    - [11, 9421.93]
  - - [4096, 3505, 1, 1024, 4096, 4096, 1024, 1024]
    - [7, 9687.55]
  - - [4096, 3554, 1, 1024, 4096, 4096, 1024, 1024]
    - [7, 9812.12]
  - - [4096, 3063, 1, 1024, 4096, 4096, 1024, 1024]
    - [7, 9825.0]
  - - [1024, 3503, 1, 4096, 1024, 1024, 4096, 4096]
    - [25, 8404.64]
  - - [1024, 3166, 1, 4096, 1024, 1024, 4096, 4096]
    - [28, 8084.83]
  - - [1024, 3425, 1, 4096, 1024, 1024, 4096, 4096]
    - [28, 8537.48]
  - - [1024, 3344, 1, 4096, 1024, 1024, 4096, 4096]
    - [19, 8351.06]
  - - [4096, 3484, 1, 1024, 4096, 4096, 1024, 1024]
    - [7, 9635.6]
  - - [1024, 3681, 1, 1024, 1024, 1024, 1024, 1024]
    - [10, 8457.08]
  - - [1024, 4050, 1, 1024, 1024, 1024, 1024, 1024]
    - [11, 9326.11]
  - - [4096, 3379, 1, 1024, 4096, 4096, 1024, 1024]
    - [5, 9356.06]
  - - [4096, 3428, 1, 1024, 4096, 4096, 1024, 1024]
    - [6, 9472.23]
  - - [12, 12, 5040, 64, 12, 12, 64, 64]
    - [44, 741.517]
  - - [27, 27, 2336, 64, 27, 27, 64, 64]
    - [50, 2757.8]
  - - [1024, 3304, 1, 4096, 1024, 1024, 4096, 4096]
    - [28, 8317.72]
  - - [1024, 3387, 1, 4096, 1024, 1024, 4096, 4096]
    - [26, 8460.05]
  - - [4096, 3126, 1, 1024, 4096, 4096, 1024, 1024]
    - [8, 9308.38]
  - - [1024, 3498, 1, 4096, 1024, 1024, 4096, 4096]
    - [25, 8485.45]
  - - [1024, 3436, 1, 4096, 1024, 1024, 4096, 4096]
    - [27, 8397.61]
  - - [4096, 3501, 1, 1024, 4096, 4096, 1024, 1024]
    - [5, 9681.09]
  - - [4096, 3358, 1, 1024, 4096, 4096, 1024, 1024]
    - [7, 9304.8]
  - - [4096, 3232, 1, 1024, 4096, 4096, 1024, 1024]
    - [5, 9607.1]
  - - [1024, 3585, 1, 4096, 1024, 1024, 4096, 4096]
    - [9, 8510.64]
  - - [4096, 3143, 1, 1024, 4096, 4096, 1024, 1024]
    - [8, 9355.81]
  - - [4096, 3464, 1, 1024, 4096, 4096, 1024, 1024]
    - [7, 9585.85]
  - - [1024, 3366, 1, 4096, 1024, 1024, 4096, 4096]
    - [15, 8275.13]
  - - [4096, 3375, 1, 1024, 4096, 4096, 1024, 1024]
    - [5, 9342.03]
  - - [4096, 2917, 1, 1024, 4096, 4096, 1024, 1024]
    - [5, 9372.74]
  - - [4096, 4026, 1, 1024, 4096, 4096, 1024, 1024]
    - [7, 9759.05]
  - - [49, 49, 1296, 64, 49, 49, 64, 64]
    - [46, 3709.92]
  - - [1024, 3277, 1, 4096, 1024, 1024, 4096, 4096]
    - [26, 8217.0]
  - - [1024, 3103, 1, 4096, 1024, 1024, 4096, 4096]
    - [27, 7872.57]
  - - [33708, 3995, 1, 1024, 33708, 33708, 1024, 1024]
    - [7, 9892.98]
  - - [1024, 3297, 1, 4096, 1024, 1024, 4096, 4096]
    - [26, 8185.72]
  - - [4096, 3545, 1, 1024, 4096, 4096, 1024, 1024]
    - [7, 9789.33]
  - - [1024, 3399, 1, 4096, 1024, 1024, 4096, 4096]
    - [26, 8377.08]
  - - [33708, 3796, 1, 1024, 33708, 33708, 1024, 1024]
    - [6, 10007.9]
  - - [4096, 3292, 1, 1024, 4096, 4096, 1024, 1024]
    - [7, 9767.18]
  - - [71, 71, 896, 64, 71, 71, 64, 64]
    - [41, 3006.15]
  - - [33708, 3859, 1, 1024, 33708, 33708, 1024, 1024]
    - [8, 9860.27]
  - - [4096, 3566, 1, 1024, 4096, 4096, 1024, 1024]
    - [7, 9834.37]
  - - [4096, 3894, 1, 1024, 4096, 4096, 1024, 1024]
    - [5, 9456.57]
  - - [4096, 3492, 1, 1024, 4096, 4096, 1024, 1024]
    - [5, 9653.14]
  - - [1024, 3977, 1, 1024, 1024, 1024, 1024, 1024]
    - [11, 9161.23]
  - - [1024, 3272, 1, 4096, 1024, 1024, 4096, 4096]
    - [28, 8256.99]
  - - [135, 134, 480, 64, 135, 135, 64, 64]
    - [52, 4238.29]
  - - [1024, 3355, 1, 4096, 1024, 1024, 4096, 4096]
    - [26, 8374.54]
  - - [4096, 3419, 1, 1024, 4096, 4096, 1024, 1024]
    - [8, 9455.34]
  - - [1024, 3404, 1, 4096, 1024, 1024, 4096, 4096]
    - [27, 8580.18]
  - - [4096, 3999, 1, 1024, 4096, 4096, 1024, 1024]
    - [7, 9701.68]
  - - [4096, 3166, 1, 1024, 4096, 4096, 1024, 1024]
    - [5, 9410.38]
  - - [33708, 3840, 1, 1024, 33708, 33708, 1024, 1024]
    - [8, 10132.8]
  - - [4096, 4032, 1, 1024, 4096, 4096, 1024, 1024]
    - [8, 9762.76]
  - - [1024, 3573, 1, 4096, 1024, 1024, 4096, 4096]
    - [26, 8603.3]
  - - [4096, 3366, 1, 1024, 4096, 4096, 1024, 1024]
    - [8, 9322.53]
  - - [1024, 3541, 1, 4096, 1024, 1024, 4096, 4096]
    - [28, 8405.8]
  - - [4096, 3207, 1, 1024, 4096, 4096, 1024, 1024]
    - [5, 9544.15]
  - - [4096, 3272, 1, 1024, 4096, 4096, 1024, 1024]
    - [7, 9716.63]
  - - [1024, 3334, 1, 4096, 1024, 1024, 4096, 4096]
    - [25, 8241.29]
  - - [228, 228, 272, 64, 228, 228, 64, 64]
    - [40, 6232.35]
  - - [4096, 3183, 1, 1024, 4096, 4096, 1024, 1024]
    - [7, 9452.34]
  - - [4096, 3536, 1, 1024, 4096, 4096, 1024, 1024]
    - [6, 9759.34]
  - - [1024, 4005, 1, 1024, 1024, 1024, 1024, 1024]
    - [10, 9225.73]
  - - [1024, 3245, 1, 4096, 1024, 1024, 4096, 4096]
    - [27, 8074.21]
  - - [4096, 3447, 1, 1024, 4096, 4096, 1024, 1024]
    - [6, 9525.74]
  - - [1024, 3183, 1, 4096, 1024, 1024, 4096, 4096]
    - [26, 8121.52]
  - - [1024, 3361, 1, 4096, 1024, 1024, 4096, 4096]
    - [28, 8285.76]
  - - [33708, 3870, 1, 1024, 33708, 33708, 1024, 1024]
    - [6, 9879.25]
  - - [1024, 3321, 1, 4096, 1024, 1024, 4096, 4096]
    - [27, 8408.57]
  - - [1024, 3968, 1, 1024, 1024, 1024, 1024, 1024]
    - [9, 9201.95]
  - - [1024, 3486, 1, 4096, 1024, 1024, 4096, 4096]
    - [23, 8258.79]
  - - [4096, 4005, 1, 1024, 4096, 4096, 1024, 1024]
    - [7, 9723.88]
  - - [4096, 3410, 1, 1024, 4096, 4096, 1024, 1024]
    - [8, 9440.4]
  - - [1024, 3944, 1, 1024, 1024, 1024, 1024, 1024]
    - [11, 9040.72]
  - - [4096, 3300, 1, 1024, 4096, 4096, 1024, 1024]
    - [6, 9789.8]
  - - [4096, 3579, 1, 1024, 4096, 4096, 1024, 1024]
    - [8, 9859.34]
  - - [4096, 3483, 1, 1024, 4096, 4096, 1024, 1024]
    - [8, 9624.21]
  - - [4096, 3532, 1, 1024, 4096, 4096, 1024, 1024]
    - [7, 9742.66]
  - - [1024, 3140, 1, 4096, 1024, 1024, 4096, 4096]
    - [27, 7899.55]
  - - [1024, 3372, 1, 4096, 1024, 1024, 4096, 4096]
    - [25, 8236.97]
  - - [1024, 3224, 1, 4096, 1024, 1024, 4096, 4096]
    - [28, 8159.03]
  - - [4096, 3230, 1, 1024, 4096, 4096, 1024, 1024]
    - [7, 9601.15]
  - - [4096, 3427, 1, 1024, 4096, 4096, 1024, 1024]
    - [7, 9466.47]
  - - [1024, 3796, 1, 1024, 1024, 1024, 1024, 1024]
    - [11, 8739.68]
  - - [143, 148, 432, 64, 143, 143, 64, 64]
    - [52, 4761.9]
  - - [1024, 3616, 1, 4096, 1024, 1024, 4096, 4096]
    - [10, 8445.79]
  - - [1024, 3315, 1, 4096, 1024, 1024, 4096, 4096]
    - [27, 8403.11]
  - - [1024, 3476, 1, 4096, 1024, 1024, 4096, 4096]
    - [25, 8523.58]
  - - [1024, 3509, 1, 4096, 1024, 1024, 4096, 4096]
    - [25, 8344.95]
  - - [4096, 3357, 1, 1024, 4096, 4096, 1024, 1024]
    - [7, 9300.06]
  - - [4096, 3406, 1, 1024, 4096, 4096, 1024, 1024]
    - [7, 9427.34]
  - - [1024, 3558, 1, 4096, 1024, 1024, 4096, 4096]
    - [26, 8525.68]
  - - [4096, 3593, 1, 1024, 4096, 4096, 1024, 1024]
    - [7, 9302.1]
  - - [4096, 3247, 1, 1024, 4096, 4096, 1024, 1024]
    - [7, 9648.4]
  - - [4096, 3088, 1, 1024, 4096, 4096, 1024, 1024]
    - [7, 9204.11]
  - - [1024, 3213, 1, 4096, 1024, 1024, 4096, 4096]
    - [25, 8054.21]
  - - [4096, 3511, 1, 1024, 4096, 4096, 1024, 1024]
    - [5, 9702.6]
  - - [122, 122, 528, 64, 122, 122, 64, 64]
    - [46, 6293.29]
  - - [1024, 3365, 1, 4096, 1024, 1024, 4096, 4096]
    - [22, 8413.52]
  - - [1024, 3504, 1, 4096, 1024, 1024, 4096, 4096]
    - [24, 8414.36]
  - - [1024, 3442, 1, 4096, 1024, 1024, 4096, 4096]
    - [27, 8683.9]
  - - [4096, 3474, 1, 1024, 4096, 4096, 1024, 1024]
    - [5, 9611.5]
  - - [4096, 2984, 1, 1024, 4096, 4096, 1024, 1024]
    - [6, 9592.72]
  - - [1024, 3876, 1, 4096, 1024, 1024, 4096, 4096]
    - [9, 9085.85]
  - - [4096, 3337, 1, 1024, 4096, 4096, 1024, 1024]
    - [7, 9246.12]
  - - [4096, 3450, 1, 1024, 4096, 4096, 1024, 1024]
    - [7, 9534.53]
  - - [1024, 3547, 1, 4096, 1024, 1024, 4096, 4096]
    - [27, 8386.63]
  - - [4096, 3291, 1, 1024, 4096, 4096, 1024, 1024]
    - [6, 9759.24]
  - - [1024, 3340, 1, 4096, 1024, 1024, 4096, 4096]
    - [26, 8237.87]
  - - [4096, 3491, 1, 1024, 4096, 4096, 1024, 1024]
    - [7, 9656.49]
  - - [4096, 3348, 1, 1024, 4096, 4096, 1024, 1024]
    - [7, 9279.05]
  - - [78, 78, 816, 64, 78, 78, 64, 64]
    - [47, 3590.99]
  - - [4096, 3968, 1, 1024, 4096, 4096, 1024, 1024]
    - [8, 9642.09]
  - - [4096, 3906, 1, 1024, 4096, 4096, 1024, 1024]
    - [8, 9485.27]
  - - [1024, 3477, 1, 4096, 1024, 1024, 4096, 4096]
    - [15, 8389.1]
  - - [1024, 3397, 1, 4096, 1024, 1024, 4096, 4096]
    - [25, 8556.78]
  - - [4096, 3165, 1, 1024, 4096, 4096, 1024, 1024]
    - [6, 9415.42]
  - - [4096, 3470, 1, 1024, 4096, 4096, 1024, 1024]
    - [5, 9598.4]
  - - [1024, 3526, 1, 4096, 1024, 1024, 4096, 4096]
    - [25, 8442.05]
  - - [112, 112, 576, 64, 112, 112, 64, 64]
    - [40, 5672.5]
  - - [4096, 3365, 1, 1024, 4096, 4096, 1024, 1024]
    - [5, 9321.73]
  - - [4096, 3319, 1, 1024, 4096, 4096, 1024, 1024]
    - [5, 9838.38]
  - - [1024, 3401, 1, 4096, 1024, 1024, 4096, 4096]
    - [27, 8460.76]
  - - [1024, 3294, 1, 4096, 1024, 1024, 4096, 4096]
    - [26, 8324.53]
  - - [159, 159, 400, 64, 159, 159, 64, 64]
    - [42, 5488.41]
  - - [1024, 3472, 1, 4096, 1024, 1024, 4096, 4096]
    - [20, 8289.67]
  - - [4096, 3328, 1, 1024, 4096, 4096, 1024, 1024]
    - [6, 9904.25]
  - - [1024, 3861, 1, 1024, 1024, 1024, 1024, 1024]
    - [11, 8917.53]
  - - [1024, 3910, 1, 1024, 1024, 1024, 1024, 1024]
    - [9, 9010.06]
  - - [1024, 3410, 1, 4096, 1024, 1024, 4096, 4096]
    - [27, 8519.53]
  - - [1024, 3395, 1, 4096, 1024, 1024, 4096, 4096]
    - [25, 8424.25]
  - - [4096, 3282, 1, 1024, 4096, 4096, 1024, 1024]
    - [5, 9743.57]
  - - [1024, 3751, 1, 1024, 1024, 1024, 1024, 1024]
    - [12, 8680.29]
  - - [4096, 3145, 1, 1024, 4096, 4096, 1024, 1024]
    - [7, 9353.27]
  - - [4096, 3514, 1, 1024, 4096, 4096, 1024, 1024]
    - [7, 9712.94]
  - - [4096, 3944, 1, 1024, 4096, 4096, 1024, 1024]
    - [7, 9563.82]
  - - [1024, 3515, 1, 4096, 1024, 1024, 4096, 4096]
    - [26, 8428.03]
  - - [4096, 3409, 1, 1024, 4096, 4096, 1024, 1024]
    - [6, 9428.67]
  - - [4096, 3564, 1, 1024, 4096, 4096, 1024, 1024]
    - [5, 9823.69]
  - - [4096, 3299, 1, 1024, 4096, 4096, 1024, 1024]
    - [7, 9792.93]
  - - [1024, 3057, 1, 4096, 1024, 1024, 4096, 4096]
    - [3, 9237.75]
  - - [4096, 3531, 1, 1024, 4096, 4096, 1024, 1024]
    - [5, 9745.54]
  - - [4096, 3388, 1, 1024, 4096, 4096, 1024, 1024]
    - [7, 9374.55]
  - - [1024, 3189, 1, 4096, 1024, 1024, 4096, 4096]
    - [27, 8084.5]
  - - [1024, 3300, 1, 4096, 1024, 1024, 4096, 4096]
    - [27, 8185.03]
  - - [1024, 3720, 1, 4096, 1024, 1024, 4096, 4096]
    - [6, 8755.01]
  - - [1024, 3383, 1, 4096, 1024, 1024, 4096, 4096]
    - [20, 8463.37]
  - - [1024, 3494, 1, 4096, 1024, 1024, 4096, 4096]
    - [27, 8676.47]
  - - [77, 78, 816, 64, 77, 77, 64, 64]
    - [43, 3548.16]
  - - [1024, 3448, 1, 4096, 1024, 1024, 4096, 4096]
    - [25, 8665.68]
  - - [4096, 3542, 1, 1024, 4096, 4096, 1024, 1024]
    - [5, 9771.78]
  - - [1024, 3488, 1, 4096, 1024, 1024, 4096, 4096]
    - [25, 8488.29]
  - - [4096, 3405, 1, 1024, 4096, 4096, 1024, 1024]
    - [7, 9426.06]
  - - [1024, 3262, 1, 4096, 1024, 1024, 4096, 4096]
    - [27, 8206.87]
  - - [33708, 4005, 1, 1024, 33708, 33708, 1024, 1024]
    - [8, 9928.06]
  - - [1024, 3594, 1, 4096, 1024, 1024, 4096, 4096]
    - [12, 8458.47]
  - - [4096, 3103, 1, 1024, 4096, 4096, 1024, 1024]
    - [8, 9243.04]
  - - [4096, 3136, 1, 1024, 4096, 4096, 1024, 1024]
    - [7, 9340.8]
  - - [1024, 3378, 1, 4096, 1024, 1024, 4096, 4096]
    - [28, 8432.35]
  - - [10, 10, 5952, 64, 10, 10, 64, 64]
    - [48, 523.253]
  - - [7, 7, 8192, 64, 7, 7, 64, 64]
    - [48, 260.443]
  - - [4096, 3559, 1, 1024, 4096, 4096, 1024, 1024]
    - [7, 9813.0]
  - - [4096, 3368, 1, 1024, 4096, 4096, 1024, 1024]
    - [8, 9328.56]
  - - [4096, 3209, 1, 1024, 4096, 4096, 1024, 1024]
    - [5, 9538.73]
  - - [4096, 3322, 1, 1024, 4096, 4096, 1024, 1024]
    - [7, 9839.48]
  - - [1024, 3483, 1, 4096, 1024, 1024, 4096, 4096]
    - [13, 8348.25]
  - - [4096, 3473, 1, 1024, 4096, 4096, 1024, 1024]
    - [6, 9605.69]
  - - [4096, 3522, 1, 1024, 4096, 4096, 1024, 1024]
    - [8, 9729.92]
  - - [1024, 3532, 1, 4096, 1024, 1024, 4096, 4096]
    - [26, 8474.22]
  - - [4096, 3449, 1, 1024, 4096, 4096, 1024, 1024]
    - [7, 9528.25]
  - - [1024, 3351, 1, 4096, 1024, 1024, 4096, 4096]
    - [28, 8311.13]
  - - [1024, 3462, 1, 4096, 1024, 1024, 4096, 4096]
    - [25, 8297.54]
  - - [4096, 3396, 1, 1024, 4096, 4096, 1024, 1024]
    - [7, 9400.15]
  - - [132, 132, 480, 64, 132, 132, 64, 64]
    - [53, 4089.74]
  - - [111, 112, 576, 64, 111, 111, 64, 64]
    - [39, 5529.6]
  - - [1024, 3416, 1, 4096, 1024, 1024, 4096, 4096]
    - [26, 8556.54]
  - - [4096, 3469, 1, 1024, 4096, 4096, 1024, 1024]
    - [8, 9598.67]
  - - [1024, 3582, 1, 4096, 1024, 1024, 4096, 4096]
    - [9, 8461.37]
  - - [1024, 3230, 1, 4096, 1024, 1024, 4096, 4096]
    - [26, 8188.84]
  - - [1024, 3489, 1, 4096, 1024, 1024, 4096, 4096]
    - [27, 8457.75]
  - - [1024, 3427, 1, 4096, 1024, 1024, 4096, 4096]
    - [27, 8566.49]
  - - [1024, 3346, 1, 4096, 1024, 1024, 4096, 4096]
    - [26, 8352.07]
  - - [33708, 3977, 1, 1024, 33708, 33708, 1024, 1024]
    - [8, 9868.4]
  - - [4096, 3796, 1, 1024, 4096, 4096, 1024, 1024]
    - [7, 9797.66]
  - - [4096, 3176, 1, 1024, 4096, 4096, 1024, 1024]
    - [7, 9435.29]
  - - [4096, 3990, 1, 1024, 4096, 4096, 1024, 1024]
    - [5, 9672.23]
  - - [1024, 3257, 1, 4096, 1024, 1024, 4096, 4096]
    - [28, 8225.07]
  - - [4096, 3343, 1, 1024, 4096, 4096, 1024, 1024]
    - [29, 9273.52]
  - - [4096, 3440, 1, 1024, 4096, 4096, 1024, 1024]
    - [5, 9501.38]
  - - [33708, 4030, 1, 1024, 33708, 33708, 1024, 1024]
    - [6, 9983.26]
  - - [1024, 3190, 1, 4096, 1024, 1024, 4096, 4096]
    - [27, 8192.01]
  - - [1024, 3389, 1, 4096, 1024, 1024, 4096, 4096]
    - [28, 8439.32]
  - - [1024, 3500, 1, 4096, 1024, 1024, 4096, 4096]
    - [26, 8556.02]
  - - [1024, 3471, 1, 4096, 1024, 1024, 4096, 4096]
    - [15, 8491.07]
  - - [1024, 3438, 1, 4096, 1024, 1024, 4096, 4096]
    - [28, 8567.85]
  - - [4096, 3513, 1, 1024, 4096, 4096, 1024, 1024]
    - [5, 9710.17]
  - - [1024, 3562, 1, 4096, 1024, 1024, 4096, 4096]
    - [20, 8608.84]
  - - [4096, 3616, 1, 1024, 4096, 4096, 1024, 1024]
    - [7, 9357.49]
  - - [4096, 3955, 1, 1024, 4096, 4096, 1024, 1024]
    - [6, 9589.61]
  - - [1024, 3441, 1, 4096, 1024, 1024, 4096, 4096]
    - [16, 8359.17]
  - - [1024, 3236, 1, 4096, 1024, 1024, 4096, 4096]
    - [30, 8022.5]
  - - [1024, 3524, 1, 4096, 1024, 1024, 4096, 4096]
    - [25, 8477.14]
  - - [4096, 3460, 1, 1024, 4096, 4096, 1024, 1024]
    - [5, 9581.86]
  - - [16, 16, 3840, 64, 16, 16, 64, 64]
    - [37, 1270.49]
  - - [92, 93, 688, 64, 92, 92, 64, 64]
    - [41, 4962.3]
  - - [1024, 3384, 1, 4096, 1024, 1024, 4096, 4096]
    - [16, 8409.29]
  - - [4096, 3387, 1, 1024, 4096, 4096, 1024, 1024]
    - [7, 9379.7]
  - - [4096, 3436, 1, 1024, 4096, 4096, 1024, 1024]
    - [5, 9491.83]
  - - [4096, 3277, 1, 1024, 4096, 4096, 1024, 1024]
    - [5, 9717.17]
  - - [1024, 3457, 1, 4096, 1024, 1024, 4096, 4096]
    - [25, 8279.12]
  - - [1024, 3999, 1, 4096, 1024, 1024, 4096, 4096]
    - [0, 9231.37]
  - - [1024, 4032, 1, 4096, 1024, 1024, 4096, 4096]
    - [9, 9443.52]
  - - [4096, 3541, 1, 1024, 4096, 4096, 1024, 1024]
    - [5, 9773.14]
  - - [4096, 3334, 1, 1024, 4096, 4096, 1024, 1024]
    - [5, 9242.69]
  - - [1024, 3393, 1, 4096, 1024, 1024, 4096, 4096]
    - [27, 8376.07]
  - - [17, 17, 3632, 64, 17, 17, 64, 64]
    - [49, 1425.67]
  - - [1024, 3411, 1, 4096, 1024, 1024, 4096, 4096]
    - [15, 8490.87]
  - - [1024, 3822, 1, 1024, 1024, 1024, 1024, 1024]
    - [12, 8773.34]
  - - [1024, 3593, 1, 4096, 1024, 1024, 4096, 4096]
    - [12, 8571.15]
  - - [33708, 3822, 1, 1024, 33708, 33708, 1024, 1024]
    - [6, 10056.7]
  - - [4096, 3504, 1, 1024, 4096, 4096, 1024, 1024]
    - [8, 9680.19]
  - - [1024, 3163, 1, 4096, 1024, 1024, 4096, 4096]
    - [27, 8014.33]
  - - [1024, 3357, 1, 4096, 1024, 1024, 4096, 4096]
    - [28, 8375.94]
  - - [1024, 3906, 1, 4096, 1024, 1024, 4096, 4096]
    - [9, 9108.12]
  - - [4096, 3415, 1, 1024, 4096, 4096, 1024, 1024]
    - [5, 9443.77]
  - - [1024, 3406, 1, 4096, 1024, 1024, 4096, 4096]
    - [28, 8451.54]
  - - [4096, 3321, 1, 1024, 4096, 4096, 1024, 1024]
    - [7, 9836.52]
  - - [4096, 3584, 1, 1024, 4096, 4096, 1024, 1024]
    - [8, 9915.83]
  - - [1024, 2736, 1, 4096, 1024, 1024, 4096, 4096]
    - [11, 8532.83]
  - - [1024, 3110, 1, 4096, 1024, 1024, 4096, 4096]
    - [28, 7889.19]
  - - [33708, 3999, 1, 1024, 33708, 33708, 1024, 1024]
    - [8, 9903.23]
  - - [1024, 3093, 1, 4096, 1024, 1024, 4096, 4096]
    - [26, 7919.25]
  - - [4096, 3378, 1, 1024, 4096, 4096, 1024, 1024]
    - [8, 9362.2]
  - - [1024, 3543, 1, 4096, 1024, 1024, 4096, 4096]
    - [22, 8438.06]
  - - [33708, 3925, 1, 1024, 33708, 33708, 1024, 1024]
    - [7, 10021.5]
  - - [1024, 3352, 1, 4096, 1024, 1024, 4096, 4096]
    - [28, 8333.72]
  - - [4096, 3780, 1, 1024, 4096, 4096, 1024, 1024]
    - [5, 9754.92]
  - - [1024, 3990, 1, 4096, 1024, 1024, 4096, 4096]
    - [2, 9250.92]
  - - [4096, 3500, 1, 1024, 4096, 4096, 1024, 1024]
    - [5, 9673.73]
  - - [4096, 3996, 1, 1024, 4096, 4096, 1024, 1024]
    - [6, 9694.4]
  - - [1024, 3247, 1, 4096, 1024, 1024, 4096, 4096]
    - [31, 8171.48]
  - - [4096, 3395, 1, 1024, 4096, 4096, 1024, 1024]
    - [7, 9391.94]
  - - [1024, 3169, 1, 4096, 1024, 1024, 4096, 4096]
    - [26, 7990.14]
  - - [1024, 3088, 1, 4096, 1024, 1024, 4096, 4096]
    - [26, 7890.26]
  - - [1024, 3584, 1, 4096, 1024, 1024, 4096, 4096]
    - [28, 8604.1]
  - - [4096, 3093, 1, 1024, 4096, 4096, 1024, 1024]
    - [7, 9224.78]
  - - [1024, 3538, 1, 4096, 1024, 1024, 4096, 4096]
    - [9, 8395.64]
  - - [1024, 3996, 1, 1024, 1024, 1024, 1024, 1024]
    - [10, 9208.23]
  - - [1024, 3581, 1, 4096, 1024, 1024, 4096, 4096]
    - [22, 8523.14]
  - - [4096, 3374, 1, 1024, 4096, 4096, 1024, 1024]
    - [7, 9342.71]
  - - [33708, 3751, 1, 1024, 33708, 33708, 1024, 1024]
    - [7, 9881.89]
  - - [59, 59, 1088, 64, 59, 59, 64, 64]
    - [45, 4515.44]
  - - [4096, 3215, 1, 1024, 4096, 4096, 1024, 1024]
    - [7, 9557.65]
  - - [4096, 3312, 1, 1024, 4096, 4096, 1024, 1024]
    - [5, 9834.3]
  - - [4096, 3581, 1, 1024, 4096, 4096, 1024, 1024]
    - [7, 9856.56]
  - - [4096, 3479, 1, 1024, 4096, 4096, 1024, 1024]
    - [7, 9620.25]
  - - [4096, 3544, 1, 1024, 4096, 4096, 1024, 1024]
    - [5, 9778.84]
  - - [1024, 3870, 1, 1024, 1024, 1024, 1024, 1024]
    - [10, 8935.16]
  - - [1024, 3374, 1, 4096, 1024, 1024, 4096, 4096]
    - [27, 8412.75]
  - - [1024, 2967, 1, 4096, 1024, 1024, 4096, 4096]
    - [10, 8982.87]
  - - [41, 41, 1552, 64, 41, 41, 64, 64]
    - [39, 2805.28]
  - - [4096, 3455, 1, 1024, 4096, 4096, 1024, 1024]
    - [5, 9538.79]
  - - [4096, 3942, 1, 1024, 4096, 4096, 1024, 1024]
    - [6, 9554.55]
  - - [1024, 3528, 1, 4096, 1024, 1024, 4096, 4096]
    - [25, 8438.37]
  - - [4096, 3186, 1, 1024, 4096, 4096, 1024, 1024]
    - [6, 9468.22]
  - - [1024, 3976, 1, 1024, 1024, 1024, 1024, 1024]
    - [10, 9166.98]
  - - [1024, 3511, 1, 4096, 1024, 1024, 4096, 4096]
    - [12, 8334.96]
  - - [4096, 3573, 1, 1024, 4096, 4096, 1024, 1024]
    - [5, 9855.23]
  - - [4096, 3561, 1, 1024, 4096, 4096, 1024, 1024]
    - [5, 9830.93]
  - - [4096, 3418, 1, 1024, 4096, 4096, 1024, 1024]
    - [6, 9450.58]
  - - [33708, 3906, 1, 1024, 33708, 33708, 1024, 1024]
    - [8, 9973.57]
  - - [4096, 3259, 1, 1024, 4096, 4096, 1024, 1024]
    - [5, 9685.16]
  - - [4096, 3308, 1, 1024, 4096, 4096, 1024, 1024]
    - [7, 9791.93]
  - - [1024, 3419, 1, 4096, 1024, 1024, 4096, 4096]
    - [27, 8514.43]
  - - [1024, 3215, 1, 4096, 1024, 1024, 4096, 4096]
    - [26, 8137.43]
  - - [1024, 4030, 1, 4096, 1024, 1024, 4096, 4096]
    - [8, 9290.66]
  - - [4096, 3459, 1, 1024, 4096, 4096, 1024, 1024]
    - [5, 9567.47]
  - - [1024, 3572, 1, 4096, 1024, 1024, 4096, 4096]
    - [25, 8501.33]
  - - [1024, 3137, 1, 4096, 1024, 1024, 4096, 4096]
    - [27, 7930.05]
  - - [1024, 3312, 1, 4096, 1024, 1024, 4096, 4096]
    - [28, 8378.5]
  - - [1024, 3925, 1, 4096, 1024, 1024, 4096, 4096]
    - [10, 9255.76]
  - - [1024, 3453, 1, 4096, 1024, 1024, 4096, 4096]
    - [27, 8630.66]
  - - [4096, 3435, 1, 1024, 4096, 4096, 1024, 1024]
    - [6, 9495.08]
  - - [1024, 3176, 1, 4096, 1024, 1024, 4096, 4096]
    - [27, 8087.13]
  - - [1024, 3444, 1, 4096, 1024, 1024, 4096, 4096]
    - [19, 8528.48]
  - - [4096, 3975, 1, 1024, 4096, 4096, 1024, 1024]
    - [8, 9645.24]
  - - [4096, 3182, 1, 1024, 4096, 4096, 1024, 1024]
    - [7, 9448.3]
  - - [1024, 3475, 1, 4096, 1024, 1024, 4096, 4096]
    - [26, 8404.77]
  - - [9, 9, 6544, 64, 9, 9, 64, 64]
    - [41, 425.754]
  - - [33708, 3955, 1, 1024, 33708, 33708, 1024, 1024]
    - [8, 10088.3]
  - - [4096, 3446, 1, 1024, 4096, 4096, 1024, 1024]
    - [7, 9519.96]
  - - [1024, 3138, 1, 4096, 1024, 1024, 4096, 4096]
    - [26, 8053.34]
  - - [1024, 3549, 1, 4096, 1024, 1024, 4096, 4096]
    - [12, 8426.32]
  - - [4096, 3287, 1, 1024, 4096, 4096, 1024, 1024]
    - [8, 9751.24]
  - - [1024, 3342, 1, 4096, 1024, 1024, 4096, 4096]
    - [25, 8319.91]
  - - [102, 102, 624, 64, 102, 102, 64, 64]
    - [40, 4747.42]
  - - [4096, 3519, 1, 1024, 4096, 4096, 1024, 1024]
    - [7, 9716.0]
  - - [4096, 3552, 1, 1024, 4096, 4096, 1024, 1024]
    - [5, 9806.59]
  - - [4096, 3859, 1, 1024, 4096, 4096, 1024, 1024]
    - [5, 9369.84]
  - - [33708, 3969, 1, 1024, 33708, 33708, 1024, 1024]
    - [5, 9830.29]
  - - [1024, 3369, 1, 4096, 1024, 1024, 4096, 4096]
    - [26, 8379.16]
  - - [4096, 3482, 1, 1024, 4096, 4096, 1024, 1024]
    - [5, 9631.6]
  - - [1024, 3306, 1, 4096, 1024, 1024, 4096, 4096]
    - [28, 8319.96]
  - - [1024, 3474, 1, 4096, 1024, 1024, 4096, 4096]
    - [27, 8498.8]
  - - [99, 99, 624, 64, 99, 99, 64, 64]
    - [39, 4492.8]
  - - [4096, 3377, 1, 1024, 4096, 4096, 1024, 1024]
    - [5, 9369.82]
  - - [4096, 3426, 1, 1024, 4096, 4096, 1024, 1024]
    - [5, 9467.2]
  - - [4096, 2935, 1, 1024, 4096, 4096, 1024, 1024]
    - [6, 9423.64]
  - - [4096, 3267, 1, 1024, 4096, 4096, 1024, 1024]
    - [5, 9697.94]
  - - [1024, 3299, 1, 4096, 1024, 1024, 4096, 4096]
    - [26, 8264.66]
  - - [1024, 3456, 1, 4096, 1024, 1024, 4096, 4096]
    - [25, 8678.29]
  - - [1024, 3280, 1, 4096, 1024, 1024, 4096, 4096]
    - [26, 8220.59]
  - - [1024, 3555, 1, 4096, 1024, 1024, 4096, 4096]
    - [25, 8656.17]
  - - [4096, 3499, 1, 1024, 4096, 4096, 1024, 1024]
    - [7, 9663.83]
  - - [4096, 3356, 1, 1024, 4096, 4096, 1024, 1024]
    - [7, 9296.8]
  - - [100, 102, 624, 64, 100, 100, 64, 64]
    - [40, 4671.41]
  - - [1024, 3412, 1, 4096, 1024, 1024, 4096, 4096]
    - [28, 8537.95]
  - - [1024, 2984, 1, 4096, 1024, 1024, 4096, 4096]
    - [11, 9193.07]
  - - [4096, 3141, 1, 1024, 4096, 4096, 1024, 1024]
    - [7, 9349.33]
  - - [4096, 3510, 1, 1024, 4096, 4096, 1024, 1024]
    - [5, 9701.88]
  - - [1024, 3995, 1, 1024, 1024, 1024, 1024, 1024]
    - [9, 9243.3]
  - - [1024, 3517, 1, 4096, 1024, 1024, 4096, 4096]
    - [27, 8569.21]
  - - [1024, 3455, 1, 4096, 1024, 1024, 4096, 4096]
    - [27, 8560.57]
  - - [1024, 3939, 1, 1024, 1024, 1024, 1024, 1024]
    - [10, 9030.84]
  - - [38, 38, 1680, 64, 38, 38, 64, 64]
    - [39, 2459.74]
  - - [1024, 3447, 1, 4096, 1024, 1024, 4096, 4096]
    - [25, 8609.92]
  - - [1024, 3969, 1, 4096, 1024, 1024, 4096, 4096]
    - [12, 9097.23]
  - - [4096, 3527, 1, 1024, 4096, 4096, 1024, 1024]
    - [7, 9743.73]
  - - [4096, 3336, 1, 1024, 4096, 4096, 1024, 1024]
    - [7, 9248.23]
  - - [1024, 3191, 1, 4096, 1024, 1024, 4096, 4096]
    - [25, 8104.86]
  - - [1024, 3302, 1, 4096, 1024, 1024, 4096, 4096]
    - [26, 8244.99]
  - - [1024, 3337, 1, 4096, 1024, 1024, 4096, 4096]
    - [28, 8254.15]
  - - [4096, 3290, 1, 1024, 4096, 4096, 1024, 1024]
    - [7, 9759.03]
  - - [1024, 3512, 1, 4096, 1024, 1024, 4096, 4096]
    - [16, 8640.96]
  - - [1024, 3433, 1, 4096, 1024, 1024, 4096, 4096]
    - [26, 8444.6]
  - - [4096, 3876, 1, 1024, 4096, 4096, 1024, 1024]
    - [6, 9420.28]
  - - [4096, 3490, 1, 1024, 4096, 4096, 1024, 1024]
    - [7, 9641.01]
  - - [4096, 3064, 1, 1024, 4096, 4096, 1024, 1024]
    - [7, 9820.39]
  - - [1024, 3508, 1, 4096, 1024, 1024, 4096, 4096]
    - [22, 8442.14]
  - - [1024, 3956, 1, 4096, 1024, 1024, 4096, 4096]
    - [7, 9128.09]
  - - [4096, 3417, 1, 1024, 4096, 4096, 1024, 1024]
    - [7, 9448.31]
  - - [1024, 3248, 1, 4096, 1024, 1024, 4096, 4096]
    - [26, 8006.06]
  - - [1024, 2499, 1, 4096, 1024, 1024, 4096, 4096]
    - [26, 8155.09]
  - - [1024, 3186, 1, 4096, 1024, 1024, 4096, 4096]
    - [26, 8092.94]
  - - [1024, 3180, 1, 4096, 1024, 1024, 4096, 4096]
    - [28, 8096.92]
  - - [4096, 3364, 1, 1024, 4096, 4096, 1024, 1024]
    - [7, 9317.98]
  - - [4096, 3976, 1, 1024, 4096, 4096, 1024, 1024]
    - [7, 9654.37]
  - - [4096, 3205, 1, 1024, 4096, 4096, 1024, 1024]
    - [8, 9538.74]
  - - [4096, 3318, 1, 1024, 4096, 4096, 1024, 1024]
    - [5, 9838.19]
  - - [1024, 3377, 1, 4096, 1024, 1024, 4096, 4096]
    - [28, 8445.54]
  - - [1024, 3485, 1, 4096, 1024, 1024, 4096, 4096]
    - [25, 8368.73]
  - - [4096, 3181, 1, 1024, 4096, 4096, 1024, 1024]
    - [8, 9458.19]
  - - [4096, 3550, 1, 1024, 4096, 4096, 1024, 1024]
    - [5, 9783.04]
  - - [1024, 3534, 1, 4096, 1024, 1024, 4096, 4096]
    - [14, 8684.89]
  - - [1024, 3860, 1, 1024, 1024, 1024, 1024, 1024]
    - [9, 8923.08]
  - - [160, 160, 400, 64, 160, 160, 64, 64]
    - [52, 5797.59]
  - - [4096, 3445, 1, 1024, 4096, 4096, 1024, 1024]
    - [7, 9511.18]
  - - [1024, 3391, 1, 4096, 1024, 1024, 4096, 4096]
    - [28, 8541.67]
  - - [1024, 3221, 1, 4096, 1024, 1024, 4096, 4096]
    - [26, 8055.4]
  - - [4096, 3079, 1, 1024, 4096, 4096, 1024, 1024]
    - [5, 9180.94]
  - - [4096, 3144, 1, 1024, 4096, 4096, 1024, 1024]
    - [7, 9351.35]
  - - [1024, 3270, 1, 4096, 1024, 1024, 4096, 4096]
    - [27, 8367.53]
  - - [1024, 3561, 1, 4096, 1024, 1024, 4096, 4096]
    - [27, 8426.19]
  - - [1024, 3480, 1, 4096, 1024, 1024, 4096, 4096]
    - [14, 8464.9]
  - - [4096, 3408, 1, 1024, 4096, 4096, 1024, 1024]
    - [7, 9419.94]
  - - [1024, 3418, 1, 4096, 1024, 1024, 4096, 4096]
    - [28, 8480.92]
  - - [4096, 3298, 1, 1024, 4096, 4096, 1024, 1024]
    - [8, 9788.3]
  - - [1024, 3640, 1, 1024, 1024, 1024, 1024, 1024]
    - [11, 8435.34]
  - - [1024, 3449, 1, 4096, 1024, 1024, 4096, 4096]
    - [26, 8590.77]
  - - [1024, 4020, 1, 4096, 1024, 1024, 4096, 4096]
    - [4, 9168.03]
  - - [4096, 3481, 1, 1024, 4096, 4096, 1024, 1024]
    - [5, 9627.81]
  - - [4096, 3530, 1, 1024, 4096, 4096, 1024, 1024]
    - [7, 9734.58]
  - - [1024, 3216, 1, 4096, 1024, 1024, 4096, 4096]
    - [28, 8014.22]
  - - [1024, 3840, 1, 1024, 1024, 1024, 1024, 1024]
    - [11, 8908.27]
  - - [1024, 3491, 1, 4096, 1024, 1024, 4096, 4096]
    - [14, 8410.49]
  - - [1024, 3154, 1, 4096, 1024, 1024, 4096, 4096]
    - [27, 8095.59]
  - - [4096, 3425, 1, 1024, 4096, 4096, 1024, 1024]
    - [7, 9474.43]
  - - [1024, 3348, 1, 4096, 1024, 1024, 4096, 4096]
    - [25, 8202.8]
  - - [1024, 3415, 1, 4096, 1024, 1024, 4096, 4096]
    - [26, 8597.58]
  - - [1024, 4026, 1, 1024, 1024, 1024, 1024, 1024]
    - [9, 9278.99]
  - - [1024, 3367, 1, 4096, 1024, 1024, 4096, 4096]
    - [28, 8335.44]
  - - [1024, 3259, 1, 4096, 1024, 1024, 4096, 4096]
    - [28, 8285.2]
  - - [1024, 3894, 1, 4096, 1024, 1024, 4096, 4096]
    - [11, 9040.34]
  - - [4096, 3355, 1, 1024, 4096, 4096, 1024, 1024]
    - [6, 9291.57]
  - - [4096, 3404, 1, 1024, 4096, 4096, 1024, 1024]
    - [7, 9410.37]
  - - [1024, 3308, 1, 4096, 1024, 1024, 4096, 4096]
    - [28, 8336.2]
  - - [4096, 3245, 1, 1024, 4096, 4096, 1024, 1024]
    - [6, 9641.37]
  - - [1024, 3502, 1, 4096, 1024, 1024, 4096, 4096]
    - [27, 8375.8]
  - - [33708, 4032, 1, 1024, 33708, 33708, 1024, 1024]
    - [6, 9988.1]
  - - [8, 8, 7280, 64, 8, 8, 64, 64]
    - [43, 339.778]
  - - [1024, 3424, 1, 4096, 1024, 1024, 4096, 4096]
    - [14, 8489.38]
  - - [4096, 3509, 1, 1024, 4096, 4096, 1024, 1024]
    - [6, 9702.19]
  - - [4096, 3558, 1, 1024, 4096, 4096, 1024, 1024]
    - [7, 9815.41]
  - - [1024, 3900, 1, 1024, 1024, 1024, 1024, 1024]
    - [10, 9013.95]
  - - [1024, 2505, 1, 4096, 1024, 1024, 4096, 4096]
    - [24, 8263.65]
  - - [4096, 3472, 1, 1024, 4096, 4096, 1024, 1024]
    - [5, 9609.51]
  - - [1024, 3386, 1, 4096, 1024, 1024, 4096, 4096]
    - [25, 8417.45]
  - - [4096, 3383, 1, 1024, 4096, 4096, 1024, 1024]
    - [7, 9364.67]
  - - [4096, 3448, 1, 1024, 4096, 4096, 1024, 1024]
    - [8, 9520.97]
  - - [4096, 4030, 1, 1024, 4096, 4096, 1024, 1024]
    - [8, 9771.46]
  - - [4096, 3289, 1, 1024, 4096, 4096, 1024, 1024]
    - [5, 9757.17]
  - - [1024, 3459, 1, 4096, 1024, 1024, 4096, 4096]
    - [27, 8422.02]
  - - [1024, 2918, 1, 4096, 1024, 1024, 4096, 4096]
    - [12, 9022.61]
  - - [4096, 3489, 1, 1024, 4096, 4096, 1024, 1024]
    - [5, 9641.8]
  - - [4096, 3346, 1, 1024, 4096, 4096, 1024, 1024]
    - [7, 9271.55]
  - - [4096, 3572, 1, 1024, 4096, 4096, 1024, 1024]
    - [7, 9829.72]
  - - [1024, 3955, 1, 4096, 1024, 1024, 4096, 4096]
    - [8, 9221.56]
  - - [4096, 3236, 1, 1024, 4096, 4096, 1024, 1024]
    - [5, 9620.62]
  - - [4096, 3163, 1, 1024, 4096, 4096, 1024, 1024]
    - [5, 9397.2]
  - - [4096, 3468, 1, 1024, 4096, 4096, 1024, 1024]
    - [5, 9601.48]
  - - [1024, 3165, 1, 4096, 1024, 1024, 4096, 4096]
    - [27, 7941.48]
  - - [1024, 3276, 1, 4096, 1024, 1024, 4096, 4096]
    - [27, 8244.86]
  - - [1024, 3359, 1, 4096, 1024, 1024, 4096, 4096]
    - [25, 8273.83]
  - - [4096, 3363, 1, 1024, 4096, 4096, 1024, 1024]
    - [7, 9315.7]
  - - [1024, 3385, 1, 4096, 1024, 1024, 4096, 4096]
    - [19, 8286.1]
  - - [1024, 3207, 1, 4096, 1024, 1024, 4096, 4096]
    - [28, 8143.92]
  - - [1024, 3458, 1, 4096, 1024, 1024, 4096, 4096]
    - [27, 8472.31]
  - - [21, 21, 2976, 64, 21, 21, 64, 64]
    - [43, 2083.2]
  - - [4096, 3110, 1, 1024, 4096, 4096, 1024, 1024]
    - [5, 9260.2]
  - - [4096, 3925, 1, 1024, 4096, 4096, 1024, 1024]
    - [8, 9526.56]
  - - [1024, 3975, 1, 4096, 1024, 1024, 4096, 4096]
    - [3, 9133.74]
  - - [4096, 3549, 1, 1024, 4096, 4096, 1024, 1024]
    - [7, 9793.67]
  - - [4096, 3342, 1, 1024, 4096, 4096, 1024, 1024]
    - [6, 9264.38]
  - - [1024, 3859, 1, 1024, 1024, 1024, 1024, 1024]
    - [9, 8933.37]
  - - [1024, 3497, 1, 4096, 1024, 1024, 4096, 4096]
    - [26, 8526.03]
  - - [4096, 3280, 1, 1024, 4096, 4096, 1024, 1024]
    - [7, 9733.22]
  - - [1024, 3435, 1, 4096, 1024, 1024, 4096, 4096]
    - [26, 8489.75]
  - - [1024, 3354, 1, 4096, 1024, 1024, 4096, 4096]
    - [26, 8248.73]
  - - [4096, 3191, 1, 1024, 4096, 4096, 1024, 1024]
    - [6, 9475.02]
  - - [4096, 3512, 1, 1024, 4096, 4096, 1024, 1024]
    - [5, 9701.27]
  - - [1024, 3055, 1, 4096, 1024, 1024, 4096, 4096]
    - [12, 9264.81]
  - - [4096, 2499, 1, 1024, 4096, 4096, 1024, 1024]
    - [7, 9573.96]
  - - [1024, 3233, 1, 4096, 1024, 1024, 4096, 4096]
    - [25, 8101.64]
  - - [4096, 3423, 1, 1024, 4096, 4096, 1024, 1024]
    - [8, 9463.4]
  - - [1024, 3319, 1, 4096, 1024, 1024, 4096, 4096]
    - [28, 8413.66]
  - - [4096, 3297, 1, 1024, 4096, 4096, 1024, 1024]
    - [5, 9782.56]
  - - [4096, 3154, 1, 1024, 4096, 4096, 1024, 1024]
    - [7, 9381.1]
  - - [1024, 3540, 1, 4096, 1024, 1024, 4096, 4096]
    - [28, 8507.43]
  - - [1024, 3289, 1, 4096, 1024, 1024, 4096, 4096]
    - [28, 8233.7]
  - - [4096, 3529, 1, 1024, 4096, 4096, 1024, 1024]
    - [7, 9741.05]
  - - [4096, 3386, 1, 1024, 4096, 4096, 1024, 1024]
    - [7, 9372.47]
  - - [4096, 3276, 1, 1024, 4096, 4096, 1024, 1024]
    - [5, 9713.66]
  - - [1024, 3244, 1, 4096, 1024, 1024, 4096, 4096]
    - [28, 8146.73]
  - - [1024, 3182, 1, 4096, 1024, 1024, 4096, 4096]
    - [25, 8115.02]
  - - [4096, 3540, 1, 1024, 4096, 4096, 1024, 1024]
    - [5, 9768.32]
  - - [1024, 3360, 1, 4096, 1024, 1024, 4096, 4096]
    - [27, 8353.21]
  - - [1024, 3942, 1, 4096, 1024, 1024, 4096, 4096]
    - [6, 9143.68]
  - - [4096, 3403, 1, 1024, 4096, 4096, 1024, 1024]
    - [8, 9412.08]
  - - [4096, 3101, 1, 1024, 4096, 4096, 1024, 1024]
    - [8, 9239.18]
  - - [4096, 2918, 1, 1024, 4096, 4096, 1024, 1024]
    - [7, 9373.65]
  - - [1024, 3465, 1, 4096, 1024, 1024, 4096, 4096]
    - [28, 8288.06]
  - - [33708, 3780, 1, 1024, 33708, 33708, 1024, 1024]
    - [7, 9971.81]
  - - [4096, 3557, 1, 1024, 4096, 4096, 1024, 1024]
    - [5, 9814.72]
  - - [4096, 3414, 1, 1024, 4096, 4096, 1024, 1024]
    - [5, 9436.53]
  - - [1024, 3948, 1, 1024, 1024, 1024, 1024, 1024]
    - [9, 9073.7]
  - - [4096, 3320, 1, 1024, 4096, 4096, 1024, 1024]
    - [7, 9834.67]
  - - [4096, 2765, 1, 1024, 4096, 4096, 1024, 1024]
    - [7, 9666.96]
  - - [1024, 3978, 1, 4096, 1024, 1024, 4096, 4096]
    - [2, 9109.5]
  - - [4096, 3487, 1, 1024, 4096, 4096, 1024, 1024]
    - [5, 9643.9]
  - - [4096, 3520, 1, 1024, 4096, 4096, 1024, 1024]
    - [7, 9727.98]
  - - [1024, 3139, 1, 4096, 1024, 1024, 4096, 4096]
    - [27, 7940.09]
  - - [1024, 3314, 1, 4096, 1024, 1024, 4096, 4096]
    - [25, 8293.91]
  - - [4096, 3431, 1, 1024, 4096, 4096, 1024, 1024]
    - [7, 9482.02]
  - - [123, 122, 528, 64, 123, 123, 64, 64]
    - [40, 6325.88]
  - - [1024, 3446, 1, 4096, 1024, 1024, 4096, 4096]
    - [21, 8468.24]
  - - [1024, 4059, 1, 4096, 1024, 1024, 4096, 4096]
    - [8, 9370.7]
  - - [99, 102, 624, 64, 99, 99, 64, 64]
    - [40, 4624.7]
  - - [4096, 3345, 1, 1024, 4096, 4096, 1024, 1024]
    - [5, 9271.22]
  - - [4096, 3394, 1, 1024, 4096, 4096, 1024, 1024]
    - [5, 9398.09]
  - - [1024, 3927, 1, 1024, 1024, 1024, 1024, 1024]
    - [10, 9041.28]
  - - [4096, 3235, 1, 1024, 4096, 4096, 1024, 1024]
    - [5, 9619.83]
  - - [1024, 3328, 1, 4096, 1024, 1024, 4096, 4096]
    - [26, 8405.99]
  - - [33708, 3956, 1, 1024, 33708, 33708, 1024, 1024]
    - [6, 10100.3]
  - - [4096, 3467, 1, 1024, 4096, 4096, 1024, 1024]
    - [7, 9586.56]
  - - [1024, 3287, 1, 4096, 1024, 1024, 4096, 4096]
    - [27, 8273.73]
  - - [4096, 3214, 1, 1024, 4096, 4096, 1024, 1024]
    - [8, 9557.39]
  - - [4096, 3910, 1, 1024, 4096, 4096, 1024, 1024]
    - [5, 9490.15]
  - - [1024, 3780, 1, 1024, 1024, 1024, 1024, 1024]
    - [12, 8705.9]
  - - [1024, 3371, 1, 4096, 1024, 1024, 4096, 4096]
    - [28, 8248.36]
  - - [4096, 3478, 1, 1024, 4096, 4096, 1024, 1024]
    - [8, 9619.52]
  - - [1024, 3546, 1, 4096, 1024, 1024, 4096, 4096]
    - [26, 8456.73]
  - - [1024, 4012, 1, 1024, 1024, 1024, 1024, 1024]
    - [9, 9253.24]
  - - [4096, 3341, 1, 1024, 4096, 4096, 1024, 1024]
    - [7, 9260.14]
  - - [4096, 3454, 1, 1024, 4096, 4096, 1024, 1024]
    - [5, 9533.52]
  - - [4096, 3295, 1, 1024, 4096, 4096, 1024, 1024]
    - [8, 9772.76]
  - - [4096, 3072, 1, 1024, 4096, 4096, 1024, 1024]
    - [5, 9887.13]
  - - [1024, 3282, 1, 4096, 1024, 1024, 4096, 4096]
    - [13, 8112.75]
  - - [33708, 3720, 1, 1024, 33708, 33708, 1024, 1024]
    - [8, 9818.75]
  - - [1024, 3681, 1, 4096, 1024, 1024, 4096, 4096]
    - [10, 8639.18]
  - - [1024, 4050, 1, 4096, 1024, 1024, 4096, 4096]
    - [8, 9291.83]
  - - [4096, 3495, 1, 1024, 4096, 4096, 1024, 1024]
    - [7, 9660.42]
  - - [4096, 3560, 1, 1024, 4096, 4096, 1024, 1024]
    - [6, 9813.7]
  - - [4096, 3751, 1, 1024, 4096, 4096, 1024, 1024]
    - [5, 9684.85]
  - - [1024, 3414, 1, 4096, 1024, 1024, 4096, 4096]
    - [26, 8555.62]
  - - [33708, 3860, 1, 1024, 33708, 33708, 1024, 1024]
    - [5, 9856.58]
  - - [1024, 3325, 1, 4096, 1024, 1024, 4096, 4096]
    - [15, 8261.11]
  - - [4096, 3458, 1, 1024, 4096, 4096, 1024, 1024]
    - [5, 9570.76]
  - - [4096, 2967, 1, 1024, 4096, 4096, 1024, 1024]
    - [5, 9544.51]
  - - [1024, 3519, 1, 4096, 1024, 1024, 4096, 4096]
    - [28, 8413.0]
  - - [4096, 3385, 1, 1024, 4096, 4096, 1024, 1024]
    - [7, 9367.24]
  - - [4096, 3434, 1, 1024, 4096, 4096, 1024, 1024]
    - [5, 9488.31]
  - - [1024, 3552, 1, 4096, 1024, 1024, 4096, 4096]
    - [26, 8456.03]
  - - [4096, 3822, 1, 1024, 4096, 4096, 1024, 1024]
    - [6, 9849.74]
  - - [1024, 3544, 1, 4096, 1024, 1024, 4096, 4096]
    - [25, 8494.46]
  - - [4096, 3539, 1, 1024, 4096, 4096, 1024, 1024]
    - [7, 9762.99]
  - - [4096, 3332, 1, 1024, 4096, 4096, 1024, 1024]
    - [5, 9232.26]
  - - [1024, 3145, 1, 4096, 1024, 1024, 4096, 4096]
    - [25, 8098.26]
  - - [1024, 3535, 1, 4096, 1024, 1024, 4096, 4096]
    - [13, 8592.7]
  - - [1024, 3320, 1, 4096, 1024, 1024, 4096, 4096]
    - [26, 8419.45]
  - - [33708, 4012, 1, 1024, 33708, 33708, 1024, 1024]
    - [8, 9940.1]
  - - [4096, 3286, 1, 1024, 4096, 4096, 1024, 1024]
    - [7, 9747.72]
  - - [1024, 3514, 1, 4096, 1024, 1024, 4096, 4096]
    - [26, 8653.59]
  - - [93, 93, 688, 64, 93, 93, 64, 64]
    - [47, 5005.69]
  - - [1024, 2765, 1, 4096, 1024, 1024, 4096, 4096]
    - [12, 8636.62]
  - - [1024, 3452, 1, 4096, 1024, 1024, 4096, 4096]
    - [25, 8445.77]
  - - [4096, 3518, 1, 1024, 4096, 4096, 1024, 1024]
    - [5, 9722.46]
  - - [1024, 3529, 1, 4096, 1024, 1024, 4096, 4096]
    - [25, 8444.22]
  - - [4096, 3413, 1, 1024, 4096, 4096, 1024, 1024]
    - [5, 9436.25]
  - - [33708, 4050, 1, 1024, 33708, 33708, 1024, 1024]
    - [7, 10026.6]
  - - [1024, 3525, 1, 4096, 1024, 1024, 4096, 4096]
    - [18, 8488.89]
  - - [4096, 3303, 1, 1024, 4096, 4096, 1024, 1024]
    - [5, 9790.95]
  - - [1024, 3382, 1, 4096, 1024, 1024, 4096, 4096]
    - [26, 8483.53]
  - - [1024, 3390, 1, 4096, 1024, 1024, 4096, 4096]
    - [25, 8552.71]
  - - [1024, 3977, 1, 4096, 1024, 1024, 4096, 4096]
    - [7, 9053.43]
  - - [1024, 3184, 1, 4096, 1024, 1024, 4096, 4096]
    - [25, 8008.71]
  - - [4096, 3535, 1, 1024, 4096, 4096, 1024, 1024]
    - [7, 9760.69]
  - - [4096, 3376, 1, 1024, 4096, 4096, 1024, 1024]
    - [8, 9341.83]
  - - [4096, 3978, 1, 1024, 4096, 4096, 1024, 1024]
    - [8, 9642.7]
  - - [1024, 3136, 1, 4096, 1024, 1024, 4096, 4096]
    - [27, 8085.02]
  - - [1024, 3293, 1, 4096, 1024, 1024, 4096, 4096]
    - [25, 8300.39]
  - - [4096, 3266, 1, 1024, 4096, 4096, 1024, 1024]
    - [6, 9691.68]
  - - [1024, 3487, 1, 4096, 1024, 1024, 4096, 4096]
    - [25, 8383.52]
  - - [1024, 3409, 1, 4096, 1024, 1024, 4096, 4096]
    - [27, 8493.15]
  - - [4096, 3498, 1, 1024, 4096, 4096, 1024, 1024]
    - [6, 9672.28]
  - - [1024, 3520, 1, 4096, 1024, 1024, 4096, 4096]
    - [28, 8488.16]
  - - [1024, 3530, 1, 4096, 1024, 1024, 4096, 4096]
    - [9, 8409.77]
  - - [4096, 3393, 1, 1024, 4096, 4096, 1024, 1024]
    - [7, 9395.33]
  - - [4096, 3140, 1, 1024, 4096, 4096, 1024, 1024]
    - [7, 9338.4]
  - - [1024, 3536, 1, 4096, 1024, 1024, 4096, 4096]
    - [28, 8642.01]
  - - [1024, 3288, 1, 4096, 1024, 1024, 4096, 4096]
    - [28, 8229.24]
  - - [1024, 4005, 1, 4096, 1024, 1024, 4096, 4096]
    - [10, 9270.94]
  - - [1024, 3579, 1, 4096, 1024, 1024, 4096, 4096]
    - [14, 8844.4]
  - - [4096, 3372, 1, 1024, 4096, 4096, 1024, 1024]
    - [5, 9339.15]
  - - [1024, 3440, 1, 4096, 1024, 1024, 4096, 4096]
    - [25, 8466.59]
  - - [4096, 3213, 1, 1024, 4096, 4096, 1024, 1024]
    - [8, 9558.75]
  - - [123, 123, 528, 64, 123, 123, 64, 64]
    - [40, 6333.49]
  - - [100, 100, 624, 64, 100, 100, 64, 64]
    - [39, 4584.02]
  - - [1024, 3968, 1, 4096, 1024, 1024, 4096, 4096]
    - [6, 9237.5]
  - - [4096, 3477, 1, 1024, 4096, 4096, 1024, 1024]
    - [6, 9618.78]
  - - [4096, 3526, 1, 1024, 4096, 4096, 1024, 1024]
    - [5, 9735.84]
  - - [1024, 3493, 1, 4096, 1024, 1024, 4096, 4096]
    - [26, 8355.03]
  - - [1024, 3944, 1, 4096, 1024, 1024, 4096, 4096]
    - [1, 9065.29]
  - - [4096, 3453, 1, 1024, 4096, 4096, 1024, 1024]
    - [6, 9533.27]
  - - [1024, 3350, 1, 4096, 1024, 1024, 4096, 4096]
    - [28, 8448.54]
  - - [4096, 3184, 1, 1024, 4096, 4096, 1024, 1024]
    - [7, 9447.28]
  - - [1024, 3423, 1, 4096, 1024, 1024, 4096, 4096]
    - [26, 8465.28]
  - - [4096, 3351, 1, 1024, 4096, 4096, 1024, 1024]
    - [5, 9281.96]
  - - [4096, 3416, 1, 1024, 4096, 4096, 1024, 1024]
    - [5, 9446.54]
  - - [1024, 3796, 1, 4096, 1024, 1024, 4096, 4096]
    - [7, 8820.24]
  - - [4096, 3257, 1, 1024, 4096, 4096, 1024, 1024]
    - [5, 9671.54]
  - - [4096, 3306, 1, 1024, 4096, 4096, 1024, 1024]
    - [7, 9795.41]
  - - [33708, 4020, 1, 1024, 33708, 33708, 1024, 1024]
    - [7, 9961.75]
  - - [19, 19, 3264, 64, 19, 19, 64, 64]
    - [37, 1735.99]
  - - [1024, 3426, 1, 4096, 1024, 1024, 4096, 4096]
    - [25, 8518.51]
  - - [4096, 3457, 1, 1024, 4096, 4096, 1024, 1024]
    - [5, 9564.46]
  - - [1024, 2935, 1, 4096, 1024, 1024, 4096, 4096]
    - [10, 9067.69]
  - - [1024, 3046, 1, 4096, 1024, 1024, 4096, 4096]
    - [10, 9242.87]
  - - [4096, 3433, 1, 1024, 4096, 4096, 1024, 1024]
    - [7, 9495.55]
  - - [1024, 3256, 1, 4096, 1024, 1024, 4096, 4096]
    - [28, 8224.13]
  - - [1024, 3531, 1, 4096, 1024, 1024, 4096, 4096]
    - [25, 8524.09]
  - - [4096, 3180, 1, 1024, 4096, 4096, 1024, 1024]
    - [5, 9443.43]
  - - [1024, 3388, 1, 4096, 1024, 1024, 4096, 4096]
    - [27, 8352.72]
  - - [4096, 3444, 1, 1024, 4096, 4096, 1024, 1024]
    - [8, 9510.93]
  - - [1024, 3501, 1, 4096, 1024, 1024, 4096, 4096]
    - [15, 8461.02]
  - - [1024, 3266, 1, 4096, 1024, 1024, 4096, 4096]
    - [13, 8147.34]
  - - [1024, 3267, 1, 4096, 1024, 1024, 4096, 4096]
    - [28, 8391.39]
  - - [1024, 3461, 1, 4096, 1024, 1024, 4096, 4096]
    - [12, 8270.19]
  - - [4096, 3870, 1, 1024, 4096, 4096, 1024, 1024]
    - [7, 9399.59]
  - - [4096, 3517, 1, 1024, 4096, 4096, 1024, 1024]
    - [5, 9725.33]
  - - [1024, 3566, 1, 4096, 1024, 1024, 4096, 4096]
    - [28, 8669.66]
  - - [4096, 3574, 1, 1024, 4096, 4096, 1024, 1024]
    - [5, 9844.53]
  - - [1024, 3876, 1, 1024, 1024, 1024, 1024, 1024]
    - [10, 8961.64]
  - - [25, 25, 2512, 64, 25, 25, 64, 64]
    - [36, 2472.44]
  - - [4096, 3720, 1, 1024, 4096, 4096, 1024, 1024]
    - [5, 9612.39]
  - - [4096, 3248, 1, 1024, 4096, 4096, 1024, 1024]
    - [7, 9644.82]
  - - [4096, 4059, 1, 1024, 4096, 4096, 1024, 1024]
    - [5, 9826.32]
  - - [1024, 3380, 1, 4096, 1024, 1024, 4096, 4096]
    - [26, 8677.81]
  - - [4096, 3480, 1, 1024, 4096, 4096, 1024, 1024]
    - [7, 9626.06]
  - - [1024, 3335, 1, 4096, 1024, 1024, 4096, 4096]
    - [27, 8302.08]
  - - [1024, 3345, 1, 4096, 1024, 1024, 4096, 4096]
    - [27, 8323.03]
  - - [4096, 3391, 1, 1024, 4096, 4096, 1024, 1024]
    - [5, 9379.38]
  - - [4096, 3424, 1, 1024, 4096, 4096, 1024, 1024]
    - [7, 9466.67]
  - - [1024, 3394, 1, 4096, 1024, 1024, 4096, 4096]
    - [13, 8373.81]
  - - [4096, 3265, 1, 1024, 4096, 4096, 1024, 1024]
    - [7, 9700.79]
  - - [1024, 3014, 1, 4096, 1024, 1024, 4096, 4096]
    - [10, 9302.99]
  - - [4096, 3497, 1, 1024, 4096, 4096, 1024, 1024]
    - [5, 9668.5]
  - - [4096, 3354, 1, 1024, 4096, 4096, 1024, 1024]
    - [7, 9294.21]
  - - [4096, 3055, 1, 1024, 4096, 4096, 1024, 1024]
    - [6, 9780.78]
  - - [1024, 3499, 1, 4096, 1024, 1024, 4096, 4096]
    - [19, 8526.94]
  - - [1024, 3162, 1, 4096, 1024, 1024, 4096, 4096]
    - [27, 8058.92]
  - - [4096, 3244, 1, 1024, 4096, 4096, 1024, 1024]
    - [7, 9636.76]
  - - [1024, 3437, 1, 4096, 1024, 1024, 4096, 4096]
    - [26, 8583.31]
  - - [1024, 3356, 1, 4096, 1024, 1024, 4096, 4096]
    - [28, 8296.85]
  - - [4096, 3139, 1, 1024, 4096, 4096, 1024, 1024]
    - [7, 9338.6]
  - - [4096, 3508, 1, 1024, 4096, 4096, 1024, 1024]
    - [7, 9700.44]
  - - [1024, 3235, 1, 4096, 1024, 1024, 4096, 4096]
    - [25, 8314.49]
  - - [1024, 3910, 1, 4096, 1024, 1024, 4096, 4096]
    - [12, 9200.11]
  - - [4096, 3371, 1, 1024, 4096, 4096, 1024, 1024]
    - [5, 9336.87]
  - - [1024, 3751, 1, 4096, 1024, 1024, 4096, 4096]
    - [12, 8827.57]
  - - [4096, 3325, 1, 1024, 4096, 4096, 1024, 1024]
    - [5, 9845.58]
  - - [1024, 3413, 1, 4096, 1024, 1024, 4096, 4096]
    - [13, 8345.68]
  - - [1024, 3542, 1, 4096, 1024, 1024, 4096, 4096]
    - [25, 8521.61]
  - - [18, 18, 3440, 64, 18, 18, 64, 64]
    - [41, 1578.14]
  - - [101, 102, 624, 64, 101, 101, 64, 64]
    - [39, 4705.18]
  - - [33708, 3900, 1, 1024, 33708, 33708, 1024, 1024]
    - [5, 9950.95]
  - - [4096, 3525, 1, 1024, 4096, 4096, 1024, 1024]
    - [6, 9744.37]
  - - [4096, 3382, 1, 1024, 4096, 4096, 1024, 1024]
    - [6, 9358.93]
  - - [102, 100, 624, 64, 102, 102, 64, 64]
    - [40, 4671.41]
  - - [15, 15, 4096, 64, 15, 15, 64, 64]
    - [44, 1129.07]
  - - [1024, 3339, 1, 4096, 1024, 1024, 4096, 4096]
    - [14, 8326.27]
  - - [4096, 3288, 1, 1024, 4096, 4096, 1024, 1024]
    - [7, 9761.38]
  - - [92, 92, 688, 64, 92, 92, 64, 64]
    - [47, 4903.77]
  - - [1024, 3141, 1, 4096, 1024, 1024, 4096, 4096]
    - [25, 7975.54]
  - - [1024, 3168, 1, 4096, 1024, 1024, 4096, 4096]
    - [25, 8083.64]
  - - [4096, 3488, 1, 1024, 4096, 4096, 1024, 1024]
    - [7, 9646.67]
  - - [4096, 3046, 1, 1024, 4096, 4096, 1024, 1024]
    - [6, 9767.48]
  - - [1024, 3362, 1, 4096, 1024, 1024, 4096, 4096]
    - [28, 8458.05]
  - - [33708, 3942, 1, 1024, 33708, 33708, 1024, 1024]
    - [6, 10060.3]
  - - [4096, 3399, 1, 1024, 4096, 4096, 1024, 1024]
    - [7, 9406.47]
  - - [1024, 3720, 1, 1024, 1024, 1024, 1024, 1024]
    - [9, 8639.06]
  - - [4096, 3563, 1, 1024, 4096, 4096, 1024, 1024]
    - [5, 9836.45]
  - - [1024, 3273, 1, 4096, 1024, 1024, 4096, 4096]
    - [28, 8221.52]
  - - [4096, 3162, 1, 1024, 4096, 4096, 1024, 1024]
    - [7, 9400.09]
  - - [1024, 3467, 1, 4096, 1024, 1024, 4096, 4096]
    - [26, 8342.32]
  - - [1024, 3130, 1, 4096, 1024, 1024, 4096, 4096]
    - [27, 7933.78]
  - - [1024, 3405, 1, 4096, 1024, 1024, 4096, 4096]
    - [34, 8406.49]
  - - [4096, 3362, 1, 1024, 4096, 4096, 1024, 1024]
    - [5, 9311.94]
  - - [1024, 3960, 1, 1024, 1024, 1024, 1024, 1024]
    - [9, 9082.16]
- null
