Tensile/Configs/miopen/archives/bert/2020-05-27/exact/vega20_Cijk_Ailk_Bjlk_SB.yaml
- {MinimumRequiredVersion: 4.19.0}
- vega20
- gfx906
- [Device 66a0, Device 66a1, Device 66a7, Device 66af, Vega 20]
- - - [1024, 7168, 6, 1024, 1024, 1024, 7168, 7168]
    - [2, 12404.9]
  - - [4096, 7168, 6, 1024, 4096, 4096, 7168, 7168]
    - [2, 12703.6]
  - - [1024, 7168, 6, 4096, 4096, 4096, 7168, 7168]
    - [0, 12572.1]
  - - [1024, 14, 6, 128, 1024, 1024, 1024, 14]
    - [3, 1563.93]
  - - [1024, 14, 6, 1024, 1024, 1024, 1024, 14]
    - [5, 3219.31]
  - - [1024, 7168, 12, 1024, 1024, 1024, 7168, 7168]
    - [1, 12700.4]
  - - [4096, 7168, 12, 1024, 4096, 4096, 7168, 7168]
    - [1, 12761.0]
  - - [1024, 7168, 12, 4096, 4096, 4096, 7168, 7168]
    - [1, 12865.2]
  - - [1024, 14, 12, 128, 1024, 1024, 1024, 14]
    - [4, 2457.6]
  - - [1024, 14, 12, 1024, 1024, 1024, 1024, 14]
    - [3, 4626.07]
- null
