Tensile/Configs/miopen/archives/bert/2020-05-27/exact/vega20_Cijk_Alik_Bljk_SB.yaml
- {MinimumRequiredVersion: 4.19.0}
- vega20
- gfx906
- [Device 66a0, Device 66a1, Device 66a7, Device 66af, Vega 20]
- - - [1024, 1024, 6, 7168, 7168, 7168, 7168, 7168]
    - [3, 11339.9]
  - - [1024, 4096, 6, 7168, 7168, 7168, 7168, 7168]
    - [4, 12708.4]
  - - [4096, 1024, 6, 7168, 7168, 7168, 7168, 7168]
    - [5, 12706.2]
  - - [1024, 1024, 6, 14, 1024, 1024, 1024, 1024]
    - [5, 1770.1]
  - - [128, 1024, 6, 14, 128, 128, 128, 128]
    - [1, 1938.39]
  - - [1024, 2, 6, 7168, 7168, 7168, 7168, 7168]
    - [0, 0.0]
  - - [1024, 1024, 12, 7168, 7168, 7168, 7168, 7168]
    - [5, 11794.8]
  - - [1024, 4096, 12, 7168, 7168, 7168, 7168, 7168]
    - [5, 12713.7]
  - - [4096, 1024, 12, 7168, 7168, 7168, 7168, 7168]
    - [5, 12723.8]
  - - [1024, 1024, 12, 14, 1024, 1024, 1024, 1024]
    - [6, 1875.65]
  - - [128, 1024, 12, 14, 128, 128, 128, 128]
    - [2, 2274.8]
  - - [1024, 2, 12, 7168, 7168, 7168, 7168, 7168]
    - [0, 0.0]
- null
