test_dir/py38/lib/python3.6/site-packages/Tensile/Configs/miopen/archives/bert/2020-01-07/exact/vega20_Cijk_Ailk_Bljk_SB.yaml
- {MinimumRequiredVersion: 4.14.0}
- vega20
- gfx906
- [Device 66a0, Device 66a1, Device 66a7, Vega 20]
    SolutionIndex: 0
    SolutionNameMin: Cijk_Ailk_Bljk_SB_MT64x64x8_SE_DTL0_EPS0_FL0_GRVW1_LPB0_PGR0_PLR0_TT4_4_USFGRO1_VW2_WG16_16_1_WGM1
    SolutionIndex: 1
    SolutionNameMin: Cijk_Ailk_Bljk_SB_MT64x64x16_SE_DTL0_EPS1_FL1_GRVW4_LPB0_PGR1_PLR1_TT4_4_USFGRO0_VW4_WG16_16_1_WGM1
    SolutionIndex: 2
    SolutionNameMin: Cijk_Ailk_Bljk_SB_MT96x64x8_SE_DTL0_EPS1_FL1_GRVW2_LPB0_PGR1_PLR1_TT6_4_USFGRO0_VW2_WG16_16_1_WGM1
    SolutionIndex: 3
    SolutionNameMin: Cijk_Ailk_Bljk_SB_MT96x64x8_SE_DTL0_EPS1_FL1_GRVW2_LPB0_PGR1_PLR1_TT6_4_USFGRO0_VW2_WG16_16_1_WGM8
    SolutionIndex: 4
    SolutionNameMin: Cijk_Ailk_Bljk_SB_MT128x64x8_SE_DTL0_EPS1_FL0_GRVW2_LPB0_PGR1_PLR1_TT8_4_USFGRO0_VW2_WG16_16_1_WGM1
    SolutionIndex: 5
    SolutionNameMin: Cijk_Ailk_Bljk_SB_MT128x64x8_SE_DTL0_EPS1_FL0_GRVW4_LPB0_PGR1_PLR1_TT8_4_USFGRO0_VW4_WG16_16_1_WGM1
    SolutionIndex: 6
    SolutionNameMin: Cijk_Ailk_Bljk_SB_MT128x64x8_SE_DTL0_EPS1_FL1_GRVW2_LPB0_PGR1_PLR1_TT8_4_USFGRO0_VW2_WG16_16_1_WGM1
    SolutionIndex: 7
    SolutionNameMin: Cijk_Ailk_Bljk_SB_MT128x64x8_SE_DTL0_EPS1_FL1_GRVW4_LPB0_PGR1_PLR0_TT8_4_USFGRO0_VW4_WG16_16_1_WGM8
    SolutionIndex: 8
    SolutionNameMin: Cijk_Ailk_Bljk_SB_MT128x64x8_SE_DTL0_EPS1_FL1_GRVW4_LPB0_PGR1_PLR1_TT8_4_USFGRO0_VW4_WG16_16_1_WGM1
    SolutionIndex: 9
    SolutionNameMin: Cijk_Ailk_Bljk_SB_MT128x128x8_SE_DTL0_EPS1_FL0_GRVW1_LPB0_PGR1_PLR1_TT8_8_USFGRO1_VW4_WG16_16_1_WGM1
    SolutionIndex: 10
    SolutionNameMin: Cijk_Ailk_Bljk_SB_MT32x32x8_SE_DTL0_EPS0_FL0_GRVW1_LPB0_PGR0_PLR0_TT2_2_USFGRO1_VW2_WG16_16_1_WGM1
    SolutionIndex: 11
    SolutionNameMin: Cijk_Ailk_Bljk_SB_MT64x64x16_SE_DTL0_EPS0_FL0_GRVW1_LPB4_PGR0_PLR1_TT4_4_USFGRO1_VW4_WG16_16_1_WGM8
    SolutionIndex: 12
    SolutionNameMin: Cijk_Ailk_Bljk_SB_MT64x64x16_SE_DTL0_EPS1_FL0_GRVW4_LPB4_PGR1_PLR1_TT4_4_USFGRO0_VW4_WG16_16_1_WGM1
    SolutionIndex: 13
    SolutionNameMin: Cijk_Ailk_Bljk_SB_MT64x64x16_SE_DTL0_EPS1_FL0_GRVW4_LPB4_PGR1_PLR1_TT4_4_USFGRO0_VW4_WG16_16_1_WGM8
    SolutionIndex: 14
    SolutionNameMin: Cijk_Ailk_Bljk_SB_MT64x64x16_SE_DTL0_EPS0_FL0_GRVW4_LPB0_PGR0_PLR0_TT4_4_USFGRO0_VW4_WG16_16_1_WGM8
    SolutionIndex: 15
    SolutionNameMin: Cijk_Ailk_Bljk_SB_MT32x16x32_SE_DTL0_EPS1_FL0_GRVW2_LPB2_PGR1_PLR1_TT2_2_USFGRO0_VW2_WG16_8_2_WGM8
    SolutionIndex: 16
    SolutionNameMin: Cijk_Ailk_Bljk_SB_MT64x32x16_SE_DTL0_EPS1_FL0_GRVW4_LPB4_PGR1_PLR1_TT4_4_USFGRO0_VW4_WG16_8_2_WGM8
    SolutionIndex: 17
    SolutionNameMin: Cijk_Ailk_Bljk_SB_MT64x32x16_SE_DTL0_EPS1_FL1_GRVW2_LPB2_PGR1_PLR1_TT4_4_USFGRO0_VW2_WG16_8_2_WGM1
    SolutionIndex: 18
    SolutionNameMin: Cijk_Ailk_Bljk_SB_MT64x32x16_SE_DTL0_EPS1_FL1_GRVW4_LPB4_PGR1_PLR0_TT4_4_USFGRO0_VW4_WG16_8_2_WGM8
    SolutionIndex: 19
    SolutionNameMin: Cijk_Ailk_Bljk_SB_MT16x32x32_SE_DTL0_EPS1_FL0_GRVW4_LPB2_PGR1_PLR1_TT4_2_USFGRO0_VW2_WG4_16_4_WGM1
    SolutionIndex: 20
    SolutionNameMin: Cijk_Ailk_Bljk_SB_MT32x8x32_SE_DTL0_EPS1_FL0_GRVW1_LPB2_PGR1_PLR1_TT2_2_USFGRO1_VW2_WG16_4_4_WGM1
    SolutionIndex: 21
    SolutionNameMin: Cijk_Ailk_Bljk_SB_MT32x8x32_SE_DTL0_EPS1_FL0_GRVW1_LPB2_PGR1_PLR1_TT2_2_USFGRO1_VW2_WG16_4_4_WGM8
    SolutionIndex: 22
    SolutionNameMin: Cijk_Ailk_Bljk_SB_MT32x16x32_SE_DTL0_EPS1_FL1_GRVW2_LPB2_PGR1_PLR0_TT2_4_USFGRO0_VW2_WG16_4_4_WGM1
    SolutionIndex: 23
    SolutionNameMin: Cijk_Ailk_Bljk_SB_MT64x16x16_SE_DTL0_EPS1_FL1_GRVW4_LPB4_PGR1_PLR1_TT4_4_USFGRO0_VW4_WG16_4_4_WGM8
- - - [1024, 4096, 1, 3072, 1024, 1024, 1024, 3072]
    - [4, 10863.2]
  - - [1024, 120, 1, 30522, 1024, 1024, 1024, 30522]
    - [14, 7527.58]
  - - [1024, 512, 1, 3072, 1024, 1024, 1024, 3072]
    - [3, 6496.38]
  - - [1024, 6, 1, 1024, 1024, 1024, 1024, 1024]
    - [20, 369.206]
  - - [64, 512, 128, 512, 64, 64, 64, 512]
    - [11, 7713.66]
  - - [3072, 4096, 1, 1024, 3072, 3072, 3072, 1024]
    - [8, 11908.2]
  - - [1024, 6, 1, 2, 1024, 1024, 1024, 2]
    - [10, 0.0]
  - - [1024, 120, 1, 1024, 1024, 1024, 1024, 1024]
    - [23, 4106.69]
  - - [64, 512, 96, 512, 64, 64, 64, 512]
    - [13, 7350.37]
  - - [1024, 20, 1, 30522, 1024, 1024, 1024, 30522]
    - [18, 3522.83]
  - - [1024, 80, 1, 30522, 1024, 1024, 1024, 30522]
    - [17, 6775.31]
  - - [3072, 512, 1, 1024, 3072, 3072, 3072, 1024]
    - [9, 8254.33]
  - - [3072, 2048, 1, 1024, 3072, 3072, 3072, 1024]
    - [7, 11482.8]
  - - [1024, 4096, 1, 2, 1024, 1024, 1024, 2]
    - [0, 0.0]
  - - [1024, 512, 1, 1024, 1024, 1024, 1024, 1024]
    - [2, 6366.95]
  - - [64, 512, 16, 512, 64, 64, 64, 512]
    - [1, 4391.94]
  - - [1024, 20, 1, 1024, 1024, 1024, 1024, 1024]
    - [19, 1202.5]
  - - [1024, 1, 1, 2, 1024, 1024, 1024, 2]
    - [10, 0.0]
  - - [1024, 2048, 1, 1024, 1024, 1024, 1024, 1024]
    - [5, 8827.05]
  - - [1024, 160, 1, 1024, 1024, 1024, 1024, 1024]
    - [16, 5127.51]
  - - [1024, 4, 1, 2, 1024, 1024, 1024, 2]
    - [10, 0.0]
  - - [1024, 1, 1, 1024, 1024, 1024, 1024, 1024]
    - [10, 0.0]
  - - [1024, 8, 1, 1024, 1024, 1024, 1024, 1024]
    - [15, 455.89]
  - - [1024, 4096, 1, 1024, 1024, 1024, 1024, 1024]
    - [8, 10743.7]
  - - [3072, 3072, 1, 1024, 3072, 3072, 3072, 1024]
    - [8, 11473.6]
  - - [1024, 4, 1, 1024, 1024, 1024, 1024, 1024]
    - [21, 230.958]
  - - [64, 512, 64, 512, 64, 64, 64, 512]
    - [12, 6614.97]
  - - [1024, 3072, 1, 1024, 1024, 1024, 1024, 1024]
    - [6, 9897.88]
  - - [1024, 80, 1, 1024, 1024, 1024, 1024, 1024]
    - [22, 3542.49]
  - - [1024, 2048, 1, 2, 1024, 1024, 1024, 2]
    - [0, 0.0]
  - - [1024, 2048, 1, 3072, 1024, 1024, 1024, 3072]
    - [8, 9867.56]
  - - [1024, 3072, 1, 3072, 1024, 1024, 1024, 3072]
    - [8, 10801.6]
  - - [1024, 512, 1, 2, 1024, 1024, 1024, 2]
    - [0, 0.0]
  - - [1024, 3072, 1, 2, 1024, 1024, 1024, 2]
    - [0, 0.0]
- null
