test_dir/py38/lib/python3.6/site-packages/Tensile/Configs/miopen/archives/winograd/2019-08-26/exact/vega20_Cijk_Ailk_Bjlk_SB.yaml
- {MinimumRequiredVersion: 4.10.0}
- vega20
- gfx906
- [Device 66a0, Device 66a1, Device 66a7, Vega 20]
    SolutionIndex: 0
    SolutionNameMin: Cijk_Ailk_Bjlk_SB_MT64x32x16_SE_AMAS1_GRVW1_TT4_4_USFGRO1_VW1_WG16_8_2_WGM8
    SolutionIndex: 1
    SolutionNameMin: Cijk_Ailk_Bjlk_SB_MT32x16x32_SE_AMAS3_GRVW2_TT4_2_USFGRO0_VW2_WG8_8_4_WGM8
    SolutionIndex: 2
    SolutionNameMin: Cijk_Ailk_Bjlk_SB_MT128x128x16_SE_AMAS3_GRVW1_TT8_8_USFGRO1_VW4_WG16_16_1_WGM1
    SolutionIndex: 3
    SolutionNameMin: Cijk_Ailk_Bjlk_SB_MT64x32x8_SE_AMAS1_GRVW1_TT4_2_USFGRO1_VW1_WG16_16_1_WGM8
    SolutionIndex: 4
    SolutionNameMin: Cijk_Ailk_Bjlk_SB_MT16x32x16_SE_AMAS3_GRVW1_TT2_4_USFGRO1_VW2_WG8_8_4_WGM1
    SolutionIndex: 5
    SolutionNameMin: Cijk_Ailk_Bjlk_SB_MT32x32x32_SE_AMAS3_GRVW2_TT4_4_USFGRO0_VW2_WG8_8_4_WGM1
    SolutionIndex: 6
    SolutionNameMin: Cijk_Ailk_Bjlk_SB_MT32x64x16_SE_AMAS3_GRVW2_TT4_4_USFGRO0_VW2_WG8_16_2_WGM1
    SolutionIndex: 7
    SolutionNameMin: Cijk_Ailk_Bjlk_SB_MT64x32x16_SE_AMAS3_GRVW1_TT4_4_USFGRO1_VW2_WG16_8_2_WGM8
    SolutionIndex: 8
    SolutionNameMin: Cijk_Ailk_Bjlk_SB_MT64x64x16_SE_AMAS3_GRVW4_TT4_4_USFGRO0_VW4_WG16_16_1_WGM8
    SolutionIndex: 9
    SolutionNameMin: Cijk_Ailk_Bjlk_SB_MT64x64x16_SE_AMAS1_GRVW1_TT4_4_USFGRO1_VW1_WG16_16_1_WGM1
    SolutionIndex: 10
    SolutionNameMin: Cijk_Ailk_Bjlk_SB_MT64x32x16_SE_AMAS3_GRVW1_TT4_4_USFGRO1_VW4_WG16_8_2_WGM8
    SolutionIndex: 11
    SolutionNameMin: Cijk_Ailk_Bjlk_SB_MT32x64x16_SE_AMAS3_GRVW2_TT4_4_USFGRO0_VW2_WG8_16_2_WGM8
    SolutionIndex: 12
    SolutionNameMin: Cijk_Ailk_Bjlk_SB_MT32x16x32_SE_AMAS3_GRVW2_TT4_2_USFGRO0_VW2_WG8_8_4_WGM1
    SolutionIndex: 13
    SolutionNameMin: Cijk_Ailk_Bjlk_SB_MT64x64x16_SE_AMAS3_GRVW4_TT4_4_USFGRO0_VW4_WG16_16_1_WGM8
    SolutionIndex: 14
    SolutionNameMin: Cijk_Ailk_Bjlk_SB_MT32x32x32_SE_AMAS3_GRVW1_TT4_4_USFGRO1_VW2_WG8_8_4_WGM1
    SolutionIndex: 15
    SolutionNameMin: Cijk_Ailk_Bjlk_SB_MT64x64x16_SE_AMAS3_GRVW1_TT4_4_USFGRO1_VW4_WG16_16_1_WGM1
    SolutionIndex: 16
    SolutionNameMin: Cijk_Ailk_Bjlk_SB_MT64x64x8_SE_AMAS3_GRVW4_TT4_4_USFGRO0_VW2_WG16_16_1_WGM1
    SolutionIndex: 17
    SolutionNameMin: Cijk_Ailk_Bjlk_SB_MT32x32x32_SE_AMAS3_GRVW4_TT4_4_USFGRO0_VW4_WG8_8_4_WGM1
    SolutionIndex: 18
    SolutionNameMin: Cijk_Ailk_Bjlk_SB_MT64x64x8_SE_AMAS3_GRVW2_TT4_4_USFGRO0_VW2_WG16_16_1_WGM1
    SolutionIndex: 19
    SolutionNameMin: Cijk_Ailk_Bjlk_SB_MT64x64x16_SE_AMAS3_GRVW4_TT4_4_USFGRO0_VW4_WG16_16_1_WGM1
    SolutionIndex: 20
    SolutionNameMin: Cijk_Ailk_Bjlk_SB_MT64x64x16_SE_AMAS3_GRVW1_TT4_4_USFGRO1_VW2_WG16_16_1_WGM1
    SolutionIndex: 21
    SolutionNameMin: Cijk_Ailk_Bjlk_SB_MT64x32x32_SE_AMAS3_GRVW4_TT4_4_USFGRO0_VW4_WG16_8_2_WGM1
    SolutionIndex: 22
    SolutionNameMin: Cijk_Ailk_Bjlk_SB_MT64x32x16_SE_AMAS3_GRVW2_TT4_4_USFGRO0_VW2_WG16_8_2_WGM1
    SolutionIndex: 23
    SolutionNameMin: Cijk_Ailk_Bjlk_SB_MT128x128x16_SE_AMAS3_GRVW2_TT8_8_USFGRO0_VW2_WG16_16_1_WGM8
    SolutionIndex: 24
    SolutionNameMin: Cijk_Ailk_Bjlk_SB_MT32x32x8_SE_AMAS3_GRVW4_TT4_2_USFGRO1_VW2_WG8_16_2_WGM8
    SolutionIndex: 25
    SolutionNameMin: Cijk_Ailk_Bjlk_SB_MT64x32x16_SE_AMAS3_GRVW1_TT4_4_USFGRO1_VW4_WG16_8_2_WGM1
    SolutionIndex: 26
    SolutionNameMin: Cijk_Ailk_Bjlk_SB_MT64x64x8_SE_AMAS3_GRVW4_TT4_4_USFGRO0_VW2_WG16_16_1_WGM8
    SolutionIndex: 27
    SolutionNameMin: Cijk_Ailk_Bjlk_SB_MT32x64x32_SE_AMAS3_GRVW4_TT4_4_USFGRO0_VW4_WG8_16_2_WGM1
    SolutionIndex: 28
    SolutionNameMin: Cijk_Ailk_Bjlk_SB_MT64x64x8_SE_AMAS3_GRVW1_TT4_4_USFGRO1_VW4_WG16_16_1_WGM8
    SolutionIndex: 29
    SolutionNameMin: Cijk_Ailk_Bjlk_SB_MT64x32x32_SE_AMAS3_GRVW4_TT4_4_USFGRO0_VW4_WG16_8_2_WGM1
    SolutionIndex: 30
    SolutionNameMin: Cijk_Ailk_Bjlk_SB_MT16x32x32_SE_AMAS3_GRVW1_TT2_4_USFGRO1_VW2_WG8_8_4_WGM8
    SolutionIndex: 31
    SolutionNameMin: Cijk_Ailk_Bjlk_SB_MT32x16x32_SE_AMAS1_GRVW1_TT4_2_USFGRO1_VW1_WG8_8_4_WGM8
    SolutionIndex: 32
    SolutionNameMin: Cijk_Ailk_Bjlk_SB_MT16x32x32_SE_AMAS3_GRVW2_TT2_4_USFGRO0_VW2_WG8_8_4_WGM1
    SolutionIndex: 33
    SolutionNameMin: Cijk_Ailk_Bjlk_SB_MT32x32x16_SE_AMAS3_GRVW2_TT4_4_USFGRO0_VW2_WG8_8_4_WGM1
    SolutionIndex: 34
    SolutionNameMin: Cijk_Ailk_Bjlk_SB_MT128x128x16_SE_AMAS3_GRVW1_TT8_8_USFGRO1_VW4_WG16_16_1_WGM8
    SolutionIndex: 35
    SolutionNameMin: Cijk_Ailk_Bjlk_SB_MT64x64x8_SE_AMAS3_GRVW1_TT4_4_USFGRO1_VW4_WG16_16_1_WGM1
    SolutionIndex: 36
    SolutionNameMin: Cijk_Ailk_Bjlk_SB_MT32x32x32_SE_AMAS3_GRVW2_TT4_4_USFGRO0_VW2_WG8_8_4_WGM8
    SolutionIndex: 37
    SolutionNameMin: Cijk_Ailk_Bjlk_SB_MT16x32x32_SE_AMAS3_GRVW2_TT2_4_USFGRO0_VW2_WG8_8_4_WGM8
    SolutionIndex: 38
    SolutionNameMin: Cijk_Ailk_Bjlk_SB_MT32x64x16_SE_AMAS3_GRVW1_TT4_4_USFGRO1_VW4_WG8_16_2_WGM8
    SolutionIndex: 39
    SolutionNameMin: Cijk_Ailk_Bjlk_SB_MT32x64x16_SE_AMAS3_GRVW2_TT4_4_USFGRO0_VW2_WG8_16_2_WGM1
    SolutionIndex: 40
    SolutionNameMin: Cijk_Ailk_Bjlk_SB_MT64x64x16_SE_AMAS3_GRVW2_TT4_4_USFGRO0_VW2_WG16_16_1_WGM8
    SolutionIndex: 41
    SolutionNameMin: Cijk_Ailk_Bjlk_SB_MT128x128x8_SE_AMAS3_GRVW1_TT8_8_USFGRO1_VW4_WG16_16_1_WGM1
    SolutionIndex: 42
    SolutionNameMin: Cijk_Ailk_Bjlk_SB_MT64x32x8_SE_AMAS3_GRVW1_TT4_4_USFGRO1_VW4_WG16_8_2_WGM1
    SolutionIndex: 43
    SolutionNameMin: Cijk_Ailk_Bjlk_SB_MT32x32x32_SE_AMAS3_GRVW1_TT4_4_USFGRO1_VW2_WG8_8_4_WGM8
    SolutionIndex: 44
    SolutionNameMin: Cijk_Ailk_Bjlk_SB_MT128x128x8_SE_AMAS3_GRVW1_TT8_8_USFGRO1_VW2_WG16_16_1_WGM8
    SolutionIndex: 45
    SolutionNameMin: Cijk_Ailk_Bjlk_SB_MT128x128x8_SE_AMAS3_GRVW1_TT8_8_USFGRO1_VW4_WG16_16_1_WGM8
    SolutionIndex: 46
    SolutionNameMin: Cijk_Ailk_Bjlk_SB_MT64x32x8_SE_AMAS1_GRVW1_TT4_2_USFGRO1_VW1_WG16_16_1_WGM1
    SolutionIndex: 47
    SolutionNameMin: Cijk_Ailk_Bjlk_SB_MT32x32x32_SE_AMAS3_GRVW4_TT4_4_USFGRO0_VW4_WG8_8_4_WGM8
    SolutionIndex: 48
    SolutionNameMin: Cijk_Ailk_Bjlk_SB_MT16x32x32_SE_AMAS1_GRVW1_TT2_4_USFGRO1_VW1_WG8_8_4_WGM8
    SolutionIndex: 49
    SolutionNameMin: Cijk_Ailk_Bjlk_SB_MT64x32x8_SE_AMAS3_GRVW1_TT4_2_USFGRO1_VW2_WG16_16_1_WGM1
    SolutionIndex: 50
    SolutionNameMin: Cijk_Ailk_Bjlk_SB_MT64x16x32_SE_AMAS3_GRVW1_TT4_2_USFGRO1_VW2_WG16_8_2_WGM8
    SolutionIndex: 51
    SolutionNameMin: Cijk_Ailk_Bjlk_SB_MT64x64x8_SE_AMAS3_GRVW2_TT4_4_USFGRO0_VW2_WG16_16_1_WGM1
    SolutionIndex: 52
    SolutionNameMin: Cijk_Ailk_Bjlk_SB_MT64x32x16_SE_AMAS3_GRVW2_TT4_4_USFGRO0_VW2_WG16_8_2_WGM1
    SolutionIndex: 53
    SolutionNameMin: Cijk_Ailk_Bjlk_SB_MT32x16x32_SE_AMAS1_GRVW1_TT4_2_USFGRO1_VW1_WG8_8_4_WGM1
    SolutionIndex: 54
    SolutionNameMin: Cijk_Ailk_Bjlk_SB_MT128x128x8_SE_AMAS3_GRVW1_TT8_8_USFGRO1_VW2_WG16_16_1_WGM1
    SolutionIndex: 55
    SolutionNameMin: Cijk_Ailk_Bjlk_SB_MT16x32x32_SE_AMAS1_GRVW1_TT2_4_USFGRO1_VW1_WG8_8_4_WGM1
    SolutionIndex: 56
    SolutionNameMin: Cijk_Ailk_Bjlk_SB_MT64x32x8_SE_AMAS3_GRVW4_TT4_2_USFGRO0_VW2_WG16_16_1_WGM1
    SolutionIndex: 57
    SolutionNameMin: Cijk_Ailk_Bjlk_SB_MT64x64x8_SE_AMAS3_GRVW1_TT4_4_USFGRO1_VW2_WG16_16_1_WGM1
    SolutionIndex: 58
    SolutionNameMin: Cijk_Ailk_Bjlk_SB_MT64x64x8_SE_AMAS3_GRVW4_TT4_4_USFGRO0_VW2_WG16_16_1_WGM8
    SolutionIndex: 59
    SolutionNameMin: Cijk_Ailk_Bjlk_SB_MT64x64x8_SE_AMAS3_GRVW4_TT4_4_USFGRO0_VW2_WG16_16_1_WGM1
    SolutionIndex: 60
    SolutionNameMin: Cijk_Ailk_Bjlk_SB_MT16x64x32_SE_AMAS3_GRVW2_TT2_4_USFGRO0_VW2_WG8_16_2_WGM1
    SolutionIndex: 61
    SolutionNameMin: Cijk_Ailk_Bjlk_SB_MT16x32x32_SE_AMAS3_GRVW2_TT2_4_USFGRO0_VW2_WG8_8_4_WGM8
    SolutionIndex: 62
    SolutionNameMin: Cijk_Ailk_Bjlk_SB_MT128x128x8_SE_AMAS3_GRVW4_TT8_8_USFGRO0_VW4_WG16_16_1_WGM1
    SolutionIndex: 63
    SolutionNameMin: Cijk_Ailk_Bjlk_SB_MT32x64x16_SE_AMAS3_GRVW2_TT4_4_USFGRO0_VW2_WG8_16_2_WGM8
    SolutionIndex: 64
    SolutionNameMin: Cijk_Ailk_Bjlk_SB_MT64x16x16_SE_AMAS3_GRVW1_TT4_2_USFGRO1_VW2_WG16_8_2_WGM1
    SolutionIndex: 65
    SolutionNameMin: Cijk_Ailk_Bjlk_SB_MT64x32x32_SE_AMAS3_GRVW4_TT4_4_USFGRO0_VW4_WG16_8_2_WGM8
    SolutionIndex: 66
    SolutionNameMin: Cijk_Ailk_Bjlk_SB_MT64x32x32_SE_AMAS3_GRVW2_TT4_4_USFGRO0_VW2_WG16_8_2_WGM1
    SolutionIndex: 67
    SolutionNameMin: Cijk_Ailk_Bjlk_SB_MT32x32x32_SE_AMAS3_GRVW4_TT4_4_USFGRO0_VW4_WG8_8_4_WGM1
    SolutionIndex: 68
    SolutionNameMin: Cijk_Ailk_Bjlk_SB_MT32x16x16_SE_AMAS3_GRVW2_TT4_2_USFGRO0_VW2_WG8_8_4_WGM1
    SolutionIndex: 69
    SolutionNameMin: Cijk_Ailk_Bjlk_SB_MT64x32x32_SE_AMAS3_GRVW4_TT4_4_USFGRO0_VW4_WG16_8_2_WGM8
    SolutionIndex: 70
    SolutionNameMin: Cijk_Ailk_Bjlk_SB_MT32x32x32_SE_AMAS3_GRVW2_TT4_4_USFGRO0_VW2_WG8_8_4_WGM1
    SolutionIndex: 71
    SolutionNameMin: Cijk_Ailk_Bjlk_SB_MT32x32x32_SE_AMAS3_GRVW1_TT4_4_USFGRO1_VW4_WG8_8_4_WGM1
    SolutionIndex: 72
    SolutionNameMin: Cijk_Ailk_Bjlk_SB_MT64x64x8_SE_AMAS1_GRVW1_TT4_4_USFGRO1_VW1_WG16_16_1_WGM1
    SolutionIndex: 73
    SolutionNameMin: Cijk_Ailk_Bjlk_SB_MT64x64x16_SE_AMAS3_GRVW2_TT4_4_USFGRO0_VW2_WG16_16_1_WGM1
    SolutionIndex: 74
    SolutionNameMin: Cijk_Ailk_Bjlk_SB_MT64x16x16_SE_AMAS3_GRVW2_TT4_2_USFGRO0_VW2_WG16_8_2_WGM8
    SolutionIndex: 75
    SolutionNameMin: Cijk_Ailk_Bjlk_SB_MT64x32x16_SE_AMAS3_GRVW2_TT4_4_USFGRO0_VW2_WG16_8_2_WGM8
    SolutionIndex: 76
    SolutionNameMin: Cijk_Ailk_Bjlk_SB_MT64x64x8_SE_AMAS3_GRVW1_TT4_4_USFGRO1_VW2_WG16_16_1_WGM8
    SolutionIndex: 77
    SolutionNameMin: Cijk_Ailk_Bjlk_SB_MT32x32x32_SE_AMAS3_GRVW2_TT4_4_USFGRO0_VW2_WG8_8_4_WGM8
    SolutionIndex: 78
    SolutionNameMin: Cijk_Ailk_Bjlk_SB_MT64x32x16_SE_AMAS3_GRVW2_TT4_4_USFGRO0_VW2_WG16_8_2_WGM8
    SolutionIndex: 79
    SolutionNameMin: Cijk_Ailk_Bjlk_SB_MT64x64x16_SE_AMAS3_GRVW4_TT4_4_USFGRO0_VW4_WG16_16_1_WGM1
    SolutionIndex: 80
    SolutionNameMin: Cijk_Ailk_Bjlk_SB_MT32x32x32_SE_AMAS3_GRVW4_TT4_4_USFGRO0_VW4_WG8_8_4_WGM8
    SolutionIndex: 81
    SolutionNameMin: Cijk_Ailk_Bjlk_SB_MT32x64x32_SE_AMAS3_GRVW2_TT4_4_USFGRO0_VW2_WG8_16_2_WGM1
    SolutionIndex: 82
    SolutionNameMin: Cijk_Ailk_Bjlk_SB_MT32x64x32_SE_AMAS3_GRVW4_TT4_4_USFGRO0_VW4_WG8_16_2_WGM1
    SolutionIndex: 83
    SolutionNameMin: Cijk_Ailk_Bjlk_SB_MT32x64x32_SE_AMAS3_GRVW2_TT4_8_USFGRO0_VW2_WG8_8_4_WGM1
    SolutionIndex: 84
    SolutionNameMin: Cijk_Ailk_Bjlk_SB_MT64x32x32_SE_AMAS3_GRVW2_TT8_4_USFGRO0_VW2_WG8_8_4_WGM1
    SolutionIndex: 85
    SolutionNameMin: Cijk_Ailk_Bjlk_SB_MT64x64x32_SE_AMAS3_GRVW2_TT8_4_USFGRO0_VW2_WG8_16_2_WGM8
    SolutionIndex: 86
    SolutionNameMin: Cijk_Ailk_Bjlk_SB_MT64x32x32_SE_AMAS3_GRVW2_TT8_4_USFGRO0_VW2_WG8_8_4_WGM8
- - - [256, 512, 36, 98, 256, 256, 256, 512]
    - [16, 7994.85]
  - - [64, 192, 36, 25088, 64, 64, 64, 192]
    - [85, 8613.89]
  - - [128, 128, 64, 25, 128, 128, 128, 128]
    - [15, 2540.15]
  - - [256, 256, 64, 56, 256, 256, 256, 256]
    - [16, 6924.56]
  - - [512, 486, 36, 800, 512, 512, 512, 486]
    - [23, 8994.84]
  - - [512, 512, 36, 1568, 512, 512, 512, 512]
    - [34, 9872.38]
  - - [64, 192, 64, 3200, 64, 64, 64, 192]
    - [79, 9295.89]
  - - [256, 384, 36, 4096, 256, 256, 256, 384]
    - [79, 9334.61]
  - - [128, 256, 64, 32, 128, 128, 128, 256]
    - [18, 4279.9]
  - - [64, 128, 64, 23104, 64, 64, 64, 128]
    - [85, 10103.1]
  - - [128, 256, 64, 9, 128, 128, 128, 256]
    - [9, 1709.63]
  - - [256, 512, 36, 784, 256, 256, 256, 512]
    - [19, 9520.73]
  - - [256, 324, 36, 32, 256, 256, 256, 324]
    - [57, 4473.38]
  - - [512, 512, 36, 33, 512, 512, 512, 512]
    - [28, 5925.17]
  - - [16, 32, 36, 5760, 16, 16, 16, 32]
    - [32, 1448.8]
  - - [192, 384, 64, 128, 192, 192, 192, 384]
    - [79, 8618.43]
  - - [512, 512, 64, 72, 512, 512, 512, 512]
    - [35, 8260.12]
  - - [128, 128, 64, 1600, 128, 128, 128, 128]
    - [8, 9008.38]
  - - [512, 512, 36, 128, 512, 512, 512, 512]
    - [79, 8871.62]
  - - [192, 384, 64, 2304, 192, 192, 192, 384]
    - [8, 9657.16]
  - - [384, 256, 64, 450, 384, 384, 384, 256]
    - [44, 9538.93]
  - - [3, 64, 36, 6272, 3, 3, 3, 64]
    - [32, 509.784]
  - - [3, 64, 64, 2888, 3, 3, 3, 64]
    - [61, 708.621]
  - - [384, 256, 64, 2304, 384, 384, 384, 256]
    - [44, 10287.5]
  - - [512, 512, 64, 144, 512, 512, 512, 512]
    - [79, 9226.7]
  - - [256, 256, 36, 6272, 256, 256, 256, 256]
    - [19, 9607.28]
  - - [80, 192, 64, 4608, 80, 80, 80, 192]
    - [80, 7347.93]
  - - [64, 64, 36, 3136, 64, 64, 64, 64]
    - [67, 5959.05]
  - - [256, 384, 64, 2304, 256, 256, 256, 384]
    - [44, 10283.4]
  - - [64, 64, 64, 6400, 64, 64, 64, 64]
    - [27, 8741.78]
  - - [128, 192, 36, 6272, 128, 128, 128, 192]
    - [47, 8504.58]
  - - [512, 512, 36, 66, 512, 512, 512, 512]
    - [28, 7618.08]
  - - [128, 256, 64, 800, 128, 128, 128, 256]
    - [54, 9611.15]
  - - [64, 128, 36, 30, 64, 64, 64, 128]
    - [10, 1242.61]
  - - [64, 128, 36, 25088, 64, 64, 64, 128]
    - [75, 6304.32]
  - - [192, 256, 36, 512, 192, 192, 192, 256]
    - [79, 8657.97]
  - - [256, 512, 64, 200, 256, 256, 256, 512]
    - [79, 9153.87]
  - - [256, 512, 64, 25, 256, 256, 256, 512]
    - [57, 5349.88]
  - - [3, 64, 64, 46208, 3, 3, 3, 64]
    - [60, 808.562]
  - - [128, 256, 36, 1568, 128, 128, 128, 256]
    - [52, 8528.62]
  - - [64, 128, 64, 11552, 64, 64, 64, 128]
    - [85, 9997.0]
  - - [128, 192, 64, 946, 128, 128, 128, 192]
    - [79, 9198.38]
  - - [64, 192, 64, 12800, 64, 64, 64, 192]
    - [40, 9000.66]
  - - [224, 224, 64, 128, 224, 224, 224, 224]
    - [17, 6312.07]
  - - [128, 256, 64, 288, 128, 128, 128, 256]
    - [79, 8697.87]
  - - [64, 64, 64, 826, 64, 64, 64, 64]
    - [22, 6650.21]
  - - [64, 64, 36, 28160, 64, 64, 64, 64]
    - [70, 5692.54]
  - - [256, 384, 64, 1152, 256, 256, 256, 384]
    - [54, 10106.8]
  - - [160, 320, 36, 2048, 160, 160, 160, 320]
    - [47, 8518.85]
  - - [3, 64, 64, 92416, 3, 3, 3, 64]
    - [60, 812.031]
  - - [32, 32, 36, 43808, 32, 32, 32, 32]
    - [1, 2813.09]
  - - [160, 320, 64, 288, 160, 160, 160, 320]
    - [11, 8090.86]
  - - [1, 16, 36, 23040, 1, 1, 1, 16]
    - [48, 42.6667]
  - - [128, 256, 36, 128, 128, 128, 128, 256]
    - [26, 6049.48]
  - - [128, 128, 64, 3360, 128, 128, 128, 128]
    - [79, 9199.96]
  - - [96, 128, 36, 2048, 96, 96, 96, 128]
    - [17, 7991.97]
  - - [128, 128, 64, 420, 128, 128, 128, 128]
    - [79, 8131.5]
  - - [64, 128, 64, 361, 64, 64, 64, 128]
    - [16, 6937.98]
  - - [128, 256, 36, 2048, 128, 128, 128, 256]
    - [52, 8603.7]
  - - [512, 512, 36, 16, 512, 512, 512, 512]
    - [72, 3797.66]
  - - [384, 256, 36, 800, 384, 384, 384, 256]
    - [13, 9151.65]
  - - [192, 384, 36, 4096, 192, 192, 192, 384]
    - [13, 8867.57]
  - - [64, 64, 64, 1600, 64, 64, 64, 64]
    - [65, 7931.74]
  - - [256, 384, 64, 576, 256, 256, 256, 384]
    - [45, 9745.8]
  - - [512, 512, 64, 14, 512, 512, 512, 512]
    - [28, 3638.18]
  - - [512, 512, 36, 8, 512, 512, 512, 512]
    - [3, 2279.51]
  - - [512, 486, 64, 128, 512, 512, 512, 486]
    - [19, 8337.83]
  - - [96, 208, 36, 2048, 96, 96, 96, 208]
    - [47, 7810.91]
  - - [1, 16, 64, 640, 1, 1, 1, 16]
    - [53, 49.9512]
  - - [64, 96, 64, 288, 64, 64, 64, 96]
    - [78, 5707.97]
  - - [96, 96, 36, 1568, 96, 96, 96, 96]
    - [47, 6866.75]
  - - [256, 256, 36, 128, 256, 256, 256, 256]
    - [51, 7703.82]
  - - [8, 384, 36, 14336, 8, 8, 8, 384]
    - [37, 2410.96]
  - - [64, 128, 36, 53824, 64, 64, 64, 128]
    - [39, 6331.31]
  - - [256, 256, 36, 32, 256, 256, 256, 256]
    - [35, 4648.86]
  - - [192, 256, 64, 288, 192, 192, 192, 256]
    - [79, 8987.79]
  - - [256, 256, 36, 16, 256, 256, 256, 256]
    - [49, 2912.71]
  - - [128, 256, 36, 3200, 128, 128, 128, 256]
    - [52, 8680.27]
  - - [160, 320, 64, 512, 160, 160, 160, 320]
    - [11, 8449.44]
  - - [128, 160, 36, 512, 128, 128, 128, 160]
    - [22, 7214.97]
  - - [96, 96, 36, 2592, 96, 96, 96, 96]
    - [17, 7104.79]
  - - [64, 96, 64, 800, 64, 64, 64, 96]
    - [47, 7268.32]
  - - [147, 64, 36, 18816, 147, 147, 147, 64]
    - [63, 7116.26]
  - - [160, 320, 36, 512, 160, 160, 160, 320]
    - [17, 7874.82]
  - - [256, 512, 36, 4, 256, 256, 256, 512]
    - [56, 1034.78]
  - - [96, 128, 64, 946, 96, 96, 96, 128]
    - [39, 7901.07]
  - - [256, 324, 64, 1568, 256, 256, 256, 324]
    - [44, 8589.53]
  - - [128, 128, 64, 50, 128, 128, 128, 128]
    - [35, 4070.56]
  - - [35, 96, 36, 8960, 35, 35, 35, 96]
    - [29, 4207.3]
  - - [32, 64, 36, 43808, 32, 32, 32, 64]
    - [70, 4390.81]
  - - [160, 224, 36, 128, 160, 160, 160, 224]
    - [17, 5446.92]
  - - [64, 64, 64, 81, 64, 64, 64, 64]
    - [42, 2391.18]
  - - [256, 256, 36, 3200, 256, 256, 256, 256]
    - [8, 9559.55]
  - - [256, 256, 36, 210, 256, 256, 256, 256]
    - [19, 8414.61]
  - - [192, 384, 64, 576, 192, 192, 192, 384]
    - [79, 9468.75]
  - - [512, 512, 64, 800, 512, 512, 512, 512]
    - [54, 10096.4]
  - - [512, 24, 36, 800, 512, 512, 512, 24]
    - [5, 4761.77]
  - - [64, 64, 64, 13216, 64, 64, 64, 64]
    - [66, 8491.41]
  - - [192, 224, 64, 1152, 192, 192, 192, 224]
    - [22, 8769.06]
  - - [256, 256, 64, 1152, 256, 256, 256, 256]
    - [44, 9988.09]
  - - [512, 486, 64, 512, 512, 512, 512, 486]
    - [54, 9254.67]
  - - [128, 128, 36, 784, 128, 128, 128, 128]
    - [17, 7468.06]
  - - [256, 512, 64, 1600, 256, 256, 256, 512]
    - [41, 10232.5]
  - - [512, 512, 64, 9, 512, 512, 512, 512]
    - [35, 2599.78]
  - - [96, 128, 64, 288, 96, 96, 96, 128]
    - [47, 6599.43]
  - - [64, 96, 36, 512, 64, 64, 64, 96]
    - [47, 5073.75]
  - - [256, 512, 36, 1568, 256, 256, 256, 512]
    - [79, 9637.81]
  - - [128, 128, 64, 400, 128, 128, 128, 128]
    - [79, 8192.0]
  - - [128, 128, 64, 800, 128, 128, 128, 128]
    - [79, 8716.34]
  - - [96, 128, 36, 512, 96, 96, 96, 128]
    - [67, 6756.93]
  - - [16, 32, 36, 360, 16, 16, 16, 32]
    - [30, 754.036]
  - - [128, 256, 64, 3200, 128, 128, 128, 256]
    - [44, 10222.5]
  - - [96, 128, 64, 800, 96, 96, 96, 128]
    - [47, 7967.9]
  - - [256, 512, 64, 4, 256, 256, 256, 512]
    - [9, 1097.99]
  - - [256, 256, 64, 450, 256, 256, 256, 256]
    - [54, 9347.45]
  - - [64, 64, 64, 3200, 64, 64, 64, 64]
    - [65, 8518.08]
  - - [192, 224, 64, 128, 192, 192, 192, 224]
    - [25, 7035.17]
  - - [128, 128, 64, 288, 128, 128, 128, 128]
    - [79, 7751.28]
  - - [256, 256, 64, 72, 256, 256, 256, 256]
    - [35, 7489.83]
  - - [96, 208, 36, 512, 96, 96, 96, 208]
    - [47, 6939.11]
  - - [128, 256, 36, 3136, 128, 128, 128, 256]
    - [22, 8669.33]
  - - [64, 64, 36, 3520, 64, 64, 64, 64]
    - [17, 6007.47]
  - - [128, 128, 36, 98, 128, 128, 128, 128]
    - [35, 3969.97]
  - - [64, 128, 36, 1568, 64, 64, 64, 128]
    - [80, 6897.7]
  - - [160, 320, 64, 242, 160, 160, 160, 320]
    - [6, 7873.17]
  - - [192, 192, 36, 512, 192, 192, 192, 192]
    - [17, 7707.32]
  - - [512, 512, 36, 512, 512, 512, 512, 512]
    - [79, 9582.42]
  - - [1, 16, 64, 10240, 1, 1, 1, 16]
    - [31, 71.3511]
  - - [128, 128, 36, 512, 128, 128, 128, 128]
    - [17, 7149.38]
  - - [512, 512, 36, 256, 512, 512, 512, 512]
    - [8, 9384.4]
  - - [512, 512, 36, 1024, 512, 512, 512, 512]
    - [2, 9777.89]
  - - [96, 208, 64, 1152, 96, 96, 96, 208]
    - [80, 7850.9]
  - - [128, 192, 64, 3200, 128, 128, 128, 192]
    - [8, 9490.82]
  - - [256, 256, 36, 4096, 256, 256, 256, 256]
    - [13, 9585.46]
  - - [160, 160, 64, 288, 160, 160, 160, 160]
    - [47, 7299.8]
  - - [256, 256, 64, 896, 256, 256, 256, 256]
    - [44, 9850.33]
  - - [128, 256, 64, 242, 128, 128, 128, 256]
    - [79, 8391.38]
  - - [128, 128, 36, 440, 128, 128, 128, 128]
    - [22, 6274.72]
  - - [96, 128, 36, 1568, 96, 96, 96, 128]
    - [67, 7875.03]
  - - [192, 384, 36, 1024, 192, 192, 192, 384]
    - [13, 8715.72]
  - - [64, 96, 36, 10368, 64, 64, 64, 96]
    - [84, 7478.59]
  - - [128, 256, 64, 100, 128, 128, 128, 256]
    - [28, 7084.97]
  - - [112, 224, 36, 2048, 112, 112, 112, 224]
    - [21, 7555.92]
  - - [384, 256, 64, 1152, 384, 384, 384, 256]
    - [44, 10102.3]
  - - [192, 384, 36, 128, 192, 192, 192, 384]
    - [79, 7543.04]
  - - [128, 128, 36, 7040, 128, 128, 128, 128]
    - [52, 7600.6]
  - - [128, 256, 64, 1568, 128, 128, 128, 256]
    - [44, 10005.9]
  - - [128, 128, 36, 1568, 128, 128, 128, 128]
    - [36, 7848.3]
  - - [128, 256, 64, 72, 128, 128, 128, 256]
    - [59, 6553.6]
  - - [256, 256, 36, 12544, 256, 256, 256, 256]
    - [73, 9365.04]
  - - [256, 256, 36, 105, 256, 256, 256, 256]
    - [35, 7286.06]
  - - [128, 256, 36, 392, 128, 128, 128, 256]
    - [22, 7625.69]
  - - [64, 64, 64, 5408, 64, 64, 64, 64]
    - [65, 8882.67]
  - - [3, 64, 36, 25088, 3, 3, 3, 64]
    - [32, 528.942]
  - - [384, 256, 36, 1024, 384, 384, 384, 256]
    - [79, 9182.75]
  - - [35, 96, 36, 13440, 35, 35, 35, 96]
    - [86, 4110.29]
  - - [128, 256, 64, 1152, 128, 128, 128, 256]
    - [44, 9804.87]
  - - [256, 324, 64, 32, 256, 256, 256, 324]
    - [57, 5043.63]
  - - [160, 224, 64, 128, 160, 160, 160, 224]
    - [71, 6046.15]
  - - [192, 224, 36, 2592, 192, 192, 192, 224]
    - [69, 8878.68]
  - - [96, 96, 64, 1152, 96, 96, 96, 96]
    - [47, 8035.45]
  - - [32, 64, 36, 90, 32, 32, 32, 64]
    - [4, 964.465]
  - - [64, 128, 64, 2888, 64, 64, 64, 128]
    - [19, 9047.23]
  - - [256, 384, 36, 800, 256, 256, 256, 384]
    - [79, 9154.02]
  - - [512, 512, 64, 4, 512, 512, 512, 512]
    - [76, 1233.62]
  - - [192, 320, 36, 128, 192, 192, 192, 320]
    - [16, 7388.19]
  - - [64, 128, 36, 480, 64, 64, 64, 128]
    - [80, 5653.27]
  - - [192, 384, 64, 242, 192, 192, 192, 384]
    - [79, 9079.99]
  - - [256, 486, 64, 32, 256, 256, 256, 486]
    - [72, 5909.18]
  - - [147, 64, 64, 9702, 147, 147, 147, 64]
    - [81, 7319.69]
  - - [512, 512, 64, 64, 512, 512, 512, 512]
    - [15, 8179.02]
  - - [64, 192, 64, 3698, 64, 64, 64, 192]
    - [8, 9287.89]
  - - [73, 192, 64, 10439, 73, 73, 73, 192]
    - [39, 6668.02]
  - - [1, 16, 36, 1440, 1, 1, 1, 16]
    - [55, 33.4452]
  - - [128, 256, 36, 512, 128, 128, 128, 256]
    - [22, 7989.15]
  - - [512, 512, 64, 576, 512, 512, 512, 512]
    - [54, 9951.89]
  - - [64, 64, 36, 12544, 64, 64, 64, 64]
    - [70, 5872.77]
  - - [128, 128, 36, 880, 128, 128, 128, 128]
    - [67, 7597.26]
  - - [192, 224, 36, 128, 192, 192, 192, 224]
    - [25, 6451.2]
  - - [64, 64, 64, 800, 64, 64, 64, 64]
    - [65, 6916.73]
  - - [64, 128, 36, 12544, 64, 64, 64, 128]
    - [43, 6395.88]
  - - [64, 64, 36, 1568, 64, 64, 64, 64]
    - [17, 5536.66]
  - - [160, 160, 36, 512, 160, 160, 160, 160]
    - [17, 7345.26]
  - - [512, 24, 64, 512, 512, 512, 512, 24]
    - [7, 5242.88]
  - - [3, 64, 36, 3136, 3, 3, 3, 64]
    - [32, 475.352]
  - - [256, 256, 64, 9, 256, 256, 256, 256]
    - [57, 2106.51]
  - - [3, 64, 64, 11552, 3, 3, 3, 64]
    - [60, 785.127]
  - - [128, 256, 36, 12544, 128, 128, 128, 256]
    - [75, 8792.13]
  - - [128, 128, 36, 3136, 128, 128, 128, 128]
    - [36, 8098.46]
  - - [256, 512, 36, 3136, 256, 256, 256, 512]
    - [19, 9694.39]
  - - [64, 64, 36, 196, 64, 64, 64, 64]
    - [33, 2757.76]
  - - [144, 288, 36, 512, 144, 144, 144, 288]
    - [67, 7077.89]
  - - [256, 24, 64, 32, 256, 256, 256, 24]
    - [46, 1483.83]
  - - [384, 384, 36, 800, 384, 384, 384, 384]
    - [8, 9246.5]
  - - [64, 128, 36, 50176, 64, 64, 64, 128]
    - [22, 6331.52]
  - - [512, 512, 64, 1600, 512, 512, 512, 512]
    - [54, 10277.3]
  - - [112, 224, 36, 512, 112, 112, 112, 224]
    - [22, 6744.78]
  - - [128, 128, 36, 49, 128, 128, 128, 128]
    - [28, 2716.29]
  - - [512, 512, 36, 4, 512, 512, 512, 512]
    - [56, 1156.52]
  - - [35, 96, 64, 4235, 35, 35, 35, 96]
    - [17, 4631.28]
  - - [192, 384, 64, 450, 192, 192, 192, 384]
    - [8, 9372.2]
  - - [256, 256, 36, 1024, 256, 256, 256, 256]
    - [79, 9346.64]
  - - [112, 224, 64, 1152, 112, 112, 112, 224]
    - [22, 7523.95]
  - - [256, 512, 64, 400, 256, 256, 256, 512]
    - [41, 9597.95]
  - - [149, 32, 36, 19072, 149, 149, 149, 32]
    - [86, 5811.8]
  - - [128, 256, 36, 6272, 128, 128, 128, 256]
    - [22, 8754.68]
  - - [128, 192, 36, 1568, 128, 128, 128, 192]
    - [47, 8195.1]
  - - [256, 256, 36, 512, 256, 256, 256, 256]
    - [79, 9074.22]
  - - [256, 256, 64, 112, 256, 256, 256, 256]
    - [79, 8305.55]
  - - [512, 512, 64, 18, 512, 512, 512, 512]
    - [72, 4324.02]
  - - [256, 256, 64, 18, 256, 256, 256, 256]
    - [35, 3547.81]
  - - [256, 256, 64, 1568, 256, 256, 256, 256]
    - [44, 10141.7]
  - - [64, 96, 36, 1568, 64, 64, 64, 96]
    - [65, 6805.66]
  - - [384, 256, 36, 4096, 384, 384, 384, 256]
    - [79, 9311.1]
  - - [256, 512, 64, 800, 256, 256, 256, 512]
    - [54, 9998.35]
  - - [256, 384, 36, 2048, 256, 256, 256, 384]
    - [79, 9285.34]
  - - [3, 64, 36, 200704, 3, 3, 3, 64]
    - [61, 547.375]
  - - [384, 384, 64, 2304, 384, 384, 384, 384]
    - [2, 9901.68]
  - - [160, 320, 64, 128, 160, 160, 160, 320]
    - [38, 7113.81]
  - - [512, 512, 36, 528, 512, 512, 512, 512]
    - [8, 9567.65]
  - - [160, 320, 36, 128, 160, 160, 160, 320]
    - [39, 6411.13]
  - - [96, 96, 64, 800, 96, 96, 96, 96]
    - [47, 7690.01]
  - - [256, 512, 36, 49, 256, 256, 256, 512]
    - [35, 6721.25]
  - - [384, 384, 64, 450, 384, 384, 384, 384]
    - [8, 9523.53]
  - - [3, 64, 64, 23104, 3, 3, 3, 64]
    - [60, 801.621]
  - - [256, 256, 64, 3200, 256, 256, 256, 256]
    - [44, 10300.4]
  - - [128, 192, 36, 512, 128, 128, 128, 192]
    - [22, 7499.75]
  - - [192, 192, 64, 288, 192, 192, 192, 192]
    - [79, 8774.24]
  - - [96, 208, 64, 242, 96, 96, 96, 208]
    - [39, 5901.99]
  - - [256, 16, 36, 3200, 256, 256, 256, 16]
    - [68, 3807.77]
  - - [512, 512, 64, 8, 512, 512, 512, 512]
    - [46, 2379.75]
  - - [64, 128, 64, 5776, 64, 64, 64, 128]
    - [19, 9332.74]
  - - [512, 512, 64, 288, 512, 512, 512, 512]
    - [8, 9521.99]
  - - [256, 16, 36, 32, 256, 256, 256, 16]
    - [64, 766.005]
  - - [128, 192, 64, 288, 128, 128, 128, 192]
    - [79, 8527.58]
  - - [32, 64, 64, 640, 32, 32, 32, 64]
    - [47, 4660.34]
  - - [64, 64, 36, 392, 64, 64, 64, 64]
    - [47, 3686.4]
  - - [384, 384, 36, 1024, 384, 384, 384, 384]
    - [13, 9282.48]
  - - [64, 64, 36, 11552, 64, 64, 64, 64]
    - [77, 5904.78]
  - - [96, 128, 36, 6272, 96, 96, 96, 128]
    - [67, 8350.99]
  - - [128, 256, 36, 16, 128, 128, 128, 256]
    - [49, 2144.81]
  - - [256, 256, 64, 288, 256, 256, 256, 256]
    - [79, 9140.13]
  - - [64, 64, 64, 1652, 64, 64, 64, 64]
    - [65, 7766.53]
  - - [256, 384, 36, 1024, 256, 256, 256, 384]
    - [13, 9203.27]
  - - [96, 128, 64, 3200, 96, 96, 96, 128]
    - [82, 8866.2]
  - - [256, 324, 36, 3200, 256, 256, 256, 324]
    - [21, 8194.25]
  - - [128, 192, 64, 800, 128, 128, 128, 192]
    - [79, 9198.03]
  - - [64, 128, 64, 10, 64, 64, 64, 128]
    - [20, 851.117]
  - - [96, 208, 64, 288, 96, 96, 96, 208]
    - [47, 6667.58]
  - - [64, 96, 36, 2592, 64, 64, 64, 96]
    - [29, 7216.88]
  - - [64, 128, 64, 160, 64, 64, 64, 128]
    - [58, 5190.97]
  - - [192, 384, 64, 512, 192, 192, 192, 384]
    - [8, 9446.04]
  - - [64, 64, 36, 6272, 64, 64, 64, 64]
    - [17, 6212.01]
  - - [512, 24, 36, 288, 512, 512, 512, 24]
    - [14, 3922.47]
  - - [128, 128, 64, 1568, 128, 128, 128, 128]
    - [8, 9037.86]
  - - [112, 224, 64, 242, 112, 112, 112, 224]
    - [78, 6399.26]
  - - [64, 192, 36, 8192, 64, 64, 64, 192]
    - [79, 7990.56]
  - - [128, 256, 64, 1600, 128, 128, 128, 256]
    - [44, 10010.3]
  - - [32, 32, 64, 20000, 32, 32, 32, 32]
    - [12, 4378.41]
  - - [160, 192, 64, 288, 160, 160, 160, 192]
    - [39, 7803.63]
  - - [512, 24, 64, 128, 512, 512, 512, 24]
    - [0, 3733.8]
  - - [512, 512, 36, 32, 512, 512, 512, 512]
    - [35, 5935.34]
  - - [3, 64, 36, 100352, 3, 3, 3, 64]
    - [32, 542.783]
  - - [3, 64, 64, 1444, 3, 3, 3, 64]
    - [61, 674.159]
  - - [512, 512, 36, 3136, 512, 512, 512, 512]
    - [2, 9921.1]
  - - [128, 256, 64, 6400, 128, 128, 128, 256]
    - [62, 10349.3]
  - - [256, 256, 36, 2048, 256, 256, 256, 256]
    - [79, 9518.99]
  - - [128, 160, 64, 288, 128, 128, 128, 160]
    - [22, 7549.75]
  - - [256, 256, 64, 6400, 256, 256, 256, 256]
    - [44, 10392.6]
  - - [32, 64, 64, 20000, 32, 32, 32, 64]
    - [70, 6493.86]
  - - [256, 256, 36, 1680, 256, 256, 256, 256]
    - [19, 9513.29]
  - - [144, 288, 36, 2048, 144, 144, 144, 288]
    - [67, 7660.97]
  - - [128, 128, 64, 210, 128, 128, 128, 128]
    - [79, 7094.1]
  - - [192, 384, 36, 2048, 192, 192, 192, 384]
    - [8, 8818.65]
  - - [256, 256, 64, 144, 256, 256, 256, 256]
    - [79, 8608.61]
  - - [384, 384, 36, 4096, 384, 384, 384, 384]
    - [13, 9356.94]
  - - [160, 320, 64, 1152, 160, 160, 160, 320]
    - [39, 8749.48]
  - - [384, 256, 36, 2048, 384, 384, 384, 256]
    - [79, 9279.63]
  - - [256, 512, 36, 392, 256, 256, 256, 512]
    - [79, 9252.14]
  - - [256, 512, 64, 50, 256, 256, 256, 512]
    - [35, 7511.29]
  - - [73, 192, 36, 23360, 73, 73, 73, 192]
    - [83, 5802.93]
  - - [3, 64, 36, 50176, 3, 3, 3, 64]
    - [32, 542.037]
  - - [384, 384, 36, 2048, 384, 384, 384, 384]
    - [8, 9325.8]
  - - [256, 384, 64, 450, 256, 256, 256, 384]
    - [54, 9528.66]
  - - [192, 320, 64, 128, 192, 192, 192, 320]
    - [13, 8399.81]
  - - [128, 256, 36, 32, 128, 128, 128, 256]
    - [28, 3276.8]
  - - [160, 192, 36, 512, 160, 160, 160, 192]
    - [67, 7752.34]
  - - [512, 512, 64, 256, 512, 512, 512, 512]
    - [19, 9473.64]
  - - [256, 512, 64, 32, 256, 256, 256, 512]
    - [57, 6391.32]
  - - [384, 384, 64, 576, 384, 384, 384, 384]
    - [8, 9614.79]
  - - [64, 64, 64, 648, 64, 64, 64, 64]
    - [65, 6282.15]
  - - [512, 486, 36, 288, 512, 512, 512, 486]
    - [79, 8624.93]
  - - [32, 64, 36, 1440, 32, 32, 32, 64]
    - [17, 3961.5]
  - - [144, 288, 64, 242, 144, 144, 144, 288]
    - [39, 6347.02]
  - - [128, 192, 36, 2048, 128, 128, 128, 192]
    - [80, 8284.29]
  - - [384, 256, 64, 576, 384, 384, 384, 256]
    - [44, 9775.24]
  - - [512, 512, 36, 64, 512, 512, 512, 512]
    - [15, 7791.28]
  - - [448, 384, 64, 128, 448, 448, 448, 384]
    - [8, 9132.23]
  - - [64, 128, 64, 722, 64, 64, 64, 128]
    - [58, 8047.11]
  - - [144, 288, 64, 288, 144, 144, 144, 288]
    - [67, 6859.4]
  - - [512, 512, 64, 224, 512, 512, 512, 512]
    - [79, 9427.29]
  - - [112, 224, 64, 288, 112, 112, 112, 224]
    - [78, 6736.92]
  - - [384, 384, 64, 1152, 384, 384, 384, 384]
    - [2, 9820.46]
  - - [448, 384, 36, 128, 448, 448, 448, 384]
    - [79, 8761.31]
  - - [64, 64, 64, 100, 64, 64, 64, 64]
    - [25, 2708.1]
  - - [256, 486, 36, 128, 256, 256, 256, 486]
    - [51, 7640.04]
  - - [64, 96, 64, 4608, 64, 64, 64, 96]
    - [80, 8351.49]
  - - [16, 32, 64, 160, 16, 16, 16, 32]
    - [4, 736.36]
  - - [64, 192, 36, 6272, 64, 64, 64, 192]
    - [80, 8041.19]
  - - [64, 64, 64, 200, 64, 64, 64, 64]
    - [33, 3924.31]
  - - [256, 256, 36, 800, 256, 256, 256, 256]
    - [79, 9299.55]
  - - [64, 128, 36, 6272, 64, 64, 64, 128]
    - [77, 6816.36]
  - - [32, 64, 64, 40, 32, 32, 32, 64]
    - [24, 885.622]
  - - [256, 16, 64, 32, 256, 256, 256, 16]
    - [74, 1205.26]
  - - [192, 384, 36, 800, 192, 192, 192, 384]
    - [13, 8673.88]
  - - [128, 128, 36, 3200, 128, 128, 128, 128]
    - [47, 8538.89]
  - - [256, 256, 36, 256, 256, 256, 256, 256]
    - [19, 8454.36]
  - - [192, 384, 64, 1152, 192, 192, 192, 384]
    - [8, 9589.01]
  - - [128, 256, 64, 200, 128, 128, 128, 256]
    - [18, 8141.12]
  - - [64, 96, 64, 1152, 64, 64, 64, 96]
    - [47, 7620.88]
  - - [128, 128, 36, 392, 128, 128, 128, 128]
    - [22, 6175.51]
  - - [80, 192, 36, 10368, 80, 80, 80, 192]
    - [70, 6497.16]
  - - [224, 224, 36, 128, 224, 224, 224, 224]
    - [80, 5826.89]
  - - [512, 512, 64, 28, 512, 512, 512, 512]
    - [35, 5728.81]
  - - [256, 16, 64, 1568, 256, 256, 256, 16]
    - [50, 4637.2]
  - - [144, 288, 64, 1152, 144, 144, 144, 288]
    - [67, 7784.24]
  - - [256, 256, 64, 576, 256, 256, 256, 256]
    - [44, 9596.12]
  - - [64, 128, 36, 784, 64, 64, 64, 128]
    - [80, 6058.99]
  - - [256, 24, 36, 128, 256, 256, 256, 24]
    - [14, 2239.84]
  - - [256, 256, 64, 2304, 256, 256, 256, 256]
    - [44, 10225.7]
  - - [192, 384, 36, 512, 192, 192, 192, 384]
    - [79, 8549.03]
  - - [16, 32, 64, 2560, 16, 16, 16, 32]
    - [32, 2153.13]
  - - [256, 512, 36, 32, 256, 256, 256, 512]
    - [57, 5702.23]
  - - [512, 512, 64, 128, 512, 512, 512, 512]
    - [79, 9084.11]
  - - [128, 128, 64, 200, 128, 128, 128, 128]
    - [16, 6971.91]
  - - [512, 512, 64, 32, 512, 512, 512, 512]
    - [28, 6248.5]
  - - [128, 256, 36, 196, 128, 128, 128, 256]
    - [28, 6628.76]
  - - [8, 384, 64, 6600, 8, 8, 8, 384]
    - [60, 2733.89]
  - - [149, 32, 64, 8195, 149, 149, 149, 32]
    - [22, 6050.91]
  - - [35, 96, 64, 6160, 35, 35, 35, 96]
    - [67, 4689.35]
  - - [64, 64, 36, 1760, 64, 64, 64, 64]
    - [17, 5622.24]
- null
