src/Tensile/data/Configs/miopen/archives/bert/2020-07-14/exact/vega20_Cijk_Alik_Bljk_SB.yaml
- {MinimumRequiredVersion: 4.21.0}
- vega20
- gfx906
- [Device 66a0, Device 66a1, Device 66a7, Device 66af, Vega 20]
    SolutionIndex: 0
    SolutionNameMin: Cijk_Alik_Bljk_SB_MT64x64x16_SE_GRVW4_GSU1_LRVW4_TT4_4_VW4_WG16_16_1_WGM1
    SolutionIndex: 1
    SolutionNameMin: Cijk_Alik_Bljk_SB_MT64x64x16_SE_GRVW4_GSU1_LRVW4_TT4_4_VW4_WG16_16_1_WGM8
    SolutionIndex: 2
    SolutionNameMin: Cijk_Alik_Bljk_SB_MT64x128x16_SE_GRVW4_GSU1_LRVW4_TT4_8_VW4_WG16_16_1_WGM1
    SolutionIndex: 3
    SolutionNameMin: Cijk_Alik_Bljk_SB_MT128x128x16_SE_GRVW4_GSU1_LRVW4_TT8_8_VW4_WG16_16_1_WGM1
    SolutionIndex: 4
    SolutionNameMin: Cijk_Alik_Bljk_SB_MT128x128x16_SE_GRVW4_GSU1_LRVW4_TT8_8_VW4_WG16_16_1_WGM8
    SolutionIndex: 5
    SolutionNameMin: Cijk_Alik_Bljk_SB_MT64x64x32_SE_GRVW4_GSU1_LRVW4_TT4_8_VW4_WG16_8_2_WGM1
    SolutionIndex: 6
    SolutionNameMin: Cijk_Alik_Bljk_SB_MT64x64x32_SE_GRVW4_GSU1_LRVW4_TT4_8_VW4_WG16_8_2_WGM8
    SolutionIndex: 7
    SolutionNameMin: Cijk_Alik_Bljk_SB_MT64x64x16_SE_GRVW4_GSU1_LRVW4_TT8_4_VW4_WG8_16_2_WGM8
    SolutionIndex: 8
    SolutionNameMin: Cijk_Alik_Bljk_SB_MT64x64x32_SE_GRVW4_GSU1_LRVW4_TT8_4_VW4_WG8_16_2_WGM8
    SolutionIndex: 9
    SolutionNameMin: Cijk_Alik_Bljk_SB_MT32x32x32_SE_GRVW4_GSU1_LRVW4_TT4_4_VW4_WG8_8_4_WGM1
    SolutionIndex: 10
    SolutionNameMin: Cijk_Alik_Bljk_SB_MT32x32x32_SE_GRVW4_GSU1_LRVW4_TT4_4_VW4_WG8_8_4_WGM8
    SolutionIndex: 11
    SolutionNameMin: Cijk_Alik_Bljk_SB_MT32x32x16_SE_GRVW2_GSU1_LRVW2_TT2_2_VW2_WG16_16_1_WGM1
- - - [512, 512, 128, 64, 512, 512, 64, 64]
    - [0, 10635.3]
  - - [512, 512, 192, 64, 512, 512, 64, 64]
    - [0, 10882.5]
  - - [64, 128, 1312, 128, 64, 64, 128, 128]
    - [6, 8065.97]
  - - [128, 128, 1312, 64, 128, 128, 64, 64]
    - [1, 9335.86]
  - - [128, 128, 1280, 64, 128, 128, 64, 64]
    - [1, 9300.01]
  - - [64, 128, 1280, 128, 64, 64, 128, 128]
    - [5, 8027.38]
  - - [64, 128, 1024, 128, 64, 64, 128, 128]
    - [8, 7885.88]
  - - [128, 128, 1024, 64, 128, 128, 64, 64]
    - [0, 9243.65]
  - - [64, 128, 512, 128, 64, 64, 128, 128]
    - [0, 7162.1]
  - - [128, 128, 512, 64, 128, 128, 64, 64]
    - [1, 8912.2]
  - - [64, 512, 128, 512, 64, 64, 512, 512]
    - [7, 8698.49]
  - - [64, 512, 192, 512, 64, 64, 512, 512]
    - [5, 8659.21]
  - - [30528, 4096, 1, 1024, 30528, 30528, 1024, 1024]
    - [3, 14088.3]
  - - [1024, 4096, 1, 4096, 1024, 1024, 4096, 4096]
    - [4, 13269.2]
  - - [1024, 4096, 1, 1024, 1024, 1024, 1024, 1024]
    - [3, 13388.3]
  - - [4096, 4096, 1, 1024, 4096, 4096, 1024, 1024]
    - [3, 13727.2]
  - - [30528, 6144, 1, 1024, 30528, 30528, 1024, 1024]
    - [3, 14141.8]
  - - [4096, 6144, 1, 1024, 4096, 4096, 1024, 1024]
    - [3, 13841.0]
  - - [1024, 6144, 1, 1024, 1024, 1024, 1024, 1024]
    - [3, 13520.9]
  - - [1024, 6144, 1, 4096, 1024, 1024, 4096, 4096]
    - [3, 12979.4]
  - - [1024, 10496, 1, 4096, 1024, 1024, 4096, 4096]
    - [2, 12297.3]
  - - [30528, 10496, 1, 1024, 30528, 30528, 1024, 1024]
    - [3, 14111.9]
  - - [1024, 10496, 1, 1024, 1024, 1024, 1024, 1024]
    - [4, 12408.5]
  - - [4096, 10496, 1, 1024, 4096, 4096, 1024, 1024]
    - [3, 13577.1]
  - - [30528, 10240, 1, 1024, 30528, 30528, 1024, 1024]
    - [3, 14143.5]
  - - [1024, 10240, 1, 1024, 1024, 1024, 1024, 1024]
    - [3, 13590.3]
  - - [4096, 10240, 1, 1024, 4096, 4096, 1024, 1024]
    - [3, 13903.9]
  - - [1024, 10240, 1, 4096, 1024, 1024, 4096, 4096]
    - [3, 13260.7]
  - - [30528, 8192, 1, 1024, 30528, 30528, 1024, 1024]
    - [3, 14184.8]
  - - [4096, 8192, 1, 1024, 4096, 4096, 1024, 1024]
    - [3, 13861.0]
  - - [1024, 8192, 1, 4096, 1024, 1024, 4096, 4096]
    - [4, 13210.4]
  - - [1024, 8192, 1, 1024, 1024, 1024, 1024, 1024]
    - [4, 13519.8]
  - - [2, 8, 1, 1024, 2, 2, 1024, 1024]
    - [11, 0.0]
  - - [2, 12, 1, 1024, 2, 2, 1024, 1024]
    - [11, 0.0]
  - - [2, 82, 1, 1024, 2, 2, 1024, 1024]
    - [11, 0.0]
  - - [2, 80, 1, 1024, 2, 2, 1024, 1024]
    - [11, 0.0]
  - - [2, 64, 1, 1024, 2, 2, 1024, 1024]
    - [11, 0.0]
  - - [2, 32, 1, 1024, 2, 2, 1024, 1024]
    - [11, 0.0]
  - - [1024, 8, 1, 1024, 1024, 1024, 1024, 1024]
    - [9, 463.972]
  - - [1024, 12, 1, 1024, 1024, 1024, 1024, 1024]
    - [10, 741.917]
  - - [1024, 82, 1, 1024, 1024, 1024, 1024, 1024]
    - [10, 3582.63]
  - - [1024, 80, 1, 1024, 1024, 1024, 1024, 1024]
    - [10, 3653.57]
  - - [1024, 64, 1, 1024, 1024, 1024, 1024, 1024]
    - [10, 3744.91]
  - - [1024, 32, 1, 1024, 1024, 1024, 1024, 1024]
    - [10, 1823.61]
- null
