Tensile/Configs/miopen/archives/dlrm/2020-07-08/exact/arcturus_Cijk_Ailk_Bjlk_SB.yaml
- {MinimumRequiredVersion: 4.20.0}
- arcturus
- gfx908
- [Device 7380, Device 7388, Device 738c, Device 7390]
- - - [256, 32768, 1, 1, 288, 288, 288, 32768]
    - [0, 1.173]
  - - [1024, 1024, 1, 32768, 1056, 1056, 1024, 1024]
    - [2, 55.336]
  - - [256, 128, 1, 32768, 256, 256, 288, 160]
    - [6, 36.999]
  - - [512, 256, 1, 32768, 512, 512, 544, 288]
    - [5, 63.381]
  - - [1024, 512, 1, 32768, 1056, 1056, 1024, 544]
    - [4, 68.992]
  - - [479, 1024, 1, 32768, 512, 512, 512, 1056]
    - [3, 65.858]
  - - [64, 64, 1, 64, 64, 64, 64, 64]
    - [7, 0.044]
  - - [128, 128, 1, 128, 128, 128, 128, 128]
    - [9, 0.271]
  - - [256, 256, 1, 256, 256, 256, 256, 256]
    - [8, 2.113]
  - - [448, 448, 1, 448, 448, 448, 448, 448]
    - [10, 8.626]
  - - [13, 512, 1, 32768, 45, 45, 77, 544]
    - [11, 11.267]
  - - [256, 1, 1, 32768, 256, 256, 256, 1]
    - [12, 0.611]
- null
