src/Tensile/data/Configs/miopen/archives/bert/2020-04-15/exact/arcturus_Cijk_Ailk_Bjlk_SB.yaml
- {MinimumRequiredVersion: 4.17.0}
- arcturus
- gfx908
- [Device 7380, Device 7388, Device 738c, Device 7390, Device 731f]
    SolutionIndex: 0
    SolutionNameMin: Cijk_Ailk_Bjlk_SB_MT64x128x8_MI32x32x1x2_SE_FL1_ONLL0_PLR0_SNLL1_TT1_32_USFGRO0
    SolutionIndex: 1
    SolutionNameMin: Cijk_Ailk_Bjlk_SB_MT128x128x8_MI32x32x1x2_SE_FL1_ONLL0_PLR0_SNLL0_TT2_32_USFGRO1
    SolutionIndex: 2
    SolutionNameMin: Cijk_Ailk_Bjlk_SB_MT128x128x8_MI32x32x1x2_SE_FL1_ONLL1_PLR0_SNLL0_TT2_32_USFGRO1
    SolutionIndex: 3
    SolutionNameMin: Cijk_Ailk_Bjlk_SB_MT128x128x32_MI32x32x1x2_SE_FL0_ONLL0_PLR1_SNLL1_TT2_32_USFGRO0
    SolutionIndex: 4
    SolutionNameMin: Cijk_Ailk_Bjlk_SB_MT128x128x32_MI32x32x1x2_SE_FL0_ONLL0_PLR1_SNLL0_TT2_32_USFGRO0
    SolutionIndex: 5
    SolutionNameMin: Cijk_Ailk_Bjlk_SB_MT128x128x32_MI32x32x1x2_SE_FL0_ONLL1_PLR1_SNLL0_TT2_32_USFGRO0
    SolutionIndex: 6
    SolutionNameMin: Cijk_Ailk_Bjlk_SB_MT128x128x32_MI32x32x1x2_SE_FL1_ONLL1_PLR1_SNLL1_TT2_32_USFGRO0
    SolutionIndex: 7
    SolutionNameMin: Cijk_Ailk_Bjlk_SB_MT32x128x8_MI32x32x2x1_SE_FL0_ONLL0_PLR0_SNLL1_TT1_32_USFGRO0
    SolutionIndex: 8
    SolutionNameMin: Cijk_Ailk_Bjlk_SB_MT32x128x8_MI32x32x2x1_SE_FL0_ONLL0_PLR0_SNLL0_TT1_32_USFGRO0
    SolutionIndex: 9
    SolutionNameMin: Cijk_Ailk_Bjlk_SB_MT256x64x8_MI16x16x1x4_SE_FL0_ONLL0_PLR1_SNLL0_TT4_16_USFGRO0
    SolutionIndex: 10
    SolutionNameMin: Cijk_Ailk_Bjlk_SB_MT128x128x8_MI16x16x1x4_SE_FL1_ONLL1_PLR1_SNLL0_TT2_32_USFGRO1
    SolutionIndex: 11
    SolutionNameMin: Cijk_Ailk_Bjlk_SB_MT64x64x16_MI16x16x4x1_SE_FL0_ONLL1_PLR0_SNLL0_TT4_16_USFGRO1
    SolutionIndex: 12
    SolutionNameMin: Cijk_Ailk_Bjlk_SB_MT64x64x16_MI16x16x4x1_SE_FL1_ONLL1_PLR0_SNLL0_TT4_16_USFGRO1
    SolutionIndex: 13
    SolutionNameMin: Cijk_Ailk_Bjlk_SB_MT64x64x8_MI16x16x4x1_SE_FL0_ONLL0_PLR1_SNLL0_TT4_16_USFGRO0
    SolutionIndex: 14
    SolutionNameMin: Cijk_Ailk_Bjlk_SB_MT64x64x32_MI16x16x4x1_SE_FL0_ONLL1_PLR1_SNLL0_TT4_16_USFGRO1
- - - [1024, 2, 1, 32, 1024, 1024, 1024, 2]
    - [8, 0.03]
  - - [1024, 30528, 1, 4096, 1024, 1024, 1024, 30528]
    - [1, 92.431]
  - - [1024, 1024, 1, 4096, 1024, 1024, 1024, 1024]
    - [6, 44.497]
  - - [1024, 1024, 1, 32, 1024, 1024, 1024, 1024]
    - [12, 11.15]
  - - [4096, 1024, 1, 4096, 4096, 4096, 4096, 1024]
    - [5, 59.622]
  - - [1024, 4096, 1, 4096, 1024, 1024, 1024, 4096]
    - [4, 59.814]
  - - [1024, 1024, 1, 2048, 1024, 1024, 1024, 1024]
    - [3, 42.212]
  - - [1024, 2, 1, 4, 1024, 1024, 1024, 2]
    - [7, 0.005]
  - - [4096, 1024, 1, 2048, 4096, 4096, 4096, 1024]
    - [5, 57.291]
  - - [1024, 30528, 1, 2048, 1024, 1024, 1024, 30528]
    - [2, 89.413]
  - - [1024, 1024, 1, 4, 1024, 1024, 1024, 1024]
    - [13, 1.654]
  - - [1024, 4096, 1, 2048, 1024, 1024, 1024, 4096]
    - [10, 57.755]
  - - [128, 64, 512, 128, 128, 128, 128, 64]
    - [14, 28.436]
  - - [64, 128, 512, 128, 64, 64, 64, 128]
    - [11, 30.049]
  - - [512, 64, 64, 512, 512, 512, 512, 64]
    - [9, 36.29]
  - - [64, 512, 64, 512, 64, 64, 64, 512]
    - [0, 45.315]
- null
