src/Tensile/data/Configs/miopen/archives/bert/2020-04-15/exact/arcturus_Cijk_Alik_Bljk_SB.yaml
- {MinimumRequiredVersion: 4.17.0}
- arcturus
- gfx908
- [Device 7380, Device 7388, Device 738c, Device 7390, Device 731f]
    SolutionIndex: 0
    SolutionNameMin: Cijk_Alik_Bljk_SB_MT64x128x32_MI32x32x1x2_SE_FL1_GRVW2_LPA1_LPB1_ONLL0_PLR1_SNLL0_TT1_32_USFGRO0
    SolutionIndex: 1
    SolutionNameMin: Cijk_Alik_Bljk_SB_MT64x128x32_MI32x32x1x2_SE_FL1_GRVW4_LPA1_LPB1_ONLL0_PLR1_SNLL0_TT1_32_USFGRO1
    SolutionIndex: 2
    SolutionNameMin: Cijk_Alik_Bljk_SB_MT32x128x32_MI32x32x2x1_SE_FL0_GRVW4_LPA0_LPB1_ONLL0_PLR0_SNLL1_TT1_32_USFGRO0
    SolutionIndex: 3
    SolutionNameMin: Cijk_Alik_Bljk_SB_MT32x128x32_MI32x32x2x1_SE_FL0_GRVW4_LPA1_LPB1_ONLL0_PLR1_SNLL1_TT1_32_USFGRO1
    SolutionIndex: 4
    SolutionNameMin: Cijk_Alik_Bljk_SB_MT32x128x32_MI32x32x2x1_SE_FL0_GRVW4_LPA1_LPB1_ONLL0_PLR1_SNLL0_TT1_32_USFGRO1
    SolutionIndex: 5
    SolutionNameMin: Cijk_Alik_Bljk_SB_MT32x128x32_MI32x32x2x1_SE_FL0_GRVW4_LPA1_LPB1_ONLL1_PLR1_SNLL1_TT1_32_USFGRO1
    SolutionIndex: 6
    SolutionNameMin: Cijk_Alik_Bljk_SB_MT64x128x16_MI32x32x2x1_SE_FL1_GRVW4_LPA0_LPB1_ONLL1_PLR0_SNLL1_TT2_32_USFGRO1
    SolutionIndex: 7
    SolutionNameMin: Cijk_Alik_Bljk_SB_MT128x128x32_MI32x32x2x1_SE_FL0_GRVW4_LPA0_LPB0_ONLL1_PLR1_SNLL0_TT4_32_USFGRO1
    SolutionIndex: 8
    SolutionNameMin: Cijk_Alik_Bljk_SB_MT128x128x16_MI16x16x1x4_SE_FL0_GRVW4_LPA0_LPB0_ONLL0_PLR1_SNLL1_TT2_32_USFGRO0
    SolutionIndex: 9
    SolutionNameMin: Cijk_Alik_Bljk_SB_MT128x128x16_MI16x16x1x4_SE_FL0_GRVW4_LPA0_LPB0_ONLL1_PLR1_SNLL1_TT2_32_USFGRO0
    SolutionIndex: 10
    SolutionNameMin: Cijk_Alik_Bljk_SB_MT128x128x16_MI16x16x1x4_SE_FL0_GRVW4_LPA0_LPB0_ONLL1_PLR1_SNLL1_TT2_32_USFGRO1
    SolutionIndex: 11
    SolutionNameMin: Cijk_Alik_Bljk_SB_MT128x128x16_MI16x16x1x4_SE_FL1_GRVW4_LPA0_LPB0_ONLL1_PLR1_SNLL0_TT2_32_USFGRO0
    SolutionIndex: 12
    SolutionNameMin: Cijk_Alik_Bljk_SB_MT64x64x32_MI16x16x4x1_SE_FL1_GRVW4_LPA0_LPB1_ONLL0_PLR1_SNLL0_TT4_16_USFGRO0
    SolutionIndex: 13
    SolutionNameMin: Cijk_Alik_Bljk_SB_MT64x64x32_MI16x16x4x1_SE_FL1_GRVW4_LPA0_LPB0_ONLL0_PLR1_SNLL0_TT4_16_USFGRO1
    SolutionIndex: 14
    SolutionNameMin: Cijk_Alik_Bljk_SB_MT32x128x32_MI16x16x4x1_SE_FL1_GRVW4_LPA1_LPB1_ONLL0_PLR1_SNLL0_TT2_32_USFGRO1
- - - [1024, 4096, 1, 1024, 1024, 1024, 1024, 1024]
    - [6, 57.015]
  - - [4096, 4096, 1, 1024, 4096, 4096, 1024, 1024]
    - [11, 76.87]
  - - [1024, 4096, 1, 4096, 1024, 1024, 4096, 4096]
    - [7, 53.227]
  - - [1024, 32, 1, 1024, 1024, 1024, 1024, 1024]
    - [5, 3.894]
  - - [30528, 4096, 1, 1024, 30528, 30528, 1024, 1024]
    - [9, 85.416]
  - - [2, 32, 1, 1024, 2, 2, 1024, 1024]
    - [2, 0.008]
  - - [1024, 2048, 1, 1024, 1024, 1024, 1024, 1024]
    - [1, 49.846]
  - - [4096, 2048, 1, 1024, 4096, 4096, 1024, 1024]
    - [8, 68.405]
  - - [1024, 4, 1, 1024, 1024, 1024, 1024, 1024]
    - [3, 0.533]
  - - [2, 4, 1, 1024, 2, 2, 1024, 1024]
    - [4, 0.001]
  - - [1024, 2048, 1, 4096, 1024, 1024, 4096, 4096]
    - [0, 48.071]
  - - [30528, 2048, 1, 1024, 30528, 30528, 1024, 1024]
    - [10, 85.201]
  - - [128, 128, 512, 64, 128, 128, 64, 64]
    - [13, 28.58]
  - - [64, 128, 512, 128, 64, 64, 128, 128]
    - [14, 23.375]
  - - [64, 512, 64, 512, 64, 64, 512, 512]
    - [12, 30.128]
  - - [512, 512, 64, 64, 512, 512, 64, 64]
    - [8, 36.019]
- null
