test_dir/py38/lib/python3.6/site-packages/Tensile/Configs/miopen/archives/bert/2020-07-14/exact/vega20_Cijk_Ailk_Bjlk_SB.yaml
- {MinimumRequiredVersion: 4.21.0}
- vega20
- gfx906
- [Device 66a0, Device 66a1, Device 66a7, Device 66af, Vega 20]
    SolutionIndex: 0
    SolutionNameMin: Cijk_Ailk_Bjlk_SB_MT64x64x16_SE_GRVW4_GSU1_LRVW4_TT4_4_VW4_WG16_16_1_WGM1
    SolutionIndex: 1
    SolutionNameMin: Cijk_Ailk_Bjlk_SB_MT64x64x16_SE_GRVW4_GSU1_LRVW4_TT4_4_VW4_WG16_16_1_WGM8
    SolutionIndex: 2
    SolutionNameMin: Cijk_Ailk_Bjlk_SB_MT128x64x16_SE_GRVW4_GSU1_LRVW4_TT8_4_VW4_WG16_16_1_WGM1
    SolutionIndex: 3
    SolutionNameMin: Cijk_Ailk_Bjlk_SB_MT128x64x16_SE_GRVW4_GSU1_LRVW4_TT8_4_VW4_WG16_16_1_WGM8
    SolutionIndex: 4
    SolutionNameMin: Cijk_Ailk_Bjlk_SB_MT128x128x16_SE_GRVW4_GSU1_LRVW4_TT8_8_VW4_WG16_16_1_WGM1
    SolutionIndex: 5
    SolutionNameMin: Cijk_Ailk_Bjlk_SB_MT128x128x16_SE_GRVW4_GSU1_LRVW4_TT8_8_VW4_WG16_16_1_WGM8
- - - [64, 128, 1312, 128, 64, 64, 64, 128]
    - [1, 11094.6]
  - - [128, 64, 1312, 128, 128, 128, 128, 64]
    - [2, 9917.33]
  - - [64, 128, 1280, 128, 64, 64, 64, 128]
    - [1, 11305.4]
  - - [128, 64, 1280, 128, 128, 128, 128, 64]
    - [3, 10112.8]
  - - [128, 64, 1024, 128, 128, 128, 128, 64]
    - [3, 9662.9]
  - - [64, 128, 1024, 128, 64, 64, 64, 128]
    - [0, 10859.0]
  - - [64, 128, 512, 128, 64, 64, 64, 128]
    - [1, 10183.4]
  - - [128, 64, 512, 128, 128, 128, 128, 64]
    - [1, 9020.01]
  - - [64, 512, 128, 512, 64, 64, 64, 512]
    - [0, 12644.2]
  - - [512, 64, 128, 512, 512, 512, 512, 64]
    - [2, 12102.6]
  - - [64, 512, 192, 512, 64, 64, 64, 512]
    - [1, 13005.6]
  - - [512, 64, 192, 512, 512, 512, 512, 64]
    - [3, 12340.0]
  - - [30528, 1024, 1, 4096, 30528, 30528, 30528, 1024]
    - [5, 14235.7]
  - - [4096, 1024, 1, 4096, 4096, 4096, 4096, 1024]
    - [4, 14029.4]
  - - [1024, 1024, 1, 4096, 1024, 1024, 1024, 1024]
    - [2, 13664.3]
  - - [1024, 1024, 1, 8, 1024, 1024, 1024, 1024]
    - [3, 1416.99]
  - - [1024, 4096, 1, 4096, 1024, 1024, 1024, 4096]
    - [5, 14031.3]
  - - [1024, 4096, 1, 6144, 1024, 1024, 1024, 4096]
    - [4, 14174.8]
  - - [30528, 1024, 1, 6144, 30528, 30528, 30528, 1024]
    - [5, 14277.4]
  - - [4096, 1024, 1, 6144, 4096, 4096, 4096, 1024]
    - [4, 14119.5]
  - - [1024, 1024, 1, 12, 1024, 1024, 1024, 1024]
    - [1, 1872.46]
  - - [1024, 1024, 1, 6144, 1024, 1024, 1024, 1024]
    - [2, 13765.9]
  - - [4096, 1024, 1, 10496, 4096, 4096, 4096, 1024]
    - [5, 14250.4]
  - - [1024, 1024, 1, 10496, 1024, 1024, 1024, 1024]
    - [3, 13923.0]
  - - [1024, 4096, 1, 10496, 1024, 1024, 1024, 4096]
    - [5, 14223.1]
  - - [30528, 1024, 1, 10496, 30528, 30528, 30528, 1024]
    - [5, 14282.8]
  - - [1024, 1024, 1, 82, 1024, 1024, 1024, 1024]
    - [1, 6634.51]
  - - [30528, 1024, 1, 10240, 30528, 30528, 30528, 1024]
    - [5, 14300.9]
  - - [4096, 1024, 1, 10240, 4096, 4096, 4096, 1024]
    - [4, 14220.2]
  - - [1024, 1024, 1, 10240, 1024, 1024, 1024, 1024]
    - [3, 13937.5]
  - - [1024, 1024, 1, 80, 1024, 1024, 1024, 1024]
    - [1, 7182.03]
  - - [1024, 4096, 1, 10240, 1024, 1024, 1024, 4096]
    - [5, 14233.8]
  - - [4096, 1024, 1, 8192, 4096, 4096, 4096, 1024]
    - [4, 14183.2]
  - - [30528, 1024, 1, 8192, 30528, 30528, 30528, 1024]
    - [5, 14278.0]
  - - [1024, 1024, 1, 8192, 1024, 1024, 1024, 1024]
    - [3, 13887.0]
  - - [1024, 1024, 1, 64, 1024, 1024, 1024, 1024]
    - [1, 6765.01]
  - - [1024, 4096, 1, 8192, 1024, 1024, 1024, 4096]
    - [4, 14217.5]
  - - [1024, 1024, 1, 32, 1024, 1024, 1024, 1024]
    - [1, 3919.91]
- null
