Tensile/Configs/miopen/archives/transformer/2020-08-31/exact/vega20_Cijk_Ailk_Bjlk_SB.yaml
- {MinimumRequiredVersion: 4.22.0}
- vega20
- gfx906
- [Device 66a0, Device 66a1, Device 66a7, Device 66af, Vega 20]
    SolutionIndex: 0
    SolutionNameMin: Cijk_Ailk_Bjlk_SB_MT64x64x16_SE_GRVW4_LRVW4_TT4_4_VW4_WG16_16_1_WGM1
    SolutionIndex: 1
    SolutionNameMin: Cijk_Ailk_Bjlk_SB_MT64x64x16_SE_GRVW4_LRVW4_TT4_4_VW4_WG16_16_1_WGM8
    SolutionIndex: 2
    SolutionNameMin: Cijk_Ailk_Bjlk_SB_MT64x64x32_SE_GRVW4_LRVW4_TT4_4_VW4_WG16_16_1_WGM8
    SolutionIndex: 3
    SolutionNameMin: Cijk_Ailk_Bjlk_SB_MT96x64x24_SE_GRVW2_LRVW2_TT6_4_VW2_WG16_16_1_WGM8
    SolutionIndex: 4
    SolutionNameMin: Cijk_Ailk_Bjlk_SB_MT64x96x16_SE_GRVW2_LRVW2_TT4_6_VW2_WG16_16_1_WGM1
    SolutionIndex: 5
    SolutionNameMin: Cijk_Ailk_Bjlk_SB_MT64x96x16_SE_GRVW2_LRVW2_TT4_6_VW2_WG16_16_1_WGM8
    SolutionIndex: 6
    SolutionNameMin: Cijk_Ailk_Bjlk_SB_MT64x96x24_SE_GRVW2_LRVW2_TT4_6_VW2_WG16_16_1_WGM8
    SolutionIndex: 7
    SolutionNameMin: Cijk_Ailk_Bjlk_SB_MT64x128x16_SE_GRVW4_LRVW4_TT4_8_VW4_WG16_16_1_WGM1
    SolutionIndex: 8
    SolutionNameMin: Cijk_Ailk_Bjlk_SB_MT64x128x16_SE_GRVW4_LRVW4_TT4_8_VW4_WG16_16_1_WGM8
    SolutionIndex: 9
    SolutionNameMin: Cijk_Ailk_Bjlk_SB_MT128x64x16_SE_GRVW4_LRVW4_TT8_4_VW4_WG16_16_1_WGM1
    SolutionIndex: 10
    SolutionNameMin: Cijk_Ailk_Bjlk_SB_MT128x64x16_SE_GRVW4_LRVW4_TT8_4_VW4_WG16_16_1_WGM8
    SolutionIndex: 11
    SolutionNameMin: Cijk_Ailk_Bjlk_SB_MT128x128x16_SE_GRVW4_LRVW4_TT8_8_VW4_WG16_16_1_WGM1
    SolutionIndex: 12
    SolutionNameMin: Cijk_Ailk_Bjlk_SB_MT128x128x16_SE_GRVW4_LRVW4_TT8_8_VW4_WG16_16_1_WGM8
    SolutionIndex: 13
    SolutionNameMin: Cijk_Ailk_Bjlk_SB_MT64x64x16_SE_GRVW4_LRVW4_TT4_8_VW4_WG16_8_2_WGM1
    SolutionIndex: 14
    SolutionNameMin: Cijk_Ailk_Bjlk_SB_MT64x64x16_SE_GRVW4_LRVW4_TT4_8_VW4_WG16_8_2_WGM8
    SolutionIndex: 15
    SolutionNameMin: Cijk_Ailk_Bjlk_SB_MT64x64x32_SE_GRVW4_LRVW4_TT4_8_VW4_WG16_8_2_WGM1
    SolutionIndex: 16
    SolutionNameMin: Cijk_Ailk_Bjlk_SB_MT64x64x32_SE_GRVW4_LRVW4_TT4_8_VW4_WG16_8_2_WGM8
    SolutionIndex: 17
    SolutionNameMin: Cijk_Ailk_Bjlk_SB_MT128x32x24_SE_GRVW4_LRVW4_TT8_4_VW4_WG16_8_2_WGM1
    SolutionIndex: 18
    SolutionNameMin: Cijk_Ailk_Bjlk_SB_MT128x32x24_SE_GRVW4_LRVW4_TT8_4_VW4_WG16_8_2_WGM8
    SolutionIndex: 19
    SolutionNameMin: Cijk_Ailk_Bjlk_SB_MT32x128x24_SE_GRVW4_LRVW4_TT4_8_VW4_WG8_16_2_WGM1
    SolutionIndex: 20
    SolutionNameMin: Cijk_Ailk_Bjlk_SB_MT32x128x24_SE_GRVW4_LRVW4_TT4_8_VW4_WG8_16_2_WGM8
    SolutionIndex: 21
    SolutionNameMin: Cijk_Ailk_Bjlk_SB_MT64x64x16_SE_GRVW4_LRVW4_TT8_4_VW4_WG8_16_2_WGM1
    SolutionIndex: 22
    SolutionNameMin: Cijk_Ailk_Bjlk_SB_MT64x64x16_SE_GRVW4_LRVW4_TT8_4_VW4_WG8_16_2_WGM8
    SolutionIndex: 23
    SolutionNameMin: Cijk_Ailk_Bjlk_SB_MT64x64x32_SE_GRVW4_LRVW4_TT8_4_VW4_WG8_16_2_WGM1
    SolutionIndex: 24
    SolutionNameMin: Cijk_Ailk_Bjlk_SB_MT64x64x32_SE_GRVW4_LRVW4_TT8_4_VW4_WG8_16_2_WGM8
- - - [4096, 1024, 1, 3344, 4096, 4096, 4096, 1024]
    - [1, 11129.4]
  - - [4096, 1024, 1, 4440, 4096, 4096, 4096, 1024]
    - [1, 11090.2]
  - - [1024, 1024, 1, 6480, 1024, 1024, 1024, 1024]
    - [1, 9493.07]
  - - [1024, 1024, 1, 5664, 1024, 1024, 1024, 1024]
    - [1, 9569.36]
  - - [4096, 1024, 1, 2160, 4096, 4096, 4096, 1024]
    - [1, 11132.0]
  - - [1024, 4096, 1, 7080, 1024, 1024, 1024, 4096]
    - [1, 11216.1]
  - - [1024, 1024, 1, 5376, 1024, 1024, 1024, 1024]
    - [1, 9472.27]
  - - [1024, 33712, 1, 7808, 1024, 1024, 1024, 33712]
    - [11, 11982.8]
  - - [1024, 1024, 1, 2880, 1024, 1024, 1024, 1024]
    - [0, 9470.32]
  - - [1024, 4096, 1, 2880, 1024, 1024, 1024, 4096]
    - [1, 11127.1]
  - - [1024, 33712, 1, 4176, 1024, 1024, 1024, 33712]
    - [12, 11950.6]
  - - [1024, 33712, 1, 7200, 1024, 1024, 1024, 33712]
    - [11, 11983.6]
  - - [1024, 4096, 1, 2392, 1024, 1024, 1024, 4096]
    - [1, 11128.7]
  - - [4096, 1024, 1, 6080, 4096, 4096, 4096, 1024]
    - [10, 10649.0]
  - - [1024, 4096, 1, 3952, 1024, 1024, 1024, 4096]
    - [1, 11189.6]
  - - [4096, 1024, 1, 7216, 4096, 4096, 4096, 1024]
    - [10, 10671.5]
  - - [1024, 4096, 1, 7872, 1024, 1024, 1024, 4096]
    - [1, 11168.4]
  - - [4096, 1024, 1, 3808, 4096, 4096, 4096, 1024]
    - [16, 11144.8]
  - - [4096, 1024, 1, 2976, 4096, 4096, 4096, 1024]
    - [1, 11131.3]
  - - [1024, 33712, 1, 5712, 1024, 1024, 1024, 33712]
    - [11, 11846.0]
  - - [1024, 1024, 1, 4160, 1024, 1024, 1024, 1024]
    - [1, 9472.87]
  - - [1024, 4096, 1, 5760, 1024, 1024, 1024, 4096]
    - [1, 11099.7]
  - - [1024, 4096, 1, 8136, 1024, 1024, 1024, 4096]
    - [7, 10559.7]
  - - [4096, 1024, 1, 7752, 4096, 4096, 4096, 1024]
    - [8, 10431.9]
  - - [1024, 1024, 1, 8136, 1024, 1024, 1024, 1024]
    - [1, 9571.85]
  - - [4096, 1024, 1, 6800, 4096, 4096, 4096, 1024]
    - [9, 10114.5]
  - - [1024, 1024, 1, 6032, 1024, 1024, 1024, 1024]
    - [1, 9534.79]
  - - [4096, 1024, 1, 2944, 4096, 4096, 4096, 1024]
    - [1, 10832.3]
  - - [4096, 1024, 1, 6232, 4096, 4096, 4096, 1024]
    - [8, 10506.3]
  - - [4096, 1024, 1, 7728, 4096, 4096, 4096, 1024]
    - [22, 10239.3]
  - - [1024, 33712, 1, 6496, 1024, 1024, 1024, 33712]
    - [0, 11572.0]
  - - [1024, 4096, 1, 7584, 1024, 1024, 1024, 4096]
    - [1, 10504.6]
  - - [1024, 1024, 1, 7616, 1024, 1024, 1024, 1024]
    - [0, 8874.84]
  - - [1024, 33712, 1, 7584, 1024, 1024, 1024, 33712]
    - [7, 10940.0]
  - - [1024, 1024, 1, 6200, 1024, 1024, 1024, 1024]
    - [24, 8697.89]
  - - [1024, 4096, 1, 6080, 1024, 1024, 1024, 4096]
    - [1, 10531.8]
  - - [1024, 4096, 1, 6336, 1024, 1024, 1024, 4096]
    - [1, 10341.4]
  - - [4096, 1024, 1, 7280, 4096, 4096, 4096, 1024]
    - [10, 10487.2]
  - - [1024, 4096, 1, 7216, 1024, 1024, 1024, 4096]
    - [1, 10431.7]
  - - [1024, 4096, 1, 7560, 1024, 1024, 1024, 4096]
    - [1, 10096.8]
  - - [4096, 1024, 1, 7560, 4096, 4096, 4096, 1024]
    - [10, 9923.66]
  - - [1024, 33712, 1, 7560, 1024, 1024, 1024, 33712]
    - [7, 10872.0]
  - - [1024, 33712, 1, 3200, 1024, 1024, 1024, 33712]
    - [12, 10872.3]
  - - [1024, 1024, 1, 7400, 1024, 1024, 1024, 1024]
    - [22, 8606.3]
  - - [1024, 33712, 1, 7400, 1024, 1024, 1024, 33712]
    - [7, 10748.7]
  - - [1024, 4096, 1, 5336, 1024, 1024, 1024, 4096]
    - [8, 10105.5]
  - - [1024, 1024, 1, 4032, 1024, 1024, 1024, 1024]
    - [1, 8251.07]
  - - [1024, 1024, 1, 6192, 1024, 1024, 1024, 1024]
    - [0, 8927.46]
  - - [4096, 1024, 1, 2880, 4096, 4096, 4096, 1024]
    - [1, 10432.1]
  - - [1024, 1024, 1, 4624, 1024, 1024, 1024, 1024]
    - [1, 9414.03]
  - - [1024, 1024, 1, 7232, 1024, 1024, 1024, 1024]
    - [1, 8864.78]
  - - [4096, 1024, 1, 7832, 4096, 4096, 4096, 1024]
    - [10, 9923.18]
  - - [1024, 1024, 1, 7832, 1024, 1024, 1024, 1024]
    - [1, 8286.01]
  - - [1024, 33712, 1, 6560, 1024, 1024, 1024, 33712]
    - [12, 10900.8]
  - - [1024, 33712, 1, 4704, 1024, 1024, 1024, 33712]
    - [1, 10215.2]
  - - [1024, 33712, 1, 7688, 1024, 1024, 1024, 33712]
    - [7, 10569.3]
  - - [4096, 1024, 1, 4680, 4096, 4096, 4096, 1024]
    - [2, 10155.9]
  - - [4096, 1024, 1, 6032, 4096, 4096, 4096, 1024]
    - [20, 9836.39]
  - - [4096, 1024, 1, 6512, 4096, 4096, 4096, 1024]
    - [20, 9539.14]
  - - [1024, 4096, 1, 7784, 1024, 1024, 1024, 4096]
    - [1, 9770.75]
  - - [1024, 4096, 1, 6880, 1024, 1024, 1024, 4096]
    - [1, 9748.11]
  - - [4096, 1024, 1, 6880, 4096, 4096, 4096, 1024]
    - [1, 9353.28]
  - - [1024, 1024, 1, 6880, 1024, 1024, 1024, 1024]
    - [18, 8762.73]
  - - [4096, 1024, 1, 6728, 4096, 4096, 4096, 1024]
    - [8, 9109.55]
  - - [1024, 33712, 1, 7728, 1024, 1024, 1024, 33712]
    - [7, 10559.5]
  - - [1024, 33712, 1, 6256, 1024, 1024, 1024, 33712]
    - [12, 11079.9]
  - - [1024, 33712, 1, 8120, 1024, 1024, 1024, 33712]
    - [7, 10412.6]
  - - [1024, 4096, 1, 2160, 1024, 1024, 1024, 4096]
    - [24, 10046.7]
  - - [1024, 33712, 1, 7896, 1024, 1024, 1024, 33712]
    - [7, 10528.4]
  - - [1024, 4096, 1, 3808, 1024, 1024, 1024, 4096]
    - [2, 9530.66]
  - - [1024, 1024, 1, 7208, 1024, 1024, 1024, 1024]
    - [24, 8143.12]
  - - [4096, 1024, 1, 7208, 4096, 4096, 4096, 1024]
    - [8, 9135.0]
  - - [1024, 4096, 1, 6448, 1024, 1024, 1024, 4096]
    - [1, 9742.36]
  - - [4096, 1024, 1, 8040, 4096, 4096, 4096, 1024]
    - [10, 9206.45]
  - - [1024, 1024, 1, 8040, 1024, 1024, 1024, 1024]
    - [1, 8322.66]
  - - [1024, 1024, 1, 3600, 1024, 1024, 1024, 1024]
    - [14, 8607.41]
  - - [1024, 4096, 1, 5184, 1024, 1024, 1024, 4096]
    - [1, 10451.1]
  - - [1024, 4096, 1, 3600, 1024, 1024, 1024, 4096]
    - [9, 9885.98]
  - - [4096, 1024, 1, 6192, 4096, 4096, 4096, 1024]
    - [22, 9148.35]
  - - [1024, 33712, 1, 3600, 1024, 1024, 1024, 33712]
    - [11, 10948.5]
  - - [1024, 4096, 1, 5704, 1024, 1024, 1024, 4096]
    - [22, 9528.53]
  - - [1024, 1024, 1, 3168, 1024, 1024, 1024, 1024]
    - [1, 8876.34]
  - - [1024, 4096, 1, 7440, 1024, 1024, 1024, 4096]
    - [1, 9579.07]
  - - [4096, 1024, 1, 5304, 4096, 4096, 4096, 1024]
    - [1, 9385.77]
  - - [1024, 1024, 1, 2520, 1024, 1024, 1024, 1024]
    - [1, 8857.63]
  - - [1024, 4096, 1, 6936, 1024, 1024, 1024, 4096]
    - [17, 9898.34]
  - - [1024, 1024, 1, 2304, 1024, 1024, 1024, 1024]
    - [17, 8033.77]
  - - [4096, 1024, 1, 4160, 4096, 4096, 4096, 1024]
    - [24, 9469.16]
  - - [4096, 1024, 1, 3456, 4096, 4096, 4096, 1024]
    - [1, 10386.0]
  - - [4096, 1024, 1, 5152, 4096, 4096, 4096, 1024]
    - [20, 10166.5]
  - - [1024, 1024, 1, 5152, 1024, 1024, 1024, 1024]
    - [1, 8835.29]
  - - [1024, 1024, 1, 7584, 1024, 1024, 1024, 1024]
    - [1, 8383.63]
  - - [1024, 33712, 1, 7936, 1024, 1024, 1024, 33712]
    - [7, 10461.9]
  - - [1024, 4096, 1, 7688, 1024, 1024, 1024, 4096]
    - [9, 9972.33]
  - - [1024, 4096, 1, 6216, 1024, 1024, 1024, 4096]
    - [1, 9651.9]
  - - [4096, 1024, 1, 5616, 4096, 4096, 4096, 1024]
    - [1, 9435.95]
  - - [1024, 4096, 1, 5104, 1024, 1024, 1024, 4096]
    - [1, 10461.5]
  - - [4096, 1024, 1, 5104, 4096, 4096, 4096, 1024]
    - [20, 10255.1]
  - - [4096, 1024, 1, 4864, 4096, 4096, 4096, 1024]
    - [20, 9968.45]
  - - [1024, 1024, 1, 6600, 1024, 1024, 1024, 1024]
    - [1, 8855.29]
  - - [1024, 1024, 1, 6768, 1024, 1024, 1024, 1024]
    - [1, 8933.46]
  - - [1024, 1024, 1, 7552, 1024, 1024, 1024, 1024]
    - [1, 8939.34]
  - - [1024, 4096, 1, 6192, 1024, 1024, 1024, 4096]
    - [1, 9704.02]
  - - [1024, 4096, 1, 6600, 1024, 1024, 1024, 4096]
    - [10, 9221.29]
  - - [1024, 4096, 1, 6200, 1024, 1024, 1024, 4096]
    - [1, 9528.01]
  - - [4096, 1024, 1, 3600, 4096, 4096, 4096, 1024]
    - [1, 9661.3]
  - - [1024, 4096, 1, 6864, 1024, 1024, 1024, 4096]
    - [1, 10302.9]
  - - [1024, 4096, 1, 5040, 1024, 1024, 1024, 4096]
    - [8, 9857.88]
  - - [4096, 1024, 1, 3904, 4096, 4096, 4096, 1024]
    - [10, 9867.97]
  - - [1024, 1024, 1, 3904, 1024, 1024, 1024, 1024]
    - [0, 8273.3]
  - - [1024, 4096, 1, 6944, 1024, 1024, 1024, 4096]
    - [9, 9966.72]
  - - [1024, 4096, 1, 7744, 1024, 1024, 1024, 4096]
    - [16, 9726.36]
  - - [4096, 1024, 1, 2592, 4096, 4096, 4096, 1024]
    - [20, 9858.9]
  - - [1024, 33712, 1, 7744, 1024, 1024, 1024, 33712]
    - [7, 10489.3]
  - - [1024, 33712, 1, 8024, 1024, 1024, 1024, 33712]
    - [7, 10794.7]
  - - [1024, 4096, 1, 3040, 1024, 1024, 1024, 4096]
    - [24, 9549.61]
  - - [1024, 1024, 1, 7168, 1024, 1024, 1024, 1024]
    - [22, 8112.61]
  - - [1024, 33712, 1, 3360, 1024, 1024, 1024, 33712]
    - [11, 10891.0]
  - - [1024, 1024, 1, 7840, 1024, 1024, 1024, 1024]
    - [20, 8517.92]
  - - [1024, 4096, 1, 5400, 1024, 1024, 1024, 4096]
    - [22, 9575.36]
  - - [4096, 1024, 1, 7808, 4096, 4096, 4096, 1024]
    - [10, 9221.75]
  - - [1024, 1024, 1, 4176, 1024, 1024, 1024, 1024]
    - [0, 8828.31]
  - - [1024, 1024, 1, 7808, 1024, 1024, 1024, 1024]
    - [1, 8953.7]
  - - [1024, 4096, 1, 5664, 1024, 1024, 1024, 4096]
    - [1, 10522.9]
  - - [1024, 1024, 1, 6440, 1024, 1024, 1024, 1024]
    - [1, 8859.17]
  - - [1024, 1024, 1, 7488, 1024, 1024, 1024, 1024]
    - [1, 8817.4]
  - - [1024, 1024, 1, 4144, 1024, 1024, 1024, 1024]
    - [17, 8633.93]
  - - [4096, 1024, 1, 7952, 4096, 4096, 4096, 1024]
    - [10, 9211.5]
  - - [4096, 1024, 1, 7992, 4096, 4096, 4096, 1024]
    - [10, 9200.71]
  - - [1024, 33712, 1, 6992, 1024, 1024, 1024, 33712]
    - [13, 10124.2]
  - - [4096, 1024, 1, 2560, 4096, 4096, 4096, 1024]
    - [2, 9442.61]
  - - [1024, 1024, 1, 2560, 1024, 1024, 1024, 1024]
    - [0, 8749.5]
  - - [1024, 4096, 1, 5888, 1024, 1024, 1024, 4096]
    - [1, 9669.84]
  - - [4096, 1024, 1, 7344, 4096, 4096, 4096, 1024]
    - [10, 9219.77]
  - - [4096, 1024, 1, 6320, 4096, 4096, 4096, 1024]
    - [14, 9581.55]
  - - [1024, 1024, 1, 6496, 1024, 1024, 1024, 1024]
    - [0, 8292.99]
  - - [1024, 1024, 1, 6320, 1024, 1024, 1024, 1024]
    - [0, 8935.1]
  - - [4096, 1024, 1, 3672, 4096, 4096, 4096, 1024]
    - [1, 9618.68]
  - - [1024, 4096, 1, 3904, 1024, 1024, 1024, 4096]
    - [1, 10247.4]
  - - [1024, 1024, 1, 6336, 1024, 1024, 1024, 1024]
    - [20, 8095.04]
  - - [1024, 33712, 1, 7296, 1024, 1024, 1024, 33712]
    - [13, 10176.5]
  - - [1024, 33712, 1, 8000, 1024, 1024, 1024, 33712]
    - [7, 10513.3]
  - - [1024, 4096, 1, 7296, 1024, 1024, 1024, 4096]
    - [2, 9450.76]
  - - [1024, 33712, 1, 5616, 1024, 1024, 1024, 33712]
    - [12, 10956.6]
  - - [1024, 33712, 1, 4624, 1024, 1024, 1024, 33712]
    - [11, 10232.8]
  - - [4096, 1024, 1, 1512, 4096, 4096, 4096, 1024]
    - [10, 9690.97]
  - - [4096, 1024, 1, 5632, 4096, 4096, 4096, 1024]
    - [16, 10203.1]
  - - [1024, 4096, 1, 4784, 1024, 1024, 1024, 4096]
    - [1, 9742.04]
  - - [4096, 1024, 1, 4784, 4096, 4096, 4096, 1024]
    - [22, 9203.0]
  - - [1024, 4096, 1, 7568, 1024, 1024, 1024, 4096]
    - [1, 10453.4]
  - - [1024, 1024, 1, 7568, 1024, 1024, 1024, 1024]
    - [22, 8134.07]
  - - [1024, 4096, 1, 2520, 1024, 1024, 1024, 4096]
    - [10, 9044.99]
  - - [1024, 33712, 1, 6384, 1024, 1024, 1024, 33712]
    - [12, 11118.7]
  - - [1024, 33712, 1, 7128, 1024, 1024, 1024, 33712]
    - [19, 10155.0]
  - - [1024, 4096, 1, 7280, 1024, 1024, 1024, 4096]
    - [2, 9208.88]
  - - [1024, 4096, 1, 5376, 1024, 1024, 1024, 4096]
    - [24, 9249.08]
  - - [1024, 1024, 1, 5304, 1024, 1024, 1024, 1024]
    - [1, 8258.54]
  - - [4096, 1024, 1, 7744, 4096, 4096, 4096, 1024]
    - [8, 9121.1]
  - - [4096, 1024, 1, 5376, 4096, 4096, 4096, 1024]
    - [1, 9509.33]
  - - [1024, 33712, 1, 2976, 1024, 1024, 1024, 33712]
    - [11, 11471.3]
  - - [4096, 1024, 1, 1600, 4096, 4096, 4096, 1024]
    - [10, 9751.9]
  - - [1024, 4096, 1, 6608, 1024, 1024, 1024, 4096]
    - [1, 9642.85]
  - - [4096, 1024, 1, 4992, 4096, 4096, 4096, 1024]
    - [24, 9551.61]
  - - [4096, 1024, 1, 6560, 4096, 4096, 4096, 1024]
    - [1, 9215.26]
  - - [1024, 4096, 1, 5680, 1024, 1024, 1024, 4096]
    - [1, 9767.92]
  - - [1024, 4096, 1, 6432, 1024, 1024, 1024, 4096]
    - [9, 9953.1]
  - - [1024, 4096, 1, 5520, 1024, 1024, 1024, 4096]
    - [1, 9314.05]
  - - [1024, 1024, 1, 3584, 1024, 1024, 1024, 1024]
    - [1, 8239.97]
  - - [1024, 33712, 1, 3960, 1024, 1024, 1024, 33712]
    - [0, 10553.9]
  - - [4096, 1024, 1, 7872, 4096, 4096, 4096, 1024]
    - [10, 9218.02]
  - - [1024, 1024, 1, 2736, 1024, 1024, 1024, 1024]
    - [0, 8221.27]
  - - [1024, 33712, 1, 8112, 1024, 1024, 1024, 33712]
    - [7, 10428.9]
  - - [1024, 33712, 1, 4352, 1024, 1024, 1024, 33712]
    - [9, 10939.3]
  - - [1024, 1024, 1, 5576, 1024, 1024, 1024, 1024]
    - [24, 8101.71]
  - - [1024, 1024, 1, 7800, 1024, 1024, 1024, 1024]
    - [1, 8274.19]
  - - [1024, 1024, 1, 7360, 1024, 1024, 1024, 1024]
    - [1, 8260.02]
  - - [1024, 4096, 1, 4488, 1024, 1024, 1024, 4096]
    - [8, 9804.15]
  - - [4096, 1024, 1, 5040, 4096, 4096, 4096, 1024]
    - [16, 9631.86]
  - - [1024, 4096, 1, 6256, 1024, 1024, 1024, 4096]
    - [1, 10488.7]
  - - [1024, 33712, 1, 7440, 1024, 1024, 1024, 33712]
    - [15, 10242.8]
  - - [1024, 1024, 1, 6256, 1024, 1024, 1024, 1024]
    - [22, 8111.42]
  - - [4096, 1024, 1, 6960, 4096, 4096, 4096, 1024]
    - [8, 9824.28]
  - - [1024, 4096, 1, 2112, 1024, 1024, 1024, 4096]
    - [24, 10053.5]
  - - [4096, 1024, 1, 2112, 4096, 4096, 4096, 1024]
    - [20, 9495.7]
  - - [1024, 1024, 1, 7320, 1024, 1024, 1024, 1024]
    - [1, 8864.86]
  - - [1024, 33712, 1, 7448, 1024, 1024, 1024, 33712]
    - [7, 10101.3]
  - - [1024, 4096, 1, 3520, 1024, 1024, 1024, 4096]
    - [2, 8997.11]
  - - [1024, 33712, 1, 6800, 1024, 1024, 1024, 33712]
    - [12, 10637.2]
  - - [4096, 1024, 1, 6864, 4096, 4096, 4096, 1024]
    - [10, 9878.4]
  - - [4096, 1024, 1, 7760, 4096, 4096, 4096, 1024]
    - [10, 9221.36]
  - - [1024, 33712, 1, 3456, 1024, 1024, 1024, 33712]
    - [11, 10886.9]
  - - [1024, 33712, 1, 8008, 1024, 1024, 1024, 33712]
    - [7, 10432.8]
  - - [4096, 1024, 1, 6624, 4096, 4096, 4096, 1024]
    - [2, 9572.68]
  - - [1024, 1024, 1, 5120, 1024, 1024, 1024, 1024]
    - [17, 8709.75]
  - - [1024, 1024, 1, 4320, 1024, 1024, 1024, 1024]
    - [14, 8631.55]
  - - [4096, 1024, 1, 7232, 4096, 4096, 4096, 1024]
    - [24, 9303.49]
  - - [1024, 4096, 1, 7520, 1024, 1024, 1024, 4096]
    - [1, 9491.63]
  - - [1024, 4096, 1, 6720, 1024, 1024, 1024, 4096]
    - [18, 9588.52]
  - - [1024, 4096, 1, 4704, 1024, 1024, 1024, 4096]
    - [24, 9594.41]
  - - [1024, 4096, 1, 7232, 1024, 1024, 1024, 4096]
    - [9, 9986.41]
  - - [1024, 4096, 1, 2736, 1024, 1024, 1024, 4096]
    - [9, 9109.92]
  - - [4096, 1024, 1, 6720, 4096, 4096, 4096, 1024]
    - [1, 9439.01]
  - - [1024, 1024, 1, 5512, 1024, 1024, 1024, 1024]
    - [1, 8279.47]
  - - [1024, 1024, 1, 7872, 1024, 1024, 1024, 1024]
    - [20, 7861.3]
  - - [1024, 33712, 1, 7872, 1024, 1024, 1024, 33712]
    - [7, 10315.5]
  - - [4096, 1024, 1, 7904, 4096, 4096, 4096, 1024]
    - [10, 9207.57]
  - - [1024, 4096, 1, 6528, 1024, 1024, 1024, 4096]
    - [1, 10504.4]
  - - [1024, 4096, 1, 4160, 1024, 1024, 1024, 4096]
    - [1, 9763.77]
  - - [1024, 1024, 1, 6528, 1024, 1024, 1024, 1024]
    - [0, 8291.04]
  - - [1024, 1024, 1, 6240, 1024, 1024, 1024, 1024]
    - [1, 8843.93]
  - - [1024, 1024, 1, 4816, 1024, 1024, 1024, 1024]
    - [17, 8678.05]
  - - [1024, 4096, 1, 6976, 1024, 1024, 1024, 4096]
    - [9, 9960.57]
  - - [1024, 4096, 1, 4800, 1024, 1024, 1024, 4096]
    - [1, 10210.9]
  - - [1024, 1024, 1, 5104, 1024, 1024, 1024, 1024]
    - [0, 8275.48]
  - - [1024, 1024, 1, 6624, 1024, 1024, 1024, 1024]
    - [1, 8957.17]
  - - [1024, 4096, 1, 4432, 1024, 1024, 1024, 4096]
    - [1, 10487.1]
  - - [1024, 4096, 1, 3528, 1024, 1024, 1024, 4096]
    - [1, 9647.83]
  - - [1024, 1024, 1, 7776, 1024, 1024, 1024, 1024]
    - [22, 8095.42]
  - - [1024, 33712, 1, 7000, 1024, 1024, 1024, 33712]
    - [13, 10058.4]
  - - [1024, 1024, 1, 3840, 1024, 1024, 1024, 1024]
    - [10, 7716.01]
  - - [1024, 1024, 1, 7200, 1024, 1024, 1024, 1024]
    - [1, 8303.7]
  - - [1024, 1024, 1, 7248, 1024, 1024, 1024, 1024]
    - [0, 8776.05]
  - - [4096, 1024, 1, 8184, 4096, 4096, 4096, 1024]
    - [9, 8855.69]
  - - [1024, 1024, 1, 7176, 1024, 1024, 1024, 1024]
    - [1, 8926.35]
  - - [4096, 1024, 1, 6256, 4096, 4096, 4096, 1024]
    - [1, 9238.73]
  - - [1024, 33712, 1, 3808, 1024, 1024, 1024, 33712]
    - [0, 10473.4]
  - - [1024, 33712, 1, 6480, 1024, 1024, 1024, 33712]
    - [12, 10951.0]
  - - [4096, 1024, 1, 8112, 4096, 4096, 4096, 1024]
    - [22, 9059.37]
  - - [1024, 4096, 1, 7696, 1024, 1024, 1024, 4096]
    - [1, 10250.0]
  - - [1024, 4096, 1, 5832, 1024, 1024, 1024, 4096]
    - [1, 9118.02]
  - - [1024, 4096, 1, 1600, 1024, 1024, 1024, 4096]
    - [14, 9696.66]
  - - [1024, 4096, 1, 7728, 1024, 1024, 1024, 4096]
    - [9, 9262.05]
  - - [4096, 1024, 1, 1824, 4096, 4096, 4096, 1024]
    - [22, 10412.7]
  - - [1024, 4096, 1, 7680, 1024, 1024, 1024, 4096]
    - [16, 9570.09]
  - - [1024, 33712, 1, 7992, 1024, 1024, 1024, 33712]
    - [7, 10420.3]
  - - [1024, 4096, 1, 7904, 1024, 1024, 1024, 4096]
    - [10, 9865.87]
  - - [1024, 1024, 1, 6728, 1024, 1024, 1024, 1024]
    - [1, 7742.99]
  - - [4096, 1024, 1, 5032, 4096, 4096, 4096, 1024]
    - [1, 9486.21]
  - - [4096, 1024, 1, 7920, 4096, 4096, 4096, 1024]
    - [10, 9219.04]
  - - [1024, 33712, 1, 7168, 1024, 1024, 1024, 33712]
    - [19, 10143.0]
  - - [4096, 1024, 1, 5888, 4096, 4096, 4096, 1024]
    - [2, 9363.9]
  - - [1024, 4096, 1, 7888, 1024, 1024, 1024, 4096]
    - [1, 9773.07]
  - - [4096, 1024, 1, 8024, 4096, 4096, 4096, 1024]
    - [14, 9256.05]
  - - [4096, 1024, 1, 6576, 4096, 4096, 4096, 1024]
    - [14, 9259.81]
  - - [1024, 1024, 1, 7912, 1024, 1024, 1024, 1024]
    - [0, 8211.56]
  - - [4096, 1024, 1, 5400, 4096, 4096, 4096, 1024]
    - [20, 9201.59]
  - - [4096, 1024, 1, 4896, 4096, 4096, 4096, 1024]
    - [1, 10107.5]
  - - [1024, 1024, 1, 6408, 1024, 1024, 1024, 1024]
    - [0, 8922.84]
  - - [1024, 1024, 1, 6048, 1024, 1024, 1024, 1024]
    - [18, 8113.83]
  - - [1024, 4096, 1, 7992, 1024, 1024, 1024, 4096]
    - [1, 9693.24]
  - - [1024, 1024, 1, 8160, 1024, 1024, 1024, 1024]
    - [1, 8215.25]
  - - [1024, 4096, 1, 8184, 1024, 1024, 1024, 4096]
    - [9, 8645.32]
  - - [4096, 1024, 1, 7400, 4096, 4096, 4096, 1024]
    - [10, 9202.59]
  - - [1024, 1024, 1, 7992, 1024, 1024, 1024, 1024]
    - [1, 8286.72]
  - - [4096, 1024, 1, 8120, 4096, 4096, 4096, 1024]
    - [10, 9557.95]
  - - [4096, 1024, 1, 7072, 4096, 4096, 4096, 1024]
    - [20, 9152.46]
  - - [1024, 1024, 1, 7424, 1024, 1024, 1024, 1024]
    - [20, 8574.86]
  - - [1024, 1024, 1, 6432, 1024, 1024, 1024, 1024]
    - [22, 8626.34]
  - - [1024, 4096, 1, 7424, 1024, 1024, 1024, 4096]
    - [1, 10317.6]
  - - [1024, 1024, 1, 7392, 1024, 1024, 1024, 1024]
    - [20, 8632.23]
  - - [1024, 4096, 1, 6560, 1024, 1024, 1024, 4096]
    - [9, 9965.86]
  - - [1024, 4096, 1, 3000, 1024, 1024, 1024, 4096]
    - [10, 9843.9]
  - - [1024, 4096, 1, 8176, 1024, 1024, 1024, 4096]
    - [1, 9770.39]
  - - [4096, 1024, 1, 4176, 4096, 4096, 4096, 1024]
    - [16, 9500.63]
  - - [4096, 1024, 1, 6992, 4096, 4096, 4096, 1024]
    - [10, 9200.64]
  - - [1024, 4096, 1, 7040, 1024, 1024, 1024, 4096]
    - [1, 9747.47]
  - - [1024, 1024, 1, 7040, 1024, 1024, 1024, 1024]
    - [0, 8214.58]
  - - [1024, 1024, 1, 5280, 1024, 1024, 1024, 1024]
    - [0, 8740.31]
  - - [1024, 1024, 1, 7688, 1024, 1024, 1024, 1024]
    - [22, 8100.96]
  - - [1024, 4096, 1, 6968, 1024, 1024, 1024, 4096]
    - [9, 9244.93]
  - - [1024, 1024, 1, 7536, 1024, 1024, 1024, 1024]
    - [20, 8525.42]
  - - [1024, 1024, 1, 8056, 1024, 1024, 1024, 1024]
    - [1, 8314.27]
  - - [1024, 1024, 1, 6552, 1024, 1024, 1024, 1024]
    - [22, 8091.79]
  - - [1024, 4096, 1, 7912, 1024, 1024, 1024, 4096]
    - [1, 9775.31]
  - - [1024, 4096, 1, 4864, 1024, 1024, 1024, 4096]
    - [24, 9397.58]
  - - [1024, 4096, 1, 5936, 1024, 1024, 1024, 4096]
    - [22, 9246.16]
  - - [1024, 1024, 1, 5336, 1024, 1024, 1024, 1024]
    - [1, 8267.12]
  - - [1024, 4096, 1, 4872, 1024, 1024, 1024, 4096]
    - [24, 10134.6]
  - - [1024, 4096, 1, 6656, 1024, 1024, 1024, 4096]
    - [1, 9743.27]
  - - [1024, 4096, 1, 7920, 1024, 1024, 1024, 4096]
    - [1, 9549.8]
  - - [1024, 33712, 1, 7776, 1024, 1024, 1024, 33712]
    - [7, 10424.0]
  - - [1024, 1024, 1, 8112, 1024, 1024, 1024, 1024]
    - [20, 8598.89]
  - - [1024, 1024, 1, 8192, 1024, 1024, 1024, 1024]
    - [0, 8196.48]
  - - [4096, 1024, 1, 968, 4096, 4096, 4096, 1024]
    - [16, 9484.39]
  - - [1024, 4096, 1, 6552, 1024, 1024, 1024, 4096]
    - [1, 10147.2]
  - - [1024, 4096, 1, 7808, 1024, 1024, 1024, 4096]
    - [1, 9687.91]
  - - [1024, 4096, 1, 7176, 1024, 1024, 1024, 4096]
    - [1, 9296.0]
  - - [1024, 33712, 1, 6032, 1024, 1024, 1024, 33712]
    - [12, 11277.4]
  - - [1024, 4096, 1, 6344, 1024, 1024, 1024, 4096]
    - [1, 9918.51]
  - - [1024, 1024, 1, 3400, 1024, 1024, 1024, 1024]
    - [17, 8584.92]
  - - [1024, 1024, 1, 5056, 1024, 1024, 1024, 1024]
    - [1, 9555.84]
  - - [4096, 1024, 1, 5664, 4096, 4096, 4096, 1024]
    - [20, 9865.31]
  - - [1024, 4096, 1, 8128, 1024, 1024, 1024, 4096]
    - [1, 9467.88]
  - - [1024, 1024, 1, 7128, 1024, 1024, 1024, 1024]
    - [20, 8009.24]
  - - [1024, 4096, 1, 3840, 1024, 1024, 1024, 4096]
    - [7, 9794.98]
  - - [4096, 1024, 1, 8128, 4096, 4096, 4096, 1024]
    - [2, 9706.4]
  - - [1024, 4096, 1, 6048, 1024, 1024, 1024, 4096]
    - [1, 10161.1]
  - - [1024, 4096, 1, 1248, 1024, 1024, 1024, 4096]
    - [1, 9496.51]
  - - [1024, 4096, 1, 3120, 1024, 1024, 1024, 4096]
    - [10, 10491.8]
  - - [1024, 1024, 1, 3224, 1024, 1024, 1024, 1024]
    - [17, 8041.39]
  - - [1024, 33712, 1, 7424, 1024, 1024, 1024, 33712]
    - [19, 10066.4]
  - - [1024, 4096, 1, 3240, 1024, 1024, 1024, 4096]
    - [11, 8887.6]
  - - [1024, 1024, 1, 4704, 1024, 1024, 1024, 1024]
    - [14, 8084.98]
  - - [1024, 4096, 1, 7968, 1024, 1024, 1024, 4096]
    - [11, 9685.19]
  - - [4096, 1024, 1, 8160, 4096, 4096, 4096, 1024]
    - [2, 9397.01]
  - - [1024, 33712, 1, 8128, 1024, 1024, 1024, 33712]
    - [7, 10381.2]
  - - [1024, 1024, 1, 4992, 1024, 1024, 1024, 1024]
    - [24, 8131.1]
  - - [1024, 4096, 1, 4624, 1024, 1024, 1024, 4096]
    - [1, 9714.3]
  - - [1024, 33712, 1, 7104, 1024, 1024, 1024, 33712]
    - [19, 10205.1]
  - - [1024, 4096, 1, 7360, 1024, 1024, 1024, 4096]
    - [9, 9252.7]
  - - [1024, 1024, 1, 2976, 1024, 1024, 1024, 1024]
    - [0, 8250.2]
  - - [4096, 1024, 1, 7568, 4096, 4096, 4096, 1024]
    - [10, 9219.08]
  - - [1024, 33712, 1, 7504, 1024, 1024, 1024, 33712]
    - [15, 10133.9]
  - - [1024, 4096, 1, 8096, 1024, 1024, 1024, 4096]
    - [9, 10000.3]
  - - [1024, 1024, 1, 4968, 1024, 1024, 1024, 1024]
    - [1, 8246.75]
  - - [1024, 1024, 1, 8128, 1024, 1024, 1024, 1024]
    - [20, 7945.63]
  - - [4096, 1024, 1, 6688, 4096, 4096, 4096, 1024]
    - [14, 9329.32]
  - - [4096, 1024, 1, 5832, 4096, 4096, 4096, 1024]
    - [1, 9254.63]
  - - [4096, 1024, 1, 5184, 4096, 4096, 4096, 1024]
    - [22, 9458.5]
  - - [4096, 1024, 1, 8096, 4096, 4096, 4096, 1024]
    - [10, 9214.82]
  - - [1024, 33712, 1, 6200, 1024, 1024, 1024, 33712]
    - [12, 11142.8]
  - - [1024, 1024, 1, 7968, 1024, 1024, 1024, 1024]
    - [5, 8047.3]
  - - [1024, 4096, 1, 2560, 1024, 1024, 1024, 4096]
    - [9, 9110.59]
  - - [1024, 33712, 1, 6600, 1024, 1024, 1024, 33712]
    - [12, 10950.4]
  - - [1024, 4096, 1, 6320, 1024, 1024, 1024, 4096]
    - [1, 10948.3]
  - - [4096, 1024, 1, 7536, 4096, 4096, 4096, 1024]
    - [14, 9377.5]
  - - [4096, 1024, 1, 6888, 4096, 4096, 4096, 1024]
    - [20, 9644.75]
  - - [1024, 1024, 1, 4368, 1024, 1024, 1024, 1024]
    - [1, 8274.62]
  - - [1024, 1024, 1, 5712, 1024, 1024, 1024, 1024]
    - [1, 8749.34]
  - - [4096, 1024, 1, 3168, 4096, 4096, 4096, 1024]
    - [24, 9373.25]
  - - [1024, 4096, 1, 7344, 1024, 1024, 1024, 4096]
    - [10, 9246.11]
  - - [4096, 1024, 1, 6112, 4096, 4096, 4096, 1024]
    - [20, 9358.76]
  - - [1024, 33712, 1, 6240, 1024, 1024, 1024, 33712]
    - [12, 11172.6]
  - - [1024, 4096, 1, 4992, 1024, 1024, 1024, 4096]
    - [1, 11246.8]
  - - [1024, 1024, 1, 7952, 1024, 1024, 1024, 1024]
    - [0, 8264.2]
  - - [4096, 1024, 1, 7616, 4096, 4096, 4096, 1024]
    - [10, 9224.82]
  - - [1024, 1024, 1, 5824, 1024, 1024, 1024, 1024]
    - [1, 8210.83]
  - - [1024, 33712, 1, 3400, 1024, 1024, 1024, 33712]
    - [11, 10851.2]
  - - [1024, 33712, 1, 2352, 1024, 1024, 1024, 33712]
    - [1, 10230.1]
  - - [1024, 4096, 1, 7504, 1024, 1024, 1024, 4096]
    - [1, 10305.5]
  - - [4096, 1024, 1, 3120, 4096, 4096, 4096, 1024]
    - [24, 9433.52]
  - - [1024, 33712, 1, 5832, 1024, 1024, 1024, 33712]
    - [19, 10331.0]
  - - [1024, 33712, 1, 6624, 1024, 1024, 1024, 33712]
    - [12, 11033.5]
  - - [1024, 4096, 1, 3960, 1024, 1024, 1024, 4096]
    - [1, 11158.0]
  - - [4096, 1024, 1, 6656, 4096, 4096, 4096, 1024]
    - [1, 9313.68]
  - - [1024, 4096, 1, 3168, 1024, 1024, 1024, 4096]
    - [10, 9893.61]
  - - [1024, 4096, 1, 6480, 1024, 1024, 1024, 4096]
    - [22, 9390.46]
  - - [1024, 4096, 1, 8008, 1024, 1024, 1024, 4096]
    - [1, 9593.69]
  - - [1024, 1024, 1, 2112, 1024, 1024, 1024, 1024]
    - [16, 8533.38]
  - - [1024, 4096, 1, 7248, 1024, 1024, 1024, 4096]
    - [1, 9139.29]
  - - [4096, 1024, 1, 7448, 4096, 4096, 4096, 1024]
    - [1, 9366.03]
  - - [4096, 1024, 1, 6336, 4096, 4096, 4096, 1024]
    - [1, 9272.77]
  - - [1024, 1024, 1, 4200, 1024, 1024, 1024, 1024]
    - [0, 8819.3]
  - - [1024, 4096, 1, 4176, 1024, 1024, 1024, 4096]
    - [1, 10438.7]
  - - [1024, 1024, 1, 7296, 1024, 1024, 1024, 1024]
    - [22, 8702.32]
  - - [1024, 4096, 1, 5568, 1024, 1024, 1024, 4096]
    - [1, 10157.4]
  - - [1024, 4096, 1, 6496, 1024, 1024, 1024, 4096]
    - [1, 9766.75]
  - - [4096, 1024, 1, 5712, 4096, 4096, 4096, 1024]
    - [8, 9740.52]
  - - [1024, 4096, 1, 6992, 1024, 1024, 1024, 4096]
    - [1, 10450.2]
  - - [1024, 4096, 1, 5056, 1024, 1024, 1024, 4096]
    - [22, 10094.0]
  - - [1024, 33712, 1, 7072, 1024, 1024, 1024, 33712]
    - [19, 10097.8]
  - - [4096, 1024, 1, 7656, 4096, 4096, 4096, 1024]
    - [10, 9198.68]
  - - [1024, 4096, 1, 6440, 1024, 1024, 1024, 4096]
    - [1, 10443.6]
  - - [1024, 4096, 1, 5280, 1024, 1024, 1024, 4096]
    - [1, 9521.99]
  - - [1024, 4096, 1, 6208, 1024, 1024, 1024, 4096]
    - [1, 9722.4]
  - - [4096, 1024, 1, 5120, 4096, 4096, 4096, 1024]
    - [8, 9114.0]
  - - [1024, 33712, 1, 7760, 1024, 1024, 1024, 33712]
    - [7, 10479.4]
  - - [1024, 4096, 1, 3264, 1024, 1024, 1024, 4096]
    - [2, 9371.69]
  - - [1024, 33712, 1, 7176, 1024, 1024, 1024, 33712]
    - [19, 10211.1]
  - - [1024, 4096, 1, 2584, 1024, 1024, 1024, 4096]
    - [14, 9247.48]
  - - [1024, 1024, 1, 7728, 1024, 1024, 1024, 1024]
    - [1, 8284.3]
  - - [1024, 4096, 1, 6120, 1024, 1024, 1024, 4096]
    - [9, 9213.06]
  - - [4096, 1024, 1, 7584, 4096, 4096, 4096, 1024]
    - [14, 9418.23]
  - - [1024, 1024, 1, 6120, 1024, 1024, 1024, 1024]
    - [1, 8280.77]
  - - [4096, 1024, 1, 6344, 4096, 4096, 4096, 1024]
    - [1, 9477.34]
  - - [4096, 1024, 1, 7296, 4096, 4096, 4096, 1024]
    - [1, 8855.43]
  - - [1024, 4096, 1, 8000, 1024, 1024, 1024, 4096]
    - [1, 9648.7]
  - - [1024, 33712, 1, 4680, 1024, 1024, 1024, 33712]
    - [11, 11412.5]
  - - [1024, 33712, 1, 6960, 1024, 1024, 1024, 33712]
    - [0, 10498.4]
  - - [4096, 1024, 1, 6784, 4096, 4096, 4096, 1024]
    - [2, 9697.25]
  - - [1024, 1024, 1, 1824, 1024, 1024, 1024, 1024]
    - [1, 8848.07]
  - - [4096, 1024, 1, 3200, 4096, 4096, 4096, 1024]
    - [1, 10433.6]
  - - [4096, 1024, 1, 8192, 4096, 4096, 4096, 1024]
    - [1, 9773.7]
  - - [1024, 4096, 1, 7480, 1024, 1024, 1024, 4096]
    - [1, 10137.2]
  - - [1024, 4096, 1, 8064, 1024, 1024, 1024, 4096]
    - [17, 9508.89]
  - - [1024, 1024, 1, 2600, 1024, 1024, 1024, 1024]
    - [17, 9146.16]
  - - [1024, 4096, 1, 7536, 1024, 1024, 1024, 4096]
    - [1, 9484.42]
  - - [1024, 4096, 1, 8024, 1024, 1024, 1024, 4096]
    - [16, 9449.82]
  - - [1024, 33712, 1, 6912, 1024, 1024, 1024, 33712]
    - [12, 10675.0]
  - - [1024, 33712, 1, 6432, 1024, 1024, 1024, 33712]
    - [12, 11092.5]
  - - [1024, 1024, 1, 6392, 1024, 1024, 1024, 1024]
    - [22, 8112.02]
  - - [1024, 1024, 1, 7280, 1024, 1024, 1024, 1024]
    - [1, 8948.71]
  - - [1024, 1024, 1, 6400, 1024, 1024, 1024, 1024]
    - [1, 8304.7]
  - - [1024, 1024, 1, 7936, 1024, 1024, 1024, 1024]
    - [1, 8958.61]
  - - [1024, 33712, 1, 7696, 1024, 1024, 1024, 33712]
    - [7, 10454.5]
  - - [4096, 1024, 1, 7504, 4096, 4096, 4096, 1024]
    - [10, 9954.06]
  - - [1024, 1024, 1, 6656, 1024, 1024, 1024, 1024]
    - [1, 8944.15]
  - - [1024, 4096, 1, 6072, 1024, 1024, 1024, 4096]
    - [1, 9691.21]
  - - [1024, 1024, 1, 3240, 1024, 1024, 1024, 1024]
    - [1, 8226.88]
  - - [1024, 33712, 1, 6080, 1024, 1024, 1024, 33712]
    - [12, 11247.6]
  - - [1024, 4096, 1, 4576, 1024, 1024, 1024, 4096]
    - [1, 11061.0]
  - - [1024, 4096, 1, 7488, 1024, 1024, 1024, 4096]
    - [1, 9634.24]
  - - [4096, 1024, 1, 6480, 4096, 4096, 4096, 1024]
    - [1, 9227.73]
  - - [1024, 33712, 1, 7680, 1024, 1024, 1024, 33712]
    - [7, 10289.1]
  - - [1024, 1024, 1, 7416, 1024, 1024, 1024, 1024]
    - [17, 8202.07]
  - - [1024, 33712, 1, 6696, 1024, 1024, 1024, 33712]
    - [12, 10791.8]
  - - [1024, 33712, 1, 7888, 1024, 1024, 1024, 33712]
    - [7, 10443.0]
  - - [1024, 4096, 1, 7400, 1024, 1024, 1024, 4096]
    - [10, 9220.52]
  - - [1024, 1024, 1, 5632, 1024, 1024, 1024, 1024]
    - [17, 8079.18]
  - - [4096, 1024, 1, 8000, 4096, 4096, 4096, 1024]
    - [10, 9199.82]
  - - [1024, 1024, 1, 3696, 1024, 1024, 1024, 1024]
    - [1, 8248.6]
  - - [1024, 1024, 1, 7696, 1024, 1024, 1024, 1024]
    - [1, 8947.37]
  - - [1024, 4096, 1, 7208, 1024, 1024, 1024, 4096]
    - [10, 9205.08]
  - - [4096, 1024, 1, 7912, 4096, 4096, 4096, 1024]
    - [10, 9189.73]
  - - [4096, 1024, 1, 6552, 4096, 4096, 4096, 1024]
    - [20, 9688.14]
  - - [4096, 1024, 1, 7848, 4096, 4096, 4096, 1024]
    - [10, 9201.21]
  - - [1024, 33712, 1, 3344, 1024, 1024, 1024, 33712]
    - [12, 10285.4]
  - - [1024, 33712, 1, 6808, 1024, 1024, 1024, 33712]
    - [12, 10718.7]
  - - [1024, 4096, 1, 7840, 1024, 1024, 1024, 4096]
    - [1, 9340.34]
  - - [4096, 1024, 1, 4608, 4096, 4096, 4096, 1024]
    - [16, 9932.21]
  - - [4096, 1024, 1, 6200, 4096, 4096, 4096, 1024]
    - [20, 9786.76]
  - - [1024, 1024, 1, 8184, 1024, 1024, 1024, 1024]
    - [0, 8324.46]
  - - [1024, 33712, 1, 7216, 1024, 1024, 1024, 33712]
    - [13, 10131.3]
  - - [1024, 33712, 1, 7656, 1024, 1024, 1024, 33712]
    - [7, 10218.4]
  - - [1024, 4096, 1, 7752, 1024, 1024, 1024, 4096]
    - [10, 9921.32]
  - - [4096, 1024, 1, 7936, 4096, 4096, 4096, 1024]
    - [10, 9219.24]
  - - [1024, 1024, 1, 2184, 1024, 1024, 1024, 1024]
    - [1, 8837.92]
  - - [4096, 1024, 1, 2184, 4096, 4096, 4096, 1024]
    - [1, 10189.9]
  - - [1024, 4096, 1, 4680, 1024, 1024, 1024, 4096]
    - [1, 10495.6]
  - - [1024, 1024, 1, 6832, 1024, 1024, 1024, 1024]
    - [24, 8633.64]
  - - [1024, 4096, 1, 1440, 1024, 1024, 1024, 4096]
    - [1, 10465.4]
  - - [1024, 4096, 1, 6888, 1024, 1024, 1024, 4096]
    - [9, 9940.5]
  - - [4096, 1024, 1, 7168, 4096, 4096, 4096, 1024]
    - [1, 9252.72]
  - - [4096, 1024, 1, 7840, 4096, 4096, 4096, 1024]
    - [22, 9106.71]
  - - [1024, 1024, 1, 6960, 1024, 1024, 1024, 1024]
    - [1, 8294.76]
  - - [1024, 1024, 1, 4680, 1024, 1024, 1024, 1024]
    - [1, 8702.15]
  - - [1024, 4096, 1, 7832, 1024, 1024, 1024, 4096]
    - [1, 9700.7]
  - - [1024, 33712, 1, 4992, 1024, 1024, 1024, 33712]
    - [11, 10052.1]
  - - [1024, 4096, 1, 6912, 1024, 1024, 1024, 4096]
    - [8, 9143.33]
  - - [1024, 33712, 1, 6208, 1024, 1024, 1024, 33712]
    - [12, 11184.7]
  - - [4096, 1024, 1, 6600, 4096, 4096, 4096, 1024]
    - [10, 9907.49]
  - - [1024, 1024, 1, 6800, 1024, 1024, 1024, 1024]
    - [1, 8141.83]
  - - [1024, 33712, 1, 8160, 1024, 1024, 1024, 33712]
    - [7, 10409.0]
  - - [1024, 4096, 1, 6696, 1024, 1024, 1024, 4096]
    - [2, 9305.08]
  - - [1024, 1024, 1, 4432, 1024, 1024, 1024, 1024]
    - [17, 8649.63]
  - - [1024, 1024, 1, 5984, 1024, 1024, 1024, 1024]
    - [1, 8285.78]
  - - [1024, 33712, 1, 8136, 1024, 1024, 1024, 33712]
    - [7, 10449.5]
  - - [4096, 1024, 1, 6120, 4096, 4096, 4096, 1024]
    - [2, 9598.06]
  - - [4096, 1024, 1, 7040, 4096, 4096, 4096, 1024]
    - [24, 9309.36]
  - - [4096, 1024, 1, 5880, 4096, 4096, 4096, 1024]
    - [20, 9234.93]
  - - [1024, 1024, 1, 5760, 1024, 1024, 1024, 1024]
    - [1, 8322.0]
  - - [1024, 1024, 1, 5920, 1024, 1024, 1024, 1024]
    - [18, 8001.07]
  - - [4096, 1024, 1, 4800, 4096, 4096, 4096, 1024]
    - [20, 9960.32]
  - - [4096, 1024, 1, 8056, 4096, 4096, 4096, 1024]
    - [10, 9202.85]
  - - [4096, 1024, 1, 5824, 4096, 4096, 4096, 1024]
    - [1, 9563.83]
  - - [1024, 1024, 1, 6688, 1024, 1024, 1024, 1024]
    - [17, 8730.27]
  - - [1024, 1024, 1, 7848, 1024, 1024, 1024, 1024]
    - [1, 8215.39]
  - - [1024, 4096, 1, 4224, 1024, 1024, 1024, 4096]
    - [1, 9118.77]
  - - [1024, 33712, 1, 7904, 1024, 1024, 1024, 33712]
    - [7, 10413.3]
  - - [4096, 1024, 1, 5280, 4096, 4096, 4096, 1024]
    - [2, 10192.3]
  - - [1024, 4096, 1, 7936, 1024, 1024, 1024, 4096]
    - [1, 10195.9]
  - - [1024, 1024, 1, 1440, 1024, 1024, 1024, 1024]
    - [24, 7786.44]
  - - [1024, 1024, 1, 5424, 1024, 1024, 1024, 1024]
    - [1, 8934.68]
  - - [1024, 1024, 1, 2992, 1024, 1024, 1024, 1024]
    - [17, 8545.79]
  - - [1024, 33712, 1, 8192, 1024, 1024, 1024, 33712]
    - [7, 10347.8]
  - - [1024, 1024, 1, 3128, 1024, 1024, 1024, 1024]
    - [18, 8045.37]
  - - [1024, 4096, 1, 4144, 1024, 1024, 1024, 4096]
    - [1, 10457.0]
  - - [4096, 1024, 1, 7680, 4096, 4096, 4096, 1024]
    - [14, 9793.78]
  - - [1024, 4096, 1, 8056, 1024, 1024, 1024, 4096]
    - [9, 9251.64]
  - - [1024, 4096, 1, 7776, 1024, 1024, 1024, 4096]
    - [1, 9795.41]
  - - [4096, 1024, 1, 1440, 4096, 4096, 4096, 1024]
    - [16, 9798.47]
  - - [4096, 1024, 1, 3696, 4096, 4096, 4096, 1024]
    - [1, 10352.4]
  - - [1024, 1024, 1, 7344, 1024, 1024, 1024, 1024]
    - [20, 8441.55]
  - - [4096, 1024, 1, 6496, 4096, 4096, 4096, 1024]
    - [1, 9298.25]
  - - [4096, 1024, 1, 7192, 4096, 4096, 4096, 1024]
    - [8, 9110.09]
  - - [1024, 1024, 1, 6208, 1024, 1024, 1024, 1024]
    - [1, 8283.54]
  - - [4096, 1024, 1, 7128, 4096, 4096, 4096, 1024]
    - [8, 9119.36]
  - - [1024, 1024, 1, 6912, 1024, 1024, 1024, 1024]
    - [1, 8159.66]
  - - [1024, 1024, 1, 3264, 1024, 1024, 1024, 1024]
    - [0, 8730.98]
  - - [1024, 4096, 1, 5632, 1024, 1024, 1024, 4096]
    - [1, 9661.29]
  - - [4096, 1024, 1, 7440, 4096, 4096, 4096, 1024]
    - [10, 9220.18]
  - - [1024, 1024, 1, 5184, 1024, 1024, 1024, 1024]
    - [1, 8924.02]
  - - [1024, 1024, 1, 6384, 1024, 1024, 1024, 1024]
    - [0, 8987.76]
  - - [4096, 1024, 1, 3128, 4096, 4096, 4096, 1024]
    - [1, 10437.0]
  - - [4096, 1024, 1, 6768, 4096, 4096, 4096, 1024]
    - [1, 9358.25]
  - - [1024, 33712, 1, 8176, 1024, 1024, 1024, 33712]
    - [7, 10329.5]
  - - [1024, 1024, 1, 8096, 1024, 1024, 1024, 1024]
    - [20, 8540.49]
  - - [1024, 33712, 1, 8064, 1024, 1024, 1024, 33712]
    - [7, 10396.0]
  - - [1024, 4096, 1, 3400, 1024, 1024, 1024, 4096]
    - [11, 9590.43]
  - - [1024, 1024, 1, 3960, 1024, 1024, 1024, 1024]
    - [1, 7688.4]
  - - [4096, 1024, 1, 6440, 4096, 4096, 4096, 1024]
    - [1, 9151.14]
  - - [1024, 1024, 1, 6992, 1024, 1024, 1024, 1024]
    - [20, 8514.84]
  - - [4096, 1024, 1, 7968, 4096, 4096, 4096, 1024]
    - [10, 9434.95]
  - - [1024, 4096, 1, 2992, 1024, 1024, 1024, 4096]
    - [1, 10465.4]
  - - [1024, 1024, 1, 6560, 1024, 1024, 1024, 1024]
    - [24, 8106.24]
  - - [1024, 4096, 1, 8040, 1024, 1024, 1024, 4096]
    - [1, 9858.88]
  - - [4096, 1024, 1, 4320, 4096, 4096, 4096, 1024]
    - [20, 9537.7]
  - - [1024, 4096, 1, 6624, 1024, 1024, 1024, 4096]
    - [1, 10465.2]
  - - [4096, 1024, 1, 7200, 4096, 4096, 4096, 1024]
    - [10, 9214.84]
  - - [1024, 4096, 1, 2184, 1024, 1024, 1024, 4096]
    - [1, 9738.4]
  - - [1024, 1024, 1, 6448, 1024, 1024, 1024, 1024]
    - [20, 8469.28]
  - - [1024, 1024, 1, 7680, 1024, 1024, 1024, 1024]
    - [1, 8954.98]
  - - [1024, 4096, 1, 6240, 1024, 1024, 1024, 4096]
    - [1, 8976.42]
  - - [1024, 1024, 1, 6936, 1024, 1024, 1024, 1024]
    - [0, 8216.85]
  - - [1024, 33712, 1, 7544, 1024, 1024, 1024, 33712]
    - [7, 10209.1]
  - - [1024, 1024, 1, 8176, 1024, 1024, 1024, 1024]
    - [14, 8035.7]
  - - [1024, 33712, 1, 6720, 1024, 1024, 1024, 33712]
    - [11, 10465.7]
  - - [1024, 1024, 1, 7072, 1024, 1024, 1024, 1024]
    - [17, 8097.65]
  - - [4096, 1024, 1, 5576, 4096, 4096, 4096, 1024]
    - [8, 9824.97]
  - - [1024, 1024, 1, 3120, 1024, 1024, 1024, 1024]
    - [1, 8907.5]
  - - [4096, 1024, 1, 7176, 4096, 4096, 4096, 1024]
    - [10, 9173.6]
  - - [1024, 33712, 1, 7912, 1024, 1024, 1024, 33712]
    - [7, 10517.7]
  - - [1024, 4096, 1, 7616, 1024, 1024, 1024, 4096]
    - [10, 9915.73]
  - - [4096, 1024, 1, 2992, 4096, 4096, 4096, 1024]
    - [24, 9277.65]
  - - [1024, 33712, 1, 7208, 1024, 1024, 1024, 33712]
    - [19, 10109.5]
  - - [1024, 33712, 1, 7704, 1024, 1024, 1024, 33712]
    - [7, 10412.5]
  - - [1024, 33712, 1, 7800, 1024, 1024, 1024, 33712]
    - [7, 10405.8]
  - - [1024, 1024, 1, 5888, 1024, 1024, 1024, 1024]
    - [4, 8087.92]
  - - [4096, 1024, 1, 7800, 4096, 4096, 4096, 1024]
    - [1, 8834.18]
  - - [1024, 1024, 1, 4800, 1024, 1024, 1024, 1024]
    - [1, 8265.15]
  - - [1024, 33712, 1, 5984, 1024, 1024, 1024, 33712]
    - [12, 11072.5]
  - - [4096, 1024, 1, 7008, 4096, 4096, 4096, 1024]
    - [10, 9211.52]
  - - [1024, 33712, 1, 7232, 1024, 1024, 1024, 33712]
    - [24, 10385.5]
  - - [1024, 1024, 1, 5400, 1024, 1024, 1024, 1024]
    - [6, 8068.7]
  - - [1024, 33712, 1, 4576, 1024, 1024, 1024, 33712]
    - [11, 10840.5]
  - - [1024, 1024, 1, 7440, 1024, 1024, 1024, 1024]
    - [1, 9580.24]
  - - [1024, 33712, 1, 7616, 1024, 1024, 1024, 33712]
    - [15, 10088.1]
  - - [4096, 1024, 1, 7696, 4096, 4096, 4096, 1024]
    - [10, 9213.8]
  - - [1024, 1024, 1, 4864, 1024, 1024, 1024, 1024]
    - [0, 8281.79]
  - - [1024, 1024, 1, 6080, 1024, 1024, 1024, 1024]
    - [24, 8716.12]
  - - [1024, 4096, 1, 6768, 1024, 1024, 1024, 4096]
    - [1, 9928.84]
  - - [4096, 1024, 1, 5936, 4096, 4096, 4096, 1024]
    - [8, 9129.52]
  - - [1024, 4096, 1, 2576, 1024, 1024, 1024, 4096]
    - [1, 10500.4]
  - - [1024, 4096, 1, 968, 1024, 1024, 1024, 4096]
    - [1, 10152.2]
  - - [1024, 1024, 1, 5616, 1024, 1024, 1024, 1024]
    - [24, 8099.67]
  - - [4096, 1024, 1, 2576, 4096, 4096, 4096, 1024]
    - [1, 9752.05]
  - - [4096, 1024, 1, 4736, 4096, 4096, 4096, 1024]
    - [16, 9400.75]
  - - [4096, 1024, 1, 6912, 4096, 4096, 4096, 1024]
    - [1, 9304.37]
  - - [1024, 1024, 1, 6808, 1024, 1024, 1024, 1024]
    - [1, 8284.61]
  - - [1024, 4096, 1, 6512, 1024, 1024, 1024, 4096]
    - [1, 9735.53]
  - - [4096, 1024, 1, 7488, 4096, 4096, 4096, 1024]
    - [10, 9223.42]
  - - [1024, 4096, 1, 5824, 1024, 1024, 1024, 4096]
    - [1, 9568.62]
  - - [1024, 4096, 1, 8112, 1024, 1024, 1024, 4096]
    - [1, 9444.42]
  - - [1024, 33712, 1, 6048, 1024, 1024, 1024, 33712]
    - [12, 11151.8]
  - - [1024, 4096, 1, 5880, 1024, 1024, 1024, 4096]
    - [8, 9839.47]
  - - [4096, 1024, 1, 6048, 4096, 4096, 4096, 1024]
    - [24, 9215.54]
  - - [1024, 1024, 1, 4096, 1024, 1024, 1024, 1024]
    - [1, 8932.93]
  - - [4096, 1024, 1, 8176, 4096, 4096, 4096, 1024]
    - [10, 9224.57]
  - - [1024, 4096, 1, 3128, 1024, 1024, 1024, 4096]
    - [10, 9813.7]
  - - [1024, 33712, 1, 5760, 1024, 1024, 1024, 33712]
    - [12, 11148.0]
  - - [1024, 33712, 1, 7040, 1024, 1024, 1024, 33712]
    - [12, 10629.3]
  - - [1024, 4096, 1, 6400, 1024, 1024, 1024, 4096]
    - [8, 9158.84]
  - - [1024, 1024, 1, 6944, 1024, 1024, 1024, 1024]
    - [22, 8114.12]
  - - [1024, 4096, 1, 5920, 1024, 1024, 1024, 4096]
    - [1, 10318.7]
  - - [1024, 4096, 1, 1952, 1024, 1024, 1024, 4096]
    - [24, 10156.9]
  - - [4096, 1024, 1, 7360, 4096, 4096, 4096, 1024]
    - [14, 9463.51]
  - - [1024, 1024, 1, 7520, 1024, 1024, 1024, 1024]
    - [22, 8000.47]
  - - [1024, 4096, 1, 2304, 1024, 1024, 1024, 4096]
    - [20, 9625.91]
  - - [1024, 4096, 1, 5472, 1024, 1024, 1024, 4096]
    - [22, 9741.91]
  - - [1024, 4096, 1, 1824, 1024, 1024, 1024, 4096]
    - [24, 10159.3]
  - - [1024, 1024, 1, 4784, 1024, 1024, 1024, 1024]
    - [17, 8686.06]
  - - [4096, 1024, 1, 7248, 4096, 4096, 4096, 1024]
    - [8, 9118.9]
  - - [1024, 1024, 1, 7104, 1024, 1024, 1024, 1024]
    - [1, 8954.06]
  - - [4096, 1024, 1, 7104, 4096, 4096, 4096, 1024]
    - [14, 9209.1]
  - - [1024, 4096, 1, 7104, 1024, 1024, 1024, 4096]
    - [1, 9527.6]
  - - [1024, 4096, 1, 5264, 1024, 1024, 1024, 4096]
    - [12, 9644.4]
  - - [4096, 1024, 1, 7424, 4096, 4096, 4096, 1024]
    - [14, 9449.17]
  - - [1024, 4096, 1, 5120, 1024, 1024, 1024, 4096]
    - [1, 9758.42]
  - - [1024, 33712, 1, 3840, 1024, 1024, 1024, 33712]
    - [9, 9697.36]
  - - [1024, 1024, 1, 6536, 1024, 1024, 1024, 1024]
    - [17, 8730.09]
  - - [1024, 4096, 1, 5712, 1024, 1024, 1024, 4096]
    - [1, 9744.01]
  - - [4096, 1024, 1, 6208, 4096, 4096, 4096, 1024]
    - [20, 9110.11]
  - - [1024, 33712, 1, 7920, 1024, 1024, 1024, 33712]
    - [7, 10394.4]
  - - [1024, 4096, 1, 4896, 1024, 1024, 1024, 4096]
    - [10, 9916.57]
  - - [1024, 4096, 1, 5152, 1024, 1024, 1024, 4096]
    - [22, 10045.5]
  - - [4096, 1024, 1, 3400, 4096, 4096, 4096, 1024]
    - [24, 9711.65]
  - - [1024, 1024, 1, 7888, 1024, 1024, 1024, 1024]
    - [22, 8704.27]
  - - [4096, 1024, 1, 7888, 4096, 4096, 4096, 1024]
    - [10, 9590.39]
  - - [1024, 33712, 1, 6888, 1024, 1024, 1024, 33712]
    - [12, 10712.6]
  - - [4096, 1024, 1, 7480, 4096, 4096, 4096, 1024]
    - [9, 9336.4]
  - - [1024, 1024, 1, 2392, 1024, 1024, 1024, 1024]
    - [1, 8884.19]
  - - [1024, 33712, 1, 6552, 1024, 1024, 1024, 33712]
    - [12, 11087.7]
  - - [1024, 1024, 1, 3672, 1024, 1024, 1024, 1024]
    - [1, 8875.06]
  - - [1024, 4096, 1, 6960, 1024, 1024, 1024, 4096]
    - [1, 10537.2]
  - - [1024, 4096, 1, 7392, 1024, 1024, 1024, 4096]
    - [9, 9257.64]
  - - [4096, 1024, 1, 5440, 4096, 4096, 4096, 1024]
    - [20, 9122.1]
  - - [1024, 33712, 1, 5520, 1024, 1024, 1024, 33712]
    - [12, 10858.9]
  - - [1024, 33712, 1, 6784, 1024, 1024, 1024, 33712]
    - [0, 10500.6]
  - - [4096, 1024, 1, 3240, 4096, 4096, 4096, 1024]
    - [2, 10070.5]
  - - [4096, 1024, 1, 2304, 4096, 4096, 4096, 1024]
    - [1, 9569.48]
  - - [1024, 33712, 1, 2240, 1024, 1024, 1024, 33712]
    - [0, 11008.7]
  - - [1024, 1024, 1, 7896, 1024, 1024, 1024, 1024]
    - [20, 8474.79]
  - - [1024, 4096, 1, 6688, 1024, 1024, 1024, 4096]
    - [9, 9238.14]
  - - [1024, 1024, 1, 5472, 1024, 1024, 1024, 1024]
    - [1, 8285.86]
  - - [1024, 4096, 1, 5808, 1024, 1024, 1024, 4096]
    - [22, 9395.13]
  - - [4096, 1024, 1, 6448, 4096, 4096, 4096, 1024]
    - [20, 9746.29]
  - - [1024, 4096, 1, 7704, 1024, 1024, 1024, 4096]
    - [1, 9423.72]
  - - [1024, 1024, 1, 7192, 1024, 1024, 1024, 1024]
    - [21, 8281.36]
  - - [4096, 1024, 1, 7000, 4096, 4096, 4096, 1024]
    - [8, 9127.09]
  - - [1024, 4096, 1, 6536, 1024, 1024, 1024, 4096]
    - [1, 9660.12]
  - - [1024, 1024, 1, 7600, 1024, 1024, 1024, 1024]
    - [0, 8237.36]
  - - [1024, 1024, 1, 6720, 1024, 1024, 1024, 1024]
    - [20, 8145.0]
  - - [4096, 1024, 1, 7600, 4096, 4096, 4096, 1024]
    - [14, 9386.07]
  - - [1024, 4096, 1, 7600, 1024, 1024, 1024, 4096]
    - [1, 9757.27]
  - - [1024, 4096, 1, 7760, 1024, 1024, 1024, 4096]
    - [1, 9126.82]
  - - [1024, 4096, 1, 8192, 1024, 1024, 1024, 4096]
    - [10, 9231.49]
  - - [1024, 4096, 1, 4888, 1024, 1024, 1024, 4096]
    - [22, 9501.73]
  - - [1024, 4096, 1, 7168, 1024, 1024, 1024, 4096]
    - [1, 9650.46]
  - - [4096, 1024, 1, 4888, 4096, 4096, 4096, 1024]
    - [20, 9757.88]
  - - [1024, 33712, 1, 7392, 1024, 1024, 1024, 33712]
    - [19, 10060.1]
  - - [1024, 1024, 1, 2944, 1024, 1024, 1024, 1024]
    - [18, 8563.58]
  - - [1024, 1024, 1, 7752, 1024, 1024, 1024, 1024]
    - [1, 8940.31]
  - - [1024, 4096, 1, 1144, 1024, 1024, 1024, 4096]
    - [16, 9576.62]
  - - [4096, 1024, 1, 3952, 4096, 4096, 4096, 1024]
    - [1, 10110.7]
  - - [1024, 33712, 1, 5280, 1024, 1024, 1024, 33712]
    - [12, 10957.7]
  - - [4096, 1024, 1, 6000, 4096, 4096, 4096, 1024]
    - [20, 9598.5]
  - - [1024, 1024, 1, 7560, 1024, 1024, 1024, 1024]
    - [0, 8829.99]
  - - [1024, 33712, 1, 5440, 1024, 1024, 1024, 33712]
    - [12, 10753.7]
  - - [1024, 4096, 1, 7200, 1024, 1024, 1024, 4096]
    - [1, 10910.9]
  - - [1024, 33712, 1, 7280, 1024, 1024, 1024, 33712]
    - [18, 10197.0]
  - - [1024, 4096, 1, 7656, 1024, 1024, 1024, 4096]
    - [7, 9301.42]
  - - [1024, 1024, 1, 7656, 1024, 1024, 1024, 1024]
    - [20, 8024.02]
  - - [4096, 1024, 1, 3000, 4096, 4096, 4096, 1024]
    - [24, 9529.59]
  - - [1024, 1024, 1, 8000, 1024, 1024, 1024, 1024]
    - [1, 8954.51]
  - - [4096, 1024, 1, 6240, 4096, 4096, 4096, 1024]
    - [8, 9134.06]
  - - [1024, 33712, 1, 4800, 1024, 1024, 1024, 33712]
    - [11, 11599.0]
  - - [1024, 33712, 1, 7344, 1024, 1024, 1024, 33712]
    - [18, 10314.9]
  - - [1024, 4096, 1, 3344, 1024, 1024, 1024, 4096]
    - [11, 8901.82]
  - - [4096, 1024, 1, 4488, 4096, 4096, 4096, 1024]
    - [22, 9533.25]
  - - [1024, 1024, 1, 3344, 1024, 1024, 1024, 1024]
    - [1, 8904.99]
  - - [1024, 4096, 1, 7128, 1024, 1024, 1024, 4096]
    - [9, 9235.88]
  - - [1024, 33712, 1, 6336, 1024, 1024, 1024, 33712]
    - [12, 10892.0]
  - - [4096, 1024, 1, 3360, 4096, 4096, 4096, 1024]
    - [1, 11114.2]
  - - [4096, 1024, 1, 3264, 4096, 4096, 4096, 1024]
    - [16, 10220.8]
  - - [1024, 4096, 1, 3360, 1024, 1024, 1024, 4096]
    - [1, 9685.52]
  - - [1024, 1024, 1, 3360, 1024, 1024, 1024, 1024]
    - [18, 8083.71]
  - - [1024, 1024, 1, 5952, 1024, 1024, 1024, 1024]
    - [1, 9575.77]
  - - [4096, 1024, 1, 5952, 4096, 4096, 4096, 1024]
    - [20, 9250.46]
  - - [1024, 1024, 1, 6840, 1024, 1024, 1024, 1024]
    - [1, 8282.79]
  - - [4096, 1024, 1, 3528, 4096, 4096, 4096, 1024]
    - [24, 10109.2]
  - - [1024, 1024, 1, 6000, 1024, 1024, 1024, 1024]
    - [17, 8746.85]
  - - [1024, 1024, 1, 5680, 1024, 1024, 1024, 1024]
    - [22, 8084.33]
  - - [4096, 1024, 1, 5200, 4096, 4096, 4096, 1024]
    - [1, 9492.32]
  - - [1024, 4096, 1, 5200, 1024, 1024, 1024, 4096]
    - [22, 9934.73]
  - - [1024, 1024, 1, 5200, 1024, 1024, 1024, 1024]
    - [1, 8265.49]
  - - [1024, 1024, 1, 1760, 1024, 1024, 1024, 1024]
    - [1, 8232.91]
  - - [4096, 1024, 1, 1760, 4096, 4096, 4096, 1024]
    - [1, 10465.5]
  - - [4096, 1024, 1, 6392, 4096, 4096, 4096, 1024]
    - [20, 9404.08]
  - - [1024, 4096, 1, 1760, 1024, 1024, 1024, 4096]
    - [24, 10211.9]
  - - [1024, 33712, 1, 4736, 1024, 1024, 1024, 33712]
    - [9, 10593.0]
  - - [1024, 1024, 1, 7592, 1024, 1024, 1024, 1024]
    - [20, 8043.78]
  - - [4096, 1024, 1, 7592, 4096, 4096, 4096, 1024]
    - [10, 9194.48]
  - - [1024, 33712, 1, 4872, 1024, 1024, 1024, 33712]
    - [10, 11127.4]
  - - [1024, 4096, 1, 7592, 1024, 1024, 1024, 4096]
    - [1, 9349.76]
  - - [1024, 4096, 1, 5440, 1024, 1024, 1024, 4096]
    - [1, 9661.32]
  - - [1024, 1024, 1, 7904, 1024, 1024, 1024, 1024]
    - [1, 8296.54]
  - - [1024, 1024, 1, 3520, 1024, 1024, 1024, 1024]
    - [18, 8599.67]
  - - [1024, 4096, 1, 6408, 1024, 1024, 1024, 4096]
    - [1, 10459.0]
  - - [1024, 1024, 1, 3200, 1024, 1024, 1024, 1024]
    - [1, 8783.86]
  - - [1024, 4096, 1, 3200, 1024, 1024, 1024, 4096]
    - [10, 9785.45]
  - - [4096, 1024, 1, 2352, 4096, 4096, 4096, 1024]
    - [20, 9785.9]
  - - [1024, 33712, 1, 6936, 1024, 1024, 1024, 33712]
    - [12, 10606.3]
  - - [1024, 1024, 1, 2160, 1024, 1024, 1024, 1024]
    - [14, 8524.99]
  - - [1024, 33712, 1, 6880, 1024, 1024, 1024, 33712]
    - [12, 10345.8]
  - - [1024, 1024, 1, 7056, 1024, 1024, 1024, 1024]
    - [24, 8776.25]
  - - [1024, 4096, 1, 7056, 1024, 1024, 1024, 4096]
    - [1, 9756.74]
  - - [1024, 1024, 1, 7504, 1024, 1024, 1024, 1024]
    - [20, 8328.91]
  - - [1024, 33712, 1, 5632, 1024, 1024, 1024, 33712]
    - [9, 10540.5]
  - - [4096, 1024, 1, 6384, 4096, 4096, 4096, 1024]
    - [20, 9901.03]
  - - [1024, 33712, 1, 7520, 1024, 1024, 1024, 33712]
    - [15, 10193.0]
  - - [4096, 1024, 1, 7520, 4096, 4096, 4096, 1024]
    - [2, 9236.58]
  - - [4096, 1024, 1, 1248, 4096, 4096, 4096, 1024]
    - [1, 10372.7]
  - - [1024, 1024, 1, 3000, 1024, 1024, 1024, 1024]
    - [0, 8874.18]
  - - [1024, 4096, 1, 4368, 1024, 1024, 1024, 4096]
    - [8, 9841.77]
  - - [1024, 1024, 1, 5600, 1024, 1024, 1024, 1024]
    - [1, 8912.1]
  - - [4096, 1024, 1, 2720, 4096, 4096, 4096, 1024]
    - [24, 9187.34]
  - - [4096, 1024, 1, 5600, 4096, 4096, 4096, 1024]
    - [16, 10171.5]
  - - [1024, 4096, 1, 6000, 1024, 1024, 1024, 4096]
    - [1, 10388.8]
  - - [1024, 4096, 1, 5600, 1024, 1024, 1024, 4096]
    - [1, 9764.54]
  - - [1024, 33712, 1, 5952, 1024, 1024, 1024, 33712]
    - [12, 11288.1]
  - - [4096, 1024, 1, 5568, 4096, 4096, 4096, 1024]
    - [2, 10200.7]
  - - [4096, 1024, 1, 4624, 4096, 4096, 4096, 1024]
    - [20, 9938.91]
  - - [1024, 1024, 1, 6232, 1024, 1024, 1024, 1024]
    - [1, 8916.47]
  - - [1024, 33712, 1, 5920, 1024, 1024, 1024, 33712]
    - [12, 11238.2]
  - - [1024, 4096, 1, 6232, 1024, 1024, 1024, 4096]
    - [1, 10656.4]
  - - [4096, 1024, 1, 3960, 4096, 4096, 4096, 1024]
    - [22, 9220.88]
  - - [1024, 33712, 1, 7832, 1024, 1024, 1024, 33712]
    - [7, 10410.2]
  - - [1024, 1024, 1, 3328, 1024, 1024, 1024, 1024]
    - [14, 8028.83]
  - - [1024, 33712, 1, 5376, 1024, 1024, 1024, 33712]
    - [12, 10758.5]
  - - [1024, 4096, 1, 4608, 1024, 1024, 1024, 4096]
    - [1, 11138.9]
  - - [1024, 1024, 1, 7216, 1024, 1024, 1024, 1024]
    - [1, 8292.24]
  - - [1024, 33712, 1, 5200, 1024, 1024, 1024, 33712]
    - [13, 10439.0]
  - - [4096, 1024, 1, 7392, 4096, 4096, 4096, 1024]
    - [10, 9940.55]
  - - [1024, 1024, 1, 6864, 1024, 1024, 1024, 1024]
    - [1, 8286.59]
  - - [1024, 1024, 1, 2720, 1024, 1024, 1024, 1024]
    - [24, 8609.39]
  - - [1024, 1024, 1, 7544, 1024, 1024, 1024, 1024]
    - [20, 8601.29]
  - - [1024, 1024, 1, 5440, 1024, 1024, 1024, 1024]
    - [14, 8100.77]
  - - [4096, 1024, 1, 7544, 4096, 4096, 4096, 1024]
    - [14, 8857.27]
  - - [1024, 33712, 1, 8096, 1024, 1024, 1024, 33712]
    - [7, 10427.6]
  - - [1024, 1024, 1, 4960, 1024, 1024, 1024, 1024]
    - [24, 8839.09]
  - - [1024, 1024, 1, 3456, 1024, 1024, 1024, 1024]
    - [1, 8290.32]
  - - [1024, 4096, 1, 3456, 1024, 1024, 1024, 4096]
    - [10, 9866.77]
  - - [1024, 1024, 1, 2576, 1024, 1024, 1024, 1024]
    - [18, 8539.21]
  - - [1024, 33712, 1, 1824, 1024, 1024, 1024, 33712]
    - [7, 11226.8]
  - - [1024, 4096, 1, 2976, 1024, 1024, 1024, 4096]
    - [2, 9613.53]
  - - [1024, 33712, 1, 5032, 1024, 1024, 1024, 33712]
    - [21, 10156.9]
  - - [4096, 1024, 1, 1952, 4096, 4096, 4096, 1024]
    - [8, 10148.8]
  - - [1024, 4096, 1, 5032, 1024, 1024, 1024, 4096]
    - [22, 9996.24]
  - - [1024, 1024, 1, 5032, 1024, 1024, 1024, 1024]
    - [18, 8698.92]
  - - [1024, 4096, 1, 4096, 1024, 1024, 1024, 4096]
    - [24, 9518.96]
  - - [4096, 1024, 1, 3864, 4096, 4096, 4096, 1024]
    - [1, 9687.93]
  - - [1024, 33712, 1, 3952, 1024, 1024, 1024, 33712]
    - [0, 10414.5]
  - - [1024, 1024, 1, 3952, 1024, 1024, 1024, 1024]
    - [17, 8049.65]
  - - [1024, 33712, 1, 7192, 1024, 1024, 1024, 33712]
    - [18, 10323.7]
  - - [1024, 1024, 1, 1472, 1024, 1024, 1024, 1024]
    - [17, 8817.98]
  - - [4096, 1024, 1, 7784, 4096, 4096, 4096, 1024]
    - [10, 9204.6]
  - - [4096, 1024, 1, 1472, 4096, 4096, 4096, 1024]
    - [24, 9981.24]
  - - [1024, 1024, 1, 6216, 1024, 1024, 1024, 1024]
    - [1, 8898.44]
  - - [1024, 4096, 1, 5792, 1024, 1024, 1024, 4096]
    - [22, 9869.56]
  - - [1024, 4096, 1, 4032, 1024, 1024, 1024, 4096]
    - [1, 10485.7]
  - - [1024, 33712, 1, 5208, 1024, 1024, 1024, 33712]
    - [12, 10722.1]
  - - [4096, 1024, 1, 5208, 4096, 4096, 4096, 1024]
    - [2, 10258.0]
  - - [1024, 4096, 1, 5208, 1024, 1024, 1024, 4096]
    - [1, 10429.7]
  - - [1024, 1024, 1, 5208, 1024, 1024, 1024, 1024]
    - [1, 8258.18]
  - - [1024, 33712, 1, 8040, 1024, 1024, 1024, 33712]
    - [7, 10435.1]
  - - [1024, 1024, 1, 968, 1024, 1024, 1024, 1024]
    - [18, 8509.57]
  - - [4096, 1024, 1, 4968, 4096, 4096, 4096, 1024]
    - [1, 9709.08]
  - - [4096, 1024, 1, 7896, 4096, 4096, 4096, 1024]
    - [10, 9203.16]
  - - [1024, 4096, 1, 4968, 1024, 1024, 1024, 4096]
    - [1, 9690.65]
  - - [4096, 1024, 1, 3328, 4096, 4096, 4096, 1024]
    - [1, 9706.41]
  - - [1024, 4096, 1, 8160, 1024, 1024, 1024, 4096]
    - [1, 9744.61]
  - - [4096, 1024, 1, 5680, 4096, 4096, 4096, 1024]
    - [8, 9809.43]
  - - [4096, 1024, 1, 6840, 4096, 4096, 4096, 1024]
    - [24, 9623.55]
  - - [1024, 33712, 1, 6448, 1024, 1024, 1024, 33712]
    - [12, 11126.3]
  - - [4096, 1024, 1, 6400, 4096, 4096, 4096, 1024]
    - [1, 9544.68]
  - - [1024, 33712, 1, 6440, 1024, 1024, 1024, 33712]
    - [12, 10605.4]
  - - [1024, 33712, 1, 5104, 1024, 1024, 1024, 33712]
    - [0, 11030.8]
  - - [4096, 1024, 1, 5792, 4096, 4096, 4096, 1024]
    - [2, 10290.3]
  - - [1024, 1024, 1, 5520, 1024, 1024, 1024, 1024]
    - [1, 8943.33]
  - - [4096, 1024, 1, 2736, 4096, 4096, 4096, 1024]
    - [14, 9401.28]
  - - [1024, 1024, 1, 1952, 1024, 1024, 1024, 1024]
    - [1, 8874.51]
  - - [4096, 1024, 1, 4224, 4096, 4096, 4096, 1024]
    - [1, 9399.37]
  - - [1024, 1024, 1, 7448, 1024, 1024, 1024, 1024]
    - [1, 8782.91]
  - - [1024, 4096, 1, 7448, 1024, 1024, 1024, 4096]
    - [9, 9244.52]
  - - [1024, 33712, 1, 2992, 1024, 1024, 1024, 33712]
    - [0, 10144.0]
  - - [4096, 1024, 1, 5336, 4096, 4096, 4096, 1024]
    - [20, 9986.76]
  - - [4096, 1024, 1, 3584, 4096, 4096, 4096, 1024]
    - [1, 10390.1]
  - - [1024, 4096, 1, 1472, 1024, 1024, 1024, 4096]
    - [1, 9725.89]
  - - [1024, 33712, 1, 6320, 1024, 1024, 1024, 33712]
    - [10, 10714.4]
  - - [4096, 1024, 1, 1144, 4096, 4096, 4096, 1024]
    - [1, 10289.6]
  - - [1024, 1024, 1, 7080, 1024, 1024, 1024, 1024]
    - [1, 8932.4]
  - - [4096, 1024, 1, 7080, 4096, 4096, 4096, 1024]
    - [1, 9191.17]
  - - [4096, 1024, 1, 6528, 4096, 4096, 4096, 1024]
    - [16, 9517.63]
  - - [1024, 1024, 1, 5704, 1024, 1024, 1024, 1024]
    - [1, 8747.31]
  - - [1024, 4096, 1, 4816, 1024, 1024, 1024, 4096]
    - [1, 9479.16]
  - - [4096, 1024, 1, 5704, 4096, 4096, 4096, 1024]
    - [20, 9270.95]
  - - [4096, 1024, 1, 2600, 4096, 4096, 4096, 1024]
    - [1, 10434.4]
  - - [1024, 4096, 1, 2600, 1024, 1024, 1024, 4096]
    - [1, 10432.0]
  - - [1024, 1024, 1, 4896, 1024, 1024, 1024, 1024]
    - [1, 8262.22]
  - - [1024, 4096, 1, 3696, 1024, 1024, 1024, 4096]
    - [10, 9878.98]
  - - [4096, 1024, 1, 5760, 4096, 4096, 4096, 1024]
    - [16, 10378.7]
  - - [1024, 1024, 1, 6072, 1024, 1024, 1024, 1024]
    - [1, 8263.59]
  - - [4096, 1024, 1, 6072, 4096, 4096, 4096, 1024]
    - [16, 10201.8]
  - - [4096, 1024, 1, 6696, 4096, 4096, 4096, 1024]
    - [1, 9293.26]
  - - [4096, 1024, 1, 1320, 4096, 4096, 4096, 1024]
    - [1, 10290.8]
  - - [1024, 4096, 1, 7192, 1024, 1024, 1024, 4096]
    - [9, 9947.15]
  - - [1024, 4096, 1, 7224, 1024, 1024, 1024, 4096]
    - [1, 9604.03]
  - - [1024, 33712, 1, 4488, 1024, 1024, 1024, 33712]
    - [7, 10508.5]
  - - [1024, 1024, 1, 4488, 1024, 1024, 1024, 1024]
    - [14, 8000.12]
  - - [1024, 4096, 1, 3584, 1024, 1024, 1024, 4096]
    - [1, 9272.81]
  - - [4096, 1024, 1, 5264, 4096, 4096, 4096, 1024]
    - [20, 9883.41]
  - - [1024, 1024, 1, 6576, 1024, 1024, 1024, 1024]
    - [1, 8935.59]
  - - [1024, 1024, 1, 5264, 1024, 1024, 1024, 1024]
    - [1, 8935.0]
  - - [1024, 33712, 1, 3328, 1024, 1024, 1024, 33712]
    - [11, 10470.2]
  - - [1024, 1024, 1, 5832, 1024, 1024, 1024, 1024]
    - [18, 8179.0]
  - - [1024, 33712, 1, 6944, 1024, 1024, 1024, 33712]
    - [11, 10620.7]
  - - [1024, 1024, 1, 1320, 1024, 1024, 1024, 1024]
    - [18, 8318.01]
  - - [1024, 4096, 1, 4440, 1024, 1024, 1024, 4096]
    - [8, 9819.59]
  - - [1024, 4096, 1, 7848, 1024, 1024, 1024, 4096]
    - [16, 9378.0]
  - - [1024, 1024, 1, 4224, 1024, 1024, 1024, 1024]
    - [1, 8286.88]
  - - [4096, 1024, 1, 6808, 4096, 4096, 4096, 1024]
    - [20, 9187.26]
  - - [4096, 1024, 1, 4704, 4096, 4096, 4096, 1024]
    - [16, 10329.4]
  - - [1024, 1024, 1, 5880, 1024, 1024, 1024, 1024]
    - [1, 8930.48]
  - - [1024, 4096, 1, 2944, 1024, 1024, 1024, 4096]
    - [9, 9176.02]
  - - [1024, 1024, 1, 1248, 1024, 1024, 1024, 1024]
    - [1, 7944.5]
  - - [1024, 1024, 1, 4608, 1024, 1024, 1024, 1024]
    - [1, 8790.25]
  - - [1024, 1024, 1, 3384, 1024, 1024, 1024, 1024]
    - [1, 8722.65]
  - - [4096, 1024, 1, 3384, 4096, 4096, 4096, 1024]
    - [24, 9805.38]
  - - [1024, 4096, 1, 3384, 1024, 1024, 1024, 4096]
    - [10, 9785.91]
  - - [1024, 1024, 1, 3528, 1024, 1024, 1024, 1024]
    - [1, 8219.35]
  - - [1024, 1024, 1, 3536, 1024, 1024, 1024, 1024]
    - [1, 8131.04]
  - - [1024, 1024, 1, 4752, 1024, 1024, 1024, 1024]
    - [1, 8902.98]
  - - [4096, 1024, 1, 8136, 4096, 4096, 4096, 1024]
    - [8, 9051.66]
  - - [4096, 1024, 1, 4752, 4096, 4096, 4096, 1024]
    - [1, 9715.75]
  - - [1024, 4096, 1, 6392, 1024, 1024, 1024, 4096]
    - [1, 10337.3]
  - - [4096, 1024, 1, 4352, 4096, 4096, 4096, 1024]
    - [16, 9801.09]
  - - [1024, 33712, 1, 7592, 1024, 1024, 1024, 33712]
    - [15, 10210.6]
  - - [1024, 33712, 1, 4816, 1024, 1024, 1024, 33712]
    - [8, 9494.75]
  - - [1024, 33712, 1, 3000, 1024, 1024, 1024, 33712]
    - [9, 9791.96]
  - - [4096, 1024, 1, 4816, 4096, 4096, 4096, 1024]
    - [22, 9688.66]
  - - [4096, 1024, 1, 7552, 4096, 4096, 4096, 1024]
    - [14, 9222.3]
  - - [1024, 33712, 1, 7320, 1024, 1024, 1024, 33712]
    - [18, 10203.7]
  - - [1024, 4096, 1, 7800, 1024, 1024, 1024, 4096]
    - [9, 9233.31]
  - - [1024, 1024, 1, 7480, 1024, 1024, 1024, 1024]
    - [20, 8061.3]
  - - [1024, 1024, 1, 2592, 1024, 1024, 1024, 1024]
    - [18, 8058.29]
  - - [1024, 4096, 1, 2592, 1024, 1024, 1024, 4096]
    - [1, 9694.32]
  - - [1024, 33712, 1, 3536, 1024, 1024, 1024, 33712]
    - [11, 10768.2]
  - - [4096, 1024, 1, 5520, 4096, 4096, 4096, 1024]
    - [8, 9841.06]
  - - [1024, 33712, 1, 7552, 1024, 1024, 1024, 33712]
    - [15, 10220.6]
  - - [4096, 1024, 1, 3536, 4096, 4096, 4096, 1024]
    - [14, 9911.13]
  - - [1024, 33712, 1, 6512, 1024, 1024, 1024, 33712]
    - [12, 11104.8]
  - - [1024, 33712, 1, 3672, 1024, 1024, 1024, 33712]
    - [0, 11291.9]
  - - [1024, 4096, 1, 3672, 1024, 1024, 1024, 4096]
    - [11, 8903.39]
  - - [1024, 4096, 1, 4960, 1024, 1024, 1024, 4096]
    - [22, 9342.07]
  - - [1024, 33712, 1, 6360, 1024, 1024, 1024, 33712]
    - [12, 11174.2]
  - - [4096, 1024, 1, 6360, 4096, 4096, 4096, 1024]
    - [20, 9961.64]
  - - [1024, 4096, 1, 6728, 1024, 1024, 1024, 4096]
    - [1, 10525.1]
  - - [1024, 4096, 1, 6360, 1024, 1024, 1024, 4096]
    - [17, 9141.77]
  - - [1024, 1024, 1, 6360, 1024, 1024, 1024, 1024]
    - [1, 8303.77]
  - - [1024, 1024, 1, 1512, 1024, 1024, 1024, 1024]
    - [1, 8780.7]
  - - [1024, 4096, 1, 1512, 1024, 1024, 1024, 4096]
    - [1, 9689.78]
  - - [1024, 1024, 1, 1960, 1024, 1024, 1024, 1024]
    - [0, 8810.03]
  - - [4096, 1024, 1, 1960, 4096, 4096, 4096, 1024]
    - [1, 10253.5]
  - - [1024, 33712, 1, 5824, 1024, 1024, 1024, 33712]
    - [12, 11212.7]
  - - [1024, 33712, 1, 7568, 1024, 1024, 1024, 33712]
    - [15, 10164.7]
  - - [1024, 33712, 1, 2584, 1024, 1024, 1024, 33712]
    - [1, 9475.08]
  - - [4096, 1024, 1, 6592, 4096, 4096, 4096, 1024]
    - [14, 9311.85]
  - - [4096, 1024, 1, 2584, 4096, 4096, 4096, 1024]
    - [1, 9580.34]
  - - [1024, 1024, 1, 2584, 1024, 1024, 1024, 1024]
    - [1, 8613.66]
  - - [1024, 33712, 1, 5424, 1024, 1024, 1024, 33712]
    - [12, 10929.6]
  - - [4096, 1024, 1, 5424, 4096, 4096, 4096, 1024]
    - [20, 9973.45]
  - - [1024, 4096, 1, 5424, 1024, 1024, 1024, 4096]
    - [1, 10444.1]
  - - [4096, 1024, 1, 4368, 4096, 4096, 4096, 1024]
    - [22, 9530.49]
  - - [1024, 1024, 1, 7744, 1024, 1024, 1024, 1024]
    - [1, 8943.68]
  - - [1024, 1024, 1, 6976, 1024, 1024, 1024, 1024]
    - [20, 8436.57]
  - - [1024, 1024, 1, 6512, 1024, 1024, 1024, 1024]
    - [1, 8917.96]
  - - [1024, 1024, 1, 4736, 1024, 1024, 1024, 1024]
    - [0, 8860.34]
  - - [1024, 33712, 1, 2576, 1024, 1024, 1024, 33712]
    - [0, 10948.4]
  - - [1024, 33712, 1, 6968, 1024, 1024, 1024, 33712]
    - [12, 10238.0]
  - - [4096, 1024, 1, 6968, 4096, 4096, 4096, 1024]
    - [10, 9506.43]
  - - [1024, 1024, 1, 6968, 1024, 1024, 1024, 1024]
    - [1, 8860.18]
  - - [1024, 4096, 1, 2352, 1024, 1024, 1024, 4096]
    - [1, 10391.2]
  - - [1024, 1024, 1, 2352, 1024, 1024, 1024, 1024]
    - [24, 8487.89]
  - - [1024, 4096, 1, 6800, 1024, 1024, 1024, 4096]
    - [9, 9250.75]
  - - [4096, 1024, 1, 7704, 4096, 4096, 4096, 1024]
    - [10, 9191.68]
  - - [1024, 1024, 1, 7704, 1024, 1024, 1024, 1024]
    - [1, 8295.21]
  - - [4096, 1024, 1, 4144, 4096, 4096, 4096, 1024]
    - [16, 11013.5]
  - - [4096, 1024, 1, 4032, 4096, 4096, 4096, 1024]
    - [1, 9948.81]
  - - [1024, 33712, 1, 3120, 1024, 1024, 1024, 33712]
    - [0, 10597.2]
  - - [4096, 1024, 1, 7776, 4096, 4096, 4096, 1024]
    - [10, 9206.36]
  - - [1024, 33712, 1, 8184, 1024, 1024, 1024, 33712]
    - [7, 10396.3]
  - - [1024, 33712, 1, 6656, 1024, 1024, 1024, 33712]
    - [12, 10915.1]
  - - [4096, 1024, 1, 7632, 4096, 4096, 4096, 1024]
    - [8, 9154.74]
  - - [1024, 4096, 1, 7632, 1024, 1024, 1024, 4096]
    - [1, 10377.5]
  - - [1024, 33712, 1, 4368, 1024, 1024, 1024, 33712]
    - [16, 9677.69]
  - - [1024, 4096, 1, 7000, 1024, 1024, 1024, 4096]
    - [1, 10760.9]
  - - [1024, 4096, 1, 1320, 1024, 1024, 1024, 4096]
    - [1, 9668.32]
  - - [4096, 1024, 1, 4096, 4096, 4096, 4096, 1024]
    - [1, 10192.1]
  - - [1024, 4096, 1, 6272, 1024, 1024, 1024, 4096]
    - [1, 9410.0]
  - - [1024, 33712, 1, 6272, 1024, 1024, 1024, 33712]
    - [12, 11234.3]
  - - [1024, 4096, 1, 1960, 1024, 1024, 1024, 4096]
    - [7, 10184.4]
  - - [1024, 4096, 1, 5952, 1024, 1024, 1024, 4096]
    - [20, 9432.78]
  - - [1024, 1024, 1, 7920, 1024, 1024, 1024, 1024]
    - [1, 8304.7]
  - - [1024, 33712, 1, 6528, 1024, 1024, 1024, 33712]
    - [12, 11074.4]
  - - [4096, 1024, 1, 7320, 4096, 4096, 4096, 1024]
    - [10, 9196.68]
  - - [1024, 33712, 1, 7752, 1024, 1024, 1024, 33712]
    - [7, 10498.3]
  - - [1024, 33712, 1, 3864, 1024, 1024, 1024, 33712]
    - [9, 10422.5]
  - - [1024, 1024, 1, 4480, 1024, 1024, 1024, 1024]
    - [18, 8040.55]
  - - [4096, 1024, 1, 4480, 4096, 4096, 4096, 1024]
    - [22, 9503.17]
  - - [1024, 4096, 1, 4480, 1024, 1024, 1024, 4096]
    - [1, 10478.7]
  - - [1024, 33712, 1, 7056, 1024, 1024, 1024, 33712]
    - [12, 10576.2]
  - - [1024, 33712, 1, 7632, 1024, 1024, 1024, 33712]
    - [15, 10190.6]
  - - [1024, 4096, 1, 5616, 1024, 1024, 1024, 4096]
    - [22, 9978.29]
  - - [1024, 33712, 1, 6192, 1024, 1024, 1024, 33712]
    - [12, 11185.7]
  - - [4096, 1024, 1, 6944, 4096, 4096, 4096, 1024]
    - [24, 9784.84]
  - - [1024, 4096, 1, 6784, 1024, 1024, 1024, 4096]
    - [1, 10086.9]
  - - [1024, 1024, 1, 6784, 1024, 1024, 1024, 1024]
    - [23, 8496.8]
  - - [4096, 1024, 1, 2240, 4096, 4096, 4096, 1024]
    - [1, 10361.8]
  - - [1024, 4096, 1, 4352, 1024, 1024, 1024, 4096]
    - [1, 10406.8]
  - - [1024, 4096, 1, 2240, 1024, 1024, 1024, 4096]
    - [1, 9619.93]
  - - [1024, 1024, 1, 2240, 1024, 1024, 1024, 1024]
    - [17, 8490.48]
  - - [4096, 1024, 1, 4576, 4096, 4096, 4096, 1024]
    - [16, 10128.1]
  - - [1024, 33712, 1, 7360, 1024, 1024, 1024, 33712]
    - [15, 10370.6]
  - - [1024, 1024, 1, 4576, 1024, 1024, 1024, 1024]
    - [22, 8070.29]
  - - [4096, 1024, 1, 4200, 4096, 4096, 4096, 1024]
    - [20, 9639.31]
  - - [4096, 1024, 1, 6976, 4096, 4096, 4096, 1024]
    - [1, 9331.11]
  - - [1024, 33712, 1, 5568, 1024, 1024, 1024, 33712]
    - [12, 11122.1]
  - - [1024, 33712, 1, 3072, 1024, 1024, 1024, 33712]
    - [10, 10095.5]
  - - [4096, 1024, 1, 3072, 4096, 4096, 4096, 1024]
    - [3, 9025.54]
  - - [1024, 4096, 1, 3072, 1024, 1024, 1024, 4096]
    - [9, 9143.39]
  - - [1024, 1024, 1, 3072, 1024, 1024, 1024, 1024]
    - [1, 8144.26]
  - - [4096, 1024, 1, 8064, 4096, 4096, 4096, 1024]
    - [14, 9261.03]
  - - [1024, 4096, 1, 2720, 1024, 1024, 1024, 4096]
    - [1, 9756.84]
  - - [1024, 33712, 1, 6688, 1024, 1024, 1024, 33712]
    - [12, 10811.1]
  - - [1024, 33712, 1, 4032, 1024, 1024, 1024, 33712]
    - [21, 9662.92]
  - - [4096, 1024, 1, 5984, 4096, 4096, 4096, 1024]
    - [24, 9358.74]
  - - [1024, 33712, 1, 5040, 1024, 1024, 1024, 33712]
    - [19, 10040.7]
  - - [1024, 4096, 1, 7320, 1024, 1024, 1024, 4096]
    - [8, 9135.61]
  - - [1024, 33712, 1, 3680, 1024, 1024, 1024, 33712]
    - [11, 10084.1]
  - - [4096, 1024, 1, 3680, 4096, 4096, 4096, 1024]
    - [16, 9484.22]
  - - [1024, 4096, 1, 5984, 1024, 1024, 1024, 4096]
    - [22, 10027.6]
  - - [1024, 4096, 1, 3536, 1024, 1024, 1024, 4096]
    - [9, 9867.35]
  - - [1024, 4096, 1, 3680, 1024, 1024, 1024, 4096]
    - [24, 9305.81]
  - - [1024, 4096, 1, 3888, 1024, 1024, 1024, 4096]
    - [24, 9591.24]
  - - [4096, 1024, 1, 6936, 4096, 4096, 4096, 1024]
    - [2, 8874.59]
  - - [4096, 1024, 1, 7688, 4096, 4096, 4096, 1024]
    - [10, 9203.81]
  - - [1024, 1024, 1, 7008, 1024, 1024, 1024, 1024]
    - [1, 8161.26]
  - - [1024, 1024, 1, 3680, 1024, 1024, 1024, 1024]
    - [17, 8600.99]
  - - [1024, 1024, 1, 5808, 1024, 1024, 1024, 1024]
    - [1, 8937.12]
  - - [4096, 1024, 1, 5808, 4096, 4096, 4096, 1024]
    - [8, 9830.37]
  - - [1024, 33712, 1, 5888, 1024, 1024, 1024, 33712]
    - [12, 11175.9]
  - - [1024, 33712, 1, 6112, 1024, 1024, 1024, 33712]
    - [12, 11246.5]
  - - [1024, 4096, 1, 4200, 1024, 1024, 1024, 4096]
    - [11, 9627.93]
  - - [1024, 4096, 1, 6112, 1024, 1024, 1024, 4096]
    - [8, 9840.74]
  - - [1024, 1024, 1, 6112, 1024, 1024, 1024, 1024]
    - [0, 8898.25]
  - - [4096, 1024, 1, 4432, 4096, 4096, 4096, 1024]
    - [1, 10170.0]
  - - [4096, 1024, 1, 4960, 4096, 4096, 4096, 1024]
    - [20, 10147.0]
  - - [1024, 33712, 1, 5184, 1024, 1024, 1024, 33712]
    - [12, 10551.8]
  - - [1024, 4096, 1, 7072, 1024, 1024, 1024, 4096]
    - [22, 9332.38]
  - - [1024, 1024, 1, 3040, 1024, 1024, 1024, 1024]
    - [14, 8633.97]
  - - [4096, 1024, 1, 3040, 4096, 4096, 4096, 1024]
    - [1, 10446.6]
  - - [1024, 4096, 1, 6160, 1024, 1024, 1024, 4096]
    - [1, 9721.58]
  - - [1024, 33712, 1, 8056, 1024, 1024, 1024, 33712]
    - [7, 10425.1]
  - - [1024, 1024, 1, 7784, 1024, 1024, 1024, 1024]
    - [21, 8362.12]
  - - [1024, 33712, 1, 7536, 1024, 1024, 1024, 33712]
    - [7, 10240.6]
  - - [1024, 33712, 1, 7952, 1024, 1024, 1024, 33712]
    - [7, 10415.4]
  - - [1024, 4096, 1, 7552, 1024, 1024, 1024, 4096]
    - [2, 9499.78]
  - - [1024, 33712, 1, 6864, 1024, 1024, 1024, 33712]
    - [12, 10647.8]
  - - [4096, 1024, 1, 6432, 4096, 4096, 4096, 1024]
    - [2, 9579.06]
  - - [1024, 33712, 1, 4752, 1024, 1024, 1024, 33712]
    - [11, 11366.0]
  - - [1024, 1024, 1, 6160, 1024, 1024, 1024, 1024]
    - [24, 8644.55]
  - - [4096, 1024, 1, 6160, 4096, 4096, 4096, 1024]
    - [24, 9647.81]
  - - [1024, 4096, 1, 3224, 1024, 1024, 1024, 4096]
    - [1, 10421.1]
  - - [1024, 1024, 1, 6608, 1024, 1024, 1024, 1024]
    - [1, 8233.87]
  - - [4096, 1024, 1, 6608, 4096, 4096, 4096, 1024]
    - [16, 9344.78]
  - - [4096, 1024, 1, 6272, 4096, 4096, 4096, 1024]
    - [1, 9516.48]
  - - [1024, 33712, 1, 5264, 1024, 1024, 1024, 33712]
    - [12, 10702.8]
  - - [1024, 4096, 1, 7896, 1024, 1024, 1024, 4096]
    - [9, 8645.05]
  - - [1024, 33712, 1, 4864, 1024, 1024, 1024, 33712]
    - [7, 10941.2]
  - - [1024, 1024, 1, 424, 1024, 1024, 1024, 1024]
    - [21, 5956.54]
  - - [4096, 1024, 1, 3840, 4096, 4096, 4096, 1024]
    - [1, 10473.2]
  - - [4096, 1024, 1, 424, 4096, 4096, 4096, 1024]
    - [1, 9836.17]
  - - [1024, 4096, 1, 424, 1024, 1024, 1024, 4096]
    - [1, 9977.45]
  - - [1024, 33712, 1, 5600, 1024, 1024, 1024, 33712]
    - [12, 10892.6]
  - - [1024, 1024, 1, 6760, 1024, 1024, 1024, 1024]
    - [22, 8080.66]
  - - [4096, 1024, 1, 6760, 4096, 4096, 4096, 1024]
    - [8, 9240.7]
  - - [1024, 4096, 1, 6760, 1024, 1024, 1024, 4096]
    - [1, 9717.53]
  - - [1024, 1024, 1, 1144, 1024, 1024, 1024, 1024]
    - [1, 8652.42]
  - - [1024, 33712, 1, 6144, 1024, 1024, 1024, 33712]
    - [12, 11132.7]
  - - [4096, 1024, 1, 6144, 4096, 4096, 4096, 1024]
    - [20, 9602.96]
  - - [1024, 4096, 1, 6144, 1024, 1024, 1024, 4096]
    - [1, 9748.85]
  - - [1024, 1024, 1, 6344, 1024, 1024, 1024, 1024]
    - [17, 8712.47]
  - - [1024, 1024, 1, 6144, 1024, 1024, 1024, 1024]
    - [24, 8159.11]
  - - [4096, 1024, 1, 4872, 4096, 4096, 4096, 1024]
    - [1, 9680.97]
  - - [1024, 1024, 1, 3808, 1024, 1024, 1024, 1024]
    - [1, 8900.16]
  - - [1024, 33712, 1, 2560, 1024, 1024, 1024, 33712]
    - [0, 10184.5]
  - - [4096, 1024, 1, 8032, 4096, 4096, 4096, 1024]
    - [14, 9659.97]
  - - [1024, 4096, 1, 8032, 1024, 1024, 1024, 4096]
    - [1, 10350.2]
  - - [1024, 1024, 1, 8032, 1024, 1024, 1024, 1024]
    - [22, 8007.05]
  - - [1024, 4096, 1, 6576, 1024, 1024, 1024, 4096]
    - [16, 9313.35]
  - - [1024, 1024, 1, 2664, 1024, 1024, 1024, 1024]
    - [1, 8175.48]
  - - [4096, 1024, 1, 2664, 4096, 4096, 4096, 1024]
    - [1, 10230.7]
  - - [1024, 4096, 1, 2664, 1024, 1024, 1024, 4096]
    - [1, 9631.75]
  - - [1024, 1024, 1, 5040, 1024, 1024, 1024, 1024]
    - [1, 8924.63]
  - - [1024, 1024, 1, 8064, 1024, 1024, 1024, 1024]
    - [0, 8187.15]
  - - [1024, 33712, 1, 7840, 1024, 1024, 1024, 33712]
    - [7, 10466.1]
  - - [1024, 4096, 1, 4752, 1024, 1024, 1024, 4096]
    - [9, 9930.68]
  - - [1024, 33712, 1, 4968, 1024, 1024, 1024, 33712]
    - [15, 10291.3]
  - - [1024, 33712, 1, 7416, 1024, 1024, 1024, 33712]
    - [19, 10067.8]
  - - [1024, 4096, 1, 7416, 1024, 1024, 1024, 4096]
    - [10, 9232.56]
  - - [4096, 1024, 1, 6408, 4096, 4096, 4096, 1024]
    - [8, 9120.75]
  - - [1024, 1024, 1, 3888, 1024, 1024, 1024, 1024]
    - [1, 8910.77]
  - - [4096, 1024, 1, 3888, 4096, 4096, 4096, 1024]
    - [1, 10401.2]
  - - [4096, 1024, 1, 2392, 4096, 4096, 4096, 1024]
    - [1, 10416.9]
  - - [1024, 1024, 1, 8120, 1024, 1024, 1024, 1024]
    - [1, 8939.21]
  - - [1024, 1024, 1, 6888, 1024, 1024, 1024, 1024]
    - [24, 8126.94]
  - - [1024, 4096, 1, 4320, 1024, 1024, 1024, 4096]
    - [8, 9826.11]
  - - [4096, 1024, 1, 7416, 4096, 4096, 4096, 1024]
    - [1, 8951.97]
  - - [4096, 1024, 1, 6832, 4096, 4096, 4096, 1024]
    - [14, 9264.48]
  - - [1024, 1024, 1, 6264, 1024, 1024, 1024, 1024]
    - [1, 8282.39]
  - - [4096, 1024, 1, 6264, 4096, 4096, 4096, 1024]
    - [1, 9203.37]
  - - [1024, 1024, 1, 5792, 1024, 1024, 1024, 1024]
    - [17, 8726.06]
  - - [1024, 4096, 1, 6264, 1024, 1024, 1024, 4096]
    - [18, 9463.81]
  - - [1024, 4096, 1, 7952, 1024, 1024, 1024, 4096]
    - [16, 9617.36]
  - - [1024, 4096, 1, 5304, 1024, 1024, 1024, 4096]
    - [22, 9315.65]
  - - [1024, 33712, 1, 6832, 1024, 1024, 1024, 33712]
    - [12, 10759.6]
  - - [1024, 33712, 1, 6232, 1024, 1024, 1024, 33712]
    - [9, 10738.8]
  - - [1024, 4096, 1, 6832, 1024, 1024, 1024, 4096]
    - [1, 10899.6]
  - - [1024, 4096, 1, 4736, 1024, 1024, 1024, 4096]
    - [24, 9276.43]
  - - [1024, 1024, 1, 5624, 1024, 1024, 1024, 1024]
    - [1, 8270.47]
  - - [4096, 1024, 1, 5920, 4096, 4096, 4096, 1024]
    - [20, 9811.83]
  - - [4096, 1024, 1, 5624, 4096, 4096, 4096, 1024]
    - [1, 9664.33]
  - - [1024, 4096, 1, 5624, 1024, 1024, 1024, 4096]
    - [1, 10404.0]
  - - [4096, 1024, 1, 6216, 4096, 4096, 4096, 1024]
    - [20, 9813.21]
  - - [1024, 1024, 1, 4352, 1024, 1024, 1024, 1024]
    - [1, 8911.49]
  - - [1024, 33712, 1, 4480, 1024, 1024, 1024, 33712]
    - [0, 10479.9]
  - - [4096, 1024, 1, 5512, 4096, 4096, 4096, 1024]
    - [1, 10576.7]
  - - [4096, 1024, 1, 8008, 4096, 4096, 4096, 1024]
    - [11, 8886.25]
  - - [1024, 4096, 1, 5512, 1024, 1024, 1024, 4096]
    - [1, 10266.7]
  - - [1024, 1024, 1, 4928, 1024, 1024, 1024, 1024]
    - [16, 8595.09]
  - - [4096, 1024, 1, 4928, 4096, 4096, 4096, 1024]
    - [1, 9740.93]
  - - [1024, 4096, 1, 4928, 1024, 1024, 1024, 4096]
    - [1, 10510.0]
  - - [1024, 1024, 1, 6592, 1024, 1024, 1024, 1024]
    - [22, 8728.4]
  - - [1024, 4096, 1, 6592, 1024, 1024, 1024, 4096]
    - [1, 9753.07]
  - - [1024, 1024, 1, 4872, 1024, 1024, 1024, 1024]
    - [17, 8082.28]
  - - [1024, 4096, 1, 3864, 1024, 1024, 1024, 4096]
    - [8, 9741.04]
  - - [4096, 1024, 1, 3520, 4096, 4096, 4096, 1024]
    - [1, 10140.6]
  - - [1024, 1024, 1, 7000, 1024, 1024, 1024, 1024]
    - [22, 8665.49]
  - - [1024, 1024, 1, 4888, 1024, 1024, 1024, 1024]
    - [17, 8660.16]
  - - [1024, 1024, 1, 1600, 1024, 1024, 1024, 1024]
    - [1, 8182.39]
  - - [1024, 4096, 1, 3328, 1024, 1024, 1024, 4096]
    - [1, 10424.3]
  - - [1024, 4096, 1, 6032, 1024, 1024, 1024, 4096]
    - [9, 9243.28]
  - - [4096, 1024, 1, 5056, 4096, 4096, 4096, 1024]
    - [20, 10096.3]
  - - [4096, 1024, 1, 3224, 4096, 4096, 4096, 1024]
    - [1, 10365.5]
  - - [1024, 33712, 1, 2720, 1024, 1024, 1024, 33712]
    - [0, 10105.2]
  - - [4096, 1024, 1, 6536, 4096, 4096, 4096, 1024]
    - [20, 9291.59]
  - - [1024, 33712, 1, 5472, 1024, 1024, 1024, 33712]
    - [12, 10940.4]
  - - [4096, 1024, 1, 2520, 4096, 4096, 4096, 1024]
    - [1, 11062.6]
  - - [1024, 1024, 1, 7224, 1024, 1024, 1024, 1024]
    - [1, 8821.97]
  - - [1024, 1024, 1, 6696, 1024, 1024, 1024, 1024]
    - [1, 8156.66]
  - - [1024, 33712, 1, 5792, 1024, 1024, 1024, 33712]
    - [12, 11213.6]
  - - [1024, 33712, 1, 8032, 1024, 1024, 1024, 33712]
    - [7, 10423.4]
  - - [1024, 4096, 1, 6840, 1024, 1024, 1024, 4096]
    - [18, 9176.83]
  - - [1024, 1024, 1, 8024, 1024, 1024, 1024, 1024]
    - [14, 8123.89]
  - - [1024, 1024, 1, 5568, 1024, 1024, 1024, 1024]
    - [14, 8120.69]
  - - [1024, 4096, 1, 5576, 1024, 1024, 1024, 4096]
    - [22, 9829.27]
  - - [1024, 1024, 1, 7632, 1024, 1024, 1024, 1024]
    - [1, 8302.26]
  - - [4096, 1024, 1, 7224, 4096, 4096, 4096, 1024]
    - [10, 9204.9]
  - - [4096, 1024, 1, 5472, 4096, 4096, 4096, 1024]
    - [1, 9703.69]
  - - [1024, 1024, 1, 7760, 1024, 1024, 1024, 1024]
    - [20, 8543.6]
  - - [1024, 4096, 1, 6384, 1024, 1024, 1024, 4096]
    - [10, 9554.8]
  - - [1024, 4096, 1, 6808, 1024, 1024, 1024, 4096]
    - [9, 9236.95]
  - - [1024, 33712, 1, 2880, 1024, 1024, 1024, 33712]
    - [0, 10233.2]
  - - [1024, 4096, 1, 7008, 1024, 1024, 1024, 4096]
    - [9, 9232.82]
  - - [1024, 33712, 1, 7968, 1024, 1024, 1024, 33712]
    - [7, 10446.3]
  - - [1024, 1024, 1, 6272, 1024, 1024, 1024, 1024]
    - [4, 8083.4]
  - - [1024, 33712, 1, 6768, 1024, 1024, 1024, 33712]
    - [12, 10790.0]
  - - [1024, 33712, 1, 4608, 1024, 1024, 1024, 33712]
    - [11, 11208.9]
  - - [1024, 33712, 1, 6840, 1024, 1024, 1024, 33712]
    - [0, 10514.2]
  - - [1024, 1024, 1, 4440, 1024, 1024, 1024, 1024]
    - [6, 8040.32]
  - - [1024, 4096, 1, 8120, 1024, 1024, 1024, 4096]
    - [9, 9224.32]
  - - [1024, 1024, 1, 8008, 1024, 1024, 1024, 1024]
    - [22, 8044.93]
  - - [4096, 1024, 1, 7056, 4096, 4096, 4096, 1024]
    - [20, 9330.52]
  - - [1024, 1024, 1, 5936, 1024, 1024, 1024, 1024]
    - [17, 8729.29]
  - - [1024, 33712, 1, 7488, 1024, 1024, 1024, 33712]
    - [11, 10263.0]
  - - [1024, 4096, 1, 7544, 1024, 1024, 1024, 4096]
    - [9, 9248.73]
  - - [1024, 1024, 1, 3864, 1024, 1024, 1024, 1024]
    - [18, 8098.2]
- null
