Tensile/Configs/miopen/archives/transformer/2020-08-31/exact/vega20_Cijk_Ailk_Bljk_SB.yaml
- {MinimumRequiredVersion: 4.22.0}
- vega20
- gfx906
- [Device 66a0, Device 66a1, Device 66a7, Device 66af, Vega 20]
    SolutionIndex: 0
    SolutionNameMin: Cijk_Ailk_Bljk_SB_MT64x64x16_SE_GRVW4_GSU1_LRVW4_TT4_4_VW4_WG16_16_1_WGM1
    SolutionIndex: 1
    SolutionNameMin: Cijk_Ailk_Bljk_SB_MT64x64x16_SE_GRVW4_GSU1_LRVW4_TT4_4_VW4_WG16_16_1_WGM8
    SolutionIndex: 2
    SolutionNameMin: Cijk_Ailk_Bljk_SB_MT96x64x16_SE_GRVW2_GSU1_LRVW2_TT6_4_VW2_WG16_16_1_WGM1
    SolutionIndex: 3
    SolutionNameMin: Cijk_Ailk_Bljk_SB_MT96x64x16_SE_GRVW2_GSU1_LRVW2_TT6_4_VW2_WG16_16_1_WGM8
    SolutionIndex: 4
    SolutionNameMin: Cijk_Ailk_Bljk_SB_MT64x128x16_SE_GRVW4_GSU1_LRVW4_TT4_8_VW4_WG16_16_1_WGM1
    SolutionIndex: 5
    SolutionNameMin: Cijk_Ailk_Bljk_SB_MT64x128x16_SE_GRVW4_GSU1_LRVW4_TT4_8_VW4_WG16_16_1_WGM8
    SolutionIndex: 6
    SolutionNameMin: Cijk_Ailk_Bljk_SB_MT128x64x16_SE_GRVW4_GSU1_LRVW4_TT8_4_VW4_WG16_16_1_WGM1
    SolutionIndex: 7
    SolutionNameMin: Cijk_Ailk_Bljk_SB_MT128x64x16_SE_GRVW4_GSU1_LRVW4_TT8_4_VW4_WG16_16_1_WGM8
    SolutionIndex: 8
    SolutionNameMin: Cijk_Ailk_Bljk_SB_MT128x128x16_SE_GRVW4_GSU1_LRVW4_TT8_8_VW4_WG16_16_1_WGM1
    SolutionIndex: 9
    SolutionNameMin: Cijk_Ailk_Bljk_SB_MT128x128x16_SE_GRVW4_GSU1_LRVW4_TT8_8_VW4_WG16_16_1_WGM8
    SolutionIndex: 10
    SolutionNameMin: Cijk_Ailk_Bljk_SB_MT64x32x16_SE_GRVW4_GSU1_LRVW4_TT4_4_VW4_WG16_8_2_WGM1
    SolutionIndex: 11
    SolutionNameMin: Cijk_Ailk_Bljk_SB_MT64x32x16_SE_GRVW4_GSU1_LRVW4_TT4_4_VW4_WG16_8_2_WGM8
    SolutionIndex: 12
    SolutionNameMin: Cijk_Ailk_Bljk_SB_MT64x32x32_SE_GRVW4_GSU1_LRVW4_TT4_4_VW4_WG16_8_2_WGM8
    SolutionIndex: 13
    SolutionNameMin: Cijk_Ailk_Bljk_SB_MT64x64x16_SE_GRVW4_GSU1_LRVW4_TT4_8_VW4_WG16_8_2_WGM1
    SolutionIndex: 14
    SolutionNameMin: Cijk_Ailk_Bljk_SB_MT64x64x16_SE_GRVW4_GSU1_LRVW4_TT4_8_VW4_WG16_8_2_WGM8
    SolutionIndex: 15
    SolutionNameMin: Cijk_Ailk_Bljk_SB_MT64x64x32_SE_GRVW4_GSU1_LRVW4_TT4_8_VW4_WG16_8_2_WGM8
    SolutionIndex: 16
    SolutionNameMin: Cijk_Ailk_Bljk_SB_MT128x32x16_SE_GRVW4_GSU1_LRVW4_TT8_4_VW4_WG16_8_2_WGM1
    SolutionIndex: 17
    SolutionNameMin: Cijk_Ailk_Bljk_SB_MT128x32x16_SE_GRVW4_GSU1_LRVW4_TT8_4_VW4_WG16_8_2_WGM8
    SolutionIndex: 18
    SolutionNameMin: Cijk_Ailk_Bljk_SB_MT128x32x24_SE_GRVW4_GSU1_LRVW4_TT8_4_VW4_WG16_8_2_WGM1
    SolutionIndex: 19
    SolutionNameMin: Cijk_Ailk_Bljk_SB_MT128x32x24_SE_GRVW4_GSU1_LRVW4_TT8_4_VW4_WG16_8_2_WGM8
    SolutionIndex: 20
    SolutionNameMin: Cijk_Ailk_Bljk_SB_MT64x64x16_SE_GRVW4_GSU1_LRVW4_TT8_4_VW4_WG8_16_2_WGM1
    SolutionIndex: 21
    SolutionNameMin: Cijk_Ailk_Bljk_SB_MT64x64x16_SE_GRVW4_GSU1_LRVW4_TT8_4_VW4_WG8_16_2_WGM8
    SolutionIndex: 22
    SolutionNameMin: Cijk_Ailk_Bljk_SB_MT64x64x32_SE_GRVW4_GSU1_LRVW4_TT8_4_VW4_WG8_16_2_WGM1
    SolutionIndex: 23
    SolutionNameMin: Cijk_Ailk_Bljk_SB_MT64x64x32_SE_GRVW4_GSU1_LRVW4_TT8_4_VW4_WG8_16_2_WGM8
    SolutionIndex: 24
    SolutionNameMin: Cijk_Ailk_Bljk_SB_MT32x32x32_SE_GRVW4_GSU1_LRVW4_TT4_4_VW4_WG8_8_4_WGM1
    SolutionIndex: 25
    SolutionNameMin: Cijk_Ailk_Bljk_SB_MT32x32x32_SE_GRVW4_GSU1_LRVW4_TT4_4_VW4_WG8_8_4_WGM8
    SolutionIndex: 26
    SolutionNameMin: Cijk_Ailk_Bljk_SB_MT64x32x32_SE_GRVW4_GSU1_LRVW4_TT8_4_VW4_WG8_8_4_WGM1
    SolutionIndex: 27
    SolutionNameMin: Cijk_Ailk_Bljk_SB_MT64x32x32_SE_GRVW4_GSU1_LRVW4_TT8_4_VW4_WG8_8_4_WGM8
- - - [1024, 26656, 1, 1024, 1024, 1024, 1024, 1024]
    - [8, 11535.8]
  - - [1024, 33792, 1, 1024, 1024, 1024, 1024, 1024]
    - [8, 11572.0]
  - - [1024, 26624, 1, 1024, 1024, 1024, 1024, 1024]
    - [8, 11534.5]
  - - [1024, 17408, 1, 1024, 1024, 1024, 1024, 1024]
    - [8, 11322.4]
  - - [1024, 13312, 1, 1024, 1024, 1024, 1024, 1024]
    - [9, 10944.9]
  - - [1024, 312, 1, 1024, 1024, 1024, 1024, 1024]
    - [10, 7136.9]
  - - [1024, 12800, 1, 1024, 1024, 1024, 1024, 1024]
    - [8, 11814.1]
  - - [4096, 3344, 1, 1024, 4096, 4096, 4096, 1024]
    - [8, 10651.4]
  - - [1024, 3344, 1, 33712, 1024, 1024, 1024, 33712]
    - [8, 10907.9]
  - - [1024, 3344, 1, 1024, 1024, 1024, 1024, 1024]
    - [8, 10495.8]
  - - [1024, 6968, 1, 1024, 1024, 1024, 1024, 1024]
    - [6, 10493.0]
  - - [1024, 5280, 1, 33712, 1024, 1024, 1024, 33712]
    - [8, 10814.4]
  - - [1024, 5664, 1, 4096, 1024, 1024, 1024, 4096]
    - [0, 9486.21]
  - - [1024, 2160, 1, 4096, 1024, 1024, 1024, 4096]
    - [0, 9423.04]
  - - [1024, 2160, 1, 1024, 1024, 1024, 1024, 1024]
    - [16, 9558.26]
  - - [1024, 6072, 1, 4096, 1024, 1024, 1024, 4096]
    - [6, 10602.4]
  - - [1024, 2880, 1, 4096, 1024, 1024, 1024, 4096]
    - [0, 9672.33]
  - - [4096, 6560, 1, 1024, 4096, 4096, 4096, 1024]
    - [7, 10119.5]
  - - [1024, 2880, 1, 1024, 1024, 1024, 1024, 1024]
    - [16, 9357.64]
  - - [4096, 4176, 1, 1024, 4096, 4096, 4096, 1024]
    - [0, 10245.8]
  - - [1024, 4176, 1, 33712, 1024, 1024, 1024, 33712]
    - [18, 9048.49]
  - - [1024, 4176, 1, 1024, 1024, 1024, 1024, 1024]
    - [4, 9532.5]
  - - [1024, 6080, 1, 4096, 1024, 1024, 1024, 4096]
    - [7, 9930.74]
  - - [1024, 7216, 1, 33712, 1024, 1024, 1024, 33712]
    - [19, 10079.9]
  - - [1024, 7800, 1, 33712, 1024, 1024, 1024, 33712]
    - [6, 9382.86]
  - - [1024, 3528, 1, 4096, 1024, 1024, 1024, 4096]
    - [8, 9967.59]
  - - [1024, 7216, 1, 1024, 1024, 1024, 1024, 1024]
    - [8, 9346.92]
  - - [1024, 2976, 1, 4096, 1024, 1024, 1024, 4096]
    - [6, 9617.1]
  - - [1024, 7616, 1, 33712, 1024, 1024, 1024, 33712]
    - [18, 9888.44]
  - - [1024, 7848, 1, 1024, 1024, 1024, 1024, 1024]
    - [4, 9276.33]
  - - [4096, 6072, 1, 1024, 4096, 4096, 4096, 1024]
    - [7, 9959.24]
  - - [1024, 4224, 1, 1024, 1024, 1024, 1024, 1024]
    - [16, 8881.1]
  - - [1024, 8136, 1, 4096, 1024, 1024, 1024, 4096]
    - [7, 9370.42]
  - - [4096, 7232, 1, 1024, 4096, 4096, 4096, 1024]
    - [7, 9412.05]
  - - [1024, 8120, 1, 1024, 1024, 1024, 1024, 1024]
    - [0, 9664.06]
  - - [1024, 7232, 1, 33712, 1024, 1024, 1024, 33712]
    - [8, 10231.7]
  - - [1024, 3584, 1, 1024, 1024, 1024, 1024, 1024]
    - [8, 11235.6]
  - - [1024, 6496, 1, 33712, 1024, 1024, 1024, 33712]
    - [14, 9301.22]
  - - [1024, 4704, 1, 33712, 1024, 1024, 1024, 33712]
    - [9, 9206.4]
  - - [1024, 5632, 1, 1024, 1024, 1024, 1024, 1024]
    - [4, 8978.31]
  - - [4096, 3904, 1, 1024, 4096, 4096, 4096, 1024]
    - [6, 9232.79]
  - - [1024, 292, 1, 1024, 1024, 1024, 1024, 1024]
    - [21, 6094.43]
  - - [1024, 7584, 1, 4096, 1024, 1024, 1024, 4096]
    - [0, 10316.3]
  - - [1024, 5336, 1, 4096, 1024, 1024, 1024, 4096]
    - [8, 10039.1]
  - - [1024, 5336, 1, 1024, 1024, 1024, 1024, 1024]
    - [1, 9847.92]
  - - [1024, 1248, 1, 4096, 1024, 1024, 1024, 4096]
    - [16, 8924.04]
  - - [1024, 7280, 1, 33712, 1024, 1024, 1024, 33712]
    - [8, 9845.84]
  - - [1024, 4680, 1, 33712, 1024, 1024, 1024, 33712]
    - [7, 8988.49]
  - - [1024, 6200, 1, 33712, 1024, 1024, 1024, 33712]
    - [16, 9649.32]
  - - [1024, 7808, 1, 33712, 1024, 1024, 1024, 33712]
    - [19, 9530.34]
  - - [4096, 7560, 1, 1024, 4096, 4096, 4096, 1024]
    - [7, 9963.58]
  - - [1024, 7560, 1, 1024, 1024, 1024, 1024, 1024]
    - [0, 9581.34]
  - - [1024, 5184, 1, 4096, 1024, 1024, 1024, 4096]
    - [8, 10499.9]
  - - [1024, 6536, 1, 4096, 1024, 1024, 1024, 4096]
    - [0, 10141.9]
  - - [4096, 7400, 1, 1024, 4096, 4096, 4096, 1024]
    - [8, 10079.0]
  - - [1024, 7080, 1, 1024, 1024, 1024, 1024, 1024]
    - [9, 9725.3]
  - - [4096, 6192, 1, 1024, 4096, 4096, 4096, 1024]
    - [7, 10046.7]
  - - [1024, 6696, 1, 4096, 1024, 1024, 1024, 4096]
    - [0, 8977.21]
  - - [1024, 316, 1, 1024, 1024, 1024, 1024, 1024]
    - [16, 6605.86]
  - - [1024, 4176, 1, 4096, 1024, 1024, 1024, 4096]
    - [0, 9816.72]
  - - [4096, 3168, 1, 1024, 4096, 4096, 4096, 1024]
    - [8, 10751.1]
  - - [4096, 2560, 1, 1024, 4096, 4096, 4096, 1024]
    - [8, 9535.2]
  - - [1024, 7248, 1, 4096, 1024, 1024, 1024, 4096]
    - [9, 10870.6]
  - - [1024, 5712, 1, 1024, 1024, 1024, 1024, 1024]
    - [0, 8724.88]
  - - [1024, 7832, 1, 4096, 1024, 1024, 1024, 4096]
    - [7, 9282.94]
  - - [4096, 7832, 1, 1024, 4096, 4096, 4096, 1024]
    - [0, 9755.8]
  - - [4096, 5600, 1, 1024, 4096, 4096, 4096, 1024]
    - [0, 9699.08]
  - - [1024, 5760, 1, 33712, 1024, 1024, 1024, 33712]
    - [9, 9885.63]
  - - [4096, 7000, 1, 1024, 4096, 4096, 4096, 1024]
    - [0, 10407.2]
  - - [1024, 340, 1, 1024, 1024, 1024, 1024, 1024]
    - [17, 7062.52]
  - - [1024, 7000, 1, 1024, 1024, 1024, 1024, 1024]
    - [0, 10092.4]
  - - [4096, 6880, 1, 1024, 4096, 4096, 4096, 1024]
    - [7, 10005.3]
  - - [1024, 6880, 1, 1024, 1024, 1024, 1024, 1024]
    - [8, 8905.53]
  - - [1024, 6560, 1, 4096, 1024, 1024, 1024, 4096]
    - [13, 8914.55]
  - - [1024, 6720, 1, 1024, 1024, 1024, 1024, 1024]
    - [8, 9309.83]
  - - [1024, 7584, 1, 1024, 1024, 1024, 1024, 1024]
    - [0, 10291.4]
  - - [1024, 4160, 1, 4096, 1024, 1024, 1024, 4096]
    - [0, 9582.75]
  - - [1024, 512, 1, 1024, 1024, 1024, 1024, 1024]
    - [10, 6778.67]
  - - [1024, 6728, 1, 4096, 1024, 1024, 1024, 4096]
    - [0, 9906.49]
  - - [1024, 6728, 1, 1024, 1024, 1024, 1024, 1024]
    - [8, 9332.75]
  - - [1024, 7128, 1, 1024, 1024, 1024, 1024, 1024]
    - [16, 9210.17]
  - - [4096, 3952, 1, 1024, 4096, 4096, 4096, 1024]
    - [6, 9718.04]
  - - [1024, 6808, 1, 4096, 1024, 1024, 1024, 4096]
    - [7, 9736.35]
  - - [1024, 2560, 1, 1024, 1024, 1024, 1024, 1024]
    - [16, 8933.54]
  - - [4096, 8056, 1, 1024, 4096, 4096, 4096, 1024]
    - [8, 10018.2]
  - - [1024, 6200, 1, 1024, 1024, 1024, 1024, 1024]
    - [0, 9547.05]
  - - [4096, 4200, 1, 1024, 4096, 4096, 4096, 1024]
    - [7, 9865.62]
  - - [1024, 4200, 1, 1024, 1024, 1024, 1024, 1024]
    - [7, 8853.36]
  - - [4096, 6720, 1, 1024, 4096, 4096, 4096, 1024]
    - [7, 10089.1]
  - - [1024, 5520, 1, 1024, 1024, 1024, 1024, 1024]
    - [8, 9063.21]
  - - [4096, 6240, 1, 1024, 4096, 4096, 4096, 1024]
    - [7, 10011.2]
  - - [1024, 5520, 1, 4096, 1024, 1024, 1024, 4096]
    - [0, 9568.11]
  - - [1024, 6240, 1, 1024, 1024, 1024, 1024, 1024]
    - [0, 10007.2]
  - - [4096, 7208, 1, 1024, 4096, 4096, 4096, 1024]
    - [8, 9481.07]
  - - [1024, 6688, 1, 1024, 1024, 1024, 1024, 1024]
    - [0, 9582.51]
  - - [4096, 8040, 1, 1024, 4096, 4096, 4096, 1024]
    - [8, 9404.04]
  - - [1024, 8136, 1, 33712, 1024, 1024, 1024, 33712]
    - [6, 9806.54]
  - - [4096, 3600, 1, 1024, 4096, 4096, 4096, 1024]
    - [8, 10649.6]
  - - [1024, 3960, 1, 4096, 1024, 1024, 1024, 4096]
    - [16, 9108.44]
  - - [4096, 7504, 1, 1024, 4096, 4096, 4096, 1024]
    - [6, 9992.76]
  - - [1024, 3600, 1, 1024, 1024, 1024, 1024, 1024]
    - [6, 9375.3]
  - - [1024, 6832, 1, 33712, 1024, 1024, 1024, 33712]
    - [18, 9919.74]
  - - [4096, 8120, 1, 1024, 4096, 4096, 4096, 1024]
    - [8, 10131.2]
  - - [4096, 7072, 1, 1024, 4096, 4096, 4096, 1024]
    - [6, 9327.22]
  - - [1024, 8040, 1, 1024, 1024, 1024, 1024, 1024]
    - [0, 9614.24]
  - - [1024, 7440, 1, 1024, 1024, 1024, 1024, 1024]
    - [8, 9631.35]
  - - [1024, 6936, 1, 4096, 1024, 1024, 1024, 4096]
    - [6, 9254.72]
  - - [4096, 6936, 1, 1024, 4096, 4096, 4096, 1024]
    - [7, 9228.88]
  - - [1024, 5888, 1, 33712, 1024, 1024, 1024, 33712]
    - [16, 10266.8]
  - - [1024, 4864, 1, 1024, 1024, 1024, 1024, 1024]
    - [0, 10230.0]
  - - [4096, 2184, 1, 1024, 4096, 4096, 4096, 1024]
    - [8, 9097.75]
  - - [1024, 6256, 1, 1024, 1024, 1024, 1024, 1024]
    - [0, 8839.86]
  - - [1024, 5152, 1, 1024, 1024, 1024, 1024, 1024]
    - [0, 9324.52]
  - - [1024, 7688, 1, 4096, 1024, 1024, 1024, 4096]
    - [6, 9802.09]
  - - [4096, 8184, 1, 1024, 4096, 4096, 4096, 1024]
    - [8, 10182.7]
  - - [1024, 5616, 1, 4096, 1024, 1024, 1024, 4096]
    - [6, 9560.35]
  - - [4096, 5616, 1, 1024, 4096, 4096, 4096, 1024]
    - [0, 10265.3]
  - - [1024, 5512, 1, 4096, 1024, 1024, 1024, 4096]
    - [0, 9560.88]
  - - [4096, 2976, 1, 1024, 4096, 4096, 4096, 1024]
    - [6, 10260.3]
  - - [1024, 6256, 1, 33712, 1024, 1024, 1024, 33712]
    - [14, 9471.79]
  - - [4096, 8008, 1, 1024, 4096, 4096, 4096, 1024]
    - [8, 9997.84]
  - - [1024, 7488, 1, 1024, 1024, 1024, 1024, 1024]
    - [8, 9604.32]
  - - [4096, 4576, 1, 1024, 4096, 4096, 4096, 1024]
    - [0, 9642.84]
  - - [1024, 3072, 1, 4096, 1024, 1024, 1024, 4096]
    - [0, 9631.68]
  - - [1024, 8008, 1, 33712, 1024, 1024, 1024, 33712]
    - [6, 9671.73]
  - - [1024, 7688, 1, 1024, 1024, 1024, 1024, 1024]
    - [18, 9534.3]
  - - [1024, 8008, 1, 1024, 1024, 1024, 1024, 1024]
    - [0, 8886.83]
  - - [1024, 6600, 1, 4096, 1024, 1024, 1024, 4096]
    - [6, 9044.39]
  - - [4096, 6784, 1, 1024, 4096, 4096, 4096, 1024]
    - [6, 9998.77]
  - - [4096, 6600, 1, 1024, 4096, 4096, 4096, 1024]
    - [6, 9924.84]
  - - [4096, 7440, 1, 1024, 4096, 4096, 4096, 1024]
    - [8, 9232.42]
  - - [4096, 5680, 1, 1024, 4096, 4096, 4096, 1024]
    - [7, 10031.2]
  - - [1024, 7280, 1, 4096, 1024, 1024, 1024, 4096]
    - [9, 10110.0]
  - - [1024, 4432, 1, 1024, 1024, 1024, 1024, 1024]
    - [4, 9413.56]
  - - [1024, 428, 1, 1024, 1024, 1024, 1024, 1024]
    - [16, 8213.59]
  - - [1024, 7560, 1, 33712, 1024, 1024, 1024, 33712]
    - [18, 9625.33]
  - - [4096, 7744, 1, 1024, 4096, 4096, 4096, 1024]
    - [6, 10036.0]
  - - [1024, 2600, 1, 1024, 1024, 1024, 1024, 1024]
    - [1, 8819.53]
  - - [1024, 6944, 1, 4096, 1024, 1024, 1024, 4096]
    - [8, 9240.7]
  - - [1024, 3400, 1, 4096, 1024, 1024, 1024, 4096]
    - [5, 9052.74]
  - - [1024, 7744, 1, 1024, 1024, 1024, 1024, 1024]
    - [7, 8904.46]
  - - [4096, 4992, 1, 1024, 4096, 4096, 4096, 1024]
    - [8, 9535.27]
  - - [1024, 5808, 1, 4096, 1024, 1024, 1024, 4096]
    - [0, 10160.0]
  - - [1024, 7808, 1, 4096, 1024, 1024, 1024, 4096]
    - [0, 9636.84]
  - - [1024, 4680, 1, 4096, 1024, 1024, 1024, 4096]
    - [0, 9319.6]
  - - [1024, 6336, 1, 1024, 1024, 1024, 1024, 1024]
    - [16, 9203.94]
  - - [4096, 7488, 1, 1024, 4096, 4096, 4096, 1024]
    - [7, 9423.58]
  - - [1024, 3400, 1, 1024, 1024, 1024, 1024, 1024]
    - [0, 9299.75]
  - - [1024, 7040, 1, 33712, 1024, 1024, 1024, 33712]
    - [18, 9786.86]
  - - [4096, 7952, 1, 1024, 4096, 4096, 4096, 1024]
    - [9, 9745.51]
  - - [1024, 5712, 1, 33712, 1024, 1024, 1024, 33712]
    - [13, 9174.66]
  - - [1024, 4200, 1, 4096, 1024, 1024, 1024, 4096]
    - [7, 9774.09]
  - - [1024, 6768, 1, 33712, 1024, 1024, 1024, 33712]
    - [16, 9833.16]
  - - [1024, 4144, 1, 1024, 1024, 1024, 1024, 1024]
    - [4, 9415.18]
  - - [1024, 2560, 1, 4096, 1024, 1024, 1024, 4096]
    - [4, 9301.93]
  - - [1024, 7952, 1, 33712, 1024, 1024, 1024, 33712]
    - [18, 9400.45]
  - - [1024, 6336, 1, 4096, 1024, 1024, 1024, 4096]
    - [7, 9003.61]
  - - [1024, 7552, 1, 4096, 1024, 1024, 1024, 4096]
    - [0, 8929.07]
  - - [4096, 5888, 1, 1024, 4096, 4096, 4096, 1024]
    - [7, 10046.2]
  - - [4096, 2880, 1, 1024, 4096, 4096, 4096, 1024]
    - [6, 9816.32]
  - - [4096, 7936, 1, 1024, 4096, 4096, 4096, 1024]
    - [9, 9759.67]
  - - [1024, 5888, 1, 1024, 1024, 1024, 1024, 1024]
    - [0, 9398.99]
  - - [1024, 6768, 1, 4096, 1024, 1024, 1024, 4096]
    - [7, 9706.42]
  - - [4096, 6768, 1, 1024, 4096, 4096, 4096, 1024]
    - [6, 9548.4]
  - - [1024, 2976, 1, 1024, 1024, 1024, 1024, 1024]
    - [16, 8924.04]
  - - [4096, 5808, 1, 1024, 4096, 4096, 4096, 1024]
    - [7, 9506.6]
  - - [4096, 7296, 1, 1024, 4096, 4096, 4096, 1024]
    - [9, 9996.34]
  - - [1024, 6552, 1, 4096, 1024, 1024, 1024, 4096]
    - [7, 9790.04]
  - - [1024, 4488, 1, 1024, 1024, 1024, 1024, 1024]
    - [16, 9838.61]
  - - [1024, 7296, 1, 1024, 1024, 1024, 1024, 1024]
    - [8, 10879.4]
  - - [4096, 4624, 1, 1024, 4096, 4096, 4096, 1024]
    - [0, 9615.29]
  - - [1024, 4624, 1, 33712, 1024, 1024, 1024, 33712]
    - [18, 9442.91]
  - - [1024, 4624, 1, 1024, 1024, 1024, 1024, 1024]
    - [7, 9862.91]
  - - [1024, 5632, 1, 4096, 1024, 1024, 1024, 4096]
    - [8, 8839.35]
  - - [1024, 4784, 1, 4096, 1024, 1024, 1024, 4096]
    - [8, 9728.83]
  - - [4096, 4784, 1, 1024, 4096, 4096, 4096, 1024]
    - [6, 9248.83]
  - - [1024, 7232, 1, 4096, 1024, 1024, 1024, 4096]
    - [7, 9560.85]
  - - [1024, 7952, 1, 1024, 1024, 1024, 1024, 1024]
    - [0, 8762.36]
  - - [1024, 432, 1, 1024, 1024, 1024, 1024, 1024]
    - [16, 8959.35]
  - - [4096, 7808, 1, 1024, 4096, 4096, 4096, 1024]
    - [9, 10769.9]
  - - [4096, 6392, 1, 1024, 4096, 4096, 4096, 1024]
    - [6, 10019.6]
  - - [1024, 2600, 1, 4096, 1024, 1024, 1024, 4096]
    - [6, 9184.39]
  - - [1024, 7056, 1, 33712, 1024, 1024, 1024, 33712]
    - [18, 9803.32]
  - - [1024, 7128, 1, 33712, 1024, 1024, 1024, 33712]
    - [19, 9888.26]
  - - [1024, 3328, 1, 4096, 1024, 1024, 1024, 4096]
    - [8, 10154.4]
  - - [4096, 6200, 1, 1024, 4096, 4096, 4096, 1024]
    - [7, 9999.32]
  - - [1024, 3952, 1, 33712, 1024, 1024, 1024, 33712]
    - [15, 8316.94]
  - - [1024, 4992, 1, 4096, 1024, 1024, 1024, 4096]
    - [1, 9570.14]
  - - [1024, 2736, 1, 1024, 1024, 1024, 1024, 1024]
    - [7, 10541.2]
  - - [1024, 4992, 1, 1024, 1024, 1024, 1024, 1024]
    - [1, 9356.65]
  - - [4096, 6688, 1, 1024, 4096, 4096, 4096, 1024]
    - [7, 10008.1]
  - - [4096, 6160, 1, 1024, 4096, 4096, 4096, 1024]
    - [7, 9918.64]
  - - [4096, 6496, 1, 1024, 4096, 4096, 4096, 1024]
    - [6, 9929.93]
  - - [4096, 8000, 1, 1024, 4096, 4096, 4096, 1024]
    - [6, 9363.52]
  - - [1024, 6840, 1, 33712, 1024, 1024, 1024, 33712]
    - [18, 9578.75]
  - - [4096, 3960, 1, 1024, 4096, 4096, 4096, 1024]
    - [7, 9873.86]
  - - [4096, 4432, 1, 1024, 4096, 4096, 4096, 1024]
    - [0, 9631.27]
  - - [4096, 4816, 1, 1024, 4096, 4096, 4096, 1024]
    - [8, 9177.02]
  - - [1024, 6864, 1, 33712, 1024, 1024, 1024, 33712]
    - [17, 9731.26]
  - - [1024, 5792, 1, 4096, 1024, 1024, 1024, 4096]
    - [4, 9061.44]
  - - [4096, 8064, 1, 1024, 4096, 4096, 4096, 1024]
    - [8, 9889.01]
  - - [1024, 5576, 1, 1024, 1024, 1024, 1024, 1024]
    - [0, 9278.36]
  - - [1024, 3400, 1, 33712, 1024, 1024, 1024, 33712]
    - [8, 9759.74]
  - - [1024, 6200, 1, 4096, 1024, 1024, 1024, 4096]
    - [4, 9877.78]
  - - [1024, 4680, 1, 1024, 1024, 1024, 1024, 1024]
    - [16, 9667.7]
  - - [1024, 5280, 1, 1024, 1024, 1024, 1024, 1024]
    - [16, 9188.25]
  - - [4096, 6408, 1, 1024, 4096, 4096, 4096, 1024]
    - [7, 9265.9]
  - - [1024, 5568, 1, 1024, 1024, 1024, 1024, 1024]
    - [16, 9018.88]
  - - [4096, 7784, 1, 1024, 4096, 4096, 4096, 1024]
    - [8, 9625.34]
  - - [1024, 7544, 1, 4096, 1024, 1024, 1024, 4096]
    - [9, 9260.64]
  - - [1024, 7000, 1, 33712, 1024, 1024, 1024, 33712]
    - [18, 9797.18]
  - - [1024, 4320, 1, 4096, 1024, 1024, 1024, 4096]
    - [6, 9838.49]
  - - [4096, 7280, 1, 1024, 4096, 4096, 4096, 1024]
    - [6, 10570.5]
  - - [4096, 5336, 1, 1024, 4096, 4096, 4096, 1024]
    - [0, 9664.54]
  - - [1024, 468, 1, 1024, 1024, 1024, 1024, 1024]
    - [11, 6970.65]
  - - [4096, 5376, 1, 1024, 4096, 4096, 4096, 1024]
    - [0, 10269.9]
  - - [1024, 7320, 1, 33712, 1024, 1024, 1024, 33712]
    - [18, 9520.79]
  - - [4096, 6912, 1, 1024, 4096, 4096, 4096, 1024]
    - [7, 10016.8]
  - - [1024, 3456, 1, 33712, 1024, 1024, 1024, 33712]
    - [8, 9899.35]
  - - [1024, 5600, 1, 4096, 1024, 1024, 1024, 4096]
    - [8, 8797.29]
  - - [4096, 6272, 1, 1024, 4096, 4096, 4096, 1024]
    - [6, 10277.6]
  - - [1024, 4864, 1, 4096, 1024, 1024, 1024, 4096]
    - [8, 9925.01]
  - - [1024, 3600, 1, 33712, 1024, 1024, 1024, 33712]
    - [8, 9902.7]
  - - [1024, 6624, 1, 4096, 1024, 1024, 1024, 4096]
    - [7, 9847.94]
  - - [1024, 2976, 1, 33712, 1024, 1024, 1024, 33712]
    - [8, 9301.02]
  - - [1024, 2584, 1, 33712, 1024, 1024, 1024, 33712]
    - [6, 9148.05]
  - - [4096, 7176, 1, 1024, 4096, 4096, 4096, 1024]
    - [6, 9242.58]
  - - [1024, 6944, 1, 33712, 1024, 1024, 1024, 33712]
    - [18, 9563.28]
  - - [1024, 2112, 1, 4096, 1024, 1024, 1024, 4096]
    - [16, 9072.46]
  - - [4096, 5936, 1, 1024, 4096, 4096, 4096, 1024]
    - [8, 10244.1]
  - - [4096, 7872, 1, 1024, 4096, 4096, 4096, 1024]
    - [0, 9789.81]
  - - [1024, 3960, 1, 33712, 1024, 1024, 1024, 33712]
    - [20, 9163.79]
  - - [1024, 6528, 1, 4096, 1024, 1024, 1024, 4096]
    - [7, 9725.9]
  - - [1024, 6528, 1, 1024, 1024, 1024, 1024, 1024]
    - [16, 9260.13]
  - - [1024, 7656, 1, 33712, 1024, 1024, 1024, 33712]
    - [18, 9804.31]
  - - [1024, 4800, 1, 4096, 1024, 1024, 1024, 4096]
    - [6, 9629.52]
  - - [1024, 8128, 1, 1024, 1024, 1024, 1024, 1024]
    - [1, 8647.33]
  - - [1024, 7872, 1, 1024, 1024, 1024, 1024, 1024]
    - [0, 8970.58]
  - - [1024, 8184, 1, 1024, 1024, 1024, 1024, 1024]
    - [6, 9513.89]
  - - [4096, 7536, 1, 1024, 4096, 4096, 4096, 1024]
    - [7, 9401.83]
  - - [1024, 7992, 1, 4096, 1024, 1024, 1024, 4096]
    - [0, 9607.02]
  - - [1024, 7560, 1, 4096, 1024, 1024, 1024, 4096]
    - [0, 9628.12]
  - - [1024, 7536, 1, 33712, 1024, 1024, 1024, 33712]
    - [16, 9592.65]
  - - [1024, 6960, 1, 1024, 1024, 1024, 1024, 1024]
    - [4, 9345.96]
  - - [1024, 6888, 1, 33712, 1024, 1024, 1024, 33712]
    - [22, 9324.68]
  - - [1024, 1824, 1, 33712, 1024, 1024, 1024, 33712]
    - [20, 8684.25]
  - - [4096, 8128, 1, 1024, 4096, 4096, 4096, 1024]
    - [7, 9421.01]
  - - [4096, 5832, 1, 1024, 4096, 4096, 4096, 1024]
    - [7, 10015.5]
  - - [4096, 7920, 1, 1024, 4096, 4096, 4096, 1024]
    - [0, 9752.11]
  - - [1024, 7568, 1, 4096, 1024, 1024, 1024, 4096]
    - [0, 9636.91]
  - - [1024, 7400, 1, 1024, 1024, 1024, 1024, 1024]
    - [8, 10022.0]
  - - [1024, 3328, 1, 33712, 1024, 1024, 1024, 33712]
    - [8, 10374.6]
  - - [4096, 7904, 1, 1024, 4096, 4096, 4096, 1024]
    - [7, 9394.19]
  - - [1024, 7760, 1, 33712, 1024, 1024, 1024, 33712]
    - [19, 9451.83]
  - - [4096, 5632, 1, 1024, 4096, 4096, 4096, 1024]
    - [4, 9662.57]
  - - [1024, 6240, 1, 33712, 1024, 1024, 1024, 33712]
    - [9, 9336.09]
  - - [1024, 6912, 1, 1024, 1024, 1024, 1024, 1024]
    - [4, 9310.12]
  - - [1024, 3864, 1, 33712, 1024, 1024, 1024, 33712]
    - [18, 8312.3]
  - - [1024, 7632, 1, 33712, 1024, 1024, 1024, 33712]
    - [18, 9601.58]
  - - [1024, 504, 1, 1024, 1024, 1024, 1024, 1024]
    - [24, 6659.3]
  - - [4096, 4680, 1, 1024, 4096, 4096, 4096, 1024]
    - [0, 10253.5]
  - - [1024, 7080, 1, 4096, 1024, 1024, 1024, 4096]
    - [7, 10132.0]
  - - [1024, 6320, 1, 33712, 1024, 1024, 1024, 33712]
    - [17, 9701.92]
  - - [1024, 8024, 1, 1024, 1024, 1024, 1024, 1024]
    - [4, 8893.28]
  - - [4096, 5400, 1, 1024, 4096, 4096, 4096, 1024]
    - [8, 10086.0]
  - - [4096, 7192, 1, 1024, 4096, 4096, 4096, 1024]
    - [0, 9732.52]
  - - [1024, 260, 1, 1024, 1024, 1024, 1024, 1024]
    - [16, 5845.41]
  - - [1024, 4624, 1, 4096, 1024, 1024, 1024, 4096]
    - [0, 10256.0]
  - - [1024, 372, 1, 1024, 1024, 1024, 1024, 1024]
    - [16, 7666.48]
  - - [4096, 6552, 1, 1024, 4096, 4096, 4096, 1024]
    - [0, 10136.7]
  - - [1024, 2184, 1, 1024, 1024, 1024, 1024, 1024]
    - [16, 9053.15]
  - - [1024, 4864, 1, 33712, 1024, 1024, 1024, 33712]
    - [9, 9876.23]
  - - [4096, 5664, 1, 1024, 4096, 4096, 4096, 1024]
    - [9, 9602.77]
  - - [4096, 2160, 1, 1024, 4096, 4096, 4096, 1024]
    - [8, 10113.1]
  - - [1024, 5376, 1, 4096, 1024, 1024, 1024, 4096]
    - [8, 9501.0]
  - - [1024, 6688, 1, 4096, 1024, 1024, 1024, 4096]
    - [7, 9870.32]
  - - [1024, 6440, 1, 1024, 1024, 1024, 1024, 1024]
    - [8, 9609.54]
  - - [1024, 7208, 1, 1024, 1024, 1024, 1024, 1024]
    - [0, 9442.93]
  - - [1024, 356, 1, 1024, 1024, 1024, 1024, 1024]
    - [16, 8031.26]
  - - [1024, 4608, 1, 33712, 1024, 1024, 1024, 33712]
    - [7, 8872.16]
  - - [1024, 7896, 1, 33712, 1024, 1024, 1024, 33712]
    - [6, 9423.44]
  - - [1024, 7616, 1, 4096, 1024, 1024, 1024, 4096]
    - [6, 9768.97]
  - - [1024, 8136, 1, 1024, 1024, 1024, 1024, 1024]
    - [9, 9547.85]
  - - [1024, 6384, 1, 4096, 1024, 1024, 1024, 4096]
    - [7, 9559.17]
  - - [4096, 7080, 1, 1024, 4096, 4096, 4096, 1024]
    - [0, 9609.73]
  - - [1024, 6944, 1, 1024, 1024, 1024, 1024, 1024]
    - [8, 9023.12]
  - - [1024, 5440, 1, 33712, 1024, 1024, 1024, 33712]
    - [9, 10984.5]
  - - [1024, 6272, 1, 33712, 1024, 1024, 1024, 33712]
    - [9, 9244.82]
  - - [1024, 3264, 1, 4096, 1024, 1024, 1024, 4096]
    - [8, 9938.86]
  - - [1024, 6888, 1, 1024, 1024, 1024, 1024, 1024]
    - [8, 10230.3]
  - - [1024, 7936, 1, 4096, 1024, 1024, 1024, 4096]
    - [9, 9019.4]
  - - [4096, 5152, 1, 1024, 4096, 4096, 4096, 1024]
    - [0, 9685.97]
  - - [1024, 324, 1, 1024, 1024, 1024, 1024, 1024]
    - [16, 7296.79]
  - - [1024, 2304, 1, 1024, 1024, 1024, 1024, 1024]
    - [0, 9904.53]
  - - [4096, 7656, 1, 1024, 4096, 4096, 4096, 1024]
    - [9, 9895.33]
  - - [1024, 7040, 1, 1024, 1024, 1024, 1024, 1024]
    - [8, 9770.7]
  - - [4096, 5032, 1, 1024, 4096, 4096, 4096, 1024]
    - [8, 9769.35]
  - - [1024, 6936, 1, 1024, 1024, 1024, 1024, 1024]
    - [1, 9721.06]
  - - [4096, 7680, 1, 1024, 4096, 4096, 4096, 1024]
    - [8, 10162.1]
  - - [4096, 1600, 1, 1024, 4096, 4096, 4096, 1024]
    - [0, 9464.73]
  - - [1024, 7680, 1, 33712, 1024, 1024, 1024, 33712]
    - [18, 9809.11]
  - - [4096, 1760, 1, 1024, 4096, 4096, 4096, 1024]
    - [4, 9332.91]
  - - [1024, 8192, 1, 4096, 1024, 1024, 1024, 4096]
    - [9, 9250.2]
  - - [1024, 7680, 1, 1024, 1024, 1024, 1024, 1024]
    - [0, 9627.31]
  - - [1024, 3456, 1, 4096, 1024, 1024, 1024, 4096]
    - [8, 9186.92]
  - - [1024, 8112, 1, 4096, 1024, 1024, 1024, 4096]
    - [6, 8845.71]
  - - [1024, 268, 1, 1024, 1024, 1024, 1024, 1024]
    - [16, 6014.95]
  - - [4096, 2992, 1, 1024, 4096, 4096, 4096, 1024]
    - [6, 10353.6]
  - - [1024, 6192, 1, 4096, 1024, 1024, 1024, 4096]
    - [6, 9353.42]
  - - [1024, 2520, 1, 1024, 1024, 1024, 1024, 1024]
    - [0, 8626.3]
  - - [4096, 5440, 1, 1024, 4096, 4096, 4096, 1024]
    - [8, 10153.9]
  - - [1024, 8112, 1, 1024, 1024, 1024, 1024, 1024]
    - [0, 10315.8]
  - - [1024, 4608, 1, 4096, 1024, 1024, 1024, 4096]
    - [18, 9747.88]
  - - [1024, 7744, 1, 33712, 1024, 1024, 1024, 33712]
    - [16, 9443.11]
  - - [4096, 5760, 1, 1024, 4096, 4096, 4096, 1024]
    - [8, 9957.11]
  - - [1024, 7912, 1, 4096, 1024, 1024, 1024, 4096]
    - [0, 9537.53]
  - - [1024, 288, 1, 1024, 1024, 1024, 1024, 1024]
    - [16, 6610.99]
  - - [4096, 7776, 1, 1024, 4096, 4096, 4096, 1024]
    - [8, 10249.3]
  - - [1024, 5760, 1, 4096, 1024, 1024, 1024, 4096]
    - [16, 9819.83]
  - - [1024, 8096, 1, 33712, 1024, 1024, 1024, 33712]
    - [6, 9746.29]
  - - [1024, 6032, 1, 33712, 1024, 1024, 1024, 33712]
    - [9, 9197.34]
  - - [4096, 6032, 1, 1024, 4096, 4096, 4096, 1024]
    - [1, 10275.9]
  - - [1024, 308, 1, 1024, 1024, 1024, 1024, 1024]
    - [10, 6107.44]
  - - [1024, 6192, 1, 1024, 1024, 1024, 1024, 1024]
    - [16, 9780.63]
  - - [1024, 7168, 1, 4096, 1024, 1024, 1024, 4096]
    - [6, 10159.5]
  - - [1024, 7536, 1, 1024, 1024, 1024, 1024, 1024]
    - [8, 9631.01]
  - - [1024, 7536, 1, 4096, 1024, 1024, 1024, 4096]
    - [0, 9315.6]
  - - [4096, 6960, 1, 1024, 4096, 4096, 4096, 1024]
    - [7, 10092.2]
  - - [4096, 6800, 1, 1024, 4096, 4096, 4096, 1024]
    - [6, 9954.63]
  - - [1024, 3840, 1, 4096, 1024, 1024, 1024, 4096]
    - [6, 9146.2]
  - - [1024, 4480, 1, 4096, 1024, 1024, 1024, 4096]
    - [4, 9722.68]
  - - [1024, 6784, 1, 33712, 1024, 1024, 1024, 33712]
    - [18, 9810.76]
  - - [1024, 8176, 1, 4096, 1024, 1024, 1024, 4096]
    - [6, 9408.01]
  - - [1024, 5984, 1, 1024, 1024, 1024, 1024, 1024]
    - [0, 9477.2]
  - - [1024, 7920, 1, 33712, 1024, 1024, 1024, 33712]
    - [6, 9521.58]
  - - [1024, 15360, 1, 1024, 1024, 1024, 1024, 1024]
    - [6, 10771.9]
  - - [1024, 5184, 1, 1024, 1024, 1024, 1024, 1024]
    - [9, 10055.9]
  - - [1024, 8192, 1, 1024, 1024, 1024, 1024, 1024]
    - [4, 9005.62]
  - - [1024, 5888, 1, 4096, 1024, 1024, 1024, 4096]
    - [18, 9364.77]
  - - [1024, 7200, 1, 1024, 1024, 1024, 1024, 1024]
    - [9, 10145.3]
  - - [1024, 5616, 1, 1024, 1024, 1024, 1024, 1024]
    - [16, 9791.16]
  - - [1024, 3904, 1, 4096, 1024, 1024, 1024, 4096]
    - [6, 8669.64]
  - - [4096, 5704, 1, 1024, 4096, 4096, 4096, 1024]
    - [7, 9255.18]
  - - [1024, 6480, 1, 33712, 1024, 1024, 1024, 33712]
    - [17, 10049.5]
  - - [1024, 7176, 1, 1024, 1024, 1024, 1024, 1024]
    - [4, 9504.56]
  - - [1024, 272, 1, 1024, 1024, 1024, 1024, 1024]
    - [25, 5704.25]
  - - [1024, 2992, 1, 4096, 1024, 1024, 1024, 4096]
    - [0, 10146.0]
  - - [4096, 4896, 1, 1024, 4096, 4096, 4096, 1024]
    - [8, 9971.29]
  - - [1024, 20480, 1, 1024, 1024, 1024, 1024, 1024]
    - [8, 9928.06]
  - - [1024, 6624, 1, 33712, 1024, 1024, 1024, 33712]
    - [19, 10172.5]
  - - [4096, 2576, 1, 1024, 4096, 4096, 4096, 1024]
    - [9, 8811.66]
  - - [1024, 7400, 1, 33712, 1024, 1024, 1024, 33712]
    - [19, 9485.99]
  - - [4096, 8192, 1, 1024, 4096, 4096, 4096, 1024]
    - [9, 10001.5]
  - - [1024, 7488, 1, 4096, 1024, 1024, 1024, 4096]
    - [6, 9156.95]
  - - [1024, 6656, 1, 4096, 1024, 1024, 1024, 4096]
    - [6, 9831.39]
  - - [1024, 2664, 1, 1024, 1024, 1024, 1024, 1024]
    - [16, 9131.15]
  - - [1024, 7616, 1, 1024, 1024, 1024, 1024, 1024]
    - [8, 9763.71]
  - - [1024, 6480, 1, 1024, 1024, 1024, 1024, 1024]
    - [8, 8974.48]
  - - [1024, 2392, 1, 1024, 1024, 1024, 1024, 1024]
    - [4, 9043.08]
  - - [4096, 4888, 1, 1024, 4096, 4096, 4096, 1024]
    - [9, 9699.17]
  - - [4096, 4608, 1, 1024, 4096, 4096, 4096, 1024]
    - [1, 9635.9]
  - - [4096, 5624, 1, 1024, 4096, 4096, 4096, 1024]
    - [0, 10390.4]
  - - [1024, 7840, 1, 4096, 1024, 1024, 1024, 4096]
    - [0, 9681.12]
  - - [1024, 7728, 1, 1024, 1024, 1024, 1024, 1024]
    - [1, 9449.78]
  - - [1024, 5936, 1, 1024, 1024, 1024, 1024, 1024]
    - [0, 9480.22]
  - - [4096, 7688, 1, 1024, 4096, 4096, 4096, 1024]
    - [9, 9900.32]
  - - [1024, 6448, 1, 4096, 1024, 1024, 1024, 4096]
    - [6, 9605.62]
  - - [4096, 424, 1, 1024, 4096, 4096, 4096, 1024]
    - [1, 8375.95]
  - - [4096, 3120, 1, 1024, 4096, 4096, 4096, 1024]
    - [6, 10422.3]
  - - [1024, 7904, 1, 4096, 1024, 1024, 1024, 4096]
    - [0, 9524.38]
  - - [1024, 8064, 1, 4096, 1024, 1024, 1024, 4096]
    - [7, 9542.38]
  - - [1024, 4960, 1, 1024, 1024, 1024, 1024, 1024]
    - [16, 9961.93]
  - - [1024, 6240, 1, 4096, 1024, 1024, 1024, 4096]
    - [7, 10073.1]
  - - [1024, 7104, 1, 33712, 1024, 1024, 1024, 33712]
    - [18, 9748.91]
  - - [1024, 2184, 1, 4096, 1024, 1024, 1024, 4096]
    - [26, 8186.48]
  - - [1024, 5376, 1, 1024, 1024, 1024, 1024, 1024]
    - [8, 9866.16]
  - - [1024, 6448, 1, 1024, 1024, 1024, 1024, 1024]
    - [16, 9080.8]
  - - [1024, 3520, 1, 4096, 1024, 1024, 1024, 4096]
    - [6, 9405.21]
  - - [1024, 8128, 1, 4096, 1024, 1024, 1024, 4096]
    - [8, 9250.85]
  - - [1024, 6440, 1, 4096, 1024, 1024, 1024, 4096]
    - [7, 9647.15]
  - - [4096, 6144, 1, 1024, 4096, 4096, 4096, 1024]
    - [7, 10146.5]
  - - [4096, 7600, 1, 1024, 4096, 4096, 4096, 1024]
    - [8, 9410.69]
  - - [1024, 7416, 1, 33712, 1024, 1024, 1024, 33712]
    - [8, 10028.4]
  - - [1024, 328, 1, 1024, 1024, 1024, 1024, 1024]
    - [20, 6813.25]
  - - [4096, 7728, 1, 1024, 4096, 4096, 4096, 1024]
    - [0, 10451.4]
  - - [4096, 7568, 1, 1024, 4096, 4096, 4096, 1024]
    - [9, 9765.21]
  - - [1024, 8120, 1, 4096, 1024, 1024, 1024, 4096]
    - [0, 9714.33]
  - - [1024, 11264, 1, 1024, 1024, 1024, 1024, 1024]
    - [8, 10178.5]
  - - [1024, 8112, 1, 33712, 1024, 1024, 1024, 33712]
    - [6, 9775.99]
  - - [1024, 7848, 1, 4096, 1024, 1024, 1024, 4096]
    - [6, 9690.08]
  - - [1024, 6888, 1, 4096, 1024, 1024, 1024, 4096]
    - [7, 9193.7]
  - - [4096, 7216, 1, 1024, 4096, 4096, 4096, 1024]
    - [9, 9882.33]
  - - [1024, 6912, 1, 4096, 1024, 1024, 1024, 4096]
    - [0, 9619.27]
  - - [1024, 5984, 1, 33712, 1024, 1024, 1024, 33712]
    - [22, 9037.64]
  - - [4096, 7696, 1, 1024, 4096, 4096, 4096, 1024]
    - [1, 10195.1]
  - - [1024, 6144, 1, 33712, 1024, 1024, 1024, 33712]
    - [16, 9333.74]
  - - [1024, 8160, 1, 4096, 1024, 1024, 1024, 4096]
    - [9, 9888.08]
  - - [1024, 5120, 1, 1024, 1024, 1024, 1024, 1024]
    - [16, 9682.4]
  - - [1024, 6880, 1, 4096, 1024, 1024, 1024, 4096]
    - [7, 9186.76]
  - - [1024, 7424, 1, 33712, 1024, 1024, 1024, 33712]
    - [18, 9822.68]
  - - [1024, 7200, 1, 4096, 1024, 1024, 1024, 4096]
    - [6, 10137.9]
  - - [4096, 6120, 1, 1024, 4096, 4096, 4096, 1024]
    - [7, 9439.1]
  - - [1024, 8160, 1, 33712, 1024, 1024, 1024, 33712]
    - [6, 9638.67]
  - - [1024, 7040, 1, 4096, 1024, 1024, 1024, 4096]
    - [7, 10049.8]
  - - [4096, 7040, 1, 1024, 4096, 4096, 4096, 1024]
    - [7, 9447.81]
  - - [1024, 7744, 1, 4096, 1024, 1024, 1024, 4096]
    - [6, 9155.86]
  - - [1024, 5952, 1, 1024, 1024, 1024, 1024, 1024]
    - [6, 8952.7]
  - - [1024, 7936, 1, 33712, 1024, 1024, 1024, 33712]
    - [18, 9607.24]
  - - [1024, 2240, 1, 4096, 1024, 1024, 1024, 4096]
    - [18, 8594.86]
  - - [1024, 3600, 1, 4096, 1024, 1024, 1024, 4096]
    - [6, 9678.14]
  - - [1024, 4160, 1, 1024, 1024, 1024, 1024, 1024]
    - [4, 9522.49]
  - - [1024, 6992, 1, 1024, 1024, 1024, 1024, 1024]
    - [8, 10389.4]
  - - [1024, 7392, 1, 4096, 1024, 1024, 1024, 4096]
    - [7, 9117.38]
  - - [1024, 2576, 1, 33712, 1024, 1024, 1024, 33712]
    - [7, 8901.22]
  - - [1024, 6800, 1, 4096, 1024, 1024, 1024, 4096]
    - [8, 9060.55]
  - - [4096, 8160, 1, 1024, 4096, 4096, 4096, 1024]
    - [8, 9546.09]
  - - [4096, 4160, 1, 1024, 4096, 4096, 4096, 1024]
    - [7, 9220.56]
  - - [1024, 6232, 1, 1024, 1024, 1024, 1024, 1024]
    - [4, 8828.77]
  - - [1024, 7904, 1, 1024, 1024, 1024, 1024, 1024]
    - [22, 8912.51]
  - - [4096, 7912, 1, 1024, 4096, 4096, 4096, 1024]
    - [0, 9744.54]
  - - [1024, 7248, 1, 1024, 1024, 1024, 1024, 1024]
    - [8, 10777.2]
  - - [1024, 7280, 1, 1024, 1024, 1024, 1024, 1024]
    - [9, 10599.9]
  - - [4096, 3456, 1, 1024, 4096, 4096, 4096, 1024]
    - [6, 9687.41]
  - - [4096, 6512, 1, 1024, 4096, 4096, 4096, 1024]
    - [7, 9305.15]
  - - [4096, 6480, 1, 1024, 4096, 4096, 4096, 1024]
    - [7, 10046.1]
  - - [4096, 5184, 1, 1024, 4096, 4096, 4096, 1024]
    - [8, 9689.83]
  - - [1024, 7920, 1, 4096, 1024, 1024, 1024, 4096]
    - [0, 10198.8]
  - - [1024, 6960, 1, 4096, 1024, 1024, 1024, 4096]
    - [6, 9997.62]
  - - [1024, 6840, 1, 4096, 1024, 1024, 1024, 4096]
    - [6, 9156.2]
  - - [1024, 6800, 1, 33712, 1024, 1024, 1024, 33712]
    - [19, 10017.7]
  - - [1024, 6976, 1, 1024, 1024, 1024, 1024, 1024]
    - [4, 9391.49]
  - - [4096, 6384, 1, 1024, 4096, 4096, 4096, 1024]
    - [7, 9384.94]
  - - [1024, 6592, 1, 4096, 1024, 1024, 1024, 4096]
    - [7, 9130.55]
  - - [4096, 1824, 1, 1024, 4096, 4096, 4096, 1024]
    - [7, 8805.69]
  - - [1024, 3528, 1, 1024, 1024, 1024, 1024, 1024]
    - [16, 9235.49]
  - - [1024, 7760, 1, 1024, 1024, 1024, 1024, 1024]
    - [22, 8728.36]
  - - [1024, 5472, 1, 4096, 1024, 1024, 1024, 4096]
    - [8, 10304.6]
  - - [4096, 6728, 1, 1024, 4096, 4096, 4096, 1024]
    - [0, 10365.2]
  - - [1024, 7832, 1, 1024, 1024, 1024, 1024, 1024]
    - [8, 9430.02]
  - - [1024, 1824, 1, 1024, 1024, 1024, 1024, 1024]
    - [18, 8760.53]
  - - [1024, 8064, 1, 1024, 1024, 1024, 1024, 1024]
    - [8, 10362.4]
  - - [1024, 8128, 1, 33712, 1024, 1024, 1024, 33712]
    - [6, 9760.15]
  - - [4096, 6656, 1, 1024, 4096, 4096, 4096, 1024]
    - [7, 10001.0]
  - - [1024, 8056, 1, 4096, 1024, 1024, 1024, 4096]
    - [8, 9171.48]
  - - [4096, 3040, 1, 1024, 4096, 4096, 4096, 1024]
    - [6, 9624.0]
  - - [1024, 7632, 1, 1024, 1024, 1024, 1024, 1024]
    - [0, 8962.8]
  - - [1024, 7168, 1, 1024, 1024, 1024, 1024, 1024]
    - [8, 9937.81]
  - - [1024, 2992, 1, 1024, 1024, 1024, 1024, 1024]
    - [0, 9341.74]
  - - [1024, 6344, 1, 1024, 1024, 1024, 1024, 1024]
    - [6, 9356.56]
  - - [1024, 7400, 1, 4096, 1024, 1024, 1024, 4096]
    - [9, 10056.8]
  - - [4096, 7800, 1, 1024, 4096, 4096, 4096, 1024]
    - [7, 9331.92]
  - - [1024, 7760, 1, 4096, 1024, 1024, 1024, 4096]
    - [0, 9612.43]
  - - [1024, 7296, 1, 4096, 1024, 1024, 1024, 4096]
    - [6, 10195.1]
  - - [4096, 4144, 1, 1024, 4096, 4096, 4096, 1024]
    - [7, 9159.54]
  - - [1024, 7360, 1, 1024, 1024, 1024, 1024, 1024]
    - [16, 9039.42]
  - - [1024, 6480, 1, 4096, 1024, 1024, 1024, 4096]
    - [6, 10205.4]
  - - [1024, 23040, 1, 1024, 1024, 1024, 1024, 1024]
    - [7, 10124.7]
  - - [4096, 5280, 1, 1024, 4096, 4096, 4096, 1024]
    - [8, 9876.31]
  - - [4096, 7840, 1, 1024, 4096, 4096, 4096, 1024]
    - [0, 9941.24]
  - - [1024, 420, 1, 1024, 1024, 1024, 1024, 1024]
    - [16, 8119.5]
  - - [1024, 18944, 1, 1024, 1024, 1024, 1024, 1024]
    - [1, 10180.1]
  - - [1024, 6560, 1, 1024, 1024, 1024, 1024, 1024]
    - [16, 9203.91]
  - - [1024, 400, 1, 1024, 1024, 1024, 1024, 1024]
    - [16, 8256.5]
  - - [1024, 8000, 1, 1024, 1024, 1024, 1024, 1024]
    - [0, 10219.0]
  - - [1024, 412, 1, 1024, 1024, 1024, 1024, 1024]
    - [16, 7479.45]
  - - [1024, 5424, 1, 4096, 1024, 1024, 1024, 4096]
    - [8, 10964.4]
  - - [1024, 9728, 1, 1024, 1024, 1024, 1024, 1024]
    - [8, 10990.0]
  - - [1024, 8160, 1, 1024, 1024, 1024, 1024, 1024]
    - [4, 8930.73]
  - - [1024, 5472, 1, 33712, 1024, 1024, 1024, 33712]
    - [9, 11412.4]
  - - [1024, 7968, 1, 1024, 1024, 1024, 1024, 1024]
    - [0, 10198.0]
  - - [1024, 7216, 1, 4096, 1024, 1024, 1024, 4096]
    - [8, 10115.4]
  - - [4096, 7888, 1, 1024, 4096, 4096, 4096, 1024]
    - [9, 9391.55]
  - - [1024, 4816, 1, 1024, 1024, 1024, 1024, 1024]
    - [16, 9133.85]
  - - [1024, 5208, 1, 33712, 1024, 1024, 1024, 33712]
    - [9, 10397.4]
  - - [1024, 2992, 1, 33712, 1024, 1024, 1024, 33712]
    - [0, 9301.29]
  - - [4096, 1440, 1, 1024, 4096, 4096, 4096, 1024]
    - [7, 9198.0]
  - - [1024, 476, 1, 1024, 1024, 1024, 1024, 1024]
    - [10, 7154.85]
  - - [1024, 2584, 1, 4096, 1024, 1024, 1024, 4096]
    - [7, 9766.82]
  - - [1024, 6912, 1, 33712, 1024, 1024, 1024, 33712]
    - [9, 10085.7]
  - - [1024, 6208, 1, 1024, 1024, 1024, 1024, 1024]
    - [4, 10187.7]
  - - [1024, 7000, 1, 4096, 1024, 1024, 1024, 4096]
    - [7, 9338.91]
  - - [4096, 4864, 1, 1024, 4096, 4096, 4096, 1024]
    - [8, 9933.11]
  - - [1024, 8032, 1, 4096, 1024, 1024, 1024, 4096]
    - [0, 9556.7]
  - - [1024, 396, 1, 1024, 1024, 1024, 1024, 1024]
    - [16, 8251.91]
  - - [1024, 7344, 1, 4096, 1024, 1024, 1024, 4096]
    - [0, 10129.9]
  - - [1024, 6392, 1, 4096, 1024, 1024, 1024, 4096]
    - [6, 10195.4]
  - - [1024, 7888, 1, 4096, 1024, 1024, 1024, 4096]
    - [4, 8862.63]
  - - [1024, 6208, 1, 33712, 1024, 1024, 1024, 33712]
    - [14, 9444.83]
  - - [1024, 7840, 1, 1024, 1024, 1024, 1024, 1024]
    - [1, 9925.63]
  - - [4096, 6208, 1, 1024, 4096, 4096, 4096, 1024]
    - [7, 9950.99]
  - - [1024, 5600, 1, 1024, 1024, 1024, 1024, 1024]
    - [0, 9332.5]
  - - [1024, 7776, 1, 1024, 1024, 1024, 1024, 1024]
    - [6, 9122.1]
  - - [1024, 8056, 1, 1024, 1024, 1024, 1024, 1024]
    - [0, 9616.69]
  - - [1024, 3168, 1, 1024, 1024, 1024, 1024, 1024]
    - [16, 10157.4]
  - - [4096, 3128, 1, 1024, 4096, 4096, 4096, 1024]
    - [8, 9942.81]
  - - [1024, 8056, 1, 33712, 1024, 1024, 1024, 33712]
    - [6, 9680.83]
  - - [1024, 4704, 1, 4096, 1024, 1024, 1024, 4096]
    - [6, 8953.18]
  - - [4096, 5424, 1, 1024, 4096, 4096, 4096, 1024]
    - [8, 10112.1]
  - - [1024, 304, 1, 1024, 1024, 1024, 1024, 1024]
    - [10, 6917.69]
  - - [1024, 7208, 1, 4096, 1024, 1024, 1024, 4096]
    - [9, 10021.9]
  - - [1024, 3264, 1, 1024, 1024, 1024, 1024, 1024]
    - [16, 10128.3]
  - - [1024, 8096, 1, 1024, 1024, 1024, 1024, 1024]
    - [6, 8879.96]
  - - [1024, 8064, 1, 33712, 1024, 1024, 1024, 33712]
    - [6, 9730.31]
  - - [1024, 7680, 1, 4096, 1024, 1024, 1024, 4096]
    - [6, 9775.71]
  - - [1024, 7504, 1, 4096, 1024, 1024, 1024, 4096]
    - [0, 9548.21]
  - - [1024, 3120, 1, 4096, 1024, 1024, 1024, 4096]
    - [18, 9278.35]
  - - [4096, 4032, 1, 1024, 4096, 4096, 4096, 1024]
    - [7, 9968.51]
  - - [4096, 4488, 1, 1024, 4096, 4096, 4096, 1024]
    - [4, 9371.87]
  - - [4096, 7168, 1, 1024, 4096, 4096, 4096, 1024]
    - [1, 10154.8]
  - - [1024, 6272, 1, 4096, 1024, 1024, 1024, 4096]
    - [7, 10135.4]
  - - [1024, 5952, 1, 4096, 1024, 1024, 1024, 4096]
    - [6, 9780.45]
  - - [4096, 6992, 1, 1024, 4096, 4096, 4096, 1024]
    - [6, 9958.73]
  - - [4096, 7344, 1, 1024, 4096, 4096, 4096, 1024]
    - [0, 9750.21]
  - - [1024, 2240, 1, 33712, 1024, 1024, 1024, 33712]
    - [16, 9521.71]
  - - [1024, 7936, 1, 1024, 1024, 1024, 1024, 1024]
    - [22, 8809.89]
  - - [1024, 7656, 1, 4096, 1024, 1024, 1024, 4096]
    - [0, 9727.45]
  - - [1024, 7488, 1, 33712, 1024, 1024, 1024, 33712]
    - [18, 9567.24]
  - - [4096, 1248, 1, 1024, 4096, 4096, 4096, 1024]
    - [4, 9500.64]
  - - [1024, 7776, 1, 4096, 1024, 1024, 1024, 4096]
    - [9, 8845.41]
  - - [1024, 7904, 1, 33712, 1024, 1024, 1024, 33712]
    - [19, 9581.59]
  - - [1024, 2576, 1, 4096, 1024, 1024, 1024, 4096]
    - [3, 8337.31]
  - - [1024, 4784, 1, 1024, 1024, 1024, 1024, 1024]
    - [1, 9365.89]
  - - [1024, 5520, 1, 33712, 1024, 1024, 1024, 33712]
    - [9, 10012.1]
  - - [1024, 7728, 1, 4096, 1024, 1024, 1024, 4096]
    - [0, 10225.3]
  - - [4096, 7968, 1, 1024, 4096, 4096, 4096, 1024]
    - [9, 9755.3]
  - - [1024, 9216, 1, 1024, 1024, 1024, 1024, 1024]
    - [8, 11234.7]
  - - [1024, 3360, 1, 33712, 1024, 1024, 1024, 33712]
    - [8, 9597.09]
  - - [1024, 6120, 1, 4096, 1024, 1024, 1024, 4096]
    - [4, 8851.15]
  - - [1024, 7208, 1, 33712, 1024, 1024, 1024, 33712]
    - [19, 9759.91]
  - - [1024, 7392, 1, 33712, 1024, 1024, 1024, 33712]
    - [19, 9618.13]
  - - [4096, 3696, 1, 1024, 4096, 4096, 4096, 1024]
    - [8, 10792.3]
  - - [1024, 7696, 1, 33712, 1024, 1024, 1024, 33712]
    - [18, 9756.21]
  - - [1024, 7688, 1, 33712, 1024, 1024, 1024, 33712]
    - [18, 9789.29]
  - - [1024, 6344, 1, 4096, 1024, 1024, 1024, 4096]
    - [8, 9017.65]
  - - [1024, 3520, 1, 1024, 1024, 1024, 1024, 1024]
    - [1, 9082.12]
  - - [4096, 8096, 1, 1024, 4096, 4096, 4096, 1024]
    - [8, 9468.47]
  - - [1024, 7592, 1, 33712, 1024, 1024, 1024, 33712]
    - [16, 9626.43]
  - - [1024, 7584, 1, 33712, 1024, 1024, 1024, 33712]
    - [18, 9714.6]
  - - [1024, 1824, 1, 4096, 1024, 1024, 1024, 4096]
    - [16, 9725.39]
  - - [1024, 6768, 1, 1024, 1024, 1024, 1024, 1024]
    - [16, 9164.17]
  - - [1024, 7424, 1, 1024, 1024, 1024, 1024, 1024]
    - [9, 9260.33]
  - - [1024, 5472, 1, 1024, 1024, 1024, 1024, 1024]
    - [16, 9564.26]
  - - [1024, 5616, 1, 33712, 1024, 1024, 1024, 33712]
    - [9, 10111.4]
  - - [4096, 3264, 1, 1024, 4096, 4096, 4096, 1024]
    - [7, 10443.5]
  - - [1024, 7912, 1, 1024, 1024, 1024, 1024, 1024]
    - [4, 8789.95]
  - - [1024, 7480, 1, 4096, 1024, 1024, 1024, 4096]
    - [7, 9173.26]
  - - [1024, 6496, 1, 4096, 1024, 1024, 1024, 4096]
    - [7, 9753.6]
  - - [1024, 6120, 1, 1024, 1024, 1024, 1024, 1024]
    - [22, 8871.46]
  - - [4096, 5104, 1, 1024, 4096, 4096, 4096, 1024]
    - [8, 9936.71]
  - - [1024, 7800, 1, 1024, 1024, 1024, 1024, 1024]
    - [0, 9589.69]
  - - [4096, 6624, 1, 1024, 4096, 4096, 4096, 1024]
    - [6, 9948.35]
  - - [1024, 6032, 1, 1024, 1024, 1024, 1024, 1024]
    - [16, 9054.32]
  - - [4096, 3400, 1, 1024, 4096, 4096, 4096, 1024]
    - [8, 9495.91]
  - - [1024, 6600, 1, 33712, 1024, 1024, 1024, 33712]
    - [17, 10078.6]
  - - [1024, 7800, 1, 4096, 1024, 1024, 1024, 4096]
    - [7, 9234.97]
  - - [1024, 3224, 1, 4096, 1024, 1024, 1024, 4096]
    - [6, 9171.95]
  - - [1024, 6800, 1, 1024, 1024, 1024, 1024, 1024]
    - [8, 9434.59]
  - - [4096, 8032, 1, 1024, 4096, 4096, 4096, 1024]
    - [8, 10033.8]
  - - [1024, 5568, 1, 4096, 1024, 1024, 1024, 4096]
    - [7, 9537.14]
  - - [1024, 5568, 1, 33712, 1024, 1024, 1024, 33712]
    - [9, 10113.9]
  - - [1024, 5680, 1, 1024, 1024, 1024, 1024, 1024]
    - [6, 10162.3]
  - - [4096, 6080, 1, 1024, 4096, 4096, 4096, 1024]
    - [8, 9772.4]
  - - [1024, 6496, 1, 1024, 1024, 1024, 1024, 1024]
    - [0, 9651.33]
  - - [1024, 3680, 1, 33712, 1024, 1024, 1024, 33712]
    - [8, 10311.5]
  - - [1024, 4992, 1, 33712, 1024, 1024, 1024, 33712]
    - [16, 10075.4]
  - - [1024, 7696, 1, 1024, 1024, 1024, 1024, 1024]
    - [4, 9858.55]
  - - [1024, 5664, 1, 1024, 1024, 1024, 1024, 1024]
    - [8, 9923.66]
  - - [1024, 2944, 1, 4096, 1024, 1024, 1024, 4096]
    - [6, 9012.07]
  - - [1024, 7600, 1, 1024, 1024, 1024, 1024, 1024]
    - [0, 8870.38]
  - - [1024, 7176, 1, 33712, 1024, 1024, 1024, 33712]
    - [8, 9860.71]
  - - [1024, 7176, 1, 4096, 1024, 1024, 1024, 4096]
    - [7, 10143.6]
  - - [1024, 5400, 1, 4096, 1024, 1024, 1024, 4096]
    - [9, 9984.64]
  - - [1024, 6272, 1, 1024, 1024, 1024, 1024, 1024]
    - [16, 10079.5]
  - - [1024, 7696, 1, 4096, 1024, 1024, 1024, 4096]
    - [6, 9104.23]
  - - [4096, 7360, 1, 1024, 4096, 4096, 4096, 1024]
    - [6, 9289.0]
  - - [4096, 6320, 1, 1024, 4096, 4096, 4096, 1024]
    - [0, 10411.9]
  - - [1024, 5824, 1, 33712, 1024, 1024, 1024, 33712]
    - [13, 9494.49]
  - - [1024, 6992, 1, 4096, 1024, 1024, 1024, 4096]
    - [7, 9302.66]
  - - [4096, 1472, 1, 1024, 4096, 4096, 4096, 1024]
    - [1, 8714.42]
  - - [1024, 7888, 1, 1024, 1024, 1024, 1024, 1024]
    - [6, 9243.56]
  - - [1024, 6232, 1, 33712, 1024, 1024, 1024, 33712]
    - [14, 9413.27]
  - - [1024, 3904, 1, 1024, 1024, 1024, 1024, 1024]
    - [7, 9527.15]
  - - [1024, 7200, 1, 33712, 1024, 1024, 1024, 33712]
    - [8, 9566.83]
  - - [1024, 7992, 1, 1024, 1024, 1024, 1024, 1024]
    - [4, 9522.07]
  - - [1024, 3840, 1, 1024, 1024, 1024, 1024, 1024]
    - [1, 9213.16]
  - - [1024, 8024, 1, 4096, 1024, 1024, 1024, 4096]
    - [6, 9349.02]
  - - [4096, 3840, 1, 1024, 4096, 4096, 4096, 1024]
    - [6, 9990.86]
  - - [1024, 6144, 1, 1024, 1024, 1024, 1024, 1024]
    - [22, 9553.96]
  - - [1024, 7752, 1, 4096, 1024, 1024, 1024, 4096]
    - [0, 9480.66]
  - - [1024, 2720, 1, 1024, 1024, 1024, 1024, 1024]
    - [16, 9372.1]
  - - [4096, 7992, 1, 1024, 4096, 4096, 4096, 1024]
    - [7, 9388.51]
  - - [1024, 6360, 1, 33712, 1024, 1024, 1024, 33712]
    - [19, 9995.76]
  - - [1024, 7072, 1, 1024, 1024, 1024, 1024, 1024]
    - [4, 9433.52]
  - - [1024, 7992, 1, 33712, 1024, 1024, 1024, 33712]
    - [6, 9643.43]
  - - [1024, 5400, 1, 1024, 1024, 1024, 1024, 1024]
    - [8, 10665.9]
  - - [1024, 8176, 1, 1024, 1024, 1024, 1024, 1024]
    - [0, 9529.08]
  - - [1024, 6336, 1, 33712, 1024, 1024, 1024, 33712]
    - [4, 9568.35]
  - - [1024, 6048, 1, 1024, 1024, 1024, 1024, 1024]
    - [4, 9260.75]
  - - [1024, 8096, 1, 4096, 1024, 1024, 1024, 4096]
    - [8, 9501.32]
  - - [1024, 2664, 1, 4096, 1024, 1024, 1024, 4096]
    - [6, 10100.5]
  - - [1024, 6384, 1, 1024, 1024, 1024, 1024, 1024]
    - [6, 8896.03]
  - - [1024, 6048, 1, 33712, 1024, 1024, 1024, 33712]
    - [14, 9095.26]
  - - [1024, 7968, 1, 33712, 1024, 1024, 1024, 33712]
    - [6, 9592.07]
  - - [1024, 7912, 1, 33712, 1024, 1024, 1024, 33712]
    - [6, 9392.13]
  - - [1024, 4144, 1, 4096, 1024, 1024, 1024, 4096]
    - [6, 9862.64]
  - - [1024, 7008, 1, 4096, 1024, 1024, 1024, 4096]
    - [6, 9919.27]
  - - [4096, 7320, 1, 1024, 4096, 4096, 4096, 1024]
    - [9, 9709.98]
  - - [1024, 5040, 1, 33712, 1024, 1024, 1024, 33712]
    - [9, 10160.7]
  - - [1024, 16384, 1, 1024, 1024, 1024, 1024, 1024]
    - [8, 10204.7]
  - - [4096, 8176, 1, 1024, 4096, 4096, 4096, 1024]
    - [9, 9634.02]
  - - [4096, 5472, 1, 1024, 4096, 4096, 4096, 1024]
    - [7, 9983.97]
  - - [1024, 7128, 1, 4096, 1024, 1024, 1024, 4096]
    - [9, 9753.14]
  - - [4096, 2736, 1, 1024, 4096, 4096, 4096, 1024]
    - [6, 9301.3]
  - - [1024, 3960, 1, 1024, 1024, 1024, 1024, 1024]
    - [16, 8489.42]
  - - [1024, 8184, 1, 4096, 1024, 1024, 1024, 4096]
    - [7, 9505.44]
  - - [1024, 5936, 1, 4096, 1024, 1024, 1024, 4096]
    - [7, 9703.97]
  - - [1024, 5920, 1, 1024, 1024, 1024, 1024, 1024]
    - [0, 9455.8]
  - - [1024, 5104, 1, 4096, 1024, 1024, 1024, 4096]
    - [8, 9571.68]
  - - [1024, 8184, 1, 33712, 1024, 1024, 1024, 33712]
    - [6, 9813.14]
  - - [1024, 4968, 1, 33712, 1024, 1024, 1024, 33712]
    - [9, 9673.62]
  - - [1024, 7808, 1, 1024, 1024, 1024, 1024, 1024]
    - [4, 9994.2]
  - - [1024, 2112, 1, 1024, 1024, 1024, 1024, 1024]
    - [16, 9532.47]
  - - [1024, 7320, 1, 1024, 1024, 1024, 1024, 1024]
    - [8, 10748.9]
  - - [4096, 5120, 1, 1024, 4096, 4096, 4096, 1024]
    - [8, 9995.7]
  - - [1024, 1320, 1, 4096, 1024, 1024, 1024, 4096]
    - [16, 9362.25]
  - - [1024, 5824, 1, 4096, 1024, 1024, 1024, 4096]
    - [6, 9176.66]
  - - [4096, 3360, 1, 1024, 4096, 4096, 4096, 1024]
    - [7, 9881.09]
  - - [1024, 2584, 1, 1024, 1024, 1024, 1024, 1024]
    - [16, 9679.59]
  - - [4096, 7128, 1, 1024, 4096, 4096, 4096, 1024]
    - [7, 10034.4]
  - - [1024, 5104, 1, 33712, 1024, 1024, 1024, 33712]
    - [9, 10379.3]
  - - [4096, 3808, 1, 1024, 4096, 4096, 4096, 1024]
    - [7, 9912.52]
  - - [1024, 7448, 1, 33712, 1024, 1024, 1024, 33712]
    - [18, 9558.58]
  - - [1024, 7168, 1, 33712, 1024, 1024, 1024, 33712]
    - [17, 9476.86]
  - - [4096, 2304, 1, 1024, 4096, 4096, 4096, 1024]
    - [8, 8890.52]
  - - [4096, 5984, 1, 1024, 4096, 4096, 4096, 1024]
    - [7, 9321.19]
  - - [1024, 7888, 1, 33712, 1024, 1024, 1024, 33712]
    - [6, 9572.16]
  - - [1024, 5984, 1, 4096, 1024, 1024, 1024, 4096]
    - [4, 9342.57]
  - - [4096, 4352, 1, 1024, 4096, 4096, 4096, 1024]
    - [0, 9707.68]
  - - [4096, 4224, 1, 1024, 4096, 4096, 4096, 1024]
    - [6, 9862.32]
  - - [4096, 7056, 1, 1024, 4096, 4096, 4096, 1024]
    - [6, 9293.94]
  - - [1024, 5040, 1, 4096, 1024, 1024, 1024, 4096]
    - [8, 10262.5]
  - - [4096, 2392, 1, 1024, 4096, 4096, 4096, 1024]
    - [8, 9582.73]
  - - [1024, 2392, 1, 4096, 1024, 1024, 1024, 4096]
    - [0, 8289.87]
  - - [1024, 8040, 1, 4096, 1024, 1024, 1024, 4096]
    - [8, 9154.65]
  - - [1024, 7392, 1, 1024, 1024, 1024, 1024, 1024]
    - [8, 10060.0]
  - - [4096, 3584, 1, 1024, 4096, 4096, 4096, 1024]
    - [6, 9890.21]
  - - [1024, 5632, 1, 33712, 1024, 1024, 1024, 33712]
    - [8, 10282.8]
  - - [4096, 6448, 1, 1024, 4096, 4096, 4096, 1024]
    - [0, 10422.0]
  - - [1024, 8120, 1, 33712, 1024, 1024, 1024, 33712]
    - [6, 9784.17]
  - - [1024, 7896, 1, 1024, 1024, 1024, 1024, 1024]
    - [0, 10106.8]
  - - [1024, 452, 1, 1024, 1024, 1024, 1024, 1024]
    - [11, 6249.38]
  - - [4096, 6344, 1, 1024, 4096, 4096, 4096, 1024]
    - [6, 10216.5]
  - - [1024, 8024, 1, 33712, 1024, 1024, 1024, 33712]
    - [6, 9594.55]
  - - [1024, 7728, 1, 33712, 1024, 1024, 1024, 33712]
    - [17, 9449.46]
  - - [1024, 5424, 1, 1024, 1024, 1024, 1024, 1024]
    - [6, 10121.5]
  - - [4096, 7896, 1, 1024, 4096, 4096, 4096, 1024]
    - [6, 9966.44]
  - - [1024, 7896, 1, 4096, 1024, 1024, 1024, 4096]
    - [0, 9409.19]
  - - [4096, 5200, 1, 1024, 4096, 4096, 4096, 1024]
    - [8, 9720.77]
  - - [4096, 5576, 1, 1024, 4096, 4096, 4096, 1024]
    - [0, 10069.6]
  - - [1024, 5760, 1, 1024, 1024, 1024, 1024, 1024]
    - [0, 9573.57]
  - - [4096, 7104, 1, 1024, 4096, 4096, 4096, 1024]
    - [6, 9395.17]
  - - [1024, 7360, 1, 33712, 1024, 1024, 1024, 33712]
    - [8, 9798.19]
  - - [1024, 7320, 1, 4096, 1024, 1024, 1024, 4096]
    - [6, 9947.31]
  - - [1024, 4480, 1, 33712, 1024, 1024, 1024, 33712]
    - [16, 9181.93]
  - - [1024, 5304, 1, 4096, 1024, 1024, 1024, 4096]
    - [8, 10015.9]
  - - [1024, 7656, 1, 1024, 1024, 1024, 1024, 1024]
    - [8, 9806.34]
  - - [1024, 7704, 1, 4096, 1024, 1024, 1024, 4096]
    - [0, 8853.98]
  - - [4096, 8112, 1, 1024, 4096, 4096, 4096, 1024]
    - [8, 10129.3]
  - - [4096, 7752, 1, 1024, 4096, 4096, 4096, 1024]
    - [8, 10236.7]
  - - [1024, 5712, 1, 4096, 1024, 1024, 1024, 4096]
    - [6, 9799.8]
  - - [1024, 4368, 1, 33712, 1024, 1024, 1024, 33712]
    - [20, 9119.05]
  - - [1024, 3120, 1, 1024, 1024, 1024, 1024, 1024]
    - [16, 9281.5]
  - - [1024, 4320, 1, 1024, 1024, 1024, 1024, 1024]
    - [0, 9391.75]
  - - [1024, 3584, 1, 4096, 1024, 1024, 1024, 4096]
    - [6, 10142.7]
  - - [1024, 332, 1, 1024, 1024, 1024, 1024, 1024]
    - [16, 7007.39]
  - - [4096, 6440, 1, 1024, 4096, 4096, 4096, 1024]
    - [0, 10412.0]
  - - [1024, 8000, 1, 33712, 1024, 1024, 1024, 33712]
    - [19, 9842.07]
  - - [1024, 7360, 1, 4096, 1024, 1024, 1024, 4096]
    - [7, 10011.3]
  - - [1024, 4800, 1, 1024, 1024, 1024, 1024, 1024]
    - [8, 8809.06]
  - - [1024, 2520, 1, 4096, 1024, 1024, 1024, 4096]
    - [7, 8953.65]
  - - [1024, 6320, 1, 4096, 1024, 1024, 1024, 4096]
    - [7, 9773.72]
  - - [1024, 5824, 1, 1024, 1024, 1024, 1024, 1024]
    - [0, 9550.36]
  - - [1024, 5880, 1, 1024, 1024, 1024, 1024, 1024]
    - [4, 9069.2]
  - - [4096, 4800, 1, 1024, 4096, 4096, 4096, 1024]
    - [4, 9489.34]
  - - [1024, 6968, 1, 33712, 1024, 1024, 1024, 33712]
    - [18, 9782.14]
  - - [1024, 7344, 1, 33712, 1024, 1024, 1024, 33712]
    - [8, 9650.39]
  - - [1024, 3360, 1, 1024, 1024, 1024, 1024, 1024]
    - [8, 10535.9]
  - - [1024, 7568, 1, 1024, 1024, 1024, 1024, 1024]
    - [0, 9572.02]
  - - [1024, 6720, 1, 4096, 1024, 1024, 1024, 4096]
    - [6, 9950.3]
  - - [1024, 3360, 1, 4096, 1024, 1024, 1024, 4096]
    - [4, 9045.91]
  - - [1024, 6552, 1, 33712, 1024, 1024, 1024, 33712]
    - [14, 9400.59]
  - - [4096, 5952, 1, 1024, 4096, 4096, 4096, 1024]
    - [8, 10238.0]
  - - [1024, 5200, 1, 1024, 1024, 1024, 1024, 1024]
    - [16, 9805.38]
  - - [1024, 7056, 1, 4096, 1024, 1024, 1024, 4096]
    - [8, 9384.0]
  - - [1024, 5200, 1, 33712, 1024, 1024, 1024, 33712]
    - [9, 10530.5]
  - - [1024, 1072, 1, 1024, 1024, 1024, 1024, 1024]
    - [1, 8620.16]
  - - [1024, 6408, 1, 1024, 1024, 1024, 1024, 1024]
    - [0, 9546.55]
  - - [1024, 5200, 1, 4096, 1024, 1024, 1024, 4096]
    - [8, 9833.67]
  - - [1024, 6960, 1, 33712, 1024, 1024, 1024, 33712]
    - [18, 9635.89]
  - - [1024, 1760, 1, 1024, 1024, 1024, 1024, 1024]
    - [9, 10670.0]
  - - [1024, 6968, 1, 4096, 1024, 1024, 1024, 4096]
    - [8, 9279.92]
  - - [1024, 472, 1, 1024, 1024, 1024, 1024, 1024]
    - [27, 6637.98]
  - - [1024, 7752, 1, 33712, 1024, 1024, 1024, 33712]
    - [16, 9357.65]
  - - [1024, 1760, 1, 4096, 1024, 1024, 1024, 4096]
    - [4, 9411.91]
  - - [1024, 5880, 1, 4096, 1024, 1024, 1024, 4096]
    - [7, 8997.46]
  - - [4096, 7592, 1, 1024, 4096, 4096, 4096, 1024]
    - [8, 10035.2]
  - - [1024, 7592, 1, 4096, 1024, 1024, 1024, 4096]
    - [0, 9665.34]
  - - [1024, 5440, 1, 1024, 1024, 1024, 1024, 1024]
    - [16, 9541.4]
  - - [1024, 5440, 1, 4096, 1024, 1024, 1024, 4096]
    - [8, 10266.4]
  - - [1024, 3200, 1, 1024, 1024, 1024, 1024, 1024]
    - [0, 9936.71]
  - - [4096, 3200, 1, 1024, 4096, 4096, 4096, 1024]
    - [6, 9976.9]
  - - [1024, 3200, 1, 4096, 1024, 1024, 1024, 4096]
    - [7, 9085.43]
  - - [1024, 3696, 1, 1024, 1024, 1024, 1024, 1024]
    - [8, 9307.21]
  - - [1024, 4888, 1, 1024, 1024, 1024, 1024, 1024]
    - [16, 9221.04]
  - - [1024, 7968, 1, 4096, 1024, 1024, 1024, 4096]
    - [8, 9014.72]
  - - [1024, 7056, 1, 1024, 1024, 1024, 1024, 1024]
    - [8, 9780.46]
  - - [1024, 480, 1, 1024, 1024, 1024, 1024, 1024]
    - [11, 7198.46]
  - - [1024, 7872, 1, 33712, 1024, 1024, 1024, 33712]
    - [18, 9600.43]
  - - [1024, 7504, 1, 1024, 1024, 1024, 1024, 1024]
    - [16, 9251.81]
  - - [1024, 3240, 1, 4096, 1024, 1024, 1024, 4096]
    - [8, 8623.65]
  - - [1024, 5792, 1, 33712, 1024, 1024, 1024, 33712]
    - [14, 8756.23]
  - - [1024, 7192, 1, 1024, 1024, 1024, 1024, 1024]
    - [0, 10101.4]
  - - [1024, 7520, 1, 1024, 1024, 1024, 1024, 1024]
    - [0, 9506.73]
  - - [1024, 6512, 1, 1024, 1024, 1024, 1024, 1024]
    - [0, 9676.2]
  - - [1024, 7520, 1, 33712, 1024, 1024, 1024, 33712]
    - [18, 9717.83]
  - - [1024, 7592, 1, 1024, 1024, 1024, 1024, 1024]
    - [16, 9254.97]
  - - [4096, 7520, 1, 1024, 4096, 4096, 4096, 1024]
    - [0, 9743.55]
  - - [1024, 7520, 1, 4096, 1024, 1024, 1024, 4096]
    - [0, 9590.21]
  - - [1024, 3344, 1, 4096, 1024, 1024, 1024, 4096]
    - [7, 9545.97]
  - - [1024, 5920, 1, 33712, 1024, 1024, 1024, 33712]
    - [13, 9578.15]
  - - [1024, 3840, 1, 33712, 1024, 1024, 1024, 33712]
    - [0, 9063.99]
  - - [4096, 6968, 1, 1024, 4096, 4096, 4096, 1024]
    - [6, 9928.05]
  - - [1024, 6112, 1, 4096, 1024, 1024, 1024, 4096]
    - [7, 10018.6]
  - - [1024, 14336, 1, 1024, 1024, 1024, 1024, 1024]
    - [4, 9701.28]
  - - [1024, 6688, 1, 33712, 1024, 1024, 1024, 33712]
    - [16, 10131.3]
  - - [1024, 5952, 1, 33712, 1024, 1024, 1024, 33712]
    - [13, 9477.83]
  - - [1024, 6840, 1, 1024, 1024, 1024, 1024, 1024]
    - [4, 9826.05]
  - - [1024, 3680, 1, 4096, 1024, 1024, 1024, 4096]
    - [8, 9598.87]
  - - [4096, 6840, 1, 1024, 4096, 4096, 4096, 1024]
    - [6, 10014.0]
  - - [4096, 7248, 1, 1024, 4096, 4096, 4096, 1024]
    - [9, 9325.21]
  - - [1024, 6080, 1, 1024, 1024, 1024, 1024, 1024]
    - [0, 9376.57]
  - - [4096, 3384, 1, 1024, 4096, 4096, 4096, 1024]
    - [8, 9446.69]
  - - [4096, 6232, 1, 1024, 4096, 4096, 4096, 1024]
    - [7, 9309.49]
  - - [4096, 6808, 1, 1024, 4096, 4096, 4096, 1024]
    - [6, 9973.28]
  - - [1024, 6232, 1, 4096, 1024, 1024, 1024, 4096]
    - [7, 10773.0]
  - - [1024, 364, 1, 1024, 1024, 1024, 1024, 1024]
    - [16, 7068.18]
  - - [1024, 436, 1, 1024, 1024, 1024, 1024, 1024]
    - [16, 9768.79]
  - - [1024, 7832, 1, 33712, 1024, 1024, 1024, 33712]
    - [16, 9501.05]
  - - [1024, 6864, 1, 1024, 1024, 1024, 1024, 1024]
    - [4, 9235.96]
  - - [4096, 6864, 1, 1024, 4096, 4096, 4096, 1024]
    - [6, 9842.19]
  - - [1024, 6864, 1, 4096, 1024, 1024, 1024, 4096]
    - [6, 9197.01]
  - - [1024, 6080, 1, 33712, 1024, 1024, 1024, 33712]
    - [13, 9298.15]
  - - [1024, 1248, 1, 1024, 1024, 1024, 1024, 1024]
    - [16, 9889.8]
  - - [1024, 7544, 1, 1024, 1024, 1024, 1024, 1024]
    - [8, 9642.16]
  - - [1024, 4888, 1, 4096, 1024, 1024, 1024, 4096]
    - [0, 9304.73]
  - - [1024, 7232, 1, 1024, 1024, 1024, 1024, 1024]
    - [0, 10034.0]
  - - [1024, 7440, 1, 4096, 1024, 1024, 1024, 4096]
    - [0, 9505.29]
  - - [4096, 4960, 1, 1024, 4096, 4096, 4096, 1024]
    - [8, 10078.9]
  - - [1024, 3672, 1, 4096, 1024, 1024, 1024, 4096]
    - [0, 10103.8]
  - - [4096, 5712, 1, 1024, 4096, 4096, 4096, 1024]
    - [8, 9827.46]
  - - [1024, 7008, 1, 1024, 1024, 1024, 1024, 1024]
    - [8, 10400.2]
  - - [1024, 4960, 1, 4096, 1024, 1024, 1024, 4096]
    - [8, 10092.6]
  - - [1024, 2576, 1, 1024, 1024, 1024, 1024, 1024]
    - [7, 9600.23]
  - - [1024, 3224, 1, 1024, 1024, 1024, 1024, 1024]
    - [0, 9502.47]
  - - [4096, 2944, 1, 1024, 4096, 4096, 4096, 1024]
    - [4, 9666.19]
  - - [1024, 5120, 1, 4096, 1024, 1024, 1024, 4096]
    - [8, 10399.6]
  - - [4096, 7424, 1, 1024, 4096, 4096, 4096, 1024]
    - [1, 10388.6]
  - - [1024, 5032, 1, 1024, 1024, 1024, 1024, 1024]
    - [16, 9573.99]
  - - [1024, 3128, 1, 1024, 1024, 1024, 1024, 1024]
    - [16, 9956.09]
  - - [1024, 4816, 1, 4096, 1024, 1024, 1024, 4096]
    - [18, 9365.58]
  - - [1024, 5680, 1, 4096, 1024, 1024, 1024, 4096]
    - [0, 9517.54]
  - - [1024, 5032, 1, 33712, 1024, 1024, 1024, 33712]
    - [9, 9830.8]
  - - [1024, 5032, 1, 4096, 1024, 1024, 1024, 4096]
    - [0, 10196.8]
  - - [1024, 3240, 1, 1024, 1024, 1024, 1024, 1024]
    - [8, 9519.65]
  - - [1024, 6360, 1, 1024, 1024, 1024, 1024, 1024]
    - [8, 9500.96]
  - - [4096, 3888, 1, 1024, 4096, 4096, 4096, 1024]
    - [0, 9632.47]
  - - [1024, 7440, 1, 33712, 1024, 1024, 1024, 33712]
    - [18, 9725.77]
  - - [1024, 1472, 1, 1024, 1024, 1024, 1024, 1024]
    - [16, 8891.13]
  - - [4096, 4928, 1, 1024, 4096, 4096, 4096, 1024]
    - [8, 10783.8]
  - - [1024, 1472, 1, 4096, 1024, 1024, 1024, 4096]
    - [1, 9116.94]
  - - [1024, 8704, 1, 1024, 1024, 1024, 1024, 1024]
    - [8, 9692.01]
  - - [1024, 4608, 1, 1024, 1024, 1024, 1024, 1024]
    - [16, 8863.77]
  - - [4096, 7552, 1, 1024, 4096, 4096, 4096, 1024]
    - [7, 9408.57]
  - - [1024, 3000, 1, 33712, 1024, 1024, 1024, 33712]
    - [8, 9237.31]
  - - [4096, 3000, 1, 1024, 4096, 4096, 4096, 1024]
    - [7, 9057.63]
  - - [1024, 5280, 1, 4096, 1024, 1024, 1024, 4096]
    - [8, 9952.65]
  - - [1024, 3000, 1, 4096, 1024, 1024, 1024, 4096]
    - [16, 9841.43]
  - - [1024, 7504, 1, 33712, 1024, 1024, 1024, 33712]
    - [18, 9692.43]
  - - [1024, 2352, 1, 1024, 1024, 1024, 1024, 1024]
    - [7, 9395.92]
  - - [1024, 5208, 1, 1024, 1024, 1024, 1024, 1024]
    - [8, 9519.18]
  - - [4096, 5208, 1, 1024, 4096, 4096, 4096, 1024]
    - [4, 8924.89]
  - - [1024, 5208, 1, 4096, 1024, 1024, 1024, 4096]
    - [0, 10118.1]
  - - [1024, 8040, 1, 33712, 1024, 1024, 1024, 33712]
    - [6, 9703.03]
  - - [1024, 968, 1, 1024, 1024, 1024, 1024, 1024]
    - [18, 7870.79]
  - - [4096, 968, 1, 1024, 4096, 4096, 4096, 1024]
    - [0, 9459.63]
  - - [1024, 968, 1, 4096, 1024, 1024, 1024, 4096]
    - [23, 7163.15]
  - - [1024, 4968, 1, 1024, 1024, 1024, 1024, 1024]
    - [16, 9137.85]
  - - [4096, 4968, 1, 1024, 4096, 4096, 4096, 1024]
    - [8, 9446.05]
  - - [1024, 4736, 1, 1024, 1024, 1024, 1024, 1024]
    - [0, 9970.36]
  - - [1024, 4968, 1, 4096, 1024, 1024, 1024, 4096]
    - [7, 8839.22]
  - - [1024, 3672, 1, 1024, 1024, 1024, 1024, 1024]
    - [8, 10497.2]
  - - [4096, 5920, 1, 1024, 4096, 4096, 4096, 1024]
    - [8, 9564.79]
  - - [1024, 4872, 1, 1024, 1024, 1024, 1024, 1024]
    - [16, 9909.69]
  - - [1024, 7952, 1, 4096, 1024, 1024, 1024, 4096]
    - [5, 9116.02]
  - - [1024, 6448, 1, 33712, 1024, 1024, 1024, 33712]
    - [9, 9570.62]
  - - [1024, 6400, 1, 1024, 1024, 1024, 1024, 1024]
    - [6, 9559.63]
  - - [4096, 6264, 1, 1024, 4096, 4096, 4096, 1024]
    - [6, 10431.1]
  - - [1024, 6400, 1, 4096, 1024, 1024, 1024, 4096]
    - [6, 10209.7]
  - - [1024, 5792, 1, 1024, 1024, 1024, 1024, 1024]
    - [0, 9576.97]
  - - [1024, 6600, 1, 1024, 1024, 1024, 1024, 1024]
    - [8, 9138.73]
  - - [4096, 5792, 1, 1024, 4096, 4096, 4096, 1024]
    - [7, 9741.33]
  - - [1024, 6432, 1, 1024, 1024, 1024, 1024, 1024]
    - [0, 9573.6]
  - - [4096, 1952, 1, 1024, 4096, 4096, 4096, 1024]
    - [0, 9365.85]
  - - [1024, 1952, 1, 4096, 1024, 1024, 1024, 4096]
    - [0, 8759.04]
  - - [1024, 7448, 1, 1024, 1024, 1024, 1024, 1024]
    - [6, 9018.2]
  - - [1024, 3168, 1, 4096, 1024, 1024, 1024, 4096]
    - [0, 9322.73]
  - - [4096, 7448, 1, 1024, 4096, 4096, 4096, 1024]
    - [7, 9327.99]
  - - [1024, 7448, 1, 4096, 1024, 1024, 1024, 4096]
    - [0, 9505.32]
  - - [1024, 1440, 1, 4096, 1024, 1024, 1024, 4096]
    - [8, 7943.73]
  - - [1024, 6320, 1, 1024, 1024, 1024, 1024, 1024]
    - [16, 9095.99]
  - - [1024, 4752, 1, 33712, 1024, 1024, 1024, 33712]
    - [18, 9566.83]
  - - [1024, 5704, 1, 1024, 1024, 1024, 1024, 1024]
    - [0, 10137.4]
  - - [1024, 6656, 1, 1024, 1024, 1024, 1024, 1024]
    - [0, 9548.12]
  - - [4096, 6608, 1, 1024, 4096, 4096, 4096, 1024]
    - [6, 10245.4]
  - - [1024, 7192, 1, 33712, 1024, 1024, 1024, 33712]
    - [18, 9819.53]
  - - [1024, 5704, 1, 4096, 1024, 1024, 1024, 4096]
    - [8, 9088.64]
  - - [4096, 2600, 1, 1024, 4096, 4096, 4096, 1024]
    - [8, 10254.6]
  - - [1024, 4896, 1, 1024, 1024, 1024, 1024, 1024]
    - [16, 9346.43]
  - - [1024, 4896, 1, 4096, 1024, 1024, 1024, 4096]
    - [8, 9936.15]
  - - [1024, 3696, 1, 4096, 1024, 1024, 1024, 4096]
    - [8, 9935.2]
  - - [1024, 2304, 1, 4096, 1024, 1024, 1024, 4096]
    - [0, 8071.33]
  - - [1024, 6072, 1, 1024, 1024, 1024, 1024, 1024]
    - [22, 8798.96]
  - - [4096, 6048, 1, 1024, 4096, 4096, 4096, 1024]
    - [8, 9720.37]
  - - [1024, 6360, 1, 4096, 1024, 1024, 1024, 4096]
    - [6, 10102.6]
  - - [1024, 6696, 1, 33712, 1024, 1024, 1024, 33712]
    - [18, 10019.6]
  - - [4096, 4736, 1, 1024, 4096, 4096, 4096, 1024]
    - [6, 9299.69]
  - - [1024, 6552, 1, 1024, 1024, 1024, 1024, 1024]
    - [1, 10102.1]
  - - [4096, 6696, 1, 1024, 4096, 4096, 4096, 1024]
    - [7, 10028.3]
  - - [1024, 3952, 1, 1024, 1024, 1024, 1024, 1024]
    - [6, 8779.57]
  - - [1024, 3000, 1, 1024, 1024, 1024, 1024, 1024]
    - [16, 8890.22]
  - - [1024, 5264, 1, 1024, 1024, 1024, 1024, 1024]
    - [16, 9193.34]
  - - [1024, 4032, 1, 33712, 1024, 1024, 1024, 33712]
    - [14, 8393.1]
  - - [1024, 5264, 1, 33712, 1024, 1024, 1024, 33712]
    - [9, 10028.9]
  - - [4096, 5264, 1, 1024, 4096, 4096, 4096, 1024]
    - [6, 9824.99]
  - - [1024, 5264, 1, 4096, 1024, 1024, 1024, 4096]
    - [0, 10206.9]
  - - [1024, 3328, 1, 1024, 1024, 1024, 1024, 1024]
    - [1, 9614.41]
  - - [4096, 3328, 1, 1024, 4096, 4096, 4096, 1024]
    - [4, 9549.16]
  - - [1024, 6560, 1, 33712, 1024, 1024, 1024, 33712]
    - [18, 9744.53]
  - - [1024, 5832, 1, 1024, 1024, 1024, 1024, 1024]
    - [4, 8950.93]
  - - [1024, 7544, 1, 33712, 1024, 1024, 1024, 33712]
    - [16, 9780.16]
  - - [1024, 2720, 1, 4096, 1024, 1024, 1024, 4096]
    - [10, 8259.82]
  - - [1024, 6656, 1, 33712, 1024, 1024, 1024, 33712]
    - [18, 9761.76]
  - - [1024, 4440, 1, 1024, 1024, 1024, 1024, 1024]
    - [4, 10119.2]
  - - [1024, 4440, 1, 4096, 1024, 1024, 1024, 4096]
    - [7, 9381.87]
  - - [1024, 1440, 1, 1024, 1024, 1024, 1024, 1024]
    - [16, 8195.53]
  - - [4096, 7848, 1, 1024, 4096, 4096, 4096, 1024]
    - [9, 9651.2]
  - - [1024, 3808, 1, 33712, 1024, 1024, 1024, 33712]
    - [23, 8163.66]
  - - [4096, 6400, 1, 1024, 4096, 4096, 4096, 1024]
    - [7, 10045.0]
  - - [1024, 3808, 1, 1024, 1024, 1024, 1024, 1024]
    - [16, 8884.31]
  - - [1024, 4224, 1, 4096, 1024, 1024, 1024, 4096]
    - [18, 9815.55]
  - - [4096, 2520, 1, 1024, 4096, 4096, 4096, 1024]
    - [8, 9352.97]
  - - [1024, 7776, 1, 33712, 1024, 1024, 1024, 33712]
    - [18, 9456.65]
  - - [4096, 8024, 1, 1024, 4096, 4096, 4096, 1024]
    - [9, 9814.69]
  - - [1024, 2944, 1, 1024, 1024, 1024, 1024, 1024]
    - [0, 9176.57]
  - - [1024, 3384, 1, 1024, 1024, 1024, 1024, 1024]
    - [16, 9540.67]
  - - [1024, 6264, 1, 1024, 1024, 1024, 1024, 1024]
    - [16, 9239.61]
  - - [1024, 6512, 1, 4096, 1024, 1024, 1024, 4096]
    - [7, 9090.1]
  - - [1024, 3384, 1, 4096, 1024, 1024, 1024, 4096]
    - [4, 9180.29]
  - - [1024, 4488, 1, 4096, 1024, 1024, 1024, 4096]
    - [7, 9383.45]
  - - [1024, 4752, 1, 1024, 1024, 1024, 1024, 1024]
    - [4, 8968.35]
  - - [4096, 4752, 1, 1024, 4096, 4096, 4096, 1024]
    - [4, 9373.59]
  - - [1024, 4752, 1, 4096, 1024, 1024, 1024, 4096]
    - [18, 9087.42]
  - - [1024, 6392, 1, 1024, 1024, 1024, 1024, 1024]
    - [6, 9622.25]
  - - [1024, 6936, 1, 33712, 1024, 1024, 1024, 33712]
    - [18, 9590.91]
  - - [1024, 3128, 1, 4096, 1024, 1024, 1024, 4096]
    - [8, 9573.09]
  - - [4096, 7480, 1, 1024, 4096, 4096, 4096, 1024]
    - [7, 9381.51]
  - - [1024, 2592, 1, 1024, 1024, 1024, 1024, 1024]
    - [6, 9648.89]
  - - [4096, 5568, 1, 1024, 4096, 4096, 4096, 1024]
    - [7, 9739.19]
  - - [4096, 2592, 1, 1024, 4096, 4096, 4096, 1024]
    - [8, 10294.3]
  - - [1024, 2592, 1, 4096, 1024, 1024, 1024, 4096]
    - [7, 9154.26]
  - - [1024, 3536, 1, 1024, 1024, 1024, 1024, 1024]
    - [8, 9565.92]
  - - [1024, 3536, 1, 33712, 1024, 1024, 1024, 33712]
    - [8, 9308.7]
  - - [1024, 3536, 1, 4096, 1024, 1024, 1024, 4096]
    - [8, 10004.2]
  - - [1024, 7416, 1, 4096, 1024, 1024, 1024, 4096]
    - [6, 9747.8]
  - - [1024, 6512, 1, 33712, 1024, 1024, 1024, 33712]
    - [19, 10026.5]
  - - [1024, 3672, 1, 33712, 1024, 1024, 1024, 33712]
    - [9, 8343.88]
  - - [4096, 3672, 1, 1024, 4096, 4096, 4096, 1024]
    - [8, 10129.8]
  - - [1024, 2736, 1, 4096, 1024, 1024, 1024, 4096]
    - [6, 8833.34]
  - - [1024, 4736, 1, 4096, 1024, 1024, 1024, 4096]
    - [22, 9026.2]
  - - [4096, 6360, 1, 1024, 4096, 4096, 4096, 1024]
    - [6, 9950.04]
  - - [1024, 3888, 1, 4096, 1024, 1024, 1024, 4096]
    - [22, 8697.83]
  - - [1024, 5424, 1, 33712, 1024, 1024, 1024, 33712]
    - [9, 10737.5]
  - - [4096, 1512, 1, 1024, 4096, 4096, 4096, 1024]
    - [4, 9874.44]
  - - [1024, 1512, 1, 4096, 1024, 1024, 1024, 4096]
    - [1, 8716.96]
  - - [1024, 6384, 1, 33712, 1024, 1024, 1024, 33712]
    - [17, 9820.62]
  - - [1024, 4800, 1, 33712, 1024, 1024, 1024, 33712]
    - [16, 10273.1]
  - - [4096, 1960, 1, 1024, 4096, 4096, 4096, 1024]
    - [0, 10066.6]
  - - [1024, 1960, 1, 4096, 1024, 1024, 1024, 4096]
    - [0, 8102.19]
  - - [1024, 7920, 1, 1024, 1024, 1024, 1024, 1024]
    - [6, 9301.85]
  - - [4096, 2584, 1, 1024, 4096, 4096, 4096, 1024]
    - [8, 10261.7]
  - - [1024, 4816, 1, 33712, 1024, 1024, 1024, 33712]
    - [19, 10028.9]
  - - [1024, 4368, 1, 1024, 1024, 1024, 1024, 1024]
    - [7, 10458.9]
  - - [4096, 4368, 1, 1024, 4096, 4096, 4096, 1024]
    - [8, 9786.25]
  - - [1024, 4368, 1, 4096, 1024, 1024, 1024, 4096]
    - [6, 9165.46]
  - - [1024, 4736, 1, 33712, 1024, 1024, 1024, 33712]
    - [9, 9025.68]
  - - [4096, 3528, 1, 1024, 4096, 4096, 4096, 1024]
    - [8, 9222.12]
  - - [4096, 1144, 1, 1024, 4096, 4096, 4096, 1024]
    - [6, 9470.76]
  - - [4096, 3536, 1, 1024, 4096, 4096, 4096, 1024]
    - [8, 9846.37]
  - - [1024, 7704, 1, 33712, 1024, 1024, 1024, 33712]
    - [16, 9942.51]
  - - [4096, 2352, 1, 1024, 4096, 4096, 4096, 1024]
    - [2, 8468.07]
  - - [1024, 2352, 1, 4096, 1024, 1024, 1024, 4096]
    - [4, 7948.44]
  - - [1024, 7704, 1, 1024, 1024, 1024, 1024, 1024]
    - [7, 9061.96]
  - - [1024, 6720, 1, 33712, 1024, 1024, 1024, 33712]
    - [16, 9814.16]
  - - [4096, 7704, 1, 1024, 4096, 4096, 4096, 1024]
    - [9, 9910.93]
  - - [1024, 4032, 1, 1024, 1024, 1024, 1024, 1024]
    - [0, 9213.4]
  - - [1024, 6760, 1, 4096, 1024, 1024, 1024, 4096]
    - [6, 9659.25]
  - - [1024, 6208, 1, 4096, 1024, 1024, 1024, 4096]
    - [6, 10143.3]
  - - [4096, 3240, 1, 1024, 4096, 4096, 4096, 1024]
    - [7, 9724.56]
  - - [1024, 6576, 1, 4096, 1024, 1024, 1024, 4096]
    - [6, 9798.79]
  - - [1024, 4032, 1, 4096, 1024, 1024, 1024, 4096]
    - [18, 9351.15]
  - - [4096, 7632, 1, 1024, 4096, 4096, 4096, 1024]
    - [7, 9375.24]
  - - [1024, 7104, 1, 1024, 1024, 1024, 1024, 1024]
    - [8, 10542.7]
  - - [4096, 5040, 1, 1024, 4096, 4096, 4096, 1024]
    - [8, 9865.96]
  - - [1024, 1320, 1, 1024, 1024, 1024, 1024, 1024]
    - [16, 9574.68]
  - - [4096, 1320, 1, 1024, 4096, 4096, 4096, 1024]
    - [7, 8992.43]
  - - [1024, 4096, 1, 1024, 1024, 1024, 1024, 1024]
    - [6, 8602.29]
  - - [1024, 6624, 1, 1024, 1024, 1024, 1024, 1024]
    - [8, 9866.11]
  - - [4096, 4096, 1, 1024, 4096, 4096, 4096, 1024]
    - [4, 10340.8]
  - - [1024, 4096, 1, 4096, 1024, 1024, 1024, 4096]
    - [0, 9438.21]
  - - [1024, 5104, 1, 1024, 1024, 1024, 1024, 1024]
    - [4, 9096.94]
  - - [1024, 8000, 1, 4096, 1024, 1024, 1024, 4096]
    - [9, 9570.97]
  - - [1024, 7224, 1, 1024, 1024, 1024, 1024, 1024]
    - [8, 9968.0]
  - - [4096, 2112, 1, 1024, 4096, 4096, 4096, 1024]
    - [8, 9983.7]
  - - [1024, 7072, 1, 33712, 1024, 1024, 1024, 33712]
    - [4, 9245.58]
  - - [4096, 5520, 1, 1024, 4096, 4096, 4096, 1024]
    - [4, 9504.3]
  - - [1024, 6528, 1, 33712, 1024, 1024, 1024, 33712]
    - [8, 10232.1]
  - - [1024, 3864, 1, 1024, 1024, 1024, 1024, 1024]
    - [6, 9913.1]
  - - [4096, 3864, 1, 1024, 4096, 4096, 4096, 1024]
    - [9, 8790.04]
  - - [1024, 3864, 1, 4096, 1024, 1024, 1024, 4096]
    - [16, 9240.29]
  - - [1024, 4480, 1, 1024, 1024, 1024, 1024, 1024]
    - [6, 10082.4]
  - - [4096, 4480, 1, 1024, 4096, 4096, 4096, 1024]
    - [7, 9297.4]
  - - [1024, 6784, 1, 1024, 1024, 1024, 1024, 1024]
    - [22, 9440.37]
  - - [1024, 3952, 1, 4096, 1024, 1024, 1024, 4096]
    - [18, 9174.13]
  - - [1024, 6784, 1, 4096, 1024, 1024, 1024, 4096]
    - [6, 9744.8]
  - - [1024, 2240, 1, 1024, 1024, 1024, 1024, 1024]
    - [16, 9928.98]
  - - [1024, 2880, 1, 33712, 1024, 1024, 1024, 33712]
    - [6, 8874.47]
  - - [4096, 2240, 1, 1024, 4096, 4096, 4096, 1024]
    - [8, 9849.88]
  - - [1024, 8176, 1, 33712, 1024, 1024, 1024, 33712]
    - [6, 9813.94]
  - - [1024, 408, 1, 1024, 1024, 1024, 1024, 1024]
    - [16, 8488.47]
  - - [1024, 4576, 1, 33712, 1024, 1024, 1024, 33712]
    - [9, 9283.71]
  - - [4096, 6976, 1, 1024, 4096, 4096, 4096, 1024]
    - [7, 10110.4]
  - - [1024, 6976, 1, 4096, 1024, 1024, 1024, 4096]
    - [6, 9974.69]
  - - [1024, 5920, 1, 4096, 1024, 1024, 1024, 4096]
    - [16, 9093.97]
  - - [1024, 3072, 1, 1024, 1024, 1024, 1024, 1024]
    - [1, 8999.81]
  - - [1024, 3072, 1, 33712, 1024, 1024, 1024, 33712]
    - [8, 9605.55]
  - - [4096, 3072, 1, 1024, 4096, 4096, 4096, 1024]
    - [8, 9189.29]
  - - [1024, 320, 1, 1024, 1024, 1024, 1024, 1024]
    - [16, 6668.21]
  - - [4096, 2720, 1, 1024, 4096, 4096, 4096, 1024]
    - [0, 10175.9]
  - - [1024, 3040, 1, 4096, 1024, 1024, 1024, 4096]
    - [7, 8648.02]
  - - [1024, 6536, 1, 1024, 1024, 1024, 1024, 1024]
    - [22, 9456.71]
  - - [4096, 6536, 1, 1024, 4096, 4096, 4096, 1024]
    - [6, 9953.04]
  - - [1024, 5040, 1, 1024, 1024, 1024, 1024, 1024]
    - [16, 8844.57]
  - - [1024, 5624, 1, 4096, 1024, 1024, 1024, 4096]
    - [16, 9073.13]
  - - [1024, 3680, 1, 1024, 1024, 1024, 1024, 1024]
    - [8, 9313.44]
  - - [1024, 6432, 1, 4096, 1024, 1024, 1024, 4096]
    - [6, 9590.76]
  - - [4096, 3680, 1, 1024, 4096, 4096, 4096, 1024]
    - [4, 9447.52]
  - - [1024, 5808, 1, 1024, 1024, 1024, 1024, 1024]
    - [22, 8754.18]
  - - [1024, 6112, 1, 1024, 1024, 1024, 1024, 1024]
    - [4, 8700.14]
  - - [1024, 6112, 1, 33712, 1024, 1024, 1024, 33712]
    - [13, 9260.5]
  - - [4096, 6112, 1, 1024, 4096, 4096, 4096, 1024]
    - [6, 9991.69]
  - - [1024, 4432, 1, 4096, 1024, 1024, 1024, 4096]
    - [18, 9231.4]
  - - [1024, 6880, 1, 33712, 1024, 1024, 1024, 33712]
    - [18, 9730.3]
  - - [1024, 5184, 1, 33712, 1024, 1024, 1024, 33712]
    - [9, 10184.0]
  - - [1024, 3040, 1, 1024, 1024, 1024, 1024, 1024]
    - [1, 9514.27]
  - - [1024, 6760, 1, 1024, 1024, 1024, 1024, 1024]
    - [22, 9504.86]
  - - [1024, 6992, 1, 33712, 1024, 1024, 1024, 33712]
    - [9, 9328.89]
  - - [1024, 7552, 1, 1024, 1024, 1024, 1024, 1024]
    - [16, 10064.6]
  - - [1024, 7552, 1, 33712, 1024, 1024, 1024, 33712]
    - [16, 9706.78]
  - - [1024, 6432, 1, 33712, 1024, 1024, 1024, 33712]
    - [16, 9600.96]
  - - [1024, 6160, 1, 1024, 1024, 1024, 1024, 1024]
    - [6, 9972.83]
  - - [1024, 5376, 1, 33712, 1024, 1024, 1024, 33712]
    - [9, 10155.0]
  - - [1024, 6160, 1, 4096, 1024, 1024, 1024, 4096]
    - [5, 9317.41]
  - - [4096, 6528, 1, 1024, 4096, 4096, 4096, 1024]
    - [7, 10098.1]
  - - [1024, 6608, 1, 1024, 1024, 1024, 1024, 1024]
    - [8, 9148.84]
  - - [1024, 7840, 1, 33712, 1024, 1024, 1024, 33712]
    - [6, 9405.91]
  - - [4096, 7008, 1, 1024, 4096, 4096, 4096, 1024]
    - [6, 10227.1]
  - - [1024, 424, 1, 1024, 1024, 1024, 1024, 1024]
    - [16, 8835.29]
  - - [4096, 7224, 1, 1024, 4096, 4096, 4096, 1024]
    - [0, 10185.4]
  - - [4096, 4440, 1, 1024, 4096, 4096, 4096, 1024]
    - [0, 10306.5]
  - - [1024, 7296, 1, 33712, 1024, 1024, 1024, 33712]
    - [8, 9813.94]
  - - [1024, 7104, 1, 4096, 1024, 1024, 1024, 4096]
    - [7, 10148.9]
  - - [4096, 6576, 1, 1024, 4096, 4096, 4096, 1024]
    - [6, 10004.4]
  - - [4096, 6760, 1, 1024, 4096, 4096, 4096, 1024]
    - [6, 9932.11]
  - - [1024, 1144, 1, 1024, 1024, 1024, 1024, 1024]
    - [16, 8452.41]
  - - [1024, 1144, 1, 4096, 1024, 1024, 1024, 4096]
    - [16, 8782.89]
  - - [1024, 7224, 1, 4096, 1024, 1024, 1024, 4096]
    - [8, 10151.6]
  - - [1024, 6144, 1, 4096, 1024, 1024, 1024, 4096]
    - [7, 10040.6]
  - - [4096, 4872, 1, 1024, 4096, 4096, 4096, 1024]
    - [8, 9924.32]
  - - [1024, 4872, 1, 4096, 1024, 1024, 1024, 4096]
    - [1, 9447.85]
  - - [1024, 6000, 1, 1024, 1024, 1024, 1024, 1024]
    - [16, 8926.55]
  - - [4096, 6000, 1, 1024, 4096, 4096, 4096, 1024]
    - [7, 10033.5]
  - - [1024, 6000, 1, 4096, 1024, 1024, 1024, 4096]
    - [6, 9826.68]
  - - [1024, 2560, 1, 33712, 1024, 1024, 1024, 33712]
    - [6, 9439.61]
  - - [1024, 8032, 1, 1024, 1024, 1024, 1024, 1024]
    - [8, 9641.6]
  - - [1024, 5600, 1, 33712, 1024, 1024, 1024, 33712]
    - [8, 10166.9]
  - - [1024, 8032, 1, 33712, 1024, 1024, 1024, 33712]
    - [6, 9647.05]
  - - [4096, 7760, 1, 1024, 4096, 4096, 4096, 1024]
    - [9, 9804.7]
  - - [1024, 6576, 1, 1024, 1024, 1024, 1024, 1024]
    - [0, 9433.36]
  - - [1024, 7416, 1, 1024, 1024, 1024, 1024, 1024]
    - [0, 9669.02]
  - - [4096, 2664, 1, 1024, 4096, 4096, 4096, 1024]
    - [8, 10517.3]
  - - [1024, 4704, 1, 1024, 1024, 1024, 1024, 1024]
    - [16, 8987.76]
  - - [4096, 4704, 1, 1024, 4096, 4096, 4096, 1024]
    - [8, 9597.39]
  - - [4096, 7416, 1, 1024, 4096, 4096, 4096, 1024]
    - [6, 9957.75]
  - - [1024, 1600, 1, 1024, 1024, 1024, 1024, 1024]
    - [6, 8878.69]
  - - [1024, 7632, 1, 4096, 1024, 1024, 1024, 4096]
    - [6, 9068.01]
  - - [1024, 1952, 1, 1024, 1024, 1024, 1024, 1024]
    - [16, 8828.55]
  - - [1024, 6408, 1, 4096, 1024, 1024, 1024, 4096]
    - [7, 9065.37]
  - - [1024, 3888, 1, 1024, 1024, 1024, 1024, 1024]
    - [0, 9423.19]
  - - [1024, 7784, 1, 1024, 1024, 1024, 1024, 1024]
    - [8, 9249.87]
  - - [1024, 7784, 1, 4096, 1024, 1024, 1024, 4096]
    - [0, 9634.19]
  - - [4096, 4320, 1, 1024, 4096, 4096, 4096, 1024]
    - [0, 9653.55]
  - - [1024, 6832, 1, 1024, 1024, 1024, 1024, 1024]
    - [9, 9391.51]
  - - [4096, 7544, 1, 1024, 4096, 4096, 4096, 1024]
    - [9, 9771.03]
  - - [4096, 6832, 1, 1024, 4096, 4096, 4096, 1024]
    - [6, 10007.0]
  - - [1024, 6832, 1, 4096, 1024, 1024, 1024, 4096]
    - [6, 9773.85]
  - - [1024, 3808, 1, 4096, 1024, 1024, 1024, 4096]
    - [18, 9103.47]
  - - [1024, 6264, 1, 4096, 1024, 1024, 1024, 4096]
    - [7, 9515.62]
  - - [1024, 5304, 1, 1024, 1024, 1024, 1024, 1024]
    - [0, 9408.62]
  - - [4096, 5304, 1, 1024, 4096, 4096, 4096, 1024]
    - [8, 9911.65]
  - - [1024, 4872, 1, 33712, 1024, 1024, 1024, 33712]
    - [9, 9789.96]
  - - [4096, 7200, 1, 1024, 4096, 4096, 4096, 1024]
    - [0, 10416.9]
  - - [1024, 5624, 1, 1024, 1024, 1024, 1024, 1024]
    - [0, 9334.51]
  - - [4096, 6216, 1, 1024, 4096, 4096, 4096, 1024]
    - [8, 9303.88]
  - - [1024, 6216, 1, 4096, 1024, 1024, 1024, 4096]
    - [7, 10150.3]
  - - [1024, 4352, 1, 1024, 1024, 1024, 1024, 1024]
    - [16, 9858.68]
  - - [4096, 6256, 1, 1024, 4096, 4096, 4096, 1024]
    - [6, 10228.1]
  - - [1024, 4352, 1, 33712, 1024, 1024, 1024, 33712]
    - [18, 9256.54]
  - - [1024, 5056, 1, 4096, 1024, 1024, 1024, 4096]
    - [1, 9610.93]
  - - [1024, 6192, 1, 33712, 1024, 1024, 1024, 33712]
    - [14, 9487.55]
  - - [1024, 5512, 1, 1024, 1024, 1024, 1024, 1024]
    - [0, 8847.25]
  - - [4096, 5512, 1, 1024, 4096, 4096, 4096, 1024]
    - [8, 9544.75]
  - - [1024, 5832, 1, 33712, 1024, 1024, 1024, 33712]
    - [13, 9610.39]
  - - [1024, 6696, 1, 1024, 1024, 1024, 1024, 1024]
    - [16, 9285.39]
  - - [4096, 6888, 1, 1024, 4096, 4096, 4096, 1024]
    - [8, 9619.31]
  - - [1024, 4928, 1, 1024, 1024, 1024, 1024, 1024]
    - [16, 9193.29]
  - - [1024, 384, 1, 1024, 1024, 1024, 1024, 1024]
    - [16, 7434.51]
  - - [1024, 4928, 1, 4096, 1024, 1024, 1024, 4096]
    - [0, 9626.24]
  - - [1024, 6592, 1, 1024, 1024, 1024, 1024, 1024]
    - [1, 9440.81]
  - - [1024, 2352, 1, 33712, 1024, 1024, 1024, 33712]
    - [7, 8248.73]
  - - [1024, 5576, 1, 4096, 1024, 1024, 1024, 4096]
    - [7, 8935.2]
  - - [4096, 6592, 1, 1024, 4096, 4096, 4096, 1024]
    - [6, 10055.3]
  - - [1024, 6440, 1, 33712, 1024, 1024, 1024, 33712]
    - [9, 9578.22]
  - - [1024, 1512, 1, 1024, 1024, 1024, 1024, 1024]
    - [8, 9213.4]
  - - [1024, 7568, 1, 33712, 1024, 1024, 1024, 33712]
    - [18, 9666.82]
  - - [1024, 4352, 1, 4096, 1024, 1024, 1024, 4096]
    - [6, 9944.62]
  - - [4096, 3520, 1, 1024, 4096, 4096, 4096, 1024]
    - [8, 9812.77]
  - - [1024, 296, 1, 1024, 1024, 1024, 1024, 1024]
    - [10, 5923.25]
  - - [1024, 1600, 1, 4096, 1024, 1024, 1024, 4096]
    - [16, 8673.95]
  - - [1024, 8192, 1, 33712, 1024, 1024, 1024, 33712]
    - [4, 9388.17]
  - - [1024, 6032, 1, 4096, 1024, 1024, 1024, 4096]
    - [4, 9382.58]
  - - [4096, 5056, 1, 1024, 4096, 4096, 4096, 1024]
    - [8, 9864.14]
  - - [1024, 284, 1, 1024, 1024, 1024, 1024, 1024]
    - [10, 6519.17]
  - - [1024, 3200, 1, 33712, 1024, 1024, 1024, 33712]
    - [8, 9468.37]
  - - [1024, 3120, 1, 33712, 1024, 1024, 1024, 33712]
    - [8, 9424.96]
  - - [4096, 3224, 1, 1024, 4096, 4096, 4096, 1024]
    - [7, 9111.63]
  - - [1024, 2720, 1, 33712, 1024, 1024, 1024, 33712]
    - [6, 10233.6]
  - - [1024, 4400, 1, 1024, 1024, 1024, 1024, 1024]
    - [6, 9246.67]
  - - [1024, 952, 1, 1024, 1024, 1024, 1024, 1024]
    - [26, 7525.94]
  - - [4096, 5880, 1, 1024, 4096, 4096, 4096, 1024]
    - [0, 10001.0]
  - - [1024, 508, 1, 1024, 1024, 1024, 1024, 1024]
    - [26, 6625.33]
  - - [1024, 484, 1, 1024, 1024, 1024, 1024, 1024]
    - [10, 6691.86]
  - - [1024, 460, 1, 1024, 1024, 1024, 1024, 1024]
    - [11, 7220.73]
  - - [1024, 456, 1, 1024, 1024, 1024, 1024, 1024]
    - [11, 6982.29]
  - - [1024, 440, 1, 1024, 1024, 1024, 1024, 1024]
    - [17, 9709.04]
  - - [1024, 448, 1, 1024, 1024, 1024, 1024, 1024]
    - [16, 9952.59]
  - - [1024, 416, 1, 1024, 1024, 1024, 1024, 1024]
    - [16, 9226.05]
  - - [1024, 392, 1, 1024, 1024, 1024, 1024, 1024]
    - [16, 8142.67]
  - - [1024, 388, 1, 1024, 1024, 1024, 1024, 1024]
    - [16, 8605.07]
  - - [1024, 380, 1, 1024, 1024, 1024, 1024, 1024]
    - [16, 7918.5]
  - - [1024, 360, 1, 1024, 1024, 1024, 1024, 1024]
    - [16, 7970.59]
  - - [1024, 3456, 1, 1024, 1024, 1024, 1024, 1024]
    - [0, 10052.9]
  - - [1024, 7424, 1, 4096, 1024, 1024, 1024, 4096]
    - [9, 9968.5]
  - - [1024, 7752, 1, 1024, 1024, 1024, 1024, 1024]
    - [8, 9212.68]
  - - [1024, 344, 1, 1024, 1024, 1024, 1024, 1024]
    - [16, 6689.67]
  - - [1024, 6048, 1, 4096, 1024, 1024, 1024, 4096]
    - [0, 9917.99]
  - - [1024, 280, 1, 1024, 1024, 1024, 1024, 1024]
    - [10, 5967.51]
  - - [1024, 264, 1, 1024, 1024, 1024, 1024, 1024]
    - [10, 6146.18]
  - - [4096, 6336, 1, 1024, 4096, 4096, 4096, 1024]
    - [0, 10154.3]
  - - [1024, 5056, 1, 1024, 1024, 1024, 1024, 1024]
    - [8, 9287.99]
  - - [4096, 5824, 1, 1024, 4096, 4096, 4096, 1024]
    - [8, 9422.75]
  - - [1024, 5152, 1, 4096, 1024, 1024, 1024, 4096]
    - [8, 9727.11]
  - - [1024, 5832, 1, 4096, 1024, 1024, 1024, 4096]
    - [0, 10084.9]
  - - [4096, 7392, 1, 1024, 4096, 4096, 4096, 1024]
    - [0, 9739.21]
  - - [1024, 7480, 1, 1024, 1024, 1024, 1024, 1024]
    - [0, 9490.03]
  - - [4096, 8136, 1, 1024, 4096, 4096, 4096, 1024]
    - [9, 9896.04]
  - - [1024, 6256, 1, 4096, 1024, 1024, 1024, 4096]
    - [6, 10105.5]
  - - [1024, 488, 1, 1024, 1024, 1024, 1024, 1024]
    - [27, 6364.49]
  - - [1024, 6216, 1, 1024, 1024, 1024, 1024, 1024]
    - [0, 10223.9]
  - - [1024, 404, 1, 1024, 1024, 1024, 1024, 1024]
    - [16, 8990.24]
  - - [1024, 368, 1, 1024, 1024, 1024, 1024, 1024]
    - [16, 8217.03]
  - - [1024, 336, 1, 1024, 1024, 1024, 1024, 1024]
    - [16, 7541.13]
  - - [1024, 4576, 1, 4096, 1024, 1024, 1024, 4096]
    - [0, 10016.8]
  - - [1024, 7192, 1, 4096, 1024, 1024, 1024, 4096]
    - [0, 9480.94]
  - - [1024, 7072, 1, 4096, 1024, 1024, 1024, 4096]
    - [6, 9715.56]
  - - [1024, 496, 1, 1024, 1024, 1024, 1024, 1024]
    - [10, 6514.2]
  - - [1024, 6808, 1, 33712, 1024, 1024, 1024, 33712]
    - [18, 9836.58]
  - - [1024, 4488, 1, 33712, 1024, 1024, 1024, 33712]
    - [18, 9392.71]
  - - [1024, 8008, 1, 4096, 1024, 1024, 1024, 4096]
    - [7, 9467.34]
  - - [1024, 6808, 1, 1024, 1024, 1024, 1024, 1024]
    - [0, 9467.74]
  - - [1024, 500, 1, 1024, 1024, 1024, 1024, 1024]
    - [10, 6957.11]
  - - [4096, 7616, 1, 1024, 4096, 4096, 4096, 1024]
    - [9, 10457.7]
  - - [1024, 1960, 1, 1024, 1024, 1024, 1024, 1024]
    - [0, 8752.98]
  - - [1024, 7600, 1, 4096, 1024, 1024, 1024, 4096]
    - [0, 9692.23]
  - - [1024, 464, 1, 1024, 1024, 1024, 1024, 1024]
    - [11, 6879.8]
  - - [1024, 444, 1, 1024, 1024, 1024, 1024, 1024]
    - [16, 9830.3]
  - - [1024, 376, 1, 1024, 1024, 1024, 1024, 1024]
    - [17, 8324.84]
  - - [1024, 348, 1, 1024, 1024, 1024, 1024, 1024]
    - [16, 7149.38]
  - - [4096, 7584, 1, 1024, 4096, 4096, 4096, 1024]
    - [9, 10268.8]
  - - [1024, 7872, 1, 4096, 1024, 1024, 1024, 4096]
    - [0, 9711.7]
  - - [1024, 4576, 1, 1024, 1024, 1024, 1024, 1024]
    - [0, 10128.1]
  - - [1024, 276, 1, 1024, 1024, 1024, 1024, 1024]
    - [10, 5930.47]
  - - [1024, 492, 1, 1024, 1024, 1024, 1024, 1024]
    - [10, 6889.68]
  - - [4096, 6432, 1, 1024, 4096, 4096, 4096, 1024]
    - [7, 9992.61]
  - - [1024, 352, 1, 1024, 1024, 1024, 1024, 1024]
    - [16, 6855.47]
  - - [1024, 300, 1, 1024, 1024, 1024, 1024, 1024]
    - [10, 6886.44]
  - - [1024, 6608, 1, 4096, 1024, 1024, 1024, 4096]
    - [0, 10230.3]
  - - [1024, 7344, 1, 1024, 1024, 1024, 1024, 1024]
    - [8, 10037.4]
  - - [1024, 10752, 1, 1024, 1024, 1024, 1024, 1024]
    - [8, 10782.6]
  - - [4096, 6944, 1, 1024, 4096, 4096, 4096, 1024]
    - [7, 9366.44]
  - - [1024, 11776, 1, 1024, 1024, 1024, 1024, 1024]
    - [6, 10978.7]
  - - [1024, 424, 1, 4096, 1024, 1024, 1024, 4096]
    - [16, 10325.0]
  - - [1024, 224, 1, 1024, 1024, 1024, 1024, 1024]
    - [11, 7007.19]
  - - [1024, 216, 1, 1024, 1024, 1024, 1024, 1024]
    - [27, 7450.41]
  - - [1024, 248, 1, 1024, 1024, 1024, 1024, 1024]
    - [10, 5753.25]
  - - [1024, 240, 1, 1024, 1024, 1024, 1024, 1024]
    - [10, 5587.44]
  - - [1024, 244, 1, 1024, 1024, 1024, 1024, 1024]
    - [10, 5660.45]
  - - [1024, 212, 1, 1024, 1024, 1024, 1024, 1024]
    - [27, 7052.6]
  - - [1024, 256, 1, 1024, 1024, 1024, 1024, 1024]
    - [10, 5959.93]
  - - [1024, 252, 1, 1024, 1024, 1024, 1024, 1024]
    - [11, 5825.42]
  - - [1024, 236, 1, 1024, 1024, 1024, 1024, 1024]
    - [11, 5553.5]
  - - [1024, 208, 1, 1024, 1024, 1024, 1024, 1024]
    - [12, 6649.51]
  - - [1024, 228, 1, 1024, 1024, 1024, 1024, 1024]
    - [11, 5355.63]
  - - [1024, 232, 1, 1024, 1024, 1024, 1024, 1024]
    - [11, 5430.13]
  - - [1024, 220, 1, 1024, 1024, 1024, 1024, 1024]
    - [27, 7648.76]
  - - [1024, 88, 1, 1024, 1024, 1024, 1024, 1024]
    - [24, 4164.02]
  - - [1024, 120, 1, 1024, 1024, 1024, 1024, 1024]
    - [27, 4418.16]
  - - [1024, 60, 1, 1024, 1024, 1024, 1024, 1024]
    - [24, 3183.94]
  - - [1024, 80, 1, 1024, 1024, 1024, 1024, 1024]
    - [24, 4096.0]
  - - [1024, 112, 1, 1024, 1024, 1024, 1024, 1024]
    - [24, 4158.66]
  - - [1024, 128, 1, 1024, 1024, 1024, 1024, 1024]
    - [25, 4766.25]
  - - [1024, 140, 1, 1024, 1024, 1024, 1024, 1024]
    - [27, 5097.24]
  - - [1024, 156, 1, 1024, 1024, 1024, 1024, 1024]
    - [27, 5679.79]
  - - [1024, 136, 1, 1024, 1024, 1024, 1024, 1024]
    - [25, 5035.53]
  - - [1024, 180, 1, 1024, 1024, 1024, 1024, 1024]
    - [26, 6208.67]
  - - [1024, 148, 1, 1024, 1024, 1024, 1024, 1024]
    - [27, 5403.53]
  - - [1024, 100, 1, 1024, 1024, 1024, 1024, 1024]
    - [25, 3713.09]
  - - [1024, 204, 1, 1024, 1024, 1024, 1024, 1024]
    - [27, 6909.22]
  - - [1024, 176, 1, 1024, 1024, 1024, 1024, 1024]
    - [11, 5796.15]
  - - [1024, 76, 1, 1024, 1024, 1024, 1024, 1024]
    - [25, 3906.46]
  - - [1024, 92, 1, 1024, 1024, 1024, 1024, 1024]
    - [24, 4710.4]
  - - [1024, 192, 1, 1024, 1024, 1024, 1024, 1024]
    - [27, 6857.17]
  - - [1024, 84, 1, 1024, 1024, 1024, 1024, 1024]
    - [25, 4317.67]
  - - [1024, 144, 1, 1024, 1024, 1024, 1024, 1024]
    - [25, 5301.79]
  - - [1024, 68, 1, 1024, 1024, 1024, 1024, 1024]
    - [24, 3454.61]
  - - [1024, 200, 1, 1024, 1024, 1024, 1024, 1024]
    - [27, 6971.91]
  - - [1024, 132, 1, 1024, 1024, 1024, 1024, 1024]
    - [27, 4873.66]
  - - [1024, 152, 1, 1024, 1024, 1024, 1024, 1024]
    - [24, 5518.82]
  - - [1024, 164, 1, 1024, 1024, 1024, 1024, 1024]
    - [27, 5954.52]
  - - [1024, 196, 1, 1024, 1024, 1024, 1024, 1024]
    - [27, 6536.92]
  - - [1024, 188, 1, 1024, 1024, 1024, 1024, 1024]
    - [27, 6588.65]
  - - [1024, 184, 1, 1024, 1024, 1024, 1024, 1024]
    - [27, 6215.79]
  - - [1024, 172, 1, 1024, 1024, 1024, 1024, 1024]
    - [27, 6227.73]
  - - [1024, 160, 1, 1024, 1024, 1024, 1024, 1024]
    - [25, 5841.65]
  - - [1024, 124, 1, 1024, 1024, 1024, 1024, 1024]
    - [26, 4591.22]
  - - [1024, 116, 1, 1024, 1024, 1024, 1024, 1024]
    - [26, 4295.01]
  - - [1024, 108, 1, 1024, 1024, 1024, 1024, 1024]
    - [25, 4032.98]
  - - [1024, 104, 1, 1024, 1024, 1024, 1024, 1024]
    - [26, 3872.58]
  - - [1024, 96, 1, 1024, 1024, 1024, 1024, 1024]
    - [25, 4934.48]
  - - [1024, 72, 1, 1024, 1024, 1024, 1024, 1024]
    - [24, 3700.86]
  - - [1024, 56, 1, 1024, 1024, 1024, 1024, 1024]
    - [25, 2878.44]
  - - [1024, 168, 1, 1024, 1024, 1024, 1024, 1024]
    - [27, 6000.03]
- null
