Tensile/Configs/miopen/archives/transformer/2020-08-31/exact/vega20_Cijk_Alik_Bljk_SB.yaml
- {MinimumRequiredVersion: 4.22.0}
- vega20
- gfx906
- [Device 66a0, Device 66a1, Device 66a7, Device 66af, Vega 20]
    SolutionIndex: 0
    SolutionNameMin: Cijk_Alik_Bljk_SB_MT64x64x16_SE_GRVW4_GSU1_LRVW4_TT4_4_VW4_WG16_16_1_WGM1
    SolutionIndex: 1
    SolutionNameMin: Cijk_Alik_Bljk_SB_MT64x64x16_SE_GRVW4_GSU1_LRVW4_TT4_4_VW4_WG16_16_1_WGM8
    SolutionIndex: 2
    SolutionNameMin: Cijk_Alik_Bljk_SB_MT64x96x16_SE_GRVW2_GSU1_LRVW2_TT4_6_VW2_WG16_16_1_WGM1
    SolutionIndex: 3
    SolutionNameMin: Cijk_Alik_Bljk_SB_MT64x96x16_SE_GRVW2_GSU1_LRVW2_TT4_6_VW2_WG16_16_1_WGM8
    SolutionIndex: 4
    SolutionNameMin: Cijk_Alik_Bljk_SB_MT64x128x16_SE_GRVW4_GSU1_LRVW4_TT4_8_VW4_WG16_16_1_WGM1
    SolutionIndex: 5
    SolutionNameMin: Cijk_Alik_Bljk_SB_MT64x128x16_SE_GRVW4_GSU1_LRVW4_TT4_8_VW4_WG16_16_1_WGM8
    SolutionIndex: 6
    SolutionNameMin: Cijk_Alik_Bljk_SB_MT128x64x16_SE_GRVW4_GSU1_LRVW4_TT8_4_VW4_WG16_16_1_WGM1
    SolutionIndex: 7
    SolutionNameMin: Cijk_Alik_Bljk_SB_MT128x64x16_SE_GRVW4_GSU1_LRVW4_TT8_4_VW4_WG16_16_1_WGM8
    SolutionIndex: 8
    SolutionNameMin: Cijk_Alik_Bljk_SB_MT128x128x16_SE_GRVW4_GSU1_LRVW4_TT8_8_VW4_WG16_16_1_WGM1
    SolutionIndex: 9
    SolutionNameMin: Cijk_Alik_Bljk_SB_MT128x128x16_SE_GRVW4_GSU1_LRVW4_TT8_8_VW4_WG16_16_1_WGM8
    SolutionIndex: 10
    SolutionNameMin: Cijk_Alik_Bljk_SB_MT64x32x16_SE_GRVW4_GSU1_LRVW4_TT4_4_VW4_WG16_8_2_WGM1
    SolutionIndex: 11
    SolutionNameMin: Cijk_Alik_Bljk_SB_MT64x32x16_SE_GRVW4_GSU1_LRVW4_TT4_4_VW4_WG16_8_2_WGM8
    SolutionIndex: 12
    SolutionNameMin: Cijk_Alik_Bljk_SB_MT64x64x16_SE_GRVW4_GSU1_LRVW4_TT4_8_VW4_WG16_8_2_WGM1
    SolutionIndex: 13
    SolutionNameMin: Cijk_Alik_Bljk_SB_MT64x64x16_SE_GRVW4_GSU1_LRVW4_TT4_8_VW4_WG16_8_2_WGM8
    SolutionIndex: 14
    SolutionNameMin: Cijk_Alik_Bljk_SB_MT64x64x32_SE_GRVW4_GSU1_LRVW4_TT4_8_VW4_WG16_8_2_WGM1
    SolutionIndex: 15
    SolutionNameMin: Cijk_Alik_Bljk_SB_MT128x32x16_SE_GRVW4_GSU1_LRVW4_TT8_4_VW4_WG16_8_2_WGM1
    SolutionIndex: 16
    SolutionNameMin: Cijk_Alik_Bljk_SB_MT128x32x16_SE_GRVW4_GSU1_LRVW4_TT8_4_VW4_WG16_8_2_WGM8
    SolutionIndex: 17
    SolutionNameMin: Cijk_Alik_Bljk_SB_MT32x64x16_SE_GRVW4_GSU1_LRVW4_TT4_4_VW4_WG8_16_2_WGM1
    SolutionIndex: 18
    SolutionNameMin: Cijk_Alik_Bljk_SB_MT32x64x16_SE_GRVW4_GSU1_LRVW4_TT4_4_VW4_WG8_16_2_WGM8
    SolutionIndex: 19
    SolutionNameMin: Cijk_Alik_Bljk_SB_MT32x128x16_SE_GRVW4_GSU1_LRVW4_TT4_8_VW4_WG8_16_2_WGM1
    SolutionIndex: 20
    SolutionNameMin: Cijk_Alik_Bljk_SB_MT64x64x16_SE_GRVW4_GSU1_LRVW4_TT8_4_VW4_WG8_16_2_WGM1
    SolutionIndex: 21
    SolutionNameMin: Cijk_Alik_Bljk_SB_MT64x64x16_SE_GRVW4_GSU1_LRVW4_TT8_4_VW4_WG8_16_2_WGM8
    SolutionIndex: 22
    SolutionNameMin: Cijk_Alik_Bljk_SB_MT32x32x24_SE_GRVW4_GSU1_LRVW4_TT4_4_VW4_WG8_8_4_WGM1
    SolutionIndex: 23
    SolutionNameMin: Cijk_Alik_Bljk_SB_MT32x32x24_SE_GRVW4_GSU1_LRVW4_TT4_4_VW4_WG8_8_4_WGM8
    SolutionIndex: 24
    SolutionNameMin: Cijk_Alik_Bljk_SB_MT32x32x32_SE_GRVW4_GSU1_LRVW4_TT4_4_VW4_WG8_8_4_WGM1
    SolutionIndex: 25
    SolutionNameMin: Cijk_Alik_Bljk_SB_MT32x32x32_SE_GRVW4_GSU1_LRVW4_TT4_4_VW4_WG8_8_4_WGM8
    SolutionIndex: 26
    SolutionNameMin: Cijk_Alik_Bljk_SB_MT32x48x16_SE_GRVW2_GSU1_LRVW2_TT4_6_VW2_WG8_8_4_WGM8
    SolutionIndex: 27
    SolutionNameMin: Cijk_Alik_Bljk_SB_MT32x64x16_SE_GRVW4_GSU1_LRVW4_TT4_8_VW4_WG8_8_4_WGM1
    SolutionIndex: 28
    SolutionNameMin: Cijk_Alik_Bljk_SB_MT32x64x16_SE_GRVW4_GSU1_LRVW4_TT4_8_VW4_WG8_8_4_WGM8
    SolutionIndex: 29
    SolutionNameMin: Cijk_Alik_Bljk_SB_MT32x64x32_SE_GRVW4_GSU1_LRVW4_TT4_8_VW4_WG8_8_4_WGM8
    SolutionIndex: 30
    SolutionNameMin: Cijk_Alik_Bljk_SB_MT64x32x16_SE_GRVW4_GSU1_LRVW4_TT8_4_VW4_WG8_8_4_WGM8
    SolutionIndex: 31
    SolutionNameMin: Cijk_Alik_Bljk_SB_MT64x32x32_SE_GRVW4_GSU1_LRVW4_TT8_4_VW4_WG8_8_4_WGM1
    SolutionIndex: 32
    SolutionNameMin: Cijk_Alik_Bljk_SB_MT64x32x32_SE_GRVW4_GSU1_LRVW4_TT8_4_VW4_WG8_8_4_WGM8
- - - [1024, 26656, 1, 4096, 1024, 1024, 4096, 4096]
    - [8, 11150.6]
  - - [4096, 26656, 1, 1024, 4096, 4096, 1024, 1024]
    - [8, 11700.7]
  - - [1024, 26656, 1, 1024, 1024, 1024, 1024, 1024]
    - [8, 11413.0]
  - - [1024, 33792, 1, 4096, 1024, 1024, 4096, 4096]
    - [8, 11253.8]
  - - [4096, 33792, 1, 1024, 4096, 4096, 1024, 1024]
    - [8, 11776.4]
  - - [1024, 33792, 1, 1024, 1024, 1024, 1024, 1024]
    - [8, 11399.0]
  - - [1024, 26624, 1, 4096, 1024, 1024, 4096, 4096]
    - [8, 11194.1]
  - - [4096, 26624, 1, 1024, 4096, 4096, 1024, 1024]
    - [8, 11818.0]
  - - [1024, 23040, 1, 1024, 1024, 1024, 1024, 1024]
    - [8, 11332.2]
  - - [1024, 20480, 1, 4096, 1024, 1024, 4096, 4096]
    - [8, 10923.5]
  - - [4096, 20480, 1, 1024, 4096, 4096, 1024, 1024]
    - [8, 11730.3]
  - - [1024, 20480, 1, 1024, 1024, 1024, 1024, 1024]
    - [8, 11176.0]
  - - [1024, 18944, 1, 4096, 1024, 1024, 4096, 4096]
    - [8, 10887.3]
  - - [1024, 18944, 1, 1024, 1024, 1024, 1024, 1024]
    - [8, 11063.7]
  - - [1024, 17408, 1, 4096, 1024, 1024, 4096, 4096]
    - [8, 10882.8]
  - - [1024, 17408, 1, 1024, 1024, 1024, 1024, 1024]
    - [8, 11129.2]
  - - [1024, 16384, 1, 4096, 1024, 1024, 4096, 4096]
    - [8, 11252.8]
  - - [4096, 16384, 1, 1024, 4096, 4096, 1024, 1024]
    - [8, 11712.0]
  - - [4096, 15360, 1, 1024, 4096, 4096, 1024, 1024]
    - [8, 11647.5]
  - - [1024, 15360, 1, 1024, 1024, 1024, 1024, 1024]
    - [8, 10950.0]
  - - [1024, 14336, 1, 4096, 1024, 1024, 4096, 4096]
    - [8, 11029.9]
  - - [4096, 14336, 1, 1024, 4096, 4096, 1024, 1024]
    - [8, 11539.1]
  - - [1024, 14336, 1, 1024, 1024, 1024, 1024, 1024]
    - [8, 11451.3]
  - - [1024, 13312, 1, 4096, 1024, 1024, 4096, 4096]
    - [8, 10793.2]
  - - [4096, 13312, 1, 1024, 4096, 4096, 1024, 1024]
    - [8, 11772.1]
  - - [33712, 312, 1, 1024, 33712, 33712, 1024, 1024]
    - [6, 9434.65]
  - - [1024, 12800, 1, 1024, 1024, 1024, 1024, 1024]
    - [8, 11556.2]
  - - [1024, 11776, 1, 4096, 1024, 1024, 4096, 4096]
    - [8, 10516.7]
  - - [1024, 6784, 1, 4096, 1024, 1024, 4096, 4096]
    - [8, 10792.5]
  - - [33712, 5616, 1, 1024, 33712, 33712, 1024, 1024]
    - [8, 11776.5]
  - - [1024, 7688, 1, 4096, 1024, 1024, 4096, 4096]
    - [8, 9769.81]
  - - [33712, 5424, 1, 1024, 33712, 33712, 1024, 1024]
    - [8, 11536.1]
  - - [4096, 5664, 1, 1024, 4096, 4096, 1024, 1024]
    - [8, 11150.0]
  - - [1024, 5664, 1, 1024, 1024, 1024, 1024, 1024]
    - [8, 9790.22]
  - - [1024, 2160, 1, 4096, 1024, 1024, 4096, 4096]
    - [20, 8846.68]
  - - [1024, 7080, 1, 1024, 1024, 1024, 1024, 1024]
    - [8, 11213.0]
  - - [33712, 7760, 1, 1024, 33712, 33712, 1024, 1024]
    - [8, 11528.6]
  - - [33712, 300, 1, 1024, 33712, 33712, 1024, 1024]
    - [6, 9090.88]
  - - [4096, 2880, 1, 1024, 4096, 4096, 1024, 1024]
    - [8, 10419.9]
  - - [1024, 6344, 1, 1024, 1024, 1024, 1024, 1024]
    - [8, 10051.0]
  - - [4096, 4176, 1, 1024, 4096, 4096, 1024, 1024]
    - [8, 10937.3]
  - - [4096, 6120, 1, 1024, 4096, 4096, 1024, 1024]
    - [8, 10393.7]
  - - [4096, 6080, 1, 1024, 4096, 4096, 1024, 1024]
    - [8, 11074.9]
  - - [1024, 7216, 1, 4096, 1024, 1024, 4096, 4096]
    - [8, 10781.9]
  - - [1024, 5712, 1, 4096, 1024, 1024, 4096, 4096]
    - [0, 9200.14]
  - - [1024, 3960, 1, 4096, 1024, 1024, 4096, 4096]
    - [0, 8831.06]
  - - [1024, 4864, 1, 4096, 1024, 1024, 4096, 4096]
    - [8, 9569.72]
  - - [4096, 6760, 1, 1024, 4096, 4096, 1024, 1024]
    - [8, 10756.9]
  - - [33712, 4480, 1, 1024, 33712, 33712, 1024, 1024]
    - [8, 11291.0]
  - - [1024, 7232, 1, 4096, 1024, 1024, 4096, 4096]
    - [8, 10524.5]
  - - [1024, 7232, 1, 1024, 1024, 1024, 1024, 1024]
    - [8, 11380.9]
  - - [4096, 3128, 1, 1024, 4096, 4096, 1024, 1024]
    - [8, 10569.6]
  - - [1024, 8136, 1, 4096, 1024, 1024, 4096, 4096]
    - [9, 9927.18]
  - - [33712, 6192, 1, 1024, 33712, 33712, 1024, 1024]
    - [8, 10705.4]
  - - [1024, 3584, 1, 4096, 1024, 1024, 4096, 4096]
    - [8, 10535.7]
  - - [4096, 4816, 1, 1024, 4096, 4096, 1024, 1024]
    - [8, 10335.1]
  - - [4096, 3584, 1, 1024, 4096, 4096, 1024, 1024]
    - [8, 10624.5]
  - - [1024, 2720, 1, 1024, 1024, 1024, 1024, 1024]
    - [0, 9021.15]
  - - [1024, 6384, 1, 4096, 1024, 1024, 4096, 4096]
    - [8, 9483.09]
  - - [4096, 6384, 1, 1024, 4096, 4096, 1024, 1024]
    - [8, 10845.9]
  - - [33712, 7200, 1, 1024, 33712, 33712, 1024, 1024]
    - [8, 10832.6]
  - - [33712, 6208, 1, 1024, 33712, 33712, 1024, 1024]
    - [8, 10401.9]
  - - [4096, 5808, 1, 1024, 4096, 4096, 1024, 1024]
    - [8, 10618.1]
  - - [33712, 7584, 1, 1024, 33712, 33712, 1024, 1024]
    - [8, 10829.3]
  - - [1024, 2600, 1, 4096, 1024, 1024, 4096, 4096]
    - [4, 9079.19]
  - - [4096, 7192, 1, 1024, 4096, 4096, 1024, 1024]
    - [8, 10725.0]
  - - [33712, 6200, 1, 1024, 33712, 33712, 1024, 1024]
    - [8, 10276.0]
  - - [4096, 6200, 1, 1024, 4096, 4096, 1024, 1024]
    - [9, 9943.37]
  - - [1024, 312, 1, 1024, 1024, 1024, 1024, 1024]
    - [17, 5943.96]
  - - [1024, 6200, 1, 1024, 1024, 1024, 1024, 1024]
    - [0, 9381.74]
  - - [1024, 1600, 1, 1024, 1024, 1024, 1024, 1024]
    - [8, 8556.31]
  - - [1024, 1248, 1, 4096, 1024, 1024, 4096, 4096]
    - [20, 8255.25]
  - - [4096, 1248, 1, 1024, 4096, 4096, 1024, 1024]
    - [8, 9520.03]
  - - [1024, 7808, 1, 4096, 1024, 1024, 4096, 4096]
    - [9, 9320.89]
  - - [4096, 304, 1, 1024, 4096, 4096, 1024, 1024]
    - [12, 7941.38]
  - - [4096, 288, 1, 1024, 4096, 4096, 1024, 1024]
    - [13, 7599.14]
  - - [33712, 7400, 1, 1024, 33712, 33712, 1024, 1024]
    - [8, 10869.4]
  - - [1024, 7400, 1, 1024, 1024, 1024, 1024, 1024]
    - [8, 9979.76]
  - - [1024, 6360, 1, 4096, 1024, 1024, 4096, 4096]
    - [0, 9044.11]
  - - [1024, 6192, 1, 4096, 1024, 1024, 4096, 4096]
    - [6, 9044.39]
  - - [4096, 6696, 1, 1024, 4096, 4096, 1024, 1024]
    - [8, 10541.5]
  - - [1024, 7392, 1, 1024, 1024, 1024, 1024, 1024]
    - [8, 9977.18]
  - - [1024, 6728, 1, 1024, 1024, 1024, 1024, 1024]
    - [8, 9935.25]
  - - [1024, 6264, 1, 1024, 1024, 1024, 1024, 1024]
    - [8, 9154.14]
  - - [1024, 7104, 1, 4096, 1024, 1024, 4096, 4096]
    - [9, 10157.5]
  - - [1024, 7000, 1, 4096, 1024, 1024, 4096, 4096]
    - [8, 10132.6]
  - - [1024, 5280, 1, 1024, 1024, 1024, 1024, 1024]
    - [8, 10289.3]
  - - [1024, 8184, 1, 1024, 1024, 1024, 1024, 1024]
    - [8, 10282.7]
  - - [33712, 352, 1, 1024, 33712, 33712, 1024, 1024]
    - [5, 9183.92]
  - - [4096, 6880, 1, 1024, 4096, 4096, 1024, 1024]
    - [8, 10052.7]
  - - [1024, 6880, 1, 1024, 1024, 1024, 1024, 1024]
    - [8, 10116.4]
  - - [33712, 7744, 1, 1024, 33712, 33712, 1024, 1024]
    - [8, 10901.1]
  - - [4096, 7000, 1, 1024, 4096, 4096, 1024, 1024]
    - [8, 10451.7]
  - - [4096, 7520, 1, 1024, 4096, 4096, 1024, 1024]
    - [8, 10260.1]
  - - [1024, 3696, 1, 1024, 1024, 1024, 1024, 1024]
    - [8, 9816.46]
  - - [33712, 6256, 1, 1024, 33712, 33712, 1024, 1024]
    - [8, 10191.4]
  - - [1024, 7480, 1, 4096, 1024, 1024, 4096, 4096]
    - [9, 8983.75]
  - - [1024, 3536, 1, 4096, 1024, 1024, 4096, 4096]
    - [8, 9818.77]
  - - [1024, 5520, 1, 1024, 1024, 1024, 1024, 1024]
    - [0, 8708.68]
  - - [1024, 4200, 1, 1024, 1024, 1024, 1024, 1024]
    - [0, 8436.82]
  - - [1024, 3168, 1, 4096, 1024, 1024, 4096, 4096]
    - [8, 8900.62]
  - - [4096, 5520, 1, 1024, 4096, 4096, 1024, 1024]
    - [6, 9652.37]
  - - [4096, 3808, 1, 1024, 4096, 4096, 1024, 1024]
    - [8, 10036.6]
  - - [1024, 4096, 1, 1024, 1024, 1024, 1024, 1024]
    - [0, 9224.59]
  - - [1024, 7168, 1, 4096, 1024, 1024, 4096, 4096]
    - [9, 10602.9]
  - - [4096, 7872, 1, 1024, 4096, 4096, 1024, 1024]
    - [8, 10457.3]
  - - [4096, 4680, 1, 1024, 4096, 4096, 1024, 1024]
    - [8, 10120.3]
  - - [1024, 7208, 1, 4096, 1024, 1024, 4096, 4096]
    - [9, 10376.4]
  - - [4096, 7208, 1, 1024, 4096, 4096, 1024, 1024]
    - [8, 10597.5]
  - - [1024, 1512, 1, 4096, 1024, 1024, 4096, 4096]
    - [8, 9115.95]
  - - [4096, 3040, 1, 1024, 4096, 4096, 1024, 1024]
    - [8, 9568.56]
  - - [33712, 6656, 1, 1024, 33712, 33712, 1024, 1024]
    - [8, 9844.68]
  - - [4096, 3528, 1, 1024, 4096, 4096, 1024, 1024]
    - [8, 9682.71]
  - - [1024, 5680, 1, 4096, 1024, 1024, 4096, 4096]
    - [0, 9141.84]
  - - [1024, 5472, 1, 1024, 1024, 1024, 1024, 1024]
    - [8, 10592.6]
  - - [1024, 3600, 1, 4096, 1024, 1024, 4096, 4096]
    - [8, 8902.58]
  - - [4096, 3600, 1, 1024, 4096, 4096, 1024, 1024]
    - [6, 9571.67]
  - - [33712, 7424, 1, 1024, 33712, 33712, 1024, 1024]
    - [8, 10750.4]
  - - [1024, 3600, 1, 1024, 1024, 1024, 1024, 1024]
    - [8, 10275.7]
  - - [33712, 8120, 1, 1024, 33712, 33712, 1024, 1024]
    - [8, 10757.4]
  - - [1024, 7904, 1, 4096, 1024, 1024, 4096, 4096]
    - [4, 9643.42]
  - - [4096, 336, 1, 1024, 4096, 4096, 1024, 1024]
    - [9, 7258.38]
  - - [1024, 8040, 1, 4096, 1024, 1024, 4096, 4096]
    - [9, 9547.62]
  - - [4096, 8040, 1, 1024, 4096, 4096, 1024, 1024]
    - [8, 10628.0]
  - - [4096, 7440, 1, 1024, 4096, 4096, 1024, 1024]
    - [8, 10454.3]
  - - [4096, 7848, 1, 1024, 4096, 4096, 1024, 1024]
    - [8, 9704.5]
  - - [33712, 248, 1, 1024, 33712, 33712, 1024, 1024]
    - [9, 9131.0]
  - - [1024, 2520, 1, 1024, 1024, 1024, 1024, 1024]
    - [6, 8742.76]
  - - [4096, 6936, 1, 1024, 4096, 4096, 1024, 1024]
    - [8, 10364.1]
  - - [1024, 6936, 1, 1024, 1024, 1024, 1024, 1024]
    - [8, 10252.8]
  - - [4096, 6688, 1, 1024, 4096, 4096, 1024, 1024]
    - [8, 10285.2]
  - - [4096, 420, 1, 1024, 4096, 4096, 1024, 1024]
    - [7, 8363.12]
  - - [1024, 5152, 1, 1024, 1024, 1024, 1024, 1024]
    - [8, 10077.3]
  - - [4096, 7688, 1, 1024, 4096, 4096, 1024, 1024]
    - [8, 10797.8]
  - - [4096, 3168, 1, 1024, 4096, 4096, 1024, 1024]
    - [4, 9525.95]
  - - [1024, 5616, 1, 4096, 1024, 1024, 4096, 4096]
    - [0, 8928.65]
  - - [4096, 5616, 1, 1024, 4096, 4096, 1024, 1024]
    - [6, 9235.02]
  - - [4096, 8160, 1, 1024, 4096, 4096, 1024, 1024]
    - [8, 10797.5]
  - - [33712, 4736, 1, 1024, 33712, 33712, 1024, 1024]
    - [8, 11263.7]
  - - [33712, 7040, 1, 1024, 33712, 33712, 1024, 1024]
    - [8, 11008.4]
  - - [33712, 6800, 1, 1024, 33712, 33712, 1024, 1024]
    - [8, 9656.63]
  - - [4096, 428, 1, 1024, 4096, 4096, 1024, 1024]
    - [6, 8925.83]
  - - [1024, 8008, 1, 1024, 1024, 1024, 1024, 1024]
    - [4, 9057.86]
  - - [1024, 5424, 1, 4096, 1024, 1024, 4096, 4096]
    - [9, 9593.61]
  - - [1024, 2664, 1, 1024, 1024, 1024, 1024, 1024]
    - [4, 9648.41]
  - - [1024, 5336, 1, 4096, 1024, 1024, 4096, 4096]
    - [6, 8960.92]
  - - [4096, 6160, 1, 1024, 4096, 4096, 1024, 1024]
    - [8, 9769.54]
  - - [4096, 4704, 1, 1024, 4096, 4096, 1024, 1024]
    - [8, 10178.5]
  - - [33712, 6600, 1, 1024, 33712, 33712, 1024, 1024]
    - [8, 9782.5]
  - - [1024, 6600, 1, 4096, 1024, 1024, 4096, 4096]
    - [9, 8921.06]
  - - [4096, 6600, 1, 1024, 4096, 4096, 1024, 1024]
    - [8, 10127.6]
  - - [1024, 6600, 1, 1024, 1024, 1024, 1024, 1024]
    - [8, 9083.11]
  - - [33712, 7888, 1, 1024, 33712, 33712, 1024, 1024]
    - [8, 10807.0]
  - - [4096, 2976, 1, 1024, 4096, 4096, 1024, 1024]
    - [8, 10033.3]
  - - [1024, 2240, 1, 4096, 1024, 1024, 4096, 4096]
    - [0, 8396.4]
  - - [33712, 6720, 1, 1024, 33712, 33712, 1024, 1024]
    - [8, 9622.76]
  - - [1024, 7200, 1, 1024, 1024, 1024, 1024, 1024]
    - [8, 9748.15]
  - - [1024, 4096, 1, 4096, 1024, 1024, 4096, 4096]
    - [0, 8649.79]
  - - [4096, 5952, 1, 1024, 4096, 4096, 1024, 1024]
    - [6, 9311.22]
  - - [4096, 6264, 1, 1024, 4096, 4096, 1024, 1024]
    - [9, 10213.5]
  - - [1024, 7744, 1, 4096, 1024, 1024, 4096, 4096]
    - [9, 9120.71]
  - - [1024, 7744, 1, 1024, 1024, 1024, 1024, 1024]
    - [9, 9121.32]
  - - [1024, 3904, 1, 1024, 1024, 1024, 1024, 1024]
    - [0, 8693.6]
  - - [1024, 8032, 1, 4096, 1024, 1024, 4096, 4096]
    - [8, 9182.67]
  - - [4096, 5208, 1, 1024, 4096, 4096, 1024, 1024]
    - [6, 9726.39]
  - - [33712, 6432, 1, 1024, 33712, 33712, 1024, 1024]
    - [8, 9543.91]
  - - [33712, 8024, 1, 1024, 33712, 33712, 1024, 1024]
    - [8, 10751.8]
  - - [1024, 3264, 1, 1024, 1024, 1024, 1024, 1024]
    - [8, 10145.1]
  - - [33712, 6440, 1, 1024, 33712, 33712, 1024, 1024]
    - [8, 9759.11]
  - - [1024, 4608, 1, 1024, 1024, 1024, 1024, 1024]
    - [8, 9041.61]
  - - [33712, 7488, 1, 1024, 33712, 33712, 1024, 1024]
    - [8, 10607.6]
  - - [1024, 7488, 1, 4096, 1024, 1024, 4096, 4096]
    - [0, 9081.35]
  - - [1024, 7488, 1, 1024, 1024, 1024, 1024, 1024]
    - [8, 9491.02]
  - - [1024, 8128, 1, 4096, 1024, 1024, 4096, 4096]
    - [8, 9427.69]
  - - [1024, 5280, 1, 4096, 1024, 1024, 4096, 4096]
    - [8, 9631.67]
  - - [33712, 6808, 1, 1024, 33712, 33712, 1024, 1024]
    - [8, 9601.12]
  - - [33712, 308, 1, 1024, 33712, 33712, 1024, 1024]
    - [9, 8505.45]
  - - [1024, 6720, 1, 4096, 1024, 1024, 4096, 4096]
    - [9, 9583.58]
  - - [1024, 7224, 1, 4096, 1024, 1024, 4096, 4096]
    - [8, 10322.0]
  - - [4096, 480, 1, 1024, 4096, 4096, 1024, 1024]
    - [0, 7800.94]
  - - [1024, 4144, 1, 4096, 1024, 1024, 4096, 4096]
    - [4, 8710.1]
  - - [4096, 4144, 1, 1024, 4096, 4096, 1024, 1024]
    - [8, 9489.62]
  - - [1024, 4144, 1, 1024, 1024, 1024, 1024, 1024]
    - [0, 8711.51]
  - - [33712, 5888, 1, 1024, 33712, 33712, 1024, 1024]
    - [8, 10824.3]
  - - [1024, 2880, 1, 4096, 1024, 1024, 4096, 4096]
    - [8, 8574.87]
  - - [1024, 2560, 1, 4096, 1024, 1024, 4096, 4096]
    - [6, 8740.97]
  - - [4096, 2560, 1, 1024, 4096, 4096, 1024, 1024]
    - [8, 9664.99]
  - - [1024, 6968, 1, 4096, 1024, 1024, 4096, 4096]
    - [9, 9870.41]
  - - [4096, 2736, 1, 1024, 4096, 4096, 1024, 1024]
    - [6, 8779.31]
  - - [1024, 5936, 1, 4096, 1024, 1024, 4096, 4096]
    - [6, 8899.8]
  - - [1024, 5888, 1, 1024, 1024, 1024, 1024, 1024]
    - [1, 8529.53]
  - - [33712, 228, 1, 1024, 33712, 33712, 1024, 1024]
    - [9, 8845.99]
  - - [33712, 6768, 1, 1024, 33712, 33712, 1024, 1024]
    - [8, 9683.94]
  - - [1024, 6768, 1, 1024, 1024, 1024, 1024, 1024]
    - [4, 8910.15]
  - - [4096, 6336, 1, 1024, 4096, 4096, 1024, 1024]
    - [8, 9767.67]
  - - [33712, 7296, 1, 1024, 33712, 33712, 1024, 1024]
    - [8, 10256.7]
  - - [1024, 7296, 1, 1024, 1024, 1024, 1024, 1024]
    - [8, 9306.16]
  - - [33712, 3344, 1, 1024, 33712, 33712, 1024, 1024]
    - [8, 9336.6]
  - - [33712, 392, 1, 1024, 33712, 33712, 1024, 1024]
    - [6, 7954.16]
  - - [1024, 5632, 1, 4096, 1024, 1024, 4096, 4096]
    - [0, 8883.24]
  - - [33712, 428, 1, 1024, 33712, 33712, 1024, 1024]
    - [9, 8037.94]
  - - [1024, 4784, 1, 4096, 1024, 1024, 4096, 4096]
    - [8, 8904.08]
  - - [1024, 7568, 1, 1024, 1024, 1024, 1024, 1024]
    - [8, 9638.09]
  - - [1024, 428, 1, 1024, 1024, 1024, 1024, 1024]
    - [12, 7813.21]
  - - [1024, 7056, 1, 4096, 1024, 1024, 4096, 4096]
    - [9, 10236.8]
  - - [33712, 260, 1, 1024, 33712, 33712, 1024, 1024]
    - [6, 7415.3]
  - - [1024, 440, 1, 1024, 1024, 1024, 1024, 1024]
    - [13, 8054.7]
  - - [1024, 5376, 1, 1024, 1024, 1024, 1024, 1024]
    - [0, 9351.59]
  - - [1024, 1320, 1, 4096, 1024, 1024, 4096, 4096]
    - [12, 7986.84]
  - - [4096, 3344, 1, 1024, 4096, 4096, 1024, 1024]
    - [8, 9213.88]
  - - [1024, 5568, 1, 4096, 1024, 1024, 4096, 4096]
    - [0, 9328.11]
  - - [1024, 5568, 1, 1024, 1024, 1024, 1024, 1024]
    - [0, 8751.75]
  - - [1024, 7936, 1, 4096, 1024, 1024, 4096, 4096]
    - [8, 9354.83]
  - - [33712, 7568, 1, 1024, 33712, 33712, 1024, 1024]
    - [8, 10532.7]
  - - [4096, 5184, 1, 1024, 4096, 4096, 1024, 1024]
    - [8, 10309.5]
  - - [1024, 8040, 1, 1024, 1024, 1024, 1024, 1024]
    - [8, 9528.19]
  - - [1024, 5984, 1, 1024, 1024, 1024, 1024, 1024]
    - [8, 8837.57]
  - - [1024, 6320, 1, 4096, 1024, 1024, 4096, 4096]
    - [6, 9089.78]
  - - [1024, 4488, 1, 4096, 1024, 1024, 4096, 4096]
    - [9, 8869.88]
  - - [1024, 6688, 1, 4096, 1024, 1024, 4096, 4096]
    - [9, 9762.88]
  - - [1024, 7000, 1, 1024, 1024, 1024, 1024, 1024]
    - [8, 10319.5]
  - - [33712, 3000, 1, 1024, 33712, 33712, 1024, 1024]
    - [8, 9915.97]
  - - [4096, 4624, 1, 1024, 4096, 4096, 1024, 1024]
    - [8, 10031.5]
  - - [4096, 4400, 1, 1024, 4096, 4096, 1024, 1024]
    - [8, 9705.35]
  - - [1024, 6496, 1, 1024, 1024, 1024, 1024, 1024]
    - [8, 9501.65]
  - - [4096, 448, 1, 1024, 4096, 4096, 1024, 1024]
    - [12, 8400.61]
  - - [1024, 5576, 1, 4096, 1024, 1024, 4096, 4096]
    - [9, 8478.37]
  - - [4096, 3960, 1, 1024, 4096, 4096, 1024, 1024]
    - [8, 9695.88]
  - - [1024, 4992, 1, 4096, 1024, 1024, 4096, 4096]
    - [8, 9148.96]
  - - [4096, 5576, 1, 1024, 4096, 4096, 1024, 1024]
    - [6, 9200.4]
  - - [1024, 5808, 1, 1024, 1024, 1024, 1024, 1024]
    - [0, 8787.55]
  - - [1024, 3584, 1, 1024, 1024, 1024, 1024, 1024]
    - [8, 9137.56]
  - - [1024, 2304, 1, 1024, 1024, 1024, 1024, 1024]
    - [0, 8571.95]
  - - [33712, 6384, 1, 1024, 33712, 33712, 1024, 1024]
    - [8, 10003.9]
  - - [4096, 5280, 1, 1024, 4096, 4096, 1024, 1024]
    - [8, 10456.0]
  - - [4096, 7584, 1, 1024, 4096, 4096, 1024, 1024]
    - [8, 10640.9]
  - - [1024, 2736, 1, 1024, 1024, 1024, 1024, 1024]
    - [0, 8501.97]
  - - [1024, 6256, 1, 4096, 1024, 1024, 4096, 4096]
    - [6, 9109.43]
  - - [1024, 6256, 1, 1024, 1024, 1024, 1024, 1024]
    - [0, 8810.42]
  - - [1024, 968, 1, 1024, 1024, 1024, 1024, 1024]
    - [0, 6821.38]
  - - [1024, 3224, 1, 1024, 1024, 1024, 1024, 1024]
    - [0, 9070.1]
  - - [1024, 5104, 1, 4096, 1024, 1024, 4096, 4096]
    - [8, 9882.06]
  - - [1024, 2112, 1, 1024, 1024, 1024, 1024, 1024]
    - [12, 8033.2]
  - - [1024, 372, 1, 1024, 1024, 1024, 1024, 1024]
    - [12, 7310.16]
  - - [33712, 7320, 1, 1024, 33712, 33712, 1024, 1024]
    - [8, 10174.3]
  - - [4096, 7320, 1, 1024, 4096, 4096, 1024, 1024]
    - [8, 9889.67]
  - - [4096, 7752, 1, 1024, 4096, 4096, 1024, 1024]
    - [8, 10016.2]
  - - [1024, 3864, 1, 1024, 1024, 1024, 1024, 1024]
    - [0, 8500.53]
  - - [1024, 3120, 1, 1024, 1024, 1024, 1024, 1024]
    - [8, 9120.09]
  - - [4096, 6000, 1, 1024, 4096, 4096, 1024, 1024]
    - [8, 9354.76]
  - - [1024, 6440, 1, 1024, 1024, 1024, 1024, 1024]
    - [8, 8875.95]
  - - [1024, 6720, 1, 1024, 1024, 1024, 1024, 1024]
    - [9, 9710.1]
  - - [1024, 12800, 1, 4096, 1024, 1024, 4096, 4096]
    - [8, 10070.3]
  - - [33712, 3456, 1, 1024, 33712, 33712, 1024, 1024]
    - [8, 10038.6]
  - - [1024, 7704, 1, 1024, 1024, 1024, 1024, 1024]
    - [4, 8376.42]
  - - [1024, 4352, 1, 1024, 1024, 1024, 1024, 1024]
    - [4, 9109.31]
  - - [33712, 7680, 1, 1024, 33712, 33712, 1024, 1024]
    - [8, 10677.9]
  - - [1024, 6624, 1, 1024, 1024, 1024, 1024, 1024]
    - [8, 9087.51]
  - - [4096, 4992, 1, 1024, 4096, 4096, 1024, 1024]
    - [8, 10063.6]
  - - [4096, 1440, 1, 1024, 4096, 4096, 1024, 1024]
    - [20, 8721.98]
  - - [4096, 8008, 1, 1024, 4096, 4096, 1024, 1024]
    - [8, 9874.16]
  - - [1024, 304, 1, 1024, 1024, 1024, 1024, 1024]
    - [18, 5596.33]
  - - [1024, 8160, 1, 4096, 1024, 1024, 4096, 4096]
    - [0, 9203.57]
  - - [1024, 7872, 1, 4096, 1024, 1024, 4096, 4096]
    - [4, 9151.4]
  - - [1024, 4816, 1, 1024, 1024, 1024, 1024, 1024]
    - [8, 8755.09]
  - - [1024, 7872, 1, 1024, 1024, 1024, 1024, 1024]
    - [8, 8664.74]
  - - [33712, 480, 1, 1024, 33712, 33712, 1024, 1024]
    - [8, 8731.77]
  - - [4096, 6720, 1, 1024, 4096, 4096, 1024, 1024]
    - [8, 10662.2]
  - - [4096, 5152, 1, 1024, 4096, 4096, 1024, 1024]
    - [8, 9510.35]
  - - [4096, 4896, 1, 1024, 4096, 4096, 1024, 1024]
    - [8, 10592.2]
  - - [4096, 6528, 1, 1024, 4096, 4096, 1024, 1024]
    - [8, 9696.15]
  - - [33712, 224, 1, 1024, 33712, 33712, 1024, 1024]
    - [9, 8441.09]
  - - [1024, 6528, 1, 1024, 1024, 1024, 1024, 1024]
    - [8, 9009.56]
  - - [1024, 2976, 1, 4096, 1024, 1024, 4096, 4096]
    - [0, 8262.88]
  - - [4096, 7488, 1, 1024, 4096, 4096, 1024, 1024]
    - [8, 10508.8]
  - - [1024, 7920, 1, 4096, 1024, 1024, 4096, 4096]
    - [8, 9218.65]
  - - [4096, 7920, 1, 1024, 4096, 4096, 1024, 1024]
    - [8, 9769.79]
  - - [1024, 6480, 1, 4096, 1024, 1024, 4096, 4096]
    - [8, 9021.44]
  - - [4096, 6560, 1, 1024, 4096, 4096, 1024, 1024]
    - [8, 9408.37]
  - - [1024, 5520, 1, 4096, 1024, 1024, 4096, 4096]
    - [0, 8764.85]
  - - [4096, 7200, 1, 1024, 4096, 4096, 1024, 1024]
    - [8, 9970.34]
  - - [1024, 484, 1, 1024, 1024, 1024, 1024, 1024]
    - [17, 5951.11]
  - - [4096, 5632, 1, 1024, 4096, 4096, 1024, 1024]
    - [6, 9906.69]
  - - [4096, 7760, 1, 1024, 4096, 4096, 1024, 1024]
    - [8, 10654.6]
  - - [33712, 7392, 1, 1024, 33712, 33712, 1024, 1024]
    - [8, 10143.0]
  - - [4096, 7616, 1, 1024, 4096, 4096, 1024, 1024]
    - [8, 10685.0]
  - - [4096, 5264, 1, 1024, 4096, 4096, 1024, 1024]
    - [8, 9718.8]
  - - [4096, 6624, 1, 1024, 4096, 4096, 1024, 1024]
    - [8, 9536.16]
  - - [1024, 7536, 1, 1024, 1024, 1024, 1024, 1024]
    - [8, 9519.64]
  - - [33712, 8184, 1, 1024, 33712, 33712, 1024, 1024]
    - [8, 10850.2]
  - - [1024, 6216, 1, 1024, 1024, 1024, 1024, 1024]
    - [0, 9469.35]
  - - [4096, 300, 1, 1024, 4096, 4096, 1024, 1024]
    - [20, 7394.75]
  - - [4096, 7744, 1, 1024, 4096, 4096, 1024, 1024]
    - [8, 10715.2]
  - - [1024, 5704, 1, 1024, 1024, 1024, 1024, 1024]
    - [8, 9126.39]
  - - [4096, 296, 1, 1024, 4096, 4096, 1024, 1024]
    - [12, 7389.96]
  - - [1024, 1824, 1, 4096, 1024, 1024, 4096, 4096]
    - [0, 7963.2]
  - - [33712, 6240, 1, 1024, 33712, 33712, 1024, 1024]
    - [8, 10027.2]
  - - [33712, 412, 1, 1024, 33712, 33712, 1024, 1024]
    - [6, 8618.55]
  - - [4096, 8136, 1, 1024, 4096, 4096, 1024, 1024]
    - [8, 10769.8]
  - - [1024, 7848, 1, 1024, 1024, 1024, 1024, 1024]
    - [8, 9342.04]
  - - [33712, 6496, 1, 1024, 33712, 33712, 1024, 1024]
    - [4, 9426.24]
  - - [1024, 3120, 1, 4096, 1024, 1024, 4096, 4096]
    - [8, 9356.39]
  - - [1024, 6480, 1, 1024, 1024, 1024, 1024, 1024]
    - [8, 8906.73]
  - - [1024, 7912, 1, 1024, 1024, 1024, 1024, 1024]
    - [8, 9380.74]
  - - [4096, 284, 1, 1024, 4096, 4096, 1024, 1024]
    - [12, 7083.62]
  - - [4096, 444, 1, 1024, 4096, 4096, 1024, 1024]
    - [7, 8731.58]
  - - [1024, 5920, 1, 1024, 1024, 1024, 1024, 1024]
    - [4, 8211.06]
  - - [1024, 5184, 1, 4096, 1024, 1024, 4096, 4096]
    - [8, 9954.97]
  - - [1024, 376, 1, 1024, 1024, 1024, 1024, 1024]
    - [20, 7101.31]
  - - [1024, 7344, 1, 1024, 1024, 1024, 1024, 1024]
    - [8, 9945.15]
  - - [33712, 484, 1, 1024, 33712, 33712, 1024, 1024]
    - [8, 8986.76]
  - - [1024, 7920, 1, 1024, 1024, 1024, 1024, 1024]
    - [8, 10036.6]
  - - [1024, 4784, 1, 1024, 1024, 1024, 1024, 1024]
    - [0, 8718.69]
  - - [1024, 6560, 1, 4096, 1024, 1024, 4096, 4096]
    - [9, 9207.87]
  - - [1024, 7904, 1, 1024, 1024, 1024, 1024, 1024]
    - [8, 9910.0]
  - - [4096, 5400, 1, 1024, 4096, 4096, 1024, 1024]
    - [8, 9355.78]
  - - [1024, 5400, 1, 1024, 1024, 1024, 1024, 1024]
    - [8, 9835.86]
  - - [4096, 7896, 1, 1024, 4096, 4096, 1024, 1024]
    - [8, 10403.0]
  - - [33712, 6624, 1, 1024, 33712, 33712, 1024, 1024]
    - [8, 9498.36]
  - - [1024, 7128, 1, 1024, 1024, 1024, 1024, 1024]
    - [4, 9355.9]
  - - [1024, 7224, 1, 1024, 1024, 1024, 1024, 1024]
    - [8, 9806.97]
  - - [33712, 7176, 1, 1024, 33712, 33712, 1024, 1024]
    - [8, 9561.43]
  - - [4096, 5984, 1, 1024, 4096, 4096, 1024, 1024]
    - [8, 9876.39]
  - - [4096, 5888, 1, 1024, 4096, 4096, 1024, 1024]
    - [9, 9694.45]
  - - [33712, 7872, 1, 1024, 33712, 33712, 1024, 1024]
    - [8, 10687.6]
  - - [1024, 7424, 1, 4096, 1024, 1024, 4096, 4096]
    - [8, 9430.87]
  - - [33712, 6912, 1, 1024, 33712, 33712, 1024, 1024]
    - [8, 9931.04]
  - - [4096, 8120, 1, 1024, 4096, 4096, 1024, 1024]
    - [8, 10248.0]
  - - [1024, 7080, 1, 4096, 1024, 1024, 4096, 4096]
    - [8, 9523.69]
  - - [1024, 3840, 1, 4096, 1024, 1024, 4096, 4096]
    - [0, 8582.42]
  - - [1024, 8000, 1, 4096, 1024, 1024, 4096, 4096]
    - [4, 9303.09]
  - - [33712, 3200, 1, 1024, 33712, 33712, 1024, 1024]
    - [8, 10147.8]
  - - [4096, 7216, 1, 1024, 4096, 4096, 1024, 1024]
    - [8, 10768.1]
  - - [1024, 420, 1, 1024, 1024, 1024, 1024, 1024]
    - [21, 7920.9]
  - - [1024, 7280, 1, 1024, 1024, 1024, 1024, 1024]
    - [8, 10663.9]
  - - [33712, 384, 1, 1024, 33712, 33712, 1024, 1024]
    - [9, 9336.32]
  - - [1024, 1440, 1, 4096, 1024, 1024, 4096, 4096]
    - [1, 7800.93]
  - - [1024, 6624, 1, 4096, 1024, 1024, 4096, 4096]
    - [8, 9102.03]
  - - [4096, 23040, 1, 1024, 4096, 4096, 1024, 1024]
    - [8, 9908.03]
  - - [33712, 7000, 1, 1024, 33712, 33712, 1024, 1024]
    - [8, 9602.35]
  - - [1024, 7280, 1, 4096, 1024, 1024, 4096, 4096]
    - [9, 9978.33]
  - - [4096, 7656, 1, 1024, 4096, 4096, 1024, 1024]
    - [8, 10231.0]
  - - [1024, 7800, 1, 4096, 1024, 1024, 4096, 4096]
    - [8, 9220.0]
  - - [1024, 4896, 1, 1024, 1024, 1024, 1024, 1024]
    - [8, 8912.89]
  - - [1024, 4440, 1, 4096, 1024, 1024, 4096, 4096]
    - [4, 9121.25]
  - - [4096, 7040, 1, 1024, 4096, 4096, 1024, 1024]
    - [8, 9940.43]
  - - [33712, 5632, 1, 1024, 33712, 33712, 1024, 1024]
    - [8, 10753.6]
  - - [4096, 1600, 1, 1024, 4096, 4096, 1024, 1024]
    - [1, 8558.92]
  - - [1024, 7040, 1, 1024, 1024, 1024, 1024, 1024]
    - [8, 10426.5]
  - - [1024, 3456, 1, 4096, 1024, 1024, 4096, 4096]
    - [8, 9530.99]
  - - [1024, 7424, 1, 1024, 1024, 1024, 1024, 1024]
    - [8, 10028.6]
  - - [4096, 312, 1, 1024, 4096, 4096, 1024, 1024]
    - [12, 8101.92]
  - - [33712, 4624, 1, 1024, 33712, 33712, 1024, 1024]
    - [8, 10905.2]
  - - [4096, 6576, 1, 1024, 4096, 4096, 1024, 1024]
    - [0, 9302.3]
  - - [4096, 2392, 1, 1024, 4096, 4096, 1024, 1024]
    - [8, 9284.09]
  - - [4096, 6448, 1, 1024, 4096, 4096, 1024, 1024]
    - [8, 9400.23]
  - - [4096, 7680, 1, 1024, 4096, 4096, 1024, 1024]
    - [8, 10423.6]
  - - [1024, 6448, 1, 1024, 1024, 1024, 1024, 1024]
    - [8, 9490.75]
  - - [4096, 1072, 1, 1024, 4096, 4096, 1024, 1024]
    - [12, 8166.76]
  - - [1024, 7936, 1, 1024, 1024, 1024, 1024, 1024]
    - [8, 8782.39]
  - - [33712, 360, 1, 1024, 33712, 33712, 1024, 1024]
    - [9, 8626.43]
  - - [4096, 6768, 1, 1024, 4096, 4096, 1024, 1024]
    - [8, 10743.2]
  - - [1024, 7680, 1, 1024, 1024, 1024, 1024, 1024]
    - [8, 9177.06]
  - - [1024, 432, 1, 1024, 1024, 1024, 1024, 1024]
    - [21, 8089.01]
  - - [33712, 304, 1, 1024, 33712, 33712, 1024, 1024]
    - [7, 9116.68]
  - - [4096, 6240, 1, 1024, 4096, 4096, 1024, 1024]
    - [8, 9889.82]
  - - [1024, 7992, 1, 4096, 1024, 1024, 4096, 4096]
    - [8, 8880.72]
  - - [33712, 6032, 1, 1024, 33712, 33712, 1024, 1024]
    - [8, 10283.0]
  - - [1024, 8112, 1, 1024, 1024, 1024, 1024, 1024]
    - [4, 8512.16]
  - - [1024, 7192, 1, 1024, 1024, 1024, 1024, 1024]
    - [8, 10574.0]
  - - [1024, 3808, 1, 1024, 1024, 1024, 1024, 1024]
    - [20, 8136.97]
  - - [4096, 4368, 1, 1024, 4096, 4096, 1024, 1024]
    - [8, 9666.08]
  - - [1024, 7992, 1, 1024, 1024, 1024, 1024, 1024]
    - [8, 9433.77]
  - - [1024, 4224, 1, 1024, 1024, 1024, 1024, 1024]
    - [0, 8429.47]
  - - [1024, 5712, 1, 1024, 1024, 1024, 1024, 1024]
    - [0, 9329.37]
  - - [4096, 3000, 1, 1024, 4096, 4096, 1024, 1024]
    - [0, 9450.02]
  - - [1024, 7968, 1, 4096, 1024, 1024, 4096, 4096]
    - [9, 9267.11]
  - - [1024, 2112, 1, 4096, 1024, 1024, 4096, 4096]
    - [0, 8696.94]
  - - [33712, 7208, 1, 1024, 33712, 33712, 1024, 1024]
    - [8, 9691.93]
  - - [1024, 3520, 1, 4096, 1024, 1024, 4096, 4096]
    - [8, 9765.54]
  - - [4096, 7784, 1, 1024, 4096, 4096, 1024, 1024]
    - [8, 10093.9]
  - - [1024, 6440, 1, 4096, 1024, 1024, 4096, 4096]
    - [0, 8817.99]
  - - [4096, 7536, 1, 1024, 4096, 4096, 1024, 1024]
    - [8, 9826.47]
  - - [1024, 5304, 1, 4096, 1024, 1024, 4096, 4096]
    - [8, 9090.62]
  - - [1024, 7968, 1, 1024, 1024, 1024, 1024, 1024]
    - [8, 9406.29]
  - - [1024, 5040, 1, 1024, 1024, 1024, 1024, 1024]
    - [8, 9204.43]
  - - [4096, 432, 1, 1024, 4096, 4096, 1024, 1024]
    - [20, 7997.61]
  - - [1024, 7752, 1, 4096, 1024, 1024, 4096, 4096]
    - [9, 9232.79]
  - - [1024, 4928, 1, 1024, 1024, 1024, 1024, 1024]
    - [0, 8549.59]
  - - [1024, 5760, 1, 1024, 1024, 1024, 1024, 1024]
    - [0, 8838.37]
  - - [4096, 1320, 1, 1024, 4096, 4096, 1024, 1024]
    - [0, 8944.8]
  - - [1024, 7888, 1, 1024, 1024, 1024, 1024, 1024]
    - [0, 9435.93]
  - - [1024, 6944, 1, 4096, 1024, 1024, 4096, 4096]
    - [9, 9783.28]
  - - [1024, 6264, 1, 4096, 1024, 1024, 4096, 4096]
    - [8, 8621.59]
  - - [1024, 6384, 1, 1024, 1024, 1024, 1024, 1024]
    - [0, 8759.16]
  - - [33712, 220, 1, 1024, 33712, 33712, 1024, 1024]
    - [8, 8262.93]
  - - [4096, 6256, 1, 1024, 4096, 4096, 1024, 1024]
    - [8, 9890.36]
  - - [33712, 8008, 1, 1024, 33712, 33712, 1024, 1024]
    - [8, 10687.5]
  - - [1024, 4200, 1, 4096, 1024, 1024, 4096, 4096]
    - [0, 8938.53]
  - - [1024, 4160, 1, 1024, 1024, 1024, 1024, 1024]
    - [6, 8736.72]
  - - [4096, 7080, 1, 1024, 4096, 4096, 1024, 1024]
    - [8, 10516.9]
  - - [1024, 7728, 1, 4096, 1024, 1024, 4096, 4096]
    - [8, 9097.16]
  - - [4096, 7592, 1, 1024, 4096, 4096, 1024, 1024]
    - [8, 10658.4]
  - - [33712, 6512, 1, 1024, 33712, 33712, 1024, 1024]
    - [8, 9642.68]
  - - [4096, 8184, 1, 1024, 4096, 4096, 1024, 1024]
    - [8, 10736.8]
  - - [1024, 7320, 1, 4096, 1024, 1024, 4096, 4096]
    - [9, 9381.95]
  - - [1024, 7776, 1, 4096, 1024, 1024, 4096, 4096]
    - [9, 9150.58]
  - - [1024, 6936, 1, 4096, 1024, 1024, 4096, 4096]
    - [8, 9940.29]
  - - [4096, 4608, 1, 1024, 4096, 4096, 1024, 1024]
    - [8, 10948.1]
  - - [33712, 5264, 1, 1024, 33712, 33712, 1024, 1024]
    - [8, 10732.7]
  - - [1024, 4624, 1, 1024, 1024, 1024, 1024, 1024]
    - [8, 9074.36]
  - - [33712, 6480, 1, 1024, 33712, 33712, 1024, 1024]
    - [8, 9688.96]
  - - [4096, 6912, 1, 1024, 4096, 4096, 1024, 1024]
    - [8, 10322.4]
  - - [33712, 452, 1, 1024, 33712, 33712, 1024, 1024]
    - [9, 8303.98]
  - - [1024, 7776, 1, 1024, 1024, 1024, 1024, 1024]
    - [8, 9762.59]
  - - [33712, 7840, 1, 1024, 33712, 33712, 1024, 1024]
    - [8, 10628.9]
  - - [1024, 6560, 1, 1024, 1024, 1024, 1024, 1024]
    - [8, 9050.85]
  - - [1024, 6208, 1, 1024, 1024, 1024, 1024, 1024]
    - [0, 8777.71]
  - - [4096, 5472, 1, 1024, 4096, 4096, 1024, 1024]
    - [8, 9469.56]
  - - [1024, 5952, 1, 4096, 1024, 1024, 4096, 4096]
    - [6, 8824.61]
  - - [4096, 6944, 1, 1024, 4096, 4096, 1024, 1024]
    - [8, 10376.1]
  - - [4096, 464, 1, 1024, 4096, 4096, 1024, 1024]
    - [12, 7069.72]
  - - [4096, 7168, 1, 1024, 4096, 4096, 1024, 1024]
    - [8, 9945.19]
  - - [1024, 8008, 1, 4096, 1024, 1024, 4096, 4096]
    - [4, 9018.93]
  - - [1024, 8096, 1, 4096, 1024, 1024, 4096, 4096]
    - [9, 9451.62]
  - - [1024, 2392, 1, 4096, 1024, 1024, 4096, 4096]
    - [4, 8447.93]
  - - [33712, 448, 1, 1024, 33712, 33712, 1024, 1024]
    - [6, 9055.55]
  - - [1024, 2944, 1, 1024, 1024, 1024, 1024, 1024]
    - [0, 9113.73]
  - - [4096, 292, 1, 1024, 4096, 4096, 1024, 1024]
    - [20, 7669.94]
  - - [1024, 7616, 1, 4096, 1024, 1024, 4096, 4096]
    - [8, 8974.98]
  - - [33712, 5792, 1, 1024, 33712, 33712, 1024, 1024]
    - [8, 10323.3]
  - - [1024, 6888, 1, 1024, 1024, 1024, 1024, 1024]
    - [4, 8955.69]
  - - [4096, 6432, 1, 1024, 4096, 4096, 1024, 1024]
    - [9, 9759.26]
  - - [4096, 6888, 1, 1024, 4096, 4096, 1024, 1024]
    - [8, 10098.4]
  - - [4096, 7344, 1, 1024, 4096, 4096, 1024, 1024]
    - [8, 10330.7]
  - - [4096, 6480, 1, 1024, 4096, 4096, 1024, 1024]
    - [8, 9776.92]
  - - [4096, 3840, 1, 1024, 4096, 4096, 1024, 1024]
    - [4, 9061.81]
  - - [1024, 7168, 1, 1024, 1024, 1024, 1024, 1024]
    - [8, 9741.04]
  - - [4096, 18944, 1, 1024, 4096, 4096, 1024, 1024]
    - [8, 9557.9]
  - - [1024, 6960, 1, 1024, 1024, 1024, 1024, 1024]
    - [8, 9556.46]
  - - [4096, 6960, 1, 1024, 4096, 4096, 1024, 1024]
    - [8, 10380.4]
  - - [4096, 4320, 1, 1024, 4096, 4096, 1024, 1024]
    - [8, 10247.6]
  - - [1024, 5792, 1, 4096, 1024, 1024, 4096, 4096]
    - [0, 8880.97]
  - - [1024, 328, 1, 1024, 1024, 1024, 1024, 1024]
    - [20, 6563.61]
  - - [1024, 4888, 1, 1024, 1024, 1024, 1024, 1024]
    - [0, 9095.38]
  - - [1024, 6336, 1, 4096, 1024, 1024, 4096, 4096]
    - [6, 8857.41]
  - - [4096, 11264, 1, 1024, 4096, 4096, 1024, 1024]
    - [8, 10225.9]
  - - [33712, 8128, 1, 1024, 33712, 33712, 1024, 1024]
    - [8, 10707.5]
  - - [33712, 388, 1, 1024, 33712, 33712, 1024, 1024]
    - [0, 8440.99]
  - - [4096, 4432, 1, 1024, 4096, 4096, 1024, 1024]
    - [8, 10506.1]
  - - [1024, 7584, 1, 4096, 1024, 1024, 4096, 4096]
    - [8, 9063.58]
  - - [4096, 6512, 1, 1024, 4096, 4096, 1024, 1024]
    - [8, 9375.69]
  - - [33712, 8192, 1, 1024, 33712, 33712, 1024, 1024]
    - [8, 10811.2]
  - - [4096, 3904, 1, 1024, 4096, 4096, 1024, 1024]
    - [0, 9640.7]
  - - [4096, 6208, 1, 1024, 4096, 4096, 1024, 1024]
    - [0, 9577.09]
  - - [1024, 7128, 1, 4096, 1024, 1024, 4096, 4096]
    - [8, 10299.3]
  - - [4096, 6344, 1, 1024, 4096, 4096, 1024, 1024]
    - [8, 10778.3]
  - - [1024, 3240, 1, 1024, 1024, 1024, 1024, 1024]
    - [8, 8803.33]
  - - [4096, 5792, 1, 1024, 4096, 4096, 1024, 1024]
    - [8, 9273.41]
  - - [1024, 448, 1, 1024, 1024, 1024, 1024, 1024]
    - [13, 8400.61]
  - - [1024, 5376, 1, 4096, 1024, 1024, 4096, 4096]
    - [0, 9408.08]
  - - [1024, 6120, 1, 4096, 1024, 1024, 4096, 4096]
    - [4, 8534.74]
  - - [1024, 7440, 1, 1024, 1024, 1024, 1024, 1024]
    - [8, 9452.11]
  - - [1024, 8064, 1, 1024, 1024, 1024, 1024, 1024]
    - [8, 9574.81]
  - - [33712, 7896, 1, 1024, 33712, 33712, 1024, 1024]
    - [8, 10760.3]
  - - [4096, 3224, 1, 1024, 4096, 4096, 1024, 1024]
    - [8, 9588.19]
  - - [1024, 952, 1, 4096, 1024, 1024, 4096, 4096]
    - [0, 8604.06]
  - - [33712, 3328, 1, 1024, 33712, 33712, 1024, 1024]
    - [8, 9523.42]
  - - [1024, 4400, 1, 1024, 1024, 1024, 1024, 1024]
    - [4, 9035.19]
  - - [1024, 2880, 1, 1024, 1024, 1024, 1024, 1024]
    - [1, 8683.85]
  - - [1024, 5336, 1, 1024, 1024, 1024, 1024, 1024]
    - [8, 10378.4]
  - - [1024, 7040, 1, 4096, 1024, 1024, 4096, 4096]
    - [9, 10080.5]
  - - [1024, 6944, 1, 1024, 1024, 1024, 1024, 1024]
    - [8, 10263.4]
  - - [1024, 8064, 1, 4096, 1024, 1024, 4096, 4096]
    - [8, 9528.2]
  - - [1024, 3952, 1, 1024, 1024, 1024, 1024, 1024]
    - [0, 8760.29]
  - - [1024, 6112, 1, 4096, 1024, 1024, 4096, 4096]
    - [6, 9091.39]
  - - [1024, 7416, 1, 1024, 1024, 1024, 1024, 1024]
    - [9, 9654.63]
  - - [4096, 5120, 1, 1024, 4096, 4096, 1024, 1024]
    - [8, 9720.27]
  - - [1024, 6160, 1, 1024, 1024, 1024, 1024, 1024]
    - [9, 9054.64]
  - - [33712, 8056, 1, 1024, 33712, 33712, 1024, 1024]
    - [8, 10775.3]
  - - [33712, 380, 1, 1024, 33712, 33712, 1024, 1024]
    - [9, 10365.7]
  - - [4096, 3672, 1, 1024, 4096, 4096, 1024, 1024]
    - [1, 9064.8]
  - - [1024, 8192, 1, 4096, 1024, 1024, 4096, 4096]
    - [8, 9690.36]
  - - [1024, 6344, 1, 4096, 1024, 1024, 4096, 4096]
    - [9, 9295.39]
  - - [1024, 4368, 1, 1024, 1024, 1024, 1024, 1024]
    - [4, 8468.0]
  - - [4096, 2160, 1, 1024, 4096, 4096, 1024, 1024]
    - [8, 10052.9]
  - - [4096, 4160, 1, 1024, 4096, 4096, 1024, 1024]
    - [8, 9898.05]
  - - [4096, 7936, 1, 1024, 4096, 4096, 1024, 1024]
    - [8, 9814.92]
  - - [4096, 6536, 1, 1024, 4096, 4096, 1024, 1024]
    - [8, 9640.3]
  - - [33712, 8112, 1, 1024, 33712, 33712, 1024, 1024]
    - [8, 10655.8]
  - - [33712, 8064, 1, 1024, 33712, 33712, 1024, 1024]
    - [8, 10854.6]
  - - [4096, 4784, 1, 1024, 4096, 4096, 1024, 1024]
    - [8, 10307.3]
  - - [4096, 7800, 1, 1024, 4096, 4096, 1024, 1024]
    - [8, 10910.1]
  - - [4096, 376, 1, 1024, 4096, 4096, 1024, 1024]
    - [8, 7810.31]
  - - [1024, 6656, 1, 4096, 1024, 1024, 4096, 4096]
    - [8, 9219.45]
  - - [4096, 3384, 1, 1024, 4096, 4096, 1024, 1024]
    - [4, 8789.2]
  - - [1024, 7832, 1, 1024, 1024, 1024, 1024, 1024]
    - [8, 9288.4]
  - - [1024, 2184, 1, 1024, 1024, 1024, 1024, 1024]
    - [0, 8164.88]
  - - [33712, 4576, 1, 1024, 33712, 33712, 1024, 1024]
    - [8, 11168.8]
  - - [1024, 5600, 1, 4096, 1024, 1024, 4096, 4096]
    - [0, 8892.14]
  - - [4096, 3120, 1, 1024, 4096, 4096, 1024, 1024]
    - [8, 9597.93]
  - - [4096, 8112, 1, 1024, 4096, 4096, 1024, 1024]
    - [8, 9984.78]
  - - [33712, 4968, 1, 1024, 33712, 33712, 1024, 1024]
    - [8, 11087.4]
  - - [4096, 6496, 1, 1024, 4096, 4096, 1024, 1024]
    - [0, 9644.25]
  - - [33712, 7752, 1, 1024, 33712, 33712, 1024, 1024]
    - [8, 10561.8]
  - - [1024, 3536, 1, 1024, 1024, 1024, 1024, 1024]
    - [8, 10936.1]
  - - [33712, 5032, 1, 1024, 33712, 33712, 1024, 1024]
    - [8, 11019.0]
  - - [4096, 5936, 1, 1024, 4096, 4096, 1024, 1024]
    - [6, 9706.11]
  - - [4096, 5568, 1, 1024, 4096, 4096, 1024, 1024]
    - [6, 9237.19]
  - - [4096, 6968, 1, 1024, 4096, 4096, 1024, 1024]
    - [8, 10411.0]
  - - [4096, 7424, 1, 1024, 4096, 4096, 1024, 1024]
    - [8, 9722.75]
  - - [1024, 8192, 1, 1024, 1024, 1024, 1024, 1024]
    - [8, 9731.19]
  - - [1024, 4368, 1, 4096, 1024, 1024, 4096, 4096]
    - [0, 8823.97]
  - - [4096, 3456, 1, 1024, 4096, 4096, 1024, 1024]
    - [4, 9520.47]
  - - [1024, 7344, 1, 4096, 1024, 1024, 4096, 4096]
    - [9, 8841.04]
  - - [4096, 7840, 1, 1024, 4096, 4096, 1024, 1024]
    - [8, 9704.89]
  - - [1024, 7600, 1, 1024, 1024, 1024, 1024, 1024]
    - [8, 9605.1]
  - - [1024, 300, 1, 1024, 1024, 1024, 1024, 1024]
    - [18, 5921.93]
  - - [4096, 9728, 1, 1024, 4096, 4096, 1024, 1024]
    - [8, 10359.7]
  - - [4096, 6440, 1, 1024, 4096, 4096, 1024, 1024]
    - [8, 9742.64]
  - - [33712, 7448, 1, 1024, 33712, 33712, 1024, 1024]
    - [8, 9995.29]
  - - [1024, 8096, 1, 1024, 1024, 1024, 1024, 1024]
    - [4, 9220.23]
  - - [33712, 4608, 1, 1024, 33712, 33712, 1024, 1024]
    - [8, 11259.4]
  - - [33712, 3840, 1, 1024, 33712, 33712, 1024, 1024]
    - [0, 9446.01]
  - - [1024, 2560, 1, 1024, 1024, 1024, 1024, 1024]
    - [4, 9446.61]
  - - [1024, 5472, 1, 4096, 1024, 1024, 4096, 4096]
    - [8, 9125.86]
  - - [1024, 7696, 1, 1024, 1024, 1024, 1024, 1024]
    - [8, 9765.04]
  - - [4096, 6048, 1, 1024, 4096, 4096, 1024, 1024]
    - [6, 9251.85]
  - - [33712, 240, 1, 1024, 33712, 33712, 1024, 1024]
    - [9, 8989.85]
  - - [4096, 6800, 1, 1024, 4096, 4096, 1024, 1024]
    - [8, 10744.6]
  - - [1024, 1760, 1, 1024, 1024, 1024, 1024, 1024]
    - [8, 9216.39]
  - - [1024, 2992, 1, 1024, 1024, 1024, 1024, 1024]
    - [12, 8712.88]
  - - [1024, 6992, 1, 4096, 1024, 1024, 4096, 4096]
    - [8, 9456.99]
  - - [4096, 256, 1, 1024, 4096, 4096, 1024, 1024]
    - [21, 6932.73]
  - - [1024, 7560, 1, 1024, 1024, 1024, 1024, 1024]
    - [8, 10216.5]
  - - [1024, 5832, 1, 4096, 1024, 1024, 4096, 4096]
    - [0, 8656.48]
  - - [4096, 8176, 1, 1024, 4096, 4096, 1024, 1024]
    - [8, 10832.6]
  - - [1024, 7840, 1, 1024, 1024, 1024, 1024, 1024]
    - [8, 9329.12]
  - - [4096, 7544, 1, 1024, 4096, 4096, 1024, 1024]
    - [8, 10524.5]
  - - [1024, 6240, 1, 1024, 1024, 1024, 1024, 1024]
    - [0, 8662.23]
  - - [4096, 6808, 1, 1024, 4096, 4096, 1024, 1024]
    - [8, 10688.3]
  - - [33712, 7968, 1, 1024, 33712, 33712, 1024, 1024]
    - [8, 10595.9]
  - - [1024, 7104, 1, 1024, 1024, 1024, 1024, 1024]
    - [8, 9731.75]
  - - [1024, 8120, 1, 4096, 1024, 1024, 4096, 4096]
    - [9, 9505.67]
  - - [33712, 2992, 1, 1024, 33712, 33712, 1024, 1024]
    - [8, 9874.16]
  - - [1024, 6048, 1, 4096, 1024, 1024, 4096, 4096]
    - [6, 8957.56]
  - - [1024, 6272, 1, 4096, 1024, 1024, 4096, 4096]
    - [6, 9192.98]
  - - [33712, 5376, 1, 1024, 33712, 33712, 1024, 1024]
    - [8, 11083.5]
  - - [1024, 6552, 1, 1024, 1024, 1024, 1024, 1024]
    - [1, 8821.59]
  - - [1024, 1440, 1, 1024, 1024, 1024, 1024, 1024]
    - [9, 8007.79]
  - - [4096, 6976, 1, 1024, 4096, 4096, 1024, 1024]
    - [8, 10604.9]
  - - [33712, 7416, 1, 1024, 33712, 33712, 1024, 1024]
    - [8, 10175.1]
  - - [1024, 7552, 1, 1024, 1024, 1024, 1024, 1024]
    - [4, 8872.04]
  - - [1024, 3400, 1, 1024, 1024, 1024, 1024, 1024]
    - [9, 9709.02]
  - - [4096, 7696, 1, 1024, 4096, 4096, 1024, 1024]
    - [8, 10052.8]
  - - [4096, 320, 1, 1024, 4096, 4096, 1024, 1024]
    - [12, 7858.18]
  - - [4096, 3328, 1, 1024, 4096, 4096, 1024, 1024]
    - [4, 8995.81]
  - - [33712, 7128, 1, 1024, 33712, 33712, 1024, 1024]
    - [8, 9979.5]
  - - [4096, 348, 1, 1024, 4096, 4096, 1024, 1024]
    - [8, 8130.65]
  - - [4096, 6552, 1, 1024, 4096, 4096, 1024, 1024]
    - [8, 9847.57]
  - - [4096, 7360, 1, 1024, 4096, 4096, 1024, 1024]
    - [8, 9799.26]
  - - [1024, 6728, 1, 4096, 1024, 1024, 4096, 4096]
    - [9, 9825.08]
  - - [1024, 6992, 1, 1024, 1024, 1024, 1024, 1024]
    - [8, 10320.4]
  - - [33712, 7920, 1, 1024, 33712, 33712, 1024, 1024]
    - [8, 10627.3]
  - - [33712, 440, 1, 1024, 33712, 33712, 1024, 1024]
    - [1, 9410.0]
  - - [1024, 284, 1, 1024, 1024, 1024, 1024, 1024]
    - [17, 5606.09]
  - - [1024, 8112, 1, 4096, 1024, 1024, 4096, 4096]
    - [8, 9448.83]
  - - [1024, 7248, 1, 4096, 1024, 1024, 4096, 4096]
    - [8, 10411.6]
  - - [1024, 5952, 1, 1024, 1024, 1024, 1024, 1024]
    - [6, 8832.09]
  - - [4096, 8056, 1, 1024, 4096, 4096, 1024, 1024]
    - [8, 9923.53]
  - - [33712, 512, 1, 1024, 33712, 33712, 1024, 1024]
    - [9, 10069.5]
  - - [1024, 7592, 1, 4096, 1024, 1024, 4096, 4096]
    - [0, 8869.74]
  - - [33712, 4176, 1, 1024, 33712, 33712, 1024, 1024]
    - [8, 11137.0]
  - - [1024, 7320, 1, 1024, 1024, 1024, 1024, 1024]
    - [0, 9429.43]
  - - [1024, 7632, 1, 1024, 1024, 1024, 1024, 1024]
    - [8, 9603.87]
  - - [1024, 4680, 1, 1024, 1024, 1024, 1024, 1024]
    - [0, 8551.73]
  - - [1024, 6536, 1, 1024, 1024, 1024, 1024, 1024]
    - [8, 9663.67]
  - - [33712, 4800, 1, 1024, 33712, 33712, 1024, 1024]
    - [8, 11083.4]
  - - [1024, 2976, 1, 1024, 1024, 1024, 1024, 1024]
    - [8, 9276.33]
  - - [1024, 7504, 1, 1024, 1024, 1024, 1024, 1024]
    - [8, 9467.34]
  - - [1024, 7360, 1, 1024, 1024, 1024, 1024, 1024]
    - [8, 10007.1]
  - - [1024, 8024, 1, 4096, 1024, 1024, 4096, 4096]
    - [9, 9446.02]
  - - [1024, 5632, 1, 1024, 1024, 1024, 1024, 1024]
    - [0, 8800.62]
  - - [33712, 6144, 1, 1024, 33712, 33712, 1024, 1024]
    - [8, 9992.44]
  - - [33712, 2880, 1, 1024, 33712, 33712, 1024, 1024]
    - [8, 9849.39]
  - - [4096, 468, 1, 1024, 4096, 4096, 1024, 1024]
    - [12, 7093.56]
  - - [4096, 8192, 1, 1024, 4096, 4096, 1024, 1024]
    - [8, 10778.1]
  - - [4096, 5040, 1, 1024, 4096, 4096, 1024, 1024]
    - [8, 9335.8]
  - - [1024, 7616, 1, 1024, 1024, 1024, 1024, 1024]
    - [8, 8932.02]
  - - [4096, 5712, 1, 1024, 4096, 4096, 1024, 1024]
    - [8, 9135.83]
  - - [1024, 6552, 1, 4096, 1024, 1024, 4096, 4096]
    - [0, 9253.12]
  - - [4096, 2184, 1, 1024, 4096, 4096, 1024, 1024]
    - [8, 10287.9]
  - - [4096, 7728, 1, 1024, 4096, 4096, 1024, 1024]
    - [8, 10831.4]
  - - [4096, 7968, 1, 1024, 4096, 4096, 1024, 1024]
    - [8, 9844.51]
  - - [4096, 1952, 1, 1024, 4096, 4096, 1024, 1024]
    - [9, 9557.41]
  - - [33712, 7104, 1, 1024, 33712, 33712, 1024, 1024]
    - [8, 9549.77]
  - - [4096, 8128, 1, 1024, 4096, 4096, 1024, 1024]
    - [8, 10779.1]
  - - [1024, 4800, 1, 4096, 1024, 1024, 4096, 4096]
    - [8, 9302.74]
  - - [33712, 344, 1, 1024, 33712, 33712, 1024, 1024]
    - [5, 8959.46]
  - - [1024, 8128, 1, 1024, 1024, 1024, 1024, 1024]
    - [9, 9084.6]
  - - [33712, 5280, 1, 1024, 33712, 33712, 1024, 1024]
    - [8, 10802.5]
  - - [1024, 5512, 1, 1024, 1024, 1024, 1024, 1024]
    - [0, 9451.43]
  - - [33712, 4992, 1, 1024, 33712, 33712, 1024, 1024]
    - [8, 11173.4]
  - - [33712, 8096, 1, 1024, 33712, 33712, 1024, 1024]
    - [8, 10669.1]
  - - [1024, 5104, 1, 1024, 1024, 1024, 1024, 1024]
    - [8, 9974.51]
  - - [1024, 7680, 1, 4096, 1024, 1024, 4096, 4096]
    - [0, 8948.62]
  - - [4096, 7128, 1, 1024, 4096, 4096, 1024, 1024]
    - [8, 9912.25]
  - - [4096, 1824, 1, 1024, 4096, 4096, 1024, 1024]
    - [8, 9136.32]
  - - [33712, 7800, 1, 1024, 33712, 33712, 1024, 1024]
    - [8, 10644.2]
  - - [1024, 5056, 1, 4096, 1024, 1024, 4096, 4096]
    - [8, 9742.34]
  - - [1024, 1960, 1, 4096, 1024, 1024, 4096, 4096]
    - [0, 8065.95]
  - - [1024, 6696, 1, 1024, 1024, 1024, 1024, 1024]
    - [8, 9201.68]
  - - [33712, 7656, 1, 1024, 33712, 33712, 1024, 1024]
    - [8, 10705.7]
  - - [1024, 3128, 1, 1024, 1024, 1024, 1024, 1024]
    - [8, 9750.12]
  - - [33712, 7216, 1, 1024, 33712, 33712, 1024, 1024]
    - [8, 9915.12]
  - - [1024, 5984, 1, 4096, 1024, 1024, 4096, 4096]
    - [6, 8924.79]
  - - [33712, 7904, 1, 1024, 33712, 33712, 1024, 1024]
    - [8, 10758.8]
  - - [33712, 348, 1, 1024, 33712, 33712, 1024, 1024]
    - [9, 8897.7]
  - - [1024, 6496, 1, 4096, 1024, 1024, 4096, 4096]
    - [9, 8785.22]
  - - [1024, 6216, 1, 4096, 1024, 1024, 4096, 4096]
    - [6, 9112.68]
  - - [1024, 3960, 1, 1024, 1024, 1024, 1024, 1024]
    - [0, 8795.87]
  - - [1024, 7176, 1, 4096, 1024, 1024, 4096, 4096]
    - [9, 10318.1]
  - - [1024, 5704, 1, 4096, 1024, 1024, 4096, 4096]
    - [4, 8024.4]
  - - [1024, 7200, 1, 4096, 1024, 1024, 4096, 4096]
    - [8, 10201.0]
  - - [33712, 7168, 1, 1024, 33712, 33712, 1024, 1024]
    - [8, 9837.3]
  - - [33712, 7592, 1, 1024, 33712, 33712, 1024, 1024]
    - [8, 10353.3]
  - - [1024, 2664, 1, 4096, 1024, 1024, 4096, 4096]
    - [4, 8094.93]
  - - [4096, 3264, 1, 1024, 4096, 4096, 1024, 1024]
    - [6, 9038.09]
  - - [1024, 26624, 1, 1024, 1024, 1024, 1024, 1024]
    - [8, 10602.0]
  - - [1024, 3264, 1, 4096, 1024, 1024, 4096, 4096]
    - [8, 9028.55]
  - - [33712, 5984, 1, 1024, 33712, 33712, 1024, 1024]
    - [8, 10428.2]
  - - [4096, 7600, 1, 1024, 4096, 4096, 1024, 1024]
    - [8, 10624.4]
  - - [1024, 7752, 1, 1024, 1024, 1024, 1024, 1024]
    - [8, 9253.81]
  - - [1024, 5576, 1, 1024, 1024, 1024, 1024, 1024]
    - [0, 8754.86]
  - - [33712, 7728, 1, 1024, 33712, 33712, 1024, 1024]
    - [8, 10546.7]
  - - [4096, 272, 1, 1024, 4096, 4096, 1024, 1024]
    - [21, 7411.97]
  - - [1024, 5120, 1, 4096, 1024, 1024, 4096, 4096]
    - [8, 9441.29]
  - - [33712, 6992, 1, 1024, 33712, 33712, 1024, 1024]
    - [8, 9699.0]
  - - [4096, 212, 1, 1024, 4096, 4096, 1024, 1024]
    - [15, 7170.91]
  - - [33712, 7280, 1, 1024, 33712, 33712, 1024, 1024]
    - [8, 9724.38]
  - - [4096, 7808, 1, 1024, 4096, 4096, 1024, 1024]
    - [8, 10919.6]
  - - [33712, 8160, 1, 1024, 33712, 33712, 1024, 1024]
    - [8, 10777.7]
  - - [1024, 7832, 1, 4096, 1024, 1024, 4096, 4096]
    - [0, 9453.7]
  - - [1024, 3200, 1, 4096, 1024, 1024, 4096, 4096]
    - [8, 8934.01]
  - - [33712, 7552, 1, 1024, 33712, 33712, 1024, 1024]
    - [8, 10308.7]
  - - [4096, 7912, 1, 1024, 4096, 4096, 1024, 1024]
    - [8, 10680.1]
  - - [1024, 7296, 1, 4096, 1024, 1024, 4096, 4096]
    - [9, 9832.14]
  - - [33712, 7912, 1, 1024, 33712, 33712, 1024, 1024]
    - [8, 10778.6]
  - - [1024, 5920, 1, 4096, 1024, 1024, 4096, 4096]
    - [0, 8876.3]
  - - [4096, 408, 1, 1024, 4096, 4096, 1024, 1024]
    - [7, 8614.94]
  - - [33712, 6048, 1, 1024, 33712, 33712, 1024, 1024]
    - [8, 10362.4]
  - - [1024, 5184, 1, 1024, 1024, 1024, 1024, 1024]
    - [8, 9452.91]
  - - [4096, 3240, 1, 1024, 4096, 4096, 1024, 1024]
    - [20, 8983.02]
  - - [4096, 9216, 1, 1024, 4096, 4096, 1024, 1024]
    - [8, 11005.2]
  - - [33712, 272, 1, 1024, 33712, 33712, 1024, 1024]
    - [0, 8253.38]
  - - [4096, 3680, 1, 1024, 4096, 4096, 1024, 1024]
    - [8, 9077.27]
  - - [4096, 3360, 1, 1024, 4096, 4096, 1024, 1024]
    - [1, 9201.37]
  - - [1024, 7392, 1, 4096, 1024, 1024, 4096, 4096]
    - [9, 9518.67]
  - - [1024, 6800, 1, 4096, 1024, 1024, 4096, 4096]
    - [8, 9304.35]
  - - [1024, 8032, 1, 1024, 1024, 1024, 1024, 1024]
    - [8, 9458.83]
  - - [33712, 3680, 1, 1024, 33712, 33712, 1024, 1024]
    - [8, 10020.0]
  - - [33712, 416, 1, 1024, 33712, 33712, 1024, 1024]
    - [6, 8405.56]
  - - [1024, 8120, 1, 1024, 1024, 1024, 1024, 1024]
    - [0, 8942.96]
  - - [4096, 5920, 1, 1024, 4096, 4096, 1024, 1024]
    - [6, 9184.13]
  - - [33712, 7560, 1, 1024, 33712, 33712, 1024, 1024]
    - [8, 10436.5]
  - - [1024, 4176, 1, 1024, 1024, 1024, 1024, 1024]
    - [6, 9383.77]
  - - [1024, 6768, 1, 4096, 1024, 1024, 4096, 4096]
    - [9, 9924.13]
  - - [4096, 4200, 1, 1024, 4096, 4096, 1024, 1024]
    - [8, 9993.21]
  - - [33712, 508, 1, 1024, 33712, 33712, 1024, 1024]
    - [9, 9876.03]
  - - [1024, 7176, 1, 1024, 1024, 1024, 1024, 1024]
    - [8, 10602.8]
  - - [1024, 2584, 1, 4096, 1024, 1024, 4096, 4096]
    - [5, 8989.76]
  - - [1024, 1600, 1, 4096, 1024, 1024, 4096, 4096]
    - [8, 8366.0]
  - - [33712, 6560, 1, 1024, 33712, 33712, 1024, 1024]
    - [4, 9393.38]
  - - [1024, 5936, 1, 1024, 1024, 1024, 1024, 1024]
    - [4, 9497.58]
  - - [33712, 7936, 1, 1024, 33712, 33712, 1024, 1024]
    - [8, 10833.8]
  - - [1024, 6528, 1, 4096, 1024, 1024, 4096, 4096]
    - [0, 9173.01]
  - - [1024, 7072, 1, 4096, 1024, 1024, 4096, 4096]
    - [9, 10250.3]
  - - [33712, 3600, 1, 1024, 33712, 33712, 1024, 1024]
    - [8, 9850.45]
  - - [1024, 6912, 1, 4096, 1024, 1024, 4096, 4096]
    - [8, 9492.78]
  - - [33712, 8176, 1, 1024, 33712, 33712, 1024, 1024]
    - [8, 10769.9]
  - - [4096, 492, 1, 1024, 4096, 4096, 1024, 1024]
    - [0, 8530.06]
  - - [4096, 452, 1, 1024, 4096, 4096, 1024, 1024]
    - [14, 7052.91]
  - - [33712, 4704, 1, 1024, 33712, 33712, 1024, 1024]
    - [8, 11242.4]
  - - [1024, 480, 1, 1024, 1024, 1024, 1024, 1024]
    - [10, 6329.43]
  - - [33712, 5760, 1, 1024, 33712, 33712, 1024, 1024]
    - [8, 10239.7]
  - - [1024, 3328, 1, 4096, 1024, 1024, 4096, 4096]
    - [8, 9301.77]
  - - [4096, 7400, 1, 1024, 4096, 4096, 1024, 1024]
    - [8, 10567.1]
  - - [1024, 9728, 1, 4096, 1024, 1024, 4096, 4096]
    - [4, 9396.55]
  - - [1024, 7656, 1, 1024, 1024, 1024, 1024, 1024]
    - [0, 8605.48]
  - - [33712, 7192, 1, 1024, 33712, 33712, 1024, 1024]
    - [8, 9694.06]
  - - [4096, 3400, 1, 1024, 4096, 4096, 1024, 1024]
    - [8, 10024.6]
  - - [1024, 3344, 1, 1024, 1024, 1024, 1024, 1024]
    - [8, 9052.12]
  - - [1024, 4608, 1, 4096, 1024, 1024, 4096, 4096]
    - [8, 8604.29]
  - - [4096, 8024, 1, 1024, 4096, 4096, 1024, 1024]
    - [8, 10145.6]
  - - [1024, 6048, 1, 1024, 1024, 1024, 1024, 1024]
    - [8, 8980.64]
  - - [1024, 8000, 1, 1024, 1024, 1024, 1024, 1024]
    - [9, 10029.4]
  - - [33712, 5104, 1, 1024, 33712, 33712, 1024, 1024]
    - [8, 11148.5]
  - - [1024, 7688, 1, 1024, 1024, 1024, 1024, 1024]
    - [0, 9460.0]
  - - [1024, 4992, 1, 1024, 1024, 1024, 1024, 1024]
    - [8, 9115.49]
  - - [33712, 296, 1, 1024, 33712, 33712, 1024, 1024]
    - [6, 8428.65]
  - - [4096, 6608, 1, 1024, 4096, 4096, 1024, 1024]
    - [8, 9771.5]
  - - [1024, 8176, 1, 4096, 1024, 1024, 4096, 4096]
    - [8, 8962.65]
  - - [1024, 7560, 1, 4096, 1024, 1024, 4096, 4096]
    - [8, 9000.22]
  - - [4096, 7280, 1, 1024, 4096, 4096, 1024, 1024]
    - [8, 10073.7]
  - - [4096, 7904, 1, 1024, 4096, 4096, 1024, 1024]
    - [8, 10420.3]
  - - [4096, 7072, 1, 1024, 4096, 4096, 1024, 1024]
    - [8, 10530.1]
  - - [1024, 7584, 1, 1024, 1024, 1024, 1024, 1024]
    - [9, 8965.07]
  - - [33712, 3960, 1, 1024, 33712, 33712, 1024, 1024]
    - [6, 9737.8]
  - - [33712, 6944, 1, 1024, 33712, 33712, 1024, 1024]
    - [8, 9409.75]
  - - [4096, 2520, 1, 1024, 4096, 4096, 1024, 1024]
    - [8, 9711.87]
  - - [4096, 340, 1, 1024, 4096, 4096, 1024, 1024]
    - [8, 7263.96]
  - - [33712, 5472, 1, 1024, 33712, 33712, 1024, 1024]
    - [8, 10971.4]
  - - [1024, 7360, 1, 4096, 1024, 1024, 4096, 4096]
    - [9, 9561.06]
  - - [4096, 7232, 1, 1024, 4096, 4096, 1024, 1024]
    - [8, 10015.4]
  - - [1024, 2736, 1, 4096, 1024, 1024, 4096, 4096]
    - [0, 8555.7]
  - - [4096, 7104, 1, 1024, 4096, 4096, 1024, 1024]
    - [8, 9838.94]
  - - [33712, 4680, 1, 1024, 33712, 33712, 1024, 1024]
    - [8, 10912.4]
  - - [4096, 372, 1, 1024, 4096, 4096, 1024, 1024]
    - [8, 8805.17]
  - - [1024, 6688, 1, 1024, 1024, 1024, 1024, 1024]
    - [8, 9917.49]
  - - [1024, 5120, 1, 1024, 1024, 1024, 1024, 1024]
    - [8, 10061.3]
  - - [1024, 7912, 1, 4096, 1024, 1024, 4096, 4096]
    - [8, 9294.96]
  - - [1024, 4480, 1, 4096, 1024, 1024, 4096, 4096]
    - [9, 8894.63]
  - - [4096, 7888, 1, 1024, 4096, 4096, 1024, 1024]
    - [8, 9918.63]
  - - [1024, 4800, 1, 1024, 1024, 1024, 1024, 1024]
    - [8, 8749.05]
  - - [1024, 7600, 1, 4096, 1024, 1024, 4096, 4096]
    - [9, 9093.89]
  - - [1024, 5824, 1, 1024, 1024, 1024, 1024, 1024]
    - [0, 8698.28]
  - - [1024, 6432, 1, 4096, 1024, 1024, 4096, 4096]
    - [0, 9181.33]
  - - [4096, 5824, 1, 1024, 4096, 4096, 1024, 1024]
    - [8, 9304.46]
  - - [1024, 5824, 1, 4096, 1024, 1024, 4096, 4096]
    - [0, 8879.91]
  - - [1024, 1248, 1, 1024, 1024, 1024, 1024, 1024]
    - [20, 8232.4]
  - - [1024, 356, 1, 1024, 1024, 1024, 1024, 1024]
    - [20, 6902.61]
  - - [1024, 4968, 1, 4096, 1024, 1024, 4096, 4096]
    - [0, 9197.88]
  - - [1024, 6272, 1, 1024, 1024, 1024, 1024, 1024]
    - [0, 8818.72]
  - - [1024, 8160, 1, 1024, 1024, 1024, 1024, 1024]
    - [8, 9630.33]
  - - [4096, 6272, 1, 1024, 4096, 4096, 1024, 1024]
    - [8, 9658.48]
  - - [1024, 392, 1, 1024, 1024, 1024, 1024, 1024]
    - [13, 7298.33]
  - - [33712, 6272, 1, 1024, 33712, 33712, 1024, 1024]
    - [8, 10036.8]
  - - [4096, 8064, 1, 1024, 4096, 4096, 1024, 1024]
    - [8, 9926.16]
  - - [4096, 3536, 1, 1024, 4096, 4096, 1024, 1024]
    - [8, 9772.17]
  - - [33712, 5568, 1, 1024, 33712, 33712, 1024, 1024]
    - [8, 10786.2]
  - - [1024, 5032, 1, 4096, 1024, 1024, 4096, 4096]
    - [8, 9746.96]
  - - [1024, 3400, 1, 4096, 1024, 1024, 4096, 4096]
    - [4, 9519.76]
  - - [1024, 7208, 1, 1024, 1024, 1024, 1024, 1024]
    - [8, 10030.4]
  - - [1024, 2392, 1, 1024, 1024, 1024, 1024, 1024]
    - [4, 8220.34]
  - - [1024, 6576, 1, 1024, 1024, 1024, 1024, 1024]
    - [0, 9499.91]
  - - [4096, 8096, 1, 1024, 4096, 4096, 1024, 1024]
    - [8, 10737.7]
  - - [4096, 404, 1, 1024, 4096, 4096, 1024, 1024]
    - [20, 7927.09]
  - - [4096, 5336, 1, 1024, 4096, 4096, 1024, 1024]
    - [6, 9178.15]
  - - [1024, 6448, 1, 4096, 1024, 1024, 4096, 4096]
    - [9, 9069.35]
  - - [1024, 6200, 1, 4096, 1024, 1024, 4096, 4096]
    - [6, 9152.17]
  - - [1024, 2160, 1, 1024, 1024, 1024, 1024, 1024]
    - [12, 8008.91]
  - - [4096, 11776, 1, 1024, 4096, 4096, 1024, 1024]
    - [8, 10444.9]
  - - [1024, 7192, 1, 4096, 1024, 1024, 4096, 4096]
    - [9, 9636.75]
  - - [1024, 7896, 1, 4096, 1024, 1024, 4096, 4096]
    - [8, 8733.13]
  - - [1024, 4160, 1, 4096, 1024, 1024, 4096, 4096]
    - [0, 8756.0]
  - - [1024, 7696, 1, 4096, 1024, 1024, 4096, 4096]
    - [0, 8937.07]
  - - [1024, 308, 1, 1024, 1024, 1024, 1024, 1024]
    - [18, 5980.77]
  - - [1024, 7536, 1, 4096, 1024, 1024, 4096, 4096]
    - [0, 9184.16]
  - - [4096, 12800, 1, 1024, 4096, 4096, 1024, 1024]
    - [8, 10163.8]
  - - [1024, 6144, 1, 4096, 1024, 1024, 4096, 4096]
    - [4, 8573.45]
  - - [1024, 2240, 1, 1024, 1024, 1024, 1024, 1024]
    - [0, 8296.15]
  - - [1024, 8056, 1, 1024, 1024, 1024, 1024, 1024]
    - [8, 10163.8]
  - - [33712, 6688, 1, 1024, 33712, 33712, 1024, 1024]
    - [8, 9377.54]
  - - [1024, 4176, 1, 4096, 1024, 1024, 4096, 4096]
    - [4, 8877.71]
  - - [4096, 224, 1, 1024, 4096, 4096, 1024, 1024]
    - [15, 7108.99]
  - - [1024, 4320, 1, 1024, 1024, 1024, 1024, 1024]
    - [0, 8657.94]
  - - [1024, 2992, 1, 4096, 1024, 1024, 4096, 4096]
    - [8, 8454.14]
  - - [1024, 6336, 1, 1024, 1024, 1024, 1024, 1024]
    - [20, 8814.16]
  - - [1024, 7656, 1, 4096, 1024, 1024, 4096, 4096]
    - [4, 8962.68]
  - - [1024, 6912, 1, 1024, 1024, 1024, 1024, 1024]
    - [8, 9543.53]
  - - [4096, 2112, 1, 1024, 4096, 4096, 1024, 1024]
    - [8, 9893.61]
  - - [4096, 7560, 1, 1024, 4096, 4096, 1024, 1024]
    - [8, 9867.33]
  - - [4096, 8000, 1, 1024, 4096, 4096, 1024, 1024]
    - [8, 9871.71]
  - - [1024, 3528, 1, 4096, 1024, 1024, 4096, 4096]
    - [8, 9262.77]
  - - [1024, 2520, 1, 4096, 1024, 1024, 4096, 4096]
    - [6, 8633.62]
  - - [1024, 7072, 1, 1024, 1024, 1024, 1024, 1024]
    - [8, 10325.7]
  - - [4096, 264, 1, 1024, 4096, 4096, 1024, 1024]
    - [12, 7079.88]
  - - [4096, 4800, 1, 1024, 4096, 4096, 1024, 1024]
    - [8, 9638.73]
  - - [33712, 6552, 1, 1024, 33712, 33712, 1024, 1024]
    - [8, 9399.64]
  - - [1024, 4320, 1, 4096, 1024, 1024, 4096, 4096]
    - [4, 9075.28]
  - - [33712, 3864, 1, 1024, 33712, 33712, 1024, 1024]
    - [8, 10806.1]
  - - [33712, 6336, 1, 1024, 33712, 33712, 1024, 1024]
    - [8, 9886.14]
  - - [1024, 6536, 1, 4096, 1024, 1024, 4096, 4096]
    - [9, 8878.02]
  - - [1024, 7840, 1, 4096, 1024, 1024, 4096, 4096]
    - [4, 9003.39]
  - - [1024, 8056, 1, 4096, 1024, 1024, 4096, 4096]
    - [8, 9479.43]
  - - [1024, 3360, 1, 1024, 1024, 1024, 1024, 1024]
    - [8, 9116.14]
  - - [4096, 456, 1, 1024, 4096, 4096, 1024, 1024]
    - [0, 7466.42]
  - - [1024, 3360, 1, 4096, 1024, 1024, 4096, 4096]
    - [5, 9031.08]
  - - [33712, 3360, 1, 1024, 33712, 33712, 1024, 1024]
    - [8, 9120.59]
  - - [4096, 7992, 1, 1024, 4096, 4096, 1024, 1024]
    - [8, 10569.8]
  - - [1024, 5880, 1, 1024, 1024, 1024, 1024, 1024]
    - [8, 9320.37]
  - - [33712, 3072, 1, 1024, 33712, 33712, 1024, 1024]
    - [8, 10171.7]
  - - [1024, 5200, 1, 1024, 1024, 1024, 1024, 1024]
    - [8, 10178.8]
  - - [1024, 6608, 1, 4096, 1024, 1024, 4096, 4096]
    - [9, 9332.7]
  - - [4096, 5200, 1, 1024, 4096, 4096, 1024, 1024]
    - [8, 9299.67]
  - - [1024, 5200, 1, 4096, 1024, 1024, 4096, 4096]
    - [8, 10038.6]
  - - [33712, 5200, 1, 1024, 33712, 33712, 1024, 1024]
    - [8, 11035.4]
  - - [33712, 2560, 1, 1024, 33712, 33712, 1024, 1024]
    - [0, 9390.03]
  - - [1024, 280, 1, 1024, 1024, 1024, 1024, 1024]
    - [21, 5469.47]
  - - [33712, 7688, 1, 1024, 33712, 33712, 1024, 1024]
    - [4, 9307.72]
  - - [33712, 6960, 1, 1024, 33712, 33712, 1024, 1024]
    - [8, 9645.4]
  - - [4096, 2576, 1, 1024, 4096, 4096, 1024, 1024]
    - [8, 9422.09]
  - - [4096, 1760, 1, 1024, 4096, 4096, 1024, 1024]
    - [8, 10184.8]
  - - [1024, 1760, 1, 4096, 1024, 1024, 4096, 4096]
    - [8, 9739.76]
  - - [1024, 8024, 1, 1024, 1024, 1024, 1024, 1024]
    - [8, 9510.07]
  - - [1024, 7592, 1, 1024, 1024, 1024, 1024, 1024]
    - [8, 10264.0]
  - - [1024, 4888, 1, 4096, 1024, 1024, 4096, 4096]
    - [9, 9392.04]
  - - [33712, 320, 1, 1024, 33712, 33712, 1024, 1024]
    - [6, 8470.89]
  - - [1024, 292, 1, 1024, 1024, 1024, 1024, 1024]
    - [18, 5242.88]
  - - [1024, 5440, 1, 1024, 1024, 1024, 1024, 1024]
    - [0, 9329.19]
  - - [4096, 5440, 1, 1024, 4096, 4096, 1024, 1024]
    - [8, 10020.8]
  - - [1024, 5440, 1, 4096, 1024, 1024, 4096, 4096]
    - [8, 9692.18]
  - - [33712, 5440, 1, 1024, 33712, 33712, 1024, 1024]
    - [6, 9427.19]
  - - [4096, 332, 1, 1024, 4096, 4096, 1024, 1024]
    - [9, 7701.91]
  - - [1024, 3200, 1, 1024, 1024, 1024, 1024, 1024]
    - [8, 8710.89]
  - - [4096, 3200, 1, 1024, 4096, 4096, 1024, 1024]
    - [8, 10099.4]
  - - [33712, 6936, 1, 1024, 33712, 33712, 1024, 1024]
    - [8, 9472.02]
  - - [4096, 2944, 1, 1024, 4096, 4096, 1024, 1024]
    - [8, 10539.4]
  - - [4096, 7568, 1, 1024, 4096, 4096, 1024, 1024]
    - [8, 10605.4]
  - - [1024, 7056, 1, 1024, 1024, 1024, 1024, 1024]
    - [8, 10193.3]
  - - [1024, 7448, 1, 4096, 1024, 1024, 4096, 4096]
    - [9, 8994.74]
  - - [4096, 7056, 1, 1024, 4096, 4096, 1024, 1024]
    - [8, 10509.0]
  - - [1024, 316, 1, 1024, 1024, 1024, 1024, 1024]
    - [18, 6090.99]
  - - [1024, 4872, 1, 1024, 1024, 1024, 1024, 1024]
    - [0, 9454.86]
  - - [33712, 4488, 1, 1024, 33712, 33712, 1024, 1024]
    - [8, 10993.8]
  - - [4096, 7504, 1, 1024, 4096, 4096, 1024, 1024]
    - [8, 10513.5]
  - - [33712, 280, 1, 1024, 33712, 33712, 1024, 1024]
    - [7, 8459.25]
  - - [1024, 7520, 1, 1024, 1024, 1024, 1024, 1024]
    - [8, 10090.7]
  - - [1024, 7728, 1, 1024, 1024, 1024, 1024, 1024]
    - [0, 9564.89]
  - - [33712, 7520, 1, 1024, 33712, 33712, 1024, 1024]
    - [8, 10133.0]
  - - [4096, 5880, 1, 1024, 4096, 4096, 1024, 1024]
    - [8, 10474.3]
  - - [1024, 13312, 1, 1024, 1024, 1024, 1024, 1024]
    - [4, 9343.61]
  - - [1024, 464, 1, 1024, 1024, 1024, 1024, 1024]
    - [10, 6308.86]
  - - [1024, 5600, 1, 1024, 1024, 1024, 1024, 1024]
    - [0, 9344.38]
  - - [1024, 2576, 1, 4096, 1024, 1024, 4096, 4096]
    - [6, 8708.25]
  - - [4096, 6032, 1, 1024, 4096, 4096, 1024, 1024]
    - [6, 9219.57]
  - - [33712, 5952, 1, 1024, 33712, 33712, 1024, 1024]
    - [8, 10503.3]
  - - [1024, 7400, 1, 4096, 1024, 1024, 4096, 4096]
    - [9, 9583.82]
  - - [1024, 6840, 1, 1024, 1024, 1024, 1024, 1024]
    - [8, 9392.67]
  - - [4096, 6840, 1, 1024, 4096, 4096, 1024, 1024]
    - [8, 10759.8]
  - - [1024, 6840, 1, 4096, 1024, 1024, 4096, 4096]
    - [9, 10000.3]
  - - [1024, 6232, 1, 1024, 1024, 1024, 1024, 1024]
    - [9, 9063.9]
  - - [1024, 6232, 1, 4096, 1024, 1024, 4096, 4096]
    - [0, 8760.37]
  - - [4096, 7248, 1, 1024, 4096, 4096, 1024, 1024]
    - [8, 10780.8]
  - - [33712, 7536, 1, 1024, 33712, 33712, 1024, 1024]
    - [8, 10224.2]
  - - [33712, 7616, 1, 1024, 33712, 33712, 1024, 1024]
    - [8, 10420.1]
  - - [1024, 6864, 1, 1024, 1024, 1024, 1024, 1024]
    - [4, 9054.71]
  - - [4096, 6864, 1, 1024, 4096, 4096, 1024, 1024]
    - [8, 10857.5]
  - - [1024, 6864, 1, 4096, 1024, 1024, 4096, 4096]
    - [9, 9950.24]
  - - [1024, 3384, 1, 4096, 1024, 1024, 4096, 4096]
    - [8, 9516.63]
  - - [33712, 6080, 1, 1024, 33712, 33712, 1024, 1024]
    - [8, 10172.6]
  - - [1024, 4624, 1, 4096, 1024, 1024, 4096, 4096]
    - [8, 8587.68]
  - - [4096, 4032, 1, 1024, 4096, 4096, 1024, 1024]
    - [8, 10533.3]
  - - [1024, 6192, 1, 1024, 1024, 1024, 1024, 1024]
    - [8, 9119.05]
  - - [1024, 7544, 1, 1024, 1024, 1024, 1024, 1024]
    - [8, 9472.21]
  - - [1024, 7544, 1, 4096, 1024, 1024, 4096, 4096]
    - [9, 9104.59]
  - - [1024, 7440, 1, 4096, 1024, 1024, 4096, 4096]
    - [9, 8688.67]
  - - [4096, 7176, 1, 1024, 4096, 4096, 1024, 1024]
    - [8, 10707.2]
  - - [1024, 4960, 1, 1024, 1024, 1024, 1024, 1024]
    - [0, 8640.56]
  - - [33712, 264, 1, 1024, 33712, 33712, 1024, 1024]
    - [8, 7570.9]
  - - [33712, 6784, 1, 1024, 33712, 33712, 1024, 1024]
    - [4, 9492.65]
  - - [1024, 4400, 1, 4096, 1024, 1024, 4096, 4096]
    - [4, 9115.14]
  - - [1024, 7952, 1, 1024, 1024, 1024, 1024, 1024]
    - [9, 9979.72]
  - - [1024, 2576, 1, 1024, 1024, 1024, 1024, 1024]
    - [6, 8998.96]
  - - [33712, 2576, 1, 1024, 33712, 33712, 1024, 1024]
    - [8, 9547.82]
  - - [33712, 1824, 1, 1024, 33712, 33712, 1024, 1024]
    - [8, 8702.19]
  - - [33712, 6840, 1, 1024, 33712, 33712, 1024, 1024]
    - [8, 9428.08]
  - - [4096, 5032, 1, 1024, 4096, 4096, 1024, 1024]
    - [8, 10272.6]
  - - [4096, 5304, 1, 1024, 4096, 4096, 1024, 1024]
    - [8, 9776.12]
  - - [33712, 5040, 1, 1024, 33712, 33712, 1024, 1024]
    - [8, 10985.6]
  - - [1024, 268, 1, 1024, 1024, 1024, 1024, 1024]
    - [18, 5454.55]
  - - [1024, 1824, 1, 1024, 1024, 1024, 1024, 1024]
    - [0, 8987.77]
  - - [4096, 3952, 1, 1024, 4096, 4096, 1024, 1024]
    - [8, 10420.3]
  - - [1024, 3952, 1, 4096, 1024, 1024, 4096, 4096]
    - [0, 8826.7]
  - - [33712, 3952, 1, 1024, 33712, 33712, 1024, 1024]
    - [8, 11239.5]
  - - [33712, 7440, 1, 1024, 33712, 33712, 1024, 1024]
    - [8, 10036.0]
  - - [1024, 1472, 1, 4096, 1024, 1024, 4096, 4096]
    - [4, 8270.82]
  - - [1024, 3000, 1, 1024, 1024, 1024, 1024, 1024]
    - [8, 8783.0]
  - - [1024, 3000, 1, 4096, 1024, 1024, 4096, 4096]
    - [20, 8147.0]
  - - [1024, 7520, 1, 4096, 1024, 1024, 4096, 4096]
    - [9, 9129.22]
  - - [1024, 3888, 1, 4096, 1024, 1024, 4096, 4096]
    - [0, 8710.48]
  - - [4096, 360, 1, 1024, 4096, 4096, 1024, 1024]
    - [8, 8358.86]
  - - [1024, 444, 1, 1024, 1024, 1024, 1024, 1024]
    - [21, 7972.05]
  - - [1024, 5208, 1, 1024, 1024, 1024, 1024, 1024]
    - [0, 9263.42]
  - - [1024, 5208, 1, 4096, 1024, 1024, 4096, 4096]
    - [8, 9475.25]
  - - [4096, 2584, 1, 1024, 4096, 4096, 1024, 1024]
    - [8, 9389.12]
  - - [33712, 288, 1, 1024, 33712, 33712, 1024, 1024]
    - [7, 7626.14]
  - - [1024, 968, 1, 4096, 1024, 1024, 4096, 4096]
    - [1, 6478.29]
  - - [33712, 4872, 1, 1024, 33712, 33712, 1024, 1024]
    - [8, 10952.4]
  - - [4096, 380, 1, 1024, 4096, 4096, 1024, 1024]
    - [8, 8930.03]
  - - [1024, 4968, 1, 1024, 1024, 1024, 1024, 1024]
    - [8, 9682.73]
  - - [4096, 4968, 1, 1024, 4096, 4096, 1024, 1024]
    - [8, 10706.0]
  - - [1024, 15360, 1, 4096, 1024, 1024, 4096, 4096]
    - [4, 9374.14]
  - - [4096, 2992, 1, 1024, 4096, 4096, 1024, 1024]
    - [8, 9393.77]
  - - [1024, 6880, 1, 4096, 1024, 1024, 4096, 4096]
    - [8, 10070.3]
  - - [1024, 5680, 1, 1024, 1024, 1024, 1024, 1024]
    - [8, 9133.68]
  - - [4096, 5680, 1, 1024, 4096, 4096, 1024, 1024]
    - [6, 9302.89]
  - - [1024, 2184, 1, 4096, 1024, 1024, 4096, 4096]
    - [0, 8196.44]
  - - [33712, 6448, 1, 1024, 33712, 33712, 1024, 1024]
    - [8, 9817.55]
  - - [1024, 6400, 1, 1024, 1024, 1024, 1024, 1024]
    - [4, 9015.14]
  - - [4096, 6400, 1, 1024, 4096, 4096, 1024, 1024]
    - [8, 10145.2]
  - - [1024, 3456, 1, 1024, 1024, 1024, 1024, 1024]
    - [8, 9396.05]
  - - [1024, 6400, 1, 4096, 1024, 1024, 4096, 4096]
    - [9, 8912.65]
  - - [1024, 8136, 1, 1024, 1024, 1024, 1024, 1024]
    - [8, 9003.71]
  - - [1024, 1952, 1, 1024, 1024, 1024, 1024, 1024]
    - [0, 8030.51]
  - - [1024, 5792, 1, 1024, 1024, 1024, 1024, 1024]
    - [8, 9297.82]
  - - [1024, 7448, 1, 1024, 1024, 1024, 1024, 1024]
    - [8, 9464.1]
  - - [4096, 7448, 1, 1024, 4096, 4096, 1024, 1024]
    - [8, 10453.2]
  - - [1024, 3072, 1, 4096, 1024, 1024, 4096, 4096]
    - [0, 8272.25]
  - - [1024, 488, 1, 1024, 1024, 1024, 1024, 1024]
    - [17, 5726.33]
  - - [33712, 5600, 1, 1024, 33712, 33712, 1024, 1024]
    - [8, 10951.1]
  - - [4096, 4872, 1, 1024, 4096, 4096, 1024, 1024]
    - [8, 10533.7]
  - - [1024, 3040, 1, 1024, 1024, 1024, 1024, 1024]
    - [8, 8229.2]
  - - [1024, 3328, 1, 1024, 1024, 1024, 1024, 1024]
    - [8, 9078.18]
  - - [4096, 228, 1, 1024, 4096, 4096, 1024, 1024]
    - [21, 6361.77]
  - - [1024, 6320, 1, 1024, 1024, 1024, 1024, 1024]
    - [0, 8700.48]
  - - [4096, 6320, 1, 1024, 4096, 4096, 1024, 1024]
    - [8, 9989.12]
  - - [33712, 6320, 1, 1024, 33712, 33712, 1024, 1024]
    - [8, 9907.75]
  - - [4096, 384, 1, 1024, 4096, 4096, 1024, 1024]
    - [8, 9355.3]
  - - [4096, 5704, 1, 1024, 4096, 4096, 1024, 1024]
    - [6, 9114.69]
  - - [4096, 10752, 1, 1024, 4096, 4096, 1024, 1024]
    - [8, 10672.5]
  - - [33712, 8136, 1, 1024, 33712, 33712, 1024, 1024]
    - [8, 10765.1]
  - - [1024, 2600, 1, 1024, 1024, 1024, 1024, 1024]
    - [6, 9651.28]
  - - [4096, 2600, 1, 1024, 4096, 4096, 1024, 1024]
    - [8, 10226.9]
  - - [33712, 324, 1, 1024, 33712, 33712, 1024, 1024]
    - [9, 8215.42]
  - - [4096, 7296, 1, 1024, 4096, 4096, 1024, 1024]
    - [8, 10881.9]
  - - [4096, 1472, 1, 1024, 4096, 4096, 1024, 1024]
    - [20, 8914.75]
  - - [33712, 8040, 1, 1024, 33712, 33712, 1024, 1024]
    - [8, 10788.5]
  - - [33712, 256, 1, 1024, 33712, 33712, 1024, 1024]
    - [1, 9537.83]
  - - [1024, 6072, 1, 1024, 1024, 1024, 1024, 1024]
    - [0, 9559.96]
  - - [4096, 6072, 1, 1024, 4096, 4096, 1024, 1024]
    - [0, 9378.59]
  - - [1024, 6072, 1, 4096, 1024, 1024, 4096, 4096]
    - [6, 8994.12]
  - - [1024, 6960, 1, 4096, 1024, 1024, 4096, 4096]
    - [9, 9377.66]
  - - [1024, 5152, 1, 4096, 1024, 1024, 4096, 4096]
    - [8, 9314.22]
  - - [4096, 260, 1, 1024, 4096, 4096, 1024, 1024]
    - [21, 6791.95]
  - - [4096, 952, 1, 1024, 4096, 4096, 1024, 1024]
    - [0, 8441.08]
  - - [1024, 6696, 1, 4096, 1024, 1024, 4096, 4096]
    - [9, 9838.09]
  - - [1024, 4488, 1, 1024, 1024, 1024, 1024, 1024]
    - [0, 8462.81]
  - - [4096, 4488, 1, 1024, 4096, 4096, 1024, 1024]
    - [8, 9922.4]
  - - [1024, 7632, 1, 4096, 1024, 1024, 4096, 4096]
    - [4, 8895.85]
  - - [4096, 7952, 1, 1024, 4096, 4096, 1024, 1024]
    - [8, 9827.75]
  - - [1024, 6208, 1, 4096, 1024, 1024, 4096, 4096]
    - [6, 9056.63]
  - - [1024, 7952, 1, 4096, 1024, 1024, 4096, 4096]
    - [9, 9402.42]
  - - [1024, 3520, 1, 1024, 1024, 1024, 1024, 1024]
    - [8, 10878.9]
  - - [33712, 7832, 1, 1024, 33712, 33712, 1024, 1024]
    - [8, 10566.0]
  - - [1024, 5832, 1, 1024, 1024, 1024, 1024, 1024]
    - [4, 8785.31]
  - - [4096, 5832, 1, 1024, 4096, 4096, 1024, 1024]
    - [0, 9591.69]
  - - [33712, 7544, 1, 1024, 33712, 33712, 1024, 1024]
    - [8, 10577.0]
  - - [1024, 4440, 1, 1024, 1024, 1024, 1024, 1024]
    - [4, 9577.99]
  - - [1024, 6000, 1, 1024, 1024, 1024, 1024, 1024]
    - [0, 8795.77]
  - - [33712, 6880, 1, 1024, 33712, 33712, 1024, 1024]
    - [8, 9613.35]
  - - [1024, 7848, 1, 4096, 1024, 1024, 4096, 4096]
    - [9, 9335.03]
  - - [4096, 4224, 1, 1024, 4096, 4096, 1024, 1024]
    - [8, 10635.8]
  - - [1024, 4224, 1, 4096, 1024, 1024, 4096, 4096]
    - [4, 8905.37]
  - - [1024, 10752, 1, 1024, 1024, 1024, 1024, 1024]
    - [8, 10640.9]
  - - [33712, 236, 1, 1024, 33712, 33712, 1024, 1024]
    - [9, 8882.42]
  - - [1024, 5880, 1, 4096, 1024, 1024, 4096, 4096]
    - [6, 9145.35]
  - - [1024, 11264, 1, 1024, 1024, 1024, 1024, 1024]
    - [6, 9484.11]
  - - [1024, 3072, 1, 1024, 1024, 1024, 1024, 1024]
    - [8, 9011.91]
  - - [1024, 3168, 1, 1024, 1024, 1024, 1024, 1024]
    - [0, 8419.2]
  - - [1024, 2944, 1, 4096, 1024, 1024, 4096, 4096]
    - [8, 8288.58]
  - - [1024, 5512, 1, 4096, 1024, 1024, 4096, 4096]
    - [0, 8567.14]
  - - [4096, 276, 1, 1024, 4096, 4096, 1024, 1024]
    - [20, 7209.94]
  - - [1024, 3384, 1, 1024, 1024, 1024, 1024, 1024]
    - [8, 9186.96]
  - - [1024, 4752, 1, 1024, 1024, 1024, 1024, 1024]
    - [0, 8626.77]
  - - [4096, 4752, 1, 1024, 4096, 4096, 1024, 1024]
    - [8, 10237.5]
  - - [4096, 6232, 1, 1024, 4096, 4096, 1024, 1024]
    - [8, 9825.74]
  - - [1024, 4752, 1, 4096, 1024, 1024, 4096, 4096]
    - [9, 8749.77]
  - - [4096, 6392, 1, 1024, 4096, 4096, 1024, 1024]
    - [8, 9782.36]
  - - [1024, 6392, 1, 4096, 1024, 1024, 4096, 4096]
    - [9, 8833.0]
  - - [1024, 6832, 1, 4096, 1024, 1024, 4096, 4096]
    - [9, 9220.12]
  - - [1024, 3128, 1, 4096, 1024, 1024, 4096, 4096]
    - [9, 8635.5]
  - - [33712, 7344, 1, 1024, 33712, 33712, 1024, 1024]
    - [8, 10084.9]
  - - [33712, 4816, 1, 1024, 33712, 33712, 1024, 1024]
    - [8, 11156.9]
  - - [4096, 2304, 1, 1024, 4096, 4096, 1024, 1024]
    - [8, 10819.1]
  - - [1024, 16384, 1, 1024, 1024, 1024, 1024, 1024]
    - [8, 9982.7]
  - - [1024, 4432, 1, 4096, 1024, 1024, 4096, 4096]
    - [0, 9016.83]
  - - [4096, 3888, 1, 1024, 4096, 4096, 1024, 1024]
    - [8, 10260.4]
  - - [1024, 7808, 1, 1024, 1024, 1024, 1024, 1024]
    - [8, 9694.11]
  - - [1024, 7480, 1, 1024, 1024, 1024, 1024, 1024]
    - [9, 8996.29]
  - - [33712, 5520, 1, 1024, 33712, 33712, 1024, 1024]
    - [8, 10662.5]
  - - [1024, 2592, 1, 1024, 1024, 1024, 1024, 1024]
    - [4, 9516.47]
  - - [4096, 2592, 1, 1024, 4096, 4096, 1024, 1024]
    - [8, 10195.4]
  - - [1024, 2592, 1, 4096, 1024, 1024, 4096, 4096]
    - [9, 8169.72]
  - - [4096, 484, 1, 1024, 4096, 4096, 1024, 1024]
    - [12, 7323.37]
  - - [33712, 3536, 1, 1024, 33712, 33712, 1024, 1024]
    - [6, 9107.68]
  - - [4096, 220, 1, 1024, 4096, 4096, 1024, 1024]
    - [15, 6948.4]
  - - [1024, 264, 1, 1024, 1024, 1024, 1024, 1024]
    - [18, 5356.5]
  - - [1024, 3672, 1, 1024, 1024, 1024, 1024, 1024]
    - [8, 9179.77]
  - - [1024, 3672, 1, 4096, 1024, 1024, 4096, 4096]
    - [8, 8824.62]
  - - [1024, 3344, 1, 4096, 1024, 1024, 4096, 4096]
    - [8, 8759.5]
  - - [4096, 1512, 1, 1024, 4096, 4096, 1024, 1024]
    - [0, 8502.86]
  - - [33712, 6360, 1, 1024, 33712, 33712, 1024, 1024]
    - [8, 9954.69]
  - - [1024, 3904, 1, 4096, 1024, 1024, 4096, 4096]
    - [6, 8143.28]
  - - [1024, 7248, 1, 1024, 1024, 1024, 1024, 1024]
    - [8, 9301.03]
  - - [1024, 400, 1, 1024, 1024, 1024, 1024, 1024]
    - [21, 7767.23]
  - - [4096, 5760, 1, 1024, 4096, 4096, 1024, 1024]
    - [0, 9532.78]
  - - [1024, 452, 1, 1024, 1024, 1024, 1024, 1024]
    - [11, 5819.7]
  - - [1024, 3888, 1, 1024, 1024, 1024, 1024, 1024]
    - [0, 9284.15]
  - - [1024, 5624, 1, 1024, 1024, 1024, 1024, 1024]
    - [0, 8877.01]
  - - [1024, 1960, 1, 1024, 1024, 1024, 1024, 1024]
    - [0, 8577.65]
  - - [4096, 1960, 1, 1024, 4096, 4096, 1024, 1024]
    - [8, 9139.11]
  - - [33712, 7056, 1, 1024, 33712, 33712, 1024, 1024]
    - [8, 9566.69]
  - - [33712, 232, 1, 1024, 33712, 33712, 1024, 1024]
    - [9, 7643.22]
  - - [33712, 5824, 1, 1024, 33712, 33712, 1024, 1024]
    - [8, 10632.6]
  - - [33712, 2584, 1, 1024, 33712, 33712, 1024, 1024]
    - [8, 9733.05]
  - - [1024, 344, 1, 1024, 1024, 1024, 1024, 1024]
    - [20, 6515.72]
  - - [1024, 6032, 1, 1024, 1024, 1024, 1024, 1024]
    - [0, 9519.85]
  - - [1024, 7760, 1, 4096, 1024, 1024, 4096, 4096]
    - [9, 9304.87]
  - - [1024, 336, 1, 1024, 1024, 1024, 1024, 1024]
    - [21, 6514.82]
  - - [1024, 5400, 1, 4096, 1024, 1024, 4096, 4096]
    - [9, 9099.27]
  - - [33712, 7632, 1, 1024, 33712, 33712, 1024, 1024]
    - [8, 10497.0]
  - - [1024, 7760, 1, 1024, 1024, 1024, 1024, 1024]
    - [4, 9078.96]
  - - [33712, 5208, 1, 1024, 33712, 33712, 1024, 1024]
    - [8, 11031.0]
  - - [1024, 4736, 1, 1024, 1024, 1024, 1024, 1024]
    - [8, 8673.4]
  - - [4096, 4736, 1, 1024, 4096, 4096, 1024, 1024]
    - [8, 9571.43]
  - - [1024, 4736, 1, 4096, 1024, 1024, 4096, 4096]
    - [8, 8790.39]
  - - [1024, 384, 1, 1024, 1024, 1024, 1024, 1024]
    - [12, 7129.13]
  - - [33712, 492, 1, 1024, 33712, 33712, 1024, 1024]
    - [0, 9314.44]
  - - [1024, 6968, 1, 1024, 1024, 1024, 1024, 1024]
    - [9, 9707.77]
  - - [33712, 6968, 1, 1024, 33712, 33712, 1024, 1024]
    - [8, 9603.1]
  - - [1024, 4576, 1, 4096, 1024, 1024, 4096, 4096]
    - [8, 8523.59]
  - - [4096, 7832, 1, 1024, 4096, 4096, 1024, 1024]
    - [8, 10411.8]
  - - [4096, 2352, 1, 1024, 4096, 4096, 1024, 1024]
    - [6, 9343.96]
  - - [1024, 5888, 1, 4096, 1024, 1024, 4096, 4096]
    - [6, 8715.9]
  - - [1024, 4352, 1, 4096, 1024, 1024, 4096, 4096]
    - [0, 8711.42]
  - - [1024, 6360, 1, 1024, 1024, 1024, 1024, 1024]
    - [0, 9266.51]
  - - [4096, 240, 1, 1024, 4096, 4096, 1024, 1024]
    - [0, 6612.12]
  - - [1024, 504, 1, 1024, 1024, 1024, 1024, 1024]
    - [0, 6202.84]
  - - [1024, 4032, 1, 4096, 1024, 1024, 4096, 4096]
    - [0, 8875.32]
  - - [33712, 408, 1, 1024, 33712, 33712, 1024, 1024]
    - [0, 8249.32]
  - - [4096, 7704, 1, 1024, 4096, 4096, 1024, 1024]
    - [8, 10667.1]
  - - [4096, 6192, 1, 1024, 4096, 4096, 1024, 1024]
    - [6, 9207.24]
  - - [1024, 7704, 1, 4096, 1024, 1024, 4096, 4096]
    - [0, 8699.53]
  - - [33712, 7704, 1, 1024, 33712, 33712, 1024, 1024]
    - [8, 10474.2]
  - - [4096, 412, 1, 1024, 4096, 4096, 1024, 1024]
    - [7, 8702.91]
  - - [4096, 3864, 1, 1024, 4096, 4096, 1024, 1024]
    - [8, 9481.18]
  - - [1024, 4032, 1, 1024, 1024, 1024, 1024, 1024]
    - [0, 9089.79]
  - - [33712, 3120, 1, 1024, 33712, 33712, 1024, 1024]
    - [8, 9883.56]
  - - [1024, 1144, 1, 4096, 1024, 1024, 4096, 4096]
    - [12, 6924.31]
  - - [4096, 968, 1, 1024, 4096, 4096, 1024, 1024]
    - [0, 7553.35]
  - - [4096, 5424, 1, 1024, 4096, 4096, 1024, 1024]
    - [8, 9363.62]
  - - [1024, 4960, 1, 4096, 1024, 1024, 4096, 4096]
    - [9, 9676.5]
  - - [4096, 7632, 1, 1024, 4096, 4096, 1024, 1024]
    - [8, 9969.99]
  - - [33712, 4368, 1, 1024, 33712, 33712, 1024, 1024]
    - [8, 9905.75]
  - - [1024, 952, 1, 1024, 1024, 1024, 1024, 1024]
    - [0, 8182.3]
  - - [1024, 1320, 1, 1024, 1024, 1024, 1024, 1024]
    - [0, 8510.31]
  - - [4096, 424, 1, 1024, 4096, 4096, 1024, 1024]
    - [6, 8319.52]
  - - [33712, 7072, 1, 1024, 33712, 33712, 1024, 1024]
    - [8, 9538.84]
  - - [4096, 4096, 1, 1024, 4096, 4096, 1024, 1024]
    - [8, 9454.01]
  - - [4096, 208, 1, 1024, 4096, 4096, 1024, 1024]
    - [15, 6479.61]
  - - [1024, 364, 1, 1024, 1024, 1024, 1024, 1024]
    - [20, 7089.18]
  - - [4096, 7224, 1, 1024, 4096, 4096, 1024, 1024]
    - [8, 10598.4]
  - - [4096, 504, 1, 1024, 4096, 4096, 1024, 1024]
    - [0, 8088.17]
  - - [33712, 496, 1, 1024, 33712, 33712, 1024, 1024]
    - [9, 9694.71]
  - - [1024, 4872, 1, 4096, 1024, 1024, 4096, 4096]
    - [8, 8934.01]
  - - [33712, 6528, 1, 1024, 33712, 33712, 1024, 1024]
    - [8, 9765.32]
  - - [1024, 6512, 1, 4096, 1024, 1024, 4096, 4096]
    - [8, 8562.57]
  - - [1024, 3864, 1, 4096, 1024, 1024, 4096, 4096]
    - [0, 8701.33]
  - - [1024, 6976, 1, 1024, 1024, 1024, 1024, 1024]
    - [8, 9598.53]
  - - [1024, 4480, 1, 1024, 1024, 1024, 1024, 1024]
    - [8, 8832.74]
  - - [4096, 4480, 1, 1024, 4096, 4096, 1024, 1024]
    - [8, 10631.4]
  - - [4096, 4440, 1, 1024, 4096, 4096, 1024, 1024]
    - [8, 10531.7]
  - - [1024, 6800, 1, 1024, 1024, 1024, 1024, 1024]
    - [8, 10075.6]
  - - [1024, 6784, 1, 1024, 1024, 1024, 1024, 1024]
    - [8, 10059.8]
  - - [4096, 6784, 1, 1024, 4096, 4096, 1024, 1024]
    - [8, 10043.9]
  - - [33712, 8000, 1, 1024, 33712, 33712, 1024, 1024]
    - [8, 10709.2]
  - - [4096, 6656, 1, 1024, 4096, 4096, 1024, 1024]
    - [8, 9846.92]
  - - [4096, 2240, 1, 1024, 4096, 4096, 1024, 1024]
    - [8, 10458.7]
  - - [33712, 2240, 1, 1024, 33712, 33712, 1024, 1024]
    - [0, 8580.3]
  - - [33712, 7808, 1, 1024, 33712, 33712, 1024, 1024]
    - [8, 10836.8]
  - - [4096, 7480, 1, 1024, 4096, 4096, 1024, 1024]
    - [8, 10512.7]
  - - [33712, 376, 1, 1024, 33712, 33712, 1024, 1024]
    - [5, 9080.4]
  - - [33712, 420, 1, 1024, 33712, 33712, 1024, 1024]
    - [0, 9077.19]
  - - [4096, 4576, 1, 1024, 4096, 4096, 1024, 1024]
    - [8, 10861.7]
  - - [1024, 1472, 1, 1024, 1024, 1024, 1024, 1024]
    - [1, 7650.18]
  - - [33712, 7696, 1, 1024, 33712, 33712, 1024, 1024]
    - [8, 10555.4]
  - - [1024, 7504, 1, 4096, 1024, 1024, 4096, 4096]
    - [9, 9016.47]
  - - [1024, 6976, 1, 4096, 1024, 1024, 4096, 4096]
    - [9, 9927.05]
  - - [1024, 5264, 1, 1024, 1024, 1024, 1024, 1024]
    - [8, 10302.5]
  - - [4096, 2720, 1, 1024, 4096, 4096, 1024, 1024]
    - [8, 9623.83]
  - - [1024, 7896, 1, 1024, 1024, 1024, 1024, 1024]
    - [8, 8716.77]
  - - [1024, 2720, 1, 4096, 1024, 1024, 4096, 4096]
    - [0, 8621.36]
  - - [4096, 5376, 1, 1024, 4096, 4096, 1024, 1024]
    - [8, 9933.27]
  - - [1024, 23040, 1, 4096, 1024, 1024, 4096, 4096]
    - [9, 9652.22]
  - - [33712, 332, 1, 1024, 33712, 33712, 1024, 1024]
    - [9, 9161.15]
  - - [4096, 3072, 1, 1024, 4096, 4096, 1024, 1024]
    - [8, 9959.24]
  - - [4096, 488, 1, 1024, 4096, 4096, 1024, 1024]
    - [0, 8421.73]
  - - [1024, 6000, 1, 4096, 1024, 1024, 4096, 4096]
    - [0, 8907.6]
  - - [1024, 408, 1, 1024, 1024, 1024, 1024, 1024]
    - [13, 7864.32]
  - - [1024, 5040, 1, 4096, 1024, 1024, 4096, 4096]
    - [0, 9260.55]
  - - [4096, 328, 1, 1024, 4096, 4096, 1024, 1024]
    - [1, 6970.65]
  - - [1024, 3680, 1, 1024, 1024, 1024, 1024, 1024]
    - [8, 8766.7]
  - - [1024, 3680, 1, 4096, 1024, 1024, 4096, 4096]
    - [0, 9123.2]
  - - [1024, 4432, 1, 1024, 1024, 1024, 1024, 1024]
    - [4, 9078.13]
  - - [1024, 5808, 1, 4096, 1024, 1024, 4096, 4096]
    - [0, 8824.46]
  - - [4096, 6112, 1, 1024, 4096, 4096, 1024, 1024]
    - [6, 9217.43]
  - - [4096, 5512, 1, 1024, 4096, 4096, 1024, 1024]
    - [6, 9119.18]
  - - [33712, 6112, 1, 1024, 33712, 33712, 1024, 1024]
    - [8, 9986.87]
  - - [1024, 3840, 1, 1024, 1024, 1024, 1024, 1024]
    - [4, 8939.88]
  - - [33712, 7504, 1, 1024, 33712, 33712, 1024, 1024]
    - [8, 10319.1]
  - - [1024, 4576, 1, 1024, 1024, 1024, 1024, 1024]
    - [8, 8918.72]
  - - [1024, 6160, 1, 4096, 1024, 1024, 4096, 4096]
    - [6, 9094.92]
  - - [33712, 5184, 1, 1024, 33712, 33712, 1024, 1024]
    - [8, 10968.1]
  - - [4096, 5056, 1, 1024, 4096, 4096, 1024, 1024]
    - [8, 10297.9]
  - - [1024, 3040, 1, 4096, 1024, 1024, 4096, 4096]
    - [5, 8311.59]
  - - [1024, 3528, 1, 1024, 1024, 1024, 1024, 1024]
    - [8, 9514.83]
  - - [4096, 7552, 1, 1024, 4096, 4096, 1024, 1024]
    - [8, 9853.2]
  - - [1024, 7552, 1, 4096, 1024, 1024, 4096, 4096]
    - [9, 9016.08]
  - - [33712, 7232, 1, 1024, 33712, 33712, 1024, 1024]
    - [8, 9733.87]
  - - [33712, 4752, 1, 1024, 33712, 33712, 1024, 1024]
    - [8, 11015.1]
  - - [1024, 340, 1, 1024, 1024, 1024, 1024, 1024]
    - [20, 6752.19]
  - - [1024, 7784, 1, 1024, 1024, 1024, 1024, 1024]
    - [0, 9446.87]
  - - [4096, 6728, 1, 1024, 4096, 4096, 1024, 1024]
    - [8, 9951.76]
  - - [1024, 7008, 1, 1024, 1024, 1024, 1024, 1024]
    - [8, 10353.4]
  - - [4096, 7008, 1, 1024, 4096, 4096, 1024, 1024]
    - [8, 10467.8]
  - - [1024, 7008, 1, 4096, 1024, 1024, 4096, 4096]
    - [8, 9623.62]
  - - [1024, 424, 1, 1024, 1024, 1024, 1024, 1024]
    - [21, 7927.89]
  - - [33712, 4864, 1, 1024, 33712, 33712, 1024, 1024]
    - [8, 10802.7]
  - - [1024, 6760, 1, 1024, 1024, 1024, 1024, 1024]
    - [0, 9536.59]
  - - [33712, 5920, 1, 1024, 33712, 33712, 1024, 1024]
    - [8, 10523.5]
  - - [1024, 6760, 1, 4096, 1024, 1024, 4096, 4096]
    - [9, 9276.01]
  - - [1024, 6144, 1, 1024, 1024, 1024, 1024, 1024]
    - [8, 9167.85]
  - - [1024, 6080, 1, 1024, 1024, 1024, 1024, 1024]
    - [0, 8926.03]
  - - [4096, 1144, 1, 1024, 4096, 4096, 1024, 1024]
    - [0, 9226.02]
  - - [1024, 5032, 1, 1024, 1024, 1024, 1024, 1024]
    - [9, 9709.3]
  - - [1024, 3696, 1, 4096, 1024, 1024, 4096, 4096]
    - [0, 8701.62]
  - - [4096, 6144, 1, 1024, 4096, 4096, 1024, 1024]
    - [8, 9708.89]
  - - [1024, 2352, 1, 4096, 1024, 1024, 4096, 4096]
    - [6, 8339.79]
  - - [33712, 244, 1, 1024, 33712, 33712, 1024, 1024]
    - [9, 8547.57]
  - - [1024, 1512, 1, 1024, 1024, 1024, 1024, 1024]
    - [8, 8538.58]
  - - [1024, 460, 1, 1024, 1024, 1024, 1024, 1024]
    - [17, 5780.74]
  - - [1024, 5424, 1, 1024, 1024, 1024, 1024, 1024]
    - [8, 9315.16]
  - - [1024, 5264, 1, 4096, 1024, 1024, 4096, 4096]
    - [8, 9664.0]
  - - [1024, 5304, 1, 1024, 1024, 1024, 1024, 1024]
    - [8, 10379.3]
  - - [4096, 6992, 1, 1024, 4096, 4096, 1024, 1024]
    - [8, 10639.1]
  - - [4096, 8032, 1, 1024, 4096, 4096, 1024, 1024]
    - [8, 10606.2]
  - - [33712, 8032, 1, 1024, 33712, 33712, 1024, 1024]
    - [8, 10783.1]
  - - [1024, 4816, 1, 4096, 1024, 1024, 4096, 4096]
    - [8, 9512.37]
  - - [1024, 9216, 1, 1024, 1024, 1024, 1024, 1024]
    - [8, 10743.1]
  - - [4096, 6832, 1, 1024, 4096, 4096, 1024, 1024]
    - [8, 10797.7]
  - - [1024, 6576, 1, 4096, 1024, 1024, 4096, 4096]
    - [9, 9557.85]
  - - [33712, 2976, 1, 1024, 33712, 33712, 1024, 1024]
    - [8, 9836.4]
  - - [4096, 2664, 1, 1024, 4096, 4096, 1024, 1024]
    - [8, 9737.17]
  - - [1024, 6112, 1, 1024, 1024, 1024, 1024, 1024]
    - [0, 8670.96]
  - - [1024, 7568, 1, 4096, 1024, 1024, 4096, 4096]
    - [0, 9045.07]
  - - [1024, 4704, 1, 1024, 1024, 1024, 1024, 1024]
    - [8, 9201.03]
  - - [33712, 404, 1, 1024, 33712, 33712, 1024, 1024]
    - [6, 8185.32]
  - - [1024, 4704, 1, 4096, 1024, 1024, 4096, 4096]
    - [8, 9031.88]
  - - [33712, 7776, 1, 1024, 33712, 33712, 1024, 1024]
    - [8, 10626.2]
  - - [1024, 6408, 1, 1024, 1024, 1024, 1024, 1024]
    - [8, 8784.72]
  - - [4096, 6408, 1, 1024, 4096, 4096, 1024, 1024]
    - [8, 9702.06]
  - - [33712, 6864, 1, 1024, 33712, 33712, 1024, 1024]
    - [8, 9588.39]
  - - [1024, 6408, 1, 4096, 1024, 1024, 4096, 4096]
    - [6, 8719.51]
  - - [4096, 7416, 1, 1024, 4096, 4096, 1024, 1024]
    - [8, 10600.1]
  - - [1024, 7416, 1, 4096, 1024, 1024, 4096, 4096]
    - [9, 9444.03]
  - - [1024, 9216, 1, 4096, 1024, 1024, 4096, 4096]
    - [8, 9320.11]
  - - [1024, 3240, 1, 4096, 1024, 1024, 4096, 4096]
    - [8, 9093.14]
  - - [1024, 476, 1, 1024, 1024, 1024, 1024, 1024]
    - [11, 5814.56]
  - - [1024, 7784, 1, 4096, 1024, 1024, 4096, 4096]
    - [4, 9091.62]
  - - [1024, 1952, 1, 4096, 1024, 1024, 4096, 4096]
    - [0, 7513.45]
  - - [33712, 6888, 1, 1024, 33712, 33712, 1024, 1024]
    - [8, 9653.07]
  - - [4096, 5600, 1, 1024, 4096, 4096, 1024, 1024]
    - [8, 9549.22]
  - - [1024, 6832, 1, 1024, 1024, 1024, 1024, 1024]
    - [8, 9426.12]
  - - [1024, 2304, 1, 4096, 1024, 1024, 4096, 4096]
    - [6, 8737.48]
  - - [33712, 336, 1, 1024, 33712, 33712, 1024, 1024]
    - [5, 8207.19]
  - - [4096, 232, 1, 1024, 4096, 4096, 1024, 1024]
    - [18, 6550.05]
  - - [4096, 436, 1, 1024, 4096, 4096, 1024, 1024]
    - [6, 8488.27]
  - - [33712, 6832, 1, 1024, 33712, 33712, 1024, 1024]
    - [8, 9605.72]
  - - [33712, 6232, 1, 1024, 33712, 33712, 1024, 1024]
    - [8, 9937.49]
  - - [4096, 7392, 1, 1024, 4096, 4096, 1024, 1024]
    - [8, 10568.4]
  - - [4096, 5624, 1, 1024, 4096, 4096, 1024, 1024]
    - [8, 9557.51]
  - - [1024, 5624, 1, 4096, 1024, 1024, 4096, 4096]
    - [0, 8885.3]
  - - [4096, 6216, 1, 1024, 4096, 4096, 1024, 1024]
    - [8, 9844.63]
  - - [4096, 4352, 1, 1024, 4096, 4096, 1024, 1024]
    - [8, 10360.5]
  - - [33712, 4352, 1, 1024, 33712, 33712, 1024, 1024]
    - [8, 11316.9]
  - - [33712, 476, 1, 1024, 33712, 33712, 1024, 1024]
    - [0, 9038.9]
  - - [1024, 320, 1, 1024, 1024, 1024, 1024, 1024]
    - [17, 6288.31]
  - - [33712, 208, 1, 1024, 33712, 33712, 1024, 1024]
    - [9, 7863.55]
  - - [33712, 5832, 1, 1024, 33712, 33712, 1024, 1024]
    - [8, 10634.9]
  - - [1024, 3808, 1, 4096, 1024, 1024, 4096, 4096]
    - [4, 8029.29]
  - - [33712, 3400, 1, 1024, 33712, 33712, 1024, 1024]
    - [8, 9383.64]
  - - [33712, 3808, 1, 1024, 33712, 33712, 1024, 1024]
    - [12, 9013.56]
  - - [4096, 248, 1, 1024, 4096, 4096, 1024, 1024]
    - [18, 6814.64]
  - - [33712, 212, 1, 1024, 33712, 33712, 1024, 1024]
    - [9, 8029.55]
  - - [4096, 4928, 1, 1024, 4096, 4096, 1024, 1024]
    - [8, 10651.3]
  - - [1024, 4928, 1, 4096, 1024, 1024, 4096, 4096]
    - [8, 9036.39]
  - - [1024, 6592, 1, 1024, 1024, 1024, 1024, 1024]
    - [8, 9048.32]
  - - [4096, 6592, 1, 1024, 4096, 4096, 1024, 1024]
    - [8, 9753.07]
  - - [1024, 6592, 1, 4096, 1024, 1024, 4096, 4096]
    - [9, 9595.47]
  - - [33712, 7360, 1, 1024, 33712, 33712, 1024, 1024]
    - [8, 10183.6]
  - - [4096, 3520, 1, 1024, 4096, 4096, 1024, 1024]
    - [8, 10349.3]
  - - [4096, 4888, 1, 1024, 4096, 4096, 1024, 1024]
    - [8, 10575.3]
  - - [33712, 2352, 1, 1024, 33712, 33712, 1024, 1024]
    - [4, 8945.55]
  - - [1024, 6392, 1, 1024, 1024, 1024, 1024, 1024]
    - [4, 9011.62]
  - - [1024, 4680, 1, 4096, 1024, 1024, 4096, 4096]
    - [8, 8653.67]
  - - [33712, 4032, 1, 1024, 33712, 33712, 1024, 1024]
    - [4, 9094.25]
  - - [1024, 6032, 1, 4096, 1024, 1024, 4096, 4096]
    - [0, 9136.99]
  - - [1024, 5056, 1, 1024, 1024, 1024, 1024, 1024]
    - [8, 9182.46]
  - - [1024, 3224, 1, 4096, 1024, 1024, 4096, 4096]
    - [5, 8693.17]
  - - [33712, 2720, 1, 1024, 33712, 33712, 1024, 1024]
    - [8, 9255.91]
  - - [33712, 7600, 1, 1024, 33712, 33712, 1024, 1024]
    - [8, 10398.3]
  - - [1024, 1072, 1, 1024, 1024, 1024, 1024, 1024]
    - [20, 7333.46]
  - - [1024, 1072, 1, 4096, 1024, 1024, 4096, 4096]
    - [0, 8068.26]
  - - [33712, 340, 1, 1024, 33712, 33712, 1024, 1024]
    - [5, 8313.36]
  - - [33712, 1072, 1, 1024, 33712, 33712, 1024, 1024]
    - [9, 9729.13]
  - - [1024, 512, 1, 1024, 1024, 1024, 1024, 1024]
    - [31, 5730.9]
  - - [4096, 512, 1, 1024, 4096, 4096, 1024, 1024]
    - [0, 8795.38]
  - - [1024, 6512, 1, 1024, 1024, 1024, 1024, 1024]
    - [8, 8911.45]
  - - [1024, 508, 1, 1024, 1024, 1024, 1024, 1024]
    - [17, 6014.87]
  - - [1024, 9728, 1, 1024, 1024, 1024, 1024, 1024]
    - [8, 10078.8]
  - - [4096, 508, 1, 1024, 4096, 4096, 1024, 1024]
    - [0, 8174.89]
  - - [33712, 468, 1, 1024, 33712, 33712, 1024, 1024]
    - [9, 8605.97]
  - - [33712, 5712, 1, 1024, 33712, 33712, 1024, 1024]
    - [8, 10545.9]
  - - [4096, 460, 1, 1024, 4096, 4096, 1024, 1024]
    - [12, 7466.63]
  - - [33712, 460, 1, 1024, 33712, 33712, 1024, 1024]
    - [9, 8482.36]
  - - [1024, 456, 1, 1024, 1024, 1024, 1024, 1024]
    - [10, 6318.06]
  - - [33712, 456, 1, 1024, 33712, 33712, 1024, 1024]
    - [9, 9027.37]
  - - [1024, 6432, 1, 1024, 1024, 1024, 1024, 1024]
    - [9, 9335.1]
  - - [4096, 440, 1, 1024, 4096, 4096, 1024, 1024]
    - [7, 8015.5]
  - - [33712, 424, 1, 1024, 33712, 33712, 1024, 1024]
    - [20, 8178.5]
  - - [4096, 6360, 1, 1024, 4096, 4096, 1024, 1024]
    - [8, 9766.74]
  - - [1024, 416, 1, 1024, 1024, 1024, 1024, 1024]
    - [21, 7800.57]
  - - [4096, 416, 1, 1024, 4096, 4096, 1024, 1024]
    - [7, 8302.37]
  - - [1024, 6808, 1, 1024, 1024, 1024, 1024, 1024]
    - [8, 10063.6]
  - - [4096, 392, 1, 1024, 4096, 4096, 1024, 1024]
    - [12, 7820.41]
  - - [4096, 17408, 1, 1024, 4096, 4096, 1024, 1024]
    - [8, 9378.31]
  - - [1024, 388, 1, 1024, 1024, 1024, 1024, 1024]
    - [21, 7717.14]
  - - [4096, 388, 1, 1024, 4096, 4096, 1024, 1024]
    - [7, 8255.81]
  - - [1024, 380, 1, 1024, 1024, 1024, 1024, 1024]
    - [20, 7335.4]
  - - [4096, 364, 1, 1024, 4096, 4096, 1024, 1024]
    - [8, 8538.72]
  - - [1024, 6656, 1, 1024, 1024, 1024, 1024, 1024]
    - [8, 9156.31]
  - - [33712, 364, 1, 1024, 33712, 33712, 1024, 1024]
    - [5, 9370.63]
  - - [1024, 360, 1, 1024, 1024, 1024, 1024, 1024]
    - [20, 6712.08]
  - - [1024, 352, 1, 1024, 1024, 1024, 1024, 1024]
    - [12, 6865.68]
  - - [4096, 356, 1, 1024, 4096, 4096, 1024, 1024]
    - [1, 7922.16]
  - - [33712, 356, 1, 1024, 33712, 33712, 1024, 1024]
    - [9, 9059.29]
  - - [33712, 6696, 1, 1024, 33712, 33712, 1024, 1024]
    - [8, 9494.23]
  - - [4096, 344, 1, 1024, 4096, 4096, 1024, 1024]
    - [8, 8005.09]
  - - [4096, 316, 1, 1024, 4096, 4096, 1024, 1024]
    - [20, 7705.79]
  - - [33712, 316, 1, 1024, 33712, 33712, 1024, 1024]
    - [6, 8909.95]
  - - [4096, 280, 1, 1024, 4096, 4096, 1024, 1024]
    - [13, 7493.65]
  - - [4096, 236, 1, 1024, 4096, 4096, 1024, 1024]
    - [1, 6564.01]
  - - [33712, 252, 1, 1024, 33712, 33712, 1024, 1024]
    - [9, 10027.8]
  - - [4096, 216, 1, 1024, 4096, 4096, 1024, 1024]
    - [1, 6504.64]
  - - [4096, 3696, 1, 1024, 4096, 4096, 1024, 1024]
    - [8, 9607.15]
  - - [1024, 2584, 1, 1024, 1024, 1024, 1024, 1024]
    - [4, 8912.88]
  - - [1024, 7888, 1, 4096, 1024, 1024, 4096, 4096]
    - [8, 9342.34]
  - - [33712, 372, 1, 1024, 33712, 33712, 1024, 1024]
    - [5, 8988.84]
  - - [1024, 5664, 1, 4096, 1024, 1024, 4096, 4096]
    - [0, 9299.63]
  - - [33712, 504, 1, 1024, 33712, 33712, 1024, 1024]
    - [8, 9980.37]
  - - [33712, 488, 1, 1024, 33712, 33712, 1024, 1024]
    - [9, 10184.7]
  - - [1024, 436, 1, 1024, 1024, 1024, 1024, 1024]
    - [21, 7796.37]
  - - [33712, 436, 1, 1024, 33712, 33712, 1024, 1024]
    - [0, 9410.73]
  - - [1024, 6080, 1, 4096, 1024, 1024, 4096, 4096]
    - [0, 9419.8]
  - - [1024, 412, 1, 1024, 1024, 1024, 1024, 1024]
    - [21, 7941.42]
  - - [1024, 6240, 1, 4096, 1024, 1024, 4096, 4096]
    - [0, 9238.27]
  - - [1024, 404, 1, 1024, 1024, 1024, 1024, 1024]
    - [21, 7775.78]
  - - [1024, 368, 1, 1024, 1024, 1024, 1024, 1024]
    - [12, 7156.45]
  - - [1024, 5760, 1, 4096, 1024, 1024, 4096, 4096]
    - [9, 8090.15]
  - - [4096, 368, 1, 1024, 4096, 4096, 1024, 1024]
    - [8, 8110.02]
  - - [33712, 368, 1, 1024, 33712, 33712, 1024, 1024]
    - [8, 9026.63]
  - - [33712, 328, 1, 1024, 33712, 33712, 1024, 1024]
    - [0, 8288.11]
  - - [1024, 324, 1, 1024, 1024, 1024, 1024, 1024]
    - [21, 6395.68]
  - - [4096, 324, 1, 1024, 4096, 4096, 1024, 1024]
    - [9, 7356.81]
  - - [4096, 7776, 1, 1024, 4096, 4096, 1024, 1024]
    - [8, 10129.3]
  - - [4096, 4960, 1, 1024, 4096, 4096, 1024, 1024]
    - [8, 10088.3]
  - - [4096, 308, 1, 1024, 4096, 4096, 1024, 1024]
    - [12, 8090.19]
  - - [1024, 1144, 1, 1024, 1024, 1024, 1024, 1024]
    - [19, 7271.87]
  - - [1024, 288, 1, 1024, 1024, 1024, 1024, 1024]
    - [17, 5651.01]
  - - [33712, 292, 1, 1024, 33712, 33712, 1024, 1024]
    - [0, 8786.72]
  - - [33712, 7992, 1, 1024, 33712, 33712, 1024, 1024]
    - [8, 10714.4]
  - - [1024, 8176, 1, 1024, 1024, 1024, 1024, 1024]
    - [4, 9304.06]
  - - [1024, 468, 1, 1024, 1024, 1024, 1024, 1024]
    - [17, 5847.64]
  - - [1024, 496, 1, 1024, 1024, 1024, 1024, 1024]
    - [0, 6041.98]
  - - [4096, 496, 1, 1024, 4096, 4096, 1024, 1024]
    - [0, 8487.15]
  - - [33712, 216, 1, 1024, 33712, 33712, 1024, 1024]
    - [9, 8578.62]
  - - [4096, 476, 1, 1024, 4096, 4096, 1024, 1024]
    - [12, 7229.45]
  - - [33712, 432, 1, 1024, 33712, 33712, 1024, 1024]
    - [0, 9372.69]
  - - [1024, 396, 1, 1024, 1024, 1024, 1024, 1024]
    - [13, 7888.22]
  - - [4096, 396, 1, 1024, 4096, 4096, 1024, 1024]
    - [6, 7837.58]
  - - [33712, 396, 1, 1024, 33712, 33712, 1024, 1024]
    - [6, 7540.66]
  - - [33712, 7952, 1, 1024, 33712, 33712, 1024, 1024]
    - [8, 10659.1]
  - - [1024, 6888, 1, 4096, 1024, 1024, 4096, 4096]
    - [9, 9936.4]
  - - [1024, 296, 1, 1024, 1024, 1024, 1024, 1024]
    - [21, 5582.35]
  - - [1024, 260, 1, 1024, 1024, 1024, 1024, 1024]
    - [12, 5316.49]
  - - [1024, 6808, 1, 4096, 1024, 1024, 4096, 4096]
    - [9, 9925.59]
  - - [1024, 7800, 1, 1024, 1024, 1024, 1024, 1024]
    - [8, 9757.19]
  - - [4096, 252, 1, 1024, 4096, 4096, 1024, 1024]
    - [1, 7372.77]
  - - [4096, 5104, 1, 1024, 4096, 4096, 1024, 1024]
    - [8, 9455.35]
  - - [1024, 500, 1, 1024, 1024, 1024, 1024, 1024]
    - [17, 5947.01]
  - - [1024, 6120, 1, 1024, 1024, 1024, 1024, 1024]
    - [0, 9316.59]
  - - [4096, 500, 1, 1024, 4096, 4096, 1024, 1024]
    - [0, 8608.98]
  - - [33712, 500, 1, 1024, 33712, 33712, 1024, 1024]
    - [8, 9723.13]
  - - [1024, 8184, 1, 4096, 1024, 1024, 4096, 4096]
    - [4, 9578.23]
  - - [33712, 3672, 1, 1024, 33712, 33712, 1024, 1024]
    - [8, 10664.2]
  - - [33712, 464, 1, 1024, 33712, 33712, 1024, 1024]
    - [5, 8989.84]
  - - [1024, 5616, 1, 1024, 1024, 1024, 1024, 1024]
    - [0, 9490.7]
  - - [33712, 444, 1, 1024, 33712, 33712, 1024, 1024]
    - [0, 9614.19]
  - - [4096, 4864, 1, 1024, 4096, 4096, 1024, 1024]
    - [8, 10542.5]
  - - [1024, 348, 1, 1024, 1024, 1024, 1024, 1024]
    - [12, 6859.11]
  - - [1024, 332, 1, 1024, 1024, 1024, 1024, 1024]
    - [21, 6593.32]
  - - [1024, 4864, 1, 1024, 1024, 1024, 1024, 1024]
    - [0, 9458.94]
  - - [4096, 268, 1, 1024, 4096, 4096, 1024, 1024]
    - [13, 7291.6]
  - - [33712, 268, 1, 1024, 33712, 33712, 1024, 1024]
    - [7, 7542.25]
  - - [1024, 472, 1, 1024, 1024, 1024, 1024, 1024]
    - [17, 5781.87]
  - - [1024, 7216, 1, 1024, 1024, 1024, 1024, 1024]
    - [8, 10610.4]
  - - [4096, 472, 1, 1024, 4096, 4096, 1024, 1024]
    - [0, 7510.27]
  - - [33712, 472, 1, 1024, 33712, 33712, 1024, 1024]
    - [9, 9260.85]
  - - [1024, 4896, 1, 4096, 1024, 1024, 4096, 4096]
    - [0, 9286.93]
  - - [1024, 276, 1, 1024, 1024, 1024, 1024, 1024]
    - [18, 5489.51]
  - - [1024, 6608, 1, 1024, 1024, 1024, 1024, 1024]
    - [0, 9365.5]
  - - [33712, 276, 1, 1024, 33712, 33712, 1024, 1024]
    - [6, 7842.06]
  - - [1024, 8704, 1, 1024, 1024, 1024, 1024, 1024]
    - [8, 10306.7]
  - - [4096, 8704, 1, 1024, 4096, 4096, 1024, 1024]
    - [8, 10924.5]
  - - [1024, 8704, 1, 4096, 1024, 1024, 4096, 4096]
    - [8, 9462.12]
  - - [1024, 492, 1, 1024, 1024, 1024, 1024, 1024]
    - [31, 5651.83]
  - - [4096, 352, 1, 1024, 4096, 4096, 1024, 1024]
    - [0, 7823.18]
  - - [33712, 284, 1, 1024, 33712, 33712, 1024, 1024]
    - [0, 8055.05]
  - - [4096, 244, 1, 1024, 4096, 4096, 1024, 1024]
    - [1, 6659.34]
  - - [4096, 400, 1, 1024, 4096, 4096, 1024, 1024]
    - [6, 7851.54]
  - - [33712, 400, 1, 1024, 33712, 33712, 1024, 1024]
    - [7, 7848.89]
  - - [1024, 272, 1, 1024, 1024, 1024, 1024, 1024]
    - [18, 5418.17]
  - - [1024, 10752, 1, 4096, 1024, 1024, 4096, 4096]
    - [9, 10234.6]
  - - [1024, 11264, 1, 4096, 1024, 1024, 4096, 4096]
    - [8, 9818.55]
  - - [1024, 2352, 1, 1024, 1024, 1024, 1024, 1024]
    - [12, 7920.87]
  - - [1024, 11776, 1, 1024, 1024, 1024, 1024, 1024]
    - [8, 10026.6]
  - - [1024, 312, 1, 4096, 1024, 1024, 4096, 4096]
    - [20, 6445.13]
  - - [1024, 356, 1, 4096, 1024, 1024, 4096, 4096]
    - [21, 7532.12]
  - - [1024, 408, 1, 4096, 1024, 1024, 4096, 4096]
    - [13, 8639.3]
  - - [1024, 296, 1, 4096, 1024, 1024, 4096, 4096]
    - [12, 6262.67]
  - - [1024, 328, 1, 4096, 1024, 1024, 4096, 4096]
    - [20, 6976.31]
  - - [4096, 140, 1, 1024, 4096, 4096, 1024, 1024]
    - [7, 5914.61]
  - - [1024, 460, 1, 4096, 1024, 1024, 4096, 4096]
    - [10, 6403.93]
  - - [1024, 416, 1, 4096, 1024, 1024, 4096, 4096]
    - [20, 8703.24]
  - - [4096, 68, 1, 1024, 4096, 4096, 1024, 1024]
    - [15, 4406.87]
  - - [1024, 500, 1, 4096, 1024, 1024, 4096, 4096]
    - [1, 6335.02]
  - - [1024, 508, 1, 4096, 1024, 1024, 4096, 4096]
    - [1, 6354.99]
  - - [1024, 372, 1, 4096, 1024, 1024, 4096, 4096]
    - [13, 7544.86]
  - - [33712, 152, 1, 1024, 33712, 33712, 1024, 1024]
    - [7, 7903.35]
  - - [4096, 92, 1, 1024, 4096, 4096, 1024, 1024]
    - [15, 6199.81]
  - - [1024, 288, 1, 4096, 1024, 1024, 4096, 4096]
    - [20, 6073.8]
  - - [33712, 92, 1, 1024, 33712, 33712, 1024, 1024]
    - [2, 7132.44]
  - - [33712, 84, 1, 1024, 33712, 33712, 1024, 1024]
    - [11, 6566.5]
  - - [1024, 392, 1, 4096, 1024, 1024, 4096, 4096]
    - [21, 8433.33]
  - - [1024, 404, 1, 4096, 1024, 1024, 4096, 4096]
    - [12, 8527.05]
  - - [4096, 84, 1, 1024, 4096, 4096, 1024, 1024]
    - [16, 5726.94]
  - - [1024, 260, 1, 4096, 1024, 1024, 4096, 4096]
    - [20, 5543.49]
  - - [1024, 304, 1, 4096, 1024, 1024, 4096, 4096]
    - [12, 6478.99]
  - - [1024, 340, 1, 4096, 1024, 1024, 4096, 4096]
    - [12, 7341.74]
  - - [1024, 388, 1, 4096, 1024, 1024, 4096, 4096]
    - [21, 8275.97]
  - - [33712, 60, 1, 1024, 33712, 33712, 1024, 1024]
    - [0, 8221.9]
  - - [1024, 316, 1, 4096, 1024, 1024, 4096, 4096]
    - [20, 6626.98]
  - - [4096, 100, 1, 1024, 4096, 4096, 1024, 1024]
    - [18, 4946.11]
  - - [33712, 72, 1, 1024, 33712, 33712, 1024, 1024]
    - [11, 5689.23]
  - - [4096, 172, 1, 1024, 4096, 4096, 1024, 1024]
    - [6, 7078.3]
  - - [1024, 276, 1, 4096, 1024, 1024, 4096, 4096]
    - [20, 5809.04]
  - - [4096, 104, 1, 1024, 4096, 4096, 1024, 1024]
    - [1, 5119.81]
  - - [4096, 128, 1, 1024, 4096, 4096, 1024, 1024]
    - [0, 6283.6]
  - - [33712, 124, 1, 1024, 33712, 33712, 1024, 1024]
    - [0, 9003.46]
  - - [33712, 140, 1, 1024, 33712, 33712, 1024, 1024]
    - [7, 7238.4]
  - - [4096, 72, 1, 1024, 4096, 4096, 1024, 1024]
    - [15, 4877.1]
  - - [4096, 176, 1, 1024, 4096, 4096, 1024, 1024]
    - [6, 7136.48]
  - - [33712, 168, 1, 1024, 33712, 33712, 1024, 1024]
    - [7, 8560.94]
  - - [4096, 144, 1, 1024, 4096, 4096, 1024, 1024]
    - [7, 6030.15]
  - - [4096, 112, 1, 1024, 4096, 4096, 1024, 1024]
    - [0, 5477.64]
  - - [1024, 336, 1, 4096, 1024, 1024, 4096, 4096]
    - [20, 7108.97]
  - - [33712, 100, 1, 1024, 33712, 33712, 1024, 1024]
    - [0, 7395.25]
  - - [33712, 104, 1, 1024, 33712, 33712, 1024, 1024]
    - [1, 7760.21]
  - - [4096, 88, 1, 1024, 4096, 4096, 1024, 1024]
    - [15, 5633.38]
  - - [4096, 156, 1, 1024, 4096, 4096, 1024, 1024]
    - [11, 6384.77]
  - - [1024, 332, 1, 4096, 1024, 1024, 4096, 4096]
    - [12, 7180.82]
  - - [4096, 168, 1, 1024, 4096, 4096, 1024, 1024]
    - [6, 7007.19]
  - - [4096, 116, 1, 1024, 4096, 4096, 1024, 1024]
    - [1, 5641.69]
  - - [4096, 200, 1, 1024, 4096, 4096, 1024, 1024]
    - [16, 7009.2]
  - - [33712, 200, 1, 1024, 33712, 33712, 1024, 1024]
    - [8, 8212.24]
  - - [33712, 172, 1, 1024, 33712, 33712, 1024, 1024]
    - [6, 8827.32]
  - - [1024, 292, 1, 4096, 1024, 1024, 4096, 4096]
    - [20, 6228.3]
  - - [4096, 204, 1, 1024, 4096, 4096, 1024, 1024]
    - [15, 6995.05]
  - - [4096, 96, 1, 1024, 4096, 4096, 1024, 1024]
    - [15, 6579.3]
  - - [33712, 112, 1, 1024, 33712, 33712, 1024, 1024]
    - [6, 8041.49]
  - - [1024, 412, 1, 4096, 1024, 1024, 4096, 4096]
    - [21, 8770.04]
  - - [4096, 188, 1, 1024, 4096, 4096, 1024, 1024]
    - [6, 7700.48]
  - - [33712, 188, 1, 1024, 33712, 33712, 1024, 1024]
    - [7, 9545.16]
  - - [33712, 160, 1, 1024, 33712, 33712, 1024, 1024]
    - [6, 8100.67]
  - - [33712, 88, 1, 1024, 33712, 33712, 1024, 1024]
    - [11, 6869.23]
  - - [1024, 468, 1, 4096, 1024, 1024, 4096, 4096]
    - [10, 6434.99]
  - - [1024, 348, 1, 4096, 1024, 1024, 4096, 4096]
    - [12, 7474.47]
  - - [33712, 144, 1, 1024, 33712, 33712, 1024, 1024]
    - [7, 7511.82]
  - - [1024, 280, 1, 4096, 1024, 1024, 4096, 4096]
    - [21, 6001.65]
  - - [4096, 180, 1, 1024, 4096, 4096, 1024, 1024]
    - [6, 7419.17]
  - - [4096, 192, 1, 1024, 4096, 4096, 1024, 1024]
    - [7, 8144.28]
  - - [4096, 152, 1, 1024, 4096, 4096, 1024, 1024]
    - [6, 6265.08]
  - - [1024, 424, 1, 4096, 1024, 1024, 4096, 4096]
    - [21, 8693.69]
  - - [1024, 420, 1, 4096, 1024, 1024, 4096, 4096]
    - [13, 8769.43]
  - - [33712, 76, 1, 1024, 33712, 33712, 1024, 1024]
    - [16, 6009.7]
  - - [1024, 360, 1, 4096, 1024, 1024, 4096, 4096]
    - [12, 7825.17]
  - - [33712, 96, 1, 1024, 33712, 33712, 1024, 1024]
    - [3, 7515.46]
  - - [33712, 136, 1, 1024, 33712, 33712, 1024, 1024]
    - [7, 7104.8]
  - - [33712, 164, 1, 1024, 33712, 33712, 1024, 1024]
    - [7, 8325.65]
  - - [1024, 324, 1, 4096, 1024, 1024, 4096, 4096]
    - [20, 6961.84]
  - - [1024, 488, 1, 4096, 1024, 1024, 4096, 4096]
    - [1, 6226.62]
  - - [1024, 512, 1, 4096, 1024, 1024, 4096, 4096]
    - [1, 6445.01]
  - - [1024, 484, 1, 4096, 1024, 1024, 4096, 4096]
    - [1, 6227.11]
  - - [1024, 456, 1, 4096, 1024, 1024, 4096, 4096]
    - [10, 5972.39]
  - - [1024, 452, 1, 4096, 1024, 1024, 4096, 4096]
    - [10, 6062.35]
  - - [1024, 440, 1, 4096, 1024, 1024, 4096, 4096]
    - [13, 9092.87]
  - - [1024, 384, 1, 4096, 1024, 1024, 4096, 4096]
    - [12, 7833.7]
  - - [33712, 192, 1, 1024, 33712, 33712, 1024, 1024]
    - [6, 9741.37]
  - - [1024, 380, 1, 4096, 1024, 1024, 4096, 4096]
    - [21, 7677.42]
  - - [1024, 364, 1, 4096, 1024, 1024, 4096, 4096]
    - [13, 7466.37]
  - - [1024, 344, 1, 4096, 1024, 1024, 4096, 4096]
    - [21, 7287.06]
  - - [1024, 264, 1, 4096, 1024, 1024, 4096, 4096]
    - [20, 5679.59]
  - - [33712, 204, 1, 1024, 33712, 33712, 1024, 1024]
    - [9, 8314.77]
  - - [33712, 196, 1, 1024, 33712, 33712, 1024, 1024]
    - [9, 7958.64]
  - - [4096, 196, 1, 1024, 4096, 4096, 1024, 1024]
    - [15, 6422.5]
  - - [4096, 184, 1, 1024, 4096, 4096, 1024, 1024]
    - [6, 7607.96]
  - - [33712, 184, 1, 1024, 33712, 33712, 1024, 1024]
    - [7, 9288.52]
  - - [33712, 180, 1, 1024, 33712, 33712, 1024, 1024]
    - [7, 9026.41]
  - - [33712, 176, 1, 1024, 33712, 33712, 1024, 1024]
    - [6, 8844.32]
  - - [4096, 164, 1, 1024, 4096, 4096, 1024, 1024]
    - [6, 6727.95]
  - - [4096, 160, 1, 1024, 4096, 4096, 1024, 1024]
    - [6, 6631.28]
  - - [33712, 156, 1, 1024, 33712, 33712, 1024, 1024]
    - [7, 7953.2]
  - - [4096, 148, 1, 1024, 4096, 4096, 1024, 1024]
    - [11, 6105.01]
  - - [33712, 148, 1, 1024, 33712, 33712, 1024, 1024]
    - [7, 7605.55]
  - - [4096, 136, 1, 1024, 4096, 4096, 1024, 1024]
    - [11, 5650.01]
  - - [4096, 132, 1, 1024, 4096, 4096, 1024, 1024]
    - [6, 5554.25]
  - - [33712, 132, 1, 1024, 33712, 33712, 1024, 1024]
    - [7, 6821.51]
  - - [33712, 128, 1, 1024, 33712, 33712, 1024, 1024]
    - [6, 9194.87]
  - - [4096, 124, 1, 1024, 4096, 4096, 1024, 1024]
    - [0, 5986.35]
  - - [4096, 120, 1, 1024, 4096, 4096, 1024, 1024]
    - [1, 5798.58]
  - - [33712, 120, 1, 1024, 33712, 33712, 1024, 1024]
    - [6, 8508.29]
  - - [33712, 116, 1, 1024, 33712, 33712, 1024, 1024]
    - [6, 8246.36]
  - - [1024, 504, 1, 4096, 1024, 1024, 4096, 4096]
    - [1, 6370.31]
  - - [1024, 448, 1, 4096, 1024, 1024, 4096, 4096]
    - [13, 9142.87]
  - - [1024, 436, 1, 4096, 1024, 1024, 4096, 4096]
    - [21, 8802.04]
  - - [1024, 368, 1, 4096, 1024, 1024, 4096, 4096]
    - [20, 7495.63]
  - - [1024, 308, 1, 4096, 1024, 1024, 4096, 4096]
    - [12, 6332.56]
  - - [4096, 108, 1, 1024, 4096, 4096, 1024, 1024]
    - [18, 5223.53]
  - - [33712, 108, 1, 1024, 33712, 33712, 1024, 1024]
    - [6, 7738.85]
  - - [4096, 80, 1, 1024, 4096, 4096, 1024, 1024]
    - [15, 5223.29]
  - - [33712, 80, 1, 1024, 33712, 33712, 1024, 1024]
    - [11, 6176.59]
  - - [4096, 76, 1, 1024, 4096, 4096, 1024, 1024]
    - [15, 5291.62]
  - - [1024, 496, 1, 4096, 1024, 1024, 4096, 4096]
    - [1, 6269.19]
  - - [1024, 284, 1, 4096, 1024, 1024, 4096, 4096]
    - [20, 5892.26]
  - - [1024, 480, 1, 4096, 1024, 1024, 4096, 4096]
    - [10, 6523.0]
  - - [1024, 476, 1, 4096, 1024, 1024, 4096, 4096]
    - [10, 6316.38]
  - - [1024, 432, 1, 4096, 1024, 1024, 4096, 4096]
    - [13, 8809.49]
  - - [1024, 396, 1, 4096, 1024, 1024, 4096, 4096]
    - [13, 8334.71]
  - - [1024, 320, 1, 4096, 1024, 1024, 4096, 4096]
    - [20, 6512.88]
  - - [1024, 428, 1, 4096, 1024, 1024, 4096, 4096]
    - [20, 8650.53]
  - - [33712, 68, 1, 1024, 33712, 33712, 1024, 1024]
    - [11, 5419.81]
  - - [33712, 56, 1, 1024, 33712, 33712, 1024, 1024]
    - [0, 7664.04]
  - - [1024, 464, 1, 4096, 1024, 1024, 4096, 4096]
    - [10, 6516.71]
  - - [1024, 444, 1, 4096, 1024, 1024, 4096, 4096]
    - [20, 8973.91]
  - - [1024, 376, 1, 4096, 1024, 1024, 4096, 4096]
    - [12, 7835.13]
  - - [1024, 268, 1, 4096, 1024, 1024, 4096, 4096]
    - [12, 5693.23]
  - - [1024, 300, 1, 4096, 1024, 1024, 4096, 4096]
    - [20, 6170.5]
  - - [1024, 472, 1, 4096, 1024, 1024, 4096, 4096]
    - [10, 6304.79]
  - - [1024, 492, 1, 4096, 1024, 1024, 4096, 4096]
    - [0, 6223.13]
  - - [1024, 352, 1, 4096, 1024, 1024, 4096, 4096]
    - [12, 7326.28]
  - - [1024, 400, 1, 4096, 1024, 1024, 4096, 4096]
    - [20, 8405.4]
  - - [1024, 272, 1, 4096, 1024, 1024, 4096, 4096]
    - [12, 5813.53]
  - - [1024, 212, 1, 1024, 1024, 1024, 1024, 1024]
    - [30, 5557.45]
  - - [1024, 232, 1, 1024, 1024, 1024, 1024, 1024]
    - [12, 4736.56]
  - - [1024, 240, 1, 1024, 1024, 1024, 1024, 1024]
    - [12, 4892.27]
  - - [1024, 256, 1, 1024, 1024, 1024, 1024, 1024]
    - [18, 5202.24]
  - - [1024, 236, 1, 1024, 1024, 1024, 1024, 1024]
    - [17, 4773.61]
  - - [1024, 244, 1, 1024, 1024, 1024, 1024, 1024]
    - [12, 5012.78]
  - - [1024, 208, 1, 1024, 1024, 1024, 1024, 1024]
    - [31, 5387.94]
  - - [1024, 248, 1, 1024, 1024, 1024, 1024, 1024]
    - [17, 5000.9]
  - - [1024, 224, 1, 1024, 1024, 1024, 1024, 1024]
    - [11, 6273.53]
  - - [1024, 216, 1, 1024, 1024, 1024, 1024, 1024]
    - [32, 5837.43]
  - - [1024, 252, 1, 1024, 1024, 1024, 1024, 1024]
    - [17, 5081.56]
  - - [1024, 228, 1, 1024, 1024, 1024, 1024, 1024]
    - [17, 4669.44]
  - - [1024, 220, 1, 1024, 1024, 1024, 1024, 1024]
    - [32, 5801.98]
  - - [1024, 228, 1, 4096, 1024, 1024, 4096, 4096]
    - [12, 4857.27]
  - - [1024, 100, 1, 1024, 1024, 1024, 1024, 1024]
    - [28, 3048.19]
  - - [1024, 68, 1, 1024, 1024, 1024, 1024, 1024]
    - [25, 2856.7]
  - - [1024, 60, 1, 1024, 1024, 1024, 1024, 1024]
    - [25, 2434.77]
  - - [1024, 248, 1, 4096, 1024, 1024, 4096, 4096]
    - [12, 5209.26]
  - - [1024, 96, 1, 1024, 1024, 1024, 1024, 1024]
    - [25, 3932.16]
  - - [1024, 204, 1, 1024, 1024, 1024, 1024, 1024]
    - [11, 5677.0]
  - - [1024, 76, 1, 1024, 1024, 1024, 1024, 1024]
    - [25, 3162.37]
  - - [1024, 172, 1, 4096, 1024, 1024, 4096, 4096]
    - [11, 5367.71]
  - - [1024, 128, 1, 1024, 1024, 1024, 1024, 1024]
    - [24, 3813.0]
  - - [1024, 220, 1, 4096, 1024, 1024, 4096, 4096]
    - [32, 6201.26]
  - - [1024, 132, 1, 4096, 1024, 1024, 4096, 4096]
    - [25, 4149.04]
  - - [1024, 236, 1, 4096, 1024, 1024, 4096, 4096]
    - [20, 5007.35]
  - - [1024, 196, 1, 1024, 1024, 1024, 1024, 1024]
    - [31, 5419.86]
  - - [1024, 108, 1, 1024, 1024, 1024, 1024, 1024]
    - [26, 3239.31]
  - - [1024, 192, 1, 1024, 1024, 1024, 1024, 1024]
    - [18, 5494.72]
  - - [1024, 240, 1, 4096, 1024, 1024, 4096, 4096]
    - [13, 5029.13]
  - - [1024, 180, 1, 4096, 1024, 1024, 4096, 4096]
    - [18, 5343.82]
  - - [1024, 84, 1, 4096, 1024, 1024, 4096, 4096]
    - [25, 3760.9]
  - - [1024, 116, 1, 1024, 1024, 1024, 1024, 1024]
    - [24, 3511.4]
  - - [1024, 180, 1, 1024, 1024, 1024, 1024, 1024]
    - [11, 4987.94]
  - - [1024, 160, 1, 1024, 1024, 1024, 1024, 1024]
    - [25, 4788.02]
  - - [1024, 200, 1, 1024, 1024, 1024, 1024, 1024]
    - [30, 5427.41]
  - - [1024, 84, 1, 1024, 1024, 1024, 1024, 1024]
    - [24, 3440.64]
  - - [1024, 196, 1, 4096, 1024, 1024, 4096, 4096]
    - [11, 6058.99]
  - - [1024, 144, 1, 4096, 1024, 1024, 4096, 4096]
    - [28, 4451.5]
  - - [1024, 80, 1, 1024, 1024, 1024, 1024, 1024]
    - [25, 3339.41]
  - - [1024, 184, 1, 1024, 1024, 1024, 1024, 1024]
    - [31, 5066.65]
  - - [1024, 208, 1, 4096, 1024, 1024, 4096, 4096]
    - [10, 6011.68]
  - - [1024, 56, 1, 1024, 1024, 1024, 1024, 1024]
    - [25, 2330.17]
  - - [1024, 144, 1, 1024, 1024, 1024, 1024, 1024]
    - [28, 4328.98]
  - - [1024, 140, 1, 4096, 1024, 1024, 4096, 4096]
    - [24, 4305.0]
  - - [1024, 212, 1, 4096, 1024, 1024, 4096, 4096]
    - [11, 6290.27]
  - - [1024, 160, 1, 4096, 1024, 1024, 4096, 4096]
    - [24, 4891.32]
  - - [1024, 200, 1, 4096, 1024, 1024, 4096, 4096]
    - [11, 5937.58]
  - - [1024, 156, 1, 1024, 1024, 1024, 1024, 1024]
    - [11, 4397.25]
  - - [1024, 136, 1, 1024, 1024, 1024, 1024, 1024]
    - [28, 4088.48]
  - - [1024, 184, 1, 4096, 1024, 1024, 4096, 4096]
    - [32, 5471.87]
  - - [1024, 120, 1, 1024, 1024, 1024, 1024, 1024]
    - [24, 3574.69]
  - - [1024, 172, 1, 1024, 1024, 1024, 1024, 1024]
    - [17, 4817.18]
  - - [1024, 60, 1, 4096, 1024, 1024, 4096, 4096]
    - [22, 2883.34]
  - - [1024, 164, 1, 4096, 1024, 1024, 4096, 4096]
    - [18, 4933.06]
  - - [1024, 108, 1, 4096, 1024, 1024, 4096, 4096]
    - [22, 3495.25]
  - - [1024, 204, 1, 4096, 1024, 1024, 4096, 4096]
    - [11, 5988.51]
  - - [1024, 188, 1, 1024, 1024, 1024, 1024, 1024]
    - [17, 5187.69]
  - - [1024, 88, 1, 4096, 1024, 1024, 4096, 4096]
    - [23, 3980.79]
  - - [1024, 168, 1, 4096, 1024, 1024, 4096, 4096]
    - [29, 5082.54]
  - - [1024, 176, 1, 1024, 1024, 1024, 1024, 1024]
    - [28, 4982.43]
  - - [1024, 72, 1, 1024, 1024, 1024, 1024, 1024]
    - [25, 3034.46]
  - - [1024, 96, 1, 4096, 1024, 1024, 4096, 4096]
    - [25, 4305.53]
  - - [4096, 56, 1, 1024, 4096, 4096, 1024, 1024]
    - [11, 4324.02]
  - - [1024, 256, 1, 4096, 1024, 1024, 4096, 4096]
    - [17, 5263.43]
  - - [1024, 168, 1, 1024, 1024, 1024, 1024, 1024]
    - [30, 4766.25]
  - - [1024, 224, 1, 4096, 1024, 1024, 4096, 4096]
    - [31, 6307.22]
  - - [1024, 216, 1, 4096, 1024, 1024, 4096, 4096]
    - [32, 6065.68]
  - - [1024, 164, 1, 1024, 1024, 1024, 1024, 1024]
    - [28, 4713.99]
  - - [1024, 124, 1, 4096, 1024, 1024, 4096, 4096]
    - [25, 3959.3]
  - - [1024, 148, 1, 4096, 1024, 1024, 4096, 4096]
    - [25, 4559.03]
  - - [1024, 176, 1, 4096, 1024, 1024, 4096, 4096]
    - [18, 5272.84]
  - - [1024, 156, 1, 4096, 1024, 1024, 4096, 4096]
    - [22, 4760.71]
  - - [1024, 152, 1, 1024, 1024, 1024, 1024, 1024]
    - [27, 4359.51]
  - - [1024, 152, 1, 4096, 1024, 1024, 4096, 4096]
    - [28, 4668.53]
  - - [1024, 148, 1, 1024, 1024, 1024, 1024, 1024]
    - [25, 4418.83]
  - - [1024, 140, 1, 1024, 1024, 1024, 1024, 1024]
    - [24, 4161.02]
  - - [1024, 136, 1, 4096, 1024, 1024, 4096, 4096]
    - [25, 4211.65]
  - - [1024, 132, 1, 1024, 1024, 1024, 1024, 1024]
    - [24, 3810.9]
  - - [1024, 128, 1, 4096, 1024, 1024, 4096, 4096]
    - [23, 4145.08]
  - - [1024, 124, 1, 1024, 1024, 1024, 1024, 1024]
    - [24, 3753.56]
  - - [1024, 120, 1, 4096, 1024, 1024, 4096, 4096]
    - [24, 3843.28]
  - - [1024, 116, 1, 4096, 1024, 1024, 4096, 4096]
    - [25, 3688.14]
  - - [1024, 104, 1, 1024, 1024, 1024, 1024, 1024]
    - [24, 3140.9]
  - - [1024, 112, 1, 1024, 1024, 1024, 1024, 1024]
    - [24, 3366.99]
  - - [1024, 112, 1, 4096, 1024, 1024, 4096, 4096]
    - [22, 3600.26]
  - - [1024, 104, 1, 4096, 1024, 1024, 4096, 4096]
    - [24, 3334.92]
  - - [1024, 100, 1, 4096, 1024, 1024, 4096, 4096]
    - [28, 3248.38]
  - - [1024, 88, 1, 1024, 1024, 1024, 1024, 1024]
    - [24, 3638.59]
  - - [1024, 80, 1, 4096, 1024, 1024, 4096, 4096]
    - [25, 3609.56]
  - - [1024, 76, 1, 4096, 1024, 1024, 4096, 4096]
    - [23, 3532.44]
  - - [1024, 252, 1, 4096, 1024, 1024, 4096, 4096]
    - [17, 5201.58]
  - - [1024, 92, 1, 1024, 1024, 1024, 1024, 1024]
    - [24, 3721.8]
  - - [1024, 92, 1, 4096, 1024, 1024, 4096, 4096]
    - [25, 4129.67]
  - - [1024, 72, 1, 4096, 1024, 1024, 4096, 4096]
    - [25, 3291.08]
  - - [1024, 68, 1, 4096, 1024, 1024, 4096, 4096]
    - [22, 3174.67]
  - - [4096, 60, 1, 1024, 4096, 4096, 1024, 1024]
    - [10, 4632.88]
  - - [1024, 56, 1, 4096, 1024, 1024, 4096, 4096]
    - [22, 2721.05]
  - - [1024, 188, 1, 4096, 1024, 1024, 4096, 4096]
    - [32, 5512.65]
  - - [1024, 232, 1, 4096, 1024, 1024, 4096, 4096]
    - [12, 4928.46]
  - - [1024, 192, 1, 4096, 1024, 1024, 4096, 4096]
    - [18, 5785.25]
  - - [1024, 244, 1, 4096, 1024, 1024, 4096, 4096]
    - [13, 5137.59]
- null
