src/Tensile/data/Configs/miopen/archives/resnext3d/2021-02-10/exact/arcturus_Cijk_Alik_Bljk_SB.yaml
- {MinimumRequiredVersion: 4.25.0}
- arcturus
- gfx908
- [Device 7380, Device 7388, Device 738c, Device 7390]
    SolutionIndex: 0
    SolutionNameMin: Cijk_Alik_Bljk_SB_MT128x128x8_MI32x32x2x1_SE_EPS0_GRVW4_GSU1_IU1_LPA4_LPB4_PGR2_PLR5_SU0_SUS128_SRVW2_TT2_64_WG64_4_1_WGM1
    SolutionIndex: 1
    SolutionNameMin: Cijk_Alik_Bljk_SB_MT32x32x32_MI16x16x4x1_SE_EPS0_GRVW4_GSU1_IU2_LPA4_LPB4_PGR2_PLR5_SU0_SUS128_SRVW2_TT1_16_WG32_8_1_WGM1
    SolutionIndex: 2
    SolutionNameMin: Cijk_Alik_Bljk_SB_MT64x64x32_MI32x32x2x1_SE_EPS0_GRVW4_GSU1_IU2_LPA4_LPB4_PGR2_PLR9_SU0_SUS256_SRVW2_TT1_32_WG64_4_1_WGM1
    SolutionIndex: 3
    SolutionNameMin: Cijk_Alik_Bljk_SB_MT32x32x32_MI16x16x4x1_SE_EPS0_GRVW1_GSU1_IU2_LPA2_LPB2_PGR2_PLR5_SU32_SUS128_SRVW2_TT1_16_WG32_8_1_WGM1
    SolutionIndex: 4
    SolutionNameMin: Cijk_Alik_Bljk_SB_MT64x64x16_MI32x32x2x1_SE_EPS0_GRVW1_GSU1_IU2_LPA2_LPB2_PGR2_PLR5_SU0_SUS128_SRVW2_TT1_32_WG64_4_1_WGM8
    SolutionIndex: 5
    SolutionNameMin: Cijk_Alik_Bljk_SB_MT64x128x16_MI32x32x2x1_SE_EPS1_GRVW4_GSU1_IU2_LPA4_LPB4_PGR1_PLR5_SU0_SUS128_SRVW2_TT1_64_WG64_4_1_WGM8
    SolutionIndex: 6
    SolutionNameMin: Cijk_Alik_Bljk_SB_MT32x32x32_MI16x16x4x1_SE_EPS1_GRVW4_GSU1_IU2_LPA4_LPB4_PGR1_PLR5_SU0_SUS128_SRVW2_TT1_16_WG32_8_1_WGM8
    SolutionIndex: 7
    SolutionNameMin: Cijk_Alik_Bljk_SB_MT64x128x16_MI32x32x2x1_SE_EPS1_GRVW4_GSU1_IU1_LPA4_LPB4_PGR1_PLR9_SU0_SUS256_SRVW2_TT1_64_WG64_4_1_WGM8
    SolutionIndex: 8
    SolutionNameMin: Cijk_Alik_Bljk_SB_MT32x32x32_MI16x16x4x1_SE_EPS0_GRVW4_GSU1_IU1_LPA4_LPB4_PGR2_PLR9_SU0_SUS256_SRVW2_TT1_16_WG32_8_1_WGM8
    SolutionIndex: 9
    SolutionNameMin: Cijk_Alik_Bljk_SB_MT64x64x32_MI32x32x2x1_SE_EPS0_GRVW4_GSU15_IU2_LPA4_LPB4_PGR2_PLR9_SU0_SUS256_SRVW0_TT1_32_WG64_4_1_WGM1
    SolutionIndex: 10
    SolutionNameMin: Cijk_Alik_Bljk_SB_MT128x64x16_MI32x32x2x1_SE_EPS0_GRVW1_GSU15_IU1_LPA2_LPB2_PGR2_PLR9_SU0_SUS256_SRVW0_TT2_32_WG64_4_1_WGM8
    SolutionIndex: 11
    SolutionNameMin: Cijk_Alik_Bljk_SB_MT32x32x32_MI16x16x4x1_SE_EPS0_GRVW4_GSU15_IU2_LPA4_LPB4_PGR2_PLR5_SU0_SUS256_SRVW0_TT1_16_WG32_8_1_WGM8
- - - [101, 8, 1, 512, 101, 101, 512, 512]
    - [1, 0.114]
  - - [101, 100, 1, 512, 101, 101, 512, 512]
    - [8, 1.467]
  - - [13824, 512, 1, 49, 13824, 13824, 49, 49]
    - [5, 27.389]
  - - [6912, 512, 1, 49, 6912, 6912, 49, 49]
    - [7, 23.954]
  - - [6912, 256, 1, 392, 6912, 6912, 392, 392]
    - [0, 53.317]
  - - [3456, 256, 1, 392, 3456, 3456, 392, 392]
    - [4, 46.367]
  - - [3456, 128, 1, 3136, 3456, 3456, 3136, 3136]
    - [2, 53.482]
  - - [256, 512, 1, 49, 256, 256, 49, 49]
    - [3, 2.797]
  - - [128, 256, 1, 392, 128, 128, 392, 392]
    - [1, 3.615]
  - - [1728, 128, 1, 3136, 1728, 1728, 3136, 3136]
    - [6, 37.2]
  - - [1728, 64, 1, 25088, 1728, 1728, 25088, 25088]
    - [10, 43.767]
  - - [441, 64, 1, 25088, 441, 441, 25088, 25088]
    - [9, 33.427]
  - - [64, 128, 1, 3136, 64, 64, 3136, 3136]
    - [11, 5.142]
- null
