test_dir/py38/lib/python3.6/site-packages/Tensile/Configs/miopen/archives/inception/2019-08-26/exact/vega20_Cijk_Ailk_Bljk_SB.yaml
- {MinimumRequiredVersion: 4.11.0}
- vega20
- gfx906
- [Device 66a0, Device 66a1, Device 66a7, Vega 20]
    SolutionIndex: 0
    SolutionNameMin: Cijk_Ailk_Bljk_SB_MT32x16x32_SE_EPS1_FL1_GRVW2_NLCA1_PGR1_PLR1_TT2_4_USFGRO0_VW2_WGM1
    SolutionIndex: 1
    SolutionNameMin: Cijk_Ailk_Bljk_SB_MT32x16x32_SE_EPS1_FL1_GRVW2_NLCA1_PGR1_PLR1_TT2_4_USFGRO0_VW2_WGM8
    SolutionIndex: 2
    SolutionNameMin: Cijk_Ailk_Bljk_SB_MT64x16x32_SE_EPS1_FL1_GRVW4_NLCA1_PGR1_PLR1_TT4_4_USFGRO0_VW4_WGM8
    SolutionIndex: 3
    SolutionNameMin: Cijk_Ailk_Bljk_SB_MT128x64x8_SE_EPS1_FL0_GRVW4_NLCA1_PGR1_PLR0_TT8_4_USFGRO0_VW4_WGM8
    SolutionIndex: 4
    SolutionNameMin: Cijk_Ailk_Bljk_SB_MT128x64x8_SE_EPS1_FL0_GRVW4_NLCA1_PGR1_PLR1_TT8_4_USFGRO0_VW4_WGM1
    SolutionIndex: 5
    SolutionNameMin: Cijk_Ailk_Bljk_SB_MT128x64x16_SE_EPS1_FL0_GRVW4_NLCA1_PGR1_PLR1_TT8_4_USFGRO0_VW4_WGM1
    SolutionIndex: 6
    SolutionNameMin: Cijk_Ailk_Bljk_SB_MT128x64x8_SE_EPS1_FL1_GRVW4_NLCA1_PGR1_PLR0_TT8_4_USFGRO0_VW4_WGM8
    SolutionIndex: 7
    SolutionNameMin: Cijk_Ailk_Bljk_SB_MT128x64x8_SE_EPS1_FL1_GRVW4_NLCA1_PGR1_PLR1_TT8_4_USFGRO0_VW4_WGM8
- - - [8192, 320, 1, 1280, 8192, 8192, 8192, 1280]
    - [4, 9875.92]
  - - [8192, 320, 1, 2048, 8192, 8192, 8192, 2048]
    - [7, 9745.7]
  - - [8192, 384, 1, 1280, 8192, 8192, 8192, 1280]
    - [4, 10046.2]
  - - [8192, 192, 1, 1280, 8192, 8192, 8192, 1280]
    - [7, 9950.9]
  - - [8192, 192, 1, 2048, 8192, 8192, 8192, 2048]
    - [3, 9559.67]
  - - [8192, 384, 1, 2048, 8192, 8192, 8192, 2048]
    - [5, 9945.74]
  - - [8192, 448, 1, 2048, 8192, 8192, 8192, 2048]
    - [6, 9908.51]
  - - [1001, 64, 1, 1536, 1001, 1001, 1001, 1536]
    - [0, 3649.94]
  - - [8192, 448, 1, 1280, 8192, 8192, 8192, 1280]
    - [4, 9981.35]
  - - [1001, 64, 1, 2048, 1001, 1001, 1001, 2048]
    - [1, 3580.87]
  - - [1001, 128, 1, 2048, 1001, 1001, 1001, 2048]
    - [2, 5587.87]
- null
