Tensile/Configs/miopen/archives/skinny-sizes/2020-05-21/exact/vega20_Cijk_Ailk_Bjlk_DB.yaml
- {MinimumRequiredVersion: 4.19.0}
- vega20
- gfx906
- [Device 66a0, Device 66a1, Device 66a7, Device 66af, Vega 20]
- - - [32, 4096, 1, 32, 32, 32, 32, 4096]
    - [3, 690.0]
  - - [32, 4096, 1, 32, 32, 32, 32, 4160]
    - [0, 708.0]
  - - [32, 4096, 1, 32, 32, 32, 32, 4224]
    - [3, 708.0]
  - - [32, 8192, 1, 32, 32, 32, 32, 8192]
    - [2, 1165.0]
  - - [32, 8192, 1, 32, 32, 32, 32, 8256]
    - [2, 1140.0]
  - - [32, 8192, 1, 32, 32, 32, 32, 8320]
    - [2, 1116.0]
  - - [32, 12288, 1, 32, 32, 32, 32, 12288]
    - [0, 1219.0]
  - - [32, 12288, 1, 32, 32, 32, 32, 12352]
    - [0, 1268.0]
  - - [32, 12288, 1, 32, 32, 32, 32, 12416]
    - [0, 1279.0]
  - - [32, 16384, 1, 32, 32, 32, 32, 16384]
    - [1, 1362.0]
  - - [32, 16384, 1, 32, 32, 32, 32, 16448]
    - [0, 1436.0]
  - - [32, 16384, 1, 32, 32, 32, 32, 16512]
    - [0, 1427.0]
  - - [32, 20480, 1, 32, 32, 32, 32, 20480]
    - [1, 1464.0]
  - - [32, 20480, 1, 32, 32, 32, 32, 20544]
    - [1, 1570.0]
  - - [32, 20480, 1, 32, 32, 32, 32, 20608]
    - [1, 1560.0]
  - - [32, 24576, 1, 32, 32, 32, 32, 24576]
    - [1, 1527.0]
  - - [32, 24576, 1, 32, 32, 32, 32, 24640]
    - [1, 1613.0]
  - - [32, 24576, 1, 32, 32, 32, 32, 24704]
    - [1, 1613.0]
  - - [32, 28672, 1, 32, 32, 32, 32, 28672]
    - [0, 1617.0]
  - - [32, 28672, 1, 32, 32, 32, 32, 28736]
    - [0, 1646.0]
  - - [32, 28672, 1, 32, 32, 32, 32, 28800]
    - [0, 1661.0]
  - - [32, 32768, 1, 32, 32, 32, 32, 32768]
    - [1, 1645.0]
  - - [32, 32768, 1, 32, 32, 32, 32, 32832]
    - [0, 1733.0]
  - - [32, 32768, 1, 32, 32, 32, 32, 32896]
    - [0, 1712.0]
- null
