src/Tensile/data/Configs/miopen/archives/sparsNN/exact/vega20_Cijk_Alik_Bljk_SB.yaml
- {MinimumRequiredVersion: 4.9.1}
- vega20
- gfx906
- [Device 66a0, Device 66a1, Device 66a7]
    SolutionIndex: 0
    SolutionNameMin: Cijk_Alik_Bljk_SB_MT128x128x16_EPS1_GSU1_LPA0_LPB0_PGR1_SNLL1_TT8_8_VW2_WG16_16_1_WGM1
    SolutionIndex: 1
    SolutionNameMin: Cijk_Alik_Bljk_SB_MT64x32x16_EPS1_GSU3_LPA0_LPB0_PGR1_SNLL0_TT4_4_VW2_WG16_8_1_WGM1
    SolutionIndex: 2
    SolutionNameMin: Cijk_Alik_Bljk_SB_MT64x64x16_EPS1_GSU3_LPA0_LPB0_PGR1_SNLL0_TT4_4_VW2_WG16_16_1_WGM1
    SolutionIndex: 3
    SolutionNameMin: Cijk_Alik_Bljk_SB_MT128x128x16_EPS1_GSU3_LPA0_LPB0_PGR1_SNLL0_TT8_8_VW2_WG16_16_1_WGM1
    SolutionIndex: 4
    SolutionNameMin: Cijk_Alik_Bljk_SB_MT64x64x16_EPS1_GSU5_LPA0_LPB0_PGR1_SNLL0_TT4_4_VW2_WG16_16_1_WGM1
    SolutionIndex: 5
    SolutionNameMin: Cijk_Alik_Bljk_SB_MT128x128x16_EPS1_GSU5_LPA0_LPB0_PGR1_SNLL0_TT8_8_VW2_WG16_16_1_WGM1
    SolutionIndex: 6
    SolutionNameMin: Cijk_Alik_Bljk_SB_MT64x64x16_EPS1_GSU5_LPA0_LPB0_PGR1_SNLL0_TT4_4_VW2_WG16_16_1_WGM8
    SolutionIndex: 7
    SolutionNameMin: Cijk_Alik_Bljk_SB_MT64x64x16_EPS1_GSU3_LPA0_LPB0_PGR1_SNLL0_TT4_4_VW2_WG16_16_1_WGM64
    SolutionIndex: 8
    SolutionNameMin: Cijk_Alik_Bljk_SB_MT32x128x16_EPS1_GSU5_LPA0_LPB0_PGR1_SNLL0_TT4_4_VW2_WG8_32_1_WGM64
    SolutionIndex: 9
    SolutionNameMin: Cijk_Alik_Bljk_SB_MT64x64x16_EPS1_GSU5_LPA0_LPB0_PGR1_SNLL0_TT4_4_VW2_WG16_16_1_WGM64
    SolutionIndex: 10
    SolutionNameMin: Cijk_Alik_Bljk_SB_MT128x32x8_EPS1_GSU1_LPA0_LPB0_PGR1_SNLL1_TT4_4_VW4_WG32_8_1_WGM1
    SolutionIndex: 11
    SolutionNameMin: Cijk_Alik_Bljk_SB_MT128x128x16_EPS1_GSU1_LPA0_LPB0_PGR1_SNLL1_TT8_8_VW4_WG16_16_1_WGM1
    SolutionIndex: 12
    SolutionNameMin: Cijk_Alik_Bljk_SB_MT64x64x16_EPS1_GSU3_LPA0_LPB0_PGR1_SNLL0_TT4_4_VW4_WG16_16_1_WGM1
    SolutionIndex: 13
    SolutionNameMin: Cijk_Alik_Bljk_SB_MT128x128x16_EPS1_GSU1_LPA0_LPB0_PGR1_SNLL1_TT8_8_VW4_WG16_16_1_WGM8
    SolutionIndex: 14
    SolutionNameMin: Cijk_Alik_Bljk_SB_MT128x64x16_EPS0_GSU1_LPA0_LPB0_PGR0_SNLL0_TT4_8_VW4_WG32_8_1_WGM8
    SolutionIndex: 15
    SolutionNameMin: Cijk_Alik_Bljk_SB_MT64x32x16_EPS1_GSU1_LPA0_LPB0_PGR1_SNLL1_TT4_4_VW4_WG16_8_1_WGM64
    SolutionIndex: 16
    SolutionNameMin: Cijk_Alik_Bljk_SB_MT128x128x16_EPS1_GSU1_LPA0_LPB0_PGR1_SNLL1_TT8_8_VW4_WG16_16_1_WGM64
    SolutionIndex: 17
    SolutionNameMin: Cijk_Alik_Bljk_SB_MT128x64x16_EPS1_GSU1_LPA0_LPB0_PGR1_SNLL1_TT4_8_VW4_WG32_8_1_WGM64
    SolutionIndex: 18
    SolutionNameMin: Cijk_Alik_Bljk_SB_MT64x64x8_EPS1_GSU1_LPA2_LPB0_PGR1_SNLL1_TT4_8_VW2_WG16_8_1_WGM8
    SolutionIndex: 19
    SolutionNameMin: Cijk_Alik_Bljk_SB_MT64x32x16_EPS1_GSU3_LPA2_LPB0_PGR1_SNLL0_TT4_4_VW2_WG16_8_1_WGM1
    SolutionIndex: 20
    SolutionNameMin: Cijk_Alik_Bljk_SB_MT128x32x16_EPS1_GSU3_LPA2_LPB0_PGR1_SNLL0_TT4_4_VW2_WG32_8_1_WGM1
    SolutionIndex: 21
    SolutionNameMin: Cijk_Alik_Bljk_SB_MT64x64x16_EPS1_GSU5_LPA2_LPB0_PGR1_SNLL0_TT4_4_VW2_WG16_16_1_WGM1
    SolutionIndex: 22
    SolutionNameMin: Cijk_Alik_Bljk_SB_MT64x32x16_EPS0_GSU1_LPA2_LPB0_PGR0_SNLL0_TT4_4_VW2_WG16_8_1_WGM8
    SolutionIndex: 23
    SolutionNameMin: Cijk_Alik_Bljk_SB_MT64x64x16_EPS0_GSU1_LPA2_LPB0_PGR0_SNLL0_TT4_4_VW2_WG16_16_1_WGM8
    SolutionIndex: 24
    SolutionNameMin: Cijk_Alik_Bljk_SB_MT64x32x16_EPS1_GSU3_LPA2_LPB0_PGR1_SNLL0_TT4_4_VW2_WG16_8_1_WGM8
    SolutionIndex: 25
    SolutionNameMin: Cijk_Alik_Bljk_SB_MT64x64x16_EPS1_GSU5_LPA2_LPB0_PGR1_SNLL0_TT4_4_VW2_WG16_16_1_WGM8
    SolutionIndex: 26
    SolutionNameMin: Cijk_Alik_Bljk_SB_MT128x32x16_EPS1_GSU1_LPA2_LPB0_PGR1_SNLL1_TT4_4_VW2_WG32_8_1_WGM64
    SolutionIndex: 27
    SolutionNameMin: Cijk_Alik_Bljk_SB_MT64x32x16_EPS1_GSU5_LPA2_LPB0_PGR1_SNLL0_TT4_4_VW2_WG16_8_1_WGM64
    SolutionIndex: 28
    SolutionNameMin: Cijk_Alik_Bljk_SB_MT256x64x8_EPS1_GSU1_LPA4_LPB0_PGR1_SNLL1_TT8_8_VW4_WG32_8_1_WGM1
    SolutionIndex: 29
    SolutionNameMin: Cijk_Alik_Bljk_SB_MT128x128x8_EPS1_GSU1_LPA4_LPB0_PGR1_SNLL1_TT8_8_VW4_WG16_16_1_WGM8
    SolutionIndex: 30
    SolutionNameMin: Cijk_Alik_Bljk_SB_MT64x64x16_EPS1_GSU5_LPA4_LPB0_PGR1_SNLL0_TT4_4_VW4_WG16_16_1_WGM1
    SolutionIndex: 31
    SolutionNameMin: Cijk_Alik_Bljk_SB_MT64x64x16_EPS1_GSU1_LPA4_LPB0_PGR1_SNLL1_TT4_4_VW4_WG16_16_1_WGM8
    SolutionIndex: 32
    SolutionNameMin: Cijk_Alik_Bljk_SB_MT128x64x16_EPS1_GSU1_LPA4_LPB0_PGR1_SNLL1_TT8_4_VW4_WG16_16_1_WGM8
    SolutionIndex: 33
    SolutionNameMin: Cijk_Alik_Bljk_SB_MT128x64x16_EPS0_GSU1_LPA4_LPB0_PGR0_SNLL0_TT4_8_VW4_WG32_8_1_WGM8
    SolutionIndex: 34
    SolutionNameMin: Cijk_Alik_Bljk_SB_MT128x64x16_EPS1_GSU1_LPA4_LPB0_PGR1_SNLL1_TT4_8_VW4_WG32_8_1_WGM8
    SolutionIndex: 35
    SolutionNameMin: Cijk_Alik_Bljk_SB_MT64x64x16_EPS1_GSU1_LPA4_LPB0_PGR1_SNLL1_TT4_4_VW4_WG16_16_1_WGM64
    SolutionIndex: 36
    SolutionNameMin: Cijk_Alik_Bljk_SB_MT128x32x16_EPS0_GSU1_LPA4_LPB0_PGR0_SNLL0_TT4_4_VW4_WG32_8_1_WGM64
    SolutionIndex: 37
    SolutionNameMin: Cijk_Alik_Bljk_SB_MT64x32x16_EPS1_GSU5_LPA4_LPB0_PGR1_SNLL0_TT4_4_VW4_WG16_8_1_WGM64
    SolutionIndex: 38
    SolutionNameMin: Cijk_Alik_Bljk_SB_MT32x128x32_EPS1_GSU1_LPA4_LPB0_PGR1_SNLL1_TT4_4_VW4_WG8_32_1_WGM64
    SolutionIndex: 39
    SolutionNameMin: Cijk_Alik_Bljk_SB_MT128x64x8_EPS1_GSU1_LPA0_LPB2_PGR1_SNLL1_TT8_4_VW2_WG16_16_1_WGM8
    SolutionIndex: 40
    SolutionNameMin: Cijk_Alik_Bljk_SB_MT64x32x16_EPS1_GSU5_LPA0_LPB2_PGR1_SNLL0_TT4_4_VW2_WG16_8_1_WGM1
    SolutionIndex: 41
    SolutionNameMin: Cijk_Alik_Bljk_SB_MT64x64x16_EPS1_GSU5_LPA0_LPB2_PGR1_SNLL0_TT4_4_VW2_WG16_16_1_WGM1
    SolutionIndex: 42
    SolutionNameMin: Cijk_Alik_Bljk_SB_MT64x64x16_EPS1_GSU3_LPA0_LPB2_PGR1_SNLL0_TT4_4_VW2_WG16_16_1_WGM64
    SolutionIndex: 43
    SolutionNameMin: Cijk_Alik_Bljk_SB_MT64x32x16_EPS1_GSU5_LPA0_LPB2_PGR1_SNLL0_TT4_4_VW2_WG16_8_1_WGM64
    SolutionIndex: 44
    SolutionNameMin: Cijk_Alik_Bljk_SB_MT128x64x8_EPS1_GSU1_LPA0_LPB4_PGR1_SNLL1_TT4_8_VW4_WG32_8_1_WGM8
    SolutionIndex: 45
    SolutionNameMin: Cijk_Alik_Bljk_SB_MT64x32x16_EPS1_GSU1_LPA0_LPB4_PGR1_SNLL1_TT4_4_VW4_WG16_8_1_WGM1
    SolutionIndex: 46
    SolutionNameMin: Cijk_Alik_Bljk_SB_MT128x64x16_EPS0_GSU1_LPA0_LPB4_PGR0_SNLL0_TT8_4_VW4_WG16_16_1_WGM1
    SolutionIndex: 47
    SolutionNameMin: Cijk_Alik_Bljk_SB_MT64x32x16_EPS1_GSU5_LPA0_LPB4_PGR1_SNLL0_TT4_4_VW4_WG16_8_1_WGM1
    SolutionIndex: 48
    SolutionNameMin: Cijk_Alik_Bljk_SB_MT64x64x16_EPS1_GSU5_LPA0_LPB4_PGR1_SNLL0_TT4_4_VW4_WG16_16_1_WGM1
    SolutionIndex: 49
    SolutionNameMin: Cijk_Alik_Bljk_SB_MT64x128x16_EPS1_GSU1_LPA0_LPB4_PGR1_SNLL1_TT8_4_VW4_WG8_32_1_WGM8
    SolutionIndex: 50
    SolutionNameMin: Cijk_Alik_Bljk_SB_MT64x256x16_EPS1_GSU1_LPA0_LPB4_PGR1_SNLL1_TT8_8_VW4_WG8_32_1_WGM8
    SolutionIndex: 51
    SolutionNameMin: Cijk_Alik_Bljk_SB_MT64x128x16_EPS1_GSU1_LPA0_LPB4_PGR1_SNLL1_TT4_8_VW4_WG16_16_1_WGM8
    SolutionIndex: 52
    SolutionNameMin: Cijk_Alik_Bljk_SB_MT128x32x16_EPS0_GSU1_LPA0_LPB4_PGR0_SNLL0_TT4_4_VW4_WG32_8_1_WGM8
    SolutionIndex: 53
    SolutionNameMin: Cijk_Alik_Bljk_SB_MT64x32x16_EPS1_GSU5_LPA0_LPB4_PGR1_SNLL0_TT4_4_VW4_WG16_8_1_WGM8
    SolutionIndex: 54
    SolutionNameMin: Cijk_Alik_Bljk_SB_MT64x64x16_EPS1_GSU5_LPA0_LPB4_PGR1_SNLL0_TT4_4_VW4_WG16_16_1_WGM8
    SolutionIndex: 55
    SolutionNameMin: Cijk_Alik_Bljk_SB_MT64x32x16_EPS1_GSU1_LPA0_LPB4_PGR1_SNLL1_TT4_4_VW4_WG16_8_1_WGM64
    SolutionIndex: 56
    SolutionNameMin: Cijk_Alik_Bljk_SB_MT32x256x16_EPS1_GSU1_LPA0_LPB4_PGR1_SNLL1_TT4_8_VW4_WG8_32_1_WGM64
    SolutionIndex: 57
    SolutionNameMin: Cijk_Alik_Bljk_SB_MT64x128x16_EPS1_GSU1_LPA0_LPB4_PGR1_SNLL1_TT8_4_VW4_WG8_32_1_WGM64
    SolutionIndex: 58
    SolutionNameMin: Cijk_Alik_Bljk_SB_MT64x128x16_EPS1_GSU1_LPA0_LPB4_PGR1_SNLL1_TT4_8_VW4_WG16_16_1_WGM64
    SolutionIndex: 59
    SolutionNameMin: Cijk_Alik_Bljk_SB_MT128x64x16_EPS1_GSU1_LPA0_LPB4_PGR1_SNLL1_TT4_8_VW4_WG32_8_1_WGM64
    SolutionIndex: 60
    SolutionNameMin: Cijk_Alik_Bljk_SB_MT64x32x16_EPS1_GSU5_LPA0_LPB4_PGR1_SNLL0_TT4_4_VW4_WG16_8_1_WGM64
    SolutionIndex: 61
    SolutionNameMin: Cijk_Alik_Bljk_SB_MT32x128x32_EPS1_GSU5_LPA0_LPB4_PGR1_SNLL0_TT4_4_VW4_WG8_32_1_WGM8
    SolutionIndex: 62
    SolutionNameMin: Cijk_Alik_Bljk_SB_MT32x128x32_EPS1_GSU1_LPA0_LPB4_PGR1_SNLL1_TT4_4_VW4_WG8_32_1_WGM64
    SolutionIndex: 63
    SolutionNameMin: Cijk_Alik_Bljk_SB_MT128x32x8_EPS1_GSU1_LPA2_LPB2_PGR1_SNLL1_TT4_4_VW2_WG32_8_1_WGM64
    SolutionIndex: 64
    SolutionNameMin: Cijk_Alik_Bljk_SB_MT64x32x16_EPS1_GSU3_LPA2_LPB2_PGR1_SNLL0_TT4_4_VW2_WG16_8_1_WGM1
    SolutionIndex: 65
    SolutionNameMin: Cijk_Alik_Bljk_SB_MT32x128x16_EPS1_GSU3_LPA2_LPB2_PGR1_SNLL0_TT4_4_VW2_WG8_32_1_WGM1
    SolutionIndex: 66
    SolutionNameMin: Cijk_Alik_Bljk_SB_MT64x64x16_EPS1_GSU3_LPA2_LPB2_PGR1_SNLL0_TT4_4_VW2_WG16_16_1_WGM1
    SolutionIndex: 67
    SolutionNameMin: Cijk_Alik_Bljk_SB_MT64x128x16_EPS1_GSU3_LPA2_LPB2_PGR1_SNLL0_TT4_8_VW2_WG16_16_1_WGM1
    SolutionIndex: 68
    SolutionNameMin: Cijk_Alik_Bljk_SB_MT128x32x16_EPS1_GSU3_LPA2_LPB2_PGR1_SNLL0_TT4_4_VW2_WG32_8_1_WGM1
    SolutionIndex: 69
    SolutionNameMin: Cijk_Alik_Bljk_SB_MT64x32x16_EPS1_GSU5_LPA2_LPB2_PGR1_SNLL0_TT4_4_VW2_WG16_8_1_WGM1
    SolutionIndex: 70
    SolutionNameMin: Cijk_Alik_Bljk_SB_MT64x64x16_EPS0_GSU5_LPA2_LPB2_PGR0_SNLL0_TT4_4_VW2_WG16_16_1_WGM1
    SolutionIndex: 71
    SolutionNameMin: Cijk_Alik_Bljk_SB_MT64x64x16_EPS1_GSU5_LPA2_LPB2_PGR1_SNLL0_TT4_4_VW2_WG16_16_1_WGM1
    SolutionIndex: 72
    SolutionNameMin: Cijk_Alik_Bljk_SB_MT128x64x16_EPS1_GSU5_LPA2_LPB2_PGR1_SNLL0_TT8_4_VW2_WG16_16_1_WGM1
    SolutionIndex: 73
    SolutionNameMin: Cijk_Alik_Bljk_SB_MT128x64x16_EPS1_GSU5_LPA2_LPB2_PGR1_SNLL0_TT4_8_VW2_WG32_8_1_WGM1
    SolutionIndex: 74
    SolutionNameMin: Cijk_Alik_Bljk_SB_MT64x32x16_EPS1_GSU1_LPA2_LPB2_PGR1_SNLL1_TT4_4_VW2_WG16_8_1_WGM8
    SolutionIndex: 75
    SolutionNameMin: Cijk_Alik_Bljk_SB_MT64x64x16_EPS1_GSU1_LPA2_LPB2_PGR1_SNLL1_TT4_4_VW2_WG16_16_1_WGM8
    SolutionIndex: 76
    SolutionNameMin: Cijk_Alik_Bljk_SB_MT128x64x16_EPS1_GSU1_LPA2_LPB2_PGR1_SNLL1_TT8_4_VW2_WG16_16_1_WGM8
    SolutionIndex: 77
    SolutionNameMin: Cijk_Alik_Bljk_SB_MT64x128x16_EPS1_GSU3_LPA2_LPB2_PGR1_SNLL0_TT8_4_VW2_WG8_32_1_WGM8
    SolutionIndex: 78
    SolutionNameMin: Cijk_Alik_Bljk_SB_MT32x128x16_EPS1_GSU5_LPA2_LPB2_PGR1_SNLL0_TT4_4_VW2_WG8_32_1_WGM8
    SolutionIndex: 79
    SolutionNameMin: Cijk_Alik_Bljk_SB_MT64x128x16_EPS1_GSU5_LPA2_LPB2_PGR1_SNLL0_TT8_4_VW2_WG8_32_1_WGM8
    SolutionIndex: 80
    SolutionNameMin: Cijk_Alik_Bljk_SB_MT64x64x16_EPS1_GSU5_LPA2_LPB2_PGR1_SNLL0_TT4_4_VW2_WG16_16_1_WGM8
    SolutionIndex: 81
    SolutionNameMin: Cijk_Alik_Bljk_SB_MT64x128x16_EPS1_GSU5_LPA2_LPB2_PGR1_SNLL0_TT4_8_VW2_WG16_16_1_WGM8
    SolutionIndex: 82
    SolutionNameMin: Cijk_Alik_Bljk_SB_MT64x64x16_EPS1_GSU1_LPA2_LPB2_PGR1_SNLL1_TT4_4_VW2_WG16_16_1_WGM64
    SolutionIndex: 83
    SolutionNameMin: Cijk_Alik_Bljk_SB_MT64x128x16_EPS1_GSU1_LPA2_LPB2_PGR1_SNLL1_TT4_8_VW2_WG16_16_1_WGM64
    SolutionIndex: 84
    SolutionNameMin: Cijk_Alik_Bljk_SB_MT64x128x16_EPS1_GSU3_LPA2_LPB2_PGR1_SNLL0_TT4_8_VW2_WG16_16_1_WGM64
    SolutionIndex: 85
    SolutionNameMin: Cijk_Alik_Bljk_SB_MT128x64x16_EPS1_GSU3_LPA2_LPB2_PGR1_SNLL0_TT8_4_VW2_WG16_16_1_WGM64
    SolutionIndex: 86
    SolutionNameMin: Cijk_Alik_Bljk_SB_MT64x32x16_EPS1_GSU5_LPA2_LPB2_PGR1_SNLL0_TT4_4_VW2_WG16_8_1_WGM64
    SolutionIndex: 87
    SolutionNameMin: Cijk_Alik_Bljk_SB_MT64x64x16_EPS1_GSU5_LPA2_LPB2_PGR1_SNLL0_TT4_4_VW2_WG16_16_1_WGM64
    SolutionIndex: 88
    SolutionNameMin: Cijk_Alik_Bljk_SB_MT32x128x32_EPS1_GSU5_LPA2_LPB2_PGR1_SNLL0_TT4_4_VW2_WG8_32_1_WGM1
    SolutionIndex: 89
    SolutionNameMin: Cijk_Alik_Bljk_SB_MT64x128x32_EPS1_GSU1_LPA2_LPB2_PGR1_SNLL1_TT8_4_VW2_WG8_32_1_WGM8
    SolutionIndex: 90
    SolutionNameMin: Cijk_Alik_Bljk_SB_MT64x64x32_EPS1_GSU5_LPA2_LPB2_PGR1_SNLL0_TT4_4_VW2_WG16_16_1_WGM64
    SolutionIndex: 91
    SolutionNameMin: Cijk_Alik_Bljk_SB_MT128x32x8_EPS1_GSU1_LPA4_LPB4_PGR1_SNLL1_TT4_4_VW4_WG32_8_1_WGM8
    SolutionIndex: 92
    SolutionNameMin: Cijk_Alik_Bljk_SB_MT128x64x8_EPS1_GSU1_LPA4_LPB4_PGR1_SNLL1_TT4_8_VW4_WG32_8_1_WGM8
    SolutionIndex: 93
    SolutionNameMin: Cijk_Alik_Bljk_SB_MT64x32x16_EPS1_GSU1_LPA4_LPB4_PGR1_SNLL1_TT4_4_VW4_WG16_8_1_WGM1
    SolutionIndex: 94
    SolutionNameMin: Cijk_Alik_Bljk_SB_MT32x128x16_EPS1_GSU1_LPA4_LPB4_PGR1_SNLL1_TT4_4_VW4_WG8_32_1_WGM1
    SolutionIndex: 95
    SolutionNameMin: Cijk_Alik_Bljk_SB_MT64x64x16_EPS1_GSU1_LPA4_LPB4_PGR1_SNLL1_TT4_4_VW4_WG16_16_1_WGM1
    SolutionIndex: 96
    SolutionNameMin: Cijk_Alik_Bljk_SB_MT128x64x16_EPS1_GSU1_LPA4_LPB4_PGR1_SNLL1_TT8_4_VW4_WG16_16_1_WGM1
    SolutionIndex: 97
    SolutionNameMin: Cijk_Alik_Bljk_SB_MT128x32x16_EPS1_GSU1_LPA4_LPB4_PGR1_SNLL1_TT4_4_VW4_WG32_8_1_WGM1
    SolutionIndex: 98
    SolutionNameMin: Cijk_Alik_Bljk_SB_MT128x64x16_EPS1_GSU1_LPA4_LPB4_PGR1_SNLL1_TT4_8_VW4_WG32_8_1_WGM1
    SolutionIndex: 99
    SolutionNameMin: Cijk_Alik_Bljk_SB_MT256x32x16_EPS0_GSU1_LPA4_LPB4_PGR0_SNLL0_TT8_4_VW4_WG32_8_1_WGM1
    SolutionIndex: 100
    SolutionNameMin: Cijk_Alik_Bljk_SB_MT128x64x16_EPS1_GSU3_LPA4_LPB4_PGR1_SNLL0_TT8_4_VW4_WG16_16_1_WGM1
    SolutionIndex: 101
    SolutionNameMin: Cijk_Alik_Bljk_SB_MT64x32x16_EPS1_GSU5_LPA4_LPB4_PGR1_SNLL0_TT4_4_VW4_WG16_8_1_WGM1
    SolutionIndex: 102
    SolutionNameMin: Cijk_Alik_Bljk_SB_MT64x128x16_EPS1_GSU1_LPA4_LPB4_PGR1_SNLL1_TT8_4_VW4_WG8_32_1_WGM8
    SolutionIndex: 103
    SolutionNameMin: Cijk_Alik_Bljk_SB_MT64x64x16_EPS1_GSU1_LPA4_LPB4_PGR1_SNLL1_TT4_4_VW4_WG16_16_1_WGM8
    SolutionIndex: 104
    SolutionNameMin: Cijk_Alik_Bljk_SB_MT64x128x16_EPS1_GSU1_LPA4_LPB4_PGR1_SNLL1_TT4_8_VW4_WG16_16_1_WGM8
    SolutionIndex: 105
    SolutionNameMin: Cijk_Alik_Bljk_SB_MT128x64x16_EPS1_GSU1_LPA4_LPB4_PGR1_SNLL1_TT8_4_VW4_WG16_16_1_WGM8
    SolutionIndex: 106
    SolutionNameMin: Cijk_Alik_Bljk_SB_MT128x128x16_EPS1_GSU1_LPA4_LPB4_PGR1_SNLL1_TT8_8_VW4_WG16_16_1_WGM8
    SolutionIndex: 107
    SolutionNameMin: Cijk_Alik_Bljk_SB_MT128x32x16_EPS0_GSU1_LPA4_LPB4_PGR0_SNLL0_TT4_4_VW4_WG32_8_1_WGM8
    SolutionIndex: 108
    SolutionNameMin: Cijk_Alik_Bljk_SB_MT128x32x16_EPS1_GSU1_LPA4_LPB4_PGR1_SNLL1_TT4_4_VW4_WG32_8_1_WGM8
    SolutionIndex: 109
    SolutionNameMin: Cijk_Alik_Bljk_SB_MT128x64x16_EPS1_GSU1_LPA4_LPB4_PGR1_SNLL1_TT4_8_VW4_WG32_8_1_WGM8
    SolutionIndex: 110
    SolutionNameMin: Cijk_Alik_Bljk_SB_MT64x32x16_EPS1_GSU5_LPA4_LPB4_PGR1_SNLL0_TT4_4_VW4_WG16_8_1_WGM8
    SolutionIndex: 111
    SolutionNameMin: Cijk_Alik_Bljk_SB_MT64x32x16_EPS1_GSU1_LPA4_LPB4_PGR1_SNLL1_TT4_4_VW4_WG16_8_1_WGM64
    SolutionIndex: 112
    SolutionNameMin: Cijk_Alik_Bljk_SB_MT32x128x16_EPS1_GSU1_LPA4_LPB4_PGR1_SNLL1_TT4_4_VW4_WG8_32_1_WGM64
    SolutionIndex: 113
    SolutionNameMin: Cijk_Alik_Bljk_SB_MT64x128x16_EPS1_GSU1_LPA4_LPB4_PGR1_SNLL1_TT8_4_VW4_WG8_32_1_WGM64
    SolutionIndex: 114
    SolutionNameMin: Cijk_Alik_Bljk_SB_MT64x64x16_EPS1_GSU1_LPA4_LPB4_PGR1_SNLL1_TT4_4_VW4_WG16_16_1_WGM64
    SolutionIndex: 115
    SolutionNameMin: Cijk_Alik_Bljk_SB_MT64x128x16_EPS1_GSU1_LPA4_LPB4_PGR1_SNLL1_TT4_8_VW4_WG16_16_1_WGM64
    SolutionIndex: 116
    SolutionNameMin: Cijk_Alik_Bljk_SB_MT128x64x16_EPS1_GSU1_LPA4_LPB4_PGR1_SNLL1_TT8_4_VW4_WG16_16_1_WGM64
    SolutionIndex: 117
    SolutionNameMin: Cijk_Alik_Bljk_SB_MT128x128x16_EPS1_GSU1_LPA4_LPB4_PGR1_SNLL1_TT8_8_VW4_WG16_16_1_WGM64
    SolutionIndex: 118
    SolutionNameMin: Cijk_Alik_Bljk_SB_MT128x32x16_EPS1_GSU1_LPA4_LPB4_PGR1_SNLL1_TT4_4_VW4_WG32_8_1_WGM64
    SolutionIndex: 119
    SolutionNameMin: Cijk_Alik_Bljk_SB_MT128x64x16_EPS1_GSU1_LPA4_LPB4_PGR1_SNLL1_TT4_8_VW4_WG32_8_1_WGM64
    SolutionIndex: 120
    SolutionNameMin: Cijk_Alik_Bljk_SB_MT32x128x16_EPS1_GSU5_LPA4_LPB4_PGR1_SNLL0_TT4_4_VW4_WG8_32_1_WGM64
    SolutionIndex: 121
    SolutionNameMin: Cijk_Alik_Bljk_SB_MT32x128x32_EPS1_GSU1_LPA4_LPB4_PGR1_SNLL1_TT4_4_VW4_WG8_32_1_WGM1
    SolutionIndex: 122
    SolutionNameMin: Cijk_Alik_Bljk_SB_MT64x64x32_EPS1_GSU1_LPA4_LPB4_PGR1_SNLL1_TT4_4_VW4_WG16_16_1_WGM1
    SolutionIndex: 123
    SolutionNameMin: Cijk_Alik_Bljk_SB_MT32x128x32_EPS1_GSU5_LPA4_LPB4_PGR1_SNLL0_TT4_4_VW4_WG8_32_1_WGM1
    SolutionIndex: 124
    SolutionNameMin: Cijk_Alik_Bljk_SB_MT64x64x32_EPS1_GSU1_LPA4_LPB4_PGR1_SNLL1_TT4_4_VW4_WG16_16_1_WGM8
    SolutionIndex: 125
    SolutionNameMin: Cijk_Alik_Bljk_SB_MT64x128x32_EPS1_GSU1_LPA4_LPB4_PGR1_SNLL1_TT4_8_VW4_WG16_16_1_WGM8
    SolutionIndex: 126
    SolutionNameMin: Cijk_Alik_Bljk_SB_MT64x64x32_EPS1_GSU1_LPA4_LPB4_PGR1_SNLL1_TT4_4_VW4_WG16_16_1_WGM64
    SolutionIndex: 127
    SolutionNameMin: Cijk_Alik_Bljk_SB_MT64x128x32_EPS1_GSU1_LPA4_LPB4_PGR1_SNLL1_TT4_8_VW4_WG16_16_1_WGM64
- - - [1024, 1024, 1, 3328]
    - [109, 8705.0]
  - - [2048, 200, 1, 3200]
    - [114, 6173.32]
  - - [1024, 200, 1, 13312]
    - [12, 5213.21]
  - - [1024, 256, 1, 1536]
    - [114, 5859.33]
  - - [4096, 256, 1, 12288]
    - [119, 8807.42]
  - - [64, 200, 1, 1024]
    - [86, 366.532]
  - - [32, 512, 1, 1024]
    - [41, 452.949]
  - - [2048, 256, 1, 3328]
    - [103, 7876.63]
  - - [4096, 512, 1, 32]
    - [107, 3975.64]
  - - [2048, 256, 1, 13312]
    - [84, 7837.71]
  - - [4096, 200, 1, 11264]
    - [119, 6902.66]
  - - [2048, 512, 1, 1024]
    - [113, 8100.04]
  - - [2048, 1024, 1, 1664]
    - [13, 9081.98]
  - - [1024, 1024, 1, 64]
    - [109, 4258.18]
  - - [512, 1024, 1, 1536]
    - [103, 7597.23]
  - - [1024, 256, 1, 15360]
    - [4, 6735.14]
  - - [1, 512, 1, 1024]
    - [54, 15.0657]
  - - [4096, 512, 1, 1408]
    - [16, 9024.42]
  - - [1024, 200, 1, 1408]
    - [114, 4460.99]
  - - [1024, 512, 1, 512]
    - [108, 6528.1]
  - - [4096, 256, 1, 15360]
    - [115, 8823.93]
  - - [2048, 512, 1, 640]
    - [105, 7989.15]
  - - [4096, 1024, 1, 1280]
    - [11, 9421.44]
  - - [1024, 200, 1, 6144]
    - [103, 4966.42]
  - - [1024, 1024, 1, 512]
    - [105, 7731.44]
  - - [128, 512, 1, 2048]
    - [21, 2190.24]
  - - [2048, 1024, 1, 640]
    - [11, 8581.7]
  - - [1024, 256, 1, 3328]
    - [103, 6192.61]
  - - [4096, 1024, 1, 13312]
    - [16, 9642.49]
  - - [2048, 256, 1, 2048]
    - [103, 7485.65]
  - - [2048, 1024, 1, 13312]
    - [16, 9352.16]
  - - [2048, 512, 1, 16640]
    - [104, 8839.07]
  - - [1024, 512, 1, 128]
    - [108, 4279.9]
  - - [2048, 1024, 1, 3584]
    - [11, 9264.62]
  - - [2048, 512, 1, 256]
    - [119, 6990.51]
  - - [512, 256, 1, 3200]
    - [66, 4154.42]
  - - [4096, 1024, 1, 1920]
    - [11, 9535.22]
  - - [4096, 200, 1, 2560]
    - [116, 6754.55]
  - - [1024, 256, 1, 16384]
    - [6, 6289.5]
  - - [1024, 1024, 1, 1152]
    - [109, 8407.29]
  - - [2048, 200, 1, 32]
    - [52, 1412.41]
  - - [512, 1024, 1, 2816]
    - [103, 7843.15]
  - - [4096, 256, 1, 14336]
    - [115, 8844.67]
  - - [1024, 200, 1, 4608]
    - [114, 4931.64]
  - - [1024, 200, 1, 16384]
    - [9, 5135.05]
  - - [64, 256, 1, 1024]
    - [87, 460.913]
  - - [1, 200, 1, 1024]
    - [69, 7.39884]
  - - [2048, 200, 1, 2080]
    - [114, 6033.77]
  - - [512, 256, 1, 1792]
    - [24, 3153.61]
  - - [2048, 200, 1, 1024]
    - [114, 5711.2]
  - - [4096, 1024, 1, 12288]
    - [11, 9658.13]
  - - [4096, 200, 1, 4096]
    - [105, 6834.45]
  - - [1024, 512, 1, 11264]
    - [72, 7686.36]
  - - [128, 512, 1, 1024]
    - [42, 1458.89]
  - - [32, 256, 1, 2048]
    - [60, 384.799]
  - - [1024, 200, 1, 1792]
    - [114, 4638.54]
  - - [1024, 1024, 1, 1792]
    - [109, 8550.46]
  - - [32, 256, 1, 512]
    - [93, 161.319]
  - - [512, 200, 1, 2816]
    - [19, 3353.0]
  - - [512, 200, 1, 3072]
    - [4, 3298.79]
  - - [1024, 1024, 1, 8192]
    - [50, 8369.0]
  - - [1024, 256, 1, 12288]
    - [7, 6475.61]
  - - [4096, 200, 1, 768]
    - [109, 6367.87]
  - - [1024, 512, 1, 16384]
    - [125, 7367.02]
  - - [4096, 256, 1, 1024]
    - [105, 8214.06]
  - - [1024, 512, 1, 256]
    - [108, 5537.03]
  - - [4096, 1024, 1, 8320]
    - [11, 9674.16]
  - - [4096, 256, 1, 9216]
    - [113, 8790.92]
  - - [1024, 512, 1, 1408]
    - [103, 7459.55]
  - - [1024, 512, 1, 5632]
    - [114, 7997.81]
  - - [4096, 200, 1, 256]
    - [119, 5371.8]
  - - [1024, 200, 1, 128]
    - [97, 1998.05]
  - - [256, 200, 1, 1024]
    - [66, 1195.91]
  - - [1024, 200, 1, 5120]
    - [114, 4957.34]
  - - [512, 1024, 1, 3072]
    - [127, 7103.97]
  - - [4096, 1024, 1, 15360]
    - [11, 9668.94]
  - - [1, 256, 1, 2048]
    - [53, 13.8262]
  - - [1024, 1024, 1, 4160]
    - [105, 8759.2]
  - - [1024, 256, 1, 256]
    - [112, 3728.27]
  - - [2048, 256, 1, 384]
    - [114, 6123.07]
  - - [512, 256, 1, 2560]
    - [68, 3809.54]
  - - [4096, 512, 1, 3072]
    - [16, 9215.09]
  - - [1024, 256, 1, 4160]
    - [103, 6293.39]
  - - [4096, 512, 1, 13312]
    - [13, 9367.22]
  - - [4096, 1024, 1, 3840]
    - [11, 9631.47]
  - - [4096, 200, 1, 640]
    - [109, 6206.06]
  - - [32, 200, 1, 2048]
    - [47, 303.407]
  - - [1024, 200, 1, 512]
    - [103, 3713.09]
  - - [1024, 1024, 1, 7168]
    - [106, 8475.64]
  - - [2048, 1024, 1, 3200]
    - [11, 9271.24]
  - - [512, 512, 1, 1536]
    - [114, 5832.17]
  - - [4096, 256, 1, 768]
    - [119, 8065.97]
  - - [2048, 256, 1, 6656]
    - [103, 8034.77]
  - - [1024, 256, 1, 896]
    - [103, 5467.44]
  - - [2048, 256, 1, 512]
    - [114, 6465.21]
  - - [2048, 200, 1, 3072]
    - [114, 6165.68]
  - - [128, 200, 1, 1024]
    - [71, 692.77]
  - - [4096, 512, 1, 3840]
    - [16, 9272.6]
  - - [1024, 200, 1, 3200]
    - [114, 4838.75]
  - - [4096, 512, 1, 5632]
    - [11, 9335.42]
  - - [4096, 512, 1, 64]
    - [46, 5275.85]
  - - [1024, 512, 1, 2816]
    - [103, 7816.58]
  - - [4096, 256, 1, 7680]
    - [109, 8795.4]
  - - [4096, 200, 1, 1024]
    - [119, 6448.81]
  - - [1024, 512, 1, 12288]
    - [73, 7624.57]
  - - [2048, 1024, 1, 512]
    - [16, 8436.06]
  - - [128, 256, 1, 2048]
    - [90, 1342.18]
  - - [2048, 200, 1, 1792]
    - [114, 6020.37]
  - - [1024, 1024, 1, 2816]
    - [105, 8670.4]
  - - [2048, 512, 1, 1536]
    - [116, 8466.22]
  - - [4096, 256, 1, 3072]
    - [113, 8631.37]
  - - [1024, 200, 1, 1536]
    - [95, 4577.6]
  - - [1024, 256, 1, 1024]
    - [103, 5491.72]
  - - [4096, 512, 1, 8192]
    - [16, 9325.54]
  - - [128, 1024, 1, 512]
    - [114, 2534.32]
  - - [4096, 512, 1, 2304]
    - [11, 9192.99]
  - - [2048, 256, 1, 5632]
    - [114, 7999.54]
  - - [1024, 256, 1, 5120]
    - [114, 6307.22]
  - - [1024, 512, 1, 6656]
    - [114, 8028.85]
  - - [4096, 512, 1, 2816]
    - [11, 9234.4]
  - - [4096, 200, 1, 2080]
    - [98, 6697.86]
  - - [1024, 200, 1, 2304]
    - [114, 4752.81]
  - - [2048, 200, 1, 13312]
    - [103, 6346.13]
  - - [64, 1024, 1, 1024]
    - [87, 1359.58]
  - - [4096, 256, 1, 3584]
    - [109, 8668.8]
  - - [2048, 1024, 1, 7680]
    - [11, 9365.78]
  - - [1024, 256, 1, 1664]
    - [103, 5907.47]
  - - [1, 512, 1, 2048]
    - [30, 23.4057]
  - - [512, 512, 1, 1024]
    - [103, 5360.13]
  - - [2048, 256, 1, 8192]
    - [75, 7665.21]
  - - [2048, 512, 1, 512]
    - [105, 7767.23]
  - - [4096, 512, 1, 1920]
    - [11, 9132.94]
  - - [4096, 200, 1, 12288]
    - [119, 6910.65]
  - - [1024, 512, 1, 3072]
    - [49, 7310.33]
  - - [2048, 512, 1, 1152]
    - [109, 8342.26]
  - - [1024, 256, 1, 2080]
    - [103, 6010.36]
  - - [4096, 1024, 1, 32]
    - [99, 4793.49]
  - - [4096, 512, 1, 16640]
    - [11, 9365.31]
  - - [2048, 200, 1, 9216]
    - [103, 6315.88]
  - - [2048, 200, 1, 2560]
    - [103, 6119.14]
  - - [2048, 1024, 1, 1024]
    - [11, 8628.59]
  - - [2048, 256, 1, 4608]
    - [103, 7951.29]
  - - [512, 200, 1, 768]
    - [55, 2132.41]
  - - [128, 256, 1, 512]
    - [55, 670.017]
  - - [4096, 512, 1, 1792]
    - [16, 9126.91]
  - - [4096, 1024, 1, 8192]
    - [11, 9591.27]
  - - [1024, 256, 1, 2816]
    - [114, 6119.01]
  - - [1024, 1024, 1, 13312]
    - [106, 8529.27]
  - - [2048, 1024, 1, 4160]
    - [11, 9305.57]
  - - [2048, 256, 1, 3584]
    - [103, 7903.13]
  - - [128, 200, 1, 2048]
    - [71, 1135.81]
  - - [4096, 512, 1, 10240]
    - [13, 9339.49]
  - - [4096, 512, 1, 512]
    - [11, 8446.68]
  - - [2048, 1024, 1, 6656]
    - [11, 9331.65]
  - - [1024, 512, 1, 640]
    - [103, 6775.94]
  - - [2048, 512, 1, 768]
    - [105, 8085.41]
  - - [2048, 200, 1, 1408]
    - [103, 5880.07]
  - - [4096, 200, 1, 2048]
    - [119, 6691.61]
  - - [1024, 1024, 1, 5632]
    - [105, 8749.53]
  - - [2048, 512, 1, 3584]
    - [109, 8704.13]
  - - [64, 512, 1, 512]
    - [45, 667.883]
  - - [64, 200, 1, 512]
    - [55, 251.288]
  - - [1024, 200, 1, 64]
    - [10, 1310.72]
  - - [512, 512, 1, 2304]
    - [103, 6078.7]
  - - [2048, 1024, 1, 14336]
    - [11, 9321.84]
  - - [4096, 512, 1, 11264]
    - [13, 9339.85]
  - - [4096, 512, 1, 128]
    - [98, 6566.43]
  - - [1024, 512, 1, 64]
    - [118, 2953.74]
  - - [4096, 512, 1, 768]
    - [11, 8738.13]
  - - [4096, 1024, 1, 11264]
    - [11, 9637.68]
  - - [1, 256, 1, 1024]
    - [101, 8.83234]
  - - [4096, 200, 1, 7680]
    - [98, 6889.47]
  - - [1024, 200, 1, 12288]
    - [70, 5237.64]
  - - [1024, 1024, 1, 1280]
    - [105, 8418.07]
  - - [4096, 1024, 1, 16640]
    - [11, 9674.91]
  - - [2048, 1024, 1, 5632]
    - [11, 9327.75]
  - - [1024, 200, 1, 15360]
    - [70, 5386.53]
  - - [1, 1024, 1, 1024]
    - [120, 27.2499]
  - - [2048, 256, 1, 16384]
    - [81, 7652.65]
  - - [4096, 512, 1, 12288]
    - [13, 9359.41]
  - - [2048, 200, 1, 896]
    - [114, 5628.86]
  - - [4096, 1024, 1, 5632]
    - [11, 9626.68]
  - - [2048, 256, 1, 32]
    - [107, 1889.33]
  - - [2048, 256, 1, 1280]
    - [103, 7390.84]
  - - [4096, 256, 1, 4096]
    - [105, 8694.27]
  - - [2048, 256, 1, 11264]
    - [103, 8113.85]
  - - [4096, 200, 1, 9216]
    - [105, 6890.98]
  - - [1024, 512, 1, 4096]
    - [51, 7348.36]
  - - [2048, 1024, 1, 10240]
    - [13, 9095.81]
  - - [4096, 1024, 1, 640]
    - [11, 9115.58]
  - - [128, 1024, 1, 2048]
    - [4, 3270.41]
  - - [4096, 200, 1, 3840]
    - [98, 6836.16]
  - - [1024, 1024, 1, 1920]
    - [109, 8562.72]
  - - [2048, 200, 1, 7168]
    - [114, 6296.13]
  - - [2048, 512, 1, 16384]
    - [5, 8632.41]
  - - [2048, 1024, 1, 12288]
    - [11, 9157.98]
  - - [4096, 1024, 1, 10240]
    - [11, 9658.74]
  - - [1024, 1024, 1, 8320]
    - [113, 8799.48]
  - - [1024, 256, 1, 9216]
    - [103, 6375.13]
  - - [4096, 256, 1, 1152]
    - [98, 8300.99]
  - - [512, 200, 1, 2560]
    - [64, 3088.41]
  - - [2048, 256, 1, 1920]
    - [103, 7714.84]
  - - [2048, 1024, 1, 4608]
    - [11, 9305.6]
  - - [512, 256, 1, 1024]
    - [111, 2887.64]
  - - [1024, 256, 1, 1920]
    - [95, 5913.02]
  - - [4096, 512, 1, 3584]
    - [11, 9275.59]
  - - [2048, 512, 1, 4160]
    - [116, 8733.93]
  - - [2048, 512, 1, 5632]
    - [119, 8758.88]
  - - [4096, 1024, 1, 4608]
    - [11, 9657.12]
  - - [4096, 1024, 1, 3328]
    - [11, 9621.35]
  - - [4096, 256, 1, 7168]
    - [105, 8769.95]
  - - [4096, 200, 1, 128]
    - [119, 4458.23]
  - - [2048, 200, 1, 5120]
    - [103, 6176.81]
  - - [1024, 1024, 1, 6656]
    - [105, 8780.35]
  - - [512, 1024, 1, 3200]
    - [114, 7886.99]
  - - [512, 200, 1, 2304]
    - [4, 2990.99]
  - - [2048, 1024, 1, 9216]
    - [16, 9325.36]
  - - [2048, 256, 1, 1536]
    - [114, 7551.63]
  - - [4096, 256, 1, 256]
    - [119, 6932.73]
  - - [2048, 512, 1, 1408]
    - [116, 8430.76]
  - - [1024, 256, 1, 384]
    - [108, 4462.03]
  - - [2048, 1024, 1, 2304]
    - [11, 9174.84]
  - - [4096, 512, 1, 6144]
    - [13, 9284.15]
  - - [1024, 200, 1, 14336]
    - [2, 5268.47]
  - - [1024, 512, 1, 2080]
    - [114, 7736.37]
  - - [2048, 512, 1, 2304]
    - [116, 8615.97]
  - - [4096, 512, 1, 15360]
    - [16, 9362.07]
  - - [1024, 256, 1, 32]
    - [36, 1028.02]
  - - [1024, 200, 1, 2816]
    - [114, 4780.48]
  - - [4096, 200, 1, 512]
    - [105, 6054.13]
  - - [4096, 1024, 1, 7168]
    - [16, 9468.39]
  - - [2048, 256, 1, 14336]
    - [77, 7865.42]
  - - [1024, 200, 1, 3072]
    - [114, 4804.1]
  - - [2048, 200, 1, 1280]
    - [114, 5846.21]
  - - [1024, 1024, 1, 2304]
    - [105, 8633.22]
  - - [4096, 1024, 1, 9216]
    - [11, 9640.93]
  - - [2048, 512, 1, 4608]
    - [116, 8743.2]
  - - [4096, 1024, 1, 7680]
    - [11, 9684.76]
  - - [4096, 256, 1, 6144]
    - [116, 8757.14]
  - - [4096, 256, 1, 896]
    - [109, 8258.83]
  - - [512, 256, 1, 1536]
    - [93, 3065.26]
  - - [1024, 256, 1, 512]
    - [103, 4752.75]
  - - [2048, 256, 1, 640]
    - [103, 6775.94]
  - - [256, 256, 1, 2048]
    - [40, 2248.96]
  - - [2048, 1024, 1, 8192]
    - [11, 9178.07]
  - - [4096, 200, 1, 16640]
    - [3, 7009.49]
  - - [256, 512, 1, 512]
    - [15, 2511.56]
  - - [2048, 512, 1, 384]
    - [116, 7467.6]
  - - [2048, 200, 1, 16384]
    - [84, 6327.21]
  - - [4096, 200, 1, 10240]
    - [109, 6892.64]
  - - [1024, 512, 1, 9216]
    - [58, 7529.99]
  - - [4096, 1024, 1, 64]
    - [33, 6260.16]
  - - [4096, 200, 1, 1920]
    - [119, 6710.17]
  - - [2048, 1024, 1, 1280]
    - [11, 8998.24]
  - - [1024, 200, 1, 3840]
    - [103, 4873.77]
  - - [256, 1024, 1, 512]
    - [114, 4766.25]
  - - [2048, 1024, 1, 3328]
    - [11, 9275.1]
  - - [1024, 256, 1, 16640]
    - [68, 6837.12]
  - - [4096, 512, 1, 14336]
    - [16, 9354.32]
  - - [1024, 1024, 1, 16640]
    - [113, 8832.27]
  - - [1024, 256, 1, 1152]
    - [114, 5642.56]
  - - [512, 512, 1, 512]
    - [103, 4779.83]
  - - [4096, 512, 1, 8320]
    - [16, 9327.86]
  - - [2048, 512, 1, 7680]
    - [119, 8793.86]
  - - [4096, 1024, 1, 6656]
    - [11, 9666.93]
  - - [1024, 512, 1, 3584]
    - [114, 7900.47]
  - - [1024, 1024, 1, 32]
    - [99, 2974.68]
  - - [512, 512, 1, 2816]
    - [95, 6155.75]
  - - [2048, 512, 1, 1664]
    - [119, 8496.45]
  - - [1024, 1024, 1, 14336]
    - [5, 8624.64]
  - - [2048, 200, 1, 2048]
    - [114, 6029.76]
  - - [1024, 1024, 1, 3584]
    - [105, 8702.52]
  - - [512, 200, 1, 1280]
    - [19, 2350.65]
  - - [4096, 256, 1, 6656]
    - [119, 8788.31]
  - - [4096, 256, 1, 4160]
    - [96, 8728.34]
  - - [128, 256, 1, 1024]
    - [78, 859.489]
  - - [512, 200, 1, 3200]
    - [19, 3376.75]
  - - [2048, 512, 1, 9216]
    - [102, 8806.3]
  - - [2048, 1024, 1, 256]
    - [98, 7713.66]
  - - [1024, 256, 1, 2304]
    - [114, 6015.73]
  - - [1024, 200, 1, 8192]
    - [114, 5021.92]
  - - [2048, 256, 1, 3072]
    - [31, 7514.99]
  - - [2048, 256, 1, 8320]
    - [103, 8063.58]
  - - [4096, 512, 1, 1024]
    - [13, 8824.31]
  - - [1024, 512, 1, 3200]
    - [103, 7866.29]
  - - [1024, 512, 1, 896]
    - [95, 7161.01]
  - - [2048, 512, 1, 1280]
    - [109, 8384.42]
  - - [4096, 200, 1, 64]
    - [18, 3260.5]
  - - [1024, 256, 1, 6144]
    - [124, 6143.62]
  - - [1024, 200, 1, 2560]
    - [103, 4762.79]
  - - [1024, 1024, 1, 5120]
    - [32, 8454.13]
  - - [2048, 512, 1, 6656]
    - [109, 8798.95]
  - - [4096, 1024, 1, 1536]
    - [11, 9503.27]
  - - [1024, 1024, 1, 128]
    - [34, 5825.42]
  - - [512, 1024, 1, 1792]
    - [103, 7701.02]
  - - [2048, 1024, 1, 32]
    - [14, 3938.31]
  - - [4096, 256, 1, 2816]
    - [98, 8652.1]
  - - [1024, 1024, 1, 15360]
    - [5, 8719.6]
  - - [1024, 256, 1, 5632]
    - [103, 6344.08]
  - - [1024, 1024, 1, 4096]
    - [106, 8187.76]
  - - [2048, 200, 1, 4160]
    - [114, 6222.38]
  - - [512, 256, 1, 768]
    - [45, 2771.57]
  - - [4096, 512, 1, 640]
    - [16, 8590.48]
  - - [2048, 512, 1, 8192]
    - [58, 8494.8]
  - - [1024, 512, 1, 768]
    - [103, 7049.25]
  - - [4096, 200, 1, 8320]
    - [98, 6908.6]
  - - [2048, 512, 1, 896]
    - [105, 8224.13]
  - - [4096, 200, 1, 7168]
    - [116, 6878.49]
  - - [2048, 512, 1, 13312]
    - [104, 8802.94]
  - - [64, 512, 1, 1024]
    - [8, 843.924]
  - - [2048, 200, 1, 3840]
    - [103, 6192.38]
  - - [1024, 1024, 1, 768]
    - [96, 8098.41]
  - - [4096, 512, 1, 16384]
    - [16, 9345.63]
  - - [4096, 256, 1, 2304]
    - [96, 8596.35]
  - - [1, 256, 1, 4096]
    - [101, 19.8293]
  - - [1024, 1024, 1, 11264]
    - [106, 8491.38]
  - - [2048, 200, 1, 16640]
    - [100, 6510.54]
  - - [1024, 256, 1, 3072]
    - [114, 6179.45]
  - - [4096, 1024, 1, 512]
    - [11, 9032.15]
  - - [2048, 256, 1, 2816]
    - [103, 7793.47]
  - - [32, 512, 1, 512]
    - [15, 318.716]
  - - [256, 512, 1, 2048]
    - [66, 3368.92]
  - - [1024, 512, 1, 384]
    - [114, 6198.48]
  - - [2048, 200, 1, 7680]
    - [103, 6307.6]
  - - [1024, 512, 1, 4608]
    - [114, 7953.38]
  - - [2048, 256, 1, 768]
    - [114, 7059.14]
  - - [4096, 200, 1, 32]
    - [63, 2199.19]
  - - [4096, 200, 1, 3328]
    - [98, 6813.02]
  - - [1024, 200, 1, 1152]
    - [103, 4375.55]
  - - [1024, 1024, 1, 1408]
    - [105, 8457.81]
  - - [2048, 200, 1, 15360]
    - [79, 6333.0]
  - - [512, 1024, 1, 2048]
    - [89, 6280.66]
  - - [1024, 512, 1, 1024]
    - [114, 7064.09]
  - - [1024, 200, 1, 10240]
    - [103, 5030.59]
  - - [4096, 256, 1, 5632]
    - [116, 8765.12]
  - - [512, 512, 1, 3072]
    - [126, 5942.34]
  - - [2048, 256, 1, 1408]
    - [103, 7544.95]
  - - [2048, 256, 1, 6144]
    - [114, 7963.87]
  - - [4096, 256, 1, 3328]
    - [109, 8682.48]
  - - [1024, 200, 1, 1664]
    - [103, 4595.3]
  - - [2048, 1024, 1, 1152]
    - [11, 8942.55]
  - - [2048, 512, 1, 6144]
    - [104, 8729.61]
  - - [2048, 512, 1, 3200]
    - [105, 8696.46]
  - - [4096, 1024, 1, 2080]
    - [44, 9538.35]
  - - [4096, 1024, 1, 768]
    - [11, 9260.65]
  - - [4096, 1024, 1, 2560]
    - [11, 9567.17]
  - - [64, 200, 1, 2048]
    - [43, 583.061]
  - - [2048, 200, 1, 4608]
    - [114, 6243.18]
  - - [1024, 1024, 1, 6144]
    - [106, 8320.15]
  - - [4096, 256, 1, 1664]
    - [109, 8503.07]
  - - [2048, 200, 1, 384]
    - [114, 4939.9]
  - - [1, 200, 1, 2048]
    - [60, 11.2281]
  - - [4096, 256, 1, 1792]
    - [119, 8504.02]
  - - [2048, 1024, 1, 64]
    - [33, 5309.25]
  - - [4096, 1024, 1, 16384]
    - [0, 9428.51]
  - - [1024, 512, 1, 16640]
    - [114, 8122.45]
  - - [2048, 512, 1, 10240]
    - [104, 8766.11]
  - - [4096, 512, 1, 6656]
    - [11, 9351.65]
  - - [2048, 256, 1, 16640]
    - [103, 8135.17]
  - - [2048, 512, 1, 2816]
    - [105, 8660.22]
  - - [1024, 200, 1, 32]
    - [23, 780.191]
  - - [1, 512, 1, 4096]
    - [48, 34.7671]
  - - [256, 256, 1, 1024]
    - [55, 1489.98]
  - - [2048, 1024, 1, 128]
    - [28, 6605.2]
  - - [2048, 1024, 1, 2080]
    - [11, 9159.41]
  - - [2048, 1024, 1, 16640]
    - [11, 9371.55]
  - - [1024, 200, 1, 384]
    - [114, 3378.14]
  - - [4096, 256, 1, 384]
    - [59, 7369.2]
  - - [4096, 256, 1, 13312]
    - [113, 8776.38]
  - - [2048, 256, 1, 128]
    - [108, 4279.9]
  - - [512, 256, 1, 2304]
    - [20, 3584.88]
  - - [2048, 1024, 1, 3072]
    - [13, 9156.42]
  - - [1024, 1024, 1, 640]
    - [109, 7928.74]
  - - [256, 512, 1, 1024]
    - [114, 2843.6]
  - - [4096, 1024, 1, 1408]
    - [11, 9437.46]
  - - [4096, 200, 1, 5632]
    - [116, 6873.86]
  - - [4096, 1024, 1, 2048]
    - [11, 9437.0]
  - - [2048, 1024, 1, 2560]
    - [16, 9195.52]
  - - [4096, 1024, 1, 128]
    - [98, 7407.16]
  - - [1024, 200, 1, 3328]
    - [114, 4857.29]
  - - [2048, 200, 1, 1152]
    - [103, 5760.0]
  - - [1024, 200, 1, 9216]
    - [2, 5053.11]
  - - [4096, 256, 1, 512]
    - [96, 7617.35]
  - - [4096, 1024, 1, 14336]
    - [11, 9665.02]
  - - [1024, 1024, 1, 384]
    - [34, 7478.7]
  - - [2048, 200, 1, 512]
    - [103, 5150.18]
  - - [2048, 256, 1, 9216]
    - [82, 7717.61]
  - - [2048, 256, 1, 1792]
    - [103, 7655.84]
  - - [4096, 512, 1, 9216]
    - [13, 9331.12]
  - - [4096, 200, 1, 15360]
    - [3, 6958.04]
  - - [1024, 512, 1, 2048]
    - [102, 7067.81]
  - - [64, 256, 1, 2048]
    - [27, 723.156]
  - - [4096, 200, 1, 1792]
    - [105, 6699.55]
  - - [1, 200, 1, 4096]
    - [37, 15.5387]
  - - [2048, 1024, 1, 2048]
    - [16, 9071.83]
  - - [1024, 200, 1, 2080]
    - [95, 4679.09]
  - - [2048, 200, 1, 1536]
    - [114, 5939.82]
  - - [1024, 1024, 1, 3072]
    - [76, 8333.05]
  - - [512, 200, 1, 1792]
    - [1, 2679.63]
  - - [1024, 256, 1, 11264]
    - [4, 6470.88]
  - - [2048, 512, 1, 12288]
    - [51, 8729.14]
  - - [1024, 256, 1, 1792]
    - [114, 5931.34]
  - - [1024, 200, 1, 7168]
    - [114, 4970.23]
  - - [32, 256, 1, 1024]
    - [25, 237.234]
  - - [512, 256, 1, 3072]
    - [68, 3813.0]
  - - [1024, 1024, 1, 2080]
    - [105, 8600.31]
  - - [2048, 200, 1, 2304]
    - [114, 6093.22]
  - - [4096, 512, 1, 1536]
    - [11, 9074.9]
  - - [2048, 256, 1, 7168]
    - [114, 7895.16]
  - - [2048, 512, 1, 1792]
    - [116, 8531.82]
  - - [1024, 200, 1, 2048]
    - [103, 4685.33]
  - - [1024, 1024, 1, 4608]
    - [109, 8735.61]
  - - [4096, 256, 1, 8192]
    - [105, 8782.45]
  - - [512, 1024, 1, 1280]
    - [95, 7483.15]
  - - [2048, 1024, 1, 16384]
    - [5, 8878.86]
  - - [512, 512, 1, 1280]
    - [103, 5745.62]
  - - [1024, 200, 1, 1280]
    - [95, 4446.13]
  - - [4096, 512, 1, 4096]
    - [13, 9264.39]
  - - [2048, 256, 1, 3200]
    - [103, 7842.75]
  - - [2048, 512, 1, 15360]
    - [51, 8757.14]
  - - [1024, 512, 1, 3328]
    - [103, 7853.94]
  - - [1024, 512, 1, 4160]
    - [103, 7934.51]
  - - [4096, 200, 1, 6656]
    - [105, 6883.2]
  - - [4096, 1024, 1, 1024]
    - [11, 9229.34]
  - - [2048, 200, 1, 3328]
    - [114, 6182.64]
  - - [1024, 1024, 1, 256]
    - [34, 6932.73]
  - - [512, 200, 1, 512]
    - [55, 1910.67]
  - - [2048, 256, 1, 64]
    - [26, 2912.71]
  - - [1024, 256, 1, 2560]
    - [103, 6123.07]
  - - [2048, 512, 1, 11264]
    - [115, 8728.84]
  - - [32, 200, 1, 1024]
    - [110, 187.46]
  - - [32, 512, 1, 2048]
    - [54, 694.421]
  - - [2048, 256, 1, 2304]
    - [103, 7759.25]
  - - [2048, 256, 1, 12288]
    - [82, 7726.25]
  - - [4096, 200, 1, 8192]
    - [105, 6870.84]
  - - [1024, 512, 1, 7168]
    - [51, 7479.1]
  - - [1024, 512, 1, 1792]
    - [103, 7626.01]
  - - [4096, 1024, 1, 1664]
    - [11, 9503.44]
  - - [4096, 200, 1, 2816]
    - [98, 6775.34]
  - - [1024, 1024, 1, 896]
    - [105, 8229.89]
  - - [1024, 200, 1, 8320]
    - [66, 5173.48]
  - - [1024, 1024, 1, 12288]
    - [106, 8463.11]
  - - [1024, 256, 1, 8320]
    - [95, 6404.27]
  - - [1024, 200, 1, 1024]
    - [103, 4297.44]
  - - [1024, 200, 1, 16640]
    - [65, 5499.41]
  - - [4096, 256, 1, 5120]
    - [119, 8729.05]
  - - [1024, 256, 1, 3200]
    - [114, 6124.86]
  - - [512, 512, 1, 2560]
    - [114, 6109.69]
  - - [4096, 256, 1, 2048]
    - [119, 8510.95]
  - - [1024, 256, 1, 640]
    - [103, 5102.56]
  - - [2048, 256, 1, 5120]
    - [31, 7667.83]
  - - [2048, 256, 1, 7680]
    - [114, 8054.35]
  - - [4096, 512, 1, 384]
    - [109, 8190.67]
  - - [2048, 200, 1, 3584]
    - [103, 6166.02]
  - - [1024, 512, 1, 1536]
    - [103, 7517.8]
  - - [4096, 512, 1, 3328]
    - [11, 9259.35]
  - - [4096, 1024, 1, 256]
    - [11, 8341.69]
  - - [2048, 200, 1, 64]
    - [74, 2307.61]
  - - [2048, 200, 1, 4096]
    - [114, 6211.94]
  - - [1024, 1024, 1, 1536]
    - [105, 8484.05]
  - - [2048, 1024, 1, 7168]
    - [13, 9315.14]
  - - [1024, 256, 1, 3584]
    - [103, 6207.22]
  - - [4096, 256, 1, 32]
    - [107, 2892.62]
  - - [4096, 256, 1, 1280]
    - [116, 8392.8]
  - - [512, 512, 1, 3200]
    - [114, 6219.31]
  - - [2048, 1024, 1, 1536]
    - [13, 9052.45]
  - - [2048, 256, 1, 1024]
    - [103, 7192.8]
  - - [128, 200, 1, 512]
    - [93, 502.577]
  - - [4096, 512, 1, 7168]
    - [16, 9329.01]
  - - [1024, 512, 1, 1152]
    - [103, 7358.43]
  - - [64, 1024, 1, 2048]
    - [21, 2102.41]
  - - [2048, 512, 1, 3328]
    - [105, 8694.59]
  - - [4096, 1024, 1, 896]
    - [11, 9342.92]
  - - [1, 1024, 1, 2048]
    - [61, 40.8324]
  - - [4096, 200, 1, 3584]
    - [109, 6810.2]
  - - [4096, 1024, 1, 4096]
    - [11, 9347.46]
  - - [1024, 256, 1, 14336]
    - [4, 6625.7]
  - - [2048, 200, 1, 256]
    - [103, 4413.2]
  - - [4096, 256, 1, 16384]
    - [5, 8752.03]
  - - [4096, 256, 1, 1920]
    - [96, 8533.68]
  - - [32, 1024, 1, 512]
    - [94, 647.269]
  - - [1024, 256, 1, 7680]
    - [114, 6387.26]
  - - [2048, 256, 1, 1664]
    - [114, 7631.34]
  - - [512, 200, 1, 1536]
    - [19, 2576.78]
  - - [2048, 1024, 1, 6144]
    - [0, 9033.67]
  - - [512, 256, 1, 2816]
    - [66, 3977.36]
  - - [4096, 512, 1, 4160]
    - [13, 9288.92]
  - - [4096, 512, 1, 2080]
    - [92, 9150.18]
  - - [2048, 256, 1, 15360]
    - [77, 7963.87]
  - - [4096, 200, 1, 5120]
    - [116, 6861.52]
  - - [1024, 512, 1, 8192]
    - [102, 7473.15]
  - - [4096, 200, 1, 896]
    - [119, 6443.15]
  - - [2048, 512, 1, 8320]
    - [109, 8810.14]
  - - [1024, 1024, 1, 10240]
    - [117, 8436.6]
  - - [1024, 200, 1, 768]
    - [103, 4087.48]
  - - [2048, 200, 1, 640]
    - [114, 5416.2]
  - - [512, 200, 1, 2048]
    - [68, 2702.52]
  - - [1024, 1024, 1, 9216]
    - [106, 8498.98]
  - - [4096, 200, 1, 1408]
    - [116, 6613.72]
  - - [1024, 256, 1, 13312]
    - [4, 6643.44]
  - - [1024, 256, 1, 128]
    - [35, 2706.0]
  - - [2048, 200, 1, 5632]
    - [114, 6270.02]
  - - [64, 1024, 1, 512]
    - [93, 1310.72]
  - - [1024, 512, 1, 2560]
    - [114, 7731.44]
  - - [4096, 200, 1, 1280]
    - [96, 6566.73]
  - - [1024, 200, 1, 4096]
    - [114, 4911.36]
  - - [1024, 1024, 1, 2560]
    - [105, 8630.25]
  - - [2048, 512, 1, 64]
    - [109, 4152.78]
  - - [2048, 200, 1, 8192]
    - [103, 6234.11]
  - - [2048, 512, 1, 3072]
    - [113, 8614.75]
  - - [4096, 1024, 1, 5120]
    - [11, 9573.65]
  - - [4096, 256, 1, 640]
    - [98, 7913.78]
  - - [1024, 256, 1, 1280]
    - [103, 5706.54]
  - - [2048, 1024, 1, 1920]
    - [13, 9141.24]
  - - [2048, 256, 1, 4096]
    - [103, 7937.18]
  - - [2048, 1024, 1, 15360]
    - [16, 9351.86]
  - - [4096, 200, 1, 16384]
    - [5, 6975.11]
  - - [1, 1024, 1, 4096]
    - [123, 60.6815]
  - - [4096, 1024, 1, 2816]
    - [11, 9583.88]
  - - [4096, 200, 1, 1664]
    - [98, 6658.6]
  - - [4096, 512, 1, 256]
    - [29, 7731.44]
  - - [1024, 200, 1, 896]
    - [103, 4193.35]
  - - [2048, 200, 1, 6656]
    - [114, 6291.07]
  - - [2048, 1024, 1, 5120]
    - [13, 9270.47]
  - - [512, 1024, 1, 768]
    - [103, 7098.96]
  - - [2048, 512, 1, 14336]
    - [83, 8559.03]
  - - [2048, 200, 1, 8320]
    - [103, 6314.62]
  - - [4096, 256, 1, 3840]
    - [119, 8718.46]
  - - [2048, 1024, 1, 4096]
    - [0, 8973.28]
  - - [1024, 1024, 1, 3200]
    - [109, 8701.88]
  - - [1024, 256, 1, 4608]
    - [103, 6267.95]
  - - [4096, 512, 1, 4608]
    - [11, 9316.37]
  - - [2048, 512, 1, 2048]
    - [102, 8462.66]
  - - [4096, 512, 1, 1664]
    - [11, 9074.43]
  - - [4096, 256, 1, 4608]
    - [98, 8717.95]
  - - [1024, 512, 1, 32]
    - [91, 1807.89]
  - - [1024, 512, 1, 3840]
    - [103, 7936.24]
  - - [2048, 512, 1, 1920]
    - [119, 8548.17]
  - - [2048, 1024, 1, 896]
    - [11, 8843.41]
  - - [4096, 200, 1, 6144]
    - [119, 6864.66]
  - - [1024, 512, 1, 13312]
    - [72, 7763.09]
  - - [4096, 1024, 1, 4160]
    - [11, 9650.62]
  - - [2048, 200, 1, 2816]
    - [103, 6119.66]
  - - [1024, 1024, 1, 3840]
    - [98, 8709.4]
  - - [128, 1024, 1, 1024]
    - [121, 2577.15]
  - - [2048, 1024, 1, 11264]
    - [16, 9338.96]
  - - [2048, 1024, 1, 384]
    - [105, 8210.71]
  - - [1024, 256, 1, 2048]
    - [126, 5755.48]
  - - [2048, 1024, 1, 3840]
    - [13, 9288.86]
  - - [4096, 256, 1, 8320]
    - [119, 8812.28]
  - - [2048, 256, 1, 3840]
    - [95, 7856.95]
  - - [64, 256, 1, 512]
    - [93, 336.082]
  - - [4096, 512, 1, 1280]
    - [13, 8993.42]
  - - [512, 256, 1, 1280]
    - [45, 2995.93]
  - - [1024, 512, 1, 7680]
    - [103, 8041.49]
  - - [4096, 1024, 1, 1152]
    - [11, 9368.38]
  - - [256, 200, 1, 512]
    - [45, 992.97]
  - - [256, 1024, 1, 2048]
    - [122, 4759.49]
  - - [2048, 200, 1, 10240]
    - [114, 6328.93]
  - - [2048, 512, 1, 5120]
    - [115, 8732.46]
  - - [2048, 1024, 1, 1408]
    - [13, 9006.8]
  - - [512, 1024, 1, 512]
    - [103, 6528.1]
  - - [1024, 200, 1, 11264]
    - [70, 5194.72]
  - - [512, 1024, 1, 1024]
    - [56, 6337.0]
  - - [2048, 512, 1, 32]
    - [22, 2777.68]
  - - [4096, 256, 1, 2560]
    - [105, 8621.39]
  - - [4096, 256, 1, 64]
    - [39, 4194.3]
  - - [32, 1024, 1, 1024]
    - [40, 778.164]
  - - [2048, 200, 1, 768]
    - [114, 5507.23]
  - - [512, 512, 1, 2048]
    - [62, 5338.81]
  - - [2048, 512, 1, 2560]
    - [116, 8643.59]
  - - [512, 256, 1, 512]
    - [95, 2542.0]
  - - [1024, 200, 1, 7680]
    - [70, 5047.7]
  - - [4096, 512, 1, 896]
    - [11, 8856.75]
  - - [4096, 1024, 1, 3072]
    - [11, 9492.07]
  - - [4096, 200, 1, 13312]
    - [3, 6900.63]
  - - [2048, 512, 1, 7168]
    - [104, 8788.0]
  - - [2048, 1024, 1, 2816]
    - [16, 9229.78]
  - - [2048, 512, 1, 128]
    - [34, 5629.94]
  - - [1024, 256, 1, 8192]
    - [126, 6203.73]
  - - [4096, 1024, 1, 1792]
    - [11, 9510.32]
  - - [1024, 200, 1, 6656]
    - [95, 5002.75]
  - - [1024, 1024, 1, 1024]
    - [32, 8095.16]
  - - [4096, 200, 1, 2304]
    - [116, 6754.35]
  - - [4096, 512, 1, 1152]
    - [11, 8974.44]
  - - [512, 200, 1, 1024]
    - [93, 2232.91]
  - - [1024, 256, 1, 3840]
    - [114, 6244.62]
  - - [512, 512, 1, 768]
    - [103, 5331.74]
  - - [2048, 512, 1, 4096]
    - [113, 8621.66]
  - - [2048, 256, 1, 2560]
    - [103, 7770.83]
  - - [2048, 256, 1, 4160]
    - [114, 7922.98]
  - - [1024, 256, 1, 64]
    - [10, 1705.0]
  - - [4096, 512, 1, 7680]
    - [11, 9364.47]
  - - [1024, 512, 1, 1664]
    - [114, 7594.14]
  - - [2048, 512, 1, 2080]
    - [105, 8570.57]
  - - [2048, 512, 1, 3840]
    - [116, 8729.04]
  - - [4096, 1024, 1, 384]
    - [11, 8764.76]
  - - [4096, 200, 1, 3072]
    - [105, 6772.29]
  - - [1024, 512, 1, 14336]
    - [73, 7680.87]
  - - [1024, 200, 1, 1920]
    - [95, 4636.98]
  - - [1024, 1024, 1, 1664]
    - [109, 8506.39]
  - - [512, 1024, 1, 2304]
    - [103, 7775.23]
  - - [2048, 1024, 1, 1792]
    - [11, 9123.36]
  - - [32, 200, 1, 512]
    - [111, 125.644]
  - - [4096, 256, 1, 11264]
    - [116, 8822.21]
  - - [4096, 256, 1, 1408]
    - [116, 8419.22]
  - - [1024, 256, 1, 7168]
    - [103, 6377.44]
  - - [2048, 256, 1, 1152]
    - [114, 7401.71]
  - - [256, 256, 1, 512]
    - [93, 1314.83]
  - - [1024, 512, 1, 1280]
    - [103, 7410.43]
  - - [512, 512, 1, 1792]
    - [95, 5931.34]
  - - [2048, 200, 1, 12288]
    - [77, 6242.15]
  - - [2048, 200, 1, 1664]
    - [114, 5953.65]
  - - [4096, 200, 1, 4608]
    - [109, 6853.44]
  - - [512, 1024, 1, 2560]
    - [103, 7778.03]
  - - [4096, 200, 1, 384]
    - [96, 5765.63]
  - - [128, 512, 1, 512]
    - [93, 1302.58]
  - - [1024, 200, 1, 256]
    - [97, 2861.83]
  - - [256, 1024, 1, 1024]
    - [38, 4522.16]
  - - [2048, 200, 1, 128]
    - [103, 3309.9]
  - - [2048, 200, 1, 11264]
    - [84, 6168.1]
  - - [1024, 512, 1, 1920]
    - [114, 7649.19]
  - - [4096, 256, 1, 1536]
    - [109, 8427.23]
  - - [4096, 1024, 1, 3584]
    - [11, 9617.9]
  - - [2048, 256, 1, 256]
    - [103, 5464.89]
  - - [2048, 1024, 1, 768]
    - [11, 8726.77]
  - - [4096, 256, 1, 10240]
    - [105, 8790.79]
  - - [2048, 256, 1, 10240]
    - [85, 7665.21]
  - - [4096, 200, 1, 14336]
    - [119, 6916.08]
  - - [1024, 512, 1, 5120]
    - [57, 7420.26]
  - - [1024, 512, 1, 8320]
    - [114, 8061.21]
  - - [256, 200, 1, 2048]
    - [69, 1916.26]
  - - [1024, 200, 1, 640]
    - [97, 3873.29]
  - - [1024, 512, 1, 10240]
    - [102, 7526.8]
  - - [1024, 200, 1, 4160]
    - [114, 4928.09]
  - - [1024, 200, 1, 5632]
    - [95, 4978.56]
  - - [1024, 1024, 1, 2048]
    - [50, 7937.18]
  - - [1024, 256, 1, 6656]
    - [114, 6373.58]
  - - [2048, 1024, 1, 8320]
    - [11, 9333.05]
  - - [1024, 256, 1, 10240]
    - [103, 6407.19]
  - - [2048, 256, 1, 2080]
    - [103, 7714.48]
  - - [4096, 256, 1, 128]
    - [17, 5765.37]
  - - [1024, 256, 1, 768]
    - [108, 5210.32]
  - - [2048, 256, 1, 896]
    - [114, 7267.36]
  - - [64, 512, 1, 2048]
    - [80, 1296.54]
  - - [4096, 512, 1, 2048]
    - [13, 9121.15]
  - - [512, 256, 1, 2048]
    - [66, 3283.21]
  - - [4096, 256, 1, 16640]
    - [98, 8839.78]
  - - [4096, 512, 1, 2560]
    - [16, 9222.05]
  - - [1024, 512, 1, 15360]
    - [67, 7865.56]
  - - [4096, 1024, 1, 2304]
    - [11, 9558.16]
  - - [4096, 200, 1, 1152]
    - [116, 6531.83]
  - - [2048, 200, 1, 6144]
    - [114, 6277.65]
  - - [1024, 1024, 1, 7680]
    - [109, 8799.24]
  - - [2048, 200, 1, 1920]
    - [114, 6030.92]
  - - [32, 1024, 1, 2048]
    - [88, 1174.88]
  - - [1024, 200, 1, 3584]
    - [95, 4880.34]
  - - [4096, 256, 1, 2080]
    - [102, 8557.12]
  - - [1024, 1024, 1, 16384]
    - [3, 8618.55]
  - - [1024, 256, 1, 1408]
    - [114, 5803.44]
  - - [1024, 256, 1, 4096]
    - [124, 6037.68]
  - - [2048, 200, 1, 14336]
    - [114, 6364.38]
  - - [4096, 512, 1, 5120]
    - [13, 9301.95]
  - - [1024, 512, 1, 6144]
    - [49, 7468.99]
  - - [1024, 512, 1, 2304]
    - [114, 7759.25]
  - - [4096, 200, 1, 4160]
    - [98, 6843.12]
  - - [4096, 200, 1, 1536]
    - [109, 6628.17]
  - - [4096, 1024, 1, 6144]
    - [11, 9592.98]
- null
