Tensile/Configs/miopen/archives/bert/2020-11-08/exact/arcturus_Cijk_Ailk_Bjlk_SB.yaml
- {MinimumRequiredVersion: 4.24.0}
- arcturus
- gfx908
- [Device 7380, Device 7388, Device 738c, Device 7390]
    SolutionIndex: 0
    SolutionNameMin: Cijk_Ailk_Bjlk_SB_MT64x128x8_MI32x32x2x1_SE_EPS0_GRVW1_GSU1_PGR2_SU0_SUS256_SRVW2_TT1_64_WG64_4_1_WGM1
    SolutionIndex: 1
    SolutionNameMin: Cijk_Ailk_Bjlk_SB_MT64x128x16_MI32x32x2x1_SE_EPS0_GRVW1_GSU1_PGR2_SU0_SUS256_SRVW2_TT1_64_WG64_4_1_WGM1
    SolutionIndex: 2
    SolutionNameMin: Cijk_Ailk_Bjlk_SB_MT64x192x16_MI32x32x2x1_SE_EPS0_GRVW1_GSU1_PGR2_SU0_SUS256_SRVW2_TT1_96_WG64_4_1_WGM1
    SolutionIndex: 3
    SolutionNameMin: Cijk_Ailk_Bjlk_SB_MT64x64x16_MI32x32x2x1_SE_EPS0_GRVW4_GSU1_PGR2_SU0_SUS256_SRVW2_TT1_32_WG64_4_1_WGM1
    SolutionIndex: 4
    SolutionNameMin: Cijk_Ailk_Bjlk_SB_MT128x160x16_MI32x32x2x1_SE_EPS1_GRVW1_GSU1_PGR1_SU32_SUS128_SRVW2_TT1_160_WG128_2_1_WGM1
    SolutionIndex: 5
    SolutionNameMin: Cijk_Ailk_Bjlk_SB_MT128x160x16_MI32x32x2x1_SE_EPS1_GRVW1_GSU1_PGR1_SU32_SUS256_SRVW2_TT1_160_WG128_2_1_WGM1
    SolutionIndex: 6
    SolutionNameMin: Cijk_Ailk_Bjlk_SB_MT64x64x32_MI32x32x2x1_SE_EPS0_GRVW4_GSU1_PGR2_SU32_SUS256_SRVW2_TT1_32_WG64_4_1_WGM1
    SolutionIndex: 7
    SolutionNameMin: Cijk_Ailk_Bjlk_SB_MT128x160x16_MI32x32x2x1_SE_EPS1_GRVW1_GSU1_PGR1_SU0_SUS256_SRVW2_TT1_160_WG128_2_1_WGM2
    SolutionIndex: 8
    SolutionNameMin: Cijk_Ailk_Bjlk_SB_MT64x64x32_MI32x32x2x1_SE_EPS1_GRVW1_GSU1_PGR1_SU0_SUS256_SRVW2_TT1_32_WG64_4_1_WGM2
    SolutionIndex: 9
    SolutionNameMin: Cijk_Ailk_Bjlk_SB_MT64x32x8_MI16x16x4x1_SE_EPS0_GRVW2_GSU1_PGR2_SU0_SUS256_SRVW2_TT2_16_WG32_8_1_WGM2
    SolutionIndex: 10
    SolutionNameMin: Cijk_Ailk_Bjlk_SB_MT128x64x16_MI32x32x2x1_SE_EPS0_GRVW4_GSU1_PGR2_SU0_SUS256_SRVW2_TT2_32_WG64_4_1_WGM2
    SolutionIndex: 11
    SolutionNameMin: Cijk_Ailk_Bjlk_SB_MT64x128x8_MI32x32x2x1_SE_EPS0_GRVW1_GSU1_PGR2_SU32_SUS128_SRVW2_TT1_64_WG64_4_1_WGM2
    SolutionIndex: 12
    SolutionNameMin: Cijk_Ailk_Bjlk_SB_MT64x192x32_MI32x32x2x1_SE_EPS1_GRVW4_GSU1_PGR1_SU32_SUS128_SRVW2_TT1_96_WG64_4_1_WGM2
    SolutionIndex: 13
    SolutionNameMin: Cijk_Ailk_Bjlk_SB_MT64x64x16_MI32x32x2x1_SE_EPS0_GRVW1_GSU1_PGR2_SU0_SUS256_SRVW2_TT1_32_WG64_4_1_WGM15
    SolutionIndex: 14
    SolutionNameMin: Cijk_Ailk_Bjlk_SB_MT128x96x16_MI32x32x2x1_SE_EPS0_GRVW1_GSU1_PGR2_SU0_SUS256_SRVW2_TT1_96_WG128_2_1_WGM15
    SolutionIndex: 15
    SolutionNameMin: Cijk_Ailk_Bjlk_SB_MT128x96x16_MI32x32x2x1_SE_EPS0_GRVW2_GSU1_PGR2_SU0_SUS256_SRVW2_TT1_96_WG128_2_1_WGM15
    SolutionIndex: 16
    SolutionNameMin: Cijk_Ailk_Bjlk_SB_MT64x64x32_MI32x32x2x1_SE_EPS1_GRVW4_GSU1_PGR1_SU0_SUS256_SRVW2_TT1_32_WG64_4_1_WGM15
    SolutionIndex: 17
    SolutionNameMin: Cijk_Ailk_Bjlk_SB_MT64x64x32_MI32x32x2x1_SE_EPS0_GRVW4_GSU1_PGR2_SU0_SUS256_SRVW2_TT1_32_WG64_4_1_WGM15
    SolutionIndex: 18
    SolutionNameMin: Cijk_Ailk_Bjlk_SB_MT64x64x16_MI32x32x2x1_SE_EPS1_GRVW1_GSU1_PGR1_SU32_SUS128_SRVW2_TT1_32_WG64_4_1_WGM15
    SolutionIndex: 19
    SolutionNameMin: Cijk_Ailk_Bjlk_SB_MT128x96x16_MI32x32x2x1_SE_EPS0_GRVW1_GSU1_PGR2_SU32_SUS128_SRVW2_TT1_96_WG128_2_1_WGM15
    SolutionIndex: 20
    SolutionNameMin: Cijk_Ailk_Bjlk_SB_MT64x128x16_MI32x32x2x1_SE_EPS0_GRVW1_GSU1_PGR2_SU32_SUS256_SRVW2_TT1_64_WG64_4_1_WGM15
    SolutionIndex: 21
    SolutionNameMin: Cijk_Ailk_Bjlk_SB_MT128x96x16_MI32x32x2x1_SE_EPS0_GRVW2_GSU1_PGR2_SU32_SUS256_SRVW2_TT1_96_WG128_2_1_WGM15
    SolutionIndex: 22
    SolutionNameMin: Cijk_Ailk_Bjlk_SB_MT64x192x8_MI32x32x2x1_SE_EPS0_GRVW1_GSU2_PGR2_SU0_SUS256_SRVW0_TT1_96_WG64_4_1_WGM2
    SolutionIndex: 23
    SolutionNameMin: Cijk_Ailk_Bjlk_SB_MT64x16x32_MI16x16x4x1_SE_EPS0_GRVW1_GSU5_PGR2_SU0_SUS256_SRVW0_TT1_16_WG64_4_1_WGM1
    SolutionIndex: 24
    SolutionNameMin: Cijk_Ailk_Bjlk_SB_MT16x16x32_MI16x16x4x1_SE_EPS0_GRVW2_GSU5_PGR2_SU0_SUS256_SRVW0_TT1_16_WG16_4_1_WGM1
    SolutionIndex: 25
    SolutionNameMin: Cijk_Ailk_Bjlk_SB_MT64x16x32_MI16x16x4x1_SE_EPS0_GRVW1_GSU5_PGR2_SU0_SUS256_SRVW0_TT1_16_WG64_4_1_WGM15
    SolutionIndex: 26
    SolutionNameMin: Cijk_Ailk_Bjlk_SB_MT16x16x32_MI16x16x4x1_SE_EPS0_GRVW2_GSU5_PGR2_SU0_SUS256_SRVW0_TT1_16_WG16_4_1_WGM15
- - - [1024, 1024, 1, 2048, 1024, 1024, 1024, 1024]
    - [2, 63.65]
  - - [1024, 1024, 1, 4608, 1024, 1024, 1024, 1024]
    - [12, 67.39]
  - - [1024, 4096, 1, 2048, 1024, 1024, 1024, 4096]
    - [14, 90.072]
  - - [1024, 4096, 1, 4608, 1024, 1024, 1024, 4096]
    - [15, 92.226]
  - - [3072, 768, 1, 2048, 3072, 3072, 3072, 768]
    - [5, 90.034]
  - - [3072, 768, 1, 4608, 3072, 3072, 3072, 768]
    - [4, 93.022]
  - - [4096, 1024, 1, 2048, 4096, 4096, 4096, 1024]
    - [21, 89.644]
  - - [4096, 1024, 1, 4608, 4096, 4096, 4096, 1024]
    - [19, 92.049]
  - - [768, 3072, 1, 2048, 768, 768, 768, 3072]
    - [7, 90.483]
  - - [768, 3072, 1, 4608, 768, 768, 768, 3072]
    - [7, 93.172]
  - - [768, 768, 1, 2048, 768, 768, 768, 768]
    - [10, 54.744]
  - - [768, 768, 1, 4608, 768, 768, 768, 768]
    - [22, 57.613]
  - - [128, 64, 192, 128, 128, 128, 128, 64]
    - [9, 33.056]
  - - [128, 64, 256, 128, 128, 128, 128, 64]
    - [18, 33.385]
  - - [384, 64, 144, 384, 384, 384, 384, 64]
    - [3, 61.811]
  - - [384, 64, 192, 384, 384, 384, 384, 64]
    - [13, 63.569]
  - - [512, 64, 48, 512, 512, 512, 512, 64]
    - [16, 57.313]
  - - [512, 64, 64, 512, 512, 512, 512, 64]
    - [17, 60.994]
  - - [64, 128, 192, 128, 64, 64, 64, 128]
    - [0, 34.571]
  - - [64, 128, 256, 128, 64, 64, 64, 128]
    - [8, 33.496]
  - - [64, 384, 144, 384, 64, 64, 64, 384]
    - [20, 62.88]
  - - [64, 384, 192, 384, 64, 64, 64, 384]
    - [11, 65.031]
  - - [64, 512, 48, 512, 64, 64, 64, 512]
    - [1, 60.17]
  - - [64, 512, 64, 512, 64, 64, 64, 512]
    - [6, 60.443]
  - - [1024, 2, 1, 2048, 1024, 1024, 1024, 2]
    - [23, 1.054]
  - - [1024, 2, 1, 4608, 1024, 1024, 1024, 2]
    - [25, 1.614]
  - - [768, 2, 1, 2048, 768, 768, 768, 2]
    - [26, 0.853]
  - - [768, 2, 1, 4608, 768, 768, 768, 2]
    - [24, 1.36]
- null
