Tensile/Configs/miopen/archives/bert/2020-11-08/exact/arcturus_Cijk_Ailk_Bljk_SB.yaml
- {MinimumRequiredVersion: 4.24.0}
- arcturus
- gfx908
- [Device 7380, Device 7388, Device 738c, Device 7390]
    SolutionIndex: 0
    SolutionNameMin: Cijk_Ailk_Bljk_SB_MT64x64x32_MI32x32x2x1_SE_1LDSB0_EPS0_GRVW1_GSU1_LPB2_NLCA1_PGR2_PLR17_SU0_SUS256_SRVW2_TT1_32_WG64_4_1_WGM1
    SolutionIndex: 1
    SolutionNameMin: Cijk_Ailk_Bljk_SB_MT64x128x32_MI32x32x2x1_SE_1LDSB0_EPS0_GRVW1_GSU1_LPB2_NLCA1_PGR2_PLR17_SU0_SUS256_SRVW2_TT1_64_WG64_4_1_WGM1
    SolutionIndex: 2
    SolutionNameMin: Cijk_Ailk_Bljk_SB_MT128x96x16_MI32x32x2x1_SE_1LDSB0_EPS0_GRVW2_GSU1_LPB2_NLCA1_PGR2_PLR9_SU0_SUS256_SRVW2_TT1_96_WG128_2_1_WGM1
    SolutionIndex: 3
    SolutionNameMin: Cijk_Ailk_Bljk_SB_MT64x128x16_MI32x32x2x1_SE_1LDSB0_EPS0_GRVW4_GSU1_LPB4_NLCA1_PGR2_PLR9_SU0_SUS256_SRVW2_TT1_64_WG64_4_1_WGM1
    SolutionIndex: 4
    SolutionNameMin: Cijk_Ailk_Bljk_SB_MT128x96x16_MI32x32x2x1_SE_1LDSB0_EPS0_GRVW1_GSU1_LPB2_NLCA2_PGR2_PLR9_SU32_SUS128_SRVW2_TT1_96_WG128_2_1_WGM1
    SolutionIndex: 5
    SolutionNameMin: Cijk_Ailk_Bljk_SB_MT64x128x16_MI32x32x2x1_SE_1LDSB0_EPS1_GRVW4_GSU1_LPB4_NLCA1_PGR1_PLR9_SU32_SUS128_SRVW2_TT1_64_WG64_4_1_WGM1
    SolutionIndex: 6
    SolutionNameMin: Cijk_Ailk_Bljk_SB_MT64x128x16_MI32x32x2x1_SE_1LDSB0_EPS1_GRVW4_GSU1_LPB4_NLCA1_PGR1_PLR9_SU32_SUS256_SRVW2_TT1_64_WG64_4_1_WGM1
    SolutionIndex: 7
    SolutionNameMin: Cijk_Ailk_Bljk_SB_MT128x144x16_MI16x16x4x1_SE_1LDSB0_EPS1_GRVW1_GSU1_LPB2_NLCA2_PGR1_PLR5_SU0_SUS256_SRVW2_TT2_144_WG64_4_1_WGM2
    SolutionIndex: 8
    SolutionNameMin: Cijk_Ailk_Bljk_SB_MT128x160x16_MI32x32x2x1_SE_1LDSB0_EPS1_GRVW1_GSU1_LPB2_NLCA2_PGR1_PLR9_SU0_SUS256_SRVW2_TT1_160_WG128_2_1_WGM2
    SolutionIndex: 9
    SolutionNameMin: Cijk_Ailk_Bljk_SB_MT64x128x16_MI32x32x2x1_SE_1LDSB0_EPS0_GRVW1_GSU1_LPB2_NLCA1_PGR2_PLR9_SU0_SUS256_SRVW2_TT1_64_WG64_4_1_WGM2
    SolutionIndex: 10
    SolutionNameMin: Cijk_Ailk_Bljk_SB_MT128x160x16_MI32x32x2x1_SE_1LDSB0_EPS0_GRVW2_GSU1_LPB2_NLCA1_PGR2_PLR9_SU0_SUS256_SRVW2_TT1_160_WG128_2_1_WGM2
    SolutionIndex: 11
    SolutionNameMin: Cijk_Ailk_Bljk_SB_MT64x128x16_MI32x32x2x1_SE_1LDSB0_EPS1_GRVW4_GSU1_LPB4_NLCA1_PGR1_PLR9_SU0_SUS256_SRVW2_TT1_64_WG64_4_1_WGM2
    SolutionIndex: 12
    SolutionNameMin: Cijk_Ailk_Bljk_SB_MT64x128x16_MI32x32x2x1_SE_1LDSB0_EPS0_GRVW4_GSU1_LPB4_NLCA1_PGR2_PLR9_SU0_SUS256_SRVW2_TT1_64_WG64_4_1_WGM2
    SolutionIndex: 13
    SolutionNameMin: Cijk_Ailk_Bljk_SB_MT64x32x16_MI16x16x4x1_SE_1LDSB0_EPS0_GRVW1_GSU1_LPB2_NLCA1_PGR2_PLR5_SU32_SUS128_SRVW2_TT2_16_WG32_8_1_WGM2
    SolutionIndex: 14
    SolutionNameMin: Cijk_Ailk_Bljk_SB_MT64x128x16_MI32x32x2x1_SE_1LDSB0_EPS0_GRVW1_GSU1_LPB2_NLCA1_PGR2_PLR9_SU32_SUS128_SRVW2_TT1_64_WG64_4_1_WGM2
    SolutionIndex: 15
    SolutionNameMin: Cijk_Ailk_Bljk_SB_MT128x96x16_MI32x32x2x1_SE_1LDSB0_EPS0_GRVW1_GSU1_LPB2_NLCA2_PGR2_PLR9_SU32_SUS128_SRVW2_TT1_96_WG128_2_1_WGM2
    SolutionIndex: 16
    SolutionNameMin: Cijk_Ailk_Bljk_SB_MT64x32x16_MI16x16x4x1_SE_1LDSB0_EPS0_GRVW1_GSU1_LPB2_NLCA1_PGR2_PLR5_SU0_SUS256_SRVW2_TT2_16_WG32_8_1_WGM15
    SolutionIndex: 17
    SolutionNameMin: Cijk_Ailk_Bljk_SB_MT64x128x16_MI32x32x2x1_SE_1LDSB0_EPS1_GRVW1_GSU1_LPB2_NLCA1_PGR1_PLR9_SU0_SUS256_SRVW2_TT1_64_WG64_4_1_WGM15
    SolutionIndex: 18
    SolutionNameMin: Cijk_Ailk_Bljk_SB_MT128x128x16_MI32x32x2x1_SE_1LDSB0_EPS1_GRVW4_GSU1_LPB4_NLCA1_PGR1_PLR9_SU0_SUS256_SRVW2_TT2_64_WG64_4_1_WGM15
    SolutionIndex: 19
    SolutionNameMin: Cijk_Ailk_Bljk_SB_MT64x128x16_MI32x32x2x1_SE_1LDSB0_EPS0_GRVW4_GSU1_LPB4_NLCA1_PGR2_PLR9_SU0_SUS256_SRVW2_TT1_64_WG64_4_1_WGM15
    SolutionIndex: 20
    SolutionNameMin: Cijk_Ailk_Bljk_SB_MT128x96x16_MI32x32x2x1_SE_1LDSB0_EPS0_GRVW1_GSU1_LPB2_NLCA2_PGR2_PLR9_SU32_SUS128_SRVW2_TT1_96_WG128_2_1_WGM15
    SolutionIndex: 21
    SolutionNameMin: Cijk_Ailk_Bljk_SB_MT64x144x16_MI16x16x4x1_SE_1LDSB0_EPS0_GRVW1_GSU1_LPB2_NLCA1_PGR2_PLR5_SU32_SUS256_SRVW2_TT1_144_WG64_4_1_WGM15
    SolutionIndex: 22
    SolutionNameMin: Cijk_Ailk_Bljk_SB_MT64x128x16_MI32x32x2x1_SE_1LDSB0_EPS0_GRVW1_GSU1_LPB2_NLCA1_PGR2_PLR9_SU32_SUS256_SRVW2_TT1_64_WG64_4_1_WGM15
    SolutionIndex: 23
    SolutionNameMin: Cijk_Ailk_Bljk_SB_MT128x144x16_MI16x16x4x1_SE_1LDSB1_EPS1_GRVW1_GSU1_LPB2_NLCA2_PGR1_PLR5_SU0_SUS256_SRVW2_TT2_144_WG64_4_1_WGM1
    SolutionIndex: 24
    SolutionNameMin: Cijk_Ailk_Bljk_SB_MT96x96x16_MI16x16x4x1_SE_1LDSB1_EPS0_GRVW2_GSU1_LPB2_NLCA3_PGR2_PLR5_SU0_SUS256_SRVW0_TT3_48_WG32_8_1_WGM2
    SolutionIndex: 25
    SolutionNameMin: Cijk_Ailk_Bljk_SB_MT128x144x16_MI16x16x4x1_SE_1LDSB1_EPS1_GRVW1_GSU1_LPB2_NLCA2_PGR1_PLR5_SU0_SUS256_SRVW2_TT2_144_WG64_4_1_WGM15
- - - [1024, 2048, 1, 1024, 1024, 1024, 1024, 1024]
    - [7, 83.478]
  - - [1024, 2048, 1, 2, 1024, 1024, 1024, 2]
    - [21, 1.689]
  - - [1024, 2048, 1, 4096, 1024, 1024, 1024, 4096]
    - [7, 90.453]
  - - [1024, 4608, 1, 1024, 1024, 1024, 1024, 1024]
    - [10, 85.643]
  - - [1024, 4608, 1, 2, 1024, 1024, 1024, 2]
    - [9, 2.249]
  - - [1024, 4608, 1, 4096, 1024, 1024, 1024, 4096]
    - [8, 92.342]
  - - [3072, 2048, 1, 768, 3072, 3072, 3072, 768]
    - [25, 87.293]
  - - [3072, 4608, 1, 768, 3072, 3072, 3072, 768]
    - [24, 91.309]
  - - [4096, 2048, 1, 1024, 4096, 4096, 4096, 1024]
    - [23, 88.557]
  - - [4096, 4608, 1, 1024, 4096, 4096, 4096, 1024]
    - [2, 93.307]
  - - [768, 2048, 1, 2, 768, 768, 768, 2]
    - [17, 1.635]
  - - [768, 2048, 1, 3072, 768, 768, 768, 3072]
    - [18, 76.773]
  - - [768, 2048, 1, 768, 768, 768, 768, 768]
    - [19, 68.933]
  - - [768, 4608, 1, 2, 768, 768, 768, 2]
    - [22, 2.153]
  - - [768, 4608, 1, 3072, 768, 768, 768, 3072]
    - [12, 87.015]
  - - [768, 4608, 1, 768, 768, 768, 768, 768]
    - [3, 81.46]
  - - [128, 128, 192, 64, 128, 128, 128, 64]
    - [6, 31.142]
  - - [128, 128, 256, 64, 128, 128, 128, 64]
    - [16, 32.208]
  - - [384, 384, 144, 64, 384, 384, 384, 64]
    - [20, 56.523]
  - - [384, 384, 192, 64, 384, 384, 384, 64]
    - [15, 58.071]
  - - [512, 512, 48, 64, 512, 512, 512, 64]
    - [14, 47.7]
  - - [512, 512, 64, 64, 512, 512, 512, 64]
    - [4, 49.138]
  - - [64, 128, 192, 128, 64, 64, 64, 128]
    - [11, 37.871]
  - - [64, 128, 256, 128, 64, 64, 64, 128]
    - [13, 33.385]
  - - [64, 384, 144, 384, 64, 64, 64, 384]
    - [5, 57.481]
  - - [64, 384, 192, 384, 64, 64, 64, 384]
    - [1, 56.666]
  - - [64, 512, 48, 512, 64, 64, 64, 512]
    - [5, 59.694]
  - - [64, 512, 64, 512, 64, 64, 64, 512]
    - [0, 53.953]
- null
