Tensile/Configs/miopen/archives/resnet50/logic/vega20_Cijk_Ailk_Bljk_HB.yaml
- {MinimumRequiredVersion: 4.3.0}
- vega20
- gfx906
- [Device 66a0, Device 66a7]
    SolutionIndex: 0
    SolutionNameMin: Cijk_Ailk_Bljk_HB_MT128x128x16_DTL0_GRVW08_GSU01_LPB00_PGR1_PLR1_TT08_08_VW08_WG16_16_01_WGM01
    SolutionIndex: 1
    SolutionNameMin: Cijk_Ailk_Bljk_HB_MT128x128x16_DTL0_GRVW08_GSU01_LPB00_PGR1_PLR1_TT08_08_VW08_WG16_16_01_WGM08
    SolutionIndex: 2
    SolutionNameMin: Cijk_Ailk_Bljk_HB_MT128x032x16_DTL0_GRVW08_GSU01_LPB04_PGR1_PLR1_TT08_04_VW04_WG16_08_02_WGM64
    SolutionIndex: 3
    SolutionNameMin: Cijk_Ailk_Bljk_HB_MT128x064x16_DTL0_GRVW08_GSU01_LPB04_PGR1_PLR1_TT08_04_VW04_WG16_16_01_WGM01
    SolutionIndex: 4
    SolutionNameMin: Cijk_Ailk_Bljk_HB_MT128x064x16_DTL0_GRVW08_GSU01_LPB04_PGR1_PLR1_TT08_04_VW04_WG16_16_01_WGM08
    SolutionIndex: 5
    SolutionNameMin: Cijk_Ailk_Bljk_HB_MT128x064x32_DTL0_GRVW08_GSU05_LPB04_PGR0_PLR1_TT08_04_VW04_WG16_16_01_WGM08
    SolutionIndex: 6
    SolutionNameMin: Cijk_Ailk_Bljk_HB_MT064x128x16_DTL0_GRVW08_GSU01_LPB00_PGR0_PLR1_TT08_04_VW04_WG08_32_01_WGM01
    SolutionIndex: 7
    SolutionNameMin: Cijk_Ailk_Bljk_HB_MT256x064x08_DTL0_GRVW08_GSU01_LPB08_PGR1_PLR1_TT08_08_VW08_WG32_08_01_WGM01
    SolutionIndex: 8
    SolutionNameMin: Cijk_Ailk_Bljk_HB_MT064x128x16_DTL0_GRVW08_GSU01_LPB04_PGR0_PLR0_TT08_04_VW04_WG08_32_01_WGM01
    SolutionIndex: 9
    SolutionNameMin: Cijk_Ailk_Bljk_HB_MT128x064x16_DTL0_GRVW08_GSU01_LPB04_PGR0_PLR1_TT08_04_VW04_WG16_16_01_WGM01
- - - [3136, 64, 128, 64]
    - [7, 14524.3]
  - - [784, 512, 64, 128]
    - [6, 15406.1]
  - - [3136, 256, 64, 64]
    - [0, 15900.8]
  - - [784, 128, 128, 512]
    - [0, 15815.2]
  - - [784, 128, 64, 512]
    - [1, 15050.8]
  - - [3136, 512, 1, 2048]
    - [5, 14833.5]
  - - [12544, 256, 1, 1024]
    - [2, 15072.8]
  - - [3136, 64, 128, 256]
    - [9, 17266.8]
  - - [3136, 64, 64, 256]
    - [3, 16825.1]
  - - [3136, 2048, 1, 512]
    - [4, 16285.1]
  - - [784, 512, 128, 128]
    - [8, 15812.1]
  - - [3136, 64, 64, 64]
    - [7, 13432.6]
  - - [12544, 1024, 1, 256]
    - [3, 16901.1]
  - - [3136, 256, 128, 64]
    - [0, 16310.9]
- null
