Tensile/Configs/miopen/archives/resnet50/logic/vega20_Cijk_Ailk_Bljk_SB.yaml
- {MinimumRequiredVersion: 4.4.0}
- vega20
- gfx906
- [Device 66a0, Device 66a7]
    SolutionIndex: 0
    SolutionNameMin: Cijk_Ailk_Bljk_SB_MT064x064x16_DTL0_GRVW02_GSU04_PGR1_PLR1_TT04_04_VW02_WG16_16_01_WGM01
    SolutionIndex: 1
    SolutionNameMin: Cijk_Ailk_Bljk_SB_MT064x064x08_DTL0_GRVW04_GSU01_PGR1_PLR1_TT04_08_VW04_WG16_08_01_WGM01
    SolutionIndex: 2
    SolutionNameMin: Cijk_Ailk_Bljk_SB_MT064x128x08_DTL0_GRVW04_GSU01_PGR1_PLR1_TT08_04_VW04_WG08_32_01_WGM01
    SolutionIndex: 3
    SolutionNameMin: Cijk_Ailk_Bljk_SB_MT128x064x08_DTL0_GRVW04_GSU01_PGR1_PLR1_TT08_04_VW04_WG16_16_01_WGM01
    SolutionIndex: 4
    SolutionNameMin: Cijk_Ailk_Bljk_SB_MT128x064x08_DTL0_GRVW04_GSU01_PGR1_PLR1_TT04_08_VW04_WG32_08_01_WGM08
    SolutionIndex: 5
    SolutionNameMin: Cijk_Ailk_Bljk_SB_MT064x064x16_DTL0_GRVW04_GSU01_PGR0_PLR0_TT04_04_VW04_WG16_16_01_WGM01
    SolutionIndex: 6
    SolutionNameMin: Cijk_Ailk_Bljk_SB_MT064x064x16_DTL0_GRVW04_GSU01_PGR1_PLR1_TT04_04_VW04_WG16_16_01_WGM01
    SolutionIndex: 7
    SolutionNameMin: Cijk_Ailk_Bljk_SB_MT128x064x16_DTL0_GRVW04_GSU01_PGR1_PLR1_TT04_08_VW04_WG32_08_01_WGM01
    SolutionIndex: 8
    SolutionNameMin: Cijk_Ailk_Bljk_SB_MT128x064x16_DTL0_GRVW04_GSU01_PGR1_PLR1_TT08_04_VW04_WG16_16_01_WGM08
    SolutionIndex: 9
    SolutionNameMin: Cijk_Ailk_Bljk_SB_MT128x064x16_DTL0_GRVW04_GSU01_PGR1_PLR1_TT08_04_VW04_WG16_16_01_WGM64
- - - [3136, 64, 128, 64]
    - [5, 7734.96]
  - - [784, 512, 64, 128]
    - [2, 7939.64]
  - - [3136, 256, 64, 64]
    - [5, 7970.44]
  - - [784, 128, 128, 512]
    - [9, 7502.7]
  - - [784, 128, 64, 512]
    - [8, 7371.52]
  - - [3136, 512, 1, 2048]
    - [0, 6769.36]
  - - [12544, 256, 1, 1024]
    - [8, 7289.15]
  - - [3136, 64, 128, 256]
    - [3, 8635.2]
  - - [3136, 64, 64, 256]
    - [3, 8461.01]
  - - [3136, 2048, 1, 512]
    - [7, 7924.34]
  - - [784, 512, 128, 128]
    - [1, 8065.06]
  - - [3136, 64, 64, 64]
    - [6, 7408.73]
  - - [12544, 1024, 1, 256]
    - [4, 8637.02]
  - - [3136, 256, 128, 64]
    - [5, 8065.85]
- null
