test_dir/py38/lib/python3.6/site-packages/Tensile/Configs/miopen/archives/transformer/2020-01-19/exact/arcturus_Cijk_Ailk_Bjlk_SB.yaml
- {MinimumRequiredVersion: 4.15.0}
- arcturus
- gfx908
- [Device 7380, Device 7388, Device 738c, Device 7390, Device 731f]
    SolutionIndex: 0
    SolutionNameMin: Cijk_Ailk_Bjlk_SB_MT96x64x16_SE_EPS1_FL0_GRVW2_PGR1_PLR1_TT6_4_USFGRO0_VW2_WGM8
    SolutionIndex: 1
    SolutionNameMin: Cijk_Ailk_Bjlk_SB_MT96x64x8_SE_EPS1_FL1_GRVW2_PGR1_PLR1_TT6_4_USFGRO0_VW2_WGM1
    SolutionIndex: 2
    SolutionNameMin: Cijk_Ailk_Bjlk_SB_MT96x64x8_SE_EPS1_FL1_GRVW2_PGR1_PLR1_TT6_4_USFGRO0_VW2_WGM8
    SolutionIndex: 3
    SolutionNameMin: Cijk_Ailk_Bjlk_SB_MT64x96x8_SE_EPS1_FL1_GRVW2_PGR1_PLR1_TT4_6_USFGRO0_VW2_WGM1
    SolutionIndex: 4
    SolutionNameMin: Cijk_Ailk_Bjlk_SB_MT64x96x8_SE_EPS1_FL1_GRVW2_PGR1_PLR1_TT4_6_USFGRO0_VW2_WGM8
    SolutionIndex: 5
    SolutionNameMin: Cijk_Ailk_Bjlk_SB_MT64x128x8_SE_EPS0_FL0_GRVW1_PGR0_PLR0_TT4_8_USFGRO1_VW2_WGM8
    SolutionIndex: 6
    SolutionNameMin: Cijk_Ailk_Bjlk_SB_MT64x128x8_SE_EPS1_FL0_GRVW1_PGR1_PLR0_TT4_8_USFGRO1_VW2_WGM8
    SolutionIndex: 7
    SolutionNameMin: Cijk_Ailk_Bjlk_SB_MT64x128x16_SE_EPS0_FL0_GRVW1_PGR0_PLR0_TT4_8_USFGRO1_VW2_WGM1
    SolutionIndex: 8
    SolutionNameMin: Cijk_Ailk_Bjlk_SB_MT64x128x16_SE_EPS0_FL0_GRVW1_PGR0_PLR0_TT4_8_USFGRO1_VW2_WGM8
    SolutionIndex: 9
    SolutionNameMin: Cijk_Ailk_Bjlk_SB_MT64x128x8_SE_EPS0_FL0_GRVW1_PGR0_PLR1_TT4_8_USFGRO1_VW2_WGM1
    SolutionIndex: 10
    SolutionNameMin: Cijk_Ailk_Bjlk_SB_MT64x128x8_SE_EPS1_FL0_GRVW1_PGR1_PLR1_TT4_8_USFGRO1_VW2_WGM1
    SolutionIndex: 11
    SolutionNameMin: Cijk_Ailk_Bjlk_SB_MT64x128x8_SE_EPS0_FL0_GRVW1_PGR0_PLR1_TT4_8_USFGRO1_VW2_WGM8
    SolutionIndex: 12
    SolutionNameMin: Cijk_Ailk_Bjlk_SB_MT64x128x8_SE_EPS1_FL0_GRVW1_PGR1_PLR1_TT4_8_USFGRO1_VW2_WGM8
    SolutionIndex: 13
    SolutionNameMin: Cijk_Ailk_Bjlk_SB_MT64x128x16_SE_EPS0_FL0_GRVW1_PGR0_PLR1_TT4_8_USFGRO1_VW2_WGM8
    SolutionIndex: 14
    SolutionNameMin: Cijk_Ailk_Bjlk_SB_MT64x128x8_SE_EPS0_FL0_GRVW1_PGR0_PLR0_TT4_8_USFGRO1_VW4_WGM1
    SolutionIndex: 15
    SolutionNameMin: Cijk_Ailk_Bjlk_SB_MT64x128x8_SE_EPS1_FL0_GRVW1_PGR1_PLR0_TT4_8_USFGRO1_VW4_WGM1
    SolutionIndex: 16
    SolutionNameMin: Cijk_Ailk_Bjlk_SB_MT64x128x8_SE_EPS0_FL0_GRVW1_PGR0_PLR1_TT4_8_USFGRO1_VW4_WGM8
    SolutionIndex: 17
    SolutionNameMin: Cijk_Ailk_Bjlk_SB_MT64x128x8_SE_EPS1_FL0_GRVW2_PGR1_PLR0_TT4_8_USFGRO0_VW2_WGM1
    SolutionIndex: 18
    SolutionNameMin: Cijk_Ailk_Bjlk_SB_MT64x128x8_SE_EPS0_FL0_GRVW2_PGR0_PLR1_TT4_8_USFGRO0_VW2_WGM8
    SolutionIndex: 19
    SolutionNameMin: Cijk_Ailk_Bjlk_SB_MT64x128x8_SE_EPS0_FL1_GRVW2_PGR0_PLR1_TT4_8_USFGRO0_VW2_WGM1
    SolutionIndex: 20
    SolutionNameMin: Cijk_Ailk_Bjlk_SB_MT128x64x8_SE_EPS0_FL0_GRVW1_PGR0_PLR0_TT8_4_USFGRO1_VW2_WGM8
    SolutionIndex: 21
    SolutionNameMin: Cijk_Ailk_Bjlk_SB_MT128x64x8_SE_EPS0_FL0_GRVW1_PGR0_PLR1_TT8_4_USFGRO1_VW2_WGM1
    SolutionIndex: 22
    SolutionNameMin: Cijk_Ailk_Bjlk_SB_MT128x64x8_SE_EPS0_FL0_GRVW2_PGR0_PLR0_TT8_4_USFGRO0_VW2_WGM1
    SolutionIndex: 23
    SolutionNameMin: Cijk_Ailk_Bjlk_SB_MT128x64x8_SE_EPS1_FL0_GRVW2_PGR1_PLR1_TT8_4_USFGRO0_VW2_WGM8
    SolutionIndex: 24
    SolutionNameMin: Cijk_Ailk_Bjlk_SB_MT128x64x8_SE_EPS1_FL1_GRVW2_PGR1_PLR1_TT8_4_USFGRO0_VW2_WGM1
    SolutionIndex: 25
    SolutionNameMin: Cijk_Ailk_Bjlk_SB_MT128x64x8_SE_EPS1_FL1_GRVW2_PGR1_PLR1_TT8_4_USFGRO0_VW2_WGM8
    SolutionIndex: 26
    SolutionNameMin: Cijk_Ailk_Bjlk_SB_MT64x64x8_SE_EPS0_FL0_GRVW2_PGR0_PLR0_TT4_4_USFGRO0_VW2_WGM8
    SolutionIndex: 27
    SolutionNameMin: Cijk_Ailk_Bjlk_SB_MT64x64x8_SE_EPS0_FL1_GRVW2_PGR0_PLR0_TT4_4_USFGRO0_VW2_WGM8
    SolutionIndex: 28
    SolutionNameMin: Cijk_Ailk_Bjlk_SB_MT16x64x16_SE_EPS1_FL0_GRVW4_PGR1_PLR0_TT4_4_USFGRO0_VW4_WGM1
    SolutionIndex: 29
    SolutionNameMin: Cijk_Ailk_Bjlk_SB_MT16x64x16_SE_EPS1_FL0_GRVW4_PGR1_PLR1_TT4_4_USFGRO0_VW4_WGM1
    SolutionIndex: 30
    SolutionNameMin: Cijk_Ailk_Bjlk_SB_MT64x16x16_SE_EPS1_FL0_GRVW4_PGR1_PLR0_TT4_4_USFGRO0_VW4_WGM8
    SolutionIndex: 31
    SolutionNameMin: Cijk_Ailk_Bjlk_SB_MT64x16x16_SE_EPS1_FL0_GRVW4_PGR1_PLR1_TT4_4_USFGRO0_VW4_WGM8
- - - [512, 2048, 1, 2790, 512, 512, 512, 2048]
    - [1, 32.055]
  - - [512, 2048, 1, 2864, 512, 512, 512, 2048]
    - [1, 32.522]
  - - [512, 2048, 1, 3092, 512, 512, 512, 2048]
    - [1, 32.553]
  - - [512, 2048, 1, 3113, 512, 512, 512, 2048]
    - [1, 32.567]
  - - [512, 2048, 1, 3137, 512, 512, 512, 2048]
    - [1, 32.571]
  - - [512, 2048, 1, 3165, 512, 512, 512, 2048]
    - [1, 32.616]
  - - [512, 2048, 1, 3166, 512, 512, 512, 2048]
    - [1, 32.505]
  - - [512, 2048, 1, 3194, 512, 512, 512, 2048]
    - [1, 32.621]
  - - [512, 2048, 1, 3219, 512, 512, 512, 2048]
    - [1, 32.604]
  - - [512, 2048, 1, 3222, 512, 512, 512, 2048]
    - [1, 32.496]
  - - [512, 2048, 1, 3234, 512, 512, 512, 2048]
    - [1, 32.656]
  - - [512, 2048, 1, 3237, 512, 512, 512, 2048]
    - [1, 32.567]
  - - [512, 2048, 1, 3242, 512, 512, 512, 2048]
    - [1, 32.697]
  - - [512, 2048, 1, 3246, 512, 512, 512, 2048]
    - [1, 32.52]
  - - [512, 2048, 1, 3249, 512, 512, 512, 2048]
    - [1, 32.639]
  - - [512, 2048, 1, 3251, 512, 512, 512, 2048]
    - [1, 32.57]
  - - [512, 2048, 1, 3257, 512, 512, 512, 2048]
    - [1, 32.659]
  - - [512, 2048, 1, 3262, 512, 512, 512, 2048]
    - [3, 32.503]
  - - [512, 2048, 1, 3268, 512, 512, 512, 2048]
    - [1, 32.563]
  - - [512, 2048, 1, 3282, 512, 512, 512, 2048]
    - [1, 32.624]
  - - [512, 2048, 1, 3286, 512, 512, 512, 2048]
    - [1, 32.585]
  - - [512, 2048, 1, 3287, 512, 512, 512, 2048]
    - [2, 32.663]
  - - [512, 2048, 1, 3293, 512, 512, 512, 2048]
    - [1, 32.537]
  - - [512, 2048, 1, 3297, 512, 512, 512, 2048]
    - [1, 32.626]
  - - [512, 2048, 1, 3307, 512, 512, 512, 2048]
    - [1, 32.627]
  - - [512, 2048, 1, 3314, 512, 512, 512, 2048]
    - [1, 32.628]
  - - [512, 2048, 1, 3315, 512, 512, 512, 2048]
    - [1, 32.628]
  - - [512, 2048, 1, 3319, 512, 512, 512, 2048]
    - [1, 32.513]
  - - [512, 2048, 1, 3322, 512, 512, 512, 2048]
    - [4, 32.707]
  - - [512, 2048, 1, 3323, 512, 512, 512, 2048]
    - [1, 32.581]
  - - [512, 2048, 1, 3324, 512, 512, 512, 2048]
    - [1, 32.562]
  - - [512, 2048, 1, 3325, 512, 512, 512, 2048]
    - [3, 32.61]
  - - [512, 2048, 1, 3327, 512, 512, 512, 2048]
    - [1, 32.591]
  - - [512, 2048, 1, 3329, 512, 512, 512, 2048]
    - [1, 32.582]
  - - [512, 2048, 1, 3332, 512, 512, 512, 2048]
    - [1, 32.631]
  - - [512, 2048, 1, 3336, 512, 512, 512, 2048]
    - [1, 32.631]
  - - [512, 2048, 1, 3339, 512, 512, 512, 2048]
    - [1, 32.689]
  - - [512, 2048, 1, 3342, 512, 512, 512, 2048]
    - [1, 32.68]
  - - [512, 2048, 1, 3344, 512, 512, 512, 2048]
    - [4, 32.709]
  - - [512, 2048, 1, 3358, 512, 512, 512, 2048]
    - [1, 32.644]
  - - [512, 2048, 1, 3360, 512, 512, 512, 2048]
    - [3, 32.644]
  - - [512, 2048, 1, 3364, 512, 512, 512, 2048]
    - [1, 32.578]
  - - [512, 2048, 1, 3365, 512, 512, 512, 2048]
    - [1, 32.674]
  - - [512, 2048, 1, 3369, 512, 512, 512, 2048]
    - [1, 32.617]
  - - [512, 2048, 1, 3371, 512, 512, 512, 2048]
    - [1, 32.617]
  - - [512, 2048, 1, 3374, 512, 512, 512, 2048]
    - [1, 32.579]
  - - [512, 2048, 1, 3376, 512, 512, 512, 2048]
    - [1, 32.675]
  - - [512, 2048, 1, 3377, 512, 512, 512, 2048]
    - [4, 32.723]
  - - [512, 2048, 1, 3378, 512, 512, 512, 2048]
    - [1, 32.732]
  - - [512, 2048, 1, 3381, 512, 512, 512, 2048]
    - [1, 32.609]
  - - [512, 2048, 1, 3382, 512, 512, 512, 2048]
    - [1, 32.628]
  - - [512, 2048, 1, 3383, 512, 512, 512, 2048]
    - [1, 32.638]
  - - [512, 2048, 1, 3384, 512, 512, 512, 2048]
    - [1, 32.685]
  - - [512, 2048, 1, 3385, 512, 512, 512, 2048]
    - [1, 32.657]
  - - [512, 2048, 1, 3386, 512, 512, 512, 2048]
    - [1, 32.543]
  - - [512, 2048, 1, 3388, 512, 512, 512, 2048]
    - [1, 32.686]
  - - [512, 2048, 1, 3390, 512, 512, 512, 2048]
    - [1, 32.648]
  - - [512, 2048, 1, 3391, 512, 512, 512, 2048]
    - [1, 32.667]
  - - [512, 2048, 1, 3396, 512, 512, 512, 2048]
    - [1, 32.621]
  - - [512, 2048, 1, 3399, 512, 512, 512, 2048]
    - [3, 32.621]
  - - [512, 2048, 1, 3402, 512, 512, 512, 2048]
    - [1, 32.64]
  - - [512, 2048, 1, 3410, 512, 512, 512, 2048]
    - [1, 32.613]
  - - [512, 2048, 1, 3412, 512, 512, 512, 2048]
    - [1, 32.623]
  - - [512, 2048, 1, 3414, 512, 512, 512, 2048]
    - [1, 32.604]
  - - [512, 2048, 1, 3415, 512, 512, 512, 2048]
    - [1, 32.604]
  - - [512, 2048, 1, 3418, 512, 512, 512, 2048]
    - [1, 32.586]
  - - [512, 2048, 1, 3420, 512, 512, 512, 2048]
    - [1, 32.633]
  - - [512, 2048, 1, 3422, 512, 512, 512, 2048]
    - [3, 32.615]
  - - [512, 2048, 1, 3425, 512, 512, 512, 2048]
    - [1, 32.643]
  - - [512, 2048, 1, 3426, 512, 512, 512, 2048]
    - [1, 32.672]
  - - [512, 2048, 1, 3427, 512, 512, 512, 2048]
    - [1, 32.69]
  - - [512, 2048, 1, 3428, 512, 512, 512, 2048]
    - [1, 32.644]
  - - [512, 2048, 1, 3430, 512, 512, 512, 2048]
    - [1, 32.606]
  - - [512, 2048, 1, 3431, 512, 512, 512, 2048]
    - [1, 32.635]
  - - [512, 2048, 1, 3432, 512, 512, 512, 2048]
    - [2, 32.71]
  - - [512, 2048, 1, 3438, 512, 512, 512, 2048]
    - [1, 32.664]
  - - [512, 2048, 1, 3439, 512, 512, 512, 2048]
    - [3, 32.636]
  - - [512, 2048, 1, 3440, 512, 512, 512, 2048]
    - [3, 32.645]
  - - [512, 2048, 1, 3443, 512, 512, 512, 2048]
    - [1, 32.571]
  - - [512, 2048, 1, 3445, 512, 512, 512, 2048]
    - [1, 32.711]
  - - [512, 2048, 1, 3447, 512, 512, 512, 2048]
    - [1, 32.627]
  - - [512, 2048, 1, 3448, 512, 512, 512, 2048]
    - [1, 32.656]
  - - [512, 2048, 1, 3450, 512, 512, 512, 2048]
    - [1, 32.628]
  - - [512, 2048, 1, 3451, 512, 512, 512, 2048]
    - [1, 32.6]
  - - [512, 2048, 1, 3452, 512, 512, 512, 2048]
    - [1, 32.712]
  - - [512, 2048, 1, 3453, 512, 512, 512, 2048]
    - [1, 32.656]
  - - [512, 2048, 1, 3455, 512, 512, 512, 2048]
    - [1, 32.591]
  - - [512, 2048, 1, 3456, 512, 512, 512, 2048]
    - [1, 32.788]
  - - [512, 2048, 1, 3457, 512, 512, 512, 2048]
    - [1, 32.713]
  - - [512, 2048, 1, 3458, 512, 512, 512, 2048]
    - [3, 32.638]
  - - [512, 2048, 1, 3459, 512, 512, 512, 2048]
    - [1, 32.713]
  - - [512, 2048, 1, 3460, 512, 512, 512, 2048]
    - [1, 32.695]
  - - [512, 2048, 1, 3461, 512, 512, 512, 2048]
    - [1, 32.685]
  - - [512, 2048, 1, 3462, 512, 512, 512, 2048]
    - [3, 32.685]
  - - [512, 2048, 1, 3466, 512, 512, 512, 2048]
    - [1, 32.695]
  - - [512, 2048, 1, 3467, 512, 512, 512, 2048]
    - [3, 32.575]
  - - [512, 2048, 1, 3468, 512, 512, 512, 2048]
    - [1, 32.705]
  - - [512, 2048, 1, 3470, 512, 512, 512, 2048]
    - [1, 32.677]
  - - [512, 2048, 1, 3471, 512, 512, 512, 2048]
    - [1, 32.548]
  - - [512, 2048, 1, 3472, 512, 512, 512, 2048]
    - [1, 32.705]
  - - [512, 2048, 1, 3475, 512, 512, 512, 2048]
    - [1, 32.622]
  - - [512, 2048, 1, 3476, 512, 512, 512, 2048]
    - [1, 32.64]
  - - [512, 2048, 1, 3477, 512, 512, 512, 2048]
    - [1, 32.687]
  - - [512, 2048, 1, 3478, 512, 512, 512, 2048]
    - [3, 32.659]
  - - [512, 2048, 1, 3479, 512, 512, 512, 2048]
    - [1, 32.669]
  - - [512, 2048, 1, 3480, 512, 512, 512, 2048]
    - [1, 32.753]
  - - [512, 2048, 1, 3481, 512, 512, 512, 2048]
    - [1, 32.595]
  - - [512, 2048, 1, 3483, 512, 512, 512, 2048]
    - [1, 32.679]
  - - [512, 2048, 1, 3484, 512, 512, 512, 2048]
    - [1, 32.586]
  - - [512, 2048, 1, 3487, 512, 512, 512, 2048]
    - [1, 32.568]
  - - [512, 2048, 1, 3489, 512, 512, 512, 2048]
    - [1, 32.587]
  - - [512, 2048, 1, 3490, 512, 512, 512, 2048]
    - [1, 32.735]
  - - [512, 2048, 1, 3491, 512, 512, 512, 2048]
    - [1, 32.661]
  - - [512, 2048, 1, 3493, 512, 512, 512, 2048]
    - [3, 32.643]
  - - [512, 2048, 1, 3494, 512, 512, 512, 2048]
    - [1, 32.661]
  - - [512, 2048, 1, 3495, 512, 512, 512, 2048]
    - [3, 32.643]
  - - [512, 2048, 1, 3497, 512, 512, 512, 2048]
    - [1, 32.689]
  - - [512, 2048, 1, 3498, 512, 512, 512, 2048]
    - [3, 32.662]
  - - [512, 2048, 1, 3499, 512, 512, 512, 2048]
    - [4, 32.736]
  - - [512, 2048, 1, 3501, 512, 512, 512, 2048]
    - [1, 32.708]
  - - [512, 2048, 1, 3503, 512, 512, 512, 2048]
    - [1, 32.626]
  - - [512, 2048, 1, 3507, 512, 512, 512, 2048]
    - [1, 32.681]
  - - [512, 2048, 1, 3508, 512, 512, 512, 2048]
    - [1, 32.608]
  - - [512, 2048, 1, 3509, 512, 512, 512, 2048]
    - [3, 32.627]
  - - [512, 2048, 1, 3511, 512, 512, 512, 2048]
    - [1, 32.673]
  - - [512, 2048, 1, 3514, 512, 512, 512, 2048]
    - [1, 32.691]
  - - [512, 2048, 1, 3515, 512, 512, 512, 2048]
    - [1, 32.719]
  - - [512, 2048, 1, 3517, 512, 512, 512, 2048]
    - [1, 32.692]
  - - [512, 2048, 1, 3518, 512, 512, 512, 2048]
    - [1, 32.655]
  - - [512, 2048, 1, 3519, 512, 512, 512, 2048]
    - [1, 32.582]
  - - [512, 2048, 1, 3520, 512, 512, 512, 2048]
    - [1, 32.72]
  - - [512, 2048, 1, 3523, 512, 512, 512, 2048]
    - [1, 32.637]
  - - [512, 2048, 1, 3528, 512, 512, 512, 2048]
    - [1, 32.757]
  - - [512, 2048, 1, 3529, 512, 512, 512, 2048]
    - [1, 32.693]
  - - [512, 2048, 1, 3530, 512, 512, 512, 2048]
    - [1, 32.602]
  - - [512, 2048, 1, 3532, 512, 512, 512, 2048]
    - [2, 32.712]
  - - [512, 2048, 1, 3533, 512, 512, 512, 2048]
    - [1, 32.621]
  - - [512, 2048, 1, 3534, 512, 512, 512, 2048]
    - [1, 32.666]
  - - [512, 2048, 1, 3538, 512, 512, 512, 2048]
    - [1, 32.694]
  - - [512, 2048, 1, 3539, 512, 512, 512, 2048]
    - [1, 32.694]
  - - [512, 2048, 1, 3541, 512, 512, 512, 2048]
    - [1, 32.667]
  - - [512, 2048, 1, 3547, 512, 512, 512, 2048]
    - [1, 32.686]
  - - [512, 2048, 1, 3548, 512, 512, 512, 2048]
    - [2, 32.732]
  - - [512, 2048, 1, 3552, 512, 512, 512, 2048]
    - [1, 32.714]
  - - [512, 2048, 1, 3564, 512, 512, 512, 2048]
    - [1, 32.688]
  - - [512, 2048, 1, 3575, 512, 512, 512, 2048]
    - [1, 32.671]
  - - [512, 2048, 1, 3598, 512, 512, 512, 2048]
    - [1, 32.674]
  - - [512, 2048, 1, 3599, 512, 512, 512, 2048]
    - [1, 32.674]
  - - [512, 2048, 1, 3608, 512, 512, 512, 2048]
    - [1, 32.792]
  - - [512, 2048, 1, 3780, 512, 512, 512, 2048]
    - [1, 32.711]
  - - [512, 2048, 1, 3796, 512, 512, 512, 2048]
    - [1, 32.671]
  - - [512, 2048, 1, 3822, 512, 512, 512, 2048]
    - [1, 32.758]
  - - [512, 2048, 1, 3840, 512, 512, 512, 2048]
    - [1, 32.802]
  - - [512, 2048, 1, 3859, 512, 512, 512, 2048]
    - [1, 32.795]
  - - [512, 2048, 1, 3870, 512, 512, 512, 2048]
    - [1, 32.762]
  - - [512, 2048, 1, 3876, 512, 512, 512, 2048]
    - [1, 32.779]
  - - [512, 2048, 1, 3906, 512, 512, 512, 2048]
    - [3, 32.824]
  - - [512, 2048, 1, 3910, 512, 512, 512, 2048]
    - [1, 32.849]
  - - [512, 2048, 1, 3925, 512, 512, 512, 2048]
    - [1, 32.8]
  - - [512, 2048, 1, 3942, 512, 512, 512, 2048]
    - [1, 32.785]
  - - [512, 2048, 1, 3944, 512, 512, 512, 2048]
    - [1, 32.851]
  - - [512, 2048, 1, 3955, 512, 512, 512, 2048]
    - [3, 32.72]
  - - [512, 2048, 1, 3968, 512, 512, 512, 2048]
    - [3, 32.844]
  - - [512, 2048, 1, 3969, 512, 512, 512, 2048]
    - [1, 32.803]
  - - [512, 2048, 1, 3976, 512, 512, 512, 2048]
    - [1, 32.828]
  - - [512, 2048, 1, 3977, 512, 512, 512, 2048]
    - [1, 32.836]
  - - [512, 2048, 1, 3978, 512, 512, 512, 2048]
    - [1, 32.804]
  - - [512, 2048, 1, 3990, 512, 512, 512, 2048]
    - [1, 32.756]
  - - [512, 2048, 1, 3995, 512, 512, 512, 2048]
    - [1, 32.83]
  - - [512, 2048, 1, 3996, 512, 512, 512, 2048]
    - [1, 32.764]
  - - [512, 2048, 1, 3999, 512, 512, 512, 2048]
    - [1, 32.813]
  - - [512, 2048, 1, 4005, 512, 512, 512, 2048]
    - [1, 32.741]
  - - [512, 2048, 1, 4012, 512, 512, 512, 2048]
    - [1, 32.79]
  - - [512, 2048, 1, 4020, 512, 512, 512, 2048]
    - [1, 32.848]
  - - [512, 2048, 1, 4026, 512, 512, 512, 2048]
    - [1, 32.791]
  - - [512, 2048, 1, 4030, 512, 512, 512, 2048]
    - [1, 32.8]
  - - [512, 2048, 1, 4032, 512, 512, 512, 2048]
    - [1, 32.913]
  - - [512, 33708, 1, 3780, 512, 512, 512, 33708]
    - [25, 47.225]
  - - [512, 33708, 1, 3796, 512, 512, 512, 33708]
    - [23, 47.195]
  - - [512, 33708, 1, 3822, 512, 512, 512, 33708]
    - [25, 47.2]
  - - [512, 33708, 1, 3840, 512, 512, 512, 33708]
    - [25, 47.17]
  - - [512, 33708, 1, 3859, 512, 512, 512, 33708]
    - [25, 47.161]
  - - [512, 33708, 1, 3870, 512, 512, 512, 33708]
    - [23, 47.139]
  - - [512, 33708, 1, 3876, 512, 512, 512, 33708]
    - [23, 47.153]
  - - [512, 33708, 1, 3906, 512, 512, 512, 33708]
    - [23, 47.142]
  - - [512, 33708, 1, 3910, 512, 512, 512, 33708]
    - [25, 47.13]
  - - [512, 33708, 1, 3925, 512, 512, 512, 33708]
    - [23, 47.156]
  - - [512, 33708, 1, 3942, 512, 512, 512, 33708]
    - [25, 47.138]
  - - [512, 33708, 1, 3944, 512, 512, 512, 33708]
    - [25, 47.169]
  - - [512, 33708, 1, 3955, 512, 512, 512, 33708]
    - [25, 47.153]
  - - [512, 33708, 1, 3968, 512, 512, 512, 33708]
    - [25, 47.121]
  - - [512, 33708, 1, 3969, 512, 512, 512, 33708]
    - [25, 47.184]
  - - [512, 33708, 1, 3976, 512, 512, 512, 33708]
    - [23, 47.177]
  - - [512, 33708, 1, 3977, 512, 512, 512, 33708]
    - [23, 47.13]
  - - [512, 33708, 1, 3978, 512, 512, 512, 33708]
    - [23, 47.177]
  - - [512, 33708, 1, 3990, 512, 512, 512, 33708]
    - [25, 47.189]
  - - [512, 33708, 1, 3995, 512, 512, 512, 33708]
    - [24, 47.233]
  - - [512, 33708, 1, 3996, 512, 512, 512, 33708]
    - [23, 47.12]
  - - [512, 33708, 1, 3999, 512, 512, 512, 33708]
    - [25, 47.141]
  - - [512, 33708, 1, 4005, 512, 512, 512, 33708]
    - [23, 47.162]
  - - [512, 33708, 1, 4012, 512, 512, 512, 33708]
    - [25, 47.126]
  - - [512, 33708, 1, 4020, 512, 512, 512, 33708]
    - [23, 47.125]
  - - [512, 33708, 1, 4026, 512, 512, 512, 33708]
    - [23, 47.116]
  - - [512, 33708, 1, 4030, 512, 512, 512, 33708]
    - [25, 47.104]
  - - [512, 33708, 1, 4032, 512, 512, 512, 33708]
    - [23, 47.137]
  - - [2048, 512, 1, 2790, 2048, 2048, 2048, 512]
    - [1, 32.404]
  - - [2048, 512, 1, 2864, 2048, 2048, 2048, 512]
    - [1, 32.433]
  - - [2048, 512, 1, 3092, 2048, 2048, 2048, 512]
    - [1, 32.533]
  - - [2048, 512, 1, 3113, 2048, 2048, 2048, 512]
    - [1, 32.671]
  - - [2048, 512, 1, 3137, 2048, 2048, 2048, 512]
    - [1, 32.551]
  - - [2048, 512, 1, 3165, 2048, 2048, 2048, 512]
    - [1, 32.525]
  - - [2048, 512, 1, 3166, 2048, 2048, 2048, 512]
    - [1, 32.425]
  - - [2048, 512, 1, 3194, 2048, 2048, 2048, 512]
    - [1, 32.55]
  - - [2048, 512, 1, 3219, 2048, 2048, 2048, 512]
    - [1, 32.584]
  - - [2048, 512, 1, 3222, 2048, 2048, 2048, 512]
    - [1, 32.635]
  - - [2048, 512, 1, 3234, 2048, 2048, 2048, 512]
    - [1, 32.557]
  - - [2048, 512, 1, 3237, 2048, 2048, 2048, 512]
    - [1, 32.577]
  - - [2048, 512, 1, 3242, 2048, 2048, 2048, 512]
    - [1, 32.648]
  - - [2048, 512, 1, 3246, 2048, 2048, 2048, 512]
    - [1, 32.549]
  - - [2048, 512, 1, 3249, 2048, 2048, 2048, 512]
    - [1, 32.658]
  - - [2048, 512, 1, 3251, 2048, 2048, 2048, 512]
    - [1, 32.599]
  - - [2048, 512, 1, 3257, 2048, 2048, 2048, 512]
    - [1, 32.6]
  - - [2048, 512, 1, 3262, 2048, 2048, 2048, 512]
    - [1, 32.523]
  - - [2048, 512, 1, 3268, 2048, 2048, 2048, 512]
    - [1, 32.582]
  - - [2048, 512, 1, 3282, 2048, 2048, 2048, 512]
    - [1, 32.624]
  - - [2048, 512, 1, 3286, 2048, 2048, 2048, 512]
    - [1, 32.585]
  - - [2048, 512, 1, 3287, 2048, 2048, 2048, 512]
    - [1, 32.595]
  - - [2048, 512, 1, 3293, 2048, 2048, 2048, 512]
    - [1, 32.567]
  - - [2048, 512, 1, 3297, 2048, 2048, 2048, 512]
    - [1, 32.558]
  - - [2048, 512, 1, 3307, 2048, 2048, 2048, 512]
    - [1, 32.559]
  - - [2048, 512, 1, 3314, 2048, 2048, 2048, 512]
    - [1, 32.58]
  - - [2048, 512, 1, 3315, 2048, 2048, 2048, 512]
    - [1, 32.56]
  - - [2048, 512, 1, 3319, 2048, 2048, 2048, 512]
    - [1, 32.629]
  - - [2048, 512, 1, 3322, 2048, 2048, 2048, 512]
    - [1, 32.717]
  - - [2048, 512, 1, 3323, 2048, 2048, 2048, 512]
    - [1, 32.542]
  - - [2048, 512, 1, 3324, 2048, 2048, 2048, 512]
    - [1, 32.678]
  - - [2048, 512, 1, 3325, 2048, 2048, 2048, 512]
    - [1, 32.62]
  - - [2048, 512, 1, 3327, 2048, 2048, 2048, 512]
    - [1, 32.63]
  - - [2048, 512, 1, 3329, 2048, 2048, 2048, 512]
    - [1, 32.476]
  - - [2048, 512, 1, 3332, 2048, 2048, 2048, 512]
    - [1, 32.621]
  - - [2048, 512, 1, 3336, 2048, 2048, 2048, 512]
    - [1, 32.747]
  - - [2048, 512, 1, 3339, 2048, 2048, 2048, 512]
    - [1, 32.536]
  - - [2048, 512, 1, 3342, 2048, 2048, 2048, 512]
    - [1, 32.507]
  - - [2048, 512, 1, 3344, 2048, 2048, 2048, 512]
    - [1, 32.69]
  - - [2048, 512, 1, 3358, 2048, 2048, 2048, 512]
    - [1, 32.701]
  - - [2048, 512, 1, 3360, 2048, 2048, 2048, 512]
    - [1, 32.577]
  - - [2048, 512, 1, 3364, 2048, 2048, 2048, 512]
    - [1, 32.654]
  - - [2048, 512, 1, 3365, 2048, 2048, 2048, 512]
    - [1, 32.626]
  - - [2048, 512, 1, 3369, 2048, 2048, 2048, 512]
    - [0, 32.55]
  - - [2048, 512, 1, 3371, 2048, 2048, 2048, 512]
    - [1, 32.646]
  - - [2048, 512, 1, 3374, 2048, 2048, 2048, 512]
    - [1, 32.579]
  - - [2048, 512, 1, 3376, 2048, 2048, 2048, 512]
    - [1, 32.713]
  - - [2048, 512, 1, 3377, 2048, 2048, 2048, 512]
    - [1, 32.627]
  - - [2048, 512, 1, 3378, 2048, 2048, 2048, 512]
    - [1, 32.723]
  - - [2048, 512, 1, 3381, 2048, 2048, 2048, 512]
    - [1, 32.59]
  - - [2048, 512, 1, 3382, 2048, 2048, 2048, 512]
    - [1, 32.647]
  - - [2048, 512, 1, 3383, 2048, 2048, 2048, 512]
    - [1, 32.704]
  - - [2048, 512, 1, 3384, 2048, 2048, 2048, 512]
    - [1, 32.657]
  - - [2048, 512, 1, 3385, 2048, 2048, 2048, 512]
    - [1, 32.562]
  - - [2048, 512, 1, 3386, 2048, 2048, 2048, 512]
    - [2, 32.676]
  - - [2048, 512, 1, 3388, 2048, 2048, 2048, 512]
    - [1, 32.638]
  - - [2048, 512, 1, 3390, 2048, 2048, 2048, 512]
    - [1, 32.648]
  - - [2048, 512, 1, 3391, 2048, 2048, 2048, 512]
    - [1, 32.696]
  - - [2048, 512, 1, 3396, 2048, 2048, 2048, 512]
    - [1, 32.63]
  - - [2048, 512, 1, 3399, 2048, 2048, 2048, 512]
    - [1, 32.564]
  - - [2048, 512, 1, 3402, 2048, 2048, 2048, 512]
    - [1, 32.707]
  - - [2048, 512, 1, 3410, 2048, 2048, 2048, 512]
    - [1, 32.66]
  - - [2048, 512, 1, 3412, 2048, 2048, 2048, 512]
    - [1, 32.632]
  - - [2048, 512, 1, 3414, 2048, 2048, 2048, 512]
    - [1, 32.68]
  - - [2048, 512, 1, 3415, 2048, 2048, 2048, 512]
    - [1, 32.604]
  - - [2048, 512, 1, 3418, 2048, 2048, 2048, 512]
    - [1, 32.661]
  - - [2048, 512, 1, 3420, 2048, 2048, 2048, 512]
    - [1, 32.614]
  - - [2048, 512, 1, 3422, 2048, 2048, 2048, 512]
    - [1, 32.671]
  - - [2048, 512, 1, 3425, 2048, 2048, 2048, 512]
    - [1, 32.672]
  - - [2048, 512, 1, 3426, 2048, 2048, 2048, 512]
    - [2, 32.653]
  - - [2048, 512, 1, 3427, 2048, 2048, 2048, 512]
    - [1, 32.672]
  - - [2048, 512, 1, 3428, 2048, 2048, 2048, 512]
    - [1, 32.634]
  - - [2048, 512, 1, 3430, 2048, 2048, 2048, 512]
    - [1, 32.606]
  - - [2048, 512, 1, 3431, 2048, 2048, 2048, 512]
    - [1, 32.616]
  - - [2048, 512, 1, 3432, 2048, 2048, 2048, 512]
    - [1, 32.729]
  - - [2048, 512, 1, 3438, 2048, 2048, 2048, 512]
    - [1, 32.73]
  - - [2048, 512, 1, 3439, 2048, 2048, 2048, 512]
    - [1, 32.655]
  - - [2048, 512, 1, 3440, 2048, 2048, 2048, 512]
    - [2, 32.692]
  - - [2048, 512, 1, 3443, 2048, 2048, 2048, 512]
    - [1, 32.692]
  - - [2048, 512, 1, 3445, 2048, 2048, 2048, 512]
    - [1, 32.683]
  - - [2048, 512, 1, 3447, 2048, 2048, 2048, 512]
    - [0, 32.313]
  - - [2048, 512, 1, 3448, 2048, 2048, 2048, 512]
    - [1, 32.656]
  - - [2048, 512, 1, 3450, 2048, 2048, 2048, 512]
    - [1, 32.74]
  - - [2048, 512, 1, 3451, 2048, 2048, 2048, 512]
    - [2, 32.637]
  - - [2048, 512, 1, 3452, 2048, 2048, 2048, 512]
    - [1, 32.694]
  - - [2048, 512, 1, 3453, 2048, 2048, 2048, 512]
    - [2, 32.647]
  - - [2048, 512, 1, 3455, 2048, 2048, 2048, 512]
    - [1, 32.61]
  - - [2048, 512, 1, 3456, 2048, 2048, 2048, 512]
    - [1, 32.722]
  - - [2048, 512, 1, 3457, 2048, 2048, 2048, 512]
    - [1, 32.722]
  - - [2048, 512, 1, 3458, 2048, 2048, 2048, 512]
    - [1, 32.741]
  - - [2048, 512, 1, 3459, 2048, 2048, 2048, 512]
    - [1, 32.638]
  - - [2048, 512, 1, 3460, 2048, 2048, 2048, 512]
    - [1, 32.666]
  - - [2048, 512, 1, 3461, 2048, 2048, 2048, 512]
    - [1, 32.602]
  - - [2048, 512, 1, 3462, 2048, 2048, 2048, 512]
    - [1, 32.676]
  - - [2048, 512, 1, 3466, 2048, 2048, 2048, 512]
    - [1, 32.789]
  - - [2048, 512, 1, 3467, 2048, 2048, 2048, 512]
    - [1, 32.649]
  - - [2048, 512, 1, 3468, 2048, 2048, 2048, 512]
    - [1, 32.667]
  - - [2048, 512, 1, 3470, 2048, 2048, 2048, 512]
    - [1, 32.696]
  - - [2048, 512, 1, 3471, 2048, 2048, 2048, 512]
    - [1, 32.474]
  - - [2048, 512, 1, 3472, 2048, 2048, 2048, 512]
    - [1, 32.789]
  - - [2048, 512, 1, 3475, 2048, 2048, 2048, 512]
    - [1, 32.604]
  - - [2048, 512, 1, 3476, 2048, 2048, 2048, 512]
    - [1, 32.622]
  - - [2048, 512, 1, 3477, 2048, 2048, 2048, 512]
    - [1, 32.687]
  - - [2048, 512, 1, 3478, 2048, 2048, 2048, 512]
    - [1, 32.724]
  - - [2048, 512, 1, 3479, 2048, 2048, 2048, 512]
    - [1, 32.66]
  - - [2048, 512, 1, 3480, 2048, 2048, 2048, 512]
    - [1, 32.706]
  - - [2048, 512, 1, 3481, 2048, 2048, 2048, 512]
    - [1, 32.522]
  - - [2048, 512, 1, 3483, 2048, 2048, 2048, 512]
    - [1, 32.632]
  - - [2048, 512, 1, 3484, 2048, 2048, 2048, 512]
    - [1, 32.67]
  - - [2048, 512, 1, 3487, 2048, 2048, 2048, 512]
    - [1, 32.661]
  - - [2048, 512, 1, 3489, 2048, 2048, 2048, 512]
    - [1, 32.642]
  - - [2048, 512, 1, 3490, 2048, 2048, 2048, 512]
    - [1, 32.67]
  - - [2048, 512, 1, 3491, 2048, 2048, 2048, 512]
    - [1, 32.68]
  - - [2048, 512, 1, 3493, 2048, 2048, 2048, 512]
    - [2, 32.698]
  - - [2048, 512, 1, 3494, 2048, 2048, 2048, 512]
    - [1, 32.652]
  - - [2048, 512, 1, 3495, 2048, 2048, 2048, 512]
    - [1, 32.689]
  - - [2048, 512, 1, 3497, 2048, 2048, 2048, 512]
    - [1, 32.736]
  - - [2048, 512, 1, 3498, 2048, 2048, 2048, 512]
    - [1, 32.616]
  - - [2048, 512, 1, 3499, 2048, 2048, 2048, 512]
    - [1, 32.671]
  - - [2048, 512, 1, 3501, 2048, 2048, 2048, 512]
    - [1, 32.681]
  - - [2048, 512, 1, 3503, 2048, 2048, 2048, 512]
    - [1, 32.644]
  - - [2048, 512, 1, 3507, 2048, 2048, 2048, 512]
    - [1, 32.746]
  - - [2048, 512, 1, 3508, 2048, 2048, 2048, 512]
    - [1, 32.599]
  - - [2048, 512, 1, 3509, 2048, 2048, 2048, 512]
    - [1, 32.709]
  - - [2048, 512, 1, 3511, 2048, 2048, 2048, 512]
    - [1, 32.673]
  - - [2048, 512, 1, 3514, 2048, 2048, 2048, 512]
    - [1, 32.655]
  - - [2048, 512, 1, 3515, 2048, 2048, 2048, 512]
    - [1, 32.618]
  - - [2048, 512, 1, 3517, 2048, 2048, 2048, 512]
    - [1, 32.683]
  - - [2048, 512, 1, 3518, 2048, 2048, 2048, 512]
    - [1, 32.609]
  - - [2048, 512, 1, 3519, 2048, 2048, 2048, 512]
    - [1, 32.784]
  - - [2048, 512, 1, 3520, 2048, 2048, 2048, 512]
    - [1, 32.646]
  - - [2048, 512, 1, 3523, 2048, 2048, 2048, 512]
    - [1, 32.729]
  - - [2048, 512, 1, 3528, 2048, 2048, 2048, 512]
    - [1, 32.785]
  - - [2048, 512, 1, 3529, 2048, 2048, 2048, 512]
    - [1, 32.693]
  - - [2048, 512, 1, 3530, 2048, 2048, 2048, 512]
    - [1, 32.739]
  - - [2048, 512, 1, 3532, 2048, 2048, 2048, 512]
    - [1, 32.694]
  - - [2048, 512, 1, 3533, 2048, 2048, 2048, 512]
    - [1, 32.584]
  - - [2048, 512, 1, 3534, 2048, 2048, 2048, 512]
    - [1, 32.739]
  - - [2048, 512, 1, 3538, 2048, 2048, 2048, 512]
    - [1, 32.712]
  - - [2048, 512, 1, 3539, 2048, 2048, 2048, 512]
    - [1, 32.777]
  - - [2048, 512, 1, 3541, 2048, 2048, 2048, 512]
    - [1, 32.649]
  - - [2048, 512, 1, 3547, 2048, 2048, 2048, 512]
    - [1, 32.65]
  - - [2048, 512, 1, 3548, 2048, 2048, 2048, 512]
    - [1, 32.641]
  - - [2048, 512, 1, 3552, 2048, 2048, 2048, 512]
    - [1, 32.769]
  - - [2048, 512, 1, 3564, 2048, 2048, 2048, 512]
    - [2, 32.661]
  - - [2048, 512, 1, 3575, 2048, 2048, 2048, 512]
    - [1, 32.716]
  - - [2048, 512, 1, 3598, 2048, 2048, 2048, 512]
    - [1, 32.656]
  - - [2048, 512, 1, 3599, 2048, 2048, 2048, 512]
    - [1, 32.692]
  - - [2048, 512, 1, 3608, 2048, 2048, 2048, 512]
    - [1, 32.792]
  - - [2048, 512, 1, 3780, 2048, 2048, 2048, 512]
    - [1, 32.78]
  - - [2048, 512, 1, 3796, 2048, 2048, 2048, 512]
    - [1, 32.704]
  - - [2048, 512, 1, 3822, 2048, 2048, 2048, 512]
    - [1, 32.656]
  - - [2048, 512, 1, 3840, 2048, 2048, 2048, 512]
    - [1, 32.81]
  - - [2048, 512, 1, 3859, 2048, 2048, 2048, 512]
    - [1, 32.77]
  - - [2048, 512, 1, 3870, 2048, 2048, 2048, 512]
    - [1, 32.821]
  - - [2048, 512, 1, 3876, 2048, 2048, 2048, 512]
    - [1, 32.771]
  - - [2048, 512, 1, 3906, 2048, 2048, 2048, 512]
    - [1, 32.74]
  - - [2048, 512, 1, 3910, 2048, 2048, 2048, 512]
    - [1, 32.799]
  - - [2048, 512, 1, 3925, 2048, 2048, 2048, 512]
    - [1, 32.775]
  - - [2048, 512, 1, 3942, 2048, 2048, 2048, 512]
    - [2, 32.678]
  - - [2048, 512, 1, 3944, 2048, 2048, 2048, 512]
    - [1, 32.785]
  - - [2048, 512, 1, 3955, 2048, 2048, 2048, 512]
    - [2, 32.753]
  - - [2048, 512, 1, 3968, 2048, 2048, 2048, 512]
    - [1, 32.902]
  - - [2048, 512, 1, 3969, 2048, 2048, 2048, 512]
    - [1, 32.771]
  - - [2048, 512, 1, 3976, 2048, 2048, 2048, 512]
    - [2, 32.919]
  - - [2048, 512, 1, 3977, 2048, 2048, 2048, 512]
    - [1, 32.853]
  - - [2048, 512, 1, 3978, 2048, 2048, 2048, 512]
    - [1, 32.747]
  - - [2048, 512, 1, 3990, 2048, 2048, 2048, 512]
    - [1, 32.772]
  - - [2048, 512, 1, 3995, 2048, 2048, 2048, 512]
    - [1, 32.854]
  - - [2048, 512, 1, 3996, 2048, 2048, 2048, 512]
    - [1, 32.83]
  - - [2048, 512, 1, 3999, 2048, 2048, 2048, 512]
    - [1, 32.838]
  - - [2048, 512, 1, 4005, 2048, 2048, 2048, 512]
    - [1, 32.92]
  - - [2048, 512, 1, 4012, 2048, 2048, 2048, 512]
    - [1, 32.839]
  - - [2048, 512, 1, 4020, 2048, 2048, 2048, 512]
    - [1, 32.864]
  - - [2048, 512, 1, 4026, 2048, 2048, 2048, 512]
    - [1, 32.824]
  - - [2048, 512, 1, 4030, 2048, 2048, 2048, 512]
    - [1, 32.897]
  - - [2048, 512, 1, 4032, 2048, 2048, 2048, 512]
    - [1, 32.856]
  - - [512, 512, 1, 3780, 512, 512, 512, 512]
    - [31, 23.97]
  - - [512, 512, 1, 3796, 512, 512, 512, 512]
    - [29, 23.979]
  - - [512, 512, 1, 3822, 512, 512, 512, 512]
    - [31, 24.671]
  - - [512, 512, 1, 3840, 512, 512, 512, 512]
    - [31, 23.027]
  - - [512, 512, 1, 3859, 512, 512, 512, 512]
    - [31, 23.69]
  - - [512, 512, 1, 3870, 512, 512, 512, 512]
    - [31, 23.548]
  - - [512, 512, 1, 3876, 512, 512, 512, 512]
    - [31, 23.209]
  - - [512, 512, 1, 3906, 512, 512, 512, 512]
    - [29, 23.237]
  - - [512, 512, 1, 3910, 512, 512, 512, 512]
    - [31, 23.652]
  - - [512, 512, 1, 3925, 512, 512, 512, 512]
    - [31, 24.257]
  - - [512, 512, 1, 3927, 512, 512, 512, 512]
    - [31, 23.162]
  - - [512, 512, 1, 3942, 512, 512, 512, 512]
    - [31, 24.289]
  - - [512, 512, 1, 3944, 512, 512, 512, 512]
    - [30, 23.346]
  - - [512, 512, 1, 3955, 512, 512, 512, 512]
    - [27, 23.427]
  - - [512, 512, 1, 3968, 512, 512, 512, 512]
    - [31, 23.589]
  - - [512, 512, 1, 3969, 512, 512, 512, 512]
    - [31, 23.162]
  - - [512, 512, 1, 3976, 512, 512, 512, 512]
    - [31, 23.722]
  - - [512, 512, 1, 3977, 512, 512, 512, 512]
    - [31, 24.745]
  - - [512, 512, 1, 3978, 512, 512, 512, 512]
    - [31, 24.901]
  - - [512, 512, 1, 3990, 512, 512, 512, 512]
    - [29, 23.961]
  - - [512, 512, 1, 3995, 512, 512, 512, 512]
    - [31, 23.597]
  - - [512, 512, 1, 3996, 512, 512, 512, 512]
    - [28, 23.222]
  - - [512, 512, 1, 3999, 512, 512, 512, 512]
    - [31, 24.9]
  - - [512, 512, 1, 4005, 512, 512, 512, 512]
    - [31, 24.994]
  - - [512, 512, 1, 4012, 512, 512, 512, 512]
    - [29, 23.954]
  - - [512, 512, 1, 4020, 512, 512, 512, 512]
    - [29, 23.984]
  - - [512, 512, 1, 4026, 512, 512, 512, 512]
    - [31, 23.478]
  - - [512, 512, 1, 4030, 512, 512, 512, 512]
    - [31, 24.521]
  - - [512, 512, 1, 4032, 512, 512, 512, 512]
    - [31, 25.106]
  - - [512, 512, 1, 4050, 512, 512, 512, 512]
    - [26, 23.161]
  - - [512, 512, 1, 4059, 512, 512, 512, 512]
    - [29, 23.197]
  - - [64, 12, 2520, 12, 64, 64, 64, 12]
    - [20, 1.358]
  - - [64, 13, 2336, 13, 64, 64, 64, 13]
    - [8, 1.628]
  - - [64, 14, 2184, 14, 64, 64, 64, 14]
    - [7, 1.783]
  - - [64, 15, 2048, 15, 64, 64, 64, 15]
    - [20, 1.952]
  - - [64, 16, 1920, 16, 64, 64, 64, 16]
    - [22, 2.104]
  - - [64, 17, 1816, 17, 64, 64, 64, 17]
    - [20, 2.372]
  - - [64, 18, 1720, 18, 64, 64, 64, 18]
    - [5, 2.547]
  - - [64, 19, 1632, 19, 64, 64, 64, 19]
    - [21, 2.743]
  - - [64, 21, 1488, 21, 64, 64, 64, 21]
    - [11, 3.055]
  - - [64, 23, 1360, 23, 64, 64, 64, 23]
    - [9, 3.545]
  - - [64, 25, 1256, 25, 64, 64, 64, 25]
    - [9, 3.916]
  - - [64, 27, 1168, 27, 64, 64, 64, 27]
    - [21, 4.258]
  - - [64, 29, 1088, 29, 64, 64, 64, 29]
    - [21, 4.531]
  - - [64, 32, 992, 32, 64, 64, 64, 32]
    - [9, 4.875]
  - - [64, 35, 904, 35, 64, 64, 64, 35]
    - [21, 5.826]
  - - [64, 38, 840, 38, 64, 64, 64, 38]
    - [21, 6.751]
  - - [64, 41, 776, 41, 64, 64, 64, 41]
    - [21, 7.161]
  - - [64, 45, 712, 45, 64, 64, 64, 45]
    - [9, 8.114]
  - - [64, 49, 648, 49, 64, 64, 64, 49]
    - [9, 8.122]
  - - [64, 54, 592, 54, 64, 64, 64, 54]
    - [9, 9.503]
  - - [64, 59, 544, 59, 64, 64, 64, 59]
    - [25, 9.785]
  - - [64, 64, 496, 64, 64, 64, 64, 64]
    - [13, 9.392]
  - - [64, 64, 496, 65, 64, 64, 64, 64]
    - [25, 10.118]
  - - [64, 65, 496, 65, 64, 64, 64, 65]
    - [12, 10.276]
  - - [64, 71, 448, 71, 64, 64, 64, 71]
    - [19, 12.852]
  - - [64, 77, 408, 77, 64, 64, 64, 77]
    - [18, 13.173]
  - - [64, 77, 408, 78, 64, 64, 64, 77]
    - [11, 13.526]
  - - [64, 78, 408, 78, 64, 64, 64, 78]
    - [19, 13.302]
  - - [64, 85, 376, 85, 64, 64, 64, 85]
    - [9, 13.79]
  - - [64, 93, 344, 93, 64, 64, 64, 93]
    - [12, 16.885]
  - - [64, 102, 312, 102, 64, 64, 64, 102]
    - [12, 17.677]
  - - [64, 112, 288, 112, 64, 64, 64, 112]
    - [17, 18.431]
  - - [64, 122, 264, 122, 64, 64, 64, 122]
    - [10, 18.635]
  - - [64, 123, 264, 122, 64, 64, 64, 123]
    - [12, 18.832]
  - - [64, 123, 264, 123, 64, 64, 64, 123]
    - [6, 19.076]
  - - [64, 134, 240, 134, 64, 64, 64, 134]
    - [14, 17.951]
  - - [64, 135, 240, 134, 64, 64, 64, 135]
    - [16, 17.864]
  - - [64, 135, 240, 135, 64, 64, 64, 135]
    - [15, 17.674]
- null
