test_dir/py38/lib/python3.6/site-packages/Tensile/Configs/miopen/archives/transformer/2020-01-19/exact/arcturus_Cijk_Alik_Bljk_SB.yaml
- {MinimumRequiredVersion: 4.15.0}
- arcturus
- gfx908
- [Device 7380, Device 7388, Device 738c, Device 7390, Device 731f]
    SolutionIndex: 0
    SolutionNameMin: Cijk_Alik_Bljk_SB_MT64x128x16_SE_EPS0_FL0_GRVW1_PGR0_PLR1_TT4_8_VW2_WGM1
    SolutionIndex: 1
    SolutionNameMin: Cijk_Alik_Bljk_SB_MT64x128x16_SE_EPS0_FL0_GRVW1_PGR0_PLR1_TT4_8_VW2_WGM8
    SolutionIndex: 2
    SolutionNameMin: Cijk_Alik_Bljk_SB_MT64x128x8_SE_EPS0_FL0_GRVW1_PGR0_PLR1_TT4_8_VW4_WGM1
    SolutionIndex: 3
    SolutionNameMin: Cijk_Alik_Bljk_SB_MT64x128x8_SE_EPS0_FL0_GRVW2_PGR0_PLR1_TT4_8_VW2_WGM1
    SolutionIndex: 4
    SolutionNameMin: Cijk_Alik_Bljk_SB_MT64x128x8_SE_EPS1_FL0_GRVW2_PGR1_PLR1_TT4_8_VW4_WGM8
    SolutionIndex: 5
    SolutionNameMin: Cijk_Alik_Bljk_SB_MT64x128x8_SE_EPS1_FL0_GRVW2_PGR1_PLR0_TT4_8_VW4_WGM8
    SolutionIndex: 6
    SolutionNameMin: Cijk_Alik_Bljk_SB_MT64x128x8_SE_EPS1_FL0_GRVW4_PGR1_PLR0_TT4_8_VW2_WGM1
    SolutionIndex: 7
    SolutionNameMin: Cijk_Alik_Bljk_SB_MT64x128x8_SE_EPS1_FL0_GRVW4_PGR1_PLR1_TT4_8_VW2_WGM1
    SolutionIndex: 8
    SolutionNameMin: Cijk_Alik_Bljk_SB_MT64x128x8_SE_EPS1_FL0_GRVW4_PGR1_PLR1_TT4_8_VW2_WGM8
    SolutionIndex: 9
    SolutionNameMin: Cijk_Alik_Bljk_SB_MT64x128x8_SE_EPS1_FL0_GRVW4_PGR1_PLR1_TT4_8_VW2_WGM1
    SolutionIndex: 10
    SolutionNameMin: Cijk_Alik_Bljk_SB_MT64x128x8_SE_EPS1_FL0_GRVW4_PGR1_PLR0_TT4_8_VW2_WGM1
    SolutionIndex: 11
    SolutionNameMin: Cijk_Alik_Bljk_SB_MT64x128x16_SE_EPS0_FL0_GRVW4_PGR0_PLR0_TT4_8_VW2_WGM1
    SolutionIndex: 12
    SolutionNameMin: Cijk_Alik_Bljk_SB_MT64x128x8_SE_EPS1_FL0_GRVW4_PGR1_PLR1_TT4_8_VW2_WGM1
    SolutionIndex: 13
    SolutionNameMin: Cijk_Alik_Bljk_SB_MT64x128x16_SE_EPS0_FL0_GRVW4_PGR0_PLR1_TT4_8_VW2_WGM1
    SolutionIndex: 14
    SolutionNameMin: Cijk_Alik_Bljk_SB_MT64x128x8_SE_EPS1_FL0_GRVW4_PGR1_PLR1_TT4_8_VW2_WGM1
    SolutionIndex: 15
    SolutionNameMin: Cijk_Alik_Bljk_SB_MT64x128x16_SE_EPS0_FL0_GRVW4_PGR0_PLR1_TT4_8_VW2_WGM1
    SolutionIndex: 16
    SolutionNameMin: Cijk_Alik_Bljk_SB_MT64x128x16_SE_EPS0_FL0_GRVW4_PGR0_PLR1_TT4_8_VW2_WGM8
    SolutionIndex: 17
    SolutionNameMin: Cijk_Alik_Bljk_SB_MT64x128x8_SE_EPS1_FL0_GRVW4_PGR1_PLR0_TT4_8_VW4_WGM8
    SolutionIndex: 18
    SolutionNameMin: Cijk_Alik_Bljk_SB_MT64x128x16_SE_EPS1_FL0_GRVW4_PGR1_PLR0_TT4_8_VW4_WGM1
    SolutionIndex: 19
    SolutionNameMin: Cijk_Alik_Bljk_SB_MT64x128x8_SE_EPS1_FL0_GRVW4_PGR1_PLR0_TT4_8_VW4_WGM1
    SolutionIndex: 20
    SolutionNameMin: Cijk_Alik_Bljk_SB_MT64x128x8_SE_EPS0_FL0_GRVW4_PGR0_PLR1_TT4_8_VW4_WGM1
    SolutionIndex: 21
    SolutionNameMin: Cijk_Alik_Bljk_SB_MT64x128x8_SE_EPS1_FL0_GRVW4_PGR1_PLR1_TT4_8_VW4_WGM1
    SolutionIndex: 22
    SolutionNameMin: Cijk_Alik_Bljk_SB_MT64x128x8_SE_EPS1_FL0_GRVW4_PGR1_PLR1_TT4_8_VW4_WGM8
    SolutionIndex: 23
    SolutionNameMin: Cijk_Alik_Bljk_SB_MT64x128x16_SE_EPS1_FL0_GRVW4_PGR1_PLR1_TT4_8_VW4_WGM1
    SolutionIndex: 24
    SolutionNameMin: Cijk_Alik_Bljk_SB_MT64x128x8_SE_EPS0_FL0_GRVW4_PGR0_PLR1_TT4_8_VW4_WGM1
    SolutionIndex: 25
    SolutionNameMin: Cijk_Alik_Bljk_SB_MT64x128x8_SE_EPS1_FL0_GRVW4_PGR1_PLR0_TT4_8_VW4_WGM1
    SolutionIndex: 26
    SolutionNameMin: Cijk_Alik_Bljk_SB_MT64x128x16_SE_EPS0_FL0_GRVW4_PGR0_PLR1_TT4_8_VW4_WGM1
    SolutionIndex: 27
    SolutionNameMin: Cijk_Alik_Bljk_SB_MT64x128x16_SE_EPS0_FL0_GRVW4_PGR0_PLR1_TT4_8_VW4_WGM1
    SolutionIndex: 28
    SolutionNameMin: Cijk_Alik_Bljk_SB_MT64x128x16_SE_EPS0_FL0_GRVW4_PGR0_PLR1_TT4_8_VW4_WGM8
    SolutionIndex: 29
    SolutionNameMin: Cijk_Alik_Bljk_SB_MT64x128x8_SE_EPS1_FL1_GRVW2_PGR1_PLR1_TT4_8_VW2_WGM8
    SolutionIndex: 30
    SolutionNameMin: Cijk_Alik_Bljk_SB_MT64x128x8_SE_EPS1_FL1_GRVW2_PGR1_PLR1_TT4_8_VW4_WGM8
    SolutionIndex: 31
    SolutionNameMin: Cijk_Alik_Bljk_SB_MT64x128x8_SE_EPS1_FL1_GRVW4_PGR1_PLR0_TT4_8_VW2_WGM8
    SolutionIndex: 32
    SolutionNameMin: Cijk_Alik_Bljk_SB_MT64x128x8_SE_EPS1_FL1_GRVW4_PGR1_PLR1_TT4_8_VW2_WGM1
    SolutionIndex: 33
    SolutionNameMin: Cijk_Alik_Bljk_SB_MT64x128x8_SE_EPS1_FL1_GRVW4_PGR1_PLR1_TT4_8_VW2_WGM8
    SolutionIndex: 34
    SolutionNameMin: Cijk_Alik_Bljk_SB_MT64x128x8_SE_EPS1_FL1_GRVW4_PGR1_PLR1_TT4_8_VW2_WGM1
    SolutionIndex: 35
    SolutionNameMin: Cijk_Alik_Bljk_SB_MT64x128x16_SE_EPS0_FL1_GRVW4_PGR0_PLR1_TT4_8_VW2_WGM1
    SolutionIndex: 36
    SolutionNameMin: Cijk_Alik_Bljk_SB_MT64x128x8_SE_EPS1_FL1_GRVW4_PGR1_PLR0_TT4_8_VW2_WGM1
    SolutionIndex: 37
    SolutionNameMin: Cijk_Alik_Bljk_SB_MT64x128x8_SE_EPS1_FL1_GRVW4_PGR1_PLR1_TT4_8_VW2_WGM1
    SolutionIndex: 38
    SolutionNameMin: Cijk_Alik_Bljk_SB_MT64x128x8_SE_EPS0_FL1_GRVW4_PGR0_PLR1_TT4_8_VW2_WGM1
    SolutionIndex: 39
    SolutionNameMin: Cijk_Alik_Bljk_SB_MT64x128x16_SE_EPS0_FL1_GRVW4_PGR0_PLR1_TT4_8_VW2_WGM1
    SolutionIndex: 40
    SolutionNameMin: Cijk_Alik_Bljk_SB_MT64x128x16_SE_EPS0_FL1_GRVW4_PGR0_PLR1_TT4_8_VW2_WGM8
    SolutionIndex: 41
    SolutionNameMin: Cijk_Alik_Bljk_SB_MT64x128x8_SE_EPS1_FL1_GRVW4_PGR1_PLR0_TT4_8_VW4_WGM8
    SolutionIndex: 42
    SolutionNameMin: Cijk_Alik_Bljk_SB_MT64x128x8_SE_EPS1_FL1_GRVW4_PGR1_PLR0_TT4_8_VW4_WGM1
    SolutionIndex: 43
    SolutionNameMin: Cijk_Alik_Bljk_SB_MT64x128x8_SE_EPS1_FL1_GRVW4_PGR1_PLR1_TT4_8_VW4_WGM1
    SolutionIndex: 44
    SolutionNameMin: Cijk_Alik_Bljk_SB_MT64x128x8_SE_EPS1_FL1_GRVW4_PGR1_PLR1_TT4_8_VW4_WGM8
    SolutionIndex: 45
    SolutionNameMin: Cijk_Alik_Bljk_SB_MT64x128x16_SE_EPS1_FL1_GRVW4_PGR1_PLR1_TT4_8_VW4_WGM1
    SolutionIndex: 46
    SolutionNameMin: Cijk_Alik_Bljk_SB_MT64x128x8_SE_EPS0_FL1_GRVW4_PGR0_PLR1_TT4_8_VW4_WGM1
    SolutionIndex: 47
    SolutionNameMin: Cijk_Alik_Bljk_SB_MT64x128x8_SE_EPS1_FL1_GRVW4_PGR1_PLR0_TT4_8_VW4_WGM1
    SolutionIndex: 48
    SolutionNameMin: Cijk_Alik_Bljk_SB_MT64x128x16_SE_EPS0_FL1_GRVW4_PGR0_PLR1_TT4_8_VW4_WGM1
    SolutionIndex: 49
    SolutionNameMin: Cijk_Alik_Bljk_SB_MT64x128x16_SE_EPS0_FL1_GRVW4_PGR0_PLR1_TT4_8_VW4_WGM8
    SolutionIndex: 50
    SolutionNameMin: Cijk_Alik_Bljk_SB_MT128x64x16_SE_EPS0_FL0_GRVW1_PGR0_PLR1_TT8_4_VW2_WGM1
    SolutionIndex: 51
    SolutionNameMin: Cijk_Alik_Bljk_SB_MT128x64x8_SE_EPS0_FL0_GRVW1_PGR0_PLR1_TT8_4_VW4_WGM1
    SolutionIndex: 52
    SolutionNameMin: Cijk_Alik_Bljk_SB_MT128x64x8_SE_EPS1_FL0_GRVW2_PGR1_PLR0_TT8_4_VW2_WGM8
    SolutionIndex: 53
    SolutionNameMin: Cijk_Alik_Bljk_SB_MT128x64x8_SE_EPS1_FL0_GRVW2_PGR1_PLR0_TT8_4_VW4_WGM8
    SolutionIndex: 54
    SolutionNameMin: Cijk_Alik_Bljk_SB_MT128x64x8_SE_EPS1_FL0_GRVW2_PGR1_PLR1_TT8_4_VW4_WGM8
    SolutionIndex: 55
    SolutionNameMin: Cijk_Alik_Bljk_SB_MT128x64x8_SE_EPS0_FL0_GRVW2_PGR0_PLR1_TT8_4_VW4_WGM8
    SolutionIndex: 56
    SolutionNameMin: Cijk_Alik_Bljk_SB_MT128x64x8_SE_EPS1_FL0_GRVW4_PGR1_PLR0_TT8_4_VW2_WGM8
    SolutionIndex: 57
    SolutionNameMin: Cijk_Alik_Bljk_SB_MT128x64x8_SE_EPS0_FL0_GRVW4_PGR0_PLR1_TT8_4_VW2_WGM1
    SolutionIndex: 58
    SolutionNameMin: Cijk_Alik_Bljk_SB_MT128x64x8_SE_EPS1_FL0_GRVW4_PGR1_PLR1_TT8_4_VW2_WGM1
    SolutionIndex: 59
    SolutionNameMin: Cijk_Alik_Bljk_SB_MT128x64x8_SE_EPS1_FL0_GRVW4_PGR1_PLR1_TT8_4_VW2_WGM8
    SolutionIndex: 60
    SolutionNameMin: Cijk_Alik_Bljk_SB_MT128x64x16_SE_EPS1_FL0_GRVW4_PGR1_PLR1_TT8_4_VW2_WGM8
    SolutionIndex: 61
    SolutionNameMin: Cijk_Alik_Bljk_SB_MT128x64x16_SE_EPS0_FL0_GRVW4_PGR0_PLR1_TT8_4_VW2_WGM1
    SolutionIndex: 62
    SolutionNameMin: Cijk_Alik_Bljk_SB_MT128x64x16_SE_EPS0_FL0_GRVW4_PGR0_PLR1_TT8_4_VW2_WGM8
    SolutionIndex: 63
    SolutionNameMin: Cijk_Alik_Bljk_SB_MT128x64x8_SE_EPS1_FL0_GRVW4_PGR1_PLR0_TT8_4_VW2_WGM8
    SolutionIndex: 64
    SolutionNameMin: Cijk_Alik_Bljk_SB_MT128x64x8_SE_EPS1_FL0_GRVW4_PGR1_PLR1_TT8_4_VW2_WGM1
    SolutionIndex: 65
    SolutionNameMin: Cijk_Alik_Bljk_SB_MT128x64x16_SE_EPS0_FL0_GRVW4_PGR0_PLR1_TT8_4_VW2_WGM1
    SolutionIndex: 66
    SolutionNameMin: Cijk_Alik_Bljk_SB_MT128x64x16_SE_EPS0_FL0_GRVW4_PGR0_PLR1_TT8_4_VW2_WGM8
    SolutionIndex: 67
    SolutionNameMin: Cijk_Alik_Bljk_SB_MT128x64x8_SE_EPS1_FL0_GRVW4_PGR1_PLR0_TT8_4_VW4_WGM8
    SolutionIndex: 68
    SolutionNameMin: Cijk_Alik_Bljk_SB_MT128x64x16_SE_EPS1_FL0_GRVW4_PGR1_PLR0_TT8_4_VW4_WGM1
    SolutionIndex: 69
    SolutionNameMin: Cijk_Alik_Bljk_SB_MT128x64x8_SE_EPS1_FL0_GRVW4_PGR1_PLR1_TT8_4_VW4_WGM8
    SolutionIndex: 70
    SolutionNameMin: Cijk_Alik_Bljk_SB_MT128x64x16_SE_EPS1_FL0_GRVW4_PGR1_PLR1_TT8_4_VW4_WGM1
    SolutionIndex: 71
    SolutionNameMin: Cijk_Alik_Bljk_SB_MT128x64x16_SE_EPS1_FL0_GRVW4_PGR1_PLR1_TT8_4_VW4_WGM8
    SolutionIndex: 72
    SolutionNameMin: Cijk_Alik_Bljk_SB_MT128x64x8_SE_EPS0_FL0_GRVW4_PGR0_PLR1_TT8_4_VW4_WGM1
    SolutionIndex: 73
    SolutionNameMin: Cijk_Alik_Bljk_SB_MT128x64x16_SE_EPS0_FL0_GRVW4_PGR0_PLR1_TT8_4_VW4_WGM1
    SolutionIndex: 74
    SolutionNameMin: Cijk_Alik_Bljk_SB_MT128x64x8_SE_EPS1_FL1_GRVW2_PGR1_PLR0_TT8_4_VW2_WGM8
    SolutionIndex: 75
    SolutionNameMin: Cijk_Alik_Bljk_SB_MT128x64x8_SE_EPS0_FL1_GRVW2_PGR0_PLR1_TT8_4_VW2_WGM1
    SolutionIndex: 76
    SolutionNameMin: Cijk_Alik_Bljk_SB_MT128x64x16_SE_EPS0_FL1_GRVW2_PGR0_PLR1_TT8_4_VW2_WGM8
    SolutionIndex: 77
    SolutionNameMin: Cijk_Alik_Bljk_SB_MT128x64x8_SE_EPS1_FL1_GRVW2_PGR1_PLR0_TT8_4_VW4_WGM8
    SolutionIndex: 78
    SolutionNameMin: Cijk_Alik_Bljk_SB_MT128x64x8_SE_EPS1_FL1_GRVW2_PGR1_PLR1_TT8_4_VW4_WGM8
    SolutionIndex: 79
    SolutionNameMin: Cijk_Alik_Bljk_SB_MT128x64x8_SE_EPS1_FL1_GRVW2_PGR1_PLR0_TT8_4_VW4_WGM8
    SolutionIndex: 80
    SolutionNameMin: Cijk_Alik_Bljk_SB_MT128x64x8_SE_EPS1_FL1_GRVW4_PGR1_PLR0_TT8_4_VW2_WGM8
    SolutionIndex: 81
    SolutionNameMin: Cijk_Alik_Bljk_SB_MT128x64x8_SE_EPS1_FL1_GRVW4_PGR1_PLR1_TT8_4_VW2_WGM1
    SolutionIndex: 82
    SolutionNameMin: Cijk_Alik_Bljk_SB_MT128x64x8_SE_EPS1_FL1_GRVW4_PGR1_PLR1_TT8_4_VW2_WGM8
    SolutionIndex: 83
    SolutionNameMin: Cijk_Alik_Bljk_SB_MT128x64x16_SE_EPS0_FL1_GRVW4_PGR0_PLR1_TT8_4_VW2_WGM1
    SolutionIndex: 84
    SolutionNameMin: Cijk_Alik_Bljk_SB_MT128x64x16_SE_EPS1_FL1_GRVW4_PGR1_PLR1_TT8_4_VW2_WGM8
    SolutionIndex: 85
    SolutionNameMin: Cijk_Alik_Bljk_SB_MT128x64x16_SE_EPS0_FL1_GRVW4_PGR0_PLR1_TT8_4_VW2_WGM1
    SolutionIndex: 86
    SolutionNameMin: Cijk_Alik_Bljk_SB_MT128x64x8_SE_EPS1_FL1_GRVW4_PGR1_PLR1_TT8_4_VW2_WGM1
    SolutionIndex: 87
    SolutionNameMin: Cijk_Alik_Bljk_SB_MT128x64x8_SE_EPS1_FL1_GRVW4_PGR1_PLR1_TT8_4_VW2_WGM8
    SolutionIndex: 88
    SolutionNameMin: Cijk_Alik_Bljk_SB_MT128x64x8_SE_EPS0_FL1_GRVW4_PGR0_PLR1_TT8_4_VW2_WGM1
    SolutionIndex: 89
    SolutionNameMin: Cijk_Alik_Bljk_SB_MT128x64x8_SE_EPS1_FL1_GRVW4_PGR1_PLR1_TT8_4_VW2_WGM1
    SolutionIndex: 90
    SolutionNameMin: Cijk_Alik_Bljk_SB_MT128x64x16_SE_EPS0_FL1_GRVW4_PGR0_PLR1_TT8_4_VW2_WGM8
    SolutionIndex: 91
    SolutionNameMin: Cijk_Alik_Bljk_SB_MT128x64x8_SE_EPS1_FL1_GRVW4_PGR1_PLR0_TT8_4_VW4_WGM8
    SolutionIndex: 92
    SolutionNameMin: Cijk_Alik_Bljk_SB_MT128x64x16_SE_EPS1_FL1_GRVW4_PGR1_PLR0_TT8_4_VW4_WGM8
    SolutionIndex: 93
    SolutionNameMin: Cijk_Alik_Bljk_SB_MT128x64x8_SE_EPS1_FL1_GRVW4_PGR1_PLR1_TT8_4_VW4_WGM8
    SolutionIndex: 94
    SolutionNameMin: Cijk_Alik_Bljk_SB_MT128x64x16_SE_EPS1_FL1_GRVW4_PGR1_PLR1_TT8_4_VW4_WGM1
    SolutionIndex: 95
    SolutionNameMin: Cijk_Alik_Bljk_SB_MT128x64x16_SE_EPS1_FL1_GRVW4_PGR1_PLR1_TT8_4_VW4_WGM8
    SolutionIndex: 96
    SolutionNameMin: Cijk_Alik_Bljk_SB_MT128x64x16_SE_EPS0_FL1_GRVW4_PGR0_PLR1_TT8_4_VW4_WGM1
    SolutionIndex: 97
    SolutionNameMin: Cijk_Alik_Bljk_SB_MT128x64x8_SE_EPS1_FL1_GRVW4_PGR1_PLR0_TT8_4_VW4_WGM1
    SolutionIndex: 98
    SolutionNameMin: Cijk_Alik_Bljk_SB_MT128x64x16_SE_EPS0_FL1_GRVW4_PGR0_PLR1_TT8_4_VW4_WGM1
    SolutionIndex: 99
    SolutionNameMin: Cijk_Alik_Bljk_SB_MT128x128x8_SE_EPS1_FL0_GRVW2_PGR1_PLR1_TT8_8_VW4_WGM8
    SolutionIndex: 100
    SolutionNameMin: Cijk_Alik_Bljk_SB_MT128x128x16_SE_EPS1_FL0_GRVW2_PGR1_PLR1_TT8_8_VW4_WGM1
    SolutionIndex: 101
    SolutionNameMin: Cijk_Alik_Bljk_SB_MT128x128x16_SE_EPS1_FL0_GRVW4_PGR1_PLR1_TT8_8_VW2_WGM1
    SolutionIndex: 102
    SolutionNameMin: Cijk_Alik_Bljk_SB_MT128x128x8_SE_EPS1_FL0_GRVW4_PGR1_PLR1_TT8_8_VW4_WGM8
    SolutionIndex: 103
    SolutionNameMin: Cijk_Alik_Bljk_SB_MT128x128x16_SE_EPS1_FL0_GRVW4_PGR1_PLR1_TT8_8_VW4_WGM1
    SolutionIndex: 104
    SolutionNameMin: Cijk_Alik_Bljk_SB_MT128x128x16_SE_EPS1_FL0_GRVW4_PGR1_PLR1_TT8_8_VW4_WGM8
    SolutionIndex: 105
    SolutionNameMin: Cijk_Alik_Bljk_SB_MT128x128x32_SE_EPS1_FL0_GRVW4_PGR1_PLR1_TT8_8_VW4_WGM8
    SolutionIndex: 106
    SolutionNameMin: Cijk_Alik_Bljk_SB_MT128x128x16_SE_EPS1_FL1_GRVW2_PGR1_PLR1_TT8_8_VW4_WGM1
    SolutionIndex: 107
    SolutionNameMin: Cijk_Alik_Bljk_SB_MT128x128x8_SE_EPS1_FL1_GRVW4_PGR1_PLR1_TT8_8_VW2_WGM8
    SolutionIndex: 108
    SolutionNameMin: Cijk_Alik_Bljk_SB_MT128x128x8_SE_EPS1_FL1_GRVW4_PGR1_PLR0_TT8_8_VW4_WGM8
    SolutionIndex: 109
    SolutionNameMin: Cijk_Alik_Bljk_SB_MT128x128x8_SE_EPS1_FL1_GRVW4_PGR1_PLR1_TT8_8_VW4_WGM8
    SolutionIndex: 110
    SolutionNameMin: Cijk_Alik_Bljk_SB_MT128x128x16_SE_EPS1_FL1_GRVW4_PGR1_PLR1_TT8_8_VW4_WGM1
    SolutionIndex: 111
    SolutionNameMin: Cijk_Alik_Bljk_SB_MT128x128x16_SE_EPS1_FL1_GRVW4_PGR1_PLR1_TT8_8_VW4_WGM8
    SolutionIndex: 112
    SolutionNameMin: Cijk_Alik_Bljk_SB_MT128x128x32_SE_EPS1_FL1_GRVW4_PGR1_PLR1_TT8_8_VW4_WGM8
- - - [7, 7, 736, 64, 7, 7, 64, 64]
    - [48, 0.169]
  - - [8, 8, 264, 64, 8, 8, 64, 64]
    - [24, 0.16]
  - - [9, 9, 416, 64, 9, 9, 64, 64]
    - [80, 0.258]
  - - [10, 10, 448, 64, 10, 10, 64, 64]
    - [49, 0.339]
  - - [11, 11, 568, 64, 11, 11, 64, 64]
    - [43, 0.423]
  - - [12, 12, 480, 64, 12, 12, 64, 64]
    - [36, 0.527]
  - - [12, 12, 2520, 64, 12, 12, 64, 64]
    - [47, 0.67]
  - - [13, 13, 576, 64, 13, 13, 64, 64]
    - [21, 0.6]
  - - [13, 13, 2336, 64, 13, 13, 64, 64]
    - [47, 0.766]
  - - [14, 14, 704, 64, 14, 14, 64, 64]
    - [19, 0.751]
  - - [14, 14, 2184, 64, 14, 14, 64, 64]
    - [25, 0.875]
  - - [15, 15, 688, 64, 15, 15, 64, 64]
    - [96, 0.841]
  - - [15, 15, 2048, 64, 15, 15, 64, 64]
    - [42, 0.999]
  - - [16, 16, 712, 64, 16, 16, 64, 64]
    - [79, 0.99]
  - - [16, 16, 1920, 64, 16, 16, 64, 64]
    - [48, 1.159]
  - - [17, 17, 688, 64, 17, 17, 64, 64]
    - [5, 1.077]
  - - [17, 17, 1816, 64, 17, 17, 64, 64]
    - [73, 1.259]
  - - [18, 18, 648, 64, 18, 18, 64, 64]
    - [49, 1.15]
  - - [18, 18, 1720, 64, 18, 18, 64, 64]
    - [49, 1.402]
  - - [19, 19, 680, 64, 19, 19, 64, 64]
    - [5, 1.333]
  - - [19, 19, 1632, 64, 19, 19, 64, 64]
    - [48, 1.572]
  - - [21, 21, 1472, 64, 21, 21, 64, 64]
    - [97, 1.845]
  - - [21, 21, 1488, 64, 21, 21, 64, 64]
    - [27, 1.87]
  - - [23, 23, 64, 64, 23, 23, 64, 64]
    - [2, 0.433]
  - - [23, 23, 1360, 64, 23, 23, 64, 64]
    - [27, 2.189]
  - - [25, 25, 176, 64, 25, 25, 64, 64]
    - [72, 1.208]
  - - [25, 25, 1256, 64, 25, 25, 64, 64]
    - [48, 2.554]
  - - [26, 26, 56, 64, 26, 26, 64, 64]
    - [46, 0.49]
  - - [26, 27, 56, 64, 26, 26, 64, 64]
    - [55, 0.506]
  - - [27, 27, 56, 64, 27, 27, 64, 64]
    - [20, 0.529]
  - - [27, 27, 1168, 64, 27, 27, 64, 64]
    - [28, 2.987]
  - - [29, 29, 136, 64, 29, 29, 64, 64]
    - [51, 1.277]
  - - [29, 29, 1088, 64, 29, 29, 64, 64]
    - [26, 3.243]
  - - [32, 32, 624, 64, 32, 32, 64, 64]
    - [37, 3.388]
  - - [32, 32, 992, 64, 32, 32, 64, 64]
    - [39, 3.843]
  - - [35, 35, 384, 64, 35, 35, 64, 64]
    - [10, 3.494]
  - - [35, 35, 904, 64, 35, 35, 64, 64]
    - [16, 4.585]
  - - [38, 38, 320, 64, 38, 38, 64, 64]
    - [9, 4.224]
  - - [38, 38, 840, 64, 38, 38, 64, 64]
    - [6, 5.41]
  - - [41, 41, 312, 64, 41, 41, 64, 64]
    - [34, 4.73]
  - - [41, 41, 776, 64, 41, 41, 64, 64]
    - [31, 5.843]
  - - [45, 45, 392, 64, 45, 45, 64, 64]
    - [76, 5.687]
  - - [45, 45, 712, 64, 45, 45, 64, 64]
    - [86, 7.139]
  - - [49, 49, 160, 64, 49, 49, 64, 64]
    - [64, 3.98]
  - - [49, 49, 648, 64, 49, 49, 64, 64]
    - [14, 7.592]
  - - [54, 54, 200, 64, 54, 54, 64, 64]
    - [58, 5.776]
  - - [54, 54, 592, 64, 54, 54, 64, 64]
    - [12, 8.874]
  - - [59, 59, 512, 64, 59, 59, 64, 64]
    - [87, 9.047]
  - - [59, 59, 544, 64, 59, 59, 64, 64]
    - [34, 9.446]
  - - [64, 64, 496, 64, 64, 64, 64, 64]
    - [9, 10.185]
  - - [64, 65, 496, 64, 64, 64, 64, 64]
    - [35, 10.318]
  - - [65, 65, 472, 64, 65, 65, 64, 64]
    - [65, 7.339]
  - - [65, 65, 496, 64, 65, 65, 64, 64]
    - [62, 7.274]
  - - [70, 70, 216, 64, 70, 70, 64, 64]
    - [66, 6.853]
  - - [70, 71, 216, 64, 70, 70, 64, 64]
    - [66, 6.907]
  - - [71, 71, 216, 64, 71, 71, 64, 64]
    - [40, 6.961]
  - - [71, 71, 448, 64, 71, 71, 64, 64]
    - [11, 8.387]
  - - [77, 77, 248, 64, 77, 77, 64, 64]
    - [0, 7.521]
  - - [77, 77, 408, 64, 77, 77, 64, 64]
    - [11, 9.602]
  - - [77, 78, 248, 64, 77, 77, 64, 64]
    - [83, 7.638]
  - - [77, 78, 408, 64, 77, 77, 64, 64]
    - [15, 9.669]
  - - [78, 78, 248, 64, 78, 78, 64, 64]
    - [0, 7.717]
  - - [78, 78, 408, 64, 78, 78, 64, 64]
    - [90, 9.891]
  - - [80, 80, 152, 64, 80, 80, 64, 64]
    - [7, 8.155]
  - - [80, 84, 152, 64, 80, 80, 64, 64]
    - [81, 8.563]
  - - [84, 84, 152, 64, 84, 84, 64, 64]
    - [32, 8.431]
  - - [85, 85, 376, 64, 85, 85, 64, 64]
    - [61, 10.636]
  - - [91, 91, 40, 64, 91, 91, 64, 64]
    - [13, 3.846]
  - - [91, 93, 40, 64, 91, 91, 64, 64]
    - [0, 3.931]
  - - [93, 93, 40, 64, 93, 93, 64, 64]
    - [88, 3.994]
  - - [93, 93, 344, 64, 93, 93, 64, 64]
    - [63, 12.119]
  - - [102, 102, 56, 64, 102, 102, 64, 64]
    - [13, 6.131]
  - - [102, 102, 312, 64, 102, 102, 64, 64]
    - [6, 13.195]
  - - [103, 103, 16, 64, 103, 103, 64, 64]
    - [57, 2.029]
  - - [103, 104, 16, 64, 103, 103, 64, 64]
    - [75, 2.037]
  - - [104, 104, 16, 64, 104, 104, 64, 64]
    - [50, 2.081]
  - - [112, 112, 16, 64, 112, 112, 64, 64]
    - [1, 2.371]
  - - [112, 112, 288, 64, 112, 112, 64, 64]
    - [86, 16.934]
  - - [112, 123, 16, 64, 112, 112, 64, 64]
    - [3, 2.604]
  - - [119, 119, 32, 64, 119, 119, 64, 64]
    - [38, 5.262]
  - - [119, 135, 32, 64, 119, 119, 64, 64]
    - [85, 5.707]
  - - [122, 122, 264, 64, 122, 122, 64, 64]
    - [89, 16.678]
  - - [123, 122, 264, 64, 123, 123, 64, 64]
    - [34, 16.779]
  - - [123, 123, 16, 64, 123, 123, 64, 64]
    - [88, 2.86]
  - - [123, 123, 264, 64, 123, 123, 64, 64]
    - [82, 16.846]
  - - [134, 134, 240, 64, 134, 134, 64, 64]
    - [15, 12.747]
  - - [135, 134, 240, 64, 135, 135, 64, 64]
    - [98, 12.805]
  - - [135, 135, 32, 64, 135, 135, 64, 64]
    - [4, 6.301]
  - - [135, 135, 240, 64, 135, 135, 64, 64]
    - [0, 12.882]
  - - [512, 2790, 1, 2048, 512, 512, 2048, 2048]
    - [95, 24.444]
  - - [512, 2864, 1, 2048, 512, 512, 2048, 2048]
    - [23, 24.471]
  - - [512, 3092, 1, 2048, 512, 512, 2048, 2048]
    - [45, 25.352]
  - - [512, 3113, 1, 2048, 512, 512, 2048, 2048]
    - [45, 26.2]
  - - [512, 3137, 1, 2048, 512, 512, 2048, 2048]
    - [94, 25.532]
  - - [512, 3165, 1, 2048, 512, 512, 2048, 2048]
    - [94, 25.74]
  - - [512, 3166, 1, 2048, 512, 512, 2048, 2048]
    - [71, 25.705]
  - - [512, 3194, 1, 2048, 512, 512, 2048, 2048]
    - [95, 25.83]
  - - [512, 3219, 1, 2048, 512, 512, 2048, 2048]
    - [45, 25.718]
  - - [512, 3222, 1, 2048, 512, 512, 2048, 2048]
    - [111, 25.974]
  - - [512, 3234, 1, 2048, 512, 512, 2048, 2048]
    - [94, 26.014]
  - - [512, 3237, 1, 2048, 512, 512, 2048, 2048]
    - [95, 26.262]
  - - [512, 3242, 1, 2048, 512, 512, 2048, 2048]
    - [106, 26.047]
  - - [512, 3246, 1, 2048, 512, 512, 2048, 2048]
    - [23, 26.181]
  - - [512, 3249, 1, 2048, 512, 512, 2048, 2048]
    - [23, 25.971]
  - - [512, 3251, 1, 2048, 512, 512, 2048, 2048]
    - [70, 25.955]
  - - [512, 3257, 1, 2048, 512, 512, 2048, 2048]
    - [70, 26.237]
  - - [512, 3262, 1, 2048, 512, 512, 2048, 2048]
    - [23, 26.031]
  - - [512, 3268, 1, 2048, 512, 512, 2048, 2048]
    - [71, 26.116]
  - - [512, 3282, 1, 2048, 512, 512, 2048, 2048]
    - [95, 25.99]
  - - [512, 3286, 1, 2048, 512, 512, 2048, 2048]
    - [71, 26.178]
  - - [512, 3287, 1, 2048, 512, 512, 2048, 2048]
    - [71, 26.192]
  - - [512, 3293, 1, 2048, 512, 512, 2048, 2048]
    - [45, 26.158]
  - - [512, 3297, 1, 2048, 512, 512, 2048, 2048]
    - [95, 25.818]
  - - [512, 3307, 1, 2048, 512, 512, 2048, 2048]
    - [45, 26.1]
  - - [512, 3314, 1, 2048, 512, 512, 2048, 2048]
    - [95, 25.811]
  - - [512, 3315, 1, 2048, 512, 512, 2048, 2048]
    - [71, 26.498]
  - - [512, 3319, 1, 2048, 512, 512, 2048, 2048]
    - [70, 26.479]
  - - [512, 3322, 1, 2048, 512, 512, 2048, 2048]
    - [18, 25.928]
  - - [512, 3323, 1, 2048, 512, 512, 2048, 2048]
    - [95, 26.321]
  - - [512, 3324, 1, 2048, 512, 512, 2048, 2048]
    - [71, 26.481]
  - - [512, 3325, 1, 2048, 512, 512, 2048, 2048]
    - [71, 26.444]
  - - [512, 3327, 1, 2048, 512, 512, 2048, 2048]
    - [110, 27.051]
  - - [512, 3329, 1, 2048, 512, 512, 2048, 2048]
    - [104, 26.883]
  - - [512, 3332, 1, 2048, 512, 512, 2048, 2048]
    - [100, 26.322]
  - - [512, 3336, 1, 2048, 512, 512, 2048, 2048]
    - [100, 26.615]
  - - [512, 3339, 1, 2048, 512, 512, 2048, 2048]
    - [104, 27.116]
  - - [512, 3342, 1, 2048, 512, 512, 2048, 2048]
    - [103, 26.701]
  - - [512, 3344, 1, 2048, 512, 512, 2048, 2048]
    - [100, 26.672]
  - - [512, 3358, 1, 2048, 512, 512, 2048, 2048]
    - [105, 26.465]
  - - [512, 3360, 1, 2048, 512, 512, 2048, 2048]
    - [104, 26.576]
  - - [512, 3364, 1, 2048, 512, 512, 2048, 2048]
    - [103, 26.318]
  - - [512, 3365, 1, 2048, 512, 512, 2048, 2048]
    - [112, 26.332]
  - - [512, 3369, 1, 2048, 512, 512, 2048, 2048]
    - [110, 26.276]
  - - [512, 3371, 1, 2048, 512, 512, 2048, 2048]
    - [103, 26.656]
  - - [512, 3374, 1, 2048, 512, 512, 2048, 2048]
    - [100, 26.534]
  - - [512, 3376, 1, 2048, 512, 512, 2048, 2048]
    - [105, 26.22]
  - - [512, 3377, 1, 2048, 512, 512, 2048, 2048]
    - [95, 26.634]
  - - [512, 3378, 1, 2048, 512, 512, 2048, 2048]
    - [92, 25.967]
  - - [512, 3381, 1, 2048, 512, 512, 2048, 2048]
    - [100, 26.922]
  - - [512, 3382, 1, 2048, 512, 512, 2048, 2048]
    - [103, 27.418]
  - - [512, 3383, 1, 2048, 512, 512, 2048, 2048]
    - [60, 26.317]
  - - [512, 3384, 1, 2048, 512, 512, 2048, 2048]
    - [100, 26.721]
  - - [512, 3385, 1, 2048, 512, 512, 2048, 2048]
    - [105, 26.697]
  - - [512, 3386, 1, 2048, 512, 512, 2048, 2048]
    - [71, 26.878]
  - - [512, 3388, 1, 2048, 512, 512, 2048, 2048]
    - [112, 26.625]
  - - [512, 3390, 1, 2048, 512, 512, 2048, 2048]
    - [94, 26.832]
  - - [512, 3391, 1, 2048, 512, 512, 2048, 2048]
    - [110, 27.008]
  - - [512, 3396, 1, 2048, 512, 512, 2048, 2048]
    - [45, 26.644]
  - - [512, 3399, 1, 2048, 512, 512, 2048, 2048]
    - [84, 26.473]
  - - [512, 3402, 1, 2048, 512, 512, 2048, 2048]
    - [103, 27.167]
  - - [512, 3410, 1, 2048, 512, 512, 2048, 2048]
    - [105, 26.385]
  - - [512, 3412, 1, 2048, 512, 512, 2048, 2048]
    - [23, 26.839]
  - - [512, 3414, 1, 2048, 512, 512, 2048, 2048]
    - [70, 26.226]
  - - [512, 3415, 1, 2048, 512, 512, 2048, 2048]
    - [110, 26.623]
  - - [512, 3418, 1, 2048, 512, 512, 2048, 2048]
    - [95, 26.416]
  - - [512, 3420, 1, 2048, 512, 512, 2048, 2048]
    - [112, 26.592]
  - - [512, 3422, 1, 2048, 512, 512, 2048, 2048]
    - [103, 26.664]
  - - [512, 3425, 1, 2048, 512, 512, 2048, 2048]
    - [112, 26.494]
  - - [512, 3426, 1, 2048, 512, 512, 2048, 2048]
    - [60, 26.484]
  - - [512, 3427, 1, 2048, 512, 512, 2048, 2048]
    - [105, 26.222]
  - - [512, 3428, 1, 2048, 512, 512, 2048, 2048]
    - [105, 26.067]
  - - [512, 3430, 1, 2048, 512, 512, 2048, 2048]
    - [71, 26.154]
  - - [512, 3431, 1, 2048, 512, 512, 2048, 2048]
    - [71, 26.144]
  - - [512, 3432, 1, 2048, 512, 512, 2048, 2048]
    - [71, 26.642]
  - - [512, 3438, 1, 2048, 512, 512, 2048, 2048]
    - [23, 26.639]
  - - [512, 3439, 1, 2048, 512, 512, 2048, 2048]
    - [112, 26.81]
  - - [512, 3440, 1, 2048, 512, 512, 2048, 2048]
    - [70, 26.963]
  - - [512, 3443, 1, 2048, 512, 512, 2048, 2048]
    - [23, 26.659]
  - - [512, 3445, 1, 2048, 512, 512, 2048, 2048]
    - [100, 26.593]
  - - [512, 3447, 1, 2048, 512, 512, 2048, 2048]
    - [23, 26.603]
  - - [512, 3448, 1, 2048, 512, 512, 2048, 2048]
    - [71, 26.623]
  - - [512, 3450, 1, 2048, 512, 512, 2048, 2048]
    - [110, 27.274]
  - - [512, 3451, 1, 2048, 512, 512, 2048, 2048]
    - [68, 26.941]
  - - [512, 3452, 1, 2048, 512, 512, 2048, 2048]
    - [100, 26.879]
  - - [512, 3453, 1, 2048, 512, 512, 2048, 2048]
    - [106, 26.354]
  - - [512, 3455, 1, 2048, 512, 512, 2048, 2048]
    - [110, 27.126]
  - - [512, 3456, 1, 2048, 512, 512, 2048, 2048]
    - [23, 26.653]
  - - [512, 3457, 1, 2048, 512, 512, 2048, 2048]
    - [104, 27.09]
  - - [512, 3458, 1, 2048, 512, 512, 2048, 2048]
    - [106, 27.318]
  - - [512, 3459, 1, 2048, 512, 512, 2048, 2048]
    - [111, 26.72]
  - - [512, 3460, 1, 2048, 512, 512, 2048, 2048]
    - [104, 27.191]
  - - [512, 3461, 1, 2048, 512, 512, 2048, 2048]
    - [104, 26.892]
  - - [512, 3462, 1, 2048, 512, 512, 2048, 2048]
    - [106, 26.944]
  - - [512, 3466, 1, 2048, 512, 512, 2048, 2048]
    - [111, 26.712]
  - - [512, 3467, 1, 2048, 512, 512, 2048, 2048]
    - [106, 27.009]
  - - [512, 3468, 1, 2048, 512, 512, 2048, 2048]
    - [104, 27.371]
  - - [512, 3470, 1, 2048, 512, 512, 2048, 2048]
    - [106, 27.026]
  - - [512, 3471, 1, 2048, 512, 512, 2048, 2048]
    - [111, 27.168]
  - - [512, 3472, 1, 2048, 512, 512, 2048, 2048]
    - [110, 26.972]
  - - [512, 3475, 1, 2048, 512, 512, 2048, 2048]
    - [111, 27.058]
  - - [512, 3476, 1, 2048, 512, 512, 2048, 2048]
    - [104, 27.22]
  - - [512, 3477, 1, 2048, 512, 512, 2048, 2048]
    - [104, 27.24]
  - - [512, 3478, 1, 2048, 512, 512, 2048, 2048]
    - [95, 26.823]
  - - [512, 3479, 1, 2048, 512, 512, 2048, 2048]
    - [106, 27.243]
  - - [512, 3480, 1, 2048, 512, 512, 2048, 2048]
    - [111, 27.531]
  - - [512, 3481, 1, 2048, 512, 512, 2048, 2048]
    - [106, 27.143]
  - - [512, 3483, 1, 2048, 512, 512, 2048, 2048]
    - [104, 27.185]
  - - [512, 3484, 1, 2048, 512, 512, 2048, 2048]
    - [110, 27.917]
  - - [512, 3487, 1, 2048, 512, 512, 2048, 2048]
    - [103, 27.54]
  - - [512, 3489, 1, 2048, 512, 512, 2048, 2048]
    - [104, 27.412]
  - - [512, 3490, 1, 2048, 512, 512, 2048, 2048]
    - [106, 27.15]
  - - [512, 3491, 1, 2048, 512, 512, 2048, 2048]
    - [101, 26.774]
  - - [512, 3493, 1, 2048, 512, 512, 2048, 2048]
    - [111, 27.301]
  - - [512, 3494, 1, 2048, 512, 512, 2048, 2048]
    - [106, 26.859]
  - - [512, 3495, 1, 2048, 512, 512, 2048, 2048]
    - [104, 26.705]
  - - [512, 3497, 1, 2048, 512, 512, 2048, 2048]
    - [106, 26.976]
  - - [512, 3498, 1, 2048, 512, 512, 2048, 2048]
    - [103, 27.601]
  - - [512, 3499, 1, 2048, 512, 512, 2048, 2048]
    - [101, 26.601]
  - - [512, 3501, 1, 2048, 512, 512, 2048, 2048]
    - [94, 27.026]
  - - [512, 3503, 1, 2048, 512, 512, 2048, 2048]
    - [103, 27.418]
  - - [512, 3507, 1, 2048, 512, 512, 2048, 2048]
    - [103, 27.135]
  - - [512, 3508, 1, 2048, 512, 512, 2048, 2048]
    - [106, 26.954]
  - - [512, 3509, 1, 2048, 512, 512, 2048, 2048]
    - [110, 27.459]
  - - [512, 3511, 1, 2048, 512, 512, 2048, 2048]
    - [103, 26.989]
  - - [512, 3514, 1, 2048, 512, 512, 2048, 2048]
    - [112, 26.568]
  - - [512, 3515, 1, 2048, 512, 512, 2048, 2048]
    - [110, 27.267]
  - - [512, 3517, 1, 2048, 512, 512, 2048, 2048]
    - [106, 27.541]
  - - [512, 3518, 1, 2048, 512, 512, 2048, 2048]
    - [106, 27.653]
  - - [512, 3519, 1, 2048, 512, 512, 2048, 2048]
    - [110, 27.721]
  - - [512, 3520, 1, 2048, 512, 512, 2048, 2048]
    - [110, 27.597]
  - - [512, 3523, 1, 2048, 512, 512, 2048, 2048]
    - [112, 26.882]
  - - [512, 3528, 1, 2048, 512, 512, 2048, 2048]
    - [103, 27.032]
  - - [512, 3529, 1, 2048, 512, 512, 2048, 2048]
    - [110, 27.773]
  - - [512, 3530, 1, 2048, 512, 512, 2048, 2048]
    - [112, 26.818]
  - - [512, 3532, 1, 2048, 512, 512, 2048, 2048]
    - [110, 27.639]
  - - [512, 3533, 1, 2048, 512, 512, 2048, 2048]
    - [106, 26.816]
  - - [512, 3534, 1, 2048, 512, 512, 2048, 2048]
    - [106, 27.191]
  - - [512, 3538, 1, 2048, 512, 512, 2048, 2048]
    - [105, 26.634]
  - - [512, 3539, 1, 2048, 512, 512, 2048, 2048]
    - [23, 27.486]
  - - [512, 3541, 1, 2048, 512, 512, 2048, 2048]
    - [23, 27.126]
  - - [512, 3547, 1, 2048, 512, 512, 2048, 2048]
    - [45, 27.317]
  - - [512, 3548, 1, 2048, 512, 512, 2048, 2048]
    - [105, 27.217]
  - - [512, 3552, 1, 2048, 512, 512, 2048, 2048]
    - [103, 27.503]
  - - [512, 3564, 1, 2048, 512, 512, 2048, 2048]
    - [23, 27.352]
  - - [512, 3575, 1, 2048, 512, 512, 2048, 2048]
    - [45, 27.197]
  - - [512, 3598, 1, 2048, 512, 512, 2048, 2048]
    - [111, 28.255]
  - - [512, 3599, 1, 2048, 512, 512, 2048, 2048]
    - [104, 28.283]
  - - [512, 3608, 1, 2048, 512, 512, 2048, 2048]
    - [103, 28.207]
  - - [512, 3780, 1, 512, 512, 512, 512, 512]
    - [30, 36.887]
  - - [512, 3780, 1, 2048, 512, 512, 2048, 2048]
    - [110, 28.97]
  - - [512, 3796, 1, 512, 512, 512, 512, 512]
    - [29, 36.189]
  - - [512, 3796, 1, 2048, 512, 512, 2048, 2048]
    - [110, 28.511]
  - - [512, 3822, 1, 512, 512, 512, 512, 512]
    - [22, 36.819]
  - - [512, 3822, 1, 2048, 512, 512, 2048, 2048]
    - [106, 28.494]
  - - [512, 3840, 1, 512, 512, 512, 512, 512]
    - [44, 36.736]
  - - [512, 3840, 1, 2048, 512, 512, 2048, 2048]
    - [105, 28.764]
  - - [512, 3859, 1, 512, 512, 512, 512, 512]
    - [30, 27.939]
  - - [512, 3859, 1, 2048, 512, 512, 2048, 2048]
    - [71, 25.269]
  - - [512, 3870, 1, 512, 512, 512, 512, 512]
    - [44, 28.291]
  - - [512, 3870, 1, 2048, 512, 512, 2048, 2048]
    - [71, 25.64]
  - - [512, 3876, 1, 512, 512, 512, 512, 512]
    - [30, 27.964]
  - - [512, 3876, 1, 2048, 512, 512, 2048, 2048]
    - [95, 25.517]
  - - [512, 3906, 1, 512, 512, 512, 512, 512]
    - [4, 28.058]
  - - [512, 3906, 1, 2048, 512, 512, 2048, 2048]
    - [95, 25.371]
  - - [512, 3910, 1, 512, 512, 512, 512, 512]
    - [44, 28.111]
  - - [512, 3910, 1, 2048, 512, 512, 2048, 2048]
    - [95, 25.502]
  - - [512, 3925, 1, 512, 512, 512, 512, 512]
    - [22, 28.244]
  - - [512, 3925, 1, 2048, 512, 512, 2048, 2048]
    - [71, 25.809]
  - - [512, 3927, 1, 512, 512, 512, 512, 512]
    - [22, 28.506]
  - - [512, 3942, 1, 512, 512, 512, 512, 512]
    - [33, 28.17]
  - - [512, 3942, 1, 2048, 512, 512, 2048, 2048]
    - [71, 25.696]
  - - [512, 3944, 1, 512, 512, 512, 512, 512]
    - [8, 28.356]
  - - [512, 3944, 1, 2048, 512, 512, 2048, 2048]
    - [71, 25.704]
  - - [512, 3955, 1, 512, 512, 512, 512, 512]
    - [44, 28.336]
  - - [512, 3955, 1, 2048, 512, 512, 2048, 2048]
    - [71, 25.559]
  - - [512, 3968, 1, 512, 512, 512, 512, 512]
    - [22, 28.778]
  - - [512, 3968, 1, 2048, 512, 512, 2048, 2048]
    - [60, 25.229]
  - - [512, 3969, 1, 512, 512, 512, 512, 512]
    - [22, 29.143]
  - - [512, 3969, 1, 2048, 512, 512, 2048, 2048]
    - [95, 25.75]
  - - [512, 3976, 1, 512, 512, 512, 512, 512]
    - [33, 28.836]
  - - [512, 3976, 1, 2048, 512, 512, 2048, 2048]
    - [95, 25.535]
  - - [512, 3977, 1, 512, 512, 512, 512, 512]
    - [30, 29.021]
  - - [512, 3977, 1, 2048, 512, 512, 2048, 2048]
    - [84, 24.847]
  - - [512, 3978, 1, 512, 512, 512, 512, 512]
    - [22, 29.209]
  - - [512, 3978, 1, 2048, 512, 512, 2048, 2048]
    - [71, 25.788]
  - - [512, 3990, 1, 512, 512, 512, 512, 512]
    - [33, 28.837]
  - - [512, 3990, 1, 2048, 512, 512, 2048, 2048]
    - [71, 25.36]
  - - [512, 3995, 1, 512, 512, 512, 512, 512]
    - [30, 29.076]
  - - [512, 3995, 1, 2048, 512, 512, 2048, 2048]
    - [95, 25.873]
  - - [512, 3996, 1, 512, 512, 512, 512, 512]
    - [4, 29.058]
  - - [512, 3996, 1, 2048, 512, 512, 2048, 2048]
    - [71, 25.739]
  - - [512, 3999, 1, 512, 512, 512, 512, 512]
    - [22, 29.003]
  - - [512, 3999, 1, 2048, 512, 512, 2048, 2048]
    - [71, 25.574]
  - - [512, 4005, 1, 512, 512, 512, 512, 512]
    - [33, 28.945]
  - - [512, 4005, 1, 2048, 512, 512, 2048, 2048]
    - [95, 25.782]
  - - [512, 4012, 1, 512, 512, 512, 512, 512]
    - [4, 29.381]
  - - [512, 4012, 1, 2048, 512, 512, 2048, 2048]
    - [71, 25.276]
  - - [512, 4020, 1, 512, 512, 512, 512, 512]
    - [44, 29.491]
  - - [512, 4020, 1, 2048, 512, 512, 2048, 2048]
    - [71, 25.833]
  - - [512, 4026, 1, 512, 512, 512, 512, 512]
    - [22, 29.693]
  - - [512, 4026, 1, 2048, 512, 512, 2048, 2048]
    - [71, 25.476]
  - - [512, 4030, 1, 512, 512, 512, 512, 512]
    - [22, 29.67]
  - - [512, 4030, 1, 2048, 512, 512, 2048, 2048]
    - [71, 25.609]
  - - [512, 4032, 1, 512, 512, 512, 512, 512]
    - [4, 29.166]
  - - [512, 4032, 1, 2048, 512, 512, 2048, 2048]
    - [95, 26.118]
  - - [512, 4050, 1, 512, 512, 512, 512, 512]
    - [44, 29.45]
  - - [512, 4059, 1, 512, 512, 512, 512, 512]
    - [30, 29.542]
  - - [2048, 2790, 1, 512, 2048, 2048, 512, 512]
    - [71, 39.483]
  - - [2048, 2864, 1, 512, 2048, 2048, 512, 512]
    - [95, 40.272]
  - - [2048, 3092, 1, 512, 2048, 2048, 512, 512]
    - [53, 39.593]
  - - [2048, 3113, 1, 512, 2048, 2048, 512, 512]
    - [77, 39.769]
  - - [2048, 3137, 1, 512, 2048, 2048, 512, 512]
    - [52, 39.392]
  - - [2048, 3165, 1, 512, 2048, 2048, 512, 512]
    - [54, 39.668]
  - - [2048, 3166, 1, 512, 2048, 2048, 512, 512]
    - [77, 39.832]
  - - [2048, 3194, 1, 512, 2048, 2048, 512, 512]
    - [78, 39.881]
  - - [2048, 3219, 1, 512, 2048, 2048, 512, 512]
    - [54, 39.202]
  - - [2048, 3222, 1, 512, 2048, 2048, 512, 512]
    - [74, 39.311]
  - - [2048, 3234, 1, 512, 2048, 2048, 512, 512]
    - [53, 39.53]
  - - [2048, 3237, 1, 512, 2048, 2048, 512, 512]
    - [78, 39.552]
  - - [2048, 3242, 1, 512, 2048, 2048, 512, 512]
    - [93, 39.76]
  - - [2048, 3246, 1, 512, 2048, 2048, 512, 512]
    - [80, 39.429]
  - - [2048, 3249, 1, 512, 2048, 2048, 512, 512]
    - [74, 39.394]
  - - [2048, 3251, 1, 512, 2048, 2048, 512, 512]
    - [53, 39.534]
  - - [2048, 3257, 1, 512, 2048, 2048, 512, 512]
    - [78, 39.189]
  - - [2048, 3262, 1, 512, 2048, 2048, 512, 512]
    - [78, 39.537]
  - - [2048, 3268, 1, 512, 2048, 2048, 512, 512]
    - [95, 38.8]
  - - [2048, 3282, 1, 512, 2048, 2048, 512, 512]
    - [95, 39.036]
  - - [2048, 3286, 1, 512, 2048, 2048, 512, 512]
    - [71, 39.126]
  - - [2048, 3287, 1, 512, 2048, 2048, 512, 512]
    - [71, 39.265]
  - - [2048, 3293, 1, 512, 2048, 2048, 512, 512]
    - [71, 39.223]
  - - [2048, 3297, 1, 512, 2048, 2048, 512, 512]
    - [71, 39.256]
  - - [2048, 3307, 1, 512, 2048, 2048, 512, 512]
    - [71, 39.39]
  - - [2048, 3314, 1, 512, 2048, 2048, 512, 512]
    - [71, 39.289]
  - - [2048, 3315, 1, 512, 2048, 2048, 512, 512]
    - [71, 39.414]
  - - [2048, 3319, 1, 512, 2048, 2048, 512, 512]
    - [71, 39.349]
  - - [2048, 3322, 1, 512, 2048, 2048, 512, 512]
    - [95, 39.356]
  - - [2048, 3323, 1, 512, 2048, 2048, 512, 512]
    - [71, 39.312]
  - - [2048, 3324, 1, 512, 2048, 2048, 512, 512]
    - [71, 39.38]
  - - [2048, 3325, 1, 512, 2048, 2048, 512, 512]
    - [95, 39.406]
  - - [2048, 3327, 1, 512, 2048, 2048, 512, 512]
    - [95, 39.345]
  - - [2048, 3329, 1, 512, 2048, 2048, 512, 512]
    - [91, 38.786]
  - - [2048, 3332, 1, 512, 2048, 2048, 512, 512]
    - [67, 38.821]
  - - [2048, 3336, 1, 512, 2048, 2048, 512, 512]
    - [93, 38.854]
  - - [2048, 3339, 1, 512, 2048, 2048, 512, 512]
    - [69, 38.807]
  - - [2048, 3342, 1, 512, 2048, 2048, 512, 512]
    - [93, 39.186]
  - - [2048, 3344, 1, 512, 2048, 2048, 512, 512]
    - [69, 38.92]
  - - [2048, 3358, 1, 512, 2048, 2048, 512, 512]
    - [69, 39.221]
  - - [2048, 3360, 1, 512, 2048, 2048, 512, 512]
    - [93, 39.551]
  - - [2048, 3364, 1, 512, 2048, 2048, 512, 512]
    - [93, 38.961]
  - - [2048, 3365, 1, 512, 2048, 2048, 512, 512]
    - [69, 38.959]
  - - [2048, 3369, 1, 512, 2048, 2048, 512, 512]
    - [93, 39.335]
  - - [2048, 3371, 1, 512, 2048, 2048, 512, 512]
    - [91, 38.96]
  - - [2048, 3374, 1, 512, 2048, 2048, 512, 512]
    - [56, 39.036]
  - - [2048, 3376, 1, 512, 2048, 2048, 512, 512]
    - [93, 39.196]
  - - [2048, 3377, 1, 512, 2048, 2048, 512, 512]
    - [67, 39.125]
  - - [2048, 3378, 1, 512, 2048, 2048, 512, 512]
    - [69, 39.123]
  - - [2048, 3381, 1, 512, 2048, 2048, 512, 512]
    - [93, 39.282]
  - - [2048, 3382, 1, 512, 2048, 2048, 512, 512]
    - [78, 39.142]
  - - [2048, 3383, 1, 512, 2048, 2048, 512, 512]
    - [91, 39.099]
  - - [2048, 3384, 1, 512, 2048, 2048, 512, 512]
    - [93, 39.567]
  - - [2048, 3385, 1, 512, 2048, 2048, 512, 512]
    - [93, 39.328]
  - - [2048, 3386, 1, 512, 2048, 2048, 512, 512]
    - [67, 39.189]
  - - [2048, 3388, 1, 512, 2048, 2048, 512, 512]
    - [69, 39.432]
  - - [2048, 3390, 1, 512, 2048, 2048, 512, 512]
    - [93, 39.084]
  - - [2048, 3391, 1, 512, 2048, 2048, 512, 512]
    - [80, 39.164]
  - - [2048, 3396, 1, 512, 2048, 2048, 512, 512]
    - [93, 39.721]
  - - [2048, 3399, 1, 512, 2048, 2048, 512, 512]
    - [93, 39.339]
  - - [2048, 3402, 1, 512, 2048, 2048, 512, 512]
    - [91, 39.415]
  - - [2048, 3410, 1, 512, 2048, 2048, 512, 512]
    - [67, 39.274]
  - - [2048, 3412, 1, 512, 2048, 2048, 512, 512]
    - [91, 39.503]
  - - [2048, 3414, 1, 512, 2048, 2048, 512, 512]
    - [91, 39.651]
  - - [2048, 3415, 1, 512, 2048, 2048, 512, 512]
    - [91, 39.483]
  - - [2048, 3418, 1, 512, 2048, 2048, 512, 512]
    - [56, 39.462]
  - - [2048, 3420, 1, 512, 2048, 2048, 512, 512]
    - [69, 39.847]
  - - [2048, 3422, 1, 512, 2048, 2048, 512, 512]
    - [93, 39.647]
  - - [2048, 3425, 1, 512, 2048, 2048, 512, 512]
    - [91, 39.64]
  - - [2048, 3426, 1, 512, 2048, 2048, 512, 512]
    - [77, 39.445]
  - - [2048, 3427, 1, 512, 2048, 2048, 512, 512]
    - [93, 39.566]
  - - [2048, 3428, 1, 512, 2048, 2048, 512, 512]
    - [67, 39.495]
  - - [2048, 3430, 1, 512, 2048, 2048, 512, 512]
    - [53, 39.449]
  - - [2048, 3431, 1, 512, 2048, 2048, 512, 512]
    - [91, 39.585]
  - - [2048, 3432, 1, 512, 2048, 2048, 512, 512]
    - [67, 39.721]
  - - [2048, 3438, 1, 512, 2048, 2048, 512, 512]
    - [91, 39.79]
  - - [2048, 3439, 1, 512, 2048, 2048, 512, 512]
    - [69, 39.927]
  - - [2048, 3440, 1, 512, 2048, 2048, 512, 512]
    - [69, 39.786]
  - - [2048, 3443, 1, 512, 2048, 2048, 512, 512]
    - [67, 39.834]
  - - [2048, 3445, 1, 512, 2048, 2048, 512, 512]
    - [67, 39.802]
  - - [2048, 3447, 1, 512, 2048, 2048, 512, 512]
    - [69, 39.922]
  - - [2048, 3448, 1, 512, 2048, 2048, 512, 512]
    - [69, 40.117]
  - - [2048, 3450, 1, 512, 2048, 2048, 512, 512]
    - [80, 39.762]
  - - [2048, 3451, 1, 512, 2048, 2048, 512, 512]
    - [67, 39.719]
  - - [2048, 3452, 1, 512, 2048, 2048, 512, 512]
    - [91, 39.73]
  - - [2048, 3453, 1, 512, 2048, 2048, 512, 512]
    - [80, 39.604]
  - - [2048, 3455, 1, 512, 2048, 2048, 512, 512]
    - [67, 39.71]
  - - [2048, 3456, 1, 512, 2048, 2048, 512, 512]
    - [56, 39.776]
  - - [2048, 3457, 1, 512, 2048, 2048, 512, 512]
    - [53, 39.622]
  - - [2048, 3458, 1, 512, 2048, 2048, 512, 512]
    - [53, 39.841]
  - - [2048, 3459, 1, 512, 2048, 2048, 512, 512]
    - [80, 39.687]
  - - [2048, 3460, 1, 512, 2048, 2048, 512, 512]
    - [69, 39.905]
  - - [2048, 3461, 1, 512, 2048, 2048, 512, 512]
    - [77, 39.848]
  - - [2048, 3462, 1, 512, 2048, 2048, 512, 512]
    - [67, 39.887]
  - - [2048, 3466, 1, 512, 2048, 2048, 512, 512]
    - [93, 39.975]
  - - [2048, 3467, 1, 512, 2048, 2048, 512, 512]
    - [77, 39.737]
  - - [2048, 3468, 1, 512, 2048, 2048, 512, 512]
    - [53, 40.012]
  - - [2048, 3470, 1, 512, 2048, 2048, 512, 512]
    - [91, 40.049]
  - - [2048, 3471, 1, 512, 2048, 2048, 512, 512]
    - [91, 39.893]
  - - [2048, 3472, 1, 512, 2048, 2048, 512, 512]
    - [77, 39.822]
  - - [2048, 3475, 1, 512, 2048, 2048, 512, 512]
    - [77, 39.912]
  - - [2048, 3476, 1, 512, 2048, 2048, 512, 512]
    - [91, 40.118]
  - - [2048, 3477, 1, 512, 2048, 2048, 512, 512]
    - [77, 40.074]
  - - [2048, 3478, 1, 512, 2048, 2048, 512, 512]
    - [67, 40.029]
  - - [2048, 3479, 1, 512, 2048, 2048, 512, 512]
    - [67, 40.041]
  - - [2048, 3480, 1, 512, 2048, 2048, 512, 512]
    - [67, 39.941]
  - - [2048, 3481, 1, 512, 2048, 2048, 512, 512]
    - [77, 40.078]
  - - [2048, 3483, 1, 512, 2048, 2048, 512, 512]
    - [91, 40.017]
  - - [2048, 3484, 1, 512, 2048, 2048, 512, 512]
    - [56, 40.029]
  - - [2048, 3487, 1, 512, 2048, 2048, 512, 512]
    - [67, 40.203]
  - - [2048, 3489, 1, 512, 2048, 2048, 512, 512]
    - [77, 39.975]
  - - [2048, 3490, 1, 512, 2048, 2048, 512, 512]
    - [91, 40.042]
  - - [2048, 3491, 1, 512, 2048, 2048, 512, 512]
    - [77, 39.957]
  - - [2048, 3493, 1, 512, 2048, 2048, 512, 512]
    - [91, 39.855]
  - - [2048, 3494, 1, 512, 2048, 2048, 512, 512]
    - [53, 40.116]
  - - [2048, 3495, 1, 512, 2048, 2048, 512, 512]
    - [77, 40.016]
  - - [2048, 3497, 1, 512, 2048, 2048, 512, 512]
    - [67, 40.276]
  - - [2048, 3498, 1, 512, 2048, 2048, 512, 512]
    - [56, 40.162]
  - - [2048, 3499, 1, 512, 2048, 2048, 512, 512]
    - [67, 40.201]
  - - [2048, 3501, 1, 512, 2048, 2048, 512, 512]
    - [56, 40.224]
  - - [2048, 3503, 1, 512, 2048, 2048, 512, 512]
    - [91, 40.275]
  - - [2048, 3507, 1, 512, 2048, 2048, 512, 512]
    - [53, 40.279]
  - - [2048, 3508, 1, 512, 2048, 2048, 512, 512]
    - [80, 40.333]
  - - [2048, 3509, 1, 512, 2048, 2048, 512, 512]
    - [91, 40.344]
  - - [2048, 3511, 1, 512, 2048, 2048, 512, 512]
    - [56, 40.075]
  - - [2048, 3514, 1, 512, 2048, 2048, 512, 512]
    - [67, 40.514]
  - - [2048, 3515, 1, 512, 2048, 2048, 512, 512]
    - [77, 39.75]
  - - [2048, 3517, 1, 512, 2048, 2048, 512, 512]
    - [77, 40.45]
  - - [2048, 3518, 1, 512, 2048, 2048, 512, 512]
    - [56, 40.21]
  - - [2048, 3519, 1, 512, 2048, 2048, 512, 512]
    - [67, 40.18]
  - - [2048, 3520, 1, 512, 2048, 2048, 512, 512]
    - [77, 40.358]
  - - [2048, 3523, 1, 512, 2048, 2048, 512, 512]
    - [77, 40.267]
  - - [2048, 3528, 1, 512, 2048, 2048, 512, 512]
    - [77, 40.199]
  - - [2048, 3529, 1, 512, 2048, 2048, 512, 512]
    - [77, 40.1]
  - - [2048, 3530, 1, 512, 2048, 2048, 512, 512]
    - [91, 40.305]
  - - [2048, 3532, 1, 512, 2048, 2048, 512, 512]
    - [53, 40.19]
  - - [2048, 3533, 1, 512, 2048, 2048, 512, 512]
    - [80, 40.118]
  - - [2048, 3534, 1, 512, 2048, 2048, 512, 512]
    - [56, 40.323]
  - - [2048, 3538, 1, 512, 2048, 2048, 512, 512]
    - [77, 40.467]
  - - [2048, 3539, 1, 512, 2048, 2048, 512, 512]
    - [80, 40.38]
  - - [2048, 3541, 1, 512, 2048, 2048, 512, 512]
    - [53, 40.168]
  - - [2048, 3547, 1, 512, 2048, 2048, 512, 512]
    - [80, 40.003]
  - - [2048, 3548, 1, 512, 2048, 2048, 512, 512]
    - [56, 40.386]
  - - [2048, 3552, 1, 512, 2048, 2048, 512, 512]
    - [53, 40.279]
  - - [2048, 3564, 1, 512, 2048, 2048, 512, 512]
    - [67, 40.934]
  - - [2048, 3575, 1, 512, 2048, 2048, 512, 512]
    - [80, 40.581]
  - - [2048, 3598, 1, 512, 2048, 2048, 512, 512]
    - [102, 40.509]
  - - [2048, 3599, 1, 512, 2048, 2048, 512, 512]
    - [99, 40.659]
  - - [2048, 3608, 1, 512, 2048, 2048, 512, 512]
    - [107, 40.677]
  - - [2048, 3780, 1, 512, 2048, 2048, 512, 512]
    - [108, 42.242]
  - - [2048, 3796, 1, 512, 2048, 2048, 512, 512]
    - [109, 42.478]
  - - [2048, 3822, 1, 512, 2048, 2048, 512, 512]
    - [99, 42.856]
  - - [2048, 3840, 1, 512, 2048, 2048, 512, 512]
    - [102, 43.248]
  - - [2048, 3859, 1, 512, 2048, 2048, 512, 512]
    - [93, 39.719]
  - - [2048, 3870, 1, 512, 2048, 2048, 512, 512]
    - [93, 40.538]
  - - [2048, 3876, 1, 512, 2048, 2048, 512, 512]
    - [59, 39.931]
  - - [2048, 3906, 1, 512, 2048, 2048, 512, 512]
    - [93, 40.303]
  - - [2048, 3910, 1, 512, 2048, 2048, 512, 512]
    - [69, 40.559]
  - - [2048, 3925, 1, 512, 2048, 2048, 512, 512]
    - [78, 40.148]
  - - [2048, 3942, 1, 512, 2048, 2048, 512, 512]
    - [78, 40.472]
  - - [2048, 3944, 1, 512, 2048, 2048, 512, 512]
    - [93, 40.343]
  - - [2048, 3955, 1, 512, 2048, 2048, 512, 512]
    - [69, 40.194]
  - - [2048, 3968, 1, 512, 2048, 2048, 512, 512]
    - [69, 41.212]
  - - [2048, 3969, 1, 512, 2048, 2048, 512, 512]
    - [93, 40.399]
  - - [2048, 3976, 1, 512, 2048, 2048, 512, 512]
    - [82, 39.93]
  - - [2048, 3977, 1, 512, 2048, 2048, 512, 512]
    - [93, 40.706]
  - - [2048, 3978, 1, 512, 2048, 2048, 512, 512]
    - [93, 40.366]
  - - [2048, 3990, 1, 512, 2048, 2048, 512, 512]
    - [54, 40.801]
  - - [2048, 3995, 1, 512, 2048, 2048, 512, 512]
    - [54, 40.341]
  - - [2048, 3996, 1, 512, 2048, 2048, 512, 512]
    - [59, 40.241]
  - - [2048, 3999, 1, 512, 2048, 2048, 512, 512]
    - [93, 40.679]
  - - [2048, 4005, 1, 512, 2048, 2048, 512, 512]
    - [93, 40.678]
  - - [2048, 4012, 1, 512, 2048, 2048, 512, 512]
    - [54, 40.887]
  - - [2048, 4020, 1, 512, 2048, 2048, 512, 512]
    - [59, 40.668]
  - - [2048, 4026, 1, 512, 2048, 2048, 512, 512]
    - [78, 40.469]
  - - [2048, 4030, 1, 512, 2048, 2048, 512, 512]
    - [54, 40.657]
  - - [2048, 4032, 1, 512, 2048, 2048, 512, 512]
    - [78, 40.702]
  - - [33708, 184, 1, 512, 33708, 33708, 512, 512]
    - [52, 36.706]
  - - [33708, 189, 1, 512, 33708, 33708, 512, 512]
    - [52, 37.842]
  - - [33708, 208, 1, 512, 33708, 33708, 512, 512]
    - [78, 32.648]
  - - [33708, 246, 1, 512, 33708, 33708, 512, 512]
    - [82, 37.615]
  - - [33708, 264, 1, 512, 33708, 33708, 512, 512]
    - [69, 34.868]
  - - [33708, 465, 1, 512, 33708, 33708, 512, 512]
    - [69, 40.244]
  - - [33708, 468, 1, 512, 33708, 33708, 512, 512]
    - [93, 40.279]
  - - [33708, 493, 1, 512, 33708, 33708, 512, 512]
    - [82, 41.934]
  - - [33708, 540, 1, 512, 33708, 33708, 512, 512]
    - [69, 40.991]
  - - [33708, 550, 1, 512, 33708, 33708, 512, 512]
    - [69, 40.94]
  - - [33708, 560, 1, 512, 33708, 33708, 512, 512]
    - [69, 41.989]
  - - [33708, 644, 1, 512, 33708, 33708, 512, 512]
    - [93, 41.18]
  - - [33708, 714, 1, 512, 33708, 33708, 512, 512]
    - [44, 41.867]
  - - [33708, 720, 1, 512, 33708, 33708, 512, 512]
    - [22, 42.124]
  - - [33708, 781, 1, 512, 33708, 33708, 512, 512]
    - [77, 42.308]
  - - [33708, 936, 1, 512, 33708, 33708, 512, 512]
    - [69, 44.277]
  - - [33708, 980, 1, 512, 33708, 33708, 512, 512]
    - [69, 43.407]
  - - [33708, 1232, 1, 512, 33708, 33708, 512, 512]
    - [44, 43.915]
  - - [33708, 1290, 1, 512, 33708, 33708, 512, 512]
    - [91, 44.14]
  - - [33708, 1350, 1, 512, 33708, 33708, 512, 512]
    - [91, 44.205]
  - - [33708, 1424, 1, 512, 33708, 33708, 512, 512]
    - [93, 44.527]
  - - [33708, 1458, 1, 512, 33708, 33708, 512, 512]
    - [67, 45.351]
  - - [33708, 1462, 1, 512, 33708, 33708, 512, 512]
    - [69, 45.413]
  - - [33708, 1520, 1, 512, 33708, 33708, 512, 512]
    - [80, 44.896]
  - - [33708, 1596, 1, 512, 33708, 33708, 512, 512]
    - [77, 45.05]
  - - [33708, 1599, 1, 512, 33708, 33708, 512, 512]
    - [69, 44.976]
  - - [33708, 1615, 1, 512, 33708, 33708, 512, 512]
    - [17, 44.882]
  - - [33708, 1680, 1, 512, 33708, 33708, 512, 512]
    - [53, 44.77]
  - - [33708, 1917, 1, 512, 33708, 33708, 512, 512]
    - [17, 45.889]
  - - [33708, 2205, 1, 512, 33708, 33708, 512, 512]
    - [67, 45.452]
  - - [33708, 2418, 1, 512, 33708, 33708, 512, 512]
    - [17, 46.003]
  - - [33708, 2496, 1, 512, 33708, 33708, 512, 512]
    - [93, 46.275]
  - - [33708, 3776, 1, 512, 33708, 33708, 512, 512]
    - [67, 46.465]
  - - [33708, 3780, 1, 512, 33708, 33708, 512, 512]
    - [41, 46.103]
  - - [33708, 3796, 1, 512, 33708, 33708, 512, 512]
    - [17, 46.204]
  - - [33708, 3822, 1, 512, 33708, 33708, 512, 512]
    - [41, 46.327]
  - - [33708, 3835, 1, 512, 33708, 33708, 512, 512]
    - [41, 46.484]
  - - [33708, 3840, 1, 512, 33708, 33708, 512, 512]
    - [17, 46.845]
  - - [33708, 3859, 1, 512, 33708, 33708, 512, 512]
    - [93, 45.886]
  - - [33708, 3864, 1, 512, 33708, 33708, 512, 512]
    - [91, 45.753]
  - - [33708, 3870, 1, 512, 33708, 33708, 512, 512]
    - [53, 46.04]
  - - [33708, 3876, 1, 512, 33708, 33708, 512, 512]
    - [53, 46.145]
  - - [33708, 3906, 1, 512, 33708, 33708, 512, 512]
    - [41, 46.024]
  - - [33708, 3910, 1, 512, 33708, 33708, 512, 512]
    - [41, 46.047]
  - - [33708, 3925, 1, 512, 33708, 33708, 512, 512]
    - [41, 46.264]
  - - [33708, 3942, 1, 512, 33708, 33708, 512, 512]
    - [41, 46.356]
  - - [33708, 3944, 1, 512, 33708, 33708, 512, 512]
    - [17, 46.399]
  - - [33708, 3955, 1, 512, 33708, 33708, 512, 512]
    - [17, 46.549]
  - - [33708, 3968, 1, 512, 33708, 33708, 512, 512]
    - [17, 46.828]
  - - [33708, 3969, 1, 512, 33708, 33708, 512, 512]
    - [69, 45.794]
  - - [33708, 3976, 1, 512, 33708, 33708, 512, 512]
    - [69, 45.759]
  - - [33708, 3977, 1, 512, 33708, 33708, 512, 512]
    - [53, 45.773]
  - - [33708, 3978, 1, 512, 33708, 33708, 512, 512]
    - [77, 45.829]
  - - [33708, 3990, 1, 512, 33708, 33708, 512, 512]
    - [53, 45.884]
  - - [33708, 3995, 1, 512, 33708, 33708, 512, 512]
    - [53, 46.017]
  - - [33708, 3996, 1, 512, 33708, 33708, 512, 512]
    - [91, 46.067]
  - - [33708, 3999, 1, 512, 33708, 33708, 512, 512]
    - [53, 45.971]
  - - [33708, 4005, 1, 512, 33708, 33708, 512, 512]
    - [67, 46.16]
  - - [33708, 4012, 1, 512, 33708, 33708, 512, 512]
    - [77, 46.118]
  - - [33708, 4020, 1, 512, 33708, 33708, 512, 512]
    - [77, 46.234]
  - - [33708, 4026, 1, 512, 33708, 33708, 512, 512]
    - [93, 46.365]
  - - [33708, 4030, 1, 512, 33708, 33708, 512, 512]
    - [53, 46.394]
  - - [33708, 4032, 1, 512, 33708, 33708, 512, 512]
    - [69, 46.456]
- null
