src/Tensile/data/Configs/miopen/archives/megatron/2021-02-04/exact/vega20_Cijk_Ailk_Bjlk_HBH.yaml
- {MinimumRequiredVersion: 4.25.0}
- vega20
- gfx906
- [Device 66a0, Device 66a1, Device 66a7, Device 66af, Vega 20]
    SolutionIndex: 0
    SolutionNameMin: Cijk_Ailk_Bjlk_HBH_MT64x64x16_SE_FL0_GRVW4_IU2_LDL2_LRVW4_TT4_4_VW4_WG16_16_1_WGM1
    SolutionIndex: 1
    SolutionNameMin: Cijk_Ailk_Bjlk_HBH_MT128x64x16_SE_FL1_GRVW4_IU2_LDL2_LRVW4_TT8_4_VW4_WG16_16_1_WGM1
    SolutionIndex: 2
    SolutionNameMin: Cijk_Ailk_Bjlk_HBH_MT64x128x16_SE_FL0_GRVW4_IU2_LDL2_LRVW4_TT4_8_VW4_WG16_16_1_WGM1
    SolutionIndex: 3
    SolutionNameMin: Cijk_Ailk_Bjlk_HBH_MT64x128x16_SE_FL1_GRVW4_IU2_LDL2_LRVW4_TT4_8_VW4_WG16_16_1_WGM1
    SolutionIndex: 4
    SolutionNameMin: Cijk_Ailk_Bjlk_HBH_MT96x64x16_SE_FL0_GRVW2_IU2_LDL2_LRVW2_TT6_4_VW2_WG16_16_1_WGM8
    SolutionIndex: 5
    SolutionNameMin: Cijk_Ailk_Bjlk_HBH_MT64x32x8_SE_FL1_GRVW2_IU2_LDL2_LRVW2_TT4_4_VW2_WG16_8_1_WGM8
    SolutionIndex: 6
    SolutionNameMin: Cijk_Ailk_Bjlk_HBH_MT64x32x16_SE_FL1_GRVW4_IU2_LDL2_LRVW4_TT4_4_VW4_WG16_8_1_WGM1
    SolutionIndex: 7
    SolutionNameMin: Cijk_Ailk_Bjlk_HBH_MT64x64x16_SE_FL0_GRVW4_IU2_LDL2_LRVW4_TT4_8_VW4_WG16_8_1_WGM1
    SolutionIndex: 8
    SolutionNameMin: Cijk_Ailk_Bjlk_HBH_MT64x64x16_SE_FL0_GRVW4_IU2_LDL2_LRVW4_TT4_8_VW4_WG16_8_1_WGM8
    SolutionIndex: 9
    SolutionNameMin: Cijk_Ailk_Bjlk_HBH_MT64x64x16_SE_FL1_GRVW4_IU2_LDL2_LRVW4_TT4_8_VW4_WG16_8_1_WGM1
    SolutionIndex: 10
    SolutionNameMin: Cijk_Ailk_Bjlk_HBH_MT32x64x8_SE_FL0_GRVW4_IU2_LDL2_LRVW4_TT4_4_VW4_WG8_16_1_WGM8
    SolutionIndex: 11
    SolutionNameMin: Cijk_Ailk_Bjlk_HBH_MT32x64x8_SE_FL1_GRVW4_IU2_LDL2_LRVW4_TT4_4_VW4_WG8_16_1_WGM8
    SolutionIndex: 12
    SolutionNameMin: Cijk_Ailk_Bjlk_HBH_MT64x64x8_SE_FL0_GRVW4_IU2_LDL2_LRVW4_TT8_4_VW4_WG8_16_1_WGM8
    SolutionIndex: 13
    SolutionNameMin: Cijk_Ailk_Bjlk_HBH_MT64x64x16_SE_FL0_GRVW4_IU2_LDL2_LRVW4_TT8_4_VW4_WG8_16_1_WGM1
    SolutionIndex: 14
    SolutionNameMin: Cijk_Ailk_Bjlk_HBH_MT64x64x16_SE_FL0_GRVW4_IU2_LDL2_LRVW4_TT8_4_VW4_WG8_16_1_WGM8
    SolutionIndex: 15
    SolutionNameMin: Cijk_Ailk_Bjlk_HBH_MT64x64x8_SE_FL1_GRVW4_IU2_LDL2_LRVW4_TT8_4_VW4_WG8_16_1_WGM8
    SolutionIndex: 16
    SolutionNameMin: Cijk_Ailk_Bjlk_HBH_MT32x64x8_SE_FL0_GRVW4_IU2_LDL2_LRVW4_TT8_4_VW4_WG4_16_1_WGM8
    SolutionIndex: 17
    SolutionNameMin: Cijk_Ailk_Bjlk_HBH_MT64x32x8_SE_FL0_GRVW4_IU2_LDL2_LRVW4_TT4_8_VW4_WG16_4_1_WGM8
    SolutionIndex: 18
    SolutionNameMin: Cijk_Ailk_Bjlk_HBH_MT64x32x8_SE_FL1_GRVW4_IU2_LDL2_LRVW4_TT4_8_VW4_WG16_4_1_WGM1
    SolutionIndex: 19
    SolutionNameMin: Cijk_Ailk_Bjlk_HBH_MT64x32x8_SE_FL1_GRVW4_IU2_LDL2_LRVW4_TT4_8_VW4_WG16_4_1_WGM8
    SolutionIndex: 20
    SolutionNameMin: Cijk_Ailk_Bjlk_HBH_MT64x32x8_SE_FL0_GRVW4_IU2_LDL2_LRVW4_TT8_4_VW4_WG8_8_1_WGM1
    SolutionIndex: 21
    SolutionNameMin: Cijk_Ailk_Bjlk_HBH_MT64x32x8_SE_FL1_GRVW4_IU2_LDL2_LRVW4_TT8_4_VW4_WG8_8_1_WGM1
    SolutionIndex: 22
    SolutionNameMin: Cijk_Ailk_Bjlk_HBH_MT32x64x8_SE_FL0_GRVW4_IU2_LDL2_LRVW4_TT4_8_VW4_WG8_8_1_WGM8
    SolutionIndex: 23
    SolutionNameMin: Cijk_Ailk_Bjlk_HBH_MT32x64x8_SE_FL1_GRVW4_IU2_LDL2_LRVW4_TT4_8_VW4_WG8_8_1_WGM1
    SolutionIndex: 24
    SolutionNameMin: Cijk_Ailk_Bjlk_HBH_MT64x64x8_SE_FL1_GRVW8_IU2_LDL2_LRVW8_TT8_8_VW8_WG8_8_1_WGM8
- - - [1920, 25216, 1, 16384, 1920, 1920, 1920, 25216]
    - [3, 16883.0]
  - - [3840, 1920, 1, 16384, 3840, 3840, 3840, 1920]
    - [4, 15923.0]
  - - [1920, 3840, 1, 16384, 1920, 1920, 1920, 3840]
    - [15, 16110.0]
  - - [960, 1920, 1, 16384, 960, 960, 960, 1920]
    - [24, 14027.0]
  - - [1920, 2880, 1, 16384, 1920, 1920, 1920, 2880]
    - [3, 15606.0]
  - - [1920, 25216, 1, 4096, 1920, 1920, 1920, 25216]
    - [3, 16821.0]
  - - [3840, 1920, 1, 4096, 3840, 3840, 3840, 1920]
    - [12, 16076.0]
  - - [1920, 3840, 1, 4096, 1920, 1920, 1920, 3840]
    - [12, 16003.0]
  - - [960, 1920, 1, 4096, 960, 960, 960, 1920]
    - [24, 13840.0]
  - - [1920, 2880, 1, 4096, 1920, 1920, 1920, 2880]
    - [13, 15517.0]
  - - [1920, 25216, 1, 8192, 1920, 1920, 1920, 25216]
    - [2, 16862.0]
  - - [3840, 1920, 1, 8192, 3840, 3840, 3840, 1920]
    - [15, 16139.0]
  - - [1920, 3840, 1, 8192, 1920, 1920, 1920, 3840]
    - [15, 16109.0]
  - - [960, 1920, 1, 8192, 960, 960, 960, 1920]
    - [24, 13941.0]
  - - [1920, 2880, 1, 8192, 1920, 1920, 1920, 2880]
    - [3, 15568.0]
  - - [2304, 12672, 1, 16384, 2304, 2304, 2304, 12672]
    - [2, 16830.0]
  - - [2304, 2304, 1, 16384, 2304, 2304, 2304, 2304]
    - [4, 15816.0]
  - - [576, 2304, 1, 16384, 576, 576, 576, 2304]
    - [9, 13975.0]
  - - [2304, 1728, 1, 16384, 2304, 2304, 2304, 1728]
    - [8, 14814.0]
  - - [2304, 12672, 1, 4096, 2304, 2304, 2304, 12672]
    - [2, 16756.0]
  - - [2304, 2304, 1, 4096, 2304, 2304, 2304, 2304]
    - [4, 15721.0]
  - - [576, 2304, 1, 4096, 576, 576, 576, 2304]
    - [7, 13752.0]
  - - [2304, 1728, 1, 4096, 2304, 2304, 2304, 1728]
    - [14, 14714.0]
  - - [2304, 12672, 1, 8192, 2304, 2304, 2304, 12672]
    - [3, 16808.0]
  - - [2304, 2304, 1, 8192, 2304, 2304, 2304, 2304]
    - [4, 15784.0]
  - - [576, 2304, 1, 8192, 576, 576, 576, 2304]
    - [9, 13915.0]
  - - [2304, 1728, 1, 8192, 2304, 2304, 2304, 1728]
    - [13, 14805.0]
  - - [3072, 6400, 1, 4096, 3072, 3072, 3072, 6400]
    - [3, 16717.0]
  - - [1536, 3072, 1, 4096, 1536, 1536, 1536, 3072]
    - [3, 15687.0]
  - - [3072, 1536, 1, 4096, 3072, 3072, 3072, 1536]
    - [1, 15682.0]
  - - [3072, 1152, 1, 4096, 3072, 3072, 3072, 1152]
    - [4, 15305.0]
  - - [3072, 6400, 1, 8192, 3072, 3072, 3072, 6400]
    - [3, 16763.0]
  - - [1536, 3072, 1, 8192, 1536, 1536, 1536, 3072]
    - [2, 15752.0]
  - - [3072, 1536, 1, 8192, 3072, 3072, 3072, 1536]
    - [2, 15753.0]
  - - [3072, 1152, 1, 8192, 3072, 3072, 3072, 1152]
    - [4, 15371.0]
  - - [384, 3072, 1, 4096, 384, 384, 384, 3072]
    - [0, 13324.0]
  - - [384, 3072, 1, 8192, 384, 384, 384, 3072]
    - [0, 13388.0]
  - - [96, 1024, 160, 1024, 96, 96, 96, 1024]
    - [22, 14261.0]
  - - [1024, 96, 160, 1024, 1024, 1024, 1024, 96]
    - [17, 14299.0]
  - - [96, 1024, 40, 1024, 96, 96, 96, 1024]
    - [11, 12949.0]
  - - [1024, 96, 40, 1024, 1024, 1024, 1024, 96]
    - [20, 12505.0]
  - - [96, 1024, 80, 1024, 96, 96, 96, 1024]
    - [23, 13596.0]
  - - [1024, 96, 80, 1024, 1024, 1024, 1024, 96]
    - [19, 13611.0]
  - - [96, 1024, 96, 1024, 96, 96, 96, 1024]
    - [23, 13905.0]
  - - [1024, 96, 96, 1024, 1024, 1024, 1024, 96]
    - [18, 13949.0]
  - - [96, 1024, 24, 1024, 96, 96, 96, 1024]
    - [10, 12356.0]
  - - [1024, 96, 24, 1024, 1024, 1024, 1024, 96]
    - [21, 12003.0]
  - - [96, 1024, 48, 1024, 96, 96, 96, 1024]
    - [16, 13187.0]
  - - [1024, 96, 48, 1024, 1024, 1024, 1024, 96]
    - [18, 13248.0]
  - - [96, 1024, 16, 1024, 96, 96, 96, 1024]
    - [11, 11472.0]
  - - [1024, 96, 16, 1024, 1024, 1024, 1024, 96]
    - [6, 11080.0]
  - - [96, 1024, 32, 1024, 96, 96, 96, 1024]
    - [10, 12964.0]
  - - [1024, 96, 32, 1024, 1024, 1024, 1024, 96]
    - [5, 12202.0]
- null
