src/Tensile/data/Configs/miopen/archives/megatron/2021-02-04/exact/vega20_Cijk_Ailk_Bljk_HBH.yaml
- {MinimumRequiredVersion: 4.25.0}
- vega20
- gfx906
- [Device 66a0, Device 66a1, Device 66a7, Device 66af, Vega 20]
    SolutionIndex: 0
    SolutionNameMin: Cijk_Ailk_Bljk_HBH_MT128x64x16_SE_FL0_GRVW4_IU2_LDL2_LRVW4_NLCA1_NLCB1_TT8_4_VW4_WG16_16_1_WGM1
    SolutionIndex: 1
    SolutionNameMin: Cijk_Ailk_Bljk_HBH_MT128x64x16_SE_FL0_GRVW4_IU2_LDL2_LRVW4_NLCA1_NLCB1_TT8_4_VW4_WG16_16_1_WGM8
    SolutionIndex: 2
    SolutionNameMin: Cijk_Ailk_Bljk_HBH_MT128x64x16_SE_FL1_GRVW4_IU2_LDL2_LRVW4_NLCA1_NLCB1_TT8_4_VW4_WG16_16_1_WGM1
    SolutionIndex: 3
    SolutionNameMin: Cijk_Ailk_Bljk_HBH_MT128x64x16_SE_FL1_GRVW4_IU2_LDL2_LRVW4_NLCA1_NLCB1_TT8_4_VW4_WG16_16_1_WGM8
    SolutionIndex: 4
    SolutionNameMin: Cijk_Ailk_Bljk_HBH_MT128x128x16_SE_FL0_GRVW8_IU2_LDL2_LRVW8_NLCA1_NLCB1_TT8_8_VW8_WG16_16_1_WGM1
    SolutionIndex: 5
    SolutionNameMin: Cijk_Ailk_Bljk_HBH_MT128x128x16_SE_FL0_GRVW8_IU2_LDL2_LRVW8_NLCA1_NLCB1_TT8_8_VW8_WG16_16_1_WGM8
    SolutionIndex: 6
    SolutionNameMin: Cijk_Ailk_Bljk_HBH_MT128x128x16_SE_FL1_GRVW8_IU2_LDL2_LRVW8_NLCA1_NLCB1_TT8_8_VW8_WG16_16_1_WGM1
    SolutionIndex: 7
    SolutionNameMin: Cijk_Ailk_Bljk_HBH_MT128x128x16_SE_FL1_GRVW8_IU2_LDL2_LRVW8_NLCA1_NLCB1_TT8_8_VW8_WG16_16_1_WGM8
    SolutionIndex: 8
    SolutionNameMin: Cijk_Ailk_Bljk_HBH_MT128x64x8_SE_FL1_GRVW8_IU2_LDL2_LRVW8_NLCA1_NLCB1_TT8_8_VW8_WG16_8_1_WGM1
    SolutionIndex: 9
    SolutionNameMin: Cijk_Ailk_Bljk_HBH_MT64x64x8_SE_FL0_GRVW4_IU2_LDL2_LRVW4_NLCA1_NLCB1_TT4_8_VW4_WG16_8_1_WGM1
    SolutionIndex: 10
    SolutionNameMin: Cijk_Ailk_Bljk_HBH_MT64x64x8_SE_FL0_GRVW4_IU2_LDL2_LRVW4_NLCA1_NLCB1_TT4_8_VW4_WG16_8_1_WGM8
    SolutionIndex: 11
    SolutionNameMin: Cijk_Ailk_Bljk_HBH_MT64x64x16_SE_FL0_GRVW8_IU2_LDL2_LRVW8_NLCA1_NLCB1_TT8_8_VW8_WG8_8_1_WGM1
    SolutionIndex: 12
    SolutionNameMin: Cijk_Ailk_Bljk_HBH_MT64x64x16_SE_FL0_GRVW8_IU2_LDL2_LRVW8_NLCA1_NLCB1_TT8_8_VW8_WG8_8_1_WGM8
    SolutionIndex: 13
    SolutionNameMin: Cijk_Ailk_Bljk_HBH_MT64x64x8_SE_FL1_GRVW8_IU2_LDL2_LRVW8_NLCA1_NLCB1_TT8_8_VW8_WG8_8_1_WGM8
    SolutionIndex: 14
    SolutionNameMin: Cijk_Ailk_Bljk_HBH_MT64x64x16_SE_FL1_GRVW8_IU2_LDL2_LRVW8_NLCA1_NLCB1_TT8_8_VW8_WG8_8_1_WGM1
    SolutionIndex: 15
    SolutionNameMin: Cijk_Ailk_Bljk_HBH_MT64x48x16_SE_FL1_GRVW2_IU2_LDL2_LRVW2_NLCA1_NLCB1_TT4_6_VW2_WG16_8_1_WGM1
- - - [1024, 1024, 160, 96, 1024, 1024, 1024, 96]
    - [6, 14279.0]
  - - [1024, 1024, 40, 96, 1024, 1024, 1024, 96]
    - [4, 13505.0]
  - - [1024, 1024, 80, 96, 1024, 1024, 1024, 96]
    - [6, 14030.0]
  - - [1024, 1024, 96, 96, 1024, 1024, 1024, 96]
    - [6, 14108.0]
  - - [1024, 1024, 24, 96, 1024, 1024, 1024, 96]
    - [8, 13051.0]
  - - [1024, 1024, 48, 96, 1024, 1024, 1024, 96]
    - [4, 13727.0]
  - - [1024, 1024, 16, 96, 1024, 1024, 1024, 96]
    - [9, 12575.0]
  - - [1024, 1024, 32, 96, 1024, 1024, 1024, 96]
    - [4, 13311.0]
  - - [96, 1024, 160, 1024, 96, 96, 96, 1024]
    - [3, 10700.0]
  - - [96, 1024, 40, 1024, 96, 96, 96, 1024]
    - [3, 9183.0]
  - - [96, 1024, 80, 1024, 96, 96, 96, 1024]
    - [3, 10353.0]
  - - [96, 1024, 96, 1024, 96, 96, 96, 1024]
    - [3, 10292.0]
  - - [96, 1024, 24, 1024, 96, 96, 96, 1024]
    - [0, 8485.0]
  - - [96, 1024, 48, 1024, 96, 96, 96, 1024]
    - [2, 9440.0]
  - - [96, 1024, 16, 1024, 96, 96, 96, 1024]
    - [2, 7342.0]
  - - [96, 1024, 32, 1024, 96, 96, 96, 1024]
    - [1, 9259.0]
  - - [1920, 16384, 1, 25216, 1920, 1920, 1920, 25216]
    - [4, 15576.0]
  - - [3840, 16384, 1, 1920, 3840, 3840, 3840, 1920]
    - [4, 16125.0]
  - - [1920, 16384, 1, 3840, 1920, 1920, 1920, 3840]
    - [5, 15978.0]
  - - [960, 16384, 1, 1920, 960, 960, 960, 1920]
    - [11, 15149.0]
  - - [1920, 16384, 1, 2880, 1920, 1920, 1920, 2880]
    - [5, 16251.0]
  - - [1920, 4096, 1, 25216, 1920, 1920, 1920, 25216]
    - [7, 15166.0]
  - - [3840, 4096, 1, 1920, 3840, 3840, 3840, 1920]
    - [4, 15810.0]
  - - [1920, 4096, 1, 3840, 1920, 1920, 1920, 3840]
    - [7, 15371.0]
  - - [960, 4096, 1, 1920, 960, 960, 960, 1920]
    - [13, 13538.0]
  - - [1920, 4096, 1, 2880, 1920, 1920, 1920, 2880]
    - [5, 15679.0]
  - - [1920, 8192, 1, 25216, 1920, 1920, 1920, 25216]
    - [6, 15368.0]
  - - [3840, 8192, 1, 1920, 3840, 3840, 3840, 1920]
    - [4, 16022.0]
  - - [1920, 8192, 1, 3840, 1920, 1920, 1920, 3840]
    - [7, 15726.0]
  - - [960, 8192, 1, 1920, 960, 960, 960, 1920]
    - [11, 14095.0]
  - - [1920, 8192, 1, 2880, 1920, 1920, 1920, 2880]
    - [7, 16033.0]
  - - [2304, 16384, 1, 12672, 2304, 2304, 2304, 12672]
    - [7, 15851.0]
  - - [2304, 16384, 1, 2304, 2304, 2304, 2304, 2304]
    - [5, 15802.0]
  - - [576, 16384, 1, 2304, 576, 576, 576, 2304]
    - [12, 13874.0]
  - - [2304, 16384, 1, 1728, 2304, 2304, 2304, 1728]
    - [7, 15988.0]
  - - [2304, 4096, 1, 12672, 2304, 2304, 2304, 12672]
    - [5, 15020.0]
  - - [2304, 4096, 1, 2304, 2304, 2304, 2304, 2304]
    - [5, 14911.0]
  - - [576, 4096, 1, 2304, 576, 576, 576, 2304]
    - [10, 12280.0]
  - - [2304, 4096, 1, 1728, 2304, 2304, 2304, 1728]
    - [5, 15105.0]
  - - [2304, 8192, 1, 12672, 2304, 2304, 2304, 12672]
    - [5, 15357.0]
  - - [2304, 8192, 1, 2304, 2304, 2304, 2304, 2304]
    - [5, 15254.0]
  - - [576, 8192, 1, 2304, 576, 576, 576, 2304]
    - [15, 13126.0]
  - - [2304, 8192, 1, 1728, 2304, 2304, 2304, 1728]
    - [7, 15451.0]
  - - [3072, 4096, 1, 6400, 3072, 3072, 3072, 6400]
    - [5, 15476.0]
  - - [1536, 4096, 1, 3072, 1536, 1536, 1536, 3072]
    - [14, 14284.0]
  - - [3072, 4096, 1, 1536, 3072, 3072, 3072, 1536]
    - [4, 15304.0]
  - - [3072, 4096, 1, 1152, 3072, 3072, 3072, 1152]
    - [4, 15208.0]
  - - [3072, 8192, 1, 6400, 3072, 3072, 3072, 6400]
    - [7, 15777.0]
  - - [1536, 8192, 1, 3072, 1536, 1536, 1536, 3072]
    - [5, 15324.0]
  - - [3072, 8192, 1, 1536, 3072, 3072, 3072, 1536]
    - [4, 15545.0]
  - - [3072, 8192, 1, 1152, 3072, 3072, 3072, 1152]
    - [4, 15477.0]
  - - [384, 4096, 1, 3072, 384, 384, 384, 3072]
    - [12, 11548.0]
  - - [384, 8192, 1, 3072, 384, 384, 384, 3072]
    - [1, 13045.0]
- null
