Tensile/Configs/miopen/archives/inception/2019-08-26/exact/vega20_Cijk_Ailk_Bjlk_SB.yaml
- {MinimumRequiredVersion: 4.11.0}
- vega20
- gfx906
- [Device 66a0, Device 66a1, Device 66a7, Vega 20]
    SolutionIndex: 0
    SolutionNameMin: Cijk_Ailk_Bjlk_SB_MT64x64x8_SE_DTL0_EPS1_FL0_GRVW1_PGR1_PLR0_TT4_4_USFGRO1_VW4_WG16_16_1_WGM1
    SolutionIndex: 1
    SolutionNameMin: Cijk_Ailk_Bjlk_SB_MT64x64x8_SE_DTL0_EPS1_FL0_GRVW1_PGR1_PLR0_TT4_4_USFGRO1_VW4_WG16_16_1_WGM8
    SolutionIndex: 2
    SolutionNameMin: Cijk_Ailk_Bjlk_SB_MT64x64x16_SE_DTL0_EPS0_FL0_GRVW1_PGR0_PLR1_TT4_4_USFGRO1_VW4_WG16_16_1_WGM1
    SolutionIndex: 3
    SolutionNameMin: Cijk_Ailk_Bjlk_SB_MT64x64x16_SE_DTL0_EPS1_FL0_GRVW1_PGR1_PLR1_TT4_4_USFGRO1_VW4_WG16_16_1_WGM8
    SolutionIndex: 4
    SolutionNameMin: Cijk_Ailk_Bjlk_SB_MT64x128x8_SE_DTL0_EPS1_FL0_GRVW1_PGR1_PLR1_TT4_8_USFGRO1_VW2_WG16_16_1_WGM8
    SolutionIndex: 5
    SolutionNameMin: Cijk_Ailk_Bjlk_SB_MT64x128x8_SE_DTL0_EPS1_FL0_GRVW1_PGR1_PLR0_TT4_8_USFGRO1_VW4_WG16_16_1_WGM1
    SolutionIndex: 6
    SolutionNameMin: Cijk_Ailk_Bjlk_SB_MT64x128x8_SE_DTL0_EPS1_FL0_GRVW1_PGR1_PLR0_TT4_8_USFGRO1_VW4_WG16_16_1_WGM8
    SolutionIndex: 7
    SolutionNameMin: Cijk_Ailk_Bjlk_SB_MT64x128x8_SE_DTL0_EPS1_FL1_GRVW2_PGR1_PLR0_TT4_8_USFGRO0_VW2_WG16_16_1_WGM8
    SolutionIndex: 8
    SolutionNameMin: Cijk_Ailk_Bjlk_SB_MT64x128x8_SE_DTL0_EPS1_FL1_GRVW2_PGR1_PLR1_TT4_8_USFGRO0_VW2_WG16_16_1_WGM1
    SolutionIndex: 9
    SolutionNameMin: Cijk_Ailk_Bjlk_SB_MT64x128x8_SE_DTL0_EPS1_FL1_GRVW2_PGR1_PLR1_TT4_8_USFGRO0_VW2_WG16_16_1_WGM8
    SolutionIndex: 10
    SolutionNameMin: Cijk_Ailk_Bjlk_SB_MT128x64x16_SE_DTL0_EPS0_FL0_GRVW1_PGR0_PLR1_TT8_4_USFGRO1_VW4_WG16_16_1_WGM1
    SolutionIndex: 11
    SolutionNameMin: Cijk_Ailk_Bjlk_SB_MT64x64x8_SE_DTL0_EPS1_FL0_GRVW4_PGR1_PLR0_TT4_8_USFGRO0_VW4_WG16_8_1_WGM1
    SolutionIndex: 12
    SolutionNameMin: Cijk_Ailk_Bjlk_SB_MT64x64x8_SE_DTL0_EPS1_FL0_GRVW4_PGR1_PLR0_TT4_8_USFGRO0_VW4_WG16_8_1_WGM8
    SolutionIndex: 13
    SolutionNameMin: Cijk_Ailk_Bjlk_SB_MT128x32x8_SE_DTL1_EPS0_FL0_GRVW1_PGR0_PLR1_TT8_4_USFGRO1_VW4_WG16_8_1_WGM8
    SolutionIndex: 14
    SolutionNameMin: Cijk_Ailk_Bjlk_SB_MT64x64x8_SE_DTL0_EPS1_FL0_GRVW4_PGR1_PLR0_TT8_4_USFGRO0_VW4_WG8_16_1_WGM1
    SolutionIndex: 15
    SolutionNameMin: Cijk_Ailk_Bjlk_SB_MT64x64x8_SE_DTL0_EPS1_FL1_GRVW4_PGR1_PLR0_TT8_4_USFGRO0_VW4_WG8_16_1_WGM1
- - - [1001, 2048, 1, 64, 1001, 1001, 1001, 2048]
    - [3, 5714.42]
  - - [5329, 64, 128, 80, 5329, 5329, 5329, 64]
    - [10, 8835.29]
  - - [64, 1280, 128, 448, 64, 64, 64, 1280]
    - [8, 10020.5]
  - - [289, 768, 128, 128, 289, 289, 289, 768]
    - [11, 8542.71]
  - - [1225, 192, 128, 64, 1225, 1225, 1225, 192]
    - [0, 8444.77]
  - - [1225, 288, 128, 48, 1225, 1225, 1225, 288]
    - [13, 7244.66]
  - - [289, 768, 128, 192, 289, 289, 289, 768]
    - [15, 8794.49]
  - - [289, 768, 128, 160, 289, 289, 289, 768]
    - [12, 8705.33]
  - - [64, 2048, 128, 192, 64, 64, 64, 2048]
    - [6, 9780.26]
  - - [64, 1280, 128, 384, 64, 64, 64, 1280]
    - [9, 9950.9]
  - - [1225, 256, 128, 48, 1225, 1225, 1225, 256]
    - [1, 8273.61]
  - - [1225, 192, 128, 48, 1225, 1225, 1225, 192]
    - [1, 8140.32]
  - - [1225, 288, 128, 64, 1225, 1225, 1225, 288]
    - [13, 7886.21]
  - - [64, 1280, 128, 320, 64, 64, 64, 1280]
    - [5, 9894.56]
  - - [1225, 256, 128, 64, 1225, 1225, 1225, 256]
    - [6, 8572.51]
  - - [1001, 2048, 1, 128, 1001, 1001, 1001, 2048]
    - [7, 7289.06]
  - - [1225, 192, 128, 32, 1225, 1225, 1225, 192]
    - [2, 7104.57]
  - - [64, 1280, 128, 192, 64, 64, 64, 1280]
    - [14, 9642.08]
  - - [1001, 1536, 1, 64, 1001, 1001, 1001, 1536]
    - [4, 5146.56]
- null
