Tensile/Configs/miopen/archives/resnet50/2018-09-12/logic/vega20_Cijk_Ailk_Bjlk_HB.yaml
- {MinimumRequiredVersion: 4.3.0}
- vega20
- gfx906
- [Device 66a0, Device 66a7]
    SolutionIndex: 0
    SolutionNameMin: Cijk_Ailk_Bjlk_HB_MT256x256x32_DTL0_GRVW08_GSU05_PGR0_PLR1_TT16_16_VW04_WG16_16_01_WGM08
    SolutionIndex: 1
    SolutionNameMin: Cijk_Ailk_Bjlk_HB_MT032x128x16_DTL0_GRVW08_GSU01_PGR0_PLR1_TT04_04_VW04_WG08_32_01_WGM01
    SolutionIndex: 2
    SolutionNameMin: Cijk_Ailk_Bjlk_HB_MT064x256x08_DTL0_GRVW08_GSU01_PGR1_PLR1_TT08_08_VW08_WG08_32_01_WGM01
    SolutionIndex: 3
    SolutionNameMin: Cijk_Ailk_Bjlk_HB_MT128x064x08_DTL0_GRVW08_GSU01_PGR1_PLR1_TT08_08_VW08_WG16_08_01_WGM01
    SolutionIndex: 4
    SolutionNameMin: Cijk_Ailk_Bjlk_HB_MT032x128x16_DTL0_GRVW08_GSU01_PGR1_PLR1_TT04_04_VW04_WG08_32_01_WGM01
    SolutionIndex: 5
    SolutionNameMin: Cijk_Ailk_Bjlk_HB_MT128x064x16_DTL0_GRVW08_GSU01_PGR0_PLR1_TT08_04_VW04_WG16_16_01_WGM01
    SolutionIndex: 6
    SolutionNameMin: Cijk_Ailk_Bjlk_HB_MT064x128x16_DTL0_GRVW08_GSU01_PGR1_PLR1_TT08_04_VW04_WG08_32_01_WGM01
    SolutionIndex: 7
    SolutionNameMin: Cijk_Ailk_Bjlk_HB_MT128x064x16_DTL0_GRVW08_GSU01_PGR1_PLR1_TT08_04_VW04_WG16_16_01_WGM01
    SolutionIndex: 8
    SolutionNameMin: Cijk_Ailk_Bjlk_HB_MT032x128x16_DTL0_GRVW08_GSU01_PGR0_PLR1_TT04_04_VW04_WG08_32_01_WGM64
- - - [3136, 256, 64, 64]
    - [2, 16074.9]
  - - [784, 512, 64, 128]
    - [2, 15833.4]
  - - [49, 2048, 128, 512]
    - [0, 0.0]
  - - [784, 128, 64, 512]
    - [6, 16500.8]
  - - [196, 1024, 64, 256]
    - [1, 13742.4]
  - - [3136, 64, 128, 64]
    - [3, 14617.2]
  - - [784, 512, 128, 128]
    - [2, 16298.0]
  - - [196, 1024, 128, 256]
    - [8, 14030.9]
  - - [196, 256, 64, 1024]
    - [4, 14105.5]
  - - [3136, 64, 64, 64]
    - [5, 13485.4]
  - - [3136, 64, 64, 256]
    - [7, 16852.6]
  - - [3136, 64, 128, 256]
    - [5, 17346.9]
  - - [784, 128, 128, 512]
    - [6, 16988.5]
  - - [49, 2048, 64, 512]
    - [0, 0.0]
  - - [196, 256, 128, 1024]
    - [4, 14648.5]
  - - [49, 512, 64, 2048]
    - [0, 0.0]
  - - [49, 512, 128, 2048]
    - [0, 0.0]
  - - [3136, 256, 128, 64]
    - [2, 16431.6]
- null
