Tensile/Configs/miopen/Logic/deepbench_gemm/vega10_Cijk_Ailk_Bljk_SB.yaml
- {MinimumRequiredVersion: 4.2.0}
- vega10
- gfx900
- [Device 6863, Device 6862, Device 687f, Device 6860, Device 6861]
    SolutionIndex: 0
    SolutionNameMin: Cijk_Ailk_Bljk_SB_MT032x016x16_NLCB01_PGR0_TT02_02_WGM01
    SolutionIndex: 1
    SolutionNameMin: Cijk_Ailk_Bljk_SB_MT064x128x32_NLCB01_PGR1_TT04_08_WGM08
    SolutionIndex: 2
    SolutionNameMin: Cijk_Ailk_Bljk_SB_MT064x016x16_NLCB01_PGR1_TT02_02_WGM08
    SolutionIndex: 3
    SolutionNameMin: Cijk_Ailk_Bljk_SB_MT032x016x16_NLCB01_PGR1_TT02_02_WGM01
    SolutionIndex: 4
    SolutionNameMin: Cijk_Ailk_Bljk_SB_MT064x016x32_NLCB01_PGR1_TT02_02_WGM01
    SolutionIndex: 5
    SolutionNameMin: Cijk_Ailk_Bljk_SB_MT032x016x16_NLCB01_PGR1_TT02_02_WGM64
    SolutionIndex: 6
    SolutionNameMin: Cijk_Ailk_Bljk_SB_MT064x064x16_NLCB01_PGR1_TT04_04_WGM08
    SolutionIndex: 7
    SolutionNameMin: Cijk_Ailk_Bljk_SB_MT032x016x16_NLCB01_PGR1_TT02_02_WGM01
    SolutionIndex: 8
    SolutionNameMin: Cijk_Ailk_Bljk_SB_MT128x064x16_NLCB01_PGR1_TT08_04_WGM08
    SolutionIndex: 9
    SolutionNameMin: Cijk_Ailk_Bljk_SB_MT128x064x16_NLCB01_PGR1_TT08_04_WGM01
    SolutionIndex: 10
    SolutionNameMin: Cijk_Ailk_Bljk_SB_MT128x032x32_NLCB01_PGR0_TT04_04_WGM64
    SolutionIndex: 11
    SolutionNameMin: Cijk_Ailk_Bljk_SB_MT128x032x16_NLCB01_PGR0_TT04_04_WGM01
    SolutionIndex: 12
    SolutionNameMin: Cijk_Ailk_Bljk_SB_MT128x032x16_NLCB01_PGR1_TT04_04_WGM08
    SolutionIndex: 13
    SolutionNameMin: Cijk_Ailk_Bljk_SB_MT064x064x16_NLCB01_PGR0_TT04_04_WGM08
    SolutionIndex: 14
    SolutionNameMin: Cijk_Ailk_Bljk_SB_MT128x064x16_NLCB01_PGR0_TT08_04_WGM08
    SolutionIndex: 15
    SolutionNameMin: Cijk_Ailk_Bljk_SB_MT032x016x32_NLCB01_PGR1_TT02_02_WGM64
    SolutionIndex: 16
    SolutionNameMin: Cijk_Ailk_Bljk_SB_MT064x032x16_NLCB01_PGR1_TT04_04_WGM08
    SolutionIndex: 17
    SolutionNameMin: Cijk_Ailk_Bljk_SB_MT064x064x16_NLCB01_PGR1_TT04_04_WGM01
    SolutionIndex: 18
    SolutionNameMin: Cijk_Ailk_Bljk_SB_MT128x064x16_NLCB01_PGR1_TT08_04_WGM08
    SolutionIndex: 19
    SolutionNameMin: Cijk_Ailk_Bljk_SB_MT064x016x16_NLCB01_PGR0_TT02_02_WGM01
    SolutionIndex: 20
    SolutionNameMin: Cijk_Ailk_Bljk_SB_MT064x128x16_NLCB01_PGR1_TT04_08_WGM01
    SolutionIndex: 21
    SolutionNameMin: Cijk_Ailk_Bljk_SB_MT128x064x16_NLCB01_PGR0_TT04_08_WGM64
    SolutionIndex: 22
    SolutionNameMin: Cijk_Ailk_Bljk_SB_MT032x016x16_NLCB01_PGR1_TT02_02_WGM08
    SolutionIndex: 23
    SolutionNameMin: Cijk_Ailk_Bljk_SB_MT064x064x16_NLCB01_PGR1_TT04_04_WGM64
    SolutionIndex: 24
    SolutionNameMin: Cijk_Ailk_Bljk_SB_MT032x016x16_NLCB01_PGR1_TT02_02_WGM01
    SolutionIndex: 25
    SolutionNameMin: Cijk_Ailk_Bljk_SB_MT064x016x32_NLCB01_PGR1_TT02_02_WGM64
    SolutionIndex: 26
    SolutionNameMin: Cijk_Ailk_Bljk_SB_MT064x032x16_NLCB01_PGR0_TT04_04_WGM08
    SolutionIndex: 27
    SolutionNameMin: Cijk_Ailk_Bljk_SB_MT128x032x16_NLCB01_PGR0_TT04_04_WGM08
    SolutionIndex: 28
    SolutionNameMin: Cijk_Ailk_Bljk_SB_MT128x032x16_NLCB01_PGR1_TT04_04_WGM08
    SolutionIndex: 29
    SolutionNameMin: Cijk_Ailk_Bljk_SB_MT128x032x16_NLCB01_PGR1_TT04_04_WGM64
    SolutionIndex: 30
    SolutionNameMin: Cijk_Ailk_Bljk_SB_MT032x016x32_NLCB01_PGR1_TT02_02_WGM01
    SolutionIndex: 31
    SolutionNameMin: Cijk_Ailk_Bljk_SB_MT032x016x16_NLCB01_PGR1_TT02_02_WGM08
    SolutionIndex: 32
    SolutionNameMin: Cijk_Ailk_Bljk_SB_MT128x032x16_NLCB01_PGR0_TT04_04_WGM64
    SolutionIndex: 33
    SolutionNameMin: Cijk_Ailk_Bljk_SB_MT064x016x16_NLCB01_PGR0_TT02_02_WGM01
    SolutionIndex: 34
    SolutionNameMin: Cijk_Ailk_Bljk_SB_MT064x016x16_NLCB01_PGR0_TT02_02_WGM01
    SolutionIndex: 35
    SolutionNameMin: Cijk_Ailk_Bljk_SB_MT128x032x16_NLCB01_PGR0_TT04_04_WGM08
    SolutionIndex: 36
    SolutionNameMin: Cijk_Ailk_Bljk_SB_MT128x032x16_NLCB01_PGR0_TT04_04_WGM08
    SolutionIndex: 37
    SolutionNameMin: Cijk_Ailk_Bljk_SB_MT032x016x32_NLCB01_PGR1_TT02_02_WGM64
    SolutionIndex: 38
    SolutionNameMin: Cijk_Ailk_Bljk_SB_MT064x032x16_NLCB01_PGR0_TT04_04_WGM08
    SolutionIndex: 39
    SolutionNameMin: Cijk_Ailk_Bljk_SB_MT128x128x16_NLCB01_PGR1_TT08_08_WGM08
    SolutionIndex: 40
    SolutionNameMin: Cijk_Ailk_Bljk_SB_MT128x128x16_NLCB01_PGR1_TT08_08_WGM01
- - - [8448, 48000, 1, 2816]
    - [39, 11154.7]
  - - [2048, 7000, 1, 2048]
    - [40, 10285.9]
  - - [7680, 64, 1, 2560]
    - [12, 7394.21]
  - - [7680, 128, 1, 2560]
    - [13, 8729.32]
  - - [512, 24000, 1, 2816]
    - [40, 10566.4]
  - - [512, 24000, 1, 2048]
    - [9, 9545.66]
  - - [5124, 9124, 1, 2560]
    - [40, 10456.2]
  - - [1024, 48000, 1, 2560]
    - [39, 10842.0]
  - - [3072, 32, 1, 1024]
    - [28, 3111.09]
  - - [3072, 48000, 1, 1024]
    - [40, 10589.8]
  - - [5124, 9124, 1, 4096]
    - [40, 10390.5]
  - - [5124, 9124, 1, 1760]
    - [39, 10600.0]
  - - [4096, 32, 1, 4096]
    - [10, 5170.95]
  - - [512, 48000, 1, 2560]
    - [40, 10484.7]
  - - [2048, 64, 1, 2048]
    - [23, 4760.14]
  - - [512, 24000, 1, 1536]
    - [40, 10140.4]
  - - [4096, 128, 1, 4096]
    - [21, 8072.25]
  - - [4608, 24000, 1, 1536]
    - [40, 10920.7]
  - - [7680, 48000, 1, 2560]
    - [40, 11069.7]
  - - [2560, 16, 1, 2560]
    - [4, 2756.13]
  - - [512, 16, 1, 512]
    - [34, 453.693]
  - - [3072, 24000, 1, 1024]
    - [40, 10406.0]
  - - [4096, 64, 1, 4096]
    - [38, 6786.14]
  - - [2560, 7000, 1, 2560]
    - [40, 10408.8]
  - - [1760, 7000, 1, 1760]
    - [18, 10103.8]
  - - [3072, 128, 1, 1024]
    - [35, 5849.35]
  - - [1760, 32, 1, 1760]
    - [31, 3125.34]
  - - [8448, 24000, 1, 2816]
    - [39, 11114.2]
  - - [6144, 16, 1, 2048]
    - [24, 2958.3]
  - - [2560, 64, 1, 2560]
    - [29, 5731.88]
  - - [35, 8457, 1, 4096]
    - [20, 1551.31]
  - - [1760, 128, 1, 1760]
    - [6, 6201.96]
  - - [3072, 16, 1, 1024]
    - [22, 2138.29]
  - - [1024, 16, 1, 512]
    - [0, 813.531]
  - - [1024, 24000, 1, 2048]
    - [40, 10409.6]
  - - [4096, 16, 1, 4096]
    - [22, 3099.16]
  - - [1024, 32, 1, 512]
    - [5, 1474.54]
  - - [512, 48000, 1, 2048]
    - [14, 9966.38]
  - - [512, 48000, 1, 1536]
    - [40, 10396.8]
  - - [512, 32, 1, 512]
    - [33, 842.595]
  - - [8448, 32, 1, 2816]
    - [26, 5506.71]
  - - [1024, 8, 1, 500000]
    - [15, 1519.87]
  - - [2048, 128, 1, 2048]
    - [27, 6167.94]
  - - [4608, 16, 1, 1536]
    - [3, 2755.16]
  - - [1024, 24000, 1, 2560]
    - [39, 10577.4]
  - - [5124, 9124, 1, 2048]
    - [40, 10300.7]
  - - [35, 8457, 1, 1760]
    - [20, 2564.13]
  - - [1024, 700, 1, 512]
    - [9, 5375.86]
  - - [2560, 32, 1, 2560]
    - [16, 4324.14]
  - - [2048, 32, 1, 2048]
    - [2, 3444.15]
  - - [8448, 16, 1, 2816]
    - [19, 3049.87]
  - - [6144, 24000, 1, 2048]
    - [40, 10865.1]
  - - [4096, 7000, 1, 4096]
    - [40, 10628.6]
  - - [7680, 24000, 1, 2560]
    - [40, 11045.5]
  - - [6144, 48000, 1, 2048]
    - [40, 10931.4]
  - - [4608, 32, 1, 1536]
    - [27, 4746.64]
  - - [35, 8457, 1, 2560]
    - [20, 2002.93]
  - - [4608, 48000, 1, 1536]
    - [40, 10982.1]
  - - [1024, 48000, 1, 2816]
    - [39, 10988.2]
  - - [3072, 64, 1, 1024]
    - [32, 4702.77]
  - - [512, 48000, 1, 2816]
    - [39, 10713.9]
  - - [2048, 16, 1, 2048]
    - [7, 2341.68]
  - - [1024, 24000, 1, 1536]
    - [39, 10436.7]
  - - [7680, 16, 1, 2560]
    - [25, 3252.63]
  - - [1760, 64, 1, 1760]
    - [17, 4638.57]
  - - [6144, 32, 1, 2048]
    - [36, 5218.61]
  - - [1024, 48000, 1, 1536]
    - [39, 10705.1]
  - - [2560, 128, 1, 2560]
    - [8, 7076.3]
  - - [35, 8457, 1, 2048]
    - [1, 1452.21]
  - - [512, 16, 1, 500000]
    - [30, 1903.46]
  - - [512, 8, 1, 500000]
    - [30, 949.502]
  - - [512, 24000, 1, 2560]
    - [40, 10347.1]
  - - [7680, 32, 1, 2560]
    - [11, 5682.18]
  - - [1024, 48000, 1, 2048]
    - [40, 10727.5]
  - - [1024, 16, 1, 500000]
    - [37, 2679.07]
  - - [1024, 24000, 1, 2816]
    - [39, 10717.1]
- null
