Tensile/Configs/miopen/Logic/deepbench_gemm/vega10_Cijk_Ailk_Bjlk_HB.yaml
- {MinimumRequiredVersion: 4.2.0}
- vega10
- gfx900
- [Device 6863, Device 6862, Device 687f, Device 6860, Device 6861, Device 6864]
    SolutionIndex: 0
    SolutionNameMin: Cijk_Ailk_Bjlk_HB_MT256x128x16_GRVW08_PGR1_PLR1_TT16_08_VW08_WG16_16_01_WGM01
    SolutionIndex: 1
    SolutionNameMin: Cijk_Ailk_Bjlk_HB_MT256x128x16_GRVW08_PGR1_PLR1_TT16_08_VW08_WG16_16_01_WGM08
    SolutionIndex: 2
    SolutionNameMin: Cijk_Ailk_Bjlk_HB_MT064x032x08_GRVW08_PGR1_PLR1_TT04_04_VW04_WG16_08_01_WGM01
    SolutionIndex: 3
    SolutionNameMin: Cijk_Ailk_Bjlk_HB_MT064x032x16_GRVW08_PGR1_PLR1_TT04_04_VW04_WG16_08_01_WGM01
    SolutionIndex: 4
    SolutionNameMin: Cijk_Ailk_Bjlk_HB_MT064x032x16_GRVW02_PGR1_PLR1_TT04_04_VW04_WG16_08_01_WGM01
- - - [1024, 32, 1, 512]
    - [3, 883.621]
  - - [2560, 7133, 1, 2560]
    - [0, 21604.6]
  - - [4096, 7133, 1, 4096]
    - [1, 22441.6]
  - - [512, 32, 1, 512]
    - [2, 433.676]
  - - [3072, 7435, 1, 1024]
    - [1, 20080.2]
  - - [1024, 16, 1, 512]
    - [3, 422.806]
  - - [1760, 7133, 1, 1760]
    - [1, 18916.7]
  - - [2048, 7133, 1, 2048]
    - [1, 21776.0]
  - - [7680, 5481, 1, 2560]
    - [1, 21933.0]
  - - [512, 16, 1, 512]
    - [4, 206.224]
- null
