Tensile/Configs/miopen/Logic/deepbench_gemm/vega10_Cijk_Alik_Bljk_SB.yaml
- {MinimumRequiredVersion: 4.2.0}
- vega10
- gfx900
- [Device 6863, Device 6862, Device 687f, Device 6860, Device 6861]
    SolutionIndex: 0
    SolutionNameMin: Cijk_Alik_Bljk_SB_MT128x128x16_GRVW04_GSU01_PBC0_PGR1_PLR1_TT08_08_USFGRO00_VW04_WG16_16_01_WGM08
    SolutionIndex: 1
    SolutionNameMin: Cijk_Alik_Bljk_SB_MT064x128x32_GRVW04_GSU01_PBC0_PGR1_PLR1_TT04_08_USFGRO00_VW04_WG16_16_01_WGM01
    SolutionIndex: 2
    SolutionNameMin: Cijk_Alik_Bljk_SB_MT128x064x16_GRVW04_GSU01_PBC0_PGR0_PLR1_TT08_04_USFGRO00_VW04_WG16_16_01_WGM01
    SolutionIndex: 3
    SolutionNameMin: Cijk_Alik_Bljk_SB_MT128x128x16_GRVW04_GSU01_PBC0_PGR1_PLR1_TT08_08_USFGRO00_VW04_WG16_16_01_WGM01
    SolutionIndex: 4
    SolutionNameMin: Cijk_Alik_Bljk_SB_MT064x128x16_GRVW04_GSU01_PBC0_PGR1_PLR1_TT04_08_USFGRO00_VW04_WG16_16_01_WGM08
    SolutionIndex: 5
    SolutionNameMin: Cijk_Alik_Bljk_SB_MT064x128x16_GRVW04_GSU01_PBC0_PGR0_PLR1_TT04_08_USFGRO00_VW04_WG16_16_01_WGM01
    SolutionIndex: 6
    SolutionNameMin: Cijk_Alik_Bljk_SB_MT064x128x16_GRVW04_GSU01_PBC0_PGR1_PLR1_TT04_08_USFGRO00_VW04_WG16_16_01_WGM01
    SolutionIndex: 7
    SolutionNameMin: Cijk_Alik_Bljk_SB_MT032x016x32_GRVW04_GSU05_PBC0_PGR0_PLR1_TT02_02_USFGRO00_VW01_WG16_08_01_WGM64
    SolutionIndex: 8
    SolutionNameMin: Cijk_Alik_Bljk_SB_MT064x032x16_GRVW04_GSU03_PBC0_PGR0_PLR0_TT04_04_USFGRO00_VW04_WG16_08_01_WGM01
    SolutionIndex: 9
    SolutionNameMin: Cijk_Alik_Bljk_SB_MT128x032x16_GRVW04_GSU05_PBC0_PGR1_PLR1_TT04_04_USFGRO00_VW01_WG32_08_01_WGM64
    SolutionIndex: 10
    SolutionNameMin: Cijk_Alik_Bljk_SB_MT032x016x32_GRVW04_GSU05_PBC0_PGR1_PLR1_TT02_02_USFGRO00_VW01_WG16_08_01_WGM08
    SolutionIndex: 11
    SolutionNameMin: Cijk_Alik_Bljk_SB_MT064x064x16_GRVW04_GSU05_PBC0_PGR1_PLR1_TT04_04_USFGRO00_VW01_WG16_16_01_WGM08
    SolutionIndex: 12
    SolutionNameMin: Cijk_Alik_Bljk_SB_MT064x064x16_GRVW04_GSU05_PBC0_PGR1_PLR1_TT04_04_USFGRO00_VW01_WG16_16_01_WGM01
    SolutionIndex: 13
    SolutionNameMin: Cijk_Alik_Bljk_SB_MT064x016x32_GRVW04_GSU03_PBC0_PGR1_PLR1_TT02_02_USFGRO00_VW01_WG32_08_01_WGM64
    SolutionIndex: 14
    SolutionNameMin: Cijk_Alik_Bljk_SB_MT128x032x32_GRVW04_GSU03_PBC0_PGR1_PLR1_TT04_04_USFGRO00_VW04_WG32_08_01_WGM01
    SolutionIndex: 15
    SolutionNameMin: Cijk_Alik_Bljk_SB_MT032x016x32_GRVW04_GSU05_PBC0_PGR0_PLR1_TT02_02_USFGRO00_VW01_WG16_08_01_WGM01
    SolutionIndex: 16
    SolutionNameMin: Cijk_Alik_Bljk_SB_MT064x032x16_GRVW04_GSU05_PBC0_PGR1_PLR1_TT04_04_USFGRO00_VW04_WG16_08_01_WGM01
    SolutionIndex: 17
    SolutionNameMin: Cijk_Alik_Bljk_SB_MT064x016x32_GRVW04_GSU03_PBC0_PGR1_PLR1_TT02_02_USFGRO00_VW01_WG32_08_01_WGM08
    SolutionIndex: 18
    SolutionNameMin: Cijk_Alik_Bljk_SB_MT064x016x16_GRVW04_GSU05_PBC0_PGR1_PLR1_TT02_02_USFGRO00_VW01_WG32_08_01_WGM64
    SolutionIndex: 19
    SolutionNameMin: Cijk_Alik_Bljk_SB_MT128x064x16_GRVW04_GSU05_PBC0_PGR1_PLR1_TT04_08_USFGRO00_VW01_WG32_08_01_WGM08
    SolutionIndex: 20
    SolutionNameMin: Cijk_Alik_Bljk_SB_MT032x016x16_GRVW04_GSU05_PBC0_PGR1_PLR1_TT02_02_USFGRO00_VW01_WG16_08_01_WGM08
    SolutionIndex: 21
    SolutionNameMin: Cijk_Alik_Bljk_SB_MT064x064x16_GRVW04_GSU05_PBC0_PGR0_PLR0_TT04_04_USFGRO00_VW01_WG16_16_01_WGM08
    SolutionIndex: 22
    SolutionNameMin: Cijk_Alik_Bljk_SB_MT128x032x32_GRVW04_GSU05_PBC0_PGR0_PLR1_TT04_04_USFGRO00_VW01_WG32_08_01_WGM64
    SolutionIndex: 23
    SolutionNameMin: Cijk_Alik_Bljk_SB_MT064x064x16_GRVW04_GSU05_PBC0_PGR0_PLR1_TT04_04_USFGRO00_VW01_WG16_16_01_WGM64
    SolutionIndex: 24
    SolutionNameMin: Cijk_Alik_Bljk_SB_MT032x016x32_GRVW04_GSU05_PBC0_PGR0_PLR0_TT02_02_USFGRO00_VW01_WG16_08_01_WGM64
    SolutionIndex: 25
    SolutionNameMin: Cijk_Alik_Bljk_SB_MT032x016x32_GRVW04_GSU05_PBC0_PGR1_PLR1_TT02_02_USFGRO00_VW01_WG16_08_01_WGM64
    SolutionIndex: 26
    SolutionNameMin: Cijk_Alik_Bljk_SB_MT064x016x32_GRVW04_GSU05_PBC0_PGR0_PLR0_TT02_02_USFGRO00_VW01_WG32_08_01_WGM64
    SolutionIndex: 27
    SolutionNameMin: Cijk_Alik_Bljk_SB_MT064x064x16_GRVW04_GSU05_PBC0_PGR1_PLR1_TT04_04_USFGRO00_VW01_WG16_16_01_WGM64
    SolutionIndex: 28
    SolutionNameMin: Cijk_Alik_Bljk_SB_MT128x032x32_GRVW04_GSU05_PBC0_PGR0_PLR0_TT04_04_USFGRO00_VW01_WG32_08_01_WGM01
    SolutionIndex: 29
    SolutionNameMin: Cijk_Alik_Bljk_SB_MT032x032x16_GRVW04_GSU05_PBC0_PGR1_PLR1_TT02_02_USFGRO00_VW01_WG16_16_01_WGM01
    SolutionIndex: 30
    SolutionNameMin: Cijk_Alik_Bljk_SB_MT032x032x16_GRVW04_GSU05_PBC0_PGR0_PLR1_TT02_02_USFGRO00_VW01_WG16_16_01_WGM01
    SolutionIndex: 31
    SolutionNameMin: Cijk_Alik_Bljk_SB_MT032x016x32_GRVW04_GSU05_PBC0_PGR1_PLR1_TT02_02_USFGRO00_VW01_WG16_08_01_WGM01
    SolutionIndex: 32
    SolutionNameMin: Cijk_Alik_Bljk_SB_MT064x032x32_GRVW04_GSU05_PBC0_PGR0_PLR1_TT04_04_USFGRO00_VW04_WG16_08_01_WGM64
    SolutionIndex: 33
    SolutionNameMin: Cijk_Alik_Bljk_SB_MT064x064x16_GRVW04_GSU05_PBC0_PGR0_PLR1_TT04_04_USFGRO00_VW01_WG16_16_01_WGM08
    SolutionIndex: 34
    SolutionNameMin: Cijk_Alik_Bljk_SB_MT064x064x16_GRVW04_GSU05_PBC0_PGR0_PLR1_TT04_04_USFGRO00_VW01_WG16_16_01_WGM01
    SolutionIndex: 35
    SolutionNameMin: Cijk_Alik_Bljk_SB_MT032x016x16_GRVW04_GSU05_PBC0_PGR0_PLR1_TT02_02_USFGRO00_VW01_WG16_08_01_WGM01
    SolutionIndex: 36
    SolutionNameMin: Cijk_Alik_Bljk_SB_MT128x032x32_GRVW04_GSU03_PBC0_PGR0_PLR1_TT04_04_USFGRO00_VW01_WG32_08_01_WGM01
- - - [8448, 48000, 1, 2816]
    - [0, 10740.8]
  - - [4096, 7000, 1, 4096]
    - [3, 9291.39]
  - - [7680, 64, 1, 2560]
    - [11, 5108.06]
  - - [7680, 128, 1, 2560]
    - [21, 7239.9]
  - - [2048, 7000, 1, 2048]
    - [5, 8233.64]
  - - [512, 24000, 1, 2048]
    - [2, 8079.6]
  - - [1024, 48000, 1, 2560]
    - [3, 10259.1]
  - - [1760, 32, 1, 1760]
    - [16, 2922.21]
  - - [3072, 48000, 1, 1024]
    - [3, 9368.35]
  - - [5124, 9124, 1, 4096]
    - [0, 9410.81]
  - - [4096, 32, 1, 4096]
    - [32, 2579.28]
  - - [512, 48000, 1, 2816]
    - [0, 10262.4]
  - - [512, 24000, 1, 1536]
    - [0, 9463.89]
  - - [1024, 16, 1, 500000]
    - [10, 2357.9]
  - - [2560, 64, 1, 2560]
    - [12, 4471.65]
  - - [7680, 48000, 1, 2560]
    - [3, 10458.3]
  - - [512, 48000, 1, 2560]
    - [0, 10002.2]
  - - [35, 8457, 1, 1760]
    - [6, 2499.39]
  - - [3072, 24000, 1, 1024]
    - [3, 9117.18]
  - - [2048, 64, 1, 2048]
    - [34, 2872.75]
  - - [2560, 7000, 1, 2560]
    - [0, 9663.63]
  - - [3072, 16, 1, 1024]
    - [15, 959.04]
  - - [2560, 16, 1, 2560]
    - [26, 1654.91]
  - - [3072, 128, 1, 1024]
    - [19, 3648.32]
  - - [5124, 9124, 1, 1760]
    - [0, 10409.1]
  - - [8448, 24000, 1, 2816]
    - [3, 10667.0]
  - - [512, 48000, 1, 2048]
    - [3, 8745.6]
  - - [1024, 24000, 1, 2560]
    - [3, 9955.84]
  - - [512, 24000, 1, 2816]
    - [0, 10142.7]
  - - [1760, 128, 1, 1760]
    - [27, 6034.15]
  - - [2560, 128, 1, 2560]
    - [27, 6102.54]
  - - [1760, 16, 1, 1760]
    - [20, 2008.47]
  - - [1024, 24000, 1, 2048]
    - [3, 8748.95]
  - - [4096, 16, 1, 4096]
    - [24, 1403.79]
  - - [6144, 16, 1, 2048]
    - [30, 1310.08]
  - - [512, 48000, 1, 1536]
    - [3, 9787.23]
  - - [35, 8457, 1, 2048]
    - [1, 1423.83]
  - - [4608, 16, 1, 1536]
    - [28, 1480.01]
  - - [1024, 8, 1, 500000]
    - [31, 1200.1]
  - - [1760, 7000, 1, 1760]
    - [0, 9766.91]
  - - [3072, 32, 1, 1024]
    - [13, 1574.58]
  - - [1024, 700, 1, 512]
    - [4, 4527.05]
  - - [2560, 32, 1, 2560]
    - [14, 2766.48]
  - - [2048, 32, 1, 2048]
    - [18, 1841.35]
  - - [8448, 16, 1, 2816]
    - [35, 1925.37]
  - - [6144, 24000, 1, 2048]
    - [3, 9539.55]
  - - [7680, 24000, 1, 2560]
    - [3, 10371.1]
  - - [6144, 48000, 1, 2048]
    - [5, 9600.23]
  - - [4608, 32, 1, 1536]
    - [22, 2833.6]
  - - [35, 8457, 1, 2560]
    - [6, 1982.07]
  - - [4608, 48000, 1, 1536]
    - [3, 10314.6]
  - - [5124, 9124, 1, 2560]
    - [3, 9795.66]
  - - [3072, 64, 1, 1024]
    - [9, 2583.11]
  - - [4608, 24000, 1, 1536]
    - [3, 10176.4]
  - - [5124, 9124, 1, 2048]
    - [5, 9092.01]
  - - [1024, 24000, 1, 1536]
    - [3, 9662.87]
  - - [7680, 16, 1, 2560]
    - [17, 1738.83]
  - - [4096, 128, 1, 4096]
    - [23, 5584.0]
  - - [1760, 64, 1, 1760]
    - [12, 4439.14]
  - - [6144, 32, 1, 2048]
    - [29, 2462.88]
  - - [1024, 48000, 1, 1536]
    - [3, 10039.8]
  - - [1024, 48000, 1, 2816]
    - [0, 10561.0]
  - - [4096, 64, 1, 4096]
    - [34, 3939.25]
  - - [8448, 32, 1, 2816]
    - [8, 3577.89]
  - - [2048, 16, 1, 2048]
    - [7, 1110.24]
  - - [2048, 128, 1, 2048]
    - [33, 4056.73]
  - - [35, 8457, 1, 4096]
    - [4, 1628.67]
  - - [512, 8, 1, 500000]
    - [25, 770.324]
  - - [512, 24000, 1, 2560]
    - [3, 9893.28]
  - - [7680, 32, 1, 2560]
    - [36, 3396.23]
  - - [1024, 48000, 1, 2048]
    - [3, 9362.69]
  - - [512, 16, 1, 500000]
    - [31, 1510.39]
  - - [1024, 24000, 1, 2816]
    - [0, 10271.0]
- null
