Tensile/Configs/miopen/Logic/deepbench_gemm/vega10_Cijk_Alik_Bljk_HB.yaml
- {MinimumRequiredVersion: 4.2.0}
- vega10
- gfx900
- [Device 6863, Device 6862, Device 687f, Device 6860, Device 6861, Device 6864]
    SolutionIndex: 0
    SolutionNameMin: Cijk_Alik_Bljk_HB_MT256x128x32_GRVW08_LPB00_PGR0_PLR1_TT16_08_VW08_WG16_16_01_WGM08
    SolutionIndex: 1
    SolutionNameMin: Cijk_Alik_Bljk_HB_MT256x128x32_GRVW08_LPB00_PGR0_PLR1_TT16_08_VW08_WG16_16_01_WGM01
    SolutionIndex: 2
    SolutionNameMin: Cijk_Alik_Bljk_HB_MT128x256x16_GRVW08_LPB00_PGR1_PLR1_TT08_16_VW08_WG16_16_01_WGM01
    SolutionIndex: 3
    SolutionNameMin: Cijk_Alik_Bljk_HB_MT128x256x32_GRVW08_LPB00_PGR1_PLR1_TT08_16_VW08_WG16_16_01_WGM01
    SolutionIndex: 4
    SolutionNameMin: Cijk_Alik_Bljk_HB_MT128x256x16_GRVW08_LPB00_PGR0_PLR1_TT08_16_VW08_WG16_16_01_WGM08
    SolutionIndex: 5
    SolutionNameMin: Cijk_Alik_Bljk_HB_MT256x128x16_GRVW08_LPB00_PGR1_PLR1_TT16_08_VW08_WG16_16_01_WGM01
    SolutionIndex: 6
    SolutionNameMin: Cijk_Alik_Bljk_HB_MT128x256x16_GRVW08_LPB00_PGR1_PLR1_TT08_16_VW08_WG16_16_01_WGM08
    SolutionIndex: 7
    SolutionNameMin: Cijk_Alik_Bljk_HB_MT128x256x32_GRVW08_LPB00_PGR1_PLR1_TT08_16_VW08_WG16_16_01_WGM08
    SolutionIndex: 8
    SolutionNameMin: Cijk_Alik_Bljk_HB_MT128x256x32_GRVW08_LPB00_PGR0_PLR1_TT08_16_VW08_WG16_16_01_WGM08
    SolutionIndex: 9
    SolutionNameMin: Cijk_Alik_Bljk_HB_MT128x256x32_GRVW08_LPB00_PGR0_PLR1_TT08_16_VW08_WG16_16_01_WGM01
    SolutionIndex: 10
    SolutionNameMin: Cijk_Alik_Bljk_HB_MT256x128x16_GRVW08_LPB00_PGR1_PLR1_TT16_08_VW08_WG16_16_01_WGM08
    SolutionIndex: 11
    SolutionNameMin: Cijk_Alik_Bljk_HB_MT064x032x32_GRVW08_LPB04_PGR1_PLR1_TT04_04_VW04_WG16_08_01_WGM01
    SolutionIndex: 12
    SolutionNameMin: Cijk_Alik_Bljk_HB_MT064x064x32_GRVW08_LPB04_PGR1_PLR1_TT04_04_VW04_WG16_16_01_WGM64
    SolutionIndex: 13
    SolutionNameMin: Cijk_Alik_Bljk_HB_MT128x032x32_GRVW08_LPB04_PGR1_PLR1_TT04_04_VW04_WG32_08_01_WGM08
    SolutionIndex: 14
    SolutionNameMin: Cijk_Alik_Bljk_HB_MT128x032x32_GRVW08_LPB04_PGR1_PLR1_TT04_04_VW04_WG32_08_01_WGM01
    SolutionIndex: 15
    SolutionNameMin: Cijk_Alik_Bljk_HB_MT064x032x16_GRVW08_LPB04_PGR1_PLR1_TT04_04_VW04_WG16_08_01_WGM08
    SolutionIndex: 16
    SolutionNameMin: Cijk_Alik_Bljk_HB_MT064x032x16_GRVW08_LPB04_PGR1_PLR1_TT04_04_VW04_WG16_08_01_WGM01
    SolutionIndex: 17
    SolutionNameMin: Cijk_Alik_Bljk_HB_MT064x032x32_GRVW08_LPB04_PGR1_PLR1_TT04_04_VW04_WG16_08_01_WGM08
    SolutionIndex: 18
    SolutionNameMin: Cijk_Alik_Bljk_HB_MT064x064x32_GRVW08_LPB04_PGR1_PLR1_TT04_04_VW04_WG16_16_01_WGM08
    SolutionIndex: 19
    SolutionNameMin: Cijk_Alik_Bljk_HB_MT064x064x32_GRVW08_LPB04_PGR1_PLR1_TT04_04_VW04_WG16_16_01_WGM01
    SolutionIndex: 20
    SolutionNameMin: Cijk_Alik_Bljk_HB_MT064x128x32_GRVW08_LPB00_PGR1_PLR1_TT08_04_VW04_WG08_32_01_WGM64
    SolutionIndex: 21
    SolutionNameMin: Cijk_Alik_Bljk_HB_MT032x128x32_GRVW08_LPB04_PGR1_PLR1_TT04_04_VW04_WG08_32_01_WGM64
    SolutionIndex: 22
    SolutionNameMin: Cijk_Alik_Bljk_HB_MT064x128x32_GRVW08_LPB04_PGR1_PLR1_TT08_04_VW04_WG08_32_01_WGM01
    SolutionIndex: 23
    SolutionNameMin: Cijk_Alik_Bljk_HB_MT064x032x32_GRVW08_LPB00_PGR1_PLR1_TT04_04_VW04_WG16_08_01_WGM01
    SolutionIndex: 24
    SolutionNameMin: Cijk_Alik_Bljk_HB_MT064x032x32_GRVW08_LPB00_PGR1_PLR1_TT04_04_VW04_WG16_08_01_WGM64
    SolutionIndex: 25
    SolutionNameMin: Cijk_Alik_Bljk_HB_MT064x032x32_GRVW08_LPB04_PGR1_PLR1_TT04_04_VW04_WG16_08_01_WGM64
- - - [8448, 48000, 1, 2816]
    - [6, 21323.8]
  - - [4096, 7000, 1, 4096]
    - [9, 16323.1]
  - - [7680, 64, 1, 2560]
    - [25, 8556.23]
  - - [7680, 128, 1, 2560]
    - [22, 12447.6]
  - - [2048, 7000, 1, 2048]
    - [1, 12232.4]
  - - [512, 24000, 1, 2048]
    - [1, 12524.8]
  - - [1024, 48000, 1, 2560]
    - [10, 19024.7]
  - - [1760, 32, 1, 1760]
    - [16, 1858.53]
  - - [3072, 48000, 1, 1024]
    - [2, 18734.6]
  - - [5124, 9124, 1, 4096]
    - [9, 16888.7]
  - - [4096, 32, 1, 4096]
    - [12, 2417.41]
  - - [512, 48000, 1, 2816]
    - [10, 20045.1]
  - - [512, 24000, 1, 1536]
    - [1, 17628.5]
  - - [1024, 16, 1, 500000]
    - [11, 566.097]
  - - [2560, 64, 1, 2560]
    - [19, 4568.62]
  - - [7680, 48000, 1, 2560]
    - [2, 21077.5]
  - - [512, 48000, 1, 2560]
    - [10, 18948.3]
  - - [35, 8457, 1, 1760]
    - [6, 2311.68]
  - - [3072, 24000, 1, 1024]
    - [9, 17456.9]
  - - [2048, 64, 1, 2048]
    - [17, 2552.26]
  - - [2560, 7000, 1, 2560]
    - [6, 17814.7]
  - - [3072, 16, 1, 1024]
    - [18, 932.507]
  - - [2560, 16, 1, 2560]
    - [23, 1166.56]
  - - [3072, 128, 1, 1024]
    - [12, 6419.69]
  - - [5124, 9124, 1, 1760]
    - [10, 20427.8]
  - - [8448, 24000, 1, 2816]
    - [6, 21343.2]
  - - [512, 48000, 1, 2048]
    - [0, 15949.5]
  - - [1024, 24000, 1, 2560]
    - [1, 18432.4]
  - - [512, 24000, 1, 2816]
    - [10, 19442.0]
  - - [1760, 128, 1, 1760]
    - [18, 6758.19]
  - - [2560, 128, 1, 2560]
    - [25, 7461.22]
  - - [1760, 16, 1, 1760]
    - [15, 919.45]
  - - [1024, 24000, 1, 2048]
    - [9, 14922.8]
  - - [4096, 16, 1, 4096]
    - [19, 1269.69]
  - - [6144, 16, 1, 2048]
    - [19, 1108.49]
  - - [512, 48000, 1, 1536]
    - [1, 18246.0]
  - - [35, 8457, 1, 2048]
    - [7, 1365.45]
  - - [4608, 16, 1, 1536]
    - [11, 1512.33]
  - - [1024, 8, 1, 500000]
    - [11, 288.02]
  - - [1760, 7000, 1, 1760]
    - [2, 17836.4]
  - - [3072, 32, 1, 1024]
    - [19, 1847.97]
  - - [1024, 700, 1, 512]
    - [4, 3720.87]
  - - [2560, 32, 1, 2560]
    - [24, 2329.42]
  - - [2048, 32, 1, 2048]
    - [21, 1405.36]
  - - [8448, 16, 1, 2816]
    - [25, 2908.98]
  - - [6144, 24000, 1, 2048]
    - [8, 17698.7]
  - - [7680, 24000, 1, 2560]
    - [2, 20696.0]
  - - [6144, 48000, 1, 2048]
    - [0, 18217.2]
  - - [4608, 32, 1, 1536]
    - [17, 2987.77]
  - - [35, 8457, 1, 2560]
    - [3, 2126.44]
  - - [4608, 48000, 1, 1536]
    - [2, 19740.5]
  - - [5124, 9124, 1, 2560]
    - [2, 19619.9]
  - - [3072, 64, 1, 1024]
    - [17, 3521.25]
  - - [4608, 24000, 1, 1536]
    - [9, 18982.5]
  - - [5124, 9124, 1, 2048]
    - [9, 16293.7]
  - - [1024, 24000, 1, 1536]
    - [8, 18045.0]
  - - [7680, 16, 1, 2560]
    - [14, 2308.75]
  - - [4096, 128, 1, 4096]
    - [20, 6252.23]
  - - [1760, 64, 1, 1760]
    - [16, 3592.48]
  - - [6144, 32, 1, 2048]
    - [19, 2146.39]
  - - [1024, 48000, 1, 1536]
    - [1, 18404.8]
  - - [1024, 48000, 1, 2816]
    - [6, 20302.5]
  - - [4096, 64, 1, 4096]
    - [12, 4408.51]
  - - [8448, 32, 1, 2816]
    - [25, 5767.8]
  - - [2048, 16, 1, 2048]
    - [21, 785.106]
  - - [2048, 128, 1, 2048]
    - [19, 4203.54]
  - - [35, 8457, 1, 4096]
    - [7, 1473.8]
  - - [512, 8, 1, 500000]
    - [12, 143.64]
  - - [512, 24000, 1, 2560]
    - [5, 18004.7]
  - - [7680, 32, 1, 2560]
    - [13, 4441.34]
  - - [1024, 48000, 1, 2048]
    - [1, 16556.1]
  - - [512, 16, 1, 500000]
    - [25, 282.998]
  - - [1024, 24000, 1, 2816]
    - [6, 20176.8]
- null
