Tensile/Configs/miopen/Logic/deepbench_gemm/vega10_Cijk_Ailk_Bljk_HB.yaml
- {MinimumRequiredVersion: 4.2.0}
- vega10
- gfx900
- [Device 6863, Device 6862, Device 687f, Device 6860, Device 6861, Device 6864]
    SolutionIndex: 0
    SolutionNameMin: Cijk_Ailk_Bljk_HB_MT064x032x16_NLCB01_PGR1_TT04_04_WGM01
    SolutionIndex: 1
    SolutionNameMin: Cijk_Ailk_Bljk_HB_MT128x032x32_NLCB01_PGR1_TT04_04_WGM08
    SolutionIndex: 2
    SolutionNameMin: Cijk_Ailk_Bljk_HB_MT128x032x32_NLCB01_PGR1_TT04_04_WGM64
    SolutionIndex: 3
    SolutionNameMin: Cijk_Ailk_Bljk_HB_MT064x064x32_NLCB01_PGR1_TT04_04_WGM01
    SolutionIndex: 4
    SolutionNameMin: Cijk_Ailk_Bljk_HB_MT128x032x16_NLCB01_PGR1_TT04_04_WGM64
    SolutionIndex: 5
    SolutionNameMin: Cijk_Ailk_Bljk_HB_MT128x032x16_NLCB01_PGR1_TT04_04_WGM01
    SolutionIndex: 6
    SolutionNameMin: Cijk_Ailk_Bljk_HB_MT064x032x16_NLCB01_PGR1_TT04_04_WGM08
    SolutionIndex: 7
    SolutionNameMin: Cijk_Ailk_Bljk_HB_MT064x032x16_NLCB01_PGR1_TT04_04_WGM08
    SolutionIndex: 8
    SolutionNameMin: Cijk_Ailk_Bljk_HB_MT064x032x32_NLCB01_PGR1_TT04_04_WGM01
    SolutionIndex: 9
    SolutionNameMin: Cijk_Ailk_Bljk_HB_MT128x032x16_NLCB01_PGR1_TT04_04_WGM08
    SolutionIndex: 10
    SolutionNameMin: Cijk_Ailk_Bljk_HB_MT128x032x32_NLCB01_PGR1_TT04_04_WGM01
    SolutionIndex: 11
    SolutionNameMin: Cijk_Ailk_Bljk_HB_MT064x032x32_NLCB01_PGR1_TT04_04_WGM64
    SolutionIndex: 12
    SolutionNameMin: Cijk_Ailk_Bljk_HB_MT064x032x32_NLCB01_PGR1_TT04_04_WGM08
    SolutionIndex: 13
    SolutionNameMin: Cijk_Ailk_Bljk_HB_MT256x128x16_NLCB01_PGR0_TT16_08_WGM08
    SolutionIndex: 14
    SolutionNameMin: Cijk_Ailk_Bljk_HB_MT128x256x32_NLCB01_PGR1_TT08_16_WGM01
    SolutionIndex: 15
    SolutionNameMin: Cijk_Ailk_Bljk_HB_MT256x128x16_NLCB01_PGR0_TT16_08_WGM01
    SolutionIndex: 16
    SolutionNameMin: Cijk_Ailk_Bljk_HB_MT256x128x32_NLCB01_PGR0_TT16_08_WGM08
    SolutionIndex: 17
    SolutionNameMin: Cijk_Ailk_Bljk_HB_MT128x256x32_NLCB01_PGR0_TT08_16_WGM01
    SolutionIndex: 18
    SolutionNameMin: Cijk_Ailk_Bljk_HB_MT256x128x32_NLCB01_PGR0_TT16_08_WGM01
    SolutionIndex: 19
    SolutionNameMin: Cijk_Ailk_Bljk_HB_MT256x128x16_NLCB01_PGR1_TT16_08_WGM01
    SolutionIndex: 20
    SolutionNameMin: Cijk_Ailk_Bljk_HB_MT128x256x16_NLCB01_PGR1_TT08_16_WGM01
    SolutionIndex: 21
    SolutionNameMin: Cijk_Ailk_Bljk_HB_MT256x128x16_NLCB01_PGR1_TT16_08_WGM08
- - - [8448, 48000, 1, 2816]
    - [19, 22313.2]
  - - [2048, 7000, 1, 2048]
    - [16, 19639.8]
  - - [7680, 64, 1, 2560]
    - [9, 12665.9]
  - - [7680, 128, 1, 2560]
    - [4, 15617.2]
  - - [512, 24000, 1, 2816]
    - [21, 20778.6]
  - - [512, 24000, 1, 2048]
    - [18, 16320.2]
  - - [5124, 9124, 1, 2560]
    - [19, 20612.0]
  - - [1024, 48000, 1, 2560]
    - [21, 21403.5]
  - - [3072, 32, 1, 1024]
    - [7, 3037.63]
  - - [3072, 48000, 1, 1024]
    - [15, 21129.6]
  - - [5124, 9124, 1, 4096]
    - [19, 20089.5]
  - - [5124, 9124, 1, 1760]
    - [21, 21212.7]
  - - [4096, 32, 1, 4096]
    - [8, 4986.5]
  - - [512, 48000, 1, 2560]
    - [21, 20979.7]
  - - [2048, 64, 1, 2048]
    - [8, 4597.81]
  - - [512, 24000, 1, 1536]
    - [21, 20142.3]
  - - [4096, 128, 1, 4096]
    - [1, 13505.5]
  - - [4608, 24000, 1, 1536]
    - [21, 21924.4]
  - - [7680, 48000, 1, 2560]
    - [21, 22291.4]
  - - [2560, 16, 1, 2560]
    - [11, 1495.46]
  - - [512, 16, 1, 512]
    - [0, 213.699]
  - - [3072, 24000, 1, 1024]
    - [19, 20830.7]
  - - [4096, 64, 1, 4096]
    - [2, 9150.96]
  - - [2560, 7000, 1, 2560]
    - [21, 20640.1]
  - - [1760, 7000, 1, 1760]
    - [21, 18822.9]
  - - [3072, 128, 1, 1024]
    - [4, 9251.9]
  - - [1760, 32, 1, 1760]
    - [8, 1935.96]
  - - [8448, 24000, 1, 2816]
    - [21, 22244.0]
  - - [6144, 16, 1, 2048]
    - [1, 3295.8]
  - - [2560, 64, 1, 2560]
    - [4, 5687.63]
  - - [35, 8457, 1, 4096]
    - [14, 1621.7]
  - - [1760, 128, 1, 1760]
    - [3, 7336.26]
  - - [3072, 16, 1, 1024]
    - [0, 1505.9]
  - - [1024, 16, 1, 512]
    - [0, 424.325]
  - - [1024, 24000, 1, 2048]
    - [16, 19901.9]
  - - [4096, 16, 1, 4096]
    - [8, 2521.57]
  - - [1024, 32, 1, 512]
    - [0, 900.467]
  - - [512, 48000, 1, 2048]
    - [18, 18370.8]
  - - [512, 48000, 1, 1536]
    - [21, 20769.6]
  - - [512, 32, 1, 512]
    - [6, 445.142]
  - - [8448, 32, 1, 2816]
    - [5, 7194.28]
  - - [1024, 8, 1, 500000]
    - [8, 349.148]
  - - [2048, 128, 1, 2048]
    - [9, 8463.66]
  - - [4608, 16, 1, 1536]
    - [4, 2387.54]
  - - [1024, 24000, 1, 2560]
    - [21, 21057.6]
  - - [1760, 16, 1, 1760]
    - [8, 977.482]
  - - [5124, 9124, 1, 2048]
    - [19, 19746.1]
  - - [35, 8457, 1, 1760]
    - [20, 2324.14]
  - - [1024, 700, 1, 512]
    - [13, 4293.55]
  - - [2560, 32, 1, 2560]
    - [8, 3081.54]
  - - [2048, 32, 1, 2048]
    - [8, 2392.12]
  - - [8448, 16, 1, 2816]
    - [0, 3621.47]
  - - [6144, 24000, 1, 2048]
    - [19, 21482.0]
  - - [4096, 7000, 1, 4096]
    - [18, 20579.8]
  - - [7680, 24000, 1, 2560]
    - [19, 21960.6]
  - - [6144, 48000, 1, 2048]
    - [19, 21546.2]
  - - [4608, 32, 1, 1536]
    - [4, 4877.45]
  - - [35, 8457, 1, 2560]
    - [14, 2092.2]
  - - [4608, 48000, 1, 1536]
    - [21, 22060.5]
  - - [1024, 48000, 1, 2816]
    - [21, 21477.0]
  - - [3072, 64, 1, 1024]
    - [5, 5998.03]
  - - [512, 48000, 1, 2816]
    - [21, 21184.8]
  - - [2048, 16, 1, 2048]
    - [12, 1160.75]
  - - [1024, 24000, 1, 1536]
    - [21, 20573.2]
  - - [7680, 16, 1, 2560]
    - [10, 4216.95]
  - - [1760, 64, 1, 1760]
    - [12, 3861.2]
  - - [6144, 32, 1, 2048]
    - [4, 6354.81]
  - - [1024, 48000, 1, 1536]
    - [21, 21063.4]
  - - [2560, 128, 1, 2560]
    - [11, 8796.59]
  - - [35, 8457, 1, 2048]
    - [17, 1365.22]
  - - [512, 16, 1, 500000]
    - [12, 349.426]
  - - [512, 8, 1, 500000]
    - [8, 174.341]
  - - [512, 24000, 1, 2560]
    - [21, 20547.1]
  - - [7680, 32, 1, 2560]
    - [5, 8338.5]
  - - [1024, 48000, 1, 2048]
    - [18, 20443.1]
  - - [1024, 16, 1, 500000]
    - [12, 698.258]
  - - [1024, 24000, 1, 2816]
    - [21, 21239.4]
- null
