Tensile/Configs/miopen/Logic/deepbench_gemm/vega10_Cijk_Ailk_Bjlk_SB.yaml
- {MinimumRequiredVersion: 4.2.0}
- vega10
- gfx900
- [Device 6863, Device 6862, Device 687f, Device 6860, Device 6861, Device 6864]
    SolutionIndex: 0
    SolutionNameMin: Cijk_Ailk_Bjlk_SB_MT128x064x16_DTL0_GRVW04_GSU01_PBC0_PGR1_PLR1_TT08_04_USFGRO00_VW04_WG16_16_01_WGM01
    SolutionIndex: 1
    SolutionNameMin: Cijk_Ailk_Bjlk_SB_MT128x128x16_DTL0_GRVW04_GSU01_PBC0_PGR1_PLR1_TT08_08_USFGRO00_VW04_WG16_16_01_WGM08
    SolutionIndex: 2
    SolutionNameMin: Cijk_Ailk_Bjlk_SB_MT128x128x16_DTL0_GRVW04_GSU01_PBC0_PGR1_PLR1_TT08_08_USFGRO00_VW04_WG16_16_01_WGM01
    SolutionIndex: 3
    SolutionNameMin: Cijk_Ailk_Bjlk_SB_MT064x128x16_DTL0_GRVW04_GSU01_PBC0_PGR1_PLR1_TT04_08_USFGRO00_VW04_WG16_16_01_WGM01
    SolutionIndex: 4
    SolutionNameMin: Cijk_Ailk_Bjlk_SB_MT064x016x16_DTL0_GRVW01_GSU05_PBC1_PGR0_PLR1_TT02_02_USFGRO01_VW01_WG32_08_01_WGM01
    SolutionIndex: 5
    SolutionNameMin: Cijk_Ailk_Bjlk_SB_MT032x032x32_DTL0_GRVW04_GSU05_PBC0_PGR0_PLR1_TT02_02_USFGRO00_VW01_WG16_16_01_WGM01
    SolutionIndex: 6
    SolutionNameMin: Cijk_Ailk_Bjlk_SB_MT032x032x32_DTL0_GRVW01_GSU05_PBC1_PGR0_PLR1_TT02_02_USFGRO01_VW01_WG16_16_01_WGM01
    SolutionIndex: 7
    SolutionNameMin: Cijk_Ailk_Bjlk_SB_MT032x016x16_DTL0_GRVW01_GSU05_PBC1_PGR0_PLR1_TT02_02_USFGRO01_VW01_WG16_08_01_WGM01
- - - [1024, 32, 1, 512]
    - [6, 1502.69]
  - - [2560, 7133, 1, 2560]
    - [1, 11108.6]
  - - [4096, 7133, 1, 4096]
    - [2, 11467.9]
  - - [512, 32, 1, 512]
    - [7, 880.328]
  - - [3072, 7435, 1, 1024]
    - [0, 10770.0]
  - - [1024, 16, 1, 512]
    - [5, 786.404]
  - - [1760, 7133, 1, 1760]
    - [3, 10526.4]
  - - [2048, 7133, 1, 2048]
    - [2, 11274.0]
  - - [7680, 5481, 1, 2560]
    - [1, 11338.4]
  - - [512, 16, 1, 512]
    - [4, 433.676]
- null
