test_dir/py38/lib/python3.6/site-packages/Tensile/Configs/miopen/archives/rnn/2019-05-29/vega20_Cijk_Ailk_Bljk_SB.yaml
- {MinimumRequiredVersion: 4.9.6}
- vega20
- gfx906
- [Device 66a0, Device 66a1, Device 66a7, Vega 20]
    SolutionIndex: 0
    SolutionNameMin: Cijk_Ailk_Bljk_SB_MT64x64x16_SE_EPS1_FL0_GRVW4_GSU1_LPB0_PGR1_PLR1_TT4_4_USFGRO0_WG16_16_1_WGM8
    SolutionIndex: 1
    SolutionNameMin: Cijk_Ailk_Bljk_SB_MT64x64x16_SE_EPS1_FL1_GRVW4_GSU1_LPB0_PGR1_PLR1_TT4_4_USFGRO0_WG16_16_1_WGM8
    SolutionIndex: 2
    SolutionNameMin: Cijk_Ailk_Bljk_SB_MT96x64x8_SE_EPS1_FL1_GRVW2_GSU1_LPB0_PGR1_PLR0_TT6_4_USFGRO0_WG16_16_1_WGM1
    SolutionIndex: 3
    SolutionNameMin: Cijk_Ailk_Bljk_SB_MT96x64x8_SE_EPS1_FL1_GRVW2_GSU1_LPB0_PGR1_PLR0_TT6_4_USFGRO0_WG16_16_1_WGM8
    SolutionIndex: 4
    SolutionNameMin: Cijk_Ailk_Bljk_SB_MT96x64x8_SE_EPS1_FL1_GRVW2_GSU1_LPB0_PGR1_PLR1_TT6_4_USFGRO0_WG16_16_1_WGM1
    SolutionIndex: 5
    SolutionNameMin: Cijk_Ailk_Bljk_SB_MT96x64x8_SE_EPS1_FL1_GRVW2_GSU1_LPB0_PGR1_PLR1_TT6_4_USFGRO0_WG16_16_1_WGM8
    SolutionIndex: 6
    SolutionNameMin: Cijk_Ailk_Bljk_SB_MT64x96x16_SE_EPS1_FL0_GRVW2_GSU1_LPB0_PGR1_PLR1_TT4_6_USFGRO0_WG16_16_1_WGM1
    SolutionIndex: 7
    SolutionNameMin: Cijk_Ailk_Bljk_SB_MT64x96x8_SE_EPS1_FL1_GRVW4_GSU1_LPB0_PGR1_PLR1_TT4_6_USFGRO0_WG16_16_1_WGM8
    SolutionIndex: 8
    SolutionNameMin: Cijk_Ailk_Bljk_SB_MT128x64x8_SE_EPS1_FL0_GRVW1_GSU1_LPB0_PGR1_PLR1_TT8_4_USFGRO1_WG16_16_1_WGM8
    SolutionIndex: 9
    SolutionNameMin: Cijk_Ailk_Bljk_SB_MT128x64x8_SE_EPS1_FL0_GRVW2_GSU1_LPB0_PGR1_PLR0_TT8_4_USFGRO0_WG16_16_1_WGM8
    SolutionIndex: 10
    SolutionNameMin: Cijk_Ailk_Bljk_SB_MT128x64x8_SE_EPS1_FL0_GRVW2_GSU1_LPB0_PGR1_PLR1_TT8_4_USFGRO0_WG16_16_1_WGM8
    SolutionIndex: 11
    SolutionNameMin: Cijk_Ailk_Bljk_SB_MT128x64x8_SE_EPS1_FL0_GRVW4_GSU1_LPB0_PGR1_PLR0_TT8_4_USFGRO0_WG16_16_1_WGM8
    SolutionIndex: 12
    SolutionNameMin: Cijk_Ailk_Bljk_SB_MT128x64x8_SE_EPS1_FL0_GRVW4_GSU1_LPB0_PGR1_PLR1_TT8_4_USFGRO0_WG16_16_1_WGM1
    SolutionIndex: 13
    SolutionNameMin: Cijk_Ailk_Bljk_SB_MT128x64x8_SE_EPS1_FL0_GRVW4_GSU1_LPB0_PGR1_PLR1_TT8_4_USFGRO0_WG16_16_1_WGM8
    SolutionIndex: 14
    SolutionNameMin: Cijk_Ailk_Bljk_SB_MT128x64x16_SE_EPS1_FL0_GRVW4_GSU1_LPB0_PGR1_PLR1_TT8_4_USFGRO0_WG16_16_1_WGM1
    SolutionIndex: 15
    SolutionNameMin: Cijk_Ailk_Bljk_SB_MT128x64x8_SE_EPS1_FL1_GRVW2_GSU1_LPB0_PGR1_PLR0_TT8_4_USFGRO0_WG16_16_1_WGM8
    SolutionIndex: 16
    SolutionNameMin: Cijk_Ailk_Bljk_SB_MT128x64x8_SE_EPS1_FL1_GRVW2_GSU1_LPB0_PGR1_PLR1_TT8_4_USFGRO0_WG16_16_1_WGM8
    SolutionIndex: 17
    SolutionNameMin: Cijk_Ailk_Bljk_SB_MT128x64x8_SE_EPS1_FL1_GRVW4_GSU1_LPB0_PGR1_PLR0_TT8_4_USFGRO0_WG16_16_1_WGM1
    SolutionIndex: 18
    SolutionNameMin: Cijk_Ailk_Bljk_SB_MT128x64x8_SE_EPS1_FL1_GRVW4_GSU1_LPB0_PGR1_PLR0_TT8_4_USFGRO0_WG16_16_1_WGM8
    SolutionIndex: 19
    SolutionNameMin: Cijk_Ailk_Bljk_SB_MT128x64x8_SE_EPS1_FL1_GRVW4_GSU1_LPB0_PGR1_PLR1_TT8_4_USFGRO0_WG16_16_1_WGM1
    SolutionIndex: 20
    SolutionNameMin: Cijk_Ailk_Bljk_SB_MT128x64x8_SE_EPS1_FL1_GRVW4_GSU1_LPB0_PGR1_PLR1_TT8_4_USFGRO0_WG16_16_1_WGM8
    SolutionIndex: 21
    SolutionNameMin: Cijk_Ailk_Bljk_SB_MT128x64x16_SE_EPS1_FL1_GRVW4_GSU1_LPB0_PGR1_PLR1_TT8_4_USFGRO0_WG16_16_1_WGM8
    SolutionIndex: 22
    SolutionNameMin: Cijk_Ailk_Bljk_SB_MT128x128x8_SE_EPS1_FL0_GRVW1_GSU1_LPB0_PGR1_PLR1_TT8_8_USFGRO1_WG16_16_1_WGM8
    SolutionIndex: 23
    SolutionNameMin: Cijk_Ailk_Bljk_SB_MT128x128x8_SE_EPS1_FL0_GRVW2_GSU1_LPB0_PGR1_PLR0_TT8_8_USFGRO0_WG16_16_1_WGM8
    SolutionIndex: 24
    SolutionNameMin: Cijk_Ailk_Bljk_SB_MT128x128x8_SE_EPS1_FL0_GRVW2_GSU1_LPB0_PGR1_PLR1_TT8_8_USFGRO0_WG16_16_1_WGM8
    SolutionIndex: 25
    SolutionNameMin: Cijk_Ailk_Bljk_SB_MT128x128x8_SE_EPS1_FL0_GRVW4_GSU1_LPB0_PGR1_PLR0_TT8_8_USFGRO0_WG16_16_1_WGM1
    SolutionIndex: 26
    SolutionNameMin: Cijk_Ailk_Bljk_SB_MT128x128x8_SE_EPS1_FL0_GRVW4_GSU1_LPB0_PGR1_PLR0_TT8_8_USFGRO0_WG16_16_1_WGM8
    SolutionIndex: 27
    SolutionNameMin: Cijk_Ailk_Bljk_SB_MT128x128x8_SE_EPS1_FL0_GRVW4_GSU1_LPB0_PGR1_PLR1_TT8_8_USFGRO0_WG16_16_1_WGM1
    SolutionIndex: 28
    SolutionNameMin: Cijk_Ailk_Bljk_SB_MT128x128x8_SE_EPS1_FL0_GRVW4_GSU1_LPB0_PGR1_PLR1_TT8_8_USFGRO0_WG16_16_1_WGM8
    SolutionIndex: 29
    SolutionNameMin: Cijk_Ailk_Bljk_SB_MT128x128x16_SE_EPS1_FL0_GRVW4_GSU1_LPB0_PGR1_PLR1_TT8_8_USFGRO0_WG16_16_1_WGM1
    SolutionIndex: 30
    SolutionNameMin: Cijk_Ailk_Bljk_SB_MT128x128x8_SE_EPS1_FL1_GRVW4_GSU1_LPB0_PGR1_PLR0_TT8_8_USFGRO0_WG16_16_1_WGM8
    SolutionIndex: 31
    SolutionNameMin: Cijk_Ailk_Bljk_SB_MT128x128x8_SE_EPS1_FL1_GRVW4_GSU1_LPB0_PGR1_PLR1_TT8_8_USFGRO0_WG16_16_1_WGM8
    SolutionIndex: 32
    SolutionNameMin: Cijk_Ailk_Bljk_SB_MT32x32x8_SE_EPS0_FL0_GRVW1_GSU1_LPB0_PGR0_PLR0_TT2_2_USFGRO1_WG16_16_1_WGM1
    SolutionIndex: 33
    SolutionNameMin: Cijk_Ailk_Bljk_SB_MT32x32x32_SE_EPS1_FL0_GRVW2_GSU1_LPB2_PGR1_PLR1_TT4_2_USFGRO0_WG8_16_2_WGM1
    SolutionIndex: 34
    SolutionNameMin: Cijk_Ailk_Bljk_SB_MT32x32x32_SE_EPS1_FL1_GRVW2_GSU1_LPB2_PGR1_PLR1_TT4_2_USFGRO0_WG8_16_2_WGM1
    SolutionIndex: 35
    SolutionNameMin: Cijk_Ailk_Bljk_SB_MT32x16x32_SE_EPS1_FL1_GRVW2_GSU1_LPB2_PGR1_PLR1_TT2_2_USFGRO0_WG16_8_2_WGM8
    SolutionIndex: 36
    SolutionNameMin: Cijk_Ailk_Bljk_SB_MT32x32x32_SE_EPS1_FL0_GRVW2_GSU1_LPB2_PGR1_PLR1_TT2_4_USFGRO0_WG16_8_2_WGM1
    SolutionIndex: 37
    SolutionNameMin: Cijk_Ailk_Bljk_SB_MT32x32x16_SE_EPS1_FL0_GRVW4_GSU1_LPB2_PGR1_PLR1_TT2_4_USFGRO0_WG16_8_2_WGM8
    SolutionIndex: 38
    SolutionNameMin: Cijk_Ailk_Bljk_SB_MT64x32x16_SE_EPS1_FL0_GRVW4_GSU1_LPB4_PGR1_PLR1_TT4_4_USFGRO0_WG16_8_2_WGM8
    SolutionIndex: 39
    SolutionNameMin: Cijk_Ailk_Bljk_SB_MT64x32x32_SE_EPS1_FL0_GRVW4_GSU1_LPB4_PGR1_PLR1_TT4_4_USFGRO0_WG16_8_2_WGM8
    SolutionIndex: 40
    SolutionNameMin: Cijk_Ailk_Bljk_SB_MT64x32x32_SE_EPS1_FL1_GRVW2_GSU1_LPB2_PGR1_PLR1_TT4_4_USFGRO0_WG16_8_2_WGM8
    SolutionIndex: 41
    SolutionNameMin: Cijk_Ailk_Bljk_SB_MT64x32x16_SE_EPS1_FL1_GRVW4_GSU1_LPB4_PGR1_PLR1_TT4_4_USFGRO0_WG16_8_2_WGM8
    SolutionIndex: 42
    SolutionNameMin: Cijk_Ailk_Bljk_SB_MT64x32x32_SE_EPS1_FL1_GRVW4_GSU1_LPB4_PGR1_PLR1_TT4_4_USFGRO0_WG16_8_2_WGM8
    SolutionIndex: 43
    SolutionNameMin: Cijk_Ailk_Bljk_SB_MT8x32x32_SE_EPS1_FL0_GRVW4_GSU1_LPB2_PGR1_PLR1_TT2_2_USFGRO1_WG4_16_4_WGM1
    SolutionIndex: 44
    SolutionNameMin: Cijk_Ailk_Bljk_SB_MT16x32x32_SE_EPS1_FL0_GRVW1_GSU1_LPB2_PGR1_PLR1_TT4_2_USFGRO1_WG4_16_4_WGM1
    SolutionIndex: 45
    SolutionNameMin: Cijk_Ailk_Bljk_SB_MT16x32x32_SE_EPS1_FL0_GRVW1_GSU1_LPB2_PGR1_PLR1_TT4_2_USFGRO1_WG4_16_4_WGM8
    SolutionIndex: 46
    SolutionNameMin: Cijk_Ailk_Bljk_SB_MT16x32x32_SE_EPS1_FL1_GRVW2_GSU1_LPB2_PGR1_PLR1_TT4_2_USFGRO0_WG4_16_4_WGM8
    SolutionIndex: 47
    SolutionNameMin: Cijk_Ailk_Bljk_SB_MT16x32x32_SE_EPS1_FL1_GRVW4_GSU1_LPB2_PGR1_PLR1_TT4_2_USFGRO0_WG4_16_4_WGM8
    SolutionIndex: 48
    SolutionNameMin: Cijk_Ailk_Bljk_SB_MT16x64x32_SE_EPS1_FL0_GRVW4_GSU1_LPB2_PGR1_PLR0_TT4_4_USFGRO0_WG4_16_4_WGM8
    SolutionIndex: 49
    SolutionNameMin: Cijk_Ailk_Bljk_SB_MT32x8x32_SE_EPS1_FL0_GRVW2_GSU1_LPB2_PGR1_PLR1_TT2_2_USFGRO0_WG16_4_4_WGM8
    SolutionIndex: 50
    SolutionNameMin: Cijk_Ailk_Bljk_SB_MT32x16x32_SE_EPS1_FL0_GRVW1_GSU1_LPB2_PGR1_PLR0_TT2_4_USFGRO1_WG16_4_4_WGM8
    SolutionIndex: 51
    SolutionNameMin: Cijk_Ailk_Bljk_SB_MT32x16x32_SE_EPS1_FL0_GRVW1_GSU1_LPB2_PGR1_PLR1_TT2_4_USFGRO1_WG16_4_4_WGM8
    SolutionIndex: 52
    SolutionNameMin: Cijk_Ailk_Bljk_SB_MT32x16x32_SE_EPS1_FL0_GRVW2_GSU1_LPB2_PGR1_PLR0_TT2_4_USFGRO0_WG16_4_4_WGM8
    SolutionIndex: 53
    SolutionNameMin: Cijk_Ailk_Bljk_SB_MT64x16x16_SE_EPS1_FL0_GRVW4_GSU1_LPB4_PGR1_PLR1_TT4_4_USFGRO0_WG16_4_4_WGM8
- - - [4096, 64, 1, 2048, 4096, 4096, 4096, 2048]
    - [41, 7247.18]
  - - [1024, 10080, 1, 1024, 1024, 1024, 1024, 1024]
    - [29, 9833.37]
  - - [1024, 1131, 1, 1024, 1024, 1024, 1024, 1024]
    - [7, 7551.85]
  - - [36548, 1216, 1, 1024, 36548, 36548, 36548, 1024]
    - [19, 10351.5]
  - - [1024, 29, 1, 1024, 1024, 1024, 1024, 1024]
    - [51, 1696.91]
  - - [1024, 2592, 1, 1024, 1024, 1024, 1024, 1024]
    - [20, 8424.01]
  - - [1024, 1568, 1, 1024, 1024, 1024, 1024, 1024]
    - [31, 7511.76]
  - - [4096, 91, 1, 2048, 4096, 4096, 4096, 2048]
    - [0, 5599.81]
  - - [1024, 4445, 1, 1024, 1024, 1024, 1024, 1024]
    - [18, 9261.12]
  - - [1024, 6272, 1, 1024, 1024, 1024, 1024, 1024]
    - [13, 9439.51]
  - - [36548, 3584, 1, 1024, 36548, 36548, 36548, 1024]
    - [12, 10393.7]
  - - [1024, 1827, 1, 1024, 1024, 1024, 1024, 1024]
    - [31, 8714.32]
  - - [1024, 3220, 1, 1024, 1024, 1024, 1024, 1024]
    - [11, 8861.1]
  - - [1024, 1856, 1, 1024, 1024, 1024, 1024, 1024]
    - [28, 8826.95]
  - - [1024, 1760, 1, 1024, 1024, 1024, 1024, 1024]
    - [28, 8334.1]
  - - [1024, 1600, 1, 1024, 1024, 1024, 1024, 1024]
    - [28, 7614.97]
  - - [1024, 1, 1, 21, 1024, 1024, 1024, 21]
    - [32, 0.0]
  - - [36548, 4235, 1, 1024, 36548, 36548, 36548, 1024]
    - [12, 10276.7]
  - - [1024, 49, 1, 1024, 1024, 1024, 1024, 1024]
    - [47, 2643.02]
  - - [1024, 1984, 1, 1024, 1024, 1024, 1024, 1024]
    - [31, 9449.42]
  - - [1024, 14720, 1, 1024, 1024, 1024, 1024, 1024]
    - [18, 10033.2]
  - - [1024, 1152, 1, 1024, 1024, 1024, 1024, 1024]
    - [1, 7523.44]
  - - [36548, 14976, 1, 1024, 36548, 36548, 36548, 1024]
    - [19, 10421.6]
  - - [36548, 1152, 1, 1024, 36548, 36548, 36548, 1024]
    - [19, 10258.0]
  - - [4096, 86, 1, 3072, 4096, 4096, 4096, 3072]
    - [0, 5308.75]
  - - [1024, 3392, 1, 1024, 1024, 1024, 1024, 1024]
    - [13, 9176.44]
  - - [1024, 1408, 1, 1024, 1024, 1024, 1024, 1024]
    - [13, 8958.73]
  - - [1024, 2080, 1, 1024, 1024, 1024, 1024, 1024]
    - [4, 8396.39]
  - - [1024, 1824, 1, 1024, 1024, 1024, 1024, 1024]
    - [22, 8671.61]
  - - [36548, 2432, 1, 1024, 36548, 36548, 36548, 1024]
    - [12, 10392.5]
  - - [4096, 29, 1, 2048, 4096, 4096, 4096, 2048]
    - [33, 4325.56]
  - - [1024, 1102, 1, 1024, 1024, 1024, 1024, 1024]
    - [7, 7204.08]
  - - [4096, 49, 1, 2048, 4096, 4096, 4096, 2048]
    - [39, 5609.19]
  - - [36548, 1827, 1, 1024, 36548, 36548, 36548, 1024]
    - [19, 10183.1]
  - - [4096, 25, 1, 2048, 4096, 4096, 4096, 2048]
    - [34, 3788.21]
  - - [1024, 10176, 1, 1024, 1024, 1024, 1024, 1024]
    - [29, 9941.08]
  - - [1024, 774, 1, 1024, 1024, 1024, 1024, 1024]
    - [14, 7079.57]
  - - [1024, 1952, 1, 1024, 1024, 1024, 1024, 1024]
    - [31, 9300.39]
  - - [4096, 128, 1, 2048, 4096, 4096, 4096, 2048]
    - [1, 8274.86]
  - - [1024, 17024, 1, 1024, 1024, 1024, 1024, 1024]
    - [11, 9960.62]
  - - [1024, 1472, 1, 1024, 1024, 1024, 1024, 1024]
    - [20, 9343.27]
  - - [36548, 4459, 1, 1024, 36548, 36548, 36548, 1024]
    - [12, 10358.0]
  - - [4096, 91, 1, 3072, 4096, 4096, 4096, 3072]
    - [6, 5509.29]
  - - [1024, 3712, 1, 1024, 1024, 1024, 1024, 1024]
    - [20, 9048.56]
  - - [4096, 64, 1, 3072, 4096, 4096, 4096, 3072]
    - [53, 7489.83]
  - - [4096, 29, 1, 3072, 4096, 4096, 4096, 3072]
    - [33, 4511.68]
  - - [4096, 128, 1, 3072, 4096, 4096, 4096, 3072]
    - [0, 8423.73]
  - - [36548, 12928, 1, 1024, 36548, 36548, 36548, 1024]
    - [19, 10426.0]
  - - [1024, 1632, 1, 1024, 1024, 1024, 1024, 1024]
    - [1, 7761.63]
  - - [1024, 1696, 1, 1024, 1024, 1024, 1024, 1024]
    - [26, 8107.19]
  - - [4096, 24, 1, 2048, 4096, 4096, 4096, 2048]
    - [33, 3663.15]
  - - [4096, 63, 1, 3072, 4096, 4096, 4096, 3072]
    - [42, 7175.27]
  - - [4096, 96, 1, 2048, 4096, 4096, 4096, 2048]
    - [1, 5866.18]
  - - [36548, 1764, 1, 1024, 36548, 36548, 36548, 1024]
    - [12, 10128.4]
  - - [4096, 32, 1, 2048, 4096, 4096, 4096, 2048]
    - [37, 4540.52]
  - - [1024, 35, 1, 1024, 1024, 1024, 1024, 1024]
    - [45, 1911.47]
  - - [1024, 1120, 1, 1024, 1024, 1024, 1024, 1024]
    - [0, 7289.03]
  - - [4096, 49, 1, 3072, 4096, 4096, 4096, 3072]
    - [39, 5751.52]
  - - [1024, 24, 1, 1024, 1024, 1024, 1024, 1024]
    - [45, 1391.92]
  - - [1024, 2944, 1, 1024, 1024, 1024, 1024, 1024]
    - [21, 9284.83]
  - - [36548, 14080, 1, 1024, 36548, 36548, 36548, 1024]
    - [12, 10441.3]
  - - [1024, 1, 1, 1024, 1024, 1024, 1024, 1024]
    - [32, 0.0]
  - - [1024, 1280, 1, 1024, 1024, 1024, 1024, 1024]
    - [0, 8244.36]
  - - [1024, 13440, 1, 1024, 1024, 1024, 1024, 1024]
    - [12, 9799.82]
  - - [1024, 1015, 1, 1024, 1024, 1024, 1024, 1024]
    - [20, 9187.75]
  - - [36548, 9120, 1, 1024, 36548, 36548, 36548, 1024]
    - [12, 10399.9]
  - - [36548, 1, 1, 1024, 36548, 36548, 36548, 1024]
    - [32, 0.0]
  - - [1024, 3008, 1, 1024, 1024, 1024, 1024, 1024]
    - [21, 9468.45]
  - - [1024, 2560, 1, 1024, 1024, 1024, 1024, 1024]
    - [18, 8879.21]
  - - [1024, 21, 1, 1024, 1024, 1024, 1024, 1024]
    - [44, 1234.31]
  - - [1024, 2208, 1, 1024, 1024, 1024, 1024, 1024]
    - [0, 8231.17]
  - - [1024, 96, 1, 1024, 1024, 1024, 1024, 1024]
    - [50, 3767.34]
  - - [4096, 86, 1, 2048, 4096, 4096, 4096, 2048]
    - [1, 5528.99]
  - - [4096, 96, 1, 3072, 4096, 4096, 4096, 3072]
    - [0, 6273.18]
  - - [1024, 1920, 1, 1024, 1024, 1024, 1024, 1024]
    - [30, 9118.09]
  - - [4096, 27, 1, 2048, 4096, 4096, 4096, 2048]
    - [33, 4073.6]
  - - [36548, 2496, 1, 1024, 36548, 36548, 36548, 1024]
    - [12, 10361.1]
  - - [1024, 1, 1, 14, 1024, 1024, 1024, 14]
    - [32, 0.0]
  - - [1024, 91, 1, 1024, 1024, 1024, 1024, 1024]
    - [52, 3647.57]
  - - [1024, 2016, 1, 1024, 1024, 1024, 1024, 1024]
    - [28, 9560.14]
  - - [1024, 1184, 1, 1024, 1024, 1024, 1024, 1024]
    - [1, 7678.86]
  - - [4096, 1, 1, 2048, 4096, 4096, 4096, 2048]
    - [32, 0.0]
  - - [1024, 1664, 1, 1024, 1024, 1024, 1024, 1024]
    - [26, 7933.97]
  - - [1024, 11424, 1, 1024, 1024, 1024, 1024, 1024]
    - [18, 9777.81]
  - - [4096, 24, 1, 3072, 4096, 4096, 4096, 3072]
    - [36, 3813.0]
  - - [1024, 1216, 1, 1024, 1024, 1024, 1024, 1024]
    - [0, 7902.03]
  - - [36548, 3185, 1, 1024, 36548, 36548, 36548, 1024]
    - [12, 10336.6]
  - - [36548, 9216, 1, 1024, 36548, 36548, 36548, 1024]
    - [12, 10414.2]
  - - [1024, 3200, 1, 1024, 1024, 1024, 1024, 1024]
    - [18, 8846.91]
  - - [1024, 2656, 1, 1024, 1024, 1024, 1024, 1024]
    - [13, 8649.15]
  - - [1024, 2368, 1, 1024, 1024, 1024, 1024, 1024]
    - [13, 8873.06]
  - - [1024, 4459, 1, 1024, 1024, 1024, 1024, 1024]
    - [20, 9431.22]
  - - [1024, 3808, 1, 1024, 1024, 1024, 1024, 1024]
    - [20, 9263.62]
  - - [1024, 2336, 1, 1024, 1024, 1024, 1024, 1024]
    - [13, 8965.9]
  - - [4096, 27, 1, 3072, 4096, 4096, 4096, 3072]
    - [33, 4171.64]
  - - [1024, 2304, 1, 1024, 1024, 1024, 1024, 1024]
    - [10, 8601.28]
  - - [1024, 1560, 1, 1024, 1024, 1024, 1024, 1024]
    - [25, 7481.64]
  - - [4096, 35, 1, 3072, 4096, 4096, 4096, 3072]
    - [39, 4176.8]
  - - [1024, 2496, 1, 1024, 1024, 1024, 1024, 1024]
    - [16, 9092.76]
  - - [1024, 1504, 1, 1024, 1024, 1024, 1024, 1024]
    - [16, 9220.43]
  - - [4096, 50, 1, 2048, 4096, 4096, 4096, 2048]
    - [40, 5472.73]
  - - [1024, 3232, 1, 1024, 1024, 1024, 1024, 1024]
    - [13, 8961.84]
  - - [1024, 14, 1, 1024, 1024, 1024, 1024, 1024]
    - [44, 882.215]
  - - [36548, 1015, 1, 1024, 36548, 36548, 36548, 1024]
    - [12, 10140.8]
  - - [1024, 2000, 1, 1024, 1024, 1024, 1024, 1024]
    - [24, 9487.7]
  - - [36548, 243, 1, 1024, 36548, 36548, 36548, 1024]
    - [17, 9441.02]
  - - [36548, 32, 1, 1024, 36548, 36548, 36548, 1024]
    - [5, 4720.95]
  - - [1024, 25, 1, 1024, 1024, 1024, 1024, 1024]
    - [51, 1462.86]
  - - [1024, 13184, 1, 1024, 1024, 1024, 1024, 1024]
    - [15, 9866.18]
  - - [1024, 2688, 1, 1024, 1024, 1024, 1024, 1024]
    - [10, 8559.83]
  - - [1024, 27, 1, 1024, 1024, 1024, 1024, 1024]
    - [49, 1559.01]
  - - [36548, 950, 1, 1024, 36548, 36548, 36548, 1024]
    - [19, 10053.5]
  - - [1024, 1764, 1, 1024, 1024, 1024, 1024, 1024]
    - [26, 8347.01]
  - - [1024, 992, 1, 1024, 1024, 1024, 1024, 1024]
    - [13, 9035.72]
  - - [1024, 1376, 1, 1024, 1024, 1024, 1024, 1024]
    - [13, 8797.86]
  - - [1024, 950, 1, 1024, 1024, 1024, 1024, 1024]
    - [20, 8635.16]
  - - [36548, 774, 1, 1024, 36548, 36548, 36548, 1024]
    - [12, 9460.72]
  - - [36548, 25, 1, 1024, 36548, 36548, 36548, 1024]
    - [5, 3694.06]
  - - [1024, 4256, 1, 1024, 1024, 1024, 1024, 1024]
    - [13, 9172.06]
  - - [4096, 32, 1, 3072, 4096, 4096, 4096, 3072]
    - [34, 4886.57]
  - - [1024, 243, 1, 1024, 1024, 1024, 1024, 1024]
    - [38, 6594.31]
  - - [36548, 3712, 1, 1024, 36548, 36548, 36548, 1024]
    - [12, 10401.5]
  - - [1024, 50, 1, 1024, 1024, 1024, 1024, 1024]
    - [47, 2742.09]
  - - [1024, 3360, 1, 1024, 1024, 1024, 1024, 1024]
    - [9, 9017.27]
  - - [1024, 2048, 1, 1024, 1024, 1024, 1024, 1024]
    - [24, 9736.55]
  - - [1024, 2784, 1, 1024, 1024, 1024, 1024, 1024]
    - [20, 8835.5]
  - - [1024, 4992, 1, 1024, 1024, 1024, 1024, 1024]
    - [18, 9639.28]
  - - [36548, 1102, 1, 1024, 36548, 36548, 36548, 1024]
    - [19, 9858.94]
  - - [1024, 1536, 1, 1024, 1024, 1024, 1024, 1024]
    - [11, 9294.88]
  - - [1024, 2720, 1, 1024, 1024, 1024, 1024, 1024]
    - [16, 8617.78]
  - - [4096, 1, 1, 3072, 4096, 4096, 4096, 3072]
    - [32, 0.0]
  - - [1024, 2752, 1, 1024, 1024, 1024, 1024, 1024]
    - [20, 8902.07]
  - - [1024, 2816, 1, 1024, 1024, 1024, 1024, 1024]
    - [18, 8906.85]
  - - [1024, 2624, 1, 1024, 1024, 1024, 1024, 1024]
    - [20, 8494.31]
  - - [1024, 2144, 1, 1024, 1024, 1024, 1024, 1024]
    - [3, 8243.46]
  - - [36548, 1131, 1, 1024, 36548, 36548, 36548, 1024]
    - [19, 10104.5]
  - - [4096, 25, 1, 3072, 4096, 4096, 4096, 3072]
    - [34, 3959.88]
  - - [1024, 64, 1, 1024, 1024, 1024, 1024, 1024]
    - [47, 3410.0]
  - - [1024, 3296, 1, 1024, 1024, 1024, 1024, 1024]
    - [18, 9066.42]
  - - [36548, 4992, 1, 1024, 36548, 36548, 36548, 1024]
    - [12, 10395.5]
  - - [1024, 1344, 1, 1024, 1024, 1024, 1024, 1024]
    - [13, 8522.56]
  - - [36548, 2401, 1, 1024, 36548, 36548, 36548, 1024]
    - [12, 10250.2]
  - - [1024, 15744, 1, 1024, 1024, 1024, 1024, 1024]
    - [12, 10006.3]
  - - [1024, 15232, 1, 1024, 1024, 1024, 1024, 1024]
    - [11, 9912.11]
  - - [1024, 1888, 1, 1024, 1024, 1024, 1024, 1024]
    - [23, 8962.88]
  - - [1024, 1792, 1, 1024, 1024, 1024, 1024, 1024]
    - [27, 8556.72]
  - - [36548, 1073, 1, 1024, 36548, 36548, 36548, 1024]
    - [12, 10161.1]
  - - [4096, 50, 1, 3072, 4096, 4096, 4096, 3072]
    - [39, 5882.06]
  - - [36548, 15488, 1, 1024, 36548, 36548, 36548, 1024]
    - [19, 10437.0]
  - - [1024, 2464, 1, 1024, 1024, 1024, 1024, 1024]
    - [16, 8879.92]
  - - [1024, 2272, 1, 1024, 1024, 1024, 1024, 1024]
    - [13, 8720.25]
  - - [1024, 13, 1, 1024, 1024, 1024, 1024, 1024]
    - [43, 774.516]
  - - [1024, 2432, 1, 1024, 1024, 1024, 1024, 1024]
    - [18, 8491.43]
  - - [36548, 24, 1, 1024, 36548, 36548, 36548, 1024]
    - [5, 3564.31]
  - - [1024, 3936, 1, 1024, 1024, 1024, 1024, 1024]
    - [28, 9433.2]
  - - [36548, 13824, 1, 1024, 36548, 36548, 36548, 1024]
    - [12, 10439.7]
  - - [1024, 2401, 1, 1024, 1024, 1024, 1024, 1024]
    - [20, 8869.93]
  - - [1024, 32, 1, 1024, 1024, 1024, 1024, 1024]
    - [35, 1839.61]
  - - [1024, 2176, 1, 1024, 1024, 1024, 1024, 1024]
    - [4, 8544.45]
  - - [1024, 2240, 1, 1024, 1024, 1024, 1024, 1024]
    - [13, 8381.45]
  - - [1024, 1728, 1, 1024, 1024, 1024, 1024, 1024]
    - [1, 8212.23]
  - - [1024, 128, 1, 1024, 1024, 1024, 1024, 1024]
    - [48, 4660.34]
  - - [1024, 216, 1, 1024, 1024, 1024, 1024, 1024]
    - [38, 5777.87]
  - - [1024, 63, 1, 1024, 1024, 1024, 1024, 1024]
    - [46, 3329.65]
  - - [1024, 86, 1, 1024, 1024, 1024, 1024, 1024]
    - [52, 3533.6]
  - - [1024, 2528, 1, 1024, 1024, 1024, 1024, 1024]
    - [8, 8789.15]
  - - [1024, 2400, 1, 1024, 1024, 1024, 1024, 1024]
    - [13, 8939.3]
  - - [1024, 1440, 1, 1024, 1024, 1024, 1024, 1024]
    - [20, 9131.31]
  - - [1024, 2912, 1, 1024, 1024, 1024, 1024, 1024]
    - [13, 9139.93]
  - - [4096, 35, 1, 2048, 4096, 4096, 4096, 2048]
    - [39, 4059.75]
  - - [4096, 63, 1, 2048, 4096, 4096, 4096, 2048]
    - [41, 6946.4]
  - - [1024, 2880, 1, 1024, 1024, 1024, 1024, 1024]
    - [11, 9104.88]
  - - [1024, 4064, 1, 1024, 1024, 1024, 1024, 1024]
    - [30, 9715.1]
  - - [1024, 4655, 1, 1024, 1024, 1024, 1024, 1024]
    - [18, 9033.8]
  - - [1024, 1088, 1, 1024, 1024, 1024, 1024, 1024]
    - [2, 8144.31]
  - - [36548, 6272, 1, 1024, 36548, 36548, 36548, 1024]
    - [19, 10427.3]
  - - [1024, 1, 1, 13, 1024, 1024, 1024, 13]
    - [32, 0.0]
- null
