src/Tensile/data/Configs/miopen/archives/dlrm/2020-08-27/exact/arcturus_Cijk_Ailk_Bjlk_SB.yaml
- {MinimumRequiredVersion: 4.22.0}
- arcturus
- gfx908
- [Device 7380, Device 7388, Device 738c, Device 7390]
    SolutionIndex: 0
    SolutionNameMin: Cijk_Ailk_Bjlk_SB_MT64x64x32_MI16x16x4x1_SE_DVO1_GRVW4_IU1_ONLL0_SIA3_TT4_16_VW4_WG16_16_1_WGM8
    SolutionIndex: 1
    SolutionNameMin: Cijk_Ailk_Bjlk_SB_MT64x64x32_MI16x16x4x1_SE_DVO0_GRVW4_IU1_ONLL0_SIA3_TT4_16_VW4_WG16_16_1_WGM1
    SolutionIndex: 2
    SolutionNameMin: Cijk_Ailk_Bjlk_SB_MT64x64x32_MI16x16x4x1_SE_DVO1_GRVW4_IU1_ONLL1_SIA3_TT4_16_VW4_WG16_16_1_WGM8
    SolutionIndex: 3
    SolutionNameMin: Cijk_Ailk_Bjlk_SB_MT64x64x32_MI16x16x4x1_SE_DVO0_GRVW2_IU1_ONLL1_SIA3_TT4_16_VW2_WG16_16_1_WGM8
    SolutionIndex: 4
    SolutionNameMin: Cijk_Ailk_Bjlk_SB_MT64x64x32_MI16x16x4x1_SE_DVO0_GRVW4_IU1_ONLL1_SIA3_TT4_16_VW4_WG16_16_1_WGM1
    SolutionIndex: 5
    SolutionNameMin: Cijk_Ailk_Bjlk_SB_MT64x64x32_MI16x16x4x1_SE_DVO0_GRVW4_IU1_ONLL1_SIA3_TT4_16_VW4_WG16_16_1_WGM8
    SolutionIndex: 6
    SolutionNameMin: Cijk_Ailk_Bjlk_SB_MT64x64x32_MI16x16x4x1_SE_DVO1_GRVW4_IU1_ONLL2_SIA3_TT4_16_VW4_WG16_16_1_WGM1
    SolutionIndex: 7
    SolutionNameMin: Cijk_Ailk_Bjlk_SB_MT64x64x32_MI16x16x4x1_SE_DVO1_GRVW4_IU1_ONLL2_SIA3_TT4_16_VW4_WG16_16_1_WGM8
    SolutionIndex: 8
    SolutionNameMin: Cijk_Ailk_Bjlk_SB_MT128x32x32_MI16x16x4x1_SE_DVO1_GRVW4_IU1_ONLL1_SIA3_TT4_16_VW4_WG32_8_1_WGM1
    SolutionIndex: 9
    SolutionNameMin: Cijk_Ailk_Bjlk_SB_MT128x32x32_MI16x16x4x1_SE_DVO0_GRVW4_IU1_ONLL2_SIA3_TT4_16_VW4_WG32_8_1_WGM1
    SolutionIndex: 10
    SolutionNameMin: Cijk_Ailk_Bjlk_SB_MT64x128x32_MI32x32x2x1_SE_DVO1_GRVW4_IU2_ONLL0_SIA3_TT2_32_VW4_WG16_16_1_WGM1
    SolutionIndex: 11
    SolutionNameMin: Cijk_Ailk_Bjlk_SB_MT64x128x32_MI32x32x2x1_SE_DVO1_GRVW4_IU2_ONLL0_SIA3_TT2_32_VW4_WG16_16_1_WGM8
    SolutionIndex: 12
    SolutionNameMin: Cijk_Ailk_Bjlk_SB_MT128x64x32_MI32x32x2x1_SE_DVO0_GRVW4_IU1_ONLL0_SIA3_TT2_32_VW4_WG64_4_1_WGM8
    SolutionIndex: 13
    SolutionNameMin: Cijk_Ailk_Bjlk_SB_MT64x128x32_MI32x32x2x1_SE_DVO0_GRVW4_IU1_ONLL2_SIA3_TT1_64_VW4_WG64_4_1_WGM8
- - - [256, 4, 1, 4096, 256, 256, 256, 4]
    - [0, 0.143]
  - - [256, 4, 1, 6912, 256, 256, 256, 4]
    - [7, 0.149]
  - - [1024, 1024, 1, 4096, 1024, 1024, 1024, 1024]
    - [6, 57.005]
  - - [1024, 1024, 1, 6912, 1024, 1024, 1024, 1024]
    - [3, 57.939]
  - - [512, 256, 1, 4096, 512, 512, 512, 256]
    - [5, 17.371]
  - - [1024, 512, 1, 4096, 1024, 1024, 1024, 512]
    - [12, 49.699]
  - - [480, 1024, 1, 4096, 480, 480, 480, 1024]
    - [10, 45.387]
  - - [256, 128, 1, 32768, 256, 256, 256, 128]
    - [4, 4.55]
  - - [512, 256, 1, 32768, 512, 512, 512, 256]
    - [2, 18.773]
  - - [13, 512, 1, 32768, 13, 13, 13, 512]
    - [8, 1.048]
  - - [512, 256, 1, 6912, 512, 512, 512, 256]
    - [5, 18.017]
  - - [1024, 512, 1, 6912, 1024, 1024, 1024, 512]
    - [13, 50.988]
  - - [480, 1024, 1, 6912, 480, 480, 480, 1024]
    - [11, 47.198]
  - - [256, 128, 1, 55296, 256, 256, 256, 128]
    - [1, 4.561]
  - - [512, 256, 1, 55296, 512, 512, 512, 256]
    - [2, 18.715]
  - - [13, 512, 1, 55296, 13, 13, 13, 512]
    - [9, 1.058]
- null
