Tensile/Configs/miopen/archives/transformer/2019-11-01/exact/vega10_Cijk_Ailk_Bljk_SB.yaml
- {MinimumRequiredVersion: 4.14.0}
- vega10
- gfx900
- [Device 6863, Device 6862, Device 687f, Device 6860, Device 6861, 'Vega 10 XTX [Radeon
    SolutionIndex: 0
    SolutionNameMin: Cijk_Ailk_Bljk_SB_MT64x64x8_SE_DTL0_EPS1_FL0_GRVW1_LPB0_PGR1_PLR1_TT4_4_USFGRO1_VW2_WG16_16_1_WGM8
    SolutionIndex: 1
    SolutionNameMin: Cijk_Ailk_Bljk_SB_MT64x64x8_SE_DTL0_EPS1_FL0_GRVW1_LPB0_PGR1_PLR1_TT4_4_USFGRO1_VW4_WG16_16_1_WGM8
    SolutionIndex: 2
    SolutionNameMin: Cijk_Ailk_Bljk_SB_MT64x64x8_SE_DTL0_EPS1_FL0_GRVW2_LPB0_PGR1_PLR1_TT4_4_USFGRO0_VW2_WG16_16_1_WGM8
    SolutionIndex: 3
    SolutionNameMin: Cijk_Ailk_Bljk_SB_MT64x64x8_SE_DTL0_EPS1_FL0_GRVW4_LPB0_PGR1_PLR1_TT4_4_USFGRO0_VW2_WG16_16_1_WGM8
    SolutionIndex: 4
    SolutionNameMin: Cijk_Ailk_Bljk_SB_MT64x64x16_SE_DTL0_EPS1_FL0_GRVW4_LPB0_PGR1_PLR1_TT4_4_USFGRO0_VW4_WG16_16_1_WGM1
    SolutionIndex: 5
    SolutionNameMin: Cijk_Ailk_Bljk_SB_MT64x64x16_SE_DTL0_EPS1_FL0_GRVW4_LPB0_PGR1_PLR1_TT4_4_USFGRO0_VW4_WG16_16_1_WGM8
    SolutionIndex: 6
    SolutionNameMin: Cijk_Ailk_Bljk_SB_MT64x64x32_SE_DTL0_EPS1_FL0_GRVW4_LPB0_PGR1_PLR1_TT4_4_USFGRO0_VW4_WG16_16_1_WGM1
    SolutionIndex: 7
    SolutionNameMin: Cijk_Ailk_Bljk_SB_MT64x64x32_SE_DTL0_EPS1_FL0_GRVW4_LPB0_PGR1_PLR1_TT4_4_USFGRO0_VW4_WG16_16_1_WGM8
    SolutionIndex: 8
    SolutionNameMin: Cijk_Ailk_Bljk_SB_MT64x64x8_SE_DTL0_EPS1_FL1_GRVW2_LPB0_PGR1_PLR1_TT4_4_USFGRO0_VW2_WG16_16_1_WGM8
    SolutionIndex: 9
    SolutionNameMin: Cijk_Ailk_Bljk_SB_MT64x64x16_SE_DTL0_EPS1_FL1_GRVW4_LPB0_PGR1_PLR1_TT4_4_USFGRO0_VW4_WG16_16_1_WGM1
    SolutionIndex: 10
    SolutionNameMin: Cijk_Ailk_Bljk_SB_MT64x64x16_SE_DTL0_EPS1_FL1_GRVW4_LPB0_PGR1_PLR1_TT4_4_USFGRO0_VW4_WG16_16_1_WGM8
    SolutionIndex: 11
    SolutionNameMin: Cijk_Ailk_Bljk_SB_MT64x64x32_SE_DTL0_EPS1_FL1_GRVW4_LPB0_PGR1_PLR1_TT4_4_USFGRO0_VW4_WG16_16_1_WGM1
    SolutionIndex: 12
    SolutionNameMin: Cijk_Ailk_Bljk_SB_MT64x64x32_SE_DTL0_EPS1_FL1_GRVW4_LPB0_PGR1_PLR1_TT4_4_USFGRO0_VW4_WG16_16_1_WGM8
    SolutionIndex: 13
    SolutionNameMin: Cijk_Ailk_Bljk_SB_MT96x64x16_SE_DTL0_EPS1_FL0_GRVW2_LPB0_PGR1_PLR1_TT6_4_USFGRO0_VW2_WG16_16_1_WGM1
    SolutionIndex: 14
    SolutionNameMin: Cijk_Ailk_Bljk_SB_MT96x64x16_SE_DTL0_EPS1_FL1_GRVW2_LPB0_PGR1_PLR1_TT6_4_USFGRO0_VW2_WG16_16_1_WGM1
    SolutionIndex: 15
    SolutionNameMin: Cijk_Ailk_Bljk_SB_MT64x96x8_SE_DTL0_EPS1_FL1_GRVW4_LPB0_PGR1_PLR0_TT4_6_USFGRO0_VW2_WG16_16_1_WGM8
    SolutionIndex: 16
    SolutionNameMin: Cijk_Ailk_Bljk_SB_MT64x96x8_SE_DTL0_EPS1_FL1_GRVW4_LPB0_PGR1_PLR1_TT4_6_USFGRO0_VW2_WG16_16_1_WGM1
    SolutionIndex: 17
    SolutionNameMin: Cijk_Ailk_Bljk_SB_MT64x96x8_SE_DTL0_EPS1_FL1_GRVW4_LPB0_PGR1_PLR1_TT4_6_USFGRO0_VW2_WG16_16_1_WGM8
    SolutionIndex: 18
    SolutionNameMin: Cijk_Ailk_Bljk_SB_MT64x128x8_SE_DTL0_EPS1_FL0_GRVW4_LPB0_PGR1_PLR1_TT4_8_USFGRO0_VW2_WG16_16_1_WGM1
    SolutionIndex: 19
    SolutionNameMin: Cijk_Ailk_Bljk_SB_MT64x128x16_SE_DTL0_EPS1_FL0_GRVW4_LPB0_PGR1_PLR1_TT4_8_USFGRO0_VW4_WG16_16_1_WGM1
    SolutionIndex: 20
    SolutionNameMin: Cijk_Ailk_Bljk_SB_MT64x128x16_SE_DTL0_EPS1_FL0_GRVW4_LPB0_PGR1_PLR1_TT4_8_USFGRO0_VW4_WG16_16_1_WGM8
    SolutionIndex: 21
    SolutionNameMin: Cijk_Ailk_Bljk_SB_MT64x128x8_SE_DTL0_EPS1_FL1_GRVW2_LPB0_PGR1_PLR1_TT4_8_USFGRO0_VW2_WG16_16_1_WGM1
    SolutionIndex: 22
    SolutionNameMin: Cijk_Ailk_Bljk_SB_MT64x128x8_SE_DTL0_EPS1_FL1_GRVW4_LPB0_PGR1_PLR1_TT4_8_USFGRO0_VW2_WG16_16_1_WGM1
    SolutionIndex: 23
    SolutionNameMin: Cijk_Ailk_Bljk_SB_MT64x128x16_SE_DTL0_EPS1_FL1_GRVW4_LPB0_PGR1_PLR1_TT4_8_USFGRO0_VW4_WG16_16_1_WGM1
    SolutionIndex: 24
    SolutionNameMin: Cijk_Ailk_Bljk_SB_MT64x128x16_SE_DTL0_EPS1_FL1_GRVW4_LPB0_PGR1_PLR1_TT4_8_USFGRO0_VW4_WG16_16_1_WGM8
    SolutionIndex: 25
    SolutionNameMin: Cijk_Ailk_Bljk_SB_MT128x64x8_SE_DTL0_EPS1_FL0_GRVW2_LPB0_PGR1_PLR0_TT8_4_USFGRO0_VW2_WG16_16_1_WGM1
    SolutionIndex: 26
    SolutionNameMin: Cijk_Ailk_Bljk_SB_MT128x64x8_SE_DTL0_EPS1_FL0_GRVW2_LPB0_PGR1_PLR0_TT8_4_USFGRO0_VW2_WG16_16_1_WGM8
    SolutionIndex: 27
    SolutionNameMin: Cijk_Ailk_Bljk_SB_MT128x64x8_SE_DTL0_EPS1_FL0_GRVW4_LPB0_PGR1_PLR0_TT8_4_USFGRO0_VW4_WG16_16_1_WGM8
    SolutionIndex: 28
    SolutionNameMin: Cijk_Ailk_Bljk_SB_MT128x64x16_SE_DTL0_EPS1_FL0_GRVW4_LPB0_PGR1_PLR0_TT8_4_USFGRO0_VW4_WG16_16_1_WGM8
    SolutionIndex: 29
    SolutionNameMin: Cijk_Ailk_Bljk_SB_MT128x64x8_SE_DTL0_EPS1_FL1_GRVW2_LPB0_PGR1_PLR0_TT8_4_USFGRO0_VW2_WG16_16_1_WGM1
    SolutionIndex: 30
    SolutionNameMin: Cijk_Ailk_Bljk_SB_MT128x64x8_SE_DTL0_EPS1_FL1_GRVW2_LPB0_PGR1_PLR0_TT8_4_USFGRO0_VW2_WG16_16_1_WGM8
    SolutionIndex: 31
    SolutionNameMin: Cijk_Ailk_Bljk_SB_MT128x64x8_SE_DTL0_EPS1_FL1_GRVW4_LPB0_PGR1_PLR0_TT8_4_USFGRO0_VW4_WG16_16_1_WGM1
    SolutionIndex: 32
    SolutionNameMin: Cijk_Ailk_Bljk_SB_MT128x64x8_SE_DTL0_EPS1_FL1_GRVW4_LPB0_PGR1_PLR0_TT8_4_USFGRO0_VW4_WG16_16_1_WGM8
    SolutionIndex: 33
    SolutionNameMin: Cijk_Ailk_Bljk_SB_MT128x64x8_SE_DTL0_EPS1_FL0_GRVW2_LPB0_PGR1_PLR1_TT8_4_USFGRO0_VW2_WG16_16_1_WGM1
    SolutionIndex: 34
    SolutionNameMin: Cijk_Ailk_Bljk_SB_MT128x64x8_SE_DTL0_EPS1_FL0_GRVW2_LPB0_PGR1_PLR1_TT8_4_USFGRO0_VW2_WG16_16_1_WGM8
    SolutionIndex: 35
    SolutionNameMin: Cijk_Ailk_Bljk_SB_MT128x64x16_SE_DTL0_EPS1_FL0_GRVW2_LPB0_PGR1_PLR1_TT8_4_USFGRO0_VW2_WG16_16_1_WGM8
    SolutionIndex: 36
    SolutionNameMin: Cijk_Ailk_Bljk_SB_MT128x64x8_SE_DTL0_EPS1_FL0_GRVW4_LPB0_PGR1_PLR1_TT8_4_USFGRO0_VW4_WG16_16_1_WGM1
    SolutionIndex: 37
    SolutionNameMin: Cijk_Ailk_Bljk_SB_MT128x64x8_SE_DTL0_EPS1_FL0_GRVW4_LPB0_PGR1_PLR1_TT8_4_USFGRO0_VW4_WG16_16_1_WGM8
    SolutionIndex: 38
    SolutionNameMin: Cijk_Ailk_Bljk_SB_MT128x64x16_SE_DTL0_EPS1_FL0_GRVW4_LPB0_PGR1_PLR1_TT8_4_USFGRO0_VW4_WG16_16_1_WGM1
    SolutionIndex: 39
    SolutionNameMin: Cijk_Ailk_Bljk_SB_MT128x64x16_SE_DTL0_EPS1_FL0_GRVW4_LPB0_PGR1_PLR1_TT8_4_USFGRO0_VW4_WG16_16_1_WGM8
    SolutionIndex: 40
    SolutionNameMin: Cijk_Ailk_Bljk_SB_MT128x64x8_SE_DTL0_EPS1_FL1_GRVW2_LPB0_PGR1_PLR1_TT8_4_USFGRO0_VW2_WG16_16_1_WGM1
    SolutionIndex: 41
    SolutionNameMin: Cijk_Ailk_Bljk_SB_MT128x64x8_SE_DTL0_EPS1_FL1_GRVW2_LPB0_PGR1_PLR1_TT8_4_USFGRO0_VW2_WG16_16_1_WGM8
    SolutionIndex: 42
    SolutionNameMin: Cijk_Ailk_Bljk_SB_MT128x64x16_SE_DTL0_EPS1_FL1_GRVW2_LPB0_PGR1_PLR1_TT8_4_USFGRO0_VW2_WG16_16_1_WGM1
    SolutionIndex: 43
    SolutionNameMin: Cijk_Ailk_Bljk_SB_MT128x64x16_SE_DTL0_EPS1_FL1_GRVW2_LPB0_PGR1_PLR1_TT8_4_USFGRO0_VW2_WG16_16_1_WGM8
    SolutionIndex: 44
    SolutionNameMin: Cijk_Ailk_Bljk_SB_MT128x64x8_SE_DTL0_EPS1_FL1_GRVW4_LPB0_PGR1_PLR1_TT8_4_USFGRO0_VW4_WG16_16_1_WGM1
    SolutionIndex: 45
    SolutionNameMin: Cijk_Ailk_Bljk_SB_MT128x64x8_SE_DTL0_EPS1_FL1_GRVW4_LPB0_PGR1_PLR1_TT8_4_USFGRO0_VW4_WG16_16_1_WGM8
    SolutionIndex: 46
    SolutionNameMin: Cijk_Ailk_Bljk_SB_MT128x64x16_SE_DTL0_EPS1_FL1_GRVW4_LPB0_PGR1_PLR1_TT8_4_USFGRO0_VW4_WG16_16_1_WGM1
    SolutionIndex: 47
    SolutionNameMin: Cijk_Ailk_Bljk_SB_MT128x64x16_SE_DTL0_EPS1_FL1_GRVW4_LPB0_PGR1_PLR1_TT8_4_USFGRO0_VW4_WG16_16_1_WGM8
    SolutionIndex: 48
    SolutionNameMin: Cijk_Ailk_Bljk_SB_MT128x128x16_SE_DTL0_EPS1_FL0_GRVW4_LPB0_PGR1_PLR0_TT8_8_USFGRO0_VW4_WG16_16_1_WGM1
    SolutionIndex: 49
    SolutionNameMin: Cijk_Ailk_Bljk_SB_MT128x128x16_SE_DTL0_EPS1_FL0_GRVW4_LPB0_PGR1_PLR0_TT8_8_USFGRO0_VW4_WG16_16_1_WGM8
    SolutionIndex: 50
    SolutionNameMin: Cijk_Ailk_Bljk_SB_MT128x128x16_SE_DTL0_EPS1_FL1_GRVW4_LPB0_PGR1_PLR0_TT8_8_USFGRO0_VW4_WG16_16_1_WGM1
    SolutionIndex: 51
    SolutionNameMin: Cijk_Ailk_Bljk_SB_MT128x128x16_SE_DTL0_EPS1_FL1_GRVW4_LPB0_PGR1_PLR0_TT8_8_USFGRO0_VW4_WG16_16_1_WGM8
    SolutionIndex: 52
    SolutionNameMin: Cijk_Ailk_Bljk_SB_MT128x128x8_SE_DTL0_EPS1_FL0_GRVW1_LPB0_PGR1_PLR1_TT8_8_USFGRO1_VW2_WG16_16_1_WGM1
    SolutionIndex: 53
    SolutionNameMin: Cijk_Ailk_Bljk_SB_MT128x128x16_SE_DTL0_EPS1_FL0_GRVW4_LPB0_PGR1_PLR1_TT8_8_USFGRO0_VW4_WG16_16_1_WGM1
    SolutionIndex: 54
    SolutionNameMin: Cijk_Ailk_Bljk_SB_MT128x128x16_SE_DTL0_EPS1_FL0_GRVW4_LPB0_PGR1_PLR1_TT8_8_USFGRO0_VW4_WG16_16_1_WGM8
    SolutionIndex: 55
    SolutionNameMin: Cijk_Ailk_Bljk_SB_MT128x128x16_SE_DTL0_EPS1_FL1_GRVW4_LPB0_PGR1_PLR1_TT8_8_USFGRO0_VW4_WG16_16_1_WGM1
    SolutionIndex: 56
    SolutionNameMin: Cijk_Ailk_Bljk_SB_MT128x128x16_SE_DTL0_EPS1_FL1_GRVW4_LPB0_PGR1_PLR1_TT8_8_USFGRO0_VW4_WG16_16_1_WGM8
    SolutionIndex: 57
    SolutionNameMin: Cijk_Ailk_Bljk_SB_MT64x32x8_SE_DTL0_EPS0_FL0_GRVW1_LPB0_PGR0_PLR1_TT4_2_USFGRO1_VW2_WG16_16_1_WGM1
    SolutionIndex: 58
    SolutionNameMin: Cijk_Ailk_Bljk_SB_MT64x32x16_SE_DTL0_EPS0_FL0_GRVW1_LPB0_PGR0_PLR1_TT4_2_USFGRO1_VW2_WG16_16_1_WGM1
    SolutionIndex: 59
    SolutionNameMin: Cijk_Ailk_Bljk_SB_MT64x32x16_SE_DTL0_EPS0_FL0_GRVW1_LPB0_PGR0_PLR1_TT4_2_USFGRO1_VW2_WG16_16_1_WGM8
    SolutionIndex: 60
    SolutionNameMin: Cijk_Ailk_Bljk_SB_MT64x32x32_SE_DTL0_EPS0_FL0_GRVW1_LPB2_PGR0_PLR0_TT4_2_USFGRO1_VW2_WG16_16_1_WGM1
    SolutionIndex: 61
    SolutionNameMin: Cijk_Ailk_Bljk_SB_MT64x32x8_SE_DTL0_EPS0_FL0_GRVW1_LPB2_PGR0_PLR1_TT4_2_USFGRO1_VW2_WG16_16_1_WGM1
    SolutionIndex: 62
    SolutionNameMin: Cijk_Ailk_Bljk_SB_MT64x32x32_SE_DTL0_EPS0_FL0_GRVW1_LPB2_PGR0_PLR1_TT4_2_USFGRO1_VW2_WG16_16_1_WGM1
    SolutionIndex: 63
    SolutionNameMin: Cijk_Ailk_Bljk_SB_MT64x32x8_SE_DTL0_EPS1_FL0_GRVW1_LPB2_PGR1_PLR1_TT4_2_USFGRO1_VW2_WG16_16_1_WGM1
    SolutionIndex: 64
    SolutionNameMin: Cijk_Ailk_Bljk_SB_MT64x32x8_SE_DTL0_EPS1_FL1_GRVW4_LPB2_PGR1_PLR1_TT4_2_USFGRO0_VW2_WG16_16_1_WGM8
    SolutionIndex: 65
    SolutionNameMin: Cijk_Ailk_Bljk_SB_MT32x64x16_SE_DTL0_EPS0_FL1_GRVW4_LPB0_PGR0_PLR1_TT2_4_USFGRO0_VW2_WG16_16_1_WGM1
    SolutionIndex: 66
    SolutionNameMin: Cijk_Ailk_Bljk_SB_MT64x64x8_SE_DTL0_EPS0_FL1_GRVW4_LPB2_PGR0_PLR0_TT4_4_USFGRO0_VW2_WG16_16_1_WGM1
    SolutionIndex: 67
    SolutionNameMin: Cijk_Ailk_Bljk_SB_MT64x64x8_SE_DTL0_EPS1_FL0_GRVW2_LPB2_PGR1_PLR0_TT4_4_USFGRO0_VW2_WG16_16_1_WGM1
    SolutionIndex: 68
    SolutionNameMin: Cijk_Ailk_Bljk_SB_MT64x64x8_SE_DTL0_EPS1_FL1_GRVW2_LPB2_PGR1_PLR0_TT4_4_USFGRO0_VW2_WG16_16_1_WGM1
    SolutionIndex: 69
    SolutionNameMin: Cijk_Ailk_Bljk_SB_MT64x64x8_SE_DTL0_EPS1_FL1_GRVW4_LPB2_PGR1_PLR0_TT4_4_USFGRO0_VW2_WG16_16_1_WGM1
    SolutionIndex: 70
    SolutionNameMin: Cijk_Ailk_Bljk_SB_MT64x64x8_SE_DTL0_EPS0_FL1_GRVW1_LPB2_PGR0_PLR1_TT4_4_USFGRO1_VW2_WG16_16_1_WGM1
    SolutionIndex: 71
    SolutionNameMin: Cijk_Ailk_Bljk_SB_MT32x32x32_SE_DTL0_EPS1_FL1_GRVW1_LPB2_PGR1_PLR1_TT4_2_USFGRO1_VW2_WG8_16_2_WGM1
    SolutionIndex: 72
    SolutionNameMin: Cijk_Ailk_Bljk_SB_MT32x64x32_SE_DTL0_EPS1_FL0_GRVW4_LPB4_PGR1_PLR1_TT4_4_USFGRO0_VW4_WG8_16_2_WGM8
    SolutionIndex: 73
    SolutionNameMin: Cijk_Ailk_Bljk_SB_MT32x64x32_SE_DTL0_EPS1_FL1_GRVW2_LPB2_PGR1_PLR1_TT4_4_USFGRO0_VW2_WG8_16_2_WGM8
    SolutionIndex: 74
    SolutionNameMin: Cijk_Ailk_Bljk_SB_MT32x64x32_SE_DTL0_EPS1_FL1_GRVW4_LPB4_PGR1_PLR1_TT4_4_USFGRO0_VW4_WG8_16_2_WGM8
    SolutionIndex: 75
    SolutionNameMin: Cijk_Ailk_Bljk_SB_MT64x32x32_SE_DTL0_EPS1_FL1_GRVW4_LPB0_PGR1_PLR1_TT4_4_USFGRO0_VW4_WG16_8_2_WGM8
    SolutionIndex: 76
    SolutionNameMin: Cijk_Ailk_Bljk_SB_MT64x32x16_SE_DTL0_EPS1_FL0_GRVW4_LPB4_PGR1_PLR1_TT4_4_USFGRO0_VW4_WG16_8_2_WGM1
    SolutionIndex: 77
    SolutionNameMin: Cijk_Ailk_Bljk_SB_MT64x32x32_SE_DTL0_EPS1_FL0_GRVW4_LPB4_PGR1_PLR1_TT4_4_USFGRO0_VW4_WG16_8_2_WGM8
    SolutionIndex: 78
    SolutionNameMin: Cijk_Ailk_Bljk_SB_MT64x32x32_SE_DTL0_EPS1_FL1_GRVW2_LPB2_PGR1_PLR1_TT4_4_USFGRO0_VW2_WG16_8_2_WGM8
    SolutionIndex: 79
    SolutionNameMin: Cijk_Ailk_Bljk_SB_MT64x32x16_SE_DTL0_EPS1_FL1_GRVW4_LPB4_PGR1_PLR1_TT4_4_USFGRO0_VW4_WG16_8_2_WGM8
    SolutionIndex: 80
    SolutionNameMin: Cijk_Ailk_Bljk_SB_MT64x32x32_SE_DTL0_EPS1_FL1_GRVW4_LPB4_PGR1_PLR1_TT4_4_USFGRO0_VW4_WG16_8_2_WGM8
    SolutionIndex: 81
    SolutionNameMin: Cijk_Ailk_Bljk_SB_MT32x16x32_SE_DTL0_EPS1_FL0_GRVW2_LPB2_PGR1_PLR0_TT2_4_USFGRO0_VW2_WG16_4_4_WGM8
    SolutionIndex: 82
    SolutionNameMin: Cijk_Ailk_Bljk_SB_MT32x16x32_SE_DTL0_EPS1_FL1_GRVW2_LPB2_PGR1_PLR0_TT2_4_USFGRO0_VW2_WG16_4_4_WGM8
    SolutionIndex: 83
    SolutionNameMin: Cijk_Ailk_Bljk_SB_MT32x16x32_SE_DTL0_EPS1_FL0_GRVW1_LPB2_PGR1_PLR1_TT2_4_USFGRO1_VW2_WG16_4_4_WGM8
    SolutionIndex: 84
    SolutionNameMin: Cijk_Ailk_Bljk_SB_MT64x16x32_SE_DTL0_EPS1_FL0_GRVW4_LPB4_PGR1_PLR0_TT4_4_USFGRO0_VW4_WG16_4_4_WGM8
    SolutionIndex: 85
    SolutionNameMin: Cijk_Ailk_Bljk_SB_MT64x16x32_SE_DTL0_EPS1_FL0_GRVW1_LPB4_PGR1_PLR1_TT4_4_USFGRO1_VW4_WG16_4_4_WGM1
    SolutionIndex: 86
    SolutionNameMin: Cijk_Ailk_Bljk_SB_MT64x16x16_SE_DTL0_EPS1_FL0_GRVW4_LPB4_PGR1_PLR1_TT4_4_USFGRO0_VW4_WG16_4_4_WGM8
    SolutionIndex: 87
    SolutionNameMin: Cijk_Ailk_Bljk_SB_MT64x16x32_SE_DTL0_EPS1_FL0_GRVW4_LPB4_PGR1_PLR1_TT4_4_USFGRO0_VW4_WG16_4_4_WGM1
    SolutionIndex: 88
    SolutionNameMin: Cijk_Ailk_Bljk_SB_MT64x16x32_SE_DTL0_EPS1_FL0_GRVW4_LPB4_PGR1_PLR1_TT4_4_USFGRO0_VW4_WG16_4_4_WGM8
    SolutionIndex: 89
    SolutionNameMin: Cijk_Ailk_Bljk_SB_MT64x16x16_SE_DTL0_EPS1_FL1_GRVW4_LPB4_PGR1_PLR1_TT4_4_USFGRO0_VW4_WG16_4_4_WGM1
    SolutionIndex: 90
    SolutionNameMin: Cijk_Ailk_Bljk_SB_MT64x16x32_SE_DTL0_EPS1_FL1_GRVW4_LPB4_PGR1_PLR1_TT4_4_USFGRO0_VW4_WG16_4_4_WGM8
    SolutionIndex: 91
    SolutionNameMin: Cijk_Ailk_Bljk_SB_MT64x32x8_SE_DTL0_EPS0_FL0_GRVW1_LPB0_PGR0_PLR0_TT4_4_USFGRO1_VW2_WG16_8_1_WGM1
    SolutionIndex: 92
    SolutionNameMin: Cijk_Ailk_Bljk_SB_MT64x32x8_SE_DTL0_EPS1_FL0_GRVW2_LPB0_PGR1_PLR0_TT4_4_USFGRO0_VW2_WG16_8_1_WGM1
    SolutionIndex: 93
    SolutionNameMin: Cijk_Ailk_Bljk_SB_MT64x32x8_SE_DTL0_EPS1_FL1_GRVW1_LPB0_PGR1_PLR0_TT4_4_USFGRO1_VW2_WG16_8_1_WGM1
    SolutionIndex: 94
    SolutionNameMin: Cijk_Ailk_Bljk_SB_MT64x32x8_SE_DTL0_EPS1_FL1_GRVW2_LPB0_PGR1_PLR0_TT4_4_USFGRO0_VW2_WG16_8_1_WGM1
    SolutionIndex: 95
    SolutionNameMin: Cijk_Ailk_Bljk_SB_MT64x32x8_SE_DTL0_EPS0_FL0_GRVW1_LPB0_PGR0_PLR1_TT4_4_USFGRO1_VW2_WG16_8_1_WGM1
    SolutionIndex: 96
    SolutionNameMin: Cijk_Ailk_Bljk_SB_MT64x32x8_SE_DTL0_EPS1_FL0_GRVW2_LPB0_PGR1_PLR1_TT4_4_USFGRO0_VW2_WG16_8_1_WGM1
    SolutionIndex: 97
    SolutionNameMin: Cijk_Ailk_Bljk_SB_MT64x32x8_SE_DTL0_EPS1_FL1_GRVW2_LPB0_PGR1_PLR1_TT4_4_USFGRO0_VW2_WG16_8_1_WGM1
    SolutionIndex: 98
    SolutionNameMin: Cijk_Ailk_Bljk_SB_MT64x32x8_SE_DTL0_EPS0_FL0_GRVW1_LPB2_PGR0_PLR0_TT4_4_USFGRO1_VW2_WG16_8_1_WGM1
    SolutionIndex: 99
    SolutionNameMin: Cijk_Ailk_Bljk_SB_MT64x32x8_SE_DTL0_EPS0_FL1_GRVW2_LPB2_PGR0_PLR0_TT4_4_USFGRO0_VW2_WG16_8_1_WGM1
    SolutionIndex: 100
    SolutionNameMin: Cijk_Ailk_Bljk_SB_MT64x32x16_SE_DTL0_EPS0_FL1_GRVW4_LPB4_PGR0_PLR0_TT4_4_USFGRO0_VW4_WG16_8_1_WGM8
    SolutionIndex: 101
    SolutionNameMin: Cijk_Ailk_Bljk_SB_MT64x32x8_SE_DTL0_EPS1_FL0_GRVW2_LPB2_PGR1_PLR0_TT4_4_USFGRO0_VW2_WG16_8_1_WGM1
    SolutionIndex: 102
    SolutionNameMin: Cijk_Ailk_Bljk_SB_MT64x32x8_SE_DTL0_EPS0_FL0_GRVW1_LPB2_PGR0_PLR1_TT4_4_USFGRO1_VW2_WG16_8_1_WGM1
    SolutionIndex: 103
    SolutionNameMin: Cijk_Ailk_Bljk_SB_MT64x32x8_SE_DTL0_EPS0_FL0_GRVW4_LPB4_PGR0_PLR1_TT4_4_USFGRO0_VW4_WG16_8_1_WGM1
    SolutionIndex: 104
    SolutionNameMin: Cijk_Ailk_Bljk_SB_MT64x32x8_SE_DTL0_EPS0_FL1_GRVW1_LPB2_PGR0_PLR1_TT4_4_USFGRO1_VW2_WG16_8_1_WGM1
    SolutionIndex: 105
    SolutionNameMin: Cijk_Ailk_Bljk_SB_MT64x32x8_SE_DTL0_EPS1_FL1_GRVW1_LPB2_PGR1_PLR1_TT4_4_USFGRO1_VW2_WG16_8_1_WGM1
    SolutionIndex: 106
    SolutionNameMin: Cijk_Ailk_Bljk_SB_MT64x16x8_SE_DTL0_EPS0_FL0_GRVW1_LPB0_PGR0_PLR0_TT4_2_USFGRO1_VW2_WG16_8_1_WGM1
    SolutionIndex: 107
    SolutionNameMin: Cijk_Ailk_Bljk_SB_MT64x16x16_SE_DTL0_EPS0_FL0_GRVW1_LPB0_PGR0_PLR0_TT4_2_USFGRO1_VW2_WG16_8_1_WGM8
    SolutionIndex: 108
    SolutionNameMin: Cijk_Ailk_Bljk_SB_MT64x16x8_SE_DTL0_EPS0_FL1_GRVW1_LPB0_PGR0_PLR0_TT4_2_USFGRO1_VW2_WG16_8_1_WGM1
    SolutionIndex: 109
    SolutionNameMin: Cijk_Ailk_Bljk_SB_MT64x16x16_SE_DTL0_EPS0_FL1_GRVW2_LPB0_PGR0_PLR0_TT4_2_USFGRO0_VW2_WG16_8_1_WGM1
    SolutionIndex: 110
    SolutionNameMin: Cijk_Ailk_Bljk_SB_MT64x16x8_SE_DTL0_EPS1_FL0_GRVW2_LPB0_PGR1_PLR0_TT4_2_USFGRO0_VW2_WG16_8_1_WGM1
    SolutionIndex: 111
    SolutionNameMin: Cijk_Ailk_Bljk_SB_MT64x16x8_SE_DTL0_EPS1_FL1_GRVW1_LPB0_PGR1_PLR0_TT4_2_USFGRO1_VW2_WG16_8_1_WGM1
    SolutionIndex: 112
    SolutionNameMin: Cijk_Ailk_Bljk_SB_MT64x16x8_SE_DTL0_EPS0_FL0_GRVW1_LPB0_PGR0_PLR1_TT4_2_USFGRO1_VW2_WG16_8_1_WGM1
    SolutionIndex: 113
    SolutionNameMin: Cijk_Ailk_Bljk_SB_MT64x16x16_SE_DTL0_EPS0_FL0_GRVW1_LPB0_PGR0_PLR1_TT4_2_USFGRO1_VW2_WG16_8_1_WGM1
    SolutionIndex: 114
    SolutionNameMin: Cijk_Ailk_Bljk_SB_MT64x16x16_SE_DTL0_EPS0_FL1_GRVW1_LPB0_PGR0_PLR1_TT4_2_USFGRO1_VW2_WG16_8_1_WGM8
    SolutionIndex: 115
    SolutionNameMin: Cijk_Ailk_Bljk_SB_MT64x16x8_SE_DTL0_EPS0_FL0_GRVW1_LPB2_PGR0_PLR0_TT4_2_USFGRO1_VW2_WG16_8_1_WGM1
    SolutionIndex: 116
    SolutionNameMin: Cijk_Ailk_Bljk_SB_MT64x16x8_SE_DTL0_EPS0_FL1_GRVW1_LPB2_PGR0_PLR0_TT4_2_USFGRO1_VW2_WG16_8_1_WGM1
    SolutionIndex: 117
    SolutionNameMin: Cijk_Ailk_Bljk_SB_MT64x16x8_SE_DTL0_EPS1_FL1_GRVW2_LPB2_PGR1_PLR0_TT4_2_USFGRO0_VW2_WG16_8_1_WGM1
    SolutionIndex: 118
    SolutionNameMin: Cijk_Ailk_Bljk_SB_MT64x16x8_SE_DTL0_EPS0_FL0_GRVW1_LPB2_PGR0_PLR1_TT4_2_USFGRO1_VW2_WG16_8_1_WGM1
    SolutionIndex: 119
    SolutionNameMin: Cijk_Ailk_Bljk_SB_MT64x16x16_SE_DTL0_EPS0_FL0_GRVW1_LPB2_PGR0_PLR1_TT4_2_USFGRO1_VW2_WG16_8_1_WGM1
    SolutionIndex: 120
    SolutionNameMin: Cijk_Ailk_Bljk_SB_MT64x16x8_SE_DTL0_EPS0_FL1_GRVW1_LPB2_PGR0_PLR1_TT4_2_USFGRO1_VW2_WG16_8_1_WGM1
    SolutionIndex: 121
    SolutionNameMin: Cijk_Ailk_Bljk_SB_MT32x32x16_SE_DTL0_EPS0_FL0_GRVW1_LPB2_PGR0_PLR1_TT2_4_USFGRO1_VW2_WG16_8_1_WGM8
    SolutionIndex: 122
    SolutionNameMin: Cijk_Ailk_Bljk_SB_MT32x32x8_SE_DTL0_EPS1_FL1_GRVW2_LPB2_PGR1_PLR1_TT2_4_USFGRO0_VW2_WG16_8_1_WGM1
    SolutionIndex: 123
    SolutionNameMin: Cijk_Ailk_Bljk_SB_MT64x64x8_SE_DTL0_EPS1_FL1_GRVW4_LPB0_PGR1_PLR1_TT4_8_USFGRO0_VW4_WG16_8_1_WGM1
    SolutionIndex: 124
    SolutionNameMin: Cijk_Ailk_Bljk_SB_MT32x64x8_SE_DTL0_EPS0_FL0_GRVW1_LPB2_PGR0_PLR0_TT4_4_USFGRO1_VW2_WG8_16_1_WGM1
    SolutionIndex: 125
    SolutionNameMin: Cijk_Ailk_Bljk_SB_MT32x64x8_SE_DTL0_EPS0_FL0_GRVW1_LPB2_PGR0_PLR1_TT4_4_USFGRO1_VW2_WG8_16_1_WGM1
    SolutionIndex: 126
    SolutionNameMin: Cijk_Ailk_Bljk_SB_MT32x32x8_SE_DTL0_EPS0_FL1_GRVW1_LPB0_PGR0_PLR1_TT4_2_USFGRO1_VW2_WG8_16_1_WGM1
    SolutionIndex: 127
    SolutionNameMin: Cijk_Ailk_Bljk_SB_MT32x32x8_SE_DTL0_EPS1_FL0_GRVW2_LPB0_PGR1_PLR1_TT4_2_USFGRO0_VW2_WG8_16_1_WGM1
    SolutionIndex: 128
    SolutionNameMin: Cijk_Ailk_Bljk_SB_MT32x32x8_SE_DTL0_EPS0_FL1_GRVW1_LPB2_PGR0_PLR1_TT4_2_USFGRO1_VW2_WG8_16_1_WGM1
    SolutionIndex: 129
    SolutionNameMin: Cijk_Ailk_Bljk_SB_MT32x32x8_SE_DTL0_EPS1_FL0_GRVW2_LPB2_PGR1_PLR1_TT4_2_USFGRO0_VW2_WG8_16_1_WGM1
    SolutionIndex: 130
    SolutionNameMin: Cijk_Ailk_Bljk_SB_MT32x32x8_SE_DTL0_EPS1_FL0_GRVW2_LPB2_PGR1_PLR1_TT4_2_USFGRO0_VW2_WG8_16_1_WGM8
    SolutionIndex: 131
    SolutionNameMin: Cijk_Ailk_Bljk_SB_MT32x32x8_SE_DTL0_EPS1_FL1_GRVW4_LPB2_PGR1_PLR1_TT4_2_USFGRO0_VW2_WG8_16_1_WGM1
    SolutionIndex: 132
    SolutionNameMin: Cijk_Ailk_Bljk_SB_MT64x64x8_SE_DTL0_EPS1_FL0_GRVW4_LPB0_PGR1_PLR1_TT8_4_USFGRO0_VW4_WG8_16_1_WGM1
    SolutionIndex: 133
    SolutionNameMin: Cijk_Ailk_Bljk_SB_MT64x64x8_SE_DTL0_EPS1_FL0_GRVW2_LPB2_PGR1_PLR1_TT8_4_USFGRO0_VW2_WG8_16_1_WGM1
- - - [512, 540, 1, 512, 512, 512, 512, 512]
    - [4, 2765.5]
  - - [512, 540, 1, 2048, 512, 512, 512, 2048]
    - [5, 3297.61]
  - - [512, 550, 1, 512, 512, 512, 512, 512]
    - [1, 2669.91]
  - - [512, 550, 1, 2048, 512, 512, 512, 2048]
    - [10, 3332.8]
  - - [512, 560, 1, 512, 512, 512, 512, 512]
    - [9, 2910.06]
  - - [512, 560, 1, 2048, 512, 512, 512, 2048]
    - [5, 3263.48]
  - - [512, 600, 1, 2048, 512, 512, 512, 2048]
    - [10, 3600.33]
  - - [512, 644, 1, 512, 512, 512, 512, 512]
    - [4, 3381.32]
  - - [512, 644, 1, 2048, 512, 512, 512, 2048]
    - [9, 3851.3]
  - - [512, 668, 1, 2048, 512, 512, 512, 2048]
    - [4, 3951.42]
  - - [512, 714, 1, 512, 512, 512, 512, 512]
    - [2, 3661.9]
  - - [512, 714, 1, 2048, 512, 512, 512, 2048]
    - [9, 4126.94]
  - - [512, 720, 1, 512, 512, 512, 512, 512]
    - [2, 3730.55]
  - - [512, 720, 1, 2048, 512, 512, 512, 2048]
    - [5, 4159.93]
  - - [512, 722, 1, 2048, 512, 512, 512, 2048]
    - [9, 4185.15]
  - - [512, 781, 1, 512, 512, 512, 512, 512]
    - [5, 4082.44]
  - - [512, 781, 1, 2048, 512, 512, 512, 2048]
    - [5, 4406.26]
  - - [512, 848, 1, 2048, 512, 512, 512, 2048]
    - [10, 4514.37]
  - - [512, 872, 1, 2048, 512, 512, 512, 2048]
    - [5, 4642.13]
  - - [512, 936, 1, 512, 512, 512, 512, 512]
    - [4, 4652.16]
  - - [512, 936, 1, 2048, 512, 512, 512, 2048]
    - [10, 4671.85]
  - - [512, 980, 1, 512, 512, 512, 512, 512]
    - [10, 4816.75]
  - - [512, 980, 1, 2048, 512, 512, 512, 2048]
    - [10, 5141.66]
  - - [512, 1139, 1, 2048, 512, 512, 512, 2048]
    - [5, 4571.28]
  - - [512, 1184, 1, 2048, 512, 512, 512, 2048]
    - [10, 4664.59]
  - - [512, 1186, 1, 2048, 512, 512, 512, 2048]
    - [5, 4726.41]
  - - [512, 1232, 1, 512, 512, 512, 512, 512]
    - [10, 4471.63]
  - - [512, 1232, 1, 2048, 512, 512, 512, 2048]
    - [14, 4772.67]
  - - [512, 1279, 1, 2048, 512, 512, 512, 2048]
    - [14, 4882.58]
  - - [512, 1290, 1, 512, 512, 512, 512, 512]
    - [10, 4682.12]
  - - [512, 1290, 1, 2048, 512, 512, 512, 2048]
    - [13, 4959.36]
  - - [512, 1327, 1, 2048, 512, 512, 512, 2048]
    - [10, 5007.76]
  - - [512, 1331, 1, 2048, 512, 512, 512, 2048]
    - [13, 5056.56]
  - - [512, 1341, 1, 2048, 512, 512, 512, 2048]
    - [13, 4986.15]
  - - [512, 1350, 1, 512, 512, 512, 512, 512]
    - [5, 4874.91]
  - - [512, 1350, 1, 2048, 512, 512, 512, 2048]
    - [10, 5101.36]
  - - [512, 1359, 1, 2048, 512, 512, 512, 2048]
    - [10, 5079.77]
  - - [512, 1391, 1, 2048, 512, 512, 512, 2048]
    - [5, 5064.31]
  - - [512, 1424, 1, 512, 512, 512, 512, 512]
    - [10, 5090.21]
  - - [512, 1424, 1, 2048, 512, 512, 512, 2048]
    - [5, 5189.79]
  - - [512, 1458, 1, 512, 512, 512, 512, 512]
    - [17, 5123.75]
  - - [512, 1458, 1, 2048, 512, 512, 512, 2048]
    - [5, 4981.52]
  - - [512, 1462, 1, 512, 512, 512, 512, 512]
    - [5, 5137.8]
  - - [512, 1462, 1, 2048, 512, 512, 512, 2048]
    - [4, 5009.7]
  - - [512, 1467, 1, 2048, 512, 512, 512, 2048]
    - [9, 4947.78]
  - - [512, 1472, 1, 2048, 512, 512, 512, 2048]
    - [39, 4971.76]
  - - [512, 1520, 1, 512, 512, 512, 512, 512]
    - [17, 5325.74]
  - - [512, 1520, 1, 2048, 512, 512, 512, 2048]
    - [38, 5003.73]
  - - [512, 1596, 1, 512, 512, 512, 512, 512]
    - [18, 4852.21]
  - - [512, 1596, 1, 2048, 512, 512, 512, 2048]
    - [46, 5162.68]
  - - [512, 1599, 1, 512, 512, 512, 512, 512]
    - [36, 4844.67]
  - - [512, 1599, 1, 2048, 512, 512, 512, 2048]
    - [38, 5162.94]
  - - [512, 1615, 1, 512, 512, 512, 512, 512]
    - [44, 4982.76]
  - - [512, 1615, 1, 2048, 512, 512, 512, 2048]
    - [46, 5183.86]
  - - [512, 1680, 1, 512, 512, 512, 512, 512]
    - [36, 5107.59]
  - - [512, 1680, 1, 2048, 512, 512, 512, 2048]
    - [47, 5246.17]
  - - [512, 1709, 1, 2048, 512, 512, 512, 2048]
    - [47, 5228.32]
  - - [512, 1890, 1, 512, 512, 512, 512, 512]
    - [21, 5274.75]
  - - [512, 1902, 1, 2048, 512, 512, 512, 2048]
    - [42, 5195.56]
  - - [512, 1917, 1, 512, 512, 512, 512, 512]
    - [22, 5287.56]
  - - [512, 1917, 1, 2048, 512, 512, 512, 2048]
    - [39, 5387.28]
  - - [512, 2076, 1, 2048, 512, 512, 512, 2048]
    - [17, 4371.68]
  - - [512, 2195, 1, 2048, 512, 512, 512, 2048]
    - [6, 4545.85]
  - - [512, 2205, 1, 512, 512, 512, 512, 512]
    - [15, 5103.41]
  - - [512, 2205, 1, 2048, 512, 512, 512, 2048]
    - [12, 4596.15]
  - - [512, 2387, 1, 512, 512, 512, 512, 512]
    - [5, 5359.89]
  - - [512, 2418, 1, 512, 512, 512, 512, 512]
    - [10, 5385.06]
  - - [512, 2418, 1, 2048, 512, 512, 512, 2048]
    - [7, 4900.15]
  - - [512, 2496, 1, 512, 512, 512, 512, 512]
    - [36, 5544.82]
  - - [512, 2496, 1, 2048, 512, 512, 512, 2048]
    - [27, 5071.29]
  - - [512, 2790, 1, 2048, 512, 512, 512, 2048]
    - [6, 5022.04]
  - - [512, 2864, 1, 2048, 512, 512, 512, 2048]
    - [6, 5107.82]
  - - [512, 3092, 1, 2048, 512, 512, 512, 2048]
    - [39, 4910.05]
  - - [512, 3113, 1, 2048, 512, 512, 512, 2048]
    - [39, 5117.35]
  - - [512, 3137, 1, 2048, 512, 512, 512, 2048]
    - [6, 4854.09]
  - - [512, 3165, 1, 2048, 512, 512, 512, 2048]
    - [47, 5048.06]
  - - [512, 3166, 1, 2048, 512, 512, 512, 2048]
    - [39, 5173.23]
  - - [512, 3194, 1, 2048, 512, 512, 512, 2048]
    - [39, 5094.31]
  - - [512, 3219, 1, 2048, 512, 512, 512, 2048]
    - [47, 5076.98]
  - - [512, 3222, 1, 2048, 512, 512, 512, 2048]
    - [39, 5083.98]
  - - [512, 3234, 1, 2048, 512, 512, 512, 2048]
    - [38, 4995.44]
  - - [512, 3237, 1, 2048, 512, 512, 512, 2048]
    - [46, 5061.95]
  - - [512, 3242, 1, 2048, 512, 512, 512, 2048]
    - [39, 5064.17]
  - - [512, 3246, 1, 2048, 512, 512, 512, 2048]
    - [54, 5089.51]
  - - [512, 3249, 1, 2048, 512, 512, 512, 2048]
    - [46, 5085.2]
  - - [512, 3251, 1, 2048, 512, 512, 512, 2048]
    - [39, 5155.03]
  - - [512, 3257, 1, 2048, 512, 512, 512, 2048]
    - [47, 5162.8]
  - - [512, 3262, 1, 2048, 512, 512, 512, 2048]
    - [47, 5205.7]
  - - [512, 3268, 1, 2048, 512, 512, 512, 2048]
    - [39, 5090.18]
  - - [512, 3282, 1, 2048, 512, 512, 512, 2048]
    - [39, 5121.0]
  - - [512, 3286, 1, 2048, 512, 512, 512, 2048]
    - [11, 5035.65]
  - - [512, 3287, 1, 2048, 512, 512, 512, 2048]
    - [47, 5154.94]
  - - [512, 3293, 1, 2048, 512, 512, 512, 2048]
    - [47, 5152.93]
  - - [512, 3297, 1, 2048, 512, 512, 512, 2048]
    - [39, 5280.61]
  - - [512, 3307, 1, 2048, 512, 512, 512, 2048]
    - [39, 5111.55]
  - - [512, 3314, 1, 2048, 512, 512, 512, 2048]
    - [39, 5134.71]
  - - [512, 3315, 1, 2048, 512, 512, 512, 2048]
    - [47, 5159.41]
  - - [512, 3319, 1, 2048, 512, 512, 512, 2048]
    - [39, 5163.93]
  - - [512, 3322, 1, 2048, 512, 512, 512, 2048]
    - [39, 5138.1]
  - - [512, 3323, 1, 2048, 512, 512, 512, 2048]
    - [39, 5128.44]
  - - [512, 3324, 1, 2048, 512, 512, 512, 2048]
    - [47, 5276.69]
  - - [512, 3325, 1, 2048, 512, 512, 512, 2048]
    - [47, 5267.64]
  - - [512, 3327, 1, 2048, 512, 512, 512, 2048]
    - [6, 5122.33]
  - - [512, 3329, 1, 2048, 512, 512, 512, 2048]
    - [49, 5138.83]
  - - [512, 3332, 1, 2048, 512, 512, 512, 2048]
    - [47, 5363.98]
  - - [512, 3336, 1, 2048, 512, 512, 512, 2048]
    - [47, 5111.17]
  - - [512, 3339, 1, 2048, 512, 512, 512, 2048]
    - [49, 5174.58]
  - - [512, 3342, 1, 2048, 512, 512, 512, 2048]
    - [38, 5315.99]
  - - [512, 3344, 1, 2048, 512, 512, 512, 2048]
    - [47, 5206.26]
  - - [512, 3358, 1, 2048, 512, 512, 512, 2048]
    - [7, 5059.99]
  - - [512, 3360, 1, 2048, 512, 512, 512, 2048]
    - [49, 5156.87]
  - - [512, 3364, 1, 2048, 512, 512, 512, 2048]
    - [39, 5290.94]
  - - [512, 3365, 1, 2048, 512, 512, 512, 2048]
    - [54, 5106.96]
  - - [512, 3369, 1, 2048, 512, 512, 512, 2048]
    - [47, 5409.39]
  - - [512, 3370, 1, 2048, 512, 512, 512, 2048]
    - [12, 5094.88]
  - - [512, 3371, 1, 2048, 512, 512, 512, 2048]
    - [11, 5141.97]
  - - [512, 3374, 1, 2048, 512, 512, 512, 2048]
    - [47, 5377.17]
  - - [512, 3376, 1, 2048, 512, 512, 512, 2048]
    - [39, 5180.31]
  - - [512, 3377, 1, 2048, 512, 512, 512, 2048]
    - [39, 5193.1]
  - - [512, 3378, 1, 2048, 512, 512, 512, 2048]
    - [47, 5138.26]
  - - [512, 3381, 1, 2048, 512, 512, 512, 2048]
    - [38, 5230.5]
  - - [512, 3382, 1, 2048, 512, 512, 512, 2048]
    - [39, 5175.49]
  - - [512, 3383, 1, 2048, 512, 512, 512, 2048]
    - [11, 5210.25]
  - - [512, 3384, 1, 2048, 512, 512, 512, 2048]
    - [39, 5351.53]
  - - [512, 3385, 1, 2048, 512, 512, 512, 2048]
    - [47, 5299.23]
  - - [512, 3386, 1, 2048, 512, 512, 512, 2048]
    - [56, 5201.29]
  - - [512, 3388, 1, 2048, 512, 512, 512, 2048]
    - [46, 5260.88]
  - - [512, 3390, 1, 2048, 512, 512, 512, 2048]
    - [38, 5167.06]
  - - [512, 3391, 1, 2048, 512, 512, 512, 2048]
    - [51, 5199.37]
  - - [512, 3396, 1, 2048, 512, 512, 512, 2048]
    - [54, 5325.88]
  - - [512, 3399, 1, 2048, 512, 512, 512, 2048]
    - [38, 5283.76]
  - - [512, 3402, 1, 2048, 512, 512, 512, 2048]
    - [54, 5207.22]
  - - [512, 3410, 1, 2048, 512, 512, 512, 2048]
    - [47, 5403.52]
  - - [512, 3412, 1, 2048, 512, 512, 512, 2048]
    - [47, 5301.05]
  - - [512, 3414, 1, 2048, 512, 512, 512, 2048]
    - [39, 5320.51]
  - - [512, 3415, 1, 2048, 512, 512, 512, 2048]
    - [47, 5314.47]
  - - [512, 3418, 1, 2048, 512, 512, 512, 2048]
    - [39, 5484.34]
  - - [512, 3420, 1, 2048, 512, 512, 512, 2048]
    - [12, 5130.47]
  - - [512, 3422, 1, 2048, 512, 512, 512, 2048]
    - [56, 5190.68]
  - - [512, 3425, 1, 2048, 512, 512, 512, 2048]
    - [6, 5175.27]
  - - [512, 3426, 1, 2048, 512, 512, 512, 2048]
    - [39, 5308.24]
  - - [512, 3427, 1, 2048, 512, 512, 512, 2048]
    - [54, 5257.99]
  - - [512, 3428, 1, 2048, 512, 512, 512, 2048]
    - [39, 5448.5]
  - - [512, 3430, 1, 2048, 512, 512, 512, 2048]
    - [6, 5193.36]
  - - [512, 3431, 1, 2048, 512, 512, 512, 2048]
    - [47, 5362.36]
  - - [512, 3432, 1, 2048, 512, 512, 512, 2048]
    - [39, 5236.71]
  - - [512, 3433, 1, 2048, 512, 512, 512, 2048]
    - [6, 5178.51]
  - - [512, 3438, 1, 2048, 512, 512, 512, 2048]
    - [49, 5250.96]
  - - [512, 3439, 1, 2048, 512, 512, 512, 2048]
    - [47, 5249.66]
  - - [512, 3440, 1, 2048, 512, 512, 512, 2048]
    - [47, 5437.66]
  - - [512, 3443, 1, 2048, 512, 512, 512, 2048]
    - [38, 5296.89]
  - - [512, 3445, 1, 2048, 512, 512, 512, 2048]
    - [47, 5409.92]
  - - [512, 3447, 1, 2048, 512, 512, 512, 2048]
    - [39, 5478.71]
  - - [512, 3448, 1, 2048, 512, 512, 512, 2048]
    - [47, 5312.09]
  - - [512, 3450, 1, 2048, 512, 512, 512, 2048]
    - [38, 5378.98]
  - - [512, 3451, 1, 2048, 512, 512, 512, 2048]
    - [35, 5225.15]
  - - [512, 3452, 1, 2048, 512, 512, 512, 2048]
    - [39, 5300.94]
  - - [512, 3453, 1, 2048, 512, 512, 512, 2048]
    - [46, 5327.91]
  - - [512, 3455, 1, 2048, 512, 512, 512, 2048]
    - [6, 5251.43]
  - - [512, 3456, 1, 2048, 512, 512, 512, 2048]
    - [39, 5336.03]
  - - [512, 3457, 1, 2048, 512, 512, 512, 2048]
    - [47, 5264.08]
  - - [512, 3458, 1, 2048, 512, 512, 512, 2048]
    - [39, 5272.41]
  - - [512, 3459, 1, 2048, 512, 512, 512, 2048]
    - [46, 5447.62]
  - - [512, 3460, 1, 2048, 512, 512, 512, 2048]
    - [47, 5463.17]
  - - [512, 3461, 1, 2048, 512, 512, 512, 2048]
    - [39, 5451.98]
  - - [512, 3462, 1, 2048, 512, 512, 512, 2048]
    - [39, 5295.62]
  - - [512, 3466, 1, 2048, 512, 512, 512, 2048]
    - [39, 5440.48]
  - - [512, 3467, 1, 2048, 512, 512, 512, 2048]
    - [39, 5417.42]
  - - [512, 3468, 1, 2048, 512, 512, 512, 2048]
    - [47, 5421.98]
  - - [512, 3470, 1, 2048, 512, 512, 512, 2048]
    - [11, 5224.86]
  - - [512, 3471, 1, 2048, 512, 512, 512, 2048]
    - [39, 5277.45]
  - - [512, 3472, 1, 2048, 512, 512, 512, 2048]
    - [47, 5441.45]
  - - [512, 3475, 1, 2048, 512, 512, 512, 2048]
    - [46, 5381.8]
  - - [512, 3476, 1, 2048, 512, 512, 512, 2048]
    - [38, 5364.57]
  - - [512, 3477, 1, 2048, 512, 512, 512, 2048]
    - [46, 5242.09]
  - - [512, 3478, 1, 2048, 512, 512, 512, 2048]
    - [47, 5450.86]
  - - [512, 3479, 1, 2048, 512, 512, 512, 2048]
    - [47, 5293.59]
  - - [512, 3480, 1, 2048, 512, 512, 512, 2048]
    - [12, 5280.92]
  - - [512, 3481, 1, 2048, 512, 512, 512, 2048]
    - [39, 5329.86]
  - - [512, 3483, 1, 2048, 512, 512, 512, 2048]
    - [39, 5419.69]
  - - [512, 3484, 1, 2048, 512, 512, 512, 2048]
    - [47, 5406.98]
  - - [512, 3487, 1, 2048, 512, 512, 512, 2048]
    - [38, 5379.2]
  - - [512, 3489, 1, 2048, 512, 512, 512, 2048]
    - [6, 5336.34]
  - - [512, 3490, 1, 2048, 512, 512, 512, 2048]
    - [38, 5329.23]
  - - [512, 3491, 1, 2048, 512, 512, 512, 2048]
    - [50, 5279.5]
  - - [512, 3493, 1, 2048, 512, 512, 512, 2048]
    - [11, 5281.97]
  - - [512, 3494, 1, 2048, 512, 512, 512, 2048]
    - [47, 5404.13]
  - - [512, 3495, 1, 2048, 512, 512, 512, 2048]
    - [38, 5295.17]
  - - [512, 3497, 1, 2048, 512, 512, 512, 2048]
    - [12, 5258.8]
  - - [512, 3498, 1, 2048, 512, 512, 512, 2048]
    - [39, 5440.04]
  - - [512, 3499, 1, 2048, 512, 512, 512, 2048]
    - [54, 5424.31]
  - - [512, 3501, 1, 2048, 512, 512, 512, 2048]
    - [47, 5350.65]
  - - [512, 3503, 1, 2048, 512, 512, 512, 2048]
    - [55, 5393.3]
  - - [512, 3505, 1, 2048, 512, 512, 512, 2048]
    - [53, 5409.32]
  - - [512, 3507, 1, 2048, 512, 512, 512, 2048]
    - [46, 5250.97]
  - - [512, 3508, 1, 2048, 512, 512, 512, 2048]
    - [39, 5418.09]
  - - [512, 3509, 1, 2048, 512, 512, 512, 2048]
    - [47, 5518.38]
  - - [512, 3510, 1, 2048, 512, 512, 512, 2048]
    - [38, 5388.26]
  - - [512, 3511, 1, 2048, 512, 512, 512, 2048]
    - [47, 5515.4]
  - - [512, 3513, 1, 2048, 512, 512, 512, 2048]
    - [38, 5361.46]
  - - [512, 3514, 1, 2048, 512, 512, 512, 2048]
    - [39, 5509.11]
  - - [512, 3515, 1, 2048, 512, 512, 512, 2048]
    - [47, 5374.94]
  - - [512, 3517, 1, 2048, 512, 512, 512, 2048]
    - [47, 5390.82]
  - - [512, 3518, 1, 2048, 512, 512, 512, 2048]
    - [38, 5370.83]
  - - [512, 3519, 1, 2048, 512, 512, 512, 2048]
    - [47, 5450.54]
  - - [512, 3520, 1, 2048, 512, 512, 512, 2048]
    - [47, 5430.7]
  - - [512, 3523, 1, 2048, 512, 512, 512, 2048]
    - [49, 5386.02]
  - - [512, 3528, 1, 2048, 512, 512, 512, 2048]
    - [47, 5598.65]
  - - [512, 3529, 1, 2048, 512, 512, 512, 2048]
    - [47, 5467.23]
  - - [512, 3530, 1, 2048, 512, 512, 512, 2048]
    - [47, 5374.66]
  - - [512, 3531, 1, 2048, 512, 512, 512, 2048]
    - [47, 5472.72]
  - - [512, 3532, 1, 2048, 512, 512, 512, 2048]
    - [39, 5590.58]
  - - [512, 3533, 1, 2048, 512, 512, 512, 2048]
    - [38, 5339.03]
  - - [512, 3534, 1, 2048, 512, 512, 512, 2048]
    - [47, 5318.96]
  - - [512, 3538, 1, 2048, 512, 512, 512, 2048]
    - [38, 5553.5]
  - - [512, 3539, 1, 2048, 512, 512, 512, 2048]
    - [12, 5236.29]
  - - [512, 3540, 1, 2048, 512, 512, 512, 2048]
    - [47, 5291.98]
  - - [512, 3541, 1, 2048, 512, 512, 512, 2048]
    - [38, 5491.83]
  - - [512, 3547, 1, 2048, 512, 512, 512, 2048]
    - [47, 5436.21]
  - - [512, 3548, 1, 2048, 512, 512, 512, 2048]
    - [39, 5597.75]
  - - [512, 3552, 1, 2048, 512, 512, 512, 2048]
    - [47, 5331.88]
  - - [512, 3564, 1, 2048, 512, 512, 512, 2048]
    - [47, 5565.31]
  - - [512, 3575, 1, 2048, 512, 512, 512, 2048]
    - [38, 5411.74]
  - - [512, 3598, 1, 2048, 512, 512, 512, 2048]
    - [47, 5535.35]
  - - [512, 3599, 1, 2048, 512, 512, 512, 2048]
    - [47, 5445.16]
  - - [512, 3608, 1, 2048, 512, 512, 512, 2048]
    - [47, 5592.67]
  - - [512, 3776, 1, 512, 512, 512, 512, 512]
    - [23, 5616.9]
  - - [512, 3776, 1, 2048, 512, 512, 512, 2048]
    - [54, 5551.56]
  - - [512, 3780, 1, 512, 512, 512, 512, 512]
    - [19, 5604.0]
  - - [512, 3780, 1, 2048, 512, 512, 512, 2048]
    - [47, 5718.4]
  - - [512, 3780, 1, 33708, 512, 512, 512, 33708]
    - [53, 6705.74]
  - - [512, 3796, 1, 512, 512, 512, 512, 512]
    - [23, 5620.66]
  - - [512, 3796, 1, 2048, 512, 512, 512, 2048]
    - [43, 5512.83]
  - - [512, 3796, 1, 33708, 512, 512, 512, 33708]
    - [56, 6724.55]
  - - [512, 3822, 1, 512, 512, 512, 512, 512]
    - [23, 5628.54]
  - - [512, 3822, 1, 2048, 512, 512, 512, 2048]
    - [47, 5841.24]
  - - [512, 3822, 1, 33708, 512, 512, 512, 33708]
    - [52, 6853.41]
  - - [512, 3835, 1, 512, 512, 512, 512, 512]
    - [19, 5587.23]
  - - [512, 3835, 1, 2048, 512, 512, 512, 2048]
    - [38, 5635.96]
  - - [512, 3840, 1, 512, 512, 512, 512, 512]
    - [19, 5673.95]
  - - [512, 3840, 1, 2048, 512, 512, 512, 2048]
    - [38, 5806.68]
  - - [512, 3840, 1, 33708, 512, 512, 512, 33708]
    - [50, 6812.65]
  - - [512, 3859, 1, 512, 512, 512, 512, 512]
    - [19, 5733.15]
  - - [512, 3859, 1, 2048, 512, 512, 512, 2048]
    - [47, 5647.78]
  - - [512, 3859, 1, 33708, 512, 512, 512, 33708]
    - [50, 6844.17]
  - - [512, 3864, 1, 512, 512, 512, 512, 512]
    - [23, 5759.9]
  - - [512, 3864, 1, 2048, 512, 512, 512, 2048]
    - [46, 5714.17]
  - - [512, 3870, 1, 512, 512, 512, 512, 512]
    - [23, 5759.15]
  - - [512, 3870, 1, 2048, 512, 512, 512, 2048]
    - [39, 5838.95]
  - - [512, 3870, 1, 33708, 512, 512, 512, 33708]
    - [48, 6861.69]
  - - [512, 3876, 1, 512, 512, 512, 512, 512]
    - [19, 5765.66]
  - - [512, 3876, 1, 2048, 512, 512, 512, 2048]
    - [47, 5921.85]
  - - [512, 3876, 1, 33708, 512, 512, 512, 33708]
    - [50, 6868.77]
  - - [512, 3906, 1, 512, 512, 512, 512, 512]
    - [23, 5798.09]
  - - [512, 3906, 1, 2048, 512, 512, 512, 2048]
    - [28, 5588.3]
  - - [512, 3906, 1, 33708, 512, 512, 512, 33708]
    - [50, 6930.53]
  - - [512, 3910, 1, 512, 512, 512, 512, 512]
    - [19, 5762.93]
  - - [512, 3910, 1, 2048, 512, 512, 512, 2048]
    - [39, 5712.38]
  - - [512, 3910, 1, 33708, 512, 512, 512, 33708]
    - [48, 6934.14]
  - - [512, 3925, 1, 512, 512, 512, 512, 512]
    - [19, 5768.22]
  - - [512, 3925, 1, 2048, 512, 512, 512, 2048]
    - [47, 5825.68]
  - - [512, 3925, 1, 33708, 512, 512, 512, 33708]
    - [55, 6958.89]
  - - [512, 3927, 1, 512, 512, 512, 512, 512]
    - [19, 5797.65]
  - - [512, 3942, 1, 512, 512, 512, 512, 512]
    - [20, 5759.74]
  - - [512, 3942, 1, 2048, 512, 512, 512, 2048]
    - [47, 5759.72]
  - - [512, 3942, 1, 33708, 512, 512, 512, 33708]
    - [54, 6974.54]
  - - [512, 3944, 1, 512, 512, 512, 512, 512]
    - [24, 5741.31]
  - - [512, 3944, 1, 2048, 512, 512, 512, 2048]
    - [47, 5791.34]
  - - [512, 3944, 1, 33708, 512, 512, 512, 33708]
    - [48, 6995.5]
  - - [512, 3955, 1, 512, 512, 512, 512, 512]
    - [23, 5750.22]
  - - [512, 3955, 1, 2048, 512, 512, 512, 2048]
    - [46, 5753.77]
  - - [512, 3955, 1, 33708, 512, 512, 512, 33708]
    - [55, 6995.47]
  - - [512, 3968, 1, 512, 512, 512, 512, 512]
    - [23, 5880.27]
  - - [512, 3968, 1, 2048, 512, 512, 512, 2048]
    - [39, 5799.5]
  - - [512, 3968, 1, 33708, 512, 512, 512, 33708]
    - [55, 7037.7]
  - - [512, 3969, 1, 512, 512, 512, 512, 512]
    - [23, 5862.1]
  - - [512, 3969, 1, 2048, 512, 512, 512, 2048]
    - [47, 5908.33]
  - - [512, 3969, 1, 33708, 512, 512, 512, 33708]
    - [48, 7031.55]
  - - [512, 3976, 1, 512, 512, 512, 512, 512]
    - [23, 5877.36]
  - - [512, 3976, 1, 2048, 512, 512, 512, 2048]
    - [47, 5740.08]
  - - [512, 3976, 1, 33708, 512, 512, 512, 33708]
    - [48, 7044.91]
  - - [512, 3977, 1, 512, 512, 512, 512, 512]
    - [19, 5883.75]
  - - [512, 3977, 1, 2048, 512, 512, 512, 2048]
    - [46, 5874.53]
  - - [512, 3977, 1, 33708, 512, 512, 512, 33708]
    - [50, 7046.26]
  - - [512, 3978, 1, 512, 512, 512, 512, 512]
    - [23, 5836.41]
  - - [512, 3978, 1, 2048, 512, 512, 512, 2048]
    - [39, 5734.19]
  - - [512, 3978, 1, 33708, 512, 512, 512, 33708]
    - [50, 7045.67]
  - - [512, 3990, 1, 512, 512, 512, 512, 512]
    - [19, 5868.63]
  - - [512, 3990, 1, 2048, 512, 512, 512, 2048]
    - [47, 6031.57]
  - - [512, 3990, 1, 33708, 512, 512, 512, 33708]
    - [48, 7066.28]
  - - [512, 3995, 1, 512, 512, 512, 512, 512]
    - [23, 5902.96]
  - - [512, 3995, 1, 2048, 512, 512, 512, 2048]
    - [47, 5987.34]
  - - [512, 3995, 1, 33708, 512, 512, 512, 33708]
    - [48, 7080.52]
  - - [512, 3996, 1, 512, 512, 512, 512, 512]
    - [19, 5889.68]
  - - [512, 3996, 1, 2048, 512, 512, 512, 2048]
    - [39, 5957.3]
  - - [512, 3996, 1, 33708, 512, 512, 512, 33708]
    - [53, 7080.94]
  - - [512, 3999, 1, 512, 512, 512, 512, 512]
    - [23, 5894.11]
  - - [512, 3999, 1, 2048, 512, 512, 512, 2048]
    - [47, 5931.16]
  - - [512, 3999, 1, 33708, 512, 512, 512, 33708]
    - [48, 7084.8]
  - - [512, 4005, 1, 512, 512, 512, 512, 512]
    - [19, 5912.79]
  - - [512, 4005, 1, 2048, 512, 512, 512, 2048]
    - [39, 6080.87]
  - - [512, 4005, 1, 33708, 512, 512, 512, 33708]
    - [48, 7097.11]
  - - [512, 4012, 1, 512, 512, 512, 512, 512]
    - [19, 5920.67]
  - - [512, 4012, 1, 2048, 512, 512, 512, 2048]
    - [47, 5941.11]
  - - [512, 4012, 1, 33708, 512, 512, 512, 33708]
    - [48, 7108.11]
  - - [512, 4020, 1, 512, 512, 512, 512, 512]
    - [23, 5947.36]
  - - [512, 4020, 1, 2048, 512, 512, 512, 2048]
    - [43, 5743.27]
  - - [512, 4020, 1, 33708, 512, 512, 512, 33708]
    - [53, 7127.43]
  - - [512, 4026, 1, 512, 512, 512, 512, 512]
    - [23, 5916.65]
  - - [512, 4026, 1, 2048, 512, 512, 512, 2048]
    - [39, 6036.99]
  - - [512, 4026, 1, 33708, 512, 512, 512, 33708]
    - [50, 7137.36]
  - - [512, 4030, 1, 512, 512, 512, 512, 512]
    - [19, 5934.86]
  - - [512, 4030, 1, 2048, 512, 512, 512, 2048]
    - [39, 6044.27]
  - - [512, 4030, 1, 33708, 512, 512, 512, 33708]
    - [55, 7143.96]
  - - [512, 4032, 1, 512, 512, 512, 512, 512]
    - [23, 5947.69]
  - - [512, 4032, 1, 2048, 512, 512, 512, 2048]
    - [47, 6071.72]
  - - [512, 4032, 1, 33708, 512, 512, 512, 33708]
    - [53, 7148.0]
  - - [512, 4050, 1, 512, 512, 512, 512, 512]
    - [23, 5956.88]
  - - [512, 4059, 1, 512, 512, 512, 512, 512]
    - [23, 5952.79]
  - - [2048, 160, 1, 512, 2048, 2048, 2048, 512]
    - [4, 3240.13]
  - - [2048, 174, 1, 512, 2048, 2048, 2048, 512]
    - [5, 3503.58]
  - - [2048, 184, 1, 512, 2048, 2048, 2048, 512]
    - [5, 3715.49]
  - - [2048, 189, 1, 512, 2048, 2048, 2048, 512]
    - [5, 3762.8]
  - - [2048, 198, 1, 512, 2048, 2048, 2048, 512]
    - [5, 3998.19]
  - - [2048, 207, 1, 512, 2048, 2048, 2048, 512]
    - [8, 4156.24]
  - - [2048, 208, 1, 512, 2048, 2048, 2048, 512]
    - [3, 4141.07]
  - - [2048, 245, 1, 512, 2048, 2048, 2048, 512]
    - [0, 4463.38]
  - - [2048, 246, 1, 512, 2048, 2048, 2048, 512]
    - [10, 4674.06]
  - - [2048, 264, 1, 512, 2048, 2048, 2048, 512]
    - [16, 3904.9]
  - - [2048, 401, 1, 512, 2048, 2048, 2048, 512]
    - [45, 5127.6]
  - - [2048, 439, 1, 512, 2048, 2048, 2048, 512]
    - [34, 5504.14]
  - - [2048, 443, 1, 512, 2048, 2048, 2048, 512]
    - [40, 5529.83]
  - - [2048, 446, 1, 512, 2048, 2048, 2048, 512]
    - [33, 5586.96]
  - - [2048, 465, 1, 512, 2048, 2048, 2048, 512]
    - [44, 5748.67]
  - - [2048, 468, 1, 512, 2048, 2048, 2048, 512]
    - [36, 5785.72]
  - - [2048, 493, 1, 512, 2048, 2048, 2048, 512]
    - [33, 5985.03]
  - - [2048, 495, 1, 512, 2048, 2048, 2048, 512]
    - [40, 6050.85]
  - - [2048, 511, 1, 512, 2048, 2048, 2048, 512]
    - [40, 6203.59]
  - - [2048, 512, 1, 512, 2048, 2048, 2048, 512]
    - [44, 6237.1]
  - - [2048, 540, 1, 512, 2048, 2048, 2048, 512]
    - [15, 5352.86]
  - - [2048, 550, 1, 512, 2048, 2048, 2048, 512]
    - [17, 5425.4]
  - - [2048, 560, 1, 512, 2048, 2048, 2048, 512]
    - [15, 5637.94]
  - - [2048, 600, 1, 512, 2048, 2048, 2048, 512]
    - [5, 5447.83]
  - - [2048, 644, 1, 512, 2048, 2048, 2048, 512]
    - [36, 5847.34]
  - - [2048, 668, 1, 512, 2048, 2048, 2048, 512]
    - [44, 6042.0]
  - - [2048, 714, 1, 512, 2048, 2048, 2048, 512]
    - [45, 6364.54]
  - - [2048, 720, 1, 512, 2048, 2048, 2048, 512]
    - [36, 6450.51]
  - - [2048, 722, 1, 512, 2048, 2048, 2048, 512]
    - [44, 6407.61]
  - - [2048, 781, 1, 512, 2048, 2048, 2048, 512]
    - [10, 5392.82]
  - - [2048, 848, 1, 512, 2048, 2048, 2048, 512]
    - [5, 5718.76]
  - - [2048, 872, 1, 512, 2048, 2048, 2048, 512]
    - [25, 5900.28]
  - - [2048, 936, 1, 512, 2048, 2048, 2048, 512]
    - [29, 6270.39]
  - - [2048, 980, 1, 512, 2048, 2048, 2048, 512]
    - [30, 6580.73]
  - - [2048, 1139, 1, 512, 2048, 2048, 2048, 512]
    - [36, 6123.39]
  - - [2048, 1184, 1, 512, 2048, 2048, 2048, 512]
    - [37, 6370.15]
  - - [2048, 1186, 1, 512, 2048, 2048, 2048, 512]
    - [36, 6388.19]
  - - [2048, 1232, 1, 512, 2048, 2048, 2048, 512]
    - [36, 6610.81]
  - - [2048, 1279, 1, 512, 2048, 2048, 2048, 512]
    - [41, 6796.03]
  - - [2048, 1290, 1, 512, 2048, 2048, 2048, 512]
    - [45, 6056.49]
  - - [2048, 1327, 1, 512, 2048, 2048, 2048, 512]
    - [34, 6156.7]
  - - [2048, 1331, 1, 512, 2048, 2048, 2048, 512]
    - [34, 6191.49]
  - - [2048, 1341, 1, 512, 2048, 2048, 2048, 512]
    - [34, 6201.32]
  - - [2048, 1350, 1, 512, 2048, 2048, 2048, 512]
    - [45, 6288.13]
  - - [2048, 1359, 1, 512, 2048, 2048, 2048, 512]
    - [34, 6296.91]
  - - [2048, 1391, 1, 512, 2048, 2048, 2048, 512]
    - [41, 6370.12]
  - - [2048, 1424, 1, 512, 2048, 2048, 2048, 512]
    - [27, 6602.41]
  - - [2048, 1458, 1, 512, 2048, 2048, 2048, 512]
    - [34, 6705.15]
  - - [2048, 1462, 1, 512, 2048, 2048, 2048, 512]
    - [41, 6669.37]
  - - [2048, 1467, 1, 512, 2048, 2048, 2048, 512]
    - [37, 6683.56]
  - - [2048, 1472, 1, 512, 2048, 2048, 2048, 512]
    - [36, 6811.58]
  - - [2048, 1520, 1, 512, 2048, 2048, 2048, 512]
    - [41, 6916.11]
  - - [2048, 1596, 1, 512, 2048, 2048, 2048, 512]
    - [27, 6351.38]
  - - [2048, 1599, 1, 512, 2048, 2048, 2048, 512]
    - [27, 6372.28]
  - - [2048, 1615, 1, 512, 2048, 2048, 2048, 512]
    - [32, 6481.66]
  - - [2048, 1680, 1, 512, 2048, 2048, 2048, 512]
    - [27, 6729.18]
  - - [2048, 1709, 1, 512, 2048, 2048, 2048, 512]
    - [32, 6761.15]
  - - [2048, 1902, 1, 512, 2048, 2048, 2048, 512]
    - [27, 6597.25]
  - - [2048, 1917, 1, 512, 2048, 2048, 2048, 512]
    - [26, 6628.16]
  - - [2048, 2076, 1, 512, 2048, 2048, 2048, 512]
    - [37, 6482.76]
  - - [2048, 2195, 1, 512, 2048, 2048, 2048, 512]
    - [44, 6830.26]
  - - [2048, 2205, 1, 512, 2048, 2048, 2048, 512]
    - [44, 6853.84]
  - - [2048, 2418, 1, 512, 2048, 2048, 2048, 512]
    - [37, 6793.87]
  - - [2048, 2496, 1, 512, 2048, 2048, 2048, 512]
    - [27, 7062.09]
  - - [2048, 2790, 1, 512, 2048, 2048, 2048, 512]
    - [44, 7113.35]
  - - [2048, 2864, 1, 512, 2048, 2048, 2048, 512]
    - [27, 6804.42]
  - - [2048, 3092, 1, 512, 2048, 2048, 2048, 512]
    - [27, 6798.41]
  - - [2048, 3113, 1, 512, 2048, 2048, 2048, 512]
    - [27, 6822.33]
  - - [2048, 3137, 1, 512, 2048, 2048, 2048, 512]
    - [32, 6892.0]
  - - [2048, 3165, 1, 512, 2048, 2048, 2048, 512]
    - [27, 6930.93]
  - - [2048, 3166, 1, 512, 2048, 2048, 2048, 512]
    - [32, 6932.05]
  - - [2048, 3194, 1, 512, 2048, 2048, 2048, 512]
    - [45, 6987.95]
  - - [2048, 3219, 1, 512, 2048, 2048, 2048, 512]
    - [36, 7036.12]
  - - [2048, 3222, 1, 512, 2048, 2048, 2048, 512]
    - [27, 7074.36]
  - - [2048, 3234, 1, 512, 2048, 2048, 2048, 512]
    - [45, 7040.64]
  - - [2048, 3237, 1, 512, 2048, 2048, 2048, 512]
    - [32, 7054.77]
  - - [2048, 3242, 1, 512, 2048, 2048, 2048, 512]
    - [32, 7042.89]
  - - [2048, 3246, 1, 512, 2048, 2048, 2048, 512]
    - [32, 7076.55]
  - - [2048, 3249, 1, 512, 2048, 2048, 2048, 512]
    - [36, 7046.2]
  - - [2048, 3251, 1, 512, 2048, 2048, 2048, 512]
    - [27, 7052.7]
  - - [2048, 3257, 1, 512, 2048, 2048, 2048, 512]
    - [27, 7079.83]
  - - [2048, 3262, 1, 512, 2048, 2048, 2048, 512]
    - [32, 7089.6]
  - - [2048, 3268, 1, 512, 2048, 2048, 2048, 512]
    - [36, 7115.75]
  - - [2048, 3282, 1, 512, 2048, 2048, 2048, 512]
    - [36, 7129.79]
  - - [2048, 3286, 1, 512, 2048, 2048, 2048, 512]
    - [27, 7152.75]
  - - [2048, 3287, 1, 512, 2048, 2048, 2048, 512]
    - [34, 7056.18]
  - - [2048, 3293, 1, 512, 2048, 2048, 2048, 512]
    - [37, 7140.53]
  - - [2048, 3297, 1, 512, 2048, 2048, 2048, 512]
    - [45, 7118.67]
  - - [2048, 3307, 1, 512, 2048, 2048, 2048, 512]
    - [45, 7166.49]
  - - [2048, 3314, 1, 512, 2048, 2048, 2048, 512]
    - [44, 7165.22]
  - - [2048, 3315, 1, 512, 2048, 2048, 2048, 512]
    - [27, 7195.95]
  - - [2048, 3319, 1, 512, 2048, 2048, 2048, 512]
    - [27, 7205.74]
  - - [2048, 3322, 1, 512, 2048, 2048, 2048, 512]
    - [32, 7197.9]
  - - [2048, 3323, 1, 512, 2048, 2048, 2048, 512]
    - [27, 7166.06]
  - - [2048, 3324, 1, 512, 2048, 2048, 2048, 512]
    - [36, 7203.33]
  - - [2048, 3325, 1, 512, 2048, 2048, 2048, 512]
    - [32, 7194.49]
  - - [2048, 3327, 1, 512, 2048, 2048, 2048, 512]
    - [27, 7185.64]
  - - [2048, 3329, 1, 512, 2048, 2048, 2048, 512]
    - [32, 6879.27]
  - - [2048, 3332, 1, 512, 2048, 2048, 2048, 512]
    - [32, 6886.47]
  - - [2048, 3336, 1, 512, 2048, 2048, 2048, 512]
    - [32, 6860.68]
  - - [2048, 3339, 1, 512, 2048, 2048, 2048, 512]
    - [27, 6894.9]
  - - [2048, 3342, 1, 512, 2048, 2048, 2048, 512]
    - [27, 6915.22]
  - - [2048, 3344, 1, 512, 2048, 2048, 2048, 512]
    - [37, 6834.44]
  - - [2048, 3358, 1, 512, 2048, 2048, 2048, 512]
    - [26, 6837.38]
  - - [2048, 3360, 1, 512, 2048, 2048, 2048, 512]
    - [32, 6927.15]
  - - [2048, 3364, 1, 512, 2048, 2048, 2048, 512]
    - [27, 6933.37]
  - - [2048, 3365, 1, 512, 2048, 2048, 2048, 512]
    - [32, 6933.42]
  - - [2048, 3369, 1, 512, 2048, 2048, 2048, 512]
    - [37, 6862.74]
  - - [2048, 3370, 1, 512, 2048, 2048, 2048, 512]
    - [27, 6920.55]
  - - [2048, 3371, 1, 512, 2048, 2048, 2048, 512]
    - [27, 6924.61]
  - - [2048, 3374, 1, 512, 2048, 2048, 2048, 512]
    - [27, 6935.81]
  - - [2048, 3376, 1, 512, 2048, 2048, 2048, 512]
    - [27, 6971.3]
  - - [2048, 3377, 1, 512, 2048, 2048, 2048, 512]
    - [27, 6946.01]
  - - [2048, 3378, 1, 512, 2048, 2048, 2048, 512]
    - [27, 6922.92]
  - - [2048, 3381, 1, 512, 2048, 2048, 2048, 512]
    - [32, 6941.13]
  - - [2048, 3382, 1, 512, 2048, 2048, 2048, 512]
    - [27, 6976.57]
  - - [2048, 3383, 1, 512, 2048, 2048, 2048, 512]
    - [32, 6970.51]
  - - [2048, 3384, 1, 512, 2048, 2048, 2048, 512]
    - [32, 6963.45]
  - - [2048, 3385, 1, 512, 2048, 2048, 2048, 512]
    - [32, 6960.44]
  - - [2048, 3386, 1, 512, 2048, 2048, 2048, 512]
    - [26, 6874.62]
  - - [2048, 3388, 1, 512, 2048, 2048, 2048, 512]
    - [27, 6952.47]
  - - [2048, 3390, 1, 512, 2048, 2048, 2048, 512]
    - [27, 6956.58]
  - - [2048, 3391, 1, 512, 2048, 2048, 2048, 512]
    - [32, 6932.5]
  - - [2048, 3396, 1, 512, 2048, 2048, 2048, 512]
    - [27, 7012.6]
  - - [2048, 3399, 1, 512, 2048, 2048, 2048, 512]
    - [32, 6993.29]
  - - [2048, 3402, 1, 512, 2048, 2048, 2048, 512]
    - [27, 7012.71]
  - - [2048, 3410, 1, 512, 2048, 2048, 2048, 512]
    - [32, 7008.79]
  - - [2048, 3412, 1, 512, 2048, 2048, 2048, 512]
    - [30, 6926.41]
  - - [2048, 3414, 1, 512, 2048, 2048, 2048, 512]
    - [32, 7026.19]
  - - [2048, 3415, 1, 512, 2048, 2048, 2048, 512]
    - [32, 7002.8]
  - - [2048, 3418, 1, 512, 2048, 2048, 2048, 512]
    - [30, 6941.58]
  - - [2048, 3420, 1, 512, 2048, 2048, 2048, 512]
    - [27, 7022.21]
  - - [2048, 3422, 1, 512, 2048, 2048, 2048, 512]
    - [27, 7028.35]
  - - [2048, 3425, 1, 512, 2048, 2048, 2048, 512]
    - [27, 7006.05]
  - - [2048, 3426, 1, 512, 2048, 2048, 2048, 512]
    - [32, 7032.49]
  - - [2048, 3427, 1, 512, 2048, 2048, 2048, 512]
    - [27, 7011.16]
  - - [2048, 3428, 1, 512, 2048, 2048, 2048, 512]
    - [27, 7018.28]
  - - [2048, 3430, 1, 512, 2048, 2048, 2048, 512]
    - [27, 7020.33]
  - - [2048, 3431, 1, 512, 2048, 2048, 2048, 512]
    - [32, 7040.71]
  - - [2048, 3432, 1, 512, 2048, 2048, 2048, 512]
    - [32, 7039.7]
  - - [2048, 3433, 1, 512, 2048, 2048, 2048, 512]
    - [26, 6961.06]
  - - [2048, 3438, 1, 512, 2048, 2048, 2048, 512]
    - [27, 7044.86]
  - - [2048, 3439, 1, 512, 2048, 2048, 2048, 512]
    - [36, 6976.22]
  - - [2048, 3440, 1, 512, 2048, 2048, 2048, 512]
    - [32, 7068.4]
  - - [2048, 3443, 1, 512, 2048, 2048, 2048, 512]
    - [27, 7062.26]
  - - [2048, 3445, 1, 512, 2048, 2048, 2048, 512]
    - [32, 7032.74]
  - - [2048, 3447, 1, 512, 2048, 2048, 2048, 512]
    - [30, 6997.46]
  - - [2048, 3448, 1, 512, 2048, 2048, 2048, 512]
    - [32, 7069.44]
  - - [2048, 3450, 1, 512, 2048, 2048, 2048, 512]
    - [34, 6993.52]
  - - [2048, 3451, 1, 512, 2048, 2048, 2048, 512]
    - [32, 7023.71]
  - - [2048, 3452, 1, 512, 2048, 2048, 2048, 512]
    - [27, 7070.48]
  - - [2048, 3453, 1, 512, 2048, 2048, 2048, 512]
    - [27, 7053.14]
  - - [2048, 3455, 1, 512, 2048, 2048, 2048, 512]
    - [32, 7057.23]
  - - [2048, 3456, 1, 512, 2048, 2048, 2048, 512]
    - [32, 7107.47]
  - - [2048, 3457, 1, 512, 2048, 2048, 2048, 512]
    - [32, 7113.66]
  - - [2048, 3458, 1, 512, 2048, 2048, 2048, 512]
    - [32, 7100.24]
  - - [2048, 3459, 1, 512, 2048, 2048, 2048, 512]
    - [27, 7127.1]
  - - [2048, 3460, 1, 512, 2048, 2048, 2048, 512]
    - [27, 7082.77]
  - - [2048, 3461, 1, 512, 2048, 2048, 2048, 512]
    - [37, 7038.0]
  - - [2048, 3462, 1, 512, 2048, 2048, 2048, 512]
    - [32, 7097.12]
  - - [2048, 3466, 1, 512, 2048, 2048, 2048, 512]
    - [36, 7034.02]
  - - [2048, 3467, 1, 512, 2048, 2048, 2048, 512]
    - [37, 7049.19]
  - - [2048, 3468, 1, 512, 2048, 2048, 2048, 512]
    - [26, 7040.09]
  - - [2048, 3470, 1, 512, 2048, 2048, 2048, 512]
    - [32, 7106.32]
  - - [2048, 3471, 1, 512, 2048, 2048, 2048, 512]
    - [26, 7028.04]
  - - [2048, 3472, 1, 512, 2048, 2048, 2048, 512]
    - [32, 7139.34]
  - - [2048, 3475, 1, 512, 2048, 2048, 2048, 512]
    - [32, 7139.28]
  - - [2048, 3476, 1, 512, 2048, 2048, 2048, 512]
    - [27, 7113.46]
  - - [2048, 3477, 1, 512, 2048, 2048, 2048, 512]
    - [27, 7140.29]
  - - [2048, 3478, 1, 512, 2048, 2048, 2048, 512]
    - [34, 7035.17]
  - - [2048, 3479, 1, 512, 2048, 2048, 2048, 512]
    - [27, 7133.0]
  - - [2048, 3480, 1, 512, 2048, 2048, 2048, 512]
    - [32, 7129.89]
  - - [2048, 3481, 1, 512, 2048, 2048, 2048, 512]
    - [27, 7155.76]
  - - [2048, 3483, 1, 512, 2048, 2048, 2048, 512]
    - [32, 7125.72]
  - - [2048, 3484, 1, 512, 2048, 2048, 2048, 512]
    - [32, 7103.13]
  - - [2048, 3487, 1, 512, 2048, 2048, 2048, 512]
    - [31, 7126.7]
  - - [2048, 3489, 1, 512, 2048, 2048, 2048, 512]
    - [32, 7141.1]
  - - [2048, 3490, 1, 512, 2048, 2048, 2048, 512]
    - [27, 7134.89]
  - - [2048, 3491, 1, 512, 2048, 2048, 2048, 512]
    - [30, 7056.42]
  - - [2048, 3493, 1, 512, 2048, 2048, 2048, 512]
    - [32, 7137.93]
  - - [2048, 3494, 1, 512, 2048, 2048, 2048, 512]
    - [32, 7150.3]
  - - [2048, 3495, 1, 512, 2048, 2048, 2048, 512]
    - [30, 7066.53]
  - - [2048, 3497, 1, 512, 2048, 2048, 2048, 512]
    - [32, 7176.15]
  - - [2048, 3498, 1, 512, 2048, 2048, 2048, 512]
    - [32, 7154.35]
  - - [2048, 3499, 1, 512, 2048, 2048, 2048, 512]
    - [27, 7168.82]
  - - [2048, 3501, 1, 512, 2048, 2048, 2048, 512]
    - [27, 7154.28]
  - - [2048, 3503, 1, 512, 2048, 2048, 2048, 512]
    - [32, 7180.13]
  - - [2048, 3505, 1, 512, 2048, 2048, 2048, 512]
    - [27, 7144.92]
  - - [2048, 3507, 1, 512, 2048, 2048, 2048, 512]
    - [32, 7140.77]
  - - [2048, 3508, 1, 512, 2048, 2048, 2048, 512]
    - [27, 7166.52]
  - - [2048, 3509, 1, 512, 2048, 2048, 2048, 512]
    - [32, 7173.73]
  - - [2048, 3510, 1, 512, 2048, 2048, 2048, 512]
    - [32, 7176.82]
  - - [2048, 3511, 1, 512, 2048, 2048, 2048, 512]
    - [32, 7163.34]
  - - [2048, 3513, 1, 512, 2048, 2048, 2048, 512]
    - [27, 7177.77]
  - - [2048, 3514, 1, 512, 2048, 2048, 2048, 512]
    - [30, 7106.97]
  - - [2048, 3515, 1, 512, 2048, 2048, 2048, 512]
    - [32, 7183.92]
  - - [2048, 3517, 1, 512, 2048, 2048, 2048, 512]
    - [45, 7119.15]
  - - [2048, 3518, 1, 512, 2048, 2048, 2048, 512]
    - [30, 7133.41]
  - - [2048, 3519, 1, 512, 2048, 2048, 2048, 512]
    - [32, 7170.36]
  - - [2048, 3520, 1, 512, 2048, 2048, 2048, 512]
    - [32, 7212.89]
  - - [2048, 3523, 1, 512, 2048, 2048, 2048, 512]
    - [44, 7109.94]
  - - [2048, 3528, 1, 512, 2048, 2048, 2048, 512]
    - [32, 7209.45]
  - - [2048, 3529, 1, 512, 2048, 2048, 2048, 512]
    - [36, 7127.12]
  - - [2048, 3530, 1, 512, 2048, 2048, 2048, 512]
    - [32, 7216.67]
  - - [2048, 3531, 1, 512, 2048, 2048, 2048, 512]
    - [45, 7151.57]
  - - [2048, 3532, 1, 512, 2048, 2048, 2048, 512]
    - [32, 7193.74]
  - - [2048, 3533, 1, 512, 2048, 2048, 2048, 512]
    - [32, 7218.63]
  - - [2048, 3534, 1, 512, 2048, 2048, 2048, 512]
    - [26, 7103.78]
  - - [2048, 3538, 1, 512, 2048, 2048, 2048, 512]
    - [27, 7226.76]
  - - [2048, 3539, 1, 512, 2048, 2048, 2048, 512]
    - [32, 7187.31]
  - - [2048, 3540, 1, 512, 2048, 2048, 2048, 512]
    - [27, 7238.16]
  - - [2048, 3541, 1, 512, 2048, 2048, 2048, 512]
    - [27, 7243.35]
  - - [2048, 3547, 1, 512, 2048, 2048, 2048, 512]
    - [45, 7169.62]
  - - [2048, 3548, 1, 512, 2048, 2048, 2048, 512]
    - [27, 7248.23]
  - - [2048, 3552, 1, 512, 2048, 2048, 2048, 512]
    - [30, 7160.3]
  - - [2048, 3564, 1, 512, 2048, 2048, 2048, 512]
    - [30, 7164.09]
  - - [2048, 3575, 1, 512, 2048, 2048, 2048, 512]
    - [27, 7223.12]
  - - [2048, 3598, 1, 512, 2048, 2048, 2048, 512]
    - [27, 6947.31]
  - - [2048, 3599, 1, 512, 2048, 2048, 2048, 512]
    - [32, 6956.84]
  - - [2048, 3608, 1, 512, 2048, 2048, 2048, 512]
    - [27, 6959.98]
  - - [2048, 3776, 1, 512, 2048, 2048, 2048, 512]
    - [32, 7232.8]
  - - [2048, 3780, 1, 512, 2048, 2048, 2048, 512]
    - [37, 7133.32]
  - - [2048, 3796, 1, 512, 2048, 2048, 2048, 512]
    - [26, 7124.57]
  - - [2048, 3822, 1, 512, 2048, 2048, 2048, 512]
    - [27, 7284.44]
  - - [2048, 3835, 1, 512, 2048, 2048, 2048, 512]
    - [27, 7248.71]
  - - [2048, 3840, 1, 512, 2048, 2048, 2048, 512]
    - [30, 7204.28]
  - - [2048, 3859, 1, 512, 2048, 2048, 2048, 512]
    - [27, 6979.08]
  - - [2048, 3864, 1, 512, 2048, 2048, 2048, 512]
    - [27, 6998.86]
  - - [2048, 3870, 1, 512, 2048, 2048, 2048, 512]
    - [32, 6998.98]
  - - [2048, 3876, 1, 512, 2048, 2048, 2048, 512]
    - [32, 7033.19]
  - - [2048, 3906, 1, 512, 2048, 2048, 2048, 512]
    - [27, 7052.37]
  - - [2048, 3910, 1, 512, 2048, 2048, 2048, 512]
    - [32, 7022.87]
  - - [2048, 3925, 1, 512, 2048, 2048, 2048, 512]
    - [27, 7061.46]
  - - [2048, 3942, 1, 512, 2048, 2048, 2048, 512]
    - [27, 7046.37]
  - - [2048, 3944, 1, 512, 2048, 2048, 2048, 512]
    - [27, 7111.0]
  - - [2048, 3955, 1, 512, 2048, 2048, 2048, 512]
    - [32, 7136.29]
  - - [2048, 3968, 1, 512, 2048, 2048, 2048, 512]
    - [37, 7090.15]
  - - [2048, 3969, 1, 512, 2048, 2048, 2048, 512]
    - [45, 7091.05]
  - - [2048, 3976, 1, 512, 2048, 2048, 2048, 512]
    - [26, 7070.54]
  - - [2048, 3977, 1, 512, 2048, 2048, 2048, 512]
    - [27, 7157.74]
  - - [2048, 3978, 1, 512, 2048, 2048, 2048, 512]
    - [27, 7157.72]
  - - [2048, 3990, 1, 512, 2048, 2048, 2048, 512]
    - [27, 7150.23]
  - - [2048, 3995, 1, 512, 2048, 2048, 2048, 512]
    - [32, 7158.28]
  - - [2048, 3996, 1, 512, 2048, 2048, 2048, 512]
    - [32, 7180.07]
  - - [2048, 3999, 1, 512, 2048, 2048, 2048, 512]
    - [37, 7089.17]
  - - [2048, 4005, 1, 512, 2048, 2048, 2048, 512]
    - [37, 7122.11]
  - - [2048, 4012, 1, 512, 2048, 2048, 2048, 512]
    - [27, 7196.94]
  - - [2048, 4020, 1, 512, 2048, 2048, 2048, 512]
    - [27, 7207.64]
  - - [2048, 4026, 1, 512, 2048, 2048, 2048, 512]
    - [32, 7206.53]
  - - [2048, 4030, 1, 512, 2048, 2048, 2048, 512]
    - [27, 7215.51]
  - - [2048, 4032, 1, 512, 2048, 2048, 2048, 512]
    - [27, 7250.27]
  - - [512, 160, 1, 2048, 512, 512, 512, 2048]
    - [71, 2280.81]
  - - [512, 174, 1, 2048, 512, 512, 512, 2048]
    - [81, 2981.85]
  - - [512, 182, 1, 512, 512, 512, 512, 512]
    - [83, 2394.31]
  - - [512, 184, 1, 512, 512, 512, 512, 512]
    - [87, 2420.62]
  - - [512, 184, 1, 2048, 512, 512, 512, 2048]
    - [81, 3108.09]
  - - [512, 189, 1, 512, 512, 512, 512, 512]
    - [81, 2477.2]
  - - [512, 189, 1, 2048, 512, 512, 512, 2048]
    - [82, 3219.42]
  - - [512, 198, 1, 2048, 512, 512, 512, 2048]
    - [84, 3270.43]
  - - [512, 206, 1, 512, 512, 512, 512, 512]
    - [85, 2557.87]
  - - [512, 207, 1, 2048, 512, 512, 512, 2048]
    - [84, 3391.36]
  - - [512, 208, 1, 512, 512, 512, 512, 512]
    - [88, 2756.83]
  - - [512, 208, 1, 2048, 512, 512, 512, 2048]
    - [90, 3231.93]
  - - [512, 224, 1, 512, 512, 512, 512, 512]
    - [87, 2925.12]
  - - [512, 245, 1, 2048, 512, 512, 512, 2048]
    - [90, 4075.27]
  - - [512, 246, 1, 512, 512, 512, 512, 512]
    - [90, 3348.26]
  - - [512, 246, 1, 2048, 512, 512, 512, 2048]
    - [88, 3627.3]
  - - [512, 264, 1, 512, 512, 512, 512, 512]
    - [89, 2839.63]
  - - [512, 264, 1, 2048, 512, 512, 512, 2048]
    - [86, 3330.66]
  - - [512, 401, 1, 2048, 512, 512, 512, 2048]
    - [77, 4271.08]
  - - [512, 439, 1, 2048, 512, 512, 512, 2048]
    - [78, 4385.45]
  - - [512, 443, 1, 2048, 512, 512, 512, 2048]
    - [75, 4303.91]
  - - [512, 446, 1, 2048, 512, 512, 512, 2048]
    - [80, 4638.68]
  - - [512, 455, 1, 512, 512, 512, 512, 512]
    - [79, 4237.29]
  - - [512, 465, 1, 512, 512, 512, 512, 512]
    - [79, 4263.1]
  - - [512, 465, 1, 2048, 512, 512, 512, 2048]
    - [77, 4423.53]
  - - [512, 468, 1, 512, 512, 512, 512, 512]
    - [76, 4192.8]
  - - [512, 468, 1, 2048, 512, 512, 512, 2048]
    - [77, 4619.71]
  - - [512, 476, 1, 512, 512, 512, 512, 512]
    - [79, 4386.65]
  - - [512, 493, 1, 512, 512, 512, 512, 512]
    - [79, 4484.98]
  - - [512, 493, 1, 2048, 512, 512, 512, 2048]
    - [74, 4570.11]
  - - [512, 495, 1, 2048, 512, 512, 512, 2048]
    - [73, 4606.75]
  - - [512, 511, 1, 2048, 512, 512, 512, 2048]
    - [72, 4693.94]
  - - [512, 512, 1, 2048, 512, 512, 512, 2048]
    - [73, 4847.83]
  - - [64, 7, 736, 7, 64, 64, 64, 7]
    - [115, 120.767]
  - - [64, 8, 264, 8, 64, 64, 64, 8]
    - [116, 130.337]
  - - [64, 9, 416, 9, 64, 64, 64, 9]
    - [114, 217.262]
  - - [64, 10, 448, 10, 64, 64, 64, 10]
    - [107, 302.383]
  - - [64, 11, 568, 11, 64, 64, 64, 11]
    - [106, 409.514]
  - - [64, 12, 480, 12, 64, 64, 64, 12]
    - [104, 380.368]
  - - [64, 12, 2520, 12, 64, 64, 64, 12]
    - [108, 490.643]
  - - [64, 13, 576, 13, 64, 64, 64, 13]
    - [115, 525.629]
  - - [64, 13, 2336, 13, 64, 64, 64, 13]
    - [115, 532.11]
  - - [64, 14, 704, 14, 64, 64, 64, 14]
    - [106, 575.908]
  - - [64, 14, 2184, 14, 64, 64, 64, 14]
    - [106, 568.101]
  - - [64, 15, 688, 15, 64, 64, 64, 15]
    - [120, 597.071]
  - - [64, 15, 2048, 15, 64, 64, 64, 15]
    - [111, 606.89]
  - - [64, 16, 712, 16, 64, 64, 64, 16]
    - [109, 574.736]
  - - [64, 16, 1920, 16, 64, 64, 64, 16]
    - [113, 644.399]
  - - [64, 17, 688, 17, 64, 64, 64, 17]
    - [91, 653.18]
  - - [64, 17, 1816, 17, 64, 64, 64, 17]
    - [106, 680.83]
  - - [64, 18, 648, 18, 64, 64, 64, 18]
    - [99, 634.236]
  - - [64, 18, 1720, 18, 64, 64, 64, 18]
    - [112, 713.297]
  - - [64, 19, 680, 19, 64, 64, 64, 19]
    - [102, 675.439]
  - - [64, 19, 1632, 19, 64, 64, 64, 19]
    - [120, 749.647]
  - - [64, 21, 1472, 21, 64, 64, 64, 21]
    - [112, 817.564]
  - - [64, 21, 1488, 21, 64, 64, 64, 21]
    - [108, 814.572]
  - - [64, 23, 64, 23, 64, 64, 64, 23]
    - [126, 234.007]
  - - [64, 23, 1360, 23, 64, 64, 64, 23]
    - [118, 908.733]
  - - [64, 25, 176, 25, 64, 64, 64, 25]
    - [121, 688.677]
  - - [64, 25, 1256, 25, 64, 64, 64, 25]
    - [115, 949.878]
  - - [64, 26, 56, 26, 64, 64, 64, 26]
    - [128, 253.535]
  - - [64, 27, 56, 26, 64, 64, 64, 26]
    - [57, 263.301]
  - - [64, 27, 56, 27, 64, 64, 64, 27]
    - [61, 271.312]
  - - [64, 27, 1168, 27, 64, 64, 64, 27]
    - [115, 1003.6]
  - - [64, 29, 136, 29, 64, 64, 64, 29]
    - [58, 700.82]
  - - [64, 29, 1088, 29, 64, 64, 64, 29]
    - [60, 1036.09]
  - - [64, 32, 624, 32, 64, 64, 64, 32]
    - [59, 1135.93]
  - - [64, 32, 992, 32, 64, 64, 64, 32]
    - [100, 1167.06]
  - - [64, 35, 384, 35, 64, 64, 64, 35]
    - [124, 1128.92]
  - - [64, 35, 904, 35, 64, 64, 64, 35]
    - [118, 1214.17]
  - - [64, 38, 320, 38, 64, 64, 64, 38]
    - [98, 1308.92]
  - - [64, 38, 840, 38, 64, 64, 64, 38]
    - [120, 1305.06]
  - - [64, 41, 312, 41, 64, 64, 64, 41]
    - [91, 1317.25]
  - - [64, 41, 776, 41, 64, 64, 64, 41]
    - [116, 1321.23]
  - - [64, 45, 392, 45, 64, 64, 64, 45]
    - [66, 1379.92]
  - - [64, 45, 712, 45, 64, 64, 64, 45]
    - [118, 1428.53]
  - - [64, 49, 160, 49, 64, 64, 64, 49]
    - [112, 1418.38]
  - - [64, 49, 648, 49, 64, 64, 64, 49]
    - [70, 1490.25]
  - - [64, 54, 200, 54, 64, 64, 64, 54]
    - [125, 1614.95]
  - - [64, 54, 592, 54, 64, 64, 64, 54]
    - [68, 1638.96]
  - - [64, 59, 512, 59, 64, 64, 64, 59]
    - [101, 1757.8]
  - - [64, 59, 544, 59, 64, 64, 64, 59]
    - [67, 1744.21]
  - - [64, 64, 496, 64, 64, 64, 64, 64]
    - [9, 1976.64]
  - - [64, 65, 472, 65, 64, 64, 64, 65]
    - [103, 1813.62]
  - - [64, 65, 496, 64, 64, 64, 64, 64]
    - [62, 1886.43]
  - - [64, 65, 496, 65, 64, 64, 64, 65]
    - [105, 1830.68]
  - - [64, 70, 216, 70, 64, 64, 64, 70]
    - [102, 2092.51]
  - - [64, 71, 216, 70, 64, 64, 64, 70]
    - [102, 2098.42]
  - - [64, 71, 216, 71, 64, 64, 64, 71]
    - [102, 2090.53]
  - - [64, 71, 448, 71, 64, 64, 64, 71]
    - [102, 2009.45]
  - - [64, 77, 248, 77, 64, 64, 64, 77]
    - [98, 2164.18]
  - - [64, 77, 408, 77, 64, 64, 64, 77]
    - [95, 2094.16]
  - - [64, 78, 248, 77, 64, 64, 64, 77]
    - [95, 2148.39]
  - - [64, 78, 248, 78, 64, 64, 64, 78]
    - [102, 2255.33]
  - - [64, 78, 408, 77, 64, 64, 64, 77]
    - [103, 2089.95]
  - - [64, 78, 408, 78, 64, 64, 64, 78]
    - [102, 2144.6]
  - - [64, 80, 152, 80, 64, 64, 64, 80]
    - [101, 2302.66]
  - - [64, 84, 152, 80, 64, 64, 64, 80]
    - [92, 2304.15]
  - - [64, 84, 152, 84, 64, 64, 64, 84]
    - [101, 2316.56]
  - - [64, 85, 376, 85, 64, 64, 64, 85]
    - [97, 2316.95]
  - - [64, 91, 40, 91, 64, 64, 64, 91]
    - [63, 1572.48]
  - - [64, 93, 40, 91, 64, 64, 64, 91]
    - [122, 1643.11]
  - - [64, 93, 40, 93, 64, 64, 64, 93]
    - [127, 1598.43]
  - - [64, 93, 344, 93, 64, 64, 64, 93]
    - [93, 2360.45]
  - - [64, 102, 56, 102, 64, 64, 64, 102]
    - [110, 1921.27]
  - - [64, 102, 312, 102, 64, 64, 64, 102]
    - [133, 2554.18]
  - - [64, 103, 16, 103, 64, 64, 64, 103]
    - [113, 862.671]
  - - [64, 104, 16, 103, 64, 64, 64, 103]
    - [130, 871.046]
  - - [64, 104, 16, 104, 64, 64, 64, 104]
    - [131, 900.71]
  - - [64, 112, 16, 112, 64, 64, 64, 112]
    - [65, 996.552]
  - - [64, 112, 288, 112, 64, 64, 64, 112]
    - [69, 2903.48]
  - - [64, 119, 32, 119, 64, 64, 64, 119]
    - [129, 1779.57]
  - - [64, 122, 264, 122, 64, 64, 64, 122]
    - [93, 2845.65]
  - - [64, 122, 264, 123, 64, 64, 64, 123]
    - [96, 2817.03]
  - - [64, 123, 16, 112, 64, 64, 64, 112]
    - [119, 1107.18]
  - - [64, 123, 16, 123, 64, 64, 64, 123]
    - [64, 1112.42]
  - - [64, 123, 264, 123, 64, 64, 64, 123]
    - [94, 2798.67]
  - - [64, 134, 240, 134, 64, 64, 64, 134]
    - [132, 2973.84]
  - - [64, 134, 240, 135, 64, 64, 64, 135]
    - [123, 2932.77]
  - - [64, 135, 32, 119, 64, 64, 64, 119]
    - [127, 1827.74]
  - - [64, 135, 32, 135, 64, 64, 64, 135]
    - [117, 1975.95]
  - - [64, 135, 240, 135, 64, 64, 64, 135]
    - [132, 2961.61]
- null
