Tensile/Configs/miopen/archives/transformer/2019-11-01/exact/vega10_Cijk_Alik_Bljk_SB.yaml
- {MinimumRequiredVersion: 4.14.0}
- vega10
- gfx900
- [Device 6863, Device 6862, Device 687f, Device 6860, Device 6861, 'Vega 10 XTX [Radeon
    SolutionIndex: 0
    SolutionNameMin: Cijk_Alik_Bljk_SB_MT64x64x16_SE_EPS1_FL0_GRVW4_LPA0_LPB0_PGR1_PLR1_TT4_4_USFGRO1_VW2_WG16_16_1_WGM1
    SolutionIndex: 1
    SolutionNameMin: Cijk_Alik_Bljk_SB_MT64x64x16_SE_EPS1_FL1_GRVW4_LPA0_LPB0_PGR1_PLR1_TT4_4_USFGRO1_VW4_WG16_16_1_WGM8
    SolutionIndex: 2
    SolutionNameMin: Cijk_Alik_Bljk_SB_MT96x64x16_SE_EPS0_FL1_GRVW4_LPA0_LPB0_PGR0_PLR0_TT6_4_USFGRO1_VW2_WG16_16_1_WGM8
    SolutionIndex: 3
    SolutionNameMin: Cijk_Alik_Bljk_SB_MT64x96x8_SE_EPS1_FL1_GRVW4_LPA0_LPB0_PGR1_PLR0_TT4_6_USFGRO1_VW2_WG16_16_1_WGM8
    SolutionIndex: 4
    SolutionNameMin: Cijk_Alik_Bljk_SB_MT64x96x16_SE_EPS0_FL1_GRVW4_LPA0_LPB0_PGR0_PLR1_TT4_6_USFGRO1_VW2_WG16_16_1_WGM8
    SolutionIndex: 5
    SolutionNameMin: Cijk_Alik_Bljk_SB_MT64x128x16_SE_EPS0_FL1_GRVW4_LPA0_LPB0_PGR0_PLR0_TT4_8_USFGRO1_VW2_WG16_16_1_WGM1
    SolutionIndex: 6
    SolutionNameMin: Cijk_Alik_Bljk_SB_MT64x128x8_SE_EPS1_FL0_GRVW1_LPA0_LPB0_PGR1_PLR0_TT4_8_USFGRO1_VW2_WG16_16_1_WGM8
    SolutionIndex: 7
    SolutionNameMin: Cijk_Alik_Bljk_SB_MT64x128x8_SE_EPS1_FL0_GRVW2_LPA0_LPB0_PGR1_PLR0_TT4_8_USFGRO1_VW2_WG16_16_1_WGM8
    SolutionIndex: 8
    SolutionNameMin: Cijk_Alik_Bljk_SB_MT64x128x16_SE_EPS1_FL0_GRVW4_LPA0_LPB0_PGR1_PLR0_TT4_8_USFGRO1_VW4_WG16_16_1_WGM1
    SolutionIndex: 9
    SolutionNameMin: Cijk_Alik_Bljk_SB_MT64x128x16_SE_EPS0_FL0_GRVW4_LPA0_LPB0_PGR0_PLR1_TT4_8_USFGRO1_VW2_WG16_16_1_WGM1
    SolutionIndex: 10
    SolutionNameMin: Cijk_Alik_Bljk_SB_MT64x128x16_SE_EPS0_FL1_GRVW4_LPA0_LPB0_PGR0_PLR1_TT4_8_USFGRO1_VW2_WG16_16_1_WGM1
    SolutionIndex: 11
    SolutionNameMin: Cijk_Alik_Bljk_SB_MT64x128x16_SE_EPS1_FL0_GRVW4_LPA0_LPB0_PGR1_PLR1_TT4_8_USFGRO1_VW2_WG16_16_1_WGM1
    SolutionIndex: 12
    SolutionNameMin: Cijk_Alik_Bljk_SB_MT64x128x16_SE_EPS1_FL0_GRVW4_LPA0_LPB0_PGR1_PLR1_TT4_8_USFGRO1_VW2_WG16_16_1_WGM8
    SolutionIndex: 13
    SolutionNameMin: Cijk_Alik_Bljk_SB_MT64x128x16_SE_EPS1_FL0_GRVW4_LPA0_LPB0_PGR1_PLR1_TT4_8_USFGRO1_VW4_WG16_16_1_WGM1
    SolutionIndex: 14
    SolutionNameMin: Cijk_Alik_Bljk_SB_MT64x128x16_SE_EPS1_FL0_GRVW4_LPA0_LPB0_PGR1_PLR1_TT4_8_USFGRO1_VW4_WG16_16_1_WGM8
    SolutionIndex: 15
    SolutionNameMin: Cijk_Alik_Bljk_SB_MT64x128x16_SE_EPS1_FL1_GRVW4_LPA0_LPB0_PGR1_PLR1_TT4_8_USFGRO1_VW2_WG16_16_1_WGM1
    SolutionIndex: 16
    SolutionNameMin: Cijk_Alik_Bljk_SB_MT64x128x16_SE_EPS1_FL1_GRVW4_LPA0_LPB0_PGR1_PLR1_TT4_8_USFGRO1_VW4_WG16_16_1_WGM1
    SolutionIndex: 17
    SolutionNameMin: Cijk_Alik_Bljk_SB_MT64x128x16_SE_EPS1_FL1_GRVW4_LPA0_LPB0_PGR1_PLR1_TT4_8_USFGRO1_VW4_WG16_16_1_WGM8
    SolutionIndex: 18
    SolutionNameMin: Cijk_Alik_Bljk_SB_MT128x64x8_SE_EPS1_FL0_GRVW2_LPA0_LPB0_PGR1_PLR0_TT8_4_USFGRO1_VW2_WG16_16_1_WGM8
    SolutionIndex: 19
    SolutionNameMin: Cijk_Alik_Bljk_SB_MT128x64x8_SE_EPS1_FL0_GRVW2_LPA0_LPB0_PGR1_PLR0_TT8_4_USFGRO1_VW4_WG16_16_1_WGM8
    SolutionIndex: 20
    SolutionNameMin: Cijk_Alik_Bljk_SB_MT128x64x8_SE_EPS1_FL0_GRVW4_LPA0_LPB0_PGR1_PLR0_TT8_4_USFGRO1_VW2_WG16_16_1_WGM8
    SolutionIndex: 21
    SolutionNameMin: Cijk_Alik_Bljk_SB_MT128x64x8_SE_EPS1_FL1_GRVW2_LPA0_LPB0_PGR1_PLR0_TT8_4_USFGRO1_VW2_WG16_16_1_WGM8
    SolutionIndex: 22
    SolutionNameMin: Cijk_Alik_Bljk_SB_MT128x64x8_SE_EPS1_FL1_GRVW2_LPA0_LPB0_PGR1_PLR0_TT8_4_USFGRO1_VW4_WG16_16_1_WGM8
    SolutionIndex: 23
    SolutionNameMin: Cijk_Alik_Bljk_SB_MT128x64x16_SE_EPS0_FL1_GRVW4_LPA0_LPB0_PGR0_PLR1_TT8_4_USFGRO1_VW2_WG16_16_1_WGM8
    SolutionIndex: 24
    SolutionNameMin: Cijk_Alik_Bljk_SB_MT128x64x16_SE_EPS0_FL1_GRVW4_LPA0_LPB0_PGR0_PLR1_TT8_4_USFGRO1_VW4_WG16_16_1_WGM8
    SolutionIndex: 25
    SolutionNameMin: Cijk_Alik_Bljk_SB_MT128x64x16_SE_EPS1_FL0_GRVW4_LPA0_LPB0_PGR1_PLR1_TT8_4_USFGRO1_VW4_WG16_16_1_WGM1
    SolutionIndex: 26
    SolutionNameMin: Cijk_Alik_Bljk_SB_MT128x64x16_SE_EPS1_FL0_GRVW4_LPA0_LPB0_PGR1_PLR1_TT8_4_USFGRO1_VW4_WG16_16_1_WGM8
    SolutionIndex: 27
    SolutionNameMin: Cijk_Alik_Bljk_SB_MT128x64x16_SE_EPS1_FL1_GRVW4_LPA0_LPB0_PGR1_PLR1_TT8_4_USFGRO1_VW2_WG16_16_1_WGM8
    SolutionIndex: 28
    SolutionNameMin: Cijk_Alik_Bljk_SB_MT128x64x16_SE_EPS1_FL1_GRVW4_LPA0_LPB0_PGR1_PLR1_TT8_4_USFGRO1_VW4_WG16_16_1_WGM1
    SolutionIndex: 29
    SolutionNameMin: Cijk_Alik_Bljk_SB_MT128x64x16_SE_EPS1_FL1_GRVW4_LPA0_LPB0_PGR1_PLR1_TT8_4_USFGRO1_VW4_WG16_16_1_WGM8
    SolutionIndex: 30
    SolutionNameMin: Cijk_Alik_Bljk_SB_MT128x128x16_SE_EPS1_FL0_GRVW2_LPA0_LPB0_PGR1_PLR0_TT8_8_USFGRO1_VW2_WG16_16_1_WGM1
    SolutionIndex: 31
    SolutionNameMin: Cijk_Alik_Bljk_SB_MT128x128x16_SE_EPS1_FL0_GRVW2_LPA0_LPB0_PGR1_PLR0_TT8_8_USFGRO1_VW2_WG16_16_1_WGM8
    SolutionIndex: 32
    SolutionNameMin: Cijk_Alik_Bljk_SB_MT128x128x16_SE_EPS1_FL0_GRVW2_LPA0_LPB0_PGR1_PLR0_TT8_8_USFGRO1_VW4_WG16_16_1_WGM8
    SolutionIndex: 33
    SolutionNameMin: Cijk_Alik_Bljk_SB_MT128x128x8_SE_EPS1_FL0_GRVW4_LPA0_LPB0_PGR1_PLR0_TT8_8_USFGRO1_VW2_WG16_16_1_WGM1
    SolutionIndex: 34
    SolutionNameMin: Cijk_Alik_Bljk_SB_MT128x128x16_SE_EPS1_FL0_GRVW4_LPA0_LPB0_PGR1_PLR0_TT8_8_USFGRO1_VW2_WG16_16_1_WGM1
    SolutionIndex: 35
    SolutionNameMin: Cijk_Alik_Bljk_SB_MT128x128x16_SE_EPS1_FL0_GRVW4_LPA0_LPB0_PGR1_PLR0_TT8_8_USFGRO1_VW2_WG16_16_1_WGM8
    SolutionIndex: 36
    SolutionNameMin: Cijk_Alik_Bljk_SB_MT128x128x16_SE_EPS1_FL0_GRVW4_LPA0_LPB0_PGR1_PLR0_TT8_8_USFGRO1_VW4_WG16_16_1_WGM1
    SolutionIndex: 37
    SolutionNameMin: Cijk_Alik_Bljk_SB_MT128x128x16_SE_EPS1_FL0_GRVW4_LPA0_LPB0_PGR1_PLR0_TT8_8_USFGRO1_VW4_WG16_16_1_WGM8
    SolutionIndex: 38
    SolutionNameMin: Cijk_Alik_Bljk_SB_MT128x128x8_SE_EPS1_FL1_GRVW2_LPA0_LPB0_PGR1_PLR0_TT8_8_USFGRO1_VW2_WG16_16_1_WGM1
    SolutionIndex: 39
    SolutionNameMin: Cijk_Alik_Bljk_SB_MT128x128x16_SE_EPS1_FL1_GRVW2_LPA0_LPB0_PGR1_PLR0_TT8_8_USFGRO1_VW4_WG16_16_1_WGM1
    SolutionIndex: 40
    SolutionNameMin: Cijk_Alik_Bljk_SB_MT128x128x16_SE_EPS1_FL1_GRVW2_LPA0_LPB0_PGR1_PLR0_TT8_8_USFGRO1_VW4_WG16_16_1_WGM8
    SolutionIndex: 41
    SolutionNameMin: Cijk_Alik_Bljk_SB_MT128x128x16_SE_EPS1_FL1_GRVW4_LPA0_LPB0_PGR1_PLR0_TT8_8_USFGRO1_VW2_WG16_16_1_WGM1
    SolutionIndex: 42
    SolutionNameMin: Cijk_Alik_Bljk_SB_MT128x128x16_SE_EPS1_FL1_GRVW4_LPA0_LPB0_PGR1_PLR0_TT8_8_USFGRO1_VW2_WG16_16_1_WGM8
    SolutionIndex: 43
    SolutionNameMin: Cijk_Alik_Bljk_SB_MT128x128x8_SE_EPS1_FL1_GRVW4_LPA0_LPB0_PGR1_PLR0_TT8_8_USFGRO1_VW4_WG16_16_1_WGM1
    SolutionIndex: 44
    SolutionNameMin: Cijk_Alik_Bljk_SB_MT128x128x16_SE_EPS1_FL1_GRVW4_LPA0_LPB0_PGR1_PLR0_TT8_8_USFGRO1_VW4_WG16_16_1_WGM1
    SolutionIndex: 45
    SolutionNameMin: Cijk_Alik_Bljk_SB_MT128x128x16_SE_EPS1_FL1_GRVW4_LPA0_LPB0_PGR1_PLR0_TT8_8_USFGRO1_VW4_WG16_16_1_WGM8
    SolutionIndex: 46
    SolutionNameMin: Cijk_Alik_Bljk_SB_MT128x128x8_SE_EPS1_FL0_GRVW2_LPA0_LPB0_PGR1_PLR1_TT8_8_USFGRO1_VW2_WG16_16_1_WGM1
    SolutionIndex: 47
    SolutionNameMin: Cijk_Alik_Bljk_SB_MT128x128x8_SE_EPS1_FL0_GRVW2_LPA0_LPB0_PGR1_PLR1_TT8_8_USFGRO1_VW2_WG16_16_1_WGM8
    SolutionIndex: 48
    SolutionNameMin: Cijk_Alik_Bljk_SB_MT128x128x16_SE_EPS1_FL0_GRVW2_LPA0_LPB0_PGR1_PLR1_TT8_8_USFGRO1_VW2_WG16_16_1_WGM8
    SolutionIndex: 49
    SolutionNameMin: Cijk_Alik_Bljk_SB_MT128x128x8_SE_EPS1_FL0_GRVW2_LPA0_LPB0_PGR1_PLR1_TT8_8_USFGRO1_VW4_WG16_16_1_WGM1
    SolutionIndex: 50
    SolutionNameMin: Cijk_Alik_Bljk_SB_MT128x128x16_SE_EPS1_FL0_GRVW2_LPA0_LPB0_PGR1_PLR1_TT8_8_USFGRO1_VW4_WG16_16_1_WGM1
    SolutionIndex: 51
    SolutionNameMin: Cijk_Alik_Bljk_SB_MT128x128x8_SE_EPS1_FL0_GRVW4_LPA0_LPB0_PGR1_PLR1_TT8_8_USFGRO1_VW2_WG16_16_1_WGM1
    SolutionIndex: 52
    SolutionNameMin: Cijk_Alik_Bljk_SB_MT128x128x8_SE_EPS1_FL0_GRVW4_LPA0_LPB0_PGR1_PLR1_TT8_8_USFGRO1_VW2_WG16_16_1_WGM8
    SolutionIndex: 53
    SolutionNameMin: Cijk_Alik_Bljk_SB_MT128x128x16_SE_EPS1_FL0_GRVW4_LPA0_LPB0_PGR1_PLR1_TT8_8_USFGRO1_VW2_WG16_16_1_WGM1
    SolutionIndex: 54
    SolutionNameMin: Cijk_Alik_Bljk_SB_MT128x128x16_SE_EPS1_FL0_GRVW4_LPA0_LPB0_PGR1_PLR1_TT8_8_USFGRO1_VW2_WG16_16_1_WGM8
    SolutionIndex: 55
    SolutionNameMin: Cijk_Alik_Bljk_SB_MT128x128x8_SE_EPS1_FL0_GRVW4_LPA0_LPB0_PGR1_PLR1_TT8_8_USFGRO1_VW4_WG16_16_1_WGM1
    SolutionIndex: 56
    SolutionNameMin: Cijk_Alik_Bljk_SB_MT128x128x16_SE_EPS1_FL0_GRVW4_LPA0_LPB0_PGR1_PLR1_TT8_8_USFGRO1_VW4_WG16_16_1_WGM1
    SolutionIndex: 57
    SolutionNameMin: Cijk_Alik_Bljk_SB_MT128x128x16_SE_EPS1_FL0_GRVW4_LPA0_LPB0_PGR1_PLR1_TT8_8_USFGRO1_VW4_WG16_16_1_WGM8
    SolutionIndex: 58
    SolutionNameMin: Cijk_Alik_Bljk_SB_MT128x128x8_SE_EPS1_FL1_GRVW2_LPA0_LPB0_PGR1_PLR1_TT8_8_USFGRO1_VW2_WG16_16_1_WGM1
    SolutionIndex: 59
    SolutionNameMin: Cijk_Alik_Bljk_SB_MT128x128x16_SE_EPS1_FL1_GRVW2_LPA0_LPB0_PGR1_PLR1_TT8_8_USFGRO1_VW2_WG16_16_1_WGM1
    SolutionIndex: 60
    SolutionNameMin: Cijk_Alik_Bljk_SB_MT128x128x16_SE_EPS1_FL1_GRVW2_LPA0_LPB0_PGR1_PLR1_TT8_8_USFGRO1_VW2_WG16_16_1_WGM8
    SolutionIndex: 61
    SolutionNameMin: Cijk_Alik_Bljk_SB_MT128x128x8_SE_EPS1_FL1_GRVW2_LPA0_LPB0_PGR1_PLR1_TT8_8_USFGRO1_VW4_WG16_16_1_WGM1
    SolutionIndex: 62
    SolutionNameMin: Cijk_Alik_Bljk_SB_MT128x128x16_SE_EPS1_FL1_GRVW2_LPA0_LPB0_PGR1_PLR1_TT8_8_USFGRO1_VW4_WG16_16_1_WGM8
    SolutionIndex: 63
    SolutionNameMin: Cijk_Alik_Bljk_SB_MT128x128x8_SE_EPS1_FL1_GRVW4_LPA0_LPB0_PGR1_PLR1_TT8_8_USFGRO1_VW2_WG16_16_1_WGM8
    SolutionIndex: 64
    SolutionNameMin: Cijk_Alik_Bljk_SB_MT128x128x16_SE_EPS1_FL1_GRVW4_LPA0_LPB0_PGR1_PLR1_TT8_8_USFGRO1_VW2_WG16_16_1_WGM1
    SolutionIndex: 65
    SolutionNameMin: Cijk_Alik_Bljk_SB_MT128x128x16_SE_EPS1_FL1_GRVW4_LPA0_LPB0_PGR1_PLR1_TT8_8_USFGRO1_VW2_WG16_16_1_WGM8
    SolutionIndex: 66
    SolutionNameMin: Cijk_Alik_Bljk_SB_MT128x128x8_SE_EPS1_FL1_GRVW4_LPA0_LPB0_PGR1_PLR1_TT8_8_USFGRO1_VW4_WG16_16_1_WGM1
    SolutionIndex: 67
    SolutionNameMin: Cijk_Alik_Bljk_SB_MT128x128x16_SE_EPS1_FL1_GRVW4_LPA0_LPB0_PGR1_PLR1_TT8_8_USFGRO1_VW4_WG16_16_1_WGM1
    SolutionIndex: 68
    SolutionNameMin: Cijk_Alik_Bljk_SB_MT128x128x16_SE_EPS1_FL1_GRVW4_LPA0_LPB0_PGR1_PLR1_TT8_8_USFGRO1_VW4_WG16_16_1_WGM8
    SolutionIndex: 69
    SolutionNameMin: Cijk_Alik_Bljk_SB_MT64x64x16_SE_EPS0_FL1_GRVW4_LPA2_LPB0_PGR0_PLR0_TT4_4_USFGRO1_VW2_WG16_16_1_WGM1
    SolutionIndex: 70
    SolutionNameMin: Cijk_Alik_Bljk_SB_MT64x64x8_SE_EPS1_FL1_GRVW4_LPA2_LPB0_PGR1_PLR0_TT4_4_USFGRO1_VW2_WG16_16_1_WGM1
    SolutionIndex: 71
    SolutionNameMin: Cijk_Alik_Bljk_SB_MT64x64x8_SE_EPS1_FL0_GRVW2_LPA2_LPB2_PGR1_PLR0_TT4_4_USFGRO1_VW2_WG16_16_1_WGM1
    SolutionIndex: 72
    SolutionNameMin: Cijk_Alik_Bljk_SB_MT64x32x32_SE_EPS0_FL0_GRVW4_LPA0_LPB0_PGR0_PLR1_TT4_2_USFGRO1_VW2_WG16_16_1_WGM1
    SolutionIndex: 73
    SolutionNameMin: Cijk_Alik_Bljk_SB_MT64x32x8_SE_EPS1_FL1_GRVW2_LPA2_LPB2_PGR1_PLR0_TT4_2_USFGRO1_VW2_WG16_16_1_WGM1
    SolutionIndex: 74
    SolutionNameMin: Cijk_Alik_Bljk_SB_MT64x32x32_SE_EPS0_FL0_GRVW4_LPA2_LPB2_PGR0_PLR1_TT4_2_USFGRO1_VW2_WG16_16_1_WGM1
    SolutionIndex: 75
    SolutionNameMin: Cijk_Alik_Bljk_SB_MT64x32x32_SE_EPS0_FL1_GRVW4_LPA2_LPB2_PGR0_PLR1_TT4_2_USFGRO1_VW2_WG16_16_1_WGM1
    SolutionIndex: 76
    SolutionNameMin: Cijk_Alik_Bljk_SB_MT64x32x32_SE_EPS0_FL1_GRVW4_LPA2_LPB2_PGR0_PLR1_TT4_2_USFGRO1_VW2_WG16_16_1_WGM8
    SolutionIndex: 77
    SolutionNameMin: Cijk_Alik_Bljk_SB_MT64x32x16_SE_EPS1_FL0_GRVW4_LPA2_LPB2_PGR1_PLR1_TT4_2_USFGRO1_VW2_WG16_16_1_WGM1
    SolutionIndex: 78
    SolutionNameMin: Cijk_Alik_Bljk_SB_MT32x64x16_SE_EPS0_FL0_GRVW4_LPA0_LPB2_PGR0_PLR1_TT2_4_USFGRO1_VW2_WG16_16_1_WGM8
    SolutionIndex: 79
    SolutionNameMin: Cijk_Alik_Bljk_SB_MT32x64x32_SE_EPS0_FL0_GRVW4_LPA2_LPB2_PGR0_PLR1_TT2_4_USFGRO1_VW2_WG16_16_1_WGM1
    SolutionIndex: 80
    SolutionNameMin: Cijk_Alik_Bljk_SB_MT64x32x8_SE_EPS1_FL0_GRVW4_LPA2_LPB0_PGR1_PLR1_TT4_4_USFGRO1_VW2_WG16_8_1_WGM1
    SolutionIndex: 81
    SolutionNameMin: Cijk_Alik_Bljk_SB_MT64x32x16_SE_EPS0_FL1_GRVW4_LPA4_LPB4_PGR0_PLR1_TT4_4_USFGRO1_VW4_WG16_8_1_WGM8
    SolutionIndex: 82
    SolutionNameMin: Cijk_Alik_Bljk_SB_MT64x32x8_SE_EPS1_FL1_GRVW2_LPA2_LPB2_PGR1_PLR1_TT4_4_USFGRO1_VW2_WG16_8_1_WGM1
    SolutionIndex: 83
    SolutionNameMin: Cijk_Alik_Bljk_SB_MT64x16x32_SE_EPS0_FL1_GRVW4_LPA2_LPB0_PGR0_PLR1_TT4_2_USFGRO1_VW2_WG16_8_1_WGM8
    SolutionIndex: 84
    SolutionNameMin: Cijk_Alik_Bljk_SB_MT64x16x8_SE_EPS1_FL0_GRVW4_LPA0_LPB2_PGR1_PLR1_TT4_2_USFGRO1_VW2_WG16_8_1_WGM8
    SolutionIndex: 85
    SolutionNameMin: Cijk_Alik_Bljk_SB_MT64x16x8_SE_EPS1_FL1_GRVW4_LPA0_LPB2_PGR1_PLR1_TT4_2_USFGRO1_VW2_WG16_8_1_WGM1
    SolutionIndex: 86
    SolutionNameMin: Cijk_Alik_Bljk_SB_MT64x16x8_SE_EPS1_FL1_GRVW4_LPA0_LPB2_PGR1_PLR1_TT4_2_USFGRO1_VW2_WG16_8_1_WGM8
    SolutionIndex: 87
    SolutionNameMin: Cijk_Alik_Bljk_SB_MT64x16x16_SE_EPS0_FL0_GRVW2_LPA2_LPB2_PGR0_PLR1_TT4_2_USFGRO1_VW2_WG16_8_1_WGM1
    SolutionIndex: 88
    SolutionNameMin: Cijk_Alik_Bljk_SB_MT64x16x16_SE_EPS0_FL1_GRVW1_LPA2_LPB2_PGR0_PLR1_TT4_2_USFGRO1_VW2_WG16_8_1_WGM1
    SolutionIndex: 89
    SolutionNameMin: Cijk_Alik_Bljk_SB_MT64x16x32_SE_EPS0_FL1_GRVW2_LPA2_LPB2_PGR0_PLR1_TT4_2_USFGRO1_VW2_WG16_8_1_WGM1
    SolutionIndex: 90
    SolutionNameMin: Cijk_Alik_Bljk_SB_MT64x16x8_SE_EPS1_FL0_GRVW4_LPA2_LPB2_PGR1_PLR1_TT4_2_USFGRO1_VW2_WG16_8_1_WGM1
    SolutionIndex: 91
    SolutionNameMin: Cijk_Alik_Bljk_SB_MT32x32x16_SE_EPS0_FL0_GRVW4_LPA0_LPB0_PGR0_PLR1_TT2_4_USFGRO1_VW2_WG16_8_1_WGM1
    SolutionIndex: 92
    SolutionNameMin: Cijk_Alik_Bljk_SB_MT32x32x32_SE_EPS0_FL1_GRVW4_LPA0_LPB0_PGR0_PLR1_TT2_4_USFGRO1_VW2_WG16_8_1_WGM1
    SolutionIndex: 93
    SolutionNameMin: Cijk_Alik_Bljk_SB_MT32x32x16_SE_EPS1_FL0_GRVW4_LPA0_LPB0_PGR1_PLR1_TT2_4_USFGRO1_VW2_WG16_8_1_WGM1
    SolutionIndex: 94
    SolutionNameMin: Cijk_Alik_Bljk_SB_MT32x32x8_SE_EPS1_FL1_GRVW2_LPA0_LPB0_PGR1_PLR1_TT2_4_USFGRO1_VW2_WG16_8_1_WGM1
    SolutionIndex: 95
    SolutionNameMin: Cijk_Alik_Bljk_SB_MT32x32x16_SE_EPS1_FL1_GRVW4_LPA0_LPB0_PGR1_PLR1_TT2_4_USFGRO1_VW2_WG16_8_1_WGM1
    SolutionIndex: 96
    SolutionNameMin: Cijk_Alik_Bljk_SB_MT32x32x16_SE_EPS0_FL0_GRVW4_LPA2_LPB0_PGR0_PLR0_TT2_4_USFGRO1_VW2_WG16_8_1_WGM8
    SolutionIndex: 97
    SolutionNameMin: Cijk_Alik_Bljk_SB_MT32x32x16_SE_EPS0_FL0_GRVW4_LPA2_LPB0_PGR0_PLR1_TT2_4_USFGRO1_VW2_WG16_8_1_WGM1
    SolutionIndex: 98
    SolutionNameMin: Cijk_Alik_Bljk_SB_MT32x32x16_SE_EPS0_FL1_GRVW4_LPA2_LPB0_PGR0_PLR1_TT2_4_USFGRO1_VW2_WG16_8_1_WGM1
    SolutionIndex: 99
    SolutionNameMin: Cijk_Alik_Bljk_SB_MT32x32x16_SE_EPS1_FL1_GRVW4_LPA2_LPB0_PGR1_PLR1_TT2_4_USFGRO1_VW2_WG16_8_1_WGM8
    SolutionIndex: 100
    SolutionNameMin: Cijk_Alik_Bljk_SB_MT32x32x16_SE_EPS0_FL1_GRVW4_LPA0_LPB2_PGR0_PLR1_TT2_4_USFGRO1_VW2_WG16_8_1_WGM8
    SolutionIndex: 101
    SolutionNameMin: Cijk_Alik_Bljk_SB_MT32x32x32_SE_EPS0_FL1_GRVW4_LPA0_LPB2_PGR0_PLR1_TT2_4_USFGRO1_VW2_WG16_8_1_WGM8
    SolutionIndex: 102
    SolutionNameMin: Cijk_Alik_Bljk_SB_MT32x32x8_SE_EPS0_FL0_GRVW1_LPA2_LPB2_PGR0_PLR0_TT2_4_USFGRO1_VW2_WG16_8_1_WGM1
    SolutionIndex: 103
    SolutionNameMin: Cijk_Alik_Bljk_SB_MT32x32x16_SE_EPS0_FL0_GRVW1_LPA2_LPB2_PGR0_PLR0_TT2_4_USFGRO1_VW2_WG16_8_1_WGM1
    SolutionIndex: 104
    SolutionNameMin: Cijk_Alik_Bljk_SB_MT32x32x16_SE_EPS0_FL0_GRVW4_LPA2_LPB2_PGR0_PLR0_TT2_4_USFGRO1_VW2_WG16_8_1_WGM1
    SolutionIndex: 105
    SolutionNameMin: Cijk_Alik_Bljk_SB_MT32x32x32_SE_EPS0_FL0_GRVW4_LPA2_LPB2_PGR0_PLR0_TT2_4_USFGRO1_VW2_WG16_8_1_WGM8
    SolutionIndex: 106
    SolutionNameMin: Cijk_Alik_Bljk_SB_MT32x32x16_SE_EPS0_FL1_GRVW2_LPA2_LPB2_PGR0_PLR0_TT2_4_USFGRO1_VW2_WG16_8_1_WGM1
    SolutionIndex: 107
    SolutionNameMin: Cijk_Alik_Bljk_SB_MT32x32x8_SE_EPS0_FL1_GRVW4_LPA2_LPB2_PGR0_PLR0_TT2_4_USFGRO1_VW2_WG16_8_1_WGM1
    SolutionIndex: 108
    SolutionNameMin: Cijk_Alik_Bljk_SB_MT32x32x16_SE_EPS0_FL1_GRVW4_LPA2_LPB2_PGR0_PLR0_TT2_4_USFGRO1_VW2_WG16_8_1_WGM1
    SolutionIndex: 109
    SolutionNameMin: Cijk_Alik_Bljk_SB_MT32x32x16_SE_EPS0_FL1_GRVW4_LPA2_LPB2_PGR0_PLR0_TT2_4_USFGRO1_VW2_WG16_8_1_WGM8
    SolutionIndex: 110
    SolutionNameMin: Cijk_Alik_Bljk_SB_MT32x32x16_SE_EPS0_FL0_GRVW1_LPA2_LPB2_PGR0_PLR1_TT2_4_USFGRO1_VW2_WG16_8_1_WGM1
    SolutionIndex: 111
    SolutionNameMin: Cijk_Alik_Bljk_SB_MT32x32x16_SE_EPS0_FL0_GRVW2_LPA2_LPB2_PGR0_PLR1_TT2_4_USFGRO1_VW2_WG16_8_1_WGM1
    SolutionIndex: 112
    SolutionNameMin: Cijk_Alik_Bljk_SB_MT32x32x16_SE_EPS0_FL0_GRVW4_LPA2_LPB2_PGR0_PLR1_TT2_4_USFGRO1_VW2_WG16_8_1_WGM1
    SolutionIndex: 113
    SolutionNameMin: Cijk_Alik_Bljk_SB_MT32x32x16_SE_EPS0_FL0_GRVW4_LPA2_LPB2_PGR0_PLR1_TT2_4_USFGRO1_VW2_WG16_8_1_WGM8
    SolutionIndex: 114
    SolutionNameMin: Cijk_Alik_Bljk_SB_MT32x32x32_SE_EPS0_FL0_GRVW4_LPA2_LPB2_PGR0_PLR1_TT2_4_USFGRO1_VW2_WG16_8_1_WGM8
    SolutionIndex: 115
    SolutionNameMin: Cijk_Alik_Bljk_SB_MT32x32x16_SE_EPS0_FL1_GRVW2_LPA2_LPB2_PGR0_PLR1_TT2_4_USFGRO1_VW2_WG16_8_1_WGM1
    SolutionIndex: 116
    SolutionNameMin: Cijk_Alik_Bljk_SB_MT32x32x32_SE_EPS0_FL1_GRVW2_LPA2_LPB2_PGR0_PLR1_TT2_4_USFGRO1_VW2_WG16_8_1_WGM1
    SolutionIndex: 117
    SolutionNameMin: Cijk_Alik_Bljk_SB_MT32x32x16_SE_EPS0_FL1_GRVW4_LPA2_LPB2_PGR0_PLR1_TT2_4_USFGRO1_VW2_WG16_8_1_WGM1
    SolutionIndex: 118
    SolutionNameMin: Cijk_Alik_Bljk_SB_MT32x32x16_SE_EPS0_FL1_GRVW4_LPA2_LPB2_PGR0_PLR1_TT2_4_USFGRO1_VW2_WG16_8_1_WGM8
    SolutionIndex: 119
    SolutionNameMin: Cijk_Alik_Bljk_SB_MT32x32x32_SE_EPS0_FL1_GRVW4_LPA2_LPB2_PGR0_PLR1_TT2_4_USFGRO1_VW2_WG16_8_1_WGM1
    SolutionIndex: 120
    SolutionNameMin: Cijk_Alik_Bljk_SB_MT32x32x32_SE_EPS0_FL1_GRVW4_LPA2_LPB2_PGR0_PLR1_TT2_4_USFGRO1_VW2_WG16_8_1_WGM8
    SolutionIndex: 121
    SolutionNameMin: Cijk_Alik_Bljk_SB_MT32x32x8_SE_EPS1_FL1_GRVW1_LPA2_LPB2_PGR1_PLR1_TT2_4_USFGRO1_VW2_WG16_8_1_WGM8
    SolutionIndex: 122
    SolutionNameMin: Cijk_Alik_Bljk_SB_MT64x64x8_SE_EPS1_FL0_GRVW2_LPA0_LPB0_PGR1_PLR1_TT4_8_USFGRO1_VW2_WG16_8_1_WGM1
    SolutionIndex: 123
    SolutionNameMin: Cijk_Alik_Bljk_SB_MT64x64x8_SE_EPS1_FL0_GRVW4_LPA2_LPB0_PGR1_PLR1_TT4_8_USFGRO1_VW2_WG16_8_1_WGM1
    SolutionIndex: 124
    SolutionNameMin: Cijk_Alik_Bljk_SB_MT64x64x8_SE_EPS1_FL1_GRVW4_LPA0_LPB2_PGR1_PLR1_TT4_8_USFGRO1_VW2_WG16_8_1_WGM1
    SolutionIndex: 125
    SolutionNameMin: Cijk_Alik_Bljk_SB_MT32x32x16_SE_EPS0_FL1_GRVW4_LPA0_LPB0_PGR0_PLR1_TT4_2_USFGRO1_VW2_WG8_16_1_WGM1
    SolutionIndex: 126
    SolutionNameMin: Cijk_Alik_Bljk_SB_MT32x32x8_SE_EPS1_FL1_GRVW4_LPA0_LPB0_PGR1_PLR1_TT4_2_USFGRO1_VW2_WG8_16_1_WGM1
    SolutionIndex: 127
    SolutionNameMin: Cijk_Alik_Bljk_SB_MT32x32x16_SE_EPS0_FL0_GRVW4_LPA2_LPB0_PGR0_PLR1_TT4_2_USFGRO1_VW2_WG8_16_1_WGM8
    SolutionIndex: 128
    SolutionNameMin: Cijk_Alik_Bljk_SB_MT32x32x8_SE_EPS1_FL0_GRVW4_LPA2_LPB0_PGR1_PLR1_TT4_2_USFGRO1_VW2_WG8_16_1_WGM1
    SolutionIndex: 129
    SolutionNameMin: Cijk_Alik_Bljk_SB_MT32x32x16_SE_EPS0_FL1_GRVW4_LPA0_LPB2_PGR0_PLR0_TT4_2_USFGRO1_VW2_WG8_16_1_WGM1
    SolutionIndex: 130
    SolutionNameMin: Cijk_Alik_Bljk_SB_MT32x32x16_SE_EPS0_FL0_GRVW2_LPA0_LPB2_PGR0_PLR1_TT4_2_USFGRO1_VW2_WG8_16_1_WGM8
    SolutionIndex: 131
    SolutionNameMin: Cijk_Alik_Bljk_SB_MT32x32x16_SE_EPS0_FL0_GRVW4_LPA0_LPB2_PGR0_PLR1_TT4_2_USFGRO1_VW2_WG8_16_1_WGM8
    SolutionIndex: 132
    SolutionNameMin: Cijk_Alik_Bljk_SB_MT32x32x16_SE_EPS0_FL1_GRVW4_LPA0_LPB2_PGR0_PLR1_TT4_2_USFGRO1_VW2_WG8_16_1_WGM1
    SolutionIndex: 133
    SolutionNameMin: Cijk_Alik_Bljk_SB_MT32x32x8_SE_EPS1_FL1_GRVW2_LPA0_LPB2_PGR1_PLR1_TT4_2_USFGRO1_VW2_WG8_16_1_WGM1
    SolutionIndex: 134
    SolutionNameMin: Cijk_Alik_Bljk_SB_MT32x32x8_SE_EPS0_FL0_GRVW1_LPA2_LPB2_PGR0_PLR0_TT4_2_USFGRO1_VW2_WG8_16_1_WGM1
    SolutionIndex: 135
    SolutionNameMin: Cijk_Alik_Bljk_SB_MT32x32x16_SE_EPS0_FL0_GRVW4_LPA2_LPB2_PGR0_PLR0_TT4_2_USFGRO1_VW2_WG8_16_1_WGM8
    SolutionIndex: 136
    SolutionNameMin: Cijk_Alik_Bljk_SB_MT32x32x16_SE_EPS0_FL0_GRVW1_LPA2_LPB2_PGR0_PLR1_TT4_2_USFGRO1_VW2_WG8_16_1_WGM8
    SolutionIndex: 137
    SolutionNameMin: Cijk_Alik_Bljk_SB_MT32x32x16_SE_EPS0_FL0_GRVW2_LPA2_LPB2_PGR0_PLR1_TT4_2_USFGRO1_VW2_WG8_16_1_WGM8
    SolutionIndex: 138
    SolutionNameMin: Cijk_Alik_Bljk_SB_MT32x32x32_SE_EPS0_FL0_GRVW4_LPA2_LPB2_PGR0_PLR1_TT4_2_USFGRO1_VW2_WG8_16_1_WGM1
    SolutionIndex: 139
    SolutionNameMin: Cijk_Alik_Bljk_SB_MT32x32x32_SE_EPS0_FL0_GRVW4_LPA2_LPB2_PGR0_PLR1_TT4_2_USFGRO1_VW2_WG8_16_1_WGM8
    SolutionIndex: 140
    SolutionNameMin: Cijk_Alik_Bljk_SB_MT32x32x16_SE_EPS0_FL1_GRVW2_LPA2_LPB2_PGR0_PLR1_TT4_2_USFGRO1_VW2_WG8_16_1_WGM1
    SolutionIndex: 141
    SolutionNameMin: Cijk_Alik_Bljk_SB_MT32x32x32_SE_EPS0_FL1_GRVW4_LPA2_LPB2_PGR0_PLR1_TT4_2_USFGRO1_VW2_WG8_16_1_WGM1
    SolutionIndex: 142
    SolutionNameMin: Cijk_Alik_Bljk_SB_MT32x32x32_SE_EPS0_FL1_GRVW4_LPA2_LPB2_PGR0_PLR1_TT4_2_USFGRO1_VW2_WG8_16_1_WGM8
    SolutionIndex: 143
    SolutionNameMin: Cijk_Alik_Bljk_SB_MT32x32x8_SE_EPS1_FL1_GRVW4_LPA2_LPB2_PGR1_PLR1_TT4_2_USFGRO1_VW2_WG8_16_1_WGM1
    SolutionIndex: 144
    SolutionNameMin: Cijk_Alik_Bljk_SB_MT64x64x16_SE_EPS0_FL1_GRVW4_LPA2_LPB0_PGR0_PLR0_TT8_4_USFGRO1_VW2_WG8_16_1_WGM1
- - - [512, 2790, 1, 2048, 512, 512, 2048, 2048]
    - [57, 4454.97]
  - - [512, 2864, 1, 2048, 512, 512, 2048, 2048]
    - [67, 4456.99]
  - - [512, 3092, 1, 2048, 512, 512, 2048, 2048]
    - [68, 4751.74]
  - - [512, 3113, 1, 2048, 512, 512, 2048, 2048]
    - [36, 4779.85]
  - - [512, 3137, 1, 2048, 512, 512, 2048, 2048]
    - [56, 4848.26]
  - - [512, 3165, 1, 2048, 512, 512, 2048, 2048]
    - [36, 5003.52]
  - - [512, 3166, 1, 2048, 512, 512, 2048, 2048]
    - [64, 4770.67]
  - - [512, 3194, 1, 2048, 512, 512, 2048, 2048]
    - [32, 4794.49]
  - - [512, 3219, 1, 2048, 512, 512, 2048, 2048]
    - [65, 4852.6]
  - - [512, 3222, 1, 2048, 512, 512, 2048, 2048]
    - [64, 4986.7]
  - - [512, 3234, 1, 2048, 512, 512, 2048, 2048]
    - [41, 5065.09]
  - - [512, 3237, 1, 2048, 512, 512, 2048, 2048]
    - [68, 4985.39]
  - - [512, 3242, 1, 2048, 512, 512, 2048, 2048]
    - [36, 4914.49]
  - - [512, 3246, 1, 2048, 512, 512, 2048, 2048]
    - [44, 5038.17]
  - - [512, 3249, 1, 2048, 512, 512, 2048, 2048]
    - [57, 4982.19]
  - - [512, 3251, 1, 2048, 512, 512, 2048, 2048]
    - [53, 5002.6]
  - - [512, 3257, 1, 2048, 512, 512, 2048, 2048]
    - [36, 5081.43]
  - - [512, 3262, 1, 2048, 512, 512, 2048, 2048]
    - [32, 4913.24]
  - - [512, 3268, 1, 2048, 512, 512, 2048, 2048]
    - [45, 5037.52]
  - - [512, 3282, 1, 2048, 512, 512, 2048, 2048]
    - [30, 4847.42]
  - - [512, 3286, 1, 2048, 512, 512, 2048, 2048]
    - [37, 4962.59]
  - - [512, 3287, 1, 2048, 512, 512, 2048, 2048]
    - [42, 5004.14]
  - - [512, 3293, 1, 2048, 512, 512, 2048, 2048]
    - [37, 4935.25]
  - - [512, 3297, 1, 2048, 512, 512, 2048, 2048]
    - [54, 4954.36]
  - - [512, 3307, 1, 2048, 512, 512, 2048, 2048]
    - [54, 4916.67]
  - - [512, 3314, 1, 2048, 512, 512, 2048, 2048]
    - [35, 4935.37]
  - - [512, 3315, 1, 2048, 512, 512, 2048, 2048]
    - [42, 4936.86]
  - - [512, 3319, 1, 2048, 512, 512, 2048, 2048]
    - [65, 4820.59]
  - - [512, 3322, 1, 2048, 512, 512, 2048, 2048]
    - [37, 5050.36]
  - - [512, 3323, 1, 2048, 512, 512, 2048, 2048]
    - [35, 4968.64]
  - - [512, 3324, 1, 2048, 512, 512, 2048, 2048]
    - [57, 4948.7]
  - - [512, 3325, 1, 2048, 512, 512, 2048, 2048]
    - [35, 4926.87]
  - - [512, 3327, 1, 2048, 512, 512, 2048, 2048]
    - [65, 4909.79]
  - - [512, 3329, 1, 2048, 512, 512, 2048, 2048]
    - [45, 5055.57]
  - - [512, 3332, 1, 2048, 512, 512, 2048, 2048]
    - [57, 5050.38]
  - - [512, 3336, 1, 2048, 512, 512, 2048, 2048]
    - [53, 5106.75]
  - - [512, 3339, 1, 2048, 512, 512, 2048, 2048]
    - [57, 5072.94]
  - - [512, 3342, 1, 2048, 512, 512, 2048, 2048]
    - [45, 5059.03]
  - - [512, 3344, 1, 2048, 512, 512, 2048, 2048]
    - [37, 4919.49]
  - - [512, 3358, 1, 2048, 512, 512, 2048, 2048]
    - [57, 5111.68]
  - - [512, 3360, 1, 2048, 512, 512, 2048, 2048]
    - [68, 5087.37]
  - - [512, 3364, 1, 2048, 512, 512, 2048, 2048]
    - [45, 5089.07]
  - - [512, 3365, 1, 2048, 512, 512, 2048, 2048]
    - [57, 5124.54]
  - - [512, 3369, 1, 2048, 512, 512, 2048, 2048]
    - [64, 5111.39]
  - - [512, 3371, 1, 2048, 512, 512, 2048, 2048]
    - [57, 5100.21]
  - - [512, 3374, 1, 2048, 512, 512, 2048, 2048]
    - [35, 5134.93]
  - - [512, 3376, 1, 2048, 512, 512, 2048, 2048]
    - [45, 5072.53]
  - - [512, 3377, 1, 2048, 512, 512, 2048, 2048]
    - [53, 5151.13]
  - - [512, 3378, 1, 2048, 512, 512, 2048, 2048]
    - [44, 5133.29]
  - - [512, 3381, 1, 2048, 512, 512, 2048, 2048]
    - [34, 5168.37]
  - - [512, 3382, 1, 2048, 512, 512, 2048, 2048]
    - [54, 5090.73]
  - - [512, 3383, 1, 2048, 512, 512, 2048, 2048]
    - [65, 5045.02]
  - - [512, 3384, 1, 2048, 512, 512, 2048, 2048]
    - [50, 5166.82]
  - - [512, 3385, 1, 2048, 512, 512, 2048, 2048]
    - [53, 5133.46]
  - - [512, 3386, 1, 2048, 512, 512, 2048, 2048]
    - [39, 5215.44]
  - - [512, 3388, 1, 2048, 512, 512, 2048, 2048]
    - [64, 5189.15]
  - - [512, 3390, 1, 2048, 512, 512, 2048, 2048]
    - [67, 5194.47]
  - - [512, 3391, 1, 2048, 512, 512, 2048, 2048]
    - [65, 5090.2]
  - - [512, 3396, 1, 2048, 512, 512, 2048, 2048]
    - [34, 5034.71]
  - - [512, 3399, 1, 2048, 512, 512, 2048, 2048]
    - [42, 5174.65]
  - - [512, 3402, 1, 2048, 512, 512, 2048, 2048]
    - [57, 5228.7]
  - - [512, 3410, 1, 2048, 512, 512, 2048, 2048]
    - [67, 5108.98]
  - - [512, 3412, 1, 2048, 512, 512, 2048, 2048]
    - [68, 5145.19]
  - - [512, 3414, 1, 2048, 512, 512, 2048, 2048]
    - [37, 5224.45]
  - - [512, 3415, 1, 2048, 512, 512, 2048, 2048]
    - [54, 5179.51]
  - - [512, 3418, 1, 2048, 512, 512, 2048, 2048]
    - [68, 5193.52]
  - - [512, 3420, 1, 2048, 512, 512, 2048, 2048]
    - [35, 5149.03]
  - - [512, 3422, 1, 2048, 512, 512, 2048, 2048]
    - [67, 5088.18]
  - - [512, 3425, 1, 2048, 512, 512, 2048, 2048]
    - [68, 5153.26]
  - - [512, 3426, 1, 2048, 512, 512, 2048, 2048]
    - [45, 5230.38]
  - - [512, 3427, 1, 2048, 512, 512, 2048, 2048]
    - [42, 5133.36]
  - - [512, 3428, 1, 2048, 512, 512, 2048, 2048]
    - [45, 5153.4]
  - - [512, 3430, 1, 2048, 512, 512, 2048, 2048]
    - [56, 5119.97]
  - - [512, 3431, 1, 2048, 512, 512, 2048, 2048]
    - [45, 5255.01]
  - - [512, 3432, 1, 2048, 512, 512, 2048, 2048]
    - [68, 5203.07]
  - - [512, 3438, 1, 2048, 512, 512, 2048, 2048]
    - [34, 5122.19]
  - - [512, 3439, 1, 2048, 512, 512, 2048, 2048]
    - [37, 5138.28]
  - - [512, 3440, 1, 2048, 512, 512, 2048, 2048]
    - [57, 5197.93]
  - - [512, 3443, 1, 2048, 512, 512, 2048, 2048]
    - [57, 5237.69]
  - - [512, 3445, 1, 2048, 512, 512, 2048, 2048]
    - [62, 5132.62]
  - - [512, 3447, 1, 2048, 512, 512, 2048, 2048]
    - [42, 5149.69]
  - - [512, 3448, 1, 2048, 512, 512, 2048, 2048]
    - [54, 5207.24]
  - - [512, 3450, 1, 2048, 512, 512, 2048, 2048]
    - [34, 5210.26]
  - - [512, 3451, 1, 2048, 512, 512, 2048, 2048]
    - [35, 5065.32]
  - - [512, 3452, 1, 2048, 512, 512, 2048, 2048]
    - [45, 5093.2]
  - - [512, 3453, 1, 2048, 512, 512, 2048, 2048]
    - [68, 5140.75]
  - - [512, 3455, 1, 2048, 512, 512, 2048, 2048]
    - [57, 5185.18]
  - - [512, 3456, 1, 2048, 512, 512, 2048, 2048]
    - [45, 5193.83]
  - - [512, 3457, 1, 2048, 512, 512, 2048, 2048]
    - [45, 5304.59]
  - - [512, 3458, 1, 2048, 512, 512, 2048, 2048]
    - [44, 5217.34]
  - - [512, 3459, 1, 2048, 512, 512, 2048, 2048]
    - [54, 5238.95]
  - - [512, 3460, 1, 2048, 512, 512, 2048, 2048]
    - [42, 5268.08]
  - - [512, 3461, 1, 2048, 512, 512, 2048, 2048]
    - [42, 5038.72]
  - - [512, 3462, 1, 2048, 512, 512, 2048, 2048]
    - [42, 5266.03]
  - - [512, 3466, 1, 2048, 512, 512, 2048, 2048]
    - [37, 5306.32]
  - - [512, 3467, 1, 2048, 512, 512, 2048, 2048]
    - [34, 5249.94]
  - - [512, 3468, 1, 2048, 512, 512, 2048, 2048]
    - [42, 5182.16]
  - - [512, 3470, 1, 2048, 512, 512, 2048, 2048]
    - [42, 5200.52]
  - - [512, 3471, 1, 2048, 512, 512, 2048, 2048]
    - [42, 5180.63]
  - - [512, 3472, 1, 2048, 512, 512, 2048, 2048]
    - [45, 5204.62]
  - - [512, 3475, 1, 2048, 512, 512, 2048, 2048]
    - [62, 5201.4]
  - - [512, 3476, 1, 2048, 512, 512, 2048, 2048]
    - [45, 5268.08]
  - - [512, 3477, 1, 2048, 512, 512, 2048, 2048]
    - [35, 5190.13]
  - - [512, 3478, 1, 2048, 512, 512, 2048, 2048]
    - [31, 5153.58]
  - - [512, 3479, 1, 2048, 512, 512, 2048, 2048]
    - [67, 5301.57]
  - - [512, 3480, 1, 2048, 512, 512, 2048, 2048]
    - [57, 5211.64]
  - - [512, 3481, 1, 2048, 512, 512, 2048, 2048]
    - [57, 5228.08]
  - - [512, 3483, 1, 2048, 512, 512, 2048, 2048]
    - [54, 5298.54]
  - - [512, 3484, 1, 2048, 512, 512, 2048, 2048]
    - [40, 5224.26]
  - - [512, 3487, 1, 2048, 512, 512, 2048, 2048]
    - [37, 5316.62]
  - - [512, 3489, 1, 2048, 512, 512, 2048, 2048]
    - [68, 5343.27]
  - - [512, 3490, 1, 2048, 512, 512, 2048, 2048]
    - [57, 5253.3]
  - - [512, 3491, 1, 2048, 512, 512, 2048, 2048]
    - [37, 5240.87]
  - - [512, 3493, 1, 2048, 512, 512, 2048, 2048]
    - [35, 5304.06]
  - - [512, 3494, 1, 2048, 512, 512, 2048, 2048]
    - [45, 5282.35]
  - - [512, 3495, 1, 2048, 512, 512, 2048, 2048]
    - [42, 5250.77]
  - - [512, 3497, 1, 2048, 512, 512, 2048, 2048]
    - [35, 5290.28]
  - - [512, 3498, 1, 2048, 512, 512, 2048, 2048]
    - [37, 5127.39]
  - - [512, 3499, 1, 2048, 512, 512, 2048, 2048]
    - [68, 5159.85]
  - - [512, 3501, 1, 2048, 512, 512, 2048, 2048]
    - [54, 5194.73]
  - - [512, 3503, 1, 2048, 512, 512, 2048, 2048]
    - [45, 5262.23]
  - - [512, 3507, 1, 2048, 512, 512, 2048, 2048]
    - [35, 5258.76]
  - - [512, 3508, 1, 2048, 512, 512, 2048, 2048]
    - [44, 5285.45]
  - - [512, 3509, 1, 2048, 512, 512, 2048, 2048]
    - [54, 5265.66]
  - - [512, 3511, 1, 2048, 512, 512, 2048, 2048]
    - [42, 5337.12]
  - - [512, 3514, 1, 2048, 512, 512, 2048, 2048]
    - [54, 5249.24]
  - - [512, 3515, 1, 2048, 512, 512, 2048, 2048]
    - [44, 5296.56]
  - - [512, 3517, 1, 2048, 512, 512, 2048, 2048]
    - [45, 5329.07]
  - - [512, 3518, 1, 2048, 512, 512, 2048, 2048]
    - [45, 5336.87]
  - - [512, 3519, 1, 2048, 512, 512, 2048, 2048]
    - [53, 5347.56]
  - - [512, 3520, 1, 2048, 512, 512, 2048, 2048]
    - [35, 5156.97]
  - - [512, 3523, 1, 2048, 512, 512, 2048, 2048]
    - [45, 5232.86]
  - - [512, 3528, 1, 2048, 512, 512, 2048, 2048]
    - [56, 5299.79]
  - - [512, 3529, 1, 2048, 512, 512, 2048, 2048]
    - [68, 5388.21]
  - - [512, 3530, 1, 2048, 512, 512, 2048, 2048]
    - [32, 5225.16]
  - - [512, 3532, 1, 2048, 512, 512, 2048, 2048]
    - [57, 5399.19]
  - - [512, 3533, 1, 2048, 512, 512, 2048, 2048]
    - [40, 5290.46]
  - - [512, 3534, 1, 2048, 512, 512, 2048, 2048]
    - [36, 5266.33]
  - - [512, 3538, 1, 2048, 512, 512, 2048, 2048]
    - [44, 5366.64]
  - - [512, 3539, 1, 2048, 512, 512, 2048, 2048]
    - [45, 5268.23]
  - - [512, 3541, 1, 2048, 512, 512, 2048, 2048]
    - [42, 5345.41]
  - - [512, 3547, 1, 2048, 512, 512, 2048, 2048]
    - [68, 5332.29]
  - - [512, 3548, 1, 2048, 512, 512, 2048, 2048]
    - [57, 5381.23]
  - - [512, 3552, 1, 2048, 512, 512, 2048, 2048]
    - [65, 5321.72]
  - - [512, 3564, 1, 2048, 512, 512, 2048, 2048]
    - [42, 5265.58]
  - - [512, 3575, 1, 2048, 512, 512, 2048, 2048]
    - [35, 5351.65]
  - - [512, 3598, 1, 2048, 512, 512, 2048, 2048]
    - [37, 5378.12]
  - - [512, 3599, 1, 2048, 512, 512, 2048, 2048]
    - [36, 5347.43]
  - - [512, 3608, 1, 2048, 512, 512, 2048, 2048]
    - [68, 5478.1]
  - - [512, 3780, 1, 512, 512, 512, 512, 512]
    - [16, 5525.3]
  - - [512, 3780, 1, 2048, 512, 512, 2048, 2048]
    - [32, 5524.16]
  - - [512, 3796, 1, 512, 512, 512, 512, 512]
    - [11, 5371.2]
  - - [512, 3796, 1, 2048, 512, 512, 2048, 2048]
    - [57, 5491.41]
  - - [512, 3822, 1, 512, 512, 512, 512, 512]
    - [12, 5410.15]
  - - [512, 3822, 1, 2048, 512, 512, 2048, 2048]
    - [40, 5509.89]
  - - [512, 3840, 1, 512, 512, 512, 512, 512]
    - [16, 5619.97]
  - - [512, 3840, 1, 2048, 512, 512, 2048, 2048]
    - [35, 5507.23]
  - - [512, 3859, 1, 512, 512, 512, 512, 512]
    - [16, 5654.81]
  - - [512, 3859, 1, 2048, 512, 512, 2048, 2048]
    - [37, 5538.97]
  - - [512, 3870, 1, 512, 512, 512, 512, 512]
    - [16, 5663.88]
  - - [512, 3870, 1, 2048, 512, 512, 2048, 2048]
    - [68, 5513.94]
  - - [512, 3876, 1, 512, 512, 512, 512, 512]
    - [16, 5693.86]
  - - [512, 3876, 1, 2048, 512, 512, 2048, 2048]
    - [57, 5556.61]
  - - [512, 3906, 1, 512, 512, 512, 512, 512]
    - [13, 5714.19]
  - - [512, 3906, 1, 2048, 512, 512, 2048, 2048]
    - [45, 5648.81]
  - - [512, 3910, 1, 512, 512, 512, 512, 512]
    - [1, 5340.33]
  - - [512, 3910, 1, 2048, 512, 512, 2048, 2048]
    - [36, 5660.96]
  - - [512, 3925, 1, 512, 512, 512, 512, 512]
    - [13, 5730.15]
  - - [512, 3925, 1, 2048, 512, 512, 2048, 2048]
    - [65, 5603.02]
  - - [512, 3927, 1, 512, 512, 512, 512, 512]
    - [13, 5700.14]
  - - [512, 3942, 1, 512, 512, 512, 512, 512]
    - [11, 5555.58]
  - - [512, 3942, 1, 2048, 512, 512, 2048, 2048]
    - [45, 5572.22]
  - - [512, 3944, 1, 512, 512, 512, 512, 512]
    - [15, 5525.4]
  - - [512, 3944, 1, 2048, 512, 512, 2048, 2048]
    - [45, 5596.84]
  - - [512, 3955, 1, 512, 512, 512, 512, 512]
    - [16, 5671.01]
  - - [512, 3955, 1, 2048, 512, 512, 2048, 2048]
    - [56, 5572.78]
  - - [512, 3968, 1, 512, 512, 512, 512, 512]
    - [13, 5824.17]
  - - [512, 3968, 1, 2048, 512, 512, 2048, 2048]
    - [45, 5637.69]
  - - [512, 3969, 1, 512, 512, 512, 512, 512]
    - [8, 5400.08]
  - - [512, 3969, 1, 2048, 512, 512, 2048, 2048]
    - [41, 5526.5]
  - - [512, 3976, 1, 512, 512, 512, 512, 512]
    - [13, 5809.4]
  - - [512, 3976, 1, 2048, 512, 512, 2048, 2048]
    - [31, 5465.29]
  - - [512, 3977, 1, 512, 512, 512, 512, 512]
    - [13, 5813.26]
  - - [512, 3977, 1, 2048, 512, 512, 2048, 2048]
    - [67, 5407.84]
  - - [512, 3978, 1, 512, 512, 512, 512, 512]
    - [16, 5776.55]
  - - [512, 3978, 1, 2048, 512, 512, 2048, 2048]
    - [34, 5498.47]
  - - [512, 3990, 1, 512, 512, 512, 512, 512]
    - [16, 5832.28]
  - - [512, 3990, 1, 2048, 512, 512, 2048, 2048]
    - [41, 5587.62]
  - - [512, 3995, 1, 512, 512, 512, 512, 512]
    - [13, 5839.57]
  - - [512, 3995, 1, 2048, 512, 512, 2048, 2048]
    - [68, 5605.72]
  - - [512, 3996, 1, 512, 512, 512, 512, 512]
    - [11, 5600.45]
  - - [512, 3996, 1, 2048, 512, 512, 2048, 2048]
    - [56, 5626.64]
  - - [512, 3999, 1, 512, 512, 512, 512, 512]
    - [13, 5833.38]
  - - [512, 3999, 1, 2048, 512, 512, 2048, 2048]
    - [35, 5589.72]
  - - [512, 4005, 1, 512, 512, 512, 512, 512]
    - [13, 5842.13]
  - - [512, 4005, 1, 2048, 512, 512, 2048, 2048]
    - [56, 5600.87]
  - - [512, 4012, 1, 512, 512, 512, 512, 512]
    - [11, 5625.1]
  - - [512, 4012, 1, 2048, 512, 512, 2048, 2048]
    - [68, 5566.12]
  - - [512, 4020, 1, 512, 512, 512, 512, 512]
    - [13, 5873.69]
  - - [512, 4020, 1, 2048, 512, 512, 2048, 2048]
    - [62, 5531.67]
  - - [512, 4026, 1, 512, 512, 512, 512, 512]
    - [13, 5867.92]
  - - [512, 4026, 1, 2048, 512, 512, 2048, 2048]
    - [36, 5633.57]
  - - [512, 4030, 1, 512, 512, 512, 512, 512]
    - [13, 5861.69]
  - - [512, 4030, 1, 2048, 512, 512, 2048, 2048]
    - [67, 5658.19]
  - - [512, 4032, 1, 512, 512, 512, 512, 512]
    - [17, 5850.15]
  - - [512, 4032, 1, 2048, 512, 512, 2048, 2048]
    - [67, 5672.81]
  - - [512, 4050, 1, 512, 512, 512, 512, 512]
    - [13, 5869.07]
  - - [512, 4059, 1, 512, 512, 512, 512, 512]
    - [15, 5628.56]
  - - [2048, 2790, 1, 512, 2048, 2048, 512, 512]
    - [28, 6452.1]
  - - [2048, 2864, 1, 512, 2048, 2048, 512, 512]
    - [66, 6442.21]
  - - [2048, 3092, 1, 512, 2048, 2048, 512, 512]
    - [28, 6156.73]
  - - [2048, 3113, 1, 512, 2048, 2048, 512, 512]
    - [13, 6121.05]
  - - [2048, 3137, 1, 512, 2048, 2048, 512, 512]
    - [28, 6277.24]
  - - [2048, 3165, 1, 512, 2048, 2048, 512, 512]
    - [25, 6295.0]
  - - [2048, 3166, 1, 512, 2048, 2048, 512, 512]
    - [28, 6311.17]
  - - [2048, 3194, 1, 512, 2048, 2048, 512, 512]
    - [28, 6343.77]
  - - [2048, 3219, 1, 512, 2048, 2048, 512, 512]
    - [28, 6430.41]
  - - [2048, 3222, 1, 512, 2048, 2048, 512, 512]
    - [28, 6404.77]
  - - [2048, 3234, 1, 512, 2048, 2048, 512, 512]
    - [25, 6416.91]
  - - [2048, 3237, 1, 512, 2048, 2048, 512, 512]
    - [28, 6427.37]
  - - [2048, 3242, 1, 512, 2048, 2048, 512, 512]
    - [29, 6364.98]
  - - [2048, 3246, 1, 512, 2048, 2048, 512, 512]
    - [28, 6458.82]
  - - [2048, 3249, 1, 512, 2048, 2048, 512, 512]
    - [28, 6459.35]
  - - [2048, 3251, 1, 512, 2048, 2048, 512, 512]
    - [13, 6395.06]
  - - [2048, 3257, 1, 512, 2048, 2048, 512, 512]
    - [28, 6467.98]
  - - [2048, 3262, 1, 512, 2048, 2048, 512, 512]
    - [28, 6463.41]
  - - [2048, 3268, 1, 512, 2048, 2048, 512, 512]
    - [25, 6514.51]
  - - [2048, 3282, 1, 512, 2048, 2048, 512, 512]
    - [25, 6526.79]
  - - [2048, 3286, 1, 512, 2048, 2048, 512, 512]
    - [28, 6527.41]
  - - [2048, 3287, 1, 512, 2048, 2048, 512, 512]
    - [25, 6534.9]
  - - [2048, 3293, 1, 512, 2048, 2048, 512, 512]
    - [25, 6549.58]
  - - [2048, 3297, 1, 512, 2048, 2048, 512, 512]
    - [25, 6551.1]
  - - [2048, 3307, 1, 512, 2048, 2048, 512, 512]
    - [25, 6541.58]
  - - [2048, 3314, 1, 512, 2048, 2048, 512, 512]
    - [28, 6576.56]
  - - [2048, 3315, 1, 512, 2048, 2048, 512, 512]
    - [25, 6540.04]
  - - [2048, 3319, 1, 512, 2048, 2048, 512, 512]
    - [28, 6559.82]
  - - [2048, 3322, 1, 512, 2048, 2048, 512, 512]
    - [25, 6586.91]
  - - [2048, 3323, 1, 512, 2048, 2048, 512, 512]
    - [25, 6587.04]
  - - [2048, 3324, 1, 512, 2048, 2048, 512, 512]
    - [25, 6584.41]
  - - [2048, 3325, 1, 512, 2048, 2048, 512, 512]
    - [28, 6594.7]
  - - [2048, 3327, 1, 512, 2048, 2048, 512, 512]
    - [28, 6577.47]
  - - [2048, 3329, 1, 512, 2048, 2048, 512, 512]
    - [25, 6263.02]
  - - [2048, 3332, 1, 512, 2048, 2048, 512, 512]
    - [25, 6278.68]
  - - [2048, 3336, 1, 512, 2048, 2048, 512, 512]
    - [25, 6261.21]
  - - [2048, 3339, 1, 512, 2048, 2048, 512, 512]
    - [25, 6263.53]
  - - [2048, 3342, 1, 512, 2048, 2048, 512, 512]
    - [25, 6289.99]
  - - [2048, 3344, 1, 512, 2048, 2048, 512, 512]
    - [25, 6282.06]
  - - [2048, 3358, 1, 512, 2048, 2048, 512, 512]
    - [28, 6288.33]
  - - [2048, 3360, 1, 512, 2048, 2048, 512, 512]
    - [25, 6306.26]
  - - [2048, 3364, 1, 512, 2048, 2048, 512, 512]
    - [25, 6280.46]
  - - [2048, 3365, 1, 512, 2048, 2048, 512, 512]
    - [25, 6311.46]
  - - [2048, 3369, 1, 512, 2048, 2048, 512, 512]
    - [28, 6282.34]
  - - [2048, 3371, 1, 512, 2048, 2048, 512, 512]
    - [28, 6292.7]
  - - [2048, 3374, 1, 512, 2048, 2048, 512, 512]
    - [28, 6304.11]
  - - [2048, 3376, 1, 512, 2048, 2048, 512, 512]
    - [25, 6323.71]
  - - [2048, 3377, 1, 512, 2048, 2048, 512, 512]
    - [28, 6316.39]
  - - [2048, 3378, 1, 512, 2048, 2048, 512, 512]
    - [25, 6319.93]
  - - [2048, 3381, 1, 512, 2048, 2048, 512, 512]
    - [25, 6327.21]
  - - [2048, 3382, 1, 512, 2048, 2048, 512, 512]
    - [28, 6337.47]
  - - [2048, 3383, 1, 512, 2048, 2048, 512, 512]
    - [28, 6326.78]
  - - [2048, 3384, 1, 512, 2048, 2048, 512, 512]
    - [28, 6297.04]
  - - [2048, 3385, 1, 512, 2048, 2048, 512, 512]
    - [25, 6327.17]
  - - [2048, 3386, 1, 512, 2048, 2048, 512, 512]
    - [28, 6327.37]
  - - [2048, 3388, 1, 512, 2048, 2048, 512, 512]
    - [28, 6329.44]
  - - [2048, 3390, 1, 512, 2048, 2048, 512, 512]
    - [28, 6342.38]
  - - [2048, 3391, 1, 512, 2048, 2048, 512, 512]
    - [25, 6337.55]
  - - [2048, 3396, 1, 512, 2048, 2048, 512, 512]
    - [25, 6364.54]
  - - [2048, 3399, 1, 512, 2048, 2048, 512, 512]
    - [28, 6356.7]
  - - [2048, 3402, 1, 512, 2048, 2048, 512, 512]
    - [25, 6376.63]
  - - [2048, 3410, 1, 512, 2048, 2048, 512, 512]
    - [28, 6380.65]
  - - [2048, 3412, 1, 512, 2048, 2048, 512, 512]
    - [25, 6412.36]
  - - [2048, 3414, 1, 512, 2048, 2048, 512, 512]
    - [28, 6386.44]
  - - [2048, 3415, 1, 512, 2048, 2048, 512, 512]
    - [25, 6407.78]
  - - [2048, 3418, 1, 512, 2048, 2048, 512, 512]
    - [25, 6406.63]
  - - [2048, 3420, 1, 512, 2048, 2048, 512, 512]
    - [28, 6410.37]
  - - [2048, 3422, 1, 512, 2048, 2048, 512, 512]
    - [28, 6420.92]
  - - [2048, 3425, 1, 512, 2048, 2048, 512, 512]
    - [25, 6423.99]
  - - [2048, 3426, 1, 512, 2048, 2048, 512, 512]
    - [28, 6425.02]
  - - [2048, 3427, 1, 512, 2048, 2048, 512, 512]
    - [28, 6414.15]
  - - [2048, 3428, 1, 512, 2048, 2048, 512, 512]
    - [28, 6401.63]
  - - [2048, 3430, 1, 512, 2048, 2048, 512, 512]
    - [25, 6385.99]
  - - [2048, 3431, 1, 512, 2048, 2048, 512, 512]
    - [28, 6428.44]
  - - [2048, 3432, 1, 512, 2048, 2048, 512, 512]
    - [25, 6416.72]
  - - [2048, 3438, 1, 512, 2048, 2048, 512, 512]
    - [28, 6410.16]
  - - [2048, 3439, 1, 512, 2048, 2048, 512, 512]
    - [25, 6419.63]
  - - [2048, 3440, 1, 512, 2048, 2048, 512, 512]
    - [28, 6436.78]
  - - [2048, 3443, 1, 512, 2048, 2048, 512, 512]
    - [28, 6452.63]
  - - [2048, 3445, 1, 512, 2048, 2048, 512, 512]
    - [28, 6455.52]
  - - [2048, 3447, 1, 512, 2048, 2048, 512, 512]
    - [28, 6436.26]
  - - [2048, 3448, 1, 512, 2048, 2048, 512, 512]
    - [28, 6438.13]
  - - [2048, 3450, 1, 512, 2048, 2048, 512, 512]
    - [25, 6446.97]
  - - [2048, 3451, 1, 512, 2048, 2048, 512, 512]
    - [25, 6452.25]
  - - [2048, 3452, 1, 512, 2048, 2048, 512, 512]
    - [25, 6443.05]
  - - [2048, 3453, 1, 512, 2048, 2048, 512, 512]
    - [25, 6451.72]
  - - [2048, 3455, 1, 512, 2048, 2048, 512, 512]
    - [28, 6454.6]
  - - [2048, 3456, 1, 512, 2048, 2048, 512, 512]
    - [25, 6464.15]
  - - [2048, 3457, 1, 512, 2048, 2048, 512, 512]
    - [25, 6486.6]
  - - [2048, 3458, 1, 512, 2048, 2048, 512, 512]
    - [28, 6503.12]
  - - [2048, 3459, 1, 512, 2048, 2048, 512, 512]
    - [28, 6501.55]
  - - [2048, 3460, 1, 512, 2048, 2048, 512, 512]
    - [28, 6496.53]
  - - [2048, 3461, 1, 512, 2048, 2048, 512, 512]
    - [25, 6499.27]
  - - [2048, 3462, 1, 512, 2048, 2048, 512, 512]
    - [25, 6492.53]
  - - [2048, 3466, 1, 512, 2048, 2048, 512, 512]
    - [28, 6512.98]
  - - [2048, 3467, 1, 512, 2048, 2048, 512, 512]
    - [28, 6500.19]
  - - [2048, 3468, 1, 512, 2048, 2048, 512, 512]
    - [28, 6503.79]
  - - [2048, 3470, 1, 512, 2048, 2048, 512, 512]
    - [28, 6510.99]
  - - [2048, 3471, 1, 512, 2048, 2048, 512, 512]
    - [28, 6498.23]
  - - [2048, 3472, 1, 512, 2048, 2048, 512, 512]
    - [25, 6494.94]
  - - [2048, 3475, 1, 512, 2048, 2048, 512, 512]
    - [25, 6479.14]
  - - [2048, 3476, 1, 512, 2048, 2048, 512, 512]
    - [28, 6514.48]
  - - [2048, 3477, 1, 512, 2048, 2048, 512, 512]
    - [28, 6509.45]
  - - [2048, 3478, 1, 512, 2048, 2048, 512, 512]
    - [28, 6489.87]
  - - [2048, 3479, 1, 512, 2048, 2048, 512, 512]
    - [25, 6502.88]
  - - [2048, 3480, 1, 512, 2048, 2048, 512, 512]
    - [25, 6503.89]
  - - [2048, 3481, 1, 512, 2048, 2048, 512, 512]
    - [25, 6526.43]
  - - [2048, 3483, 1, 512, 2048, 2048, 512, 512]
    - [28, 6528.46]
  - - [2048, 3484, 1, 512, 2048, 2048, 512, 512]
    - [28, 6520.83]
  - - [2048, 3487, 1, 512, 2048, 2048, 512, 512]
    - [25, 6533.37]
  - - [2048, 3489, 1, 512, 2048, 2048, 512, 512]
    - [25, 6526.74]
  - - [2048, 3490, 1, 512, 2048, 2048, 512, 512]
    - [28, 6522.58]
  - - [2048, 3491, 1, 512, 2048, 2048, 512, 512]
    - [25, 6521.0]
  - - [2048, 3493, 1, 512, 2048, 2048, 512, 512]
    - [28, 6503.28]
  - - [2048, 3494, 1, 512, 2048, 2048, 512, 512]
    - [25, 6515.43]
  - - [2048, 3495, 1, 512, 2048, 2048, 512, 512]
    - [25, 6549.21]
  - - [2048, 3497, 1, 512, 2048, 2048, 512, 512]
    - [25, 6528.76]
  - - [2048, 3498, 1, 512, 2048, 2048, 512, 512]
    - [25, 6546.17]
  - - [2048, 3499, 1, 512, 2048, 2048, 512, 512]
    - [25, 6534.22]
  - - [2048, 3501, 1, 512, 2048, 2048, 512, 512]
    - [25, 6543.13]
  - - [2048, 3503, 1, 512, 2048, 2048, 512, 512]
    - [28, 6528.77]
  - - [2048, 3507, 1, 512, 2048, 2048, 512, 512]
    - [25, 6557.81]
  - - [2048, 3508, 1, 512, 2048, 2048, 512, 512]
    - [25, 6544.98]
  - - [2048, 3509, 1, 512, 2048, 2048, 512, 512]
    - [25, 6540.81]
  - - [2048, 3511, 1, 512, 2048, 2048, 512, 512]
    - [25, 6573.11]
  - - [2048, 3514, 1, 512, 2048, 2048, 512, 512]
    - [28, 6557.04]
  - - [2048, 3515, 1, 512, 2048, 2048, 512, 512]
    - [28, 6552.87]
  - - [2048, 3517, 1, 512, 2048, 2048, 512, 512]
    - [28, 6543.66]
  - - [2048, 3518, 1, 512, 2048, 2048, 512, 512]
    - [28, 6532.65]
  - - [2048, 3519, 1, 512, 2048, 2048, 512, 512]
    - [28, 6542.22]
  - - [2048, 3520, 1, 512, 2048, 2048, 512, 512]
    - [28, 6624.12]
  - - [2048, 3523, 1, 512, 2048, 2048, 512, 512]
    - [25, 6582.51]
  - - [2048, 3528, 1, 512, 2048, 2048, 512, 512]
    - [25, 6599.69]
  - - [2048, 3529, 1, 512, 2048, 2048, 512, 512]
    - [28, 6634.89]
  - - [2048, 3530, 1, 512, 2048, 2048, 512, 512]
    - [28, 6605.19]
  - - [2048, 3532, 1, 512, 2048, 2048, 512, 512]
    - [25, 6610.67]
  - - [2048, 3533, 1, 512, 2048, 2048, 512, 512]
    - [25, 6616.92]
  - - [2048, 3534, 1, 512, 2048, 2048, 512, 512]
    - [25, 6630.2]
  - - [2048, 3538, 1, 512, 2048, 2048, 512, 512]
    - [28, 6633.31]
  - - [2048, 3539, 1, 512, 2048, 2048, 512, 512]
    - [25, 6610.67]
  - - [2048, 3541, 1, 512, 2048, 2048, 512, 512]
    - [25, 6640.69]
  - - [2048, 3547, 1, 512, 2048, 2048, 512, 512]
    - [28, 6634.37]
  - - [2048, 3548, 1, 512, 2048, 2048, 512, 512]
    - [28, 6623.98]
  - - [2048, 3552, 1, 512, 2048, 2048, 512, 512]
    - [28, 6645.47]
  - - [2048, 3564, 1, 512, 2048, 2048, 512, 512]
    - [25, 6662.63]
  - - [2048, 3575, 1, 512, 2048, 2048, 512, 512]
    - [25, 6662.96]
  - - [2048, 3598, 1, 512, 2048, 2048, 512, 512]
    - [28, 6268.4]
  - - [2048, 3599, 1, 512, 2048, 2048, 512, 512]
    - [25, 6261.67]
  - - [2048, 3608, 1, 512, 2048, 2048, 512, 512]
    - [28, 6277.33]
  - - [2048, 3780, 1, 512, 2048, 2048, 512, 512]
    - [28, 6564.48]
  - - [2048, 3796, 1, 512, 2048, 2048, 512, 512]
    - [29, 6523.43]
  - - [2048, 3822, 1, 512, 2048, 2048, 512, 512]
    - [28, 6607.42]
  - - [2048, 3840, 1, 512, 2048, 2048, 512, 512]
    - [25, 6704.86]
  - - [2048, 3859, 1, 512, 2048, 2048, 512, 512]
    - [55, 6574.23]
  - - [2048, 3870, 1, 512, 2048, 2048, 512, 512]
    - [66, 6590.6]
  - - [2048, 3876, 1, 512, 2048, 2048, 512, 512]
    - [49, 6588.92]
  - - [2048, 3906, 1, 512, 2048, 2048, 512, 512]
    - [63, 6624.01]
  - - [2048, 3910, 1, 512, 2048, 2048, 512, 512]
    - [55, 6641.13]
  - - [2048, 3925, 1, 512, 2048, 2048, 512, 512]
    - [33, 6651.45]
  - - [2048, 3942, 1, 512, 2048, 2048, 512, 512]
    - [38, 6673.86]
  - - [2048, 3944, 1, 512, 2048, 2048, 512, 512]
    - [51, 6672.46]
  - - [2048, 3955, 1, 512, 2048, 2048, 512, 512]
    - [51, 6707.1]
  - - [2048, 3968, 1, 512, 2048, 2048, 512, 512]
    - [66, 6759.12]
  - - [2048, 3969, 1, 512, 2048, 2048, 512, 512]
    - [55, 6722.8]
  - - [2048, 3976, 1, 512, 2048, 2048, 512, 512]
    - [66, 6741.1]
  - - [2048, 3977, 1, 512, 2048, 2048, 512, 512]
    - [66, 6729.9]
  - - [2048, 3978, 1, 512, 2048, 2048, 512, 512]
    - [55, 6727.57]
  - - [2048, 3990, 1, 512, 2048, 2048, 512, 512]
    - [61, 6734.99]
  - - [2048, 3995, 1, 512, 2048, 2048, 512, 512]
    - [66, 6757.94]
  - - [2048, 3996, 1, 512, 2048, 2048, 512, 512]
    - [51, 6753.17]
  - - [2048, 3999, 1, 512, 2048, 2048, 512, 512]
    - [51, 6746.16]
  - - [2048, 4005, 1, 512, 2048, 2048, 512, 512]
    - [55, 6781.34]
  - - [2048, 4012, 1, 512, 2048, 2048, 512, 512]
    - [66, 6778.59]
  - - [2048, 4020, 1, 512, 2048, 2048, 512, 512]
    - [66, 6792.11]
  - - [2048, 4026, 1, 512, 2048, 2048, 512, 512]
    - [58, 6782.01]
  - - [2048, 4030, 1, 512, 2048, 2048, 512, 512]
    - [51, 6789.55]
  - - [2048, 4032, 1, 512, 2048, 2048, 512, 512]
    - [46, 6801.02]
  - - [33708, 184, 1, 512, 33708, 33708, 512, 512]
    - [26, 6059.17]
  - - [33708, 189, 1, 512, 33708, 33708, 512, 512]
    - [29, 6170.62]
  - - [33708, 208, 1, 512, 33708, 33708, 512, 512]
    - [7, 5387.46]
  - - [33708, 246, 1, 512, 33708, 33708, 512, 512]
    - [23, 6077.79]
  - - [33708, 264, 1, 512, 33708, 33708, 512, 512]
    - [4, 5726.93]
  - - [33708, 465, 1, 512, 33708, 33708, 512, 512]
    - [3, 6129.37]
  - - [33708, 468, 1, 512, 33708, 33708, 512, 512]
    - [13, 6182.91]
  - - [33708, 493, 1, 512, 33708, 33708, 512, 512]
    - [59, 6396.39]
  - - [33708, 540, 1, 512, 33708, 33708, 512, 512]
    - [19, 6017.9]
  - - [33708, 550, 1, 512, 33708, 33708, 512, 512]
    - [29, 6021.05]
  - - [33708, 560, 1, 512, 33708, 33708, 512, 512]
    - [21, 6103.28]
  - - [33708, 644, 1, 512, 33708, 33708, 512, 512]
    - [18, 6196.69]
  - - [33708, 714, 1, 512, 33708, 33708, 512, 512]
    - [18, 6316.65]
  - - [33708, 720, 1, 512, 33708, 33708, 512, 512]
    - [14, 6187.87]
  - - [33708, 781, 1, 512, 33708, 33708, 512, 512]
    - [18, 6402.72]
  - - [33708, 936, 1, 512, 33708, 33708, 512, 512]
    - [22, 6439.23]
  - - [33708, 980, 1, 512, 33708, 33708, 512, 512]
    - [60, 6632.07]
  - - [33708, 1232, 1, 512, 33708, 33708, 512, 512]
    - [54, 6718.48]
  - - [33708, 1290, 1, 512, 33708, 33708, 512, 512]
    - [29, 6510.97]
  - - [33708, 1350, 1, 512, 33708, 33708, 512, 512]
    - [57, 6778.27]
  - - [33708, 1424, 1, 512, 33708, 33708, 512, 512]
    - [27, 6506.88]
  - - [33708, 1458, 1, 512, 33708, 33708, 512, 512]
    - [67, 6798.37]
  - - [33708, 1462, 1, 512, 33708, 33708, 512, 512]
    - [26, 6842.63]
  - - [33708, 1520, 1, 512, 33708, 33708, 512, 512]
    - [56, 6928.02]
  - - [33708, 1596, 1, 512, 33708, 33708, 512, 512]
    - [41, 6790.09]
  - - [33708, 1599, 1, 512, 33708, 33708, 512, 512]
    - [41, 6797.39]
  - - [33708, 1615, 1, 512, 33708, 33708, 512, 512]
    - [54, 7027.22]
  - - [33708, 1680, 1, 512, 33708, 33708, 512, 512]
    - [64, 6744.95]
  - - [33708, 1917, 1, 512, 33708, 33708, 512, 512]
    - [36, 7132.89]
  - - [33708, 2205, 1, 512, 33708, 33708, 512, 512]
    - [26, 5599.79]
  - - [33708, 2418, 1, 512, 33708, 33708, 512, 512]
    - [20, 6773.88]
  - - [33708, 2496, 1, 512, 33708, 33708, 512, 512]
    - [29, 7035.88]
  - - [33708, 3776, 1, 512, 33708, 33708, 512, 512]
    - [6, 6460.79]
  - - [33708, 3780, 1, 512, 33708, 33708, 512, 512]
    - [40, 7159.11]
  - - [33708, 3796, 1, 512, 33708, 33708, 512, 512]
    - [10, 6625.36]
  - - [33708, 3822, 1, 512, 33708, 33708, 512, 512]
    - [48, 7308.77]
  - - [33708, 3835, 1, 512, 33708, 33708, 512, 512]
    - [40, 7247.79]
  - - [33708, 3840, 1, 512, 33708, 33708, 512, 512]
    - [9, 6697.49]
  - - [33708, 3859, 1, 512, 33708, 33708, 512, 512]
    - [52, 6909.12]
  - - [33708, 3864, 1, 512, 33708, 33708, 512, 512]
    - [24, 6119.31]
  - - [33708, 3870, 1, 512, 33708, 33708, 512, 512]
    - [52, 6880.17]
  - - [33708, 3876, 1, 512, 33708, 33708, 512, 512]
    - [37, 7361.76]
  - - [33708, 3906, 1, 512, 33708, 33708, 512, 512]
    - [10, 6594.06]
  - - [33708, 3910, 1, 512, 33708, 33708, 512, 512]
    - [29, 6192.37]
  - - [33708, 3925, 1, 512, 33708, 33708, 512, 512]
    - [10, 6631.09]
  - - [33708, 3942, 1, 512, 33708, 33708, 512, 512]
    - [29, 6223.33]
  - - [33708, 3944, 1, 512, 33708, 33708, 512, 512]
    - [29, 6184.96]
  - - [33708, 3955, 1, 512, 33708, 33708, 512, 512]
    - [47, 7033.43]
  - - [33708, 3968, 1, 512, 33708, 33708, 512, 512]
    - [26, 6230.39]
  - - [33708, 3969, 1, 512, 33708, 33708, 512, 512]
    - [42, 7270.38]
  - - [33708, 3976, 1, 512, 33708, 33708, 512, 512]
    - [41, 7209.01]
  - - [33708, 3977, 1, 512, 33708, 33708, 512, 512]
    - [5, 6365.11]
  - - [33708, 3978, 1, 512, 33708, 33708, 512, 512]
    - [44, 7253.56]
  - - [33708, 3990, 1, 512, 33708, 33708, 512, 512]
    - [53, 7265.71]
  - - [33708, 3995, 1, 512, 33708, 33708, 512, 512]
    - [62, 7288.72]
  - - [33708, 3996, 1, 512, 33708, 33708, 512, 512]
    - [24, 6133.48]
  - - [33708, 3999, 1, 512, 33708, 33708, 512, 512]
    - [37, 7325.45]
  - - [33708, 4005, 1, 512, 33708, 33708, 512, 512]
    - [2, 6604.93]
  - - [33708, 4012, 1, 512, 33708, 33708, 512, 512]
    - [43, 6991.09]
  - - [33708, 4020, 1, 512, 33708, 33708, 512, 512]
    - [39, 7123.04]
  - - [33708, 4026, 1, 512, 33708, 33708, 512, 512]
    - [37, 7346.31]
  - - [33708, 4030, 1, 512, 33708, 33708, 512, 512]
    - [54, 7389.55]
  - - [33708, 4032, 1, 512, 33708, 33708, 512, 512]
    - [37, 7370.02]
  - - [7, 7, 736, 64, 7, 7, 64, 64]
    - [140, 81.9957]
  - - [8, 8, 264, 64, 8, 8, 64, 64]
    - [121, 87.9356]
  - - [9, 9, 416, 64, 9, 9, 64, 64]
    - [106, 147.034]
  - - [10, 10, 448, 64, 10, 10, 64, 64]
    - [105, 191.613]
  - - [11, 11, 568, 64, 11, 11, 64, 64]
    - [143, 260.434]
  - - [12, 12, 480, 64, 12, 12, 64, 64]
    - [137, 281.691]
  - - [12, 12, 2520, 64, 12, 12, 64, 64]
    - [115, 459.029]
  - - [13, 13, 576, 64, 13, 13, 64, 64]
    - [85, 356.367]
  - - [13, 13, 2336, 64, 13, 13, 64, 64]
    - [111, 502.33]
  - - [14, 14, 704, 64, 14, 14, 64, 64]
    - [90, 435.088]
  - - [14, 14, 2184, 64, 14, 14, 64, 64]
    - [140, 542.282]
  - - [15, 15, 688, 64, 15, 15, 64, 64]
    - [128, 474.267]
  - - [15, 15, 2048, 64, 15, 15, 64, 64]
    - [117, 579.503]
  - - [16, 16, 712, 64, 16, 16, 64, 64]
    - [94, 523.183]
  - - [16, 16, 1920, 64, 16, 16, 64, 64]
    - [132, 613.669]
  - - [17, 17, 688, 64, 17, 17, 64, 64]
    - [107, 550.59]
  - - [17, 17, 1816, 64, 17, 17, 64, 64]
    - [125, 645.912]
  - - [18, 18, 648, 64, 18, 18, 64, 64]
    - [102, 600.64]
  - - [18, 18, 1720, 64, 18, 18, 64, 64]
    - [98, 681.975]
  - - [19, 19, 680, 64, 19, 19, 64, 64]
    - [134, 629.335]
  - - [19, 19, 1632, 64, 19, 19, 64, 64]
    - [118, 709.922]
  - - [21, 21, 1472, 64, 21, 21, 64, 64]
    - [99, 781.126]
  - - [21, 21, 1488, 64, 21, 21, 64, 64]
    - [116, 787.425]
  - - [23, 23, 64, 64, 23, 23, 64, 64]
    - [131, 218.294]
  - - [23, 23, 1360, 64, 23, 23, 64, 64]
    - [101, 852.646]
  - - [25, 25, 176, 64, 25, 25, 64, 64]
    - [133, 637.826]
  - - [25, 25, 1256, 64, 25, 25, 64, 64]
    - [91, 905.494]
  - - [26, 26, 56, 64, 26, 26, 64, 64]
    - [78, 230.336]
  - - [26, 27, 56, 64, 26, 26, 64, 64]
    - [127, 251.584]
  - - [27, 27, 56, 64, 27, 27, 64, 64]
    - [130, 257.45]
  - - [27, 27, 1168, 64, 27, 27, 64, 64]
    - [92, 971.792]
  - - [29, 29, 136, 64, 29, 29, 64, 64]
    - [126, 641.689]
  - - [29, 29, 1088, 64, 29, 29, 64, 64]
    - [92, 1038.81]
  - - [32, 32, 624, 64, 32, 32, 64, 64]
    - [129, 1091.03]
  - - [32, 32, 992, 64, 32, 32, 64, 64]
    - [95, 1170.17]
  - - [35, 35, 384, 64, 35, 35, 64, 64]
    - [122, 986.438]
  - - [35, 35, 904, 64, 35, 35, 64, 64]
    - [88, 1139.01]
  - - [38, 38, 320, 64, 38, 38, 64, 64]
    - [123, 1102.84]
  - - [38, 38, 840, 64, 38, 38, 64, 64]
    - [89, 1224.26]
  - - [41, 41, 312, 64, 41, 41, 64, 64]
    - [124, 1189.32]
  - - [41, 41, 776, 64, 41, 41, 64, 64]
    - [83, 1299.9]
  - - [45, 45, 392, 64, 45, 45, 64, 64]
    - [144, 1281.91]
  - - [45, 45, 712, 64, 45, 45, 64, 64]
    - [89, 1430.17]
  - - [49, 49, 160, 64, 49, 49, 64, 64]
    - [70, 1271.66]
  - - [49, 49, 648, 64, 49, 49, 64, 64]
    - [139, 1506.97]
  - - [54, 54, 200, 64, 54, 54, 64, 64]
    - [71, 1443.73]
  - - [54, 54, 592, 64, 54, 54, 64, 64]
    - [69, 1640.76]
  - - [59, 59, 512, 64, 59, 59, 64, 64]
    - [0, 1759.81]
  - - [59, 59, 544, 64, 59, 59, 64, 64]
    - [72, 1759.21]
  - - [64, 64, 496, 64, 64, 64, 64, 64]
    - [0, 2008.3]
  - - [64, 65, 496, 64, 64, 64, 64, 64]
    - [142, 1886.43]
  - - [65, 65, 472, 64, 65, 65, 64, 64]
    - [117, 1754.5]
  - - [65, 65, 496, 64, 65, 65, 64, 64]
    - [110, 1751.01]
  - - [70, 70, 216, 64, 70, 70, 64, 64]
    - [112, 1693.38]
  - - [70, 71, 216, 64, 70, 70, 64, 64]
    - [136, 1683.27]
  - - [71, 71, 216, 64, 71, 71, 64, 64]
    - [112, 1701.15]
  - - [71, 71, 448, 64, 71, 71, 64, 64]
    - [109, 1896.17]
  - - [77, 77, 248, 64, 77, 77, 64, 64]
    - [93, 1896.09]
  - - [77, 77, 408, 64, 77, 77, 64, 64]
    - [141, 2019.29]
  - - [77, 78, 248, 64, 77, 77, 64, 64]
    - [96, 1898.06]
  - - [77, 78, 408, 64, 77, 77, 64, 64]
    - [138, 2051.47]
  - - [78, 78, 248, 64, 78, 78, 64, 64]
    - [109, 1914.23]
  - - [78, 78, 408, 64, 78, 78, 64, 64]
    - [120, 2072.09]
  - - [80, 80, 152, 64, 80, 80, 64, 64]
    - [112, 1855.35]
  - - [80, 84, 152, 64, 80, 80, 64, 64]
    - [113, 1901.93]
  - - [84, 84, 152, 64, 84, 84, 64, 64]
    - [97, 1918.47]
  - - [85, 85, 376, 64, 85, 85, 64, 64]
    - [119, 2203.82]
  - - [91, 91, 40, 64, 91, 91, 64, 64]
    - [103, 1490.5]
  - - [91, 93, 40, 64, 91, 91, 64, 64]
    - [135, 1477.14]
  - - [93, 93, 40, 64, 93, 93, 64, 64]
    - [100, 1509.56]
  - - [93, 93, 344, 64, 93, 93, 64, 64]
    - [114, 2353.96]
  - - [102, 102, 56, 64, 102, 102, 64, 64]
    - [80, 1753.9]
  - - [102, 102, 312, 64, 102, 102, 64, 64]
    - [74, 2432.35]
  - - [103, 103, 16, 64, 103, 103, 64, 64]
    - [86, 964.84]
  - - [103, 104, 16, 64, 103, 103, 64, 64]
    - [84, 961.568]
  - - [104, 104, 16, 64, 104, 104, 64, 64]
    - [86, 964.646]
  - - [112, 112, 16, 64, 112, 112, 64, 64]
    - [86, 1133.37]
  - - [112, 112, 288, 64, 112, 112, 64, 64]
    - [74, 2670.01]
  - - [112, 123, 16, 64, 112, 112, 64, 64]
    - [73, 1154.15]
  - - [119, 119, 32, 64, 119, 119, 64, 64]
    - [77, 1787.69]
  - - [119, 135, 32, 64, 119, 119, 64, 64]
    - [82, 1890.0]
  - - [122, 122, 264, 64, 122, 122, 64, 64]
    - [79, 2803.36]
  - - [123, 122, 264, 64, 123, 123, 64, 64]
    - [76, 2824.01]
  - - [123, 123, 16, 64, 123, 123, 64, 64]
    - [87, 1349.25]
  - - [123, 123, 264, 64, 123, 123, 64, 64]
    - [75, 2819.25]
  - - [134, 134, 240, 64, 134, 134, 64, 64]
    - [109, 2663.26]
  - - [135, 134, 240, 64, 135, 135, 64, 64]
    - [108, 2692.77]
  - - [135, 135, 32, 64, 135, 135, 64, 64]
    - [81, 1887.14]
  - - [135, 135, 240, 64, 135, 135, 64, 64]
    - [104, 2680.15]
- null
