Tensile/Configs/miopen/archives/bert/2019-11-05/exact/vega20_Cijk_Alik_Bljk_SB.yaml
- {MinimumRequiredVersion: 4.13.0}
- vega20
- gfx906
- [Device 66a0, Device 66a1, Device 66a7, Vega 20]
    SolutionIndex: 0
    SolutionNameMin: Cijk_Alik_Bljk_SB_MT64x64x16_SE_EPS0_FL1_GRVW4_LPA0_LPB0_PGR0_PLR1_TT4_4_USFGRO1_VW2_WG16_16_1_WGM8
    SolutionIndex: 1
    SolutionNameMin: Cijk_Alik_Bljk_SB_MT64x96x16_SE_EPS0_FL1_GRVW4_LPA0_LPB0_PGR0_PLR0_TT4_6_USFGRO1_VW2_WG16_16_1_WGM8
    SolutionIndex: 2
    SolutionNameMin: Cijk_Alik_Bljk_SB_MT64x128x8_SE_EPS1_FL1_GRVW4_LPA0_LPB0_PGR1_PLR0_TT4_8_USFGRO1_VW2_WG16_16_1_WGM8
    SolutionIndex: 3
    SolutionNameMin: Cijk_Alik_Bljk_SB_MT128x64x8_SE_EPS1_FL0_GRVW2_LPA0_LPB0_PGR1_PLR0_TT8_4_USFGRO1_VW2_WG16_16_1_WGM8
    SolutionIndex: 4
    SolutionNameMin: Cijk_Alik_Bljk_SB_MT128x64x8_SE_EPS1_FL0_GRVW2_LPA0_LPB0_PGR1_PLR0_TT8_4_USFGRO1_VW4_WG16_16_1_WGM8
    SolutionIndex: 5
    SolutionNameMin: Cijk_Alik_Bljk_SB_MT128x64x16_SE_EPS1_FL0_GRVW4_LPA0_LPB0_PGR1_PLR1_TT8_4_USFGRO1_VW4_WG16_16_1_WGM1
    SolutionIndex: 6
    SolutionNameMin: Cijk_Alik_Bljk_SB_MT128x64x8_SE_EPS1_FL1_GRVW4_LPA0_LPB0_PGR1_PLR1_TT8_4_USFGRO1_VW2_WG16_16_1_WGM8
    SolutionIndex: 7
    SolutionNameMin: Cijk_Alik_Bljk_SB_MT128x64x16_SE_EPS1_FL1_GRVW4_LPA0_LPB0_PGR1_PLR1_TT8_4_USFGRO1_VW4_WG16_16_1_WGM1
    SolutionIndex: 8
    SolutionNameMin: Cijk_Alik_Bljk_SB_MT128x64x16_SE_EPS1_FL1_GRVW4_LPA0_LPB0_PGR1_PLR1_TT8_4_USFGRO1_VW4_WG16_16_1_WGM8
    SolutionIndex: 9
    SolutionNameMin: Cijk_Alik_Bljk_SB_MT128x128x8_SE_EPS1_FL0_GRVW4_LPA0_LPB0_PGR1_PLR0_TT8_8_USFGRO1_VW2_WG16_16_1_WGM1
    SolutionIndex: 10
    SolutionNameMin: Cijk_Alik_Bljk_SB_MT128x128x16_SE_EPS1_FL0_GRVW4_LPA0_LPB0_PGR1_PLR0_TT8_8_USFGRO1_VW2_WG16_16_1_WGM1
    SolutionIndex: 11
    SolutionNameMin: Cijk_Alik_Bljk_SB_MT128x128x16_SE_EPS1_FL0_GRVW4_LPA0_LPB0_PGR1_PLR0_TT8_8_USFGRO1_VW2_WG16_16_1_WGM8
    SolutionIndex: 12
    SolutionNameMin: Cijk_Alik_Bljk_SB_MT128x128x8_SE_EPS1_FL0_GRVW4_LPA0_LPB0_PGR1_PLR0_TT8_8_USFGRO1_VW4_WG16_16_1_WGM1
    SolutionIndex: 13
    SolutionNameMin: Cijk_Alik_Bljk_SB_MT128x128x8_SE_EPS1_FL0_GRVW4_LPA0_LPB0_PGR1_PLR0_TT8_8_USFGRO1_VW4_WG16_16_1_WGM8
    SolutionIndex: 14
    SolutionNameMin: Cijk_Alik_Bljk_SB_MT128x128x16_SE_EPS1_FL0_GRVW4_LPA0_LPB0_PGR1_PLR0_TT8_8_USFGRO1_VW4_WG16_16_1_WGM1
    SolutionIndex: 15
    SolutionNameMin: Cijk_Alik_Bljk_SB_MT128x128x16_SE_EPS1_FL0_GRVW4_LPA0_LPB0_PGR1_PLR0_TT8_8_USFGRO1_VW4_WG16_16_1_WGM8
    SolutionIndex: 16
    SolutionNameMin: Cijk_Alik_Bljk_SB_MT128x128x8_SE_EPS1_FL1_GRVW2_LPA0_LPB0_PGR1_PLR0_TT8_8_USFGRO1_VW4_WG16_16_1_WGM1
    SolutionIndex: 17
    SolutionNameMin: Cijk_Alik_Bljk_SB_MT128x128x8_SE_EPS1_FL1_GRVW4_LPA0_LPB0_PGR1_PLR0_TT8_8_USFGRO1_VW2_WG16_16_1_WGM1
    SolutionIndex: 18
    SolutionNameMin: Cijk_Alik_Bljk_SB_MT128x128x16_SE_EPS1_FL1_GRVW4_LPA0_LPB0_PGR1_PLR0_TT8_8_USFGRO1_VW2_WG16_16_1_WGM1
    SolutionIndex: 19
    SolutionNameMin: Cijk_Alik_Bljk_SB_MT128x128x16_SE_EPS1_FL1_GRVW4_LPA0_LPB0_PGR1_PLR0_TT8_8_USFGRO1_VW2_WG16_16_1_WGM8
    SolutionIndex: 20
    SolutionNameMin: Cijk_Alik_Bljk_SB_MT128x128x8_SE_EPS1_FL1_GRVW4_LPA0_LPB0_PGR1_PLR0_TT8_8_USFGRO1_VW4_WG16_16_1_WGM1
    SolutionIndex: 21
    SolutionNameMin: Cijk_Alik_Bljk_SB_MT128x128x16_SE_EPS1_FL1_GRVW4_LPA0_LPB0_PGR1_PLR0_TT8_8_USFGRO1_VW4_WG16_16_1_WGM1
    SolutionIndex: 22
    SolutionNameMin: Cijk_Alik_Bljk_SB_MT128x128x16_SE_EPS1_FL1_GRVW4_LPA0_LPB0_PGR1_PLR0_TT8_8_USFGRO1_VW4_WG16_16_1_WGM8
    SolutionIndex: 23
    SolutionNameMin: Cijk_Alik_Bljk_SB_MT128x128x8_SE_EPS1_FL0_GRVW2_LPA0_LPB0_PGR1_PLR1_TT8_8_USFGRO1_VW2_WG16_16_1_WGM1
    SolutionIndex: 24
    SolutionNameMin: Cijk_Alik_Bljk_SB_MT128x128x16_SE_EPS1_FL0_GRVW2_LPA0_LPB0_PGR1_PLR1_TT8_8_USFGRO1_VW2_WG16_16_1_WGM1
    SolutionIndex: 25
    SolutionNameMin: Cijk_Alik_Bljk_SB_MT128x128x16_SE_EPS1_FL0_GRVW2_LPA0_LPB0_PGR1_PLR1_TT8_8_USFGRO1_VW4_WG16_16_1_WGM1
    SolutionIndex: 26
    SolutionNameMin: Cijk_Alik_Bljk_SB_MT128x128x16_SE_EPS1_FL0_GRVW2_LPA0_LPB0_PGR1_PLR1_TT8_8_USFGRO1_VW4_WG16_16_1_WGM8
    SolutionIndex: 27
    SolutionNameMin: Cijk_Alik_Bljk_SB_MT128x128x8_SE_EPS1_FL0_GRVW4_LPA0_LPB0_PGR1_PLR1_TT8_8_USFGRO1_VW2_WG16_16_1_WGM1
    SolutionIndex: 28
    SolutionNameMin: Cijk_Alik_Bljk_SB_MT128x128x8_SE_EPS1_FL0_GRVW4_LPA0_LPB0_PGR1_PLR1_TT8_8_USFGRO1_VW2_WG16_16_1_WGM8
    SolutionIndex: 29
    SolutionNameMin: Cijk_Alik_Bljk_SB_MT128x128x16_SE_EPS1_FL0_GRVW4_LPA0_LPB0_PGR1_PLR1_TT8_8_USFGRO1_VW2_WG16_16_1_WGM1
    SolutionIndex: 30
    SolutionNameMin: Cijk_Alik_Bljk_SB_MT128x128x16_SE_EPS1_FL0_GRVW4_LPA0_LPB0_PGR1_PLR1_TT8_8_USFGRO1_VW2_WG16_16_1_WGM8
    SolutionIndex: 31
    SolutionNameMin: Cijk_Alik_Bljk_SB_MT128x128x8_SE_EPS1_FL0_GRVW4_LPA0_LPB0_PGR1_PLR1_TT8_8_USFGRO1_VW4_WG16_16_1_WGM1
    SolutionIndex: 32
    SolutionNameMin: Cijk_Alik_Bljk_SB_MT128x128x8_SE_EPS1_FL0_GRVW4_LPA0_LPB0_PGR1_PLR1_TT8_8_USFGRO1_VW4_WG16_16_1_WGM8
    SolutionIndex: 33
    SolutionNameMin: Cijk_Alik_Bljk_SB_MT128x128x16_SE_EPS1_FL0_GRVW4_LPA0_LPB0_PGR1_PLR1_TT8_8_USFGRO1_VW4_WG16_16_1_WGM1
    SolutionIndex: 34
    SolutionNameMin: Cijk_Alik_Bljk_SB_MT128x128x16_SE_EPS1_FL0_GRVW4_LPA0_LPB0_PGR1_PLR1_TT8_8_USFGRO1_VW4_WG16_16_1_WGM8
    SolutionIndex: 35
    SolutionNameMin: Cijk_Alik_Bljk_SB_MT128x128x8_SE_EPS1_FL1_GRVW2_LPA0_LPB0_PGR1_PLR1_TT8_8_USFGRO1_VW2_WG16_16_1_WGM1
    SolutionIndex: 36
    SolutionNameMin: Cijk_Alik_Bljk_SB_MT128x128x16_SE_EPS1_FL1_GRVW2_LPA0_LPB0_PGR1_PLR1_TT8_8_USFGRO1_VW2_WG16_16_1_WGM1
    SolutionIndex: 37
    SolutionNameMin: Cijk_Alik_Bljk_SB_MT128x128x8_SE_EPS1_FL1_GRVW2_LPA0_LPB0_PGR1_PLR1_TT8_8_USFGRO1_VW4_WG16_16_1_WGM1
    SolutionIndex: 38
    SolutionNameMin: Cijk_Alik_Bljk_SB_MT128x128x16_SE_EPS1_FL1_GRVW2_LPA0_LPB0_PGR1_PLR1_TT8_8_USFGRO1_VW4_WG16_16_1_WGM1
    SolutionIndex: 39
    SolutionNameMin: Cijk_Alik_Bljk_SB_MT128x128x16_SE_EPS1_FL1_GRVW2_LPA0_LPB0_PGR1_PLR1_TT8_8_USFGRO1_VW4_WG16_16_1_WGM8
    SolutionIndex: 40
    SolutionNameMin: Cijk_Alik_Bljk_SB_MT128x128x8_SE_EPS1_FL1_GRVW4_LPA0_LPB0_PGR1_PLR1_TT8_8_USFGRO1_VW2_WG16_16_1_WGM1
    SolutionIndex: 41
    SolutionNameMin: Cijk_Alik_Bljk_SB_MT128x128x8_SE_EPS1_FL1_GRVW4_LPA0_LPB0_PGR1_PLR1_TT8_8_USFGRO1_VW2_WG16_16_1_WGM8
    SolutionIndex: 42
    SolutionNameMin: Cijk_Alik_Bljk_SB_MT128x128x16_SE_EPS1_FL1_GRVW4_LPA0_LPB0_PGR1_PLR1_TT8_8_USFGRO1_VW2_WG16_16_1_WGM1
    SolutionIndex: 43
    SolutionNameMin: Cijk_Alik_Bljk_SB_MT128x128x16_SE_EPS1_FL1_GRVW4_LPA0_LPB0_PGR1_PLR1_TT8_8_USFGRO1_VW2_WG16_16_1_WGM8
    SolutionIndex: 44
    SolutionNameMin: Cijk_Alik_Bljk_SB_MT128x128x8_SE_EPS1_FL1_GRVW4_LPA0_LPB0_PGR1_PLR1_TT8_8_USFGRO1_VW4_WG16_16_1_WGM1
    SolutionIndex: 45
    SolutionNameMin: Cijk_Alik_Bljk_SB_MT128x128x8_SE_EPS1_FL1_GRVW4_LPA0_LPB0_PGR1_PLR1_TT8_8_USFGRO1_VW4_WG16_16_1_WGM8
    SolutionIndex: 46
    SolutionNameMin: Cijk_Alik_Bljk_SB_MT128x128x16_SE_EPS1_FL1_GRVW4_LPA0_LPB0_PGR1_PLR1_TT8_8_USFGRO1_VW4_WG16_16_1_WGM1
    SolutionIndex: 47
    SolutionNameMin: Cijk_Alik_Bljk_SB_MT128x128x16_SE_EPS1_FL1_GRVW4_LPA0_LPB0_PGR1_PLR1_TT8_8_USFGRO1_VW4_WG16_16_1_WGM8
    SolutionIndex: 48
    SolutionNameMin: Cijk_Alik_Bljk_SB_MT64x64x16_SE_EPS0_FL0_GRVW4_LPA2_LPB0_PGR0_PLR1_TT4_4_USFGRO1_VW2_WG16_16_1_WGM1
    SolutionIndex: 49
    SolutionNameMin: Cijk_Alik_Bljk_SB_MT64x64x16_SE_EPS0_FL0_GRVW4_LPA0_LPB2_PGR0_PLR1_TT4_4_USFGRO1_VW2_WG16_16_1_WGM1
    SolutionIndex: 50
    SolutionNameMin: Cijk_Alik_Bljk_SB_MT64x64x8_SE_EPS1_FL1_GRVW4_LPA0_LPB2_PGR1_PLR1_TT4_4_USFGRO1_VW2_WG16_16_1_WGM1
    SolutionIndex: 51
    SolutionNameMin: Cijk_Alik_Bljk_SB_MT64x64x16_SE_EPS0_FL0_GRVW4_LPA2_LPB2_PGR0_PLR0_TT4_4_USFGRO1_VW2_WG16_16_1_WGM1
    SolutionIndex: 52
    SolutionNameMin: Cijk_Alik_Bljk_SB_MT64x64x16_SE_EPS0_FL1_GRVW4_LPA2_LPB2_PGR0_PLR0_TT4_4_USFGRO1_VW2_WG16_16_1_WGM1
    SolutionIndex: 53
    SolutionNameMin: Cijk_Alik_Bljk_SB_MT64x64x16_SE_EPS0_FL0_GRVW1_LPA2_LPB2_PGR0_PLR1_TT4_4_USFGRO1_VW2_WG16_16_1_WGM8
    SolutionIndex: 54
    SolutionNameMin: Cijk_Alik_Bljk_SB_MT64x64x16_SE_EPS0_FL0_GRVW4_LPA2_LPB2_PGR0_PLR1_TT4_4_USFGRO1_VW2_WG16_16_1_WGM1
    SolutionIndex: 55
    SolutionNameMin: Cijk_Alik_Bljk_SB_MT64x64x16_SE_EPS0_FL0_GRVW4_LPA2_LPB2_PGR0_PLR1_TT4_4_USFGRO1_VW2_WG16_16_1_WGM8
    SolutionIndex: 56
    SolutionNameMin: Cijk_Alik_Bljk_SB_MT64x32x32_SE_EPS0_FL0_GRVW2_LPA2_LPB2_PGR0_PLR1_TT4_2_USFGRO1_VW2_WG16_16_1_WGM1
    SolutionIndex: 57
    SolutionNameMin: Cijk_Alik_Bljk_SB_MT64x32x8_SE_EPS1_FL0_GRVW1_LPA2_LPB2_PGR1_PLR1_TT4_2_USFGRO1_VW2_WG16_16_1_WGM1
    SolutionIndex: 58
    SolutionNameMin: Cijk_Alik_Bljk_SB_MT32x64x32_SE_EPS0_FL1_GRVW4_LPA2_LPB2_PGR0_PLR1_TT2_4_USFGRO1_VW2_WG16_16_1_WGM8
    SolutionIndex: 59
    SolutionNameMin: Cijk_Alik_Bljk_SB_MT64x32x16_SE_EPS0_FL0_GRVW4_LPA2_LPB0_PGR0_PLR1_TT4_4_USFGRO1_VW2_WG16_8_1_WGM8
    SolutionIndex: 60
    SolutionNameMin: Cijk_Alik_Bljk_SB_MT64x32x16_SE_EPS0_FL1_GRVW4_LPA4_LPB0_PGR0_PLR1_TT4_4_USFGRO1_VW4_WG16_8_1_WGM8
    SolutionIndex: 61
    SolutionNameMin: Cijk_Alik_Bljk_SB_MT64x32x8_SE_EPS1_FL1_GRVW4_LPA0_LPB2_PGR1_PLR1_TT4_4_USFGRO1_VW2_WG16_8_1_WGM1
    SolutionIndex: 62
    SolutionNameMin: Cijk_Alik_Bljk_SB_MT64x32x16_SE_EPS0_FL0_GRVW4_LPA2_LPB2_PGR0_PLR1_TT4_4_USFGRO1_VW2_WG16_8_1_WGM1
    SolutionIndex: 63
    SolutionNameMin: Cijk_Alik_Bljk_SB_MT64x32x16_SE_EPS0_FL0_GRVW4_LPA4_LPB4_PGR0_PLR1_TT4_4_USFGRO1_VW4_WG16_8_1_WGM1
    SolutionIndex: 64
    SolutionNameMin: Cijk_Alik_Bljk_SB_MT64x32x16_SE_EPS0_FL1_GRVW2_LPA2_LPB2_PGR0_PLR1_TT4_4_USFGRO1_VW2_WG16_8_1_WGM8
    SolutionIndex: 65
    SolutionNameMin: Cijk_Alik_Bljk_SB_MT64x32x16_SE_EPS0_FL1_GRVW4_LPA4_LPB4_PGR0_PLR1_TT4_4_USFGRO1_VW4_WG16_8_1_WGM8
    SolutionIndex: 66
    SolutionNameMin: Cijk_Alik_Bljk_SB_MT64x16x16_SE_EPS1_FL0_GRVW4_LPA0_LPB2_PGR1_PLR1_TT4_2_USFGRO1_VW2_WG16_8_1_WGM1
    SolutionIndex: 67
    SolutionNameMin: Cijk_Alik_Bljk_SB_MT64x16x16_SE_EPS0_FL1_GRVW4_LPA2_LPB2_PGR0_PLR1_TT4_2_USFGRO1_VW2_WG16_8_1_WGM1
    SolutionIndex: 68
    SolutionNameMin: Cijk_Alik_Bljk_SB_MT64x16x16_SE_EPS0_FL1_GRVW4_LPA2_LPB2_PGR0_PLR1_TT4_2_USFGRO1_VW2_WG16_8_1_WGM8
    SolutionIndex: 69
    SolutionNameMin: Cijk_Alik_Bljk_SB_MT32x32x16_SE_EPS0_FL1_GRVW4_LPA2_LPB0_PGR0_PLR1_TT2_4_USFGRO1_VW2_WG16_8_1_WGM8
    SolutionIndex: 70
    SolutionNameMin: Cijk_Alik_Bljk_SB_MT32x32x16_SE_EPS1_FL1_GRVW2_LPA2_LPB2_PGR1_PLR0_TT2_4_USFGRO1_VW2_WG16_8_1_WGM1
    SolutionIndex: 71
    SolutionNameMin: Cijk_Alik_Bljk_SB_MT32x32x16_SE_EPS0_FL0_GRVW1_LPA2_LPB2_PGR0_PLR1_TT2_4_USFGRO1_VW2_WG16_8_1_WGM1
    SolutionIndex: 72
    SolutionNameMin: Cijk_Alik_Bljk_SB_MT32x32x16_SE_EPS0_FL0_GRVW1_LPA2_LPB2_PGR0_PLR1_TT2_4_USFGRO1_VW2_WG16_8_1_WGM8
    SolutionIndex: 73
    SolutionNameMin: Cijk_Alik_Bljk_SB_MT32x32x16_SE_EPS0_FL0_GRVW2_LPA2_LPB2_PGR0_PLR1_TT2_4_USFGRO1_VW2_WG16_8_1_WGM1
    SolutionIndex: 74
    SolutionNameMin: Cijk_Alik_Bljk_SB_MT32x32x32_SE_EPS0_FL0_GRVW2_LPA2_LPB2_PGR0_PLR1_TT2_4_USFGRO1_VW2_WG16_8_1_WGM1
    SolutionIndex: 75
    SolutionNameMin: Cijk_Alik_Bljk_SB_MT32x32x16_SE_EPS0_FL0_GRVW4_LPA2_LPB2_PGR0_PLR1_TT2_4_USFGRO1_VW2_WG16_8_1_WGM1
    SolutionIndex: 76
    SolutionNameMin: Cijk_Alik_Bljk_SB_MT32x32x16_SE_EPS0_FL0_GRVW4_LPA2_LPB2_PGR0_PLR1_TT2_4_USFGRO1_VW2_WG16_8_1_WGM8
    SolutionIndex: 77
    SolutionNameMin: Cijk_Alik_Bljk_SB_MT32x32x32_SE_EPS0_FL0_GRVW4_LPA2_LPB2_PGR0_PLR1_TT2_4_USFGRO1_VW2_WG16_8_1_WGM1
    SolutionIndex: 78
    SolutionNameMin: Cijk_Alik_Bljk_SB_MT32x32x32_SE_EPS0_FL0_GRVW4_LPA2_LPB2_PGR0_PLR1_TT2_4_USFGRO1_VW2_WG16_8_1_WGM8
    SolutionIndex: 79
    SolutionNameMin: Cijk_Alik_Bljk_SB_MT32x32x16_SE_EPS0_FL1_GRVW2_LPA2_LPB2_PGR0_PLR1_TT2_4_USFGRO1_VW2_WG16_8_1_WGM8
    SolutionIndex: 80
    SolutionNameMin: Cijk_Alik_Bljk_SB_MT32x32x32_SE_EPS0_FL1_GRVW2_LPA2_LPB2_PGR0_PLR1_TT2_4_USFGRO1_VW2_WG16_8_1_WGM1
    SolutionIndex: 81
    SolutionNameMin: Cijk_Alik_Bljk_SB_MT32x32x16_SE_EPS0_FL1_GRVW4_LPA2_LPB2_PGR0_PLR1_TT2_4_USFGRO1_VW2_WG16_8_1_WGM1
    SolutionIndex: 82
    SolutionNameMin: Cijk_Alik_Bljk_SB_MT32x32x16_SE_EPS0_FL1_GRVW4_LPA2_LPB2_PGR0_PLR1_TT2_4_USFGRO1_VW2_WG16_8_1_WGM8
    SolutionIndex: 83
    SolutionNameMin: Cijk_Alik_Bljk_SB_MT32x32x32_SE_EPS0_FL1_GRVW4_LPA2_LPB2_PGR0_PLR1_TT2_4_USFGRO1_VW2_WG16_8_1_WGM8
    SolutionIndex: 84
    SolutionNameMin: Cijk_Alik_Bljk_SB_MT32x32x8_SE_EPS1_FL0_GRVW2_LPA2_LPB2_PGR1_PLR1_TT2_4_USFGRO1_VW2_WG16_8_1_WGM1
    SolutionIndex: 85
    SolutionNameMin: Cijk_Alik_Bljk_SB_MT32x32x8_SE_EPS1_FL0_GRVW2_LPA2_LPB2_PGR1_PLR1_TT2_4_USFGRO1_VW2_WG16_8_1_WGM8
    SolutionIndex: 86
    SolutionNameMin: Cijk_Alik_Bljk_SB_MT32x32x8_SE_EPS1_FL1_GRVW2_LPA2_LPB2_PGR1_PLR1_TT2_4_USFGRO1_VW2_WG16_8_1_WGM1
    SolutionIndex: 87
    SolutionNameMin: Cijk_Alik_Bljk_SB_MT32x32x8_SE_EPS1_FL1_GRVW2_LPA2_LPB2_PGR1_PLR1_TT2_4_USFGRO1_VW2_WG16_8_1_WGM8
    SolutionIndex: 88
    SolutionNameMin: Cijk_Alik_Bljk_SB_MT32x32x8_SE_EPS1_FL1_GRVW4_LPA2_LPB2_PGR1_PLR1_TT2_4_USFGRO1_VW2_WG16_8_1_WGM8
    SolutionIndex: 89
    SolutionNameMin: Cijk_Alik_Bljk_SB_MT64x64x16_SE_EPS0_FL1_GRVW4_LPA0_LPB0_PGR0_PLR0_TT4_8_USFGRO1_VW2_WG16_8_1_WGM8
    SolutionIndex: 90
    SolutionNameMin: Cijk_Alik_Bljk_SB_MT64x64x8_SE_EPS1_FL1_GRVW4_LPA0_LPB0_PGR1_PLR1_TT4_8_USFGRO1_VW2_WG16_8_1_WGM1
    SolutionIndex: 91
    SolutionNameMin: Cijk_Alik_Bljk_SB_MT64x64x8_SE_EPS1_FL1_GRVW4_LPA0_LPB2_PGR1_PLR1_TT4_8_USFGRO1_VW2_WG16_8_1_WGM1
    SolutionIndex: 92
    SolutionNameMin: Cijk_Alik_Bljk_SB_MT32x64x8_SE_EPS1_FL1_GRVW4_LPA0_LPB2_PGR1_PLR1_TT4_4_USFGRO1_VW2_WG8_16_1_WGM1
    SolutionIndex: 93
    SolutionNameMin: Cijk_Alik_Bljk_SB_MT32x32x16_SE_EPS0_FL0_GRVW4_LPA2_LPB0_PGR0_PLR1_TT4_2_USFGRO1_VW2_WG8_16_1_WGM1
    SolutionIndex: 94
    SolutionNameMin: Cijk_Alik_Bljk_SB_MT32x32x8_SE_EPS1_FL1_GRVW2_LPA2_LPB0_PGR1_PLR1_TT4_2_USFGRO1_VW2_WG8_16_1_WGM1
    SolutionIndex: 95
    SolutionNameMin: Cijk_Alik_Bljk_SB_MT32x32x8_SE_EPS1_FL0_GRVW2_LPA0_LPB2_PGR1_PLR1_TT4_2_USFGRO1_VW2_WG8_16_1_WGM1
    SolutionIndex: 96
    SolutionNameMin: Cijk_Alik_Bljk_SB_MT32x32x16_SE_EPS1_FL1_GRVW4_LPA0_LPB2_PGR1_PLR1_TT4_2_USFGRO1_VW2_WG8_16_1_WGM1
    SolutionIndex: 97
    SolutionNameMin: Cijk_Alik_Bljk_SB_MT32x32x16_SE_EPS0_FL0_GRVW1_LPA2_LPB2_PGR0_PLR1_TT4_2_USFGRO1_VW2_WG8_16_1_WGM8
    SolutionIndex: 98
    SolutionNameMin: Cijk_Alik_Bljk_SB_MT32x32x16_SE_EPS0_FL0_GRVW2_LPA2_LPB2_PGR0_PLR1_TT4_2_USFGRO1_VW2_WG8_16_1_WGM8
    SolutionIndex: 99
    SolutionNameMin: Cijk_Alik_Bljk_SB_MT32x32x16_SE_EPS0_FL0_GRVW4_LPA2_LPB2_PGR0_PLR1_TT4_2_USFGRO1_VW2_WG8_16_1_WGM1
    SolutionIndex: 100
    SolutionNameMin: Cijk_Alik_Bljk_SB_MT32x32x16_SE_EPS0_FL0_GRVW4_LPA2_LPB2_PGR0_PLR1_TT4_2_USFGRO1_VW2_WG8_16_1_WGM8
    SolutionIndex: 101
    SolutionNameMin: Cijk_Alik_Bljk_SB_MT32x32x16_SE_EPS0_FL1_GRVW2_LPA2_LPB2_PGR0_PLR1_TT4_2_USFGRO1_VW2_WG8_16_1_WGM1
    SolutionIndex: 102
    SolutionNameMin: Cijk_Alik_Bljk_SB_MT32x32x16_SE_EPS0_FL1_GRVW2_LPA2_LPB2_PGR0_PLR1_TT4_2_USFGRO1_VW2_WG8_16_1_WGM8
    SolutionIndex: 103
    SolutionNameMin: Cijk_Alik_Bljk_SB_MT32x32x32_SE_EPS0_FL1_GRVW2_LPA2_LPB2_PGR0_PLR1_TT4_2_USFGRO1_VW2_WG8_16_1_WGM1
    SolutionIndex: 104
    SolutionNameMin: Cijk_Alik_Bljk_SB_MT32x32x32_SE_EPS0_FL1_GRVW2_LPA2_LPB2_PGR0_PLR1_TT4_2_USFGRO1_VW2_WG8_16_1_WGM8
    SolutionIndex: 105
    SolutionNameMin: Cijk_Alik_Bljk_SB_MT32x32x8_SE_EPS1_FL0_GRVW2_LPA2_LPB2_PGR1_PLR1_TT4_2_USFGRO1_VW2_WG8_16_1_WGM8
    SolutionIndex: 106
    SolutionNameMin: Cijk_Alik_Bljk_SB_MT32x32x8_SE_EPS1_FL1_GRVW2_LPA2_LPB2_PGR1_PLR1_TT4_2_USFGRO1_VW2_WG8_16_1_WGM1
    SolutionIndex: 107
    SolutionNameMin: Cijk_Alik_Bljk_SB_MT32x32x8_SE_EPS1_FL1_GRVW4_LPA2_LPB2_PGR1_PLR1_TT4_2_USFGRO1_VW2_WG8_16_1_WGM1
    SolutionIndex: 108
    SolutionNameMin: Cijk_Alik_Bljk_SB_MT32x32x8_SE_EPS1_FL1_GRVW4_LPA2_LPB2_PGR1_PLR1_TT4_2_USFGRO1_VW2_WG8_16_1_WGM8
    SolutionIndex: 109
    SolutionNameMin: Cijk_Alik_Bljk_SB_MT16x64x16_SE_EPS0_FL0_GRVW1_LPA2_LPB2_PGR0_PLR1_TT2_4_USFGRO1_VW2_WG8_16_1_WGM8
- - - [512, 2790, 1, 2048, 512, 512, 2048, 2048]
    - [22, 6378.7]
  - - [512, 2864, 1, 2048, 512, 512, 2048, 2048]
    - [47, 6523.99]
  - - [512, 3092, 1, 2048, 512, 512, 2048, 2048]
    - [10, 6940.83]
  - - [512, 3113, 1, 2048, 512, 512, 2048, 2048]
    - [21, 6919.24]
  - - [512, 3165, 1, 2048, 512, 512, 2048, 2048]
    - [19, 7057.55]
  - - [512, 3166, 1, 2048, 512, 512, 2048, 2048]
    - [14, 7073.02]
  - - [512, 3194, 1, 2048, 512, 512, 2048, 2048]
    - [11, 7107.71]
  - - [512, 3219, 1, 2048, 512, 512, 2048, 2048]
    - [34, 7171.86]
  - - [512, 3222, 1, 2048, 512, 512, 2048, 2048]
    - [46, 7112.06]
  - - [512, 3234, 1, 2048, 512, 512, 2048, 2048]
    - [26, 7194.28]
  - - [512, 3242, 1, 2048, 512, 512, 2048, 2048]
    - [43, 7196.2]
  - - [512, 3246, 1, 2048, 512, 512, 2048, 2048]
    - [10, 7181.97]
  - - [512, 3249, 1, 2048, 512, 512, 2048, 2048]
    - [26, 7145.18]
  - - [512, 3251, 1, 2048, 512, 512, 2048, 2048]
    - [11, 7233.32]
  - - [512, 3257, 1, 2048, 512, 512, 2048, 2048]
    - [11, 7222.15]
  - - [512, 3262, 1, 2048, 512, 512, 2048, 2048]
    - [15, 7199.14]
  - - [512, 3282, 1, 2048, 512, 512, 2048, 2048]
    - [15, 7307.26]
  - - [512, 3286, 1, 2048, 512, 512, 2048, 2048]
    - [22, 7266.79]
  - - [512, 3287, 1, 2048, 512, 512, 2048, 2048]
    - [43, 7265.32]
  - - [512, 3293, 1, 2048, 512, 512, 2048, 2048]
    - [30, 7260.22]
  - - [512, 3297, 1, 2048, 512, 512, 2048, 2048]
    - [22, 7293.58]
  - - [512, 3314, 1, 2048, 512, 512, 2048, 2048]
    - [47, 7365.99]
  - - [512, 3315, 1, 2048, 512, 512, 2048, 2048]
    - [19, 7218.87]
  - - [512, 3319, 1, 2048, 512, 512, 2048, 2048]
    - [22, 7323.7]
  - - [512, 3322, 1, 2048, 512, 512, 2048, 2048]
    - [39, 7237.72]
  - - [512, 3323, 1, 2048, 512, 512, 2048, 2048]
    - [11, 7306.7]
  - - [512, 3324, 1, 2048, 512, 512, 2048, 2048]
    - [19, 7261.39]
  - - [512, 3325, 1, 2048, 512, 512, 2048, 2048]
    - [34, 7293.97]
  - - [512, 3327, 1, 2048, 512, 512, 2048, 2048]
    - [30, 7294.69]
  - - [512, 3329, 1, 2048, 512, 512, 2048, 2048]
    - [15, 7285.67]
  - - [512, 3332, 1, 2048, 512, 512, 2048, 2048]
    - [34, 7346.21]
  - - [512, 3336, 1, 2048, 512, 512, 2048, 2048]
    - [15, 7341.44]
  - - [512, 3339, 1, 2048, 512, 512, 2048, 2048]
    - [47, 7327.13]
  - - [512, 3342, 1, 2048, 512, 512, 2048, 2048]
    - [30, 7365.77]
  - - [512, 3344, 1, 2048, 512, 512, 2048, 2048]
    - [15, 7363.99]
  - - [512, 3358, 1, 2048, 512, 512, 2048, 2048]
    - [34, 7382.42]
  - - [512, 3360, 1, 2048, 512, 512, 2048, 2048]
    - [46, 7362.12]
  - - [512, 3364, 1, 2048, 512, 512, 2048, 2048]
    - [22, 7449.34]
  - - [512, 3365, 1, 2048, 512, 512, 2048, 2048]
    - [14, 7435.22]
  - - [512, 3369, 1, 2048, 512, 512, 2048, 2048]
    - [15, 7444.06]
  - - [512, 3371, 1, 2048, 512, 512, 2048, 2048]
    - [15, 7398.59]
  - - [512, 3374, 1, 2048, 512, 512, 2048, 2048]
    - [15, 7426.32]
  - - [512, 3376, 1, 2048, 512, 512, 2048, 2048]
    - [10, 7287.54]
  - - [512, 3377, 1, 2048, 512, 512, 2048, 2048]
    - [19, 7514.94]
  - - [512, 3378, 1, 2048, 512, 512, 2048, 2048]
    - [14, 7408.99]
  - - [512, 3381, 1, 2048, 512, 512, 2048, 2048]
    - [21, 7446.72]
  - - [512, 3382, 1, 2048, 512, 512, 2048, 2048]
    - [34, 7469.01]
  - - [512, 3383, 1, 2048, 512, 512, 2048, 2048]
    - [29, 7395.21]
  - - [512, 3384, 1, 2048, 512, 512, 2048, 2048]
    - [22, 7444.58]
  - - [512, 3385, 1, 2048, 512, 512, 2048, 2048]
    - [10, 7450.52]
  - - [512, 3386, 1, 2048, 512, 512, 2048, 2048]
    - [15, 7476.58]
  - - [512, 3388, 1, 2048, 512, 512, 2048, 2048]
    - [46, 7454.62]
  - - [512, 3390, 1, 2048, 512, 512, 2048, 2048]
    - [22, 7552.85]
  - - [512, 3391, 1, 2048, 512, 512, 2048, 2048]
    - [46, 7431.28]
  - - [512, 3399, 1, 2048, 512, 512, 2048, 2048]
    - [22, 7525.57]
  - - [512, 3402, 1, 2048, 512, 512, 2048, 2048]
    - [29, 7396.03]
  - - [512, 3412, 1, 2048, 512, 512, 2048, 2048]
    - [22, 7516.26]
  - - [512, 3414, 1, 2048, 512, 512, 2048, 2048]
    - [30, 7439.4]
  - - [512, 3415, 1, 2048, 512, 512, 2048, 2048]
    - [34, 7408.32]
  - - [512, 3420, 1, 2048, 512, 512, 2048, 2048]
    - [19, 7494.84]
  - - [512, 3422, 1, 2048, 512, 512, 2048, 2048]
    - [11, 7487.95]
  - - [512, 3425, 1, 2048, 512, 512, 2048, 2048]
    - [15, 7475.8]
  - - [512, 3426, 1, 2048, 512, 512, 2048, 2048]
    - [15, 7553.45]
  - - [512, 3427, 1, 2048, 512, 512, 2048, 2048]
    - [43, 7495.14]
  - - [512, 3428, 1, 2048, 512, 512, 2048, 2048]
    - [47, 7528.73]
  - - [512, 3430, 1, 2048, 512, 512, 2048, 2048]
    - [22, 7497.95]
  - - [512, 3431, 1, 2048, 512, 512, 2048, 2048]
    - [33, 7501.38]
  - - [512, 3432, 1, 2048, 512, 512, 2048, 2048]
    - [30, 7430.44]
  - - [512, 3438, 1, 2048, 512, 512, 2048, 2048]
    - [30, 7544.38]
  - - [512, 3439, 1, 2048, 512, 512, 2048, 2048]
    - [43, 7475.23]
  - - [512, 3440, 1, 2048, 512, 512, 2048, 2048]
    - [34, 7519.81]
  - - [512, 3445, 1, 2048, 512, 512, 2048, 2048]
    - [11, 7477.12]
  - - [512, 3448, 1, 2048, 512, 512, 2048, 2048]
    - [11, 7473.73]
  - - [512, 3450, 1, 2048, 512, 512, 2048, 2048]
    - [19, 7466.95]
  - - [512, 3451, 1, 2048, 512, 512, 2048, 2048]
    - [33, 7569.11]
  - - [512, 3453, 1, 2048, 512, 512, 2048, 2048]
    - [22, 7504.42]
  - - [512, 3455, 1, 2048, 512, 512, 2048, 2048]
    - [43, 7476.54]
  - - [512, 3456, 1, 2048, 512, 512, 2048, 2048]
    - [19, 7455.31]
  - - [512, 3458, 1, 2048, 512, 512, 2048, 2048]
    - [43, 7561.68]
  - - [512, 3459, 1, 2048, 512, 512, 2048, 2048]
    - [15, 7528.7]
  - - [512, 3460, 1, 2048, 512, 512, 2048, 2048]
    - [14, 7491.07]
  - - [512, 3462, 1, 2048, 512, 512, 2048, 2048]
    - [33, 7564.12]
  - - [512, 3468, 1, 2048, 512, 512, 2048, 2048]
    - [21, 7573.44]
  - - [512, 3470, 1, 2048, 512, 512, 2048, 2048]
    - [14, 7640.18]
  - - [512, 3471, 1, 2048, 512, 512, 2048, 2048]
    - [47, 7610.42]
  - - [512, 3472, 1, 2048, 512, 512, 2048, 2048]
    - [22, 7616.44]
  - - [512, 3475, 1, 2048, 512, 512, 2048, 2048]
    - [15, 7511.13]
  - - [512, 3476, 1, 2048, 512, 512, 2048, 2048]
    - [15, 7575.77]
  - - [512, 3477, 1, 2048, 512, 512, 2048, 2048]
    - [46, 7614.66]
  - - [512, 3478, 1, 2048, 512, 512, 2048, 2048]
    - [22, 7623.22]
  - - [512, 3480, 1, 2048, 512, 512, 2048, 2048]
    - [21, 7609.79]
  - - [512, 3487, 1, 2048, 512, 512, 2048, 2048]
    - [18, 7573.29]
  - - [512, 3489, 1, 2048, 512, 512, 2048, 2048]
    - [19, 7578.89]
  - - [512, 3490, 1, 2048, 512, 512, 2048, 2048]
    - [47, 7582.32]
  - - [512, 3491, 1, 2048, 512, 512, 2048, 2048]
    - [10, 7635.11]
  - - [512, 3493, 1, 2048, 512, 512, 2048, 2048]
    - [42, 7553.78]
  - - [512, 3494, 1, 2048, 512, 512, 2048, 2048]
    - [19, 7637.85]
  - - [512, 3495, 1, 2048, 512, 512, 2048, 2048]
    - [14, 7607.05]
  - - [512, 3497, 1, 2048, 512, 512, 2048, 2048]
    - [22, 7622.8]
  - - [512, 3498, 1, 2048, 512, 512, 2048, 2048]
    - [21, 7660.65]
  - - [512, 3499, 1, 2048, 512, 512, 2048, 2048]
    - [22, 7648.78]
  - - [512, 3501, 1, 2048, 512, 512, 2048, 2048]
    - [21, 7583.6]
  - - [512, 3503, 1, 2048, 512, 512, 2048, 2048]
    - [11, 7638.42]
  - - [512, 3508, 1, 2048, 512, 512, 2048, 2048]
    - [22, 7600.01]
  - - [512, 3509, 1, 2048, 512, 512, 2048, 2048]
    - [46, 7624.86]
  - - [512, 3511, 1, 2048, 512, 512, 2048, 2048]
    - [34, 7707.15]
  - - [512, 3514, 1, 2048, 512, 512, 2048, 2048]
    - [14, 7679.01]
  - - [512, 3515, 1, 2048, 512, 512, 2048, 2048]
    - [22, 7575.11]
  - - [512, 3517, 1, 2048, 512, 512, 2048, 2048]
    - [10, 7661.3]
  - - [512, 3518, 1, 2048, 512, 512, 2048, 2048]
    - [15, 7699.3]
  - - [512, 3519, 1, 2048, 512, 512, 2048, 2048]
    - [22, 7666.93]
  - - [512, 3523, 1, 2048, 512, 512, 2048, 2048]
    - [30, 7666.72]
  - - [512, 3529, 1, 2048, 512, 512, 2048, 2048]
    - [30, 7759.66]
  - - [512, 3530, 1, 2048, 512, 512, 2048, 2048]
    - [46, 7702.42]
  - - [512, 3532, 1, 2048, 512, 512, 2048, 2048]
    - [22, 7805.54]
  - - [512, 3533, 1, 2048, 512, 512, 2048, 2048]
    - [19, 7670.65]
  - - [512, 3534, 1, 2048, 512, 512, 2048, 2048]
    - [15, 7674.1]
  - - [512, 3538, 1, 2048, 512, 512, 2048, 2048]
    - [47, 7677.69]
  - - [512, 3539, 1, 2048, 512, 512, 2048, 2048]
    - [33, 7660.84]
  - - [512, 3547, 1, 2048, 512, 512, 2048, 2048]
    - [22, 7661.71]
  - - [512, 3548, 1, 2048, 512, 512, 2048, 2048]
    - [22, 7716.0]
  - - [512, 3552, 1, 2048, 512, 512, 2048, 2048]
    - [15, 7609.8]
  - - [512, 3564, 1, 2048, 512, 512, 2048, 2048]
    - [22, 7604.44]
  - - [512, 3575, 1, 2048, 512, 512, 2048, 2048]
    - [19, 7718.37]
  - - [512, 3598, 1, 2048, 512, 512, 2048, 2048]
    - [11, 7822.14]
  - - [512, 3608, 1, 2048, 512, 512, 2048, 2048]
    - [18, 7677.07]
  - - [512, 3780, 1, 2048, 512, 512, 2048, 2048]
    - [14, 7975.73]
  - - [512, 3822, 1, 2048, 512, 512, 2048, 2048]
    - [34, 8015.31]
  - - [512, 3840, 1, 2048, 512, 512, 2048, 2048]
    - [19, 8174.71]
  - - [512, 3859, 1, 2048, 512, 512, 2048, 2048]
    - [15, 8220.49]
  - - [512, 3870, 1, 2048, 512, 512, 2048, 2048]
    - [22, 8299.23]
  - - [512, 3876, 1, 2048, 512, 512, 2048, 2048]
    - [14, 8088.44]
  - - [512, 3906, 1, 512, 512, 512, 512, 512]
    - [38, 8487.52]
  - - [512, 3906, 1, 2048, 512, 512, 2048, 2048]
    - [22, 8368.21]
  - - [512, 3910, 1, 512, 512, 512, 512, 512]
    - [35, 8547.22]
  - - [512, 3910, 1, 2048, 512, 512, 2048, 2048]
    - [22, 8220.92]
  - - [512, 3925, 1, 512, 512, 512, 512, 512]
    - [32, 8707.81]
  - - [512, 3925, 1, 2048, 512, 512, 2048, 2048]
    - [34, 8267.04]
  - - [512, 3927, 1, 512, 512, 512, 512, 512]
    - [41, 8718.15]
  - - [512, 3942, 1, 512, 512, 512, 512, 512]
    - [21, 8605.69]
  - - [512, 3942, 1, 2048, 512, 512, 2048, 2048]
    - [15, 8370.09]
  - - [512, 3944, 1, 512, 512, 512, 512, 512]
    - [42, 8587.18]
  - - [512, 3944, 1, 2048, 512, 512, 2048, 2048]
    - [22, 8356.74]
  - - [512, 3955, 1, 512, 512, 512, 512, 512]
    - [32, 8738.87]
  - - [512, 3955, 1, 2048, 512, 512, 2048, 2048]
    - [15, 8343.64]
  - - [512, 3968, 1, 512, 512, 512, 512, 512]
    - [45, 8797.25]
  - - [512, 3968, 1, 2048, 512, 512, 2048, 2048]
    - [22, 8285.7]
  - - [512, 3969, 1, 512, 512, 512, 512, 512]
    - [17, 8763.89]
  - - [512, 3969, 1, 2048, 512, 512, 2048, 2048]
    - [18, 8147.61]
  - - [512, 3976, 1, 512, 512, 512, 512, 512]
    - [44, 8714.75]
  - - [512, 3976, 1, 2048, 512, 512, 2048, 2048]
    - [14, 8268.16]
  - - [512, 3977, 1, 512, 512, 512, 512, 512]
    - [31, 8757.95]
  - - [512, 3977, 1, 2048, 512, 512, 2048, 2048]
    - [14, 8175.55]
  - - [512, 3978, 1, 512, 512, 512, 512, 512]
    - [44, 8783.77]
  - - [512, 3978, 1, 2048, 512, 512, 2048, 2048]
    - [10, 8390.81]
  - - [512, 3990, 1, 512, 512, 512, 512, 512]
    - [32, 8810.26]
  - - [512, 3990, 1, 2048, 512, 512, 2048, 2048]
    - [33, 8284.13]
  - - [512, 3995, 1, 512, 512, 512, 512, 512]
    - [31, 8797.59]
  - - [512, 3995, 1, 2048, 512, 512, 2048, 2048]
    - [21, 8219.0]
  - - [512, 3996, 1, 512, 512, 512, 512, 512]
    - [31, 8787.98]
  - - [512, 3996, 1, 2048, 512, 512, 2048, 2048]
    - [33, 8308.43]
  - - [512, 3999, 1, 512, 512, 512, 512, 512]
    - [12, 8824.19]
  - - [512, 3999, 1, 2048, 512, 512, 2048, 2048]
    - [14, 8266.16]
  - - [512, 4005, 1, 512, 512, 512, 512, 512]
    - [9, 8784.19]
  - - [512, 4005, 1, 2048, 512, 512, 2048, 2048]
    - [46, 8332.43]
  - - [512, 4012, 1, 512, 512, 512, 512, 512]
    - [44, 8925.0]
  - - [512, 4012, 1, 2048, 512, 512, 2048, 2048]
    - [29, 8372.25]
  - - [512, 4020, 1, 512, 512, 512, 512, 512]
    - [20, 8870.53]
  - - [512, 4020, 1, 2048, 512, 512, 2048, 2048]
    - [10, 8339.81]
  - - [512, 4026, 1, 512, 512, 512, 512, 512]
    - [12, 8848.02]
  - - [512, 4026, 1, 2048, 512, 512, 2048, 2048]
    - [33, 8381.45]
  - - [512, 4030, 1, 512, 512, 512, 512, 512]
    - [27, 8868.71]
  - - [512, 4030, 1, 2048, 512, 512, 2048, 2048]
    - [21, 8372.49]
  - - [512, 4032, 1, 2048, 512, 512, 2048, 2048]
    - [21, 8325.19]
  - - [512, 4050, 1, 512, 512, 512, 512, 512]
    - [12, 8900.76]
  - - [512, 4059, 1, 512, 512, 512, 512, 512]
    - [27, 8914.57]
  - - [2048, 2864, 1, 512, 2048, 2048, 512, 512]
    - [35, 8931.48]
  - - [2048, 3092, 1, 512, 2048, 2048, 512, 512]
    - [5, 8349.29]
  - - [2048, 3113, 1, 512, 2048, 2048, 512, 512]
    - [7, 8381.82]
  - - [2048, 3137, 1, 512, 2048, 2048, 512, 512]
    - [5, 8477.79]
  - - [2048, 3165, 1, 512, 2048, 2048, 512, 512]
    - [5, 8528.84]
  - - [2048, 3194, 1, 512, 2048, 2048, 512, 512]
    - [7, 8582.29]
  - - [2048, 3219, 1, 512, 2048, 2048, 512, 512]
    - [7, 8669.01]
  - - [2048, 3234, 1, 512, 2048, 2048, 512, 512]
    - [7, 8704.04]
  - - [2048, 3237, 1, 512, 2048, 2048, 512, 512]
    - [7, 8712.12]
  - - [2048, 3242, 1, 512, 2048, 2048, 512, 512]
    - [7, 8686.33]
  - - [2048, 3246, 1, 512, 2048, 2048, 512, 512]
    - [5, 8723.8]
  - - [2048, 3249, 1, 512, 2048, 2048, 512, 512]
    - [5, 8724.71]
  - - [2048, 3251, 1, 512, 2048, 2048, 512, 512]
    - [5, 8717.58]
  - - [2048, 3257, 1, 512, 2048, 2048, 512, 512]
    - [5, 8739.03]
  - - [2048, 3268, 1, 512, 2048, 2048, 512, 512]
    - [7, 8804.59]
  - - [2048, 3282, 1, 512, 2048, 2048, 512, 512]
    - [7, 8824.17]
  - - [2048, 3286, 1, 512, 2048, 2048, 512, 512]
    - [7, 8822.26]
  - - [2048, 3287, 1, 512, 2048, 2048, 512, 512]
    - [7, 8841.24]
  - - [2048, 3293, 1, 512, 2048, 2048, 512, 512]
    - [5, 8821.17]
  - - [2048, 3297, 1, 512, 2048, 2048, 512, 512]
    - [7, 8844.54]
  - - [2048, 3307, 1, 512, 2048, 2048, 512, 512]
    - [5, 8865.93]
  - - [2048, 3314, 1, 512, 2048, 2048, 512, 512]
    - [5, 8871.99]
  - - [2048, 3315, 1, 512, 2048, 2048, 512, 512]
    - [5, 8878.29]
  - - [2048, 3319, 1, 512, 2048, 2048, 512, 512]
    - [5, 8883.56]
  - - [2048, 3323, 1, 512, 2048, 2048, 512, 512]
    - [5, 8896.08]
  - - [2048, 3324, 1, 512, 2048, 2048, 512, 512]
    - [5, 8893.31]
  - - [2048, 3327, 1, 512, 2048, 2048, 512, 512]
    - [7, 8894.08]
  - - [2048, 3329, 1, 512, 2048, 2048, 512, 512]
    - [4, 8515.59]
  - - [2048, 3332, 1, 512, 2048, 2048, 512, 512]
    - [7, 8472.01]
  - - [2048, 3336, 1, 512, 2048, 2048, 512, 512]
    - [7, 8477.24]
  - - [2048, 3339, 1, 512, 2048, 2048, 512, 512]
    - [5, 8478.29]
  - - [2048, 3342, 1, 512, 2048, 2048, 512, 512]
    - [7, 8500.73]
  - - [2048, 3344, 1, 512, 2048, 2048, 512, 512]
    - [5, 8499.22]
  - - [2048, 3358, 1, 512, 2048, 2048, 512, 512]
    - [36, 8524.88]
  - - [2048, 3360, 1, 512, 2048, 2048, 512, 512]
    - [36, 8525.01]
  - - [2048, 3364, 1, 512, 2048, 2048, 512, 512]
    - [24, 8546.74]
  - - [2048, 3365, 1, 512, 2048, 2048, 512, 512]
    - [36, 8552.59]
  - - [2048, 3369, 1, 512, 2048, 2048, 512, 512]
    - [36, 8546.19]
  - - [2048, 3374, 1, 512, 2048, 2048, 512, 512]
    - [24, 8550.6]
  - - [2048, 3377, 1, 512, 2048, 2048, 512, 512]
    - [36, 8566.48]
  - - [2048, 3378, 1, 512, 2048, 2048, 512, 512]
    - [36, 8555.77]
  - - [2048, 3381, 1, 512, 2048, 2048, 512, 512]
    - [36, 8584.94]
  - - [2048, 3382, 1, 512, 2048, 2048, 512, 512]
    - [36, 8570.87]
  - - [2048, 3383, 1, 512, 2048, 2048, 512, 512]
    - [36, 8566.78]
  - - [2048, 3384, 1, 512, 2048, 2048, 512, 512]
    - [36, 8570.97]
  - - [2048, 3385, 1, 512, 2048, 2048, 512, 512]
    - [38, 8735.55]
  - - [2048, 3386, 1, 512, 2048, 2048, 512, 512]
    - [36, 8595.97]
  - - [2048, 3388, 1, 512, 2048, 2048, 512, 512]
    - [36, 8587.74]
  - - [2048, 3391, 1, 512, 2048, 2048, 512, 512]
    - [24, 8580.41]
  - - [2048, 3396, 1, 512, 2048, 2048, 512, 512]
    - [5, 8626.37]
  - - [2048, 3399, 1, 512, 2048, 2048, 512, 512]
    - [7, 8639.01]
  - - [2048, 3402, 1, 512, 2048, 2048, 512, 512]
    - [5, 8633.24]
  - - [2048, 3410, 1, 512, 2048, 2048, 512, 512]
    - [7, 8638.49]
  - - [2048, 3412, 1, 512, 2048, 2048, 512, 512]
    - [38, 8729.61]
  - - [2048, 3414, 1, 512, 2048, 2048, 512, 512]
    - [24, 8653.64]
  - - [2048, 3415, 1, 512, 2048, 2048, 512, 512]
    - [5, 8644.47]
  - - [2048, 3418, 1, 512, 2048, 2048, 512, 512]
    - [24, 8652.07]
  - - [2048, 3420, 1, 512, 2048, 2048, 512, 512]
    - [24, 8675.56]
  - - [2048, 3422, 1, 512, 2048, 2048, 512, 512]
    - [25, 8770.6]
  - - [2048, 3425, 1, 512, 2048, 2048, 512, 512]
    - [25, 8771.43]
  - - [2048, 3426, 1, 512, 2048, 2048, 512, 512]
    - [36, 8668.97]
  - - [2048, 3427, 1, 512, 2048, 2048, 512, 512]
    - [36, 8696.68]
  - - [2048, 3428, 1, 512, 2048, 2048, 512, 512]
    - [24, 8684.09]
  - - [2048, 3430, 1, 512, 2048, 2048, 512, 512]
    - [36, 8687.48]
  - - [2048, 3431, 1, 512, 2048, 2048, 512, 512]
    - [42, 8750.89]
  - - [2048, 3432, 1, 512, 2048, 2048, 512, 512]
    - [5, 8680.8]
  - - [2048, 3438, 1, 512, 2048, 2048, 512, 512]
    - [5, 8692.62]
  - - [2048, 3439, 1, 512, 2048, 2048, 512, 512]
    - [36, 8711.96]
  - - [2048, 3440, 1, 512, 2048, 2048, 512, 512]
    - [25, 8785.81]
  - - [2048, 3443, 1, 512, 2048, 2048, 512, 512]
    - [24, 8720.4]
  - - [2048, 3445, 1, 512, 2048, 2048, 512, 512]
    - [36, 8720.41]
  - - [2048, 3447, 1, 512, 2048, 2048, 512, 512]
    - [5, 8717.06]
  - - [2048, 3448, 1, 512, 2048, 2048, 512, 512]
    - [5, 8704.47]
  - - [2048, 3450, 1, 512, 2048, 2048, 512, 512]
    - [36, 8717.92]
  - - [2048, 3451, 1, 512, 2048, 2048, 512, 512]
    - [36, 8737.29]
  - - [2048, 3453, 1, 512, 2048, 2048, 512, 512]
    - [36, 8730.55]
  - - [2048, 3455, 1, 512, 2048, 2048, 512, 512]
    - [5, 8710.4]
  - - [2048, 3456, 1, 512, 2048, 2048, 512, 512]
    - [24, 8809.51]
  - - [2048, 3457, 1, 512, 2048, 2048, 512, 512]
    - [5, 8767.72]
  - - [2048, 3458, 1, 512, 2048, 2048, 512, 512]
    - [5, 8775.35]
  - - [2048, 3459, 1, 512, 2048, 2048, 512, 512]
    - [7, 8774.49]
  - - [2048, 3460, 1, 512, 2048, 2048, 512, 512]
    - [5, 8773.63]
  - - [2048, 3461, 1, 512, 2048, 2048, 512, 512]
    - [5, 8781.27]
  - - [2048, 3462, 1, 512, 2048, 2048, 512, 512]
    - [7, 8766.83]
  - - [2048, 3466, 1, 512, 2048, 2048, 512, 512]
    - [5, 8776.96]
  - - [2048, 3467, 1, 512, 2048, 2048, 512, 512]
    - [5, 8772.71]
  - - [2048, 3468, 1, 512, 2048, 2048, 512, 512]
    - [36, 8771.86]
  - - [2048, 3470, 1, 512, 2048, 2048, 512, 512]
    - [7, 8782.0]
  - - [2048, 3471, 1, 512, 2048, 2048, 512, 512]
    - [5, 8784.53]
  - - [2048, 3472, 1, 512, 2048, 2048, 512, 512]
    - [7, 8780.28]
  - - [2048, 3475, 1, 512, 2048, 2048, 512, 512]
    - [7, 8792.96]
  - - [2048, 3476, 1, 512, 2048, 2048, 512, 512]
    - [5, 8803.99]
  - - [2048, 3477, 1, 512, 2048, 2048, 512, 512]
    - [5, 8813.33]
  - - [2048, 3478, 1, 512, 2048, 2048, 512, 512]
    - [36, 8802.25]
  - - [2048, 3479, 1, 512, 2048, 2048, 512, 512]
    - [7, 8797.98]
  - - [2048, 3480, 1, 512, 2048, 2048, 512, 512]
    - [7, 8805.61]
  - - [2048, 3481, 1, 512, 2048, 2048, 512, 512]
    - [5, 8826.88]
  - - [2048, 3484, 1, 512, 2048, 2048, 512, 512]
    - [5, 8820.84]
  - - [2048, 3491, 1, 512, 2048, 2048, 512, 512]
    - [36, 8833.44]
  - - [2048, 3493, 1, 512, 2048, 2048, 512, 512]
    - [36, 8838.5]
  - - [2048, 3494, 1, 512, 2048, 2048, 512, 512]
    - [7, 8844.45]
  - - [2048, 3495, 1, 512, 2048, 2048, 512, 512]
    - [7, 8838.45]
  - - [2048, 3497, 1, 512, 2048, 2048, 512, 512]
    - [36, 8852.04]
  - - [2048, 3498, 1, 512, 2048, 2048, 512, 512]
    - [24, 8852.86]
  - - [2048, 3499, 1, 512, 2048, 2048, 512, 512]
    - [7, 8831.52]
  - - [2048, 3501, 1, 512, 2048, 2048, 512, 512]
    - [36, 8874.17]
  - - [2048, 3503, 1, 512, 2048, 2048, 512, 512]
    - [36, 8855.26]
  - - [2048, 3507, 1, 512, 2048, 2048, 512, 512]
    - [7, 8850.01]
  - - [2048, 3508, 1, 512, 2048, 2048, 512, 512]
    - [36, 8871.32]
  - - [2048, 3509, 1, 512, 2048, 2048, 512, 512]
    - [7, 8844.84]
  - - [2048, 3511, 1, 512, 2048, 2048, 512, 512]
    - [36, 8899.51]
  - - [2048, 3514, 1, 512, 2048, 2048, 512, 512]
    - [36, 8879.64]
  - - [2048, 3515, 1, 512, 2048, 2048, 512, 512]
    - [36, 8918.27]
  - - [2048, 3517, 1, 512, 2048, 2048, 512, 512]
    - [36, 8911.27]
  - - [2048, 3518, 1, 512, 2048, 2048, 512, 512]
    - [36, 8898.33]
  - - [2048, 3519, 1, 512, 2048, 2048, 512, 512]
    - [36, 8885.42]
  - - [2048, 3520, 1, 512, 2048, 2048, 512, 512]
    - [5, 8939.61]
  - - [2048, 3523, 1, 512, 2048, 2048, 512, 512]
    - [7, 8916.14]
  - - [2048, 3528, 1, 512, 2048, 2048, 512, 512]
    - [5, 8939.15]
  - - [2048, 3529, 1, 512, 2048, 2048, 512, 512]
    - [5, 8933.05]
  - - [2048, 3530, 1, 512, 2048, 2048, 512, 512]
    - [5, 8937.3]
  - - [2048, 3532, 1, 512, 2048, 2048, 512, 512]
    - [36, 8937.19]
  - - [2048, 3533, 1, 512, 2048, 2048, 512, 512]
    - [36, 8934.54]
  - - [2048, 3534, 1, 512, 2048, 2048, 512, 512]
    - [36, 8937.07]
  - - [2048, 3538, 1, 512, 2048, 2048, 512, 512]
    - [5, 8942.01]
  - - [2048, 3539, 1, 512, 2048, 2048, 512, 512]
    - [36, 8984.38]
  - - [2048, 3541, 1, 512, 2048, 2048, 512, 512]
    - [36, 8980.77]
  - - [2048, 3547, 1, 512, 2048, 2048, 512, 512]
    - [5, 8961.3]
  - - [2048, 3548, 1, 512, 2048, 2048, 512, 512]
    - [36, 8981.14]
  - - [2048, 3552, 1, 512, 2048, 2048, 512, 512]
    - [36, 8986.06]
  - - [2048, 3564, 1, 512, 2048, 2048, 512, 512]
    - [24, 8995.58]
  - - [2048, 3575, 1, 512, 2048, 2048, 512, 512]
    - [36, 9023.35]
  - - [2048, 3598, 1, 512, 2048, 2048, 512, 512]
    - [44, 8546.52]
  - - [2048, 3599, 1, 512, 2048, 2048, 512, 512]
    - [44, 8539.61]
  - - [2048, 3608, 1, 512, 2048, 2048, 512, 512]
    - [27, 8567.17]
  - - [2048, 3780, 1, 512, 2048, 2048, 512, 512]
    - [27, 8919.03]
  - - [2048, 3796, 1, 512, 2048, 2048, 512, 512]
    - [27, 8966.47]
  - - [2048, 3822, 1, 512, 2048, 2048, 512, 512]
    - [17, 9006.78]
  - - [2048, 3840, 1, 512, 2048, 2048, 512, 512]
    - [44, 9096.63]
  - - [2048, 3859, 1, 512, 2048, 2048, 512, 512]
    - [31, 9092.34]
  - - [2048, 3870, 1, 512, 2048, 2048, 512, 512]
    - [31, 9119.9]
  - - [2048, 3876, 1, 512, 2048, 2048, 512, 512]
    - [31, 9145.55]
  - - [2048, 3906, 1, 512, 2048, 2048, 512, 512]
    - [40, 9194.81]
  - - [2048, 3910, 1, 512, 2048, 2048, 512, 512]
    - [40, 9205.88]
  - - [2048, 3925, 1, 512, 2048, 2048, 512, 512]
    - [17, 9231.25]
  - - [2048, 3942, 1, 512, 2048, 2048, 512, 512]
    - [35, 9282.89]
  - - [2048, 3944, 1, 512, 2048, 2048, 512, 512]
    - [40, 9289.27]
  - - [2048, 3955, 1, 512, 2048, 2048, 512, 512]
    - [27, 9303.48]
  - - [2048, 3968, 1, 512, 2048, 2048, 512, 512]
    - [27, 9362.62]
  - - [2048, 3969, 1, 512, 2048, 2048, 512, 512]
    - [31, 9343.12]
  - - [2048, 3976, 1, 512, 2048, 2048, 512, 512]
    - [17, 9351.2]
  - - [2048, 3977, 1, 512, 2048, 2048, 512, 512]
    - [27, 9355.23]
  - - [2048, 3978, 1, 512, 2048, 2048, 512, 512]
    - [31, 9364.3]
  - - [2048, 3990, 1, 512, 2048, 2048, 512, 512]
    - [31, 9395.93]
  - - [2048, 3995, 1, 512, 2048, 2048, 512, 512]
    - [44, 9394.2]
  - - [2048, 3996, 1, 512, 2048, 2048, 512, 512]
    - [31, 9398.24]
  - - [2048, 3999, 1, 512, 2048, 2048, 512, 512]
    - [9, 9393.49]
  - - [2048, 4005, 1, 512, 2048, 2048, 512, 512]
    - [27, 9405.9]
  - - [2048, 4012, 1, 512, 2048, 2048, 512, 512]
    - [31, 9408.85]
  - - [2048, 4020, 1, 512, 2048, 2048, 512, 512]
    - [35, 9439.44]
  - - [2048, 4026, 1, 512, 2048, 2048, 512, 512]
    - [35, 9467.1]
  - - [2048, 4030, 1, 512, 2048, 2048, 512, 512]
    - [16, 9449.38]
  - - [2048, 4032, 1, 512, 2048, 2048, 512, 512]
    - [23, 9452.38]
  - - [33708, 184, 1, 512, 33708, 33708, 512, 512]
    - [3, 8179.38]
  - - [33708, 189, 1, 512, 33708, 33708, 512, 512]
    - [8, 8223.72]
  - - [33708, 208, 1, 512, 33708, 33708, 512, 512]
    - [6, 7231.6]
  - - [33708, 246, 1, 512, 33708, 33708, 512, 512]
    - [5, 8218.97]
  - - [33708, 264, 1, 512, 33708, 33708, 512, 512]
    - [1, 7712.0]
  - - [33708, 465, 1, 512, 33708, 33708, 512, 512]
    - [28, 8406.52]
  - - [33708, 468, 1, 512, 33708, 33708, 512, 512]
    - [2, 8458.63]
  - - [33708, 493, 1, 512, 33708, 33708, 512, 512]
    - [30, 8826.92]
  - - [33708, 540, 1, 512, 33708, 33708, 512, 512]
    - [4, 8535.05]
  - - [33708, 560, 1, 512, 33708, 33708, 512, 512]
    - [4, 8758.76]
  - - [33708, 644, 1, 512, 33708, 33708, 512, 512]
    - [4, 8456.96]
  - - [33708, 714, 1, 512, 33708, 33708, 512, 512]
    - [43, 8828.07]
  - - [33708, 720, 1, 512, 33708, 33708, 512, 512]
    - [30, 8909.41]
  - - [33708, 781, 1, 512, 33708, 33708, 512, 512]
    - [3, 8727.59]
  - - [33708, 936, 1, 512, 33708, 33708, 512, 512]
    - [8, 9024.16]
  - - [33708, 980, 1, 512, 33708, 33708, 512, 512]
    - [36, 9211.66]
  - - [33708, 1232, 1, 512, 33708, 33708, 512, 512]
    - [38, 9367.72]
  - - [33708, 1290, 1, 512, 33708, 33708, 512, 512]
    - [37, 9003.93]
  - - [33708, 1350, 1, 512, 33708, 33708, 512, 512]
    - [38, 9379.62]
  - - [33708, 1424, 1, 512, 33708, 33708, 512, 512]
    - [38, 9157.35]
  - - [33708, 1458, 1, 512, 33708, 33708, 512, 512]
    - [38, 9333.98]
  - - [33708, 1462, 1, 512, 33708, 33708, 512, 512]
    - [38, 9354.31]
  - - [33708, 1615, 1, 512, 33708, 33708, 512, 512]
    - [38, 9576.86]
  - - [33708, 1680, 1, 512, 33708, 33708, 512, 512]
    - [38, 9296.62]
  - - [33708, 1917, 1, 512, 33708, 33708, 512, 512]
    - [38, 9878.35]
  - - [33708, 2205, 1, 512, 33708, 33708, 512, 512]
    - [25, 9475.47]
  - - [33708, 2418, 1, 512, 33708, 33708, 512, 512]
    - [46, 9840.94]
  - - [33708, 2496, 1, 512, 33708, 33708, 512, 512]
    - [38, 9692.65]
  - - [33708, 3776, 1, 512, 33708, 33708, 512, 512]
    - [33, 9850.91]
  - - [33708, 3780, 1, 512, 33708, 33708, 512, 512]
    - [46, 9879.87]
  - - [33708, 3796, 1, 512, 33708, 33708, 512, 512]
    - [33, 9937.94]
  - - [33708, 3822, 1, 512, 33708, 33708, 512, 512]
    - [46, 9986.86]
  - - [33708, 3835, 1, 512, 33708, 33708, 512, 512]
    - [46, 10001.2]
  - - [33708, 3840, 1, 512, 33708, 33708, 512, 512]
    - [46, 10060.9]
  - - [33708, 3859, 1, 512, 33708, 33708, 512, 512]
    - [33, 9782.47]
  - - [33708, 3864, 1, 512, 33708, 33708, 512, 512]
    - [46, 9790.31]
  - - [33708, 3870, 1, 512, 33708, 33708, 512, 512]
    - [33, 9797.8]
  - - [33708, 3876, 1, 512, 33708, 33708, 512, 512]
    - [46, 9827.99]
  - - [33708, 3910, 1, 512, 33708, 33708, 512, 512]
    - [46, 9911.05]
  - - [33708, 3925, 1, 512, 33708, 33708, 512, 512]
    - [46, 9917.84]
  - - [33708, 3942, 1, 512, 33708, 33708, 512, 512]
    - [33, 9965.12]
  - - [33708, 3944, 1, 512, 33708, 33708, 512, 512]
    - [33, 9962.58]
  - - [33708, 3955, 1, 512, 33708, 33708, 512, 512]
    - [46, 10006.3]
  - - [33708, 3968, 1, 512, 33708, 33708, 512, 512]
    - [46, 10071.6]
  - - [33708, 3969, 1, 512, 33708, 33708, 512, 512]
    - [33, 9750.59]
  - - [33708, 3976, 1, 512, 33708, 33708, 512, 512]
    - [33, 9792.76]
  - - [33708, 3977, 1, 512, 33708, 33708, 512, 512]
    - [33, 9779.59]
  - - [33708, 3978, 1, 512, 33708, 33708, 512, 512]
    - [33, 9797.24]
  - - [33708, 3990, 1, 512, 33708, 33708, 512, 512]
    - [46, 9807.98]
  - - [33708, 3995, 1, 512, 33708, 33708, 512, 512]
    - [33, 9810.77]
  - - [33708, 3996, 1, 512, 33708, 33708, 512, 512]
    - [33, 9823.74]
  - - [33708, 3999, 1, 512, 33708, 33708, 512, 512]
    - [46, 9826.52]
  - - [33708, 4005, 1, 512, 33708, 33708, 512, 512]
    - [46, 9860.02]
  - - [33708, 4012, 1, 512, 33708, 33708, 512, 512]
    - [46, 9841.54]
  - - [33708, 4020, 1, 512, 33708, 33708, 512, 512]
    - [46, 9872.5]
  - - [33708, 4026, 1, 512, 33708, 33708, 512, 512]
    - [46, 9892.53]
  - - [33708, 4030, 1, 512, 33708, 33708, 512, 512]
    - [33, 9896.38]
  - - [7, 7, 736, 64, 7, 7, 64, 64]
    - [108, 134.192]
  - - [8, 8, 264, 64, 8, 8, 64, 64]
    - [70, 84.48]
  - - [9, 9, 416, 64, 9, 9, 64, 64]
    - [85, 144.929]
  - - [10, 10, 448, 64, 10, 10, 64, 64]
    - [105, 193.73]
  - - [11, 11, 568, 64, 11, 11, 64, 64]
    - [106, 269.522]
  - - [12, 12, 480, 64, 12, 12, 64, 64]
    - [86, 283.569]
  - - [12, 12, 2520, 64, 12, 12, 64, 64]
    - [100, 621.636]
  - - [13, 13, 576, 64, 13, 13, 64, 64]
    - [88, 376.209]
  - - [13, 13, 2336, 64, 13, 13, 64, 64]
    - [75, 712.928]
  - - [14, 14, 704, 64, 14, 14, 64, 64]
    - [71, 486.287]
  - - [14, 14, 2184, 64, 14, 14, 64, 64]
    - [99, 801.993]
  - - [15, 15, 688, 64, 15, 15, 64, 64]
    - [99, 547.965]
  - - [15, 15, 2048, 64, 15, 15, 64, 64]
    - [72, 903.529]
  - - [16, 16, 712, 64, 16, 16, 64, 64]
    - [68, 639.551]
  - - [16, 16, 1920, 64, 16, 16, 64, 64]
    - [102, 1005.67]
  - - [17, 17, 688, 64, 17, 17, 64, 64]
    - [100, 710.114]
  - - [17, 17, 1816, 64, 17, 17, 64, 64]
    - [100, 1113.68]
  - - [18, 18, 648, 64, 18, 18, 64, 64]
    - [84, 746.496]
  - - [18, 18, 1720, 64, 18, 18, 64, 64]
    - [97, 1231.56]
  - - [19, 19, 680, 64, 19, 19, 64, 64]
    - [76, 839.248]
  - - [19, 19, 1632, 64, 19, 19, 64, 64]
    - [72, 1327.67]
  - - [21, 21, 1472, 64, 21, 21, 64, 64]
    - [100, 1742.69]
  - - [21, 21, 1488, 64, 21, 21, 64, 64]
    - [71, 1785.6]
  - - [23, 23, 64, 64, 23, 23, 64, 64]
    - [60, 237.586]
  - - [23, 23, 1360, 64, 23, 23, 64, 64]
    - [78, 1658.65]
  - - [25, 25, 176, 64, 25, 25, 64, 64]
    - [104, 578.947]
  - - [25, 25, 1256, 64, 25, 25, 64, 64]
    - [83, 1825.58]
  - - [26, 26, 56, 64, 26, 26, 64, 64]
    - [69, 325.643]
  - - [26, 27, 56, 64, 26, 26, 64, 64]
    - [107, 223.047]
  - - [27, 27, 56, 64, 27, 27, 64, 64]
    - [57, 233.28]
  - - [27, 27, 1168, 64, 27, 27, 64, 64]
    - [74, 1991.75]
  - - [29, 29, 136, 64, 29, 29, 64, 64]
    - [95, 635.422]
  - - [29, 29, 1088, 64, 29, 29, 64, 64]
    - [103, 2134.13]
  - - [32, 32, 624, 64, 32, 32, 64, 64]
    - [99, 2112.32]
  - - [32, 32, 992, 64, 32, 32, 64, 64]
    - [74, 2563.55]
  - - [35, 35, 384, 64, 35, 35, 64, 64]
    - [90, 1306.67]
  - - [35, 35, 904, 64, 35, 35, 64, 64]
    - [55, 1768.3]
  - - [38, 38, 320, 64, 38, 38, 64, 64]
    - [50, 1384.51]
  - - [38, 38, 840, 64, 38, 38, 64, 64]
    - [53, 1996.64]
  - - [41, 41, 312, 64, 41, 41, 64, 64]
    - [109, 1525.74]
  - - [41, 41, 776, 64, 41, 41, 64, 64]
    - [54, 2210.94]
  - - [45, 45, 392, 64, 45, 45, 64, 64]
    - [67, 2003.28]
  - - [45, 45, 712, 64, 45, 45, 64, 64]
    - [51, 2502.04]
  - - [49, 49, 648, 64, 49, 49, 64, 64]
    - [55, 2741.58]
  - - [54, 54, 200, 64, 54, 54, 64, 64]
    - [100, 1927.93]
  - - [59, 59, 544, 64, 59, 59, 64, 64]
    - [56, 3359.05]
  - - [64, 65, 496, 64, 64, 64, 64, 64]
    - [59, 3410.51]
  - - [65, 65, 472, 64, 65, 65, 64, 64]
    - [76, 2285.62]
  - - [65, 65, 496, 64, 65, 65, 64, 64]
    - [98, 2321.99]
  - - [70, 70, 216, 64, 70, 70, 64, 64]
    - [100, 2187.91]
  - - [70, 71, 216, 64, 70, 70, 64, 64]
    - [76, 2230.69]
  - - [71, 71, 216, 64, 71, 71, 64, 64]
    - [73, 2239.29]
  - - [71, 71, 448, 64, 71, 71, 64, 64]
    - [79, 2692.54]
  - - [77, 77, 248, 64, 77, 77, 64, 64]
    - [99, 2748.4]
  - - [77, 77, 408, 64, 77, 77, 64, 64]
    - [71, 3126.37]
  - - [77, 78, 248, 64, 77, 77, 64, 64]
    - [76, 2790.61]
  - - [77, 78, 408, 64, 77, 77, 64, 64]
    - [75, 3161.87]
  - - [78, 78, 248, 64, 78, 78, 64, 64]
    - [100, 2840.15]
  - - [78, 78, 408, 64, 78, 78, 64, 64]
    - [101, 3172.23]
  - - [80, 80, 152, 64, 80, 80, 64, 64]
    - [75, 2502.38]
  - - [80, 84, 152, 64, 80, 80, 64, 64]
    - [72, 2594.13]
  - - [84, 84, 152, 64, 84, 84, 64, 64]
    - [99, 2767.77]
  - - [85, 85, 376, 64, 85, 85, 64, 64]
    - [82, 3702.35]
  - - [91, 91, 40, 64, 91, 91, 64, 64]
    - [84, 1488.72]
  - - [91, 93, 40, 64, 91, 91, 64, 64]
    - [77, 2184.0]
  - - [93, 93, 40, 64, 93, 93, 64, 64]
    - [101, 1581.53]
  - - [93, 93, 344, 64, 93, 93, 64, 64]
    - [81, 4190.5]
  - - [102, 102, 56, 64, 102, 102, 64, 64]
    - [64, 2000.43]
  - - [102, 102, 312, 64, 102, 102, 64, 64]
    - [51, 4013.66]
  - - [103, 103, 16, 64, 103, 103, 64, 64]
    - [66, 887.55]
  - - [103, 104, 16, 64, 103, 103, 64, 64]
    - [87, 896.167]
  - - [112, 112, 16, 64, 112, 112, 64, 64]
    - [94, 1225.67]
  - - [112, 112, 288, 64, 112, 112, 64, 64]
    - [52, 4646.52]
  - - [112, 123, 16, 64, 112, 112, 64, 64]
    - [80, 1160.08]
  - - [119, 119, 32, 64, 119, 119, 64, 64]
    - [91, 1918.1]
  - - [119, 135, 32, 64, 119, 119, 64, 64]
    - [61, 2046.09]
  - - [122, 122, 264, 64, 122, 122, 64, 64]
    - [48, 5029.6]
  - - [123, 122, 264, 64, 123, 123, 64, 64]
    - [49, 4751.53]
  - - [123, 123, 16, 64, 123, 123, 64, 64]
    - [93, 1729.03]
  - - [123, 123, 264, 64, 123, 123, 64, 64]
    - [0, 5008.22]
  - - [135, 134, 240, 64, 135, 135, 64, 64]
    - [62, 3825.2]
  - - [135, 135, 240, 64, 135, 135, 64, 64]
    - [63, 3836.84]
- null
