Tensile/Configs/miopen/archives/bert/2019-11-05/exact/vega20_Cijk_Ailk_Bjlk_SB.yaml
- {MinimumRequiredVersion: 4.13.0}
- vega20
- gfx906
- [Device 66a0, Device 66a1, Device 66a7, Vega 20]
    SolutionIndex: 0
    SolutionNameMin: Cijk_Ailk_Bjlk_SB_MT64x64x8_SE_DTL0_EPS1_FL0_GRVW4_PGR1_PLR0_TT4_4_USFGRO0_VW2_WG16_16_1_WGM1
    SolutionIndex: 1
    SolutionNameMin: Cijk_Ailk_Bjlk_SB_MT64x64x8_SE_DTL0_EPS1_FL1_GRVW2_PGR1_PLR0_TT4_4_USFGRO0_VW2_WG16_16_1_WGM1
    SolutionIndex: 2
    SolutionNameMin: Cijk_Ailk_Bjlk_SB_MT64x64x8_SE_DTL0_EPS1_FL1_GRVW4_PGR1_PLR0_TT4_4_USFGRO0_VW2_WG16_16_1_WGM1
    SolutionIndex: 3
    SolutionNameMin: Cijk_Ailk_Bjlk_SB_MT64x64x32_SE_DTL0_EPS0_FL0_GRVW4_PGR0_PLR1_TT4_4_USFGRO0_VW4_WG16_16_1_WGM1
    SolutionIndex: 4
    SolutionNameMin: Cijk_Ailk_Bjlk_SB_MT64x128x8_SE_DTL0_EPS1_FL0_GRVW2_PGR1_PLR1_TT4_8_USFGRO0_VW2_WG16_16_1_WGM8
    SolutionIndex: 5
    SolutionNameMin: Cijk_Ailk_Bjlk_SB_MT64x128x8_SE_DTL0_EPS1_FL1_GRVW2_PGR1_PLR1_TT4_8_USFGRO0_VW2_WG16_16_1_WGM8
    SolutionIndex: 6
    SolutionNameMin: Cijk_Ailk_Bjlk_SB_MT128x64x8_SE_DTL0_EPS1_FL0_GRVW2_PGR1_PLR1_TT8_4_USFGRO0_VW2_WG16_16_1_WGM1
    SolutionIndex: 7
    SolutionNameMin: Cijk_Ailk_Bjlk_SB_MT128x64x8_SE_DTL0_EPS1_FL0_GRVW2_PGR1_PLR1_TT8_4_USFGRO0_VW2_WG16_16_1_WGM8
    SolutionIndex: 8
    SolutionNameMin: Cijk_Ailk_Bjlk_SB_MT128x64x8_SE_DTL0_EPS1_FL1_GRVW2_PGR1_PLR1_TT8_4_USFGRO0_VW2_WG16_16_1_WGM1
    SolutionIndex: 9
    SolutionNameMin: Cijk_Ailk_Bjlk_SB_MT128x64x8_SE_DTL0_EPS1_FL1_GRVW2_PGR1_PLR1_TT8_4_USFGRO0_VW2_WG16_16_1_WGM8
    SolutionIndex: 10
    SolutionNameMin: Cijk_Ailk_Bjlk_SB_MT64x32x32_SE_DTL0_EPS0_FL1_GRVW2_PGR0_PLR1_TT4_2_USFGRO0_VW2_WG16_16_1_WGM8
    SolutionIndex: 11
    SolutionNameMin: Cijk_Ailk_Bjlk_SB_MT32x64x32_SE_DTL0_EPS1_FL0_GRVW4_PGR1_PLR1_TT4_4_USFGRO0_VW4_WG8_16_2_WGM1
    SolutionIndex: 12
    SolutionNameMin: Cijk_Ailk_Bjlk_SB_MT32x64x32_SE_DTL0_EPS1_FL1_GRVW4_PGR1_PLR1_TT4_4_USFGRO0_VW4_WG8_16_2_WGM1
    SolutionIndex: 13
    SolutionNameMin: Cijk_Ailk_Bjlk_SB_MT64x32x32_SE_DTL0_EPS1_FL0_GRVW4_PGR1_PLR1_TT4_4_USFGRO0_VW4_WG16_8_2_WGM1
    SolutionIndex: 14
    SolutionNameMin: Cijk_Ailk_Bjlk_SB_MT64x32x32_SE_DTL0_EPS1_FL0_GRVW4_PGR1_PLR1_TT4_4_USFGRO0_VW4_WG16_8_2_WGM8
    SolutionIndex: 15
    SolutionNameMin: Cijk_Ailk_Bjlk_SB_MT64x32x32_SE_DTL0_EPS1_FL1_GRVW4_PGR1_PLR1_TT4_4_USFGRO0_VW4_WG16_8_2_WGM1
    SolutionIndex: 16
    SolutionNameMin: Cijk_Ailk_Bjlk_SB_MT64x32x32_SE_DTL0_EPS1_FL1_GRVW4_PGR1_PLR1_TT4_4_USFGRO0_VW4_WG16_8_2_WGM8
    SolutionIndex: 17
    SolutionNameMin: Cijk_Ailk_Bjlk_SB_MT64x32x8_SE_DTL0_EPS0_FL0_GRVW1_PGR0_PLR0_TT4_4_USFGRO1_VW2_WG16_8_1_WGM1
    SolutionIndex: 18
    SolutionNameMin: Cijk_Ailk_Bjlk_SB_MT64x32x8_SE_DTL0_EPS0_FL0_GRVW1_PGR0_PLR1_TT4_4_USFGRO1_VW2_WG16_8_1_WGM1
    SolutionIndex: 19
    SolutionNameMin: Cijk_Ailk_Bjlk_SB_MT64x32x8_SE_DTL0_EPS0_FL0_GRVW1_PGR0_PLR1_TT4_4_USFGRO1_VW2_WG16_8_1_WGM8
    SolutionIndex: 20
    SolutionNameMin: Cijk_Ailk_Bjlk_SB_MT64x32x8_SE_DTL0_EPS0_FL0_GRVW1_PGR0_PLR1_TT4_4_USFGRO1_VW4_WG16_8_1_WGM1
    SolutionIndex: 21
    SolutionNameMin: Cijk_Ailk_Bjlk_SB_MT64x32x8_SE_DTL0_EPS1_FL0_GRVW1_PGR1_PLR1_TT4_4_USFGRO1_VW2_WG16_8_1_WGM1
    SolutionIndex: 22
    SolutionNameMin: Cijk_Ailk_Bjlk_SB_MT64x32x8_SE_DTL0_EPS1_FL0_GRVW1_PGR1_PLR1_TT4_4_USFGRO1_VW4_WG16_8_1_WGM1
    SolutionIndex: 23
    SolutionNameMin: Cijk_Ailk_Bjlk_SB_MT64x32x8_SE_DTL0_EPS1_FL1_GRVW2_PGR1_PLR1_TT4_4_USFGRO0_VW2_WG16_8_1_WGM1
    SolutionIndex: 24
    SolutionNameMin: Cijk_Ailk_Bjlk_SB_MT64x32x8_SE_DTL0_EPS1_FL1_GRVW2_PGR1_PLR1_TT4_4_USFGRO0_VW2_WG16_8_1_WGM8
    SolutionIndex: 25
    SolutionNameMin: Cijk_Ailk_Bjlk_SB_MT64x16x8_SE_DTL0_EPS0_FL0_GRVW1_PGR0_PLR0_TT4_2_USFGRO1_VW2_WG16_8_1_WGM1
    SolutionIndex: 26
    SolutionNameMin: Cijk_Ailk_Bjlk_SB_MT64x16x16_SE_DTL0_EPS0_FL1_GRVW2_PGR0_PLR0_TT4_2_USFGRO0_VW2_WG16_8_1_WGM1
    SolutionIndex: 27
    SolutionNameMin: Cijk_Ailk_Bjlk_SB_MT64x16x16_SE_DTL0_EPS0_FL1_GRVW2_PGR0_PLR0_TT4_2_USFGRO0_VW2_WG16_8_1_WGM8
    SolutionIndex: 28
    SolutionNameMin: Cijk_Ailk_Bjlk_SB_MT64x16x8_SE_DTL0_EPS0_FL0_GRVW1_PGR0_PLR1_TT4_2_USFGRO1_VW2_WG16_8_1_WGM1
    SolutionIndex: 29
    SolutionNameMin: Cijk_Ailk_Bjlk_SB_MT64x16x8_SE_DTL0_EPS0_FL0_GRVW1_PGR0_PLR1_TT4_2_USFGRO1_VW2_WG16_8_1_WGM8
    SolutionIndex: 30
    SolutionNameMin: Cijk_Ailk_Bjlk_SB_MT64x16x16_SE_DTL0_EPS0_FL0_GRVW1_PGR0_PLR1_TT4_2_USFGRO1_VW2_WG16_8_1_WGM1
    SolutionIndex: 31
    SolutionNameMin: Cijk_Ailk_Bjlk_SB_MT64x16x16_SE_DTL0_EPS0_FL1_GRVW2_PGR0_PLR1_TT4_2_USFGRO0_VW2_WG16_8_1_WGM1
    SolutionIndex: 32
    SolutionNameMin: Cijk_Ailk_Bjlk_SB_MT64x64x8_SE_DTL0_EPS1_FL0_GRVW4_PGR1_PLR0_TT4_8_USFGRO0_VW4_WG16_8_1_WGM1
- - - [512, 2048, 1, 2864, 512, 512, 512, 2048]
    - [4, 9959.94]
  - - [512, 2048, 1, 3092, 512, 512, 512, 2048]
    - [6, 9960.05]
  - - [512, 2048, 1, 3113, 512, 512, 512, 2048]
    - [4, 9976.21]
  - - [512, 2048, 1, 3137, 512, 512, 512, 2048]
    - [6, 9979.92]
  - - [512, 2048, 1, 3165, 512, 512, 512, 2048]
    - [6, 9972.18]
  - - [512, 2048, 1, 3166, 512, 512, 512, 2048]
    - [6, 9980.13]
  - - [512, 2048, 1, 3194, 512, 512, 512, 2048]
    - [6, 9962.97]
  - - [512, 2048, 1, 3219, 512, 512, 512, 2048]
    - [8, 9974.49]
  - - [512, 2048, 1, 3222, 512, 512, 512, 2048]
    - [4, 9967.29]
  - - [512, 2048, 1, 3234, 512, 512, 512, 2048]
    - [6, 9964.43]
  - - [512, 2048, 1, 3237, 512, 512, 512, 2048]
    - [9, 9964.3]
  - - [512, 2048, 1, 3242, 512, 512, 512, 2048]
    - [6, 9984.38]
  - - [512, 2048, 1, 3246, 512, 512, 512, 2048]
    - [5, 9973.27]
  - - [512, 2048, 1, 3249, 512, 512, 512, 2048]
    - [6, 9982.49]
  - - [512, 2048, 1, 3251, 512, 512, 512, 2048]
    - [8, 9983.95]
  - - [512, 2048, 1, 3257, 512, 512, 512, 2048]
    - [6, 9976.67]
  - - [512, 2048, 1, 3262, 512, 512, 512, 2048]
    - [7, 9959.4]
  - - [512, 2048, 1, 3268, 512, 512, 512, 2048]
    - [9, 9968.43]
  - - [512, 2048, 1, 3282, 512, 512, 512, 2048]
    - [8, 9983.25]
  - - [512, 2048, 1, 3286, 512, 512, 512, 2048]
    - [8, 9967.66]
  - - [512, 2048, 1, 3287, 512, 512, 512, 2048]
    - [7, 9966.08]
  - - [512, 2048, 1, 3293, 512, 512, 512, 2048]
    - [6, 9970.43]
  - - [512, 2048, 1, 3297, 512, 512, 512, 2048]
    - [8, 9989.47]
  - - [512, 2048, 1, 3307, 512, 512, 512, 2048]
    - [8, 9973.66]
  - - [512, 2048, 1, 3314, 512, 512, 512, 2048]
    - [6, 9983.28]
  - - [512, 2048, 1, 3315, 512, 512, 512, 2048]
    - [6, 9979.41]
  - - [512, 2048, 1, 3319, 512, 512, 512, 2048]
    - [6, 9975.42]
  - - [512, 2048, 1, 3322, 512, 512, 512, 2048]
    - [4, 9982.15]
  - - [512, 2048, 1, 3324, 512, 512, 512, 2048]
    - [6, 9995.03]
  - - [512, 2048, 1, 3325, 512, 512, 512, 2048]
    - [6, 9970.59]
  - - [512, 2048, 1, 3327, 512, 512, 512, 2048]
    - [6, 9976.59]
  - - [512, 2048, 1, 3329, 512, 512, 512, 2048]
    - [6, 9984.87]
  - - [512, 2048, 1, 3332, 512, 512, 512, 2048]
    - [8, 9980.16]
  - - [512, 2048, 1, 3336, 512, 512, 512, 2048]
    - [8, 9992.14]
  - - [512, 2048, 1, 3339, 512, 512, 512, 2048]
    - [8, 9976.05]
  - - [512, 2048, 1, 3342, 512, 512, 512, 2048]
    - [5, 9969.11]
  - - [512, 2048, 1, 3344, 512, 512, 512, 2048]
    - [8, 10000.1]
  - - [512, 2048, 1, 3358, 512, 512, 512, 2048]
    - [4, 9969.19]
  - - [512, 2048, 1, 3360, 512, 512, 512, 2048]
    - [8, 10002.3]
  - - [512, 2048, 1, 3364, 512, 512, 512, 2048]
    - [8, 9989.27]
  - - [512, 2048, 1, 3365, 512, 512, 512, 2048]
    - [6, 9980.93]
  - - [512, 2048, 1, 3369, 512, 512, 512, 2048]
    - [4, 9999.58]
  - - [512, 2048, 1, 3371, 512, 512, 512, 2048]
    - [6, 9978.4]
  - - [512, 2048, 1, 3374, 512, 512, 512, 2048]
    - [4, 9969.27]
  - - [512, 2048, 1, 3376, 512, 512, 512, 2048]
    - [6, 9999.98]
  - - [512, 2048, 1, 3377, 512, 512, 512, 2048]
    - [8, 9978.14]
  - - [512, 2048, 1, 3378, 512, 512, 512, 2048]
    - [6, 9994.61]
  - - [512, 2048, 1, 3381, 512, 512, 512, 2048]
    - [6, 9998.97]
  - - [512, 2048, 1, 3382, 512, 512, 512, 2048]
    - [6, 9983.91]
  - - [512, 2048, 1, 3383, 512, 512, 512, 2048]
    - [5, 9964.42]
  - - [512, 2048, 1, 3384, 512, 512, 512, 2048]
    - [8, 9974.09]
  - - [512, 2048, 1, 3385, 512, 512, 512, 2048]
    - [8, 9983.77]
  - - [512, 2048, 1, 3386, 512, 512, 512, 2048]
    - [6, 9988.97]
  - - [512, 2048, 1, 3388, 512, 512, 512, 2048]
    - [6, 9976.9]
  - - [512, 2048, 1, 3390, 512, 512, 512, 2048]
    - [5, 9987.28]
  - - [512, 2048, 1, 3391, 512, 512, 512, 2048]
    - [8, 9954.43]
  - - [512, 2048, 1, 3396, 512, 512, 512, 2048]
    - [7, 9995.97]
  - - [512, 2048, 1, 3399, 512, 512, 512, 2048]
    - [8, 9982.38]
  - - [512, 2048, 1, 3402, 512, 512, 512, 2048]
    - [6, 9986.72]
  - - [512, 2048, 1, 3410, 512, 512, 512, 2048]
    - [6, 9983.37]
  - - [512, 2048, 1, 3412, 512, 512, 512, 2048]
    - [8, 9998.16]
  - - [512, 2048, 1, 3414, 512, 512, 512, 2048]
    - [8, 9990.62]
  - - [512, 2048, 1, 3415, 512, 512, 512, 2048]
    - [8, 9980.18]
  - - [512, 2048, 1, 3418, 512, 512, 512, 2048]
    - [6, 9986.72]
  - - [512, 2048, 1, 3420, 512, 512, 512, 2048]
    - [6, 9988.11]
  - - [512, 2048, 1, 3422, 512, 512, 512, 2048]
    - [6, 9989.5]
  - - [512, 2048, 1, 3425, 512, 512, 512, 2048]
    - [6, 9996.03]
  - - [512, 2048, 1, 3426, 512, 512, 512, 2048]
    - [5, 9987.83]
  - - [512, 2048, 1, 3427, 512, 512, 512, 2048]
    - [4, 9995.19]
  - - [512, 2048, 1, 3428, 512, 512, 512, 2048]
    - [6, 9991.44]
  - - [512, 2048, 1, 3430, 512, 512, 512, 2048]
    - [6, 9988.38]
  - - [512, 2048, 1, 3431, 512, 512, 512, 2048]
    - [8, 9991.29]
  - - [512, 2048, 1, 3432, 512, 512, 512, 2048]
    - [6, 10007.5]
  - - [512, 2048, 1, 3438, 512, 512, 512, 2048]
    - [6, 9976.21]
  - - [512, 2048, 1, 3439, 512, 512, 512, 2048]
    - [4, 9985.75]
  - - [512, 2048, 1, 3440, 512, 512, 512, 2048]
    - [6, 10015.3]
  - - [512, 2048, 1, 3443, 512, 512, 512, 2048]
    - [8, 9981.88]
  - - [512, 2048, 1, 3445, 512, 512, 512, 2048]
    - [8, 9976.65]
  - - [512, 2048, 1, 3447, 512, 512, 512, 2048]
    - [8, 9980.23]
  - - [512, 2048, 1, 3448, 512, 512, 512, 2048]
    - [8, 10007.4]
  - - [512, 2048, 1, 3450, 512, 512, 512, 2048]
    - [8, 9982.3]
  - - [512, 2048, 1, 3451, 512, 512, 512, 2048]
    - [6, 9996.23]
  - - [512, 2048, 1, 3452, 512, 512, 512, 2048]
    - [6, 9985.89]
  - - [512, 2048, 1, 3453, 512, 512, 512, 2048]
    - [6, 9988.78]
  - - [512, 2048, 1, 3455, 512, 512, 512, 2048]
    - [6, 9990.16]
  - - [512, 2048, 1, 3456, 512, 512, 512, 2048]
    - [5, 9993.05]
  - - [512, 2048, 1, 3457, 512, 512, 512, 2048]
    - [4, 9987.13]
  - - [512, 2048, 1, 3458, 512, 512, 512, 2048]
    - [6, 10001.0]
  - - [512, 2048, 1, 3460, 512, 512, 512, 2048]
    - [8, 10002.4]
  - - [512, 2048, 1, 3461, 512, 512, 512, 2048]
    - [4, 9983.28]
  - - [512, 2048, 1, 3462, 512, 512, 512, 2048]
    - [8, 9997.16]
  - - [512, 2048, 1, 3466, 512, 512, 512, 2048]
    - [8, 9993.3]
  - - [512, 2048, 1, 3467, 512, 512, 512, 2048]
    - [6, 9993.99]
  - - [512, 2048, 1, 3468, 512, 512, 512, 2048]
    - [4, 9992.48]
  - - [512, 2048, 1, 3470, 512, 512, 512, 2048]
    - [8, 9993.84]
  - - [512, 2048, 1, 3471, 512, 512, 512, 2048]
    - [8, 9992.33]
  - - [512, 2048, 1, 3472, 512, 512, 512, 2048]
    - [5, 10001.8]
  - - [512, 2048, 1, 3475, 512, 512, 512, 2048]
    - [7, 9988.49]
  - - [512, 2048, 1, 3476, 512, 512, 512, 2048]
    - [6, 9989.18]
  - - [512, 2048, 1, 3478, 512, 512, 512, 2048]
    - [6, 9979.61]
  - - [512, 2048, 1, 3479, 512, 512, 512, 2048]
    - [8, 9969.38]
  - - [512, 2048, 1, 3480, 512, 512, 512, 2048]
    - [8, 10005.1]
  - - [512, 2048, 1, 3481, 512, 512, 512, 2048]
    - [8, 9996.97]
  - - [512, 2048, 1, 3484, 512, 512, 512, 2048]
    - [8, 9985.89]
  - - [512, 2048, 1, 3487, 512, 512, 512, 2048]
    - [7, 9979.22]
  - - [512, 2048, 1, 3489, 512, 512, 512, 2048]
    - [8, 9991.48]
  - - [512, 2048, 1, 3490, 512, 512, 512, 2048]
    - [8, 9994.35]
  - - [512, 2048, 1, 3491, 512, 512, 512, 2048]
    - [6, 9997.21]
  - - [512, 2048, 1, 3493, 512, 512, 512, 2048]
    - [5, 9992.02]
  - - [512, 2048, 1, 3494, 512, 512, 512, 2048]
    - [8, 9977.46]
  - - [512, 2048, 1, 3495, 512, 512, 512, 2048]
    - [6, 9993.38]
  - - [512, 2048, 1, 3497, 512, 512, 512, 2048]
    - [6, 9996.92]
  - - [512, 2048, 1, 3498, 512, 512, 512, 2048]
    - [6, 9982.36]
  - - [512, 2048, 1, 3499, 512, 512, 512, 2048]
    - [4, 9991.74]
  - - [512, 2048, 1, 3501, 512, 512, 512, 2048]
    - [4, 9990.92]
  - - [512, 2048, 1, 3503, 512, 512, 512, 2048]
    - [7, 9979.25]
  - - [512, 2048, 1, 3507, 512, 512, 512, 2048]
    - [8, 10001.5]
  - - [512, 2048, 1, 3508, 512, 512, 512, 2048]
    - [6, 9986.98]
  - - [512, 2048, 1, 3509, 512, 512, 512, 2048]
    - [8, 9998.51]
  - - [512, 2048, 1, 3511, 512, 512, 512, 2048]
    - [4, 9986.84]
  - - [512, 2048, 1, 3514, 512, 512, 512, 2048]
    - [6, 9999.72]
  - - [512, 2048, 1, 3515, 512, 512, 512, 2048]
    - [8, 10002.6]
  - - [512, 2048, 1, 3518, 512, 512, 512, 2048]
    - [6, 9993.74]
  - - [512, 2048, 1, 3519, 512, 512, 512, 2048]
    - [6, 9983.6]
  - - [512, 2048, 1, 3523, 512, 512, 512, 2048]
    - [6, 9997.11]
  - - [512, 2048, 1, 3528, 512, 512, 512, 2048]
    - [4, 10035.2]
  - - [512, 2048, 1, 3529, 512, 512, 512, 2048]
    - [6, 9994.66]
  - - [512, 2048, 1, 3530, 512, 512, 512, 2048]
    - [8, 10010.5]
  - - [512, 2048, 1, 3532, 512, 512, 512, 2048]
    - [5, 10003.2]
  - - [512, 2048, 1, 3533, 512, 512, 512, 2048]
    - [8, 10001.7]
  - - [512, 2048, 1, 3534, 512, 512, 512, 2048]
    - [8, 10011.0]
  - - [512, 2048, 1, 3538, 512, 512, 512, 2048]
    - [6, 10013.7]
  - - [512, 2048, 1, 3539, 512, 512, 512, 2048]
    - [8, 10012.2]
  - - [512, 2048, 1, 3541, 512, 512, 512, 2048]
    - [4, 9983.35]
  - - [512, 2048, 1, 3547, 512, 512, 512, 2048]
    - [6, 9993.82]
  - - [512, 2048, 1, 3598, 512, 512, 512, 2048]
    - [5, 10012.7]
  - - [512, 2048, 1, 3599, 512, 512, 512, 2048]
    - [8, 9987.89]
  - - [512, 2048, 1, 3780, 512, 512, 512, 2048]
    - [6, 10005.1]
  - - [512, 2048, 1, 3796, 512, 512, 512, 2048]
    - [8, 10027.2]
  - - [512, 2048, 1, 3822, 512, 512, 512, 2048]
    - [6, 10035.2]
  - - [512, 2048, 1, 3840, 512, 512, 512, 2048]
    - [8, 10036.2]
  - - [512, 2048, 1, 3859, 512, 512, 512, 2048]
    - [6, 10021.9]
  - - [512, 2048, 1, 3870, 512, 512, 512, 2048]
    - [5, 10014.8]
  - - [512, 2048, 1, 3876, 512, 512, 512, 2048]
    - [6, 10022.4]
  - - [512, 2048, 1, 3906, 512, 512, 512, 2048]
    - [8, 10022.9]
  - - [512, 2048, 1, 3910, 512, 512, 512, 2048]
    - [6, 10017.4]
  - - [512, 2048, 1, 3925, 512, 512, 512, 2048]
    - [5, 10022.6]
  - - [512, 2048, 1, 3942, 512, 512, 512, 2048]
    - [8, 10021.1]
  - - [512, 2048, 1, 3944, 512, 512, 512, 2048]
    - [8, 10047.6]
  - - [512, 2048, 1, 3955, 512, 512, 512, 2048]
    - [5, 10017.2]
  - - [512, 2048, 1, 3968, 512, 512, 512, 2048]
    - [6, 10042.4]
  - - [512, 2048, 1, 3969, 512, 512, 512, 2048]
    - [8, 10017.8]
  - - [512, 2048, 1, 3976, 512, 512, 512, 2048]
    - [5, 10054.8]
  - - [512, 2048, 1, 3977, 512, 512, 512, 2048]
    - [8, 10051.5]
  - - [512, 2048, 1, 3978, 512, 512, 512, 2048]
    - [6, 10028.9]
  - - [512, 2048, 1, 3990, 512, 512, 512, 2048]
    - [5, 10020.6]
  - - [512, 2048, 1, 3996, 512, 512, 512, 2048]
    - [6, 10022.3]
  - - [512, 2048, 1, 3999, 512, 512, 512, 2048]
    - [6, 10024.0]
  - - [512, 2048, 1, 4005, 512, 512, 512, 2048]
    - [6, 10041.0]
  - - [512, 2048, 1, 4012, 512, 512, 512, 2048]
    - [8, 10035.5]
  - - [512, 2048, 1, 4020, 512, 512, 512, 2048]
    - [8, 10040.2]
  - - [512, 2048, 1, 4026, 512, 512, 512, 2048]
    - [6, 10036.1]
  - - [512, 2048, 1, 4030, 512, 512, 512, 2048]
    - [9, 10038.4]
  - - [512, 2048, 1, 4032, 512, 512, 512, 2048]
    - [8, 10062.5]
  - - [512, 33708, 1, 3780, 512, 512, 512, 33708]
    - [8, 10494.6]
  - - [512, 33708, 1, 3796, 512, 512, 512, 33708]
    - [8, 10500.7]
  - - [512, 33708, 1, 3822, 512, 512, 512, 33708]
    - [8, 10497.0]
  - - [512, 33708, 1, 3840, 512, 512, 512, 33708]
    - [8, 10502.9]
  - - [512, 33708, 1, 3859, 512, 512, 512, 33708]
    - [8, 10499.4]
  - - [512, 33708, 1, 3870, 512, 512, 512, 33708]
    - [9, 10494.6]
  - - [512, 33708, 1, 3876, 512, 512, 512, 33708]
    - [6, 10500.7]
  - - [512, 33708, 1, 3906, 512, 512, 512, 33708]
    - [7, 10494.6]
  - - [512, 33708, 1, 3910, 512, 512, 512, 33708]
    - [6, 10500.2]
  - - [512, 33708, 1, 3925, 512, 512, 512, 33708]
    - [8, 10502.7]
  - - [512, 33708, 1, 3942, 512, 512, 512, 33708]
    - [8, 10504.1]
  - - [512, 33708, 1, 3944, 512, 512, 512, 33708]
    - [8, 10507.5]
  - - [512, 33708, 1, 3955, 512, 512, 512, 33708]
    - [7, 10502.9]
  - - [512, 33708, 1, 3968, 512, 512, 512, 33708]
    - [8, 10505.4]
  - - [512, 33708, 1, 3969, 512, 512, 512, 33708]
    - [8, 10503.3]
  - - [512, 33708, 1, 3976, 512, 512, 512, 33708]
    - [6, 10507.9]
  - - [512, 33708, 1, 3977, 512, 512, 512, 33708]
    - [6, 10500.6]
  - - [512, 33708, 1, 3978, 512, 512, 512, 33708]
    - [8, 10500.4]
  - - [512, 33708, 1, 3990, 512, 512, 512, 33708]
    - [9, 10496.4]
  - - [512, 33708, 1, 3995, 512, 512, 512, 33708]
    - [8, 10500.6]
  - - [512, 33708, 1, 3996, 512, 512, 512, 33708]
    - [9, 10501.2]
  - - [512, 33708, 1, 3999, 512, 512, 512, 33708]
    - [6, 10500.4]
  - - [512, 33708, 1, 4005, 512, 512, 512, 33708]
    - [6, 10499.6]
  - - [512, 33708, 1, 4012, 512, 512, 512, 33708]
    - [6, 10499.6]
  - - [512, 33708, 1, 4020, 512, 512, 512, 33708]
    - [8, 10502.6]
  - - [512, 33708, 1, 4026, 512, 512, 512, 33708]
    - [6, 10502.5]
  - - [512, 33708, 1, 4030, 512, 512, 512, 33708]
    - [6, 10504.0]
  - - [512, 33708, 1, 4032, 512, 512, 512, 33708]
    - [6, 10504.4]
  - - [2048, 512, 1, 2864, 2048, 2048, 2048, 512]
    - [6, 9946.75]
  - - [2048, 512, 1, 3092, 2048, 2048, 2048, 512]
    - [8, 9957.61]
  - - [2048, 512, 1, 3113, 2048, 2048, 2048, 512]
    - [6, 9961.6]
  - - [2048, 512, 1, 3137, 2048, 2048, 2048, 512]
    - [6, 9960.58]
  - - [2048, 512, 1, 3165, 2048, 2048, 2048, 512]
    - [6, 9965.0]
  - - [2048, 512, 1, 3194, 2048, 2048, 2048, 512]
    - [8, 9974.84]
  - - [2048, 512, 1, 3219, 2048, 2048, 2048, 512]
    - [6, 9969.77]
  - - [2048, 512, 1, 3222, 2048, 2048, 2048, 512]
    - [6, 9964.94]
  - - [2048, 512, 1, 3234, 2048, 2048, 2048, 512]
    - [8, 9980.85]
  - - [2048, 512, 1, 3237, 2048, 2048, 2048, 512]
    - [8, 9978.36]
  - - [2048, 512, 1, 3246, 2048, 2048, 2048, 512]
    - [8, 9977.95]
  - - [2048, 512, 1, 3249, 2048, 2048, 2048, 512]
    - [6, 9973.14]
  - - [2048, 512, 1, 3251, 2048, 2048, 2048, 512]
    - [8, 9979.28]
  - - [2048, 512, 1, 3257, 2048, 2048, 2048, 512]
    - [6, 9981.33]
  - - [2048, 512, 1, 3262, 2048, 2048, 2048, 512]
    - [8, 9973.33]
  - - [2048, 512, 1, 3268, 2048, 2048, 2048, 512]
    - [6, 9970.75]
  - - [2048, 512, 1, 3282, 2048, 2048, 2048, 512]
    - [8, 9987.89]
  - - [2048, 512, 1, 3286, 2048, 2048, 2048, 512]
    - [8, 9965.35]
  - - [2048, 512, 1, 3287, 2048, 2048, 2048, 512]
    - [9, 9968.39]
  - - [2048, 512, 1, 3293, 2048, 2048, 2048, 512]
    - [6, 9988.89]
  - - [2048, 512, 1, 3307, 2048, 2048, 2048, 512]
    - [8, 9987.44]
  - - [2048, 512, 1, 3314, 2048, 2048, 2048, 512]
    - [6, 9999.37]
  - - [2048, 512, 1, 3315, 2048, 2048, 2048, 512]
    - [8, 9986.29]
  - - [2048, 512, 1, 3319, 2048, 2048, 2048, 512]
    - [6, 9977.71]
  - - [2048, 512, 1, 3322, 2048, 2048, 2048, 512]
    - [6, 9993.6]
  - - [2048, 512, 1, 3323, 2048, 2048, 2048, 512]
    - [8, 9992.02]
  - - [2048, 512, 1, 3324, 2048, 2048, 2048, 512]
    - [8, 9981.29]
  - - [2048, 512, 1, 3325, 2048, 2048, 2048, 512]
    - [8, 9984.29]
  - - [2048, 512, 1, 3327, 2048, 2048, 2048, 512]
    - [8, 9978.87]
  - - [2048, 512, 1, 3329, 2048, 2048, 2048, 512]
    - [6, 9987.15]
  - - [2048, 512, 1, 3332, 2048, 2048, 2048, 512]
    - [6, 9977.88]
  - - [2048, 512, 1, 3336, 2048, 2048, 2048, 512]
    - [6, 9999.0]
  - - [2048, 512, 1, 3339, 2048, 2048, 2048, 512]
    - [8, 9989.72]
  - - [2048, 512, 1, 3342, 2048, 2048, 2048, 512]
    - [6, 9987.29]
  - - [2048, 512, 1, 3344, 2048, 2048, 2048, 512]
    - [8, 10000.1]
  - - [2048, 512, 1, 3360, 2048, 2048, 2048, 512]
    - [8, 10000.0]
  - - [2048, 512, 1, 3364, 2048, 2048, 2048, 512]
    - [6, 9996.06]
  - - [2048, 512, 1, 3365, 2048, 2048, 2048, 512]
    - [8, 9985.45]
  - - [2048, 512, 1, 3369, 2048, 2048, 2048, 512]
    - [6, 9999.58]
  - - [2048, 512, 1, 3371, 2048, 2048, 2048, 512]
    - [6, 9982.91]
  - - [2048, 512, 1, 3374, 2048, 2048, 2048, 512]
    - [8, 9987.28]
  - - [2048, 512, 1, 3376, 2048, 2048, 2048, 512]
    - [8, 9999.98]
  - - [2048, 512, 1, 3377, 2048, 2048, 2048, 512]
    - [8, 9996.16]
  - - [2048, 512, 1, 3378, 2048, 2048, 2048, 512]
    - [6, 9990.1]
  - - [2048, 512, 1, 3381, 2048, 2048, 2048, 512]
    - [8, 9992.21]
  - - [2048, 512, 1, 3382, 2048, 2048, 2048, 512]
    - [6, 9995.16]
  - - [2048, 512, 1, 3383, 2048, 2048, 2048, 512]
    - [6, 9986.86]
  - - [2048, 512, 1, 3384, 2048, 2048, 2048, 512]
    - [8, 10019.1]
  - - [2048, 512, 1, 3385, 2048, 2048, 2048, 512]
    - [8, 9997.27]
  - - [2048, 512, 1, 3386, 2048, 2048, 2048, 512]
    - [6, 9993.46]
  - - [2048, 512, 1, 3388, 2048, 2048, 2048, 512]
    - [8, 10001.6]
  - - [2048, 512, 1, 3390, 2048, 2048, 2048, 512]
    - [8, 9991.77]
  - - [2048, 512, 1, 3391, 2048, 2048, 2048, 512]
    - [8, 9992.47]
  - - [2048, 512, 1, 3396, 2048, 2048, 2048, 512]
    - [6, 9991.48]
  - - [2048, 512, 1, 3399, 2048, 2048, 2048, 512]
    - [8, 9986.86]
  - - [2048, 512, 1, 3402, 2048, 2048, 2048, 512]
    - [8, 10000.2]
  - - [2048, 512, 1, 3410, 2048, 2048, 2048, 512]
    - [6, 9999.0]
  - - [2048, 512, 1, 3412, 2048, 2048, 2048, 512]
    - [8, 9989.23]
  - - [2048, 512, 1, 3414, 2048, 2048, 2048, 512]
    - [6, 9992.85]
  - - [2048, 512, 1, 3415, 2048, 2048, 2048, 512]
    - [6, 9984.63]
  - - [2048, 512, 1, 3418, 2048, 2048, 2048, 512]
    - [6, 10000.1]
  - - [2048, 512, 1, 3420, 2048, 2048, 2048, 512]
    - [6, 9994.79]
  - - [2048, 512, 1, 3422, 2048, 2048, 2048, 512]
    - [6, 10002.9]
  - - [2048, 512, 1, 3425, 2048, 2048, 2048, 512]
    - [8, 9989.36]
  - - [2048, 512, 1, 3426, 2048, 2048, 2048, 512]
    - [8, 10003.4]
  - - [2048, 512, 1, 3427, 2048, 2048, 2048, 512]
    - [6, 10004.1]
  - - [2048, 512, 1, 3428, 2048, 2048, 2048, 512]
    - [6, 9986.99]
  - - [2048, 512, 1, 3430, 2048, 2048, 2048, 512]
    - [6, 10003.9]
  - - [2048, 512, 1, 3431, 2048, 2048, 2048, 512]
    - [6, 9984.64]
  - - [2048, 512, 1, 3432, 2048, 2048, 2048, 512]
    - [6, 10007.5]
  - - [2048, 512, 1, 3438, 2048, 2048, 2048, 512]
    - [6, 10000.6]
  - - [2048, 512, 1, 3439, 2048, 2048, 2048, 512]
    - [6, 9999.04]
  - - [2048, 512, 1, 3440, 2048, 2048, 2048, 512]
    - [6, 10004.2]
  - - [2048, 512, 1, 3443, 2048, 2048, 2048, 512]
    - [6, 9997.36]
  - - [2048, 512, 1, 3445, 2048, 2048, 2048, 512]
    - [6, 9989.89]
  - - [2048, 512, 1, 3447, 2048, 2048, 2048, 512]
    - [6, 9991.27]
  - - [2048, 512, 1, 3448, 2048, 2048, 2048, 512]
    - [6, 9998.59]
  - - [2048, 512, 1, 3450, 2048, 2048, 2048, 512]
    - [8, 10004.4]
  - - [2048, 512, 1, 3451, 2048, 2048, 2048, 512]
    - [8, 10005.1]
  - - [2048, 512, 1, 3452, 2048, 2048, 2048, 512]
    - [8, 9999.13]
  - - [2048, 512, 1, 3453, 2048, 2048, 2048, 512]
    - [8, 9993.19]
  - - [2048, 512, 1, 3455, 2048, 2048, 2048, 512]
    - [8, 9996.77]
  - - [2048, 512, 1, 3456, 2048, 2048, 2048, 512]
    - [6, 10008.5]
  - - [2048, 512, 1, 3457, 2048, 2048, 2048, 512]
    - [6, 10009.2]
  - - [2048, 512, 1, 3458, 2048, 2048, 2048, 512]
    - [6, 10003.2]
  - - [2048, 512, 1, 3459, 2048, 2048, 2048, 512]
    - [6, 10003.9]
  - - [2048, 512, 1, 3460, 2048, 2048, 2048, 512]
    - [6, 9993.59]
  - - [2048, 512, 1, 3461, 2048, 2048, 2048, 512]
    - [6, 9998.68]
  - - [2048, 512, 1, 3462, 2048, 2048, 2048, 512]
    - [6, 9999.37]
  - - [2048, 512, 1, 3466, 2048, 2048, 2048, 512]
    - [6, 9997.7]
  - - [2048, 512, 1, 3467, 2048, 2048, 2048, 512]
    - [8, 9991.79]
  - - [2048, 512, 1, 3468, 2048, 2048, 2048, 512]
    - [8, 9999.07]
  - - [2048, 512, 1, 3470, 2048, 2048, 2048, 512]
    - [6, 9996.04]
  - - [2048, 512, 1, 3471, 2048, 2048, 2048, 512]
    - [8, 9998.92]
  - - [2048, 512, 1, 3472, 2048, 2048, 2048, 512]
    - [6, 10012.8]
  - - [2048, 512, 1, 3475, 2048, 2048, 2048, 512]
    - [6, 10006.0]
  - - [2048, 512, 1, 3476, 2048, 2048, 2048, 512]
    - [6, 9997.94]
  - - [2048, 512, 1, 3477, 2048, 2048, 2048, 512]
    - [6, 9992.05]
  - - [2048, 512, 1, 3478, 2048, 2048, 2048, 512]
    - [6, 9994.92]
  - - [2048, 512, 1, 3479, 2048, 2048, 2048, 512]
    - [6, 9991.22]
  - - [2048, 512, 1, 3480, 2048, 2048, 2048, 512]
    - [8, 10018.2]
  - - [2048, 512, 1, 3481, 2048, 2048, 2048, 512]
    - [6, 9999.16]
  - - [2048, 512, 1, 3483, 2048, 2048, 2048, 512]
    - [8, 9989.58]
  - - [2048, 512, 1, 3484, 2048, 2048, 2048, 512]
    - [6, 9996.82]
  - - [2048, 512, 1, 3487, 2048, 2048, 2048, 512]
    - [8, 10001.1]
  - - [2048, 512, 1, 3489, 2048, 2048, 2048, 512]
    - [6, 10015.6]
  - - [2048, 512, 1, 3491, 2048, 2048, 2048, 512]
    - [8, 10001.6]
  - - [2048, 512, 1, 3493, 2048, 2048, 2048, 512]
    - [8, 9994.2]
  - - [2048, 512, 1, 3494, 2048, 2048, 2048, 512]
    - [8, 10005.8]
  - - [2048, 512, 1, 3495, 2048, 2048, 2048, 512]
    - [7, 9991.2]
  - - [2048, 512, 1, 3497, 2048, 2048, 2048, 512]
    - [8, 10003.5]
  - - [2048, 512, 1, 3499, 2048, 2048, 2048, 512]
    - [6, 9996.1]
  - - [2048, 512, 1, 3501, 2048, 2048, 2048, 512]
    - [6, 10001.8]
  - - [2048, 512, 1, 3503, 2048, 2048, 2048, 512]
    - [8, 9990.1]
  - - [2048, 512, 1, 3507, 2048, 2048, 2048, 512]
    - [8, 10003.7]
  - - [2048, 512, 1, 3508, 2048, 2048, 2048, 512]
    - [8, 9995.66]
  - - [2048, 512, 1, 3509, 2048, 2048, 2048, 512]
    - [8, 9994.17]
  - - [2048, 512, 1, 3511, 2048, 2048, 2048, 512]
    - [8, 9997.69]
  - - [2048, 512, 1, 3514, 2048, 2048, 2048, 512]
    - [8, 10006.2]
  - - [2048, 512, 1, 3515, 2048, 2048, 2048, 512]
    - [6, 10006.9]
  - - [2048, 512, 1, 3517, 2048, 2048, 2048, 512]
    - [6, 9999.57]
  - - [2048, 512, 1, 3518, 2048, 2048, 2048, 512]
    - [8, 10002.4]
  - - [2048, 512, 1, 3519, 2048, 2048, 2048, 512]
    - [6, 10003.1]
  - - [2048, 512, 1, 3520, 2048, 2048, 2048, 512]
    - [6, 10019.0]
  - - [2048, 512, 1, 3523, 2048, 2048, 2048, 512]
    - [6, 10001.4]
  - - [2048, 512, 1, 3529, 2048, 2048, 2048, 512]
    - [8, 10001.1]
  - - [2048, 512, 1, 3530, 2048, 2048, 2048, 512]
    - [6, 10001.8]
  - - [2048, 512, 1, 3532, 2048, 2048, 2048, 512]
    - [6, 10014.0]
  - - [2048, 512, 1, 3533, 2048, 2048, 2048, 512]
    - [6, 9999.51]
  - - [2048, 512, 1, 3534, 2048, 2048, 2048, 512]
    - [6, 9995.87]
  - - [2048, 512, 1, 3538, 2048, 2048, 2048, 512]
    - [6, 10013.7]
  - - [2048, 512, 1, 3539, 2048, 2048, 2048, 512]
    - [6, 10007.8]
  - - [2048, 512, 1, 3541, 2048, 2048, 2048, 512]
    - [6, 10004.9]
  - - [2048, 512, 1, 3547, 2048, 2048, 2048, 512]
    - [6, 10011.0]
  - - [2048, 512, 1, 3548, 2048, 2048, 2048, 512]
    - [6, 10013.9]
  - - [2048, 512, 1, 3552, 2048, 2048, 2048, 512]
    - [6, 10025.1]
  - - [2048, 512, 1, 3564, 2048, 2048, 2048, 512]
    - [6, 10007.3]
  - - [2048, 512, 1, 3598, 2048, 2048, 2048, 512]
    - [6, 10008.4]
  - - [2048, 512, 1, 3599, 2048, 2048, 2048, 512]
    - [8, 10013.3]
  - - [2048, 512, 1, 3608, 2048, 2048, 2048, 512]
    - [7, 10019.2]
  - - [2048, 512, 1, 3780, 2048, 2048, 2048, 512]
    - [8, 10017.2]
  - - [2048, 512, 1, 3796, 2048, 2048, 2048, 512]
    - [6, 10025.2]
  - - [2048, 512, 1, 3822, 2048, 2048, 2048, 512]
    - [6, 10025.2]
  - - [2048, 512, 1, 3840, 2048, 2048, 2048, 512]
    - [6, 10048.2]
  - - [2048, 512, 1, 3859, 2048, 2048, 2048, 512]
    - [8, 10029.9]
  - - [2048, 512, 1, 3870, 2048, 2048, 2048, 512]
    - [6, 10028.6]
  - - [2048, 512, 1, 3876, 2048, 2048, 2048, 512]
    - [6, 10028.3]
  - - [2048, 512, 1, 3906, 2048, 2048, 2048, 512]
    - [6, 10034.6]
  - - [2048, 512, 1, 3910, 2048, 2048, 2048, 512]
    - [6, 10031.2]
  - - [2048, 512, 1, 3925, 2048, 2048, 2048, 512]
    - [8, 10026.5]
  - - [2048, 512, 1, 3942, 2048, 2048, 2048, 512]
    - [6, 10030.8]
  - - [2048, 512, 1, 3944, 2048, 2048, 2048, 512]
    - [8, 10049.5]
  - - [2048, 512, 1, 3955, 2048, 2048, 2048, 512]
    - [6, 10032.7]
  - - [2048, 512, 1, 3968, 2048, 2048, 2048, 512]
    - [8, 10050.1]
  - - [2048, 512, 1, 3969, 2048, 2048, 2048, 512]
    - [8, 10037.1]
  - - [2048, 512, 1, 3976, 2048, 2048, 2048, 512]
    - [6, 10054.8]
  - - [2048, 512, 1, 3977, 2048, 2048, 2048, 512]
    - [6, 10039.9]
  - - [2048, 512, 1, 3978, 2048, 2048, 2048, 512]
    - [8, 10038.6]
  - - [2048, 512, 1, 3990, 2048, 2048, 2048, 512]
    - [6, 10034.1]
  - - [2048, 512, 1, 3995, 2048, 2048, 2048, 512]
    - [6, 10046.7]
  - - [2048, 512, 1, 3996, 2048, 2048, 2048, 512]
    - [8, 10037.6]
  - - [2048, 512, 1, 3999, 2048, 2048, 2048, 512]
    - [6, 10041.3]
  - - [2048, 512, 1, 4005, 2048, 2048, 2048, 512]
    - [8, 10029.5]
  - - [2048, 512, 1, 4012, 2048, 2048, 2048, 512]
    - [6, 10037.4]
  - - [2048, 512, 1, 4020, 2048, 2048, 2048, 512]
    - [8, 10038.3]
  - - [2048, 512, 1, 4026, 2048, 2048, 2048, 512]
    - [8, 10049.4]
  - - [2048, 512, 1, 4030, 2048, 2048, 2048, 512]
    - [6, 10040.3]
  - - [2048, 512, 1, 4032, 2048, 2048, 2048, 512]
    - [6, 10054.8]
  - - [512, 512, 1, 3780, 512, 512, 512, 512]
    - [16, 8391.81]
  - - [512, 512, 1, 3796, 512, 512, 512, 512]
    - [13, 8404.55]
  - - [512, 512, 1, 3822, 512, 512, 512, 512]
    - [15, 8433.62]
  - - [512, 512, 1, 3840, 512, 512, 512, 512]
    - [14, 8559.8]
  - - [512, 512, 1, 3859, 512, 512, 512, 512]
    - [11, 8430.11]
  - - [512, 512, 1, 3870, 512, 512, 512, 512]
    - [16, 8337.42]
  - - [512, 512, 1, 3876, 512, 512, 512, 512]
    - [11, 8467.25]
  - - [512, 512, 1, 3906, 512, 512, 512, 512]
    - [11, 8504.44]
  - - [512, 512, 1, 3910, 512, 512, 512, 512]
    - [15, 8524.48]
  - - [512, 512, 1, 3925, 512, 512, 512, 512]
    - [13, 8384.25]
  - - [512, 512, 1, 3927, 512, 512, 512, 512]
    - [16, 8465.79]
  - - [512, 512, 1, 3942, 512, 512, 512, 512]
    - [14, 8543.09]
  - - [512, 512, 1, 3944, 512, 512, 512, 512]
    - [12, 8446.86]
  - - [512, 512, 1, 3955, 512, 512, 512, 512]
    - [12, 8404.5]
  - - [512, 512, 1, 3968, 512, 512, 512, 512]
    - [16, 8593.75]
  - - [512, 512, 1, 3969, 512, 512, 512, 512]
    - [15, 8472.72]
  - - [512, 512, 1, 3976, 512, 512, 512, 512]
    - [15, 8498.73]
  - - [512, 512, 1, 3977, 512, 512, 512, 512]
    - [13, 8478.75]
  - - [512, 512, 1, 3978, 512, 512, 512, 512]
    - [13, 8497.46]
  - - [512, 512, 1, 3990, 512, 512, 512, 512]
    - [16, 8424.25]
  - - [512, 512, 1, 3995, 512, 512, 512, 512]
    - [14, 8429.37]
  - - [512, 512, 1, 3996, 512, 512, 512, 512]
    - [14, 8345.5]
  - - [512, 512, 1, 3999, 512, 512, 512, 512]
    - [15, 8389.2]
  - - [512, 512, 1, 4012, 512, 512, 512, 512]
    - [14, 8514.59]
  - - [512, 512, 1, 4020, 512, 512, 512, 512]
    - [16, 8400.98]
  - - [512, 512, 1, 4026, 512, 512, 512, 512]
    - [15, 8392.11]
  - - [512, 512, 1, 4030, 512, 512, 512, 512]
    - [15, 8389.77]
  - - [512, 512, 1, 4032, 512, 512, 512, 512]
    - [14, 8573.69]
  - - [512, 512, 1, 4050, 512, 512, 512, 512]
    - [12, 8436.77]
  - - [512, 512, 1, 4059, 512, 512, 512, 512]
    - [12, 8407.42]
  - - [64, 14, 2184, 14, 64, 64, 64, 14]
    - [31, 1342.95]
  - - [64, 15, 2048, 15, 64, 64, 64, 15]
    - [27, 1445.65]
  - - [64, 16, 1920, 16, 64, 64, 64, 16]
    - [30, 1771.24]
  - - [64, 17, 1816, 17, 64, 64, 64, 17]
    - [28, 1602.52]
  - - [64, 18, 1720, 18, 64, 64, 64, 18]
    - [28, 1688.73]
  - - [64, 19, 1632, 19, 64, 64, 64, 19]
    - [28, 1841.1]
  - - [64, 21, 1488, 21, 64, 64, 64, 21]
    - [28, 2026.9]
  - - [64, 23, 1360, 23, 64, 64, 64, 23]
    - [28, 2155.63]
  - - [64, 25, 1256, 25, 64, 64, 64, 25]
    - [28, 2275.36]
  - - [64, 27, 1168, 27, 64, 64, 64, 27]
    - [28, 2477.01]
  - - [64, 29, 1088, 29, 64, 64, 64, 29]
    - [29, 2623.68]
  - - [64, 32, 992, 32, 64, 64, 64, 32]
    - [10, 2987.67]
  - - [64, 35, 904, 35, 64, 64, 64, 35]
    - [17, 2812.44]
  - - [64, 41, 776, 41, 64, 64, 64, 41]
    - [28, 3281.65]
  - - [64, 45, 712, 45, 64, 64, 64, 45]
    - [28, 3549.05]
  - - [64, 54, 592, 54, 64, 64, 64, 54]
    - [17, 4038.06]
  - - [64, 64, 496, 64, 64, 64, 64, 64]
    - [3, 4683.84]
  - - [64, 64, 496, 65, 64, 64, 64, 64]
    - [32, 5672.47]
  - - [64, 65, 496, 65, 64, 64, 64, 65]
    - [20, 4170.35]
  - - [64, 77, 408, 77, 64, 64, 64, 77]
    - [18, 4778.33]
  - - [64, 77, 408, 78, 64, 64, 64, 77]
    - [18, 4769.73]
  - - [64, 78, 408, 78, 64, 64, 64, 78]
    - [18, 4867.2]
  - - [64, 85, 376, 85, 64, 64, 64, 85]
    - [21, 5149.95]
  - - [64, 93, 344, 93, 64, 64, 64, 93]
    - [19, 5484.34]
  - - [64, 102, 312, 102, 64, 64, 64, 102]
    - [1, 5204.09]
  - - [64, 112, 288, 112, 64, 64, 64, 112]
    - [2, 5910.3]
  - - [64, 122, 264, 122, 64, 64, 64, 122]
    - [0, 5897.75]
  - - [64, 123, 264, 122, 64, 64, 64, 123]
    - [24, 5901.8]
  - - [64, 123, 264, 123, 64, 64, 64, 123]
    - [24, 5895.29]
  - - [64, 134, 240, 134, 64, 64, 64, 134]
    - [23, 5707.87]
  - - [64, 135, 240, 134, 64, 64, 64, 135]
    - [23, 5712.63]
  - - [64, 135, 240, 135, 64, 64, 64, 135]
    - [22, 5745.81]
- null
