src/Tensile/data/Configs/miopen/archives/rk/2020-08-12/inc/arcturus_Cijk_Alik_Bljk_SB.yaml
- {MinimumRequiredVersion: 4.21.0}
- arcturus
- gfx908
- [Device 7380, Device 7388, Device 738c, Device 7390]
- - - [1023, 2048, 1, 4096, 1023, 1023, 4096, 4096]
    - [3, 38.967]
  - - [1025, 2048, 1, 4096, 1025, 1025, 4096, 4096]
    - [1, 40.138]
  - - [1024, 2047, 1, 4096, 1024, 1024, 4096, 4096]
    - [11, 41.025]
  - - [1024, 2049, 1, 4096, 1024, 1024, 4096, 4096]
    - [6, 38.599]
  - - [1024, 2048, 1, 4095, 1024, 1024, 4095, 4095]
    - [4, 41.282]
  - - [1024, 2048, 1, 4097, 1024, 1024, 4097, 4097]
    - [4, 41.342]
  - - [767, 1280, 1, 768, 767, 767, 768, 768]
    - [3, 36.278]
  - - [769, 1280, 1, 768, 769, 769, 768, 768]
    - [3, 30.04]
  - - [768, 1279, 1, 768, 768, 768, 768, 768]
    - [11, 33.538]
  - - [768, 1281, 1, 768, 768, 768, 768, 768]
    - [0, 28.456]
  - - [768, 1280, 1, 767, 768, 768, 767, 767]
    - [3, 34.673]
  - - [768, 1280, 1, 769, 768, 768, 769, 769]
    - [0, 34.637]
  - - [1023, 3072, 1, 1024, 1023, 1023, 1024, 1024]
    - [12, 48.673]
  - - [1025, 3072, 1, 1024, 1025, 1025, 1024, 1024]
    - [7, 52.686]
  - - [1024, 3071, 1, 1024, 1024, 1024, 1024, 1024]
    - [10, 51.012]
  - - [1024, 3073, 1, 1024, 1024, 1024, 1024, 1024]
    - [2, 52.743]
  - - [1024, 3072, 1, 1023, 1024, 1024, 1023, 1023]
    - [5, 53.588]
  - - [1024, 3072, 1, 1025, 1024, 1024, 1025, 1025]
    - [8, 53.621]
  - - [3071, 512, 1, 1024, 3071, 3071, 1024, 1024]
    - [1, 43.963]
  - - [3073, 512, 1, 1024, 3073, 3073, 1024, 1024]
    - [6, 45.9]
  - - [3072, 511, 1, 1024, 3072, 3072, 1024, 1024]
    - [12, 41.932]
  - - [3072, 513, 1, 1024, 3072, 3072, 1024, 1024]
    - [6, 47.604]
  - - [3072, 512, 1, 1023, 3072, 3072, 1023, 1023]
    - [9, 36.329]
  - - [3072, 512, 1, 1025, 3072, 3072, 1025, 1025]
    - [12, 40.971]
- null
