Tensile/Configs/miopen/archives/conv1x1/2020-07-07/exact/arcturus_Cijk_Ailk_Bljk_BBH.yaml
- {MinimumRequiredVersion: 4.20.0}
- arcturus
- gfx908
- [Device 7380, Device 7388, Device 738c, Device 7390]
- - - [64, 192, 64, 1280, 64, 64, 64, 1280]
    - [10, 48.684]
  - - [64, 320, 64, 1280, 64, 64, 64, 1280]
    - [34, 51.478]
  - - [64, 384, 64, 1280, 64, 64, 64, 1280]
    - [46, 60.388]
  - - [64, 448, 64, 1280, 64, 64, 64, 1280]
    - [45, 60.139]
  - - [64, 192, 64, 2048, 64, 64, 64, 2048]
    - [50, 48.699]
  - - [64, 320, 64, 2048, 64, 64, 64, 2048]
    - [27, 51.796]
  - - [64, 384, 64, 2048, 64, 64, 64, 2048]
    - [36, 58.878]
  - - [64, 448, 64, 2048, 64, 64, 64, 2048]
    - [43, 59.813]
  - - [1225, 32, 64, 192, 1225, 1225, 1225, 192]
    - [22, 26.992]
  - - [1225, 48, 64, 192, 1225, 1225, 1225, 192]
    - [8, 26.007]
  - - [1225, 64, 64, 192, 1225, 1225, 1225, 192]
    - [12, 39.542]
  - - [1225, 48, 64, 256, 1225, 1225, 1225, 256]
    - [5, 29.755]
  - - [1225, 64, 64, 256, 1225, 1225, 1225, 256]
    - [18, 45.022]
  - - [1225, 48, 64, 288, 1225, 1225, 1225, 288]
    - [9, 32.301]
  - - [1225, 64, 64, 288, 1225, 1225, 1225, 288]
    - [7, 47.202]
  - - [5329, 80, 64, 64, 5329, 5329, 5329, 64]
    - [11, 23.098]
  - - [289, 128, 64, 768, 289, 289, 289, 768]
    - [21, 51.098]
  - - [289, 160, 64, 768, 289, 289, 289, 768]
    - [19, 47.004]
  - - [289, 192, 64, 768, 289, 289, 289, 768]
    - [19, 56.53]
  - - [64, 192, 32, 1280, 64, 64, 64, 1280]
    - [48, 40.431]
  - - [64, 320, 32, 1280, 64, 64, 64, 1280]
    - [49, 46.868]
  - - [64, 384, 32, 1280, 64, 64, 64, 1280]
    - [54, 53.223]
  - - [64, 448, 32, 1280, 64, 64, 64, 1280]
    - [29, 56.217]
  - - [64, 192, 32, 2048, 64, 64, 64, 2048]
    - [47, 42.22]
  - - [64, 320, 32, 2048, 64, 64, 64, 2048]
    - [31, 50.546]
  - - [64, 384, 32, 2048, 64, 64, 64, 2048]
    - [54, 56.878]
  - - [64, 448, 32, 2048, 64, 64, 64, 2048]
    - [0, 57.373]
  - - [1225, 32, 32, 192, 1225, 1225, 1225, 192]
    - [1, 22.427]
  - - [1225, 48, 32, 192, 1225, 1225, 1225, 192]
    - [4, 23.236]
  - - [1225, 64, 32, 192, 1225, 1225, 1225, 192]
    - [10, 33.145]
  - - [1225, 48, 32, 256, 1225, 1225, 1225, 256]
    - [8, 26.362]
  - - [1225, 64, 32, 256, 1225, 1225, 1225, 256]
    - [2, 37.101]
  - - [1225, 48, 32, 288, 1225, 1225, 1225, 288]
    - [20, 27.561]
  - - [1225, 64, 32, 288, 1225, 1225, 1225, 288]
    - [10, 39.892]
  - - [5329, 80, 32, 64, 5329, 5329, 5329, 64]
    - [11, 22.083]
  - - [289, 128, 32, 768, 289, 289, 289, 768]
    - [15, 43.297]
  - - [289, 160, 32, 768, 289, 289, 289, 768]
    - [17, 41.705]
  - - [289, 192, 32, 768, 289, 289, 289, 768]
    - [10, 47.886]
  - - [3136, 256, 64, 64, 3136, 3136, 3136, 64]
    - [39, 45.089]
  - - [3136, 64, 64, 64, 3136, 3136, 3136, 64]
    - [51, 31.148]
  - - [3136, 64, 64, 256, 3136, 3136, 3136, 256]
    - [44, 56.002]
  - - [784, 512, 64, 128, 784, 784, 784, 128]
    - [38, 51.547]
  - - [784, 128, 64, 512, 784, 784, 784, 512]
    - [52, 65.128]
  - - [196, 1024, 64, 256, 196, 196, 196, 256]
    - [32, 50.531]
  - - [196, 256, 64, 1024, 196, 196, 196, 1024]
    - [30, 53.519]
  - - [49, 2048, 64, 512, 49, 49, 49, 512]
    - [3, 40.813]
  - - [49, 512, 64, 2048, 49, 49, 49, 2048]
    - [25, 38.11]
  - - [3136, 256, 32, 64, 3136, 3136, 3136, 64]
    - [42, 41.812]
  - - [3136, 64, 32, 64, 3136, 3136, 3136, 64]
    - [35, 27.874]
  - - [3136, 64, 32, 256, 3136, 3136, 3136, 256]
    - [28, 51.203]
  - - [784, 512, 32, 128, 784, 784, 784, 128]
    - [40, 48.009]
  - - [784, 128, 32, 512, 784, 784, 784, 512]
    - [41, 59.988]
  - - [196, 1024, 32, 256, 196, 196, 196, 256]
    - [32, 47.199]
  - - [196, 256, 32, 1024, 196, 196, 196, 1024]
    - [26, 42.98]
  - - [49, 2048, 32, 512, 49, 49, 49, 512]
    - [16, 35.993]
  - - [49, 512, 32, 2048, 49, 49, 49, 2048]
    - [24, 33.09]
  - - [3136, 128, 64, 64, 3136, 3136, 3136, 64]
    - [39, 41.085]
  - - [3136, 256, 64, 128, 3136, 3136, 3136, 128]
    - [40, 62.611]
  - - [784, 512, 64, 256, 784, 784, 784, 256]
    - [39, 67.671]
  - - [3136, 128, 64, 256, 3136, 3136, 3136, 256]
    - [40, 72.408]
  - - [3136, 256, 64, 256, 3136, 3136, 3136, 256]
    - [40, 76.527]
  - - [196, 1024, 64, 512, 196, 196, 196, 512]
    - [32, 57.763]
  - - [784, 256, 64, 512, 784, 784, 784, 512]
    - [41, 73.357]
  - - [784, 512, 64, 512, 784, 784, 784, 512]
    - [41, 77.661]
  - - [196, 512, 64, 1024, 196, 196, 196, 1024]
    - [19, 61.241]
  - - [196, 1024, 64, 1024, 196, 196, 196, 1024]
    - [23, 63.45]
  - - [49, 2048, 64, 1024, 49, 49, 49, 1024]
    - [3, 46.573]
  - - [49, 1024, 64, 2048, 49, 49, 49, 2048]
    - [13, 45.878]
  - - [3136, 128, 32, 64, 3136, 3136, 3136, 64]
    - [53, 37.529]
  - - [3136, 256, 32, 128, 3136, 3136, 3136, 128]
    - [40, 59.065]
  - - [784, 512, 32, 256, 784, 784, 784, 256]
    - [41, 64.582]
  - - [3136, 128, 32, 256, 3136, 3136, 3136, 256]
    - [40, 67.933]
  - - [3136, 256, 32, 256, 3136, 3136, 3136, 256]
    - [40, 74.242]
  - - [196, 1024, 32, 512, 196, 196, 196, 512]
    - [33, 55.298]
  - - [784, 256, 32, 512, 784, 784, 784, 512]
    - [37, 67.933]
  - - [784, 512, 32, 512, 784, 784, 784, 512]
    - [42, 74.019]
  - - [196, 512, 32, 1024, 196, 196, 196, 1024]
    - [19, 53.799]
  - - [196, 1024, 32, 1024, 196, 196, 196, 1024]
    - [19, 61.241]
  - - [49, 2048, 32, 1024, 49, 49, 49, 1024]
    - [6, 40.678]
  - - [49, 1024, 32, 2048, 49, 49, 49, 2048]
    - [14, 38.66]
- null
