Tensile/Configs/miopen/archives/conv1x1/2020-07-07/exact/arcturus_Cijk_Ailk_Bjlk_HBH.yaml
- {MinimumRequiredVersion: 4.20.0}
- arcturus
- gfx908
- [Device 7380, Device 7388, Device 738c, Device 7390]
- - - [64, 1280, 64, 192, 64, 64, 64, 1280]
    - [17, 25.669]
  - - [64, 1280, 64, 320, 64, 64, 64, 1280]
    - [11, 30.427]
  - - [64, 1280, 64, 384, 64, 64, 64, 1280]
    - [27, 32.767]
  - - [64, 1280, 64, 448, 64, 64, 64, 1280]
    - [30, 34.292]
  - - [64, 2048, 64, 192, 64, 64, 64, 2048]
    - [25, 26.915]
  - - [64, 2048, 64, 320, 64, 64, 64, 2048]
    - [29, 31.168]
  - - [64, 2048, 64, 384, 64, 64, 64, 2048]
    - [23, 32.66]
  - - [64, 2048, 64, 448, 64, 64, 64, 2048]
    - [19, 34.079]
  - - [1225, 192, 64, 32, 1225, 1225, 1225, 192]
    - [9, 11.77]
  - - [1225, 192, 64, 48, 1225, 1225, 1225, 192]
    - [5, 10.032]
  - - [1225, 192, 64, 64, 1225, 1225, 1225, 192]
    - [9, 18.068]
  - - [1225, 256, 64, 48, 1225, 1225, 1225, 256]
    - [10, 11.255]
  - - [1225, 256, 64, 64, 1225, 1225, 1225, 256]
    - [14, 20.068]
  - - [1225, 288, 64, 48, 1225, 1225, 1225, 288]
    - [5, 9.435]
  - - [1225, 288, 64, 64, 1225, 1225, 1225, 288]
    - [12, 16.532]
  - - [5329, 64, 64, 80, 5329, 5329, 5329, 64]
    - [1, 14.91]
  - - [289, 768, 64, 128, 289, 289, 289, 768]
    - [3, 25.587]
  - - [289, 768, 64, 160, 289, 289, 289, 768]
    - [3, 28.743]
  - - [289, 768, 64, 192, 289, 289, 289, 768]
    - [14, 31.088]
  - - [64, 1280, 32, 192, 64, 64, 64, 1280]
    - [23, 20.934]
  - - [64, 1280, 32, 320, 64, 64, 64, 1280]
    - [30, 25.572]
  - - [64, 1280, 32, 384, 64, 64, 64, 1280]
    - [30, 27.07]
  - - [64, 1280, 32, 448, 64, 64, 64, 1280]
    - [22, 27.545]
  - - [64, 2048, 32, 192, 64, 64, 64, 2048]
    - [22, 23.117]
  - - [64, 2048, 32, 320, 64, 64, 64, 2048]
    - [30, 27.246]
  - - [64, 2048, 32, 384, 64, 64, 64, 2048]
    - [0, 28.875]
  - - [64, 2048, 32, 448, 64, 64, 64, 2048]
    - [11, 30.529]
  - - [1225, 192, 32, 32, 1225, 1225, 1225, 192]
    - [9, 9.51]
  - - [1225, 192, 32, 48, 1225, 1225, 1225, 192]
    - [5, 8.736]
  - - [1225, 192, 32, 64, 1225, 1225, 1225, 192]
    - [12, 15.544]
  - - [1225, 256, 32, 48, 1225, 1225, 1225, 256]
    - [13, 9.653]
  - - [1225, 256, 32, 64, 1225, 1225, 1225, 256]
    - [12, 16.422]
  - - [1225, 288, 32, 48, 1225, 1225, 1225, 288]
    - [1, 8.881]
  - - [1225, 288, 32, 64, 1225, 1225, 1225, 288]
    - [12, 15.161]
  - - [5329, 64, 32, 80, 5329, 5329, 5329, 64]
    - [9, 14.015]
  - - [289, 768, 32, 128, 289, 289, 289, 768]
    - [3, 21.704]
  - - [289, 768, 32, 160, 289, 289, 289, 768]
    - [3, 24.448]
  - - [289, 768, 32, 192, 289, 289, 289, 768]
    - [8, 26.422]
  - - [3136, 64, 64, 256, 3136, 3136, 3136, 64]
    - [26, 30.319]
  - - [3136, 64, 64, 64, 3136, 3136, 3136, 64]
    - [31, 19.233]
  - - [3136, 256, 64, 64, 3136, 3136, 3136, 256]
    - [24, 29.197]
  - - [784, 128, 64, 512, 784, 784, 784, 128]
    - [3, 44.088]
  - - [784, 512, 64, 128, 784, 784, 784, 512]
    - [24, 36.591]
  - - [196, 256, 64, 1024, 196, 196, 196, 256]
    - [21, 33.304]
  - - [196, 1024, 64, 256, 196, 196, 196, 1024]
    - [14, 31.084]
  - - [49, 512, 64, 2048, 49, 49, 49, 512]
    - [16, 23.138]
  - - [49, 2048, 64, 512, 49, 49, 49, 2048]
    - [15, 23.653]
  - - [3136, 64, 32, 256, 3136, 3136, 3136, 64]
    - [33, 27.925]
  - - [3136, 64, 32, 64, 3136, 3136, 3136, 64]
    - [7, 16.027]
  - - [3136, 256, 32, 64, 3136, 3136, 3136, 256]
    - [24, 25.816]
  - - [784, 128, 32, 512, 784, 784, 784, 128]
    - [24, 39.053]
  - - [784, 512, 32, 128, 784, 784, 784, 512]
    - [24, 31.791]
  - - [196, 256, 32, 1024, 196, 196, 196, 256]
    - [20, 26.713]
  - - [196, 1024, 32, 256, 196, 196, 196, 1024]
    - [14, 26.392]
  - - [49, 512, 32, 2048, 49, 49, 49, 512]
    - [7, 23.103]
  - - [49, 2048, 32, 512, 49, 49, 49, 2048]
    - [2, 20.821]
  - - [3136, 64, 64, 128, 3136, 3136, 3136, 64]
    - [28, 24.27]
  - - [3136, 128, 64, 256, 3136, 3136, 3136, 128]
    - [24, 47.784]
  - - [784, 256, 64, 512, 784, 784, 784, 256]
    - [24, 53.799]
  - - [3136, 256, 64, 128, 3136, 3136, 3136, 256]
    - [24, 44.99]
  - - [3136, 256, 64, 256, 3136, 3136, 3136, 256]
    - [24, 58.869]
  - - [196, 512, 64, 1024, 196, 196, 196, 512]
    - [14, 42.3]
  - - [784, 512, 64, 256, 784, 784, 784, 512]
    - [24, 48.272]
  - - [784, 512, 64, 512, 784, 784, 784, 512]
    - [24, 58.283]
  - - [196, 1024, 64, 512, 196, 196, 196, 1024]
    - [3, 40.096]
  - - [196, 1024, 64, 1024, 196, 196, 196, 1024]
    - [18, 46.051]
  - - [49, 1024, 64, 2048, 49, 49, 49, 1024]
    - [6, 27.415]
  - - [49, 2048, 64, 1024, 49, 49, 49, 2048]
    - [2, 28.507]
  - - [3136, 64, 32, 128, 3136, 3136, 3136, 64]
    - [31, 21.732]
  - - [3136, 128, 32, 256, 3136, 3136, 3136, 128]
    - [24, 43.039]
  - - [784, 256, 32, 512, 784, 784, 784, 256]
    - [24, 48.083]
  - - [3136, 256, 32, 128, 3136, 3136, 3136, 256]
    - [32, 39.554]
  - - [3136, 256, 32, 256, 3136, 3136, 3136, 256]
    - [24, 55.051]
  - - [196, 512, 32, 1024, 196, 196, 196, 512]
    - [21, 33.413]
  - - [784, 512, 32, 256, 784, 784, 784, 512]
    - [24, 43.282]
  - - [784, 512, 32, 512, 784, 784, 784, 512]
    - [24, 55.348]
  - - [196, 1024, 32, 512, 196, 196, 196, 1024]
    - [3, 34.97]
  - - [196, 1024, 32, 1024, 196, 196, 196, 1024]
    - [3, 40.814]
  - - [49, 1024, 32, 2048, 49, 49, 49, 1024]
    - [4, 23.856]
  - - [49, 2048, 32, 1024, 49, 49, 49, 2048]
    - [2, 25.059]
- null
