Tensile/Configs/miopen/archives/conv1x1/2020-07-07/exact/arcturus_Cijk_Ailk_Bjlk_BBH.yaml
- {MinimumRequiredVersion: 4.20.0}
- arcturus
- gfx908
- [Device 7380, Device 7388, Device 738c, Device 7390]
- - - [64, 1280, 64, 192, 64, 64, 64, 1280]
    - [24, 44.859]
  - - [64, 1280, 64, 320, 64, 64, 64, 1280]
    - [21, 56.274]
  - - [64, 1280, 64, 384, 64, 64, 64, 1280]
    - [31, 60.485]
  - - [64, 1280, 64, 448, 64, 64, 64, 1280]
    - [31, 62.625]
  - - [64, 2048, 64, 192, 64, 64, 64, 2048]
    - [34, 49.418]
  - - [64, 2048, 64, 320, 64, 64, 64, 2048]
    - [5, 60.459]
  - - [64, 2048, 64, 384, 64, 64, 64, 2048]
    - [28, 64.207]
  - - [64, 2048, 64, 448, 64, 64, 64, 2048]
    - [28, 67.569]
  - - [1225, 192, 64, 32, 1225, 1225, 1225, 192]
    - [16, 23.057]
  - - [1225, 192, 64, 48, 1225, 1225, 1225, 192]
    - [13, 19.685]
  - - [1225, 192, 64, 64, 1225, 1225, 1225, 192]
    - [16, 35.99]
  - - [1225, 256, 64, 48, 1225, 1225, 1225, 256]
    - [18, 20.305]
  - - [1225, 256, 64, 64, 1225, 1225, 1225, 256]
    - [16, 36.316]
  - - [1225, 288, 64, 48, 1225, 1225, 1225, 288]
    - [1, 18.16]
  - - [1225, 288, 64, 64, 1225, 1225, 1225, 288]
    - [3, 32.314]
  - - [5329, 64, 64, 80, 5329, 5329, 5329, 64]
    - [1, 25.613]
  - - [289, 768, 64, 128, 289, 289, 289, 768]
    - [4, 44.486]
  - - [289, 768, 64, 160, 289, 289, 289, 768]
    - [4, 49.349]
  - - [289, 768, 64, 192, 289, 289, 289, 768]
    - [5, 54.075]
  - - [64, 1280, 32, 192, 64, 64, 64, 1280]
    - [30, 39.251]
  - - [64, 1280, 32, 320, 64, 64, 64, 1280]
    - [21, 50.322]
  - - [64, 1280, 32, 384, 64, 64, 64, 1280]
    - [21, 53.525]
  - - [64, 1280, 32, 448, 64, 64, 64, 1280]
    - [31, 56.652]
  - - [64, 2048, 32, 192, 64, 64, 64, 2048]
    - [23, 43.312]
  - - [64, 2048, 32, 320, 64, 64, 64, 2048]
    - [2, 53.223]
  - - [64, 2048, 32, 384, 64, 64, 64, 2048]
    - [25, 56.241]
  - - [64, 2048, 32, 448, 64, 64, 64, 2048]
    - [28, 59.408]
  - - [1225, 192, 32, 32, 1225, 1225, 1225, 192]
    - [10, 19.599]
  - - [1225, 192, 32, 48, 1225, 1225, 1225, 192]
    - [15, 18.079]
  - - [1225, 192, 32, 64, 1225, 1225, 1225, 192]
    - [7, 31.195]
  - - [1225, 256, 32, 48, 1225, 1225, 1225, 256]
    - [7, 18.14]
  - - [1225, 256, 32, 64, 1225, 1225, 1225, 256]
    - [16, 33.206]
  - - [1225, 288, 32, 48, 1225, 1225, 1225, 288]
    - [0, 16.932]
  - - [1225, 288, 32, 64, 1225, 1225, 1225, 288]
    - [13, 29.722]
  - - [5329, 64, 32, 80, 5329, 5329, 5329, 64]
    - [8, 24.61]
  - - [289, 768, 32, 128, 289, 289, 289, 768]
    - [3, 40.418]
  - - [289, 768, 32, 160, 289, 289, 289, 768]
    - [19, 43.855]
  - - [289, 768, 32, 192, 289, 289, 289, 768]
    - [5, 47.886]
  - - [3136, 64, 64, 256, 3136, 3136, 3136, 64]
    - [20, 58.504]
  - - [3136, 64, 64, 64, 3136, 3136, 3136, 64]
    - [35, 37.621]
  - - [3136, 256, 64, 64, 3136, 3136, 3136, 256]
    - [26, 47.6]
  - - [784, 128, 64, 512, 784, 784, 784, 128]
    - [28, 71.733]
  - - [784, 512, 64, 128, 784, 784, 784, 512]
    - [27, 58.228]
  - - [196, 256, 64, 1024, 196, 196, 196, 256]
    - [5, 55.249]
  - - [196, 1024, 64, 256, 196, 196, 196, 1024]
    - [18, 52.515]
  - - [49, 512, 64, 2048, 49, 49, 49, 512]
    - [6, 44.406]
  - - [49, 2048, 64, 512, 49, 49, 49, 2048]
    - [11, 45.965]
  - - [3136, 64, 32, 256, 3136, 3136, 3136, 64]
    - [33, 54.178]
  - - [3136, 64, 32, 64, 3136, 3136, 3136, 64]
    - [23, 31.273]
  - - [3136, 256, 32, 64, 3136, 3136, 3136, 256]
    - [26, 45.122]
  - - [784, 128, 32, 512, 784, 784, 784, 128]
    - [28, 62.168]
  - - [784, 512, 32, 128, 784, 784, 784, 512]
    - [30, 51.203]
  - - [196, 256, 32, 1024, 196, 196, 196, 256]
    - [22, 46.275]
  - - [196, 1024, 32, 256, 196, 196, 196, 1024]
    - [5, 46.137]
  - - [49, 512, 32, 2048, 49, 49, 49, 512]
    - [10, 38.133]
  - - [49, 2048, 32, 512, 49, 49, 49, 2048]
    - [0, 41.252]
  - - [3136, 64, 64, 128, 3136, 3136, 3136, 64]
    - [29, 46.91]
  - - [3136, 128, 64, 256, 3136, 3136, 3136, 128]
    - [36, 77.858]
  - - [784, 256, 64, 512, 784, 784, 784, 256]
    - [30, 76.646]
  - - [3136, 256, 64, 128, 3136, 3136, 3136, 256]
    - [32, 70.947]
  - - [3136, 256, 64, 256, 3136, 3136, 3136, 256]
    - [32, 83.369]
  - - [196, 512, 64, 1024, 196, 196, 196, 512]
    - [4, 62.58]
  - - [784, 512, 64, 256, 784, 784, 784, 512]
    - [32, 71.567]
  - - [784, 512, 64, 512, 784, 784, 784, 512]
    - [30, 78.453]
  - - [196, 1024, 64, 512, 196, 196, 196, 1024]
    - [14, 60.31]
  - - [196, 1024, 64, 1024, 196, 196, 196, 1024]
    - [18, 65.441]
  - - [49, 1024, 64, 2048, 49, 49, 49, 1024]
    - [19, 53.241]
  - - [49, 2048, 64, 1024, 49, 49, 49, 2048]
    - [9, 53.988]
  - - [3136, 64, 32, 128, 3136, 3136, 3136, 64]
    - [29, 40.922]
  - - [3136, 128, 32, 256, 3136, 3136, 3136, 128]
    - [28, 71.4]
  - - [784, 256, 32, 512, 784, 784, 784, 256]
    - [30, 72.408]
  - - [3136, 256, 32, 128, 3136, 3136, 3136, 256]
    - [36, 64.718]
  - - [3136, 256, 32, 256, 3136, 3136, 3136, 256]
    - [36, 78.553]
  - - [196, 512, 32, 1024, 196, 196, 196, 512]
    - [4, 54.952]
  - - [784, 512, 32, 256, 784, 784, 784, 512]
    - [28, 66.754]
  - - [784, 512, 32, 512, 784, 784, 784, 512]
    - [30, 75.195]
  - - [196, 1024, 32, 512, 196, 196, 196, 1024]
    - [2, 55.1]
  - - [196, 1024, 32, 1024, 196, 196, 196, 1024]
    - [17, 61.424]
  - - [49, 1024, 32, 2048, 49, 49, 49, 1024]
    - [12, 47.162]
  - - [49, 2048, 32, 1024, 49, 49, 49, 2048]
    - [9, 47.972]
- null
