Tensile/Configs/miopen/archives/conv1x1/2020-07-07/exact/arcturus_Cijk_Ailk_Bljk_HBH.yaml
- {MinimumRequiredVersion: 4.20.0}
- arcturus
- gfx908
- [Device 7380, Device 7388, Device 738c, Device 7390]
- - - [64, 192, 64, 1280, 64, 64, 64, 1280]
    - [0, 23.203]
  - - [64, 320, 64, 1280, 64, 64, 64, 1280]
    - [50, 26.038]
  - - [64, 384, 64, 1280, 64, 64, 64, 1280]
    - [1, 29.624]
  - - [64, 448, 64, 1280, 64, 64, 64, 1280]
    - [45, 28.809]
  - - [64, 192, 64, 2048, 64, 64, 64, 2048]
    - [19, 24.001]
  - - [64, 320, 64, 2048, 64, 64, 64, 2048]
    - [42, 27.305]
  - - [64, 384, 64, 2048, 64, 64, 64, 2048]
    - [32, 30.543]
  - - [64, 448, 64, 2048, 64, 64, 64, 2048]
    - [15, 30.06]
  - - [1225, 32, 64, 192, 1225, 1225, 1225, 192]
    - [4, 13.537]
  - - [1225, 48, 64, 192, 1225, 1225, 1225, 192]
    - [25, 14.146]
  - - [1225, 64, 64, 192, 1225, 1225, 1225, 192]
    - [24, 21.883]
  - - [1225, 48, 64, 256, 1225, 1225, 1225, 256]
    - [24, 16.512]
  - - [1225, 64, 64, 256, 1225, 1225, 1225, 256]
    - [12, 24.186]
  - - [1225, 48, 64, 288, 1225, 1225, 1225, 288]
    - [13, 17.67]
  - - [1225, 64, 64, 288, 1225, 1225, 1225, 288]
    - [8, 25.661]
  - - [5329, 80, 64, 64, 5329, 5329, 5329, 64]
    - [10, 12.334]
  - - [289, 128, 64, 768, 289, 289, 289, 768]
    - [7, 28.407]
  - - [289, 160, 64, 768, 289, 289, 289, 768]
    - [10, 26.002]
  - - [289, 192, 64, 768, 289, 289, 289, 768]
    - [12, 30.494]
  - - [64, 192, 32, 1280, 64, 64, 64, 1280]
    - [46, 18.256]
  - - [64, 320, 32, 1280, 64, 64, 64, 1280]
    - [50, 23.646]
  - - [64, 384, 32, 1280, 64, 64, 64, 1280]
    - [29, 28.721]
  - - [64, 448, 32, 1280, 64, 64, 64, 1280]
    - [48, 26.168]
  - - [64, 192, 32, 2048, 64, 64, 64, 2048]
    - [49, 20.314]
  - - [64, 320, 32, 2048, 64, 64, 64, 2048]
    - [2, 25.634]
  - - [64, 384, 32, 2048, 64, 64, 64, 2048]
    - [43, 28.493]
  - - [64, 448, 32, 2048, 64, 64, 64, 2048]
    - [0, 27.606]
  - - [1225, 32, 32, 192, 1225, 1225, 1225, 192]
    - [3, 10.995]
  - - [1225, 48, 32, 192, 1225, 1225, 1225, 192]
    - [13, 11.739]
  - - [1225, 64, 32, 192, 1225, 1225, 1225, 192]
    - [12, 18.25]
  - - [1225, 48, 32, 256, 1225, 1225, 1225, 256]
    - [13, 13.297]
  - - [1225, 64, 32, 256, 1225, 1225, 1225, 256]
    - [12, 19.642]
  - - [1225, 48, 32, 288, 1225, 1225, 1225, 288]
    - [13, 14.245]
  - - [1225, 64, 32, 288, 1225, 1225, 1225, 288]
    - [11, 21.603]
  - - [5329, 80, 32, 64, 5329, 5329, 5329, 64]
    - [10, 11.38]
  - - [289, 128, 32, 768, 289, 289, 289, 768]
    - [7, 25.396]
  - - [289, 160, 32, 768, 289, 289, 289, 768]
    - [22, 21.142]
  - - [289, 192, 32, 768, 289, 289, 289, 768]
    - [17, 24.401]
  - - [3136, 256, 64, 64, 3136, 3136, 3136, 64]
    - [38, 24.639]
  - - [3136, 64, 64, 64, 3136, 3136, 3136, 64]
    - [35, 18.145]
  - - [3136, 64, 64, 256, 3136, 3136, 3136, 256]
    - [10, 29.448]
  - - [784, 512, 64, 128, 784, 784, 784, 128]
    - [40, 28.207]
  - - [784, 128, 64, 512, 784, 784, 784, 512]
    - [5, 37.166]
  - - [196, 1024, 64, 256, 196, 196, 196, 256]
    - [33, 28.258]
  - - [196, 256, 64, 1024, 196, 196, 196, 1024]
    - [16, 29.477]
  - - [49, 2048, 64, 512, 49, 49, 49, 512]
    - [21, 20.667]
  - - [49, 512, 64, 2048, 49, 49, 49, 2048]
    - [26, 19.828]
  - - [3136, 256, 32, 64, 3136, 3136, 3136, 64]
    - [37, 23.349]
  - - [3136, 64, 32, 64, 3136, 3136, 3136, 64]
    - [35, 14.91]
  - - [3136, 64, 32, 256, 3136, 3136, 3136, 256]
    - [28, 26.76]
  - - [784, 512, 32, 128, 784, 784, 784, 128]
    - [41, 25.947]
  - - [784, 128, 32, 512, 784, 784, 784, 512]
    - [5, 33.742]
  - - [196, 1024, 32, 256, 196, 196, 196, 256]
    - [30, 24.979]
  - - [196, 256, 32, 1024, 196, 196, 196, 1024]
    - [27, 27.526]
  - - [49, 2048, 32, 512, 49, 49, 49, 512]
    - [6, 18.187]
  - - [49, 512, 32, 2048, 49, 49, 49, 2048]
    - [9, 18.209]
  - - [3136, 128, 64, 64, 3136, 3136, 3136, 64]
    - [44, 22.661]
  - - [3136, 256, 64, 128, 3136, 3136, 3136, 128]
    - [36, 34.422]
  - - [784, 512, 64, 256, 784, 784, 784, 256]
    - [41, 37.121]
  - - [3136, 128, 64, 256, 3136, 3136, 3136, 256]
    - [36, 40.043]
  - - [3136, 256, 64, 256, 3136, 3136, 3136, 256]
    - [36, 43.93]
  - - [196, 1024, 64, 512, 196, 196, 196, 512]
    - [33, 37.054]
  - - [784, 256, 64, 512, 784, 784, 784, 512]
    - [34, 42.329]
  - - [784, 512, 64, 512, 784, 784, 784, 512]
    - [39, 46.468]
  - - [196, 512, 64, 1024, 196, 196, 196, 1024]
    - [31, 37.505]
  - - [196, 1024, 64, 1024, 196, 196, 196, 1024]
    - [33, 44.294]
  - - [49, 2048, 64, 1024, 49, 49, 49, 1024]
    - [23, 23.892]
  - - [49, 1024, 64, 2048, 49, 49, 49, 2048]
    - [14, 23.995]
  - - [3136, 128, 32, 64, 3136, 3136, 3136, 64]
    - [44, 20.353]
  - - [3136, 256, 32, 128, 3136, 3136, 3136, 128]
    - [36, 32.496]
  - - [784, 512, 32, 256, 784, 784, 784, 256]
    - [10, 35.089]
  - - [3136, 128, 32, 256, 3136, 3136, 3136, 256]
    - [47, 37.166]
  - - [3136, 256, 32, 256, 3136, 3136, 3136, 256]
    - [36, 42.329]
  - - [196, 1024, 32, 512, 196, 196, 196, 512]
    - [18, 31.053]
  - - [784, 256, 32, 512, 784, 784, 784, 512]
    - [34, 39.914]
  - - [784, 512, 32, 512, 784, 784, 784, 512]
    - [34, 43.775]
  - - [196, 512, 32, 1024, 196, 196, 196, 1024]
    - [18, 30.897]
  - - [196, 1024, 32, 1024, 196, 196, 196, 1024]
    - [31, 37.369]
  - - [49, 2048, 32, 1024, 49, 49, 49, 1024]
    - [23, 21.565]
  - - [49, 1024, 32, 2048, 49, 49, 49, 2048]
    - [20, 20.299]
- null
