Tensile/Configs/miopen/archives/dlrm/2019-08-26/exact/vega20_Cijk_Ailk_Bjlk_SB.yaml
- {MinimumRequiredVersion: 4.9.11}
- vega20
- gfx906
- [Device 66a0, Device 66a1, Device 66a7, Vega 20]
    SolutionIndex: 0
    SolutionNameMin: Cijk_Ailk_Bjlk_SB_MT64x64x8_SE_AMAS3_EPS1_FL0_GRVW4_GSU1_PGR1_PLR1_TT4_4_USFGRO0_VW2_WG16_16_1_WGM1
    SolutionIndex: 1
    SolutionNameMin: Cijk_Ailk_Bjlk_SB_MT64x64x16_SE_AMAS3_EPS1_FL0_GRVW4_GSU1_PGR1_PLR1_TT4_4_USFGRO0_VW4_WG16_16_1_WGM8
    SolutionIndex: 2
    SolutionNameMin: Cijk_Ailk_Bjlk_SB_MT64x32x8_SE_AMAS3_EPS1_FL0_GRVW2_GSU1_PGR1_PLR1_TT4_4_USFGRO0_VW2_WG16_8_2_WGM8
    SolutionIndex: 3
    SolutionNameMin: Cijk_Ailk_Bjlk_SB_MT8x32x32_SE_AMAS3_EPS1_FL0_GRVW1_GSU1_PGR1_PLR1_TT2_2_USFGRO1_VW2_WG4_16_4_WGM1
    SolutionIndex: 4
    SolutionNameMin: Cijk_Ailk_Bjlk_SB_MT16x32x32_SE_AMAS1_EPS1_FL0_GRVW1_GSU1_PGR1_PLR1_TT4_2_USFGRO1_VW1_WG4_16_4_WGM8
    SolutionIndex: 5
    SolutionNameMin: Cijk_Ailk_Bjlk_SB_MT16x32x32_SE_AMAS3_EPS1_FL0_GRVW1_GSU1_PGR1_PLR1_TT4_2_USFGRO1_VW2_WG4_16_4_WGM8
    SolutionIndex: 6
    SolutionNameMin: Cijk_Ailk_Bjlk_SB_MT32x8x32_SE_AMAS1_EPS1_FL0_GRVW1_GSU1_PGR1_PLR1_TT2_2_USFGRO1_VW1_WG16_4_4_WGM8
    SolutionIndex: 7
    SolutionNameMin: Cijk_Ailk_Bjlk_SB_MT64x16x16_SE_AMAS3_EPS1_FL0_GRVW4_GSU1_PGR1_PLR0_TT4_4_USFGRO0_VW4_WG16_4_4_WGM1
    SolutionIndex: 8
    SolutionNameMin: Cijk_Ailk_Bjlk_SB_MT128x64x8_SE_AMAS3_EPS1_FL0_GRVW1_GSU1_PGR1_PLR1_TT8_4_USFGRO1_VW4_WG16_16_1_WGM8
    SolutionIndex: 9
    SolutionNameMin: Cijk_Ailk_Bjlk_SB_MT128x64x8_SE_AMAS3_EPS1_FL0_GRVW2_GSU1_PGR1_PLR1_TT8_4_USFGRO0_VW2_WG16_16_1_WGM8
    SolutionIndex: 10
    SolutionNameMin: Cijk_Ailk_Bjlk_SB_MT128x64x8_SE_AMAS3_EPS1_FL1_GRVW2_GSU1_PGR1_PLR0_TT8_4_USFGRO0_VW2_WG16_16_1_WGM8
- - - [2048, 2048, 1, 512, 2048, 2048, 2048, 2048]
    - [10, 9607.57]
  - - [512, 32, 1, 200, 512, 512, 512, 32]
    - [3, 422.268]
  - - [1024, 1, 1, 200, 1024, 1024, 1024, 1]
    - [6, 24.6154]
  - - [1600, 1024, 1, 512, 1600, 1600, 1600, 1024]
    - [1, 8115.91]
  - - [560, 1024, 1, 200, 560, 560, 560, 1024]
    - [0, 4810.74]
  - - [1024, 1024, 1, 512, 1024, 1024, 1024, 1024]
    - [9, 8614.74]
  - - [2048, 1, 1, 512, 2048, 2048, 2048, 1]
    - [4, 80.9086]
  - - [512, 512, 1, 200, 512, 512, 512, 512]
    - [2, 4398.39]
  - - [100, 2048, 1, 512, 100, 100, 100, 2048]
    - [7, 4443.12]
  - - [1024, 1024, 1, 200, 1024, 1024, 1024, 1024]
    - [8, 6990.51]
  - - [1024, 64, 1, 512, 1024, 1024, 1024, 64]
    - [5, 2853.27]
- null
