HostLibraryTests/configs/lite_configs_mixed/arcturus_Cijk_Alik_Bljk_SB.yaml
- {MinimumRequiredVersion: 4.12.0}
- arcturus
- gfx908
- [Device 7380, Device 7388, Device 738c]
    SolutionIndex: 0
    SolutionNameMin: Cijk_Alik_Bljk_SB_MT64x128x16_SE_AMAS2_GRVW4_GSU1_VW4
    SolutionIndex: 1
    SolutionNameMin: Cijk_Alik_Bljk_SB_MT128x128x16_SE_AMAS2_GRVW4_GSU1_VW4
    SolutionIndex: 2
    SolutionNameMin: Cijk_Alik_Bljk_SB_MT128x64x16_SE_AMAS2_GRVW4_GSU1_VW4
    SolutionIndex: 3
    SolutionNameMin: Cijk_Alik_Bljk_SB_MT32x32x32_SE_AMAS2_GRVW4_GSU1_VW4
    SolutionIndex: 4
    SolutionNameMin: Cijk_Alik_Bljk_SB_MT32x64x16_SE_AMAS2_GRVW4_GSU1_VW4
    SolutionIndex: 5
    SolutionNameMin: Cijk_Alik_Bljk_SB_MT32x32x32_SE_AMAS3_GRVW4_GSU4_VW4
    SolutionIndex: 6
    SolutionNameMin: Cijk_Alik_Bljk_SB_MT32x64x16_SE_AMAS3_GRVW4_GSU1_VW4
    SolutionIndex: 7
    SolutionNameMin: Cijk_Alik_Bljk_SB_MT64x64x16_SE_AMAS3_GRVW4_GSU4_VW4
    SolutionIndex: 8
    SolutionNameMin: Cijk_Alik_Bljk_SB_MT64x32x16_SE_AMAS3_GRVW4_GSU1_VW4
    SolutionIndex: 9
    SolutionNameMin: Cijk_Alik_Bljk_SB_MT64x64x16_SE_AMAS3_GRVW4_GSU2_VW4
    SolutionIndex: 10
    SolutionNameMin: Cijk_Alik_Bljk_SB_MT32x32x32_SE_AMAS3_GRVW4_GSU8_VW4
    SolutionIndex: 11
    SolutionNameMin: Cijk_Alik_Bljk_SB_MT64x128x16_SE_AMAS3_GRVW4_GSU1_VW4
    SolutionIndex: 12
    SolutionNameMin: Cijk_Alik_Bljk_SB_MT64x64x16_SE_AMAS3_GRVW4_GSU1_VW4
    SolutionIndex: 13
    SolutionNameMin: Cijk_Alik_Bljk_SB_MT128x128x16_SE_AMAS3_GRVW4_GSU1_VW4
    SolutionIndex: 14
    SolutionNameMin: Cijk_Alik_Bljk_SB_MT64x128x8_SE_AMAS0_GRVW1_GSU8_VW1
    SolutionIndex: 15
    SolutionNameMin: Cijk_Alik_Bljk_SB_MT32x64x16_SE_AMAS3_GRVW4_GSU2_VW4
    SolutionIndex: 16
    SolutionNameMin: Cijk_Alik_Bljk_SB_MT32x64x16_SE_AMAS3_GRVW4_GSU4_VW4
    SolutionIndex: 17
    SolutionNameMin: Cijk_Alik_Bljk_SB_MT128x64x16_SE_AMAS3_GRVW4_GSU1_VW4
    SolutionIndex: 18
    SolutionNameMin: Cijk_Alik_Bljk_SB_MT32x32x16_SE_AMAS3_GRVW4_GSU1_VW4
    SolutionIndex: 19
    SolutionNameMin: Cijk_Alik_Bljk_SB_MT64x32x16_SE_AMAS3_GRVW4_GSU4_VW4
    SolutionIndex: 20
    SolutionNameMin: Cijk_Alik_Bljk_SB_MT128x64x8_SE_AMAS0_GRVW1_GSU8_VW1
    SolutionIndex: 21
    SolutionNameMin: Cijk_Alik_Bljk_SB_MT32x32x32_SE_AMAS3_GRVW4_GSU2_VW4
    SolutionIndex: 22
    SolutionNameMin: Cijk_Alik_Bljk_SB_MT64x32x16_SE_AMAS3_GRVW4_GSU2_VW4
    SolutionIndex: 23
    SolutionNameMin: Cijk_Alik_Bljk_SB_MT16x16x4_SE_AMAS2_GRVW2_GSU1_VW2
    SolutionIndex: 24
    SolutionNameMin: Cijk_Alik_Bljk_SB_MT16x16x4_SE_AMAS0_GRVW1_GSU1_VW1
    SolutionIndex: 25
    SolutionNameMin: Cijk_Alik_Bljk_SB_MT8x8x8_SE_AMAS3_GRVW2_GSU2_VW2
    SolutionIndex: 26
    SolutionNameMin: Cijk_Alik_Bljk_SB_MT8x8x8_SE_AMAS3_GRVW2_GSU4_VW2
    SolutionIndex: 27
    SolutionNameMin: Cijk_Alik_Bljk_SB_MT8x8x8_SE_AMAS3_GRVW2_GSU8_VW2
    SolutionIndex: 28
    SolutionNameMin: Cijk_Alik_Bljk_SB_MT8x8x8_SE_AMAS0_GRVW1_GSU2_VW1
    SolutionIndex: 29
    SolutionNameMin: Cijk_Alik_Bljk_SB_MT8x8x8_SE_AMAS0_GRVW1_GSU4_VW1
    SolutionIndex: 30
    SolutionNameMin: Cijk_Alik_Bljk_SB_MT8x8x8_SE_AMAS0_GRVW1_GSU8_VW1
- - - [6784, 448, 1, 256, 6784, 6784, 256, 256]
    - [12, 2943.57]
  - - [1856, 6784, 1, 3328, 1856, 1856, 3328, 3328]
    - [11, 4030.09]
  - - [704, 448, 1, 3328, 704, 704, 3328, 3328]
    - [14, 2175.48]
  - - [2944, 704, 1, 3328, 2944, 2944, 3328, 3328]
    - [8, 3058.29]
  - - [3584, 4288, 1, 128, 3584, 3584, 128, 128]
    - [0, 2020.31]
  - - [704, 1856, 1, 768, 704, 704, 768, 768]
    - [12, 2918.47]
  - - [4, 3584, 1, 128, 4, 4, 128, 128]
    - [23, 33.0993]
  - - [5056, 1856, 1, 128, 5056, 5056, 128, 128]
    - [0, 2128.18]
  - - [3584, 2368, 1, 128, 3584, 3584, 128, 128]
    - [0, 1823.18]
  - - [1408, 2944, 1, 1792, 1408, 1408, 1792, 1792]
    - [11, 3301.5]
  - - [128, 4, 1, 128, 128, 128, 128, 128]
    - [23, 1.26812]
  - - [64, 1024, 1, 128, 64, 64, 128, 128]
    - [3, 84.223]
  - - [1408, 1024, 1, 256, 1408, 1408, 256, 256]
    - [12, 2912.71]
  - - [3584, 5056, 1, 768, 3584, 3584, 768, 768]
    - [13, 3954.96]
  - - [704, 4, 1, 1792, 704, 704, 1792, 1792]
    - [27, 67.4635]
  - - [1408, 128, 1, 3328, 1408, 1408, 3328, 3328]
    - [15, 1769.49]
  - - [2368, 2944, 1, 768, 2368, 2368, 768, 768]
    - [13, 3795.25]
  - - [3584, 1024, 1, 256, 3584, 3584, 256, 256]
    - [13, 3309.12]
  - - [2368, 2368, 1, 3328, 2368, 2368, 3328, 3328]
    - [11, 3898.8]
  - - [128, 128, 1, 1792, 128, 128, 1792, 1792]
    - [5, 316.927]
  - - [256, 4, 1, 1792, 256, 256, 1792, 1792]
    - [27, 28.1789]
  - - [4288, 5888, 1, 256, 4288, 4288, 256, 256]
    - [11, 3885.39]
  - - [448, 5888, 1, 256, 448, 448, 256, 256]
    - [12, 2938.06]
  - - [256, 2368, 1, 128, 256, 256, 128, 128]
    - [0, 570.549]
  - - [5888, 5888, 1, 768, 5888, 5888, 768, 768]
    - [13, 4257.51]
  - - [3584, 4, 1, 1792, 3584, 3584, 1792, 1792]
    - [25, 117.715]
  - - [1856, 2944, 1, 1792, 1856, 1856, 1792, 1792]
    - [13, 3791.67]
  - - [704, 4, 1, 768, 704, 704, 768, 768]
    - [27, 36.0448]
  - - [64, 256, 1, 256, 64, 64, 256, 256]
    - [18, 126.64]
  - - [1856, 128, 1, 768, 1856, 1856, 768, 768]
    - [8, 1840.72]
  - - [5888, 4, 1, 3328, 5888, 5888, 3328, 3328]
    - [30, 65.0705]
  - - [4288, 704, 1, 256, 4288, 4288, 256, 256]
    - [12, 2925.5]
  - - [6784, 128, 1, 3328, 6784, 6784, 3328, 3328]
    - [12, 3041.21]
  - - [3584, 6784, 1, 1792, 3584, 3584, 1792, 1792]
    - [17, 4076.21]
  - - [2368, 3584, 1, 128, 2368, 2368, 128, 128]
    - [0, 2093.92]
  - - [1408, 4, 1, 256, 1408, 1408, 256, 256]
    - [26, 24.9618]
  - - [448, 448, 1, 768, 448, 448, 768, 768]
    - [8, 1583.2]
  - - [4, 1408, 1, 768, 4, 4, 768, 768]
    - [30, 63.9092]
  - - [5056, 256, 1, 128, 5056, 5056, 128, 128]
    - [0, 950.407]
  - - [1856, 5056, 1, 3328, 1856, 1856, 3328, 3328]
    - [11, 3919.67]
  - - [5056, 704, 1, 3328, 5056, 5056, 3328, 3328]
    - [13, 4014.64]
  - - [4288, 448, 1, 1792, 4288, 4288, 1792, 1792]
    - [17, 3871.78]
  - - [256, 6784, 1, 256, 256, 256, 256, 256]
    - [11, 2962.39]
  - - [3584, 2368, 1, 3328, 3584, 3584, 3328, 3328]
    - [17, 3884.3]
  - - [5056, 4, 1, 3328, 5056, 5056, 3328, 3328]
    - [28, 65.1178]
  - - [704, 1024, 1, 768, 704, 704, 768, 768]
    - [8, 2657.68]
  - - [2944, 256, 1, 1792, 2944, 2944, 1792, 1792]
    - [12, 2601.64]
  - - [2944, 256, 1, 3328, 2944, 2944, 3328, 3328]
    - [12, 2644.21]
  - - [6784, 64, 1, 1792, 6784, 6784, 1792, 1792]
    - [8, 2748.88]
  - - [6784, 1408, 1, 128, 6784, 6784, 128, 128]
    - [0, 2037.19]
  - - [4288, 5888, 1, 768, 4288, 4288, 768, 768]
    - [13, 4051.46]
  - - [4288, 2944, 1, 768, 4288, 4288, 768, 768]
    - [11, 3964.71]
  - - [64, 2368, 1, 768, 64, 64, 768, 768]
    - [18, 1125.21]
  - - [1408, 4288, 1, 128, 1408, 1408, 128, 128]
    - [0, 1802.58]
  - - [1408, 3584, 1, 128, 1408, 1408, 128, 128]
    - [0, 1707.71]
  - - [1408, 5056, 1, 3328, 1408, 1408, 3328, 3328]
    - [13, 4045.69]
  - - [1856, 1856, 1, 256, 1856, 1856, 256, 256]
    - [13, 3092.05]
  - - [1024, 4288, 1, 1792, 1024, 1024, 1792, 1792]
    - [17, 3493.15]
  - - [2944, 1408, 1, 3328, 2944, 2944, 3328, 3328]
    - [8, 3326.29]
  - - [2368, 4, 1, 256, 2368, 2368, 256, 256]
    - [26, 40.8496]
  - - [4288, 5888, 1, 3328, 4288, 4288, 3328, 3328]
    - [13, 4134.11]
  - - [1024, 6784, 1, 768, 1024, 1024, 768, 768]
    - [13, 3655.82]
  - - [3584, 4288, 1, 1792, 3584, 3584, 1792, 1792]
    - [13, 4280.89]
  - - [6784, 256, 1, 768, 6784, 6784, 768, 768]
    - [11, 3407.39]
  - - [2368, 1856, 1, 3328, 2368, 2368, 3328, 3328]
    - [11, 3507.78]
  - - [4288, 1408, 1, 768, 4288, 4288, 768, 768]
    - [11, 3446.52]
  - - [2368, 6784, 1, 256, 2368, 2368, 256, 256]
    - [11, 3706.31]
  - - [1024, 128, 1, 1792, 1024, 1024, 1792, 1792]
    - [6, 1127.5]
  - - [448, 704, 1, 1792, 448, 448, 1792, 1792]
    - [8, 2004.76]
  - - [4288, 4288, 1, 256, 4288, 4288, 256, 256]
    - [11, 3764.68]
  - - [5888, 1408, 1, 128, 5888, 5888, 128, 128]
    - [0, 1861.42]
  - - [5056, 5888, 1, 256, 5056, 5056, 256, 256]
    - [13, 3881.64]
  - - [128, 1408, 1, 256, 128, 128, 256, 256]
    - [6, 1046.67]
  - - [2944, 6784, 1, 3328, 2944, 2944, 3328, 3328]
    - [17, 3968.68]
  - - [1024, 5888, 1, 768, 1024, 1024, 768, 768]
    - [17, 3432.04]
  - - [2944, 704, 1, 1792, 2944, 2944, 1792, 1792]
    - [8, 2996.75]
  - - [3584, 5056, 1, 256, 3584, 3584, 256, 256]
    - [17, 3735.99]
  - - [6784, 4, 1, 768, 6784, 6784, 768, 768]
    - [27, 193.541]
  - - [704, 2944, 1, 3328, 704, 704, 3328, 3328]
    - [8, 3111.93]
  - - [2944, 1856, 1, 768, 2944, 2944, 768, 768]
    - [11, 3682.09]
  - - [3584, 128, 1, 768, 3584, 3584, 768, 768]
    - [8, 2610.56]
  - - [128, 1856, 1, 128, 128, 128, 128, 128]
    - [3, 277.654]
  - - [5056, 64, 1, 1792, 5056, 5056, 1792, 1792]
    - [8, 2048.69]
  - - [5888, 6784, 1, 3328, 5888, 5888, 3328, 3328]
    - [13, 4169.73]
  - - [1856, 3584, 1, 3328, 1856, 1856, 3328, 3328]
    - [11, 3872.86]
  - - [2368, 1856, 1, 128, 2368, 2368, 128, 128]
    - [0, 1784.32]
  - - [5888, 5056, 1, 768, 5888, 5888, 768, 768]
    - [13, 4098.87]
  - - [1408, 4288, 1, 256, 1408, 1408, 256, 256]
    - [12, 3255.82]
  - - [4288, 4, 1, 256, 4288, 4288, 256, 256]
    - [26, 67.9287]
  - - [2368, 64, 1, 1792, 2368, 2368, 1792, 1792]
    - [5, 1292.26]
  - - [448, 1408, 1, 256, 448, 448, 256, 256]
    - [8, 1898.88]
  - - [5888, 1408, 1, 256, 5888, 5888, 256, 256]
    - [17, 3480.58]
  - - [1856, 704, 1, 1792, 1856, 1856, 1792, 1792]
    - [12, 3009.91]
  - - [4, 2944, 1, 128, 4, 4, 128, 128]
    - [23, 27.0715]
  - - [5056, 256, 1, 256, 5056, 5056, 256, 256]
    - [12, 2618.13]
  - - [4, 1024, 1, 256, 4, 4, 256, 256]
    - [26, 17.9305]
  - - [1408, 2944, 1, 128, 1408, 1408, 128, 128]
    - [0, 1623.96]
  - - [448, 5888, 1, 128, 448, 448, 128, 128]
    - [0, 1622.03]
  - - [1856, 256, 1, 128, 1856, 1856, 128, 128]
    - [3, 531.993]
  - - [2368, 64, 1, 3328, 2368, 2368, 3328, 3328]
    - [5, 1602.99]
  - - [1024, 256, 1, 1792, 1024, 1024, 1792, 1792]
    - [8, 1670.56]
  - - [2944, 4288, 1, 3328, 2944, 2944, 3328, 3328]
    - [17, 4025.95]
  - - [704, 1024, 1, 1792, 704, 704, 1792, 1792]
    - [8, 2814.72]
  - - [1856, 4, 1, 3328, 1856, 1856, 3328, 3328]
    - [27, 206.72]
  - - [5888, 64, 1, 256, 5888, 5888, 256, 256]
    - [8, 1715.31]
  - - [256, 256, 1, 768, 256, 256, 768, 768]
    - [18, 682.37]
  - - [448, 6784, 1, 256, 448, 448, 256, 256]
    - [12, 2944.46]
  - - [1408, 2368, 1, 1792, 1408, 1408, 1792, 1792]
    - [13, 3702.04]
  - - [5056, 1024, 1, 768, 5056, 5056, 768, 768]
    - [11, 3532.77]
  - - [6784, 704, 1, 256, 6784, 6784, 256, 256]
    - [17, 3313.75]
  - - [5056, 448, 1, 1792, 5056, 5056, 1792, 1792]
    - [8, 3023.9]
  - - [128, 5056, 1, 128, 128, 128, 128, 128]
    - [0, 625.661]
  - - [5056, 2944, 1, 768, 5056, 5056, 768, 768]
    - [13, 4097.22]
  - - [704, 3584, 1, 1792, 704, 704, 1792, 1792]
    - [11, 3194.21]
  - - [5888, 1024, 1, 128, 5888, 5888, 128, 128]
    - [0, 1765.54]
  - - [4, 4288, 1, 128, 4, 4, 128, 128]
    - [23, 39.261]
  - - [5888, 448, 1, 1792, 5888, 5888, 1792, 1792]
    - [17, 3342.61]
  - - [704, 4288, 1, 128, 704, 704, 128, 128]
    - [0, 1489.36]
  - - [448, 1856, 1, 768, 448, 448, 768, 768]
    - [12, 2740.23]
  - - [128, 5888, 1, 1792, 128, 128, 1792, 1792]
    - [12, 2594.05]
  - - [64, 64, 1, 128, 64, 64, 128, 128]
    - [3, 5.116]
  - - [1024, 3584, 1, 1792, 1024, 1024, 1792, 1792]
    - [13, 4012.71]
  - - [2368, 1024, 1, 1792, 2368, 2368, 1792, 1792]
    - [8, 3246.64]
  - - [4, 704, 1, 128, 4, 4, 128, 128]
    - [24, 6.40006]
  - - [128, 3584, 1, 1792, 128, 128, 1792, 1792]
    - [6, 2830.09]
  - - [4, 1024, 1, 1792, 4, 4, 1792, 1792]
    - [27, 91.8428]
  - - [5888, 2944, 1, 128, 5888, 5888, 128, 128]
    - [0, 2074.41]
  - - [256, 2944, 1, 128, 256, 256, 128, 128]
    - [4, 680.893]
  - - [5056, 3584, 1, 3328, 5056, 5056, 3328, 3328]
    - [13, 4142.97]
  - - [448, 704, 1, 768, 448, 448, 768, 768]
    - [8, 1848.45]
  - - [6784, 2944, 1, 3328, 6784, 6784, 3328, 3328]
    - [17, 3965.71]
  - - [4288, 256, 1, 256, 4288, 4288, 256, 256]
    - [12, 2240.26]
  - - [2368, 1856, 1, 1792, 2368, 2368, 1792, 1792]
    - [17, 3486.99]
  - - [448, 6784, 1, 768, 448, 448, 768, 768]
    - [13, 3178.98]
  - - [256, 3584, 1, 3328, 256, 256, 3328, 3328]
    - [8, 3044.44]
  - - [5056, 704, 1, 1792, 5056, 5056, 1792, 1792]
    - [13, 3940.45]
  - - [1408, 704, 1, 3328, 1408, 1408, 3328, 3328]
    - [20, 2643.46]
  - - [128, 256, 1, 128, 128, 128, 128, 128]
    - [3, 41.1206]
  - - [1024, 1856, 1, 256, 1024, 1024, 256, 256]
    - [17, 3247.06]
  - - [2368, 1024, 1, 256, 2368, 2368, 256, 256]
    - [12, 3130.08]
  - - [4, 2368, 1, 768, 4, 4, 768, 768]
    - [29, 94.6214]
  - - [2944, 1408, 1, 768, 2944, 2944, 768, 768]
    - [12, 3244.21]
  - - [704, 5056, 1, 3328, 704, 704, 3328, 3328]
    - [13, 4014.32]
  - - [704, 448, 1, 768, 704, 704, 768, 768]
    - [8, 1858.66]
  - - [2944, 4288, 1, 768, 2944, 2944, 768, 768]
    - [17, 3954.88]
  - - [4, 128, 1, 768, 4, 4, 768, 768]
    - [27, 7.8019]
  - - [4, 3584, 1, 3328, 4, 4, 3328, 3328]
    - [25, 68.3061]
  - - [448, 5888, 1, 3328, 448, 448, 3328, 3328]
    - [11, 3315.82]
  - - [4, 2944, 1, 1792, 4, 4, 1792, 1792]
    - [26, 192.543]
  - - [5888, 256, 1, 768, 5888, 5888, 768, 768]
    - [17, 2967.67]
  - - [128, 128, 1, 768, 128, 128, 768, 768]
    - [18, 172.463]
  - - [4288, 2944, 1, 256, 4288, 4288, 256, 256]
    - [11, 3751.87]
  - - [256, 2368, 1, 1792, 256, 256, 1792, 1792]
    - [8, 2316.85]
  - - [5888, 1856, 1, 3328, 5888, 5888, 3328, 3328]
    - [13, 4137.71]
  - - [704, 5056, 1, 768, 704, 704, 768, 768]
    - [13, 3712.17]
  - - [4, 3584, 1, 768, 4, 4, 768, 768]
    - [29, 132.972]
  - - [704, 5888, 1, 1792, 704, 704, 1792, 1792]
    - [8, 3308.8]
  - - [5888, 704, 1, 1792, 5888, 5888, 1792, 1792]
    - [17, 3301.03]
  - - [448, 64, 1, 1792, 448, 448, 1792, 1792]
    - [5, 483.624]
  - - [3584, 2368, 1, 256, 3584, 3584, 256, 256]
    - [17, 3509.71]
  - - [4288, 64, 1, 128, 4288, 4288, 128, 128]
    - [3, 324.772]
  - - [128, 4288, 1, 128, 128, 128, 128, 128]
    - [0, 530.624]
  - - [1856, 6784, 1, 256, 1856, 1856, 256, 256]
    - [11, 3743.18]
  - - [4, 64, 1, 256, 4, 4, 256, 256]
    - [30, 1.64498]
  - - [256, 704, 1, 128, 256, 256, 128, 128]
    - [3, 215.193]
  - - [4288, 1856, 1, 128, 4288, 4288, 128, 128]
    - [0, 1993.68]
  - - [5888, 2368, 1, 256, 5888, 5888, 256, 256]
    - [17, 3646.66]
  - - [1856, 5056, 1, 256, 1856, 1856, 256, 256]
    - [11, 3562.96]
  - - [5888, 5888, 1, 3328, 5888, 5888, 3328, 3328]
    - [13, 4401.47]
  - - [6784, 1408, 1, 768, 6784, 6784, 768, 768]
    - [11, 3923.75]
  - - [4, 6784, 1, 768, 4, 4, 768, 768]
    - [26, 170.936]
  - - [2368, 4, 1, 3328, 2368, 2368, 3328, 3328]
    - [26, 194.298]
  - - [128, 3584, 1, 256, 128, 128, 256, 256]
    - [6, 2000.01]
  - - [4, 256, 1, 3328, 4, 4, 3328, 3328]
    - [27, 39.7373]
  - - [2368, 1024, 1, 768, 2368, 2368, 768, 768]
    - [12, 3355.2]
  - - [1024, 256, 1, 3328, 1024, 1024, 3328, 3328]
    - [8, 1718.16]
  - - [2944, 2368, 1, 256, 2944, 2944, 256, 256]
    - [17, 3307.9]
  - - [704, 5056, 1, 1792, 704, 704, 1792, 1792]
    - [13, 3933.26]
  - - [1024, 5056, 1, 1792, 1024, 1024, 1792, 1792]
    - [17, 3591.48]
  - - [6784, 2944, 1, 768, 6784, 6784, 768, 768]
    - [13, 3946.89]
  - - [1408, 128, 1, 768, 1408, 1408, 768, 768]
    - [8, 1432.24]
  - - [6784, 2944, 1, 256, 6784, 6784, 256, 256]
    - [11, 3772.77]
  - - [2944, 64, 1, 128, 2944, 2944, 128, 128]
    - [3, 226.496]
  - - [64, 4, 1, 768, 64, 64, 768, 768]
    - [27, 4.33439]
  - - [128, 2368, 1, 768, 128, 128, 768, 768]
    - [6, 1750.78]
  - - [64, 704, 1, 256, 64, 64, 256, 256]
    - [18, 348.259]
  - - [2368, 5056, 1, 1792, 2368, 2368, 1792, 1792]
    - [17, 3814.29]
  - - [704, 5888, 1, 3328, 704, 704, 3328, 3328]
    - [8, 3277.49]
  - - [448, 1408, 1, 3328, 448, 448, 3328, 3328]
    - [8, 2535.08]
  - - [256, 1024, 1, 256, 256, 256, 256, 256]
    - [8, 1200.09]
  - - [4, 6784, 1, 256, 4, 4, 256, 256]
    - [26, 92.084]
  - - [5888, 64, 1, 3328, 5888, 5888, 3328, 3328]
    - [8, 2466.36]
  - - [3584, 1408, 1, 768, 3584, 3584, 768, 768]
    - [11, 3446.52]
  - - [4288, 1856, 1, 3328, 4288, 4288, 3328, 3328]
    - [11, 3628.42]
  - - [3584, 1856, 1, 128, 3584, 3584, 128, 128]
    - [0, 1793.87]
  - - [6784, 1024, 1, 256, 6784, 6784, 256, 256]
    - [13, 3389.72]
  - - [5056, 2368, 1, 256, 5056, 5056, 256, 256]
    - [17, 3555.34]
  - - [128, 448, 1, 1792, 128, 128, 1792, 1792]
    - [5, 785.15]
  - - [256, 2944, 1, 256, 256, 256, 256, 256]
    - [12, 2117.41]
  - - [2944, 448, 1, 1792, 2944, 2944, 1792, 1792]
    - [8, 2898.71]
  - - [3584, 1856, 1, 1792, 3584, 3584, 1792, 1792]
    - [17, 3844.44]
  - - [4288, 4, 1, 128, 4288, 4288, 128, 128]
    - [23, 39.487]
  - - [1024, 1408, 1, 768, 1024, 1024, 768, 768]
    - [12, 3197.32]
  - - [1856, 1024, 1, 768, 1856, 1856, 768, 768]
    - [11, 3735.71]
  - - [448, 2368, 1, 256, 448, 448, 256, 256]
    - [12, 2156.78]
  - - [1024, 6784, 1, 3328, 1024, 1024, 3328, 3328]
    - [13, 3923.21]
  - - [1408, 2368, 1, 3328, 1408, 1408, 3328, 3328]
    - [13, 3768.93]
  - - [64, 4, 1, 1792, 64, 64, 1792, 1792]
    - [27, 7.77019]
  - - [128, 704, 1, 3328, 128, 128, 3328, 3328]
    - [5, 1338.33]
  - - [5888, 1408, 1, 1792, 5888, 5888, 1792, 1792]
    - [11, 3775.83]
  - - [6784, 1856, 1, 256, 6784, 6784, 256, 256]
    - [17, 3715.56]
  - - [2368, 2368, 1, 768, 2368, 2368, 768, 768]
    - [11, 3788.54]
  - - [2368, 128, 1, 256, 2368, 2368, 256, 256]
    - [8, 1385.62]
  - - [3584, 6784, 1, 3328, 3584, 3584, 3328, 3328]
    - [17, 4089.55]
  - - [2368, 3584, 1, 256, 2368, 2368, 256, 256]
    - [11, 3546.84]
  - - [64, 3584, 1, 1792, 64, 64, 1792, 1792]
    - [18, 1869.05]
  - - [6784, 256, 1, 3328, 6784, 6784, 3328, 3328]
    - [11, 3590.44]
  - - [704, 2368, 1, 256, 704, 704, 256, 256]
    - [17, 2813.62]
  - - [4288, 4288, 1, 3328, 4288, 4288, 3328, 3328]
    - [13, 4200.33]
  - - [3584, 1856, 1, 256, 3584, 3584, 256, 256]
    - [17, 3429.92]
  - - [128, 128, 1, 3328, 128, 128, 3328, 3328]
    - [5, 453.174]
  - - [1856, 128, 1, 256, 1856, 1856, 256, 256]
    - [8, 1288.5]
  - - [3584, 448, 1, 256, 3584, 3584, 256, 256]
    - [17, 2757.93]
  - - [2944, 1856, 1, 3328, 2944, 2944, 3328, 3328]
    - [13, 3843.19]
  - - [1024, 5056, 1, 256, 1024, 1024, 256, 256]
    - [12, 3265.82]
  - - [448, 64, 1, 256, 448, 448, 256, 256]
    - [18, 221.619]
  - - [2368, 5888, 1, 768, 2368, 2368, 768, 768]
    - [13, 3866.96]
  - - [4, 5888, 1, 128, 4, 4, 128, 128]
    - [23, 53.6802]
  - - [1856, 5056, 1, 128, 1856, 1856, 128, 128]
    - [0, 2132.41]
  - - [5056, 4288, 1, 1792, 5056, 5056, 1792, 1792]
    - [13, 4091.25]
  - - [5888, 4, 1, 1792, 5888, 5888, 1792, 1792]
    - [25, 129.91]
  - - [6784, 448, 1, 768, 6784, 6784, 768, 768]
    - [13, 3174.83]
  - - [64, 1408, 1, 3328, 64, 64, 3328, 3328]
    - [5, 1321.81]
  - - [1024, 3584, 1, 128, 1024, 1024, 128, 128]
    - [0, 1464.35]
  - - [448, 2944, 1, 3328, 448, 448, 3328, 3328]
    - [8, 2964.17]
  - - [64, 1024, 1, 3328, 64, 64, 3328, 3328]
    - [5, 988.505]
  - - [4, 1024, 1, 768, 4, 4, 768, 768]
    - [27, 48.0117]
  - - [704, 128, 1, 3328, 704, 704, 3328, 3328]
    - [5, 1347.95]
  - - [2944, 6784, 1, 768, 2944, 2944, 768, 768]
    - [11, 3940.81]
  - - [4288, 1024, 1, 128, 4288, 4288, 128, 128]
    - [0, 1778.6]
  - - [1408, 256, 1, 128, 1408, 1408, 128, 128]
    - [3, 427.514]
  - - [3584, 6784, 1, 256, 3584, 3584, 256, 256]
    - [17, 3841.81]
  - - [704, 704, 1, 3328, 704, 704, 3328, 3328]
    - [7, 2221.25]
  - - [1408, 6784, 1, 128, 1408, 1408, 128, 128]
    - [0, 2040.18]
  - - [6784, 448, 1, 128, 6784, 6784, 128, 128]
    - [1, 1378.73]
  - - [4, 2944, 1, 3328, 4, 4, 3328, 3328]
    - [25, 158.538]
  - - [4288, 2368, 1, 3328, 4288, 4288, 3328, 3328]
    - [13, 3860.23]
  - - [64, 128, 1, 256, 64, 64, 256, 256]
    - [18, 63.1672]
  - - [256, 128, 1, 768, 256, 256, 768, 768]
    - [18, 349.914]
  - - [2944, 2944, 1, 256, 2944, 2944, 256, 256]
    - [11, 3614.13]
  - - [1856, 2944, 1, 128, 1856, 1856, 128, 128]
    - [0, 1932.9]
  - - [128, 64, 1, 768, 128, 128, 768, 768]
    - [5, 92.9589]
  - - [64, 704, 1, 768, 64, 64, 768, 768]
    - [18, 477.415]
  - - [3584, 128, 1, 1792, 3584, 3584, 1792, 1792]
    - [8, 2880.06]
  - - [256, 1856, 1, 3328, 256, 256, 3328, 3328]
    - [8, 3101.47]
  - - [128, 6784, 1, 1792, 128, 128, 1792, 1792]
    - [12, 2990.64]
  - - [1856, 4288, 1, 128, 1856, 1856, 128, 128]
    - [0, 1988.7]
  - - [64, 64, 1, 256, 64, 64, 256, 256]
    - [18, 27.8877]
  - - [2368, 6784, 1, 128, 2368, 2368, 128, 128]
    - [0, 2192.74]
  - - [3584, 3584, 1, 256, 3584, 3584, 256, 256]
    - [11, 3607.21]
  - - [1408, 5888, 1, 768, 1408, 1408, 768, 768]
    - [11, 3719.54]
  - - [2944, 4, 1, 128, 2944, 2944, 128, 128]
    - [23, 27.1495]
  - - [256, 448, 1, 768, 256, 256, 768, 768]
    - [6, 936.229]
  - - [2368, 5056, 1, 256, 2368, 2368, 256, 256]
    - [17, 3540.88]
  - - [448, 4, 1, 1792, 448, 448, 1792, 1792]
    - [27, 46.2452]
  - - [2368, 4288, 1, 256, 2368, 2368, 256, 256]
    - [11, 3489.34]
  - - [5888, 256, 1, 128, 5888, 5888, 128, 128]
    - [0, 1044.49]
  - - [448, 2944, 1, 1792, 448, 448, 1792, 1792]
    - [8, 2911.28]
  - - [4, 6784, 1, 1792, 4, 4, 1792, 1792]
    - [27, 97.5212]
  - - [128, 704, 1, 256, 128, 128, 256, 256]
    - [18, 639.376]
  - - [256, 2944, 1, 1792, 256, 256, 1792, 1792]
    - [12, 2602.85]
  - - [256, 128, 1, 1792, 256, 256, 1792, 1792]
    - [5, 534.988]
  - - [4, 704, 1, 256, 4, 4, 256, 256]
    - [27, 13.1743]
  - - [448, 6784, 1, 1792, 448, 448, 1792, 1792]
    - [13, 3359.6]
  - - [1024, 1024, 1, 3328, 1024, 1024, 3328, 3328]
    - [12, 2427.02]
  - - [2368, 5888, 1, 128, 2368, 2368, 128, 128]
    - [0, 2166.5]
  - - [1408, 3584, 1, 256, 1408, 1408, 256, 256]
    - [12, 3192.58]
  - - [1856, 64, 1, 128, 1856, 1856, 128, 128]
    - [3, 145.413]
  - - [4, 704, 1, 768, 4, 4, 768, 768]
    - [30, 35.0176]
  - - [128, 704, 1, 1792, 128, 128, 1792, 1792]
    - [5, 998.767]
  - - [128, 4, 1, 3328, 128, 128, 3328, 3328]
    - [27, 20.2464]
  - - [128, 1856, 1, 3328, 128, 128, 3328, 3328]
    - [22, 2233.92]
  - - [1408, 1408, 1, 3328, 1408, 1408, 3328, 3328]
    - [20, 2886.11]
  - - [4288, 2944, 1, 3328, 4288, 4288, 3328, 3328]
    - [11, 3791.37]
  - - [5056, 1408, 1, 128, 5056, 5056, 128, 128]
    - [0, 1987.81]
  - - [6784, 3584, 1, 1792, 6784, 6784, 1792, 1792]
    - [17, 4079.08]
  - - [3584, 448, 1, 3328, 3584, 3584, 3328, 3328]
    - [17, 3323.76]
  - - [128, 2944, 1, 768, 128, 128, 768, 768]
    - [6, 2139.32]
  - - [1408, 448, 1, 1792, 1408, 1408, 1792, 1792]
    - [8, 2447.1]
  - - [448, 5056, 1, 256, 448, 448, 256, 256]
    - [12, 2941.67]
  - - [256, 448, 1, 256, 256, 256, 256, 256]
    - [18, 756.704]
  - - [1024, 1408, 1, 128, 1024, 1024, 128, 128]
    - [0, 937.37]
  - - [5056, 5056, 1, 3328, 5056, 5056, 3328, 3328]
    - [13, 4177.95]
  - - [2944, 704, 1, 768, 2944, 2944, 768, 768]
    - [12, 2873.17]
  - - [4288, 128, 1, 1792, 4288, 4288, 1792, 1792]
    - [8, 2099.84]
  - - [5888, 2944, 1, 768, 5888, 5888, 768, 768]
    - [11, 3976.61]
  - - [4288, 4, 1, 768, 4288, 4288, 768, 768]
    - [26, 151.063]
  - - [448, 1024, 1, 128, 448, 448, 128, 128]
    - [3, 515.452]
  - - [4, 1408, 1, 256, 4, 4, 256, 256]
    - [26, 24.2237]
  - - [128, 704, 1, 768, 128, 128, 768, 768]
    - [18, 905.838]
  - - [2944, 64, 1, 3328, 2944, 2944, 3328, 3328]
    - [22, 1865.77]
  - - [448, 2368, 1, 768, 448, 448, 768, 768]
    - [8, 2550.54]
  - - [128, 1024, 1, 128, 128, 128, 128, 128]
    - [3, 170.778]
  - - [5056, 704, 1, 256, 5056, 5056, 256, 256]
    - [17, 3184.28]
  - - [256, 4, 1, 3328, 256, 256, 3328, 3328]
    - [27, 38.6205]
  - - [448, 1408, 1, 768, 448, 448, 768, 768]
    - [8, 2334.44]
  - - [3584, 2368, 1, 768, 3584, 3584, 768, 768]
    - [11, 3764.82]
  - - [2368, 1408, 1, 256, 2368, 2368, 256, 256]
    - [12, 3194.39]
  - - [1024, 704, 1, 3328, 1024, 1024, 3328, 3328]
    - [12, 2523.29]
  - - [4, 1408, 1, 3328, 4, 4, 3328, 3328]
    - [27, 174.066]
  - - [1408, 2368, 1, 128, 1408, 1408, 128, 128]
    - [0, 1575.96]
  - - [1856, 2944, 1, 768, 1856, 1856, 768, 768]
    - [11, 3723.65]
  - - [3584, 2944, 1, 768, 3584, 3584, 768, 768]
    - [11, 3893.92]
  - - [4, 128, 1, 1792, 4, 4, 1792, 1792]
    - [27, 14.39]
  - - [256, 4288, 1, 3328, 256, 256, 3328, 3328]
    - [8, 2778.39]
  - - [448, 448, 1, 3328, 448, 448, 3328, 3328]
    - [22, 1923.8]
  - - [3584, 1024, 1, 1792, 3584, 3584, 1792, 1792]
    - [13, 4049.68]
  - - [2944, 1408, 1, 1792, 2944, 2944, 1792, 1792]
    - [17, 3303.38]
  - - [1024, 4, 1, 256, 1024, 1024, 256, 256]
    - [30, 18.2046]
  - - [1024, 64, 1, 1792, 1024, 1024, 1792, 1792]
    - [5, 720.671]
  - - [4, 256, 1, 128, 4, 4, 128, 128]
    - [23, 2.35404]
  - - [64, 5056, 1, 3328, 64, 64, 3328, 3328]
    - [14, 2211.45]
  - - [704, 1024, 1, 256, 704, 704, 256, 256]
    - [8, 2139.95]
  - - [1024, 1408, 1, 3328, 1024, 1024, 3328, 3328]
    - [17, 2988.92]
  - - [704, 1024, 1, 128, 704, 704, 128, 128]
    - [0, 726.344]
  - - [4288, 128, 1, 128, 4288, 4288, 128, 128]
    - [0, 548.864]
  - - [5056, 2368, 1, 1792, 5056, 5056, 1792, 1792]
    - [17, 3815.7]
  - - [64, 2368, 1, 3328, 64, 64, 3328, 3328]
    - [15, 1505.39]
  - - [1408, 704, 1, 768, 1408, 1408, 768, 768]
    - [8, 2359.49]
  - - [1856, 5888, 1, 768, 1856, 1856, 768, 768]
    - [13, 3979.44]
  - - [1408, 1024, 1, 128, 1408, 1408, 128, 128]
    - [0, 1059.17]
  - - [1024, 2944, 1, 3328, 1024, 1024, 3328, 3328]
    - [13, 3405.1]
  - - [64, 4, 1, 128, 64, 64, 128, 128]
    - [23, 0.629192]
  - - [6784, 448, 1, 3328, 6784, 6784, 3328, 3328]
    - [13, 3422.91]
  - - [1408, 1856, 1, 1792, 1408, 1408, 1792, 1792]
    - [11, 3285.08]
  - - [3584, 256, 1, 3328, 3584, 3584, 3328, 3328]
    - [12, 3203.64]
  - - [5888, 1024, 1, 1792, 5888, 5888, 1792, 1792]
    - [11, 3495.53]
  - - [1024, 448, 1, 128, 1024, 1024, 128, 128]
    - [0, 474.162]
  - - [2368, 128, 1, 1792, 2368, 2368, 1792, 1792]
    - [8, 1926.65]
  - - [1856, 64, 1, 256, 1856, 1856, 256, 256]
    - [18, 796.874]
  - - [128, 2368, 1, 1792, 128, 128, 1792, 1792]
    - [6, 1878.67]
  - - [64, 6784, 1, 1792, 64, 64, 1792, 1792]
    - [8, 2248.16]
  - - [1024, 1024, 1, 1792, 1024, 1024, 1792, 1792]
    - [8, 2559.45]
  - - [2368, 2944, 1, 1792, 2368, 2368, 1792, 1792]
    - [13, 3923.01]
  - - [704, 2368, 1, 128, 704, 704, 128, 128]
    - [0, 1317.84]
  - - [1408, 5888, 1, 256, 1408, 1408, 256, 256]
    - [11, 3474.2]
  - - [1856, 2944, 1, 3328, 1856, 1856, 3328, 3328]
    - [13, 3847.74]
  - - [4288, 704, 1, 128, 4288, 4288, 128, 128]
    - [0, 1503.74]
  - - [6784, 704, 1, 1792, 6784, 6784, 1792, 1792]
    - [17, 3794.06]
  - - [2944, 1856, 1, 128, 2944, 2944, 128, 128]
    - [0, 1832.43]
  - - [1024, 1024, 1, 128, 1024, 1024, 128, 128]
    - [0, 732.95]
  - - [2368, 704, 1, 128, 2368, 2368, 128, 128]
    - [0, 1245.25]
  - - [64, 64, 1, 1792, 64, 64, 1792, 1792]
    - [5, 88.9917]
  - - [128, 704, 1, 128, 128, 128, 128, 128]
    - [3, 117.986]
  - - [5056, 5888, 1, 1792, 5056, 5056, 1792, 1792]
    - [13, 4231.37]
  - - [704, 704, 1, 256, 704, 704, 256, 256]
    - [8, 1516.22]
  - - [4288, 2368, 1, 1792, 4288, 4288, 1792, 1792]
    - [13, 3812.62]
  - - [5888, 6784, 1, 128, 5888, 5888, 128, 128]
    - [0, 2176.35]
  - - [128, 448, 1, 256, 128, 128, 256, 256]
    - [18, 436.907]
  - - [128, 5888, 1, 768, 128, 128, 768, 768]
    - [12, 2484.61]
  - - [64, 4288, 1, 128, 64, 64, 128, 128]
    - [3, 319.107]
  - - [64, 6784, 1, 768, 64, 64, 768, 768]
    - [8, 1971.66]
  - - [64, 128, 1, 128, 64, 64, 128, 128]
    - [3, 10.1922]
  - - [2944, 5888, 1, 1792, 2944, 2944, 1792, 1792]
    - [17, 4037.68]
  - - [3584, 4, 1, 3328, 3584, 3584, 3328, 3328]
    - [25, 63.0823]
  - - [4288, 2944, 1, 1792, 4288, 4288, 1792, 1792]
    - [11, 4012.7]
  - - [4, 6784, 1, 128, 4, 4, 128, 128]
    - [23, 62.1144]
  - - [704, 64, 1, 3328, 704, 704, 3328, 3328]
    - [5, 956.291]
  - - [2944, 448, 1, 3328, 2944, 2944, 3328, 3328]
    - [8, 2949.99]
  - - [704, 448, 1, 256, 704, 704, 256, 256]
    - [8, 1433.6]
  - - [5888, 5888, 1, 1792, 5888, 5888, 1792, 1792]
    - [13, 4359.14]
  - - [1024, 448, 1, 3328, 1024, 1024, 3328, 3328]
    - [8, 2980.96]
  - - [2944, 6784, 1, 256, 2944, 2944, 256, 256]
    - [11, 3775.0]
  - - [256, 64, 1, 256, 256, 256, 256, 256]
    - [18, 128.188]
  - - [4288, 256, 1, 768, 4288, 4288, 768, 768]
    - [8, 2585.42]
  - - [2944, 2944, 1, 3328, 2944, 2944, 3328, 3328]
    - [17, 3962.38]
  - - [704, 704, 1, 1792, 704, 704, 1792, 1792]
    - [6, 1908.51]
  - - [1856, 5056, 1, 1792, 1856, 1856, 1792, 1792]
    - [17, 3907.43]
  - - [5888, 3584, 1, 256, 5888, 5888, 256, 256]
    - [11, 3816.24]
  - - [1024, 4, 1, 128, 1024, 1024, 128, 128]
    - [23, 9.72353]
  - - [1408, 3584, 1, 768, 1408, 1408, 768, 768]
    - [17, 3438.44]
  - - [448, 704, 1, 3328, 448, 448, 3328, 3328]
    - [14, 2213.28]
  - - [64, 1856, 1, 128, 64, 64, 128, 128]
    - [3, 151.801]
  - - [64, 5056, 1, 256, 64, 64, 256, 256]
    - [18, 1336.09]
  - - [1856, 2944, 1, 256, 1856, 1856, 256, 256]
    - [11, 3415.04]
  - - [2944, 256, 1, 256, 2944, 2944, 256, 256]
    - [12, 2138.05]
  - - [128, 5056, 1, 3328, 128, 128, 3328, 3328]
    - [6, 2501.83]
  - - [64, 256, 1, 128, 64, 64, 128, 128]
    - [3, 20.5281]
  - - [704, 1408, 1, 256, 704, 704, 256, 256]
    - [12, 2047.74]
  - - [2944, 448, 1, 768, 2944, 2944, 768, 768]
    - [12, 2954.17]
  - - [64, 6784, 1, 256, 64, 64, 256, 256]
    - [12, 1473.34]
  - - [4288, 704, 1, 768, 4288, 4288, 768, 768]
    - [13, 3179.73]
  - - [5888, 448, 1, 3328, 5888, 5888, 3328, 3328]
    - [17, 3366.06]
  - - [5056, 1856, 1, 3328, 5056, 5056, 3328, 3328]
    - [11, 3922.94]
  - - [4288, 448, 1, 128, 4288, 4288, 128, 128]
    - [2, 1388.9]
  - - [5888, 2368, 1, 768, 5888, 5888, 768, 768]
    - [17, 3823.0]
  - - [128, 256, 1, 256, 128, 128, 256, 256]
    - [18, 257.635]
  - - [1856, 4, 1, 256, 1856, 1856, 256, 256]
    - [29, 32.3662]
  - - [2944, 1856, 1, 256, 2944, 2944, 256, 256]
    - [17, 3366.39]
  - - [4288, 6784, 1, 256, 4288, 4288, 256, 256]
    - [11, 3894.22]
  - - [2368, 704, 1, 256, 2368, 2368, 256, 256]
    - [17, 2788.62]
  - - [128, 2368, 1, 128, 128, 128, 128, 128]
    - [3, 354.249]
  - - [4, 2368, 1, 256, 4, 4, 256, 256]
    - [29, 39.8297]
  - - [3584, 5888, 1, 128, 3584, 3584, 128, 128]
    - [0, 2092.35]
  - - [3584, 1024, 1, 128, 3584, 3584, 128, 128]
    - [0, 1506.42]
  - - [4288, 3584, 1, 128, 4288, 4288, 128, 128]
    - [0, 2219.44]
  - - [2944, 1024, 1, 3328, 2944, 2944, 3328, 3328]
    - [13, 3422.66]
  - - [1024, 5888, 1, 3328, 1024, 1024, 3328, 3328]
    - [11, 3504.78]
  - - [5056, 1024, 1, 256, 5056, 5056, 256, 256]
    - [12, 3272.27]
  - - [1024, 128, 1, 256, 1024, 1024, 256, 256]
    - [6, 773.857]
  - - [6784, 2944, 1, 128, 6784, 6784, 128, 128]
    - [0, 2134.34]
  - - [448, 4288, 1, 128, 448, 448, 128, 128]
    - [0, 1477.0]
  - - [256, 4288, 1, 768, 256, 256, 768, 768]
    - [6, 2538.1]
  - - [6784, 64, 1, 3328, 6784, 6784, 3328, 3328]
    - [8, 2831.43]
  - - [2368, 4, 1, 768, 2368, 2368, 768, 768]
    - [27, 103.448]
  - - [1856, 2368, 1, 3328, 1856, 1856, 3328, 3328]
    - [11, 3506.5]
  - - [3584, 4, 1, 128, 3584, 3584, 128, 128]
    - [24, 33.0516]
  - - [6784, 2368, 1, 3328, 6784, 6784, 3328, 3328]
    - [17, 3872.85]
  - - [6784, 5056, 1, 1792, 6784, 6784, 1792, 1792]
    - [13, 4317.51]
  - - [704, 128, 1, 128, 704, 704, 128, 128]
    - [3, 113.259]
  - - [64, 3584, 1, 768, 64, 64, 768, 768]
    - [18, 1675.81]
  - - [5056, 64, 1, 128, 5056, 5056, 128, 128]
    - [3, 370.339]
  - - [704, 256, 1, 1792, 704, 704, 1792, 1792]
    - [8, 1603.9]
  - - [4288, 704, 1, 3328, 4288, 4288, 3328, 3328]
    - [13, 3409.54]
  - - [128, 2944, 1, 1792, 128, 128, 1792, 1792]
    - [6, 2353.89]
  - - [3584, 1024, 1, 3328, 3584, 3584, 3328, 3328]
    - [13, 4126.96]
  - - [448, 256, 1, 768, 448, 448, 768, 768]
    - [18, 1128.08]
  - - [1024, 2944, 1, 768, 1024, 1024, 768, 768]
    - [13, 3151.21]
  - - [4, 448, 1, 128, 4, 4, 128, 128]
    - [24, 4.1554]
  - - [1024, 2368, 1, 128, 1024, 1024, 128, 128]
    - [0, 1177.11]
  - - [1856, 448, 1, 768, 1856, 1856, 768, 768]
    - [12, 2744.0]
  - - [1856, 64, 1, 1792, 1856, 1856, 1792, 1792]
    - [18, 1240.45]
  - - [6784, 1408, 1, 1792, 6784, 6784, 1792, 1792]
    - [17, 3988.18]
  - - [128, 448, 1, 768, 128, 128, 768, 768]
    - [18, 592.575]
  - - [64, 704, 1, 3328, 64, 64, 3328, 3328]
    - [5, 936.229]
  - - [448, 256, 1, 128, 448, 448, 128, 128]
    - [3, 147.746]
  - - [6784, 1408, 1, 3328, 6784, 6784, 3328, 3328]
    - [11, 3927.59]
  - - [6784, 2368, 1, 128, 6784, 6784, 128, 128]
    - [0, 2118.63]
  - - [3584, 1408, 1, 256, 3584, 3584, 256, 256]
    - [12, 3197.0]
  - - [2944, 6784, 1, 128, 2944, 2944, 128, 128]
    - [0, 2145.67]
  - - [1024, 1024, 1, 256, 1024, 1024, 256, 256]
    - [12, 2131.79]
  - - [6784, 5888, 1, 256, 6784, 6784, 256, 256]
    - [11, 3928.5]
  - - [5056, 5056, 1, 128, 5056, 5056, 128, 128]
    - [0, 2232.84]
  - - [1856, 3584, 1, 768, 1856, 1856, 768, 768]
    - [11, 3779.49]
  - - [64, 4, 1, 256, 64, 64, 256, 256]
    - [29, 1.76172]
  - - [2944, 3584, 1, 256, 2944, 2944, 256, 256]
    - [11, 3660.47]
  - - [1856, 256, 1, 3328, 1856, 1856, 3328, 3328]
    - [6, 3046.49]
  - - [5888, 4288, 1, 3328, 5888, 5888, 3328, 3328]
    - [13, 4119.06]
  - - [4288, 1408, 1, 128, 4288, 4288, 128, 128]
    - [0, 1881.58]
  - - [4288, 6784, 1, 1792, 4288, 4288, 1792, 1792]
    - [13, 4146.25]
  - - [5888, 3584, 1, 1792, 5888, 5888, 1792, 1792]
    - [17, 4030.37]
  - - [64, 1408, 1, 256, 64, 64, 256, 256]
    - [18, 637.961]
  - - [704, 6784, 1, 3328, 704, 704, 3328, 3328]
    - [13, 3358.39]
  - - [256, 704, 1, 1792, 256, 256, 1792, 1792]
    - [6, 1541.43]
  - - [5056, 1408, 1, 256, 5056, 5056, 256, 256]
    - [13, 3460.48]
  - - [2944, 3584, 1, 128, 2944, 2944, 128, 128]
    - [0, 2036.93]
  - - [5056, 5888, 1, 3328, 5056, 5056, 3328, 3328]
    - [13, 4262.56]
  - - [704, 1856, 1, 128, 704, 704, 128, 128]
    - [0, 1031.38]
  - - [4, 3584, 1, 256, 4, 4, 256, 256]
    - [26, 57.201]
  - - [1408, 64, 1, 1792, 1408, 1408, 1792, 1792]
    - [5, 1052.4]
  - - [704, 5888, 1, 128, 704, 704, 128, 128]
    - [0, 1701.45]
  - - [1408, 1408, 1, 256, 1408, 1408, 256, 256]
    - [12, 2590.4]
  - - [64, 1408, 1, 1792, 64, 64, 1792, 1792]
    - [21, 922.536]
  - - [1024, 1408, 1, 1792, 1024, 1024, 1792, 1792]
    - [12, 3301.59]
  - - [4288, 5056, 1, 1792, 4288, 4288, 1792, 1792]
    - [13, 4100.33]
  - - [4288, 1856, 1, 1792, 4288, 4288, 1792, 1792]
    - [17, 3623.32]
  - - [1408, 5888, 1, 3328, 1408, 1408, 3328, 3328]
    - [11, 3778.27]
  - - [3584, 5888, 1, 3328, 3584, 3584, 3328, 3328]
    - [17, 4039.82]
  - - [448, 1856, 1, 128, 448, 448, 128, 128]
    - [0, 845.223]
  - - [6784, 1856, 1, 3328, 6784, 6784, 3328, 3328]
    - [17, 3951.52]
  - - [704, 1024, 1, 3328, 704, 704, 3328, 3328]
    - [8, 2876.39]
  - - [5056, 448, 1, 128, 5056, 5056, 128, 128]
    - [0, 1379.57]
  - - [704, 2944, 1, 1792, 704, 704, 1792, 1792]
    - [8, 3059.56]
  - - [2944, 1024, 1, 256, 2944, 2944, 256, 256]
    - [12, 2929.52]
  - - [5888, 3584, 1, 768, 5888, 5888, 768, 768]
    - [11, 3978.03]
  - - [2944, 2368, 1, 128, 2944, 2944, 128, 128]
    - [0, 1856.26]
  - - [6784, 64, 1, 256, 6784, 6784, 256, 256]
    - [6, 1880.06]
  - - [2368, 704, 1, 768, 2368, 2368, 768, 768]
    - [17, 3227.24]
  - - [256, 5056, 1, 128, 256, 256, 128, 128]
    - [0, 803.0]
  - - [6784, 256, 1, 128, 6784, 6784, 128, 128]
    - [0, 1285.85]
  - - [1856, 704, 1, 256, 1856, 1856, 256, 256]
    - [12, 2663.18]
  - - [3584, 704, 1, 256, 3584, 3584, 256, 256]
    - [12, 2805.43]
  - - [6784, 1856, 1, 768, 6784, 6784, 768, 768]
    - [17, 3942.17]
  - - [3584, 448, 1, 1792, 3584, 3584, 1792, 1792]
    - [17, 3272.93]
  - - [5888, 3584, 1, 3328, 5888, 5888, 3328, 3328]
    - [11, 4032.36]
  - - [2944, 5056, 1, 3328, 2944, 2944, 3328, 3328]
    - [13, 4245.62]
  - - [64, 1408, 1, 768, 64, 64, 768, 768]
    - [18, 900.182]
  - - [64, 1856, 1, 256, 64, 64, 256, 256]
    - [18, 782.117]
  - - [2368, 128, 1, 128, 2368, 2368, 128, 128]
    - [3, 360.57]
  - - [1856, 4288, 1, 3328, 1856, 1856, 3328, 3328]
    - [17, 3643.87]
  - - [5056, 4, 1, 1792, 5056, 5056, 1792, 1792]
    - [25, 100.828]
  - - [1024, 6784, 1, 256, 1024, 1024, 256, 256]
    - [17, 3329.81]
  - - [5056, 5888, 1, 768, 5056, 5056, 768, 768]
    - [13, 4150.24]
  - - [1408, 256, 1, 1792, 1408, 1408, 1792, 1792]
    - [8, 2301.61]
  - - [448, 1024, 1, 1792, 448, 448, 1792, 1792]
    - [8, 2902.84]
  - - [2944, 1024, 1, 1792, 2944, 2944, 1792, 1792]
    - [13, 3375.57]
  - - [1024, 2944, 1, 128, 1024, 1024, 128, 128]
    - [0, 1258.73]
  - - [2368, 6784, 1, 768, 2368, 2368, 768, 768]
    - [11, 3896.4]
  - - [5056, 3584, 1, 768, 5056, 5056, 768, 768]
    - [13, 4002.09]
  - - [1856, 1408, 1, 1792, 1856, 1856, 1792, 1792]
    - [11, 3305.3]
  - - [4288, 2368, 1, 128, 4288, 4288, 128, 128]
    - [0, 2116.79]
  - - [704, 1408, 1, 768, 704, 704, 768, 768]
    - [8, 2392.71]
  - - [4288, 4, 1, 1792, 4288, 4288, 1792, 1792]
    - [25, 107.984]
  - - [4, 4, 1, 1792, 4, 4, 1792, 1792]
    - [30, 0.463648]
  - - [2944, 2368, 1, 3328, 2944, 2944, 3328, 3328]
    - [13, 3959.24]
  - - [2368, 64, 1, 768, 2368, 2368, 768, 768]
    - [8, 1194.5]
  - - [704, 4, 1, 128, 704, 704, 128, 128]
    - [23, 6.76523]
  - - [128, 1856, 1, 256, 128, 128, 256, 256]
    - [18, 1303.98]
  - - [2944, 1856, 1, 1792, 2944, 2944, 1792, 1792]
    - [13, 3785.45]
  - - [704, 64, 1, 1792, 704, 704, 1792, 1792]
    - [5, 707.256]
  - - [64, 6784, 1, 128, 64, 64, 128, 128]
    - [3, 486.472]
  - - [5888, 2944, 1, 3328, 5888, 5888, 3328, 3328]
    - [11, 4023.13]
  - - [4, 4, 1, 256, 4, 4, 256, 256]
    - [30, 0.0973384]
  - - [2944, 64, 1, 1792, 2944, 2944, 1792, 1792]
    - [18, 1563.73]
  - - [4288, 448, 1, 768, 4288, 4288, 768, 768]
    - [17, 3709.14]
  - - [5888, 5888, 1, 256, 5888, 5888, 256, 256]
    - [13, 3932.49]
  - - [1408, 6784, 1, 3328, 1408, 1408, 3328, 3328]
    - [11, 3976.21]
  - - [1024, 704, 1, 128, 1024, 1024, 128, 128]
    - [0, 685.751]
  - - [5888, 704, 1, 768, 5888, 5888, 768, 768]
    - [12, 3279.23]
  - - [2368, 448, 1, 3328, 2368, 2368, 3328, 3328]
    - [6, 2655.51]
  - - [1408, 64, 1, 256, 1408, 1408, 256, 256]
    - [18, 636.553]
  - - [1024, 256, 1, 256, 1024, 1024, 256, 256]
    - [8, 1178.18]
  - - [5888, 3584, 1, 128, 5888, 5888, 128, 128]
    - [0, 2070.91]
  - - [2368, 6784, 1, 1792, 2368, 2368, 1792, 1792]
    - [11, 3941.22]
  - - [1856, 256, 1, 768, 1856, 1856, 768, 768]
    - [8, 2747.77]
  - - [1408, 1024, 1, 1792, 1408, 1408, 1792, 1792]
    - [8, 3155.77]
  - - [2944, 4, 1, 1792, 2944, 2944, 1792, 1792]
    - [27, 194.818]
  - - [128, 2944, 1, 128, 128, 128, 128, 128]
    - [3, 413.533]
  - - [5888, 704, 1, 128, 5888, 5888, 128, 128]
    - [0, 1568.28]
  - - [448, 448, 1, 256, 448, 448, 256, 256]
    - [8, 1116.96]
  - - [4, 448, 1, 3328, 4, 4, 3328, 3328]
    - [27, 66.7989]
  - - [256, 1024, 1, 768, 256, 256, 768, 768]
    - [8, 1534.5]
  - - [3584, 5056, 1, 128, 3584, 3584, 128, 128]
    - [0, 2067.54]
  - - [2944, 5056, 1, 768, 2944, 2944, 768, 768]
    - [13, 4078.28]
  - - [1024, 2944, 1, 256, 1024, 1024, 256, 256]
    - [12, 2892.62]
  - - [1856, 448, 1, 3328, 1856, 1856, 3328, 3328]
    - [12, 2911.61]
  - - [5056, 448, 1, 256, 5056, 5056, 256, 256]
    - [12, 2938.1]
  - - [3584, 3584, 1, 128, 3584, 3584, 128, 128]
    - [0, 2006.85]
  - - [2368, 128, 1, 3328, 2368, 2368, 3328, 3328]
    - [14, 2163.91]
  - - [4, 1024, 1, 128, 4, 4, 128, 128]
    - [24, 9.60947]
  - - [5888, 128, 1, 256, 5888, 5888, 256, 256]
    - [12, 2134.27]
  - - [6784, 1856, 1, 128, 6784, 6784, 128, 128]
    - [0, 2043.18]
  - - [704, 64, 1, 128, 704, 704, 128, 128]
    - [3, 56.4523]
  - - [2944, 448, 1, 128, 2944, 2944, 128, 128]
    - [0, 984.263]
  - - [4288, 64, 1, 768, 4288, 4288, 768, 768]
    - [8, 1602.52]
  - - [448, 1408, 1, 128, 448, 448, 128, 128]
    - [0, 635.951]
  - - [256, 3584, 1, 256, 256, 256, 256, 256]
    - [12, 2528.87]
  - - [704, 448, 1, 128, 704, 704, 128, 128]
    - [3, 379.134]
  - - [5888, 4288, 1, 1792, 5888, 5888, 1792, 1792]
    - [17, 4081.74]
  - - [6784, 5888, 1, 128, 6784, 6784, 128, 128]
    - [0, 2254.19]
  - - [256, 1856, 1, 256, 256, 256, 256, 256]
    - [8, 2082.79]
  - - [2368, 704, 1, 1792, 2368, 2368, 1792, 1792]
    - [17, 3376.66]
  - - [5056, 4, 1, 128, 5056, 5056, 128, 128]
    - [23, 46.2267]
  - - [5888, 448, 1, 256, 5888, 5888, 256, 256]
    - [12, 2936.01]
  - - [2368, 2368, 1, 256, 2368, 2368, 256, 256]
    - [11, 3427.0]
  - - [3584, 256, 1, 1792, 3584, 3584, 1792, 1792]
    - [12, 3138.2]
  - - [1408, 1856, 1, 768, 1408, 1408, 768, 768]
    - [17, 3209.72]
  - - [2944, 128, 1, 768, 2944, 2944, 768, 768]
    - [8, 2207.19]
  - - [5056, 6784, 1, 3328, 5056, 5056, 3328, 3328]
    - [13, 4363.07]
  - - [2368, 4, 1, 128, 2368, 2368, 128, 128]
    - [23, 21.8692]
  - - [5056, 256, 1, 768, 5056, 5056, 768, 768]
    - [12, 2882.31]
  - - [1856, 1024, 1, 256, 1856, 1856, 256, 256]
    - [11, 3292.77]
  - - [1408, 2944, 1, 256, 1408, 1408, 256, 256]
    - [12, 3176.36]
  - - [1408, 1856, 1, 3328, 1408, 1408, 3328, 3328]
    - [11, 3334.09]
  - - [64, 3584, 1, 128, 64, 64, 128, 128]
    - [3, 264.41]
  - - [5888, 256, 1, 256, 5888, 5888, 256, 256]
    - [11, 2654.62]
  - - [704, 2368, 1, 3328, 704, 704, 3328, 3328]
    - [11, 3424.87]
  - - [64, 3584, 1, 256, 64, 64, 256, 256]
    - [18, 1248.3]
  - - [6784, 5056, 1, 128, 6784, 6784, 128, 128]
    - [0, 2197.39]
  - - [1408, 128, 1, 1792, 1408, 1408, 1792, 1792]
    - [6, 1508.6]
  - - [4288, 2944, 1, 128, 4288, 4288, 128, 128]
    - [0, 2219.83]
  - - [2368, 4, 1, 1792, 2368, 2368, 1792, 1792]
    - [27, 174.198]
  - - [2944, 5056, 1, 128, 2944, 2944, 128, 128]
    - [0, 2086.36]
  - - [1024, 1856, 1, 128, 1024, 1024, 128, 128]
    - [0, 1165.53]
  - - [5056, 4288, 1, 128, 5056, 5056, 128, 128]
    - [0, 2220.47]
  - - [2944, 5888, 1, 256, 2944, 2944, 256, 256]
    - [11, 3805.55]
  - - [4288, 2368, 1, 256, 4288, 4288, 256, 256]
    - [17, 3504.4]
  - - [704, 1408, 1, 1792, 704, 704, 1792, 1792]
    - [8, 2501.25]
  - - [4288, 6784, 1, 768, 4288, 4288, 768, 768]
    - [13, 4079.5]
  - - [256, 704, 1, 256, 256, 256, 256, 256]
    - [6, 1035.4]
  - - [64, 2368, 1, 128, 64, 64, 128, 128]
    - [3, 187.681]
  - - [128, 4288, 1, 1792, 128, 128, 1792, 1792]
    - [6, 2087.01]
  - - [448, 64, 1, 128, 448, 448, 128, 128]
    - [3, 36.2363]
  - - [1856, 4288, 1, 256, 1856, 1856, 256, 256]
    - [12, 3319.94]
  - - [4, 2368, 1, 1792, 4, 4, 1792, 1792]
    - [30, 166.672]
  - - [5056, 448, 1, 768, 5056, 5056, 768, 768]
    - [12, 3134.62]
  - - [2944, 4288, 1, 256, 2944, 2944, 256, 256]
    - [17, 3705.41]
  - - [128, 256, 1, 3328, 128, 128, 3328, 3328]
    - [5, 703.742]
  - - [4288, 5888, 1, 1792, 4288, 4288, 1792, 1792]
    - [13, 4105.95]
  - - [1856, 128, 1, 1792, 1856, 1856, 1792, 1792]
    - [8, 2001.32]
  - - [6784, 1408, 1, 256, 6784, 6784, 256, 256]
    - [11, 3694.22]
  - - [1408, 2368, 1, 768, 1408, 1408, 768, 768]
    - [13, 3515.8]
  - - [64, 6784, 1, 3328, 64, 64, 3328, 3328]
    - [8, 2428.63]
  - - [64, 64, 1, 768, 64, 64, 768, 768]
    - [18, 42.7874]
  - - [6784, 2368, 1, 256, 6784, 6784, 256, 256]
    - [17, 3699.64]
  - - [64, 5888, 1, 768, 64, 64, 768, 768]
    - [6, 1845.71]
  - - [128, 448, 1, 3328, 128, 128, 3328, 3328]
    - [5, 1135.42]
  - - [4288, 5888, 1, 128, 4288, 4288, 128, 128]
    - [0, 2285.9]
  - - [1024, 5056, 1, 768, 1024, 1024, 768, 768]
    - [17, 3528.76]
  - - [704, 4288, 1, 3328, 704, 704, 3328, 3328]
    - [13, 3408.24]
  - - [4, 1856, 1, 128, 4, 4, 128, 128]
    - [23, 17.1407]
  - - [4288, 6784, 1, 3328, 4288, 4288, 3328, 3328]
    - [13, 4169.2]
  - - [128, 6784, 1, 3328, 128, 128, 3328, 3328]
    - [12, 3040.19]
  - - [6784, 256, 1, 256, 6784, 6784, 256, 256]
    - [11, 3033.54]
  - - [1408, 704, 1, 256, 1408, 1408, 256, 256]
    - [12, 2046.41]
  - - [64, 2368, 1, 256, 64, 64, 256, 256]
    - [18, 866.011]
  - - [1408, 6784, 1, 1792, 1408, 1408, 1792, 1792]
    - [11, 3986.03]
  - - [64, 5888, 1, 1792, 64, 64, 1792, 1792]
    - [6, 2076.01]
  - - [5056, 64, 1, 256, 5056, 5056, 256, 256]
    - [8, 1464.6]
  - - [2944, 5888, 1, 128, 2944, 2944, 128, 128]
    - [0, 2157.85]
  - - [4, 5056, 1, 128, 4, 4, 128, 128]
    - [23, 46.2928]
  - - [2944, 1408, 1, 128, 2944, 2944, 128, 128]
    - [0, 1610.94]
  - - [704, 4288, 1, 1792, 704, 704, 1792, 1792]
    - [13, 3343.39]
  - - [6784, 4, 1, 1792, 6784, 6784, 1792, 1792]
    - [25, 102.591]
  - - [1408, 448, 1, 128, 1408, 1408, 128, 128]
    - [4, 609.453]
  - - [2368, 5056, 1, 3328, 2368, 2368, 3328, 3328]
    - [17, 3811.33]
  - - [1856, 4288, 1, 768, 1856, 1856, 768, 768]
    - [17, 3560.04]
  - - [4, 4288, 1, 768, 4, 4, 768, 768]
    - [29, 147.149]
  - - [6784, 5888, 1, 768, 6784, 6784, 768, 768]
    - [13, 4089.07]
  - - [1024, 128, 1, 128, 1024, 1024, 128, 128]
    - [3, 162.444]
  - - [4, 4288, 1, 256, 4, 4, 256, 256]
    - [26, 64.9543]
  - - [4, 128, 1, 3328, 4, 4, 3328, 3328]
    - [27, 20.0746]
  - - [4, 4288, 1, 3328, 4, 4, 3328, 3328]
    - [30, 64.8543]
  - - [5888, 5056, 1, 3328, 5888, 5888, 3328, 3328]
    - [13, 4245.76]
  - - [4288, 1024, 1, 1792, 4288, 4288, 1792, 1792]
    - [11, 3497.0]
  - - [3584, 64, 1, 768, 3584, 3584, 768, 768]
    - [18, 1692.55]
  - - [256, 2944, 1, 3328, 256, 256, 3328, 3328]
    - [12, 2641.1]
  - - [6784, 5888, 1, 1792, 6784, 6784, 1792, 1792]
    - [13, 4127.14]
  - - [64, 5888, 1, 256, 64, 64, 256, 256]
    - [6, 1345.83]
  - - [1856, 5888, 1, 256, 1856, 1856, 256, 256]
    - [13, 3628.73]
  - - [704, 5056, 1, 128, 704, 704, 128, 128]
    - [0, 1729.98]
  - - [448, 256, 1, 3328, 448, 448, 3328, 3328]
    - [16, 1548.03]
  - - [4, 5056, 1, 768, 4, 4, 768, 768]
    - [26, 165.235]
  - - [5056, 3584, 1, 256, 5056, 5056, 256, 256]
    - [11, 3772.45]
  - - [3584, 5888, 1, 1792, 3584, 3584, 1792, 1792]
    - [17, 4027.52]
  - - [64, 2944, 1, 128, 64, 64, 128, 128]
    - [3, 225.648]
  - - [128, 5056, 1, 1792, 128, 128, 1792, 1792]
    - [6, 2436.81]
  - - [4, 3584, 1, 1792, 4, 4, 1792, 1792]
    - [30, 80.5842]
  - - [64, 256, 1, 1792, 64, 64, 1792, 1792]
    - [5, 302.807]
  - - [5056, 2944, 1, 3328, 5056, 5056, 3328, 3328]
    - [13, 4244.08]
  - - [1024, 448, 1, 768, 1024, 1024, 768, 768]
    - [8, 2586.04]
  - - [3584, 2368, 1, 1792, 3584, 3584, 1792, 1792]
    - [17, 3858.79]
  - - [448, 5056, 1, 3328, 448, 448, 3328, 3328]
    - [8, 3099.6]
  - - [1856, 3584, 1, 1792, 1856, 1856, 1792, 1792]
    - [11, 3842.95]
  - - [5056, 1408, 1, 3328, 5056, 5056, 3328, 3328]
    - [13, 4051.83]
  - - [128, 3584, 1, 128, 128, 128, 128, 128]
    - [3, 489.662]
  - - [5056, 704, 1, 768, 5056, 5056, 768, 768]
    - [13, 3726.34]
  - - [1024, 6784, 1, 1792, 1024, 1024, 1792, 1792]
    - [13, 3848.18]
  - - [5888, 5056, 1, 128, 5888, 5888, 128, 128]
    - [0, 2161.14]
  - - [5888, 1024, 1, 256, 5888, 5888, 256, 256]
    - [12, 3256.34]
  - - [1408, 5056, 1, 128, 1408, 1408, 128, 128]
    - [0, 1867.24]
  - - [2944, 5056, 1, 1792, 2944, 2944, 1792, 1792]
    - [13, 4198.68]
  - - [5888, 6784, 1, 1792, 5888, 5888, 1792, 1792]
    - [13, 4150.84]
  - - [1856, 704, 1, 768, 1856, 1856, 768, 768]
    - [12, 2925.96]
  - - [64, 4, 1, 3328, 64, 64, 3328, 3328]
    - [27, 10.768]
  - - [704, 64, 1, 768, 704, 704, 768, 768]
    - [18, 471.688]
  - - [5056, 2944, 1, 1792, 5056, 5056, 1792, 1792]
    - [13, 4204.34]
  - - [1856, 128, 1, 3328, 1856, 1856, 3328, 3328]
    - [22, 2244.06]
  - - [5888, 2944, 1, 256, 5888, 5888, 256, 256]
    - [11, 3807.9]
  - - [5056, 1408, 1, 768, 5056, 5056, 768, 768]
    - [13, 3861.29]
  - - [4, 5056, 1, 256, 4, 4, 256, 256]
    - [29, 73.8776]
  - - [3584, 6784, 1, 128, 3584, 3584, 128, 128]
    - [0, 2122.21]
  - - [256, 1024, 1, 128, 256, 256, 128, 128]
    - [3, 305.707]
  - - [2944, 4288, 1, 1792, 2944, 2944, 1792, 1792]
    - [17, 4023.15]
  - - [704, 2944, 1, 768, 704, 704, 768, 768]
    - [8, 2922.98]
  - - [256, 5056, 1, 1792, 256, 256, 1792, 1792]
    - [12, 2979.77]
  - - [1024, 5888, 1, 1792, 1024, 1024, 1792, 1792]
    - [17, 3500.51]
  - - [3584, 4288, 1, 3328, 3584, 3584, 3328, 3328]
    - [13, 4355.2]
  - - [64, 2944, 1, 1792, 64, 64, 1792, 1792]
    - [18, 1551.09]
  - - [1024, 2368, 1, 1792, 1024, 1024, 1792, 1792]
    - [12, 3211.89]
  - - [1408, 6784, 1, 256, 1408, 1408, 256, 256]
    - [11, 3683.98]
  - - [2368, 2944, 1, 256, 2368, 2368, 256, 256]
    - [13, 3399.64]
  - - [6784, 128, 1, 1792, 6784, 6784, 1792, 1792]
    - [12, 2992.47]
  - - [3584, 256, 1, 128, 3584, 3584, 128, 128]
    - [4, 858.483]
  - - [3584, 3584, 1, 3328, 3584, 3584, 3328, 3328]
    - [17, 3862.76]
  - - [4, 1024, 1, 3328, 4, 4, 3328, 3328]
    - [27, 133.433]
  - - [448, 4, 1, 128, 448, 448, 128, 128]
    - [23, 4.40434]
  - - [4288, 3584, 1, 3328, 4288, 4288, 3328, 3328]
    - [13, 4388.11]
  - - [4, 4, 1, 128, 4, 4, 128, 128]
    - [24, 0.0353594]
  - - [5056, 1408, 1, 1792, 5056, 5056, 1792, 1792]
    - [13, 4005.99]
  - - [64, 128, 1, 3328, 64, 64, 3328, 3328]
    - [10, 258.172]
  - - [4, 64, 1, 1792, 4, 4, 1792, 1792]
    - [27, 7.7179]
  - - [1024, 1856, 1, 768, 1024, 1024, 768, 768]
    - [17, 3703.86]
  - - [5056, 64, 1, 768, 5056, 5056, 768, 768]
    - [8, 1890.69]
  - - [3584, 2944, 1, 256, 3584, 3584, 256, 256]
    - [17, 3632.51]
  - - [2368, 1408, 1, 768, 2368, 2368, 768, 768]
    - [13, 3559.59]
  - - [64, 256, 1, 768, 64, 64, 768, 768]
    - [18, 171.898]
  - - [5056, 64, 1, 3328, 5056, 5056, 3328, 3328]
    - [20, 2258.95]
  - - [448, 3584, 1, 3328, 448, 448, 3328, 3328]
    - [11, 3321.78]
  - - [2944, 2368, 1, 768, 2944, 2944, 768, 768]
    - [13, 3770.87]
  - - [2944, 3584, 1, 1792, 2944, 2944, 1792, 1792]
    - [13, 3972.92]
  - - [2944, 704, 1, 256, 2944, 2944, 256, 256]
    - [12, 2693.84]
  - - [1856, 2368, 1, 768, 1856, 1856, 768, 768]
    - [12, 3462.63]
  - - [64, 448, 1, 256, 64, 64, 256, 256]
    - [18, 224.878]
  - - [2368, 2944, 1, 3328, 2368, 2368, 3328, 3328]
    - [13, 3970.57]
  - - [4288, 1024, 1, 3328, 4288, 4288, 3328, 3328]
    - [11, 3516.93]
  - - [2368, 256, 1, 1792, 2368, 2368, 1792, 1792]
    - [8, 2341.62]
  - - [2368, 2368, 1, 1792, 2368, 2368, 1792, 1792]
    - [17, 3871.12]
  - - [448, 4, 1, 768, 448, 448, 768, 768]
    - [27, 24.7885]
  - - [1024, 5888, 1, 256, 1024, 1024, 256, 256]
    - [12, 3240.48]
  - - [6784, 64, 1, 128, 6784, 6784, 128, 128]
    - [3, 503.392]
  - - [256, 5888, 1, 1792, 256, 256, 1792, 1792]
    - [17, 3087.43]
  - - [3584, 6784, 1, 768, 3584, 3584, 768, 768]
    - [17, 4030.55]
  - - [1024, 5056, 1, 3328, 1024, 1024, 3328, 3328]
    - [17, 3615.11]
  - - [256, 256, 1, 256, 256, 256, 256, 256]
    - [18, 488.847]
  - - [1856, 1408, 1, 768, 1856, 1856, 768, 768]
    - [11, 3222.09]
  - - [5056, 2368, 1, 128, 5056, 5056, 128, 128]
    - [0, 2110.41]
  - - [6784, 5888, 1, 3328, 6784, 6784, 3328, 3328]
    - [13, 4164.62]
  - - [3584, 704, 1, 1792, 3584, 3584, 1792, 1792]
    - [17, 3196.19]
  - - [1856, 1856, 1, 768, 1856, 1856, 768, 768]
    - [13, 3616.52]
  - - [256, 704, 1, 3328, 256, 256, 3328, 3328]
    - [22, 1780.41]
  - - [64, 448, 1, 3328, 64, 64, 3328, 3328]
    - [5, 692.657]
  - - [1024, 4, 1, 3328, 1024, 1024, 3328, 3328]
    - [27, 131.477]
  - - [3584, 1856, 1, 768, 3584, 3584, 768, 768]
    - [17, 3736.59]
  - - [3584, 128, 1, 3328, 3584, 3584, 3328, 3328]
    - [8, 2997.81]
  - - [5888, 128, 1, 1792, 5888, 5888, 1792, 1792]
    - [12, 2598.84]
  - - [4288, 64, 1, 256, 4288, 4288, 256, 256]
    - [8, 1267.22]
  - - [5056, 4, 1, 256, 5056, 5056, 256, 256]
    - [25, 78.2549]
  - - [64, 4288, 1, 1792, 64, 64, 1792, 1792]
    - [8, 1704.74]
  - - [5888, 1856, 1, 256, 5888, 5888, 256, 256]
    - [17, 3567.28]
  - - [64, 448, 1, 128, 64, 64, 128, 128]
    - [3, 38.3893]
  - - [3584, 3584, 1, 768, 3584, 3584, 768, 768]
    - [17, 3800.43]
  - - [2944, 4288, 1, 128, 2944, 2944, 128, 128]
    - [0, 2033.86]
  - - [6784, 4288, 1, 768, 6784, 6784, 768, 768]
    - [13, 4027.08]
  - - [1408, 128, 1, 256, 1408, 1408, 256, 256]
    - [6, 1028.02]
  - - [4288, 128, 1, 768, 4288, 4288, 768, 768]
    - [8, 1960.23]
  - - [704, 704, 1, 768, 704, 704, 768, 768]
    - [8, 1833.49]
  - - [4288, 1408, 1, 256, 4288, 4288, 256, 256]
    - [12, 3270.14]
  - - [2944, 5888, 1, 768, 2944, 2944, 768, 768]
    - [11, 3992.16]
  - - [128, 1024, 1, 1792, 128, 128, 1792, 1792]
    - [5, 1121.04]
  - - [5888, 1856, 1, 1792, 5888, 5888, 1792, 1792]
    - [13, 4068.92]
  - - [2368, 256, 1, 256, 2368, 2368, 256, 256]
    - [8, 1838.74]
  - - [256, 256, 1, 128, 256, 256, 128, 128]
    - [3, 81.984]
  - - [1408, 256, 1, 3328, 1408, 1408, 3328, 3328]
    - [20, 2415.76]
  - - [6784, 4288, 1, 128, 6784, 6784, 128, 128]
    - [0, 2209.21]
  - - [2944, 128, 1, 3328, 2944, 2944, 3328, 3328]
    - [8, 2469.08]
  - - [256, 6784, 1, 3328, 256, 256, 3328, 3328]
    - [17, 3599.03]
  - - [1024, 4288, 1, 128, 1024, 1024, 128, 128]
    - [0, 1517.71]
  - - [256, 448, 1, 1792, 256, 256, 1792, 1792]
    - [18, 1286.44]
  - - [4, 704, 1, 1792, 4, 4, 1792, 1792]
    - [27, 67.1761]
  - - [6784, 704, 1, 128, 6784, 6784, 128, 128]
    - [0, 1665.91]
  - - [6784, 448, 1, 1792, 6784, 6784, 1792, 1792]
    - [13, 3363.58]
  - - [1024, 128, 1, 768, 1024, 1024, 768, 768]
    - [6, 1056.5]
  - - [1408, 4, 1, 3328, 1408, 1408, 3328, 3328]
    - [27, 179.123]
  - - [1024, 64, 1, 128, 1024, 1024, 128, 128]
    - [3, 82.7605]
  - - [704, 1856, 1, 3328, 704, 704, 3328, 3328]
    - [8, 2947.22]
  - - [1024, 4, 1, 768, 1024, 1024, 768, 768]
    - [30, 48.0117]
  - - [704, 448, 1, 1792, 704, 704, 1792, 1792]
    - [8, 2007.04]
  - - [1024, 704, 1, 256, 1024, 1024, 256, 256]
    - [6, 2036.07]
  - - [2368, 2368, 1, 128, 2368, 2368, 128, 128]
    - [0, 1979.68]
  - - [1024, 5056, 1, 128, 1024, 1024, 128, 128]
    - [0, 1562.97]
  - - [2944, 3584, 1, 768, 2944, 2944, 768, 768]
    - [11, 3902.17]
  - - [1408, 2944, 1, 3328, 1408, 1408, 3328, 3328]
    - [11, 3292.32]
  - - [64, 1024, 1, 256, 64, 64, 256, 256]
    - [18, 496.955]
  - - [128, 5056, 1, 768, 128, 128, 768, 768]
    - [6, 2266.62]
  - - [4288, 128, 1, 256, 4288, 4288, 256, 256]
    - [8, 1658.51]
  - - [5056, 1856, 1, 768, 5056, 5056, 768, 768]
    - [11, 3833.44]
  - - [2368, 1856, 1, 256, 2368, 2368, 256, 256]
    - [12, 3350.97]
  - - [2368, 1024, 1, 3328, 2368, 2368, 3328, 3328]
    - [6, 3223.71]
  - - [1856, 448, 1, 256, 1856, 1856, 256, 256]
    - [12, 2382.06]
  - - [4288, 6784, 1, 128, 4288, 4288, 128, 128]
    - [0, 2287.61]
  - - [256, 1856, 1, 128, 256, 256, 128, 128]
    - [3, 505.464]
  - - [256, 256, 1, 3328, 256, 256, 3328, 3328]
    - [16, 1030.35]
  - - [128, 4288, 1, 768, 128, 128, 768, 768]
    - [6, 1943.6]
  - - [1024, 2368, 1, 256, 1024, 1024, 256, 256]
    - [12, 3098.83]
  - - [4, 64, 1, 768, 4, 4, 768, 768]
    - [27, 4.28153]
  - - [2944, 2944, 1, 768, 2944, 2944, 768, 768]
    - [11, 3874.66]
  - - [1856, 1856, 1, 128, 1856, 1856, 128, 128]
    - [0, 1674.75]
  - - [64, 2944, 1, 768, 64, 64, 768, 768]
    - [18, 1396.75]
  - - [448, 4288, 1, 768, 448, 448, 768, 768]
    - [11, 3691.32]
  - - [5888, 704, 1, 3328, 5888, 5888, 3328, 3328]
    - [11, 3302.66]
  - - [3584, 2944, 1, 128, 3584, 3584, 128, 128]
    - [0, 1945.39]
  - - [6784, 3584, 1, 256, 6784, 6784, 256, 256]
    - [11, 3866.25]
  - - [1024, 6784, 1, 128, 1024, 1024, 128, 128]
    - [0, 1645.92]
  - - [1408, 5056, 1, 768, 1408, 1408, 768, 768]
    - [13, 3826.91]
  - - [64, 704, 1, 128, 64, 64, 128, 128]
    - [3, 55.0723]
  - - [1024, 704, 1, 768, 1024, 1024, 768, 768]
    - [6, 2545.27]
  - - [128, 1408, 1, 768, 128, 128, 768, 768]
    - [6, 1425.17]
  - - [2368, 3584, 1, 1792, 2368, 2368, 1792, 1792]
    - [11, 3861.69]
  - - [64, 2944, 1, 3328, 64, 64, 3328, 3328]
    - [15, 1807.68]
  - - [4, 448, 1, 1792, 4, 4, 1792, 1792]
    - [27, 46.0859]
  - - [448, 1024, 1, 256, 448, 448, 256, 256]
    - [8, 2019.27]
  - - [4288, 1856, 1, 768, 4288, 4288, 768, 768]
    - [11, 3540.4]
  - - [2944, 2368, 1, 1792, 2944, 2944, 1792, 1792]
    - [13, 3904.76]
  - - [3584, 1408, 1, 1792, 3584, 3584, 1792, 1792]
    - [17, 3497.09]
  - - [2944, 256, 1, 128, 2944, 2944, 128, 128]
    - [0, 755.553]
  - - [704, 6784, 1, 128, 704, 704, 128, 128]
    - [0, 1932.6]
  - - [1856, 6784, 1, 1792, 1856, 1856, 1792, 1792]
    - [11, 4008.71]
  - - [5888, 5888, 1, 128, 5888, 5888, 128, 128]
    - [0, 2192.74]
  - - [3584, 4288, 1, 768, 3584, 3584, 768, 768]
    - [13, 4142.02]
  - - [1024, 448, 1, 256, 1024, 1024, 256, 256]
    - [6, 1965.2]
  - - [2368, 4288, 1, 3328, 2368, 2368, 3328, 3328]
    - [13, 3857.27]
  - - [128, 4288, 1, 256, 128, 128, 256, 256]
    - [6, 1638.4]
  - - [4288, 704, 1, 1792, 4288, 4288, 1792, 1792]
    - [13, 3348.03]
  - - [1856, 1024, 1, 1792, 1856, 1856, 1792, 1792]
    - [11, 3878.66]
  - - [256, 448, 1, 3328, 256, 256, 3328, 3328]
    - [19, 1519.92]
  - - [64, 2944, 1, 256, 64, 64, 256, 256]
    - [18, 1057.77]
  - - [64, 1856, 1, 3328, 64, 64, 3328, 3328]
    - [19, 1518.57]
  - - [64, 3584, 1, 3328, 64, 64, 3328, 3328]
    - [15, 2147.66]
  - - [1408, 5056, 1, 256, 1408, 1408, 256, 256]
    - [12, 3354.98]
  - - [128, 6784, 1, 768, 128, 128, 768, 768]
    - [12, 2845.11]
  - - [4288, 256, 1, 128, 4288, 4288, 128, 128]
    - [0, 834.774]
  - - [2368, 1408, 1, 128, 2368, 2368, 128, 128]
    - [0, 1625.92]
  - - [448, 4, 1, 3328, 448, 448, 3328, 3328]
    - [27, 64.6553]
  - - [704, 704, 1, 128, 704, 704, 128, 128]
    - [0, 486.494]
  - - [5888, 4, 1, 256, 5888, 5888, 256, 256]
    - [28, 86.9278]
  - - [4, 256, 1, 256, 4, 4, 256, 256]
    - [30, 5.67903]
  - - [5888, 5056, 1, 1792, 5888, 5888, 1792, 1792]
    - [13, 4203.84]
  - - [256, 2368, 1, 768, 256, 256, 768, 768]
    - [6, 2165.03]
  - - [4288, 3584, 1, 1792, 4288, 4288, 1792, 1792]
    - [13, 4348.15]
  - - [128, 2944, 1, 3328, 128, 128, 3328, 3328]
    - [6, 2425.53]
  - - [3584, 4, 1, 768, 3584, 3584, 768, 768]
    - [27, 134.927]
  - - [1856, 1408, 1, 3328, 1856, 1856, 3328, 3328]
    - [11, 3341.36]
  - - [256, 128, 1, 256, 256, 256, 256, 256]
    - [18, 256.376]
  - - [256, 5056, 1, 256, 256, 256, 256, 256]
    - [12, 2614.82]
  - - [5888, 256, 1, 3328, 5888, 5888, 3328, 3328]
    - [17, 3119.18]
  - - [5888, 4, 1, 768, 5888, 5888, 768, 768]
    - [26, 183.373]
  - - [2944, 128, 1, 128, 2944, 2944, 128, 128]
    - [3, 451.972]
  - - [4288, 5056, 1, 128, 4288, 4288, 128, 128]
    - [0, 2224.03]
  - - [6784, 704, 1, 768, 6784, 6784, 768, 768]
    - [17, 3708.87]
  - - [1856, 5888, 1, 3328, 1856, 1856, 3328, 3328]
    - [13, 4156.02]
  - - [5888, 448, 1, 768, 5888, 5888, 768, 768]
    - [17, 3250.3]
  - - [1408, 5888, 1, 128, 1408, 1408, 128, 128]
    - [0, 1957.86]
  - - [448, 4288, 1, 1792, 448, 448, 1792, 1792]
    - [11, 3867.95]
  - - [64, 1024, 1, 1792, 64, 64, 1792, 1792]
    - [5, 745.559]
  - - [704, 1856, 1, 1792, 704, 704, 1792, 1792]
    - [8, 2897.86]
  - - [2944, 6784, 1, 1792, 2944, 2944, 1792, 1792]
    - [17, 3982.55]
  - - [448, 6784, 1, 128, 448, 448, 128, 128]
    - [0, 1508.3]
  - - [448, 5056, 1, 1792, 448, 448, 1792, 1792]
    - [8, 3051.36]
  - - [2944, 448, 1, 256, 2944, 2944, 256, 256]
    - [12, 2684.81]
  - - [256, 5056, 1, 3328, 256, 256, 3328, 3328]
    - [8, 2903.45]
  - - [256, 1024, 1, 3328, 256, 256, 3328, 3328]
    - [8, 1737.05]
  - - [1024, 64, 1, 768, 1024, 1024, 768, 768]
    - [18, 682.37]
  - - [448, 4288, 1, 256, 448, 448, 256, 256]
    - [11, 3188.42]
  - - [3584, 64, 1, 256, 3584, 3584, 256, 256]
    - [18, 1261.17]
  - - [5056, 5056, 1, 768, 5056, 5056, 768, 768]
    - [13, 4050.28]
  - - [4288, 1024, 1, 768, 4288, 4288, 768, 768]
    - [11, 3420.66]
  - - [4, 1408, 1, 128, 4, 4, 128, 128]
    - [24, 12.4122]
  - - [128, 2368, 1, 256, 128, 128, 256, 256]
    - [6, 1358.45]
  - - [5056, 1024, 1, 3328, 5056, 5056, 3328, 3328]
    - [13, 3646.2]
  - - [2368, 448, 1, 1792, 2368, 2368, 1792, 1792]
    - [8, 2643.9]
  - - [448, 704, 1, 256, 448, 448, 256, 256]
    - [6, 1433.6]
  - - [5888, 448, 1, 128, 5888, 5888, 128, 128]
    - [2, 1265.9]
  - - [448, 5056, 1, 768, 448, 448, 768, 768]
    - [12, 3044.65]
  - - [2368, 3584, 1, 768, 2368, 2368, 768, 768]
    - [11, 3808.28]
  - - [256, 1408, 1, 3328, 256, 256, 3328, 3328]
    - [8, 2378.22]
  - - [6784, 2944, 1, 1792, 6784, 6784, 1792, 1792]
    - [17, 3981.55]
  - - [256, 2368, 1, 3328, 256, 256, 3328, 3328]
    - [22, 2396.49]
  - - [1856, 256, 1, 256, 1856, 1856, 256, 256]
    - [8, 2102.95]
  - - [448, 3584, 1, 128, 448, 448, 128, 128]
    - [0, 1277.48]
  - - [4288, 256, 1, 3328, 4288, 4288, 3328, 3328]
    - [7, 2826.19]
  - - [1024, 1024, 1, 768, 1024, 1024, 768, 768]
    - [6, 2384.26]
  - - [1024, 3584, 1, 256, 1024, 1024, 256, 256]
    - [17, 3302.6]
  - - [256, 3584, 1, 128, 256, 256, 128, 128]
    - [0, 774.674]
  - - [6784, 4, 1, 3328, 6784, 6784, 3328, 3328]
    - [26, 66.9749]
  - - [704, 2944, 1, 256, 704, 704, 256, 256]
    - [12, 2691.66]
  - - [2368, 5888, 1, 256, 2368, 2368, 256, 256]
    - [11, 3638.34]
  - - [1408, 4288, 1, 1792, 1408, 1408, 1792, 1792]
    - [11, 3490.16]
  - - [2368, 704, 1, 3328, 2368, 2368, 3328, 3328]
    - [17, 3438.97]
  - - [448, 2944, 1, 256, 448, 448, 256, 256]
    - [12, 2674.6]
  - - [3584, 1024, 1, 768, 3584, 3584, 768, 768]
    - [13, 3831.25]
  - - [4288, 1024, 1, 256, 4288, 4288, 256, 256]
    - [12, 3338.3]
  - - [256, 128, 1, 3328, 256, 256, 3328, 3328]
    - [5, 711.084]
  - - [6784, 6784, 1, 3328, 6784, 6784, 3328, 3328]
    - [13, 4391.67]
  - - [4288, 4288, 1, 128, 4288, 4288, 128, 128]
    - [0, 2232.95]
  - - [2368, 128, 1, 768, 2368, 2368, 768, 768]
    - [8, 1757.12]
  - - [4, 1856, 1, 1792, 4, 4, 1792, 1792]
    - [27, 146.777]
  - - [2368, 4288, 1, 128, 2368, 2368, 128, 128]
    - [0, 2101.73]
  - - [4, 6784, 1, 3328, 4, 4, 3328, 3328]
    - [30, 70.3341]
  - - [256, 3584, 1, 1792, 256, 256, 1792, 1792]
    - [12, 3158.95]
  - - [704, 1856, 1, 256, 704, 704, 256, 256]
    - [12, 2648.0]
  - - [128, 128, 1, 256, 128, 128, 256, 256]
    - [18, 126.334]
  - - [1024, 1408, 1, 256, 1024, 1024, 256, 256]
    - [12, 2816.69]
  - - [5888, 64, 1, 128, 5888, 5888, 128, 128]
    - [3, 449.278]
  - - [256, 1024, 1, 1792, 256, 256, 1792, 1792]
    - [8, 1680.12]
  - - [5888, 1408, 1, 3328, 5888, 5888, 3328, 3328]
    - [11, 3788.44]
  - - [5888, 1856, 1, 128, 5888, 5888, 128, 128]
    - [0, 1951.45]
  - - [704, 128, 1, 256, 704, 704, 256, 256]
    - [18, 629.604]
  - - [3584, 128, 1, 128, 3584, 3584, 128, 128]
    - [3, 506.558]
  - - [5056, 128, 1, 128, 5056, 5056, 128, 128]
    - [0, 650.42]
  - - [2944, 2944, 1, 128, 2944, 2944, 128, 128]
    - [0, 2027.7]
  - - [1856, 1408, 1, 128, 1856, 1856, 128, 128]
    - [0, 1610.01]
  - - [64, 4288, 1, 768, 64, 64, 768, 768]
    - [8, 1534.39]
  - - [2944, 5056, 1, 256, 2944, 2944, 256, 256]
    - [17, 3655.81]
  - - [2368, 256, 1, 128, 2368, 2368, 128, 128]
    - [0, 608.872]
  - - [4288, 448, 1, 3328, 4288, 4288, 3328, 3328]
    - [17, 3941.92]
  - - [128, 64, 1, 256, 128, 128, 256, 256]
    - [18, 63.3198]
  - - [128, 1408, 1, 3328, 128, 128, 3328, 3328]
    - [22, 1777.04]
  - - [1856, 6784, 1, 128, 1856, 1856, 128, 128]
    - [0, 2231.48]
  - - [4, 4288, 1, 1792, 4, 4, 1792, 1792]
    - [30, 80.7835]
  - - [2368, 5888, 1, 1792, 2368, 2368, 1792, 1792]
    - [13, 3949.4]
  - - [6784, 64, 1, 768, 6784, 6784, 768, 768]
    - [6, 2472.18]
  - - [3584, 5056, 1, 1792, 3584, 3584, 1792, 1792]
    - [13, 4056.65]
  - - [1856, 448, 1, 128, 1856, 1856, 128, 128]
    - [0, 814.685]
  - - [4288, 2368, 1, 768, 4288, 4288, 768, 768]
    - [11, 3735.52]
  - - [2944, 128, 1, 256, 2944, 2944, 256, 256]
    - [8, 1681.82]
  - - [6784, 6784, 1, 768, 6784, 6784, 768, 768]
    - [13, 4266.96]
  - - [1856, 1856, 1, 1792, 1856, 1856, 1792, 1792]
    - [13, 3813.49]
  - - [1408, 4, 1, 128, 1408, 1408, 128, 128]
    - [23, 13.213]
  - - [1024, 4288, 1, 256, 1024, 1024, 256, 256]
    - [12, 3308.43]
  - - [5056, 3584, 1, 128, 5056, 5056, 128, 128]
    - [0, 2238.34]
  - - [5056, 2368, 1, 768, 5056, 5056, 768, 768]
    - [11, 3751.09]
  - - [448, 3584, 1, 768, 448, 448, 768, 768]
    - [11, 3156.68]
  - - [2944, 64, 1, 256, 2944, 2944, 256, 256]
    - [6, 1076.66]
  - - [4, 256, 1, 1792, 4, 4, 1792, 1792]
    - [27, 27.7695]
  - - [2368, 256, 1, 768, 2368, 2368, 768, 768]
    - [8, 2183.71]
  - - [3584, 5888, 1, 768, 3584, 3584, 768, 768]
    - [17, 3981.7]
  - - [256, 5888, 1, 768, 256, 256, 768, 768]
    - [11, 2973.77]
  - - [5888, 1408, 1, 768, 5888, 5888, 768, 768]
    - [11, 3721.45]
  - - [1024, 2368, 1, 3328, 1024, 1024, 3328, 3328]
    - [17, 3106.56]
  - - [256, 448, 1, 128, 256, 256, 128, 128]
    - [3, 146.449]
  - - [128, 6784, 1, 128, 128, 128, 128, 128]
    - [0, 773.157]
  - - [3584, 4288, 1, 256, 3584, 3584, 256, 256]
    - [17, 3759.52]
  - - [5056, 4, 1, 768, 5056, 5056, 768, 768]
    - [27, 167.95]
  - - [2368, 5056, 1, 768, 2368, 2368, 768, 768]
    - [17, 3745.47]
  - - [5056, 2944, 1, 128, 5056, 5056, 128, 128]
    - [0, 2170.2]
  - - [2368, 448, 1, 128, 2368, 2368, 128, 128]
    - [0, 844.469]
  - - [128, 5888, 1, 256, 128, 128, 256, 256]
    - [12, 2113.69]
  - - [448, 64, 1, 768, 448, 448, 768, 768]
    - [18, 303.14]
  - - [256, 5888, 1, 3328, 256, 256, 3328, 3328]
    - [17, 3129.61]
  - - [4, 1856, 1, 3328, 4, 4, 3328, 3328]
    - [30, 205.209]
  - - [2368, 5056, 1, 128, 2368, 2368, 128, 128]
    - [0, 2121.4]
  - - [448, 1408, 1, 1792, 448, 448, 1792, 1792]
    - [8, 2471.5]
  - - [5056, 128, 1, 3328, 5056, 5056, 3328, 3328]
    - [9, 2525.06]
  - - [5888, 6784, 1, 768, 5888, 5888, 768, 768]
    - [13, 4106.76]
  - - [4288, 64, 1, 3328, 4288, 4288, 3328, 3328]
    - [20, 1995.87]
  - - [448, 1024, 1, 3328, 448, 448, 3328, 3328]
    - [8, 3007.74]
  - - [4, 448, 1, 256, 4, 4, 256, 256]
    - [27, 9.30909]
  - - [5888, 2368, 1, 128, 5888, 5888, 128, 128]
    - [0, 2023.26]
  - - [5888, 704, 1, 256, 5888, 5888, 256, 256]
    - [12, 3174.08]
  - - [4, 256, 1, 768, 4, 4, 768, 768]
    - [27, 14.9171]
  - - [1856, 1024, 1, 128, 1856, 1856, 128, 128]
    - [0, 1435.05]
  - - [6784, 4288, 1, 256, 6784, 6784, 256, 256]
    - [17, 3869.61]
  - - [704, 4288, 1, 256, 704, 704, 256, 256]
    - [12, 2933.5]
  - - [128, 2368, 1, 3328, 128, 128, 3328, 3328]
    - [20, 2101.52]
  - - [448, 1856, 1, 256, 448, 448, 256, 256]
    - [12, 2379.93]
  - - [5888, 64, 1, 1792, 5888, 5888, 1792, 1792]
    - [8, 2393.26]
  - - [1024, 64, 1, 3328, 1024, 1024, 3328, 3328]
    - [5, 967.458]
  - - [4288, 5056, 1, 768, 4288, 4288, 768, 768]
    - [13, 4033.91]
  - - [128, 5888, 1, 3328, 128, 128, 3328, 3328]
    - [12, 2641.32]
  - - [256, 256, 1, 1792, 256, 256, 1792, 1792]
    - [18, 766.984]
  - - [1856, 1408, 1, 256, 1856, 1856, 256, 256]
    - [12, 2918.81]
  - - [5056, 6784, 1, 128, 5056, 5056, 128, 128]
    - [1, 2324.24]
  - - [1856, 128, 1, 128, 1856, 1856, 128, 128]
    - [3, 286.011]
  - - [256, 64, 1, 128, 256, 256, 128, 128]
    - [3, 20.7228]
  - - [6784, 128, 1, 768, 6784, 6784, 768, 768]
    - [12, 2854.86]
  - - [256, 2368, 1, 256, 256, 256, 256, 256]
    - [6, 1786.25]
  - - [2368, 6784, 1, 3328, 2368, 2368, 3328, 3328]
    - [11, 3917.33]
  - - [64, 1408, 1, 128, 64, 64, 128, 128]
    - [3, 117.505]
  - - [5056, 1856, 1, 256, 5056, 5056, 256, 256]
    - [17, 3590.65]
  - - [4, 128, 1, 256, 4, 4, 256, 256]
    - [29, 3.25726]
  - - [1856, 1856, 1, 3328, 1856, 1856, 3328, 3328]
    - [13, 3886.13]
  - - [448, 128, 1, 128, 448, 448, 128, 128]
    - [3, 70.6316]
  - - [64, 4288, 1, 256, 64, 64, 256, 256]
    - [6, 1149.45]
  - - [128, 256, 1, 768, 128, 128, 768, 768]
    - [18, 351.871]
  - - [64, 128, 1, 1792, 64, 64, 1792, 1792]
    - [5, 165.914]
  - - [2944, 128, 1, 1792, 2944, 2944, 1792, 1792]
    - [8, 2400.07]
  - - [4, 64, 1, 3328, 4, 4, 3328, 3328]
    - [27, 10.5861]
  - - [704, 3584, 1, 256, 704, 704, 256, 256]
    - [12, 2819.15]
  - - [1408, 5888, 1, 1792, 1408, 1408, 1792, 1792]
    - [11, 3776.06]
  - - [6784, 1024, 1, 768, 6784, 6784, 768, 768]
    - [13, 3796.29]
  - - [5056, 1024, 1, 128, 5056, 5056, 128, 128]
    - [0, 1847.4]
  - - [6784, 4288, 1, 1792, 6784, 6784, 1792, 1792]
    - [13, 4118.83]
  - - [448, 3584, 1, 1792, 448, 448, 1792, 1792]
    - [11, 3281.29]
  - - [1856, 64, 1, 3328, 1856, 1856, 3328, 3328]
    - [16, 1638.94]
  - - [3584, 1408, 1, 3328, 3584, 3584, 3328, 3328]
    - [13, 3547.47]
  - - [5056, 2944, 1, 256, 5056, 5056, 256, 256]
    - [13, 3719.76]
  - - [2944, 4, 1, 3328, 2944, 2944, 3328, 3328]
    - [26, 212.438]
  - - [128, 1856, 1, 1792, 128, 128, 1792, 1792]
    - [6, 1942.87]
  - - [1856, 448, 1, 1792, 1856, 1856, 1792, 1792]
    - [12, 2875.17]
  - - [5888, 128, 1, 768, 5888, 5888, 768, 768]
    - [12, 2476.1]
  - - [5888, 1024, 1, 768, 5888, 5888, 768, 768]
    - [17, 3432.86]
  - - [3584, 2944, 1, 1792, 3584, 3584, 1792, 1792]
    - [17, 3954.77]
  - - [128, 5056, 1, 256, 128, 128, 256, 256]
    - [6, 1905.19]
  - - [256, 5888, 1, 256, 256, 256, 256, 256]
    - [17, 2644.44]
  - - [6784, 2368, 1, 768, 6784, 6784, 768, 768]
    - [17, 3882.47]
  - - [4288, 3584, 1, 768, 4288, 4288, 768, 768]
    - [13, 4244.5]
  - - [128, 1024, 1, 3328, 128, 128, 3328, 3328]
    - [5, 1398.46]
  - - [448, 4, 1, 256, 448, 448, 256, 256]
    - [27, 9.40066]
  - - [5056, 128, 1, 256, 5056, 5056, 256, 256]
    - [6, 1887.82]
  - - [4, 5888, 1, 256, 4, 4, 256, 256]
    - [26, 82.2777]
  - - [448, 2368, 1, 3328, 448, 448, 3328, 3328]
    - [8, 2746.92]
  - - [256, 704, 1, 768, 256, 256, 768, 768]
    - [8, 1427.52]
  - - [1856, 2368, 1, 1792, 1856, 1856, 1792, 1792]
    - [17, 3481.2]
  - - [256, 64, 1, 3328, 256, 256, 3328, 3328]
    - [5, 456.513]
  - - [1408, 448, 1, 768, 1408, 1408, 768, 768]
    - [8, 2289.42]
  - - [4, 2368, 1, 3328, 4, 4, 3328, 3328]
    - [26, 205.978]
  - - [6784, 3584, 1, 768, 6784, 6784, 768, 768]
    - [17, 4021.59]
  - - [64, 64, 1, 3328, 64, 64, 3328, 3328]
    - [10, 139.438]
  - - [3584, 256, 1, 256, 3584, 3584, 256, 256]
    - [12, 2577.71]
  - - [704, 64, 1, 256, 704, 704, 256, 256]
    - [18, 344.103]
  - - [3584, 448, 1, 128, 3584, 3584, 128, 128]
    - [0, 1121.35]
  - - [1856, 704, 1, 128, 1856, 1856, 128, 128]
    - [0, 1018.31]
  - - [128, 3584, 1, 768, 128, 128, 768, 768]
    - [6, 2590.6]
  - - [704, 4, 1, 3328, 704, 704, 3328, 3328]
    - [27, 95.7072]
  - - [5056, 4288, 1, 3328, 5056, 5056, 3328, 3328]
    - [13, 4135.36]
  - - [4, 64, 1, 128, 4, 4, 128, 128]
    - [24, 0.571274]
  - - [2368, 448, 1, 768, 2368, 2368, 768, 768]
    - [8, 2503.51]
  - - [704, 3584, 1, 128, 704, 704, 128, 128]
    - [0, 1544.97]
  - - [1408, 1856, 1, 256, 1408, 1408, 256, 256]
    - [12, 2902.6]
  - - [4, 2944, 1, 256, 4, 4, 256, 256]
    - [26, 47.7607]
  - - [1024, 4288, 1, 768, 1024, 1024, 768, 768]
    - [12, 3441.89]
  - - [448, 4288, 1, 3328, 448, 448, 3328, 3328]
    - [11, 3956.37]
  - - [704, 128, 1, 1792, 704, 704, 1792, 1792]
    - [5, 1021.51]
  - - [3584, 704, 1, 768, 3584, 3584, 768, 768]
    - [17, 3095.87]
  - - [256, 64, 1, 768, 256, 256, 768, 768]
    - [18, 171.336]
  - - [704, 6784, 1, 768, 704, 704, 768, 768]
    - [11, 3707.07]
  - - [5056, 4288, 1, 768, 5056, 5056, 768, 768]
    - [13, 4001.41]
  - - [2368, 3584, 1, 3328, 2368, 2368, 3328, 3328]
    - [17, 3788.23]
  - - [5056, 2368, 1, 3328, 5056, 5056, 3328, 3328]
    - [11, 3830.18]
  - - [2944, 4, 1, 768, 2944, 2944, 768, 768]
    - [30, 119.503]
  - - [128, 256, 1, 1792, 128, 128, 1792, 1792]
    - [5, 517.998]
  - - [5056, 3584, 1, 1792, 5056, 5056, 1792, 1792]
    - [13, 4108.88]
  - - [704, 6784, 1, 1792, 704, 704, 1792, 1792]
    - [11, 3783.06]
  - - [704, 4, 1, 256, 704, 704, 256, 256]
    - [27, 13.7786]
  - - [128, 2944, 1, 256, 128, 128, 256, 256]
    - [6, 1627.34]
  - - [256, 6784, 1, 768, 256, 256, 768, 768]
    - [11, 3396.28]
  - - [3584, 704, 1, 3328, 3584, 3584, 3328, 3328]
    - [17, 3228.52]
  - - [2944, 4, 1, 256, 2944, 2944, 256, 256]
    - [29, 49.9777]
  - - [64, 256, 1, 3328, 64, 64, 3328, 3328]
    - [5, 436.068]
  - - [1024, 2368, 1, 768, 1024, 1024, 768, 768]
    - [12, 3324.06]
  - - [256, 1856, 1, 1792, 256, 256, 1792, 1792]
    - [8, 3001.42]
  - - [2368, 4288, 1, 1792, 2368, 2368, 1792, 1792]
    - [13, 3816.46]
  - - [704, 128, 1, 768, 704, 704, 768, 768]
    - [18, 917.365]
  - - [6784, 2368, 1, 1792, 6784, 6784, 1792, 1792]
    - [17, 3941.26]
  - - [704, 1408, 1, 128, 704, 704, 128, 128]
    - [0, 818.777]
  - - [5056, 256, 1, 3328, 5056, 5056, 3328, 3328]
    - [12, 3009.58]
  - - [5888, 5056, 1, 256, 5888, 5888, 256, 256]
    - [17, 3860.72]
  - - [4, 1856, 1, 256, 4, 4, 256, 256]
    - [29, 31.5077]
  - - [5888, 4288, 1, 768, 5888, 5888, 768, 768]
    - [17, 4031.31]
  - - [4, 2944, 1, 768, 4, 4, 768, 768]
    - [26, 113.732]
  - - [1856, 3584, 1, 128, 1856, 1856, 128, 128]
    - [0, 2014.59]
  - - [64, 1856, 1, 768, 64, 64, 768, 768]
    - [18, 1108.19]
  - - [2368, 2944, 1, 128, 2368, 2368, 128, 128]
    - [0, 1952.09]
  - - [5056, 1856, 1, 1792, 5056, 5056, 1792, 1792]
    - [17, 3910.92]
  - - [1408, 448, 1, 256, 1408, 1408, 256, 256]
    - [6, 1845.07]
  - - [4288, 128, 1, 3328, 4288, 4288, 3328, 3328]
    - [7, 2448.55]
  - - [1856, 2368, 1, 256, 1856, 1856, 256, 256]
    - [12, 3341.42]
  - - [5056, 5056, 1, 1792, 5056, 5056, 1792, 1792]
    - [13, 4142.27]
  - - [3584, 448, 1, 768, 3584, 3584, 768, 768]
    - [17, 3137.4]
  - - [448, 448, 1, 128, 448, 448, 128, 128]
    - [3, 244.388]
  - - [256, 4, 1, 256, 256, 256, 256, 256]
    - [30, 5.82025]
  - - [256, 1856, 1, 768, 256, 256, 768, 768]
    - [8, 2710.22]
  - - [1408, 3584, 1, 1792, 1408, 1408, 1792, 1792]
    - [13, 3512.42]
  - - [4, 5056, 1, 1792, 4, 4, 1792, 1792]
    - [27, 80.0529]
  - - [256, 4288, 1, 256, 256, 256, 256, 256]
    - [12, 2234.56]
  - - [64, 448, 1, 1792, 64, 64, 1792, 1792]
    - [5, 466.076]
  - - [3584, 4, 1, 256, 3584, 3584, 256, 256]
    - [26, 58.8144]
  - - [64, 5888, 1, 128, 64, 64, 128, 128]
    - [3, 416.965]
  - - [1408, 1408, 1, 128, 1408, 1408, 128, 128]
    - [0, 1181.8]
  - - [4288, 256, 1, 1792, 4288, 4288, 1792, 1792]
    - [8, 2720.64]
  - - [6784, 3584, 1, 3328, 6784, 6784, 3328, 3328]
    - [17, 4055.35]
  - - [3584, 64, 1, 128, 3584, 3584, 128, 128]
    - [3, 271.25]
  - - [1408, 1408, 1, 1792, 1408, 1408, 1792, 1792]
    - [8, 2899.21]
  - - [1408, 1408, 1, 768, 1408, 1408, 768, 768]
    - [8, 2771.47]
  - - [64, 1856, 1, 1792, 64, 64, 1792, 1792]
    - [18, 1191.56]
  - - [448, 64, 1, 3328, 448, 448, 3328, 3328]
    - [5, 715.94]
  - - [128, 64, 1, 1792, 128, 128, 1792, 1792]
    - [5, 172.14]
  - - [6784, 5056, 1, 3328, 6784, 6784, 3328, 3328]
    - [13, 4358.37]
  - - [704, 3584, 1, 3328, 704, 704, 3328, 3328]
    - [8, 3103.29]
  - - [448, 2944, 1, 768, 448, 448, 768, 768]
    - [12, 2944.55]
  - - [1408, 256, 1, 256, 1408, 1408, 256, 256]
    - [8, 1622.27]
  - - [448, 1856, 1, 3328, 448, 448, 3328, 3328]
    - [12, 2914.06]
  - - [3584, 1408, 1, 128, 3584, 3584, 128, 128]
    - [0, 1567.47]
  - - [1856, 4, 1, 128, 1856, 1856, 128, 128]
    - [23, 17.0914]
  - - [4, 128, 1, 128, 4, 4, 128, 128]
    - [24, 1.15381]
  - - [128, 64, 1, 3328, 128, 128, 3328, 3328]
    - [10, 273.067]
  - - [4, 5056, 1, 3328, 4, 4, 3328, 3328]
    - [30, 68.6962]
  - - [128, 1408, 1, 1792, 128, 128, 1792, 1792]
    - [6, 1509.17]
  - - [2944, 2944, 1, 1792, 2944, 2944, 1792, 1792]
    - [17, 3943.29]
  - - [4, 1856, 1, 768, 4, 4, 768, 768]
    - [27, 79.8101]
  - - [256, 4, 1, 128, 256, 256, 128, 128]
    - [23, 2.54018]
  - - [6784, 1024, 1, 128, 6784, 6784, 128, 128]
    - [0, 1865.86]
  - - [3584, 64, 1, 3328, 3584, 3584, 3328, 3328]
    - [22, 2028.93]
  - - [128, 3584, 1, 3328, 128, 128, 3328, 3328]
    - [6, 2936.92]
  - - [5888, 256, 1, 1792, 5888, 5888, 1792, 1792]
    - [11, 3080.95]
  - - [448, 1856, 1, 1792, 448, 448, 1792, 1792]
    - [12, 2866.32]
  - - [448, 256, 1, 256, 448, 448, 256, 256]
    - [18, 752.052]
  - - [4288, 4288, 1, 768, 4288, 4288, 768, 768]
    - [13, 4067.72]
  - - [256, 6784, 1, 1792, 256, 256, 1792, 1792]
    - [17, 3547.2]
  - - [4288, 4288, 1, 1792, 4288, 4288, 1792, 1792]
    - [13, 4149.76]
  - - [4, 704, 1, 3328, 4, 4, 3328, 3328]
    - [27, 97.0557]
  - - [6784, 1856, 1, 1792, 6784, 6784, 1792, 1792]
    - [17, 4013.96]
  - - [1856, 5056, 1, 768, 1856, 1856, 768, 768]
    - [17, 3845.39]
  - - [5056, 128, 1, 768, 5056, 5056, 768, 768]
    - [8, 2299.34]
  - - [1408, 1856, 1, 128, 1408, 1408, 128, 128]
    - [0, 1554.93]
  - - [1856, 3584, 1, 256, 1856, 1856, 256, 256]
    - [11, 3492.96]
  - - [6784, 5056, 1, 768, 6784, 6784, 768, 768]
    - [13, 4235.92]
  - - [128, 4, 1, 256, 128, 128, 256, 256]
    - [29, 3.25726]
  - - [704, 2368, 1, 768, 704, 704, 768, 768]
    - [17, 3220.1]
  - - [704, 2944, 1, 128, 704, 704, 128, 128]
    - [0, 1285.32]
  - - [1024, 256, 1, 128, 1024, 1024, 128, 128]
    - [3, 303.276]
  - - [5056, 5056, 1, 256, 5056, 5056, 256, 256]
    - [17, 3770.72]
  - - [4288, 1408, 1, 3328, 4288, 4288, 3328, 3328]
    - [11, 3517.65]
  - - [1024, 64, 1, 256, 1024, 1024, 256, 256]
    - [18, 480.998]
  - - [2368, 1408, 1, 3328, 2368, 2368, 3328, 3328]
    - [13, 3782.09]
  - - [5056, 128, 1, 1792, 5056, 5056, 1792, 1792]
    - [8, 2456.63]
  - - [128, 448, 1, 128, 128, 128, 128, 128]
    - [3, 70.7951]
  - - [128, 6784, 1, 256, 128, 128, 256, 256]
    - [12, 2414.18]
  - - [4, 1408, 1, 1792, 4, 4, 1792, 1792]
    - [27, 120.494]
  - - [2368, 1024, 1, 128, 2368, 2368, 128, 128]
    - [0, 1491.06]
  - - [4288, 64, 1, 1792, 4288, 4288, 1792, 1792]
    - [8, 1757.37]
  - - [2944, 256, 1, 768, 2944, 2944, 768, 768]
    - [12, 2475.26]
  - - [2944, 704, 1, 128, 2944, 2944, 128, 128]
    - [0, 1238.75]
  - - [256, 3584, 1, 768, 256, 256, 768, 768]
    - [12, 3001.04]
  - - [5056, 448, 1, 3328, 5056, 5056, 3328, 3328]
    - [8, 3075.92]
  - - [5888, 4288, 1, 128, 5888, 5888, 128, 128]
    - [0, 2107.82]
  - - [5056, 6784, 1, 256, 5056, 5056, 256, 256]
    - [13, 3953.88]
  - - [1024, 448, 1, 1792, 1024, 1024, 1792, 1792]
    - [8, 2864.0]
  - - [4, 5888, 1, 3328, 4, 4, 3328, 3328]
    - [27, 69.9434]
  - - [3584, 3584, 1, 1792, 3584, 3584, 1792, 1792]
    - [17, 3843.46]
  - - [6784, 4, 1, 256, 6784, 6784, 256, 256]
    - [28, 100.041]
  - - [2944, 64, 1, 768, 2944, 2944, 768, 768]
    - [18, 1409.82]
  - - [256, 4288, 1, 1792, 256, 256, 1792, 1792]
    - [8, 2708.35]
  - - [448, 2368, 1, 1792, 448, 448, 1792, 1792]
    - [8, 2683.31]
  - - [256, 4, 1, 768, 256, 256, 768, 768]
    - [27, 15.2409]
  - - [448, 3584, 1, 256, 448, 448, 256, 256]
    - [11, 2821.54]
  - - [448, 1024, 1, 768, 448, 448, 768, 768]
    - [8, 2659.43]
  - - [5888, 1856, 1, 768, 5888, 5888, 768, 768]
    - [13, 3926.72]
  - - [1408, 4, 1, 1792, 1408, 1408, 1792, 1792]
    - [27, 124.17]
  - - [448, 2944, 1, 128, 448, 448, 128, 128]
    - [0, 1033.93]
  - - [64, 5056, 1, 768, 64, 64, 768, 768]
    - [8, 1704.94]
  - - [6784, 128, 1, 128, 6784, 6784, 128, 128]
    - [4, 771.012]
  - - [1024, 1856, 1, 3328, 1024, 1024, 3328, 3328]
    - [17, 3913.99]
  - - [1856, 4, 1, 1792, 1856, 1856, 1792, 1792]
    - [27, 152.287]
  - - [128, 1024, 1, 256, 128, 128, 256, 256]
    - [6, 773.857]
  - - [6784, 1024, 1, 3328, 6784, 6784, 3328, 3328]
    - [13, 3955.21]
  - - [1024, 3584, 1, 768, 1024, 1024, 768, 768]
    - [13, 3754.09]
  - - [1024, 256, 1, 768, 1024, 1024, 768, 768]
    - [8, 1531.7]
  - - [4288, 1856, 1, 256, 4288, 4288, 256, 256]
    - [12, 3329.06]
  - - [6784, 256, 1, 1792, 6784, 6784, 1792, 1792]
    - [11, 3550.12]
  - - [1024, 704, 1, 1792, 1024, 1024, 1792, 1792]
    - [6, 2693.14]
  - - [704, 6784, 1, 256, 704, 704, 256, 256]
    - [11, 3347.13]
  - - [2368, 1408, 1, 1792, 2368, 2368, 1792, 1792]
    - [13, 3728.09]
  - - [2944, 1024, 1, 128, 2944, 2944, 128, 128]
    - [0, 1428.33]
  - - [4288, 448, 1, 256, 4288, 4288, 256, 256]
    - [17, 3218.47]
  - - [1024, 2944, 1, 1792, 1024, 1024, 1792, 1792]
    - [13, 3339.02]
  - - [128, 4, 1, 1792, 128, 128, 1792, 1792]
    - [27, 14.4808]
  - - [64, 5888, 1, 3328, 64, 64, 3328, 3328]
    - [6, 2227.37]
  - - [1408, 64, 1, 3328, 1408, 1408, 3328, 3328]
    - [16, 1406.1]
  - - [256, 128, 1, 128, 256, 256, 128, 128]
    - [3, 40.5796]
  - - [2944, 1408, 1, 256, 2944, 2944, 256, 256]
    - [12, 3175.6]
  - - [1408, 3584, 1, 3328, 1408, 1408, 3328, 3328]
    - [13, 3560.83]
  - - [1408, 64, 1, 768, 1408, 1408, 768, 768]
    - [18, 909.648]
  - - [1856, 256, 1, 1792, 1856, 1856, 1792, 1792]
    - [8, 3011.61]
  - - [5888, 6784, 1, 256, 5888, 5888, 256, 256]
    - [17, 3932.12]
  - - [3584, 1856, 1, 3328, 3584, 3584, 3328, 3328]
    - [17, 3873.56]
  - - [5056, 256, 1, 1792, 5056, 5056, 1792, 1792]
    - [12, 2982.83]
  - - [448, 128, 1, 1792, 448, 448, 1792, 1792]
    - [5, 803.821]
  - - [2368, 4288, 1, 768, 2368, 2368, 768, 768]
    - [17, 3745.13]
  - - [1856, 5888, 1, 128, 1856, 1856, 128, 128]
    - [0, 2112.74]
  - - [3584, 128, 1, 256, 3584, 3584, 256, 256]
    - [8, 2000.01]
  - - [4, 4, 1, 768, 4, 4, 768, 768]
    - [30, 0.255574]
  - - [1408, 2368, 1, 256, 1408, 1408, 256, 256]
    - [12, 3201.1]
  - - [4288, 4, 1, 3328, 4288, 4288, 3328, 3328]
    - [29, 65.3711]
  - - [4, 4, 1, 3328, 4, 4, 3328, 3328]
    - [27, 0.646846]
  - - [256, 1408, 1, 1792, 256, 256, 1792, 1792]
    - [8, 2297.68]
  - - [256, 64, 1, 1792, 256, 256, 1792, 1792]
    - [5, 318.855]
  - - [1408, 256, 1, 768, 1408, 1408, 768, 768]
    - [8, 2095.88]
  - - [1856, 64, 1, 768, 1856, 1856, 768, 768]
    - [18, 1144.91]
  - - [128, 1856, 1, 768, 128, 128, 768, 768]
    - [6, 1784.55]
  - - [704, 256, 1, 256, 704, 704, 256, 256]
    - [8, 1028.02]
  - - [3584, 5888, 1, 256, 3584, 3584, 256, 256]
    - [11, 3796.07]
  - - [256, 1408, 1, 768, 256, 256, 768, 768]
    - [8, 2121.58]
  - - [1856, 4288, 1, 1792, 1856, 1856, 1792, 1792]
    - [17, 3622.0]
  - - [256, 2944, 1, 768, 256, 256, 768, 768]
    - [12, 2469.34]
  - - [1856, 704, 1, 3328, 1856, 1856, 3328, 3328]
    - [6, 2857.36]
  - - [448, 5888, 1, 1792, 448, 448, 1792, 1792]
    - [11, 3337.89]
  - - [64, 4288, 1, 3328, 64, 64, 3328, 3328]
    - [14, 1916.79]
  - - [448, 6784, 1, 3328, 448, 448, 3328, 3328]
    - [13, 3429.41]
  - - [5888, 2944, 1, 1792, 5888, 5888, 1792, 1792]
    - [17, 4037.31]
  - - [704, 5888, 1, 256, 704, 704, 256, 256]
    - [12, 3163.48]
  - - [5888, 2368, 1, 1792, 5888, 5888, 1792, 1792]
    - [13, 3922.22]
  - - [4, 5888, 1, 768, 4, 4, 768, 768]
    - [29, 180.735]
  - - [2368, 64, 1, 128, 2368, 2368, 128, 128]
    - [3, 183.006]
  - - [64, 128, 1, 768, 64, 64, 768, 768]
    - [5, 88.8624]
  - - [1856, 1024, 1, 3328, 1856, 1856, 3328, 3328]
    - [11, 3927.6]
  - - [1408, 4288, 1, 768, 1408, 1408, 768, 768]
    - [17, 3437.32]
  - - [2368, 256, 1, 3328, 2368, 2368, 3328, 3328]
    - [14, 2652.88]
  - - [256, 6784, 1, 128, 256, 256, 128, 128]
    - [0, 1206.57]
  - - [5888, 64, 1, 768, 5888, 5888, 768, 768]
    - [8, 2166.22]
  - - [704, 256, 1, 3328, 704, 704, 3328, 3328]
    - [22, 1771.58]
  - - [128, 1408, 1, 128, 128, 128, 128, 128]
    - [3, 217.958]
  - - [5888, 4288, 1, 256, 5888, 5888, 256, 256]
    - [17, 3883.9]
  - - [1856, 5888, 1, 1792, 1856, 1856, 1792, 1792]
    - [13, 4110.25]
  - - [1408, 2944, 1, 768, 1408, 1408, 768, 768]
    - [12, 3259.36]
  - - [6784, 6784, 1, 128, 6784, 6784, 128, 128]
    - [0, 2246.59]
  - - [448, 5056, 1, 128, 448, 448, 128, 128]
    - [0, 1412.92]
  - - [448, 2368, 1, 128, 448, 448, 128, 128]
    - [0, 809.434]
  - - [1856, 6784, 1, 768, 1856, 1856, 768, 768]
    - [11, 3964.27]
  - - [2944, 3584, 1, 3328, 2944, 2944, 3328, 3328]
    - [13, 4013.88]
  - - [1408, 5056, 1, 1792, 1408, 1408, 1792, 1792]
    - [13, 3986.16]
  - - [1408, 704, 1, 128, 1408, 1408, 128, 128]
    - [0, 756.666]
  - - [1408, 6784, 1, 768, 1408, 1408, 768, 768]
    - [11, 3931.66]
  - - [4288, 3584, 1, 256, 4288, 4288, 256, 256]
    - [13, 3817.3]
  - - [128, 1024, 1, 768, 128, 128, 768, 768]
    - [6, 1057.39]
  - - [3584, 256, 1, 768, 3584, 3584, 768, 768]
    - [12, 2968.67]
  - - [4, 448, 1, 768, 4, 4, 768, 768]
    - [27, 24.3327]
  - - [128, 64, 1, 128, 128, 128, 128, 128]
    - [3, 10.3943]
  - - [2368, 64, 1, 256, 2368, 2368, 256, 256]
    - [6, 886.593]
  - - [6784, 6784, 1, 256, 6784, 6784, 256, 256]
    - [11, 3957.45]
  - - [64, 1024, 1, 768, 64, 64, 768, 768]
    - [18, 682.37]
  - - [256, 1408, 1, 128, 256, 256, 128, 128]
    - [3, 404.146]
  - - [128, 4288, 1, 3328, 128, 128, 3328, 3328]
    - [20, 2361.69]
  - - [704, 4288, 1, 768, 704, 704, 768, 768]
    - [13, 3163.07]
  - - [256, 4288, 1, 128, 256, 256, 128, 128]
    - [0, 796.176]
  - - [6784, 6784, 1, 1792, 6784, 6784, 1792, 1792]
    - [13, 4355.54]
  - - [448, 128, 1, 768, 448, 448, 768, 768]
    - [18, 594.495]
  - - [3584, 5056, 1, 3328, 3584, 3584, 3328, 3328]
    - [13, 4118.95]
  - - [704, 5056, 1, 256, 704, 704, 256, 256]
    - [11, 3112.92]
  - - [5888, 2368, 1, 3328, 5888, 5888, 3328, 3328]
    - [13, 3971.76]
  - - [6784, 5056, 1, 256, 6784, 6784, 256, 256]
    - [17, 3921.25]
  - - [5888, 128, 1, 128, 5888, 5888, 128, 128]
    - [4, 690.247]
  - - [1024, 1856, 1, 1792, 1024, 1024, 1792, 1792]
    - [17, 3870.2]
  - - [1856, 4, 1, 768, 1856, 1856, 768, 768]
    - [27, 83.9463]
  - - [64, 704, 1, 1792, 64, 64, 1792, 1792]
    - [5, 650.293]
  - - [448, 128, 1, 3328, 448, 448, 3328, 3328]
    - [5, 1125.77]
  - - [1024, 128, 1, 3328, 1024, 1024, 3328, 3328]
    - [22, 1301.34]
  - - [6784, 128, 1, 256, 6784, 6784, 256, 256]
    - [12, 2461.23]
  - - [256, 5056, 1, 768, 256, 256, 768, 768]
    - [12, 2887.0]
  - - [4288, 5056, 1, 3328, 4288, 4288, 3328, 3328]
    - [13, 4132.33]
  - - [1408, 128, 1, 128, 1408, 1408, 128, 128]
    - [3, 226.697]
  - - [1408, 1024, 1, 3328, 1408, 1408, 3328, 3328]
    - [11, 2991.75]
  - - [5056, 704, 1, 128, 5056, 5056, 128, 128]
    - [0, 1713.84]
  - - [448, 5888, 1, 768, 448, 448, 768, 768]
    - [11, 3235.36]
  - - [6784, 1024, 1, 1792, 6784, 6784, 1792, 1792]
    - [13, 3907.02]
  - - [128, 4, 1, 768, 128, 128, 768, 768]
    - [27, 7.81431]
  - - [6784, 4, 1, 128, 6784, 6784, 128, 128]
    - [23, 62.2034]
  - - [5056, 6784, 1, 1792, 5056, 5056, 1792, 1792]
    - [13, 4333.83]
  - - [2368, 1856, 1, 768, 2368, 2368, 768, 768]
    - [12, 3420.8]
  - - [1408, 704, 1, 1792, 1408, 1408, 1792, 1792]
    - [8, 2476.98]
  - - [6784, 704, 1, 3328, 6784, 6784, 3328, 3328]
    - [17, 3822.88]
  - - [256, 1408, 1, 256, 256, 256, 256, 256]
    - [8, 1613.19]
  - - [5056, 5888, 1, 128, 5056, 5056, 128, 128]
    - [0, 2267.63]
  - - [64, 448, 1, 768, 64, 64, 768, 768]
    - [18, 304.481]
  - - [1408, 64, 1, 128, 1408, 1408, 128, 128]
    - [3, 112.905]
  - - [1408, 4, 1, 768, 1408, 1408, 768, 768]
    - [27, 66.7496]
  - - [704, 5888, 1, 768, 704, 704, 768, 768]
    - [12, 3278.42]
  - - [4, 2368, 1, 128, 4, 4, 128, 128]
    - [23, 21.7437]
  - - [448, 128, 1, 256, 448, 448, 256, 256]
    - [18, 440.05]
  - - [2944, 1024, 1, 768, 2944, 2944, 768, 768]
    - [13, 3237.94]
  - - [3584, 64, 1, 1792, 3584, 3584, 1792, 1792]
    - [18, 1895.95]
  - - [256, 5888, 1, 128, 256, 256, 128, 128]
    - [0, 1061.5]
  - - [4288, 5056, 1, 256, 4288, 4288, 256, 256]
    - [17, 3734.33]
  - - [3584, 704, 1, 128, 3584, 3584, 128, 128]
    - [0, 1237.59]
  - - [448, 704, 1, 128, 448, 448, 128, 128]
    - [3, 373.521]
  - - [5888, 1024, 1, 3328, 5888, 5888, 3328, 3328]
    - [11, 3513.81]
  - - [448, 256, 1, 1792, 448, 448, 1792, 1792]
    - [18, 1300.77]
  - - [4, 5888, 1, 1792, 4, 4, 1792, 1792]
    - [27, 92.1515]
  - - [3584, 2944, 1, 3328, 3584, 3584, 3328, 3328]
    - [13, 3993.0]
  - - [5056, 1024, 1, 1792, 5056, 5056, 1792, 1792]
    - [13, 3596.05]
  - - [1024, 4288, 1, 3328, 1024, 1024, 3328, 3328]
    - [17, 3516.59]
  - - [128, 5888, 1, 128, 128, 128, 128, 128]
    - [0, 671.416]
  - - [64, 5056, 1, 128, 64, 64, 128, 128]
    - [3, 373.815]
  - - [1408, 4288, 1, 3328, 1408, 1408, 3328, 3328]
    - [11, 3490.96]
  - - [5056, 4288, 1, 256, 5056, 5056, 256, 256]
    - [17, 3731.32]
  - - [2944, 5888, 1, 3328, 2944, 2944, 3328, 3328]
    - [17, 4048.09]
  - - [704, 3584, 1, 768, 704, 704, 768, 768]
    - [11, 3101.42]
  - - [5888, 128, 1, 3328, 5888, 5888, 3328, 3328]
    - [12, 2640.87]
  - - [448, 448, 1, 1792, 448, 448, 1792, 1792]
    - [6, 1731.14]
  - - [64, 5056, 1, 1792, 64, 64, 1792, 1792]
    - [8, 1963.24]
  - - [2368, 448, 1, 256, 2368, 2368, 256, 256]
    - [12, 2165.03]
  - - [2368, 5888, 1, 3328, 2368, 2368, 3328, 3328]
    - [13, 3985.49]
  - - [1024, 3584, 1, 3328, 1024, 1024, 3328, 3328]
    - [13, 4105.76]
  - - [1408, 1024, 1, 768, 1408, 1408, 768, 768]
    - [12, 3216.64]
  - - [128, 128, 1, 128, 128, 128, 128, 128]
    - [3, 20.7228]
  - - [5056, 6784, 1, 768, 5056, 5056, 768, 768]
    - [13, 4246.74]
  - - [1408, 448, 1, 3328, 1408, 1408, 3328, 3328]
    - [20, 2385.51]
  - - [6784, 4288, 1, 3328, 6784, 6784, 3328, 3328]
    - [13, 4157.67]
  - - [1024, 5888, 1, 128, 1024, 1024, 128, 128]
    - [0, 1585.36]
  - - [1856, 2368, 1, 128, 1856, 1856, 128, 128]
    - [0, 1808.65]
  - - [6784, 3584, 1, 128, 6784, 6784, 128, 128]
    - [0, 2193.65]
  - - [704, 1408, 1, 3328, 704, 704, 3328, 3328]
    - [14, 2683.72]
  - - [64, 2368, 1, 1792, 64, 64, 1792, 1792]
    - [18, 1248.08]
  - - [4288, 1408, 1, 1792, 4288, 4288, 1792, 1792]
    - [11, 3500.0]
  - - [704, 256, 1, 128, 704, 704, 128, 128]
    - [3, 225.104]
  - - [704, 256, 1, 768, 704, 704, 768, 768]
    - [6, 1426.34]
  - - [704, 2368, 1, 1792, 704, 704, 1792, 1792]
    - [17, 3388.3]
  - - [1024, 4, 1, 1792, 1024, 1024, 1792, 1792]
    - [30, 91.8422]
  - - [5888, 4, 1, 128, 5888, 5888, 128, 128]
    - [23, 54.143]
- null
