HostLibraryTests/configs/lite_configs_mixed/arcturus_Cijk_Ailk_Bljk_SB.yaml
- {MinimumRequiredVersion: 4.12.0}
- arcturus
- gfx908
- [Device 7380, Device 7388, Device 738c]
    SolutionIndex: 0
    SolutionNameMin: Cijk_Ailk_Bljk_SB_MT64x64x8_SE_AMAS2_GRVW4_GSU1_VW4
    SolutionIndex: 1
    SolutionNameMin: Cijk_Ailk_Bljk_SB_MT32x32x16_SE_AMAS2_GRVW4_GSU1_VW4
    SolutionIndex: 2
    SolutionNameMin: Cijk_Ailk_Bljk_SB_MT32x64x8_SE_AMAS2_GRVW4_GSU1_VW4
    SolutionIndex: 3
    SolutionNameMin: Cijk_Ailk_Bljk_SB_MT64x128x16_SE_AMAS2_GRVW4_GSU1_VW4
    SolutionIndex: 4
    SolutionNameMin: Cijk_Ailk_Bljk_SB_MT64x32x8_SE_AMAS2_GRVW4_GSU1_VW4
    SolutionIndex: 5
    SolutionNameMin: Cijk_Ailk_Bljk_SB_MT32x32x32_SE_AMAS3_GRVW4_GSU8_VW4
    SolutionIndex: 6
    SolutionNameMin: Cijk_Ailk_Bljk_SB_MT64x32x32_SE_AMAS3_GRVW4_GSU1_VW4
    SolutionIndex: 7
    SolutionNameMin: Cijk_Ailk_Bljk_SB_MT32x64x32_SE_AMAS3_GRVW4_GSU1_VW4
    SolutionIndex: 8
    SolutionNameMin: Cijk_Ailk_Bljk_SB_MT128x64x8_SE_AMAS0_GRVW1_GSU8_VW1
    SolutionIndex: 9
    SolutionNameMin: Cijk_Ailk_Bljk_SB_MT64x64x8_SE_AMAS0_GRVW1_GSU8_VW1
    SolutionIndex: 10
    SolutionNameMin: Cijk_Ailk_Bljk_SB_MT64x64x16_SE_AMAS3_GRVW4_GSU1_VW4
    SolutionIndex: 11
    SolutionNameMin: Cijk_Ailk_Bljk_SB_MT32x32x8_SE_AMAS3_GRVW4_GSU1_VW4
    SolutionIndex: 12
    SolutionNameMin: Cijk_Ailk_Bljk_SB_MT64x128x16_SE_AMAS3_GRVW4_GSU1_VW4
    SolutionIndex: 13
    SolutionNameMin: Cijk_Ailk_Bljk_SB_MT64x32x16_SE_AMAS0_GRVW1_GSU8_VW1
    SolutionIndex: 14
    SolutionNameMin: Cijk_Ailk_Bljk_SB_MT128x64x8_SE_AMAS3_GRVW4_GSU1_VW4
    SolutionIndex: 15
    SolutionNameMin: Cijk_Ailk_Bljk_SB_MT64x32x32_SE_AMAS3_GRVW4_GSU4_VW4
    SolutionIndex: 16
    SolutionNameMin: Cijk_Ailk_Bljk_SB_MT32x32x8_SE_AMAS0_GRVW1_GSU4_VW1
    SolutionIndex: 17
    SolutionNameMin: Cijk_Ailk_Bljk_SB_MT64x32x32_SE_AMAS3_GRVW4_GSU2_VW4
    SolutionIndex: 18
    SolutionNameMin: Cijk_Ailk_Bljk_SB_MT128x128x8_SE_AMAS3_GRVW4_GSU1_VW4
    SolutionIndex: 19
    SolutionNameMin: Cijk_Ailk_Bljk_SB_MT64x128x8_SE_AMAS0_GRVW1_GSU8_VW1
    SolutionIndex: 20
    SolutionNameMin: Cijk_Ailk_Bljk_SB_MT16x16x4_SE_AMAS2_GRVW2_GSU1_VW2
    SolutionIndex: 21
    SolutionNameMin: Cijk_Ailk_Bljk_SB_MT16x16x4_SE_AMAS0_GRVW1_GSU1_VW1
    SolutionIndex: 22
    SolutionNameMin: Cijk_Ailk_Bljk_SB_MT8x8x8_SE_AMAS3_GRVW2_GSU2_VW2
    SolutionIndex: 23
    SolutionNameMin: Cijk_Ailk_Bljk_SB_MT8x8x8_SE_AMAS3_GRVW2_GSU4_VW2
    SolutionIndex: 24
    SolutionNameMin: Cijk_Ailk_Bljk_SB_MT8x8x8_SE_AMAS3_GRVW2_GSU8_VW2
    SolutionIndex: 25
    SolutionNameMin: Cijk_Ailk_Bljk_SB_MT8x8x8_SE_AMAS0_GRVW1_GSU4_VW1
    SolutionIndex: 26
    SolutionNameMin: Cijk_Ailk_Bljk_SB_MT8x8x8_SE_AMAS0_GRVW1_GSU8_VW1
- - - [4, 2368, 1, 256, 4, 4, 4, 256]
    - [25, 39.3642]
  - - [2368, 4288, 1, 768, 2368, 2368, 2368, 768]
    - [14, 4148.36]
  - - [5888, 1856, 1, 768, 5888, 5888, 5888, 768]
    - [14, 4141.24]
  - - [3584, 2944, 1, 1792, 3584, 3584, 3584, 1792]
    - [14, 4378.86]
  - - [5056, 64, 1, 1792, 5056, 5056, 5056, 1792]
    - [6, 2352.57]
  - - [256, 1856, 1, 128, 256, 256, 256, 128]
    - [1, 566.059]
  - - [4288, 704, 1, 1792, 4288, 4288, 4288, 1792]
    - [6, 3523.35]
  - - [2368, 5888, 1, 256, 2368, 2368, 2368, 256]
    - [14, 3995.42]
  - - [4288, 3584, 1, 768, 4288, 4288, 4288, 768]
    - [14, 4359.77]
  - - [3584, 5056, 1, 768, 3584, 3584, 3584, 768]
    - [14, 4346.04]
  - - [1856, 1408, 1, 3328, 1856, 1856, 1856, 3328]
    - [14, 3978.89]
  - - [1408, 2944, 1, 768, 1408, 1408, 1408, 768]
    - [14, 3629.13]
  - - [1856, 5056, 1, 256, 1856, 1856, 1856, 256]
    - [14, 3966.27]
  - - [448, 256, 1, 128, 448, 448, 448, 128]
    - [1, 165.764]
  - - [4, 2944, 1, 128, 4, 4, 4, 128]
    - [20, 27.2674]
  - - [6784, 4, 1, 256, 6784, 6784, 6784, 256]
    - [23, 99.9254]
  - - [2944, 2368, 1, 3328, 2944, 2944, 2944, 3328]
    - [14, 3976.72]
  - - [704, 4288, 1, 1792, 704, 704, 704, 1792]
    - [6, 3528.86]
  - - [4, 256, 1, 3328, 4, 4, 4, 3328]
    - [24, 39.961]
  - - [1024, 4, 1, 1792, 1024, 1024, 1024, 1792]
    - [24, 93.5274]
  - - [1024, 128, 1, 768, 1024, 1024, 1024, 768]
    - [6, 1106.68]
  - - [5056, 2368, 1, 768, 5056, 5056, 5056, 768]
    - [14, 4171.94]
  - - [5888, 1024, 1, 256, 5888, 5888, 5888, 256]
    - [14, 3639.65]
  - - [64, 4288, 1, 256, 64, 64, 64, 256]
    - [6, 1297.17]
  - - [256, 1408, 1, 1792, 256, 256, 256, 1792]
    - [6, 2622.29]
  - - [4, 4288, 1, 256, 4, 4, 4, 256]
    - [25, 65.341]
  - - [2944, 704, 1, 768, 2944, 2944, 2944, 768]
    - [6, 3218.49]
  - - [5056, 704, 1, 768, 5056, 5056, 5056, 768]
    - [18, 3755.41]
  - - [448, 128, 1, 768, 448, 448, 448, 768]
    - [6, 495.056]
  - - [6784, 1856, 1, 3328, 6784, 6784, 6784, 3328]
    - [14, 4461.2]
  - - [256, 6784, 1, 256, 256, 256, 256, 256]
    - [14, 3094.35]
  - - [4288, 5056, 1, 256, 4288, 4288, 4288, 256]
    - [14, 4145.09]
  - - [1856, 6784, 1, 256, 1856, 1856, 1856, 256]
    - [14, 3864.15]
  - - [64, 128, 1, 3328, 64, 64, 64, 3328]
    - [5, 249.844]
  - - [128, 704, 1, 3328, 128, 128, 128, 3328]
    - [16, 1329.78]
  - - [3584, 4, 1, 128, 3584, 3584, 3584, 128]
    - [20, 32.3523]
  - - [256, 1408, 1, 768, 256, 256, 256, 768]
    - [6, 2345.97]
  - - [5888, 448, 1, 128, 5888, 5888, 5888, 128]
    - [4, 1423.93]
  - - [3584, 4288, 1, 3328, 3584, 3584, 3584, 3328]
    - [14, 4439.33]
  - - [6784, 2368, 1, 128, 6784, 6784, 6784, 128]
    - [4, 2220.39]
  - - [1024, 6784, 1, 1792, 1024, 1024, 1024, 1792]
    - [14, 3947.86]
  - - [4, 448, 1, 768, 4, 4, 4, 768]
    - [24, 24.7172]
  - - [128, 3584, 1, 256, 128, 128, 128, 256]
    - [6, 2112.24]
  - - [1408, 1024, 1, 128, 1408, 1408, 1408, 128]
    - [4, 1158.65]
  - - [3584, 704, 1, 3328, 3584, 3584, 3584, 3328]
    - [14, 3849.86]
  - - [256, 6784, 1, 128, 256, 256, 256, 128]
    - [4, 1291.23]
  - - [448, 3584, 1, 1792, 448, 448, 448, 1792]
    - [14, 3495.93]
  - - [4, 6784, 1, 1792, 4, 4, 4, 1792]
    - [26, 101.342]
  - - [2368, 64, 1, 768, 2368, 2368, 2368, 768]
    - [6, 1271.77]
  - - [448, 6784, 1, 1792, 448, 448, 448, 1792]
    - [6, 3546.14]
  - - [1024, 1856, 1, 768, 1024, 1024, 1024, 768]
    - [14, 3935.55]
  - - [5888, 1408, 1, 256, 5888, 5888, 5888, 256]
    - [14, 3944.24]
  - - [2368, 2368, 1, 768, 2368, 2368, 2368, 768]
    - [14, 4127.22]
  - - [704, 128, 1, 128, 704, 704, 704, 128]
    - [1, 132.884]
  - - [5056, 4, 1, 128, 5056, 5056, 5056, 128]
    - [20, 45.1937]
  - - [1408, 448, 1, 3328, 1408, 1408, 1408, 3328]
    - [6, 2893.12]
  - - [3584, 1856, 1, 1792, 3584, 3584, 3584, 1792]
    - [14, 4278.74]
  - - [3584, 1024, 1, 128, 3584, 3584, 3584, 128]
    - [0, 1605.26]
  - - [3584, 4, 1, 256, 3584, 3584, 3584, 256]
    - [23, 60.3621]
  - - [6784, 1856, 1, 256, 6784, 6784, 6784, 256]
    - [14, 4178.75]
  - - [1856, 3584, 1, 3328, 1856, 1856, 1856, 3328]
    - [14, 4276.36]
  - - [4288, 1024, 1, 128, 4288, 4288, 4288, 128]
    - [3, 1766.53]
  - - [64, 64, 1, 256, 64, 64, 64, 256]
    - [6, 21.3472]
  - - [128, 448, 1, 128, 128, 128, 128, 128]
    - [1, 84.6406]
  - - [6784, 704, 1, 3328, 6784, 6784, 6784, 3328]
    - [14, 4300.5]
  - - [5056, 3584, 1, 3328, 5056, 5056, 5056, 3328]
    - [14, 4416.4]
  - - [4, 4288, 1, 3328, 4, 4, 4, 3328]
    - [24, 65.5694]
  - - [2368, 256, 1, 3328, 2368, 2368, 2368, 3328]
    - [19, 2812.03]
  - - [4, 2944, 1, 3328, 4, 4, 4, 3328]
    - [22, 158.641]
  - - [4288, 2944, 1, 3328, 4288, 4288, 4288, 3328]
    - [14, 4160.45]
  - - [4288, 256, 1, 3328, 4288, 4288, 4288, 3328]
    - [6, 3209.78]
  - - [1856, 1856, 1, 1792, 1856, 1856, 1856, 1792]
    - [18, 3848.87]
  - - [1024, 5888, 1, 256, 1024, 1024, 1024, 256]
    - [14, 3625.97]
  - - [4, 5056, 1, 256, 4, 4, 4, 256]
    - [25, 73.0438]
  - - [1024, 2944, 1, 768, 1024, 1024, 1024, 768]
    - [6, 3278.28]
  - - [4288, 5888, 1, 768, 4288, 4288, 4288, 768]
    - [14, 4292.92]
  - - [128, 3584, 1, 768, 128, 128, 128, 768]
    - [6, 2943.86]
  - - [2368, 704, 1, 3328, 2368, 2368, 2368, 3328]
    - [14, 3706.58]
  - - [1856, 1024, 1, 256, 1856, 1856, 1856, 256]
    - [12, 3301.71]
  - - [1024, 3584, 1, 128, 1024, 1024, 1024, 128]
    - [0, 1616.3]
  - - [256, 704, 1, 768, 256, 256, 256, 768]
    - [6, 1495.38]
  - - [3584, 1408, 1, 1792, 3584, 3584, 3584, 1792]
    - [14, 3830.45]
  - - [4288, 6784, 1, 128, 4288, 4288, 4288, 128]
    - [0, 2429.72]
  - - [2944, 64, 1, 768, 2944, 2944, 2944, 768]
    - [6, 1553.95]
  - - [1408, 128, 1, 1792, 1408, 1408, 1408, 1792]
    - [6, 1775.29]
  - - [448, 4, 1, 256, 448, 448, 448, 256]
    - [26, 9.55733]
  - - [6784, 4288, 1, 128, 6784, 6784, 6784, 128]
    - [0, 2377.59]
  - - [1856, 128, 1, 128, 1856, 1856, 1856, 128]
    - [1, 346.183]
  - - [4, 1024, 1, 3328, 4, 4, 4, 3328]
    - [24, 135.234]
  - - [4288, 6784, 1, 1792, 4288, 4288, 4288, 1792]
    - [14, 4349.99]
  - - [4, 4288, 1, 768, 4, 4, 4, 768]
    - [25, 151.063]
  - - [4, 128, 1, 256, 4, 4, 4, 256]
    - [25, 3.21886]
  - - [128, 5056, 1, 128, 128, 128, 128, 128]
    - [1, 704.401]
  - - [128, 5888, 1, 1792, 128, 128, 128, 1792]
    - [6, 2829.71]
  - - [704, 4288, 1, 3328, 704, 704, 704, 3328]
    - [6, 3600.97]
  - - [64, 256, 1, 3328, 64, 64, 64, 3328]
    - [5, 408.618]
  - - [256, 704, 1, 128, 256, 256, 256, 128]
    - [1, 258.154]
  - - [3584, 1024, 1, 3328, 3584, 3584, 3584, 3328]
    - [18, 4157.3]
  - - [3584, 4, 1, 768, 3584, 3584, 3584, 768]
    - [23, 138.875]
  - - [6784, 2944, 1, 256, 6784, 6784, 6784, 256]
    - [14, 4203.55]
  - - [704, 2944, 1, 128, 704, 704, 704, 128]
    - [1, 1300.95]
  - - [1408, 4288, 1, 128, 1408, 1408, 1408, 128]
    - [4, 1839.3]
  - - [448, 6784, 1, 128, 448, 448, 448, 128]
    - [0, 1549.64]
  - - [4, 4, 1, 256, 4, 4, 4, 256]
    - [23, 0.0975238]
  - - [128, 128, 1, 1792, 128, 128, 128, 1792]
    - [13, 271.652]
  - - [5888, 3584, 1, 768, 5888, 5888, 5888, 768]
    - [14, 4388.28]
  - - [4, 2368, 1, 768, 4, 4, 4, 768]
    - [24, 97.8807]
  - - [3584, 5888, 1, 768, 3584, 3584, 3584, 768]
    - [14, 4382.68]
  - - [1856, 1408, 1, 768, 1856, 1856, 1856, 768]
    - [14, 3797.64]
  - - [4288, 1856, 1, 768, 4288, 4288, 4288, 768]
    - [14, 3968.1]
  - - [1408, 1856, 1, 3328, 1408, 1408, 1408, 3328]
    - [14, 3953.56]
  - - [4, 2944, 1, 768, 4, 4, 4, 768]
    - [23, 114.655]
  - - [4288, 64, 1, 768, 4288, 4288, 4288, 768]
    - [6, 1781.3]
  - - [3584, 5888, 1, 1792, 3584, 3584, 3584, 1792]
    - [14, 4428.42]
  - - [5888, 704, 1, 3328, 5888, 5888, 5888, 3328]
    - [6, 3798.7]
  - - [1408, 6784, 1, 1792, 1408, 1408, 1408, 1792]
    - [14, 4183.52]
  - - [704, 4, 1, 128, 704, 704, 704, 128]
    - [20, 6.61621]
  - - [64, 64, 1, 128, 64, 64, 64, 128]
    - [2, 4.36035]
  - - [4, 1856, 1, 768, 4, 4, 4, 768]
    - [24, 80.2595]
  - - [1856, 704, 1, 128, 1856, 1856, 1856, 128]
    - [4, 1114.99]
  - - [6784, 256, 1, 3328, 6784, 6784, 6784, 3328]
    - [14, 3858.52]
  - - [128, 256, 1, 3328, 128, 128, 128, 3328]
    - [13, 732.876]
  - - [128, 128, 1, 128, 128, 128, 128, 128]
    - [1, 26.5866]
  - - [1024, 704, 1, 256, 1024, 1024, 1024, 256]
    - [6, 2114.45]
  - - [64, 6784, 1, 3328, 64, 64, 64, 3328]
    - [6, 3203.57]
  - - [1408, 64, 1, 128, 1408, 1408, 1408, 128]
    - [1, 135.634]
  - - [3584, 1856, 1, 256, 3584, 3584, 3584, 256]
    - [14, 3906.42]
  - - [5888, 128, 1, 128, 5888, 5888, 5888, 128]
    - [1, 889.935]
  - - [448, 6784, 1, 768, 448, 448, 448, 768]
    - [6, 3342.88]
  - - [6784, 704, 1, 768, 6784, 6784, 6784, 768]
    - [14, 4165.82]
  - - [5056, 1024, 1, 128, 5056, 5056, 5056, 128]
    - [3, 1808.68]
  - - [448, 64, 1, 1792, 448, 448, 448, 1792]
    - [13, 450.388]
  - - [6784, 5888, 1, 128, 6784, 6784, 6784, 128]
    - [0, 2462.27]
  - - [5888, 4288, 1, 768, 5888, 5888, 5888, 768]
    - [14, 4447.72]
  - - [1024, 64, 1, 768, 1024, 1024, 1024, 768]
    - [6, 563.751]
  - - [3584, 6784, 1, 128, 3584, 3584, 3584, 128]
    - [0, 2150.84]
  - - [6784, 3584, 1, 1792, 6784, 6784, 6784, 1792]
    - [14, 4496.73]
  - - [704, 5056, 1, 256, 704, 704, 704, 256]
    - [10, 3243.21]
  - - [2368, 4, 1, 3328, 2368, 2368, 2368, 3328]
    - [23, 210.041]
  - - [1408, 2368, 1, 3328, 1408, 1408, 1408, 3328]
    - [18, 3774.26]
  - - [1024, 4288, 1, 1792, 1024, 1024, 1024, 1792]
    - [14, 3927.19]
  - - [2368, 4, 1, 1792, 2368, 2368, 2368, 1792]
    - [26, 181.189]
  - - [1856, 5056, 1, 768, 1856, 1856, 1856, 768]
    - [14, 4209.42]
  - - [1856, 448, 1, 1792, 1856, 1856, 1856, 1792]
    - [10, 3117.73]
  - - [4288, 4, 1, 768, 4288, 4288, 4288, 768]
    - [23, 157.418]
  - - [128, 128, 1, 768, 128, 128, 128, 768]
    - [16, 140.184]
  - - [128, 4288, 1, 128, 128, 128, 128, 128]
    - [1, 578.894]
  - - [1024, 3584, 1, 256, 1024, 1024, 1024, 256]
    - [14, 3493.17]
  - - [5056, 5056, 1, 768, 5056, 5056, 5056, 768]
    - [14, 4340.86]
  - - [64, 4, 1, 768, 64, 64, 64, 768]
    - [26, 4.38075]
  - - [448, 5056, 1, 768, 448, 448, 448, 768]
    - [10, 3334.59]
  - - [6784, 64, 1, 1792, 6784, 6784, 6784, 1792]
    - [6, 3135.25]
  - - [3584, 5056, 1, 128, 3584, 3584, 3584, 128]
    - [0, 2084.49]
  - - [4288, 128, 1, 128, 4288, 4288, 4288, 128]
    - [1, 655.849]
  - - [1856, 4288, 1, 256, 1856, 1856, 1856, 256]
    - [14, 3755.13]
  - - [64, 1408, 1, 256, 64, 64, 64, 256]
    - [11, 516.771]
  - - [64, 6784, 1, 768, 64, 64, 64, 768]
    - [6, 2670.14]
  - - [256, 448, 1, 1792, 256, 256, 256, 1792]
    - [16, 1180.07]
  - - [2944, 5888, 1, 1792, 2944, 2944, 2944, 1792]
    - [14, 4437.93]
  - - [2944, 448, 1, 768, 2944, 2944, 2944, 768]
    - [10, 3173.32]
  - - [1024, 704, 1, 3328, 1024, 1024, 1024, 3328]
    - [6, 3263.61]
  - - [256, 704, 1, 1792, 256, 256, 256, 1792]
    - [6, 1769.85]
  - - [128, 256, 1, 256, 128, 128, 128, 256]
    - [11, 202.038]
  - - [5888, 64, 1, 768, 5888, 5888, 5888, 768]
    - [6, 2413.33]
  - - [64, 448, 1, 128, 64, 64, 64, 128]
    - [1, 41.9718]
  - - [5888, 1024, 1, 768, 5888, 5888, 5888, 768]
    - [14, 3835.24]
  - - [256, 128, 1, 1792, 256, 256, 256, 1792]
    - [13, 495.948]
  - - [1856, 4288, 1, 768, 1856, 1856, 1856, 768]
    - [14, 3972.23]
  - - [448, 1024, 1, 128, 448, 448, 448, 128]
    - [1, 620.984]
  - - [4, 2368, 1, 128, 4, 4, 4, 128]
    - [20, 21.9961]
  - - [64, 5888, 1, 1792, 64, 64, 64, 1792]
    - [6, 2690.8]
  - - [4288, 2368, 1, 256, 4288, 4288, 4288, 256]
    - [14, 3930.42]
  - - [2944, 4, 1, 3328, 2944, 2944, 2944, 3328]
    - [23, 248.798]
  - - [3584, 1024, 1, 768, 3584, 3584, 3584, 768]
    - [18, 3950.24]
  - - [4288, 1024, 1, 768, 4288, 4288, 4288, 768]
    - [14, 3832.07]
  - - [448, 1856, 1, 768, 448, 448, 448, 768]
    - [10, 2942.24]
  - - [1856, 2944, 1, 768, 1856, 1856, 1856, 768]
    - [14, 4047.77]
  - - [1856, 704, 1, 768, 1856, 1856, 1856, 768]
    - [10, 3152.45]
  - - [3584, 128, 1, 1792, 3584, 3584, 3584, 1792]
    - [6, 3149.26]
  - - [1856, 5888, 1, 128, 1856, 1856, 1856, 128]
    - [4, 2094.77]
  - - [128, 128, 1, 256, 128, 128, 128, 256]
    - [11, 105.703]
  - - [4, 5888, 1, 3328, 4, 4, 4, 3328]
    - [24, 71.2817]
  - - [1408, 5056, 1, 768, 1408, 1408, 1408, 768]
    - [14, 3975.85]
  - - [256, 1024, 1, 3328, 256, 256, 256, 3328]
    - [8, 2131.59]
  - - [64, 4, 1, 1792, 64, 64, 64, 1792]
    - [24, 7.86612]
  - - [2368, 3584, 1, 1792, 2368, 2368, 2368, 1792]
    - [14, 4294.26]
  - - [704, 64, 1, 3328, 704, 704, 704, 3328]
    - [13, 961.688]
  - - [3584, 5888, 1, 256, 3584, 3584, 3584, 256]
    - [14, 4222.89]
  - - [704, 1024, 1, 1792, 704, 704, 704, 1792]
    - [6, 3188.17]
  - - [4, 4288, 1, 128, 4, 4, 4, 128]
    - [20, 39.487]
  - - [5888, 3584, 1, 128, 5888, 5888, 5888, 128]
    - [4, 2215.93]
  - - [2944, 1856, 1, 128, 2944, 2944, 2944, 128]
    - [4, 1801.47]
  - - [1408, 2368, 1, 768, 1408, 1408, 1408, 768]
    - [10, 3608.14]
  - - [448, 5888, 1, 1792, 448, 448, 448, 1792]
    - [6, 3600.47]
  - - [1856, 2368, 1, 256, 1856, 1856, 1856, 256]
    - [10, 3588.68]
  - - [2944, 5888, 1, 128, 2944, 2944, 2944, 128]
    - [4, 2232.72]
  - - [2368, 448, 1, 1792, 2368, 2368, 2368, 1792]
    - [6, 3020.64]
  - - [256, 64, 1, 3328, 256, 256, 256, 3328]
    - [13, 393.292]
  - - [5056, 4, 1, 768, 5056, 5056, 5056, 768]
    - [23, 173.349]
  - - [1856, 64, 1, 3328, 1856, 1856, 1856, 3328]
    - [9, 1733.22]
  - - [64, 1408, 1, 3328, 64, 64, 64, 3328]
    - [15, 1336.9]
  - - [5888, 128, 1, 3328, 5888, 5888, 5888, 3328]
    - [6, 2914.61]
  - - [64, 4288, 1, 3328, 64, 64, 64, 3328]
    - [6, 2076.84]
  - - [704, 1856, 1, 256, 704, 704, 704, 256]
    - [10, 2823.23]
  - - [2368, 3584, 1, 3328, 2368, 2368, 2368, 3328]
    - [14, 4322.48]
  - - [1408, 704, 1, 256, 1408, 1408, 1408, 256]
    - [10, 2184.53]
  - - [2944, 256, 1, 3328, 2944, 2944, 2944, 3328]
    - [6, 2915.69]
  - - [1856, 448, 1, 768, 1856, 1856, 1856, 768]
    - [10, 2959.69]
  - - [4288, 4288, 1, 128, 4288, 4288, 4288, 128]
    - [4, 2273.68]
  - - [5056, 2368, 1, 3328, 5056, 5056, 5056, 3328]
    - [14, 4245.39]
  - - [4, 64, 1, 3328, 4, 4, 4, 3328]
    - [24, 10.6603]
  - - [448, 1856, 1, 256, 448, 448, 448, 256]
    - [10, 2470.53]
  - - [64, 704, 1, 128, 64, 64, 64, 128]
    - [1, 68.0091]
  - - [2944, 128, 1, 3328, 2944, 2944, 2944, 3328]
    - [6, 2846.6]
  - - [3584, 2944, 1, 768, 3584, 3584, 3584, 768]
    - [14, 4304.64]
  - - [4288, 1024, 1, 1792, 4288, 4288, 4288, 1792]
    - [14, 3915.62]
  - - [64, 1856, 1, 128, 64, 64, 64, 128]
    - [1, 173.249]
  - - [1024, 2368, 1, 128, 1024, 1024, 1024, 128]
    - [4, 1325.5]
  - - [4, 5888, 1, 1792, 4, 4, 4, 1792]
    - [24, 90.7877]
  - - [3584, 128, 1, 3328, 3584, 3584, 3584, 3328]
    - [6, 3329.39]
  - - [2368, 256, 1, 1792, 2368, 2368, 2368, 1792]
    - [6, 2678.84]
  - - [1408, 3584, 1, 1792, 1408, 1408, 1408, 1792]
    - [6, 3695.81]
  - - [256, 2368, 1, 1792, 256, 256, 256, 1792]
    - [6, 2688.39]
  - - [2944, 2944, 1, 1792, 2944, 2944, 2944, 1792]
    - [14, 4392.89]
  - - [1408, 256, 1, 256, 1408, 1408, 1408, 256]
    - [6, 1744.98]
  - - [1856, 128, 1, 3328, 1856, 1856, 1856, 3328]
    - [17, 2494.4]
  - - [2368, 5056, 1, 128, 2368, 2368, 2368, 128]
    - [4, 2146.35]
  - - [3584, 3584, 1, 1792, 3584, 3584, 3584, 1792]
    - [14, 4221.01]
  - - [5056, 1024, 1, 1792, 5056, 5056, 5056, 1792]
    - [14, 3916.54]
  - - [256, 448, 1, 768, 256, 256, 256, 768]
    - [6, 976.068]
  - - [2944, 4288, 1, 768, 2944, 2944, 2944, 768]
    - [14, 4392.5]
  - - [2368, 5888, 1, 128, 2368, 2368, 2368, 128]
    - [4, 2196.37]
  - - [448, 5888, 1, 128, 448, 448, 448, 128]
    - [3, 1587.85]
  - - [5888, 5056, 1, 128, 5888, 5888, 5888, 128]
    - [0, 2304.61]
  - - [2368, 704, 1, 1792, 2368, 2368, 2368, 1792]
    - [14, 3644.58]
  - - [4288, 704, 1, 256, 4288, 4288, 4288, 256]
    - [10, 3128.24]
  - - [4288, 64, 1, 1792, 4288, 4288, 4288, 1792]
    - [6, 1993.93]
  - - [448, 3584, 1, 3328, 448, 448, 448, 3328]
    - [14, 3564.64]
  - - [4, 2944, 1, 1792, 4, 4, 4, 1792]
    - [24, 201.514]
  - - [4, 1024, 1, 256, 4, 4, 4, 256]
    - [23, 17.9797]
  - - [6784, 1024, 1, 256, 6784, 6784, 6784, 256]
    - [14, 3717.36]
  - - [2944, 1856, 1, 3328, 2944, 2944, 2944, 3328]
    - [14, 4171.27]
  - - [4, 3584, 1, 128, 4, 4, 4, 128]
    - [20, 32.9566]
  - - [2368, 1856, 1, 1792, 2368, 2368, 2368, 1792]
    - [14, 3919.12]
  - - [704, 2944, 1, 256, 704, 704, 704, 256]
    - [10, 2831.87]
  - - [2368, 5056, 1, 3328, 2368, 2368, 2368, 3328]
    - [14, 4244.99]
  - - [2944, 6784, 1, 3328, 2944, 2944, 2944, 3328]
    - [14, 4410.19]
  - - [448, 1856, 1, 1792, 448, 448, 448, 1792]
    - [10, 3108.37]
  - - [1024, 1024, 1, 768, 1024, 1024, 1024, 768]
    - [6, 2749.61]
  - - [128, 1856, 1, 256, 128, 128, 128, 256]
    - [11, 1240.16]
  - - [64, 3584, 1, 768, 64, 64, 64, 768]
    - [6, 1864.53]
  - - [704, 1408, 1, 256, 704, 704, 704, 256]
    - [10, 2205.8]
  - - [448, 2944, 1, 1792, 448, 448, 448, 1792]
    - [6, 3329.61]
  - - [1408, 3584, 1, 128, 1408, 1408, 1408, 128]
    - [4, 1709.88]
  - - [2944, 128, 1, 768, 2944, 2944, 2944, 768]
    - [6, 2436.09]
  - - [4288, 2368, 1, 3328, 4288, 4288, 4288, 3328]
    - [14, 4242.39]
  - - [5888, 6784, 1, 1792, 5888, 5888, 5888, 1792]
    - [14, 4521.32]
  - - [5888, 1024, 1, 3328, 5888, 5888, 5888, 3328]
    - [14, 3915.63]
  - - [5888, 5056, 1, 3328, 5888, 5888, 5888, 3328]
    - [14, 4461.97]
  - - [256, 2368, 1, 768, 256, 256, 256, 768]
    - [6, 2469.07]
  - - [128, 704, 1, 1792, 128, 128, 128, 1792]
    - [16, 998.273]
  - - [704, 64, 1, 256, 704, 704, 704, 256]
    - [11, 276.205]
  - - [128, 5056, 1, 768, 128, 128, 128, 768]
    - [6, 2617.02]
  - - [448, 704, 1, 256, 448, 448, 448, 256]
    - [6, 1499.64]
  - - [1408, 6784, 1, 256, 1408, 1408, 1408, 256]
    - [14, 4060.31]
  - - [256, 448, 1, 256, 256, 256, 256, 256]
    - [6, 657.709]
  - - [4, 256, 1, 768, 4, 4, 4, 768]
    - [24, 15.0542]
  - - [5888, 64, 1, 3328, 5888, 5888, 5888, 3328]
    - [6, 2840.92]
  - - [6784, 64, 1, 128, 6784, 6784, 6784, 128]
    - [1, 530.696]
  - - [256, 3584, 1, 768, 256, 256, 256, 768]
    - [10, 3206.42]
  - - [3584, 6784, 1, 768, 3584, 3584, 3584, 768]
    - [14, 4440.8]
  - - [3584, 448, 1, 128, 3584, 3584, 3584, 128]
    - [4, 1272.42]
  - - [2944, 64, 1, 128, 2944, 2944, 2944, 128]
    - [1, 266.077]
  - - [4288, 2368, 1, 768, 4288, 4288, 4288, 768]
    - [14, 4151.19]
  - - [64, 5056, 1, 3328, 64, 64, 64, 3328]
    - [6, 2438.61]
  - - [1024, 5056, 1, 3328, 1024, 1024, 1024, 3328]
    - [14, 3926.02]
  - - [128, 1024, 1, 128, 128, 128, 128, 128]
    - [1, 192.223]
  - - [2368, 6784, 1, 768, 2368, 2368, 2368, 768]
    - [14, 4295.68]
  - - [2944, 256, 1, 768, 2944, 2944, 2944, 768]
    - [10, 2676.72]
  - - [1024, 4288, 1, 256, 1024, 1024, 1024, 256]
    - [14, 3552.7]
  - - [4288, 2944, 1, 1792, 4288, 4288, 4288, 1792]
    - [14, 4144.37]
  - - [4, 64, 1, 768, 4, 4, 4, 768]
    - [24, 4.25927]
  - - [2368, 5056, 1, 1792, 2368, 2368, 2368, 1792]
    - [14, 4226.4]
  - - [2944, 4, 1, 256, 2944, 2944, 2944, 256]
    - [25, 50.5815]
  - - [1856, 256, 1, 3328, 1856, 1856, 1856, 3328]
    - [6, 3583.98]
  - - [2368, 3584, 1, 256, 2368, 2368, 2368, 256]
    - [14, 3932.54]
  - - [5888, 448, 1, 768, 5888, 5888, 5888, 768]
    - [14, 3876.18]
  - - [4288, 448, 1, 768, 4288, 4288, 4288, 768]
    - [14, 3975.39]
  - - [6784, 4, 1, 768, 6784, 6784, 6784, 768]
    - [22, 201.474]
  - - [6784, 3584, 1, 256, 6784, 6784, 6784, 256]
    - [14, 4303.81]
  - - [704, 5056, 1, 1792, 704, 704, 704, 1792]
    - [18, 3948.45]
  - - [2944, 1408, 1, 128, 2944, 2944, 2944, 128]
    - [4, 1626.35]
  - - [128, 1856, 1, 128, 128, 128, 128, 128]
    - [1, 340.905]
  - - [64, 1024, 1, 768, 64, 64, 64, 768]
    - [6, 561.737]
  - - [448, 2944, 1, 3328, 448, 448, 448, 3328]
    - [6, 3415.51]
  - - [6784, 128, 1, 256, 6784, 6784, 6784, 256]
    - [10, 2575.28]
  - - [2944, 128, 1, 1792, 2944, 2944, 2944, 1792]
    - [6, 2747.73]
  - - [2368, 1024, 1, 1792, 2368, 2368, 2368, 1792]
    - [6, 3696.24]
  - - [3584, 1408, 1, 256, 3584, 3584, 3584, 256]
    - [14, 3530.4]
  - - [2368, 4288, 1, 3328, 2368, 2368, 2368, 3328]
    - [14, 4233.41]
  - - [4288, 128, 1, 256, 4288, 4288, 4288, 256]
    - [6, 1706.87]
  - - [1408, 704, 1, 768, 1408, 1408, 1408, 768]
    - [6, 2627.96]
  - - [1408, 3584, 1, 768, 1408, 1408, 1408, 768]
    - [14, 3763.53]
  - - [1024, 5888, 1, 3328, 1024, 1024, 1024, 3328]
    - [14, 3897.5]
  - - [3584, 64, 1, 768, 3584, 3584, 3584, 768]
    - [6, 1855.11]
  - - [5056, 1408, 1, 3328, 5056, 5056, 5056, 3328]
    - [14, 4059.38]
  - - [4288, 1024, 1, 256, 4288, 4288, 4288, 256]
    - [10, 3584.42]
  - - [4288, 1856, 1, 128, 4288, 4288, 4288, 128]
    - [4, 1994.62]
  - - [704, 6784, 1, 1792, 704, 704, 704, 1792]
    - [12, 3890.5]
  - - [5888, 2944, 1, 256, 5888, 5888, 5888, 256]
    - [14, 4239.18]
  - - [1024, 64, 1, 128, 1024, 1024, 1024, 128]
    - [1, 98.4578]
  - - [448, 5888, 1, 256, 448, 448, 448, 256]
    - [10, 3142.6]
  - - [704, 448, 1, 768, 704, 704, 704, 768]
    - [6, 2056.9]
  - - [5888, 4288, 1, 3328, 5888, 5888, 5888, 3328]
    - [14, 4506.24]
  - - [4288, 448, 1, 1792, 4288, 4288, 4288, 1792]
    - [14, 4184.67]
  - - [1408, 128, 1, 256, 1408, 1408, 1408, 256]
    - [11, 970.904]
  - - [4, 1024, 1, 1792, 4, 4, 4, 1792]
    - [24, 91.476]
  - - [1024, 5056, 1, 768, 1024, 1024, 1024, 768]
    - [14, 3846.05]
  - - [1024, 3584, 1, 768, 1024, 1024, 1024, 768]
    - [18, 3941.4]
  - - [2944, 1024, 1, 3328, 2944, 2944, 2944, 3328]
    - [6, 3595.46]
  - - [704, 448, 1, 1792, 704, 704, 704, 1792]
    - [6, 2291.53]
  - - [3584, 3584, 1, 3328, 3584, 3584, 3584, 3328]
    - [14, 4238.22]
  - - [1024, 1408, 1, 1792, 1024, 1024, 1024, 1792]
    - [6, 3586.47]
  - - [6784, 2368, 1, 1792, 6784, 6784, 6784, 1792]
    - [14, 4354.21]
  - - [3584, 4288, 1, 1792, 3584, 3584, 3584, 1792]
    - [14, 4417.73]
  - - [5888, 64, 1, 1792, 5888, 5888, 5888, 1792]
    - [6, 2720.28]
  - - [6784, 448, 1, 1792, 6784, 6784, 6784, 1792]
    - [6, 3541.9]
  - - [5056, 448, 1, 3328, 5056, 5056, 5056, 3328]
    - [6, 3540.4]
  - - [256, 6784, 1, 3328, 256, 256, 256, 3328]
    - [14, 3855.64]
  - - [6784, 448, 1, 3328, 6784, 6784, 6784, 3328]
    - [6, 3623.32]
  - - [704, 1856, 1, 128, 704, 704, 704, 128]
    - [1, 1113.8]
  - - [2944, 5056, 1, 768, 2944, 2944, 2944, 768]
    - [14, 4235.17]
  - - [128, 1856, 1, 3328, 128, 128, 128, 3328]
    - [17, 2476.9]
  - - [64, 3584, 1, 1792, 64, 64, 64, 1792]
    - [6, 2180.82]
  - - [128, 128, 1, 3328, 128, 128, 128, 3328]
    - [5, 418.915]
  - - [6784, 4288, 1, 1792, 6784, 6784, 6784, 1792]
    - [14, 4489.82]
  - - [6784, 256, 1, 256, 6784, 6784, 6784, 256]
    - [14, 3072.11]
  - - [2944, 128, 1, 128, 2944, 2944, 2944, 128]
    - [1, 529.817]
  - - [4, 128, 1, 768, 4, 4, 4, 768]
    - [24, 7.81431]
  - - [64, 704, 1, 1792, 64, 64, 64, 1792]
    - [13, 608.718]
  - - [1408, 5056, 1, 3328, 1408, 1408, 1408, 3328]
    - [18, 4044.3]
  - - [6784, 128, 1, 1792, 6784, 6784, 6784, 1792]
    - [6, 3246.72]
  - - [5888, 2368, 1, 256, 5888, 5888, 5888, 256]
    - [14, 4082.81]
  - - [64, 256, 1, 128, 64, 64, 64, 128]
    - [1, 25.1578]
  - - [64, 128, 1, 1792, 64, 64, 64, 1792]
    - [5, 159.566]
  - - [64, 1024, 1, 256, 64, 64, 64, 256]
    - [11, 392.725]
  - - [1024, 1856, 1, 128, 1024, 1024, 1024, 128]
    - [4, 1374.72]
  - - [5056, 1024, 1, 256, 5056, 5056, 5056, 256]
    - [14, 3578.29]
  - - [4, 5056, 1, 768, 4, 4, 4, 768]
    - [23, 167.084]
  - - [704, 6784, 1, 768, 704, 704, 704, 768]
    - [12, 3782.92]
  - - [2368, 704, 1, 256, 2368, 2368, 2368, 256]
    - [14, 2953.84]
  - - [3584, 64, 1, 256, 3584, 3584, 3584, 256]
    - [11, 1221.3]
  - - [1856, 4, 1, 768, 1856, 1856, 1856, 768]
    - [24, 85.7646]
  - - [1408, 4288, 1, 1792, 1408, 1408, 1408, 1792]
    - [14, 3822.29]
  - - [1408, 5888, 1, 1792, 1408, 1408, 1408, 1792]
    - [14, 4035.35]
  - - [448, 6784, 1, 3328, 448, 448, 448, 3328]
    - [6, 3622.28]
  - - [256, 64, 1, 256, 256, 256, 256, 256]
    - [11, 105.703]
  - - [5056, 1856, 1, 768, 5056, 5056, 5056, 768]
    - [14, 4212.77]
  - - [1856, 5888, 1, 768, 1856, 1856, 1856, 768]
    - [14, 4118.16]
  - - [2944, 5056, 1, 3328, 2944, 2944, 2944, 3328]
    - [14, 4303.36]
  - - [704, 128, 1, 3328, 704, 704, 704, 3328]
    - [15, 1379.2]
  - - [1856, 704, 1, 256, 1856, 1856, 1856, 256]
    - [10, 2825.13]
  - - [5888, 704, 1, 1792, 5888, 5888, 5888, 1792]
    - [6, 3716.14]
  - - [1024, 1408, 1, 256, 1024, 1024, 1024, 256]
    - [10, 2978.52]
  - - [128, 704, 1, 256, 128, 128, 128, 256]
    - [6, 521.444]
  - - [4, 3584, 1, 3328, 4, 4, 4, 3328]
    - [22, 66.9038]
  - - [1024, 704, 1, 768, 1024, 1024, 1024, 768]
    - [7, 2534.09]
  - - [4288, 4, 1, 256, 4288, 4288, 4288, 256]
    - [23, 69.0395]
  - - [128, 4288, 1, 768, 128, 128, 128, 768]
    - [6, 2226.06]
  - - [3584, 256, 1, 256, 3584, 3584, 3584, 256]
    - [10, 2539.8]
  - - [448, 1856, 1, 3328, 448, 448, 448, 3328]
    - [6, 3202.47]
  - - [5056, 448, 1, 128, 5056, 5056, 5056, 128]
    - [1, 1353.3]
  - - [1024, 5888, 1, 128, 1024, 1024, 1024, 128]
    - [4, 1719.9]
  - - [1856, 64, 1, 768, 1856, 1856, 1856, 768]
    - [6, 1010.03]
  - - [2368, 1408, 1, 768, 2368, 2368, 2368, 768]
    - [10, 3609.36]
  - - [448, 4288, 1, 768, 448, 448, 448, 768]
    - [12, 3814.24]
  - - [256, 4288, 1, 128, 256, 256, 256, 128]
    - [1, 888.849]
  - - [5056, 6784, 1, 768, 5056, 5056, 5056, 768]
    - [14, 4379.88]
  - - [704, 2944, 1, 3328, 704, 704, 704, 3328]
    - [6, 3514.27]
  - - [4, 5056, 1, 1792, 4, 4, 4, 1792]
    - [24, 79.771]
  - - [64, 128, 1, 768, 64, 64, 64, 768]
    - [5, 76.9503]
  - - [4, 6784, 1, 256, 4, 4, 4, 256]
    - [23, 92.4762]
  - - [128, 2368, 1, 128, 128, 128, 128, 128]
    - [1, 420.978]
  - - [64, 6784, 1, 256, 64, 64, 64, 256]
    - [6, 1999.08]
  - - [4, 448, 1, 1792, 4, 4, 4, 1792]
    - [24, 45.9277]
  - - [64, 64, 1, 1792, 64, 64, 64, 1792]
    - [5, 94.588]
  - - [2944, 1024, 1, 1792, 2944, 2944, 2944, 1792]
    - [6, 3517.46]
  - - [2944, 2944, 1, 768, 2944, 2944, 2944, 768]
    - [14, 4316.26]
  - - [4288, 5056, 1, 768, 4288, 4288, 4288, 768]
    - [14, 4312.31]
  - - [3584, 1856, 1, 768, 3584, 3584, 3584, 768]
    - [14, 4191.83]
  - - [2368, 1024, 1, 3328, 2368, 2368, 2368, 3328]
    - [6, 3782.12]
  - - [448, 2944, 1, 256, 448, 448, 448, 256]
    - [10, 2849.78]
  - - [6784, 256, 1, 1792, 6784, 6784, 6784, 1792]
    - [14, 3779.48]
  - - [4288, 5888, 1, 128, 4288, 4288, 4288, 128]
    - [0, 2406.56]
  - - [2368, 5888, 1, 768, 2368, 2368, 2368, 768]
    - [14, 4211.53]
  - - [3584, 448, 1, 3328, 3584, 3584, 3584, 3328]
    - [14, 3569.22]
  - - [448, 1408, 1, 128, 448, 448, 448, 128]
    - [1, 746.49]
  - - [6784, 1024, 1, 128, 6784, 6784, 6784, 128]
    - [4, 1923.0]
  - - [704, 448, 1, 3328, 704, 704, 704, 3328]
    - [8, 2457.45]
  - - [1856, 3584, 1, 256, 1856, 1856, 1856, 256]
    - [14, 3654.89]
  - - [2368, 2368, 1, 256, 2368, 2368, 2368, 256]
    - [14, 3772.87]
  - - [256, 4288, 1, 768, 256, 256, 256, 768]
    - [6, 2880.86]
  - - [4288, 3584, 1, 1792, 4288, 4288, 4288, 1792]
    - [14, 4418.24]
  - - [2368, 128, 1, 256, 2368, 2368, 2368, 256]
    - [6, 1439.07]
  - - [5056, 6784, 1, 1792, 5056, 5056, 5056, 1792]
    - [14, 4417.68]
  - - [5056, 1856, 1, 256, 5056, 5056, 5056, 256]
    - [14, 3951.13]
  - - [256, 64, 1, 768, 256, 256, 256, 768]
    - [16, 138.578]
  - - [64, 2944, 1, 3328, 64, 64, 64, 3328]
    - [17, 2014.94]
  - - [1408, 4, 1, 256, 1408, 1408, 1408, 256]
    - [25, 25.2062]
  - - [256, 1856, 1, 3328, 256, 256, 256, 3328]
    - [6, 3597.68]
  - - [1024, 2944, 1, 1792, 1024, 1024, 1024, 1792]
    - [6, 3504.14]
  - - [2368, 4, 1, 256, 2368, 2368, 2368, 256]
    - [23, 41.3512]
  - - [256, 1024, 1, 256, 256, 256, 256, 256]
    - [11, 1284.63]
  - - [704, 5888, 1, 128, 704, 704, 704, 128]
    - [4, 1659.31]
  - - [4288, 1408, 1, 1792, 4288, 4288, 4288, 1792]
    - [14, 3887.89]
  - - [4, 4288, 1, 1792, 4, 4, 4, 1792]
    - [24, 81.5378]
  - - [1856, 448, 1, 3328, 1856, 1856, 1856, 3328]
    - [6, 3208.12]
  - - [5056, 3584, 1, 768, 5056, 5056, 5056, 768]
    - [14, 4347.12]
  - - [3584, 6784, 1, 3328, 3584, 3584, 3584, 3328]
    - [14, 4512.11]
  - - [448, 2368, 1, 128, 448, 448, 448, 128]
    - [1, 939.337]
  - - [1024, 64, 1, 256, 1024, 1024, 1024, 256]
    - [11, 379.919]
  - - [704, 128, 1, 768, 704, 704, 704, 768]
    - [6, 775.852]
  - - [704, 128, 1, 1792, 704, 704, 704, 1792]
    - [16, 1058.47]
  - - [448, 5056, 1, 1792, 448, 448, 448, 1792]
    - [6, 3465.95]
  - - [4, 448, 1, 256, 4, 4, 4, 256]
    - [25, 9.24903]
  - - [128, 448, 1, 768, 128, 128, 128, 768]
    - [6, 492.84]
  - - [3584, 64, 1, 1792, 3584, 3584, 3584, 1792]
    - [6, 2224.25]
  - - [6784, 1856, 1, 768, 6784, 6784, 6784, 768]
    - [14, 4385.55]
  - - [64, 64, 1, 768, 64, 64, 64, 768]
    - [16, 37.8092]
  - - [1024, 1024, 1, 256, 1024, 1024, 1024, 256]
    - [10, 2250.46]
  - - [1408, 2368, 1, 256, 1408, 1408, 1408, 256]
    - [10, 3429.53]
  - - [64, 704, 1, 3328, 64, 64, 64, 3328]
    - [13, 916.095]
  - - [5056, 5888, 1, 256, 5056, 5056, 5056, 256]
    - [14, 4265.58]
  - - [5888, 5056, 1, 1792, 5888, 5888, 5888, 1792]
    - [14, 4450.36]
  - - [704, 3584, 1, 768, 704, 704, 704, 768]
    - [14, 3615.24]
  - - [2368, 2944, 1, 768, 2368, 2368, 2368, 768]
    - [14, 3868.07]
  - - [448, 64, 1, 768, 448, 448, 448, 768]
    - [6, 246.862]
  - - [1024, 4288, 1, 768, 1024, 1024, 1024, 768]
    - [14, 3836.6]
  - - [5056, 1408, 1, 128, 5056, 5056, 5056, 128]
    - [4, 1943.71]
  - - [128, 4, 1, 3328, 128, 128, 128, 3328]
    - [24, 21.0466]
  - - [6784, 1408, 1, 256, 6784, 6784, 6784, 256]
    - [14, 4084.72]
  - - [6784, 5888, 1, 1792, 6784, 6784, 6784, 1792]
    - [14, 4518.51]
  - - [128, 6784, 1, 3328, 128, 128, 128, 3328]
    - [6, 3336.42]
  - - [448, 256, 1, 3328, 448, 448, 448, 3328]
    - [9, 1613.47]
  - - [1856, 1856, 1, 128, 1856, 1856, 1856, 128]
    - [0, 1728.31]
  - - [5888, 256, 1, 1792, 5888, 5888, 5888, 1792]
    - [14, 3295.03]
  - - [4288, 4288, 1, 768, 4288, 4288, 4288, 768]
    - [14, 4397.48]
  - - [2944, 6784, 1, 128, 2944, 2944, 2944, 128]
    - [4, 2257.53]
  - - [5888, 704, 1, 768, 5888, 5888, 5888, 768]
    - [14, 3641.76]
  - - [5888, 1408, 1, 3328, 5888, 5888, 5888, 3328]
    - [14, 4233.8]
  - - [4288, 6784, 1, 256, 4288, 4288, 4288, 256]
    - [14, 4194.07]
  - - [704, 256, 1, 256, 704, 704, 704, 256]
    - [11, 989.223]
  - - [1408, 3584, 1, 3328, 1408, 1408, 1408, 3328]
    - [6, 3771.56]
  - - [128, 1408, 1, 768, 128, 128, 128, 768]
    - [6, 1509.73]
  - - [4288, 5888, 1, 3328, 4288, 4288, 4288, 3328]
    - [14, 4343.82]
  - - [128, 2368, 1, 3328, 128, 128, 128, 3328]
    - [8, 2418.79]
  - - [256, 2944, 1, 1792, 256, 256, 256, 1792]
    - [6, 2832.56]
  - - [3584, 256, 1, 3328, 3584, 3584, 3584, 3328]
    - [6, 3533.44]
  - - [6784, 1408, 1, 3328, 6784, 6784, 6784, 3328]
    - [14, 4380.48]
  - - [1408, 64, 1, 768, 1408, 1408, 1408, 768]
    - [6, 777.945]
  - - [1408, 1856, 1, 1792, 1408, 1408, 1408, 1792]
    - [14, 3929.17]
  - - [1024, 128, 1, 256, 1024, 1024, 1024, 256]
    - [6, 725.658]
  - - [1856, 1408, 1, 256, 1856, 1856, 1856, 256]
    - [14, 3370.57]
  - - [2944, 2368, 1, 768, 2944, 2944, 2944, 768]
    - [14, 3903.04]
  - - [2368, 4288, 1, 128, 2368, 2368, 2368, 128]
    - [4, 2041.26]
  - - [3584, 5056, 1, 3328, 3584, 3584, 3584, 3328]
    - [14, 4414.07]
  - - [1408, 5056, 1, 256, 1408, 1408, 1408, 256]
    - [14, 3757.27]
  - - [5888, 1856, 1, 256, 5888, 5888, 5888, 256]
    - [14, 3982.92]
  - - [2944, 448, 1, 128, 2944, 2944, 2944, 128]
    - [1, 1108.91]
  - - [256, 256, 1, 3328, 256, 256, 256, 3328]
    - [15, 1124.25]
  - - [448, 704, 1, 128, 448, 448, 448, 128]
    - [1, 443.433]
  - - [128, 4, 1, 256, 128, 128, 128, 256]
    - [25, 3.30323]
  - - [1408, 6784, 1, 128, 1408, 1408, 1408, 128]
    - [4, 2013.04]
  - - [256, 5888, 1, 128, 256, 256, 256, 128]
    - [4, 1154.49]
  - - [704, 1856, 1, 1792, 704, 704, 704, 1792]
    - [6, 3292.65]
  - - [256, 3584, 1, 128, 256, 256, 256, 128]
    - [1, 958.229]
  - - [2944, 448, 1, 3328, 2944, 2944, 2944, 3328]
    - [6, 3416.79]
  - - [1856, 704, 1, 3328, 1856, 1856, 1856, 3328]
    - [6, 3384.32]
  - - [2368, 2944, 1, 3328, 2368, 2368, 2368, 3328]
    - [14, 3973.34]
  - - [1408, 448, 1, 256, 1408, 1408, 1408, 256]
    - [6, 1933.44]
  - - [64, 5056, 1, 1792, 64, 64, 64, 1792]
    - [6, 2332.89]
  - - [5056, 2944, 1, 768, 5056, 5056, 5056, 768]
    - [14, 4230.03]
  - - [5888, 2368, 1, 128, 5888, 5888, 5888, 128]
    - [4, 2132.33]
  - - [5056, 128, 1, 768, 5056, 5056, 5056, 768]
    - [6, 2615.92]
  - - [704, 2368, 1, 768, 704, 704, 704, 768]
    - [14, 3438.0]
  - - [2368, 2368, 1, 1792, 2368, 2368, 2368, 1792]
    - [14, 4243.46]
  - - [4288, 4, 1, 3328, 4288, 4288, 4288, 3328]
    - [23, 302.085]
  - - [704, 448, 1, 256, 704, 704, 704, 256]
    - [6, 1522.25]
  - - [4, 1408, 1, 1792, 4, 4, 4, 1792]
    - [24, 121.538]
  - - [3584, 448, 1, 768, 3584, 3584, 3584, 768]
    - [14, 3345.79]
  - - [1856, 1856, 1, 256, 1856, 1856, 1856, 256]
    - [18, 3273.88]
  - - [5056, 4, 1, 3328, 5056, 5056, 5056, 3328]
    - [25, 307.163]
  - - [704, 2944, 1, 768, 704, 704, 704, 768]
    - [6, 3218.49]
  - - [3584, 448, 1, 1792, 3584, 3584, 3584, 1792]
    - [14, 3510.95]
  - - [3584, 6784, 1, 256, 3584, 3584, 3584, 256]
    - [14, 4268.16]
  - - [128, 448, 1, 3328, 128, 128, 128, 3328]
    - [13, 1152.42]
  - - [4, 1024, 1, 768, 4, 4, 4, 768]
    - [26, 47.7204]
  - - [3584, 4, 1, 1792, 3584, 3584, 3584, 1792]
    - [23, 214.8]
  - - [5056, 2944, 1, 256, 5056, 5056, 5056, 256]
    - [14, 4060.66]
  - - [128, 2944, 1, 128, 128, 128, 128, 128]
    - [1, 525.659]
  - - [64, 6784, 1, 1792, 64, 64, 64, 1792]
    - [6, 3013.8]
  - - [1408, 64, 1, 3328, 1408, 1408, 1408, 3328]
    - [15, 1432.97]
  - - [704, 1408, 1, 128, 704, 704, 704, 128]
    - [1, 923.687]
  - - [5888, 256, 1, 256, 5888, 5888, 5888, 256]
    - [14, 2731.29]
  - - [448, 5056, 1, 256, 448, 448, 448, 256]
    - [10, 3120.22]
  - - [2368, 6784, 1, 3328, 2368, 2368, 2368, 3328]
    - [14, 4366.64]
  - - [4288, 256, 1, 256, 4288, 4288, 4288, 256]
    - [10, 2368.66]
  - - [6784, 5888, 1, 256, 6784, 6784, 6784, 256]
    - [14, 4352.55]
  - - [64, 1856, 1, 768, 64, 64, 64, 768]
    - [6, 1004.69]
  - - [6784, 64, 1, 3328, 6784, 6784, 6784, 3328]
    - [6, 3286.94]
  - - [64, 4, 1, 256, 64, 64, 64, 256]
    - [25, 1.76172]
  - - [64, 1024, 1, 128, 64, 64, 64, 128]
    - [1, 99.297]
  - - [2944, 448, 1, 1792, 2944, 2944, 2944, 1792]
    - [6, 3319.88]
  - - [1408, 4, 1, 1792, 1408, 1408, 1408, 1792]
    - [24, 116.381]
  - - [64, 704, 1, 256, 64, 64, 64, 256]
    - [11, 273.585]
  - - [256, 3584, 1, 256, 256, 256, 256, 256]
    - [10, 2666.68]
  - - [5888, 128, 1, 256, 5888, 5888, 5888, 256]
    - [10, 2224.84]
  - - [1024, 448, 1, 128, 1024, 1024, 1024, 128]
    - [1, 601.149]
  - - [3584, 256, 1, 768, 3584, 3584, 3584, 768]
    - [10, 3212.27]
  - - [256, 1856, 1, 256, 256, 256, 256, 256]
    - [6, 2181.4]
  - - [1024, 128, 1, 1792, 1024, 1024, 1024, 1792]
    - [6, 1299.12]
  - - [256, 1024, 1, 1792, 256, 256, 256, 1792]
    - [6, 1908.98]
  - - [4288, 4, 1, 128, 4288, 4288, 4288, 128]
    - [20, 38.7619]
  - - [704, 3584, 1, 3328, 704, 704, 704, 3328]
    - [14, 3832.99]
  - - [64, 1024, 1, 3328, 64, 64, 64, 3328]
    - [15, 1038.99]
  - - [2368, 128, 1, 1792, 2368, 2368, 2368, 1792]
    - [6, 2190.88]
  - - [704, 2944, 1, 1792, 704, 704, 704, 1792]
    - [6, 3432.84]
  - - [6784, 704, 1, 256, 6784, 6784, 6784, 256]
    - [14, 3870.09]
  - - [2944, 2368, 1, 128, 2944, 2944, 2944, 128]
    - [4, 1884.48]
  - - [1408, 2944, 1, 1792, 1408, 1408, 1408, 1792]
    - [6, 3727.33]
  - - [5888, 6784, 1, 256, 5888, 5888, 5888, 256]
    - [14, 4358.94]
  - - [64, 4, 1, 3328, 64, 64, 64, 3328]
    - [24, 10.9677]
  - - [5888, 704, 1, 128, 5888, 5888, 5888, 128]
    - [4, 1604.32]
  - - [448, 64, 1, 128, 448, 448, 448, 128]
    - [1, 43.197]
  - - [704, 6784, 1, 256, 704, 704, 704, 256]
    - [10, 3534.46]
  - - [1856, 704, 1, 1792, 1856, 1856, 1856, 1792]
    - [6, 3293.39]
  - - [1024, 2944, 1, 256, 1024, 1024, 1024, 256]
    - [10, 3103.89]
  - - [1856, 4, 1, 256, 1856, 1856, 1856, 256]
    - [23, 32.9956]
  - - [1408, 704, 1, 1792, 1408, 1408, 1408, 1792]
    - [6, 2820.58]
  - - [3584, 5888, 1, 3328, 3584, 3584, 3584, 3328]
    - [14, 4446.3]
  - - [448, 128, 1, 256, 448, 448, 448, 256]
    - [11, 344.926]
  - - [5056, 64, 1, 256, 5056, 5056, 5056, 256]
    - [11, 1547.79]
  - - [5056, 128, 1, 256, 5056, 5056, 5056, 256]
    - [6, 2000.91]
  - - [256, 5056, 1, 3328, 256, 256, 256, 3328]
    - [6, 3351.24]
  - - [3584, 5056, 1, 256, 3584, 3584, 3584, 256]
    - [14, 4178.59]
  - - [448, 5056, 1, 3328, 448, 448, 448, 3328]
    - [6, 3545.33]
  - - [2944, 1856, 1, 1792, 2944, 2944, 2944, 1792]
    - [14, 4141.26]
  - - [6784, 704, 1, 1792, 6784, 6784, 6784, 1792]
    - [14, 4259.14]
  - - [256, 704, 1, 256, 256, 256, 256, 256]
    - [11, 984.158]
  - - [128, 5888, 1, 3328, 128, 128, 128, 3328]
    - [6, 2913.52]
  - - [1856, 5056, 1, 3328, 1856, 1856, 1856, 3328]
    - [14, 4297.31]
  - - [5888, 5888, 1, 3328, 5888, 5888, 5888, 3328]
    - [14, 4477.42]
  - - [4, 448, 1, 3328, 4, 4, 4, 3328]
    - [24, 67.2809]
  - - [6784, 448, 1, 768, 6784, 6784, 6784, 768]
    - [6, 3337.14]
  - - [704, 1856, 1, 768, 704, 704, 704, 768]
    - [10, 3144.55]
  - - [1408, 1024, 1, 256, 1408, 1408, 1408, 256]
    - [10, 3098.55]
  - - [1024, 6784, 1, 128, 1024, 1024, 1024, 128]
    - [4, 1787.25]
  - - [6784, 2944, 1, 768, 6784, 6784, 6784, 768]
    - [14, 4349.64]
  - - [2368, 1024, 1, 256, 2368, 2368, 2368, 256]
    - [10, 3313.18]
  - - [1024, 1408, 1, 768, 1024, 1024, 1024, 768]
    - [10, 3425.19]
  - - [4288, 5056, 1, 128, 4288, 4288, 4288, 128]
    - [0, 2329.32]
  - - [1856, 64, 1, 1792, 1856, 1856, 1856, 1792]
    - [9, 1266.43]
  - - [1856, 1408, 1, 128, 1856, 1856, 1856, 128]
    - [3, 1568.34]
  - - [256, 5056, 1, 128, 256, 256, 256, 128]
    - [4, 996.122]
  - - [2944, 4, 1, 1792, 2944, 2944, 2944, 1792]
    - [26, 202.288]
  - - [3584, 128, 1, 768, 3584, 3584, 3584, 768]
    - [6, 2826.71]
  - - [128, 4, 1, 128, 128, 128, 128, 128]
    - [20, 1.23189]
  - - [704, 2368, 1, 1792, 704, 704, 704, 1792]
    - [14, 3633.59]
  - - [6784, 1408, 1, 1792, 6784, 6784, 6784, 1792]
    - [14, 4358.39]
  - - [2368, 1408, 1, 1792, 2368, 2368, 2368, 1792]
    - [18, 3731.07]
  - - [1856, 4288, 1, 1792, 1856, 1856, 1856, 1792]
    - [14, 4024.81]
  - - [5056, 4288, 1, 3328, 5056, 5056, 5056, 3328]
    - [14, 4372.03]
  - - [4288, 1856, 1, 3328, 4288, 4288, 4288, 3328]
    - [14, 4060.18]
  - - [448, 2368, 1, 1792, 448, 448, 448, 1792]
    - [10, 2647.14]
  - - [5056, 704, 1, 1792, 5056, 5056, 5056, 1792]
    - [18, 3947.28]
  - - [3584, 6784, 1, 1792, 3584, 3584, 3584, 1792]
    - [14, 4492.65]
  - - [1024, 6784, 1, 3328, 1024, 1024, 1024, 3328]
    - [18, 3960.85]
  - - [5056, 5056, 1, 1792, 5056, 5056, 5056, 1792]
    - [14, 4383.11]
  - - [1024, 448, 1, 256, 1024, 1024, 1024, 256]
    - [6, 2070.53]
  - - [5056, 448, 1, 1792, 5056, 5056, 5056, 1792]
    - [6, 3467.13]
  - - [4288, 2944, 1, 128, 4288, 4288, 4288, 128]
    - [4, 2180.76]
  - - [1856, 6784, 1, 768, 1856, 1856, 1856, 768]
    - [14, 4086.64]
  - - [256, 256, 1, 768, 256, 256, 256, 768]
    - [6, 564.256]
  - - [448, 5888, 1, 3328, 448, 448, 448, 3328]
    - [6, 3691.13]
  - - [5888, 448, 1, 1792, 5888, 5888, 5888, 1792]
    - [14, 3987.26]
  - - [704, 704, 1, 3328, 704, 704, 704, 3328]
    - [9, 2531.63]
  - - [5056, 704, 1, 256, 5056, 5056, 5056, 256]
    - [14, 3372.86]
  - - [6784, 1024, 1, 1792, 6784, 6784, 6784, 1792]
    - [14, 3945.45]
  - - [2944, 3584, 1, 128, 2944, 2944, 2944, 128]
    - [4, 2092.22]
  - - [128, 2368, 1, 256, 128, 128, 128, 256]
    - [11, 1460.74]
  - - [2368, 256, 1, 256, 2368, 2368, 2368, 256]
    - [6, 1849.25]
  - - [256, 128, 1, 768, 256, 256, 256, 768]
    - [6, 282.889]
  - - [1856, 5888, 1, 3328, 1856, 1856, 1856, 3328]
    - [14, 4195.95]
  - - [256, 256, 1, 1792, 256, 256, 256, 1792]
    - [16, 814.654]
  - - [5888, 6784, 1, 128, 5888, 5888, 5888, 128]
    - [0, 2353.9]
  - - [1408, 448, 1, 768, 1408, 1408, 1408, 768]
    - [6, 2552.92]
  - - [64, 128, 1, 128, 64, 64, 64, 128]
    - [1, 12.1814]
  - - [1856, 64, 1, 128, 1856, 1856, 1856, 128]
    - [1, 168.637]
  - - [128, 1408, 1, 256, 128, 128, 128, 256]
    - [11, 979.146]
  - - [2368, 6784, 1, 256, 2368, 2368, 2368, 256]
    - [14, 4112.19]
  - - [2368, 448, 1, 3328, 2368, 2368, 2368, 3328]
    - [8, 3172.45]
  - - [704, 704, 1, 256, 704, 704, 704, 256]
    - [6, 1523.51]
  - - [5888, 128, 1, 768, 5888, 5888, 5888, 768]
    - [10, 2662.93]
  - - [2368, 64, 1, 1792, 2368, 2368, 2368, 1792]
    - [6, 1486.98]
  - - [256, 1024, 1, 768, 256, 256, 256, 768]
    - [6, 1708.47]
  - - [6784, 4, 1, 3328, 6784, 6784, 6784, 3328]
    - [22, 332.409]
  - - [1024, 1856, 1, 1792, 1024, 1024, 1024, 1792]
    - [14, 4138.04]
  - - [704, 1408, 1, 768, 704, 704, 704, 768]
    - [6, 2614.24]
  - - [128, 2944, 1, 768, 128, 128, 128, 768]
    - [6, 2441.02]
  - - [1856, 3584, 1, 768, 1856, 1856, 1856, 768]
    - [14, 4056.55]
  - - [1408, 704, 1, 3328, 1408, 1408, 1408, 3328]
    - [8, 3024.66]
  - - [4288, 448, 1, 128, 4288, 4288, 4288, 128]
    - [4, 1515.6]
  - - [5888, 256, 1, 768, 5888, 5888, 5888, 768]
    - [14, 3160.85]
  - - [4, 5056, 1, 128, 4, 4, 4, 128]
    - [20, 46.6264]
  - - [704, 6784, 1, 3328, 704, 704, 704, 3328]
    - [12, 3921.5]
  - - [2944, 6784, 1, 768, 2944, 2944, 2944, 768]
    - [14, 4348.85]
  - - [1024, 448, 1, 1792, 1024, 1024, 1024, 1792]
    - [6, 3309.52]
  - - [5888, 2368, 1, 768, 5888, 5888, 5888, 768]
    - [14, 4235.52]
  - - [128, 3584, 1, 128, 128, 128, 128, 128]
    - [1, 539.708]
  - - [1408, 4, 1, 3328, 1408, 1408, 1408, 3328]
    - [24, 183.04]
  - - [2368, 704, 1, 768, 2368, 2368, 2368, 768]
    - [14, 3464.05]
  - - [1024, 4, 1, 768, 1024, 1024, 1024, 768]
    - [26, 48.6052]
  - - [5888, 2944, 1, 128, 5888, 5888, 5888, 128]
    - [4, 2187.64]
  - - [704, 4288, 1, 128, 704, 704, 704, 128]
    - [0, 1607.32]
  - - [1024, 256, 1, 768, 1024, 1024, 1024, 768]
    - [6, 1706.16]
  - - [6784, 4, 1, 1792, 6784, 6784, 6784, 1792]
    - [22, 281.542]
  - - [64, 3584, 1, 3328, 64, 64, 64, 3328]
    - [6, 2316.59]
  - - [2944, 5056, 1, 128, 2944, 2944, 2944, 128]
    - [4, 2208.65]
  - - [6784, 5056, 1, 768, 6784, 6784, 6784, 768]
    - [14, 4499.82]
  - - [1408, 3584, 1, 256, 1408, 1408, 1408, 256]
    - [14, 3518.86]
  - - [1408, 5056, 1, 128, 1408, 1408, 1408, 128]
    - [4, 1909.5]
  - - [64, 4288, 1, 768, 64, 64, 64, 768]
    - [6, 1775.3]
  - - [6784, 6784, 1, 256, 6784, 6784, 6784, 256]
    - [14, 4379.72]
  - - [6784, 2944, 1, 3328, 6784, 6784, 6784, 3328]
    - [14, 4407.8]
  - - [448, 4288, 1, 1792, 448, 448, 448, 1792]
    - [12, 4012.21]
  - - [2944, 704, 1, 3328, 2944, 2944, 2944, 3328]
    - [6, 3513.99]
  - - [1024, 5888, 1, 768, 1024, 1024, 1024, 768]
    - [14, 3831.94]
  - - [6784, 128, 1, 3328, 6784, 6784, 6784, 3328]
    - [10, 3301.36]
  - - [704, 1024, 1, 128, 704, 704, 704, 128]
    - [1, 848.113]
  - - [2944, 704, 1, 128, 2944, 2944, 2944, 128]
    - [1, 1280.36]
  - - [64, 2944, 1, 768, 64, 64, 64, 768]
    - [6, 1559.3]
  - - [1408, 1024, 1, 768, 1408, 1408, 1408, 768]
    - [10, 3462.9]
  - - [4, 256, 1, 256, 4, 4, 4, 256]
    - [23, 5.68889]
  - - [1024, 2368, 1, 256, 1024, 1024, 1024, 256]
    - [10, 3289.3]
  - - [4288, 5888, 1, 1792, 4288, 4288, 4288, 1792]
    - [14, 4329.8]
  - - [448, 4288, 1, 256, 448, 448, 448, 256]
    - [12, 3275.05]
  - - [2944, 5888, 1, 768, 2944, 2944, 2944, 768]
    - [14, 4383.11]
  - - [256, 2368, 1, 128, 256, 256, 256, 128]
    - [1, 664.793]
  - - [4288, 3584, 1, 256, 4288, 4288, 4288, 256]
    - [14, 4146.56]
  - - [2944, 3584, 1, 768, 2944, 2944, 2944, 768]
    - [14, 4314.91]
  - - [4288, 2368, 1, 128, 4288, 4288, 4288, 128]
    - [3, 2044.34]
  - - [5056, 2368, 1, 1792, 5056, 5056, 5056, 1792]
    - [14, 4227.47]
  - - [3584, 3584, 1, 256, 3584, 3584, 3584, 256]
    - [14, 4017.22]
  - - [5056, 3584, 1, 128, 5056, 5056, 5056, 128]
    - [4, 2242.14]
  - - [5056, 4288, 1, 768, 5056, 5056, 5056, 768]
    - [14, 4308.74]
  - - [64, 5888, 1, 768, 64, 64, 64, 768]
    - [6, 2379.99]
  - - [3584, 2368, 1, 768, 3584, 3584, 3584, 768]
    - [14, 4227.82]
  - - [2368, 1856, 1, 768, 2368, 2368, 2368, 768]
    - [14, 3798.69]
  - - [4, 4, 1, 3328, 4, 4, 4, 3328]
    - [24, 0.668277]
  - - [3584, 1024, 1, 256, 3584, 3584, 3584, 256]
    - [14, 3510.93]
  - - [1856, 256, 1, 1792, 1856, 1856, 1856, 1792]
    - [6, 3448.82]
  - - [3584, 64, 1, 3328, 3584, 3584, 3584, 3328]
    - [6, 2370.69]
  - - [1856, 4, 1, 1792, 1856, 1856, 1856, 1792]
    - [24, 155.855]
  - - [5056, 128, 1, 1792, 5056, 5056, 5056, 1792]
    - [6, 2857.03]
  - - [256, 2944, 1, 768, 256, 256, 256, 768]
    - [10, 2655.11]
  - - [64, 5888, 1, 3328, 64, 64, 64, 3328]
    - [6, 2818.45]
  - - [2944, 5888, 1, 256, 2944, 2944, 2944, 256]
    - [14, 4213.1]
  - - [4, 5888, 1, 256, 4, 4, 4, 256]
    - [25, 83.6475]
  - - [6784, 128, 1, 128, 6784, 6784, 6784, 128]
    - [1, 1004.6]
  - - [2944, 256, 1, 1792, 2944, 2944, 2944, 1792]
    - [6, 2831.61]
  - - [5888, 2368, 1, 3328, 5888, 5888, 5888, 3328]
    - [14, 4297.78]
  - - [1024, 1408, 1, 128, 1024, 1024, 1024, 128]
    - [4, 1159.23]
  - - [4, 5888, 1, 768, 4, 4, 4, 768]
    - [23, 185.328]
  - - [5056, 6784, 1, 3328, 5056, 5056, 5056, 3328]
    - [14, 4432.48]
  - - [256, 256, 1, 256, 256, 256, 256, 256]
    - [11, 386.928]
  - - [2944, 5056, 1, 1792, 2944, 2944, 2944, 1792]
    - [14, 4289.42]
  - - [704, 4, 1, 3328, 704, 704, 704, 3328]
    - [24, 99.6136]
  - - [4, 448, 1, 128, 4, 4, 4, 128]
    - [20, 3.9385]
  - - [6784, 5056, 1, 256, 6784, 6784, 6784, 256]
    - [14, 4357.62]
  - - [5056, 4288, 1, 1792, 5056, 5056, 5056, 1792]
    - [14, 4357.97]
  - - [4, 1408, 1, 256, 4, 4, 4, 256]
    - [23, 24.487]
  - - [5056, 448, 1, 768, 5056, 5056, 5056, 768]
    - [10, 3368.68]
  - - [1856, 2368, 1, 1792, 1856, 1856, 1856, 1792]
    - [14, 3911.17]
  - - [4288, 704, 1, 128, 4288, 4288, 4288, 128]
    - [0, 1564.63]
  - - [2368, 2944, 1, 128, 2368, 2368, 2368, 128]
    - [4, 1937.85]
  - - [1856, 64, 1, 256, 1856, 1856, 1856, 256]
    - [6, 668.03]
  - - [1024, 3584, 1, 1792, 1024, 1024, 1024, 1792]
    - [18, 4099.15]
  - - [704, 4, 1, 256, 704, 704, 704, 256]
    - [26, 13.8209]
  - - [64, 4, 1, 128, 64, 64, 64, 128]
    - [20, 0.605028]
  - - [2944, 6784, 1, 256, 2944, 2944, 2944, 256]
    - [14, 4208.25]
  - - [2368, 1856, 1, 256, 2368, 2368, 2368, 256]
    - [10, 3571.36]
  - - [5056, 256, 1, 768, 5056, 5056, 5056, 768]
    - [10, 3114.19]
  - - [5888, 256, 1, 128, 5888, 5888, 5888, 128]
    - [4, 1215.59]
  - - [4288, 256, 1, 1792, 4288, 4288, 4288, 1792]
    - [6, 3113.73]
  - - [5056, 256, 1, 256, 5056, 5056, 5056, 256]
    - [10, 2792.9]
  - - [448, 1024, 1, 1792, 448, 448, 448, 1792]
    - [6, 3333.13]
  - - [1408, 1408, 1, 256, 1408, 1408, 1408, 256]
    - [10, 2753.42]
  - - [2944, 3584, 1, 1792, 2944, 2944, 2944, 1792]
    - [14, 4383.9]
  - - [4, 1856, 1, 1792, 4, 4, 4, 1792]
    - [24, 153.553]
  - - [256, 128, 1, 256, 256, 256, 256, 256]
    - [11, 205.201]
  - - [256, 2944, 1, 256, 256, 256, 256, 256]
    - [10, 2245.55]
  - - [704, 1856, 1, 3328, 704, 704, 704, 3328]
    - [6, 3384.11]
  - - [2944, 5888, 1, 3328, 2944, 2944, 2944, 3328]
    - [14, 4458.04]
  - - [2944, 6784, 1, 1792, 2944, 2944, 2944, 1792]
    - [14, 4394.43]
  - - [704, 3584, 1, 256, 704, 704, 704, 256]
    - [14, 3195.11]
  - - [448, 4288, 1, 3328, 448, 448, 448, 3328]
    - [12, 4090.84]
  - - [128, 5056, 1, 3328, 128, 128, 128, 3328]
    - [6, 2964.02]
  - - [64, 1408, 1, 768, 64, 64, 64, 768]
    - [6, 774.463]
  - - [5056, 5056, 1, 3328, 5056, 5056, 5056, 3328]
    - [14, 4395.23]
  - - [2368, 4288, 1, 256, 2368, 2368, 2368, 256]
    - [14, 3946.17]
  - - [3584, 1856, 1, 3328, 3584, 3584, 3584, 3328]
    - [14, 4313.43]
  - - [4, 704, 1, 1792, 4, 4, 4, 1792]
    - [24, 66.8912]
  - - [4288, 3584, 1, 3328, 4288, 4288, 4288, 3328]
    - [14, 4439.79]
  - - [2944, 256, 1, 128, 2944, 2944, 2944, 128]
    - [1, 873.813]
  - - [2944, 448, 1, 256, 2944, 2944, 2944, 256]
    - [10, 2834.46]
  - - [128, 64, 1, 1792, 128, 128, 128, 1792]
    - [5, 168.969]
  - - [4, 1408, 1, 3328, 4, 4, 4, 3328]
    - [24, 178.305]
  - - [4288, 1024, 1, 3328, 4288, 4288, 4288, 3328]
    - [14, 3954.41]
  - - [5056, 256, 1, 1792, 5056, 5056, 5056, 1792]
    - [6, 3263.15]
  - - [3584, 448, 1, 256, 3584, 3584, 3584, 256]
    - [14, 2851.29]
  - - [448, 128, 1, 3328, 448, 448, 448, 3328]
    - [13, 1168.22]
  - - [1024, 2368, 1, 1792, 1024, 1024, 1024, 1792]
    - [14, 3669.02]
  - - [448, 3584, 1, 128, 448, 448, 448, 128]
    - [4, 1312.06]
  - - [128, 3584, 1, 1792, 128, 128, 128, 1792]
    - [6, 3304.19]
  - - [5888, 704, 1, 256, 5888, 5888, 5888, 256]
    - [14, 3435.51]
  - - [1408, 5888, 1, 768, 1408, 1408, 1408, 768]
    - [14, 4133.74]
  - - [5888, 64, 1, 256, 5888, 5888, 5888, 256]
    - [6, 1745.1]
  - - [3584, 2368, 1, 128, 3584, 3584, 3584, 128]
    - [4, 1889.39]
  - - [4288, 5056, 1, 1792, 4288, 4288, 4288, 1792]
    - [14, 4354.77]
  - - [448, 4, 1, 128, 448, 448, 448, 128]
    - [20, 4.29226]
  - - [2368, 1408, 1, 256, 2368, 2368, 2368, 256]
    - [10, 3408.71]
  - - [5056, 5056, 1, 128, 5056, 5056, 5056, 128]
    - [0, 2404.96]
  - - [4, 6784, 1, 3328, 4, 4, 4, 3328]
    - [26, 70.9441]
  - - [4, 1408, 1, 128, 4, 4, 4, 128]
    - [20, 12.1774]
  - - [1024, 4288, 1, 3328, 1024, 1024, 1024, 3328]
    - [14, 3925.26]
  - - [448, 1408, 1, 768, 448, 448, 448, 768]
    - [6, 2570.26]
  - - [5888, 1856, 1, 128, 5888, 5888, 5888, 128]
    - [4, 2049.11]
  - - [6784, 2944, 1, 1792, 6784, 6784, 6784, 1792]
    - [14, 4390.38]
  - - [448, 1024, 1, 256, 448, 448, 448, 256]
    - [6, 2155.66]
  - - [4, 4, 1, 128, 4, 4, 4, 128]
    - [21, 0.0286676]
  - - [2944, 4288, 1, 128, 2944, 2944, 2944, 128]
    - [4, 2134.89]
  - - [3584, 704, 1, 1792, 3584, 3584, 3584, 1792]
    - [14, 3803.64]
  - - [1024, 1024, 1, 128, 1024, 1024, 1024, 128]
    - [4, 866.144]
  - - [1408, 1024, 1, 3328, 1408, 1408, 1408, 3328]
    - [6, 3725.14]
  - - [4288, 5056, 1, 3328, 4288, 4288, 4288, 3328]
    - [14, 4372.9]
  - - [64, 256, 1, 1792, 64, 64, 64, 1792]
    - [13, 260.47]
  - - [5888, 4288, 1, 128, 5888, 5888, 5888, 128]
    - [4, 2264.76]
  - - [64, 6784, 1, 128, 64, 64, 64, 128]
    - [1, 585.735]
  - - [3584, 2368, 1, 256, 3584, 3584, 3584, 256]
    - [14, 3992.08]
  - - [4288, 4288, 1, 3328, 4288, 4288, 4288, 3328]
    - [14, 4478.82]
  - - [2944, 64, 1, 256, 2944, 2944, 2944, 256]
    - [6, 1015.04]
  - - [1856, 1856, 1, 768, 1856, 1856, 1856, 768]
    - [18, 3701.94]
  - - [256, 256, 1, 128, 256, 256, 256, 128]
    - [1, 95.8479]
  - - [1408, 4288, 1, 256, 1408, 1408, 1408, 256]
    - [14, 3589.75]
  - - [128, 64, 1, 256, 128, 128, 128, 256]
    - [11, 51.3002]
  - - [6784, 6784, 1, 1792, 6784, 6784, 6784, 1792]
    - [14, 4544.89]
  - - [64, 5888, 1, 256, 64, 64, 64, 256]
    - [6, 1747.63]
  - - [4, 256, 1, 1792, 4, 4, 4, 1792]
    - [24, 27.9046]
  - - [4, 1856, 1, 256, 4, 4, 4, 256]
    - [23, 31.9312]
  - - [6784, 3584, 1, 128, 6784, 6784, 6784, 128]
    - [4, 2316.02]
  - - [448, 448, 1, 3328, 448, 448, 448, 3328]
    - [17, 2145.24]
  - - [256, 4, 1, 1792, 256, 256, 256, 1792]
    - [24, 28.672]
  - - [1408, 1408, 1, 3328, 1408, 1408, 1408, 3328]
    - [6, 3364.63]
  - - [2944, 4288, 1, 3328, 2944, 2944, 2944, 3328]
    - [14, 4476.55]
  - - [4, 128, 1, 128, 4, 4, 4, 128]
    - [20, 1.17197]
  - - [2368, 5888, 1, 1792, 2368, 2368, 2368, 1792]
    - [14, 4269.62]
  - - [448, 2368, 1, 256, 448, 448, 448, 256]
    - [10, 2314.09]
  - - [1024, 1856, 1, 3328, 1024, 1024, 1024, 3328]
    - [14, 4220.95]
  - - [4, 6784, 1, 768, 4, 4, 4, 768]
    - [26, 183.585]
  - - [704, 448, 1, 128, 704, 704, 704, 128]
    - [1, 453.801]
  - - [1408, 2944, 1, 3328, 1408, 1408, 1408, 3328]
    - [6, 3807.34]
  - - [2368, 4, 1, 128, 2368, 2368, 2368, 128]
    - [20, 21.4361]
  - - [1024, 6784, 1, 768, 1024, 1024, 1024, 768]
    - [14, 3895.64]
  - - [2368, 5888, 1, 3328, 2368, 2368, 2368, 3328]
    - [14, 4287.55]
  - - [448, 1408, 1, 256, 448, 448, 448, 256]
    - [6, 1927.9]
  - - [5888, 448, 1, 3328, 5888, 5888, 5888, 3328]
    - [14, 4029.73]
  - - [2944, 1408, 1, 3328, 2944, 2944, 2944, 3328]
    - [6, 3801.8]
  - - [6784, 1856, 1, 128, 6784, 6784, 6784, 128]
    - [4, 2147.51]
  - - [448, 1024, 1, 768, 448, 448, 448, 768]
    - [6, 2959.69]
  - - [128, 1408, 1, 128, 128, 128, 128, 128]
    - [1, 260.722]
  - - [5056, 2944, 1, 1792, 5056, 5056, 5056, 1792]
    - [14, 4279.73]
  - - [256, 3584, 1, 3328, 256, 256, 256, 3328]
    - [6, 3520.08]
  - - [4288, 1856, 1, 1792, 4288, 4288, 4288, 1792]
    - [14, 4034.92]
  - - [3584, 1408, 1, 128, 3584, 3584, 3584, 128]
    - [4, 1650.46]
  - - [2368, 1024, 1, 768, 2368, 2368, 2368, 768]
    - [10, 3602.35]
  - - [128, 1408, 1, 1792, 128, 128, 128, 1792]
    - [6, 1765.2]
  - - [1024, 2368, 1, 3328, 1024, 1024, 1024, 3328]
    - [6, 3762.52]
  - - [128, 256, 1, 1792, 128, 128, 128, 1792]
    - [13, 485.773]
  - - [4, 128, 1, 3328, 4, 4, 4, 3328]
    - [24, 19.9805]
  - - [2944, 3584, 1, 256, 2944, 2944, 2944, 256]
    - [14, 4093.62]
  - - [64, 256, 1, 768, 64, 64, 64, 768]
    - [6, 139.81]
  - - [448, 4, 1, 768, 448, 448, 448, 768]
    - [26, 25.0047]
  - - [256, 5056, 1, 256, 256, 256, 256, 256]
    - [10, 2779.78]
  - - [448, 6784, 1, 256, 448, 448, 448, 256]
    - [10, 3147.42]
  - - [6784, 3584, 1, 768, 6784, 6784, 6784, 768]
    - [14, 4448.59]
  - - [4, 5888, 1, 128, 4, 4, 4, 128]
    - [20, 53.8336]
  - - [5056, 2944, 1, 3328, 5056, 5056, 5056, 3328]
    - [14, 4298.85]
  - - [6784, 2944, 1, 128, 6784, 6784, 6784, 128]
    - [4, 2288.9]
  - - [4288, 64, 1, 128, 4288, 4288, 4288, 128]
    - [1, 374.013]
  - - [128, 448, 1, 256, 128, 128, 128, 256]
    - [11, 354.249]
  - - [1856, 128, 1, 768, 1856, 1856, 1856, 768]
    - [6, 1932.76]
  - - [128, 64, 1, 768, 128, 128, 128, 768]
    - [5, 82.957]
  - - [6784, 64, 1, 256, 6784, 6784, 6784, 256]
    - [6, 2049.21]
  - - [704, 256, 1, 128, 704, 704, 704, 128]
    - [1, 255.864]
  - - [4, 6784, 1, 128, 4, 4, 4, 128]
    - [20, 62.3822]
  - - [2944, 4288, 1, 1792, 2944, 2944, 2944, 1792]
    - [14, 4453.78]
  - - [448, 448, 1, 256, 448, 448, 448, 256]
    - [11, 1083.06]
  - - [5056, 5888, 1, 3328, 5056, 5056, 5056, 3328]
    - [14, 4460.72]
  - - [6784, 5056, 1, 128, 6784, 6784, 6784, 128]
    - [0, 2412.2]
  - - [128, 256, 1, 128, 128, 128, 128, 128]
    - [1, 50.607]
  - - [6784, 256, 1, 768, 6784, 6784, 6784, 768]
    - [14, 3608.74]
  - - [2368, 448, 1, 256, 2368, 2368, 2368, 256]
    - [10, 2333.17]
  - - [4, 704, 1, 128, 4, 4, 4, 128]
    - [20, 6.29279]
  - - [1856, 5888, 1, 256, 1856, 1856, 1856, 256]
    - [14, 3919.53]
  - - [448, 2368, 1, 768, 448, 448, 448, 768]
    - [6, 2805.59]
  - - [1024, 1856, 1, 256, 1024, 1024, 1024, 256]
    - [14, 3345.29]
  - - [6784, 1024, 1, 768, 6784, 6784, 6784, 768]
    - [14, 3891.09]
  - - [5056, 1024, 1, 768, 5056, 5056, 5056, 768]
    - [14, 3841.0]
  - - [1024, 1408, 1, 3328, 1024, 1024, 1024, 3328]
    - [6, 3679.21]
  - - [4, 1856, 1, 128, 4, 4, 4, 128]
    - [20, 17.1407]
  - - [5056, 64, 1, 128, 5056, 5056, 5056, 128]
    - [1, 450.204]
  - - [5888, 5056, 1, 768, 5888, 5888, 5888, 768]
    - [14, 4414.96]
  - - [5888, 256, 1, 3328, 5888, 5888, 5888, 3328]
    - [14, 3354.1]
  - - [5888, 4288, 1, 256, 5888, 5888, 5888, 256]
    - [14, 4308.95]
  - - [1856, 256, 1, 256, 1856, 1856, 1856, 256]
    - [6, 2213.15]
  - - [4, 2368, 1, 3328, 4, 4, 4, 3328]
    - [23, 197.314]
  - - [5888, 448, 1, 256, 5888, 5888, 5888, 256]
    - [14, 3458.02]
  - - [1856, 6784, 1, 128, 1856, 1856, 1856, 128]
    - [3, 2166.45]
  - - [1408, 1408, 1, 128, 1408, 1408, 1408, 128]
    - [1, 1265.74]
  - - [3584, 2944, 1, 128, 3584, 3584, 3584, 128]
    - [4, 1982.16]
  - - [1856, 448, 1, 128, 1856, 1856, 1856, 128]
    - [1, 964.743]
  - - [128, 256, 1, 768, 128, 128, 128, 768]
    - [6, 278.137]
  - - [1408, 1856, 1, 128, 1408, 1408, 1408, 128]
    - [3, 1469.15]
  - - [64, 256, 1, 256, 64, 64, 64, 256]
    - [11, 101.606]
  - - [704, 4, 1, 1792, 704, 704, 704, 1792]
    - [26, 68.2667]
  - - [256, 5056, 1, 768, 256, 256, 256, 768]
    - [10, 3113.41]
  - - [128, 5888, 1, 128, 128, 128, 128, 128]
    - [1, 793.331]
  - - [4288, 128, 1, 768, 4288, 4288, 4288, 768]
    - [6, 2241.21]
  - - [128, 4, 1, 768, 128, 128, 128, 768]
    - [24, 7.96629]
  - - [128, 5056, 1, 1792, 128, 128, 128, 1792]
    - [6, 2855.9]
  - - [448, 256, 1, 256, 448, 448, 448, 256]
    - [6, 646.13]
  - - [4288, 4288, 1, 1792, 4288, 4288, 4288, 1792]
    - [14, 4456.48]
  - - [4288, 6784, 1, 768, 4288, 4288, 4288, 768]
    - [14, 4314.93]
  - - [128, 64, 1, 3328, 128, 128, 128, 3328]
    - [5, 254.889]
  - - [6784, 256, 1, 128, 6784, 6784, 6784, 128]
    - [4, 1367.48]
  - - [1408, 6784, 1, 3328, 1408, 1408, 1408, 3328]
    - [14, 4163.56]
  - - [2368, 2944, 1, 256, 2368, 2368, 2368, 256]
    - [14, 3653.53]
  - - [3584, 4, 1, 3328, 3584, 3584, 3584, 3328]
    - [23, 277.644]
  - - [4288, 2944, 1, 256, 4288, 4288, 4288, 256]
    - [14, 3905.3]
  - - [448, 448, 1, 768, 448, 448, 448, 768]
    - [6, 1652.45]
  - - [1024, 2944, 1, 128, 1024, 1024, 1024, 128]
    - [0, 1452.41]
  - - [1408, 4288, 1, 768, 1408, 1408, 1408, 768]
    - [14, 3824.23]
  - - [64, 5056, 1, 256, 64, 64, 64, 256]
    - [6, 1529.5]
  - - [5056, 6784, 1, 256, 5056, 5056, 5056, 256]
    - [14, 4256.23]
  - - [256, 128, 1, 128, 256, 256, 256, 128]
    - [1, 49.9322]
  - - [5056, 4, 1, 1792, 5056, 5056, 5056, 1792]
    - [23, 257.251]
  - - [2368, 1408, 1, 3328, 2368, 2368, 2368, 3328]
    - [18, 3784.77]
  - - [448, 5056, 1, 128, 448, 448, 448, 128]
    - [3, 1384.85]
  - - [704, 256, 1, 1792, 704, 704, 704, 1792]
    - [6, 1771.4]
  - - [3584, 4288, 1, 768, 3584, 3584, 3584, 768]
    - [14, 4354.88]
  - - [4, 4, 1, 768, 4, 4, 4, 768]
    - [26, 0.258586]
  - - [6784, 2368, 1, 256, 6784, 6784, 6784, 256]
    - [14, 4149.36]
  - - [3584, 5056, 1, 1792, 3584, 3584, 3584, 1792]
    - [14, 4395.04]
  - - [4288, 256, 1, 128, 4288, 4288, 4288, 128]
    - [1, 980.662]
  - - [4288, 128, 1, 3328, 4288, 4288, 4288, 3328]
    - [8, 2825.48]
  - - [1856, 2368, 1, 128, 1856, 1856, 1856, 128]
    - [3, 1764.62]
  - - [5056, 4, 1, 256, 5056, 5056, 5056, 256]
    - [25, 78.2549]
  - - [4288, 5888, 1, 256, 4288, 4288, 4288, 256]
    - [14, 4169.52]
  - - [5888, 1856, 1, 3328, 5888, 5888, 5888, 3328]
    - [14, 4196.45]
  - - [1856, 2368, 1, 3328, 1856, 1856, 1856, 3328]
    - [14, 3941.37]
  - - [2368, 1408, 1, 128, 2368, 2368, 2368, 128]
    - [0, 1673.87]
  - - [1408, 64, 1, 256, 1408, 1408, 1408, 256]
    - [6, 511.274]
  - - [3584, 128, 1, 128, 3584, 3584, 3584, 128]
    - [1, 617.328]
  - - [448, 4, 1, 1792, 448, 448, 448, 1792]
    - [24, 46.8935]
  - - [128, 5056, 1, 256, 128, 128, 128, 256]
    - [6, 1972.32]
  - - [1024, 3584, 1, 3328, 1024, 1024, 1024, 3328]
    - [18, 4166.15]
  - - [128, 5888, 1, 256, 128, 128, 128, 256]
    - [10, 2258.17]
  - - [1856, 4288, 1, 3328, 1856, 1856, 1856, 3328]
    - [14, 4055.05]
  - - [448, 256, 1, 768, 448, 448, 448, 768]
    - [6, 976.068]
  - - [1856, 1856, 1, 3328, 1856, 1856, 1856, 3328]
    - [18, 3907.96]
  - - [64, 1408, 1, 128, 64, 64, 64, 128]
    - [1, 136.018]
  - - [3584, 1856, 1, 128, 3584, 3584, 3584, 128]
    - [4, 1802.99]
  - - [64, 1856, 1, 256, 64, 64, 64, 256]
    - [6, 656.492]
  - - [2368, 1024, 1, 128, 2368, 2368, 2368, 128]
    - [1, 1443.35]
  - - [64, 2944, 1, 256, 64, 64, 64, 256]
    - [6, 1011.63]
  - - [5056, 1856, 1, 128, 5056, 5056, 5056, 128]
    - [3, 2068.94]
  - - [1024, 1024, 1, 3328, 1024, 1024, 1024, 3328]
    - [6, 3057.03]
  - - [64, 4288, 1, 1792, 64, 64, 64, 1792]
    - [6, 1988.12]
  - - [448, 448, 1, 1792, 448, 448, 448, 1792]
    - [6, 1958.09]
  - - [4288, 1856, 1, 256, 4288, 4288, 4288, 256]
    - [14, 3729.29]
  - - [448, 3584, 1, 256, 448, 448, 448, 256]
    - [12, 2827.75]
  - - [128, 4288, 1, 256, 128, 128, 128, 256]
    - [6, 1698.61]
  - - [1408, 1408, 1, 768, 1408, 1408, 1408, 768]
    - [6, 3081.05]
  - - [1024, 256, 1, 128, 1024, 1024, 1024, 128]
    - [1, 368.568]
  - - [704, 704, 1, 1792, 704, 704, 704, 1792]
    - [6, 2212.84]
  - - [5056, 256, 1, 128, 5056, 5056, 5056, 128]
    - [1, 1105.09]
  - - [5056, 1856, 1, 3328, 5056, 5056, 5056, 3328]
    - [14, 4307.17]
  - - [1024, 704, 1, 128, 1024, 1024, 1024, 128]
    - [1, 809.427]
  - - [4288, 2944, 1, 768, 4288, 4288, 4288, 768]
    - [14, 4089.26]
  - - [5056, 2368, 1, 256, 5056, 5056, 5056, 256]
    - [14, 3964.03]
  - - [5888, 1408, 1, 128, 5888, 5888, 5888, 128]
    - [4, 1889.8]
  - - [4, 1024, 1, 128, 4, 4, 4, 128]
    - [20, 9.08968]
  - - [64, 2368, 1, 1792, 64, 64, 64, 1792]
    - [6, 1497.47]
  - - [448, 1408, 1, 3328, 448, 448, 448, 3328]
    - [6, 2887.39]
  - - [6784, 4288, 1, 256, 6784, 6784, 6784, 256]
    - [14, 4313.99]
  - - [128, 6784, 1, 128, 128, 128, 128, 128]
    - [1, 888.908]
  - - [1024, 4288, 1, 128, 1024, 1024, 1024, 128]
    - [4, 1607.29]
  - - [5888, 3584, 1, 1792, 5888, 5888, 5888, 1792]
    - [14, 4430.95]
  - - [5888, 3584, 1, 256, 5888, 5888, 5888, 256]
    - [14, 4252.68]
  - - [6784, 1856, 1, 1792, 6784, 6784, 6784, 1792]
    - [14, 4440.61]
  - - [4, 4, 1, 1792, 4, 4, 4, 1792]
    - [24, 0.483019]
  - - [4, 704, 1, 256, 4, 4, 4, 256]
    - [25, 13.5303]
  - - [3584, 256, 1, 128, 3584, 3584, 3584, 128]
    - [1, 987.227]
  - - [3584, 2368, 1, 1792, 3584, 3584, 3584, 1792]
    - [14, 4301.25]
  - - [1408, 5888, 1, 256, 1408, 1408, 1408, 256]
    - [14, 3912.25]
  - - [4, 128, 1, 1792, 4, 4, 4, 1792]
    - [24, 14.2824]
  - - [1408, 64, 1, 1792, 1408, 1408, 1408, 1792]
    - [16, 1083.47]
  - - [2368, 448, 1, 768, 2368, 2368, 2368, 768]
    - [6, 2802.5]
  - - [2944, 64, 1, 1792, 2944, 2944, 2944, 1792]
    - [6, 1832.62]
  - - [5888, 3584, 1, 3328, 5888, 5888, 5888, 3328]
    - [14, 4445.82]
  - - [3584, 704, 1, 128, 3584, 3584, 3584, 128]
    - [4, 1380.18]
  - - [2944, 2368, 1, 1792, 2944, 2944, 2944, 1792]
    - [14, 3960.92]
  - - [1856, 1408, 1, 1792, 1856, 1856, 1856, 1792]
    - [14, 3928.11]
  - - [256, 4, 1, 3328, 256, 256, 256, 3328]
    - [24, 40.6862]
  - - [2944, 2944, 1, 128, 2944, 2944, 2944, 128]
    - [4, 2020.32]
  - - [704, 4288, 1, 768, 704, 704, 704, 768]
    - [6, 3316.93]
  - - [128, 6784, 1, 256, 128, 128, 128, 256]
    - [10, 2537.65]
  - - [5056, 4288, 1, 256, 5056, 5056, 5056, 256]
    - [14, 4173.27]
  - - [128, 704, 1, 128, 128, 128, 128, 128]
    - [1, 135.38]
  - - [2368, 6784, 1, 128, 2368, 2368, 2368, 128]
    - [4, 2227.32]
  - - [128, 1856, 1, 768, 128, 128, 128, 768]
    - [6, 1932.76]
  - - [5888, 2944, 1, 1792, 5888, 5888, 5888, 1792]
    - [14, 4441.69]
  - - [64, 3584, 1, 256, 64, 64, 64, 256]
    - [6, 1176.29]
  - - [2368, 2368, 1, 128, 2368, 2368, 2368, 128]
    - [3, 1908.91]
  - - [5888, 2368, 1, 1792, 5888, 5888, 5888, 1792]
    - [14, 4281.09]
  - - [704, 704, 1, 768, 704, 704, 704, 768]
    - [6, 2028.1]
  - - [704, 3584, 1, 1792, 704, 704, 704, 1792]
    - [14, 3775.18]
  - - [448, 128, 1, 128, 448, 448, 448, 128]
    - [1, 85.1117]
  - - [1408, 704, 1, 128, 1408, 1408, 1408, 128]
    - [1, 911.478]
  - - [2368, 1856, 1, 128, 2368, 2368, 2368, 128]
    - [3, 1764.18]
  - - [5888, 1024, 1, 128, 5888, 5888, 5888, 128]
    - [4, 1792.11]
  - - [5888, 4, 1, 1792, 5888, 5888, 5888, 1792]
    - [22, 256.1]
  - - [256, 2368, 1, 256, 256, 256, 256, 256]
    - [6, 1838.74]
  - - [6784, 2368, 1, 3328, 6784, 6784, 6784, 3328]
    - [14, 4370.84]
  - - [64, 2368, 1, 256, 64, 64, 64, 256]
    - [11, 819.2]
  - - [5056, 128, 1, 3328, 5056, 5056, 5056, 3328]
    - [6, 2963.69]
  - - [448, 704, 1, 768, 448, 448, 448, 768]
    - [6, 2056.9]
  - - [256, 128, 1, 3328, 256, 256, 256, 3328]
    - [13, 799.97]
  - - [2944, 704, 1, 1792, 2944, 2944, 2944, 1792]
    - [6, 3430.3]
  - - [4, 3584, 1, 1792, 4, 4, 4, 1792]
    - [26, 83.6489]
  - - [6784, 4288, 1, 768, 6784, 6784, 6784, 768]
    - [14, 4444.3]
  - - [1024, 64, 1, 3328, 1024, 1024, 1024, 3328]
    - [15, 988.864]
  - - [6784, 1408, 1, 128, 6784, 6784, 6784, 128]
    - [4, 2051.69]
  - - [4, 704, 1, 768, 4, 4, 4, 768]
    - [24, 35.4772]
  - - [448, 4288, 1, 128, 448, 448, 448, 128]
    - [2, 1480.56]
  - - [5888, 4288, 1, 1792, 5888, 5888, 5888, 1792]
    - [14, 4492.91]
  - - [5888, 128, 1, 1792, 5888, 5888, 5888, 1792]
    - [10, 2803.87]
  - - [4, 3584, 1, 768, 4, 4, 4, 768]
    - [23, 134.269]
  - - [2944, 1408, 1, 1792, 2944, 2944, 2944, 1792]
    - [6, 3721.65]
  - - [1408, 5056, 1, 1792, 1408, 1408, 1408, 1792]
    - [18, 3981.68]
  - - [2944, 1024, 1, 256, 2944, 2944, 2944, 256]
    - [10, 3129.06]
  - - [128, 1024, 1, 768, 128, 128, 128, 768]
    - [6, 1106.68]
  - - [704, 5056, 1, 3328, 704, 704, 704, 3328]
    - [18, 4021.73]
  - - [6784, 2368, 1, 768, 6784, 6784, 6784, 768]
    - [14, 4307.56]
  - - [1408, 256, 1, 1792, 1408, 1408, 1408, 1792]
    - [6, 2626.56]
  - - [704, 256, 1, 3328, 704, 704, 704, 3328]
    - [9, 2005.7]
  - - [1408, 448, 1, 128, 1408, 1408, 1408, 128]
    - [1, 728.704]
  - - [448, 64, 1, 3328, 448, 448, 448, 3328]
    - [13, 678.473]
  - - [5056, 1408, 1, 256, 5056, 5056, 5056, 256]
    - [14, 3732.64]
  - - [5056, 1408, 1, 1792, 5056, 5056, 5056, 1792]
    - [14, 4035.28]
  - - [128, 6784, 1, 768, 128, 128, 128, 768]
    - [10, 3034.65]
  - - [1408, 1024, 1, 1792, 1408, 1408, 1408, 1792]
    - [6, 3625.11]
  - - [2944, 4, 1, 768, 2944, 2944, 2944, 768]
    - [24, 122.613]
  - - [128, 1856, 1, 1792, 128, 128, 128, 1792]
    - [6, 2306.69]
  - - [2944, 1408, 1, 256, 2944, 2944, 2944, 256]
    - [10, 3392.45]
  - - [5888, 64, 1, 128, 5888, 5888, 5888, 128]
    - [1, 519.768]
  - - [256, 5888, 1, 256, 256, 256, 256, 256]
    - [14, 2709.8]
  - - [3584, 2368, 1, 3328, 3584, 3584, 3584, 3328]
    - [14, 4325.34]
  - - [4288, 128, 1, 1792, 4288, 4288, 4288, 1792]
    - [6, 2427.83]
  - - [1408, 128, 1, 768, 1408, 1408, 1408, 768]
    - [6, 1490.22]
  - - [6784, 5888, 1, 3328, 6784, 6784, 6784, 3328]
    - [14, 4534.05]
  - - [2944, 64, 1, 3328, 2944, 2944, 2944, 3328]
    - [17, 2087.38]
  - - [5888, 4, 1, 256, 5888, 5888, 5888, 256]
    - [25, 88.9804]
  - - [3584, 5888, 1, 128, 3584, 3584, 3584, 128]
    - [0, 2139.28]
  - - [5888, 1408, 1, 768, 5888, 5888, 5888, 768]
    - [14, 4150.99]
  - - [5056, 256, 1, 3328, 5056, 5056, 5056, 3328]
    - [6, 3352.28]
  - - [64, 2368, 1, 768, 64, 64, 64, 768]
    - [6, 1266.23]
  - - [1024, 5056, 1, 1792, 1024, 1024, 1024, 1792]
    - [14, 3931.0]
  - - [448, 704, 1, 1792, 448, 448, 448, 1792]
    - [6, 2301.23]
  - - [2944, 4288, 1, 256, 2944, 2944, 2944, 256]
    - [14, 4183.12]
  - - [5056, 2944, 1, 128, 5056, 5056, 5056, 128]
    - [4, 2225.15]
  - - [1024, 4, 1, 256, 1024, 1024, 1024, 256]
    - [24, 18.6447]
  - - [256, 64, 1, 128, 256, 256, 256, 128]
    - [1, 26.7494]
  - - [6784, 1408, 1, 768, 6784, 6784, 6784, 768]
    - [14, 4295.19]
  - - [448, 3584, 1, 768, 448, 448, 448, 768]
    - [14, 3312.0]
  - - [1024, 704, 1, 1792, 1024, 1024, 1024, 1792]
    - [7, 2780.79]
  - - [704, 1408, 1, 1792, 704, 704, 704, 1792]
    - [6, 2825.6]
  - - [448, 1024, 1, 3328, 448, 448, 448, 3328]
    - [6, 3471.1]
  - - [1856, 448, 1, 256, 1856, 1856, 1856, 256]
    - [10, 2493.68]
  - - [1024, 128, 1, 128, 1024, 1024, 1024, 128]
    - [1, 186.912]
  - - [5888, 5888, 1, 256, 5888, 5888, 5888, 256]
    - [14, 4312.34]
  - - [128, 1024, 1, 256, 128, 128, 128, 256]
    - [6, 728.178]
  - - [256, 4, 1, 768, 256, 256, 256, 768]
    - [26, 15.3121]
  - - [64, 4288, 1, 128, 64, 64, 64, 128]
    - [1, 388.233]
  - - [64, 1024, 1, 1792, 64, 64, 64, 1792]
    - [16, 753.597]
  - - [3584, 4288, 1, 256, 3584, 3584, 3584, 256]
    - [14, 4163.76]
  - - [6784, 5888, 1, 768, 6784, 6784, 6784, 768]
    - [14, 4480.35]
  - - [5056, 64, 1, 768, 5056, 5056, 5056, 768]
    - [6, 2108.9]
  - - [1856, 3584, 1, 1792, 1856, 1856, 1856, 1792]
    - [14, 4219.49]
  - - [128, 6784, 1, 1792, 128, 128, 128, 1792]
    - [6, 3246.18]
  - - [6784, 5056, 1, 1792, 6784, 6784, 6784, 1792]
    - [14, 4540.43]
  - - [2944, 5056, 1, 256, 2944, 2944, 2944, 256]
    - [14, 4088.55]
  - - [3584, 64, 1, 128, 3584, 3584, 3584, 128]
    - [1, 319.967]
  - - [1856, 1024, 1, 3328, 1856, 1856, 1856, 3328]
    - [14, 4199.65]
  - - [2944, 704, 1, 256, 2944, 2944, 2944, 256]
    - [10, 2869.86]
  - - [128, 4288, 1, 3328, 128, 128, 128, 3328]
    - [8, 2569.23]
  - - [5056, 5888, 1, 128, 5056, 5056, 5056, 128]
    - [0, 2436.65]
  - - [256, 5888, 1, 768, 256, 256, 256, 768]
    - [14, 3172.63]
  - - [64, 448, 1, 1792, 64, 64, 64, 1792]
    - [13, 433.369]
  - - [128, 4, 1, 1792, 128, 128, 128, 1792]
    - [24, 14.8176]
  - - [4288, 4, 1, 1792, 4288, 4288, 4288, 1792]
    - [23, 239.083]
  - - [4288, 2368, 1, 1792, 4288, 4288, 4288, 1792]
    - [14, 4220.07]
  - - [1856, 2944, 1, 3328, 1856, 1856, 1856, 3328]
    - [14, 4165.0]
  - - [3584, 3584, 1, 128, 3584, 3584, 3584, 128]
    - [4, 2017.09]
  - - [1856, 1024, 1, 1792, 1856, 1856, 1856, 1792]
    - [14, 4106.91]
  - - [2368, 4, 1, 768, 2368, 2368, 2368, 768]
    - [24, 103.448]
  - - [2368, 3584, 1, 768, 2368, 2368, 2368, 768]
    - [14, 4209.47]
  - - [4288, 64, 1, 3328, 4288, 4288, 4288, 3328]
    - [8, 2297.52]
  - - [3584, 3584, 1, 768, 3584, 3584, 3584, 768]
    - [14, 4173.01]
  - - [4288, 704, 1, 3328, 4288, 4288, 4288, 3328]
    - [6, 3598.39]
  - - [256, 1408, 1, 3328, 256, 256, 256, 3328]
    - [8, 2802.21]
  - - [1408, 128, 1, 3328, 1408, 1408, 1408, 3328]
    - [9, 2058.01]
  - - [2944, 1856, 1, 256, 2944, 2944, 2944, 256]
    - [14, 3766.7]
  - - [1408, 256, 1, 768, 1408, 1408, 1408, 768]
    - [6, 2342.79]
  - - [2944, 4, 1, 128, 2944, 2944, 2944, 128]
    - [20, 26.8019]
  - - [704, 256, 1, 768, 704, 704, 704, 768]
    - [6, 1499.26]
  - - [704, 5888, 1, 256, 704, 704, 704, 256]
    - [10, 3399.41]
  - - [448, 2368, 1, 3328, 448, 448, 448, 3328]
    - [6, 3105.04]
  - - [1024, 256, 1, 1792, 1024, 1024, 1024, 1792]
    - [6, 1900.95]
  - - [256, 64, 1, 1792, 256, 256, 256, 1792]
    - [13, 267.105]
  - - [5888, 4, 1, 768, 5888, 5888, 5888, 768]
    - [23, 191.447]
  - - [5056, 3584, 1, 256, 5056, 5056, 5056, 256]
    - [14, 4178.89]
  - - [2368, 64, 1, 3328, 2368, 2368, 2368, 3328]
    - [9, 1808.54]
  - - [448, 2944, 1, 768, 448, 448, 448, 768]
    - [10, 3175.71]
  - - [128, 1024, 1, 1792, 128, 128, 128, 1792]
    - [6, 1299.12]
  - - [256, 4, 1, 256, 256, 256, 256, 256]
    - [24, 5.82025]
  - - [5056, 5056, 1, 256, 5056, 5056, 5056, 256]
    - [14, 4199.28]
  - - [1408, 4, 1, 768, 1408, 1408, 1408, 768]
    - [26, 60.1415]
  - - [4288, 3584, 1, 128, 4288, 4288, 4288, 128]
    - [0, 2240.67]
  - - [3584, 704, 1, 256, 3584, 3584, 3584, 256]
    - [14, 3319.92]
  - - [256, 4288, 1, 256, 256, 256, 256, 256]
    - [10, 2378.29]
  - - [5056, 1408, 1, 768, 5056, 5056, 5056, 768]
    - [14, 3958.12]
  - - [5888, 6784, 1, 3328, 5888, 5888, 5888, 3328]
    - [14, 4533.49]
  - - [4, 256, 1, 128, 4, 4, 4, 128]
    - [20, 2.25677]
  - - [4288, 1408, 1, 3328, 4288, 4288, 4288, 3328]
    - [14, 3917.77]
  - - [64, 2944, 1, 1792, 64, 64, 64, 1792]
    - [6, 1836.6]
  - - [5888, 2944, 1, 3328, 5888, 5888, 5888, 3328]
    - [14, 4457.63]
  - - [256, 1856, 1, 768, 256, 256, 256, 768]
    - [6, 3073.66]
  - - [4288, 448, 1, 256, 4288, 4288, 4288, 256]
    - [14, 3396.29]
  - - [4, 5056, 1, 3328, 4, 4, 4, 3328]
    - [26, 69.3016]
  - - [1024, 5888, 1, 1792, 1024, 1024, 1024, 1792]
    - [14, 3889.77]
  - - [4288, 64, 1, 256, 4288, 4288, 4288, 256]
    - [11, 1297.17]
  - - [256, 5888, 1, 1792, 256, 256, 256, 1792]
    - [14, 3291.5]
  - - [704, 5056, 1, 768, 704, 704, 704, 768]
    - [18, 3749.64]
  - - [5056, 4288, 1, 128, 5056, 5056, 5056, 128]
    - [0, 2339.69]
  - - [256, 3584, 1, 1792, 256, 256, 256, 1792]
    - [6, 3421.93]
  - - [1856, 5888, 1, 1792, 1856, 1856, 1856, 1792]
    - [14, 4168.41]
  - - [1856, 4, 1, 128, 1856, 1856, 1856, 128]
    - [20, 16.8251]
  - - [704, 2368, 1, 3328, 704, 704, 704, 3328]
    - [14, 3703.02]
  - - [2944, 1856, 1, 768, 2944, 2944, 2944, 768]
    - [14, 4051.52]
  - - [2368, 4288, 1, 1792, 2368, 2368, 2368, 1792]
    - [14, 4211.71]
  - - [2368, 3584, 1, 128, 2368, 2368, 2368, 128]
    - [4, 2058.06]
  - - [4, 2944, 1, 256, 4, 4, 4, 256]
    - [23, 47.943]
  - - [64, 128, 1, 256, 64, 64, 64, 256]
    - [11, 52.6394]
  - - [64, 64, 1, 3328, 64, 64, 64, 3328]
    - [5, 142.948]
  - - [2368, 5056, 1, 768, 2368, 2368, 2368, 768]
    - [14, 4154.15]
  - - [5056, 5888, 1, 1792, 5056, 5056, 5056, 1792]
    - [14, 4447.42]
  - - [2368, 256, 1, 768, 2368, 2368, 2368, 768]
    - [6, 2466.98]
  - - [1024, 448, 1, 768, 1024, 1024, 1024, 768]
    - [6, 2943.86]
  - - [1856, 2944, 1, 1792, 1856, 1856, 1856, 1792]
    - [14, 4130.78]
  - - [2368, 128, 1, 3328, 2368, 2368, 2368, 3328]
    - [8, 2488.48]
  - - [704, 5056, 1, 128, 704, 704, 704, 128]
    - [0, 1731.03]
  - - [256, 2944, 1, 128, 256, 256, 256, 128]
    - [1, 804.982]
  - - [3584, 2944, 1, 256, 3584, 3584, 3584, 256]
    - [14, 4066.5]
  - - [704, 128, 1, 256, 704, 704, 704, 256]
    - [11, 521.444]
  - - [2368, 448, 1, 128, 2368, 2368, 2368, 128]
    - [4, 912.571]
  - - [64, 3584, 1, 128, 64, 64, 64, 128]
    - [1, 327.973]
  - - [5888, 5888, 1, 1792, 5888, 5888, 5888, 1792]
    - [14, 4466.21]
  - - [2368, 64, 1, 128, 2368, 2368, 2368, 128]
    - [1, 217.474]
  - - [4288, 1408, 1, 128, 4288, 4288, 4288, 128]
    - [4, 1854.49]
  - - [5888, 4, 1, 128, 5888, 5888, 5888, 128]
    - [20, 53.1503]
  - - [128, 2944, 1, 3328, 128, 128, 128, 3328]
    - [6, 2861.67]
  - - [64, 1856, 1, 1792, 64, 64, 64, 1792]
    - [6, 1176.29]
  - - [128, 704, 1, 768, 128, 128, 128, 768]
    - [6, 777.246]
  - - [5888, 6784, 1, 768, 5888, 5888, 5888, 768]
    - [14, 4483.23]
  - - [4288, 4288, 1, 256, 4288, 4288, 4288, 256]
    - [14, 4207.54]
  - - [2944, 2944, 1, 3328, 2944, 2944, 2944, 3328]
    - [14, 4421.63]
  - - [704, 1024, 1, 768, 704, 704, 704, 768]
    - [6, 2912.71]
  - - [1408, 448, 1, 1792, 1408, 1408, 1408, 1792]
    - [6, 2789.1]
  - - [128, 3584, 1, 3328, 128, 128, 128, 3328]
    - [6, 3469.83]
  - - [1408, 2368, 1, 1792, 1408, 1408, 1408, 1792]
    - [18, 3711.42]
  - - [128, 2368, 1, 1792, 128, 128, 128, 1792]
    - [6, 2200.82]
  - - [2944, 2944, 1, 256, 2944, 2944, 2944, 256]
    - [14, 4071.47]
  - - [1856, 5056, 1, 1792, 1856, 1856, 1856, 1792]
    - [14, 4272.71]
  - - [64, 448, 1, 768, 64, 64, 64, 768]
    - [6, 246.862]
  - - [64, 5888, 1, 128, 64, 64, 64, 128]
    - [1, 523.833]
  - - [4, 64, 1, 1792, 4, 4, 4, 1792]
    - [24, 7.81253]
  - - [2944, 256, 1, 256, 2944, 2944, 2944, 256]
    - [10, 2222.79]
  - - [2368, 128, 1, 128, 2368, 2368, 2368, 128]
    - [1, 432.619]
  - - [256, 2368, 1, 3328, 256, 256, 256, 3328]
    - [6, 2770.63]
  - - [3584, 2944, 1, 3328, 3584, 3584, 3584, 3328]
    - [14, 4407.1]
  - - [4288, 1408, 1, 768, 4288, 4288, 4288, 768]
    - [14, 3801.9]
  - - [2368, 5056, 1, 256, 2368, 2368, 2368, 256]
    - [14, 3955.03]
  - - [1408, 4288, 1, 3328, 1408, 1408, 1408, 3328]
    - [6, 3800.56]
  - - [4288, 256, 1, 768, 4288, 4288, 4288, 768]
    - [6, 2899.89]
  - - [6784, 704, 1, 128, 6784, 6784, 6784, 128]
    - [4, 1808.64]
  - - [5888, 1024, 1, 1792, 5888, 5888, 5888, 1792]
    - [14, 3895.38]
  - - [1856, 2944, 1, 256, 1856, 1856, 1856, 256]
    - [14, 3749.73]
  - - [1856, 1024, 1, 768, 1856, 1856, 1856, 768]
    - [14, 3850.02]
  - - [1408, 1856, 1, 768, 1408, 1408, 1408, 768]
    - [14, 3806.86]
  - - [1408, 256, 1, 128, 1408, 1408, 1408, 128]
    - [1, 505.449]
  - - [4288, 1408, 1, 256, 4288, 4288, 4288, 256]
    - [14, 3583.09]
  - - [448, 64, 1, 256, 448, 448, 448, 256]
    - [11, 178.851]
  - - [448, 128, 1, 1792, 448, 448, 448, 1792]
    - [13, 784.191]
  - - [1408, 2944, 1, 256, 1408, 1408, 1408, 256]
    - [14, 3400.28]
  - - [2368, 128, 1, 768, 2368, 2368, 2368, 768]
    - [6, 1971.41]
  - - [6784, 1024, 1, 3328, 6784, 6784, 6784, 3328]
    - [14, 3965.04]
  - - [256, 4, 1, 128, 256, 256, 256, 128]
    - [20, 2.47121]
  - - [448, 5888, 1, 768, 448, 448, 448, 768]
    - [6, 3393.15]
  - - [64, 1856, 1, 3328, 64, 64, 64, 3328]
    - [9, 1602.79]
  - - [1408, 2944, 1, 128, 1408, 1408, 1408, 128]
    - [4, 1667.23]
  - - [1024, 5056, 1, 128, 1024, 1024, 1024, 128]
    - [4, 1646.22]
  - - [5056, 64, 1, 3328, 5056, 5056, 5056, 3328]
    - [8, 2677.23]
  - - [1856, 2944, 1, 128, 1856, 1856, 1856, 128]
    - [3, 1884.97]
  - - [256, 448, 1, 128, 256, 256, 256, 128]
    - [1, 169.125]
  - - [2944, 2368, 1, 256, 2944, 2944, 2944, 256]
    - [14, 3705.11]
  - - [256, 6784, 1, 768, 256, 256, 256, 768]
    - [14, 3600.94]
  - - [2944, 128, 1, 256, 2944, 2944, 2944, 256]
    - [6, 1677.14]
  - - [4, 1408, 1, 768, 4, 4, 4, 768]
    - [24, 64.9846]
  - - [64, 1408, 1, 1792, 64, 64, 64, 1792]
    - [16, 1013.31]
  - - [64, 2368, 1, 128, 64, 64, 64, 128]
    - [1, 218.848]
  - - [1856, 4288, 1, 128, 1856, 1856, 1856, 128]
    - [4, 1990.26]
  - - [256, 1856, 1, 1792, 256, 256, 256, 1792]
    - [6, 3422.2]
  - - [704, 5888, 1, 1792, 704, 704, 704, 1792]
    - [6, 3725.08]
  - - [256, 5056, 1, 1792, 256, 256, 256, 1792]
    - [6, 3267.57]
  - - [1856, 2368, 1, 768, 1856, 1856, 1856, 768]
    - [14, 3824.17]
  - - [1856, 6784, 1, 3328, 1856, 1856, 1856, 3328]
    - [14, 4148.08]
  - - [64, 448, 1, 3328, 64, 64, 64, 3328]
    - [13, 665.6]
  - - [1024, 6784, 1, 256, 1024, 1024, 1024, 256]
    - [14, 3676.17]
  - - [5056, 704, 1, 128, 5056, 5056, 5056, 128]
    - [0, 1751.25]
  - - [5888, 5888, 1, 128, 5888, 5888, 5888, 128]
    - [0, 2312.49]
  - - [5056, 448, 1, 256, 5056, 5056, 5056, 256]
    - [10, 3128.3]
  - - [1856, 6784, 1, 1792, 1856, 1856, 1856, 1792]
    - [14, 4134.28]
  - - [6784, 6784, 1, 768, 6784, 6784, 6784, 768]
    - [14, 4507.56]
  - - [256, 1408, 1, 128, 256, 256, 256, 128]
    - [1, 495.036]
  - - [4, 64, 1, 256, 4, 4, 4, 256]
    - [25, 1.64498]
  - - [448, 1408, 1, 1792, 448, 448, 448, 1792]
    - [6, 2790.75]
  - - [3584, 1024, 1, 1792, 3584, 3584, 3584, 1792]
    - [18, 4096.69]
  - - [1024, 64, 1, 1792, 1024, 1024, 1024, 1792]
    - [16, 759.445]
  - - [448, 256, 1, 1792, 448, 448, 448, 1792]
    - [9, 1168.26]
  - - [704, 1024, 1, 3328, 704, 704, 704, 3328]
    - [6, 3298.79]
  - - [6784, 448, 1, 128, 6784, 6784, 6784, 128]
    - [0, 1497.16]
  - - [1856, 1024, 1, 128, 1856, 1856, 1856, 128]
    - [2, 1474.0]
  - - [6784, 3584, 1, 3328, 6784, 6784, 6784, 3328]
    - [14, 4511.54]
  - - [1024, 1024, 1, 1792, 1024, 1024, 1024, 1792]
    - [6, 2968.67]
  - - [448, 448, 1, 128, 448, 448, 448, 128]
    - [1, 295.969]
  - - [2944, 1408, 1, 768, 2944, 2944, 2944, 768]
    - [14, 3635.77]
  - - [128, 2944, 1, 1792, 128, 128, 128, 1792]
    - [6, 2726.43]
  - - [704, 1408, 1, 3328, 704, 704, 704, 3328]
    - [6, 2913.74]
  - - [6784, 128, 1, 768, 6784, 6784, 6784, 768]
    - [10, 3065.9]
  - - [5056, 704, 1, 3328, 5056, 5056, 5056, 3328]
    - [18, 4020.09]
  - - [5056, 3584, 1, 1792, 5056, 5056, 5056, 1792]
    - [14, 4397.37]
  - - [256, 2944, 1, 3328, 256, 256, 256, 3328]
    - [6, 2915.15]
  - - [2368, 64, 1, 256, 2368, 2368, 2368, 256]
    - [11, 831.846]
  - - [128, 1024, 1, 3328, 128, 128, 128, 3328]
    - [9, 1522.22]
  - - [64, 704, 1, 768, 64, 64, 64, 768]
    - [6, 387.926]
  - - [1408, 1856, 1, 256, 1408, 1408, 1408, 256]
    - [14, 3371.93]
  - - [3584, 1408, 1, 3328, 3584, 3584, 3584, 3328]
    - [14, 3852.75]
  - - [5056, 5888, 1, 768, 5056, 5056, 5056, 768]
    - [14, 4404.62]
  - - [1408, 2368, 1, 128, 1408, 1408, 1408, 128]
    - [0, 1577.36]
  - - [1856, 128, 1, 1792, 1856, 1856, 1856, 1792]
    - [6, 2302.69]
  - - [128, 448, 1, 1792, 128, 128, 128, 1792]
    - [13, 771.012]
  - - [64, 5056, 1, 128, 64, 64, 64, 128]
    - [1, 444.026]
  - - [6784, 6784, 1, 128, 6784, 6784, 6784, 128]
    - [0, 2506.43]
  - - [448, 1856, 1, 128, 448, 448, 448, 128]
    - [1, 953.678]
  - - [2944, 1024, 1, 128, 2944, 2944, 2944, 128]
    - [0, 1500.76]
  - - [6784, 4288, 1, 3328, 6784, 6784, 6784, 3328]
    - [14, 4503.58]
  - - [704, 5888, 1, 768, 704, 704, 704, 768]
    - [14, 3605.13]
  - - [3584, 704, 1, 768, 3584, 3584, 3584, 768]
    - [14, 3689.58]
  - - [256, 5888, 1, 3328, 256, 256, 256, 3328]
    - [14, 3359.31]
  - - [704, 704, 1, 128, 704, 704, 704, 128]
    - [1, 653.201]
  - - [1408, 128, 1, 128, 1408, 1408, 1408, 128]
    - [1, 257.463]
  - - [5056, 1856, 1, 1792, 5056, 5056, 5056, 1792]
    - [14, 4280.89]
  - - [4, 704, 1, 3328, 4, 4, 4, 3328]
    - [24, 98.3595]
  - - [2368, 2368, 1, 3328, 2368, 2368, 2368, 3328]
    - [14, 4264.67]
  - - [1024, 5056, 1, 256, 1024, 1024, 1024, 256]
    - [14, 3619.73]
  - - [3584, 1408, 1, 768, 3584, 3584, 3584, 768]
    - [14, 3742.02]
  - - [704, 64, 1, 1792, 704, 704, 704, 1792]
    - [13, 645.303]
  - - [6784, 5056, 1, 3328, 6784, 6784, 6784, 3328]
    - [14, 4554.14]
  - - [1408, 6784, 1, 768, 1408, 1408, 1408, 768]
    - [14, 4286.55]
  - - [5056, 1024, 1, 3328, 5056, 5056, 5056, 3328]
    - [14, 3949.42]
  - - [1856, 256, 1, 768, 1856, 1856, 1856, 768]
    - [6, 3040.87]
  - - [448, 704, 1, 3328, 448, 448, 448, 3328]
    - [8, 2484.44]
  - - [128, 4288, 1, 1792, 128, 128, 128, 1792]
    - [6, 2436.49]
  - - [6784, 6784, 1, 3328, 6784, 6784, 6784, 3328]
    - [14, 4556.72]
  - - [448, 2944, 1, 128, 448, 448, 448, 128]
    - [4, 1104.27]
  - - [1024, 4, 1, 3328, 1024, 1024, 1024, 3328]
    - [24, 135.664]
  - - [128, 64, 1, 128, 128, 128, 128, 128]
    - [1, 13.2262]
  - - [1856, 256, 1, 128, 1856, 1856, 1856, 128]
    - [1, 638.302]
  - - [64, 2368, 1, 3328, 64, 64, 64, 3328]
    - [9, 1668.76]
  - - [1024, 256, 1, 256, 1024, 1024, 1024, 256]
    - [11, 1269.08]
  - - [4288, 704, 1, 768, 4288, 4288, 4288, 768]
    - [6, 3324.54]
  - - [64, 2944, 1, 128, 64, 64, 64, 128]
    - [1, 269.166]
  - - [1024, 128, 1, 3328, 1024, 1024, 1024, 3328]
    - [17, 1424.77]
  - - [5056, 2368, 1, 128, 5056, 5056, 5056, 128]
    - [4, 2156.26]
  - - [704, 6784, 1, 128, 704, 704, 704, 128]
    - [3, 1897.57]
  - - [2944, 3584, 1, 3328, 2944, 2944, 2944, 3328]
    - [14, 4408.12]
  - - [256, 4288, 1, 1792, 256, 256, 256, 1792]
    - [6, 3113.73]
  - - [256, 4288, 1, 3328, 256, 256, 256, 3328]
    - [6, 3208.42]
  - - [1024, 256, 1, 3328, 1024, 1024, 1024, 3328]
    - [6, 1980.24]
  - - [256, 6784, 1, 1792, 256, 256, 256, 1792]
    - [14, 3777.28]
  - - [256, 704, 1, 3328, 256, 256, 256, 3328]
    - [17, 1978.71]
  - - [3584, 4288, 1, 128, 3584, 3584, 3584, 128]
    - [0, 2061.81]
  - - [256, 448, 1, 3328, 256, 256, 256, 3328]
    - [15, 1569.93]
  - - [1408, 4, 1, 128, 1408, 1408, 1408, 128]
    - [20, 13.0033]
  - - [1024, 2368, 1, 768, 1024, 1024, 1024, 768]
    - [14, 3569.76]
  - - [1408, 1408, 1, 1792, 1408, 1408, 1408, 1792]
    - [6, 3289.18]
  - - [5056, 6784, 1, 128, 5056, 5056, 5056, 128]
    - [0, 2459.99]
  - - [64, 5056, 1, 768, 64, 64, 64, 768]
    - [6, 2080.65]
  - - [1024, 4, 1, 128, 1024, 1024, 1024, 128]
    - [20, 9.49806]
  - - [256, 1024, 1, 128, 256, 256, 256, 128]
    - [1, 377.525]
  - - [5888, 4, 1, 3328, 5888, 5888, 5888, 3328]
    - [22, 302.117]
  - - [128, 2368, 1, 768, 128, 128, 128, 768]
    - [6, 1966.08]
  - - [256, 1408, 1, 256, 256, 256, 256, 256]
    - [6, 1724.12]
  - - [4, 3584, 1, 256, 4, 4, 4, 256]
    - [23, 56.5662]
  - - [704, 64, 1, 768, 704, 704, 704, 768]
    - [6, 385.85]
  - - [1408, 256, 1, 3328, 1408, 1408, 1408, 3328]
    - [8, 2833.99]
  - - [5888, 5056, 1, 256, 5888, 5888, 5888, 256]
    - [14, 4291.71]
  - - [1856, 5056, 1, 128, 1856, 1856, 1856, 128]
    - [4, 2068.94]
  - - [5888, 1856, 1, 1792, 5888, 5888, 5888, 1792]
    - [14, 4183.09]
  - - [6784, 448, 1, 256, 6784, 6784, 6784, 256]
    - [10, 3156.62]
  - - [4288, 448, 1, 3328, 4288, 4288, 4288, 3328]
    - [14, 4256.21]
  - - [4288, 6784, 1, 3328, 4288, 4288, 4288, 3328]
    - [14, 4363.46]
  - - [448, 4, 1, 3328, 448, 448, 448, 3328]
    - [24, 66.5006]
  - - [1024, 2944, 1, 3328, 1024, 1024, 1024, 3328]
    - [6, 3583.54]
  - - [128, 5888, 1, 768, 128, 128, 128, 768]
    - [10, 2659.99]
  - - [1408, 5888, 1, 3328, 1408, 1408, 1408, 3328]
    - [14, 4152.69]
  - - [5888, 2944, 1, 768, 5888, 5888, 5888, 768]
    - [14, 4389.23]
  - - [3584, 128, 1, 256, 3584, 3584, 3584, 256]
    - [6, 1981.12]
  - - [6784, 64, 1, 768, 6784, 6784, 6784, 768]
    - [6, 2786.16]
  - - [704, 4, 1, 768, 704, 704, 704, 768]
    - [24, 36.6806]
  - - [6784, 4, 1, 128, 6784, 6784, 6784, 128]
    - [20, 61.2383]
  - - [128, 2944, 1, 256, 128, 128, 128, 256]
    - [6, 1775.94]
  - - [2944, 1024, 1, 768, 2944, 2944, 2944, 768]
    - [6, 3320.03]
  - - [704, 5888, 1, 3328, 704, 704, 704, 3328]
    - [6, 3808.1]
  - - [1856, 128, 1, 256, 1856, 1856, 1856, 256]
    - [6, 1224.18]
  - - [5888, 5888, 1, 768, 5888, 5888, 5888, 768]
    - [14, 4433.08]
  - - [704, 2368, 1, 256, 704, 704, 704, 256]
    - [14, 2913.51]
  - - [3584, 256, 1, 1792, 3584, 3584, 3584, 1792]
    - [6, 3431.07]
  - - [4, 64, 1, 128, 4, 4, 4, 128]
    - [21, 0.472983]
  - - [2368, 2944, 1, 1792, 2368, 2368, 2368, 1792]
    - [14, 3948.3]
  - - [2368, 704, 1, 128, 2368, 2368, 2368, 128]
    - [4, 1356.72]
  - - [2368, 6784, 1, 1792, 2368, 2368, 2368, 1792]
    - [14, 4348.69]
  - - [128, 1408, 1, 3328, 128, 128, 128, 3328]
    - [9, 2017.03]
  - - [704, 3584, 1, 128, 704, 704, 704, 128]
    - [3, 1504.1]
  - - [64, 448, 1, 256, 64, 64, 64, 256]
    - [11, 177.467]
  - - [1408, 5888, 1, 128, 1408, 1408, 1408, 128]
    - [4, 1931.63]
  - - [1856, 3584, 1, 128, 1856, 1856, 1856, 128]
    - [3, 1990.85]
  - - [4, 1856, 1, 3328, 4, 4, 4, 3328]
    - [24, 211.1]
  - - [704, 2368, 1, 128, 704, 704, 704, 128]
    - [2, 1329.01]
  - - [5888, 1408, 1, 1792, 5888, 5888, 5888, 1792]
    - [14, 4213.24]
  - - [704, 64, 1, 128, 704, 704, 704, 128]
    - [1, 66.3198]
  - - [2368, 256, 1, 128, 2368, 2368, 2368, 128]
    - [1, 724.912]
  - - [2368, 1856, 1, 3328, 2368, 2368, 2368, 3328]
    - [14, 3940.44]
  - - [5056, 128, 1, 128, 5056, 5056, 5056, 128]
    - [1, 767.014]
  - - [4, 2368, 1, 1792, 4, 4, 4, 1792]
    - [26, 179.961]
  - - [704, 4288, 1, 256, 704, 704, 704, 256]
    - [10, 3107.11]
  - - [1856, 4, 1, 3328, 1856, 1856, 1856, 3328]
    - [24, 211.533]
  - - [704, 1024, 1, 256, 704, 704, 704, 256]
    - [6, 2182.47]
  - - [1024, 448, 1, 3328, 1024, 1024, 1024, 3328]
    - [6, 3459.77]
- null
