HostLibraryTests/configs/lite_configs_mixed/vega10_Cijk_Ailk_Bjlk_SB.yaml
- {MinimumRequiredVersion: 4.9.5}
- vega10
- gfx900
- [Device 6863, Device 6862, Device 687f, Device 6860, Device 6861, 'Vega 10 XTX [Radeon
    SolutionIndex: 0
    SolutionNameMin: Cijk_Ailk_Bjlk_SB_MT32x32x8_SE_AMAS2_GRVW4_GSU1_VW4
    SolutionIndex: 1
    SolutionNameMin: Cijk_Ailk_Bjlk_SB_MT64x64x16_SE_AMAS2_GRVW4_GSU1_VW4
    SolutionIndex: 2
    SolutionNameMin: Cijk_Ailk_Bjlk_SB_MT64x128x8_SE_AMAS0_GRVW1_GSU1_VW1
    SolutionIndex: 3
    SolutionNameMin: Cijk_Ailk_Bjlk_SB_MT64x32x16_SE_AMAS1_GRVW1_GSU1_VW1
    SolutionIndex: 4
    SolutionNameMin: Cijk_Ailk_Bjlk_SB_MT16x16x4_SE_AMAS2_GRVW2_GSU1_VW2
    SolutionIndex: 5
    SolutionNameMin: Cijk_Ailk_Bjlk_SB_MT16x16x4_SE_AMAS0_GRVW1_GSU1_VW1
    SolutionIndex: 6
    SolutionNameMin: Cijk_Ailk_Bjlk_SB_MT8x8x8_SE_AMAS3_GRVW2_GSU2_VW2
- - - [128, 5056, 1, 1792, 128, 128, 128, 5056]
    - [3, 0.0]
  - - [4288, 1408, 1, 3328, 4288, 4288, 4288, 1408]
    - [3, 0.0]
  - - [1408, 704, 1, 128, 1408, 1408, 1408, 704]
    - [0, 2168.13]
  - - [1856, 256, 1, 768, 1856, 1856, 1856, 256]
    - [3, 0.0]
  - - [128, 64, 1, 256, 128, 128, 128, 64]
    - [3, 0.0]
  - - [5056, 704, 1, 3328, 5056, 5056, 5056, 704]
    - [3, 0.0]
  - - [3584, 1856, 1, 3328, 3584, 3584, 3584, 1856]
    - [3, 0.0]
  - - [448, 1408, 1, 256, 448, 448, 448, 1408]
    - [3, 0.0]
  - - [5056, 448, 1, 1792, 5056, 5056, 5056, 448]
    - [3, 0.0]
  - - [2944, 1024, 1, 256, 2944, 2944, 2944, 1024]
    - [3, 0.0]
  - - [6784, 128, 1, 768, 6784, 6784, 6784, 128]
    - [3, 0.0]
  - - [2944, 1024, 1, 1792, 2944, 2944, 2944, 1024]
    - [3, 0.0]
  - - [5056, 256, 1, 768, 5056, 5056, 5056, 256]
    - [3, 0.0]
  - - [1024, 4288, 1, 1792, 1024, 1024, 1024, 4288]
    - [3, 0.0]
  - - [1408, 448, 1, 3328, 1408, 1408, 1408, 448]
    - [3, 0.0]
  - - [4, 448, 1, 128, 4, 4, 4, 448]
    - [5, 9.95664]
  - - [448, 6784, 1, 768, 448, 448, 448, 6784]
    - [3, 0.0]
  - - [64, 1856, 1, 256, 64, 64, 64, 1856]
    - [3, 0.0]
  - - [1408, 128, 1, 1792, 1408, 1408, 1408, 128]
    - [3, 0.0]
  - - [1408, 4288, 1, 3328, 1408, 1408, 1408, 4288]
    - [3, 0.0]
  - - [64, 1408, 1, 3328, 64, 64, 64, 1408]
    - [3, 0.0]
  - - [4, 6784, 1, 768, 4, 4, 4, 6784]
    - [6, 0.0]
  - - [256, 5888, 1, 1792, 256, 256, 256, 5888]
    - [3, 0.0]
  - - [256, 448, 1, 1792, 256, 256, 256, 448]
    - [3, 0.0]
  - - [704, 1408, 1, 768, 704, 704, 704, 1408]
    - [3, 0.0]
  - - [6784, 4288, 1, 3328, 6784, 6784, 6784, 4288]
    - [3, 0.0]
  - - [2368, 6784, 1, 128, 2368, 2368, 2368, 6784]
    - [0, 3791.17]
  - - [1024, 5888, 1, 128, 1024, 1024, 1024, 5888]
    - [2, 3200.76]
  - - [256, 6784, 1, 256, 256, 256, 256, 6784]
    - [3, 0.0]
  - - [5056, 448, 1, 768, 5056, 5056, 5056, 448]
    - [3, 0.0]
  - - [128, 6784, 1, 1792, 128, 128, 128, 6784]
    - [3, 0.0]
  - - [448, 1856, 1, 3328, 448, 448, 448, 1856]
    - [3, 0.0]
  - - [4, 1408, 1, 256, 4, 4, 4, 1408]
    - [6, 0.0]
  - - [128, 1856, 1, 256, 128, 128, 128, 1856]
    - [3, 0.0]
  - - [5888, 4288, 1, 256, 5888, 5888, 5888, 4288]
    - [3, 0.0]
  - - [5888, 1856, 1, 256, 5888, 5888, 5888, 1856]
    - [3, 0.0]
  - - [64, 64, 1, 768, 64, 64, 64, 64]
    - [3, 0.0]
  - - [2944, 448, 1, 256, 2944, 2944, 2944, 448]
    - [3, 0.0]
  - - [4, 4, 1, 1792, 4, 4, 4, 4]
    - [6, 0.0]
  - - [1408, 6784, 1, 768, 1408, 1408, 1408, 6784]
    - [3, 0.0]
  - - [64, 6784, 1, 256, 64, 64, 64, 6784]
    - [3, 0.0]
  - - [3584, 128, 1, 3328, 3584, 3584, 3584, 128]
    - [3, 0.0]
  - - [1408, 64, 1, 128, 1408, 1408, 1408, 64]
    - [0, 394.202]
  - - [4, 3584, 1, 3328, 4, 4, 4, 3584]
    - [6, 0.0]
  - - [2944, 1024, 1, 3328, 2944, 2944, 2944, 1024]
    - [3, 0.0]
  - - [4288, 1856, 1, 3328, 4288, 4288, 4288, 1856]
    - [3, 0.0]
  - - [448, 128, 1, 1792, 448, 448, 448, 128]
    - [3, 0.0]
  - - [1856, 64, 1, 768, 1856, 1856, 1856, 64]
    - [3, 0.0]
  - - [1024, 1856, 1, 1792, 1024, 1024, 1024, 1856]
    - [3, 0.0]
  - - [5056, 4, 1, 1792, 5056, 5056, 5056, 4]
    - [6, 0.0]
  - - [256, 4288, 1, 128, 256, 256, 256, 4288]
    - [1, 1801.37]
  - - [6784, 6784, 1, 1792, 6784, 6784, 6784, 6784]
    - [3, 0.0]
  - - [4, 1024, 1, 768, 4, 4, 4, 1024]
    - [6, 0.0]
  - - [1024, 1856, 1, 768, 1024, 1024, 1024, 1856]
    - [3, 0.0]
  - - [4, 5888, 1, 3328, 4, 4, 4, 5888]
    - [6, 0.0]
  - - [704, 64, 1, 768, 704, 704, 704, 64]
    - [3, 0.0]
  - - [1856, 3584, 1, 768, 1856, 1856, 1856, 3584]
    - [3, 0.0]
  - - [448, 1024, 1, 1792, 448, 448, 448, 1024]
    - [3, 0.0]
  - - [3584, 448, 1, 3328, 3584, 3584, 3584, 448]
    - [3, 0.0]
  - - [1856, 1408, 1, 128, 1856, 1856, 1856, 1408]
    - [0, 3053.15]
  - - [4288, 128, 1, 256, 4288, 4288, 4288, 128]
    - [3, 0.0]
  - - [4288, 1408, 1, 256, 4288, 4288, 4288, 1408]
    - [3, 0.0]
  - - [1408, 5888, 1, 128, 1408, 1408, 1408, 5888]
    - [0, 3510.26]
  - - [448, 4, 1, 128, 448, 448, 448, 4]
    - [5, 10.0537]
  - - [2368, 2368, 1, 1792, 2368, 2368, 2368, 2368]
    - [3, 0.0]
  - - [64, 5056, 1, 1792, 64, 64, 64, 5056]
    - [3, 0.0]
  - - [3584, 1856, 1, 768, 3584, 3584, 3584, 1856]
    - [3, 0.0]
  - - [256, 1408, 1, 1792, 256, 256, 256, 1408]
    - [3, 0.0]
  - - [64, 3584, 1, 1792, 64, 64, 64, 3584]
    - [3, 0.0]
  - - [1856, 2368, 1, 128, 1856, 1856, 1856, 2368]
    - [0, 3352.95]
  - - [2944, 448, 1, 128, 2944, 2944, 2944, 448]
    - [0, 2327.92]
  - - [6784, 4, 1, 256, 6784, 6784, 6784, 4]
    - [6, 0.0]
  - - [4, 2944, 1, 256, 4, 4, 4, 2944]
    - [6, 0.0]
  - - [2944, 256, 1, 256, 2944, 2944, 2944, 256]
    - [3, 0.0]
  - - [4, 1856, 1, 128, 4, 4, 4, 1856]
    - [5, 39.4721]
  - - [704, 4, 1, 128, 704, 704, 704, 4]
    - [5, 15.4968]
  - - [64, 128, 1, 1792, 64, 64, 64, 128]
    - [3, 0.0]
  - - [1856, 6784, 1, 3328, 1856, 1856, 1856, 6784]
    - [3, 0.0]
  - - [704, 4, 1, 256, 704, 704, 704, 4]
    - [6, 0.0]
  - - [4288, 4288, 1, 256, 4288, 4288, 4288, 4288]
    - [3, 0.0]
  - - [256, 2944, 1, 3328, 256, 256, 256, 2944]
    - [3, 0.0]
  - - [3584, 2944, 1, 256, 3584, 3584, 3584, 2944]
    - [3, 0.0]
  - - [2368, 128, 1, 768, 2368, 2368, 2368, 128]
    - [3, 0.0]
  - - [1024, 64, 1, 3328, 1024, 1024, 1024, 64]
    - [3, 0.0]
  - - [5888, 128, 1, 1792, 5888, 5888, 5888, 128]
    - [3, 0.0]
  - - [704, 704, 1, 768, 704, 704, 704, 704]
    - [3, 0.0]
  - - [3584, 1856, 1, 256, 3584, 3584, 3584, 1856]
    - [3, 0.0]
  - - [3584, 3584, 1, 1792, 3584, 3584, 3584, 3584]
    - [3, 0.0]
  - - [128, 448, 1, 256, 128, 128, 128, 448]
    - [3, 0.0]
  - - [1856, 128, 1, 768, 1856, 1856, 1856, 128]
    - [3, 0.0]
  - - [448, 4288, 1, 1792, 448, 448, 448, 4288]
    - [3, 0.0]
  - - [4288, 2368, 1, 3328, 4288, 4288, 4288, 2368]
    - [3, 0.0]
  - - [6784, 5056, 1, 256, 6784, 6784, 6784, 5056]
    - [3, 0.0]
  - - [704, 6784, 1, 128, 704, 704, 704, 6784]
    - [0, 3287.92]
  - - [5056, 4, 1, 128, 5056, 5056, 5056, 4]
    - [5, 102.784]
  - - [4, 2944, 1, 3328, 4, 4, 4, 2944]
    - [6, 0.0]
  - - [448, 704, 1, 768, 448, 448, 448, 704]
    - [3, 0.0]
  - - [4, 704, 1, 256, 4, 4, 4, 704]
    - [6, 0.0]
  - - [128, 704, 1, 768, 128, 128, 128, 704]
    - [3, 0.0]
  - - [1856, 2944, 1, 256, 1856, 1856, 1856, 2944]
    - [3, 0.0]
  - - [704, 2368, 1, 1792, 704, 704, 704, 2368]
    - [3, 0.0]
  - - [128, 704, 1, 3328, 128, 128, 128, 704]
    - [3, 0.0]
  - - [4, 2368, 1, 3328, 4, 4, 4, 2368]
    - [6, 0.0]
  - - [5888, 1408, 1, 1792, 5888, 5888, 5888, 1408]
    - [3, 0.0]
  - - [448, 64, 1, 128, 448, 448, 448, 64]
    - [0, 123.859]
  - - [4, 256, 1, 128, 4, 4, 4, 256]
    - [5, 5.65319]
  - - [256, 1408, 1, 256, 256, 256, 256, 1408]
    - [3, 0.0]
  - - [5888, 1024, 1, 768, 5888, 5888, 5888, 1024]
    - [3, 0.0]
  - - [704, 4288, 1, 1792, 704, 704, 704, 4288]
    - [3, 0.0]
  - - [6784, 2944, 1, 3328, 6784, 6784, 6784, 2944]
    - [3, 0.0]
  - - [5056, 2368, 1, 256, 5056, 5056, 5056, 2368]
    - [3, 0.0]
  - - [1856, 128, 1, 128, 1856, 1856, 1856, 128]
    - [0, 894.36]
  - - [128, 6784, 1, 3328, 128, 128, 128, 6784]
    - [3, 0.0]
  - - [64, 448, 1, 1792, 64, 64, 64, 448]
    - [3, 0.0]
  - - [2944, 2368, 1, 768, 2944, 2944, 2944, 2368]
    - [3, 0.0]
  - - [5888, 3584, 1, 3328, 5888, 5888, 5888, 3584]
    - [3, 0.0]
  - - [4288, 6784, 1, 128, 4288, 4288, 4288, 6784]
    - [0, 3874.68]
  - - [1856, 4288, 1, 128, 1856, 1856, 1856, 4288]
    - [0, 3585.94]
  - - [4288, 2368, 1, 768, 4288, 4288, 4288, 2368]
    - [3, 0.0]
  - - [448, 1408, 1, 768, 448, 448, 448, 1408]
    - [3, 0.0]
  - - [448, 2944, 1, 768, 448, 448, 448, 2944]
    - [3, 0.0]
  - - [2368, 4, 1, 128, 2368, 2368, 2368, 4]
    - [5, 50.0533]
  - - [4288, 448, 1, 1792, 4288, 4288, 4288, 448]
    - [3, 0.0]
  - - [256, 1408, 1, 3328, 256, 256, 256, 1408]
    - [3, 0.0]
  - - [704, 6784, 1, 768, 704, 704, 704, 6784]
    - [3, 0.0]
  - - [1024, 448, 1, 128, 1024, 1024, 1024, 448]
    - [0, 1190.25]
  - - [1856, 64, 1, 128, 1856, 1856, 1856, 64]
    - [0, 508.056]
  - - [3584, 1024, 1, 256, 3584, 3584, 3584, 1024]
    - [3, 0.0]
  - - [2368, 1856, 1, 3328, 2368, 2368, 2368, 1856]
    - [3, 0.0]
  - - [64, 64, 1, 3328, 64, 64, 64, 64]
    - [3, 0.0]
  - - [5888, 1856, 1, 128, 5888, 5888, 5888, 1856]
    - [2, 3449.66]
  - - [1408, 2944, 1, 3328, 1408, 1408, 1408, 2944]
    - [3, 0.0]
  - - [5888, 3584, 1, 1792, 5888, 5888, 5888, 3584]
    - [3, 0.0]
  - - [704, 2944, 1, 1792, 704, 704, 704, 2944]
    - [3, 0.0]
  - - [5888, 704, 1, 768, 5888, 5888, 5888, 704]
    - [3, 0.0]
  - - [1024, 256, 1, 1792, 1024, 1024, 1024, 256]
    - [3, 0.0]
  - - [128, 1024, 1, 256, 128, 128, 128, 1024]
    - [3, 0.0]
  - - [2944, 5056, 1, 256, 2944, 2944, 2944, 5056]
    - [3, 0.0]
  - - [448, 448, 1, 256, 448, 448, 448, 448]
    - [3, 0.0]
  - - [448, 6784, 1, 128, 448, 448, 448, 6784]
    - [0, 3069.37]
  - - [5056, 4288, 1, 768, 5056, 5056, 5056, 4288]
    - [3, 0.0]
  - - [5056, 4, 1, 768, 5056, 5056, 5056, 4]
    - [6, 0.0]
  - - [4288, 5888, 1, 256, 4288, 4288, 4288, 5888]
    - [3, 0.0]
  - - [3584, 128, 1, 256, 3584, 3584, 3584, 128]
    - [3, 0.0]
  - - [1408, 64, 1, 256, 1408, 1408, 1408, 64]
    - [3, 0.0]
  - - [1408, 1856, 1, 768, 1408, 1408, 1408, 1856]
    - [3, 0.0]
  - - [128, 4, 1, 128, 128, 128, 128, 4]
    - [5, 3.02987]
  - - [6784, 5056, 1, 3328, 6784, 6784, 6784, 5056]
    - [3, 0.0]
  - - [2944, 1856, 1, 3328, 2944, 2944, 2944, 1856]
    - [3, 0.0]
  - - [704, 128, 1, 3328, 704, 704, 704, 128]
    - [3, 0.0]
  - - [448, 6784, 1, 1792, 448, 448, 448, 6784]
    - [3, 0.0]
  - - [2944, 128, 1, 1792, 2944, 2944, 2944, 128]
    - [3, 0.0]
  - - [704, 4, 1, 3328, 704, 704, 704, 4]
    - [6, 0.0]
  - - [1024, 1408, 1, 768, 1024, 1024, 1024, 1408]
    - [3, 0.0]
  - - [1856, 1856, 1, 1792, 1856, 1856, 1856, 1856]
    - [3, 0.0]
  - - [2368, 5056, 1, 768, 2368, 2368, 2368, 5056]
    - [3, 0.0]
  - - [128, 2368, 1, 256, 128, 128, 128, 2368]
    - [3, 0.0]
  - - [5888, 5888, 1, 768, 5888, 5888, 5888, 5888]
    - [3, 0.0]
  - - [256, 1856, 1, 256, 256, 256, 256, 1856]
    - [3, 0.0]
  - - [128, 1856, 1, 128, 128, 128, 128, 1856]
    - [0, 918.373]
  - - [1856, 4288, 1, 1792, 1856, 1856, 1856, 4288]
    - [3, 0.0]
  - - [5056, 256, 1, 1792, 5056, 5056, 5056, 256]
    - [3, 0.0]
  - - [128, 128, 1, 1792, 128, 128, 128, 128]
    - [3, 0.0]
  - - [256, 4, 1, 3328, 256, 256, 256, 4]
    - [6, 0.0]
  - - [2368, 4288, 1, 3328, 2368, 2368, 2368, 4288]
    - [3, 0.0]
  - - [4, 128, 1, 1792, 4, 4, 4, 128]
    - [6, 0.0]
  - - [1408, 704, 1, 768, 1408, 1408, 1408, 704]
    - [3, 0.0]
  - - [256, 2368, 1, 768, 256, 256, 256, 2368]
    - [3, 0.0]
  - - [4, 1408, 1, 3328, 4, 4, 4, 1408]
    - [6, 0.0]
  - - [5888, 704, 1, 1792, 5888, 5888, 5888, 704]
    - [3, 0.0]
  - - [6784, 2944, 1, 128, 6784, 6784, 6784, 2944]
    - [0, 3689.85]
  - - [448, 256, 1, 128, 448, 448, 448, 256]
    - [0, 490.537]
  - - [704, 1024, 1, 3328, 704, 704, 704, 1024]
    - [3, 0.0]
  - - [5888, 1856, 1, 768, 5888, 5888, 5888, 1856]
    - [3, 0.0]
  - - [6784, 1024, 1, 768, 6784, 6784, 6784, 1024]
    - [3, 0.0]
  - - [64, 4288, 1, 128, 64, 64, 64, 4288]
    - [0, 839.312]
  - - [1408, 2368, 1, 128, 1408, 1408, 1408, 2368]
    - [0, 3126.04]
  - - [704, 2944, 1, 3328, 704, 704, 704, 2944]
    - [3, 0.0]
  - - [4, 1408, 1, 128, 4, 4, 4, 1408]
    - [5, 30.1302]
  - - [2368, 64, 1, 1792, 2368, 2368, 2368, 64]
    - [3, 0.0]
  - - [128, 5056, 1, 768, 128, 128, 128, 5056]
    - [3, 0.0]
  - - [448, 1856, 1, 768, 448, 448, 448, 1856]
    - [3, 0.0]
  - - [4, 1856, 1, 256, 4, 4, 4, 1856]
    - [6, 0.0]
  - - [2944, 6784, 1, 1792, 2944, 2944, 2944, 6784]
    - [3, 0.0]
  - - [2368, 5888, 1, 128, 2368, 2368, 2368, 5888]
    - [0, 3727.79]
  - - [64, 256, 1, 3328, 64, 64, 64, 256]
    - [3, 0.0]
  - - [2368, 1856, 1, 128, 2368, 2368, 2368, 1856]
    - [0, 3336.74]
  - - [2944, 4, 1, 128, 2944, 2944, 2944, 4]
    - [5, 62.8053]
  - - [1856, 4, 1, 256, 1856, 1856, 1856, 4]
    - [6, 0.0]
  - - [256, 448, 1, 128, 256, 256, 256, 448]
    - [0, 483.358]
  - - [3584, 256, 1, 128, 3584, 3584, 3584, 256]
    - [2, 1828.62]
  - - [1856, 448, 1, 128, 1856, 1856, 1856, 448]
    - [0, 1962.81]
  - - [1408, 3584, 1, 1792, 1408, 1408, 1408, 3584]
    - [3, 0.0]
  - - [1024, 2944, 1, 1792, 1024, 1024, 1024, 2944]
    - [3, 0.0]
  - - [4, 5056, 1, 128, 4, 4, 4, 5056]
    - [4, 102.481]
  - - [5056, 704, 1, 1792, 5056, 5056, 5056, 704]
    - [3, 0.0]
  - - [5888, 256, 1, 768, 5888, 5888, 5888, 256]
    - [3, 0.0]
  - - [3584, 2944, 1, 1792, 3584, 3584, 3584, 2944]
    - [3, 0.0]
  - - [2944, 3584, 1, 3328, 2944, 2944, 2944, 3584]
    - [3, 0.0]
  - - [256, 704, 1, 3328, 256, 256, 256, 704]
    - [3, 0.0]
  - - [4288, 5056, 1, 1792, 4288, 4288, 4288, 5056]
    - [3, 0.0]
  - - [1856, 5888, 1, 1792, 1856, 1856, 1856, 5888]
    - [3, 0.0]
  - - [2368, 2944, 1, 3328, 2368, 2368, 2368, 2944]
    - [3, 0.0]
  - - [256, 3584, 1, 128, 256, 256, 256, 3584]
    - [2, 1822.31]
  - - [64, 5056, 1, 3328, 64, 64, 64, 5056]
    - [3, 0.0]
  - - [1408, 1856, 1, 256, 1408, 1408, 1408, 1856]
    - [3, 0.0]
  - - [2944, 4288, 1, 768, 2944, 2944, 2944, 4288]
    - [3, 0.0]
  - - [2368, 6784, 1, 1792, 2368, 2368, 2368, 6784]
    - [3, 0.0]
  - - [4, 1024, 1, 1792, 4, 4, 4, 1024]
    - [6, 0.0]
  - - [4288, 3584, 1, 1792, 4288, 4288, 4288, 3584]
    - [3, 0.0]
  - - [2944, 1408, 1, 768, 2944, 2944, 2944, 1408]
    - [3, 0.0]
  - - [3584, 4, 1, 128, 3584, 3584, 3584, 4]
    - [4, 75.7548]
  - - [2944, 5056, 1, 128, 2944, 2944, 2944, 5056]
    - [0, 3717.92]
  - - [128, 1024, 1, 768, 128, 128, 128, 1024]
    - [3, 0.0]
  - - [5888, 3584, 1, 768, 5888, 5888, 5888, 3584]
    - [3, 0.0]
  - - [1408, 128, 1, 768, 1408, 1408, 1408, 128]
    - [3, 0.0]
  - - [4288, 1408, 1, 128, 4288, 4288, 4288, 1408]
    - [0, 3470.59]
  - - [1408, 1856, 1, 128, 1408, 1408, 1408, 1856]
    - [0, 2951.39]
  - - [1856, 448, 1, 3328, 1856, 1856, 1856, 448]
    - [3, 0.0]
  - - [5056, 1856, 1, 768, 5056, 5056, 5056, 1856]
    - [3, 0.0]
  - - [3584, 1408, 1, 128, 3584, 3584, 3584, 1408]
    - [2, 3197.57]
  - - [1024, 6784, 1, 256, 1024, 1024, 1024, 6784]
    - [3, 0.0]
  - - [1024, 64, 1, 768, 1024, 1024, 1024, 64]
    - [3, 0.0]
  - - [5888, 4, 1, 768, 5888, 5888, 5888, 4]
    - [6, 0.0]
  - - [128, 1408, 1, 768, 128, 128, 128, 1408]
    - [3, 0.0]
  - - [64, 6784, 1, 3328, 64, 64, 64, 6784]
    - [3, 0.0]
  - - [1408, 4, 1, 128, 1408, 1408, 1408, 4]
    - [5, 29.8526]
  - - [6784, 4288, 1, 256, 6784, 6784, 6784, 4288]
    - [3, 0.0]
  - - [128, 5888, 1, 3328, 128, 128, 128, 5888]
    - [3, 0.0]
  - - [128, 5888, 1, 256, 128, 128, 128, 5888]
    - [3, 0.0]
  - - [3584, 4, 1, 256, 3584, 3584, 3584, 4]
    - [6, 0.0]
  - - [2368, 64, 1, 768, 2368, 2368, 2368, 64]
    - [3, 0.0]
  - - [5888, 1408, 1, 128, 5888, 5888, 5888, 1408]
    - [2, 3470.3]
  - - [256, 2944, 1, 1792, 256, 256, 256, 2944]
    - [3, 0.0]
  - - [2944, 5888, 1, 768, 2944, 2944, 2944, 5888]
    - [3, 0.0]
  - - [704, 448, 1, 256, 704, 704, 704, 448]
    - [3, 0.0]
  - - [4288, 4, 1, 128, 4288, 4288, 4288, 4]
    - [5, 90.0866]
  - - [128, 256, 1, 128, 128, 128, 128, 256]
    - [0, 144.813]
  - - [2944, 2944, 1, 256, 2944, 2944, 2944, 2944]
    - [3, 0.0]
  - - [64, 4288, 1, 1792, 64, 64, 64, 4288]
    - [3, 0.0]
  - - [4288, 4, 1, 256, 4288, 4288, 4288, 4]
    - [6, 0.0]
  - - [256, 2368, 1, 256, 256, 256, 256, 2368]
    - [3, 0.0]
  - - [1024, 64, 1, 128, 1024, 1024, 1024, 64]
    - [0, 274.196]
  - - [1856, 5888, 1, 256, 1856, 1856, 1856, 5888]
    - [3, 0.0]
  - - [448, 256, 1, 256, 448, 448, 448, 256]
    - [3, 0.0]
  - - [256, 4, 1, 768, 256, 256, 256, 4]
    - [6, 0.0]
  - - [3584, 64, 1, 768, 3584, 3584, 3584, 64]
    - [3, 0.0]
  - - [5056, 2368, 1, 768, 5056, 5056, 5056, 2368]
    - [3, 0.0]
  - - [5888, 5056, 1, 1792, 5888, 5888, 5888, 5056]
    - [3, 0.0]
  - - [1408, 3584, 1, 256, 1408, 1408, 1408, 3584]
    - [3, 0.0]
  - - [1856, 704, 1, 3328, 1856, 1856, 1856, 704]
    - [3, 0.0]
  - - [128, 1856, 1, 3328, 128, 128, 128, 1856]
    - [3, 0.0]
  - - [2944, 1024, 1, 128, 2944, 2944, 2944, 1024]
    - [2, 2852.8]
  - - [4, 1024, 1, 256, 4, 4, 4, 1024]
    - [6, 0.0]
  - - [5056, 6784, 1, 1792, 5056, 5056, 5056, 6784]
    - [3, 0.0]
  - - [1856, 5056, 1, 256, 1856, 1856, 1856, 5056]
    - [3, 0.0]
  - - [128, 2944, 1, 3328, 128, 128, 128, 2944]
    - [3, 0.0]
  - - [448, 448, 1, 3328, 448, 448, 448, 448]
    - [3, 0.0]
  - - [64, 4288, 1, 768, 64, 64, 64, 4288]
    - [3, 0.0]
  - - [1024, 448, 1, 1792, 1024, 1024, 1024, 448]
    - [3, 0.0]
  - - [256, 2944, 1, 768, 256, 256, 256, 2944]
    - [3, 0.0]
  - - [1024, 2368, 1, 1792, 1024, 1024, 1024, 2368]
    - [3, 0.0]
  - - [64, 1024, 1, 3328, 64, 64, 64, 1024]
    - [3, 0.0]
  - - [3584, 2368, 1, 256, 3584, 3584, 3584, 2368]
    - [3, 0.0]
  - - [5056, 448, 1, 256, 5056, 5056, 5056, 448]
    - [3, 0.0]
  - - [4, 2368, 1, 1792, 4, 4, 4, 2368]
    - [6, 0.0]
  - - [448, 4, 1, 256, 448, 448, 448, 4]
    - [6, 0.0]
  - - [704, 3584, 1, 768, 704, 704, 704, 3584]
    - [3, 0.0]
  - - [64, 5888, 1, 1792, 64, 64, 64, 5888]
    - [3, 0.0]
  - - [2368, 1408, 1, 256, 2368, 2368, 2368, 1408]
    - [3, 0.0]
  - - [448, 1856, 1, 128, 448, 448, 448, 1856]
    - [0, 1946.87]
  - - [3584, 256, 1, 1792, 3584, 3584, 3584, 256]
    - [3, 0.0]
  - - [704, 1856, 1, 128, 704, 704, 704, 1856]
    - [0, 2522.69]
  - - [256, 128, 1, 768, 256, 256, 256, 128]
    - [3, 0.0]
  - - [1856, 1408, 1, 1792, 1856, 1856, 1856, 1408]
    - [3, 0.0]
  - - [4, 448, 1, 1792, 4, 4, 4, 448]
    - [6, 0.0]
  - - [128, 5056, 1, 256, 128, 128, 128, 5056]
    - [3, 0.0]
  - - [1856, 64, 1, 3328, 1856, 1856, 1856, 64]
    - [3, 0.0]
  - - [64, 2944, 1, 1792, 64, 64, 64, 2944]
    - [3, 0.0]
  - - [1408, 5056, 1, 1792, 1408, 1408, 1408, 5056]
    - [3, 0.0]
  - - [4, 2944, 1, 768, 4, 4, 4, 2944]
    - [6, 0.0]
  - - [256, 64, 1, 3328, 256, 256, 256, 64]
    - [3, 0.0]
  - - [4, 3584, 1, 256, 4, 4, 4, 3584]
    - [6, 0.0]
  - - [6784, 3584, 1, 3328, 6784, 6784, 6784, 3584]
    - [3, 0.0]
  - - [256, 1408, 1, 128, 256, 256, 256, 1408]
    - [1, 993.376]
  - - [1856, 704, 1, 256, 1856, 1856, 1856, 704]
    - [3, 0.0]
  - - [4288, 704, 1, 128, 4288, 4288, 4288, 704]
    - [0, 3084.75]
  - - [5056, 6784, 1, 256, 5056, 5056, 5056, 6784]
    - [3, 0.0]
  - - [5888, 1024, 1, 128, 5888, 5888, 5888, 1024]
    - [2, 3272.13]
  - - [4288, 1856, 1, 768, 4288, 4288, 4288, 1856]
    - [3, 0.0]
  - - [5056, 64, 1, 128, 5056, 5056, 5056, 64]
    - [0, 1148.14]
  - - [5888, 704, 1, 256, 5888, 5888, 5888, 704]
    - [3, 0.0]
  - - [2368, 1024, 1, 128, 2368, 2368, 2368, 1024]
    - [2, 2668.81]
  - - [1856, 6784, 1, 128, 1856, 1856, 1856, 6784]
    - [0, 3719.78]
  - - [5056, 1408, 1, 256, 5056, 5056, 5056, 1408]
    - [3, 0.0]
  - - [448, 6784, 1, 3328, 448, 448, 448, 6784]
    - [3, 0.0]
  - - [256, 448, 1, 256, 256, 256, 256, 448]
    - [3, 0.0]
  - - [2368, 128, 1, 256, 2368, 2368, 2368, 128]
    - [3, 0.0]
  - - [1408, 704, 1, 256, 1408, 1408, 1408, 704]
    - [3, 0.0]
  - - [1024, 6784, 1, 3328, 1024, 1024, 1024, 6784]
    - [3, 0.0]
  - - [2944, 448, 1, 768, 2944, 2944, 2944, 448]
    - [3, 0.0]
  - - [64, 1408, 1, 768, 64, 64, 64, 1408]
    - [3, 0.0]
  - - [704, 4, 1, 768, 704, 704, 704, 4]
    - [6, 0.0]
  - - [1024, 256, 1, 768, 1024, 1024, 1024, 256]
    - [3, 0.0]
  - - [5888, 128, 1, 768, 5888, 5888, 5888, 128]
    - [3, 0.0]
  - - [704, 3584, 1, 256, 704, 704, 704, 3584]
    - [3, 0.0]
  - - [256, 3584, 1, 3328, 256, 256, 256, 3584]
    - [3, 0.0]
  - - [6784, 3584, 1, 128, 6784, 6784, 6784, 3584]
    - [2, 3710.46]
  - - [4288, 5056, 1, 768, 4288, 4288, 4288, 5056]
    - [3, 0.0]
  - - [256, 4288, 1, 3328, 256, 256, 256, 4288]
    - [3, 0.0]
  - - [6784, 2944, 1, 768, 6784, 6784, 6784, 2944]
    - [3, 0.0]
  - - [64, 704, 1, 3328, 64, 64, 64, 704]
    - [3, 0.0]
  - - [256, 2368, 1, 3328, 256, 256, 256, 2368]
    - [3, 0.0]
  - - [5888, 64, 1, 768, 5888, 5888, 5888, 64]
    - [3, 0.0]
  - - [4288, 64, 1, 128, 4288, 4288, 4288, 64]
    - [0, 963.831]
  - - [6784, 6784, 1, 768, 6784, 6784, 6784, 6784]
    - [3, 0.0]
  - - [704, 64, 1, 256, 704, 704, 704, 64]
    - [3, 0.0]
  - - [3584, 1024, 1, 1792, 3584, 3584, 3584, 1024]
    - [3, 0.0]
  - - [2368, 5888, 1, 1792, 2368, 2368, 2368, 5888]
    - [3, 0.0]
  - - [2944, 4, 1, 256, 2944, 2944, 2944, 4]
    - [6, 0.0]
  - - [256, 1408, 1, 768, 256, 256, 256, 1408]
    - [3, 0.0]
  - - [4, 4288, 1, 256, 4, 4, 4, 4288]
    - [6, 0.0]
  - - [1024, 5888, 1, 3328, 1024, 1024, 1024, 5888]
    - [3, 0.0]
  - - [5888, 704, 1, 128, 5888, 5888, 5888, 704]
    - [0, 2918.78]
  - - [3584, 5888, 1, 128, 3584, 3584, 3584, 5888]
    - [2, 3674.76]
  - - [4, 4, 1, 768, 4, 4, 4, 4]
    - [6, 0.0]
  - - [4288, 5056, 1, 256, 4288, 4288, 4288, 5056]
    - [3, 0.0]
  - - [128, 64, 1, 1792, 128, 128, 128, 64]
    - [3, 0.0]
  - - [5056, 4288, 1, 1792, 5056, 5056, 5056, 4288]
    - [3, 0.0]
  - - [256, 64, 1, 128, 256, 256, 256, 64]
    - [0, 72.2222]
  - - [6784, 448, 1, 1792, 6784, 6784, 6784, 448]
    - [3, 0.0]
  - - [256, 5888, 1, 3328, 256, 256, 256, 5888]
    - [3, 0.0]
  - - [6784, 5888, 1, 3328, 6784, 6784, 6784, 5888]
    - [3, 0.0]
  - - [128, 6784, 1, 768, 128, 128, 128, 6784]
    - [3, 0.0]
  - - [6784, 4, 1, 768, 6784, 6784, 6784, 4]
    - [6, 0.0]
  - - [6784, 5056, 1, 128, 6784, 6784, 6784, 5056]
    - [0, 3783.78]
  - - [704, 3584, 1, 3328, 704, 704, 704, 3584]
    - [3, 0.0]
  - - [2944, 1024, 1, 768, 2944, 2944, 2944, 1024]
    - [3, 0.0]
  - - [2944, 704, 1, 768, 2944, 2944, 2944, 704]
    - [3, 0.0]
  - - [704, 2944, 1, 768, 704, 704, 704, 2944]
    - [3, 0.0]
  - - [1408, 6784, 1, 256, 1408, 1408, 1408, 6784]
    - [3, 0.0]
  - - [704, 4288, 1, 256, 704, 704, 704, 4288]
    - [3, 0.0]
  - - [3584, 4288, 1, 1792, 3584, 3584, 3584, 4288]
    - [3, 0.0]
  - - [1024, 1024, 1, 768, 1024, 1024, 1024, 1024]
    - [3, 0.0]
  - - [3584, 5056, 1, 1792, 3584, 3584, 3584, 5056]
    - [3, 0.0]
  - - [5888, 704, 1, 3328, 5888, 5888, 5888, 704]
    - [3, 0.0]
  - - [3584, 64, 1, 128, 3584, 3584, 3584, 64]
    - [0, 837.963]
  - - [1408, 704, 1, 3328, 1408, 1408, 1408, 704]
    - [3, 0.0]
  - - [4, 64, 1, 128, 4, 4, 4, 64]
    - [5, 1.42696]
  - - [4288, 2944, 1, 768, 4288, 4288, 4288, 2944]
    - [3, 0.0]
  - - [2944, 1856, 1, 1792, 2944, 2944, 2944, 1856]
    - [3, 0.0]
  - - [5888, 1408, 1, 256, 5888, 5888, 5888, 1408]
    - [3, 0.0]
  - - [256, 5888, 1, 128, 256, 256, 256, 5888]
    - [2, 2413.91]
  - - [1408, 1024, 1, 3328, 1408, 1408, 1408, 1024]
    - [3, 0.0]
  - - [1408, 5888, 1, 768, 1408, 1408, 1408, 5888]
    - [3, 0.0]
  - - [256, 3584, 1, 768, 256, 256, 256, 3584]
    - [3, 0.0]
  - - [5056, 128, 1, 1792, 5056, 5056, 5056, 128]
    - [3, 0.0]
  - - [64, 64, 1, 256, 64, 64, 64, 64]
    - [3, 0.0]
  - - [5056, 256, 1, 3328, 5056, 5056, 5056, 256]
    - [3, 0.0]
  - - [6784, 6784, 1, 256, 6784, 6784, 6784, 6784]
    - [3, 0.0]
  - - [256, 256, 1, 1792, 256, 256, 256, 256]
    - [3, 0.0]
  - - [448, 1024, 1, 256, 448, 448, 448, 1024]
    - [3, 0.0]
  - - [6784, 4288, 1, 1792, 6784, 6784, 6784, 4288]
    - [3, 0.0]
  - - [4, 2368, 1, 768, 4, 4, 4, 2368]
    - [6, 0.0]
  - - [128, 3584, 1, 256, 128, 128, 128, 3584]
    - [3, 0.0]
  - - [64, 5888, 1, 768, 64, 64, 64, 5888]
    - [3, 0.0]
  - - [256, 5056, 1, 768, 256, 256, 256, 5056]
    - [3, 0.0]
  - - [1024, 2944, 1, 256, 1024, 1024, 1024, 2944]
    - [3, 0.0]
  - - [1408, 448, 1, 1792, 1408, 1408, 1408, 448]
    - [3, 0.0]
  - - [704, 5888, 1, 128, 704, 704, 704, 5888]
    - [2, 3045.36]
  - - [6784, 2368, 1, 1792, 6784, 6784, 6784, 2368]
    - [3, 0.0]
  - - [448, 3584, 1, 1792, 448, 448, 448, 3584]
    - [3, 0.0]
  - - [128, 2944, 1, 128, 128, 128, 128, 2944]
    - [0, 1148.41]
  - - [2944, 1856, 1, 768, 2944, 2944, 2944, 1856]
    - [3, 0.0]
  - - [1856, 3584, 1, 3328, 1856, 1856, 1856, 3584]
    - [3, 0.0]
  - - [704, 6784, 1, 1792, 704, 704, 704, 6784]
    - [3, 0.0]
  - - [2944, 128, 1, 128, 2944, 2944, 2944, 128]
    - [0, 1279.28]
  - - [704, 448, 1, 128, 704, 704, 704, 448]
    - [0, 1140.13]
  - - [3584, 4288, 1, 3328, 3584, 3584, 3584, 4288]
    - [3, 0.0]
  - - [704, 1856, 1, 256, 704, 704, 704, 1856]
    - [3, 0.0]
  - - [1024, 448, 1, 3328, 1024, 1024, 1024, 448]
    - [3, 0.0]
  - - [4288, 3584, 1, 256, 4288, 4288, 4288, 3584]
    - [3, 0.0]
  - - [2944, 448, 1, 3328, 2944, 2944, 2944, 448]
    - [3, 0.0]
  - - [4288, 3584, 1, 3328, 4288, 4288, 4288, 3584]
    - [3, 0.0]
  - - [3584, 5888, 1, 1792, 3584, 3584, 3584, 5888]
    - [3, 0.0]
  - - [2368, 256, 1, 768, 2368, 2368, 2368, 256]
    - [3, 0.0]
  - - [128, 4288, 1, 3328, 128, 128, 128, 4288]
    - [3, 0.0]
  - - [256, 6784, 1, 768, 256, 256, 256, 6784]
    - [3, 0.0]
  - - [704, 5056, 1, 3328, 704, 704, 704, 5056]
    - [3, 0.0]
  - - [128, 5056, 1, 128, 128, 128, 128, 5056]
    - [0, 1546.73]
  - - [5888, 2368, 1, 256, 5888, 5888, 5888, 2368]
    - [3, 0.0]
  - - [64, 4, 1, 128, 64, 64, 64, 4]
    - [5, 1.46965]
  - - [128, 1856, 1, 1792, 128, 128, 128, 1856]
    - [3, 0.0]
  - - [3584, 4288, 1, 768, 3584, 3584, 3584, 4288]
    - [3, 0.0]
  - - [3584, 1856, 1, 128, 3584, 3584, 3584, 1856]
    - [2, 3182.25]
  - - [2368, 2944, 1, 768, 2368, 2368, 2368, 2944]
    - [3, 0.0]
  - - [2944, 5888, 1, 3328, 2944, 2944, 2944, 5888]
    - [3, 0.0]
  - - [1024, 5056, 1, 3328, 1024, 1024, 1024, 5056]
    - [3, 0.0]
  - - [64, 6784, 1, 1792, 64, 64, 64, 6784]
    - [3, 0.0]
  - - [1856, 128, 1, 256, 1856, 1856, 1856, 128]
    - [3, 0.0]
  - - [2944, 704, 1, 3328, 2944, 2944, 2944, 704]
    - [3, 0.0]
  - - [256, 2944, 1, 128, 256, 256, 256, 2944]
    - [0, 1669.63]
  - - [1024, 256, 1, 256, 1024, 1024, 1024, 256]
    - [3, 0.0]
  - - [448, 128, 1, 256, 448, 448, 448, 128]
    - [3, 0.0]
  - - [1856, 4, 1, 128, 1856, 1856, 1856, 4]
    - [5, 39.9635]
  - - [5056, 6784, 1, 768, 5056, 5056, 5056, 6784]
    - [3, 0.0]
  - - [6784, 2368, 1, 256, 6784, 6784, 6784, 2368]
    - [3, 0.0]
  - - [128, 448, 1, 768, 128, 128, 128, 448]
    - [3, 0.0]
  - - [4288, 4288, 1, 1792, 4288, 4288, 4288, 4288]
    - [3, 0.0]
  - - [2368, 2368, 1, 256, 2368, 2368, 2368, 2368]
    - [3, 0.0]
  - - [2944, 4288, 1, 128, 2944, 2944, 2944, 4288]
    - [0, 3711.7]
  - - [256, 3584, 1, 256, 256, 256, 256, 3584]
    - [3, 0.0]
  - - [1856, 1024, 1, 128, 1856, 1856, 1856, 1024]
    - [1, 2495.5]
  - - [1856, 704, 1, 1792, 1856, 1856, 1856, 704]
    - [3, 0.0]
  - - [1856, 2944, 1, 1792, 1856, 1856, 1856, 2944]
    - [3, 0.0]
  - - [4288, 704, 1, 1792, 4288, 4288, 4288, 704]
    - [3, 0.0]
  - - [1408, 5056, 1, 256, 1408, 1408, 1408, 5056]
    - [3, 0.0]
  - - [1856, 1856, 1, 768, 1856, 1856, 1856, 1856]
    - [3, 0.0]
  - - [1856, 448, 1, 1792, 1856, 1856, 1856, 448]
    - [3, 0.0]
  - - [256, 1024, 1, 256, 256, 256, 256, 1024]
    - [3, 0.0]
  - - [2368, 704, 1, 768, 2368, 2368, 2368, 704]
    - [3, 0.0]
  - - [2368, 1856, 1, 1792, 2368, 2368, 2368, 1856]
    - [3, 0.0]
  - - [64, 3584, 1, 256, 64, 64, 64, 3584]
    - [3, 0.0]
  - - [1856, 128, 1, 3328, 1856, 1856, 1856, 128]
    - [3, 0.0]
  - - [5888, 5056, 1, 768, 5888, 5888, 5888, 5056]
    - [3, 0.0]
  - - [64, 2368, 1, 128, 64, 64, 64, 2368]
    - [0, 625.007]
  - - [3584, 448, 1, 256, 3584, 3584, 3584, 448]
    - [3, 0.0]
  - - [448, 2368, 1, 1792, 448, 448, 448, 2368]
    - [3, 0.0]
  - - [4288, 2368, 1, 128, 4288, 4288, 4288, 2368]
    - [0, 3669.12]
  - - [64, 1856, 1, 768, 64, 64, 64, 1856]
    - [3, 0.0]
  - - [3584, 1408, 1, 1792, 3584, 3584, 3584, 1408]
    - [3, 0.0]
  - - [128, 1408, 1, 128, 128, 128, 128, 1408]
    - [0, 715.907]
  - - [5888, 1024, 1, 256, 5888, 5888, 5888, 1024]
    - [3, 0.0]
  - - [256, 704, 1, 1792, 256, 256, 256, 704]
    - [3, 0.0]
  - - [4288, 128, 1, 768, 4288, 4288, 4288, 128]
    - [3, 0.0]
  - - [5888, 6784, 1, 768, 5888, 5888, 5888, 6784]
    - [3, 0.0]
  - - [2368, 3584, 1, 1792, 2368, 2368, 2368, 3584]
    - [3, 0.0]
  - - [2368, 704, 1, 3328, 2368, 2368, 2368, 704]
    - [3, 0.0]
  - - [5056, 64, 1, 768, 5056, 5056, 5056, 64]
    - [3, 0.0]
  - - [448, 5056, 1, 3328, 448, 448, 448, 5056]
    - [3, 0.0]
  - - [704, 2368, 1, 768, 704, 704, 704, 2368]
    - [3, 0.0]
  - - [4288, 5888, 1, 768, 4288, 4288, 4288, 5888]
    - [3, 0.0]
  - - [4288, 128, 1, 1792, 4288, 4288, 4288, 128]
    - [3, 0.0]
  - - [4, 4, 1, 128, 4, 4, 4, 4]
    - [5, 0.0861282]
  - - [5888, 64, 1, 3328, 5888, 5888, 5888, 64]
    - [3, 0.0]
  - - [3584, 4288, 1, 256, 3584, 3584, 3584, 4288]
    - [3, 0.0]
  - - [4288, 448, 1, 3328, 4288, 4288, 4288, 448]
    - [3, 0.0]
  - - [6784, 128, 1, 3328, 6784, 6784, 6784, 128]
    - [3, 0.0]
  - - [3584, 5056, 1, 128, 3584, 3584, 3584, 5056]
    - [2, 3651.97]
  - - [6784, 64, 1, 3328, 6784, 6784, 6784, 64]
    - [3, 0.0]
  - - [2368, 2368, 1, 128, 2368, 2368, 2368, 2368]
    - [0, 3439.63]
  - - [1856, 5888, 1, 128, 1856, 1856, 1856, 5888]
    - [0, 3666.69]
  - - [448, 448, 1, 1792, 448, 448, 448, 448]
    - [3, 0.0]
  - - [1856, 4288, 1, 256, 1856, 1856, 1856, 4288]
    - [3, 0.0]
  - - [4288, 2944, 1, 256, 4288, 4288, 4288, 2944]
    - [3, 0.0]
  - - [4288, 5056, 1, 128, 4288, 4288, 4288, 5056]
    - [0, 3826.62]
  - - [704, 704, 1, 3328, 704, 704, 704, 704]
    - [3, 0.0]
  - - [1408, 5056, 1, 128, 1408, 1408, 1408, 5056]
    - [0, 3494.64]
  - - [4, 256, 1, 768, 4, 4, 4, 256]
    - [6, 0.0]
  - - [1408, 64, 1, 3328, 1408, 1408, 1408, 64]
    - [3, 0.0]
  - - [4288, 704, 1, 768, 4288, 4288, 4288, 704]
    - [3, 0.0]
  - - [2944, 256, 1, 3328, 2944, 2944, 2944, 256]
    - [3, 0.0]
  - - [6784, 3584, 1, 1792, 6784, 6784, 6784, 3584]
    - [3, 0.0]
  - - [1024, 128, 1, 1792, 1024, 1024, 1024, 128]
    - [3, 0.0]
  - - [1024, 6784, 1, 768, 1024, 1024, 1024, 6784]
    - [3, 0.0]
  - - [2944, 1856, 1, 256, 2944, 2944, 2944, 1856]
    - [3, 0.0]
  - - [64, 448, 1, 256, 64, 64, 64, 448]
    - [3, 0.0]
  - - [6784, 64, 1, 1792, 6784, 6784, 6784, 64]
    - [3, 0.0]
  - - [256, 704, 1, 768, 256, 256, 256, 704]
    - [3, 0.0]
  - - [2368, 1856, 1, 256, 2368, 2368, 2368, 1856]
    - [3, 0.0]
  - - [128, 128, 1, 256, 128, 128, 128, 128]
    - [3, 0.0]
  - - [1408, 2368, 1, 256, 1408, 1408, 1408, 2368]
    - [3, 0.0]
  - - [4288, 2368, 1, 256, 4288, 4288, 4288, 2368]
    - [3, 0.0]
  - - [1856, 704, 1, 128, 1856, 1856, 1856, 704]
    - [0, 2522.69]
  - - [2944, 1856, 1, 128, 2944, 2944, 2944, 1856]
    - [0, 3380.49]
  - - [2944, 64, 1, 256, 2944, 2944, 2944, 64]
    - [3, 0.0]
  - - [256, 4288, 1, 768, 256, 256, 256, 4288]
    - [3, 0.0]
  - - [1024, 4, 1, 1792, 1024, 1024, 1024, 4]
    - [6, 0.0]
  - - [2368, 1408, 1, 128, 2368, 2368, 2368, 1408]
    - [0, 3184.79]
  - - [704, 256, 1, 256, 704, 704, 704, 256]
    - [3, 0.0]
  - - [4, 128, 1, 768, 4, 4, 4, 128]
    - [6, 0.0]
  - - [2368, 3584, 1, 256, 2368, 2368, 2368, 3584]
    - [3, 0.0]
  - - [128, 2368, 1, 1792, 128, 128, 128, 2368]
    - [3, 0.0]
  - - [4288, 2944, 1, 1792, 4288, 4288, 4288, 2944]
    - [3, 0.0]
  - - [3584, 704, 1, 256, 3584, 3584, 3584, 704]
    - [3, 0.0]
  - - [1408, 2944, 1, 128, 1408, 1408, 1408, 2944]
    - [0, 3242.51]
  - - [64, 1408, 1, 128, 64, 64, 64, 1408]
    - [0, 402.356]
  - - [5056, 1024, 1, 256, 5056, 5056, 5056, 1024]
    - [3, 0.0]
  - - [1408, 6784, 1, 128, 1408, 1408, 1408, 6784]
    - [0, 3609.3]
  - - [2944, 128, 1, 3328, 2944, 2944, 2944, 128]
    - [3, 0.0]
  - - [4, 5056, 1, 768, 4, 4, 4, 5056]
    - [6, 0.0]
  - - [1408, 1408, 1, 3328, 1408, 1408, 1408, 1408]
    - [3, 0.0]
  - - [128, 256, 1, 768, 128, 128, 128, 256]
    - [3, 0.0]
  - - [3584, 64, 1, 3328, 3584, 3584, 3584, 64]
    - [3, 0.0]
  - - [1856, 1024, 1, 1792, 1856, 1856, 1856, 1024]
    - [3, 0.0]
  - - [4, 128, 1, 128, 4, 4, 4, 128]
    - [5, 2.88184]
  - - [1856, 2944, 1, 128, 1856, 1856, 1856, 2944]
    - [0, 3442.12]
  - - [4, 2368, 1, 256, 4, 4, 4, 2368]
    - [6, 0.0]
  - - [64, 128, 1, 3328, 64, 64, 64, 128]
    - [3, 0.0]
  - - [6784, 256, 1, 768, 6784, 6784, 6784, 256]
    - [3, 0.0]
  - - [2944, 4288, 1, 1792, 2944, 2944, 2944, 4288]
    - [3, 0.0]
  - - [128, 3584, 1, 768, 128, 128, 128, 3584]
    - [3, 0.0]
  - - [6784, 1408, 1, 128, 6784, 6784, 6784, 1408]
    - [0, 3517.76]
  - - [3584, 6784, 1, 1792, 3584, 3584, 3584, 6784]
    - [3, 0.0]
  - - [1856, 1856, 1, 3328, 1856, 1856, 1856, 1856]
    - [3, 0.0]
  - - [4288, 4, 1, 768, 4288, 4288, 4288, 4]
    - [6, 0.0]
  - - [4288, 4, 1, 3328, 4288, 4288, 4288, 4]
    - [6, 0.0]
  - - [5056, 3584, 1, 1792, 5056, 5056, 5056, 3584]
    - [3, 0.0]
  - - [1408, 1024, 1, 128, 1408, 1408, 1408, 1024]
    - [2, 2345.93]
  - - [4, 6784, 1, 3328, 4, 4, 4, 6784]
    - [6, 0.0]
  - - [1408, 256, 1, 1792, 1408, 1408, 1408, 256]
    - [3, 0.0]
  - - [2368, 448, 1, 768, 2368, 2368, 2368, 448]
    - [3, 0.0]
  - - [3584, 448, 1, 768, 3584, 3584, 3584, 448]
    - [3, 0.0]
  - - [448, 64, 1, 256, 448, 448, 448, 64]
    - [3, 0.0]
  - - [128, 64, 1, 128, 128, 128, 128, 64]
    - [0, 36.4836]
  - - [1024, 6784, 1, 128, 1024, 1024, 1024, 6784]
    - [2, 3244.29]
  - - [704, 6784, 1, 256, 704, 704, 704, 6784]
    - [3, 0.0]
  - - [2368, 64, 1, 256, 2368, 2368, 2368, 64]
    - [3, 0.0]
  - - [5888, 4, 1, 3328, 5888, 5888, 5888, 4]
    - [6, 0.0]
  - - [1024, 3584, 1, 1792, 1024, 1024, 1024, 3584]
    - [3, 0.0]
  - - [448, 3584, 1, 256, 448, 448, 448, 3584]
    - [3, 0.0]
  - - [64, 5056, 1, 768, 64, 64, 64, 5056]
    - [3, 0.0]
  - - [256, 2944, 1, 256, 256, 256, 256, 2944]
    - [3, 0.0]
  - - [128, 256, 1, 1792, 128, 128, 128, 256]
    - [3, 0.0]
  - - [5888, 1856, 1, 3328, 5888, 5888, 5888, 1856]
    - [3, 0.0]
  - - [2368, 448, 1, 256, 2368, 2368, 2368, 448]
    - [3, 0.0]
  - - [2944, 2944, 1, 128, 2944, 2944, 2944, 2944]
    - [0, 3600.99]
  - - [64, 256, 1, 128, 64, 64, 64, 256]
    - [0, 72.5922]
  - - [3584, 256, 1, 3328, 3584, 3584, 3584, 256]
    - [3, 0.0]
  - - [4, 3584, 1, 128, 4, 4, 4, 3584]
    - [5, 75.7548]
  - - [1408, 3584, 1, 128, 1408, 1408, 1408, 3584]
    - [0, 3204.63]
  - - [4, 64, 1, 1792, 4, 4, 4, 64]
    - [6, 0.0]
  - - [3584, 3584, 1, 768, 3584, 3584, 3584, 3584]
    - [3, 0.0]
  - - [6784, 1856, 1, 1792, 6784, 6784, 6784, 1856]
    - [3, 0.0]
  - - [64, 256, 1, 1792, 64, 64, 64, 256]
    - [3, 0.0]
  - - [2368, 704, 1, 128, 2368, 2368, 2368, 704]
    - [0, 2623.55]
  - - [1024, 6784, 1, 1792, 1024, 1024, 1024, 6784]
    - [3, 0.0]
  - - [448, 256, 1, 768, 448, 448, 448, 256]
    - [3, 0.0]
  - - [64, 4, 1, 1792, 64, 64, 64, 4]
    - [6, 0.0]
  - - [704, 128, 1, 768, 704, 704, 704, 128]
    - [3, 0.0]
  - - [704, 1408, 1, 3328, 704, 704, 704, 1408]
    - [3, 0.0]
  - - [256, 1856, 1, 1792, 256, 256, 256, 1856]
    - [3, 0.0]
  - - [3584, 1024, 1, 768, 3584, 3584, 3584, 1024]
    - [3, 0.0]
  - - [1024, 2368, 1, 128, 1024, 1024, 1024, 2368]
    - [2, 2658.65]
  - - [5888, 64, 1, 256, 5888, 5888, 5888, 64]
    - [3, 0.0]
  - - [704, 5056, 1, 128, 704, 704, 704, 5056]
    - [0, 3188.48]
  - - [1856, 448, 1, 768, 1856, 1856, 1856, 448]
    - [3, 0.0]
  - - [704, 6784, 1, 3328, 704, 704, 704, 6784]
    - [3, 0.0]
  - - [448, 4288, 1, 3328, 448, 448, 448, 4288]
    - [3, 0.0]
  - - [448, 2944, 1, 128, 448, 448, 448, 2944]
    - [0, 2381.43]
  - - [64, 448, 1, 768, 64, 64, 64, 448]
    - [3, 0.0]
  - - [704, 3584, 1, 128, 704, 704, 704, 3584]
    - [0, 2916.31]
  - - [4288, 2368, 1, 1792, 4288, 4288, 4288, 2368]
    - [3, 0.0]
  - - [448, 5056, 1, 128, 448, 448, 448, 5056]
    - [0, 2888.57]
  - - [2944, 6784, 1, 768, 2944, 2944, 2944, 6784]
    - [3, 0.0]
  - - [448, 448, 1, 768, 448, 448, 448, 448]
    - [3, 0.0]
  - - [256, 1024, 1, 128, 256, 256, 256, 1024]
    - [1, 793.305]
  - - [1408, 1024, 1, 1792, 1408, 1408, 1408, 1024]
    - [3, 0.0]
  - - [6784, 1408, 1, 3328, 6784, 6784, 6784, 1408]
    - [3, 0.0]
  - - [64, 1856, 1, 3328, 64, 64, 64, 1856]
    - [3, 0.0]
  - - [256, 5888, 1, 768, 256, 256, 256, 5888]
    - [3, 0.0]
  - - [1024, 1856, 1, 128, 1024, 1024, 1024, 1856]
    - [2, 2405.92]
  - - [64, 3584, 1, 768, 64, 64, 64, 3584]
    - [3, 0.0]
  - - [4288, 256, 1, 768, 4288, 4288, 4288, 256]
    - [3, 0.0]
  - - [704, 2944, 1, 128, 704, 704, 704, 2944]
    - [0, 2862.8]
  - - [6784, 128, 1, 256, 6784, 6784, 6784, 128]
    - [3, 0.0]
  - - [448, 4, 1, 768, 448, 448, 448, 4]
    - [6, 0.0]
  - - [448, 1856, 1, 1792, 448, 448, 448, 1856]
    - [3, 0.0]
  - - [3584, 1024, 1, 128, 3584, 3584, 3584, 1024]
    - [2, 3025.61]
  - - [128, 4, 1, 256, 128, 128, 128, 4]
    - [6, 0.0]
  - - [64, 2368, 1, 1792, 64, 64, 64, 2368]
    - [3, 0.0]
  - - [704, 64, 1, 128, 704, 704, 704, 64]
    - [0, 193.672]
  - - [128, 3584, 1, 3328, 128, 128, 128, 3584]
    - [3, 0.0]
  - - [6784, 1856, 1, 256, 6784, 6784, 6784, 1856]
    - [3, 0.0]
  - - [1024, 4288, 1, 256, 1024, 1024, 1024, 4288]
    - [3, 0.0]
  - - [704, 5056, 1, 1792, 704, 704, 704, 5056]
    - [3, 0.0]
  - - [448, 256, 1, 1792, 448, 448, 448, 256]
    - [3, 0.0]
  - - [2368, 448, 1, 128, 2368, 2368, 2368, 448]
    - [0, 2124.15]
  - - [4288, 5888, 1, 128, 4288, 4288, 4288, 5888]
    - [0, 3785.12]
  - - [704, 3584, 1, 1792, 704, 704, 704, 3584]
    - [3, 0.0]
  - - [6784, 448, 1, 768, 6784, 6784, 6784, 448]
    - [3, 0.0]
  - - [64, 2944, 1, 3328, 64, 64, 64, 2944]
    - [3, 0.0]
  - - [256, 5056, 1, 128, 256, 256, 256, 5056]
    - [2, 2107.99]
  - - [4, 64, 1, 256, 4, 4, 4, 64]
    - [6, 0.0]
  - - [256, 64, 1, 768, 256, 256, 256, 64]
    - [3, 0.0]
  - - [1024, 5056, 1, 256, 1024, 1024, 1024, 5056]
    - [3, 0.0]
  - - [4288, 2944, 1, 128, 4288, 4288, 4288, 2944]
    - [0, 3730.74]
  - - [448, 2944, 1, 3328, 448, 448, 448, 2944]
    - [3, 0.0]
  - - [2368, 1024, 1, 3328, 2368, 2368, 2368, 1024]
    - [3, 0.0]
  - - [6784, 256, 1, 1792, 6784, 6784, 6784, 256]
    - [3, 0.0]
  - - [4288, 448, 1, 128, 4288, 4288, 4288, 448]
    - [0, 2705.36]
  - - [2944, 6784, 1, 256, 2944, 2944, 2944, 6784]
    - [3, 0.0]
  - - [256, 256, 1, 3328, 256, 256, 256, 256]
    - [3, 0.0]
  - - [5056, 2944, 1, 768, 5056, 5056, 5056, 2944]
    - [3, 0.0]
  - - [3584, 3584, 1, 128, 3584, 3584, 3584, 3584]
    - [2, 3571.91]
  - - [4, 2944, 1, 1792, 4, 4, 4, 2944]
    - [6, 0.0]
  - - [5056, 2944, 1, 128, 5056, 5056, 5056, 2944]
    - [0, 3747.17]
  - - [2368, 128, 1, 3328, 2368, 2368, 2368, 128]
    - [3, 0.0]
  - - [704, 448, 1, 1792, 704, 704, 704, 448]
    - [3, 0.0]
  - - [448, 4288, 1, 256, 448, 448, 448, 4288]
    - [3, 0.0]
  - - [5888, 2944, 1, 1792, 5888, 5888, 5888, 2944]
    - [3, 0.0]
  - - [4, 5888, 1, 256, 4, 4, 4, 5888]
    - [6, 0.0]
  - - [128, 2944, 1, 768, 128, 128, 128, 2944]
    - [3, 0.0]
  - - [5888, 5888, 1, 1792, 5888, 5888, 5888, 5888]
    - [3, 0.0]
  - - [6784, 4, 1, 128, 6784, 6784, 6784, 4]
    - [5, 137.105]
  - - [5888, 3584, 1, 128, 5888, 5888, 5888, 3584]
    - [2, 3688.14]
  - - [4, 4288, 1, 1792, 4, 4, 4, 4288]
    - [6, 0.0]
  - - [4288, 128, 1, 128, 4288, 4288, 4288, 128]
    - [0, 1498.3]
  - - [1024, 1024, 1, 3328, 1024, 1024, 1024, 1024]
    - [3, 0.0]
  - - [5056, 3584, 1, 768, 5056, 5056, 5056, 3584]
    - [3, 0.0]
  - - [1856, 3584, 1, 256, 1856, 1856, 1856, 3584]
    - [3, 0.0]
  - - [5888, 6784, 1, 128, 5888, 5888, 5888, 6784]
    - [2, 3788.48]
  - - [1408, 128, 1, 256, 1408, 1408, 1408, 128]
    - [3, 0.0]
  - - [3584, 5888, 1, 256, 3584, 3584, 3584, 5888]
    - [3, 0.0]
  - - [256, 6784, 1, 1792, 256, 256, 256, 6784]
    - [3, 0.0]
  - - [128, 4288, 1, 128, 128, 128, 128, 4288]
    - [1, 1347.19]
  - - [3584, 2368, 1, 1792, 3584, 3584, 3584, 2368]
    - [3, 0.0]
  - - [3584, 4288, 1, 128, 3584, 3584, 3584, 4288]
    - [2, 3586.68]
  - - [4288, 448, 1, 768, 4288, 4288, 4288, 448]
    - [3, 0.0]
  - - [1024, 64, 1, 1792, 1024, 1024, 1024, 64]
    - [3, 0.0]
  - - [4288, 1408, 1, 1792, 4288, 4288, 4288, 1408]
    - [3, 0.0]
  - - [704, 1408, 1, 256, 704, 704, 704, 1408]
    - [3, 0.0]
  - - [1024, 5888, 1, 768, 1024, 1024, 1024, 5888]
    - [3, 0.0]
  - - [64, 128, 1, 128, 64, 64, 64, 128]
    - [0, 36.1111]
  - - [2944, 3584, 1, 256, 2944, 2944, 2944, 3584]
    - [3, 0.0]
  - - [3584, 1408, 1, 768, 3584, 3584, 3584, 1408]
    - [3, 0.0]
  - - [1408, 5056, 1, 768, 1408, 1408, 1408, 5056]
    - [3, 0.0]
  - - [64, 4, 1, 256, 64, 64, 64, 4]
    - [6, 0.0]
  - - [5888, 1024, 1, 1792, 5888, 5888, 5888, 1024]
    - [3, 0.0]
  - - [1408, 5888, 1, 1792, 1408, 1408, 1408, 5888]
    - [3, 0.0]
  - - [256, 448, 1, 768, 256, 256, 256, 448]
    - [3, 0.0]
  - - [1856, 3584, 1, 1792, 1856, 1856, 1856, 3584]
    - [3, 0.0]
  - - [1856, 256, 1, 1792, 1856, 1856, 1856, 256]
    - [3, 0.0]
  - - [2944, 64, 1, 768, 2944, 2944, 2944, 64]
    - [3, 0.0]
  - - [5888, 4288, 1, 1792, 5888, 5888, 5888, 4288]
    - [3, 0.0]
  - - [1408, 448, 1, 128, 1408, 1408, 1408, 448]
    - [0, 1721.91]
  - - [2368, 256, 1, 3328, 2368, 2368, 2368, 256]
    - [3, 0.0]
  - - [1408, 256, 1, 256, 1408, 1408, 1408, 256]
    - [3, 0.0]
  - - [1024, 1024, 1, 1792, 1024, 1024, 1024, 1024]
    - [3, 0.0]
  - - [2368, 5888, 1, 3328, 2368, 2368, 2368, 5888]
    - [3, 0.0]
  - - [5056, 4288, 1, 128, 5056, 5056, 5056, 4288]
    - [0, 3837.98]
  - - [1408, 1408, 1, 1792, 1408, 1408, 1408, 1408]
    - [3, 0.0]
  - - [5888, 64, 1, 128, 5888, 5888, 5888, 64]
    - [0, 1214.84]
  - - [5056, 5888, 1, 1792, 5056, 5056, 5056, 5888]
    - [3, 0.0]
  - - [1408, 4288, 1, 768, 1408, 1408, 1408, 4288]
    - [3, 0.0]
  - - [1024, 128, 1, 768, 1024, 1024, 1024, 128]
    - [3, 0.0]
  - - [5056, 4, 1, 256, 5056, 5056, 5056, 4]
    - [6, 0.0]
  - - [4288, 64, 1, 768, 4288, 4288, 4288, 64]
    - [3, 0.0]
  - - [256, 5056, 1, 256, 256, 256, 256, 5056]
    - [3, 0.0]
  - - [4, 704, 1, 3328, 4, 4, 4, 704]
    - [6, 0.0]
  - - [4288, 1024, 1, 768, 4288, 4288, 4288, 1024]
    - [3, 0.0]
  - - [5056, 2368, 1, 128, 5056, 5056, 5056, 2368]
    - [0, 3695.65]
  - - [6784, 3584, 1, 768, 6784, 6784, 6784, 3584]
    - [3, 0.0]
  - - [704, 5056, 1, 256, 704, 704, 704, 5056]
    - [3, 0.0]
  - - [2368, 6784, 1, 3328, 2368, 2368, 2368, 6784]
    - [3, 0.0]
  - - [2944, 1408, 1, 256, 2944, 2944, 2944, 1408]
    - [3, 0.0]
  - - [128, 1408, 1, 256, 128, 128, 128, 1408]
    - [3, 0.0]
  - - [6784, 1024, 1, 256, 6784, 6784, 6784, 1024]
    - [3, 0.0]
  - - [6784, 256, 1, 128, 6784, 6784, 6784, 256]
    - [0, 2424.04]
  - - [1024, 2368, 1, 768, 1024, 1024, 1024, 2368]
    - [3, 0.0]
  - - [256, 1856, 1, 3328, 256, 256, 256, 1856]
    - [3, 0.0]
  - - [1024, 2944, 1, 128, 1024, 1024, 1024, 2944]
    - [2, 2868.52]
  - - [704, 64, 1, 1792, 704, 704, 704, 64]
    - [3, 0.0]
  - - [1408, 256, 1, 128, 1408, 1408, 1408, 256]
    - [0, 1248.19]
  - - [4, 256, 1, 256, 4, 4, 4, 256]
    - [6, 0.0]
  - - [6784, 4, 1, 3328, 6784, 6784, 6784, 4]
    - [6, 0.0]
  - - [2944, 4, 1, 1792, 2944, 2944, 2944, 4]
    - [6, 0.0]
  - - [2368, 1408, 1, 3328, 2368, 2368, 2368, 1408]
    - [3, 0.0]
  - - [1024, 5056, 1, 1792, 1024, 1024, 1024, 5056]
    - [3, 0.0]
  - - [4288, 6784, 1, 256, 4288, 4288, 4288, 6784]
    - [3, 0.0]
  - - [128, 64, 1, 3328, 128, 128, 128, 64]
    - [3, 0.0]
  - - [64, 5888, 1, 3328, 64, 64, 64, 5888]
    - [3, 0.0]
  - - [5056, 4, 1, 3328, 5056, 5056, 5056, 4]
    - [6, 0.0]
  - - [2944, 4288, 1, 3328, 2944, 2944, 2944, 4288]
    - [3, 0.0]
  - - [6784, 3584, 1, 256, 6784, 6784, 6784, 3584]
    - [3, 0.0]
  - - [4288, 256, 1, 3328, 4288, 4288, 4288, 256]
    - [3, 0.0]
  - - [256, 3584, 1, 1792, 256, 256, 256, 3584]
    - [3, 0.0]
  - - [1408, 2368, 1, 768, 1408, 1408, 1408, 2368]
    - [3, 0.0]
  - - [1408, 2944, 1, 256, 1408, 1408, 1408, 2944]
    - [3, 0.0]
  - - [256, 2368, 1, 1792, 256, 256, 256, 2368]
    - [3, 0.0]
  - - [6784, 2368, 1, 3328, 6784, 6784, 6784, 2368]
    - [3, 0.0]
  - - [2368, 1024, 1, 1792, 2368, 2368, 2368, 1024]
    - [3, 0.0]
  - - [2368, 4288, 1, 256, 2368, 2368, 2368, 4288]
    - [3, 0.0]
  - - [5056, 3584, 1, 128, 5056, 5056, 5056, 3584]
    - [2, 3657.94]
  - - [128, 448, 1, 128, 128, 128, 128, 448]
    - [0, 245.269]
  - - [5056, 4288, 1, 3328, 5056, 5056, 5056, 4288]
    - [3, 0.0]
  - - [2944, 64, 1, 128, 2944, 2944, 2944, 64]
    - [0, 717.135]
  - - [5056, 64, 1, 256, 5056, 5056, 5056, 64]
    - [3, 0.0]
  - - [1408, 256, 1, 768, 1408, 1408, 1408, 256]
    - [3, 0.0]
  - - [6784, 128, 1, 128, 6784, 6784, 6784, 128]
    - [0, 1887.4]
  - - [5056, 2944, 1, 256, 5056, 5056, 5056, 2944]
    - [3, 0.0]
  - - [1408, 1408, 1, 256, 1408, 1408, 1408, 1408]
    - [3, 0.0]
  - - [256, 256, 1, 256, 256, 256, 256, 256]
    - [3, 0.0]
  - - [64, 704, 1, 768, 64, 64, 64, 704]
    - [3, 0.0]
  - - [5056, 1856, 1, 256, 5056, 5056, 5056, 1856]
    - [3, 0.0]
  - - [64, 448, 1, 128, 64, 64, 64, 448]
    - [0, 130.036]
  - - [448, 2944, 1, 256, 448, 448, 448, 2944]
    - [3, 0.0]
  - - [64, 64, 1, 1792, 64, 64, 64, 64]
    - [3, 0.0]
  - - [4, 448, 1, 3328, 4, 4, 4, 448]
    - [6, 0.0]
  - - [3584, 5888, 1, 3328, 3584, 3584, 3584, 5888]
    - [3, 0.0]
  - - [704, 2944, 1, 256, 704, 704, 704, 2944]
    - [3, 0.0]
  - - [6784, 5056, 1, 768, 6784, 6784, 6784, 5056]
    - [3, 0.0]
  - - [448, 64, 1, 768, 448, 448, 448, 64]
    - [3, 0.0]
  - - [5056, 128, 1, 3328, 5056, 5056, 5056, 128]
    - [3, 0.0]
  - - [1408, 2944, 1, 768, 1408, 1408, 1408, 2944]
    - [3, 0.0]
  - - [4288, 1856, 1, 128, 4288, 4288, 4288, 1856]
    - [0, 3570.12]
  - - [6784, 2944, 1, 1792, 6784, 6784, 6784, 2944]
    - [3, 0.0]
  - - [2368, 1024, 1, 256, 2368, 2368, 2368, 1024]
    - [3, 0.0]
  - - [448, 128, 1, 768, 448, 448, 448, 128]
    - [3, 0.0]
  - - [2368, 704, 1, 1792, 2368, 2368, 2368, 704]
    - [3, 0.0]
  - - [5056, 1024, 1, 1792, 5056, 5056, 5056, 1024]
    - [3, 0.0]
  - - [2944, 3584, 1, 768, 2944, 2944, 2944, 3584]
    - [3, 0.0]
  - - [128, 448, 1, 3328, 128, 128, 128, 448]
    - [3, 0.0]
  - - [64, 64, 1, 128, 64, 64, 64, 64]
    - [1, 15.9051]
  - - [5888, 2944, 1, 768, 5888, 5888, 5888, 2944]
    - [3, 0.0]
  - - [2368, 2944, 1, 1792, 2368, 2368, 2368, 2944]
    - [3, 0.0]
  - - [704, 256, 1, 768, 704, 704, 704, 256]
    - [3, 0.0]
  - - [704, 256, 1, 1792, 704, 704, 704, 256]
    - [3, 0.0]
  - - [1024, 448, 1, 256, 1024, 1024, 1024, 448]
    - [3, 0.0]
  - - [448, 704, 1, 1792, 448, 448, 448, 704]
    - [3, 0.0]
  - - [6784, 256, 1, 3328, 6784, 6784, 6784, 256]
    - [3, 0.0]
  - - [1408, 448, 1, 256, 1408, 1408, 1408, 448]
    - [3, 0.0]
  - - [448, 3584, 1, 128, 448, 448, 448, 3584]
    - [0, 2522.25]
  - - [1024, 4, 1, 256, 1024, 1024, 1024, 4]
    - [6, 0.0]
  - - [64, 2368, 1, 256, 64, 64, 64, 2368]
    - [3, 0.0]
  - - [64, 1408, 1, 256, 64, 64, 64, 1408]
    - [3, 0.0]
  - - [2944, 4, 1, 3328, 2944, 2944, 2944, 4]
    - [6, 0.0]
  - - [4288, 5056, 1, 3328, 4288, 4288, 4288, 5056]
    - [3, 0.0]
  - - [256, 1024, 1, 1792, 256, 256, 256, 1024]
    - [3, 0.0]
  - - [4288, 4288, 1, 768, 4288, 4288, 4288, 4288]
    - [3, 0.0]
  - - [3584, 6784, 1, 128, 3584, 3584, 3584, 6784]
    - [2, 3709.15]
  - - [4, 704, 1, 768, 4, 4, 4, 704]
    - [6, 0.0]
  - - [256, 6784, 1, 3328, 256, 256, 256, 6784]
    - [3, 0.0]
  - - [2368, 64, 1, 128, 2368, 2368, 2368, 64]
    - [0, 597.894]
  - - [1856, 5056, 1, 768, 1856, 1856, 1856, 5056]
    - [3, 0.0]
  - - [2944, 704, 1, 1792, 2944, 2944, 2944, 704]
    - [3, 0.0]
  - - [4, 5888, 1, 1792, 4, 4, 4, 5888]
    - [6, 0.0]
  - - [4288, 5888, 1, 1792, 4288, 4288, 4288, 5888]
    - [3, 0.0]
  - - [1408, 2368, 1, 1792, 1408, 1408, 1408, 2368]
    - [3, 0.0]
  - - [4288, 4288, 1, 3328, 4288, 4288, 4288, 4288]
    - [3, 0.0]
  - - [1856, 1856, 1, 256, 1856, 1856, 1856, 1856]
    - [3, 0.0]
  - - [704, 1024, 1, 256, 704, 704, 704, 1024]
    - [3, 0.0]
  - - [3584, 5056, 1, 3328, 3584, 3584, 3584, 5056]
    - [3, 0.0]
  - - [448, 448, 1, 128, 448, 448, 448, 448]
    - [0, 860.568]
  - - [1024, 4288, 1, 3328, 1024, 1024, 1024, 4288]
    - [3, 0.0]
  - - [4, 6784, 1, 128, 4, 4, 4, 6784]
    - [4, 134.743]
  - - [2368, 5056, 1, 3328, 2368, 2368, 2368, 5056]
    - [3, 0.0]
  - - [5056, 5056, 1, 128, 5056, 5056, 5056, 5056]
    - [0, 3844.74]
  - - [2944, 256, 1, 1792, 2944, 2944, 2944, 256]
    - [3, 0.0]
  - - [704, 704, 1, 1792, 704, 704, 704, 704]
    - [3, 0.0]
  - - [5888, 448, 1, 3328, 5888, 5888, 5888, 448]
    - [3, 0.0]
  - - [64, 6784, 1, 768, 64, 64, 64, 6784]
    - [3, 0.0]
  - - [4288, 1024, 1, 128, 4288, 4288, 4288, 1024]
    - [2, 3065.59]
  - - [6784, 448, 1, 3328, 6784, 6784, 6784, 448]
    - [3, 0.0]
  - - [128, 5888, 1, 128, 128, 128, 128, 5888]
    - [1, 1678.23]
  - - [5056, 1856, 1, 3328, 5056, 5056, 5056, 1856]
    - [3, 0.0]
  - - [6784, 704, 1, 1792, 6784, 6784, 6784, 704]
    - [3, 0.0]
  - - [4288, 4, 1, 1792, 4288, 4288, 4288, 4]
    - [6, 0.0]
  - - [128, 2368, 1, 3328, 128, 128, 128, 2368]
    - [3, 0.0]
  - - [3584, 2368, 1, 768, 3584, 3584, 3584, 2368]
    - [3, 0.0]
  - - [4288, 3584, 1, 128, 4288, 4288, 4288, 3584]
    - [1, 3626.35]
  - - [704, 4288, 1, 3328, 704, 704, 704, 4288]
    - [3, 0.0]
  - - [1024, 4288, 1, 128, 1024, 1024, 1024, 4288]
    - [2, 3001.32]
  - - [128, 704, 1, 1792, 128, 128, 128, 704]
    - [3, 0.0]
  - - [4, 6784, 1, 1792, 4, 4, 4, 6784]
    - [6, 0.0]
  - - [448, 5888, 1, 768, 448, 448, 448, 5888]
    - [3, 0.0]
  - - [5888, 2944, 1, 256, 5888, 5888, 5888, 2944]
    - [3, 0.0]
  - - [128, 4288, 1, 1792, 128, 128, 128, 4288]
    - [3, 0.0]
  - - [2368, 3584, 1, 128, 2368, 2368, 2368, 3584]
    - [1, 3436.87]
  - - [256, 1856, 1, 128, 256, 256, 256, 1856]
    - [1, 1290.92]
  - - [704, 1024, 1, 768, 704, 704, 704, 1024]
    - [3, 0.0]
  - - [5888, 256, 1, 3328, 5888, 5888, 5888, 256]
    - [3, 0.0]
  - - [704, 1024, 1, 128, 704, 704, 704, 1024]
    - [0, 1884.54]
  - - [1024, 3584, 1, 128, 1024, 1024, 1024, 3584]
    - [2, 2999.84]
  - - [6784, 1408, 1, 256, 6784, 6784, 6784, 1408]
    - [3, 0.0]
  - - [6784, 1024, 1, 128, 6784, 6784, 6784, 1024]
    - [2, 3317.82]
  - - [256, 4288, 1, 1792, 256, 256, 256, 4288]
    - [3, 0.0]
  - - [448, 5888, 1, 256, 448, 448, 448, 5888]
    - [3, 0.0]
  - - [4, 2368, 1, 128, 4, 4, 4, 2368]
    - [5, 50.6725]
  - - [448, 6784, 1, 256, 448, 448, 448, 6784]
    - [3, 0.0]
  - - [448, 1408, 1, 3328, 448, 448, 448, 1408]
    - [3, 0.0]
  - - [1024, 704, 1, 1792, 1024, 1024, 1024, 704]
    - [3, 0.0]
  - - [128, 128, 1, 768, 128, 128, 128, 128]
    - [3, 0.0]
  - - [448, 1024, 1, 768, 448, 448, 448, 1024]
    - [3, 0.0]
  - - [3584, 704, 1, 3328, 3584, 3584, 3584, 704]
    - [3, 0.0]
  - - [2944, 5888, 1, 128, 2944, 2944, 2944, 5888]
    - [0, 3690.62]
  - - [1408, 4, 1, 256, 1408, 1408, 1408, 4]
    - [6, 0.0]
  - - [4, 1856, 1, 3328, 4, 4, 4, 1856]
    - [6, 0.0]
  - - [2944, 64, 1, 1792, 2944, 2944, 2944, 64]
    - [3, 0.0]
  - - [2368, 4, 1, 256, 2368, 2368, 2368, 4]
    - [6, 0.0]
  - - [1856, 2368, 1, 256, 1856, 1856, 1856, 2368]
    - [3, 0.0]
  - - [6784, 704, 1, 256, 6784, 6784, 6784, 704]
    - [3, 0.0]
  - - [448, 1856, 1, 256, 448, 448, 448, 1856]
    - [3, 0.0]
  - - [128, 2944, 1, 1792, 128, 128, 128, 2944]
    - [3, 0.0]
  - - [1024, 3584, 1, 256, 1024, 1024, 1024, 3584]
    - [3, 0.0]
  - - [448, 3584, 1, 3328, 448, 448, 448, 3584]
    - [3, 0.0]
  - - [2944, 2368, 1, 1792, 2944, 2944, 2944, 2368]
    - [3, 0.0]
  - - [64, 1024, 1, 256, 64, 64, 64, 1024]
    - [3, 0.0]
  - - [4288, 1856, 1, 256, 4288, 4288, 4288, 1856]
    - [3, 0.0]
  - - [704, 2368, 1, 128, 704, 704, 704, 2368]
    - [0, 2599.86]
  - - [1856, 1408, 1, 768, 1856, 1856, 1856, 1408]
    - [3, 0.0]
  - - [2944, 704, 1, 128, 2944, 2944, 2944, 704]
    - [0, 2808.89]
  - - [5888, 6784, 1, 256, 5888, 5888, 5888, 6784]
    - [3, 0.0]
  - - [128, 256, 1, 3328, 128, 128, 128, 256]
    - [3, 0.0]
  - - [5888, 2368, 1, 128, 5888, 5888, 5888, 2368]
    - [2, 3518.21]
  - - [4, 704, 1, 1792, 4, 4, 4, 704]
    - [6, 0.0]
  - - [1408, 1856, 1, 3328, 1408, 1408, 1408, 1856]
    - [3, 0.0]
  - - [128, 4288, 1, 256, 128, 128, 128, 4288]
    - [3, 0.0]
  - - [704, 5056, 1, 768, 704, 704, 704, 5056]
    - [3, 0.0]
  - - [448, 5888, 1, 3328, 448, 448, 448, 5888]
    - [3, 0.0]
  - - [4288, 3584, 1, 768, 4288, 4288, 4288, 3584]
    - [3, 0.0]
  - - [1856, 4, 1, 1792, 1856, 1856, 1856, 4]
    - [6, 0.0]
  - - [1408, 704, 1, 1792, 1408, 1408, 1408, 704]
    - [3, 0.0]
  - - [704, 128, 1, 256, 704, 704, 704, 128]
    - [3, 0.0]
  - - [64, 2368, 1, 3328, 64, 64, 64, 2368]
    - [3, 0.0]
  - - [5056, 5888, 1, 128, 5056, 5056, 5056, 5888]
    - [2, 3767.2]
  - - [4, 1024, 1, 128, 4, 4, 4, 1024]
    - [5, 21.6447]
  - - [5056, 1024, 1, 128, 5056, 5056, 5056, 1024]
    - [2, 3235.55]
  - - [5888, 256, 1, 1792, 5888, 5888, 5888, 256]
    - [3, 0.0]
  - - [4, 128, 1, 256, 4, 4, 4, 128]
    - [6, 0.0]
  - - [2944, 256, 1, 128, 2944, 2944, 2944, 256]
    - [0, 1940.85]
  - - [1856, 128, 1, 1792, 1856, 1856, 1856, 128]
    - [3, 0.0]
  - - [2368, 5888, 1, 768, 2368, 2368, 2368, 5888]
    - [3, 0.0]
  - - [64, 3584, 1, 128, 64, 64, 64, 3584]
    - [0, 874.959]
  - - [6784, 1408, 1, 1792, 6784, 6784, 6784, 1408]
    - [3, 0.0]
  - - [6784, 4288, 1, 768, 6784, 6784, 6784, 4288]
    - [3, 0.0]
  - - [3584, 4, 1, 3328, 3584, 3584, 3584, 4]
    - [6, 0.0]
  - - [5056, 5056, 1, 1792, 5056, 5056, 5056, 5056]
    - [3, 0.0]
  - - [64, 6784, 1, 128, 64, 64, 64, 6784]
    - [0, 1280.27]
  - - [448, 704, 1, 128, 448, 448, 448, 704]
    - [0, 1152.2]
  - - [5056, 3584, 1, 3328, 5056, 5056, 5056, 3584]
    - [3, 0.0]
  - - [2368, 1408, 1, 768, 2368, 2368, 2368, 1408]
    - [3, 0.0]
  - - [1408, 3584, 1, 3328, 1408, 1408, 1408, 3584]
    - [3, 0.0]
  - - [128, 704, 1, 128, 128, 128, 128, 704]
    - [0, 397.222]
  - - [5888, 2368, 1, 3328, 5888, 5888, 5888, 2368]
    - [3, 0.0]
  - - [2368, 5888, 1, 256, 2368, 2368, 2368, 5888]
    - [3, 0.0]
  - - [1408, 1024, 1, 768, 1408, 1408, 1408, 1024]
    - [3, 0.0]
  - - [6784, 128, 1, 1792, 6784, 6784, 6784, 128]
    - [3, 0.0]
  - - [2944, 2368, 1, 256, 2944, 2944, 2944, 2368]
    - [3, 0.0]
  - - [1856, 256, 1, 256, 1856, 1856, 1856, 256]
    - [3, 0.0]
  - - [6784, 5888, 1, 768, 6784, 6784, 6784, 5888]
    - [3, 0.0]
  - - [448, 256, 1, 3328, 448, 448, 448, 256]
    - [3, 0.0]
  - - [1856, 5888, 1, 768, 1856, 1856, 1856, 5888]
    - [3, 0.0]
  - - [2944, 5888, 1, 1792, 2944, 2944, 2944, 5888]
    - [3, 0.0]
  - - [1408, 4, 1, 768, 1408, 1408, 1408, 4]
    - [6, 0.0]
  - - [704, 5888, 1, 768, 704, 704, 704, 5888]
    - [3, 0.0]
  - - [128, 3584, 1, 128, 128, 128, 128, 3584]
    - [0, 1321.17]
  - - [4, 1856, 1, 768, 4, 4, 4, 1856]
    - [6, 0.0]
  - - [6784, 64, 1, 256, 6784, 6784, 6784, 64]
    - [3, 0.0]
  - - [5888, 256, 1, 128, 5888, 5888, 5888, 256]
    - [0, 2466.48]
  - - [64, 256, 1, 256, 64, 64, 64, 256]
    - [3, 0.0]
  - - [3584, 2944, 1, 768, 3584, 3584, 3584, 2944]
    - [3, 0.0]
  - - [3584, 3584, 1, 3328, 3584, 3584, 3584, 3584]
    - [3, 0.0]
  - - [4288, 704, 1, 256, 4288, 4288, 4288, 704]
    - [3, 0.0]
  - - [3584, 704, 1, 768, 3584, 3584, 3584, 704]
    - [3, 0.0]
  - - [6784, 5056, 1, 1792, 6784, 6784, 6784, 5056]
    - [3, 0.0]
  - - [2368, 1024, 1, 768, 2368, 2368, 2368, 1024]
    - [3, 0.0]
  - - [64, 128, 1, 768, 64, 64, 64, 128]
    - [3, 0.0]
  - - [5056, 5888, 1, 768, 5056, 5056, 5056, 5888]
    - [3, 0.0]
  - - [5888, 448, 1, 1792, 5888, 5888, 5888, 448]
    - [3, 0.0]
  - - [128, 5888, 1, 768, 128, 128, 128, 5888]
    - [3, 0.0]
  - - [256, 5056, 1, 3328, 256, 256, 256, 5056]
    - [3, 0.0]
  - - [2944, 5056, 1, 3328, 2944, 2944, 2944, 5056]
    - [3, 0.0]
  - - [448, 1024, 1, 128, 448, 448, 448, 1024]
    - [0, 1501.34]
  - - [64, 1856, 1, 1792, 64, 64, 64, 1856]
    - [3, 0.0]
  - - [1408, 64, 1, 768, 1408, 1408, 1408, 64]
    - [3, 0.0]
  - - [256, 256, 1, 128, 256, 256, 256, 256]
    - [0, 291.864]
  - - [256, 4, 1, 128, 256, 256, 256, 4]
    - [5, 5.82051]
  - - [5056, 64, 1, 1792, 5056, 5056, 5056, 64]
    - [3, 0.0]
  - - [4, 5056, 1, 256, 4, 4, 4, 5056]
    - [6, 0.0]
  - - [4, 1856, 1, 1792, 4, 4, 4, 1856]
    - [6, 0.0]
  - - [2368, 2944, 1, 256, 2368, 2368, 2368, 2944]
    - [3, 0.0]
  - - [256, 5056, 1, 1792, 256, 256, 256, 5056]
    - [3, 0.0]
  - - [256, 128, 1, 128, 256, 256, 256, 128]
    - [0, 142.625]
  - - [1856, 6784, 1, 768, 1856, 1856, 1856, 6784]
    - [3, 0.0]
  - - [6784, 2944, 1, 256, 6784, 6784, 6784, 2944]
    - [3, 0.0]
  - - [64, 2944, 1, 128, 64, 64, 64, 2944]
    - [0, 729.996]
  - - [4288, 128, 1, 3328, 4288, 4288, 4288, 128]
    - [3, 0.0]
  - - [6784, 704, 1, 128, 6784, 6784, 6784, 704]
    - [0, 3260.63]
  - - [3584, 6784, 1, 256, 3584, 3584, 3584, 6784]
    - [3, 0.0]
  - - [1856, 5056, 1, 128, 1856, 1856, 1856, 5056]
    - [0, 3641.4]
  - - [704, 1408, 1, 1792, 704, 704, 704, 1408]
    - [3, 0.0]
  - - [128, 1024, 1, 3328, 128, 128, 128, 1024]
    - [3, 0.0]
  - - [2944, 2944, 1, 1792, 2944, 2944, 2944, 2944]
    - [3, 0.0]
  - - [1024, 5056, 1, 768, 1024, 1024, 1024, 5056]
    - [3, 0.0]
  - - [5888, 5056, 1, 3328, 5888, 5888, 5888, 5056]
    - [3, 0.0]
  - - [5888, 2368, 1, 768, 5888, 5888, 5888, 2368]
    - [3, 0.0]
  - - [5056, 5888, 1, 3328, 5056, 5056, 5056, 5888]
    - [3, 0.0]
  - - [1856, 256, 1, 128, 1856, 1856, 1856, 256]
    - [0, 1549.09]
  - - [704, 1856, 1, 768, 704, 704, 704, 1856]
    - [3, 0.0]
  - - [2944, 64, 1, 3328, 2944, 2944, 2944, 64]
    - [3, 0.0]
  - - [3584, 128, 1, 128, 3584, 3584, 3584, 128]
    - [2, 1147.18]
  - - [256, 448, 1, 3328, 256, 256, 256, 448]
    - [3, 0.0]
  - - [448, 2368, 1, 256, 448, 448, 448, 2368]
    - [3, 0.0]
  - - [6784, 4, 1, 1792, 6784, 6784, 6784, 4]
    - [6, 0.0]
  - - [1856, 6784, 1, 256, 1856, 1856, 1856, 6784]
    - [3, 0.0]
  - - [448, 1024, 1, 3328, 448, 448, 448, 1024]
    - [3, 0.0]
  - - [1856, 64, 1, 1792, 1856, 1856, 1856, 64]
    - [3, 0.0]
  - - [256, 64, 1, 256, 256, 256, 256, 64]
    - [3, 0.0]
  - - [1024, 4, 1, 3328, 1024, 1024, 1024, 4]
    - [6, 0.0]
  - - [448, 5888, 1, 1792, 448, 448, 448, 5888]
    - [3, 0.0]
  - - [2368, 5056, 1, 256, 2368, 2368, 2368, 5056]
    - [3, 0.0]
  - - [6784, 64, 1, 128, 6784, 6784, 6784, 64]
    - [0, 1330.22]
  - - [3584, 448, 1, 128, 3584, 3584, 3584, 448]
    - [1, 2181.19]
  - - [4, 64, 1, 768, 4, 4, 4, 64]
    - [6, 0.0]
  - - [1856, 4288, 1, 3328, 1856, 1856, 1856, 4288]
    - [3, 0.0]
  - - [2944, 128, 1, 768, 2944, 2944, 2944, 128]
    - [3, 0.0]
  - - [5888, 6784, 1, 1792, 5888, 5888, 5888, 6784]
    - [3, 0.0]
  - - [704, 5888, 1, 1792, 704, 704, 704, 5888]
    - [3, 0.0]
  - - [6784, 6784, 1, 128, 6784, 6784, 6784, 6784]
    - [2, 3807.24]
  - - [5056, 64, 1, 3328, 5056, 5056, 5056, 64]
    - [3, 0.0]
  - - [448, 64, 1, 1792, 448, 448, 448, 64]
    - [3, 0.0]
  - - [1024, 5888, 1, 256, 1024, 1024, 1024, 5888]
    - [3, 0.0]
  - - [64, 2944, 1, 256, 64, 64, 64, 2944]
    - [3, 0.0]
  - - [256, 1024, 1, 768, 256, 256, 256, 1024]
    - [3, 0.0]
  - - [128, 128, 1, 128, 128, 128, 128, 128]
    - [0, 72.4067]
  - - [5056, 4288, 1, 256, 5056, 5056, 5056, 4288]
    - [3, 0.0]
  - - [5056, 6784, 1, 3328, 5056, 5056, 5056, 6784]
    - [3, 0.0]
  - - [5888, 1408, 1, 768, 5888, 5888, 5888, 1408]
    - [3, 0.0]
  - - [448, 4288, 1, 128, 448, 448, 448, 4288]
    - [0, 2707.56]
  - - [704, 448, 1, 3328, 704, 704, 704, 448]
    - [3, 0.0]
  - - [5056, 1024, 1, 768, 5056, 5056, 5056, 1024]
    - [3, 0.0]
  - - [2368, 128, 1, 1792, 2368, 2368, 2368, 128]
    - [3, 0.0]
  - - [2944, 5056, 1, 1792, 2944, 2944, 2944, 5056]
    - [3, 0.0]
  - - [128, 4, 1, 768, 128, 128, 128, 4]
    - [6, 0.0]
  - - [5888, 5888, 1, 256, 5888, 5888, 5888, 5888]
    - [3, 0.0]
  - - [2944, 1408, 1, 3328, 2944, 2944, 2944, 1408]
    - [3, 0.0]
  - - [1408, 4288, 1, 256, 1408, 1408, 1408, 4288]
    - [3, 0.0]
  - - [64, 3584, 1, 3328, 64, 64, 64, 3584]
    - [3, 0.0]
  - - [6784, 2368, 1, 128, 6784, 6784, 6784, 2368]
    - [0, 3671.34]
  - - [2944, 2368, 1, 3328, 2944, 2944, 2944, 2368]
    - [3, 0.0]
  - - [2368, 2944, 1, 128, 2368, 2368, 2368, 2944]
    - [0, 3526.44]
  - - [5056, 1408, 1, 1792, 5056, 5056, 5056, 1408]
    - [3, 0.0]
  - - [6784, 5888, 1, 256, 6784, 6784, 6784, 5888]
    - [3, 0.0]
  - - [128, 1024, 1, 128, 128, 128, 128, 1024]
    - [0, 569.066]
  - - [128, 4, 1, 1792, 128, 128, 128, 4]
    - [6, 0.0]
  - - [128, 256, 1, 256, 128, 128, 128, 256]
    - [3, 0.0]
  - - [128, 1856, 1, 768, 128, 128, 128, 1856]
    - [3, 0.0]
  - - [2368, 448, 1, 3328, 2368, 2368, 2368, 448]
    - [3, 0.0]
  - - [1408, 256, 1, 3328, 1408, 1408, 1408, 256]
    - [3, 0.0]
  - - [256, 704, 1, 256, 256, 256, 256, 704]
    - [3, 0.0]
  - - [1856, 1856, 1, 128, 1856, 1856, 1856, 1856]
    - [0, 3156.1]
  - - [128, 5056, 1, 3328, 128, 128, 128, 5056]
    - [3, 0.0]
  - - [3584, 4, 1, 768, 3584, 3584, 3584, 4]
    - [6, 0.0]
  - - [4, 4288, 1, 3328, 4, 4, 4, 4288]
    - [6, 0.0]
  - - [6784, 5888, 1, 128, 6784, 6784, 6784, 5888]
    - [2, 3782.46]
  - - [5888, 448, 1, 768, 5888, 5888, 5888, 448]
    - [3, 0.0]
  - - [5056, 2368, 1, 3328, 5056, 5056, 5056, 2368]
    - [3, 0.0]
  - - [704, 1408, 1, 128, 704, 704, 704, 1408]
    - [0, 2241.91]
  - - [4288, 704, 1, 3328, 4288, 4288, 4288, 704]
    - [3, 0.0]
  - - [5888, 2944, 1, 128, 5888, 5888, 5888, 2944]
    - [2, 3638.61]
  - - [5888, 5056, 1, 256, 5888, 5888, 5888, 5056]
    - [3, 0.0]
  - - [704, 704, 1, 128, 704, 704, 704, 704]
    - [0, 1628.16]
  - - [1856, 2944, 1, 3328, 1856, 1856, 1856, 2944]
    - [3, 0.0]
  - - [5888, 4, 1, 1792, 5888, 5888, 5888, 4]
    - [6, 0.0]
  - - [64, 4, 1, 768, 64, 64, 64, 4]
    - [6, 0.0]
  - - [4, 4, 1, 256, 4, 4, 4, 4]
    - [6, 0.0]
  - - [704, 5888, 1, 256, 704, 704, 704, 5888]
    - [3, 0.0]
  - - [5888, 6784, 1, 3328, 5888, 5888, 5888, 6784]
    - [3, 0.0]
  - - [256, 128, 1, 1792, 256, 256, 256, 128]
    - [3, 0.0]
  - - [6784, 1856, 1, 768, 6784, 6784, 6784, 1856]
    - [3, 0.0]
  - - [1408, 128, 1, 3328, 1408, 1408, 1408, 128]
    - [3, 0.0]
  - - [2944, 2944, 1, 3328, 2944, 2944, 2944, 2944]
    - [3, 0.0]
  - - [2368, 4288, 1, 1792, 2368, 2368, 2368, 4288]
    - [3, 0.0]
  - - [3584, 1408, 1, 3328, 3584, 3584, 3584, 1408]
    - [3, 0.0]
  - - [4288, 5888, 1, 3328, 4288, 4288, 4288, 5888]
    - [3, 0.0]
  - - [704, 256, 1, 3328, 704, 704, 704, 256]
    - [3, 0.0]
  - - [448, 1408, 1, 128, 448, 448, 448, 1408]
    - [0, 1695.14]
  - - [5056, 1856, 1, 1792, 5056, 5056, 5056, 1856]
    - [3, 0.0]
  - - [4, 704, 1, 128, 4, 4, 4, 704]
    - [5, 14.8354]
  - - [128, 2368, 1, 128, 128, 128, 128, 2368]
    - [0, 933.615]
  - - [2368, 1408, 1, 1792, 2368, 2368, 2368, 1408]
    - [3, 0.0]
  - - [1408, 448, 1, 768, 1408, 1408, 1408, 448]
    - [3, 0.0]
  - - [1024, 2368, 1, 3328, 1024, 1024, 1024, 2368]
    - [3, 0.0]
  - - [256, 4288, 1, 256, 256, 256, 256, 4288]
    - [3, 0.0]
  - - [448, 4, 1, 3328, 448, 448, 448, 4]
    - [6, 0.0]
  - - [64, 704, 1, 256, 64, 64, 64, 704]
    - [3, 0.0]
  - - [448, 5056, 1, 768, 448, 448, 448, 5056]
    - [3, 0.0]
  - - [1024, 1856, 1, 256, 1024, 1024, 1024, 1856]
    - [3, 0.0]
  - - [4, 1408, 1, 1792, 4, 4, 4, 1408]
    - [6, 0.0]
  - - [256, 2368, 1, 128, 256, 256, 256, 2368]
    - [1, 1383.77]
  - - [2944, 2944, 1, 768, 2944, 2944, 2944, 2944]
    - [3, 0.0]
  - - [4288, 6784, 1, 1792, 4288, 4288, 4288, 6784]
    - [3, 0.0]
  - - [128, 6784, 1, 256, 128, 128, 128, 6784]
    - [3, 0.0]
  - - [1856, 5056, 1, 1792, 1856, 1856, 1856, 5056]
    - [3, 0.0]
  - - [1856, 704, 1, 768, 1856, 1856, 1856, 704]
    - [3, 0.0]
  - - [2368, 4288, 1, 128, 2368, 2368, 2368, 4288]
    - [0, 3663.76]
  - - [4, 6784, 1, 256, 4, 4, 4, 6784]
    - [6, 0.0]
  - - [256, 5888, 1, 256, 256, 256, 256, 5888]
    - [3, 0.0]
  - - [3584, 448, 1, 1792, 3584, 3584, 3584, 448]
    - [3, 0.0]
  - - [1856, 1024, 1, 256, 1856, 1856, 1856, 1024]
    - [3, 0.0]
  - - [1408, 6784, 1, 1792, 1408, 1408, 1408, 6784]
    - [3, 0.0]
  - - [1024, 2944, 1, 3328, 1024, 1024, 1024, 2944]
    - [3, 0.0]
  - - [6784, 1408, 1, 768, 6784, 6784, 6784, 1408]
    - [3, 0.0]
  - - [1856, 1408, 1, 256, 1856, 1856, 1856, 1408]
    - [3, 0.0]
  - - [4288, 1024, 1, 3328, 4288, 4288, 4288, 1024]
    - [3, 0.0]
  - - [5888, 4, 1, 128, 5888, 5888, 5888, 4]
    - [5, 119.698]
  - - [1024, 1024, 1, 256, 1024, 1024, 1024, 1024]
    - [3, 0.0]
  - - [704, 64, 1, 3328, 704, 704, 704, 64]
    - [3, 0.0]
  - - [2368, 3584, 1, 3328, 2368, 2368, 2368, 3584]
    - [3, 0.0]
  - - [5888, 2368, 1, 1792, 5888, 5888, 5888, 2368]
    - [3, 0.0]
  - - [128, 704, 1, 256, 128, 128, 128, 704]
    - [3, 0.0]
  - - [1024, 256, 1, 128, 1024, 1024, 1024, 256]
    - [0, 915.113]
  - - [448, 2368, 1, 3328, 448, 448, 448, 2368]
    - [3, 0.0]
  - - [4, 4288, 1, 768, 4, 4, 4, 4288]
    - [6, 0.0]
  - - [5056, 1408, 1, 128, 5056, 5056, 5056, 1408]
    - [0, 3529.74]
  - - [1024, 1408, 1, 3328, 1024, 1024, 1024, 1408]
    - [3, 0.0]
  - - [6784, 1856, 1, 128, 6784, 6784, 6784, 1856]
    - [0, 3629.8]
  - - [3584, 6784, 1, 768, 3584, 3584, 3584, 6784]
    - [3, 0.0]
  - - [4, 4, 1, 3328, 4, 4, 4, 4]
    - [6, 0.0]
  - - [128, 1408, 1, 1792, 128, 128, 128, 1408]
    - [3, 0.0]
  - - [4288, 1408, 1, 768, 4288, 4288, 4288, 1408]
    - [3, 0.0]
  - - [5056, 2944, 1, 3328, 5056, 5056, 5056, 2944]
    - [3, 0.0]
  - - [704, 1024, 1, 1792, 704, 704, 704, 1024]
    - [3, 0.0]
  - - [5888, 128, 1, 128, 5888, 5888, 5888, 128]
    - [0, 1689.12]
  - - [128, 3584, 1, 1792, 128, 128, 128, 3584]
    - [3, 0.0]
  - - [2368, 704, 1, 256, 2368, 2368, 2368, 704]
    - [3, 0.0]
  - - [1024, 128, 1, 128, 1024, 1024, 1024, 128]
    - [0, 544.441]
  - - [704, 448, 1, 768, 704, 704, 704, 448]
    - [3, 0.0]
  - - [1856, 256, 1, 3328, 1856, 1856, 1856, 256]
    - [3, 0.0]
  - - [1024, 128, 1, 3328, 1024, 1024, 1024, 128]
    - [3, 0.0]
  - - [448, 64, 1, 3328, 448, 448, 448, 64]
    - [3, 0.0]
  - - [2944, 256, 1, 768, 2944, 2944, 2944, 256]
    - [3, 0.0]
  - - [4, 1024, 1, 3328, 4, 4, 4, 1024]
    - [6, 0.0]
  - - [5888, 2944, 1, 3328, 5888, 5888, 5888, 2944]
    - [3, 0.0]
  - - [1024, 1856, 1, 3328, 1024, 1024, 1024, 1856]
    - [3, 0.0]
  - - [4, 3584, 1, 768, 4, 4, 4, 3584]
    - [6, 0.0]
  - - [448, 2944, 1, 1792, 448, 448, 448, 2944]
    - [3, 0.0]
  - - [704, 4288, 1, 128, 704, 704, 704, 4288]
    - [0, 3079.29]
  - - [4, 5056, 1, 3328, 4, 4, 4, 5056]
    - [6, 0.0]
  - - [2944, 128, 1, 256, 2944, 2944, 2944, 128]
    - [3, 0.0]
  - - [64, 5888, 1, 128, 64, 64, 64, 5888]
    - [0, 1142.37]
  - - [1856, 5056, 1, 3328, 1856, 1856, 1856, 5056]
    - [3, 0.0]
  - - [4288, 448, 1, 256, 4288, 4288, 4288, 448]
    - [3, 0.0]
  - - [448, 704, 1, 3328, 448, 448, 448, 704]
    - [3, 0.0]
  - - [5888, 1024, 1, 3328, 5888, 5888, 5888, 1024]
    - [3, 0.0]
  - - [4288, 1856, 1, 1792, 4288, 4288, 4288, 1856]
    - [3, 0.0]
  - - [1408, 5056, 1, 3328, 1408, 1408, 1408, 5056]
    - [3, 0.0]
  - - [256, 256, 1, 768, 256, 256, 256, 256]
    - [3, 0.0]
  - - [2368, 1856, 1, 768, 2368, 2368, 2368, 1856]
    - [3, 0.0]
  - - [64, 1024, 1, 1792, 64, 64, 64, 1024]
    - [3, 0.0]
  - - [6784, 4288, 1, 128, 6784, 6784, 6784, 4288]
    - [0, 3765.83]
  - - [3584, 4, 1, 1792, 3584, 3584, 3584, 4]
    - [6, 0.0]
  - - [2368, 256, 1, 256, 2368, 2368, 2368, 256]
    - [3, 0.0]
  - - [1408, 5888, 1, 256, 1408, 1408, 1408, 5888]
    - [3, 0.0]
  - - [3584, 128, 1, 1792, 3584, 3584, 3584, 128]
    - [3, 0.0]
  - - [4288, 64, 1, 3328, 4288, 4288, 4288, 64]
    - [3, 0.0]
  - - [4288, 2944, 1, 3328, 4288, 4288, 4288, 2944]
    - [3, 0.0]
  - - [1856, 2368, 1, 3328, 1856, 1856, 1856, 2368]
    - [3, 0.0]
  - - [448, 1408, 1, 1792, 448, 448, 448, 1408]
    - [3, 0.0]
  - - [5056, 256, 1, 256, 5056, 5056, 5056, 256]
    - [3, 0.0]
  - - [64, 4288, 1, 256, 64, 64, 64, 4288]
    - [3, 0.0]
  - - [256, 1856, 1, 768, 256, 256, 256, 1856]
    - [3, 0.0]
  - - [5056, 1408, 1, 3328, 5056, 5056, 5056, 1408]
    - [3, 0.0]
  - - [2368, 2368, 1, 3328, 2368, 2368, 2368, 2368]
    - [3, 0.0]
  - - [2944, 6784, 1, 128, 2944, 2944, 2944, 6784]
    - [0, 3794.94]
  - - [5056, 1024, 1, 3328, 5056, 5056, 5056, 1024]
    - [3, 0.0]
  - - [2368, 3584, 1, 768, 2368, 2368, 2368, 3584]
    - [3, 0.0]
  - - [448, 5888, 1, 128, 448, 448, 448, 5888]
    - [0, 2933.13]
  - - [5888, 1408, 1, 3328, 5888, 5888, 5888, 1408]
    - [3, 0.0]
  - - [704, 2368, 1, 3328, 704, 704, 704, 2368]
    - [3, 0.0]
  - - [5888, 4288, 1, 3328, 5888, 5888, 5888, 4288]
    - [3, 0.0]
  - - [1408, 2368, 1, 3328, 1408, 1408, 1408, 2368]
    - [3, 0.0]
  - - [704, 4288, 1, 768, 704, 704, 704, 4288]
    - [3, 0.0]
  - - [5056, 5056, 1, 256, 5056, 5056, 5056, 5056]
    - [3, 0.0]
  - - [448, 128, 1, 3328, 448, 448, 448, 128]
    - [3, 0.0]
  - - [128, 448, 1, 1792, 128, 128, 128, 448]
    - [3, 0.0]
  - - [1408, 4, 1, 3328, 1408, 1408, 1408, 4]
    - [6, 0.0]
  - - [128, 64, 1, 768, 128, 128, 128, 64]
    - [3, 0.0]
  - - [4, 448, 1, 256, 4, 4, 4, 448]
    - [6, 0.0]
  - - [1024, 3584, 1, 3328, 1024, 1024, 1024, 3584]
    - [3, 0.0]
  - - [1856, 4288, 1, 768, 1856, 1856, 1856, 4288]
    - [3, 0.0]
  - - [1024, 4, 1, 768, 1024, 1024, 1024, 4]
    - [6, 0.0]
  - - [5056, 704, 1, 256, 5056, 5056, 5056, 704]
    - [3, 0.0]
  - - [4, 448, 1, 768, 4, 4, 4, 448]
    - [6, 0.0]
  - - [256, 128, 1, 256, 256, 256, 256, 128]
    - [3, 0.0]
  - - [1856, 448, 1, 256, 1856, 1856, 1856, 448]
    - [3, 0.0]
  - - [64, 1408, 1, 1792, 64, 64, 64, 1408]
    - [3, 0.0]
  - - [4, 2944, 1, 128, 4, 4, 4, 2944]
    - [5, 62.4191]
  - - [64, 704, 1, 1792, 64, 64, 64, 704]
    - [3, 0.0]
  - - [4288, 6784, 1, 768, 4288, 4288, 4288, 6784]
    - [3, 0.0]
  - - [5888, 256, 1, 256, 5888, 5888, 5888, 256]
    - [3, 0.0]
  - - [1856, 4, 1, 768, 1856, 1856, 1856, 4]
    - [6, 0.0]
  - - [448, 4288, 1, 768, 448, 448, 448, 4288]
    - [3, 0.0]
  - - [5056, 5056, 1, 768, 5056, 5056, 5056, 5056]
    - [3, 0.0]
  - - [3584, 64, 1, 256, 3584, 3584, 3584, 64]
    - [3, 0.0]
  - - [704, 256, 1, 128, 704, 704, 704, 256]
    - [0, 802.64]
  - - [256, 4, 1, 1792, 256, 256, 256, 4]
    - [6, 0.0]
  - - [128, 2944, 1, 256, 128, 128, 128, 2944]
    - [3, 0.0]
  - - [6784, 704, 1, 768, 6784, 6784, 6784, 704]
    - [3, 0.0]
  - - [1408, 64, 1, 1792, 1408, 1408, 1408, 64]
    - [3, 0.0]
  - - [2368, 4, 1, 3328, 2368, 2368, 2368, 4]
    - [6, 0.0]
  - - [64, 704, 1, 128, 64, 64, 64, 704]
    - [0, 201.178]
  - - [704, 2368, 1, 256, 704, 704, 704, 2368]
    - [3, 0.0]
  - - [1024, 704, 1, 256, 1024, 1024, 1024, 704]
    - [3, 0.0]
  - - [128, 128, 1, 3328, 128, 128, 128, 128]
    - [3, 0.0]
  - - [704, 1856, 1, 3328, 704, 704, 704, 1856]
    - [3, 0.0]
  - - [2944, 3584, 1, 128, 2944, 2944, 2944, 3584]
    - [2, 3474.14]
  - - [64, 5056, 1, 128, 64, 64, 64, 5056]
    - [0, 986.137]
  - - [2944, 2368, 1, 128, 2944, 2944, 2944, 2368]
    - [0, 3510.01]
  - - [1408, 1408, 1, 768, 1408, 1408, 1408, 1408]
    - [3, 0.0]
  - - [1024, 128, 1, 256, 1024, 1024, 1024, 128]
    - [3, 0.0]
  - - [3584, 1024, 1, 3328, 3584, 3584, 3584, 1024]
    - [3, 0.0]
  - - [6784, 448, 1, 128, 6784, 6784, 6784, 448]
    - [0, 2927.36]
  - - [1024, 4, 1, 128, 1024, 1024, 1024, 4]
    - [4, 21.3829]
  - - [128, 2368, 1, 768, 128, 128, 128, 2368]
    - [3, 0.0]
  - - [6784, 1024, 1, 1792, 6784, 6784, 6784, 1024]
    - [3, 0.0]
  - - [256, 6784, 1, 128, 256, 256, 256, 6784]
    - [2, 2246.24]
  - - [4, 4288, 1, 128, 4, 4, 4, 4288]
    - [5, 89.8121]
  - - [1024, 704, 1, 768, 1024, 1024, 1024, 704]
    - [3, 0.0]
  - - [2368, 128, 1, 128, 2368, 2368, 2368, 128]
    - [0, 1098.02]
  - - [1856, 4, 1, 3328, 1856, 1856, 1856, 4]
    - [6, 0.0]
  - - [5056, 3584, 1, 256, 5056, 5056, 5056, 3584]
    - [3, 0.0]
  - - [1408, 4, 1, 1792, 1408, 1408, 1408, 4]
    - [6, 0.0]
  - - [4, 256, 1, 1792, 4, 4, 4, 256]
    - [6, 0.0]
  - - [5056, 5888, 1, 256, 5056, 5056, 5056, 5888]
    - [3, 0.0]
  - - [1408, 1856, 1, 1792, 1408, 1408, 1408, 1856]
    - [3, 0.0]
  - - [4288, 64, 1, 1792, 4288, 4288, 4288, 64]
    - [3, 0.0]
  - - [2944, 448, 1, 1792, 2944, 2944, 2944, 448]
    - [3, 0.0]
  - - [128, 4288, 1, 768, 128, 128, 128, 4288]
    - [3, 0.0]
  - - [5888, 5888, 1, 128, 5888, 5888, 5888, 5888]
    - [2, 3755.87]
  - - [3584, 256, 1, 768, 3584, 3584, 3584, 256]
    - [3, 0.0]
  - - [6784, 1024, 1, 3328, 6784, 6784, 6784, 1024]
    - [3, 0.0]
  - - [1856, 3584, 1, 128, 1856, 1856, 1856, 3584]
    - [0, 3396.65]
  - - [2944, 4, 1, 768, 2944, 2944, 2944, 4]
    - [6, 0.0]
  - - [4, 128, 1, 3328, 4, 4, 4, 128]
    - [6, 0.0]
  - - [5056, 704, 1, 768, 5056, 5056, 5056, 704]
    - [3, 0.0]
  - - [1024, 4288, 1, 768, 1024, 1024, 1024, 4288]
    - [3, 0.0]
  - - [2368, 5056, 1, 1792, 2368, 2368, 2368, 5056]
    - [3, 0.0]
  - - [3584, 5888, 1, 768, 3584, 3584, 3584, 5888]
    - [3, 0.0]
  - - [5888, 4, 1, 256, 5888, 5888, 5888, 4]
    - [6, 0.0]
  - - [64, 2944, 1, 768, 64, 64, 64, 2944]
    - [3, 0.0]
  - - [5888, 3584, 1, 256, 5888, 5888, 5888, 3584]
    - [3, 0.0]
  - - [1408, 1024, 1, 256, 1408, 1408, 1408, 1024]
    - [3, 0.0]
  - - [5888, 5888, 1, 3328, 5888, 5888, 5888, 5888]
    - [3, 0.0]
  - - [2368, 4, 1, 1792, 2368, 2368, 2368, 4]
    - [6, 0.0]
  - - [5056, 128, 1, 256, 5056, 5056, 5056, 128]
    - [3, 0.0]
  - - [5056, 5056, 1, 3328, 5056, 5056, 5056, 5056]
    - [3, 0.0]
  - - [2944, 4288, 1, 256, 2944, 2944, 2944, 4288]
    - [3, 0.0]
  - - [4288, 256, 1, 128, 4288, 4288, 4288, 256]
    - [0, 2162.88]
  - - [4288, 6784, 1, 3328, 4288, 4288, 4288, 6784]
    - [3, 0.0]
  - - [1856, 1408, 1, 3328, 1856, 1856, 1856, 1408]
    - [3, 0.0]
  - - [1408, 1408, 1, 128, 1408, 1408, 1408, 1408]
    - [0, 2749.31]
  - - [704, 128, 1, 1792, 704, 704, 704, 128]
    - [3, 0.0]
  - - [1024, 256, 1, 3328, 1024, 1024, 1024, 256]
    - [3, 0.0]
  - - [1024, 5056, 1, 128, 1024, 1024, 1024, 5056]
    - [2, 3106.35]
  - - [1024, 64, 1, 256, 1024, 1024, 1024, 64]
    - [3, 0.0]
  - - [3584, 2368, 1, 128, 3584, 3584, 3584, 2368]
    - [2, 3364.33]
  - - [2368, 6784, 1, 256, 2368, 2368, 2368, 6784]
    - [3, 0.0]
  - - [1856, 5888, 1, 3328, 1856, 1856, 1856, 5888]
    - [3, 0.0]
  - - [5888, 128, 1, 256, 5888, 5888, 5888, 128]
    - [3, 0.0]
  - - [1024, 5888, 1, 1792, 1024, 1024, 1024, 5888]
    - [3, 0.0]
  - - [256, 704, 1, 128, 256, 256, 256, 704]
    - [0, 661.192]
  - - [4, 5888, 1, 768, 4, 4, 4, 5888]
    - [6, 0.0]
  - - [128, 5888, 1, 1792, 128, 128, 128, 5888]
    - [3, 0.0]
  - - [1024, 2944, 1, 768, 1024, 1024, 1024, 2944]
    - [3, 0.0]
  - - [1024, 1408, 1, 1792, 1024, 1024, 1024, 1408]
    - [3, 0.0]
  - - [64, 256, 1, 768, 64, 64, 64, 256]
    - [3, 0.0]
  - - [1856, 1024, 1, 3328, 1856, 1856, 1856, 1024]
    - [3, 0.0]
  - - [4288, 4288, 1, 128, 4288, 4288, 4288, 4288]
    - [0, 3804.58]
  - - [3584, 2944, 1, 3328, 3584, 3584, 3584, 2944]
    - [3, 0.0]
  - - [2368, 64, 1, 3328, 2368, 2368, 2368, 64]
    - [3, 0.0]
  - - [3584, 6784, 1, 3328, 3584, 3584, 3584, 6784]
    - [3, 0.0]
  - - [64, 128, 1, 256, 64, 64, 64, 128]
    - [3, 0.0]
  - - [3584, 1856, 1, 1792, 3584, 3584, 3584, 1856]
    - [3, 0.0]
  - - [5888, 5056, 1, 128, 5888, 5888, 5888, 5056]
    - [2, 3717.11]
  - - [5888, 64, 1, 1792, 5888, 5888, 5888, 64]
    - [3, 0.0]
  - - [6784, 256, 1, 256, 6784, 6784, 6784, 256]
    - [3, 0.0]
  - - [2944, 5056, 1, 768, 2944, 2944, 2944, 5056]
    - [3, 0.0]
  - - [128, 6784, 1, 128, 128, 128, 128, 6784]
    - [1, 1812.18]
  - - [5056, 256, 1, 128, 5056, 5056, 5056, 256]
    - [0, 2433.71]
  - - [1856, 6784, 1, 1792, 1856, 1856, 1856, 6784]
    - [3, 0.0]
  - - [4288, 256, 1, 1792, 4288, 4288, 4288, 256]
    - [3, 0.0]
  - - [1408, 3584, 1, 768, 1408, 1408, 1408, 3584]
    - [3, 0.0]
  - - [3584, 1408, 1, 256, 3584, 3584, 3584, 1408]
    - [3, 0.0]
  - - [6784, 448, 1, 256, 6784, 6784, 6784, 448]
    - [3, 0.0]
  - - [1024, 1408, 1, 256, 1024, 1024, 1024, 1408]
    - [3, 0.0]
  - - [256, 4, 1, 256, 256, 256, 256, 4]
    - [6, 0.0]
  - - [1024, 704, 1, 3328, 1024, 1024, 1024, 704]
    - [3, 0.0]
  - - [5888, 4288, 1, 768, 5888, 5888, 5888, 4288]
    - [3, 0.0]
  - - [4288, 64, 1, 256, 4288, 4288, 4288, 64]
    - [3, 0.0]
  - - [704, 1856, 1, 1792, 704, 704, 704, 1856]
    - [3, 0.0]
  - - [64, 4, 1, 3328, 64, 64, 64, 4]
    - [6, 0.0]
  - - [2944, 3584, 1, 1792, 2944, 2944, 2944, 3584]
    - [3, 0.0]
  - - [2368, 256, 1, 128, 2368, 2368, 2368, 256]
    - [0, 1670.66]
  - - [2944, 6784, 1, 3328, 2944, 2944, 2944, 6784]
    - [3, 0.0]
  - - [1408, 128, 1, 128, 1408, 1408, 1408, 128]
    - [0, 796.474]
  - - [448, 2368, 1, 128, 448, 448, 448, 2368]
    - [0, 2126.61]
  - - [64, 5056, 1, 256, 64, 64, 64, 5056]
    - [3, 0.0]
  - - [3584, 704, 1, 1792, 3584, 3584, 3584, 704]
    - [3, 0.0]
  - - [704, 4, 1, 1792, 704, 704, 704, 4]
    - [6, 0.0]
  - - [1024, 1024, 1, 128, 1024, 1024, 1024, 1024]
    - [2, 2051.98]
  - - [2944, 5888, 1, 256, 2944, 2944, 2944, 5888]
    - [3, 0.0]
  - - [2368, 5056, 1, 128, 2368, 2368, 2368, 5056]
    - [0, 3720.91]
  - - [256, 1024, 1, 3328, 256, 256, 256, 1024]
    - [3, 0.0]
  - - [3584, 2944, 1, 128, 3584, 3584, 3584, 2944]
    - [2, 3476.79]
  - - [4288, 1024, 1, 1792, 4288, 4288, 4288, 1024]
    - [3, 0.0]
  - - [1856, 2944, 1, 768, 1856, 1856, 1856, 2944]
    - [3, 0.0]
  - - [3584, 128, 1, 768, 3584, 3584, 3584, 128]
    - [3, 0.0]
  - - [2368, 6784, 1, 768, 2368, 2368, 2368, 6784]
    - [3, 0.0]
  - - [5056, 128, 1, 768, 5056, 5056, 5056, 128]
    - [3, 0.0]
  - - [1024, 2368, 1, 256, 1024, 1024, 1024, 2368]
    - [3, 0.0]
  - - [1408, 4288, 1, 128, 1408, 1408, 1408, 4288]
    - [0, 3435.17]
  - - [2944, 1408, 1, 1792, 2944, 2944, 2944, 1408]
    - [3, 0.0]
  - - [64, 1024, 1, 128, 64, 64, 64, 1024]
    - [0, 284.533]
  - - [5888, 448, 1, 256, 5888, 5888, 5888, 448]
    - [3, 0.0]
  - - [5056, 2368, 1, 1792, 5056, 5056, 5056, 2368]
    - [3, 0.0]
  - - [64, 2368, 1, 768, 64, 64, 64, 2368]
    - [3, 0.0]
  - - [256, 128, 1, 3328, 256, 256, 256, 128]
    - [3, 0.0]
  - - [1408, 6784, 1, 3328, 1408, 1408, 1408, 6784]
    - [3, 0.0]
  - - [6784, 1856, 1, 3328, 6784, 6784, 6784, 1856]
    - [3, 0.0]
  - - [704, 704, 1, 256, 704, 704, 704, 704]
    - [3, 0.0]
  - - [5888, 4288, 1, 128, 5888, 5888, 5888, 4288]
    - [2, 3695.04]
  - - [2368, 256, 1, 1792, 2368, 2368, 2368, 256]
    - [3, 0.0]
  - - [1856, 2368, 1, 1792, 1856, 1856, 1856, 2368]
    - [3, 0.0]
  - - [1024, 1408, 1, 128, 1024, 1024, 1024, 1408]
    - [2, 2332.75]
  - - [4, 64, 1, 3328, 4, 4, 4, 64]
    - [6, 0.0]
  - - [1408, 4288, 1, 1792, 1408, 1408, 1408, 4288]
    - [3, 0.0]
  - - [64, 4288, 1, 3328, 64, 64, 64, 4288]
    - [3, 0.0]
  - - [64, 448, 1, 3328, 64, 64, 64, 448]
    - [3, 0.0]
  - - [128, 1024, 1, 1792, 128, 128, 128, 1024]
    - [3, 0.0]
  - - [1856, 64, 1, 256, 1856, 1856, 1856, 64]
    - [3, 0.0]
  - - [3584, 64, 1, 1792, 3584, 3584, 3584, 64]
    - [3, 0.0]
  - - [64, 1024, 1, 768, 64, 64, 64, 1024]
    - [3, 0.0]
  - - [448, 704, 1, 256, 448, 448, 448, 704]
    - [3, 0.0]
  - - [448, 3584, 1, 768, 448, 448, 448, 3584]
    - [3, 0.0]
  - - [3584, 5056, 1, 256, 3584, 3584, 3584, 5056]
    - [3, 0.0]
  - - [128, 1408, 1, 3328, 128, 128, 128, 1408]
    - [3, 0.0]
  - - [448, 4, 1, 1792, 448, 448, 448, 4]
    - [6, 0.0]
  - - [4, 5888, 1, 128, 4, 4, 4, 5888]
    - [5, 118.996]
  - - [6784, 704, 1, 3328, 6784, 6784, 6784, 704]
    - [3, 0.0]
  - - [1024, 448, 1, 768, 1024, 1024, 1024, 448]
    - [3, 0.0]
  - - [5056, 6784, 1, 128, 5056, 5056, 5056, 6784]
    - [0, 3878.87]
  - - [5056, 1408, 1, 768, 5056, 5056, 5056, 1408]
    - [3, 0.0]
  - - [256, 64, 1, 1792, 256, 256, 256, 64]
    - [3, 0.0]
  - - [448, 5056, 1, 256, 448, 448, 448, 5056]
    - [3, 0.0]
  - - [2368, 448, 1, 1792, 2368, 2368, 2368, 448]
    - [3, 0.0]
  - - [64, 1856, 1, 128, 64, 64, 64, 1856]
    - [0, 524.949]
  - - [1024, 704, 1, 128, 1024, 1024, 1024, 704]
    - [2, 1458.65]
  - - [704, 128, 1, 128, 704, 704, 704, 128]
    - [0, 386.378]
  - - [5056, 448, 1, 3328, 5056, 5056, 5056, 448]
    - [3, 0.0]
  - - [3584, 256, 1, 256, 3584, 3584, 3584, 256]
    - [3, 0.0]
  - - [4288, 1024, 1, 256, 4288, 4288, 4288, 1024]
    - [3, 0.0]
  - - [4288, 256, 1, 256, 4288, 4288, 4288, 256]
    - [3, 0.0]
  - - [64, 5888, 1, 256, 64, 64, 64, 5888]
    - [3, 0.0]
  - - [6784, 64, 1, 768, 6784, 6784, 6784, 64]
    - [3, 0.0]
  - - [6784, 6784, 1, 3328, 6784, 6784, 6784, 6784]
    - [3, 0.0]
  - - [1408, 2944, 1, 1792, 1408, 1408, 1408, 2944]
    - [3, 0.0]
  - - [5888, 448, 1, 128, 5888, 5888, 5888, 448]
    - [0, 2612.08]
  - - [1408, 5888, 1, 3328, 1408, 1408, 1408, 5888]
    - [3, 0.0]
  - - [4, 3584, 1, 1792, 4, 4, 4, 3584]
    - [6, 0.0]
  - - [448, 2368, 1, 768, 448, 448, 448, 2368]
    - [3, 0.0]
  - - [448, 128, 1, 128, 448, 448, 448, 128]
    - [0, 250.86]
  - - [2944, 704, 1, 256, 2944, 2944, 2944, 704]
    - [3, 0.0]
  - - [4, 5056, 1, 1792, 4, 4, 4, 5056]
    - [6, 0.0]
  - - [5056, 2944, 1, 1792, 5056, 5056, 5056, 2944]
    - [3, 0.0]
  - - [1024, 3584, 1, 768, 1024, 1024, 1024, 3584]
    - [3, 0.0]
  - - [4, 256, 1, 3328, 4, 4, 4, 256]
    - [6, 0.0]
  - - [448, 5056, 1, 1792, 448, 448, 448, 5056]
    - [3, 0.0]
  - - [5056, 448, 1, 128, 5056, 5056, 5056, 448]
    - [0, 2884.3]
  - - [2368, 4288, 1, 768, 2368, 2368, 2368, 4288]
    - [3, 0.0]
  - - [3584, 704, 1, 128, 3584, 3584, 3584, 704]
    - [1, 2461.82]
  - - [4, 1408, 1, 768, 4, 4, 4, 1408]
    - [6, 0.0]
  - - [1856, 1024, 1, 768, 1856, 1856, 1856, 1024]
    - [3, 0.0]
  - - [6784, 5888, 1, 1792, 6784, 6784, 6784, 5888]
    - [3, 0.0]
  - - [5056, 1856, 1, 128, 5056, 5056, 5056, 1856]
    - [0, 3640.58]
  - - [3584, 5056, 1, 768, 3584, 3584, 3584, 5056]
    - [3, 0.0]
  - - [3584, 2368, 1, 3328, 3584, 3584, 3584, 2368]
    - [3, 0.0]
  - - [6784, 2368, 1, 768, 6784, 6784, 6784, 2368]
    - [3, 0.0]
  - - [5056, 704, 1, 128, 5056, 5056, 5056, 704]
    - [0, 3191.78]
  - - [3584, 3584, 1, 256, 3584, 3584, 3584, 3584]
    - [3, 0.0]
  - - [704, 5888, 1, 3328, 704, 704, 704, 5888]
    - [3, 0.0]
  - - [128, 4, 1, 3328, 128, 128, 128, 4]
    - [6, 0.0]
  - - [5888, 128, 1, 3328, 5888, 5888, 5888, 128]
    - [3, 0.0]
  - - [5056, 128, 1, 128, 5056, 5056, 5056, 128]
    - [0, 1736.47]
  - - [2368, 4, 1, 768, 2368, 2368, 2368, 4]
    - [6, 0.0]
  - - [5888, 1856, 1, 1792, 5888, 5888, 5888, 1856]
    - [3, 0.0]
  - - [2368, 2368, 1, 768, 2368, 2368, 2368, 2368]
    - [3, 0.0]
  - - [1856, 2368, 1, 768, 1856, 1856, 1856, 2368]
    - [3, 0.0]
  - - [2944, 1408, 1, 128, 2944, 2944, 2944, 1408]
    - [0, 3260.22]
- null
