HostLibraryTests/configs/lite_configs_mixed/vega10_Cijk_Alik_Bljk_SB.yaml
- {MinimumRequiredVersion: 4.9.5}
- vega10
- gfx900
- [Device 6863, Device 6862, Device 687f, Device 6860, Device 6861, 'Vega 10 XTX [Radeon
    SolutionIndex: 0
    SolutionNameMin: Cijk_Alik_Bljk_SB_MT32x32x8_SE_AMAS2_GRVW4_GSU1_VW4
    SolutionIndex: 1
    SolutionNameMin: Cijk_Alik_Bljk_SB_MT64x128x16_SE_AMAS2_GRVW4_GSU1_VW4
    SolutionIndex: 2
    SolutionNameMin: Cijk_Alik_Bljk_SB_MT64x64x32_SE_AMAS2_GRVW4_GSU1_VW4
    SolutionIndex: 3
    SolutionNameMin: Cijk_Alik_Bljk_SB_MT128x64x16_SE_AMAS2_GRVW4_GSU1_VW4
    SolutionIndex: 4
    SolutionNameMin: Cijk_Alik_Bljk_SB_MT64x32x16_SE_AMAS2_GRVW4_GSU1_VW4
    SolutionIndex: 5
    SolutionNameMin: Cijk_Alik_Bljk_SB_MT64x32x16_SE_AMAS1_GRVW1_GSU1_VW1
    SolutionIndex: 6
    SolutionNameMin: Cijk_Alik_Bljk_SB_MT16x16x4_SE_AMAS2_GRVW2_GSU1_VW2
    SolutionIndex: 7
    SolutionNameMin: Cijk_Alik_Bljk_SB_MT16x16x4_SE_AMAS0_GRVW1_GSU1_VW1
    SolutionIndex: 8
    SolutionNameMin: Cijk_Alik_Bljk_SB_MT8x8x8_SE_AMAS3_GRVW2_GSU2_VW2
- - - [6784, 448, 1, 256, 6784, 6784, 256, 256]
    - [5, 0.0]
  - - [704, 5888, 1, 1792, 704, 704, 1792, 1792]
    - [5, 0.0]
  - - [256, 6784, 1, 256, 256, 256, 256, 256]
    - [5, 0.0]
  - - [704, 448, 1, 3328, 704, 704, 3328, 3328]
    - [5, 0.0]
  - - [64, 128, 1, 3328, 64, 64, 3328, 3328]
    - [5, 0.0]
  - - [704, 1856, 1, 768, 704, 704, 768, 768]
    - [5, 0.0]
  - - [4, 3584, 1, 128, 4, 4, 128, 128]
    - [6, 81.4871]
  - - [5056, 1856, 1, 128, 5056, 5056, 128, 128]
    - [1, 3252.13]
  - - [5056, 6784, 1, 768, 5056, 5056, 768, 768]
    - [5, 0.0]
  - - [704, 2944, 1, 3328, 704, 704, 3328, 3328]
    - [5, 0.0]
  - - [256, 1024, 1, 256, 256, 256, 256, 256]
    - [5, 0.0]
  - - [128, 4, 1, 128, 128, 128, 128, 128]
    - [6, 3.26472]
  - - [2944, 2368, 1, 128, 2944, 2944, 128, 128]
    - [1, 2992.88]
  - - [128, 2944, 1, 128, 128, 128, 128, 128]
    - [0, 1107.4]
  - - [2944, 1408, 1, 768, 2944, 2944, 768, 768]
    - [5, 0.0]
  - - [64, 3584, 1, 256, 64, 64, 256, 256]
    - [5, 0.0]
  - - [704, 4, 1, 1792, 704, 704, 1792, 1792]
    - [8, 0.0]
  - - [1408, 128, 1, 3328, 1408, 1408, 3328, 3328]
    - [5, 0.0]
  - - [2368, 2944, 1, 768, 2368, 2368, 768, 768]
    - [5, 0.0]
  - - [3584, 1024, 1, 256, 3584, 3584, 256, 256]
    - [5, 0.0]
  - - [448, 128, 1, 768, 448, 448, 768, 768]
    - [5, 0.0]
  - - [6784, 4288, 1, 128, 6784, 6784, 128, 128]
    - [1, 3462.81]
  - - [128, 128, 1, 1792, 128, 128, 1792, 1792]
    - [5, 0.0]
  - - [256, 4, 1, 1792, 256, 256, 1792, 1792]
    - [8, 0.0]
  - - [4288, 5888, 1, 256, 4288, 4288, 256, 256]
    - [5, 0.0]
  - - [1408, 4, 1, 128, 1408, 1408, 128, 128]
    - [6, 32.9899]
  - - [448, 128, 1, 128, 448, 448, 128, 128]
    - [0, 254.725]
  - - [5888, 5888, 1, 768, 5888, 5888, 768, 768]
    - [5, 0.0]
  - - [3584, 4, 1, 1792, 3584, 3584, 1792, 1792]
    - [8, 0.0]
  - - [1024, 2368, 1, 1792, 1024, 1024, 1792, 1792]
    - [5, 0.0]
  - - [448, 2944, 1, 3328, 448, 448, 3328, 3328]
    - [5, 0.0]
  - - [64, 256, 1, 256, 64, 64, 256, 256]
    - [5, 0.0]
  - - [1856, 128, 1, 768, 1856, 1856, 768, 768]
    - [5, 0.0]
  - - [4, 6784, 1, 3328, 4, 4, 3328, 3328]
    - [8, 0.0]
  - - [448, 2944, 1, 128, 448, 448, 128, 128]
    - [1, 2083.22]
  - - [6784, 128, 1, 3328, 6784, 6784, 3328, 3328]
    - [5, 0.0]
  - - [3584, 6784, 1, 1792, 3584, 3584, 1792, 1792]
    - [5, 0.0]
  - - [704, 128, 1, 256, 704, 704, 256, 256]
    - [5, 0.0]
  - - [1408, 4, 1, 256, 1408, 1408, 256, 256]
    - [8, 0.0]
  - - [3584, 4288, 1, 128, 3584, 3584, 128, 128]
    - [1, 3052.03]
  - - [448, 448, 1, 768, 448, 448, 768, 768]
    - [5, 0.0]
  - - [4, 1408, 1, 768, 4, 4, 768, 768]
    - [8, 0.0]
  - - [5056, 256, 1, 128, 5056, 5056, 128, 128]
    - [0, 2092.21]
  - - [1856, 5056, 1, 3328, 1856, 1856, 3328, 3328]
    - [5, 0.0]
  - - [5056, 704, 1, 3328, 5056, 5056, 3328, 3328]
    - [5, 0.0]
  - - [4288, 448, 1, 1792, 4288, 4288, 1792, 1792]
    - [5, 0.0]
  - - [128, 1024, 1, 768, 128, 128, 768, 768]
    - [5, 0.0]
  - - [256, 2944, 1, 256, 256, 256, 256, 256]
    - [5, 0.0]
  - - [2368, 64, 1, 3328, 2368, 2368, 3328, 3328]
    - [5, 0.0]
  - - [1024, 704, 1, 3328, 1024, 1024, 3328, 3328]
    - [5, 0.0]
  - - [704, 1024, 1, 768, 704, 704, 768, 768]
    - [5, 0.0]
  - - [2944, 256, 1, 1792, 2944, 2944, 1792, 1792]
    - [5, 0.0]
  - - [2944, 256, 1, 3328, 2944, 2944, 3328, 3328]
    - [5, 0.0]
  - - [6784, 64, 1, 1792, 6784, 6784, 1792, 1792]
    - [5, 0.0]
  - - [64, 64, 1, 768, 64, 64, 768, 768]
    - [5, 0.0]
  - - [4288, 2944, 1, 768, 4288, 4288, 768, 768]
    - [5, 0.0]
  - - [64, 2368, 1, 768, 64, 64, 768, 768]
    - [5, 0.0]
  - - [3584, 704, 1, 1792, 3584, 3584, 1792, 1792]
    - [5, 0.0]
  - - [1408, 3584, 1, 128, 1408, 1408, 128, 128]
    - [1, 2882.58]
  - - [1408, 5056, 1, 3328, 1408, 1408, 3328, 3328]
    - [5, 0.0]
  - - [1856, 1856, 1, 256, 1856, 1856, 256, 256]
    - [5, 0.0]
  - - [1024, 4288, 1, 1792, 1024, 1024, 1792, 1792]
    - [5, 0.0]
  - - [2944, 1408, 1, 3328, 2944, 2944, 3328, 3328]
    - [5, 0.0]
  - - [4288, 5888, 1, 3328, 4288, 4288, 3328, 3328]
    - [5, 0.0]
  - - [448, 704, 1, 256, 448, 448, 256, 256]
    - [5, 0.0]
  - - [3584, 4288, 1, 1792, 3584, 3584, 1792, 1792]
    - [5, 0.0]
  - - [3584, 256, 1, 3328, 3584, 3584, 3328, 3328]
    - [5, 0.0]
  - - [6784, 256, 1, 768, 6784, 6784, 768, 768]
    - [5, 0.0]
  - - [2368, 1856, 1, 3328, 2368, 2368, 3328, 3328]
    - [5, 0.0]
  - - [3584, 3584, 1, 256, 3584, 3584, 256, 256]
    - [5, 0.0]
  - - [4288, 1408, 1, 768, 4288, 4288, 768, 768]
    - [5, 0.0]
  - - [448, 1856, 1, 1792, 448, 448, 1792, 1792]
    - [5, 0.0]
  - - [2368, 6784, 1, 256, 2368, 2368, 256, 256]
    - [5, 0.0]
  - - [448, 704, 1, 1792, 448, 448, 1792, 1792]
    - [5, 0.0]
  - - [6784, 4, 1, 768, 6784, 6784, 768, 768]
    - [8, 0.0]
  - - [5888, 1408, 1, 128, 5888, 5888, 128, 128]
    - [1, 2921.16]
  - - [5056, 5888, 1, 256, 5056, 5056, 256, 256]
    - [5, 0.0]
  - - [256, 5888, 1, 768, 256, 256, 768, 768]
    - [5, 0.0]
  - - [2944, 6784, 1, 3328, 2944, 2944, 3328, 3328]
    - [5, 0.0]
  - - [64, 64, 1, 128, 64, 64, 128, 128]
    - [2, 14.7762]
  - - [2944, 704, 1, 1792, 2944, 2944, 1792, 1792]
    - [5, 0.0]
  - - [3584, 5056, 1, 256, 3584, 3584, 256, 256]
    - [5, 0.0]
  - - [1024, 1856, 1, 3328, 1024, 1024, 3328, 3328]
    - [5, 0.0]
  - - [2368, 1408, 1, 128, 2368, 2368, 128, 128]
    - [1, 2734.36]
  - - [3584, 128, 1, 768, 3584, 3584, 768, 768]
    - [5, 0.0]
  - - [128, 1856, 1, 128, 128, 128, 128, 128]
    - [0, 867.89]
  - - [5056, 64, 1, 1792, 5056, 5056, 1792, 1792]
    - [5, 0.0]
  - - [5888, 6784, 1, 3328, 5888, 5888, 3328, 3328]
    - [5, 0.0]
  - - [1856, 3584, 1, 3328, 1856, 1856, 3328, 3328]
    - [5, 0.0]
  - - [2368, 1856, 1, 128, 2368, 2368, 128, 128]
    - [1, 3014.86]
  - - [5888, 5056, 1, 768, 5888, 5888, 768, 768]
    - [5, 0.0]
  - - [1408, 4288, 1, 256, 1408, 1408, 256, 256]
    - [5, 0.0]
  - - [4288, 4, 1, 256, 4288, 4288, 256, 256]
    - [8, 0.0]
  - - [2368, 64, 1, 1792, 2368, 2368, 1792, 1792]
    - [5, 0.0]
  - - [256, 704, 1, 1792, 256, 256, 1792, 1792]
    - [5, 0.0]
  - - [1856, 448, 1, 256, 1856, 1856, 256, 256]
    - [5, 0.0]
  - - [1856, 704, 1, 1792, 1856, 1856, 1792, 1792]
    - [5, 0.0]
  - - [5056, 256, 1, 256, 5056, 5056, 256, 256]
    - [5, 0.0]
  - - [64, 256, 1, 768, 64, 64, 768, 768]
    - [5, 0.0]
  - - [1408, 2944, 1, 128, 1408, 1408, 128, 128]
    - [1, 2891.68]
  - - [448, 5888, 1, 128, 448, 448, 128, 128]
    - [1, 2659.32]
  - - [1024, 64, 1, 3328, 1024, 1024, 3328, 3328]
    - [5, 0.0]
  - - [128, 128, 1, 256, 128, 128, 256, 256]
    - [5, 0.0]
  - - [5888, 1408, 1, 256, 5888, 5888, 256, 256]
    - [5, 0.0]
  - - [2944, 4288, 1, 3328, 2944, 2944, 3328, 3328]
    - [5, 0.0]
  - - [704, 1024, 1, 1792, 704, 704, 1792, 1792]
    - [5, 0.0]
  - - [1856, 4, 1, 3328, 1856, 1856, 3328, 3328]
    - [8, 0.0]
  - - [128, 3584, 1, 768, 128, 128, 768, 768]
    - [5, 0.0]
  - - [4288, 1856, 1, 3328, 4288, 4288, 3328, 3328]
    - [5, 0.0]
  - - [448, 6784, 1, 256, 448, 448, 256, 256]
    - [5, 0.0]
  - - [5056, 1024, 1, 768, 5056, 5056, 768, 768]
    - [5, 0.0]
  - - [6784, 704, 1, 256, 6784, 6784, 256, 256]
    - [5, 0.0]
  - - [5056, 448, 1, 1792, 5056, 5056, 1792, 1792]
    - [5, 0.0]
  - - [128, 5056, 1, 128, 128, 128, 128, 128]
    - [0, 1553.18]
  - - [5056, 2944, 1, 768, 5056, 5056, 768, 768]
    - [5, 0.0]
  - - [704, 3584, 1, 1792, 704, 704, 1792, 1792]
    - [5, 0.0]
  - - [5888, 1024, 1, 128, 5888, 5888, 128, 128]
    - [1, 2784.19]
  - - [4, 4288, 1, 128, 4, 4, 128, 128]
    - [7, 91.7603]
  - - [5888, 448, 1, 1792, 5888, 5888, 1792, 1792]
    - [5, 0.0]
  - - [704, 4288, 1, 128, 704, 704, 128, 128]
    - [1, 2891.51]
  - - [1408, 704, 1, 3328, 1408, 1408, 3328, 3328]
    - [5, 0.0]
  - - [2944, 3584, 1, 3328, 2944, 2944, 3328, 3328]
    - [5, 0.0]
  - - [64, 4288, 1, 256, 64, 64, 256, 256]
    - [5, 0.0]
  - - [704, 2368, 1, 3328, 704, 704, 3328, 3328]
    - [5, 0.0]
  - - [2368, 1024, 1, 1792, 2368, 2368, 1792, 1792]
    - [5, 0.0]
  - - [4, 704, 1, 128, 4, 4, 128, 128]
    - [6, 15.954]
  - - [128, 3584, 1, 1792, 128, 128, 1792, 1792]
    - [5, 0.0]
  - - [4, 1024, 1, 1792, 4, 4, 1792, 1792]
    - [8, 0.0]
  - - [2368, 5056, 1, 1792, 2368, 2368, 1792, 1792]
    - [5, 0.0]
  - - [2368, 4288, 1, 768, 2368, 2368, 768, 768]
    - [5, 0.0]
  - - [5056, 3584, 1, 3328, 5056, 5056, 3328, 3328]
    - [5, 0.0]
  - - [1408, 1024, 1, 256, 1408, 1408, 256, 256]
    - [5, 0.0]
  - - [448, 704, 1, 768, 448, 448, 768, 768]
    - [5, 0.0]
  - - [6784, 2944, 1, 3328, 6784, 6784, 3328, 3328]
    - [5, 0.0]
  - - [704, 6784, 1, 256, 704, 704, 256, 256]
    - [5, 0.0]
  - - [2944, 2944, 1, 256, 2944, 2944, 256, 256]
    - [5, 0.0]
  - - [2368, 1856, 1, 1792, 2368, 2368, 1792, 1792]
    - [5, 0.0]
  - - [448, 6784, 1, 768, 448, 448, 768, 768]
    - [5, 0.0]
  - - [256, 3584, 1, 3328, 256, 256, 3328, 3328]
    - [5, 0.0]
  - - [5056, 704, 1, 1792, 5056, 5056, 1792, 1792]
    - [5, 0.0]
  - - [704, 5888, 1, 768, 704, 704, 768, 768]
    - [5, 0.0]
  - - [1408, 1856, 1, 768, 1408, 1408, 768, 768]
    - [5, 0.0]
  - - [128, 256, 1, 128, 128, 128, 128, 128]
    - [0, 135.137]
  - - [1024, 1856, 1, 256, 1024, 1024, 256, 256]
    - [5, 0.0]
  - - [448, 4288, 1, 1792, 448, 448, 1792, 1792]
    - [5, 0.0]
  - - [2368, 1024, 1, 256, 2368, 2368, 256, 256]
    - [5, 0.0]
  - - [4, 2368, 1, 768, 4, 4, 768, 768]
    - [8, 0.0]
  - - [64, 1408, 1, 256, 64, 64, 256, 256]
    - [5, 0.0]
  - - [6784, 256, 1, 3328, 6784, 6784, 3328, 3328]
    - [5, 0.0]
  - - [704, 448, 1, 768, 704, 704, 768, 768]
    - [5, 0.0]
  - - [2944, 4288, 1, 768, 2944, 2944, 768, 768]
    - [5, 0.0]
  - - [3584, 2368, 1, 3328, 3584, 3584, 3328, 3328]
    - [5, 0.0]
  - - [1856, 1024, 1, 3328, 1856, 1856, 3328, 3328]
    - [5, 0.0]
  - - [448, 5888, 1, 3328, 448, 448, 3328, 3328]
    - [5, 0.0]
  - - [4, 2944, 1, 1792, 4, 4, 1792, 1792]
    - [8, 0.0]
  - - [5888, 256, 1, 768, 5888, 5888, 768, 768]
    - [5, 0.0]
  - - [128, 128, 1, 768, 128, 128, 768, 768]
    - [5, 0.0]
  - - [4288, 2944, 1, 256, 4288, 4288, 256, 256]
    - [5, 0.0]
  - - [256, 2368, 1, 1792, 256, 256, 1792, 1792]
    - [5, 0.0]
  - - [5888, 1856, 1, 3328, 5888, 5888, 3328, 3328]
    - [5, 0.0]
  - - [704, 5056, 1, 768, 704, 704, 768, 768]
    - [5, 0.0]
  - - [4, 3584, 1, 768, 4, 4, 768, 768]
    - [8, 0.0]
  - - [1408, 2368, 1, 128, 1408, 1408, 128, 128]
    - [1, 2675.94]
  - - [5888, 704, 1, 1792, 5888, 5888, 1792, 1792]
    - [5, 0.0]
  - - [448, 64, 1, 1792, 448, 448, 1792, 1792]
    - [5, 0.0]
  - - [4, 1024, 1, 3328, 4, 4, 3328, 3328]
    - [8, 0.0]
  - - [3584, 2368, 1, 256, 3584, 3584, 256, 256]
    - [5, 0.0]
  - - [4288, 64, 1, 128, 4288, 4288, 128, 128]
    - [0, 937.165]
  - - [128, 4288, 1, 128, 128, 128, 128, 128]
    - [0, 1368.56]
  - - [1856, 6784, 1, 256, 1856, 1856, 256, 256]
    - [5, 0.0]
  - - [4, 64, 1, 256, 4, 4, 256, 256]
    - [8, 0.0]
  - - [3584, 5056, 1, 128, 3584, 3584, 128, 128]
    - [1, 3117.48]
  - - [4288, 1856, 1, 128, 4288, 4288, 128, 128]
    - [1, 3198.16]
  - - [5888, 2368, 1, 256, 5888, 5888, 256, 256]
    - [5, 0.0]
  - - [1856, 5056, 1, 256, 1856, 1856, 256, 256]
    - [5, 0.0]
  - - [5888, 5888, 1, 3328, 5888, 5888, 3328, 3328]
    - [5, 0.0]
  - - [6784, 1408, 1, 768, 6784, 6784, 768, 768]
    - [5, 0.0]
  - - [4, 6784, 1, 768, 4, 4, 768, 768]
    - [8, 0.0]
  - - [2368, 4, 1, 3328, 2368, 2368, 3328, 3328]
    - [8, 0.0]
  - - [128, 3584, 1, 256, 128, 128, 256, 256]
    - [5, 0.0]
  - - [4, 256, 1, 3328, 4, 4, 3328, 3328]
    - [8, 0.0]
  - - [2368, 1024, 1, 768, 2368, 2368, 768, 768]
    - [5, 0.0]
  - - [1024, 256, 1, 3328, 1024, 1024, 3328, 3328]
    - [5, 0.0]
  - - [2944, 2368, 1, 256, 2944, 2944, 256, 256]
    - [5, 0.0]
  - - [704, 5056, 1, 1792, 704, 704, 1792, 1792]
    - [5, 0.0]
  - - [64, 3584, 1, 1792, 64, 64, 1792, 1792]
    - [5, 0.0]
  - - [6784, 2944, 1, 768, 6784, 6784, 768, 768]
    - [5, 0.0]
  - - [1408, 128, 1, 768, 1408, 1408, 768, 768]
    - [5, 0.0]
  - - [6784, 2944, 1, 256, 6784, 6784, 256, 256]
    - [5, 0.0]
  - - [2944, 64, 1, 128, 2944, 2944, 128, 128]
    - [0, 683.983]
  - - [64, 4, 1, 768, 64, 64, 768, 768]
    - [8, 0.0]
  - - [2944, 5056, 1, 128, 2944, 2944, 128, 128]
    - [1, 3313.65]
  - - [64, 704, 1, 256, 64, 64, 256, 256]
    - [5, 0.0]
  - - [704, 5888, 1, 3328, 704, 704, 3328, 3328]
    - [5, 0.0]
  - - [1408, 4288, 1, 3328, 1408, 1408, 3328, 3328]
    - [5, 0.0]
  - - [2944, 3584, 1, 128, 2944, 2944, 128, 128]
    - [1, 3168.63]
  - - [4, 6784, 1, 256, 4, 4, 256, 256]
    - [8, 0.0]
  - - [5888, 64, 1, 3328, 5888, 5888, 3328, 3328]
    - [5, 0.0]
  - - [3584, 1408, 1, 768, 3584, 3584, 768, 768]
    - [5, 0.0]
  - - [4, 2944, 1, 128, 4, 4, 128, 128]
    - [6, 67.8289]
  - - [3584, 1856, 1, 128, 3584, 3584, 128, 128]
    - [1, 2788.51]
  - - [1024, 1856, 1, 768, 1024, 1024, 768, 768]
    - [5, 0.0]
  - - [5056, 2368, 1, 256, 5056, 5056, 256, 256]
    - [5, 0.0]
  - - [128, 448, 1, 1792, 128, 128, 1792, 1792]
    - [5, 0.0]
  - - [128, 256, 1, 768, 128, 128, 768, 768]
    - [5, 0.0]
  - - [2944, 448, 1, 1792, 2944, 2944, 1792, 1792]
    - [5, 0.0]
  - - [1856, 64, 1, 256, 1856, 1856, 256, 256]
    - [5, 0.0]
  - - [64, 2368, 1, 128, 64, 64, 128, 128]
    - [0, 634.088]
  - - [1024, 1408, 1, 768, 1024, 1024, 768, 768]
    - [5, 0.0]
  - - [1856, 1024, 1, 768, 1856, 1856, 768, 768]
    - [5, 0.0]
  - - [448, 1856, 1, 768, 448, 448, 768, 768]
    - [5, 0.0]
  - - [704, 448, 1, 1792, 704, 704, 1792, 1792]
    - [5, 0.0]
  - - [448, 2944, 1, 768, 448, 448, 768, 768]
    - [5, 0.0]
  - - [64, 4, 1, 1792, 64, 64, 1792, 1792]
    - [8, 0.0]
  - - [128, 704, 1, 3328, 128, 128, 3328, 3328]
    - [5, 0.0]
  - - [5888, 1408, 1, 1792, 5888, 5888, 1792, 1792]
    - [5, 0.0]
  - - [6784, 1856, 1, 256, 6784, 6784, 256, 256]
    - [5, 0.0]
  - - [2368, 2368, 1, 768, 2368, 2368, 768, 768]
    - [5, 0.0]
  - - [2368, 128, 1, 256, 2368, 2368, 256, 256]
    - [5, 0.0]
  - - [3584, 6784, 1, 3328, 3584, 3584, 3328, 3328]
    - [5, 0.0]
  - - [2368, 3584, 1, 256, 2368, 2368, 256, 256]
    - [5, 0.0]
  - - [2944, 1856, 1, 768, 2944, 2944, 768, 768]
    - [5, 0.0]
  - - [704, 2368, 1, 256, 704, 704, 256, 256]
    - [5, 0.0]
  - - [4288, 4288, 1, 3328, 4288, 4288, 3328, 3328]
    - [5, 0.0]
  - - [3584, 1856, 1, 256, 3584, 3584, 256, 256]
    - [5, 0.0]
  - - [256, 128, 1, 128, 256, 256, 128, 128]
    - [0, 135.784]
  - - [1856, 128, 1, 256, 1856, 1856, 256, 256]
    - [5, 0.0]
  - - [3584, 448, 1, 256, 3584, 3584, 256, 256]
    - [5, 0.0]
  - - [2944, 1856, 1, 3328, 2944, 2944, 3328, 3328]
    - [5, 0.0]
  - - [1024, 5056, 1, 256, 1024, 1024, 256, 256]
    - [5, 0.0]
  - - [448, 64, 1, 256, 448, 448, 256, 256]
    - [5, 0.0]
  - - [2368, 5888, 1, 768, 2368, 2368, 768, 768]
    - [5, 0.0]
  - - [4, 5888, 1, 128, 4, 4, 128, 128]
    - [7, 111.805]
  - - [1856, 5056, 1, 128, 1856, 1856, 128, 128]
    - [1, 3194.47]
  - - [5056, 4288, 1, 1792, 5056, 5056, 1792, 1792]
    - [5, 0.0]
  - - [5888, 4, 1, 1792, 5888, 5888, 1792, 1792]
    - [8, 0.0]
  - - [6784, 448, 1, 768, 6784, 6784, 768, 768]
    - [5, 0.0]
  - - [64, 1408, 1, 3328, 64, 64, 3328, 3328]
    - [5, 0.0]
  - - [448, 256, 1, 256, 448, 448, 256, 256]
    - [5, 0.0]
  - - [1024, 3584, 1, 128, 1024, 1024, 128, 128]
    - [3, 2396.7]
  - - [1408, 4288, 1, 128, 1408, 1408, 128, 128]
    - [1, 3021.32]
  - - [64, 1024, 1, 3328, 64, 64, 3328, 3328]
    - [5, 0.0]
  - - [448, 1408, 1, 3328, 448, 448, 3328, 3328]
    - [5, 0.0]
  - - [704, 128, 1, 3328, 704, 704, 3328, 3328]
    - [5, 0.0]
  - - [1024, 2944, 1, 3328, 1024, 1024, 3328, 3328]
    - [5, 0.0]
  - - [128, 2368, 1, 1792, 128, 128, 1792, 1792]
    - [5, 0.0]
  - - [1408, 256, 1, 128, 1408, 1408, 128, 128]
    - [0, 1221.26]
  - - [3584, 6784, 1, 256, 3584, 3584, 256, 256]
    - [5, 0.0]
  - - [1408, 6784, 1, 128, 1408, 1408, 128, 128]
    - [1, 3199.95]
  - - [1408, 5888, 1, 128, 1408, 1408, 128, 128]
    - [1, 3191.22]
  - - [4288, 2368, 1, 3328, 4288, 4288, 3328, 3328]
    - [5, 0.0]
  - - [64, 128, 1, 256, 64, 64, 256, 256]
    - [5, 0.0]
  - - [256, 128, 1, 768, 256, 256, 768, 768]
    - [5, 0.0]
  - - [704, 5056, 1, 256, 704, 704, 256, 256]
    - [5, 0.0]
  - - [1856, 2944, 1, 128, 1856, 1856, 128, 128]
    - [1, 3120.2]
  - - [128, 64, 1, 768, 128, 128, 768, 768]
    - [5, 0.0]
  - - [64, 704, 1, 768, 64, 64, 768, 768]
    - [5, 0.0]
  - - [4288, 704, 1, 256, 4288, 4288, 256, 256]
    - [5, 0.0]
  - - [256, 1856, 1, 3328, 256, 256, 3328, 3328]
    - [5, 0.0]
  - - [128, 6784, 1, 1792, 128, 128, 1792, 1792]
    - [5, 0.0]
  - - [1856, 4288, 1, 128, 1856, 1856, 128, 128]
    - [1, 3192.21]
  - - [128, 6784, 1, 128, 128, 128, 128, 128]
    - [0, 1669.06]
  - - [2368, 6784, 1, 128, 2368, 2368, 128, 128]
    - [1, 3384.0]
  - - [1856, 1856, 1, 1792, 1856, 1856, 1792, 1792]
    - [5, 0.0]
  - - [1408, 5888, 1, 768, 1408, 1408, 768, 768]
    - [5, 0.0]
  - - [2944, 4, 1, 128, 2944, 2944, 128, 128]
    - [6, 68.0555]
  - - [256, 448, 1, 768, 256, 256, 768, 768]
    - [5, 0.0]
  - - [2368, 5056, 1, 256, 2368, 2368, 256, 256]
    - [5, 0.0]
  - - [448, 4, 1, 1792, 448, 448, 1792, 1792]
    - [8, 0.0]
  - - [2368, 4288, 1, 256, 2368, 2368, 256, 256]
    - [5, 0.0]
  - - [5888, 256, 1, 128, 5888, 5888, 128, 128]
    - [2, 2039.64]
  - - [4288, 1024, 1, 128, 4288, 4288, 128, 128]
    - [1, 2968.45]
  - - [448, 2944, 1, 1792, 448, 448, 1792, 1792]
    - [5, 0.0]
  - - [4, 6784, 1, 1792, 4, 4, 1792, 1792]
    - [8, 0.0]
  - - [128, 704, 1, 256, 128, 128, 256, 256]
    - [5, 0.0]
  - - [256, 2944, 1, 1792, 256, 256, 1792, 1792]
    - [5, 0.0]
  - - [256, 128, 1, 1792, 256, 256, 1792, 1792]
    - [5, 0.0]
  - - [4, 704, 1, 256, 4, 4, 256, 256]
    - [8, 0.0]
  - - [448, 6784, 1, 1792, 448, 448, 1792, 1792]
    - [5, 0.0]
  - - [1024, 1024, 1, 3328, 1024, 1024, 3328, 3328]
    - [5, 0.0]
  - - [2368, 5888, 1, 128, 2368, 2368, 128, 128]
    - [1, 3395.25]
  - - [1408, 3584, 1, 256, 1408, 1408, 256, 256]
    - [5, 0.0]
  - - [1856, 64, 1, 128, 1856, 1856, 128, 128]
    - [0, 492.217]
  - - [5888, 6784, 1, 128, 5888, 5888, 128, 128]
    - [1, 3240.63]
  - - [128, 704, 1, 1792, 128, 128, 1792, 1792]
    - [5, 0.0]
  - - [128, 4, 1, 3328, 128, 128, 3328, 3328]
    - [8, 0.0]
  - - [128, 1856, 1, 3328, 128, 128, 3328, 3328]
    - [5, 0.0]
  - - [1408, 1408, 1, 3328, 1408, 1408, 3328, 3328]
    - [5, 0.0]
  - - [4288, 2944, 1, 3328, 4288, 4288, 3328, 3328]
    - [5, 0.0]
  - - [5056, 1408, 1, 128, 5056, 5056, 128, 128]
    - [1, 3192.61]
  - - [6784, 3584, 1, 1792, 6784, 6784, 1792, 1792]
    - [5, 0.0]
  - - [3584, 448, 1, 3328, 3584, 3584, 3328, 3328]
    - [5, 0.0]
  - - [128, 2944, 1, 768, 128, 128, 768, 768]
    - [5, 0.0]
  - - [1408, 448, 1, 1792, 1408, 1408, 1792, 1792]
    - [5, 0.0]
  - - [448, 5056, 1, 256, 448, 448, 256, 256]
    - [5, 0.0]
  - - [4, 1024, 1, 256, 4, 4, 256, 256]
    - [8, 0.0]
  - - [256, 448, 1, 256, 256, 256, 256, 256]
    - [5, 0.0]
  - - [1024, 1408, 1, 128, 1024, 1024, 128, 128]
    - [1, 1838.64]
  - - [5056, 5056, 1, 3328, 5056, 5056, 3328, 3328]
    - [5, 0.0]
  - - [256, 2368, 1, 768, 256, 256, 768, 768]
    - [5, 0.0]
  - - [4288, 128, 1, 1792, 4288, 4288, 1792, 1792]
    - [5, 0.0]
  - - [5888, 2944, 1, 768, 5888, 5888, 768, 768]
    - [5, 0.0]
  - - [4288, 4, 1, 768, 4288, 4288, 768, 768]
    - [8, 0.0]
  - - [448, 1024, 1, 128, 448, 448, 128, 128]
    - [0, 1462.56]
  - - [1408, 256, 1, 3328, 1408, 1408, 3328, 3328]
    - [5, 0.0]
  - - [448, 64, 1, 768, 448, 448, 768, 768]
    - [5, 0.0]
  - - [4, 1408, 1, 256, 4, 4, 256, 256]
    - [8, 0.0]
  - - [128, 704, 1, 768, 128, 128, 768, 768]
    - [5, 0.0]
  - - [4288, 256, 1, 256, 4288, 4288, 256, 256]
    - [5, 0.0]
  - - [2944, 64, 1, 3328, 2944, 2944, 3328, 3328]
    - [5, 0.0]
  - - [128, 1024, 1, 128, 128, 128, 128, 128]
    - [0, 556.477]
  - - [5056, 704, 1, 256, 5056, 5056, 256, 256]
    - [5, 0.0]
  - - [256, 4, 1, 3328, 256, 256, 3328, 3328]
    - [8, 0.0]
  - - [448, 1408, 1, 768, 448, 448, 768, 768]
    - [5, 0.0]
  - - [3584, 2368, 1, 768, 3584, 3584, 768, 768]
    - [5, 0.0]
  - - [2368, 1408, 1, 256, 2368, 2368, 256, 256]
    - [5, 0.0]
  - - [1408, 5056, 1, 128, 1408, 1408, 128, 128]
    - [1, 3053.15]
  - - [4, 1408, 1, 3328, 4, 4, 3328, 3328]
    - [8, 0.0]
  - - [704, 4288, 1, 768, 704, 704, 768, 768]
    - [5, 0.0]
  - - [6784, 4288, 1, 768, 6784, 6784, 768, 768]
    - [5, 0.0]
  - - [64, 256, 1, 128, 64, 64, 128, 128]
    - [2, 59.8545]
  - - [3584, 2944, 1, 768, 3584, 3584, 768, 768]
    - [5, 0.0]
  - - [4, 128, 1, 1792, 4, 4, 1792, 1792]
    - [8, 0.0]
  - - [256, 4288, 1, 3328, 256, 256, 3328, 3328]
    - [5, 0.0]
  - - [448, 448, 1, 3328, 448, 448, 3328, 3328]
    - [5, 0.0]
  - - [3584, 1024, 1, 1792, 3584, 3584, 1792, 1792]
    - [5, 0.0]
  - - [2944, 1408, 1, 1792, 2944, 2944, 1792, 1792]
    - [5, 0.0]
  - - [1024, 4, 1, 256, 1024, 1024, 256, 256]
    - [8, 0.0]
  - - [1024, 64, 1, 1792, 1024, 1024, 1792, 1792]
    - [5, 0.0]
  - - [1024, 6784, 1, 768, 1024, 1024, 768, 768]
    - [5, 0.0]
  - - [2944, 1024, 1, 3328, 2944, 2944, 3328, 3328]
    - [5, 0.0]
  - - [704, 1024, 1, 256, 704, 704, 256, 256]
    - [5, 0.0]
  - - [1408, 128, 1, 1792, 1408, 1408, 1792, 1792]
    - [5, 0.0]
  - - [1024, 1408, 1, 3328, 1024, 1024, 3328, 3328]
    - [5, 0.0]
  - - [256, 1408, 1, 768, 256, 256, 768, 768]
    - [5, 0.0]
  - - [704, 1408, 1, 768, 704, 704, 768, 768]
    - [5, 0.0]
  - - [128, 448, 1, 768, 128, 128, 768, 768]
    - [5, 0.0]
  - - [2944, 6784, 1, 768, 2944, 2944, 768, 768]
    - [5, 0.0]
  - - [1856, 5888, 1, 3328, 1856, 1856, 3328, 3328]
    - [5, 0.0]
  - - [64, 1408, 1, 768, 64, 64, 768, 768]
    - [5, 0.0]
  - - [1856, 5888, 1, 768, 1856, 1856, 768, 768]
    - [5, 0.0]
  - - [1024, 128, 1, 3328, 1024, 1024, 3328, 3328]
    - [5, 0.0]
  - - [64, 4, 1, 128, 64, 64, 128, 128]
    - [6, 1.64444]
  - - [6784, 448, 1, 3328, 6784, 6784, 3328, 3328]
    - [5, 0.0]
  - - [1024, 256, 1, 1792, 1024, 1024, 1792, 1792]
    - [5, 0.0]
  - - [5888, 1024, 1, 1792, 5888, 5888, 1792, 1792]
    - [5, 0.0]
  - - [1024, 448, 1, 128, 1024, 1024, 128, 128]
    - [0, 1174.38]
  - - [2368, 128, 1, 1792, 2368, 2368, 1792, 1792]
    - [5, 0.0]
  - - [128, 5888, 1, 1792, 128, 128, 1792, 1792]
    - [5, 0.0]
  - - [4288, 704, 1, 768, 4288, 4288, 768, 768]
    - [5, 0.0]
  - - [128, 256, 1, 1792, 128, 128, 1792, 1792]
    - [5, 0.0]
  - - [256, 448, 1, 3328, 256, 256, 3328, 3328]
    - [5, 0.0]
  - - [1024, 1024, 1, 1792, 1024, 1024, 1792, 1792]
    - [5, 0.0]
  - - [2368, 2944, 1, 1792, 2368, 2368, 1792, 1792]
    - [5, 0.0]
  - - [704, 2368, 1, 128, 704, 704, 128, 128]
    - [1, 2202.33]
  - - [64, 64, 1, 3328, 64, 64, 3328, 3328]
    - [5, 0.0]
  - - [448, 5888, 1, 256, 448, 448, 256, 256]
    - [5, 0.0]
  - - [4288, 704, 1, 128, 4288, 4288, 128, 128]
    - [3, 2646.52]
  - - [6784, 704, 1, 1792, 6784, 6784, 1792, 1792]
    - [5, 0.0]
  - - [2944, 1856, 1, 128, 2944, 2944, 128, 128]
    - [1, 2905.14]
  - - [2368, 704, 1, 128, 2368, 2368, 128, 128]
    - [1, 2252.27]
  - - [1856, 4, 1, 256, 1856, 1856, 256, 256]
    - [8, 0.0]
  - - [1408, 1408, 1, 128, 1408, 1408, 128, 128]
    - [1, 2306.81]
  - - [128, 1408, 1, 768, 128, 128, 768, 768]
    - [5, 0.0]
  - - [5056, 5888, 1, 1792, 5056, 5056, 1792, 1792]
    - [5, 0.0]
  - - [6784, 448, 1, 1792, 6784, 6784, 1792, 1792]
    - [5, 0.0]
  - - [704, 704, 1, 256, 704, 704, 256, 256]
    - [5, 0.0]
  - - [4288, 2368, 1, 1792, 4288, 4288, 1792, 1792]
    - [5, 0.0]
  - - [2944, 5888, 1, 128, 2944, 2944, 128, 128]
    - [1, 3314.49]
  - - [128, 448, 1, 256, 128, 128, 256, 256]
    - [5, 0.0]
  - - [2944, 5056, 1, 1792, 2944, 2944, 1792, 1792]
    - [5, 0.0]
  - - [128, 5888, 1, 768, 128, 128, 768, 768]
    - [5, 0.0]
  - - [1408, 6784, 1, 1792, 1408, 1408, 1792, 1792]
    - [5, 0.0]
  - - [64, 6784, 1, 768, 64, 64, 768, 768]
    - [5, 0.0]
  - - [4, 256, 1, 768, 4, 4, 768, 768]
    - [8, 0.0]
  - - [2944, 5888, 1, 1792, 2944, 2944, 1792, 1792]
    - [5, 0.0]
  - - [3584, 4, 1, 3328, 3584, 3584, 3328, 3328]
    - [8, 0.0]
  - - [4288, 2944, 1, 1792, 4288, 4288, 1792, 1792]
    - [5, 0.0]
  - - [4, 6784, 1, 128, 4, 4, 128, 128]
    - [7, 121.793]
  - - [4, 256, 1, 256, 4, 4, 256, 256]
    - [8, 0.0]
  - - [1408, 2944, 1, 256, 1408, 1408, 256, 256]
    - [5, 0.0]
  - - [704, 448, 1, 256, 704, 704, 256, 256]
    - [5, 0.0]
  - - [5888, 5888, 1, 1792, 5888, 5888, 1792, 1792]
    - [5, 0.0]
  - - [1024, 448, 1, 3328, 1024, 1024, 3328, 3328]
    - [5, 0.0]
  - - [2944, 6784, 1, 256, 2944, 2944, 256, 256]
    - [5, 0.0]
  - - [256, 64, 1, 256, 256, 256, 256, 256]
    - [5, 0.0]
  - - [4288, 256, 1, 768, 4288, 4288, 768, 768]
    - [5, 0.0]
  - - [2944, 2944, 1, 3328, 2944, 2944, 3328, 3328]
    - [5, 0.0]
  - - [1856, 5056, 1, 768, 1856, 1856, 768, 768]
    - [5, 0.0]
  - - [704, 704, 1, 1792, 704, 704, 1792, 1792]
    - [5, 0.0]
  - - [1856, 5056, 1, 1792, 1856, 1856, 1792, 1792]
    - [5, 0.0]
  - - [5888, 3584, 1, 256, 5888, 5888, 256, 256]
    - [5, 0.0]
  - - [1024, 4, 1, 128, 1024, 1024, 128, 128]
    - [6, 24.2389]
  - - [1408, 3584, 1, 768, 1408, 1408, 768, 768]
    - [5, 0.0]
  - - [448, 704, 1, 3328, 448, 448, 3328, 3328]
    - [5, 0.0]
  - - [1024, 128, 1, 1792, 1024, 1024, 1792, 1792]
    - [5, 0.0]
  - - [64, 5056, 1, 256, 64, 64, 256, 256]
    - [5, 0.0]
  - - [1856, 2944, 1, 256, 1856, 1856, 256, 256]
    - [5, 0.0]
  - - [2944, 256, 1, 256, 2944, 2944, 256, 256]
    - [5, 0.0]
  - - [128, 5056, 1, 3328, 128, 128, 3328, 3328]
    - [5, 0.0]
  - - [1024, 2944, 1, 1792, 1024, 1024, 1792, 1792]
    - [5, 0.0]
  - - [3584, 2368, 1, 128, 3584, 3584, 128, 128]
    - [1, 2949.54]
  - - [2944, 448, 1, 768, 2944, 2944, 768, 768]
    - [5, 0.0]
  - - [64, 6784, 1, 256, 64, 64, 256, 256]
    - [5, 0.0]
  - - [5888, 448, 1, 3328, 5888, 5888, 3328, 3328]
    - [5, 0.0]
  - - [5056, 1856, 1, 3328, 5056, 5056, 3328, 3328]
    - [5, 0.0]
  - - [5888, 2368, 1, 768, 5888, 5888, 768, 768]
    - [5, 0.0]
  - - [128, 256, 1, 256, 128, 128, 256, 256]
    - [5, 0.0]
  - - [1856, 6784, 1, 3328, 1856, 1856, 3328, 3328]
    - [5, 0.0]
  - - [2944, 1856, 1, 256, 2944, 2944, 256, 256]
    - [5, 0.0]
  - - [4288, 6784, 1, 256, 4288, 4288, 256, 256]
    - [5, 0.0]
  - - [2368, 704, 1, 256, 2368, 2368, 256, 256]
    - [5, 0.0]
  - - [128, 2368, 1, 128, 128, 128, 128, 128]
    - [2, 928.643]
  - - [4, 2368, 1, 256, 4, 4, 256, 256]
    - [8, 0.0]
  - - [3584, 5888, 1, 128, 3584, 3584, 128, 128]
    - [1, 3115.83]
  - - [1856, 448, 1, 768, 1856, 1856, 768, 768]
    - [5, 0.0]
  - - [4288, 3584, 1, 128, 4288, 4288, 128, 128]
    - [1, 3370.87]
  - - [2944, 2944, 1, 1792, 2944, 2944, 1792, 1792]
    - [5, 0.0]
  - - [5056, 1024, 1, 256, 5056, 5056, 256, 256]
    - [5, 0.0]
  - - [1024, 128, 1, 256, 1024, 1024, 256, 256]
    - [5, 0.0]
  - - [64, 5056, 1, 128, 64, 64, 128, 128]
    - [0, 964.034]
  - - [4288, 448, 1, 128, 4288, 4288, 128, 128]
    - [3, 2297.21]
  - - [256, 4288, 1, 768, 256, 256, 768, 768]
    - [5, 0.0]
  - - [1408, 704, 1, 768, 1408, 1408, 768, 768]
    - [5, 0.0]
  - - [1856, 1856, 1, 768, 1856, 1856, 768, 768]
    - [5, 0.0]
  - - [6784, 64, 1, 3328, 6784, 6784, 3328, 3328]
    - [5, 0.0]
  - - [2368, 4, 1, 768, 2368, 2368, 768, 768]
    - [8, 0.0]
  - - [1856, 2368, 1, 3328, 1856, 1856, 3328, 3328]
    - [5, 0.0]
  - - [3584, 4, 1, 128, 3584, 3584, 128, 128]
    - [6, 82.8502]
  - - [6784, 2368, 1, 3328, 6784, 6784, 3328, 3328]
    - [5, 0.0]
  - - [6784, 5056, 1, 1792, 6784, 6784, 1792, 1792]
    - [5, 0.0]
  - - [704, 128, 1, 128, 704, 704, 128, 128]
    - [0, 399.257]
  - - [64, 3584, 1, 768, 64, 64, 768, 768]
    - [5, 0.0]
  - - [5056, 64, 1, 128, 5056, 5056, 128, 128]
    - [0, 1118.29]
  - - [704, 256, 1, 1792, 704, 704, 1792, 1792]
    - [5, 0.0]
  - - [3584, 5056, 1, 3328, 3584, 3584, 3328, 3328]
    - [5, 0.0]
  - - [704, 448, 1, 128, 704, 704, 128, 128]
    - [0, 1092.15]
  - - [3584, 1024, 1, 3328, 3584, 3584, 3328, 3328]
    - [5, 0.0]
  - - [448, 256, 1, 768, 448, 448, 768, 768]
    - [5, 0.0]
  - - [1024, 2944, 1, 768, 1024, 1024, 768, 768]
    - [5, 0.0]
  - - [4, 448, 1, 128, 4, 4, 128, 128]
    - [6, 10.391]
  - - [1024, 2368, 1, 128, 1024, 1024, 128, 128]
    - [4, 2117.25]
  - - [64, 704, 1, 1792, 64, 64, 1792, 1792]
    - [5, 0.0]
  - - [1856, 64, 1, 1792, 1856, 1856, 1792, 1792]
    - [5, 0.0]
  - - [6784, 1408, 1, 1792, 6784, 6784, 1792, 1792]
    - [5, 0.0]
  - - [64, 704, 1, 3328, 64, 64, 3328, 3328]
    - [5, 0.0]
  - - [448, 256, 1, 128, 448, 448, 128, 128]
    - [0, 510.762]
  - - [6784, 1408, 1, 3328, 6784, 6784, 3328, 3328]
    - [5, 0.0]
  - - [6784, 2368, 1, 128, 6784, 6784, 128, 128]
    - [1, 3321.64]
  - - [3584, 1408, 1, 256, 3584, 3584, 256, 256]
    - [5, 0.0]
  - - [6784, 2368, 1, 768, 6784, 6784, 768, 768]
    - [5, 0.0]
  - - [1024, 1024, 1, 256, 1024, 1024, 256, 256]
    - [5, 0.0]
  - - [6784, 5888, 1, 256, 6784, 6784, 256, 256]
    - [5, 0.0]
  - - [5056, 5056, 1, 128, 5056, 5056, 128, 128]
    - [1, 3462.05]
  - - [1856, 3584, 1, 768, 1856, 1856, 768, 768]
    - [5, 0.0]
  - - [64, 4, 1, 256, 64, 64, 256, 256]
    - [8, 0.0]
  - - [2944, 3584, 1, 256, 2944, 2944, 256, 256]
    - [5, 0.0]
  - - [1856, 256, 1, 3328, 1856, 1856, 3328, 3328]
    - [5, 0.0]
  - - [5888, 4288, 1, 3328, 5888, 5888, 3328, 3328]
    - [5, 0.0]
  - - [4288, 1408, 1, 128, 4288, 4288, 128, 128]
    - [1, 3133.86]
  - - [4288, 6784, 1, 1792, 4288, 4288, 1792, 1792]
    - [5, 0.0]
  - - [5888, 3584, 1, 1792, 5888, 5888, 1792, 1792]
    - [5, 0.0]
  - - [256, 4288, 1, 128, 256, 256, 128, 128]
    - [2, 1732.28]
  - - [704, 6784, 1, 3328, 704, 704, 3328, 3328]
    - [5, 0.0]
  - - [5056, 1408, 1, 256, 5056, 5056, 256, 256]
    - [5, 0.0]
  - - [64, 1856, 1, 128, 64, 64, 128, 128]
    - [0, 510.582]
  - - [5056, 5888, 1, 3328, 5056, 5056, 3328, 3328]
    - [5, 0.0]
  - - [704, 704, 1, 3328, 704, 704, 3328, 3328]
    - [5, 0.0]
  - - [1408, 64, 1, 1792, 1408, 1408, 1792, 1792]
    - [5, 0.0]
  - - [704, 5888, 1, 128, 704, 704, 128, 128]
    - [1, 2780.55]
  - - [1024, 2944, 1, 128, 1024, 1024, 128, 128]
    - [4, 2237.64]
  - - [64, 1408, 1, 1792, 64, 64, 1792, 1792]
    - [5, 0.0]
  - - [1024, 1408, 1, 1792, 1024, 1024, 1792, 1792]
    - [5, 0.0]
  - - [4288, 5056, 1, 1792, 4288, 4288, 1792, 1792]
    - [5, 0.0]
  - - [4288, 1856, 1, 1792, 4288, 4288, 1792, 1792]
    - [5, 0.0]
  - - [2368, 3584, 1, 128, 2368, 2368, 128, 128]
    - [1, 3228.78]
  - - [2368, 4, 1, 256, 2368, 2368, 256, 256]
    - [8, 0.0]
  - - [128, 3584, 1, 3328, 128, 128, 3328, 3328]
    - [5, 0.0]
  - - [6784, 1856, 1, 3328, 6784, 6784, 3328, 3328]
    - [5, 0.0]
  - - [5056, 448, 1, 128, 5056, 5056, 128, 128]
    - [1, 2432.57]
  - - [704, 2944, 1, 1792, 704, 704, 1792, 1792]
    - [5, 0.0]
  - - [2944, 1024, 1, 256, 2944, 2944, 256, 256]
    - [5, 0.0]
  - - [5888, 3584, 1, 768, 5888, 5888, 768, 768]
    - [5, 0.0]
  - - [64, 1024, 1, 128, 64, 64, 128, 128]
    - [0, 281.7]
  - - [6784, 64, 1, 256, 6784, 6784, 256, 256]
    - [5, 0.0]
  - - [2368, 704, 1, 768, 2368, 2368, 768, 768]
    - [5, 0.0]
  - - [256, 5056, 1, 128, 256, 256, 128, 128]
    - [1, 1870.04]
  - - [1856, 704, 1, 256, 1856, 1856, 256, 256]
    - [5, 0.0]
  - - [3584, 704, 1, 256, 3584, 3584, 256, 256]
    - [5, 0.0]
  - - [6784, 1856, 1, 768, 6784, 6784, 768, 768]
    - [5, 0.0]
  - - [3584, 448, 1, 1792, 3584, 3584, 1792, 1792]
    - [5, 0.0]
  - - [5888, 3584, 1, 3328, 5888, 5888, 3328, 3328]
    - [5, 0.0]
  - - [2944, 5056, 1, 3328, 2944, 2944, 3328, 3328]
    - [5, 0.0]
  - - [64, 1856, 1, 256, 64, 64, 256, 256]
    - [5, 0.0]
  - - [2368, 128, 1, 128, 2368, 2368, 128, 128]
    - [0, 1062.37]
  - - [1856, 4288, 1, 3328, 1856, 1856, 3328, 3328]
    - [5, 0.0]
  - - [5056, 4, 1, 1792, 5056, 5056, 1792, 1792]
    - [8, 0.0]
  - - [1024, 6784, 1, 256, 1024, 1024, 256, 256]
    - [5, 0.0]
  - - [5056, 5888, 1, 768, 5056, 5056, 768, 768]
    - [5, 0.0]
  - - [1408, 256, 1, 1792, 1408, 1408, 1792, 1792]
    - [5, 0.0]
  - - [448, 1024, 1, 1792, 448, 448, 1792, 1792]
    - [5, 0.0]
  - - [2944, 1024, 1, 1792, 2944, 2944, 1792, 1792]
    - [5, 0.0]
  - - [2368, 6784, 1, 768, 2368, 2368, 768, 768]
    - [5, 0.0]
  - - [5056, 3584, 1, 768, 5056, 5056, 768, 768]
    - [5, 0.0]
  - - [1856, 1408, 1, 1792, 1856, 1856, 1792, 1792]
    - [5, 0.0]
  - - [448, 64, 1, 128, 448, 448, 128, 128]
    - [0, 119.673]
  - - [704, 1024, 1, 128, 704, 704, 128, 128]
    - [0, 1754.49]
  - - [4288, 4, 1, 1792, 4288, 4288, 1792, 1792]
    - [8, 0.0]
  - - [4, 4, 1, 1792, 4, 4, 1792, 1792]
    - [8, 0.0]
  - - [2944, 2368, 1, 3328, 2944, 2944, 3328, 3328]
    - [5, 0.0]
  - - [2368, 64, 1, 768, 2368, 2368, 768, 768]
    - [5, 0.0]
  - - [1856, 4, 1, 768, 1856, 1856, 768, 768]
    - [8, 0.0]
  - - [128, 1856, 1, 256, 128, 128, 256, 256]
    - [5, 0.0]
  - - [2944, 1856, 1, 1792, 2944, 2944, 1792, 1792]
    - [5, 0.0]
  - - [704, 64, 1, 1792, 704, 704, 1792, 1792]
    - [5, 0.0]
  - - [704, 4, 1, 128, 704, 704, 128, 128]
    - [6, 16.551]
  - - [5888, 2944, 1, 3328, 5888, 5888, 3328, 3328]
    - [5, 0.0]
  - - [4, 4, 1, 256, 4, 4, 256, 256]
    - [8, 0.0]
  - - [2944, 64, 1, 1792, 2944, 2944, 1792, 1792]
    - [5, 0.0]
  - - [4288, 448, 1, 768, 4288, 4288, 768, 768]
    - [5, 0.0]
  - - [5888, 5888, 1, 256, 5888, 5888, 256, 256]
    - [5, 0.0]
  - - [64, 6784, 1, 1792, 64, 64, 1792, 1792]
    - [5, 0.0]
  - - [5888, 704, 1, 768, 5888, 5888, 768, 768]
    - [5, 0.0]
  - - [2368, 448, 1, 3328, 2368, 2368, 3328, 3328]
    - [5, 0.0]
  - - [704, 1408, 1, 1792, 704, 704, 1792, 1792]
    - [5, 0.0]
  - - [1024, 256, 1, 256, 1024, 1024, 256, 256]
    - [5, 0.0]
  - - [5888, 3584, 1, 128, 5888, 5888, 128, 128]
    - [1, 3211.89]
  - - [2368, 6784, 1, 1792, 2368, 2368, 1792, 1792]
    - [5, 0.0]
  - - [1856, 256, 1, 768, 1856, 1856, 768, 768]
    - [5, 0.0]
  - - [1408, 1024, 1, 1792, 1408, 1408, 1792, 1792]
    - [5, 0.0]
  - - [1024, 3584, 1, 1792, 1024, 1024, 1792, 1792]
    - [5, 0.0]
  - - [1024, 1024, 1, 128, 1024, 1024, 128, 128]
    - [4, 1845.12]
  - - [448, 448, 1, 256, 448, 448, 256, 256]
    - [5, 0.0]
  - - [4, 448, 1, 3328, 4, 4, 3328, 3328]
    - [8, 0.0]
  - - [256, 1024, 1, 768, 256, 256, 768, 768]
    - [5, 0.0]
  - - [4, 5056, 1, 1792, 4, 4, 1792, 1792]
    - [8, 0.0]
  - - [256, 256, 1, 768, 256, 256, 768, 768]
    - [5, 0.0]
  - - [1856, 448, 1, 3328, 1856, 1856, 3328, 3328]
    - [5, 0.0]
  - - [5056, 448, 1, 256, 5056, 5056, 256, 256]
    - [5, 0.0]
  - - [3584, 3584, 1, 128, 3584, 3584, 128, 128]
    - [1, 3048.88]
  - - [2368, 128, 1, 3328, 2368, 2368, 3328, 3328]
    - [5, 0.0]
  - - [4, 1024, 1, 128, 4, 4, 128, 128]
    - [6, 24.1563]
  - - [4, 2368, 1, 3328, 4, 4, 3328, 3328]
    - [8, 0.0]
  - - [6784, 1856, 1, 128, 6784, 6784, 128, 128]
    - [1, 3204.75]
  - - [704, 64, 1, 128, 704, 704, 128, 128]
    - [0, 186.703]
  - - [2944, 448, 1, 128, 2944, 2944, 128, 128]
    - [1, 2033.04]
  - - [4288, 64, 1, 768, 4288, 4288, 768, 768]
    - [5, 0.0]
  - - [3584, 5056, 1, 768, 3584, 3584, 768, 768]
    - [5, 0.0]
  - - [448, 1408, 1, 128, 448, 448, 128, 128]
    - [0, 1600.56]
  - - [2944, 2944, 1, 768, 2944, 2944, 768, 768]
    - [5, 0.0]
  - - [5888, 4288, 1, 1792, 5888, 5888, 1792, 1792]
    - [5, 0.0]
  - - [4, 64, 1, 768, 4, 4, 768, 768]
    - [8, 0.0]
  - - [128, 1408, 1, 1792, 128, 128, 1792, 1792]
    - [5, 0.0]
  - - [256, 1856, 1, 256, 256, 256, 256, 256]
    - [5, 0.0]
  - - [2368, 704, 1, 1792, 2368, 2368, 1792, 1792]
    - [5, 0.0]
  - - [5056, 4, 1, 128, 5056, 5056, 128, 128]
    - [7, 104.945]
  - - [5888, 448, 1, 256, 5888, 5888, 256, 256]
    - [5, 0.0]
  - - [2368, 2368, 1, 256, 2368, 2368, 256, 256]
    - [5, 0.0]
  - - [3584, 256, 1, 1792, 3584, 3584, 1792, 1792]
    - [5, 0.0]
  - - [1856, 6784, 1, 128, 1856, 1856, 128, 128]
    - [1, 3345.17]
  - - [448, 128, 1, 256, 448, 448, 256, 256]
    - [5, 0.0]
  - - [2944, 128, 1, 768, 2944, 2944, 768, 768]
    - [5, 0.0]
  - - [4, 5056, 1, 256, 4, 4, 256, 256]
    - [8, 0.0]
  - - [5056, 256, 1, 768, 5056, 5056, 768, 768]
    - [5, 0.0]
  - - [1856, 1024, 1, 256, 1856, 1856, 256, 256]
    - [5, 0.0]
  - - [256, 3584, 1, 256, 256, 256, 256, 256]
    - [5, 0.0]
  - - [1408, 1856, 1, 3328, 1408, 1408, 3328, 3328]
    - [5, 0.0]
  - - [64, 3584, 1, 128, 64, 64, 128, 128]
    - [0, 859.778]
  - - [5888, 256, 1, 256, 5888, 5888, 256, 256]
    - [5, 0.0]
  - - [128, 64, 1, 256, 128, 128, 256, 256]
    - [5, 0.0]
  - - [6784, 5056, 1, 128, 6784, 6784, 128, 128]
    - [1, 3484.37]
  - - [448, 4288, 1, 128, 448, 448, 128, 128]
    - [1, 2484.63]
  - - [4288, 2944, 1, 128, 4288, 4288, 128, 128]
    - [1, 3384.58]
  - - [2368, 4, 1, 1792, 2368, 2368, 1792, 1792]
    - [8, 0.0]
  - - [4288, 4288, 1, 256, 4288, 4288, 256, 256]
    - [5, 0.0]
  - - [1024, 1856, 1, 128, 1024, 1024, 128, 128]
    - [4, 2066.77]
  - - [2944, 5888, 1, 256, 2944, 2944, 256, 256]
    - [5, 0.0]
  - - [4288, 2368, 1, 256, 4288, 4288, 256, 256]
    - [5, 0.0]
  - - [5888, 1408, 1, 768, 5888, 5888, 768, 768]
    - [5, 0.0]
  - - [4288, 6784, 1, 768, 4288, 4288, 768, 768]
    - [5, 0.0]
  - - [256, 704, 1, 256, 256, 256, 256, 256]
    - [5, 0.0]
  - - [6784, 256, 1, 128, 6784, 6784, 128, 128]
    - [2, 2268.31]
  - - [128, 4288, 1, 1792, 128, 128, 1792, 1792]
    - [5, 0.0]
  - - [256, 6784, 1, 3328, 256, 256, 3328, 3328]
    - [5, 0.0]
  - - [4, 2368, 1, 1792, 4, 4, 1792, 1792]
    - [8, 0.0]
  - - [5056, 448, 1, 768, 5056, 5056, 768, 768]
    - [5, 0.0]
  - - [2944, 4288, 1, 256, 2944, 2944, 256, 256]
    - [5, 0.0]
  - - [1856, 704, 1, 128, 1856, 1856, 128, 128]
    - [1, 2094.45]
  - - [4288, 5888, 1, 1792, 4288, 4288, 1792, 1792]
    - [5, 0.0]
  - - [1856, 128, 1, 1792, 1856, 1856, 1792, 1792]
    - [5, 0.0]
  - - [6784, 1408, 1, 256, 6784, 6784, 256, 256]
    - [5, 0.0]
  - - [1408, 2368, 1, 768, 1408, 1408, 768, 768]
    - [5, 0.0]
  - - [64, 6784, 1, 3328, 64, 64, 3328, 3328]
    - [5, 0.0]
  - - [256, 1024, 1, 128, 256, 256, 128, 128]
    - [2, 840.405]
  - - [6784, 2368, 1, 256, 6784, 6784, 256, 256]
    - [5, 0.0]
  - - [64, 5888, 1, 768, 64, 64, 768, 768]
    - [5, 0.0]
  - - [4, 3584, 1, 3328, 4, 4, 3328, 3328]
    - [8, 0.0]
  - - [128, 448, 1, 3328, 128, 128, 3328, 3328]
    - [5, 0.0]
  - - [4288, 5888, 1, 128, 4288, 4288, 128, 128]
    - [1, 3481.27]
  - - [1856, 704, 1, 3328, 1856, 1856, 3328, 3328]
    - [5, 0.0]
  - - [1024, 5056, 1, 768, 1024, 1024, 768, 768]
    - [5, 0.0]
  - - [6784, 128, 1, 128, 6784, 6784, 128, 128]
    - [1, 1728.67]
  - - [4, 1856, 1, 128, 4, 4, 128, 128]
    - [6, 43.1932]
  - - [4288, 6784, 1, 3328, 4288, 4288, 3328, 3328]
    - [5, 0.0]
  - - [5888, 128, 1, 128, 5888, 5888, 128, 128]
    - [2, 1686.93]
  - - [6784, 256, 1, 256, 6784, 6784, 256, 256]
    - [5, 0.0]
  - - [1408, 704, 1, 256, 1408, 1408, 256, 256]
    - [5, 0.0]
  - - [64, 2368, 1, 256, 64, 64, 256, 256]
    - [5, 0.0]
  - - [128, 5888, 1, 128, 128, 128, 128, 128]
    - [0, 1669.62]
  - - [64, 5888, 1, 1792, 64, 64, 1792, 1792]
    - [5, 0.0]
  - - [5056, 64, 1, 256, 5056, 5056, 256, 256]
    - [5, 0.0]
  - - [1856, 4288, 1, 256, 1856, 1856, 256, 256]
    - [5, 0.0]
  - - [4, 5056, 1, 128, 4, 4, 128, 128]
    - [6, 100.709]
  - - [2944, 1408, 1, 128, 2944, 2944, 128, 128]
    - [1, 2914.03]
  - - [704, 4288, 1, 1792, 704, 704, 1792, 1792]
    - [5, 0.0]
  - - [6784, 4, 1, 1792, 6784, 6784, 1792, 1792]
    - [8, 0.0]
  - - [1408, 448, 1, 128, 1408, 1408, 128, 128]
    - [0, 1607.62]
  - - [2368, 5056, 1, 3328, 2368, 2368, 3328, 3328]
    - [5, 0.0]
  - - [1856, 4288, 1, 768, 1856, 1856, 768, 768]
    - [5, 0.0]
  - - [4, 4288, 1, 768, 4, 4, 768, 768]
    - [8, 0.0]
  - - [4, 5888, 1, 256, 4, 4, 256, 256]
    - [8, 0.0]
  - - [1024, 128, 1, 128, 1024, 1024, 128, 128]
    - [0, 537.973]
  - - [4, 4288, 1, 256, 4, 4, 256, 256]
    - [8, 0.0]
  - - [4, 128, 1, 3328, 4, 4, 3328, 3328]
    - [8, 0.0]
  - - [4, 4288, 1, 3328, 4, 4, 3328, 3328]
    - [8, 0.0]
  - - [5888, 5056, 1, 3328, 5888, 5888, 3328, 3328]
    - [5, 0.0]
  - - [448, 4, 1, 256, 448, 448, 256, 256]
    - [8, 0.0]
  - - [4288, 1024, 1, 1792, 4288, 4288, 1792, 1792]
    - [5, 0.0]
  - - [3584, 64, 1, 768, 3584, 3584, 768, 768]
    - [5, 0.0]
  - - [6784, 1024, 1, 256, 6784, 6784, 256, 256]
    - [5, 0.0]
  - - [256, 2944, 1, 3328, 256, 256, 3328, 3328]
    - [5, 0.0]
  - - [6784, 5888, 1, 1792, 6784, 6784, 1792, 1792]
    - [5, 0.0]
  - - [1408, 2368, 1, 1792, 1408, 1408, 1792, 1792]
    - [5, 0.0]
  - - [1856, 5888, 1, 256, 1856, 1856, 256, 256]
    - [5, 0.0]
  - - [704, 5056, 1, 128, 704, 704, 128, 128]
    - [1, 2985.71]
  - - [448, 256, 1, 3328, 448, 448, 3328, 3328]
    - [5, 0.0]
  - - [4, 5056, 1, 768, 4, 4, 768, 768]
    - [8, 0.0]
  - - [5056, 3584, 1, 256, 5056, 5056, 256, 256]
    - [5, 0.0]
  - - [3584, 5888, 1, 1792, 3584, 3584, 1792, 1792]
    - [5, 0.0]
  - - [64, 2944, 1, 128, 64, 64, 128, 128]
    - [0, 710.868]
  - - [128, 5056, 1, 1792, 128, 128, 1792, 1792]
    - [5, 0.0]
  - - [4, 3584, 1, 1792, 4, 4, 1792, 1792]
    - [8, 0.0]
  - - [5056, 2944, 1, 3328, 5056, 5056, 3328, 3328]
    - [5, 0.0]
  - - [1024, 448, 1, 768, 1024, 1024, 768, 768]
    - [5, 0.0]
  - - [3584, 2368, 1, 1792, 3584, 3584, 1792, 1792]
    - [5, 0.0]
  - - [448, 5056, 1, 3328, 448, 448, 3328, 3328]
    - [5, 0.0]
  - - [1856, 3584, 1, 1792, 1856, 1856, 1792, 1792]
    - [5, 0.0]
  - - [5056, 1408, 1, 3328, 5056, 5056, 3328, 3328]
    - [5, 0.0]
  - - [128, 3584, 1, 128, 128, 128, 128, 128]
    - [0, 1295.28]
  - - [5056, 704, 1, 768, 5056, 5056, 768, 768]
    - [5, 0.0]
  - - [1024, 6784, 1, 1792, 1024, 1024, 1792, 1792]
    - [5, 0.0]
  - - [5888, 5056, 1, 128, 5888, 5888, 128, 128]
    - [1, 3205.65]
  - - [5888, 1024, 1, 256, 5888, 5888, 256, 256]
    - [5, 0.0]
  - - [4288, 704, 1, 3328, 4288, 4288, 3328, 3328]
    - [5, 0.0]
  - - [1856, 2944, 1, 768, 1856, 1856, 768, 768]
    - [5, 0.0]
  - - [5888, 6784, 1, 1792, 5888, 5888, 1792, 1792]
    - [5, 0.0]
  - - [64, 64, 1, 1792, 64, 64, 1792, 1792]
    - [5, 0.0]
  - - [64, 4, 1, 3328, 64, 64, 3328, 3328]
    - [8, 0.0]
  - - [128, 704, 1, 128, 128, 128, 128, 128]
    - [0, 398.237]
  - - [5056, 2944, 1, 1792, 5056, 5056, 1792, 1792]
    - [5, 0.0]
  - - [1856, 128, 1, 3328, 1856, 1856, 3328, 3328]
    - [5, 0.0]
  - - [5888, 2944, 1, 256, 5888, 5888, 256, 256]
    - [5, 0.0]
  - - [5056, 1408, 1, 768, 5056, 5056, 768, 768]
    - [5, 0.0]
  - - [5056, 4288, 1, 128, 5056, 5056, 128, 128]
    - [1, 3410.96]
  - - [2944, 4288, 1, 1792, 2944, 2944, 1792, 1792]
    - [5, 0.0]
  - - [64, 64, 1, 256, 64, 64, 256, 256]
    - [5, 0.0]
  - - [256, 5056, 1, 1792, 256, 256, 1792, 1792]
    - [5, 0.0]
  - - [1024, 5888, 1, 1792, 1024, 1024, 1792, 1792]
    - [5, 0.0]
  - - [128, 5056, 1, 256, 128, 128, 256, 256]
    - [5, 0.0]
  - - [128, 4288, 1, 256, 128, 128, 256, 256]
    - [5, 0.0]
  - - [5888, 4, 1, 3328, 5888, 5888, 3328, 3328]
    - [8, 0.0]
  - - [1408, 6784, 1, 256, 1408, 1408, 256, 256]
    - [5, 0.0]
  - - [2368, 2944, 1, 256, 2368, 2368, 256, 256]
    - [5, 0.0]
  - - [6784, 128, 1, 1792, 6784, 6784, 1792, 1792]
    - [5, 0.0]
  - - [3584, 3584, 1, 3328, 3584, 3584, 3328, 3328]
    - [5, 0.0]
  - - [1408, 1408, 1, 256, 1408, 1408, 256, 256]
    - [5, 0.0]
  - - [256, 2944, 1, 768, 256, 256, 768, 768]
    - [5, 0.0]
  - - [448, 4, 1, 128, 448, 448, 128, 128]
    - [6, 11.0195]
  - - [4288, 3584, 1, 3328, 4288, 4288, 3328, 3328]
    - [5, 0.0]
  - - [4, 4, 1, 128, 4, 4, 128, 128]
    - [7, 0.0921588]
  - - [5056, 1408, 1, 1792, 5056, 5056, 1792, 1792]
    - [5, 0.0]
  - - [4, 64, 1, 1792, 4, 4, 1792, 1792]
    - [8, 0.0]
  - - [704, 1024, 1, 3328, 704, 704, 3328, 3328]
    - [5, 0.0]
  - - [5056, 64, 1, 768, 5056, 5056, 768, 768]
    - [5, 0.0]
  - - [3584, 2944, 1, 256, 3584, 3584, 256, 256]
    - [5, 0.0]
  - - [2368, 1408, 1, 768, 2368, 2368, 768, 768]
    - [5, 0.0]
  - - [64, 128, 1, 128, 64, 64, 128, 128]
    - [0, 34.5256]
  - - [5056, 64, 1, 3328, 5056, 5056, 3328, 3328]
    - [5, 0.0]
  - - [448, 3584, 1, 3328, 448, 448, 3328, 3328]
    - [5, 0.0]
  - - [2944, 2368, 1, 768, 2944, 2944, 768, 768]
    - [5, 0.0]
  - - [2944, 3584, 1, 1792, 2944, 2944, 1792, 1792]
    - [5, 0.0]
  - - [2944, 704, 1, 256, 2944, 2944, 256, 256]
    - [5, 0.0]
  - - [64, 4288, 1, 128, 64, 64, 128, 128]
    - [0, 820.434]
  - - [64, 448, 1, 256, 64, 64, 256, 256]
    - [5, 0.0]
  - - [2368, 2944, 1, 3328, 2368, 2368, 3328, 3328]
    - [5, 0.0]
  - - [4288, 1024, 1, 3328, 4288, 4288, 3328, 3328]
    - [5, 0.0]
  - - [2368, 256, 1, 1792, 2368, 2368, 1792, 1792]
    - [5, 0.0]
  - - [2368, 2368, 1, 1792, 2368, 2368, 1792, 1792]
    - [5, 0.0]
  - - [704, 1408, 1, 256, 704, 704, 256, 256]
    - [5, 0.0]
  - - [4, 1408, 1, 1792, 4, 4, 1792, 1792]
    - [8, 0.0]
  - - [1024, 5888, 1, 256, 1024, 1024, 256, 256]
    - [5, 0.0]
  - - [256, 256, 1, 256, 256, 256, 256, 256]
    - [5, 0.0]
  - - [6784, 64, 1, 128, 6784, 6784, 128, 128]
    - [2, 1300.25]
  - - [704, 1856, 1, 3328, 704, 704, 3328, 3328]
    - [5, 0.0]
  - - [3584, 6784, 1, 768, 3584, 3584, 768, 768]
    - [5, 0.0]
  - - [1024, 5056, 1, 3328, 1024, 1024, 3328, 3328]
    - [5, 0.0]
  - - [256, 2944, 1, 128, 256, 256, 128, 128]
    - [2, 1611.77]
  - - [1856, 1408, 1, 768, 1856, 1856, 768, 768]
    - [5, 0.0]
  - - [5056, 2368, 1, 128, 5056, 5056, 128, 128]
    - [1, 3217.96]
  - - [1408, 2944, 1, 3328, 1408, 1408, 3328, 3328]
    - [5, 0.0]
  - - [6784, 5888, 1, 3328, 6784, 6784, 3328, 3328]
    - [5, 0.0]
  - - [5888, 128, 1, 256, 5888, 5888, 256, 256]
    - [5, 0.0]
  - - [448, 1408, 1, 256, 448, 448, 256, 256]
    - [5, 0.0]
  - - [256, 704, 1, 3328, 256, 256, 3328, 3328]
    - [5, 0.0]
  - - [64, 448, 1, 3328, 64, 64, 3328, 3328]
    - [5, 0.0]
  - - [1024, 4, 1, 3328, 1024, 1024, 3328, 3328]
    - [8, 0.0]
  - - [3584, 1856, 1, 768, 3584, 3584, 768, 768]
    - [5, 0.0]
  - - [3584, 128, 1, 3328, 3584, 3584, 3328, 3328]
    - [5, 0.0]
  - - [5888, 128, 1, 1792, 5888, 5888, 1792, 1792]
    - [5, 0.0]
  - - [4288, 64, 1, 256, 4288, 4288, 256, 256]
    - [5, 0.0]
  - - [5056, 4, 1, 256, 5056, 5056, 256, 256]
    - [8, 0.0]
  - - [64, 4288, 1, 1792, 64, 64, 1792, 1792]
    - [5, 0.0]
  - - [2944, 4, 1, 1792, 2944, 2944, 1792, 1792]
    - [8, 0.0]
  - - [1408, 128, 1, 128, 1408, 1408, 128, 128]
    - [0, 790.402]
  - - [64, 448, 1, 128, 64, 64, 128, 128]
    - [0, 122.94]
  - - [2944, 4, 1, 768, 2944, 2944, 768, 768]
    - [8, 0.0]
  - - [64, 1024, 1, 768, 64, 64, 768, 768]
    - [5, 0.0]
  - - [1408, 2944, 1, 1792, 1408, 1408, 1792, 1792]
    - [5, 0.0]
  - - [1408, 128, 1, 256, 1408, 1408, 256, 256]
    - [5, 0.0]
  - - [4288, 128, 1, 768, 4288, 4288, 768, 768]
    - [5, 0.0]
  - - [704, 704, 1, 768, 704, 704, 768, 768]
    - [5, 0.0]
  - - [4288, 1408, 1, 256, 4288, 4288, 256, 256]
    - [5, 0.0]
  - - [2944, 5888, 1, 768, 2944, 2944, 768, 768]
    - [5, 0.0]
  - - [4288, 64, 1, 1792, 4288, 4288, 1792, 1792]
    - [5, 0.0]
  - - [5888, 1856, 1, 1792, 5888, 5888, 1792, 1792]
    - [5, 0.0]
  - - [2368, 256, 1, 256, 2368, 2368, 256, 256]
    - [5, 0.0]
  - - [256, 256, 1, 128, 256, 256, 128, 128]
    - [0, 283.107]
  - - [448, 4288, 1, 3328, 448, 448, 3328, 3328]
    - [5, 0.0]
  - - [64, 256, 1, 1792, 64, 64, 1792, 1792]
    - [5, 0.0]
  - - [2944, 128, 1, 3328, 2944, 2944, 3328, 3328]
    - [5, 0.0]
  - - [704, 4288, 1, 3328, 704, 704, 3328, 3328]
    - [5, 0.0]
  - - [1024, 4288, 1, 128, 1024, 1024, 128, 128]
    - [3, 2375.5]
  - - [4, 704, 1, 1792, 4, 4, 1792, 1792]
    - [8, 0.0]
  - - [6784, 704, 1, 128, 6784, 6784, 128, 128]
    - [1, 2882.52]
  - - [256, 1024, 1, 3328, 256, 256, 3328, 3328]
    - [5, 0.0]
  - - [448, 3584, 1, 768, 448, 448, 768, 768]
    - [5, 0.0]
  - - [1024, 128, 1, 768, 1024, 1024, 768, 768]
    - [5, 0.0]
  - - [1408, 4, 1, 3328, 1408, 1408, 3328, 3328]
    - [8, 0.0]
  - - [1024, 64, 1, 128, 1024, 1024, 128, 128]
    - [0, 273.539]
  - - [3584, 1856, 1, 1792, 3584, 3584, 1792, 1792]
    - [5, 0.0]
  - - [256, 5888, 1, 1792, 256, 256, 1792, 1792]
    - [5, 0.0]
  - - [1024, 4, 1, 768, 1024, 1024, 768, 768]
    - [8, 0.0]
  - - [4288, 704, 1, 1792, 4288, 4288, 1792, 1792]
    - [5, 0.0]
  - - [1024, 704, 1, 256, 1024, 1024, 256, 256]
    - [5, 0.0]
  - - [2368, 2368, 1, 128, 2368, 2368, 128, 128]
    - [1, 3182.09]
  - - [128, 6784, 1, 3328, 128, 128, 3328, 3328]
    - [5, 0.0]
  - - [1024, 5056, 1, 128, 1024, 1024, 128, 128]
    - [2, 2428.42]
  - - [2944, 3584, 1, 768, 2944, 2944, 768, 768]
    - [5, 0.0]
  - - [3584, 2944, 1, 128, 3584, 3584, 128, 128]
    - [1, 3030.13]
  - - [64, 1024, 1, 256, 64, 64, 256, 256]
    - [5, 0.0]
  - - [128, 5056, 1, 768, 128, 128, 768, 768]
    - [5, 0.0]
  - - [4288, 128, 1, 256, 4288, 4288, 256, 256]
    - [5, 0.0]
  - - [4, 5056, 1, 3328, 4, 4, 3328, 3328]
    - [8, 0.0]
  - - [5056, 1856, 1, 768, 5056, 5056, 768, 768]
    - [5, 0.0]
  - - [2368, 1856, 1, 256, 2368, 2368, 256, 256]
    - [5, 0.0]
  - - [2368, 1024, 1, 3328, 2368, 2368, 3328, 3328]
    - [5, 0.0]
  - - [128, 6784, 1, 768, 128, 128, 768, 768]
    - [5, 0.0]
  - - [4, 2944, 1, 3328, 4, 4, 3328, 3328]
    - [8, 0.0]
  - - [256, 1856, 1, 128, 256, 256, 128, 128]
    - [0, 1212.72]
  - - [1024, 704, 1, 128, 1024, 1024, 128, 128]
    - [2, 1382.56]
  - - [256, 256, 1, 3328, 256, 256, 3328, 3328]
    - [5, 0.0]
  - - [128, 4288, 1, 768, 128, 128, 768, 768]
    - [5, 0.0]
  - - [1024, 2368, 1, 256, 1024, 1024, 256, 256]
    - [5, 0.0]
  - - [1408, 5888, 1, 256, 1408, 1408, 256, 256]
    - [5, 0.0]
  - - [3584, 5888, 1, 768, 3584, 3584, 768, 768]
    - [5, 0.0]
  - - [448, 5056, 1, 128, 448, 448, 128, 128]
    - [1, 2571.62]
  - - [64, 2944, 1, 768, 64, 64, 768, 768]
    - [5, 0.0]
  - - [448, 4288, 1, 768, 448, 448, 768, 768]
    - [5, 0.0]
  - - [5888, 704, 1, 3328, 5888, 5888, 3328, 3328]
    - [5, 0.0]
  - - [64, 4288, 1, 3328, 64, 64, 3328, 3328]
    - [5, 0.0]
  - - [6784, 3584, 1, 256, 6784, 6784, 256, 256]
    - [5, 0.0]
  - - [1024, 6784, 1, 128, 1024, 1024, 128, 128]
    - [4, 2503.41]
  - - [1408, 5056, 1, 768, 1408, 1408, 768, 768]
    - [5, 0.0]
  - - [64, 704, 1, 128, 64, 64, 128, 128]
    - [0, 196.109]
  - - [1024, 704, 1, 768, 1024, 1024, 768, 768]
    - [5, 0.0]
  - - [6784, 1024, 1, 3328, 6784, 6784, 3328, 3328]
    - [5, 0.0]
  - - [2368, 3584, 1, 1792, 2368, 2368, 1792, 1792]
    - [5, 0.0]
  - - [64, 2944, 1, 3328, 64, 64, 3328, 3328]
    - [5, 0.0]
  - - [4, 448, 1, 1792, 4, 4, 1792, 1792]
    - [8, 0.0]
  - - [448, 1024, 1, 256, 448, 448, 256, 256]
    - [5, 0.0]
  - - [4288, 1856, 1, 768, 4288, 4288, 768, 768]
    - [5, 0.0]
  - - [2944, 2368, 1, 1792, 2944, 2944, 1792, 1792]
    - [5, 0.0]
  - - [3584, 1408, 1, 1792, 3584, 3584, 1792, 1792]
    - [5, 0.0]
  - - [1024, 6784, 1, 3328, 1024, 1024, 3328, 3328]
    - [5, 0.0]
  - - [2944, 256, 1, 128, 2944, 2944, 128, 128]
    - [0, 1745.73]
  - - [704, 6784, 1, 128, 704, 704, 128, 128]
    - [1, 2940.03]
  - - [1856, 6784, 1, 1792, 1856, 1856, 1792, 1792]
    - [5, 0.0]
  - - [5888, 5888, 1, 128, 5888, 5888, 128, 128]
    - [1, 3225.44]
  - - [3584, 4288, 1, 768, 3584, 3584, 768, 768]
    - [5, 0.0]
  - - [1024, 448, 1, 256, 1024, 1024, 256, 256]
    - [5, 0.0]
  - - [2368, 4288, 1, 3328, 2368, 2368, 3328, 3328]
    - [5, 0.0]
  - - [6784, 5888, 1, 768, 6784, 6784, 768, 768]
    - [5, 0.0]
  - - [6784, 448, 1, 128, 6784, 6784, 128, 128]
    - [3, 2509.17]
  - - [1856, 1024, 1, 1792, 1856, 1856, 1792, 1792]
    - [5, 0.0]
  - - [1856, 3584, 1, 256, 1856, 1856, 256, 256]
    - [5, 0.0]
  - - [64, 2944, 1, 256, 64, 64, 256, 256]
    - [5, 0.0]
  - - [64, 1856, 1, 3328, 64, 64, 3328, 3328]
    - [5, 0.0]
  - - [64, 3584, 1, 3328, 64, 64, 3328, 3328]
    - [5, 0.0]
  - - [1408, 5056, 1, 256, 1408, 1408, 256, 256]
    - [5, 0.0]
  - - [4288, 256, 1, 128, 4288, 4288, 128, 128]
    - [0, 1850.57]
  - - [448, 4, 1, 3328, 448, 448, 3328, 3328]
    - [8, 0.0]
  - - [1408, 1024, 1, 3328, 1408, 1408, 3328, 3328]
    - [5, 0.0]
  - - [448, 2368, 1, 256, 448, 448, 256, 256]
    - [5, 0.0]
  - - [1856, 256, 1, 128, 1856, 1856, 128, 128]
    - [0, 1484.66]
  - - [4288, 3584, 1, 1792, 4288, 4288, 1792, 1792]
    - [5, 0.0]
  - - [128, 2944, 1, 3328, 128, 128, 3328, 3328]
    - [5, 0.0]
  - - [3584, 4, 1, 768, 3584, 3584, 768, 768]
    - [8, 0.0]
  - - [1856, 1408, 1, 3328, 1856, 1856, 3328, 3328]
    - [5, 0.0]
  - - [256, 128, 1, 256, 256, 256, 256, 256]
    - [5, 0.0]
  - - [256, 704, 1, 128, 256, 256, 128, 128]
    - [0, 654.245]
  - - [256, 5056, 1, 256, 256, 256, 256, 256]
    - [5, 0.0]
  - - [5888, 256, 1, 3328, 5888, 5888, 3328, 3328]
    - [5, 0.0]
  - - [5888, 4, 1, 768, 5888, 5888, 768, 768]
    - [8, 0.0]
  - - [2944, 128, 1, 128, 2944, 2944, 128, 128]
    - [0, 1249.81]
  - - [4288, 5056, 1, 128, 4288, 4288, 128, 128]
    - [1, 3423.43]
  - - [6784, 704, 1, 768, 6784, 6784, 768, 768]
    - [5, 0.0]
  - - [3584, 5888, 1, 3328, 3584, 3584, 3328, 3328]
    - [5, 0.0]
  - - [5888, 448, 1, 768, 5888, 5888, 768, 768]
    - [5, 0.0]
  - - [128, 6784, 1, 256, 128, 128, 256, 256]
    - [5, 0.0]
  - - [704, 1856, 1, 128, 704, 704, 128, 128]
    - [1, 2142.13]
  - - [64, 1024, 1, 1792, 64, 64, 1792, 1792]
    - [5, 0.0]
  - - [704, 1856, 1, 1792, 704, 704, 1792, 1792]
    - [5, 0.0]
  - - [2944, 6784, 1, 1792, 2944, 2944, 1792, 1792]
    - [5, 0.0]
  - - [448, 6784, 1, 128, 448, 448, 128, 128]
    - [1, 2872.92]
  - - [448, 5056, 1, 1792, 448, 448, 1792, 1792]
    - [5, 0.0]
  - - [2944, 448, 1, 256, 2944, 2944, 256, 256]
    - [5, 0.0]
  - - [64, 6784, 1, 128, 64, 64, 128, 128]
    - [0, 1311.6]
  - - [704, 704, 1, 128, 704, 704, 128, 128]
    - [0, 1499.84]
  - - [1024, 64, 1, 768, 1024, 1024, 768, 768]
    - [5, 0.0]
  - - [448, 4288, 1, 256, 448, 448, 256, 256]
    - [5, 0.0]
  - - [3584, 64, 1, 256, 3584, 3584, 256, 256]
    - [5, 0.0]
  - - [5056, 5056, 1, 768, 5056, 5056, 768, 768]
    - [5, 0.0]
  - - [4288, 1024, 1, 768, 4288, 4288, 768, 768]
    - [5, 0.0]
  - - [4, 1408, 1, 128, 4, 4, 128, 128]
    - [6, 32.8778]
  - - [128, 2368, 1, 256, 128, 128, 256, 256]
    - [5, 0.0]
  - - [5056, 1024, 1, 3328, 5056, 5056, 3328, 3328]
    - [5, 0.0]
  - - [448, 1856, 1, 128, 448, 448, 128, 128]
    - [4, 1653.37]
  - - [2368, 448, 1, 1792, 2368, 2368, 1792, 1792]
    - [5, 0.0]
  - - [4288, 2368, 1, 128, 4288, 4288, 128, 128]
    - [1, 3289.42]
  - - [5888, 448, 1, 128, 5888, 5888, 128, 128]
    - [3, 2221.29]
  - - [1024, 5888, 1, 768, 1024, 1024, 768, 768]
    - [5, 0.0]
  - - [448, 5056, 1, 768, 448, 448, 768, 768]
    - [5, 0.0]
  - - [704, 4, 1, 768, 704, 704, 768, 768]
    - [8, 0.0]
  - - [2368, 3584, 1, 768, 2368, 2368, 768, 768]
    - [5, 0.0]
  - - [1856, 2368, 1, 256, 1856, 1856, 256, 256]
    - [5, 0.0]
  - - [6784, 2944, 1, 1792, 6784, 6784, 1792, 1792]
    - [5, 0.0]
  - - [256, 2368, 1, 3328, 256, 256, 3328, 3328]
    - [5, 0.0]
  - - [1856, 256, 1, 256, 1856, 1856, 256, 256]
    - [5, 0.0]
  - - [448, 3584, 1, 128, 448, 448, 128, 128]
    - [1, 2119.54]
  - - [4288, 256, 1, 3328, 4288, 4288, 3328, 3328]
    - [5, 0.0]
  - - [1024, 1024, 1, 768, 1024, 1024, 768, 768]
    - [5, 0.0]
  - - [1024, 3584, 1, 256, 1024, 1024, 256, 256]
    - [5, 0.0]
  - - [6784, 6784, 1, 3328, 6784, 6784, 3328, 3328]
    - [5, 0.0]
  - - [6784, 4, 1, 3328, 6784, 6784, 3328, 3328]
    - [8, 0.0]
  - - [704, 2944, 1, 256, 704, 704, 256, 256]
    - [5, 0.0]
  - - [2368, 5888, 1, 256, 2368, 2368, 256, 256]
    - [5, 0.0]
  - - [1408, 4288, 1, 1792, 1408, 1408, 1792, 1792]
    - [5, 0.0]
  - - [4288, 4, 1, 128, 4288, 4288, 128, 128]
    - [7, 93.2016]
  - - [2944, 4288, 1, 128, 2944, 2944, 128, 128]
    - [1, 3317.66]
  - - [448, 2944, 1, 256, 448, 448, 256, 256]
    - [5, 0.0]
  - - [3584, 1024, 1, 768, 3584, 3584, 768, 768]
    - [5, 0.0]
  - - [704, 256, 1, 768, 704, 704, 768, 768]
    - [5, 0.0]
  - - [4288, 1024, 1, 256, 4288, 4288, 256, 256]
    - [5, 0.0]
  - - [256, 128, 1, 3328, 256, 256, 3328, 3328]
    - [5, 0.0]
  - - [1856, 2944, 1, 1792, 1856, 1856, 1792, 1792]
    - [5, 0.0]
  - - [4288, 4288, 1, 128, 4288, 4288, 128, 128]
    - [1, 3411.58]
  - - [2368, 128, 1, 768, 2368, 2368, 768, 768]
    - [5, 0.0]
  - - [4, 1856, 1, 1792, 4, 4, 1792, 1792]
    - [8, 0.0]
  - - [2368, 4288, 1, 128, 2368, 2368, 128, 128]
    - [1, 3285.72]
  - - [1024, 4288, 1, 256, 1024, 1024, 256, 256]
    - [5, 0.0]
  - - [256, 3584, 1, 1792, 256, 256, 1792, 1792]
    - [5, 0.0]
  - - [704, 1856, 1, 256, 704, 704, 256, 256]
    - [5, 0.0]
  - - [1024, 1408, 1, 256, 1024, 1024, 256, 256]
    - [5, 0.0]
  - - [5888, 64, 1, 128, 5888, 5888, 128, 128]
    - [0, 1177.5]
  - - [256, 1024, 1, 1792, 256, 256, 1792, 1792]
    - [5, 0.0]
  - - [5888, 1408, 1, 3328, 5888, 5888, 3328, 3328]
    - [5, 0.0]
  - - [5888, 1856, 1, 128, 5888, 5888, 128, 128]
    - [1, 2990.25]
  - - [256, 2368, 1, 128, 256, 256, 128, 128]
    - [2, 1315.95]
  - - [3584, 128, 1, 128, 3584, 3584, 128, 128]
    - [2, 1246.4]
  - - [5056, 128, 1, 128, 5056, 5056, 128, 128]
    - [0, 1681.64]
  - - [2944, 2944, 1, 128, 2944, 2944, 128, 128]
    - [1, 3151.63]
  - - [3584, 6784, 1, 128, 3584, 3584, 128, 128]
    - [1, 3176.59]
  - - [64, 4288, 1, 768, 64, 64, 768, 768]
    - [5, 0.0]
  - - [2944, 5056, 1, 256, 2944, 2944, 256, 256]
    - [5, 0.0]
  - - [2368, 256, 1, 128, 2368, 2368, 128, 128]
    - [0, 1606.61]
  - - [4288, 448, 1, 3328, 4288, 4288, 3328, 3328]
    - [5, 0.0]
  - - [256, 6784, 1, 768, 256, 256, 768, 768]
    - [5, 0.0]
  - - [128, 1408, 1, 3328, 128, 128, 3328, 3328]
    - [5, 0.0]
  - - [1856, 2368, 1, 768, 1856, 1856, 768, 768]
    - [5, 0.0]
  - - [4, 4288, 1, 1792, 4, 4, 1792, 1792]
    - [8, 0.0]
  - - [2368, 5888, 1, 1792, 2368, 2368, 1792, 1792]
    - [5, 0.0]
  - - [6784, 64, 1, 768, 6784, 6784, 768, 768]
    - [5, 0.0]
  - - [3584, 5056, 1, 1792, 3584, 3584, 1792, 1792]
    - [5, 0.0]
  - - [1856, 448, 1, 128, 1856, 1856, 128, 128]
    - [2, 1692.31]
  - - [4288, 2368, 1, 768, 4288, 4288, 768, 768]
    - [5, 0.0]
  - - [2944, 128, 1, 256, 2944, 2944, 256, 256]
    - [5, 0.0]
  - - [6784, 6784, 1, 768, 6784, 6784, 768, 768]
    - [5, 0.0]
  - - [128, 128, 1, 128, 128, 128, 128, 128]
    - [0, 68.8833]
  - - [1856, 1856, 1, 128, 1856, 1856, 128, 128]
    - [1, 2876.94]
  - - [5056, 5888, 1, 128, 5056, 5056, 128, 128]
    - [1, 3497.49]
  - - [5056, 3584, 1, 128, 5056, 5056, 128, 128]
    - [1, 3375.96]
  - - [5056, 2368, 1, 768, 5056, 5056, 768, 768]
    - [5, 0.0]
  - - [256, 5056, 1, 3328, 256, 256, 3328, 3328]
    - [5, 0.0]
  - - [2944, 64, 1, 256, 2944, 2944, 256, 256]
    - [5, 0.0]
  - - [4, 256, 1, 1792, 4, 4, 1792, 1792]
    - [8, 0.0]
  - - [2368, 256, 1, 768, 2368, 2368, 768, 768]
    - [5, 0.0]
  - - [128, 1408, 1, 256, 128, 128, 256, 256]
    - [5, 0.0]
  - - [1024, 2368, 1, 3328, 1024, 1024, 3328, 3328]
    - [5, 0.0]
  - - [3584, 3584, 1, 768, 3584, 3584, 768, 768]
    - [5, 0.0]
  - - [4, 704, 1, 768, 4, 4, 768, 768]
    - [8, 0.0]
  - - [3584, 4288, 1, 256, 3584, 3584, 256, 256]
    - [5, 0.0]
  - - [5056, 4, 1, 768, 5056, 5056, 768, 768]
    - [8, 0.0]
  - - [2368, 5056, 1, 768, 2368, 2368, 768, 768]
    - [5, 0.0]
  - - [5056, 2944, 1, 128, 5056, 5056, 128, 128]
    - [1, 3338.16]
  - - [2368, 448, 1, 128, 2368, 2368, 128, 128]
    - [0, 1798.96]
  - - [128, 5888, 1, 256, 128, 128, 256, 256]
    - [5, 0.0]
  - - [1408, 1024, 1, 128, 1408, 1408, 128, 128]
    - [2, 2091.83]
  - - [3584, 448, 1, 128, 3584, 3584, 128, 128]
    - [2, 1945.63]
  - - [256, 5888, 1, 3328, 256, 256, 3328, 3328]
    - [5, 0.0]
  - - [1856, 704, 1, 768, 1856, 1856, 768, 768]
    - [5, 0.0]
  - - [4, 1856, 1, 3328, 4, 4, 3328, 3328]
    - [8, 0.0]
  - - [2368, 5056, 1, 128, 2368, 2368, 128, 128]
    - [1, 3336.28]
  - - [448, 1408, 1, 1792, 448, 448, 1792, 1792]
    - [5, 0.0]
  - - [5056, 128, 1, 3328, 5056, 5056, 3328, 3328]
    - [5, 0.0]
  - - [5888, 6784, 1, 768, 5888, 5888, 768, 768]
    - [5, 0.0]
  - - [4288, 64, 1, 3328, 4288, 4288, 3328, 3328]
    - [5, 0.0]
  - - [448, 1024, 1, 3328, 448, 448, 3328, 3328]
    - [5, 0.0]
  - - [4, 448, 1, 256, 4, 4, 256, 256]
    - [8, 0.0]
  - - [5888, 704, 1, 256, 5888, 5888, 256, 256]
    - [5, 0.0]
  - - [1856, 1024, 1, 128, 1856, 1856, 128, 128]
    - [1, 2454.47]
  - - [6784, 4288, 1, 256, 6784, 6784, 256, 256]
    - [5, 0.0]
  - - [704, 4288, 1, 256, 704, 704, 256, 256]
    - [5, 0.0]
  - - [128, 2368, 1, 3328, 128, 128, 3328, 3328]
    - [5, 0.0]
  - - [448, 1856, 1, 256, 448, 448, 256, 256]
    - [5, 0.0]
  - - [5888, 64, 1, 1792, 5888, 5888, 1792, 1792]
    - [5, 0.0]
  - - [64, 2944, 1, 1792, 64, 64, 1792, 1792]
    - [5, 0.0]
  - - [4288, 5056, 1, 768, 4288, 4288, 768, 768]
    - [5, 0.0]
  - - [128, 5888, 1, 3328, 128, 128, 3328, 3328]
    - [5, 0.0]
  - - [1408, 64, 1, 768, 1408, 1408, 768, 768]
    - [5, 0.0]
  - - [256, 256, 1, 1792, 256, 256, 1792, 1792]
    - [5, 0.0]
  - - [1856, 1408, 1, 256, 1856, 1856, 256, 256]
    - [5, 0.0]
  - - [5056, 6784, 1, 128, 5056, 5056, 128, 128]
    - [1, 3455.32]
  - - [1856, 128, 1, 128, 1856, 1856, 128, 128]
    - [0, 961.388]
  - - [256, 64, 1, 128, 256, 256, 128, 128]
    - [0, 68.3835]
  - - [6784, 128, 1, 768, 6784, 6784, 768, 768]
    - [5, 0.0]
  - - [256, 2368, 1, 256, 256, 256, 256, 256]
    - [5, 0.0]
  - - [6784, 2944, 1, 128, 6784, 6784, 128, 128]
    - [1, 3388.1]
  - - [2368, 6784, 1, 3328, 2368, 2368, 3328, 3328]
    - [5, 0.0]
  - - [64, 1408, 1, 128, 64, 64, 128, 128]
    - [0, 401.313]
  - - [1408, 64, 1, 3328, 1408, 1408, 3328, 3328]
    - [5, 0.0]
  - - [5056, 1856, 1, 256, 5056, 5056, 256, 256]
    - [5, 0.0]
  - - [4, 128, 1, 256, 4, 4, 256, 256]
    - [8, 0.0]
  - - [1856, 1856, 1, 3328, 1856, 1856, 3328, 3328]
    - [5, 0.0]
  - - [1024, 5888, 1, 3328, 1024, 1024, 3328, 3328]
    - [5, 0.0]
  - - [64, 128, 1, 1792, 64, 64, 1792, 1792]
    - [5, 0.0]
  - - [2944, 128, 1, 1792, 2944, 2944, 1792, 1792]
    - [5, 0.0]
  - - [4, 64, 1, 3328, 4, 4, 3328, 3328]
    - [8, 0.0]
  - - [704, 3584, 1, 256, 704, 704, 256, 256]
    - [5, 0.0]
  - - [1408, 5888, 1, 1792, 1408, 1408, 1792, 1792]
    - [5, 0.0]
  - - [6784, 1024, 1, 768, 6784, 6784, 768, 768]
    - [5, 0.0]
  - - [6784, 4288, 1, 1792, 6784, 6784, 1792, 1792]
    - [5, 0.0]
  - - [448, 3584, 1, 1792, 448, 448, 1792, 1792]
    - [5, 0.0]
  - - [6784, 5056, 1, 256, 6784, 6784, 256, 256]
    - [5, 0.0]
  - - [1856, 64, 1, 3328, 1856, 1856, 3328, 3328]
    - [5, 0.0]
  - - [256, 4288, 1, 256, 256, 256, 256, 256]
    - [5, 0.0]
  - - [5056, 2944, 1, 256, 5056, 5056, 256, 256]
    - [5, 0.0]
  - - [448, 4, 1, 768, 448, 448, 768, 768]
    - [8, 0.0]
  - - [128, 1856, 1, 1792, 128, 128, 1792, 1792]
    - [5, 0.0]
  - - [1856, 448, 1, 1792, 1856, 1856, 1792, 1792]
    - [5, 0.0]
  - - [5888, 128, 1, 768, 5888, 5888, 768, 768]
    - [5, 0.0]
  - - [5888, 1024, 1, 768, 5888, 5888, 768, 768]
    - [5, 0.0]
  - - [3584, 2944, 1, 1792, 3584, 3584, 1792, 1792]
    - [5, 0.0]
  - - [4288, 128, 1, 128, 4288, 4288, 128, 128]
    - [0, 1470.41]
  - - [5888, 2944, 1, 128, 5888, 5888, 128, 128]
    - [1, 3162.28]
  - - [2944, 4, 1, 3328, 2944, 2944, 3328, 3328]
    - [8, 0.0]
  - - [4288, 3584, 1, 768, 4288, 4288, 768, 768]
    - [5, 0.0]
  - - [128, 1024, 1, 3328, 128, 128, 3328, 3328]
    - [5, 0.0]
  - - [2944, 704, 1, 768, 2944, 2944, 768, 768]
    - [5, 0.0]
  - - [5056, 128, 1, 256, 5056, 5056, 256, 256]
    - [5, 0.0]
  - - [448, 2368, 1, 3328, 448, 448, 3328, 3328]
    - [5, 0.0]
  - - [256, 704, 1, 768, 256, 256, 768, 768]
    - [5, 0.0]
  - - [1856, 2368, 1, 1792, 1856, 1856, 1792, 1792]
    - [5, 0.0]
  - - [256, 64, 1, 3328, 256, 256, 3328, 3328]
    - [5, 0.0]
  - - [1408, 448, 1, 768, 1408, 1408, 768, 768]
    - [5, 0.0]
  - - [6784, 3584, 1, 768, 6784, 6784, 768, 768]
    - [5, 0.0]
  - - [4, 256, 1, 128, 4, 4, 128, 128]
    - [6, 6.16534]
  - - [3584, 256, 1, 256, 3584, 3584, 256, 256]
    - [5, 0.0]
  - - [704, 64, 1, 256, 704, 704, 256, 256]
    - [5, 0.0]
  - - [5888, 704, 1, 128, 5888, 5888, 128, 128]
    - [1, 2574.65]
  - - [3584, 4288, 1, 3328, 3584, 3584, 3328, 3328]
    - [5, 0.0]
  - - [3584, 128, 1, 1792, 3584, 3584, 1792, 1792]
    - [5, 0.0]
  - - [3584, 256, 1, 128, 3584, 3584, 128, 128]
    - [4, 1708.42]
  - - [704, 4, 1, 3328, 704, 704, 3328, 3328]
    - [8, 0.0]
  - - [5056, 4288, 1, 3328, 5056, 5056, 3328, 3328]
    - [5, 0.0]
  - - [4, 64, 1, 128, 4, 4, 128, 128]
    - [6, 1.5576]
  - - [2368, 2368, 1, 3328, 2368, 2368, 3328, 3328]
    - [5, 0.0]
  - - [2368, 448, 1, 768, 2368, 2368, 768, 768]
    - [5, 0.0]
  - - [704, 3584, 1, 128, 704, 704, 128, 128]
    - [1, 2773.47]
  - - [1408, 1856, 1, 256, 1408, 1408, 256, 256]
    - [5, 0.0]
  - - [4, 2944, 1, 256, 4, 4, 256, 256]
    - [8, 0.0]
  - - [1024, 4288, 1, 768, 1024, 1024, 768, 768]
    - [5, 0.0]
  - - [256, 5888, 1, 128, 256, 256, 128, 128]
    - [1, 2015.95]
  - - [704, 128, 1, 1792, 704, 704, 1792, 1792]
    - [5, 0.0]
  - - [3584, 704, 1, 768, 3584, 3584, 768, 768]
    - [5, 0.0]
  - - [256, 64, 1, 768, 256, 256, 768, 768]
    - [5, 0.0]
  - - [704, 6784, 1, 768, 704, 704, 768, 768]
    - [5, 0.0]
  - - [5056, 4288, 1, 768, 5056, 5056, 768, 768]
    - [5, 0.0]
  - - [2368, 3584, 1, 3328, 2368, 2368, 3328, 3328]
    - [5, 0.0]
  - - [5056, 2368, 1, 3328, 5056, 5056, 3328, 3328]
    - [5, 0.0]
  - - [2944, 6784, 1, 128, 2944, 2944, 128, 128]
    - [1, 3402.46]
  - - [5056, 3584, 1, 1792, 5056, 5056, 1792, 1792]
    - [5, 0.0]
  - - [704, 6784, 1, 1792, 704, 704, 1792, 1792]
    - [5, 0.0]
  - - [704, 4, 1, 256, 704, 704, 256, 256]
    - [8, 0.0]
  - - [128, 2944, 1, 256, 128, 128, 256, 256]
    - [5, 0.0]
  - - [1408, 2368, 1, 3328, 1408, 1408, 3328, 3328]
    - [5, 0.0]
  - - [448, 2368, 1, 128, 448, 448, 128, 128]
    - [0, 1791.92]
  - - [3584, 704, 1, 3328, 3584, 3584, 3328, 3328]
    - [5, 0.0]
  - - [2944, 4, 1, 256, 2944, 2944, 256, 256]
    - [8, 0.0]
  - - [4, 3584, 1, 256, 4, 4, 256, 256]
    - [8, 0.0]
  - - [1024, 2368, 1, 768, 1024, 1024, 768, 768]
    - [5, 0.0]
  - - [256, 1856, 1, 1792, 256, 256, 1792, 1792]
    - [5, 0.0]
  - - [2368, 4288, 1, 1792, 2368, 2368, 1792, 1792]
    - [5, 0.0]
  - - [704, 128, 1, 768, 704, 704, 768, 768]
    - [5, 0.0]
  - - [6784, 2368, 1, 1792, 6784, 6784, 1792, 1792]
    - [5, 0.0]
  - - [704, 1408, 1, 128, 704, 704, 128, 128]
    - [1, 2003.3]
  - - [5056, 256, 1, 3328, 5056, 5056, 3328, 3328]
    - [5, 0.0]
  - - [5888, 1856, 1, 256, 5888, 5888, 256, 256]
    - [5, 0.0]
  - - [5888, 5056, 1, 256, 5888, 5888, 256, 256]
    - [5, 0.0]
  - - [4, 1856, 1, 256, 4, 4, 256, 256]
    - [8, 0.0]
  - - [5888, 4288, 1, 768, 5888, 5888, 768, 768]
    - [5, 0.0]
  - - [4, 2944, 1, 768, 4, 4, 768, 768]
    - [8, 0.0]
  - - [5056, 6784, 1, 3328, 5056, 5056, 3328, 3328]
    - [5, 0.0]
  - - [64, 1856, 1, 768, 64, 64, 768, 768]
    - [5, 0.0]
  - - [2368, 2944, 1, 128, 2368, 2368, 128, 128]
    - [1, 3130.54]
  - - [5056, 1856, 1, 1792, 5056, 5056, 1792, 1792]
    - [5, 0.0]
  - - [1408, 448, 1, 256, 1408, 1408, 256, 256]
    - [5, 0.0]
  - - [4288, 128, 1, 3328, 4288, 4288, 3328, 3328]
    - [5, 0.0]
  - - [1024, 2944, 1, 256, 1024, 1024, 256, 256]
    - [5, 0.0]
  - - [5056, 5056, 1, 1792, 5056, 5056, 1792, 1792]
    - [5, 0.0]
  - - [448, 448, 1, 128, 448, 448, 128, 128]
    - [0, 862.707]
  - - [256, 4, 1, 256, 256, 256, 256, 256]
    - [8, 0.0]
  - - [256, 1856, 1, 768, 256, 256, 768, 768]
    - [5, 0.0]
  - - [1408, 3584, 1, 1792, 1408, 1408, 1792, 1792]
    - [5, 0.0]
  - - [5888, 2368, 1, 128, 5888, 5888, 128, 128]
    - [1, 3087.62]
  - - [64, 448, 1, 1792, 64, 64, 1792, 1792]
    - [5, 0.0]
  - - [3584, 4, 1, 256, 3584, 3584, 256, 256]
    - [8, 0.0]
  - - [64, 5888, 1, 128, 64, 64, 128, 128]
    - [0, 1164.86]
  - - [4288, 256, 1, 1792, 4288, 4288, 1792, 1792]
    - [5, 0.0]
  - - [6784, 3584, 1, 3328, 6784, 6784, 3328, 3328]
    - [5, 0.0]
  - - [3584, 64, 1, 128, 3584, 3584, 128, 128]
    - [0, 808.886]
  - - [1408, 1408, 1, 1792, 1408, 1408, 1792, 1792]
    - [5, 0.0]
  - - [1408, 1408, 1, 768, 1408, 1408, 768, 768]
    - [5, 0.0]
  - - [64, 1856, 1, 1792, 64, 64, 1792, 1792]
    - [5, 0.0]
  - - [64, 5056, 1, 3328, 64, 64, 3328, 3328]
    - [5, 0.0]
  - - [128, 64, 1, 1792, 128, 128, 1792, 1792]
    - [5, 0.0]
  - - [6784, 5056, 1, 3328, 6784, 6784, 3328, 3328]
    - [5, 0.0]
  - - [704, 3584, 1, 3328, 704, 704, 3328, 3328]
    - [5, 0.0]
  - - [1408, 256, 1, 256, 1408, 1408, 256, 256]
    - [5, 0.0]
  - - [448, 1856, 1, 3328, 448, 448, 3328, 3328]
    - [5, 0.0]
  - - [3584, 1408, 1, 128, 3584, 3584, 128, 128]
    - [1, 2729.2]
  - - [1856, 4, 1, 128, 1856, 1856, 128, 128]
    - [6, 43.4857]
  - - [2368, 704, 1, 3328, 2368, 2368, 3328, 3328]
    - [5, 0.0]
  - - [128, 64, 1, 3328, 128, 128, 3328, 3328]
    - [5, 0.0]
  - - [448, 704, 1, 128, 448, 448, 128, 128]
    - [0, 1103.21]
  - - [4, 128, 1, 128, 4, 4, 128, 128]
    - [6, 3.10428]
  - - [704, 5056, 1, 3328, 704, 704, 3328, 3328]
    - [5, 0.0]
  - - [5056, 448, 1, 3328, 5056, 5056, 3328, 3328]
    - [5, 0.0]
  - - [4, 1856, 1, 768, 4, 4, 768, 768]
    - [8, 0.0]
  - - [256, 4, 1, 128, 256, 256, 128, 128]
    - [6, 6.41111]
  - - [6784, 1024, 1, 128, 6784, 6784, 128, 128]
    - [1, 3007.74]
  - - [3584, 64, 1, 3328, 3584, 3584, 3328, 3328]
    - [5, 0.0]
  - - [2368, 5888, 1, 3328, 2368, 2368, 3328, 3328]
    - [5, 0.0]
  - - [5888, 256, 1, 1792, 5888, 5888, 1792, 1792]
    - [5, 0.0]
  - - [128, 128, 1, 3328, 128, 128, 3328, 3328]
    - [5, 0.0]
  - - [4288, 5888, 1, 768, 4288, 4288, 768, 768]
    - [5, 0.0]
  - - [128, 4, 1, 768, 128, 128, 768, 768]
    - [8, 0.0]
  - - [1856, 3584, 1, 128, 1856, 1856, 128, 128]
    - [1, 3146.53]
  - - [4288, 4288, 1, 768, 4288, 4288, 768, 768]
    - [5, 0.0]
  - - [256, 6784, 1, 1792, 256, 256, 1792, 1792]
    - [5, 0.0]
  - - [4288, 4288, 1, 1792, 4288, 4288, 1792, 1792]
    - [5, 0.0]
  - - [4, 704, 1, 3328, 4, 4, 3328, 3328]
    - [8, 0.0]
  - - [6784, 1856, 1, 1792, 6784, 6784, 1792, 1792]
    - [5, 0.0]
  - - [256, 5888, 1, 256, 256, 256, 256, 256]
    - [5, 0.0]
  - - [5056, 128, 1, 768, 5056, 5056, 768, 768]
    - [5, 0.0]
  - - [1408, 1856, 1, 128, 1408, 1408, 128, 128]
    - [2, 2466.2]
  - - [1408, 64, 1, 256, 1408, 1408, 256, 256]
    - [5, 0.0]
  - - [6784, 5056, 1, 768, 6784, 6784, 768, 768]
    - [5, 0.0]
  - - [5056, 128, 1, 1792, 5056, 5056, 1792, 1792]
    - [5, 0.0]
  - - [128, 4, 1, 256, 128, 128, 256, 256]
    - [8, 0.0]
  - - [704, 2368, 1, 768, 704, 704, 768, 768]
    - [5, 0.0]
  - - [704, 2944, 1, 128, 704, 704, 128, 128]
    - [1, 2569.12]
  - - [1024, 256, 1, 128, 1024, 1024, 128, 128]
    - [0, 911.421]
  - - [5056, 5056, 1, 256, 5056, 5056, 256, 256]
    - [5, 0.0]
  - - [4288, 1408, 1, 3328, 4288, 4288, 3328, 3328]
    - [5, 0.0]
  - - [1024, 64, 1, 256, 1024, 1024, 256, 256]
    - [5, 0.0]
  - - [2368, 1408, 1, 3328, 2368, 2368, 3328, 3328]
    - [5, 0.0]
  - - [1408, 5888, 1, 3328, 1408, 1408, 3328, 3328]
    - [5, 0.0]
  - - [128, 448, 1, 128, 128, 128, 128, 128]
    - [0, 236.485]
  - - [2368, 4, 1, 128, 2368, 2368, 128, 128]
    - [6, 54.377]
  - - [6784, 5888, 1, 128, 6784, 6784, 128, 128]
    - [1, 3504.74]
  - - [2368, 1024, 1, 128, 2368, 2368, 128, 128]
    - [1, 2638.57]
  - - [2944, 256, 1, 768, 2944, 2944, 768, 768]
    - [5, 0.0]
  - - [2944, 704, 1, 128, 2944, 2944, 128, 128]
    - [2, 2318.01]
  - - [4, 1024, 1, 768, 4, 4, 768, 768]
    - [8, 0.0]
  - - [256, 3584, 1, 768, 256, 256, 768, 768]
    - [5, 0.0]
  - - [704, 2944, 1, 768, 704, 704, 768, 768]
    - [5, 0.0]
  - - [5888, 4288, 1, 128, 5888, 5888, 128, 128]
    - [1, 3150.67]
  - - [5056, 6784, 1, 256, 5056, 5056, 256, 256]
    - [5, 0.0]
  - - [1024, 448, 1, 1792, 1024, 1024, 1792, 1792]
    - [5, 0.0]
  - - [4, 5888, 1, 3328, 4, 4, 3328, 3328]
    - [8, 0.0]
  - - [3584, 3584, 1, 1792, 3584, 3584, 1792, 1792]
    - [5, 0.0]
  - - [5888, 64, 1, 256, 5888, 5888, 256, 256]
    - [5, 0.0]
  - - [5888, 4, 1, 256, 5888, 5888, 256, 256]
    - [8, 0.0]
  - - [6784, 4, 1, 256, 6784, 6784, 256, 256]
    - [8, 0.0]
  - - [2944, 64, 1, 768, 2944, 2944, 768, 768]
    - [5, 0.0]
  - - [256, 4288, 1, 1792, 256, 256, 1792, 1792]
    - [5, 0.0]
  - - [448, 2368, 1, 1792, 448, 448, 1792, 1792]
    - [5, 0.0]
  - - [256, 4, 1, 768, 256, 256, 768, 768]
    - [8, 0.0]
  - - [448, 3584, 1, 256, 448, 448, 256, 256]
    - [5, 0.0]
  - - [448, 1024, 1, 768, 448, 448, 768, 768]
    - [5, 0.0]
  - - [5888, 1856, 1, 768, 5888, 5888, 768, 768]
    - [5, 0.0]
  - - [1408, 4, 1, 1792, 1408, 1408, 1792, 1792]
    - [8, 0.0]
  - - [4288, 6784, 1, 128, 4288, 4288, 128, 128]
    - [1, 3468.07]
  - - [64, 5056, 1, 768, 64, 64, 768, 768]
    - [5, 0.0]
  - - [3584, 704, 1, 128, 3584, 3584, 128, 128]
    - [1, 2330.25]
  - - [1856, 4, 1, 1792, 1856, 1856, 1792, 1792]
    - [8, 0.0]
  - - [128, 1024, 1, 256, 128, 128, 256, 256]
    - [5, 0.0]
  - - [1024, 3584, 1, 768, 1024, 1024, 768, 768]
    - [5, 0.0]
  - - [1024, 256, 1, 768, 1024, 1024, 768, 768]
    - [5, 0.0]
  - - [4288, 1856, 1, 256, 4288, 4288, 256, 256]
    - [5, 0.0]
  - - [6784, 256, 1, 1792, 6784, 6784, 1792, 1792]
    - [5, 0.0]
  - - [1024, 704, 1, 1792, 1024, 1024, 1792, 1792]
    - [5, 0.0]
  - - [448, 2368, 1, 768, 448, 448, 768, 768]
    - [5, 0.0]
  - - [2368, 1408, 1, 1792, 2368, 2368, 1792, 1792]
    - [5, 0.0]
  - - [2944, 1024, 1, 128, 2944, 2944, 128, 128]
    - [1, 2590.36]
  - - [4288, 448, 1, 256, 4288, 4288, 256, 256]
    - [5, 0.0]
  - - [256, 3584, 1, 128, 256, 256, 128, 128]
    - [0, 1642.93]
  - - [128, 4, 1, 1792, 128, 128, 1792, 1792]
    - [8, 0.0]
  - - [64, 5888, 1, 3328, 64, 64, 3328, 3328]
    - [5, 0.0]
  - - [704, 64, 1, 3328, 704, 704, 3328, 3328]
    - [5, 0.0]
  - - [2944, 1408, 1, 256, 2944, 2944, 256, 256]
    - [5, 0.0]
  - - [1408, 3584, 1, 3328, 1408, 1408, 3328, 3328]
    - [5, 0.0]
  - - [1856, 1408, 1, 128, 1856, 1856, 128, 128]
    - [1, 2756.77]
  - - [1856, 256, 1, 1792, 1856, 1856, 1792, 1792]
    - [5, 0.0]
  - - [5888, 6784, 1, 256, 5888, 5888, 256, 256]
    - [5, 0.0]
  - - [3584, 1856, 1, 3328, 3584, 3584, 3328, 3328]
    - [5, 0.0]
  - - [5056, 256, 1, 1792, 5056, 5056, 1792, 1792]
    - [5, 0.0]
  - - [448, 128, 1, 1792, 448, 448, 1792, 1792]
    - [5, 0.0]
  - - [4, 128, 1, 768, 4, 4, 768, 768]
    - [8, 0.0]
  - - [1856, 5888, 1, 128, 1856, 1856, 128, 128]
    - [1, 3363.04]
  - - [3584, 128, 1, 256, 3584, 3584, 256, 256]
    - [5, 0.0]
  - - [4, 4, 1, 768, 4, 4, 768, 768]
    - [8, 0.0]
  - - [1408, 2368, 1, 256, 1408, 1408, 256, 256]
    - [5, 0.0]
  - - [4288, 4, 1, 3328, 4288, 4288, 3328, 3328]
    - [8, 0.0]
  - - [4, 4, 1, 3328, 4, 4, 3328, 3328]
    - [8, 0.0]
  - - [256, 1408, 1, 1792, 256, 256, 1792, 1792]
    - [5, 0.0]
  - - [256, 64, 1, 1792, 256, 256, 1792, 1792]
    - [5, 0.0]
  - - [1408, 256, 1, 768, 1408, 1408, 768, 768]
    - [5, 0.0]
  - - [1856, 64, 1, 768, 1856, 1856, 768, 768]
    - [5, 0.0]
  - - [128, 1856, 1, 768, 128, 128, 768, 768]
    - [5, 0.0]
  - - [704, 256, 1, 256, 704, 704, 256, 256]
    - [5, 0.0]
  - - [3584, 5888, 1, 256, 3584, 3584, 256, 256]
    - [5, 0.0]
  - - [3584, 1024, 1, 128, 3584, 3584, 128, 128]
    - [1, 2693.99]
  - - [1856, 4288, 1, 1792, 1856, 1856, 1792, 1792]
    - [5, 0.0]
  - - [128, 256, 1, 3328, 128, 128, 3328, 3328]
    - [5, 0.0]
  - - [1408, 6784, 1, 3328, 1408, 1408, 3328, 3328]
    - [5, 0.0]
  - - [448, 5888, 1, 1792, 448, 448, 1792, 1792]
    - [5, 0.0]
  - - [448, 6784, 1, 3328, 448, 448, 3328, 3328]
    - [5, 0.0]
  - - [5888, 2944, 1, 1792, 5888, 5888, 1792, 1792]
    - [5, 0.0]
  - - [704, 5888, 1, 256, 704, 704, 256, 256]
    - [5, 0.0]
  - - [5888, 2368, 1, 1792, 5888, 5888, 1792, 1792]
    - [5, 0.0]
  - - [4, 5888, 1, 768, 4, 4, 768, 768]
    - [8, 0.0]
  - - [2368, 64, 1, 128, 2368, 2368, 128, 128]
    - [0, 561.97]
  - - [64, 128, 1, 768, 64, 64, 768, 768]
    - [5, 0.0]
  - - [128, 1024, 1, 1792, 128, 128, 1792, 1792]
    - [5, 0.0]
  - - [1408, 4288, 1, 768, 1408, 1408, 768, 768]
    - [5, 0.0]
  - - [2368, 256, 1, 3328, 2368, 2368, 3328, 3328]
    - [5, 0.0]
  - - [256, 6784, 1, 128, 256, 256, 128, 128]
    - [2, 2038.7]
  - - [5888, 64, 1, 768, 5888, 5888, 768, 768]
    - [5, 0.0]
  - - [704, 256, 1, 3328, 704, 704, 3328, 3328]
    - [5, 0.0]
  - - [128, 1408, 1, 128, 128, 128, 128, 128]
    - [0, 743.252]
  - - [5888, 4288, 1, 256, 5888, 5888, 256, 256]
    - [5, 0.0]
  - - [1856, 5888, 1, 1792, 1856, 1856, 1792, 1792]
    - [5, 0.0]
  - - [1408, 2944, 1, 768, 1408, 1408, 768, 768]
    - [5, 0.0]
  - - [6784, 6784, 1, 128, 6784, 6784, 128, 128]
    - [1, 3534.16]
  - - [5888, 5056, 1, 1792, 5888, 5888, 1792, 1792]
    - [5, 0.0]
  - - [1856, 6784, 1, 768, 1856, 1856, 768, 768]
    - [5, 0.0]
  - - [2944, 5056, 1, 768, 2944, 2944, 768, 768]
    - [5, 0.0]
  - - [1408, 5056, 1, 1792, 1408, 1408, 1792, 1792]
    - [5, 0.0]
  - - [1408, 704, 1, 128, 1408, 1408, 128, 128]
    - [2, 1882.22]
  - - [1024, 5056, 1, 1792, 1024, 1024, 1792, 1792]
    - [5, 0.0]
  - - [1408, 6784, 1, 768, 1408, 1408, 768, 768]
    - [5, 0.0]
  - - [4288, 3584, 1, 256, 4288, 4288, 256, 256]
    - [5, 0.0]
  - - [3584, 256, 1, 768, 3584, 3584, 768, 768]
    - [5, 0.0]
  - - [4, 448, 1, 768, 4, 4, 768, 768]
    - [8, 0.0]
  - - [128, 64, 1, 128, 128, 128, 128, 128]
    - [0, 34.7798]
  - - [2368, 64, 1, 256, 2368, 2368, 256, 256]
    - [5, 0.0]
  - - [6784, 6784, 1, 256, 6784, 6784, 256, 256]
    - [5, 0.0]
  - - [5056, 1024, 1, 128, 5056, 5056, 128, 128]
    - [1, 3173.56]
  - - [256, 1408, 1, 128, 256, 256, 128, 128]
    - [2, 987.075]
  - - [5056, 4, 1, 3328, 5056, 5056, 3328, 3328]
    - [8, 0.0]
  - - [128, 4288, 1, 3328, 128, 128, 3328, 3328]
    - [5, 0.0]
  - - [6784, 6784, 1, 1792, 6784, 6784, 1792, 1792]
    - [5, 0.0]
  - - [64, 256, 1, 3328, 64, 64, 3328, 3328]
    - [5, 0.0]
  - - [128, 2368, 1, 768, 128, 128, 768, 768]
    - [5, 0.0]
  - - [256, 1408, 1, 3328, 256, 256, 3328, 3328]
    - [5, 0.0]
  - - [5888, 2368, 1, 3328, 5888, 5888, 3328, 3328]
    - [5, 0.0]
  - - [704, 64, 1, 768, 704, 704, 768, 768]
    - [5, 0.0]
  - - [1024, 1856, 1, 1792, 1024, 1024, 1792, 1792]
    - [5, 0.0]
  - - [448, 128, 1, 3328, 448, 448, 3328, 3328]
    - [5, 0.0]
  - - [6784, 128, 1, 256, 6784, 6784, 256, 256]
    - [5, 0.0]
  - - [256, 5056, 1, 768, 256, 256, 768, 768]
    - [5, 0.0]
  - - [4288, 5056, 1, 3328, 4288, 4288, 3328, 3328]
    - [5, 0.0]
  - - [64, 2368, 1, 3328, 64, 64, 3328, 3328]
    - [5, 0.0]
  - - [3584, 448, 1, 768, 3584, 3584, 768, 768]
    - [5, 0.0]
  - - [5056, 704, 1, 128, 5056, 5056, 128, 128]
    - [1, 2775.53]
  - - [2944, 448, 1, 3328, 2944, 2944, 3328, 3328]
    - [5, 0.0]
  - - [448, 5888, 1, 768, 448, 448, 768, 768]
    - [5, 0.0]
  - - [6784, 1024, 1, 1792, 6784, 6784, 1792, 1792]
    - [5, 0.0]
  - - [5056, 2368, 1, 1792, 5056, 5056, 1792, 1792]
    - [5, 0.0]
  - - [6784, 4, 1, 128, 6784, 6784, 128, 128]
    - [7, 136.705]
  - - [5056, 6784, 1, 1792, 5056, 5056, 1792, 1792]
    - [5, 0.0]
  - - [2368, 1856, 1, 768, 2368, 2368, 768, 768]
    - [5, 0.0]
  - - [1408, 704, 1, 1792, 1408, 1408, 1792, 1792]
    - [5, 0.0]
  - - [6784, 704, 1, 3328, 6784, 6784, 3328, 3328]
    - [5, 0.0]
  - - [256, 1408, 1, 256, 256, 256, 256, 256]
    - [5, 0.0]
  - - [4, 5888, 1, 1792, 4, 4, 1792, 1792]
    - [8, 0.0]
  - - [64, 448, 1, 768, 64, 64, 768, 768]
    - [5, 0.0]
  - - [1408, 64, 1, 128, 1408, 1408, 128, 128]
    - [0, 372.514]
  - - [1408, 4, 1, 768, 1408, 1408, 768, 768]
    - [8, 0.0]
  - - [4, 2368, 1, 128, 4, 4, 128, 128]
    - [6, 54.558]
  - - [64, 5888, 1, 256, 64, 64, 256, 256]
    - [5, 0.0]
  - - [2944, 1024, 1, 768, 2944, 2944, 768, 768]
    - [5, 0.0]
  - - [3584, 64, 1, 1792, 3584, 3584, 1792, 1792]
    - [5, 0.0]
  - - [2944, 5888, 1, 3328, 2944, 2944, 3328, 3328]
    - [5, 0.0]
  - - [4288, 5056, 1, 256, 4288, 4288, 256, 256]
    - [5, 0.0]
  - - [128, 2944, 1, 1792, 128, 128, 1792, 1792]
    - [5, 0.0]
  - - [5888, 1024, 1, 3328, 5888, 5888, 3328, 3328]
    - [5, 0.0]
  - - [448, 256, 1, 1792, 448, 448, 1792, 1792]
    - [5, 0.0]
  - - [3584, 2944, 1, 3328, 3584, 3584, 3328, 3328]
    - [5, 0.0]
  - - [5056, 1024, 1, 1792, 5056, 5056, 1792, 1792]
    - [5, 0.0]
  - - [1024, 4288, 1, 3328, 1024, 1024, 3328, 3328]
    - [5, 0.0]
  - - [2944, 704, 1, 3328, 2944, 2944, 3328, 3328]
    - [5, 0.0]
  - - [6784, 1408, 1, 128, 6784, 6784, 128, 128]
    - [1, 3188.82]
  - - [1408, 1856, 1, 1792, 1408, 1408, 1792, 1792]
    - [5, 0.0]
  - - [5056, 4288, 1, 256, 5056, 5056, 256, 256]
    - [5, 0.0]
  - - [448, 64, 1, 3328, 448, 448, 3328, 3328]
    - [5, 0.0]
  - - [256, 448, 1, 128, 256, 256, 128, 128]
    - [0, 470.726]
  - - [5888, 128, 1, 3328, 5888, 5888, 3328, 3328]
    - [5, 0.0]
  - - [448, 448, 1, 1792, 448, 448, 1792, 1792]
    - [5, 0.0]
  - - [1856, 2944, 1, 3328, 1856, 1856, 3328, 3328]
    - [5, 0.0]
  - - [3584, 1408, 1, 3328, 3584, 3584, 3328, 3328]
    - [5, 0.0]
  - - [2368, 448, 1, 256, 2368, 2368, 256, 256]
    - [5, 0.0]
  - - [1024, 3584, 1, 3328, 1024, 1024, 3328, 3328]
    - [5, 0.0]
  - - [1408, 1024, 1, 768, 1408, 1408, 768, 768]
    - [5, 0.0]
  - - [64, 5056, 1, 1792, 64, 64, 1792, 1792]
    - [5, 0.0]
  - - [1408, 448, 1, 3328, 1408, 1408, 3328, 3328]
    - [5, 0.0]
  - - [6784, 4288, 1, 3328, 6784, 6784, 3328, 3328]
    - [5, 0.0]
  - - [1024, 5888, 1, 128, 1024, 1024, 128, 128]
    - [3, 2502.03]
  - - [1856, 2368, 1, 128, 1856, 1856, 128, 128]
    - [1, 3005.32]
  - - [6784, 3584, 1, 128, 6784, 6784, 128, 128]
    - [1, 3448.25]
  - - [704, 1408, 1, 3328, 704, 704, 3328, 3328]
    - [5, 0.0]
  - - [64, 2368, 1, 1792, 64, 64, 1792, 1792]
    - [5, 0.0]
  - - [4288, 1408, 1, 1792, 4288, 4288, 1792, 1792]
    - [5, 0.0]
  - - [704, 256, 1, 128, 704, 704, 128, 128]
    - [0, 784.435]
  - - [256, 448, 1, 1792, 256, 256, 1792, 1792]
    - [5, 0.0]
  - - [704, 2368, 1, 1792, 704, 704, 1792, 1792]
    - [5, 0.0]
  - - [1024, 4, 1, 1792, 1024, 1024, 1792, 1792]
    - [8, 0.0]
  - - [5888, 4, 1, 128, 5888, 5888, 128, 128]
    - [7, 121.485]
  - - [704, 3584, 1, 768, 704, 704, 768, 768]
    - [5, 0.0]
- null
