Tensile/Configs/miopen/archives/small-sizes/exact/vega20_Cijk_Ailk_Bljk_SB.yaml
- {MinimumRequiredVersion: 4.9.4}
- vega20
- gfx906
- [Device 66a0, Device 66a1, Device 66a7]
    SolutionIndex: 0
    SolutionNameMin: Cijk_Ailk_Bljk_SB_MT32x32x8_SE_EPS0_GRVW2_GSU1_LPB0_PGR0_PLR1_SNLL0_TT2_2_VW2_WG16_16_1_WGM1
    SolutionIndex: 1
    SolutionNameMin: Cijk_Ailk_Bljk_SB_MT16x16x8_SE_EPS0_GRVW2_GSU1_LPB0_PGR0_PLR0_SNLL0_TT2_2_VW2_WG8_8_4_WGM1
    SolutionIndex: 2
    SolutionNameMin: Cijk_Ailk_Bljk_SB_MT32x32x16_SE_EPS0_GRVW2_GSU1_LPB0_PGR0_PLR0_SNLL0_TT2_2_VW2_WG16_16_1_WGM1
    SolutionIndex: 3
    SolutionNameMin: Cijk_Ailk_Bljk_SB_MT32x32x16_SE_EPS0_GRVW2_GSU1_LPB0_PGR0_PLR1_SNLL0_TT2_2_VW2_WG16_16_1_WGM1
    SolutionIndex: 4
    SolutionNameMin: Cijk_Ailk_Bljk_SB_MT16x16x16_SE_EPS0_GRVW2_GSU1_LPB0_PGR0_PLR0_SNLL0_TT2_2_VW2_WG8_8_2_WGM1
    SolutionIndex: 5
    SolutionNameMin: Cijk_Ailk_Bljk_SB_MT16x16x16_SE_EPS0_GRVW2_GSU1_LPB0_PGR0_PLR1_SNLL0_TT2_2_VW2_WG8_8_2_WGM1
    SolutionIndex: 6
    SolutionNameMin: Cijk_Ailk_Bljk_SB_MT16x16x16_SE_EPS1_GRVW2_GSU1_LPB0_PGR1_PLR1_SNLL1_TT2_2_VW2_WG8_8_4_WGM1
    SolutionIndex: 7
    SolutionNameMin: Cijk_Ailk_Bljk_SB_MT16x32x16_SE_EPS0_GRVW2_GSU1_LPB0_PGR0_PLR1_SNLL0_TT2_4_VW2_WG8_8_4_WGM1
    SolutionIndex: 8
    SolutionNameMin: Cijk_Ailk_Bljk_SB_MT32x32x16_SE_EPS0_GRVW2_GSU1_LPB0_PGR0_PLR0_SNLL0_TT2_2_VW2_WG16_16_1_WGM8
    SolutionIndex: 9
    SolutionNameMin: Cijk_Ailk_Bljk_SB_MT32x64x16_SE_EPS0_GRVW2_GSU1_LPB0_PGR0_PLR0_SNLL0_TT2_4_VW2_WG16_16_1_WGM8
    SolutionIndex: 10
    SolutionNameMin: Cijk_Ailk_Bljk_SB_MT32x64x16_SE_EPS0_GRVW2_GSU1_LPB0_PGR0_PLR1_SNLL0_TT2_4_VW2_WG16_16_1_WGM8
    SolutionIndex: 11
    SolutionNameMin: Cijk_Ailk_Bljk_SB_MT16x16x16_SE_EPS0_GRVW2_GSU1_LPB0_PGR0_PLR0_SNLL0_TT2_2_VW2_WG8_8_4_WGM8
    SolutionIndex: 12
    SolutionNameMin: Cijk_Ailk_Bljk_SB_MT16x16x32_SE_EPS0_GRVW2_GSU1_LPB0_PGR0_PLR0_SNLL0_TT2_2_VW2_WG8_8_4_WGM1
    SolutionIndex: 13
    SolutionNameMin: Cijk_Ailk_Bljk_SB_MT32x16x32_SE_EPS1_GRVW2_GSU1_LPB0_PGR1_PLR1_SNLL1_TT4_2_VW2_WG8_8_4_WGM1
    SolutionIndex: 14
    SolutionNameMin: Cijk_Ailk_Bljk_SB_MT16x8x32_SE_EPS0_GRVW2_GSU1_LPB0_PGR0_PLR1_SNLL0_TT2_2_VW2_WG8_4_4_WGM1
    SolutionIndex: 15
    SolutionNameMin: Cijk_Ailk_Bljk_SB_MT16x8x32_SE_EPS1_GRVW2_GSU1_LPB0_PGR1_PLR1_SNLL1_TT2_2_VW2_WG8_4_4_WGM1
    SolutionIndex: 16
    SolutionNameMin: Cijk_Ailk_Bljk_SB_MT16x8x32_SE_EPS0_GRVW2_GSU1_LPB0_PGR0_PLR1_SNLL0_TT2_2_VW2_WG8_4_4_WGM8
    SolutionIndex: 17
    SolutionNameMin: Cijk_Ailk_Bljk_SB_MT16x8x32_SE_EPS1_GRVW2_GSU4_LPB0_PGR1_PLR1_SNLL0_TT2_2_VW2_WG8_4_4_WGM1
    SolutionIndex: 18
    SolutionNameMin: Cijk_Ailk_Bljk_SB_MT32x32x16_SE_EPS0_GRVW2_GSU1_LPB2_PGR0_PLR1_SNLL0_TT2_2_VW2_WG16_16_1_WGM1
    SolutionIndex: 19
    SolutionNameMin: Cijk_Ailk_Bljk_SB_MT32x64x16_SE_EPS0_GRVW2_GSU1_LPB2_PGR0_PLR0_SNLL0_TT2_4_VW2_WG16_16_1_WGM1
    SolutionIndex: 20
    SolutionNameMin: Cijk_Ailk_Bljk_SB_MT32x64x16_SE_EPS0_GRVW2_GSU1_LPB2_PGR0_PLR1_SNLL0_TT2_4_VW2_WG16_16_1_WGM1
    SolutionIndex: 21
    SolutionNameMin: Cijk_Ailk_Bljk_SB_MT16x16x16_SE_EPS0_GRVW2_GSU1_LPB2_PGR0_PLR1_SNLL0_TT2_2_VW2_WG8_8_2_WGM1
    SolutionIndex: 22
    SolutionNameMin: Cijk_Ailk_Bljk_SB_MT32x16x16_SE_EPS0_GRVW2_GSU1_LPB2_PGR0_PLR1_SNLL0_TT4_2_VW2_WG8_8_4_WGM1
    SolutionIndex: 23
    SolutionNameMin: Cijk_Ailk_Bljk_SB_MT32x16x16_SE_EPS1_GRVW2_GSU1_LPB2_PGR1_PLR1_SNLL1_TT4_2_VW2_WG8_8_4_WGM1
    SolutionIndex: 24
    SolutionNameMin: Cijk_Ailk_Bljk_SB_MT32x32x32_SE_EPS1_GRVW2_GSU1_LPB2_PGR1_PLR1_SNLL1_TT2_2_VW2_WG16_16_1_WGM1
    SolutionIndex: 25
    SolutionNameMin: Cijk_Ailk_Bljk_SB_MT16x16x32_SE_EPS1_GRVW2_GSU1_LPB2_PGR1_PLR0_SNLL1_TT2_2_VW2_WG8_8_4_WGM1
    SolutionIndex: 26
    SolutionNameMin: Cijk_Ailk_Bljk_SB_MT16x16x32_SE_EPS0_GRVW2_GSU1_LPB2_PGR0_PLR1_SNLL0_TT2_2_VW2_WG8_8_4_WGM1
    SolutionIndex: 27
    SolutionNameMin: Cijk_Ailk_Bljk_SB_MT16x16x32_SE_EPS1_GRVW2_GSU1_LPB2_PGR1_PLR1_SNLL1_TT2_2_VW2_WG8_8_4_WGM1
    SolutionIndex: 28
    SolutionNameMin: Cijk_Ailk_Bljk_SB_MT32x16x32_SE_EPS1_GRVW2_GSU1_LPB2_PGR1_PLR0_SNLL1_TT4_2_VW2_WG8_8_4_WGM1
    SolutionIndex: 29
    SolutionNameMin: Cijk_Ailk_Bljk_SB_MT32x16x32_SE_EPS0_GRVW2_GSU1_LPB2_PGR0_PLR1_SNLL0_TT4_2_VW2_WG8_8_4_WGM1
    SolutionIndex: 30
    SolutionNameMin: Cijk_Ailk_Bljk_SB_MT32x16x32_SE_EPS1_GRVW2_GSU1_LPB2_PGR1_PLR1_SNLL1_TT4_2_VW2_WG8_8_4_WGM1
    SolutionIndex: 31
    SolutionNameMin: Cijk_Ailk_Bljk_SB_MT16x32x32_SE_EPS1_GRVW2_GSU1_LPB2_PGR1_PLR0_SNLL1_TT2_4_VW2_WG8_8_4_WGM1
    SolutionIndex: 32
    SolutionNameMin: Cijk_Ailk_Bljk_SB_MT16x32x32_SE_EPS0_GRVW2_GSU1_LPB2_PGR0_PLR1_SNLL0_TT2_4_VW2_WG8_8_4_WGM1
    SolutionIndex: 33
    SolutionNameMin: Cijk_Ailk_Bljk_SB_MT16x32x32_SE_EPS1_GRVW2_GSU1_LPB2_PGR1_PLR1_SNLL1_TT2_4_VW2_WG8_8_4_WGM1
    SolutionIndex: 34
    SolutionNameMin: Cijk_Ailk_Bljk_SB_MT16x8x32_SE_EPS1_GRVW2_GSU1_LPB2_PGR1_PLR1_SNLL1_TT2_2_VW2_WG8_4_4_WGM1
    SolutionIndex: 35
    SolutionNameMin: Cijk_Ailk_Bljk_SB_MT64x32x32_SE_EPS1_GRVW2_GSU1_LPB2_PGR1_PLR1_SNLL1_TT4_2_VW2_WG16_16_1_WGM8
    SolutionIndex: 36
    SolutionNameMin: Cijk_Ailk_Bljk_SB_MT16x16x32_SE_EPS0_GRVW2_GSU1_LPB2_PGR0_PLR1_SNLL0_TT2_2_VW2_WG8_8_4_WGM8
    SolutionIndex: 37
    SolutionNameMin: Cijk_Ailk_Bljk_SB_MT16x16x32_SE_EPS1_GRVW2_GSU1_LPB2_PGR1_PLR1_SNLL1_TT2_2_VW2_WG8_8_4_WGM8
    SolutionIndex: 38
    SolutionNameMin: Cijk_Ailk_Bljk_SB_MT32x16x32_SE_EPS0_GRVW2_GSU1_LPB2_PGR0_PLR1_SNLL0_TT4_2_VW2_WG8_8_4_WGM8
    SolutionIndex: 39
    SolutionNameMin: Cijk_Ailk_Bljk_SB_MT32x16x32_SE_EPS1_GRVW2_GSU1_LPB2_PGR1_PLR1_SNLL1_TT4_2_VW2_WG8_8_4_WGM8
    SolutionIndex: 40
    SolutionNameMin: Cijk_Ailk_Bljk_SB_MT16x32x32_SE_EPS1_GRVW2_GSU1_LPB2_PGR1_PLR0_SNLL1_TT2_4_VW2_WG8_8_4_WGM8
    SolutionIndex: 41
    SolutionNameMin: Cijk_Ailk_Bljk_SB_MT16x32x32_SE_EPS1_GRVW2_GSU1_LPB2_PGR1_PLR1_SNLL1_TT2_4_VW2_WG8_8_4_WGM8
    SolutionIndex: 42
    SolutionNameMin: Cijk_Ailk_Bljk_SB_MT16x8x32_SE_EPS0_GRVW2_GSU1_LPB2_PGR0_PLR1_SNLL0_TT2_2_VW2_WG8_4_4_WGM8
    SolutionIndex: 43
    SolutionNameMin: Cijk_Ailk_Bljk_SB_MT16x8x32_SE_EPS1_GRVW2_GSU1_LPB2_PGR1_PLR1_SNLL1_TT2_2_VW2_WG8_4_4_WGM8
    SolutionIndex: 44
    SolutionNameMin: Cijk_Ailk_Bljk_SB_MT16x16x32_SE_EPS1_GRVW2_GSU4_LPB2_PGR1_PLR1_SNLL0_TT2_2_VW2_WG8_8_2_WGM1
    SolutionIndex: 45
    SolutionNameMin: Cijk_Ailk_Bljk_SB_MT16x16x32_SE_EPS1_GRVW2_GSU4_LPB2_PGR1_PLR0_SNLL0_TT2_2_VW2_WG8_8_4_WGM1
    SolutionIndex: 46
    SolutionNameMin: Cijk_Ailk_Bljk_SB_MT16x16x32_SE_EPS1_GRVW2_GSU4_LPB2_PGR1_PLR1_SNLL0_TT2_2_VW2_WG8_8_4_WGM1
    SolutionIndex: 47
    SolutionNameMin: Cijk_Ailk_Bljk_SB_MT16x32x32_SE_EPS1_GRVW2_GSU4_LPB2_PGR1_PLR1_SNLL0_TT2_4_VW2_WG8_8_4_WGM1
    SolutionIndex: 48
    SolutionNameMin: Cijk_Ailk_Bljk_SB_MT16x8x32_SE_EPS1_GRVW2_GSU4_LPB2_PGR1_PLR0_SNLL0_TT2_2_VW2_WG8_4_4_WGM1
    SolutionIndex: 49
    SolutionNameMin: Cijk_Ailk_Bljk_SB_MT16x8x32_SE_EPS1_GRVW2_GSU4_LPB2_PGR1_PLR1_SNLL0_TT2_2_VW2_WG8_4_4_WGM1
    SolutionIndex: 50
    SolutionNameMin: Cijk_Ailk_Bljk_SB_MT16x16x32_SE_EPS1_GRVW2_GSU4_LPB2_PGR1_PLR1_SNLL0_TT2_4_VW2_WG8_4_4_WGM1
    SolutionIndex: 51
    SolutionNameMin: Cijk_Ailk_Bljk_SB_MT16x16x32_SE_EPS1_GRVW2_GSU4_LPB2_PGR1_PLR0_SNLL0_TT2_2_VW2_WG8_8_4_WGM8
    SolutionIndex: 52
    SolutionNameMin: Cijk_Ailk_Bljk_SB_MT16x16x32_SE_EPS0_GRVW2_GSU4_LPB2_PGR0_PLR1_SNLL0_TT2_2_VW2_WG8_8_4_WGM8
    SolutionIndex: 53
    SolutionNameMin: Cijk_Ailk_Bljk_SB_MT16x16x32_SE_EPS1_GRVW2_GSU4_LPB2_PGR1_PLR1_SNLL0_TT2_2_VW2_WG8_8_4_WGM8
    SolutionIndex: 54
    SolutionNameMin: Cijk_Ailk_Bljk_SB_MT32x16x32_SE_EPS1_GRVW2_GSU4_LPB2_PGR1_PLR0_SNLL0_TT4_2_VW2_WG8_8_4_WGM8
    SolutionIndex: 55
    SolutionNameMin: Cijk_Ailk_Bljk_SB_MT32x16x32_SE_EPS1_GRVW2_GSU4_LPB2_PGR1_PLR1_SNLL0_TT4_2_VW2_WG8_8_4_WGM8
    SolutionIndex: 56
    SolutionNameMin: Cijk_Ailk_Bljk_SB_MT16x32x32_SE_EPS1_GRVW2_GSU4_LPB2_PGR1_PLR1_SNLL0_TT2_4_VW2_WG8_8_4_WGM8
    SolutionIndex: 57
    SolutionNameMin: Cijk_Ailk_Bljk_SB_MT16x8x32_SE_EPS1_GRVW2_GSU4_LPB2_PGR1_PLR0_SNLL0_TT2_2_VW2_WG8_4_4_WGM8
    SolutionIndex: 58
    SolutionNameMin: Cijk_Ailk_Bljk_SB_MT16x8x32_SE_EPS1_GRVW2_GSU4_LPB2_PGR1_PLR1_SNLL0_TT2_2_VW2_WG8_4_4_WGM8
    SolutionIndex: 59
    SolutionNameMin: Cijk_Ailk_Bljk_SB_MT16x32x16_SE_EPS0_GRVW2_GSU1_LPB0_PGR0_PLR0_SNLL0_TT2_2_VW2_WG8_16_1_WGM1
    SolutionIndex: 60
    SolutionNameMin: Cijk_Ailk_Bljk_SB_MT16x64x16_SE_EPS0_GRVW2_GSU1_LPB0_PGR0_PLR1_SNLL0_TT2_4_VW2_WG8_16_1_WGM1
    SolutionIndex: 61
    SolutionNameMin: Cijk_Ailk_Bljk_SB_MT8x32x16_SE_EPS0_GRVW2_GSU1_LPB0_PGR0_PLR0_SNLL0_TT2_2_VW2_WG4_16_4_WGM1
    SolutionIndex: 62
    SolutionNameMin: Cijk_Ailk_Bljk_SB_MT8x32x16_SE_EPS0_GRVW2_GSU1_LPB0_PGR0_PLR1_SNLL0_TT2_2_VW2_WG4_16_4_WGM1
    SolutionIndex: 63
    SolutionNameMin: Cijk_Ailk_Bljk_SB_MT4x64x16_SE_EPS0_GRVW2_GSU1_LPB0_PGR0_PLR0_SNLL0_TT2_2_VW2_WG2_32_4_WGM1
    SolutionIndex: 64
    SolutionNameMin: Cijk_Ailk_Bljk_SB_MT8x64x8_SE_EPS0_GRVW2_GSU1_LPB2_PGR0_PLR1_SNLL0_TT2_4_VW2_WG4_16_4_WGM1
    SolutionIndex: 65
    SolutionNameMin: Cijk_Ailk_Bljk_SB_MT16x32x16_SE_EPS0_GRVW2_GSU1_LPB2_PGR0_PLR0_SNLL0_TT2_2_VW2_WG8_16_1_WGM1
    SolutionIndex: 66
    SolutionNameMin: Cijk_Ailk_Bljk_SB_MT8x32x16_SE_EPS0_GRVW2_GSU1_LPB2_PGR0_PLR0_SNLL0_TT2_2_VW2_WG4_16_4_WGM1
    SolutionIndex: 67
    SolutionNameMin: Cijk_Ailk_Bljk_SB_MT8x32x16_SE_EPS0_GRVW2_GSU1_LPB2_PGR0_PLR1_SNLL0_TT2_2_VW2_WG4_16_4_WGM1
    SolutionIndex: 68
    SolutionNameMin: Cijk_Ailk_Bljk_SB_MT8x64x16_SE_EPS0_GRVW2_GSU1_LPB2_PGR0_PLR0_SNLL0_TT2_4_VW2_WG4_16_4_WGM1
    SolutionIndex: 69
    SolutionNameMin: Cijk_Ailk_Bljk_SB_MT4x64x16_SE_EPS0_GRVW2_GSU1_LPB2_PGR0_PLR0_SNLL0_TT2_2_VW2_WG2_32_4_WGM1
    SolutionIndex: 70
    SolutionNameMin: Cijk_Ailk_Bljk_SB_MT4x64x16_SE_EPS0_GRVW2_GSU1_LPB2_PGR0_PLR1_SNLL0_TT2_2_VW2_WG2_32_4_WGM1
    SolutionIndex: 71
    SolutionNameMin: Cijk_Ailk_Bljk_SB_MT4x64x16_SE_EPS1_GRVW2_GSU1_LPB2_PGR1_PLR1_SNLL1_TT2_2_VW2_WG2_32_4_WGM1
    SolutionIndex: 72
    SolutionNameMin: Cijk_Ailk_Bljk_SB_MT4x64x16_SE_EPS1_GRVW2_GSU1_LPB2_PGR1_PLR1_SNLL1_TT2_2_VW2_WG2_32_4_WGM8
    SolutionIndex: 73
    SolutionNameMin: Cijk_Ailk_Bljk_SB_MT8x32x32_SE_EPS0_GRVW2_GSU1_LPB2_PGR0_PLR1_SNLL0_TT2_2_VW2_WG4_16_4_WGM1
    SolutionIndex: 74
    SolutionNameMin: Cijk_Ailk_Bljk_SB_MT16x32x32_SE_EPS1_GRVW2_GSU1_LPB2_PGR1_PLR1_SNLL1_TT4_2_VW2_WG4_16_4_WGM1
    SolutionIndex: 75
    SolutionNameMin: Cijk_Ailk_Bljk_SB_MT16x16x32_SE_EPS1_GRVW2_GSU1_LPB2_PGR1_PLR0_SNLL1_TT4_2_VW2_WG4_8_8_WGM1
    SolutionIndex: 76
    SolutionNameMin: Cijk_Ailk_Bljk_SB_MT16x16x32_SE_EPS1_GRVW2_GSU1_LPB2_PGR1_PLR1_SNLL1_TT4_2_VW2_WG4_8_8_WGM1
    SolutionIndex: 77
    SolutionNameMin: Cijk_Ailk_Bljk_SB_MT8x32x32_SE_EPS0_GRVW2_GSU1_LPB2_PGR0_PLR1_SNLL0_TT2_4_VW2_WG4_8_8_WGM1
    SolutionIndex: 78
    SolutionNameMin: Cijk_Ailk_Bljk_SB_MT8x32x32_SE_EPS1_GRVW2_GSU1_LPB2_PGR1_PLR1_SNLL1_TT2_4_VW2_WG4_8_8_WGM1
    SolutionIndex: 79
    SolutionNameMin: Cijk_Ailk_Bljk_SB_MT4x64x32_SE_EPS0_GRVW2_GSU1_LPB2_PGR0_PLR1_SNLL0_TT2_2_VW2_WG2_32_4_WGM1
    SolutionIndex: 80
    SolutionNameMin: Cijk_Ailk_Bljk_SB_MT16x32x32_SE_EPS1_GRVW2_GSU1_LPB2_PGR1_PLR1_SNLL1_TT4_2_VW2_WG4_16_4_WGM8
    SolutionIndex: 81
    SolutionNameMin: Cijk_Ailk_Bljk_SB_MT16x16x32_SE_EPS1_GRVW2_GSU1_LPB2_PGR1_PLR1_SNLL1_TT4_2_VW2_WG4_8_8_WGM8
    SolutionIndex: 82
    SolutionNameMin: Cijk_Ailk_Bljk_SB_MT8x32x32_SE_EPS0_GRVW2_GSU1_LPB2_PGR0_PLR1_SNLL0_TT2_4_VW2_WG4_8_8_WGM8
    SolutionIndex: 83
    SolutionNameMin: Cijk_Ailk_Bljk_SB_MT8x32x32_SE_EPS1_GRVW2_GSU1_LPB2_PGR1_PLR1_SNLL1_TT2_4_VW2_WG4_8_8_WGM8
    SolutionIndex: 84
    SolutionNameMin: Cijk_Ailk_Bljk_SB_MT8x32x32_SE_EPS1_GRVW2_GSU1_LPB2_PGR1_PLR1_SNLL1_TT4_2_VW2_WG2_16_8_WGM8
    SolutionIndex: 85
    SolutionNameMin: Cijk_Ailk_Bljk_SB_MT32x8x32_SE_EPS1_GRVW2_GSU1_LPB0_PGR1_PLR1_SNLL1_TT2_2_VW2_WG16_4_4_WGM1
    SolutionIndex: 86
    SolutionNameMin: Cijk_Ailk_Bljk_SB_MT32x8x32_SE_EPS1_GRVW2_GSU1_LPB2_PGR1_PLR1_SNLL1_TT2_2_VW2_WG16_4_4_WGM1
    SolutionIndex: 87
    SolutionNameMin: Cijk_Ailk_Bljk_SB_MT32x16x32_SE_EPS1_GRVW2_GSU1_LPB2_PGR1_PLR1_SNLL1_TT2_4_VW2_WG16_4_4_WGM1
    SolutionIndex: 88
    SolutionNameMin: Cijk_Ailk_Bljk_SB_MT32x16x32_SE_EPS1_GRVW2_GSU1_LPB2_PGR1_PLR1_SNLL1_TT2_2_VW2_WG16_8_2_WGM1
    SolutionIndex: 89
    SolutionNameMin: Cijk_Ailk_Bljk_SB_MT32x32x32_SE_EPS1_GRVW2_GSU1_LPB2_PGR1_PLR1_SNLL1_TT2_4_VW2_WG16_8_2_WGM1
    SolutionIndex: 90
    SolutionNameMin: Cijk_Ailk_Bljk_SB_MT32x8x32_SE_EPS1_GRVW2_GSU1_LPB2_PGR1_PLR1_SNLL1_TT4_2_VW2_WG8_4_8_WGM1
    SolutionIndex: 91
    SolutionNameMin: Cijk_Ailk_Bljk_SB_MT16x16x32_SE_EPS1_GRVW2_GSU1_LPB2_PGR1_PLR1_SNLL1_TT2_4_VW2_WG8_4_8_WGM1
    SolutionIndex: 92
    SolutionNameMin: Cijk_Ailk_Bljk_SB_MT32x8x32_SE_EPS1_GRVW2_GSU1_LPB2_PGR1_PLR1_SNLL1_TT2_2_VW2_WG16_4_4_WGM8
    SolutionIndex: 93
    SolutionNameMin: Cijk_Ailk_Bljk_SB_MT32x16x32_SE_EPS1_GRVW2_GSU1_LPB2_PGR1_PLR1_SNLL1_TT2_4_VW2_WG16_4_4_WGM8
    SolutionIndex: 94
    SolutionNameMin: Cijk_Ailk_Bljk_SB_MT64x16x32_SE_EPS1_GRVW2_GSU1_LPB2_PGR1_PLR1_SNLL1_TT4_2_VW2_WG16_8_2_WGM8
    SolutionIndex: 95
    SolutionNameMin: Cijk_Ailk_Bljk_SB_MT16x16x32_SE_EPS1_GRVW2_GSU1_LPB2_PGR1_PLR1_SNLL1_TT2_4_VW2_WG8_4_8_WGM8
    SolutionIndex: 96
    SolutionNameMin: Cijk_Ailk_Bljk_SB_MT64x32x32_SE_EPS1_GRVW2_GSU1_LPB2_PGR1_PLR1_SNLL1_TT2_4_VW2_WG32_8_2_WGM8
    SolutionIndex: 97
    SolutionNameMin: Cijk_Ailk_Bljk_SB_MT32x8x32_SE_EPS1_GRVW2_GSU4_LPB2_PGR1_PLR0_SNLL0_TT2_2_VW2_WG16_4_4_WGM1
    SolutionIndex: 98
    SolutionNameMin: Cijk_Ailk_Bljk_SB_MT16x16x32_SE_EPS1_GRVW2_GSU4_LPB2_PGR1_PLR0_SNLL0_TT2_4_VW2_WG8_4_8_WGM1
    SolutionIndex: 99
    SolutionNameMin: Cijk_Ailk_Bljk_SB_MT16x16x32_SE_EPS0_GRVW2_GSU4_LPB2_PGR0_PLR1_SNLL0_TT2_4_VW2_WG8_4_8_WGM1
    SolutionIndex: 100
    SolutionNameMin: Cijk_Ailk_Bljk_SB_MT16x16x32_SE_EPS1_GRVW2_GSU4_LPB2_PGR1_PLR1_SNLL0_TT2_4_VW2_WG8_4_8_WGM1
    SolutionIndex: 101
    SolutionNameMin: Cijk_Ailk_Bljk_SB_MT16x16x32_SE_EPS1_GRVW2_GSU4_LPB2_PGR1_PLR1_SNLL0_TT2_4_VW2_WG8_4_8_WGM8
    SolutionIndex: 102
    SolutionNameMin: Cijk_Ailk_Bljk_SB_MT64x64x8_SE_EPS1_GRVW2_GSU1_LPB0_PGR1_PLR1_SNLL1_TT4_4_VW2_WG16_16_1_WGM1
    SolutionIndex: 103
    SolutionNameMin: Cijk_Ailk_Bljk_SB_MT64x64x8_SE_EPS1_GRVW2_GSU1_LPB0_PGR1_PLR1_SNLL1_TT4_4_VW2_WG16_16_1_WGM8
    SolutionIndex: 104
    SolutionNameMin: Cijk_Ailk_Bljk_SB_MT64x64x8_SE_EPS0_GRVW2_GSU1_LPB0_PGR0_PLR0_SNLL0_TT4_4_VW2_WG16_16_1_WGM16
    SolutionIndex: 105
    SolutionNameMin: Cijk_Ailk_Bljk_SB_MT64x64x16_SE_EPS0_GRVW2_GSU1_LPB0_PGR0_PLR0_SNLL0_TT4_4_VW2_WG16_16_1_WGM16
    SolutionIndex: 106
    SolutionNameMin: Cijk_Ailk_Bljk_SB_MT128x64x16_SE_EPS1_GRVW4_GSU1_LPB0_PGR1_PLR1_SNLL1_TT8_4_VW4_WG16_16_1_WGM1
    SolutionIndex: 107
    SolutionNameMin: Cijk_Ailk_Bljk_SB_MT64x64x16_SE_EPS1_GRVW4_GSU1_LPB0_PGR1_PLR1_SNLL1_TT4_4_VW4_WG16_16_1_WGM8
    SolutionIndex: 108
    SolutionNameMin: Cijk_Ailk_Bljk_SB_MT64x64x32_SE_EPS1_GRVW4_GSU1_LPB0_PGR1_PLR1_SNLL1_TT4_4_VW4_WG16_16_1_WGM16
    SolutionIndex: 109
    SolutionNameMin: Cijk_Ailk_Bljk_SB_MT64x64x8_SE_EPS1_GRVW2_GSU1_LPB2_PGR1_PLR1_SNLL1_TT4_4_VW2_WG16_16_1_WGM1
    SolutionIndex: 110
    SolutionNameMin: Cijk_Ailk_Bljk_SB_MT64x64x8_SE_EPS0_GRVW2_GSU1_LPB2_PGR0_PLR1_SNLL0_TT4_4_VW2_WG16_16_1_WGM16
    SolutionIndex: 111
    SolutionNameMin: Cijk_Ailk_Bljk_SB_MT64x64x8_SE_EPS1_GRVW2_GSU1_LPB2_PGR1_PLR1_SNLL1_TT4_4_VW2_WG16_16_1_WGM16
    SolutionIndex: 112
    SolutionNameMin: Cijk_Ailk_Bljk_SB_MT64x32x16_SE_EPS1_GRVW2_GSU1_LPB2_PGR1_PLR1_SNLL1_TT4_4_VW2_WG16_8_4_WGM1
    SolutionIndex: 113
    SolutionNameMin: Cijk_Ailk_Bljk_SB_MT64x64x16_SE_EPS0_GRVW2_GSU1_LPB2_PGR0_PLR1_SNLL0_TT4_4_VW2_WG16_16_1_WGM8
    SolutionIndex: 114
    SolutionNameMin: Cijk_Ailk_Bljk_SB_MT64x32x16_SE_EPS1_GRVW2_GSU1_LPB2_PGR1_PLR1_SNLL1_TT4_4_VW2_WG16_8_4_WGM8
    SolutionIndex: 115
    SolutionNameMin: Cijk_Ailk_Bljk_SB_MT32x64x16_SE_EPS0_GRVW2_GSU1_LPB2_PGR0_PLR0_SNLL0_TT4_4_VW2_WG8_16_4_WGM8
    SolutionIndex: 116
    SolutionNameMin: Cijk_Ailk_Bljk_SB_MT32x64x16_SE_EPS1_GRVW2_GSU1_LPB2_PGR1_PLR1_SNLL1_TT4_4_VW2_WG8_16_4_WGM8
    SolutionIndex: 117
    SolutionNameMin: Cijk_Ailk_Bljk_SB_MT64x64x16_SE_EPS0_GRVW2_GSU1_LPB2_PGR0_PLR0_SNLL0_TT4_4_VW2_WG16_16_1_WGM16
    SolutionIndex: 118
    SolutionNameMin: Cijk_Ailk_Bljk_SB_MT64x64x16_SE_EPS0_GRVW2_GSU1_LPB2_PGR0_PLR1_SNLL0_TT4_4_VW2_WG16_16_1_WGM16
    SolutionIndex: 119
    SolutionNameMin: Cijk_Ailk_Bljk_SB_MT64x64x32_SE_EPS1_GRVW2_GSU1_LPB2_PGR1_PLR1_SNLL1_TT4_4_VW2_WG16_16_4_WGM1
    SolutionIndex: 120
    SolutionNameMin: Cijk_Ailk_Bljk_SB_MT64x32x32_SE_EPS1_GRVW2_GSU1_LPB2_PGR1_PLR1_SNLL1_TT4_4_VW2_WG16_8_4_WGM1
    SolutionIndex: 121
    SolutionNameMin: Cijk_Ailk_Bljk_SB_MT128x64x32_SE_EPS1_GRVW2_GSU1_LPB2_PGR1_PLR1_SNLL1_TT4_4_VW2_WG32_16_2_WGM1
    SolutionIndex: 122
    SolutionNameMin: Cijk_Ailk_Bljk_SB_MT64x64x32_SE_EPS1_GRVW2_GSU1_LPB2_PGR1_PLR1_SNLL1_TT4_4_VW2_WG16_16_4_WGM8
    SolutionIndex: 123
    SolutionNameMin: Cijk_Ailk_Bljk_SB_MT64x32x32_SE_EPS1_GRVW2_GSU1_LPB2_PGR1_PLR1_SNLL1_TT4_4_VW2_WG16_8_4_WGM8
    SolutionIndex: 124
    SolutionNameMin: Cijk_Ailk_Bljk_SB_MT64x64x16_SE_EPS1_GRVW4_GSU1_LPB4_PGR1_PLR1_SNLL1_TT4_4_VW4_WG16_16_1_WGM1
    SolutionIndex: 125
    SolutionNameMin: Cijk_Ailk_Bljk_SB_MT128x64x16_SE_EPS1_GRVW4_GSU1_LPB4_PGR1_PLR1_SNLL1_TT8_4_VW4_WG16_16_1_WGM1
    SolutionIndex: 126
    SolutionNameMin: Cijk_Ailk_Bljk_SB_MT64x64x16_SE_EPS0_GRVW4_GSU1_LPB4_PGR0_PLR0_SNLL0_TT4_4_VW4_WG16_16_1_WGM8
    SolutionIndex: 127
    SolutionNameMin: Cijk_Ailk_Bljk_SB_MT64x64x16_SE_EPS1_GRVW4_GSU1_LPB4_PGR1_PLR1_SNLL1_TT4_4_VW4_WG16_16_1_WGM16
    SolutionIndex: 128
    SolutionNameMin: Cijk_Ailk_Bljk_SB_MT64x128x16_SE_EPS1_GRVW4_GSU1_LPB4_PGR1_PLR1_SNLL1_TT4_8_VW4_WG16_16_1_WGM16
    SolutionIndex: 129
    SolutionNameMin: Cijk_Ailk_Bljk_SB_MT128x64x16_SE_EPS1_GRVW4_GSU1_LPB4_PGR1_PLR1_SNLL1_TT8_4_VW4_WG16_16_1_WGM16
    SolutionIndex: 130
    SolutionNameMin: Cijk_Ailk_Bljk_SB_MT64x64x32_SE_EPS1_GRVW4_GSU1_LPB4_PGR1_PLR1_SNLL1_TT4_4_VW4_WG16_16_1_WGM1
    SolutionIndex: 131
    SolutionNameMin: Cijk_Ailk_Bljk_SB_MT64x32x32_SE_EPS1_GRVW4_GSU1_LPB4_PGR1_PLR1_SNLL1_TT4_4_VW4_WG16_8_4_WGM1
    SolutionIndex: 132
    SolutionNameMin: Cijk_Ailk_Bljk_SB_MT64x64x32_SE_EPS1_GRVW4_GSU1_LPB4_PGR1_PLR1_SNLL1_TT4_8_VW4_WG16_8_4_WGM1
    SolutionIndex: 133
    SolutionNameMin: Cijk_Ailk_Bljk_SB_MT128x32x32_SE_EPS1_GRVW4_GSU1_LPB4_PGR1_PLR1_SNLL1_TT8_4_VW4_WG16_8_4_WGM1
    SolutionIndex: 134
    SolutionNameMin: Cijk_Ailk_Bljk_SB_MT64x64x32_SE_EPS1_GRVW4_GSU1_LPB4_PGR1_PLR1_SNLL1_TT8_4_VW4_WG8_16_4_WGM1
    SolutionIndex: 135
    SolutionNameMin: Cijk_Ailk_Bljk_SB_MT128x64x32_SE_EPS1_GRVW4_GSU1_LPB4_PGR1_PLR1_SNLL1_TT4_4_VW4_WG32_16_2_WGM1
    SolutionIndex: 136
    SolutionNameMin: Cijk_Ailk_Bljk_SB_MT64x32x32_SE_EPS1_GRVW4_GSU1_LPB4_PGR1_PLR1_SNLL1_TT4_4_VW4_WG16_8_4_WGM8
    SolutionIndex: 137
    SolutionNameMin: Cijk_Ailk_Bljk_SB_MT64x64x32_SE_EPS1_GRVW4_GSU1_LPB4_PGR1_PLR1_SNLL1_TT4_8_VW4_WG16_8_4_WGM8
    SolutionIndex: 138
    SolutionNameMin: Cijk_Ailk_Bljk_SB_MT128x64x32_SE_EPS1_GRVW4_GSU1_LPB4_PGR1_PLR1_SNLL1_TT4_4_VW4_WG32_16_2_WGM8
    SolutionIndex: 139
    SolutionNameMin: Cijk_Ailk_Bljk_SB_MT64x64x32_SE_EPS1_GRVW4_GSU1_LPB4_PGR1_PLR1_SNLL1_TT4_4_VW4_WG16_16_1_WGM16
    SolutionIndex: 140
    SolutionNameMin: Cijk_Ailk_Bljk_SB_MT64x32x32_SE_EPS1_GRVW4_GSU1_LPB4_PGR1_PLR0_SNLL1_TT4_4_VW4_WG16_8_4_WGM16
    SolutionIndex: 141
    SolutionNameMin: Cijk_Ailk_Bljk_SB_MT64x64x32_SE_EPS1_GRVW4_GSU1_LPB4_PGR1_PLR1_SNLL1_TT4_8_VW4_WG16_8_4_WGM16
    SolutionIndex: 142
    SolutionNameMin: Cijk_Ailk_Bljk_SB_MT64x64x32_SE_EPS1_GRVW4_GSU1_LPB4_PGR1_PLR1_SNLL1_TT8_4_VW4_WG8_16_4_WGM16
    SolutionIndex: 143
    SolutionNameMin: Cijk_Ailk_Bljk_SB_MT128x64x32_SE_EPS1_GRVW4_GSU1_LPB4_PGR1_PLR1_SNLL1_TT4_4_VW4_WG32_16_2_WGM16
    SolutionIndex: 144
    SolutionNameMin: Cijk_Ailk_Bljk_SB_MT16x64x8_SE_EPS0_GRVW2_GSU1_LPB0_PGR0_PLR0_SNLL0_TT4_4_VW2_WG4_16_4_WGM1
    SolutionIndex: 145
    SolutionNameMin: Cijk_Ailk_Bljk_SB_MT16x64x8_SE_EPS0_GRVW2_GSU1_LPB0_PGR0_PLR1_SNLL0_TT4_4_VW2_WG4_16_4_WGM1
    SolutionIndex: 146
    SolutionNameMin: Cijk_Ailk_Bljk_SB_MT64x64x32_SE_EPS1_GRVW4_GSU1_LPB0_PGR1_PLR1_SNLL1_TT8_4_VW4_WG8_16_2_WGM16
    SolutionIndex: 147
    SolutionNameMin: Cijk_Ailk_Bljk_SB_MT32x64x8_SE_EPS0_GRVW2_GSU1_LPB2_PGR0_PLR1_SNLL0_TT4_4_VW2_WG8_16_2_WGM8
    SolutionIndex: 148
    SolutionNameMin: Cijk_Ailk_Bljk_SB_MT32x64x8_SE_EPS0_GRVW2_GSU1_LPB2_PGR0_PLR1_SNLL0_TT4_4_VW2_WG8_16_2_WGM16
    SolutionIndex: 149
    SolutionNameMin: Cijk_Ailk_Bljk_SB_MT32x64x8_SE_EPS1_GRVW2_GSU1_LPB2_PGR1_PLR1_SNLL1_TT4_4_VW2_WG8_16_2_WGM16
    SolutionIndex: 150
    SolutionNameMin: Cijk_Ailk_Bljk_SB_MT32x64x16_SE_EPS0_GRVW2_GSU1_LPB2_PGR0_PLR1_SNLL0_TT4_4_VW2_WG8_16_2_WGM1
    SolutionIndex: 151
    SolutionNameMin: Cijk_Ailk_Bljk_SB_MT32x64x16_SE_EPS1_GRVW2_GSU1_LPB2_PGR1_PLR1_SNLL1_TT4_4_VW2_WG8_16_2_WGM1
    SolutionIndex: 152
    SolutionNameMin: Cijk_Ailk_Bljk_SB_MT16x64x16_SE_EPS0_GRVW2_GSU1_LPB2_PGR0_PLR1_SNLL0_TT4_4_VW2_WG4_16_4_WGM1
    SolutionIndex: 153
    SolutionNameMin: Cijk_Ailk_Bljk_SB_MT32x64x16_SE_EPS0_GRVW2_GSU1_LPB2_PGR0_PLR1_SNLL0_TT4_4_VW2_WG8_16_2_WGM8
    SolutionIndex: 154
    SolutionNameMin: Cijk_Ailk_Bljk_SB_MT32x64x16_SE_EPS1_GRVW2_GSU1_LPB2_PGR1_PLR1_SNLL1_TT4_4_VW2_WG8_16_2_WGM8
    SolutionIndex: 155
    SolutionNameMin: Cijk_Ailk_Bljk_SB_MT32x64x16_SE_EPS1_GRVW2_GSU1_LPB2_PGR1_PLR1_SNLL1_TT4_4_VW2_WG8_16_2_WGM16
    SolutionIndex: 156
    SolutionNameMin: Cijk_Ailk_Bljk_SB_MT16x32x32_SE_EPS1_GRVW2_GSU1_LPB2_PGR1_PLR1_SNLL1_TT4_4_VW2_WG4_8_8_WGM8
    SolutionIndex: 157
    SolutionNameMin: Cijk_Ailk_Bljk_SB_MT64x64x16_SE_EPS1_GRVW4_GSU1_LPB4_PGR1_PLR1_SNLL1_TT8_4_VW4_WG8_16_2_WGM1
    SolutionIndex: 158
    SolutionNameMin: Cijk_Ailk_Bljk_SB_MT64x64x16_SE_EPS1_GRVW4_GSU1_LPB4_PGR1_PLR1_SNLL1_TT8_4_VW4_WG8_16_2_WGM8
    SolutionIndex: 159
    SolutionNameMin: Cijk_Ailk_Bljk_SB_MT64x64x16_SE_EPS1_GRVW4_GSU1_LPB4_PGR1_PLR1_SNLL1_TT8_4_VW4_WG8_16_2_WGM16
    SolutionIndex: 160
    SolutionNameMin: Cijk_Ailk_Bljk_SB_MT32x64x32_SE_EPS1_GRVW4_GSU1_LPB4_PGR1_PLR1_SNLL1_TT4_4_VW4_WG8_16_2_WGM1
    SolutionIndex: 161
    SolutionNameMin: Cijk_Ailk_Bljk_SB_MT32x64x32_SE_EPS1_GRVW4_GSU1_LPB4_PGR1_PLR1_SNLL1_TT4_4_VW4_WG8_16_2_WGM16
    SolutionIndex: 162
    SolutionNameMin: Cijk_Ailk_Bljk_SB_MT32x32x32_SE_EPS1_GRVW4_GSU1_LPB0_PGR1_PLR1_SNLL1_TT4_4_VW4_WG8_8_4_WGM16
    SolutionIndex: 163
    SolutionNameMin: Cijk_Ailk_Bljk_SB_MT32x32x16_SE_EPS1_GRVW2_GSU1_LPB2_PGR1_PLR1_SNLL1_TT4_4_VW2_WG8_8_4_WGM1
    SolutionIndex: 164
    SolutionNameMin: Cijk_Ailk_Bljk_SB_MT32x32x16_SE_EPS0_GRVW2_GSU1_LPB2_PGR0_PLR1_SNLL0_TT4_4_VW2_WG8_8_4_WGM8
    SolutionIndex: 165
    SolutionNameMin: Cijk_Ailk_Bljk_SB_MT32x32x16_SE_EPS1_GRVW2_GSU1_LPB2_PGR1_PLR1_SNLL1_TT4_4_VW2_WG8_8_4_WGM16
    SolutionIndex: 166
    SolutionNameMin: Cijk_Ailk_Bljk_SB_MT32x32x32_SE_EPS1_GRVW2_GSU1_LPB2_PGR1_PLR1_SNLL1_TT4_4_VW2_WG8_8_4_WGM1
    SolutionIndex: 167
    SolutionNameMin: Cijk_Ailk_Bljk_SB_MT32x32x32_SE_EPS1_GRVW2_GSU1_LPB2_PGR1_PLR1_SNLL1_TT4_4_VW2_WG8_8_4_WGM8
    SolutionIndex: 168
    SolutionNameMin: Cijk_Ailk_Bljk_SB_MT32x32x32_SE_EPS1_GRVW2_GSU1_LPB2_PGR1_PLR1_SNLL1_TT4_4_VW2_WG8_8_4_WGM16
    SolutionIndex: 169
    SolutionNameMin: Cijk_Ailk_Bljk_SB_MT64x32x16_SE_EPS1_GRVW4_GSU1_LPB4_PGR1_PLR1_SNLL1_TT4_4_VW4_WG16_8_2_WGM1
    SolutionIndex: 170
    SolutionNameMin: Cijk_Ailk_Bljk_SB_MT64x32x16_SE_EPS1_GRVW4_GSU1_LPB4_PGR1_PLR1_SNLL1_TT4_4_VW4_WG16_8_2_WGM8
    SolutionIndex: 171
    SolutionNameMin: Cijk_Ailk_Bljk_SB_MT64x32x16_SE_EPS1_GRVW4_GSU1_LPB4_PGR1_PLR1_SNLL1_TT4_4_VW4_WG16_8_2_WGM16
    SolutionIndex: 172
    SolutionNameMin: Cijk_Ailk_Bljk_SB_MT64x64x16_SE_EPS1_GRVW4_GSU1_LPB4_PGR1_PLR1_SNLL1_TT4_8_VW4_WG16_8_2_WGM16
    SolutionIndex: 173
    SolutionNameMin: Cijk_Ailk_Bljk_SB_MT64x32x32_SE_EPS1_GRVW4_GSU1_LPB4_PGR1_PLR1_SNLL1_TT4_4_VW4_WG16_8_2_WGM1
    SolutionIndex: 174
    SolutionNameMin: Cijk_Ailk_Bljk_SB_MT128x32x32_SE_EPS1_GRVW4_GSU1_LPB4_PGR1_PLR1_SNLL1_TT4_8_VW4_WG32_4_4_WGM1
    SolutionIndex: 175
    SolutionNameMin: Cijk_Ailk_Bljk_SB_MT32x32x32_SE_EPS1_GRVW4_GSU1_LPB4_PGR1_PLR1_SNLL1_TT4_4_VW4_WG8_8_4_WGM1
    SolutionIndex: 176
    SolutionNameMin: Cijk_Ailk_Bljk_SB_MT64x32x32_SE_EPS1_GRVW4_GSU1_LPB4_PGR1_PLR1_SNLL1_TT4_4_VW4_WG16_8_2_WGM8
    SolutionIndex: 177
    SolutionNameMin: Cijk_Ailk_Bljk_SB_MT32x32x32_SE_EPS0_GRVW4_GSU1_LPB4_PGR0_PLR1_SNLL0_TT4_4_VW4_WG8_8_4_WGM8
    SolutionIndex: 178
    SolutionNameMin: Cijk_Ailk_Bljk_SB_MT32x32x32_SE_EPS1_GRVW4_GSU1_LPB4_PGR1_PLR1_SNLL1_TT4_4_VW4_WG8_8_4_WGM8
    SolutionIndex: 179
    SolutionNameMin: Cijk_Ailk_Bljk_SB_MT64x32x32_SE_EPS1_GRVW4_GSU1_LPB4_PGR1_PLR1_SNLL1_TT8_4_VW4_WG8_8_4_WGM8
    SolutionIndex: 180
    SolutionNameMin: Cijk_Ailk_Bljk_SB_MT64x32x32_SE_EPS1_GRVW4_GSU1_LPB4_PGR1_PLR1_SNLL1_TT4_4_VW4_WG16_8_2_WGM16
    SolutionIndex: 181
    SolutionNameMin: Cijk_Ailk_Bljk_SB_MT32x32x32_SE_EPS1_GRVW4_GSU1_LPB4_PGR1_PLR1_SNLL1_TT4_4_VW4_WG8_8_4_WGM16
    SolutionIndex: 182
    SolutionNameMin: Cijk_Ailk_Bljk_SB_MT64x32x32_SE_EPS0_GRVW2_GSU4_LPB2_PGR0_PLR1_SNLL0_TT4_4_VW2_WG16_8_2_WGM1
    SolutionIndex: 183
    SolutionNameMin: Cijk_Ailk_Bljk_SB_MT64x32x32_SE_EPS0_GRVW2_GSU4_LPB2_PGR0_PLR1_SNLL0_TT4_4_VW2_WG16_8_2_WGM8
    SolutionIndex: 184
    SolutionNameMin: Cijk_Ailk_Bljk_SB_MT32x32x32_SE_EPS1_GRVW2_GSU4_LPB2_PGR1_PLR1_SNLL0_TT4_4_VW2_WG8_8_4_WGM8
    SolutionIndex: 185
    SolutionNameMin: Cijk_Ailk_Bljk_SB_MT32x32x32_SE_EPS1_GRVW2_GSU4_LPB2_PGR1_PLR1_SNLL0_TT4_4_VW2_WG8_8_4_WGM16
    SolutionIndex: 186
    SolutionNameMin: Cijk_Ailk_Bljk_SB_MT16x32x8_SE_EPS0_GRVW2_GSU1_LPB0_PGR0_PLR0_SNLL0_TT2_2_VW2_WG8_16_2_WGM1
    SolutionIndex: 187
    SolutionNameMin: Cijk_Ailk_Bljk_SB_MT32x32x8_SE_EPS0_GRVW2_GSU1_LPB0_PGR0_PLR1_SNLL0_TT2_2_VW2_WG16_16_1_WGM16
    SolutionIndex: 188
    SolutionNameMin: Cijk_Ailk_Bljk_SB_MT32x32x16_SE_EPS0_GRVW2_GSU1_LPB0_PGR0_PLR0_SNLL0_TT2_2_VW2_WG16_16_1_WGM16
    SolutionIndex: 189
    SolutionNameMin: Cijk_Ailk_Bljk_SB_MT32x32x16_SE_EPS0_GRVW2_GSU1_LPB0_PGR0_PLR1_SNLL0_TT2_2_VW2_WG16_16_1_WGM16
    SolutionIndex: 190
    SolutionNameMin: Cijk_Ailk_Bljk_SB_MT32x32x8_SE_EPS0_GRVW2_GSU1_LPB2_PGR0_PLR1_SNLL0_TT2_2_VW2_WG16_16_1_WGM16
    SolutionIndex: 191
    SolutionNameMin: Cijk_Ailk_Bljk_SB_MT16x32x16_SE_EPS0_GRVW2_GSU1_LPB2_PGR0_PLR0_SNLL0_TT2_2_VW2_WG8_16_2_WGM1
    SolutionIndex: 192
    SolutionNameMin: Cijk_Ailk_Bljk_SB_MT16x32x16_SE_EPS0_GRVW2_GSU1_LPB2_PGR0_PLR1_SNLL0_TT2_2_VW2_WG8_16_2_WGM1
    SolutionIndex: 193
    SolutionNameMin: Cijk_Ailk_Bljk_SB_MT32x32x16_SE_EPS1_GRVW2_GSU1_LPB2_PGR1_PLR1_SNLL1_TT4_2_VW2_WG8_16_2_WGM1
    SolutionIndex: 194
    SolutionNameMin: Cijk_Ailk_Bljk_SB_MT32x64x16_SE_EPS0_GRVW2_GSU1_LPB2_PGR0_PLR0_SNLL0_TT2_4_VW2_WG16_16_1_WGM16
    SolutionIndex: 195
    SolutionNameMin: Cijk_Ailk_Bljk_SB_MT16x16x32_SE_EPS0_GRVW2_GSU1_LPB2_PGR0_PLR1_SNLL0_TT2_2_VW2_WG8_8_4_WGM16
    SolutionIndex: 196
    SolutionNameMin: Cijk_Ailk_Bljk_SB_MT16x16x32_SE_EPS1_GRVW2_GSU1_LPB2_PGR1_PLR1_SNLL1_TT2_2_VW2_WG8_8_4_WGM16
    SolutionIndex: 197
    SolutionNameMin: Cijk_Ailk_Bljk_SB_MT32x16x32_SE_EPS1_GRVW2_GSU1_LPB2_PGR1_PLR1_SNLL1_TT4_2_VW2_WG8_8_4_WGM16
    SolutionIndex: 198
    SolutionNameMin: Cijk_Ailk_Bljk_SB_MT32x8x32_SE_EPS1_GRVW2_GSU1_LPB2_PGR1_PLR1_SNLL1_TT2_2_VW2_WG16_4_4_WGM16
    SolutionIndex: 199
    SolutionNameMin: Cijk_Ailk_Bljk_SB_MT32x16x32_SE_EPS1_GRVW2_GSU1_LPB2_PGR1_PLR1_SNLL1_TT2_4_VW2_WG16_4_4_WGM16
    SolutionIndex: 200
    SolutionNameMin: Cijk_Ailk_Bljk_SB_MT64x16x32_SE_EPS1_GRVW4_GSU1_LPB4_PGR1_PLR1_SNLL1_TT4_4_VW4_WG16_4_4_WGM1
    SolutionIndex: 201
    SolutionNameMin: Cijk_Ailk_Bljk_SB_MT128x32x32_SE_EPS1_GRVW4_GSU1_LPB4_PGR1_PLR1_SNLL1_TT4_4_VW4_WG32_8_2_WGM1
    SolutionIndex: 202
    SolutionNameMin: Cijk_Ailk_Bljk_SB_MT64x16x32_SE_EPS1_GRVW4_GSU1_LPB4_PGR1_PLR1_SNLL1_TT4_4_VW4_WG16_4_4_WGM8
    SolutionIndex: 203
    SolutionNameMin: Cijk_Ailk_Bljk_SB_MT64x16x32_SE_EPS1_GRVW4_GSU1_LPB4_PGR1_PLR1_SNLL1_TT4_4_VW4_WG16_4_4_WGM16
    SolutionIndex: 204
    SolutionNameMin: Cijk_Ailk_Bljk_SB_MT128x32x32_SE_EPS1_GRVW4_GSU1_LPB4_PGR1_PLR1_SNLL1_TT4_4_VW4_WG32_8_2_WGM16
- - - [512, 512, 1, 1024, 512, 512, 512, 1024]
    - [141, 6670.86]
  - - [8, 500, 1, 512, 8, 8, 8, 512]
    - [37, 228.571]
  - - [512, 512, 1, 2000, 512, 512, 512, 2000]
    - [174, 7629.34]
  - - [32, 512, 1, 512, 32, 32, 32, 512]
    - [34, 903.945]
  - - [100, 1024, 1, 2048, 100, 100, 100, 2048]
    - [96, 3196.88]
  - - [8, 512, 1, 500, 8, 8, 8, 500]
    - [27, 237.037]
  - - [8, 500, 1, 1024, 8, 8, 8, 1024]
    - [91, 289.266]
  - - [100, 2000, 1, 1024, 100, 100, 100, 1024]
    - [130, 3368.42]
  - - [64, 1024, 1, 100, 64, 64, 64, 100]
    - [29, 941.609]
  - - [64, 1024, 1, 500, 64, 64, 64, 500]
    - [156, 2659.74]
  - - [64, 1024, 1, 1024, 64, 64, 64, 1024]
    - [94, 2452.81]
  - - [128, 2000, 1, 100, 128, 128, 128, 100]
    - [150, 2560.0]
  - - [2, 500, 1, 2048, 2, 2, 2, 2048]
    - [91, 72.1127]
  - - [16, 512, 1, 10, 16, 16, 16, 10]
    - [5, 18.2857]
  - - [64, 2000, 1, 1024, 64, 64, 64, 1024]
    - [161, 2800.68]
  - - [100, 1024, 1, 1024, 100, 100, 100, 1024]
    - [89, 3034.07]
  - - [8, 512, 1, 10, 8, 8, 8, 10]
    - [67, 9.14286]
  - - [16, 500, 1, 2048, 16, 16, 16, 2048]
    - [91, 565.746]
  - - [10, 100, 1, 500, 10, 10, 10, 500]
    - [27, 58.4112]
  - - [16, 100, 1, 10, 16, 16, 16, 10]
    - [67, 3.57143]
  - - [500, 1024, 1, 512, 500, 500, 500, 512]
    - [157, 6514.51]
  - - [128, 1024, 1, 512, 128, 128, 128, 512]
    - [175, 4194.3]
  - - [512, 500, 1, 2000, 512, 512, 512, 2000]
    - [133, 7347.88]
  - - [2, 100, 1, 2000, 2, 2, 2, 2000]
    - [27, 20.8333]
  - - [500, 512, 1, 100, 500, 500, 500, 100]
    - [149, 2539.68]
  - - [100, 1024, 1, 500, 100, 100, 100, 500]
    - [175, 3216.08]
  - - [256, 100, 1, 2048, 256, 256, 256, 2048]
    - [185, 1689.07]
  - - [2, 512, 1, 512, 2, 2, 2, 512]
    - [41, 50.4123]
  - - [128, 2000, 1, 512, 128, 128, 128, 512]
    - [161, 4641.36]
  - - [2, 100, 1, 10, 2, 2, 2, 10]
    - [5, 0.396825]
  - - [16, 2000, 1, 2048, 16, 16, 16, 2048]
    - [49, 1266.15]
  - - [200, 100, 1, 100, 200, 200, 200, 100]
    - [195, 316.456]
  - - [256, 1024, 1, 100, 256, 256, 256, 100]
    - [151, 2685.9]
  - - [200, 500, 1, 1024, 200, 200, 200, 1024]
    - [200, 3282.05]
  - - [500, 100, 1, 100, 500, 500, 500, 100]
    - [114, 631.313]
  - - [4, 100, 1, 10, 4, 4, 4, 10]
    - [12, 0.877193]
  - - [32, 100, 1, 512, 32, 32, 32, 512]
    - [91, 198.835]
  - - [100, 2000, 1, 512, 100, 100, 100, 512]
    - [161, 3832.34]
  - - [16, 1024, 1, 512, 16, 16, 16, 512]
    - [75, 794.376]
  - - [200, 512, 1, 100, 200, 200, 200, 100]
    - [193, 1306.12]
  - - [4, 1024, 1, 1024, 4, 4, 4, 1024]
    - [34, 213.125]
  - - [512, 1024, 1, 512, 512, 512, 512, 512]
    - [158, 7049.25]
  - - [4, 512, 1, 10, 4, 4, 4, 10]
    - [66, 4.49123]
  - - [2, 2048, 1, 2000, 2, 2, 2, 2000]
    - [27, 300.293]
  - - [64, 2048, 1, 10, 64, 64, 64, 10]
    - [187, 240.941]
  - - [128, 100, 1, 10, 128, 128, 128, 10]
    - [192, 27.5862]
  - - [4, 512, 1, 2048, 4, 4, 4, 2048]
    - [27, 146.449]
  - - [64, 2048, 1, 500, 64, 64, 64, 500]
    - [167, 4015.69]
  - - [512, 512, 1, 512, 512, 512, 512, 512]
    - [122, 6123.07]
  - - [500, 500, 1, 2000, 500, 500, 500, 2000]
    - [133, 7126.57]
  - - [10, 1024, 1, 2000, 10, 10, 10, 2000]
    - [100, 807.571]
  - - [256, 100, 1, 100, 256, 256, 256, 100]
    - [112, 296.296]
  - - [32, 2000, 1, 2048, 32, 32, 32, 2048]
    - [55, 2167.2]
  - - [64, 1024, 1, 2048, 64, 64, 64, 2048]
    - [88, 2383.13]
  - - [200, 2048, 1, 512, 200, 200, 200, 512]
    - [163, 5263.94]
  - - [256, 500, 1, 10, 256, 256, 256, 10]
    - [145, 210.526]
  - - [16, 1024, 1, 100, 16, 16, 16, 100]
    - [25, 262.564]
  - - [32, 1024, 1, 1024, 32, 32, 32, 1024]
    - [30, 1476.87]
  - - [512, 500, 1, 512, 512, 512, 512, 512]
    - [119, 5851.43]
  - - [128, 1024, 1, 2000, 128, 128, 128, 2000]
    - [203, 5516.5]
  - - [8, 100, 1, 500, 8, 8, 8, 500]
    - [27, 46.2963]
  - - [100, 2000, 1, 2048, 100, 100, 100, 2048]
    - [182, 3715.53]
  - - [10, 512, 1, 512, 10, 10, 10, 512]
    - [37, 292.571]
  - - [8, 500, 1, 10, 8, 8, 8, 10]
    - [66, 8.77193]
  - - [10, 2000, 1, 1024, 10, 10, 10, 1024]
    - [80, 640.0]
  - - [16, 1024, 1, 10, 16, 16, 16, 10]
    - [65, 36.5714]
  - - [16, 512, 1, 2048, 16, 16, 16, 2048]
    - [44, 585.797]
  - - [256, 512, 1, 10, 256, 256, 256, 10]
    - [110, 230.761]
  - - [2, 2000, 1, 100, 2, 2, 2, 100]
    - [72, 64.1026]
  - - [128, 512, 1, 2048, 128, 128, 128, 2048]
    - [39, 3106.89]
  - - [128, 512, 1, 100, 128, 128, 128, 100]
    - [32, 952.558]
  - - [512, 2000, 1, 1024, 512, 512, 512, 1024]
    - [129, 8065.97]
  - - [64, 500, 1, 2048, 64, 64, 64, 2048]
    - [198, 1857.6]
  - - [64, 2000, 1, 2048, 64, 64, 64, 2048]
    - [180, 3442.02]
  - - [64, 2048, 1, 512, 64, 64, 64, 512]
    - [181, 3315.66]
  - - [10, 2000, 1, 512, 10, 10, 10, 512]
    - [27, 785.276]
  - - [32, 2000, 1, 500, 32, 32, 32, 500]
    - [30, 2500.0]
  - - [64, 2000, 1, 10, 64, 64, 64, 10]
    - [18, 231.884]
  - - [500, 100, 1, 10, 500, 500, 500, 10]
    - [115, 88.0282]
  - - [128, 1024, 1, 500, 128, 128, 128, 500]
    - [166, 4096.0]
  - - [64, 100, 1, 2048, 64, 64, 64, 2048]
    - [27, 587.24]
  - - [64, 100, 1, 10, 64, 64, 64, 10]
    - [186, 11.9403]
  - - [16, 512, 1, 500, 16, 16, 16, 500]
    - [37, 461.261]
  - - [32, 2000, 1, 1024, 32, 32, 32, 1024]
    - [24, 1713.81]
  - - [200, 512, 1, 1024, 200, 200, 200, 1024]
    - [203, 3244.36]
  - - [128, 2048, 1, 10, 128, 128, 128, 10]
    - [19, 455.111]
  - - [200, 100, 1, 2000, 200, 200, 200, 2000]
    - [27, 1461.99]
  - - [2, 100, 1, 512, 2, 2, 2, 512]
    - [27, 12.4272]
  - - [64, 2048, 1, 100, 64, 64, 64, 100]
    - [193, 1689.07]
  - - [32, 512, 1, 100, 32, 32, 32, 100]
    - [26, 265.974]
  - - [16, 512, 1, 1024, 16, 16, 16, 1024]
    - [91, 569.878]
  - - [4, 1024, 1, 512, 4, 4, 4, 512]
    - [81, 208.051]
  - - [64, 2000, 1, 100, 64, 64, 64, 100]
    - [193, 1649.48]
  - - [512, 2048, 1, 512, 512, 512, 512, 512]
    - [129, 7848.99]
  - - [2, 500, 1, 500, 2, 2, 2, 500]
    - [15, 53.4188]
  - - [32, 100, 1, 100, 32, 32, 32, 100]
    - [26, 57.1429]
  - - [100, 500, 1, 2000, 100, 100, 100, 2000]
    - [30, 2783.96]
  - - [200, 2000, 1, 100, 200, 200, 200, 100]
    - [102, 2994.01]
  - - [10, 512, 1, 10, 10, 10, 10, 10]
    - [62, 11.0345]
  - - [100, 500, 1, 2048, 100, 100, 100, 2048]
    - [202, 2361.62]
  - - [4, 2048, 1, 500, 4, 4, 4, 500]
    - [37, 379.259]
  - - [200, 500, 1, 100, 200, 200, 200, 100]
    - [163, 1288.66]
  - - [500, 500, 1, 500, 500, 500, 500, 500]
    - [119, 5425.35]
  - - [2, 100, 1, 1024, 2, 2, 2, 1024]
    - [91, 16.2025]
  - - [128, 2048, 1, 512, 128, 128, 128, 512]
    - [177, 4699.5]
  - - [200, 2000, 1, 1024, 200, 200, 200, 1024]
    - [127, 4620.94]
  - - [32, 512, 1, 1024, 32, 32, 32, 1024]
    - [90, 1028.02]
  - - [100, 2048, 1, 500, 100, 100, 100, 500]
    - [151, 4142.39]
  - - [256, 100, 1, 1024, 256, 256, 256, 1024]
    - [181, 1443.52]
  - - [16, 2000, 1, 500, 16, 16, 16, 500]
    - [76, 1428.57]
  - - [128, 100, 1, 100, 128, 128, 128, 100]
    - [26, 213.333]
  - - [500, 500, 1, 2048, 500, 500, 500, 2048]
    - [123, 6639.0]
  - - [32, 512, 1, 10, 32, 32, 32, 10]
    - [59, 35.9298]
  - - [128, 100, 1, 1024, 128, 128, 128, 1024]
    - [87, 791.498]
  - - [16, 500, 1, 2000, 16, 16, 16, 2000]
    - [100, 694.444]
  - - [4, 2048, 1, 100, 4, 4, 4, 100]
    - [71, 129.62]
  - - [64, 500, 1, 500, 64, 64, 64, 500]
    - [13, 1333.33]
  - - [500, 1024, 1, 2048, 500, 500, 500, 2048]
    - [132, 7031.76]
  - - [512, 2048, 1, 100, 512, 512, 512, 100]
    - [107, 5285.16]
  - - [128, 512, 1, 1024, 128, 128, 128, 1024]
    - [199, 2519.1]
  - - [128, 512, 1, 2000, 128, 128, 128, 2000]
    - [197, 3608.81]
  - - [128, 2000, 1, 2000, 128, 128, 128, 2000]
    - [170, 7017.54]
  - - [2, 512, 1, 10, 2, 2, 2, 10]
    - [63, 2.03175]
  - - [10, 512, 1, 500, 10, 10, 10, 500]
    - [27, 293.578]
  - - [4, 1024, 1, 2000, 4, 4, 4, 2000]
    - [47, 326.115]
  - - [256, 100, 1, 2000, 256, 256, 256, 2000]
    - [184, 1767.96]
  - - [512, 2048, 1, 2000, 512, 512, 512, 2000]
    - [129, 8674.52]
  - - [100, 100, 1, 10, 100, 100, 100, 10]
    - [191, 21.5517]
  - - [256, 500, 1, 1024, 256, 256, 256, 1024]
    - [131, 4833.04]
  - - [128, 512, 1, 10, 128, 128, 128, 10]
    - [19, 132.129]
  - - [256, 100, 1, 500, 256, 256, 256, 500]
    - [178, 914.286]
  - - [64, 100, 1, 512, 64, 64, 64, 512]
    - [85, 369.009]
  - - [64, 512, 1, 500, 64, 64, 64, 500]
    - [27, 1600.0]
  - - [64, 2048, 1, 2000, 64, 64, 64, 2000]
    - [181, 5925.5]
  - - [100, 2048, 1, 1024, 100, 100, 100, 1024]
    - [139, 3260.5]
  - - [200, 2000, 1, 10, 200, 200, 200, 10]
    - [19, 595.238]
  - - [128, 1024, 1, 100, 128, 128, 128, 100]
    - [163, 1689.07]
  - - [16, 2000, 1, 100, 16, 16, 16, 100]
    - [26, 493.827]
  - - [8, 100, 1, 512, 8, 8, 8, 512]
    - [27, 49.7087]
  - - [500, 2048, 1, 1024, 500, 500, 500, 1024]
    - [129, 7651.61]
  - - [500, 2000, 1, 10, 500, 500, 500, 10]
    - [117, 1008.06]
  - - [32, 100, 1, 500, 32, 32, 32, 500]
    - [91, 186.916]
  - - [256, 1024, 1, 2048, 256, 256, 256, 2048]
    - [132, 6190.85]
  - - [32, 500, 1, 2048, 32, 32, 32, 2048]
    - [27, 1083.6]
  - - [4, 2000, 1, 10, 4, 4, 4, 10]
    - [70, 17.5439]
  - - [128, 500, 1, 2000, 128, 128, 128, 2000]
    - [87, 3516.48]
  - - [8, 1024, 1, 10, 8, 8, 8, 10]
    - [61, 17.9649]
  - - [2, 500, 1, 100, 2, 2, 2, 100]
    - [6, 16.0256]
  - - [10, 500, 1, 512, 10, 10, 10, 512]
    - [27, 290.909]
  - - [10, 2000, 1, 10, 10, 10, 10, 10]
    - [5, 38.4615]
  - - [500, 512, 1, 512, 500, 500, 500, 512]
    - [122, 5893.53]
  - - [32, 500, 1, 500, 32, 32, 32, 500]
    - [27, 892.857]
  - - [256, 500, 1, 2000, 256, 256, 256, 2000]
    - [136, 6237.82]
  - - [100, 500, 1, 100, 100, 100, 100, 100]
    - [38, 726.744]
  - - [500, 2048, 1, 100, 500, 500, 500, 100]
    - [111, 4866.92]
  - - [10, 1024, 1, 512, 10, 10, 10, 512]
    - [27, 520.127]
  - - [2, 2048, 1, 512, 2, 2, 2, 512]
    - [37, 151.528]
  - - [256, 512, 1, 100, 256, 256, 256, 100]
    - [116, 1590.68]
  - - [10, 2048, 1, 100, 10, 10, 10, 100]
    - [27, 324.051]
  - - [8, 2048, 1, 100, 8, 8, 8, 100]
    - [82, 256.0]
  - - [512, 100, 1, 512, 512, 512, 512, 512]
    - [178, 2100.51]
  - - [4, 500, 1, 500, 4, 4, 4, 500]
    - [27, 115.741]
  - - [64, 100, 1, 1024, 64, 64, 64, 1024]
    - [27, 450.11]
  - - [2, 2048, 1, 1024, 2, 2, 2, 1024]
    - [84, 137.608]
  - - [2, 500, 1, 2000, 2, 2, 2, 2000]
    - [53, 90.2527]
  - - [512, 1024, 1, 500, 512, 512, 512, 500]
    - [158, 6898.53]
  - - [128, 2000, 1, 500, 128, 128, 128, 500]
    - [163, 5161.29]
  - - [32, 512, 1, 2048, 32, 32, 32, 2048]
    - [97, 1103.76]
  - - [10, 100, 1, 2000, 10, 10, 10, 2000]
    - [27, 105.932]
  - - [4, 100, 1, 512, 4, 4, 4, 512]
    - [27, 24.6154]
  - - [2, 512, 1, 2048, 2, 2, 2, 2048]
    - [91, 73.2246]
  - - [200, 512, 1, 2048, 200, 200, 200, 2048]
    - [203, 3953.91]
  - - [200, 2000, 1, 2000, 200, 200, 200, 2000]
    - [165, 6230.53]
  - - [100, 100, 1, 2000, 100, 100, 100, 2000]
    - [27, 827.815]
  - - [500, 2048, 1, 2000, 500, 500, 500, 2000]
    - [128, 8387.94]
  - - [64, 2048, 1, 2048, 64, 64, 64, 2048]
    - [173, 3406.54]
  - - [16, 2000, 1, 1024, 16, 16, 16, 1024]
    - [33, 1024.0]
  - - [512, 2048, 1, 1024, 512, 512, 512, 1024]
    - [106, 8061.12]
  - - [10, 500, 1, 500, 10, 10, 10, 500]
    - [37, 284.091]
  - - [200, 1024, 1, 2048, 200, 200, 200, 2048]
    - [201, 4886.19]
  - - [10, 2000, 1, 2000, 10, 10, 10, 2000]
    - [27, 1449.28]
  - - [8, 2000, 1, 500, 8, 8, 8, 500]
    - [76, 719.424]
  - - [2, 100, 1, 2048, 2, 2, 2, 2048]
    - [91, 19.845]
  - - [32, 100, 1, 2048, 32, 32, 32, 2048]
    - [91, 323.794]
  - - [512, 512, 1, 10, 512, 512, 512, 10]
    - [148, 420.103]
  - - [512, 500, 1, 10, 512, 512, 512, 10]
    - [153, 376.471]
  - - [16, 100, 1, 1024, 16, 16, 16, 1024]
    - [37, 129.62]
  - - [2, 500, 1, 10, 2, 2, 2, 10]
    - [1, 2.11864]
  - - [200, 512, 1, 10, 200, 200, 200, 10]
    - [3, 188.235]
  - - [512, 1024, 1, 100, 512, 512, 512, 100]
    - [103, 3877.87]
  - - [16, 2000, 1, 2000, 16, 16, 16, 2000]
    - [27, 2222.22]
  - - [500, 500, 1, 1024, 500, 500, 500, 1024]
    - [123, 6130.27]
  - - [500, 100, 1, 2048, 500, 500, 500, 2048]
    - [178, 2949.31]
  - - [256, 1024, 1, 512, 256, 256, 256, 512]
    - [142, 5886.74]
  - - [256, 500, 1, 512, 256, 256, 256, 512]
    - [120, 4380.75]
  - - [16, 1024, 1, 2000, 16, 16, 16, 2000]
    - [91, 1208.26]
  - - [200, 500, 1, 2048, 200, 200, 200, 2048]
    - [203, 3855.42]
  - - [256, 2000, 1, 10, 256, 256, 256, 10]
    - [105, 727.273]
  - - [10, 2048, 1, 2048, 10, 10, 10, 2048]
    - [58, 823.058]
  - - [512, 2000, 1, 100, 512, 512, 512, 100]
    - [107, 5120.0]
  - - [10, 1024, 1, 1024, 10, 10, 10, 1024]
    - [34, 553.046]
  - - [512, 2000, 1, 2048, 512, 512, 512, 2048]
    - [135, 7563.3]
  - - [500, 1024, 1, 500, 500, 500, 500, 500]
    - [159, 6570.84]
  - - [500, 100, 1, 512, 500, 500, 500, 512]
    - [178, 2038.22]
  - - [256, 2000, 1, 100, 256, 256, 256, 100]
    - [127, 3764.71]
  - - [512, 1024, 1, 2048, 512, 512, 512, 2048]
    - [171, 7286.52]
  - - [32, 512, 1, 500, 32, 32, 32, 500]
    - [27, 898.246]
  - - [100, 2000, 1, 10, 100, 100, 100, 10]
    - [19, 333.333]
  - - [100, 500, 1, 512, 100, 100, 100, 512]
    - [197, 2176.87]
  - - [8, 2000, 1, 512, 8, 8, 8, 512]
    - [76, 602.353]
  - - [100, 2048, 1, 2048, 100, 100, 100, 2048]
    - [183, 3694.77]
  - - [128, 1024, 1, 2048, 128, 128, 128, 2048]
    - [202, 4168.25]
  - - [8, 500, 1, 2000, 8, 8, 8, 2000]
    - [101, 352.113]
  - - [100, 2000, 1, 500, 100, 100, 100, 500]
    - [151, 4045.31]
  - - [100, 2048, 1, 100, 100, 100, 100, 100]
    - [151, 2081.3]
  - - [4, 100, 1, 1024, 4, 4, 4, 1024]
    - [27, 33.0323]
  - - [500, 2048, 1, 2048, 500, 500, 500, 2048]
    - [135, 7764.93]
  - - [2, 2000, 1, 2048, 2, 2, 2, 2048]
    - [46, 166.234]
  - - [200, 2048, 1, 10, 200, 200, 200, 10]
    - [20, 609.524]
  - - [2, 500, 1, 1024, 2, 2, 2, 1024]
    - [91, 75.2941]
  - - [100, 500, 1, 1024, 100, 100, 100, 1024]
    - [87, 1975.31]
  - - [16, 2048, 1, 500, 16, 16, 16, 500]
    - [27, 1473.38]
  - - [100, 1024, 1, 10, 100, 100, 100, 10]
    - [187, 185.507]
  - - [8, 2048, 1, 1024, 8, 8, 8, 1024]
    - [83, 543.304]
  - - [2, 2000, 1, 500, 2, 2, 2, 500]
    - [27, 179.856]
  - - [32, 100, 1, 1024, 32, 32, 32, 1024]
    - [27, 267.712]
  - - [500, 2000, 1, 512, 500, 500, 500, 512]
    - [157, 7087.49]
  - - [64, 100, 1, 2000, 64, 64, 64, 2000]
    - [37, 615.385]
  - - [100, 1024, 1, 2000, 100, 100, 100, 2000]
    - [200, 4224.42]
  - - [64, 500, 1, 10, 64, 64, 64, 10]
    - [2, 63.4921]
  - - [32, 2048, 1, 100, 32, 32, 32, 100]
    - [23, 941.609]
  - - [64, 500, 1, 512, 64, 64, 64, 512]
    - [27, 1575.38]
  - - [10, 100, 1, 1024, 10, 10, 10, 1024]
    - [37, 82.5806]
  - - [16, 512, 1, 100, 16, 16, 16, 100]
    - [26, 148.406]
  - - [4, 100, 1, 2000, 4, 4, 4, 2000]
    - [100, 43.8597]
  - - [2, 512, 1, 1024, 2, 2, 2, 1024]
    - [91, 74.052]
  - - [64, 512, 1, 1024, 64, 64, 64, 1024]
    - [92, 1570.9]
  - - [10, 2048, 1, 500, 10, 10, 10, 500]
    - [27, 920.863]
  - - [4, 2000, 1, 2048, 4, 4, 4, 2048]
    - [46, 326.115]
  - - [512, 100, 1, 2048, 512, 512, 512, 2048]
    - [181, 3084.05]
  - - [32, 100, 1, 2000, 32, 32, 32, 2000]
    - [27, 343.348]
  - - [256, 512, 1, 500, 256, 256, 256, 500]
    - [120, 4311.58]
  - - [100, 2000, 1, 100, 100, 100, 100, 100]
    - [151, 2016.13]
  - - [8, 2000, 1, 1024, 8, 8, 8, 1024]
    - [40, 544.681]
  - - [4, 512, 1, 500, 4, 4, 4, 500]
    - [27, 118.519]
  - - [128, 1024, 1, 10, 128, 128, 128, 10]
    - [190, 244.537]
  - - [4, 500, 1, 1024, 4, 4, 4, 1024]
    - [27, 144.633]
  - - [32, 2048, 1, 512, 32, 32, 32, 512]
    - [30, 2139.95]
  - - [32, 100, 1, 10, 32, 32, 32, 10]
    - [5, 7.01754]
  - - [100, 2048, 1, 10, 100, 100, 100, 10]
    - [194, 341.333]
  - - [512, 500, 1, 100, 512, 512, 512, 100]
    - [155, 2461.54]
  - - [128, 2000, 1, 1024, 128, 128, 128, 1024]
    - [139, 4174.27]
  - - [200, 1024, 1, 500, 200, 200, 200, 500]
    - [151, 4295.3]
  - - [32, 2048, 1, 1024, 32, 32, 32, 1024]
    - [54, 1667.72]
  - - [10, 1024, 1, 2048, 10, 10, 10, 2048]
    - [45, 555.39]
  - - [8, 500, 1, 100, 8, 8, 8, 100]
    - [26, 71.4286]
  - - [32, 2048, 1, 500, 32, 32, 32, 500]
    - [30, 2528.4]
  - - [200, 100, 1, 1024, 200, 200, 200, 1024]
    - [39, 1071.13]
  - - [16, 100, 1, 100, 16, 16, 16, 100]
    - [16, 28.5714]
  - - [8, 1024, 1, 2000, 8, 8, 8, 2000]
    - [100, 654.313]
  - - [4, 512, 1, 100, 4, 4, 4, 100]
    - [26, 36.5714]
  - - [16, 500, 1, 100, 16, 16, 16, 100]
    - [26, 142.857]
  - - [8, 1024, 1, 2048, 8, 8, 8, 2048]
    - [52, 441.506]
  - - [16, 1024, 1, 2048, 16, 16, 16, 2048]
    - [53, 886.745]
  - - [10, 2048, 1, 1024, 10, 10, 10, 1024]
    - [31, 639.376]
  - - [64, 512, 1, 100, 64, 64, 64, 100]
    - [26, 518.481]
  - - [2, 100, 1, 500, 2, 2, 2, 500]
    - [27, 9.61538]
  - - [2, 500, 1, 512, 2, 2, 2, 512]
    - [33, 48.1203]
  - - [256, 512, 1, 2000, 256, 256, 256, 2000]
    - [136, 6450.39]
  - - [128, 500, 1, 1024, 128, 128, 128, 1024]
    - [30, 2497.56]
  - - [10, 100, 1, 10, 10, 10, 10, 10]
    - [67, 2.23214]
  - - [8, 2048, 1, 2048, 8, 8, 8, 2048]
    - [17, 643.298]
  - - [16, 2048, 1, 2048, 16, 16, 16, 2048]
    - [57, 1337.9]
  - - [64, 1024, 1, 10, 64, 64, 64, 10]
    - [20, 132.129]
  - - [500, 100, 1, 500, 500, 500, 500, 500]
    - [178, 1940.99]
  - - [256, 1024, 1, 2000, 256, 256, 256, 2000]
    - [174, 7629.34]
  - - [200, 512, 1, 500, 200, 200, 200, 500]
    - [163, 3232.32]
  - - [8, 2000, 1, 10, 8, 8, 8, 10]
    - [64, 32.2581]
  - - [64, 2000, 1, 512, 64, 64, 64, 512]
    - [162, 3225.2]
  - - [2, 512, 1, 100, 2, 2, 2, 100]
    - [6, 16.6234]
  - - [4, 2000, 1, 2000, 4, 4, 4, 2000]
    - [27, 586.51]
  - - [200, 1024, 1, 100, 200, 200, 200, 100]
    - [151, 2133.33]
  - - [16, 100, 1, 500, 16, 16, 16, 500]
    - [91, 92.5926]
  - - [128, 100, 1, 500, 128, 128, 128, 500]
    - [87, 526.316]
  - - [500, 1024, 1, 1024, 500, 500, 500, 1024]
    - [121, 7201.76]
  - - [200, 1024, 1, 1024, 200, 200, 200, 1024]
    - [173, 4519.72]
  - - [8, 2048, 1, 512, 8, 8, 8, 512]
    - [37, 624.152]
  - - [200, 2000, 1, 500, 200, 200, 200, 500]
    - [127, 5186.72]
  - - [512, 100, 1, 1024, 512, 512, 512, 1024]
    - [178, 2742.09]
  - - [16, 100, 1, 2000, 16, 16, 16, 2000]
    - [37, 168.776]
  - - [500, 512, 1, 2000, 500, 500, 500, 2000]
    - [174, 7289.29]
  - - [8, 2000, 1, 2048, 8, 8, 8, 2048]
    - [48, 668.189]
  - - [256, 2048, 1, 100, 256, 256, 256, 100]
    - [109, 3924.31]
  - - [32, 2048, 1, 2000, 32, 32, 32, 2000]
    - [41, 3882.46]
  - - [200, 500, 1, 512, 200, 200, 200, 512]
    - [166, 3368.42]
  - - [10, 512, 1, 100, 10, 10, 10, 100]
    - [26, 91.4286]
  - - [16, 2000, 1, 10, 16, 16, 16, 10]
    - [4, 61.5385]
  - - [8, 512, 1, 100, 8, 8, 8, 100]
    - [26, 72.1127]
  - - [256, 512, 1, 512, 256, 256, 256, 512]
    - [131, 4583.94]
  - - [500, 2000, 1, 1024, 500, 500, 500, 1024]
    - [106, 7569.49]
  - - [512, 512, 1, 500, 512, 512, 512, 500]
    - [122, 5708.71]
  - - [256, 2048, 1, 1024, 256, 256, 256, 1024]
    - [146, 5923.11]
  - - [8, 2048, 1, 2000, 8, 8, 8, 2000]
    - [27, 1153.8]
  - - [100, 512, 1, 2048, 100, 100, 100, 2048]
    - [93, 2383.13]
  - - [100, 1024, 1, 512, 100, 100, 100, 512]
    - [178, 3343.67]
  - - [128, 100, 1, 2000, 128, 128, 128, 2000]
    - [196, 1084.75]
  - - [4, 2048, 1, 2048, 4, 4, 4, 2048]
    - [45, 332.354]
  - - [2, 1024, 1, 2000, 2, 2, 2, 2000]
    - [56, 161.006]
  - - [100, 512, 1, 512, 100, 100, 100, 512]
    - [30, 2184.53]
  - - [128, 1024, 1, 1024, 128, 128, 128, 1024]
    - [173, 3847.99]
  - - [200, 2048, 1, 1024, 200, 200, 200, 1024]
    - [108, 4547.16]
  - - [32, 1024, 1, 2000, 32, 32, 32, 2000]
    - [37, 2416.52]
  - - [128, 500, 1, 100, 128, 128, 128, 100]
    - [32, 919.54]
  - - [200, 512, 1, 2000, 200, 200, 200, 2000]
    - [200, 4238.41]
  - - [10, 2048, 1, 2000, 10, 10, 10, 2000]
    - [37, 1454.55]
  - - [256, 1024, 1, 500, 256, 256, 256, 500]
    - [134, 5669.2]
  - - [100, 100, 1, 100, 100, 100, 100, 100]
    - [26, 171.233]
  - - [8, 512, 1, 1024, 8, 8, 8, 1024]
    - [95, 286.496]
  - - [200, 1024, 1, 512, 200, 200, 200, 512]
    - [151, 4354.55]
  - - [256, 500, 1, 500, 256, 256, 256, 500]
    - [136, 4020.1]
  - - [200, 100, 1, 500, 200, 200, 200, 500]
    - [200, 702.247]
  - - [2, 1024, 1, 2048, 2, 2, 2, 2048]
    - [46, 112.75]
  - - [256, 500, 1, 2048, 256, 256, 256, 2048]
    - [136, 5041.23]
  - - [512, 2048, 1, 500, 512, 512, 512, 500]
    - [129, 7710.12]
  - - [512, 100, 1, 2000, 512, 512, 512, 2000]
    - [178, 3099.27]
  - - [512, 500, 1, 1024, 512, 512, 512, 1024]
    - [137, 6463.12]
  - - [16, 512, 1, 2000, 16, 16, 16, 2000]
    - [53, 721.127]
  - - [64, 500, 1, 1024, 64, 64, 64, 1024]
    - [92, 1528.36]
  - - [512, 2000, 1, 10, 512, 512, 512, 10]
    - [113, 1174.31]
  - - [256, 512, 1, 1024, 256, 256, 256, 1024]
    - [131, 4978.4]
  - - [10, 512, 1, 1024, 10, 10, 10, 1024]
    - [91, 370.26]
  - - [512, 100, 1, 100, 512, 512, 512, 100]
    - [114, 659.794]
  - - [8, 2000, 1, 100, 8, 8, 8, 100]
    - [26, 256.41]
  - - [128, 2048, 1, 1024, 128, 128, 128, 1024]
    - [139, 4173.44]
  - - [2, 2000, 1, 2000, 2, 2, 2, 2000]
    - [27, 250.627]
  - - [16, 2048, 1, 1024, 16, 16, 16, 1024]
    - [74, 1045.96]
  - - [500, 512, 1, 500, 500, 500, 500, 500]
    - [119, 5517.24]
  - - [8, 100, 1, 1024, 8, 8, 8, 1024]
    - [92, 64.0]
  - - [10, 100, 1, 100, 10, 10, 10, 100]
    - [16, 17.8571]
  - - [200, 500, 1, 500, 200, 200, 200, 500]
    - [166, 3140.7]
  - - [10, 500, 1, 2000, 10, 10, 10, 2000]
    - [53, 444.84]
  - - [500, 100, 1, 2000, 500, 500, 500, 2000]
    - [181, 2969.12]
  - - [100, 512, 1, 2000, 100, 100, 100, 2000]
    - [93, 2776.57]
  - - [500, 1024, 1, 2000, 500, 500, 500, 2000]
    - [172, 8020.05]
  - - [32, 2000, 1, 2000, 32, 32, 32, 2000]
    - [33, 3827.75]
  - - [64, 1024, 1, 512, 64, 64, 64, 512]
    - [197, 2573.19]
  - - [64, 2000, 1, 2000, 64, 64, 64, 2000]
    - [166, 5797.1]
  - - [32, 500, 1, 100, 32, 32, 32, 100]
    - [26, 266.667]
  - - [128, 2000, 1, 2048, 128, 128, 128, 2048]
    - [182, 4547.95]
  - - [10, 100, 1, 2048, 10, 10, 10, 2048]
    - [91, 98.4615]
  - - [32, 2048, 1, 2048, 32, 32, 32, 2048]
    - [54, 2213.35]
  - - [64, 100, 1, 100, 64, 64, 64, 100]
    - [27, 96.3855]
  - - [2, 1024, 1, 100, 2, 2, 2, 100]
    - [77, 34.5946]
  - - [256, 1024, 1, 10, 256, 256, 256, 10]
    - [147, 425.558]
  - - [256, 1024, 1, 1024, 256, 256, 256, 1024]
    - [140, 5482.75]
  - - [64, 500, 1, 2000, 64, 64, 64, 2000]
    - [27, 2056.56]
  - - [512, 2000, 1, 512, 512, 512, 512, 512]
    - [125, 7550.23]
  - - [8, 512, 1, 512, 8, 8, 8, 512]
    - [34, 231.986]
  - - [8, 512, 1, 2048, 8, 8, 8, 2048]
    - [27, 290.464]
  - - [100, 100, 1, 1024, 100, 100, 100, 1024]
    - [197, 624.39]
  - - [2, 2048, 1, 10, 2, 2, 2, 10]
    - [70, 8.82759]
  - - [4, 2048, 1, 512, 4, 4, 4, 512]
    - [76, 312.076]
  - - [4, 2048, 1, 10, 4, 4, 4, 10]
    - [69, 17.9649]
  - - [8, 100, 1, 2000, 8, 8, 8, 2000]
    - [46, 85.8369]
  - - [2, 1024, 1, 1024, 2, 2, 2, 1024]
    - [43, 101.214]
  - - [16, 2048, 1, 100, 16, 16, 16, 100]
    - [27, 518.481]
  - - [16, 512, 1, 512, 16, 16, 16, 512]
    - [37, 455.903]
  - - [32, 500, 1, 512, 32, 32, 32, 512]
    - [34, 906.195]
  - - [500, 2000, 1, 2000, 500, 500, 500, 2000]
    - [129, 8143.32]
  - - [500, 1024, 1, 10, 500, 500, 500, 10]
    - [110, 680.851]
  - - [32, 500, 1, 1024, 32, 32, 32, 1024]
    - [86, 1008.87]
  - - [32, 500, 1, 10, 32, 32, 32, 10]
    - [22, 33.3333]
  - - [500, 500, 1, 10, 500, 500, 500, 10]
    - [151, 367.647]
  - - [4, 2000, 1, 500, 4, 4, 4, 500]
    - [37, 370.37]
  - - [10, 2000, 1, 500, 10, 10, 10, 500]
    - [27, 899.281]
  - - [32, 2000, 1, 512, 32, 32, 32, 512]
    - [39, 2089.8]
  - - [256, 500, 1, 100, 256, 256, 256, 100]
    - [152, 1495.33]
  - - [256, 2048, 1, 10, 256, 256, 256, 10]
    - [110, 789.59]
  - - [4, 1024, 1, 500, 4, 4, 4, 500]
    - [27, 222.609]
  - - [256, 512, 1, 2048, 256, 256, 256, 2048]
    - [136, 5292.5]
  - - [2, 2000, 1, 1024, 2, 2, 2, 1024]
    - [74, 137.265]
  - - [256, 100, 1, 512, 256, 256, 256, 512]
    - [178, 1085.03]
  - - [8, 1024, 1, 500, 8, 8, 8, 500]
    - [27, 441.379]
  - - [256, 2048, 1, 500, 256, 256, 256, 500]
    - [157, 7031.76]
  - - [256, 2048, 1, 2048, 256, 256, 256, 2048]
    - [120, 6771.83]
  - - [2, 2000, 1, 512, 2, 2, 2, 512]
    - [81, 159.006]
  - - [256, 2000, 1, 512, 256, 256, 256, 512]
    - [124, 6527.49]
  - - [4, 1024, 1, 100, 4, 4, 4, 100]
    - [73, 70.137]
  - - [512, 1024, 1, 2000, 512, 512, 512, 2000]
    - [158, 8295.7]
  - - [100, 500, 1, 500, 100, 100, 100, 500]
    - [30, 2016.13]
  - - [4, 2048, 1, 1024, 4, 4, 4, 1024]
    - [78, 284.939]
  - - [2, 1024, 1, 500, 2, 2, 2, 500]
    - [27, 109.402]
  - - [64, 100, 1, 500, 64, 64, 64, 500]
    - [27, 296.296]
  - - [256, 2000, 1, 2000, 256, 256, 256, 2000]
    - [135, 8152.87]
  - - [2, 512, 1, 500, 2, 2, 2, 500]
    - [33, 44.7552]
  - - [8, 2048, 1, 500, 8, 8, 8, 500]
    - [27, 736.691]
  - - [10, 1024, 1, 500, 10, 10, 10, 500]
    - [27, 547.009]
  - - [4, 2048, 1, 2000, 4, 4, 4, 2000]
    - [37, 604.13]
  - - [200, 1024, 1, 2000, 200, 200, 200, 2000]
    - [204, 5400.84]
  - - [128, 500, 1, 512, 128, 128, 128, 512]
    - [197, 2730.67]
  - - [10, 500, 1, 2048, 10, 10, 10, 2048]
    - [91, 359.551]
  - - [256, 2048, 1, 2000, 256, 256, 256, 2000]
    - [135, 8375.21]
  - - [8, 2000, 1, 2000, 8, 8, 8, 2000]
    - [37, 1146.13]
  - - [100, 2048, 1, 512, 100, 100, 100, 512]
    - [160, 3936.1]
  - - [512, 500, 1, 2048, 512, 512, 512, 2048]
    - [136, 6756.29]
  - - [200, 2048, 1, 100, 200, 200, 200, 100]
    - [127, 3180.12]
  - - [128, 512, 1, 512, 128, 128, 128, 512]
    - [30, 2872.81]
  - - [200, 2000, 1, 2048, 200, 200, 200, 2048]
    - [176, 4818.82]
  - - [4, 2000, 1, 1024, 4, 4, 4, 1024]
    - [74, 275.269]
  - - [64, 512, 1, 10, 64, 64, 64, 10]
    - [189, 69.4237]
  - - [32, 500, 1, 2000, 32, 32, 32, 2000]
    - [56, 1246.11]
  - - [128, 2048, 1, 2000, 128, 128, 128, 2000]
    - [169, 7233.55]
  - - [100, 100, 1, 2048, 100, 100, 100, 2048]
    - [27, 790.123]
  - - [500, 2048, 1, 512, 500, 500, 500, 512]
    - [157, 7249.56]
  - - [200, 100, 1, 512, 200, 200, 200, 512]
    - [33, 748.538]
  - - [32, 2000, 1, 100, 32, 32, 32, 100]
    - [28, 930.233]
  - - [500, 512, 1, 2048, 500, 500, 500, 2048]
    - [179, 6639.92]
  - - [500, 2000, 1, 500, 500, 500, 500, 500]
    - [159, 7078.14]
  - - [200, 100, 1, 2048, 200, 200, 200, 2048]
    - [37, 1387.53]
  - - [2, 2048, 1, 100, 2, 2, 2, 100]
    - [71, 64.8101]
  - - [8, 100, 1, 10, 8, 8, 8, 10]
    - [12, 1.75439]
  - - [200, 2048, 1, 2048, 200, 200, 200, 2048]
    - [176, 5021.92]
  - - [200, 2048, 1, 500, 200, 200, 200, 500]
    - [127, 5355.65]
  - - [100, 100, 1, 500, 100, 100, 100, 500]
    - [197, 416.667]
  - - [8, 2048, 1, 10, 8, 8, 8, 10]
    - [68, 34.7119]
  - - [100, 500, 1, 10, 100, 100, 100, 10]
    - [8, 93.2836]
  - - [200, 500, 1, 2000, 200, 200, 200, 2000]
    - [200, 4152.82]
  - - [512, 2000, 1, 500, 512, 512, 512, 500]
    - [129, 7485.38]
  - - [10, 500, 1, 1024, 10, 10, 10, 1024]
    - [95, 363.636]
  - - [256, 100, 1, 10, 256, 256, 256, 10]
    - [144, 41.0256]
  - - [500, 512, 1, 1024, 500, 500, 500, 1024]
    - [123, 6362.72]
  - - [200, 2048, 1, 2000, 200, 200, 200, 2000]
    - [165, 6320.99]
  - - [100, 1024, 1, 100, 100, 100, 100, 100]
    - [164, 1306.12]
  - - [500, 1024, 1, 100, 500, 500, 500, 100]
    - [103, 3699.42]
  - - [10, 512, 1, 2048, 10, 10, 10, 2048]
    - [27, 361.08]
  - - [2, 1024, 1, 512, 2, 2, 2, 512]
    - [76, 105.703]
  - - [4, 500, 1, 2048, 4, 4, 4, 2048]
    - [99, 143.417]
  - - [100, 512, 1, 100, 100, 100, 100, 100]
    - [32, 744.186]
  - - [16, 500, 1, 512, 16, 16, 16, 512]
    - [27, 453.097]
  - - [10, 1024, 1, 100, 10, 10, 10, 100]
    - [25, 166.234]
  - - [8, 1024, 1, 100, 8, 8, 8, 100]
    - [73, 140.274]
  - - [64, 2000, 1, 500, 64, 64, 64, 500]
    - [168, 3940.89]
  - - [64, 1024, 1, 2000, 64, 64, 64, 2000]
    - [33, 3531.03]
  - - [10, 100, 1, 512, 10, 10, 10, 512]
    - [27, 61.5385]
  - - [4, 500, 1, 2000, 4, 4, 4, 2000]
    - [53, 173.01]
  - - [512, 1024, 1, 10, 512, 512, 512, 10]
    - [104, 736.36]
  - - [128, 2048, 1, 2048, 128, 128, 128, 2048]
    - [167, 4596.5]
  - - [4, 100, 1, 100, 4, 4, 4, 100]
    - [16, 7.14286]
  - - [32, 1024, 1, 512, 32, 32, 32, 512]
    - [76, 1519.68]
  - - [8, 512, 1, 2000, 8, 8, 8, 2000]
    - [101, 356.794]
  - - [100, 100, 1, 512, 100, 100, 100, 512]
    - [41, 426.667]
  - - [2, 2048, 1, 2048, 2, 2, 2, 2048]
    - [50, 170.778]
  - - [2, 512, 1, 2000, 2, 2, 2, 2000]
    - [53, 90.7801]
  - - [16, 500, 1, 10, 16, 16, 16, 10]
    - [26, 18.1818]
  - - [10, 500, 1, 100, 10, 10, 10, 100]
    - [26, 88.0282]
  - - [4, 100, 1, 500, 4, 4, 4, 500]
    - [91, 23.5849]
  - - [512, 1024, 1, 1024, 512, 512, 512, 1024]
    - [143, 7431.77]
  - - [64, 500, 1, 100, 64, 64, 64, 100]
    - [36, 506.329]
  - - [128, 2000, 1, 10, 128, 128, 128, 10]
    - [194, 432.432]
  - - [10, 2000, 1, 2048, 10, 10, 10, 2048]
    - [57, 806.299]
  - - [2, 100, 1, 100, 2, 2, 2, 100]
    - [14, 3.125]
  - - [10, 512, 1, 2000, 10, 10, 10, 2000]
    - [46, 462.094]
  - - [8, 500, 1, 500, 8, 8, 8, 500]
    - [27, 231.481]
  - - [4, 500, 1, 512, 4, 4, 4, 512]
    - [27, 118.519]
  - - [10, 500, 1, 10, 10, 10, 10, 10]
    - [21, 10.9649]
  - - [64, 512, 1, 2000, 64, 64, 64, 2000]
    - [27, 2116.8]
  - - [500, 512, 1, 10, 500, 500, 500, 10]
    - [148, 395.062]
  - - [200, 512, 1, 512, 200, 200, 200, 512]
    - [166, 3449.26]
  - - [512, 500, 1, 500, 512, 512, 512, 500]
    - [122, 5536.33]
  - - [32, 512, 1, 2000, 32, 32, 32, 2000]
    - [37, 1264.2]
  - - [128, 500, 1, 2048, 128, 128, 128, 2048]
    - [93, 3006.24]
  - - [500, 2048, 1, 10, 500, 500, 500, 10]
    - [118, 1049.18]
  - - [512, 512, 1, 100, 512, 512, 512, 100]
    - [155, 2664.06]
  - - [200, 2000, 1, 512, 200, 200, 200, 512]
    - [163, 5192.7]
  - - [500, 500, 1, 512, 500, 500, 500, 512]
    - [119, 5673.76]
  - - [128, 2048, 1, 500, 128, 128, 128, 500]
    - [151, 5251.28]
  - - [4, 512, 1, 512, 4, 4, 4, 512]
    - [27, 123.653]
  - - [16, 2048, 1, 2000, 16, 16, 16, 2000]
    - [43, 2294.68]
  - - [16, 500, 1, 1024, 16, 16, 16, 1024]
    - [27, 562.637]
  - - [256, 2000, 1, 500, 256, 256, 256, 500]
    - [157, 6639.0]
  - - [10, 1024, 1, 10, 10, 10, 10, 10]
    - [7, 20.9836]
  - - [16, 500, 1, 500, 16, 16, 16, 500]
    - [27, 446.429]
  - - [10, 2048, 1, 512, 10, 10, 10, 512]
    - [25, 784.862]
  - - [200, 500, 1, 10, 200, 200, 200, 10]
    - [0, 176.056]
  - - [256, 2048, 1, 512, 256, 256, 256, 512]
    - [154, 6540.83]
  - - [256, 2000, 1, 2048, 256, 256, 256, 2048]
    - [131, 6670.33]
  - - [500, 2048, 1, 500, 500, 500, 500, 500]
    - [159, 7264.47]
  - - [500, 100, 1, 1024, 500, 500, 500, 1024]
    - [181, 2700.42]
  - - [16, 100, 1, 512, 16, 16, 16, 512]
    - [91, 96.6038]
  - - [64, 512, 1, 2048, 64, 64, 64, 2048]
    - [92, 1868.29]
  - - [32, 1024, 1, 10, 32, 32, 32, 10]
    - [3, 69.4237]
  - - [16, 2048, 1, 512, 16, 16, 16, 512]
    - [76, 1226.4]
  - - [8, 1024, 1, 512, 8, 8, 8, 512]
    - [76, 416.102]
  - - [4, 1024, 1, 2048, 4, 4, 4, 2048]
    - [98, 223.101]
  - - [100, 2048, 1, 2000, 100, 100, 100, 2000]
    - [171, 5614.04]
  - - [512, 512, 1, 2048, 512, 512, 512, 2048]
    - [136, 6868.87]
  - - [256, 2000, 1, 1024, 256, 256, 256, 1024]
    - [127, 5758.88]
  - - [64, 512, 1, 512, 64, 64, 64, 512]
    - [196, 1651.3]
  - - [200, 1024, 1, 10, 200, 200, 200, 10]
    - [10, 341.333]
  - - [128, 500, 1, 500, 128, 128, 128, 500]
    - [39, 2580.65]
  - - [100, 512, 1, 1024, 100, 100, 100, 1024]
    - [30, 2041.62]
  - - [16, 1024, 1, 500, 16, 16, 16, 500]
    - [27, 867.797]
  - - [128, 100, 1, 2048, 128, 128, 128, 2048]
    - [197, 1011.36]
  - - [100, 512, 1, 500, 100, 100, 100, 500]
    - [30, 2051.28]
  - - [8, 1024, 1, 1024, 8, 8, 8, 1024]
    - [43, 424.525]
  - - [2, 2000, 1, 10, 2, 2, 2, 10]
    - [69, 8.47458]
  - - [4, 500, 1, 10, 4, 4, 4, 10]
    - [66, 4.46429]
  - - [500, 2000, 1, 2048, 500, 500, 500, 2048]
    - [143, 7444.02]
  - - [4, 2000, 1, 100, 4, 4, 4, 100]
    - [79, 128.205]
  - - [512, 2000, 1, 2000, 512, 512, 512, 2000]
    - [129, 8454.43]
  - - [128, 500, 1, 10, 128, 128, 128, 10]
    - [188, 117.647]
  - - [32, 1024, 1, 100, 32, 32, 32, 100]
    - [36, 512.0]
  - - [8, 500, 1, 2048, 8, 8, 8, 2048]
    - [51, 286.835]
  - - [16, 1024, 1, 1024, 16, 16, 16, 1024]
    - [15, 881.156]
  - - [200, 100, 1, 10, 200, 200, 200, 10]
    - [187, 40.3226]
  - - [512, 100, 1, 500, 512, 512, 512, 500]
    - [181, 1987.58]
  - - [512, 2048, 1, 2048, 512, 512, 512, 2048]
    - [138, 8063.55]
  - - [16, 2000, 1, 512, 16, 16, 16, 512]
    - [37, 1204.71]
  - - [64, 2048, 1, 1024, 64, 64, 64, 1024]
    - [35, 2853.27]
  - - [32, 2048, 1, 10, 32, 32, 32, 10]
    - [9, 130.032]
  - - [10, 2048, 1, 10, 10, 10, 10, 10]
    - [11, 39.3846]
  - - [4, 2000, 1, 512, 4, 4, 4, 512]
    - [27, 316.049]
  - - [4, 500, 1, 100, 4, 4, 4, 100]
    - [26, 35.7143]
  - - [8, 100, 1, 2048, 8, 8, 8, 2048]
    - [46, 84.6281]
  - - [512, 2048, 1, 10, 512, 512, 512, 10]
    - [126, 1224.97]
  - - [512, 100, 1, 10, 512, 512, 512, 10]
    - [115, 90.1408]
  - - [4, 512, 1, 1024, 4, 4, 4, 1024]
    - [27, 143.248]
  - - [16, 2048, 1, 10, 16, 16, 16, 10]
    - [60, 65.0159]
  - - [500, 2000, 1, 100, 500, 500, 500, 100]
    - [111, 4716.98]
  - - [32, 1024, 1, 2048, 32, 32, 32, 2048]
    - [54, 1582.76]
  - - [100, 2000, 1, 2000, 100, 100, 100, 2000]
    - [171, 5512.68]
  - - [128, 100, 1, 512, 128, 128, 128, 512]
    - [197, 561.096]
  - - [500, 500, 1, 100, 500, 500, 500, 100]
    - [151, 2460.63]
  - - [32, 2000, 1, 10, 32, 32, 32, 10]
    - [3, 119.403]
  - - [128, 2048, 1, 100, 128, 128, 128, 100]
    - [151, 2708.1]
  - - [10, 2000, 1, 100, 10, 10, 10, 100]
    - [26, 316.456]
  - - [2, 2048, 1, 500, 2, 2, 2, 500]
    - [37, 191.045]
  - - [32, 1024, 1, 500, 32, 32, 32, 500]
    - [37, 1563.36]
  - - [4, 1024, 1, 10, 4, 4, 4, 10]
    - [66, 9.14286]
  - - [100, 512, 1, 10, 100, 100, 100, 10]
    - [192, 96.9697]
  - - [8, 100, 1, 100, 8, 8, 8, 100]
    - [42, 14.2857]
  - - [128, 512, 1, 500, 128, 128, 128, 500]
    - [30, 2677.12]
  - - [16, 100, 1, 2048, 16, 16, 16, 2048]
    - [53, 161.897]
  - - [2, 1024, 1, 10, 2, 2, 2, 10]
    - [66, 4.49123]
  - - [4, 100, 1, 2048, 4, 4, 4, 2048]
    - [46, 41.7959]
  - - [4, 512, 1, 2000, 4, 4, 4, 2000]
    - [46, 180.282]
- null
