src/Tensile/data/Configs/miopen/archives/bert/2019-08-26/exact/vega20_Cijk_Ailk_Bjlk_SB.yaml
- {MinimumRequiredVersion: 4.9.11}
- vega20
- gfx906
- [Device 66a0, Device 66a1, Device 66a7, Vega 20]
    SolutionIndex: 0
    SolutionNameMin: Cijk_Ailk_Bjlk_SB_MT64x64x8_SE_DTL0_EPS0_FL0_GRVW1_PGR0_PLR1_TT4_4_USFGRO1_VW2_WG16_16_1_WGM1
    SolutionIndex: 1
    SolutionNameMin: Cijk_Ailk_Bjlk_SB_MT64x64x8_SE_DTL0_EPS0_FL0_GRVW1_PGR0_PLR1_TT4_4_USFGRO1_VW4_WG16_16_1_WGM1
    SolutionIndex: 2
    SolutionNameMin: Cijk_Ailk_Bjlk_SB_MT64x64x8_SE_DTL0_EPS1_FL0_GRVW1_PGR1_PLR1_TT4_4_USFGRO1_VW4_WG16_16_1_WGM1
    SolutionIndex: 3
    SolutionNameMin: Cijk_Ailk_Bjlk_SB_MT64x64x16_SE_DTL0_EPS1_FL0_GRVW1_PGR1_PLR1_TT4_4_USFGRO1_VW4_WG16_16_1_WGM1
    SolutionIndex: 4
    SolutionNameMin: Cijk_Ailk_Bjlk_SB_MT64x64x16_SE_DTL0_EPS1_FL0_GRVW4_PGR1_PLR1_TT4_4_USFGRO0_VW4_WG16_16_1_WGM1
    SolutionIndex: 5
    SolutionNameMin: Cijk_Ailk_Bjlk_SB_MT32x8x32_SE_DTL0_EPS1_FL0_GRVW1_PGR1_PLR0_TT2_2_USFGRO1_VW2_WG16_4_4_WGM1
    SolutionIndex: 6
    SolutionNameMin: Cijk_Ailk_Bjlk_SB_MT32x8x32_SE_DTL0_EPS0_FL0_GRVW1_PGR0_PLR1_TT2_2_USFGRO1_VW2_WG16_4_4_WGM8
    SolutionIndex: 7
    SolutionNameMin: Cijk_Ailk_Bjlk_SB_MT32x8x16_SE_DTL0_EPS1_FL1_GRVW2_PGR1_PLR0_TT2_2_USFGRO0_VW2_WG16_4_4_WGM1
    SolutionIndex: 8
    SolutionNameMin: Cijk_Ailk_Bjlk_SB_MT64x8x32_SE_DTL0_EPS1_FL1_GRVW2_PGR1_PLR1_TT4_2_USFGRO0_VW2_WG16_4_4_WGM1
    SolutionIndex: 9
    SolutionNameMin: Cijk_Ailk_Bjlk_SB_MT96x64x8_SE_DTL0_EPS1_FL1_GRVW2_PGR1_PLR1_TT6_4_USFGRO0_VW2_WG16_16_1_WGM1
    SolutionIndex: 10
    SolutionNameMin: Cijk_Ailk_Bjlk_SB_MT96x64x8_SE_DTL0_EPS1_FL1_GRVW2_PGR1_PLR1_TT6_4_USFGRO0_VW2_WG16_16_1_WGM8
    SolutionIndex: 11
    SolutionNameMin: Cijk_Ailk_Bjlk_SB_MT64x96x8_SE_DTL0_EPS1_FL1_GRVW2_PGR1_PLR1_TT4_6_USFGRO0_VW2_WG16_16_1_WGM1
    SolutionIndex: 12
    SolutionNameMin: Cijk_Ailk_Bjlk_SB_MT64x128x8_SE_DTL0_EPS1_FL0_GRVW1_PGR1_PLR0_TT4_8_USFGRO1_VW4_WG16_16_1_WGM1
    SolutionIndex: 13
    SolutionNameMin: Cijk_Ailk_Bjlk_SB_MT64x128x8_SE_DTL0_EPS1_FL0_GRVW2_PGR1_PLR1_TT4_8_USFGRO0_VW2_WG16_16_1_WGM1
    SolutionIndex: 14
    SolutionNameMin: Cijk_Ailk_Bjlk_SB_MT128x64x8_SE_DTL0_EPS1_FL1_GRVW2_PGR1_PLR1_TT8_4_USFGRO0_VW2_WG16_16_1_WGM1
- - - [768, 3072, 1, 4096, 768, 768, 768, 3072]
    - [10, 10028.7]
  - - [64, 256, 192, 256, 64, 64, 64, 256]
    - [4, 8791.55]
  - - [768, 2, 1, 16, 768, 768, 768, 2]
    - [7, 4.95484]
  - - [768, 768, 1, 64, 768, 768, 768, 768]
    - [3, 3469.55]
  - - [768, 768, 1, 4096, 768, 768, 768, 768]
    - [11, 7475.0]
  - - [768, 768, 1, 320, 768, 768, 768, 768]
    - [11, 6003.3]
  - - [768, 30522, 1, 1280, 768, 768, 768, 30522]
    - [14, 10296.9]
  - - [64, 128, 384, 128, 64, 64, 64, 128]
    - [4, 7660.83]
  - - [768, 30522, 1, 320, 768, 768, 768, 30522]
    - [12, 10007.9]
  - - [768, 2, 1, 4096, 768, 768, 768, 2]
    - [8, 225.986]
  - - [768, 768, 1, 32, 768, 768, 768, 768]
    - [1, 2359.3]
  - - [3072, 768, 1, 4096, 3072, 3072, 3072, 768]
    - [10, 10033.7]
  - - [768, 30522, 1, 640, 768, 768, 768, 30522]
    - [13, 10206.7]
  - - [64, 64, 768, 64, 64, 64, 64, 64]
    - [2, 5494.72]
  - - [768, 768, 1, 640, 768, 768, 768, 768]
    - [11, 6721.64]
  - - [768, 768, 1, 16, 768, 768, 768, 768]
    - [0, 1203.72]
  - - [768, 768, 1, 1280, 768, 768, 768, 768]
    - [9, 7138.57]
  - - [768, 2, 1, 64, 768, 768, 768, 2]
    - [6, 20.48]
  - - [768, 2, 1, 32, 768, 768, 768, 2]
    - [5, 11.8154]
- null
