src/Tensile/data/Configs/miopen/archives/bert/2020-05-27/exact/vega20_Cijk_Ailk_Bljk_SB.yaml
- {MinimumRequiredVersion: 4.19.0}
- vega20
- gfx906
- [Device 66a0, Device 66a1, Device 66a7, Device 66af, Vega 20]
- - - [1024, 7168, 6, 1024, 1024, 1024, 1024, 1024]
    - [2, 12660.7]
  - - [1024, 7168, 6, 4096, 1024, 4096, 1024, 4096]
    - [0, 0.0]
  - - [4096, 7168, 6, 1024, 4096, 4096, 4096, 4096]
    - [2, 12709.8]
  - - [1024, 14, 6, 1024, 1024, 1024, 1024, 1024]
    - [5, 3387.71]
  - - [128, 14, 6, 1024, 128, 1024, 128, 1024]
    - [0, 0.0]
  - - [1024, 7168, 6, 2, 1024, 1024, 1024, 1024]
    - [0, 0.0]
  - - [1024, 7168, 12, 1024, 1024, 1024, 1024, 1024]
    - [1, 12704.0]
  - - [1024, 7168, 12, 4096, 1024, 4096, 1024, 4096]
    - [0, 0.0]
  - - [4096, 7168, 12, 1024, 4096, 4096, 4096, 4096]
    - [3, 12734.5]
  - - [1024, 14, 12, 1024, 1024, 1024, 1024, 1024]
    - [4, 4549.61]
  - - [128, 14, 12, 1024, 128, 1024, 128, 1024]
    - [0, 0.0]
  - - [1024, 7168, 12, 2, 1024, 1024, 1024, 1024]
    - [0, 0.0]
- null
