Tensile/Configs/miopen/archives/transformer/2020-01-19/exact/arcturus_Cijk_Ailk_Bljk_SB.yaml
- {MinimumRequiredVersion: 4.15.0}
- arcturus
- gfx908
- [Device 7380, Device 7388, Device 738c, Device 7390, Device 731f]
    SolutionIndex: 0
    SolutionNameMin: Cijk_Ailk_Bljk_SB_MT64x64x8_SE_EPS1_FL0_GRVW2_LPB0_PGR1_PLR1_TT4_4_USFGRO0_VW2_WGM8
    SolutionIndex: 1
    SolutionNameMin: Cijk_Ailk_Bljk_SB_MT64x64x16_SE_EPS1_FL0_GRVW2_LPB0_PGR1_PLR1_TT4_4_USFGRO0_VW2_WGM8
    SolutionIndex: 2
    SolutionNameMin: Cijk_Ailk_Bljk_SB_MT64x64x8_SE_EPS1_FL0_GRVW4_LPB0_PGR1_PLR1_TT4_4_USFGRO0_VW2_WGM8
    SolutionIndex: 3
    SolutionNameMin: Cijk_Ailk_Bljk_SB_MT64x64x16_SE_EPS1_FL0_GRVW4_LPB0_PGR1_PLR0_TT4_4_USFGRO0_VW4_WGM8
    SolutionIndex: 4
    SolutionNameMin: Cijk_Ailk_Bljk_SB_MT64x64x16_SE_EPS1_FL0_GRVW4_LPB0_PGR1_PLR1_TT4_4_USFGRO0_VW4_WGM1
    SolutionIndex: 5
    SolutionNameMin: Cijk_Ailk_Bljk_SB_MT64x64x16_SE_EPS1_FL0_GRVW4_LPB0_PGR1_PLR1_TT4_4_USFGRO0_VW4_WGM8
    SolutionIndex: 6
    SolutionNameMin: Cijk_Ailk_Bljk_SB_MT64x64x32_SE_EPS1_FL0_GRVW4_LPB0_PGR1_PLR1_TT4_4_USFGRO0_VW4_WGM8
    SolutionIndex: 7
    SolutionNameMin: Cijk_Ailk_Bljk_SB_MT64x64x8_SE_EPS1_FL1_GRVW2_LPB0_PGR1_PLR1_TT4_4_USFGRO0_VW2_WGM8
    SolutionIndex: 8
    SolutionNameMin: Cijk_Ailk_Bljk_SB_MT64x64x16_SE_EPS1_FL1_GRVW2_LPB0_PGR1_PLR1_TT4_4_USFGRO0_VW2_WGM8
    SolutionIndex: 9
    SolutionNameMin: Cijk_Ailk_Bljk_SB_MT64x64x16_SE_EPS1_FL1_GRVW4_LPB0_PGR1_PLR1_TT4_4_USFGRO0_VW4_WGM8
    SolutionIndex: 10
    SolutionNameMin: Cijk_Ailk_Bljk_SB_MT64x64x32_SE_EPS1_FL1_GRVW4_LPB0_PGR1_PLR1_TT4_4_USFGRO0_VW4_WGM8
    SolutionIndex: 11
    SolutionNameMin: Cijk_Ailk_Bljk_SB_MT96x64x16_SE_EPS1_FL0_GRVW2_LPB0_PGR1_PLR1_TT6_4_USFGRO0_VW2_WGM1
    SolutionIndex: 12
    SolutionNameMin: Cijk_Ailk_Bljk_SB_MT96x64x8_SE_EPS1_FL1_GRVW2_LPB0_PGR1_PLR1_TT6_4_USFGRO0_VW2_WGM8
    SolutionIndex: 13
    SolutionNameMin: Cijk_Ailk_Bljk_SB_MT96x64x16_SE_EPS1_FL1_GRVW2_LPB0_PGR1_PLR1_TT6_4_USFGRO0_VW2_WGM1
    SolutionIndex: 14
    SolutionNameMin: Cijk_Ailk_Bljk_SB_MT64x96x16_SE_EPS0_FL0_GRVW2_LPB0_PGR0_PLR1_TT4_6_USFGRO0_VW2_WGM8
    SolutionIndex: 15
    SolutionNameMin: Cijk_Ailk_Bljk_SB_MT64x96x16_SE_EPS0_FL1_GRVW2_LPB0_PGR0_PLR1_TT4_6_USFGRO0_VW2_WGM8
    SolutionIndex: 16
    SolutionNameMin: Cijk_Ailk_Bljk_SB_MT64x96x16_SE_EPS1_FL1_GRVW2_LPB0_PGR1_PLR1_TT4_6_USFGRO0_VW2_WGM8
    SolutionIndex: 17
    SolutionNameMin: Cijk_Ailk_Bljk_SB_MT64x96x8_SE_EPS1_FL1_GRVW4_LPB0_PGR1_PLR0_TT4_6_USFGRO0_VW2_WGM8
    SolutionIndex: 18
    SolutionNameMin: Cijk_Ailk_Bljk_SB_MT64x96x8_SE_EPS1_FL1_GRVW4_LPB0_PGR1_PLR1_TT4_6_USFGRO0_VW2_WGM8
    SolutionIndex: 19
    SolutionNameMin: Cijk_Ailk_Bljk_SB_MT64x128x8_SE_EPS0_FL0_GRVW1_LPB0_PGR0_PLR0_TT4_8_USFGRO1_VW2_WGM1
    SolutionIndex: 20
    SolutionNameMin: Cijk_Ailk_Bljk_SB_MT64x128x8_SE_EPS0_FL0_GRVW2_LPB0_PGR0_PLR1_TT4_8_USFGRO0_VW2_WGM8
    SolutionIndex: 21
    SolutionNameMin: Cijk_Ailk_Bljk_SB_MT64x128x8_SE_EPS0_FL0_GRVW4_LPB0_PGR0_PLR0_TT4_8_USFGRO0_VW2_WGM1
    SolutionIndex: 22
    SolutionNameMin: Cijk_Ailk_Bljk_SB_MT64x128x8_SE_EPS1_FL0_GRVW4_LPB0_PGR1_PLR0_TT4_8_USFGRO0_VW2_WGM1
    SolutionIndex: 23
    SolutionNameMin: Cijk_Ailk_Bljk_SB_MT64x128x8_SE_EPS1_FL0_GRVW4_LPB0_PGR1_PLR0_TT4_8_USFGRO0_VW2_WGM8
    SolutionIndex: 24
    SolutionNameMin: Cijk_Ailk_Bljk_SB_MT64x128x8_SE_EPS0_FL0_GRVW4_LPB0_PGR0_PLR1_TT4_8_USFGRO0_VW2_WGM1
    SolutionIndex: 25
    SolutionNameMin: Cijk_Ailk_Bljk_SB_MT64x128x8_SE_EPS1_FL0_GRVW4_LPB0_PGR1_PLR1_TT4_8_USFGRO0_VW2_WGM8
    SolutionIndex: 26
    SolutionNameMin: Cijk_Ailk_Bljk_SB_MT64x128x8_SE_EPS1_FL1_GRVW2_LPB0_PGR1_PLR0_TT4_8_USFGRO0_VW2_WGM1
    SolutionIndex: 27
    SolutionNameMin: Cijk_Ailk_Bljk_SB_MT64x128x8_SE_EPS0_FL1_GRVW4_LPB0_PGR0_PLR0_TT4_8_USFGRO0_VW2_WGM1
    SolutionIndex: 28
    SolutionNameMin: Cijk_Ailk_Bljk_SB_MT64x128x8_SE_EPS1_FL1_GRVW4_LPB0_PGR1_PLR0_TT4_8_USFGRO0_VW2_WGM1
    SolutionIndex: 29
    SolutionNameMin: Cijk_Ailk_Bljk_SB_MT64x128x8_SE_EPS1_FL1_GRVW4_LPB0_PGR1_PLR0_TT4_8_USFGRO0_VW2_WGM8
    SolutionIndex: 30
    SolutionNameMin: Cijk_Ailk_Bljk_SB_MT64x128x8_SE_EPS1_FL1_GRVW4_LPB0_PGR1_PLR1_TT4_8_USFGRO0_VW2_WGM1
    SolutionIndex: 31
    SolutionNameMin: Cijk_Ailk_Bljk_SB_MT64x128x8_SE_EPS1_FL1_GRVW4_LPB0_PGR1_PLR1_TT4_8_USFGRO0_VW2_WGM8
    SolutionIndex: 32
    SolutionNameMin: Cijk_Ailk_Bljk_SB_MT128x64x8_SE_EPS0_FL0_GRVW1_LPB0_PGR0_PLR0_TT8_4_USFGRO1_VW2_WGM1
    SolutionIndex: 33
    SolutionNameMin: Cijk_Ailk_Bljk_SB_MT128x64x8_SE_EPS1_FL0_GRVW2_LPB0_PGR1_PLR0_TT8_4_USFGRO0_VW2_WGM1
    SolutionIndex: 34
    SolutionNameMin: Cijk_Ailk_Bljk_SB_MT128x64x8_SE_EPS1_FL0_GRVW2_LPB0_PGR1_PLR0_TT8_4_USFGRO0_VW2_WGM8
    SolutionIndex: 35
    SolutionNameMin: Cijk_Ailk_Bljk_SB_MT128x64x8_SE_EPS0_FL0_GRVW2_LPB0_PGR0_PLR1_TT8_4_USFGRO0_VW2_WGM1
    SolutionIndex: 36
    SolutionNameMin: Cijk_Ailk_Bljk_SB_MT128x64x8_SE_EPS1_FL0_GRVW2_LPB0_PGR1_PLR1_TT8_4_USFGRO0_VW2_WGM8
    SolutionIndex: 37
    SolutionNameMin: Cijk_Ailk_Bljk_SB_MT128x64x8_SE_EPS1_FL0_GRVW4_LPB0_PGR1_PLR0_TT8_4_USFGRO0_VW4_WGM8
    SolutionIndex: 38
    SolutionNameMin: Cijk_Ailk_Bljk_SB_MT128x64x8_SE_EPS1_FL0_GRVW4_LPB0_PGR1_PLR1_TT8_4_USFGRO0_VW4_WGM8
    SolutionIndex: 39
    SolutionNameMin: Cijk_Ailk_Bljk_SB_MT128x64x16_SE_EPS1_FL0_GRVW4_LPB0_PGR1_PLR1_TT8_4_USFGRO0_VW4_WGM1
    SolutionIndex: 40
    SolutionNameMin: Cijk_Ailk_Bljk_SB_MT128x64x16_SE_EPS1_FL0_GRVW4_LPB0_PGR1_PLR1_TT8_4_USFGRO0_VW4_WGM8
    SolutionIndex: 41
    SolutionNameMin: Cijk_Ailk_Bljk_SB_MT128x64x32_SE_EPS1_FL0_GRVW4_LPB0_PGR1_PLR1_TT8_4_USFGRO0_VW4_WGM8
    SolutionIndex: 42
    SolutionNameMin: Cijk_Ailk_Bljk_SB_MT128x64x8_SE_EPS1_FL1_GRVW2_LPB0_PGR1_PLR0_TT8_4_USFGRO0_VW2_WGM8
    SolutionIndex: 43
    SolutionNameMin: Cijk_Ailk_Bljk_SB_MT128x64x8_SE_EPS0_FL1_GRVW2_LPB0_PGR0_PLR1_TT8_4_USFGRO0_VW2_WGM1
    SolutionIndex: 44
    SolutionNameMin: Cijk_Ailk_Bljk_SB_MT128x64x8_SE_EPS1_FL1_GRVW2_LPB0_PGR1_PLR1_TT8_4_USFGRO0_VW2_WGM8
    SolutionIndex: 45
    SolutionNameMin: Cijk_Ailk_Bljk_SB_MT128x64x8_SE_EPS1_FL1_GRVW4_LPB0_PGR1_PLR0_TT8_4_USFGRO0_VW4_WGM8
    SolutionIndex: 46
    SolutionNameMin: Cijk_Ailk_Bljk_SB_MT128x64x16_SE_EPS1_FL1_GRVW4_LPB0_PGR1_PLR0_TT8_4_USFGRO0_VW4_WGM1
    SolutionIndex: 47
    SolutionNameMin: Cijk_Ailk_Bljk_SB_MT128x64x16_SE_EPS1_FL1_GRVW4_LPB0_PGR1_PLR0_TT8_4_USFGRO0_VW4_WGM8
    SolutionIndex: 48
    SolutionNameMin: Cijk_Ailk_Bljk_SB_MT128x64x8_SE_EPS1_FL1_GRVW4_LPB0_PGR1_PLR1_TT8_4_USFGRO0_VW4_WGM8
    SolutionIndex: 49
    SolutionNameMin: Cijk_Ailk_Bljk_SB_MT128x64x16_SE_EPS1_FL1_GRVW4_LPB0_PGR1_PLR1_TT8_4_USFGRO0_VW4_WGM1
    SolutionIndex: 50
    SolutionNameMin: Cijk_Ailk_Bljk_SB_MT128x64x16_SE_EPS1_FL1_GRVW4_LPB0_PGR1_PLR1_TT8_4_USFGRO0_VW4_WGM8
    SolutionIndex: 51
    SolutionNameMin: Cijk_Ailk_Bljk_SB_MT32x64x32_SE_EPS1_FL0_GRVW4_LPB4_PGR1_PLR1_TT4_4_USFGRO0_VW4_WGM8
    SolutionIndex: 52
    SolutionNameMin: Cijk_Ailk_Bljk_SB_MT64x32x32_SE_EPS1_FL0_GRVW4_LPB0_PGR1_PLR1_TT4_4_USFGRO0_VW4_WGM8
    SolutionIndex: 53
    SolutionNameMin: Cijk_Ailk_Bljk_SB_MT64x32x32_SE_EPS1_FL0_GRVW4_LPB4_PGR1_PLR1_TT4_4_USFGRO0_VW4_WGM8
    SolutionIndex: 54
    SolutionNameMin: Cijk_Ailk_Bljk_SB_MT64x32x32_SE_EPS1_FL1_GRVW2_LPB2_PGR1_PLR1_TT4_4_USFGRO0_VW2_WGM8
    SolutionIndex: 55
    SolutionNameMin: Cijk_Ailk_Bljk_SB_MT64x32x32_SE_EPS1_FL1_GRVW4_LPB0_PGR1_PLR1_TT4_4_USFGRO0_VW4_WGM8
    SolutionIndex: 56
    SolutionNameMin: Cijk_Ailk_Bljk_SB_MT64x32x16_SE_EPS1_FL1_GRVW4_LPB4_PGR1_PLR1_TT4_4_USFGRO0_VW4_WGM8
    SolutionIndex: 57
    SolutionNameMin: Cijk_Ailk_Bljk_SB_MT64x32x32_SE_EPS1_FL1_GRVW4_LPB4_PGR1_PLR1_TT4_4_USFGRO0_VW4_WGM8
    SolutionIndex: 58
    SolutionNameMin: Cijk_Ailk_Bljk_SB_MT16x32x32_SE_EPS1_FL0_GRVW2_LPB2_PGR1_PLR1_TT4_2_USFGRO0_VW2_WGM8
    SolutionIndex: 59
    SolutionNameMin: Cijk_Ailk_Bljk_SB_MT16x32x32_SE_EPS1_FL0_GRVW4_LPB2_PGR1_PLR1_TT4_2_USFGRO0_VW2_WGM8
    SolutionIndex: 60
    SolutionNameMin: Cijk_Ailk_Bljk_SB_MT32x16x32_SE_EPS1_FL0_GRVW2_LPB2_PGR1_PLR1_TT2_4_USFGRO0_VW2_WGM8
    SolutionIndex: 61
    SolutionNameMin: Cijk_Ailk_Bljk_SB_MT32x16x32_SE_EPS1_FL1_GRVW2_LPB2_PGR1_PLR0_TT2_4_USFGRO0_VW2_WGM8
    SolutionIndex: 62
    SolutionNameMin: Cijk_Ailk_Bljk_SB_MT32x16x32_SE_EPS1_FL1_GRVW2_LPB2_PGR1_PLR1_TT2_4_USFGRO0_VW2_WGM8
    SolutionIndex: 63
    SolutionNameMin: Cijk_Ailk_Bljk_SB_MT64x16x16_SE_EPS1_FL0_GRVW4_LPB0_PGR1_PLR1_TT4_4_USFGRO0_VW4_WGM8
    SolutionIndex: 64
    SolutionNameMin: Cijk_Ailk_Bljk_SB_MT64x16x16_SE_EPS1_FL0_GRVW4_LPB4_PGR1_PLR1_TT4_4_USFGRO0_VW4_WGM8
    SolutionIndex: 65
    SolutionNameMin: Cijk_Ailk_Bljk_SB_MT64x16x32_SE_EPS1_FL0_GRVW4_LPB4_PGR1_PLR1_TT4_4_USFGRO0_VW4_WGM8
    SolutionIndex: 66
    SolutionNameMin: Cijk_Ailk_Bljk_SB_MT64x16x32_SE_EPS1_FL1_GRVW4_LPB4_PGR1_PLR1_TT4_4_USFGRO0_VW4_WGM8
    SolutionIndex: 67
    SolutionNameMin: Cijk_Ailk_Bljk_SB_MT64x128x8_SE_EPS0_FL0_GRVW1_LPB2_PGR0_PLR0_TT4_8_USFGRO1_VW2_WGM1
    SolutionIndex: 68
    SolutionNameMin: Cijk_Ailk_Bljk_SB_MT64x128x8_SE_EPS0_FL0_GRVW1_LPB2_PGR0_PLR0_TT4_8_USFGRO1_VW2_WGM8
    SolutionIndex: 69
    SolutionNameMin: Cijk_Ailk_Bljk_SB_MT64x128x16_SE_EPS0_FL0_GRVW1_LPB2_PGR0_PLR0_TT4_8_USFGRO1_VW2_WGM1
    SolutionIndex: 70
    SolutionNameMin: Cijk_Ailk_Bljk_SB_MT64x128x16_SE_EPS0_FL0_GRVW1_LPB2_PGR0_PLR0_TT4_8_USFGRO1_VW2_WGM8
    SolutionIndex: 71
    SolutionNameMin: Cijk_Ailk_Bljk_SB_MT64x128x8_SE_EPS0_FL0_GRVW1_LPB2_PGR0_PLR1_TT4_8_USFGRO1_VW2_WGM1
    SolutionIndex: 72
    SolutionNameMin: Cijk_Ailk_Bljk_SB_MT64x128x8_SE_EPS1_FL0_GRVW1_LPB2_PGR1_PLR1_TT4_8_USFGRO1_VW2_WGM1
    SolutionIndex: 73
    SolutionNameMin: Cijk_Ailk_Bljk_SB_MT64x128x16_SE_EPS0_FL0_GRVW1_LPB2_PGR0_PLR1_TT4_8_USFGRO1_VW2_WGM8
    SolutionIndex: 74
    SolutionNameMin: Cijk_Ailk_Bljk_SB_MT64x128x32_SE_EPS0_FL0_GRVW1_LPB2_PGR0_PLR1_TT4_8_USFGRO1_VW2_WGM1
    SolutionIndex: 75
    SolutionNameMin: Cijk_Ailk_Bljk_SB_MT64x128x8_SE_EPS1_FL0_GRVW1_LPB4_PGR1_PLR1_TT4_8_USFGRO1_VW4_WGM8
    SolutionIndex: 76
    SolutionNameMin: Cijk_Ailk_Bljk_SB_MT64x128x32_SE_EPS0_FL0_GRVW1_LPB4_PGR0_PLR1_TT4_8_USFGRO1_VW4_WGM1
    SolutionIndex: 77
    SolutionNameMin: Cijk_Ailk_Bljk_SB_MT64x128x8_SE_EPS1_FL0_GRVW2_LPB2_PGR1_PLR1_TT4_8_USFGRO0_VW2_WGM1
    SolutionIndex: 78
    SolutionNameMin: Cijk_Ailk_Bljk_SB_MT64x128x8_SE_EPS0_FL0_GRVW2_LPB2_PGR0_PLR1_TT4_8_USFGRO0_VW2_WGM8
    SolutionIndex: 79
    SolutionNameMin: Cijk_Ailk_Bljk_SB_MT64x128x8_SE_EPS1_FL0_GRVW2_LPB2_PGR1_PLR1_TT4_8_USFGRO0_VW2_WGM8
    SolutionIndex: 80
    SolutionNameMin: Cijk_Ailk_Bljk_SB_MT64x128x8_SE_EPS1_FL0_GRVW4_LPB2_PGR1_PLR0_TT4_8_USFGRO0_VW2_WGM1
    SolutionIndex: 81
    SolutionNameMin: Cijk_Ailk_Bljk_SB_MT64x128x8_SE_EPS1_FL0_GRVW4_LPB2_PGR1_PLR1_TT4_8_USFGRO0_VW2_WGM1
    SolutionIndex: 82
    SolutionNameMin: Cijk_Ailk_Bljk_SB_MT64x128x8_SE_EPS1_FL0_GRVW4_LPB2_PGR1_PLR1_TT4_8_USFGRO0_VW2_WGM8
    SolutionIndex: 83
    SolutionNameMin: Cijk_Ailk_Bljk_SB_MT64x128x8_SE_EPS0_FL1_GRVW2_LPB2_PGR0_PLR1_TT4_8_USFGRO0_VW2_WGM1
    SolutionIndex: 84
    SolutionNameMin: Cijk_Ailk_Bljk_SB_MT64x128x8_SE_EPS1_FL1_GRVW4_LPB2_PGR1_PLR0_TT4_8_USFGRO0_VW2_WGM1
    SolutionIndex: 85
    SolutionNameMin: Cijk_Ailk_Bljk_SB_MT64x128x8_SE_EPS1_FL1_GRVW4_LPB2_PGR1_PLR1_TT4_8_USFGRO0_VW2_WGM8
    SolutionIndex: 86
    SolutionNameMin: Cijk_Ailk_Bljk_SB_MT128x64x8_SE_EPS0_FL0_GRVW1_LPB2_PGR0_PLR0_TT8_4_USFGRO1_VW2_WGM8
    SolutionIndex: 87
    SolutionNameMin: Cijk_Ailk_Bljk_SB_MT128x64x16_SE_EPS0_FL0_GRVW1_LPB2_PGR0_PLR0_TT8_4_USFGRO1_VW2_WGM1
    SolutionIndex: 88
    SolutionNameMin: Cijk_Ailk_Bljk_SB_MT128x64x32_SE_EPS0_FL0_GRVW1_LPB2_PGR0_PLR0_TT8_4_USFGRO1_VW2_WGM8
    SolutionIndex: 89
    SolutionNameMin: Cijk_Ailk_Bljk_SB_MT128x64x8_SE_EPS0_FL0_GRVW1_LPB2_PGR0_PLR1_TT8_4_USFGRO1_VW2_WGM1
    SolutionIndex: 90
    SolutionNameMin: Cijk_Ailk_Bljk_SB_MT128x64x8_SE_EPS1_FL0_GRVW1_LPB2_PGR1_PLR1_TT8_4_USFGRO1_VW2_WGM1
    SolutionIndex: 91
    SolutionNameMin: Cijk_Ailk_Bljk_SB_MT128x64x8_SE_EPS0_FL0_GRVW1_LPB2_PGR0_PLR1_TT8_4_USFGRO1_VW2_WGM8
    SolutionIndex: 92
    SolutionNameMin: Cijk_Ailk_Bljk_SB_MT128x64x16_SE_EPS0_FL0_GRVW1_LPB2_PGR0_PLR1_TT8_4_USFGRO1_VW2_WGM8
    SolutionIndex: 93
    SolutionNameMin: Cijk_Ailk_Bljk_SB_MT128x64x8_SE_EPS0_FL0_GRVW1_LPB4_PGR0_PLR1_TT8_4_USFGRO1_VW4_WGM1
    SolutionIndex: 94
    SolutionNameMin: Cijk_Ailk_Bljk_SB_MT128x64x16_SE_EPS0_FL0_GRVW1_LPB4_PGR0_PLR1_TT8_4_USFGRO1_VW4_WGM1
    SolutionIndex: 95
    SolutionNameMin: Cijk_Ailk_Bljk_SB_MT128x64x8_SE_EPS0_FL0_GRVW2_LPB2_PGR0_PLR1_TT8_4_USFGRO0_VW2_WGM1
    SolutionIndex: 96
    SolutionNameMin: Cijk_Ailk_Bljk_SB_MT128x64x8_SE_EPS1_FL0_GRVW4_LPB4_PGR1_PLR1_TT8_4_USFGRO0_VW4_WGM1
    SolutionIndex: 97
    SolutionNameMin: Cijk_Ailk_Bljk_SB_MT128x64x16_SE_EPS0_FL0_GRVW4_LPB4_PGR0_PLR1_TT8_4_USFGRO0_VW4_WGM1
    SolutionIndex: 98
    SolutionNameMin: Cijk_Ailk_Bljk_SB_MT128x64x16_SE_EPS0_FL1_GRVW4_LPB4_PGR0_PLR1_TT8_4_USFGRO0_VW4_WGM1
- - - [512, 540, 1, 512, 512, 512, 512, 512]
    - [9, 11.371]
  - - [512, 540, 1, 2048, 512, 512, 512, 2048]
    - [5, 15.199]
  - - [512, 550, 1, 512, 512, 512, 512, 512]
    - [4, 11.611]
  - - [512, 550, 1, 2048, 512, 512, 512, 2048]
    - [9, 15.441]
  - - [512, 560, 1, 512, 512, 512, 512, 512]
    - [9, 12.099]
  - - [512, 560, 1, 2048, 512, 512, 512, 2048]
    - [5, 15.709]
  - - [512, 600, 1, 2048, 512, 512, 512, 2048]
    - [9, 16.888]
  - - [512, 644, 1, 512, 512, 512, 512, 512]
    - [9, 13.39]
  - - [512, 644, 1, 2048, 512, 512, 512, 2048]
    - [9, 17.632]
  - - [512, 668, 1, 2048, 512, 512, 512, 2048]
    - [9, 18.006]
  - - [512, 714, 1, 512, 512, 512, 512, 512]
    - [5, 15.387]
  - - [512, 714, 1, 2048, 512, 512, 512, 2048]
    - [9, 18.998]
  - - [512, 720, 1, 512, 512, 512, 512, 512]
    - [5, 15.356]
  - - [512, 720, 1, 2048, 512, 512, 512, 2048]
    - [6, 18.855]
  - - [512, 722, 1, 2048, 512, 512, 512, 2048]
    - [5, 19.227]
  - - [512, 781, 1, 512, 512, 512, 512, 512]
    - [9, 16.743]
  - - [512, 781, 1, 2048, 512, 512, 512, 2048]
    - [5, 19.978]
  - - [512, 848, 1, 2048, 512, 512, 512, 2048]
    - [6, 20.979]
  - - [512, 872, 1, 2048, 512, 512, 512, 2048]
    - [5, 20.81]
  - - [512, 936, 1, 512, 512, 512, 512, 512]
    - [9, 19.659]
  - - [512, 936, 1, 2048, 512, 512, 512, 2048]
    - [5, 21.048]
  - - [512, 980, 1, 512, 512, 512, 512, 512]
    - [5, 17.181]
  - - [512, 980, 1, 2048, 512, 512, 512, 2048]
    - [5, 18.959]
  - - [512, 1139, 1, 2048, 512, 512, 512, 2048]
    - [5, 20.807]
  - - [512, 1184, 1, 2048, 512, 512, 512, 2048]
    - [5, 22.23]
  - - [512, 1186, 1, 2048, 512, 512, 512, 2048]
    - [5, 20.971]
  - - [512, 1232, 1, 512, 512, 512, 512, 512]
    - [2, 21.284]
  - - [512, 1232, 1, 2048, 512, 512, 512, 2048]
    - [9, 23.237]
  - - [512, 1279, 1, 2048, 512, 512, 512, 2048]
    - [9, 21.578]
  - - [512, 1290, 1, 512, 512, 512, 512, 512]
    - [5, 22.379]
  - - [512, 1290, 1, 2048, 512, 512, 512, 2048]
    - [9, 22.994]
  - - [512, 1327, 1, 2048, 512, 512, 512, 2048]
    - [6, 23.07]
  - - [512, 1331, 1, 2048, 512, 512, 512, 2048]
    - [6, 23.006]
  - - [512, 1341, 1, 2048, 512, 512, 512, 2048]
    - [10, 22.904]
  - - [512, 1350, 1, 512, 512, 512, 512, 512]
    - [9, 23.469]
  - - [512, 1350, 1, 2048, 512, 512, 512, 2048]
    - [6, 22.729]
  - - [512, 1359, 1, 2048, 512, 512, 512, 2048]
    - [6, 23.188]
  - - [512, 1391, 1, 2048, 512, 512, 512, 2048]
    - [6, 23.721]
  - - [512, 1424, 1, 512, 512, 512, 512, 512]
    - [9, 24.448]
  - - [512, 1424, 1, 2048, 512, 512, 512, 2048]
    - [9, 24.012]
  - - [512, 1458, 1, 512, 512, 512, 512, 512]
    - [0, 24.774]
  - - [512, 1458, 1, 2048, 512, 512, 512, 2048]
    - [5, 24.106]
  - - [512, 1462, 1, 512, 512, 512, 512, 512]
    - [5, 24.945]
  - - [512, 1462, 1, 2048, 512, 512, 512, 2048]
    - [5, 23.898]
  - - [512, 1467, 1, 2048, 512, 512, 512, 2048]
    - [9, 24.438]
  - - [512, 1472, 1, 2048, 512, 512, 512, 2048]
    - [9, 24.522]
  - - [512, 1520, 1, 512, 512, 512, 512, 512]
    - [0, 25.828]
  - - [512, 1520, 1, 2048, 512, 512, 512, 2048]
    - [5, 23.902]
  - - [512, 1596, 1, 512, 512, 512, 512, 512]
    - [9, 26.789]
  - - [512, 1596, 1, 2048, 512, 512, 512, 2048]
    - [41, 23.959]
  - - [512, 1599, 1, 512, 512, 512, 512, 512]
    - [2, 26.84]
  - - [512, 1599, 1, 2048, 512, 512, 512, 2048]
    - [9, 24.606]
  - - [512, 1615, 1, 512, 512, 512, 512, 512]
    - [9, 27.901]
  - - [512, 1615, 1, 2048, 512, 512, 512, 2048]
    - [9, 24.841]
  - - [512, 1680, 1, 512, 512, 512, 512, 512]
    - [5, 28.488]
  - - [512, 1680, 1, 2048, 512, 512, 512, 2048]
    - [9, 25.323]
  - - [512, 1709, 1, 2048, 512, 512, 512, 2048]
    - [9, 26.299]
  - - [512, 1890, 1, 512, 512, 512, 512, 512]
    - [9, 31.596]
  - - [512, 1902, 1, 2048, 512, 512, 512, 2048]
    - [50, 27.686]
  - - [512, 1917, 1, 512, 512, 512, 512, 512]
    - [7, 31.727]
  - - [512, 1917, 1, 2048, 512, 512, 512, 2048]
    - [41, 27.222]
  - - [512, 2076, 1, 2048, 512, 512, 512, 2048]
    - [16, 24.256]
  - - [512, 2195, 1, 2048, 512, 512, 512, 2048]
    - [11, 25.21]
  - - [512, 2205, 1, 512, 512, 512, 512, 512]
    - [12, 28.466]
  - - [512, 2205, 1, 2048, 512, 512, 512, 2048]
    - [13, 25.047]
  - - [512, 2387, 1, 512, 512, 512, 512, 512]
    - [12, 30.111]
  - - [512, 2418, 1, 512, 512, 512, 512, 512]
    - [18, 30.642]
  - - [512, 2418, 1, 2048, 512, 512, 512, 2048]
    - [3, 26.573]
  - - [512, 2496, 1, 512, 512, 512, 512, 512]
    - [18, 31.679]
  - - [512, 2496, 1, 2048, 512, 512, 512, 2048]
    - [50, 26.591]
  - - [512, 2790, 1, 2048, 512, 512, 512, 2048]
    - [50, 28.797]
  - - [512, 2864, 1, 2048, 512, 512, 512, 2048]
    - [40, 29.116]
  - - [512, 3092, 1, 2048, 512, 512, 512, 2048]
    - [50, 30.497]
  - - [512, 3113, 1, 2048, 512, 512, 512, 2048]
    - [40, 29.998]
  - - [512, 3137, 1, 2048, 512, 512, 512, 2048]
    - [50, 29.651]
  - - [512, 3165, 1, 2048, 512, 512, 512, 2048]
    - [40, 30.209]
  - - [512, 3166, 1, 2048, 512, 512, 512, 2048]
    - [50, 29.495]
  - - [512, 3194, 1, 2048, 512, 512, 512, 2048]
    - [50, 30.044]
  - - [512, 3219, 1, 2048, 512, 512, 512, 2048]
    - [49, 29.647]
  - - [512, 3222, 1, 2048, 512, 512, 512, 2048]
    - [39, 30.187]
  - - [512, 3234, 1, 2048, 512, 512, 512, 2048]
    - [40, 29.86]
  - - [512, 3237, 1, 2048, 512, 512, 512, 2048]
    - [40, 31.311]
  - - [512, 3242, 1, 2048, 512, 512, 512, 2048]
    - [49, 30.212]
  - - [512, 3246, 1, 2048, 512, 512, 512, 2048]
    - [49, 30.326]
  - - [512, 3249, 1, 2048, 512, 512, 512, 2048]
    - [49, 30.371]
  - - [512, 3251, 1, 2048, 512, 512, 512, 2048]
    - [40, 30.632]
  - - [512, 3257, 1, 2048, 512, 512, 512, 2048]
    - [50, 30.558]
  - - [512, 3262, 1, 2048, 512, 512, 512, 2048]
    - [49, 30.501]
  - - [512, 3268, 1, 2048, 512, 512, 512, 2048]
    - [40, 30.609]
  - - [512, 3282, 1, 2048, 512, 512, 512, 2048]
    - [40, 30.49]
  - - [512, 3286, 1, 2048, 512, 512, 512, 2048]
    - [40, 31.4]
  - - [512, 3287, 1, 2048, 512, 512, 512, 2048]
    - [50, 31.158]
  - - [512, 3293, 1, 2048, 512, 512, 512, 2048]
    - [40, 30.73]
  - - [512, 3297, 1, 2048, 512, 512, 512, 2048]
    - [39, 30.527]
  - - [512, 3307, 1, 2048, 512, 512, 512, 2048]
    - [50, 30.619]
  - - [512, 3314, 1, 2048, 512, 512, 512, 2048]
    - [40, 30.831]
  - - [512, 3315, 1, 2048, 512, 512, 512, 2048]
    - [47, 30.421]
  - - [512, 3319, 1, 2048, 512, 512, 512, 2048]
    - [50, 31.149]
  - - [512, 3322, 1, 2048, 512, 512, 512, 2048]
    - [49, 30.511]
  - - [512, 3323, 1, 2048, 512, 512, 512, 2048]
    - [47, 30.152]
  - - [512, 3324, 1, 2048, 512, 512, 512, 2048]
    - [50, 30.046]
  - - [512, 3325, 1, 2048, 512, 512, 512, 2048]
    - [40, 31.5]
  - - [512, 3327, 1, 2048, 512, 512, 512, 2048]
    - [40, 29.724]
  - - [512, 3329, 1, 2048, 512, 512, 512, 2048]
    - [50, 30.223]
  - - [512, 3332, 1, 2048, 512, 512, 512, 2048]
    - [40, 31.226]
  - - [512, 3336, 1, 2048, 512, 512, 512, 2048]
    - [40, 31.149]
  - - [512, 3339, 1, 2048, 512, 512, 512, 2048]
    - [50, 30.641]
  - - [512, 3342, 1, 2048, 512, 512, 512, 2048]
    - [40, 31.347]
  - - [512, 3344, 1, 2048, 512, 512, 512, 2048]
    - [40, 32.019]
  - - [512, 3358, 1, 2048, 512, 512, 512, 2048]
    - [50, 30.287]
  - - [512, 3360, 1, 2048, 512, 512, 512, 2048]
    - [49, 31.822]
  - - [512, 3364, 1, 2048, 512, 512, 512, 2048]
    - [49, 30.267]
  - - [512, 3365, 1, 2048, 512, 512, 512, 2048]
    - [40, 31.509]
  - - [512, 3369, 1, 2048, 512, 512, 512, 2048]
    - [39, 31.003]
  - - [512, 3370, 1, 2048, 512, 512, 512, 2048]
    - [50, 30.713]
  - - [512, 3371, 1, 2048, 512, 512, 512, 2048]
    - [39, 30.371]
  - - [512, 3374, 1, 2048, 512, 512, 512, 2048]
    - [50, 32.092]
  - - [512, 3376, 1, 2048, 512, 512, 512, 2048]
    - [50, 31.249]
  - - [512, 3377, 1, 2048, 512, 512, 512, 2048]
    - [49, 31.32]
  - - [512, 3378, 1, 2048, 512, 512, 512, 2048]
    - [40, 31.094]
  - - [512, 3381, 1, 2048, 512, 512, 512, 2048]
    - [40, 30.214]
  - - [512, 3382, 1, 2048, 512, 512, 512, 2048]
    - [49, 31.894]
  - - [512, 3383, 1, 2048, 512, 512, 512, 2048]
    - [40, 31.473]
  - - [512, 3384, 1, 2048, 512, 512, 512, 2048]
    - [49, 30.389]
  - - [512, 3385, 1, 2048, 512, 512, 512, 2048]
    - [50, 31.254]
  - - [512, 3386, 1, 2048, 512, 512, 512, 2048]
    - [39, 30.169]
  - - [512, 3388, 1, 2048, 512, 512, 512, 2048]
    - [40, 31.378]
  - - [512, 3390, 1, 2048, 512, 512, 512, 2048]
    - [49, 31.396]
  - - [512, 3391, 1, 2048, 512, 512, 512, 2048]
    - [40, 31.144]
  - - [512, 3396, 1, 2048, 512, 512, 512, 2048]
    - [40, 30.857]
  - - [512, 3399, 1, 2048, 512, 512, 512, 2048]
    - [40, 30.342]
  - - [512, 3402, 1, 2048, 512, 512, 512, 2048]
    - [39, 30.312]
  - - [512, 3410, 1, 2048, 512, 512, 512, 2048]
    - [50, 30.188]
  - - [512, 3412, 1, 2048, 512, 512, 512, 2048]
    - [50, 30.516]
  - - [512, 3414, 1, 2048, 512, 512, 512, 2048]
    - [40, 31.654]
  - - [512, 3415, 1, 2048, 512, 512, 512, 2048]
    - [50, 30.551]
  - - [512, 3418, 1, 2048, 512, 512, 512, 2048]
    - [50, 30.586]
  - - [512, 3420, 1, 2048, 512, 512, 512, 2048]
    - [39, 30.956]
  - - [512, 3422, 1, 2048, 512, 512, 512, 2048]
    - [50, 30.822]
  - - [512, 3425, 1, 2048, 512, 512, 512, 2048]
    - [39, 31.052]
  - - [512, 3426, 1, 2048, 512, 512, 512, 2048]
    - [50, 30.485]
  - - [512, 3427, 1, 2048, 512, 512, 512, 2048]
    - [49, 31.475]
  - - [512, 3428, 1, 2048, 512, 512, 512, 2048]
    - [50, 30.994]
  - - [512, 3430, 1, 2048, 512, 512, 512, 2048]
    - [50, 30.43]
  - - [512, 3431, 1, 2048, 512, 512, 512, 2048]
    - [39, 31.013]
  - - [512, 3432, 1, 2048, 512, 512, 512, 2048]
    - [40, 31.098]
  - - [512, 3433, 1, 2048, 512, 512, 512, 2048]
    - [39, 31.443]
  - - [512, 3438, 1, 2048, 512, 512, 512, 2048]
    - [40, 31.042]
  - - [512, 3439, 1, 2048, 512, 512, 512, 2048]
    - [39, 31.144]
  - - [512, 3440, 1, 2048, 512, 512, 512, 2048]
    - [39, 30.348]
  - - [512, 3443, 1, 2048, 512, 512, 512, 2048]
    - [49, 30.978]
  - - [512, 3445, 1, 2048, 512, 512, 512, 2048]
    - [39, 31.379]
  - - [512, 3447, 1, 2048, 512, 512, 512, 2048]
    - [50, 30.177]
  - - [512, 3448, 1, 2048, 512, 512, 512, 2048]
    - [39, 31.175]
  - - [512, 3450, 1, 2048, 512, 512, 512, 2048]
    - [50, 30.453]
  - - [512, 3451, 1, 2048, 512, 512, 512, 2048]
    - [39, 31.117]
  - - [512, 3452, 1, 2048, 512, 512, 512, 2048]
    - [39, 31.521]
  - - [512, 3453, 1, 2048, 512, 512, 512, 2048]
    - [39, 31.212]
  - - [512, 3455, 1, 2048, 512, 512, 512, 2048]
    - [50, 31.847]
  - - [512, 3456, 1, 2048, 512, 512, 512, 2048]
    - [39, 30.16]
  - - [512, 3457, 1, 2048, 512, 512, 512, 2048]
    - [50, 30.794]
  - - [512, 3458, 1, 2048, 512, 512, 512, 2048]
    - [46, 30.41]
  - - [512, 3459, 1, 2048, 512, 512, 512, 2048]
    - [39, 31.498]
  - - [512, 3460, 1, 2048, 512, 512, 512, 2048]
    - [50, 30.779]
  - - [512, 3461, 1, 2048, 512, 512, 512, 2048]
    - [40, 31.37]
  - - [512, 3462, 1, 2048, 512, 512, 512, 2048]
    - [39, 29.96]
  - - [512, 3466, 1, 2048, 512, 512, 512, 2048]
    - [39, 30.199]
  - - [512, 3467, 1, 2048, 512, 512, 512, 2048]
    - [40, 31.117]
  - - [512, 3468, 1, 2048, 512, 512, 512, 2048]
    - [49, 30.385]
  - - [512, 3470, 1, 2048, 512, 512, 512, 2048]
    - [49, 31.102]
  - - [512, 3471, 1, 2048, 512, 512, 512, 2048]
    - [50, 30.251]
  - - [512, 3472, 1, 2048, 512, 512, 512, 2048]
    - [49, 31.375]
  - - [512, 3475, 1, 2048, 512, 512, 512, 2048]
    - [49, 30.714]
  - - [512, 3476, 1, 2048, 512, 512, 512, 2048]
    - [49, 31.978]
  - - [512, 3477, 1, 2048, 512, 512, 512, 2048]
    - [39, 30.79]
  - - [512, 3478, 1, 2048, 512, 512, 512, 2048]
    - [39, 30.897]
  - - [512, 3479, 1, 2048, 512, 512, 512, 2048]
    - [39, 31.395]
  - - [512, 3480, 1, 2048, 512, 512, 512, 2048]
    - [39, 31.768]
  - - [512, 3481, 1, 2048, 512, 512, 512, 2048]
    - [49, 31.534]
  - - [512, 3483, 1, 2048, 512, 512, 512, 2048]
    - [49, 31.151]
  - - [512, 3484, 1, 2048, 512, 512, 512, 2048]
    - [39, 30.695]
  - - [512, 3487, 1, 2048, 512, 512, 512, 2048]
    - [49, 31.382]
  - - [512, 3489, 1, 2048, 512, 512, 512, 2048]
    - [49, 30.28]
  - - [512, 3490, 1, 2048, 512, 512, 512, 2048]
    - [39, 30.971]
  - - [512, 3491, 1, 2048, 512, 512, 512, 2048]
    - [49, 31.948]
  - - [512, 3493, 1, 2048, 512, 512, 512, 2048]
    - [39, 31.41]
  - - [512, 3494, 1, 2048, 512, 512, 512, 2048]
    - [49, 31.808]
  - - [512, 3495, 1, 2048, 512, 512, 512, 2048]
    - [50, 30.46]
  - - [512, 3497, 1, 2048, 512, 512, 512, 2048]
    - [50, 30.373]
  - - [512, 3498, 1, 2048, 512, 512, 512, 2048]
    - [40, 31.025]
  - - [512, 3499, 1, 2048, 512, 512, 512, 2048]
    - [39, 31.092]
  - - [512, 3501, 1, 2048, 512, 512, 512, 2048]
    - [49, 31.38]
  - - [512, 3503, 1, 2048, 512, 512, 512, 2048]
    - [40, 30.498]
  - - [512, 3505, 1, 2048, 512, 512, 512, 2048]
    - [39, 31.314]
  - - [512, 3507, 1, 2048, 512, 512, 512, 2048]
    - [46, 30.468]
  - - [512, 3508, 1, 2048, 512, 512, 512, 2048]
    - [40, 30.89]
  - - [512, 3509, 1, 2048, 512, 512, 512, 2048]
    - [39, 31.031]
  - - [512, 3510, 1, 2048, 512, 512, 512, 2048]
    - [39, 31.249]
  - - [512, 3511, 1, 2048, 512, 512, 512, 2048]
    - [40, 30.95]
  - - [512, 3513, 1, 2048, 512, 512, 512, 2048]
    - [40, 30.593]
  - - [512, 3514, 1, 2048, 512, 512, 512, 2048]
    - [40, 31.001]
  - - [512, 3515, 1, 2048, 512, 512, 512, 2048]
    - [50, 31.361]
  - - [512, 3517, 1, 2048, 512, 512, 512, 2048]
    - [40, 31.421]
  - - [512, 3518, 1, 2048, 512, 512, 512, 2048]
    - [49, 31.178]
  - - [512, 3519, 1, 2048, 512, 512, 512, 2048]
    - [39, 31.254]
  - - [512, 3520, 1, 2048, 512, 512, 512, 2048]
    - [49, 31.542]
  - - [512, 3523, 1, 2048, 512, 512, 512, 2048]
    - [39, 31.289]
  - - [512, 3528, 1, 2048, 512, 512, 512, 2048]
    - [40, 31.05]
  - - [512, 3529, 1, 2048, 512, 512, 512, 2048]
    - [49, 31.267]
  - - [512, 3530, 1, 2048, 512, 512, 512, 2048]
    - [40, 31.351]
  - - [512, 3531, 1, 2048, 512, 512, 512, 2048]
    - [49, 31.135]
  - - [512, 3532, 1, 2048, 512, 512, 512, 2048]
    - [49, 30.383]
  - - [512, 3533, 1, 2048, 512, 512, 512, 2048]
    - [40, 31.437]
  - - [512, 3534, 1, 2048, 512, 512, 512, 2048]
    - [49, 31.582]
  - - [512, 3538, 1, 2048, 512, 512, 512, 2048]
    - [39, 31.815]
  - - [512, 3539, 1, 2048, 512, 512, 512, 2048]
    - [50, 31.431]
  - - [512, 3540, 1, 2048, 512, 512, 512, 2048]
    - [50, 31.222]
  - - [512, 3541, 1, 2048, 512, 512, 512, 2048]
    - [39, 31.008]
  - - [512, 3547, 1, 2048, 512, 512, 512, 2048]
    - [49, 31.309]
  - - [512, 3548, 1, 2048, 512, 512, 512, 2048]
    - [40, 31.259]
  - - [512, 3552, 1, 2048, 512, 512, 512, 2048]
    - [39, 31.785]
  - - [512, 3564, 1, 2048, 512, 512, 512, 2048]
    - [49, 31.442]
  - - [512, 3575, 1, 2048, 512, 512, 512, 2048]
    - [49, 31.256]
  - - [512, 3598, 1, 2048, 512, 512, 512, 2048]
    - [40, 31.474]
  - - [512, 3599, 1, 2048, 512, 512, 512, 2048]
    - [39, 31.391]
  - - [512, 3608, 1, 2048, 512, 512, 512, 2048]
    - [49, 31.133]
  - - [512, 3776, 1, 512, 512, 512, 512, 512]
    - [31, 37.556]
  - - [512, 3776, 1, 2048, 512, 512, 512, 2048]
    - [47, 31.27]
  - - [512, 3780, 1, 512, 512, 512, 512, 512]
    - [25, 37.687]
  - - [512, 3780, 1, 2048, 512, 512, 512, 2048]
    - [40, 31.596]
  - - [512, 3780, 1, 33708, 512, 512, 512, 33708]
    - [40, 45.475]
  - - [512, 3796, 1, 512, 512, 512, 512, 512]
    - [25, 37.665]
  - - [512, 3796, 1, 2048, 512, 512, 512, 2048]
    - [39, 31.794]
  - - [512, 3796, 1, 33708, 512, 512, 512, 33708]
    - [39, 45.711]
  - - [512, 3822, 1, 512, 512, 512, 512, 512]
    - [31, 37.832]
  - - [512, 3822, 1, 2048, 512, 512, 512, 2048]
    - [50, 31.307]
  - - [512, 3822, 1, 33708, 512, 512, 512, 33708]
    - [39, 45.894]
  - - [512, 3835, 1, 512, 512, 512, 512, 512]
    - [31, 37.38]
  - - [512, 3835, 1, 2048, 512, 512, 512, 2048]
    - [39, 32.827]
  - - [512, 3840, 1, 512, 512, 512, 512, 512]
    - [31, 38.193]
  - - [512, 3840, 1, 2048, 512, 512, 512, 2048]
    - [40, 31.627]
  - - [512, 3840, 1, 33708, 512, 512, 512, 33708]
    - [39, 45.749]
  - - [512, 3859, 1, 512, 512, 512, 512, 512]
    - [18, 34.862]
  - - [512, 3859, 1, 2048, 512, 512, 512, 2048]
    - [6, 27.04]
  - - [512, 3859, 1, 33708, 512, 512, 512, 33708]
    - [14, 30.467]
  - - [512, 3864, 1, 512, 512, 512, 512, 512]
    - [18, 34.643]
  - - [512, 3864, 1, 2048, 512, 512, 512, 2048]
    - [10, 26.978]
  - - [512, 3870, 1, 512, 512, 512, 512, 512]
    - [18, 35.742]
  - - [512, 3870, 1, 2048, 512, 512, 512, 2048]
    - [6, 27.209]
  - - [512, 3870, 1, 33708, 512, 512, 512, 33708]
    - [15, 30.607]
  - - [512, 3876, 1, 512, 512, 512, 512, 512]
    - [18, 35.286]
  - - [512, 3876, 1, 2048, 512, 512, 512, 2048]
    - [6, 27.176]
  - - [512, 3876, 1, 33708, 512, 512, 512, 33708]
    - [14, 30.617]
  - - [512, 3906, 1, 512, 512, 512, 512, 512]
    - [18, 35.248]
  - - [512, 3906, 1, 2048, 512, 512, 512, 2048]
    - [6, 26.953]
  - - [512, 3906, 1, 33708, 512, 512, 512, 33708]
    - [15, 30.917]
  - - [512, 3910, 1, 512, 512, 512, 512, 512]
    - [18, 35.478]
  - - [512, 3910, 1, 2048, 512, 512, 512, 2048]
    - [10, 27.071]
  - - [512, 3910, 1, 33708, 512, 512, 512, 33708]
    - [15, 30.875]
  - - [512, 3925, 1, 512, 512, 512, 512, 512]
    - [18, 35.969]
  - - [512, 3925, 1, 2048, 512, 512, 512, 2048]
    - [6, 26.876]
  - - [512, 3925, 1, 33708, 512, 512, 512, 33708]
    - [15, 31.006]
  - - [512, 3927, 1, 512, 512, 512, 512, 512]
    - [18, 35.361]
  - - [512, 3942, 1, 512, 512, 512, 512, 512]
    - [18, 35.965]
  - - [512, 3942, 1, 2048, 512, 512, 512, 2048]
    - [6, 27.745]
  - - [512, 3942, 1, 33708, 512, 512, 512, 33708]
    - [15, 31.061]
  - - [512, 3944, 1, 512, 512, 512, 512, 512]
    - [18, 35.984]
  - - [512, 3944, 1, 2048, 512, 512, 512, 2048]
    - [10, 27.369]
  - - [512, 3944, 1, 33708, 512, 512, 512, 33708]
    - [14, 31.123]
  - - [512, 3955, 1, 512, 512, 512, 512, 512]
    - [18, 35.497]
  - - [512, 3955, 1, 2048, 512, 512, 512, 2048]
    - [1, 27.388]
  - - [512, 3955, 1, 33708, 512, 512, 512, 33708]
    - [14, 31.282]
  - - [512, 3968, 1, 512, 512, 512, 512, 512]
    - [18, 35.847]
  - - [512, 3968, 1, 2048, 512, 512, 512, 2048]
    - [10, 27.692]
  - - [512, 3968, 1, 33708, 512, 512, 512, 33708]
    - [15, 31.41]
  - - [512, 3969, 1, 512, 512, 512, 512, 512]
    - [18, 36.412]
  - - [512, 3969, 1, 2048, 512, 512, 512, 2048]
    - [6, 27.172]
  - - [512, 3969, 1, 33708, 512, 512, 512, 33708]
    - [15, 31.361]
  - - [512, 3976, 1, 512, 512, 512, 512, 512]
    - [18, 36.196]
  - - [512, 3976, 1, 2048, 512, 512, 512, 2048]
    - [10, 27.203]
  - - [512, 3976, 1, 33708, 512, 512, 512, 33708]
    - [15, 31.403]
  - - [512, 3977, 1, 512, 512, 512, 512, 512]
    - [18, 36.325]
  - - [512, 3977, 1, 2048, 512, 512, 512, 2048]
    - [10, 27.408]
  - - [512, 3977, 1, 33708, 512, 512, 512, 33708]
    - [14, 31.471]
  - - [512, 3978, 1, 512, 512, 512, 512, 512]
    - [18, 35.434]
  - - [512, 3978, 1, 2048, 512, 512, 512, 2048]
    - [10, 27.341]
  - - [512, 3978, 1, 33708, 512, 512, 512, 33708]
    - [15, 31.443]
  - - [512, 3990, 1, 512, 512, 512, 512, 512]
    - [18, 36.403]
  - - [512, 3990, 1, 2048, 512, 512, 512, 2048]
    - [10, 27.192]
  - - [512, 3990, 1, 33708, 512, 512, 512, 33708]
    - [14, 31.485]
  - - [512, 3995, 1, 512, 512, 512, 512, 512]
    - [18, 35.433]
  - - [512, 3995, 1, 2048, 512, 512, 512, 2048]
    - [10, 27.356]
  - - [512, 3995, 1, 33708, 512, 512, 512, 33708]
    - [14, 31.539]
  - - [512, 3996, 1, 512, 512, 512, 512, 512]
    - [18, 35.366]
  - - [512, 3996, 1, 2048, 512, 512, 512, 2048]
    - [10, 27.132]
  - - [512, 3996, 1, 33708, 512, 512, 512, 33708]
    - [15, 31.609]
  - - [512, 3999, 1, 512, 512, 512, 512, 512]
    - [18, 35.431]
  - - [512, 3999, 1, 2048, 512, 512, 512, 2048]
    - [6, 27.338]
  - - [512, 3999, 1, 33708, 512, 512, 512, 33708]
    - [14, 31.57]
  - - [512, 4005, 1, 512, 512, 512, 512, 512]
    - [18, 35.446]
  - - [512, 4005, 1, 2048, 512, 512, 512, 2048]
    - [6, 27.099]
  - - [512, 4005, 1, 33708, 512, 512, 512, 33708]
    - [14, 31.524]
  - - [512, 4012, 1, 512, 512, 512, 512, 512]
    - [18, 35.622]
  - - [512, 4012, 1, 2048, 512, 512, 512, 2048]
    - [40, 27.119]
  - - [512, 4012, 1, 33708, 512, 512, 512, 33708]
    - [15, 31.715]
  - - [512, 4020, 1, 512, 512, 512, 512, 512]
    - [18, 36.596]
  - - [512, 4020, 1, 2048, 512, 512, 512, 2048]
    - [6, 27.212]
  - - [512, 4020, 1, 33708, 512, 512, 512, 33708]
    - [15, 31.757]
  - - [512, 4026, 1, 512, 512, 512, 512, 512]
    - [18, 35.518]
  - - [512, 4026, 1, 2048, 512, 512, 512, 2048]
    - [8, 27.398]
  - - [512, 4026, 1, 33708, 512, 512, 512, 33708]
    - [14, 31.807]
  - - [512, 4030, 1, 512, 512, 512, 512, 512]
    - [18, 36.567]
  - - [512, 4030, 1, 2048, 512, 512, 512, 2048]
    - [6, 27.369]
  - - [512, 4030, 1, 33708, 512, 512, 512, 33708]
    - [14, 31.801]
  - - [512, 4032, 1, 512, 512, 512, 512, 512]
    - [18, 35.647]
  - - [512, 4032, 1, 2048, 512, 512, 512, 2048]
    - [10, 27.753]
  - - [512, 4032, 1, 33708, 512, 512, 512, 33708]
    - [15, 31.862]
  - - [512, 4050, 1, 512, 512, 512, 512, 512]
    - [18, 36.829]
  - - [512, 4059, 1, 512, 512, 512, 512, 512]
    - [18, 36.789]
  - - [2048, 160, 1, 512, 2048, 2048, 2048, 512]
    - [5, 13.756]
  - - [2048, 174, 1, 512, 2048, 2048, 2048, 512]
    - [5, 14.882]
  - - [2048, 184, 1, 512, 2048, 2048, 2048, 512]
    - [5, 15.497]
  - - [2048, 189, 1, 512, 2048, 2048, 2048, 512]
    - [4, 16.082]
  - - [2048, 198, 1, 512, 2048, 2048, 2048, 512]
    - [9, 13.945]
  - - [2048, 207, 1, 512, 2048, 2048, 2048, 512]
    - [5, 14.578]
  - - [2048, 208, 1, 512, 2048, 2048, 2048, 512]
    - [5, 14.711]
  - - [2048, 245, 1, 512, 2048, 2048, 2048, 512]
    - [4, 17.001]
  - - [2048, 246, 1, 512, 2048, 2048, 2048, 512]
    - [5, 16.72]
  - - [2048, 264, 1, 512, 2048, 2048, 2048, 512]
    - [9, 18.553]
  - - [2048, 401, 1, 512, 2048, 2048, 2048, 512]
    - [5, 27.653]
  - - [2048, 439, 1, 512, 2048, 2048, 2048, 512]
    - [5, 29.062]
  - - [2048, 443, 1, 512, 2048, 2048, 2048, 512]
    - [9, 28.865]
  - - [2048, 446, 1, 512, 2048, 2048, 2048, 512]
    - [5, 29.644]
  - - [2048, 465, 1, 512, 2048, 2048, 2048, 512]
    - [12, 24.906]
  - - [2048, 468, 1, 512, 2048, 2048, 2048, 512]
    - [12, 24.746]
  - - [2048, 493, 1, 512, 2048, 2048, 2048, 512]
    - [12, 26.027]
  - - [2048, 495, 1, 512, 2048, 2048, 2048, 512]
    - [12, 25.803]
  - - [2048, 511, 1, 512, 2048, 2048, 2048, 512]
    - [12, 26.553]
  - - [2048, 512, 1, 512, 2048, 2048, 2048, 512]
    - [12, 27.335]
  - - [2048, 540, 1, 512, 2048, 2048, 2048, 512]
    - [12, 28.104]
  - - [2048, 550, 1, 512, 2048, 2048, 2048, 512]
    - [12, 28.943]
  - - [2048, 560, 1, 512, 2048, 2048, 2048, 512]
    - [12, 29.099]
  - - [2048, 600, 1, 512, 2048, 2048, 2048, 512]
    - [12, 31.032]
  - - [2048, 644, 1, 512, 2048, 2048, 2048, 512]
    - [18, 31.487]
  - - [2048, 668, 1, 512, 2048, 2048, 2048, 512]
    - [18, 32.374]
  - - [2048, 714, 1, 512, 2048, 2048, 2048, 512]
    - [48, 30.3]
  - - [2048, 720, 1, 512, 2048, 2048, 2048, 512]
    - [36, 30.321]
  - - [2048, 722, 1, 512, 2048, 2048, 2048, 512]
    - [38, 30.522]
  - - [2048, 781, 1, 512, 2048, 2048, 2048, 512]
    - [38, 33.101]
  - - [2048, 848, 1, 512, 2048, 2048, 2048, 512]
    - [38, 35.486]
  - - [2048, 872, 1, 512, 2048, 2048, 2048, 512]
    - [36, 36.307]
  - - [2048, 936, 1, 512, 2048, 2048, 2048, 512]
    - [44, 38.108]
  - - [2048, 980, 1, 512, 2048, 2048, 2048, 512]
    - [12, 35.963]
  - - [2048, 1139, 1, 512, 2048, 2048, 2048, 512]
    - [9, 34.909]
  - - [2048, 1184, 1, 512, 2048, 2048, 2048, 512]
    - [36, 35.371]
  - - [2048, 1186, 1, 512, 2048, 2048, 2048, 512]
    - [48, 35.527]
  - - [2048, 1232, 1, 512, 2048, 2048, 2048, 512]
    - [38, 36.905]
  - - [2048, 1279, 1, 512, 2048, 2048, 2048, 512]
    - [36, 37.699]
  - - [2048, 1290, 1, 512, 2048, 2048, 2048, 512]
    - [44, 38.538]
  - - [2048, 1327, 1, 512, 2048, 2048, 2048, 512]
    - [48, 39.324]
  - - [2048, 1331, 1, 512, 2048, 2048, 2048, 512]
    - [44, 39.87]
  - - [2048, 1341, 1, 512, 2048, 2048, 2048, 512]
    - [44, 39.703]
  - - [2048, 1350, 1, 512, 2048, 2048, 2048, 512]
    - [38, 40.33]
  - - [2048, 1359, 1, 512, 2048, 2048, 2048, 512]
    - [48, 40.746]
  - - [2048, 1391, 1, 512, 2048, 2048, 2048, 512]
    - [44, 41.331]
  - - [2048, 1424, 1, 512, 2048, 2048, 2048, 512]
    - [17, 37.951]
  - - [2048, 1458, 1, 512, 2048, 2048, 2048, 512]
    - [12, 33.352]
  - - [2048, 1462, 1, 512, 2048, 2048, 2048, 512]
    - [12, 33.606]
  - - [2048, 1467, 1, 512, 2048, 2048, 2048, 512]
    - [5, 33.535]
  - - [2048, 1472, 1, 512, 2048, 2048, 2048, 512]
    - [5, 34.121]
  - - [2048, 1520, 1, 512, 2048, 2048, 2048, 512]
    - [12, 34.461]
  - - [2048, 1596, 1, 512, 2048, 2048, 2048, 512]
    - [5, 36.333]
  - - [2048, 1599, 1, 512, 2048, 2048, 2048, 512]
    - [5, 36.402]
  - - [2048, 1615, 1, 512, 2048, 2048, 2048, 512]
    - [5, 36.867]
  - - [2048, 1680, 1, 512, 2048, 2048, 2048, 512]
    - [42, 37.625]
  - - [2048, 1709, 1, 512, 2048, 2048, 2048, 512]
    - [42, 37.966]
  - - [2048, 1902, 1, 512, 2048, 2048, 2048, 512]
    - [34, 42.253]
  - - [2048, 1917, 1, 512, 2048, 2048, 2048, 512]
    - [34, 42.303]
  - - [2048, 2076, 1, 512, 2048, 2048, 2048, 512]
    - [48, 38.454]
  - - [2048, 2195, 1, 512, 2048, 2048, 2048, 512]
    - [48, 40.522]
  - - [2048, 2205, 1, 512, 2048, 2048, 2048, 512]
    - [48, 40.526]
  - - [2048, 2418, 1, 512, 2048, 2048, 2048, 512]
    - [12, 39.78]
  - - [2048, 2496, 1, 512, 2048, 2048, 2048, 512]
    - [38, 39.588]
  - - [2048, 2790, 1, 512, 2048, 2048, 2048, 512]
    - [38, 43.398]
  - - [2048, 2864, 1, 512, 2048, 2048, 2048, 512]
    - [48, 44.073]
  - - [2048, 3092, 1, 512, 2048, 2048, 2048, 512]
    - [45, 41.47]
  - - [2048, 3113, 1, 512, 2048, 2048, 2048, 512]
    - [38, 41.483]
  - - [2048, 3137, 1, 512, 2048, 2048, 2048, 512]
    - [37, 42.073]
  - - [2048, 3165, 1, 512, 2048, 2048, 2048, 512]
    - [38, 42.159]
  - - [2048, 3166, 1, 512, 2048, 2048, 2048, 512]
    - [37, 42.325]
  - - [2048, 3194, 1, 512, 2048, 2048, 2048, 512]
    - [37, 42.34]
  - - [2048, 3219, 1, 512, 2048, 2048, 2048, 512]
    - [37, 42.982]
  - - [2048, 3222, 1, 512, 2048, 2048, 2048, 512]
    - [37, 42.97]
  - - [2048, 3234, 1, 512, 2048, 2048, 2048, 512]
    - [37, 42.905]
  - - [2048, 3237, 1, 512, 2048, 2048, 2048, 512]
    - [45, 42.773]
  - - [2048, 3242, 1, 512, 2048, 2048, 2048, 512]
    - [37, 43.011]
  - - [2048, 3246, 1, 512, 2048, 2048, 2048, 512]
    - [37, 42.927]
  - - [2048, 3249, 1, 512, 2048, 2048, 2048, 512]
    - [48, 43.001]
  - - [2048, 3251, 1, 512, 2048, 2048, 2048, 512]
    - [45, 43.01]
  - - [2048, 3257, 1, 512, 2048, 2048, 2048, 512]
    - [45, 43.141]
  - - [2048, 3262, 1, 512, 2048, 2048, 2048, 512]
    - [37, 43.086]
  - - [2048, 3268, 1, 512, 2048, 2048, 2048, 512]
    - [48, 43.2]
  - - [2048, 3282, 1, 512, 2048, 2048, 2048, 512]
    - [37, 43.385]
  - - [2048, 3286, 1, 512, 2048, 2048, 2048, 512]
    - [38, 43.438]
  - - [2048, 3287, 1, 512, 2048, 2048, 2048, 512]
    - [37, 43.731]
  - - [2048, 3293, 1, 512, 2048, 2048, 2048, 512]
    - [45, 43.74]
  - - [2048, 3297, 1, 512, 2048, 2048, 2048, 512]
    - [37, 43.187]
  - - [2048, 3307, 1, 512, 2048, 2048, 2048, 512]
    - [38, 43.49]
  - - [2048, 3314, 1, 512, 2048, 2048, 2048, 512]
    - [48, 43.53]
  - - [2048, 3315, 1, 512, 2048, 2048, 2048, 512]
    - [45, 43.405]
  - - [2048, 3319, 1, 512, 2048, 2048, 2048, 512]
    - [37, 43.579]
  - - [2048, 3322, 1, 512, 2048, 2048, 2048, 512]
    - [48, 43.67]
  - - [2048, 3323, 1, 512, 2048, 2048, 2048, 512]
    - [48, 43.718]
  - - [2048, 3324, 1, 512, 2048, 2048, 2048, 512]
    - [38, 43.661]
  - - [2048, 3325, 1, 512, 2048, 2048, 2048, 512]
    - [48, 43.744]
  - - [2048, 3327, 1, 512, 2048, 2048, 2048, 512]
    - [45, 43.477]
  - - [2048, 3329, 1, 512, 2048, 2048, 2048, 512]
    - [12, 40.216]
  - - [2048, 3332, 1, 512, 2048, 2048, 2048, 512]
    - [48, 39.903]
  - - [2048, 3336, 1, 512, 2048, 2048, 2048, 512]
    - [12, 40.404]
  - - [2048, 3339, 1, 512, 2048, 2048, 2048, 512]
    - [12, 40.205]
  - - [2048, 3342, 1, 512, 2048, 2048, 2048, 512]
    - [12, 39.922]
  - - [2048, 3344, 1, 512, 2048, 2048, 2048, 512]
    - [12, 40.486]
  - - [2048, 3358, 1, 512, 2048, 2048, 2048, 512]
    - [12, 40.084]
  - - [2048, 3360, 1, 512, 2048, 2048, 2048, 512]
    - [12, 40.414]
  - - [2048, 3364, 1, 512, 2048, 2048, 2048, 512]
    - [12, 40.388]
  - - [2048, 3365, 1, 512, 2048, 2048, 2048, 512]
    - [12, 40.651]
  - - [2048, 3369, 1, 512, 2048, 2048, 2048, 512]
    - [12, 40.64]
  - - [2048, 3370, 1, 512, 2048, 2048, 2048, 512]
    - [12, 40.504]
  - - [2048, 3371, 1, 512, 2048, 2048, 2048, 512]
    - [12, 40.283]
  - - [2048, 3374, 1, 512, 2048, 2048, 2048, 512]
    - [12, 40.745]
  - - [2048, 3376, 1, 512, 2048, 2048, 2048, 512]
    - [12, 40.724]
  - - [2048, 3377, 1, 512, 2048, 2048, 2048, 512]
    - [12, 40.811]
  - - [2048, 3378, 1, 512, 2048, 2048, 2048, 512]
    - [12, 40.764]
  - - [2048, 3381, 1, 512, 2048, 2048, 2048, 512]
    - [12, 40.904]
  - - [2048, 3382, 1, 512, 2048, 2048, 2048, 512]
    - [12, 40.842]
  - - [2048, 3383, 1, 512, 2048, 2048, 2048, 512]
    - [12, 40.339]
  - - [2048, 3384, 1, 512, 2048, 2048, 2048, 512]
    - [12, 40.496]
  - - [2048, 3385, 1, 512, 2048, 2048, 2048, 512]
    - [12, 40.655]
  - - [2048, 3386, 1, 512, 2048, 2048, 2048, 512]
    - [12, 40.98]
  - - [2048, 3388, 1, 512, 2048, 2048, 2048, 512]
    - [12, 40.75]
  - - [2048, 3390, 1, 512, 2048, 2048, 2048, 512]
    - [12, 40.938]
  - - [2048, 3391, 1, 512, 2048, 2048, 2048, 512]
    - [12, 40.713]
  - - [2048, 3396, 1, 512, 2048, 2048, 2048, 512]
    - [48, 40.363]
  - - [2048, 3399, 1, 512, 2048, 2048, 2048, 512]
    - [38, 40.573]
  - - [2048, 3402, 1, 512, 2048, 2048, 2048, 512]
    - [38, 40.624]
  - - [2048, 3410, 1, 512, 2048, 2048, 2048, 512]
    - [48, 40.661]
  - - [2048, 3412, 1, 512, 2048, 2048, 2048, 512]
    - [48, 40.437]
  - - [2048, 3414, 1, 512, 2048, 2048, 2048, 512]
    - [48, 40.46]
  - - [2048, 3415, 1, 512, 2048, 2048, 2048, 512]
    - [48, 40.647]
  - - [2048, 3418, 1, 512, 2048, 2048, 2048, 512]
    - [38, 40.407]
  - - [2048, 3420, 1, 512, 2048, 2048, 2048, 512]
    - [48, 40.372]
  - - [2048, 3422, 1, 512, 2048, 2048, 2048, 512]
    - [38, 40.555]
  - - [2048, 3425, 1, 512, 2048, 2048, 2048, 512]
    - [38, 40.737]
  - - [2048, 3426, 1, 512, 2048, 2048, 2048, 512]
    - [38, 40.719]
  - - [2048, 3427, 1, 512, 2048, 2048, 2048, 512]
    - [38, 40.76]
  - - [2048, 3428, 1, 512, 2048, 2048, 2048, 512]
    - [48, 40.612]
  - - [2048, 3430, 1, 512, 2048, 2048, 2048, 512]
    - [38, 40.738]
  - - [2048, 3431, 1, 512, 2048, 2048, 2048, 512]
    - [48, 40.662]
  - - [2048, 3432, 1, 512, 2048, 2048, 2048, 512]
    - [38, 40.645]
  - - [2048, 3433, 1, 512, 2048, 2048, 2048, 512]
    - [38, 40.569]
  - - [2048, 3438, 1, 512, 2048, 2048, 2048, 512]
    - [36, 40.355]
  - - [2048, 3439, 1, 512, 2048, 2048, 2048, 512]
    - [48, 40.8]
  - - [2048, 3440, 1, 512, 2048, 2048, 2048, 512]
    - [38, 40.783]
  - - [2048, 3443, 1, 512, 2048, 2048, 2048, 512]
    - [38, 40.892]
  - - [2048, 3445, 1, 512, 2048, 2048, 2048, 512]
    - [38, 40.989]
  - - [2048, 3447, 1, 512, 2048, 2048, 2048, 512]
    - [48, 40.778]
  - - [2048, 3448, 1, 512, 2048, 2048, 2048, 512]
    - [44, 40.631]
  - - [2048, 3450, 1, 512, 2048, 2048, 2048, 512]
    - [48, 40.828]
  - - [2048, 3451, 1, 512, 2048, 2048, 2048, 512]
    - [38, 40.826]
  - - [2048, 3452, 1, 512, 2048, 2048, 2048, 512]
    - [48, 40.823]
  - - [2048, 3453, 1, 512, 2048, 2048, 2048, 512]
    - [38, 40.646]
  - - [2048, 3455, 1, 512, 2048, 2048, 2048, 512]
    - [48, 40.626]
  - - [2048, 3456, 1, 512, 2048, 2048, 2048, 512]
    - [38, 41.328]
  - - [2048, 3457, 1, 512, 2048, 2048, 2048, 512]
    - [48, 41.236]
  - - [2048, 3458, 1, 512, 2048, 2048, 2048, 512]
    - [38, 41.085]
  - - [2048, 3459, 1, 512, 2048, 2048, 2048, 512]
    - [38, 41.112]
  - - [2048, 3460, 1, 512, 2048, 2048, 2048, 512]
    - [48, 41.153]
  - - [2048, 3461, 1, 512, 2048, 2048, 2048, 512]
    - [38, 41.239]
  - - [2048, 3462, 1, 512, 2048, 2048, 2048, 512]
    - [38, 41.236]
  - - [2048, 3466, 1, 512, 2048, 2048, 2048, 512]
    - [48, 41.388]
  - - [2048, 3467, 1, 512, 2048, 2048, 2048, 512]
    - [38, 40.957]
  - - [2048, 3468, 1, 512, 2048, 2048, 2048, 512]
    - [38, 41.1]
  - - [2048, 3470, 1, 512, 2048, 2048, 2048, 512]
    - [48, 41.228]
  - - [2048, 3471, 1, 512, 2048, 2048, 2048, 512]
    - [48, 41.343]
  - - [2048, 3472, 1, 512, 2048, 2048, 2048, 512]
    - [48, 41.34]
  - - [2048, 3475, 1, 512, 2048, 2048, 2048, 512]
    - [38, 41.302]
  - - [2048, 3476, 1, 512, 2048, 2048, 2048, 512]
    - [38, 41.225]
  - - [2048, 3477, 1, 512, 2048, 2048, 2048, 512]
    - [38, 41.192]
  - - [2048, 3478, 1, 512, 2048, 2048, 2048, 512]
    - [38, 41.131]
  - - [2048, 3479, 1, 512, 2048, 2048, 2048, 512]
    - [38, 41.201]
  - - [2048, 3480, 1, 512, 2048, 2048, 2048, 512]
    - [48, 41.257]
  - - [2048, 3481, 1, 512, 2048, 2048, 2048, 512]
    - [38, 41.24]
  - - [2048, 3483, 1, 512, 2048, 2048, 2048, 512]
    - [38, 41.412]
  - - [2048, 3484, 1, 512, 2048, 2048, 2048, 512]
    - [38, 41.29]
  - - [2048, 3487, 1, 512, 2048, 2048, 2048, 512]
    - [38, 41.193]
  - - [2048, 3489, 1, 512, 2048, 2048, 2048, 512]
    - [38, 41.216]
  - - [2048, 3490, 1, 512, 2048, 2048, 2048, 512]
    - [38, 41.243]
  - - [2048, 3491, 1, 512, 2048, 2048, 2048, 512]
    - [38, 41.05]
  - - [2048, 3493, 1, 512, 2048, 2048, 2048, 512]
    - [38, 41.264]
  - - [2048, 3494, 1, 512, 2048, 2048, 2048, 512]
    - [38, 41.394]
  - - [2048, 3495, 1, 512, 2048, 2048, 2048, 512]
    - [48, 41.391]
  - - [2048, 3497, 1, 512, 2048, 2048, 2048, 512]
    - [48, 41.459]
  - - [2048, 3498, 1, 512, 2048, 2048, 2048, 512]
    - [38, 41.338]
  - - [2048, 3499, 1, 512, 2048, 2048, 2048, 512]
    - [48, 41.527]
  - - [2048, 3501, 1, 512, 2048, 2048, 2048, 512]
    - [48, 41.255]
  - - [2048, 3503, 1, 512, 2048, 2048, 2048, 512]
    - [38, 41.456]
  - - [2048, 3505, 1, 512, 2048, 2048, 2048, 512]
    - [48, 41.346]
  - - [2048, 3507, 1, 512, 2048, 2048, 2048, 512]
    - [38, 41.503]
  - - [2048, 3508, 1, 512, 2048, 2048, 2048, 512]
    - [48, 41.323]
  - - [2048, 3509, 1, 512, 2048, 2048, 2048, 512]
    - [38, 41.379]
  - - [2048, 3510, 1, 512, 2048, 2048, 2048, 512]
    - [48, 41.346]
  - - [2048, 3511, 1, 512, 2048, 2048, 2048, 512]
    - [48, 41.491]
  - - [2048, 3513, 1, 512, 2048, 2048, 2048, 512]
    - [38, 41.544]
  - - [2048, 3514, 1, 512, 2048, 2048, 2048, 512]
    - [38, 41.423]
  - - [2048, 3515, 1, 512, 2048, 2048, 2048, 512]
    - [48, 41.509]
  - - [2048, 3517, 1, 512, 2048, 2048, 2048, 512]
    - [38, 41.429]
  - - [2048, 3518, 1, 512, 2048, 2048, 2048, 512]
    - [38, 41.529]
  - - [2048, 3519, 1, 512, 2048, 2048, 2048, 512]
    - [38, 41.379]
  - - [2048, 3520, 1, 512, 2048, 2048, 2048, 512]
    - [48, 41.912]
  - - [2048, 3523, 1, 512, 2048, 2048, 2048, 512]
    - [48, 41.782]
  - - [2048, 3528, 1, 512, 2048, 2048, 2048, 512]
    - [48, 41.767]
  - - [2048, 3529, 1, 512, 2048, 2048, 2048, 512]
    - [48, 41.959]
  - - [2048, 3530, 1, 512, 2048, 2048, 2048, 512]
    - [48, 41.925]
  - - [2048, 3531, 1, 512, 2048, 2048, 2048, 512]
    - [38, 41.802]
  - - [2048, 3532, 1, 512, 2048, 2048, 2048, 512]
    - [38, 41.799]
  - - [2048, 3533, 1, 512, 2048, 2048, 2048, 512]
    - [48, 41.811]
  - - [2048, 3534, 1, 512, 2048, 2048, 2048, 512]
    - [38, 41.703]
  - - [2048, 3538, 1, 512, 2048, 2048, 2048, 512]
    - [48, 41.855]
  - - [2048, 3539, 1, 512, 2048, 2048, 2048, 512]
    - [38, 41.837]
  - - [2048, 3540, 1, 512, 2048, 2048, 2048, 512]
    - [38, 41.744]
  - - [2048, 3541, 1, 512, 2048, 2048, 2048, 512]
    - [38, 41.846]
  - - [2048, 3547, 1, 512, 2048, 2048, 2048, 512]
    - [48, 41.708]
  - - [2048, 3548, 1, 512, 2048, 2048, 2048, 512]
    - [48, 41.928]
  - - [2048, 3552, 1, 512, 2048, 2048, 2048, 512]
    - [48, 41.826]
  - - [2048, 3564, 1, 512, 2048, 2048, 2048, 512]
    - [38, 41.789]
  - - [2048, 3575, 1, 512, 2048, 2048, 2048, 512]
    - [44, 41.594]
  - - [2048, 3598, 1, 512, 2048, 2048, 2048, 512]
    - [48, 42.443]
  - - [2048, 3599, 1, 512, 2048, 2048, 2048, 512]
    - [38, 42.501]
  - - [2048, 3608, 1, 512, 2048, 2048, 2048, 512]
    - [38, 42.425]
  - - [2048, 3776, 1, 512, 2048, 2048, 2048, 512]
    - [48, 43.733]
  - - [2048, 3780, 1, 512, 2048, 2048, 2048, 512]
    - [38, 43.887]
  - - [2048, 3796, 1, 512, 2048, 2048, 2048, 512]
    - [48, 44.15]
  - - [2048, 3822, 1, 512, 2048, 2048, 2048, 512]
    - [38, 44.096]
  - - [2048, 3835, 1, 512, 2048, 2048, 2048, 512]
    - [38, 44.323]
  - - [2048, 3840, 1, 512, 2048, 2048, 2048, 512]
    - [38, 44.646]
  - - [2048, 3859, 1, 512, 2048, 2048, 2048, 512]
    - [48, 41.165]
  - - [2048, 3864, 1, 512, 2048, 2048, 2048, 512]
    - [38, 41.192]
  - - [2048, 3870, 1, 512, 2048, 2048, 2048, 512]
    - [48, 41.349]
  - - [2048, 3876, 1, 512, 2048, 2048, 2048, 512]
    - [38, 41.44]
  - - [2048, 3906, 1, 512, 2048, 2048, 2048, 512]
    - [48, 41.842]
  - - [2048, 3910, 1, 512, 2048, 2048, 2048, 512]
    - [48, 41.75]
  - - [2048, 3925, 1, 512, 2048, 2048, 2048, 512]
    - [38, 41.721]
  - - [2048, 3942, 1, 512, 2048, 2048, 2048, 512]
    - [48, 42.024]
  - - [2048, 3944, 1, 512, 2048, 2048, 2048, 512]
    - [38, 41.843]
  - - [2048, 3955, 1, 512, 2048, 2048, 2048, 512]
    - [38, 42.108]
  - - [2048, 3968, 1, 512, 2048, 2048, 2048, 512]
    - [38, 42.479]
  - - [2048, 3969, 1, 512, 2048, 2048, 2048, 512]
    - [38, 42.284]
  - - [2048, 3976, 1, 512, 2048, 2048, 2048, 512]
    - [48, 42.372]
  - - [2048, 3977, 1, 512, 2048, 2048, 2048, 512]
    - [38, 42.356]
  - - [2048, 3978, 1, 512, 2048, 2048, 2048, 512]
    - [48, 42.462]
  - - [2048, 3990, 1, 512, 2048, 2048, 2048, 512]
    - [48, 42.344]
  - - [2048, 3995, 1, 512, 2048, 2048, 2048, 512]
    - [48, 42.438]
  - - [2048, 3996, 1, 512, 2048, 2048, 2048, 512]
    - [48, 42.327]
  - - [2048, 3999, 1, 512, 2048, 2048, 2048, 512]
    - [48, 42.481]
  - - [2048, 4005, 1, 512, 2048, 2048, 2048, 512]
    - [38, 42.668]
  - - [2048, 4012, 1, 512, 2048, 2048, 2048, 512]
    - [48, 42.199]
  - - [2048, 4020, 1, 512, 2048, 2048, 2048, 512]
    - [48, 42.377]
  - - [2048, 4026, 1, 512, 2048, 2048, 2048, 512]
    - [48, 42.306]
  - - [2048, 4030, 1, 512, 2048, 2048, 2048, 512]
    - [48, 42.564]
  - - [2048, 4032, 1, 512, 2048, 2048, 2048, 512]
    - [38, 42.955]
  - - [512, 160, 1, 2048, 512, 512, 512, 2048]
    - [62, 11.463]
  - - [512, 174, 1, 2048, 512, 512, 512, 2048]
    - [65, 13.001]
  - - [512, 182, 1, 512, 512, 512, 512, 512]
    - [60, 9.908]
  - - [512, 184, 1, 512, 512, 512, 512, 512]
    - [62, 10.288]
  - - [512, 184, 1, 2048, 512, 512, 512, 2048]
    - [61, 13.356]
  - - [512, 189, 1, 512, 512, 512, 512, 512]
    - [62, 10.427]
  - - [512, 189, 1, 2048, 512, 512, 512, 2048]
    - [60, 13.964]
  - - [512, 198, 1, 2048, 512, 512, 512, 2048]
    - [65, 14.155]
  - - [512, 206, 1, 512, 512, 512, 512, 512]
    - [62, 11.142]
  - - [512, 207, 1, 2048, 512, 512, 512, 2048]
    - [65, 14.304]
  - - [512, 208, 1, 512, 512, 512, 512, 512]
    - [59, 11.177]
  - - [512, 208, 1, 2048, 512, 512, 512, 2048]
    - [65, 14.434]
  - - [512, 224, 1, 512, 512, 512, 512, 512]
    - [58, 11.882]
  - - [512, 245, 1, 2048, 512, 512, 512, 2048]
    - [65, 14.278]
  - - [512, 246, 1, 512, 512, 512, 512, 512]
    - [64, 11.124]
  - - [512, 246, 1, 2048, 512, 512, 512, 2048]
    - [65, 14.386]
  - - [512, 264, 1, 512, 512, 512, 512, 512]
    - [64, 11.809]
  - - [512, 264, 1, 2048, 512, 512, 512, 2048]
    - [65, 15.412]
  - - [512, 401, 1, 2048, 512, 512, 512, 2048]
    - [57, 19.723]
  - - [512, 439, 1, 2048, 512, 512, 512, 2048]
    - [51, 20.524]
  - - [512, 443, 1, 2048, 512, 512, 512, 2048]
    - [55, 20.509]
  - - [512, 446, 1, 2048, 512, 512, 512, 2048]
    - [53, 21.0]
  - - [512, 455, 1, 512, 512, 512, 512, 512]
    - [66, 18.457]
  - - [512, 465, 1, 512, 512, 512, 512, 512]
    - [63, 18.862]
  - - [512, 465, 1, 2048, 512, 512, 512, 2048]
    - [52, 21.377]
  - - [512, 468, 1, 512, 512, 512, 512, 512]
    - [64, 18.8]
  - - [512, 468, 1, 2048, 512, 512, 512, 2048]
    - [54, 21.456]
  - - [512, 476, 1, 512, 512, 512, 512, 512]
    - [65, 19.121]
  - - [512, 493, 1, 512, 512, 512, 512, 512]
    - [64, 16.999]
  - - [512, 493, 1, 2048, 512, 512, 512, 2048]
    - [57, 18.112]
  - - [512, 495, 1, 2048, 512, 512, 512, 2048]
    - [64, 19.008]
  - - [512, 511, 1, 2048, 512, 512, 512, 2048]
    - [56, 19.265]
  - - [512, 512, 1, 2048, 512, 512, 512, 2048]
    - [56, 19.128]
  - - [64, 7, 736, 7, 64, 64, 64, 7]
    - [67, 0.37]
  - - [64, 8, 264, 8, 64, 64, 64, 8]
    - [69, 0.299]
  - - [64, 9, 416, 9, 64, 64, 64, 9]
    - [69, 0.54]
  - - [64, 10, 448, 10, 64, 64, 64, 10]
    - [92, 0.702]
  - - [64, 11, 568, 11, 64, 64, 64, 11]
    - [87, 0.862]
  - - [64, 12, 480, 12, 64, 64, 64, 12]
    - [92, 1.005]
  - - [64, 12, 2520, 12, 64, 64, 64, 12]
    - [68, 1.429]
  - - [64, 13, 576, 13, 64, 64, 64, 13]
    - [70, 1.124]
  - - [64, 13, 2336, 13, 64, 64, 64, 13]
    - [69, 1.641]
  - - [64, 14, 704, 14, 64, 64, 64, 14]
    - [68, 1.401]
  - - [64, 14, 2184, 14, 64, 64, 64, 14]
    - [87, 1.783]
  - - [64, 15, 688, 15, 64, 64, 64, 15]
    - [67, 1.541]
  - - [64, 15, 2048, 15, 64, 64, 64, 15]
    - [32, 1.944]
  - - [64, 16, 712, 16, 64, 64, 64, 16]
    - [27, 1.762]
  - - [64, 16, 1920, 16, 64, 64, 64, 16]
    - [21, 2.099]
  - - [64, 17, 688, 17, 64, 64, 64, 17]
    - [86, 1.886]
  - - [64, 17, 1816, 17, 64, 64, 64, 17]
    - [19, 2.383]
  - - [64, 18, 648, 18, 64, 64, 64, 18]
    - [67, 1.937]
  - - [64, 18, 1720, 18, 64, 64, 64, 18]
    - [67, 2.513]
  - - [64, 19, 680, 19, 64, 64, 64, 19]
    - [71, 2.234]
  - - [64, 19, 1632, 19, 64, 64, 64, 19]
    - [68, 2.775]
  - - [64, 21, 1472, 21, 64, 64, 64, 21]
    - [32, 3.057]
  - - [64, 21, 1488, 21, 64, 64, 64, 21]
    - [71, 3.048]
  - - [64, 23, 64, 23, 64, 64, 64, 23]
    - [76, 0.605]
  - - [64, 23, 1360, 23, 64, 64, 64, 23]
    - [89, 3.511]
  - - [64, 25, 176, 25, 64, 64, 64, 25]
    - [74, 1.61]
  - - [64, 25, 1256, 25, 64, 64, 64, 25]
    - [89, 3.878]
  - - [64, 26, 56, 26, 64, 64, 64, 26]
    - [76, 0.665]
  - - [64, 27, 56, 26, 64, 64, 64, 26]
    - [78, 0.802]
  - - [64, 27, 56, 27, 64, 64, 64, 27]
    - [20, 0.817]
  - - [64, 27, 1168, 27, 64, 64, 64, 27]
    - [71, 4.196]
  - - [64, 29, 136, 29, 64, 64, 64, 29]
    - [88, 1.662]
  - - [64, 29, 1088, 29, 64, 64, 64, 29]
    - [71, 4.542]
  - - [64, 32, 624, 32, 64, 64, 64, 32]
    - [35, 4.421]
  - - [64, 32, 992, 32, 64, 64, 64, 32]
    - [83, 5.03]
  - - [64, 35, 384, 35, 64, 64, 64, 35]
    - [43, 4.34]
  - - [64, 35, 904, 35, 64, 64, 64, 35]
    - [91, 5.621]
  - - [64, 38, 320, 38, 64, 64, 64, 38]
    - [71, 4.888]
  - - [64, 38, 840, 38, 64, 64, 64, 38]
    - [67, 6.483]
  - - [64, 41, 312, 41, 64, 64, 64, 41]
    - [90, 5.194]
  - - [64, 41, 776, 41, 64, 64, 64, 41]
    - [71, 6.827]
  - - [64, 45, 392, 45, 64, 64, 64, 45]
    - [73, 6.339]
  - - [64, 45, 712, 45, 64, 64, 64, 45]
    - [95, 7.665]
  - - [64, 49, 160, 49, 64, 64, 64, 49]
    - [71, 4.264]
  - - [64, 49, 648, 49, 64, 64, 64, 49]
    - [33, 7.958]
  - - [64, 54, 200, 54, 64, 64, 64, 54]
    - [24, 5.833]
  - - [64, 54, 592, 54, 64, 64, 64, 54]
    - [90, 8.966]
  - - [64, 59, 512, 59, 64, 64, 64, 59]
    - [85, 9.07]
  - - [64, 59, 544, 59, 64, 64, 64, 59]
    - [90, 9.517]
  - - [64, 64, 496, 64, 64, 64, 64, 64]
    - [30, 9.867]
  - - [64, 65, 472, 65, 64, 64, 64, 65]
    - [22, 11.577]
  - - [64, 65, 496, 64, 64, 64, 64, 64]
    - [82, 9.832]
  - - [64, 65, 496, 65, 64, 64, 64, 65]
    - [82, 10.129]
  - - [64, 70, 216, 70, 64, 64, 64, 70]
    - [71, 8.873]
  - - [64, 71, 216, 70, 64, 64, 64, 70]
    - [71, 8.962]
  - - [64, 71, 216, 71, 64, 64, 64, 71]
    - [83, 9.016]
  - - [64, 71, 448, 71, 64, 64, 64, 71]
    - [83, 12.432]
  - - [64, 77, 248, 77, 64, 64, 64, 77]
    - [84, 10.07]
  - - [64, 77, 408, 77, 64, 64, 64, 77]
    - [22, 12.929]
  - - [64, 78, 248, 77, 64, 64, 64, 77]
    - [72, 10.377]
  - - [64, 78, 248, 78, 64, 64, 64, 78]
    - [22, 10.195]
  - - [64, 78, 408, 77, 64, 64, 64, 77]
    - [23, 13.028]
  - - [64, 78, 408, 78, 64, 64, 64, 78]
    - [29, 13.128]
  - - [64, 80, 152, 80, 64, 64, 64, 80]
    - [30, 8.155]
  - - [64, 84, 152, 80, 64, 64, 64, 80]
    - [81, 8.457]
  - - [64, 84, 152, 84, 64, 64, 64, 84]
    - [77, 8.531]
  - - [64, 85, 376, 85, 64, 64, 64, 85]
    - [28, 13.721]
  - - [64, 91, 40, 91, 64, 64, 64, 91]
    - [71, 3.297]
  - - [64, 93, 40, 91, 64, 64, 64, 91]
    - [71, 3.42]
  - - [64, 93, 40, 93, 64, 64, 64, 93]
    - [71, 3.443]
  - - [64, 93, 344, 93, 64, 64, 64, 93]
    - [30, 16.29]
  - - [64, 102, 56, 102, 64, 64, 64, 102]
    - [30, 5.278]
  - - [64, 102, 312, 102, 64, 64, 64, 102]
    - [81, 17.395]
  - - [64, 103, 16, 103, 64, 64, 64, 103]
    - [93, 1.618]
  - - [64, 104, 16, 103, 64, 64, 64, 103]
    - [94, 1.626]
  - - [64, 104, 16, 104, 64, 64, 64, 104]
    - [96, 1.681]
  - - [64, 112, 16, 112, 64, 64, 64, 112]
    - [96, 1.904]
  - - [64, 112, 288, 112, 64, 64, 64, 112]
    - [26, 18.431]
  - - [64, 119, 32, 119, 64, 64, 64, 119]
    - [98, 3.879]
  - - [64, 122, 264, 122, 64, 64, 64, 122]
    - [28, 18.419]
  - - [64, 122, 264, 123, 64, 64, 64, 123]
    - [79, 18.57]
  - - [64, 123, 16, 112, 64, 64, 64, 112]
    - [97, 2.043]
  - - [64, 123, 16, 123, 64, 64, 64, 123]
    - [96, 2.136]
  - - [64, 123, 264, 123, 64, 64, 64, 123]
    - [72, 18.465]
  - - [64, 134, 240, 134, 64, 64, 64, 134]
    - [80, 17.343]
  - - [64, 134, 240, 135, 64, 64, 64, 135]
    - [80, 17.232]
  - - [64, 135, 32, 119, 64, 64, 64, 119]
    - [75, 4.657]
  - - [64, 135, 32, 135, 64, 64, 64, 135]
    - [75, 4.909]
  - - [64, 135, 240, 135, 64, 64, 64, 135]
    - [84, 17.361]
- null
