HostLibraryTests/configs/tile_aware_metric_selection/vega20_Cijk_Ailk_Bjlk_SB.yaml
- {MinimumRequiredVersion: 4.24.0}
- vega20
- gfx906
- [Device 66a0, Device 66a1, Device 66a7]
    SolutionNameMin: Cijk_Ailk_Bjlk_SB_MT128x128x16_SE_GSU1_TT8_8_WG16_16_1
    SolutionNameMin: Cijk_Ailk_Bjlk_SB_MT128x128x16_SE_GSU1_TT8_8_WG16_16_1
    SolutionNameMin: Cijk_Ailk_Bjlk_SB_MT64x64x16_SE_GSU1_TT4_4_WG16_16_1
    SolutionNameMin: Cijk_Ailk_Bjlk_SB_MT64x64x16_SE_GSU1_TT4_4_WG16_16_1
    SolutionNameMin: Cijk_Ailk_Bjlk_SB_MT64x64x16_SE_GSU1_TT4_4_WG16_16_1
    SolutionNameMin: Cijk_Ailk_Bjlk_SB_MT128x128x16_SE_GSU1_TT8_8_WG16_16_1
    SolutionNameMin: Cijk_Ailk_Bjlk_SB_MT128x128x16_SE_GSU1_TT8_8_WG16_16_1
    SolutionNameMin: Cijk_Ailk_Bjlk_SB_MT64x64x16_SE_GSU1_TT4_4_WG16_16_1
    SolutionNameMin: Cijk_Ailk_Bjlk_SB_MT128x128x16_SE_GSU1_TT8_8_WG16_16_1
    SolutionNameMin: Cijk_Ailk_Bjlk_SB_MT128x128x16_SE_GSU1_TT8_8_WG16_16_1
    SolutionNameMin: Cijk_Ailk_Bjlk_SB_MT128x128x16_SE_GSU4_TT8_8_WG16_16_1
  - - [4608, 4608, 1, 32]
    - 0
  - - [4608, 4608, 1, 64]
    - 1
  - - [4608, 4608, 1, 96]
    - 2
  - - [4608, 4608, 1, 128]
    - 3
  - - [4608, 4608, 1, 256]
    - 4
  - - [4608, 4608, 1, 512]
    - 5
  - - [4608, 4608, 1, 1024]
    - 6
  - - [4608, 4608, 1, 2048]
    - 7
  - - [4608, 4608, 1, 4096]
    - 8
  - - [4608, 4608, 1, 8192]
    - 9
  - - [4608, 4608, 1, 16192]
    - 10
  SelectionModel: TileAwareMetricSelection
  TileSelectionIndices: [0, 1, 2, 3, 4, 5, 6, 7, 8, 9, 10]
