test_dir/py38/lib/python3.6/site-packages/Tensile/Configs/miopen/archives/bert/2020-04-15/exact/arcturus_Cijk_Ailk_Bljk_SB.yaml
- {MinimumRequiredVersion: 4.17.0}
- arcturus
- gfx908
- [Device 7380, Device 7388, Device 738c, Device 7390, Device 731f]
    SolutionIndex: 0
    SolutionNameMin: Cijk_Ailk_Bljk_SB_MT64x128x32_MI32x32x1x2_SE_FL0_GRVW1_LPB1_ONLL1_PLR1_SNLL1_TT1_32_USFGRO0
    SolutionIndex: 1
    SolutionNameMin: Cijk_Ailk_Bljk_SB_MT64x128x32_MI32x32x1x2_SE_FL0_GRVW1_LPB1_ONLL0_PLR1_SNLL1_TT1_32_USFGRO1
    SolutionIndex: 2
    SolutionNameMin: Cijk_Ailk_Bljk_SB_MT64x128x32_MI32x32x1x2_SE_FL1_GRVW1_LPB1_ONLL1_PLR1_SNLL1_TT1_32_USFGRO0
    SolutionIndex: 3
    SolutionNameMin: Cijk_Ailk_Bljk_SB_MT64x128x16_MI32x32x1x2_SE_FL1_GRVW1_LPB1_ONLL0_PLR1_SNLL1_TT1_32_USFGRO1
    SolutionIndex: 4
    SolutionNameMin: Cijk_Ailk_Bljk_SB_MT64x128x32_MI32x32x1x2_SE_FL1_GRVW1_LPB1_ONLL1_PLR1_SNLL0_TT1_32_USFGRO1
    SolutionIndex: 5
    SolutionNameMin: Cijk_Ailk_Bljk_SB_MT32x128x8_MI32x32x2x1_SE_FL0_GRVW1_LPB0_ONLL0_PLR0_SNLL1_TT1_32_USFGRO0
    SolutionIndex: 6
    SolutionNameMin: Cijk_Ailk_Bljk_SB_MT32x128x16_MI32x32x2x1_SE_FL1_GRVW1_LPB1_ONLL0_PLR1_SNLL1_TT1_32_USFGRO0
    SolutionIndex: 7
    SolutionNameMin: Cijk_Ailk_Bljk_SB_MT32x128x16_MI32x32x2x1_SE_FL1_GRVW1_LPB1_ONLL0_PLR1_SNLL0_TT1_32_USFGRO0
    SolutionIndex: 8
    SolutionNameMin: Cijk_Ailk_Bljk_SB_MT256x64x8_MI16x16x1x4_SE_FL0_GRVW1_LPB1_ONLL1_PLR1_SNLL0_TT4_16_USFGRO1
    SolutionIndex: 9
    SolutionNameMin: Cijk_Ailk_Bljk_SB_MT256x64x8_MI16x16x1x4_SE_FL1_GRVW1_LPB1_ONLL0_PLR1_SNLL0_TT4_16_USFGRO0
    SolutionIndex: 10
    SolutionNameMin: Cijk_Ailk_Bljk_SB_MT64x64x16_MI16x16x4x1_SE_FL1_GRVW1_LPB0_ONLL1_PLR0_SNLL0_TT4_16_USFGRO1
    SolutionIndex: 11
    SolutionNameMin: Cijk_Ailk_Bljk_SB_MT64x64x32_MI16x16x4x1_SE_FL1_GRVW1_LPB1_ONLL0_PLR0_SNLL1_TT4_16_USFGRO1
    SolutionIndex: 12
    SolutionNameMin: Cijk_Ailk_Bljk_SB_MT64x64x16_MI16x16x4x1_SE_FL0_GRVW1_LPB1_ONLL0_PLR1_SNLL0_TT4_16_USFGRO1
    SolutionIndex: 13
    SolutionNameMin: Cijk_Ailk_Bljk_SB_MT64x64x32_MI16x16x4x1_SE_FL1_GRVW1_LPB1_ONLL1_PLR1_SNLL0_TT4_16_USFGRO1
    SolutionIndex: 14
    SolutionNameMin: Cijk_Ailk_Bljk_SB_MT32x128x8_MI16x16x4x1_SE_FL0_GRVW1_LPB0_ONLL0_PLR0_SNLL0_TT2_32_USFGRO0
- - - [1024, 32, 1, 2, 1024, 1024, 1024, 2]
    - [14, 0.033]
  - - [1024, 4096, 1, 30528, 1024, 1024, 1024, 30528]
    - [2, 71.88]
  - - [1024, 4096, 1, 1024, 1024, 1024, 1024, 1024]
    - [3, 59.49]
  - - [1024, 32, 1, 1024, 1024, 1024, 1024, 1024]
    - [7, 3.25]
  - - [4096, 4096, 1, 1024, 4096, 4096, 4096, 1024]
    - [9, 74.711]
  - - [1024, 4096, 1, 4096, 1024, 1024, 1024, 4096]
    - [4, 53.909]
  - - [1024, 4, 1, 1024, 1024, 1024, 1024, 1024]
    - [6, 0.437]
  - - [1024, 2048, 1, 1024, 1024, 1024, 1024, 1024]
    - [12, 49.265]
  - - [1024, 2048, 1, 4096, 1024, 1024, 1024, 4096]
    - [1, 49.113]
  - - [1024, 4, 1, 2, 1024, 1024, 1024, 2]
    - [5, 0.005]
  - - [4096, 2048, 1, 1024, 4096, 4096, 4096, 1024]
    - [9, 66.46]
  - - [1024, 2048, 1, 30528, 1024, 1024, 1024, 30528]
    - [0, 60.129]
  - - [128, 128, 512, 64, 128, 128, 128, 64]
    - [10, 28.628]
  - - [64, 128, 512, 128, 64, 64, 64, 128]
    - [11, 23.87]
  - - [64, 512, 64, 512, 64, 64, 64, 512]
    - [13, 28.724]
  - - [512, 512, 64, 64, 512, 512, 512, 64]
    - [8, 39.643]
- null
