Tensile/Configs/miopen/archives/bert/2019-08-26/exact/vega20_Cijk_Ailk_Bljk_SB.yaml
- {MinimumRequiredVersion: 4.9.11}
- vega20
- gfx906
- [Device 66a0, Device 66a1, Device 66a7, Vega 20]
    SolutionIndex: 0
    SolutionNameMin: Cijk_Ailk_Bljk_SB_MT64x64x8_SE_DTL0_EPS0_FL0_GRVW1_LPB0_PGR0_PLR1_TT4_4_USFGRO1_VW2_WG16_16_1_WGM1
    SolutionIndex: 1
    SolutionNameMin: Cijk_Ailk_Bljk_SB_MT64x64x8_SE_DTL0_EPS0_FL0_GRVW1_LPB0_PGR0_PLR0_TT4_4_USFGRO1_VW4_WG16_16_1_WGM1
    SolutionIndex: 2
    SolutionNameMin: Cijk_Ailk_Bljk_SB_MT64x64x16_SE_DTL0_EPS1_FL0_GRVW4_LPB0_PGR1_PLR1_TT4_4_USFGRO0_VW4_WG16_16_1_WGM1
    SolutionIndex: 3
    SolutionNameMin: Cijk_Ailk_Bljk_SB_MT64x64x16_SE_DTL0_EPS1_FL0_GRVW4_LPB0_PGR1_PLR1_TT4_4_USFGRO0_VW4_WG16_16_1_WGM8
    SolutionIndex: 4
    SolutionNameMin: Cijk_Ailk_Bljk_SB_MT64x64x8_SE_DTL0_EPS1_FL1_GRVW2_LPB0_PGR1_PLR1_TT4_4_USFGRO0_VW2_WG16_16_1_WGM1
    SolutionIndex: 5
    SolutionNameMin: Cijk_Ailk_Bljk_SB_MT64x64x16_SE_DTL0_EPS1_FL1_GRVW4_LPB0_PGR1_PLR1_TT4_4_USFGRO0_VW4_WG16_16_1_WGM1
    SolutionIndex: 6
    SolutionNameMin: Cijk_Ailk_Bljk_SB_MT96x64x16_SE_DTL0_EPS1_FL0_GRVW2_LPB0_PGR1_PLR1_TT6_4_USFGRO0_VW2_WG16_16_1_WGM8
    SolutionIndex: 7
    SolutionNameMin: Cijk_Ailk_Bljk_SB_MT96x64x8_SE_DTL0_EPS1_FL1_GRVW2_LPB0_PGR1_PLR1_TT6_4_USFGRO0_VW2_WG16_16_1_WGM8
    SolutionIndex: 8
    SolutionNameMin: Cijk_Ailk_Bljk_SB_MT128x64x8_SE_DTL0_EPS1_FL0_GRVW2_LPB0_PGR1_PLR1_TT8_4_USFGRO0_VW2_WG16_16_1_WGM8
    SolutionIndex: 9
    SolutionNameMin: Cijk_Ailk_Bljk_SB_MT128x64x8_SE_DTL0_EPS1_FL0_GRVW4_LPB0_PGR1_PLR1_TT8_4_USFGRO0_VW4_WG16_16_1_WGM1
    SolutionIndex: 10
    SolutionNameMin: Cijk_Ailk_Bljk_SB_MT128x64x8_SE_DTL0_EPS1_FL0_GRVW4_LPB0_PGR1_PLR1_TT8_4_USFGRO0_VW4_WG16_16_1_WGM8
    SolutionIndex: 11
    SolutionNameMin: Cijk_Ailk_Bljk_SB_MT128x64x16_SE_DTL0_EPS1_FL0_GRVW4_LPB0_PGR1_PLR1_TT8_4_USFGRO0_VW4_WG16_16_1_WGM1
    SolutionIndex: 12
    SolutionNameMin: Cijk_Ailk_Bljk_SB_MT128x64x8_SE_DTL0_EPS1_FL1_GRVW4_LPB0_PGR1_PLR1_TT8_4_USFGRO0_VW4_WG16_16_1_WGM1
    SolutionIndex: 13
    SolutionNameMin: Cijk_Ailk_Bljk_SB_MT128x64x8_SE_DTL0_EPS1_FL1_GRVW4_LPB0_PGR1_PLR1_TT8_4_USFGRO0_VW4_WG16_16_1_WGM8
    SolutionIndex: 14
    SolutionNameMin: Cijk_Ailk_Bljk_SB_MT32x32x8_SE_DTL0_EPS0_FL0_GRVW1_LPB0_PGR0_PLR0_TT2_2_USFGRO1_VW2_WG16_16_1_WGM8
    SolutionIndex: 15
    SolutionNameMin: Cijk_Ailk_Bljk_SB_MT64x32x8_SE_DTL0_EPS0_FL0_GRVW1_LPB2_PGR0_PLR0_TT4_2_USFGRO1_VW2_WG16_16_1_WGM1
    SolutionIndex: 16
    SolutionNameMin: Cijk_Ailk_Bljk_SB_MT32x64x16_SE_DTL0_EPS1_FL1_GRVW4_LPB2_PGR1_PLR1_TT2_4_USFGRO0_VW2_WG16_16_1_WGM8
    SolutionIndex: 17
    SolutionNameMin: Cijk_Ailk_Bljk_SB_MT64x64x16_SE_DTL0_EPS0_FL0_GRVW1_LPB2_PGR0_PLR1_TT4_4_USFGRO1_VW2_WG16_16_1_WGM1
    SolutionIndex: 18
    SolutionNameMin: Cijk_Ailk_Bljk_SB_MT64x64x16_SE_DTL0_EPS0_FL0_GRVW1_LPB4_PGR0_PLR1_TT4_4_USFGRO1_VW4_WG16_16_1_WGM1
    SolutionIndex: 19
    SolutionNameMin: Cijk_Ailk_Bljk_SB_MT64x64x32_SE_DTL0_EPS0_FL0_GRVW4_LPB4_PGR0_PLR1_TT4_4_USFGRO0_VW4_WG16_16_1_WGM8
    SolutionIndex: 20
    SolutionNameMin: Cijk_Ailk_Bljk_SB_MT64x64x16_SE_DTL0_EPS0_FL1_GRVW4_LPB4_PGR0_PLR1_TT4_4_USFGRO0_VW4_WG16_16_1_WGM1
    SolutionIndex: 21
    SolutionNameMin: Cijk_Ailk_Bljk_SB_MT32x16x16_SE_DTL0_EPS0_FL0_GRVW1_LPB0_PGR0_PLR1_TT2_2_USFGRO1_VW2_WG16_8_2_WGM8
    SolutionIndex: 22
    SolutionNameMin: Cijk_Ailk_Bljk_SB_MT64x32x16_SE_DTL0_EPS1_FL0_GRVW4_LPB4_PGR1_PLR1_TT4_4_USFGRO0_VW4_WG16_8_2_WGM1
    SolutionIndex: 23
    SolutionNameMin: Cijk_Ailk_Bljk_SB_MT64x32x16_SE_DTL0_EPS1_FL1_GRVW4_LPB4_PGR1_PLR1_TT4_4_USFGRO0_VW4_WG16_8_2_WGM8
    SolutionIndex: 24
    SolutionNameMin: Cijk_Ailk_Bljk_SB_MT8x32x32_SE_DTL0_EPS1_FL0_GRVW4_LPB2_PGR1_PLR1_TT2_2_USFGRO1_VW2_WG4_16_4_WGM1
    SolutionIndex: 25
    SolutionNameMin: Cijk_Ailk_Bljk_SB_MT32x8x32_SE_DTL0_EPS1_FL0_GRVW1_LPB2_PGR1_PLR1_TT2_2_USFGRO1_VW2_WG16_4_4_WGM1
    SolutionIndex: 26
    SolutionNameMin: Cijk_Ailk_Bljk_SB_MT32x16x32_SE_DTL0_EPS1_FL1_GRVW2_LPB2_PGR1_PLR1_TT2_4_USFGRO0_VW2_WG16_4_4_WGM1
    SolutionIndex: 27
    SolutionNameMin: Cijk_Ailk_Bljk_SB_MT64x16x32_SE_DTL0_EPS1_FL0_GRVW4_LPB4_PGR1_PLR1_TT4_4_USFGRO0_VW4_WG16_4_4_WGM1
- - - [768, 512, 1, 768, 768, 768, 768, 768]
    - [2, 5889.04]
  - - [768, 2048, 1, 3072, 768, 768, 768, 3072]
    - [12, 9394.62]
  - - [768, 32, 1, 768, 768, 768, 768, 768]
    - [24, 1502.74]
  - - [64, 128, 96, 128, 64, 64, 64, 128]
    - [19, 4973.48]
  - - [3072, 1024, 1, 768, 3072, 3072, 3072, 768]
    - [13, 9856.07]
  - - [768, 1024, 1, 3072, 768, 768, 768, 3072]
    - [6, 8611.06]
  - - [768, 512, 1, 3072, 768, 768, 768, 3072]
    - [5, 6430.79]
  - - [768, 64, 1, 768, 768, 768, 768, 768]
    - [26, 2621.44]
  - - [768, 4096, 1, 3072, 768, 768, 768, 3072]
    - [11, 10030.4]
  - - [768, 2048, 1, 2, 768, 768, 768, 2]
    - [4, 381.763]
  - - [768, 2048, 1, 768, 768, 768, 768, 768]
    - [9, 9754.2]
  - - [768, 320, 1, 30522, 768, 768, 768, 30522]
    - [22, 8529.4]
  - - [64, 64, 96, 64, 64, 64, 64, 64]
    - [16, 2496.61]
  - - [768, 640, 1, 30522, 768, 768, 768, 30522]
    - [3, 8253.84]
  - - [768, 16, 1, 2, 768, 768, 768, 2]
    - [21, 6.144]
  - - [768, 1280, 1, 30522, 768, 768, 768, 30522]
    - [8, 9572.85]
  - - [768, 1280, 1, 768, 768, 768, 768, 768]
    - [12, 8713.93]
  - - [768, 640, 1, 768, 768, 768, 768, 768]
    - [2, 7293.03]
  - - [768, 32, 1, 2, 768, 768, 768, 2]
    - [14, 11.8154]
  - - [3072, 2048, 1, 768, 3072, 3072, 3072, 768]
    - [9, 10019.6]
  - - [768, 4096, 1, 768, 768, 768, 768, 768]
    - [9, 9927.35]
  - - [3072, 4096, 1, 768, 3072, 3072, 3072, 768]
    - [12, 10150.1]
  - - [64, 256, 192, 256, 64, 64, 64, 256]
    - [18, 7054.19]
  - - [768, 8, 1, 768, 768, 768, 768, 768]
    - [25, 340.939]
  - - [64, 128, 384, 128, 64, 64, 64, 128]
    - [17, 6765.01]
  - - [768, 1024, 1, 768, 768, 768, 768, 768]
    - [7, 8768.58]
  - - [768, 320, 1, 768, 768, 768, 768, 768]
    - [23, 6838.54]
  - - [64, 64, 768, 64, 64, 64, 64, 64]
    - [20, 5388.83]
  - - [768, 1024, 1, 2, 768, 768, 768, 2]
    - [0, 258.695]
  - - [768, 16, 1, 768, 768, 768, 768, 768]
    - [25, 819.2]
  - - [768, 64, 1, 2, 768, 768, 768, 2]
    - [15, 24.576]
  - - [64, 256, 96, 256, 64, 64, 64, 256]
    - [18, 5893.64]
  - - [3072, 512, 1, 768, 3072, 3072, 3072, 768]
    - [10, 9722.79]
  - - [768, 160, 1, 768, 768, 768, 768, 768]
    - [27, 5019.78]
  - - [768, 4096, 1, 2, 768, 768, 768, 2]
    - [1, 507.375]
  - - [768, 512, 1, 2, 768, 768, 768, 2]
    - [0, 131.072]
- null
