test_dir/py38/lib/python3.6/site-packages/Tensile/Configs/miopen/archives/bert/2019-08-26/exact/vega20_Cijk_Alik_Bljk_SB.yaml
- {MinimumRequiredVersion: 4.9.11}
- vega20
- gfx906
- [Device 66a0, Device 66a1, Device 66a7, Vega 20]
    SolutionIndex: 0
    SolutionNameMin: Cijk_Alik_Bljk_SB_MT64x64x8_SE_EPS1_FL0_GRVW2_LPA0_LPB0_PGR1_PLR1_TT4_4_USFGRO1_VW4_WG16_16_1_WGM1
    SolutionIndex: 1
    SolutionNameMin: Cijk_Alik_Bljk_SB_MT64x64x8_SE_EPS1_FL0_GRVW2_LPA4_LPB4_PGR1_PLR1_TT4_4_USFGRO1_VW4_WG16_16_1_WGM1
    SolutionIndex: 2
    SolutionNameMin: Cijk_Alik_Bljk_SB_MT64x64x16_SE_EPS0_FL0_GRVW4_LPA2_LPB2_PGR0_PLR0_TT4_4_USFGRO1_VW2_WG16_16_1_WGM1
    SolutionIndex: 3
    SolutionNameMin: Cijk_Alik_Bljk_SB_MT64x64x16_SE_EPS0_FL0_GRVW4_LPA4_LPB4_PGR0_PLR1_TT4_4_USFGRO1_VW4_WG16_16_1_WGM8
    SolutionIndex: 4
    SolutionNameMin: Cijk_Alik_Bljk_SB_MT64x64x16_SE_EPS1_FL1_GRVW4_LPA0_LPB0_PGR1_PLR1_TT4_4_USFGRO1_VW4_WG16_16_1_WGM8
    SolutionIndex: 5
    SolutionNameMin: Cijk_Alik_Bljk_SB_MT64x64x16_SE_EPS0_FL1_GRVW4_LPA4_LPB4_PGR0_PLR1_TT4_4_USFGRO1_VW4_WG16_16_1_WGM8
    SolutionIndex: 6
    SolutionNameMin: Cijk_Alik_Bljk_SB_MT64x32x16_SE_EPS1_FL1_GRVW4_LPA0_LPB0_PGR1_PLR1_TT4_4_USFGRO1_VW4_WG16_8_2_WGM1
    SolutionIndex: 7
    SolutionNameMin: Cijk_Alik_Bljk_SB_MT8x32x32_SE_EPS1_FL0_GRVW1_LPA0_LPB2_PGR1_PLR1_TT2_2_USFGRO1_VW2_WG4_16_4_WGM1
    SolutionIndex: 8
    SolutionNameMin: Cijk_Alik_Bljk_SB_MT8x32x32_SE_EPS1_FL0_GRVW4_LPA2_LPB2_PGR1_PLR1_TT2_2_USFGRO1_VW2_WG4_16_4_WGM1
    SolutionIndex: 9
    SolutionNameMin: Cijk_Alik_Bljk_SB_MT32x8x32_SE_EPS1_FL0_GRVW2_LPA2_LPB2_PGR1_PLR1_TT2_2_USFGRO1_VW2_WG16_4_4_WGM1
    SolutionIndex: 10
    SolutionNameMin: Cijk_Alik_Bljk_SB_MT32x8x32_SE_EPS1_FL0_GRVW4_LPA2_LPB2_PGR1_PLR1_TT2_2_USFGRO1_VW2_WG16_4_4_WGM8
    SolutionIndex: 11
    SolutionNameMin: Cijk_Alik_Bljk_SB_MT32x8x16_SE_EPS1_FL1_GRVW2_LPA0_LPB0_PGR1_PLR1_TT2_2_USFGRO1_VW2_WG16_4_4_WGM1
    SolutionIndex: 12
    SolutionNameMin: Cijk_Alik_Bljk_SB_MT32x16x16_SE_EPS1_FL0_GRVW4_LPA0_LPB0_PGR1_PLR1_TT2_4_USFGRO1_VW2_WG16_4_4_WGM1
    SolutionIndex: 13
    SolutionNameMin: Cijk_Alik_Bljk_SB_MT96x64x8_SE_EPS1_FL1_GRVW4_LPA0_LPB0_PGR1_PLR1_TT6_4_USFGRO1_VW2_WG16_16_1_WGM8
    SolutionIndex: 14
    SolutionNameMin: Cijk_Alik_Bljk_SB_MT64x128x8_SE_EPS1_FL0_GRVW4_LPA0_LPB0_PGR1_PLR0_TT4_8_USFGRO1_VW4_WG16_16_1_WGM1
    SolutionIndex: 15
    SolutionNameMin: Cijk_Alik_Bljk_SB_MT64x128x8_SE_EPS1_FL0_GRVW4_LPA0_LPB0_PGR1_PLR1_TT4_8_USFGRO1_VW4_WG16_16_1_WGM1
    SolutionIndex: 16
    SolutionNameMin: Cijk_Alik_Bljk_SB_MT128x64x8_SE_EPS1_FL0_GRVW4_LPA0_LPB0_PGR1_PLR0_TT8_4_USFGRO1_VW4_WG16_16_1_WGM8
    SolutionIndex: 17
    SolutionNameMin: Cijk_Alik_Bljk_SB_MT128x128x16_SE_EPS1_FL0_GRVW4_LPA0_LPB0_PGR1_PLR1_TT8_8_USFGRO1_VW4_WG16_16_1_WGM1
    SolutionIndex: 18
    SolutionNameMin: Cijk_Alik_Bljk_SB_MT128x128x8_SE_EPS1_FL1_GRVW4_LPA0_LPB0_PGR1_PLR1_TT8_8_USFGRO1_VW4_WG16_16_1_WGM1
- - - [256, 256, 192, 64, 256, 256, 64, 64]
    - [2, 8264.64]
  - - [768, 4096, 1, 768, 768, 768, 768, 768]
    - [15, 9642.08]
  - - [2, 32, 1, 768, 2, 2, 768, 768]
    - [10, 4.99512]
  - - [768, 64, 1, 768, 768, 768, 768, 768]
    - [12, 1850.43]
  - - [768, 1280, 1, 768, 768, 768, 768, 768]
    - [15, 8738.13]
  - - [30522, 320, 1, 768, 30522, 30522, 768, 768]
    - [16, 9733.59]
  - - [128, 128, 96, 64, 128, 128, 64, 64]
    - [5, 5470.83]
  - - [2, 16, 1, 768, 2, 2, 768, 768]
    - [8, 2.47742]
  - - [30522, 1280, 1, 768, 30522, 30522, 768, 768]
    - [14, 10127.9]
  - - [30522, 640, 1, 768, 30522, 30522, 768, 768]
    - [15, 9987.61]
  - - [64, 64, 96, 64, 64, 64, 64, 64]
    - [1, 2578.47]
  - - [2, 8, 1, 768, 2, 2, 768, 768]
    - [7, 0.96]
  - - [768, 4096, 1, 3072, 768, 768, 3072, 3072]
    - [17, 9479.41]
  - - [768, 32, 1, 768, 768, 768, 768, 768]
    - [11, 880.334]
  - - [2, 64, 1, 768, 2, 2, 768, 768]
    - [8, 9.99024]
  - - [256, 256, 96, 64, 256, 256, 64, 64]
    - [2, 7614.47]
  - - [64, 64, 768, 64, 64, 64, 64, 64]
    - [4, 5354.43]
  - - [30522, 160, 1, 768, 30522, 30522, 768, 768]
    - [13, 7740.11]
  - - [768, 320, 1, 768, 768, 768, 768, 768]
    - [6, 5423.67]
  - - [128, 128, 384, 64, 128, 128, 64, 64]
    - [3, 7179.98]
  - - [768, 16, 1, 768, 768, 768, 768, 768]
    - [9, 706.376]
  - - [3072, 4096, 1, 768, 3072, 3072, 768, 768]
    - [18, 9961.74]
  - - [768, 640, 1, 768, 768, 768, 768, 768]
    - [0, 6683.56]
- null
