test_dir/py38/lib/python3.6/site-packages/Tensile/Configs/miopen/archives/resnet/2019-08-26/exact/vega20_Cijk_Alik_Bljk_SB.yaml
- {MinimumRequiredVersion: 4.10.0}
- vega20
- gfx906
- [Device 66a0, Device 66a1, Device 66a7, Vega 20]
    SolutionIndex: 0
    SolutionNameMin: Cijk_Alik_Bljk_SB_MT64x64x8_SE_EPS1_FL0_GRVW2_GSU1_LPA0_LPB0_PGR1_PLR0_TT4_4_WG16_16_1_WGM8
    SolutionIndex: 1
    SolutionNameMin: Cijk_Alik_Bljk_SB_MT64x64x8_SE_EPS1_FL0_GRVW2_GSU1_LPA0_LPB0_PGR1_PLR1_TT4_4_WG16_16_1_WGM1
    SolutionIndex: 2
    SolutionNameMin: Cijk_Alik_Bljk_SB_MT64x64x8_SE_EPS1_FL0_GRVW2_GSU1_LPA0_LPB0_PGR1_PLR1_TT4_4_WG16_16_1_WGM8
    SolutionIndex: 3
    SolutionNameMin: Cijk_Alik_Bljk_SB_MT64x64x8_SE_EPS1_FL0_GRVW4_GSU1_LPA0_LPB0_PGR1_PLR1_TT4_4_WG16_16_1_WGM1
    SolutionIndex: 4
    SolutionNameMin: Cijk_Alik_Bljk_SB_MT64x64x8_SE_EPS1_FL0_GRVW4_GSU1_LPA0_LPB0_PGR1_PLR1_TT4_4_WG16_16_1_WGM8
    SolutionIndex: 5
    SolutionNameMin: Cijk_Alik_Bljk_SB_MT64x64x16_SE_EPS0_FL0_GRVW4_GSU1_LPA0_LPB0_PGR0_PLR1_TT4_4_WG16_16_1_WGM1
    SolutionIndex: 6
    SolutionNameMin: Cijk_Alik_Bljk_SB_MT64x64x16_SE_EPS1_FL0_GRVW4_GSU1_LPA0_LPB0_PGR1_PLR1_TT4_4_WG16_16_1_WGM1
    SolutionIndex: 7
    SolutionNameMin: Cijk_Alik_Bljk_SB_MT64x64x16_SE_EPS1_FL0_GRVW4_GSU1_LPA0_LPB0_PGR1_PLR1_TT4_4_WG16_16_1_WGM8
    SolutionIndex: 8
    SolutionNameMin: Cijk_Alik_Bljk_SB_MT64x64x8_SE_EPS1_FL1_GRVW2_GSU1_LPA0_LPB0_PGR1_PLR0_TT4_4_WG16_16_1_WGM1
    SolutionIndex: 9
    SolutionNameMin: Cijk_Alik_Bljk_SB_MT64x64x8_SE_EPS1_FL1_GRVW2_GSU1_LPA0_LPB0_PGR1_PLR1_TT4_4_WG16_16_1_WGM1
    SolutionIndex: 10
    SolutionNameMin: Cijk_Alik_Bljk_SB_MT64x64x8_SE_EPS0_FL1_GRVW2_GSU1_LPA0_LPB0_PGR0_PLR1_TT4_4_WG16_16_1_WGM8
    SolutionIndex: 11
    SolutionNameMin: Cijk_Alik_Bljk_SB_MT64x64x16_SE_EPS1_FL1_GRVW4_GSU1_LPA0_LPB0_PGR1_PLR0_TT4_4_WG16_16_1_WGM1
    SolutionIndex: 12
    SolutionNameMin: Cijk_Alik_Bljk_SB_MT64x64x8_SE_EPS1_FL1_GRVW4_GSU1_LPA0_LPB0_PGR1_PLR1_TT4_4_WG16_16_1_WGM1
    SolutionIndex: 13
    SolutionNameMin: Cijk_Alik_Bljk_SB_MT64x64x8_SE_EPS1_FL1_GRVW4_GSU1_LPA0_LPB0_PGR1_PLR1_TT4_4_WG16_16_1_WGM8
    SolutionIndex: 14
    SolutionNameMin: Cijk_Alik_Bljk_SB_MT64x64x16_SE_EPS0_FL1_GRVW4_GSU1_LPA0_LPB0_PGR0_PLR1_TT4_4_WG16_16_1_WGM8
    SolutionIndex: 15
    SolutionNameMin: Cijk_Alik_Bljk_SB_MT96x64x8_SE_EPS1_FL1_GRVW4_GSU1_LPA0_LPB0_PGR1_PLR1_TT6_4_WG16_16_1_WGM1
    SolutionIndex: 16
    SolutionNameMin: Cijk_Alik_Bljk_SB_MT96x64x8_SE_EPS1_FL1_GRVW4_GSU1_LPA0_LPB0_PGR1_PLR1_TT6_4_WG16_16_1_WGM8
    SolutionIndex: 17
    SolutionNameMin: Cijk_Alik_Bljk_SB_MT64x128x8_SE_EPS1_FL0_GRVW2_GSU1_LPA0_LPB0_PGR1_PLR1_TT4_8_WG16_16_1_WGM1
    SolutionIndex: 18
    SolutionNameMin: Cijk_Alik_Bljk_SB_MT64x128x8_SE_EPS1_FL0_GRVW4_GSU1_LPA0_LPB0_PGR1_PLR1_TT4_8_WG16_16_1_WGM1
    SolutionIndex: 19
    SolutionNameMin: Cijk_Alik_Bljk_SB_MT64x128x8_SE_EPS1_FL0_GRVW4_GSU1_LPA0_LPB0_PGR1_PLR1_TT4_8_WG16_16_1_WGM1
    SolutionIndex: 20
    SolutionNameMin: Cijk_Alik_Bljk_SB_MT64x128x8_SE_EPS1_FL0_GRVW4_GSU1_LPA0_LPB0_PGR1_PLR1_TT4_8_WG16_16_1_WGM8
    SolutionIndex: 21
    SolutionNameMin: Cijk_Alik_Bljk_SB_MT64x128x8_SE_EPS1_FL1_GRVW2_GSU1_LPA0_LPB0_PGR1_PLR1_TT4_8_WG16_16_1_WGM1
    SolutionIndex: 22
    SolutionNameMin: Cijk_Alik_Bljk_SB_MT128x64x8_SE_EPS1_FL0_GRVW4_GSU1_LPA0_LPB0_PGR1_PLR0_TT8_4_WG16_16_1_WGM8
    SolutionIndex: 23
    SolutionNameMin: Cijk_Alik_Bljk_SB_MT128x64x8_SE_EPS1_FL0_GRVW4_GSU1_LPA0_LPB0_PGR1_PLR1_TT8_4_WG16_16_1_WGM1
    SolutionIndex: 24
    SolutionNameMin: Cijk_Alik_Bljk_SB_MT128x64x8_SE_EPS1_FL1_GRVW2_GSU1_LPA0_LPB0_PGR1_PLR1_TT8_4_WG16_16_1_WGM1
    SolutionIndex: 25
    SolutionNameMin: Cijk_Alik_Bljk_SB_MT128x64x8_SE_EPS0_FL1_GRVW4_GSU1_LPA0_LPB0_PGR0_PLR1_TT8_4_WG16_16_1_WGM8
    SolutionIndex: 26
    SolutionNameMin: Cijk_Alik_Bljk_SB_MT128x64x16_SE_EPS1_FL1_GRVW4_GSU1_LPA0_LPB0_PGR1_PLR1_TT8_4_WG16_16_1_WGM1
    SolutionIndex: 27
    SolutionNameMin: Cijk_Alik_Bljk_SB_MT128x128x8_SE_EPS1_FL1_GRVW4_GSU1_LPA0_LPB0_PGR1_PLR0_TT8_8_WG16_16_1_WGM8
    SolutionIndex: 28
    SolutionNameMin: Cijk_Alik_Bljk_SB_MT128x128x8_SE_EPS1_FL1_GRVW4_GSU1_LPA0_LPB0_PGR1_PLR1_TT8_8_WG16_16_1_WGM8
    SolutionIndex: 29
    SolutionNameMin: Cijk_Alik_Bljk_SB_MT64x64x16_SE_EPS1_FL1_GRVW4_GSU8_LPA0_LPB0_PGR1_PLR1_TT4_4_WG16_16_1_WGM8
    SolutionIndex: 30
    SolutionNameMin: Cijk_Alik_Bljk_SB_MT32x32x8_SE_EPS1_FL0_GRVW2_GSU1_LPA0_LPB0_PGR1_PLR1_TT4_2_WG8_16_2_WGM8
    SolutionIndex: 31
    SolutionNameMin: Cijk_Alik_Bljk_SB_MT32x64x8_SE_EPS1_FL0_GRVW2_GSU1_LPA0_LPB0_PGR1_PLR1_TT4_4_WG8_16_2_WGM1
    SolutionIndex: 32
    SolutionNameMin: Cijk_Alik_Bljk_SB_MT32x64x8_SE_EPS1_FL0_GRVW4_GSU1_LPA0_LPB0_PGR1_PLR1_TT4_4_WG8_16_2_WGM1
    SolutionIndex: 33
    SolutionNameMin: Cijk_Alik_Bljk_SB_MT32x64x16_SE_EPS1_FL0_GRVW4_GSU1_LPA0_LPB0_PGR1_PLR1_TT4_4_WG8_16_2_WGM1
    SolutionIndex: 34
    SolutionNameMin: Cijk_Alik_Bljk_SB_MT32x64x8_SE_EPS1_FL1_GRVW2_GSU1_LPA0_LPB0_PGR1_PLR1_TT4_4_WG8_16_2_WGM1
    SolutionIndex: 35
    SolutionNameMin: Cijk_Alik_Bljk_SB_MT32x64x8_SE_EPS1_FL1_GRVW2_GSU1_LPA0_LPB0_PGR1_PLR1_TT4_4_WG8_16_2_WGM8
    SolutionIndex: 36
    SolutionNameMin: Cijk_Alik_Bljk_SB_MT32x32x8_SE_EPS1_FL0_GRVW1_GSU1_LPA0_LPB0_PGR1_PLR1_TT2_4_WG16_8_2_WGM1
    SolutionIndex: 37
    SolutionNameMin: Cijk_Alik_Bljk_SB_MT64x32x8_SE_EPS1_FL0_GRVW2_GSU1_LPA0_LPB0_PGR1_PLR1_TT4_4_WG16_8_2_WGM1
    SolutionIndex: 38
    SolutionNameMin: Cijk_Alik_Bljk_SB_MT64x32x8_SE_EPS1_FL0_GRVW2_GSU1_LPA0_LPB0_PGR1_PLR1_TT4_4_WG16_8_2_WGM8
    SolutionIndex: 39
    SolutionNameMin: Cijk_Alik_Bljk_SB_MT64x32x16_SE_EPS1_FL0_GRVW4_GSU8_LPA0_LPB0_PGR1_PLR1_TT4_4_WG16_8_2_WGM8
    SolutionIndex: 40
    SolutionNameMin: Cijk_Alik_Bljk_SB_MT64x32x8_SE_EPS1_FL0_GRVW4_GSU1_LPA0_LPB0_PGR1_PLR1_TT4_4_WG16_8_2_WGM1
    SolutionIndex: 41
    SolutionNameMin: Cijk_Alik_Bljk_SB_MT64x32x8_SE_EPS1_FL1_GRVW2_GSU1_LPA0_LPB0_PGR1_PLR1_TT4_4_WG16_8_2_WGM1
    SolutionIndex: 42
    SolutionNameMin: Cijk_Alik_Bljk_SB_MT64x32x8_SE_EPS1_FL1_GRVW2_GSU1_LPA0_LPB0_PGR1_PLR1_TT4_4_WG16_8_2_WGM8
    SolutionIndex: 43
    SolutionNameMin: Cijk_Alik_Bljk_SB_MT64x32x16_SE_EPS1_FL1_GRVW4_GSU8_LPA0_LPB0_PGR1_PLR1_TT4_4_WG16_8_2_WGM1
    SolutionIndex: 44
    SolutionNameMin: Cijk_Alik_Bljk_SB_MT64x32x16_SE_EPS1_FL1_GRVW4_GSU1_LPA0_LPB0_PGR1_PLR1_TT4_4_WG16_8_2_WGM1
    SolutionIndex: 45
    SolutionNameMin: Cijk_Alik_Bljk_SB_MT8x32x16_SE_EPS1_FL1_GRVW2_GSU1_LPA0_LPB0_PGR1_PLR1_TT2_2_WG4_16_4_WGM1
    SolutionIndex: 46
    SolutionNameMin: Cijk_Alik_Bljk_SB_MT8x32x16_SE_EPS1_FL1_GRVW4_GSU1_LPA0_LPB0_PGR1_PLR1_TT2_2_WG4_16_4_WGM1
    SolutionIndex: 47
    SolutionNameMin: Cijk_Alik_Bljk_SB_MT8x32x16_SE_EPS1_FL1_GRVW4_GSU1_LPA0_LPB0_PGR1_PLR1_TT2_2_WG4_16_4_WGM8
    SolutionIndex: 48
    SolutionNameMin: Cijk_Alik_Bljk_SB_MT16x32x16_SE_EPS1_FL0_GRVW2_GSU1_LPA0_LPB0_PGR1_PLR1_TT4_2_WG4_16_4_WGM1
    SolutionIndex: 49
    SolutionNameMin: Cijk_Alik_Bljk_SB_MT16x32x16_SE_EPS1_FL0_GRVW4_GSU1_LPA0_LPB0_PGR1_PLR1_TT4_2_WG4_16_4_WGM1
    SolutionIndex: 50
    SolutionNameMin: Cijk_Alik_Bljk_SB_MT8x64x16_SE_EPS1_FL1_GRVW4_GSU1_LPA0_LPB0_PGR1_PLR1_TT2_4_WG4_16_4_WGM1
    SolutionIndex: 51
    SolutionNameMin: Cijk_Alik_Bljk_SB_MT16x64x16_SE_EPS1_FL0_GRVW4_GSU1_LPA0_LPB0_PGR1_PLR1_TT4_4_WG4_16_4_WGM1
    SolutionIndex: 52
    SolutionNameMin: Cijk_Alik_Bljk_SB_MT16x64x16_SE_EPS1_FL0_GRVW4_GSU1_LPA0_LPB0_PGR1_PLR1_TT4_4_WG4_16_4_WGM8
    SolutionIndex: 53
    SolutionNameMin: Cijk_Alik_Bljk_SB_MT16x64x16_SE_EPS1_FL0_GRVW4_GSU1_LPA0_LPB0_PGR1_PLR1_TT4_4_WG4_16_4_WGM1
    SolutionIndex: 54
    SolutionNameMin: Cijk_Alik_Bljk_SB_MT16x64x16_SE_EPS1_FL0_GRVW4_GSU1_LPA0_LPB0_PGR1_PLR1_TT4_4_WG4_16_4_WGM8
    SolutionIndex: 55
    SolutionNameMin: Cijk_Alik_Bljk_SB_MT16x64x16_SE_EPS1_FL0_GRVW4_GSU8_LPA0_LPB0_PGR1_PLR1_TT4_4_WG4_16_4_WGM1
    SolutionIndex: 56
    SolutionNameMin: Cijk_Alik_Bljk_SB_MT32x16x16_SE_EPS1_FL0_GRVW2_GSU1_LPA0_LPB0_PGR1_PLR1_TT2_4_WG16_4_4_WGM1
    SolutionIndex: 57
    SolutionNameMin: Cijk_Alik_Bljk_SB_MT32x16x16_SE_EPS1_FL0_GRVW2_GSU1_LPA0_LPB0_PGR1_PLR1_TT2_4_WG16_4_4_WGM8
    SolutionIndex: 58
    SolutionNameMin: Cijk_Alik_Bljk_SB_MT32x16x16_SE_EPS1_FL0_GRVW4_GSU1_LPA0_LPB0_PGR1_PLR1_TT2_4_WG16_4_4_WGM1
    SolutionIndex: 59
    SolutionNameMin: Cijk_Alik_Bljk_SB_MT32x16x16_SE_EPS1_FL1_GRVW4_GSU1_LPA0_LPB0_PGR1_PLR1_TT2_4_WG16_4_4_WGM8
    SolutionIndex: 60
    SolutionNameMin: Cijk_Alik_Bljk_SB_MT64x16x16_SE_EPS1_FL0_GRVW4_GSU1_LPA0_LPB0_PGR1_PLR1_TT4_4_WG16_4_4_WGM1
    SolutionIndex: 61
    SolutionNameMin: Cijk_Alik_Bljk_SB_MT64x16x16_SE_EPS1_FL0_GRVW4_GSU1_LPA0_LPB0_PGR1_PLR1_TT4_4_WG16_4_4_WGM8
    SolutionIndex: 62
    SolutionNameMin: Cijk_Alik_Bljk_SB_MT64x16x16_SE_EPS1_FL0_GRVW4_GSU8_LPA0_LPB0_PGR1_PLR1_TT4_4_WG16_4_4_WGM8
    SolutionIndex: 63
    SolutionNameMin: Cijk_Alik_Bljk_SB_MT64x16x16_SE_EPS1_FL0_GRVW4_GSU1_LPA0_LPB0_PGR1_PLR1_TT4_4_WG16_4_4_WGM1
    SolutionIndex: 64
    SolutionNameMin: Cijk_Alik_Bljk_SB_MT64x16x16_SE_EPS1_FL0_GRVW4_GSU1_LPA0_LPB0_PGR1_PLR1_TT4_4_WG16_4_4_WGM8
    SolutionIndex: 65
    SolutionNameMin: Cijk_Alik_Bljk_SB_MT64x16x8_SE_EPS1_FL1_GRVW4_GSU1_LPA0_LPB0_PGR1_PLR1_TT4_4_WG16_4_4_WGM8
    SolutionIndex: 66
    SolutionNameMin: Cijk_Alik_Bljk_SB_MT64x64x16_SE_EPS1_FL0_GRVW2_GSU1_LPA4_LPB4_PGR1_PLR1_TT4_4_WG16_16_1_WGM1
    SolutionIndex: 67
    SolutionNameMin: Cijk_Alik_Bljk_SB_MT64x64x8_SE_EPS1_FL1_GRVW2_GSU1_LPA4_LPB4_PGR1_PLR0_TT4_4_WG16_16_1_WGM1
    SolutionIndex: 68
    SolutionNameMin: Cijk_Alik_Bljk_SB_MT64x32x32_SE_EPS1_FL1_GRVW4_GSU1_LPA2_LPB2_PGR1_PLR1_TT4_2_WG16_16_1_WGM8
    SolutionIndex: 69
    SolutionNameMin: Cijk_Alik_Bljk_SB_MT32x64x16_SE_EPS1_FL0_GRVW4_GSU1_LPA2_LPB2_PGR1_PLR1_TT2_4_WG16_16_1_WGM8
    SolutionIndex: 70
    SolutionNameMin: Cijk_Alik_Bljk_SB_MT32x64x16_SE_EPS1_FL1_GRVW4_GSU1_LPA2_LPB2_PGR1_PLR1_TT2_4_WG16_16_1_WGM8
    SolutionIndex: 71
    SolutionNameMin: Cijk_Alik_Bljk_SB_MT64x128x16_SE_EPS1_FL0_GRVW4_GSU1_LPA2_LPB2_PGR1_PLR1_TT4_8_WG16_16_1_WGM1
    SolutionIndex: 72
    SolutionNameMin: Cijk_Alik_Bljk_SB_MT64x128x8_SE_EPS1_FL0_GRVW4_GSU1_LPA4_LPB0_PGR1_PLR1_TT4_8_WG16_16_1_WGM1
    SolutionIndex: 73
    SolutionNameMin: Cijk_Alik_Bljk_SB_MT128x64x16_SE_EPS1_FL0_GRVW4_GSU1_LPA2_LPB2_PGR1_PLR1_TT8_4_WG16_16_1_WGM8
    SolutionIndex: 74
    SolutionNameMin: Cijk_Alik_Bljk_SB_MT64x32x16_SE_EPS1_FL0_GRVW1_GSU1_LPA4_LPB4_PGR1_PLR1_TT4_4_WG16_8_1_WGM1
    SolutionIndex: 75
    SolutionNameMin: Cijk_Alik_Bljk_SB_MT64x32x16_SE_EPS1_FL0_GRVW1_GSU1_LPA4_LPB4_PGR1_PLR1_TT4_4_WG16_8_1_WGM8
    SolutionIndex: 76
    SolutionNameMin: Cijk_Alik_Bljk_SB_MT32x32x16_SE_EPS1_FL0_GRVW1_GSU1_LPA2_LPB2_PGR1_PLR1_TT2_4_WG16_8_1_WGM1
    SolutionIndex: 77
    SolutionNameMin: Cijk_Alik_Bljk_SB_MT32x32x32_SE_EPS1_FL0_GRVW4_GSU1_LPA2_LPB2_PGR1_PLR1_TT2_4_WG16_8_1_WGM1
    SolutionIndex: 78
    SolutionNameMin: Cijk_Alik_Bljk_SB_MT8x32x32_SE_EPS1_FL0_GRVW2_GSU1_LPA0_LPB2_PGR1_PLR1_TT2_2_WG4_16_4_WGM8
    SolutionIndex: 79
    SolutionNameMin: Cijk_Alik_Bljk_SB_MT8x32x32_SE_EPS1_FL0_GRVW2_GSU1_LPA2_LPB2_PGR1_PLR1_TT2_2_WG4_16_4_WGM8
    SolutionIndex: 80
    SolutionNameMin: Cijk_Alik_Bljk_SB_MT8x32x32_SE_EPS1_FL0_GRVW2_GSU8_LPA2_LPB2_PGR1_PLR1_TT2_2_WG4_16_4_WGM1
    SolutionIndex: 81
    SolutionNameMin: Cijk_Alik_Bljk_SB_MT8x32x32_SE_EPS1_FL0_GRVW4_GSU1_LPA2_LPB2_PGR1_PLR1_TT2_2_WG4_16_4_WGM1
    SolutionIndex: 82
    SolutionNameMin: Cijk_Alik_Bljk_SB_MT8x32x32_SE_EPS1_FL0_GRVW4_GSU1_LPA2_LPB2_PGR1_PLR1_TT2_2_WG4_16_4_WGM8
    SolutionIndex: 83
    SolutionNameMin: Cijk_Alik_Bljk_SB_MT16x32x32_SE_EPS1_FL0_GRVW2_GSU8_LPA2_LPB2_PGR1_PLR0_TT4_2_WG4_16_4_WGM1
    SolutionIndex: 84
    SolutionNameMin: Cijk_Alik_Bljk_SB_MT32x8x32_SE_EPS1_FL0_GRVW1_GSU1_LPA2_LPB2_PGR1_PLR1_TT2_2_WG16_4_4_WGM1
    SolutionIndex: 85
    SolutionNameMin: Cijk_Alik_Bljk_SB_MT32x8x32_SE_EPS1_FL0_GRVW2_GSU1_LPA2_LPB0_PGR1_PLR1_TT2_2_WG16_4_4_WGM8
    SolutionIndex: 86
    SolutionNameMin: Cijk_Alik_Bljk_SB_MT32x8x32_SE_EPS1_FL0_GRVW2_GSU1_LPA2_LPB2_PGR1_PLR1_TT2_2_WG16_4_4_WGM8
    SolutionIndex: 87
    SolutionNameMin: Cijk_Alik_Bljk_SB_MT32x8x32_SE_EPS1_FL0_GRVW4_GSU1_LPA2_LPB2_PGR1_PLR1_TT2_2_WG16_4_4_WGM1
    SolutionIndex: 88
    SolutionNameMin: Cijk_Alik_Bljk_SB_MT32x8x32_SE_EPS1_FL0_GRVW4_GSU1_LPA2_LPB2_PGR1_PLR1_TT2_2_WG16_4_4_WGM8
    SolutionIndex: 89
    SolutionNameMin: Cijk_Alik_Bljk_SB_MT32x16x32_SE_EPS1_FL0_GRVW1_GSU8_LPA2_LPB2_PGR1_PLR1_TT2_4_WG16_4_4_WGM1
    SolutionIndex: 90
    SolutionNameMin: Cijk_Alik_Bljk_SB_MT32x16x32_SE_EPS1_FL1_GRVW2_GSU8_LPA2_LPB2_PGR1_PLR1_TT2_4_WG16_4_4_WGM8
    SolutionIndex: 91
    SolutionNameMin: Cijk_Alik_Bljk_SB_MT64x16x32_SE_EPS1_FL0_GRVW2_GSU8_LPA2_LPB2_PGR1_PLR1_TT4_4_WG16_4_4_WGM1
    SolutionIndex: 92
    SolutionNameMin: Cijk_Alik_Bljk_SB_MT64x16x32_SE_EPS1_FL0_GRVW4_GSU8_LPA2_LPB2_PGR1_PLR1_TT4_4_WG16_4_4_WGM8
    SolutionIndex: 93
    SolutionNameMin: Cijk_Alik_Bljk_SB_MT64x16x32_SE_EPS1_FL1_GRVW4_GSU8_LPA2_LPB2_PGR1_PLR1_TT4_4_WG16_4_4_WGM1
    SolutionIndex: 94
    SolutionNameMin: Cijk_Alik_Bljk_SB_MT8x32x32_SE_EPS1_FL0_GRVW4_GSU4_LPA0_LPB2_PGR1_PLR1_TT2_2_WG4_16_4_WGM8
- - - [1728, 320, 1, 64, 1728, 1728, 64, 64]
    - [6, 3205.57]
  - - [1152, 128, 1, 784, 1152, 1152, 784, 784]
    - [53, 3498.96]
  - - [576, 96, 1, 5329, 576, 576, 5329, 5329]
    - [39, 3947.92]
  - - [864, 96, 1, 1225, 864, 864, 1225, 1225]
    - [60, 3009.67]
  - - [256, 128, 1, 784, 256, 256, 784, 784]
    - [50, 1536.49]
  - - [1152, 256, 1, 64, 1152, 1152, 64, 64]
    - [1, 2087.87]
  - - [256, 64, 1, 1225, 256, 256, 1225, 1225]
    - [87, 1417.4]
  - - [384, 96, 1, 1225, 384, 384, 1225, 1225]
    - [54, 1650.53]
  - - [1440, 320, 1, 196, 1440, 1440, 196, 196]
    - [3, 4824.62]
  - - [192, 48, 1, 1225, 192, 192, 1225, 1225]
    - [81, 820.465]
  - - [2592, 384, 1, 289, 2592, 2592, 289, 289]
    - [21, 7353.01]
  - - [192, 80, 36, 10368, 192, 192, 10368, 10368]
    - [71, 5360.04]
  - - [896, 192, 1, 289, 896, 896, 289, 289]
    - [38, 3076.56]
  - - [768, 128, 1, 289, 768, 768, 289, 289]
    - [63, 2351.81]
  - - [64, 256, 1, 3136, 64, 64, 3136, 3136]
    - [89, 1809.16]
  - - [1280, 384, 1, 64, 1280, 1280, 64, 64]
    - [3, 3171.1]
  - - [1024, 512, 1, 49, 1024, 1024, 49, 49]
    - [10, 2327.0]
  - - [512, 144, 1, 196, 512, 512, 196, 196]
    - [61, 1445.07]
  - - [1024, 384, 1, 289, 1024, 1024, 289, 289]
    - [1, 4552.86]
  - - [1344, 192, 1, 289, 1344, 1344, 289, 289]
    - [44, 4376.52]
  - - [288, 64, 1, 21609, 288, 288, 21609, 21609]
    - [55, 3396.12]
  - - [256, 64, 1, 3136, 256, 256, 3136, 3136]
    - [91, 1759.6]
  - - [2048, 384, 1, 64, 2048, 2048, 64, 64]
    - [14, 3744.91]
  - - [400, 32, 1, 784, 400, 400, 784, 784]
    - [82, 922.353]
  - - [288, 32, 1, 21609, 288, 288, 21609, 21609]
    - [93, 2816.01]
  - - [1280, 448, 1, 64, 1280, 1280, 64, 64]
    - [6, 3253.56]
  - - [3456, 256, 1, 169, 3456, 3456, 169, 169]
    - [18, 5822.44]
  - - [2304, 256, 1, 196, 2304, 2304, 196, 196]
    - [16, 4931.98]
  - - [384, 192, 1, 1225, 384, 384, 1225, 1225]
    - [64, 2720.39]
  - - [832, 48, 1, 49, 832, 832, 49, 49]
    - [59, 344.518]
  - - [600, 64, 1, 196, 600, 600, 196, 196]
    - [63, 879.252]
  - - [832, 192, 1, 49, 832, 832, 49, 49]
    - [41, 1099.36]
  - - [1280, 192, 1, 64, 1280, 1280, 64, 64]
    - [42, 2069.56]
  - - [64, 64, 36, 12544, 64, 64, 12544, 12544]
    - [76, 4054.92]
  - - [192, 32, 1, 784, 192, 192, 784, 784]
    - [81, 459.627]
  - - [288, 48, 1, 1225, 288, 288, 1225, 1225]
    - [88, 1176.0]
  - - [512, 112, 1, 196, 512, 512, 196, 196]
    - [56, 1277.21]
  - - [224, 192, 36, 2592, 224, 224, 2592, 2592]
    - [73, 7369.56]
  - - [528, 32, 1, 196, 528, 528, 196, 196]
    - [47, 440.374]
  - - [192, 128, 36, 1568, 192, 192, 1568, 1568]
    - [72, 8245.76]
  - - [4032, 384, 1, 64, 4032, 4032, 64, 64]
    - [17, 5898.24]
  - - [576, 64, 1, 3136, 576, 576, 3136, 3136]
    - [62, 2671.11]
  - - [1008, 224, 1, 196, 1008, 1008, 196, 196]
    - [34, 3312.52]
  - - [2048, 320, 1, 64, 2048, 2048, 64, 64]
    - [0, 3084.05]
  - - [2048, 32, 1, 1001, 2048, 2048, 1001, 1001]
    - [64, 2323.0]
  - - [480, 64, 1, 196, 480, 480, 196, 196]
    - [49, 752.64]
  - - [512, 256, 1, 196, 512, 512, 196, 196]
    - [51, 2528.55]
  - - [1120, 160, 1, 289, 1120, 1120, 289, 289]
    - [37, 3142.52]
  - - [256, 1024, 1, 196, 256, 256, 196, 196]
    - [35, 4090.78]
  - - [832, 32, 1, 49, 832, 832, 49, 49]
    - [48, 232.96]
  - - [864, 96, 1, 289, 864, 864, 289, 289]
    - [61, 1958.4]
  - - [896, 128, 1, 289, 896, 896, 289, 289]
    - [64, 2725.73]
  - - [192, 64, 1, 784, 192, 192, 784, 784]
    - [79, 898.675]
  - - [1200, 64, 1, 1225, 1200, 1200, 1225, 1225]
    - [63, 2780.14]
  - - [1296, 288, 1, 196, 1296, 1296, 196, 196]
    - [2, 3826.18]
  - - [576, 96, 1, 5041, 576, 576, 5041, 5041]
    - [43, 3795.58]
  - - [1024, 256, 1, 289, 1024, 1024, 289, 289]
    - [32, 4488.13]
  - - [1024, 2048, 1, 49, 1024, 1024, 49, 49]
    - [22, 5077.1]
  - - [192, 64, 36, 6272, 192, 192, 6272, 6272]
    - [66, 7514.98]
  - - [4096, 512, 1, 4096, 4096, 4096, 4096, 4096]
    - [28, 10276.0]
  - - [192, 32, 1, 1225, 192, 192, 1225, 1225]
    - [82, 556.686]
  - - [768, 192, 1, 289, 768, 768, 289, 289]
    - [65, 2690.33]
  - - [1024, 256, 1, 196, 1024, 1024, 196, 196]
    - [42, 3892.44]
  - - [1120, 192, 1, 289, 1120, 1120, 289, 289]
    - [31, 3752.81]
  - - [400, 48, 1, 196, 400, 400, 196, 196]
    - [56, 480.0]
  - - [1728, 224, 1, 1225, 1728, 1728, 1225, 1225]
    - [9, 5575.77]
  - - [800, 96, 1, 784, 800, 800, 784, 784]
    - [63, 2668.94]
  - - [832, 128, 1, 49, 832, 832, 49, 49]
    - [36, 815.36]
  - - [1152, 384, 1, 64, 1152, 1152, 64, 64]
    - [13, 3077.34]
  - - [832, 384, 1, 49, 832, 832, 49, 49]
    - [12, 1811.91]
  - - [4608, 512, 1, 49, 4608, 4608, 49, 49]
    - [20, 4676.6]
  - - [1792, 256, 1, 289, 1792, 1792, 289, 289]
    - [13, 5345.94]
  - - [864, 128, 1, 784, 864, 864, 784, 784]
    - [63, 3816.2]
  - - [1728, 384, 1, 169, 1728, 1728, 169, 169]
    - [15, 5191.68]
  - - [480, 16, 1, 196, 480, 480, 196, 196]
    - [84, 241.231]
  - - [1568, 256, 1, 289, 1568, 1568, 289, 289]
    - [3, 4723.41]
  - - [1152, 448, 1, 64, 1152, 1152, 64, 64]
    - [9, 3356.72]
  - - [512, 64, 1, 196, 512, 512, 196, 196]
    - [48, 802.816]
  - - [1344, 224, 1, 289, 1344, 1344, 289, 289]
    - [3, 3519.63]
  - - [9216, 512, 1, 4096, 9216, 9216, 4096, 4096]
    - [26, 9146.02]
  - - [512, 24, 1, 196, 512, 512, 196, 196]
    - [85, 371.674]
  - - [27, 32, 1, 22201, 27, 27, 22201, 22201]
    - [94, 264.356]
  - - [1152, 192, 1, 784, 1152, 1152, 784, 784]
    - [33, 4904.08]
  - - [1536, 256, 1, 64, 1536, 1536, 64, 64]
    - [1, 2578.47]
  - - [384, 64, 1, 1225, 384, 384, 1225, 1225]
    - [45, 1221.82]
  - - [800, 128, 1, 196, 800, 800, 196, 196]
    - [63, 1991.11]
  - - [800, 64, 1, 196, 800, 800, 196, 196]
    - [58, 1150.83]
  - - [864, 208, 1, 196, 864, 864, 196, 196]
    - [35, 2684.72]
  - - [1440, 320, 1, 49, 1440, 1440, 49, 49]
    - [4, 2313.44]
  - - [512, 128, 1, 784, 512, 512, 784, 784]
    - [54, 2780.32]
  - - [720, 192, 1, 5041, 720, 720, 5041, 5041]
    - [29, 5410.46]
  - - [256, 64, 1, 784, 256, 256, 784, 784]
    - [86, 1163.5]
  - - [256, 48, 1, 1225, 256, 256, 1225, 1225]
    - [81, 1075.2]
  - - [576, 192, 1, 3136, 576, 576, 3136, 3136]
    - [29, 4833.01]
  - - [160, 64, 1, 5329, 160, 160, 5329, 5329]
    - [83, 1753.5]
  - - [363, 64, 1, 3025, 363, 363, 3025, 3025]
    - [43, 2042.93]
  - - [3456, 384, 1, 289, 3456, 3456, 289, 289]
    - [23, 7341.75]
  - - [32, 32, 36, 43808, 32, 32, 43808, 43808]
    - [77, 1378.03]
  - - [1344, 512, 1, 64, 1344, 1344, 64, 64]
    - [2, 3822.93]
  - - [192, 16, 1, 784, 192, 192, 784, 784]
    - [82, 228.073]
  - - [3456, 384, 1, 169, 3456, 3456, 169, 169]
    - [19, 6675.02]
  - - [1152, 256, 1, 196, 1152, 1152, 196, 196]
    - [12, 3211.26]
  - - [1728, 192, 1, 1225, 1728, 1728, 1225, 1225]
    - [13, 4852.26]
  - - [2048, 512, 1, 49, 2048, 2048, 49, 49]
    - [25, 3471.64]
  - - [576, 96, 1, 1225, 576, 576, 1225, 1225]
    - [56, 2176.66]
  - - [512, 2048, 1, 49, 512, 512, 49, 49]
    - [7, 3845.83]
  - - [1024, 128, 1, 289, 1024, 1024, 289, 289]
    - [63, 3074.66]
  - - [1728, 192, 1, 64, 1728, 1728, 64, 64]
    - [2, 2369.83]
  - - [832, 256, 1, 49, 832, 832, 49, 49]
    - [32, 1433.6]
  - - [512, 128, 1, 196, 512, 512, 196, 196]
    - [57, 1459.67]
  - - [1200, 128, 1, 49, 1200, 1200, 49, 49]
    - [52, 1069.09]
  - - [528, 256, 1, 196, 528, 528, 196, 196]
    - [40, 2069.76]
  - - [1568, 224, 1, 289, 1568, 1568, 289, 289]
    - [1, 4002.6]
  - - [256, 512, 1, 784, 256, 256, 784, 784]
    - [63, 4538.89]
  - - [480, 192, 1, 196, 480, 480, 196, 196]
    - [63, 1792.0]
  - - [96, 64, 36, 2592, 96, 96, 2592, 2592]
    - [70, 4845.41]
  - - [96, 96, 36, 2592, 96, 96, 2592, 2592]
    - [75, 5111.53]
  - - [2048, 448, 1, 64, 2048, 2048, 64, 64]
    - [24, 3883.61]
  - - [1024, 192, 1, 289, 1024, 1024, 289, 289]
    - [37, 3431.14]
  - - [1536, 384, 1, 64, 1536, 1536, 64, 64]
    - [8, 3166.84]
  - - [192, 96, 1, 784, 192, 192, 784, 784]
    - [48, 881.14]
  - - [2048, 192, 1, 64, 2048, 2048, 64, 64]
    - [5, 2330.17]
  - - [192, 64, 1, 1225, 192, 192, 1225, 1225]
    - [87, 1100.35]
  - - [512, 32, 1, 196, 512, 512, 196, 196]
    - [78, 477.867]
  - - [128, 96, 36, 1568, 128, 128, 1568, 1568]
    - [74, 6649.09]
  - - [800, 128, 1, 49, 800, 800, 49, 49]
    - [30, 774.321]
  - - [528, 128, 1, 196, 528, 528, 196, 196]
    - [60, 1403.23]
  - - [128, 512, 1, 784, 128, 128, 784, 784]
    - [50, 2237.81]
  - - [1600, 192, 1, 729, 1600, 1600, 729, 729]
    - [2, 4306.71]
  - - [128, 128, 36, 3136, 128, 128, 3136, 3136]
    - [67, 6538.77]
  - - [528, 160, 1, 196, 528, 528, 196, 196]
    - [64, 1642.67]
  - - [448, 64, 1, 5329, 448, 448, 5329, 5329]
    - [39, 3264.81]
  - - [1280, 320, 1, 64, 1280, 1280, 64, 64]
    - [3, 2776.95]
  - - [1792, 320, 1, 289, 1792, 1792, 289, 289]
    - [15, 5204.9]
  - - [64, 80, 1, 5329, 64, 64, 5329, 5329]
    - [90, 1042.98]
  - - [2880, 320, 1, 64, 2880, 2880, 64, 64]
    - [11, 4336.94]
  - - [147, 64, 1, 12544, 147, 147, 12544, 12544]
    - [92, 2430.27]
  - - [4096, 512, 1, 1001, 4096, 4096, 1001, 1001]
    - [27, 9618.99]
  - - [1536, 32, 1, 1001, 1536, 1536, 1001, 1001]
    - [64, 1757.18]
  - - [2048, 64, 1, 1001, 2048, 2048, 1001, 1001]
    - [54, 4304.56]
  - - [512, 160, 1, 196, 512, 512, 196, 196]
    - [60, 1592.89]
  - - [768, 160, 1, 289, 768, 768, 289, 289]
    - [61, 2757.17]
  - - [1728, 384, 1, 49, 1728, 1728, 49, 49]
    - [13, 3102.49]
  - - [64, 32, 36, 43808, 64, 64, 43808, 43808]
    - [68, 2626.43]
  - - [64, 64, 1, 3136, 64, 64, 3136, 3136]
    - [80, 610.506]
  - - [256, 32, 1, 784, 256, 256, 784, 784]
    - [81, 612.837]
  - - [288, 64, 1, 1225, 288, 288, 1225, 1225]
    - [48, 960.0]
  - - [480, 96, 1, 196, 480, 480, 196, 196]
    - [56, 1055.1]
  - - [1024, 32, 1, 1001, 1024, 1024, 1001, 1001]
    - [46, 1188.43]
  - - [2016, 256, 1, 289, 2016, 2016, 289, 289]
    - [2, 5937.57]
  - - [832, 160, 1, 49, 832, 832, 49, 49]
    - [61, 959.247]
  - - [512, 1024, 1, 196, 512, 512, 196, 196]
    - [4, 4978.7]
  - - [96, 64, 36, 10368, 96, 96, 10368, 10368]
    - [69, 5012.32]
- null
