test_dir/py38/lib/python3.6/site-packages/Tensile/Configs/miopen/archives/resnet/2019-08-26/exact/vega20_Cijk_Ailk_Bjlk_SB.yaml
- {MinimumRequiredVersion: 4.10.0}
- vega20
- gfx906
- [Device 66a0, Device 66a1, Device 66a7, Vega 20]
    SolutionIndex: 0
    SolutionNameMin: Cijk_Ailk_Bjlk_SB_MT64x64x8_SE_DTL0_EPS1_FL0_GRVW1_PGR1_PLR0_TT4_4_USFGRO1_VW2_WG16_16_1_WGM8
    SolutionIndex: 1
    SolutionNameMin: Cijk_Ailk_Bjlk_SB_MT64x64x8_SE_DTL0_EPS0_FL0_GRVW1_PGR0_PLR1_TT4_4_USFGRO1_VW2_WG16_16_1_WGM1
    SolutionIndex: 2
    SolutionNameMin: Cijk_Ailk_Bjlk_SB_MT64x64x8_SE_DTL0_EPS1_FL0_GRVW1_PGR1_PLR1_TT4_4_USFGRO1_VW2_WG16_16_1_WGM1
    SolutionIndex: 3
    SolutionNameMin: Cijk_Ailk_Bjlk_SB_MT64x64x8_SE_DTL0_EPS1_FL0_GRVW1_PGR1_PLR1_TT4_4_USFGRO1_VW2_WG16_16_1_WGM8
    SolutionIndex: 4
    SolutionNameMin: Cijk_Ailk_Bjlk_SB_MT64x64x16_SE_DTL0_EPS0_FL0_GRVW1_PGR0_PLR1_TT4_4_USFGRO1_VW2_WG16_16_1_WGM1
    SolutionIndex: 5
    SolutionNameMin: Cijk_Ailk_Bjlk_SB_MT64x64x16_SE_DTL0_EPS0_FL0_GRVW1_PGR0_PLR1_TT4_4_USFGRO1_VW2_WG16_16_1_WGM8
    SolutionIndex: 6
    SolutionNameMin: Cijk_Ailk_Bjlk_SB_MT64x64x8_SE_DTL0_EPS1_FL0_GRVW1_PGR1_PLR0_TT4_4_USFGRO1_VW4_WG16_16_1_WGM1
    SolutionIndex: 7
    SolutionNameMin: Cijk_Ailk_Bjlk_SB_MT64x64x8_SE_DTL0_EPS0_FL0_GRVW1_PGR0_PLR0_TT4_4_USFGRO1_VW4_WG16_16_1_WGM8
    SolutionIndex: 8
    SolutionNameMin: Cijk_Ailk_Bjlk_SB_MT64x64x8_SE_DTL0_EPS1_FL0_GRVW1_PGR1_PLR0_TT4_4_USFGRO1_VW4_WG16_16_1_WGM8
    SolutionIndex: 9
    SolutionNameMin: Cijk_Ailk_Bjlk_SB_MT64x64x8_SE_DTL0_EPS0_FL0_GRVW1_PGR0_PLR1_TT4_4_USFGRO1_VW4_WG16_16_1_WGM1
    SolutionIndex: 10
    SolutionNameMin: Cijk_Ailk_Bjlk_SB_MT64x64x8_SE_DTL0_EPS1_FL0_GRVW1_PGR1_PLR1_TT4_4_USFGRO1_VW4_WG16_16_1_WGM8
    SolutionIndex: 11
    SolutionNameMin: Cijk_Ailk_Bjlk_SB_MT64x64x16_SE_DTL0_EPS0_FL0_GRVW1_PGR0_PLR1_TT4_4_USFGRO1_VW4_WG16_16_1_WGM1
    SolutionIndex: 12
    SolutionNameMin: Cijk_Ailk_Bjlk_SB_MT64x64x16_SE_DTL0_EPS1_FL0_GRVW1_PGR1_PLR1_TT4_4_USFGRO1_VW4_WG16_16_1_WGM1
    SolutionIndex: 13
    SolutionNameMin: Cijk_Ailk_Bjlk_SB_MT64x64x16_SE_DTL0_EPS0_FL0_GRVW1_PGR0_PLR1_TT4_4_USFGRO1_VW4_WG16_16_1_WGM8
    SolutionIndex: 14
    SolutionNameMin: Cijk_Ailk_Bjlk_SB_MT64x64x8_SE_DTL0_EPS1_FL0_GRVW2_PGR1_PLR1_TT4_4_USFGRO0_VW2_WG16_16_1_WGM1
    SolutionIndex: 15
    SolutionNameMin: Cijk_Ailk_Bjlk_SB_MT64x64x8_SE_DTL0_EPS1_FL0_GRVW2_PGR1_PLR1_TT4_4_USFGRO0_VW2_WG16_16_1_WGM8
    SolutionIndex: 16
    SolutionNameMin: Cijk_Ailk_Bjlk_SB_MT64x64x8_SE_DTL0_EPS1_FL0_GRVW4_PGR1_PLR1_TT4_4_USFGRO0_VW2_WG16_16_1_WGM1
    SolutionIndex: 17
    SolutionNameMin: Cijk_Ailk_Bjlk_SB_MT64x64x8_SE_DTL0_EPS1_FL0_GRVW4_PGR1_PLR1_TT4_4_USFGRO0_VW2_WG16_16_1_WGM8
    SolutionIndex: 18
    SolutionNameMin: Cijk_Ailk_Bjlk_SB_MT64x64x16_SE_DTL0_EPS1_FL0_GRVW4_PGR1_PLR1_TT4_4_USFGRO0_VW4_WG16_16_1_WGM1
    SolutionIndex: 19
    SolutionNameMin: Cijk_Ailk_Bjlk_SB_MT64x64x16_SE_DTL0_EPS1_FL0_GRVW4_PGR1_PLR1_TT4_4_USFGRO0_VW4_WG16_16_1_WGM8
    SolutionIndex: 20
    SolutionNameMin: Cijk_Ailk_Bjlk_SB_MT64x64x8_SE_DTL0_EPS1_FL1_GRVW2_PGR1_PLR1_TT4_4_USFGRO0_VW2_WG16_16_1_WGM8
    SolutionIndex: 21
    SolutionNameMin: Cijk_Ailk_Bjlk_SB_MT64x64x16_SE_DTL0_EPS1_FL1_GRVW4_PGR1_PLR1_TT4_4_USFGRO0_VW4_WG16_16_1_WGM8
    SolutionIndex: 22
    SolutionNameMin: Cijk_Ailk_Bjlk_SB_MT96x64x8_SE_DTL0_EPS1_FL0_GRVW1_PGR1_PLR1_TT6_4_USFGRO1_VW2_WG16_16_1_WGM1
    SolutionIndex: 23
    SolutionNameMin: Cijk_Ailk_Bjlk_SB_MT96x64x8_SE_DTL0_EPS1_FL0_GRVW1_PGR1_PLR1_TT6_4_USFGRO1_VW2_WG16_16_1_WGM8
    SolutionIndex: 24
    SolutionNameMin: Cijk_Ailk_Bjlk_SB_MT96x64x8_SE_DTL0_EPS1_FL1_GRVW2_PGR1_PLR1_TT6_4_USFGRO0_VW2_WG16_16_1_WGM1
    SolutionIndex: 25
    SolutionNameMin: Cijk_Ailk_Bjlk_SB_MT96x64x8_SE_DTL0_EPS1_FL1_GRVW2_PGR1_PLR1_TT6_4_USFGRO0_VW2_WG16_16_1_WGM8
    SolutionIndex: 26
    SolutionNameMin: Cijk_Ailk_Bjlk_SB_MT64x96x8_SE_DTL0_EPS1_FL0_GRVW1_PGR1_PLR1_TT4_6_USFGRO1_VW2_WG16_16_1_WGM8
    SolutionIndex: 27
    SolutionNameMin: Cijk_Ailk_Bjlk_SB_MT64x96x8_SE_DTL0_EPS1_FL1_GRVW2_PGR1_PLR1_TT4_6_USFGRO0_VW2_WG16_16_1_WGM1
    SolutionIndex: 28
    SolutionNameMin: Cijk_Ailk_Bjlk_SB_MT64x96x8_SE_DTL0_EPS1_FL1_GRVW2_PGR1_PLR1_TT4_6_USFGRO0_VW2_WG16_16_1_WGM8
    SolutionIndex: 29
    SolutionNameMin: Cijk_Ailk_Bjlk_SB_MT64x128x8_SE_DTL0_EPS1_FL0_GRVW1_PGR1_PLR0_TT4_8_USFGRO1_VW4_WG16_16_1_WGM1
    SolutionIndex: 30
    SolutionNameMin: Cijk_Ailk_Bjlk_SB_MT64x128x8_SE_DTL0_EPS1_FL0_GRVW1_PGR1_PLR0_TT4_8_USFGRO1_VW4_WG16_16_1_WGM8
    SolutionIndex: 31
    SolutionNameMin: Cijk_Ailk_Bjlk_SB_MT64x128x8_SE_DTL0_EPS1_FL0_GRVW2_PGR1_PLR0_TT4_8_USFGRO0_VW2_WG16_16_1_WGM1
    SolutionIndex: 32
    SolutionNameMin: Cijk_Ailk_Bjlk_SB_MT64x128x8_SE_DTL0_EPS1_FL0_GRVW2_PGR1_PLR0_TT4_8_USFGRO0_VW2_WG16_16_1_WGM8
    SolutionIndex: 33
    SolutionNameMin: Cijk_Ailk_Bjlk_SB_MT64x128x8_SE_DTL0_EPS1_FL0_GRVW2_PGR1_PLR1_TT4_8_USFGRO0_VW2_WG16_16_1_WGM1
    SolutionIndex: 34
    SolutionNameMin: Cijk_Ailk_Bjlk_SB_MT64x128x8_SE_DTL0_EPS1_FL0_GRVW2_PGR1_PLR1_TT4_8_USFGRO0_VW2_WG16_16_1_WGM8
    SolutionIndex: 35
    SolutionNameMin: Cijk_Ailk_Bjlk_SB_MT64x128x16_SE_DTL0_EPS0_FL0_GRVW4_PGR0_PLR0_TT4_8_USFGRO0_VW4_WG16_16_1_WGM8
    SolutionIndex: 36
    SolutionNameMin: Cijk_Ailk_Bjlk_SB_MT64x128x8_SE_DTL0_EPS1_FL1_GRVW2_PGR1_PLR1_TT4_8_USFGRO0_VW2_WG16_16_1_WGM1
    SolutionIndex: 37
    SolutionNameMin: Cijk_Ailk_Bjlk_SB_MT64x128x8_SE_DTL0_EPS1_FL1_GRVW2_PGR1_PLR1_TT4_8_USFGRO0_VW2_WG16_16_1_WGM8
    SolutionIndex: 38
    SolutionNameMin: Cijk_Ailk_Bjlk_SB_MT128x64x8_SE_DTL0_EPS1_FL0_GRVW1_PGR1_PLR0_TT8_4_USFGRO1_VW4_WG16_16_1_WGM1
    SolutionIndex: 39
    SolutionNameMin: Cijk_Ailk_Bjlk_SB_MT128x64x8_SE_DTL0_EPS1_FL0_GRVW1_PGR1_PLR0_TT8_4_USFGRO1_VW4_WG16_16_1_WGM8
    SolutionIndex: 40
    SolutionNameMin: Cijk_Ailk_Bjlk_SB_MT128x64x8_SE_DTL0_EPS1_FL0_GRVW1_PGR1_PLR1_TT8_4_USFGRO1_VW4_WG16_16_1_WGM8
    SolutionIndex: 41
    SolutionNameMin: Cijk_Ailk_Bjlk_SB_MT128x64x8_SE_DTL0_EPS1_FL0_GRVW2_PGR1_PLR0_TT8_4_USFGRO0_VW2_WG16_16_1_WGM1
    SolutionIndex: 42
    SolutionNameMin: Cijk_Ailk_Bjlk_SB_MT128x64x8_SE_DTL0_EPS1_FL1_GRVW2_PGR1_PLR1_TT8_4_USFGRO0_VW2_WG16_16_1_WGM8
    SolutionIndex: 43
    SolutionNameMin: Cijk_Ailk_Bjlk_SB_MT32x64x16_SE_DTL0_EPS0_FL0_GRVW1_PGR0_PLR1_TT2_4_USFGRO1_VW2_WG16_16_1_WGM1
    SolutionIndex: 44
    SolutionNameMin: Cijk_Ailk_Bjlk_SB_MT32x64x16_SE_DTL0_EPS0_FL0_GRVW1_PGR0_PLR1_TT2_4_USFGRO1_VW2_WG16_16_1_WGM8
    SolutionIndex: 45
    SolutionNameMin: Cijk_Ailk_Bjlk_SB_MT32x64x8_SE_DTL0_EPS1_FL0_GRVW4_PGR1_PLR1_TT2_4_USFGRO0_VW2_WG16_16_1_WGM8
    SolutionIndex: 46
    SolutionNameMin: Cijk_Ailk_Bjlk_SB_MT32x64x16_SE_DTL0_EPS1_FL0_GRVW1_PGR1_PLR1_TT4_4_USFGRO1_VW2_WG8_16_2_WGM1
    SolutionIndex: 47
    SolutionNameMin: Cijk_Ailk_Bjlk_SB_MT32x64x16_SE_DTL0_EPS1_FL0_GRVW1_PGR1_PLR1_TT4_4_USFGRO1_VW4_WG8_16_2_WGM1
    SolutionIndex: 48
    SolutionNameMin: Cijk_Ailk_Bjlk_SB_MT32x32x8_SE_DTL0_EPS1_FL0_GRVW4_PGR1_PLR1_TT2_4_USFGRO1_VW2_WG16_8_2_WGM1
    SolutionIndex: 49
    SolutionNameMin: Cijk_Ailk_Bjlk_SB_MT32x32x16_SE_DTL0_EPS1_FL1_GRVW4_PGR1_PLR1_TT2_4_USFGRO0_VW2_WG16_8_2_WGM1
    SolutionIndex: 50
    SolutionNameMin: Cijk_Ailk_Bjlk_SB_MT64x32x16_SE_DTL0_EPS1_FL0_GRVW1_PGR1_PLR1_TT4_4_USFGRO1_VW4_WG16_8_2_WGM1
    SolutionIndex: 51
    SolutionNameMin: Cijk_Ailk_Bjlk_SB_MT8x32x32_SE_DTL0_EPS1_FL0_GRVW1_PGR1_PLR1_TT2_2_USFGRO1_VW2_WG4_16_4_WGM1
    SolutionIndex: 52
    SolutionNameMin: Cijk_Ailk_Bjlk_SB_MT16x32x32_SE_DTL0_EPS1_FL1_GRVW2_PGR1_PLR1_TT4_2_USFGRO0_VW2_WG4_16_4_WGM1
    SolutionIndex: 53
    SolutionNameMin: Cijk_Ailk_Bjlk_SB_MT16x64x16_SE_DTL0_EPS1_FL0_GRVW4_PGR1_PLR1_TT4_4_USFGRO0_VW4_WG4_16_4_WGM8
    SolutionIndex: 54
    SolutionNameMin: Cijk_Ailk_Bjlk_SB_MT32x16x32_SE_DTL0_EPS1_FL0_GRVW1_PGR1_PLR1_TT2_4_USFGRO1_VW2_WG16_4_4_WGM1
    SolutionIndex: 55
    SolutionNameMin: Cijk_Ailk_Bjlk_SB_MT32x16x16_SE_DTL0_EPS1_FL0_GRVW2_PGR1_PLR1_TT2_4_USFGRO0_VW2_WG16_4_4_WGM1
    SolutionIndex: 56
    SolutionNameMin: Cijk_Ailk_Bjlk_SB_MT64x16x16_SE_DTL0_EPS1_FL0_GRVW4_PGR1_PLR1_TT4_4_USFGRO0_VW4_WG16_4_4_WGM1
    SolutionIndex: 57
    SolutionNameMin: Cijk_Ailk_Bjlk_SB_MT64x16x16_SE_DTL0_EPS1_FL0_GRVW4_PGR1_PLR1_TT4_4_USFGRO0_VW4_WG16_4_4_WGM8
    SolutionIndex: 58
    SolutionNameMin: Cijk_Ailk_Bjlk_SB_MT64x16x32_SE_DTL0_EPS1_FL1_GRVW2_PGR1_PLR1_TT4_4_USFGRO0_VW2_WG16_4_4_WGM1
    SolutionIndex: 59
    SolutionNameMin: Cijk_Ailk_Bjlk_SB_MT64x32x8_SE_DTL0_EPS0_FL0_GRVW1_PGR0_PLR1_TT4_4_USFGRO1_VW4_WG16_8_1_WGM1
    SolutionIndex: 60
    SolutionNameMin: Cijk_Ailk_Bjlk_SB_MT64x32x8_SE_DTL0_EPS0_FL0_GRVW1_PGR0_PLR1_TT4_4_USFGRO1_VW4_WG16_8_1_WGM8
    SolutionIndex: 61
    SolutionNameMin: Cijk_Ailk_Bjlk_SB_MT64x32x16_SE_DTL0_EPS0_FL0_GRVW2_PGR0_PLR1_TT4_4_USFGRO0_VW2_WG16_8_1_WGM8
    SolutionIndex: 62
    SolutionNameMin: Cijk_Ailk_Bjlk_SB_MT64x64x8_SE_DTL0_EPS1_FL0_GRVW1_PGR1_PLR0_TT4_8_USFGRO1_VW2_WG16_8_1_WGM1
    SolutionIndex: 63
    SolutionNameMin: Cijk_Ailk_Bjlk_SB_MT64x64x8_SE_DTL0_EPS1_FL0_GRVW1_PGR1_PLR0_TT4_8_USFGRO1_VW4_WG16_8_1_WGM1
    SolutionIndex: 64
    SolutionNameMin: Cijk_Ailk_Bjlk_SB_MT64x64x8_SE_DTL0_EPS1_FL0_GRVW1_PGR1_PLR0_TT4_8_USFGRO1_VW4_WG16_8_1_WGM8
    SolutionIndex: 65
    SolutionNameMin: Cijk_Ailk_Bjlk_SB_MT64x64x8_SE_DTL0_EPS1_FL0_GRVW4_PGR1_PLR0_TT4_8_USFGRO0_VW4_WG16_8_1_WGM1
    SolutionIndex: 66
    SolutionNameMin: Cijk_Ailk_Bjlk_SB_MT64x64x8_SE_DTL0_EPS1_FL0_GRVW4_PGR1_PLR0_TT4_8_USFGRO0_VW4_WG16_8_1_WGM8
    SolutionIndex: 67
    SolutionNameMin: Cijk_Ailk_Bjlk_SB_MT64x64x8_SE_DTL0_EPS1_FL1_GRVW4_PGR1_PLR0_TT4_8_USFGRO0_VW4_WG16_8_1_WGM8
    SolutionIndex: 68
    SolutionNameMin: Cijk_Ailk_Bjlk_SB_MT64x64x8_SE_DTL0_EPS1_FL1_GRVW4_PGR1_PLR1_TT4_8_USFGRO0_VW4_WG16_8_1_WGM8
    SolutionIndex: 69
    SolutionNameMin: Cijk_Ailk_Bjlk_SB_MT128x32x8_SE_DTL1_EPS0_FL0_GRVW1_PGR0_PLR1_TT8_4_USFGRO1_VW4_WG16_8_1_WGM8
    SolutionIndex: 70
    SolutionNameMin: Cijk_Ailk_Bjlk_SB_MT32x64x16_SE_DTL0_EPS0_FL0_GRVW2_PGR0_PLR1_TT4_4_USFGRO0_VW2_WG8_16_1_WGM8
    SolutionIndex: 71
    SolutionNameMin: Cijk_Ailk_Bjlk_SB_MT32x64x8_SE_DTL0_EPS1_FL1_GRVW2_PGR1_PLR1_TT4_4_USFGRO0_VW2_WG8_16_1_WGM1
    SolutionIndex: 72
    SolutionNameMin: Cijk_Ailk_Bjlk_SB_MT32x64x16_SE_DTL0_EPS0_FL1_GRVW2_PGR0_PLR1_TT4_4_USFGRO0_VW2_WG8_16_1_WGM1
    SolutionIndex: 73
    SolutionNameMin: Cijk_Ailk_Bjlk_SB_MT32x128x8_SE_DTL1_EPS0_FL0_GRVW1_PGR0_PLR1_TT4_8_USFGRO1_VW4_WG8_16_1_WGM1
    SolutionIndex: 74
    SolutionNameMin: Cijk_Ailk_Bjlk_SB_MT64x64x8_SE_DTL0_EPS1_FL0_GRVW4_PGR1_PLR0_TT8_4_USFGRO0_VW4_WG8_16_1_WGM1
    SolutionIndex: 75
    SolutionNameMin: Cijk_Ailk_Bjlk_SB_MT64x64x8_SE_DTL0_EPS1_FL0_GRVW4_PGR1_PLR0_TT8_4_USFGRO0_VW4_WG8_16_1_WGM8
    SolutionIndex: 76
    SolutionNameMin: Cijk_Ailk_Bjlk_SB_MT64x64x8_SE_DTL0_EPS1_FL1_GRVW4_PGR1_PLR0_TT8_4_USFGRO0_VW4_WG8_16_1_WGM1
    SolutionIndex: 77
    SolutionNameMin: Cijk_Ailk_Bjlk_SB_MT64x128x8_SE_DTL0_EPS1_FL1_GRVW2_PGR1_PLR1_TT8_8_USFGRO0_VW2_WG8_16_1_WGM8
    SolutionIndex: 78
    SolutionNameMin: Cijk_Ailk_Bjlk_SB_MT64x128x8_SE_DTL0_EPS1_FL1_GRVW4_PGR1_PLR0_TT8_8_USFGRO0_VW4_WG8_16_1_WGM8
- - - [196, 528, 32, 32, 196, 196, 196, 528]
    - [13, 4088.41]
  - - [5329, 64, 32, 80, 5329, 5329, 5329, 64]
    - [6, 8331.14]
  - - [64, 2880, 1, 320, 64, 64, 64, 2880]
    - [57, 4362.6]
  - - [49, 832, 32, 256, 49, 49, 49, 832]
    - [20, 5618.63]
  - - [3136, 64, 64, 64, 3136, 3136, 3136, 64]
    - [6, 8457.65]
  - - [196, 512, 32, 24, 196, 196, 196, 512]
    - [7, 3621.73]
  - - [289, 1120, 1, 160, 289, 289, 289, 1120]
    - [3, 3302.86]
  - - [1225, 192, 32, 32, 1225, 1225, 1225, 192]
    - [11, 6194.57]
  - - [64, 2048, 32, 384, 64, 64, 64, 2048]
    - [34, 9541.54]
  - - [1001, 1536, 1, 32, 1001, 1001, 1001, 1536]
    - [5, 3575.67]
  - - [289, 1792, 1, 320, 289, 289, 289, 1792]
    - [28, 5140.33]
  - - [3136, 256, 64, 64, 3136, 3136, 3136, 256]
    - [29, 9310.12]
  - - [1001, 1024, 1, 32, 1001, 1001, 1001, 1024]
    - [0, 2733.4]
  - - [196, 480, 32, 64, 196, 196, 196, 480]
    - [61, 5070.42]
  - - [64, 1728, 1, 320, 64, 64, 64, 1728]
    - [58, 3205.57]
  - - [49, 832, 32, 160, 49, 49, 49, 832]
    - [62, 4988.82]
  - - [49, 2048, 64, 512, 49, 49, 49, 2048]
    - [32, 7370.31]
  - - [49, 832, 32, 384, 49, 49, 49, 832]
    - [20, 5901.95]
  - - [289, 896, 1, 192, 289, 289, 289, 896]
    - [46, 3452.59]
  - - [289, 1024, 32, 384, 289, 289, 289, 1024]
    - [65, 8902.42]
  - - [784, 192, 32, 96, 784, 784, 784, 192]
    - [76, 7853.63]
  - - [50176, 256, 1, 128, 50176, 50176, 50176, 256]
    - [39, 9041.83]
  - - [196, 800, 1, 128, 196, 196, 196, 800]
    - [53, 2220.18]
  - - [289, 1024, 32, 256, 289, 289, 289, 1024]
    - [74, 8660.72]
  - - [289, 1024, 32, 192, 289, 289, 289, 1024]
    - [63, 8433.35]
  - - [12544, 512, 1, 256, 12544, 12544, 12544, 512]
    - [23, 9187.34]
  - - [1225, 1728, 1, 192, 1225, 1225, 1225, 1728]
    - [27, 7720.85]
  - - [196, 480, 32, 96, 196, 196, 196, 480]
    - [72, 5662.5]
  - - [196, 512, 32, 144, 196, 196, 196, 512]
    - [66, 6531.38]
  - - [784, 400, 1, 32, 784, 784, 784, 400]
    - [1, 1280.0]
  - - [289, 768, 32, 128, 289, 289, 289, 768]
    - [67, 7913.61]
  - - [5329, 576, 1, 96, 5329, 5329, 5329, 576]
    - [10, 7563.46]
  - - [49, 1200, 1, 128, 49, 49, 49, 1200]
    - [54, 1011.61]
  - - [64, 1536, 32, 256, 64, 64, 64, 1536]
    - [68, 9159.54]
  - - [289, 2592, 1, 384, 289, 289, 289, 2592]
    - [36, 6002.71]
  - - [289, 864, 1, 96, 289, 289, 289, 864]
    - [50, 2436.06]
  - - [196, 528, 32, 128, 196, 196, 196, 528]
    - [71, 5987.1]
  - - [64, 2048, 32, 448, 64, 64, 64, 2048]
    - [34, 9669.87]
  - - [196, 1024, 64, 256, 196, 196, 196, 1024]
    - [73, 7818.94]
  - - [5329, 448, 1, 64, 5329, 5329, 5329, 448]
    - [6, 6201.02]
  - - [784, 256, 32, 64, 784, 784, 784, 256]
    - [8, 7623.18]
  - - [784, 192, 32, 32, 784, 784, 784, 192]
    - [13, 5874.26]
  - - [21609, 288, 1, 32, 21609, 21609, 21609, 288]
    - [26, 5296.5]
  - - [784, 256, 32, 32, 784, 784, 784, 256]
    - [4, 6235.46]
  - - [5041, 720, 1, 192, 5041, 5041, 5041, 720]
    - [22, 8140.98]
  - - [289, 2016, 1, 256, 289, 289, 289, 2016]
    - [19, 5404.05]
  - - [196, 512, 32, 128, 196, 196, 196, 512]
    - [64, 6366.82]
  - - [289, 768, 32, 160, 289, 289, 289, 768]
    - [66, 8253.88]
  - - [64, 1536, 32, 384, 64, 64, 64, 1536]
    - [37, 9508.5]
  - - [64, 1280, 32, 320, 64, 64, 64, 1280]
    - [37, 9070.73]
  - - [289, 896, 1, 128, 289, 289, 289, 896]
    - [47, 2917.68]
  - - [289, 3456, 1, 384, 289, 289, 289, 3456]
    - [27, 7274.91]
  - - [196, 800, 1, 64, 196, 196, 196, 800]
    - [49, 1393.78]
  - - [64, 1280, 32, 384, 64, 64, 64, 1280]
    - [33, 9225.01]
  - - [64, 1344, 1, 512, 64, 64, 64, 1344]
    - [52, 3041.45]
  - - [1001, 4096, 1, 512, 1001, 1001, 1001, 4096]
    - [33, 9391.77]
  - - [1225, 192, 32, 64, 1225, 1225, 1225, 192]
    - [6, 7729.29]
  - - [64, 1152, 1, 384, 64, 64, 64, 1152]
    - [56, 2440.65]
  - - [729, 1600, 1, 192, 729, 729, 729, 1600]
    - [18, 6827.71]
  - - [289, 1344, 1, 192, 289, 289, 289, 1344]
    - [16, 4439.04]
  - - [784, 192, 32, 16, 784, 784, 784, 192]
    - [43, 3663.04]
  - - [196, 256, 64, 1024, 196, 196, 196, 256]
    - [78, 7583.8]
  - - [3136, 1024, 1, 2048, 3136, 3136, 3136, 1024]
    - [25, 9071.77]
  - - [64, 1152, 1, 448, 64, 64, 64, 1152]
    - [53, 2564.45]
  - - [49, 832, 32, 128, 49, 49, 49, 832]
    - [16, 4733.16]
  - - [784, 256, 32, 128, 784, 784, 784, 256]
    - [29, 8471.6]
  - - [784, 800, 1, 96, 784, 784, 784, 800]
    - [14, 4228.31]
  - - [49, 800, 1, 128, 49, 49, 49, 800]
    - [51, 633.535]
  - - [196, 512, 32, 32, 196, 196, 196, 512]
    - [13, 4354.26]
  - - [1225, 384, 32, 96, 1225, 1225, 1225, 384]
    - [30, 8751.63]
  - - [5041, 576, 1, 96, 5041, 5041, 5041, 576]
    - [12, 7067.63]
  - - [49, 832, 32, 48, 49, 49, 49, 832]
    - [45, 3316.72]
  - - [64, 1536, 1, 256, 64, 64, 64, 1536]
    - [56, 2621.44]
  - - [3136, 64, 64, 256, 3136, 3136, 3136, 64]
    - [67, 9721.9]
  - - [5329, 160, 32, 64, 5329, 5329, 5329, 160]
    - [69, 8159.84]
  - - [1225, 288, 32, 48, 1225, 1225, 1225, 288]
    - [59, 6673.65]
  - - [4096, 9216, 1, 512, 4096, 4096, 4096, 9216]
    - [41, 10116.9]
  - - [196, 480, 32, 192, 196, 196, 196, 480]
    - [70, 6388.46]
  - - [64, 1152, 1, 256, 64, 64, 64, 1152]
    - [57, 1982.6]
  - - [3136, 1024, 1, 512, 3136, 3136, 3136, 1024]
    - [25, 8745.57]
  - - [49, 832, 32, 32, 49, 49, 49, 832]
    - [44, 2717.87]
  - - [784, 192, 32, 64, 784, 784, 784, 192]
    - [8, 7216.32]
  - - [289, 1024, 32, 128, 289, 289, 289, 1024]
    - [31, 7970.5]
  - - [289, 768, 32, 192, 289, 289, 289, 768]
    - [75, 8327.27]
  - - [289, 1120, 1, 192, 289, 289, 289, 1120]
    - [15, 3716.9]
  - - [196, 512, 32, 112, 196, 196, 196, 512]
    - [21, 6252.81]
  - - [1001, 2048, 1, 32, 1001, 1001, 1001, 2048]
    - [9, 4000.09]
  - - [1225, 288, 32, 64, 1225, 1225, 1225, 288]
    - [69, 7208.04]
  - - [196, 600, 1, 64, 196, 196, 196, 600]
    - [48, 1093.95]
  - - [1225, 384, 32, 192, 1225, 1225, 1225, 384]
    - [30, 9332.66]
  - - [50176, 256, 1, 512, 50176, 50176, 50176, 256]
    - [40, 9833.54]
  - - [196, 512, 32, 160, 196, 196, 196, 512]
    - [67, 6614.34]
  - - [4096, 4096, 1, 512, 4096, 4096, 4096, 4096]
    - [38, 10032.2]
  - - [49, 832, 32, 192, 49, 49, 49, 832]
    - [16, 5244.53]
  - - [1225, 256, 32, 64, 1225, 1225, 1225, 256]
    - [6, 7972.35]
  - - [289, 1344, 1, 224, 289, 289, 289, 1344]
    - [14, 4627.94]
  - - [64, 2048, 32, 320, 64, 64, 64, 2048]
    - [34, 9404.27]
  - - [289, 1568, 1, 224, 289, 289, 289, 1568]
    - [17, 5308.89]
  - - [196, 480, 32, 16, 196, 196, 196, 480]
    - [60, 2724.49]
  - - [1225, 256, 32, 48, 1225, 1225, 1225, 256]
    - [8, 7100.38]
  - - [64, 1280, 32, 448, 64, 64, 64, 1280]
    - [33, 9344.41]
  - - [1225, 1200, 1, 64, 1225, 1225, 1225, 1200]
    - [2, 5157.89]
  - - [1225, 384, 32, 64, 1225, 1225, 1225, 384]
    - [6, 8219.96]
  - - [12544, 512, 1, 1024, 12544, 12544, 12544, 512]
    - [25, 9672.72]
  - - [196, 400, 1, 48, 196, 196, 196, 400]
    - [55, 644.384]
  - - [64, 1280, 32, 192, 64, 64, 64, 1280]
    - [21, 8525.01]
  - - [196, 512, 32, 64, 196, 196, 196, 512]
    - [6, 5489.34]
  - - [289, 1792, 1, 256, 289, 289, 289, 1792]
    - [24, 4831.61]
  - - [196, 528, 32, 256, 196, 196, 196, 528]
    - [42, 6453.82]
  - - [49, 512, 64, 2048, 49, 49, 49, 512]
    - [77, 7548.98]
  - - [289, 1568, 1, 256, 289, 289, 289, 1568]
    - [20, 5577.26]
  - - [3136, 64, 32, 64, 3136, 3136, 3136, 64]
    - [8, 7773.1]
  - - [64, 2048, 32, 192, 64, 64, 64, 2048]
    - [29, 8955.81]
  - - [784, 512, 64, 128, 784, 784, 784, 512]
    - [29, 9160.73]
  - - [784, 128, 64, 512, 784, 784, 784, 128]
    - [36, 9280.69]
  - - [196, 528, 32, 160, 196, 196, 196, 528]
    - [70, 6161.15]
  - - [1225, 192, 32, 48, 1225, 1225, 1225, 192]
    - [6, 7236.92]
  - - [1001, 2048, 1, 64, 1001, 1001, 1001, 2048]
    - [35, 5559.45]
  - - [64, 1728, 1, 192, 64, 64, 64, 1728]
    - [56, 2480.57]
- null
