Tensile/Configs/miopen/archives/resnet50/2018-10-09/logic/resnet50/vega20_Cijk_Ailk_Bljk_SB.yaml
- {MinimumRequiredVersion: 4.5.0}
- vega20
- gfx906
- [Device 66a0, Device 66a1, Device 66a7]
    SolutionIndex: 0
    SolutionNameMin: Cijk_Ailk_Bljk_SB_MT128x064x08_DTL0_GRVW01_GSU08_PGR1_PLR1_TT08_04_USFGRO01_VW01_WG16_16_01_WGM01
    SolutionIndex: 1
    SolutionNameMin: Cijk_Ailk_Bljk_SB_MT256x032x08_DTL1_GRVW01_GSU04_PGR0_PLR1_TT08_04_USFGRO01_VW01_WG32_08_01_WGM08
    SolutionIndex: 2
    SolutionNameMin: Cijk_Ailk_Bljk_SB_MT064x064x08_DTL0_GRVW01_GSU01_PGR1_PLR1_TT04_08_USFGRO01_VW04_WG16_08_01_WGM01
    SolutionIndex: 3
    SolutionNameMin: Cijk_Ailk_Bljk_SB_MT128x064x08_DTL0_GRVW01_GSU01_PGR1_PLR1_TT08_04_USFGRO01_VW04_WG16_16_01_WGM01
    SolutionIndex: 4
    SolutionNameMin: Cijk_Ailk_Bljk_SB_MT128x064x08_DTL0_GRVW01_GSU01_PGR1_PLR1_TT04_08_USFGRO01_VW04_WG32_08_01_WGM01
    SolutionIndex: 5
    SolutionNameMin: Cijk_Ailk_Bljk_SB_MT128x064x08_DTL0_GRVW01_GSU01_PGR1_PLR1_TT08_04_USFGRO01_VW04_WG16_16_01_WGM08
    SolutionIndex: 6
    SolutionNameMin: Cijk_Ailk_Bljk_SB_MT256x032x08_DTL1_GRVW01_GSU01_PGR0_PLR1_TT08_04_USFGRO01_VW04_WG32_08_01_WGM08
    SolutionIndex: 7
    SolutionNameMin: Cijk_Ailk_Bljk_SB_MT128x064x16_DTL0_GRVW01_GSU01_PGR1_PLR1_TT08_04_USFGRO01_VW04_WG16_16_01_WGM01
- - - [3136, 64, 128, 64]
    - [3, 8110.53]
  - - [784, 512, 64, 128]
    - [2, 8186.45]
  - - [3136, 256, 64, 64]
    - [3, 8454.17]
  - - [784, 128, 128, 512]
    - [3, 7562.87]
  - - [784, 128, 64, 512]
    - [7, 7073.52]
  - - [3136, 512, 1, 2048]
    - [0, 7420.87]
  - - [12544, 256, 1, 1024]
    - [1, 7416.85]
  - - [3136, 64, 128, 256]
    - [4, 8912.43]
  - - [3136, 64, 64, 256]
    - [4, 8862.48]
  - - [3136, 2048, 1, 512]
    - [6, 8335.87]
  - - [784, 512, 128, 128]
    - [2, 8322.36]
  - - [3136, 64, 64, 64]
    - [3, 7850.3]
  - - [12544, 1024, 1, 256]
    - [5, 9004.2]
  - - [3136, 256, 128, 64]
    - [4, 8561.58]
- null
