Tensile/Configs/miopen/archives/resnet50/2018-10-09/logic/resnet50/vega20_Cijk_Ailk_Bjlk_HB.yaml
- {MinimumRequiredVersion: 4.5.0}
- vega20
- gfx906
- [Device 66a0, Device 66a1, Device 66a7]
    SolutionIndex: 0
    SolutionNameMin: Cijk_Ailk_Bjlk_HB_MT128x064x08_GSU01_PGR1_PLR1_TT08_08_WG16_08_01_WGM01
    SolutionIndex: 1
    SolutionNameMin: Cijk_Ailk_Bjlk_HB_MT064x256x08_GSU01_PGR1_PLR1_TT08_08_WG08_32_01_WGM01
    SolutionIndex: 2
    SolutionNameMin: Cijk_Ailk_Bjlk_HB_MT256x064x08_GSU01_PGR1_PLR1_TT08_08_WG32_08_01_WGM01
    SolutionIndex: 3
    SolutionNameMin: Cijk_Ailk_Bjlk_HB_MT128x064x08_GSU01_PGR1_PLR1_TT08_08_WG16_08_01_WGM08
    SolutionIndex: 4
    SolutionNameMin: Cijk_Ailk_Bjlk_HB_MT128x128x16_GSU01_PGR1_PLR1_TT08_08_WG16_16_01_WGM01
    SolutionIndex: 5
    SolutionNameMin: Cijk_Ailk_Bjlk_HB_MT128x128x16_GSU01_PGR1_PLR1_TT08_08_WG16_16_01_WGM64
- - - [3136, 256, 64, 64]
    - [1, 17894.7]
  - - [784, 512, 64, 128]
    - [1, 17336.2]
  - - [784, 128, 128, 512]
    - [4, 17550.9]
  - - [3136, 64, 128, 64]
    - [0, 16468.0]
  - - [196, 256, 128, 1024]
    - [4, 15123.0]
  - - [196, 256, 64, 1024]
    - [5, 14468.2]
  - - [196, 1024, 128, 256]
    - [1, 14971.5]
  - - [3136, 64, 64, 256]
    - [2, 18004.5]
  - - [3136, 64, 128, 256]
    - [3, 18469.6]
  - - [784, 128, 64, 512]
    - [4, 17041.5]
  - - [784, 512, 128, 128]
    - [1, 17809.4]
  - - [196, 1024, 64, 256]
    - [1, 14716.9]
  - - [3136, 64, 64, 64]
    - [2, 15429.5]
  - - [3136, 256, 128, 64]
    - [1, 18252.3]
- null
