src/Tensile/data/Configs/miopen/archives/resnet/2019-08-26/exact/vega20_Cijk_Ailk_Bljk_SB.yaml
- {MinimumRequiredVersion: 4.10.0}
- vega20
- gfx906
- [Device 66a0, Device 66a1, Device 66a7, Vega 20]
    SolutionIndex: 0
    SolutionNameMin: Cijk_Ailk_Bljk_SB_MT64x64x8_SE_EPS1_FL0_GRVW1_GSU1_LPB4_PGR1_PLR1_TT4_4_USFGRO1_VW4_WG16_16_1_WGM1
    SolutionIndex: 1
    SolutionNameMin: Cijk_Ailk_Bljk_SB_MT64x64x8_SE_EPS1_FL0_GRVW1_GSU1_LPB4_PGR1_PLR1_TT4_4_USFGRO1_VW4_WG16_16_1_WGM8
    SolutionIndex: 2
    SolutionNameMin: Cijk_Ailk_Bljk_SB_MT64x64x16_SE_EPS0_FL0_GRVW1_GSU1_LPB4_PGR0_PLR1_TT4_4_USFGRO1_VW4_WG16_16_1_WGM8
    SolutionIndex: 3
    SolutionNameMin: Cijk_Ailk_Bljk_SB_MT64x64x16_SE_EPS1_FL0_GRVW4_GSU1_LPB0_PGR1_PLR1_TT4_4_USFGRO0_VW4_WG16_16_1_WGM1
    SolutionIndex: 4
    SolutionNameMin: Cijk_Ailk_Bljk_SB_MT64x64x16_SE_EPS1_FL0_GRVW4_GSU1_LPB0_PGR1_PLR1_TT4_4_USFGRO0_VW4_WG16_16_1_WGM8
    SolutionIndex: 5
    SolutionNameMin: Cijk_Ailk_Bljk_SB_MT64x64x16_SE_EPS0_FL0_GRVW4_GSU1_LPB4_PGR0_PLR1_TT4_4_USFGRO0_VW4_WG16_16_1_WGM1
    SolutionIndex: 6
    SolutionNameMin: Cijk_Ailk_Bljk_SB_MT64x64x16_SE_EPS1_FL0_GRVW4_GSU1_LPB4_PGR1_PLR1_TT4_4_USFGRO0_VW4_WG16_16_1_WGM8
    SolutionIndex: 7
    SolutionNameMin: Cijk_Ailk_Bljk_SB_MT64x64x8_SE_EPS1_FL1_GRVW2_GSU1_LPB2_PGR1_PLR1_TT4_4_USFGRO0_VW2_WG16_16_1_WGM1
    SolutionIndex: 8
    SolutionNameMin: Cijk_Ailk_Bljk_SB_MT64x64x16_SE_EPS1_FL1_GRVW4_GSU1_LPB0_PGR1_PLR1_TT4_4_USFGRO0_VW4_WG16_16_1_WGM1
    SolutionIndex: 9
    SolutionNameMin: Cijk_Ailk_Bljk_SB_MT64x64x16_SE_EPS1_FL1_GRVW4_GSU1_LPB0_PGR1_PLR1_TT4_4_USFGRO0_VW4_WG16_16_1_WGM8
    SolutionIndex: 10
    SolutionNameMin: Cijk_Ailk_Bljk_SB_MT64x128x8_SE_EPS1_FL0_GRVW1_GSU1_LPB4_PGR1_PLR0_TT4_8_USFGRO1_VW4_WG16_16_1_WGM1
    SolutionIndex: 11
    SolutionNameMin: Cijk_Ailk_Bljk_SB_MT64x128x8_SE_EPS1_FL0_GRVW1_GSU1_LPB4_PGR1_PLR0_TT4_8_USFGRO1_VW4_WG16_16_1_WGM8
    SolutionIndex: 12
    SolutionNameMin: Cijk_Ailk_Bljk_SB_MT64x128x16_SE_EPS0_FL0_GRVW1_GSU1_LPB4_PGR0_PLR1_TT4_8_USFGRO1_VW4_WG16_16_1_WGM8
    SolutionIndex: 13
    SolutionNameMin: Cijk_Ailk_Bljk_SB_MT64x128x8_SE_EPS1_FL0_GRVW4_GSU1_LPB0_PGR1_PLR1_TT4_8_USFGRO0_VW2_WG16_16_1_WGM1
    SolutionIndex: 14
    SolutionNameMin: Cijk_Ailk_Bljk_SB_MT128x64x8_SE_EPS1_FL0_GRVW2_GSU1_LPB0_PGR1_PLR1_TT8_4_USFGRO0_VW2_WG16_16_1_WGM1
    SolutionIndex: 15
    SolutionNameMin: Cijk_Ailk_Bljk_SB_MT128x64x16_SE_EPS0_FL0_GRVW2_GSU1_LPB0_PGR0_PLR1_TT8_4_USFGRO0_VW2_WG16_16_1_WGM1
    SolutionIndex: 16
    SolutionNameMin: Cijk_Ailk_Bljk_SB_MT128x64x8_SE_EPS1_FL0_GRVW4_GSU1_LPB0_PGR1_PLR0_TT8_4_USFGRO0_VW4_WG16_16_1_WGM1
    SolutionIndex: 17
    SolutionNameMin: Cijk_Ailk_Bljk_SB_MT128x64x8_SE_EPS1_FL0_GRVW4_GSU1_LPB0_PGR1_PLR1_TT8_4_USFGRO0_VW4_WG16_16_1_WGM1
    SolutionIndex: 18
    SolutionNameMin: Cijk_Ailk_Bljk_SB_MT128x64x8_SE_EPS1_FL0_GRVW4_GSU1_LPB0_PGR1_PLR1_TT8_4_USFGRO0_VW4_WG16_16_1_WGM8
    SolutionIndex: 19
    SolutionNameMin: Cijk_Ailk_Bljk_SB_MT128x64x8_SE_EPS1_FL0_GRVW4_GSU1_LPB4_PGR1_PLR0_TT8_4_USFGRO0_VW4_WG16_16_1_WGM1
    SolutionIndex: 20
    SolutionNameMin: Cijk_Ailk_Bljk_SB_MT128x64x8_SE_EPS1_FL0_GRVW4_GSU1_LPB4_PGR1_PLR1_TT8_4_USFGRO0_VW4_WG16_16_1_WGM1
    SolutionIndex: 21
    SolutionNameMin: Cijk_Ailk_Bljk_SB_MT128x64x16_SE_EPS1_FL0_GRVW4_GSU1_LPB4_PGR1_PLR1_TT8_4_USFGRO0_VW4_WG16_16_1_WGM8
    SolutionIndex: 22
    SolutionNameMin: Cijk_Ailk_Bljk_SB_MT128x64x8_SE_EPS1_FL1_GRVW2_GSU1_LPB0_PGR1_PLR1_TT8_4_USFGRO0_VW2_WG16_16_1_WGM1
    SolutionIndex: 23
    SolutionNameMin: Cijk_Ailk_Bljk_SB_MT128x64x8_SE_EPS1_FL1_GRVW2_GSU1_LPB0_PGR1_PLR1_TT8_4_USFGRO0_VW2_WG16_16_1_WGM8
    SolutionIndex: 24
    SolutionNameMin: Cijk_Ailk_Bljk_SB_MT128x64x8_SE_EPS1_FL1_GRVW4_GSU1_LPB0_PGR1_PLR1_TT8_4_USFGRO0_VW4_WG16_16_1_WGM1
    SolutionIndex: 25
    SolutionNameMin: Cijk_Ailk_Bljk_SB_MT128x64x8_SE_EPS1_FL1_GRVW4_GSU1_LPB0_PGR1_PLR1_TT8_4_USFGRO0_VW4_WG16_16_1_WGM8
    SolutionIndex: 26
    SolutionNameMin: Cijk_Ailk_Bljk_SB_MT128x64x8_SE_EPS1_FL1_GRVW4_GSU1_LPB4_PGR1_PLR1_TT8_4_USFGRO0_VW4_WG16_16_1_WGM1
    SolutionIndex: 27
    SolutionNameMin: Cijk_Ailk_Bljk_SB_MT128x128x8_SE_EPS1_FL0_GRVW1_GSU1_LPB0_PGR1_PLR1_TT8_8_USFGRO1_VW4_WG16_16_1_WGM8
    SolutionIndex: 28
    SolutionNameMin: Cijk_Ailk_Bljk_SB_MT128x128x8_SE_EPS1_FL0_GRVW2_GSU1_LPB0_PGR1_PLR1_TT8_8_USFGRO0_VW2_WG16_16_1_WGM8
    SolutionIndex: 29
    SolutionNameMin: Cijk_Ailk_Bljk_SB_MT128x128x8_SE_EPS1_FL1_GRVW2_GSU1_LPB0_PGR1_PLR0_TT8_8_USFGRO0_VW2_WG16_16_1_WGM1
    SolutionIndex: 30
    SolutionNameMin: Cijk_Ailk_Bljk_SB_MT128x128x8_SE_EPS1_FL1_GRVW4_GSU1_LPB0_PGR1_PLR1_TT8_8_USFGRO0_VW4_WG16_16_1_WGM8
    SolutionIndex: 31
    SolutionNameMin: Cijk_Ailk_Bljk_SB_MT64x32x8_SE_EPS1_FL0_GRVW4_GSU1_LPB4_PGR1_PLR0_TT4_4_USFGRO0_VW4_WG16_8_1_WGM8
    SolutionIndex: 32
    SolutionNameMin: Cijk_Ailk_Bljk_SB_MT64x32x8_SE_EPS1_FL1_GRVW4_GSU1_LPB4_PGR1_PLR0_TT4_4_USFGRO0_VW4_WG16_8_1_WGM1
    SolutionIndex: 33
    SolutionNameMin: Cijk_Ailk_Bljk_SB_MT64x32x8_SE_EPS0_FL1_GRVW4_GSU1_LPB4_PGR0_PLR1_TT4_4_USFGRO0_VW4_WG16_8_1_WGM1
    SolutionIndex: 34
    SolutionNameMin: Cijk_Ailk_Bljk_SB_MT64x16x8_SE_EPS1_FL0_GRVW2_GSU1_LPB2_PGR1_PLR1_TT4_2_USFGRO0_VW2_WG16_8_1_WGM1
    SolutionIndex: 35
    SolutionNameMin: Cijk_Ailk_Bljk_SB_MT64x64x8_SE_EPS1_FL0_GRVW4_GSU1_LPB0_PGR1_PLR0_TT4_8_USFGRO0_VW4_WG16_8_1_WGM8
    SolutionIndex: 36
    SolutionNameMin: Cijk_Ailk_Bljk_SB_MT64x64x8_SE_EPS1_FL1_GRVW2_GSU1_LPB0_PGR1_PLR0_TT4_8_USFGRO0_VW2_WG16_8_1_WGM8
    SolutionIndex: 37
    SolutionNameMin: Cijk_Ailk_Bljk_SB_MT128x32x8_SE_EPS0_FL0_GRVW1_GSU1_LPB2_PGR0_PLR1_TT8_4_USFGRO1_VW2_WG16_8_1_WGM8
    SolutionIndex: 38
    SolutionNameMin: Cijk_Ailk_Bljk_SB_MT128x32x8_SE_EPS0_FL0_GRVW1_GSU1_LPB4_PGR0_PLR1_TT8_4_USFGRO1_VW4_WG16_8_1_WGM1
    SolutionIndex: 39
    SolutionNameMin: Cijk_Ailk_Bljk_SB_MT128x32x8_SE_EPS0_FL0_GRVW1_GSU1_LPB4_PGR0_PLR1_TT8_4_USFGRO1_VW4_WG16_8_1_WGM8
    SolutionIndex: 40
    SolutionNameMin: Cijk_Ailk_Bljk_SB_MT96x64x16_SE_EPS0_FL0_GRVW2_GSU1_LPB0_PGR0_PLR0_TT6_4_USFGRO0_VW2_WG16_16_1_WGM1
    SolutionIndex: 41
    SolutionNameMin: Cijk_Ailk_Bljk_SB_MT96x64x16_SE_EPS1_FL0_GRVW2_GSU1_LPB0_PGR1_PLR1_TT6_4_USFGRO0_VW2_WG16_16_1_WGM1
    SolutionIndex: 42
    SolutionNameMin: Cijk_Ailk_Bljk_SB_MT96x64x8_SE_EPS1_FL1_GRVW2_GSU1_LPB0_PGR1_PLR1_TT6_4_USFGRO0_VW2_WG16_16_1_WGM1
    SolutionIndex: 43
    SolutionNameMin: Cijk_Ailk_Bljk_SB_MT96x64x8_SE_EPS1_FL1_GRVW2_GSU1_LPB0_PGR1_PLR1_TT6_4_USFGRO0_VW2_WG16_16_1_WGM8
    SolutionIndex: 44
    SolutionNameMin: Cijk_Ailk_Bljk_SB_MT64x96x8_SE_EPS1_FL1_GRVW2_GSU1_LPB0_PGR1_PLR1_TT4_6_USFGRO0_VW2_WG16_16_1_WGM8
    SolutionIndex: 45
    SolutionNameMin: Cijk_Ailk_Bljk_SB_MT64x96x8_SE_EPS1_FL1_GRVW4_GSU1_LPB0_PGR1_PLR1_TT4_6_USFGRO0_VW2_WG16_16_1_WGM8
    SolutionIndex: 46
    SolutionNameMin: Cijk_Ailk_Bljk_SB_MT64x32x16_SE_EPS1_FL0_GRVW4_GSU1_LPB4_PGR1_PLR1_TT4_4_USFGRO0_VW4_WG16_8_2_WGM1
    SolutionIndex: 47
    SolutionNameMin: Cijk_Ailk_Bljk_SB_MT64x32x16_SE_EPS1_FL1_GRVW4_GSU1_LPB4_PGR1_PLR1_TT4_4_USFGRO0_VW4_WG16_8_2_WGM1
    SolutionIndex: 48
    SolutionNameMin: Cijk_Ailk_Bljk_SB_MT8x32x32_SE_EPS1_FL0_GRVW1_GSU1_LPB2_PGR1_PLR1_TT2_2_USFGRO1_VW2_WG4_16_4_WGM1
    SolutionIndex: 49
    SolutionNameMin: Cijk_Ailk_Bljk_SB_MT8x32x32_SE_EPS1_FL0_GRVW2_GSU1_LPB2_PGR1_PLR1_TT2_2_USFGRO1_VW2_WG4_16_4_WGM8
    SolutionIndex: 50
    SolutionNameMin: Cijk_Ailk_Bljk_SB_MT8x32x32_SE_EPS1_FL0_GRVW4_GSU1_LPB2_PGR1_PLR1_TT2_2_USFGRO1_VW2_WG4_16_4_WGM1
    SolutionIndex: 51
    SolutionNameMin: Cijk_Ailk_Bljk_SB_MT8x32x32_SE_EPS1_FL0_GRVW4_GSU1_LPB2_PGR1_PLR1_TT2_2_USFGRO1_VW2_WG4_16_4_WGM8
    SolutionIndex: 52
    SolutionNameMin: Cijk_Ailk_Bljk_SB_MT16x32x32_SE_EPS1_FL0_GRVW1_GSU1_LPB2_PGR1_PLR1_TT4_2_USFGRO1_VW2_WG4_16_4_WGM1
    SolutionIndex: 53
    SolutionNameMin: Cijk_Ailk_Bljk_SB_MT16x32x32_SE_EPS1_FL1_GRVW2_GSU1_LPB2_PGR1_PLR1_TT4_2_USFGRO0_VW2_WG4_16_4_WGM8
    SolutionIndex: 54
    SolutionNameMin: Cijk_Ailk_Bljk_SB_MT16x32x32_SE_EPS1_FL1_GRVW4_GSU1_LPB2_PGR1_PLR1_TT4_2_USFGRO0_VW2_WG4_16_4_WGM1
    SolutionIndex: 55
    SolutionNameMin: Cijk_Ailk_Bljk_SB_MT16x64x16_SE_EPS1_FL0_GRVW2_GSU8_LPB2_PGR1_PLR1_TT4_4_USFGRO1_VW2_WG4_16_4_WGM1
    SolutionIndex: 56
    SolutionNameMin: Cijk_Ailk_Bljk_SB_MT32x8x32_SE_EPS1_FL0_GRVW2_GSU1_LPB2_PGR1_PLR1_TT2_2_USFGRO0_VW2_WG16_4_4_WGM1
    SolutionIndex: 57
    SolutionNameMin: Cijk_Ailk_Bljk_SB_MT32x8x32_SE_EPS1_FL0_GRVW2_GSU1_LPB2_PGR1_PLR1_TT2_2_USFGRO0_VW2_WG16_4_4_WGM8
    SolutionIndex: 58
    SolutionNameMin: Cijk_Ailk_Bljk_SB_MT32x8x32_SE_EPS1_FL1_GRVW2_GSU1_LPB2_PGR1_PLR1_TT2_2_USFGRO0_VW2_WG16_4_4_WGM1
    SolutionIndex: 59
    SolutionNameMin: Cijk_Ailk_Bljk_SB_MT32x16x32_SE_EPS1_FL0_GRVW2_GSU1_LPB2_PGR1_PLR1_TT2_4_USFGRO0_VW2_WG16_4_4_WGM1
    SolutionIndex: 60
    SolutionNameMin: Cijk_Ailk_Bljk_SB_MT32x16x32_SE_EPS1_FL1_GRVW2_GSU1_LPB2_PGR1_PLR1_TT2_4_USFGRO0_VW2_WG16_4_4_WGM1
    SolutionIndex: 61
    SolutionNameMin: Cijk_Ailk_Bljk_SB_MT64x16x16_SE_EPS1_FL0_GRVW1_GSU1_LPB2_PGR1_PLR1_TT4_4_USFGRO1_VW2_WG16_4_4_WGM8
    SolutionIndex: 62
    SolutionNameMin: Cijk_Ailk_Bljk_SB_MT64x16x16_SE_EPS1_FL0_GRVW4_GSU1_LPB4_PGR1_PLR1_TT4_4_USFGRO0_VW4_WG16_4_4_WGM8
    SolutionIndex: 63
    SolutionNameMin: Cijk_Ailk_Bljk_SB_MT64x16x32_SE_EPS1_FL0_GRVW4_GSU1_LPB4_PGR1_PLR1_TT4_4_USFGRO0_VW4_WG16_4_4_WGM1
    SolutionIndex: 64
    SolutionNameMin: Cijk_Ailk_Bljk_SB_MT64x16x32_SE_EPS1_FL1_GRVW4_GSU1_LPB4_PGR1_PLR1_TT4_4_USFGRO0_VW4_WG16_4_4_WGM1
    SolutionIndex: 65
    SolutionNameMin: Cijk_Ailk_Bljk_SB_MT64x16x32_SE_EPS1_FL1_GRVW4_GSU1_LPB4_PGR1_PLR1_TT4_4_USFGRO0_VW4_WG16_4_4_WGM8
- - - [6272, 256, 1, 528, 6272, 6272, 6272, 528]
    - [43, 7389.94]
  - - [3136, 2048, 1, 1024, 3136, 3136, 3136, 1024]
    - [24, 9657.94]
  - - [6272, 112, 1, 512, 6272, 6272, 6272, 512]
    - [22, 5931.09]
  - - [2048, 320, 1, 1280, 2048, 2048, 2048, 1280]
    - [42, 7772.99]
  - - [289, 256, 1, 1568, 289, 289, 289, 1568]
    - [63, 3718.17]
  - - [3136, 64, 64, 64, 3136, 3136, 3136, 64]
    - [2, 8201.15]
  - - [50176, 128, 1, 256, 50176, 50176, 50176, 256]
    - [25, 8908.58]
  - - [5329, 64, 1, 448, 5329, 5329, 5329, 448]
    - [8, 4602.2]
  - - [289, 192, 1, 1344, 289, 289, 289, 1344]
    - [60, 3452.59]
  - - [12544, 1024, 1, 256, 12544, 12544, 12544, 256]
    - [25, 9742.64]
  - - [784, 64, 32, 192, 784, 784, 784, 192]
    - [1, 6844.61]
  - - [6272, 64, 1, 480, 6272, 6272, 6272, 480]
    - [9, 5562.24]
  - - [196, 48, 1, 400, 196, 196, 196, 400]
    - [50, 452.308]
  - - [1225, 96, 32, 384, 1225, 1225, 1225, 384]
    - [39, 7989.1]
  - - [196, 128, 1, 800, 196, 196, 196, 800]
    - [51, 1639.74]
  - - [64, 512, 1, 1344, 64, 64, 64, 1344]
    - [50, 2313.04]
  - - [6272, 64, 1, 512, 6272, 6272, 6272, 512]
    - [8, 5609.19]
  - - [6272, 160, 1, 528, 6272, 6272, 6272, 528]
    - [9, 6149.7]
  - - [289, 160, 32, 768, 289, 289, 289, 768]
    - [36, 6637.82]
  - - [12544, 256, 1, 1024, 12544, 12544, 12544, 1024]
    - [43, 8790.46]
  - - [289, 224, 1, 1568, 289, 289, 289, 1568]
    - [63, 3270.17]
  - - [5329, 64, 32, 160, 5329, 5329, 5329, 160]
    - [16, 9091.04]
  - - [5329, 96, 1, 576, 5329, 5329, 5329, 576]
    - [43, 5555.66]
  - - [3025, 64, 1, 363, 3025, 3025, 3025, 363]
    - [61, 4392.3]
  - - [784, 32, 32, 192, 784, 784, 784, 192]
    - [32, 5633.8]
  - - [3136, 512, 1, 1024, 3136, 3136, 3136, 1024]
    - [28, 7553.14]
  - - [6272, 16, 1, 480, 6272, 6272, 6272, 480]
    - [63, 3219.85]
  - - [1225, 64, 32, 288, 1225, 1225, 1225, 288]
    - [23, 8240.58]
  - - [289, 320, 1, 1792, 289, 289, 289, 1792]
    - [63, 4708.07]
  - - [64, 256, 1, 1536, 64, 64, 64, 1536]
    - [56, 1456.36]
  - - [289, 192, 32, 768, 289, 289, 289, 768]
    - [35, 7372.8]
  - - [2048, 448, 1, 1280, 2048, 2048, 2048, 1280]
    - [18, 8403.01]
  - - [22201, 32, 1, 27, 22201, 22201, 22201, 27]
    - [40, 1339.5]
  - - [3136, 2048, 1, 512, 3136, 3136, 3136, 512]
    - [17, 9486.31]
  - - [289, 256, 1, 2016, 289, 289, 289, 2016]
    - [63, 3876.08]
  - - [2048, 384, 1, 2048, 2048, 2048, 2048, 2048]
    - [45, 8711.67]
  - - [289, 384, 32, 1024, 289, 289, 289, 1024]
    - [2, 7350.54]
  - - [1568, 32, 1, 832, 1568, 1568, 1568, 832]
    - [52, 2717.87]
  - - [49, 128, 1, 800, 49, 49, 49, 800]
    - [51, 402.051]
  - - [3136, 64, 32, 64, 3136, 3136, 3136, 64]
    - [5, 7657.26]
  - - [2048, 384, 1, 1280, 2048, 2048, 2048, 1280]
    - [44, 8618.43]
  - - [289, 160, 1, 1120, 289, 289, 289, 1120]
    - [59, 2826.9]
  - - [6272, 128, 1, 528, 6272, 6272, 6272, 528]
    - [13, 6926.26]
  - - [21609, 32, 1, 288, 21609, 21609, 21609, 288]
    - [14, 3698.9]
  - - [1225, 192, 1, 1728, 1225, 1225, 1225, 1728]
    - [47, 7309.81]
  - - [4096, 512, 1, 4096, 4096, 4096, 4096, 4096]
    - [30, 10272.1]
  - - [64, 256, 1, 1152, 64, 64, 64, 1152]
    - [56, 1387.82]
  - - [6272, 96, 1, 480, 6272, 6272, 6272, 480]
    - [44, 6371.56]
  - - [784, 96, 1, 800, 784, 784, 784, 800]
    - [64, 3330.27]
  - - [1225, 48, 32, 192, 1225, 1225, 1225, 192]
    - [7, 5421.18]
  - - [1225, 48, 32, 256, 1225, 1225, 1225, 256]
    - [14, 5845.75]
  - - [2048, 448, 1, 2048, 2048, 2048, 2048, 2048]
    - [18, 8622.65]
  - - [784, 96, 32, 192, 784, 784, 784, 192]
    - [33, 7092.36]
  - - [3136, 64, 64, 256, 3136, 3136, 3136, 256]
    - [26, 9579.16]
  - - [289, 224, 1, 1344, 289, 289, 289, 1344]
    - [63, 3180.01]
  - - [1001, 512, 1, 4096, 1001, 1001, 1001, 4096]
    - [4, 8195.07]
  - - [2048, 192, 1, 1280, 2048, 2048, 2048, 1280]
    - [9, 6120.09]
  - - [1225, 64, 32, 256, 1225, 1225, 1225, 256]
    - [14, 8076.62]
  - - [2048, 256, 1, 1536, 2048, 2048, 2048, 1536]
    - [4, 8137.7]
  - - [1225, 64, 1, 1200, 1225, 1225, 1225, 1200]
    - [63, 3552.87]
  - - [6272, 128, 1, 512, 6272, 6272, 6272, 512]
    - [17, 6878.21]
  - - [729, 192, 1, 1600, 729, 729, 729, 1600]
    - [62, 5016.77]
  - - [289, 192, 1, 896, 289, 289, 289, 896]
    - [60, 3091.87]
  - - [1568, 384, 1, 832, 1568, 1568, 1568, 832]
    - [43, 6934.62]
  - - [784, 16, 32, 192, 784, 784, 784, 192]
    - [34, 3380.28]
  - - [1568, 256, 1, 832, 1568, 1568, 1568, 832]
    - [8, 5980.86]
  - - [1568, 48, 1, 832, 1568, 1568, 1568, 832]
    - [65, 3275.09]
  - - [1568, 192, 1, 832, 1568, 1568, 1568, 832]
    - [3, 4441.11]
  - - [289, 192, 32, 1024, 289, 289, 289, 1024]
    - [6, 6563.06]
  - - [6272, 32, 1, 528, 6272, 6272, 6272, 528]
    - [47, 4998.67]
  - - [49, 128, 1, 1200, 49, 49, 49, 1200]
    - [48, 550.175]
  - - [1225, 64, 32, 384, 1225, 1225, 1225, 384]
    - [20, 8589.33]
  - - [289, 128, 1, 896, 289, 289, 289, 896]
    - [59, 2103.1]
  - - [196, 64, 1, 600, 196, 196, 196, 600]
    - [49, 771.148]
  - - [1568, 160, 1, 832, 1568, 1568, 1568, 832]
    - [47, 6995.05]
  - - [1001, 32, 1, 1024, 1001, 1001, 1001, 1024]
    - [56, 1744.72]
  - - [2048, 320, 1, 2048, 2048, 2048, 2048, 2048]
    - [41, 7118.04]
  - - [2048, 384, 1, 1536, 2048, 2048, 2048, 1536]
    - [4, 8184.01]
  - - [50176, 512, 1, 256, 50176, 50176, 50176, 256]
    - [16, 9852.4]
  - - [289, 256, 1, 1792, 289, 289, 289, 1792]
    - [65, 3809.75]
  - - [64, 448, 1, 1152, 64, 64, 64, 1152]
    - [57, 2128.23]
  - - [289, 128, 32, 1024, 289, 289, 289, 1024]
    - [15, 5566.47]
  - - [5041, 96, 1, 576, 5041, 5041, 5041, 576]
    - [42, 5279.3]
  - - [6272, 192, 1, 480, 6272, 6272, 6272, 480]
    - [4, 7479.65]
  - - [784, 32, 32, 256, 784, 784, 784, 256]
    - [31, 5708.91]
  - - [1001, 32, 1, 2048, 1001, 1001, 1001, 2048]
    - [58, 2141.04]
  - - [289, 192, 1, 1120, 289, 289, 289, 1120]
    - [54, 3277.77]
  - - [6272, 32, 1, 512, 6272, 6272, 6272, 512]
    - [46, 4978.7]
  - - [289, 384, 1, 3456, 289, 289, 289, 3456]
    - [63, 5904.14]
  - - [289, 384, 1, 2592, 289, 289, 289, 2592]
    - [64, 5707.34]
  - - [784, 128, 64, 512, 784, 784, 784, 512]
    - [10, 8864.39]
  - - [12544, 1024, 1, 512, 12544, 12544, 12544, 512]
    - [25, 10008.3]
  - - [289, 256, 32, 1024, 289, 289, 289, 1024]
    - [21, 6780.9]
  - - [12544, 256, 1, 512, 12544, 12544, 12544, 512]
    - [43, 8628.08]
  - - [5329, 80, 32, 64, 5329, 5329, 5329, 64]
    - [37, 6026.39]
  - - [6272, 24, 1, 512, 6272, 6272, 6272, 512]
    - [47, 3568.07]
  - - [5041, 192, 1, 720, 5041, 5041, 5041, 720]
    - [18, 8424.42]
  - - [64, 320, 1, 1728, 64, 64, 64, 1728]
    - [51, 1469.66]
  - - [784, 128, 32, 256, 784, 784, 784, 256]
    - [19, 8104.14]
  - - [289, 96, 1, 864, 289, 289, 289, 864]
    - [57, 1838.25]
  - - [1225, 32, 32, 192, 1225, 1225, 1225, 192]
    - [38, 5949.72]
  - - [1568, 128, 1, 832, 1568, 1568, 1568, 832]
    - [46, 5718.69]
  - - [289, 128, 32, 768, 289, 289, 289, 768]
    - [4, 7289.25]
  - - [3136, 256, 64, 64, 3136, 3136, 3136, 64]
    - [12, 9103.92]
  - - [196, 64, 1, 800, 196, 196, 196, 800]
    - [50, 915.62]
  - - [4096, 512, 1, 9216, 4096, 4096, 4096, 9216]
    - [27, 10351.4]
  - - [12544, 64, 1, 147, 12544, 12544, 12544, 147]
    - [17, 5069.33]
  - - [2048, 192, 1, 2048, 2048, 2048, 2048, 2048]
    - [4, 6275.77]
  - - [784, 32, 1, 400, 784, 784, 784, 400]
    - [48, 1140.36]
  - - [6272, 160, 1, 512, 6272, 6272, 6272, 512]
    - [8, 6140.08]
  - - [1225, 48, 32, 288, 1225, 1225, 1225, 288]
    - [14, 5978.61]
  - - [64, 320, 1, 2880, 64, 64, 64, 2880]
    - [55, 1920.0]
  - - [1225, 64, 32, 192, 1225, 1225, 1225, 192]
    - [8, 7641.01]
  - - [1001, 32, 1, 1536, 1001, 1001, 1001, 1536]
    - [56, 2084.79]
  - - [784, 64, 32, 256, 784, 784, 784, 256]
    - [0, 6990.51]
  - - [64, 384, 1, 1152, 64, 64, 64, 1152]
    - [57, 1862.6]
  - - [784, 512, 64, 128, 784, 784, 784, 128]
    - [11, 9025.95]
  - - [3136, 512, 1, 2048, 3136, 3136, 3136, 2048]
    - [29, 7764.3]
  - - [1001, 64, 1, 2048, 1001, 1001, 1001, 2048]
    - [53, 3620.39]
  - - [6272, 144, 1, 512, 6272, 6272, 6272, 512]
    - [4, 5574.04]
  - - [1225, 192, 32, 384, 1225, 1225, 1225, 384]
    - [18, 9373.83]
  - - [64, 192, 1, 1728, 64, 64, 64, 1728]
    - [56, 1206.46]
- null
