test_dir/py38/lib/python3.6/site-packages/Tensile/Configs/miopen/archives/resnet50/2018-10-09/logic/resnet50/vega20_Cijk_Ailk_Bljk_HB.yaml
- {MinimumRequiredVersion: 4.5.0}
- vega20
- gfx906
- [Device 66a0, Device 66a1, Device 66a7]
    SolutionIndex: 0
    SolutionNameMin: Cijk_Ailk_Bljk_HB_MT256x064x08_GSU01_LPB00_NLCB01_PGR1_PLR1_TT08_08_WG32_08_01_WGM01
    SolutionIndex: 1
    SolutionNameMin: Cijk_Ailk_Bljk_HB_MT128x128x16_GSU01_LPB00_NLCB01_PGR1_PLR1_TT08_08_WG16_16_01_WGM01
    SolutionIndex: 2
    SolutionNameMin: Cijk_Ailk_Bljk_HB_MT128x128x16_GSU01_LPB00_NLCB01_PGR1_PLR1_TT08_08_WG16_16_01_WGM08
    SolutionIndex: 3
    SolutionNameMin: Cijk_Ailk_Bljk_HB_MT128x064x32_GSU03_LPB00_NLCB01_PGR1_PLR1_TT08_08_WG16_08_02_WGM01
    SolutionIndex: 4
    SolutionNameMin: Cijk_Ailk_Bljk_HB_MT256x064x08_GSU01_LPB08_NLCB01_PGR1_PLR1_TT08_08_WG32_08_01_WGM01
    SolutionIndex: 5
    SolutionNameMin: Cijk_Ailk_Bljk_HB_MT256x064x08_GSU01_LPB08_NLCB01_PGR1_PLR1_TT08_08_WG32_08_01_WGM64
    SolutionIndex: 6
    SolutionNameMin: Cijk_Ailk_Bljk_HB_MT128x032x32_GSU01_LPB08_NLCB01_PGR1_PLR1_TT08_08_WG16_04_04_WGM08
- - - [3136, 64, 128, 64]
    - [4, 16298.2]
  - - [784, 512, 64, 128]
    - [1, 16567.6]
  - - [3136, 256, 64, 64]
    - [1, 17694.4]
  - - [784, 128, 128, 512]
    - [1, 17166.1]
  - - [784, 128, 64, 512]
    - [1, 16494.5]
  - - [3136, 512, 1, 2048]
    - [3, 13830.5]
  - - [12544, 256, 1, 1024]
    - [6, 15791.1]
  - - [3136, 64, 128, 256]
    - [4, 18292.9]
  - - [3136, 64, 64, 256]
    - [5, 17910.3]
  - - [3136, 2048, 1, 512]
    - [2, 16587.6]
  - - [784, 512, 128, 128]
    - [1, 16897.9]
  - - [3136, 64, 64, 64]
    - [0, 15383.3]
  - - [12544, 1024, 1, 256]
    - [1, 18236.1]
  - - [3136, 256, 128, 64]
    - [1, 18091.6]
- null
