Tensile/Configs/miopen/archives/resnet/2020-06-15/exact/arcturus_Cijk_Ailk_Bljk_SB.yaml
- {MinimumRequiredVersion: 4.20.0}
- arcturus
- gfx908
- [Device 7380, Device 7388, Device 738c, Device 7390, Device 731f]
- - - [64, 192, 64, 1280, 64, 64, 64, 1280]
    - [33, 17899.0]
  - - [64, 320, 64, 1280, 64, 64, 64, 1280]
    - [33, 20867.0]
  - - [64, 384, 64, 1280, 64, 64, 64, 1280]
    - [37, 21602.0]
  - - [64, 448, 64, 1280, 64, 64, 64, 1280]
    - [26, 20676.0]
  - - [64, 192, 64, 2048, 64, 64, 64, 2048]
    - [32, 17660.0]
  - - [64, 320, 64, 2048, 64, 64, 64, 2048]
    - [3, 20636.0]
  - - [64, 384, 64, 2048, 64, 64, 64, 2048]
    - [35, 20874.0]
  - - [64, 448, 64, 2048, 64, 64, 64, 2048]
    - [24, 20768.0]
  - - [1225, 32, 64, 192, 1225, 1225, 1225, 192]
    - [14, 8050.0]
  - - [1225, 48, 64, 192, 1225, 1225, 1225, 192]
    - [0, 10551.0]
  - - [1225, 64, 64, 192, 1225, 1225, 1225, 192]
    - [4, 15340.0]
  - - [1225, 48, 64, 256, 1225, 1225, 1225, 256]
    - [16, 11795.0]
  - - [1225, 64, 64, 256, 1225, 1225, 1225, 256]
    - [20, 16485.0]
  - - [1225, 48, 64, 288, 1225, 1225, 1225, 288]
    - [2, 12361.0]
  - - [1225, 64, 64, 288, 1225, 1225, 1225, 288]
    - [1, 17203.0]
  - - [5329, 80, 64, 64, 5329, 5329, 5329, 80]
    - [22, 11292.0]
  - - [289, 128, 64, 768, 289, 289, 289, 768]
    - [13, 17483.0]
  - - [289, 160, 64, 768, 289, 289, 289, 768]
    - [23, 17197.0]
  - - [289, 192, 64, 768, 289, 289, 289, 768]
    - [18, 19890.0]
  - - [49, 2048, 64, 512, 49, 49, 49, 2048]
    - [11, 15213.0]
  - - [49, 512, 64, 2048, 49, 49, 49, 2048]
    - [15, 15779.0]
  - - [3136, 256, 64, 64, 3136, 3136, 3136, 256]
    - [40, 18726.0]
  - - [3136, 64, 64, 64, 3136, 3136, 3136, 64]
    - [29, 13294.0]
  - - [3136, 64, 64, 256, 3136, 3136, 3136, 256]
    - [29, 20238.0]
  - - [784, 512, 64, 128, 784, 784, 784, 512]
    - [38, 22511.0]
  - - [784, 128, 64, 512, 784, 784, 784, 512]
    - [42, 24038.0]
  - - [196, 1024, 64, 256, 196, 196, 196, 1024]
    - [9, 18812.0]
  - - [196, 256, 64, 1024, 196, 196, 196, 1024]
    - [39, 18277.0]
  - - [64, 192, 32, 1280, 64, 64, 64, 1280]
    - [27, 14170.0]
  - - [64, 320, 32, 1280, 64, 64, 64, 1280]
    - [31, 17476.0]
  - - [64, 384, 32, 1280, 64, 64, 64, 1280]
    - [3, 19661.0]
  - - [64, 448, 32, 1280, 64, 64, 64, 1280]
    - [3, 21494.0]
  - - [64, 192, 32, 2048, 64, 64, 64, 2048]
    - [30, 14760.0]
  - - [64, 320, 32, 2048, 64, 64, 64, 2048]
    - [8, 17458.0]
  - - [64, 384, 32, 2048, 64, 64, 64, 2048]
    - [8, 19719.0]
  - - [64, 448, 32, 2048, 64, 64, 64, 2048]
    - [28, 21256.0]
  - - [1225, 32, 32, 192, 1225, 1225, 1225, 192]
    - [3, 7034.0]
  - - [1225, 48, 32, 192, 1225, 1225, 1225, 192]
    - [21, 9428.0]
  - - [1225, 64, 32, 192, 1225, 1225, 1225, 192]
    - [4, 14068.0]
  - - [1225, 48, 32, 256, 1225, 1225, 1225, 256]
    - [2, 10508.0]
  - - [1225, 64, 32, 256, 1225, 1225, 1225, 256]
    - [4, 15234.0]
  - - [1225, 48, 32, 288, 1225, 1225, 1225, 288]
    - [7, 11141.0]
  - - [1225, 64, 32, 288, 1225, 1225, 1225, 288]
    - [22, 16572.0]
  - - [5329, 80, 32, 64, 5329, 5329, 5329, 80]
    - [17, 10816.0]
  - - [289, 128, 32, 768, 289, 289, 289, 768]
    - [8, 18095.0]
  - - [289, 160, 32, 768, 289, 289, 289, 768]
    - [10, 15307.0]
  - - [289, 192, 32, 768, 289, 289, 289, 768]
    - [19, 18329.0]
  - - [49, 2048, 32, 512, 49, 49, 49, 2048]
    - [5, 14670.0]
  - - [49, 512, 32, 2048, 49, 49, 49, 2048]
    - [6, 13962.0]
  - - [3136, 256, 32, 64, 3136, 3136, 3136, 256]
    - [36, 17748.0]
  - - [3136, 64, 32, 64, 3136, 3136, 3136, 64]
    - [25, 11784.0]
  - - [3136, 64, 32, 256, 3136, 3136, 3136, 256]
    - [12, 19262.0]
  - - [784, 512, 32, 128, 784, 784, 784, 512]
    - [36, 21298.0]
  - - [784, 128, 32, 512, 784, 784, 784, 512]
    - [34, 21841.0]
  - - [196, 1024, 32, 256, 196, 196, 196, 1024]
    - [9, 17566.0]
  - - [196, 256, 32, 1024, 196, 196, 196, 1024]
    - [41, 16521.0]
- null
