test_dir/py38/lib/python3.6/site-packages/Tensile/Configs/miopen/archives/resnext3d/2021-02-17/exact/vega20_Cijk_Alik_Bljk_SB.yaml
- {MinimumRequiredVersion: 4.26.0}
- vega20
- gfx906
- [Device 66a0, Device 66a1, Device 66a7, Device 66af, Vega 20]
    SolutionIndex: 0
    SolutionNameMin: Cijk_Alik_Bljk_SB_MT64x64x16_SE_GRVW4_GSU1_LRVW4_TT4_4_VW4_WG16_16_1_WGM1
    SolutionIndex: 1
    SolutionNameMin: Cijk_Alik_Bljk_SB_MT64x128x8_SE_GRVW4_GSU1_LRVW4_TT4_8_VW4_WG16_16_1_WGM1
    SolutionIndex: 2
    SolutionNameMin: Cijk_Alik_Bljk_SB_MT128x64x8_SE_GRVW4_GSU1_LRVW4_TT8_4_VW4_WG16_16_1_WGM1
    SolutionIndex: 3
    SolutionNameMin: Cijk_Alik_Bljk_SB_MT128x128x8_SE_GRVW4_GSU1_LRVW4_TT8_8_VW4_WG16_16_1_WGM1
    SolutionIndex: 4
    SolutionNameMin: Cijk_Alik_Bljk_SB_MT64x64x32_SE_GRVW4_GSU16_LRVW4_TT8_4_VW4_WG8_16_2_WGM1
    SolutionIndex: 5
    SolutionNameMin: Cijk_Alik_Bljk_SB_MT64x64x16_SE_GRVW4_GSU1_LRVW4_TT4_8_VW4_WG16_8_2_WGM1
    SolutionIndex: 6
    SolutionNameMin: Cijk_Alik_Bljk_SB_MT64x24x16_SE_GRVW2_GSU16_LRVW2_TT4_6_VW2_WG16_4_4_WGM1
    SolutionIndex: 7
    SolutionNameMin: Cijk_Alik_Bljk_SB_MT32x32x8_SE_GRVW4_GSU1_LRVW4_TT4_4_VW4_WG8_8_4_WGM8
    SolutionIndex: 8
    SolutionNameMin: Cijk_Alik_Bljk_SB_MT32x32x24_SE_GRVW4_GSU1_LRVW4_TT4_4_VW4_WG8_8_4_WGM1
    SolutionIndex: 9
    SolutionNameMin: Cijk_Alik_Bljk_SB_MT32x32x32_SE_GRVW4_GSU1_LRVW4_TT4_4_VW4_WG8_8_4_WGM8
    SolutionIndex: 10
    SolutionNameMin: Cijk_Alik_Bljk_SB_MT64x32x16_SE_GRVW4_GSU1_LRVW4_TT8_4_VW4_WG8_8_4_WGM1
    SolutionIndex: 11
    SolutionNameMin: Cijk_Alik_Bljk_SB_MT64x16x32_SE_GRVW2_GSU16_LRVW2_TT2_2_VW2_WG32_8_4_WGM1
    SolutionIndex: 12
    SolutionNameMin: Cijk_Alik_Bljk_SB_MT128x64x16_SE_GRVW4_GSU8_LRVW4_TT8_4_VW4_WG16_16_1_WGM1
- - - [101, 100, 1, 512, 101, 101, 512, 512]
    - [9, 357.0]
  - - [64, 128, 1, 3136, 64, 64, 3136, 3136]
    - [6, 1447.0]
  - - [101, 8, 1, 512, 101, 101, 512, 512]
    - [11, 49.0]
  - - [128, 256, 1, 392, 128, 128, 392, 392]
    - [8, 1029.0]
  - - [256, 512, 1, 49, 256, 256, 49, 49]
    - [7, 1071.0]
  - - [1728, 128, 1, 3136, 1728, 1728, 3136, 3136]
    - [10, 5526.0]
  - - [1728, 64, 1, 25088, 1728, 1728, 25088, 25088]
    - [12, 6525.0]
  - - [441, 64, 1, 25088, 441, 441, 25088, 25088]
    - [4, 5113.0]
  - - [13824, 512, 1, 49, 13824, 13824, 49, 49]
    - [2, 3992.0]
  - - [3456, 256, 1, 392, 3456, 3456, 392, 392]
    - [1, 6925.0]
  - - [6912, 256, 1, 392, 6912, 6912, 392, 392]
    - [3, 7231.0]
  - - [6912, 512, 1, 49, 6912, 6912, 49, 49]
    - [0, 3864.0]
  - - [3456, 128, 1, 3136, 3456, 3456, 3136, 3136]
    - [5, 7018.0]
- null
