test_dir/py38/lib/python3.6/site-packages/Tensile/Configs/miopen/archives/resnext3d/2021-02-17/exact/vega20_Cijk_Ailk_Bljk_SB.yaml
- {MinimumRequiredVersion: 4.26.0}
- vega20
- gfx906
- [Device 66a0, Device 66a1, Device 66a7, Device 66af, Vega 20]
    SolutionIndex: 0
    SolutionNameMin: Cijk_Ailk_Bljk_SB_MT64x64x16_SE_GRVW4_GSU1_LRVW4_TT4_4_VW4_WG16_16_1_WGM8
    SolutionIndex: 1
    SolutionNameMin: Cijk_Ailk_Bljk_SB_MT128x64x8_SE_GRVW4_GSU1_LRVW4_TT8_4_VW4_WG16_16_1_WGM1
    SolutionIndex: 2
    SolutionNameMin: Cijk_Ailk_Bljk_SB_MT128x64x8_SE_GRVW4_GSU1_LRVW4_TT8_4_VW4_WG16_16_1_WGM8
    SolutionIndex: 3
    SolutionNameMin: Cijk_Ailk_Bljk_SB_MT64x32x16_SE_GRVW4_GSU1_LRVW4_TT4_4_VW4_WG16_8_2_WGM1
    SolutionIndex: 4
    SolutionNameMin: Cijk_Ailk_Bljk_SB_MT64x32x16_SE_GRVW4_GSU1_LRVW4_TT4_4_VW4_WG16_8_2_WGM8
    SolutionIndex: 5
    SolutionNameMin: Cijk_Ailk_Bljk_SB_MT128x32x24_SE_GRVW4_GSU1_LRVW4_TT8_4_VW4_WG16_8_2_WGM1
    SolutionIndex: 6
    SolutionNameMin: Cijk_Ailk_Bljk_SB_MT32x32x32_SE_GRVW4_GSU1_LRVW4_TT4_4_VW4_WG8_8_4_WGM1
    SolutionIndex: 7
    SolutionNameMin: Cijk_Ailk_Bljk_SB_MT64x32x24_SE_GRVW4_GSU1_LRVW4_TT8_4_VW4_WG8_8_4_WGM8
    SolutionIndex: 8
    SolutionNameMin: Cijk_Ailk_Bljk_SB_MT64x64x16_SE_GRVW4_GSU8_LRVW4_TT4_4_VW4_WG16_16_1_WGM8
    SolutionIndex: 9
    SolutionNameMin: Cijk_Ailk_Bljk_SB_MT96x64x8_SE_GRVW2_GSU8_LRVW2_TT6_4_VW2_WG16_16_1_WGM1
    SolutionIndex: 10
    SolutionNameMin: Cijk_Ailk_Bljk_SB_MT96x64x8_SE_GRVW2_GSU16_LRVW2_TT6_4_VW2_WG16_16_1_WGM1
    SolutionIndex: 11
    SolutionNameMin: Cijk_Ailk_Bljk_SB_MT96x64x8_SE_GRVW2_GSU16_LRVW2_TT6_4_VW2_WG16_16_1_WGM8
    SolutionIndex: 12
    SolutionNameMin: Cijk_Ailk_Bljk_SB_MT64x32x16_SE_GRVW4_GSU16_LRVW4_TT4_4_VW4_WG16_8_2_WGM1
    SolutionIndex: 13
    SolutionNameMin: Cijk_Ailk_Bljk_SB_MT64x32x16_SE_GRVW4_GSU16_LRVW4_TT4_4_VW4_WG16_8_2_WGM8
    SolutionIndex: 14
    SolutionNameMin: Cijk_Ailk_Bljk_SB_MT16x64x16_SE_GRVW4_GSU1_LRVW4_TT4_4_VW4_WG4_16_4_WGM1
- - - [3136, 128, 1, 64, 3136, 3136, 3136, 64]
    - [4, 3058.0]
  - - [5504, 128, 1, 64, 5504, 5504, 5504, 64]
    - [0, 4055.0]
  - - [25088, 64, 1, 1728, 25088, 25088, 25088, 1728]
    - [0, 7262.0]
  - - [25088, 64, 1, 441, 25088, 25088, 25088, 441]
    - [0, 7019.0]
  - - [3136, 128, 1, 1728, 3136, 3136, 3136, 1728]
    - [5, 6811.0]
  - - [3136, 128, 1, 3456, 3136, 3136, 3136, 3456]
    - [5, 7029.0]
  - - [43520, 64, 1, 1728, 43520, 43520, 43520, 1728]
    - [1, 8528.0]
  - - [43520, 64, 1, 441, 43520, 43520, 43520, 441]
    - [2, 8395.0]
  - - [5504, 128, 1, 1728, 5504, 5504, 5504, 1728]
    - [0, 7274.0]
  - - [5504, 128, 1, 3456, 5504, 5504, 5504, 3456]
    - [0, 7343.0]
  - - [392, 256, 1, 128, 392, 392, 392, 128]
    - [6, 1911.0]
  - - [704, 256, 1, 128, 704, 704, 704, 128]
    - [3, 2746.0]
  - - [88, 512, 1, 256, 88, 88, 88, 256]
    - [6, 1287.0]
  - - [392, 256, 1, 3456, 392, 392, 392, 3456]
    - [9, 4632.0]
  - - [392, 256, 1, 6912, 392, 392, 392, 6912]
    - [8, 5268.0]
  - - [49, 512, 1, 13824, 49, 49, 49, 13824]
    - [13, 3625.0]
  - - [49, 512, 1, 256, 49, 49, 49, 256]
    - [6, 723.0]
  - - [49, 512, 1, 6912, 49, 49, 49, 6912]
    - [12, 3036.0]
  - - [704, 256, 1, 3456, 704, 704, 704, 3456]
    - [7, 5894.0]
  - - [704, 256, 1, 6912, 704, 704, 704, 6912]
    - [11, 6128.0]
  - - [88, 512, 1, 13824, 88, 88, 88, 13824]
    - [10, 4648.0]
  - - [88, 512, 1, 6912, 88, 88, 88, 6912]
    - [10, 4199.0]
  - - [512, 8, 1, 101, 512, 512, 512, 101]
    - [14, 67.0]
- null
