Tensile/Configs/miopen/archives/transformer/2020-09-01/exact/vega20_Cijk_Alik_Bljk_HBH.yaml
- {MinimumRequiredVersion: 4.22.0}
- vega20
- gfx906
- [Device 66a0, Device 66a1, Device 66a7, Device 66af, Vega 20]
    SolutionIndex: 0
    SolutionNameMin: Cijk_Alik_Bljk_HBH_MT64x64x8_SE_GRVW2_LRVW2_TT4_4_VW2_WG16_16_1_WGM1
    SolutionIndex: 1
    SolutionNameMin: Cijk_Alik_Bljk_HBH_MT64x64x16_SE_GRVW2_LRVW2_TT4_4_VW2_WG16_16_1_WGM1
    SolutionIndex: 2
    SolutionNameMin: Cijk_Alik_Bljk_HBH_MT64x64x16_SE_GRVW2_LRVW2_TT4_4_VW2_WG16_16_1_WGM8
    SolutionIndex: 3
    SolutionNameMin: Cijk_Alik_Bljk_HBH_MT64x64x16_SE_GRVW4_LRVW4_TT4_4_VW4_WG16_16_1_WGM1
    SolutionIndex: 4
    SolutionNameMin: Cijk_Alik_Bljk_HBH_MT64x64x16_SE_GRVW4_LRVW4_TT4_4_VW4_WG16_16_1_WGM8
    SolutionIndex: 5
    SolutionNameMin: Cijk_Alik_Bljk_HBH_MT128x64x16_SE_GRVW2_LRVW2_TT8_4_VW2_WG16_16_1_WGM1
    SolutionIndex: 6
    SolutionNameMin: Cijk_Alik_Bljk_HBH_MT128x64x16_SE_GRVW2_LRVW2_TT8_4_VW2_WG16_16_1_WGM8
    SolutionIndex: 7
    SolutionNameMin: Cijk_Alik_Bljk_HBH_MT128x64x16_SE_GRVW4_LRVW4_TT8_4_VW4_WG16_16_1_WGM1
    SolutionIndex: 8
    SolutionNameMin: Cijk_Alik_Bljk_HBH_MT128x64x16_SE_GRVW4_LRVW4_TT8_4_VW4_WG16_16_1_WGM8
    SolutionIndex: 9
    SolutionNameMin: Cijk_Alik_Bljk_HBH_MT64x128x8_SE_GRVW2_LRVW2_TT4_8_VW2_WG16_16_1_WGM1
    SolutionIndex: 10
    SolutionNameMin: Cijk_Alik_Bljk_HBH_MT64x128x8_SE_GRVW2_LRVW2_TT4_8_VW2_WG16_16_1_WGM8
    SolutionIndex: 11
    SolutionNameMin: Cijk_Alik_Bljk_HBH_MT64x128x16_SE_GRVW2_LRVW2_TT4_8_VW2_WG16_16_1_WGM1
    SolutionIndex: 12
    SolutionNameMin: Cijk_Alik_Bljk_HBH_MT64x128x16_SE_GRVW2_LRVW2_TT4_8_VW2_WG16_16_1_WGM8
    SolutionIndex: 13
    SolutionNameMin: Cijk_Alik_Bljk_HBH_MT64x128x8_SE_GRVW4_LRVW4_TT4_8_VW4_WG16_16_1_WGM1
    SolutionIndex: 14
    SolutionNameMin: Cijk_Alik_Bljk_HBH_MT64x128x16_SE_GRVW4_LRVW4_TT4_8_VW4_WG16_16_1_WGM1
    SolutionIndex: 15
    SolutionNameMin: Cijk_Alik_Bljk_HBH_MT64x128x16_SE_GRVW4_LRVW4_TT4_8_VW4_WG16_16_1_WGM8
    SolutionIndex: 16
    SolutionNameMin: Cijk_Alik_Bljk_HBH_MT128x128x16_SE_GRVW4_LRVW4_TT8_8_VW4_WG16_16_1_WGM1
    SolutionIndex: 17
    SolutionNameMin: Cijk_Alik_Bljk_HBH_MT128x128x16_SE_GRVW4_LRVW4_TT8_8_VW4_WG16_16_1_WGM8
    SolutionIndex: 18
    SolutionNameMin: Cijk_Alik_Bljk_HBH_MT128x128x16_SE_GRVW8_LRVW8_TT8_8_VW8_WG16_16_1_WGM1
    SolutionIndex: 19
    SolutionNameMin: Cijk_Alik_Bljk_HBH_MT128x128x16_SE_GRVW8_LRVW8_TT8_8_VW8_WG16_16_1_WGM8
    SolutionIndex: 20
    SolutionNameMin: Cijk_Alik_Bljk_HBH_MT96x64x16_SE_GRVW2_LRVW2_TT6_4_VW2_WG16_16_1_WGM1
    SolutionIndex: 21
    SolutionNameMin: Cijk_Alik_Bljk_HBH_MT96x64x16_SE_GRVW2_LRVW2_TT6_4_VW2_WG16_16_1_WGM8
    SolutionIndex: 22
    SolutionNameMin: Cijk_Alik_Bljk_HBH_MT64x96x8_SE_GRVW2_LRVW2_TT4_6_VW2_WG16_16_1_WGM1
    SolutionIndex: 23
    SolutionNameMin: Cijk_Alik_Bljk_HBH_MT64x96x8_SE_GRVW2_LRVW2_TT4_6_VW2_WG16_16_1_WGM8
    SolutionIndex: 24
    SolutionNameMin: Cijk_Alik_Bljk_HBH_MT64x96x16_SE_GRVW2_LRVW2_TT4_6_VW2_WG16_16_1_WGM1
    SolutionIndex: 25
    SolutionNameMin: Cijk_Alik_Bljk_HBH_MT64x96x16_SE_GRVW2_LRVW2_TT4_6_VW2_WG16_16_1_WGM8
    SolutionIndex: 26
    SolutionNameMin: Cijk_Alik_Bljk_HBH_MT64x32x16_SE_GRVW4_LRVW4_TT4_4_VW4_WG16_8_1_WGM1
    SolutionIndex: 27
    SolutionNameMin: Cijk_Alik_Bljk_HBH_MT64x32x16_SE_GRVW4_LRVW4_TT4_4_VW4_WG16_8_1_WGM8
    SolutionIndex: 28
    SolutionNameMin: Cijk_Alik_Bljk_HBH_MT64x32x32_SE_GRVW4_LRVW4_TT4_4_VW4_WG16_8_1_WGM1
    SolutionIndex: 29
    SolutionNameMin: Cijk_Alik_Bljk_HBH_MT64x64x16_SE_GRVW2_LRVW2_TT4_8_VW2_WG16_8_1_WGM1
    SolutionIndex: 30
    SolutionNameMin: Cijk_Alik_Bljk_HBH_MT64x64x16_SE_GRVW2_LRVW2_TT4_8_VW2_WG16_8_1_WGM8
    SolutionIndex: 31
    SolutionNameMin: Cijk_Alik_Bljk_HBH_MT64x64x16_SE_GRVW4_LRVW4_TT4_8_VW4_WG16_8_1_WGM1
    SolutionIndex: 32
    SolutionNameMin: Cijk_Alik_Bljk_HBH_MT64x64x16_SE_GRVW4_LRVW4_TT4_8_VW4_WG16_8_1_WGM8
    SolutionIndex: 33
    SolutionNameMin: Cijk_Alik_Bljk_HBH_MT128x64x16_SE_GRVW4_LRVW4_TT8_8_VW4_WG16_8_1_WGM1
    SolutionIndex: 34
    SolutionNameMin: Cijk_Alik_Bljk_HBH_MT128x64x16_SE_GRVW8_LRVW8_TT8_8_VW8_WG16_8_1_WGM1
    SolutionIndex: 35
    SolutionNameMin: Cijk_Alik_Bljk_HBH_MT128x64x16_SE_GRVW8_LRVW8_TT8_8_VW8_WG16_8_1_WGM8
    SolutionIndex: 36
    SolutionNameMin: Cijk_Alik_Bljk_HBH_MT96x32x16_SE_GRVW2_LRVW2_TT6_4_VW2_WG16_8_1_WGM8
    SolutionIndex: 37
    SolutionNameMin: Cijk_Alik_Bljk_HBH_MT64x48x8_SE_GRVW2_LRVW2_TT4_6_VW2_WG16_8_1_WGM1
    SolutionIndex: 38
    SolutionNameMin: Cijk_Alik_Bljk_HBH_MT64x48x16_SE_GRVW2_LRVW2_TT4_6_VW2_WG16_8_1_WGM1
    SolutionIndex: 39
    SolutionNameMin: Cijk_Alik_Bljk_HBH_MT64x48x16_SE_GRVW2_LRVW2_TT4_6_VW2_WG16_8_1_WGM8
    SolutionIndex: 40
    SolutionNameMin: Cijk_Alik_Bljk_HBH_MT32x64x16_SE_GRVW4_LRVW4_TT4_4_VW4_WG8_16_1_WGM1
    SolutionIndex: 41
    SolutionNameMin: Cijk_Alik_Bljk_HBH_MT32x64x16_SE_GRVW4_LRVW4_TT4_4_VW4_WG8_16_1_WGM8
    SolutionIndex: 42
    SolutionNameMin: Cijk_Alik_Bljk_HBH_MT32x64x32_SE_GRVW4_LRVW4_TT4_4_VW4_WG8_16_1_WGM1
    SolutionIndex: 43
    SolutionNameMin: Cijk_Alik_Bljk_HBH_MT64x64x16_SE_GRVW2_LRVW2_TT8_4_VW2_WG8_16_1_WGM1
    SolutionIndex: 44
    SolutionNameMin: Cijk_Alik_Bljk_HBH_MT64x64x16_SE_GRVW2_LRVW2_TT8_4_VW2_WG8_16_1_WGM8
    SolutionIndex: 45
    SolutionNameMin: Cijk_Alik_Bljk_HBH_MT64x64x16_SE_GRVW4_LRVW4_TT8_4_VW4_WG8_16_1_WGM1
    SolutionIndex: 46
    SolutionNameMin: Cijk_Alik_Bljk_HBH_MT64x64x16_SE_GRVW4_LRVW4_TT8_4_VW4_WG8_16_1_WGM8
    SolutionIndex: 47
    SolutionNameMin: Cijk_Alik_Bljk_HBH_MT64x128x8_SE_GRVW4_LRVW4_TT8_8_VW4_WG8_16_1_WGM1
    SolutionIndex: 48
    SolutionNameMin: Cijk_Alik_Bljk_HBH_MT64x128x8_SE_GRVW4_LRVW4_TT8_8_VW4_WG8_16_1_WGM8
    SolutionIndex: 49
    SolutionNameMin: Cijk_Alik_Bljk_HBH_MT64x128x16_SE_GRVW8_LRVW8_TT8_8_VW8_WG8_16_1_WGM1
    SolutionIndex: 50
    SolutionNameMin: Cijk_Alik_Bljk_HBH_MT64x128x16_SE_GRVW8_LRVW8_TT8_8_VW8_WG8_16_1_WGM8
    SolutionIndex: 51
    SolutionNameMin: Cijk_Alik_Bljk_HBH_MT48x64x16_SE_GRVW2_LRVW2_TT6_4_VW2_WG8_16_1_WGM1
    SolutionIndex: 52
    SolutionNameMin: Cijk_Alik_Bljk_HBH_MT48x64x16_SE_GRVW2_LRVW2_TT6_4_VW2_WG8_16_1_WGM8
    SolutionIndex: 53
    SolutionNameMin: Cijk_Alik_Bljk_HBH_MT64x16x16_SE_GRVW4_LRVW4_TT4_4_VW4_WG16_4_1_WGM1
    SolutionIndex: 54
    SolutionNameMin: Cijk_Alik_Bljk_HBH_MT64x16x16_SE_GRVW4_LRVW4_TT4_4_VW4_WG16_4_1_WGM8
    SolutionIndex: 55
    SolutionNameMin: Cijk_Alik_Bljk_HBH_MT32x32x8_SE_GRVW4_LRVW4_TT4_4_VW4_WG8_8_1_WGM1
    SolutionIndex: 56
    SolutionNameMin: Cijk_Alik_Bljk_HBH_MT32x32x16_SE_GRVW4_LRVW4_TT4_4_VW4_WG8_8_1_WGM1
    SolutionIndex: 57
    SolutionNameMin: Cijk_Alik_Bljk_HBH_MT32x32x16_SE_GRVW4_LRVW4_TT4_4_VW4_WG8_8_1_WGM8
    SolutionIndex: 58
    SolutionNameMin: Cijk_Alik_Bljk_HBH_MT32x32x32_SE_GRVW4_LRVW4_TT4_4_VW4_WG8_8_1_WGM8
    SolutionIndex: 59
    SolutionNameMin: Cijk_Alik_Bljk_HBH_MT64x64x16_SE_GRVW8_LRVW8_TT8_8_VW8_WG8_8_1_WGM1
    SolutionIndex: 60
    SolutionNameMin: Cijk_Alik_Bljk_HBH_MT64x64x16_SE_GRVW8_LRVW8_TT8_8_VW8_WG8_8_1_WGM8
    SolutionIndex: 61
    SolutionNameMin: Cijk_Alik_Bljk_HBH_MT32x32x16_SE_GRVW2_LRVW2_TT2_4_VW2_WG16_8_1_WGM8
    SolutionIndex: 62
    SolutionNameMin: Cijk_Alik_Bljk_HBH_MT32x32x16_SE_GRVW2_LRVW2_TT4_2_VW2_WG8_16_1_WGM1
    SolutionIndex: 63
    SolutionNameMin: Cijk_Alik_Bljk_HBH_MT32x32x16_SE_GRVW2_LRVW2_TT4_2_VW2_WG8_16_1_WGM8
    SolutionIndex: 64
    SolutionNameMin: Cijk_Alik_Bljk_HBH_MT32x16x16_SE_GRVW2_LRVW2_TT4_2_VW2_WG8_8_1_WGM8
- - - [1024, 26656, 1, 4096, 1024, 1024, 4096, 4096]
    - [3, 12270.4]
  - - [1024, 33792, 1, 1024, 1024, 1024, 1024, 1024]
    - [3, 12692.2]
  - - [1024, 26624, 1, 4096, 1024, 1024, 4096, 4096]
    - [3, 12244.1]
  - - [1024, 26624, 1, 1024, 1024, 1024, 1024, 1024]
    - [3, 12625.8]
  - - [33712, 484, 1, 1024, 33712, 33712, 1024, 1024]
    - [4, 11765.7]
  - - [4096, 484, 1, 1024, 4096, 4096, 1024, 1024]
    - [4, 10516.2]
  - - [4096, 23040, 1, 1024, 4096, 4096, 1024, 1024]
    - [3, 12705.7]
  - - [1024, 23040, 1, 1024, 1024, 1024, 1024, 1024]
    - [8, 12296.5]
  - - [1024, 20480, 1, 4096, 1024, 1024, 4096, 4096]
    - [11, 11822.5]
  - - [33712, 316, 1, 1024, 33712, 33712, 1024, 1024]
    - [4, 11363.2]
  - - [1024, 316, 1, 1024, 1024, 1024, 1024, 1024]
    - [40, 5493.2]
  - - [33712, 428, 1, 1024, 33712, 33712, 1024, 1024]
    - [3, 10985.5]
  - - [1024, 18944, 1, 4096, 1024, 1024, 4096, 4096]
    - [3, 11308.3]
  - - [4096, 18944, 1, 1024, 4096, 4096, 1024, 1024]
    - [3, 11200.6]
  - - [1024, 17408, 1, 4096, 1024, 1024, 4096, 4096]
    - [3, 10645.7]
  - - [33712, 248, 1, 1024, 33712, 33712, 1024, 1024]
    - [4, 11109.2]
  - - [33712, 288, 1, 1024, 33712, 33712, 1024, 1024]
    - [4, 9646.49]
  - - [4096, 288, 1, 1024, 4096, 4096, 1024, 1024]
    - [38, 8728.03]
  - - [1024, 16384, 1, 4096, 1024, 1024, 4096, 4096]
    - [3, 10614.9]
  - - [4096, 16384, 1, 1024, 4096, 4096, 1024, 1024]
    - [47, 10043.9]
  - - [1024, 16384, 1, 1024, 1024, 1024, 1024, 1024]
    - [7, 11275.2]
  - - [33712, 256, 1, 1024, 33712, 33712, 1024, 1024]
    - [4, 11477.1]
  - - [4096, 256, 1, 1024, 4096, 4096, 1024, 1024]
    - [26, 9250.02]
  - - [33712, 368, 1, 1024, 33712, 33712, 1024, 1024]
    - [8, 10607.7]
  - - [4096, 368, 1, 1024, 4096, 4096, 1024, 1024]
    - [4, 8659.69]
  - - [1024, 368, 1, 1024, 1024, 1024, 1024, 1024]
    - [57, 6144.52]
  - - [1024, 444, 1, 1024, 1024, 1024, 1024, 1024]
    - [3, 7441.94]
  - - [33712, 480, 1, 1024, 33712, 33712, 1024, 1024]
    - [45, 10489.5]
  - - [4096, 480, 1, 1024, 4096, 4096, 1024, 1024]
    - [4, 9746.64]
  - - [1024, 480, 1, 1024, 1024, 1024, 1024, 1024]
    - [56, 7884.03]
  - - [1024, 15360, 1, 4096, 1024, 1024, 4096, 4096]
    - [43, 10824.6]
  - - [4096, 15360, 1, 1024, 4096, 4096, 1024, 1024]
    - [45, 9902.79]
  - - [1024, 15360, 1, 1024, 1024, 1024, 1024, 1024]
    - [7, 11504.4]
  - - [1024, 288, 1, 1024, 1024, 1024, 1024, 1024]
    - [26, 4993.22]
  - - [4096, 308, 1, 1024, 4096, 4096, 1024, 1024]
    - [4, 9504.46]
  - - [33712, 404, 1, 1024, 33712, 33712, 1024, 1024]
    - [8, 10271.7]
  - - [4096, 404, 1, 1024, 4096, 4096, 1024, 1024]
    - [46, 8774.33]
  - - [1024, 404, 1, 1024, 1024, 1024, 1024, 1024]
    - [4, 6754.22]
  - - [1024, 14336, 1, 4096, 1024, 1024, 4096, 4096]
    - [5, 10174.2]
  - - [4096, 14336, 1, 1024, 4096, 4096, 1024, 1024]
    - [9, 10802.7]
  - - [1024, 14336, 1, 1024, 1024, 1024, 1024, 1024]
    - [11, 11145.6]
  - - [33712, 252, 1, 1024, 33712, 33712, 1024, 1024]
    - [14, 10332.7]
  - - [33712, 324, 1, 1024, 33712, 33712, 1024, 1024]
    - [27, 8975.42]
  - - [4096, 304, 1, 1024, 4096, 4096, 1024, 1024]
    - [52, 8366.59]
  - - [4096, 324, 1, 1024, 4096, 4096, 1024, 1024]
    - [38, 8917.02]
  - - [33712, 384, 1, 1024, 33712, 33712, 1024, 1024]
    - [9, 10598.8]
  - - [4096, 384, 1, 1024, 4096, 4096, 1024, 1024]
    - [4, 9758.92]
  - - [1024, 12800, 1, 4096, 1024, 1024, 4096, 4096]
    - [20, 10327.0]
  - - [4096, 12800, 1, 1024, 4096, 4096, 1024, 1024]
    - [9, 10806.7]
  - - [1024, 12800, 1, 1024, 1024, 1024, 1024, 1024]
    - [29, 10481.8]
  - - [4096, 276, 1, 1024, 4096, 4096, 1024, 1024]
    - [38, 8354.71]
  - - [1024, 276, 1, 1024, 1024, 1024, 1024, 1024]
    - [26, 4772.54]
  - - [33712, 344, 1, 1024, 33712, 33712, 1024, 1024]
    - [10, 9772.89]
  - - [1024, 344, 1, 1024, 1024, 1024, 1024, 1024]
    - [26, 5948.39]
  - - [1024, 372, 1, 1024, 1024, 1024, 1024, 1024]
    - [40, 6315.9]
  - - [33712, 464, 1, 1024, 33712, 33712, 1024, 1024]
    - [7, 10143.0]
  - - [4096, 464, 1, 1024, 4096, 4096, 1024, 1024]
    - [3, 9425.4]
  - - [1024, 464, 1, 1024, 1024, 1024, 1024, 1024]
    - [56, 7649.99]
  - - [1024, 11776, 1, 4096, 1024, 1024, 4096, 4096]
    - [24, 10587.5]
  - - [33712, 244, 1, 1024, 33712, 33712, 1024, 1024]
    - [14, 10785.6]
  - - [33712, 340, 1, 1024, 33712, 33712, 1024, 1024]
    - [11, 9576.03]
  - - [33712, 436, 1, 1024, 33712, 33712, 1024, 1024]
    - [8, 10224.4]
  - - [1024, 436, 1, 1024, 1024, 1024, 1024, 1024]
    - [26, 7233.85]
  - - [4096, 460, 1, 1024, 4096, 4096, 1024, 1024]
    - [4, 9362.26]
  - - [1024, 11264, 1, 4096, 1024, 1024, 4096, 4096]
    - [7, 10918.2]
  - - [4096, 336, 1, 1024, 4096, 4096, 1024, 1024]
    - [38, 9918.96]
  - - [33712, 416, 1, 1024, 33712, 33712, 1024, 1024]
    - [8, 10526.6]
  - - [1024, 416, 1, 1024, 1024, 1024, 1024, 1024]
    - [56, 6910.77]
  - - [4096, 440, 1, 1024, 4096, 4096, 1024, 1024]
    - [32, 10252.7]
  - - [4096, 10752, 1, 1024, 4096, 4096, 1024, 1024]
    - [6, 11308.6]
  - - [1024, 10752, 1, 1024, 1024, 1024, 1024, 1024]
    - [11, 10729.2]
  - - [33712, 440, 1, 1024, 33712, 33712, 1024, 1024]
    - [8, 11080.6]
  - - [33712, 216, 1, 1024, 33712, 33712, 1024, 1024]
    - [36, 8854.06]
  - - [33712, 272, 1, 1024, 33712, 33712, 1024, 1024]
    - [4, 9116.23]
  - - [4096, 272, 1, 1024, 4096, 4096, 1024, 1024]
    - [26, 8038.69]
  - - [1024, 272, 1, 1024, 1024, 1024, 1024, 1024]
    - [40, 4734.61]
  - - [33712, 312, 1, 1024, 33712, 33712, 1024, 1024]
    - [29, 10840.8]
  - - [4096, 312, 1, 1024, 4096, 4096, 1024, 1024]
    - [52, 8600.31]
  - - [1024, 312, 1, 1024, 1024, 1024, 1024, 1024]
    - [40, 5409.32]
  - - [33712, 356, 1, 1024, 33712, 33712, 1024, 1024]
    - [1, 10278.2]
  - - [1024, 356, 1, 1024, 1024, 1024, 1024, 1024]
    - [40, 5966.96]
  - - [33712, 396, 1, 1024, 33712, 33712, 1024, 1024]
    - [8, 9986.5]
  - - [4096, 232, 1, 1024, 4096, 4096, 1024, 1024]
    - [21, 8382.83]
  - - [33712, 268, 1, 1024, 33712, 33712, 1024, 1024]
    - [27, 9672.58]
  - - [4096, 268, 1, 1024, 4096, 4096, 1024, 1024]
    - [38, 7586.89]
  - - [1024, 268, 1, 1024, 1024, 1024, 1024, 1024]
    - [40, 4664.98]
  - - [1024, 360, 1, 1024, 1024, 1024, 1024, 1024]
    - [3, 6144.0]
  - - [33712, 400, 1, 1024, 33712, 33712, 1024, 1024]
    - [8, 10082.1]
  - - [4096, 400, 1, 1024, 4096, 4096, 1024, 1024]
    - [46, 8871.2]
  - - [1024, 400, 1, 1024, 1024, 1024, 1024, 1024]
    - [56, 6636.56]
  - - [1024, 296, 1, 1024, 1024, 1024, 1024, 1024]
    - [26, 5152.37]
  - - [33712, 328, 1, 1024, 33712, 33712, 1024, 1024]
    - [1, 9574.9]
  - - [4096, 328, 1, 1024, 4096, 4096, 1024, 1024]
    - [38, 9017.64]
  - - [1024, 380, 1, 1024, 1024, 1024, 1024, 1024]
    - [40, 6361.09]
  - - [4096, 432, 1, 1024, 4096, 4096, 1024, 1024]
    - [4, 9750.0]
  - - [33712, 280, 1, 1024, 33712, 33712, 1024, 1024]
    - [27, 9469.67]
  - - [4096, 280, 1, 1024, 4096, 4096, 1024, 1024]
    - [4, 8137.51]
  - - [1024, 280, 1, 1024, 1024, 1024, 1024, 1024]
    - [40, 4867.4]
  - - [33712, 320, 1, 1024, 33712, 33712, 1024, 1024]
    - [1, 11159.2]
  - - [4096, 320, 1, 1024, 4096, 4096, 1024, 1024]
    - [38, 8830.11]
  - - [4096, 448, 1, 1024, 4096, 4096, 1024, 1024]
    - [4, 10128.5]
  - - [4096, 492, 1, 1024, 4096, 4096, 1024, 1024]
    - [4, 9994.15]
  - - [1024, 492, 1, 1024, 1024, 1024, 1024, 1024]
    - [27, 6889.68]
  - - [33712, 212, 1, 1024, 33712, 33712, 1024, 1024]
    - [15, 9413.53]
  - - [4096, 212, 1, 1024, 4096, 4096, 1024, 1024]
    - [26, 9140.55]
  - - [33712, 392, 1, 1024, 33712, 33712, 1024, 1024]
    - [7, 9883.89]
  - - [4096, 392, 1, 1024, 4096, 4096, 1024, 1024]
    - [32, 8527.84]
  - - [33712, 456, 1, 1024, 33712, 33712, 1024, 1024]
    - [7, 9533.88]
  - - [4096, 456, 1, 1024, 4096, 4096, 1024, 1024]
    - [4, 8602.91]
  - - [1024, 456, 1, 1024, 1024, 1024, 1024, 1024]
    - [27, 7518.09]
  - - [33712, 468, 1, 1024, 33712, 33712, 1024, 1024]
    - [7, 10030.7]
  - - [4096, 468, 1, 1024, 4096, 4096, 1024, 1024]
    - [4, 8797.64]
  - - [4096, 488, 1, 1024, 4096, 4096, 1024, 1024]
    - [4, 10576.8]
  - - [1024, 488, 1, 1024, 1024, 1024, 1024, 1024]
    - [40, 6775.76]
  - - [33712, 236, 1, 1024, 33712, 33712, 1024, 1024]
    - [14, 10442.7]
  - - [4096, 236, 1, 1024, 4096, 4096, 1024, 1024]
    - [21, 8527.36]
  - - [4096, 260, 1, 1024, 4096, 4096, 1024, 1024]
    - [38, 7861.3]
  - - [1024, 260, 1, 1024, 1024, 1024, 1024, 1024]
    - [26, 4531.74]
  - - [4096, 372, 1, 1024, 4096, 4096, 1024, 1024]
    - [4, 10115.9]
  - - [4096, 364, 1, 1024, 4096, 4096, 1024, 1024]
    - [4, 9237.21]
  - - [1024, 364, 1, 1024, 1024, 1024, 1024, 1024]
    - [40, 6220.37]
  - - [33712, 472, 1, 1024, 33712, 33712, 1024, 1024]
    - [8, 10343.5]
  - - [4096, 472, 1, 1024, 4096, 4096, 1024, 1024]
    - [4, 9610.23]
  - - [4096, 240, 1, 1024, 4096, 4096, 1024, 1024]
    - [4, 8665.92]
  - - [33712, 292, 1, 1024, 33712, 33712, 1024, 1024]
    - [1, 9510.28]
  - - [4096, 292, 1, 1024, 4096, 4096, 1024, 1024]
    - [51, 8057.48]
  - - [1024, 292, 1, 1024, 1024, 1024, 1024, 1024]
    - [40, 5076.0]
  - - [33712, 348, 1, 1024, 33712, 33712, 1024, 1024]
    - [11, 9836.65]
  - - [4096, 348, 1, 1024, 4096, 4096, 1024, 1024]
    - [4, 8222.27]
  - - [1024, 348, 1, 1024, 1024, 1024, 1024, 1024]
    - [26, 6025.5]
  - - [33712, 408, 1, 1024, 33712, 33712, 1024, 1024]
    - [8, 10286.7]
  - - [4096, 408, 1, 1024, 4096, 4096, 1024, 1024]
    - [46, 8898.07]
  - - [1024, 408, 1, 1024, 1024, 1024, 1024, 1024]
    - [3, 6927.12]
  - - [33712, 208, 1, 1024, 33712, 33712, 1024, 1024]
    - [15, 9234.97]
  - - [4096, 208, 1, 1024, 4096, 4096, 1024, 1024]
    - [26, 8493.14]
  - - [33712, 264, 1, 1024, 33712, 33712, 1024, 1024]
    - [30, 9143.53]
  - - [1024, 264, 1, 1024, 1024, 1024, 1024, 1024]
    - [26, 4589.26]
  - - [1024, 2912, 1, 4096, 1024, 1024, 4096, 4096]
    - [7, 9554.56]
  - - [33712, 7424, 1, 1024, 33712, 33712, 1024, 1024]
    - [7, 11322.4]
  - - [4096, 7424, 1, 1024, 4096, 4096, 1024, 1024]
    - [7, 11502.8]
  - - [1024, 9960, 1, 4096, 1024, 1024, 4096, 4096]
    - [3, 11086.8]
  - - [1024, 7904, 1, 1024, 1024, 1024, 1024, 1024]
    - [3, 11409.6]
  - - [1024, 5840, 1, 1024, 1024, 1024, 1024, 1024]
    - [32, 10756.9]
  - - [1024, 8208, 1, 4096, 1024, 1024, 4096, 4096]
    - [43, 10560.6]
  - - [1024, 8208, 1, 1024, 1024, 1024, 1024, 1024]
    - [3, 11513.7]
  - - [4096, 7072, 1, 1024, 4096, 4096, 1024, 1024]
    - [7, 11510.5]
  - - [1024, 8320, 1, 1024, 1024, 1024, 1024, 1024]
    - [3, 11358.4]
  - - [1024, 7448, 1, 4096, 1024, 1024, 4096, 4096]
    - [24, 10285.5]
  - - [1024, 9512, 1, 1024, 1024, 1024, 1024, 1024]
    - [4, 11428.7]
  - - [33712, 8192, 1, 1024, 33712, 33712, 1024, 1024]
    - [5, 10958.2]
  - - [4096, 8432, 1, 1024, 4096, 4096, 1024, 1024]
    - [1, 11422.0]
  - - [1024, 1344, 1, 1024, 1024, 1024, 1024, 1024]
    - [3, 10485.8]
  - - [1024, 468, 1, 1024, 1024, 1024, 1024, 1024]
    - [26, 7745.16]
  - - [4096, 3240, 1, 1024, 4096, 4096, 1024, 1024]
    - [11, 10743.7]
  - - [4096, 9960, 1, 1024, 4096, 4096, 1024, 1024]
    - [3, 11813.2]
  - - [1024, 9960, 1, 1024, 1024, 1024, 1024, 1024]
    - [31, 11038.1]
  - - [4096, 8288, 1, 1024, 4096, 4096, 1024, 1024]
    - [3, 11792.8]
  - - [33712, 4368, 1, 1024, 33712, 33712, 1024, 1024]
    - [2, 10725.3]
  - - [4096, 9968, 1, 1024, 4096, 4096, 1024, 1024]
    - [14, 11577.0]
  - - [4096, 9200, 1, 1024, 4096, 4096, 1024, 1024]
    - [31, 11869.0]
  - - [1024, 7200, 1, 1024, 1024, 1024, 1024, 1024]
    - [3, 11366.0]
  - - [1024, 7752, 1, 4096, 1024, 1024, 4096, 4096]
    - [29, 10703.9]
  - - [4096, 7752, 1, 1024, 4096, 4096, 1024, 1024]
    - [7, 11479.7]
  - - [4096, 9048, 1, 1024, 4096, 4096, 1024, 1024]
    - [31, 11845.4]
  - - [4096, 8320, 1, 1024, 4096, 4096, 1024, 1024]
    - [4, 11786.8]
  - - [1024, 6800, 1, 4096, 1024, 1024, 4096, 4096]
    - [7, 10721.9]
  - - [33712, 4896, 1, 1024, 33712, 33712, 1024, 1024]
    - [40, 10397.1]
  - - [33712, 7616, 1, 1024, 33712, 33712, 1024, 1024]
    - [6, 10938.2]
  - - [1024, 9144, 1, 1024, 1024, 1024, 1024, 1024]
    - [3, 12355.8]
  - - [33712, 4488, 1, 1024, 33712, 33712, 1024, 1024]
    - [44, 10391.7]
  - - [33712, 6400, 1, 1024, 33712, 33712, 1024, 1024]
    - [31, 11655.3]
  - - [4096, 7840, 1, 1024, 4096, 4096, 1024, 1024]
    - [8, 11446.1]
  - - [1024, 7840, 1, 1024, 1024, 1024, 1024, 1024]
    - [3, 11314.7]
  - - [4096, 9760, 1, 1024, 4096, 4096, 1024, 1024]
    - [31, 11309.1]
  - - [1024, 4608, 1, 4096, 1024, 1024, 4096, 4096]
    - [5, 10092.4]
  - - [1024, 9168, 1, 1024, 1024, 1024, 1024, 1024]
    - [11, 10907.3]
  - - [1024, 9696, 1, 4096, 1024, 1024, 4096, 4096]
    - [3, 11304.4]
  - - [4096, 13312, 1, 1024, 4096, 4096, 1024, 1024]
    - [9, 10809.7]
  - - [4096, 9696, 1, 1024, 4096, 4096, 1024, 1024]
    - [45, 11353.9]
  - - [33712, 8000, 1, 1024, 33712, 33712, 1024, 1024]
    - [12, 10936.0]
  - - [4096, 5760, 1, 1024, 4096, 4096, 1024, 1024]
    - [14, 11445.9]
  - - [1024, 6600, 1, 4096, 1024, 1024, 4096, 4096]
    - [7, 10501.0]
  - - [1024, 8128, 1, 4096, 1024, 1024, 4096, 4096]
    - [43, 10984.1]
  - - [1024, 7040, 1, 4096, 1024, 1024, 4096, 4096]
    - [7, 10533.3]
  - - [1024, 9656, 1, 4096, 1024, 1024, 4096, 4096]
    - [3, 11783.9]
  - - [1024, 8216, 1, 4096, 1024, 1024, 4096, 4096]
    - [3, 11087.9]
  - - [1024, 3240, 1, 4096, 1024, 1024, 4096, 4096]
    - [24, 9508.45]
  - - [33712, 9440, 1, 1024, 33712, 33712, 1024, 1024]
    - [7, 10301.3]
  - - [1024, 9440, 1, 4096, 1024, 1024, 4096, 4096]
    - [3, 11168.9]
  - - [4096, 9440, 1, 1024, 4096, 4096, 1024, 1024]
    - [4, 11779.2]
  - - [1024, 6160, 1, 4096, 1024, 1024, 4096, 4096]
    - [30, 9925.62]
  - - [4096, 6160, 1, 1024, 4096, 4096, 1024, 1024]
    - [15, 10400.3]
  - - [33712, 4352, 1, 1024, 33712, 33712, 1024, 1024]
    - [26, 10286.9]
  - - [1024, 8816, 1, 4096, 1024, 1024, 4096, 4096]
    - [3, 11906.5]
  - - [1024, 2720, 1, 1024, 1024, 1024, 1024, 1024]
    - [3, 11386.6]
  - - [1024, 6968, 1, 4096, 1024, 1024, 4096, 4096]
    - [3, 11057.0]
  - - [33712, 5360, 1, 1024, 33712, 33712, 1024, 1024]
    - [8, 11348.8]
  - - [1024, 4800, 1, 4096, 1024, 1024, 4096, 4096]
    - [14, 10883.4]
  - - [1024, 9000, 1, 1024, 1024, 1024, 1024, 1024]
    - [31, 10165.8]
  - - [4096, 26624, 1, 1024, 4096, 4096, 1024, 1024]
    - [18, 9807.12]
  - - [33712, 9048, 1, 1024, 33712, 33712, 1024, 1024]
    - [5, 10388.7]
  - - [1024, 9840, 1, 4096, 1024, 1024, 4096, 4096]
    - [3, 11692.8]
  - - [33712, 10120, 1, 1024, 33712, 33712, 1024, 1024]
    - [14, 10162.8]
  - - [33712, 8816, 1, 1024, 33712, 33712, 1024, 1024]
    - [3, 10795.7]
  - - [4096, 4048, 1, 1024, 4096, 4096, 1024, 1024]
    - [4, 11504.9]
  - - [1024, 5640, 1, 1024, 1024, 1024, 1024, 1024]
    - [3, 10974.5]
  - - [1024, 308, 1, 1024, 1024, 1024, 1024, 1024]
    - [40, 5361.25]
  - - [1024, 8944, 1, 4096, 1024, 1024, 4096, 4096]
    - [3, 11128.5]
  - - [4096, 9184, 1, 1024, 4096, 4096, 1024, 1024]
    - [3, 12371.9]
  - - [4096, 332, 1, 1024, 4096, 4096, 1024, 1024]
    - [38, 9740.51]
  - - [4096, 9656, 1, 1024, 4096, 4096, 1024, 1024]
    - [3, 11818.9]
  - - [1024, 33792, 1, 4096, 1024, 1024, 4096, 4096]
    - [1, 10869.4]
  - - [1024, 324, 1, 1024, 1024, 1024, 1024, 1024]
    - [26, 5609.95]
  - - [1024, 6080, 1, 1024, 1024, 1024, 1024, 1024]
    - [3, 11386.1]
  - - [4096, 8008, 1, 1024, 4096, 4096, 1024, 1024]
    - [3, 10883.4]
  - - [1024, 8528, 1, 4096, 1024, 1024, 4096, 4096]
    - [3, 11600.0]
  - - [1024, 6864, 1, 1024, 1024, 1024, 1024, 1024]
    - [3, 11202.5]
  - - [4096, 2912, 1, 1024, 4096, 4096, 1024, 1024]
    - [29, 10319.2]
  - - [1024, 8880, 1, 1024, 1024, 1024, 1024, 1024]
    - [44, 10159.9]
  - - [1024, 8024, 1, 4096, 1024, 1024, 4096, 4096]
    - [3, 11111.9]
  - - [1024, 9792, 1, 4096, 1024, 1024, 4096, 4096]
    - [3, 11247.5]
  - - [33712, 9408, 1, 1024, 33712, 33712, 1024, 1024]
    - [3, 10606.6]
  - - [4096, 9408, 1, 1024, 4096, 4096, 1024, 1024]
    - [45, 11904.4]
  - - [1024, 3240, 1, 1024, 1024, 1024, 1024, 1024]
    - [3, 10953.6]
  - - [4096, 396, 1, 1024, 4096, 4096, 1024, 1024]
    - [45, 8632.74]
  - - [33712, 8064, 1, 1024, 33712, 33712, 1024, 1024]
    - [8, 11264.4]
  - - [1024, 8840, 1, 4096, 1024, 1024, 4096, 4096]
    - [3, 10674.3]
  - - [4096, 4472, 1, 1024, 4096, 4096, 1024, 1024]
    - [31, 11968.4]
  - - [4096, 3024, 1, 1024, 4096, 4096, 1024, 1024]
    - [8, 10169.6]
  - - [4096, 6784, 1, 1024, 4096, 4096, 1024, 1024]
    - [14, 10772.5]
  - - [1024, 2400, 1, 1024, 1024, 1024, 1024, 1024]
    - [8, 9772.34]
  - - [4096, 10168, 1, 1024, 4096, 4096, 1024, 1024]
    - [3, 11807.4]
  - - [1024, 4032, 1, 1024, 1024, 1024, 1024, 1024]
    - [4, 10758.9]
  - - [1024, 9408, 1, 4096, 1024, 1024, 4096, 4096]
    - [43, 10338.5]
  - - [33712, 5760, 1, 1024, 33712, 33712, 1024, 1024]
    - [31, 10694.2]
  - - [1024, 8288, 1, 1024, 1024, 1024, 1024, 1024]
    - [3, 12106.5]
  - - [4096, 9088, 1, 1024, 4096, 4096, 1024, 1024]
    - [31, 11893.9]
  - - [1024, 7040, 1, 1024, 1024, 1024, 1024, 1024]
    - [3, 11465.5]
  - - [33712, 10112, 1, 1024, 33712, 33712, 1024, 1024]
    - [14, 10257.5]
  - - [1024, 9408, 1, 1024, 1024, 1024, 1024, 1024]
    - [3, 12396.9]
  - - [1024, 5984, 1, 1024, 1024, 1024, 1024, 1024]
    - [3, 11217.6]
  - - [4096, 8904, 1, 1024, 4096, 4096, 1024, 1024]
    - [31, 12061.1]
  - - [4096, 248, 1, 1024, 4096, 4096, 1024, 1024]
    - [4, 8954.74]
  - - [33712, 5576, 1, 1024, 33712, 33712, 1024, 1024]
    - [9, 11052.7]
  - - [4096, 8880, 1, 1024, 4096, 4096, 1024, 1024]
    - [4, 11804.4]
  - - [1024, 9800, 1, 4096, 1024, 1024, 4096, 4096]
    - [3, 11186.3]
  - - [33712, 8968, 1, 1024, 33712, 33712, 1024, 1024]
    - [45, 10587.2]
  - - [4096, 216, 1, 1024, 4096, 4096, 1024, 1024]
    - [57, 8895.97]
  - - [4096, 7800, 1, 1024, 4096, 4096, 1024, 1024]
    - [4, 12180.3]
  - - [1024, 7800, 1, 1024, 1024, 1024, 1024, 1024]
    - [4, 11254.5]
  - - [1024, 5760, 1, 4096, 1024, 1024, 4096, 4096]
    - [16, 10206.1]
  - - [33712, 9504, 1, 1024, 33712, 33712, 1024, 1024]
    - [3, 10231.0]
  - - [4096, 9752, 1, 1024, 4096, 4096, 1024, 1024]
    - [14, 11453.5]
  - - [33712, 7936, 1, 1024, 33712, 33712, 1024, 1024]
    - [6, 11186.5]
  - - [1024, 9344, 1, 1024, 1024, 1024, 1024, 1024]
    - [3, 12323.7]
  - - [33712, 8832, 1, 1024, 33712, 33712, 1024, 1024]
    - [5, 10809.1]
  - - [1024, 8904, 1, 4096, 1024, 1024, 4096, 4096]
    - [3, 10539.2]
  - - [33712, 9384, 1, 1024, 33712, 33712, 1024, 1024]
    - [3, 10278.5]
  - - [33712, 9112, 1, 1024, 33712, 33712, 1024, 1024]
    - [3, 10561.6]
  - - [4096, 9384, 1, 1024, 4096, 4096, 1024, 1024]
    - [45, 11885.8]
  - - [4096, 296, 1, 1024, 4096, 4096, 1024, 1024]
    - [4, 9171.91]
  - - [1024, 9384, 1, 1024, 1024, 1024, 1024, 1024]
    - [14, 10916.6]
  - - [4096, 9168, 1, 1024, 4096, 4096, 1024, 1024]
    - [3, 11789.4]
  - - [33712, 372, 1, 1024, 33712, 33712, 1024, 1024]
    - [8, 10725.8]
  - - [1024, 6912, 1, 4096, 1024, 1024, 4096, 4096]
    - [7, 10602.6]
  - - [4096, 6912, 1, 1024, 4096, 4096, 1024, 1024]
    - [14, 10790.8]
  - - [1024, 9152, 1, 4096, 1024, 1024, 4096, 4096]
    - [3, 11779.5]
  - - [33712, 7168, 1, 1024, 33712, 33712, 1024, 1024]
    - [3, 11674.1]
  - - [33712, 10000, 1, 1024, 33712, 33712, 1024, 1024]
    - [14, 10364.1]
  - - [4096, 4704, 1, 1024, 4096, 4096, 1024, 1024]
    - [8, 12106.0]
  - - [1024, 8352, 1, 4096, 1024, 1024, 4096, 4096]
    - [3, 10990.2]
  - - [4096, 8352, 1, 1024, 4096, 4096, 1024, 1024]
    - [4, 11777.7]
  - - [33712, 9840, 1, 1024, 33712, 33712, 1024, 1024]
    - [3, 10206.9]
  - - [1024, 7296, 1, 4096, 1024, 1024, 4096, 4096]
    - [29, 10818.8]
  - - [4096, 1344, 1, 1024, 4096, 4096, 1024, 1024]
    - [4, 12074.0]
  - - [33712, 5280, 1, 1024, 33712, 33712, 1024, 1024]
    - [1, 10641.9]
  - - [4096, 7904, 1, 1024, 4096, 4096, 1024, 1024]
    - [7, 11530.2]
  - - [1024, 7360, 1, 1024, 1024, 1024, 1024, 1024]
    - [3, 11271.0]
  - - [4096, 2400, 1, 1024, 4096, 4096, 1024, 1024]
    - [8, 10296.1]
  - - [33712, 5800, 1, 1024, 33712, 33712, 1024, 1024]
    - [45, 11071.8]
  - - [1024, 5800, 1, 4096, 1024, 1024, 4096, 4096]
    - [1, 10308.7]
  - - [4096, 5800, 1, 1024, 4096, 4096, 1024, 1024]
    - [7, 11448.1]
  - - [1024, 5800, 1, 1024, 1024, 1024, 1024, 1024]
    - [7, 10680.2]
  - - [4096, 6600, 1, 1024, 4096, 4096, 1024, 1024]
    - [14, 11505.5]
  - - [4096, 8208, 1, 1024, 4096, 4096, 1024, 1024]
    - [7, 11473.4]
  - - [4096, 7056, 1, 1024, 4096, 4096, 1024, 1024]
    - [7, 11495.1]
  - - [33712, 10040, 1, 1024, 33712, 33712, 1024, 1024]
    - [14, 10277.2]
  - - [33712, 8320, 1, 1024, 33712, 33712, 1024, 1024]
    - [5, 11107.7]
  - - [1024, 10000, 1, 1024, 1024, 1024, 1024, 1024]
    - [3, 12268.0]
  - - [1024, 8512, 1, 4096, 1024, 1024, 4096, 4096]
    - [5, 11413.6]
  - - [33712, 336, 1, 1024, 33712, 33712, 1024, 1024]
    - [2, 9818.38]
  - - [1024, 20480, 1, 1024, 1024, 1024, 1024, 1024]
    - [5, 10468.5]
  - - [4096, 8856, 1, 1024, 4096, 4096, 1024, 1024]
    - [32, 11332.0]
  - - [1024, 4896, 1, 4096, 1024, 1024, 4096, 4096]
    - [6, 10257.4]
  - - [1024, 9296, 1, 4096, 1024, 1024, 4096, 4096]
    - [3, 10310.9]
  - - [1024, 7168, 1, 1024, 1024, 1024, 1024, 1024]
    - [3, 11315.4]
  - - [1024, 396, 1, 1024, 1024, 1024, 1024, 1024]
    - [40, 6496.13]
  - - [1024, 3040, 1, 4096, 1024, 1024, 4096, 4096]
    - [30, 9318.46]
  - - [1024, 9520, 1, 1024, 1024, 1024, 1024, 1024]
    - [14, 10259.8]
  - - [1024, 8064, 1, 1024, 1024, 1024, 1024, 1024]
    - [3, 10498.2]
  - - [4096, 8816, 1, 1024, 4096, 4096, 1024, 1024]
    - [31, 11378.0]
  - - [4096, 2176, 1, 1024, 4096, 4096, 1024, 1024]
    - [14, 11121.5]
  - - [4096, 8944, 1, 1024, 4096, 4096, 1024, 1024]
    - [3, 11809.2]
  - - [33712, 6624, 1, 1024, 33712, 33712, 1024, 1024]
    - [3, 11911.1]
  - - [1024, 8016, 1, 4096, 1024, 1024, 4096, 4096]
    - [43, 10931.9]
  - - [33712, 5600, 1, 1024, 33712, 33712, 1024, 1024]
    - [7, 10958.1]
  - - [1024, 5600, 1, 1024, 1024, 1024, 1024, 1024]
    - [3, 12112.2]
  - - [1024, 4800, 1, 1024, 1024, 1024, 1024, 1024]
    - [3, 10256.7]
  - - [1024, 8024, 1, 1024, 1024, 1024, 1024, 1024]
    - [3, 10452.4]
  - - [1024, 8232, 1, 1024, 1024, 1024, 1024, 1024]
    - [3, 10707.4]
  - - [4096, 9928, 1, 1024, 4096, 4096, 1024, 1024]
    - [45, 11332.5]
  - - [1024, 1232, 1, 4096, 1024, 1024, 4096, 4096]
    - [4, 9132.19]
  - - [4096, 8576, 1, 1024, 4096, 4096, 1024, 1024]
    - [4, 11797.2]
  - - [33712, 8784, 1, 1024, 33712, 33712, 1024, 1024]
    - [3, 10767.7]
  - - [4096, 9672, 1, 1024, 4096, 4096, 1024, 1024]
    - [4, 11776.3]
  - - [1024, 4704, 1, 4096, 1024, 1024, 4096, 4096]
    - [1, 9464.79]
  - - [1024, 2912, 1, 1024, 1024, 1024, 1024, 1024]
    - [21, 10028.4]
  - - [1024, 3344, 1, 4096, 1024, 1024, 4096, 4096]
    - [7, 9709.86]
  - - [1024, 8320, 1, 4096, 1024, 1024, 4096, 4096]
    - [43, 10500.1]
  - - [1024, 8816, 1, 1024, 1024, 1024, 1024, 1024]
    - [3, 11416.0]
  - - [33712, 2400, 1, 1024, 33712, 33712, 1024, 1024]
    - [45, 10493.7]
  - - [1024, 8096, 1, 4096, 1024, 1024, 4096, 4096]
    - [3, 11123.8]
  - - [4096, 8096, 1, 1024, 4096, 4096, 1024, 1024]
    - [46, 11363.8]
  - - [1024, 2720, 1, 4096, 1024, 1024, 4096, 4096]
    - [17, 9639.43]
  - - [1024, 9512, 1, 4096, 1024, 1024, 4096, 4096]
    - [7, 10756.9]
  - - [1024, 8832, 1, 4096, 1024, 1024, 4096, 4096]
    - [3, 11219.2]
  - - [4096, 8832, 1, 1024, 4096, 4096, 1024, 1024]
    - [4, 11826.7]
  - - [1024, 8832, 1, 1024, 1024, 1024, 1024, 1024]
    - [14, 11303.8]
  - - [1024, 3024, 1, 1024, 1024, 1024, 1024, 1024]
    - [8, 9968.81]
  - - [1024, 3024, 1, 4096, 1024, 1024, 4096, 4096]
    - [7, 9746.96]
  - - [1024, 4760, 1, 4096, 1024, 1024, 4096, 4096]
    - [24, 9417.71]
  - - [33712, 8200, 1, 1024, 33712, 33712, 1024, 1024]
    - [12, 10761.7]
  - - [4096, 6072, 1, 1024, 4096, 4096, 1024, 1024]
    - [1, 11408.6]
  - - [1024, 9280, 1, 4096, 1024, 1024, 4096, 4096]
    - [3, 11101.1]
  - - [1024, 8640, 1, 1024, 1024, 1024, 1024, 1024]
    - [14, 11067.8]
  - - [1024, 5784, 1, 1024, 1024, 1024, 1024, 1024]
    - [31, 10532.3]
  - - [1024, 9072, 1, 4096, 1024, 1024, 4096, 4096]
    - [29, 10415.9]
  - - [4096, 9072, 1, 1024, 4096, 4096, 1024, 1024]
    - [4, 11822.2]
  - - [1024, 9072, 1, 1024, 1024, 1024, 1024, 1024]
    - [2, 11071.5]
  - - [4096, 3120, 1, 1024, 4096, 4096, 1024, 1024]
    - [11, 10703.9]
  - - [1024, 4968, 1, 4096, 1024, 1024, 4096, 4096]
    - [11, 9738.47]
  - - [4096, 8192, 1, 1024, 4096, 4096, 1024, 1024]
    - [30, 10705.3]
  - - [1024, 428, 1, 1024, 1024, 1024, 1024, 1024]
    - [3, 7173.76]
  - - [1024, 9424, 1, 4096, 1024, 1024, 4096, 4096]
    - [3, 11165.8]
  - - [1024, 7632, 1, 1024, 1024, 1024, 1024, 1024]
    - [3, 11336.6]
  - - [4096, 7200, 1, 1024, 4096, 4096, 1024, 1024]
    - [30, 10701.5]
  - - [4096, 5880, 1, 1024, 4096, 4096, 1024, 1024]
    - [5, 11202.0]
  - - [33712, 8616, 1, 1024, 33712, 33712, 1024, 1024]
    - [8, 11106.3]
  - - [1024, 8400, 1, 1024, 1024, 1024, 1024, 1024]
    - [3, 12260.6]
  - - [1024, 8120, 1, 1024, 1024, 1024, 1024, 1024]
    - [3, 11392.6]
  - - [1024, 3040, 1, 1024, 1024, 1024, 1024, 1024]
    - [8, 9288.05]
  - - [1024, 17408, 1, 1024, 1024, 1024, 1024, 1024]
    - [1, 10577.6]
  - - [1024, 912, 1, 4096, 1024, 1024, 4096, 4096]
    - [3, 9100.67]
  - - [4096, 344, 1, 1024, 4096, 4096, 1024, 1024]
    - [4, 8767.84]
  - - [1024, 8960, 1, 4096, 1024, 1024, 4096, 4096]
    - [3, 10950.4]
  - - [4096, 8960, 1, 1024, 4096, 4096, 1024, 1024]
    - [4, 11843.5]
  - - [1024, 8960, 1, 1024, 1024, 1024, 1024, 1024]
    - [15, 11501.3]
  - - [33712, 4704, 1, 1024, 33712, 33712, 1024, 1024]
    - [7, 10673.2]
  - - [1024, 8600, 1, 4096, 1024, 1024, 4096, 4096]
    - [11, 10783.9]
  - - [1024, 9152, 1, 1024, 1024, 1024, 1024, 1024]
    - [3, 11230.8]
  - - [1024, 9672, 1, 4096, 1024, 1024, 4096, 4096]
    - [3, 10817.0]
  - - [4096, 11776, 1, 1024, 4096, 4096, 1024, 1024]
    - [7, 11618.1]
  - - [4096, 10240, 1, 1024, 4096, 4096, 1024, 1024]
    - [3, 11820.4]
  - - [1024, 7800, 1, 4096, 1024, 1024, 4096, 4096]
    - [3, 11137.1]
  - - [33712, 7872, 1, 1024, 33712, 33712, 1024, 1024]
    - [5, 10770.5]
  - - [1024, 6128, 1, 1024, 1024, 1024, 1024, 1024]
    - [3, 12264.6]
  - - [4096, 9472, 1, 1024, 4096, 4096, 1024, 1024]
    - [45, 12043.0]
  - - [1024, 6864, 1, 4096, 1024, 1024, 4096, 4096]
    - [3, 10664.4]
  - - [4096, 10200, 1, 1024, 4096, 4096, 1024, 1024]
    - [14, 11542.7]
  - - [1024, 6240, 1, 4096, 1024, 1024, 4096, 4096]
    - [7, 10913.2]
  - - [33712, 9912, 1, 1024, 33712, 33712, 1024, 1024]
    - [14, 10654.8]
  - - [33712, 7744, 1, 1024, 33712, 33712, 1024, 1024]
    - [6, 11203.2]
  - - [4096, 7744, 1, 1024, 4096, 4096, 1024, 1024]
    - [14, 11509.4]
  - - [1024, 7744, 1, 1024, 1024, 1024, 1024, 1024]
    - [3, 12307.7]
  - - [33712, 9856, 1, 1024, 33712, 33712, 1024, 1024]
    - [3, 10016.0]
  - - [1024, 5640, 1, 4096, 1024, 1024, 4096, 4096]
    - [14, 10290.1]
  - - [4096, 2720, 1, 1024, 4096, 4096, 1024, 1024]
    - [29, 11093.4]
  - - [1024, 7360, 1, 4096, 1024, 1024, 4096, 4096]
    - [3, 10383.3]
  - - [1024, 9016, 1, 4096, 1024, 1024, 4096, 4096]
    - [3, 11167.7]
  - - [1024, 9016, 1, 1024, 1024, 1024, 1024, 1024]
    - [1, 11003.2]
  - - [33712, 8016, 1, 1024, 33712, 33712, 1024, 1024]
    - [12, 10970.2]
  - - [1024, 7072, 1, 4096, 1024, 1024, 4096, 4096]
    - [1, 10669.5]
  - - [1024, 9696, 1, 1024, 1024, 1024, 1024, 1024]
    - [3, 11390.8]
  - - [1024, 6936, 1, 4096, 1024, 1024, 4096, 4096]
    - [7, 10391.0]
  - - [1024, 8200, 1, 1024, 1024, 1024, 1024, 1024]
    - [3, 11509.8]
  - - [4096, 7208, 1, 1024, 4096, 4096, 1024, 1024]
    - [7, 11544.4]
  - - [1024, 8192, 1, 4096, 1024, 1024, 4096, 4096]
    - [3, 11257.2]
  - - [1024, 9576, 1, 1024, 1024, 1024, 1024, 1024]
    - [3, 10677.5]
  - - [4096, 9280, 1, 1024, 4096, 4096, 1024, 1024]
    - [46, 11436.1]
  - - [4096, 10032, 1, 1024, 4096, 4096, 1024, 1024]
    - [3, 11837.5]
  - - [4096, 9504, 1, 1024, 4096, 4096, 1024, 1024]
    - [3, 11781.1]
  - - [1024, 484, 1, 1024, 1024, 1024, 1024, 1024]
    - [27, 6777.66]
  - - [4096, 3584, 1, 1024, 4096, 4096, 1024, 1024]
    - [8, 11348.2]
  - - [4096, 7176, 1, 1024, 4096, 4096, 1024, 1024]
    - [7, 11467.6]
  - - [1024, 8856, 1, 1024, 1024, 1024, 1024, 1024]
    - [3, 11459.9]
  - - [1024, 452, 1, 1024, 1024, 1024, 1024, 1024]
    - [57, 7350.44]
  - - [1024, 6960, 1, 1024, 1024, 1024, 1024, 1024]
    - [3, 11343.7]
  - - [1024, 5600, 1, 4096, 1024, 1024, 4096, 4096]
    - [17, 9936.72]
  - - [4096, 8016, 1, 1024, 4096, 4096, 1024, 1024]
    - [7, 11090.0]
  - - [4096, 10208, 1, 1024, 4096, 4096, 1024, 1024]
    - [3, 11781.6]
  - - [1024, 10032, 1, 4096, 1024, 1024, 4096, 4096]
    - [5, 10816.1]
  - - [1024, 2400, 1, 4096, 1024, 1024, 4096, 4096]
    - [2, 9003.84]
  - - [1024, 10224, 1, 1024, 1024, 1024, 1024, 1024]
    - [11, 11090.6]
  - - [4096, 444, 1, 1024, 4096, 4096, 1024, 1024]
    - [4, 10003.6]
  - - [1024, 5120, 1, 1024, 1024, 1024, 1024, 1024]
    - [3, 11271.2]
  - - [4096, 8200, 1, 1024, 4096, 4096, 1024, 1024]
    - [32, 12113.7]
  - - [33712, 8664, 1, 1024, 33712, 33712, 1024, 1024]
    - [3, 10921.3]
  - - [1024, 9400, 1, 4096, 1024, 1024, 4096, 4096]
    - [3, 11166.9]
  - - [1024, 7696, 1, 4096, 1024, 1024, 4096, 4096]
    - [4, 10868.4]
  - - [4096, 8624, 1, 1024, 4096, 4096, 1024, 1024]
    - [4, 11785.9]
  - - [1024, 8664, 1, 1024, 1024, 1024, 1024, 1024]
    - [3, 11510.3]
  - - [33712, 10168, 1, 1024, 33712, 33712, 1024, 1024]
    - [14, 10208.3]
  - - [33712, 5984, 1, 1024, 33712, 33712, 1024, 1024]
    - [45, 11559.7]
  - - [33712, 9728, 1, 1024, 33712, 33712, 1024, 1024]
    - [3, 10305.6]
  - - [1024, 5888, 1, 1024, 1024, 1024, 1024, 1024]
    - [3, 12240.3]
  - - [33712, 444, 1, 1024, 33712, 33712, 1024, 1024]
    - [8, 10400.1]
  - - [4096, 9728, 1, 1024, 4096, 4096, 1024, 1024]
    - [45, 11395.9]
  - - [1024, 5776, 1, 4096, 1024, 1024, 4096, 4096]
    - [8, 10165.8]
  - - [1024, 9240, 1, 1024, 1024, 1024, 1024, 1024]
    - [31, 10763.4]
  - - [1024, 10240, 1, 4096, 1024, 1024, 4096, 4096]
    - [3, 11240.3]
  - - [4096, 9976, 1, 1024, 4096, 4096, 1024, 1024]
    - [3, 11845.0]
  - - [1024, 4968, 1, 1024, 1024, 1024, 1024, 1024]
    - [31, 11310.8]
  - - [1024, 9504, 1, 1024, 1024, 1024, 1024, 1024]
    - [60, 10251.9]
  - - [4096, 7040, 1, 1024, 4096, 4096, 1024, 1024]
    - [8, 11472.6]
  - - [1024, 8400, 1, 4096, 1024, 1024, 4096, 4096]
    - [3, 11024.1]
  - - [1024, 7176, 1, 4096, 1024, 1024, 4096, 4096]
    - [7, 10625.5]
  - - [1024, 9240, 1, 4096, 1024, 1024, 4096, 4096]
    - [3, 11620.3]
  - - [1024, 10064, 1, 1024, 1024, 1024, 1024, 1024]
    - [14, 11182.6]
  - - [33712, 7040, 1, 1024, 33712, 33712, 1024, 1024]
    - [7, 11596.9]
  - - [1024, 9752, 1, 1024, 1024, 1024, 1024, 1024]
    - [3, 12263.4]
  - - [1024, 4920, 1, 4096, 1024, 1024, 4096, 4096]
    - [7, 9619.21]
  - - [4096, 9880, 1, 1024, 4096, 4096, 1024, 1024]
    - [31, 11339.1]
  - - [4096, 4032, 1, 1024, 4096, 4096, 1024, 1024]
    - [8, 11343.2]
  - - [4096, 428, 1, 1024, 4096, 4096, 1024, 1024]
    - [45, 9307.12]
  - - [1024, 6624, 1, 1024, 1024, 1024, 1024, 1024]
    - [45, 10607.4]
  - - [1024, 5888, 1, 4096, 1024, 1024, 4096, 4096]
    - [14, 10547.7]
  - - [1024, 6336, 1, 4096, 1024, 1024, 4096, 4096]
    - [30, 9817.29]
  - - [1024, 9144, 1, 4096, 1024, 1024, 4096, 4096]
    - [3, 11264.8]
  - - [33712, 9696, 1, 1024, 33712, 33712, 1024, 1024]
    - [3, 10149.2]
  - - [1024, 10152, 1, 1024, 1024, 1024, 1024, 1024]
    - [3, 12467.3]
  - - [4096, 9952, 1, 1024, 4096, 4096, 1024, 1024]
    - [3, 11818.9]
  - - [33712, 8432, 1, 1024, 33712, 33712, 1024, 1024]
    - [5, 10821.3]
  - - [33712, 364, 1, 1024, 33712, 33712, 1024, 1024]
    - [3, 11640.0]
  - - [1024, 6664, 1, 4096, 1024, 1024, 4096, 4096]
    - [7, 10519.5]
  - - [33712, 2912, 1, 1024, 33712, 33712, 1024, 1024]
    - [7, 9985.4]
  - - [1024, 8928, 1, 4096, 1024, 1024, 4096, 4096]
    - [3, 10346.7]
  - - [1024, 10224, 1, 4096, 1024, 1024, 4096, 4096]
    - [3, 11154.3]
  - - [1024, 10120, 1, 4096, 1024, 1024, 4096, 4096]
    - [3, 11208.3]
  - - [4096, 6720, 1, 1024, 4096, 4096, 1024, 1024]
    - [1, 10629.3]
  - - [1024, 6480, 1, 1024, 1024, 1024, 1024, 1024]
    - [4, 11300.5]
  - - [33712, 296, 1, 1024, 33712, 33712, 1024, 1024]
    - [30, 9710.91]
  - - [1024, 6496, 1, 1024, 1024, 1024, 1024, 1024]
    - [3, 10503.8]
  - - [1024, 10176, 1, 4096, 1024, 1024, 4096, 4096]
    - [24, 10437.5]
  - - [33712, 9512, 1, 1024, 33712, 33712, 1024, 1024]
    - [14, 10440.6]
  - - [1024, 8664, 1, 4096, 1024, 1024, 4096, 4096]
    - [3, 10691.8]
  - - [1024, 9840, 1, 1024, 1024, 1024, 1024, 1024]
    - [2, 11161.8]
  - - [1024, 9272, 1, 1024, 1024, 1024, 1024, 1024]
    - [3, 10587.1]
  - - [4096, 8216, 1, 1024, 4096, 4096, 1024, 1024]
    - [3, 11774.0]
  - - [1024, 8448, 1, 4096, 1024, 1024, 4096, 4096]
    - [3, 11634.6]
  - - [4096, 9888, 1, 1024, 4096, 4096, 1024, 1024]
    - [45, 11352.3]
  - - [4096, 8640, 1, 1024, 4096, 4096, 1024, 1024]
    - [4, 11808.1]
  - - [1024, 8544, 1, 4096, 1024, 1024, 4096, 4096]
    - [3, 11701.9]
  - - [1024, 4392, 1, 1024, 1024, 1024, 1024, 1024]
    - [3, 11124.0]
  - - [4096, 10040, 1, 1024, 4096, 4096, 1024, 1024]
    - [31, 11386.2]
  - - [33712, 360, 1, 1024, 33712, 33712, 1024, 1024]
    - [11, 10167.2]
  - - [1024, 448, 1, 1024, 1024, 1024, 1024, 1024]
    - [40, 7432.94]
  - - [4096, 6560, 1, 1024, 4096, 4096, 1024, 1024]
    - [15, 11608.3]
  - - [1024, 7688, 1, 1024, 1024, 1024, 1024, 1024]
    - [3, 11426.2]
  - - [1024, 5120, 1, 4096, 1024, 1024, 4096, 4096]
    - [7, 9361.92]
  - - [1024, 4536, 1, 4096, 1024, 1024, 4096, 4096]
    - [16, 10219.0]
  - - [33712, 9776, 1, 1024, 33712, 33712, 1024, 1024]
    - [3, 10083.6]
  - - [33712, 9240, 1, 1024, 33712, 33712, 1024, 1024]
    - [3, 10854.9]
  - - [1024, 9048, 1, 1024, 1024, 1024, 1024, 1024]
    - [3, 12228.7]
  - - [1024, 6720, 1, 1024, 1024, 1024, 1024, 1024]
    - [3, 10497.0]
  - - [1024, 8928, 1, 1024, 1024, 1024, 1024, 1024]
    - [20, 10177.5]
  - - [1024, 3120, 1, 1024, 1024, 1024, 1024, 1024]
    - [3, 10553.4]
  - - [1024, 8448, 1, 1024, 1024, 1024, 1024, 1024]
    - [14, 10837.7]
  - - [33712, 10080, 1, 1024, 33712, 33712, 1024, 1024]
    - [14, 10282.5]
  - - [1024, 6360, 1, 1024, 1024, 1024, 1024, 1024]
    - [4, 11866.4]
  - - [33712, 6840, 1, 1024, 33712, 33712, 1024, 1024]
    - [3, 11558.5]
  - - [1024, 8496, 1, 1024, 1024, 1024, 1024, 1024]
    - [3, 12409.0]
  - - [4096, 6384, 1, 1024, 4096, 4096, 1024, 1024]
    - [14, 10686.3]
  - - [1024, 4216, 1, 4096, 1024, 1024, 4096, 4096]
    - [7, 9829.2]
  - - [1024, 9440, 1, 1024, 1024, 1024, 1024, 1024]
    - [14, 10156.1]
  - - [33712, 10224, 1, 1024, 33712, 33712, 1024, 1024]
    - [14, 10375.9]
  - - [1024, 9280, 1, 1024, 1024, 1024, 1024, 1024]
    - [3, 12234.4]
  - - [4096, 9312, 1, 1024, 4096, 4096, 1024, 1024]
    - [3, 11642.5]
  - - [4096, 9016, 1, 1024, 4096, 4096, 1024, 1024]
    - [31, 11945.8]
  - - [1024, 8192, 1, 1024, 1024, 1024, 1024, 1024]
    - [3, 11493.7]
  - - [1024, 8712, 1, 1024, 1024, 1024, 1024, 1024]
    - [3, 10474.2]
  - - [1024, 6664, 1, 1024, 1024, 1024, 1024, 1024]
    - [46, 10702.9]
  - - [1024, 8704, 1, 4096, 1024, 1024, 4096, 4096]
    - [43, 10596.0]
  - - [33712, 9792, 1, 1024, 33712, 33712, 1024, 1024]
    - [3, 10426.9]
  - - [4096, 512, 1, 1024, 4096, 4096, 1024, 1024]
    - [4, 11129.1]
  - - [4096, 9144, 1, 1024, 4096, 4096, 1024, 1024]
    - [3, 12108.4]
  - - [1024, 5632, 1, 4096, 1024, 1024, 4096, 4096]
    - [16, 9988.77]
  - - [1024, 1584, 1, 1024, 1024, 1024, 1024, 1024]
    - [3, 10078.5]
  - - [4096, 8976, 1, 1024, 4096, 4096, 1024, 1024]
    - [31, 11937.8]
  - - [33712, 8512, 1, 1024, 33712, 33712, 1024, 1024]
    - [5, 10945.1]
  - - [33712, 3072, 1, 1024, 33712, 33712, 1024, 1024]
    - [0, 10148.6]
  - - [1024, 9976, 1, 1024, 1024, 1024, 1024, 1024]
    - [3, 10618.6]
  - - [4096, 10224, 1, 1024, 4096, 4096, 1024, 1024]
    - [45, 11380.7]
  - - [4096, 352, 1, 1024, 4096, 4096, 1024, 1024]
    - [4, 8963.03]
  - - [1024, 9464, 1, 1024, 1024, 1024, 1024, 1024]
    - [14, 10982.4]
  - - [4096, 9520, 1, 1024, 4096, 4096, 1024, 1024]
    - [3, 11807.1]
  - - [4096, 9568, 1, 1024, 4096, 4096, 1024, 1024]
    - [3, 11790.2]
  - - [1024, 6976, 1, 4096, 1024, 1024, 4096, 4096]
    - [7, 10830.7]
  - - [1024, 340, 1, 1024, 1024, 1024, 1024, 1024]
    - [26, 5863.75]
  - - [4096, 7392, 1, 1024, 4096, 4096, 1024, 1024]
    - [7, 12301.3]
  - - [33712, 9744, 1, 1024, 33712, 33712, 1024, 1024]
    - [3, 10266.3]
  - - [33712, 496, 1, 1024, 33712, 33712, 1024, 1024]
    - [4, 11395.5]
  - - [33712, 9272, 1, 1024, 33712, 33712, 1024, 1024]
    - [14, 10327.6]
  - - [4096, 6480, 1, 1024, 4096, 4096, 1024, 1024]
    - [1, 11288.8]
  - - [1024, 5920, 1, 1024, 1024, 1024, 1024, 1024]
    - [3, 11875.5]
  - - [33712, 3240, 1, 1024, 33712, 33712, 1024, 1024]
    - [3, 10256.8]
  - - [4096, 7560, 1, 1024, 4096, 4096, 1024, 1024]
    - [59, 10661.4]
  - - [1024, 10080, 1, 1024, 1024, 1024, 1024, 1024]
    - [14, 12000.0]
  - - [33712, 9936, 1, 1024, 33712, 33712, 1024, 1024]
    - [14, 10153.6]
  - - [1024, 8160, 1, 4096, 1024, 1024, 4096, 4096]
    - [43, 11016.9]
  - - [33712, 10184, 1, 1024, 33712, 33712, 1024, 1024]
    - [14, 10144.0]
  - - [1024, 7560, 1, 4096, 1024, 1024, 4096, 4096]
    - [29, 10749.6]
  - - [1024, 5832, 1, 1024, 1024, 1024, 1024, 1024]
    - [3, 12135.4]
  - - [33712, 6976, 1, 1024, 33712, 33712, 1024, 1024]
    - [3, 11714.3]
  - - [1024, 6480, 1, 4096, 1024, 1024, 4096, 4096]
    - [1, 10688.6]
  - - [1024, 9912, 1, 4096, 1024, 1024, 4096, 4096]
    - [3, 11318.6]
  - - [1024, 9360, 1, 4096, 1024, 1024, 4096, 4096]
    - [3, 11217.0]
  - - [4096, 10000, 1, 1024, 4096, 4096, 1024, 1024]
    - [3, 11806.1]
  - - [1024, 5104, 1, 1024, 1024, 1024, 1024, 1024]
    - [3, 11236.0]
  - - [1024, 7936, 1, 4096, 1024, 1024, 4096, 4096]
    - [29, 10704.2]
  - - [4096, 9856, 1, 1024, 4096, 4096, 1024, 1024]
    - [4, 11856.4]
  - - [1024, 5984, 1, 4096, 1024, 1024, 4096, 4096]
    - [14, 9996.9]
  - - [4096, 2112, 1, 1024, 4096, 4096, 1024, 1024]
    - [3, 10654.2]
  - - [1024, 8480, 1, 1024, 1024, 1024, 1024, 1024]
    - [3, 10117.3]
  - - [1024, 13312, 1, 1024, 1024, 1024, 1024, 1024]
    - [17, 10496.4]
  - - [33712, 9016, 1, 1024, 33712, 33712, 1024, 1024]
    - [45, 10545.1]
  - - [1024, 6560, 1, 1024, 1024, 1024, 1024, 1024]
    - [3, 12223.9]
  - - [4096, 9360, 1, 1024, 4096, 4096, 1024, 1024]
    - [3, 11695.2]
  - - [4096, 9840, 1, 1024, 4096, 4096, 1024, 1024]
    - [31, 11412.4]
  - - [4096, 9176, 1, 1024, 4096, 4096, 1024, 1024]
    - [3, 12277.0]
  - - [1024, 8648, 1, 4096, 1024, 1024, 4096, 4096]
    - [3, 11350.4]
  - - [1024, 10120, 1, 1024, 1024, 1024, 1024, 1024]
    - [14, 11243.0]
  - - [4096, 8512, 1, 1024, 4096, 4096, 1024, 1024]
    - [4, 11797.4]
  - - [1024, 7896, 1, 1024, 1024, 1024, 1024, 1024]
    - [3, 11410.6]
  - - [1024, 352, 1, 1024, 1024, 1024, 1024, 1024]
    - [26, 6110.91]
  - - [1024, 4864, 1, 1024, 1024, 1024, 1024, 1024]
    - [3, 11190.7]
  - - [1024, 8904, 1, 1024, 1024, 1024, 1024, 1024]
    - [3, 10687.4]
  - - [33712, 7072, 1, 1024, 33712, 33712, 1024, 1024]
    - [14, 11486.7]
  - - [1024, 9504, 1, 4096, 1024, 1024, 4096, 4096]
    - [3, 11802.9]
  - - [4096, 8160, 1, 1024, 4096, 4096, 1024, 1024]
    - [4, 11787.9]
  - - [1024, 7344, 1, 4096, 1024, 1024, 4096, 4096]
    - [7, 10603.0]
  - - [33712, 9888, 1, 1024, 33712, 33712, 1024, 1024]
    - [3, 10182.0]
  - - [33712, 10176, 1, 1024, 33712, 33712, 1024, 1024]
    - [7, 10145.3]
  - - [4096, 228, 1, 1024, 4096, 4096, 1024, 1024]
    - [3, 8232.62]
  - - [1024, 10040, 1, 1024, 1024, 1024, 1024, 1024]
    - [14, 11161.6]
  - - [1024, 4368, 1, 1024, 1024, 1024, 1024, 1024]
    - [32, 10306.4]
  - - [1024, 6768, 1, 1024, 1024, 1024, 1024, 1024]
    - [46, 10860.6]
  - - [1024, 5824, 1, 1024, 1024, 1024, 1024, 1024]
    - [8, 9952.55]
  - - [1024, 5680, 1, 4096, 1024, 1024, 4096, 4096]
    - [7, 11043.7]
  - - [33712, 9296, 1, 1024, 33712, 33712, 1024, 1024]
    - [5, 10443.1]
  - - [4096, 380, 1, 1024, 4096, 4096, 1024, 1024]
    - [4, 10344.2]
  - - [1024, 8840, 1, 1024, 1024, 1024, 1024, 1024]
    - [14, 10787.4]
  - - [1024, 9184, 1, 1024, 1024, 1024, 1024, 1024]
    - [14, 11191.5]
  - - [4096, 7224, 1, 1024, 4096, 4096, 1024, 1024]
    - [7, 10968.9]
  - - [33712, 10240, 1, 1024, 33712, 33712, 1024, 1024]
    - [14, 10333.8]
  - - [1024, 8616, 1, 4096, 1024, 1024, 4096, 4096]
    - [4, 10454.7]
  - - [1024, 7920, 1, 4096, 1024, 1024, 4096, 4096]
    - [3, 10696.1]
  - - [1024, 412, 1, 1024, 1024, 1024, 1024, 1024]
    - [26, 6792.66]
  - - [1024, 9312, 1, 4096, 1024, 1024, 4096, 4096]
    - [3, 11118.8]
  - - [4096, 9344, 1, 1024, 4096, 4096, 1024, 1024]
    - [4, 11818.0]
  - - [4096, 8024, 1, 1024, 4096, 4096, 1024, 1024]
    - [4, 11759.9]
  - - [1024, 8568, 1, 1024, 1024, 1024, 1024, 1024]
    - [4, 11389.7]
  - - [1024, 10080, 1, 4096, 1024, 1024, 4096, 4096]
    - [3, 11265.8]
  - - [33712, 284, 1, 1024, 33712, 33712, 1024, 1024]
    - [32, 9925.44]
  - - [1024, 9640, 1, 4096, 1024, 1024, 4096, 4096]
    - [24, 10513.6]
  - - [1024, 8736, 1, 4096, 1024, 1024, 4096, 4096]
    - [3, 11319.4]
  - - [1024, 10240, 1, 1024, 1024, 1024, 1024, 1024]
    - [14, 11385.9]
  - - [1024, 9328, 1, 1024, 1024, 1024, 1024, 1024]
    - [3, 10655.7]
  - - [1024, 10112, 1, 4096, 1024, 1024, 4096, 4096]
    - [3, 10461.9]
  - - [4096, 5600, 1, 1024, 4096, 4096, 1024, 1024]
    - [1, 10502.6]
  - - [1024, 10000, 1, 4096, 1024, 1024, 4096, 4096]
    - [3, 11296.1]
  - - [4096, 8448, 1, 1024, 4096, 4096, 1024, 1024]
    - [4, 11570.5]
  - - [1024, 4560, 1, 4096, 1024, 1024, 4096, 4096]
    - [11, 9266.81]
  - - [4096, 8704, 1, 1024, 4096, 4096, 1024, 1024]
    - [31, 11363.0]
  - - [33712, 9640, 1, 1024, 33712, 33712, 1024, 1024]
    - [3, 10183.7]
  - - [4096, 252, 1, 1024, 4096, 4096, 1024, 1024]
    - [21, 9099.21]
  - - [1024, 5280, 1, 1024, 1024, 1024, 1024, 1024]
    - [3, 11144.3]
  - - [1024, 4048, 1, 1024, 1024, 1024, 1024, 1024]
    - [24, 10014.7]
  - - [33712, 9152, 1, 1024, 33712, 33712, 1024, 1024]
    - [45, 10612.1]
  - - [4096, 8536, 1, 1024, 4096, 4096, 1024, 1024]
    - [7, 11459.6]
  - - [4096, 26656, 1, 1024, 4096, 4096, 1024, 1024]
    - [13, 10541.9]
  - - [33712, 10152, 1, 1024, 33712, 33712, 1024, 1024]
    - [14, 10023.4]
  - - [1024, 7424, 1, 4096, 1024, 1024, 4096, 4096]
    - [1, 11005.5]
  - - [1024, 9728, 1, 4096, 1024, 1024, 4096, 4096]
    - [3, 11314.0]
  - - [4096, 5832, 1, 1024, 4096, 4096, 1024, 1024]
    - [9, 10598.8]
  - - [4096, 7936, 1, 1024, 4096, 4096, 1024, 1024]
    - [7, 10758.2]
  - - [33712, 8736, 1, 1024, 33712, 33712, 1024, 1024]
    - [5, 10679.6]
  - - [4096, 416, 1, 1024, 4096, 4096, 1024, 1024]
    - [4, 10069.4]
  - - [1024, 9600, 1, 4096, 1024, 1024, 4096, 4096]
    - [3, 10994.4]
  - - [4096, 6128, 1, 1024, 4096, 4096, 1024, 1024]
    - [1, 10640.3]
  - - [1024, 23040, 1, 4096, 1024, 1024, 4096, 4096]
    - [14, 11218.3]
  - - [4096, 8928, 1, 1024, 4096, 4096, 1024, 1024]
    - [32, 11341.4]
  - - [1024, 4080, 1, 1024, 1024, 1024, 1024, 1024]
    - [3, 10884.8]
  - - [4096, 224, 1, 1024, 4096, 4096, 1024, 1024]
    - [27, 9729.95]
  - - [1024, 7216, 1, 1024, 1024, 1024, 1024, 1024]
    - [3, 10567.7]
  - - [1024, 5720, 1, 1024, 1024, 1024, 1024, 1024]
    - [31, 10526.9]
  - - [4096, 9936, 1, 1024, 4096, 4096, 1024, 1024]
    - [31, 11378.5]
  - - [4096, 8280, 1, 1024, 4096, 4096, 1024, 1024]
    - [3, 11778.8]
  - - [4096, 3344, 1, 1024, 4096, 4096, 1024, 1024]
    - [1, 11069.0]
  - - [1024, 5632, 1, 1024, 1024, 1024, 1024, 1024]
    - [31, 10404.4]
  - - [1024, 8592, 1, 4096, 1024, 1024, 4096, 4096]
    - [3, 11043.0]
  - - [1024, 9656, 1, 1024, 1024, 1024, 1024, 1024]
    - [1, 11221.1]
  - - [1024, 7224, 1, 1024, 1024, 1024, 1024, 1024]
    - [3, 11420.4]
  - - [4096, 10120, 1, 1024, 4096, 4096, 1024, 1024]
    - [45, 11343.7]
  - - [1024, 8968, 1, 1024, 1024, 1024, 1024, 1024]
    - [14, 10939.5]
  - - [1024, 9168, 1, 4096, 1024, 1024, 4096, 4096]
    - [3, 10422.7]
  - - [4096, 20480, 1, 1024, 4096, 4096, 1024, 1024]
    - [3, 11022.4]
  - - [33712, 6072, 1, 1024, 33712, 33712, 1024, 1024]
    - [13, 10857.1]
  - - [33712, 6968, 1, 1024, 33712, 33712, 1024, 1024]
    - [3, 11587.7]
  - - [1024, 10752, 1, 4096, 1024, 1024, 4096, 4096]
    - [3, 11307.7]
  - - [1024, 8464, 1, 4096, 1024, 1024, 4096, 4096]
    - [3, 11088.9]
  - - [1024, 8288, 1, 4096, 1024, 1024, 4096, 4096]
    - [3, 11348.9]
  - - [1024, 6696, 1, 1024, 1024, 1024, 1024, 1024]
    - [3, 11288.2]
  - - [1024, 8944, 1, 1024, 1024, 1024, 1024, 1024]
    - [34, 10093.0]
  - - [33712, 7488, 1, 1024, 33712, 33712, 1024, 1024]
    - [14, 11193.5]
  - - [33712, 420, 1, 1024, 33712, 33712, 1024, 1024]
    - [3, 10877.8]
  - - [1024, 8704, 1, 1024, 1024, 1024, 1024, 1024]
    - [14, 10338.4]
  - - [1024, 4608, 1, 1024, 1024, 1024, 1024, 1024]
    - [3, 11100.5]
  - - [1024, 10168, 1, 1024, 1024, 1024, 1024, 1024]
    - [14, 11299.2]
  - - [1024, 10168, 1, 4096, 1024, 1024, 4096, 4096]
    - [7, 11018.2]
  - - [1024, 8296, 1, 1024, 1024, 1024, 1024, 1024]
    - [3, 11277.4]
  - - [4096, 7920, 1, 1024, 4096, 4096, 1024, 1024]
    - [30, 10736.5]
  - - [33712, 304, 1, 1024, 33712, 33712, 1024, 1024]
    - [2, 10627.0]
  - - [1024, 3400, 1, 1024, 1024, 1024, 1024, 1024]
    - [3, 10005.5]
  - - [1024, 6400, 1, 4096, 1024, 1024, 4096, 4096]
    - [14, 10741.8]
  - - [4096, 9240, 1, 1024, 4096, 4096, 1024, 1024]
    - [31, 11858.1]
  - - [1024, 7904, 1, 4096, 1024, 1024, 4096, 4096]
    - [3, 11081.0]
  - - [1024, 9880, 1, 4096, 1024, 1024, 4096, 4096]
    - [3, 11085.8]
  - - [33712, 9976, 1, 1024, 33712, 33712, 1024, 1024]
    - [3, 10106.7]
  - - [1024, 9568, 1, 1024, 1024, 1024, 1024, 1024]
    - [3, 12326.4]
  - - [4096, 8496, 1, 1024, 4096, 4096, 1024, 1024]
    - [4, 11780.8]
  - - [33712, 9568, 1, 1024, 33712, 33712, 1024, 1024]
    - [3, 10438.5]
  - - [1024, 8160, 1, 1024, 1024, 1024, 1024, 1024]
    - [3, 12269.6]
  - - [1024, 8008, 1, 1024, 1024, 1024, 1024, 1024]
    - [3, 11250.0]
  - - [1024, 9984, 1, 4096, 1024, 1024, 4096, 4096]
    - [3, 11229.6]
  - - [33712, 8680, 1, 1024, 33712, 33712, 1024, 1024]
    - [5, 10778.5]
  - - [33712, 224, 1, 1024, 33712, 33712, 1024, 1024]
    - [4, 10775.8]
  - - [1024, 7656, 1, 1024, 1024, 1024, 1024, 1024]
    - [3, 10550.8]
  - - [33712, 380, 1, 1024, 33712, 33712, 1024, 1024]
    - [30, 10325.2]
  - - [4096, 7728, 1, 1024, 4096, 4096, 1024, 1024]
    - [14, 11487.9]
  - - [4096, 6816, 1, 1024, 4096, 4096, 1024, 1024]
    - [30, 11092.8]
  - - [1024, 3120, 1, 4096, 1024, 1024, 4096, 4096]
    - [3, 10232.5]
  - - [1024, 9088, 1, 1024, 1024, 1024, 1024, 1024]
    - [14, 11067.3]
  - - [1024, 8584, 1, 4096, 1024, 1024, 4096, 4096]
    - [3, 10721.3]
  - - [33712, 9576, 1, 1024, 33712, 33712, 1024, 1024]
    - [3, 10557.7]
  - - [1024, 9112, 1, 1024, 1024, 1024, 1024, 1024]
    - [3, 12319.0]
  - - [1024, 6624, 1, 4096, 1024, 1024, 4096, 4096]
    - [14, 10519.4]
  - - [33712, 7680, 1, 1024, 33712, 33712, 1024, 1024]
    - [19, 10909.3]
  - - [1024, 4048, 1, 4096, 1024, 1024, 4096, 4096]
    - [3, 10585.6]
  - - [33712, 9752, 1, 1024, 33712, 33712, 1024, 1024]
    - [3, 10290.2]
  - - [1024, 9568, 1, 4096, 1024, 1024, 4096, 4096]
    - [3, 11679.0]
  - - [1024, 9184, 1, 4096, 1024, 1024, 4096, 4096]
    - [3, 11182.7]
  - - [1024, 9728, 1, 1024, 1024, 1024, 1024, 1024]
    - [14, 11295.7]
  - - [33712, 10208, 1, 1024, 33712, 33712, 1024, 1024]
    - [14, 10308.6]
  - - [33712, 8704, 1, 1024, 33712, 33712, 1024, 1024]
    - [5, 10572.3]
  - - [33712, 2720, 1, 1024, 33712, 33712, 1024, 1024]
    - [6, 10271.4]
  - - [33712, 9312, 1, 1024, 33712, 33712, 1024, 1024]
    - [3, 10546.7]
  - - [1024, 9744, 1, 1024, 1024, 1024, 1024, 1024]
    - [3, 12263.9]
  - - [1024, 9984, 1, 1024, 1024, 1024, 1024, 1024]
    - [3, 10627.9]
  - - [4096, 6400, 1, 1024, 4096, 4096, 1024, 1024]
    - [45, 11154.3]
  - - [33712, 9400, 1, 1024, 33712, 33712, 1024, 1024]
    - [3, 10726.0]
  - - [4096, 8528, 1, 1024, 4096, 4096, 1024, 1024]
    - [1, 11396.6]
  - - [1024, 5040, 1, 4096, 1024, 1024, 4096, 4096]
    - [5, 9653.32]
  - - [4096, 6976, 1, 1024, 4096, 4096, 1024, 1024]
    - [7, 10704.9]
  - - [4096, 8648, 1, 1024, 4096, 4096, 1024, 1024]
    - [32, 11354.4]
  - - [1024, 9768, 1, 4096, 1024, 1024, 4096, 4096]
    - [3, 11170.0]
  - - [1024, 8280, 1, 4096, 1024, 1024, 4096, 4096]
    - [3, 11073.1]
  - - [4096, 5888, 1, 1024, 4096, 4096, 1024, 1024]
    - [1, 10601.7]
  - - [1024, 9744, 1, 4096, 1024, 1024, 4096, 4096]
    - [3, 10981.4]
  - - [1024, 10160, 1, 1024, 1024, 1024, 1024, 1024]
    - [14, 11288.4]
  - - [4096, 5440, 1, 1024, 4096, 4096, 1024, 1024]
    - [46, 10449.2]
  - - [4096, 8736, 1, 1024, 4096, 4096, 1024, 1024]
    - [32, 11316.3]
  - - [1024, 6072, 1, 1024, 1024, 1024, 1024, 1024]
    - [3, 11376.0]
  - - [1024, 9176, 1, 1024, 1024, 1024, 1024, 1024]
    - [14, 10362.0]
  - - [4096, 504, 1, 1024, 4096, 4096, 1024, 1024]
    - [21, 9297.7]
  - - [1024, 7936, 1, 1024, 1024, 1024, 1024, 1024]
    - [15, 11421.8]
  - - [4096, 5984, 1, 1024, 4096, 4096, 1024, 1024]
    - [50, 10610.2]
  - - [33712, 308, 1, 1024, 33712, 33712, 1024, 1024]
    - [3, 11853.9]
  - - [1024, 9864, 1, 1024, 1024, 1024, 1024, 1024]
    - [30, 10221.3]
  - - [4096, 9776, 1, 1024, 4096, 4096, 1024, 1024]
    - [3, 11478.6]
  - - [1024, 9176, 1, 4096, 1024, 1024, 4096, 4096]
    - [3, 11108.7]
  - - [4096, 1584, 1, 1024, 4096, 4096, 1024, 1024]
    - [3, 11017.1]
  - - [33712, 8800, 1, 1024, 33712, 33712, 1024, 1024]
    - [3, 11122.4]
  - - [4096, 4640, 1, 1024, 4096, 4096, 1024, 1024]
    - [8, 11981.3]
  - - [1024, 8640, 1, 4096, 1024, 1024, 4096, 4096]
    - [3, 10444.9]
  - - [1024, 4640, 1, 4096, 1024, 1024, 4096, 4096]
    - [1, 9645.87]
  - - [1024, 4760, 1, 1024, 1024, 1024, 1024, 1024]
    - [32, 9926.82]
  - - [1024, 388, 1, 1024, 1024, 1024, 1024, 1024]
    - [57, 6437.46]
  - - [1024, 7520, 1, 1024, 1024, 1024, 1024, 1024]
    - [3, 11213.4]
  - - [33712, 9928, 1, 1024, 33712, 33712, 1024, 1024]
    - [7, 10020.5]
  - - [4096, 5840, 1, 1024, 4096, 4096, 1024, 1024]
    - [7, 11310.4]
  - - [1024, 9856, 1, 4096, 1024, 1024, 4096, 4096]
    - [3, 11183.6]
  - - [33712, 412, 1, 1024, 33712, 33712, 1024, 1024]
    - [8, 10429.0]
  - - [1024, 5936, 1, 4096, 1024, 1024, 4096, 4096]
    - [30, 10065.5]
  - - [1024, 4216, 1, 1024, 1024, 1024, 1024, 1024]
    - [8, 9978.29]
  - - [33712, 5936, 1, 1024, 33712, 33712, 1024, 1024]
    - [45, 10811.3]
  - - [1024, 9272, 1, 4096, 1024, 1024, 4096, 4096]
    - [3, 11142.1]
  - - [4096, 8584, 1, 1024, 4096, 4096, 1024, 1024]
    - [4, 11743.2]
  - - [4096, 9792, 1, 1024, 4096, 4096, 1024, 1024]
    - [3, 12213.2]
  - - [4096, 5680, 1, 1024, 4096, 4096, 1024, 1024]
    - [5, 11217.2]
  - - [33712, 432, 1, 1024, 33712, 33712, 1024, 1024]
    - [3, 9695.39]
  - - [1024, 9384, 1, 4096, 1024, 1024, 4096, 4096]
    - [3, 11272.0]
  - - [4096, 8480, 1, 1024, 4096, 4096, 1024, 1024]
    - [4, 11760.2]
  - - [1024, 7616, 1, 4096, 1024, 1024, 4096, 4096]
    - [29, 10560.0]
  - - [1024, 10192, 1, 1024, 1024, 1024, 1024, 1024]
    - [3, 11452.0]
  - - [1024, 5760, 1, 1024, 1024, 1024, 1024, 1024]
    - [32, 10609.5]
  - - [4096, 10192, 1, 1024, 4096, 4096, 1024, 1024]
    - [31, 11366.5]
  - - [1024, 5200, 1, 1024, 1024, 1024, 1024, 1024]
    - [3, 10970.1]
  - - [1024, 6160, 1, 1024, 1024, 1024, 1024, 1024]
    - [3, 10327.5]
  - - [1024, 10192, 1, 4096, 1024, 1024, 4096, 4096]
    - [7, 10633.2]
  - - [1024, 4032, 1, 4096, 1024, 1024, 4096, 4096]
    - [7, 10182.7]
  - - [1024, 9216, 1, 4096, 1024, 1024, 4096, 4096]
    - [3, 10518.1]
  - - [1024, 1344, 1, 4096, 1024, 1024, 4096, 4096]
    - [4, 9451.92]
  - - [33712, 9360, 1, 1024, 33712, 33712, 1024, 1024]
    - [14, 10307.4]
  - - [33712, 4160, 1, 1024, 33712, 33712, 1024, 1024]
    - [32, 10721.1]
  - - [1024, 392, 1, 1024, 1024, 1024, 1024, 1024]
    - [56, 6536.92]
  - - [1024, 9880, 1, 1024, 1024, 1024, 1024, 1024]
    - [14, 10984.7]
  - - [1024, 10200, 1, 1024, 1024, 1024, 1024, 1024]
    - [14, 10503.0]
  - - [4096, 5824, 1, 1024, 4096, 4096, 1024, 1024]
    - [45, 11307.8]
  - - [1024, 10200, 1, 4096, 1024, 1024, 4096, 4096]
    - [3, 11199.6]
  - - [1024, 1232, 1, 1024, 1024, 1024, 1024, 1024]
    - [3, 9634.89]
  - - [1024, 9792, 1, 1024, 1024, 1024, 1024, 1024]
    - [33, 10199.1]
  - - [33712, 3256, 1, 1024, 33712, 33712, 1024, 1024]
    - [4, 10072.8]
  - - [4096, 7776, 1, 1024, 4096, 4096, 1024, 1024]
    - [30, 10723.2]
  - - [33712, 9672, 1, 1024, 33712, 33712, 1024, 1024]
    - [3, 10396.6]
  - - [4096, 8400, 1, 1024, 4096, 4096, 1024, 1024]
    - [1, 11385.4]
  - - [1024, 9776, 1, 1024, 1024, 1024, 1024, 1024]
    - [3, 11474.5]
  - - [4096, 10184, 1, 1024, 4096, 4096, 1024, 1024]
    - [3, 11426.9]
  - - [33712, 9216, 1, 1024, 33712, 33712, 1024, 1024]
    - [5, 10481.5]
  - - [1024, 8512, 1, 1024, 1024, 1024, 1024, 1024]
    - [3, 12442.1]
  - - [1024, 7448, 1, 1024, 1024, 1024, 1024, 1024]
    - [3, 10576.6]
  - - [1024, 9912, 1, 1024, 1024, 1024, 1024, 1024]
    - [43, 10234.6]
  - - [1024, 10208, 1, 1024, 1024, 1024, 1024, 1024]
    - [14, 10509.6]
  - - [4096, 6336, 1, 1024, 4096, 4096, 1024, 1024]
    - [30, 10605.2]
  - - [1024, 8000, 1, 1024, 1024, 1024, 1024, 1024]
    - [3, 12369.6]
  - - [4096, 356, 1, 1024, 4096, 4096, 1024, 1024]
    - [25, 8150.48]
  - - [1024, 9112, 1, 4096, 1024, 1024, 4096, 4096]
    - [3, 11097.9]
  - - [1024, 10208, 1, 4096, 1024, 1024, 4096, 4096]
    - [5, 11190.6]
  - - [1024, 7488, 1, 4096, 1024, 1024, 4096, 4096]
    - [3, 10403.7]
  - - [1024, 6400, 1, 1024, 1024, 1024, 1024, 1024]
    - [3, 11947.8]
  - - [1024, 8584, 1, 1024, 1024, 1024, 1024, 1024]
    - [44, 10249.8]
  - - [33712, 488, 1, 1024, 33712, 33712, 1024, 1024]
    - [8, 9942.3]
  - - [1024, 9360, 1, 1024, 1024, 1024, 1024, 1024]
    - [15, 10859.8]
  - - [1024, 472, 1, 1024, 1024, 1024, 1024, 1024]
    - [56, 7723.59]
  - - [33712, 6048, 1, 1024, 33712, 33712, 1024, 1024]
    - [31, 11099.5]
  - - [4096, 9112, 1, 1024, 4096, 4096, 1024, 1024]
    - [4, 11794.0]
  - - [1024, 4704, 1, 1024, 1024, 1024, 1024, 1024]
    - [4, 10837.8]
  - - [1024, 6720, 1, 4096, 1024, 1024, 4096, 4096]
    - [3, 10383.1]
  - - [1024, 10112, 1, 1024, 1024, 1024, 1024, 1024]
    - [3, 11601.9]
  - - [4096, 6120, 1, 1024, 4096, 4096, 1024, 1024]
    - [14, 11466.8]
  - - [1024, 7920, 1, 1024, 1024, 1024, 1024, 1024]
    - [3, 10603.5]
  - - [4096, 500, 1, 1024, 4096, 4096, 1024, 1024]
    - [20, 9851.31]
  - - [4096, 9024, 1, 1024, 4096, 4096, 1024, 1024]
    - [3, 12454.0]
  - - [1024, 6528, 1, 1024, 1024, 1024, 1024, 1024]
    - [3, 11384.2]
  - - [1024, 7560, 1, 1024, 1024, 1024, 1024, 1024]
    - [43, 10128.8]
  - - [1024, 4640, 1, 1024, 1024, 1024, 1024, 1024]
    - [7, 10194.0]
  - - [1024, 1984, 1, 4096, 1024, 1024, 4096, 4096]
    - [4, 8719.79]
  - - [4096, 1984, 1, 1024, 4096, 4096, 1024, 1024]
    - [46, 10696.0]
  - - [1024, 7480, 1, 1024, 1024, 1024, 1024, 1024]
    - [46, 10662.5]
  - - [1024, 9976, 1, 4096, 1024, 1024, 4096, 4096]
    - [24, 10488.7]
  - - [4096, 6496, 1, 1024, 4096, 4096, 1024, 1024]
    - [7, 10671.7]
  - - [1024, 3360, 1, 4096, 1024, 1024, 4096, 4096]
    - [3, 9619.41]
  - - [1024, 2112, 1, 1024, 1024, 1024, 1024, 1024]
    - [4, 9073.21]
  - - [1024, 2112, 1, 4096, 1024, 1024, 4096, 4096]
    - [15, 9114.27]
  - - [1024, 8200, 1, 4096, 1024, 1024, 4096, 4096]
    - [3, 11027.7]
  - - [1024, 336, 1, 1024, 1024, 1024, 1024, 1024]
    - [26, 5817.73]
  - - [1024, 9312, 1, 1024, 1024, 1024, 1024, 1024]
    - [14, 11346.5]
  - - [1024, 7392, 1, 4096, 1024, 1024, 4096, 4096]
    - [3, 10276.9]
  - - [33712, 10032, 1, 1024, 33712, 33712, 1024, 1024]
    - [3, 10317.8]
  - - [1024, 8616, 1, 1024, 1024, 1024, 1024, 1024]
    - [3, 12268.5]
  - - [1024, 10064, 1, 4096, 1024, 1024, 4096, 4096]
    - [3, 11143.2]
  - - [33712, 9288, 1, 1024, 33712, 33712, 1024, 1024]
    - [5, 10356.3]
  - - [33712, 7192, 1, 1024, 33712, 33712, 1024, 1024]
    - [7, 11679.6]
  - - [4096, 9576, 1, 1024, 4096, 4096, 1024, 1024]
    - [4, 11810.0]
  - - [1024, 9120, 1, 1024, 1024, 1024, 1024, 1024]
    - [1, 11121.8]
  - - [4096, 9648, 1, 1024, 4096, 4096, 1024, 1024]
    - [45, 11895.5]
  - - [33712, 6912, 1, 1024, 33712, 33712, 1024, 1024]
    - [7, 11508.1]
  - - [1024, 9576, 1, 4096, 1024, 1024, 4096, 4096]
    - [3, 11191.4]
  - - [33712, 3360, 1, 1024, 33712, 33712, 1024, 1024]
    - [3, 10170.5]
  - - [1024, 9920, 1, 1024, 1024, 1024, 1024, 1024]
    - [3, 10801.0]
  - - [1024, 7072, 1, 1024, 1024, 1024, 1024, 1024]
    - [45, 10709.9]
  - - [4096, 9920, 1, 1024, 4096, 4096, 1024, 1024]
    - [45, 11380.6]
  - - [33712, 9920, 1, 1024, 33712, 33712, 1024, 1024]
    - [7, 10156.9]
  - - [4096, 5640, 1, 1024, 4096, 4096, 1024, 1024]
    - [1, 11224.5]
  - - [4096, 9680, 1, 1024, 4096, 4096, 1024, 1024]
    - [3, 11782.5]
  - - [33712, 8120, 1, 1024, 33712, 33712, 1024, 1024]
    - [11, 11012.0]
  - - [1024, 7424, 1, 1024, 1024, 1024, 1024, 1024]
    - [3, 12172.6]
  - - [1024, 10032, 1, 1024, 1024, 1024, 1024, 1024]
    - [14, 10335.7]
  - - [1024, 5680, 1, 1024, 1024, 1024, 1024, 1024]
    - [31, 10453.3]
  - - [1024, 800, 1, 1024, 1024, 1024, 1024, 1024]
    - [40, 8804.16]
  - - [1024, 4160, 1, 4096, 1024, 1024, 4096, 4096]
    - [7, 9674.98]
  - - [33712, 8976, 1, 1024, 33712, 33712, 1024, 1024]
    - [45, 10500.1]
  - - [1024, 9768, 1, 1024, 1024, 1024, 1024, 1024]
    - [3, 12284.7]
  - - [1024, 384, 1, 1024, 1024, 1024, 1024, 1024]
    - [40, 6436.27]
  - - [4096, 9768, 1, 1024, 4096, 4096, 1024, 1024]
    - [3, 11815.3]
  - - [1024, 10184, 1, 4096, 1024, 1024, 4096, 4096]
    - [14, 11081.4]
  - - [1024, 9248, 1, 4096, 1024, 1024, 4096, 4096]
    - [3, 10962.5]
  - - [1024, 5832, 1, 4096, 1024, 1024, 4096, 4096]
    - [14, 10500.1]
  - - [1024, 6888, 1, 4096, 1024, 1024, 4096, 4096]
    - [3, 10217.2]
  - - [33712, 10200, 1, 1024, 33712, 33712, 1024, 1024]
    - [14, 10118.0]
  - - [4096, 4368, 1, 1024, 4096, 4096, 1024, 1024]
    - [4, 11541.6]
  - - [4096, 6080, 1, 1024, 4096, 4096, 1024, 1024]
    - [45, 10726.0]
  - - [4096, 7144, 1, 1024, 4096, 4096, 1024, 1024]
    - [30, 10652.4]
  - - [33712, 6960, 1, 1024, 33712, 33712, 1024, 1024]
    - [3, 11616.1]
  - - [1024, 9720, 1, 1024, 1024, 1024, 1024, 1024]
    - [3, 12236.0]
  - - [1024, 7392, 1, 1024, 1024, 1024, 1024, 1024]
    - [3, 10507.3]
  - - [33712, 8584, 1, 1024, 33712, 33712, 1024, 1024]
    - [5, 10787.8]
  - - [33712, 8576, 1, 1024, 33712, 33712, 1024, 1024]
    - [5, 10876.8]
  - - [33712, 7392, 1, 1024, 33712, 33712, 1024, 1024]
    - [11, 11297.2]
  - - [4096, 9400, 1, 1024, 4096, 4096, 1024, 1024]
    - [45, 11972.3]
  - - [4096, 9800, 1, 1024, 4096, 4096, 1024, 1024]
    - [3, 11785.0]
  - - [4096, 3600, 1, 1024, 4096, 4096, 1024, 1024]
    - [7, 11064.8]
  - - [4096, 5280, 1, 1024, 4096, 4096, 1024, 1024]
    - [46, 11182.1]
  - - [4096, 800, 1, 1024, 4096, 4096, 1024, 1024]
    - [14, 9312.37]
  - - [4096, 3808, 1, 1024, 4096, 4096, 1024, 1024]
    - [7, 11348.2]
  - - [4096, 360, 1, 1024, 4096, 4096, 1024, 1024]
    - [26, 8460.02]
  - - [4096, 9512, 1, 1024, 4096, 4096, 1024, 1024]
    - [3, 11793.8]
  - - [1024, 5280, 1, 4096, 1024, 1024, 4096, 4096]
    - [14, 9657.52]
  - - [1024, 2880, 1, 1024, 1024, 1024, 1024, 1024]
    - [20, 9918.18]
  - - [33712, 3120, 1, 1024, 33712, 33712, 1024, 1024]
    - [4, 10265.7]
  - - [1024, 9048, 1, 4096, 1024, 1024, 4096, 4096]
    - [3, 10458.2]
  - - [4096, 6048, 1, 1024, 4096, 4096, 1024, 1024]
    - [38, 10805.2]
  - - [1024, 9632, 1, 1024, 1024, 1024, 1024, 1024]
    - [3, 11580.3]
  - - [4096, 9152, 1, 1024, 4096, 4096, 1024, 1024]
    - [3, 11843.8]
  - - [4096, 3400, 1, 1024, 4096, 4096, 1024, 1024]
    - [9, 10525.3]
  - - [1024, 9024, 1, 1024, 1024, 1024, 1024, 1024]
    - [14, 10992.5]
  - - [1024, 7688, 1, 4096, 1024, 1024, 4096, 4096]
    - [29, 10861.5]
  - - [1024, 9920, 1, 4096, 1024, 1024, 4096, 4096]
    - [3, 11221.9]
  - - [33712, 512, 1, 1024, 33712, 33712, 1024, 1024]
    - [8, 11220.6]
  - - [1024, 9472, 1, 1024, 1024, 1024, 1024, 1024]
    - [3, 10820.2]
  - - [1024, 6784, 1, 4096, 1024, 1024, 4096, 4096]
    - [7, 10662.7]
  - - [33712, 9072, 1, 1024, 33712, 33712, 1024, 1024]
    - [3, 10720.4]
  - - [1024, 8280, 1, 1024, 1024, 1024, 1024, 1024]
    - [3, 12111.1]
  - - [4096, 10152, 1, 1024, 4096, 4096, 1024, 1024]
    - [45, 11375.4]
  - - [1024, 9472, 1, 4096, 1024, 1024, 4096, 4096]
    - [3, 10690.2]
  - - [33712, 9472, 1, 1024, 33712, 33712, 1024, 1024]
    - [3, 10865.1]
  - - [4096, 9120, 1, 1024, 4096, 4096, 1024, 1024]
    - [43, 11459.0]
  - - [4096, 9600, 1, 1024, 4096, 4096, 1024, 1024]
    - [3, 11826.3]
  - - [1024, 7168, 1, 4096, 1024, 1024, 4096, 4096]
    - [3, 10658.2]
  - - [1024, 6816, 1, 1024, 1024, 1024, 1024, 1024]
    - [4, 12265.0]
  - - [1024, 6880, 1, 1024, 1024, 1024, 1024, 1024]
    - [3, 10409.5]
  - - [4096, 5720, 1, 1024, 4096, 4096, 1024, 1024]
    - [20, 10580.1]
  - - [33712, 7144, 1, 1024, 33712, 33712, 1024, 1024]
    - [4, 11544.9]
  - - [1024, 3400, 1, 4096, 1024, 1024, 4096, 4096]
    - [3, 10642.9]
  - - [1024, 10040, 1, 4096, 1024, 1024, 4096, 4096]
    - [11, 11077.6]
  - - [33712, 8448, 1, 1024, 33712, 33712, 1024, 1024]
    - [3, 11173.3]
  - - [33712, 4640, 1, 1024, 33712, 33712, 1024, 1024]
    - [44, 10560.5]
  - - [1024, 4368, 1, 4096, 1024, 1024, 4096, 4096]
    - [8, 10046.4]
  - - [1024, 6912, 1, 1024, 1024, 1024, 1024, 1024]
    - [46, 11004.1]
  - - [1024, 4864, 1, 4096, 1024, 1024, 4096, 4096]
    - [14, 9588.03]
  - - [1024, 5824, 1, 4096, 1024, 1024, 4096, 4096]
    - [7, 10583.9]
  - - [33712, 10064, 1, 1024, 33712, 33712, 1024, 1024]
    - [14, 10134.2]
  - - [33712, 492, 1, 1024, 33712, 33712, 1024, 1024]
    - [4, 11298.2]
  - - [1024, 3344, 1, 1024, 1024, 1024, 1024, 1024]
    - [3, 10605.0]
  - - [1024, 3584, 1, 1024, 1024, 1024, 1024, 1024]
    - [60, 9982.17]
  - - [33712, 6336, 1, 1024, 33712, 33712, 1024, 1024]
    - [45, 11721.8]
  - - [4096, 6864, 1, 1024, 4096, 4096, 1024, 1024]
    - [1, 11335.9]
  - - [4096, 4536, 1, 1024, 4096, 4096, 1024, 1024]
    - [7, 11473.7]
  - - [1024, 1984, 1, 1024, 1024, 1024, 1024, 1024]
    - [3, 10146.2]
  - - [1024, 8216, 1, 1024, 1024, 1024, 1024, 1024]
    - [14, 11084.8]
  - - [1024, 8968, 1, 4096, 1024, 1024, 4096, 4096]
    - [24, 10427.4]
  - - [33712, 8160, 1, 1024, 33712, 33712, 1024, 1024]
    - [11, 10994.4]
  - - [1024, 8432, 1, 4096, 1024, 1024, 4096, 4096]
    - [43, 10814.6]
  - - [1024, 11264, 1, 1024, 1024, 1024, 1024, 1024]
    - [1, 11224.7]
  - - [4096, 5104, 1, 1024, 4096, 4096, 1024, 1024]
    - [46, 11187.6]
  - - [1024, 3864, 1, 4096, 1024, 1024, 4096, 4096]
    - [3, 9963.81]
  - - [1024, 7872, 1, 1024, 1024, 1024, 1024, 1024]
    - [3, 10536.1]
  - - [4096, 7448, 1, 1024, 4096, 4096, 1024, 1024]
    - [4, 10885.3]
  - - [1024, 8736, 1, 1024, 1024, 1024, 1024, 1024]
    - [3, 11328.1]
  - - [33712, 9720, 1, 1024, 33712, 33712, 1024, 1024]
    - [3, 10349.6]
  - - [1024, 8600, 1, 1024, 1024, 1024, 1024, 1024]
    - [3, 12239.0]
  - - [4096, 8600, 1, 1024, 4096, 4096, 1024, 1024]
    - [3, 11742.7]
  - - [4096, 6960, 1, 1024, 4096, 4096, 1024, 1024]
    - [7, 11515.9]
  - - [1024, 5400, 1, 1024, 1024, 1024, 1024, 1024]
    - [3, 11687.4]
  - - [4096, 5400, 1, 1024, 4096, 4096, 1024, 1024]
    - [46, 11191.2]
  - - [33712, 9984, 1, 1024, 33712, 33712, 1024, 1024]
    - [3, 10119.3]
  - - [1024, 5400, 1, 4096, 1024, 1024, 4096, 4096]
    - [14, 10498.6]
  - - [33712, 5400, 1, 1024, 33712, 33712, 1024, 1024]
    - [38, 10461.1]
  - - [4096, 7400, 1, 1024, 4096, 4096, 1024, 1024]
    - [14, 11513.5]
  - - [4096, 5632, 1, 1024, 4096, 4096, 1024, 1024]
    - [1, 11314.6]
  - - [33712, 7800, 1, 1024, 33712, 33712, 1024, 1024]
    - [4, 11136.8]
  - - [1024, 5456, 1, 1024, 1024, 1024, 1024, 1024]
    - [3, 11818.3]
  - - [4096, 5456, 1, 1024, 4096, 4096, 1024, 1024]
    - [45, 11248.1]
  - - [1024, 5456, 1, 4096, 1024, 1024, 4096, 4096]
    - [11, 9827.21]
  - - [4096, 17408, 1, 1024, 4096, 4096, 1024, 1024]
    - [32, 9971.02]
  - - [33712, 228, 1, 1024, 33712, 33712, 1024, 1024]
    - [15, 10087.6]
  - - [33712, 9520, 1, 1024, 33712, 33712, 1024, 1024]
    - [7, 10154.7]
  - - [1024, 8976, 1, 4096, 1024, 1024, 4096, 4096]
    - [3, 11134.0]
  - - [1024, 508, 1, 1024, 1024, 1024, 1024, 1024]
    - [26, 7098.57]
  - - [1024, 8520, 1, 1024, 1024, 1024, 1024, 1024]
    - [14, 10909.8]
  - - [1024, 9856, 1, 1024, 1024, 1024, 1024, 1024]
    - [14, 10943.2]
  - - [4096, 9000, 1, 1024, 4096, 4096, 1024, 1024]
    - [31, 11663.2]
  - - [4096, 8520, 1, 1024, 4096, 4096, 1024, 1024]
    - [4, 11727.0]
  - - [1024, 5936, 1, 1024, 1024, 1024, 1024, 1024]
    - [3, 11114.9]
  - - [1024, 8520, 1, 4096, 1024, 1024, 4096, 4096]
    - [43, 10666.0]
  - - [33712, 9088, 1, 1024, 33712, 33712, 1024, 1024]
    - [3, 10681.7]
  - - [33712, 9328, 1, 1024, 33712, 33712, 1024, 1024]
    - [3, 10520.9]
  - - [1024, 18944, 1, 1024, 1024, 1024, 1024, 1024]
    - [8, 12244.9]
  - - [1024, 4536, 1, 1024, 1024, 1024, 1024, 1024]
    - [7, 10714.4]
  - - [1024, 1584, 1, 4096, 1024, 1024, 4096, 4096]
    - [3, 9033.71]
  - - [1024, 8256, 1, 4096, 1024, 1024, 4096, 4096]
    - [3, 11181.0]
  - - [1024, 8784, 1, 1024, 1024, 1024, 1024, 1024]
    - [3, 11381.3]
  - - [4096, 6800, 1, 1024, 4096, 4096, 1024, 1024]
    - [14, 11445.1]
  - - [4096, 5120, 1, 1024, 4096, 4096, 1024, 1024]
    - [7, 11508.9]
  - - [1024, 7224, 1, 4096, 1024, 1024, 4096, 4096]
    - [3, 10318.6]
  - - [1024, 8784, 1, 4096, 1024, 1024, 4096, 4096]
    - [3, 10978.4]
  - - [1024, 4560, 1, 1024, 1024, 1024, 1024, 1024]
    - [3, 10995.0]
  - - [4096, 6656, 1, 1024, 4096, 4096, 1024, 1024]
    - [14, 10753.9]
  - - [1024, 6656, 1, 4096, 1024, 1024, 4096, 4096]
    - [16, 10159.7]
  - - [1024, 8232, 1, 4096, 1024, 1024, 4096, 4096]
    - [43, 10983.4]
  - - [33712, 3864, 1, 1024, 33712, 33712, 1024, 1024]
    - [45, 10459.3]
  - - [1024, 2392, 1, 1024, 1024, 1024, 1024, 1024]
    - [3, 10874.9]
  - - [4096, 2392, 1, 1024, 4096, 4096, 1024, 1024]
    - [14, 11072.7]
  - - [4096, 10176, 1, 1024, 4096, 4096, 1024, 1024]
    - [45, 11407.9]
  - - [1024, 2392, 1, 4096, 1024, 1024, 4096, 4096]
    - [2, 8959.72]
  - - [33712, 276, 1, 1024, 33712, 33712, 1024, 1024]
    - [27, 9975.49]
  - - [1024, 7616, 1, 1024, 1024, 1024, 1024, 1024]
    - [31, 10861.1]
  - - [33712, 8096, 1, 1024, 33712, 33712, 1024, 1024]
    - [3, 10960.6]
  - - [33712, 448, 1, 1024, 33712, 33712, 1024, 1024]
    - [3, 11599.5]
  - - [1024, 9720, 1, 4096, 1024, 1024, 4096, 4096]
    - [3, 11239.7]
  - - [1024, 8360, 1, 1024, 1024, 1024, 1024, 1024]
    - [14, 10711.2]
  - - [1024, 3696, 1, 1024, 1024, 1024, 1024, 1024]
    - [7, 10777.3]
  - - [4096, 3696, 1, 1024, 4096, 4096, 1024, 1024]
    - [15, 10419.2]
  - - [1024, 304, 1, 1024, 1024, 1024, 1024, 1024]
    - [40, 5270.62]
  - - [33712, 8208, 1, 1024, 33712, 33712, 1024, 1024]
    - [11, 10815.3]
  - - [1024, 3696, 1, 4096, 1024, 1024, 4096, 4096]
    - [3, 10704.1]
  - - [1024, 7968, 1, 1024, 1024, 1024, 1024, 1024]
    - [59, 10422.9]
  - - [4096, 7968, 1, 1024, 4096, 4096, 1024, 1024]
    - [32, 11335.9]
  - - [1024, 7968, 1, 4096, 1024, 1024, 4096, 4096]
    - [3, 11225.6]
  - - [33712, 7968, 1, 1024, 33712, 33712, 1024, 1024]
    - [4, 11156.1]
  - - [1024, 7504, 1, 1024, 1024, 1024, 1024, 1024]
    - [3, 12291.4]
  - - [1024, 9760, 1, 1024, 1024, 1024, 1024, 1024]
    - [14, 10062.6]
  - - [1024, 8760, 1, 4096, 1024, 1024, 4096, 4096]
    - [3, 10433.3]
  - - [1024, 6048, 1, 1024, 1024, 1024, 1024, 1024]
    - [3, 11324.6]
  - - [1024, 5040, 1, 1024, 1024, 1024, 1024, 1024]
    - [31, 10091.7]
  - - [1024, 6048, 1, 4096, 1024, 1024, 4096, 4096]
    - [39, 9876.29]
  - - [33712, 8528, 1, 1024, 33712, 33712, 1024, 1024]
    - [12, 10831.7]
  - - [1024, 9400, 1, 1024, 1024, 1024, 1024, 1024]
    - [3, 12388.9]
  - - [33712, 8400, 1, 1024, 33712, 33712, 1024, 1024]
    - [5, 10993.7]
  - - [4096, 11264, 1, 1024, 4096, 4096, 1024, 1024]
    - [3, 12024.2]
  - - [33712, 8520, 1, 1024, 33712, 33712, 1024, 1024]
    - [5, 10879.2]
  - - [33712, 7400, 1, 1024, 33712, 33712, 1024, 1024]
    - [8, 11498.0]
  - - [33712, 9760, 1, 1024, 33712, 33712, 1024, 1024]
    - [3, 10102.8]
  - - [1024, 3072, 1, 1024, 1024, 1024, 1024, 1024]
    - [4, 11135.3]
  - - [1024, 3072, 1, 4096, 1024, 1024, 4096, 4096]
    - [7, 9893.77]
  - - [1024, 7216, 1, 4096, 1024, 1024, 4096, 4096]
    - [3, 10328.6]
  - - [33712, 9768, 1, 1024, 33712, 33712, 1024, 1024]
    - [3, 10413.1]
  - - [1024, 9040, 1, 1024, 1024, 1024, 1024, 1024]
    - [3, 12199.0]
  - - [4096, 9040, 1, 1024, 4096, 4096, 1024, 1024]
    - [3, 11667.2]
  - - [4096, 7696, 1, 1024, 4096, 4096, 1024, 1024]
    - [4, 11706.2]
  - - [1024, 9040, 1, 4096, 1024, 1024, 4096, 4096]
    - [3, 11816.4]
  - - [4096, 10160, 1, 1024, 4096, 4096, 1024, 1024]
    - [3, 11796.1]
  - - [1024, 8880, 1, 4096, 1024, 1024, 4096, 4096]
    - [3, 11109.8]
  - - [4096, 2304, 1, 1024, 4096, 4096, 1024, 1024]
    - [15, 11784.9]
  - - [1024, 2304, 1, 4096, 1024, 1024, 4096, 4096]
    - [11, 9784.98]
  - - [4096, 8664, 1, 1024, 4096, 4096, 1024, 1024]
    - [3, 11750.9]
  - - [33712, 4920, 1, 1024, 33712, 33712, 1024, 1024]
    - [2, 10757.2]
  - - [4096, 5776, 1, 1024, 4096, 4096, 1024, 1024]
    - [2, 10486.8]
  - - [1024, 8496, 1, 4096, 1024, 1024, 4096, 4096]
    - [3, 11141.4]
  - - [1024, 9936, 1, 4096, 1024, 1024, 4096, 4096]
    - [3, 11168.2]
  - - [1024, 6384, 1, 1024, 1024, 1024, 1024, 1024]
    - [3, 11140.5]
  - - [1024, 7128, 1, 4096, 1024, 1024, 4096, 4096]
    - [3, 10979.9]
  - - [1024, 6384, 1, 4096, 1024, 1024, 4096, 4096]
    - [29, 10208.4]
  - - [1024, 9752, 1, 4096, 1024, 1024, 4096, 4096]
    - [3, 11245.7]
  - - [33712, 9880, 1, 1024, 33712, 33712, 1024, 1024]
    - [14, 10057.8]
  - - [33712, 7200, 1, 1024, 33712, 33712, 1024, 1024]
    - [3, 11422.3]
  - - [1024, 6000, 1, 1024, 1024, 1024, 1024, 1024]
    - [4, 12019.4]
  - - [4096, 7488, 1, 1024, 4096, 4096, 1024, 1024]
    - [3, 11806.7]
  - - [1024, 6120, 1, 1024, 1024, 1024, 1024, 1024]
    - [3, 12254.2]
  - - [1024, 6120, 1, 4096, 1024, 1024, 4096, 4096]
    - [7, 10415.9]
  - - [1024, 7992, 1, 1024, 1024, 1024, 1024, 1024]
    - [3, 11535.3]
  - - [1024, 9640, 1, 1024, 1024, 1024, 1024, 1024]
    - [3, 10743.4]
  - - [4096, 9640, 1, 1024, 4096, 4096, 1024, 1024]
    - [45, 11390.3]
  - - [1024, 26656, 1, 1024, 1024, 1024, 1024, 1024]
    - [29, 11431.6]
  - - [1024, 3808, 1, 4096, 1024, 1024, 4096, 4096]
    - [8, 10368.1]
  - - [4096, 9720, 1, 1024, 4096, 4096, 1024, 1024]
    - [3, 11823.5]
  - - [1024, 5840, 1, 4096, 1024, 1024, 4096, 4096]
    - [14, 10035.8]
  - - [33712, 5840, 1, 1024, 33712, 33712, 1024, 1024]
    - [31, 10572.8]
  - - [1024, 5576, 1, 1024, 1024, 1024, 1024, 1024]
    - [3, 12056.3]
  - - [1024, 8624, 1, 1024, 1024, 1024, 1024, 1024]
    - [12, 10715.3]
  - - [33712, 8624, 1, 1024, 33712, 33712, 1024, 1024]
    - [5, 10688.1]
  - - [4096, 9864, 1, 1024, 4096, 4096, 1024, 1024]
    - [4, 11767.7]
  - - [4096, 9464, 1, 1024, 4096, 4096, 1024, 1024]
    - [3, 11806.0]
  - - [33712, 452, 1, 1024, 33712, 33712, 1024, 1024]
    - [7, 9862.64]
  - - [1024, 9464, 1, 4096, 1024, 1024, 4096, 4096]
    - [3, 11300.3]
  - - [1024, 5472, 1, 4096, 1024, 1024, 4096, 4096]
    - [11, 9821.28]
  - - [1024, 8120, 1, 4096, 1024, 1024, 4096, 4096]
    - [43, 10691.4]
  - - [1024, 5776, 1, 1024, 1024, 1024, 1024, 1024]
    - [3, 11227.5]
  - - [1024, 6336, 1, 1024, 1024, 1024, 1024, 1024]
    - [14, 10093.2]
  - - [4096, 5936, 1, 1024, 4096, 4096, 1024, 1024]
    - [4, 10737.9]
  - - [1024, 3864, 1, 1024, 1024, 1024, 1024, 1024]
    - [3, 10092.9]
  - - [1024, 9928, 1, 4096, 1024, 1024, 4096, 4096]
    - [7, 10889.1]
  - - [4096, 6688, 1, 1024, 4096, 4096, 1024, 1024]
    - [14, 10616.2]
  - - [1024, 9648, 1, 1024, 1024, 1024, 1024, 1024]
    - [3, 11598.4]
  - - [1024, 9648, 1, 4096, 1024, 1024, 4096, 4096]
    - [7, 11030.6]
  - - [1024, 5440, 1, 1024, 1024, 1024, 1024, 1024]
    - [3, 11012.0]
  - - [1024, 5440, 1, 4096, 1024, 1024, 4096, 4096]
    - [30, 9861.07]
  - - [1024, 8040, 1, 1024, 1024, 1024, 1024, 1024]
    - [4, 10465.9]
  - - [1024, 8040, 1, 4096, 1024, 1024, 4096, 4096]
    - [29, 10710.9]
  - - [4096, 7520, 1, 1024, 4096, 4096, 1024, 1024]
    - [7, 10828.4]
  - - [33712, 9176, 1, 1024, 33712, 33712, 1024, 1024]
    - [14, 10510.9]
  - - [1024, 6032, 1, 1024, 1024, 1024, 1024, 1024]
    - [3, 12081.7]
  - - [1024, 6032, 1, 4096, 1024, 1024, 4096, 4096]
    - [14, 9507.54]
  - - [33712, 6032, 1, 1024, 33712, 33712, 1024, 1024]
    - [45, 11538.6]
  - - [1024, 6976, 1, 1024, 1024, 1024, 1024, 1024]
    - [3, 12176.8]
  - - [1024, 9928, 1, 1024, 1024, 1024, 1024, 1024]
    - [31, 10927.8]
  - - [1024, 9952, 1, 4096, 1024, 1024, 4096, 4096]
    - [3, 11221.6]
  - - [1024, 3600, 1, 4096, 1024, 1024, 4096, 4096]
    - [7, 10304.8]
  - - [33712, 8256, 1, 1024, 33712, 33712, 1024, 1024]
    - [5, 10893.1]
  - - [4096, 4800, 1, 1024, 4096, 4096, 1024, 1024]
    - [1, 11311.0]
  - - [33712, 4800, 1, 1024, 33712, 33712, 1024, 1024]
    - [7, 10525.2]
  - - [1024, 6688, 1, 1024, 1024, 1024, 1024, 1024]
    - [3, 12057.9]
  - - [1024, 8856, 1, 4096, 1024, 1024, 4096, 4096]
    - [24, 10424.5]
  - - [4096, 8544, 1, 1024, 4096, 4096, 1024, 1024]
    - [4, 11760.0]
  - - [33712, 6720, 1, 1024, 33712, 33712, 1024, 1024]
    - [3, 11903.0]
  - - [1024, 8008, 1, 4096, 1024, 1024, 4096, 4096]
    - [1, 10884.8]
  - - [4096, 7504, 1, 1024, 4096, 4096, 1024, 1024]
    - [7, 11447.4]
  - - [1024, 7504, 1, 4096, 1024, 1024, 4096, 4096]
    - [29, 10327.7]
  - - [1024, 6784, 1, 1024, 1024, 1024, 1024, 1024]
    - [3, 11509.1]
  - - [33712, 5472, 1, 1024, 33712, 33712, 1024, 1024]
    - [1, 10563.7]
  - - [33712, 9680, 1, 1024, 33712, 33712, 1024, 1024]
    - [3, 10346.0]
  - - [1024, 8112, 1, 4096, 1024, 1024, 4096, 4096]
    - [29, 10816.4]
  - - [1024, 7728, 1, 4096, 1024, 1024, 4096, 4096]
    - [3, 10787.8]
  - - [1024, 5104, 1, 4096, 1024, 1024, 4096, 4096]
    - [1, 9860.92]
  - - [33712, 8352, 1, 1024, 33712, 33712, 1024, 1024]
    - [3, 10910.8]
  - - [4096, 5200, 1, 1024, 4096, 4096, 1024, 1024]
    - [7, 11935.4]
  - - [33712, 8008, 1, 1024, 33712, 33712, 1024, 1024]
    - [45, 11144.4]
  - - [4096, 9328, 1, 1024, 4096, 4096, 1024, 1024]
    - [1, 11441.5]
  - - [1024, 5472, 1, 1024, 1024, 1024, 1024, 1024]
    - [3, 11070.0]
  - - [1024, 9968, 1, 4096, 1024, 1024, 4096, 4096]
    - [3, 10537.3]
  - - [1024, 11776, 1, 1024, 1024, 1024, 1024, 1024]
    - [2, 10513.6]
  - - [1024, 7056, 1, 4096, 1024, 1024, 4096, 4096]
    - [29, 10491.7]
  - - [4096, 388, 1, 1024, 4096, 4096, 1024, 1024]
    - [8, 9134.4]
  - - [33712, 7056, 1, 1024, 33712, 33712, 1024, 1024]
    - [7, 11450.9]
  - - [33712, 4048, 1, 1024, 33712, 33712, 1024, 1024]
    - [3, 9881.66]
  - - [4096, 7384, 1, 1024, 4096, 4096, 1024, 1024]
    - [30, 10653.4]
  - - [1024, 8360, 1, 4096, 1024, 1024, 4096, 4096]
    - [3, 11219.0]
  - - [1024, 8296, 1, 4096, 1024, 1024, 4096, 4096]
    - [3, 11003.0]
  - - [1024, 10184, 1, 1024, 1024, 1024, 1024, 1024]
    - [14, 11315.0]
  - - [1024, 7872, 1, 4096, 1024, 1024, 4096, 4096]
    - [29, 10619.8]
  - - [4096, 8568, 1, 1024, 4096, 4096, 1024, 1024]
    - [32, 11393.1]
  - - [1024, 8432, 1, 1024, 1024, 1024, 1024, 1024]
    - [3, 11512.5]
  - - [1024, 9216, 1, 1024, 1024, 1024, 1024, 1024]
    - [3, 10785.3]
  - - [1024, 8544, 1, 1024, 1024, 1024, 1024, 1024]
    - [3, 10532.1]
  - - [1024, 6528, 1, 4096, 1024, 1024, 4096, 4096]
    - [14, 10217.5]
  - - [1024, 7344, 1, 1024, 1024, 1024, 1024, 1024]
    - [3, 11239.9]
  - - [4096, 7344, 1, 1024, 4096, 4096, 1024, 1024]
    - [7, 11582.8]
  - - [1024, 6968, 1, 1024, 1024, 1024, 1024, 1024]
    - [3, 12138.6]
  - - [4096, 10064, 1, 1024, 4096, 4096, 1024, 1024]
    - [45, 11249.9]
  - - [4096, 5920, 1, 1024, 4096, 4096, 1024, 1024]
    - [31, 10478.6]
  - - [1024, 7144, 1, 1024, 1024, 1024, 1024, 1024]
    - [5, 10531.7]
  - - [1024, 7144, 1, 4096, 1024, 1024, 4096, 4096]
    - [3, 11044.8]
  - - [1024, 9888, 1, 4096, 1024, 1024, 4096, 4096]
    - [3, 11288.0]
  - - [1024, 7400, 1, 1024, 1024, 1024, 1024, 1024]
    - [3, 10508.4]
  - - [33712, 9424, 1, 1024, 33712, 33712, 1024, 1024]
    - [45, 10128.8]
  - - [1024, 7400, 1, 4096, 1024, 1024, 4096, 4096]
    - [7, 10570.6]
  - - [4096, 244, 1, 1024, 4096, 4096, 1024, 1024]
    - [21, 8828.59]
  - - [1024, 4472, 1, 1024, 1024, 1024, 1024, 1024]
    - [3, 10792.7]
  - - [1024, 8800, 1, 1024, 1024, 1024, 1024, 1024]
    - [3, 10576.1]
  - - [1024, 6768, 1, 4096, 1024, 1024, 4096, 4096]
    - [14, 10705.9]
  - - [4096, 8800, 1, 1024, 4096, 4096, 1024, 1024]
    - [32, 11329.0]
  - - [1024, 8800, 1, 4096, 1024, 1024, 4096, 4096]
    - [3, 11063.0]
  - - [1024, 7488, 1, 1024, 1024, 1024, 1024, 1024]
    - [3, 11472.4]
  - - [1024, 6072, 1, 4096, 1024, 1024, 4096, 4096]
    - [39, 9288.55]
  - - [1024, 5568, 1, 1024, 1024, 1024, 1024, 1024]
    - [4, 11248.6]
  - - [4096, 5568, 1, 1024, 4096, 4096, 1024, 1024]
    - [46, 11306.1]
  - - [1024, 5568, 1, 4096, 1024, 1024, 4096, 4096]
    - [7, 9746.67]
  - - [33712, 5568, 1, 1024, 33712, 33712, 1024, 1024]
    - [20, 10671.4]
  - - [4096, 8784, 1, 1024, 4096, 4096, 1024, 1024]
    - [1, 11413.2]
  - - [1024, 320, 1, 1024, 1024, 1024, 1024, 1024]
    - [26, 5533.38]
  - - [33712, 7520, 1, 1024, 33712, 33712, 1024, 1024]
    - [15, 11593.1]
  - - [33712, 260, 1, 1024, 33712, 33712, 1024, 1024]
    - [4, 10077.5]
  - - [1024, 9288, 1, 1024, 1024, 1024, 1024, 1024]
    - [14, 10491.1]
  - - [4096, 7296, 1, 1024, 4096, 4096, 1024, 1024]
    - [7, 11477.1]
  - - [4096, 6000, 1, 1024, 4096, 4096, 1024, 1024]
    - [45, 11204.7]
  - - [1024, 460, 1, 1024, 1024, 1024, 1024, 1024]
    - [26, 7508.48]
  - - [1024, 6000, 1, 4096, 1024, 1024, 4096, 4096]
    - [14, 10888.2]
  - - [33712, 6864, 1, 1024, 33712, 33712, 1024, 1024]
    - [3, 11673.1]
  - - [1024, 5720, 1, 4096, 1024, 1024, 4096, 4096]
    - [6, 10184.1]
  - - [33712, 232, 1, 1024, 33712, 33712, 1024, 1024]
    - [19, 9128.37]
  - - [1024, 512, 1, 1024, 1024, 1024, 1024, 1024]
    - [27, 7162.1]
  - - [33712, 8640, 1, 1024, 33712, 33712, 1024, 1024]
    - [5, 10837.7]
  - - [4096, 6768, 1, 1024, 4096, 4096, 1024, 1024]
    - [1, 11376.6]
  - - [4096, 8968, 1, 1024, 4096, 4096, 1024, 1024]
    - [31, 11567.4]
  - - [33712, 5120, 1, 1024, 33712, 33712, 1024, 1024]
    - [2, 10545.4]
  - - [1024, 7680, 1, 1024, 1024, 1024, 1024, 1024]
    - [3, 12216.4]
  - - [4096, 7680, 1, 1024, 4096, 4096, 1024, 1024]
    - [3, 11770.7]
  - - [1024, 7680, 1, 4096, 1024, 1024, 4096, 4096]
    - [3, 10881.3]
  - - [1024, 7752, 1, 1024, 1024, 1024, 1024, 1024]
    - [3, 11198.8]
  - - [1024, 9296, 1, 1024, 1024, 1024, 1024, 1024]
    - [14, 10496.6]
  - - [4096, 9296, 1, 1024, 4096, 4096, 1024, 1024]
    - [3, 11741.7]
  - - [33712, 7920, 1, 1024, 33712, 33712, 1024, 1024]
    - [4, 11266.0]
  - - [1024, 4920, 1, 1024, 1024, 1024, 1024, 1024]
    - [3, 12101.2]
  - - [4096, 33792, 1, 1024, 4096, 4096, 1024, 1024]
    - [45, 10416.1]
  - - [4096, 5472, 1, 1024, 4096, 4096, 1024, 1024]
    - [46, 11285.1]
  - - [1024, 7888, 1, 4096, 1024, 1024, 4096, 4096]
    - [43, 10752.1]
  - - [1024, 7440, 1, 1024, 1024, 1024, 1024, 1024]
    - [3, 11390.9]
  - - [4096, 7440, 1, 1024, 4096, 4096, 1024, 1024]
    - [4, 10851.8]
  - - [33712, 8904, 1, 1024, 33712, 33712, 1024, 1024]
    - [3, 10841.9]
  - - [33712, 9648, 1, 1024, 33712, 33712, 1024, 1024]
    - [3, 10278.5]
  - - [33712, 7176, 1, 1024, 33712, 33712, 1024, 1024]
    - [7, 11273.1]
  - - [4096, 4160, 1, 1024, 4096, 4096, 1024, 1024]
    - [8, 11350.1]
  - - [1024, 4896, 1, 1024, 1024, 1024, 1024, 1024]
    - [32, 11286.1]
  - - [4096, 4896, 1, 1024, 4096, 4096, 1024, 1024]
    - [14, 10450.7]
  - - [1024, 7176, 1, 1024, 1024, 1024, 1024, 1024]
    - [45, 10859.8]
  - - [1024, 7728, 1, 1024, 1024, 1024, 1024, 1024]
    - [3, 10654.5]
  - - [4096, 4488, 1, 1024, 4096, 4096, 1024, 1024]
    - [32, 11082.3]
  - - [1024, 6128, 1, 4096, 1024, 1024, 4096, 4096]
    - [7, 10589.1]
  - - [1024, 8128, 1, 1024, 1024, 1024, 1024, 1024]
    - [4, 11402.7]
  - - [33712, 7992, 1, 1024, 33712, 33712, 1024, 1024]
    - [4, 11271.9]
  - - [4096, 8128, 1, 1024, 4096, 4096, 1024, 1024]
    - [7, 11526.3]
  - - [33712, 8128, 1, 1024, 33712, 33712, 1024, 1024]
    - [5, 11134.2]
  - - [1024, 328, 1, 1024, 1024, 1024, 1024, 1024]
    - [26, 5649.36]
  - - [1024, 7440, 1, 4096, 1024, 1024, 4096, 4096]
    - [3, 10926.3]
  - - [4096, 284, 1, 1024, 4096, 4096, 1024, 1024]
    - [7, 8421.82]
  - - [1024, 7568, 1, 1024, 1024, 1024, 1024, 1024]
    - [1, 10863.5]
  - - [4096, 7568, 1, 1024, 4096, 4096, 1024, 1024]
    - [24, 10889.5]
  - - [1024, 9328, 1, 4096, 1024, 1024, 4096, 4096]
    - [3, 11507.2]
  - - [33712, 8648, 1, 1024, 33712, 33712, 1024, 1024]
    - [14, 10716.6]
  - - [4096, 7992, 1, 1024, 4096, 4096, 1024, 1024]
    - [7, 11496.1]
  - - [1024, 7992, 1, 4096, 1024, 1024, 4096, 4096]
    - [3, 10879.1]
  - - [4096, 6664, 1, 1024, 4096, 4096, 1024, 1024]
    - [14, 10582.3]
  - - [1024, 8480, 1, 4096, 1024, 1024, 4096, 4096]
    - [3, 11068.9]
  - - [1024, 8576, 1, 1024, 1024, 1024, 1024, 1024]
    - [4, 11388.8]
  - - [1024, 6272, 1, 4096, 1024, 1024, 4096, 4096]
    - [30, 10107.0]
  - - [1024, 8576, 1, 4096, 1024, 1024, 4096, 4096]
    - [43, 10711.5]
  - - [1024, 7384, 1, 1024, 1024, 1024, 1024, 1024]
    - [3, 11307.8]
  - - [1024, 9952, 1, 1024, 1024, 1024, 1024, 1024]
    - [31, 10242.8]
  - - [1024, 7384, 1, 4096, 1024, 1024, 4096, 4096]
    - [3, 10116.6]
  - - [1024, 9968, 1, 1024, 1024, 1024, 1024, 1024]
    - [3, 11442.6]
  - - [1024, 2040, 1, 1024, 1024, 1024, 1024, 1024]
    - [3, 9645.97]
  - - [4096, 2040, 1, 1024, 4096, 4096, 1024, 1024]
    - [14, 10984.3]
  - - [4096, 5784, 1, 1024, 4096, 4096, 1024, 1024]
    - [46, 10453.6]
  - - [1024, 5784, 1, 4096, 1024, 1024, 4096, 4096]
    - [5, 9953.63]
  - - [4096, 8616, 1, 1024, 4096, 4096, 1024, 1024]
    - [32, 11320.6]
  - - [33712, 10160, 1, 1024, 33712, 33712, 1024, 1024]
    - [14, 10063.1]
  - - [1024, 912, 1, 1024, 1024, 1024, 1024, 1024]
    - [4, 10260.7]
  - - [4096, 912, 1, 1024, 4096, 4096, 1024, 1024]
    - [4, 10251.9]
  - - [4096, 7888, 1, 1024, 4096, 4096, 1024, 1024]
    - [4, 11731.1]
  - - [4096, 476, 1, 1024, 4096, 4096, 1024, 1024]
    - [4, 10346.6]
  - - [33712, 9184, 1, 1024, 33712, 33712, 1024, 1024]
    - [3, 10475.6]
  - - [1024, 7776, 1, 1024, 1024, 1024, 1024, 1024]
    - [3, 12028.9]
  - - [1024, 10176, 1, 1024, 1024, 1024, 1024, 1024]
    - [3, 10828.8]
  - - [33712, 7776, 1, 1024, 33712, 33712, 1024, 1024]
    - [11, 11342.4]
  - - [1024, 7776, 1, 4096, 1024, 1024, 4096, 4096]
    - [7, 10839.8]
  - - [1024, 6240, 1, 1024, 1024, 1024, 1024, 1024]
    - [3, 11262.6]
  - - [4096, 6240, 1, 1024, 4096, 4096, 1024, 1024]
    - [49, 10721.8]
  - - [4096, 7480, 1, 1024, 4096, 4096, 1024, 1024]
    - [8, 11391.2]
  - - [1024, 5328, 1, 4096, 1024, 1024, 4096, 4096]
    - [1, 10768.7]
  - - [33712, 5040, 1, 1024, 33712, 33712, 1024, 1024]
    - [38, 10534.8]
  - - [1024, 5016, 1, 1024, 1024, 1024, 1024, 1024]
    - [5, 11277.1]
  - - [4096, 8232, 1, 1024, 4096, 4096, 1024, 1024]
    - [3, 11788.6]
  - - [4096, 8360, 1, 1024, 4096, 4096, 1024, 1024]
    - [4, 11808.1]
  - - [33712, 8360, 1, 1024, 33712, 33712, 1024, 1024]
    - [5, 10860.5]
  - - [4096, 6624, 1, 1024, 4096, 4096, 1024, 1024]
    - [1, 11332.2]
  - - [33712, 4536, 1, 1024, 33712, 33712, 1024, 1024]
    - [14, 10625.8]
  - - [4096, 5576, 1, 1024, 4096, 4096, 1024, 1024]
    - [7, 11279.9]
  - - [1024, 5576, 1, 4096, 1024, 1024, 4096, 4096]
    - [3, 10042.0]
  - - [4096, 2880, 1, 1024, 4096, 4096, 1024, 1024]
    - [4, 10760.0]
  - - [1024, 2880, 1, 4096, 1024, 1024, 4096, 4096]
    - [3, 9510.86]
  - - [1024, 8760, 1, 1024, 1024, 1024, 1024, 1024]
    - [14, 11213.9]
  - - [4096, 8760, 1, 1024, 4096, 4096, 1024, 1024]
    - [3, 11801.4]
  - - [33712, 8760, 1, 1024, 33712, 33712, 1024, 1024]
    - [3, 11039.7]
  - - [1024, 2176, 1, 4096, 1024, 1024, 4096, 4096]
    - [4, 10423.5]
  - - [4096, 9984, 1, 1024, 4096, 4096, 1024, 1024]
    - [3, 11546.5]
  - - [33712, 7640, 1, 1024, 33712, 33712, 1024, 1024]
    - [6, 11082.0]
  - - [4096, 8184, 1, 1024, 4096, 4096, 1024, 1024]
    - [7, 11631.9]
  - - [1024, 8184, 1, 4096, 1024, 1024, 4096, 4096]
    - [43, 11105.9]
  - - [33712, 9120, 1, 1024, 33712, 33712, 1024, 1024]
    - [31, 10673.4]
  - - [1024, 9600, 1, 1024, 1024, 1024, 1024, 1024]
    - [3, 12348.3]
  - - [1024, 4352, 1, 1024, 1024, 1024, 1024, 1024]
    - [20, 10680.1]
  - - [4096, 264, 1, 1024, 4096, 4096, 1024, 1024]
    - [38, 8042.51]
  - - [4096, 8592, 1, 1024, 4096, 4096, 1024, 1024]
    - [3, 12401.0]
  - - [4096, 4352, 1, 1024, 4096, 4096, 1024, 1024]
    - [1, 11331.4]
  - - [4096, 3360, 1, 1024, 4096, 4096, 1024, 1024]
    - [8, 11003.8]
  - - [1024, 4352, 1, 4096, 1024, 1024, 4096, 4096]
    - [3, 9397.42]
  - - [1024, 6512, 1, 1024, 1024, 1024, 1024, 1024]
    - [46, 10428.1]
  - - [1024, 9680, 1, 1024, 1024, 1024, 1024, 1024]
    - [49, 10334.6]
  - - [1024, 9288, 1, 4096, 1024, 1024, 4096, 4096]
    - [3, 10319.5]
  - - [1024, 8624, 1, 4096, 1024, 1024, 4096, 4096]
    - [3, 11357.0]
  - - [4096, 9744, 1, 1024, 4096, 4096, 1024, 1024]
    - [3, 11782.7]
  - - [33712, 6496, 1, 1024, 33712, 33712, 1024, 1024]
    - [3, 11708.1]
  - - [1024, 5880, 1, 1024, 1024, 1024, 1024, 1024]
    - [3, 12231.4]
  - - [1024, 5880, 1, 4096, 1024, 1024, 4096, 4096]
    - [14, 10620.1]
  - - [1024, 440, 1, 1024, 1024, 1024, 1024, 1024]
    - [27, 7431.92]
  - - [33712, 5880, 1, 1024, 33712, 33712, 1024, 1024]
    - [45, 11104.2]
  - - [1024, 6816, 1, 4096, 1024, 1024, 4096, 4096]
    - [14, 10797.5]
  - - [4096, 7872, 1, 1024, 4096, 4096, 1024, 1024]
    - [7, 11130.5]
  - - [1024, 13312, 1, 4096, 1024, 1024, 4096, 4096]
    - [18, 9823.08]
  - - [1024, 9800, 1, 1024, 1024, 1024, 1024, 1024]
    - [14, 10897.6]
  - - [4096, 4864, 1, 1024, 4096, 4096, 1024, 1024]
    - [32, 10421.0]
  - - [1024, 8568, 1, 4096, 1024, 1024, 4096, 4096]
    - [43, 10527.3]
  - - [4096, 8256, 1, 1024, 4096, 4096, 1024, 1024]
    - [4, 11664.6]
  - - [4096, 8120, 1, 1024, 4096, 4096, 1024, 1024]
    - [4, 11575.1]
  - - [4096, 1232, 1, 1024, 4096, 4096, 1024, 1024]
    - [4, 11557.0]
  - - [1024, 5920, 1, 4096, 1024, 1024, 4096, 4096]
    - [14, 9994.77]
  - - [4096, 6360, 1, 1024, 4096, 4096, 1024, 1024]
    - [14, 10995.7]
  - - [1024, 6360, 1, 4096, 1024, 1024, 4096, 4096]
    - [30, 9956.59]
  - - [1024, 9424, 1, 1024, 1024, 1024, 1024, 1024]
    - [3, 11608.1]
  - - [33712, 6528, 1, 1024, 33712, 33712, 1024, 1024]
    - [31, 11603.5]
  - - [1024, 10160, 1, 4096, 1024, 1024, 4096, 4096]
    - [3, 11572.6]
  - - [33712, 8232, 1, 1024, 33712, 33712, 1024, 1024]
    - [8, 10945.2]
  - - [1024, 8680, 1, 1024, 1024, 1024, 1024, 1024]
    - [3, 12339.5]
  - - [4096, 8680, 1, 1024, 4096, 4096, 1024, 1024]
    - [3, 11766.8]
  - - [33712, 8592, 1, 1024, 33712, 33712, 1024, 1024]
    - [5, 10930.8]
  - - [1024, 5328, 1, 1024, 1024, 1024, 1024, 1024]
    - [4, 12009.4]
  - - [4096, 3072, 1, 1024, 4096, 4096, 1024, 1024]
    - [7, 11142.2]
  - - [1024, 4488, 1, 1024, 1024, 1024, 1024, 1024]
    - [3, 10815.4]
  - - [1024, 432, 1, 1024, 1024, 1024, 1024, 1024]
    - [40, 7113.46]
  - - [1024, 7888, 1, 1024, 1024, 1024, 1024, 1024]
    - [3, 11386.5]
  - - [1024, 4488, 1, 4096, 1024, 1024, 4096, 4096]
    - [7, 10253.6]
  - - [33712, 6272, 1, 1024, 33712, 33712, 1024, 1024]
    - [3, 12068.9]
  - - [4096, 6696, 1, 1024, 4096, 4096, 1024, 1024]
    - [1, 11349.1]
  - - [4096, 340, 1, 1024, 4096, 4096, 1024, 1024]
    - [15, 8047.74]
  - - [1024, 6696, 1, 4096, 1024, 1024, 4096, 4096]
    - [14, 10614.1]
  - - [33712, 8880, 1, 1024, 33712, 33712, 1024, 1024]
    - [5, 10705.8]
  - - [1024, 8536, 1, 1024, 1024, 1024, 1024, 1024]
    - [3, 12142.7]
  - - [1024, 8536, 1, 4096, 1024, 1024, 4096, 4096]
    - [3, 11138.7]
  - - [1024, 10152, 1, 4096, 1024, 1024, 4096, 4096]
    - [7, 11409.8]
  - - [4096, 3000, 1, 1024, 4096, 4096, 1024, 1024]
    - [11, 10667.1]
  - - [33712, 7360, 1, 1024, 33712, 33712, 1024, 1024]
    - [7, 11331.0]
  - - [4096, 3864, 1, 1024, 4096, 4096, 1024, 1024]
    - [3, 11600.1]
  - - [33712, 5824, 1, 1024, 33712, 33712, 1024, 1024]
    - [3, 11691.1]
  - - [1024, 8712, 1, 4096, 1024, 1024, 4096, 4096]
    - [3, 11710.5]
  - - [1024, 9680, 1, 4096, 1024, 1024, 4096, 4096]
    - [3, 11081.2]
  - - [1024, 8000, 1, 4096, 1024, 1024, 4096, 4096]
    - [3, 11136.1]
  - - [1024, 3600, 1, 1024, 1024, 1024, 1024, 1024]
    - [3, 11483.5]
  - - [1024, 3808, 1, 1024, 1024, 1024, 1024, 1024]
    - [20, 10109.8]
  - - [4096, 10112, 1, 1024, 4096, 4096, 1024, 1024]
    - [31, 11389.5]
  - - [4096, 6968, 1, 1024, 4096, 4096, 1024, 1024]
    - [7, 11500.4]
  - - [1024, 8096, 1, 1024, 1024, 1024, 1024, 1024]
    - [3, 11365.1]
  - - [33712, 9800, 1, 1024, 33712, 33712, 1024, 1024]
    - [3, 10092.1]
  - - [4096, 6936, 1, 1024, 4096, 4096, 1024, 1024]
    - [1, 11357.5]
  - - [33712, 8600, 1, 1024, 33712, 33712, 1024, 1024]
    - [5, 10821.7]
  - - [4096, 9288, 1, 1024, 4096, 4096, 1024, 1024]
    - [14, 11577.1]
  - - [33712, 9656, 1, 1024, 33712, 33712, 1024, 1024]
    - [3, 10235.3]
  - - [1024, 2176, 1, 1024, 1024, 1024, 1024, 1024]
    - [3, 10795.3]
  - - [4096, 8000, 1, 1024, 4096, 4096, 1024, 1024]
    - [3, 12512.4]
  - - [1024, 2304, 1, 1024, 1024, 1024, 1024, 1024]
    - [3, 11374.4]
  - - [1024, 7296, 1, 1024, 1024, 1024, 1024, 1024]
    - [14, 11036.3]
  - - [1024, 6272, 1, 1024, 1024, 1024, 1024, 1024]
    - [45, 10615.7]
  - - [4096, 6272, 1, 1024, 4096, 4096, 1024, 1024]
    - [14, 11537.2]
  - - [33712, 9600, 1, 1024, 33712, 33712, 1024, 1024]
    - [14, 10278.3]
  - - [33712, 7840, 1, 1024, 33712, 33712, 1024, 1024]
    - [11, 11223.5]
  - - [4096, 8040, 1, 1024, 4096, 4096, 1024, 1024]
    - [7, 11563.6]
  - - [1024, 5304, 1, 1024, 1024, 1024, 1024, 1024]
    - [3, 11961.5]
  - - [4096, 5304, 1, 1024, 4096, 4096, 1024, 1024]
    - [5, 11149.1]
  - - [1024, 5304, 1, 4096, 1024, 1024, 4096, 4096]
    - [14, 10430.3]
  - - [1024, 8184, 1, 1024, 1024, 1024, 1024, 1024]
    - [3, 10651.3]
  - - [4096, 6528, 1, 1024, 4096, 4096, 1024, 1024]
    - [14, 11578.7]
  - - [1024, 3584, 1, 4096, 1024, 1024, 4096, 4096]
    - [3, 10395.2]
  - - [4096, 7616, 1, 1024, 4096, 4096, 1024, 1024]
    - [8, 11458.6]
  - - [1024, 9936, 1, 1024, 1024, 1024, 1024, 1024]
    - [3, 11412.9]
  - - [1024, 8112, 1, 1024, 1024, 1024, 1024, 1024]
    - [3, 10558.6]
  - - [4096, 7360, 1, 1024, 4096, 4096, 1024, 1024]
    - [7, 11580.9]
  - - [1024, 6440, 1, 1024, 1024, 1024, 1024, 1024]
    - [3, 11976.5]
  - - [4096, 7688, 1, 1024, 4096, 4096, 1024, 1024]
    - [7, 11383.6]
  - - [33712, 7688, 1, 1024, 33712, 33712, 1024, 1024]
    - [6, 11046.2]
  - - [4096, 4920, 1, 1024, 4096, 4096, 1024, 1024]
    - [7, 11823.8]
  - - [1024, 420, 1, 1024, 1024, 1024, 1024, 1024]
    - [26, 6933.28]
  - - [33712, 10192, 1, 1024, 33712, 33712, 1024, 1024]
    - [14, 10368.5]
  - - [1024, 6888, 1, 1024, 1024, 1024, 1024, 1024]
    - [3, 12023.2]
  - - [1024, 8016, 1, 1024, 1024, 1024, 1024, 1024]
    - [14, 10825.0]
  - - [33712, 8712, 1, 1024, 33712, 33712, 1024, 1024]
    - [5, 10757.9]
  - - [4096, 5016, 1, 1024, 4096, 4096, 1024, 1024]
    - [7, 11514.6]
  - - [1024, 5016, 1, 4096, 1024, 1024, 4096, 4096]
    - [7, 10545.0]
  - - [33712, 5016, 1, 1024, 33712, 33712, 1024, 1024]
    - [1, 10356.0]
  - - [1024, 5200, 1, 4096, 1024, 1024, 4096, 4096]
    - [39, 9830.13]
  - - [4096, 6880, 1, 1024, 4096, 4096, 1024, 1024]
    - [14, 11135.4]
  - - [33712, 332, 1, 1024, 33712, 33712, 1024, 1024]
    - [11, 9384.39]
  - - [1024, 8064, 1, 4096, 1024, 1024, 4096, 4096]
    - [43, 10966.3]
  - - [4096, 9424, 1, 1024, 4096, 4096, 1024, 1024]
    - [4, 11759.2]
  - - [1024, 7208, 1, 1024, 1024, 1024, 1024, 1024]
    - [1, 10971.6]
  - - [1024, 7208, 1, 4096, 1024, 1024, 4096, 4096]
    - [3, 10272.8]
  - - [1024, 8464, 1, 1024, 1024, 1024, 1024, 1024]
    - [3, 11557.3]
  - - [1024, 6840, 1, 1024, 1024, 1024, 1024, 1024]
    - [3, 10687.0]
  - - [1024, 7128, 1, 1024, 1024, 1024, 1024, 1024]
    - [14, 10777.2]
  - - [4096, 7128, 1, 1024, 4096, 4096, 1024, 1024]
    - [7, 11398.2]
  - - [1024, 800, 1, 4096, 1024, 1024, 4096, 4096]
    - [3, 8811.54]
  - - [1024, 9248, 1, 1024, 1024, 1024, 1024, 1024]
    - [14, 11275.8]
  - - [4096, 9248, 1, 1024, 4096, 4096, 1024, 1024]
    - [45, 11594.3]
  - - [1024, 4480, 1, 1024, 1024, 1024, 1024, 1024]
    - [3, 10804.1]
  - - [4096, 4480, 1, 1024, 4096, 4096, 1024, 1024]
    - [46, 10493.2]
  - - [1024, 4480, 1, 4096, 1024, 1024, 4096, 4096]
    - [5, 10135.5]
  - - [1024, 9776, 1, 4096, 1024, 1024, 4096, 4096]
    - [3, 10516.5]
  - - [1024, 9200, 1, 1024, 1024, 1024, 1024, 1024]
    - [14, 11207.9]
  - - [1024, 9200, 1, 4096, 1024, 1024, 4096, 4096]
    - [3, 11241.3]
  - - [1024, 6560, 1, 4096, 1024, 1024, 4096, 4096]
    - [7, 10442.4]
  - - [1024, 3000, 1, 1024, 1024, 1024, 1024, 1024]
    - [8, 10564.6]
  - - [4096, 6032, 1, 1024, 4096, 4096, 1024, 1024]
    - [8, 11043.0]
  - - [1024, 3000, 1, 4096, 1024, 1024, 4096, 4096]
    - [3, 10256.0]
  - - [1024, 9120, 1, 4096, 1024, 1024, 4096, 4096]
    - [43, 10453.6]
  - - [4096, 9272, 1, 1024, 4096, 4096, 1024, 1024]
    - [3, 12292.5]
  - - [4096, 7216, 1, 1024, 4096, 4096, 1024, 1024]
    - [7, 12051.6]
  - - [1024, 9632, 1, 4096, 1024, 1024, 4096, 4096]
    - [3, 11651.6]
  - - [4096, 9912, 1, 1024, 4096, 4096, 1024, 1024]
    - [3, 11843.8]
  - - [1024, 8680, 1, 4096, 1024, 1024, 4096, 4096]
    - [3, 11635.9]
  - - [4096, 7192, 1, 1024, 4096, 4096, 1024, 1024]
    - [7, 11488.6]
  - - [1024, 7192, 1, 4096, 1024, 1024, 4096, 4096]
    - [7, 10681.2]
  - - [4096, 6888, 1, 1024, 4096, 4096, 1024, 1024]
    - [14, 10750.4]
  - - [1024, 7744, 1, 4096, 1024, 1024, 4096, 4096]
    - [29, 10931.2]
  - - [1024, 7520, 1, 4096, 1024, 1024, 4096, 4096]
    - [29, 10904.5]
  - - [4096, 8424, 1, 1024, 4096, 4096, 1024, 1024]
    - [4, 11751.9]
  - - [1024, 2592, 1, 1024, 1024, 1024, 1024, 1024]
    - [3, 10843.9]
  - - [1024, 2592, 1, 4096, 1024, 1024, 4096, 4096]
    - [7, 9782.95]
  - - [1024, 9888, 1, 1024, 1024, 1024, 1024, 1024]
    - [29, 10283.5]
  - - [4096, 8712, 1, 1024, 4096, 4096, 1024, 1024]
    - [3, 12560.0]
  - - [1024, 9024, 1, 4096, 1024, 1024, 4096, 4096]
    - [3, 11497.1]
  - - [33712, 9168, 1, 1024, 33712, 33712, 1024, 1024]
    - [3, 10639.1]
  - - [1024, 7192, 1, 1024, 1024, 1024, 1024, 1024]
    - [3, 12154.0]
  - - [33712, 240, 1, 1024, 33712, 33712, 1024, 1024]
    - [14, 9849.06]
  - - [1024, 6880, 1, 4096, 1024, 1024, 4096, 4096]
    - [24, 10358.9]
  - - [1024, 9520, 1, 4096, 1024, 1024, 4096, 4096]
    - [3, 11248.0]
  - - [1024, 9000, 1, 4096, 1024, 1024, 4096, 4096]
    - [3, 11675.0]
  - - [1024, 6600, 1, 1024, 1024, 1024, 1024, 1024]
    - [3, 11120.6]
  - - [4096, 4608, 1, 1024, 4096, 4096, 1024, 1024]
    - [32, 10526.8]
  - - [1024, 2040, 1, 4096, 1024, 1024, 4096, 4096]
    - [4, 8976.45]
  - - [33712, 4608, 1, 1024, 33712, 33712, 1024, 1024]
    - [30, 10752.1]
  - - [4096, 7168, 1, 1024, 4096, 4096, 1024, 1024]
    - [59, 10842.1]
  - - [4096, 8112, 1, 1024, 4096, 4096, 1024, 1024]
    - [4, 10926.4]
  - - [33712, 8112, 1, 1024, 33712, 33712, 1024, 1024]
    - [6, 11032.5]
  - - [4096, 7640, 1, 1024, 4096, 4096, 1024, 1024]
    - [14, 11525.8]
  - - [1024, 7840, 1, 4096, 1024, 1024, 4096, 4096]
    - [3, 11071.8]
  - - [4096, 4968, 1, 1024, 4096, 4096, 1024, 1024]
    - [14, 11438.0]
  - - [4096, 7656, 1, 1024, 4096, 4096, 1024, 1024]
    - [7, 11504.9]
  - - [1024, 7656, 1, 4096, 1024, 1024, 4096, 4096]
    - [29, 11001.6]
  - - [4096, 5040, 1, 1024, 4096, 4096, 1024, 1024]
    - [14, 11344.2]
  - - [1024, 4224, 1, 1024, 1024, 1024, 1024, 1024]
    - [32, 10649.1]
  - - [1024, 9088, 1, 4096, 1024, 1024, 4096, 4096]
    - [3, 10985.2]
  - - [1024, 7056, 1, 1024, 1024, 1024, 1024, 1024]
    - [3, 11145.4]
  - - [4096, 4392, 1, 1024, 4096, 4096, 1024, 1024]
    - [32, 11114.3]
  - - [1024, 4392, 1, 4096, 1024, 1024, 4096, 4096]
    - [1, 9984.24]
  - - [1024, 9864, 1, 4096, 1024, 1024, 4096, 4096]
    - [3, 10464.3]
  - - [33712, 8184, 1, 1024, 33712, 33712, 1024, 1024]
    - [11, 11034.8]
  - - [33712, 9864, 1, 1024, 33712, 33712, 1024, 1024]
    - [14, 10286.5]
  - - [33712, 7208, 1, 1024, 33712, 33712, 1024, 1024]
    - [5, 11485.4]
  - - [1024, 5504, 1, 1024, 1024, 1024, 1024, 1024]
    - [3, 11918.4]
  - - [4096, 5504, 1, 1024, 4096, 4096, 1024, 1024]
    - [35, 10614.9]
  - - [1024, 7896, 1, 4096, 1024, 1024, 4096, 4096]
    - [43, 10426.0]
  - - [1024, 5504, 1, 4096, 1024, 1024, 4096, 4096]
    - [44, 10109.2]
  - - [33712, 5504, 1, 1024, 33712, 33712, 1024, 1024]
    - [45, 11018.0]
  - - [1024, 1856, 1, 1024, 1024, 1024, 1024, 1024]
    - [7, 11002.7]
  - - [4096, 1856, 1, 1024, 4096, 4096, 1024, 1024]
    - [3, 11318.8]
  - - [33712, 388, 1, 1024, 33712, 33712, 1024, 1024]
    - [8, 9106.7]
  - - [1024, 1856, 1, 4096, 1024, 1024, 4096, 4096]
    - [5, 9997.69]
  - - [1024, 8256, 1, 1024, 1024, 1024, 1024, 1024]
    - [3, 10746.0]
  - - [1024, 6496, 1, 4096, 1024, 1024, 4096, 4096]
    - [14, 10033.2]
  - - [1024, 332, 1, 1024, 1024, 1024, 1024, 1024]
    - [26, 5703.26]
  - - [1024, 8592, 1, 1024, 1024, 1024, 1024, 1024]
    - [1, 11027.9]
  - - [1024, 7696, 1, 1024, 1024, 1024, 1024, 1024]
    - [45, 10669.8]
  - - [1024, 3256, 1, 1024, 1024, 1024, 1024, 1024]
    - [20, 9541.01]
  - - [4096, 3256, 1, 1024, 4096, 4096, 1024, 1024]
    - [7, 11382.8]
  - - [1024, 3256, 1, 4096, 1024, 1024, 4096, 4096]
    - [8, 9505.94]
  - - [33712, 6664, 1, 1024, 33712, 33712, 1024, 1024]
    - [3, 11726.2]
  - - [33712, 7888, 1, 1024, 33712, 33712, 1024, 1024]
    - [6, 11118.2]
  - - [4096, 6840, 1, 1024, 4096, 4096, 1024, 1024]
    - [1, 11391.7]
  - - [1024, 6840, 1, 4096, 1024, 1024, 4096, 4096]
    - [7, 11286.0]
  - - [1024, 6800, 1, 1024, 1024, 1024, 1024, 1024]
    - [3, 12241.3]
  - - [33712, 508, 1, 1024, 33712, 33712, 1024, 1024]
    - [48, 10347.8]
  - - [4096, 6512, 1, 1024, 4096, 4096, 1024, 1024]
    - [59, 10786.5]
  - - [1024, 6512, 1, 4096, 1024, 1024, 4096, 4096]
    - [24, 10274.9]
  - - [1024, 3360, 1, 1024, 1024, 1024, 1024, 1024]
    - [4, 10653.1]
  - - [1024, 1224, 1, 1024, 1024, 1024, 1024, 1024]
    - [52, 8443.77]
  - - [1024, 4160, 1, 1024, 1024, 1024, 1024, 1024]
    - [3, 11082.5]
  - - [33712, 9952, 1, 1024, 33712, 33712, 1024, 1024]
    - [14, 10145.8]
  - - [4096, 1224, 1, 1024, 4096, 4096, 1024, 1024]
    - [4, 11498.4]
  - - [1024, 1224, 1, 4096, 1024, 1024, 4096, 4096]
    - [4, 8945.17]
  - - [33712, 9144, 1, 1024, 33712, 33712, 1024, 1024]
    - [3, 10860.1]
  - - [4096, 9216, 1, 1024, 4096, 4096, 1024, 1024]
    - [45, 12029.9]
  - - [33712, 9024, 1, 1024, 33712, 33712, 1024, 1024]
    - [3, 10841.4]
  - - [4096, 436, 1, 1024, 4096, 4096, 1024, 1024]
    - [4, 10519.5]
  - - [4096, 8464, 1, 1024, 4096, 4096, 1024, 1024]
    - [3, 12545.4]
  - - [4096, 7632, 1, 1024, 4096, 4096, 1024, 1024]
    - [8, 11469.8]
  - - [4096, 412, 1, 1024, 4096, 4096, 1024, 1024]
    - [4, 9958.78]
  - - [1024, 7632, 1, 4096, 1024, 1024, 4096, 4096]
    - [3, 11890.4]
  - - [4096, 4224, 1, 1024, 4096, 4096, 1024, 1024]
    - [1, 11309.9]
  - - [33712, 5104, 1, 1024, 33712, 33712, 1024, 1024]
    - [45, 10196.7]
  - - [1024, 4224, 1, 4096, 1024, 1024, 4096, 4096]
    - [7, 9889.63]
  - - [33712, 7568, 1, 1024, 33712, 33712, 1024, 1024]
    - [5, 11097.1]
  - - [1024, 4472, 1, 4096, 1024, 1024, 4096, 4096]
    - [7, 11053.2]
  - - [33712, 8928, 1, 1024, 33712, 33712, 1024, 1024]
    - [5, 10676.5]
  - - [1024, 9760, 1, 4096, 1024, 1024, 4096, 4096]
    - [3, 11189.9]
  - - [33712, 4864, 1, 1024, 33712, 33712, 1024, 1024]
    - [20, 10626.4]
  - - [33712, 7560, 1, 1024, 33712, 33712, 1024, 1024]
    - [5, 11148.5]
  - - [4096, 8296, 1, 1024, 4096, 4096, 1024, 1024]
    - [7, 11444.2]
  - - [33712, 7480, 1, 1024, 33712, 33712, 1024, 1024]
    - [15, 11582.6]
  - - [33712, 5632, 1, 1024, 33712, 33712, 1024, 1024]
    - [45, 11219.3]
  - - [4096, 3040, 1, 1024, 4096, 4096, 1024, 1024]
    - [3, 11534.5]
  - - [1024, 500, 1, 1024, 1024, 1024, 1024, 1024]
    - [26, 6979.34]
  - - [1024, 6688, 1, 4096, 1024, 1024, 4096, 4096]
    - [29, 10608.2]
  - - [4096, 5328, 1, 1024, 4096, 4096, 1024, 1024]
    - [14, 10631.0]
  - - [4096, 2592, 1, 1024, 4096, 4096, 1024, 1024]
    - [29, 10330.3]
  - - [1024, 7200, 1, 4096, 1024, 1024, 4096, 4096]
    - [3, 10327.7]
  - - [1024, 8528, 1, 1024, 1024, 1024, 1024, 1024]
    - [3, 11329.6]
  - - [33712, 5720, 1, 1024, 33712, 33712, 1024, 1024]
    - [45, 11495.6]
  - - [1024, 6960, 1, 4096, 1024, 1024, 4096, 4096]
    - [1, 10279.5]
  - - [4096, 4560, 1, 1024, 4096, 4096, 1024, 1024]
    - [8, 11257.5]
  - - [1024, 8352, 1, 1024, 1024, 1024, 1024, 1024]
    - [43, 10058.9]
  - - [33712, 6600, 1, 1024, 33712, 33712, 1024, 1024]
    - [3, 11927.8]
  - - [1024, 8976, 1, 1024, 1024, 1024, 1024, 1024]
    - [3, 12126.3]
  - - [33712, 8296, 1, 1024, 33712, 33712, 1024, 1024]
    - [5, 11117.1]
  - - [1024, 6936, 1, 1024, 1024, 1024, 1024, 1024]
    - [3, 12107.0]
  - - [33712, 7344, 1, 1024, 33712, 33712, 1024, 1024]
    - [8, 11733.4]
  - - [1024, 7640, 1, 1024, 1024, 1024, 1024, 1024]
    - [3, 12149.8]
  - - [1024, 7640, 1, 4096, 1024, 1024, 4096, 4096]
    - [3, 11035.2]
  - - [1024, 4600, 1, 1024, 1024, 1024, 1024, 1024]
    - [3, 11847.7]
  - - [4096, 4600, 1, 1024, 4096, 4096, 1024, 1024]
    - [45, 11089.4]
  - - [1024, 4600, 1, 4096, 1024, 1024, 4096, 4096]
    - [1, 9908.45]
  - - [33712, 4600, 1, 1024, 33712, 33712, 1024, 1024]
    - [6, 11095.1]
  - - [33712, 8840, 1, 1024, 33712, 33712, 1024, 1024]
    - [3, 10518.3]
  - - [4096, 4216, 1, 1024, 4096, 4096, 1024, 1024]
    - [3, 11622.0]
  - - [33712, 9000, 1, 1024, 33712, 33712, 1024, 1024]
    - [14, 10491.3]
  - - [33712, 9464, 1, 1024, 33712, 33712, 1024, 1024]
    - [3, 10418.7]
  - - [1024, 8424, 1, 1024, 1024, 1024, 1024, 1024]
    - [3, 12312.1]
  - - [1024, 8424, 1, 4096, 1024, 1024, 4096, 4096]
    - [43, 10738.4]
  - - [4096, 6440, 1, 1024, 4096, 4096, 1024, 1024]
    - [15, 11274.2]
  - - [1024, 6440, 1, 4096, 1024, 1024, 4096, 4096]
    - [14, 10713.3]
  - - [4096, 8064, 1, 1024, 4096, 4096, 1024, 1024]
    - [32, 11264.9]
  - - [1024, 7480, 1, 4096, 1024, 1024, 4096, 4096]
    - [3, 10606.8]
  - - [4096, 4080, 1, 1024, 4096, 4096, 1024, 1024]
    - [1, 11222.9]
  - - [1024, 6656, 1, 1024, 1024, 1024, 1024, 1024]
    - [3, 11217.9]
  - - [1024, 4080, 1, 4096, 1024, 1024, 4096, 4096]
    - [7, 9476.31]
  - - [1024, 6080, 1, 4096, 1024, 1024, 4096, 4096]
    - [7, 10274.5]
  - - [4096, 4760, 1, 1024, 4096, 4096, 1024, 1024]
    - [7, 10630.0]
  - - [1024, 5360, 1, 1024, 1024, 1024, 1024, 1024]
    - [31, 10268.1]
  - - [4096, 8840, 1, 1024, 4096, 4096, 1024, 1024]
    - [3, 11756.3]
  - - [4096, 5360, 1, 1024, 4096, 4096, 1024, 1024]
    - [45, 11322.2]
  - - [1024, 5360, 1, 4096, 1024, 1024, 4096, 4096]
    - [14, 9768.06]
  - - [4096, 9632, 1, 1024, 4096, 4096, 1024, 1024]
    - [45, 11669.9]
  - - [4096, 508, 1, 1024, 4096, 4096, 1024, 1024]
    - [4, 11001.1]
  - - [1024, 476, 1, 1024, 1024, 1024, 1024, 1024]
    - [27, 7759.98]
  - - [33712, 476, 1, 1024, 33712, 33712, 1024, 1024]
    - [7, 10313.8]
  - - [4096, 452, 1, 1024, 4096, 4096, 1024, 1024]
    - [3, 8545.89]
  - - [4096, 420, 1, 1024, 4096, 4096, 1024, 1024]
    - [4, 10142.8]
  - - [4096, 316, 1, 1024, 4096, 4096, 1024, 1024]
    - [8, 9297.14]
  - - [33712, 352, 1, 1024, 33712, 33712, 1024, 1024]
    - [10, 9952.32]
  - - [1024, 284, 1, 1024, 1024, 1024, 1024, 1024]
    - [40, 4950.06]
  - - [33712, 460, 1, 1024, 33712, 33712, 1024, 1024]
    - [20, 10278.4]
  - - [1024, 7568, 1, 4096, 1024, 1024, 4096, 4096]
    - [3, 10194.8]
  - - [33712, 8960, 1, 1024, 33712, 33712, 1024, 1024]
    - [5, 10770.0]
  - - [1024, 9344, 1, 4096, 1024, 1024, 4096, 4096]
    - [3, 11129.9]
  - - [1024, 9672, 1, 1024, 1024, 1024, 1024, 1024]
    - [14, 11231.7]
  - - [1024, 504, 1, 1024, 1024, 1024, 1024, 1024]
    - [27, 7050.19]
  - - [33712, 504, 1, 1024, 33712, 33712, 1024, 1024]
    - [7, 11024.0]
  - - [4096, 10080, 1, 1024, 4096, 4096, 1024, 1024]
    - [3, 11404.7]
  - - [4096, 7896, 1, 1024, 4096, 4096, 1024, 1024]
    - [4, 11742.7]
  - - [33712, 500, 1, 1024, 33712, 33712, 1024, 1024]
    - [1, 11007.4]
  - - [1024, 496, 1, 1024, 1024, 1024, 1024, 1024]
    - [27, 6938.28]
  - - [4096, 496, 1, 1024, 4096, 4096, 1024, 1024]
    - [4, 10036.5]
  - - [1024, 424, 1, 1024, 1024, 1024, 1024, 1024]
    - [26, 7016.99]
  - - [4096, 424, 1, 1024, 4096, 4096, 1024, 1024]
    - [3, 10155.2]
  - - [33712, 424, 1, 1024, 33712, 33712, 1024, 1024]
    - [8, 11538.9]
  - - [1024, 376, 1, 1024, 1024, 1024, 1024, 1024]
    - [57, 6270.11]
  - - [1024, 8648, 1, 1024, 1024, 1024, 1024, 1024]
    - [1, 11096.5]
  - - [4096, 376, 1, 1024, 4096, 4096, 1024, 1024]
    - [4, 9518.67]
  - - [33712, 376, 1, 1024, 33712, 33712, 1024, 1024]
    - [11, 10623.2]
  - - [1024, 484, 1, 4096, 1024, 1024, 4096, 4096]
    - [3, 6774.02]
  - - [1024, 428, 1, 4096, 1024, 1024, 4096, 4096]
    - [56, 7393.57]
  - - [1024, 288, 1, 4096, 1024, 1024, 4096, 4096]
    - [57, 5290.63]
  - - [1024, 304, 1, 4096, 1024, 1024, 4096, 4096]
    - [56, 5565.06]
  - - [33712, 104, 1, 1024, 33712, 33712, 1024, 1024]
    - [3, 9715.8]
  - - [4096, 104, 1, 1024, 4096, 4096, 1024, 1024]
    - [54, 6112.77]
  - - [1024, 308, 1, 4096, 1024, 1024, 4096, 4096]
    - [57, 5632.38]
  - - [1024, 404, 1, 4096, 1024, 1024, 4096, 4096]
    - [56, 7158.23]
  - - [4096, 188, 1, 1024, 4096, 4096, 1024, 1024]
    - [41, 8460.61]
  - - [4096, 148, 1, 1024, 4096, 4096, 1024, 1024]
    - [57, 7782.81]
  - - [33712, 176, 1, 1024, 33712, 33712, 1024, 1024]
    - [4, 11189.9]
  - - [1024, 384, 1, 4096, 1024, 1024, 4096, 4096]
    - [56, 6833.88]
  - - [4096, 96, 1, 1024, 4096, 4096, 1024, 1024]
    - [56, 6395.38]
  - - [4096, 168, 1, 1024, 4096, 4096, 1024, 1024]
    - [41, 7606.25]
  - - [1024, 372, 1, 4096, 1024, 1024, 4096, 4096]
    - [56, 6613.59]
  - - [1024, 464, 1, 4096, 1024, 1024, 4096, 4096]
    - [56, 7926.66]
  - - [33712, 156, 1, 1024, 33712, 33712, 1024, 1024]
    - [4, 9922.75]
  - - [1024, 340, 1, 4096, 1024, 1024, 4096, 4096]
    - [27, 6153.18]
  - - [1024, 436, 1, 4096, 1024, 1024, 4096, 4096]
    - [27, 7624.72]
  - - [1024, 416, 1, 4096, 1024, 1024, 4096, 4096]
    - [57, 7383.32]
  - - [1024, 440, 1, 4096, 1024, 1024, 4096, 4096]
    - [3, 7583.37]
  - - [1024, 272, 1, 4096, 1024, 1024, 4096, 4096]
    - [40, 5000.21]
  - - [1024, 356, 1, 4096, 1024, 1024, 4096, 4096]
    - [56, 6365.83]
  - - [4096, 132, 1, 1024, 4096, 4096, 1024, 1024]
    - [57, 6997.57]
  - - [1024, 360, 1, 4096, 1024, 1024, 4096, 4096]
    - [56, 6430.78]
  - - [33712, 112, 1, 1024, 33712, 33712, 1024, 1024]
    - [3, 10427.1]
  - - [33712, 200, 1, 1024, 33712, 33712, 1024, 1024]
    - [4, 9627.67]
  - - [4096, 200, 1, 1024, 4096, 4096, 1024, 1024]
    - [27, 8730.86]
  - - [1024, 296, 1, 4096, 1024, 1024, 4096, 4096]
    - [57, 5433.79]
  - - [1024, 328, 1, 4096, 1024, 1024, 4096, 4096]
    - [56, 5968.97]
  - - [1024, 380, 1, 4096, 1024, 1024, 4096, 4096]
    - [56, 6710.31]
  - - [1024, 432, 1, 4096, 1024, 1024, 4096, 4096]
    - [56, 7462.67]
  - - [4096, 80, 1, 1024, 4096, 4096, 1024, 1024]
    - [56, 5315.97]
  - - [1024, 448, 1, 4096, 1024, 1024, 4096, 4096]
    - [4, 7668.32]
  - - [33712, 88, 1, 1024, 33712, 33712, 1024, 1024]
    - [23, 9689.5]
  - - [33712, 140, 1, 1024, 33712, 33712, 1024, 1024]
    - [39, 9558.83]
  - - [33712, 172, 1, 1024, 33712, 33712, 1024, 1024]
    - [4, 10927.6]
  - - [4096, 172, 1, 1024, 4096, 4096, 1024, 1024]
    - [27, 7821.12]
  - - [1024, 392, 1, 4096, 1024, 1024, 4096, 4096]
    - [56, 6943.26]
  - - [1024, 456, 1, 4096, 1024, 1024, 4096, 4096]
    - [56, 7805.25]
  - - [1024, 468, 1, 4096, 1024, 1024, 4096, 4096]
    - [27, 7963.85]
  - - [33712, 40, 1, 1024, 33712, 33712, 1024, 1024]
    - [37, 7237.11]
  - - [4096, 68, 1, 1024, 4096, 4096, 1024, 1024]
    - [56, 4553.2]
  - - [33712, 124, 1, 1024, 33712, 33712, 1024, 1024]
    - [3, 11534.3]
  - - [4096, 124, 1, 1024, 4096, 4096, 1024, 1024]
    - [27, 6916.14]
  - - [4096, 184, 1, 1024, 4096, 4096, 1024, 1024]
    - [41, 8359.53]
  - - [1024, 412, 1, 4096, 1024, 1024, 4096, 4096]
    - [56, 7233.97]
  - - [33712, 52, 1, 1024, 33712, 33712, 1024, 1024]
    - [4, 8426.08]
  - - [4096, 76, 1, 1024, 4096, 4096, 1024, 1024]
    - [57, 5050.18]
  - - [33712, 92, 1, 1024, 33712, 33712, 1024, 1024]
    - [23, 10099.0]
  - - [4096, 92, 1, 1024, 4096, 4096, 1024, 1024]
    - [56, 6090.21]
  - - [1024, 348, 1, 4096, 1024, 1024, 4096, 4096]
    - [56, 6311.03]
  - - [33712, 136, 1, 1024, 33712, 33712, 1024, 1024]
    - [38, 9212.82]
  - - [1024, 408, 1, 4096, 1024, 1024, 4096, 4096]
    - [57, 7219.34]
  - - [33712, 16, 1, 1024, 33712, 33712, 1024, 1024]
    - [54, 4706.35]
  - - [33712, 24, 1, 1024, 33712, 33712, 1024, 1024]
    - [26, 5844.43]
  - - [33712, 100, 1, 1024, 33712, 33712, 1024, 1024]
    - [3, 9334.03]
  - - [4096, 100, 1, 1024, 4096, 4096, 1024, 1024]
    - [41, 5589.42]
  - - [33712, 120, 1, 1024, 33712, 33712, 1024, 1024]
    - [3, 11191.2]
  - - [4096, 120, 1, 1024, 4096, 4096, 1024, 1024]
    - [27, 6678.83]
  - - [33712, 152, 1, 1024, 33712, 33712, 1024, 1024]
    - [4, 9662.62]
  - - [4096, 152, 1, 1024, 4096, 4096, 1024, 1024]
    - [57, 7874.68]
  - - [1024, 280, 1, 4096, 1024, 1024, 4096, 4096]
    - [57, 5147.28]
  - - [33712, 44, 1, 1024, 33712, 33712, 1024, 1024]
    - [37, 7674.43]
  - - [1024, 276, 1, 4096, 1024, 1024, 4096, 4096]
    - [57, 5066.64]
  - - [4096, 164, 1, 1024, 4096, 4096, 1024, 1024]
    - [27, 7438.0]
  - - [1024, 376, 1, 4096, 1024, 1024, 4096, 4096]
    - [56, 6657.61]
  - - [33712, 184, 1, 1024, 33712, 33712, 1024, 1024]
    - [4, 11674.5]
  - - [33712, 12, 1, 1024, 33712, 33712, 1024, 1024]
    - [54, 3501.12]
  - - [4096, 176, 1, 1024, 4096, 4096, 1024, 1024]
    - [40, 7934.2]
  - - [4096, 136, 1, 1024, 4096, 4096, 1024, 1024]
    - [57, 7173.36]
  - - [1024, 472, 1, 4096, 1024, 1024, 4096, 4096]
    - [56, 8011.12]
  - - [1024, 344, 1, 4096, 1024, 1024, 4096, 4096]
    - [27, 6191.37]
  - - [1024, 260, 1, 4096, 1024, 1024, 4096, 4096]
    - [57, 4782.97]
  - - [4096, 84, 1, 1024, 4096, 4096, 1024, 1024]
    - [57, 5546.62]
  - - [1024, 396, 1, 4096, 1024, 1024, 4096, 4096]
    - [57, 7007.01]
  - - [33712, 204, 1, 1024, 33712, 33712, 1024, 1024]
    - [3, 9765.76]
  - - [33712, 108, 1, 1024, 33712, 33712, 1024, 1024]
    - [3, 9407.22]
  - - [1024, 368, 1, 4096, 1024, 1024, 4096, 4096]
    - [56, 6575.92]
  - - [4096, 144, 1, 1024, 4096, 4096, 1024, 1024]
    - [57, 7557.3]
  - - [33712, 168, 1, 1024, 33712, 33712, 1024, 1024]
    - [4, 10670.3]
  - - [1024, 312, 1, 4096, 1024, 1024, 4096, 4096]
    - [57, 5677.8]
  - - [33712, 96, 1, 1024, 33712, 33712, 1024, 1024]
    - [22, 10111.1]
  - - [1024, 316, 1, 4096, 1024, 1024, 4096, 4096]
    - [56, 5736.66]
  - - [33712, 80, 1, 1024, 33712, 33712, 1024, 1024]
    - [22, 8326.33]
  - - [1024, 500, 1, 4096, 1024, 1024, 4096, 4096]
    - [41, 7113.8]
  - - [4096, 108, 1, 1024, 4096, 4096, 1024, 1024]
    - [54, 6561.19]
  - - [1024, 324, 1, 4096, 1024, 1024, 4096, 4096]
    - [57, 5888.01]
  - - [33712, 148, 1, 1024, 33712, 33712, 1024, 1024]
    - [36, 8830.73]
  - - [4096, 88, 1, 1024, 4096, 4096, 1024, 1024]
    - [57, 5847.57]
  - - [4096, 116, 1, 1024, 4096, 4096, 1024, 1024]
    - [27, 6428.9]
  - - [1024, 400, 1, 4096, 1024, 1024, 4096, 4096]
    - [56, 7063.48]
  - - [33712, 28, 1, 1024, 33712, 33712, 1024, 1024]
    - [26, 6746.16]
  - - [1024, 320, 1, 4096, 1024, 1024, 4096, 4096]
    - [56, 5817.33]
  - - [33712, 56, 1, 1024, 33712, 33712, 1024, 1024]
    - [4, 9057.24]
  - - [4096, 204, 1, 1024, 4096, 4096, 1024, 1024]
    - [27, 8846.55]
  - - [4096, 112, 1, 1024, 4096, 4096, 1024, 1024]
    - [54, 6851.84]
  - - [1024, 504, 1, 4096, 1024, 1024, 4096, 4096]
    - [41, 7037.04]
  - - [33712, 48, 1, 1024, 33712, 33712, 1024, 1024]
    - [37, 8314.97]
  - - [1024, 332, 1, 4096, 1024, 1024, 4096, 4096]
    - [56, 6022.95]
  - - [1024, 488, 1, 4096, 1024, 1024, 4096, 4096]
    - [56, 6828.19]
  - - [33712, 64, 1, 1024, 33712, 33712, 1024, 1024]
    - [4, 9679.92]
  - - [33712, 132, 1, 1024, 33712, 33712, 1024, 1024]
    - [39, 8320.13]
  - - [1024, 512, 1, 4096, 1024, 1024, 4096, 4096]
    - [41, 7078.98]
  - - [4096, 140, 1, 1024, 4096, 4096, 1024, 1024]
    - [57, 7274.56]
  - - [1024, 268, 1, 4096, 1024, 1024, 4096, 4096]
    - [57, 4906.04]
  - - [1024, 480, 1, 4096, 1024, 1024, 4096, 4096]
    - [56, 7573.21]
  - - [1024, 292, 1, 4096, 1024, 1024, 4096, 4096]
    - [56, 5350.99]
  - - [33712, 84, 1, 1024, 33712, 33712, 1024, 1024]
    - [22, 9209.12]
  - - [33712, 188, 1, 1024, 33712, 33712, 1024, 1024]
    - [46, 10531.5]
  - - [1024, 336, 1, 4096, 1024, 1024, 4096, 4096]
    - [56, 6066.13]
  - - [4096, 160, 1, 1024, 4096, 4096, 1024, 1024]
    - [57, 8160.12]
  - - [33712, 8, 1, 1024, 33712, 33712, 1024, 1024]
    - [53, 2271.12]
  - - [1024, 284, 1, 4096, 1024, 1024, 4096, 4096]
    - [57, 5198.93]
  - - [1024, 364, 1, 4096, 1024, 1024, 4096, 4096]
    - [57, 6488.96]
  - - [4096, 128, 1, 1024, 4096, 4096, 1024, 1024]
    - [27, 7177.42]
  - - [33712, 180, 1, 1024, 33712, 33712, 1024, 1024]
    - [4, 10675.1]
  - - [1024, 508, 1, 4096, 1024, 1024, 4096, 4096]
    - [56, 7134.69]
  - - [1024, 264, 1, 4096, 1024, 1024, 4096, 4096]
    - [27, 4784.37]
  - - [33712, 164, 1, 1024, 33712, 33712, 1024, 1024]
    - [4, 9734.26]
  - - [4096, 192, 1, 1024, 4096, 4096, 1024, 1024]
    - [41, 8677.87]
  - - [1024, 460, 1, 4096, 1024, 1024, 4096, 4096]
    - [56, 7678.19]
  - - [33712, 76, 1, 1024, 33712, 33712, 1024, 1024]
    - [23, 8540.36]
  - - [1024, 352, 1, 4096, 1024, 1024, 4096, 4096]
    - [56, 6357.18]
  - - [4096, 156, 1, 1024, 4096, 4096, 1024, 1024]
    - [57, 8113.98]
  - - [33712, 32, 1, 1024, 33712, 33712, 1024, 1024]
    - [26, 7731.49]
  - - [1024, 444, 1, 4096, 1024, 1024, 4096, 4096]
    - [56, 7577.58]
  - - [33712, 192, 1, 1024, 33712, 33712, 1024, 1024]
    - [3, 11349.4]
  - - [33712, 128, 1, 1024, 33712, 33712, 1024, 1024]
    - [3, 10351.1]
  - - [33712, 68, 1, 1024, 33712, 33712, 1024, 1024]
    - [22, 7200.7]
  - - [1024, 492, 1, 4096, 1024, 1024, 4096, 4096]
    - [41, 6482.76]
  - - [1024, 476, 1, 4096, 1024, 1024, 4096, 4096]
    - [56, 7567.03]
  - - [1024, 452, 1, 4096, 1024, 1024, 4096, 4096]
    - [56, 7262.57]
  - - [1024, 420, 1, 4096, 1024, 1024, 4096, 4096]
    - [3, 7156.34]
  - - [1024, 388, 1, 4096, 1024, 1024, 4096, 4096]
    - [27, 6774.0]
  - - [4096, 180, 1, 1024, 4096, 4096, 1024, 1024]
    - [41, 8128.5]
  - - [33712, 160, 1, 1024, 33712, 33712, 1024, 1024]
    - [4, 9494.22]
  - - [33712, 144, 1, 1024, 33712, 33712, 1024, 1024]
    - [39, 9152.72]
  - - [33712, 116, 1, 1024, 33712, 33712, 1024, 1024]
    - [32, 9618.65]
  - - [4096, 72, 1, 1024, 4096, 4096, 1024, 1024]
    - [56, 4796.54]
  - - [33712, 72, 1, 1024, 33712, 33712, 1024, 1024]
    - [22, 7609.33]
  - - [33712, 60, 1, 1024, 33712, 33712, 1024, 1024]
    - [41, 8449.99]
  - - [33712, 36, 1, 1024, 33712, 33712, 1024, 1024]
    - [37, 5956.46]
  - - [33712, 20, 1, 1024, 33712, 33712, 1024, 1024]
    - [56, 4682.73]
  - - [1024, 496, 1, 4096, 1024, 1024, 4096, 4096]
    - [3, 6809.28]
  - - [1024, 424, 1, 4096, 1024, 1024, 4096, 4096]
    - [56, 7310.02]
  - - [1024, 252, 1, 1024, 1024, 1024, 1024, 1024]
    - [26, 4328.98]
  - - [1024, 244, 1, 1024, 1024, 1024, 1024, 1024]
    - [26, 4235.97]
  - - [1024, 212, 1, 1024, 1024, 1024, 1024, 1024]
    - [56, 4301.43]
  - - [1024, 236, 1, 1024, 1024, 1024, 1024, 1024]
    - [54, 4575.89]
  - - [1024, 208, 1, 1024, 1024, 1024, 1024, 1024]
    - [57, 4253.19]
  - - [1024, 248, 1, 1024, 1024, 1024, 1024, 1024]
    - [26, 4351.52]
  - - [1024, 256, 1, 1024, 1024, 1024, 1024, 1024]
    - [40, 4485.89]
  - - [1024, 240, 1, 1024, 1024, 1024, 1024, 1024]
    - [54, 4667.25]
  - - [1024, 216, 1, 1024, 1024, 1024, 1024, 1024]
    - [56, 4396.2]
  - - [1024, 228, 1, 1024, 1024, 1024, 1024, 1024]
    - [54, 4394.77]
  - - [1024, 224, 1, 1024, 1024, 1024, 1024, 1024]
    - [57, 4609.13]
  - - [1024, 232, 1, 1024, 1024, 1024, 1024, 1024]
    - [54, 4511.68]
  - - [1024, 248, 1, 4096, 1024, 1024, 4096, 4096]
    - [40, 4533.58]
  - - [1024, 256, 1, 4096, 1024, 1024, 4096, 4096]
    - [26, 4719.32]
  - - [1024, 104, 1, 4096, 1024, 1024, 4096, 4096]
    - [57, 2412.65]
  - - [1024, 104, 1, 1024, 1024, 1024, 1024, 1024]
    - [55, 2163.73]
  - - [1024, 188, 1, 1024, 1024, 1024, 1024, 1024]
    - [55, 3832.28]
  - - [1024, 252, 1, 4096, 1024, 1024, 4096, 4096]
    - [57, 4645.58]
  - - [1024, 148, 1, 4096, 1024, 1024, 4096, 4096]
    - [56, 3412.25]
  - - [1024, 148, 1, 1024, 1024, 1024, 1024, 1024]
    - [3, 3059.72]
  - - [1024, 176, 1, 4096, 1024, 1024, 4096, 4096]
    - [56, 4066.76]
  - - [1024, 96, 1, 1024, 1024, 1024, 1024, 1024]
    - [26, 2010.05]
  - - [1024, 136, 1, 4096, 1024, 1024, 4096, 4096]
    - [57, 3164.81]
  - - [1024, 136, 1, 1024, 1024, 1024, 1024, 1024]
    - [3, 2861.28]
  - - [1024, 168, 1, 4096, 1024, 1024, 4096, 4096]
    - [57, 3893.92]
  - - [1024, 168, 1, 1024, 1024, 1024, 1024, 1024]
    - [3, 3500.81]
  - - [1024, 156, 1, 4096, 1024, 1024, 4096, 4096]
    - [56, 3604.62]
  - - [1024, 156, 1, 1024, 1024, 1024, 1024, 1024]
    - [3, 3225.12]
  - - [1024, 204, 1, 4096, 1024, 1024, 4096, 4096]
    - [57, 4730.42]
  - - [1024, 204, 1, 1024, 1024, 1024, 1024, 1024]
    - [57, 4158.43]
  - - [1024, 244, 1, 4096, 1024, 1024, 4096, 4096]
    - [57, 4507.61]
  - - [1024, 188, 1, 4096, 1024, 1024, 4096, 4096]
    - [56, 4340.21]
  - - [1024, 112, 1, 4096, 1024, 1024, 4096, 4096]
    - [58, 2555.28]
  - - [1024, 112, 1, 1024, 1024, 1024, 1024, 1024]
    - [55, 2319.13]
  - - [1024, 128, 1, 4096, 1024, 1024, 4096, 4096]
    - [57, 2957.64]
  - - [1024, 128, 1, 1024, 1024, 1024, 1024, 1024]
    - [55, 2663.05]
  - - [1024, 200, 1, 4096, 1024, 1024, 4096, 4096]
    - [57, 4629.47]
  - - [1024, 200, 1, 1024, 1024, 1024, 1024, 1024]
    - [57, 4083.24]
  - - [1024, 184, 1, 4096, 1024, 1024, 4096, 4096]
    - [57, 4262.88]
  - - [1024, 184, 1, 1024, 1024, 1024, 1024, 1024]
    - [3, 3744.91]
  - - [1024, 56, 1, 4096, 1024, 1024, 4096, 4096]
    - [42, 1341.26]
  - - [4096, 56, 1, 1024, 4096, 4096, 1024, 1024]
    - [26, 3842.95]
  - - [1024, 56, 1, 1024, 1024, 1024, 1024, 1024]
    - [40, 1185.79]
  - - [1024, 88, 1, 1024, 1024, 1024, 1024, 1024]
    - [26, 1851.42]
  - - [1024, 140, 1, 4096, 1024, 1024, 4096, 4096]
    - [56, 3243.5]
  - - [1024, 172, 1, 4096, 1024, 1024, 4096, 4096]
    - [57, 3986.63]
  - - [1024, 172, 1, 1024, 1024, 1024, 1024, 1024]
    - [3, 3533.6]
  - - [1024, 28, 1, 4096, 1024, 1024, 4096, 4096]
    - [40, 685.344]
  - - [4096, 28, 1, 1024, 4096, 4096, 1024, 1024]
    - [57, 2279.51]
  - - [1024, 28, 1, 1024, 1024, 1024, 1024, 1024]
    - [40, 601.642]
  - - [1024, 40, 1, 4096, 1024, 1024, 4096, 4096]
    - [40, 964.208]
  - - [4096, 40, 1, 1024, 4096, 4096, 1024, 1024]
    - [53, 3004.52]
  - - [1024, 68, 1, 4096, 1024, 1024, 4096, 4096]
    - [26, 1649.01]
  - - [1024, 68, 1, 1024, 1024, 1024, 1024, 1024]
    - [3, 1437.56]
  - - [1024, 124, 1, 4096, 1024, 1024, 4096, 4096]
    - [58, 2824.14]
  - - [1024, 124, 1, 1024, 1024, 1024, 1024, 1024]
    - [55, 2555.49]
  - - [1024, 236, 1, 4096, 1024, 1024, 4096, 4096]
    - [54, 5168.42]
  - - [1024, 44, 1, 4096, 1024, 1024, 4096, 4096]
    - [42, 1057.71]
  - - [4096, 44, 1, 1024, 4096, 4096, 1024, 1024]
    - [54, 3348.14]
  - - [1024, 44, 1, 1024, 1024, 1024, 1024, 1024]
    - [26, 930.188]
  - - [1024, 52, 1, 4096, 1024, 1024, 4096, 4096]
    - [42, 1244.88]
  - - [4096, 52, 1, 1024, 4096, 4096, 1024, 1024]
    - [26, 3559.14]
  - - [1024, 76, 1, 4096, 1024, 1024, 4096, 4096]
    - [28, 1822.78]
  - - [1024, 192, 1, 1024, 1024, 1024, 1024, 1024]
    - [55, 3944.49]
  - - [1024, 240, 1, 4096, 1024, 1024, 4096, 4096]
    - [54, 5271.43]
  - - [4096, 8, 1, 1024, 4096, 4096, 1024, 1024]
    - [57, 650.28]
  - - [4096, 16, 1, 1024, 4096, 4096, 1024, 1024]
    - [57, 1316.89]
  - - [1024, 24, 1, 4096, 1024, 1024, 4096, 4096]
    - [40, 588.537]
  - - [1024, 32, 1, 4096, 1024, 1024, 4096, 4096]
    - [40, 785.45]
  - - [1024, 64, 1, 4096, 1024, 1024, 4096, 4096]
    - [42, 1534.97]
  - - [1024, 100, 1, 4096, 1024, 1024, 4096, 4096]
    - [57, 2344.75]
  - - [1024, 208, 1, 4096, 1024, 1024, 4096, 4096]
    - [57, 4812.53]
  - - [1024, 108, 1, 1024, 1024, 1024, 1024, 1024]
    - [3, 2243.39]
  - - [4096, 20, 1, 1024, 4096, 4096, 1024, 1024]
    - [57, 1618.17]
  - - [1024, 52, 1, 1024, 1024, 1024, 1024, 1024]
    - [40, 1094.02]
  - - [33712, 4, 1, 1024, 33712, 33712, 1024, 1024]
    - [53, 1169.41]
  - - [1024, 152, 1, 1024, 1024, 1024, 1024, 1024]
    - [3, 3162.37]
  - - [1024, 132, 1, 4096, 1024, 1024, 4096, 4096]
    - [3, 3128.66]
  - - [1024, 24, 1, 1024, 1024, 1024, 1024, 1024]
    - [40, 515.693]
  - - [1024, 48, 1, 4096, 1024, 1024, 4096, 4096]
    - [42, 1148.6]
  - - [1024, 180, 1, 1024, 1024, 1024, 1024, 1024]
    - [26, 3768.84]
  - - [1024, 84, 1, 4096, 1024, 1024, 4096, 4096]
    - [28, 1996.38]
  - - [1024, 160, 1, 4096, 1024, 1024, 4096, 4096]
    - [57, 3733.25]
  - - [4096, 12, 1, 1024, 4096, 4096, 1024, 1024]
    - [57, 970.904]
  - - [4096, 24, 1, 1024, 4096, 4096, 1024, 1024]
    - [57, 1897.88]
  - - [1024, 216, 1, 4096, 1024, 1024, 4096, 4096]
    - [57, 4984.43]
  - - [1024, 120, 1, 1024, 1024, 1024, 1024, 1024]
    - [55, 2473.06]
  - - [1024, 80, 1, 1024, 1024, 1024, 1024, 1024]
    - [26, 1691.25]
  - - [1024, 72, 1, 4096, 1024, 1024, 4096, 4096]
    - [28, 1726.84]
  - - [1024, 176, 1, 1024, 1024, 1024, 1024, 1024]
    - [26, 3673.36]
  - - [1024, 96, 1, 4096, 1024, 1024, 4096, 4096]
    - [28, 2287.8]
  - - [1024, 32, 1, 1024, 1024, 1024, 1024, 1024]
    - [40, 687.591]
  - - [1024, 48, 1, 1024, 1024, 1024, 1024, 1024]
    - [40, 1023.0]
  - - [1024, 92, 1, 4096, 1024, 1024, 4096, 4096]
    - [28, 2191.48]
  - - [1024, 76, 1, 1024, 1024, 1024, 1024, 1024]
    - [26, 1609.28]
  - - [1024, 100, 1, 1024, 1024, 1024, 1024, 1024]
    - [3, 2070.65]
  - - [1024, 140, 1, 1024, 1024, 1024, 1024, 1024]
    - [3, 2936.01]
  - - [1024, 152, 1, 4096, 1024, 1024, 4096, 4096]
    - [57, 3526.18]
  - - [1024, 64, 1, 1024, 1024, 1024, 1024, 1024]
    - [40, 1366.22]
  - - [4096, 36, 1, 1024, 4096, 4096, 1024, 1024]
    - [53, 2731.46]
  - - [1024, 40, 1, 1024, 1024, 1024, 1024, 1024]
    - [26, 846.992]
  - - [1024, 228, 1, 4096, 1024, 1024, 4096, 4096]
    - [53, 4915.2]
  - - [1024, 60, 1, 1024, 1024, 1024, 1024, 1024]
    - [26, 1264.36]
  - - [1024, 88, 1, 4096, 1024, 1024, 4096, 4096]
    - [28, 2100.97]
  - - [1024, 192, 1, 4096, 1024, 1024, 4096, 4096]
    - [57, 4469.95]
  - - [1024, 120, 1, 4096, 1024, 1024, 4096, 4096]
    - [57, 2766.69]
  - - [1024, 116, 1, 1024, 1024, 1024, 1024, 1024]
    - [55, 2394.39]
  - - [1024, 224, 1, 4096, 1024, 1024, 4096, 4096]
    - [57, 5224.22]
  - - [1024, 36, 1, 1024, 1024, 1024, 1024, 1024]
    - [26, 764.764]
  - - [1024, 232, 1, 4096, 1024, 1024, 4096, 4096]
    - [54, 5097.85]
  - - [1024, 164, 1, 1024, 1024, 1024, 1024, 1024]
    - [3, 3379.84]
  - - [4096, 64, 1, 1024, 4096, 4096, 1024, 1024]
    - [40, 4415.06]
  - - [1024, 132, 1, 1024, 1024, 1024, 1024, 1024]
    - [3, 2768.24]
  - - [4096, 60, 1, 1024, 4096, 4096, 1024, 1024]
    - [40, 4112.06]
  - - [1024, 144, 1, 4096, 1024, 1024, 4096, 4096]
    - [57, 3358.43]
  - - [1024, 72, 1, 1024, 1024, 1024, 1024, 1024]
    - [26, 1519.68]
  - - [1024, 160, 1, 1024, 1024, 1024, 1024, 1024]
    - [55, 3334.1]
  - - [1024, 92, 1, 1024, 1024, 1024, 1024, 1024]
    - [26, 1929.38]
  - - [1024, 212, 1, 4096, 1024, 1024, 4096, 4096]
    - [57, 4933.38]
  - - [4096, 32, 1, 1024, 4096, 4096, 1024, 1024]
    - [57, 2557.5]
  - - [1024, 80, 1, 4096, 1024, 1024, 4096, 4096]
    - [28, 1911.72]
  - - [1024, 84, 1, 1024, 1024, 1024, 1024, 1024]
    - [26, 1761.61]
  - - [1024, 180, 1, 4096, 1024, 1024, 4096, 4096]
    - [56, 4161.02]
  - - [1024, 144, 1, 1024, 1024, 1024, 1024, 1024]
    - [3, 3019.9]
  - - [1024, 116, 1, 4096, 1024, 1024, 4096, 4096]
    - [58, 2635.07]
  - - [1024, 108, 1, 4096, 1024, 1024, 4096, 4096]
    - [56, 2495.51]
  - - [1024, 164, 1, 4096, 1024, 1024, 4096, 4096]
    - [57, 3816.39]
  - - [1024, 60, 1, 4096, 1024, 1024, 4096, 4096]
    - [28, 1433.79]
  - - [4096, 48, 1, 1024, 4096, 4096, 1024, 1024]
    - [53, 3679.21]
  - - [1024, 36, 1, 4096, 1024, 1024, 4096, 4096]
    - [40, 876.247]
  - - [1024, 20, 1, 1024, 1024, 1024, 1024, 1024]
    - [40, 429.744]
  - - [1024, 20, 1, 4096, 1024, 1024, 4096, 4096]
    - [40, 490.447]
  - - [1024, 8, 1, 4096, 1024, 1024, 4096, 4096]
    - [61, 248.92]
  - - [1024, 8, 1, 1024, 1024, 1024, 1024, 1024]
    - [62, 222.628]
  - - [1024, 16, 1, 4096, 1024, 1024, 4096, 4096]
    - [62, 505.034]
  - - [1024, 16, 1, 1024, 1024, 1024, 1024, 1024]
    - [62, 443.373]
  - - [1024, 12, 1, 1024, 1024, 1024, 1024, 1024]
    - [62, 333.234]
  - - [1024, 4, 1, 1024, 1024, 1024, 1024, 1024]
    - [61, 111.078]
  - - [1024, 12, 1, 4096, 1024, 1024, 4096, 4096]
    - [63, 378.775]
  - - [4096, 4, 1, 1024, 4096, 4096, 1024, 1024]
    - [64, 410.402]
  - - [1024, 4, 1, 4096, 1024, 1024, 4096, 4096]
    - [62, 126.563]
- null
