src/Tensile/data/Configs/miopen/archives/bert/2020-11-08/exact/arcturus_Cijk_Alik_Bljk_SB.yaml
- {MinimumRequiredVersion: 4.24.0}
- arcturus
- gfx908
- [Device 7380, Device 7388, Device 738c, Device 7390]
    SolutionIndex: 0
    SolutionNameMin: Cijk_Alik_Bljk_SB_MT64x64x32_MI32x32x2x1_SE_1LDSB1_EPS1_GRVW4_GSU1_LPA4_LPB4_PGR1_PLR17_SU0_SUS256_SRVW2_TT1_32_WG64_4_1_WGM1
    SolutionIndex: 1
    SolutionNameMin: Cijk_Alik_Bljk_SB_MT64x128x32_MI32x32x2x1_SE_1LDSB1_EPS1_GRVW4_GSU1_LPA4_LPB4_PGR1_PLR17_SU0_SUS256_SRVW2_TT1_64_WG64_4_1_WGM1
    SolutionIndex: 2
    SolutionNameMin: Cijk_Alik_Bljk_SB_MT128x160x16_MI32x32x2x1_SE_1LDSB1_EPS1_GRVW1_GSU1_LPA2_LPB2_PGR1_PLR9_SU32_SUS128_SRVW2_TT1_160_WG128_2_1_WGM1
    SolutionIndex: 3
    SolutionNameMin: Cijk_Alik_Bljk_SB_MT128x96x32_MI32x32x2x1_SE_1LDSB1_EPS1_GRVW1_GSU1_LPA2_LPB2_PGR1_PLR17_SU32_SUS128_SRVW2_TT1_96_WG128_2_1_WGM1
    SolutionIndex: 4
    SolutionNameMin: Cijk_Alik_Bljk_SB_MT64x128x32_MI32x32x2x1_SE_1LDSB1_EPS1_GRVW4_GSU1_LPA4_LPB4_PGR1_PLR17_SU32_SUS256_SRVW2_TT1_64_WG64_4_1_WGM1
    SolutionIndex: 5
    SolutionNameMin: Cijk_Alik_Bljk_SB_MT128x96x32_MI32x32x2x1_SE_1LDSB1_EPS1_GRVW1_GSU1_LPA2_LPB2_PGR1_PLR17_SU0_SUS256_SRVW2_TT1_96_WG128_2_1_WGM2
    SolutionIndex: 6
    SolutionNameMin: Cijk_Alik_Bljk_SB_MT64x128x32_MI32x32x2x1_SE_1LDSB1_EPS1_GRVW4_GSU1_LPA4_LPB4_PGR1_PLR17_SU0_SUS256_SRVW2_TT1_64_WG64_4_1_WGM2
    SolutionIndex: 7
    SolutionNameMin: Cijk_Alik_Bljk_SB_MT64x128x32_MI32x32x2x1_SE_1LDSB1_EPS1_GRVW1_GSU1_LPA2_LPB2_PGR1_PLR17_SU32_SUS128_SRVW2_TT1_64_WG64_4_1_WGM2
    SolutionIndex: 8
    SolutionNameMin: Cijk_Alik_Bljk_SB_MT64x128x32_MI32x32x2x1_SE_1LDSB1_EPS1_GRVW4_GSU1_LPA4_LPB4_PGR1_PLR17_SU32_SUS128_SRVW2_TT1_64_WG64_4_1_WGM2
    SolutionIndex: 9
    SolutionNameMin: Cijk_Alik_Bljk_SB_MT128x144x16_MI16x16x4x1_SE_1LDSB1_EPS1_GRVW1_GSU1_LPA2_LPB2_PGR1_PLR5_SU0_SUS256_SRVW2_TT2_144_WG64_4_1_WGM15
    SolutionIndex: 10
    SolutionNameMin: Cijk_Alik_Bljk_SB_MT64x144x16_MI16x16x4x1_SE_1LDSB1_EPS0_GRVW1_GSU1_LPA2_LPB2_PGR2_PLR5_SU0_SUS256_SRVW2_TT1_144_WG64_4_1_WGM15
    SolutionIndex: 11
    SolutionNameMin: Cijk_Alik_Bljk_SB_MT64x64x32_MI32x32x2x1_SE_1LDSB1_EPS1_GRVW2_GSU1_LPA2_LPB2_PGR1_PLR17_SU0_SUS256_SRVW2_TT1_32_WG64_4_1_WGM15
    SolutionIndex: 12
    SolutionNameMin: Cijk_Alik_Bljk_SB_MT64x128x32_MI32x32x2x1_SE_1LDSB1_EPS1_GRVW4_GSU1_LPA4_LPB4_PGR1_PLR17_SU0_SUS256_SRVW2_TT1_64_WG64_4_1_WGM15
    SolutionIndex: 13
    SolutionNameMin: Cijk_Alik_Bljk_SB_MT128x96x32_MI32x32x2x1_SE_1LDSB1_EPS1_GRVW4_GSU1_LPA4_LPB4_PGR1_PLR17_SU0_SUS256_SRVW2_TT1_96_WG128_2_1_WGM15
    SolutionIndex: 14
    SolutionNameMin: Cijk_Alik_Bljk_SB_MT64x128x32_MI32x32x2x1_SE_1LDSB1_EPS1_GRVW1_GSU1_LPA2_LPB2_PGR1_PLR17_SU32_SUS128_SRVW2_TT1_64_WG64_4_1_WGM15
    SolutionIndex: 15
    SolutionNameMin: Cijk_Alik_Bljk_SB_MT64x64x32_MI32x32x2x1_SE_1LDSB1_EPS1_GRVW4_GSU1_LPA4_LPB4_PGR1_PLR17_SU32_SUS256_SRVW2_TT1_32_WG64_4_1_WGM15
    SolutionIndex: 16
    SolutionNameMin: Cijk_Alik_Bljk_SB_MT16x64x32_MI16x16x4x1_SE_1LDSB0_EPS0_GRVW1_GSU1_LPA2_LPB2_PGR2_PLR9_SU0_SUS256_SRVW0_TT1_16_WG16_16_1_WGM2
    SolutionIndex: 17
    SolutionNameMin: Cijk_Alik_Bljk_SB_MT16x16x32_MI16x16x4x1_SE_1LDSB0_EPS0_GRVW2_GSU1_LPA2_LPB2_PGR2_PLR9_SU0_SUS256_SRVW0_TT1_16_WG16_4_1_WGM2
    SolutionIndex: 18
    SolutionNameMin: Cijk_Alik_Bljk_SB_MT16x16x32_MI16x16x4x1_SE_1LDSB0_EPS0_GRVW2_GSU3_LPA2_LPB2_PGR2_PLR9_SU0_SUS256_SRVW0_TT1_16_WG16_4_1_WGM1
    SolutionIndex: 19
    SolutionNameMin: Cijk_Alik_Bljk_SB_MT16x16x32_MI16x16x4x1_SE_1LDSB0_EPS0_GRVW2_GSU3_LPA2_LPB2_PGR2_PLR9_SU32_SUS128_SRVW0_TT1_16_WG16_4_1_WGM1
    SolutionIndex: 20
    SolutionNameMin: Cijk_Alik_Bljk_SB_MT16x16x32_MI16x16x4x1_SE_1LDSB0_EPS0_GRVW2_GSU3_LPA2_LPB2_PGR2_PLR9_SU32_SUS128_SRVW0_TT1_16_WG16_4_1_WGM2
    SolutionIndex: 21
    SolutionNameMin: Cijk_Alik_Bljk_SB_MT16x16x32_MI16x16x4x1_SE_1LDSB0_EPS0_GRVW1_GSU3_LPA2_LPB2_PGR2_PLR9_SU0_SUS256_SRVW0_TT1_16_WG16_4_1_WGM15
    SolutionIndex: 22
    SolutionNameMin: Cijk_Alik_Bljk_SB_MT16x16x32_MI16x16x4x1_SE_1LDSB0_EPS0_GRVW1_GSU5_LPA2_LPB2_PGR2_PLR9_SU0_SUS256_SRVW0_TT1_16_WG16_4_1_WGM1
    SolutionIndex: 23
    SolutionNameMin: Cijk_Alik_Bljk_SB_MT16x16x32_MI16x16x4x1_SE_1LDSB0_EPS0_GRVW1_GSU5_LPA2_LPB2_PGR2_PLR9_SU32_SUS256_SRVW0_TT1_16_WG16_4_1_WGM15
- - - [1024, 2048, 1, 1024, 1024, 1024, 1024, 1024]
    - [9, 81.367]
  - - [1024, 2048, 1, 4096, 1024, 1024, 4096, 4096]
    - [10, 88.803]
  - - [1024, 4608, 1, 1024, 1024, 1024, 1024, 1024]
    - [2, 87.38]
  - - [1024, 4608, 1, 4096, 1024, 1024, 4096, 4096]
    - [6, 93.573]
  - - [3072, 2048, 1, 768, 3072, 3072, 768, 768]
    - [10, 85.886]
  - - [3072, 4608, 1, 768, 3072, 3072, 768, 768]
    - [10, 90.318]
  - - [4096, 2048, 1, 1024, 4096, 4096, 1024, 1024]
    - [13, 88.704]
  - - [4096, 4608, 1, 1024, 4096, 4096, 1024, 1024]
    - [5, 93.609]
  - - [768, 2048, 1, 3072, 768, 768, 3072, 3072]
    - [1, 76.578]
  - - [768, 2048, 1, 768, 768, 768, 768, 768]
    - [12, 69.142]
  - - [768, 4608, 1, 3072, 768, 768, 3072, 3072]
    - [6, 87.257]
  - - [768, 4608, 1, 768, 768, 768, 768, 768]
    - [1, 81.526]
  - - [128, 128, 192, 64, 128, 128, 64, 64]
    - [11, 33.346]
  - - [128, 128, 256, 64, 128, 128, 64, 64]
    - [11, 35.134]
  - - [384, 384, 144, 64, 384, 384, 64, 64]
    - [3, 53.89]
  - - [384, 384, 192, 64, 384, 384, 64, 64]
    - [3, 55.235]
  - - [512, 512, 48, 64, 512, 512, 64, 64]
    - [7, 49.176]
  - - [512, 512, 64, 64, 512, 512, 64, 64]
    - [14, 50.368]
  - - [64, 128, 192, 128, 64, 64, 128, 128]
    - [8, 36.763]
  - - [64, 128, 256, 128, 64, 64, 128, 128]
    - [0, 36.407]
  - - [64, 384, 144, 384, 64, 64, 384, 384]
    - [8, 58.676]
  - - [64, 384, 192, 384, 64, 64, 384, 384]
    - [8, 60.347]
  - - [64, 512, 48, 512, 64, 64, 512, 512]
    - [4, 58.993]
  - - [64, 512, 64, 512, 64, 64, 512, 512]
    - [15, 57.502]
  - - [1024, 12, 1, 1024, 1024, 1024, 1024, 393216]
    - [19, 3.489]
  - - [1024, 16, 1, 1024, 1024, 1024, 1024, 131072]
    - [18, 4.423]
  - - [1024, 4, 1, 1024, 1024, 1024, 1024, 524288]
    - [23, 1.288]
  - - [2, 2048, 1, 1024, 2, 2, 1024, 1024]
    - [20, 1.18]
  - - [2, 2048, 1, 768, 2, 2, 768, 768]
    - [21, 0.973]
  - - [2, 4608, 1, 1024, 2, 2, 1024, 1024]
    - [16, 1.83]
  - - [2, 4608, 1, 768, 2, 2, 768, 768]
    - [17, 1.803]
  - - [768, 12, 1, 768, 768, 768, 768, 294912]
    - [19, 2.246]
  - - [768, 16, 1, 768, 768, 768, 768, 98304]
    - [18, 2.872]
  - - [768, 4, 1, 768, 768, 768, 768, 393216]
    - [22, 0.812]
- null
