test_dir/py38/lib/python3.6/site-packages/Tensile/Configs/miopen/archives/sparsNN/exact/vega20_Cijk_Ailk_Bljk_SB.yaml
- {MinimumRequiredVersion: 4.9.1}
- vega20
- gfx906
- [Device 66a0, Device 66a1, Device 66a7]
    SolutionIndex: 0
    SolutionNameMin: Cijk_Ailk_Bljk_SB_MT128x64x8_EPS1_GSU1_LPB0_PGR1_SNLL1_TT8_4_VW4_WG16_16_1_WGM8
    SolutionIndex: 1
    SolutionNameMin: Cijk_Ailk_Bljk_SB_MT128x128x16_EPS1_GSU1_LPB0_PGR1_SNLL1_TT8_8_VW4_WG16_16_1_WGM1
    SolutionIndex: 2
    SolutionNameMin: Cijk_Ailk_Bljk_SB_MT64x32x16_EPS1_GSU3_LPB0_PGR1_SNLL0_TT4_4_VW4_WG16_8_1_WGM1
    SolutionIndex: 3
    SolutionNameMin: Cijk_Ailk_Bljk_SB_MT128x64x16_EPS1_GSU1_LPB0_PGR1_SNLL1_TT8_4_VW4_WG16_16_1_WGM8
    SolutionIndex: 4
    SolutionNameMin: Cijk_Ailk_Bljk_SB_MT128x128x16_EPS1_GSU1_LPB0_PGR1_SNLL1_TT8_8_VW4_WG16_16_1_WGM8
    SolutionIndex: 5
    SolutionNameMin: Cijk_Ailk_Bljk_SB_MT32x128x16_EPS1_GSU3_LPB2_PGR1_SNLL0_TT4_4_VW2_WG8_32_1_WGM1
    SolutionIndex: 6
    SolutionNameMin: Cijk_Ailk_Bljk_SB_MT128x32x8_EPS1_GSU1_LPB4_PGR1_SNLL1_TT4_4_VW4_WG32_8_1_WGM8
    SolutionIndex: 7
    SolutionNameMin: Cijk_Ailk_Bljk_SB_MT128x64x8_EPS1_GSU1_LPB4_PGR1_SNLL1_TT4_8_VW4_WG32_8_1_WGM8
    SolutionIndex: 8
    SolutionNameMin: Cijk_Ailk_Bljk_SB_MT64x32x16_EPS1_GSU1_LPB4_PGR1_SNLL1_TT4_4_VW4_WG16_8_1_WGM1
    SolutionIndex: 9
    SolutionNameMin: Cijk_Ailk_Bljk_SB_MT64x64x16_EPS1_GSU1_LPB4_PGR1_SNLL1_TT4_4_VW4_WG16_16_1_WGM1
    SolutionIndex: 10
    SolutionNameMin: Cijk_Ailk_Bljk_SB_MT128x64x16_EPS1_GSU1_LPB4_PGR1_SNLL1_TT8_4_VW4_WG16_16_1_WGM1
    SolutionIndex: 11
    SolutionNameMin: Cijk_Ailk_Bljk_SB_MT128x32x16_EPS1_GSU1_LPB4_PGR1_SNLL1_TT4_4_VW4_WG32_8_1_WGM1
    SolutionIndex: 12
    SolutionNameMin: Cijk_Ailk_Bljk_SB_MT128x64x16_EPS1_GSU1_LPB4_PGR1_SNLL1_TT4_8_VW4_WG32_8_1_WGM1
    SolutionIndex: 13
    SolutionNameMin: Cijk_Ailk_Bljk_SB_MT64x32x16_EPS1_GSU1_LPB4_PGR1_SNLL1_TT4_4_VW4_WG16_8_1_WGM8
    SolutionIndex: 14
    SolutionNameMin: Cijk_Ailk_Bljk_SB_MT64x64x16_EPS1_GSU1_LPB4_PGR1_SNLL1_TT4_4_VW4_WG16_16_1_WGM8
    SolutionIndex: 15
    SolutionNameMin: Cijk_Ailk_Bljk_SB_MT128x64x16_EPS1_GSU1_LPB4_PGR1_SNLL1_TT8_4_VW4_WG16_16_1_WGM8
    SolutionIndex: 16
    SolutionNameMin: Cijk_Ailk_Bljk_SB_MT128x32x16_EPS1_GSU1_LPB4_PGR1_SNLL1_TT4_4_VW4_WG32_8_1_WGM8
    SolutionIndex: 17
    SolutionNameMin: Cijk_Ailk_Bljk_SB_MT128x64x16_EPS1_GSU1_LPB4_PGR1_SNLL1_TT4_8_VW4_WG32_8_1_WGM8
    SolutionIndex: 18
    SolutionNameMin: Cijk_Ailk_Bljk_SB_MT64x64x16_EPS1_GSU1_LPB4_PGR1_SNLL1_TT4_4_VW4_WG16_16_1_WGM64
    SolutionIndex: 19
    SolutionNameMin: Cijk_Ailk_Bljk_SB_MT128x64x16_EPS1_GSU1_LPB4_PGR1_SNLL1_TT8_4_VW4_WG16_16_1_WGM64
    SolutionIndex: 20
    SolutionNameMin: Cijk_Ailk_Bljk_SB_MT128x32x16_EPS1_GSU1_LPB4_PGR1_SNLL1_TT4_4_VW4_WG32_8_1_WGM64
    SolutionIndex: 21
    SolutionNameMin: Cijk_Ailk_Bljk_SB_MT128x64x16_EPS1_GSU1_LPB4_PGR1_SNLL1_TT4_8_VW4_WG32_8_1_WGM64
    SolutionIndex: 22
    SolutionNameMin: Cijk_Ailk_Bljk_SB_MT128x32x32_EPS1_GSU1_LPB4_PGR1_SNLL1_TT4_4_VW4_WG32_8_1_WGM1
    SolutionIndex: 23
    SolutionNameMin: Cijk_Ailk_Bljk_SB_MT64x64x32_EPS1_GSU1_LPB4_PGR1_SNLL1_TT4_4_VW4_WG16_16_1_WGM8
    SolutionIndex: 24
    SolutionNameMin: Cijk_Ailk_Bljk_SB_MT128x32x32_EPS1_GSU1_LPB4_PGR1_SNLL1_TT4_4_VW4_WG32_8_1_WGM64
    SolutionIndex: 25
    SolutionNameMin: Cijk_Ailk_Bljk_SB_MT128x64x8_EPS1_GRVW4_GSU1_LPB0_PGR1_SNLL1_TT8_4_VW4_WG16_16_1_WGM4
    SolutionIndex: 26
    SolutionNameMin: Cijk_Ailk_Bljk_SB_MT128x128x16_EPS1_GRVW4_GSU1_LPB0_PGR1_SNLL1_TT8_8_VW4_WG16_16_1_WGM4
    SolutionIndex: 27
    SolutionNameMin: Cijk_Ailk_Bljk_SB_MT128x64x8_EPS1_GRVW4_GSU1_LPB0_PGR1_SNLL1_TT8_4_VW4_WG16_16_1_WGM8
    SolutionIndex: 28
    SolutionNameMin: Cijk_Ailk_Bljk_SB_MT128x128x16_EPS1_GRVW4_GSU1_LPB0_PGR1_SNLL1_TT8_8_VW4_WG16_16_1_WGM8
    SolutionIndex: 29
    SolutionNameMin: Cijk_Ailk_Bljk_SB_MT128x128x16_EPS1_GRVW4_GSU1_LPB0_PGR1_SNLL1_TT8_8_VW4_WG16_16_1_WGM32
    SolutionIndex: 30
    SolutionNameMin: Cijk_Ailk_Bljk_SB_MT64x32x32_EPS1_GRVW2_GSU1_LPB2_PGR1_SNLL1_TT4_4_VW2_WG16_8_2_WGM4
    SolutionIndex: 31
    SolutionNameMin: Cijk_Ailk_Bljk_SB_MT128x64x8_EPS1_GRVW4_GSU1_LPB4_PGR1_SNLL1_TT8_4_VW4_WG16_16_1_WGM4
    SolutionIndex: 32
    SolutionNameMin: Cijk_Ailk_Bljk_SB_MT32x16x16_EPS1_GRVW4_GSU1_LPB4_PGR1_SNLL1_TT4_4_VW4_WG8_4_2_WGM4
    SolutionIndex: 33
    SolutionNameMin: Cijk_Ailk_Bljk_SB_MT128x64x16_EPS1_GRVW4_GSU1_LPB4_PGR1_SNLL1_TT8_4_VW4_WG16_16_1_WGM4
    SolutionIndex: 34
    SolutionNameMin: Cijk_Ailk_Bljk_SB_MT64x32x16_EPS1_GRVW4_GSU1_LPB4_PGR1_SNLL1_TT4_4_VW4_WG16_8_2_WGM4
    SolutionIndex: 35
    SolutionNameMin: Cijk_Ailk_Bljk_SB_MT64x64x16_EPS1_GRVW4_GSU1_LPB4_PGR1_SNLL1_TT4_8_VW4_WG16_8_2_WGM4
    SolutionIndex: 36
    SolutionNameMin: Cijk_Ailk_Bljk_SB_MT32x16x32_EPS1_GRVW4_GSU1_LPB4_PGR1_SNLL1_TT4_4_VW4_WG8_4_2_WGM4
    SolutionIndex: 37
    SolutionNameMin: Cijk_Ailk_Bljk_SB_MT64x32x32_EPS1_GRVW4_GSU1_LPB4_PGR1_SNLL1_TT4_4_VW4_WG16_8_2_WGM4
    SolutionIndex: 38
    SolutionNameMin: Cijk_Ailk_Bljk_SB_MT128x64x16_EPS1_GRVW4_GSU1_LPB4_PGR1_SNLL1_TT8_4_VW4_WG16_16_1_WGM8
    SolutionIndex: 39
    SolutionNameMin: Cijk_Ailk_Bljk_SB_MT64x32x16_EPS1_GRVW4_GSU1_LPB4_PGR1_SNLL1_TT4_4_VW4_WG16_8_2_WGM8
    SolutionIndex: 40
    SolutionNameMin: Cijk_Ailk_Bljk_SB_MT64x64x16_EPS1_GRVW4_GSU1_LPB4_PGR1_SNLL1_TT4_8_VW4_WG16_8_2_WGM8
    SolutionIndex: 41
    SolutionNameMin: Cijk_Ailk_Bljk_SB_MT128x32x16_EPS1_GRVW4_GSU1_LPB4_PGR1_SNLL1_TT8_4_VW4_WG16_8_2_WGM8
    SolutionIndex: 42
    SolutionNameMin: Cijk_Ailk_Bljk_SB_MT64x32x32_EPS1_GRVW4_GSU1_LPB4_PGR1_SNLL1_TT4_4_VW4_WG16_8_2_WGM8
    SolutionIndex: 43
    SolutionNameMin: Cijk_Ailk_Bljk_SB_MT128x64x16_EPS1_GRVW4_GSU1_LPB4_PGR1_SNLL1_TT8_4_VW4_WG16_16_1_WGM16
    SolutionIndex: 44
    SolutionNameMin: Cijk_Ailk_Bljk_SB_MT64x32x16_EPS1_GRVW4_GSU1_LPB4_PGR1_SNLL1_TT4_4_VW4_WG16_8_2_WGM16
    SolutionIndex: 45
    SolutionNameMin: Cijk_Ailk_Bljk_SB_MT64x64x16_EPS1_GRVW4_GSU1_LPB4_PGR1_SNLL1_TT4_8_VW4_WG16_8_2_WGM16
    SolutionIndex: 46
    SolutionNameMin: Cijk_Ailk_Bljk_SB_MT128x32x16_EPS1_GRVW4_GSU1_LPB4_PGR1_SNLL1_TT8_4_VW4_WG16_8_2_WGM16
    SolutionIndex: 47
    SolutionNameMin: Cijk_Ailk_Bljk_SB_MT64x32x32_EPS1_GRVW4_GSU1_LPB4_PGR1_SNLL1_TT4_4_VW4_WG16_8_2_WGM16
    SolutionIndex: 48
    SolutionNameMin: Cijk_Ailk_Bljk_SB_MT128x64x16_EPS1_GRVW4_GSU1_LPB4_PGR1_SNLL1_TT8_4_VW4_WG16_16_1_WGM32
    SolutionIndex: 49
    SolutionNameMin: Cijk_Ailk_Bljk_SB_MT64x32x16_EPS1_GRVW4_GSU1_LPB4_PGR1_SNLL1_TT4_4_VW4_WG16_8_2_WGM32
    SolutionIndex: 50
    SolutionNameMin: Cijk_Ailk_Bljk_SB_MT64x32x32_EPS1_GRVW4_GSU1_LPB4_PGR1_SNLL1_TT4_4_VW4_WG16_8_2_WGM32
- - - [1024, 256, 1, 1024]
    - [42, 6331.03]
  - - [1024, 512, 1, 2048]
    - [41, 8100.04]
  - - [512, 200, 1, 512]
    - [50, 2861.83]
  - - [4096, 256, 1, 2048]
    - [33, 8812.72]
  - - [4096, 512, 1, 1024]
    - [43, 9068.77]
  - - [1024, 200, 1, 1024]
    - [42, 5110.02]
  - - [1024, 512, 1, 1024]
    - [35, 7785.25]
  - - [2048, 256, 1, 4096]
    - [45, 8438.71]
  - - [2048, 768, 1, 512]
    - [27, 8618.43]
  - - [512, 256, 1, 1024]
    - [47, 4834.93]
  - - [512, 768, 1, 2048]
    - [44, 6908.94]
  - - [2048, 256, 1, 1024]
    - [40, 7941.88]
  - - [1024, 256, 1, 2048]
    - [37, 6997.8]
  - - [2048, 200, 1, 512]
    - [40, 5649.66]
  - - [512, 1024, 1, 512]
    - [40, 7200.52]
  - - [4096, 200, 1, 1024]
    - [38, 6678.83]
  - - [2048, 200, 1, 4096]
    - [46, 6706.59]
  - - [2048, 512, 1, 1024]
    - [43, 8548.9]
  - - [1024, 1024, 1, 512]
    - [38, 8046.63]
  - - [1024, 200, 1, 4096]
    - [37, 5884.26]
  - - [512, 512, 1, 512]
    - [39, 5886.74]
  - - [2048, 512, 1, 4096]
    - [48, 8995.84]
  - - [4096, 512, 1, 2048]
    - [43, 9298.08]
  - - [512, 256, 1, 2048]
    - [36, 5186.16]
  - - [4096, 1024, 1, 2048]
    - [25, 9790.67]
  - - [2048, 1024, 1, 2048]
    - [26, 9278.8]
  - - [1024, 200, 1, 512]
    - [42, 4535.36]
  - - [512, 512, 1, 1024]
    - [42, 6553.6]
  - - [1024, 1024, 1, 4096]
    - [33, 8967.29]
  - - [2048, 1024, 1, 4096]
    - [28, 9500.46]
  - - [4096, 200, 1, 2048]
    - [34, 7082.58]
  - - [2048, 200, 1, 1024]
    - [40, 6211.94]
  - - [1024, 768, 1, 512]
    - [41, 7401.71]
  - - [2048, 512, 1, 512]
    - [38, 8124.56]
  - - [2048, 200, 1, 2048]
    - [40, 6561.8]
  - - [512, 1024, 1, 1024]
    - [46, 7407.16]
  - - [2048, 256, 1, 2048]
    - [41, 8224.13]
  - - [512, 768, 1, 512]
    - [39, 6469.36]
  - - [512, 200, 1, 1024]
    - [42, 3755.64]
  - - [4096, 1024, 1, 1024]
    - [25, 9605.85]
  - - [512, 512, 1, 2048]
    - [42, 6631.31]
  - - [4096, 256, 1, 4096]
    - [48, 8961.29]
  - - [1024, 512, 1, 512]
    - [41, 7108.99]
  - - [512, 256, 1, 512]
    - [49, 4032.98]
  - - [1024, 256, 1, 4096]
    - [37, 7326.3]
  - - [4096, 512, 1, 4096]
    - [29, 9471.97]
  - - [1024, 200, 1, 2048]
    - [30, 5530.46]
  - - [512, 1024, 1, 2048]
    - [39, 7398.99]
  - - [2048, 1024, 1, 512]
    - [31, 8995.83]
  - - [1024, 1024, 1, 2048]
    - [38, 8830.11]
  - - [4096, 256, 1, 1024]
    - [38, 8581.7]
  - - [512, 768, 1, 1024]
    - [39, 6875.91]
  - - [1024, 512, 1, 4096]
    - [35, 8484.05]
  - - [1024, 256, 1, 512]
    - [32, 5667.98]
  - - [4096, 200, 1, 4096]
    - [45, 7018.59]
  - - [2048, 256, 1, 512]
    - [45, 7078.99]
  - - [512, 200, 1, 2048]
    - [50, 4283.4]
  - - [1024, 1024, 1, 1024]
    - [33, 8565.27]
  - - [2048, 512, 1, 2048]
    - [33, 8850.49]
  - - [4096, 1024, 1, 4096]
    - [26, 9843.18]
  - - [2048, 1024, 1, 1024]
    - [31, 9234.11]
- null
