src/Tensile/data/Configs/miopen/archives/bert/2020-01-07/exact/vega20_Cijk_Alik_Bljk_SB.yaml
- {MinimumRequiredVersion: 4.14.0}
- vega20
- gfx906
- [Device 66a0, Device 66a1, Device 66a7, Vega 20]
    SolutionIndex: 0
    SolutionNameMin: Cijk_Alik_Bljk_SB_MT64x64x16_SE_EPS1_FL0_GRVW4_LPA0_LPB0_PGR1_PLR1_TT4_4_VW4_WGM1
    SolutionIndex: 1
    SolutionNameMin: Cijk_Alik_Bljk_SB_MT64x64x16_SE_EPS1_FL1_GRVW4_LPA0_LPB0_PGR1_PLR1_TT4_4_VW4_WGM1
    SolutionIndex: 2
    SolutionNameMin: Cijk_Alik_Bljk_SB_MT64x128x16_SE_EPS1_FL0_GRVW4_LPA0_LPB0_PGR1_PLR1_TT4_8_VW4_WGM1
    SolutionIndex: 3
    SolutionNameMin: Cijk_Alik_Bljk_SB_MT128x64x16_SE_EPS1_FL0_GRVW4_LPA0_LPB0_PGR1_PLR1_TT8_4_VW4_WGM1
    SolutionIndex: 4
    SolutionNameMin: Cijk_Alik_Bljk_SB_MT128x64x16_SE_EPS1_FL0_GRVW4_LPA0_LPB0_PGR1_PLR1_TT8_4_VW4_WGM8
    SolutionIndex: 5
    SolutionNameMin: Cijk_Alik_Bljk_SB_MT128x64x16_SE_EPS1_FL1_GRVW4_LPA0_LPB0_PGR1_PLR1_TT8_4_VW4_WGM1
    SolutionIndex: 6
    SolutionNameMin: Cijk_Alik_Bljk_SB_MT128x128x8_SE_EPS1_FL0_GRVW2_LPA0_LPB0_PGR1_PLR0_TT8_8_VW2_WGM1
    SolutionIndex: 7
    SolutionNameMin: Cijk_Alik_Bljk_SB_MT128x128x16_SE_EPS1_FL0_GRVW2_LPA0_LPB0_PGR1_PLR0_TT8_8_VW4_WGM1
    SolutionIndex: 8
    SolutionNameMin: Cijk_Alik_Bljk_SB_MT128x128x8_SE_EPS1_FL0_GRVW2_LPA0_LPB0_PGR1_PLR1_TT8_8_VW4_WGM1
    SolutionIndex: 9
    SolutionNameMin: Cijk_Alik_Bljk_SB_MT128x128x16_SE_EPS1_FL1_GRVW2_LPA0_LPB0_PGR1_PLR1_TT8_8_VW2_WGM8
    SolutionIndex: 10
    SolutionNameMin: Cijk_Alik_Bljk_SB_MT128x128x16_SE_EPS1_FL1_GRVW4_LPA0_LPB0_PGR1_PLR1_TT8_8_VW4_WGM1
    SolutionIndex: 11
    SolutionNameMin: Cijk_Alik_Bljk_SB_MT32x32x8_SE_EPS0_FL0_GRVW1_LPA0_LPB0_PGR0_PLR0_TT2_2_VW2_WGM1
    SolutionIndex: 12
    SolutionNameMin: Cijk_Alik_Bljk_SB_MT32x32x16_SE_EPS1_FL0_GRVW4_LPA0_LPB0_PGR1_PLR1_TT2_2_VW2_WGM8
    SolutionIndex: 13
    SolutionNameMin: Cijk_Alik_Bljk_SB_MT64x64x16_SE_EPS0_FL1_GRVW4_LPA4_LPB4_PGR0_PLR1_TT4_4_VW4_WGM1
    SolutionIndex: 14
    SolutionNameMin: Cijk_Alik_Bljk_SB_MT32x16x32_SE_EPS1_FL0_GRVW4_LPA2_LPB2_PGR1_PLR1_TT2_2_VW2_WGM8
    SolutionIndex: 15
    SolutionNameMin: Cijk_Alik_Bljk_SB_MT64x32x16_SE_EPS1_FL0_GRVW4_LPA0_LPB0_PGR1_PLR1_TT4_4_VW2_WGM8
    SolutionIndex: 16
    SolutionNameMin: Cijk_Alik_Bljk_SB_MT64x32x16_SE_EPS1_FL1_GRVW4_LPA0_LPB0_PGR1_PLR1_TT4_4_VW4_WGM8
    SolutionIndex: 17
    SolutionNameMin: Cijk_Alik_Bljk_SB_MT128x64x16_SE_EPS0_FL1_GRVW4_LPA0_LPB4_PGR0_PLR1_TT8_4_VW4_WGM1
    SolutionIndex: 18
    SolutionNameMin: Cijk_Alik_Bljk_SB_MT128x64x16_SE_EPS0_FL1_GRVW4_LPA4_LPB4_PGR0_PLR1_TT8_4_VW4_WGM1
- - - [30522, 80, 1, 1024, 30522, 30522, 1024, 1024]
    - [6, 7042.48]
  - - [512, 512, 128, 64, 512, 512, 64, 64]
    - [18, 9402.29]
  - - [1024, 80, 1, 1024, 1024, 1024, 1024, 1024]
    - [15, 2335.36]
  - - [1024, 512, 1, 1024, 1024, 1024, 1024, 1024]
    - [0, 5677.57]
  - - [1024, 6, 1, 1024, 1024, 1024, 1024, 1024]
    - [14, 367.492]
  - - [2, 1, 1, 1024, 2, 2, 1024, 1024]
    - [11, 0.0]
  - - [3072, 3072, 1, 1024, 3072, 3072, 1024, 1024]
    - [10, 11379.8]
  - - [30522, 120, 1, 1024, 30522, 30522, 1024, 1024]
    - [9, 10251.9]
  - - [512, 512, 96, 64, 512, 512, 64, 64]
    - [17, 9269.18]
  - - [30522, 20, 1, 1024, 30522, 30522, 1024, 1024]
    - [3, 2965.33]
  - - [512, 512, 64, 64, 512, 512, 64, 64]
    - [18, 9032.15]
  - - [1024, 512, 1, 3072, 1024, 1024, 3072, 3072]
    - [1, 5958.17]
  - - [2, 8, 1, 1024, 2, 2, 1024, 1024]
    - [11, 0.0]
  - - [1024, 20, 1, 1024, 1024, 1024, 1024, 1024]
    - [12, 697.191]
  - - [512, 512, 16, 64, 512, 512, 64, 64]
    - [13, 7231.56]
  - - [3072, 2048, 1, 1024, 3072, 3072, 1024, 1024]
    - [3, 10447.7]
  - - [1024, 3072, 1, 1024, 1024, 1024, 1024, 1024]
    - [7, 9399.0]
  - - [2, 6, 1, 1024, 2, 2, 1024, 1024]
    - [11, 0.0]
  - - [1024, 1, 1, 1024, 1024, 1024, 1024, 1024]
    - [11, 0.0]
  - - [30522, 160, 1, 1024, 30522, 30522, 1024, 1024]
    - [4, 8726.67]
  - - [1024, 4, 1, 1024, 1024, 1024, 1024, 1024]
    - [14, 240.499]
  - - [1024, 2048, 1, 1024, 1024, 1024, 1024, 1024]
    - [5, 8489.42]
  - - [3072, 512, 1, 1024, 3072, 3072, 1024, 1024]
    - [8, 8437.83]
  - - [1024, 2048, 1, 3072, 1024, 1024, 3072, 3072]
    - [3, 8952.83]
  - - [1024, 3072, 1, 3072, 1024, 1024, 3072, 3072]
    - [2, 9867.35]
  - - [2, 4, 1, 1024, 2, 2, 1024, 1024]
    - [11, 0.0]
  - - [1024, 120, 1, 1024, 1024, 1024, 1024, 1024]
    - [16, 2808.69]
- null
