Tensile/Configs/miopen/archives/bert/2020-08-20/exact/vega20_Cijk_Ailk_Bjlk_HBH.yaml
- {MinimumRequiredVersion: 4.21.0}
- vega20
- gfx906
- [Device 66a0, Device 66a1, Device 66a7, Device 66af, Vega 20]
    SolutionIndex: 0
    SolutionNameMin: Cijk_Ailk_Bjlk_HBH_MT64x64x16_SE_GRVW4_LRVW4_TT4_4_VW4_WG16_16_1_WGM1
    SolutionIndex: 1
    SolutionNameMin: Cijk_Ailk_Bjlk_HBH_MT64x64x16_SE_GRVW4_LRVW4_TT4_4_VW4_WG16_16_1_WGM8
    SolutionIndex: 2
    SolutionNameMin: Cijk_Ailk_Bjlk_HBH_MT64x64x24_SE_GRVW4_LRVW4_TT4_4_VW4_WG16_16_1_WGM8
    SolutionIndex: 3
    SolutionNameMin: Cijk_Ailk_Bjlk_HBH_MT64x64x32_SE_GRVW4_LRVW4_TT4_4_VW4_WG16_16_1_WGM1
    SolutionIndex: 4
    SolutionNameMin: Cijk_Ailk_Bjlk_HBH_MT64x64x32_SE_GRVW4_LRVW4_TT4_4_VW4_WG16_16_1_WGM8
    SolutionIndex: 5
    SolutionNameMin: Cijk_Ailk_Bjlk_HBH_MT64x96x16_SE_GRVW2_LRVW2_TT4_6_VW2_WG16_16_1_WGM1
    SolutionIndex: 6
    SolutionNameMin: Cijk_Ailk_Bjlk_HBH_MT96x64x16_SE_GRVW2_LRVW2_TT6_4_VW2_WG16_16_1_WGM8
    SolutionIndex: 7
    SolutionNameMin: Cijk_Ailk_Bjlk_HBH_MT96x64x24_SE_GRVW2_LRVW2_TT6_4_VW2_WG16_16_1_WGM1
    SolutionIndex: 8
    SolutionNameMin: Cijk_Ailk_Bjlk_HBH_MT64x128x16_SE_GRVW4_LRVW4_TT4_8_VW4_WG16_16_1_WGM1
    SolutionIndex: 9
    SolutionNameMin: Cijk_Ailk_Bjlk_HBH_MT128x64x16_SE_GRVW4_LRVW4_TT8_4_VW4_WG16_16_1_WGM1
    SolutionIndex: 10
    SolutionNameMin: Cijk_Ailk_Bjlk_HBH_MT128x64x16_SE_GRVW4_LRVW4_TT8_4_VW4_WG16_16_1_WGM8
- - - [2048, 2048, 1, 1024, 2048, 2048, 2048, 2048]
    - [1, 13794.2]
  - - [2048, 30592, 1, 1024, 2048, 2048, 2048, 30592]
    - [0, 14376.0]
  - - [2048, 6144, 1, 1024, 2048, 2048, 2048, 6144]
    - [1, 14165.5]
  - - [2048, 8192, 1, 1024, 2048, 2048, 2048, 8192]
    - [8, 14194.5]
  - - [8192, 2048, 1, 1024, 8192, 8192, 8192, 2048]
    - [10, 13982.8]
  - - [1024, 1024, 1, 16, 1024, 1024, 524288, 1024]
    - [4, 2995.93]
  - - [1024, 1024, 1, 8192, 1024, 1024, 1024, 1024]
    - [4, 13441.9]
  - - [1024, 30592, 1, 8192, 1024, 1024, 1024, 30592]
    - [10, 14456.1]
  - - [1024, 3072, 1, 8192, 1024, 1024, 1024, 3072]
    - [0, 14038.9]
  - - [1024, 4096, 1, 8192, 1024, 1024, 1024, 4096]
    - [9, 13887.0]
  - - [4096, 1024, 1, 8192, 4096, 4096, 4096, 1024]
    - [1, 14125.4]
  - - [1024, 1024, 1, 2048, 1024, 1024, 1024, 1024]
    - [1, 13062.6]
  - - [1024, 1024, 1, 4, 1024, 1024, 524288, 1024]
    - [1, 919.804]
  - - [1024, 30592, 1, 2048, 1024, 1024, 1024, 30592]
    - [8, 14399.8]
  - - [1024, 3072, 1, 2048, 1024, 1024, 1024, 3072]
    - [1, 13884.6]
  - - [1024, 4096, 1, 2048, 1024, 1024, 1024, 4096]
    - [9, 13769.5]
  - - [4096, 1024, 1, 2048, 4096, 4096, 4096, 1024]
    - [1, 13930.2]
  - - [1024, 1024, 1, 4096, 1024, 1024, 1024, 1024]
    - [4, 13292.2]
  - - [1024, 1024, 1, 8, 1024, 1024, 524288, 1024]
    - [1, 1747.63]
  - - [1024, 30592, 1, 4096, 1024, 1024, 1024, 30592]
    - [4, 14399.0]
  - - [1024, 3072, 1, 4096, 1024, 1024, 1024, 3072]
    - [1, 13899.0]
  - - [1024, 4096, 1, 4096, 1024, 1024, 1024, 4096]
    - [1, 13821.7]
  - - [4096, 1024, 1, 4096, 4096, 4096, 4096, 1024]
    - [1, 13882.5]
  - - [2560, 1920, 1, 2048, 2560, 2560, 2560, 1920]
    - [1, 13825.9]
  - - [2560, 2560, 1, 2048, 2560, 2560, 2560, 2560]
    - [0, 14090.2]
  - - [2560, 2560, 1, 4, 2560, 2560, 1310720, 2560]
    - [1, 2291.47]
  - - [2560, 7680, 1, 2048, 2560, 2560, 2560, 7680]
    - [4, 14343.6]
  - - [640, 2560, 1, 2048, 640, 640, 640, 2560]
    - [1, 12021.5]
  - - [1536, 1536, 1, 4096, 1536, 1536, 1536, 1536]
    - [1, 13666.2]
  - - [1536, 4608, 1, 4096, 1536, 1536, 1536, 4608]
    - [0, 14218.0]
  - - [1536, 50304, 1, 4096, 1536, 1536, 1536, 50304]
    - [9, 14504.0]
  - - [1536, 6144, 1, 4096, 1536, 1536, 1536, 6144]
    - [1, 14273.8]
  - - [6144, 1536, 1, 4096, 6144, 6144, 6144, 1536]
    - [8, 14265.4]
  - - [1536, 1536, 1, 8192, 1536, 1536, 1536, 1536]
    - [1, 13765.1]
  - - [1536, 4608, 1, 8192, 1536, 1536, 1536, 4608]
    - [2, 14188.5]
  - - [1536, 50304, 1, 8192, 1536, 1536, 1536, 50304]
    - [10, 14286.0]
  - - [1536, 6144, 1, 8192, 1536, 1536, 1536, 6144]
    - [10, 14322.3]
  - - [6144, 1536, 1, 8192, 6144, 6144, 6144, 1536]
    - [4, 14356.1]
  - - [1024, 1024, 1, 16384, 1024, 1024, 1024, 1024]
    - [4, 13446.1]
  - - [1024, 3072, 1, 16384, 1024, 1024, 1024, 3072]
    - [4, 13973.7]
  - - [1024, 4096, 1, 16384, 1024, 1024, 1024, 4096]
    - [9, 14026.4]
  - - [1024, 50304, 1, 16384, 1024, 1024, 1024, 50304]
    - [9, 14197.2]
  - - [4096, 1024, 1, 16384, 4096, 4096, 4096, 1024]
    - [4, 14171.3]
  - - [1024, 50304, 1, 2048, 1024, 1024, 1024, 50304]
    - [8, 14411.1]
  - - [1024, 50304, 1, 4096, 1024, 1024, 1024, 50304]
    - [9, 14443.6]
  - - [512, 64, 64, 512, 512, 512, 512, 64]
    - [9, 12223.8]
  - - [64, 512, 64, 512, 64, 64, 64, 512]
    - [2, 12450.6]
  - - [512, 64, 256, 512, 512, 512, 512, 64]
    - [0, 13727.2]
  - - [64, 512, 256, 512, 64, 64, 64, 512]
    - [1, 13773.0]
  - - [512, 64, 128, 512, 512, 512, 512, 64]
    - [0, 13321.9]
  - - [64, 512, 128, 512, 64, 64, 64, 512]
    - [1, 13408.4]
  - - [512, 64, 40, 512, 512, 512, 512, 64]
    - [0, 11683.3]
  - - [64, 512, 40, 512, 64, 64, 64, 512]
    - [0, 11848.3]
  - - [1024, 96, 64, 1024, 1024, 1024, 1024, 96]
    - [5, 13640.0]
  - - [96, 1024, 64, 1024, 96, 96, 96, 1024]
    - [6, 13635.4]
  - - [1024, 96, 128, 1024, 1024, 1024, 1024, 96]
    - [5, 13949.5]
  - - [96, 1024, 128, 1024, 96, 96, 96, 1024]
    - [7, 13917.0]
  - - [1024, 64, 256, 1024, 1024, 1024, 1024, 64]
    - [3, 14144.9]
  - - [64, 1024, 256, 1024, 64, 64, 64, 1024]
    - [1, 14175.7]
  - - [1024, 64, 32, 1024, 1024, 1024, 1024, 64]
    - [0, 13190.9]
  - - [64, 1024, 32, 1024, 64, 64, 64, 1024]
    - [1, 13335.1]
  - - [1024, 64, 64, 1024, 1024, 1024, 1024, 64]
    - [0, 13706.2]
  - - [64, 1024, 64, 1024, 64, 64, 64, 1024]
    - [0, 13783.6]
- null
