Tensile/Configs/miopen/archives/bert/2020-08-20/exact/vega20_Cijk_Alik_Bljk_HBH.yaml
- {MinimumRequiredVersion: 4.21.0}
- vega20
- gfx906
- [Device 66a0, Device 66a1, Device 66a7, Device 66af, Vega 20]
    SolutionIndex: 0
    SolutionNameMin: Cijk_Alik_Bljk_HBH_MT32x32x16_SE_GRVW2_LRVW2_TT2_2_VW2_WG16_16_1_WGM1
    SolutionIndex: 1
    SolutionNameMin: Cijk_Alik_Bljk_HBH_MT64x64x16_SE_GRVW4_LRVW4_TT4_4_VW4_WG16_16_1_WGM1
    SolutionIndex: 2
    SolutionNameMin: Cijk_Alik_Bljk_HBH_MT64x64x16_SE_GRVW4_LRVW4_TT4_4_VW4_WG16_16_1_WGM8
    SolutionIndex: 3
    SolutionNameMin: Cijk_Alik_Bljk_HBH_MT64x64x32_SE_GRVW4_LRVW4_TT4_4_VW4_WG16_16_1_WGM1
    SolutionIndex: 4
    SolutionNameMin: Cijk_Alik_Bljk_HBH_MT32x32x16_SE_GRVW4_LRVW4_TT4_4_VW4_WG8_8_1_WGM8
    SolutionIndex: 5
    SolutionNameMin: Cijk_Alik_Bljk_HBH_MT96x64x16_SE_GRVW2_LRVW2_TT6_4_VW2_WG16_16_1_WGM1
    SolutionIndex: 6
    SolutionNameMin: Cijk_Alik_Bljk_HBH_MT96x64x16_SE_GRVW2_LRVW2_TT6_4_VW2_WG16_16_1_WGM8
    SolutionIndex: 7
    SolutionNameMin: Cijk_Alik_Bljk_HBH_MT64x128x16_SE_GRVW4_LRVW4_TT4_8_VW4_WG16_16_1_WGM1
    SolutionIndex: 8
    SolutionNameMin: Cijk_Alik_Bljk_HBH_MT64x128x16_SE_GRVW4_LRVW4_TT4_8_VW4_WG16_16_1_WGM8
    SolutionIndex: 9
    SolutionNameMin: Cijk_Alik_Bljk_HBH_MT128x64x16_SE_GRVW4_LRVW4_TT8_4_VW4_WG16_16_1_WGM1
    SolutionIndex: 10
    SolutionNameMin: Cijk_Alik_Bljk_HBH_MT128x64x16_SE_GRVW4_LRVW4_TT8_4_VW4_WG16_16_1_WGM8
- - - [2048, 1024, 1, 2048, 2048, 2048, 2048, 2048]
    - [10, 13034.0]
  - - [2048, 1024, 1, 8192, 2048, 2048, 8192, 8192]
    - [8, 12734.9]
  - - [30592, 1024, 1, 2048, 30592, 30592, 2048, 2048]
    - [9, 14076.5]
  - - [6144, 1024, 1, 2048, 6144, 6144, 2048, 2048]
    - [7, 13382.8]
  - - [8192, 1024, 1, 2048, 8192, 8192, 2048, 2048]
    - [9, 13518.1]
  - - [1024, 8192, 1, 1024, 1024, 1024, 1024, 1024]
    - [2, 13899.6]
  - - [1024, 8192, 1, 4096, 1024, 1024, 4096, 4096]
    - [7, 13542.4]
  - - [30592, 8192, 1, 1024, 30592, 30592, 1024, 1024]
    - [10, 14388.5]
  - - [3072, 8192, 1, 1024, 3072, 3072, 1024, 1024]
    - [7, 14208.0]
  - - [4096, 8192, 1, 1024, 4096, 4096, 1024, 1024]
    - [9, 14239.7]
  - - [1024, 2048, 1, 1024, 1024, 1024, 1024, 1024]
    - [2, 13094.4]
  - - [1024, 2048, 1, 4096, 1024, 1024, 4096, 4096]
    - [8, 13155.4]
  - - [30592, 2048, 1, 1024, 30592, 30592, 1024, 1024]
    - [9, 14316.0]
  - - [3072, 2048, 1, 1024, 3072, 3072, 1024, 1024]
    - [2, 13872.6]
  - - [4096, 2048, 1, 1024, 4096, 4096, 1024, 1024]
    - [1, 13906.8]
  - - [1024, 4096, 1, 1024, 1024, 1024, 1024, 1024]
    - [2, 13622.7]
  - - [1024, 4096, 1, 4096, 1024, 1024, 4096, 4096]
    - [9, 12823.9]
  - - [30592, 4096, 1, 1024, 30592, 30592, 1024, 1024]
    - [7, 14442.3]
  - - [3072, 4096, 1, 1024, 3072, 3072, 1024, 1024]
    - [2, 14081.3]
  - - [4096, 4096, 1, 1024, 4096, 4096, 1024, 1024]
    - [7, 14114.3]
  - - [1920, 2048, 1, 2560, 1920, 1920, 2560, 2560]
    - [1, 13721.8]
  - - [2560, 2048, 1, 2560, 2560, 2560, 2560, 2560]
    - [1, 13870.1]
  - - [2560, 2048, 1, 640, 2560, 2560, 640, 640]
    - [2, 13640.0]
  - - [7680, 2048, 1, 2560, 7680, 7680, 2560, 2560]
    - [7, 14181.1]
  - - [1536, 4096, 1, 1536, 1536, 1536, 1536, 1536]
    - [1, 13945.5]
  - - [1536, 4096, 1, 6144, 1536, 1536, 6144, 6144]
    - [9, 14017.9]
  - - [4608, 4096, 1, 1536, 4608, 4608, 1536, 1536]
    - [7, 14208.0]
  - - [50304, 4096, 1, 1536, 50304, 50304, 1536, 1536]
    - [9, 14393.4]
  - - [6144, 4096, 1, 1536, 6144, 6144, 1536, 1536]
    - [7, 14240.6]
  - - [1536, 8192, 1, 1536, 1536, 1536, 1536, 1536]
    - [7, 14115.8]
  - - [1536, 8192, 1, 6144, 1536, 1536, 6144, 6144]
    - [9, 14115.0]
  - - [4608, 8192, 1, 1536, 4608, 4608, 1536, 1536]
    - [8, 14288.9]
  - - [50304, 8192, 1, 1536, 50304, 50304, 1536, 1536]
    - [10, 14279.4]
  - - [6144, 8192, 1, 1536, 6144, 6144, 1536, 1536]
    - [9, 14407.9]
  - - [1024, 16384, 1, 1024, 1024, 1024, 1024, 1024]
    - [1, 14140.3]
  - - [1024, 16384, 1, 4096, 1024, 1024, 4096, 4096]
    - [9, 13849.8]
  - - [3072, 16384, 1, 1024, 3072, 3072, 1024, 1024]
    - [9, 14366.4]
  - - [4096, 16384, 1, 1024, 4096, 4096, 1024, 1024]
    - [9, 14285.1]
  - - [50304, 16384, 1, 1024, 50304, 50304, 1024, 1024]
    - [8, 14260.3]
  - - [50304, 2048, 1, 1024, 50304, 50304, 1024, 1024]
    - [8, 14293.8]
  - - [50304, 4096, 1, 1024, 50304, 50304, 1024, 1024]
    - [7, 14452.9]
  - - [1024, 16, 1, 1024, 1024, 1024, 1024, 524288]
    - [1, 375.834]
  - - [1024, 4, 1, 1024, 1024, 1024, 1024, 524288]
    - [1, 98.9223]
  - - [1024, 8, 1, 1024, 1024, 1024, 1024, 524288]
    - [4, 197.472]
  - - [2560, 4, 1, 2560, 2560, 2560, 2560, 1310720]
    - [4, 280.548]
  - - [512, 512, 64, 64, 512, 512, 64, 64]
    - [1, 12135.4]
  - - [512, 512, 256, 64, 512, 512, 64, 64]
    - [9, 12755.3]
  - - [512, 512, 128, 64, 512, 512, 64, 64]
    - [2, 12596.7]
  - - [512, 512, 40, 64, 512, 512, 64, 64]
    - [2, 12035.3]
  - - [1024, 1024, 64, 96, 1024, 1024, 96, 96]
    - [9, 13355.0]
  - - [1024, 1024, 128, 96, 1024, 1024, 96, 96]
    - [9, 13489.2]
  - - [1024, 1024, 256, 64, 1024, 1024, 64, 64]
    - [9, 12996.2]
  - - [1024, 1024, 32, 64, 1024, 1024, 64, 64]
    - [1, 12608.5]
  - - [1024, 1024, 64, 64, 1024, 1024, 64, 64]
    - [9, 12734.1]
  - - [64, 512, 64, 512, 64, 64, 512, 512]
    - [3, 10222.2]
  - - [64, 512, 256, 512, 64, 64, 512, 512]
    - [2, 12644.2]
  - - [64, 512, 128, 512, 64, 64, 512, 512]
    - [2, 11101.5]
  - - [64, 512, 40, 512, 64, 64, 512, 512]
    - [3, 9372.75]
  - - [96, 1024, 64, 1024, 96, 96, 1024, 1024]
    - [5, 10856.1]
  - - [96, 1024, 128, 1024, 96, 96, 1024, 1024]
    - [6, 12126.3]
  - - [64, 1024, 256, 1024, 64, 64, 1024, 1024]
    - [2, 12270.6]
  - - [64, 1024, 32, 1024, 64, 64, 1024, 1024]
    - [3, 9953.11]
  - - [64, 1024, 64, 1024, 64, 64, 1024, 1024]
    - [3, 10841.5]
- null
