Tensile/Configs/miopen/archives/bert/2020-08-20/exact/vega20_Cijk_Ailk_Bljk_HBH.yaml
- {MinimumRequiredVersion: 4.21.0}
- vega20
- gfx906
- [Device 66a0, Device 66a1, Device 66a7, Device 66af, Vega 20]
    SolutionIndex: 0
    SolutionNameMin: Cijk_Ailk_Bljk_HBH_MT64x64x16_SE_GRVW4_LRVW4_TT4_4_VW4_WG16_16_1_WGM1
    SolutionIndex: 1
    SolutionNameMin: Cijk_Ailk_Bljk_HBH_MT64x64x16_SE_GRVW4_LRVW4_TT4_4_VW4_WG16_16_1_WGM8
    SolutionIndex: 2
    SolutionNameMin: Cijk_Ailk_Bljk_HBH_MT64x64x32_SE_GRVW4_LRVW4_TT4_4_VW4_WG16_16_1_WGM1
    SolutionIndex: 3
    SolutionNameMin: Cijk_Ailk_Bljk_HBH_MT64x64x32_SE_GRVW4_LRVW4_TT4_4_VW4_WG16_16_1_WGM8
    SolutionIndex: 4
    SolutionNameMin: Cijk_Ailk_Bljk_HBH_MT96x64x24_SE_GRVW2_LRVW2_TT6_4_VW2_WG16_16_1_WGM1
    SolutionIndex: 5
    SolutionNameMin: Cijk_Ailk_Bljk_HBH_MT96x64x24_SE_GRVW2_LRVW2_TT6_4_VW2_WG16_16_1_WGM8
    SolutionIndex: 6
    SolutionNameMin: Cijk_Ailk_Bljk_HBH_MT64x128x16_SE_GRVW4_LRVW4_TT4_8_VW4_WG16_16_1_WGM1
    SolutionIndex: 7
    SolutionNameMin: Cijk_Ailk_Bljk_HBH_MT64x128x16_SE_GRVW4_LRVW4_TT4_8_VW4_WG16_16_1_WGM8
    SolutionIndex: 8
    SolutionNameMin: Cijk_Ailk_Bljk_HBH_MT128x64x16_SE_GRVW4_LRVW4_TT8_4_VW4_WG16_16_1_WGM1
    SolutionIndex: 9
    SolutionNameMin: Cijk_Ailk_Bljk_HBH_MT128x64x16_SE_GRVW4_LRVW4_TT8_4_VW4_WG16_16_1_WGM8
    SolutionIndex: 10
    SolutionNameMin: Cijk_Ailk_Bljk_HBH_MT32x32x16_SE_GRVW4_LRVW4_TT4_4_VW4_WG8_8_1_WGM8
- - - [2048, 1024, 1, 2048, 2048, 2048, 2048, 2048]
    - [8, 13152.2]
  - - [2048, 1024, 1, 30592, 2048, 2048, 2048, 30592]
    - [1, 13700.1]
  - - [2048, 1024, 1, 6144, 2048, 2048, 2048, 6144]
    - [1, 13641.2]
  - - [2048, 1024, 1, 8192, 2048, 2048, 2048, 8192]
    - [1, 13524.9]
  - - [8192, 1024, 1, 2048, 8192, 8192, 8192, 2048]
    - [6, 14005.6]
  - - [1024, 8192, 1, 1024, 1024, 1024, 1024, 1024]
    - [1, 14023.0]
  - - [1024, 8192, 1, 30592, 1024, 1024, 1024, 30592]
    - [9, 14217.0]
  - - [1024, 8192, 1, 3072, 1024, 1024, 1024, 3072]
    - [0, 14248.8]
  - - [1024, 8192, 1, 4096, 1024, 1024, 1024, 4096]
    - [0, 14109.6]
  - - [4096, 8192, 1, 1024, 4096, 4096, 4096, 1024]
    - [8, 14294.2]
  - - [1024, 2048, 1, 1024, 1024, 1024, 1024, 1024]
    - [0, 13275.7]
  - - [1024, 2048, 1, 30592, 1024, 1024, 1024, 30592]
    - [1, 13701.6]
  - - [1024, 2048, 1, 3072, 1024, 1024, 1024, 3072]
    - [1, 13587.1]
  - - [1024, 2048, 1, 4096, 1024, 1024, 1024, 4096]
    - [1, 13600.3]
  - - [4096, 2048, 1, 1024, 4096, 4096, 4096, 1024]
    - [0, 14013.9]
  - - [1024, 4096, 1, 1024, 1024, 1024, 1024, 1024]
    - [1, 13765.9]
  - - [1024, 4096, 1, 30592, 1024, 1024, 1024, 30592]
    - [7, 13916.4]
  - - [1024, 4096, 1, 3072, 1024, 1024, 1024, 3072]
    - [1, 13948.3]
  - - [1024, 4096, 1, 4096, 1024, 1024, 1024, 4096]
    - [0, 13850.3]
  - - [4096, 4096, 1, 1024, 4096, 4096, 4096, 1024]
    - [8, 14183.2]
  - - [2560, 2048, 1, 1920, 2560, 2560, 2560, 1920]
    - [1, 13987.2]
  - - [2560, 2048, 1, 2560, 2560, 2560, 2560, 2560]
    - [1, 14026.6]
  - - [2560, 2048, 1, 7680, 2560, 2560, 2560, 7680]
    - [1, 14047.0]
  - - [640, 2048, 1, 2560, 640, 640, 640, 2560]
    - [0, 12803.1]
  - - [1536, 4096, 1, 1536, 1536, 1536, 1536, 1536]
    - [0, 14016.7]
  - - [1536, 4096, 1, 4608, 1536, 1536, 1536, 4608]
    - [1, 14073.9]
  - - [1536, 4096, 1, 50304, 1536, 1536, 1536, 50304]
    - [9, 14080.4]
  - - [1536, 4096, 1, 6144, 1536, 1536, 1536, 6144]
    - [0, 14165.1]
  - - [6144, 4096, 1, 1536, 6144, 6144, 6144, 1536]
    - [6, 14281.4]
  - - [1536, 8192, 1, 1536, 1536, 1536, 1536, 1536]
    - [0, 14172.1]
  - - [1536, 8192, 1, 4608, 1536, 1536, 1536, 4608]
    - [1, 14324.5]
  - - [1536, 8192, 1, 50304, 1536, 1536, 1536, 50304]
    - [9, 14148.3]
  - - [1536, 8192, 1, 6144, 1536, 1536, 1536, 6144]
    - [0, 14344.0]
  - - [6144, 8192, 1, 1536, 6144, 6144, 6144, 1536]
    - [1, 14359.1]
  - - [1024, 16384, 1, 1024, 1024, 1024, 1024, 1024]
    - [1, 14252.0]
  - - [1024, 16384, 1, 3072, 1024, 1024, 1024, 3072]
    - [8, 14266.2]
  - - [1024, 16384, 1, 4096, 1024, 1024, 1024, 4096]
    - [8, 14278.5]
  - - [1024, 16384, 1, 50304, 1024, 1024, 1024, 50304]
    - [9, 14161.5]
  - - [4096, 16384, 1, 1024, 4096, 4096, 4096, 1024]
    - [8, 14355.6]
  - - [1024, 2048, 1, 50304, 1024, 1024, 1024, 50304]
    - [8, 13483.3]
  - - [1024, 4096, 1, 50304, 1024, 1024, 1024, 50304]
    - [9, 14014.1]
  - - [1024, 16, 1, 1024, 1024, 1024, 1024, 1024]
    - [10, 395.689]
  - - [1024, 4, 1, 1024, 1024, 1024, 1024, 1024]
    - [10, 102.2]
  - - [1024, 8, 1, 1024, 1024, 1024, 1024, 1024]
    - [10, 204.8]
  - - [2560, 4, 1, 2560, 2560, 2560, 2560, 2560]
    - [10, 287.944]
  - - [512, 512, 64, 64, 512, 512, 512, 64]
    - [1, 11941.1]
  - - [512, 512, 256, 64, 512, 512, 512, 64]
    - [8, 12704.0]
  - - [512, 512, 128, 64, 512, 512, 512, 64]
    - [1, 12404.6]
  - - [512, 512, 40, 64, 512, 512, 512, 64]
    - [1, 11915.6]
  - - [1024, 1024, 64, 96, 1024, 1024, 1024, 96]
    - [8, 13306.5]
  - - [1024, 1024, 128, 96, 1024, 1024, 1024, 96]
    - [9, 13341.7]
  - - [1024, 1024, 256, 64, 1024, 1024, 1024, 64]
    - [8, 12881.6]
  - - [1024, 1024, 32, 64, 1024, 1024, 1024, 64]
    - [1, 12370.3]
  - - [1024, 1024, 64, 64, 1024, 1024, 1024, 64]
    - [8, 12692.0]
  - - [64, 512, 64, 512, 64, 64, 64, 512]
    - [3, 11355.1]
  - - [64, 512, 256, 512, 64, 64, 64, 512]
    - [1, 12874.6]
  - - [64, 512, 128, 512, 64, 64, 64, 512]
    - [2, 12223.8]
  - - [64, 512, 40, 512, 64, 64, 64, 512]
    - [3, 10070.4]
  - - [96, 1024, 64, 1024, 96, 96, 96, 1024]
    - [4, 11152.3]
  - - [96, 1024, 128, 1024, 96, 96, 96, 1024]
    - [5, 12198.9]
  - - [64, 1024, 256, 1024, 64, 64, 64, 1024]
    - [2, 12875.4]
  - - [64, 1024, 32, 1024, 64, 64, 64, 1024]
    - [2, 10364.3]
  - - [64, 1024, 64, 1024, 64, 64, 64, 1024]
    - [2, 11786.4]
- null
