Tensile/Configs/miopen/Logic/deepbench_conv/vega10_Cijk_Ailk_Bljk_SB.yaml
- {MinimumRequiredVersion: 4.2.0}
- vega10
- gfx900
- [Device 6863, Device 6862, Device 687f, Device 6860, Device 6861]
    SolutionIndex: 0
    SolutionNameMin: Cijk_Ailk_Bljk_SB_MT064x064x16_DTL0_GRVW04_GSU03_PBC0_PGR1_PLR1_TT04_04_USFGRO00_VW01_WG16_16_01_WGM08
    SolutionIndex: 1
    SolutionNameMin: Cijk_Ailk_Bljk_SB_MT128x064x16_DTL0_GRVW01_GSU01_PBC1_PGR0_PLR1_TT04_08_USFGRO01_VW04_WG32_08_01_WGM01
    SolutionIndex: 2
    SolutionNameMin: Cijk_Ailk_Bljk_SB_MT128x032x16_DTL0_GRVW04_GSU05_PBC0_PGR0_PLR1_TT04_04_USFGRO00_VW01_WG32_08_01_WGM64
    SolutionIndex: 3
    SolutionNameMin: Cijk_Ailk_Bljk_SB_MT064x064x16_DTL0_GRVW04_GSU01_PBC0_PGR0_PLR1_TT04_04_USFGRO00_VW04_WG16_16_01_WGM08
    SolutionIndex: 4
    SolutionNameMin: Cijk_Ailk_Bljk_SB_MT064x064x16_DTL0_GRVW04_GSU05_PBC0_PGR0_PLR0_TT04_04_USFGRO00_VW01_WG16_16_01_WGM01
    SolutionIndex: 5
    SolutionNameMin: Cijk_Ailk_Bljk_SB_MT064x064x16_DTL0_GRVW04_GSU01_PBC0_PGR0_PLR1_TT04_04_USFGRO00_VW04_WG16_16_01_WGM01
    SolutionIndex: 6
    SolutionNameMin: Cijk_Ailk_Bljk_SB_MT064x032x16_DTL0_GRVW04_GSU01_PBC0_PGR0_PLR1_TT04_04_USFGRO00_VW04_WG16_08_01_WGM08
    SolutionIndex: 7
    SolutionNameMin: Cijk_Ailk_Bljk_SB_MT064x064x16_DTL0_GRVW01_GSU05_PBC1_PGR0_PLR0_TT04_04_USFGRO01_VW01_WG16_16_01_WGM64
    SolutionIndex: 8
    SolutionNameMin: Cijk_Ailk_Bljk_SB_MT064x064x16_DTL0_GRVW04_GSU01_PBC0_PGR1_PLR1_TT04_04_USFGRO00_VW04_WG16_16_01_WGM64
    SolutionIndex: 9
    SolutionNameMin: Cijk_Ailk_Bljk_SB_MT064x064x16_DTL0_GRVW04_GSU05_PBC0_PGR0_PLR1_TT04_04_USFGRO00_VW01_WG16_16_01_WGM01
    SolutionIndex: 10
    SolutionNameMin: Cijk_Ailk_Bljk_SB_MT128x032x16_DTL0_GRVW04_GSU05_PBC0_PGR0_PLR1_TT04_04_USFGRO00_VW01_WG32_08_01_WGM01
    SolutionIndex: 11
    SolutionNameMin: Cijk_Ailk_Bljk_SB_MT064x064x16_DTL0_GRVW04_GSU01_PBC0_PGR0_PLR0_TT04_04_USFGRO00_VW04_WG16_16_01_WGM01
    SolutionIndex: 12
    SolutionNameMin: Cijk_Ailk_Bljk_SB_MT064x064x16_DTL0_GRVW04_GSU01_PBC0_PGR0_PLR1_TT04_04_USFGRO00_VW04_WG16_16_01_WGM64
    SolutionIndex: 13
    SolutionNameMin: Cijk_Ailk_Bljk_SB_MT128x032x16_DTL0_GRVW04_GSU01_PBC0_PGR0_PLR1_TT04_04_USFGRO00_VW04_WG32_08_01_WGM64
    SolutionIndex: 14
    SolutionNameMin: Cijk_Ailk_Bljk_SB_MT064x064x16_DTL0_GRVW04_GSU01_PBC0_PGR1_PLR1_TT04_04_USFGRO00_VW04_WG16_16_01_WGM01
    SolutionIndex: 15
    SolutionNameMin: Cijk_Ailk_Bljk_SB_MT128x064x16_DTL0_GRVW01_GSU01_PBC1_PGR0_PLR1_TT08_04_USFGRO01_VW04_WG16_16_01_WGM01
    SolutionIndex: 16
    SolutionNameMin: Cijk_Ailk_Bljk_SB_MT128x032x32_DTL0_GRVW04_GSU01_PBC0_PGR0_PLR1_TT04_04_USFGRO00_VW04_WG32_08_01_WGM64
    SolutionIndex: 17
    SolutionNameMin: Cijk_Ailk_Bljk_SB_MT128x032x16_DTL0_GRVW04_GSU01_PBC0_PGR1_PLR1_TT04_04_USFGRO00_VW04_WG32_08_01_WGM01
    SolutionIndex: 18
    SolutionNameMin: Cijk_Ailk_Bljk_SB_MT032x128x16_DTL0_GRVW04_GSU05_PBC0_PGR0_PLR1_TT04_04_USFGRO00_VW01_WG08_32_01_WGM01
    SolutionIndex: 19
    SolutionNameMin: Cijk_Ailk_Bljk_SB_MT064x064x16_DTL0_GRVW01_GSU05_PBC1_PGR0_PLR0_TT04_04_USFGRO01_VW01_WG16_16_01_WGM01
    SolutionIndex: 20
    SolutionNameMin: Cijk_Ailk_Bljk_SB_MT064x064x32_DTL0_GRVW04_GSU05_PBC0_PGR0_PLR1_TT04_04_USFGRO00_VW01_WG16_16_01_WGM01
    SolutionIndex: 21
    SolutionNameMin: Cijk_Ailk_Bljk_SB_MT064x064x16_DTL0_GRVW04_GSU03_PBC0_PGR0_PLR0_TT04_04_USFGRO00_VW01_WG16_16_01_WGM08
    SolutionIndex: 22
    SolutionNameMin: Cijk_Ailk_Bljk_SB_MT128x032x16_DTL0_GRVW04_GSU01_PBC0_PGR0_PLR1_TT04_04_USFGRO00_VW04_WG32_08_01_WGM01
    SolutionIndex: 23
    SolutionNameMin: Cijk_Ailk_Bljk_SB_MT128x032x16_DTL0_GRVW04_GSU05_PBC0_PGR0_PLR0_TT04_04_USFGRO00_VW01_WG32_08_01_WGM64
    SolutionIndex: 24
    SolutionNameMin: Cijk_Ailk_Bljk_SB_MT128x064x16_DTL0_GRVW01_GSU01_PBC1_PGR0_PLR1_TT04_08_USFGRO01_VW04_WG32_08_01_WGM64
    SolutionIndex: 25
    SolutionNameMin: Cijk_Ailk_Bljk_SB_MT064x064x32_DTL0_GRVW04_GSU05_PBC0_PGR1_PLR1_TT04_04_USFGRO00_VW01_WG16_16_01_WGM01
    SolutionIndex: 26
    SolutionNameMin: Cijk_Ailk_Bljk_SB_MT128x064x16_DTL0_GRVW04_GSU01_PBC0_PGR1_PLR1_TT04_08_USFGRO00_VW04_WG32_08_01_WGM01
    SolutionIndex: 27
    SolutionNameMin: Cijk_Ailk_Bljk_SB_MT064x016x16_DTL0_GRVW01_GSU05_PBC1_PGR0_PLR1_TT02_02_USFGRO01_VW01_WG32_08_01_WGM01
    SolutionIndex: 28
    SolutionNameMin: Cijk_Ailk_Bljk_SB_MT032x032x32_DTL0_GRVW04_GSU05_PBC0_PGR0_PLR1_TT02_02_USFGRO00_VW01_WG16_16_01_WGM01
    SolutionIndex: 29
    SolutionNameMin: Cijk_Ailk_Bljk_SB_MT064x064x16_DTL0_GRVW04_GSU01_PBC0_PGR1_PLR1_TT04_04_USFGRO00_VW04_WG16_16_01_WGM08
- - - [196, 192, 16, 512]
    - [16, 4636.5]
  - - [6272, 512, 1, 128]
    - [12, 7789.98]
  - - [784, 128, 8, 512]
    - [26, 6188.57]
  - - [784, 512, 16, 128]
    - [3, 8493.97]
  - - [3136, 256, 1, 1024]
    - [23, 6980.85]
  - - [12544, 512, 1, 128]
    - [3, 8824.62]
  - - [100352, 64, 1, 64]
    - [15, 5235.61]
  - - [784, 128, 16, 512]
    - [22, 7202.68]
  - - [3136, 256, 8, 64]
    - [12, 7717.18]
  - - [784, 2048, 1, 512]
    - [22, 7316.65]
  - - [3136, 64, 8, 256]
    - [11, 6628.61]
  - - [784, 256, 1, 832]
    - [18, 5039.06]
  - - [49, 512, 16, 512]
    - [27, 2658.75]
  - - [3136, 64, 16, 256]
    - [5, 7560.67]
  - - [49, 256, 16, 832]
    - [0, 3986.74]
  - - [196, 256, 16, 256]
    - [14, 5515.43]
  - - [3136, 256, 1, 256]
    - [8, 5838.53]
  - - [3136, 1024, 1, 256]
    - [8, 8512.72]
  - - [392, 512, 1, 2048]
    - [9, 5142.49]
  - - [784, 64, 16, 192]
    - [8, 5160.9]
  - - [784, 512, 1, 2048]
    - [4, 6832.33]
  - - [12544, 64, 8, 64]
    - [6, 5531.21]
  - - [50176, 64, 1, 256]
    - [13, 7307.38]
  - - [49, 512, 8, 512]
    - [28, 2361.16]
  - - [12544, 128, 1, 512]
    - [29, 7400.94]
  - - [196, 256, 8, 1024]
    - [10, 4616.72]
  - - [784, 512, 8, 128]
    - [14, 7811.01]
  - - [196, 1024, 16, 256]
    - [8, 6848.5]
  - - [25088, 64, 1, 256]
    - [14, 6721.06]
  - - [1568, 256, 1, 256]
    - [14, 4849.13]
  - - [196, 256, 8, 256]
    - [14, 4558.48]
  - - [200704, 64, 1, 64]
    - [26, 5269.04]
  - - [3136, 256, 16, 64]
    - [3, 8322.72]
  - - [1568, 256, 1, 1024]
    - [2, 5904.14]
  - - [196, 256, 16, 1024]
    - [2, 5407.06]
  - - [49, 512, 16, 2048]
    - [20, 4177.92]
  - - [196, 1024, 8, 256]
    - [14, 6221.89]
  - - [784, 512, 1, 512]
    - [17, 5432.44]
  - - [49, 512, 8, 2048]
    - [25, 3302.94]
  - - [6272, 128, 1, 512]
    - [26, 6310.24]
  - - [49, 2048, 16, 512]
    - [19, 4013.99]
  - - [392, 2048, 1, 512]
    - [26, 6235.34]
  - - [392, 512, 1, 512]
    - [17, 3724.31]
  - - [49, 2048, 8, 512]
    - [7, 3321.92]
  - - [50176, 256, 1, 64]
    - [24, 7717.11]
  - - [3136, 192, 1, 512]
    - [21, 5704.1]
  - - [1568, 1024, 1, 256]
    - [14, 7298.16]
  - - [12544, 64, 16, 64]
    - [1, 5844.45]
  - - [12544, 64, 1, 192]
    - [29, 5261.0]
  - - [25088, 256, 1, 64]
    - [12, 7344.54]
- null
