Tensile/Configs/miopen/Logic/deepbench_conv/vega10_Cijk_Ailk_Bljk_SB.yaml
- {MinimumRequiredVersion: 4.2.0}
- vega10
- gfx900
- [Device 6863, Device 6862, Device 687f, Device 6860, Device 6861, Device 6864]
    SolutionIndex: 0
    SolutionNameMin: Cijk_Ailk_Bljk_SB_MT128x032x16_DTL0_GRVW01_GSU01_LPB04_PBC1_PGR0_PLR1_TT04_04_USFGRO01_VW04_WG32_08_01_WGM08
    SolutionIndex: 1
    SolutionNameMin: Cijk_Ailk_Bljk_SB_MT064x016x16_DTL0_GRVW01_GSU05_LPB01_PBC1_PGR0_PLR1_TT02_02_USFGRO01_VW01_WG32_08_01_WGM01
    SolutionIndex: 2
    SolutionNameMin: Cijk_Ailk_Bljk_SB_MT032x032x32_DTL0_GRVW01_GSU03_LPB01_PBC1_PGR0_PLR1_TT02_02_USFGRO01_VW01_WG16_16_01_WGM01
    SolutionIndex: 3
    SolutionNameMin: Cijk_Ailk_Bljk_SB_MT128x032x16_DTL0_GRVW01_GSU03_LPB01_PBC1_PGR0_PLR1_TT04_04_USFGRO01_VW01_WG32_08_01_WGM64
    SolutionIndex: 4
    SolutionNameMin: Cijk_Ailk_Bljk_SB_MT064x064x16_DTL0_GRVW04_GSU01_LPB04_PBC0_PGR0_PLR1_TT04_04_USFGRO00_VW04_WG16_16_01_WGM08
    SolutionIndex: 5
    SolutionNameMin: Cijk_Ailk_Bljk_SB_MT128x032x16_DTL0_GRVW04_GSU01_LPB04_PBC0_PGR0_PLR1_TT04_04_USFGRO00_VW04_WG32_08_01_WGM08
    SolutionIndex: 6
    SolutionNameMin: Cijk_Ailk_Bljk_SB_MT064x064x16_DTL0_GRVW01_GSU01_LPB04_PBC1_PGR0_PLR1_TT04_04_USFGRO01_VW04_WG16_16_01_WGM08
    SolutionIndex: 7
    SolutionNameMin: Cijk_Ailk_Bljk_SB_MT064x032x32_DTL0_GRVW01_GSU05_LPB02_PBC1_PGR0_PLR1_TT04_04_USFGRO01_VW02_WG16_08_01_WGM64
    SolutionIndex: 8
    SolutionNameMin: Cijk_Ailk_Bljk_SB_MT128x032x16_DTL0_GRVW04_GSU01_LPB04_PBC0_PGR1_PLR1_TT04_04_USFGRO00_VW04_WG32_08_01_WGM08
    SolutionIndex: 9
    SolutionNameMin: Cijk_Ailk_Bljk_SB_MT064x064x16_DTL0_GRVW04_GSU01_LPB00_PBC0_PGR1_PLR1_TT04_04_USFGRO00_VW04_WG16_16_01_WGM64
    SolutionIndex: 10
    SolutionNameMin: Cijk_Ailk_Bljk_SB_MT032x128x16_DTL0_GRVW01_GSU05_LPB01_PBC1_PGR0_PLR1_TT04_04_USFGRO01_VW01_WG08_32_01_WGM01
    SolutionIndex: 11
    SolutionNameMin: Cijk_Ailk_Bljk_SB_MT128x032x16_DTL0_GRVW04_GSU01_LPB04_PBC0_PGR1_PLR1_TT04_04_USFGRO00_VW04_WG32_08_01_WGM01
    SolutionIndex: 12
    SolutionNameMin: Cijk_Ailk_Bljk_SB_MT064x064x32_DTL0_GRVW01_GSU03_LPB01_PBC1_PGR0_PLR1_TT04_04_USFGRO01_VW01_WG16_16_01_WGM01
    SolutionIndex: 13
    SolutionNameMin: Cijk_Ailk_Bljk_SB_MT064x064x16_DTL0_GRVW04_GSU01_LPB04_PBC0_PGR1_PLR1_TT04_04_USFGRO00_VW04_WG16_16_01_WGM01
    SolutionIndex: 14
    SolutionNameMin: Cijk_Ailk_Bljk_SB_MT128x032x16_DTL0_GRVW04_GSU05_LPB02_PBC0_PGR0_PLR1_TT04_04_USFGRO00_VW02_WG32_08_01_WGM01
    SolutionIndex: 15
    SolutionNameMin: Cijk_Ailk_Bljk_SB_MT064x064x16_DTL0_GRVW01_GSU01_LPB04_PBC1_PGR0_PLR1_TT04_04_USFGRO01_VW04_WG16_16_01_WGM64
    SolutionIndex: 16
    SolutionNameMin: Cijk_Ailk_Bljk_SB_MT064x064x16_DTL0_GRVW01_GSU01_LPB04_PBC1_PGR0_PLR1_TT04_04_USFGRO01_VW04_WG16_16_01_WGM01
    SolutionIndex: 17
    SolutionNameMin: Cijk_Ailk_Bljk_SB_MT128x064x16_DTL0_GRVW04_GSU01_LPB00_PBC0_PGR1_PLR1_TT08_04_USFGRO00_VW04_WG16_16_01_WGM08
    SolutionIndex: 18
    SolutionNameMin: Cijk_Ailk_Bljk_SB_MT064x064x16_DTL0_GRVW01_GSU05_LPB00_PBC1_PGR0_PLR0_TT04_04_USFGRO01_VW01_WG16_16_01_WGM01
    SolutionIndex: 19
    SolutionNameMin: Cijk_Ailk_Bljk_SB_MT064x064x16_DTL0_GRVW04_GSU03_LPB01_PBC0_PGR0_PLR0_TT04_04_USFGRO00_VW01_WG16_16_01_WGM08
    SolutionIndex: 20
    SolutionNameMin: Cijk_Ailk_Bljk_SB_MT128x032x08_DTL0_GRVW04_GSU01_LPB04_PBC0_PGR1_PLR1_TT04_04_USFGRO00_VW04_WG32_08_01_WGM64
    SolutionIndex: 21
    SolutionNameMin: Cijk_Ailk_Bljk_SB_MT064x064x16_DTL0_GRVW04_GSU01_LPB04_PBC0_PGR0_PLR1_TT04_04_USFGRO00_VW04_WG16_16_01_WGM64
    SolutionIndex: 22
    SolutionNameMin: Cijk_Ailk_Bljk_SB_MT128x032x08_DTL0_GRVW04_GSU01_LPB01_PBC0_PGR0_PLR1_TT04_04_USFGRO00_VW01_WG32_08_01_WGM08
    SolutionIndex: 23
    SolutionNameMin: Cijk_Ailk_Bljk_SB_MT128x032x16_DTL0_GRVW01_GSU05_LPB01_PBC1_PGR0_PLR1_TT04_04_USFGRO01_VW01_WG32_08_01_WGM64
    SolutionIndex: 24
    SolutionNameMin: Cijk_Ailk_Bljk_SB_MT256x032x08_DTL0_GRVW04_GSU01_LPB00_PBC0_PGR1_PLR1_TT08_04_USFGRO00_VW04_WG32_08_01_WGM01
    SolutionIndex: 25
    SolutionNameMin: Cijk_Ailk_Bljk_SB_MT128x032x16_DTL0_GRVW01_GSU05_LPB01_PBC1_PGR0_PLR1_TT04_04_USFGRO01_VW01_WG32_08_01_WGM01
    SolutionIndex: 26
    SolutionNameMin: Cijk_Ailk_Bljk_SB_MT064x064x32_DTL0_GRVW04_GSU05_LPB02_PBC0_PGR0_PLR1_TT04_04_USFGRO00_VW02_WG16_16_01_WGM08
    SolutionIndex: 27
    SolutionNameMin: Cijk_Ailk_Bljk_SB_MT128x032x16_DTL0_GRVW04_GSU05_LPB01_PBC0_PGR0_PLR1_TT04_04_USFGRO00_VW01_WG32_08_01_WGM08
    SolutionIndex: 28
    SolutionNameMin: Cijk_Ailk_Bljk_SB_MT064x064x16_DTL0_GRVW04_GSU05_LPB02_PBC0_PGR0_PLR1_TT04_04_USFGRO00_VW02_WG16_16_01_WGM01
    SolutionIndex: 29
    SolutionNameMin: Cijk_Ailk_Bljk_SB_MT064x064x16_DTL0_GRVW04_GSU01_LPB04_PBC0_PGR0_PLR1_TT04_04_USFGRO00_VW04_WG16_16_01_WGM01
    SolutionIndex: 30
    SolutionNameMin: Cijk_Ailk_Bljk_SB_MT064x032x08_DTL0_GRVW01_GSU01_LPB04_PBC1_PGR1_PLR1_TT04_04_USFGRO01_VW04_WG16_08_01_WGM64
    SolutionIndex: 31
    SolutionNameMin: Cijk_Ailk_Bljk_SB_MT128x032x08_DTL0_GRVW01_GSU01_LPB00_PBC1_PGR0_PLR1_TT04_04_USFGRO01_VW04_WG32_08_01_WGM64
    SolutionIndex: 32
    SolutionNameMin: Cijk_Ailk_Bljk_SB_MT128x032x16_DTL0_GRVW04_GSU01_LPB04_PBC0_PGR0_PLR1_TT04_04_USFGRO00_VW04_WG32_08_01_WGM64
    SolutionIndex: 33
    SolutionNameMin: Cijk_Ailk_Bljk_SB_MT128x064x16_DTL0_GRVW01_GSU01_LPB04_PBC1_PGR0_PLR1_TT04_08_USFGRO01_VW04_WG32_08_01_WGM64
    SolutionIndex: 34
    SolutionNameMin: Cijk_Ailk_Bljk_SB_MT128x032x16_DTL0_GRVW01_GSU03_LPB01_PBC1_PGR0_PLR1_TT04_04_USFGRO01_VW01_WG32_08_01_WGM01
- - - [196, 192, 16, 512]
    - [32, 4696.75]
  - - [6272, 512, 1, 128]
    - [21, 8016.79]
  - - [784, 128, 8, 512]
    - [24, 6275.92]
  - - [784, 512, 16, 128]
    - [29, 8838.15]
  - - [3136, 256, 1, 1024]
    - [23, 7238.75]
  - - [12544, 512, 1, 128]
    - [4, 9024.43]
  - - [100352, 64, 1, 64]
    - [31, 5447.82]
  - - [784, 128, 16, 512]
    - [5, 7540.93]
  - - [3136, 256, 8, 64]
    - [6, 7864.09]
  - - [784, 2048, 1, 512]
    - [5, 7635.61]
  - - [3136, 64, 8, 256]
    - [16, 6752.54]
  - - [784, 256, 1, 832]
    - [10, 5093.66]
  - - [49, 512, 16, 512]
    - [2, 2916.32]
  - - [3136, 64, 16, 256]
    - [16, 7758.57]
  - - [49, 256, 16, 832]
    - [12, 4000.36]
  - - [196, 256, 16, 256]
    - [9, 5422.33]
  - - [3136, 256, 1, 256]
    - [30, 6021.04]
  - - [3136, 1024, 1, 256]
    - [4, 8811.19]
  - - [392, 512, 1, 2048]
    - [14, 5442.69]
  - - [784, 64, 16, 192]
    - [20, 5391.92]
  - - [784, 512, 1, 2048]
    - [28, 6926.47]
  - - [12544, 64, 8, 64]
    - [5, 5568.55]
  - - [50176, 64, 1, 256]
    - [32, 7463.05]
  - - [49, 512, 8, 512]
    - [1, 2478.63]
  - - [12544, 128, 1, 512]
    - [32, 7763.78]
  - - [196, 256, 8, 1024]
    - [25, 4812.77]
  - - [784, 512, 8, 128]
    - [29, 7983.6]
  - - [196, 1024, 16, 256]
    - [4, 7061.87]
  - - [25088, 64, 1, 256]
    - [29, 6897.54]
  - - [1568, 256, 1, 256]
    - [11, 4965.77]
  - - [196, 256, 8, 256]
    - [8, 4601.98]
  - - [200704, 64, 1, 64]
    - [22, 5484.0]
  - - [3136, 256, 16, 64]
    - [15, 8370.92]
  - - [1568, 256, 1, 1024]
    - [27, 6103.61]
  - - [196, 256, 16, 1024]
    - [34, 5686.32]
  - - [49, 512, 16, 2048]
    - [26, 4372.27]
  - - [196, 1024, 8, 256]
    - [16, 6269.12]
  - - [784, 512, 1, 512]
    - [8, 5600.85]
  - - [49, 512, 8, 2048]
    - [7, 3496.75]
  - - [6272, 128, 1, 512]
    - [3, 6422.4]
  - - [49, 2048, 16, 512]
    - [18, 4061.94]
  - - [392, 2048, 1, 512]
    - [17, 6110.06]
  - - [392, 512, 1, 512]
    - [13, 3802.76]
  - - [49, 2048, 8, 512]
    - [18, 3346.92]
  - - [50176, 256, 1, 64]
    - [33, 8175.6]
  - - [3136, 192, 1, 512]
    - [19, 5890.07]
  - - [1568, 1024, 1, 256]
    - [20, 7363.24]
  - - [12544, 64, 16, 64]
    - [5, 5883.09]
  - - [12544, 64, 1, 192]
    - [20, 5473.62]
  - - [25088, 256, 1, 64]
    - [0, 7665.99]
- null
