test_dir/py38/lib/python3.6/site-packages/Tensile/Configs/miopen/archives/transformer/2019-11-05/exact/vega20_Cijk_Ailk_Bljk_SB.yaml
- {MinimumRequiredVersion: 4.13.0}
- vega20
- gfx906
- [Device 66a0, Device 66a1, Device 66a7, Vega 20]
    SolutionIndex: 0
    SolutionNameMin: Cijk_Ailk_Bljk_SB_MT64x64x8_SE_DTL0_EPS1_FL0_GRVW4_LPB0_PGR1_PLR1_TT4_4_USFGRO0_VW2_WG16_16_1_WGM8
    SolutionIndex: 1
    SolutionNameMin: Cijk_Ailk_Bljk_SB_MT64x64x16_SE_DTL0_EPS1_FL0_GRVW4_LPB0_PGR1_PLR1_TT4_4_USFGRO0_VW4_WG16_16_1_WGM1
    SolutionIndex: 2
    SolutionNameMin: Cijk_Ailk_Bljk_SB_MT64x64x16_SE_DTL0_EPS1_FL0_GRVW4_LPB0_PGR1_PLR1_TT4_4_USFGRO0_VW4_WG16_16_1_WGM8
    SolutionIndex: 3
    SolutionNameMin: Cijk_Ailk_Bljk_SB_MT64x64x8_SE_DTL0_EPS1_FL1_GRVW4_LPB0_PGR1_PLR1_TT4_4_USFGRO0_VW2_WG16_16_1_WGM1
    SolutionIndex: 4
    SolutionNameMin: Cijk_Ailk_Bljk_SB_MT64x64x16_SE_DTL0_EPS1_FL1_GRVW4_LPB0_PGR1_PLR1_TT4_4_USFGRO0_VW4_WG16_16_1_WGM1
    SolutionIndex: 5
    SolutionNameMin: Cijk_Ailk_Bljk_SB_MT64x64x16_SE_DTL0_EPS1_FL1_GRVW4_LPB0_PGR1_PLR1_TT4_4_USFGRO0_VW4_WG16_16_1_WGM8
    SolutionIndex: 6
    SolutionNameMin: Cijk_Ailk_Bljk_SB_MT64x64x32_SE_DTL0_EPS1_FL1_GRVW4_LPB0_PGR1_PLR1_TT4_4_USFGRO0_VW4_WG16_16_1_WGM1
    SolutionIndex: 7
    SolutionNameMin: Cijk_Ailk_Bljk_SB_MT96x64x16_SE_DTL0_EPS1_FL0_GRVW2_LPB0_PGR1_PLR1_TT6_4_USFGRO0_VW2_WG16_16_1_WGM1
    SolutionIndex: 8
    SolutionNameMin: Cijk_Ailk_Bljk_SB_MT96x64x8_SE_DTL0_EPS1_FL1_GRVW2_LPB0_PGR1_PLR1_TT6_4_USFGRO0_VW2_WG16_16_1_WGM1
    SolutionIndex: 9
    SolutionNameMin: Cijk_Ailk_Bljk_SB_MT96x64x8_SE_DTL0_EPS1_FL1_GRVW2_LPB0_PGR1_PLR1_TT6_4_USFGRO0_VW2_WG16_16_1_WGM8
    SolutionIndex: 10
    SolutionNameMin: Cijk_Ailk_Bljk_SB_MT96x64x16_SE_DTL0_EPS1_FL1_GRVW2_LPB0_PGR1_PLR1_TT6_4_USFGRO0_VW2_WG16_16_1_WGM1
    SolutionIndex: 11
    SolutionNameMin: Cijk_Ailk_Bljk_SB_MT64x96x8_SE_DTL0_EPS1_FL1_GRVW4_LPB0_PGR1_PLR0_TT4_6_USFGRO0_VW2_WG16_16_1_WGM8
    SolutionIndex: 12
    SolutionNameMin: Cijk_Ailk_Bljk_SB_MT64x96x16_SE_DTL0_EPS1_FL0_GRVW2_LPB0_PGR1_PLR1_TT4_6_USFGRO0_VW2_WG16_16_1_WGM8
    SolutionIndex: 13
    SolutionNameMin: Cijk_Ailk_Bljk_SB_MT64x96x8_SE_DTL0_EPS1_FL1_GRVW4_LPB0_PGR1_PLR1_TT4_6_USFGRO0_VW2_WG16_16_1_WGM1
    SolutionIndex: 14
    SolutionNameMin: Cijk_Ailk_Bljk_SB_MT64x96x8_SE_DTL0_EPS1_FL1_GRVW4_LPB0_PGR1_PLR1_TT4_6_USFGRO0_VW2_WG16_16_1_WGM8
    SolutionIndex: 15
    SolutionNameMin: Cijk_Ailk_Bljk_SB_MT128x64x8_SE_DTL0_EPS1_FL0_GRVW2_LPB0_PGR1_PLR0_TT8_4_USFGRO0_VW2_WG16_16_1_WGM1
    SolutionIndex: 16
    SolutionNameMin: Cijk_Ailk_Bljk_SB_MT128x64x8_SE_DTL0_EPS1_FL0_GRVW2_LPB0_PGR1_PLR0_TT8_4_USFGRO0_VW2_WG16_16_1_WGM8
    SolutionIndex: 17
    SolutionNameMin: Cijk_Ailk_Bljk_SB_MT128x64x8_SE_DTL0_EPS1_FL0_GRVW4_LPB0_PGR1_PLR0_TT8_4_USFGRO0_VW4_WG16_16_1_WGM8
    SolutionIndex: 18
    SolutionNameMin: Cijk_Ailk_Bljk_SB_MT128x64x8_SE_DTL0_EPS1_FL1_GRVW2_LPB0_PGR1_PLR0_TT8_4_USFGRO0_VW2_WG16_16_1_WGM1
    SolutionIndex: 19
    SolutionNameMin: Cijk_Ailk_Bljk_SB_MT128x64x8_SE_DTL0_EPS1_FL1_GRVW2_LPB0_PGR1_PLR0_TT8_4_USFGRO0_VW2_WG16_16_1_WGM8
    SolutionIndex: 20
    SolutionNameMin: Cijk_Ailk_Bljk_SB_MT128x64x8_SE_DTL0_EPS1_FL1_GRVW4_LPB0_PGR1_PLR0_TT8_4_USFGRO0_VW4_WG16_16_1_WGM8
    SolutionIndex: 21
    SolutionNameMin: Cijk_Ailk_Bljk_SB_MT128x64x8_SE_DTL0_EPS1_FL0_GRVW1_LPB0_PGR1_PLR1_TT8_4_USFGRO1_VW4_WG16_16_1_WGM8
    SolutionIndex: 22
    SolutionNameMin: Cijk_Ailk_Bljk_SB_MT128x64x8_SE_DTL0_EPS1_FL0_GRVW2_LPB0_PGR1_PLR1_TT8_4_USFGRO0_VW2_WG16_16_1_WGM1
    SolutionIndex: 23
    SolutionNameMin: Cijk_Ailk_Bljk_SB_MT128x64x8_SE_DTL0_EPS1_FL0_GRVW2_LPB0_PGR1_PLR1_TT8_4_USFGRO0_VW2_WG16_16_1_WGM8
    SolutionIndex: 24
    SolutionNameMin: Cijk_Ailk_Bljk_SB_MT128x64x8_SE_DTL0_EPS1_FL0_GRVW4_LPB0_PGR1_PLR1_TT8_4_USFGRO0_VW4_WG16_16_1_WGM1
    SolutionIndex: 25
    SolutionNameMin: Cijk_Ailk_Bljk_SB_MT128x64x8_SE_DTL0_EPS1_FL0_GRVW4_LPB0_PGR1_PLR1_TT8_4_USFGRO0_VW4_WG16_16_1_WGM8
    SolutionIndex: 26
    SolutionNameMin: Cijk_Ailk_Bljk_SB_MT128x64x16_SE_DTL0_EPS1_FL0_GRVW4_LPB0_PGR1_PLR1_TT8_4_USFGRO0_VW4_WG16_16_1_WGM1
    SolutionIndex: 27
    SolutionNameMin: Cijk_Ailk_Bljk_SB_MT128x64x16_SE_DTL0_EPS1_FL0_GRVW4_LPB0_PGR1_PLR1_TT8_4_USFGRO0_VW4_WG16_16_1_WGM8
    SolutionIndex: 28
    SolutionNameMin: Cijk_Ailk_Bljk_SB_MT128x64x8_SE_DTL0_EPS1_FL1_GRVW2_LPB0_PGR1_PLR1_TT8_4_USFGRO0_VW2_WG16_16_1_WGM1
    SolutionIndex: 29
    SolutionNameMin: Cijk_Ailk_Bljk_SB_MT128x64x8_SE_DTL0_EPS1_FL1_GRVW2_LPB0_PGR1_PLR1_TT8_4_USFGRO0_VW2_WG16_16_1_WGM8
    SolutionIndex: 30
    SolutionNameMin: Cijk_Ailk_Bljk_SB_MT128x64x8_SE_DTL0_EPS1_FL1_GRVW4_LPB0_PGR1_PLR1_TT8_4_USFGRO0_VW4_WG16_16_1_WGM1
    SolutionIndex: 31
    SolutionNameMin: Cijk_Ailk_Bljk_SB_MT128x64x8_SE_DTL0_EPS1_FL1_GRVW4_LPB0_PGR1_PLR1_TT8_4_USFGRO0_VW4_WG16_16_1_WGM8
    SolutionIndex: 32
    SolutionNameMin: Cijk_Ailk_Bljk_SB_MT128x64x16_SE_DTL0_EPS1_FL1_GRVW4_LPB0_PGR1_PLR1_TT8_4_USFGRO0_VW4_WG16_16_1_WGM1
    SolutionIndex: 33
    SolutionNameMin: Cijk_Ailk_Bljk_SB_MT128x64x16_SE_DTL0_EPS1_FL1_GRVW4_LPB0_PGR1_PLR1_TT8_4_USFGRO0_VW4_WG16_16_1_WGM8
    SolutionIndex: 34
    SolutionNameMin: Cijk_Ailk_Bljk_SB_MT128x128x16_SE_DTL0_EPS1_FL0_GRVW4_LPB0_PGR1_PLR0_TT8_8_USFGRO0_VW4_WG16_16_1_WGM1
    SolutionIndex: 35
    SolutionNameMin: Cijk_Ailk_Bljk_SB_MT128x128x16_SE_DTL0_EPS1_FL0_GRVW4_LPB0_PGR1_PLR0_TT8_8_USFGRO0_VW4_WG16_16_1_WGM8
    SolutionIndex: 36
    SolutionNameMin: Cijk_Ailk_Bljk_SB_MT128x128x16_SE_DTL0_EPS1_FL1_GRVW4_LPB0_PGR1_PLR0_TT8_8_USFGRO0_VW4_WG16_16_1_WGM1
    SolutionIndex: 37
    SolutionNameMin: Cijk_Ailk_Bljk_SB_MT128x128x16_SE_DTL0_EPS1_FL1_GRVW4_LPB0_PGR1_PLR0_TT8_8_USFGRO0_VW4_WG16_16_1_WGM8
    SolutionIndex: 38
    SolutionNameMin: Cijk_Ailk_Bljk_SB_MT128x128x8_SE_DTL0_EPS1_FL0_GRVW1_LPB0_PGR1_PLR1_TT8_8_USFGRO1_VW4_WG16_16_1_WGM1
    SolutionIndex: 39
    SolutionNameMin: Cijk_Ailk_Bljk_SB_MT128x128x8_SE_DTL0_EPS1_FL0_GRVW1_LPB0_PGR1_PLR1_TT8_8_USFGRO1_VW4_WG16_16_1_WGM8
    SolutionIndex: 40
    SolutionNameMin: Cijk_Ailk_Bljk_SB_MT128x128x16_SE_DTL0_EPS1_FL0_GRVW4_LPB0_PGR1_PLR1_TT8_8_USFGRO0_VW4_WG16_16_1_WGM1
    SolutionIndex: 41
    SolutionNameMin: Cijk_Ailk_Bljk_SB_MT128x128x16_SE_DTL0_EPS1_FL0_GRVW4_LPB0_PGR1_PLR1_TT8_8_USFGRO0_VW4_WG16_16_1_WGM8
    SolutionIndex: 42
    SolutionNameMin: Cijk_Ailk_Bljk_SB_MT128x128x8_SE_DTL0_EPS1_FL1_GRVW4_LPB0_PGR1_PLR1_TT8_8_USFGRO0_VW4_WG16_16_1_WGM1
    SolutionIndex: 43
    SolutionNameMin: Cijk_Ailk_Bljk_SB_MT128x128x16_SE_DTL0_EPS1_FL1_GRVW4_LPB0_PGR1_PLR1_TT8_8_USFGRO0_VW4_WG16_16_1_WGM1
    SolutionIndex: 44
    SolutionNameMin: Cijk_Ailk_Bljk_SB_MT128x128x16_SE_DTL0_EPS1_FL1_GRVW4_LPB0_PGR1_PLR1_TT8_8_USFGRO0_VW4_WG16_16_1_WGM8
    SolutionIndex: 45
    SolutionNameMin: Cijk_Ailk_Bljk_SB_MT64x32x32_SE_DTL0_EPS0_FL0_GRVW1_LPB2_PGR0_PLR0_TT4_2_USFGRO1_VW2_WG16_16_1_WGM1
    SolutionIndex: 46
    SolutionNameMin: Cijk_Ailk_Bljk_SB_MT64x32x8_SE_DTL0_EPS0_FL0_GRVW1_LPB2_PGR0_PLR1_TT4_2_USFGRO1_VW2_WG16_16_1_WGM1
    SolutionIndex: 47
    SolutionNameMin: Cijk_Ailk_Bljk_SB_MT64x32x16_SE_DTL0_EPS0_FL0_GRVW1_LPB2_PGR0_PLR1_TT4_2_USFGRO1_VW2_WG16_16_1_WGM1
    SolutionIndex: 48
    SolutionNameMin: Cijk_Ailk_Bljk_SB_MT64x32x8_SE_DTL0_EPS1_FL0_GRVW1_LPB2_PGR1_PLR1_TT4_2_USFGRO1_VW2_WG16_16_1_WGM1
    SolutionIndex: 49
    SolutionNameMin: Cijk_Ailk_Bljk_SB_MT64x32x8_SE_DTL0_EPS1_FL0_GRVW1_LPB2_PGR1_PLR1_TT4_2_USFGRO1_VW2_WG16_16_1_WGM8
    SolutionIndex: 50
    SolutionNameMin: Cijk_Ailk_Bljk_SB_MT32x64x16_SE_DTL0_EPS0_FL0_GRVW1_LPB2_PGR0_PLR1_TT2_4_USFGRO1_VW2_WG16_16_1_WGM1
    SolutionIndex: 51
    SolutionNameMin: Cijk_Ailk_Bljk_SB_MT32x64x8_SE_DTL0_EPS1_FL0_GRVW2_LPB2_PGR1_PLR1_TT2_4_USFGRO1_VW2_WG16_16_1_WGM1
    SolutionIndex: 52
    SolutionNameMin: Cijk_Ailk_Bljk_SB_MT64x64x16_SE_DTL0_EPS0_FL1_GRVW4_LPB4_PGR0_PLR1_TT4_4_USFGRO0_VW4_WG16_16_1_WGM1
    SolutionIndex: 53
    SolutionNameMin: Cijk_Ailk_Bljk_SB_MT64x64x8_SE_DTL0_EPS1_FL0_GRVW2_LPB2_PGR1_PLR1_TT4_4_USFGRO0_VW2_WG16_16_1_WGM1
    SolutionIndex: 54
    SolutionNameMin: Cijk_Ailk_Bljk_SB_MT64x64x8_SE_DTL0_EPS1_FL0_GRVW4_LPB2_PGR1_PLR1_TT4_4_USFGRO0_VW2_WG16_16_1_WGM1
    SolutionIndex: 55
    SolutionNameMin: Cijk_Ailk_Bljk_SB_MT64x64x8_SE_DTL0_EPS1_FL1_GRVW4_LPB2_PGR1_PLR1_TT4_4_USFGRO0_VW2_WG16_16_1_WGM1
    SolutionIndex: 56
    SolutionNameMin: Cijk_Ailk_Bljk_SB_MT32x64x32_SE_DTL0_EPS1_FL0_GRVW2_LPB2_PGR1_PLR1_TT4_4_USFGRO0_VW2_WG8_16_2_WGM8
    SolutionIndex: 57
    SolutionNameMin: Cijk_Ailk_Bljk_SB_MT32x64x32_SE_DTL0_EPS1_FL1_GRVW2_LPB2_PGR1_PLR1_TT4_4_USFGRO0_VW2_WG8_16_2_WGM8
    SolutionIndex: 58
    SolutionNameMin: Cijk_Ailk_Bljk_SB_MT64x32x16_SE_DTL0_EPS1_FL0_GRVW4_LPB4_PGR1_PLR1_TT4_4_USFGRO0_VW4_WG16_8_2_WGM1
    SolutionIndex: 59
    SolutionNameMin: Cijk_Ailk_Bljk_SB_MT64x32x16_SE_DTL0_EPS1_FL0_GRVW4_LPB4_PGR1_PLR1_TT4_4_USFGRO0_VW4_WG16_8_2_WGM8
    SolutionIndex: 60
    SolutionNameMin: Cijk_Ailk_Bljk_SB_MT64x32x32_SE_DTL0_EPS1_FL0_GRVW4_LPB4_PGR1_PLR1_TT4_4_USFGRO0_VW4_WG16_8_2_WGM8
    SolutionIndex: 61
    SolutionNameMin: Cijk_Ailk_Bljk_SB_MT64x32x16_SE_DTL0_EPS1_FL1_GRVW4_LPB4_PGR1_PLR1_TT4_4_USFGRO0_VW4_WG16_8_2_WGM8
    SolutionIndex: 62
    SolutionNameMin: Cijk_Ailk_Bljk_SB_MT64x32x32_SE_DTL0_EPS1_FL1_GRVW4_LPB4_PGR1_PLR1_TT4_4_USFGRO0_VW4_WG16_8_2_WGM8
    SolutionIndex: 63
    SolutionNameMin: Cijk_Ailk_Bljk_SB_MT16x64x32_SE_DTL0_EPS1_FL0_GRVW4_LPB2_PGR1_PLR1_TT4_4_USFGRO0_VW2_WG4_16_4_WGM8
    SolutionIndex: 64
    SolutionNameMin: Cijk_Ailk_Bljk_SB_MT16x64x32_SE_DTL0_EPS1_FL1_GRVW2_LPB2_PGR1_PLR1_TT4_4_USFGRO0_VW2_WG4_16_4_WGM8
    SolutionIndex: 65
    SolutionNameMin: Cijk_Ailk_Bljk_SB_MT32x16x32_SE_DTL0_EPS1_FL0_GRVW2_LPB2_PGR1_PLR0_TT2_4_USFGRO0_VW2_WG16_4_4_WGM8
    SolutionIndex: 66
    SolutionNameMin: Cijk_Ailk_Bljk_SB_MT32x16x32_SE_DTL0_EPS1_FL1_GRVW2_LPB2_PGR1_PLR0_TT2_4_USFGRO0_VW2_WG16_4_4_WGM8
    SolutionIndex: 67
    SolutionNameMin: Cijk_Ailk_Bljk_SB_MT32x16x32_SE_DTL0_EPS1_FL0_GRVW2_LPB2_PGR1_PLR1_TT2_4_USFGRO0_VW2_WG16_4_4_WGM8
    SolutionIndex: 68
    SolutionNameMin: Cijk_Ailk_Bljk_SB_MT32x16x32_SE_DTL0_EPS1_FL1_GRVW2_LPB2_PGR1_PLR1_TT2_4_USFGRO0_VW2_WG16_4_4_WGM8
    SolutionIndex: 69
    SolutionNameMin: Cijk_Ailk_Bljk_SB_MT64x16x16_SE_DTL0_EPS1_FL0_GRVW1_LPB4_PGR1_PLR1_TT4_4_USFGRO1_VW4_WG16_4_4_WGM8
    SolutionIndex: 70
    SolutionNameMin: Cijk_Ailk_Bljk_SB_MT64x16x32_SE_DTL0_EPS1_FL0_GRVW1_LPB4_PGR1_PLR1_TT4_4_USFGRO1_VW4_WG16_4_4_WGM8
    SolutionIndex: 71
    SolutionNameMin: Cijk_Ailk_Bljk_SB_MT64x16x16_SE_DTL0_EPS1_FL0_GRVW4_LPB4_PGR1_PLR1_TT4_4_USFGRO0_VW4_WG16_4_4_WGM8
    SolutionIndex: 72
    SolutionNameMin: Cijk_Ailk_Bljk_SB_MT64x16x32_SE_DTL0_EPS1_FL0_GRVW4_LPB4_PGR1_PLR1_TT4_4_USFGRO0_VW4_WG16_4_4_WGM8
    SolutionIndex: 73
    SolutionNameMin: Cijk_Ailk_Bljk_SB_MT64x16x32_SE_DTL0_EPS1_FL1_GRVW4_LPB4_PGR1_PLR1_TT4_4_USFGRO0_VW4_WG16_4_4_WGM1
    SolutionIndex: 74
    SolutionNameMin: Cijk_Ailk_Bljk_SB_MT64x32x8_SE_DTL0_EPS0_FL0_GRVW4_LPB0_PGR0_PLR0_TT4_4_USFGRO0_VW4_WG16_8_1_WGM1
    SolutionIndex: 75
    SolutionNameMin: Cijk_Ailk_Bljk_SB_MT64x32x8_SE_DTL0_EPS1_FL0_GRVW2_LPB0_PGR1_PLR1_TT4_4_USFGRO0_VW2_WG16_8_1_WGM1
    SolutionIndex: 76
    SolutionNameMin: Cijk_Ailk_Bljk_SB_MT64x32x8_SE_DTL0_EPS1_FL0_GRVW4_LPB0_PGR1_PLR1_TT4_4_USFGRO0_VW4_WG16_8_1_WGM1
    SolutionIndex: 77
    SolutionNameMin: Cijk_Ailk_Bljk_SB_MT64x32x8_SE_DTL0_EPS1_FL1_GRVW2_LPB0_PGR1_PLR1_TT4_4_USFGRO0_VW2_WG16_8_1_WGM1
    SolutionIndex: 78
    SolutionNameMin: Cijk_Ailk_Bljk_SB_MT64x32x8_SE_DTL0_EPS1_FL1_GRVW4_LPB0_PGR1_PLR1_TT4_4_USFGRO0_VW4_WG16_8_1_WGM1
    SolutionIndex: 79
    SolutionNameMin: Cijk_Ailk_Bljk_SB_MT64x32x8_SE_DTL0_EPS0_FL0_GRVW1_LPB2_PGR0_PLR0_TT4_4_USFGRO1_VW2_WG16_8_1_WGM1
    SolutionIndex: 80
    SolutionNameMin: Cijk_Ailk_Bljk_SB_MT64x32x8_SE_DTL0_EPS0_FL1_GRVW2_LPB2_PGR0_PLR0_TT4_4_USFGRO0_VW2_WG16_8_1_WGM1
    SolutionIndex: 81
    SolutionNameMin: Cijk_Ailk_Bljk_SB_MT64x32x8_SE_DTL0_EPS0_FL1_GRVW4_LPB4_PGR0_PLR0_TT4_4_USFGRO0_VW4_WG16_8_1_WGM1
    SolutionIndex: 82
    SolutionNameMin: Cijk_Ailk_Bljk_SB_MT64x32x8_SE_DTL0_EPS1_FL1_GRVW2_LPB2_PGR1_PLR0_TT4_4_USFGRO0_VW2_WG16_8_1_WGM8
    SolutionIndex: 83
    SolutionNameMin: Cijk_Ailk_Bljk_SB_MT64x32x8_SE_DTL0_EPS0_FL0_GRVW1_LPB2_PGR0_PLR1_TT4_4_USFGRO1_VW2_WG16_8_1_WGM1
    SolutionIndex: 84
    SolutionNameMin: Cijk_Ailk_Bljk_SB_MT64x32x8_SE_DTL0_EPS0_FL0_GRVW1_LPB2_PGR0_PLR1_TT4_4_USFGRO1_VW2_WG16_8_1_WGM8
    SolutionIndex: 85
    SolutionNameMin: Cijk_Ailk_Bljk_SB_MT64x32x8_SE_DTL0_EPS0_FL0_GRVW1_LPB4_PGR0_PLR1_TT4_4_USFGRO1_VW4_WG16_8_1_WGM1
    SolutionIndex: 86
    SolutionNameMin: Cijk_Ailk_Bljk_SB_MT64x32x8_SE_DTL0_EPS0_FL0_GRVW2_LPB2_PGR0_PLR1_TT4_4_USFGRO0_VW2_WG16_8_1_WGM1
    SolutionIndex: 87
    SolutionNameMin: Cijk_Ailk_Bljk_SB_MT64x32x8_SE_DTL0_EPS0_FL0_GRVW4_LPB4_PGR0_PLR1_TT4_4_USFGRO0_VW4_WG16_8_1_WGM1
    SolutionIndex: 88
    SolutionNameMin: Cijk_Ailk_Bljk_SB_MT64x32x8_SE_DTL0_EPS0_FL0_GRVW4_LPB4_PGR0_PLR1_TT4_4_USFGRO0_VW4_WG16_8_1_WGM8
    SolutionIndex: 89
    SolutionNameMin: Cijk_Ailk_Bljk_SB_MT64x32x8_SE_DTL0_EPS0_FL1_GRVW2_LPB2_PGR0_PLR1_TT4_4_USFGRO0_VW2_WG16_8_1_WGM1
    SolutionIndex: 90
    SolutionNameMin: Cijk_Ailk_Bljk_SB_MT64x32x8_SE_DTL0_EPS1_FL0_GRVW4_LPB4_PGR1_PLR1_TT4_4_USFGRO0_VW4_WG16_8_1_WGM1
    SolutionIndex: 91
    SolutionNameMin: Cijk_Ailk_Bljk_SB_MT64x32x8_SE_DTL0_EPS1_FL1_GRVW2_LPB2_PGR1_PLR1_TT4_4_USFGRO0_VW2_WG16_8_1_WGM1
    SolutionIndex: 92
    SolutionNameMin: Cijk_Ailk_Bljk_SB_MT64x16x16_SE_DTL0_EPS0_FL0_GRVW1_LPB0_PGR0_PLR0_TT4_2_USFGRO1_VW2_WG16_8_1_WGM1
    SolutionIndex: 93
    SolutionNameMin: Cijk_Ailk_Bljk_SB_MT64x16x16_SE_DTL0_EPS0_FL1_GRVW2_LPB0_PGR0_PLR0_TT4_2_USFGRO0_VW2_WG16_8_1_WGM1
    SolutionIndex: 94
    SolutionNameMin: Cijk_Ailk_Bljk_SB_MT64x16x8_SE_DTL0_EPS0_FL0_GRVW1_LPB0_PGR0_PLR1_TT4_2_USFGRO1_VW2_WG16_8_1_WGM1
    SolutionIndex: 95
    SolutionNameMin: Cijk_Ailk_Bljk_SB_MT64x16x8_SE_DTL0_EPS0_FL0_GRVW1_LPB0_PGR0_PLR1_TT4_2_USFGRO1_VW2_WG16_8_1_WGM8
    SolutionIndex: 96
    SolutionNameMin: Cijk_Ailk_Bljk_SB_MT64x16x16_SE_DTL0_EPS0_FL0_GRVW1_LPB0_PGR0_PLR1_TT4_2_USFGRO1_VW2_WG16_8_1_WGM1
    SolutionIndex: 97
    SolutionNameMin: Cijk_Ailk_Bljk_SB_MT64x16x16_SE_DTL0_EPS0_FL1_GRVW2_LPB0_PGR0_PLR1_TT4_2_USFGRO0_VW2_WG16_8_1_WGM1
    SolutionIndex: 98
    SolutionNameMin: Cijk_Ailk_Bljk_SB_MT64x16x16_SE_DTL0_EPS0_FL0_GRVW1_LPB2_PGR0_PLR0_TT4_2_USFGRO1_VW2_WG16_8_1_WGM1
    SolutionIndex: 99
    SolutionNameMin: Cijk_Ailk_Bljk_SB_MT64x16x16_SE_DTL0_EPS0_FL0_GRVW1_LPB2_PGR0_PLR0_TT4_2_USFGRO1_VW2_WG16_8_1_WGM8
    SolutionIndex: 100
    SolutionNameMin: Cijk_Ailk_Bljk_SB_MT64x16x8_SE_DTL0_EPS0_FL0_GRVW1_LPB2_PGR0_PLR1_TT4_2_USFGRO1_VW2_WG16_8_1_WGM1
    SolutionIndex: 101
    SolutionNameMin: Cijk_Ailk_Bljk_SB_MT64x16x8_SE_DTL0_EPS0_FL0_GRVW1_LPB2_PGR0_PLR1_TT4_2_USFGRO1_VW2_WG16_8_1_WGM8
    SolutionIndex: 102
    SolutionNameMin: Cijk_Ailk_Bljk_SB_MT64x16x16_SE_DTL0_EPS0_FL0_GRVW1_LPB2_PGR0_PLR1_TT4_2_USFGRO1_VW2_WG16_8_1_WGM1
    SolutionIndex: 103
    SolutionNameMin: Cijk_Ailk_Bljk_SB_MT64x16x16_SE_DTL0_EPS0_FL0_GRVW1_LPB2_PGR0_PLR1_TT4_2_USFGRO1_VW2_WG16_8_1_WGM8
    SolutionIndex: 104
    SolutionNameMin: Cijk_Ailk_Bljk_SB_MT64x16x8_SE_DTL0_EPS1_FL0_GRVW2_LPB2_PGR1_PLR1_TT4_2_USFGRO0_VW2_WG16_8_1_WGM1
    SolutionIndex: 105
    SolutionNameMin: Cijk_Ailk_Bljk_SB_MT32x32x8_SE_DTL0_EPS0_FL0_GRVW1_LPB2_PGR0_PLR1_TT2_4_USFGRO1_VW2_WG16_8_1_WGM1
    SolutionIndex: 106
    SolutionNameMin: Cijk_Ailk_Bljk_SB_MT32x32x8_SE_DTL0_EPS1_FL0_GRVW1_LPB2_PGR1_PLR1_TT2_4_USFGRO1_VW2_WG16_8_1_WGM1
    SolutionIndex: 107
    SolutionNameMin: Cijk_Ailk_Bljk_SB_MT64x64x8_SE_DTL0_EPS0_FL0_GRVW1_LPB2_PGR0_PLR1_TT4_8_USFGRO1_VW2_WG16_8_1_WGM1
    SolutionIndex: 108
    SolutionNameMin: Cijk_Ailk_Bljk_SB_MT32x32x8_SE_DTL0_EPS0_FL0_GRVW1_LPB2_PGR0_PLR1_TT4_2_USFGRO1_VW2_WG8_16_1_WGM1
    SolutionIndex: 109
    SolutionNameMin: Cijk_Ailk_Bljk_SB_MT32x32x16_SE_DTL0_EPS0_FL0_GRVW1_LPB2_PGR0_PLR1_TT4_2_USFGRO1_VW2_WG8_16_1_WGM1
    SolutionIndex: 110
    SolutionNameMin: Cijk_Ailk_Bljk_SB_MT32x32x8_SE_DTL0_EPS1_FL0_GRVW4_LPB2_PGR1_PLR1_TT4_2_USFGRO0_VW2_WG8_16_1_WGM1
    SolutionIndex: 111
    SolutionNameMin: Cijk_Ailk_Bljk_SB_MT32x32x8_SE_DTL0_EPS1_FL1_GRVW4_LPB2_PGR1_PLR1_TT4_2_USFGRO0_VW2_WG8_16_1_WGM1
- - - [512, 540, 1, 512, 512, 512, 512, 512]
    - [4, 3748.88]
  - - [512, 550, 1, 512, 512, 512, 512, 512]
    - [3, 3850.94]
  - - [512, 848, 1, 2048, 512, 512, 512, 2048]
    - [2, 6511.37]
  - - [512, 936, 1, 2048, 512, 512, 512, 2048]
    - [2, 6763.14]
  - - [512, 1139, 1, 2048, 512, 512, 512, 2048]
    - [10, 6192.08]
  - - [512, 1232, 1, 512, 512, 512, 512, 512]
    - [8, 6628.93]
  - - [512, 1232, 1, 2048, 512, 512, 512, 2048]
    - [10, 6566.93]
  - - [512, 1279, 1, 2048, 512, 512, 512, 2048]
    - [7, 6867.72]
  - - [512, 1290, 1, 512, 512, 512, 512, 512]
    - [8, 6720.31]
  - - [512, 1290, 1, 2048, 512, 512, 512, 2048]
    - [7, 6817.86]
  - - [512, 1327, 1, 2048, 512, 512, 512, 2048]
    - [7, 7036.11]
  - - [512, 1331, 1, 2048, 512, 512, 512, 2048]
    - [10, 7014.75]
  - - [512, 1341, 1, 2048, 512, 512, 512, 2048]
    - [7, 7064.61]
  - - [512, 1350, 1, 512, 512, 512, 512, 512]
    - [14, 6955.47]
  - - [512, 1350, 1, 2048, 512, 512, 512, 2048]
    - [2, 6985.68]
  - - [512, 1391, 1, 2048, 512, 512, 512, 2048]
    - [5, 7172.35]
  - - [512, 1424, 1, 2048, 512, 512, 512, 2048]
    - [12, 7011.51]
  - - [512, 1458, 1, 512, 512, 512, 512, 512]
    - [14, 7407.09]
  - - [512, 1458, 1, 2048, 512, 512, 512, 2048]
    - [5, 7208.71]
  - - [512, 1462, 1, 512, 512, 512, 512, 512]
    - [14, 7556.28]
  - - [512, 1462, 1, 2048, 512, 512, 512, 2048]
    - [5, 7217.6]
  - - [512, 1467, 1, 2048, 512, 512, 512, 2048]
    - [5, 7111.04]
  - - [512, 1472, 1, 2048, 512, 512, 512, 2048]
    - [2, 7156.45]
  - - [512, 1520, 1, 512, 512, 512, 512, 512]
    - [14, 7674.48]
  - - [512, 1520, 1, 2048, 512, 512, 512, 2048]
    - [2, 7110.26]
  - - [512, 1596, 1, 512, 512, 512, 512, 512]
    - [28, 6836.3]
  - - [512, 1596, 1, 2048, 512, 512, 512, 2048]
    - [26, 7220.95]
  - - [512, 1599, 1, 512, 512, 512, 512, 512]
    - [28, 6858.12]
  - - [512, 1599, 1, 2048, 512, 512, 512, 2048]
    - [32, 7227.04]
  - - [512, 1615, 1, 512, 512, 512, 512, 512]
    - [24, 7027.93]
  - - [512, 1615, 1, 2048, 512, 512, 512, 2048]
    - [26, 7319.55]
  - - [512, 1680, 1, 512, 512, 512, 512, 512]
    - [24, 7291.42]
  - - [512, 1680, 1, 2048, 512, 512, 512, 2048]
    - [27, 7477.11]
  - - [512, 1709, 1, 2048, 512, 512, 512, 2048]
    - [26, 7577.88]
  - - [512, 1902, 1, 2048, 512, 512, 512, 2048]
    - [33, 8016.04]
  - - [512, 1917, 1, 512, 512, 512, 512, 512]
    - [22, 8063.7]
  - - [512, 1917, 1, 2048, 512, 512, 512, 2048]
    - [33, 7996.98]
  - - [512, 2076, 1, 2048, 512, 512, 512, 2048]
    - [5, 6639.96]
  - - [512, 2195, 1, 2048, 512, 512, 512, 2048]
    - [5, 6532.77]
  - - [512, 2205, 1, 512, 512, 512, 512, 512]
    - [14, 7896.55]
  - - [512, 2205, 1, 2048, 512, 512, 512, 2048]
    - [31, 6562.53]
  - - [512, 2387, 1, 512, 512, 512, 512, 512]
    - [1, 7542.64]
  - - [512, 2418, 1, 512, 512, 512, 512, 512]
    - [5, 7589.37]
  - - [512, 2418, 1, 2048, 512, 512, 512, 2048]
    - [23, 6916.89]
  - - [512, 2496, 1, 2048, 512, 512, 512, 2048]
    - [30, 7305.85]
  - - [512, 2790, 1, 2048, 512, 512, 512, 2048]
    - [20, 7504.43]
  - - [512, 2864, 1, 2048, 512, 512, 512, 2048]
    - [21, 7396.85]
  - - [512, 3092, 1, 2048, 512, 512, 512, 2048]
    - [5, 7098.88]
  - - [512, 3113, 1, 2048, 512, 512, 512, 2048]
    - [2, 7230.69]
  - - [512, 3137, 1, 2048, 512, 512, 512, 2048]
    - [5, 7139.67]
  - - [512, 3165, 1, 2048, 512, 512, 512, 2048]
    - [44, 7255.04]
  - - [512, 3166, 1, 2048, 512, 512, 512, 2048]
    - [5, 7195.67]
  - - [512, 3194, 1, 2048, 512, 512, 512, 2048]
    - [36, 7156.31]
  - - [512, 3219, 1, 2048, 512, 512, 512, 2048]
    - [2, 7318.67]
  - - [512, 3222, 1, 2048, 512, 512, 512, 2048]
    - [35, 7309.01]
  - - [512, 3234, 1, 2048, 512, 512, 512, 2048]
    - [2, 7345.13]
  - - [512, 3237, 1, 2048, 512, 512, 512, 2048]
    - [36, 7348.12]
  - - [512, 3242, 1, 2048, 512, 512, 512, 2048]
    - [36, 7326.48]
  - - [512, 3246, 1, 2048, 512, 512, 512, 2048]
    - [33, 7256.7]
  - - [512, 3249, 1, 2048, 512, 512, 512, 2048]
    - [35, 7284.53]
  - - [512, 3251, 1, 2048, 512, 512, 512, 2048]
    - [2, 7406.84]
  - - [512, 3257, 1, 2048, 512, 512, 512, 2048]
    - [43, 7342.65]
  - - [512, 3262, 1, 2048, 512, 512, 512, 2048]
    - [34, 7395.91]
  - - [512, 3268, 1, 2048, 512, 512, 512, 2048]
    - [35, 7369.99]
  - - [512, 3282, 1, 2048, 512, 512, 512, 2048]
    - [34, 7428.4]
  - - [512, 3286, 1, 2048, 512, 512, 512, 2048]
    - [34, 7427.2]
  - - [512, 3287, 1, 2048, 512, 512, 512, 2048]
    - [37, 7430.74]
  - - [512, 3293, 1, 2048, 512, 512, 512, 2048]
    - [36, 7426.37]
  - - [512, 3297, 1, 2048, 512, 512, 512, 2048]
    - [34, 7458.48]
  - - [512, 3307, 1, 2048, 512, 512, 512, 2048]
    - [37, 7429.82]
  - - [512, 3314, 1, 2048, 512, 512, 512, 2048]
    - [37, 7454.49]
  - - [512, 3319, 1, 2048, 512, 512, 512, 2048]
    - [36, 7398.44]
  - - [512, 3322, 1, 2048, 512, 512, 512, 2048]
    - [2, 7460.95]
  - - [512, 3324, 1, 2048, 512, 512, 512, 2048]
    - [37, 7424.74]
  - - [512, 3325, 1, 2048, 512, 512, 512, 2048]
    - [41, 7366.71]
  - - [512, 3327, 1, 2048, 512, 512, 512, 2048]
    - [2, 7491.45]
  - - [512, 3329, 1, 2048, 512, 512, 512, 2048]
    - [2, 7410.64]
  - - [512, 3332, 1, 2048, 512, 512, 512, 2048]
    - [37, 7474.45]
  - - [512, 3336, 1, 2048, 512, 512, 512, 2048]
    - [37, 7452.82]
  - - [512, 3339, 1, 2048, 512, 512, 512, 2048]
    - [2, 7419.04]
  - - [512, 3342, 1, 2048, 512, 512, 512, 2048]
    - [43, 7472.59]
  - - [512, 3344, 1, 2048, 512, 512, 512, 2048]
    - [44, 7430.16]
  - - [512, 3358, 1, 2048, 512, 512, 512, 2048]
    - [44, 7534.07]
  - - [512, 3360, 1, 2048, 512, 512, 512, 2048]
    - [35, 7492.38]
  - - [512, 3364, 1, 2048, 512, 512, 512, 2048]
    - [36, 7514.09]
  - - [512, 3365, 1, 2048, 512, 512, 512, 2048]
    - [44, 7544.61]
  - - [512, 3369, 1, 2048, 512, 512, 512, 2048]
    - [35, 7507.34]
  - - [512, 3370, 1, 2048, 512, 512, 512, 2048]
    - [40, 7457.59]
  - - [512, 3371, 1, 2048, 512, 512, 512, 2048]
    - [5, 7585.31]
  - - [512, 3376, 1, 2048, 512, 512, 512, 2048]
    - [35, 7538.32]
  - - [512, 3378, 1, 2048, 512, 512, 512, 2048]
    - [5, 7536.36]
  - - [512, 3381, 1, 2048, 512, 512, 512, 2048]
    - [37, 7512.37]
  - - [512, 3382, 1, 2048, 512, 512, 512, 2048]
    - [35, 7499.33]
  - - [512, 3383, 1, 2048, 512, 512, 512, 2048]
    - [26, 7492.68]
  - - [512, 3384, 1, 2048, 512, 512, 512, 2048]
    - [34, 7478.47]
  - - [512, 3385, 1, 2048, 512, 512, 512, 2048]
    - [27, 7540.43]
  - - [512, 3386, 1, 2048, 512, 512, 512, 2048]
    - [34, 7532.41]
  - - [512, 3390, 1, 2048, 512, 512, 512, 2048]
    - [44, 7484.16]
  - - [512, 3391, 1, 2048, 512, 512, 512, 2048]
    - [34, 7553.79]
  - - [512, 3396, 1, 2048, 512, 512, 512, 2048]
    - [35, 7545.7]
  - - [512, 3399, 1, 2048, 512, 512, 512, 2048]
    - [27, 7575.48]
  - - [512, 3402, 1, 2048, 512, 512, 512, 2048]
    - [44, 7593.79]
  - - [512, 3410, 1, 2048, 512, 512, 512, 2048]
    - [34, 7572.95]
  - - [512, 3412, 1, 2048, 512, 512, 512, 2048]
    - [43, 7609.63]
  - - [512, 3414, 1, 2048, 512, 512, 512, 2048]
    - [43, 7606.32]
  - - [512, 3415, 1, 2048, 512, 512, 512, 2048]
    - [37, 7599.51]
  - - [512, 3418, 1, 2048, 512, 512, 512, 2048]
    - [40, 7654.27]
  - - [512, 3430, 1, 2048, 512, 512, 512, 2048]
    - [44, 7679.83]
  - - [512, 3431, 1, 2048, 512, 512, 512, 2048]
    - [34, 7658.52]
  - - [512, 3432, 1, 2048, 512, 512, 512, 2048]
    - [34, 7664.67]
  - - [512, 3433, 1, 2048, 512, 512, 512, 2048]
    - [41, 7605.99]
  - - [512, 3439, 1, 2048, 512, 512, 512, 2048]
    - [36, 7689.48]
  - - [512, 3440, 1, 2048, 512, 512, 512, 2048]
    - [35, 7607.36]
  - - [512, 3443, 1, 2048, 512, 512, 512, 2048]
    - [34, 7626.86]
  - - [512, 3445, 1, 2048, 512, 512, 512, 2048]
    - [34, 7653.28]
  - - [512, 3447, 1, 2048, 512, 512, 512, 2048]
    - [43, 7673.33]
  - - [512, 3448, 1, 2048, 512, 512, 512, 2048]
    - [32, 7605.79]
  - - [512, 3450, 1, 2048, 512, 512, 512, 2048]
    - [43, 7733.85]
  - - [512, 3451, 1, 2048, 512, 512, 512, 2048]
    - [34, 7658.82]
  - - [512, 3452, 1, 2048, 512, 512, 512, 2048]
    - [44, 7631.32]
  - - [512, 3453, 1, 2048, 512, 512, 512, 2048]
    - [43, 7627.09]
  - - [512, 3455, 1, 2048, 512, 512, 512, 2048]
    - [35, 7646.98]
  - - [512, 3456, 1, 2048, 512, 512, 512, 2048]
    - [34, 7658.25]
  - - [512, 3457, 1, 2048, 512, 512, 512, 2048]
    - [35, 7673.43]
  - - [512, 3458, 1, 2048, 512, 512, 512, 2048]
    - [40, 7688.68]
  - - [512, 3459, 1, 2048, 512, 512, 512, 2048]
    - [34, 7709.2]
  - - [512, 3460, 1, 2048, 512, 512, 512, 2048]
    - [37, 7659.34]
  - - [512, 3461, 1, 2048, 512, 512, 512, 2048]
    - [40, 7681.01]
  - - [512, 3466, 1, 2048, 512, 512, 512, 2048]
    - [40, 7759.11]
  - - [512, 3467, 1, 2048, 512, 512, 512, 2048]
    - [40, 7729.66]
  - - [512, 3468, 1, 2048, 512, 512, 512, 2048]
    - [40, 7712.22]
  - - [512, 3470, 1, 2048, 512, 512, 512, 2048]
    - [34, 7706.21]
  - - [512, 3471, 1, 2048, 512, 512, 512, 2048]
    - [34, 7751.77]
  - - [512, 3472, 1, 2048, 512, 512, 512, 2048]
    - [32, 7779.19]
  - - [512, 3475, 1, 2048, 512, 512, 512, 2048]
    - [32, 7666.64]
  - - [512, 3476, 1, 2048, 512, 512, 512, 2048]
    - [35, 7715.6]
  - - [512, 3477, 1, 2048, 512, 512, 512, 2048]
    - [34, 7699.57]
  - - [512, 3478, 1, 2048, 512, 512, 512, 2048]
    - [41, 7721.36]
  - - [512, 3479, 1, 2048, 512, 512, 512, 2048]
    - [32, 7784.22]
  - - [512, 3480, 1, 2048, 512, 512, 512, 2048]
    - [34, 7721.87]
  - - [512, 3481, 1, 2048, 512, 512, 512, 2048]
    - [40, 7708.42]
  - - [512, 3484, 1, 2048, 512, 512, 512, 2048]
    - [41, 7711.17]
  - - [512, 3487, 1, 2048, 512, 512, 512, 2048]
    - [44, 7767.64]
  - - [512, 3489, 1, 2048, 512, 512, 512, 2048]
    - [32, 7793.29]
  - - [512, 3490, 1, 2048, 512, 512, 512, 2048]
    - [35, 7711.42]
  - - [512, 3493, 1, 2048, 512, 512, 512, 2048]
    - [35, 7715.44]
  - - [512, 3494, 1, 2048, 512, 512, 512, 2048]
    - [34, 7746.38]
  - - [512, 3495, 1, 2048, 512, 512, 512, 2048]
    - [35, 7792.08]
  - - [512, 3498, 1, 2048, 512, 512, 512, 2048]
    - [35, 7764.43]
  - - [512, 3499, 1, 2048, 512, 512, 512, 2048]
    - [35, 7771.92]
  - - [512, 3501, 1, 2048, 512, 512, 512, 2048]
    - [2, 7784.28]
  - - [512, 3503, 1, 2048, 512, 512, 512, 2048]
    - [36, 7725.82]
  - - [512, 3505, 1, 2048, 512, 512, 512, 2048]
    - [34, 7744.57]
  - - [512, 3507, 1, 2048, 512, 512, 512, 2048]
    - [34, 7746.37]
  - - [512, 3508, 1, 2048, 512, 512, 512, 2048]
    - [40, 7866.56]
  - - [512, 3509, 1, 2048, 512, 512, 512, 2048]
    - [43, 7791.49]
  - - [512, 3511, 1, 2048, 512, 512, 512, 2048]
    - [26, 7788.02]
  - - [512, 3513, 1, 2048, 512, 512, 512, 2048]
    - [43, 7829.55]
  - - [512, 3514, 1, 2048, 512, 512, 512, 2048]
    - [36, 7752.69]
  - - [512, 3515, 1, 2048, 512, 512, 512, 2048]
    - [32, 7718.51]
  - - [512, 3517, 1, 2048, 512, 512, 512, 2048]
    - [37, 7725.49]
  - - [512, 3518, 1, 2048, 512, 512, 512, 2048]
    - [32, 7806.18]
  - - [512, 3519, 1, 2048, 512, 512, 512, 2048]
    - [35, 7762.42]
  - - [512, 3520, 1, 2048, 512, 512, 512, 2048]
    - [26, 7839.83]
  - - [512, 3528, 1, 2048, 512, 512, 512, 2048]
    - [35, 7784.88]
  - - [512, 3529, 1, 2048, 512, 512, 512, 2048]
    - [33, 7841.21]
  - - [512, 3530, 1, 2048, 512, 512, 512, 2048]
    - [37, 7756.65]
  - - [512, 3531, 1, 2048, 512, 512, 512, 2048]
    - [27, 7783.64]
  - - [512, 3532, 1, 2048, 512, 512, 512, 2048]
    - [35, 7767.56]
  - - [512, 3533, 1, 2048, 512, 512, 512, 2048]
    - [34, 7776.29]
  - - [512, 3534, 1, 2048, 512, 512, 512, 2048]
    - [34, 7765.44]
  - - [512, 3538, 1, 2048, 512, 512, 512, 2048]
    - [37, 7861.21]
  - - [512, 3539, 1, 2048, 512, 512, 512, 2048]
    - [40, 7823.64]
  - - [512, 3541, 1, 2048, 512, 512, 512, 2048]
    - [34, 7853.24]
  - - [512, 3547, 1, 2048, 512, 512, 512, 2048]
    - [27, 7826.82]
  - - [512, 3548, 1, 2048, 512, 512, 512, 2048]
    - [32, 7836.93]
  - - [512, 3552, 1, 2048, 512, 512, 512, 2048]
    - [44, 7820.72]
  - - [512, 3564, 1, 2048, 512, 512, 512, 2048]
    - [32, 7904.24]
  - - [512, 3575, 1, 2048, 512, 512, 512, 2048]
    - [44, 7919.26]
  - - [512, 3598, 1, 2048, 512, 512, 512, 2048]
    - [26, 7940.68]
  - - [512, 3599, 1, 2048, 512, 512, 512, 2048]
    - [44, 7950.92]
  - - [512, 3608, 1, 2048, 512, 512, 512, 2048]
    - [26, 7972.15]
  - - [512, 3776, 1, 512, 512, 512, 512, 512]
    - [15, 8580.58]
  - - [512, 3776, 1, 2048, 512, 512, 512, 2048]
    - [27, 8304.16]
  - - [512, 3780, 1, 512, 512, 512, 512, 512]
    - [18, 8536.39]
  - - [512, 3780, 1, 2048, 512, 512, 512, 2048]
    - [33, 8252.03]
  - - [512, 3780, 1, 33708, 512, 512, 512, 33708]
    - [40, 9650.24]
  - - [512, 3796, 1, 512, 512, 512, 512, 512]
    - [18, 8584.36]
  - - [512, 3796, 1, 2048, 512, 512, 512, 2048]
    - [35, 8234.84]
  - - [512, 3796, 1, 33708, 512, 512, 512, 33708]
    - [38, 9693.61]
  - - [512, 3822, 1, 512, 512, 512, 512, 512]
    - [15, 8673.08]
  - - [512, 3822, 1, 2048, 512, 512, 512, 2048]
    - [44, 8274.81]
  - - [512, 3822, 1, 33708, 512, 512, 512, 33708]
    - [34, 9755.04]
  - - [512, 3835, 1, 512, 512, 512, 512, 512]
    - [18, 8660.6]
  - - [512, 3835, 1, 2048, 512, 512, 512, 2048]
    - [27, 8282.45]
  - - [512, 3840, 1, 512, 512, 512, 512, 512]
    - [18, 8695.86]
  - - [512, 3840, 1, 2048, 512, 512, 512, 2048]
    - [26, 8282.33]
  - - [512, 3840, 1, 33708, 512, 512, 512, 33708]
    - [39, 9807.02]
  - - [512, 3859, 1, 512, 512, 512, 512, 512]
    - [15, 8750.98]
  - - [512, 3859, 1, 2048, 512, 512, 512, 2048]
    - [33, 8250.0]
  - - [512, 3864, 1, 512, 512, 512, 512, 512]
    - [18, 8744.17]
  - - [512, 3870, 1, 512, 512, 512, 512, 512]
    - [42, 8709.63]
  - - [512, 3870, 1, 2048, 512, 512, 512, 2048]
    - [44, 8251.98]
  - - [512, 3870, 1, 33708, 512, 512, 512, 33708]
    - [36, 9877.32]
  - - [512, 3876, 1, 512, 512, 512, 512, 512]
    - [18, 8735.13]
  - - [512, 3876, 1, 2048, 512, 512, 512, 2048]
    - [33, 8298.52]
  - - [512, 3876, 1, 33708, 512, 512, 512, 33708]
    - [36, 9893.45]
  - - [512, 3906, 1, 512, 512, 512, 512, 512]
    - [15, 8820.94]
  - - [512, 3906, 1, 2048, 512, 512, 512, 2048]
    - [32, 8419.14]
  - - [512, 3906, 1, 33708, 512, 512, 512, 33708]
    - [34, 9970.97]
  - - [512, 3910, 1, 512, 512, 512, 512, 512]
    - [15, 8817.82]
  - - [512, 3910, 1, 2048, 512, 512, 512, 2048]
    - [27, 8507.5]
  - - [512, 3910, 1, 33708, 512, 512, 512, 33708]
    - [36, 9979.18]
  - - [512, 3925, 1, 512, 512, 512, 512, 512]
    - [18, 8863.85]
  - - [512, 3925, 1, 2048, 512, 512, 512, 2048]
    - [36, 8440.65]
  - - [512, 3925, 1, 33708, 512, 512, 512, 33708]
    - [39, 10020.2]
  - - [512, 3927, 1, 512, 512, 512, 512, 512]
    - [18, 8856.16]
  - - [512, 3942, 1, 2048, 512, 512, 512, 2048]
    - [27, 8453.63]
  - - [512, 3942, 1, 33708, 512, 512, 512, 33708]
    - [39, 10062.4]
  - - [512, 3944, 1, 512, 512, 512, 512, 512]
    - [18, 8876.17]
  - - [512, 3944, 1, 2048, 512, 512, 512, 2048]
    - [27, 8546.01]
  - - [512, 3944, 1, 33708, 512, 512, 512, 33708]
    - [34, 10064.3]
  - - [512, 3955, 1, 512, 512, 512, 512, 512]
    - [18, 8888.71]
  - - [512, 3955, 1, 2048, 512, 512, 512, 2048]
    - [27, 8505.16]
  - - [512, 3955, 1, 33708, 512, 512, 512, 33708]
    - [40, 10090.3]
  - - [512, 3968, 1, 2048, 512, 512, 512, 2048]
    - [27, 8476.11]
  - - [512, 3968, 1, 33708, 512, 512, 512, 33708]
    - [36, 10130.2]
  - - [512, 3969, 1, 512, 512, 512, 512, 512]
    - [15, 8895.77]
  - - [512, 3969, 1, 2048, 512, 512, 512, 2048]
    - [33, 8490.7]
  - - [512, 3969, 1, 33708, 512, 512, 512, 33708]
    - [39, 10138.0]
  - - [512, 3976, 1, 512, 512, 512, 512, 512]
    - [15, 8942.04]
  - - [512, 3976, 1, 2048, 512, 512, 512, 2048]
    - [27, 8493.19]
  - - [512, 3976, 1, 33708, 512, 512, 512, 33708]
    - [38, 10154.5]
  - - [512, 3977, 1, 512, 512, 512, 512, 512]
    - [15, 8925.91]
  - - [512, 3977, 1, 2048, 512, 512, 512, 2048]
    - [27, 8611.82]
  - - [512, 3977, 1, 33708, 512, 512, 512, 33708]
    - [39, 10158.1]
  - - [512, 3978, 1, 512, 512, 512, 512, 512]
    - [18, 8965.0]
  - - [512, 3978, 1, 2048, 512, 512, 512, 2048]
    - [33, 8363.88]
  - - [512, 3978, 1, 33708, 512, 512, 512, 33708]
    - [34, 10147.3]
  - - [512, 3990, 1, 512, 512, 512, 512, 512]
    - [15, 8955.09]
  - - [512, 3990, 1, 2048, 512, 512, 512, 2048]
    - [32, 8534.23]
  - - [512, 3995, 1, 512, 512, 512, 512, 512]
    - [18, 9003.31]
  - - [512, 3995, 1, 2048, 512, 512, 512, 2048]
    - [33, 8492.26]
  - - [512, 3996, 1, 2048, 512, 512, 512, 2048]
    - [33, 8519.25]
  - - [512, 3996, 1, 33708, 512, 512, 512, 33708]
    - [35, 10189.4]
  - - [512, 3999, 1, 512, 512, 512, 512, 512]
    - [15, 8993.77]
  - - [512, 3999, 1, 2048, 512, 512, 512, 2048]
    - [27, 8480.14]
  - - [512, 3999, 1, 33708, 512, 512, 512, 33708]
    - [36, 10206.3]
  - - [512, 4005, 1, 2048, 512, 512, 512, 2048]
    - [27, 8701.2]
  - - [512, 4005, 1, 33708, 512, 512, 512, 33708]
    - [36, 10217.3]
  - - [512, 4012, 1, 512, 512, 512, 512, 512]
    - [15, 8992.15]
  - - [512, 4012, 1, 2048, 512, 512, 512, 2048]
    - [27, 8416.48]
  - - [512, 4012, 1, 33708, 512, 512, 512, 33708]
    - [36, 10236.1]
  - - [512, 4020, 1, 512, 512, 512, 512, 512]
    - [15, 9003.92]
  - - [512, 4020, 1, 2048, 512, 512, 512, 2048]
    - [27, 8578.79]
  - - [512, 4020, 1, 33708, 512, 512, 512, 33708]
    - [34, 10251.8]
  - - [512, 4026, 1, 2048, 512, 512, 512, 2048]
    - [27, 8650.75]
  - - [512, 4030, 1, 512, 512, 512, 512, 512]
    - [18, 8989.45]
  - - [512, 4030, 1, 2048, 512, 512, 512, 2048]
    - [27, 8436.68]
  - - [512, 4030, 1, 33708, 512, 512, 512, 33708]
    - [40, 10283.6]
  - - [512, 4032, 1, 512, 512, 512, 512, 512]
    - [15, 9049.35]
  - - [512, 4032, 1, 2048, 512, 512, 512, 2048]
    - [27, 8659.39]
  - - [512, 4050, 1, 512, 512, 512, 512, 512]
    - [18, 9064.92]
  - - [512, 4059, 1, 512, 512, 512, 512, 512]
    - [18, 9109.95]
  - - [2048, 246, 1, 512, 2048, 2048, 2048, 512]
    - [0, 6527.07]
  - - [2048, 264, 1, 512, 2048, 2048, 2048, 512]
    - [8, 5815.63]
  - - [2048, 401, 1, 512, 2048, 2048, 2048, 512]
    - [24, 7007.98]
  - - [2048, 439, 1, 512, 2048, 2048, 2048, 512]
    - [22, 7561.18]
  - - [2048, 443, 1, 512, 2048, 2048, 2048, 512]
    - [28, 7660.28]
  - - [2048, 446, 1, 512, 2048, 2048, 2048, 512]
    - [22, 7651.59]
  - - [2048, 465, 1, 512, 2048, 2048, 2048, 512]
    - [24, 7894.88]
  - - [2048, 468, 1, 512, 2048, 2048, 2048, 512]
    - [24, 7956.12]
  - - [2048, 493, 1, 512, 2048, 2048, 2048, 512]
    - [30, 8305.72]
  - - [2048, 495, 1, 512, 2048, 2048, 2048, 512]
    - [24, 8318.03]
  - - [2048, 511, 1, 512, 2048, 2048, 2048, 512]
    - [22, 8554.0]
  - - [2048, 512, 1, 512, 2048, 2048, 2048, 512]
    - [30, 8692.86]
  - - [2048, 540, 1, 512, 2048, 2048, 2048, 512]
    - [11, 7586.16]
  - - [2048, 550, 1, 512, 2048, 2048, 2048, 512]
    - [14, 7685.46]
  - - [2048, 560, 1, 512, 2048, 2048, 2048, 512]
    - [11, 7551.47]
  - - [2048, 600, 1, 512, 2048, 2048, 2048, 512]
    - [5, 7489.83]
  - - [2048, 644, 1, 512, 2048, 2048, 2048, 512]
    - [30, 7963.24]
  - - [2048, 668, 1, 512, 2048, 2048, 2048, 512]
    - [24, 8190.47]
  - - [2048, 714, 1, 512, 2048, 2048, 2048, 512]
    - [30, 8577.95]
  - - [2048, 720, 1, 512, 2048, 2048, 2048, 512]
    - [25, 8795.14]
  - - [2048, 722, 1, 512, 2048, 2048, 2048, 512]
    - [23, 8778.66]
  - - [2048, 781, 1, 512, 2048, 2048, 2048, 512]
    - [2, 7265.24]
  - - [2048, 848, 1, 512, 2048, 2048, 2048, 512]
    - [9, 7855.06]
  - - [2048, 872, 1, 512, 2048, 2048, 2048, 512]
    - [8, 8037.61]
  - - [2048, 936, 1, 512, 2048, 2048, 2048, 512]
    - [16, 8460.92]
  - - [2048, 980, 1, 512, 2048, 2048, 2048, 512]
    - [19, 8846.46]
  - - [2048, 1139, 1, 512, 2048, 2048, 2048, 512]
    - [14, 8506.61]
  - - [2048, 1184, 1, 512, 2048, 2048, 2048, 512]
    - [25, 8747.98]
  - - [2048, 1186, 1, 512, 2048, 2048, 2048, 512]
    - [31, 8733.22]
  - - [2048, 1232, 1, 512, 2048, 2048, 2048, 512]
    - [31, 9082.15]
  - - [2048, 1279, 1, 512, 2048, 2048, 2048, 512]
    - [23, 9282.45]
  - - [2048, 1290, 1, 512, 2048, 2048, 2048, 512]
    - [25, 8203.92]
  - - [2048, 1327, 1, 512, 2048, 2048, 2048, 512]
    - [11, 8366.16]
  - - [2048, 1331, 1, 512, 2048, 2048, 2048, 512]
    - [23, 8399.46]
  - - [2048, 1341, 1, 512, 2048, 2048, 2048, 512]
    - [29, 8446.3]
  - - [2048, 1350, 1, 512, 2048, 2048, 2048, 512]
    - [25, 8581.34]
  - - [2048, 1359, 1, 512, 2048, 2048, 2048, 512]
    - [25, 8630.18]
  - - [2048, 1391, 1, 512, 2048, 2048, 2048, 512]
    - [29, 8723.5]
  - - [2048, 1424, 1, 512, 2048, 2048, 2048, 512]
    - [31, 9021.1]
  - - [2048, 1458, 1, 512, 2048, 2048, 2048, 512]
    - [23, 9126.22]
  - - [2048, 1462, 1, 512, 2048, 2048, 2048, 512]
    - [30, 9073.26]
  - - [2048, 1467, 1, 512, 2048, 2048, 2048, 512]
    - [31, 9143.25]
  - - [2048, 1472, 1, 512, 2048, 2048, 2048, 512]
    - [31, 9284.79]
  - - [2048, 1520, 1, 512, 2048, 2048, 2048, 512]
    - [23, 9460.09]
  - - [2048, 1596, 1, 512, 2048, 2048, 2048, 512]
    - [8, 8669.33]
  - - [2048, 1599, 1, 512, 2048, 2048, 2048, 512]
    - [8, 8646.21]
  - - [2048, 1680, 1, 512, 2048, 2048, 2048, 512]
    - [17, 9091.7]
  - - [2048, 1709, 1, 512, 2048, 2048, 2048, 512]
    - [20, 9161.64]
  - - [2048, 1902, 1, 512, 2048, 2048, 2048, 512]
    - [30, 8974.04]
  - - [2048, 1917, 1, 512, 2048, 2048, 2048, 512]
    - [31, 9031.81]
  - - [2048, 2076, 1, 512, 2048, 2048, 2048, 512]
    - [25, 8886.53]
  - - [2048, 2195, 1, 512, 2048, 2048, 2048, 512]
    - [25, 9371.43]
  - - [2048, 2205, 1, 512, 2048, 2048, 2048, 512]
    - [31, 9380.52]
  - - [2048, 2418, 1, 512, 2048, 2048, 2048, 512]
    - [24, 9242.7]
  - - [2048, 2790, 1, 512, 2048, 2048, 2048, 512]
    - [17, 9715.49]
  - - [2048, 2864, 1, 512, 2048, 2048, 2048, 512]
    - [29, 9221.08]
  - - [2048, 3113, 1, 512, 2048, 2048, 2048, 512]
    - [25, 9292.35]
  - - [2048, 3137, 1, 512, 2048, 2048, 2048, 512]
    - [25, 9400.39]
  - - [2048, 3165, 1, 512, 2048, 2048, 2048, 512]
    - [31, 9426.11]
  - - [2048, 3166, 1, 512, 2048, 2048, 2048, 512]
    - [25, 9431.23]
  - - [2048, 3194, 1, 512, 2048, 2048, 2048, 512]
    - [31, 9495.21]
  - - [2048, 3219, 1, 512, 2048, 2048, 2048, 512]
    - [24, 9578.22]
  - - [2048, 3222, 1, 512, 2048, 2048, 2048, 512]
    - [25, 9582.8]
  - - [2048, 3234, 1, 512, 2048, 2048, 2048, 512]
    - [24, 9594.54]
  - - [2048, 3237, 1, 512, 2048, 2048, 2048, 512]
    - [24, 9614.32]
  - - [2048, 3242, 1, 512, 2048, 2048, 2048, 512]
    - [31, 9609.58]
  - - [2048, 3246, 1, 512, 2048, 2048, 2048, 512]
    - [25, 9638.87]
  - - [2048, 3249, 1, 512, 2048, 2048, 2048, 512]
    - [24, 9641.23]
  - - [2048, 3251, 1, 512, 2048, 2048, 2048, 512]
    - [30, 9642.79]
  - - [2048, 3257, 1, 512, 2048, 2048, 2048, 512]
    - [24, 9640.96]
  - - [2048, 3262, 1, 512, 2048, 2048, 2048, 512]
    - [24, 9651.4]
  - - [2048, 3268, 1, 512, 2048, 2048, 2048, 512]
    - [30, 9673.52]
  - - [2048, 3282, 1, 512, 2048, 2048, 2048, 512]
    - [30, 9710.57]
  - - [2048, 3286, 1, 512, 2048, 2048, 2048, 512]
    - [30, 9718.02]
  - - [2048, 3287, 1, 512, 2048, 2048, 2048, 512]
    - [30, 9736.35]
  - - [2048, 3293, 1, 512, 2048, 2048, 2048, 512]
    - [24, 9758.54]
  - - [2048, 3297, 1, 512, 2048, 2048, 2048, 512]
    - [25, 9757.16]
  - - [2048, 3307, 1, 512, 2048, 2048, 2048, 512]
    - [30, 9771.31]
  - - [2048, 3314, 1, 512, 2048, 2048, 2048, 512]
    - [31, 9807.46]
  - - [2048, 3315, 1, 512, 2048, 2048, 2048, 512]
    - [24, 9790.53]
  - - [2048, 3319, 1, 512, 2048, 2048, 2048, 512]
    - [31, 9797.93]
  - - [2048, 3323, 1, 512, 2048, 2048, 2048, 512]
    - [24, 9816.37]
  - - [2048, 3324, 1, 512, 2048, 2048, 2048, 512]
    - [24, 9797.24]
  - - [2048, 3325, 1, 512, 2048, 2048, 2048, 512]
    - [30, 9802.39]
  - - [2048, 3327, 1, 512, 2048, 2048, 2048, 512]
    - [30, 9803.88]
  - - [2048, 3329, 1, 512, 2048, 2048, 2048, 512]
    - [24, 9277.88]
  - - [2048, 3342, 1, 512, 2048, 2048, 2048, 512]
    - [31, 9312.13]
  - - [2048, 3344, 1, 512, 2048, 2048, 2048, 512]
    - [31, 9337.55]
  - - [2048, 3358, 1, 512, 2048, 2048, 2048, 512]
    - [17, 9319.07]
  - - [2048, 3360, 1, 512, 2048, 2048, 2048, 512]
    - [20, 9342.43]
  - - [2048, 3364, 1, 512, 2048, 2048, 2048, 512]
    - [20, 9341.66]
  - - [2048, 3365, 1, 512, 2048, 2048, 2048, 512]
    - [30, 9346.41]
  - - [2048, 3369, 1, 512, 2048, 2048, 2048, 512]
    - [17, 9341.69]
  - - [2048, 3370, 1, 512, 2048, 2048, 2048, 512]
    - [20, 9336.56]
  - - [2048, 3371, 1, 512, 2048, 2048, 2048, 512]
    - [25, 9369.04]
  - - [2048, 3374, 1, 512, 2048, 2048, 2048, 512]
    - [25, 9391.31]
  - - [2048, 3376, 1, 512, 2048, 2048, 2048, 512]
    - [25, 9343.31]
  - - [2048, 3377, 1, 512, 2048, 2048, 2048, 512]
    - [25, 9387.7]
  - - [2048, 3378, 1, 512, 2048, 2048, 2048, 512]
    - [30, 9362.68]
  - - [2048, 3381, 1, 512, 2048, 2048, 2048, 512]
    - [31, 9378.93]
  - - [2048, 3382, 1, 512, 2048, 2048, 2048, 512]
    - [31, 9350.04]
  - - [2048, 3383, 1, 512, 2048, 2048, 2048, 512]
    - [30, 9354.78]
  - - [2048, 3384, 1, 512, 2048, 2048, 2048, 512]
    - [24, 9385.27]
  - - [2048, 3385, 1, 512, 2048, 2048, 2048, 512]
    - [31, 9413.93]
  - - [2048, 3386, 1, 512, 2048, 2048, 2048, 512]
    - [17, 9382.87]
  - - [2048, 3388, 1, 512, 2048, 2048, 2048, 512]
    - [20, 9398.35]
  - - [2048, 3390, 1, 512, 2048, 2048, 2048, 512]
    - [30, 9384.04]
  - - [2048, 3391, 1, 512, 2048, 2048, 2048, 512]
    - [31, 9442.65]
  - - [2048, 3396, 1, 512, 2048, 2048, 2048, 512]
    - [31, 9442.52]
  - - [2048, 3399, 1, 512, 2048, 2048, 2048, 512]
    - [17, 9466.93]
  - - [2048, 3402, 1, 512, 2048, 2048, 2048, 512]
    - [31, 9469.25]
  - - [2048, 3410, 1, 512, 2048, 2048, 2048, 512]
    - [31, 9463.38]
  - - [2048, 3412, 1, 512, 2048, 2048, 2048, 512]
    - [17, 9466.93]
  - - [2048, 3414, 1, 512, 2048, 2048, 2048, 512]
    - [30, 9464.46]
  - - [2048, 3415, 1, 512, 2048, 2048, 2048, 512]
    - [20, 9489.31]
  - - [2048, 3418, 1, 512, 2048, 2048, 2048, 512]
    - [24, 9475.55]
  - - [2048, 3420, 1, 512, 2048, 2048, 2048, 512]
    - [31, 9489.12]
  - - [2048, 3422, 1, 512, 2048, 2048, 2048, 512]
    - [20, 9486.64]
  - - [2048, 3425, 1, 512, 2048, 2048, 2048, 512]
    - [30, 9486.93]
  - - [2048, 3426, 1, 512, 2048, 2048, 2048, 512]
    - [17, 9505.77]
  - - [2048, 3428, 1, 512, 2048, 2048, 2048, 512]
    - [25, 9493.24]
  - - [2048, 3430, 1, 512, 2048, 2048, 2048, 512]
    - [24, 9488.75]
  - - [2048, 3431, 1, 512, 2048, 2048, 2048, 512]
    - [30, 9495.52]
  - - [2048, 3432, 1, 512, 2048, 2048, 2048, 512]
    - [31, 9522.42]
  - - [2048, 3433, 1, 512, 2048, 2048, 2048, 512]
    - [25, 9529.23]
  - - [2048, 3438, 1, 512, 2048, 2048, 2048, 512]
    - [25, 9524.95]
  - - [2048, 3439, 1, 512, 2048, 2048, 2048, 512]
    - [24, 9507.63]
  - - [2048, 3443, 1, 512, 2048, 2048, 2048, 512]
    - [24, 9516.68]
  - - [2048, 3445, 1, 512, 2048, 2048, 2048, 512]
    - [31, 9524.22]
  - - [2048, 3447, 1, 512, 2048, 2048, 2048, 512]
    - [17, 9497.69]
  - - [2048, 3448, 1, 512, 2048, 2048, 2048, 512]
    - [24, 9510.44]
  - - [2048, 3450, 1, 512, 2048, 2048, 2048, 512]
    - [25, 9548.11]
  - - [2048, 3451, 1, 512, 2048, 2048, 2048, 512]
    - [25, 9540.8]
  - - [2048, 3452, 1, 512, 2048, 2048, 2048, 512]
    - [25, 9541.56]
  - - [2048, 3453, 1, 512, 2048, 2048, 2048, 512]
    - [25, 9576.63]
  - - [2048, 3455, 1, 512, 2048, 2048, 2048, 512]
    - [25, 9533.76]
  - - [2048, 3456, 1, 512, 2048, 2048, 2048, 512]
    - [30, 9609.35]
  - - [2048, 3457, 1, 512, 2048, 2048, 2048, 512]
    - [24, 9599.91]
  - - [2048, 3458, 1, 512, 2048, 2048, 2048, 512]
    - [24, 9598.62]
  - - [2048, 3459, 1, 512, 2048, 2048, 2048, 512]
    - [25, 9597.33]
  - - [2048, 3461, 1, 512, 2048, 2048, 2048, 512]
    - [31, 9608.99]
  - - [2048, 3462, 1, 512, 2048, 2048, 2048, 512]
    - [31, 9632.16]
  - - [2048, 3466, 1, 512, 2048, 2048, 2048, 512]
    - [30, 9614.72]
  - - [2048, 3467, 1, 512, 2048, 2048, 2048, 512]
    - [25, 9633.81]
  - - [2048, 3468, 1, 512, 2048, 2048, 2048, 512]
    - [31, 9648.86]
  - - [2048, 3470, 1, 512, 2048, 2048, 2048, 512]
    - [20, 9617.67]
  - - [2048, 3471, 1, 512, 2048, 2048, 2048, 512]
    - [25, 9624.52]
  - - [2048, 3472, 1, 512, 2048, 2048, 2048, 512]
    - [25, 9617.12]
  - - [2048, 3475, 1, 512, 2048, 2048, 2048, 512]
    - [31, 9635.61]
  - - [2048, 3476, 1, 512, 2048, 2048, 2048, 512]
    - [17, 9654.72]
  - - [2048, 3477, 1, 512, 2048, 2048, 2048, 512]
    - [25, 9641.15]
  - - [2048, 3478, 1, 512, 2048, 2048, 2048, 512]
    - [31, 9641.89]
  - - [2048, 3479, 1, 512, 2048, 2048, 2048, 512]
    - [17, 9634.47]
  - - [2048, 3480, 1, 512, 2048, 2048, 2048, 512]
    - [20, 9627.07]
  - - [2048, 3481, 1, 512, 2048, 2048, 2048, 512]
    - [17, 9635.94]
  - - [2048, 3484, 1, 512, 2048, 2048, 2048, 512]
    - [30, 9656.48]
  - - [2048, 3487, 1, 512, 2048, 2048, 2048, 512]
    - [24, 9654.59]
  - - [2048, 3489, 1, 512, 2048, 2048, 2048, 512]
    - [17, 9666.25]
  - - [2048, 3490, 1, 512, 2048, 2048, 2048, 512]
    - [20, 9654.73]
  - - [2048, 3491, 1, 512, 2048, 2048, 2048, 512]
    - [30, 9673.83]
  - - [2048, 3493, 1, 512, 2048, 2048, 2048, 512]
    - [17, 9658.96]
  - - [2048, 3494, 1, 512, 2048, 2048, 2048, 512]
    - [30, 9661.72]
  - - [2048, 3495, 1, 512, 2048, 2048, 2048, 512]
    - [25, 9654.3]
  - - [2048, 3497, 1, 512, 2048, 2048, 2048, 512]
    - [24, 9655.76]
  - - [2048, 3498, 1, 512, 2048, 2048, 2048, 512]
    - [24, 9664.63]
  - - [2048, 3499, 1, 512, 2048, 2048, 2048, 512]
    - [24, 9657.21]
  - - [2048, 3501, 1, 512, 2048, 2048, 2048, 512]
    - [31, 9693.35]
  - - [2048, 3503, 1, 512, 2048, 2048, 2048, 512]
    - [20, 9670.29]
  - - [2048, 3505, 1, 512, 2048, 2048, 2048, 512]
    - [31, 9704.42]
  - - [2048, 3507, 1, 512, 2048, 2048, 2048, 512]
    - [20, 9671.14]
  - - [2048, 3508, 1, 512, 2048, 2048, 2048, 512]
    - [31, 9708.63]
  - - [2048, 3509, 1, 512, 2048, 2048, 2048, 512]
    - [30, 9699.11]
  - - [2048, 3510, 1, 512, 2048, 2048, 2048, 512]
    - [31, 9681.45]
  - - [2048, 3511, 1, 512, 2048, 2048, 2048, 512]
    - [30, 9653.74]
  - - [2048, 3513, 1, 512, 2048, 2048, 2048, 512]
    - [20, 9691.77]
  - - [2048, 3514, 1, 512, 2048, 2048, 2048, 512]
    - [24, 9692.49]
  - - [2048, 3515, 1, 512, 2048, 2048, 2048, 512]
    - [25, 9685.06]
  - - [2048, 3517, 1, 512, 2048, 2048, 2048, 512]
    - [20, 9706.89]
  - - [2048, 3518, 1, 512, 2048, 2048, 2048, 512]
    - [24, 9697.4]
  - - [2048, 3519, 1, 512, 2048, 2048, 2048, 512]
    - [24, 9702.2]
  - - [2048, 3520, 1, 512, 2048, 2048, 2048, 512]
    - [20, 9774.86]
  - - [2048, 3523, 1, 512, 2048, 2048, 2048, 512]
    - [24, 9748.08]
  - - [2048, 3528, 1, 512, 2048, 2048, 2048, 512]
    - [30, 9739.3]
  - - [2048, 3529, 1, 512, 2048, 2048, 2048, 512]
    - [17, 9735.91]
  - - [2048, 3530, 1, 512, 2048, 2048, 2048, 512]
    - [30, 9740.72]
  - - [2048, 3531, 1, 512, 2048, 2048, 2048, 512]
    - [24, 9749.64]
  - - [2048, 3533, 1, 512, 2048, 2048, 2048, 512]
    - [24, 9759.27]
  - - [2048, 3534, 1, 512, 2048, 2048, 2048, 512]
    - [31, 9749.7]
  - - [2048, 3538, 1, 512, 2048, 2048, 2048, 512]
    - [24, 9785.46]
  - - [2048, 3539, 1, 512, 2048, 2048, 2048, 512]
    - [17, 9769.67]
  - - [2048, 3540, 1, 512, 2048, 2048, 2048, 512]
    - [30, 9737.56]
  - - [2048, 3541, 1, 512, 2048, 2048, 2048, 512]
    - [20, 9777.25]
  - - [2048, 3547, 1, 512, 2048, 2048, 2048, 512]
    - [30, 9804.14]
  - - [2048, 3548, 1, 512, 2048, 2048, 2048, 512]
    - [24, 9771.87]
  - - [2048, 3564, 1, 512, 2048, 2048, 2048, 512]
    - [20, 9793.3]
  - - [2048, 3575, 1, 512, 2048, 2048, 2048, 512]
    - [24, 9827.65]
  - - [2048, 3598, 1, 512, 2048, 2048, 2048, 512]
    - [17, 9364.52]
  - - [2048, 3599, 1, 512, 2048, 2048, 2048, 512]
    - [31, 9382.02]
  - - [2048, 3608, 1, 512, 2048, 2048, 2048, 512]
    - [25, 9426.11]
  - - [2048, 3776, 1, 512, 2048, 2048, 2048, 512]
    - [17, 9823.9]
  - - [2048, 3780, 1, 512, 2048, 2048, 2048, 512]
    - [24, 9781.88]
  - - [2048, 3796, 1, 512, 2048, 2048, 2048, 512]
    - [20, 9815.53]
  - - [2048, 3822, 1, 512, 2048, 2048, 2048, 512]
    - [30, 9822.69]
  - - [2048, 3840, 1, 512, 2048, 2048, 2048, 512]
    - [20, 9931.26]
  - - [2048, 3859, 1, 512, 2048, 2048, 2048, 512]
    - [31, 9413.86]
  - - [2048, 3864, 1, 512, 2048, 2048, 2048, 512]
    - [31, 9429.57]
  - - [2048, 3870, 1, 512, 2048, 2048, 2048, 512]
    - [30, 9442.45]
  - - [2048, 3876, 1, 512, 2048, 2048, 2048, 512]
    - [31, 9480.03]
  - - [2048, 3906, 1, 512, 2048, 2048, 2048, 512]
    - [25, 9569.48]
  - - [2048, 3910, 1, 512, 2048, 2048, 2048, 512]
    - [25, 9527.64]
  - - [2048, 3925, 1, 512, 2048, 2048, 2048, 512]
    - [24, 9562.41]
  - - [2048, 3942, 1, 512, 2048, 2048, 2048, 512]
    - [17, 9610.97]
  - - [2048, 3944, 1, 512, 2048, 2048, 2048, 512]
    - [24, 9599.78]
  - - [2048, 3955, 1, 512, 2048, 2048, 2048, 512]
    - [24, 9615.84]
  - - [2048, 3968, 1, 512, 2048, 2048, 2048, 512]
    - [24, 9694.2]
  - - [2048, 3969, 1, 512, 2048, 2048, 2048, 512]
    - [30, 9684.01]
  - - [2048, 3976, 1, 512, 2048, 2048, 2048, 512]
    - [31, 9675.87]
  - - [2048, 3977, 1, 512, 2048, 2048, 2048, 512]
    - [24, 9681.9]
  - - [2048, 3978, 1, 512, 2048, 2048, 2048, 512]
    - [31, 9671.76]
  - - [2048, 3990, 1, 512, 2048, 2048, 2048, 512]
    - [24, 9702.73]
  - - [2048, 3995, 1, 512, 2048, 2048, 2048, 512]
    - [25, 9727.52]
  - - [2048, 3996, 1, 512, 2048, 2048, 2048, 512]
    - [24, 9713.72]
  - - [2048, 3999, 1, 512, 2048, 2048, 2048, 512]
    - [24, 9708.41]
  - - [2048, 4005, 1, 512, 2048, 2048, 2048, 512]
    - [24, 9719.38]
  - - [2048, 4012, 1, 512, 2048, 2048, 2048, 512]
    - [20, 9741.77]
  - - [2048, 4020, 1, 512, 2048, 2048, 2048, 512]
    - [30, 9753.97]
  - - [2048, 4026, 1, 512, 2048, 2048, 2048, 512]
    - [24, 9773.97]
  - - [2048, 4030, 1, 512, 2048, 2048, 2048, 512]
    - [30, 9754.77]
  - - [2048, 4032, 1, 512, 2048, 2048, 2048, 512]
    - [31, 9808.51]
  - - [512, 160, 1, 2048, 512, 512, 512, 2048]
    - [65, 3647.22]
  - - [512, 174, 1, 2048, 512, 512, 512, 2048]
    - [65, 4065.33]
  - - [512, 184, 1, 2048, 512, 512, 512, 2048]
    - [65, 4329.85]
  - - [512, 189, 1, 2048, 512, 512, 512, 2048]
    - [66, 4415.79]
  - - [512, 208, 1, 512, 512, 512, 512, 512]
    - [73, 3704.21]
  - - [512, 246, 1, 512, 512, 512, 512, 512]
    - [72, 4580.07]
  - - [512, 264, 1, 2048, 512, 512, 512, 2048]
    - [69, 4571.07]
  - - [512, 439, 1, 2048, 512, 512, 512, 2048]
    - [60, 6268.04]
  - - [512, 443, 1, 2048, 512, 512, 512, 2048]
    - [62, 6401.86]
  - - [512, 446, 1, 2048, 512, 512, 512, 2048]
    - [62, 6431.04]
  - - [512, 465, 1, 512, 512, 512, 512, 512]
    - [58, 5837.98]
  - - [512, 465, 1, 2048, 512, 512, 512, 2048]
    - [60, 6646.51]
  - - [512, 468, 1, 512, 512, 512, 512, 512]
    - [59, 5875.64]
  - - [512, 476, 1, 512, 512, 512, 512, 512]
    - [58, 5930.63]
  - - [512, 493, 1, 512, 512, 512, 512, 512]
    - [59, 6142.44]
  - - [512, 493, 1, 2048, 512, 512, 512, 2048]
    - [57, 6397.87]
  - - [512, 511, 1, 2048, 512, 512, 512, 2048]
    - [61, 6585.82]
  - - [512, 512, 1, 2048, 512, 512, 512, 2048]
    - [57, 6624.76]
  - - [64, 7, 736, 7, 64, 64, 64, 7]
    - [94, 264.69]
  - - [64, 8, 264, 8, 64, 64, 64, 8]
    - [95, 195.896]
  - - [64, 9, 416, 9, 64, 64, 64, 9]
    - [98, 341.225]
  - - [64, 11, 568, 11, 64, 64, 64, 11]
    - [102, 578.762]
  - - [64, 12, 480, 12, 64, 64, 64, 12]
    - [98, 628.364]
  - - [64, 12, 2520, 12, 64, 64, 64, 12]
    - [93, 1147.45]
  - - [64, 13, 576, 13, 64, 64, 64, 13]
    - [99, 771.042]
  - - [64, 13, 2336, 13, 64, 64, 64, 13]
    - [93, 1253.28]
  - - [64, 14, 704, 14, 64, 64, 64, 14]
    - [92, 951.614]
  - - [64, 14, 2184, 14, 64, 64, 64, 14]
    - [97, 1358.93]
  - - [64, 15, 688, 15, 64, 64, 64, 15]
    - [92, 1006.83]
  - - [64, 15, 2048, 15, 64, 64, 64, 15]
    - [93, 1468.69]
  - - [64, 16, 712, 16, 64, 64, 64, 16]
    - [94, 1337.78]
  - - [64, 16, 1920, 16, 64, 64, 64, 16]
    - [98, 1812.06]
  - - [64, 17, 688, 17, 64, 64, 64, 17]
    - [100, 1161.06]
  - - [64, 18, 648, 18, 64, 64, 64, 18]
    - [94, 1199.73]
  - - [64, 19, 680, 19, 64, 64, 64, 19]
    - [100, 1326.92]
  - - [64, 23, 64, 23, 64, 64, 64, 23]
    - [46, 356.379]
  - - [64, 25, 176, 25, 64, 64, 64, 25]
    - [47, 956.522]
  - - [64, 25, 1256, 25, 64, 64, 64, 25]
    - [94, 2219.08]
  - - [64, 27, 56, 26, 64, 64, 64, 26]
    - [108, 408.436]
  - - [64, 27, 56, 27, 64, 64, 64, 27]
    - [108, 413.408]
  - - [64, 27, 1168, 27, 64, 64, 64, 27]
    - [101, 2285.83]
  - - [64, 29, 136, 29, 64, 64, 64, 29]
    - [105, 1016.68]
  - - [64, 29, 1088, 29, 64, 64, 64, 29]
    - [45, 2498.32]
  - - [64, 32, 624, 32, 64, 64, 64, 32]
    - [47, 2608.07]
  - - [64, 32, 992, 32, 64, 64, 64, 32]
    - [102, 3009.8]
  - - [64, 35, 384, 35, 64, 64, 64, 35]
    - [83, 2090.67]
  - - [64, 38, 320, 38, 64, 64, 64, 38]
    - [103, 2187.36]
  - - [64, 38, 840, 38, 64, 64, 64, 38]
    - [100, 3004.24]
  - - [64, 41, 776, 41, 64, 64, 64, 41]
    - [102, 3124.45]
  - - [64, 45, 392, 45, 64, 64, 64, 45]
    - [102, 2809.91]
  - - [64, 45, 712, 45, 64, 64, 64, 45]
    - [102, 3324.03]
  - - [64, 49, 648, 49, 64, 64, 64, 49]
    - [79, 3382.28]
  - - [64, 54, 200, 54, 64, 64, 64, 54]
    - [75, 2666.06]
  - - [64, 54, 592, 54, 64, 64, 64, 54]
    - [79, 3712.41]
  - - [64, 59, 512, 59, 64, 64, 64, 59]
    - [107, 3949.63]
  - - [64, 59, 544, 59, 64, 64, 64, 59]
    - [47, 3864.62]
  - - [64, 64, 496, 64, 64, 64, 64, 64]
    - [52, 4808.56]
  - - [64, 65, 472, 65, 64, 64, 64, 65]
    - [81, 3844.24]
  - - [64, 65, 496, 64, 64, 64, 64, 64]
    - [78, 3996.82]
  - - [64, 65, 496, 65, 64, 64, 64, 65]
    - [76, 3907.88]
  - - [64, 70, 216, 70, 64, 64, 64, 70]
    - [74, 3386.88]
  - - [64, 71, 216, 70, 64, 64, 64, 70]
    - [89, 3421.58]
  - - [64, 71, 216, 71, 64, 64, 64, 71]
    - [81, 3512.44]
  - - [64, 71, 448, 71, 64, 64, 64, 71]
    - [83, 4172.5]
  - - [64, 77, 248, 77, 64, 64, 64, 77]
    - [86, 4014.72]
  - - [64, 77, 408, 77, 64, 64, 64, 77]
    - [83, 4398.24]
  - - [64, 78, 248, 77, 64, 64, 64, 77]
    - [80, 4012.09]
  - - [64, 78, 248, 78, 64, 64, 64, 78]
    - [85, 4119.68]
  - - [64, 78, 408, 77, 64, 64, 64, 77]
    - [79, 4435.2]
  - - [64, 78, 408, 78, 64, 64, 64, 78]
    - [84, 4523.5]
  - - [64, 80, 152, 80, 64, 64, 64, 80]
    - [91, 3852.67]
  - - [64, 84, 152, 80, 64, 64, 64, 80]
    - [82, 3800.71]
  - - [64, 84, 152, 84, 64, 64, 64, 84]
    - [82, 3847.58]
  - - [64, 85, 376, 85, 64, 64, 64, 85]
    - [75, 4786.96]
  - - [64, 91, 40, 91, 64, 64, 64, 91]
    - [110, 2190.02]
  - - [64, 93, 40, 91, 64, 64, 64, 91]
    - [49, 2219.8]
  - - [64, 93, 40, 93, 64, 64, 64, 93]
    - [111, 2250.15]
  - - [64, 93, 344, 93, 64, 64, 64, 93]
    - [75, 5010.96]
  - - [64, 102, 56, 102, 64, 64, 64, 102]
    - [90, 2741.76]
  - - [64, 102, 312, 102, 64, 64, 64, 102]
    - [55, 5132.09]
  - - [64, 104, 16, 103, 64, 64, 64, 103]
    - [50, 1171.91]
  - - [64, 104, 16, 104, 64, 64, 64, 104]
    - [106, 1214.43]
  - - [64, 112, 16, 112, 64, 64, 64, 112]
    - [104, 1408.45]
  - - [64, 119, 32, 119, 64, 64, 64, 119]
    - [51, 2552.97]
  - - [64, 122, 264, 122, 64, 64, 64, 122]
    - [55, 5593.42]
  - - [64, 122, 264, 123, 64, 64, 64, 123]
    - [55, 5619.27]
  - - [64, 123, 16, 112, 64, 64, 64, 112]
    - [109, 1481.79]
  - - [64, 123, 264, 123, 64, 64, 64, 123]
    - [54, 5645.31]
  - - [64, 134, 240, 134, 64, 64, 64, 134]
    - [88, 5489.73]
  - - [64, 134, 240, 135, 64, 64, 64, 135]
    - [87, 5539.52]
  - - [64, 135, 32, 119, 64, 64, 64, 119]
    - [106, 2688.0]
  - - [64, 135, 32, 135, 64, 64, 64, 135]
    - [110, 2760.71]
  - - [64, 135, 240, 135, 64, 64, 64, 135]
    - [87, 5554.29]
- null
