test_dir/py38/lib/python3.6/site-packages/Tensile/Configs/miopen/archives/bert/2020-04-27/exact/vega20_Cijk_Ailk_Bljk_SB.yaml
- {MinimumRequiredVersion: 4.18.0}
- vega20
- gfx906
- [Device 66a0, Device 66a1, Device 66a7, Device 66af, Vega 20]
- - - [1024, 32, 1, 2, 1024, 1024, 1024, 2]
    - [11, 15.0]
  - - [1024, 32, 1, 1024, 1024, 1024, 1024, 1024]
    - [13, 1762.0]
  - - [1024, 4096, 1, 30528, 1024, 1024, 1024, 30528]
    - [7, 13919.0]
  - - [1024, 4096, 1, 1024, 1024, 1024, 1024, 1024]
    - [5, 13136.0]
  - - [4096, 4096, 1, 1024, 4096, 4096, 4096, 1024]
    - [9, 13510.0]
  - - [1024, 4096, 1, 4096, 1024, 1024, 1024, 4096]
    - [3, 13293.0]
  - - [1024, 2048, 1, 1024, 1024, 1024, 1024, 1024]
    - [6, 12968.0]
  - - [1024, 2048, 1, 4096, 1024, 1024, 1024, 4096]
    - [4, 13518.0]
  - - [4096, 2048, 1, 1024, 4096, 4096, 4096, 1024]
    - [2, 13499.0]
  - - [1024, 2048, 1, 30528, 1024, 1024, 1024, 30528]
    - [8, 13903.0]
  - - [1024, 4, 1, 1024, 1024, 1024, 1024, 1024]
    - [12, 238.0]
  - - [1024, 4, 1, 2, 1024, 1024, 1024, 2]
    - [0, 2.0]
  - - [128, 128, 512, 64, 128, 128, 128, 64]
    - [0, 8877.0]
  - - [64, 128, 512, 128, 64, 64, 64, 128]
    - [10, 8254.0]
  - - [64, 512, 64, 512, 64, 64, 64, 512]
    - [14, 9155.0]
  - - [512, 512, 64, 64, 512, 512, 512, 64]
    - [1, 10644.0]
- null
