src/Tensile/data/Configs/miopen/archives/resnet50/2018-10-09/logic/resnet50/vega20_Cijk_Ailk_Bjlk_HBH.yaml
- {MinimumRequiredVersion: 4.5.0}
- vega20
- gfx906
- [Device 66a0, Device 66a1, Device 66a7]
    SolutionIndex: 0
    SolutionNameMin: Cijk_Ailk_Bjlk_HBH_MT128x064x08_GRVW04_PGR1_PLR1_TT08_04_VW04_WG16_16_01_WGM01
    SolutionIndex: 1
    SolutionNameMin: Cijk_Ailk_Bjlk_HBH_MT032x128x16_GRVW04_PGR0_PLR1_TT04_04_VW04_WG08_32_01_WGM01
    SolutionIndex: 2
    SolutionNameMin: Cijk_Ailk_Bjlk_HBH_MT032x128x16_GRVW04_PGR1_PLR1_TT04_04_VW04_WG08_32_01_WGM01
    SolutionIndex: 3
    SolutionNameMin: Cijk_Ailk_Bjlk_HBH_MT064x064x16_GRVW04_PGR0_PLR1_TT04_04_VW04_WG16_16_01_WGM01
    SolutionIndex: 4
    SolutionNameMin: Cijk_Ailk_Bjlk_HBH_MT128x064x16_GRVW04_PGR1_PLR1_TT08_04_VW04_WG16_16_01_WGM01
    SolutionIndex: 5
    SolutionNameMin: Cijk_Ailk_Bjlk_HBH_MT032x128x32_GRVW04_PGR0_PLR1_TT04_04_VW04_WG08_32_01_WGM01
    SolutionIndex: 6
    SolutionNameMin: Cijk_Ailk_Bjlk_HBH_MT064x064x32_GRVW04_PGR0_PLR1_TT04_04_VW04_WG16_16_01_WGM01
    SolutionIndex: 7
    SolutionNameMin: Cijk_Ailk_Bjlk_HBH_MT064x256x16_GRVW08_PGR1_PLR1_TT08_08_VW08_WG08_32_01_WGM01
- - - [3136, 256, 64, 64]
    - [7, 8547.22]
  - - [784, 512, 64, 128]
    - [1, 8599.08]
  - - [784, 128, 128, 512]
    - [5, 9132.1]
  - - [3136, 64, 128, 64]
    - [4, 8187.98]
  - - [196, 256, 128, 1024]
    - [2, 8153.86]
  - - [196, 256, 64, 1024]
    - [2, 7975.08]
  - - [196, 1024, 128, 256]
    - [1, 8065.86]
  - - [3136, 64, 64, 256]
    - [6, 9091.71]
  - - [3136, 64, 128, 256]
    - [3, 9225.36]
  - - [784, 128, 64, 512]
    - [2, 8955.04]
  - - [784, 512, 128, 128]
    - [1, 8676.22]
  - - [196, 1024, 64, 256]
    - [1, 7961.18]
  - - [3136, 64, 64, 64]
    - [0, 8003.03]
  - - [3136, 256, 128, 64]
    - [7, 8598.18]
- null
