Tensile/Configs/miopen/archives/phantom/2019-08-26/exact/vega20_Cijk_Ailk_Bjlk_SB.yaml
- {MinimumRequiredVersion: 4.10.0}
- vega20
- gfx906
- [Device 66a0, Device 66a1, Device 66a7, Vega 20]
    SolutionIndex: 0
    SolutionNameMin: Cijk_Ailk_Bjlk_SB_MT64x64x16_SE_EPS1_FL0_GRVW4_GSU1_PGR1_PLR0_TT4_4_USFGRO0_VW4_WG16_16_1_WGM8
    SolutionIndex: 1
    SolutionNameMin: Cijk_Ailk_Bjlk_SB_MT64x64x16_SE_EPS1_FL0_GRVW4_GSU1_PGR1_PLR1_TT4_4_USFGRO0_VW4_WG16_16_1_WGM1
    SolutionIndex: 2
    SolutionNameMin: Cijk_Ailk_Bjlk_SB_MT64x64x16_SE_EPS1_FL1_GRVW4_GSU1_PGR1_PLR1_TT4_4_USFGRO0_VW4_WG16_16_1_WGM1
    SolutionIndex: 3
    SolutionNameMin: Cijk_Ailk_Bjlk_SB_MT64x64x16_SE_EPS1_FL1_GRVW4_GSU1_PGR1_PLR1_TT4_4_USFGRO0_VW4_WG16_16_1_WGM8
    SolutionIndex: 4
    SolutionNameMin: Cijk_Ailk_Bjlk_SB_MT64x96x8_SE_EPS1_FL1_GRVW2_GSU1_PGR1_PLR0_TT4_6_USFGRO0_VW2_WG16_16_1_WGM1
    SolutionIndex: 5
    SolutionNameMin: Cijk_Ailk_Bjlk_SB_MT64x96x8_SE_EPS1_FL1_GRVW2_GSU1_PGR1_PLR1_TT4_6_USFGRO0_VW2_WG16_16_1_WGM1
    SolutionIndex: 6
    SolutionNameMin: Cijk_Ailk_Bjlk_SB_MT64x96x8_SE_EPS1_FL1_GRVW2_GSU1_PGR1_PLR1_TT4_6_USFGRO0_VW2_WG16_16_1_WGM8
    SolutionIndex: 7
    SolutionNameMin: Cijk_Ailk_Bjlk_SB_MT64x128x8_SE_EPS1_FL0_GRVW2_GSU1_PGR1_PLR1_TT4_8_USFGRO0_VW2_WG16_16_1_WGM1
    SolutionIndex: 8
    SolutionNameMin: Cijk_Ailk_Bjlk_SB_MT64x128x8_SE_EPS1_FL1_GRVW2_GSU1_PGR1_PLR1_TT4_8_USFGRO0_VW2_WG16_16_1_WGM1
    SolutionIndex: 9
    SolutionNameMin: Cijk_Ailk_Bjlk_SB_MT64x128x8_SE_EPS1_FL1_GRVW2_GSU1_PGR1_PLR1_TT4_8_USFGRO0_VW2_WG16_16_1_WGM8
    SolutionIndex: 10
    SolutionNameMin: Cijk_Ailk_Bjlk_SB_MT128x64x8_SE_EPS1_FL0_GRVW2_GSU1_PGR1_PLR1_TT8_4_USFGRO0_VW2_WG16_16_1_WGM1
    SolutionIndex: 11
    SolutionNameMin: Cijk_Ailk_Bjlk_SB_MT128x64x8_SE_EPS1_FL0_GRVW2_GSU1_PGR1_PLR1_TT8_4_USFGRO0_VW2_WG16_16_1_WGM8
    SolutionIndex: 12
    SolutionNameMin: Cijk_Ailk_Bjlk_SB_MT128x64x8_SE_EPS1_FL1_GRVW2_GSU1_PGR1_PLR1_TT8_4_USFGRO0_VW2_WG16_16_1_WGM1
    SolutionIndex: 13
    SolutionNameMin: Cijk_Ailk_Bjlk_SB_MT128x128x8_SE_EPS1_FL0_GRVW1_GSU1_PGR1_PLR1_TT8_8_USFGRO1_VW2_WG16_16_1_WGM1
    SolutionIndex: 14
    SolutionNameMin: Cijk_Ailk_Bjlk_SB_MT128x128x8_SE_EPS1_FL0_GRVW1_GSU1_PGR1_PLR0_TT8_8_USFGRO1_VW4_WG16_16_1_WGM8
    SolutionIndex: 15
    SolutionNameMin: Cijk_Ailk_Bjlk_SB_MT32x64x32_SE_EPS1_FL0_GRVW4_GSU1_PGR1_PLR1_TT4_4_USFGRO0_VW4_WG8_16_2_WGM1
    SolutionIndex: 16
    SolutionNameMin: Cijk_Ailk_Bjlk_SB_MT32x64x32_SE_EPS1_FL0_GRVW4_GSU1_PGR1_PLR1_TT4_4_USFGRO0_VW4_WG8_16_2_WGM8
    SolutionIndex: 17
    SolutionNameMin: Cijk_Ailk_Bjlk_SB_MT32x64x32_SE_EPS1_FL1_GRVW4_GSU1_PGR1_PLR1_TT4_4_USFGRO0_VW4_WG8_16_2_WGM1
    SolutionIndex: 18
    SolutionNameMin: Cijk_Ailk_Bjlk_SB_MT32x64x32_SE_EPS1_FL1_GRVW4_GSU1_PGR1_PLR1_TT4_4_USFGRO0_VW4_WG8_16_2_WGM8
    SolutionIndex: 19
    SolutionNameMin: Cijk_Ailk_Bjlk_SB_MT64x32x32_SE_EPS1_FL0_GRVW4_GSU1_PGR1_PLR1_TT4_4_USFGRO0_VW4_WG16_8_2_WGM8
    SolutionIndex: 20
    SolutionNameMin: Cijk_Ailk_Bjlk_SB_MT64x32x32_SE_EPS1_FL1_GRVW4_GSU1_PGR1_PLR1_TT4_4_USFGRO0_VW4_WG16_8_2_WGM8
- - - [1024, 256, 1, 18944, 1024, 1024, 1024, 256]
    - [18, 9196.41]
  - - [256, 3328, 1, 8976, 256, 256, 256, 3328]
    - [8, 8299.26]
  - - [1024, 256, 1, 4352, 1024, 1024, 1024, 256]
    - [16, 8813.74]
  - - [256, 9728, 1, 8976, 256, 256, 256, 9728]
    - [11, 9638.48]
  - - [1024, 256, 1, 3072, 1024, 1024, 1024, 256]
    - [18, 8640.63]
  - - [768, 2048, 1, 256, 768, 768, 768, 2048]
    - [10, 8662.93]
  - - [1024, 256, 1, 19968, 1024, 1024, 1024, 256]
    - [15, 9220.86]
  - - [256, 12800, 1, 8976, 256, 256, 256, 12800]
    - [5, 9418.42]
  - - [1024, 256, 1, 3328, 1024, 1024, 1024, 256]
    - [19, 8682.48]
  - - [256, 10240, 1, 8976, 256, 256, 256, 10240]
    - [12, 10137.7]
  - - [1024, 256, 1, 15104, 1024, 1024, 1024, 256]
    - [17, 9167.03]
  - - [256, 10496, 1, 8976, 256, 256, 256, 10496]
    - [5, 9858.38]
  - - [1024, 256, 1, 2816, 1024, 1024, 1024, 256]
    - [20, 8575.71]
  - - [1024, 256, 1, 4608, 1024, 1024, 1024, 256]
    - [15, 8861.21]
  - - [256, 11264, 1, 8976, 256, 256, 256, 11264]
    - [2, 9627.69]
  - - [1024, 256, 1, 6400, 1024, 1024, 1024, 256]
    - [15, 8985.23]
  - - [1024, 256, 1, 16128, 1024, 1024, 1024, 256]
    - [15, 9170.26]
  - - [256, 44505, 1, 8976, 256, 256, 256, 44505]
    - [9, 10331.8]
  - - [256, 6144, 1, 8976, 256, 256, 256, 6144]
    - [12, 10395.0]
  - - [1024, 256, 1, 5120, 1024, 1024, 1024, 256]
    - [17, 8881.53]
  - - [1024, 256, 1, 7936, 1024, 1024, 1024, 256]
    - [20, 9023.14]
  - - [256, 3840, 1, 8976, 256, 256, 256, 3840]
    - [7, 9541.28]
  - - [1024, 256, 1, 21248, 1024, 1024, 1024, 256]
    - [15, 9209.72]
  - - [1024, 256, 1, 12032, 1024, 1024, 1024, 256]
    - [17, 9156.17]
  - - [256, 8192, 1, 8976, 256, 256, 256, 8192]
    - [14, 10374.4]
  - - [1024, 256, 1, 3584, 1024, 1024, 1024, 256]
    - [16, 8712.2]
  - - [1024, 256, 1, 14336, 1024, 1024, 1024, 256]
    - [17, 9162.51]
  - - [256, 7168, 1, 8976, 256, 256, 256, 7168]
    - [3, 9554.86]
  - - [1024, 256, 1, 13568, 1024, 1024, 1024, 256]
    - [15, 9165.04]
  - - [256, 4096, 1, 8976, 256, 256, 256, 4096]
    - [7, 10146.6]
  - - [1024, 256, 1, 4096, 1024, 1024, 1024, 256]
    - [16, 8783.88]
  - - [256, 2560, 1, 8976, 256, 256, 256, 2560]
    - [6, 8381.56]
  - - [256, 20992, 1, 8976, 256, 256, 256, 20992]
    - [5, 9989.86]
  - - [256, 4352, 1, 8976, 256, 256, 256, 4352]
    - [6, 9634.92]
  - - [256, 33536, 1, 8976, 256, 256, 256, 33536]
    - [5, 10218.1]
  - - [256, 3584, 1, 8976, 256, 256, 256, 3584]
    - [7, 8924.5]
  - - [256, 26112, 1, 8976, 256, 256, 256, 26112]
    - [6, 10272.3]
  - - [256, 14336, 1, 8976, 256, 256, 256, 14336]
    - [10, 10217.3]
  - - [1024, 256, 1, 14848, 1024, 1024, 1024, 256]
    - [17, 9185.19]
  - - [1024, 256, 1, 8448, 1024, 1024, 1024, 256]
    - [18, 9025.89]
  - - [1024, 256, 1, 28672, 1024, 1024, 1024, 256]
    - [15, 9256.4]
  - - [1024, 256, 1, 5632, 1024, 1024, 1024, 256]
    - [15, 8932.69]
  - - [256, 22016, 1, 8976, 256, 256, 256, 22016]
    - [10, 10151.9]
  - - [1024, 256, 1, 33536, 1024, 1024, 1024, 256]
    - [15, 9243.07]
  - - [256, 5120, 1, 8976, 256, 256, 256, 5120]
    - [1, 9418.05]
  - - [256, 11520, 1, 8976, 256, 256, 256, 11520]
    - [8, 9701.0]
  - - [256, 19968, 1, 8976, 256, 256, 256, 19968]
    - [6, 10228.0]
  - - [1024, 256, 1, 5376, 1024, 1024, 1024, 256]
    - [17, 8892.52]
  - - [1024, 256, 1, 22016, 1024, 1024, 1024, 256]
    - [15, 9244.24]
  - - [256, 8960, 1, 8976, 256, 256, 256, 8960]
    - [6, 9841.31]
  - - [1024, 256, 1, 15872, 1024, 1024, 1024, 256]
    - [15, 9223.15]
  - - [256, 17408, 1, 8976, 256, 256, 256, 17408]
    - [10, 9785.77]
  - - [256, 5632, 1, 8976, 256, 256, 256, 5632]
    - [10, 9564.22]
  - - [256, 32512, 1, 8976, 256, 256, 256, 32512]
    - [9, 10357.9]
  - - [256, 11008, 1, 8976, 256, 256, 256, 11008]
    - [2, 9445.13]
  - - [1024, 256, 1, 6144, 1024, 1024, 1024, 256]
    - [17, 8955.81]
  - - [256, 4864, 1, 8976, 256, 256, 256, 4864]
    - [2, 8979.35]
  - - [256, 15104, 1, 8976, 256, 256, 256, 15104]
    - [5, 10007.0]
  - - [1024, 256, 1, 9984, 1024, 1024, 1024, 256]
    - [15, 9110.43]
  - - [256, 1280, 1, 8976, 256, 256, 256, 1280]
    - [1, 5944.34]
  - - [1024, 256, 1, 1024, 1024, 1024, 1024, 256]
    - [17, 7005.1]
  - - [1024, 256, 1, 9728, 1024, 1024, 1024, 256]
    - [17, 9066.19]
  - - [1024, 256, 1, 10496, 1024, 1024, 1024, 256]
    - [15, 9118.05]
  - - [256, 11776, 1, 8976, 256, 256, 256, 11776]
    - [12, 9911.64]
  - - [256, 12544, 1, 8976, 256, 256, 256, 12544]
    - [5, 9235.25]
  - - [1024, 256, 1, 17152, 1024, 1024, 1024, 256]
    - [15, 9152.21]
  - - [1024, 256, 1, 11520, 1024, 1024, 1024, 256]
    - [17, 9146.77]
  - - [1024, 256, 1, 21504, 1024, 1024, 1024, 256]
    - [17, 9207.42]
  - - [256, 17152, 1, 8976, 256, 256, 256, 17152]
    - [4, 9654.71]
  - - [1024, 256, 1, 17408, 1024, 1024, 1024, 256]
    - [15, 9181.17]
  - - [256, 15872, 1, 8976, 256, 256, 256, 15872]
    - [13, 10086.4]
  - - [256, 18688, 1, 8976, 256, 256, 256, 18688]
    - [6, 9612.47]
  - - [256, 5888, 1, 8976, 256, 256, 256, 5888]
    - [10, 9988.33]
  - - [512, 2048, 1, 256, 512, 512, 512, 2048]
    - [0, 7678.36]
  - - [1024, 256, 1, 7680, 1024, 1024, 1024, 256]
    - [18, 9032.96]
  - - [1024, 256, 1, 1280, 1024, 1024, 1024, 256]
    - [20, 7767.23]
  - - [256, 14848, 1, 8976, 256, 256, 256, 14848]
    - [6, 9852.66]
  - - [256, 9984, 1, 8976, 256, 256, 256, 9984]
    - [12, 9908.87]
  - - [256, 20480, 1, 8976, 256, 256, 256, 20480]
    - [10, 10337.1]
  - - [1024, 256, 1, 8192, 1024, 1024, 1024, 256]
    - [17, 9044.32]
  - - [1024, 256, 1, 19712, 1024, 1024, 1024, 256]
    - [16, 9184.18]
  - - [256, 13568, 1, 8976, 256, 256, 256, 13568]
    - [6, 9927.82]
  - - [256, 13312, 1, 8976, 256, 256, 256, 13312]
    - [5, 9757.91]
  - - [256, 2816, 1, 8976, 256, 256, 256, 2816]
    - [5, 9191.43]
  - - [1024, 256, 1, 2304, 1024, 1024, 1024, 256]
    - [16, 8444.91]
  - - [256, 21248, 1, 8976, 256, 256, 256, 21248]
    - [6, 10127.5]
  - - [256, 16128, 1, 8976, 256, 256, 256, 16128]
    - [14, 10238.4]
- null
