Tensile/Configs/miopen/archives/phantom/2019-08-26/exact/vega20_Cijk_Alik_Bljk_SB.yaml
- {MinimumRequiredVersion: 4.10.0}
- vega20
- gfx906
- [Device 66a0, Device 66a1, Device 66a7, Vega 20]
    SolutionIndex: 0
    SolutionNameMin: Cijk_Alik_Bljk_SB_MT64x64x16_SE_EPS1_FL0_GRVW2_GSU1_PGR1_PLR1_TT4_4_VW2_WG16_16_1_WGM1
    SolutionIndex: 1
    SolutionNameMin: Cijk_Alik_Bljk_SB_MT64x64x16_SE_EPS1_FL0_GRVW2_GSU1_PGR1_PLR1_TT4_4_VW4_WG16_16_1_WGM1
    SolutionIndex: 2
    SolutionNameMin: Cijk_Alik_Bljk_SB_MT64x64x16_SE_EPS1_FL0_GRVW4_GSU1_PGR1_PLR1_TT4_4_VW4_WG16_16_1_WGM1
    SolutionIndex: 3
    SolutionNameMin: Cijk_Alik_Bljk_SB_MT64x64x16_SE_EPS1_FL0_GRVW4_GSU1_PGR1_PLR1_TT4_4_VW4_WG16_16_1_WGM8
    SolutionIndex: 4
    SolutionNameMin: Cijk_Alik_Bljk_SB_MT64x64x16_SE_EPS1_FL1_GRVW2_GSU1_PGR1_PLR1_TT4_4_VW4_WG16_16_1_WGM1
    SolutionIndex: 5
    SolutionNameMin: Cijk_Alik_Bljk_SB_MT64x64x16_SE_EPS1_FL1_GRVW4_GSU1_PGR1_PLR1_TT4_4_VW2_WG16_16_1_WGM8
    SolutionIndex: 6
    SolutionNameMin: Cijk_Alik_Bljk_SB_MT64x64x16_SE_EPS1_FL1_GRVW4_GSU1_PGR1_PLR1_TT4_4_VW4_WG16_16_1_WGM1
    SolutionIndex: 7
    SolutionNameMin: Cijk_Alik_Bljk_SB_MT64x64x16_SE_EPS0_FL1_GRVW4_GSU1_PGR0_PLR1_TT4_4_VW4_WG16_16_1_WGM8
    SolutionIndex: 8
    SolutionNameMin: Cijk_Alik_Bljk_SB_MT64x96x16_SE_EPS1_FL0_GRVW2_GSU1_PGR1_PLR1_TT4_6_VW2_WG16_16_1_WGM1
    SolutionIndex: 9
    SolutionNameMin: Cijk_Alik_Bljk_SB_MT64x96x16_SE_EPS1_FL0_GRVW2_GSU1_PGR1_PLR1_TT4_6_VW2_WG16_16_1_WGM8
    SolutionIndex: 10
    SolutionNameMin: Cijk_Alik_Bljk_SB_MT64x128x8_SE_EPS1_FL0_GRVW4_GSU1_PGR1_PLR0_TT4_8_VW4_WG16_16_1_WGM1
    SolutionIndex: 11
    SolutionNameMin: Cijk_Alik_Bljk_SB_MT64x128x16_SE_EPS1_FL0_GRVW4_GSU1_PGR1_PLR0_TT4_8_VW4_WG16_16_1_WGM8
    SolutionIndex: 12
    SolutionNameMin: Cijk_Alik_Bljk_SB_MT64x128x16_SE_EPS1_FL0_GRVW4_GSU1_PGR1_PLR1_TT4_8_VW4_WG16_16_1_WGM1
    SolutionIndex: 13
    SolutionNameMin: Cijk_Alik_Bljk_SB_MT64x128x16_SE_EPS1_FL0_GRVW4_GSU1_PGR1_PLR1_TT4_8_VW4_WG16_16_1_WGM8
    SolutionIndex: 14
    SolutionNameMin: Cijk_Alik_Bljk_SB_MT64x128x8_SE_EPS1_FL1_GRVW2_GSU1_PGR1_PLR1_TT4_8_VW4_WG16_16_1_WGM1
    SolutionIndex: 15
    SolutionNameMin: Cijk_Alik_Bljk_SB_MT64x128x16_SE_EPS1_FL1_GRVW4_GSU1_PGR1_PLR1_TT4_8_VW2_WG16_16_1_WGM8
    SolutionIndex: 16
    SolutionNameMin: Cijk_Alik_Bljk_SB_MT64x128x8_SE_EPS1_FL1_GRVW4_GSU1_PGR1_PLR0_TT4_8_VW4_WG16_16_1_WGM8
    SolutionIndex: 17
    SolutionNameMin: Cijk_Alik_Bljk_SB_MT64x128x16_SE_EPS1_FL1_GRVW4_GSU1_PGR1_PLR1_TT4_8_VW4_WG16_16_1_WGM1
    SolutionIndex: 18
    SolutionNameMin: Cijk_Alik_Bljk_SB_MT64x128x16_SE_EPS1_FL1_GRVW4_GSU1_PGR1_PLR1_TT4_8_VW4_WG16_16_1_WGM8
    SolutionIndex: 19
    SolutionNameMin: Cijk_Alik_Bljk_SB_MT128x64x8_SE_EPS1_FL0_GRVW2_GSU1_PGR1_PLR0_TT8_4_VW4_WG16_16_1_WGM1
    SolutionIndex: 20
    SolutionNameMin: Cijk_Alik_Bljk_SB_MT128x64x8_SE_EPS1_FL0_GRVW2_GSU1_PGR1_PLR0_TT8_4_VW4_WG16_16_1_WGM8
    SolutionIndex: 21
    SolutionNameMin: Cijk_Alik_Bljk_SB_MT128x64x8_SE_EPS1_FL0_GRVW4_GSU1_PGR1_PLR0_TT8_4_VW2_WG16_16_1_WGM8
    SolutionIndex: 22
    SolutionNameMin: Cijk_Alik_Bljk_SB_MT128x64x8_SE_EPS1_FL0_GRVW4_GSU1_PGR1_PLR0_TT8_4_VW4_WG16_16_1_WGM8
    SolutionIndex: 23
    SolutionNameMin: Cijk_Alik_Bljk_SB_MT128x64x16_SE_EPS1_FL0_GRVW4_GSU1_PGR1_PLR1_TT8_4_VW4_WG16_16_1_WGM1
    SolutionIndex: 24
    SolutionNameMin: Cijk_Alik_Bljk_SB_MT128x64x8_SE_EPS1_FL1_GRVW2_GSU1_PGR1_PLR0_TT8_4_VW4_WG16_16_1_WGM1
    SolutionIndex: 25
    SolutionNameMin: Cijk_Alik_Bljk_SB_MT128x64x8_SE_EPS1_FL1_GRVW2_GSU1_PGR1_PLR0_TT8_4_VW4_WG16_16_1_WGM8
    SolutionIndex: 26
    SolutionNameMin: Cijk_Alik_Bljk_SB_MT128x64x8_SE_EPS1_FL1_GRVW2_GSU1_PGR1_PLR1_TT8_4_VW4_WG16_16_1_WGM1
    SolutionIndex: 27
    SolutionNameMin: Cijk_Alik_Bljk_SB_MT128x64x8_SE_EPS1_FL1_GRVW4_GSU1_PGR1_PLR0_TT8_4_VW2_WG16_16_1_WGM1
    SolutionIndex: 28
    SolutionNameMin: Cijk_Alik_Bljk_SB_MT128x64x8_SE_EPS1_FL1_GRVW4_GSU1_PGR1_PLR0_TT8_4_VW2_WG16_16_1_WGM8
    SolutionIndex: 29
    SolutionNameMin: Cijk_Alik_Bljk_SB_MT128x64x8_SE_EPS1_FL1_GRVW4_GSU1_PGR1_PLR0_TT8_4_VW4_WG16_16_1_WGM8
    SolutionIndex: 30
    SolutionNameMin: Cijk_Alik_Bljk_SB_MT128x64x8_SE_EPS1_FL1_GRVW4_GSU1_PGR1_PLR1_TT8_4_VW4_WG16_16_1_WGM1
    SolutionIndex: 31
    SolutionNameMin: Cijk_Alik_Bljk_SB_MT128x128x16_SE_EPS1_FL0_GRVW2_GSU1_PGR1_PLR0_TT8_8_VW2_WG16_16_1_WGM1
    SolutionIndex: 32
    SolutionNameMin: Cijk_Alik_Bljk_SB_MT128x128x16_SE_EPS1_FL0_GRVW2_GSU1_PGR1_PLR0_TT8_8_VW2_WG16_16_1_WGM8
    SolutionIndex: 33
    SolutionNameMin: Cijk_Alik_Bljk_SB_MT128x128x16_SE_EPS1_FL0_GRVW2_GSU1_PGR1_PLR0_TT8_8_VW4_WG16_16_1_WGM1
    SolutionIndex: 34
    SolutionNameMin: Cijk_Alik_Bljk_SB_MT128x128x16_SE_EPS1_FL0_GRVW2_GSU1_PGR1_PLR1_TT8_8_VW4_WG16_16_1_WGM1
    SolutionIndex: 35
    SolutionNameMin: Cijk_Alik_Bljk_SB_MT128x128x16_SE_EPS1_FL0_GRVW2_GSU1_PGR1_PLR1_TT8_8_VW4_WG16_16_1_WGM8
    SolutionIndex: 36
    SolutionNameMin: Cijk_Alik_Bljk_SB_MT128x128x16_SE_EPS1_FL0_GRVW4_GSU1_PGR1_PLR1_TT8_8_VW2_WG16_16_1_WGM1
    SolutionIndex: 37
    SolutionNameMin: Cijk_Alik_Bljk_SB_MT128x128x16_SE_EPS1_FL0_GRVW4_GSU1_PGR1_PLR1_TT8_8_VW4_WG16_16_1_WGM1
    SolutionIndex: 38
    SolutionNameMin: Cijk_Alik_Bljk_SB_MT128x128x16_SE_EPS1_FL1_GRVW2_GSU1_PGR1_PLR0_TT8_8_VW2_WG16_16_1_WGM1
    SolutionIndex: 39
    SolutionNameMin: Cijk_Alik_Bljk_SB_MT128x128x16_SE_EPS1_FL1_GRVW2_GSU1_PGR1_PLR1_TT8_8_VW2_WG16_16_1_WGM1
    SolutionIndex: 40
    SolutionNameMin: Cijk_Alik_Bljk_SB_MT128x128x16_SE_EPS1_FL1_GRVW2_GSU1_PGR1_PLR0_TT8_8_VW4_WG16_16_1_WGM8
    SolutionIndex: 41
    SolutionNameMin: Cijk_Alik_Bljk_SB_MT128x128x16_SE_EPS1_FL1_GRVW2_GSU1_PGR1_PLR1_TT8_8_VW4_WG16_16_1_WGM1
    SolutionIndex: 42
    SolutionNameMin: Cijk_Alik_Bljk_SB_MT128x128x16_SE_EPS1_FL1_GRVW2_GSU1_PGR1_PLR1_TT8_8_VW4_WG16_16_1_WGM8
    SolutionIndex: 43
    SolutionNameMin: Cijk_Alik_Bljk_SB_MT128x128x16_SE_EPS1_FL1_GRVW4_GSU1_PGR1_PLR0_TT8_8_VW2_WG16_16_1_WGM1
    SolutionIndex: 44
    SolutionNameMin: Cijk_Alik_Bljk_SB_MT128x128x16_SE_EPS1_FL1_GRVW4_GSU1_PGR1_PLR0_TT8_8_VW4_WG16_16_1_WGM8
    SolutionIndex: 45
    SolutionNameMin: Cijk_Alik_Bljk_SB_MT128x128x16_SE_EPS1_FL1_GRVW4_GSU1_PGR1_PLR1_TT8_8_VW4_WG16_16_1_WGM1
    SolutionIndex: 46
    SolutionNameMin: Cijk_Alik_Bljk_SB_MT128x128x16_SE_EPS1_FL1_GRVW4_GSU1_PGR1_PLR1_TT8_8_VW4_WG16_16_1_WGM8
    SolutionIndex: 47
    SolutionNameMin: Cijk_Alik_Bljk_SB_MT32x64x16_SE_EPS1_FL0_GRVW4_GSU1_PGR1_PLR1_TT4_4_VW4_WG8_16_2_WGM1
    SolutionIndex: 48
    SolutionNameMin: Cijk_Alik_Bljk_SB_MT32x64x16_SE_EPS1_FL0_GRVW4_GSU1_PGR1_PLR1_TT4_4_VW4_WG8_16_2_WGM8
    SolutionIndex: 49
    SolutionNameMin: Cijk_Alik_Bljk_SB_MT64x32x16_SE_EPS1_FL0_GRVW4_GSU1_PGR1_PLR1_TT4_4_VW2_WG16_8_2_WGM8
- - - [256, 1280, 1, 1024, 256, 256, 1024, 1024]
    - [6, 4337.44]
  - - [256, 44505, 1, 1024, 256, 256, 1024, 1024]
    - [42, 8597.69]
  - - [10240, 8976, 1, 256, 10240, 10240, 256, 256]
    - [45, 9471.43]
  - - [256, 7168, 1, 1024, 256, 256, 1024, 1024]
    - [36, 6718.56]
  - - [8448, 8976, 1, 256, 8448, 8448, 256, 256]
    - [28, 9601.31]
  - - [18944, 8976, 1, 256, 18944, 18944, 256, 256]
    - [37, 9666.26]
  - - [256, 19200, 1, 1024, 256, 256, 1024, 1024]
    - [13, 7488.94]
  - - [5632, 8976, 1, 256, 5632, 5632, 256, 256]
    - [25, 9358.39]
  - - [256, 23552, 1, 1024, 256, 256, 1024, 1024]
    - [40, 7980.89]
  - - [256, 6656, 1, 1024, 256, 256, 1024, 1024]
    - [40, 6287.22]
  - - [256, 14336, 1, 1024, 256, 256, 1024, 1024]
    - [35, 7049.26]
  - - [2048, 215, 1, 512, 2048, 2048, 512, 512]
    - [3, 5693.03]
  - - [256, 12544, 1, 1024, 256, 256, 1024, 1024]
    - [13, 6728.47]
  - - [2048, 684, 1, 768, 2048, 2048, 768, 768]
    - [30, 8479.18]
  - - [5376, 8976, 1, 256, 5376, 5376, 256, 256]
    - [25, 9519.51]
  - - [256, 5888, 1, 1024, 256, 256, 1024, 1024]
    - [45, 6012.4]
  - - [19968, 8976, 1, 256, 19968, 19968, 256, 256]
    - [37, 9684.67]
  - - [3840, 8976, 1, 256, 3840, 3840, 256, 256]
    - [22, 9461.89]
  - - [4608, 8976, 1, 256, 4608, 4608, 256, 256]
    - [22, 9305.82]
  - - [256, 684, 1, 1024, 256, 256, 1024, 1024]
    - [48, 3513.06]
  - - [256, 22016, 1, 1024, 256, 256, 1024, 1024]
    - [13, 7643.79]
  - - [256, 23296, 1, 1024, 256, 256, 1024, 1024]
    - [42, 8048.12]
  - - [2048, 256, 1, 512, 2048, 2048, 512, 512]
    - [2, 6490.22]
  - - [4864, 8976, 1, 256, 4864, 4864, 256, 256]
    - [20, 9545.62]
  - - [256, 7424, 1, 1024, 256, 256, 1024, 1024]
    - [38, 6770.65]
  - - [18176, 8976, 1, 256, 18176, 18176, 256, 256]
    - [45, 9729.47]
  - - [256, 15104, 1, 1024, 256, 256, 1024, 1024]
    - [34, 7289.08]
  - - [8192, 8976, 1, 256, 8192, 8192, 256, 256]
    - [37, 9395.49]
  - - [256, 16128, 1, 1024, 256, 256, 1024, 1024]
    - [37, 7461.28]
  - - [13312, 8976, 1, 256, 13312, 13312, 256, 256]
    - [45, 9550.97]
  - - [256, 21504, 1, 1024, 256, 256, 1024, 1024]
    - [42, 7635.93]
  - - [6400, 8976, 1, 256, 6400, 6400, 256, 256]
    - [29, 9560.96]
  - - [256, 8960, 1, 1024, 256, 256, 1024, 1024]
    - [4, 6292.36]
  - - [1792, 8976, 1, 256, 1792, 1792, 256, 256]
    - [19, 9372.18]
  - - [13824, 8976, 1, 256, 13824, 13824, 256, 256]
    - [37, 9585.27]
  - - [11776, 8976, 1, 256, 11776, 11776, 256, 256]
    - [37, 9560.34]
  - - [256, 20992, 1, 1024, 256, 256, 1024, 1024]
    - [35, 7490.65]
  - - [20480, 8976, 1, 256, 20480, 20480, 256, 256]
    - [45, 9610.7]
  - - [5888, 8976, 1, 256, 5888, 5888, 256, 256]
    - [16, 9565.2]
  - - [256, 10496, 1, 1024, 256, 256, 1024, 1024]
    - [7, 6631.96]
  - - [21248, 8976, 1, 256, 21248, 21248, 256, 256]
    - [37, 9755.77]
  - - [5120, 8976, 1, 256, 5120, 5120, 256, 256]
    - [45, 9244.59]
  - - [7168, 8976, 1, 256, 7168, 7168, 256, 256]
    - [37, 9388.42]
  - - [2048, 1536, 1, 768, 2048, 2048, 768, 768]
    - [26, 9446.04]
  - - [256, 8192, 1, 1024, 256, 256, 1024, 1024]
    - [31, 6948.89]
  - - [4096, 8976, 1, 256, 4096, 4096, 256, 256]
    - [36, 9115.94]
  - - [3328, 8976, 1, 256, 3328, 3328, 256, 256]
    - [29, 9434.55]
  - - [1280, 8976, 1, 256, 1280, 1280, 256, 256]
    - [27, 9129.8]
  - - [2560, 8976, 1, 256, 2560, 2560, 256, 256]
    - [24, 9199.48]
  - - [3072, 8976, 1, 256, 3072, 3072, 256, 256]
    - [39, 8963.6]
  - - [256, 11776, 1, 1024, 256, 256, 1024, 1024]
    - [17, 6869.8]
  - - [18688, 8976, 1, 256, 18688, 18688, 256, 256]
    - [45, 9726.21]
  - - [15104, 8976, 1, 256, 15104, 15104, 256, 256]
    - [45, 9715.71]
  - - [23552, 8976, 1, 256, 23552, 23552, 256, 256]
    - [37, 9648.42]
  - - [6144, 8976, 1, 256, 6144, 6144, 256, 256]
    - [45, 9339.8]
  - - [12544, 8976, 1, 256, 12544, 12544, 256, 256]
    - [45, 9654.45]
  - - [256, 11264, 1, 1024, 256, 256, 1024, 1024]
    - [18, 6814.98]
  - - [2048, 114, 1, 512, 2048, 2048, 512, 512]
    - [49, 4583.5]
  - - [4352, 8976, 1, 256, 4352, 4352, 256, 256]
    - [29, 9471.4]
  - - [15360, 8976, 1, 256, 15360, 15360, 256, 256]
    - [45, 9583.77]
  - - [256, 31488, 1, 1024, 256, 256, 1024, 1024]
    - [44, 8438.01]
  - - [28672, 8976, 1, 256, 28672, 28672, 256, 256]
    - [37, 9688.85]
  - - [256, 18176, 1, 1024, 256, 256, 1024, 1024]
    - [13, 7405.09]
  - - [9728, 8976, 1, 256, 9728, 9728, 256, 256]
    - [45, 9524.15]
  - - [256, 2816, 1, 1024, 256, 256, 1024, 1024]
    - [9, 5405.66]
  - - [256, 18944, 1, 1024, 256, 256, 1024, 1024]
    - [13, 7503.41]
  - - [256, 3584, 1, 1024, 256, 256, 1024, 1024]
    - [12, 6107.15]
  - - [7936, 8976, 1, 256, 7936, 7936, 256, 256]
    - [25, 9608.31]
  - - [19712, 8976, 1, 256, 19712, 19712, 256, 256]
    - [45, 9736.25]
  - - [256, 14848, 1, 1024, 256, 256, 1024, 1024]
    - [18, 7163.42]
  - - [256, 8448, 1, 1024, 256, 256, 1024, 1024]
    - [18, 6372.56]
  - - [256, 6400, 1, 1024, 256, 256, 1024, 1024]
    - [32, 6395.71]
  - - [256, 6144, 1, 1024, 256, 256, 1024, 1024]
    - [43, 6490.22]
  - - [9472, 8976, 1, 256, 9472, 9472, 256, 256]
    - [22, 9609.92]
  - - [256, 22344, 1, 1024, 256, 256, 1024, 1024]
    - [46, 7764.25]
  - - [2048, 215, 1, 768, 2048, 2048, 768, 768]
    - [3, 5978.89]
  - - [256, 9984, 1, 1024, 256, 256, 1024, 1024]
    - [5, 6484.75]
  - - [684, 8976, 1, 256, 684, 684, 256, 256]
    - [14, 8128.53]
  - - [20992, 8976, 1, 256, 20992, 20992, 256, 256]
    - [37, 9689.65]
  - - [256, 1536, 1, 1024, 256, 256, 1024, 1024]
    - [3, 4651.72]
  - - [2048, 684, 1, 512, 2048, 2048, 512, 512]
    - [21, 7241.78]
  - - [2048, 114, 1, 768, 2048, 2048, 768, 768]
    - [47, 4872.46]
  - - [8960, 8976, 1, 256, 8960, 8960, 256, 256]
    - [20, 9603.35]
  - - [2048, 1536, 1, 512, 2048, 2048, 512, 512]
    - [23, 8830.11]
  - - [256, 3328, 1, 1024, 256, 256, 1024, 1024]
    - [11, 5612.55]
  - - [33536, 8976, 1, 256, 33536, 33536, 256, 256]
    - [37, 9797.71]
  - - [2048, 8976, 1, 256, 2048, 2048, 256, 256]
    - [37, 8975.46]
  - - [10496, 8976, 1, 256, 10496, 10496, 256, 256]
    - [28, 9654.43]
  - - [256, 5376, 1, 1024, 256, 256, 1024, 1024]
    - [46, 5626.34]
  - - [256, 21248, 1, 1024, 256, 256, 1024, 1024]
    - [15, 7525.45]
  - - [256, 13312, 1, 1024, 256, 256, 1024, 1024]
    - [13, 6767.11]
  - - [16128, 8976, 1, 256, 16128, 16128, 256, 256]
    - [37, 9715.57]
  - - [2304, 8976, 1, 256, 2304, 2304, 256, 256]
    - [10, 9433.83]
  - - [256, 4864, 1, 1024, 256, 256, 1024, 1024]
    - [0, 5743.55]
  - - [17152, 8976, 1, 256, 17152, 17152, 256, 256]
    - [45, 9708.94]
  - - [15872, 8976, 1, 256, 15872, 15872, 256, 256]
    - [45, 9657.57]
  - - [9984, 8976, 1, 256, 9984, 9984, 256, 256]
    - [22, 9639.74]
  - - [256, 14592, 1, 1024, 256, 256, 1024, 1024]
    - [34, 7223.92]
  - - [256, 33536, 1, 1024, 256, 256, 1024, 1024]
    - [41, 8147.31]
  - - [11264, 8976, 1, 256, 11264, 11264, 256, 256]
    - [37, 9509.96]
  - - [31488, 8976, 1, 256, 31488, 31488, 256, 256]
    - [45, 9799.31]
  - - [256, 20480, 1, 1024, 256, 256, 1024, 1024]
    - [18, 7498.2]
  - - [44505, 8976, 1, 256, 44505, 44505, 256, 256]
    - [29, 9804.78]
  - - [13568, 8976, 1, 256, 13568, 13568, 256, 256]
    - [37, 9680.24]
  - - [256, 11520, 1, 1024, 256, 256, 1024, 1024]
    - [17, 6805.26]
  - - [256, 7936, 1, 1024, 256, 256, 1024, 1024]
    - [33, 6971.77]
  - - [2048, 256, 1, 768, 2048, 2048, 768, 768]
    - [3, 7129.13]
  - - [256, 4608, 1, 1024, 256, 256, 1024, 1024]
    - [1, 5462.91]
  - - [256, 2304, 1, 1024, 256, 256, 1024, 1024]
    - [8, 4842.69]
  - - [256, 2560, 1, 1024, 256, 256, 1024, 1024]
    - [9, 5309.25]
  - - [2816, 8976, 1, 256, 2816, 2816, 256, 256]
    - [20, 9409.56]
- null
